{"source_id": "1686", "title": "Elige un método de entrega", "description": "Pan fibra familiar, pan blanco con salvado. Loading...", "breadcrumbs": "Unimarc > 750 g", "price_raw": "2.75", "currency_raw": "", "url": "", "seller": "Desconocido", "availability": "unknown", "country": "UNKNOWN", "product_name": "Elige un método de entrega", "brand": "Unimarc", "reference": "", "unit": "750 g", "price_amount": 2.75, "price_currency": "", "price_symbol": "$", "price_text": "$2.75", "price_amount_filled": "2.75", "price_is_imputed": "False", "price_imputation_source": "original", "price_amount_usd": "2.75", "price_amount_usd_filled": "2.75", "fx_rate_local_per_usd": "1.0", "fx_source": "default_1usd", "information_text": "", "description_text": "Pan fibra familiar, pan blanco con salvado. Loading...", "features_text": "", "specifications_text": "", "benefits_text": "", "details_text": "", "other_sections": "", "sections": {"Descripción": ["Pan fibra familiar, pan blanco con salvado.", "Loading..."]}, "txt_path": "dataset/txt_limpios/1686.txt", "html_path": "dataset/paginas_descargadas/1686.html", "es_status": "EN", "category_canonical": "pan", "decision": "keep", "match_score": 0.6, "reasons": "heuristic_default"}
{"source_id": "1688", "title": "Elige un método de entrega", "description": "Coca-Cola, chispeante y refrescante, es una bebida magnífica para mantener la energía y combatir el calor. El refresco de cola, es un gran complemento para cualquier ocasión tanto si estás trabajando en un picnic.", "breadcrumbs": "Unimarc > 1.5 L", "price_raw": "1.99", "currency_raw": "", "url": "", "seller": "Desconocido", "availability": "unknown", "country": "UNKNOWN", "product_name": "Elige un método de entrega", "brand": "Unimarc", "reference": "", "unit": "1.5 L", "price_amount": 1.99, "price_currency": "", "price_symbol": "$", "price_text": "$1.99", "price_amount_filled": "1.99", "price_is_imputed": "False", "price_imputation_source": "original", "price_amount_usd": "1.99", "price_amount_usd_filled": "1.99", "fx_rate_local_per_usd": "1.0", "fx_source": "default_1usd", "information_text": "", "description_text": "Coca-Cola, chispeante y refrescante, es una bebida magnífica para mantener la energía y combatir el calor. El refresco de cola, es un gran complemento para cualquier ocasión tanto si estás trabajando en un picnic.", "features_text": "Bebidas regulares - Coca Cola - Alto en azúcares - Envase botella - Formato familiar - Contenido 1.5 L. | Loading...", "specifications_text": "", "benefits_text": "", "details_text": "", "other_sections": "", "sections": {"Descripción": ["Coca-Cola, chispeante y refrescante, es una bebida magnífica para mantener la energía y combatir el calor. El refresco de cola, es un gran complemento para cualquier ocasión tanto si estás trabajando en un picnic."], "Características": ["Bebidas regulares - Coca Cola - Alto en azúcares - Envase botella - Formato familiar - Contenido 1.5 L.", "Loading..."]}, "txt_path": "dataset/txt_limpios/1688.txt", "html_path": "dataset/paginas_descargadas/1688.html", "es_status": "ET", "category_canonical": "refresco de cola", "decision": "keep", "match_score": 0.6, "reasons": "heuristic_default"}
{"source_id": "1690", "title": "Elige un método de entrega", "description": "Si quieres disfrutar de una bebida que te refresque y a la vez te quite la sed, tienes que elegir Canada Dry Ginger ale.", "breadcrumbs": "Unimarc > 1.5 L", "price_raw": "2.0", "currency_raw": "", "url": "", "seller": "Desconocido", "availability": "unknown", "country": "UNKNOWN", "product_name": "Elige un método de entrega", "brand": "Unimarc", "reference": "", "unit": "1.5 L", "price_amount": 2.0, "price_currency": "", "price_symbol": "", "price_text": "2", "price_amount_filled": "2.0", "price_is_imputed": "False", "price_imputation_source": "original", "price_amount_usd": "2.0", "price_amount_usd_filled": "2.0", "fx_rate_local_per_usd": "1.0", "fx_source": "default_1usd", "information_text": "", "description_text": "Si quieres disfrutar de una bebida que te refresque y a la vez te quite la sed, tienes que elegir Canada Dry Ginger ale.", "features_text": "Bebidas regulares - Canda Dry - Alto en azúcares - Envase botella - Formato familiar - Contenido 1.5 L. | Loading...", "specifications_text": "", "benefits_text": "", "details_text": "", "other_sections": "", "sections": {"Descripción": ["Si quieres disfrutar de una bebida que te refresque y a la vez te quite la sed, tienes que elegir Canada Dry Ginger ale."], "Características": ["Bebidas regulares - Canda Dry - Alto en azúcares - Envase botella - Formato familiar - Contenido 1.5 L.", "Loading..."]}, "txt_path": "dataset/txt_limpios/1690.txt", "html_path": "dataset/paginas_descargadas/1690.html", "es_status": "EN", "category_canonical": "sin_categoria", "decision": "discard", "match_score": 0.3, "reasons": "no_category_detected"}
{"source_id": "1693", "title": "Elige un método de entrega", "description": "Pan de molde Amada Masa blanco XL 750 g Loading...", "breadcrumbs": "Unimarc > 750 g", "price_raw": "2.51", "currency_raw": "", "url": "", "seller": "Desconocido", "availability": "unknown", "country": "UNKNOWN", "product_name": "Elige un método de entrega", "brand": "Unimarc", "reference": "", "unit": "750 g", "price_amount": 2.51, "price_currency": "", "price_symbol": "$", "price_text": "$2.51", "price_amount_filled": "2.51", "price_is_imputed": "False", "price_imputation_source": "original", "price_amount_usd": "2.51", "price_amount_usd_filled": "2.51", "fx_rate_local_per_usd": "1.0", "fx_source": "default_1usd", "information_text": "", "description_text": "Pan de molde Amada Masa blanco XL 750 g Loading...", "features_text": "", "specifications_text": "", "benefits_text": "", "details_text": "", "other_sections": "", "sections": {"Descripción": ["Pan de molde Amada Masa blanco XL 750 g", "Loading..."]}, "txt_path": "dataset/txt_limpios/1693.txt", "html_path": "dataset/paginas_descargadas/1693.html", "es_status": "EN", "category_canonical": "pan", "decision": "keep", "match_score": 0.6, "reasons": "heuristic_default"}
{"source_id": "1694", "title": "Elige un método de entrega", "description": "Loading...", "breadcrumbs": "Unimarc > 650 g", "price_raw": "2.53", "currency_raw": "", "url": "", "seller": "Desconocido", "availability": "unknown", "country": "UNKNOWN", "product_name": "Elige un método de entrega", "brand": "Unimarc", "reference": "", "unit": "650 g", "price_amount": 2.53, "price_currency": "", "price_symbol": "$", "price_text": "$2.53", "price_amount_filled": "2.53", "price_is_imputed": "False", "price_imputation_source": "original", "price_amount_usd": "2.53", "price_amount_usd_filled": "2.53", "fx_rate_local_per_usd": "1.0", "fx_source": "default_1usd", "information_text": "", "description_text": "Loading...", "features_text": "", "specifications_text": "", "benefits_text": "", "details_text": "", "other_sections": "", "sections": {"Descripción": ["Loading..."]}, "txt_path": "dataset/txt_limpios/1694.txt", "html_path": "dataset/paginas_descargadas/1694.html", "es_status": "EN", "category_canonical": "sin_categoria", "decision": "discard", "match_score": 0.3, "reasons": "no_category_detected"}
{"source_id": "1695", "title": "Elige un método de entrega", "description": "Bebidas gaseosas de fantasía azucarada. Contiene cafeína.", "breadcrumbs": "Unimarc > 1.5 L", "price_raw": "2.0", "currency_raw": "", "url": "", "seller": "Desconocido", "availability": "unknown", "country": "UNKNOWN", "product_name": "Elige un método de entrega", "brand": "Unimarc", "reference": "", "unit": "1.5 L", "price_amount": 2.0, "price_currency": "", "price_symbol": "", "price_text": "2", "price_amount_filled": "2.0", "price_is_imputed": "False", "price_imputation_source": "original", "price_amount_usd": "2.0", "price_amount_usd_filled": "2.0", "fx_rate_local_per_usd": "1.0", "fx_source": "default_1usd", "information_text": "", "description_text": "Bebidas gaseosas de fantasía azucarada. Contiene cafeína.", "features_text": "Bebidas regulares - Pepsi - Alto en azúcares - Envase botella - Formato familiar - Contenido 1.5 L. | Loading...", "specifications_text": "", "benefits_text": "", "details_text": "", "other_sections": "", "sections": {"Descripción": ["Bebidas gaseosas de fantasía azucarada. Contiene cafeína."], "Características": ["Bebidas regulares - Pepsi - Alto en azúcares - Envase botella - Formato familiar - Contenido 1.5 L.", "Loading..."]}, "txt_path": "dataset/txt_limpios/1695.txt", "html_path": "dataset/paginas_descargadas/1695.html", "es_status": "ET", "category_canonical": "sin_categoria", "decision": "discard", "match_score": 0.3, "reasons": "no_category_detected"}
{"source_id": "1696", "title": "Elige un método de entrega", "description": "Bebidas gaseosas de fantasía sabor piña.", "breadcrumbs": "Unimarc > 1.5 L", "price_raw": "2.0", "currency_raw": "", "url": "", "seller": "Desconocido", "availability": "unknown", "country": "UNKNOWN", "product_name": "Elige un método de entrega", "brand": "Unimarc", "reference": "", "unit": "1.5 L", "price_amount": 2.0, "price_currency": "", "price_symbol": "", "price_text": "2", "price_amount_filled": "2.0", "price_is_imputed": "False", "price_imputation_source": "original", "price_amount_usd": "2.0", "price_amount_usd_filled": "2.0", "fx_rate_local_per_usd": "1.0", "fx_source": "default_1usd", "information_text": "", "description_text": "Bebidas gaseosas de fantasía sabor piña.", "features_text": "Bebidas regulares - Kem piña - Alto en azúcares - Envase botella - Formato familiar - Contenido 1.5 L. | Loading...", "specifications_text": "", "benefits_text": "", "details_text": "", "other_sections": "", "sections": {"Descripción": ["Bebidas gaseosas de fantasía sabor piña."], "Características": ["Bebidas regulares - Kem piña - Alto en azúcares - Envase botella - Formato familiar - Contenido 1.5 L.", "Loading..."]}, "txt_path": "dataset/txt_limpios/1696.txt", "html_path": "dataset/paginas_descargadas/1696.html", "es_status": "ET", "category_canonical": "sin_categoria", "decision": "discard", "match_score": 0.3, "reasons": "no_category_detected"}
{"source_id": "1697", "title": "Elige un método de entrega", "description": "Loading...", "breadcrumbs": "Unimarc > 300 g", "price_raw": "1.99", "currency_raw": "", "url": "", "seller": "Desconocido", "availability": "unknown", "country": "UNKNOWN", "product_name": "Elige un método de entrega", "brand": "Unimarc", "reference": "", "unit": "300 g", "price_amount": 1.99, "price_currency": "", "price_symbol": "$", "price_text": "$1.99", "price_amount_filled": "1.99", "price_is_imputed": "False", "price_imputation_source": "original", "price_amount_usd": "1.99", "price_amount_usd_filled": "1.99", "fx_rate_local_per_usd": "1.0", "fx_source": "default_1usd", "information_text": "", "description_text": "Loading...", "features_text": "", "specifications_text": "", "benefits_text": "", "details_text": "", "other_sections": "", "sections": {"Descripción": ["Loading..."]}, "txt_path": "dataset/txt_limpios/1697.txt", "html_path": "dataset/paginas_descargadas/1697.html", "es_status": "EN", "category_canonical": "sin_categoria", "decision": "discard", "match_score": 0.3, "reasons": "no_category_detected"}
{"source_id": "1698", "title": "Elige un método de entrega", "description": "El tomate es rico en vitaminas y minerales: esta huerta aporta vitamina C, un potente antioxidante natural, además de vitamina A, K, hierro y potasio. Loading...", "breadcrumbs": "Unimarc > 500 g", "price_raw": "1.14", "currency_raw": "", "url": "", "seller": "Desconocido", "availability": "unknown", "country": "UNKNOWN", "product_name": "Elige un método de entrega", "brand": "Unimarc", "reference": "", "unit": "500 g", "price_amount": 1.14, "price_currency": "", "price_symbol": "$", "price_text": "$1.14", "price_amount_filled": "1.14", "price_is_imputed": "False", "price_imputation_source": "original", "price_amount_usd": "1.14", "price_amount_usd_filled": "1.14", "fx_rate_local_per_usd": "1.0", "fx_source": "default_1usd", "information_text": "", "description_text": "El tomate es rico en vitaminas y minerales: esta huerta aporta vitamina C, un potente antioxidante natural, además de vitamina A, K, hierro y potasio. Loading...", "features_text": "", "specifications_text": "", "benefits_text": "", "details_text": "", "other_sections": "", "sections": {"Descripción": ["El tomate es rico en vitaminas y minerales: esta hortalizas aporta vitamina C, un potente antioxidante natural, además de vitamina A, K, hierro y potasio.", "Loading..."]}, "txt_path": "dataset/txt_limpios/1698.txt", "html_path": "dataset/paginas_descargadas/1698.html", "es_status": "ET", "category_canonical": "sin_categoria", "decision": "discard", "match_score": 0.3, "reasons": "no_category_detected"}
{"source_id": "1699", "title": "Elige un método de entrega", "description": "Loading...", "breadcrumbs": "Unimarc > 250 g", "price_raw": "1.25", "currency_raw": "", "url": "", "seller": "Desconocido", "availability": "unknown", "country": "UNKNOWN", "product_name": "Elige un método de entrega", "brand": "Unimarc", "reference": "", "unit": "250 g", "price_amount": 1.25, "price_currency": "", "price_symbol": "$", "price_text": "$1.25", "price_amount_filled": "1.25", "price_is_imputed": "False", "price_imputation_source": "original", "price_amount_usd": "1.25", "price_amount_usd_filled": "1.25", "fx_rate_local_per_usd": "1.0", "fx_source": "default_1usd", "information_text": "", "description_text": "Loading...", "features_text": "", "specifications_text": "", "benefits_text": "", "details_text": "", "other_sections": "", "sections": {"Descripción": ["Loading..."]}, "txt_path": "dataset/txt_limpios/1699.txt", "html_path": "dataset/paginas_descargadas/1699.html", "es_status": "EN", "category_canonical": "sin_categoria", "decision": "discard", "match_score": 0.3, "reasons": "no_category_detected"}
{"source_id": "1700", "title": "Elige un método de entrega", "description": "Loading...", "breadcrumbs": "Unimarc > 1 Kg", "price_raw": "1.8", "currency_raw": "", "url": "", "seller": "Desconocido", "availability": "unknown", "country": "UNKNOWN", "product_name": "Elige un método de entrega", "brand": "Unimarc", "reference": "", "unit": "1 Kg", "price_amount": 1.8, "price_currency": "", "price_symbol": "$", "price_text": "$1.80", "price_amount_filled": "1.8", "price_is_imputed": "False", "price_imputation_source": "original", "price_amount_usd": "1.8", "price_amount_usd_filled": "1.8", "fx_rate_local_per_usd": "1.0", "fx_source": "default_1usd", "information_text": "", "description_text": "Loading...", "features_text": "", "specifications_text": "", "benefits_text": "", "details_text": "", "other_sections": "", "sections": {"Descripción": ["Loading..."]}, "txt_path": "dataset/txt_limpios/1700.txt", "html_path": "dataset/paginas_descargadas/1700.html", "es_status": "EN", "category_canonical": "sin_categoria", "decision": "discard", "match_score": 0.3, "reasons": "no_category_detected"}
{"source_id": "1701", "title": "Elige un método de entrega", "description": "Los huevos Yemita son un alimento completo y nutritivo que aporta alto contenido de proteínas y vitaminas; este tipo de alimento es esencial en la alimentación humana para el crecimiento, desarrollo y buena salud.", "breadcrumbs": "Unimarc > 12 unidad", "price_raw": "4.09", "currency_raw": "", "url": "", "seller": "Desconocido", "availability": "unknown", "country": "UNKNOWN", "product_name": "Elige un método de entrega", "brand": "Unimarc", "reference": "", "unit": "12 unidad", "price_amount": 4.09, "price_currency": "", "price_symbol": "$", "price_text": "$4.09", "price_amount_filled": "4.09", "price_is_imputed": "False", "price_imputation_source": "original", "price_amount_usd": "4.09", "price_amount_usd_filled": "4.09", "fx_rate_local_per_usd": "1.0", "fx_source": "default_1usd", "information_text": "", "description_text": "Los huevos Yemita son un alimento completo y nutritivo que aporta alto contenido de proteínas y vitaminas; este tipo de alimento es esencial en la alimentación humana para el crecimiento, desarrollo y buena salud.", "features_text": "Huevos gallina - Yemita - Gallina normal - Tipo blanco - Contenido 12 unidades. | Loading...", "specifications_text": "", "benefits_text": "", "details_text": "", "other_sections": "", "sections": {"Descripción": ["Los huevos Yemita son un alimento completo y nutritivo que aporta alto contenido de proteínas y vitaminas; este tipo de alimento es esencial en la alimentación humana para el crecimiento, desarrollo y buena salud."], "Características": ["Huevos gallina - Yemita - Gallina normal - Tipo blanco - Contenido 12 unidades.", "Loading..."]}, "txt_path": "dataset/txt_limpios/1701.txt", "html_path": "dataset/paginas_descargadas/1701.html", "es_status": "ET", "category_canonical": "huevo", "decision": "discard", "match_score": 0.3, "reasons": "heuristic_default"}
{"source_id": "1702", "title": "Elige un método de entrega", "description": "Loading...", "breadcrumbs": "Unimarc > 12 unidad", "price_raw": "3.89", "currency_raw": "", "url": "", "seller": "Desconocido", "availability": "unknown", "country": "UNKNOWN", "product_name": "Elige un método de entrega", "brand": "Unimarc", "reference": "", "unit": "12 unidad", "price_amount": 3.89, "price_currency": "", "price_symbol": "$", "price_text": "$3.89", "price_amount_filled": "3.89", "price_is_imputed": "False", "price_imputation_source": "original", "price_amount_usd": "3.89", "price_amount_usd_filled": "3.89", "fx_rate_local_per_usd": "1.0", "fx_source": "default_1usd", "information_text": "", "description_text": "Loading...", "features_text": "", "specifications_text": "", "benefits_text": "", "details_text": "", "other_sections": "", "sections": {"Descripción": ["Loading..."]}, "txt_path": "dataset/txt_limpios/1702.txt", "html_path": "dataset/paginas_descargadas/1702.html", "es_status": "EN", "category_canonical": "sin_categoria", "decision": "discard", "match_score": 0.3, "reasons": "no_category_detected"}
{"source_id": "1703", "title": "Elige un método de entrega", "description": "Bebida Piri cola zero, 2 L Loading...", "breadcrumbs": "Unimarc > 2 L", "price_raw": "2.0", "currency_raw": "", "url": "", "seller": "Desconocido", "availability": "unknown", "country": "UNKNOWN", "product_name": "Elige un método de entrega", "brand": "Unimarc", "reference": "", "unit": "2 L", "price_amount": 2.0, "price_currency": "", "price_symbol": "", "price_text": "2", "price_amount_filled": "2.0", "price_is_imputed": "False", "price_imputation_source": "original", "price_amount_usd": "2.0", "price_amount_usd_filled": "2.0", "fx_rate_local_per_usd": "1.0", "fx_source": "default_1usd", "information_text": "", "description_text": "Bebida Piri cola zero, 2 L Loading...", "features_text": "", "specifications_text": "", "benefits_text": "", "details_text": "", "other_sections": "", "sections": {"Descripción": ["Bebida Piri cola zero, 2 L", "Loading..."]}, "txt_path": "dataset/txt_limpios/1703.txt", "html_path": "dataset/paginas_descargadas/1703.html", "es_status": "EN", "category_canonical": "sin_categoria", "decision": "discard", "match_score": 0.3, "reasons": "no_category_detected"}
{"source_id": "1705", "title": "Elige un método de entrega", "description": "Loading...", "breadcrumbs": "Unimarc > 20 unidad", "price_raw": "6.59", "currency_raw": "", "url": "", "seller": "Desconocido", "availability": "unknown", "country": "UNKNOWN", "product_name": "Elige un método de entrega", "brand": "Unimarc", "reference": "", "unit": "20 unidad", "price_amount": 6.59, "price_currency": "", "price_symbol": "$", "price_text": "$6.59", "price_amount_filled": "6.59", "price_is_imputed": "False", "price_imputation_source": "original", "price_amount_usd": "6.59", "price_amount_usd_filled": "6.59", "fx_rate_local_per_usd": "1.0", "fx_source": "default_1usd", "information_text": "", "description_text": "Loading...", "features_text": "", "specifications_text": "", "benefits_text": "", "details_text": "", "other_sections": "", "sections": {"Descripción": ["Loading..."]}, "txt_path": "dataset/txt_limpios/1705.txt", "html_path": "dataset/paginas_descargadas/1705.html", "es_status": "EN", "category_canonical": "sin_categoria", "decision": "discard", "match_score": 0.3, "reasons": "no_category_detected"}
{"source_id": "1707", "title": "Elige un método de entrega", "description": "Loading...", "breadcrumbs": "Unimarc > 12 unidad", "price_raw": "3.97", "currency_raw": "", "url": "", "seller": "Desconocido", "availability": "unknown", "country": "UNKNOWN", "product_name": "Elige un método de entrega", "brand": "Unimarc", "reference": "", "unit": "12 unidad", "price_amount": 3.97, "price_currency": "", "price_symbol": "$", "price_text": "$3.97", "price_amount_filled": "3.97", "price_is_imputed": "False", "price_imputation_source": "original", "price_amount_usd": "3.97", "price_amount_usd_filled": "3.97", "fx_rate_local_per_usd": "1.0", "fx_source": "default_1usd", "information_text": "", "description_text": "Loading...", "features_text": "", "specifications_text": "", "benefits_text": "", "details_text": "", "other_sections": "", "sections": {"Descripción": ["Loading..."]}, "txt_path": "dataset/txt_limpios/1707.txt", "html_path": "dataset/paginas_descargadas/1707.html", "es_status": "EN", "category_canonical": "sin_categoria", "decision": "discard", "match_score": 0.3, "reasons": "no_category_detected"}
