{"source_id": "808", "title": "AZÚCAR BLANCA 1000 GRS", "description": "Ingredientes | Componentes Nombre del producto: Azúcar Blanca 1000 g Descripción del producto: Disfruta de la Azúcar Blanca, ideal para endulzar bebidas, preparar postres y realzar tus recetas favoritas. Tamaño: 20cm x 13cm Peso: 1000 g Modo de fabricación: Industrial Conservación: Mantener en un lugar fresco y seco Origen: Nacional NSA-0019249-2024 Componentes: Azúcar de caña refinada ¡Queremos que tengas la mejor experiencia! Si tienes dudas sobre este producto el contenido, te invitamos a consultar nuestros Términos y condiciones para conocer malas sobre devoluciones y nuestras políticas de reembolsos. Ver más También puede interesarte SAL REFISAL 1000 G ACEITE VEGETAL IMATÁ 3.000 ML LENTEJA EL ESTÍO 500 GRS CABELLO DE ÁNGEL CAPRÍSSIMA 250 GRS CREMA LAVALOZA BRILLA KING 500 GRS ACEITE VEGETAL IMATÁ 900 ML LECHE ENTERA BOLSA UHT LATTI 900 ML CAFÉ TOSTADO Y MOLIDO VIEJO MOLINO 500 G ESPARCIBLE VEGETAL DON OLIO 500 G", "breadcrumbs": "Unidades disponibles > 1000 g", "price_raw": "1000.0", "currency_raw": "", "url": "", "seller": "Desconocido", "availability": "unknown", "country": "UNKNOWN", "product_name": "AZÚCAR BLANCA 1000 GRS", "brand": "Unidades disponibles", "reference": "", "unit": "1000 g", "price_amount": 1000.0, "price_currency": "", "price_symbol": "", "price_text": "1000", "price_amount_filled": "1000.0", "price_is_imputed": "False", "price_imputation_source": "original", "price_amount_usd": "1000.0", "price_amount_usd_filled": "1000.0", "fx_rate_local_per_usd": "1.0", "fx_source": "default_1usd", "information_text": "", "description_text": "Ingredientes | Componentes Nombre del producto: Azúcar Blanca 1000 g Descripción del producto: Disfruta de la Azúcar Blanca, ideal para endulzar bebidas, preparar postres y realzar tus recetas favoritas. Tamaño: 20cm x 13cm Peso: 1000 g Modo de fabricación: Industrial Conservación: Mantener en un lugar fresco y seco Origen: Nacional NSA-0019249-2024 Componentes: Azúcar de caña refinada ¡Queremos que tengas la mejor experiencia! Si tienes dudas sobre este producto el contenido, te invitamos a consultar nuestros Términos y condiciones para conocer malas sobre devoluciones y nuestras políticas de reembolsos. Ver más También puede interesarte SAL REFISAL 1000 G ACEITE VEGETAL IMATÁ 3.000 ML LENTEJA EL ESTÍO 500 GRS CABELLO DE ÁNGEL CAPRÍSSIMA 250 GRS CREMA LAVALOZA BRILLA KING 500 GRS ACEITE VEGETAL IMATÁ 900 ML LECHE ENTERA BOLSA UHT LATTI 900 ML CAFÉ TOSTADO Y MOLIDO VIEJO MOLINO 500 G ESPARCIBLE VEGETAL DON OLIO 500 G", "features_text": "", "specifications_text": "", "benefits_text": "", "details_text": "", "other_sections": "", "sections": {"Descripción": ["Ingredientes | Componentes", "Nombre del producto: Azúcar Blanca 1000 g", "Descripción del producto: Disfruta de la Azúcar Blanca, ideal para endulzar bebidas, preparar postres y realzar tus recetas favoritas.", "Tamaño: 20cm x 13cm", "Peso: 1000 g", "Modo de fabricación: Industrial", "Conservación: Mantener en un lugar fresco y seco", "Origen: Nacional", "NSA-0019249-2024", "Componentes: Azúcar de caña refinada", "¡Queremos que tengas la mejor experiencia! Si tienes dudas sobre este producto el contenido, te invitamos a consultar nuestros Términos y condiciones para conocer malas sobre devoluciones y nuestras políticas de reembolsos.", "Ver más", "También puede interesarte", "SAL REFISAL 1000 G", "ACEITE VEGETAL IMATÁ 3.000 ML", "LENTEJA EL ESTÍO 500 GRS", "CABELLO DE ÁNGEL CAPRÍSSIMA 250 GRS", "CREMA LAVALOZA BRILLA KING 500 GRS", "ACEITE VEGETAL IMATÁ 900 ML", "LECHE ENTERA BOLSA UHT LATTI 900 ML", "CAFÉ TOSTADO Y MOLIDO VIEJO MOLINO 500 G", "ESPARCIBLE VEGETAL DON OLIO 500 G"]}, "txt_path": "dataset/txt_limpios/808.txt", "html_path": "dataset/paginas_descargadas/808.html", "es_status": "ET", "category_canonical": "leche", "decision": "keep", "match_score": 0.6, "reasons": "heuristic_default"}
{"source_id": "315", "title": "Azúcar Mascavo Orgánico Native Organic 500 G", "description": "", "breadcrumbs": "Descripción > 500 G", "price_raw": "15.99", "currency_raw": "BRL", "url": "", "seller": "Desconocido", "availability": "unknown", "country": "BR", "product_name": "Azúcar Mascavo Orgánico Native Organic 500 G", "brand": "Descripción", "reference": "", "unit": "500 G", "price_amount": 15.99, "price_currency": "BRL", "price_symbol": "R$", "price_text": "R$15,99", "price_amount_filled": "15.99", "price_is_imputed": "False", "price_imputation_source": "original", "price_amount_usd": "2.935", "price_amount_usd_filled": "2.935", "fx_rate_local_per_usd": "5.448", "fx_source": "from_brasil_cambio_dolar", "information_text": "", "description_text": "", "features_text": "", "specifications_text": "", "benefits_text": "", "details_text": "", "other_sections": "", "sections": {}, "txt_path": "dataset/txt_limpios/315.txt", "html_path": "dataset/paginas_descargadas/315.html", "es_status": "ET", "category_canonical": "azucar", "decision": "keep", "match_score": 0.6, "reasons": "heuristic_default"}
{"source_id": "806", "title": "AZÚCAR MORENA 1000 GRS", "description": "Ingredientes | Componentes Nombre del producto: Azúcar Morena 1000g Descripción del producto: Disfruta de la Azúcar Morena de Mayagüez, un producto refinado y empacado industrialmente, ideal para endulzar tus recetas. Tamaño: 22cm x 13cm Peso: 1000 g Modo de fabricación: Industrial Conservación: Mantener en un lugar fresco y seco. Origen: Nacional NSA-0019958-2025 Componentes: Azúcar de caña morena ¡Queremos que tengas la mejor experiencia! Si tienes dudas sobre este producto el contenido, te invitamos a consultar nuestros Términos y condiciones para conocer malas sobre devoluciones y nuestras políticas de reembolsos. Ver más También puede interesarte SAL REFISAL 1000 G PANELA PASTILLA 1000 G LENTEJA EL ESTÍO 500 GRS ARROZ PREMIUM ALBAR 2500 G Bajó de precio FRÍDOL CARGAMANTO ROJO EL ESTÍO 500 GRS FRÍDOL BOLA ROJA EL ESTÍO 500 GRS CAFÉ TOSTADO Y MOLIDO VIEJO MOLINO 500 G CABELLO DE ÁNGEL CAPRÍSSIMA 250 GRS CHOCOLATE CLAVOS Y CANELA DE LA TAZA 500 G... GARBANZO EL ESTÍO 500 GRS", "breadcrumbs": "Unidades disponibles > 1000 g", "price_raw": "1000.0", "currency_raw": "", "url": "", "seller": "Desconocido", "availability": "unknown", "country": "UNKNOWN", "product_name": "AZÚCAR MORENA 1000 GRS", "brand": "Unidades disponibles", "reference": "", "unit": "1000 g", "price_amount": 1000.0, "price_currency": "", "price_symbol": "", "price_text": "1000", "price_amount_filled": "1000.0", "price_is_imputed": "False", "price_imputation_source": "original", "price_amount_usd": "1000.0", "price_amount_usd_filled": "1000.0", "fx_rate_local_per_usd": "1.0", "fx_source": "default_1usd", "information_text": "", "description_text": "Ingredientes | Componentes Nombre del producto: Azúcar Morena 1000g Descripción del producto: Disfruta de la Azúcar Morena de Mayagüez, un producto refinado y empacado industrialmente, ideal para endulzar tus recetas. Tamaño: 22cm x 13cm Peso: 1000 g Modo de fabricación: Industrial Conservación: Mantener en un lugar fresco y seco. Origen: Nacional NSA-0019958-2025 Componentes: Azúcar de caña morena ¡Queremos que tengas la mejor experiencia! Si tienes dudas sobre este producto el contenido, te invitamos a consultar nuestros Términos y condiciones para conocer malas sobre devoluciones y nuestras políticas de reembolsos. Ver más También puede interesarte SAL REFISAL 1000 G PANELA PASTILLA 1000 G LENTEJA EL ESTÍO 500 GRS ARROZ PREMIUM ALBAR 2500 G Bajó de precio FRÍDOL CARGAMANTO ROJO EL ESTÍO 500 GRS FRÍDOL BOLA ROJA EL ESTÍO 500 GRS CAFÉ TOSTADO Y MOLIDO VIEJO MOLINO 500 G CABELLO DE ÁNGEL CAPRÍSSIMA 250 GRS CHOCOLATE CLAVOS Y CANELA DE LA TAZA 500 G... GARBANZO EL ESTÍO 500 GRS", "features_text": "", "specifications_text": "", "benefits_text": "", "details_text": "", "other_sections": "", "sections": {"Descripción": ["Ingredientes | Componentes", "Nombre del producto: Azúcar Morena 1000g", "Descripción del producto: Disfruta de la Azúcar Morena de Mayagüez, un producto refinado y empacado industrialmente, ideal para endulzar tus recetas.", "Tamaño: 22cm x 13cm", "Peso: 1000 g", "Modo de fabricación: Industrial", "Conservación: Mantener en un lugar fresco y seco.", "Origen: Nacional", "NSA-0019958-2025", "Componentes: Azúcar de caña morena", "¡Queremos que tengas la mejor experiencia! Si tienes dudas sobre este producto el contenido, te invitamos a consultar nuestros Términos y condiciones para conocer malas sobre devoluciones y nuestras políticas de reembolsos.", "Ver más", "También puede interesarte", "SAL REFISAL 1000 G", "PANELA PASTILLA 1000 G", "LENTEJA EL ESTÍO 500 GRS", "ARROZ PREMIUM ALBAR 2500 G", "Bajó de precio", "FRÍDOL CARGAMANTO ROJO EL ESTÍO 500 GRS", "FRÍJOL BOLA ROJA EL ESTÍO 500 GRS", "CAFÉ TOSTADO Y MOLIDO VIEJO MOLINO 500 G", "CABELLO DE ÁNGEL CAPRÍSSIMA 250 GRS", "CHOCOLATE CLAVOS Y CANELA DE LA TAZA 500 G...", "GARBANZO EL ESTÍO 500 GRS"]}, "txt_path": "dataset/txt_limpios/806.txt", "html_path": "dataset/paginas_descargadas/806.html", "es_status": "ET", "category_canonical": "cafe", "decision": "keep", "match_score": 0.6, "reasons": "heuristic_default"}
{"source_id": "1594", "title": "Azúcar y Adoçante", "description": "", "breadcrumbs": "Azúcar > 1kg", "price_raw": "4.88", "currency_raw": "BRL", "url": "", "seller": "Desconocido", "availability": "unknown", "country": "BR", "product_name": "Azúcar y Adoçante", "brand": "Azúcar", "reference": "", "unit": "1kg", "price_amount": 4.88, "price_currency": "BRL", "price_symbol": "R$", "price_text": "R$4,88", "price_amount_filled": "4.88", "price_is_imputed": "False", "price_imputation_source": "original", "price_amount_usd": "0.8957", "price_amount_usd_filled": "0.8957", "fx_rate_local_per_usd": "5.448", "fx_source": "from_brasil_cambio_dolar", "information_text": "", "description_text": "", "features_text": "", "specifications_text": "", "benefits_text": "", "details_text": "", "other_sections": "", "sections": {}, "txt_path": "dataset/txt_limpios/1594.txt", "html_path": "dataset/paginas_descargadas/1594.html", "es_status": "ET", "category_canonical": "azucar", "decision": "keep", "match_score": 0.6, "reasons": "heuristic_default"}
{"source_id": "1596", "title": "Azúcar y Adoçante", "description": "", "breadcrumbs": "Azúcar > 1Kg", "price_raw": "10.19", "currency_raw": "BRL", "url": "", "seller": "Desconocido", "availability": "unknown", "country": "BR", "product_name": "Azúcar y Adoçante", "brand": "Azúcar", "reference": "", "unit": "1Kg", "price_amount": 10.19, "price_currency": "BRL", "price_symbol": "R$", "price_text": "R$10,19", "price_amount_filled": "10.19", "price_is_imputed": "False", "price_imputation_source": "original", "price_amount_usd": "1.8704", "price_amount_usd_filled": "1.8704", "fx_rate_local_per_usd": "5.448", "fx_source": "from_brasil_cambio_dolar", "information_text": "", "description_text": "", "features_text": "", "specifications_text": "", "benefits_text": "", "details_text": "", "other_sections": "", "sections": {}, "txt_path": "dataset/txt_limpios/1596.txt", "html_path": "dataset/paginas_descargadas/1596.html", "es_status": "ET", "category_canonical": "azucar", "decision": "keep", "match_score": 0.6, "reasons": "heuristic_default"}
{"source_id": "1600", "title": "Azúcar y Adoçante", "description": "", "breadcrumbs": "Azúcar > 1kg", "price_raw": "4.19", "currency_raw": "BRL", "url": "", "seller": "Desconocido", "availability": "unknown", "country": "BR", "product_name": "Azúcar y Adoçante", "brand": "Azúcar", "reference": "", "unit": "1kg", "price_amount": 4.19, "price_currency": "BRL", "price_symbol": "R$", "price_text": "R$4,19", "price_amount_filled": "4.19", "price_is_imputed": "False", "price_imputation_source": "original", "price_amount_usd": "0.7691", "price_amount_usd_filled": "0.7691", "fx_rate_local_per_usd": "5.448", "fx_source": "from_brasil_cambio_dolar", "information_text": "", "description_text": "", "features_text": "", "specifications_text": "", "benefits_text": "", "details_text": "", "other_sections": "", "sections": {}, "txt_path": "dataset/txt_limpios/1600.txt", "html_path": "dataset/paginas_descargadas/1600.html", "es_status": "ET", "category_canonical": "azucar", "decision": "keep", "match_score": 0.6, "reasons": "heuristic_default"}
{"source_id": "1602", "title": "Azúcar y Adoçante", "description": "", "breadcrumbs": "Azúcar > 500g", "price_raw": "4.99", "currency_raw": "BRL", "url": "", "seller": "Desconocido", "availability": "unknown", "country": "BR", "product_name": "Azúcar y Adoçante", "brand": "Azúcar", "reference": "", "unit": "500g", "price_amount": 4.99, "price_currency": "BRL", "price_symbol": "R$", "price_text": "R$4,99", "price_amount_filled": "4.99", "price_is_imputed": "False", "price_imputation_source": "original", "price_amount_usd": "0.9159", "price_amount_usd_filled": "0.9159", "fx_rate_local_per_usd": "5.448", "fx_source": "from_brasil_cambio_dolar", "information_text": "", "description_text": "", "features_text": "", "specifications_text": "", "benefits_text": "", "details_text": "", "other_sections": "", "sections": {}, "txt_path": "dataset/txt_limpios/1602.txt", "html_path": "dataset/paginas_descargadas/1602.html", "es_status": "ET", "category_canonical": "azucar", "decision": "keep", "match_score": 0.6, "reasons": "heuristic_default"}
{"source_id": "220", "title": "Azúcar y Adoçante", "description": "", "breadcrumbs": "Azúcar > 1kg", "price_raw": "4.89", "currency_raw": "BRL", "url": "", "seller": "Desconocido", "availability": "unknown", "country": "BR", "product_name": "Azúcar y Adoçante", "brand": "Azúcar", "reference": "", "unit": "1kg", "price_amount": 4.89, "price_currency": "BRL", "price_symbol": "R$", "price_text": "R$4,89", "price_amount_filled": "4.89", "price_is_imputed": "False", "price_imputation_source": "original", "price_amount_usd": "0.8976", "price_amount_usd_filled": "0.8976", "fx_rate_local_per_usd": "5.448", "fx_source": "from_brasil_cambio_dolar", "information_text": "", "description_text": "", "features_text": "", "specifications_text": "", "benefits_text": "", "details_text": "", "other_sections": "", "sections": {}, "txt_path": "dataset/txt_limpios/220.txt", "html_path": "dataset/paginas_descargadas/220.html", "es_status": "ET", "category_canonical": "azucar", "decision": "keep", "match_score": 0.6, "reasons": "heuristic_default"}
{"source_id": "221", "title": "Azúcar y Adoçante", "description": "", "breadcrumbs": "Azúcar > 1Kg", "price_raw": "10.19", "currency_raw": "BRL", "url": "", "seller": "Desconocido", "availability": "unknown", "country": "BR", "product_name": "Azúcar y Adoçante", "brand": "Azúcar", "reference": "", "unit": "1Kg", "price_amount": 10.19, "price_currency": "BRL", "price_symbol": "R$", "price_text": "R$10,19", "price_amount_filled": "10.19", "price_is_imputed": "False", "price_imputation_source": "original", "price_amount_usd": "1.8704", "price_amount_usd_filled": "1.8704", "fx_rate_local_per_usd": "5.448", "fx_source": "from_brasil_cambio_dolar", "information_text": "", "description_text": "", "features_text": "", "specifications_text": "", "benefits_text": "", "details_text": "", "other_sections": "", "sections": {}, "txt_path": "dataset/txt_limpios/221.txt", "html_path": "dataset/paginas_descargadas/221.html", "es_status": "ET", "category_canonical": "azucar", "decision": "keep", "match_score": 0.6, "reasons": "heuristic_default"}
{"source_id": "223", "title": "Azúcar y Adoçante", "description": "", "breadcrumbs": "Azúcar > 1kg", "price_raw": "3.99", "currency_raw": "BRL", "url": "", "seller": "Desconocido", "availability": "unknown", "country": "BR", "product_name": "Azúcar y Adoçante", "brand": "Azúcar", "reference": "", "unit": "1kg", "price_amount": 3.99, "price_currency": "BRL", "price_symbol": "R$", "price_text": "R$3,99", "price_amount_filled": "3.99", "price_is_imputed": "False", "price_imputation_source": "original", "price_amount_usd": "0.7324", "price_amount_usd_filled": "0.7324", "fx_rate_local_per_usd": "5.448", "fx_source": "from_brasil_cambio_dolar", "information_text": "", "description_text": "", "features_text": "", "specifications_text": "", "benefits_text": "", "details_text": "", "other_sections": "", "sections": {}, "txt_path": "dataset/txt_limpios/223.txt", "html_path": "dataset/paginas_descargadas/223.html", "es_status": "ET", "category_canonical": "azucar", "decision": "keep", "match_score": 0.6, "reasons": "heuristic_default"}
{"source_id": "224", "title": "Azúcar y Adoçante", "description": "", "breadcrumbs": "Azúcar > 500g", "price_raw": "4.99", "currency_raw": "BRL", "url": "", "seller": "Desconocido", "availability": "unknown", "country": "BR", "product_name": "Azúcar y Adoçante", "brand": "Azúcar", "reference": "", "unit": "500g", "price_amount": 4.99, "price_currency": "BRL", "price_symbol": "R$", "price_text": "R$4,99", "price_amount_filled": "4.99", "price_is_imputed": "False", "price_imputation_source": "original", "price_amount_usd": "0.9159", "price_amount_usd_filled": "0.9159", "fx_rate_local_per_usd": "5.448", "fx_source": "from_brasil_cambio_dolar", "information_text": "", "description_text": "", "features_text": "", "specifications_text": "", "benefits_text": "", "details_text": "", "other_sections": "", "sections": {}, "txt_path": "dataset/txt_limpios/224.txt", "html_path": "dataset/paginas_descargadas/224.html", "es_status": "ET", "category_canonical": "azucar", "decision": "keep", "match_score": 0.6, "reasons": "heuristic_default"}
{"source_id": "1228", "title": "Azúcar y Endulzantes", "description": "", "breadcrumbs": "Azúcar Rubia > 25 Kg", "price_raw": "16.92", "currency_raw": "PEN", "url": "", "seller": "Desconocido", "availability": "unknown", "country": "PE", "product_name": "Azúcar y Endulzantes", "brand": "Azúcar Rubia", "reference": "", "unit": "25 Kg", "price_amount": 16.92, "price_currency": "PEN", "price_symbol": "S/", "price_text": "S/16.92", "price_amount_filled": "16.92", "price_is_imputed": "False", "price_imputation_source": "original", "price_amount_usd": "4.7662", "price_amount_usd_filled": "4.7662", "fx_rate_local_per_usd": "3.55", "fx_source": "from_peru_cambio_dolar", "information_text": "", "description_text": "", "features_text": "", "specifications_text": "", "benefits_text": "", "details_text": "", "other_sections": "", "sections": {}, "txt_path": "dataset/txt_limpios/1228.txt", "html_path": "dataset/paginas_descargadas/1228.html", "es_status": "EN", "category_canonical": "azucar", "decision": "keep", "match_score": 0.6, "reasons": "heuristic_default"}
{"source_id": "22", "title": "Azúcar Zulka Glass 500g", "description": "Azúcar finamente pulverizada. La preferida por los expertos debido a su textura, consistencia y sabor. Especial para alta repostería, pastelería, confitería y repostería fina. Todas sus creaciones quedarán con una textura suave, desde un betún, fondant, rellenos de crema. Con un Dulzor perfecto en cualquier postre. Su sabor dulce de la azúcar se disuelva exquisitamente en tu boca. Zulka Glass es un azúcar perfecto para cubrir y dar un toque decorativo a tus postres brindándoles una textura suave y uniforme. Es un endulzante ideal para la pastelería , repostería y confitería por su fina textura el azúcar.", "breadcrumbs": "Zulka > 500g > 3546184", "price_raw": "", "currency_raw": "MXN", "url": "", "seller": "Chedraui", "availability": "unknown", "country": "MX", "product_name": "Azúcar Zulka Glass 500g", "brand": "Zulka", "reference": "3546184.0", "unit": "500g", "price_amount": null, "price_currency": "MXN", "price_symbol": "", "price_text": "", "price_amount_filled": "42.75", "price_is_imputed": "True", "price_imputation_source": "category_country_mean", "price_amount_usd": "", "price_amount_usd_filled": "2.296", "fx_rate_local_per_usd": "18.62", "fx_source": "from_mexico_cambio_dolar", "information_text": "Azúcar finamente pulverizada. La preferida por los expertos debido a su textura, consistencia y sabor. Especial para alta repostería, pastelería, confitería y repostería fina. Todas sus creaciones quedarán con una textura suave, desde un betún, fondant, rellenos de crema. Con un Dulzor perfecto en cualquier postre. Su sabor dulce de la azúcar se disuelva exquisitamente en tu boca.", "description_text": "", "features_text": "", "specifications_text": "Zulka Glass es un azúcar perfecto para cubrir y dar un toque decorativo a tus postres brindándoles una textura suave y uniforme. Es un endulzante ideal para la pastelería , repostería y confitería por su fina textura el azúcar.", "benefits_text": "", "details_text": "", "other_sections": "", "sections": {"Información": ["Azúcar finamente pulverizada. La preferida por los expertos debido a su textura, consistencia y sabor. Especial para alta repostería, pastelería, confitería y repostería fina. Todas sus creaciones quedarán con una textura suave, desde un betún, fondant, rellenos de crema. Con un Dulzor perfecto en cualquier postre. Su sabor dulce de la azúcar se disuelva exquisitamente en tu boca."], "Especificaciones": ["Zulka Glass es un azúcar perfecto para cubrir y dar un toque decorativo a tus postres brindándoles una textura suave y uniforme. Es un endulzante ideal para la pastelería , repostería y confitería por su fina textura el azúcar."]}, "txt_path": "dataset/txt_limpios/22.txt", "html_path": "dataset/paginas_descargadas/22.html", "es_status": "ET", "category_canonical": "azucar", "decision": "discard", "match_score": 0.6, "reasons": "price_parse_failed;price<=0"}
