source_id,title,description,breadcrumbs,price_raw,currency_raw,url,seller,availability,country,product_name,brand,reference,unit,price_amount,price_currency,price_symbol,price_text,price_amount_filled,price_is_imputed,price_imputation_source,price_amount_usd,price_amount_usd_filled,fx_rate_local_per_usd,fx_source,information_text,description_text,features_text,specifications_text,benefits_text,details_text,other_sections,sections,txt_path,html_path,es_status,category_canonical,decision,match_score,reasons
288,SEM GLÚTEN,,1 > 200 G,24.99,BRL,,Desconocido,unknown,BR,SEM GLÚTEN,1,,200 G,24.99,BRL,R$,"R$24,99",24.99,False,original,4.587,4.587,5.448,from_brasil_cambio_dolar,,,,,,,,{},dataset/txt_limpios/288.txt,dataset/paginas_descargadas/288.html,EN,sin_categoria,discard,0.30,no_category_detected
291,SEM GLÚTEN,,1 > 400 G,24.99,BRL,,Desconocido,unknown,BR,SEM GLÚTEN,1,,400 G,24.99,BRL,R$,"R$24,99",24.99,False,original,4.587,4.587,5.448,from_brasil_cambio_dolar,,,,,,,,{},dataset/txt_limpios/291.txt,dataset/paginas_descargadas/291.html,EN,sin_categoria,discard,0.30,no_category_detected
296,SEM GLÚTEN,,1 > 400 G,15.99,BRL,,Desconocido,unknown,BR,SEM GLÚTEN,1,,400 G,15.99,BRL,R$,"R$15,99",15.99,False,original,2.935,2.935,5.448,from_brasil_cambio_dolar,,,,,,,,{},dataset/txt_limpios/296.txt,dataset/paginas_descargadas/296.html,EN,sin_categoria,discard,0.30,no_category_detected
306,SEM GLÚTEN,,1 > 275 Ml,24.99,BRL,,Desconocido,unknown,BR,SEM GLÚTEN,1,,275 Ml,24.99,BRL,R$,"R$24,99",24.99,False,original,4.587,4.587,5.448,from_brasil_cambio_dolar,,,,,,,,{},dataset/txt_limpios/306.txt,dataset/paginas_descargadas/306.html,EN,sin_categoria,discard,0.30,no_category_detected
299,SEM LACTOSE,,1 > 1 L,9.99,BRL,,Desconocido,unknown,BR,SEM LACTOSE,1,,1 L,9.99,BRL,R$,"R$9,99",9.99,False,original,1.8337,1.8337,5.448,from_brasil_cambio_dolar,,,,,,,,{},dataset/txt_limpios/299.txt,dataset/paginas_descargadas/299.html,EN,sin_categoria,discard,0.30,no_category_detected
300,SEM LACTOSE,,1 > 1 L,9.99,BRL,,Desconocido,unknown,BR,SEM LACTOSE,1,,1 L,9.99,BRL,R$,"R$9,99",9.99,False,original,1.8337,1.8337,5.448,from_brasil_cambio_dolar,,,,,,,,{},dataset/txt_limpios/300.txt,dataset/paginas_descargadas/300.html,EN,sin_categoria,discard,0.30,no_category_detected
301,SEM LACTOSE,,1 > 1l,9.99,BRL,,Desconocido,unknown,BR,SEM LACTOSE,1,,1l,9.99,BRL,R$,"R$9,99",9.99,False,original,1.8337,1.8337,5.448,from_brasil_cambio_dolar,,,,,,,,{},dataset/txt_limpios/301.txt,dataset/paginas_descargadas/301.html,EN,sin_categoria,discard,0.30,no_category_detected
302,SEM LACTOSE,,1 > 1 L,1.0,,,Desconocido,unknown,UNKNOWN,SEM LACTOSE,1,,1 L,1.00,,r,r1,1.0,False,original,1.0,1.0,1.0,default_1usd,,,,,,,,{},dataset/txt_limpios/302.txt,dataset/paginas_descargadas/302.html,EN,sin_categoria,discard,0.30,no_category_detected
789,SOL NACIENTE,"Ingredientes | Componentes Nombre del Producto: Huevos de Gallina Sol Naciente AA x 12 Descripción del producto: Estos huevos de gallina son ideales para el consumo directo como alimento cocido o como ingrediente en la preparación de alimentos. Con un contenido neto de 12 unidades, los huevos Sol Naciente ofrecen calidad y frescura en cada comida. Son perfectos para diversas preparaciones culinarias, desde desayunos hasta recetas más elaboradas. Tamaño: 30 cm x 12 cm Cantidad: 12 Und Modo Fabricación: Industrial Conservación: Conservar en un lugar limpio, seco, fresco y protegido de la luz directa del sol. Consúmase en el menor tiempo posible. Origen: Nacional Alergenos: El huevo es un alérgeno natural. Componentes: Huevo ¡Queremos que tengas la mejor experiencia!. Si tienes dudas sobre este producto o su contenido, te invitamos a consultar nuestros Términos y condiciones para conocer más sobre devoluciones y nuestras políticas de reembolsos. Ver más También puede interesarte Bajó de precio PAPEL HIGIÉNICO 3 H 2 UN RENDY 33 MTS D1 Top 100 BANANO UNIDAD TOMATE CHONTO X 1000 G ARROZ PREMIUM ALBAR 1000 GRS PLÁTANO X 1000G FILETES DE PECHUGA BRASSET X 600 G LIMON TAHITI X 1000 GR LECHUGA VERDE CRESPA X 180 G",Unidades disponibles > 12 unidades,1.0,,,Desconocido,unknown,UNKNOWN,SOL NACIENTE,Unidades disponibles,,12 unidades,1.00,,D,D1,1.0,False,original,1.0,1.0,1.0,default_1usd,,"Ingredientes | Componentes Nombre del Producto: Huevos de Gallina Sol Naciente AA x 12 Descripción del producto: Estos huevos de gallina son ideales para el consumo directo como alimento cocido o como ingrediente en la preparación de alimentos. Con un contenido neto de 12 unidades, los huevos Sol Naciente ofrecen calidad y frescura en cada comida. Son perfectos para diversas preparaciones culinarias, desde desayunos hasta recetas más elaboradas. Tamaño: 30 cm x 12 cm Cantidad: 12 Und Modo Fabricación: Industrial Conservación: Conservar en un lugar limpio, seco, fresco y protegido de la luz directa del sol. Consúmase en el menor tiempo posible. Origen: Nacional Alergenos: El huevo es un alérgeno natural. Componentes: Huevo ¡Queremos que tengas la mejor experiencia!. Si tienes dudas sobre este producto o su contenido, te invitamos a consultar nuestros Términos y condiciones para conocer más sobre devoluciones y nuestras políticas de reembolsos. Ver más También puede interesarte Bajó de precio PAPEL HIGIÉNICO 3 H 2 UN RENDY 33 MTS D1 Top 100 BANANO UNIDAD TOMATE CHONTO X 1000 G ARROZ PREMIUM ALBAR 1000 GRS PLÁTANO X 1000G FILETES DE PECHUGA BRASSET X 600 G LIMON TAHITI X 1000 GR LECHUGA VERDE CRESPA X 180 G",,,,,,"{""Descripción"": [""Ingredientes | Componentes"", ""Nombre del Producto: Huevos de Gallina Sol Naciente AA x 12"", ""Descripción del producto: Estos huevos de gallina son ideales para el consumo directo como alimento cocido o como ingrediente en la preparación de alimentos. Con un contenido neto de 12 unidades, los huevos Sol Naciente ofrecen calidad y frescura en cada comida. Son perfectos para diversas preparaciones culinarias, desde desayunos hasta recetas más elaboradas."", ""Tamaño: 30 cm x 12 cm"", ""Cantidad: 12 Und"", ""Modo Fabricación: Industrial"", ""Conservación: Conservar en un lugar limpio, seco, fresco y protegido de la luz directa del sol. Consúmase en el menor tiempo posible."", ""Origen: Nacional"", ""Alergenos: El huevo es un alérgeno natural."", ""Componentes: Huevo"", ""¡Queremos que tengas la mejor experiencia!. Si tienes dudas sobre este producto o su contenido, te invitamos a consultar nuestros Términos y condiciones para conocer más sobre devoluciones y nuestras políticas de reembolsos."", ""Ver más"", ""También puede interesarte"", ""Bajó de precio"", ""PAPEL HIGIÉNICO 3 H 2 UN RENDY 33 MTS"", ""D1 Top 100"", ""BANANO UNIDAD"", ""TOMATE CHONTO X 1000 G"", ""ARROZ PREMIUM ALBAR 1000 GRS"", ""PLÁTANO X 1000G"", ""FILETES DE PECHUGA BRASSET X 600 G"", ""LIMON TAHITI X 1000 GR"", ""LECHUGA VERDE CRESPA X 180 G""]}",dataset/txt_limpios/789.txt,dataset/paginas_descargadas/789.html,EN,banano,keep,0.60,heuristic_default
911,super pollo,Pechuga deshuesada congelada,4.5 Kg > 4.5 Kg,32.89,,,Desconocido,unknown,UNKNOWN,super pollo,4.5 Kg,,4.5 Kg,32.89,,$,$32.89,32.89,False,original,32.89,32.89,1.0,default_1usd,,Pechuga deshuesada congelada,,,,,,"{""Descripción"": [""Pechuga deshuesada congelada""]}",dataset/txt_limpios/911.txt,dataset/paginas_descargadas/911.html,EN,sin_categoria,discard,0.30,no_category_detected
1066,Sí Acepto,,,,PEN,,Desconocido,unknown,PE,Sí Acepto,,,,,PEN,,,55.14,True,country_mean,,15.5336,3.55,from_peru_cambio_dolar,,,,,,,,{},dataset/txt_limpios/1066.txt,dataset/paginas_descargadas/1066.html,EN,sin_categoria,discard,0.30,no_category_detected;price_parse_failed
1087,Sí Acepto,,,,PEN,,Desconocido,unknown,PE,Sí Acepto,,,,,PEN,,,55.14,True,country_mean,,15.5336,3.55,from_peru_cambio_dolar,,,,,,,,{},dataset/txt_limpios/1087.txt,dataset/paginas_descargadas/1087.html,EN,sin_categoria,discard,0.30,no_category_detected;price_parse_failed
1096,Sí Acepto,,,,PEN,,Desconocido,unknown,PE,Sí Acepto,,,,,PEN,,,55.14,True,country_mean,,15.5336,3.55,from_peru_cambio_dolar,,,,,,,,{},dataset/txt_limpios/1096.txt,dataset/paginas_descargadas/1096.html,EN,sin_categoria,discard,0.30,no_category_detected;price_parse_failed
316,This app could not find url /acucar-cristal-organico-itaja-1-kg-100002544/p,,Preferências,1.0,,,Desconocido,unknown,UNKNOWN,This app could not find url /acucar-cristal-organico-itaja-1-kg-100002544/p,Preferências,,,1.00,,B,B1,1.0,False,original,1.0,1.0,1.0,default_1usd,,,,,,,,{},dataset/txt_limpios/316.txt,dataset/paginas_descargadas/316.html,EN,azucar,keep,0.60,heuristic_default
317,This app could not find url /acucar-extra-fino-mais-doce-1-kg-3783/p,,Preferências,1.0,,,Desconocido,unknown,UNKNOWN,This app could not find url /acucar-extra-fino-mais-doce-1-kg-3783/p,Preferências,,,1.00,,B,B1,1.0,False,original,1.0,1.0,1.0,default_1usd,,,,,,,,{},dataset/txt_limpios/317.txt,dataset/paginas_descargadas/317.html,EN,azucar,keep,0.60,heuristic_default
282,This app could not find url /arroz-camil-1-kg-100004793/p,,Preferências,1.0,,,Desconocido,unknown,UNKNOWN,This app could not find url /arroz-camil-1-kg-100004793/p,Preferências,,,1.00,,B,B1,1.0,False,original,1.0,1.0,1.0,default_1usd,,,,,,,,{},dataset/txt_limpios/282.txt,dataset/paginas_descargadas/282.html,EN,arroz,keep,0.60,heuristic_default
305,This app could not find url /cerveja-pure-gold-long-neck-stella-artois-sem-gluten-330-ml-100008859/p,,Preferências,1.0,,,Desconocido,unknown,UNKNOWN,This app could not find url /cerveja-pure-gold-long-neck-stella-artois-sem-gluten-330-ml-100008859/p,Preferências,,,1.00,,B,B1,1.0,False,original,1.0,1.0,1.0,default_1usd,,,,,,,,{},dataset/txt_limpios/305.txt,dataset/paginas_descargadas/305.html,EN,cerveza,keep,0.60,heuristic_default
323,Tienda Online,,Institucional > 1kg,3.98,BRL,,Desconocido,unknown,BR,Tienda Online,Institucional,,1kg,3.98,BRL,R$,"R$3,98",3.98,False,original,0.7305,0.7305,5.448,from_brasil_cambio_dolar,,,,,,,,{},dataset/txt_limpios/323.txt,dataset/paginas_descargadas/323.html,ET,sin_categoria,discard,0.30,no_category_detected
324,Tienda Online,,Institucional > 1kg,5.49,BRL,,Desconocido,unknown,BR,Tienda Online,Institucional,,1kg,5.49,BRL,R$,"R$5,49",5.49,False,original,1.0077,1.0077,5.448,from_brasil_cambio_dolar,,,,,,,,{},dataset/txt_limpios/324.txt,dataset/paginas_descargadas/324.html,ET,sin_categoria,discard,0.30,no_category_detected
325,Tienda Online,,Institucional > 1kg,3.78,BRL,,Desconocido,unknown,BR,Tienda Online,Institucional,,1kg,3.78,BRL,R$,"R$3,78",3.78,False,original,0.6938,0.6938,5.448,from_brasil_cambio_dolar,,,,,,,,{},dataset/txt_limpios/325.txt,dataset/paginas_descargadas/325.html,ET,sin_categoria,discard,0.30,no_category_detected
326,Tienda Online,,Institucional > 1kg,5.99,BRL,,Desconocido,unknown,BR,Tienda Online,Institucional,,1kg,5.99,BRL,R$,"R$5,99",5.99,False,original,1.0995,1.0995,5.448,from_brasil_cambio_dolar,,,,,,,,{},dataset/txt_limpios/326.txt,dataset/paginas_descargadas/326.html,ET,sin_categoria,discard,0.30,no_category_detected
327,Tienda Online,,Institucional > 1kg,3.99,BRL,,Desconocido,unknown,BR,Tienda Online,Institucional,,1kg,3.99,BRL,R$,"R$3,99",3.99,False,original,0.7324,0.7324,5.448,from_brasil_cambio_dolar,,,,,,,,{},dataset/txt_limpios/327.txt,dataset/paginas_descargadas/327.html,ET,sin_categoria,discard,0.30,no_category_detected
328,Tienda Online,,Institucional > 500g,27.97,BRL,,Desconocido,unknown,BR,Tienda Online,Institucional,,500g,27.97,BRL,R$,"R$27,97",27.97,False,original,5.134,5.134,5.448,from_brasil_cambio_dolar,,,,,,,,{},dataset/txt_limpios/328.txt,dataset/paginas_descargadas/328.html,ET,sin_categoria,discard,0.30,no_category_detected
329,Tienda Online,,Institucional > 200g,22.9,BRL,,Desconocido,unknown,BR,Tienda Online,Institucional,,200g,22.90,BRL,R$,"R$22,90",22.9,False,original,4.2034,4.2034,5.448,from_brasil_cambio_dolar,,,,,,,,{},dataset/txt_limpios/329.txt,dataset/paginas_descargadas/329.html,ET,sin_categoria,discard,0.30,no_category_detected
330,Tienda Online,,Institucional > 250g,29.98,BRL,,Desconocido,unknown,BR,Tienda Online,Institucional,,250g,29.98,BRL,R$,"R$29,98",29.98,False,original,5.5029,5.5029,5.448,from_brasil_cambio_dolar,,,,,,,,{},dataset/txt_limpios/330.txt,dataset/paginas_descargadas/330.html,ET,sin_categoria,discard,0.30,no_category_detected
331,Tienda Online,,Institucional > 40g,14.5,BRL,,Desconocido,unknown,BR,Tienda Online,Institucional,,40g,14.50,BRL,R$,"R$14,50",14.5,False,original,2.6615,2.6615,5.448,from_brasil_cambio_dolar,,,,,,,,{},dataset/txt_limpios/331.txt,dataset/paginas_descargadas/331.html,ET,sin_categoria,discard,0.30,no_category_detected
332,Tienda Online,,Institucional > 250g,39.9,BRL,,Desconocido,unknown,BR,Tienda Online,Institucional,,250g,39.90,BRL,R$,"R$39,90",39.9,False,original,7.3238,7.3238,5.448,from_brasil_cambio_dolar,,,,,,,,{},dataset/txt_limpios/332.txt,dataset/paginas_descargadas/332.html,ET,sin_categoria,discard,0.30,no_category_detected
333,Tienda Online,,Institucional > 450g,6.28,BRL,,Desconocido,unknown,BR,Tienda Online,Institucional,,450g,6.28,BRL,R$,"R$6,28",6.28,False,original,1.1527,1.1527,5.448,from_brasil_cambio_dolar,,,,,,,,{},dataset/txt_limpios/333.txt,dataset/paginas_descargadas/333.html,ET,sin_categoria,discard,0.30,no_category_detected
334,Tienda Online,,Institucional > 450g,8.29,BRL,,Desconocido,unknown,BR,Tienda Online,Institucional,,450g,8.29,BRL,R$,"R$8,29",8.29,False,original,1.5217,1.5217,5.448,from_brasil_cambio_dolar,,,,,,,,{},dataset/txt_limpios/334.txt,dataset/paginas_descargadas/334.html,ET,sin_categoria,discard,0.30,no_category_detected
335,Tienda Online,,Institucional > 450g,16.79,BRL,,Desconocido,unknown,BR,Tienda Online,Institucional,,450g,16.79,BRL,R$,"R$16,79",16.79,False,original,3.0819,3.0819,5.448,from_brasil_cambio_dolar,,,,,,,,{},dataset/txt_limpios/335.txt,dataset/paginas_descargadas/335.html,ET,sin_categoria,discard,0.30,no_category_detected
336,Tienda Online,,Institucional > 350g,8.45,BRL,,Desconocido,unknown,BR,Tienda Online,Institucional,,350g,8.45,BRL,R$,"R$8,45",8.45,False,original,1.551,1.551,5.448,from_brasil_cambio_dolar,,,,,,,,{},dataset/txt_limpios/336.txt,dataset/paginas_descargadas/336.html,ET,sin_categoria,discard,0.30,no_category_detected
337,Tienda Online,,Institucional > 450g,17.98,BRL,,Desconocido,unknown,BR,Tienda Online,Institucional,,450g,17.98,BRL,R$,"R$17,98",17.98,False,original,3.3003,3.3003,5.448,from_brasil_cambio_dolar,,,,,,,,{},dataset/txt_limpios/337.txt,dataset/paginas_descargadas/337.html,ET,sin_categoria,discard,0.30,no_category_detected
338,Tienda Online,,Institucional > 2 Litros,10.49,BRL,,Desconocido,unknown,BR,Tienda Online,Institucional,,2 Litros,10.49,BRL,R$,"R$10,49",10.49,False,original,1.9255,1.9255,5.448,from_brasil_cambio_dolar,,,,,,,,{},dataset/txt_limpios/338.txt,dataset/paginas_descargadas/338.html,ET,sin_categoria,discard,0.30,no_category_detected
339,Tienda Online,,"Institucional > 1,5 Litro",8.19,BRL,,Desconocido,unknown,BR,Tienda Online,Institucional,,"1,5 Litro",8.19,BRL,R$,"R$8,19",8.19,False,original,1.5033,1.5033,5.448,from_brasil_cambio_dolar,,,,,,,,{},dataset/txt_limpios/339.txt,dataset/paginas_descargadas/339.html,ET,sin_categoria,discard,0.30,no_category_detected
340,Tienda Online,,Institucional > 2 Litros,5.99,BRL,,Desconocido,unknown,BR,Tienda Online,Institucional,,2 Litros,5.99,BRL,R$,"R$5,99",5.99,False,original,1.0995,1.0995,5.448,from_brasil_cambio_dolar,,,,,,,,{},dataset/txt_limpios/340.txt,dataset/paginas_descargadas/340.html,ET,sin_categoria,discard,0.30,no_category_detected
341,Tienda Online,,Institucional > 2 Litros,7.89,BRL,,Desconocido,unknown,BR,Tienda Online,Institucional,,2 Litros,7.89,BRL,R$,"R$7,89",7.89,False,original,1.4482,1.4482,5.448,from_brasil_cambio_dolar,,,,,,,,{},dataset/txt_limpios/341.txt,dataset/paginas_descargadas/341.html,ET,sin_categoria,discard,0.30,no_category_detected
342,Tienda Online,,Institucional > 2 Litros,8.69,BRL,,Desconocido,unknown,BR,Tienda Online,Institucional,,2 Litros,8.69,BRL,R$,"R$8,69",8.69,False,original,1.5951,1.5951,5.448,from_brasil_cambio_dolar,,,,,,,,{},dataset/txt_limpios/342.txt,dataset/paginas_descargadas/342.html,ET,sin_categoria,discard,0.30,no_category_detected
343,Tienda Online,,Institucional > 500g,10.9,BRL,,Desconocido,unknown,BR,Tienda Online,Institucional,,500g,10.90,BRL,R$,"R$10,90",10.9,False,original,2.0007,2.0007,5.448,from_brasil_cambio_dolar,,,,,,,,{},dataset/txt_limpios/343.txt,dataset/paginas_descargadas/343.html,ET,sin_categoria,discard,0.30,no_category_detected
344,Tienda Online,,Institucional > 500g,3.99,BRL,,Desconocido,unknown,BR,Tienda Online,Institucional,,500g,3.99,BRL,R$,"R$3,99",3.99,False,original,0.7324,0.7324,5.448,from_brasil_cambio_dolar,,,,,,,,{},dataset/txt_limpios/344.txt,dataset/paginas_descargadas/344.html,ET,sin_categoria,discard,0.30,no_category_detected
345,Tienda Online,,Institucional > 500g,12.9,BRL,,Desconocido,unknown,BR,Tienda Online,Institucional,,500g,12.90,BRL,R$,"R$12,90",12.9,False,original,2.3678,2.3678,5.448,from_brasil_cambio_dolar,,,,,,,,{},dataset/txt_limpios/345.txt,dataset/paginas_descargadas/345.html,ET,sin_categoria,discard,0.30,no_category_detected
346,Tienda Online,,Institucional > 500g,16.9,BRL,,Desconocido,unknown,BR,Tienda Online,Institucional,,500g,16.90,BRL,R$,"R$16,90",16.9,False,original,3.1021,3.1021,5.448,from_brasil_cambio_dolar,,,,,,,,{},dataset/txt_limpios/346.txt,dataset/paginas_descargadas/346.html,ET,sin_categoria,discard,0.30,no_category_detected
347,Tienda Online,,Institucional > 500g,5.98,BRL,,Desconocido,unknown,BR,Tienda Online,Institucional,,500g,5.98,BRL,R$,"R$5,98",5.98,False,original,1.0977,1.0977,5.448,from_brasil_cambio_dolar,,,,,,,,{},dataset/txt_limpios/347.txt,dataset/paginas_descargadas/347.html,ET,sin_categoria,discard,0.30,no_category_detected
348,Tienda Online,,Institucional > 1 Litro,4.75,BRL,,Desconocido,unknown,BR,Tienda Online,Institucional,,1 Litro,4.75,BRL,R$,"R$4,75",4.75,False,original,0.8719,0.8719,5.448,from_brasil_cambio_dolar,,,,,,,,{},dataset/txt_limpios/348.txt,dataset/paginas_descargadas/348.html,ET,sin_categoria,discard,0.30,no_category_detected
349,Tienda Online,,Institucional,,BRL,,Desconocido,unknown,BR,Tienda Online,Institucional,,,,BRL,,,12.0,True,country_mean,,2.2024,5.448,from_brasil_cambio_dolar,,,,,,,,{},dataset/txt_limpios/349.txt,dataset/paginas_descargadas/349.html,ET,sin_categoria,discard,0.30,no_category_detected;price_parse_failed
350,Tienda Online,,Institucional > 1 Litro,4.78,BRL,,Desconocido,unknown,BR,Tienda Online,Institucional,,1 Litro,4.78,BRL,R$,"R$4,78",4.78,False,original,0.8774,0.8774,5.448,from_brasil_cambio_dolar,,,,,,,,{},dataset/txt_limpios/350.txt,dataset/paginas_descargadas/350.html,ET,sin_categoria,discard,0.30,no_category_detected
351,Tienda Online,,Institucional > 1 Litro,9.75,BRL,,Desconocido,unknown,BR,Tienda Online,Institucional,,1 Litro,9.75,BRL,R$,"R$9,75",9.75,False,original,1.7896,1.7896,5.448,from_brasil_cambio_dolar,,,,,,,,{},dataset/txt_limpios/351.txt,dataset/paginas_descargadas/351.html,ET,sin_categoria,discard,0.30,no_category_detected
352,Tienda Online,,Institucional,,BRL,,Desconocido,unknown,BR,Tienda Online,Institucional,,,,BRL,,,12.0,True,country_mean,,2.2024,5.448,from_brasil_cambio_dolar,,,,,,,,{},dataset/txt_limpios/352.txt,dataset/paginas_descargadas/352.html,ET,sin_categoria,discard,0.30,no_category_detected;price_parse_failed
353,Tienda Online,,Institucional > 350ml,5.79,BRL,,Desconocido,unknown,BR,Tienda Online,Institucional,,350ml,5.79,BRL,R$,"R$5,79",5.79,False,original,1.0628,1.0628,5.448,from_brasil_cambio_dolar,,,,,,,,{},dataset/txt_limpios/353.txt,dataset/paginas_descargadas/353.html,ET,sin_categoria,discard,0.30,no_category_detected
354,Tienda Online,,Institucional > 210ml,5.49,BRL,,Desconocido,unknown,BR,Tienda Online,Institucional,,210ml,5.49,BRL,R$,"R$5,49",5.49,False,original,1.0077,1.0077,5.448,from_brasil_cambio_dolar,,,,,,,,{},dataset/txt_limpios/354.txt,dataset/paginas_descargadas/354.html,ET,sin_categoria,discard,0.30,no_category_detected
355,Tienda Online,,Institucional > 355ml,4.99,BRL,,Desconocido,unknown,BR,Tienda Online,Institucional,,355ml,4.99,BRL,R$,"R$4,99",4.99,False,original,0.9159,0.9159,5.448,from_brasil_cambio_dolar,,,,,,,,{},dataset/txt_limpios/355.txt,dataset/paginas_descargadas/355.html,ET,sin_categoria,discard,0.30,no_category_detected
356,Tienda Online,,Institucional > 473ml,5.19,BRL,,Desconocido,unknown,BR,Tienda Online,Institucional,,473ml,5.19,BRL,R$,"R$5,19",5.19,False,original,0.9526,0.9526,5.448,from_brasil_cambio_dolar,,,,,,,,{},dataset/txt_limpios/356.txt,dataset/paginas_descargadas/356.html,ET,sin_categoria,discard,0.30,no_category_detected
357,Tienda Online,,Institucional > 473ml,3.48,BRL,,Desconocido,unknown,BR,Tienda Online,Institucional,,473ml,3.48,BRL,R$,"R$3,48",3.48,False,original,0.6388,0.6388,5.448,from_brasil_cambio_dolar,,,,,,,,{},dataset/txt_limpios/357.txt,dataset/paginas_descargadas/357.html,ET,sin_categoria,discard,0.30,no_category_detected
358,Tienda Online,,"Institucional > 2,769kg",60.64,BRL,,Desconocido,unknown,BR,Tienda Online,Institucional,,"2,769kg",60.64,BRL,R$,"R$60,64",60.64,False,original,11.1307,11.1307,5.448,from_brasil_cambio_dolar,,,,,,,,{},dataset/txt_limpios/358.txt,dataset/paginas_descargadas/358.html,ET,sin_categoria,discard,0.30,no_category_detected
359,Tienda Online,,Institucional > 1kg,15.9,BRL,,Desconocido,unknown,BR,Tienda Online,Institucional,,1kg,15.90,BRL,R$,"R$15,90",15.9,False,original,2.9185,2.9185,5.448,from_brasil_cambio_dolar,,,,,,,,{},dataset/txt_limpios/359.txt,dataset/paginas_descargadas/359.html,ET,sin_categoria,discard,0.30,no_category_detected
360,Tienda Online,,Institucional > 900g,21.8,BRL,,Desconocido,unknown,BR,Tienda Online,Institucional,,900g,21.80,BRL,R$,"R$21,80",21.8,False,original,4.0015,4.0015,5.448,from_brasil_cambio_dolar,,,,,,,,{},dataset/txt_limpios/360.txt,dataset/paginas_descargadas/360.html,ET,sin_categoria,discard,0.30,no_category_detected
