{"source_id": "749", "title": "(Und a $ 850)", "description": "", "breadcrumbs": "$ 25.500", "price_raw": "850.0", "currency_raw": "", "url": "", "seller": "Desconocido", "availability": "unknown", "country": "UNKNOWN", "product_name": "(Und a $ 850)", "brand": "$ 25.500", "reference": "", "unit": "", "price_amount": 850.0, "price_currency": "", "price_symbol": "$", "price_text": "$850", "price_amount_filled": "850.0", "price_is_imputed": "False", "price_imputation_source": "original", "price_amount_usd": "850.0", "price_amount_usd_filled": "850.0", "fx_rate_local_per_usd": "1.0", "fx_source": "default_1usd", "information_text": "", "description_text": "", "features_text": "", "specifications_text": "", "benefits_text": "", "details_text": "", "other_sections": "", "sections": {}, "txt_path": "dataset/txt_limpios/749.txt", "html_path": "dataset/paginas_descargadas/749.html", "es_status": "EN", "category_canonical": "sin_categoria", "decision": "discard", "match_score": 0.3, "reasons": "no_category_detected"}
{"source_id": "750", "title": "(Und a $ 858)", "description": "", "breadcrumbs": "$ 10.300", "price_raw": "858.0", "currency_raw": "", "url": "", "seller": "Desconocido", "availability": "unknown", "country": "UNKNOWN", "product_name": "(Und a $ 858)", "brand": "$ 10.300", "reference": "", "unit": "", "price_amount": 858.0, "price_currency": "", "price_symbol": "$", "price_text": "$858", "price_amount_filled": "858.0", "price_is_imputed": "False", "price_imputation_source": "original", "price_amount_usd": "858.0", "price_amount_usd_filled": "858.0", "fx_rate_local_per_usd": "1.0", "fx_source": "default_1usd", "information_text": "", "description_text": "", "features_text": "", "specifications_text": "", "benefits_text": "", "details_text": "", "other_sections": "", "sections": {}, "txt_path": "dataset/txt_limpios/750.txt", "html_path": "dataset/paginas_descargadas/750.html", "es_status": "EN", "category_canonical": "sin_categoria", "decision": "discard", "match_score": 0.3, "reasons": "no_category_detected"}
{"source_id": "1406", "title": "+595994 874276", "description": "", "breadcrumbs": "Selecciona método de entrega > 580 GR", "price_raw": "", "currency_raw": "", "url": "", "seller": "Desconocido", "availability": "unknown", "country": "UNKNOWN", "product_name": "+595994 874276", "brand": "Selecciona método de entrega", "reference": "", "unit": "580 GR", "price_amount": null, "price_currency": "", "price_symbol": "", "price_text": "", "price_amount_filled": "234.19", "price_is_imputed": "True", "price_imputation_source": "country_mean", "price_amount_usd": "", "price_amount_usd_filled": "234.1938", "fx_rate_local_per_usd": "1.0", "fx_source": "default_1usd", "information_text": "", "description_text": "", "features_text": "", "specifications_text": "", "benefits_text": "", "details_text": "", "other_sections": "", "sections": {}, "txt_path": "dataset/txt_limpios/1406.txt", "html_path": "dataset/paginas_descargadas/1406.html", "es_status": "EN", "category_canonical": "sin_categoria", "decision": "discard", "match_score": 0.3, "reasons": "no_category_detected;price_parse_failed"}
{"source_id": "1408", "title": "+595994 874276", "description": "", "breadcrumbs": "Selecciona método de entrega > 850 GR", "price_raw": "", "currency_raw": "", "url": "", "seller": "Desconocido", "availability": "unknown", "country": "UNKNOWN", "product_name": "+595994 874276", "brand": "Selecciona método de entrega", "reference": "", "unit": "850 GR", "price_amount": null, "price_currency": "", "price_symbol": "", "price_text": "", "price_amount_filled": "234.19", "price_is_imputed": "True", "price_imputation_source": "country_mean", "price_amount_usd": "", "price_amount_usd_filled": "234.1938", "fx_rate_local_per_usd": "1.0", "fx_source": "default_1usd", "information_text": "", "description_text": "", "features_text": "", "specifications_text": "", "benefits_text": "", "details_text": "", "other_sections": "", "sections": {}, "txt_path": "dataset/txt_limpios/1408.txt", "html_path": "dataset/paginas_descargadas/1408.html", "es_status": "EN", "category_canonical": "sin_categoria", "decision": "discard", "match_score": 0.3, "reasons": "no_category_detected;price_parse_failed"}
{"source_id": "1410", "title": "+595994 874276", "description": "", "breadcrumbs": "Selecciona método de entrega > 700 GR", "price_raw": "", "currency_raw": "", "url": "", "seller": "Desconocido", "availability": "unknown", "country": "UNKNOWN", "product_name": "+595994 874276", "brand": "Selecciona método de entrega", "reference": "", "unit": "700 GR", "price_amount": null, "price_currency": "", "price_symbol": "", "price_text": "", "price_amount_filled": "234.19", "price_is_imputed": "True", "price_imputation_source": "country_mean", "price_amount_usd": "", "price_amount_usd_filled": "234.1938", "fx_rate_local_per_usd": "1.0", "fx_source": "default_1usd", "information_text": "", "description_text": "", "features_text": "", "specifications_text": "", "benefits_text": "", "details_text": "", "other_sections": "", "sections": {}, "txt_path": "dataset/txt_limpios/1410.txt", "html_path": "dataset/paginas_descargadas/1410.html", "es_status": "EN", "category_canonical": "sin_categoria", "decision": "discard", "match_score": 0.3, "reasons": "no_category_detected;price_parse_failed"}
{"source_id": "1411", "title": "+595994 874276", "description": "", "breadcrumbs": "Selecciona método de entrega", "price_raw": "", "currency_raw": "", "url": "", "seller": "Desconocido", "availability": "unknown", "country": "UNKNOWN", "product_name": "+595994 874276", "brand": "Selecciona método de entrega", "reference": "", "unit": "", "price_amount": null, "price_currency": "", "price_symbol": "", "price_text": "", "price_amount_filled": "234.19", "price_is_imputed": "True", "price_imputation_source": "country_mean", "price_amount_usd": "", "price_amount_usd_filled": "234.1938", "fx_rate_local_per_usd": "1.0", "fx_source": "default_1usd", "information_text": "", "description_text": "", "features_text": "", "specifications_text": "", "benefits_text": "", "details_text": "", "other_sections": "", "sections": {}, "txt_path": "dataset/txt_limpios/1411.txt", "html_path": "dataset/paginas_descargadas/1411.html", "es_status": "EN", "category_canonical": "sin_categoria", "decision": "discard", "match_score": 0.3, "reasons": "no_category_detected;price_parse_failed"}
{"source_id": "1413", "title": "+595994 874276", "description": "", "breadcrumbs": "Selecciona método de entrega > 500 ML", "price_raw": "", "currency_raw": "", "url": "", "seller": "Desconocido", "availability": "unknown", "country": "UNKNOWN", "product_name": "+595994 874276", "brand": "Selecciona método de entrega", "reference": "", "unit": "500 ML", "price_amount": null, "price_currency": "", "price_symbol": "", "price_text": "", "price_amount_filled": "234.19", "price_is_imputed": "True", "price_imputation_source": "country_mean", "price_amount_usd": "", "price_amount_usd_filled": "234.1938", "fx_rate_local_per_usd": "1.0", "fx_source": "default_1usd", "information_text": "", "description_text": "", "features_text": "", "specifications_text": "", "benefits_text": "", "details_text": "", "other_sections": "", "sections": {}, "txt_path": "dataset/txt_limpios/1413.txt", "html_path": "dataset/paginas_descargadas/1413.html", "es_status": "EN", "category_canonical": "sin_categoria", "decision": "discard", "match_score": 0.3, "reasons": "no_category_detected;price_parse_failed"}
{"source_id": "1414", "title": "+595994 874276", "description": "", "breadcrumbs": "Selecciona método de entrega > 1 KG", "price_raw": "", "currency_raw": "", "url": "", "seller": "Desconocido", "availability": "unknown", "country": "UNKNOWN", "product_name": "+595994 874276", "brand": "Selecciona método de entrega", "reference": "", "unit": "1 KG", "price_amount": null, "price_currency": "", "price_symbol": "", "price_text": "", "price_amount_filled": "234.19", "price_is_imputed": "True", "price_imputation_source": "country_mean", "price_amount_usd": "", "price_amount_usd_filled": "234.1938", "fx_rate_local_per_usd": "1.0", "fx_source": "default_1usd", "information_text": "", "description_text": "", "features_text": "", "specifications_text": "", "benefits_text": "", "details_text": "", "other_sections": "", "sections": {}, "txt_path": "dataset/txt_limpios/1414.txt", "html_path": "dataset/paginas_descargadas/1414.html", "es_status": "EN", "category_canonical": "sin_categoria", "decision": "discard", "match_score": 0.3, "reasons": "no_category_detected;price_parse_failed"}
{"source_id": "1415", "title": "+595994 874276", "description": "", "breadcrumbs": "Selecciona método de entrega > 400 GR", "price_raw": "", "currency_raw": "", "url": "", "seller": "Desconocido", "availability": "unknown", "country": "UNKNOWN", "product_name": "+595994 874276", "brand": "Selecciona método de entrega", "reference": "", "unit": "400 GR", "price_amount": null, "price_currency": "", "price_symbol": "", "price_text": "", "price_amount_filled": "234.19", "price_is_imputed": "True", "price_imputation_source": "country_mean", "price_amount_usd": "", "price_amount_usd_filled": "234.1938", "fx_rate_local_per_usd": "1.0", "fx_source": "default_1usd", "information_text": "", "description_text": "", "features_text": "", "specifications_text": "", "benefits_text": "", "details_text": "", "other_sections": "", "sections": {}, "txt_path": "dataset/txt_limpios/1415.txt", "html_path": "dataset/paginas_descargadas/1415.html", "es_status": "EN", "category_canonical": "sin_categoria", "decision": "discard", "match_score": 0.3, "reasons": "no_category_detected;price_parse_failed"}
{"source_id": "1416", "title": "+595994 874276", "description": "", "breadcrumbs": "Selecciona método de entrega > 500 ML", "price_raw": "", "currency_raw": "", "url": "", "seller": "Desconocido", "availability": "unknown", "country": "UNKNOWN", "product_name": "+595994 874276", "brand": "Selecciona método de entrega", "reference": "", "unit": "500 ML", "price_amount": null, "price_currency": "", "price_symbol": "", "price_text": "", "price_amount_filled": "234.19", "price_is_imputed": "True", "price_imputation_source": "country_mean", "price_amount_usd": "", "price_amount_usd_filled": "234.1938", "fx_rate_local_per_usd": "1.0", "fx_source": "default_1usd", "information_text": "", "description_text": "", "features_text": "", "specifications_text": "", "benefits_text": "", "details_text": "", "other_sections": "", "sections": {}, "txt_path": "dataset/txt_limpios/1416.txt", "html_path": "dataset/paginas_descargadas/1416.html", "es_status": "EN", "category_canonical": "sin_categoria", "decision": "discard", "match_score": 0.3, "reasons": "no_category_detected;price_parse_failed"}
{"source_id": "1417", "title": "+595994 874276", "description": "", "breadcrumbs": "Selecciona método de entrega", "price_raw": "", "currency_raw": "", "url": "", "seller": "Desconocido", "availability": "unknown", "country": "UNKNOWN", "product_name": "+595994 874276", "brand": "Selecciona método de entrega", "reference": "", "unit": "", "price_amount": null, "price_currency": "", "price_symbol": "", "price_text": "", "price_amount_filled": "234.19", "price_is_imputed": "True", "price_imputation_source": "country_mean", "price_amount_usd": "", "price_amount_usd_filled": "234.1938", "fx_rate_local_per_usd": "1.0", "fx_source": "default_1usd", "information_text": "", "description_text": "", "features_text": "", "specifications_text": "", "benefits_text": "", "details_text": "", "other_sections": "", "sections": {}, "txt_path": "dataset/txt_limpios/1417.txt", "html_path": "dataset/paginas_descargadas/1417.html", "es_status": "EN", "category_canonical": "sin_categoria", "decision": "discard", "match_score": 0.3, "reasons": "no_category_detected;price_parse_failed"}
{"source_id": "1418", "title": "+595994 874276", "description": "", "breadcrumbs": "Selecciona método de entrega > 1 LT", "price_raw": "", "currency_raw": "", "url": "", "seller": "Desconocido", "availability": "unknown", "country": "UNKNOWN", "product_name": "+595994 874276", "brand": "Selecciona método de entrega", "reference": "", "unit": "1 LT", "price_amount": null, "price_currency": "", "price_symbol": "", "price_text": "", "price_amount_filled": "234.19", "price_is_imputed": "True", "price_imputation_source": "country_mean", "price_amount_usd": "", "price_amount_usd_filled": "234.1938", "fx_rate_local_per_usd": "1.0", "fx_source": "default_1usd", "information_text": "", "description_text": "", "features_text": "", "specifications_text": "", "benefits_text": "", "details_text": "", "other_sections": "", "sections": {}, "txt_path": "dataset/txt_limpios/1418.txt", "html_path": "dataset/paginas_descargadas/1418.html", "es_status": "EN", "category_canonical": "sin_categoria", "decision": "discard", "match_score": 0.3, "reasons": "no_category_detected;price_parse_failed"}
{"source_id": "1419", "title": "+595994 874276", "description": "", "breadcrumbs": "Selecciona método de entrega > 1 LT", "price_raw": "", "currency_raw": "", "url": "", "seller": "Desconocido", "availability": "unknown", "country": "UNKNOWN", "product_name": "+595994 874276", "brand": "Selecciona método de entrega", "reference": "", "unit": "1 LT", "price_amount": null, "price_currency": "", "price_symbol": "", "price_text": "", "price_amount_filled": "234.19", "price_is_imputed": "True", "price_imputation_source": "country_mean", "price_amount_usd": "", "price_amount_usd_filled": "234.1938", "fx_rate_local_per_usd": "1.0", "fx_source": "default_1usd", "information_text": "", "description_text": "", "features_text": "", "specifications_text": "", "benefits_text": "", "details_text": "", "other_sections": "", "sections": {}, "txt_path": "dataset/txt_limpios/1419.txt", "html_path": "dataset/paginas_descargadas/1419.html", "es_status": "EN", "category_canonical": "sin_categoria", "decision": "discard", "match_score": 0.3, "reasons": "no_category_detected;price_parse_failed"}
{"source_id": "1420", "title": "+595994 874276", "description": "", "breadcrumbs": "Selecciona método de entrega > 2 LT", "price_raw": "2.0", "currency_raw": "", "url": "", "seller": "Desconocido", "availability": "unknown", "country": "UNKNOWN", "product_name": "+595994 874276", "brand": "Selecciona método de entrega", "reference": "", "unit": "2 LT", "price_amount": 2.0, "price_currency": "", "price_symbol": "", "price_text": "2", "price_amount_filled": "2.0", "price_is_imputed": "False", "price_imputation_source": "original", "price_amount_usd": "2.0", "price_amount_usd_filled": "2.0", "fx_rate_local_per_usd": "1.0", "fx_source": "default_1usd", "information_text": "", "description_text": "", "features_text": "", "specifications_text": "", "benefits_text": "", "details_text": "", "other_sections": "", "sections": {}, "txt_path": "dataset/txt_limpios/1420.txt", "html_path": "dataset/paginas_descargadas/1420.html", "es_status": "EN", "category_canonical": "sin_categoria", "decision": "discard", "match_score": 0.3, "reasons": "no_category_detected"}
{"source_id": "1421", "title": "+595994 874276", "description": "", "breadcrumbs": "Selecciona método de entrega > 750 ML", "price_raw": "2.0", "currency_raw": "", "url": "", "seller": "Desconocido", "availability": "unknown", "country": "UNKNOWN", "product_name": "+595994 874276", "brand": "Selecciona método de entrega", "reference": "", "unit": "750 ML", "price_amount": 2.0, "price_currency": "", "price_symbol": "", "price_text": "2", "price_amount_filled": "2.0", "price_is_imputed": "False", "price_imputation_source": "original", "price_amount_usd": "2.0", "price_amount_usd_filled": "2.0", "fx_rate_local_per_usd": "1.0", "fx_source": "default_1usd", "information_text": "", "description_text": "", "features_text": "", "specifications_text": "", "benefits_text": "", "details_text": "", "other_sections": "", "sections": {}, "txt_path": "dataset/txt_limpios/1421.txt", "html_path": "dataset/paginas_descargadas/1421.html", "es_status": "EN", "category_canonical": "sin_categoria", "decision": "discard", "match_score": 0.3, "reasons": "no_category_detected"}
{"source_id": "1422", "title": "+595994 874276", "description": "", "breadcrumbs": "Selecciona método de entrega > 1 KG", "price_raw": "", "currency_raw": "", "url": "", "seller": "Desconocido", "availability": "unknown", "country": "UNKNOWN", "product_name": "+595994 874276", "brand": "Selecciona método de entrega", "reference": "", "unit": "1 KG", "price_amount": null, "price_currency": "", "price_symbol": "", "price_text": "", "price_amount_filled": "234.19", "price_is_imputed": "True", "price_imputation_source": "country_mean", "price_amount_usd": "", "price_amount_usd_filled": "234.1938", "fx_rate_local_per_usd": "1.0", "fx_source": "default_1usd", "information_text": "", "description_text": "", "features_text": "", "specifications_text": "", "benefits_text": "", "details_text": "", "other_sections": "", "sections": {}, "txt_path": "dataset/txt_limpios/1422.txt", "html_path": "dataset/paginas_descargadas/1422.html", "es_status": "EN", "category_canonical": "sin_categoria", "decision": "discard", "match_score": 0.3, "reasons": "no_category_detected;price_parse_failed"}
{"source_id": "1423", "title": "+595994 874276", "description": "", "breadcrumbs": "Selecciona método de entrega", "price_raw": "", "currency_raw": "", "url": "", "seller": "Desconocido", "availability": "unknown", "country": "UNKNOWN", "product_name": "+595994 874276", "brand": "Selecciona método de entrega", "reference": "", "unit": "", "price_amount": null, "price_currency": "", "price_symbol": "", "price_text": "", "price_amount_filled": "234.19", "price_is_imputed": "True", "price_imputation_source": "country_mean", "price_amount_usd": "", "price_amount_usd_filled": "234.1938", "fx_rate_local_per_usd": "1.0", "fx_source": "default_1usd", "information_text": "", "description_text": "", "features_text": "", "specifications_text": "", "benefits_text": "", "details_text": "", "other_sections": "", "sections": {}, "txt_path": "dataset/txt_limpios/1423.txt", "html_path": "dataset/paginas_descargadas/1423.html", "es_status": "EN", "category_canonical": "sin_categoria", "decision": "discard", "match_score": 0.3, "reasons": "no_category_detected;price_parse_failed"}
{"source_id": "1424", "title": "+595994 874276", "description": "", "breadcrumbs": "Selecciona método de entrega > 400 GR", "price_raw": "400.0", "currency_raw": "", "url": "", "seller": "Desconocido", "availability": "unknown", "country": "UNKNOWN", "product_name": "+595994 874276", "brand": "Selecciona método de entrega", "reference": "", "unit": "400 GR", "price_amount": 400.0, "price_currency": "", "price_symbol": "", "price_text": "400", "price_amount_filled": "400.0", "price_is_imputed": "False", "price_imputation_source": "original", "price_amount_usd": "400.0", "price_amount_usd_filled": "400.0", "fx_rate_local_per_usd": "1.0", "fx_source": "default_1usd", "information_text": "", "description_text": "", "features_text": "", "specifications_text": "", "benefits_text": "", "details_text": "", "other_sections": "", "sections": {}, "txt_path": "dataset/txt_limpios/1424.txt", "html_path": "dataset/paginas_descargadas/1424.html", "es_status": "EN", "category_canonical": "sin_categoria", "decision": "discard", "match_score": 0.3, "reasons": "no_category_detected"}
{"source_id": "1425", "title": "+595994 874276", "description": "", "breadcrumbs": "Selecciona método de entrega > 250 GR", "price_raw": "", "currency_raw": "", "url": "", "seller": "Desconocido", "availability": "unknown", "country": "UNKNOWN", "product_name": "+595994 874276", "brand": "Selecciona método de entrega", "reference": "", "unit": "250 GR", "price_amount": null, "price_currency": "", "price_symbol": "", "price_text": "", "price_amount_filled": "234.19", "price_is_imputed": "True", "price_imputation_source": "country_mean", "price_amount_usd": "", "price_amount_usd_filled": "234.1938", "fx_rate_local_per_usd": "1.0", "fx_source": "default_1usd", "information_text": "", "description_text": "", "features_text": "", "specifications_text": "", "benefits_text": "", "details_text": "", "other_sections": "", "sections": {}, "txt_path": "dataset/txt_limpios/1425.txt", "html_path": "dataset/paginas_descargadas/1425.html", "es_status": "EN", "category_canonical": "sin_categoria", "decision": "discard", "match_score": 0.3, "reasons": "no_category_detected;price_parse_failed"}
{"source_id": "1426", "title": "+595994 874276", "description": "", "breadcrumbs": "Selecciona método de entrega > 2 LT", "price_raw": "2.0", "currency_raw": "", "url": "", "seller": "Desconocido", "availability": "unknown", "country": "UNKNOWN", "product_name": "+595994 874276", "brand": "Selecciona método de entrega", "reference": "", "unit": "2 LT", "price_amount": 2.0, "price_currency": "", "price_symbol": "", "price_text": "2", "price_amount_filled": "2.0", "price_is_imputed": "False", "price_imputation_source": "original", "price_amount_usd": "2.0", "price_amount_usd_filled": "2.0", "fx_rate_local_per_usd": "1.0", "fx_source": "default_1usd", "information_text": "", "description_text": "", "features_text": "", "specifications_text": "", "benefits_text": "", "details_text": "", "other_sections": "", "sections": {}, "txt_path": "dataset/txt_limpios/1426.txt", "html_path": "dataset/paginas_descargadas/1426.html", "es_status": "EN", "category_canonical": "sin_categoria", "decision": "discard", "match_score": 0.3, "reasons": "no_category_detected"}
