source_id,title,description,breadcrumbs,price_raw,currency_raw,url,seller,availability,country,product_name,brand,reference,unit,price_amount,price_currency,price_symbol,price_text,price_amount_filled,price_is_imputed,price_imputation_source,price_amount_usd,price_amount_usd_filled,fx_rate_local_per_usd,fx_source,information_text,description_text,features_text,specifications_text,benefits_text,details_text,other_sections,sections,txt_path,html_path,es_status,category_canonical,decision,match_score,reasons
1303,Valoramos tu privacidad,"incap_ses_* sesión opt_out gdpr Caducada _GRECAPTCHA 6 meses Un CAPTCHA te ayuda a protegerte del spam y del descifrado de contraseñas pidiéndote que completes una simple prueba que demuestre que eres humano y no un ordenador que intenta acceder a una cuenta protegida con contraseña. __cf_bm 1 hora rc::a Nunca caduca rc::c rc::f rc::b Funcionales SnapABugRef 2 horas SnapABugHistory SnapABugUserAlias SnapABugVisit Analíticas ___utmvc Menos de un minuto _gcl_au 3 meses _ga 1 año 1 mes 4 días _gid 1 día _gat_UA-* 1 minuto _ga_* uid 1 año 24 días _hjSessionUser_* _hjSession_* _fbp demdex _hjTLDTest Rendimiento Anuncio 15 minutos personalization_id muc_ads cto_bundle IDE uuid2 anj CMID CMPS CMPRO dpm mv_tokens 14 días 1 minuto cf Used to present the visitor with relevant content advertisement. cip Presents the user with relevant content and advertisements, and facilitates real-time bidding for advertisers. cnac car callback criteo_write_test YSC VISITOR_INFO1_LIVE VISITOR_PRIVACY_METADATA _ttp ab Nezaradené do kategórie ck_flagpv Description is currently not available. visitor-id No description available. data-c-ts 1 mes data-c mv_tokens_eu-v1 am_tokens am_tokens_eu-v1 criteo tvid tv_UICR optout cto_tld_test XANDR_PANID gpp ttcsid_CU8M57RC77U66G5CN100 ttcsid __Secure-ROLLOUT_TOKEN Guardar mis preferencias Powered by X App Frecuento Descárgala Gratis Ver en App Arroz, Granos y Pastas Arroz El Charro Costa 100lb Marca: Charro Código - 40413115 Cantidad Pagar Realiza tus compras con seguridad Detalles del producto: Arroz El Charro Costa Calidad de exportación. | Contenido: 100lb.",Personalizar > 100lb,41.59,,,Desconocido,unknown,UNKNOWN,Valoramos tu privacidad,Personalizar,,100lb,41.59,,$,$41.59,41.59,False,original,41.59,41.59,1.0,default_1usd,,"incap_ses_* sesión opt_out gdpr Caducada _GRECAPTCHA 6 meses Un CAPTCHA te ayuda a protegerte del spam y del descifrado de contraseñas pidiéndote que completes una simple prueba que demuestre que eres humano y no un ordenador que intenta acceder a una cuenta protegida con contraseña. __cf_bm 1 hora rc::a Nunca caduca rc::c rc::f rc::b Funcionales SnapABugRef 2 horas SnapABugHistory SnapABugUserAlias SnapABugVisit Analíticas ___utmvc Menos de un minuto _gcl_au 3 meses _ga 1 año 1 mes 4 días _gid 1 día _gat_UA-* 1 minuto _ga_* uid 1 año 24 días _hjSessionUser_* _hjSession_* _fbp demdex _hjTLDTest Rendimiento Anuncio 15 minutos personalization_id muc_ads cto_bundle IDE uuid2 anj CMID CMPS CMPRO dpm mv_tokens 14 días 1 minuto cf Used to present the visitor with relevant content advertisement. cip Presents the user with relevant content and advertisements, and facilitates real-time bidding for advertisers. cnac car callback criteo_write_test YSC VISITOR_INFO1_LIVE VISITOR_PRIVACY_METADATA _ttp ab Nezaradené do kategórie ck_flagpv Description is currently not available. visitor-id No description available. data-c-ts 1 mes data-c mv_tokens_eu-v1 am_tokens am_tokens_eu-v1 criteo tvid tv_UICR optout cto_tld_test XANDR_PANID gpp ttcsid_CU8M57RC77U66G5CN100 ttcsid __Secure-ROLLOUT_TOKEN Guardar mis preferencias Powered by X App Frecuento Descárgala Gratis Ver en App Arroz, Granos y Pastas Arroz El Charro Costa 100lb Marca: Charro Código - 40413115 Cantidad Pagar Realiza tus compras con seguridad Detalles del producto: Arroz El Charro Costa",,,,Calidad de exportación. | Contenido: 100lb.,,"{""Descripción"": [""incap_ses_*"", ""sesión"", ""opt_out"", ""gdpr"", ""Caducada"", ""_GRECAPTCHA"", ""6 meses"", ""Un CAPTCHA te ayuda a protegerte del spam y del descifrado de contraseñas pidiéndote que completes una simple prueba que demuestre que eres humano y no un ordenador que intenta acceder a una cuenta protegida con contraseña."", ""__cf_bm"", ""1 hora"", ""rc::a"", ""Nunca caduca"", ""rc::c"", ""rc::f"", ""rc::b"", ""Funcionales"", ""SnapABugRef"", ""2 horas"", ""SnapABugHistory"", ""SnapABugUserAlias"", ""SnapABugVisit"", ""Analíticas"", ""___utmvc"", ""Menos de un minuto"", ""_gcl_au"", ""3 meses"", ""_ga"", ""1 año 1 mes 4 días"", ""_gid"", ""1 día"", ""_gat_UA-*"", ""1 minuto"", ""_ga_*"", ""uid"", ""1 año 24 días"", ""_hjSessionUser_*"", ""_hjSession_*"", ""_fbp"", ""demdex"", ""_hjTLDTest"", ""Rendimiento"", ""Anuncio"", ""15 minutos"", ""personalization_id"", ""muc_ads"", ""cto_bundle"", ""IDE"", ""uuid2"", ""anj"", ""CMID"", ""CMPS"", ""CMPRO"", ""dpm"", ""mv_tokens"", ""14 días 1 minuto"", ""cf"", ""Used to present the visitor with relevant content advertisement."", ""cip"", ""Presents the user with relevant content and advertisements, and facilitates real-time bidding for advertisers."", ""cnac"", ""car"", ""callback"", ""criteo_write_test"", ""YSC"", ""VISITOR_INFO1_LIVE"", ""VISITOR_PRIVACY_METADATA"", ""_ttp"", ""ab"", ""Nezaradené do kategórie"", ""ck_flagpv"", ""Description is currently not available."", ""visitor-id"", ""No description available."", ""data-c-ts"", ""1 mes"", ""data-c"", ""mv_tokens_eu-v1"", ""am_tokens"", ""am_tokens_eu-v1"", ""criteo"", ""tvid"", ""tv_UICR"", ""optout"", ""cto_tld_test"", ""XANDR_PANID"", ""gpp"", ""ttcsid_CU8M57RC77U66G5CN100"", ""ttcsid"", ""__Secure-ROLLOUT_TOKEN"", ""Guardar mis preferencias"", ""Powered by"", ""X"", ""App Frecuento"", ""Descárgala gratis"", ""Ver en App"", ""Arroz, Granos y Pastas"", ""Arroz El Charro Costa 100lb"", ""Marca: Charro"", ""Código - 40413115"", ""Cantidad"", ""Pagar"", ""Realiza tus compras"", ""con seguridad"", ""Detalles del producto: Arroz El Charro Costa""], ""Detalles"": [""Calidad de exportación."", ""Contenido: 100lb.""]}",dataset/txt_limpios/1303.txt,dataset/paginas_descargadas/1303.html,ET,arroz,keep,0.60,heuristic_default
1304,Valoramos tu privacidad,"incap_ses_* sesión opt_out gdpr Caducada _GRECAPTCHA 6 meses Un CAPTCHA te ayuda a protegerte del spam y del descifrado de contraseñas pidiéndote que completes una simple prueba que demuestre que eres humano y no un ordenador que intenta acceder a una cuenta protegida con contraseña. __cf_bm 1 hora rc::a Nunca caduca rc::c rc::f rc::b Funcionales SnapABugRef 2 horas SnapABugHistory SnapABugUserAlias SnapABugVisit Analíticas ___utmvc Menos de un minuto _gcl_au 3 meses _ga 1 año 1 mes 4 días _gid 1 día _gat_UA-* 1 minuto _ga_* uid 1 año 24 días _hjSessionUser_* _hjSession_* _fbp demdex _hjTLDTest Rendimiento Anuncio 15 minutos personalization_id muc_ads cto_bundle IDE uuid2 anj CMID CMPS CMPRO dpm mv_tokens 14 días 1 minuto cf Used to present the visitor with relevant content advertisement. cip Presents the user with relevant content and advertisements, and facilitates real-time bidding for advertisers. cnac car callback criteo_write_test YSC VISITOR_INFO1_LIVE VISITOR_PRIVACY_METADATA _ttp ab Nezaradené do kategórie ck_flagpv Description is currently not available. visitor-id No description available. data-c-ts 1 mes data-c mv_tokens_eu-v1 am_tokens am_tokens_eu-v1 criteo tvid tv_UICR optout cto_tld_test XANDR_PANID gpp ttcsid_CU8M57RC77U66G5CN100 ttcsid __Secure-ROLLOUT_TOKEN Guardar mis preferencias Powered by X App Frecuento Descárgala Gratis Ver en App Arroz, Granos y Pastas Arroz Flor Mi Comisariato 10Kg Marca: Mi Comisariato Código - 40269163 Cantidad Pagar Realiza tus compras con seguridad Detalles del producto: Arroz Flor Mi Comisariato Arroz pilado blanco | Contenido: 10kg",Personalizar > 10Kg,10.45,,,Desconocido,unknown,UNKNOWN,Valoramos tu privacidad,Personalizar,,10Kg,10.45,,$,$10.45,10.45,False,original,10.45,10.45,1.0,default_1usd,,"incap_ses_* sesión opt_out gdpr Caducada _GRECAPTCHA 6 meses Un CAPTCHA te ayuda a protegerte del spam y del descifrado de contraseñas pidiéndote que completes una simple prueba que demuestre que eres humano y no un ordenador que intenta acceder a una cuenta protegida con contraseña. __cf_bm 1 hora rc::a Nunca caduca rc::c rc::f rc::b Funcionales SnapABugRef 2 horas SnapABugHistory SnapABugUserAlias SnapABugVisit Analíticas ___utmvc Menos de un minuto _gcl_au 3 meses _ga 1 año 1 mes 4 días _gid 1 día _gat_UA-* 1 minuto _ga_* uid 1 año 24 días _hjSessionUser_* _hjSession_* _fbp demdex _hjTLDTest Rendimiento Anuncio 15 minutos personalization_id muc_ads cto_bundle IDE uuid2 anj CMID CMPS CMPRO dpm mv_tokens 14 días 1 minuto cf Used to present the visitor with relevant content advertisement. cip Presents the user with relevant content and advertisements, and facilitates real-time bidding for advertisers. cnac car callback criteo_write_test YSC VISITOR_INFO1_LIVE VISITOR_PRIVACY_METADATA _ttp ab Nezaradené do kategórie ck_flagpv Description is currently not available. visitor-id No description available. data-c-ts 1 mes data-c mv_tokens_eu-v1 am_tokens am_tokens_eu-v1 criteo tvid tv_UICR optout cto_tld_test XANDR_PANID gpp ttcsid_CU8M57RC77U66G5CN100 ttcsid __Secure-ROLLOUT_TOKEN Guardar mis preferencias Powered by X App Frecuento Descárgala Gratis Ver en App Arroz, Granos y Pastas Arroz Flor Mi Comisariato 10Kg Marca: Mi Comisariato Código - 40269163 Cantidad Pagar Realiza tus compras con seguridad Detalles del producto: Arroz Flor Mi Comisariato",,,,Arroz pilado blanco | Contenido: 10kg,,"{""Descripción"": [""incap_ses_*"", ""sesión"", ""opt_out"", ""gdpr"", ""Caducada"", ""_GRECAPTCHA"", ""6 meses"", ""Un CAPTCHA te ayuda a protegerte del spam y del descifrado de contraseñas pidiéndote que completes una simple prueba que demuestre que eres humano y no un ordenador que intenta acceder a una cuenta protegida con contraseña."", ""__cf_bm"", ""1 hora"", ""rc::a"", ""Nunca caduca"", ""rc::c"", ""rc::f"", ""rc::b"", ""Funcionales"", ""SnapABugRef"", ""2 horas"", ""SnapABugHistory"", ""SnapABugUserAlias"", ""SnapABugVisit"", ""Analíticas"", ""___utmvc"", ""Menos de un minuto"", ""_gcl_au"", ""3 meses"", ""_ga"", ""1 año 1 mes 4 días"", ""_gid"", ""1 día"", ""_gat_UA-*"", ""1 minuto"", ""_ga_*"", ""uid"", ""1 año 24 días"", ""_hjSessionUser_*"", ""_hjSession_*"", ""_fbp"", ""demdex"", ""_hjTLDTest"", ""Rendimiento"", ""Anuncio"", ""15 minutos"", ""personalization_id"", ""muc_ads"", ""cto_bundle"", ""IDE"", ""uuid2"", ""anj"", ""CMID"", ""CMPS"", ""CMPRO"", ""dpm"", ""mv_tokens"", ""14 días 1 minuto"", ""cf"", ""Used to present the visitor with relevant content advertisement."", ""cip"", ""Presents the user with relevant content and advertisements, and facilitates real-time bidding for advertisers."", ""cnac"", ""car"", ""callback"", ""criteo_write_test"", ""YSC"", ""VISITOR_INFO1_LIVE"", ""VISITOR_PRIVACY_METADATA"", ""_ttp"", ""ab"", ""Nezaradené do kategórie"", ""ck_flagpv"", ""Description is currently not available."", ""visitor-id"", ""No description available."", ""data-c-ts"", ""1 mes"", ""data-c"", ""mv_tokens_eu-v1"", ""am_tokens"", ""am_tokens_eu-v1"", ""criteo"", ""tvid"", ""tv_UICR"", ""optout"", ""cto_tld_test"", ""XANDR_PANID"", ""gpp"", ""ttcsid_CU8M57RC77U66G5CN100"", ""ttcsid"", ""__Secure-ROLLOUT_TOKEN"", ""Guardar mis preferencias"", ""Powered by"", ""X"", ""App Frecuento"", ""Descárgala gratis"", ""Ver en App"", ""Arroz, Granos y Pastas"", ""Arroz Flor Mi Comisariato 10Kg"", ""Marca: Mi Comisariato"", ""Código - 40269163"", ""Cantidad"", ""Pagar"", ""Realiza tus compras"", ""con seguridad"", ""Detalles del producto: Arroz Flor Mi Comisariato""], ""Detalles"": [""Arroz pilado blanco"", ""Contenido: 10kg""]}",dataset/txt_limpios/1304.txt,dataset/paginas_descargadas/1304.html,ET,arroz,keep,0.60,heuristic_default
1305,Valoramos tu privacidad,"incap_ses_* sesión opt_out gdpr Caducada _GRECAPTCHA 6 meses Un CAPTCHA te ayuda a protegerte del spam y del descifrado de contraseñas pidiéndote que completes una simple prueba que demuestre que eres humano y no un ordenador que intenta acceder a una cuenta protegida con contraseña. __cf_bm 1 hora rc::a Nunca caduca rc::c rc::f rc::b Funcionales SnapABugRef 2 horas SnapABugHistory SnapABugUserAlias SnapABugVisit Analíticas ___utmvc Menos de un minuto _gcl_au 3 meses _ga 1 año 1 mes 4 días _gid 1 día _gat_UA-* 1 minuto _ga_* uid 1 año 24 días _hjSessionUser_* _hjSession_* _fbp demdex _hjTLDTest Rendimiento Anuncio 15 minutos personalization_id muc_ads cto_bundle IDE uuid2 anj CMID CMPS CMPRO dpm mv_tokens 14 días 1 minuto cf Used to present the visitor with relevant content advertisement. cip Presents the user with relevant content and advertisements, and facilitates real-time bidding for advertisers. cnac car callback criteo_write_test YSC VISITOR_INFO1_LIVE VISITOR_PRIVACY_METADATA _ttp ab Nezaradené do kategórie ck_flagpv Description is currently not available. visitor-id No description available. data-c-ts 1 mes data-c mv_tokens_eu-v1 am_tokens am_tokens_eu-v1 criteo tvid tv_UICR optout cto_tld_test XANDR_PANID gpp ttcsid_CU8M57RC77U66G5CN100 ttcsid __Secure-ROLLOUT_TOKEN Guardar mis preferencias Powered by X App Frecuento Descárgala Gratis Ver en App Arroz, Granos y Pastas Arroz Calidad Solo Arroz 5kg Marca: Solo arroz Código - 40010239 Cantidad Pagar Realiza tus compras con seguridad Detalles del producto: Arroz Calidad Solo Arroz Arroz blanco | Excelente calidad y rendidor | Contenido: 5kg",Personalizar > 5kg,5.66,,,Desconocido,unknown,UNKNOWN,Valoramos tu privacidad,Personalizar,,5kg,5.66,,$,$5.66,5.66,False,original,5.66,5.66,1.0,default_1usd,,"incap_ses_* sesión opt_out gdpr Caducada _GRECAPTCHA 6 meses Un CAPTCHA te ayuda a protegerte del spam y del descifrado de contraseñas pidiéndote que completes una simple prueba que demuestre que eres humano y no un ordenador que intenta acceder a una cuenta protegida con contraseña. __cf_bm 1 hora rc::a Nunca caduca rc::c rc::f rc::b Funcionales SnapABugRef 2 horas SnapABugHistory SnapABugUserAlias SnapABugVisit Analíticas ___utmvc Menos de un minuto _gcl_au 3 meses _ga 1 año 1 mes 4 días _gid 1 día _gat_UA-* 1 minuto _ga_* uid 1 año 24 días _hjSessionUser_* _hjSession_* _fbp demdex _hjTLDTest Rendimiento Anuncio 15 minutos personalization_id muc_ads cto_bundle IDE uuid2 anj CMID CMPS CMPRO dpm mv_tokens 14 días 1 minuto cf Used to present the visitor with relevant content advertisement. cip Presents the user with relevant content and advertisements, and facilitates real-time bidding for advertisers. cnac car callback criteo_write_test YSC VISITOR_INFO1_LIVE VISITOR_PRIVACY_METADATA _ttp ab Nezaradené do kategórie ck_flagpv Description is currently not available. visitor-id No description available. data-c-ts 1 mes data-c mv_tokens_eu-v1 am_tokens am_tokens_eu-v1 criteo tvid tv_UICR optout cto_tld_test XANDR_PANID gpp ttcsid_CU8M57RC77U66G5CN100 ttcsid __Secure-ROLLOUT_TOKEN Guardar mis preferencias Powered by X App Frecuento Descárgala Gratis Ver en App Arroz, Granos y Pastas Arroz Calidad Solo Arroz 5kg Marca: Solo arroz Código - 40010239 Cantidad Pagar Realiza tus compras con seguridad Detalles del producto: Arroz Calidad Solo Arroz",,,,Arroz blanco | Excelente calidad y rendidor | Contenido: 5kg,,"{""Descripción"": [""incap_ses_*"", ""sesión"", ""opt_out"", ""gdpr"", ""Caducada"", ""_GRECAPTCHA"", ""6 meses"", ""Un CAPTCHA te ayuda a protegerte del spam y del descifrado de contraseñas pidiéndote que completes una simple prueba que demuestre que eres humano y no un ordenador que intenta acceder a una cuenta protegida con contraseña."", ""__cf_bm"", ""1 hora"", ""rc::a"", ""Nunca caduca"", ""rc::c"", ""rc::f"", ""rc::b"", ""Funcionales"", ""SnapABugRef"", ""2 horas"", ""SnapABugHistory"", ""SnapABugUserAlias"", ""SnapABugVisit"", ""Analíticas"", ""___utmvc"", ""Menos de un minuto"", ""_gcl_au"", ""3 meses"", ""_ga"", ""1 año 1 mes 4 días"", ""_gid"", ""1 día"", ""_gat_UA-*"", ""1 minuto"", ""_ga_*"", ""uid"", ""1 año 24 días"", ""_hjSessionUser_*"", ""_hjSession_*"", ""_fbp"", ""demdex"", ""_hjTLDTest"", ""Rendimiento"", ""Anuncio"", ""15 minutos"", ""personalization_id"", ""muc_ads"", ""cto_bundle"", ""IDE"", ""uuid2"", ""anj"", ""CMID"", ""CMPS"", ""CMPRO"", ""dpm"", ""mv_tokens"", ""14 días 1 minuto"", ""cf"", ""Used to present the visitor with relevant content advertisement."", ""cip"", ""Presents the user with relevant content and advertisements, and facilitates real-time bidding for advertisers."", ""cnac"", ""car"", ""callback"", ""criteo_write_test"", ""YSC"", ""VISITOR_INFO1_LIVE"", ""VISITOR_PRIVACY_METADATA"", ""_ttp"", ""ab"", ""Nezaradené do kategórie"", ""ck_flagpv"", ""Description is currently not available."", ""visitor-id"", ""No description available."", ""data-c-ts"", ""1 mes"", ""data-c"", ""mv_tokens_eu-v1"", ""am_tokens"", ""am_tokens_eu-v1"", ""criteo"", ""tvid"", ""tv_UICR"", ""optout"", ""cto_tld_test"", ""XANDR_PANID"", ""gpp"", ""ttcsid_CU8M57RC77U66G5CN100"", ""ttcsid"", ""__Secure-ROLLOUT_TOKEN"", ""Guardar mis preferencias"", ""Powered by"", ""X"", ""App Frecuento"", ""Descárgala gratis"", ""Ver en App"", ""Arroz, Granos y Pastas"", ""Arroz Calidad Solo Arroz 5kg"", ""Marca: Solo arroz"", ""Código - 40010239"", ""Cantidad"", ""Pagar"", ""Realiza tus compras"", ""con seguridad"", ""Detalles del producto: Arroz Calidad Solo Arroz""], ""Detalles"": [""Arroz blanco"", ""Excelente calidad y rendidor"", ""Contenido: 5kg""]}",dataset/txt_limpios/1305.txt,dataset/paginas_descargadas/1305.html,ET,arroz,keep,0.60,heuristic_default
