{"source_id": "1161", "title": "Centro de preferencia de la privacidad", "description": "", "breadcrumbs": "Activas siempre > 190g", "price_raw": "", "currency_raw": "PEN", "url": "", "seller": "Desconocido", "availability": "unknown", "country": "PE", "product_name": "Centro de preferencia de la privacidad", "brand": "Activas siempre", "reference": "", "unit": "190g", "price_amount": null, "price_currency": "PEN", "price_symbol": "", "price_text": "", "price_amount_filled": "55.14", "price_is_imputed": "True", "price_imputation_source": "country_mean", "price_amount_usd": "", "price_amount_usd_filled": "15.5336", "fx_rate_local_per_usd": "3.55", "fx_source": "from_peru_cambio_dolar", "information_text": "", "description_text": "", "features_text": "TE RECOMENDAMOS | Café Instantáneo NESCAFÉ Kirma Doypack 140g | 22 | 90 | CAFETAL | Café Instántaneo Intenso CAFETAL Frasco 180g | 32 | -26% | NESCAFÉ | Café Instantáneo NESCAFÉ Tradición Doypack 150g | 30 | 50 | 26% | JACOBS | Café Liofilizado JACOBS Gold Suave Frasco 200g | 44 | Café NESCAFÉ Gold Cappuccino Caja 8un | 21 | NESCAFE | Café Instantáneo NESCAFÉ Vienés Caja 144g | JUAN VALDEZ | Café Liofilizado JUAN VALDEZ Regular Frasco 95g | 35 | 60 | Café NESCAFE Descafeinado Frasco 170g | 41 | Café Instantáneo NESCAFÉ Tradición Doypack 45g | 9 | Café Instantáneo NESCAFÉ Tradición Doypack 140g | 28 | ¡Entérate de eventos exclusivos y promociones especiales que tenemos para ti! | SUSCRIBIRME | Acepto las políticas de tratamientos de datos personales | Razón Social: Compañía Food Retail S.A.C. RUC: 20608300393. Todos los derechos reservados Vivanda 2023. | | Hola! | Encuentra todo lo que necesitas en Vivanda online | Términos más buscados | 1. | quesos | 2. | vino | 3. | café | 4. | quark 500g | 5. | leche | 6. | pollo | 7. | yogurt | 8. | lunch florencia | 9. | agua | 10 | vinos", "specifications_text": "", "benefits_text": "", "details_text": "", "other_sections": "", "sections": {"Características": ["TE RECOMENDAMOS", "Café Instantáneo NESCAFÉ Kirma Doypack 140g", "22", "90", "CAFETAL", "Café Instántaneo Intenso CAFETAL Vial 180g", "32", "-26%", "NESCAFÉ", "Café Instantáneo NESCAFÉ Tradición Doypack 150g", "30", "50", "26%", "JACOBS", "Café Liofilizado JACOBS Gold Suave Frasco 200g", "44", "Café NESCAFÉ Gold Cappuccino Caja 8un", "21", "NESCAFE", "Café Instantáneo NESCAFÉ Vienés Caja 144g", "JUAN VALDEZ", "Café Liofilizado JUAN VALDEZ Regular Frasco 95g", "35", "60", "Café NESCAFE Descafeinado Frasco 170g", "41", "Café Instantáneo NESCAFÉ Tradición Doypack 45g", "9", "Café Instantáneo NESCAFÉ Tradición Doypack 140g", "28", "¡Entérate de eventos exclusivos y promociones especiales que tenemos para ti!", "SUSCRIBIRME", "Acepto las políticas de tratamiento de datos personales", "Razón social: Compañía Food Retail S.A.C. RUC: 20608300393. Todos los derechos reservados Vivanda 2023.", "¡Hola!", "Encuentra todo lo que necesitas en Vivanda online", "Términos más buscados", "1.", "quesos", "2.", "vino", "3.", "cafe", "4.", "quark 500g", "5.", "leche", "6.", "pollo", "7.", "yogurt", "8.", "lunch florencia", "9.", "agua", "10.", "vinos"]}, "txt_path": "dataset/txt_limpios/1161.txt", "html_path": "dataset/paginas_descargadas/1161.html", "es_status": "ET", "category_canonical": "sin_categoria", "decision": "discard", "match_score": 0.3, "reasons": "no_category_detected;price_parse_failed"}
{"source_id": "1162", "title": "Centro de preferencia de la privacidad", "description": "", "breadcrumbs": "Activas siempre > 200g", "price_raw": "", "currency_raw": "PEN", "url": "", "seller": "Desconocido", "availability": "unknown", "country": "PE", "product_name": "Centro de preferencia de la privacidad", "brand": "Activas siempre", "reference": "", "unit": "200g", "price_amount": null, "price_currency": "PEN", "price_symbol": "", "price_text": "", "price_amount_filled": "55.14", "price_is_imputed": "True", "price_imputation_source": "country_mean", "price_amount_usd": "", "price_amount_usd_filled": "15.5336", "fx_rate_local_per_usd": "3.55", "fx_source": "from_peru_cambio_dolar", "information_text": "", "description_text": "", "features_text": "TE RECOMENDAMOS | ALTOMAYO | Café Instantáneo ALTOMAYO Liofilizado Frasco 170g | 51 | 30 | NESCAFÉ | Café Instantáneo NESCAFÉ Tradición Doypack 250g | 42 | Café Instantáneo NESCAFÉ Tradición Frasco 170g | JUAN VALDEZ | Café Liofilizado JUAN VALDEZ Regular Frasco 50g | 21 | Café Liofilizado JACOBS Gold Suave Frasco 200g | KIRMA | Café KIRMA Doypack 150g | En el disponible | Café Instántaneo Gourmet ALTOMAYO Doypack 150g | 31 | Café NESCAFÉ Gold Signature Frasco 190g | 46 | 80 | Café Instantáneo Granulado NESCAFE Doypack 90g | 25 | BELL'S | Café Instantáneo BELL'S Granulado Frasco 200g | 22 | | Entérate de eventos exclusivos y promociones especiales que tenemos para ti! | SUSCRIBIRME | Acepto las políticas de tratamientos de datos personales | Razón Social: Compañía Food Retail S.A.C. RUC: 20608300393. Todos los derechos reservados Vivanda 2023. | | Hola! | Encuentra todo lo que necesitas en Vivanda online | Términos más buscados | 1. | quesos | 2. | vino | 3. | café | 4. | quark 500g | 5. | leche | 6. | pollo | 7. | yogurt | 8. | lunch florencia | 9. | agua | 10 | vinos", "specifications_text": "", "benefits_text": "", "details_text": "", "other_sections": "", "sections": {"Características": ["TE RECOMENDAMOS", "ALTOMAYO", "Café Instantáneo ALTOMAYO Liofilizado Frasco 170g", "51", "30", "NESCAFÉ", "Café Instantáneo NESCAFÉ Tradición Doypack 250g", "42", "Café Instantáneo NESCAFÉ Tradición Frasco 170g", "JUAN VALDEZ", "Café Liofilizado JUAN VALDEZ Regular Frasco 50g", "21", "Café Liofilizado JACOBS Gold Suave Frasco 200g", "KIRMA", "Café KIRMA Doypack 150g", "No disponible", "Café Instántaneo Gourmet ALTOMAYO Doypack 150g", "31", "Café NESCAFÉ Gold Signature Frasco 190g", "46", "80", "Café Instantáneo Granulado NESCAFE Doypack 90g", "25", "BELL'S", "Café Instantáneo BELL'S Granulado Frasco 200g", "22", "¡Entérate de eventos exclusivos y promociones especiales que tenemos para ti!", "SUSCRIBIRME", "Acepto las políticas de tratamiento de datos personales", "Razón social: Compañía Food Retail S.A.C. RUC: 20608300393. Todos los derechos reservados Vivanda 2023.", "¡Hola!", "Encuentra todo lo que necesitas en Vivanda online", "Términos más buscados", "1.", "quesos", "2.", "vino", "3.", "cafe", "4.", "quark 500g", "5.", "leche", "6.", "pollo", "7.", "yogurt", "8.", "lunch florencia", "9.", "agua", "10.", "vinos"]}, "txt_path": "dataset/txt_limpios/1162.txt", "html_path": "dataset/paginas_descargadas/1162.html", "es_status": "ET", "category_canonical": "sin_categoria", "decision": "discard", "match_score": 0.3, "reasons": "no_category_detected;price_parse_failed"}
{"source_id": "1163", "title": "Centro de preferencia de la privacidad", "description": "", "breadcrumbs": "Activas siempre > 170g", "price_raw": "", "currency_raw": "PEN", "url": "", "seller": "Desconocido", "availability": "unknown", "country": "PE", "product_name": "Centro de preferencia de la privacidad", "brand": "Activas siempre", "reference": "", "unit": "170g", "price_amount": null, "price_currency": "PEN", "price_symbol": "", "price_text": "", "price_amount_filled": "55.14", "price_is_imputed": "True", "price_imputation_source": "country_mean", "price_amount_usd": "", "price_amount_usd_filled": "15.5336", "fx_rate_local_per_usd": "3.55", "fx_source": "from_peru_cambio_dolar", "information_text": "", "description_text": "", "features_text": "TE RECOMENDAMOS | Café Instantáneo ALTOMAYO Descafeinado Frasco 170g | 42 | 70 | Café Instántaneo Gourmet ALTOMAYO Doypack 90g | 21 | Café Instántaneo Clásico ALTOMAYO Doypack 150g | 27 | 40 | NESCAFÉ | Café Instantáneo NESCAFÉ Tradición Doypack 250g | JUAN VALDEZ | Café Liofilizado JUAN VALDEZ Regular Frasco 50g | NESCAFE | Café Instantáneo NESCAFÉ Tradición Frasco 50g | No disponible | Café Liofilizado JUAN VALDEZ Regular Frasco 95g | 35 | -7% | Café NESCAFE Descafeinado Frasco 170g | 41 | MARISCAL | Café Instantáneo MARISCAL Frasco 170g | 29 | ¡Entérate de eventos exclusivos y promociones especiales que tenemos para ti! | SUSCRIBIRME | Acepto las políticas de tratamientos de datos personales | Razón Social: Compañía Food Retail S.A.C. RUC: 20608300393. Todos los derechos reservados Vivanda 2023. | | Hola! | Encuentra todo lo que necesitas en Vivanda online | Términos más buscados | 1. | quesos | 2. | vino | 3. | café | 4. | quark 500g | 5. | leche | 6. | pollo | 7. | yogurt | 8. | lunch florencia | 9. | agua | 10 | vinos", "specifications_text": "", "benefits_text": "", "details_text": "", "other_sections": "", "sections": {"Características": ["TE RECOMENDAMOS", "Café Instantáneo ALTOMAYO Descafeinado Frasco 170g", "42", "70", "Café Instántaneo Gourmet ALTOMAYO Doypack 90g", "21", "Café Instántaneo Clásico ALTOMAYO Doypack 150g", "27", "40", "NESCAFÉ", "Café Instantáneo NESCAFÉ Tradición Doypack 250g", "JUAN VALDEZ", "Café Liofilizado JUAN VALDEZ Regular Frasco 50g", "NESCAFE", "Café Instantáneo NESCAFÉ Tradición Frasco 50g", "No disponible", "Café Liofilizado JUAN VALDEZ Regular Frasco 95g", "35", "-7%", "Café NESCAFE Descafeinado Frasco 170g", "41", "MARISCAL", "Café Instantáneo MARISCAL Frasco 170g", "29", "¡Entérate de eventos exclusivos y promociones especiales que tenemos para ti!", "SUSCRIBIRME", "Acepto las políticas de tratamiento de datos personales", "Razón social: Compañía Food Retail S.A.C. RUC: 20608300393. Todos los derechos reservados Vivanda 2023.", "¡Hola!", "Encuentra todo lo que necesitas en Vivanda online", "Términos más buscados", "1.", "quesos", "2.", "vino", "3.", "cafe", "4.", "quark 500g", "5.", "leche", "6.", "pollo", "7.", "yogurt", "8.", "lunch florencia", "9.", "agua", "10.", "vinos"]}, "txt_path": "dataset/txt_limpios/1163.txt", "html_path": "dataset/paginas_descargadas/1163.html", "es_status": "ET", "category_canonical": "sin_categoria", "decision": "discard", "match_score": 0.3, "reasons": "no_category_detected;price_parse_failed"}
{"source_id": "1164", "title": "Centro de preferencia de la privacidad", "description": "", "breadcrumbs": "Activas siempre > 850g", "price_raw": "", "currency_raw": "PEN", "url": "", "seller": "Desconocido", "availability": "unknown", "country": "PE", "product_name": "Centro de preferencia de la privacidad", "brand": "Activas siempre", "reference": "", "unit": "850g", "price_amount": null, "price_currency": "PEN", "price_symbol": "", "price_text": "", "price_amount_filled": "55.14", "price_is_imputed": "True", "price_imputation_source": "country_mean", "price_amount_usd": "", "price_amount_usd_filled": "15.5336", "fx_rate_local_per_usd": "3.55", "fx_source": "from_peru_cambio_dolar", "information_text": "", "description_text": "", "features_text": "TE RECOMENDAMOS | JUAN VALDEZ | Café Molido JUAN VALDEZ Cumbre Bolsa 250g | 38 | 70 | ALTOMAYO | Café Tostado Molido ALTOMAYO Gourmet Bolsa 450g | 50 | MOUNTAIN VRICA | Café Molido VILLA RICA Extra Bolsa 220g | 24 | VILLA RICA | Café Molido VILLA RICA Gourmet Bolsa 250g | 40 | 20 | ZENA | Café Molido ZENA Descafeinado Doypack 250g | 39 | Café Tostado Molido ALTOMAYO Natural Doypack 200g | 16 | Café Molido Molido JUAN VALDEZ Orgánico Bolsa 283g | 44 | 30 | -9% | CAFETAL | Café Tostado y Molido CAFETAL Selecto Bolsa 200g | 15 | 9% | BELL'S | Café Tostado Molido BELL'S Bolsa 220g | Café Gourmet Americano CAFETAL Bolsa 450g | ¡Entérate de eventos exclusivos y promociones especiales que tenemos para ti! | SUSCRIBIRME | Acepto las políticas de tratamientos de datos personales | Razón Social: Compañía Food Retail S.A.C. RUC: 20608300393. Todos los derechos reservados Vivanda 2023. | | Hola! | Encuentra todo lo que necesitas en Vivanda online | Términos más buscados | 1. | quesos | 2. | vino | 3. | café | 4. | quark 500g | 5. | leche | 6. | pollo | 7. | yogurt | 8. | lunch florencia | 9. | agua | 10 | vinos", "specifications_text": "", "benefits_text": "", "details_text": "", "other_sections": "", "sections": {"Características": ["TE RECOMENDAMOS", "JUAN VALDEZ", "Café Molido JUAN VALDEZ Cumbre Bolsa 250g", "38", "70", "ALTOMAYO", "Café Tostado Molido ALTOMAYO Gourmet Bolsa 450g", "50", "MOUNTAIN VRICA", "Café Molido VILLA RICA Extra Bolsa 220g", "24", "VILLA RICA", "Café Molido VILLA RICA Gourmet Bolsa 250g", "40", "20", "ZENA", "Café Molido ZENA Descafeinado Doypack 250g", "39", "Café Tostado Molido ALTOMAYO Natural Doypack 200g", "16", "10", "Café Molido JUAN VALDEZ Orgánico Bolsa 283g", "44", "30", "-9%", "CAFETAL", "Café Tostado y Molido CAFETAL Selecto Bolsa 200g", "15", "9%", "BELL'S", "Café Tostado Molido BELL'S Bolsa 220g", "Café Gourmet Americano CAFETAL Bolsa 450g", "¡Entérate de eventos exclusivos y promociones especiales que tenemos para ti!", "SUSCRIBIRME", "Acepto las políticas de tratamiento de datos personales", "Razón social: Compañía Food Retail S.A.C. RUC: 20608300393. Todos los derechos reservados Vivanda 2023.", "¡Hola!", "Encuentra todo lo que necesitas en Vivanda online", "Términos más buscados", "1.", "quesos", "2.", "vino", "3.", "cafe", "4.", "quark 500g", "5.", "leche", "6.", "pollo", "7.", "yogurt", "8.", "lunch florencia", "9.", "agua", "10.", "vinos"]}, "txt_path": "dataset/txt_limpios/1164.txt", "html_path": "dataset/paginas_descargadas/1164.html", "es_status": "ET", "category_canonical": "sin_categoria", "decision": "discard", "match_score": 0.3, "reasons": "no_category_detected;price_parse_failed"}
{"source_id": "1165", "title": "Centro de preferencia de la privacidad", "description": "", "breadcrumbs": "Activas siempre > 900ml", "price_raw": "", "currency_raw": "PEN", "url": "", "seller": "Desconocido", "availability": "unknown", "country": "PE", "product_name": "Centro de preferencia de la privacidad", "brand": "Activas siempre", "reference": "", "unit": "900ml", "price_amount": null, "price_currency": "PEN", "price_symbol": "", "price_text": "", "price_amount_filled": "55.14", "price_is_imputed": "True", "price_imputation_source": "country_mean", "price_amount_usd": "", "price_amount_usd_filled": "15.5336", "fx_rate_local_per_usd": "3.55", "fx_source": "from_peru_cambio_dolar", "information_text": "", "description_text": "", "features_text": "TE RECOMENDAMOS | BELL'S | Aceite de Canola BELL'S Spray 150ml | 14 | -15% | COCINERO | Aceite Vegetal COCINERO Botella 900ml | 8 | 60 | 15% | Aceite Vegetal PRIMOR Clásico Botella 1.8L | 19 | 80 | 16 | 18% | BASSO | Aceite de Maíz BASSO Botella 1L | 13 | SoyA | Aceite de Soya SOYA Botella 900ml | 6 | 30 | Aceite de Soya BELL'S Botella 900ml | WESSON | Aceite de Soya SAO Botella 900ml | 10 | Aceite Vegetal PRIMOR Clásico Botella 900ml | | Entérate de eventos exclusivos y promociones especiales que tenemos para ti! | SUSCRIBIRME | Acepto las políticas de tratamientos de datos personales | Razón Social: Compañía Food Retail S.A.C. RUC: 20608300393. Todos los derechos reservados Vivanda 2023. | | Hola! | Encuentra todo lo que necesitas en Vivanda online | Términos más buscados | 1. | quesos | 2. | vino | 3. | café | 4. | quark 500g | 5. | leche | 6. | pollo | 7. | yogurt | 8. | lunch florencia | 9. | agua | 10 | vinos", "specifications_text": "", "benefits_text": "", "details_text": "", "other_sections": "", "sections": {"Características": ["TE RECOMENDAMOS", "BELL'S", "Aceite de Canola BELL'S Spray 150ml", "14", "-15%", "COCINERO", "Aceite Vegetal COCINERO Botella 900ml", "8", "90", "7", "60", "15%", "-18%", "Aceite vegetal PRIMOR Clásico Botella 1.8L", "19", "80", "16", "18%", "BASSO", "Aceite de Maíz BASSO Botella 1L", "13", "SOYA", "Aceite de Soya SOYA Botella 900ml", "6", "30", "Aceite de Soya BELL'S Botella 900ml", "WESSON", "Aceite Vegetal WESSON Canola Botella 1.18L", "39", "50", "SAO", "Aceite de Soya SAO Botella 900ml", "10", "Aceite vegetal PRIMOR Clásico Botella 900ml", "¡Entérate de eventos exclusivos y promociones especiales que tenemos para ti!", "SUSCRIBIRME", "Acepto las políticas de tratamiento de datos personales", "Razón social: Compañía Food Retail S.A.C. RUC: 20608300393. Todos los derechos reservados Vivanda 2023.", "¡Hola!", "Encuentra todo lo que necesitas en Vivanda online", "Términos más buscados", "1.", "quesos", "2.", "vino", "3.", "cafe", "4.", "quark 500g", "5.", "leche", "6.", "pollo", "7.", "yogurt", "8.", "lunch florencia", "9.", "agua", "10.", "vinos"]}, "txt_path": "dataset/txt_limpios/1165.txt", "html_path": "dataset/paginas_descargadas/1165.html", "es_status": "ET", "category_canonical": "sin_categoria", "decision": "discard", "match_score": 0.3, "reasons": "no_category_detected;price_parse_failed"}
{"source_id": "1166", "title": "Centro de preferencia de la privacidad", "description": "", "breadcrumbs": "Activas siempre > 500ml", "price_raw": "", "currency_raw": "PEN", "url": "", "seller": "Desconocido", "availability": "unknown", "country": "PE", "product_name": "Centro de preferencia de la privacidad", "brand": "Activas siempre", "reference": "", "unit": "500ml", "price_amount": null, "price_currency": "PEN", "price_symbol": "", "price_text": "", "price_amount_filled": "55.14", "price_is_imputed": "True", "price_imputation_source": "country_mean", "price_amount_usd": "", "price_amount_usd_filled": "15.5336", "fx_rate_local_per_usd": "3.55", "fx_source": "from_peru_cambio_dolar", "information_text": "", "description_text": "", "features_text": "TE RECOMENDAMOS | BELL'S | Aceite de Oliva BELL'S Puro Botella 500ml | 30 | 50 | -2% | ACAVILLE | Aceite de Oliva ACAVILLE Extra Virgen Gourmet Botella 250ml | 22 | 21 | 90 | 2% | HUERTO ALAMEIN | Aceite de Oliva HUERTO ALAMEIN Extra Virgen Botella 500ml | 39 | VALDEPORRES | Aceite de Oliva VALDEPORRES Virgen Botella 1L | 61 | 10 | Aceite de Oliva VALDEPORRES Suave Botella 1L | EL CORTE INGLÉS | Aceite de Oliva Virgen EL CORTE INGLÉS Extra Ecológico Botella 500ml | En el disponible | OLIVOS DEL SUR | Aceite de Oliva OLIVOS DEL SUR Extra Virgen Kids Botella 250ml | 42 | 80 | -12% | GATTI | Aceite de Oliva GATTI Extra Virgen Botella 500ml | 43 | 70 | 12% | Aceite de Oliva EL OLIVAR Extra Virgen Botella 1L | 86 | -27% | Aceite de Oliva OLIVOS DEL SUR Extra Virgen Botella 500ml | 48 | 27% | | Entérate de eventos exclusivos y promociones especiales que tenemos para ti! | SUSCRIBIRME | Acepto las políticas de tratamientos de datos personales | Razón Social: Compañía Food Retail S.A.C. RUC: 20608300393. Todos los derechos reservados Vivanda 2023. | | Hola! | Encuentra todo lo que necesitas en Vivanda online | Términos más buscados | 1. | quesos | 2. | vino | 3. | café | 4. | quark 500g | 5. | leche | 6. | pollo | 7. | yogurt | 8. | lunch florencia | 9. | agua | 10 | vinos", "specifications_text": "", "benefits_text": "", "details_text": "", "other_sections": "", "sections": {"Características": ["TE RECOMENDAMOS", "BELL'S", "Aceite de Oliva BELL'S Puro Botella 500ml", "30", "50", "-2%", "ACAVILLE", "Aceite de Oliva ACAVILLE Extra Virgen Gourmet Botella 250ml", "22", "21", "90", "2%", "HUERTO ALAMEIN", "Aceite de Oliva HUERTO ALAMEIN Extra Virgen Botella 500ml", "39", "VALDEPORRES", "Aceite de Oliva VALDEPORRES Virgen Botella 1L", "61", "10", "Aceite de Oliva VALDEPORRES Suave Botella 1L", "EL CORTE INGLÉS", "Aceite de Oliva Virgen EL CORTE INGLÉS Extra Ecológico Botella 500ml", "No disponible", "OLIVOS DEL SUR", "Aceite de Oliva OLIVOS DEL SUR Extra Virgen Kids Botella 250ml", "42", "80", "-12%", "GATTI", "Aceite de Oliva GATTI Extra Virgen Botella 500ml", "43", "70", "12%", "Aceite de Oliva EL OLIVAR Extra Virgen Botella 1L", "86", "-27%", "Aceite de Oliva OLIVOS DEL SUR Extra Virgen Botella 500ml", "48", "35", "27%", "¡Entérate de eventos exclusivos y promociones especiales que tenemos para ti!", "SUSCRIBIRME", "Acepto las políticas de tratamiento de datos personales", "Razón social: Compañía Food Retail S.A.C. RUC: 20608300393. Todos los derechos reservados Vivanda 2023.", "¡Hola!", "Encuentra todo lo que necesitas en Vivanda online", "Términos más buscados", "1.", "quesos", "2.", "vino", "3.", "cafe", "4.", "quark 500g", "5.", "leche", "6.", "pollo", "7.", "yogurt", "8.", "lunch florencia", "9.", "agua", "10.", "vinos"]}, "txt_path": "dataset/txt_limpios/1166.txt", "html_path": "dataset/paginas_descargadas/1166.html", "es_status": "ET", "category_canonical": "sin_categoria", "decision": "discard", "match_score": 0.3, "reasons": "no_category_detected;price_parse_failed"}
