{"source_id": "27", "title": "Cafe y te", "description": "Creamos una nueva experiencia para que las personas puedan disfrutar una taza de café, en la que perciban su aroma, sus componentes, texturas y sabores. Su sabor te inducirá a disfrutarlo por más tiempo, y buscar cualquier excusa para seguir deleitándote. Disfruta de la armonía que se de la entre el sabor y la sensación de degustar el café de forma diferente, va a hacer que quieras revivir la experiencia una y otra vez. Café Garat es el resultado de una cuidadosa selección de granos gourmet de las principales regiones cafetaleras de México: Chiapas, Veracruz y Oaxaca. Su nivel de tueste y molido hacen de este un café con el balance ideal de aroma, sabor y cuerpo, características que lo hacen único. Con el tostado y molido regular en su presentación estadounidense obtendrás eso que necesitas para disfrutar y compartir tu día. Adquiérelo en su presentación de 360g y con su bolsa resellable podrás guardar toda la frescura de Garat, como si recién lo hubieras abierto por primera vez.", "breadcrumbs": "Garat > 340g > 3019146", "price_raw": "150.0", "currency_raw": "MXN", "url": "", "seller": "Chedraui", "availability": "unknown", "country": "MX", "product_name": "Cafe y te", "brand": "Garat", "reference": "3019146.0", "unit": "340g", "price_amount": 150.0, "price_currency": "MXN", "price_symbol": "$", "price_text": "$150.00", "price_amount_filled": "150.0", "price_is_imputed": "False", "price_imputation_source": "original", "price_amount_usd": "8.0559", "price_amount_usd_filled": "8.0559", "fx_rate_local_per_usd": "18.62", "fx_source": "from_mexico_cambio_dolar", "information_text": "Creamos una nueva experiencia para que las personas puedan disfrutar una taza de café, en la que perciban su aroma, sus componentes, texturas y sabores. Su sabor te inducirá a disfrutarlo por más tiempo, y buscar cualquier excusa para seguir deleitándote. Disfruta de la armonía que se de la entre el sabor y la sensación de degustar el café de forma diferente, va a hacer que quieras revivir la experiencia una y otra vez.", "description_text": "", "features_text": "Bolsa Resellable | Kosher", "specifications_text": "Café Garat es el resultado de una cuidadosa selección de granos gourmet de las principales regiones cafetaleras de México: Chiapas, Veracruz y Oaxaca. Su nivel de tueste y molido hacen de este un café con el balance ideal de aroma, sabor y cuerpo, características que lo hacen único. Con el tostado y molido regular en su presentación estadounidense obtendrás eso que necesitas para disfrutar y compartir tu día. Adquiérelo en su presentación de 360g y con su bolsa resellable podrás guardar toda la frescura de Garat, como si recién lo hubieras abierto por primera vez.", "benefits_text": "", "details_text": "", "other_sections": "", "sections": {"Información": ["Creamos una nueva experiencia para que las personas puedan disfrutar una taza de café, en la que perciban su aroma, sus componentes, texturas y sabores. Su sabor te inducirá a disfrutarlo por más tiempo, y buscar cualquier excusa para seguir deleitándote. Disfruta de la armonía que se de la entre el sabor y la sensación de degustar el café de forma diferente, va a hacer que quieras revivir la experiencia una y otra vez."], "Características": ["Bolsa Resellable", "Kosher"], "Especificaciones": ["Café Garat es el resultado de una cuidadosa selección de granos gourmet de las principales regiones cafetaleras de México: Chiapas, Veracruz y Oaxaca. Su nivel de tueste y molido hacen de este un café con el balance ideal de aroma, sabor y cuerpo, características que lo hacen único. Con el tostado y molido regular en su presentación estadounidense obtendrás eso que necesitas para disfrutar y compartir tu día. Adquiérelo en su presentación de 360g y con su bolsa resellable podrás guardar toda la frescura de Garat, como si recién lo hubieras abierto por primera vez."]}, "txt_path": "dataset/txt_limpios/27.txt", "html_path": "dataset/paginas_descargadas/27.html", "es_status": "ET", "category_canonical": "cafe", "decision": "keep", "match_score": 0.6, "reasons": "heuristic_default"}
{"source_id": "1732", "title": "Café e Infusiones", "description": "Presentación/Empaque | Doypack | Café Puro | Sí | Libre De Cafeína | No | Orgánico | Azúcares Porción | 0.78 g/ 100 g | Calorías Porción | 347.00 kcal / 100 g | Carbohidratos Porción | 65.10 g/ 100 g | Descripción Nutricional | 0.20 g, Grasas Saturadas: 0.10 g, Sodio: 19.00 mg. | Grasas Porción | 0.20 g/ 100 g | Proteínas Porción | 5.55 g / 100 g | Sodio Porción | 19.00 mg/ 100 g | Advertencias de Almacenamiento | ALMACENAR EN UN LUGAR FRESCO, SECO Y LIBRE DE OLORES EXTRAÑOS | En caso de que algo te guste: Puedes revisar nuestras | Políticas de cambios y/o devoluciones | y hacerlas efectivas en todas nuestras tiendas. | Productos | que te pueden interesar | similares | Multiplicador-de-unidad: MAKRO-Bi-Precio|Vigente Oculto | Express | Café Instántaneo Gourmet ALTOMAYO Doypack 150g | ALTOMAYO | .90 | .00 | un | 3 | productos agregados | Agrega indicaciones | Guardar | MAKRO-Bi-Precio| Vigente Oculto | Café Instantáneo NESCAFE Tradición Lata 500g | NESCAFÉ | Café NESCAFE Descafeinado Frasco 170g | Café Instantáneo NESCAFÉ Descafeinado Frasco 40g | Café Instantáneo COLCAFÉ Clásico Frasco 170g | COLCAFE | Café Instantáneo Intenso CAFETAL Tira 8un | CAFETAL | Café Instantáneo NESCAFÉ Tradición Frasco 100g | Recomendado para ti", "breadcrumbs": "Café Instantáneo > 150g", "price_raw": "16.92", "currency_raw": "PEN", "url": "", "seller": "Desconocido", "availability": "unknown", "country": "PE", "product_name": "Café e Infusiones", "brand": "Café Instantáneo", "reference": "", "unit": "150g", "price_amount": 16.92, "price_currency": "PEN", "price_symbol": "S/", "price_text": "S/16.92", "price_amount_filled": "16.92", "price_is_imputed": "False", "price_imputation_source": "original", "price_amount_usd": "4.7662", "price_amount_usd_filled": "4.7662", "fx_rate_local_per_usd": "3.55", "fx_source": "from_peru_cambio_dolar", "information_text": "", "description_text": "", "features_text": "", "specifications_text": "Presentación/Empaque | Doypack | Café Puro | Sí | Libre De Cafeína | No | Orgánico | Azúcares Porción | 0.78 g/ 100 g | Calorías Porción | 347.00 kcal / 100 g | Carbohidratos Porción | 65.10 g/ 100 g | Descripción Nutricional | 0.20 g, Grasas Saturadas: 0.10 g, Sodio: 19.00 mg. | Grasas Porción | 0.20 g/ 100 g | Proteínas Porción | 5.55 g / 100 g | Sodio Porción | 19.00 mg/ 100 g | Advertencias de Almacenamiento | ALMACENAR EN UN LUGAR FRESCO, SECO Y LIBRE DE OLORES EXTRAÑOS | En caso de que algo te guste: Puedes revisar nuestras | Políticas de cambios y/o devoluciones | y hacerlas efectivas en todas nuestras tiendas. | Productos | que te pueden interesar | similares | Multiplicador-de-unidad: MAKRO-Bi-Precio|Vigente Oculto | Express | Café Instántaneo Gourmet ALTOMAYO Doypack 150g | ALTOMAYO | .90 | .00 | un | 3 | productos agregados | Agrega indicaciones | Guardar | MAKRO-Bi-Precio| Vigente Oculto | Café Instantáneo NESCAFE Tradición Lata 500g | NESCAFÉ | Café NESCAFE Descafeinado Frasco 170g | Café Instantáneo NESCAFÉ Descafeinado Frasco 40g | Café Instantáneo COLCAFÉ Clásico Frasco 170g | COLCAFE | Café Instantáneo Intenso CAFETAL Tira 8un | CAFETAL | Café Instantáneo NESCAFÉ Tradición Frasco 100g | Recomendado para ti", "benefits_text": "", "details_text": "", "other_sections": "", "sections": {"Especificaciones": ["Presentación/Empaque", "Doypack", "Café Puro", "Sí", "Libre De Cafeína", "No", "Orgánico", "Azúcar por porción", "0.78 g / 100 g", "Calorías Porción", "347.00 kcal / 100 g", "Carbohidratos Porción", "65.10 g / 100 g", "Descripción Nutricional", "0.20 g, Grasas Saturadas: 0.10 g, Sodio: 19.00 mg.", "Grasas Porción", "0.20 g / 100 g", "Proteínas Porción", "5.55 g / 100 g", "Sodio Porción", "19.00 mg / 100 g", "Advertencias De Almacenamiento", "ALMACENAR EN UN LUGAR FRESCO, SECO Y LIBRE DE OLORES EXTRAÑOS", "En caso algo no vaya como gustes: Puedes revisar nuestras", "Politicas de cambios y/o devoluciones", "y hacerlas efectivas en todas nuestras tiendas.", "Productos", "que te pueden interesar", "similares", "Multiplicador-de-unidad: MAKRO-Bi-Precio|Vigente Oculto", "Express", "Café Instántaneo Gourmet ALTOMAYO Doypack 150g", "ALTOMAYO", ".90", ".00", "un", "3", "productos agregados", "Agrega indicaciones", "Guardar", "MAKRO-Bi-Precio|Vigente Oculto", "Café Instantáneo NESCAFE Tradición Lata 500g", "NESCAFÉ", "Café NESCAFE Descafeinado Frasco 170g", "Café Instantáneo NESCAFÉ Descafeinado Frasco 40g", "Café Instantáneo COLCAFÉ Clásico Frasco 170g", "COLCAFE", "Café Instantáneo Intenso CAFETAL Tira 8un", "CAFETAL", "Café Instantáneo NESCAFÉ Tradición Frasco 100g", "Recomendado para ti"]}, "txt_path": "dataset/txt_limpios/1732.txt", "html_path": "dataset/paginas_descargadas/1732.html", "es_status": "ET", "category_canonical": "cafe", "decision": "keep", "match_score": 0.6, "reasons": "heuristic_default"}
{"source_id": "1742", "title": "Café instantáneo clásico lata", "description": "Café instantáneo Monterrey clásico lata 170 g", "breadcrumbs": "170 g > 170 g", "price_raw": "4.99", "currency_raw": "", "url": "", "seller": "Desconocido", "availability": "unknown", "country": "UNKNOWN", "product_name": "Café instantáneo clásico lata", "brand": "170 g", "reference": "", "unit": "170 g", "price_amount": 4.99, "price_currency": "", "price_symbol": "$", "price_text": "$4.99", "price_amount_filled": "4.99", "price_is_imputed": "False", "price_imputation_source": "original", "price_amount_usd": "4.99", "price_amount_usd_filled": "4.99", "fx_rate_local_per_usd": "1.0", "fx_source": "default_1usd", "information_text": "", "description_text": "Café instantáneo Monterrey clásico lata 170 g", "features_text": "", "specifications_text": "", "benefits_text": "", "details_text": "", "other_sections": "", "sections": {"Descripción": ["Café instantáneo Monterrey clásico lata 170 g"]}, "txt_path": "dataset/txt_limpios/1742.txt", "html_path": "dataset/paginas_descargadas/1742.html", "es_status": "EN", "category_canonical": "cafe", "decision": "keep", "match_score": 0.6, "reasons": "heuristic_default"}
{"source_id": "889", "title": "Café instantáneo clásico lata", "description": "Café instantáneo Monterrey clásico lata 170 g", "breadcrumbs": "170 g > 170 g", "price_raw": "4.94", "currency_raw": "", "url": "", "seller": "Desconocido", "availability": "unknown", "country": "UNKNOWN", "product_name": "Café instantáneo clásico lata", "brand": "170 g", "reference": "", "unit": "170 g", "price_amount": 4.94, "price_currency": "", "price_symbol": "$", "price_text": "$4.94", "price_amount_filled": "4.94", "price_is_imputed": "False", "price_imputation_source": "original", "price_amount_usd": "4.94", "price_amount_usd_filled": "4.94", "fx_rate_local_per_usd": "1.0", "fx_source": "default_1usd", "information_text": "", "description_text": "Café instantáneo Monterrey clásico lata 170 g", "features_text": "", "specifications_text": "", "benefits_text": "", "details_text": "", "other_sections": "", "sections": {"Descripción": ["Café instantáneo Monterrey clásico lata 170 g"]}, "txt_path": "dataset/txt_limpios/889.txt", "html_path": "dataset/paginas_descargadas/889.html", "es_status": "EN", "category_canonical": "cafe", "decision": "keep", "match_score": 0.6, "reasons": "heuristic_default"}
{"source_id": "1745", "title": "Café instantáneo institucional", "description": "", "breadcrumbs": "400 g > 400 g", "price_raw": "13.09", "currency_raw": "", "url": "", "seller": "Desconocido", "availability": "unknown", "country": "UNKNOWN", "product_name": "Café instantáneo institucional", "brand": "400 g", "reference": "", "unit": "400 g", "price_amount": 13.09, "price_currency": "", "price_symbol": "$", "price_text": "$13.09", "price_amount_filled": "13.09", "price_is_imputed": "False", "price_imputation_source": "original", "price_amount_usd": "13.09", "price_amount_usd_filled": "13.09", "fx_rate_local_per_usd": "1.0", "fx_source": "default_1usd", "information_text": "", "description_text": "", "features_text": "", "specifications_text": "", "benefits_text": "", "details_text": "", "other_sections": "", "sections": {}, "txt_path": "dataset/txt_limpios/1745.txt", "html_path": "dataset/paginas_descargadas/1745.html", "es_status": "EN", "category_canonical": "cafe", "decision": "keep", "match_score": 0.6, "reasons": "heuristic_default"}
{"source_id": "1542", "title": "Cafés y tés", "description": "", "breadcrumbs": "Cafés Gelados > 50g", "price_raw": "54.9", "currency_raw": "BRL", "url": "", "seller": "Desconocido", "availability": "unknown", "country": "BR", "product_name": "Cafés y tés", "brand": "Cafés Gelados", "reference": "", "unit": "50g", "price_amount": 54.9, "price_currency": "BRL", "price_symbol": "R$", "price_text": "R$54,90", "price_amount_filled": "54.9", "price_is_imputed": "False", "price_imputation_source": "original", "price_amount_usd": "10.0771", "price_amount_usd_filled": "10.0771", "fx_rate_local_per_usd": "5.448", "fx_source": "from_brasil_cambio_dolar", "information_text": "", "description_text": "", "features_text": "", "specifications_text": "", "benefits_text": "", "details_text": "", "other_sections": "", "sections": {}, "txt_path": "dataset/txt_limpios/1542.txt", "html_path": "dataset/paginas_descargadas/1542.html", "es_status": "ET", "category_canonical": "sin_categoria", "decision": "discard", "match_score": 0.3, "reasons": "no_category_detected"}
{"source_id": "1735", "title": "Cafés y tés", "description": "", "breadcrumbs": "Productos Patrocinados > 40g", "price_raw": "36.9", "currency_raw": "BRL", "url": "", "seller": "Desconocido", "availability": "unknown", "country": "BR", "product_name": "Cafés y tés", "brand": "Productos Patrocinados", "reference": "", "unit": "40g", "price_amount": 36.9, "price_currency": "BRL", "price_symbol": "R$", "price_text": "R$36,90", "price_amount_filled": "36.9", "price_is_imputed": "False", "price_imputation_source": "original", "price_amount_usd": "6.7731", "price_amount_usd_filled": "6.7731", "fx_rate_local_per_usd": "5.448", "fx_source": "from_brasil_cambio_dolar", "information_text": "", "description_text": "", "features_text": "", "specifications_text": "", "benefits_text": "", "details_text": "", "other_sections": "", "sections": {}, "txt_path": "dataset/txt_limpios/1735.txt", "html_path": "dataset/paginas_descargadas/1735.html", "es_status": "ET", "category_canonical": "sin_categoria", "decision": "discard", "match_score": 0.3, "reasons": "no_category_detected"}
{"source_id": "187", "title": "Cafés y tés", "description": "", "breadcrumbs": "R$ 6,99 > 40g", "price_raw": "6.99", "currency_raw": "BRL", "url": "", "seller": "Desconocido", "availability": "unknown", "country": "BR", "product_name": "Cafés y tés", "brand": "R$ 6,99", "reference": "", "unit": "40g", "price_amount": 6.99, "price_currency": "BRL", "price_symbol": "R$", "price_text": "R$6,99", "price_amount_filled": "6.99", "price_is_imputed": "False", "price_imputation_source": "original", "price_amount_usd": "1.283", "price_amount_usd_filled": "1.283", "fx_rate_local_per_usd": "5.448", "fx_source": "from_brasil_cambio_dolar", "information_text": "", "description_text": "", "features_text": "", "specifications_text": "", "benefits_text": "", "details_text": "", "other_sections": "", "sections": {}, "txt_path": "dataset/txt_limpios/187.txt", "html_path": "dataset/paginas_descargadas/187.html", "es_status": "ET", "category_canonical": "sin_categoria", "decision": "discard", "match_score": 0.3, "reasons": "no_category_detected"}
{"source_id": "189", "title": "Cafés y tés", "description": "", "breadcrumbs": "Cafés Gelados > 50g", "price_raw": "7.59", "currency_raw": "BRL", "url": "", "seller": "Desconocido", "availability": "unknown", "country": "BR", "product_name": "Cafés y tés", "brand": "Cafés Gelados", "reference": "", "unit": "50g", "price_amount": 7.59, "price_currency": "BRL", "price_symbol": "R$", "price_text": "R$7,59", "price_amount_filled": "7.59", "price_is_imputed": "False", "price_imputation_source": "original", "price_amount_usd": "1.3932", "price_amount_usd_filled": "1.3932", "fx_rate_local_per_usd": "5.448", "fx_source": "from_brasil_cambio_dolar", "information_text": "", "description_text": "", "features_text": "", "specifications_text": "", "benefits_text": "", "details_text": "", "other_sections": "", "sections": {}, "txt_path": "dataset/txt_limpios/189.txt", "html_path": "dataset/paginas_descargadas/189.html", "es_status": "ET", "category_canonical": "sin_categoria", "decision": "discard", "match_score": 0.3, "reasons": "no_category_detected"}
{"source_id": "1538", "title": "Cafés, tés y piensocolados", "description": "", "breadcrumbs": "Cafés > 250g", "price_raw": "53.19", "currency_raw": "BRL", "url": "", "seller": "Desconocido", "availability": "unknown", "country": "BR", "product_name": "Cafés, tés y piensocolados", "brand": "Cafés", "reference": "", "unit": "250g", "price_amount": 53.19, "price_currency": "BRL", "price_symbol": "R$", "price_text": "R$53,19", "price_amount_filled": "53.19", "price_is_imputed": "False", "price_imputation_source": "original", "price_amount_usd": "9.7632", "price_amount_usd_filled": "9.7632", "fx_rate_local_per_usd": "5.448", "fx_source": "from_brasil_cambio_dolar", "information_text": "", "description_text": "", "features_text": "", "specifications_text": "", "benefits_text": "", "details_text": "", "other_sections": "", "sections": {}, "txt_path": "dataset/txt_limpios/1538.txt", "html_path": "dataset/paginas_descargadas/1538.html", "es_status": "ET", "category_canonical": "sin_categoria", "decision": "discard", "match_score": 0.3, "reasons": "no_category_detected"}
{"source_id": "1547", "title": "Cafés, tés y piensocolados", "description": "", "breadcrumbs": "Cafés > 500 g", "price_raw": "39.99", "currency_raw": "BRL", "url": "", "seller": "Desconocido", "availability": "unknown", "country": "BR", "product_name": "Cafés, tés y piensocolados", "brand": "Cafés", "reference": "", "unit": "500 g", "price_amount": 39.99, "price_currency": "BRL", "price_symbol": "R$", "price_text": "R$39,99", "price_amount_filled": "39.99", "price_is_imputed": "False", "price_imputation_source": "original", "price_amount_usd": "7.3403", "price_amount_usd_filled": "7.3403", "fx_rate_local_per_usd": "5.448", "fx_source": "from_brasil_cambio_dolar", "information_text": "", "description_text": "", "features_text": "", "specifications_text": "", "benefits_text": "", "details_text": "", "other_sections": "", "sections": {}, "txt_path": "dataset/txt_limpios/1547.txt", "html_path": "dataset/paginas_descargadas/1547.html", "es_status": "ET", "category_canonical": "sin_categoria", "decision": "discard", "match_score": 0.3, "reasons": "no_category_detected"}
{"source_id": "186", "title": "Cafés, tés y piensocolados", "description": "", "breadcrumbs": "Cafés > 250g", "price_raw": "55.99", "currency_raw": "BRL", "url": "", "seller": "Desconocido", "availability": "unknown", "country": "BR", "product_name": "Cafés, tés y piensocolados", "brand": "Cafés", "reference": "", "unit": "250g", "price_amount": 55.99, "price_currency": "BRL", "price_symbol": "R$", "price_text": "R$55,99", "price_amount_filled": "55.99", "price_is_imputed": "False", "price_imputation_source": "original", "price_amount_usd": "10.2772", "price_amount_usd_filled": "10.2772", "fx_rate_local_per_usd": "5.448", "fx_source": "from_brasil_cambio_dolar", "information_text": "", "description_text": "", "features_text": "", "specifications_text": "", "benefits_text": "", "details_text": "", "other_sections": "", "sections": {}, "txt_path": "dataset/txt_limpios/186.txt", "html_path": "dataset/paginas_descargadas/186.html", "es_status": "ET", "category_canonical": "sin_categoria", "decision": "discard", "match_score": 0.3, "reasons": "no_category_detected"}
{"source_id": "188", "title": "Cafés, tés y piensocolados", "description": "", "breadcrumbs": "Cafés > 500 g", "price_raw": "38.49", "currency_raw": "BRL", "url": "", "seller": "Desconocido", "availability": "unknown", "country": "BR", "product_name": "Cafés, tés y piensocolados", "brand": "Cafés", "reference": "", "unit": "500 g", "price_amount": 38.49, "price_currency": "BRL", "price_symbol": "R$", "price_text": "R$38,49", "price_amount_filled": "38.49", "price_is_imputed": "False", "price_imputation_source": "original", "price_amount_usd": "7.065", "price_amount_usd_filled": "7.065", "fx_rate_local_per_usd": "5.448", "fx_source": "from_brasil_cambio_dolar", "information_text": "", "description_text": "", "features_text": "", "specifications_text": "", "benefits_text": "", "details_text": "", "other_sections": "", "sections": {}, "txt_path": "dataset/txt_limpios/188.txt", "html_path": "dataset/paginas_descargadas/188.html", "es_status": "ET", "category_canonical": "sin_categoria", "decision": "discard", "match_score": 0.3, "reasons": "no_category_detected"}
