{"source_id": "38", "title": "No se puede acceder a este sitio", "description": "", "breadcrumbs": "ERR_FAILED", "price_raw": "", "currency_raw": "", "url": "", "seller": "Desconocido", "availability": "unknown", "country": "UNKNOWN", "product_name": "No se puede acceder a este sitio", "brand": "ERR_FAILED", "reference": "", "unit": "", "price_amount": null, "price_currency": "", "price_symbol": "", "price_text": "", "price_amount_filled": "234.19", "price_is_imputed": "True", "price_imputation_source": "country_mean", "price_amount_usd": "", "price_amount_usd_filled": "234.1938", "fx_rate_local_per_usd": "1.0", "fx_source": "default_1usd", "information_text": "", "description_text": "", "features_text": "", "specifications_text": "", "benefits_text": "", "details_text": "", "other_sections": "", "sections": {}, "txt_path": "dataset/txt_limpios/38.txt", "html_path": "dataset/paginas_descargadas/38.html", "es_status": "EN", "category_canonical": "sin_categoria", "decision": "discard", "match_score": 0.3, "reasons": "no_category_detected;price_parse_failed"}
{"source_id": "63", "title": "No se puede acceder a este sitio", "description": "", "breadcrumbs": "ERR_FAILED", "price_raw": "", "currency_raw": "", "url": "", "seller": "Desconocido", "availability": "unknown", "country": "UNKNOWN", "product_name": "No se puede acceder a este sitio", "brand": "ERR_FAILED", "reference": "", "unit": "", "price_amount": null, "price_currency": "", "price_symbol": "", "price_text": "", "price_amount_filled": "234.19", "price_is_imputed": "True", "price_imputation_source": "country_mean", "price_amount_usd": "", "price_amount_usd_filled": "234.1938", "fx_rate_local_per_usd": "1.0", "fx_source": "default_1usd", "information_text": "", "description_text": "", "features_text": "", "specifications_text": "", "benefits_text": "", "details_text": "", "other_sections": "", "sections": {}, "txt_path": "dataset/txt_limpios/63.txt", "html_path": "dataset/paginas_descargadas/63.html", "es_status": "EN", "category_canonical": "sin_categoria", "decision": "discard", "match_score": 0.3, "reasons": "no_category_detected;price_parse_failed"}
{"source_id": "72", "title": "No se puede acceder a este sitio", "description": "", "breadcrumbs": "ERR_FAILED", "price_raw": "", "currency_raw": "", "url": "", "seller": "Desconocido", "availability": "unknown", "country": "UNKNOWN", "product_name": "No se puede acceder a este sitio", "brand": "ERR_FAILED", "reference": "", "unit": "", "price_amount": null, "price_currency": "", "price_symbol": "", "price_text": "", "price_amount_filled": "234.19", "price_is_imputed": "True", "price_imputation_source": "country_mean", "price_amount_usd": "", "price_amount_usd_filled": "234.1938", "fx_rate_local_per_usd": "1.0", "fx_source": "default_1usd", "information_text": "", "description_text": "", "features_text": "", "specifications_text": "", "benefits_text": "", "details_text": "", "other_sections": "", "sections": {}, "txt_path": "dataset/txt_limpios/72.txt", "html_path": "dataset/paginas_descargadas/72.html", "es_status": "EN", "category_canonical": "sin_categoria", "decision": "discard", "match_score": 0.3, "reasons": "no_category_detected;price_parse_failed"}
{"source_id": "902", "title": "nuestra cocina", "description": "Arroz Nuestra Cocina G2 grano largo ancho bolsa 1 Kg", "breadcrumbs": "1 Kg > 1 Kg", "price_raw": "1.59", "currency_raw": "", "url": "", "seller": "Desconocido", "availability": "unknown", "country": "UNKNOWN", "product_name": "nuestra cocina", "brand": "1 Kg", "reference": "", "unit": "1 Kg", "price_amount": 1.59, "price_currency": "", "price_symbol": "$", "price_text": "$1.59", "price_amount_filled": "1.59", "price_is_imputed": "False", "price_imputation_source": "original", "price_amount_usd": "1.59", "price_amount_usd_filled": "1.59", "fx_rate_local_per_usd": "1.0", "fx_source": "default_1usd", "information_text": "", "description_text": "Arroz Nuestra Cocina G2 grano largo ancho bolsa 1 Kg", "features_text": "", "specifications_text": "", "benefits_text": "", "details_text": "", "other_sections": "", "sections": {"Descripción": ["Arroz Nuestra Cocina G2 grano largo ancho bolsa 1 Kg"]}, "txt_path": "dataset/txt_limpios/902.txt", "html_path": "dataset/paginas_descargadas/902.html", "es_status": "EN", "category_canonical": "arroz", "decision": "keep", "match_score": 0.6, "reasons": "heuristic_default"}
{"source_id": "1544", "title": "Padaria e Matinais", "description": "", "breadcrumbs": "Panes y Torradas > 500g", "price_raw": "8.78", "currency_raw": "BRL", "url": "", "seller": "Desconocido", "availability": "unknown", "country": "BR", "product_name": "Padaria e Matinais", "brand": "Panes y Torradas", "reference": "", "unit": "500g", "price_amount": 8.78, "price_currency": "BRL", "price_symbol": "R$", "price_text": "R$8,78", "price_amount_filled": "8.78", "price_is_imputed": "False", "price_imputation_source": "original", "price_amount_usd": "1.6116", "price_amount_usd_filled": "1.6116", "fx_rate_local_per_usd": "5.448", "fx_source": "from_brasil_cambio_dolar", "information_text": "", "description_text": "", "features_text": "", "specifications_text": "", "benefits_text": "", "details_text": "", "other_sections": "", "sections": {}, "txt_path": "dataset/txt_limpios/1544.txt", "html_path": "dataset/paginas_descargadas/1544.html", "es_status": "ET", "category_canonical": "pan", "decision": "keep", "match_score": 0.6, "reasons": "heuristic_default"}
{"source_id": "1548", "title": "Padaria e Matinais", "description": "", "breadcrumbs": "Panes y Torradas > 450g", "price_raw": "13.99", "currency_raw": "BRL", "url": "", "seller": "Desconocido", "availability": "unknown", "country": "BR", "product_name": "Padaria e Matinais", "brand": "Panes y Torradas", "reference": "", "unit": "450g", "price_amount": 13.99, "price_currency": "BRL", "price_symbol": "R$", "price_text": "R$13,99", "price_amount_filled": "13.99", "price_is_imputed": "False", "price_imputation_source": "original", "price_amount_usd": "2.5679", "price_amount_usd_filled": "2.5679", "fx_rate_local_per_usd": "5.448", "fx_source": "from_brasil_cambio_dolar", "information_text": "", "description_text": "", "features_text": "", "specifications_text": "", "benefits_text": "", "details_text": "", "other_sections": "", "sections": {}, "txt_path": "dataset/txt_limpios/1548.txt", "html_path": "dataset/paginas_descargadas/1548.html", "es_status": "ET", "category_canonical": "pan", "decision": "keep", "match_score": 0.6, "reasons": "heuristic_default"}
{"source_id": "1555", "title": "Padaria e Matinais", "description": "", "breadcrumbs": "Panes y Torradas > 400g", "price_raw": "8.78", "currency_raw": "BRL", "url": "", "seller": "Desconocido", "availability": "unknown", "country": "BR", "product_name": "Padaria e Matinais", "brand": "Panes y Torradas", "reference": "", "unit": "400g", "price_amount": 8.78, "price_currency": "BRL", "price_symbol": "R$", "price_text": "R$8,78", "price_amount_filled": "8.78", "price_is_imputed": "False", "price_imputation_source": "original", "price_amount_usd": "1.6116", "price_amount_usd_filled": "1.6116", "fx_rate_local_per_usd": "5.448", "fx_source": "from_brasil_cambio_dolar", "information_text": "", "description_text": "", "features_text": "", "specifications_text": "", "benefits_text": "", "details_text": "", "other_sections": "", "sections": {}, "txt_path": "dataset/txt_limpios/1555.txt", "html_path": "dataset/paginas_descargadas/1555.html", "es_status": "ET", "category_canonical": "pan", "decision": "keep", "match_score": 0.6, "reasons": "heuristic_default"}
{"source_id": "1564", "title": "Padaria e Matinais", "description": "", "breadcrumbs": "Leites > 1 L", "price_raw": "33.14", "currency_raw": "BRL", "url": "", "seller": "Desconocido", "availability": "unknown", "country": "BR", "product_name": "Padaria e Matinais", "brand": "Leites", "reference": "", "unit": "1 L", "price_amount": 33.14, "price_currency": "BRL", "price_symbol": "R$", "price_text": "R$33,14", "price_amount_filled": "33.14", "price_is_imputed": "False", "price_imputation_source": "original", "price_amount_usd": "6.083", "price_amount_usd_filled": "6.083", "fx_rate_local_per_usd": "5.448", "fx_source": "from_brasil_cambio_dolar", "information_text": "", "description_text": "", "features_text": "", "specifications_text": "", "benefits_text": "", "details_text": "", "other_sections": "", "sections": {}, "txt_path": "dataset/txt_limpios/1564.txt", "html_path": "dataset/paginas_descargadas/1564.html", "es_status": "EN", "category_canonical": "sin_categoria", "decision": "discard", "match_score": 0.3, "reasons": "no_category_detected"}
{"source_id": "1565", "title": "Padaria e Matinais", "description": "", "breadcrumbs": "Leites > 1 L", "price_raw": "33.14", "currency_raw": "BRL", "url": "", "seller": "Desconocido", "availability": "unknown", "country": "BR", "product_name": "Padaria e Matinais", "brand": "Leites", "reference": "", "unit": "1 L", "price_amount": 33.14, "price_currency": "BRL", "price_symbol": "R$", "price_text": "R$33,14", "price_amount_filled": "33.14", "price_is_imputed": "False", "price_imputation_source": "original", "price_amount_usd": "6.083", "price_amount_usd_filled": "6.083", "fx_rate_local_per_usd": "5.448", "fx_source": "from_brasil_cambio_dolar", "information_text": "", "description_text": "", "features_text": "", "specifications_text": "", "benefits_text": "", "details_text": "", "other_sections": "", "sections": {}, "txt_path": "dataset/txt_limpios/1565.txt", "html_path": "dataset/paginas_descargadas/1565.html", "es_status": "EN", "category_canonical": "sin_categoria", "decision": "discard", "match_score": 0.3, "reasons": "no_category_detected"}
{"source_id": "1566", "title": "Padaria e Matinais", "description": "", "breadcrumbs": "Leites > 1L", "price_raw": "5.99", "currency_raw": "BRL", "url": "", "seller": "Desconocido", "availability": "unknown", "country": "BR", "product_name": "Padaria e Matinais", "brand": "Leites", "reference": "", "unit": "1L", "price_amount": 5.99, "price_currency": "BRL", "price_symbol": "R$", "price_text": "R$5,99", "price_amount_filled": "5.99", "price_is_imputed": "False", "price_imputation_source": "original", "price_amount_usd": "1.0995", "price_amount_usd_filled": "1.0995", "fx_rate_local_per_usd": "5.448", "fx_source": "from_brasil_cambio_dolar", "information_text": "", "description_text": "", "features_text": "", "specifications_text": "", "benefits_text": "", "details_text": "", "other_sections": "", "sections": {}, "txt_path": "dataset/txt_limpios/1566.txt", "html_path": "dataset/paginas_descargadas/1566.html", "es_status": "EN", "category_canonical": "sin_categoria", "decision": "discard", "match_score": 0.3, "reasons": "no_category_detected"}
{"source_id": "1568", "title": "Padaria e Matinais", "description": "", "breadcrumbs": "Panes y Torradas > 450g", "price_raw": "33.14", "currency_raw": "BRL", "url": "", "seller": "Desconocido", "availability": "unknown", "country": "BR", "product_name": "Padaria e Matinais", "brand": "Panes y Torradas", "reference": "", "unit": "450g", "price_amount": 33.14, "price_currency": "BRL", "price_symbol": "R$", "price_text": "R$33,14", "price_amount_filled": "33.14", "price_is_imputed": "False", "price_imputation_source": "original", "price_amount_usd": "6.083", "price_amount_usd_filled": "6.083", "fx_rate_local_per_usd": "5.448", "fx_source": "from_brasil_cambio_dolar", "information_text": "", "description_text": "", "features_text": "", "specifications_text": "", "benefits_text": "", "details_text": "", "other_sections": "", "sections": {}, "txt_path": "dataset/txt_limpios/1568.txt", "html_path": "dataset/paginas_descargadas/1568.html", "es_status": "ET", "category_canonical": "pan", "decision": "keep", "match_score": 0.6, "reasons": "heuristic_default"}
{"source_id": "1614", "title": "Padaria e Matinais", "description": "", "breadcrumbs": "Panes y Torradas > 450g", "price_raw": "11.9", "currency_raw": "BRL", "url": "", "seller": "Desconocido", "availability": "unknown", "country": "BR", "product_name": "Padaria e Matinais", "brand": "Panes y Torradas", "reference": "", "unit": "450g", "price_amount": 11.9, "price_currency": "BRL", "price_symbol": "R$", "price_text": "R$11,90", "price_amount_filled": "11.9", "price_is_imputed": "False", "price_imputation_source": "original", "price_amount_usd": "2.1843", "price_amount_usd_filled": "2.1843", "fx_rate_local_per_usd": "5.448", "fx_source": "from_brasil_cambio_dolar", "information_text": "", "description_text": "", "features_text": "", "specifications_text": "", "benefits_text": "", "details_text": "", "other_sections": "", "sections": {}, "txt_path": "dataset/txt_limpios/1614.txt", "html_path": "dataset/paginas_descargadas/1614.html", "es_status": "ET", "category_canonical": "pan", "decision": "keep", "match_score": 0.6, "reasons": "heuristic_default"}
{"source_id": "1737", "title": "Padaria e Matinais", "description": "", "breadcrumbs": "Leites > 1 Litro", "price_raw": "5.15", "currency_raw": "BRL", "url": "", "seller": "Desconocido", "availability": "unknown", "country": "BR", "product_name": "Padaria e Matinais", "brand": "Leites", "reference": "", "unit": "1 Litro", "price_amount": 5.15, "price_currency": "BRL", "price_symbol": "R$", "price_text": "R$5,15", "price_amount_filled": "5.15", "price_is_imputed": "False", "price_imputation_source": "original", "price_amount_usd": "0.9453", "price_amount_usd_filled": "0.9453", "fx_rate_local_per_usd": "5.448", "fx_source": "from_brasil_cambio_dolar", "information_text": "", "description_text": "", "features_text": "", "specifications_text": "", "benefits_text": "", "details_text": "", "other_sections": "", "sections": {}, "txt_path": "dataset/txt_limpios/1737.txt", "html_path": "dataset/paginas_descargadas/1737.html", "es_status": "EN", "category_canonical": "sin_categoria", "decision": "discard", "match_score": 0.3, "reasons": "no_category_detected"}
{"source_id": "1740", "title": "Padaria e Matinais", "description": "", "breadcrumbs": "Leites > 1L", "price_raw": "5.99", "currency_raw": "BRL", "url": "", "seller": "Desconocido", "availability": "unknown", "country": "BR", "product_name": "Padaria e Matinais", "brand": "Leites", "reference": "", "unit": "1L", "price_amount": 5.99, "price_currency": "BRL", "price_symbol": "R$", "price_text": "R$5,99", "price_amount_filled": "5.99", "price_is_imputed": "False", "price_imputation_source": "original", "price_amount_usd": "1.0995", "price_amount_usd_filled": "1.0995", "fx_rate_local_per_usd": "5.448", "fx_source": "from_brasil_cambio_dolar", "information_text": "", "description_text": "", "features_text": "", "specifications_text": "", "benefits_text": "", "details_text": "", "other_sections": "", "sections": {}, "txt_path": "dataset/txt_limpios/1740.txt", "html_path": "dataset/paginas_descargadas/1740.html", "es_status": "EN", "category_canonical": "sin_categoria", "decision": "discard", "match_score": 0.3, "reasons": "no_category_detected"}
{"source_id": "190", "title": "Padaria e Matinais", "description": "", "breadcrumbs": "Panes y Torradas > 500g", "price_raw": "9.49", "currency_raw": "BRL", "url": "", "seller": "Desconocido", "availability": "unknown", "country": "BR", "product_name": "Padaria e Matinais", "brand": "Panes y Torradas", "reference": "", "unit": "500g", "price_amount": 9.49, "price_currency": "BRL", "price_symbol": "R$", "price_text": "R$9,49", "price_amount_filled": "9.49", "price_is_imputed": "False", "price_imputation_source": "original", "price_amount_usd": "1.7419", "price_amount_usd_filled": "1.7419", "fx_rate_local_per_usd": "5.448", "fx_source": "from_brasil_cambio_dolar", "information_text": "", "description_text": "", "features_text": "", "specifications_text": "", "benefits_text": "", "details_text": "", "other_sections": "", "sections": {}, "txt_path": "dataset/txt_limpios/190.txt", "html_path": "dataset/paginas_descargadas/190.html", "es_status": "ET", "category_canonical": "pan", "decision": "keep", "match_score": 0.6, "reasons": "heuristic_default"}
{"source_id": "191", "title": "Padaria e Matinais", "description": "", "breadcrumbs": "Panes y Torradas > 400g", "price_raw": "9.69", "currency_raw": "BRL", "url": "", "seller": "Desconocido", "availability": "unknown", "country": "BR", "product_name": "Padaria e Matinais", "brand": "Panes y Torradas", "reference": "", "unit": "400g", "price_amount": 9.69, "price_currency": "BRL", "price_symbol": "R$", "price_text": "R$9,69", "price_amount_filled": "9.69", "price_is_imputed": "False", "price_imputation_source": "original", "price_amount_usd": "1.7786", "price_amount_usd_filled": "1.7786", "fx_rate_local_per_usd": "5.448", "fx_source": "from_brasil_cambio_dolar", "information_text": "", "description_text": "", "features_text": "", "specifications_text": "", "benefits_text": "", "details_text": "", "other_sections": "", "sections": {}, "txt_path": "dataset/txt_limpios/191.txt", "html_path": "dataset/paginas_descargadas/191.html", "es_status": "ET", "category_canonical": "pan", "decision": "keep", "match_score": 0.6, "reasons": "heuristic_default"}
{"source_id": "192", "title": "Padaria e Matinais", "description": "", "breadcrumbs": "Panes y Torradas > 450g", "price_raw": "", "currency_raw": "", "url": "", "seller": "Desconocido", "availability": "unknown", "country": "UNKNOWN", "product_name": "Padaria e Matinais", "brand": "Panes y Torradas", "reference": "", "unit": "450g", "price_amount": null, "price_currency": "", "price_symbol": "", "price_text": "", "price_amount_filled": "44.23", "price_is_imputed": "True", "price_imputation_source": "category_country_mean", "price_amount_usd": "", "price_amount_usd_filled": "44.2339", "fx_rate_local_per_usd": "1.0", "fx_source": "default_1usd", "information_text": "", "description_text": "", "features_text": "", "specifications_text": "", "benefits_text": "", "details_text": "", "other_sections": "", "sections": {}, "txt_path": "dataset/txt_limpios/192.txt", "html_path": "dataset/paginas_descargadas/192.html", "es_status": "ET", "category_canonical": "pan", "decision": "discard", "match_score": 0.6, "reasons": "price_parse_failed;price<=0"}
{"source_id": "193", "title": "Padaria e Matinais", "description": "", "breadcrumbs": "Panes y Torradas > 450g", "price_raw": "17.59", "currency_raw": "BRL", "url": "", "seller": "Desconocido", "availability": "unknown", "country": "BR", "product_name": "Padaria e Matinais", "brand": "Panes y Torradas", "reference": "", "unit": "450g", "price_amount": 17.59, "price_currency": "BRL", "price_symbol": "R$", "price_text": "R$17,59", "price_amount_filled": "17.59", "price_is_imputed": "False", "price_imputation_source": "original", "price_amount_usd": "3.2287", "price_amount_usd_filled": "3.2287", "fx_rate_local_per_usd": "5.448", "fx_source": "from_brasil_cambio_dolar", "information_text": "", "description_text": "", "features_text": "", "specifications_text": "", "benefits_text": "", "details_text": "", "other_sections": "", "sections": {}, "txt_path": "dataset/txt_limpios/193.txt", "html_path": "dataset/paginas_descargadas/193.html", "es_status": "ET", "category_canonical": "pan", "decision": "keep", "match_score": 0.6, "reasons": "heuristic_default"}
{"source_id": "194", "title": "Padaria e Matinais", "description": "", "breadcrumbs": "Panes y Torradas > 450g", "price_raw": "6.19", "currency_raw": "BRL", "url": "", "seller": "Desconocido", "availability": "unknown", "country": "BR", "product_name": "Padaria e Matinais", "brand": "Panes y Torradas", "reference": "", "unit": "450g", "price_amount": 6.19, "price_currency": "BRL", "price_symbol": "R$", "price_text": "R$6,19", "price_amount_filled": "6.19", "price_is_imputed": "False", "price_imputation_source": "original", "price_amount_usd": "1.1362", "price_amount_usd_filled": "1.1362", "fx_rate_local_per_usd": "5.448", "fx_source": "from_brasil_cambio_dolar", "information_text": "", "description_text": "", "features_text": "", "specifications_text": "", "benefits_text": "", "details_text": "", "other_sections": "", "sections": {}, "txt_path": "dataset/txt_limpios/194.txt", "html_path": "dataset/paginas_descargadas/194.html", "es_status": "ET", "category_canonical": "pan", "decision": "keep", "match_score": 0.6, "reasons": "heuristic_default"}
{"source_id": "205", "title": "Padaria e Matinais", "description": "", "breadcrumbs": "Leites > 1 Litro", "price_raw": "", "currency_raw": "", "url": "", "seller": "Desconocido", "availability": "unknown", "country": "UNKNOWN", "product_name": "Padaria e Matinais", "brand": "Leites", "reference": "", "unit": "1 Litro", "price_amount": null, "price_currency": "", "price_symbol": "", "price_text": "", "price_amount_filled": "234.19", "price_is_imputed": "True", "price_imputation_source": "country_mean", "price_amount_usd": "", "price_amount_usd_filled": "234.1938", "fx_rate_local_per_usd": "1.0", "fx_source": "default_1usd", "information_text": "", "description_text": "", "features_text": "", "specifications_text": "", "benefits_text": "", "details_text": "", "other_sections": "", "sections": {}, "txt_path": "dataset/txt_limpios/205.txt", "html_path": "dataset/paginas_descargadas/205.html", "es_status": "EN", "category_canonical": "sin_categoria", "decision": "discard", "match_score": 0.3, "reasons": "no_category_detected;price_parse_failed"}
