source_id,title,description,breadcrumbs,price_raw,currency_raw,url,seller,availability,country,product_name,brand,reference,unit,price_amount,price_currency,price_symbol,price_text,price_amount_filled,price_is_imputed,price_imputation_source,price_amount_usd,price_amount_usd_filled,fx_rate_local_per_usd,fx_source,information_text,description_text,features_text,specifications_text,benefits_text,details_text,other_sections,sections,txt_path,html_path,es_status,category_canonical,decision,match_score,reasons
712,Selecciona tu,"+ | Especificaciones técnicas | Propiedad | Especificación | Complementa tu elección | Alamar | Atún Alamar Ensalada Primavera 160 G | 160 Gramos | 25 | 400 | 7.400 | Cream Helado | Helado Tradicional Vainilla Chips x 600G | 33 | 800 | Medalla De Oro | 12 | 390 | Pond'S | CREM OJOS PONDS AGE MIRACLE 15ML | 63 | Lysol | Desinfectante Lysol Toallitas Citrus 35 unid. | 21 | 110 | Muss | Shampoo Muss Liso Brasilero 400 Ml | 28 | 990 | Ver más | Pan Bimbo Integral 650 g | Pan | INTEGRAL 650 g | Comentarios | ☆ | 0 | (0 comentarios) | Por favor, inicia sesión para escribir un comentario. | Más reciente | Ordenar por: Más reciente | Más antiguo | Calificación más alta | Calificación más baja | Todos | Filtrar por: Todos | 1 estrella | 2 estrellas | 3 estrellas | 4 estrellas | 5 estrellas | No hay comentarios. | Términos más buscados | 1. | celulares | 2. | neveras | 3. | iphone | 4. | lavadora | 5. | aire | 6. | televisores | 7. | estufa | 8. | colchon | 9. | cafe | 10. | nevera | Evalúanos",Método de envío > 650 G,250.0,COP,,Desconocido,unknown,CO,Selecciona tu,Método de envío,,650 G,250.00,COP,,250,250.0,False,original,0.0618,0.0618,4047.0,from_colombia_cambio_dolar,,,,"+ | Especificaciones técnicas | Propiedad | Especificación | Complementa tu elección | Alamar | Atún Alamar Ensalada Primavera 160 G | 160 Gramos | 25 | 400 | 7.400 | Cream Helado | Helado Tradicional Vainilla Chips x 600G | 33 | 800 | Medalla De Oro | 12 | 390 | Pond'S | CREM OJOS PONDS AGE MIRACLE 15ML | 63 | Lysol | Desinfectante Lysol Toallitas Citrus 35 unid. | 21 | 110 | Muss | Shampoo Muss Liso Brasilero 400 Ml | 28 | 990 | Ver más | Pan Bimbo Integral 650 g | Pan | INTEGRAL 650 g | Comentarios | ☆ | 0 | (0 comentarios) | Por favor, inicia sesión para escribir un comentario. | Más reciente | Ordenar por: Más reciente | Más antiguo | Calificación más alta | Calificación más baja | Todos | Filtrar por: Todos | 1 estrella | 2 estrellas | 3 estrellas | 4 estrellas | 5 estrellas | No hay comentarios. | Términos más buscados | 1. | celulares | 2. | neveras | 3. | iphone | 4. | lavadora | 5. | aire | 6. | televisores | 7. | estufa | 8. | colchon | 9. | cafe | 10. | nevera | Evalúanos",,,,"{""Especificaciones"": [""+"", ""Especificaciones técnicas"", ""Propiedad"", ""Especificación"", ""Complementa tu elección"", ""Alamar"", ""Atún Alamar Ensalada Primavera 160 G"", ""160 Gramos"", ""25"", ""400"", ""7.400"", ""Cream Helado"", ""Helado Tradicional Vainilla Chips x 600G"", ""33"", ""800"", ""Medalla De Oro"", ""12"", ""390"", ""Pond'S"", ""CREM OJOS PONDS AGE MIRACLE 15ML"", ""63"", ""Lysol"", ""Desinfectante Lysol Toallitas Citrus 35 unid."", ""21"", ""110"", ""Muss"", ""Shampoo Muss Liso Brasilero 400 Ml"", ""28"", ""990"", ""Ver más"", ""Pan Bimbo Integral 650 g"", ""Pan"", ""INTEGRAL 650 g"", ""Comentarios"", ""☆"", ""0"", ""(0 comentarios)"", ""Por favor, inicia sesión para escribir un comentario."", ""Más reciente"", ""Ordenar por: Más reciente"", ""Más antiguo"", ""Calificación más alta"", ""Calificación más baja"", ""Todos"", ""Filtrar por: Todos"", ""1 estrella"", ""2 estrellas"", ""3 estrellas"", ""4 estrellas"", ""5 estrellas"", ""No hay comentarios."", ""Términos más buscados"", ""1."", ""celulares"", ""2."", ""neveras"", ""3."", ""iphone"", ""4."", ""lavadora"", ""5."", ""aire"", ""6."", ""televisores"", ""7."", ""estufa"", ""8."", ""colchon"", ""9."", ""cafe"", ""10."", ""nevera"", ""Evalúanos""]}",dataset/txt_limpios/712.txt,dataset/paginas_descargadas/712.html,EN,cafe,keep,0.60,heuristic_default
713,Selecciona tu,"+ | Especificaciones técnicas | Propiedad | Especificación | Complementa tu elección | Finesse | Yogurt FINESSE frutos rojos x180 Gr | $ | 3 | 800 | 3.800 | Cualquier medio | Colanta | Leche Colanta Semidescremada 6000 Ml | 6000 Mililitros | ( | Mililitro | a | 5 | , | 65 | ) | 33 | 900 | Badia | CANEL MOLIDA BADIA | 17 | 650 | Binner | Shampoo Concentrado BINNER para Alfombras y Cortinas Bouquet 500ml | 15 | 500 | Herbal Essences | Herbal Essences Bio Renew White Grapefruit & Mint Shampoo 400 Ml | 36 | Tosh | GALLETA TOSH WAFFER MULTCER KIWI X6 162g | 11 | 250 | Ver más | Viajar Olímpica destinos baratos | Aires acondicionados comprar | Venta de electrodomésticos hogar | Pedir medicamentos online | Licores a domicilio | Comentarios | Cargando el resumen… | Por favor, inicia sesión para escribir un comentario. | Más reciente | Ordenar por: Más reciente | Más antiguo | Calificación más alta | Calificación más baja | Todos | Filtrar por: Todos | 1 estrella | 2 estrellas | 3 estrellas | 4 estrellas | 5 estrellas | No hay comentarios. | Términos más buscados | 1. | celulares | 2. | neveras | 3. | iphone | 4. | lavadora | 5. | aire | 6. | televisores | 7. | estufa | 8. | colchon | 9. | cafe | 10. | nevera | Evalúanos",Método de envío > 400 G,,COP,,Desconocido,unknown,CO,Selecciona tu,Método de envío,,400 G,,COP,,,97.32,True,category_country_mean,,0.024,4047.0,from_colombia_cambio_dolar,,,,"+ | Especificaciones técnicas | Propiedad | Especificación | Complementa tu elección | Finesse | Yogurt FINESSE frutos rojos x180 Gr | $ | 3 | 800 | 3.800 | Cualquier medio | Colanta | Leche Colanta Semidescremada 6000 Ml | 6000 Mililitros | ( | Mililitro | a | 5 | , | 65 | ) | 33 | 900 | Badia | CANEL MOLIDA BADIA | 17 | 650 | Binner | Shampoo Concentrado BINNER para Alfombras y Cortinas Bouquet 500ml | 15 | 500 | Herbal Essences | Herbal Essences Bio Renew White Grapefruit & Mint Shampoo 400 Ml | 36 | Tosh | GALLETA TOSH WAFFER MULTCER KIWI X6 162g | 11 | 250 | Ver más | Viajar Olímpica destinos baratos | Aires acondicionados comprar | Venta de electrodomésticos hogar | Pedir medicamentos online | Licores a domicilio | Comentarios | Cargando el resumen… | Por favor, inicia sesión para escribir un comentario. | Más reciente | Ordenar por: Más reciente | Más antiguo | Calificación más alta | Calificación más baja | Todos | Filtrar por: Todos | 1 estrella | 2 estrellas | 3 estrellas | 4 estrellas | 5 estrellas | No hay comentarios. | Términos más buscados | 1. | celulares | 2. | neveras | 3. | iphone | 4. | lavadora | 5. | aire | 6. | televisores | 7. | estufa | 8. | colchon | 9. | cafe | 10. | nevera | Evalúanos",,,,"{""Especificaciones"": [""+"", ""Especificaciones técnicas"", ""Propiedad"", ""Especificación"", ""Complementa tu elección"", ""Finesse"", ""Yogurt FINESSE frutos rojos x180 Gr"", ""$"", ""3"", ""800"", ""3.800"", ""Cualquier medio"", ""Colanta"", ""Leche Colanta Semidescremada 6000 Ml"", ""6000 Mililitros"", ""("", ""Mililitro"", ""a"", ""5"", "","", ""65"", "")"", ""33"", ""900"", ""Badia"", ""CANEL MOLIDA BADIA"", ""17"", ""650"", ""Binner"", ""Shampoo Concentrado BINNER para Alfombras y Cortinas Bouquet 500ml"", ""15"", ""500"", ""Herbal Essences"", ""Herbal Essences Bio Renew White Grapefruit & Mint Shampoo 400 Ml"", ""36"", ""Tosh"", ""GALLETA TOSH WAFFER MULTCER KIWI X6 162g"", ""11"", ""250"", ""Ver más"", ""Viajar Olímpica destinos baratos"", ""Aires acondicionados comprar"", ""Venta de electrodomésticos hogar"", ""Pedir medicamentos online"", ""Licores a domicilio"", ""Comentarios"", ""Cargando el resumen…"", ""Por favor, inicia sesión para escribir un comentario."", ""Más reciente"", ""Ordenar por: Más reciente"", ""Más antiguo"", ""Calificación más alta"", ""Calificación más baja"", ""Todos"", ""Filtrar por: Todos"", ""1 estrella"", ""2 estrellas"", ""3 estrellas"", ""4 estrellas"", ""5 estrellas"", ""No hay comentarios."", ""Términos más buscados"", ""1."", ""celulares"", ""2."", ""neveras"", ""3."", ""iphone"", ""4."", ""lavadora"", ""5."", ""aire"", ""6."", ""televisores"", ""7."", ""estufa"", ""8."", ""colchon"", ""9."", ""cafe"", ""10."", ""nevera"", ""Evalúanos""]}",dataset/txt_limpios/713.txt,dataset/paginas_descargadas/713.html,EN,cafe,discard,0.60,price_parse_failed;price<=0
714,Selecciona tu,"+ | Especificaciones técnicas | Propiedad | Especificación | Complementa tu elección | Zenu | Salchichón Zenú Cerveroni 500 G | 100 | Colombina | Helado Colombina 100% Vainilla Sin Azucar 600G | 45 | 900 | Tosh | GALLETA TOSH WAFFER MULTCER COCO X6 162g | 11 | 250 | D'Origen | Café D'Origenn Molido Región Andina 340 G | 340 Gramos | 121 | 74 | 41 | 390 | Luminance | Tinte Luminance Doble Tubo 8,1 | 37 | 990 | Koller | Salchicha Koller Celofan | Ver más | huevos | Supermercados | Multicereal | huevo | Integral | Pan Bimbo Vital Fruticereal | Vital Bimbo | Grano integral | Comentarios | ☆ | 0 | (0 comentarios) | Por favor, inicia sesión para escribir un comentario. | Más reciente | Ordenar por: Más reciente | Más antiguo | Calificación más alta | Calificación más baja | Todos | Filtrar por: Todos | 1 estrella | 2 estrellas | 3 estrellas | 4 estrellas | 5 estrellas | No hay comentarios. | Términos más buscados | 1. | celulares | 2. | neveras | 3. | iphone | 4. | lavadora | 5. | aire | 6. | televisores | 7. | estufa | 8. | colchon | 9. | cafe | 10. | nevera | Evalúanos",Método de envío > 500 G,,COP,,Desconocido,unknown,CO,Selecciona tu,Método de envío,,500 G,,COP,,,97.32,True,category_country_mean,,0.024,4047.0,from_colombia_cambio_dolar,,,,"+ | Especificaciones técnicas | Propiedad | Especificación | Complementa tu elección | Zenu | Salchichón Zenú Cerveroni 500 G | 100 | Colombina | Helado Colombina 100% Vainilla Sin Azucar 600G | 45 | 900 | Tosh | GALLETA TOSH WAFFER MULTCER COCO X6 162g | 11 | 250 | D'Origen | Café D'Origenn Molido Región Andina 340 G | 340 Gramos | 121 | 74 | 41 | 390 | Luminance | Tinte Luminance Doble Tubo 8,1 | 37 | 990 | Koller | Salchicha Koller Celofan | Ver más | huevos | Supermercados | Multicereal | huevo | Integral | Pan Bimbo Vital Fruticereal | Vital Bimbo | Grano integral | Comentarios | ☆ | 0 | (0 comentarios) | Por favor, inicia sesión para escribir un comentario. | Más reciente | Ordenar por: Más reciente | Más antiguo | Calificación más alta | Calificación más baja | Todos | Filtrar por: Todos | 1 estrella | 2 estrellas | 3 estrellas | 4 estrellas | 5 estrellas | No hay comentarios. | Términos más buscados | 1. | celulares | 2. | neveras | 3. | iphone | 4. | lavadora | 5. | aire | 6. | televisores | 7. | estufa | 8. | colchon | 9. | cafe | 10. | nevera | Evalúanos",,,,"{""Especificaciones"": [""+"", ""Especificaciones técnicas"", ""Propiedad"", ""Especificación"", ""Complementa tu elección"", ""Zenu"", ""Salchichón Zenú Cerveroni 500 G"", ""100"", ""Colombina"", ""Helado Colombina 100% Vainilla Sin Azucar 600G"", ""45"", ""900"", ""Tosh"", ""GALLETA TOSH WAFFER MULTCER COCO X6 162g"", ""11"", ""250"", ""D'Origen"", ""Café D'Origenn Molido Región Andina 340 G"", ""340 Gramos"", ""121"", ""74"", ""41"", ""390"", ""Luminance"", ""Tinte Luminance Doble Tubo 8,1"", ""37"", ""990"", ""Koller"", ""Salchicha Koller Celofan"", ""Ver más"", ""huevos"", ""Supermercados"", ""Multicereal"", ""huevo"", ""Integral"", ""Pan Bimbo Vital Fruticereal"", ""Vital Bimbo"", ""Grano integral"", ""Comentarios"", ""☆"", ""0"", ""(0 comentarios)"", ""Por favor, inicia sesión para escribir un comentario."", ""Más reciente"", ""Ordenar por: Más reciente"", ""Más antiguo"", ""Calificación más alta"", ""Calificación más baja"", ""Todos"", ""Filtrar por: Todos"", ""1 estrella"", ""2 estrellas"", ""3 estrellas"", ""4 estrellas"", ""5 estrellas"", ""No hay comentarios."", ""Términos más buscados"", ""1."", ""celulares"", ""2."", ""neveras"", ""3."", ""iphone"", ""4."", ""lavadora"", ""5."", ""aire"", ""6."", ""televisores"", ""7."", ""estufa"", ""8."", ""colchon"", ""9."", ""cafe"", ""10."", ""nevera"", ""Evalúanos""]}",dataset/txt_limpios/714.txt,dataset/paginas_descargadas/714.html,EN,cafe,discard,0.60,price_parse_failed;price<=0
716,Selecciona tu,"+ | Especificaciones técnicas | Propiedad | Especificación | Tipo de Panadería Fresca | Pan Fresco | Ver más | Aires acondicionados comprar | Pedir medicamentos online | Suscripción boletín ofertas | Electrodomésticos ofertas | Licores a domicilio | Comentarios | ☆ | 0 Calificación promedio | (0 comentarios) | Por favor, inicia sesión para escribir un comentario. | Más reciente | Ordenar por: Más reciente | Más antiguo | Calificación más alta | Calificación más baja | Todos | Filtrar por: Todos | 1 estrella | 2 estrellas | 3 estrellas | 4 estrellas | 5 estrellas | No hay comentarios. | Evalúanos | Términos más buscados | 1. | celulares | 2. | neveras | 3. | iphone | 4. | lavadora | 5. | aire | 6. | televisores | 7. | estufa | 8. | colchon | 9. | cafe | 10. | nevera",Método de envío > 540 G,,COP,,Desconocido,unknown,CO,Selecciona tu,Método de envío,,540 G,,COP,,,97.32,True,category_country_mean,,0.024,4047.0,from_colombia_cambio_dolar,,,,"+ | Especificaciones técnicas | Propiedad | Especificación | Tipo de Panadería Fresca | Pan Fresco | Ver más | Aires acondicionados comprar | Pedir medicamentos online | Suscripción boletín ofertas | Electrodomésticos ofertas | Licores a domicilio | Comentarios | ☆ | 0 Calificación promedio | (0 comentarios) | Por favor, inicia sesión para escribir un comentario. | Más reciente | Ordenar por: Más reciente | Más antiguo | Calificación más alta | Calificación más baja | Todos | Filtrar por: Todos | 1 estrella | 2 estrellas | 3 estrellas | 4 estrellas | 5 estrellas | No hay comentarios. | Evalúanos | Términos más buscados | 1. | celulares | 2. | neveras | 3. | iphone | 4. | lavadora | 5. | aire | 6. | televisores | 7. | estufa | 8. | colchon | 9. | cafe | 10. | nevera",,,,"{""Especificaciones"": [""+"", ""Especificaciones técnicas"", ""Propiedad"", ""Especificación"", ""Tipo de Panadería Fresca"", ""Pan Fresco"", ""Ver más"", ""Aires acondicionados comprar"", ""Pedir medicamentos online"", ""Suscripción boletín ofertas"", ""Electrodomésticos ofertas"", ""Licores a domicilio"", ""Comentarios"", ""☆"", ""0 Calificación promedio"", ""(0 comentarios)"", ""Por favor, inicia sesión para escribir un comentario."", ""Más reciente"", ""Ordenar por: Más reciente"", ""Más antiguo"", ""Calificación más alta"", ""Calificación más baja"", ""Todos"", ""Filtrar por: Todos"", ""1 estrella"", ""2 estrellas"", ""3 estrellas"", ""4 estrellas"", ""5 estrellas"", ""No hay comentarios."", ""Evalúanos"", ""Términos más buscados"", ""1."", ""celulares"", ""2."", ""neveras"", ""3."", ""iphone"", ""4."", ""lavadora"", ""5."", ""aire"", ""6."", ""televisores"", ""7."", ""estufa"", ""8."", ""colchon"", ""9."", ""cafe"", ""10."", ""nevera""]}",dataset/txt_limpios/716.txt,dataset/paginas_descargadas/716.html,EN,cafe,discard,0.60,price_parse_failed;price<=0
717,Selecciona tu,"+ | Especificaciones técnicas | Propiedad | Especificación | Ver más | Comprar productos cocina online | Comprar computadores baratos | Televisor | Computadores baratos | Venta de electrodomésticos hogar | Comentarios | ☆ | 0 | (0 comentarios) | Por favor, inicia sesión para escribir un comentario. | Más reciente | Ordenar por: Más reciente | Más antiguo | Calificación más alta | Calificación más baja | Todos | Filtrar por: Todos | 1 estrella | 2 estrellas | 3 estrellas | 4 estrellas | 5 estrellas | No hay comentarios. | Evalúanos | Términos más buscados | 1. | celulares | 2. | neveras | 3. | iphone | 4. | lavadora | 5. | aire | 6. | televisores | 7. | estufa | 8. | colchon | 9. | cafe | 10. | nevera",Método de envío > 440 G,,COP,,Desconocido,unknown,CO,Selecciona tu,Método de envío,,440 G,,COP,,,97.32,True,category_country_mean,,0.024,4047.0,from_colombia_cambio_dolar,,,,"+ | Especificaciones técnicas | Propiedad | Especificación | Ver más | Comprar productos cocina online | Comprar computadores baratos | Televisor | Computadores baratos | Venta de electrodomésticos hogar | Comentarios | ☆ | 0 | (0 comentarios) | Por favor, inicia sesión para escribir un comentario. | Más reciente | Ordenar por: Más reciente | Más antiguo | Calificación más alta | Calificación más baja | Todos | Filtrar por: Todos | 1 estrella | 2 estrellas | 3 estrellas | 4 estrellas | 5 estrellas | No hay comentarios. | Evalúanos | Términos más buscados | 1. | celulares | 2. | neveras | 3. | iphone | 4. | lavadora | 5. | aire | 6. | televisores | 7. | estufa | 8. | colchon | 9. | cafe | 10. | nevera",,,,"{""Especificaciones"": [""+"", ""Especificaciones técnicas"", ""Propiedad"", ""Especificación"", ""Ver más"", ""Comprar productos cocina online"", ""Comprar computadores baratos"", ""Televisor"", ""Computadores baratos"", ""Venta de electrodomésticos hogar"", ""Comentarios"", ""☆"", ""0"", ""(0 comentarios)"", ""Por favor, inicia sesión para escribir un comentario."", ""Más reciente"", ""Ordenar por: Más reciente"", ""Más antiguo"", ""Calificación más alta"", ""Calificación más baja"", ""Todos"", ""Filtrar por: Todos"", ""1 estrella"", ""2 estrellas"", ""3 estrellas"", ""4 estrellas"", ""5 estrellas"", ""No hay comentarios."", ""Evalúanos"", ""Términos más buscados"", ""1."", ""celulares"", ""2."", ""neveras"", ""3."", ""iphone"", ""4."", ""lavadora"", ""5."", ""aire"", ""6."", ""televisores"", ""7."", ""estufa"", ""8."", ""colchon"", ""9."", ""cafe"", ""10."", ""nevera""]}",dataset/txt_limpios/717.txt,dataset/paginas_descargadas/717.html,EN,cafe,discard,0.60,price_parse_failed;price<=0
719,Selecciona tu,"+ | Especificaciones técnicas | Propiedad | Especificación | Tipo de Lácteo | Leche | Complementa tu elección | 58 | One pixel | Casa Corral Perros Plegable Mascota Aire Libre | 149 | 62 | Ahorra | 87 | 000 | Antes: $ | Lopets | SNACKS LOPETS CARAMELIZADOS GATOS 100G | 5.300 | Bemoka | Café Bemoka 250 G | Koller | Salami Koller Selva Negra 120 G | Sin Marca | Muslo de Pollo Friko X6 Unds | El Galan | Cuajada El Galán 500 G | Ver más | Colanta Leche Entera | Leche entera | Entera | Comprar productos supermercado | Aires Acondicionados | Comentarios | ☆ | 0 | (0 comentarios) | Por favor, inicia sesión para escribir un comentario. | Más reciente | Ordenar por: Más reciente | Más antiguo | Calificación más alta | Calificación más baja | Todos | Filtrar por: Todos | 1 estrella | 2 estrellas | 3 estrellas | 4 estrellas | 5 estrellas | No hay comentarios. | Términos más buscados | 1. | celulares | 2. | neveras | 3. | iphone | 4. | lavadora | 5. | aire | 6. | televisores | 7. | estufa | 8. | colchon | 9. | cafe | 10. | nevera | Evalúanos",Método de envío > 1000 Ml,400.0,COP,,Desconocido,unknown,CO,Selecciona tu,Método de envío,,1000 Ml,400.00,COP,,400,400.0,False,original,0.0988,0.0988,4047.0,from_colombia_cambio_dolar,,,,"+ | Especificaciones técnicas | Propiedad | Especificación | Tipo de Lácteo | Leche | Complementa tu elección | 58 | One pixel | Casa Corral Perros Plegable Mascota Aire Libre | 149 | 62 | Ahorra | 87 | 000 | Antes: $ | Lopets | SNACKS LOPETS CARAMELIZADOS GATOS 100G | 5.300 | Bemoka | Café Bemoka 250 G | Koller | Salami Koller Selva Negra 120 G | Sin Marca | Muslo de Pollo Friko X6 Unds | El Galan | Cuajada El Galán 500 G | Ver más | Colanta Leche Entera | Leche entera | Entera | Comprar productos supermercado | Aires Acondicionados | Comentarios | ☆ | 0 | (0 comentarios) | Por favor, inicia sesión para escribir un comentario. | Más reciente | Ordenar por: Más reciente | Más antiguo | Calificación más alta | Calificación más baja | Todos | Filtrar por: Todos | 1 estrella | 2 estrellas | 3 estrellas | 4 estrellas | 5 estrellas | No hay comentarios. | Términos más buscados | 1. | celulares | 2. | neveras | 3. | iphone | 4. | lavadora | 5. | aire | 6. | televisores | 7. | estufa | 8. | colchon | 9. | cafe | 10. | nevera | Evalúanos",,,,"{""Especificaciones"": [""+"", ""Especificaciones técnicas"", ""Propiedad"", ""Especificación"", ""Tipo de Lácteo"", ""Leche"", ""Complementa tu elección"", ""58"", ""One pixel"", ""Casa Corral Perros Plegable Mascota Aire Libre"", ""149"", ""62"", ""Ahorra"", ""87"", ""000"", ""Antes: $"", ""Lopets"", ""SNACKS LOPETS CARAMELIZADOS GATOS 100G"", ""5.300"", ""Bemoka"", ""Café Bemoka 250 G"", ""Koller"", ""Salami Koller Selva Negra 120 G"", ""Sin Marca"", ""Muslo de Pollo Friko X6 Unds"", ""El Galan"", ""Cuajada El Galán 500 G"", ""Ver más"", ""Colanta Leche Entera"", ""Leche entera"", ""Entera"", ""Comprar productos supermercado"", ""Aires Acondicionados"", ""Comentarios"", ""☆"", ""0"", ""(0 comentarios)"", ""Por favor, inicia sesión para escribir un comentario."", ""Más reciente"", ""Ordenar por: Más reciente"", ""Más antiguo"", ""Calificación más alta"", ""Calificación más baja"", ""Todos"", ""Filtrar por: Todos"", ""1 estrella"", ""2 estrellas"", ""3 estrellas"", ""4 estrellas"", ""5 estrellas"", ""No hay comentarios."", ""Términos más buscados"", ""1."", ""celulares"", ""2."", ""neveras"", ""3."", ""iphone"", ""4."", ""lavadora"", ""5."", ""aire"", ""6."", ""televisores"", ""7."", ""estufa"", ""8."", ""colchon"", ""9."", ""cafe"", ""10."", ""nevera"", ""Evalúanos""]}",dataset/txt_limpios/719.txt,dataset/paginas_descargadas/719.html,EN,leche,keep,0.60,heuristic_default
