{"source_id": "1009", "title": "colaborar con nuestros estudios para marketing. También puede configurarlas.", "description": "Información de la marca", "breadcrumbs": "que podemos ofrecer. > 780g", "price_raw": "16.92", "currency_raw": "PEN", "url": "", "seller": "Desconocido", "availability": "unknown", "country": "PE", "product_name": "colaborar con nuestros estudios para marketing. También puede configurarlas.", "brand": "que podemos ofrecer.", "reference": "", "unit": "780g", "price_amount": 16.92, "price_currency": "PEN", "price_symbol": "S/", "price_text": "S/16.92", "price_amount_filled": "16.92", "price_is_imputed": "False", "price_imputation_source": "original", "price_amount_usd": "4.7662", "price_amount_usd_filled": "4.7662", "fx_rate_local_per_usd": "3.55", "fx_source": "from_peru_cambio_dolar", "information_text": "", "description_text": "Información de la marca", "features_text": "Importante destacar | Corte de pollo | Mantener refrigerado | Se recomienda el consumo 3 veces por semana | Descripción del producto | CARNES AVES Y PESCADOS | plaza Vea | para que revises nuestra gran variedad de productos y puedas elegir todos los ingredientes que necesitas para engreir a tus seres queridos. | Por ejemplo si quieres preparar una deliciosa parrilla, lo más importante es contar una buena carne, ya sea de | Res | , | o | Chancho | . Puedes usar | Aderezos y Sazonadores | para realzar el sabor y darle un toque especial. Te recomendamos complementar tu parrilla con papas doradas el una fresca ensalada de verduras. | Por otro lado, si quieres cocinar comida marina en | también encontrarás | Pescados | y | Mariscos | para que sorprendas a todos con un exquisito ceviche, chupe de pescado, pescado frito, fetuccini con langostinos , entre otras delicias. | - Conoce las distintas opciones en | Carnes, Aves y Pescados | en plazaVea Online! | *La imagen solo es referencial | Revisa todo | Componentes del Producto | Vendido por | En caso de que algo no vaya como gustes: Puedes revisar nuestras | Políticas de cambios y/o devoluciones | y hacerlas efectivas en todas nuestras tiendas. | Productos | que te pueden interesar | Recomendado para ti", "specifications_text": "", "benefits_text": "", "details_text": "", "other_sections": "", "sections": {"Descripción": ["Información de la marca"], "Características": ["Importante destacar", "Corte de pollo", "Mantener refrigerado", "Se recomienda consumo 3 veces por semana", "Descripción del producto", "CARNES AVES Y PESCADOS", "plazaVea", "para que revises nuestra gran variedad de productos y puedas elegir todos los ingredientes que necesitas para engreir a tus seres queridos.", "Por ejemplo, si quieres preparar una deliciosa parrilla, lo más importante es contar una buena carne, ya sea de", "Res", ",", "o", "Chancho", ". Puedes utilizar", "Aderezos y Sazonadores", "para realzar el sabor y darle un toque especial. Te recomendamos complementar tu parrilla con papas doradas el una fresca ensalada de verduras.", "Por otro lado, si deseas cocinar comida marina en", "la encontrarás", "Pescados", "y", "Mariscos", "para que sorprendas a todos con un exquisito ceviche, chupe de pescado, pescado frito, fetuccini con langostinos , entre otras delicias.", "¡Conoce las distintas opciones en", "Carnes , Aves y Pescados", "en plazaVea Online!", "*La imagen solo es referencial", "Revisa todo", "Componentes del Producto", "Vendido por", "En caso algo no vaya como gustes: Puedes revisar nuestras", "Politicas de cambios y/o devoluciones", "y hacerlas efectivas en todas nuestras tiendas.", "Productos", "que te pueden interesar", "Recomendado para ti"]}, "txt_path": "dataset/txt_limpios/1009.txt", "html_path": "dataset/paginas_descargadas/1009.html", "es_status": "ET", "category_canonical": "sin_categoria", "decision": "discard", "match_score": 0.3, "reasons": "no_category_detected"}
{"source_id": "1010", "title": "colaborar con nuestros estudios para marketing. También puede configurarlas.", "description": "Información de la marca", "breadcrumbs": "que podemos ofrecer. > 1Kg", "price_raw": "16.92", "currency_raw": "PEN", "url": "", "seller": "Desconocido", "availability": "unknown", "country": "PE", "product_name": "colaborar con nuestros estudios para marketing. También puede configurarlas.", "brand": "que podemos ofrecer.", "reference": "", "unit": "1Kg", "price_amount": 16.92, "price_currency": "PEN", "price_symbol": "S/", "price_text": "S/16.92", "price_amount_filled": "16.92", "price_is_imputed": "False", "price_imputation_source": "original", "price_amount_usd": "4.7662", "price_amount_usd_filled": "4.7662", "fx_rate_local_per_usd": "3.55", "fx_source": "from_peru_cambio_dolar", "information_text": "", "description_text": "Información de la marca", "features_text": "Importante destacar | Producto de calidad | Mantener refrigerado | Fuente de proteínas | Descripción del producto | CARNES AVES Y PESCADOS | plaza Vea | para que revises nuestra gran variedad de productos y puedas elegir todos los ingredientes que necesitas para engreir a tus seres queridos. | Por ejemplo si quieres preparar una deliciosa parrilla, lo más importante es contar una buena carne, ya sea de | Res | , | o | Chancho | . Puedes usar | Aderezos y Sazonadores | para realzar el sabor y darle un toque especial. Te recomendamos complementar tu parrilla con papas doradas el una fresca ensalada de verduras. | Por otro lado, si quieres cocinar comida marina en | también encontrarás | Pescados | y | Mariscos | para que sorprendas a todos con un exquisito ceviche, chupe de pescado, pescado frito, fetuccini con langostinos , entre otras delicias. | - Conoce las distintas opciones en | Carnes, Aves y Pescados | en plazaVea Online! | *La imagen solo es referencial | \"Esta empresa comienza sus actividades en 1944. Hoy en día, Sadia ofrece más de 300 tipos de productos, que van desde los productos de carne de cerdo hasta los postres más deliciosos. \" | ¿No es lo que buscas? Encuentra más | Carne de Pollo | en plaza Vea | Revisa todo | Componentes del Producto | Vendido por | En caso de que algo te guste: Puedes revisar nuestras | Políticas de cambios y/o devoluciones | y hacerlas efectivas en todas nuestras tiendas. | Productos | que te pueden interesar | Recomendado para ti", "specifications_text": "", "benefits_text": "", "details_text": "", "other_sections": "", "sections": {"Descripción": ["Información de la marca"], "Características": ["Importante destacar", "Producto de calidad", "Mantener refrigerado", "Fuente de proteínas", "Descripción del producto", "CARNES AVES Y PESCADOS", "plazaVea", "para que revises nuestra gran variedad de productos y puedas elegir todos los ingredientes que necesitas para engreir a tus seres queridos.", "Por ejemplo, si quieres preparar una deliciosa parrilla, lo más importante es contar una buena carne, ya sea de", "Res", ",", "o", "Chancho", ". Puedes utilizar", "Aderezos y Sazonadores", "para realzar el sabor y darle un toque especial. Te recomendamos complementar tu parrilla con papas doradas el una fresca ensalada de verduras.", "Por otro lado, si deseas cocinar comida marina en", "la encontrarás", "Pescados", "y", "Mariscos", "para que sorprendas a todos con un exquisito ceviche, chupe de pescado, pescado frito, fetuccini con langostinos , entre otras delicias.", "¡Conoce las distintas opciones en", "Carnes , Aves y Pescados", "en plazaVea Online!", "*La imagen solo es referencial", "\"Esta empresa comienza sus actividades en 1944. Hoy en día, Sadia ofrece más de 300 tipos de productos, que van desde los productos de carne de cerdo hasta los postres más deliciosos. \"", "¿En qué búsqueda? Encuentra más", "Carne de Pollo", "en plazaVea", "Revisa todo", "Componentes del Producto", "Vendido por", "En caso algo no vaya como gustes: Puedes revisar nuestras", "Politicas de cambios y/o devoluciones", "y hacerlas efectivas en todas nuestras tiendas.", "Productos", "que te pueden interesar", "Recomendado para ti"]}, "txt_path": "dataset/txt_limpios/1010.txt", "html_path": "dataset/paginas_descargadas/1010.html", "es_status": "ET", "category_canonical": "sin_categoria", "decision": "discard", "match_score": 0.3, "reasons": "no_category_detected"}
{"source_id": "1012", "title": "colaborar con nuestros estudios para marketing. También puede configurarlas.", "description": "Información de la marca", "breadcrumbs": "que podemos ofrecer. > 1300g", "price_raw": "16.92", "currency_raw": "PEN", "url": "", "seller": "Desconocido", "availability": "unknown", "country": "PE", "product_name": "colaborar con nuestros estudios para marketing. También puede configurarlas.", "brand": "que podemos ofrecer.", "reference": "", "unit": "1300g", "price_amount": 16.92, "price_currency": "PEN", "price_symbol": "S/", "price_text": "S/16.92", "price_amount_filled": "16.92", "price_is_imputed": "False", "price_imputation_source": "original", "price_amount_usd": "4.7662", "price_amount_usd_filled": "4.7662", "fx_rate_local_per_usd": "3.55", "fx_source": "from_peru_cambio_dolar", "information_text": "", "description_text": "Información de la marca", "features_text": "Revisa todo | Componentes del Producto | Vendido por | plazaVea | En caso algo no vaya como gustes: Puedes revisar nuestras | Politicas de cambios y/o devoluciones | y hacerlas efectivas en todas nuestras tiendas. | Productos | que te pueden interesar | Recomendado para ti", "specifications_text": "", "benefits_text": "", "details_text": "", "other_sections": "", "sections": {"Descripción": ["Información de la marca"], "Características": ["Revisa todo", "Componentes del Producto", "Vendido por", "plazaVea", "En caso algo no vaya como gustes: Puedes revisar nuestras", "Politicas de cambios y/o devoluciones", "y hacerlas efectivas en todas nuestras tiendas.", "Productos", "que te pueden interesar", "Recomendado para ti"]}, "txt_path": "dataset/txt_limpios/1012.txt", "html_path": "dataset/paginas_descargadas/1012.html", "es_status": "EN", "category_canonical": "sin_categoria", "decision": "discard", "match_score": 0.3, "reasons": "no_category_detected"}
{"source_id": "1013", "title": "colaborar con nuestros estudios para marketing. También puede configurarlas.", "description": "Información de la marca", "breadcrumbs": "que podemos ofrecer. > 1Kg", "price_raw": "42.87", "currency_raw": "PEN", "url": "", "seller": "Desconocido", "availability": "unknown", "country": "PE", "product_name": "colaborar con nuestros estudios para marketing. También puede configurarlas.", "brand": "que podemos ofrecer.", "reference": "", "unit": "1Kg", "price_amount": 42.87, "price_currency": "PEN", "price_symbol": "S/", "price_text": "S/42.87", "price_amount_filled": "42.87", "price_is_imputed": "False", "price_imputation_source": "original", "price_amount_usd": "12.0761", "price_amount_usd_filled": "12.0761", "fx_rate_local_per_usd": "3.55", "fx_source": "from_peru_cambio_dolar", "information_text": "", "description_text": "Información de la marca", "features_text": "Presentación/Empaque | Bolsa | Con Piel | Sí | Deshuesado | No | Aderezado | Formato comestibles | Entero | Congelado | Marinado | Empanizado | Número de Unidades | 1 | Alérgenos Declarados | Preparación Sugerida | Requiere Cocción completa | Advertencias de Almacenamiento | Refrigeración de 0 C° a 4°C. | Contenido Neto | 2.2Kg | Denominación/Variedad | ARTISAN Pollo Entero S/M X Kg | Revisa todo | Importante destacar | Marca: ARTISAN | Conservar refrigerado | Es parte de la dieta diaria recomendada | Descripción del producto | CARNES AVES Y PESCADOS | plaza Vea | para que revises nuestra gran variedad de productos y puedas elegir todos los ingredientes que necesitas para engreir a tus seres queridos. | Por ejemplo si quieres preparar una deliciosa parrilla, lo más importante es contar una buena carne, ya sea de | Res | , | o | Chancho | . Puedes usar | Aderezos y Sazonadores | para realzar el sabor y darle un toque especial. Te recomendamos complementar tu parrilla con papas doradas el una fresca ensalada de verduras. | Por otro lado, si quieres cocinar comida marina en | también encontrarás | Pescados | y | Mariscos | para que sorprendas a todos con un exquisito ceviche, chupe de pescado, pescado frito, fetuccini con langostinos , entre otras delicias. | - Conoce las distintas opciones en | Carnes, Aves y Pescados | en plazaVea Online! | *La imagen solo es referencial | ¿En qué búsqueda? Encuentra más | Carnes de Res | en plaza Vea | Componentes del Producto | Vendido por | En caso de que algo te guste: Puedes revisar nuestras | Políticas de cambios y/o devoluciones | y hacerlas efectivas en todas nuestras tiendas. | Productos | que te pueden interesar | Recomendado para ti", "specifications_text": "", "benefits_text": "", "details_text": "", "other_sections": "", "sections": {"Descripción": ["Información de la marca"], "Características": ["Presentación/Empaque", "Bolsa", "Con Piel", "Sí", "Deshuesado", "No", "Aderezado", "Formato comestibles", "Entero", "Congelado", "Marinado", "Empanizado", "Número de unidades", "1", "Alérgenos Declarados", "Preparación sugerida", "Requiere Cocción completa", "Advertencias De Almacenamiento", "Refrigeración de 0 C° a 4°C.", "Contenido Neto", "2.2Kg", "Denominación/Variedad", "ARTISAN Pollo Entero S/M X Kg", "Revisa todo", "Importante destacar", "Marca: ARTISAN", "Conservar refrigerado", "Es parte de la dieta alimenticia diaria recomendad", "Descripción del producto", "CARNES AVES Y PESCADOS", "plazaVea", "para que revises nuestra gran variedad de productos y puedas elegir todos los ingredientes que necesitas para engreir a tus seres queridos.", "Por ejemplo, si quieres preparar una deliciosa parrilla, lo más importante es contar una buena carne, ya sea de", "Res", ",", "o", "Chancho", ". Puedes utilizar", "Aderezos y Sazonadores", "para realzar el sabor y darle un toque especial. Te recomendamos complementar tu parrilla con papas doradas el una fresca ensalada de verduras.", "Por otro lado, si deseas cocinar comida marina en", "la encontrarás", "Pescados", "y", "Mariscos", "para que sorprendas a todos con un exquisito ceviche, chupe de pescado, pescado frito, fetuccini con langostinos , entre otras delicias.", "¡Conoce las distintas opciones en", "Carnes , Aves y Pescados", "en plazaVea Online!", "*La imagen solo es referencial", "¿En qué búsqueda? Encuentra más", "Carnes de Res", "en plazaVea", "Componentes del Producto", "Vendido por", "En caso algo no vaya como gustes: Puedes revisar nuestras", "Politicas de cambios y/o devoluciones", "y hacerlas efectivas en todas nuestras tiendas.", "Productos", "que te pueden interesar", "Recomendado para ti"]}, "txt_path": "dataset/txt_limpios/1013.txt", "html_path": "dataset/paginas_descargadas/1013.html", "es_status": "ET", "category_canonical": "sin_categoria", "decision": "discard", "match_score": 0.3, "reasons": "no_category_detected"}
{"source_id": "1014", "title": "colaborar con nuestros estudios para marketing. También puede configurarlas.", "description": "Información de la marca", "breadcrumbs": "que podemos ofrecer. > 200g", "price_raw": "16.92", "currency_raw": "PEN", "url": "", "seller": "Desconocido", "availability": "unknown", "country": "PE", "product_name": "colaborar con nuestros estudios para marketing. También puede configurarlas.", "brand": "que podemos ofrecer.", "reference": "", "unit": "200g", "price_amount": 16.92, "price_currency": "PEN", "price_symbol": "S/", "price_text": "S/16.92", "price_amount_filled": "16.92", "price_is_imputed": "False", "price_imputation_source": "original", "price_amount_usd": "4.7662", "price_amount_usd_filled": "4.7662", "fx_rate_local_per_usd": "3.55", "fx_source": "from_peru_cambio_dolar", "information_text": "", "description_text": "Información de la marca", "features_text": "Presentación/Empaque | Caja | Libre De Cafeína | No | Orgánico | Descripción Técnica | NESCAFE FINA SELECCION Frasco 12x200g PE | Porción Sugerida | 2gr | Formato | Polvo | Azúcares Porción | 0.00gr | Carbohidratos Porción | Grasas Porción | Proteínas Porción | Advertencias De Almacenamiento | Conserva en un lugras fresco | Contenido Neto | 200gr | Revisa todo | Componentes del Producto | Vendido por | plaza Ver | En caso de que algo te guste: Puedes revisar nuestras | Políticas de cambios y/o devoluciones | y hacerlas efectivas en todas nuestras tiendas. | Productos | que te pueden interesar | Recomendado para ti", "specifications_text": "", "benefits_text": "", "details_text": "", "other_sections": "", "sections": {"Descripción": ["Información de la marca"], "Características": ["Presentación/Empaque", "Caja", "Libre De Cafeína", "No", "Orgánico", "Descripción técnica", "NESCAFE FINA SELECCION Frasco 12x200g PE", "Porción sugerida", "2gr", "Formato", "Polvo", "Azúcar por porción", "0.00gr", "Carbohidratos Porción", "Grasas Porción", "Proteínas Porción", "Advertencias De Almacenamiento", "Conserva en un lugras fresco", "Contenido Neto", "200gr", "Revisa todo", "Componentes del Producto", "Vendido por", "plazaVea", "En caso algo no vaya como gustes: Puedes revisar nuestras", "Politicas de cambios y/o devoluciones", "y hacerlas efectivas en todas nuestras tiendas.", "Productos", "que te pueden interesar", "Recomendado para ti"]}, "txt_path": "dataset/txt_limpios/1014.txt", "html_path": "dataset/paginas_descargadas/1014.html", "es_status": "ET", "category_canonical": "sin_categoria", "decision": "discard", "match_score": 0.3, "reasons": "no_category_detected"}
{"source_id": "1015", "title": "colaborar con nuestros estudios para marketing. También puede configurarlas.", "description": "Información de la marca", "breadcrumbs": "que podemos ofrecer. > 190g", "price_raw": "16.92", "currency_raw": "PEN", "url": "", "seller": "Desconocido", "availability": "unknown", "country": "PE", "product_name": "colaborar con nuestros estudios para marketing. También puede configurarlas.", "brand": "que podemos ofrecer.", "reference": "", "unit": "190g", "price_amount": 16.92, "price_currency": "PEN", "price_symbol": "S/", "price_text": "S/16.92", "price_amount_filled": "16.92", "price_is_imputed": "False", "price_imputation_source": "original", "price_amount_usd": "4.7662", "price_amount_usd_filled": "4.7662", "fx_rate_local_per_usd": "3.55", "fx_source": "from_peru_cambio_dolar", "information_text": "", "description_text": "Información de la marca", "features_text": "Denominación Dietética | Revisa todo | Componentes del Producto | Vendido por | plaza Vea | En caso de que algo te guste: Puedes revisar nuestras | Políticas de cambios y/o devoluciones | y hacerlas efectivas en todas nuestras tiendas. | Productos | que te pueden interesar | Recomendado para ti", "specifications_text": "", "benefits_text": "", "details_text": "", "other_sections": "", "sections": {"Descripción": ["Información de la marca"], "Características": ["Denominación Dietética", "Revisa todo", "Componentes del Producto", "Vendido por", "plazaVea", "En caso algo no vaya como gustes: Puedes revisar nuestras", "Politicas de cambios y/o devoluciones", "y hacerlas efectivas en todas nuestras tiendas.", "Productos", "que te pueden interesar", "Recomendado para ti"]}, "txt_path": "dataset/txt_limpios/1015.txt", "html_path": "dataset/paginas_descargadas/1015.html", "es_status": "ET", "category_canonical": "sin_categoria", "decision": "discard", "match_score": 0.3, "reasons": "no_category_detected"}
