source_id,title,description,breadcrumbs,price_raw,currency_raw,url,seller,availability,country,product_name,brand,reference,unit,price_amount,price_currency,price_symbol,price_text,price_amount_filled,price_is_imputed,price_imputation_source,price_amount_usd,price_amount_usd_filled,fx_rate_local_per_usd,fx_source,information_text,description_text,features_text,specifications_text,benefits_text,details_text,other_sections,sections,txt_path,html_path,es_status,category_canonical,decision,match_score,reasons
801,PAPA AIRFRYER MCCAIN X 500G,"Ingredientes | Componentes Nombre del producto: Papa Airfryer McCain 500g Descripción del producto: Papas precocidas y/o prefritas congeladas, súper crocantes y rápidas de preparar, aptas para horno y airfryer (no apto microondas). Tamaño: 24cm x 23cm Peso: 500 g Modo de fabricación: Industrial Conservación: Mantener congelado a -18°C, no volver a congelar una vez descongelado Origen: Importado RSA-005918-2018 Alergenos: Puede contener proteína de arveja y harina de arroz (potenciales alérgenos para algunas personas). Componentes: Papas Aceite vegetal (canola, soya, algodón, girasol, maíz) - Origen Norteamérica Almidón de papa modificado Dextrina Dextrosa Levadura Fibra de arveja Proteína de arveja Harina de arroz Sal Pirofosfato ácido de sodio Goma xantana Cobertura (almidón modificado, harina de arroz, dextrina, goma xantana) - Origen Europa Aceite de girasol Ver más También puede interesarte Bajó de precio PAN DE YUCA BACKEREI 8 UNDS 160 G Amor y amistad SALCHICHA RANCHERA X 230 G X 7 UD JAMÓN PIETRÁN ESTANDAR 230G TOMATE CHERRY 250 GR MILANESA DE POLLO APANADA 320 G BRASSET EMPANADA CON CARNE TOASTATAS 12 UND 420 G... CHAMPIÑON 250 GR",Unidades disponibles > 500G,500.0,,,Desconocido,unknown,UNKNOWN,PAPA AIRFRYER MCCAIN X 500G,Unidades disponibles,,500G,500.00,,,500,500.0,False,original,500.0,500.0,1.0,default_1usd,,"Ingredientes | Componentes Nombre del producto: Papa Airfryer McCain 500g Descripción del producto: Papas precocidas y/o prefritas congeladas, súper crocantes y rápidas de preparar, aptas para horno y airfryer (no apto microondas). Tamaño: 24cm x 23cm Peso: 500 g Modo de fabricación: Industrial Conservación: Mantener congelado a -18°C, no volver a congelar una vez descongelado Origen: Importado RSA-005918-2018 Alergenos: Puede contener proteína de arveja y harina de arroz (potenciales alérgenos para algunas personas). Componentes: Papas Aceite vegetal (canola, soya, algodón, girasol, maíz) - Origen Norteamérica Almidón de papa modificado Dextrina Dextrosa Levadura Fibra de arveja Proteína de arveja Harina de arroz Sal Pirofosfato ácido de sodio Goma xantana Cobertura (almidón modificado, harina de arroz, dextrina, goma xantana) - Origen Europa Aceite de girasol Ver más También puede interesarte Bajó de precio PAN DE YUCA BACKEREI 8 UNDS 160 G Amor y amistad SALCHICHA RANCHERA X 230 G X 7 UD JAMÓN PIETRÁN ESTANDAR 230G TOMATE CHERRY 250 GR MILANESA DE POLLO APANADA 320 G BRASSET EMPANADA CON CARNE TOASTATAS 12 UND 420 G... CHAMPIÑON 250 GR",,,,,,"{""Descripción"": [""Ingredientes | Componentes"", ""Nombre del producto: Papa Airfryer McCain 500g"", ""Descripción del producto: Papas precocidas y/o prefritas congeladas, súper crocantes y rápidas de preparar, aptas para horno y airfryer (no apto microondas)."", ""Tamaño: 24cm x 23cm"", ""Peso: 500 g"", ""Modo de fabricación: Industrial"", ""Conservación: Mantener congelado a -18°C, no volver a congelar una vez descongelado"", ""Origen: Importado"", ""RSA-005918-2018"", ""Alergenos: Puede contener proteína de arveja y harina de arroz (potenciales alérgenos para algunas personas)."", ""Componentes: Papas"", ""Aceite vegetal (canola, soya, algodón, girasol, maíz) - Origen Norteamérica"", ""Almidón de papa modificado"", ""Dextrina"", ""Dextrosa"", ""Levadura"", ""Fibra de arveja"", ""Proteína de arveja"", ""Harina de arroz"", ""Sal"", ""Pirofosfato ácido de sodio"", ""Goma xantana"", ""Cobertura (almidón modificado, harina de arroz, dextrina, goma xantana) - Origen Europa"", ""Aceite de girasol"", ""Ver más"", ""También puede interesarte"", ""Bajó de precio"", ""PAN DE YUCA BACKEREI 8 UNDS 160 G"", ""Amor y amistad"", ""SALCHICHA RANCHERA X 230 G X 7 UD"", ""JAMÓN PIETRÁN ESTANDAR 230G"", ""TOMATE CHERRY 250 GR"", ""MILANESA DE POLLO APANADA 320 G BRASSET"", ""EMPANADA CON CARNE TOASTATAS 12 UND 420 G..."", ""CHAMPIÑON 250 GR""]}",dataset/txt_limpios/801.txt,dataset/paginas_descargadas/801.html,EN,papa,keep,0.60,heuristic_default
802,PAPA CAPIRA X 2500 G,"Nombre del producto: Papa Capira Descripción del producto: Disfruta de la papa capira es una variedad de piel amarilla y textura firme, muy apreciada por su sabor y versatilidad en la cocina. Es ideal para freír, hervir, hornear o preparar guisos y sopas. Su tamaño uniforme y su excelente consistencia la hacen una opción práctica para todo tipo de recetas caseras o profesionales. Presentación: 2500g Modo de fabricación: Industrial Origen: Nacional Ver más También puede interesarte Nuevo PAPA CRIOLLA 1000G TOMATE CHONTO X 1000 G CEBOLLA CABEZONA X 1000G ZANAHORIA X 1000 G PLÁTANO X 1000G CEBOLLA ROJA X 1000 G PIMENTÓN UNIDAD LIMON TAHITI X 1000 GR CEBOLLA LARGA 500 GR ESPINACA X 200G",Unidades disponibles > 2500 G,2500.0,,,Desconocido,unknown,UNKNOWN,PAPA CAPIRA X 2500 G,Unidades disponibles,,2500 G,2500.00,,,2500,2500.0,False,original,2500.0,2500.0,1.0,default_1usd,,"Nombre del producto: Papa Capira Descripción del producto: Disfruta de la papa capira es una variedad de piel amarilla y textura firme, muy apreciada por su sabor y versatilidad en la cocina. Es ideal para freír, hervir, hornear o preparar guisos y sopas. Su tamaño uniforme y su excelente consistencia la hacen una opción práctica para todo tipo de recetas caseras o profesionales. Presentación: 2500g Modo de fabricación: Industrial Origen: Nacional Ver más También puede interesarte Nuevo PAPA CRIOLLA 1000G TOMATE CHONTO X 1000 G CEBOLLA CABEZONA X 1000G ZANAHORIA X 1000 G PLÁTANO X 1000G CEBOLLA ROJA X 1000 G PIMENTÓN UNIDAD LIMON TAHITI X 1000 GR CEBOLLA LARGA 500 GR ESPINACA X 200G",,,,,,"{""Descripción"": [""Nombre del producto: Papa Capira"", ""Descripción del producto: Disfruta de la papa capira es una variedad de piel amarilla y textura firme, muy apreciada por su sabor y versatilidad en la cocina. Es ideal para freír, hervir, hornear o preparar guisos y sopas. Su tamaño uniforme y su excelente consistencia la hacen una opción práctica para todo tipo de recetas caseras o profesionales."", ""Presentación: 2500g"", ""Modo de fabricación: Industrial"", ""Origen: Nacional"", ""Ver más"", ""También puede interesarte"", ""Nuevo"", ""PAPA CRIOLLA 1000G"", ""TOMATE CHONTO X 1000 G"", ""CEBOLLA CABEZONA X 1000G"", ""ZANAHORIA X 1000 G"", ""PLÁTANO X 1000G"", ""CEBOLLA ROJA X 1000 G"", ""PIMENTÓN UNIDAD"", ""LIMON TAHITI X 1000 GR"", ""CEBOLLA LARGA 500 GR"", ""ESPINACA X 200G""]}",dataset/txt_limpios/802.txt,dataset/paginas_descargadas/802.html,EN,cebolla,keep,0.60,heuristic_default
518,"Pasta Seca, Lista Y Rellenas",,Pastas Secas > 500g,990.0,,,Desconocido,unknown,UNKNOWN,"Pasta Seca, Lista Y Rellenas",Pastas Secas,,500g,990.00,,$,"$990,00",990.0,False,original,990.0,990.0,1.0,default_1usd,,,MARCA | : LUCCHETTI | Últimos consultados | NO ACUMULABLE CON OTRAS PROMOS | Azúcar AZUCEL 1kg | Ver planes de cuotas | Azúcar Organica Sugar Pot 800g | Azúcar Cristal Uniao 1kg | Azúcar La Perla 1 Kg | Azúcar Superior Real LEDESMA 1kg,,,,,"{""Características"": [""MARCA"", "": LUCCHETTI"", ""Últimos consultados"", ""NO ACUMULABLE CON OTRAS PROMOS"", ""Azúcar AZUCEL 1kg"", ""Ver planes de cuotas"", ""Azúcar Organica Sugar Pot 800g"", ""Azúcar Cristal Uniao 1kg"", ""Azúcar La Perla 1 Kg"", ""Azúcar Superior Real LEDESMA 1kg""]}",dataset/txt_limpios/518.txt,dataset/paginas_descargadas/518.html,EN,pasta seca,keep,0.60,heuristic_default
519,"Pasta Seca, Lista Y Rellenas",,Pastas Secas > 500g,975.0,,,Desconocido,unknown,UNKNOWN,"Pasta Seca, Lista Y Rellenas",Pastas Secas,,500g,975.00,,$,"$975,00",975.0,False,original,975.0,975.0,1.0,default_1usd,,,MARCA | : MATARAZZO | Últimos consultados | 35%DTO | Fideos Tallarin N5 Lucchetti 500g | PRECIO CON 35%DTO | Ver planes de cuotas | NO ACUMULABLE CON OTRAS PROMOS | Azúcar AZUCEL 1kg | Azúcar Organica Sugar Pot 800g | Azúcar Cristal Uniao 1kg | Azúcar La Perla 1 Kg,,,,,"{""Características"": [""MARCA"", "": MATARAZZO"", ""Últimos consultados"", ""35%DTO"", ""Fideos Tallarin N5 Lucchetti 500g"", ""PRECIO CON 35%DTO"", ""Ver planes de cuotas"", ""NO ACUMULABLE CON OTRAS PROMOS"", ""Azúcar AZUCEL 1kg"", ""Azúcar Organica Sugar Pot 800g"", ""Azúcar Cristal Uniao 1kg"", ""Azúcar La Perla 1 Kg""]}",dataset/txt_limpios/519.txt,dataset/paginas_descargadas/519.html,EN,pasta seca,keep,0.60,heuristic_default
520,"Pasta Seca, Lista Y Rellenas",,Pastas Secas > 500 GR,1137.5,,,Desconocido,unknown,UNKNOWN,"Pasta Seca, Lista Y Rellenas",Pastas Secas,,500 GR,1137.50,,$,"$1.137,50",1137.5,False,original,1137.5,1137.5,1.0,default_1usd,,,TIPO DE PASTA | : ESPAGUETI | MARCA | : BARILLA | AL HUEVO | : NO | RELLENA | TIPO DE ENVASE | : CAJA | PESO | : 500 GR | SIN TACC | Últimos consultados | 35%DTO | Fideos Tallarin N° 5 Matarazzo 500g | PRECIO CON 35%DTO | Ver planes de cuotas | Fideos Tallarin N5 Lucchetti 500g | NO ACUMULABLE CON OTRAS PROMOS | Azúcar AZUCEL 1kg | Azúcar Organica Sugar Pot 800g | Azúcar Cristal Uniao 1kg,,,,,"{""Características"": [""TIPO DE PASTA"", "": ESPAGUETI"", ""MARCA"", "": BARILLA"", ""AL HUEVO"", "": NO"", ""RELLENA"", ""TIPO DE ENVASE"", "": CAJA"", ""PESO"", "": 500 GR"", ""SIN TACC"", ""Últimos consultados"", ""35%DTO"", ""Fideos Tallarin N° 5 Matarazzo 500g"", ""PRECIO CON 35%DTO"", ""Ver planes de cuotas"", ""Fideos Tallarin N5 Lucchetti 500g"", ""NO ACUMULABLE CON OTRAS PROMOS"", ""Azúcar AZUCEL 1kg"", ""Azúcar Organica Sugar Pot 800g"", ""Azúcar Cristal Uniao 1kg""]}",dataset/txt_limpios/520.txt,dataset/paginas_descargadas/520.html,EN,pasta seca,keep,0.60,heuristic_default
521,"Pasta Seca, Lista Y Rellenas",,Pastas Secas > 500 Gr,4224.35,,,Desconocido,unknown,UNKNOWN,"Pasta Seca, Lista Y Rellenas",Pastas Secas,,500 Gr,4224.35,,$,"$4.224,35",4224.35,False,original,4224.35,4224.35,1.0,default_1usd,,,MARCA | : DELVERDE | SIN TACC | : NO | Últimos consultados | 35%DTO | Espagueti BARILLA Caja 500 Gr | PRECIO CON 35%DTO | Ver planes de cuotas | Fideos Tallarin N° 5 Matarazzo 500g | Fideos Tallarin N5 Lucchetti 500g | NO ACUMULABLE CON OTRAS PROMOS | Azúcar AZUCEL 1kg | Azúcar Organica Sugar Pot 800g,,,,,"{""Características"": [""MARCA"", "": DELVERDE"", ""SIN TACC"", "": NO"", ""Últimos consultados"", ""35%DTO"", ""Espagueti BARILLA Caja 500 Gr"", ""PRECIO CON 35%DTO"", ""Ver planes de cuotas"", ""Fideos Tallarin N° 5 Matarazzo 500g"", ""Fideos Tallarin N5 Lucchetti 500g"", ""NO ACUMULABLE CON OTRAS PROMOS"", ""Azúcar AZUCEL 1kg"", ""Azúcar Organica Sugar Pot 800g""]}",dataset/txt_limpios/521.txt,dataset/paginas_descargadas/521.html,EN,pasta seca,keep,0.60,heuristic_default
522,"Pasta Seca, Lista Y Rellenas",,Pastas Secas > 500 GR,4088.5,,,Desconocido,unknown,UNKNOWN,"Pasta Seca, Lista Y Rellenas",Pastas Secas,,500 GR,4088.50,,$,"$4.088,50",4088.5,False,original,4088.5,4088.5,1.0,default_1usd,,,TIPO DE PASTA | : ESPAGUETI | MARCA | : FAVORITA | AL HUEVO | : NO | RELLENA | PESO | : 500 GR | SIN TACC | Últimos consultados | 35%DTO | Fid.Lar.Sem Spaghetti Nuev Delverde Paq 500 Grm | PRECIO CON 35%DTO | Ver planes de cuotas | Espagueti BARILLA Caja 500 Gr | Fideos Tallarin N° 5 Matarazzo 500g | Fideos Tallarin N5 Lucchetti 500g | NO ACUMULABLE CON OTRAS PROMOS | Azúcar AZUCEL 1kg,,,,,"{""Características"": [""TIPO DE PASTA"", "": ESPAGUETI"", ""MARCA"", "": FAVORITA"", ""AL HUEVO"", "": NO"", ""RELLENA"", ""PESO"", "": 500 GR"", ""SIN TACC"", ""Últimos consultados"", ""35%DTO"", ""Fid.Lar.Sem Spaghetti Nuev Delverde Paq 500 Grm"", ""PRECIO CON 35%DTO"", ""Ver planes de cuotas"", ""Espagueti BARILLA Caja 500 Gr"", ""Fideos Tallarin N° 5 Matarazzo 500g"", ""Fideos Tallarin N5 Lucchetti 500g"", ""NO ACUMULABLE CON OTRAS PROMOS"", ""Azúcar AZUCEL 1kg""]}",dataset/txt_limpios/522.txt,dataset/paginas_descargadas/522.html,EN,pasta seca,keep,0.60,heuristic_default
926,Pasta spaghetti integral,Pasta spaghetti integral Carozzi 400 g,400 g > 400 g,950.0,,,Desconocido,unknown,UNKNOWN,Pasta spaghetti integral,400 g,,400 g,950.00,,$,$950,950.0,False,original,950.0,950.0,1.0,default_1usd,,Pasta spaghetti integral Carozzi 400 g,,,,,,"{""Descripción"": [""Pasta spaghetti integral Carozzi 400 g""]}",dataset/txt_limpios/926.txt,dataset/paginas_descargadas/926.html,EN,sin_categoria,discard,0.30,no_category_detected
923,Pasta spaghetti n°5,Pasta spaghetti N°5 Lucchetti 400 g,400 g > 400 g,680.0,,,Desconocido,unknown,UNKNOWN,Pasta spaghetti n°5,400 g,,400 g,680.00,,$,$680,680.0,False,original,680.0,680.0,1.0,default_1usd,,Pasta spaghetti N°5 Lucchetti 400 g,,,,,,"{""Descripción"": [""Pasta spaghetti N°5 Lucchetti 400 g""]}",dataset/txt_limpios/923.txt,dataset/paginas_descargadas/923.html,EN,sin_categoria,discard,0.30,no_category_detected
925,Pasta spaghetti n°5,Pasta spaghetti N°5 Merkat 400 g,400 g > 400 g,470.0,,,Desconocido,unknown,UNKNOWN,Pasta spaghetti n°5,400 g,,400 g,470.00,,$,$470,470.0,False,original,470.0,470.0,1.0,default_1usd,,Pasta spaghetti N°5 Merkat 400 g,,,,,,"{""Descripción"": [""Pasta spaghetti N°5 Merkat 400 g""]}",dataset/txt_limpios/925.txt,dataset/paginas_descargadas/925.html,EN,sin_categoria,discard,0.30,no_category_detected
924,Pasta spaghetti n°5 al huevo,Pasta spaghetti N°5 Talliani al huevo 400 g,400 g > 400 g,1.22,,,Desconocido,unknown,UNKNOWN,Pasta spaghetti n°5 al huevo,400 g,,400 g,1.22,,$,$1.22,1.22,False,original,1.22,1.22,1.0,default_1usd,,Pasta spaghetti N°5 Talliani al huevo 400 g,,,,,,"{""Descripción"": [""Pasta spaghetti N°5 Talliani al huevo 400 g""]}",dataset/txt_limpios/924.txt,dataset/paginas_descargadas/924.html,EN,huevo,discard,0.30,heuristic_default
910,Pechuga deshuesada de pollo co...,Pechuga deshuesada pollo iqf,4.5 Kg > 4.5 Kg,,,,Desconocido,unknown,UNKNOWN,Pechuga deshuesada de pollo co...,4.5 Kg,,4.5 Kg,,,,,234.19,True,country_mean,,234.1938,1.0,default_1usd,,Pechuga deshuesada pollo iqf,,,,,,"{""Descripción"": [""Pechuga deshuesada pollo iqf""]}",dataset/txt_limpios/910.txt,dataset/paginas_descargadas/910.html,EN,sin_categoria,discard,0.30,no_category_detected;price_parse_failed
1562,Pratos Prontos e Massas Frescas,,Massas Frescas > 500g,9.49,BRL,,Desconocido,unknown,BR,Pratos Prontos e Massas Frescas,Massas Frescas,,500g,9.49,BRL,R$,"R$9,49",9.49,False,original,1.7419,1.7419,5.448,from_brasil_cambio_dolar,,,,,,,,{},dataset/txt_limpios/1562.txt,dataset/paginas_descargadas/1562.html,EN,sin_categoria,discard,0.30,no_category_detected
203,Pratos Prontos e Massas Frescas,,Massas Frescas > 500g,10.79,BRL,,Desconocido,unknown,BR,Pratos Prontos e Massas Frescas,Massas Frescas,,500g,10.79,BRL,R$,"R$10,79",10.79,False,original,1.9805,1.9805,5.448,from_brasil_cambio_dolar,,,,,,,,{},dataset/txt_limpios/203.txt,dataset/paginas_descargadas/203.html,EN,sin_categoria,discard,0.30,no_category_detected
280,Preços no Site e App podem ser diferentes das Lojas Físicas.,,Shipping > 1 Kg,1.0,,,Desconocido,unknown,UNKNOWN,Preços no Site e App podem ser diferentes das Lojas Físicas.,Shipping,,1 Kg,1.00,,r,r1,1.0,False,original,1.0,1.0,1.0,default_1usd,,,,,,,,{},dataset/txt_limpios/280.txt,dataset/paginas_descargadas/280.html,EN,sin_categoria,discard,0.30,no_category_detected
281,Preços no Site e App podem ser diferentes das Lojas Físicas.,,Shipping > 2 Kg,15.99,BRL,,Desconocido,unknown,BR,Preços no Site e App podem ser diferentes das Lojas Físicas.,Shipping,,2 Kg,15.99,BRL,R$,"R$15,99",15.99,False,original,2.935,2.935,5.448,from_brasil_cambio_dolar,,,,,,,,{},dataset/txt_limpios/281.txt,dataset/paginas_descargadas/281.html,EN,sin_categoria,discard,0.30,no_category_detected
283,Preços no Site e App podem ser diferentes das Lojas Físicas.,,Shipping > 250 G,2.0,,,Desconocido,unknown,UNKNOWN,Preços no Site e App podem ser diferentes das Lojas Físicas.,Shipping,,250 G,2.00,,,02,2.0,False,original,2.0,2.0,1.0,default_1usd,,,,,,,,{},dataset/txt_limpios/283.txt,dataset/paginas_descargadas/283.html,EN,sin_categoria,discard,0.30,no_category_detected
284,Preços no Site e App podem ser diferentes das Lojas Físicas.,,Shipping > 250g,24.99,BRL,,Desconocido,unknown,BR,Preços no Site e App podem ser diferentes das Lojas Físicas.,Shipping,,250g,24.99,BRL,R$,"R$24,99",24.99,False,original,4.587,4.587,5.448,from_brasil_cambio_dolar,,,,,,,,{},dataset/txt_limpios/284.txt,dataset/paginas_descargadas/284.html,EN,sin_categoria,discard,0.30,no_category_detected
285,Preços no Site e App podem ser diferentes das Lojas Físicas.,,Shipping > 500 G,24.99,BRL,,Desconocido,unknown,BR,Preços no Site e App podem ser diferentes das Lojas Físicas.,Shipping,,500 G,24.99,BRL,R$,"R$24,99",24.99,False,original,4.587,4.587,5.448,from_brasil_cambio_dolar,,,,,,,,{},dataset/txt_limpios/285.txt,dataset/paginas_descargadas/285.html,EN,sin_categoria,discard,0.30,no_category_detected
286,Preços no Site e App podem ser diferentes das Lojas Físicas.,,Shipping > 10 Unidades,24.99,BRL,,Desconocido,unknown,BR,Preços no Site e App podem ser diferentes das Lojas Físicas.,Shipping,,10 Unidades,24.99,BRL,R$,"R$24,99",24.99,False,original,4.587,4.587,5.448,from_brasil_cambio_dolar,,,,,,,,{},dataset/txt_limpios/286.txt,dataset/paginas_descargadas/286.html,EN,sin_categoria,discard,0.30,no_category_detected
287,Preços no Site e App podem ser diferentes das Lojas Físicas.,,Shipping > 400g,24.99,BRL,,Desconocido,unknown,BR,Preços no Site e App podem ser diferentes das Lojas Físicas.,Shipping,,400g,24.99,BRL,R$,"R$24,99",24.99,False,original,4.587,4.587,5.448,from_brasil_cambio_dolar,,,,,,,,{},dataset/txt_limpios/287.txt,dataset/paginas_descargadas/287.html,EN,sin_categoria,discard,0.30,no_category_detected
289,Preços no Site e App podem ser diferentes das Lojas Físicas.,,Shipping > 400 G,400.0,,,Desconocido,unknown,UNKNOWN,Preços no Site e App podem ser diferentes das Lojas Físicas.,Shipping,,400 G,400.00,,r,r400,400.0,False,original,400.0,400.0,1.0,default_1usd,,,,,,,,{},dataset/txt_limpios/289.txt,dataset/paginas_descargadas/289.html,EN,sin_categoria,discard,0.30,no_category_detected
290,Preços no Site e App podem ser diferentes das Lojas Físicas.,,Shipping > 500 G,24.99,BRL,,Desconocido,unknown,BR,Preços no Site e App podem ser diferentes das Lojas Físicas.,Shipping,,500 G,24.99,BRL,R$,"R$24,99",24.99,False,original,4.587,4.587,5.448,from_brasil_cambio_dolar,,,,,,,,{},dataset/txt_limpios/290.txt,dataset/paginas_descargadas/290.html,EN,sin_categoria,discard,0.30,no_category_detected
292,Preços no Site e App podem ser diferentes das Lojas Físicas.,,Shipping > 350ML,24.99,BRL,,Desconocido,unknown,BR,Preços no Site e App podem ser diferentes das Lojas Físicas.,Shipping,,350ML,24.99,BRL,R$,"R$24,99",24.99,False,original,4.587,4.587,5.448,from_brasil_cambio_dolar,,,,,,,,{},dataset/txt_limpios/292.txt,dataset/paginas_descargadas/292.html,EN,sin_categoria,discard,0.30,no_category_detected
293,Preços no Site e App podem ser diferentes das Lojas Físicas.,,Shipping > 2 L,24.99,BRL,,Desconocido,unknown,BR,Preços no Site e App podem ser diferentes das Lojas Físicas.,Shipping,,2 L,24.99,BRL,R$,"R$24,99",24.99,False,original,4.587,4.587,5.448,from_brasil_cambio_dolar,,,,,,,,{},dataset/txt_limpios/293.txt,dataset/paginas_descargadas/293.html,EN,sin_categoria,discard,0.30,no_category_detected
294,Preços no Site e App podem ser diferentes das Lojas Físicas.,,Shipping > 255 Ml,29.99,BRL,,Desconocido,unknown,BR,Preços no Site e App podem ser diferentes das Lojas Físicas.,Shipping,,255 Ml,29.99,BRL,R$,"R$29,99",29.99,False,original,5.5048,5.5048,5.448,from_brasil_cambio_dolar,,,,,,,,{},dataset/txt_limpios/294.txt,dataset/paginas_descargadas/294.html,EN,sin_categoria,discard,0.30,no_category_detected
295,Preços no Site e App podem ser diferentes das Lojas Físicas.,,Shipping > 500 G,15.99,BRL,,Desconocido,unknown,BR,Preços no Site e App podem ser diferentes das Lojas Físicas.,Shipping,,500 G,15.99,BRL,R$,"R$15,99",15.99,False,original,2.935,2.935,5.448,from_brasil_cambio_dolar,,,,,,,,{},dataset/txt_limpios/295.txt,dataset/paginas_descargadas/295.html,EN,sin_categoria,discard,0.30,no_category_detected
303,Preços no Site e App podem ser diferentes das Lojas Físicas.,,Shipping > 1 Litro,9.99,BRL,,Desconocido,unknown,BR,Preços no Site e App podem ser diferentes das Lojas Físicas.,Shipping,,1 Litro,9.99,BRL,R$,"R$9,99",9.99,False,original,1.8337,1.8337,5.448,from_brasil_cambio_dolar,,,,,,,,{},dataset/txt_limpios/303.txt,dataset/paginas_descargadas/303.html,EN,sin_categoria,discard,0.30,no_category_detected
307,Preços no Site e App podem ser diferentes das Lojas Físicas.,,Shipping > 600 Ml,24.99,BRL,,Desconocido,unknown,BR,Preços no Site e App podem ser diferentes das Lojas Físicas.,Shipping,,600 Ml,24.99,BRL,R$,"R$24,99",24.99,False,original,4.587,4.587,5.448,from_brasil_cambio_dolar,,,,,,,,{},dataset/txt_limpios/307.txt,dataset/paginas_descargadas/307.html,EN,sin_categoria,discard,0.30,no_category_detected
308,Preços no Site e App podem ser diferentes das Lojas Físicas.,,Shipping > 350 Ml,24.99,BRL,,Desconocido,unknown,BR,Preços no Site e App podem ser diferentes das Lojas Físicas.,Shipping,,350 Ml,24.99,BRL,R$,"R$24,99",24.99,False,original,4.587,4.587,5.448,from_brasil_cambio_dolar,,,,,,,,{},dataset/txt_limpios/308.txt,dataset/paginas_descargadas/308.html,EN,sin_categoria,discard,0.30,no_category_detected
