source_id,title,description,breadcrumbs,price_raw,currency_raw,url,seller,availability,country,product_name,brand,reference,unit,price_amount,price_currency,price_symbol,price_text,price_amount_filled,price_is_imputed,price_imputation_source,price_amount_usd,price_amount_usd_filled,fx_rate_local_per_usd,fx_source,information_text,description_text,features_text,specifications_text,benefits_text,details_text,other_sections,sections,txt_path,html_path,es_status,category_canonical,decision,match_score,reasons
309,Preços no Site e App podem ser diferentes das Lojas Físicas.,,Shipping > 750 G,21.99,BRL,,Desconocido,unknown,BR,Preços no Site e App podem ser diferentes das Lojas Físicas.,Shipping,,750 G,21.99,BRL,R$,"R$21,99",21.99,False,original,4.0363,4.0363,5.448,from_brasil_cambio_dolar,,,,,,,,{},dataset/txt_limpios/309.txt,dataset/paginas_descargadas/309.html,EN,sin_categoria,discard,0.30,no_category_detected
310,Preços no Site e App podem ser diferentes das Lojas Físicas.,,Shipping > 750g,21.99,BRL,,Desconocido,unknown,BR,Preços no Site e App podem ser diferentes das Lojas Físicas.,Shipping,,750g,21.99,BRL,R$,"R$21,99",21.99,False,original,4.0363,4.0363,5.448,from_brasil_cambio_dolar,,,,,,,,{},dataset/txt_limpios/310.txt,dataset/paginas_descargadas/310.html,EN,sin_categoria,discard,0.30,no_category_detected
311,Preços no Site e App podem ser diferentes das Lojas Físicas.,,Shipping > 300g,15.99,BRL,,Desconocido,unknown,BR,Preços no Site e App podem ser diferentes das Lojas Físicas.,Shipping,,300g,15.99,BRL,R$,"R$15,99",15.99,False,original,2.935,2.935,5.448,from_brasil_cambio_dolar,,,,,,,,{},dataset/txt_limpios/311.txt,dataset/paginas_descargadas/311.html,EN,sin_categoria,discard,0.30,no_category_detected
312,Preços no Site e App podem ser diferentes das Lojas Físicas.,,Shipping > 750 G,21.99,BRL,,Desconocido,unknown,BR,Preços no Site e App podem ser diferentes das Lojas Físicas.,Shipping,,750 G,21.99,BRL,R$,"R$21,99",21.99,False,original,4.0363,4.0363,5.448,from_brasil_cambio_dolar,,,,,,,,{},dataset/txt_limpios/312.txt,dataset/paginas_descargadas/312.html,EN,sin_categoria,discard,0.30,no_category_detected
313,Preços no Site e App podem ser diferentes das Lojas Físicas.,,Shipping > 1kg,15.99,BRL,,Desconocido,unknown,BR,Preços no Site e App podem ser diferentes das Lojas Físicas.,Shipping,,1kg,15.99,BRL,R$,"R$15,99",15.99,False,original,2.935,2.935,5.448,from_brasil_cambio_dolar,,,,,,,,{},dataset/txt_limpios/313.txt,dataset/paginas_descargadas/313.html,EN,sin_categoria,discard,0.30,no_category_detected
314,Preços no Site e App podem ser diferentes das Lojas Físicas.,,Shipping > 1 Kg,36.99,BRL,,Desconocido,unknown,BR,Preços no Site e App podem ser diferentes das Lojas Físicas.,Shipping,,1 Kg,36.99,BRL,R$,"R$36,99",36.99,False,original,6.7896,6.7896,5.448,from_brasil_cambio_dolar,,,,,,,,{},dataset/txt_limpios/314.txt,dataset/paginas_descargadas/314.html,EN,sin_categoria,discard,0.30,no_category_detected
318,Preços no Site e App podem ser diferentes das Lojas Físicas.,,Shipping > 1 Kg,1.0,,,Desconocido,unknown,UNKNOWN,Preços no Site e App podem ser diferentes das Lojas Físicas.,Shipping,,1 Kg,1.00,,r,r1,1.0,False,original,1.0,1.0,1.0,default_1usd,,,,,,,,{},dataset/txt_limpios/318.txt,dataset/paginas_descargadas/318.html,EN,sin_categoria,discard,0.30,no_category_detected
319,Preços no Site e App podem ser diferentes das Lojas Físicas.,,Shipping > 1 Kg,15.99,BRL,,Desconocido,unknown,BR,Preços no Site e App podem ser diferentes das Lojas Físicas.,Shipping,,1 Kg,15.99,BRL,R$,"R$15,99",15.99,False,original,2.935,2.935,5.448,from_brasil_cambio_dolar,,,,,,,,{},dataset/txt_limpios/319.txt,dataset/paginas_descargadas/319.html,EN,sin_categoria,discard,0.30,no_category_detected
321,Preços no Site e App podem ser diferentes das Lojas Físicas.,,Shipping > 250 G,15.99,BRL,,Desconocido,unknown,BR,Preços no Site e App podem ser diferentes das Lojas Físicas.,Shipping,,250 G,15.99,BRL,R$,"R$15,99",15.99,False,original,2.935,2.935,5.448,from_brasil_cambio_dolar,,,,,,,,{},dataset/txt_limpios/321.txt,dataset/paginas_descargadas/321.html,EN,sin_categoria,discard,0.30,no_category_detected
322,Preços no Site e App podem ser diferentes das Lojas Físicas.,,Shipping > 450g,15.99,BRL,,Desconocido,unknown,BR,Preços no Site e App podem ser diferentes das Lojas Físicas.,Shipping,,450g,15.99,BRL,R$,"R$15,99",15.99,False,original,2.935,2.935,5.448,from_brasil_cambio_dolar,,,,,,,,{},dataset/txt_limpios/322.txt,dataset/paginas_descargadas/322.html,EN,sin_categoria,discard,0.30,no_category_detected
631,Producto no disponible,,Enviar,,,,Desconocido,unknown,UNKNOWN,Producto no disponible,Enviar,,,,,,,234.19,True,country_mean,,234.1938,1.0,default_1usd,,,,,,,,{},dataset/txt_limpios/631.txt,dataset/paginas_descargadas/631.html,EN,sin_categoria,discard,0.30,no_category_detected;price_parse_failed
642,Producto no disponible,,Enviar > 500 gr,500.0,,,Desconocido,unknown,UNKNOWN,Producto no disponible,Enviar,,500 gr,500.00,,,500,500.0,False,original,500.0,500.0,1.0,default_1usd,,,,,,,,{},dataset/txt_limpios/642.txt,dataset/paginas_descargadas/642.html,EN,sin_categoria,discard,0.30,no_category_detected
648,Producto no disponible,,Enviar,1000.0,,,Desconocido,unknown,UNKNOWN,Producto no disponible,Enviar,,,1000.00,,,1000,1000.0,False,original,1000.0,1000.0,1.0,default_1usd,,,,,,,,{},dataset/txt_limpios/648.txt,dataset/paginas_descargadas/648.html,EN,sin_categoria,discard,0.30,no_category_detected
651,Producto no disponible,,Enviar,7.0,,,Desconocido,unknown,UNKNOWN,Producto no disponible,Enviar,,,7.00,,,7,7.0,False,original,7.0,7.0,1.0,default_1usd,,,,,,,,{},dataset/txt_limpios/651.txt,dataset/paginas_descargadas/651.html,EN,sin_categoria,discard,0.30,no_category_detected
751,Producto no disponible,,Enviar,,,,Desconocido,unknown,UNKNOWN,Producto no disponible,Enviar,,,,,,,234.19,True,country_mean,,234.1938,1.0,default_1usd,,,,,,,,{},dataset/txt_limpios/751.txt,dataset/paginas_descargadas/751.html,EN,sin_categoria,discard,0.30,no_category_detected;price_parse_failed
761,Producto no disponible,,Enviar,,,,Desconocido,unknown,UNKNOWN,Producto no disponible,Enviar,,,,,,,234.19,True,country_mean,,234.1938,1.0,default_1usd,,,,,,,,{},dataset/txt_limpios/761.txt,dataset/paginas_descargadas/761.html,EN,sin_categoria,discard,0.30,no_category_detected;price_parse_failed
762,Producto no disponible,,Enviar,,,,Desconocido,unknown,UNKNOWN,Producto no disponible,Enviar,,,,,,,234.19,True,country_mean,,234.1938,1.0,default_1usd,,,,,,,,{},dataset/txt_limpios/762.txt,dataset/paginas_descargadas/762.html,EN,sin_categoria,discard,0.30,no_category_detected;price_parse_failed
770,Producto no disponible,,Enviar,,,,Desconocido,unknown,UNKNOWN,Producto no disponible,Enviar,,,,,,,234.19,True,country_mean,,234.1938,1.0,default_1usd,,,,,,,,{},dataset/txt_limpios/770.txt,dataset/paginas_descargadas/770.html,EN,sin_categoria,discard,0.30,no_category_detected;price_parse_failed
776,Producto no disponible,,Enviar > 500 gr,500.0,,,Desconocido,unknown,UNKNOWN,Producto no disponible,Enviar,,500 gr,500.00,,,500,500.0,False,original,500.0,500.0,1.0,default_1usd,,,,,,,,{},dataset/txt_limpios/776.txt,dataset/paginas_descargadas/776.html,EN,sin_categoria,discard,0.30,no_category_detected
782,Producto no disponible,,Enviar,400.0,,,Desconocido,unknown,UNKNOWN,Producto no disponible,Enviar,,,400.00,,,400,400.0,False,original,400.0,400.0,1.0,default_1usd,,,,,,,,{},dataset/txt_limpios/782.txt,dataset/paginas_descargadas/782.html,EN,sin_categoria,discard,0.30,no_category_detected
787,Producto no disponible,,Enviar,,,,Desconocido,unknown,UNKNOWN,Producto no disponible,Enviar,,,,,,,234.19,True,country_mean,,234.1938,1.0,default_1usd,,,,,,,,{},dataset/txt_limpios/787.txt,dataset/paginas_descargadas/787.html,EN,sin_categoria,discard,0.30,no_category_detected;price_parse_failed
1598,Página não encontrada,,Voltar à Home,,,,Desconocido,unknown,UNKNOWN,Página não encontrada,Voltar à Home,,,,,,,234.19,True,country_mean,,234.1938,1.0,default_1usd,,,,,,,,{},dataset/txt_limpios/1598.txt,dataset/paginas_descargadas/1598.html,EN,sin_categoria,discard,0.30,no_category_detected;price_parse_failed
222,Página não encontrada,,Voltar à Home,,,,Desconocido,unknown,UNKNOWN,Página não encontrada,Voltar à Home,,,,,,,234.19,True,country_mean,,234.1938,1.0,default_1usd,,,,,,,,{},dataset/txt_limpios/222.txt,dataset/paginas_descargadas/222.html,EN,sin_categoria,discard,0.30,no_category_detected;price_parse_failed
804,QUESITO ALPINA 185 G,"Ingredientes | Componentes Descripción del producto: Disfruta del delicioso Quesito Alpina, un queso fresco, blando y semigraso, ideal para acompañar tus comidas o consumir directamente del envase. Tamaño: 11.5 cm x 4 cm Peso: 185 g Modo de fabricación: Industrial Origen: Nacional RSA-005113-2018 Alergenos: Puede contener leche Componentes: Leche Cultivos lácticos Sal Ver más También puede interesarte YOX SURTIDO FRESA Y MELOCOTÓN ALPINA 4 UND - 40... SIXPACK CHEESE STICK VITA LATTI 180GR TOMATE CHERRY 250 GR JAMÓN PIETRÁN ESTANDAR 230G",Unidades disponibles > 185 G,185.0,,,Desconocido,unknown,UNKNOWN,QUESITO ALPINA 185 G,Unidades disponibles,,185 G,185.00,,,185,185.0,False,original,185.0,185.0,1.0,default_1usd,,"Ingredientes | Componentes Descripción del producto: Disfruta del delicioso Quesito Alpina, un queso fresco, blando y semigraso, ideal para acompañar tus comidas o consumir directamente del envase. Tamaño: 11.5 cm x 4 cm Peso: 185 g Modo de fabricación: Industrial Origen: Nacional RSA-005113-2018 Alergenos: Puede contener leche Componentes: Leche Cultivos lácticos Sal Ver más También puede interesarte YOX SURTIDO FRESA Y MELOCOTÓN ALPINA 4 UND - 40... SIXPACK CHEESE STICK VITA LATTI 180GR TOMATE CHERRY 250 GR JAMÓN PIETRÁN ESTANDAR 230G",,,,,,"{""Descripción"": [""Ingredientes | Componentes"", ""Descripción del producto: Disfruta del delicioso Quesito Alpina, un queso fresco, blando y semigraso, ideal para acompañar tus comidas o consumir directamente del envase."", ""Tamaño: 11.5 cm x 4 cm"", ""Peso: 185 g"", ""Modo de fabricación: Industrial"", ""Origen: Nacional"", ""RSA-005113-2018"", ""Alergenos: Puede contener leche"", ""Componentes: Leche"", ""Cultivos lácticos"", ""Sal"", ""Ver más"", ""También puede interesarte"", ""YOX SURTIDO FRESA Y MELOCOTÓN ALPINA 4 UND - 40..."", ""SIXPACK CHEESE STICK VITA LATTI 180GR"", ""TOMATE CHERRY 250 GR"", ""JAMÓN PIETRÁN ESTANDAR 230G""]}",dataset/txt_limpios/804.txt,dataset/paginas_descargadas/804.html,EN,leche,keep,0.60,heuristic_default
1364,QUESO FRESCO LUCILITA 250 G,Ficha técnica ¿Deseas recibir notificaciones? Remind me later Permitir Thank you! Please check your email inbox to confirm. ¡Oops! Notifications are disabled.,Comparar > 250 G,250.0,USD,,Desconocido,unknown,US,QUESO FRESCO LUCILITA 250 G,Comparar,,250 G,250.00,USD,,250,250.0,False,original,250.0,250.0,1.0,default_1usd,Ficha técnica ¿Deseas recibir notificaciones? Remind me later Permitir Thank you! Please check your email inbox to confirm. ¡Oops! Notifications are disabled.,,,,,,,"{""Información"": [""Ficha técnica"", ""¿Deseas recibir notificaciones?"", ""Remind me later"", ""Permitir"", ""Thank you! Please check your email inbox to confirm."", ""Oops! Notifications are disabled.""]}",dataset/txt_limpios/1364.txt,dataset/paginas_descargadas/1364.html,ET,sin_categoria,discard,0.30,no_category_detected
1361,QUESO FRESCO NANDITO 500 G,¿Deseas recibir notificaciones? Remind me later Permitir Thank you! Please check your email inbox to confirm. Oops! Notifications are disabled.,Comparar > 500 G,500.0,USD,,Desconocido,unknown,US,QUESO FRESCO NANDITO 500 G,Comparar,,500 G,500.00,USD,,500,500.0,False,original,500.0,500.0,1.0,default_1usd,¿Deseas recibir notificaciones? Remind me later Permitir Thank you! Please check your email inbox to confirm. Oops! Notifications are disabled.,,,,,,,"{""Información"": [""¿Deseas recibir notificaciones?"", ""Remind me later"", ""Permitir"", ""Thank you! Please check your email inbox to confirm."", ""Oops! Notifications are disabled.""]}",dataset/txt_limpios/1361.txt,dataset/paginas_descargadas/1361.html,EN,sin_categoria,discard,0.30,no_category_detected
1362,QUESO FRESCO REYQUESO 700 G,¿Deseas recibir notificaciones? Remind me later Permitir Thank you! Please check your email inbox to confirm. Oops! Notifications are disabled.,Comparar > 700 G,700.0,USD,,Desconocido,unknown,US,QUESO FRESCO REYQUESO 700 G,Comparar,,700 G,700.00,USD,,700,700.0,False,original,700.0,700.0,1.0,default_1usd,¿Deseas recibir notificaciones? Remind me later Permitir Thank you! Please check your email inbox to confirm. Oops! Notifications are disabled.,,,,,,,"{""Información"": [""¿Deseas recibir notificaciones?"", ""Remind me later"", ""Permitir"", ""Thank you! Please check your email inbox to confirm."", ""Oops! Notifications are disabled.""]}",dataset/txt_limpios/1362.txt,dataset/paginas_descargadas/1362.html,EN,sin_categoria,discard,0.30,no_category_detected
803,QUESO MOZZARELLA TAJADO X 250G LATTI,Ingredientes | Componentes Tamaño: 12.8 cm x 12.5 cm x 4 cm Peso: 250 g Modo de fabricación: Industrial Origen: Nacional RSA-006514-2018 Alergenos: Contiene leche y productos lácteos. Componentes: Leche pasteurizada parcialmente descremada Sal Cultivos de quesos Enzimas Palmitato de vitamina A Ver más También puede interesarte Tratamiento de Datos Garantías Términos y condiciones Superintendencia de Industria y Comercio – SIC 0.17.168-hotfix-2.,Unidades disponibles > 250G,250.0,,,Desconocido,unknown,UNKNOWN,QUESO MOZZARELLA TAJADO X 250G LATTI,Unidades disponibles,,250G,250.00,,,250,250.0,False,original,250.0,250.0,1.0,default_1usd,,Ingredientes | Componentes Tamaño: 12.8 cm x 12.5 cm x 4 cm Peso: 250 g Modo de fabricación: Industrial Origen: Nacional RSA-006514-2018 Alergenos: Contiene leche y productos lácteos. Componentes: Leche pasteurizada parcialmente descremada Sal Cultivos de quesos Enzimas Palmitato de vitamina A Ver más También puede interesarte Tratamiento de Datos Garantías Términos y condiciones Superintendencia de Industria y Comercio – SIC 0.17.168-hotfix-2.,,,,,,"{""Descripción"": [""Ingredientes | Componentes"", ""Tamaño: 12.8 cm x 12.5 cm x 4 cm"", ""Peso: 250 g"", ""Modo de fabricación: Industrial"", ""Origen: Nacional"", ""RSA-006514-2018"", ""Alergenos: Contiene leche y productos lácteos."", ""Componentes: Leche pasteurizada parcialmente descremada"", ""Sal"", ""Cultivos de quesos"", ""Enzimas"", ""Palmitato de vitamina A"", ""Ver más"", ""También puede interesarte"", ""Tratamiento de Datos"", ""Garantías"", ""Términos y condiciones"", ""Superintendencia de Industria y Comercio – SIC"", ""0.17.168-hotfix-2.""]}",dataset/txt_limpios/803.txt,dataset/paginas_descargadas/803.html,EN,descartado,discard,0.10,excluded_keyword
532,Queso Semiduro,,Danbo > 1kg,1.0,,,Desconocido,unknown,UNKNOWN,Queso Semiduro,Danbo,,1kg,1.00,,,1,1.0,False,original,1.0,1.0,1.0,default_1usd,,,MARCA | : LAS TRES NIÑAS | Últimos consultados | Ver planes de cuotas | Queso Cremoso PUNTA DEL AGUA X Kg | NO ACUMULABLE CON OTRAS PROMOS | Queso Cremoso Fraccionado LA PAULINA Xkg | OFERTA | Huevo Color Libre Jaula CARNAVE 6 Uni,,,,,"{""Características"": [""MARCA"", "": LAS TRES NIÑAS"", ""Últimos consultados"", ""Ver planes de cuotas"", ""Queso Cremoso PUNTA DEL AGUA X Kg"", ""NO ACUMULABLE CON OTRAS PROMOS"", ""Queso Cremoso Fraccionado LA PAULINA Xkg"", ""OFERTA"", ""Huevo Color Libre Jaula CARNAVE 6 Uni""]}",dataset/txt_limpios/532.txt,dataset/paginas_descargadas/532.html,EN,sin_categoria,discard,0.30,no_category_detected
528,Quesos Blandos,,Queso Muzzarella > 500g,500.0,,,Desconocido,unknown,UNKNOWN,Quesos Blandos,Queso Muzzarella,,500g,500.00,,,500,500.0,False,original,500.0,500.0,1.0,default_1usd,,,MARCA | : LA SERENISIMA | SIN TACC | : SI | Últimos consultados | Huevo Color Libre Jaula CARNAVE 6 Uni | Ver planes de cuotas | 20%DTO | Huevo Blanco Grande 6u | PRECIO CON 20%DTO | 15%DTO | Huevo Blanco . Coto Bli 12 Uni | PRECIO CON 15%DTO | Huevo Blanco Extra 12u | 35%DTO | Espagueti FAVORITA      500 Gr | PRECIO CON 35%DTO,,,,,"{""Características"": [""MARCA"", "": LA SERENISIMA"", ""SIN TACC"", "": SI"", ""Últimos consultados"", ""Huevo Color Libre Jaula CARNAVE 6 Uni"", ""Ver planes de cuotas"", ""20%DTO"", ""Huevo Blanco Grande 6u"", ""PRECIO CON 20%DTO"", ""15%DTO"", ""Huevo Blanco . Coto Bli 12 Uni"", ""PRECIO CON 15%DTO"", ""Huevo Blanco Extra 12u"", ""35%DTO"", ""Espagueti FAVORITA      500 Gr"", ""PRECIO CON 35%DTO""]}",dataset/txt_limpios/528.txt,dataset/paginas_descargadas/528.html,EN,sin_categoria,discard,0.30,no_category_detected
529,Quesos Blandos,,Queso Cremoso > 500g,500.0,,,Desconocido,unknown,UNKNOWN,Quesos Blandos,Queso Cremoso,,500g,500.00,,,500,500.0,False,original,500.0,500.0,1.0,default_1usd,,,MARCA | : LA PAULINA | SIN TACC | : NO | Últimos consultados | Ver planes de cuotas | Huevo Color Libre Jaula CARNAVE 6 Uni | 20%DTO | Huevo Blanco Grande 6u | PRECIO CON 20%DTO | 15%DTO | Huevo Blanco . Coto Bli 12 Uni | PRECIO CON 15%DTO | Huevo Blanco Extra 12u,,,,,"{""Características"": [""MARCA"", "": LA PAULINA"", ""SIN TACC"", "": NO"", ""Últimos consultados"", ""Ver planes de cuotas"", ""Huevo Color Libre Jaula CARNAVE 6 Uni"", ""20%DTO"", ""Huevo Blanco Grande 6u"", ""PRECIO CON 20%DTO"", ""15%DTO"", ""Huevo Blanco . Coto Bli 12 Uni"", ""PRECIO CON 15%DTO"", ""Huevo Blanco Extra 12u""]}",dataset/txt_limpios/529.txt,dataset/paginas_descargadas/529.html,EN,sin_categoria,discard,0.30,no_category_detected
530,Quesos Blandos,,Queso Cremoso > 500g,8999.0,,,Desconocido,unknown,UNKNOWN,Quesos Blandos,Queso Cremoso,,500g,8999.00,,$,"$8.999,00",8999.0,False,original,8999.0,8999.0,1.0,default_1usd,,,MARCA | : PUNTA DEL AGUA | SIN TACC | : SI | ORIGEN | : ARGENTINA | Últimos consultados | NO ACUMULABLE CON OTRAS PROMOS | Queso Cremoso Fraccionado LA PAULINA Xkg | OFERTA | Ver planes de cuotas | Huevo Color Libre Jaula CARNAVE 6 Uni | 20%DTO | Huevo Blanco Grande 6u | PRECIO CON 20%DTO | 15%DTO | Huevo Blanco . Coto Bli 12 Uni | PRECIO CON 15%DTO,,,,,"{""Características"": [""MARCA"", "": PUNTA DEL AGUA"", ""SIN TACC"", "": SI"", ""ORIGEN"", "": ARGENTINA"", ""Últimos consultados"", ""NO ACUMULABLE CON OTRAS PROMOS"", ""Queso Cremoso Fraccionado LA PAULINA Xkg"", ""OFERTA"", ""Ver planes de cuotas"", ""Huevo Color Libre Jaula CARNAVE 6 Uni"", ""20%DTO"", ""Huevo Blanco Grande 6u"", ""PRECIO CON 20%DTO"", ""15%DTO"", ""Huevo Blanco . Coto Bli 12 Uni"", ""PRECIO CON 15%DTO""]}",dataset/txt_limpios/530.txt,dataset/paginas_descargadas/530.html,EN,sin_categoria,discard,0.30,no_category_detected
531,Quesos Blandos,,Queso Muzzarella > 170g,170.0,,,Desconocido,unknown,UNKNOWN,Quesos Blandos,Queso Muzzarella,,170g,170.00,,,170,170.0,False,original,170.0,170.0,1.0,default_1usd,,,MARCA | : DOÑA AURORA | SIN TACC | : SI | Últimos consultados | Queso Cremoso PUNTA DEL AGUA X Kg | Ver planes de cuotas | NO ACUMULABLE CON OTRAS PROMOS | Queso Cremoso Fraccionado LA PAULINA Xkg | OFERTA | Huevo Color Libre Jaula CARNAVE 6 Uni | 20%DTO | Huevo Blanco Grande 6u | PRECIO CON 20%DTO,,,,,"{""Características"": [""MARCA"", "": DOÑA AURORA"", ""SIN TACC"", "": SI"", ""Últimos consultados"", ""Queso Cremoso PUNTA DEL AGUA X Kg"", ""Ver planes de cuotas"", ""NO ACUMULABLE CON OTRAS PROMOS"", ""Queso Cremoso Fraccionado LA PAULINA Xkg"", ""OFERTA"", ""Huevo Color Libre Jaula CARNAVE 6 Uni"", ""20%DTO"", ""Huevo Blanco Grande 6u"", ""PRECIO CON 20%DTO""]}",dataset/txt_limpios/531.txt,dataset/paginas_descargadas/531.html,EN,sin_categoria,discard,0.30,no_category_detected
1572,Refrigerante Coca-Cola Garrafa 2 L,,"R$ 10,99 > 2 L",10.99,BRL,,Desconocido,unknown,BR,Refrigerante Coca-Cola Garrafa 2 L,"R$ 10,99",,2 L,10.99,BRL,R$,"R$10,99",10.99,False,original,2.0173,2.0173,5.448,from_brasil_cambio_dolar,,,,,,,,{},dataset/txt_limpios/1572.txt,dataset/paginas_descargadas/1572.html,EN,sin_categoria,discard,0.30,no_category_detected
195,Refrigerante Coca-Cola Garrafa 2 L,,"R$ 11,49 > 2 L",11.49,BRL,,Desconocido,unknown,BR,Refrigerante Coca-Cola Garrafa 2 L,"R$ 11,49",,2 L,11.49,BRL,R$,"R$11,49",11.49,False,original,2.109,2.109,5.448,from_brasil_cambio_dolar,,,,,,,,{},dataset/txt_limpios/195.txt,dataset/paginas_descargadas/195.html,EN,sin_categoria,discard,0.30,no_category_detected
1585,Refrigerante Fanta Laranja 2L,,"R$ 9,69 > 2L",9.69,BRL,,Desconocido,unknown,BR,Refrigerante Fanta Laranja 2L,"R$ 9,69",,2L,9.69,BRL,R$,"R$9,69",9.69,False,original,1.7786,1.7786,5.448,from_brasil_cambio_dolar,,,,,,,,{},dataset/txt_limpios/1585.txt,dataset/paginas_descargadas/1585.html,EN,sin_categoria,discard,0.30,no_category_detected
199,Refrigerante Fanta Laranja 2L,,"R$ 9,69 > 2L",9.69,BRL,,Desconocido,unknown,BR,Refrigerante Fanta Laranja 2L,"R$ 9,69",,2L,9.69,BRL,R$,"R$9,69",9.69,False,original,1.7786,1.7786,5.448,from_brasil_cambio_dolar,,,,,,,,{},dataset/txt_limpios/199.txt,dataset/paginas_descargadas/199.html,EN,sin_categoria,discard,0.30,no_category_detected
1746,Refrigerante Kuat Guaraná 2L,,"R$ 6,69 > 2L",6.69,BRL,,Desconocido,unknown,BR,Refrigerante Kuat Guaraná 2L,"R$ 6,69",,2L,6.69,BRL,R$,"R$6,69",6.69,False,original,1.228,1.228,5.448,from_brasil_cambio_dolar,,,,,,,,{},dataset/txt_limpios/1746.txt,dataset/paginas_descargadas/1746.html,EN,sin_categoria,discard,0.30,no_category_detected
198,Refrigerante Kuat Guaraná 2L,,"R$ 6,69 > 2L",6.69,BRL,,Desconocido,unknown,BR,Refrigerante Kuat Guaraná 2L,"R$ 6,69",,2L,6.69,BRL,R$,"R$6,69",6.69,False,original,1.228,1.228,5.448,from_brasil_cambio_dolar,,,,,,,,{},dataset/txt_limpios/198.txt,dataset/paginas_descargadas/198.html,EN,sin_categoria,discard,0.30,no_category_detected
