source_id,title,description,breadcrumbs,price_raw,currency_raw,url,seller,availability,country,product_name,brand,reference,unit,price_amount,price_currency,price_symbol,price_text,price_amount_filled,price_is_imputed,price_imputation_source,price_amount_usd,price_amount_usd_filled,fx_rate_local_per_usd,fx_source,information_text,description_text,features_text,specifications_text,benefits_text,details_text,other_sections,sections,txt_path,html_path,es_status,category_canonical,decision,match_score,reasons
1042,colaborar con nuestros estudios para marketing. También puede configurarlas.,"Descripción del producto Importante destacar Pan empacado Ideal para los desayunos y sándwiches Conservar en lugar fresco y seco PAN DE LA CASA Y PAN ENVASADO ¡Disfruta de los mejores insumos de la página online de plaza! ¡Mira! Ingresando la sección de Panadería, Pastelería y Comidas podrás elegir entre una variedad de deliciosos productos, todos elaborados por expertos en la cocina. Ingresa la web de y déjate atrapar por todo nuestro surtido de y Pan de la Casa , ideales para esos momentos especiales en familia, celebraciones, simplemente darte un gustito al día. Tenemos presentaciones de pan a granel, bollería fina pan pita y árabe, además de pan relleno tanto dulce como salado para brindarte una mayor diversidad de opciones. ¡Conoce la mejor variedad de Pan Envasado y Pan de la Casa en plazaVea Online! ¿En qué búsqueda? Encuentra más Pan Envasado y Pan de la casa en plazaVea En caso de que algo te guste: Puedes revisar nuestras Políticas de cambios y/o devoluciones y hacerlas efectivas en todas nuestras tiendas. Productos que te pueden interesar Recomendado para ti",que podemos ofrecer. > 600g,16.92,PEN,,Desconocido,unknown,PE,colaborar con nuestros estudios para marketing. También puede configurarlas.,que podemos ofrecer.,,600g,16.92,PEN,S/,S/16.92,16.92,False,original,4.7662,4.7662,3.55,from_peru_cambio_dolar,,"Descripción del producto Importante destacar Pan empacado Ideal para los desayunos y sándwiches Conservar en lugar fresco y seco PAN DE LA CASA Y PAN ENVASADO ¡Disfruta de los mejores insumos de la página online de plaza! ¡Mira! Ingresando la sección de Panadería, Pastelería y Comidas podrás elegir entre una variedad de deliciosos productos, todos elaborados por expertos en la cocina. Ingresa la web de y déjate atrapar por todo nuestro surtido de y Pan de la Casa , ideales para esos momentos especiales en familia, celebraciones, simplemente darte un gustito al día. Tenemos presentaciones de pan a granel, bollería fina pan pita y árabe, además de pan relleno tanto dulce como salado para brindarte una mayor diversidad de opciones. ¡Conoce la mejor variedad de Pan Envasado y Pan de la Casa en plazaVea Online! ¿En qué búsqueda? Encuentra más Pan Envasado y Pan de la casa en plazaVea En caso de que algo te guste: Puedes revisar nuestras Políticas de cambios y/o devoluciones y hacerlas efectivas en todas nuestras tiendas. Productos que te pueden interesar Recomendado para ti",,,,,,"{""Descripción"": [""Descripción del producto"", ""Importante destacar"", ""Pan empacado"", ""Ideal para los desayunos y sándwiches"", ""Conservar en lugar fresco y seco"", ""PAN DE LA CASA Y PAN ENVASADO"", ""¡Disfruta de los mejores insumos de"", ""en la página online de plaza ¡Mira! Ingresando la sección de"", ""Panadería, Pastelería y Comidas"", ""podrás elegir entre una variedad de deliciosos productos, todos elaborados por expertos en la cocina."", ""Ingresa a la web de"", ""y déjate atrapar por todo nuestro sordo"", ""y"", ""Pan de la Casa"", "", ideales para esos momentos especiales en familia, celebraciones, el simplemente darte un gustito al día. Tenemos presentaciones"", ""pan a granel"", "","", ""bollería fina"", ""pan pita y árabe"", "", además de pan relleno tanto dulce como salado para brindarte una mayor diversidad de opciones."", ""¡Conoce la mejor variedad de Pan Envasado y Pan de la Casa en plazaVea Online!"", ""¿En qué búsqueda? Encuentra más"", ""Pan Envasado y Pan de la casa"", ""en plazaVea"", ""En caso algo no vaya como gustes: Puedes revisar nuestras"", ""Politicas de cambios y/o devoluciones"", ""y hacerlas efectivas en todas nuestras tiendas."", ""Productos"", ""que te pueden interesar"", ""Recomendado para ti""]}",dataset/txt_limpios/1042.txt,dataset/paginas_descargadas/1042.html,ET,pan,keep,0.60,heuristic_default
1043,colaborar con nuestros estudios para marketing. También puede configurarlas.,Información de la marca,que podemos ofrecer. > 950g,16.92,PEN,,Desconocido,unknown,PE,colaborar con nuestros estudios para marketing. También puede configurarlas.,que podemos ofrecer.,,950g,16.92,PEN,S/,S/16.92,16.92,False,original,4.7662,4.7662,3.55,from_peru_cambio_dolar,,Información de la marca,"Presentación/Empaque | Bolsa | Producto Preparado | No | Relleno | 0 | Porción sugerida | 80g | Alérgenos Declarados | Gluten | Azúcares Porción | 3g | Calorías Porción | 280 | Carbohidratos Porción | 59g | Descripción Nutricional | Semola de trigo fortificada | Grasas Porción | 1.6g | Proteínas Porción | 11g | Sodio Porción | 4mg | Peso Neto (g) | Advertencias De Almacenamiento | Conservar en un ambiente frescos, limpio, seco y libre de contamicación. Referencia menor a 20 grados y 65%HR | Advertencias de consumo | Contiene gluten, puede contener trazas de huevo | Revisa todo | Componentes del Producto | Vendido por | plaza Vea | En caso de que algo te guste: Puedes revisar nuestras | Políticas de cambios y/o devoluciones | y hacerlas efectivas en todas nuestras tiendas. | Productos | que te pueden interesar | Recomendado para ti",,,,,"{""Descripción"": [""Información de la marca""], ""Características"": [""Presentación/Empaque"", ""Bolsa"", ""Producto Preparado"", ""No"", ""Relleno"", ""0"", ""Porción sugerida"", ""80g"", ""Alérgenos Declarados"", ""Gluten"", ""Azúcar por porción"", ""3g"", ""Calorías Porción"", ""280"", ""Carbohidratos Porción"", ""59g"", ""Descripción Nutricional"", ""Semola de trigo fortificada"", ""Grasas Porción"", ""1.6g"", ""Proteínas Porción"", ""11g"", ""Sodio Porción"", ""4mg"", ""Peso Neto (g)"", ""Advertencias De Almacenamiento"", ""Conservar en un ambiente frescos, limpio, seco y libre de contamicacion. Referencia menor a 20 grados y 65%HR"", ""Advertencias de consumo"", ""Contiene gluten, puede contener trazas de huevo"", ""Revisa todo"", ""Componentes del Producto"", ""Vendido por"", ""plazaVea"", ""En caso algo no vaya como gustes: Puedes revisar nuestras"", ""Politicas de cambios y/o devoluciones"", ""y hacerlas efectivas en todas nuestras tiendas."", ""Productos"", ""que te pueden interesar"", ""Recomendado para ti""]}",dataset/txt_limpios/1043.txt,dataset/paginas_descargadas/1043.html,ET,sin_categoria,discard,0.30,no_category_detected
1044,colaborar con nuestros estudios para marketing. También puede configurarlas.,Información de la marca,que podemos ofrecer. > 250g,16.92,PEN,,Desconocido,unknown,PE,colaborar con nuestros estudios para marketing. También puede configurarlas.,que podemos ofrecer.,,250g,16.92,PEN,S/,S/16.92,16.92,False,original,4.7662,4.7662,3.55,from_peru_cambio_dolar,,Información de la marca,"Importante destacar | Paquete de fideos | Conservar en lugar fresco y seco | Marca: LAVAGGI | Descripción del producto | FIDEOS Y PASTAS | plaza Vea | cuenta con una amplia variedad de | para que puedas elegir el que más se adecua a tus necesidades. | Dentro de los | encontramos | Jamón | y | Quesos | la combinación de ambos será un deleite en tu paladar. | Vino Tinto | .Por otro lado, si la salsa incluye albahaca, aceptada de oliva y queso parmesano , un | Vino Blanco | con elevada acidez y aromas de flores el frutas puede aportar un buen equilibrio de sabores. | - Conoce las distintas opciones en | en plazaVea Online! | *La imagen solo es referencial | ¿En qué búsqueda? Encuentra más | en plaza Vea | Revisa todo | Componentes del Producto | Vendido por | En caso de que algo te guste: Puedes revisar nuestras | Políticas de cambios y/o devoluciones | y hacerlas efectivas en todas nuestras tiendas. | Productos | que te pueden interesar | Recomendado para ti",,,,,"{""Descripción"": [""Información de la marca""], ""Características"": [""Importante destacar"", ""Paquete de fideos"", ""Conservar en lugar fresco y seco"", ""Marca: LAVAGGI"", ""Descripción del producto"", ""FIDEOS Y PASTAS"", ""plazaVea"", ""cuenta con una amplia variedad de"", ""para que puedas elegir qué más se adecua a tus necesidades."", ""Dentro de los"", ""encontramos"", ""Jamón"", ""y"", ""Quesos"", ""la combinación de ambos será un deleite en tu paladar."", ""Vino Tinto"", "".Por otro lado, si la salsa incluye albahaca, aceite de oliva y queso parmesano , un"", ""Vino Blanco"", ""con elevada acidez y aromas de flores, las frutas pueden aportar un buen equilibrio de sabores."", ""¡Conoce las distintas opciones en"", ""en plazaVea Online!"", ""*La imagen solo es referencial"", ""¿En qué búsqueda? Encuentra más"", ""en plazaVea"", ""Revisa todo"", ""Componentes del Producto"", ""Vendido por"", ""En caso algo no vaya como gustes: Puedes revisar nuestras"", ""Politicas de cambios y/o devoluciones"", ""y hacerlas efectivas en todas nuestras tiendas."", ""Productos"", ""que te pueden interesar"", ""Recomendado para ti""]}",dataset/txt_limpios/1044.txt,dataset/paginas_descargadas/1044.html,ET,sin_categoria,discard,0.30,no_category_detected
1045,colaborar con nuestros estudios para marketing. También puede configurarlas.,Información de la marca,que podemos ofrecer. > 900g,16.92,PEN,,Desconocido,unknown,PE,colaborar con nuestros estudios para marketing. También puede configurarlas.,que podemos ofrecer.,,900g,16.92,PEN,S/,S/16.92,16.92,False,original,4.7662,4.7662,3.55,from_peru_cambio_dolar,,Información de la marca,Presentación/Empaque | Bolsa | Producto Preparado | No | Relleno | N.A | Alérgenos Declarados | Contiene gluten. | Azúcares Porción | 2.3 g | Carbohidratos Porción | 69.7 g | Grasas Porción | 1.7 g | Proteínas Porción | 12.9 g | Sodio Porción | 6.8 mg | Peso Neto (g) | 900 | Advertencias De Almacenamiento | Almacenar en lugar fresco y seco. | Denominación/Variedad | Carpeta | Revisa todo | Componentes del Producto | Vendido por | plaza Vea | En caso de que algo te guste: Puedes revisar nuestras | Políticas de cambios y/o devoluciones | y hacerlas efectivas en todas nuestras tiendas. | Productos | que te pueden interesar | Recomendado para ti,,,,,"{""Descripción"": [""Información de la marca""], ""Características"": [""Presentación/Empaque"", ""Bolsa"", ""Producto Preparado"", ""No"", ""Relleno"", ""N.A"", ""Alérgenos Declarados"", ""Contiene gluten."", ""Azúcar por porción"", ""2.3 g"", ""Carbohidratos Porción"", ""69.7 g"", ""Grasas Porción"", ""1.7 g"", ""Proteínas Porción"", ""12.9 g"", ""Sodio Porción"", ""6.8 mg"", ""Peso Neto (g)"", ""900"", ""Advertencias De Almacenamiento"", ""Almacenar en lugar fresco y seco."", ""Denominación/Variedad"", ""Pasta"", ""Revisa todo"", ""Componentes del Producto"", ""Vendido por"", ""plazaVea"", ""En caso algo no vaya como gustes: Puedes revisar nuestras"", ""Politicas de cambios y/o devoluciones"", ""y hacerlas efectivas en todas nuestras tiendas."", ""Productos"", ""que te pueden interesar"", ""Recomendado para ti""]}",dataset/txt_limpios/1045.txt,dataset/paginas_descargadas/1045.html,ET,sin_categoria,discard,0.30,no_category_detected
1046,colaborar con nuestros estudios para marketing. También puede configurarlas.,Información de la marca,que podemos ofrecer. > 500g,16.92,PEN,,Desconocido,unknown,PE,colaborar con nuestros estudios para marketing. También puede configurarlas.,que podemos ofrecer.,,500g,16.92,PEN,S/,S/16.92,16.92,False,original,4.7662,4.7662,3.55,from_peru_cambio_dolar,,Información de la marca,"Presentación/Empaque | Caja | Producto Preparado | No | Porción sugerida | 85g | Tipo de Producto | Spaghetti | Alérgenos Declarados | Puede contener Soja y Huevo. | Calorías Por Porción | 305Kcal | Carbohidratos Por Porción | 58g | Grasas Porción | 1.6g | Proteínas Porción | 9.1g | Sodio Porción | 0mg | Advertencias De Almacenamiento | Almacenar en un lugar fresco y seco. | Contenido Neto | 500g | Denominación/Variedad | N°5 | Advertencias de consumo | Consumir antes de la fecha indicada en el envase. | Revisa todo | Importante destacar | Carpeta de fácil cocción | Conservar en lugar fresco y seco | Descripción del producto | FIDEOS Y PASTAS | plaza Vea | cuenta con una amplia variedad de | para que puedas elegir el que más se adecua a tus necesidades. | Dentro de los | encontramos | Jamón | y | Quesos | la combinación de ambos será un deleite en tu paladar. | Vino Tinto | .Por otro lado, si la salsa incluye albahaca, aceptada de oliva y queso parmesano , un | Vino Blanco | con elevada acidez y aromas de flores el frutas puede aportar un buen equilibrio de sabores. | *La imagen solo es referencial | Componentes del Producto | Vendido por | En caso de que algo no vaya como gustes: Puedes revisar nuestras | Políticas de cambios y/o devoluciones | y hacerlas efectivas en todas nuestras tiendas. | Productos | que te pueden interesar | Recomendado para ti",,,,,"{""Descripción"": [""Información de la marca""], ""Características"": [""Presentación/Empaque"", ""Caja"", ""Producto Preparado"", ""No"", ""Porción sugerida"", ""85g"", ""Tipo De Producto"", ""Spaghetti"", ""Alérgenos Declarados"", ""Puede contener Soja y Huevo."", ""Calorías Porción"", ""305Kcal"", ""Carbohidratos Porción"", ""58g"", ""Grasas Porción"", ""1.6g"", ""Proteínas Porción"", ""9.1g"", ""Sodio Porción"", ""0mg"", ""Advertencias De Almacenamiento"", ""Almacenar en un lugar fresco y seco."", ""Contenido Neto"", ""500g"", ""Denominación/Variedad"", ""N°5"", ""Advertencias de consumo"", ""Consumir antes de la fecha indicada en el envase."", ""Revisa todo"", ""Importante destacar"", ""Carpeta de fácil cocción"", ""Conservar en lugar fresco y seco"", ""Descripción del producto"", ""FIDEOS Y PASTAS"", ""plazaVea"", ""cuenta con una amplia variedad de"", ""para que puedas elegir qué más se adecua a tus necesidades."", ""Dentro de los"", ""encontramos"", ""Jamón"", ""y"", ""Quesos"", ""la combinación de ambos será un deleite en tu paladar."", ""Vino Tinto"", "".Por otro lado, si la salsa incluye albahaca, aceite de oliva y queso parmesano , un"", ""Vino Blanco"", ""con elevada acidez y aromas de flores, las frutas pueden aportar un buen equilibrio de sabores."", ""¡Conoce las distintas opciones en"", ""en plazaVea Online!"", ""*La imagen solo es referencial"", ""Componentes del Producto"", ""Vendido por"", ""En caso algo no vaya como gustes: Puedes revisar nuestras"", ""Politicas de cambios y/o devoluciones"", ""y hacerlas efectivas en todas nuestras tiendas."", ""Productos"", ""que te pueden interesar"", ""Recomendado para ti""]}",dataset/txt_limpios/1046.txt,dataset/paginas_descargadas/1046.html,ET,sin_categoria,discard,0.30,no_category_detected
1047,colaborar con nuestros estudios para marketing. También puede configurarlas.,Información de la marca,que podemos ofrecer. > 500g,16.92,PEN,,Desconocido,unknown,PE,colaborar con nuestros estudios para marketing. También puede configurarlas.,que podemos ofrecer.,,500g,16.92,PEN,S/,S/16.92,16.92,False,original,4.7662,4.7662,3.55,from_peru_cambio_dolar,,Información de la marca,Revisa todo | Componentes del Producto | Vendido por | plazaVea | En caso algo no vaya como gustes: Puedes revisar nuestras | Politicas de cambios y/o devoluciones | y hacerlas efectivas en todas nuestras tiendas. | Productos | que te pueden interesar | Recomendado para ti,,,,,"{""Descripción"": [""Información de la marca""], ""Características"": [""Revisa todo"", ""Componentes del Producto"", ""Vendido por"", ""plazaVea"", ""En caso algo no vaya como gustes: Puedes revisar nuestras"", ""Politicas de cambios y/o devoluciones"", ""y hacerlas efectivas en todas nuestras tiendas."", ""Productos"", ""que te pueden interesar"", ""Recomendado para ti""]}",dataset/txt_limpios/1047.txt,dataset/paginas_descargadas/1047.html,EN,sin_categoria,discard,0.30,no_category_detected
1048,colaborar con nuestros estudios para marketing. También puede configurarlas.,Presentación/Empaque | Lata | Porción Sugerida | 100g | Azúcares Porción | sin azucar añadida | Calorías Porción | 150 kcal por Porción | 0 | Contenido Escurrido | 100 g | Descripción Nutricional | Especificado en ficha tecnica | Grasas Porción | 4.5 g | Medio De Conservación | Lugar Fresco y Seco | Proteínas Porción | 27 g | Sodio Porción | 410 mg | Advertencias De Almacenamiento | Contenido Neto | 140 g | Denominación/Variedad | Filete de Atun en Aceite Vegetal 140 g | | Filete de Atun en Aceite Vegetal 140 g | En caso de que algo te guste: Puedes revisar nuestras | Políticas de cambios y/o devoluciones | y hacerlas efectivas en todas nuestras tiendas. | Productos | que te pueden interesar | Recomendado para ti,que podemos ofrecer. > 140g,16.92,PEN,,Desconocido,unknown,PE,colaborar con nuestros estudios para marketing. También puede configurarlas.,que podemos ofrecer.,,140g,16.92,PEN,S/,S/16.92,16.92,False,original,4.7662,4.7662,3.55,from_peru_cambio_dolar,,,,Presentación/Empaque | Lata | Porción Sugerida | 100g | Azúcares Porción | sin azucar añadida | Calorías Porción | 150 kcal por Porción | 0 | Contenido Escurrido | 100 g | Descripción Nutricional | Especificado en ficha tecnica | Grasas Porción | 4.5 g | Medio De Conservación | Lugar Fresco y Seco | Proteínas Porción | 27 g | Sodio Porción | 410 mg | Advertencias De Almacenamiento | Contenido Neto | 140 g | Denominación/Variedad | Filete de Atun en Aceite Vegetal 140 g | | Filete de Atun en Aceite Vegetal 140 g | En caso de que algo te guste: Puedes revisar nuestras | Políticas de cambios y/o devoluciones | y hacerlas efectivas en todas nuestras tiendas. | Productos | que te pueden interesar | Recomendado para ti,,,,"{""Especificaciones"": [""Presentación/Empaque"", ""Lata"", ""Porción sugerida"", ""100g"", ""Azúcar por porción"", ""sin azucar añadida"", ""Calorías Porción"", ""150 kcal por 100 g"", ""Carbohidratos Porción"", ""0"", ""Contenido Escurrido"", ""100 g"", ""Descripción Nutricional"", ""Especificado en ficha tecnica"", ""Grasas Porción"", ""4.5 g"", ""Medio de conservación"", ""Lugar Fresco y Seco"", ""Proteínas Porción"", ""27 g"", ""Sodio Porción"", ""410 mg"", ""Advertencias De Almacenamiento"", ""Contenido Neto"", ""140 g"", ""Denominación/Variedad"", ""Filete de Atun en Aceite Vegetal 140 g"", ""En caso algo no vaya como gustes: Puedes revisar nuestras"", ""Politicas de cambios y/o devoluciones"", ""y hacerlas efectivas en todas nuestras tiendas."", ""Productos"", ""que te pueden interesar"", ""Recomendado para ti""]}",dataset/txt_limpios/1048.txt,dataset/paginas_descargadas/1048.html,ET,atun,keep,0.60,heuristic_default
1049,colaborar con nuestros estudios para marketing. También puede configurarlas.,Información de la marca,que podemos ofrecer. > 150g,16.92,PEN,,Desconocido,unknown,PE,colaborar con nuestros estudios para marketing. También puede configurarlas.,que podemos ofrecer.,,150g,16.92,PEN,S/,S/16.92,16.92,False,original,4.7662,4.7662,3.55,from_peru_cambio_dolar,,Información de la marca,"Presentación/Empaque | Lata | Porción sugerida | 2 | Alérgenos Declarados | Atun , aceptado vegetal (soya) | Azúcares Porción | 0g/ 100g | Calorías Porción | 268.2 Kcal/100g | Carbohidratos Por Porción | Certificaciones | safe | Contenido Escurrido | 105gr | Descripción Nutricional | Contiene Omega 3. | Grasas Porción | 20.8 g/100g | Medio De Conservación | Aceite vegetal | Proteínas Porción | 20.3g/100g | Sodio Porción | 269 mg/100 g | Advertencias De Almacenamiento | Mantener en un lugar fresco y seco,refrigerar una vez abierto | Contenido Neto | 150gr | Denominación/Variedad | Filete Campomar | Revisa todo | Componentes del Producto | Vendido por | plaza Vea | En caso de que algo te guste: Puedes revisar nuestras | Políticas de cambios y/o devoluciones | y hacerlas efectivas en todas nuestras tiendas. | Productos | que te pueden interesar | Recomendado para ti",,,,,"{""Descripción"": [""Información de la marca""], ""Características"": [""Presentación/Empaque"", ""Lata"", ""Porción sugerida"", ""2"", ""Alérgenos Declarados"", ""Atun , aceite vegetal (soya)"", ""Azúcar por porción"", ""0g / 100g"", ""Calorías Porción"", ""268.2 Kcal/100g"", ""Carbohidratos Porción"", ""Certificaciones"", ""safe"", ""Contenido Escurrido"", ""105gr"", ""Descripción Nutricional"", ""Contiene Omega 3."", ""Grasas Porción"", ""20.8 g/100g"", ""Medio de conservación"", ""Aceite vegetal"", ""Proteínas Porción"", ""20.3g/100g"", ""Sodio Porción"", ""269 mg/100 g"", ""Advertencias De Almacenamiento"", ""Mantener en un lugar fresco y seco,refrigerar una vez abierto"", ""Contenido Neto"", ""150gr"", ""Denominación/Variedad"", ""Filete Campomar"", ""Revisa todo"", ""Componentes del Producto"", ""Vendido por"", ""plazaVea"", ""En caso algo no vaya como gustes: Puedes revisar nuestras"", ""Politicas de cambios y/o devoluciones"", ""y hacerlas efectivas en todas nuestras tiendas."", ""Productos"", ""que te pueden interesar"", ""Recomendado para ti""]}",dataset/txt_limpios/1049.txt,dataset/paginas_descargadas/1049.html,ET,sin_categoria,discard,0.30,no_category_detected
