source_id,title,description,breadcrumbs,price_raw,currency_raw,url,seller,availability,country,product_name,brand,reference,unit,price_amount,price_currency,price_symbol,price_text,price_amount_filled,price_is_imputed,price_imputation_source,price_amount_usd,price_amount_usd_filled,fx_rate_local_per_usd,fx_source,information_text,description_text,features_text,specifications_text,benefits_text,details_text,other_sections,sections,txt_path,html_path,es_status,category_canonical,decision,match_score,reasons
745,Selecciona tu,"+ | Especificaciones técnicas | Propiedad | Especificación | Tipo de Endulzantes | Azúcar Blanca | Ver más | Azúcar | Edulcorantes | Sustitutos del azúcar | Mayaguez Azúcar Blanco Especial | Azúcar blanco | Comentarios | ☆ | 0 Calificación promedio | (0 comentarios) | Por favor, inicia sesión para escribir un comentario. | Más reciente | Ordenar por: Más reciente | Más antiguo | Calificación más alta | Calificación más baja | Todos | Filtrar por: Todos | 1 estrella | 2 estrellas | 3 estrellas | 4 estrellas | 5 estrellas | No hay comentarios. | Términos más buscados | 1. | celulares | 2. | neveras | 3. | iphone | 4. | lavadora | 5. | aire | 6. | televisores | 7. | estufa | 8. | colchon | 9. | cafe | 10. | nevera | Evalúanos","Método de envío > 2,5 Kg",,COP,,Desconocido,unknown,CO,Selecciona tu,Método de envío,,"2,5 Kg",,COP,,,97.32,True,category_country_mean,,0.024,4047.0,from_colombia_cambio_dolar,,,,"+ | Especificaciones técnicas | Propiedad | Especificación | Tipo de Endulzantes | Azúcar Blanca | Ver más | Azúcar | Edulcorantes | Sustitutos del azúcar | Mayaguez Azúcar Blanco Especial | Azúcar blanco | Comentarios | ☆ | 0 Calificación promedio | (0 comentarios) | Por favor, inicia sesión para escribir un comentario. | Más reciente | Ordenar por: Más reciente | Más antiguo | Calificación más alta | Calificación más baja | Todos | Filtrar por: Todos | 1 estrella | 2 estrellas | 3 estrellas | 4 estrellas | 5 estrellas | No hay comentarios. | Términos más buscados | 1. | celulares | 2. | neveras | 3. | iphone | 4. | lavadora | 5. | aire | 6. | televisores | 7. | estufa | 8. | colchon | 9. | cafe | 10. | nevera | Evalúanos",,,,"{""Especificaciones"": [""+"", ""Especificaciones técnicas"", ""Propiedad"", ""Especificación"", ""Tipo de Endulzantes"", ""Azúcar Blanca"", ""Ver más"", ""Azúcar"", ""Edulcorantes"", ""Sustitutos del azúcar"", ""Mayaguez Azúcar Blanco Especial"", ""Azúcar blanco"", ""Comentarios"", ""☆"", ""0 Calificación promedio"", ""(0 comentarios)"", ""Por favor, inicia sesión para escribir un comentario."", ""Más reciente"", ""Ordenar por: Más reciente"", ""Más antiguo"", ""Calificación más alta"", ""Calificación más baja"", ""Todos"", ""Filtrar por: Todos"", ""1 estrella"", ""2 estrellas"", ""3 estrellas"", ""4 estrellas"", ""5 estrellas"", ""No hay comentarios."", ""Términos más buscados"", ""1."", ""celulares"", ""2."", ""neveras"", ""3."", ""iphone"", ""4."", ""lavadora"", ""5."", ""aire"", ""6."", ""televisores"", ""7."", ""estufa"", ""8."", ""colchon"", ""9."", ""cafe"", ""10."", ""nevera"", ""Evalúanos""]}",dataset/txt_limpios/745.txt,dataset/paginas_descargadas/745.html,EN,cafe,discard,0.60,price_parse_failed;price<=0
746,Selecciona tu,"+ | Especificaciones técnicas | Propiedad | Especificación | Complementa tu elección | Ultralimp | LAVALOZA ULTRALIMP CREM 500G | Leche Olimpica Uht Entera 800 Ml X6 Unds | 16 | 590 | Milo | BEB ACHOC MILO ACTI-GO D/PACK 320G | 14 | Lak | Jabón Lak Sensaciones 110 G X4 Unds | 690 | 7.690 | Suppra Care | P/HIG SUPPRA CARE BCO ECN 3H 20M X16 | 13 | Fruco | Salsa de Tomate Fruco Pague 800 g Lleve 1000 g | 18 | 410 | Ver más | Azúcar blanco | Azúcar Blanca 1 kg | AZUCAR | Azúcar Olimpica Blanca | Azúcar | Comentarios | ☆ | 0 Calificación promedio | (0 comentarios) | Por favor, inicia sesión para escribir un comentario. | Más reciente | Ordenar por: Más reciente | Más antiguo | Calificación más alta | Calificación más baja | Todos | Filtrar por: Todos | 1 estrella | 2 estrellas | 3 estrellas | 4 estrellas | 5 estrellas | No hay comentarios. | Evalúanos | Términos más buscados | 1. | celulares | 2. | neveras | 3. | iphone | 4. | lavadora | 5. | aire | 6. | televisores | 7. | estufa | 8. | colchon | 9. | cafe | 10. | nevera","Método de envío > 2,5 Kg",,COP,,Desconocido,unknown,CO,Selecciona tu,Método de envío,,"2,5 Kg",,COP,,,97.32,True,category_country_mean,,0.024,4047.0,from_colombia_cambio_dolar,,,,"+ | Especificaciones técnicas | Propiedad | Especificación | Complementa tu elección | Ultralimp | LAVALOZA ULTRALIMP CREM 500G | Leche Olimpica Uht Entera 800 Ml X6 Unds | 16 | 590 | Milo | BEB ACHOC MILO ACTI-GO D/PACK 320G | 14 | Lak | Jabón Lak Sensaciones 110 G X4 Unds | 690 | 7.690 | Suppra Care | P/HIG SUPPRA CARE BCO ECN 3H 20M X16 | 13 | Fruco | Salsa de Tomate Fruco Pague 800 g Lleve 1000 g | 18 | 410 | Ver más | Azúcar blanco | Azúcar Blanca 1 kg | AZUCAR | Azúcar Olimpica Blanca | Azúcar | Comentarios | ☆ | 0 Calificación promedio | (0 comentarios) | Por favor, inicia sesión para escribir un comentario. | Más reciente | Ordenar por: Más reciente | Más antiguo | Calificación más alta | Calificación más baja | Todos | Filtrar por: Todos | 1 estrella | 2 estrellas | 3 estrellas | 4 estrellas | 5 estrellas | No hay comentarios. | Evalúanos | Términos más buscados | 1. | celulares | 2. | neveras | 3. | iphone | 4. | lavadora | 5. | aire | 6. | televisores | 7. | estufa | 8. | colchon | 9. | cafe | 10. | nevera",,,,"{""Especificaciones"": [""+"", ""Especificaciones técnicas"", ""Propiedad"", ""Especificación"", ""Complementa tu elección"", ""Ultralimp"", ""LAVALOZA ULTRALIMP CREM 500G"", ""Leche Olimpica Uht Entera 800 Ml X6 Unds"", ""16"", ""590"", ""Milo"", ""BEB ACHOC MILO ACTI-GO D/PACK 320G"", ""14"", ""Lak"", ""Jabón Lak Sensaciones 110 G X4 Unds"", ""690"", ""7.690"", ""Suppra Care"", ""P/HIG SUPPRA CARE BCO ECN 3H 20M X16"", ""13"", ""Fruco"", ""Salsa de Tomate Fruco Pague 800 g Lleve 1000 g"", ""18"", ""410"", ""Ver más"", ""Azúcar blanco"", ""Azúcar Blanca 1 kg"", ""AZUCAR"", ""Azúcar Olimpica Blanca"", ""Azúcar"", ""Comentarios"", ""☆"", ""0 Calificación promedio"", ""(0 comentarios)"", ""Por favor, inicia sesión para escribir un comentario."", ""Más reciente"", ""Ordenar por: Más reciente"", ""Más antiguo"", ""Calificación más alta"", ""Calificación más baja"", ""Todos"", ""Filtrar por: Todos"", ""1 estrella"", ""2 estrellas"", ""3 estrellas"", ""4 estrellas"", ""5 estrellas"", ""No hay comentarios."", ""Evalúanos"", ""Términos más buscados"", ""1."", ""celulares"", ""2."", ""neveras"", ""3."", ""iphone"", ""4."", ""lavadora"", ""5."", ""aire"", ""6."", ""televisores"", ""7."", ""estufa"", ""8."", ""colchon"", ""9."", ""cafe"", ""10."", ""nevera""]}",dataset/txt_limpios/746.txt,dataset/paginas_descargadas/746.html,EN,cafe,discard,0.60,price_parse_failed;price<=0
747,Selecciona tu,"+ | Especificaciones técnicas | Propiedad | Especificación | Tipo de Endulzantes | Azúcar Blanca | Ver más | AZUCAR | Azúcar Providencia blanca x2.5kg | Sustitutos del azúcar | Azúcar | Azúcar blanco | Edulcorantes | Comentarios | ☆ | 0 Calificación promedio | (0 comentarios) | Por favor, inicia sesión para escribir un comentario. | Más reciente | Ordenar por: Más reciente | Más antiguo | Calificación más alta | Calificación más baja | Todos | Filtrar por: Todos | 1 estrella | 2 estrellas | 3 estrellas | 4 estrellas | 5 estrellas | No hay comentarios. | Evalúanos | Términos más buscados | 1. | celulares | 2. | neveras | 3. | iphone | 4. | lavadora | 5. | aire | 6. | televisores | 7. | estufa | 8. | colchon | 9. | cafe | 10. | nevera","Método de envío > 2,5 Kg",,COP,,Desconocido,unknown,CO,Selecciona tu,Método de envío,,"2,5 Kg",,COP,,,97.32,True,category_country_mean,,0.024,4047.0,from_colombia_cambio_dolar,,,,"+ | Especificaciones técnicas | Propiedad | Especificación | Tipo de Endulzantes | Azúcar Blanca | Ver más | AZUCAR | Azúcar Providencia blanca x2.5kg | Sustitutos del azúcar | Azúcar | Azúcar blanco | Edulcorantes | Comentarios | ☆ | 0 Calificación promedio | (0 comentarios) | Por favor, inicia sesión para escribir un comentario. | Más reciente | Ordenar por: Más reciente | Más antiguo | Calificación más alta | Calificación más baja | Todos | Filtrar por: Todos | 1 estrella | 2 estrellas | 3 estrellas | 4 estrellas | 5 estrellas | No hay comentarios. | Evalúanos | Términos más buscados | 1. | celulares | 2. | neveras | 3. | iphone | 4. | lavadora | 5. | aire | 6. | televisores | 7. | estufa | 8. | colchon | 9. | cafe | 10. | nevera",,,,"{""Especificaciones"": [""+"", ""Especificaciones técnicas"", ""Propiedad"", ""Especificación"", ""Tipo de Endulzantes"", ""Azúcar Blanca"", ""Ver más"", ""AZUCAR"", ""Azúcar Providencia blanca x2.5kg"", ""Sustitutos del azúcar"", ""Azúcar"", ""Azúcar blanco"", ""Edulcorantes"", ""Comentarios"", ""☆"", ""0 Calificación promedio"", ""(0 comentarios)"", ""Por favor, inicia sesión para escribir un comentario."", ""Más reciente"", ""Ordenar por: Más reciente"", ""Más antiguo"", ""Calificación más alta"", ""Calificación más baja"", ""Todos"", ""Filtrar por: Todos"", ""1 estrella"", ""2 estrellas"", ""3 estrellas"", ""4 estrellas"", ""5 estrellas"", ""No hay comentarios."", ""Evalúanos"", ""Términos más buscados"", ""1."", ""celulares"", ""2."", ""neveras"", ""3."", ""iphone"", ""4."", ""lavadora"", ""5."", ""aire"", ""6."", ""televisores"", ""7."", ""estufa"", ""8."", ""colchon"", ""9."", ""cafe"", ""10."", ""nevera""]}",dataset/txt_limpios/747.txt,dataset/paginas_descargadas/747.html,EN,cafe,discard,0.60,price_parse_failed;price<=0
1242,Selecciona un local,,X > 000 Ml,12.0,USD,,Desconocido,unknown,US,Selecciona un local,X,,000 Ml,12.00,USD,.,.12,12.0,False,original,12.0,12.0,1.0,default_1usd,,,,,,,,{},dataset/txt_limpios/1242.txt,dataset/paginas_descargadas/1242.html,EN,sin_categoria,discard,0.30,no_category_detected
1243,Selecciona un local,,X > 1000 Ml,12.0,USD,,Desconocido,unknown,US,Selecciona un local,X,,1000 Ml,12.00,USD,.,.12,12.0,False,original,12.0,12.0,1.0,default_1usd,,,,,,,,{},dataset/txt_limpios/1243.txt,dataset/paginas_descargadas/1243.html,EN,sin_categoria,discard,0.30,no_category_detected
1244,Selecciona un local,,X > 1000 Ml,12.0,USD,,Desconocido,unknown,US,Selecciona un local,X,,1000 Ml,12.00,USD,.,.12,12.0,False,original,12.0,12.0,1.0,default_1usd,,,,,,,,{},dataset/txt_limpios/1244.txt,dataset/paginas_descargadas/1244.html,EN,sin_categoria,discard,0.30,no_category_detected
1245,Selecciona un local,,X,12.0,USD,,Desconocido,unknown,US,Selecciona un local,X,,,12.00,USD,.,.12,12.0,False,original,12.0,12.0,1.0,default_1usd,,,,,,,,{},dataset/txt_limpios/1245.txt,dataset/paginas_descargadas/1245.html,EN,sin_categoria,discard,0.30,no_category_detected
1246,Selecciona un local,,X > 1000 Ml,12.0,USD,,Desconocido,unknown,US,Selecciona un local,X,,1000 Ml,12.00,USD,.,.12,12.0,False,original,12.0,12.0,1.0,default_1usd,,,,,,,,{},dataset/txt_limpios/1246.txt,dataset/paginas_descargadas/1246.html,EN,sin_categoria,discard,0.30,no_category_detected
1247,Selecciona un local,,X,12.0,,,Desconocido,unknown,UNKNOWN,Selecciona un local,X,,,12.00,,.,.12,12.0,False,original,12.0,12.0,1.0,default_1usd,,,,,,,,{},dataset/txt_limpios/1247.txt,dataset/paginas_descargadas/1247.html,EN,sin_categoria,discard,0.30,no_category_detected
1248,Selecciona un local,,X > 250 Ml,12.0,USD,,Desconocido,unknown,US,Selecciona un local,X,,250 Ml,12.00,USD,.,.12,12.0,False,original,12.0,12.0,1.0,default_1usd,,,,,,,,{},dataset/txt_limpios/1248.txt,dataset/paginas_descargadas/1248.html,EN,sin_categoria,discard,0.30,no_category_detected
1249,Selecciona un local,,X > 355 ML,12.0,USD,,Desconocido,unknown,US,Selecciona un local,X,,355 ML,12.00,USD,.,.12,12.0,False,original,12.0,12.0,1.0,default_1usd,,,,,,,,{},dataset/txt_limpios/1249.txt,dataset/paginas_descargadas/1249.html,EN,sin_categoria,discard,0.30,no_category_detected
1250,Selecciona un local,,X > 330 ML,12.0,USD,,Desconocido,unknown,US,Selecciona un local,X,,330 ML,12.00,USD,.,.12,12.0,False,original,12.0,12.0,1.0,default_1usd,,,,,,,,{},dataset/txt_limpios/1250.txt,dataset/paginas_descargadas/1250.html,EN,sin_categoria,discard,0.30,no_category_detected
1251,Selecciona un local,,X > 700 G,12.0,USD,,Desconocido,unknown,US,Selecciona un local,X,,700 G,12.00,USD,.,.12,12.0,False,original,12.0,12.0,1.0,default_1usd,,,,,,,,{},dataset/txt_limpios/1251.txt,dataset/paginas_descargadas/1251.html,EN,sin_categoria,discard,0.30,no_category_detected
1252,Selecciona un local,,X > 550g,12.0,USD,,Desconocido,unknown,US,Selecciona un local,X,,550g,12.00,USD,.,.12,12.0,False,original,12.0,12.0,1.0,default_1usd,,,,,,,,{},dataset/txt_limpios/1252.txt,dataset/paginas_descargadas/1252.html,EN,sin_categoria,discard,0.30,no_category_detected
1253,Selecciona un local,,X > 550 G,12.0,USD,,Desconocido,unknown,US,Selecciona un local,X,,550 G,12.00,USD,.,.12,12.0,False,original,12.0,12.0,1.0,default_1usd,,,,,,,,{},dataset/txt_limpios/1253.txt,dataset/paginas_descargadas/1253.html,EN,sin_categoria,discard,0.30,no_category_detected
1254,Selecciona un local,,X > 3 L,12.0,,,Desconocido,unknown,UNKNOWN,Selecciona un local,X,,3 L,12.00,,.,.12,12.0,False,original,12.0,12.0,1.0,default_1usd,,,,,,,,{},dataset/txt_limpios/1254.txt,dataset/paginas_descargadas/1254.html,EN,sin_categoria,discard,0.30,no_category_detected
1255,Selecciona un local,,X > 500 G,12.0,USD,,Desconocido,unknown,US,Selecciona un local,X,,500 G,12.00,USD,.,.12,12.0,False,original,12.0,12.0,1.0,default_1usd,,,,,,,,{},dataset/txt_limpios/1255.txt,dataset/paginas_descargadas/1255.html,EN,sin_categoria,discard,0.30,no_category_detected
1256,Selecciona un local,,"X > 1,25 L",12.0,,,Desconocido,unknown,UNKNOWN,Selecciona un local,X,,"1,25 L",12.00,,.,.12,12.0,False,original,12.0,12.0,1.0,default_1usd,,,,,,,,{},dataset/txt_limpios/1256.txt,dataset/paginas_descargadas/1256.html,EN,sin_categoria,discard,0.30,no_category_detected
1257,Selecciona un local,,X > 500 Ml,12.0,USD,,Desconocido,unknown,US,Selecciona un local,X,,500 Ml,12.00,USD,.,.12,12.0,False,original,12.0,12.0,1.0,default_1usd,,,,,,,,{},dataset/txt_limpios/1257.txt,dataset/paginas_descargadas/1257.html,EN,sin_categoria,discard,0.30,no_category_detected
1258,Selecciona un local,,X > 355 Ml,12.0,USD,,Desconocido,unknown,US,Selecciona un local,X,,355 Ml,12.00,USD,.,.12,12.0,False,original,12.0,12.0,1.0,default_1usd,,,,,,,,{},dataset/txt_limpios/1258.txt,dataset/paginas_descargadas/1258.html,EN,sin_categoria,discard,0.30,no_category_detected
1259,Selecciona un local,,X > 355 Ml,12.0,USD,,Desconocido,unknown,US,Selecciona un local,X,,355 Ml,12.00,USD,.,.12,12.0,False,original,12.0,12.0,1.0,default_1usd,,,,,,,,{},dataset/txt_limpios/1259.txt,dataset/paginas_descargadas/1259.html,EN,sin_categoria,discard,0.30,no_category_detected
1260,Selecciona un local,,X > 500 Ml,12.0,USD,,Desconocido,unknown,US,Selecciona un local,X,,500 Ml,12.00,USD,.,.12,12.0,False,original,12.0,12.0,1.0,default_1usd,,,,,,,,{},dataset/txt_limpios/1260.txt,dataset/paginas_descargadas/1260.html,EN,sin_categoria,discard,0.30,no_category_detected
1261,Selecciona un local,,X > 150 G,12.0,USD,,Desconocido,unknown,US,Selecciona un local,X,,150 G,12.00,USD,.,.12,12.0,False,original,12.0,12.0,1.0,default_1usd,,,,,,,,{},dataset/txt_limpios/1261.txt,dataset/paginas_descargadas/1261.html,EN,sin_categoria,discard,0.30,no_category_detected
1262,Selecciona un local,,X,12.0,USD,,Desconocido,unknown,US,Selecciona un local,X,,,12.00,USD,.,.12,12.0,False,original,12.0,12.0,1.0,default_1usd,,,,,,,,{},dataset/txt_limpios/1262.txt,dataset/paginas_descargadas/1262.html,EN,sin_categoria,discard,0.30,no_category_detected
1263,Selecciona un local,,X > 400 G,12.0,USD,,Desconocido,unknown,US,Selecciona un local,X,,400 G,12.00,USD,.,.12,12.0,False,original,12.0,12.0,1.0,default_1usd,,,,,,,,{},dataset/txt_limpios/1263.txt,dataset/paginas_descargadas/1263.html,EN,sin_categoria,discard,0.30,no_category_detected
1264,Selecciona un local,,X > 1 kg,12.0,USD,,Desconocido,unknown,US,Selecciona un local,X,,1 kg,12.00,USD,.,.12,12.0,False,original,12.0,12.0,1.0,default_1usd,,,,,,,,{},dataset/txt_limpios/1264.txt,dataset/paginas_descargadas/1264.html,EN,sin_categoria,discard,0.30,no_category_detected
1265,Selecciona un local,,X > 250 G,12.0,USD,,Desconocido,unknown,US,Selecciona un local,X,,250 G,12.00,USD,.,.12,12.0,False,original,12.0,12.0,1.0,default_1usd,,,,,,,,{},dataset/txt_limpios/1265.txt,dataset/paginas_descargadas/1265.html,EN,sin_categoria,discard,0.30,no_category_detected
1266,Selecciona un local,,X,12.0,,,Desconocido,unknown,UNKNOWN,Selecciona un local,X,,,12.00,,.,.12,12.0,False,original,12.0,12.0,1.0,default_1usd,,,,,,,,{},dataset/txt_limpios/1266.txt,dataset/paginas_descargadas/1266.html,EN,sin_categoria,discard,0.30,no_category_detected
1267,Selecciona un local,,X,12.0,,,Desconocido,unknown,UNKNOWN,Selecciona un local,X,,,12.00,,.,.12,12.0,False,original,12.0,12.0,1.0,default_1usd,,,,,,,,{},dataset/txt_limpios/1267.txt,dataset/paginas_descargadas/1267.html,EN,sin_categoria,discard,0.30,no_category_detected
1268,Selecciona un local,,X > 5000 g,12.0,USD,,Desconocido,unknown,US,Selecciona un local,X,,5000 g,12.00,USD,.,.12,12.0,False,original,12.0,12.0,1.0,default_1usd,,,,,,,,{},dataset/txt_limpios/1268.txt,dataset/paginas_descargadas/1268.html,EN,sin_categoria,discard,0.30,no_category_detected
1269,Selecciona un local,,X > 750 ML,12.0,,,Desconocido,unknown,UNKNOWN,Selecciona un local,X,,750 ML,12.00,,.,.12,12.0,False,original,12.0,12.0,1.0,default_1usd,,,,,,,,{},dataset/txt_limpios/1269.txt,dataset/paginas_descargadas/1269.html,EN,sin_categoria,discard,0.30,no_category_detected
1270,Selecciona un local,,X,12.0,USD,,Desconocido,unknown,US,Selecciona un local,X,,,12.00,USD,.,.12,12.0,False,original,12.0,12.0,1.0,default_1usd,,,,,,,,{},dataset/txt_limpios/1270.txt,dataset/paginas_descargadas/1270.html,EN,sin_categoria,discard,0.30,no_category_detected
1271,Selecciona un local,,X,12.0,,,Desconocido,unknown,UNKNOWN,Selecciona un local,X,,,12.00,,.,.12,12.0,False,original,12.0,12.0,1.0,default_1usd,,,,,,,,{},dataset/txt_limpios/1271.txt,dataset/paginas_descargadas/1271.html,EN,sin_categoria,discard,0.30,no_category_detected
1272,Selecciona un local,,X > 1000 G,12.0,USD,,Desconocido,unknown,US,Selecciona un local,X,,1000 G,12.00,USD,.,.12,12.0,False,original,12.0,12.0,1.0,default_1usd,,,,,,,,{},dataset/txt_limpios/1272.txt,dataset/paginas_descargadas/1272.html,EN,sin_categoria,discard,0.30,no_category_detected
1273,Selecciona un local,,X,12.0,USD,,Desconocido,unknown,US,Selecciona un local,X,,,12.00,USD,.,.12,12.0,False,original,12.0,12.0,1.0,default_1usd,,,,,,,,{},dataset/txt_limpios/1273.txt,dataset/paginas_descargadas/1273.html,EN,sin_categoria,discard,0.30,no_category_detected
1274,Selecciona un local,,X,12.0,USD,,Desconocido,unknown,US,Selecciona un local,X,,,12.00,USD,.,.12,12.0,False,original,12.0,12.0,1.0,default_1usd,,,,,,,,{},dataset/txt_limpios/1274.txt,dataset/paginas_descargadas/1274.html,EN,sin_categoria,discard,0.30,no_category_detected
1275,Selecciona un local,,X,12.0,USD,,Desconocido,unknown,US,Selecciona un local,X,,,12.00,USD,.,.12,12.0,False,original,12.0,12.0,1.0,default_1usd,,,,,,,,{},dataset/txt_limpios/1275.txt,dataset/paginas_descargadas/1275.html,EN,sin_categoria,discard,0.30,no_category_detected
1276,Selecciona un local,,X,12.0,,,Desconocido,unknown,UNKNOWN,Selecciona un local,X,,,12.00,,.,.12,12.0,False,original,12.0,12.0,1.0,default_1usd,,,,,,,,{},dataset/txt_limpios/1276.txt,dataset/paginas_descargadas/1276.html,EN,sin_categoria,discard,0.30,no_category_detected
1277,Selecciona un local,,X > 5000 G,12.0,USD,,Desconocido,unknown,US,Selecciona un local,X,,5000 G,12.00,USD,.,.12,12.0,False,original,12.0,12.0,1.0,default_1usd,,,,,,,,{},dataset/txt_limpios/1277.txt,dataset/paginas_descargadas/1277.html,EN,sin_categoria,discard,0.30,no_category_detected
1278,Selecciona un local,,X > 1000 G,12.0,USD,,Desconocido,unknown,US,Selecciona un local,X,,1000 G,12.00,USD,.,.12,12.0,False,original,12.0,12.0,1.0,default_1usd,,,,,,,,{},dataset/txt_limpios/1278.txt,dataset/paginas_descargadas/1278.html,EN,sin_categoria,discard,0.30,no_category_detected
1279,Selecciona un local,,X > 5000 g,12.0,USD,,Desconocido,unknown,US,Selecciona un local,X,,5000 g,12.00,USD,.,.12,12.0,False,original,12.0,12.0,1.0,default_1usd,,,,,,,,{},dataset/txt_limpios/1279.txt,dataset/paginas_descargadas/1279.html,EN,sin_categoria,discard,0.30,no_category_detected
1280,Selecciona un local,,X,12.0,USD,,Desconocido,unknown,US,Selecciona un local,X,,,12.00,USD,.,.12,12.0,False,original,12.0,12.0,1.0,default_1usd,,,,,,,,{},dataset/txt_limpios/1280.txt,dataset/paginas_descargadas/1280.html,EN,sin_categoria,discard,0.30,no_category_detected
1576,Sem Açúcar,,"R$ 9,49 > 2L",9.49,BRL,,Desconocido,unknown,BR,Sem Açúcar,"R$ 9,49",,2L,9.49,BRL,R$,"R$9,49",9.49,False,original,1.7419,1.7419,5.448,from_brasil_cambio_dolar,,,,,,,,{},dataset/txt_limpios/1576.txt,dataset/paginas_descargadas/1576.html,EN,azucar,keep,0.60,heuristic_default
1579,Sem Açúcar,,"R$ 8,49 > 2L",8.49,BRL,,Desconocido,unknown,BR,Sem Açúcar,"R$ 8,49",,2L,8.49,BRL,R$,"R$8,49",8.49,False,original,1.5584,1.5584,5.448,from_brasil_cambio_dolar,,,,,,,,{},dataset/txt_limpios/1579.txt,dataset/paginas_descargadas/1579.html,EN,azucar,keep,0.60,heuristic_default
196,Sem Açúcar,,"R$ 9,49 > 2L",9.49,BRL,,Desconocido,unknown,BR,Sem Açúcar,"R$ 9,49",,2L,9.49,BRL,R$,"R$9,49",9.49,False,original,1.7419,1.7419,5.448,from_brasil_cambio_dolar,,,,,,,,{},dataset/txt_limpios/196.txt,dataset/paginas_descargadas/196.html,EN,azucar,keep,0.60,heuristic_default
197,Sem Açúcar,,"R$ 8,49 > 2L",8.49,BRL,,Desconocido,unknown,BR,Sem Açúcar,"R$ 8,49",,2L,8.49,BRL,R$,"R$8,49",8.49,False,original,1.5584,1.5584,5.448,from_brasil_cambio_dolar,,,,,,,,{},dataset/txt_limpios/197.txt,dataset/paginas_descargadas/197.html,EN,azucar,keep,0.60,heuristic_default
