source_id,title,description,breadcrumbs,price_raw,currency_raw,url,seller,availability,country,product_name,brand,reference,unit,price_amount,price_currency,price_symbol,price_text,price_amount_filled,price_is_imputed,price_imputation_source,price_amount_usd,price_amount_usd_filled,fx_rate_local_per_usd,fx_source,information_text,description_text,features_text,specifications_text,benefits_text,details_text,other_sections,sections,txt_path,html_path,es_status,category_canonical,decision,match_score,reasons
823,Saltar menú Cenco,Ingredientes Condición alimentaria Información nutricional Tipo de Producto Bebidas Gaseosas Cantidad 1 un. Envase Botella plástico desechable (bebidas) Gasificado Sí País de Origen Chile Sabor Cola Contenido Entre 1 y 2 lt Garantía Mínima Legal Válida hasta su fecha de caducidad Te podrían interesar Kryzpo Papas Fritas Kryzpo Original 130 g Oferta 25% dcto. La Crianza Hamburguesa de Vacuno La Crianza 1 kg 10 un. Pomarola Salsa de Tomate Pomarola 200 g 6 un. Centro de preferencia de privacidad Gestionar las preferencias de consentimiento Activas siempre Back Button Search Icon Filter Icon Clear checkbox label label Apply Cancel Consent Leg.Interest Permitir todas Rechazar todas Confirmar mis preferencias,Exclusivo online > 1.5 L,3.0,,,Desconocido,unknown,UNKNOWN,Saltar menú Cenco,Exclusivo online,,1.5 L,3.00,,,3,3.0,False,original,3.0,3.0,1.0,default_1usd,,Ingredientes Condición alimentaria Información nutricional Tipo de Producto Bebidas Gaseosas Cantidad 1 un. Envase Botella plástico desechable (bebidas) Gasificado Sí País de Origen Chile Sabor Cola Contenido Entre 1 y 2 lt Garantía Mínima Legal Válida hasta su fecha de caducidad Te podrían interesar Kryzpo Papas Fritas Kryzpo Original 130 g Oferta 25% dcto. La Crianza Hamburguesa de Vacuno La Crianza 1 kg 10 un. Pomarola Salsa de Tomate Pomarola 200 g 6 un. Centro de preferencia de privacidad Gestionar las preferencias de consentimiento Activas siempre Back Button Search Icon Filter Icon Clear checkbox label label Apply Cancel Consent Leg.Interest Permitir todas Rechazar todas Confirmar mis preferencias,,,,,,"{""Descripción"": [""Ingredientes"", ""Condición alimentaria"", ""Información nutricional"", ""Tipo de Producto"", ""Bebidas Gaseosas"", ""Cantidad"", ""1 un."", ""Envase"", ""Botella plástico desechable (bebidas)"", ""Gasificado"", ""Sí"", ""País de origen"", ""Chile"", ""Sabor"", ""Cola"", ""Contenido"", ""Entre 1 y 2 lt"", ""Garantía Mínima Legal"", ""Válida hasta su fecha de caducidad"", ""Te podrían interesar"", ""Kryzpo"", ""Papas Fritas Kryzpo Original 130 g"", ""Oferta"", ""25% dcto."", ""La Crianza"", ""Hamburguesa de Vacuno La Crianza 1 kg 10 un."", ""Pomarola"", ""Salsa de Tomate Pomarola 200 g 6 un."", ""Centro de preferencia de privacidad"", ""Gestionar las preferencias de consentimiento"", ""Activas siempre"", ""Back Button"", ""Search Icon"", ""Filter Icon"", ""Clear"", ""checkbox label"", ""label"", ""Apply"", ""Cancel"", ""Consent"", ""Leg.Interest"", ""Permitir todas"", ""Rechazar todas"", ""Confirmar mis preferencias""]}",dataset/txt_limpios/823.txt,dataset/paginas_descargadas/823.html,ET,descartado,discard,0.10,excluded_keyword
824,Saltar menú Cenco,Ingredientes Condición alimentaria Información nutricional Tipo de Producto Bebidas Gaseosas Cantidad 1 un. Envase Botella plástico desechable (bebidas) Gasificado Sí País de Origen Chile Sabor Ginger Ale Contenido Entre 1 y 2 lt Garantía Mínima Legal Válida hasta su fecha de caducidad Te podrían interesar Kryzpo Papas Fritas Kryzpo Original 130 g Pomarola Salsa de Tomate Pomarola 200 g 6 un. 25% dcto. La Crianza Hamburguesa de Vacuno La Crianza 1 kg 10 un. 3.8 Centro de preferencia de privacidad Gestionar las preferencias de consentimiento Activas siempre Back Button Search Icon Filter Icon Clear checkbox label label Apply Cancel Consent Leg.Interest Permitir todas Rechazar todas Confirmar mis preferencias,Exclusivo online > 1.5 L,3.0,,,Desconocido,unknown,UNKNOWN,Saltar menú Cenco,Exclusivo online,,1.5 L,3.00,,,3,3.0,False,original,3.0,3.0,1.0,default_1usd,,Ingredientes Condición alimentaria Información nutricional Tipo de Producto Bebidas Gaseosas Cantidad 1 un. Envase Botella plástico desechable (bebidas) Gasificado Sí País de Origen Chile Sabor Ginger Ale Contenido Entre 1 y 2 lt Garantía Mínima Legal Válida hasta su fecha de caducidad Te podrían interesar Kryzpo Papas Fritas Kryzpo Original 130 g Pomarola Salsa de Tomate Pomarola 200 g 6 un. 25% dcto. La Crianza Hamburguesa de Vacuno La Crianza 1 kg 10 un. 3.8 Centro de preferencia de privacidad Gestionar las preferencias de consentimiento Activas siempre Back Button Search Icon Filter Icon Clear checkbox label label Apply Cancel Consent Leg.Interest Permitir todas Rechazar todas Confirmar mis preferencias,,,,,,"{""Descripción"": [""Ingredientes"", ""Condición alimentaria"", ""Información nutricional"", ""Tipo de Producto"", ""Bebidas Gaseosas"", ""Cantidad"", ""1 un."", ""Envase"", ""Botella plástico desechable (bebidas)"", ""Gasificado"", ""Sí"", ""País de origen"", ""Chile"", ""Sabor"", ""Ginger Ale"", ""Contenido"", ""Entre 1 y 2 lt"", ""Garantía Mínima Legal"", ""Válida hasta su fecha de caducidad"", ""Te podrían interesar"", ""Kryzpo"", ""Papas Fritas Kryzpo Original 130 g"", ""Pomarola"", ""Salsa de Tomate Pomarola 200 g 6 un."", ""25% dcto."", ""La Crianza"", ""Hamburguesa de Vacuno La Crianza 1 kg 10 un."", ""3.8"", ""Centro de preferencia de privacidad"", ""Gestionar las preferencias de consentimiento"", ""Activas siempre"", ""Back Button"", ""Search Icon"", ""Filter Icon"", ""Clear"", ""checkbox label"", ""label"", ""Apply"", ""Cancel"", ""Consent"", ""Leg.Interest"", ""Permitir todas"", ""Rechazar todas"", ""Confirmar mis preferencias""]}",dataset/txt_limpios/824.txt,dataset/paginas_descargadas/824.html,ET,descartado,discard,0.10,excluded_keyword
825,Saltar menú Cenco,Ingredientes Condición alimentaria Información nutricional Tipo de Producto Bebidas Gaseosas Cantidad 1 un. Envase Botella plástico desechable (bebidas) Gasificado Sí País de Origen Chile Sabor Piña Contenido Entre 1 y 2 lt Garantía Mínima Legal Válida hasta su fecha de caducidad Te podrían interesar Soprole Mantequilla Soprole Untable Pote 350 g 3.0 Quillayes 4.8 Receta del Abuelo Jamón Pierna Artesanal Receta del Abuelo Corte Pluma 125 g 4.0 Centro de preferencia de privacidad Gestionar las preferencias de consentimiento Activas siempre Back Button Search Icon Filter Icon Clear checkbox label label Apply Cancel Consent Leg.Interest Permitir todas Rechazar todas Confirmar mis preferencias,Exclusivo online > 1.5 L,3.0,,,Desconocido,unknown,UNKNOWN,Saltar menú Cenco,Exclusivo online,,1.5 L,3.00,,,3,3.0,False,original,3.0,3.0,1.0,default_1usd,,Ingredientes Condición alimentaria Información nutricional Tipo de Producto Bebidas Gaseosas Cantidad 1 un. Envase Botella plástico desechable (bebidas) Gasificado Sí País de Origen Chile Sabor Piña Contenido Entre 1 y 2 lt Garantía Mínima Legal Válida hasta su fecha de caducidad Te podrían interesar Soprole Mantequilla Soprole Untable Pote 350 g 3.0 Quillayes 4.8 Receta del Abuelo Jamón Pierna Artesanal Receta del Abuelo Corte Pluma 125 g 4.0 Centro de preferencia de privacidad Gestionar las preferencias de consentimiento Activas siempre Back Button Search Icon Filter Icon Clear checkbox label label Apply Cancel Consent Leg.Interest Permitir todas Rechazar todas Confirmar mis preferencias,,,,,,"{""Descripción"": [""Ingredientes"", ""Condición alimentaria"", ""Información nutricional"", ""Tipo de Producto"", ""Bebidas Gaseosas"", ""Cantidad"", ""1 un."", ""Envase"", ""Botella plástico desechable (bebidas)"", ""Gasificado"", ""Sí"", ""País de origen"", ""Chile"", ""Sabor"", ""Piña"", ""Contenido"", ""Entre 1 y 2 lt"", ""Garantía Mínima Legal"", ""Válida hasta su fecha de caducidad"", ""Te podrían interesar"", ""Soprole"", ""Mantequilla Soprole Untable Pote 350 g"", ""3.0"", ""Quillayes"", ""4.8"", ""Receta del Abuelo"", ""Jamón Pierna Artesanal Receta del Abuelo Corte Pluma 125 g"", ""4.0"", ""Centro de preferencia de privacidad"", ""Gestionar las preferencias de consentimiento"", ""Activas siempre"", ""Back Button"", ""Search Icon"", ""Filter Icon"", ""Clear"", ""checkbox label"", ""label"", ""Apply"", ""Cancel"", ""Consent"", ""Leg.Interest"", ""Permitir todas"", ""Rechazar todas"", ""Confirmar mis preferencias""]}",dataset/txt_limpios/825.txt,dataset/paginas_descargadas/825.html,ET,descartado,discard,0.10,excluded_keyword
826,Saltar menú Cenco,Ingredientes Condición alimentaria Información nutricional Tipo de Producto Bebidas Gaseosas Cantidad 1 un. Envase Botella plástico desechable (bebidas) Gasificado Sí País de Origen Chile Sabor Naranja Contenido Entre 1 y 2 lt Te podrían interesar Centro de preferencia de privacidad Gestionar las preferencias de consentimiento Activas siempre Back Button Search Icon Filter Icon Clear checkbox label label Apply Cancel Consent Leg.Interest Permitir todas Rechazar todas Confirmar mis preferencias,Agotado > 1.5 L,3.0,,,Desconocido,unknown,UNKNOWN,Saltar menú Cenco,Agotado,,1.5 L,3.00,,,3,3.0,False,original,3.0,3.0,1.0,default_1usd,,Ingredientes Condición alimentaria Información nutricional Tipo de Producto Bebidas Gaseosas Cantidad 1 un. Envase Botella plástico desechable (bebidas) Gasificado Sí País de Origen Chile Sabor Naranja Contenido Entre 1 y 2 lt Te podrían interesar Centro de preferencia de privacidad Gestionar las preferencias de consentimiento Activas siempre Back Button Search Icon Filter Icon Clear checkbox label label Apply Cancel Consent Leg.Interest Permitir todas Rechazar todas Confirmar mis preferencias,,,,,,"{""Descripción"": [""Ingredientes"", ""Condición alimentaria"", ""Información nutricional"", ""Tipo de Producto"", ""Bebidas Gaseosas"", ""Cantidad"", ""1 un."", ""Envase"", ""Botella plástico desechable (bebidas)"", ""Gasificado"", ""Sí"", ""País de origen"", ""Chile"", ""Sabor"", ""Naranja"", ""Contenido"", ""Entre 1 y 2 lt"", ""Te podrían interesar"", ""Centro de preferencia de privacidad"", ""Gestionar las preferencias de consentimiento"", ""Activas siempre"", ""Back Button"", ""Search Icon"", ""Filter Icon"", ""Clear"", ""checkbox label"", ""label"", ""Apply"", ""Cancel"", ""Consent"", ""Leg.Interest"", ""Permitir todas"", ""Rechazar todas"", ""Confirmar mis preferencias""]}",dataset/txt_limpios/826.txt,dataset/paginas_descargadas/826.html,ET,sin_categoria,discard,0.30,no_category_detected
827,Saltar menú Cenco,Tipo de Producto Tomate Larga Vida Grupo Tomates Te podrían interesar Plátano Extra Granel (1 A 2 un. Aprox) Panadería Propia Pan Marraqueta Grande Granel Cebolla Malla 3 un. Centro de preferencia de privacidad Gestionar las preferencias de consentimiento Activas siempre Back Button Search Icon Filter Icon Clear checkbox label label Apply Cancel Consent Leg.Interest Permitir todas Rechazar todas Confirmar mis preferencias,Frutas y Verduras Propias,995.0,,,Desconocido,unknown,UNKNOWN,Saltar menú Cenco,Frutas y Verduras Propias,,,995.00,,$,$995,995.0,False,original,995.0,995.0,1.0,default_1usd,,Tipo de Producto Tomate Larga Vida Grupo Tomates Te podrían interesar Plátano Extra Granel (1 A 2 un. Aprox) Panadería Propia Pan Marraqueta Grande Granel Cebolla Malla 3 un. Centro de preferencia de privacidad Gestionar las preferencias de consentimiento Activas siempre Back Button Search Icon Filter Icon Clear checkbox label label Apply Cancel Consent Leg.Interest Permitir todas Rechazar todas Confirmar mis preferencias,,,,,,"{""Descripción"": [""Tipo de Producto"", ""Tomate Larga Vida"", ""Grupo"", ""Tomates"", ""Te podrían interesar"", ""Plátano Extra Granel (1 A 2 un. Aprox)"", ""Panadería Propia"", ""Pan Marraqueta Grande Granel"", ""Cebolla Malla 3 un."", ""Centro de preferencia de privacidad"", ""Gestionar las preferencias de consentimiento"", ""Activas siempre"", ""Back Button"", ""Search Icon"", ""Filter Icon"", ""Clear"", ""checkbox label"", ""label"", ""Apply"", ""Cancel"", ""Consent"", ""Leg.Interest"", ""Permitir todas"", ""Rechazar todas"", ""Confirmar mis preferencias""]}",dataset/txt_limpios/827.txt,dataset/paginas_descargadas/827.html,EN,banano,keep,0.60,heuristic_default
828,Saltar menú Cenco,,Frutas y verduras,,,,Desconocido,unknown,UNKNOWN,Saltar menú Cenco,Frutas y verduras,,,,,,,234.19,True,country_mean,,234.1938,1.0,default_1usd,,,,,,,,{},dataset/txt_limpios/828.txt,dataset/paginas_descargadas/828.html,EN,sin_categoria,discard,0.30,no_category_detected;price_parse_failed
829,Saltar menú Cenco,"Ingredientes Condición alimentaria Información nutricional Tipo de Producto Huevo de Gallina Color Blanco Cantidad 12 unidades Envase Bandeja País de Origen Chile Tamaño del Huevo Grande [[""""]] Te podrían interesar Lobos Sal Lobos Fina 1 kg Exclusivo online Frutas y Verduras Propias Pepino Ensalada 1 un. Cuisine & Co Pimienta Negra Entera 15 g Centro de preferencia de privacidad Gestionar las preferencias de consentimiento Activas siempre Back Button Search Icon Filter Icon Clear checkbox label label Apply Cancel Consent Leg.Interest Permitir todas Rechazar todas Confirmar mis preferencias",Cintazul > 12 unidades,4.19,,,Desconocido,unknown,UNKNOWN,Saltar menú Cenco,Cintazul,,12 unidades,4.19,,$,$4.19,4.19,False,original,4.19,4.19,1.0,default_1usd,,"Ingredientes Condición alimentaria Información nutricional Tipo de Producto Huevo de Gallina Color Blanco Cantidad 12 unidades Envase Bandeja País de Origen Chile Tamaño del Huevo Grande [[""""]] Te podrían interesar Lobos Sal Lobos Fina 1 kg Exclusivo online Frutas y Verduras Propias Pepino Ensalada 1 un. Cuisine & Co Pimienta Negra Entera 15 g Centro de preferencia de privacidad Gestionar las preferencias de consentimiento Activas siempre Back Button Search Icon Filter Icon Clear checkbox label label Apply Cancel Consent Leg.Interest Permitir todas Rechazar todas Confirmar mis preferencias",,,,,,"{""Descripción"": [""Ingredientes"", ""Condición alimentaria"", ""Información nutricional"", ""Tipo de Producto"", ""Huevo de Gallina"", ""Color"", ""Blanco"", ""Cantidad"", ""12 unidades"", ""Envase"", ""Bandeja"", ""País de origen"", ""Chile"", ""Tamaño del Huevo"", ""Grande"", ""[[\""\""]]"", ""Te podrían interesar"", ""Lobos"", ""Sal Lobos Fina 1 kg"", ""Exclusivo online"", ""Frutas y Verduras Propias"", ""Pepino Ensalada 1 un."", ""Cuisine & Co"", ""Pimienta Negra Entera 15 g"", ""Centro de preferencia de privacidad"", ""Gestionar las preferencias de consentimiento"", ""Activas siempre"", ""Back Button"", ""Search Icon"", ""Filter Icon"", ""Clear"", ""checkbox label"", ""label"", ""Apply"", ""Cancel"", ""Consent"", ""Leg.Interest"", ""Permitir todas"", ""Rechazar todas"", ""Confirmar mis preferencias""]}",dataset/txt_limpios/829.txt,dataset/paginas_descargadas/829.html,ET,huevo,discard,0.30,heuristic_default
830,Saltar menú Cenco,Ingredientes Condición alimentaria Información nutricional Tipo de Producto Huevo de Gallina Envase Bandeja País de Origen Chile Garantía Mínima Legal Válida hasta su fecha de caducidad Te podrían interesar Leche Cuisine & Co Entera 1 L Soprole Mantequilla Soprole Untable Pote 350 g Centro de preferencia de privacidad Gestionar las preferencias de consentimiento Activas siempre Back Button Search Icon Filter Icon Clear checkbox label label Apply Cancel Consent Leg.Interest Permitir todas Rechazar todas Confirmar mis preferencias,Cuisine & Co > 1 L,3.89,,,Desconocido,unknown,UNKNOWN,Saltar menú Cenco,Cuisine & Co,,1 L,3.89,,$,$3.89,3.89,False,original,3.89,3.89,1.0,default_1usd,,Ingredientes Condición alimentaria Información nutricional Tipo de Producto Huevo de Gallina Envase Bandeja País de Origen Chile Garantía Mínima Legal Válida hasta su fecha de caducidad Te podrían interesar Leche Cuisine & Co Entera 1 L Soprole Mantequilla Soprole Untable Pote 350 g Centro de preferencia de privacidad Gestionar las preferencias de consentimiento Activas siempre Back Button Search Icon Filter Icon Clear checkbox label label Apply Cancel Consent Leg.Interest Permitir todas Rechazar todas Confirmar mis preferencias,,,,,,"{""Descripción"": [""Ingredientes"", ""Condición alimentaria"", ""Información nutricional"", ""Tipo de Producto"", ""Huevo de Gallina"", ""Envase"", ""Bandeja"", ""País de origen"", ""Chile"", ""Garantía Mínima Legal"", ""Válida hasta su fecha de caducidad"", ""Te podrían interesar"", ""Leche Cuisine & Co Entera 1 L"", ""Soprole"", ""Mantequilla Soprole Untable Pote 350 g"", ""Centro de preferencia de privacidad"", ""Gestionar las preferencias de consentimiento"", ""Activas siempre"", ""Back Button"", ""Search Icon"", ""Filter Icon"", ""Clear"", ""checkbox label"", ""label"", ""Apply"", ""Cancel"", ""Consent"", ""Leg.Interest"", ""Permitir todas"", ""Rechazar todas"", ""Confirmar mis preferencias""]}",dataset/txt_limpios/830.txt,dataset/paginas_descargadas/830.html,ET,descartado,discard,0.10,excluded_keyword
831,Saltar menú Cenco,Ingredientes Condición alimentaria Información nutricional Tipo de Producto Huevo de Gallina Envase Bandeja País de Origen Chile Garantía Mínima Legal Válida hasta su fecha de caducidad Te podrían interesar Exclusivo online 20% dcto. Jumbo Artesanal Pan Molde Proteína Clean Label 780 g Cuisine & Co Leche Cuisine & Co Entera 1 L Soprole Mantequilla Soprole Untable Pote 350 g Centro de preferencia de privacidad Gestionar las preferencias de consentimiento Activas siempre Back Button Search Icon Filter Icon Clear checkbox label label Apply Cancel Consent Leg.Interest Permitir todas Rechazar todas Confirmar mis preferencias,Santa Marta > 780 g,4.45,,,Desconocido,unknown,UNKNOWN,Saltar menú Cenco,Santa Marta,,780 g,4.45,,$,$4.45,4.45,False,original,4.45,4.45,1.0,default_1usd,,Ingredientes Condición alimentaria Información nutricional Tipo de Producto Huevo de Gallina Envase Bandeja País de Origen Chile Garantía Mínima Legal Válida hasta su fecha de caducidad Te podrían interesar Exclusivo online 20% dcto. Jumbo Artesanal Pan Molde Proteína Clean Label 780 g Cuisine & Co Leche Cuisine & Co Entera 1 L Soprole Mantequilla Soprole Untable Pote 350 g Centro de preferencia de privacidad Gestionar las preferencias de consentimiento Activas siempre Back Button Search Icon Filter Icon Clear checkbox label label Apply Cancel Consent Leg.Interest Permitir todas Rechazar todas Confirmar mis preferencias,,,,,,"{""Descripción"": [""Ingredientes"", ""Condición alimentaria"", ""Información nutricional"", ""Tipo de Producto"", ""Huevo de Gallina"", ""Envase"", ""Bandeja"", ""País de origen"", ""Chile"", ""Garantía Mínima Legal"", ""Válida hasta su fecha de caducidad"", ""Te podrían interesar"", ""Exclusivo online"", ""20% dcto."", ""Jumbo Artesanal"", ""Pan Molde Proteína Clean Label 780 g"", ""Cuisine & Co"", ""Leche Cuisine & Co Entera 1 L"", ""Soprole"", ""Mantequilla Soprole Untable Pote 350 g"", ""Centro de preferencia de privacidad"", ""Gestionar las preferencias de consentimiento"", ""Activas siempre"", ""Back Button"", ""Search Icon"", ""Filter Icon"", ""Clear"", ""checkbox label"", ""label"", ""Apply"", ""Cancel"", ""Consent"", ""Leg.Interest"", ""Permitir todas"", ""Rechazar todas"", ""Confirmar mis preferencias""]}",dataset/txt_limpios/831.txt,dataset/paginas_descargadas/831.html,ET,descartado,discard,0.10,excluded_keyword
832,Saltar menú Cenco,Ingredientes Condición alimentaria Información nutricional Tipo de Producto Huevo de Gallina Número de Personas 6 o + Personas Envase Bandeja País de Origen Chile Tamaño del Huevo Grande Tamaño Familiar Almacenamiento Mantener en lugar fresco y seco Centro de preferencia de privacidad Gestionar las preferencias de consentimiento Activas siempre Back Button Search Icon Filter Icon Clear checkbox label label Apply Cancel Consent Leg.Interest Permitir todas Rechazar todas Confirmar mis preferencias,Coliumo,3.99,,,Desconocido,unknown,UNKNOWN,Saltar menú Cenco,Coliumo,,,3.99,,$,$3.99,3.99,False,original,3.99,3.99,1.0,default_1usd,,Ingredientes Condición alimentaria Información nutricional Tipo de Producto Huevo de Gallina Número de Personas 6 o + Personas Envase Bandeja País de Origen Chile Tamaño del Huevo Grande Tamaño Familiar Almacenamiento Mantener en lugar fresco y seco Centro de preferencia de privacidad Gestionar las preferencias de consentimiento Activas siempre Back Button Search Icon Filter Icon Clear checkbox label label Apply Cancel Consent Leg.Interest Permitir todas Rechazar todas Confirmar mis preferencias,,,,,,"{""Descripción"": [""Ingredientes"", ""Condición alimentaria"", ""Información nutricional"", ""Tipo de Producto"", ""Huevo de Gallina"", ""Número de Personas"", ""6 o + Personas"", ""Envase"", ""Bandeja"", ""País de origen"", ""Chile"", ""Tamaño del Huevo"", ""Grande"", ""Tamaño"", ""Familiar"", ""Almacenamiento"", ""Mantener en lugar fresco y seco"", ""Centro de preferencia de privacidad"", ""Gestionar las preferencias de consentimiento"", ""Activas siempre"", ""Back Button"", ""Search Icon"", ""Filter Icon"", ""Clear"", ""checkbox label"", ""label"", ""Apply"", ""Cancel"", ""Consent"", ""Leg.Interest"", ""Permitir todas"", ""Rechazar todas"", ""Confirmar mis preferencias""]}",dataset/txt_limpios/832.txt,dataset/paginas_descargadas/832.html,ET,huevo,discard,0.30,heuristic_default
