{"source_id": "15", "title": "Lacteos y huevo", "description": "Leche Entera Ultrapasteurizada Es un producto de alta calidad y gran sabor, Ideal para hacer preparación de café con un exquisito sabor cremoso con el cuerpo y textura deseados igual que en una cafetería.", "breadcrumbs": "Leche > 946ml > 3804250", "price_raw": "39.0", "currency_raw": "MXN", "url": "", "seller": "Chedraui", "availability": "unknown", "country": "MX", "product_name": "Lacteos y huevo", "brand": "Leche", "reference": "3804250.0", "unit": "946ml", "price_amount": 39.0, "price_currency": "MXN", "price_symbol": "$", "price_text": "$39.00", "price_amount_filled": "39.0", "price_is_imputed": "False", "price_imputation_source": "original", "price_amount_usd": "2.0945", "price_amount_usd_filled": "2.0945", "fx_rate_local_per_usd": "18.62", "fx_source": "from_mexico_cambio_dolar", "information_text": "Leche Entera Ultrapasteurizada", "description_text": "", "features_text": "Ultrapasteurizada | Delicioso sabor | Cremoso", "specifications_text": "Es un producto de alta calidad y gran sabor, Ideal para hacer preparación de café con un exquisito sabor cremoso con el cuerpo y textura deseados igual que en una cafetería.", "benefits_text": "", "details_text": "", "other_sections": "", "sections": {"Información": ["Leche Entera Ultrapasteurizada"], "Características": ["Ultrapasteurizada", "Delicioso sabor", "Cremoso"], "Especificaciones": ["Es un producto de alta calidad y gran sabor, Ideal para hacer preparación de café con un exquisito sabor cremoso con el cuerpo y textura deseados igual que en una cafetería."]}, "txt_path": "dataset/txt_limpios/15.txt", "html_path": "dataset/paginas_descargadas/15.html", "es_status": "ET", "category_canonical": "leche", "decision": "keep", "match_score": 0.6, "reasons": "heuristic_default"}
{"source_id": "28", "title": "Lacteos y huevo", "description": "Huevo Blanco fresco de gallina seleccionado 30 piezas. El complemento y ingrediente imprescindible de las recetas familiares. Ideal para su consumo en cualquier momento del día. Huevo Blanco 30 piezas Bachoco. Huevo fresco de gallina seleccionado. El complemento y ingrediente imprescindible de las recetas familiares. Ideal para su consumo en cualquier momento del día. Alto en proteína. Su sabor y frescura te encantarán. Te sugerimos servirlo en el desayuno, la comida la escena y disfrutarlos con tus familiares o amigos. | Instrucciones para cocinar: Se recomienda su consumo totalmente cocido | Método de conservación: Mantener en un lugar fresco y seco.", "breadcrumbs": "Huevos > 30 piezas > 3101196", "price_raw": "106.0", "currency_raw": "MXN", "url": "", "seller": "Chedraui", "availability": "unknown", "country": "MX", "product_name": "Lacteos y huevo", "brand": "Huevos", "reference": "3101196.0", "unit": "30 piezas", "price_amount": 106.0, "price_currency": "MXN", "price_symbol": "$", "price_text": "$106.00", "price_amount_filled": "106.0", "price_is_imputed": "False", "price_imputation_source": "original", "price_amount_usd": "5.6928", "price_amount_usd_filled": "5.6928", "fx_rate_local_per_usd": "18.62", "fx_source": "from_mexico_cambio_dolar", "information_text": "Huevo Blanco fresco de gallina seleccionado 30 piezas. El complemento y ingrediente imprescindible de las recetas familiares. Ideal para su consumo en cualquier momento del día.", "description_text": "", "features_text": "Fresco | Alimento rico en vitaminas | Alimento rico en proteínas | Fuente de calcio", "specifications_text": "Huevo Blanco 30 piezas Bachoco. Huevo fresco de gallina seleccionado. El complemento y ingrediente imprescindible de las recetas familiares. Ideal para su consumo en cualquier momento del día. Alto en proteína. Su sabor y frescura te encantarán. Te sugerimos servirlo en el desayuno, la comida la escena y disfrutarlos con tus familiares o amigos. | Instrucciones para cocinar: Se recomienda su consumo totalmente cocido | Método de conservación: Mantener en un lugar fresco y seco.", "benefits_text": "", "details_text": "", "other_sections": "", "sections": {"Información": ["Huevo Blanco fresco de gallina seleccionado 30 piezas. El complemento y ingrediente imprescindible de las recetas familiares. Ideal para su consumo en cualquier momento del día."], "Características": ["Fresco", "Alimento rico en vitaminas", "Alimento rico en proteínas", "Fuente de calcio"], "Especificaciones": ["Huevo Blanco 30 piezas Bachoco. Huevo fresco de gallina seleccionado. El complemento y ingrediente imprescindible de las recetas familiares. Ideal para su consumo en cualquier momento del día. Alto en proteína. Su sabor y frescura te encantarán. Te sugerimos servirlo en el desayuno, la comida la escena y disfrutarlos con tus familiares o amigos.", "Instrucciones para cocinar: Se recomienda su consumo totalmente cocido", "Método de conservación: Mantener en un lugar fresco y seco."]}, "txt_path": "dataset/txt_limpios/28.txt", "html_path": "dataset/paginas_descargadas/28.html", "es_status": "ET", "category_canonical": "huevo", "decision": "discard", "match_score": 0.3, "reasons": "heuristic_default"}
{"source_id": "29", "title": "Lacteos y huevo", "description": "Prepara  infinidad de postres, desayunos, comidas y cenas con Huevo San Juan, lleva a casa un alimento completo, nutritivo y fresco para tu familia.", "breadcrumbs": "Huevos > 30 Piezas > 3101215", "price_raw": "87.5", "currency_raw": "MXN", "url": "", "seller": "Chedraui", "availability": "unknown", "country": "MX", "product_name": "Lacteos y huevo", "brand": "Huevos", "reference": "3101215.0", "unit": "30 Piezas", "price_amount": 87.5, "price_currency": "MXN", "price_symbol": "$", "price_text": "$87.50", "price_amount_filled": "87.5", "price_is_imputed": "False", "price_imputation_source": "original", "price_amount_usd": "4.6992", "price_amount_usd_filled": "4.6992", "fx_rate_local_per_usd": "18.62", "fx_source": "from_mexico_cambio_dolar", "information_text": "", "description_text": "", "features_text": "El único huevo en México con un código de frescura. | En tu tienda en menos de 36 horas después de su postura. | Comprueba su calidad sin abrir el empaque | Cuidamos sus nutrientes desde la alimentación de nuestras gallinas.", "specifications_text": "Prepara  infinidad de postres, desayunos, comidas y cenas con Huevo San Juan, lleva a casa un alimento completo, nutritivo y fresco para tu familia.", "benefits_text": "", "details_text": "", "other_sections": "", "sections": {"Características": ["El único huevo en México con un código de frescura.", "En tu tienda en menos de 36 horas después de su postura.", "Comprueba su calidad sin abrir el empaque", "Cuidamos sus nutrientes desde la alimentación de nuestras gallinas."], "Especificaciones": ["Prepara  infinidad de postres, desayunos, comidas y cenas con Huevo San Juan, lleva a casa un alimento completo, nutritivo y fresco para tu familia."]}, "txt_path": "dataset/txt_limpios/29.txt", "html_path": "dataset/paginas_descargadas/29.html", "es_status": "EN", "category_canonical": "huevo", "decision": "discard", "match_score": 0.3, "reasons": "heuristic_default"}
{"source_id": "30", "title": "Lacteos y huevo", "description": "30 Huevos Blancos Tehuacán para preparar ricos alimentos para toda la familia Huevo pero Fresco, Disfruta lo Natural, Ideal para preparar los Mejores Alimentos para Disfrutar con toda tu Familia", "breadcrumbs": "Huevos > 30 Piezas > 3101222", "price_raw": "", "currency_raw": "MXN", "url": "", "seller": "Chedraui", "availability": "unknown", "country": "MX", "product_name": "Lacteos y huevo", "brand": "Huevos", "reference": "3101222.0", "unit": "30 Piezas", "price_amount": null, "price_currency": "MXN", "price_symbol": "", "price_text": "", "price_amount_filled": "66.32", "price_is_imputed": "True", "price_imputation_source": "country_mean", "price_amount_usd": "", "price_amount_usd_filled": "3.5617", "fx_rate_local_per_usd": "18.62", "fx_source": "from_mexico_cambio_dolar", "information_text": "30 Huevos Blancos Tehuacán para preparar ricos alimentos para toda la familia", "description_text": "", "features_text": "Disfruta lo natural | Practico | Rico, nutritivo", "specifications_text": "Huevo mas Fresco, Disfruta lo Natural, Ideal para Preparar los Mejores Alimentos para Disfrutar con Toda tu Familia", "benefits_text": "", "details_text": "", "other_sections": "", "sections": {"Información": ["30 Huevos Blancos Tehuacán para preparar ricos alimentos para toda la familia"], "Características": ["Disfruta lo natural", "Practico", "Rico, nutritivo"], "Especificaciones": ["Huevo mas Fresco, Disfruta lo Natural, Ideal para Preparar los Mejores Alimentos para Disfrutar con Toda tu Familia"]}, "txt_path": "dataset/txt_limpios/30.txt", "html_path": "dataset/paginas_descargadas/30.html", "es_status": "ET", "category_canonical": "huevo", "decision": "discard", "match_score": 0.3, "reasons": "price_parse_failed"}
{"source_id": "32", "title": "Lacteos y huevo", "description": "Encuentra todo lo que necesitas para tu despensa en tu tienda online Chedraui.com.mx. Recibe en casa gracias al servicio a domicilio. Descarga la app.", "breadcrumbs": "Huevos > 30 Piezas > 3793290", "price_raw": "190.0", "currency_raw": "MXN", "url": "", "seller": "Chedraui", "availability": "unknown", "country": "MX", "product_name": "Lacteos y huevo", "brand": "Huevos", "reference": "3793290.0", "unit": "30 Piezas", "price_amount": 190.0, "price_currency": "MXN", "price_symbol": "$", "price_text": "$190.00", "price_amount_filled": "190.0", "price_is_imputed": "False", "price_imputation_source": "original", "price_amount_usd": "10.2041", "price_amount_usd_filled": "10.2041", "fx_rate_local_per_usd": "18.62", "fx_source": "from_mexico_cambio_dolar", "information_text": "", "description_text": "", "features_text": "Menos grasa saturada | Disfruta en una variedad de recetas", "specifications_text": "Encuentra todo lo que necesitas para tu despensa en tu tienda online Chedraui.com.mx. Recibe en casa gracias al servicio a domicilio. Descarga la app.", "benefits_text": "", "details_text": "", "other_sections": "", "sections": {"Características": ["Menos grasa saturada", "Disfruta en una variedad de recetas"], "Especificaciones": ["Encuentra todo lo que necesitas para tu despensa en tu tienda online Chedraui.com.mx. Recibe en casa gracias al servicio a domicilio. Descarga la app."]}, "txt_path": "dataset/txt_limpios/32.txt", "html_path": "dataset/paginas_descargadas/32.html", "es_status": "EN", "category_canonical": "descartado", "decision": "discard", "match_score": 0.1, "reasons": "excluded_keyword"}
{"source_id": "795", "title": "LECHE EQUILIBRIO TETRAPAK UHTLATTI 900ML", "description": "Ingredientes | Componentes Nombre del producto: Leche Equilibrio UHT 900 mL - Latti Descripción del producto: La Leche Equilibrio UHT de Latti, en presentación de 900 mL, viene en envase Tetra Pak. Es una leche semidescremada de larga vida, ideal para uso diario gracias a su embalaje práctico y duradero. Tamaño: 15 cm x 12 cm Peso: 900 mL Modo de fabricación: Industrial Origen: Nacional RSA-0026943-2023 Alergenos: Contiene proteína láctea. Se produce en una planta que procesa avena, nueces y soja. Componentes: Leche semidescremada estandarizada Estabilizante (Tripolifosfato de sodio) ¡Queremos que tengas la mejor experiencia! Si tienes dudas sobre este producto el contenido, te invitamos a consultar nuestros Términos y condiciones para conocer malas sobre los reembolsos y nuestras políticas de reembolso. Ver más También puede interesarte ACEITE VEGETAL IMATÁ 3.000 ML HUEVO TIPO A SOL NACIENTE 30 UND ARROZ ESTÁNDAR ALBAR 2500G PANELA PASTILLA 1000 G ARROZ DIANA 500 G PAN TAJADO BLANCO HORNEADITOS 450 GRS Amor y amistad SALCHICHA TRADICIONAL VIANDE 400 G ACEITE VEGETAL IMATÁ 900 ML ARROZ ECONÓMICO ALBAR 2000 GRS", "breadcrumbs": "Unidades disponibles > 900ML", "price_raw": "900.0", "currency_raw": "", "url": "", "seller": "Desconocido", "availability": "unknown", "country": "UNKNOWN", "product_name": "LECHE EQUILIBRIO TETRAPAK UHTLATTI 900ML", "brand": "Unidades disponibles", "reference": "", "unit": "900ML", "price_amount": 900.0, "price_currency": "", "price_symbol": "", "price_text": "900", "price_amount_filled": "900.0", "price_is_imputed": "False", "price_imputation_source": "original", "price_amount_usd": "900.0", "price_amount_usd_filled": "900.0", "fx_rate_local_per_usd": "1.0", "fx_source": "default_1usd", "information_text": "", "description_text": "Ingredientes | Componentes Nombre del producto: Leche Equilibrio UHT 900 mL - Latti Descripción del producto: La Leche Equilibrio UHT de Latti, en presentación de 900 mL, viene en envase Tetra Pak. Es una leche semidescremada de larga vida, ideal para uso diario gracias a su embalaje práctico y duradero. Tamaño: 15 cm x 12 cm Peso: 900 mL Modo de fabricación: Industrial Origen: Nacional RSA-0026943-2023 Alergenos: Contiene proteína láctea. Se produce en una planta que procesa avena, nueces y soja. Componentes: Leche semidescremada estandarizada Estabilizante (Tripolifosfato de sodio) ¡Queremos que tengas la mejor experiencia! Si tienes dudas sobre este producto el contenido, te invitamos a consultar nuestros Términos y condiciones para conocer malas sobre los reembolsos y nuestras políticas de reembolso. Ver más También puede interesarte ACEITE VEGETAL IMATÁ 3.000 ML HUEVO TIPO A SOL NACIENTE 30 UND ARROZ ESTÁNDAR ALBAR 2500G PANELA PASTILLA 1000 G ARROZ DIANA 500 G PAN TAJADO BLANCO HORNEADITOS 450 GRS Amor y amistad SALCHICHA TRADICIONAL VIANDE 400 G ACEITE VEGETAL IMATÁ 900 ML ARROZ ECONÓMICO ALBAR 2000 GRS", "features_text": "", "specifications_text": "", "benefits_text": "", "details_text": "", "other_sections": "", "sections": {"Descripción": ["Ingredientes | Componentes", "Nombre del producto: Leche Equilibrio UHT 900 mL - Latti", "Descripción del producto: La Leche Equilibrio UHT de Latti, en presentación de 900 mL, viene en envase Tetra Pak. Es una leche semidescremada de larga vida, ideal para uso diario gracias a su embalaje práctico y duradero.", "Tamaño: 15 cm x 12 cm", "Peso: 900 mL", "Modo de fabricación: Industrial", "Origen: Nacional", "RSA-0026943-2023", "Alergenos: contiene proteína láctea. Se produce en una planta que procesa avena, nueces y soja.", "Componentes: Leche semidescremada estandarizada", "Estabilizante (Tripolifosfato de sodio)", "¡Queremos que tengas la mejor experiencia! Si tienes dudas sobre este producto el contenido, te invitamos a consultar nuestros Términos y condiciones para conocer malas sobre los reembolsos y nuestras políticas de reembolso.", "Ver más", "También puede interesarte", "ACEITE VEGETAL IMATÁ 3.000 ML", "HUEVO TIPO A SOL NACIENTE 30 UND", "ARROZ ESTÁNDAR ALBAR 2500G", "PANELA PASTILLA 1000 G", "ARROZ DIANA 500 G", "PAN TAJADO BLANCO HORNEADITOS 450 GRS", "Amor y amistad", "SALCHICHA TRADICIONAL VIANDE 400 G", "ACEITE VEGETAL IMATÁ 900 ML", "ARROZ ECONÓMICO ALBAR 2000 GRS"]}, "txt_path": "dataset/txt_limpios/795.txt", "html_path": "dataset/paginas_descargadas/795.html", "es_status": "ET", "category_canonical": "leche", "decision": "keep", "match_score": 0.6, "reasons": "heuristic_default"}
{"source_id": "1343", "title": "LECHE LA LECHERA TETRABRIK 1 L ENTERA", "description": "Ficha técnica Leche toda la vida UHT La Lechera®. Fortificada con vitamina D, que ayuda a la absorción del calcio. Sin conservantes añadidos, fuente de calcio. ¿Deseas recibir notificaciones? Remind me later Permitir Thank you! Please check your email inbox to confirm. ¡Oops! Notifications are disabled.", "breadcrumbs": "Comparar > 1 L", "price_raw": "1.39", "currency_raw": "USD", "url": "", "seller": "Desconocido", "availability": "unknown", "country": "US", "product_name": "LECHE LA LECHERA TETRABRIK 1 L ENTERA", "brand": "Comparar", "reference": "", "unit": "1 L", "price_amount": 1.39, "price_currency": "USD", "price_symbol": "$", "price_text": "$1,39", "price_amount_filled": "1.39", "price_is_imputed": "False", "price_imputation_source": "original", "price_amount_usd": "1.39", "price_amount_usd_filled": "1.39", "fx_rate_local_per_usd": "1.0", "fx_source": "default_1usd", "information_text": "Ficha técnica Leche toda la vida UHT La Lechera®. Fortificada con vitamina D, que ayuda a la absorción del calcio. Sin conservantes añadidos, fuente de calcio. ¿Deseas recibir notificaciones? Remind me later Permitir Thank you! Please check your email inbox to confirm. ¡Oops! Notifications are disabled.", "description_text": "", "features_text": "", "specifications_text": "", "benefits_text": "", "details_text": "", "other_sections": "", "sections": {"Información": ["Ficha técnica", "Leche toda la vida UHT La Lechera®. Fortificada con vitamina D, que ayuda a la absorción del calcio. Sin conservantes añadidos, fuente de calcio.", "¿Deseas recibir notificaciones?", "Remind me later", "Permitir", "Thank you! Please check your email inbox to confirm.", "Oops! Notifications are disabled."]}, "txt_path": "dataset/txt_limpios/1343.txt", "html_path": "dataset/paginas_descargadas/1343.html", "es_status": "ET", "category_canonical": "leche", "decision": "keep", "match_score": 0.6, "reasons": "heuristic_default"}
{"source_id": "1344", "title": "LECHE PARMALAT 900 ML ENTERA", "description": "Ficha técnica ¿Deseas recibir notificaciones? Remind me later Permitir Thank you! Please check your email inbox to confirm. ¡Oops! Notifications are disabled.", "breadcrumbs": "Comparar > 900 ML", "price_raw": "0.99", "currency_raw": "USD", "url": "", "seller": "Desconocido", "availability": "unknown", "country": "US", "product_name": "LECHE PARMALAT 900 ML ENTERA", "brand": "Comparar", "reference": "", "unit": "900 ML", "price_amount": 0.99, "price_currency": "USD", "price_symbol": "$", "price_text": "$0,99", "price_amount_filled": "0.99", "price_is_imputed": "False", "price_imputation_source": "original", "price_amount_usd": "0.99", "price_amount_usd_filled": "0.99", "fx_rate_local_per_usd": "1.0", "fx_source": "default_1usd", "information_text": "Ficha técnica ¿Deseas recibir notificaciones? Remind me later Permitir Thank you! Please check your email inbox to confirm. ¡Oops! Notifications are disabled.", "description_text": "", "features_text": "", "specifications_text": "", "benefits_text": "", "details_text": "", "other_sections": "", "sections": {"Información": ["Ficha técnica", "¿Deseas recibir notificaciones?", "Remind me later", "Permitir", "Thank you! Please check your email inbox to confirm.", "Oops! Notifications are disabled."]}, "txt_path": "dataset/txt_limpios/1344.txt", "html_path": "dataset/paginas_descargadas/1344.html", "es_status": "ET", "category_canonical": "leche", "decision": "keep", "match_score": 0.6, "reasons": "heuristic_default"}
