{"source_id": "1181", "title": "Centro de preferencia de la privacidad", "description": "", "breadcrumbs": "Activas siempre > 2Kg", "price_raw": "", "currency_raw": "PEN", "url": "", "seller": "Desconocido", "availability": "unknown", "country": "PE", "product_name": "Centro de preferencia de la privacidad", "brand": "Activas siempre", "reference": "", "unit": "2Kg", "price_amount": null, "price_currency": "PEN", "price_symbol": "", "price_text": "", "price_amount_filled": "55.14", "price_is_imputed": "True", "price_imputation_source": "country_mean", "price_amount_usd": "", "price_amount_usd_filled": "15.5336", "fx_rate_local_per_usd": "3.55", "fx_source": "from_peru_cambio_dolar", "information_text": "", "description_text": "", "features_text": "TE RECOMENDAMOS | Azúcar Rubia DULFINA Bolsa 5Kg | 22 | BELL'S | Azúcar Rubia BELL'S Caja 60un | 7 | 30 | ONZA | Azúcar Rubia ONZA Light con Stevia Doypack 500g | CARTAVIO | Azúcar Rubia CARTAVIO Bolsa 5Kg | 23 | Azúcar Rubia CARTAVIO Bolsa 1Kg | No disponible | -4% | Azúcar Rubia DULFINA Bolsa 1Kg | 4 | 99 | 4% | Azúcar Rubia BELL'S Bolsa 5Kg | 20 | Azúcar Rubia BELL'S Bolsa 2Kg | 8 | 70 | Azúcar Rubia BELL'S Bolsa 1Kg | 10 | ¡Entérate de eventos exclusivos y promociones especiales que tenemos para ti! | SUSCRIBIRME | Acepto las políticas de tratamientos de datos personales | Razón Social: Compañía Food Retail S.A.C. RUC: 20608300393. Todos los derechos reservados Vivanda 2023. | | Hola! | Encuentra todo lo que necesitas en Vivanda online | Términos más buscados | 1. | quesos | 2. | vino | 3. | café | 4. | quark 500g | 5. | leche | 6. | pollo | 7. | yogurt | 8. | lunch florencia | 9. | agua | 10 | vinos", "specifications_text": "", "benefits_text": "", "details_text": "", "other_sections": "", "sections": {"Características": ["TE RECOMENDAMOS", "Azúcar Rubia DULFINA Bolsa 5Kg", "22", "BELL'S", "Azúcar Rubia BELL'S Caja 60un", "7", "30", "ONZA", "Azúcar Rubia ONZA Light con Stevia Doypack 500g", "CARTAVIO", "Azúcar Rubia CARTAVIO Bolsa 5Kg", "23", "Azúcar Rubia CARTAVIO Bolsa 1Kg", "No disponible", "-4%", "Azúcar Rubia DULFINA Bolsa 1Kg", "4", "99", "4%", "Azúcar Rubia BELL'S Bolsa 5Kg", "20", "Azúcar Rubia BELL'S Bolsa 2Kg", "8", "70", "Azúcar Rubia BELL'S Bolsa 1Kg", "10", "¡Entérate de eventos exclusivos y promociones especiales que tenemos para ti!", "SUSCRIBIRME", "Acepto las políticas de tratamiento de datos personales", "Razón social: Compañía Food Retail S.A.C. RUC: 20608300393. Todos los derechos reservados Vivanda 2023.", "¡Hola!", "Encuentra todo lo que necesitas en Vivanda online", "Términos más buscados", "1.", "quesos", "2.", "vino", "3.", "cafe", "4.", "quark 500g", "5.", "leche", "6.", "pollo", "7.", "yogurt", "8.", "lunch florencia", "9.", "agua", "10.", "vinos"]}, "txt_path": "dataset/txt_limpios/1181.txt", "html_path": "dataset/paginas_descargadas/1181.html", "es_status": "ET", "category_canonical": "sin_categoria", "decision": "discard", "match_score": 0.3, "reasons": "no_category_detected;price_parse_failed"}
{"source_id": "1182", "title": "Centro de preferencia de la privacidad", "description": "", "breadcrumbs": "Activas siempre > 500g", "price_raw": "", "currency_raw": "PEN", "url": "", "seller": "Desconocido", "availability": "unknown", "country": "PE", "product_name": "Centro de preferencia de la privacidad", "brand": "Activas siempre", "reference": "", "unit": "500g", "price_amount": null, "price_currency": "PEN", "price_symbol": "", "price_text": "", "price_amount_filled": "55.14", "price_is_imputed": "True", "price_imputation_source": "country_mean", "price_amount_usd": "", "price_amount_usd_filled": "15.5336", "fx_rate_local_per_usd": "3.55", "fx_source": "from_peru_cambio_dolar", "information_text": "", "description_text": "", "features_text": "", "specifications_text": "", "benefits_text": "", "details_text": "", "other_sections": "", "sections": {}, "txt_path": "dataset/txt_limpios/1182.txt", "html_path": "dataset/paginas_descargadas/1182.html", "es_status": "EN", "category_canonical": "sin_categoria", "decision": "discard", "match_score": 0.3, "reasons": "no_category_detected;price_parse_failed"}
{"source_id": "1183", "title": "Centro de preferencia de la privacidad", "description": "", "breadcrumbs": "Activas siempre > 200g", "price_raw": "", "currency_raw": "PEN", "url": "", "seller": "Desconocido", "availability": "unknown", "country": "PE", "product_name": "Centro de preferencia de la privacidad", "brand": "Activas siempre", "reference": "", "unit": "200g", "price_amount": null, "price_currency": "PEN", "price_symbol": "", "price_text": "", "price_amount_filled": "55.14", "price_is_imputed": "True", "price_imputation_source": "country_mean", "price_amount_usd": "", "price_amount_usd_filled": "15.5336", "fx_rate_local_per_usd": "3.55", "fx_source": "from_peru_cambio_dolar", "information_text": "", "description_text": "", "features_text": "TE RECOMENDAMOS | HERSHEY'S | Chips de Chocolate Semidulce HERSHEY'S Bolsa 340g | 31 | NESTLE | Cobertura de Chocolate Bitter NESTLÉ Tableta 500 g | 21 | 90 | MONTBLANC | Chocolate Bitter MONTBLANC Tableta Caja 80g | 18 | Chocolate Bitter MONTBLANC Tableta 190g | 26 | BADIA | Especia BADIA Canela en polvo Acerca de 14.2Gr | 4 | -37% | KARINO | Canela Molida KARIÑO Acerca de 12g | 30 | Canela Entera KARIÑO Sobre 9g | Canela en Polvo BADIA Frasco 56.7g | 9 | 70 | UMSHA | Esencia de Vainila UMSHA Botella 90ml | Entérate de eventos exclusivos y promociones especiales que tenemos para ti! | SUSCRIBIRME | Acepto las políticas de tratamientos de datos personales | Razón Social: Compañía Food Retail S.A.C. RUC: 20608300393. Todos los derechos reservados Vivanda 2023. | | Hola! | Encuentra todo lo que necesitas en Vivanda online | Términos más buscados | 1. | quesos | 2. | vino | 3. | café | 4. | quark 500g | 5. | leche | 6. | pollo | 7. | yogurt | 8. | lunch florencia | 9. | agua | 10 | vinos", "specifications_text": "", "benefits_text": "", "details_text": "", "other_sections": "", "sections": {"Características": ["TE RECOMENDAMOS", "HERSHEY'S", "Chips de Chocolate Semidulce HERSHEY'S Bolsa 340g", "31", "NESTLE", "Cubierta de Chocolate Bitter NESTLÉ Tableta 500 g", "21", "90", "MONTBLANC", "Chocolate Bitter MONTBLANC Tableta Caja 80g", "18", "Chocolate Bitter MONTBLANC Tableta 190g", "26", "BADIA", "Especia BADIA Canela en polvo Sobre 14.2Gr", "4", "-37%", "KARINO", "Canela Molida KARIÑO Sobre 12g", "30", "Canela Entera KARIÑO Sobre 9g", "Canela en Polvo BADIA Frasco 56.7g", "9", "70", "UMSHA", "Esencia de Vainila UMSHA Botella 90ml", "¡Entérate de eventos exclusivos y promociones especiales que tenemos para ti!", "SUSCRIBIRME", "Acepto las políticas de tratamiento de datos personales", "Razón social: Compañía Food Retail S.A.C. RUC: 20608300393. Todos los derechos reservados Vivanda 2023.", "¡Hola!", "Encuentra todo lo que necesitas en Vivanda online", "Términos más buscados", "1.", "quesos", "2.", "vino", "3.", "cafe", "4.", "quark 500g", "5.", "leche", "6.", "pollo", "7.", "yogurt", "8.", "lunch florencia", "9.", "agua", "10.", "vinos"]}, "txt_path": "dataset/txt_limpios/1183.txt", "html_path": "dataset/paginas_descargadas/1183.html", "es_status": "ET", "category_canonical": "sin_categoria", "decision": "discard", "match_score": 0.3, "reasons": "no_category_detected;price_parse_failed"}
{"source_id": "1184", "title": "Centro de preferencia de la privacidad", "description": "", "breadcrumbs": "Activas siempre > 810g", "price_raw": "600.0", "currency_raw": "PEN", "url": "", "seller": "Desconocido", "availability": "unknown", "country": "PE", "product_name": "Centro de preferencia de la privacidad", "brand": "Activas siempre", "reference": "", "unit": "810g", "price_amount": 600.0, "price_currency": "PEN", "price_symbol": "", "price_text": "600", "price_amount_filled": "600.0", "price_is_imputed": "False", "price_imputation_source": "original", "price_amount_usd": "169.0141", "price_amount_usd_filled": "169.0141", "fx_rate_local_per_usd": "3.55", "fx_source": "from_peru_cambio_dolar", "information_text": "", "description_text": "", "features_text": "TE RECOMENDAMOS | Pan de Molde BIMBO Integral Cero Cero Bolsa 650g | 20 | BELL'S | Pan de Molde Integral BELL'S Mediano Bolsa 500g | 8 | 10 | DON MAMINO | Pan de Molde Blanco DON MAMINO Pullman Corte Horizontal Bolsa 560g | 13 | 50 | Pan de Molde Blanco BELL'S Mediano Bolsa 500g | UNIÓN | Pan de Molde Integral UNIÓN Bolsa 495g | 14 | 60 | Pan de Molde Blanco UNIÓN Fuente Bolsa 780g | No disponible | LA FLORENCIA | Pan de Molde Integral 6 Semillas LA FLORENCIA Bolsa 500g | Pan de Molde Blanco XL BIMBO Extra Gran Bolsa 770g | 80 | ¡Entérate de eventos exclusivos y promociones especiales que tenemos para ti! | SUSCRIBIRME | Acepto las políticas de tratamientos de datos personales | Razón Social: Compañía Food Retail S.A.C. RUC: 20608300393. Todos los derechos reservados Vivanda 2023. | | Hola! | Encuentra todo lo que necesitas en Vivanda online | Términos más buscados | 1. | quesos | 2. | vino | 3. | café | 4. | quark 500g | 5. | leche | 6. | pollo | 7. | yogurt | 8. | lunch florencia | 9. | agua | 10 | vinos", "specifications_text": "", "benefits_text": "", "details_text": "", "other_sections": "", "sections": {"Características": ["TE RECOMENDAMOS", "Pan de Molde BIMBO Integral Cero Cero Bolsa 650g", "20", "BELL'S", "Pan de Molde Integral BELL'S Mediano Bolsa 500g", "8", "10", "DON MAMINO", "Pan de Molde Blanco DON MAMINO Pullman Corte Horizontal Bolsa 560g", "13", "50", "Pan de Molde Blanco BELL'S Mediano Bolsa 500g", "UNIÓN", "Pan de Molde Integral UNIÓN Bolsa 495g", "14", "60", "Pan de Molde Blanco UNIÓN Fuente Bolsa 780g", "No disponible", "LA FLORENCIA", "Pan de Molde Integral 6 Semillas LA FLORENCIA Bolsa 500g", "Pan de Molde Blanco XL BIMBO Extra Grande Bolsa 770g", "80", "¡Entérate de eventos exclusivos y promociones especiales que tenemos para ti!", "SUSCRIBIRME", "Acepto las políticas de tratamiento de datos personales", "Razón social: Compañía Food Retail S.A.C. RUC: 20608300393. Todos los derechos reservados Vivanda 2023.", "¡Hola!", "Encuentra todo lo que necesitas en Vivanda online", "Términos más buscados", "1.", "quesos", "2.", "vino", "3.", "cafe", "4.", "quark 500g", "5.", "leche", "6.", "pollo", "7.", "yogurt", "8.", "lunch florencia", "9.", "agua", "10.", "vinos"]}, "txt_path": "dataset/txt_limpios/1184.txt", "html_path": "dataset/paginas_descargadas/1184.html", "es_status": "ET", "category_canonical": "sin_categoria", "decision": "discard", "match_score": 0.3, "reasons": "no_category_detected"}
{"source_id": "1185", "title": "Centro de preferencia de la privacidad", "description": "", "breadcrumbs": "Activas siempre > 500g", "price_raw": "", "currency_raw": "PEN", "url": "", "seller": "Desconocido", "availability": "unknown", "country": "PE", "product_name": "Centro de preferencia de la privacidad", "brand": "Activas siempre", "reference": "", "unit": "500g", "price_amount": null, "price_currency": "PEN", "price_symbol": "", "price_text": "", "price_amount_filled": "55.14", "price_is_imputed": "True", "price_imputation_source": "country_mean", "price_amount_usd": "", "price_amount_usd_filled": "15.5336", "fx_rate_local_per_usd": "3.55", "fx_source": "from_peru_cambio_dolar", "information_text": "", "description_text": "", "features_text": "", "specifications_text": "", "benefits_text": "", "details_text": "", "other_sections": "", "sections": {}, "txt_path": "dataset/txt_limpios/1185.txt", "html_path": "dataset/paginas_descargadas/1185.html", "es_status": "EN", "category_canonical": "sin_categoria", "decision": "discard", "match_score": 0.3, "reasons": "no_category_detected;price_parse_failed"}
{"source_id": "1186", "title": "Centro de preferencia de la privacidad", "description": "", "breadcrumbs": "Activas siempre > 500g", "price_raw": "", "currency_raw": "PEN", "url": "", "seller": "Desconocido", "availability": "unknown", "country": "PE", "product_name": "Centro de preferencia de la privacidad", "brand": "Activas siempre", "reference": "", "unit": "500g", "price_amount": null, "price_currency": "PEN", "price_symbol": "", "price_text": "", "price_amount_filled": "55.14", "price_is_imputed": "True", "price_imputation_source": "country_mean", "price_amount_usd": "", "price_amount_usd_filled": "15.5336", "fx_rate_local_per_usd": "3.55", "fx_source": "from_peru_cambio_dolar", "information_text": "", "description_text": "", "features_text": "TE RECOMENDAMOS | Pan de Molde Integral BELL'S Mediano Bolsa 500g | DON MAMINO | Pan de Molde Blanco DON MAMINO Pullman Corte Horizontal Bolsa 560g | 13 | 50 | MOLINOS DEL MUNDO | Pan de Molde MOLINOS DEL MUNDO Sin Gluten y Sin Lactosa Bolsa 480g | 19 | 90 | LA FLORENCIA | Pan de Molde LA FLORENCIA Bolsa 350g | 7 | UNIÓN | Pan de Molde Blanco UNIÓN Fuente Bolsa 780g | No disponible | Pan de Molde Blanco BELL’S Tipo Fuente Corte Vertical sin Corteza Bolsa 500g | Pan de Molde Integral Multicereal LA FLORENCIA Bolsa 500g | 20 | Pan de Molde Integral MOLINOS DEL MUNDO Sin Gluten y Sin Lactosa Bolsa 480g | 21 | BIMBO | Pan de Molde Integral BIMBO Vital Multicereal Bolsa 600g | 14 | 80 | Pan de Molde Blanco BIMBO Vital de Semillas Bolsa 600g | ¡Entérate de eventos exclusivos y promociones especiales que tenemos para ti! | SUSCRIBIRME | Acepto las políticas de tratamientos de datos personales | Razón Social: Compañía Food Retail S.A.C. RUC: 20608300393. Todos los derechos reservados Vivanda 2023. | | Hola! | Encuentra todo lo que necesitas en Vivanda online | Términos más buscados | 1. | quesos | 2. | vino | 3. | café | 4. | quark 500g | 5. | leche | 6. | pollo | 7. | yogurt | 8. | lunch florencia | 9. | agua | 10 | vinos", "specifications_text": "", "benefits_text": "", "details_text": "", "other_sections": "", "sections": {"Características": ["TE RECOMENDAMOS", "Pan de Molde Integral BELL'S Mediano Bolsa 500g", "DON MAMINO", "Pan de Molde Blanco DON MAMINO Pullman Corte Horizontal Bolsa 560g", "13", "50", "MOLINOS DEL MUNDO", "Pan de Molde MOLINOS DEL MUNDO Sin Gluten y Sin Lactosa Bolsa 480g", "19", "90", "LA FLORENCIA", "Pan de Molde LA FLORENCIA Bolsa 350g", "7", "UNIÓN", "Pan de Molde Blanco UNIÓN Fuente Bolsa 780g", "No disponible", "Pan de Molde Blanco BELL’S Tipo Fuente Corte Vertical sin Corteza Bolsa 500g", "Pan de Molde Integral Multicereal LA FLORENCIA Bolsa 500g", "20", "Pan de Molde Integral MOLINOS DEL MUNDO Sin Gluten y Sin Lactosa Bolsa 480g", "21", "BIMBO", "Pan de Molde Integral BIMBO Vital Multicereal Bolsa 600g", "14", "80", "Pan de Molde Blanco BIMBO Vital de Semillas Bolsa 600g", "¡Entérate de eventos exclusivos y promociones especiales que tenemos para ti!", "SUSCRIBIRME", "Acepto las políticas de tratamiento de datos personales", "Razón social: Compañía Food Retail S.A.C. RUC: 20608300393. Todos los derechos reservados Vivanda 2023.", "¡Hola!", "Encuentra todo lo que necesitas en Vivanda online", "Términos más buscados", "1.", "quesos", "2.", "vino", "3.", "cafe", "4.", "quark 500g", "5.", "leche", "6.", "pollo", "7.", "yogurt", "8.", "lunch florencia", "9.", "agua", "10.", "vinos"]}, "txt_path": "dataset/txt_limpios/1186.txt", "html_path": "dataset/paginas_descargadas/1186.html", "es_status": "ET", "category_canonical": "sin_categoria", "decision": "discard", "match_score": 0.3, "reasons": "no_category_detected;price_parse_failed"}
{"source_id": "1187", "title": "Centro de preferencia de la privacidad", "description": "", "breadcrumbs": "Activas siempre > 780g", "price_raw": "", "currency_raw": "PEN", "url": "", "seller": "Desconocido", "availability": "unknown", "country": "PE", "product_name": "Centro de preferencia de la privacidad", "brand": "Activas siempre", "reference": "", "unit": "780g", "price_amount": null, "price_currency": "PEN", "price_symbol": "", "price_text": "", "price_amount_filled": "55.14", "price_is_imputed": "True", "price_imputation_source": "country_mean", "price_amount_usd": "", "price_amount_usd_filled": "15.5336", "fx_rate_local_per_usd": "3.55", "fx_source": "from_peru_cambio_dolar", "information_text": "", "description_text": "", "features_text": "TE RECOMENDAMOS | BIMBO | Pan de Molde BIMBO Integral Familiar Bolsa 620g | 10 | UNION | Pan Americano Sandwich UNIÓN Bolsa 540g | 8 | MOLINOS DEL MUNDO | Pan de Molde Integral MOLINOS DEL MUNDO Sin Gluten y Sin Lactosa Bolsa 480g | 21 | 90 | -7% | Pan de Molde UNIÓN Fibra Multicereal Bolsa 540g | 13 | 60 | 12 | 7% | LA FLORENCIA | Pan de Molde LA FLORENCIA Integal Bolsa 350g | 7 | Pan de Molde Integral XL BIMBO Extra Gran Bolsa 810g | Pan de Molde Integral 6 Semillas LA FLORENCIA Bolsa 500g | 20 | Pan de Molde Integral BIMBO sin Bordes Bolsa 650g | 16 | DON MAMINO | Pan de Molde Blanco DON MAMINO sin Corteza Bolsa 560g | 49 | ¡Entérate de eventos exclusivos y promociones especiales que tenemos para ti! | SUSCRIBIRME | Acepto las políticas de tratamientos de datos personales | Razón Social: Compañía Food Retail S.A.C. RUC: 20608300393. Todos los derechos reservados Vivanda 2023. | | Hola! | Encuentra todo lo que necesitas en Vivanda online | Términos más buscados | 1. | quesos | 2. | vino | 3. | café | 4. | quark 500g | 5. | leche | 6. | pollo | 7. | yogurt | 8. | lunch florencia | 9. | agua | 10 | vinos", "specifications_text": "", "benefits_text": "", "details_text": "", "other_sections": "", "sections": {"Características": ["TE RECOMENDAMOS", "BIMBO", "Pan de Molde BIMBO Integral Familiar Bolsa 620g", "10", "UNION", "Pan americano Sandwich UNIÓN Bolsa 540g", "8", "MOLINOS DEL MUNDO", "Pan de Molde Integral MOLINOS DEL MUNDO Sin Gluten y Sin Lactosa Bolsa 480g", "21", "90", "-7%", "Pan de Molde UNIÓN Fibra Multicereal Bolsa 540g", "13", "60", "12", "7%", "LA FLORENCIA", "Pan de Molde LA FLORENCIA Integal Bolsa 350g", "7", "Pan de Molde Integral XL BIMBO Extra Grande Bolsa 810g", "Pan de Molde Integral 6 Semillas LA FLORENCIA Bolsa 500g", "20", "Pan de Molde Integral BIMBO sin Bordes Bolsa 650g", "16", "DON MAMINO", "Pan de Molde Blanco DON MAMINO sin Corteza Bolsa 560g", "49", "¡Entérate de eventos exclusivos y promociones especiales que tenemos para ti!", "SUSCRIBIRME", "Acepto las políticas de tratamiento de datos personales", "Razón social: Compañía Food Retail S.A.C. RUC: 20608300393. Todos los derechos reservados Vivanda 2023.", "¡Hola!", "Encuentra todo lo que necesitas en Vivanda online", "Términos más buscados", "1.", "quesos", "2.", "vino", "3.", "cafe", "4.", "quark 500g", "5.", "leche", "6.", "pollo", "7.", "yogurt", "8.", "lunch florencia", "9.", "agua", "10.", "vinos"]}, "txt_path": "dataset/txt_limpios/1187.txt", "html_path": "dataset/paginas_descargadas/1187.html", "es_status": "ET", "category_canonical": "sin_categoria", "decision": "discard", "match_score": 0.3, "reasons": "no_category_detected;price_parse_failed"}
