{"source_id": "1016", "title": "colaborar con nuestros estudios para marketing. También puede configurarlas.", "description": "Información de la marca", "breadcrumbs": "que podemos ofrecer. > 170g", "price_raw": "16.92", "currency_raw": "PEN", "url": "", "seller": "Desconocido", "availability": "unknown", "country": "PE", "product_name": "colaborar con nuestros estudios para marketing. También puede configurarlas.", "brand": "que podemos ofrecer.", "reference": "", "unit": "170g", "price_amount": 16.92, "price_currency": "PEN", "price_symbol": "S/", "price_text": "S/16.92", "price_amount_filled": "16.92", "price_is_imputed": "False", "price_imputation_source": "original", "price_amount_usd": "4.7662", "price_amount_usd_filled": "4.7662", "fx_rate_local_per_usd": "3.55", "fx_source": "from_peru_cambio_dolar", "information_text": "", "description_text": "Información de la marca", "features_text": "Presentación/Empaque | Frasco | Café Puro | Sí | Libre De Cafeína | No | Formato | Polvo | Azúcares Porción | 0.20 g/ 100 g | Calorías Porción | 332.76 kcal | Carbohidratos Porción | 63.58 g/ 100 g | Descripción Nutricional | 0.20 g, Grasa: 0.00 g, Grasas Saturadas: 0.01 g, Sodio: 133.94 mg. | Grasas Porción | 0.00 g/ 100 g | Proteínas Porción | 19.61 g/ 100 g | Sodio Porción | 133.94 mg/ 100 g | Origen Del Grano | Nacional | Advertencias De Almacenamiento | Almacenar en un lugar fresco, seco y libre de olores extraños | Contenido Neto | 170 g | Revisa todo | Componentes del Producto | Vendido por | plaza Vea | En caso de que algo te guste: Puedes revisar nuestras | Políticas de cambios y/o devoluciones | y hacerlas efectivas en todas nuestras tiendas. | Productos | que te pueden interesar | Recomendado para ti", "specifications_text": "", "benefits_text": "", "details_text": "", "other_sections": "", "sections": {"Descripción": ["Información de la marca"], "Características": ["Presentación/Empaque", "Frasco", "Café Puro", "Sí", "Libre De Cafeína", "No", "Formato", "Polvo", "Azúcar por porción", "0.20 g / 100 g", "Calorías Porción", "332.76 kcal", "Carbohidratos Porción", "63.58 g / 100 g", "Descripción Nutricional", "0.20 g, Grasa: 0.00 g, Grasas Saturadas: 0.01 g, Sodio: 133.94 mg.", "Grasas Porción", "0.00 g / 100 g", "Proteínas Porción", "19.61 g / 100 g", "Sodio Porción", "133.94 mg / 100 g", "Origen Del Grano", "Nacional", "Advertencias De Almacenamiento", "Almacenar en un lugar fresco, seco y libre de olores extraños", "Contenido Neto", "170 g", "Revisa todo", "Componentes del Producto", "Vendido por", "plazaVea", "En caso algo no vaya como gustes: Puedes revisar nuestras", "Politicas de cambios y/o devoluciones", "y hacerlas efectivas en todas nuestras tiendas.", "Productos", "que te pueden interesar", "Recomendado para ti"]}, "txt_path": "dataset/txt_limpios/1016.txt", "html_path": "dataset/paginas_descargadas/1016.html", "es_status": "ET", "category_canonical": "sin_categoria", "decision": "discard", "match_score": 0.3, "reasons": "no_category_detected"}
{"source_id": "1017", "title": "colaborar con nuestros estudios para marketing. También puede configurarlas.", "description": "Información de la marca", "breadcrumbs": "que podemos ofrecer. > 900g", "price_raw": "16.92", "currency_raw": "PEN", "url": "", "seller": "Desconocido", "availability": "unknown", "country": "PE", "product_name": "colaborar con nuestros estudios para marketing. También puede configurarlas.", "brand": "que podemos ofrecer.", "reference": "", "unit": "900g", "price_amount": 16.92, "price_currency": "PEN", "price_symbol": "S/", "price_text": "S/16.92", "price_amount_filled": "16.92", "price_is_imputed": "False", "price_imputation_source": "original", "price_amount_usd": "4.7662", "price_amount_usd_filled": "4.7662", "fx_rate_local_per_usd": "3.55", "fx_source": "from_peru_cambio_dolar", "information_text": "", "description_text": "Información de la marca", "features_text": "Importante destacar | Producto de calidad | Ideal para tu desayuno | Gran sabor | Descripción del producto | La alimentación juega un papel muy importante en nuestras vidas. Es por ello que debemos tener una equilibrada incorporación de nutrientes a nuestro organismo, para el desarrollo de la vida y de las distintas actividades cotidianas. Por ello | plaza Vea | pone tu disposición una amplia variedad de | Abarrotes | para que puedas elegir el que más se adecua a tus necesidades. | El desayuno es el primer alimento del día. Esta primera comida nos aportará en buen porcentaje de energía para iniciar con fuerza nuestras actividades diarias. Por ello | te ofrece una gran variedad de productos para que pueda preparar | deliciosos. Si eres un amante del café y en el pued falta en tus mañanas. Puedes preparte algo rápido y sencillo . Una taza con | Café | y una crocantes | Tostadas | con | Mermelada. | Otro opción para tu desayuno son los | Cereales | los que puedes combinarlos con | Leche | o | Yogurt | ¡Realiza tus combinaciones y descrubre un mundo de posibilidades! | - Conoce los distintos productos para preparar | deliciosos en plazaVea Online! | *La imagen solo es referencial | Cafetal/b> | \"Cafetal es un café tostado único, con un inigualable aroma, cuerpo y sabor que lo caracteriza. Es una marca pionera de café pasado en el Perú y desde su fundación en 1957 ofrecen el mejor café arábica 100% peruano de las mejores zonas cafeteras.\" | ¿No es lo que buscas? Encuentra más productos para tus | en plaza Vea | Revisa todo | Componentes del Producto | Vendido por | En caso de que algo te guste: Puedes revisar nuestras | Políticas de cambios y/o devoluciones | y hacerlas efectivas en todas nuestras tiendas. | Productos | que te pueden interesar | Recomendado para ti", "specifications_text": "", "benefits_text": "", "details_text": "", "other_sections": "", "sections": {"Descripción": ["Información de la marca"], "Características": ["Importante destacar", "Producto de calidad", "Ideal para tu desayuno", "Gran sabor", "Descripción del producto", "La alimentación juega un papel muy importante en nuestras vidas. Es por ello que debemos tener una equilibrada incorporación de nutrientes a nuestro organismo, para el desarrollo de la vida y de las distintas actividades cotidianas. Por ello", "plazaVea", "pone a tu disposición una amplia variedad de", "Abarrotes", "para que puedas elegir qué más se adecua a tus necesidades.", "El desayuno es el primer alimento del día. Esta primera comida nos aportará en buen porcentaje de energía para iniciar con fuerza nuestras actividades diarias. Por ello", "te ofrece una gran variedad de productos para que puedar preparar", "deliciosos. Si eres un amante del café y en el pued falta en tus mañanas. Puedes preparte algo rápido y sencillo . Una taza con", "Café", "y una crocantes", "Tostadas", "con", "Mermelada.", "Otra opción para tu desayuno son los", "Cereales", "los cuales puedes combinarlos con", "Leche", "o", "Yogurt", "¡Realiza tus combinaciones y descrubre un mundo de posibilidades!", "¡Conoce los distintos productos para preparar", "deliciosos en plazaVea Online!", "*La imagen solo es referencial", "Cafetal/b>", "\"Cafetal es un café tostado único, con un inigualable aroma, cuerpo y sabor que lo caracteriza. Es una marca pionera de café pasado en el Perú y desde su fundación en 1957 ofrecen el mejor café arábica 100% peruano de las mejores zonas cafeteras. \"", "¿En qué búsqueda? Encuentra más productos para tus", "en plazaVea", "Revisa todo", "Componentes del Producto", "Vendido por", "En caso algo no vaya como gustes: Puedes revisar nuestras", "Politicas de cambios y/o devoluciones", "y hacerlas efectivas en todas nuestras tiendas.", "Productos", "que te pueden interesar", "Recomendado para ti"]}, "txt_path": "dataset/txt_limpios/1017.txt", "html_path": "dataset/paginas_descargadas/1017.html", "es_status": "ET", "category_canonical": "sin_categoria", "decision": "discard", "match_score": 0.3, "reasons": "no_category_detected"}
{"source_id": "1018", "title": "colaborar con nuestros estudios para marketing. También puede configurarlas.", "description": "Información de la marca", "breadcrumbs": "que podemos ofrecer. > 200g", "price_raw": "16.92", "currency_raw": "PEN", "url": "", "seller": "Desconocido", "availability": "unknown", "country": "PE", "product_name": "colaborar con nuestros estudios para marketing. También puede configurarlas.", "brand": "que podemos ofrecer.", "reference": "", "unit": "200g", "price_amount": 16.92, "price_currency": "PEN", "price_symbol": "S/", "price_text": "S/16.92", "price_amount_filled": "16.92", "price_is_imputed": "False", "price_imputation_source": "original", "price_amount_usd": "4.7662", "price_amount_usd_filled": "4.7662", "fx_rate_local_per_usd": "3.55", "fx_source": "from_peru_cambio_dolar", "information_text": "", "description_text": "Información de la marca", "features_text": "Importante destacar | Producto de calidad | Ideal para tu desayuno | Gran sabor | Descripción del producto | La alimentación juega un papel muy importante en nuestras vidas. Es por ello que debemos tener una equilibrada incorporación de nutrientes a nuestro organismo, para el desarrollo de la vida y de las distintas actividades cotidianas. Por ello | plaza Vea | pone tu disposición una amplia variedad de | Abarrotes | para que puedas elegir el que más se adecua a tus necesidades. | El desayuno es el primer alimento del día. Esta primera comida nos aportará en buen porcentaje de energía para iniciar con fuerza nuestras actividades diarias. Por ello | te ofrece una gran variedad de productos para que pueda preparar | deliciosos. Si eres un amante del café y en el pued falta en tus mañanas. Puedes preparte algo rápido y sencillo . Una taza con | Café | y una crocantes | Tostadas | con | Mermelada. | Otro opción para tu desayuno son los | Cereales | los que puedes combinarlos con | Leche | o | Yogurt | ¡Realiza tus combinaciones y descrubre un mundo de posibilidades! | - Conoce los distintos productos para preparar | deliciosos en plazaVea Online! | *La imagen solo es referencial | Bell ́s | \"Bell's ofrece una alternativa accesible en torno a calidad y precio de sus productos; con el respaldo y garantía de plazaVea.\" | ¿En qué búsqueda? Encuentra más productos para tus | en plaza Vea | Revisa todo | Componentes del Producto | Vendido por | En caso de que algo te guste: Puedes revisar nuestras | Políticas de cambios y/o devoluciones | y hacerlas efectivas en todas nuestras tiendas. | Productos | que te pueden interesar | Recomendado para ti", "specifications_text": "", "benefits_text": "", "details_text": "", "other_sections": "", "sections": {"Descripción": ["Información de la marca"], "Características": ["Importante destacar", "Producto de calidad", "Ideal para tu desayuno", "Gran sabor", "Descripción del producto", "La alimentación juega un papel muy importante en nuestras vidas. Es por ello que debemos tener una equilibrada incorporación de nutrientes a nuestro organismo, para el desarrollo de la vida y de las distintas actividades cotidianas. Por ello", "plazaVea", "pone a tu disposición una amplia variedad de", "Abarrotes", "para que puedas elegir qué más se adecua a tus necesidades.", "El desayuno es el primer alimento del día. Esta primera comida nos aportará en buen porcentaje de energía para iniciar con fuerza nuestras actividades diarias. Por ello", "te ofrece una gran variedad de productos para que puedar preparar", "deliciosos. Si eres un amante del café y en el pued falta en tus mañanas. Puedes preparte algo rápido y sencillo . Una taza con", "Café", "y una crocantes", "Tostadas", "con", "Mermelada.", "Otra opción para tu desayuno son los", "Cereales", "los cuales puedes combinarlos con", "Leche", "o", "Yogurt", "¡Realiza tus combinaciones y descrubre un mundo de posibilidades!", "¡Conoce los distintos productos para preparar", "deliciosos en plazaVea Online!", "*La imagen solo es referencial", "Bell´s", "\"Bell's ofrece una alternativa accesible en torno a la calidad y precio de sus productos; con el respaldo y garantía de plaza Vea", "¿En qué búsqueda? Encuentra más productos para tus", "en plazaVea", "Revisa todo", "Componentes del Producto", "Vendido por", "En caso algo no vaya como gustes: Puedes revisar nuestras", "Politicas de cambios y/o devoluciones", "y hacerlas efectivas en todas nuestras tiendas.", "Productos", "que te pueden interesar", "Recomendado para ti"]}, "txt_path": "dataset/txt_limpios/1018.txt", "html_path": "dataset/paginas_descargadas/1018.html", "es_status": "ET", "category_canonical": "sin_categoria", "decision": "discard", "match_score": 0.3, "reasons": "no_category_detected"}
{"source_id": "1019", "title": "colaborar con nuestros estudios para marketing. También puede configurarlas.", "description": "Información de la marca", "breadcrumbs": "que podemos ofrecer. > 900ml", "price_raw": "16.92", "currency_raw": "PEN", "url": "", "seller": "Desconocido", "availability": "unknown", "country": "PE", "product_name": "colaborar con nuestros estudios para marketing. También puede configurarlas.", "brand": "que podemos ofrecer.", "reference": "", "unit": "900ml", "price_amount": 16.92, "price_currency": "PEN", "price_symbol": "S/", "price_text": "S/16.92", "price_amount_filled": "16.92", "price_is_imputed": "False", "price_imputation_source": "original", "price_amount_usd": "4.7662", "price_amount_usd_filled": "4.7662", "fx_rate_local_per_usd": "3.55", "fx_source": "from_peru_cambio_dolar", "information_text": "", "description_text": "Información de la marca", "features_text": "Presentación/Empaque | Botella | Porción sugerida | 14g | Azúcares Porción | 0g | Calorías Porción | 130kcal | Carbohidratos Porción | Descripción Nutricional | Grasas Porción | Proteínas Porción | Sodio Porción | 0mg | Composición/Origen | Aceite 100% vegetal | Advertencias De Almacenamiento | Consérvese en recipiente cerrado, en lugar fresco, seco y seguro | Contenido Neto | 900ml | Revisa todo | Componentes del Producto | Vendido por | plaza Ver | En caso de que algo te guste: Puedes revisar nuestras | Políticas de cambios y/o devoluciones | y hacerlas efectivas en todas nuestras tiendas. | Productos | que te pueden interesar | Recomendado para ti", "specifications_text": "", "benefits_text": "", "details_text": "", "other_sections": "", "sections": {"Descripción": ["Información de la marca"], "Características": ["Presentación/Empaque", "Botella", "Porción sugerida", "14g", "Azúcar por porción", "0g", "Calorías Porción", "130kcal", "Carbohidratos Porción", "Descripción Nutricional", "Grasas Porción", "Proteínas Porción", "Sodio Porción", "0mg", "Composición/Origen", "Aceite 100% vegetal", "Advertencias De Almacenamiento", "Consérvese en un recipiente cerrado, en lugar fresco, seco y seguro", "Contenido Neto", "900ml", "Revisa todo", "Componentes del Producto", "Vendido por", "plazaVea", "En caso algo no vaya como gustes: Puedes revisar nuestras", "Politicas de cambios y/o devoluciones", "y hacerlas efectivas en todas nuestras tiendas.", "Productos", "que te pueden interesar", "Recomendado para ti"]}, "txt_path": "dataset/txt_limpios/1019.txt", "html_path": "dataset/paginas_descargadas/1019.html", "es_status": "ET", "category_canonical": "sin_categoria", "decision": "discard", "match_score": 0.3, "reasons": "no_category_detected"}
{"source_id": "1020", "title": "colaborar con nuestros estudios para marketing. También puede configurarlas.", "description": "Información de la marca", "breadcrumbs": "que podemos ofrecer. > 1L", "price_raw": "16.92", "currency_raw": "PEN", "url": "", "seller": "Desconocido", "availability": "unknown", "country": "PE", "product_name": "colaborar con nuestros estudios para marketing. También puede configurarlas.", "brand": "que podemos ofrecer.", "reference": "", "unit": "1L", "price_amount": 16.92, "price_currency": "PEN", "price_symbol": "S/", "price_text": "S/16.92", "price_amount_filled": "16.92", "price_is_imputed": "False", "price_imputation_source": "original", "price_amount_usd": "4.7662", "price_amount_usd_filled": "4.7662", "fx_rate_local_per_usd": "3.55", "fx_source": "from_peru_cambio_dolar", "information_text": "", "description_text": "Información de la marca", "features_text": "Presentación/Empaque | Botella | Porción sugerida | 100 ml | Alérgenos Declarados | NO | Azúcares Porción | 0 g | Calorías Porción | 828 Kcal/ 3404 KJ | Carbohidratos Porción | Grasas Porción | 92 G | Proteínas Porción | Sodio Porción | Sodio Porción | 0 mg | Composición/Origen | Aceites comestibles de girasol y aceite de oliva vírgenes extra ( España) | Grado | n/a | % De Acidez | 0,30 | Advertencias De Almacenamiento | mantener en un lugar seco y alejado de la luz | Contenido Neto | 1 L | Advertencias de consumo | Ninguna | Revisa todo | Componentes del Producto | Vendido por | plaza Vea | En caso de que algo te guste: Puedes revisar nuestras | Políticas de cambios y/o devoluciones | y hacerlas efectivas en todas nuestras tiendas. | Productos | que te pueden interesar | Recomendado para ti", "specifications_text": "", "benefits_text": "", "details_text": "", "other_sections": "", "sections": {"Descripción": ["Información de la marca"], "Características": ["Presentación/Empaque", "Botella", "Porción sugerida", "100 ml", "Alérgenos Declarados", "NO", "Azúcar por porción", "0 g", "Calorías Porción", "828 Kcal / 3404 KJ", "Carbohidratos Porción", "Grasas Porción", "92 G", "Proteínas Porción", "Sodio Porción", "0 mg", "Composición/Origen", "Aceites comestibles de girasol y aceite de oliva virgen extra ( España)", "Grado", "n/a", "% De Acidez", "0,30", "Advertencias De Almacenamiento", "mantener en un lugar seco y alejado de la luz", "Contenido Neto", "1 L", "Advertencias de consumo", "Ninguna", "Revisa todo", "Componentes del Producto", "Vendido por", "plazaVea", "En caso algo no vaya como gustes: Puedes revisar nuestras", "Politicas de cambios y/o devoluciones", "y hacerlas efectivas en todas nuestras tiendas.", "Productos", "que te pueden interesar", "Recomendado para ti"]}, "txt_path": "dataset/txt_limpios/1020.txt", "html_path": "dataset/paginas_descargadas/1020.html", "es_status": "ET", "category_canonical": "sin_categoria", "decision": "discard", "match_score": 0.3, "reasons": "no_category_detected"}
{"source_id": "1021", "title": "colaborar con nuestros estudios para marketing. También puede configurarlas.", "description": "Información de la marca", "breadcrumbs": "que podemos ofrecer. > 900ml", "price_raw": "16.92", "currency_raw": "PEN", "url": "", "seller": "Desconocido", "availability": "unknown", "country": "PE", "product_name": "colaborar con nuestros estudios para marketing. También puede configurarlas.", "brand": "que podemos ofrecer.", "reference": "", "unit": "900ml", "price_amount": 16.92, "price_currency": "PEN", "price_symbol": "S/", "price_text": "S/16.92", "price_amount_filled": "16.92", "price_is_imputed": "False", "price_imputation_source": "original", "price_amount_usd": "4.7662", "price_amount_usd_filled": "4.7662", "fx_rate_local_per_usd": "3.55", "fx_source": "from_peru_cambio_dolar", "information_text": "", "description_text": "Información de la marca", "features_text": "Presentación/Empaque | Botella | Porción sugerida | 14g | Azúcares Porción | 0g | Calorías Porción | 130kcal | Carbohidratos Porción | Descripción Nutricional | Grasas Porción | Proteínas Porción | Sodio Porción | 0mg | Composición/Origen | Aceite 100% vegetal | Advertencias De Almacenamiento | Consérvese en recipiente cerrado, en lugar fresco, seco y seguro | Contenido Neto | 900ml | Revisa todo | Componentes del Producto | Vendido por | plaza Ver | En caso de que algo te guste: Puedes revisar nuestras | Políticas de cambios y/o devoluciones | y hacerlas efectivas en todas nuestras tiendas. | Productos | que te pueden interesar | Recomendado para ti", "specifications_text": "", "benefits_text": "", "details_text": "", "other_sections": "", "sections": {"Descripción": ["Información de la marca"], "Características": ["Presentación/Empaque", "Botella", "Porción sugerida", "14g", "Azúcar por porción", "0g", "Calorías Porción", "130kcal", "Carbohidratos Porción", "Descripción Nutricional", "Grasas Porción", "Proteínas Porción", "Sodio Porción", "0mg", "Composición/Origen", "Aceite 100% vegetal", "Advertencias De Almacenamiento", "Consérvese en un recipiente cerrado, en lugar fresco, seco y seguro", "Contenido Neto", "900ml", "Revisa todo", "Componentes del Producto", "Vendido por", "plazaVea", "En caso algo no vaya como gustes: Puedes revisar nuestras", "Politicas de cambios y/o devoluciones", "y hacerlas efectivas en todas nuestras tiendas.", "Productos", "que te pueden interesar", "Recomendado para ti"]}, "txt_path": "dataset/txt_limpios/1021.txt", "html_path": "dataset/paginas_descargadas/1021.html", "es_status": "ET", "category_canonical": "sin_categoria", "decision": "discard", "match_score": 0.3, "reasons": "no_category_detected"}
