source_id,title,description,breadcrumbs,price_raw,currency_raw,url,seller,availability,country,product_name,brand,reference,unit,price_amount,price_currency,price_symbol,price_text,price_amount_filled,price_is_imputed,price_imputation_source,price_amount_usd,price_amount_usd_filled,fx_rate_local_per_usd,fx_source,information_text,description_text,features_text,specifications_text,benefits_text,details_text,other_sections,sections,txt_path,html_path,es_status,category_canonical,decision,match_score,reasons
25,Cafe y te,"Café Gold Los Portales de Córdoba 170g Prepara tu despensa en unos cuantos clics y descubre nuestra gran variedad de productos. ¡En la sala de casa, te llevamos el súper!",Los Portales de Córdoba > 170g > 3734679,149.0,MXN,,Chedraui,unknown,MX,Cafe y te,Los Portales de Córdoba,3734679.0,170g,149.00,MXN,$,$149.00,149.0,False,original,8.0021,8.0021,18.62,from_mexico_cambio_dolar,Café Gold Los Portales de Córdoba 170g,,Consérvese en un lugar fresco,"Prepara tu despensa en unos cuantos clics y descubre nuestra gran variedad de productos. ¡En la sala de casa, te llevamos el súper!",,,,"{""Información"": [""Café Gold Los Portales de Córdoba 170g""], ""Características"": [""Consérvese en un lugar fresco""], ""Especificaciones"": [""Prepara tu despensa en unos cuantos clics y descubre nuestra gran variedad de productos. ¡En la sala de casa, te llevamos el súper!""]}",dataset/txt_limpios/25.txt,dataset/paginas_descargadas/25.html,ET,cafe,keep,0.60,heuristic_default
26,Cafe y te,"Café molido y tostado ideal para cafetera, prensa francesa, italiana cualquier método de filtración. Disfruta del sabor gourmet del café americano Blasón. El café molido y tostado estadounidense Blasón tiene un tueste y una mojada regular que le dan un rico aroma que combina con su sabor lleno y de excelente cuerpo. Disfruta de un trabajo hecho con pasión, en una taza de Café Blasón. | - Mezcla de cafés de la región Pluma, Oaxaca 100% Arábica | - Dulzor abundante, amargo sutil con notas a frutas maduras",Blasón > 400g > 3202009,150.0,MXN,,Chedraui,unknown,MX,Cafe y te,Blasón,3202009.0,400g,150.00,MXN,$,$150.00,150.0,False,original,8.0559,8.0559,18.62,from_mexico_cambio_dolar,"Café molido y tostado ideal para cafetera, prensa francesa, italiana cualquier método de filtración. Disfruta del sabor gourmet del café americano Blasón.",,Café Méxicano | Tostado Molido | 100% Arabica,"El café molido y tostado estadounidense Blasón tiene un tueste y una mojada regular que le dan un rico aroma que combina con su sabor lleno y de excelente cuerpo. Disfruta de un trabajo hecho con pasión, en una taza de Café Blasón. | - Mezcla de cafés de la región Pluma, Oaxaca 100% Arábica | - Dulzor abundante, amargo sutil con notas a frutas maduras",,,,"{""Información"": [""Café molido y tostado ideal para cafetera, prensa francesa, italiana cualquier método de filtración. Disfruta del sabor gourmet del café americano Blasón.""], ""Características"": [""Café Méxicano"", ""Tostado Molido"", ""100% Arabica""], ""Especificaciones"": [""El café molido y tostado estadounidense Blasón tiene un tueste y una mojada regular que le dan un rico aroma que combina con su sabor lleno y de excelente cuerpo. Disfruta de un trabajo hecho con pasión, en una taza de Café Blasón."", ""- Mezcla de cafés de la región Pluma, Oaxaca 100% Arábica"", ""- Dulzor abundante, amargo sutil con notas a frutas maduras""]}",dataset/txt_limpios/26.txt,dataset/paginas_descargadas/26.html,ET,cafe,keep,0.60,heuristic_default
27,Cafe y te,"Creamos una nueva experiencia para que las personas puedan disfrutar una taza de café, en la que perciban su aroma, sus componentes, texturas y sabores. Su sabor te inducirá a disfrutarlo por más tiempo, y buscar cualquier excusa para seguir deleitándote. Disfruta de la armonía que se de la entre el sabor y la sensación de degustar el café de forma diferente, va a hacer que quieras revivir la experiencia una y otra vez. Café Garat es el resultado de una cuidadosa selección de granos gourmet de las principales regiones cafetaleras de México: Chiapas, Veracruz y Oaxaca. Su nivel de tueste y molido hacen de este un café con el balance ideal de aroma, sabor y cuerpo, características que lo hacen único. Con el tostado y molido regular en su presentación estadounidense obtendrás eso que necesitas para disfrutar y compartir tu día. Adquiérelo en su presentación de 360g y con su bolsa resellable podrás guardar toda la frescura de Garat, como si recién lo hubieras abierto por primera vez.",Garat > 340g > 3019146,150.0,MXN,,Chedraui,unknown,MX,Cafe y te,Garat,3019146.0,340g,150.00,MXN,$,$150.00,150.0,False,original,8.0559,8.0559,18.62,from_mexico_cambio_dolar,"Creamos una nueva experiencia para que las personas puedan disfrutar una taza de café, en la que perciban su aroma, sus componentes, texturas y sabores. Su sabor te inducirá a disfrutarlo por más tiempo, y buscar cualquier excusa para seguir deleitándote. Disfruta de la armonía que se de la entre el sabor y la sensación de degustar el café de forma diferente, va a hacer que quieras revivir la experiencia una y otra vez.",,Bolsa Resellable | Kosher,"Café Garat es el resultado de una cuidadosa selección de granos gourmet de las principales regiones cafetaleras de México: Chiapas, Veracruz y Oaxaca. Su nivel de tueste y molido hacen de este un café con el balance ideal de aroma, sabor y cuerpo, características que lo hacen único. Con el tostado y molido regular en su presentación estadounidense obtendrás eso que necesitas para disfrutar y compartir tu día. Adquiérelo en su presentación de 360g y con su bolsa resellable podrás guardar toda la frescura de Garat, como si recién lo hubieras abierto por primera vez.",,,,"{""Información"": [""Creamos una nueva experiencia para que las personas puedan disfrutar una taza de café, en la que perciban su aroma, sus componentes, texturas y sabores. Su sabor te inducirá a disfrutarlo por más tiempo, y buscar cualquier excusa para seguir deleitándote. Disfruta de la armonía que se de la entre el sabor y la sensación de degustar el café de forma diferente, va a hacer que quieras revivir la experiencia una y otra vez.""], ""Características"": [""Bolsa Resellable"", ""Kosher""], ""Especificaciones"": [""Café Garat es el resultado de una cuidadosa selección de granos gourmet de las principales regiones cafetaleras de México: Chiapas, Veracruz y Oaxaca. Su nivel de tueste y molido hacen de este un café con el balance ideal de aroma, sabor y cuerpo, características que lo hacen único. Con el tostado y molido regular en su presentación estadounidense obtendrás eso que necesitas para disfrutar y compartir tu día. Adquiérelo en su presentación de 360g y con su bolsa resellable podrás guardar toda la frescura de Garat, como si recién lo hubieras abierto por primera vez.""]}",dataset/txt_limpios/27.txt,dataset/paginas_descargadas/27.html,ET,cafe,keep,0.60,heuristic_default
1732,Café e Infusiones,"Presentación/Empaque | Doypack | Café Puro | Sí | Libre De Cafeína | No | Orgánico | Azúcares Porción | 0.78 g/ 100 g | Calorías Porción | 347.00 kcal / 100 g | Carbohidratos Porción | 65.10 g/ 100 g | Descripción Nutricional | 0.20 g, Grasas Saturadas: 0.10 g, Sodio: 19.00 mg. | Grasas Porción | 0.20 g/ 100 g | Proteínas Porción | 5.55 g / 100 g | Sodio Porción | 19.00 mg/ 100 g | Advertencias de Almacenamiento | ALMACENAR EN UN LUGAR FRESCO, SECO Y LIBRE DE OLORES EXTRAÑOS | En caso de que algo te guste: Puedes revisar nuestras | Políticas de cambios y/o devoluciones | y hacerlas efectivas en todas nuestras tiendas. | Productos | que te pueden interesar | similares | Multiplicador-de-unidad: MAKRO-Bi-Precio|Vigente Oculto | Express | Café Instántaneo Gourmet ALTOMAYO Doypack 150g | ALTOMAYO | .90 | .00 | un | 3 | productos agregados | Agrega indicaciones | Guardar | MAKRO-Bi-Precio| Vigente Oculto | Café Instantáneo NESCAFE Tradición Lata 500g | NESCAFÉ | Café NESCAFE Descafeinado Frasco 170g | Café Instantáneo NESCAFÉ Descafeinado Frasco 40g | Café Instantáneo COLCAFÉ Clásico Frasco 170g | COLCAFE | Café Instantáneo Intenso CAFETAL Tira 8un | CAFETAL | Café Instantáneo NESCAFÉ Tradición Frasco 100g | Recomendado para ti",Café Instantáneo > 150g,16.92,PEN,,Desconocido,unknown,PE,Café e Infusiones,Café Instantáneo,,150g,16.92,PEN,S/,S/16.92,16.92,False,original,4.7662,4.7662,3.55,from_peru_cambio_dolar,,,,"Presentación/Empaque | Doypack | Café Puro | Sí | Libre De Cafeína | No | Orgánico | Azúcares Porción | 0.78 g/ 100 g | Calorías Porción | 347.00 kcal / 100 g | Carbohidratos Porción | 65.10 g/ 100 g | Descripción Nutricional | 0.20 g, Grasas Saturadas: 0.10 g, Sodio: 19.00 mg. | Grasas Porción | 0.20 g/ 100 g | Proteínas Porción | 5.55 g / 100 g | Sodio Porción | 19.00 mg/ 100 g | Advertencias de Almacenamiento | ALMACENAR EN UN LUGAR FRESCO, SECO Y LIBRE DE OLORES EXTRAÑOS | En caso de que algo te guste: Puedes revisar nuestras | Políticas de cambios y/o devoluciones | y hacerlas efectivas en todas nuestras tiendas. | Productos | que te pueden interesar | similares | Multiplicador-de-unidad: MAKRO-Bi-Precio|Vigente Oculto | Express | Café Instántaneo Gourmet ALTOMAYO Doypack 150g | ALTOMAYO | .90 | .00 | un | 3 | productos agregados | Agrega indicaciones | Guardar | MAKRO-Bi-Precio| Vigente Oculto | Café Instantáneo NESCAFE Tradición Lata 500g | NESCAFÉ | Café NESCAFE Descafeinado Frasco 170g | Café Instantáneo NESCAFÉ Descafeinado Frasco 40g | Café Instantáneo COLCAFÉ Clásico Frasco 170g | COLCAFE | Café Instantáneo Intenso CAFETAL Tira 8un | CAFETAL | Café Instantáneo NESCAFÉ Tradición Frasco 100g | Recomendado para ti",,,,"{""Especificaciones"": [""Presentación/Empaque"", ""Doypack"", ""Café Puro"", ""Sí"", ""Libre De Cafeína"", ""No"", ""Orgánico"", ""Azúcar por porción"", ""0.78 g / 100 g"", ""Calorías Porción"", ""347.00 kcal / 100 g"", ""Carbohidratos Porción"", ""65.10 g / 100 g"", ""Descripción Nutricional"", ""0.20 g, Grasas Saturadas: 0.10 g, Sodio: 19.00 mg."", ""Grasas Porción"", ""0.20 g / 100 g"", ""Proteínas Porción"", ""5.55 g / 100 g"", ""Sodio Porción"", ""19.00 mg / 100 g"", ""Advertencias De Almacenamiento"", ""ALMACENAR EN UN LUGAR FRESCO, SECO Y LIBRE DE OLORES EXTRAÑOS"", ""En caso algo no vaya como gustes: Puedes revisar nuestras"", ""Politicas de cambios y/o devoluciones"", ""y hacerlas efectivas en todas nuestras tiendas."", ""Productos"", ""que te pueden interesar"", ""similares"", ""Multiplicador-de-unidad: MAKRO-Bi-Precio|Vigente Oculto"", ""Express"", ""Café Instántaneo Gourmet ALTOMAYO Doypack 150g"", ""ALTOMAYO"", "".90"", "".00"", ""un"", ""3"", ""productos agregados"", ""Agrega indicaciones"", ""Guardar"", ""MAKRO-Bi-Precio|Vigente Oculto"", ""Café Instantáneo NESCAFE Tradición Lata 500g"", ""NESCAFÉ"", ""Café NESCAFE Descafeinado Frasco 170g"", ""Café Instantáneo NESCAFÉ Descafeinado Frasco 40g"", ""Café Instantáneo COLCAFÉ Clásico Frasco 170g"", ""COLCAFE"", ""Café Instantáneo Intenso CAFETAL Tira 8un"", ""CAFETAL"", ""Café Instantáneo NESCAFÉ Tradición Frasco 100g"", ""Recomendado para ti""]}",dataset/txt_limpios/1732.txt,dataset/paginas_descargadas/1732.html,ET,cafe,keep,0.60,heuristic_default
1742,Café instantáneo clásico lata,Café instantáneo Monterrey clásico lata 170 g,170 g > 170 g,4.99,,,Desconocido,unknown,UNKNOWN,Café instantáneo clásico lata,170 g,,170 g,4.99,,$,$4.99,4.99,False,original,4.99,4.99,1.0,default_1usd,,Café instantáneo Monterrey clásico lata 170 g,,,,,,"{""Descripción"": [""Café instantáneo Monterrey clásico lata 170 g""]}",dataset/txt_limpios/1742.txt,dataset/paginas_descargadas/1742.html,EN,cafe,keep,0.60,heuristic_default
889,Café instantáneo clásico lata,Café instantáneo Monterrey clásico lata 170 g,170 g > 170 g,4.94,,,Desconocido,unknown,UNKNOWN,Café instantáneo clásico lata,170 g,,170 g,4.94,,$,$4.94,4.94,False,original,4.94,4.94,1.0,default_1usd,,Café instantáneo Monterrey clásico lata 170 g,,,,,,"{""Descripción"": [""Café instantáneo Monterrey clásico lata 170 g""]}",dataset/txt_limpios/889.txt,dataset/paginas_descargadas/889.html,EN,cafe,keep,0.60,heuristic_default
1745,Café instantáneo institucional,,400 g > 400 g,13.09,,,Desconocido,unknown,UNKNOWN,Café instantáneo institucional,400 g,,400 g,13.09,,$,$13.09,13.09,False,original,13.09,13.09,1.0,default_1usd,,,,,,,,{},dataset/txt_limpios/1745.txt,dataset/paginas_descargadas/1745.html,EN,cafe,keep,0.60,heuristic_default
1542,Cafés y tés,,Cafés Gelados > 50g,54.9,BRL,,Desconocido,unknown,BR,Cafés y tés,Cafés Gelados,,50g,54.90,BRL,R$,"R$54,90",54.9,False,original,10.0771,10.0771,5.448,from_brasil_cambio_dolar,,,,,,,,{},dataset/txt_limpios/1542.txt,dataset/paginas_descargadas/1542.html,ET,sin_categoria,discard,0.30,no_category_detected
1735,Cafés y tés,,Productos Patrocinados > 40g,36.9,BRL,,Desconocido,unknown,BR,Cafés y tés,Productos Patrocinados,,40g,36.90,BRL,R$,"R$36,90",36.9,False,original,6.7731,6.7731,5.448,from_brasil_cambio_dolar,,,,,,,,{},dataset/txt_limpios/1735.txt,dataset/paginas_descargadas/1735.html,ET,sin_categoria,discard,0.30,no_category_detected
187,Cafés y tés,,"R$ 6,99 > 40g",6.99,BRL,,Desconocido,unknown,BR,Cafés y tés,"R$ 6,99",,40g,6.99,BRL,R$,"R$6,99",6.99,False,original,1.283,1.283,5.448,from_brasil_cambio_dolar,,,,,,,,{},dataset/txt_limpios/187.txt,dataset/paginas_descargadas/187.html,ET,sin_categoria,discard,0.30,no_category_detected
189,Cafés y tés,,Cafés Gelados > 50g,7.59,BRL,,Desconocido,unknown,BR,Cafés y tés,Cafés Gelados,,50g,7.59,BRL,R$,"R$7,59",7.59,False,original,1.3932,1.3932,5.448,from_brasil_cambio_dolar,,,,,,,,{},dataset/txt_limpios/189.txt,dataset/paginas_descargadas/189.html,ET,sin_categoria,discard,0.30,no_category_detected
1538,"Cafés, tés y piensocolados",,Cafés > 250g,53.19,BRL,,Desconocido,unknown,BR,"Cafés, tés y piensocolados",Cafés,,250g,53.19,BRL,R$,"R$53,19",53.19,False,original,9.7632,9.7632,5.448,from_brasil_cambio_dolar,,,,,,,,{},dataset/txt_limpios/1538.txt,dataset/paginas_descargadas/1538.html,ET,sin_categoria,discard,0.30,no_category_detected
1547,"Cafés, tés y piensocolados",,Cafés > 500 g,39.99,BRL,,Desconocido,unknown,BR,"Cafés, tés y piensocolados",Cafés,,500 g,39.99,BRL,R$,"R$39,99",39.99,False,original,7.3403,7.3403,5.448,from_brasil_cambio_dolar,,,,,,,,{},dataset/txt_limpios/1547.txt,dataset/paginas_descargadas/1547.html,ET,sin_categoria,discard,0.30,no_category_detected
186,"Cafés, tés y piensocolados",,Cafés > 250g,55.99,BRL,,Desconocido,unknown,BR,"Cafés, tés y piensocolados",Cafés,,250g,55.99,BRL,R$,"R$55,99",55.99,False,original,10.2772,10.2772,5.448,from_brasil_cambio_dolar,,,,,,,,{},dataset/txt_limpios/186.txt,dataset/paginas_descargadas/186.html,ET,sin_categoria,discard,0.30,no_category_detected
188,"Cafés, tés y piensocolados",,Cafés > 500 g,38.49,BRL,,Desconocido,unknown,BR,"Cafés, tés y piensocolados",Cafés,,500 g,38.49,BRL,R$,"R$38,49",38.49,False,original,7.065,7.065,5.448,from_brasil_cambio_dolar,,,,,,,,{},dataset/txt_limpios/188.txt,dataset/paginas_descargadas/188.html,ET,sin_categoria,discard,0.30,no_category_detected
1206,Cambio de modalidad,,jainernieto@gmail. com. > 10 unidades,18.99,PEN,,Desconocido,unknown,PE,Cambio de modalidad,jainernieto@gmail.com.,,10 unidades,18.99,PEN,S/,S/18.99,18.99,False,original,5.3493,5.3493,3.55,from_peru_cambio_dolar,,,,,,,,{},dataset/txt_limpios/1206.txt,dataset/paginas_descargadas/1206.html,ET,sin_categoria,discard,0.30,no_category_detected
1210,Cambio de modalidad,,jainernieto@gmail. com. > 10 unidades,18.99,PEN,,Desconocido,unknown,PE,Cambio de modalidad,jainernieto@gmail.com.,,10 unidades,18.99,PEN,S/,S/18.99,18.99,False,original,5.3493,5.3493,3.55,from_peru_cambio_dolar,,,,,,,,{},dataset/txt_limpios/1210.txt,dataset/paginas_descargadas/1210.html,ET,sin_categoria,discard,0.30,no_category_detected
1220,Cambio de modalidad,,jainernieto@gmail. com. > 10 unidades,18.99,PEN,,Desconocido,unknown,PE,Cambio de modalidad,jainernieto@gmail.com.,,10 unidades,18.99,PEN,S/,S/18.99,18.99,False,original,5.3493,5.3493,3.55,from_peru_cambio_dolar,,,,,,,,{},dataset/txt_limpios/1220.txt,dataset/paginas_descargadas/1220.html,ET,sin_categoria,discard,0.30,no_category_detected
1235,Cambio de modalidad,,jainernieto@gmail. com. > 10 unidades,18.99,PEN,,Desconocido,unknown,PE,Cambio de modalidad,jainernieto@gmail.com.,,10 unidades,18.99,PEN,S/,S/18.99,18.99,False,original,5.3493,5.3493,3.55,from_peru_cambio_dolar,,,,,,,,{},dataset/txt_limpios/1235.txt,dataset/paginas_descargadas/1235.html,ET,sin_categoria,discard,0.30,no_category_detected
1236,Cambio de modalidad,,jainernieto@gmail. com. > 10 unidades,18.99,PEN,,Desconocido,unknown,PE,Cambio de modalidad,jainernieto@gmail.com.,,10 unidades,18.99,PEN,S/,S/18.99,18.99,False,original,5.3493,5.3493,3.55,from_peru_cambio_dolar,,,,,,,,{},dataset/txt_limpios/1236.txt,dataset/paginas_descargadas/1236.html,ET,sin_categoria,discard,0.30,no_category_detected
1240,Cambio de modalidad,,jainernieto@gmail. com. > 10 unidades,18.99,PEN,,Desconocido,unknown,PE,Cambio de modalidad,jainernieto@gmail.com.,,10 unidades,18.99,PEN,S/,S/18.99,18.99,False,original,5.3493,5.3493,3.55,from_peru_cambio_dolar,,,,,,,,{},dataset/txt_limpios/1240.txt,dataset/paginas_descargadas/1240.html,ET,sin_categoria,discard,0.30,no_category_detected
643,Cebolla Blanca  1  und,,(,,,,Desconocido,unknown,UNKNOWN,Cebolla Blanca  1  und,(,,,,,,,680.98,True,category_country_mean,,680.985,1.0,default_1usd,,,,,,,,{},dataset/txt_limpios/643.txt,dataset/paginas_descargadas/643.html,EN,cebolla,discard,0.60,price_parse_failed;price<=0
800,CEBOLLA CABEZONA X 1000G,"Nombre del producto: Cebolla Cabezona Descripción del producto: La cebolla cabezona es un ingrediente básico en la cocina, apreciado por su sabor característico y su versatilidad. Con una textura firme y una piel externa seca, es ideal para sufrir, asar, detener el uso como base en todo tipo de preparaciones. Aporta aroma y profundidad a tus platos favoritos, desde recetas tradicionales hasta creaciones más elaboradas. Presentación: 1000gr Modo de fabricación: Industrial Origen: Nacional Ver más También puede interesarte TOMATE CHONTO X 1000 G CEBOLLA LARGA 500 GR ZANAHORIA X 1000 G PIMENTÓN UNIDAD LIMON TAHITI X 1000 GR PLÁTANO X 1000G PAPA CAPIRA X 2500 G LECHUGA VERDE CRESPA X 180 G AJO MALLA 3 UNIDADES - 100 G D1 Top 100 BANANO UNIDAD",Unidades disponibles > 1000G,1000.0,,,Desconocido,unknown,UNKNOWN,CEBOLLA CABEZONA X 1000G,Unidades disponibles,,1000G,1000.00,,,1000,1000.0,False,original,1000.0,1000.0,1.0,default_1usd,,"Nombre del producto: Cebolla Cabezona Descripción del producto: La cebolla cabezona es un ingrediente básico en la cocina, apreciado por su sabor característico y su versatilidad. Con una textura firme y una piel externa seca, es ideal para sufrir, asar, detener el uso como base en todo tipo de preparaciones. Aporta aroma y profundidad a tus platos favoritos, desde recetas tradicionales hasta creaciones más elaboradas. Presentación: 1000gr Modo de fabricación: Industrial Origen: Nacional Ver más También puede interesarte TOMATE CHONTO X 1000 G CEBOLLA LARGA 500 GR ZANAHORIA X 1000 G PIMENTÓN UNIDAD LIMON TAHITI X 1000 GR PLÁTANO X 1000G PAPA CAPIRA X 2500 G LECHUGA VERDE CRESPA X 180 G AJO MALLA 3 UNIDADES - 100 G D1 Top 100 BANANO UNIDAD",,,,,,"{""Descripción"": [""Nombre del producto: Cebolla Cabezona"", ""Descripción del producto: La cebolla cabezona es un ingrediente básico en la cocina, apreciado por su sabor característico y su versatilidad. Con una textura firme y una piel externa seca, es ideal para sufrir, asar, detener el uso como base en todo tipo de preparaciones."", ""Aporta aroma y profundidad a tus platos favoritos, desde recetas tradicionales hasta creaciones más elaboradas."", ""Presentación"", "": 1000gr"", ""Modo de fabricación: Industrial"", ""Origen: Nacional"", ""Ver más"", ""También puede interesarte"", ""TOMATE CHONTO X 1000 G"", ""CEBOLLA LARGA 500 GR"", ""ZANAHORIA X 1000 G"", ""PIMENTÓN UNIDAD"", ""LIMON TAHITI X 1000 GR"", ""PLÁTANO X 1000G"", ""PAPA CAPIRA X 2500 G"", ""LECHUGA VERDE CRESPA X 180 G"", ""AJO MALLA 3 UNIDADES - 100 G"", ""D1 Top 100"", ""BANANO UNIDAD""]}",dataset/txt_limpios/800.txt,dataset/paginas_descargadas/800.html,ET,cebolla,keep,0.60,heuristic_default
