{"source_id": "641", "title": "$ 12.800", "description": "", "breadcrumbs": "Ver detalles del producto > 15G", "price_raw": "12.8", "currency_raw": "", "url": "", "seller": "Desconocido", "availability": "unknown", "country": "UNKNOWN", "product_name": "$ 12.800", "brand": "Ver detalles del producto", "reference": "", "unit": "15G", "price_amount": 12.8, "price_currency": "", "price_symbol": "$", "price_text": "$12.80", "price_amount_filled": "12.8", "price_is_imputed": "False", "price_imputation_source": "original", "price_amount_usd": "12.8", "price_amount_usd_filled": "12.8", "fx_rate_local_per_usd": "1.0", "fx_source": "default_1usd", "information_text": "", "description_text": "", "features_text": "", "specifications_text": "", "benefits_text": "", "details_text": "", "other_sections": "", "sections": {}, "txt_path": "dataset/txt_limpios/641.txt", "html_path": "dataset/paginas_descargadas/641.html", "es_status": "EN", "category_canonical": "sin_categoria", "decision": "discard", "match_score": 0.3, "reasons": "no_category_detected"}
{"source_id": "640", "title": "$ 8.500", "description": "", "breadcrumbs": "$ 8.000", "price_raw": "8.5", "currency_raw": "", "url": "", "seller": "Desconocido", "availability": "unknown", "country": "UNKNOWN", "product_name": "$ 8.500", "brand": "$ 8.000", "reference": "", "unit": "", "price_amount": 8.5, "price_currency": "", "price_symbol": "$", "price_text": "$8.50", "price_amount_filled": "8.5", "price_is_imputed": "False", "price_imputation_source": "original", "price_amount_usd": "8.5", "price_amount_usd_filled": "8.5", "fx_rate_local_per_usd": "1.0", "fx_source": "default_1usd", "information_text": "", "description_text": "", "features_text": "", "specifications_text": "", "benefits_text": "", "details_text": "", "other_sections": "", "sections": {}, "txt_path": "dataset/txt_limpios/640.txt", "html_path": "dataset/paginas_descargadas/640.html", "es_status": "EN", "category_canonical": "sin_categoria", "decision": "discard", "match_score": 0.3, "reasons": "no_category_detected"}
{"source_id": "1368", "title": "(021) 729-7200", "description": "", "breadcrumbs": "Zona de Cobertura > 600GR", "price_raw": "10.5", "currency_raw": "", "url": "", "seller": "Desconocido", "availability": "unknown", "country": "UNKNOWN", "product_name": "(021) 729-7200", "brand": "Zona de Cobertura", "reference": "", "unit": "600GR", "price_amount": 10.5, "price_currency": "", "price_symbol": ".", "price_text": ".10.50", "price_amount_filled": "10.5", "price_is_imputed": "False", "price_imputation_source": "original", "price_amount_usd": "10.5", "price_amount_usd_filled": "10.5", "fx_rate_local_per_usd": "1.0", "fx_source": "default_1usd", "information_text": "", "description_text": "", "features_text": "", "specifications_text": "", "benefits_text": "", "details_text": "", "other_sections": "", "sections": {}, "txt_path": "dataset/txt_limpios/1368.txt", "html_path": "dataset/paginas_descargadas/1368.html", "es_status": "EN", "category_canonical": "sin_categoria", "decision": "discard", "match_score": 0.3, "reasons": "no_category_detected"}
{"source_id": "626", "title": "(Gr a $ 10)", "description": "", "breadcrumbs": "$ 8.650 > 0.2 g", "price_raw": "10.0", "currency_raw": "", "url": "", "seller": "Desconocido", "availability": "unknown", "country": "UNKNOWN", "product_name": "(Gr a $ 10)", "brand": "$ 8.650", "reference": "", "unit": "0.2 g", "price_amount": 10.0, "price_currency": "", "price_symbol": "$", "price_text": "$10", "price_amount_filled": "10.0", "price_is_imputed": "False", "price_imputation_source": "original", "price_amount_usd": "10.0", "price_amount_usd_filled": "10.0", "fx_rate_local_per_usd": "1.0", "fx_source": "default_1usd", "information_text": "", "description_text": "", "features_text": "", "specifications_text": "", "benefits_text": "", "details_text": "", "other_sections": "", "sections": {}, "txt_path": "dataset/txt_limpios/626.txt", "html_path": "dataset/paginas_descargadas/626.html", "es_status": "EN", "category_canonical": "sin_categoria", "decision": "discard", "match_score": 0.3, "reasons": "no_category_detected"}
{"source_id": "627", "title": "(Gr a $ 10)", "description": "", "breadcrumbs": "20 > 480G", "price_raw": "10.0", "currency_raw": "", "url": "", "seller": "Desconocido", "availability": "unknown", "country": "UNKNOWN", "product_name": "(Gr a $ 10)", "brand": "20", "reference": "", "unit": "480G", "price_amount": 10.0, "price_currency": "", "price_symbol": "$", "price_text": "$10", "price_amount_filled": "10.0", "price_is_imputed": "False", "price_imputation_source": "original", "price_amount_usd": "10.0", "price_amount_usd_filled": "10.0", "fx_rate_local_per_usd": "1.0", "fx_source": "default_1usd", "information_text": "", "description_text": "", "features_text": "", "specifications_text": "", "benefits_text": "", "details_text": "", "other_sections": "", "sections": {}, "txt_path": "dataset/txt_limpios/627.txt", "html_path": "dataset/paginas_descargadas/627.html", "es_status": "EN", "category_canonical": "sin_categoria", "decision": "discard", "match_score": 0.3, "reasons": "no_category_detected"}
{"source_id": "630", "title": "(Gr a $ 10)", "description": "", "breadcrumbs": "20", "price_raw": "10.0", "currency_raw": "", "url": "", "seller": "Desconocido", "availability": "unknown", "country": "UNKNOWN", "product_name": "(Gr a $ 10)", "brand": "20", "reference": "", "unit": "", "price_amount": 10.0, "price_currency": "", "price_symbol": "$", "price_text": "$10", "price_amount_filled": "10.0", "price_is_imputed": "False", "price_imputation_source": "original", "price_amount_usd": "10.0", "price_amount_usd_filled": "10.0", "fx_rate_local_per_usd": "1.0", "fx_source": "default_1usd", "information_text": "", "description_text": "", "features_text": "", "specifications_text": "", "benefits_text": "", "details_text": "", "other_sections": "", "sections": {}, "txt_path": "dataset/txt_limpios/630.txt", "html_path": "dataset/paginas_descargadas/630.html", "es_status": "EN", "category_canonical": "sin_categoria", "decision": "discard", "match_score": 0.3, "reasons": "no_category_detected"}
{"source_id": "766", "title": "(Gr a $ 11)", "description": "", "breadcrumbs": "$ 6.700", "price_raw": "11.0", "currency_raw": "", "url": "", "seller": "Desconocido", "availability": "unknown", "country": "UNKNOWN", "product_name": "(Gr a $ 11)", "brand": "$ 6.700", "reference": "", "unit": "", "price_amount": 11.0, "price_currency": "", "price_symbol": "$", "price_text": "$11", "price_amount_filled": "11.0", "price_is_imputed": "False", "price_imputation_source": "original", "price_amount_usd": "11.0", "price_amount_usd_filled": "11.0", "fx_rate_local_per_usd": "1.0", "fx_source": "default_1usd", "information_text": "", "description_text": "", "features_text": "", "specifications_text": "", "benefits_text": "", "details_text": "", "other_sections": "", "sections": {}, "txt_path": "dataset/txt_limpios/766.txt", "html_path": "dataset/paginas_descargadas/766.html", "es_status": "EN", "category_canonical": "sin_categoria", "decision": "discard", "match_score": 0.3, "reasons": "no_category_detected"}
{"source_id": "767", "title": "(Gr a $ 12)", "description": "", "breadcrumbs": "$ 7.150", "price_raw": "12.0", "currency_raw": "", "url": "", "seller": "Desconocido", "availability": "unknown", "country": "UNKNOWN", "product_name": "(Gr a $ 12)", "brand": "$ 7.150", "reference": "", "unit": "", "price_amount": 12.0, "price_currency": "", "price_symbol": "$", "price_text": "$12", "price_amount_filled": "12.0", "price_is_imputed": "False", "price_imputation_source": "original", "price_amount_usd": "12.0", "price_amount_usd_filled": "12.0", "fx_rate_local_per_usd": "1.0", "fx_source": "default_1usd", "information_text": "", "description_text": "", "features_text": "", "specifications_text": "", "benefits_text": "", "details_text": "", "other_sections": "", "sections": {}, "txt_path": "dataset/txt_limpios/767.txt", "html_path": "dataset/paginas_descargadas/767.html", "es_status": "EN", "category_canonical": "sin_categoria", "decision": "discard", "match_score": 0.3, "reasons": "no_category_detected"}
{"source_id": "778", "title": "(Gr a $ 19)", "description": "", "breadcrumbs": "$ 39.000", "price_raw": "19.0", "currency_raw": "", "url": "", "seller": "Desconocido", "availability": "unknown", "country": "UNKNOWN", "product_name": "(Gr a $ 19)", "brand": "$ 39.000", "reference": "", "unit": "", "price_amount": 19.0, "price_currency": "", "price_symbol": "$", "price_text": "$19", "price_amount_filled": "19.0", "price_is_imputed": "False", "price_imputation_source": "original", "price_amount_usd": "19.0", "price_amount_usd_filled": "19.0", "fx_rate_local_per_usd": "1.0", "fx_source": "default_1usd", "information_text": "", "description_text": "", "features_text": "", "specifications_text": "", "benefits_text": "", "details_text": "", "other_sections": "", "sections": {}, "txt_path": "dataset/txt_limpios/778.txt", "html_path": "dataset/paginas_descargadas/778.html", "es_status": "EN", "category_canonical": "sin_categoria", "decision": "discard", "match_score": 0.3, "reasons": "no_category_detected"}
{"source_id": "637", "title": "(Gr a $ 2)", "description": "", "breadcrumbs": "36", "price_raw": "2.0", "currency_raw": "", "url": "", "seller": "Desconocido", "availability": "unknown", "country": "UNKNOWN", "product_name": "(Gr a $ 2)", "brand": "36", "reference": "", "unit": "", "price_amount": 2.0, "price_currency": "", "price_symbol": "$", "price_text": "$2", "price_amount_filled": "2.0", "price_is_imputed": "False", "price_imputation_source": "original", "price_amount_usd": "2.0", "price_amount_usd_filled": "2.0", "fx_rate_local_per_usd": "1.0", "fx_source": "default_1usd", "information_text": "", "description_text": "", "features_text": "", "specifications_text": "", "benefits_text": "", "details_text": "", "other_sections": "", "sections": {}, "txt_path": "dataset/txt_limpios/637.txt", "html_path": "dataset/paginas_descargadas/637.html", "es_status": "EN", "category_canonical": "sin_categoria", "decision": "discard", "match_score": 0.3, "reasons": "no_category_detected"}
{"source_id": "773", "title": "(Gr a $ 2)", "description": "", "breadcrumbs": "36", "price_raw": "2.0", "currency_raw": "", "url": "", "seller": "Desconocido", "availability": "unknown", "country": "UNKNOWN", "product_name": "(Gr a $ 2)", "brand": "36", "reference": "", "unit": "", "price_amount": 2.0, "price_currency": "", "price_symbol": "$", "price_text": "$2", "price_amount_filled": "2.0", "price_is_imputed": "False", "price_imputation_source": "original", "price_amount_usd": "2.0", "price_amount_usd_filled": "2.0", "fx_rate_local_per_usd": "1.0", "fx_source": "default_1usd", "information_text": "", "description_text": "", "features_text": "", "specifications_text": "", "benefits_text": "", "details_text": "", "other_sections": "", "sections": {}, "txt_path": "dataset/txt_limpios/773.txt", "html_path": "dataset/paginas_descargadas/773.html", "es_status": "EN", "category_canonical": "sin_categoria", "decision": "discard", "match_score": 0.3, "reasons": "no_category_detected"}
{"source_id": "628", "title": "(Gr a $ 21)", "description": "", "breadcrumbs": "$ 10.550", "price_raw": "21.0", "currency_raw": "", "url": "", "seller": "Desconocido", "availability": "unknown", "country": "UNKNOWN", "product_name": "(Gr a $ 21)", "brand": "$ 10.550", "reference": "", "unit": "", "price_amount": 21.0, "price_currency": "", "price_symbol": "$", "price_text": "$21", "price_amount_filled": "21.0", "price_is_imputed": "False", "price_imputation_source": "original", "price_amount_usd": "21.0", "price_amount_usd_filled": "21.0", "fx_rate_local_per_usd": "1.0", "fx_source": "default_1usd", "information_text": "", "description_text": "", "features_text": "", "specifications_text": "", "benefits_text": "", "details_text": "", "other_sections": "", "sections": {}, "txt_path": "dataset/txt_limpios/628.txt", "html_path": "dataset/paginas_descargadas/628.html", "es_status": "EN", "category_canonical": "sin_categoria", "decision": "discard", "match_score": 0.3, "reasons": "no_category_detected"}
{"source_id": "765", "title": "(Gr a $ 21)", "description": "", "breadcrumbs": "20", "price_raw": "21.0", "currency_raw": "", "url": "", "seller": "Desconocido", "availability": "unknown", "country": "UNKNOWN", "product_name": "(Gr a $ 21)", "brand": "20", "reference": "", "unit": "", "price_amount": 21.0, "price_currency": "", "price_symbol": "$", "price_text": "$21", "price_amount_filled": "21.0", "price_is_imputed": "False", "price_imputation_source": "original", "price_amount_usd": "21.0", "price_amount_usd_filled": "21.0", "fx_rate_local_per_usd": "1.0", "fx_source": "default_1usd", "information_text": "", "description_text": "", "features_text": "", "specifications_text": "", "benefits_text": "", "details_text": "", "other_sections": "", "sections": {}, "txt_path": "dataset/txt_limpios/765.txt", "html_path": "dataset/paginas_descargadas/765.html", "es_status": "EN", "category_canonical": "sin_categoria", "decision": "discard", "match_score": 0.3, "reasons": "no_category_detected"}
{"source_id": "763", "title": "(Gr a $ 23)", "description": "", "breadcrumbs": "$ 11.600", "price_raw": "23.0", "currency_raw": "", "url": "", "seller": "Desconocido", "availability": "unknown", "country": "UNKNOWN", "product_name": "(Gr a $ 23)", "brand": "$ 11.600", "reference": "", "unit": "", "price_amount": 23.0, "price_currency": "", "price_symbol": "$", "price_text": "$23", "price_amount_filled": "23.0", "price_is_imputed": "False", "price_imputation_source": "original", "price_amount_usd": "23.0", "price_amount_usd_filled": "23.0", "fx_rate_local_per_usd": "1.0", "fx_source": "default_1usd", "information_text": "", "description_text": "", "features_text": "", "specifications_text": "", "benefits_text": "", "details_text": "", "other_sections": "", "sections": {}, "txt_path": "dataset/txt_limpios/763.txt", "html_path": "dataset/paginas_descargadas/763.html", "es_status": "EN", "category_canonical": "sin_categoria", "decision": "discard", "match_score": 0.3, "reasons": "no_category_detected"}
{"source_id": "629", "title": "(Gr a $ 29)", "description": "", "breadcrumbs": "$ 13.450", "price_raw": "29.0", "currency_raw": "", "url": "", "seller": "Desconocido", "availability": "unknown", "country": "UNKNOWN", "product_name": "(Gr a $ 29)", "brand": "$ 13.450", "reference": "", "unit": "", "price_amount": 29.0, "price_currency": "", "price_symbol": "$", "price_text": "$29", "price_amount_filled": "29.0", "price_is_imputed": "False", "price_imputation_source": "original", "price_amount_usd": "29.0", "price_amount_usd_filled": "29.0", "fx_rate_local_per_usd": "1.0", "fx_source": "default_1usd", "information_text": "", "description_text": "", "features_text": "", "specifications_text": "", "benefits_text": "", "details_text": "", "other_sections": "", "sections": {}, "txt_path": "dataset/txt_limpios/629.txt", "html_path": "dataset/paginas_descargadas/629.html", "es_status": "EN", "category_canonical": "sin_categoria", "decision": "discard", "match_score": 0.3, "reasons": "no_category_detected"}
{"source_id": "654", "title": "(Gr a $ 3)", "description": "", "breadcrumbs": "30", "price_raw": "3.0", "currency_raw": "", "url": "", "seller": "Desconocido", "availability": "unknown", "country": "UNKNOWN", "product_name": "(Gr a $ 3)", "brand": "30", "reference": "", "unit": "", "price_amount": 3.0, "price_currency": "", "price_symbol": "$", "price_text": "$3", "price_amount_filled": "3.0", "price_is_imputed": "False", "price_imputation_source": "original", "price_amount_usd": "3.0", "price_amount_usd_filled": "3.0", "fx_rate_local_per_usd": "1.0", "fx_source": "default_1usd", "information_text": "", "description_text": "", "features_text": "", "specifications_text": "", "benefits_text": "", "details_text": "", "other_sections": "", "sections": {}, "txt_path": "dataset/txt_limpios/654.txt", "html_path": "dataset/paginas_descargadas/654.html", "es_status": "EN", "category_canonical": "sin_categoria", "decision": "discard", "match_score": 0.3, "reasons": "no_category_detected"}
{"source_id": "657", "title": "(Gr a $ 3)", "description": "", "breadcrumbs": "27", "price_raw": "3.0", "currency_raw": "", "url": "", "seller": "Desconocido", "availability": "unknown", "country": "UNKNOWN", "product_name": "(Gr a $ 3)", "brand": "27", "reference": "", "unit": "", "price_amount": 3.0, "price_currency": "", "price_symbol": "$", "price_text": "$3", "price_amount_filled": "3.0", "price_is_imputed": "False", "price_imputation_source": "original", "price_amount_usd": "3.0", "price_amount_usd_filled": "3.0", "fx_rate_local_per_usd": "1.0", "fx_source": "default_1usd", "information_text": "", "description_text": "", "features_text": "", "specifications_text": "", "benefits_text": "", "details_text": "", "other_sections": "", "sections": {}, "txt_path": "dataset/txt_limpios/657.txt", "html_path": "dataset/paginas_descargadas/657.html", "es_status": "EN", "category_canonical": "sin_categoria", "decision": "discard", "match_score": 0.3, "reasons": "no_category_detected"}
{"source_id": "759", "title": "(Gr a $ 3)", "description": "", "breadcrumbs": "20", "price_raw": "3.0", "currency_raw": "", "url": "", "seller": "Desconocido", "availability": "unknown", "country": "UNKNOWN", "product_name": "(Gr a $ 3)", "brand": "20", "reference": "", "unit": "", "price_amount": 3.0, "price_currency": "", "price_symbol": "$", "price_text": "$3", "price_amount_filled": "3.0", "price_is_imputed": "False", "price_imputation_source": "original", "price_amount_usd": "3.0", "price_amount_usd_filled": "3.0", "fx_rate_local_per_usd": "1.0", "fx_source": "default_1usd", "information_text": "", "description_text": "", "features_text": "", "specifications_text": "", "benefits_text": "", "details_text": "", "other_sections": "", "sections": {}, "txt_path": "dataset/txt_limpios/759.txt", "html_path": "dataset/paginas_descargadas/759.html", "es_status": "EN", "category_canonical": "sin_categoria", "decision": "discard", "match_score": 0.3, "reasons": "no_category_detected"}
{"source_id": "760", "title": "(Gr a $ 3)", "description": "", "breadcrumbs": "37", "price_raw": "3.0", "currency_raw": "", "url": "", "seller": "Desconocido", "availability": "unknown", "country": "UNKNOWN", "product_name": "(Gr a $ 3)", "brand": "37", "reference": "", "unit": "", "price_amount": 3.0, "price_currency": "", "price_symbol": "$", "price_text": "$3", "price_amount_filled": "3.0", "price_is_imputed": "False", "price_imputation_source": "original", "price_amount_usd": "3.0", "price_amount_usd_filled": "3.0", "fx_rate_local_per_usd": "1.0", "fx_source": "default_1usd", "information_text": "", "description_text": "", "features_text": "", "specifications_text": "", "benefits_text": "", "details_text": "", "other_sections": "", "sections": {}, "txt_path": "dataset/txt_limpios/760.txt", "html_path": "dataset/paginas_descargadas/760.html", "es_status": "EN", "category_canonical": "sin_categoria", "decision": "discard", "match_score": 0.3, "reasons": "no_category_detected"}
{"source_id": "785", "title": "(Gr a $ 3)", "description": "", "breadcrumbs": "30", "price_raw": "3.0", "currency_raw": "", "url": "", "seller": "Desconocido", "availability": "unknown", "country": "UNKNOWN", "product_name": "(Gr a $ 3)", "brand": "30", "reference": "", "unit": "", "price_amount": 3.0, "price_currency": "", "price_symbol": "$", "price_text": "$3", "price_amount_filled": "3.0", "price_is_imputed": "False", "price_imputation_source": "original", "price_amount_usd": "3.0", "price_amount_usd_filled": "3.0", "fx_rate_local_per_usd": "1.0", "fx_source": "default_1usd", "information_text": "", "description_text": "", "features_text": "", "specifications_text": "", "benefits_text": "", "details_text": "", "other_sections": "", "sections": {}, "txt_path": "dataset/txt_limpios/785.txt", "html_path": "dataset/paginas_descargadas/785.html", "es_status": "EN", "category_canonical": "sin_categoria", "decision": "discard", "match_score": 0.3, "reasons": "no_category_detected"}
{"source_id": "764", "title": "(Gr a $ 34)", "description": "", "breadcrumbs": "$ 15.700", "price_raw": "34.0", "currency_raw": "", "url": "", "seller": "Desconocido", "availability": "unknown", "country": "UNKNOWN", "product_name": "(Gr a $ 34)", "brand": "$ 15.700", "reference": "", "unit": "", "price_amount": 34.0, "price_currency": "", "price_symbol": "$", "price_text": "$34", "price_amount_filled": "34.0", "price_is_imputed": "False", "price_imputation_source": "original", "price_amount_usd": "34.0", "price_amount_usd_filled": "34.0", "fx_rate_local_per_usd": "1.0", "fx_source": "default_1usd", "information_text": "", "description_text": "", "features_text": "", "specifications_text": "", "benefits_text": "", "details_text": "", "other_sections": "", "sections": {}, "txt_path": "dataset/txt_limpios/764.txt", "html_path": "dataset/paginas_descargadas/764.html", "es_status": "EN", "category_canonical": "sin_categoria", "decision": "discard", "match_score": 0.3, "reasons": "no_category_detected"}
