source_id,title,description,breadcrumbs,price_raw,currency_raw,url,seller,availability,country,product_name,brand,reference,unit,price_amount,price_currency,price_symbol,price_text,price_amount_filled,price_is_imputed,price_imputation_source,price_amount_usd,price_amount_usd_filled,fx_rate_local_per_usd,fx_source,information_text,description_text,features_text,specifications_text,benefits_text,details_text,other_sections,sections,txt_path,html_path,es_status,category_canonical,decision,match_score,reasons
121,¡Lo mejor te está esperando!,"Consiente a tu familia con nuestra Leche Zaragoza de larga duración, mismo sabor y frescura, 100% leche pura de vaca, excelente fuente de proteína y calcio, adicionada con vitaminas A y D | ... Ver más | Ver más | Favoritos | Recomendados | Leche Uht Deslactosada Semidescremad... | 1 LT | Leche Uht Deslactosada Light Baja En... | Leche Uht 100 Sin Lactosa Reducida E... | Leche Uht 100 Sin Lactosa Semidescre... | Leche Uht Entera         Santa Clara... | Leche Uht Deslactosada Semi  Lala  1... | 1.5 LT | Leche Uht Deslactosada   Santa Clara... | Leche Uht Entera Premium   Zaragoza ... | Leche Uht Deslactosada   Lala  1.5 L... | Leche Uht Deslactosada Light     San... | Leche Uht Deslactosada   Zaragoza   ... | Leche Uht Light Baja En Grasa    Lal... | Leche Uht Entera   Lala  1.5 Lt | Leche Uht Ultrapasteurizada   Optima... | 6 LT | Leche Uht Deslactosada   Borden    1... | Leche Uht Entera   Borden    1 Lt | Leche Uht Entera   Alpura    1 Lt | Leche Uht Light   Zaragoza    1 Lt | Leche Uht Deslactosada   Alpura    1... | Leche Uht Light       Santa Clara   ... | Leche Uht Deslactosada Light   Alpur... | Leche Uht Deslactosada Light  Zarago... | Leche Uht Light Baja En Grasa   Lala... | Leche Uht Extra Proteina +70%  Desla... | Leche Uht Selecta  Alpura    1 Lt | Leche Uht Baja En Grasa   Borden    ... | Leche Uht Light   Alpura    1 Lt | Mes patrio Herdez | Adobo    Doña María 235 G | Mole Doña María Almendrado En Pasta ... | Mole Doña María Almendrado Listo Par... | Mole Doña María Poblano Con Cacao En... | Mole Doña Maria Poblano Con Cacao Li... | Mole Doña Mariía Rojo En Pasta   125... | Mole En Pasta 430 Gramos   Doña Mari... | Mole Listo Para Servir  Para Servir ... | Mole Rojo En Pasta  Doña Maria 235 G | Mole Verde En Pasta  Doña Maria 230 ... | Pipián En Pasta  Doña Maria 230 G | Salsa Cacahuate Picante Cremosa   He... | Salsa Casera Con Habanero   Herdez 4... | Salsa Casera  Herdez 210 G | Salsa Guacamole 15% Mas Guacamole He...",Descarga la app > 1 Lt,34.9,,,Desconocido,unknown,UNKNOWN,¡Lo mejor te está esperando!,Descarga la app,,1 Lt,34.90,,$,$34.90,34.9,False,original,34.9,34.9,1.0,default_1usd,,,,,,"Consiente a tu familia con nuestra Leche Zaragoza de larga duración, mismo sabor y frescura, 100% leche pura de vaca, excelente fuente de proteína y calcio, adicionada con vitaminas A y D | ... Ver más | Ver más | Favoritos | Recomendados | Leche Uht Deslactosada Semidescremad... | 1 LT | Leche Uht Deslactosada Light Baja En... | Leche Uht 100 Sin Lactosa Reducida E... | Leche Uht 100 Sin Lactosa Semidescre... | Leche Uht Entera         Santa Clara... | Leche Uht Deslactosada Semi  Lala  1... | 1.5 LT | Leche Uht Deslactosada   Santa Clara... | Leche Uht Entera Premium   Zaragoza ... | Leche Uht Deslactosada   Lala  1.5 L... | Leche Uht Deslactosada Light     San... | Leche Uht Deslactosada   Zaragoza   ... | Leche Uht Light Baja En Grasa    Lal... | Leche Uht Entera   Lala  1.5 Lt | Leche Uht Ultrapasteurizada   Optima... | 6 LT | Leche Uht Deslactosada   Borden    1... | Leche Uht Entera   Borden    1 Lt | Leche Uht Entera   Alpura    1 Lt | Leche Uht Light   Zaragoza    1 Lt | Leche Uht Deslactosada   Alpura    1... | Leche Uht Light       Santa Clara   ... | Leche Uht Deslactosada Light   Alpur... | Leche Uht Deslactosada Light  Zarago... | Leche Uht Light Baja En Grasa   Lala... | Leche Uht Extra Proteina +70%  Desla... | Leche Uht Selecta  Alpura    1 Lt | Leche Uht Baja En Grasa   Borden    ... | Leche Uht Light   Alpura    1 Lt | Mes patrio Herdez | Adobo    Doña María 235 G | Mole Doña María Almendrado En Pasta ... | Mole Doña María Almendrado Listo Par... | Mole Doña María Poblano Con Cacao En... | Mole Doña Maria Poblano Con Cacao Li... | Mole Doña Mariía Rojo En Pasta   125... | Mole En Pasta 430 Gramos   Doña Mari... | Mole Listo Para Servir  Para Servir ... | Mole Rojo En Pasta  Doña Maria 235 G | Mole Verde En Pasta  Doña Maria 230 ... | Pipián En Pasta  Doña Maria 230 G | Salsa Cacahuate Picante Cremosa   He... | Salsa Casera Con Habanero   Herdez 4... | Salsa Casera  Herdez 210 G | Salsa Guacamole 15% Mas Guacamole He...",,"{""Detalles"": [""Consiente a tu familia con nuestra Leche Zaragoza de larga duración, mismo sabor y frescura, 100% leche pura de vaca, excelente fuente de proteína y calcio, adicionada con vitaminas A y D"", ""... Ver más"", ""Ver más"", ""Favoritos"", ""Recomendados"", ""Leche Uht Deslactosada Semidescremad..."", ""1 LT"", ""Leche Uht Deslactosada Light Baja En..."", ""Leche Uht 100 Sin Lactosa Reducida E..."", ""Leche Uht 100 Sin Lactosa Semidescre..."", ""Leche Uht Entera         Santa Clara..."", ""Leche Uht Deslactosada Semi  Lala  1..."", ""1.5 LT"", ""Leche Uht Deslactosada   Santa Clara..."", ""Leche Uht Entera Premium   Zaragoza ..."", ""Leche Uht Deslactosada   Lala  1.5 L..."", ""Leche Uht Deslactosada Light     San..."", ""Leche Uht Deslactosada   Zaragoza   ..."", ""Leche Uht Light Baja En Grasa    Lal..."", ""Leche Uht Entera   Lala  1.5 Lt"", ""Leche Uht Ultrapasteurizada   Optima..."", ""6 LT"", ""Leche Uht Deslactosada   Borden    1..."", ""Leche Uht Entera   Borden    1 Lt"", ""Leche Uht Entera   Alpura    1 Lt"", ""Leche Uht Light   Zaragoza    1 Lt"", ""Leche Uht Deslactosada   Alpura    1..."", ""Leche Uht Light       Santa Clara   ..."", ""Leche Uht Deslactosada Light   Alpur..."", ""Leche Uht Deslactosada Light  Zarago..."", ""Leche Uht Light Baja En Grasa   Lala..."", ""Leche Uht Extra Proteina +70%  Desla..."", ""Leche Uht Selecta  Alpura    1 Lt"", ""Leche Uht Baja En Grasa   Borden    ..."", ""Leche Uht Light   Alpura    1 Lt"", ""Mes patrio Herdez"", ""Adobo    Doña María 235 G"", ""Mole Doña María Almendrado En Pasta ..."", ""Mole Doña María Almendrado Listo Par..."", ""Mole Doña María Poblano Con Cacao En..."", ""Mole Doña Maria Poblano Con Cacao Li..."", ""Mole Doña Mariía Rojo En Pasta   125..."", ""Mole En Pasta 430 Gramos   Doña Mari..."", ""Mole Listo Para Servir  Para Servir ..."", ""Mole Rojo En Pasta  Doña Maria 235 G"", ""Mole Verde En Pasta  Doña Maria 230 ..."", ""Pipián En Pasta  Doña Maria 230 G"", ""Salsa Cacahuate Picante Cremosa   He..."", ""Salsa Casera Con Habanero   Herdez 4..."", ""Salsa Casera  Herdez 210 G"", ""Salsa Guacamole 15% Mas Guacamole He...""]}",dataset/txt_limpios/121.txt,dataset/paginas_descargadas/121.html,EN,leche,keep,0.60,heuristic_default
122,¡Lo mejor te está esperando!,"La Leche UHT Entera Santa Clara de 1 litro es la elección perfecta para una alimentación saludable y equilibrada. Con su sabor delicioso y su textura cremosa, esta leche es ideal para disfrutar sola o para usar en tus recetas | ... Ver más | Ver más | Favoritos | Recomendados | Leche Uht Deslactosada Semidescremad... | 1 LT | Leche Uht Deslactosada Light Baja En... | Leche Uht 100 Sin Lactosa Reducida E... | Leche Uht 100 Sin Lactosa Semidescre... | Leche Uht Entera         Santa Clara... | Leche Uht Deslactosada Semi  Lala  1... | 1.5 LT | Leche Uht Deslactosada   Santa Clara... | Leche Uht Entera Premium   Zaragoza ... | Leche Uht Deslactosada   Lala  1.5 L... | Leche Uht Deslactosada Light     San... | Leche Uht Deslactosada   Zaragoza   ... | Leche Uht Light Baja En Grasa    Lal... | Leche Uht Entera   Lala  1.5 Lt | Leche Uht Ultrapasteurizada   Optima... | 6 LT | Leche Uht Deslactosada   Borden    1... | Leche Uht Entera   Borden    1 Lt | Leche Uht Entera   Alpura    1 Lt | Leche Uht Light   Zaragoza    1 Lt | Leche Uht Deslactosada   Alpura    1... | Leche Uht Light       Santa Clara   ... | Leche Uht Deslactosada Light   Alpur... | Leche Uht Deslactosada Light  Zarago... | Leche Uht Light Baja En Grasa   Lala... | Leche Uht Extra Proteina +70%  Desla... | Leche Uht Selecta  Alpura    1 Lt | Leche Uht Baja En Grasa   Borden    ... | Leche Uht Light   Alpura    1 Lt | Mes patrio Herdez | Adobo    Doña María 235 G | Mole Doña María Almendrado En Pasta ... | Mole Doña María Almendrado Listo Par... | Mole Doña María Poblano Con Cacao En... | Mole Doña Maria Poblano Con Cacao Li... | Mole Doña Mariía Rojo En Pasta   125... | Mole En Pasta 430 Gramos   Doña Mari... | Mole Listo Para Servir  Para Servir ... | Mole Rojo En Pasta  Doña Maria 235 G | Mole Verde En Pasta  Doña Maria 230 ... | Pipián En Pasta  Doña Maria 230 G | Salsa Cacahuate Picante Cremosa   He... | Salsa Casera Con Habanero   Herdez 4... | Salsa Casera  Herdez 210 G | Salsa Guacamole 15% Mas Guacamole He...",Descarga la app > 1 Lt,37.9,,,Desconocido,unknown,UNKNOWN,¡Lo mejor te está esperando!,Descarga la app,,1 Lt,37.90,,$,$37.90,37.9,False,original,37.9,37.9,1.0,default_1usd,,,,,,"La Leche UHT Entera Santa Clara de 1 litro es la elección perfecta para una alimentación saludable y equilibrada. Con su sabor delicioso y su textura cremosa, esta leche es ideal para disfrutar sola o para usar en tus recetas | ... Ver más | Ver más | Favoritos | Recomendados | Leche Uht Deslactosada Semidescremad... | 1 LT | Leche Uht Deslactosada Light Baja En... | Leche Uht 100 Sin Lactosa Reducida E... | Leche Uht 100 Sin Lactosa Semidescre... | Leche Uht Entera         Santa Clara... | Leche Uht Deslactosada Semi  Lala  1... | 1.5 LT | Leche Uht Deslactosada   Santa Clara... | Leche Uht Entera Premium   Zaragoza ... | Leche Uht Deslactosada   Lala  1.5 L... | Leche Uht Deslactosada Light     San... | Leche Uht Deslactosada   Zaragoza   ... | Leche Uht Light Baja En Grasa    Lal... | Leche Uht Entera   Lala  1.5 Lt | Leche Uht Ultrapasteurizada   Optima... | 6 LT | Leche Uht Deslactosada   Borden    1... | Leche Uht Entera   Borden    1 Lt | Leche Uht Entera   Alpura    1 Lt | Leche Uht Light   Zaragoza    1 Lt | Leche Uht Deslactosada   Alpura    1... | Leche Uht Light       Santa Clara   ... | Leche Uht Deslactosada Light   Alpur... | Leche Uht Deslactosada Light  Zarago... | Leche Uht Light Baja En Grasa   Lala... | Leche Uht Extra Proteina +70%  Desla... | Leche Uht Selecta  Alpura    1 Lt | Leche Uht Baja En Grasa   Borden    ... | Leche Uht Light   Alpura    1 Lt | Mes patrio Herdez | Adobo    Doña María 235 G | Mole Doña María Almendrado En Pasta ... | Mole Doña María Almendrado Listo Par... | Mole Doña María Poblano Con Cacao En... | Mole Doña Maria Poblano Con Cacao Li... | Mole Doña Mariía Rojo En Pasta   125... | Mole En Pasta 430 Gramos   Doña Mari... | Mole Listo Para Servir  Para Servir ... | Mole Rojo En Pasta  Doña Maria 235 G | Mole Verde En Pasta  Doña Maria 230 ... | Pipián En Pasta  Doña Maria 230 G | Salsa Cacahuate Picante Cremosa   He... | Salsa Casera Con Habanero   Herdez 4... | Salsa Casera  Herdez 210 G | Salsa Guacamole 15% Mas Guacamole He...",,"{""Detalles"": [""La Leche UHT Entera Santa Clara de 1 litro es la elección perfecta para una alimentación saludable y equilibrada. Con su sabor delicioso y su textura cremosa, esta leche es ideal para disfrutar sola o para usar en tus recetas"", ""... Ver más"", ""Ver más"", ""Favoritos"", ""Recomendados"", ""Leche Uht Deslactosada Semidescremad..."", ""1 LT"", ""Leche Uht Deslactosada Light Baja En..."", ""Leche Uht 100 Sin Lactosa Reducida E..."", ""Leche Uht 100 Sin Lactosa Semidescre..."", ""Leche Uht Entera         Santa Clara..."", ""Leche Uht Deslactosada Semi  Lala  1..."", ""1.5 LT"", ""Leche Uht Deslactosada   Santa Clara..."", ""Leche Uht Entera Premium   Zaragoza ..."", ""Leche Uht Deslactosada   Lala  1.5 L..."", ""Leche Uht Deslactosada Light     San..."", ""Leche Uht Deslactosada   Zaragoza   ..."", ""Leche Uht Light Baja En Grasa    Lal..."", ""Leche Uht Entera   Lala  1.5 Lt"", ""Leche Uht Ultrapasteurizada   Optima..."", ""6 LT"", ""Leche Uht Deslactosada   Borden    1..."", ""Leche Uht Entera   Borden    1 Lt"", ""Leche Uht Entera   Alpura    1 Lt"", ""Leche Uht Light   Zaragoza    1 Lt"", ""Leche Uht Deslactosada   Alpura    1..."", ""Leche Uht Light       Santa Clara   ..."", ""Leche Uht Deslactosada Light   Alpur..."", ""Leche Uht Deslactosada Light  Zarago..."", ""Leche Uht Light Baja En Grasa   Lala..."", ""Leche Uht Extra Proteina +70%  Desla..."", ""Leche Uht Selecta  Alpura    1 Lt"", ""Leche Uht Baja En Grasa   Borden    ..."", ""Leche Uht Light   Alpura    1 Lt"", ""Mes patrio Herdez"", ""Adobo    Doña María 235 G"", ""Mole Doña María Almendrado En Pasta ..."", ""Mole Doña María Almendrado Listo Par..."", ""Mole Doña María Poblano Con Cacao En..."", ""Mole Doña Maria Poblano Con Cacao Li..."", ""Mole Doña Mariía Rojo En Pasta   125..."", ""Mole En Pasta 430 Gramos   Doña Mari..."", ""Mole Listo Para Servir  Para Servir ..."", ""Mole Rojo En Pasta  Doña Maria 235 G"", ""Mole Verde En Pasta  Doña Maria 230 ..."", ""Pipián En Pasta  Doña Maria 230 G"", ""Salsa Cacahuate Picante Cremosa   He..."", ""Salsa Casera Con Habanero   Herdez 4..."", ""Salsa Casera  Herdez 210 G"", ""Salsa Guacamole 15% Mas Guacamole He...""]}",dataset/txt_limpios/122.txt,dataset/paginas_descargadas/122.html,EN,leche,keep,0.60,heuristic_default
123,¡Lo mejor te está esperando!,Complementa tus comidas con el delicioso sabor de la Leche Borden Entera. Deleita a tu familia con una leche que se adaptarán a su estilo de vida y alimentación equilibrada. ¡Disfrútala en cualquier momento del día! | Compra | ... Ver más | Favoritos | Recomendados | Leche Uht Deslactosada Semidescremad... | 1 LT | Leche Uht Deslactosada Light Baja En... | Leche Uht 100 Sin Lactosa Reducida E... | Leche Uht 100 Sin Lactosa Semidescre... | Leche Uht Entera         Santa Clara... | Leche Uht Deslactosada Semi  Lala  1... | 1.5 LT | Leche Uht Deslactosada   Santa Clara... | Leche Uht Entera Premium   Zaragoza ... | Leche Uht Deslactosada   Lala  1.5 L... | Leche Uht Deslactosada Light     San... | Leche Uht Deslactosada   Zaragoza   ... | Leche Uht Light Baja En Grasa    Lal... | Leche Uht Entera   Lala  1.5 Lt | Leche Uht Ultrapasteurizada   Optima... | 6 LT | Leche Uht Deslactosada   Borden    1... | Leche Uht Entera   Alpura    1 Lt | Leche Uht Light   Zaragoza    1 Lt | Leche Uht Deslactosada   Alpura    1... | Leche Uht Light       Santa Clara   ... | Leche Uht Deslactosada Light   Alpur... | Leche Uht Deslactosada Light  Zarago... | Leche Uht Light Baja En Grasa   Lala... | Leche Uht Extra Proteina +70%  Desla... | Leche Uht Selecta  Alpura    1 Lt | Leche Uht Baja En Grasa   Borden    ... | Leche Uht Light   Alpura    1 Lt | Mes patrio Herdez | Ver más | Adobo    Doña María 235 G | Mole Doña María Almendrado En Pasta ... | Mole Doña María Almendrado Listo Par... | Mole Doña María Poblano Con Cacao En... | Mole Doña Maria Poblano Con Cacao Li... | Mole Doña Mariía Rojo En Pasta   125... | Mole En Pasta 430 Gramos   Doña Mari... | Mole Listo Para Servir  Para Servir ... | Mole Rojo En Pasta  Doña Maria 235 G | Mole Verde En Pasta  Doña Maria 230 ... | Pipián En Pasta  Doña Maria 230 G | Salsa Cacahuate Picante Cremosa   He... | Salsa Casera Con Habanero   Herdez 4... | Salsa Casera  Herdez 210 G | Salsa Guacamole 15% Mas Guacamole He...,Descarga la app > 1 Lt,30.9,,,Desconocido,unknown,UNKNOWN,¡Lo mejor te está esperando!,Descarga la app,,1 Lt,30.90,,$,$30.90,30.9,False,original,30.9,30.9,1.0,default_1usd,,,,,,Complementa tus comidas con el delicioso sabor de la Leche Borden Entera. Deleita a tu familia con una leche que se adaptarán a su estilo de vida y alimentación equilibrada. ¡Disfrútala en cualquier momento del día! | Compra | ... Ver más | Favoritos | Recomendados | Leche Uht Deslactosada Semidescremad... | 1 LT | Leche Uht Deslactosada Light Baja En... | Leche Uht 100 Sin Lactosa Reducida E... | Leche Uht 100 Sin Lactosa Semidescre... | Leche Uht Entera         Santa Clara... | Leche Uht Deslactosada Semi  Lala  1... | 1.5 LT | Leche Uht Deslactosada   Santa Clara... | Leche Uht Entera Premium   Zaragoza ... | Leche Uht Deslactosada   Lala  1.5 L... | Leche Uht Deslactosada Light     San... | Leche Uht Deslactosada   Zaragoza   ... | Leche Uht Light Baja En Grasa    Lal... | Leche Uht Entera   Lala  1.5 Lt | Leche Uht Ultrapasteurizada   Optima... | 6 LT | Leche Uht Deslactosada   Borden    1... | Leche Uht Entera   Alpura    1 Lt | Leche Uht Light   Zaragoza    1 Lt | Leche Uht Deslactosada   Alpura    1... | Leche Uht Light       Santa Clara   ... | Leche Uht Deslactosada Light   Alpur... | Leche Uht Deslactosada Light  Zarago... | Leche Uht Light Baja En Grasa   Lala... | Leche Uht Extra Proteina +70%  Desla... | Leche Uht Selecta  Alpura    1 Lt | Leche Uht Baja En Grasa   Borden    ... | Leche Uht Light   Alpura    1 Lt | Mes patrio Herdez | Ver más | Adobo    Doña María 235 G | Mole Doña María Almendrado En Pasta ... | Mole Doña María Almendrado Listo Par... | Mole Doña María Poblano Con Cacao En... | Mole Doña Maria Poblano Con Cacao Li... | Mole Doña Mariía Rojo En Pasta   125... | Mole En Pasta 430 Gramos   Doña Mari... | Mole Listo Para Servir  Para Servir ... | Mole Rojo En Pasta  Doña Maria 235 G | Mole Verde En Pasta  Doña Maria 230 ... | Pipián En Pasta  Doña Maria 230 G | Salsa Cacahuate Picante Cremosa   He... | Salsa Casera Con Habanero   Herdez 4... | Salsa Casera  Herdez 210 G | Salsa Guacamole 15% Mas Guacamole He...,,"{""Detalles"": [""Complementa tus comidas con el delicioso sabor de la Leche Borden Entera. Deleita a tu familia con una leche que se adaptarán a su estilo de vida y alimentación equilibrada. ¡Disfrútala en cualquier momento del día!"", ""Compra"", ""... Ver más"", ""Favoritos"", ""Recomendados"", ""Leche Uht Deslactosada Semidescremad..."", ""1 LT"", ""Leche Uht Deslactosada Light Baja En..."", ""Leche Uht 100 Sin Lactosa Reducida E..."", ""Leche Uht 100 Sin Lactosa Semidescre..."", ""Leche Uht Entera         Santa Clara..."", ""Leche Uht Deslactosada Semi  Lala  1..."", ""1.5 LT"", ""Leche Uht Deslactosada   Santa Clara..."", ""Leche Uht Entera Premium   Zaragoza ..."", ""Leche Uht Deslactosada   Lala  1.5 L..."", ""Leche Uht Deslactosada Light     San..."", ""Leche Uht Deslactosada   Zaragoza   ..."", ""Leche Uht Light Baja En Grasa    Lal..."", ""Leche Uht Entera   Lala  1.5 Lt"", ""Leche Uht Ultrapasteurizada   Optima..."", ""6 LT"", ""Leche Uht Deslactosada   Borden    1..."", ""Leche Uht Entera   Alpura    1 Lt"", ""Leche Uht Light   Zaragoza    1 Lt"", ""Leche Uht Deslactosada   Alpura    1..."", ""Leche Uht Light       Santa Clara   ..."", ""Leche Uht Deslactosada Light   Alpur..."", ""Leche Uht Deslactosada Light  Zarago..."", ""Leche Uht Light Baja En Grasa   Lala..."", ""Leche Uht Extra Proteina +70%  Desla..."", ""Leche Uht Selecta  Alpura    1 Lt"", ""Leche Uht Baja En Grasa   Borden    ..."", ""Leche Uht Light   Alpura    1 Lt"", ""Mes patrio Herdez"", ""Ver más"", ""Adobo    Doña María 235 G"", ""Mole Doña María Almendrado En Pasta ..."", ""Mole Doña María Almendrado Listo Par..."", ""Mole Doña María Poblano Con Cacao En..."", ""Mole Doña Maria Poblano Con Cacao Li..."", ""Mole Doña Mariía Rojo En Pasta   125..."", ""Mole En Pasta 430 Gramos   Doña Mari..."", ""Mole Listo Para Servir  Para Servir ..."", ""Mole Rojo En Pasta  Doña Maria 235 G"", ""Mole Verde En Pasta  Doña Maria 230 ..."", ""Pipián En Pasta  Doña Maria 230 G"", ""Salsa Cacahuate Picante Cremosa   He..."", ""Salsa Casera Con Habanero   Herdez 4..."", ""Salsa Casera  Herdez 210 G"", ""Salsa Guacamole 15% Mas Guacamole He...""]}",dataset/txt_limpios/123.txt,dataset/paginas_descargadas/123.html,EN,leche,keep,0.60,heuristic_default
