{"source_id": "551", "title": "Elegí tu envío", "description": "", "breadcrumbs": "Hola, Limpía tú cache > 600 Gr > 7790606000391", "price_raw": "3.49", "currency_raw": "ARS", "url": "", "seller": "Desconocido", "availability": "unknown", "country": "AR", "product_name": "Elegí tu envío", "brand": "Hola, Limpía tú cache", "reference": "7790606000391.0", "unit": "600 Gr", "price_amount": 3.49, "price_currency": "ARS", "price_symbol": "$", "price_text": "$3.49", "price_amount_filled": "3.49", "price_is_imputed": "False", "price_imputation_source": "original", "price_amount_usd": "0.0028", "price_amount_usd_filled": "0.0028", "fx_rate_local_per_usd": "1255.0", "fx_source": "from_argentina_cambio_dolar", "information_text": "", "description_text": "", "features_text": "", "specifications_text": "", "benefits_text": "", "details_text": "", "other_sections": "", "sections": {}, "txt_path": "dataset/txt_limpios/551.txt", "html_path": "dataset/paginas_descargadas/551.html", "es_status": "EN", "category_canonical": "sin_categoria", "decision": "discard", "match_score": 0.3, "reasons": "no_category_detected"}
{"source_id": "553", "title": "Elegí tu envío", "description": "", "breadcrumbs": "Hola, Limpía tú cache", "price_raw": "", "currency_raw": "ARS", "url": "", "seller": "Desconocido", "availability": "unknown", "country": "AR", "product_name": "Elegí tu envío", "brand": "Hola, Limpía tú cache", "reference": "", "unit": "", "price_amount": null, "price_currency": "ARS", "price_symbol": "", "price_text": "", "price_amount_filled": "1663.58", "price_is_imputed": "True", "price_imputation_source": "country_mean", "price_amount_usd": "", "price_amount_usd_filled": "1.3256", "fx_rate_local_per_usd": "1255.0", "fx_source": "from_argentina_cambio_dolar", "information_text": "", "description_text": "", "features_text": "", "specifications_text": "", "benefits_text": "", "details_text": "", "other_sections": "", "sections": {}, "txt_path": "dataset/txt_limpios/553.txt", "html_path": "dataset/paginas_descargadas/553.html", "es_status": "EN", "category_canonical": "sin_categoria", "decision": "discard", "match_score": 0.3, "reasons": "no_category_detected;price_parse_failed"}
{"source_id": "555", "title": "Elegí tu envío", "description": "El Azúcar Plus DIA Común tipo A 1 Kg . Es un producto de alta calidad. Ideal para infectar tus bebidas favoritas y preparar tus postres caseros. Su formato de 1 Kg. te asegura tener suficiente azúcar para todas tus recetas. Disfrutá del dulce sabor que este azúcar aporta a tus creaciones culinarias. ¡No puedes faltar en tu despensa! Ver más Términos más buscados 1. leche 2. cerveza 3. flamin 4. galletitas 5. café", "breadcrumbs": "Hola, Limpía tú cache > 1 Kg > 8480017298515", "price_raw": "990.0", "currency_raw": "ARS", "url": "", "seller": "Desconocido", "availability": "unknown", "country": "AR", "product_name": "Elegí tu envío", "brand": "Hola, Limpía tú cache", "reference": "8480017298515.0", "unit": "1 Kg", "price_amount": 990.0, "price_currency": "ARS", "price_symbol": "$", "price_text": "$990", "price_amount_filled": "990.0", "price_is_imputed": "False", "price_imputation_source": "original", "price_amount_usd": "0.7888", "price_amount_usd_filled": "0.7888", "fx_rate_local_per_usd": "1255.0", "fx_source": "from_argentina_cambio_dolar", "information_text": "", "description_text": "El Azúcar Plus DIA Común tipo A 1 Kg . Es un producto de alta calidad. Ideal para infectar tus bebidas favoritas y preparar tus postres caseros. Su formato de 1 Kg. te asegura tener suficiente azúcar para todas tus recetas. Disfrutá del dulce sabor que este azúcar aporta a tus creaciones culinarias. ¡No puedes faltar en tu despensa! Ver más Términos más buscados 1. leche 2. cerveza 3. flamin 4. galletitas 5. café", "features_text": "", "specifications_text": "", "benefits_text": "", "details_text": "", "other_sections": "", "sections": {"Descripción": ["El Azúcar Plus DIA Común tipo A 1 Kg", ". Es un producto de alta calidad. Ideal para infectar tus bebidas favoritas y preparar tus postres caseros. Su formato de 1 Kg. te asegura tener suficiente azúcar para todas tus recetas. Disfrutá del dulce sabor que este azúcar aporta a tus creaciones culinarias.", "¡No puede faltar en tu despensa!", "Ver más", "Términos más buscados", "1.", "leche", "2.", "cerveza", "3.", "flamin", "4.", "galletitas", "5.", "cafe"]}, "txt_path": "dataset/txt_limpios/555.txt", "html_path": "dataset/paginas_descargadas/555.html", "es_status": "ET", "category_canonical": "cafe", "decision": "keep", "match_score": 0.6, "reasons": "heuristic_default"}
{"source_id": "556", "title": "Elegí tu envío", "description": "", "breadcrumbs": "Hola, Limpía tú cache", "price_raw": "", "currency_raw": "ARS", "url": "", "seller": "Desconocido", "availability": "unknown", "country": "AR", "product_name": "Elegí tu envío", "brand": "Hola, Limpía tú cache", "reference": "", "unit": "", "price_amount": null, "price_currency": "ARS", "price_symbol": "", "price_text": "", "price_amount_filled": "1663.58", "price_is_imputed": "True", "price_imputation_source": "country_mean", "price_amount_usd": "", "price_amount_usd_filled": "1.3256", "fx_rate_local_per_usd": "1255.0", "fx_source": "from_argentina_cambio_dolar", "information_text": "", "description_text": "", "features_text": "", "specifications_text": "", "benefits_text": "", "details_text": "", "other_sections": "", "sections": {}, "txt_path": "dataset/txt_limpios/556.txt", "html_path": "dataset/paginas_descargadas/556.html", "es_status": "EN", "category_canonical": "sin_categoria", "decision": "discard", "match_score": 0.3, "reasons": "no_category_detected;price_parse_failed"}
{"source_id": "557", "title": "Elegí tu envío", "description": "", "breadcrumbs": "Hola, Limpía tú cache", "price_raw": "", "currency_raw": "ARS", "url": "", "seller": "Desconocido", "availability": "unknown", "country": "AR", "product_name": "Elegí tu envío", "brand": "Hola, Limpía tú cache", "reference": "", "unit": "", "price_amount": null, "price_currency": "ARS", "price_symbol": "", "price_text": "", "price_amount_filled": "1663.58", "price_is_imputed": "True", "price_imputation_source": "country_mean", "price_amount_usd": "", "price_amount_usd_filled": "1.3256", "fx_rate_local_per_usd": "1255.0", "fx_source": "from_argentina_cambio_dolar", "information_text": "", "description_text": "", "features_text": "", "specifications_text": "", "benefits_text": "", "details_text": "", "other_sections": "", "sections": {}, "txt_path": "dataset/txt_limpios/557.txt", "html_path": "dataset/paginas_descargadas/557.html", "es_status": "EN", "category_canonical": "sin_categoria", "decision": "discard", "match_score": 0.3, "reasons": "no_category_detected;price_parse_failed"}
{"source_id": "558", "title": "Elegí tu envío", "description": "", "breadcrumbs": "Hola, Limpía tú cache > 500 Gr > 7798174970269", "price_raw": "590.0", "currency_raw": "ARS", "url": "", "seller": "Desconocido", "availability": "unknown", "country": "AR", "product_name": "Elegí tu envío", "brand": "Hola, Limpía tú cache", "reference": "7798174970269.0", "unit": "500 Gr", "price_amount": 590.0, "price_currency": "ARS", "price_symbol": "$", "price_text": "$590", "price_amount_filled": "590.0", "price_is_imputed": "False", "price_imputation_source": "original", "price_amount_usd": "0.4701", "price_amount_usd_filled": "0.4701", "fx_rate_local_per_usd": "1255.0", "fx_source": "from_argentina_cambio_dolar", "information_text": "", "description_text": "", "features_text": "", "specifications_text": "", "benefits_text": "", "details_text": "", "other_sections": "", "sections": {}, "txt_path": "dataset/txt_limpios/558.txt", "html_path": "dataset/paginas_descargadas/558.html", "es_status": "EN", "category_canonical": "sin_categoria", "decision": "discard", "match_score": 0.3, "reasons": "no_category_detected"}
{"source_id": "559", "title": "Elegí tu envío", "description": "", "breadcrumbs": "Hola, Limpía tú cache > 500 Gr > 7790070336385", "price_raw": "1.5", "currency_raw": "ARS", "url": "", "seller": "Desconocido", "availability": "unknown", "country": "AR", "product_name": "Elegí tu envío", "brand": "Hola, Limpía tú cache", "reference": "7790070336385.0", "unit": "500 Gr", "price_amount": 1.5, "price_currency": "ARS", "price_symbol": "$", "price_text": "$1.50", "price_amount_filled": "1.5", "price_is_imputed": "False", "price_imputation_source": "original", "price_amount_usd": "0.0012", "price_amount_usd_filled": "0.0012", "fx_rate_local_per_usd": "1255.0", "fx_source": "from_argentina_cambio_dolar", "information_text": "", "description_text": "", "features_text": "", "specifications_text": "", "benefits_text": "", "details_text": "", "other_sections": "", "sections": {}, "txt_path": "dataset/txt_limpios/559.txt", "html_path": "dataset/paginas_descargadas/559.html", "es_status": "EN", "category_canonical": "sin_categoria", "decision": "discard", "match_score": 0.3, "reasons": "no_category_detected"}
{"source_id": "560", "title": "Elegí tu envío", "description": "", "breadcrumbs": "Hola, Limpía tú cache > 500 Gr > 7790070336309", "price_raw": "1.75", "currency_raw": "ARS", "url": "", "seller": "Desconocido", "availability": "unknown", "country": "AR", "product_name": "Elegí tu envío", "brand": "Hola, Limpía tú cache", "reference": "7790070336309.0", "unit": "500 Gr", "price_amount": 1.75, "price_currency": "ARS", "price_symbol": "$", "price_text": "$1.75", "price_amount_filled": "1.75", "price_is_imputed": "False", "price_imputation_source": "original", "price_amount_usd": "0.0014", "price_amount_usd_filled": "0.0014", "fx_rate_local_per_usd": "1255.0", "fx_source": "from_argentina_cambio_dolar", "information_text": "", "description_text": "", "features_text": "", "specifications_text": "", "benefits_text": "", "details_text": "", "other_sections": "", "sections": {}, "txt_path": "dataset/txt_limpios/560.txt", "html_path": "dataset/paginas_descargadas/560.html", "es_status": "EN", "category_canonical": "sin_categoria", "decision": "discard", "match_score": 0.3, "reasons": "no_category_detected"}
{"source_id": "561", "title": "Elegí tu envío", "description": "", "breadcrumbs": "Hola, Limpía tú cache > 500 Gr > 8480017268693", "price_raw": "1.18", "currency_raw": "ARS", "url": "", "seller": "Desconocido", "availability": "unknown", "country": "AR", "product_name": "Elegí tu envío", "brand": "Hola, Limpía tú cache", "reference": "8480017268693.0", "unit": "500 Gr", "price_amount": 1.18, "price_currency": "ARS", "price_symbol": "$", "price_text": "$1.18", "price_amount_filled": "1.18", "price_is_imputed": "False", "price_imputation_source": "original", "price_amount_usd": "0.0009", "price_amount_usd_filled": "0.0009", "fx_rate_local_per_usd": "1255.0", "fx_source": "from_argentina_cambio_dolar", "information_text": "", "description_text": "", "features_text": "", "specifications_text": "", "benefits_text": "", "details_text": "", "other_sections": "", "sections": {}, "txt_path": "dataset/txt_limpios/561.txt", "html_path": "dataset/paginas_descargadas/561.html", "es_status": "EN", "category_canonical": "sin_categoria", "decision": "discard", "match_score": 0.3, "reasons": "no_category_detected"}
{"source_id": "562", "title": "Elegí tu envío", "description": "", "breadcrumbs": "Hola, Limpía tú cache > 500 Gr > 7790070336576", "price_raw": "3.19", "currency_raw": "ARS", "url": "", "seller": "Desconocido", "availability": "unknown", "country": "AR", "product_name": "Elegí tu envío", "brand": "Hola, Limpía tú cache", "reference": "7790070336576.0", "unit": "500 Gr", "price_amount": 3.19, "price_currency": "ARS", "price_symbol": "$", "price_text": "$3.19", "price_amount_filled": "3.19", "price_is_imputed": "False", "price_imputation_source": "original", "price_amount_usd": "0.0025", "price_amount_usd_filled": "0.0025", "fx_rate_local_per_usd": "1255.0", "fx_source": "from_argentina_cambio_dolar", "information_text": "", "description_text": "", "features_text": "", "specifications_text": "", "benefits_text": "", "details_text": "", "other_sections": "", "sections": {}, "txt_path": "dataset/txt_limpios/562.txt", "html_path": "dataset/paginas_descargadas/562.html", "es_status": "EN", "category_canonical": "sin_categoria", "decision": "discard", "match_score": 0.3, "reasons": "no_category_detected"}
{"source_id": "564", "title": "Elegí tu envío", "description": "", "breadcrumbs": "Hola, Limpía tú cache > 800 Gr > 7798016102216", "price_raw": "3.0", "currency_raw": "ARS", "url": "", "seller": "Desconocido", "availability": "unknown", "country": "AR", "product_name": "Elegí tu envío", "brand": "Hola, Limpía tú cache", "reference": "7798016102216.0", "unit": "800 Gr", "price_amount": 3.0, "price_currency": "ARS", "price_symbol": "", "price_text": "3", "price_amount_filled": "3.0", "price_is_imputed": "False", "price_imputation_source": "original", "price_amount_usd": "0.0024", "price_amount_usd_filled": "0.0024", "fx_rate_local_per_usd": "1255.0", "fx_source": "from_argentina_cambio_dolar", "information_text": "", "description_text": "", "features_text": "", "specifications_text": "", "benefits_text": "", "details_text": "", "other_sections": "", "sections": {}, "txt_path": "dataset/txt_limpios/564.txt", "html_path": "dataset/paginas_descargadas/564.html", "es_status": "EN", "category_canonical": "sin_categoria", "decision": "discard", "match_score": 0.3, "reasons": "no_category_detected"}
{"source_id": "565", "title": "Elegí tu envío", "description": "", "breadcrumbs": "Hola, Limpía tú cache > 1 Kg > 2490150000000", "price_raw": "2.79", "currency_raw": "ARS", "url": "", "seller": "Desconocido", "availability": "unknown", "country": "AR", "product_name": "Elegí tu envío", "brand": "Hola, Limpía tú cache", "reference": "2490150000000.0", "unit": "1 Kg", "price_amount": 2.79, "price_currency": "ARS", "price_symbol": "$", "price_text": "$2.79", "price_amount_filled": "2.79", "price_is_imputed": "False", "price_imputation_source": "original", "price_amount_usd": "0.0022", "price_amount_usd_filled": "0.0022", "fx_rate_local_per_usd": "1255.0", "fx_source": "from_argentina_cambio_dolar", "information_text": "", "description_text": "", "features_text": "", "specifications_text": "", "benefits_text": "", "details_text": "", "other_sections": "", "sections": {}, "txt_path": "dataset/txt_limpios/565.txt", "html_path": "dataset/paginas_descargadas/565.html", "es_status": "EN", "category_canonical": "sin_categoria", "decision": "discard", "match_score": 0.3, "reasons": "no_category_detected"}
{"source_id": "566", "title": "Elegí tu envío", "description": "", "breadcrumbs": "Hola, Limpía tú cache > 7798064180143", "price_raw": "4.19", "currency_raw": "ARS", "url": "", "seller": "Desconocido", "availability": "unknown", "country": "AR", "product_name": "Elegí tu envío", "brand": "Hola, Limpía tú cache", "reference": "7798064180143.0", "unit": "", "price_amount": 4.19, "price_currency": "ARS", "price_symbol": "$", "price_text": "$4.19", "price_amount_filled": "4.19", "price_is_imputed": "False", "price_imputation_source": "original", "price_amount_usd": "0.0033", "price_amount_usd_filled": "0.0033", "fx_rate_local_per_usd": "1255.0", "fx_source": "from_argentina_cambio_dolar", "information_text": "", "description_text": "", "features_text": "", "specifications_text": "", "benefits_text": "", "details_text": "", "other_sections": "", "sections": {}, "txt_path": "dataset/txt_limpios/566.txt", "html_path": "dataset/paginas_descargadas/566.html", "es_status": "EN", "category_canonical": "sin_categoria", "decision": "discard", "match_score": 0.3, "reasons": "no_category_detected"}
{"source_id": "568", "title": "Elegí tu envío", "description": "", "breadcrumbs": "Hola, Limpía tú cache > 1 Kg > 2406887000009", "price_raw": "11.9", "currency_raw": "ARS", "url": "", "seller": "Desconocido", "availability": "unknown", "country": "AR", "product_name": "Elegí tu envío", "brand": "Hola, Limpía tú cache", "reference": "2406887000009.0", "unit": "1 Kg", "price_amount": 11.9, "price_currency": "ARS", "price_symbol": "$", "price_text": "$11.90", "price_amount_filled": "11.9", "price_is_imputed": "False", "price_imputation_source": "original", "price_amount_usd": "0.0095", "price_amount_usd_filled": "0.0095", "fx_rate_local_per_usd": "1255.0", "fx_source": "from_argentina_cambio_dolar", "information_text": "", "description_text": "", "features_text": "", "specifications_text": "", "benefits_text": "", "details_text": "", "other_sections": "", "sections": {}, "txt_path": "dataset/txt_limpios/568.txt", "html_path": "dataset/paginas_descargadas/568.html", "es_status": "EN", "category_canonical": "sin_categoria", "decision": "discard", "match_score": 0.3, "reasons": "no_category_detected"}
{"source_id": "569", "title": "Elegí tu envío", "description": "", "breadcrumbs": "Hola, Limpía tú cache > 400 Gr > 7790616000442", "price_raw": "400.0", "currency_raw": "ARS", "url": "", "seller": "Desconocido", "availability": "unknown", "country": "AR", "product_name": "Elegí tu envío", "brand": "Hola, Limpía tú cache", "reference": "7790616000442.0", "unit": "400 Gr", "price_amount": 400.0, "price_currency": "ARS", "price_symbol": "", "price_text": "400", "price_amount_filled": "400.0", "price_is_imputed": "False", "price_imputation_source": "original", "price_amount_usd": "0.3187", "price_amount_usd_filled": "0.3187", "fx_rate_local_per_usd": "1255.0", "fx_source": "from_argentina_cambio_dolar", "information_text": "", "description_text": "", "features_text": "", "specifications_text": "", "benefits_text": "", "details_text": "", "other_sections": "", "sections": {}, "txt_path": "dataset/txt_limpios/569.txt", "html_path": "dataset/paginas_descargadas/569.html", "es_status": "EN", "category_canonical": "sin_categoria", "decision": "discard", "match_score": 0.3, "reasons": "no_category_detected"}
{"source_id": "571", "title": "Elegí tu envío", "description": "El queso muzarella DIA de 250 gr es un producto de alta calidad que se destaca por su sabor suave y cremoso. Este queso es muy fácil de cortar y derretir, por lo que es una excelente opción para aquellos que buscan una opción práctica y deliciosa. Además, está elaborado con ingredientes naturales y frescos, por lo que es una alternativa saludable para toda la familia. Ver más Términos más buscados 1. leche 2. cerveza 3. flamin 4. galletitas 5. café", "breadcrumbs": "Hola, Limpía tú cache > 250 Gr > 8480017240941", "price_raw": "250.0", "currency_raw": "ARS", "url": "", "seller": "Desconocido", "availability": "unknown", "country": "AR", "product_name": "Elegí tu envío", "brand": "Hola, Limpía tú cache", "reference": "8480017240941.0", "unit": "250 Gr", "price_amount": 250.0, "price_currency": "ARS", "price_symbol": "", "price_text": "250", "price_amount_filled": "250.0", "price_is_imputed": "False", "price_imputation_source": "original", "price_amount_usd": "0.1992", "price_amount_usd_filled": "0.1992", "fx_rate_local_per_usd": "1255.0", "fx_source": "from_argentina_cambio_dolar", "information_text": "", "description_text": "El queso muzarella DIA de 250 gr es un producto de alta calidad que se destaca por su sabor suave y cremoso. Este queso es muy fácil de cortar y derretir, por lo que es una excelente opción para aquellos que buscan una opción práctica y deliciosa. Además, está elaborado con ingredientes naturales y frescos, por lo que es una alternativa saludable para toda la familia. Ver más Términos más buscados 1. leche 2. cerveza 3. flamin 4. galletitas 5. café", "features_text": "", "specifications_text": "", "benefits_text": "", "details_text": "", "other_sections": "", "sections": {"Descripción": ["El queso muzarella DIA de 250 gr es un producto de alta calidad que se destaca por su sabor suave y cremoso. Este queso es muy fácil de cortar y derretir, por lo que es una excelente opción para aquellos que buscan una opción práctica y deliciosa. Además, está elaborado con ingredientes naturales y frescos, por lo que es una alternativa saludable para toda la familia.", "Ver más", "Términos más buscados", "1.", "leche", "2.", "cerveza", "3.", "flamin", "4.", "galletitas", "5.", "cafe"]}, "txt_path": "dataset/txt_limpios/571.txt", "html_path": "dataset/paginas_descargadas/571.html", "es_status": "ET", "category_canonical": "cafe", "decision": "keep", "match_score": 0.6, "reasons": "heuristic_default"}
{"source_id": "572", "title": "Elegí tu envío", "description": "", "breadcrumbs": "Hola, Limpía tú cache > 2.25 Lt > 7790895000997", "price_raw": "4.6", "currency_raw": "ARS", "url": "", "seller": "Desconocido", "availability": "unknown", "country": "AR", "product_name": "Elegí tu envío", "brand": "Hola, Limpía tú cache", "reference": "7790895000997.0", "unit": "2.25 Lt", "price_amount": 4.6, "price_currency": "ARS", "price_symbol": "$", "price_text": "$4.60", "price_amount_filled": "4.6", "price_is_imputed": "False", "price_imputation_source": "original", "price_amount_usd": "0.0037", "price_amount_usd_filled": "0.0037", "fx_rate_local_per_usd": "1255.0", "fx_source": "from_argentina_cambio_dolar", "information_text": "", "description_text": "", "features_text": "", "specifications_text": "", "benefits_text": "", "details_text": "", "other_sections": "", "sections": {}, "txt_path": "dataset/txt_limpios/572.txt", "html_path": "dataset/paginas_descargadas/572.html", "es_status": "EN", "category_canonical": "sin_categoria", "decision": "discard", "match_score": 0.3, "reasons": "no_category_detected"}
