source_id,title,description,breadcrumbs,price_raw,currency_raw,url,seller,availability,country,product_name,brand,reference,unit,price_amount,price_currency,price_symbol,price_text,price_amount_filled,price_is_imputed,price_imputation_source,price_amount_usd,price_amount_usd_filled,fx_rate_local_per_usd,fx_source,information_text,description_text,features_text,specifications_text,benefits_text,details_text,other_sections,sections,txt_path,html_path,es_status,category_canonical,decision,match_score,reasons
1208,Seja Bem Vindo à Plaza Vea,Información de la marca,Desayunos > 500g,30.0,PEN,,Desconocido,unknown,PE,Seja Bem Vindo à Plaza Vea,Desayunos,,500g,30.00,PEN,S/,S/30,30.0,False,original,8.4507,8.4507,3.55,from_peru_cambio_dolar,,Información de la marca,Revisa todo | Componentes del Producto | Vendido por | plazaVea | En caso algo no vaya como gustes: Puedes revisar nuestras | Politicas de cambios y/o devoluciones | y hacerlas efectivas en todas nuestras tiendas. | Productos | que te pueden interesar | similares | Café Tostado Molido ALTOMAYO Gourmet Bolsa 450g | .00 | un | 3 | productos agregados | Agrega indicaciones | Guardar | Café Soluble Granulado Aro 200G | Café Tostado Mólido ARO Paquete 500g | Café Gourmet Americano CAFETAL Bolsa 450g | Café Tostado Molido M&K 200g | COFFEE DELIGHT | Café Molido CAFETAL Bolsa 80g Paquete 6un | Café KIRMA Sobre 15g Tira 10un | Recomendado para ti,,,,,"{""Descripción"": [""Información de la marca""], ""Características"": [""Revisa todo"", ""Componentes del Producto"", ""Vendido por"", ""plazaVea"", ""En caso algo no vaya como gustes: Puedes revisar nuestras"", ""Politicas de cambios y/o devoluciones"", ""y hacerlas efectivas en todas nuestras tiendas."", ""Productos"", ""que te pueden interesar"", ""similares"", ""Café Tostado Molido ALTOMAYO Gourmet Bolsa 450g"", "".00"", ""un"", ""3"", ""productos agregados"", ""Agrega indicaciones"", ""Guardar"", ""Café Soluble Granulado Aro 200G"", ""Café Tostado Mólido ARO Paquete 500g"", ""Café Gourmet Americano CAFETAL Bolsa 450g"", ""Café Tostado Molido M&K 200g"", ""COFFEE DELIGHT"", ""Café Molido CAFETAL Bolsa 80g Paquete 6un"", ""Café KIRMA Sobre 15g Tira 10un"", ""Recomendado para ti""]}",dataset/txt_limpios/1208.txt,dataset/paginas_descargadas/1208.html,EN,sin_categoria,discard,0.30,no_category_detected
1209,Seja Bem Vindo à Plaza Vea,Información de la marca,Desayunos > 150g,22.0,PEN,,Desconocido,unknown,PE,Seja Bem Vindo à Plaza Vea,Desayunos,,150g,22.00,PEN,S/,S/22,22.0,False,original,6.1972,6.1972,3.55,from_peru_cambio_dolar,,Información de la marca,"Presentación/Empaque | Doypack | Café Puro | Sí | Libre De Cafeína | No | Orgánico | Azúcares Por Porción | 0.78 g / 100 g | Calorías Por Porción | 347.00 kcal / 100 g | Carbohidratos Por Porción | 65.10 g / 100 g | Descripción Nutricional | 0.20 g, Grasas Saturadas: 0.10 g, Sodio: 19.00 mg. | Grasas Por Porción | 0.20 g / 100 g | Proteínas Por Porción | 5.55 g / 100 g | Sodio Por Porción | 19.00 mg / 100 g | Advertencias De Almacenamiento | ALMACENAR EN UN LUGAR FRESCO, SECO Y LIBRE DE OLORES EXTRAÑOS | Revisa todo | Componentes del Producto | Vendido por | plazaVea | En caso algo no vaya como gustes: Puedes revisar nuestras | Politicas de cambios y/o devoluciones | y hacerlas efectivas en todas nuestras tiendas. | Productos | que te pueden interesar | similares | Multiplicador-de-unidad: MAKRO-Bi-Precio|Vigente Oculto | Recicla Consciente | Café Instantáneo KIRMA Lata 190g | .00 | un | 3 | productos agregados | Agrega indicaciones | Guardar | Café Liofilizado Clásico JUAN VALDÉZ Frasco 150g | JUAN VALDEZ | Café Instantáneo ALTOMAYO Descafeinado Frasco 170g | Café Instantáneo NESCAFÉ Tradición Frasco 170g | Café Instantáneo ALTOMAYO Gourmet Tira 10un | Multiplicador-de-unidad: Express | Café Instantáneo NESCAFÉ Tradición Doypack 45g | Café Instantáneo KIRMA Tira 7g | Café Instantáneo NESCAFÉ Tradición Paquete 10un | Recomendado para ti",,,,,"{""Descripción"": [""Información de la marca""], ""Características"": [""Presentación/Empaque"", ""Doypack"", ""Café Puro"", ""Sí"", ""Libre De Cafeína"", ""No"", ""Orgánico"", ""Azúcar por porción"", ""0.78 g / 100 g"", ""Calorías Porción"", ""347.00 kcal / 100 g"", ""Carbohidratos Porción"", ""65.10 g / 100 g"", ""Descripción Nutricional"", ""0.20 g, Grasas Saturadas: 0.10 g, Sodio: 19.00 mg."", ""Grasas Porción"", ""0.20 g / 100 g"", ""Proteínas Porción"", ""5.55 g / 100 g"", ""Sodio Porción"", ""19.00 mg / 100 g"", ""Advertencias De Almacenamiento"", ""ALMACENAR EN UN LUGAR FRESCO, SECO Y LIBRE DE OLORES EXTRAÑOS"", ""Revisa todo"", ""Componentes del Producto"", ""Vendido por"", ""plazaVea"", ""En caso algo no vaya como gustes: Puedes revisar nuestras"", ""Politicas de cambios y/o devoluciones"", ""y hacerlas efectivas en todas nuestras tiendas."", ""Productos"", ""que te pueden interesar"", ""similares"", ""Multiplicador-de-unidad: MAKRO-Bi-Precio|Vigente Oculto"", ""Recicla Consciente"", ""Café Instantáneo KIRMA Lata 190g"", "".00"", ""un"", ""3"", ""productos agregados"", ""Agrega indicaciones"", ""Guardar"", ""Café Liofilizado Clásico JUAN VALDÉZ Frasco 150g"", ""JUAN VALDEZ"", ""Café Instantáneo ALTOMAYO Descafeinado Frasco 170g"", ""Café Instantáneo NESCAFÉ Tradición Frasco 170g"", ""Café Instantáneo ALTOMAYO Gourmet Tira 10un"", ""Multiplicador-de-unidad: Express"", ""Café Instantáneo NESCAFÉ Tradición Doypack 45g"", ""Café Instantáneo KIRMA Tira 7g"", ""Café Instantáneo NESCAFÉ Tradición Paquete 10un"", ""Recomendado para ti""]}",dataset/txt_limpios/1209.txt,dataset/paginas_descargadas/1209.html,ET,sin_categoria,discard,0.30,no_category_detected
1211,Seja Bem Vindo à Plaza Vea,Información de la marca,Desayunos > 150g,26.0,PEN,,Desconocido,unknown,PE,Seja Bem Vindo à Plaza Vea,Desayunos,,150g,26.00,PEN,S/,S/26,26.0,False,original,7.3239,7.3239,3.55,from_peru_cambio_dolar,,Información de la marca,Revisa todo | Componentes del Producto | Vendido por | plazaVea | En caso algo no vaya como gustes: Puedes revisar nuestras | Politicas de cambios y/o devoluciones | y hacerlas efectivas en todas nuestras tiendas. | Productos | que te pueden interesar | similares | Multiplicador-de-unidad: MAKRO-Bi-Precio|Vigente Oculto | Recicla Consciente | .00 | un | 3 | productos agregados | Agrega indicaciones | Guardar | Café Instántaneo Intenso CAFETAL Frasco 180g | Café NESCAFE Descafeinado Frasco 170g | Café NESCAFÉ Gold Frasco 100g | Café Instantáneo NESCAFÉ Tradición 7g Paquete 18un | Juego de Dormitorio Forli Bio Advance Queen Gatteo | Café Instantáneo NESCAFÉ Tradición Frasco 100g | Recomendado para ti,,,,,"{""Descripción"": [""Información de la marca""], ""Características"": [""Revisa todo"", ""Componentes del Producto"", ""Vendido por"", ""plazaVea"", ""En caso algo no vaya como gustes: Puedes revisar nuestras"", ""Politicas de cambios y/o devoluciones"", ""y hacerlas efectivas en todas nuestras tiendas."", ""Productos"", ""que te pueden interesar"", ""similares"", ""Multiplicador-de-unidad: MAKRO-Bi-Precio|Vigente Oculto"", ""Recicla Consciente"", "".00"", ""un"", ""3"", ""productos agregados"", ""Agrega indicaciones"", ""Guardar"", ""Café Instántaneo Intenso CAFETAL Vial 180g"", ""Café NESCAFE Descafeinado Frasco 170g"", ""Café NESCAFÉ Gold Frasco 100g"", ""Café Instantáneo NESCAFÉ Tradición 7g Paquete 18un"", ""Juego de Dormitorio Forli Bio Advance Queen Gatteo"", ""Café Instantáneo NESCAFÉ Tradición Frasco 100g"", ""Recomendado para ti""]}",dataset/txt_limpios/1211.txt,dataset/paginas_descargadas/1211.html,ET,sin_categoria,discard,0.30,no_category_detected
1212,Seja Bem Vindo à Plaza Vea,Información de la marca,Desayunos > 500g,58.0,PEN,,Desconocido,unknown,PE,Seja Bem Vindo à Plaza Vea,Desayunos,,500g,58.00,PEN,S/,S/58,58.0,False,original,16.338,16.338,3.55,from_peru_cambio_dolar,,Información de la marca,"Importante destacar | Presentación : Lata | Descripción del producto | La alimentación juega un papel muy importante en nuestros vidas. Es por ello que debemos tener una equilibrada incorporación de nutrientes a nuestro organismo, para el desarrollo de la vida y de las distintas actividades cotidianas. Por ello | plazaVea | pone a tu disposición una amplia variedad de | Abarrotes | para que puedas elegir el que más se adecua a tus necesidades. | El Desayuno es el primer alimento del día. Esta primera comida nos aportará en buen porcentaje de energía para iniciar con fuerza nuestras actividades diarias. Por ello | te ofrece una gran variedad de productos para que puedar preparar | deliciosos. | Si eres un amante del café y no pued faltar en tus mañanas. Puedes preparte algo rápido y sencillo . Una taza con | Café | y una crocantes | Tostadas | con | Mermelada. | Otro opción para tu desayuno son los | Cereales | los cuales puedes combinarlos con | Leche | o | Yogurt | ¡Realiza tus combinaciones y descrubre un mundo de posibilidades! | ¡Conoce los distintos productos para preparar | deliciosos en plazaVea Online! | *La imagen sólo es referencial | "" NESCAFÉ debe su nombre a las tres primeras letras en Nestlé y su sufijo con ""café"". Esta marca ofrece una amplia de cafés para deleitar a los amantes de esta bebida. | ¿No es lo que buscas? Encuentra más productos para tus | en plazaVea | Revisa todo | Componentes del Producto | Vendido por | En caso algo no vaya como gustes: Puedes revisar nuestras | Politicas de cambios y/o devoluciones | y hacerlas efectivas en todas nuestras tiendas. | Productos | que te pueden interesar | similares | Multiplicador-de-unidad: MAKRO-Bi-Precio|Vigente Oculto | Café Instántaneo Gourmet ALTOMAYO Doypack 150g | ALTOMAYO | .00 | un | 3 | productos agregados | Agrega indicaciones | Guardar | Multiplicador-de-unidad: Express | Café NESCAFÉ Gold Signature Frasco 190g | Café NESCAFÉ Gold Frasco 100g | Café Instantáneo ALTOMAYO Gourmet Tira 10un | Café Instantáneo NESCAFÉ Tradición Doypack 50g | Café Instantáneo Intenso CAFETAL Doypack 90g | CAFETAL | Café Instantáneo NESCAFÉ Tradición Frasco 50g | Café Instantáneo NESCAFÉ Tradición Frasco 100g | Recomendado para ti",,,,,"{""Descripción"": [""Información de la marca""], ""Características"": [""Importante destacar"", ""Presentación : Lata"", ""Descripción del producto"", ""La alimentación juega un papel muy importante en nuestros vidas. Es por ello que debemos tener una equilibrada incorporación de nutrientes a nuestro organismo, para el desarrollo de la vida y de las distintas actividades cotidianas. Por ello"", ""plazaVea"", ""pone a tu disposición una amplia variedad de"", ""Abarrotes"", ""para que puedas elegir qué más se adecua a tus necesidades."", ""El desayuno es el primer alimento del día. Esta primera comida nos aportará en buen porcentaje de energía para iniciar con fuerza nuestras actividades diarias. Por ello"", ""te ofrece una gran variedad de productos para que puedar preparar"", ""deliciosos."", ""Si eres un amante del café y no pued faltar en tus mañanas. Puedes preparte algo rápido y sencillo . Una taza con"", ""Café"", ""y una crocantes"", ""Tostadas"", ""con"", ""Mermelada."", ""Otra opción para tu desayuno son los"", ""Cereales"", ""los cuales puedes combinarlos con"", ""Leche"", ""o"", ""Yogurt"", ""¡Realiza tus combinaciones y descrubre un mundo de posibilidades!"", ""¡Conoce los distintos productos para preparar"", ""deliciosos en plazaVea Online!"", ""*La imagen solo es referencial"", ""\"" NESCAFÉ debe su nombre a las tres primeras letras en Nestlé y su sufijo con \""café\"". Esta marca ofrece una amplia de cafés para deleitar a los amantes de esta bebida."", ""¿En qué búsqueda? Encuentra más productos para tus"", ""en plazaVea"", ""Revisa todo"", ""Componentes del Producto"", ""Vendido por"", ""En caso algo no vaya como gustes: Puedes revisar nuestras"", ""Politicas de cambios y/o devoluciones"", ""y hacerlas efectivas en todas nuestras tiendas."", ""Productos"", ""que te pueden interesar"", ""similares"", ""Multiplicador-de-unidad: MAKRO-Bi-Precio|Vigente Oculto"", ""Café Instántaneo Gourmet ALTOMAYO Doypack 150g"", ""ALTOMAYO"", "".00"", ""un"", ""3"", ""productos agregados"", ""Agrega indicaciones"", ""Guardar"", ""Multiplicador-de-unidad: Express"", ""Café NESCAFÉ Gold Signature Frasco 190g"", ""Café NESCAFÉ Gold Frasco 100g"", ""Café Instantáneo ALTOMAYO Gourmet Tira 10un"", ""Café Instantáneo NESCAFÉ Tradición Doypack 50g"", ""Café Instantáneo Intenso CAFETAL Doypack 90g"", ""CAFETAL"", ""Café Instantáneo NESCAFÉ Tradición Frasco 50g"", ""Café Instantáneo NESCAFÉ Tradición Frasco 100g"", ""Recomendado para ti""]}",dataset/txt_limpios/1212.txt,dataset/paginas_descargadas/1212.html,ET,sin_categoria,discard,0.30,no_category_detected
1213,Seja Bem Vindo à Plaza Vea,Información de la marca,Abarrotes > 3L,20.0,PEN,,Desconocido,unknown,PE,Seja Bem Vindo à Plaza Vea,Abarrotes,,3L,20.00,PEN,S/,S/20,20.0,False,original,5.6338,5.6338,3.55,from_peru_cambio_dolar,,Información de la marca,"Presentación/Empaque | Bidón | Porción Sugerida | 13 ml | Alérgenos Declarados | NA | Azúcares Por Porción | 0 g | Calorías Por Porción | 108 kcal | Carbohidratos Por Porción | Descripción Nutricional | Aceite Vegetal de Soya | Grasas Por Porción | 12 g | Proteínas Por Porción | Sodio Por Porción | Composición/Origen | Aceite de Soya | Grado | % De Acidez | máx 0,1 | Advertencias De Almacenamiento | Almacenar en lugar limpio, fresco y seco. Lejos de olores fuertes y la luz del sol. | Contenido Neto | 3L | Denominación/Variedad | Advertencias de consumo | Revisa todo | Componentes del Producto | Vendido por | plazaVea | En caso algo no vaya como gustes: Puedes revisar nuestras | Politicas de cambios y/o devoluciones | y hacerlas efectivas en todas nuestras tiendas. | Productos | que te pueden interesar | similares | Multiplicador-de-unidad: MAKRO-Bi-Precio|Vigente Oculto | .00 | un | 3 | productos agregados | Agrega indicaciones | Guardar | Aceite Vegetal LA PATRONA Botella 900ml | LA PATRONA | Aceite Vegetal BELTRAN Galonera 2L | BELTRAN | Aceite de Soya Vegetal BELTRAN Galonera 3L | Aceite Vegetal LA PATRONA Botella 500ml | Recomendado para ti",,,,,"{""Descripción"": [""Información de la marca""], ""Características"": [""Presentación/Empaque"", ""Bidón"", ""Porción sugerida"", ""13 ml"", ""Alérgenos Declarados"", ""NA"", ""Azúcar por porción"", ""0 g"", ""Calorías Porción"", ""108 kcal"", ""Carbohidratos Porción"", ""Descripción Nutricional"", ""Aceite Vegetal de Soya"", ""Grasas Porción"", ""12 g"", ""Proteínas Porción"", ""Sodio Porción"", ""Composición/Origen"", ""Aceite de Soya"", ""Grado"", ""% De Acidez"", ""máx 0,1"", ""Advertencias De Almacenamiento"", ""Almacenar en lugar limpio, fresco y seco. Lejos de olores fuertes y la luz del sol."", ""Contenido Neto"", ""3L"", ""Denominación/Variedad"", ""Advertencias de consumo"", ""Revisa todo"", ""Componentes del Producto"", ""Vendido por"", ""plazaVea"", ""En caso algo no vaya como gustes: Puedes revisar nuestras"", ""Politicas de cambios y/o devoluciones"", ""y hacerlas efectivas en todas nuestras tiendas."", ""Productos"", ""que te pueden interesar"", ""similares"", ""Multiplicador-de-unidad: MAKRO-Bi-Precio|Vigente Oculto"", "".00"", ""un"", ""3"", ""productos agregados"", ""Agrega indicaciones"", ""Guardar"", ""Aceite Vegetal LA PATRONA Botella 900ml"", ""LA PATRONA"", ""Aceite Vegetal BELTRAN Galonera 2L"", ""BELTRAN"", ""Aceite de Soya Vegetal BELTRAN Galonera 3L"", ""Aceite Vegetal LA PATRONA Botella 500ml"", ""Recomendado para ti""]}",dataset/txt_limpios/1213.txt,dataset/paginas_descargadas/1213.html,ET,sin_categoria,discard,0.30,no_category_detected
1214,Seja Bem Vindo à Plaza Vea,Información de la marca,Abarrotes > 900ml,6.0,PEN,,Desconocido,unknown,PE,Seja Bem Vindo à Plaza Vea,Abarrotes,,900ml,6.00,PEN,S/,S/6,6.0,False,original,1.6901,1.6901,3.55,from_peru_cambio_dolar,,Información de la marca,Presentación/Empaque | Botella | Porción Sugerida | 1 cucharada (14 g) | Alérgenos Declarados | Contiene soya | Azúcares Por Porción | 0 | Calorías Por Porción | 130 | Carbohidratos Por Porción | Grasas Por Porción | 14 | Proteínas Por Porción | Sodio Por Porción | Composición/Origen | Perú | % De Acidez | 0.25 | Advertencias De Almacenamiento | Proteger de la luz solar y aromas agresivos | Contenido Neto | 900 ml | Denominación/Variedad | Aceite de soya | Advertencias de consumo | NA | Revisa todo | Componentes del Producto | Vendido por | plazaVea | En caso algo no vaya como gustes: Puedes revisar nuestras | Politicas de cambios y/o devoluciones | y hacerlas efectivas en todas nuestras tiendas. | Productos | que te pueden interesar | similares | Multiplicador-de-unidad: MAKRO-Bi-Precio|Vigente Oculto | un | 3 | productos agregados | Agrega indicaciones | Guardar | Aceite Vegetal LA PATRONA Balde 18L | LA PATRONA | Aceite Vegetal COCINERO Botella 900ml | Aceite Vegetal BELTRAN Galonera 2L | Aceite Premium TONDERO Botella 900ml | TONDERO | Recomendado para ti,,,,,"{""Descripción"": [""Información de la marca""], ""Características"": [""Presentación/Empaque"", ""Botella"", ""Porción sugerida"", ""1 cucharada (14 g)"", ""Alérgenos Declarados"", ""Contiene soya"", ""Azúcar por porción"", ""0"", ""Calorías Porción"", ""130"", ""Carbohidratos Porción"", ""Grasas Porción"", ""14"", ""Proteínas Porción"", ""Sodio Porción"", ""Composición/Origen"", ""Perú"", ""% De Acidez"", ""0.25"", ""Advertencias De Almacenamiento"", ""Proteger de la luz solar y aromas agresivos"", ""Contenido Neto"", ""900 ml"", ""Denominación/Variedad"", ""Aceite de soya"", ""Advertencias de consumo"", ""NA"", ""Revisa todo"", ""Componentes del Producto"", ""Vendido por"", ""plazaVea"", ""En caso algo no vaya como gustes: Puedes revisar nuestras"", ""Politicas de cambios y/o devoluciones"", ""y hacerlas efectivas en todas nuestras tiendas."", ""Productos"", ""que te pueden interesar"", ""similares"", ""Multiplicador-de-unidad: MAKRO-Bi-Precio|Vigente Oculto"", ""un"", ""3"", ""productos agregados"", ""Agrega indicaciones"", ""Guardar"", ""Aceite Vegetal LA PATRONA Balde 18L"", ""LA PATRONA"", ""Aceite Vegetal COCINERO Botella 900ml"", ""Aceite Vegetal BELTRAN Galonera 2L"", ""Aceite Premium TONDERO Botella 900ml"", ""TONDERO"", ""Recomendado para ti""]}",dataset/txt_limpios/1214.txt,dataset/paginas_descargadas/1214.html,ET,sin_categoria,discard,0.30,no_category_detected
