{"source_id": "90", "title": "BUSCAR PRODUCTOS", "description": "", "breadcrumbs": "Ingresa", "price_raw": "443.0", "currency_raw": "", "url": "", "seller": "Desconocido", "availability": "unknown", "country": "UNKNOWN", "product_name": "BUSCAR PRODUCTOS", "brand": "Ingresa", "reference": "", "unit": "", "price_amount": 443.0, "price_currency": "", "price_symbol": "", "price_text": "443", "price_amount_filled": "443.0", "price_is_imputed": "False", "price_imputation_source": "original", "price_amount_usd": "443.0", "price_amount_usd_filled": "443.0", "fx_rate_local_per_usd": "1.0", "fx_source": "default_1usd", "information_text": "", "description_text": "", "features_text": "", "specifications_text": "", "benefits_text": "", "details_text": "", "other_sections": "", "sections": {}, "txt_path": "dataset/txt_limpios/90.txt", "html_path": "dataset/paginas_descargadas/90.html", "es_status": "EN", "category_canonical": "sin_categoria", "decision": "discard", "match_score": 0.3, "reasons": "no_category_detected"}
{"source_id": "91", "title": "BUSCAR PRODUCTOS", "description": "", "breadcrumbs": "Ingresa", "price_raw": "443.0", "currency_raw": "", "url": "", "seller": "Desconocido", "availability": "unknown", "country": "UNKNOWN", "product_name": "BUSCAR PRODUCTOS", "brand": "Ingresa", "reference": "", "unit": "", "price_amount": 443.0, "price_currency": "", "price_symbol": "", "price_text": "443", "price_amount_filled": "443.0", "price_is_imputed": "False", "price_imputation_source": "original", "price_amount_usd": "443.0", "price_amount_usd_filled": "443.0", "fx_rate_local_per_usd": "1.0", "fx_source": "default_1usd", "information_text": "", "description_text": "", "features_text": "", "specifications_text": "", "benefits_text": "", "details_text": "", "other_sections": "", "sections": {}, "txt_path": "dataset/txt_limpios/91.txt", "html_path": "dataset/paginas_descargadas/91.html", "es_status": "EN", "category_canonical": "sin_categoria", "decision": "discard", "match_score": 0.3, "reasons": "no_category_detected"}
{"source_id": "92", "title": "BUSCAR PRODUCTOS", "description": "", "breadcrumbs": "Ingresa", "price_raw": "443.0", "currency_raw": "", "url": "", "seller": "Desconocido", "availability": "unknown", "country": "UNKNOWN", "product_name": "BUSCAR PRODUCTOS", "brand": "Ingresa", "reference": "", "unit": "", "price_amount": 443.0, "price_currency": "", "price_symbol": "", "price_text": "443", "price_amount_filled": "443.0", "price_is_imputed": "False", "price_imputation_source": "original", "price_amount_usd": "443.0", "price_amount_usd_filled": "443.0", "fx_rate_local_per_usd": "1.0", "fx_source": "default_1usd", "information_text": "", "description_text": "", "features_text": "", "specifications_text": "", "benefits_text": "", "details_text": "", "other_sections": "", "sections": {}, "txt_path": "dataset/txt_limpios/92.txt", "html_path": "dataset/paginas_descargadas/92.html", "es_status": "EN", "category_canonical": "sin_categoria", "decision": "discard", "match_score": 0.3, "reasons": "no_category_detected"}
{"source_id": "93", "title": "BUSCAR PRODUCTOS", "description": "", "breadcrumbs": "Ingresa", "price_raw": "443.0", "currency_raw": "", "url": "", "seller": "Desconocido", "availability": "unknown", "country": "UNKNOWN", "product_name": "BUSCAR PRODUCTOS", "brand": "Ingresa", "reference": "", "unit": "", "price_amount": 443.0, "price_currency": "", "price_symbol": "", "price_text": "443", "price_amount_filled": "443.0", "price_is_imputed": "False", "price_imputation_source": "original", "price_amount_usd": "443.0", "price_amount_usd_filled": "443.0", "fx_rate_local_per_usd": "1.0", "fx_source": "default_1usd", "information_text": "", "description_text": "", "features_text": "", "specifications_text": "", "benefits_text": "", "details_text": "", "other_sections": "", "sections": {}, "txt_path": "dataset/txt_limpios/93.txt", "html_path": "dataset/paginas_descargadas/93.html", "es_status": "EN", "category_canonical": "sin_categoria", "decision": "discard", "match_score": 0.3, "reasons": "no_category_detected"}
{"source_id": "94", "title": "BUSCAR PRODUCTOS", "description": "", "breadcrumbs": "Ingresa", "price_raw": "443.0", "currency_raw": "", "url": "", "seller": "Desconocido", "availability": "unknown", "country": "UNKNOWN", "product_name": "BUSCAR PRODUCTOS", "brand": "Ingresa", "reference": "", "unit": "", "price_amount": 443.0, "price_currency": "", "price_symbol": "", "price_text": "443", "price_amount_filled": "443.0", "price_is_imputed": "False", "price_imputation_source": "original", "price_amount_usd": "443.0", "price_amount_usd_filled": "443.0", "fx_rate_local_per_usd": "1.0", "fx_source": "default_1usd", "information_text": "", "description_text": "", "features_text": "", "specifications_text": "", "benefits_text": "", "details_text": "", "other_sections": "", "sections": {}, "txt_path": "dataset/txt_limpios/94.txt", "html_path": "dataset/paginas_descargadas/94.html", "es_status": "EN", "category_canonical": "sin_categoria", "decision": "discard", "match_score": 0.3, "reasons": "no_category_detected"}
{"source_id": "95", "title": "BUSCAR PRODUCTOS", "description": "", "breadcrumbs": "Ingresa", "price_raw": "443.0", "currency_raw": "", "url": "", "seller": "Desconocido", "availability": "unknown", "country": "UNKNOWN", "product_name": "BUSCAR PRODUCTOS", "brand": "Ingresa", "reference": "", "unit": "", "price_amount": 443.0, "price_currency": "", "price_symbol": "", "price_text": "443", "price_amount_filled": "443.0", "price_is_imputed": "False", "price_imputation_source": "original", "price_amount_usd": "443.0", "price_amount_usd_filled": "443.0", "fx_rate_local_per_usd": "1.0", "fx_source": "default_1usd", "information_text": "", "description_text": "", "features_text": "", "specifications_text": "", "benefits_text": "", "details_text": "", "other_sections": "", "sections": {}, "txt_path": "dataset/txt_limpios/95.txt", "html_path": "dataset/paginas_descargadas/95.html", "es_status": "EN", "category_canonical": "sin_categoria", "decision": "discard", "match_score": 0.3, "reasons": "no_category_detected"}
{"source_id": "96", "title": "BUSCAR PRODUCTOS", "description": "", "breadcrumbs": "Ingresa", "price_raw": "443.0", "currency_raw": "", "url": "", "seller": "Desconocido", "availability": "unknown", "country": "UNKNOWN", "product_name": "BUSCAR PRODUCTOS", "brand": "Ingresa", "reference": "", "unit": "", "price_amount": 443.0, "price_currency": "", "price_symbol": "", "price_text": "443", "price_amount_filled": "443.0", "price_is_imputed": "False", "price_imputation_source": "original", "price_amount_usd": "443.0", "price_amount_usd_filled": "443.0", "fx_rate_local_per_usd": "1.0", "fx_source": "default_1usd", "information_text": "", "description_text": "", "features_text": "", "specifications_text": "", "benefits_text": "", "details_text": "", "other_sections": "", "sections": {}, "txt_path": "dataset/txt_limpios/96.txt", "html_path": "dataset/paginas_descargadas/96.html", "es_status": "EN", "category_canonical": "sin_categoria", "decision": "discard", "match_score": 0.3, "reasons": "no_category_detected"}
{"source_id": "97", "title": "BUSCAR PRODUCTOS", "description": "", "breadcrumbs": "Ingresa > 100.00 ml", "price_raw": "443.0", "currency_raw": "", "url": "", "seller": "Desconocido", "availability": "unknown", "country": "UNKNOWN", "product_name": "BUSCAR PRODUCTOS", "brand": "Ingresa", "reference": "", "unit": "100.00 ml", "price_amount": 443.0, "price_currency": "", "price_symbol": "", "price_text": "443", "price_amount_filled": "443.0", "price_is_imputed": "False", "price_imputation_source": "original", "price_amount_usd": "443.0", "price_amount_usd_filled": "443.0", "fx_rate_local_per_usd": "1.0", "fx_source": "default_1usd", "information_text": "", "description_text": "", "features_text": "", "specifications_text": "", "benefits_text": "", "details_text": "", "other_sections": "", "sections": {}, "txt_path": "dataset/txt_limpios/97.txt", "html_path": "dataset/paginas_descargadas/97.html", "es_status": "EN", "category_canonical": "sin_categoria", "decision": "discard", "match_score": 0.3, "reasons": "no_category_detected"}
{"source_id": "98", "title": "BUSCAR PRODUCTOS", "description": "Huevo fresco de granja | x | Promociones | Cerrar | Más información", "breadcrumbs": "Ingresa > 30 piezas", "price_raw": "443.0", "currency_raw": "", "url": "", "seller": "Desconocido", "availability": "unknown", "country": "UNKNOWN", "product_name": "BUSCAR PRODUCTOS", "brand": "Ingresa", "reference": "", "unit": "30 piezas", "price_amount": 443.0, "price_currency": "", "price_symbol": "", "price_text": "443", "price_amount_filled": "443.0", "price_is_imputed": "False", "price_imputation_source": "original", "price_amount_usd": "443.0", "price_amount_usd_filled": "443.0", "fx_rate_local_per_usd": "1.0", "fx_source": "default_1usd", "information_text": "", "description_text": "", "features_text": "", "specifications_text": "", "benefits_text": "Huevo fresco de granja | x | Promociones | Cerrar | Más información", "details_text": "", "other_sections": "", "sections": {"Beneficios": ["Huevo fresco de granja", "x", "Promociones", "Cerrar", "Más información"]}, "txt_path": "dataset/txt_limpios/98.txt", "html_path": "dataset/paginas_descargadas/98.html", "es_status": "EN", "category_canonical": "huevo", "decision": "discard", "match_score": 0.3, "reasons": "heuristic_default"}
{"source_id": "99", "title": "BUSCAR PRODUCTOS", "description": "", "breadcrumbs": "Ingresa > 100.00 g", "price_raw": "443.0", "currency_raw": "", "url": "", "seller": "Desconocido", "availability": "unknown", "country": "UNKNOWN", "product_name": "BUSCAR PRODUCTOS", "brand": "Ingresa", "reference": "", "unit": "100.00 g", "price_amount": 443.0, "price_currency": "", "price_symbol": "", "price_text": "443", "price_amount_filled": "443.0", "price_is_imputed": "False", "price_imputation_source": "original", "price_amount_usd": "443.0", "price_amount_usd_filled": "443.0", "fx_rate_local_per_usd": "1.0", "fx_source": "default_1usd", "information_text": "", "description_text": "", "features_text": "", "specifications_text": "", "benefits_text": "", "details_text": "", "other_sections": "", "sections": {}, "txt_path": "dataset/txt_limpios/99.txt", "html_path": "dataset/paginas_descargadas/99.html", "es_status": "EN", "category_canonical": "sin_categoria", "decision": "discard", "match_score": 0.3, "reasons": "no_category_detected"}
{"source_id": "23", "title": "Cafe y te", "description": "Café Nescafé Clásico Nescafé Clásico en sus distintas variedades es el café soluble que ha invitado a varias generaciones de mexicanos a disfrutar a pleno de cada día y vivir la rutina al máximo desde el momento mismo del desayuno Esta variedad se elabora con granos de café robusta y arábica cuidadosamente seleccionados que, gracias a un proceso especial de secado, dan por resultado un café 100% soluble y de origen natural, con un aroma y sabor incomparables.", "breadcrumbs": "Café Nescafé Clásico 300g > 300g > 3822396", "price_raw": "", "currency_raw": "MXN", "url": "", "seller": "Chedraui", "availability": "unknown", "country": "MX", "product_name": "Cafe y te", "brand": "Café Nescafé Clásico 300g", "reference": "3822396.0", "unit": "300g", "price_amount": null, "price_currency": "MXN", "price_symbol": "", "price_text": "", "price_amount_filled": "114.48", "price_is_imputed": "True", "price_imputation_source": "category_country_mean", "price_amount_usd": "", "price_amount_usd_filled": "6.1484", "fx_rate_local_per_usd": "18.62", "fx_source": "from_mexico_cambio_dolar", "information_text": "Café Nescafé Clásico", "description_text": "", "features_text": "", "specifications_text": "Nescafé Clásico en sus distintas variedades es el café soluble que ha invitado a varias generaciones de mexicanos a disfrutar a pleno de cada día y vivir la rutina al máximo desde el momento mismo del desayuno Esta variedad se elabora con granos de café robusta y arábica cuidadosamente seleccionados que, gracias a un proceso especial de secado, dan por resultado un café 100% soluble y de origen natural, con un aroma y sabor incomparables.", "benefits_text": "", "details_text": "", "other_sections": "", "sections": {"Información": ["Café Nescafé Clásico"], "Especificaciones": ["Nescafé Clásico en sus distintas variedades es el café soluble que ha invitado a varias generaciones de mexicanos a disfrutar a pleno de cada día y vivir la rutina al máximo desde el momento mismo del desayuno Esta variedad se elabora con granos de café robusta y arábica cuidadosamente seleccionados que, gracias a un proceso especial de secado, dan por resultado un café 100% soluble y de origen natural, con un aroma y sabor incomparables."]}, "txt_path": "dataset/txt_limpios/23.txt", "html_path": "dataset/paginas_descargadas/23.html", "es_status": "EN", "category_canonical": "cafe", "decision": "discard", "match_score": 0.6, "reasons": "price_parse_failed;price<=0"}
{"source_id": "24", "title": "Cafe y te", "description": "Prepara tu despensa en unos cuantos clics y descubre nuestra gran variedad de productos. ¡En la sala de casa, te llevamos el súper!", "breadcrumbs": "Legal > 180 g > 3278434", "price_raw": "88.0", "currency_raw": "MXN", "url": "", "seller": "Chedraui", "availability": "unknown", "country": "MX", "product_name": "Cafe y te", "brand": "Legal", "reference": "3278434.0", "unit": "180 g", "price_amount": 88.0, "price_currency": "MXN", "price_symbol": "$", "price_text": "$88.00", "price_amount_filled": "88.0", "price_is_imputed": "False", "price_imputation_source": "original", "price_amount_usd": "4.7261", "price_amount_usd_filled": "4.7261", "fx_rate_local_per_usd": "18.62", "fx_source": "from_mexico_cambio_dolar", "information_text": "", "description_text": "", "features_text": "Soluble | Kosher | De grano, origen puro y natural", "specifications_text": "Prepara tu despensa en unos cuantos clics y descubre nuestra gran variedad de productos. ¡En la sala de casa, te llevamos el súper!", "benefits_text": "", "details_text": "", "other_sections": "", "sections": {"Características": ["Soluble", "Kosher", "De grano, origen puro y natural"], "Especificaciones": ["Prepara tu despensa en unos cuantos clics y descubre nuestra gran variedad de productos. ¡En la sala de casa, te llevamos el súper!"]}, "txt_path": "dataset/txt_limpios/24.txt", "html_path": "dataset/paginas_descargadas/24.html", "es_status": "ET", "category_canonical": "cafe", "decision": "keep", "match_score": 0.6, "reasons": "heuristic_default"}
{"source_id": "25", "title": "Cafe y te", "description": "Café Gold Los Portales de Córdoba 170g Prepara tu despensa en unos cuantos clics y descubre nuestra gran variedad de productos. ¡En la sala de casa, te llevamos el súper!", "breadcrumbs": "Los Portales de Córdoba > 170g > 3734679", "price_raw": "149.0", "currency_raw": "MXN", "url": "", "seller": "Chedraui", "availability": "unknown", "country": "MX", "product_name": "Cafe y te", "brand": "Los Portales de Córdoba", "reference": "3734679.0", "unit": "170g", "price_amount": 149.0, "price_currency": "MXN", "price_symbol": "$", "price_text": "$149.00", "price_amount_filled": "149.0", "price_is_imputed": "False", "price_imputation_source": "original", "price_amount_usd": "8.0021", "price_amount_usd_filled": "8.0021", "fx_rate_local_per_usd": "18.62", "fx_source": "from_mexico_cambio_dolar", "information_text": "Café Gold Los Portales de Córdoba 170g", "description_text": "", "features_text": "Consérvese en un lugar fresco", "specifications_text": "Prepara tu despensa en unos cuantos clics y descubre nuestra gran variedad de productos. ¡En la sala de casa, te llevamos el súper!", "benefits_text": "", "details_text": "", "other_sections": "", "sections": {"Información": ["Café Gold Los Portales de Córdoba 170g"], "Características": ["Consérvese en un lugar fresco"], "Especificaciones": ["Prepara tu despensa en unos cuantos clics y descubre nuestra gran variedad de productos. ¡En la sala de casa, te llevamos el súper!"]}, "txt_path": "dataset/txt_limpios/25.txt", "html_path": "dataset/paginas_descargadas/25.html", "es_status": "ET", "category_canonical": "cafe", "decision": "keep", "match_score": 0.6, "reasons": "heuristic_default"}
{"source_id": "26", "title": "Cafe y te", "description": "Café molido y tostado ideal para cafetera, prensa francesa, italiana cualquier método de filtración. Disfruta del sabor gourmet del café americano Blasón. El café molido y tostado estadounidense Blasón tiene un tueste y una mojada regular que le dan un rico aroma que combina con su sabor lleno y de excelente cuerpo. Disfruta de un trabajo hecho con pasión, en una taza de Café Blasón. | - Mezcla de cafés de la región Pluma, Oaxaca 100% Arábica | - Dulzor abundante, amargo sutil con notas a frutas maduras", "breadcrumbs": "Blasón > 400g > 3202009", "price_raw": "150.0", "currency_raw": "MXN", "url": "", "seller": "Chedraui", "availability": "unknown", "country": "MX", "product_name": "Cafe y te", "brand": "Blasón", "reference": "3202009.0", "unit": "400g", "price_amount": 150.0, "price_currency": "MXN", "price_symbol": "$", "price_text": "$150.00", "price_amount_filled": "150.0", "price_is_imputed": "False", "price_imputation_source": "original", "price_amount_usd": "8.0559", "price_amount_usd_filled": "8.0559", "fx_rate_local_per_usd": "18.62", "fx_source": "from_mexico_cambio_dolar", "information_text": "Café molido y tostado ideal para cafetera, prensa francesa, italiana cualquier método de filtración. Disfruta del sabor gourmet del café americano Blasón.", "description_text": "", "features_text": "Café Méxicano | Tostado Molido | 100% Arabica", "specifications_text": "El café molido y tostado estadounidense Blasón tiene un tueste y una mojada regular que le dan un rico aroma que combina con su sabor lleno y de excelente cuerpo. Disfruta de un trabajo hecho con pasión, en una taza de Café Blasón. | - Mezcla de cafés de la región Pluma, Oaxaca 100% Arábica | - Dulzor abundante, amargo sutil con notas a frutas maduras", "benefits_text": "", "details_text": "", "other_sections": "", "sections": {"Información": ["Café molido y tostado ideal para cafetera, prensa francesa, italiana cualquier método de filtración. Disfruta del sabor gourmet del café americano Blasón."], "Características": ["Café Méxicano", "Tostado Molido", "100% Arabica"], "Especificaciones": ["El café molido y tostado estadounidense Blasón tiene un tueste y una mojada regular que le dan un rico aroma que combina con su sabor lleno y de excelente cuerpo. Disfruta de un trabajo hecho con pasión, en una taza de Café Blasón.", "- Mezcla de cafés de la región Pluma, Oaxaca 100% Arábica", "- Dulzor abundante, amargo sutil con notas a frutas maduras"]}, "txt_path": "dataset/txt_limpios/26.txt", "html_path": "dataset/paginas_descargadas/26.html", "es_status": "ET", "category_canonical": "cafe", "decision": "keep", "match_score": 0.6, "reasons": "heuristic_default"}
