{"source_id": "1611", "title": "Meu Desconto", "description": "", "breadcrumbs": "Blog Pão > 500g", "price_raw": "4.29", "currency_raw": "BRL", "url": "", "seller": "Desconocido", "availability": "unknown", "country": "BR", "product_name": "Meu Desconto", "brand": "Blog do Pão", "reference": "", "unit": "500g", "price_amount": 4.29, "price_currency": "BRL", "price_symbol": "R$", "price_text": "R$4,29", "price_amount_filled": "4.29", "price_is_imputed": "False", "price_imputation_source": "original", "price_amount_usd": "0.7874", "price_amount_usd_filled": "0.7874", "fx_rate_local_per_usd": "5.448", "fx_source": "from_brasil_cambio_dolar", "information_text": "", "description_text": "", "features_text": "", "specifications_text": "", "benefits_text": "", "details_text": "", "other_sections": "", "sections": {}, "txt_path": "dataset/txt_limpios/1611.txt", "html_path": "dataset/paginas_descargadas/1611.html", "es_status": "ET", "category_canonical": "pan", "decision": "keep", "match_score": 0.6, "reasons": "heuristic_default"}
{"source_id": "1613", "title": "Meu Desconto", "description": "", "breadcrumbs": "Blog Pão > 500g", "price_raw": "4.49", "currency_raw": "BRL", "url": "", "seller": "Desconocido", "availability": "unknown", "country": "BR", "product_name": "Meu Desconto", "brand": "Blog do Pão", "reference": "", "unit": "500g", "price_amount": 4.49, "price_currency": "BRL", "price_symbol": "R$", "price_text": "R$4,49", "price_amount_filled": "4.49", "price_is_imputed": "False", "price_imputation_source": "original", "price_amount_usd": "0.8242", "price_amount_usd_filled": "0.8242", "fx_rate_local_per_usd": "5.448", "fx_source": "from_brasil_cambio_dolar", "information_text": "", "description_text": "", "features_text": "", "specifications_text": "", "benefits_text": "", "details_text": "", "other_sections": "", "sections": {}, "txt_path": "dataset/txt_limpios/1613.txt", "html_path": "dataset/paginas_descargadas/1613.html", "es_status": "ET", "category_canonical": "pan", "decision": "keep", "match_score": 0.6, "reasons": "heuristic_default"}
{"source_id": "1615", "title": "Meu Desconto", "description": "", "breadcrumbs": "Blog Pão > 500g", "price_raw": "4.49", "currency_raw": "BRL", "url": "", "seller": "Desconocido", "availability": "unknown", "country": "BR", "product_name": "Meu Desconto", "brand": "Blog do Pão", "reference": "", "unit": "500g", "price_amount": 4.49, "price_currency": "BRL", "price_symbol": "R$", "price_text": "R$4,49", "price_amount_filled": "4.49", "price_is_imputed": "False", "price_imputation_source": "original", "price_amount_usd": "0.8242", "price_amount_usd_filled": "0.8242", "fx_rate_local_per_usd": "5.448", "fx_source": "from_brasil_cambio_dolar", "information_text": "", "description_text": "", "features_text": "", "specifications_text": "", "benefits_text": "", "details_text": "", "other_sections": "", "sections": {}, "txt_path": "dataset/txt_limpios/1615.txt", "html_path": "dataset/paginas_descargadas/1615.html", "es_status": "ET", "category_canonical": "pan", "decision": "keep", "match_score": 0.6, "reasons": "heuristic_default"}
{"source_id": "1620", "title": "Meu Desconto", "description": "", "breadcrumbs": "Blog Pão > 500g", "price_raw": "4.89", "currency_raw": "BRL", "url": "", "seller": "Desconocido", "availability": "unknown", "country": "BR", "product_name": "Meu Desconto", "brand": "Blog do Pão", "reference": "", "unit": "500g", "price_amount": 4.89, "price_currency": "BRL", "price_symbol": "R$", "price_text": "R$4,89", "price_amount_filled": "4.89", "price_is_imputed": "False", "price_imputation_source": "original", "price_amount_usd": "0.8976", "price_amount_usd_filled": "0.8976", "fx_rate_local_per_usd": "5.448", "fx_source": "from_brasil_cambio_dolar", "information_text": "", "description_text": "", "features_text": "", "specifications_text": "", "benefits_text": "", "details_text": "", "other_sections": "", "sections": {}, "txt_path": "dataset/txt_limpios/1620.txt", "html_path": "dataset/paginas_descargadas/1620.html", "es_status": "ET", "category_canonical": "pan", "decision": "keep", "match_score": 0.6, "reasons": "heuristic_default"}
{"source_id": "1623", "title": "Meu Desconto", "description": "", "breadcrumbs": "Blog Pão > 1L", "price_raw": "7.99", "currency_raw": "BRL", "url": "", "seller": "Desconocido", "availability": "unknown", "country": "BR", "product_name": "Meu Desconto", "brand": "Blog do Pão", "reference": "", "unit": "1L", "price_amount": 7.99, "price_currency": "BRL", "price_symbol": "R$", "price_text": "R$7,99", "price_amount_filled": "7.99", "price_is_imputed": "False", "price_imputation_source": "original", "price_amount_usd": "1.4666", "price_amount_usd_filled": "1.4666", "fx_rate_local_per_usd": "5.448", "fx_source": "from_brasil_cambio_dolar", "information_text": "", "description_text": "", "features_text": "", "specifications_text": "", "benefits_text": "", "details_text": "", "other_sections": "", "sections": {}, "txt_path": "dataset/txt_limpios/1623.txt", "html_path": "dataset/paginas_descargadas/1623.html", "es_status": "ET", "category_canonical": "pan", "decision": "keep", "match_score": 0.6, "reasons": "heuristic_default"}
{"source_id": "1624", "title": "Meu Desconto", "description": "", "breadcrumbs": "Blog Pão > 1 Litro", "price_raw": "1.0", "currency_raw": "", "url": "", "seller": "Desconocido", "availability": "unknown", "country": "UNKNOWN", "product_name": "Meu Desconto", "brand": "Blog do Pão", "reference": "", "unit": "1 Litro", "price_amount": 1.0, "price_currency": "", "price_symbol": "", "price_text": "1", "price_amount_filled": "1.0", "price_is_imputed": "False", "price_imputation_source": "original", "price_amount_usd": "1.0", "price_amount_usd_filled": "1.0", "fx_rate_local_per_usd": "1.0", "fx_source": "default_1usd", "information_text": "", "description_text": "", "features_text": "", "specifications_text": "", "benefits_text": "", "details_text": "", "other_sections": "", "sections": {}, "txt_path": "dataset/txt_limpios/1624.txt", "html_path": "dataset/paginas_descargadas/1624.html", "es_status": "ET", "category_canonical": "pan", "decision": "keep", "match_score": 0.6, "reasons": "heuristic_default"}
{"source_id": "1627", "title": "Meu Desconto", "description": "", "breadcrumbs": "Blog Pão > 1 Litro", "price_raw": "5.99", "currency_raw": "BRL", "url": "", "seller": "Desconocido", "availability": "unknown", "country": "BR", "product_name": "Meu Desconto", "brand": "Blog do Pão", "reference": "", "unit": "1 Litro", "price_amount": 5.99, "price_currency": "BRL", "price_symbol": "R$", "price_text": "R$5,99", "price_amount_filled": "5.99", "price_is_imputed": "False", "price_imputation_source": "original", "price_amount_usd": "1.0995", "price_amount_usd_filled": "1.0995", "fx_rate_local_per_usd": "5.448", "fx_source": "from_brasil_cambio_dolar", "information_text": "", "description_text": "", "features_text": "", "specifications_text": "", "benefits_text": "", "details_text": "", "other_sections": "", "sections": {}, "txt_path": "dataset/txt_limpios/1627.txt", "html_path": "dataset/paginas_descargadas/1627.html", "es_status": "ET", "category_canonical": "pan", "decision": "keep", "match_score": 0.6, "reasons": "heuristic_default"}
{"source_id": "1633", "title": "Meu Desconto", "description": "", "breadcrumbs": "Blog Pão > 1 Litro", "price_raw": "18.0", "currency_raw": "", "url": "", "seller": "Desconocido", "availability": "unknown", "country": "UNKNOWN", "product_name": "Meu Desconto", "brand": "Blog do Pão", "reference": "", "unit": "1 Litro", "price_amount": 18.0, "price_currency": "", "price_symbol": "", "price_text": "18", "price_amount_filled": "18.0", "price_is_imputed": "False", "price_imputation_source": "original", "price_amount_usd": "18.0", "price_amount_usd_filled": "18.0", "fx_rate_local_per_usd": "1.0", "fx_source": "default_1usd", "information_text": "", "description_text": "", "features_text": "", "specifications_text": "", "benefits_text": "", "details_text": "", "other_sections": "", "sections": {}, "txt_path": "dataset/txt_limpios/1633.txt", "html_path": "dataset/paginas_descargadas/1633.html", "es_status": "ET", "category_canonical": "pan", "decision": "keep", "match_score": 0.6, "reasons": "heuristic_default"}
{"source_id": "1634", "title": "Meu Desconto", "description": "", "breadcrumbs": "Blog Pão > 1L", "price_raw": "7.99", "currency_raw": "BRL", "url": "", "seller": "Desconocido", "availability": "unknown", "country": "BR", "product_name": "Meu Desconto", "brand": "Blog do Pão", "reference": "", "unit": "1L", "price_amount": 7.99, "price_currency": "BRL", "price_symbol": "R$", "price_text": "R$7,99", "price_amount_filled": "7.99", "price_is_imputed": "False", "price_imputation_source": "original", "price_amount_usd": "1.4666", "price_amount_usd_filled": "1.4666", "fx_rate_local_per_usd": "5.448", "fx_source": "from_brasil_cambio_dolar", "information_text": "", "description_text": "", "features_text": "", "specifications_text": "", "benefits_text": "", "details_text": "", "other_sections": "", "sections": {}, "txt_path": "dataset/txt_limpios/1634.txt", "html_path": "dataset/paginas_descargadas/1634.html", "es_status": "ET", "category_canonical": "pan", "decision": "keep", "match_score": 0.6, "reasons": "heuristic_default"}
{"source_id": "1637", "title": "Meu Desconto", "description": "", "breadcrumbs": "Blog Pão > 330ml", "price_raw": "6.59", "currency_raw": "BRL", "url": "", "seller": "Desconocido", "availability": "unknown", "country": "BR", "product_name": "Meu Desconto", "brand": "Blog do Pão", "reference": "", "unit": "330ml", "price_amount": 6.59, "price_currency": "BRL", "price_symbol": "R$", "price_text": "R$6,59", "price_amount_filled": "6.59", "price_is_imputed": "False", "price_imputation_source": "original", "price_amount_usd": "1.2096", "price_amount_usd_filled": "1.2096", "fx_rate_local_per_usd": "5.448", "fx_source": "from_brasil_cambio_dolar", "information_text": "", "description_text": "", "features_text": "Características gustativas | Frutado,Condimentada,Boa formación,persistente. | Cervezas del estilo American Lager son ligeros en color y cuerpo, tienen bajo amargor y suelen ser neutrales, refrescantes y bien carbonatadas. El sabor es sutil (es decir, ningún ingrediente puede dominar los demás). Hay un dulzor residual de malta y adjuntos y otras fuentes de azúcar pueden utilizarse. | Descargue la app | Institucional | Quienes somos | Trabaja Conosco | Política de privacidad y Términos de Uso | Términos Buscados | Heineken | Vinos | Fraldas | Mapa del sitio | Mapa de productos | Mapa de tiendas | Central de Atención | 0800 779 6761 | Mis Solicitudes | Encuentra una Tienda | Formas de Pago | Intercambios y descartes | Preguntas frecuentes | TripAdvisor Nuestros canales | Facebook | instagram | YouTube | Twitter | Estoy consciente", "specifications_text": "", "benefits_text": "", "details_text": "", "other_sections": "", "sections": {"Características": ["Características gustativas", "Frutado,Condimentada,Boa formación,persistente.", "Las cervezas del estilo American Lager son ligeras en color y cuerpo, tienen bajo amargor y suelen ser neutrales, refrescantes y bien carbonatadas. El sabor es sutil (es decir, ningún ingrediente puede dominar los demás). Hay un dulzor residual de malta y adjuntos y otras fuentes de azúcar pueden utilizarse.", "baixe o app", "Institucional", "Quem somos", "Trabalhe Conosco", "Política de privacidad y Términos de uso", "Termos Buscados", "Heineken", "Vinhos", "Fraldas", "Mapa do site", "Mapa de productos", "Mapa de tiendas", "Central de Atendimento", "0800 779 6761", "Meus Pedidos", "Encuentra una tienda", "Formas de Pagamento", "Intercambios y descartes", "Preguntas frecuentes", "Nossos canais", "facebook", "instagram", "youtube", "twitter", "Estou ciente"]}, "txt_path": "dataset/txt_limpios/1637.txt", "html_path": "dataset/paginas_descargadas/1637.html", "es_status": "ET", "category_canonical": "pan", "decision": "keep", "match_score": 0.6, "reasons": "heuristic_default"}
{"source_id": "1639", "title": "Meu Desconto", "description": "", "breadcrumbs": "Blog Pão > 350ml", "price_raw": "5.29", "currency_raw": "BRL", "url": "", "seller": "Desconocido", "availability": "unknown", "country": "BR", "product_name": "Meu Desconto", "brand": "Blog do Pão", "reference": "", "unit": "350ml", "price_amount": 5.29, "price_currency": "BRL", "price_symbol": "R$", "price_text": "R$5,29", "price_amount_filled": "5.29", "price_is_imputed": "False", "price_imputation_source": "original", "price_amount_usd": "0.971", "price_amount_usd_filled": "0.971", "fx_rate_local_per_usd": "5.448", "fx_source": "from_brasil_cambio_dolar", "information_text": "", "description_text": "", "features_text": "", "specifications_text": "", "benefits_text": "", "details_text": "", "other_sections": "", "sections": {}, "txt_path": "dataset/txt_limpios/1639.txt", "html_path": "dataset/paginas_descargadas/1639.html", "es_status": "ET", "category_canonical": "pan", "decision": "keep", "match_score": 0.6, "reasons": "heuristic_default"}
{"source_id": "1643", "title": "Meu Desconto", "description": "", "breadcrumbs": "Blog Pão > 269ml", "price_raw": "2.99", "currency_raw": "BRL", "url": "", "seller": "Desconocido", "availability": "unknown", "country": "BR", "product_name": "Meu Desconto", "brand": "Blog do Pão", "reference": "", "unit": "269ml", "price_amount": 2.99, "price_currency": "BRL", "price_symbol": "R$", "price_text": "R$2,99", "price_amount_filled": "2.99", "price_is_imputed": "False", "price_imputation_source": "original", "price_amount_usd": "0.5488", "price_amount_usd_filled": "0.5488", "fx_rate_local_per_usd": "5.448", "fx_source": "from_brasil_cambio_dolar", "information_text": "", "description_text": "", "features_text": "", "specifications_text": "", "benefits_text": "", "details_text": "", "other_sections": "", "sections": {}, "txt_path": "dataset/txt_limpios/1643.txt", "html_path": "dataset/paginas_descargadas/1643.html", "es_status": "ET", "category_canonical": "pan", "decision": "keep", "match_score": 0.6, "reasons": "heuristic_default"}
{"source_id": "230", "title": "Meu Desconto", "description": "", "breadcrumbs": "Minha Lista > 1kg", "price_raw": "7.69", "currency_raw": "BRL", "url": "", "seller": "Desconocido", "availability": "unknown", "country": "BR", "product_name": "Meu Desconto", "brand": "Minha Lista", "reference": "", "unit": "1kg", "price_amount": 7.69, "price_currency": "BRL", "price_symbol": "R$", "price_text": "R$7,69", "price_amount_filled": "7.69", "price_is_imputed": "False", "price_imputation_source": "original", "price_amount_usd": "1.4115", "price_amount_usd_filled": "1.4115", "fx_rate_local_per_usd": "5.448", "fx_source": "from_brasil_cambio_dolar", "information_text": "", "description_text": "", "features_text": "", "specifications_text": "", "benefits_text": "", "details_text": "", "other_sections": "", "sections": {}, "txt_path": "dataset/txt_limpios/230.txt", "html_path": "dataset/paginas_descargadas/230.html", "es_status": "EN", "category_canonical": "sin_categoria", "decision": "discard", "match_score": 0.3, "reasons": "no_category_detected"}
{"source_id": "231", "title": "Meu Desconto", "description": "", "breadcrumbs": "Minha Lista > 1kg", "price_raw": "6.59", "currency_raw": "BRL", "url": "", "seller": "Desconocido", "availability": "unknown", "country": "BR", "product_name": "Meu Desconto", "brand": "Minha Lista", "reference": "", "unit": "1kg", "price_amount": 6.59, "price_currency": "BRL", "price_symbol": "R$", "price_text": "R$6,59", "price_amount_filled": "6.59", "price_is_imputed": "False", "price_imputation_source": "original", "price_amount_usd": "1.2096", "price_amount_usd_filled": "1.2096", "fx_rate_local_per_usd": "5.448", "fx_source": "from_brasil_cambio_dolar", "information_text": "", "description_text": "", "features_text": "", "specifications_text": "", "benefits_text": "", "details_text": "", "other_sections": "", "sections": {}, "txt_path": "dataset/txt_limpios/231.txt", "html_path": "dataset/paginas_descargadas/231.html", "es_status": "EN", "category_canonical": "sin_categoria", "decision": "discard", "match_score": 0.3, "reasons": "no_category_detected"}
{"source_id": "232", "title": "Meu Desconto", "description": "", "breadcrumbs": "Minha Lista > 5kg", "price_raw": "20.99", "currency_raw": "BRL", "url": "", "seller": "Desconocido", "availability": "unknown", "country": "BR", "product_name": "Meu Desconto", "brand": "Minha Lista", "reference": "", "unit": "5kg", "price_amount": 20.99, "price_currency": "BRL", "price_symbol": "R$", "price_text": "R$20,99", "price_amount_filled": "20.99", "price_is_imputed": "False", "price_imputation_source": "original", "price_amount_usd": "3.8528", "price_amount_usd_filled": "3.8528", "fx_rate_local_per_usd": "5.448", "fx_source": "from_brasil_cambio_dolar", "information_text": "", "description_text": "", "features_text": "", "specifications_text": "", "benefits_text": "", "details_text": "", "other_sections": "", "sections": {}, "txt_path": "dataset/txt_limpios/232.txt", "html_path": "dataset/paginas_descargadas/232.html", "es_status": "EN", "category_canonical": "sin_categoria", "decision": "discard", "match_score": 0.3, "reasons": "no_category_detected"}
{"source_id": "233", "title": "Meu Desconto", "description": "", "breadcrumbs": "Minha Lista > 1kg", "price_raw": "18.99", "currency_raw": "BRL", "url": "", "seller": "Desconocido", "availability": "unknown", "country": "BR", "product_name": "Meu Desconto", "brand": "Minha Lista", "reference": "", "unit": "1kg", "price_amount": 18.99, "price_currency": "BRL", "price_symbol": "R$", "price_text": "R$18,99", "price_amount_filled": "18.99", "price_is_imputed": "False", "price_imputation_source": "original", "price_amount_usd": "3.4857", "price_amount_usd_filled": "3.4857", "fx_rate_local_per_usd": "5.448", "fx_source": "from_brasil_cambio_dolar", "information_text": "", "description_text": "", "features_text": "", "specifications_text": "", "benefits_text": "", "details_text": "", "other_sections": "", "sections": {}, "txt_path": "dataset/txt_limpios/233.txt", "html_path": "dataset/paginas_descargadas/233.html", "es_status": "EN", "category_canonical": "sin_categoria", "decision": "discard", "match_score": 0.3, "reasons": "no_category_detected"}
{"source_id": "234", "title": "Meu Desconto", "description": "", "breadcrumbs": "Minha Lista > 5kg", "price_raw": "1.0", "currency_raw": "", "url": "", "seller": "Desconocido", "availability": "unknown", "country": "UNKNOWN", "product_name": "Meu Desconto", "brand": "Minha Lista", "reference": "", "unit": "5kg", "price_amount": 1.0, "price_currency": "", "price_symbol": "", "price_text": "1", "price_amount_filled": "1.0", "price_is_imputed": "False", "price_imputation_source": "original", "price_amount_usd": "1.0", "price_amount_usd_filled": "1.0", "fx_rate_local_per_usd": "1.0", "fx_source": "default_1usd", "information_text": "", "description_text": "", "features_text": "", "specifications_text": "", "benefits_text": "", "details_text": "", "other_sections": "", "sections": {}, "txt_path": "dataset/txt_limpios/234.txt", "html_path": "dataset/paginas_descargadas/234.html", "es_status": "EN", "category_canonical": "sin_categoria", "decision": "discard", "match_score": 0.3, "reasons": "no_category_detected"}
{"source_id": "235", "title": "Meu Desconto", "description": "", "breadcrumbs": "Minha Lista > 500g", "price_raw": "34.99", "currency_raw": "BRL", "url": "", "seller": "Desconocido", "availability": "unknown", "country": "BR", "product_name": "Meu Desconto", "brand": "Minha Lista", "reference": "", "unit": "500g", "price_amount": 34.99, "price_currency": "BRL", "price_symbol": "R$", "price_text": "R$34,99", "price_amount_filled": "34.99", "price_is_imputed": "False", "price_imputation_source": "original", "price_amount_usd": "6.4225", "price_amount_usd_filled": "6.4225", "fx_rate_local_per_usd": "5.448", "fx_source": "from_brasil_cambio_dolar", "information_text": "", "description_text": "", "features_text": "", "specifications_text": "", "benefits_text": "", "details_text": "", "other_sections": "", "sections": {}, "txt_path": "dataset/txt_limpios/235.txt", "html_path": "dataset/paginas_descargadas/235.html", "es_status": "EN", "category_canonical": "sin_categoria", "decision": "discard", "match_score": 0.3, "reasons": "no_category_detected"}
{"source_id": "236", "title": "Meu Desconto", "description": "", "breadcrumbs": "Minha Lista > 500g", "price_raw": "41.49", "currency_raw": "BRL", "url": "", "seller": "Desconocido", "availability": "unknown", "country": "BR", "product_name": "Meu Desconto", "brand": "Minha Lista", "reference": "", "unit": "500g", "price_amount": 41.49, "price_currency": "BRL", "price_symbol": "R$", "price_text": "R$41,49", "price_amount_filled": "41.49", "price_is_imputed": "False", "price_imputation_source": "original", "price_amount_usd": "7.6156", "price_amount_usd_filled": "7.6156", "fx_rate_local_per_usd": "5.448", "fx_source": "from_brasil_cambio_dolar", "information_text": "", "description_text": "", "features_text": "", "specifications_text": "", "benefits_text": "", "details_text": "", "other_sections": "", "sections": {}, "txt_path": "dataset/txt_limpios/236.txt", "html_path": "dataset/paginas_descargadas/236.html", "es_status": "EN", "category_canonical": "sin_categoria", "decision": "discard", "match_score": 0.3, "reasons": "no_category_detected"}
