{"source_id": "1373", "title": "Horarios de entrega", "description": "", "breadcrumbs": "LISTA > 1 KG", "price_raw": "", "currency_raw": "", "url": "", "seller": "Desconocido", "availability": "unknown", "country": "UNKNOWN", "product_name": "Horarios de entrega", "brand": "LISTA", "reference": "", "unit": "1 KG", "price_amount": null, "price_currency": "", "price_symbol": "", "price_text": "", "price_amount_filled": "234.19", "price_is_imputed": "True", "price_imputation_source": "country_mean", "price_amount_usd": "", "price_amount_usd_filled": "234.1938", "fx_rate_local_per_usd": "1.0", "fx_source": "default_1usd", "information_text": "", "description_text": "", "features_text": "", "specifications_text": "", "benefits_text": "", "details_text": "", "other_sections": "", "sections": {}, "txt_path": "dataset/txt_limpios/1373.txt", "html_path": "dataset/paginas_descargadas/1373.html", "es_status": "EN", "category_canonical": "sin_categoria", "decision": "discard", "match_score": 0.3, "reasons": "no_category_detected;price_parse_failed"}
{"source_id": "1374", "title": "Horarios de entrega", "description": "", "breadcrumbs": "LISTA > 1 KG", "price_raw": "", "currency_raw": "", "url": "", "seller": "Desconocido", "availability": "unknown", "country": "UNKNOWN", "product_name": "Horarios de entrega", "brand": "LISTA", "reference": "", "unit": "1 KG", "price_amount": null, "price_currency": "", "price_symbol": "", "price_text": "", "price_amount_filled": "234.19", "price_is_imputed": "True", "price_imputation_source": "country_mean", "price_amount_usd": "", "price_amount_usd_filled": "234.1938", "fx_rate_local_per_usd": "1.0", "fx_source": "default_1usd", "information_text": "", "description_text": "", "features_text": "", "specifications_text": "", "benefits_text": "", "details_text": "", "other_sections": "", "sections": {}, "txt_path": "dataset/txt_limpios/1374.txt", "html_path": "dataset/paginas_descargadas/1374.html", "es_status": "EN", "category_canonical": "sin_categoria", "decision": "discard", "match_score": 0.3, "reasons": "no_category_detected;price_parse_failed"}
{"source_id": "1375", "title": "Horarios de entrega", "description": "", "breadcrumbs": "LISTA", "price_raw": "", "currency_raw": "", "url": "", "seller": "Desconocido", "availability": "unknown", "country": "UNKNOWN", "product_name": "Horarios de entrega", "brand": "LISTA", "reference": "", "unit": "", "price_amount": null, "price_currency": "", "price_symbol": "", "price_text": "", "price_amount_filled": "234.19", "price_is_imputed": "True", "price_imputation_source": "country_mean", "price_amount_usd": "", "price_amount_usd_filled": "234.1938", "fx_rate_local_per_usd": "1.0", "fx_source": "default_1usd", "information_text": "", "description_text": "", "features_text": "", "specifications_text": "", "benefits_text": "", "details_text": "", "other_sections": "", "sections": {}, "txt_path": "dataset/txt_limpios/1375.txt", "html_path": "dataset/paginas_descargadas/1375.html", "es_status": "EN", "category_canonical": "sin_categoria", "decision": "discard", "match_score": 0.3, "reasons": "no_category_detected;price_parse_failed"}
{"source_id": "1376", "title": "Horarios de entrega", "description": "", "breadcrumbs": "LISTA > 500GR", "price_raw": "500.0", "currency_raw": "", "url": "", "seller": "Desconocido", "availability": "unknown", "country": "UNKNOWN", "product_name": "Horarios de entrega", "brand": "LISTA", "reference": "", "unit": "500GR", "price_amount": 500.0, "price_currency": "", "price_symbol": "", "price_text": "500", "price_amount_filled": "500.0", "price_is_imputed": "False", "price_imputation_source": "original", "price_amount_usd": "500.0", "price_amount_usd_filled": "500.0", "fx_rate_local_per_usd": "1.0", "fx_source": "default_1usd", "information_text": "", "description_text": "", "features_text": "", "specifications_text": "", "benefits_text": "", "details_text": "", "other_sections": "", "sections": {}, "txt_path": "dataset/txt_limpios/1376.txt", "html_path": "dataset/paginas_descargadas/1376.html", "es_status": "EN", "category_canonical": "sin_categoria", "decision": "discard", "match_score": 0.3, "reasons": "no_category_detected"}
{"source_id": "1377", "title": "Horarios de entrega", "description": "", "breadcrumbs": "LISTA > 500ML", "price_raw": "", "currency_raw": "", "url": "", "seller": "Desconocido", "availability": "unknown", "country": "UNKNOWN", "product_name": "Horarios de entrega", "brand": "LISTA", "reference": "", "unit": "500ML", "price_amount": null, "price_currency": "", "price_symbol": "", "price_text": "", "price_amount_filled": "234.19", "price_is_imputed": "True", "price_imputation_source": "country_mean", "price_amount_usd": "", "price_amount_usd_filled": "234.1938", "fx_rate_local_per_usd": "1.0", "fx_source": "default_1usd", "information_text": "", "description_text": "", "features_text": "", "specifications_text": "", "benefits_text": "", "details_text": "", "other_sections": "", "sections": {}, "txt_path": "dataset/txt_limpios/1377.txt", "html_path": "dataset/paginas_descargadas/1377.html", "es_status": "EN", "category_canonical": "sin_categoria", "decision": "discard", "match_score": 0.3, "reasons": "no_category_detected;price_parse_failed"}
{"source_id": "1378", "title": "Horarios de entrega", "description": "", "breadcrumbs": "LISTA > 1Litro", "price_raw": "", "currency_raw": "", "url": "", "seller": "Desconocido", "availability": "unknown", "country": "UNKNOWN", "product_name": "Horarios de entrega", "brand": "LISTA", "reference": "", "unit": "1Litro", "price_amount": null, "price_currency": "", "price_symbol": "", "price_text": "", "price_amount_filled": "234.19", "price_is_imputed": "True", "price_imputation_source": "country_mean", "price_amount_usd": "", "price_amount_usd_filled": "234.1938", "fx_rate_local_per_usd": "1.0", "fx_source": "default_1usd", "information_text": "", "description_text": "", "features_text": "", "specifications_text": "", "benefits_text": "", "details_text": "", "other_sections": "", "sections": {}, "txt_path": "dataset/txt_limpios/1378.txt", "html_path": "dataset/paginas_descargadas/1378.html", "es_status": "EN", "category_canonical": "sin_categoria", "decision": "discard", "match_score": 0.3, "reasons": "no_category_detected;price_parse_failed"}
{"source_id": "1379", "title": "Horarios de entrega", "description": "", "breadcrumbs": "LISTA > 400GR", "price_raw": "400.0", "currency_raw": "", "url": "", "seller": "Desconocido", "availability": "unknown", "country": "UNKNOWN", "product_name": "Horarios de entrega", "brand": "LISTA", "reference": "", "unit": "400GR", "price_amount": 400.0, "price_currency": "", "price_symbol": "", "price_text": "400", "price_amount_filled": "400.0", "price_is_imputed": "False", "price_imputation_source": "original", "price_amount_usd": "400.0", "price_amount_usd_filled": "400.0", "fx_rate_local_per_usd": "1.0", "fx_source": "default_1usd", "information_text": "", "description_text": "", "features_text": "", "specifications_text": "", "benefits_text": "", "details_text": "", "other_sections": "", "sections": {}, "txt_path": "dataset/txt_limpios/1379.txt", "html_path": "dataset/paginas_descargadas/1379.html", "es_status": "EN", "category_canonical": "sin_categoria", "decision": "discard", "match_score": 0.3, "reasons": "no_category_detected"}
{"source_id": "1380", "title": "Horarios de entrega", "description": "", "breadcrumbs": "LISTA > 500 GR", "price_raw": "", "currency_raw": "", "url": "", "seller": "Desconocido", "availability": "unknown", "country": "UNKNOWN", "product_name": "Horarios de entrega", "brand": "LISTA", "reference": "", "unit": "500 GR", "price_amount": null, "price_currency": "", "price_symbol": "", "price_text": "", "price_amount_filled": "234.19", "price_is_imputed": "True", "price_imputation_source": "country_mean", "price_amount_usd": "", "price_amount_usd_filled": "234.1938", "fx_rate_local_per_usd": "1.0", "fx_source": "default_1usd", "information_text": "", "description_text": "", "features_text": "", "specifications_text": "", "benefits_text": "", "details_text": "", "other_sections": "", "sections": {}, "txt_path": "dataset/txt_limpios/1380.txt", "html_path": "dataset/paginas_descargadas/1380.html", "es_status": "EN", "category_canonical": "sin_categoria", "decision": "discard", "match_score": 0.3, "reasons": "no_category_detected;price_parse_failed"}
{"source_id": "1381", "title": "Horarios de entrega", "description": "", "breadcrumbs": "LISTA > 1 KG", "price_raw": "1.0", "currency_raw": "", "url": "", "seller": "Desconocido", "availability": "unknown", "country": "UNKNOWN", "product_name": "Horarios de entrega", "brand": "LISTA", "reference": "", "unit": "1 KG", "price_amount": 1.0, "price_currency": "", "price_symbol": "", "price_text": "1", "price_amount_filled": "1.0", "price_is_imputed": "False", "price_imputation_source": "original", "price_amount_usd": "1.0", "price_amount_usd_filled": "1.0", "fx_rate_local_per_usd": "1.0", "fx_source": "default_1usd", "information_text": "", "description_text": "", "features_text": "", "specifications_text": "", "benefits_text": "", "details_text": "", "other_sections": "", "sections": {}, "txt_path": "dataset/txt_limpios/1381.txt", "html_path": "dataset/paginas_descargadas/1381.html", "es_status": "EN", "category_canonical": "sin_categoria", "decision": "discard", "match_score": 0.3, "reasons": "no_category_detected"}
{"source_id": "1382", "title": "Horarios de entrega", "description": "", "breadcrumbs": "LISTA > 400 GR", "price_raw": "", "currency_raw": "", "url": "", "seller": "Desconocido", "availability": "unknown", "country": "UNKNOWN", "product_name": "Horarios de entrega", "brand": "LISTA", "reference": "", "unit": "400 GR", "price_amount": null, "price_currency": "", "price_symbol": "", "price_text": "", "price_amount_filled": "234.19", "price_is_imputed": "True", "price_imputation_source": "country_mean", "price_amount_usd": "", "price_amount_usd_filled": "234.1938", "fx_rate_local_per_usd": "1.0", "fx_source": "default_1usd", "information_text": "", "description_text": "", "features_text": "", "specifications_text": "", "benefits_text": "", "details_text": "", "other_sections": "", "sections": {}, "txt_path": "dataset/txt_limpios/1382.txt", "html_path": "dataset/paginas_descargadas/1382.html", "es_status": "EN", "category_canonical": "sin_categoria", "decision": "discard", "match_score": 0.3, "reasons": "no_category_detected;price_parse_failed"}
{"source_id": "1383", "title": "Horarios de entrega", "description": "", "breadcrumbs": "LISTA > 100 GR", "price_raw": "1.0", "currency_raw": "", "url": "", "seller": "Desconocido", "availability": "unknown", "country": "UNKNOWN", "product_name": "Horarios de entrega", "brand": "LISTA", "reference": "", "unit": "100 GR", "price_amount": 1.0, "price_currency": "", "price_symbol": "", "price_text": "1", "price_amount_filled": "1.0", "price_is_imputed": "False", "price_imputation_source": "original", "price_amount_usd": "1.0", "price_amount_usd_filled": "1.0", "fx_rate_local_per_usd": "1.0", "fx_source": "default_1usd", "information_text": "", "description_text": "", "features_text": "", "specifications_text": "", "benefits_text": "", "details_text": "", "other_sections": "", "sections": {}, "txt_path": "dataset/txt_limpios/1383.txt", "html_path": "dataset/paginas_descargadas/1383.html", "es_status": "EN", "category_canonical": "sin_categoria", "decision": "discard", "match_score": 0.3, "reasons": "no_category_detected"}
{"source_id": "1384", "title": "Horarios de entrega", "description": "", "breadcrumbs": "LISTA > 250GR", "price_raw": "250.0", "currency_raw": "", "url": "", "seller": "Desconocido", "availability": "unknown", "country": "UNKNOWN", "product_name": "Horarios de entrega", "brand": "LISTA", "reference": "", "unit": "250GR", "price_amount": 250.0, "price_currency": "", "price_symbol": "", "price_text": "250", "price_amount_filled": "250.0", "price_is_imputed": "False", "price_imputation_source": "original", "price_amount_usd": "250.0", "price_amount_usd_filled": "250.0", "fx_rate_local_per_usd": "1.0", "fx_source": "default_1usd", "information_text": "", "description_text": "", "features_text": "", "specifications_text": "", "benefits_text": "", "details_text": "", "other_sections": "", "sections": {}, "txt_path": "dataset/txt_limpios/1384.txt", "html_path": "dataset/paginas_descargadas/1384.html", "es_status": "EN", "category_canonical": "sin_categoria", "decision": "discard", "match_score": 0.3, "reasons": "no_category_detected"}
{"source_id": "1385", "title": "Horarios de entrega", "description": "", "breadcrumbs": "LISTA > 1 LITRO", "price_raw": "", "currency_raw": "", "url": "", "seller": "Desconocido", "availability": "unknown", "country": "UNKNOWN", "product_name": "Horarios de entrega", "brand": "LISTA", "reference": "", "unit": "1 LITRO", "price_amount": null, "price_currency": "", "price_symbol": "", "price_text": "", "price_amount_filled": "234.19", "price_is_imputed": "True", "price_imputation_source": "country_mean", "price_amount_usd": "", "price_amount_usd_filled": "234.1938", "fx_rate_local_per_usd": "1.0", "fx_source": "default_1usd", "information_text": "", "description_text": "", "features_text": "", "specifications_text": "", "benefits_text": "", "details_text": "", "other_sections": "", "sections": {}, "txt_path": "dataset/txt_limpios/1385.txt", "html_path": "dataset/paginas_descargadas/1385.html", "es_status": "EN", "category_canonical": "sin_categoria", "decision": "discard", "match_score": 0.3, "reasons": "no_category_detected;price_parse_failed"}
{"source_id": "1386", "title": "Horarios de entrega", "description": "", "breadcrumbs": "LISTA > 160GR", "price_raw": "23.0", "currency_raw": "", "url": "", "seller": "Desconocido", "availability": "unknown", "country": "UNKNOWN", "product_name": "Horarios de entrega", "brand": "LISTA", "reference": "", "unit": "160GR", "price_amount": 23.0, "price_currency": "", "price_symbol": "", "price_text": "23", "price_amount_filled": "23.0", "price_is_imputed": "False", "price_imputation_source": "original", "price_amount_usd": "23.0", "price_amount_usd_filled": "23.0", "fx_rate_local_per_usd": "1.0", "fx_source": "default_1usd", "information_text": "", "description_text": "", "features_text": "", "specifications_text": "", "benefits_text": "", "details_text": "", "other_sections": "", "sections": {}, "txt_path": "dataset/txt_limpios/1386.txt", "html_path": "dataset/paginas_descargadas/1386.html", "es_status": "EN", "category_canonical": "sin_categoria", "decision": "discard", "match_score": 0.3, "reasons": "no_category_detected"}
{"source_id": "1387", "title": "Horarios de entrega", "description": "", "breadcrumbs": "LISTA > 170GR", "price_raw": "1.0", "currency_raw": "", "url": "", "seller": "Desconocido", "availability": "unknown", "country": "UNKNOWN", "product_name": "Horarios de entrega", "brand": "LISTA", "reference": "", "unit": "170GR", "price_amount": 1.0, "price_currency": "", "price_symbol": "", "price_text": "1", "price_amount_filled": "1.0", "price_is_imputed": "False", "price_imputation_source": "original", "price_amount_usd": "1.0", "price_amount_usd_filled": "1.0", "fx_rate_local_per_usd": "1.0", "fx_source": "default_1usd", "information_text": "", "description_text": "", "features_text": "", "specifications_text": "", "benefits_text": "", "details_text": "", "other_sections": "", "sections": {}, "txt_path": "dataset/txt_limpios/1387.txt", "html_path": "dataset/paginas_descargadas/1387.html", "es_status": "EN", "category_canonical": "sin_categoria", "decision": "discard", "match_score": 0.3, "reasons": "no_category_detected"}
{"source_id": "1388", "title": "Horarios de entrega", "description": "", "breadcrumbs": "LISTA > 1 KG", "price_raw": "", "currency_raw": "", "url": "", "seller": "Desconocido", "availability": "unknown", "country": "UNKNOWN", "product_name": "Horarios de entrega", "brand": "LISTA", "reference": "", "unit": "1 KG", "price_amount": null, "price_currency": "", "price_symbol": "", "price_text": "", "price_amount_filled": "234.19", "price_is_imputed": "True", "price_imputation_source": "country_mean", "price_amount_usd": "", "price_amount_usd_filled": "234.1938", "fx_rate_local_per_usd": "1.0", "fx_source": "default_1usd", "information_text": "", "description_text": "", "features_text": "", "specifications_text": "", "benefits_text": "", "details_text": "", "other_sections": "", "sections": {}, "txt_path": "dataset/txt_limpios/1388.txt", "html_path": "dataset/paginas_descargadas/1388.html", "es_status": "EN", "category_canonical": "sin_categoria", "decision": "discard", "match_score": 0.3, "reasons": "no_category_detected;price_parse_failed"}
{"source_id": "1389", "title": "Horarios de entrega", "description": "", "breadcrumbs": "LISTA > 1 KG", "price_raw": "1.0", "currency_raw": "", "url": "", "seller": "Desconocido", "availability": "unknown", "country": "UNKNOWN", "product_name": "Horarios de entrega", "brand": "LISTA", "reference": "", "unit": "1 KG", "price_amount": 1.0, "price_currency": "", "price_symbol": "", "price_text": "1", "price_amount_filled": "1.0", "price_is_imputed": "False", "price_imputation_source": "original", "price_amount_usd": "1.0", "price_amount_usd_filled": "1.0", "fx_rate_local_per_usd": "1.0", "fx_source": "default_1usd", "information_text": "", "description_text": "", "features_text": "", "specifications_text": "", "benefits_text": "", "details_text": "", "other_sections": "", "sections": {}, "txt_path": "dataset/txt_limpios/1389.txt", "html_path": "dataset/paginas_descargadas/1389.html", "es_status": "EN", "category_canonical": "sin_categoria", "decision": "discard", "match_score": 0.3, "reasons": "no_category_detected"}
{"source_id": "1390", "title": "Horarios de entrega", "description": "", "breadcrumbs": "LISTA > 1.5LT", "price_raw": "100.0", "currency_raw": "", "url": "", "seller": "Desconocido", "availability": "unknown", "country": "UNKNOWN", "product_name": "Horarios de entrega", "brand": "LISTA", "reference": "", "unit": "1.5LT", "price_amount": 100.0, "price_currency": "", "price_symbol": "", "price_text": "100", "price_amount_filled": "100.0", "price_is_imputed": "False", "price_imputation_source": "original", "price_amount_usd": "100.0", "price_amount_usd_filled": "100.0", "fx_rate_local_per_usd": "1.0", "fx_source": "default_1usd", "information_text": "", "description_text": "", "features_text": "", "specifications_text": "", "benefits_text": "", "details_text": "", "other_sections": "", "sections": {}, "txt_path": "dataset/txt_limpios/1390.txt", "html_path": "dataset/paginas_descargadas/1390.html", "es_status": "EN", "category_canonical": "sin_categoria", "decision": "discard", "match_score": 0.3, "reasons": "no_category_detected"}
{"source_id": "1391", "title": "Horarios de entrega", "description": "", "breadcrumbs": "LISTA > 1LT", "price_raw": "", "currency_raw": "", "url": "", "seller": "Desconocido", "availability": "unknown", "country": "UNKNOWN", "product_name": "Horarios de entrega", "brand": "LISTA", "reference": "", "unit": "1LT", "price_amount": null, "price_currency": "", "price_symbol": "", "price_text": "", "price_amount_filled": "234.19", "price_is_imputed": "True", "price_imputation_source": "country_mean", "price_amount_usd": "", "price_amount_usd_filled": "234.1938", "fx_rate_local_per_usd": "1.0", "fx_source": "default_1usd", "information_text": "", "description_text": "", "features_text": "", "specifications_text": "", "benefits_text": "", "details_text": "", "other_sections": "", "sections": {}, "txt_path": "dataset/txt_limpios/1391.txt", "html_path": "dataset/paginas_descargadas/1391.html", "es_status": "EN", "category_canonical": "sin_categoria", "decision": "discard", "match_score": 0.3, "reasons": "no_category_detected;price_parse_failed"}
{"source_id": "1392", "title": "Horarios de entrega", "description": "", "breadcrumbs": "LISTA > 1 Litro", "price_raw": "", "currency_raw": "", "url": "", "seller": "Desconocido", "availability": "unknown", "country": "UNKNOWN", "product_name": "Horarios de entrega", "brand": "LISTA", "reference": "", "unit": "1 Litro", "price_amount": null, "price_currency": "", "price_symbol": "", "price_text": "", "price_amount_filled": "234.19", "price_is_imputed": "True", "price_imputation_source": "country_mean", "price_amount_usd": "", "price_amount_usd_filled": "234.1938", "fx_rate_local_per_usd": "1.0", "fx_source": "default_1usd", "information_text": "", "description_text": "", "features_text": "", "specifications_text": "", "benefits_text": "", "details_text": "", "other_sections": "", "sections": {}, "txt_path": "dataset/txt_limpios/1392.txt", "html_path": "dataset/paginas_descargadas/1392.html", "es_status": "EN", "category_canonical": "sin_categoria", "decision": "discard", "match_score": 0.3, "reasons": "no_category_detected;price_parse_failed"}
