{"source_id": "794", "title": "PAN VITAL FRUTICEREAL 500 G", "description": "Ingredientes | Componentes Nombre del producto: Pan Vital Fruticereal 500 G Descripción del producto: El Pan Vital Fruticereal de Bimbo es la opción perfecta para disfrutar en tus desayunos, meriendas los recetas favoritas. Este pan tajado con cereales y frutos deshidratados ofrece un sabor natural dulce y una textura suave que encantará a toda la familia. Fabricado con ingredientes de alta calidad, este delicioso pan es ideal para toda la familia. Además, es fácil de consumir directamente. Tamaño: 30 cm x 14 cm x 10 cm Peso: 500 g Modo fabricación: Industrial Origen: Nacional NSA-004822 Alérgenos: Contiene gluten y derivados Componentes: Harina de trigo (ingrediente principal) Cereales integrales (fuente de fibra) Frutos deshidratados (para sabor y textura) Azúcar (para endulzar) Aceite vegetal (para consistencia) Ver más También puede interesarte D1 Top 100 ARÁNDANOS 125 G Amor y amistad JAMÓN PIETRÁN ESTANDAR 230G GALLETA RELLENA DE FRUTA NATRI 145 G YOX SURTIDO FRESA Y MELOCOTÓN ALPINA 4 UND - 40... SALCHICHA RANCHERA X 230 G X 7 UD JAMON DE PAVO FINAS HIERBAS TOMATE CHERRY 250 GR YOGURT MELOCOTON LIGHT VITA LATTI 1000GR MANZANA VERDE 850 G CHAMPIÑON 250 GR", "breadcrumbs": "Unidades disponibles > 500 G", "price_raw": "500.0", "currency_raw": "", "url": "", "seller": "Desconocido", "availability": "unknown", "country": "UNKNOWN", "product_name": "PAN VITAL FRUTICEREAL 500 G", "brand": "Unidades disponibles", "reference": "", "unit": "500 G", "price_amount": 500.0, "price_currency": "", "price_symbol": "", "price_text": "500", "price_amount_filled": "500.0", "price_is_imputed": "False", "price_imputation_source": "original", "price_amount_usd": "500.0", "price_amount_usd_filled": "500.0", "fx_rate_local_per_usd": "1.0", "fx_source": "default_1usd", "information_text": "", "description_text": "Ingredientes | Componentes Nombre del producto: Pan Vital Fruticereal 500 G Descripción del producto: El Pan Vital Fruticereal de Bimbo es la opción perfecta para disfrutar en tus desayunos, meriendas los recetas favoritas. Este pan tajado con cereales y frutos deshidratados ofrece un sabor natural dulce y una textura suave que encantará a toda la familia. Fabricado con ingredientes de alta calidad, este delicioso pan es ideal para toda la familia. Además, es fácil de consumir directamente. Tamaño: 30 cm x 14 cm x 10 cm Peso: 500 g Modo fabricación: Industrial Origen: Nacional NSA-004822 Alérgenos: Contiene gluten y derivados Componentes: Harina de trigo (ingrediente principal) Cereales integrales (fuente de fibra) Frutos deshidratados (para sabor y textura) Azúcar (para endulzar) Aceite vegetal (para consistencia) Ver más También puede interesarte D1 Top 100 ARÁNDANOS 125 G Amor y amistad JAMÓN PIETRÁN ESTANDAR 230G GALLETA RELLENA DE FRUTA NATRI 145 G YOX SURTIDO FRESA Y MELOCOTÓN ALPINA 4 UND - 40... SALCHICHA RANCHERA X 230 G X 7 UD JAMON DE PAVO FINAS HIERBAS TOMATE CHERRY 250 GR YOGURT MELOCOTON LIGHT VITA LATTI 1000GR MANZANA VERDE 850 G CHAMPIÑON 250 GR", "features_text": "", "specifications_text": "", "benefits_text": "", "details_text": "", "other_sections": "", "sections": {"Descripción": ["Ingredientes | Componentes", "Nombre del Producto: Pan Vital Fruticereal 500 G", "Descripción del producto: El Pan Vital Fruticereal de Bimbo es la opción perfecta para disfrutar en tus desayunos, meriendas los recetas favoritas. Este pan tajado con cereales y frutos deshidratados ofrece un sabor natural dulce y una textura suave que encantará a toda la familia. Fabricado con ingredientes de alta calidad, este delicioso pan es ideal para toda la familia. Además, es fácil de consumir directamente.", "Tamaño: 30 cm x 14 cm x 10 cm", "Peso: 500 g", "Modo fabricación: Industrial", "Origen: Nacional", "NSA-004822", "Alérgenos: Contiene gluten y derivados", "Componentes: Harina de trigo (ingrediente principal)", "Cereales integrales (fuente de fibra)", "Frutos deshidratados (para sabor y textura)", "Azúcar (para endulzar)", "Aceite vegetal (para consistencia)", "Ver más", "También puede interesarte", "D1 Top 100", "ARÁNDANOS 125 G", "Amor y amistad", "JAMÓN PIETRÁN ESTANDAR 230G", "GALLETA RELLENA DE FRUTA NATRI 145 G", "YOX SURTIDO FRESA Y MELOCOTÓN ALPINA 4 UND - 40...", "SALCHICHA RANCHERA X 230 G X 7 UD", "JAMON DE PAVO FINAS HIERBAS", "TOMATE CHERRY 250 GR", "YOGURT MELOCOTON LIGHT VITA LATTI 1000GR", "MANZANA VERDE 850 G", "CHAMPIÑON 250 GR"]}, "txt_path": "dataset/txt_limpios/794.txt", "html_path": "dataset/paginas_descargadas/794.html", "es_status": "ET", "category_canonical": "pan", "decision": "keep", "match_score": 0.6, "reasons": "heuristic_default"}
{"source_id": "512", "title": "Panaderia Propia", "description": "", "breadcrumbs": "Panificados > 550g", "price_raw": "600.0", "currency_raw": "", "url": "", "seller": "Desconocido", "availability": "unknown", "country": "UNKNOWN", "product_name": "Panaderia Propia", "brand": "Panificados", "reference": "", "unit": "550g", "price_amount": 600.0, "price_currency": "", "price_symbol": "", "price_text": "600", "price_amount_filled": "600.0", "price_is_imputed": "False", "price_imputation_source": "original", "price_amount_usd": "600.0", "price_amount_usd_filled": "600.0", "fx_rate_local_per_usd": "1.0", "fx_source": "default_1usd", "information_text": "", "description_text": "", "features_text": "MARCA | : COTO | Últimos consultados | LLEVANDO 2 | 70% 2DA | PRECIO CON 70% 2DA | Ver planes de cuotas | Pan De Mesa Grande La Perla 550g | Pan Lacteado Blanco Rebanada Mas Grande Bimbo 610g | Pan Salvado FARGO 620g | LLEVANDO 3 | 3X2 | Leche Larga Vida Entera LAS TRES NIÑAS Ttb 1l | PRECIO CON 3X2", "specifications_text": "", "benefits_text": "", "details_text": "", "other_sections": "", "sections": {"Características": ["MARCA", ": COTO", "Últimos consultados", "LLEVANDO 2", "70% 2DA", "PRECIO CON 70% 2DA", "Ver planes de cuotas", "Pan De Mesa Grande La Perla 550g", "Pan Lacteado Blanco Rebanada Mas Grande Bimbo 610g", "Pan Salvado FARGO 620g", "LLEVANDO 3", "3X2", "Leche Larga Vida Entera LAS TRES NIÑAS Ttb 1l", "PRECIO CON 3X2"]}, "txt_path": "dataset/txt_limpios/512.txt", "html_path": "dataset/paginas_descargadas/512.html", "es_status": "EN", "category_canonical": "sin_categoria", "decision": "discard", "match_score": 0.3, "reasons": "no_category_detected"}
{"source_id": "19", "title": "Panaderia y tortilleria", "description": "Pan de caja blanco de la marca Selecto, elaborado con harina blanca. Delicioso pan de caja fresco elaborado con harina de trigo. Tú repostería favorita a la puerta de tu casa, gran variedad de pan solo en Chedraui. con.mx", "breadcrumbs": "Pan salado > 675g > 3105808", "price_raw": "", "currency_raw": "MXN", "url": "", "seller": "Chedraui", "availability": "unknown", "country": "MX", "product_name": "Panaderia y tortilleria", "brand": "Pan salado", "reference": "3105808.0", "unit": "675g", "price_amount": null, "price_currency": "MXN", "price_symbol": "", "price_text": "", "price_amount_filled": "72.0", "price_is_imputed": "True", "price_imputation_source": "category_country_mean", "price_amount_usd": "", "price_amount_usd_filled": "3.8668", "fx_rate_local_per_usd": "18.62", "fx_source": "from_mexico_cambio_dolar", "information_text": "Pan de caja blanco de la marca Selecto, elaborado con harina blanca.", "description_text": "", "features_text": "", "specifications_text": "Delicioso pan de caja fresco elaborado con harina de trigo. Tú repostería favorita a la puerta de tu casa, gran variedad de pan solo en Chedraui. con.mx", "benefits_text": "", "details_text": "", "other_sections": "", "sections": {"Información": ["Pan de caja blanco de la marca Selecto, elaborado con harina blanca."], "Especificaciones": ["Delicioso pan de caja fresco elaborado con harina de trigo. Tú repostería favorita a la puerta de tu casa, gran variedad de pan solo en Chedraui. con.mx"]}, "txt_path": "dataset/txt_limpios/19.txt", "html_path": "dataset/paginas_descargadas/19.html", "es_status": "ET", "category_canonical": "pan", "decision": "discard", "match_score": 0.6, "reasons": "price_parse_failed;price<=0"}
{"source_id": "1717", "title": "Panadería y Pastelería", "description": "Pan de Molde sin Lactosa Blanco Castaño 570g | Actualizado al: 22-04-2025 Ingredientes: Harina de trigo, Agua, Levadura, Azúcar, Aceite de maravilla, Antioxidante tocoferoles, Sal, Gluten, Propionato de calcio, Ácido láctico, Mono y diglicéridos de ácidos grasos, Ácido sórbico, Ácido ascórbico. Alérgenos: Gluten. Trazas: Leche, Soya, Nueces, Avena, Maíz, Quinua, Semillas de amapola, Semillas de calabaza, Semillas de chía, Semillas de linaza, Semillas de maravilla, Semillas de sésamo. Certificados: Libre de Huevo Libre de Peces Libre de Mariscos Libre de Maní Libre de Sulfitos Libre de Lactosa Vegano Vegetariano Porción: 2 Rebanadas (48g) Porciones por envase: 12 100g 1 Porción Energía (kCal) 261 125.3 Proteínas (g) 9.2 4.4 Grasas Totales 3.9 1.9 Grasas saturadas (g) 0,5 0,2 Grasas encontradas (g) Grasas poliinsaturadas (g) 0.9 0.4 Grasas trans (g) 0 Colesterol (mg) Hidratos de carbono disponibles 47.1 22.6 Azúcar total (g) 2.1 1 Fibra 2.7 1.3 Sodio 371 178.1 Importante: La información del empaque y/o contenido del producto final puede diferir respecto a lo que mostramos en nuestro sitio web, tanto a nivel de ingredientes, trazas, información nutricional, sellos, modo de uso y/o modo de conservación. Usted debe basarse únicamente en la información que se muestra en nuestro sitio web y siempre debe leer las etiquetas, advertencias y instrucciones antes de usar el consumo de un producto. Información obtenida de PAN MOLDE BLANCO 570 GR Productos similares Pan de Molde Blanco Familiar Ver producto Pan de Molde Multigrano Pan de Molde Blanco Castaño 400 g Pan de Molde Blanco XL Castaño 700 g Pan Molde Multigrano Jirafa -41% Pan Pita Blanco Pan de Molde Blanco Tipo Brioche Castaño 400 g Pan de Molde Miga Sándwich Blanco Castaño 440 g Pan de Molde Blanco XL Pierre 700 g -28% Pan Molde Blanco sin Gluten Pan Pita Multigrano Pan Pita Perfecto Pan Pita Light Linaza + Chía ¡Juntos son mejores! Pechuga de Pavo Sopraval 125 g Jamón Pierna -26% Jamón Pierna Artesanal Grado 1 Receta del Abuelo a Granel KG -13% Queso Ranco Laminado -17% Jamón Acaramelado Pf a Granel -16% Atún Lomitos en Agua Tottus 160 g -21% Jamón Colonial Granel Queso Ranco Laminado Granel Atún Lomitos en Aceite Tottus 160 g -11% Pack Yoghurt Batido Colun 12 x 125 g -12% Jamón Pierna Artesanal Granel -22% Jamón Artesanal Pf a Granel", "breadcrumbs": "Panadería > 570 GR", "price_raw": "2.49", "currency_raw": "", "url": "", "seller": "Desconocido", "availability": "unknown", "country": "UNKNOWN", "product_name": "Panadería y Pastelería", "brand": "Panadería", "reference": "", "unit": "570 GR", "price_amount": 2.49, "price_currency": "", "price_symbol": "", "price_text": "2.49", "price_amount_filled": "2.49", "price_is_imputed": "False", "price_imputation_source": "original", "price_amount_usd": "2.49", "price_amount_usd_filled": "2.49", "fx_rate_local_per_usd": "1.0", "fx_source": "default_1usd", "information_text": "", "description_text": "Pan de Molde sin Lactosa Blanco Castaño 570g | Actualizado al: 22-04-2025 Ingredientes: Harina de trigo, Agua, Levadura, Azúcar, Aceite de maravilla, Antioxidante tocoferoles, Sal, Gluten, Propionato de calcio, Ácido láctico, Mono y diglicéridos de ácidos grasos, Ácido sórbico, Ácido ascórbico. Alérgenos: Gluten. Trazas: Leche, Soya, Nueces, Avena, Maíz, Quinua, Semillas de amapola, Semillas de calabaza, Semillas de chía, Semillas de linaza, Semillas de maravilla, Semillas de sésamo. Certificados: Libre de Huevo Libre de Peces Libre de Mariscos Libre de Maní Libre de Sulfitos Libre de Lactosa Vegano Vegetariano Porción: 2 Rebanadas (48g) Porciones por envase: 12 100g 1 Porción Energía (kCal) 261 125.3 Proteínas (g) 9.2 4.4 Grasas Totales 3.9 1.9 Grasas saturadas (g) 0,5 0,2 Grasas encontradas (g) Grasas poliinsaturadas (g) 0.9 0.4 Grasas trans (g) 0 Colesterol (mg) Hidratos de carbono disponibles 47.1 22.6 Azúcar total (g) 2.1 1 Fibra 2.7 1.3 Sodio 371 178.1 Importante: La información del empaque y/o contenido del producto final puede diferir respecto a lo que mostramos en nuestro sitio web, tanto a nivel de ingredientes, trazas, información nutricional, sellos, modo de uso y/o modo de conservación. Usted debe basarse únicamente en la información que se muestra en nuestro sitio web y siempre debe leer las etiquetas, advertencias y instrucciones antes de usar el consumo de un producto. Información obtenida de PAN MOLDE BLANCO 570 GR Productos similares Pan de Molde Blanco Familiar Ver producto Pan de Molde Multigrano Pan de Molde Blanco Castaño 400 g Pan de Molde Blanco XL Castaño 700 g Pan Molde Multigrano Jirafa -41% Pan Pita Blanco Pan de Molde Blanco Tipo Brioche Castaño 400 g Pan de Molde Miga Sándwich Blanco Castaño 440 g Pan de Molde Blanco XL Pierre 700 g -28% Pan Molde Blanco sin Gluten Pan Pita Multigrano Pan Pita Perfecto Pan Pita Light Linaza + Chía ¡Juntos son mejores! Pechuga de Pavo Sopraval 125 g Jamón Pierna -26% Jamón Pierna Artesanal Grado 1 Receta del Abuelo a Granel KG -13% Queso Ranco Laminado -17% Jamón Acaramelado Pf a Granel -16% Atún Lomitos en Agua Tottus 160 g -21% Jamón Colonial Granel Queso Ranco Laminado Granel Atún Lomitos en Aceite Tottus 160 g -11% Pack Yoghurt Batido Colun 12 x 125 g -12% Jamón Pierna Artesanal Granel -22% Jamón Artesanal Pf a Granel", "features_text": "", "specifications_text": "", "benefits_text": "", "details_text": "", "other_sections": "", "sections": {"Descripción": ["Pan de Molde sin Lactosa Blanco Castaño", "570g | Actualizado al: 22-04-2025", "Ingredientes: Harina de trigo, Agua, Levadura, Azúcar, Aceite de maravilla, Antioxidante tocoferoles, Sal, Gluten, Propionato de calcio, Ácido láctico, Mono y diglicéridos de ácidos grasos, Ácido sórbico, Ácido ascórbico.", "Alérgenos: Gluten.", "Trazas: Leche, Soya, Nueces, Avena, Maíz, Quinua, Semillas de amapola, Semillas de calabaza, Semillas de chía, Semillas de linaza, Semillas de maravilla, Semillas de sésamo.", "Certificados: Libre de Huevo", "Libre de Peces", "Libre de Mariscos", "Libre de Maní", "Libre de Sulfitos", "Libre de Lactosa", "Vegano", "Vegetariano", "Porción: 2 Rebanadas (48g)", "Porciones por envase: 12", "100g", "1 Porción", "Energía", "(kCal)", "261", "125.3", "Proteínas", "(g)", "9.2", "4.4", "Grasas Totales", "3.9", "1.9", "Grasas saturadas (g)", "0.5", "0.2", "Grasas monoinsaturadas (g)", "Grasas poliinsaturadas (g)", "0.9", "0.4", "Grasas trans (g)", "0", "Colesterol", "(mg)", "Hidratos de carbono disponibles", "47.1", "22.6", "Azúcar total (g)", "2.1", "1", "Fibra", "2.7", "1.3", "Sodio", "371", "178.1", "Importante: La información del empaque y/o contenido del producto final puede diferir respecto a lo que mostramos en nuestro sitio web, tanto a nivel de ingredientes, trazas, información nutricional, sellos, modo de uso y/o modo de conservación. Usted debe basarse únicamente en la información que se muestra en nuestro sitio web y siempre debe leer las etiquetas, advertencias y instrucciones antes de usar el consumo de un producto.", "Información obtenida de", "PAN MOLDE BLANCO 570 GR", "Productos similares", "Pan de Molde Blanco Familiar", "Ver producto", "Pan de Molde Multigrano", "Pan de Molde Blanco Castaño 400 g", "Pan de Molde Blanco XL Castaño 700 g", "Pan Molde Multigrano Jirafa", "-41%", "Pan Pita Blanco", "Pan de Molde Blanco Tipo Brioche Castaño 400 g", "Pan de Molde Miga Sándwich Blanco Castaño 440 g", "Pan de Molde Blanco XL Pierre 700 g", "-28%", "Pan Molde Blanco sin Gluten", "Pan Pita Multigrano", "Pan Pita Perfecto", "Pan Pita Light Linaza + Chía", "¡Juntos son mejores!", "Pechuga de Pavo Cocida Sopraval 125 g", "Jamón Pierna", "-26%", "Jamón Pierna Artesanal Grado 1 Receta del Abuelo a Granel", "KG", "-13%", "Queso Ranco Laminado", "-17%", "Jamón Acaramelado Pf Granel", "-16%", "Atún Lomitos en Agua Tottus 160 g", "-21%", "Jamón Colonial Granel", "Queso Ranco Laminado Granel", "Atún Lomitos en Aceite Tottus 160 g", "-11%", "Pack Yoghurt Batido Colun 12 x 125 g", "-12%", "Jamón Pierna Artesanal Granel", "-22%", "Jamón Artesanal Pf Granel"]}, "txt_path": "dataset/txt_limpios/1717.txt", "html_path": "dataset/paginas_descargadas/1717.html", "es_status": "ET", "category_canonical": "pan", "decision": "keep", "match_score": 0.6, "reasons": "heuristic_default"}
