source_id,title,description,breadcrumbs,price_raw,currency_raw,url,seller,availability,country,product_name,brand,reference,unit,price_amount,price_currency,price_symbol,price_text,price_amount_filled,price_is_imputed,price_imputation_source,price_amount_usd,price_amount_usd_filled,fx_rate_local_per_usd,fx_source,information_text,description_text,features_text,specifications_text,benefits_text,details_text,other_sections,sections,txt_path,html_path,es_status,category_canonical,decision,match_score,reasons
117,¡Lo mejor te está esperando!,"¡Descubre el ACEITE VEGETAL DE CANOLA CAPULLO de 400 ml, un imprescindible en tu despensa! Este aceite de alta calidad es perfecto para cocinar, freír y aderezar tus platillos favoritos. Con su sabor suave y natural, eleva el | ... Ver más | Favoritos | Recomendados | Aceite Vegetal  Mimarca 800 Ml | 800 ML | Aceite Vegetal  123 1 Lt | 1 LT | Aceite Vegetal  Ave 850 Ml | 850 ML | Aceite Vegetal De Canola  Capullo 84... | 840 ML | Aceite Vegetal De Maíz  Mazola 765 M... | 765 ML | Aceite Vegetal De Canola  Capullo 40... | 400 ML | Aceite Vegetal  Kartamus 900 Ml | 900 ML | Aceite Puro De Maiz   123    1 Litro | Aceite Vegetal Comestible Aerosol  A... | 170 GR | Aceite Vegetal De Cártamo  Capullo 7... | 750 ML | Aceite Vegetal De Soya Y Canola  Sab... | -21% | Aceite Vegetal De Soya  Capullo 750 ... | Aceite Vegetal De Ajonjoli Y Soya   ... | 250 ML | Aceite De Soya  Nutrioli 850 Ml | -29% | Margarina Con Sal  Iberia 400 G | 400 GR | Mantequilla Sin Sal  La Gloria  90 G | 90 GR | Mantequilla Con Sal  La Gloria  90 G | Manteca De Cerdo   Morrell 454 G | 454 GR | Aceite De Soya  Nutrioli 400 Ml | Mantequilla Sin Sal  La Gloria 360 G | 360 GR | -24% | Margarina Con Sal  Iberia   90 G | Aceite De Soya Antigoteo  Nutrioli 7... | 700 ML | Margarina Con Sal  Chantilly 190 G | 190 GR | Manteca De Cerdo  Mybrand 454 Gramos | Aceite De Oliva Para Freir  Ines 750... | Margarina Sin Sal  Chantilly 190 G | Margarina Con Sal  Primavera  90 G | Mantequilla Con Sal  La Gloria 360 G | Sustituto De Crema Liquido Vainilla ... | 237 ML | Sustituto De Crema Liquido Avellana ... | Mes patrio Herdez | Ver más | Adobo    Doña María 235 G | Mole Doña María Almendrado En Pasta ... | Mole Doña María Almendrado Listo Par... | Mole Doña María Poblano Con Cacao En... | Mole Doña Maria Poblano Con Cacao Li... | Mole Doña Mariía Rojo En Pasta   125... | Mole En Pasta 430 Gramos   Doña Mari... | Mole Listo Para Servir  Para Servir ... | Mole Rojo En Pasta  Doña Maria 235 G | Mole Verde En Pasta  Doña Maria 230 ... | Pipián En Pasta  Doña Maria 230 G | Salsa Cacahuate Picante Cremosa   He... | Salsa Casera Con Habanero   Herdez 4... | Salsa Casera  Herdez 210 G | Salsa Guacamole 15% Mas Guacamole He...",Descarga la app > 400 Ml,25.9,,,Desconocido,unknown,UNKNOWN,¡Lo mejor te está esperando!,Descarga la app,,400 Ml,25.90,,$,$25.90,25.9,False,original,25.9,25.9,1.0,default_1usd,,,,,,"¡Descubre el ACEITE VEGETAL DE CANOLA CAPULLO de 400 ml, un imprescindible en tu despensa! Este aceite de alta calidad es perfecto para cocinar, freír y aderezar tus platillos favoritos. Con su sabor suave y natural, eleva el | ... Ver más | Favoritos | Recomendados | Aceite Vegetal  Mimarca 800 Ml | 800 ML | Aceite Vegetal  123 1 Lt | 1 LT | Aceite Vegetal  Ave 850 Ml | 850 ML | Aceite Vegetal De Canola  Capullo 84... | 840 ML | Aceite Vegetal De Maíz  Mazola 765 M... | 765 ML | Aceite Vegetal De Canola  Capullo 40... | 400 ML | Aceite Vegetal  Kartamus 900 Ml | 900 ML | Aceite Puro De Maiz   123    1 Litro | Aceite Vegetal Comestible Aerosol  A... | 170 GR | Aceite Vegetal De Cártamo  Capullo 7... | 750 ML | Aceite Vegetal De Soya Y Canola  Sab... | -21% | Aceite Vegetal De Soya  Capullo 750 ... | Aceite Vegetal De Ajonjoli Y Soya   ... | 250 ML | Aceite De Soya  Nutrioli 850 Ml | -29% | Margarina Con Sal  Iberia 400 G | 400 GR | Mantequilla Sin Sal  La Gloria  90 G | 90 GR | Mantequilla Con Sal  La Gloria  90 G | Manteca De Cerdo   Morrell 454 G | 454 GR | Aceite De Soya  Nutrioli 400 Ml | Mantequilla Sin Sal  La Gloria 360 G | 360 GR | -24% | Margarina Con Sal  Iberia   90 G | Aceite De Soya Antigoteo  Nutrioli 7... | 700 ML | Margarina Con Sal  Chantilly 190 G | 190 GR | Manteca De Cerdo  Mybrand 454 Gramos | Aceite De Oliva Para Freir  Ines 750... | Margarina Sin Sal  Chantilly 190 G | Margarina Con Sal  Primavera  90 G | Mantequilla Con Sal  La Gloria 360 G | Sustituto De Crema Liquido Vainilla ... | 237 ML | Sustituto De Crema Liquido Avellana ... | Mes patrio Herdez | Ver más | Adobo    Doña María 235 G | Mole Doña María Almendrado En Pasta ... | Mole Doña María Almendrado Listo Par... | Mole Doña María Poblano Con Cacao En... | Mole Doña Maria Poblano Con Cacao Li... | Mole Doña Mariía Rojo En Pasta   125... | Mole En Pasta 430 Gramos   Doña Mari... | Mole Listo Para Servir  Para Servir ... | Mole Rojo En Pasta  Doña Maria 235 G | Mole Verde En Pasta  Doña Maria 230 ... | Pipián En Pasta  Doña Maria 230 G | Salsa Cacahuate Picante Cremosa   He... | Salsa Casera Con Habanero   Herdez 4... | Salsa Casera  Herdez 210 G | Salsa Guacamole 15% Mas Guacamole He...",,"{""Detalles"": [""¡Descubre el ACEITE VEGETAL DE CANOLA CAPULLO de 400 ml, un imprescindible en tu despensa! Este aceite de alta calidad es perfecto para cocinar, freír y aderezar tus platillos favoritos. Con su sabor suave y natural, eleva el"", ""... Ver más"", ""Favoritos"", ""Recomendados"", ""Aceite Vegetal  Mimarca 800 Ml"", ""800 ML"", ""Aceite Vegetal  123 1 Lt"", ""1 LT"", ""Aceite Vegetal  Ave 850 Ml"", ""850 ML"", ""Aceite Vegetal De Canola  Capullo 84..."", ""840 ML"", ""Aceite Vegetal De Maíz  Mazola 765 M..."", ""765 ML"", ""Aceite Vegetal De Canola  Capullo 40..."", ""400 ML"", ""Aceite Vegetal  Kartamus 900 Ml"", ""900 ML"", ""Aceite Puro De Maiz   123    1 Litro"", ""Aceite Vegetal Comestible Aerosol  A..."", ""170 GR"", ""Aceite Vegetal De Cártamo  Capullo 7..."", ""750 ML"", ""Aceite Vegetal De Soya Y Canola  Sab..."", ""-21%"", ""Aceite Vegetal De Soya  Capullo 750 ..."", ""Aceite Vegetal De Ajonjoli Y Soya   ..."", ""250 ML"", ""Aceite De Soya  Nutrioli 850 Ml"", ""-29%"", ""Margarina Con Sal  Iberia 400 G"", ""400 GR"", ""Mantequilla Sin Sal  La Gloria  90 G"", ""90 GR"", ""Mantequilla Con Sal  La Gloria  90 G"", ""Manteca De Cerdo   Morrell 454 G"", ""454 GR"", ""Aceite De Soya  Nutrioli 400 Ml"", ""Mantequilla Sin Sal  La Gloria 360 G"", ""360 GR"", ""-24%"", ""Margarina Con Sal  Iberia   90 G"", ""Aceite De Soya Antigoteo  Nutrioli 7..."", ""700 ML"", ""Margarina Con Sal  Chantilly 190 G"", ""190 GR"", ""Manteca De Cerdo  Mybrand 454 Gramos"", ""Aceite De Oliva Para Freir  Ines 750..."", ""Margarina Sin Sal  Chantilly 190 G"", ""Margarina Con Sal  Primavera  90 G"", ""Mantequilla Con Sal  La Gloria 360 G"", ""Sustituto De Crema Liquido Vainilla ..."", ""237 ML"", ""Sustituto De Crema Liquido Avellana ..."", ""Mes patrio Herdez"", ""Ver más"", ""Adobo    Doña María 235 G"", ""Mole Doña María Almendrado En Pasta ..."", ""Mole Doña María Almendrado Listo Par..."", ""Mole Doña María Poblano Con Cacao En..."", ""Mole Doña Maria Poblano Con Cacao Li..."", ""Mole Doña Mariía Rojo En Pasta   125..."", ""Mole En Pasta 430 Gramos   Doña Mari..."", ""Mole Listo Para Servir  Para Servir ..."", ""Mole Rojo En Pasta  Doña Maria 235 G"", ""Mole Verde En Pasta  Doña Maria 230 ..."", ""Pipián En Pasta  Doña Maria 230 G"", ""Salsa Cacahuate Picante Cremosa   He..."", ""Salsa Casera Con Habanero   Herdez 4..."", ""Salsa Casera  Herdez 210 G"", ""Salsa Guacamole 15% Mas Guacamole He...""]}",dataset/txt_limpios/117.txt,dataset/paginas_descargadas/117.html,EN,aceite vegetal,keep,0.60,heuristic_default
118,¡Lo mejor te está esperando!,"Si lo que buscas es un aceite económico, práctico y rendidor, Ave en aerosol es tu mejor opción al momento de cocinar. Cocina con Ave y comprueba su calidad. | - Antiadherente | - Aceite vegetal de soya y canola, perfecto para to | ... Ver más | Ver más | Favoritos | Recomendados | Aceite Vegetal  Mimarca 800 Ml | 800 ML | Aceite Vegetal  123 1 Lt | 1 LT | 850 ML | Aceite Vegetal De Canola  Capullo 84... | 840 ML | Aceite Vegetal De Maíz  Mazola 765 M... | 765 ML | Aceite Vegetal De Canola  Capullo 40... | 400 ML | Aceite Vegetal  Kartamus 900 Ml | 900 ML | Aceite Puro De Maiz   123    1 Litro | Aceite Vegetal Comestible Aerosol  A... | 170 GR | Aceite Vegetal De Cártamo  Capullo 7... | 750 ML | Aceite Vegetal De Soya Y Canola  Sab... | -21% | Aceite Vegetal De Soya  Capullo 750 ... | Aceite Vegetal De Ajonjoli Y Soya   ... | 250 ML | Aceite De Soya  Nutrioli 850 Ml | -29% | Margarina Con Sal  Iberia 400 G | 400 GR | Mantequilla Sin Sal  La Gloria  90 G | 90 GR | Mantequilla Con Sal  La Gloria  90 G | Manteca De Cerdo   Morrell 454 G | 454 GR | Aceite De Soya  Nutrioli 400 Ml | Mantequilla Sin Sal  La Gloria 360 G | 360 GR | -24% | Margarina Con Sal  Iberia   90 G | Aceite De Soya Antigoteo  Nutrioli 7... | 700 ML | Margarina Con Sal  Chantilly 190 G | 190 GR | Manteca De Cerdo  Mybrand 454 Gramos | Aceite De Oliva Para Freir  Ines 750... | Margarina Sin Sal  Chantilly 190 G | Margarina Con Sal  Primavera  90 G | Mantequilla Con Sal  La Gloria 360 G | Sustituto De Crema Liquido Vainilla ... | 237 ML | Sustituto De Crema Liquido Avellana ... | Mes patrio Herdez | Adobo    Doña María 235 G | Mole Doña María Almendrado En Pasta ... | Mole Doña María Almendrado Listo Par... | Mole Doña María Poblano Con Cacao En... | Mole Doña Maria Poblano Con Cacao Li... | Mole Doña Mariía Rojo En Pasta   125... | Mole En Pasta 430 Gramos   Doña Mari... | Mole Listo Para Servir  Para Servir ... | Mole Rojo En Pasta  Doña Maria 235 G | Mole Verde En Pasta  Doña Maria 230 ... | Pipián En Pasta  Doña Maria 230 G | Salsa Cacahuate Picante Cremosa   He... | Salsa Casera Con Habanero   Herdez 4... | Salsa Casera  Herdez 210 G | Salsa Guacamole 15% Mas Guacamole He...",Descarga la app > 850 Ml,37.9,,,Desconocido,unknown,UNKNOWN,¡Lo mejor te está esperando!,Descarga la app,,850 Ml,37.90,,$,$37.90,37.9,False,original,37.9,37.9,1.0,default_1usd,,,,,,"Si lo que buscas es un aceite económico, práctico y rendidor, Ave en aerosol es tu mejor opción al momento de cocinar. Cocina con Ave y comprueba su calidad. | - Antiadherente | - Aceite vegetal de soya y canola, perfecto para to | ... Ver más | Ver más | Favoritos | Recomendados | Aceite Vegetal  Mimarca 800 Ml | 800 ML | Aceite Vegetal  123 1 Lt | 1 LT | 850 ML | Aceite Vegetal De Canola  Capullo 84... | 840 ML | Aceite Vegetal De Maíz  Mazola 765 M... | 765 ML | Aceite Vegetal De Canola  Capullo 40... | 400 ML | Aceite Vegetal  Kartamus 900 Ml | 900 ML | Aceite Puro De Maiz   123    1 Litro | Aceite Vegetal Comestible Aerosol  A... | 170 GR | Aceite Vegetal De Cártamo  Capullo 7... | 750 ML | Aceite Vegetal De Soya Y Canola  Sab... | -21% | Aceite Vegetal De Soya  Capullo 750 ... | Aceite Vegetal De Ajonjoli Y Soya   ... | 250 ML | Aceite De Soya  Nutrioli 850 Ml | -29% | Margarina Con Sal  Iberia 400 G | 400 GR | Mantequilla Sin Sal  La Gloria  90 G | 90 GR | Mantequilla Con Sal  La Gloria  90 G | Manteca De Cerdo   Morrell 454 G | 454 GR | Aceite De Soya  Nutrioli 400 Ml | Mantequilla Sin Sal  La Gloria 360 G | 360 GR | -24% | Margarina Con Sal  Iberia   90 G | Aceite De Soya Antigoteo  Nutrioli 7... | 700 ML | Margarina Con Sal  Chantilly 190 G | 190 GR | Manteca De Cerdo  Mybrand 454 Gramos | Aceite De Oliva Para Freir  Ines 750... | Margarina Sin Sal  Chantilly 190 G | Margarina Con Sal  Primavera  90 G | Mantequilla Con Sal  La Gloria 360 G | Sustituto De Crema Liquido Vainilla ... | 237 ML | Sustituto De Crema Liquido Avellana ... | Mes patrio Herdez | Adobo    Doña María 235 G | Mole Doña María Almendrado En Pasta ... | Mole Doña María Almendrado Listo Par... | Mole Doña María Poblano Con Cacao En... | Mole Doña Maria Poblano Con Cacao Li... | Mole Doña Mariía Rojo En Pasta   125... | Mole En Pasta 430 Gramos   Doña Mari... | Mole Listo Para Servir  Para Servir ... | Mole Rojo En Pasta  Doña Maria 235 G | Mole Verde En Pasta  Doña Maria 230 ... | Pipián En Pasta  Doña Maria 230 G | Salsa Cacahuate Picante Cremosa   He... | Salsa Casera Con Habanero   Herdez 4... | Salsa Casera  Herdez 210 G | Salsa Guacamole 15% Mas Guacamole He...",,"{""Detalles"": [""Si lo que buscas es un aceite económico, práctico y rendidor, Ave en aerosol es tu mejor opción al momento de cocinar. Cocina con Ave y comprueba su calidad."", ""- Antiadherente"", ""- Aceite vegetal de soya y canola, perfecto para to"", ""... Ver más"", ""Ver más"", ""Favoritos"", ""Recomendados"", ""Aceite Vegetal  Mimarca 800 Ml"", ""800 ML"", ""Aceite Vegetal  123 1 Lt"", ""1 LT"", ""850 ML"", ""Aceite Vegetal De Canola  Capullo 84..."", ""840 ML"", ""Aceite Vegetal De Maíz  Mazola 765 M..."", ""765 ML"", ""Aceite Vegetal De Canola  Capullo 40..."", ""400 ML"", ""Aceite Vegetal  Kartamus 900 Ml"", ""900 ML"", ""Aceite Puro De Maiz   123    1 Litro"", ""Aceite Vegetal Comestible Aerosol  A..."", ""170 GR"", ""Aceite Vegetal De Cártamo  Capullo 7..."", ""750 ML"", ""Aceite Vegetal De Soya Y Canola  Sab..."", ""-21%"", ""Aceite Vegetal De Soya  Capullo 750 ..."", ""Aceite Vegetal De Ajonjoli Y Soya   ..."", ""250 ML"", ""Aceite De Soya  Nutrioli 850 Ml"", ""-29%"", ""Margarina Con Sal  Iberia 400 G"", ""400 GR"", ""Mantequilla Sin Sal  La Gloria  90 G"", ""90 GR"", ""Mantequilla Con Sal  La Gloria  90 G"", ""Manteca De Cerdo   Morrell 454 G"", ""454 GR"", ""Aceite De Soya  Nutrioli 400 Ml"", ""Mantequilla Sin Sal  La Gloria 360 G"", ""360 GR"", ""-24%"", ""Margarina Con Sal  Iberia   90 G"", ""Aceite De Soya Antigoteo  Nutrioli 7..."", ""700 ML"", ""Margarina Con Sal  Chantilly 190 G"", ""190 GR"", ""Manteca De Cerdo  Mybrand 454 Gramos"", ""Aceite De Oliva Para Freir  Ines 750..."", ""Margarina Sin Sal  Chantilly 190 G"", ""Margarina Con Sal  Primavera  90 G"", ""Mantequilla Con Sal  La Gloria 360 G"", ""Sustituto De Crema Liquido Vainilla ..."", ""237 ML"", ""Sustituto De Crema Liquido Avellana ..."", ""Mes patrio Herdez"", ""Adobo    Doña María 235 G"", ""Mole Doña María Almendrado En Pasta ..."", ""Mole Doña María Almendrado Listo Par..."", ""Mole Doña María Poblano Con Cacao En..."", ""Mole Doña Maria Poblano Con Cacao Li..."", ""Mole Doña Mariía Rojo En Pasta   125..."", ""Mole En Pasta 430 Gramos   Doña Mari..."", ""Mole Listo Para Servir  Para Servir ..."", ""Mole Rojo En Pasta  Doña Maria 235 G"", ""Mole Verde En Pasta  Doña Maria 230 ..."", ""Pipián En Pasta  Doña Maria 230 G"", ""Salsa Cacahuate Picante Cremosa   He..."", ""Salsa Casera Con Habanero   Herdez 4..."", ""Salsa Casera  Herdez 210 G"", ""Salsa Guacamole 15% Mas Guacamole He...""]}",dataset/txt_limpios/118.txt,dataset/paginas_descargadas/118.html,EN,aceite vegetal,keep,0.60,heuristic_default
119,¡Lo mejor te está esperando!,,Descarga la app,,,,Desconocido,unknown,UNKNOWN,¡Lo mejor te está esperando!,Descarga la app,,,,,,,234.19,True,country_mean,,234.1938,1.0,default_1usd,,,,,,,,{},dataset/txt_limpios/119.txt,dataset/paginas_descargadas/119.html,EN,sin_categoria,discard,0.30,no_category_detected;price_parse_failed
120,¡Lo mejor te está esperando!,"La Leche Entera UHT MyBrand de 1 litro es la elección perfecta para una alimentación saludable y equilibrada. Con su sabor delicioso y su textura cremosa, esta leche es ideal para toda la familia. Además, su práctico envase g | ... Ver más | Ver más | Favoritos | Recomendados | -24% | Leche Entera   Lala  1.8 Lt | 1.8 LT | Leche Entera Uht   Lala    1 Lt | 1 LT | Leche Entera Uht   Lala    6 Lt | 6 LT | Leche Entera Deslactosada   Lala    ... | Leche Entera Uht   La Nacional    1 ... | Leche Entera Uht Organica  Lala 960 ... | 960 ML | Leche  Uht Deslactosada Organica  La... | Leche Entera Uht   Lyncott    1 Litr... | Leche Entera Uht   Alpura    4 Lt | 4 LT | Leche Entera   Bove 946 Ml | 946 ML | Leche Uht Deslactosada Barista  Bove... | Leche Uht Entera  Santa Clara 180 Mi... | 180 ML | Leche Entera Uht  Alpura  1.5 Litro | 1.5 LT | Crema Acida   Lala 426 Ml | 426 ML | Leche Fresca Entera   Zaragoza  1.8 ... | Leche Uht Deslactosada Semidescremad... | Leche Uht 100 Sin Lactosa Reducida E... | Leche Uht Entera         Santa Clara... | Leche Uht Deslactosada Semi  Lala  1... | Leche Fresca Lala 100 Baja En Grasas... | Leche Light   Lala  1.8 Lt | Crema   Lala 200 G | 200 GR | Leche Uht Entera Premium   Zaragoza ... | Leche Uht Deslactosada   Lala  1.5 L... | -28% | Leche Fresca   Lala 3.78 Lt | 3.78 LT | Crema   Lala 900 G | 900 GR | Leche Uht Entera   Lala  1.5 Lt | Leche Fresca   Lala    1 Lt | Mes patrio Herdez | Adobo    Doña María 235 G | Mole Doña María Almendrado En Pasta ... | Mole Doña María Almendrado Listo Par... | Mole Doña María Poblano Con Cacao En... | Mole Doña Maria Poblano Con Cacao Li... | Mole Doña Mariía Rojo En Pasta   125... | Mole En Pasta 430 Gramos   Doña Mari... | Mole Listo Para Servir  Para Servir ... | Mole Rojo En Pasta  Doña Maria 235 G | Mole Verde En Pasta  Doña Maria 230 ... | Pipián En Pasta  Doña Maria 230 G | Salsa Cacahuate Picante Cremosa   He... | Salsa Casera Con Habanero   Herdez 4... | Salsa Casera  Herdez 210 G | Salsa Guacamole 15% Mas Guacamole He...",Descarga la app > 1 Lt,27.9,,,Desconocido,unknown,UNKNOWN,¡Lo mejor te está esperando!,Descarga la app,,1 Lt,27.90,,$,$27.90,27.9,False,original,27.9,27.9,1.0,default_1usd,,,,,,"La Leche Entera UHT MyBrand de 1 litro es la elección perfecta para una alimentación saludable y equilibrada. Con su sabor delicioso y su textura cremosa, esta leche es ideal para toda la familia. Además, su práctico envase g | ... Ver más | Ver más | Favoritos | Recomendados | -24% | Leche Entera   Lala  1.8 Lt | 1.8 LT | Leche Entera Uht   Lala    1 Lt | 1 LT | Leche Entera Uht   Lala    6 Lt | 6 LT | Leche Entera Deslactosada   Lala    ... | Leche Entera Uht   La Nacional    1 ... | Leche Entera Uht Organica  Lala 960 ... | 960 ML | Leche  Uht Deslactosada Organica  La... | Leche Entera Uht   Lyncott    1 Litr... | Leche Entera Uht   Alpura    4 Lt | 4 LT | Leche Entera   Bove 946 Ml | 946 ML | Leche Uht Deslactosada Barista  Bove... | Leche Uht Entera  Santa Clara 180 Mi... | 180 ML | Leche Entera Uht  Alpura  1.5 Litro | 1.5 LT | Crema Acida   Lala 426 Ml | 426 ML | Leche Fresca Entera   Zaragoza  1.8 ... | Leche Uht Deslactosada Semidescremad... | Leche Uht 100 Sin Lactosa Reducida E... | Leche Uht Entera         Santa Clara... | Leche Uht Deslactosada Semi  Lala  1... | Leche Fresca Lala 100 Baja En Grasas... | Leche Light   Lala  1.8 Lt | Crema   Lala 200 G | 200 GR | Leche Uht Entera Premium   Zaragoza ... | Leche Uht Deslactosada   Lala  1.5 L... | -28% | Leche Fresca   Lala 3.78 Lt | 3.78 LT | Crema   Lala 900 G | 900 GR | Leche Uht Entera   Lala  1.5 Lt | Leche Fresca   Lala    1 Lt | Mes patrio Herdez | Adobo    Doña María 235 G | Mole Doña María Almendrado En Pasta ... | Mole Doña María Almendrado Listo Par... | Mole Doña María Poblano Con Cacao En... | Mole Doña Maria Poblano Con Cacao Li... | Mole Doña Mariía Rojo En Pasta   125... | Mole En Pasta 430 Gramos   Doña Mari... | Mole Listo Para Servir  Para Servir ... | Mole Rojo En Pasta  Doña Maria 235 G | Mole Verde En Pasta  Doña Maria 230 ... | Pipián En Pasta  Doña Maria 230 G | Salsa Cacahuate Picante Cremosa   He... | Salsa Casera Con Habanero   Herdez 4... | Salsa Casera  Herdez 210 G | Salsa Guacamole 15% Mas Guacamole He...",,"{""Detalles"": [""La Leche Entera UHT MyBrand de 1 litro es la elección perfecta para una alimentación saludable y equilibrada. Con su sabor delicioso y su textura cremosa, esta leche es ideal para toda la familia. Además, su práctico envase g"", ""... Ver más"", ""Ver más"", ""Favoritos"", ""Recomendados"", ""-24%"", ""Leche Entera   Lala  1.8 Lt"", ""1.8 LT"", ""Leche Entera Uht   Lala    1 Lt"", ""1 LT"", ""Leche Entera Uht   Lala    6 Lt"", ""6 LT"", ""Leche Entera Deslactosada   Lala    ..."", ""Leche Entera Uht   La Nacional    1 ..."", ""Leche Entera Uht Organica  Lala 960 ..."", ""960 ML"", ""Leche  Uht Deslactosada Organica  La..."", ""Leche Entera Uht   Lyncott    1 Litr..."", ""Leche Entera Uht   Alpura    4 Lt"", ""4 LT"", ""Leche Entera   Bove 946 Ml"", ""946 ML"", ""Leche Uht Deslactosada Barista  Bove..."", ""Leche Uht Entera  Santa Clara 180 Mi..."", ""180 ML"", ""Leche Entera Uht  Alpura  1.5 Litro"", ""1.5 LT"", ""Crema Acida   Lala 426 Ml"", ""426 ML"", ""Leche Fresca Entera   Zaragoza  1.8 ..."", ""Leche Uht Deslactosada Semidescremad..."", ""Leche Uht 100 Sin Lactosa Reducida E..."", ""Leche Uht Entera         Santa Clara..."", ""Leche Uht Deslactosada Semi  Lala  1..."", ""Leche Fresca Lala 100 Baja En Grasas..."", ""Leche Light   Lala  1.8 Lt"", ""Crema   Lala 200 G"", ""200 GR"", ""Leche Uht Entera Premium   Zaragoza ..."", ""Leche Uht Deslactosada   Lala  1.5 L..."", ""-28%"", ""Leche Fresca   Lala 3.78 Lt"", ""3.78 LT"", ""Crema   Lala 900 G"", ""900 GR"", ""Leche Uht Entera   Lala  1.5 Lt"", ""Leche Fresca   Lala    1 Lt"", ""Mes patrio Herdez"", ""Adobo    Doña María 235 G"", ""Mole Doña María Almendrado En Pasta ..."", ""Mole Doña María Almendrado Listo Par..."", ""Mole Doña María Poblano Con Cacao En..."", ""Mole Doña Maria Poblano Con Cacao Li..."", ""Mole Doña Mariía Rojo En Pasta   125..."", ""Mole En Pasta 430 Gramos   Doña Mari..."", ""Mole Listo Para Servir  Para Servir ..."", ""Mole Rojo En Pasta  Doña Maria 235 G"", ""Mole Verde En Pasta  Doña Maria 230 ..."", ""Pipián En Pasta  Doña Maria 230 G"", ""Salsa Cacahuate Picante Cremosa   He..."", ""Salsa Casera Con Habanero   Herdez 4..."", ""Salsa Casera  Herdez 210 G"", ""Salsa Guacamole 15% Mas Guacamole He...""]}",dataset/txt_limpios/120.txt,dataset/paginas_descargadas/120.html,EN,leche,keep,0.60,heuristic_default
