source_id,title,description,breadcrumbs,price_raw,currency_raw,url,seller,availability,country,product_name,brand,reference,unit,price_amount,price_currency,price_symbol,price_text,price_amount_filled,price_is_imputed,price_imputation_source,price_amount_usd,price_amount_usd_filled,fx_rate_local_per_usd,fx_source,information_text,description_text,features_text,specifications_text,benefits_text,details_text,other_sections,sections,txt_path,html_path,es_status,category_canonical,decision,match_score,reasons
526,Huevos Blanco,,Descripción del producto > 500 Gr,4241.5,,,Desconocido,unknown,UNKNOWN,Huevos Blanco,Descripción del producto,,500 Gr,4241.50,,$,"$4.241,50",4241.5,False,original,4241.5,4241.5,1.0,default_1usd,,,MARCA | : AVICOLA BRANDSEN | Últimos consultados | 15%DTO | Huevo Blanco . Coto Bli 12 Uni | PRECIO CON 15%DTO | Ver planes de cuotas | Huevo Blanco Extra 12u | 35%DTO | Espagueti FAVORITA 500 Gr | PRECIO CON 35%DTO | Fid.Lar. Sin Spaghetti Nuev Delverde Paq 500 Grm | Espagueti BARILLA Caja 500 Gr,,,,,"{""Características"": [""MARCA"", "": AVICOLA BRANDSEN"", ""Últimos consultados"", ""15%DTO"", ""Huevo Blanco . Coto Bli 12 Uni"", ""PRECIO CON 15%DTO"", ""Ver planes de cuotas"", ""Huevo Blanco Extra 12u"", ""35%DTO"", ""Espagueti FAVORITA      500 Gr"", ""PRECIO CON 35%DTO"", ""Fid.Lar.Sem Spaghetti Nuev Delverde Paq 500 Grm"", ""Espagueti BARILLA Caja 500 Gr""]}",dataset/txt_limpios/526.txt,dataset/paginas_descargadas/526.html,ET,huevo,discard,0.30,heuristic_default
908,Huevos blanco grande,Huevos grande blanco,12 un,4.11,,,Desconocido,unknown,UNKNOWN,Huevos blanco grande,12 un,,,4.11,,$,$4.11,4.11,False,original,4.11,4.11,1.0,default_1usd,,Huevos grande blanco,,,,,,"{""Descripción"": [""Huevos grande blanco""]}",dataset/txt_limpios/908.txt,dataset/paginas_descargadas/908.html,EN,huevo,discard,0.30,heuristic_default
527,Huevos Color,,Descripción del producto > 500 Gr,1596.0,,,Desconocido,unknown,UNKNOWN,Huevos Color,Descripción del producto,,500 Gr,1596.00,,$,"$1.596,00",1596.0,False,original,1596.0,1596.0,1.0,default_1usd,,,MARCA | : CARNAVE | Últimos consultados | 20%DTO | Huevo Blanco Grande 6u | PRECIO CON 20%DTO | Ver planes de cuotas | 15%DTO | Huevo Blanco . Coto Bli 12 Uni | PRECIO CON 15%DTO | Huevo Blanco Extra 12u | 35%DTO | Espagueti FAVORITA 500 Gr | PRECIO CON 35%DTO | Fid.Lar. Sin Spaghetti Nuev Delverde Paq 500 Grm,,,,,"{""Características"": [""MARCA"", "": CARNAVE"", ""Últimos consultados"", ""20%DTO"", ""Huevo Blanco Grande 6u"", ""PRECIO CON 20%DTO"", ""Ver planes de cuotas"", ""15%DTO"", ""Huevo Blanco . Coto Bli 12 Uni"", ""PRECIO CON 15%DTO"", ""Huevo Blanco Extra 12u"", ""35%DTO"", ""Espagueti FAVORITA      500 Gr"", ""PRECIO CON 35%DTO"", ""Fid.Lar.Sem Spaghetti Nuev Delverde Paq 500 Grm""]}",dataset/txt_limpios/527.txt,dataset/paginas_descargadas/527.html,ET,huevo,discard,0.30,heuristic_default
900,kem piña,,Bebida desechable > 1.5 Litro,1.39,,,Desconocido,unknown,UNKNOWN,kem piña,Bebida desechable,,1.5 Litro,1.39,,$,$1.39,1.39,False,original,1.39,1.39,1.0,default_1usd,,,,,,,,{},dataset/txt_limpios/900.txt,dataset/paginas_descargadas/900.html,EN,sin_categoria,discard,0.30,no_category_detected
909,la herradura,Huevo primera color La Herradura 30 un,Huevo primera color,,,,Desconocido,unknown,UNKNOWN,la herradura,Huevo primera color,,,,,,,234.19,True,country_mean,,234.1938,1.0,default_1usd,,Huevo primera color La Herradura 30 un,,,,,,"{""Descripción"": [""Huevo primera color La Herradura 30 un""]}",dataset/txt_limpios/909.txt,dataset/paginas_descargadas/909.html,EN,huevo,discard,0.30,price_parse_failed
11,Lacteos y huevo,Leche Entera Pasteurizada en embalaje de plástico para disfrutar con la familia,Leche > 1L > 3012021,,MXN,,Chedraui,unknown,MX,Lacteos y huevo,Leche,3012021.0,1L,,MXN,,,38.0,True,category_country_mean,,2.0408,18.62,from_mexico_cambio_dolar,Leche Entera Pasteurizada en embalaje de plástico para disfrutar con la familia,,,,,,,"{""Información"": [""Leche Entera Pasteurizada en embalaje de plástico para disfrutar con la familia""]}",dataset/txt_limpios/11.txt,dataset/paginas_descargadas/11.html,ET,leche,discard,0.60,price_parse_failed;price<=0
12,Lacteos y huevo,"Como resultado de años de experiencia y pasión por la leche, nace Selecta, la leche Premium de alpura. Su cremosidad y consistencia se disfrutan a la perfección, sin importar si se toma sola el acompañada. Selecta, para los que saben. Selecta de alclaramiento es el resultado de nuestra experiencia y pasión por la leche. Calidad que se distingue por su delicioso sabor, cremosidad y consistencia.",Leche > 1L > 3019413,,MXN,,Chedraui,unknown,MX,Lacteos y huevo,Leche,3019413.0,1L,,MXN,,,66.32,True,country_mean,,3.5617,18.62,from_mexico_cambio_dolar,"Como resultado de años de experiencia y pasión por la leche, nace Selecta, la leche Premium de alpura. Su cremosidad y consistencia se disfrutan a la perfección, sin importar si se toma sola el acompañada. Selecta, para los que saben.",,,"Selecta de alclaramiento es el resultado de nuestra experiencia y pasión por la leche. Calidad que se distingue por su delicioso sabor, cremosidad y consistencia.",,,,"{""Información"": [""Como resultado de años de experiencia y pasión por la leche, nace Selecta, la leche Premium de alpura. Su cremosidad y consistencia se disfrutan a la perfección, sin importar si se toma sola el acompañada. Selecta, para los que saben.""], ""Especificaciones"": [""Selecta de alclaramiento es el resultado de nuestra experiencia y pasión por la leche. Calidad que se distingue por su delicioso sabor, cremosidad y consistencia.""]}",dataset/txt_limpios/12.txt,dataset/paginas_descargadas/12.html,ET,huevo,discard,0.30,price_parse_failed
13,Lacteos y huevo,"Leche Alpura Clásica 4 Pack 1L La leche Alpura Clásica es fundamental en tu despensa ya que contiene proteína propia de la leche que te de la energía para comenzar tu día y que ayuda al desarrollo de músculos. Además de ser una fuente de calcio que ayuda a el crecimiento de dientes definitivos en los niños y de la fortaleza ósea en adolescentes y adultos. También contiene Vitaminas La y D que ayudan a llevar mejor el oxígeno a la sangre y a que el calcio se absorbido de mejor manera por los huesos y músculos. Disfruta de este súper alimento natural, ¡100% leche de vaca!",Leche > 4 Piezas > 3713405,,MXN,,Chedraui,unknown,MX,Lacteos y huevo,Leche,3713405.0,4 Piezas,,MXN,,,66.32,True,country_mean,,3.5617,18.62,from_mexico_cambio_dolar,Leche Alpura Clásica 4 Pack 1L,,,"La leche Alpura Clásica es fundamental en tu despensa ya que contiene proteína propia de la leche que te de la energía para comenzar tu día y que ayuda al desarrollo de músculos. Además de ser una fuente de calcio que ayuda a el crecimiento de dientes definitivos en los niños y de la fortaleza ósea en adolescentes y adultos. También contiene Vitaminas La y D que ayudan a llevar mejor el oxígeno a la sangre y a que el calcio se absorbido de mejor manera por los huesos y músculos. Disfruta de este súper alimento natural, ¡100% leche de vaca!",,,,"{""Información"": [""Leche Alpura Clásica 4 Pack 1L""], ""Especificaciones"": [""La leche Alpura Clásica es fundamental en tu despensa ya que contiene proteína propia de la leche que te de la energía para comenzar tu día y que ayuda al desarrollo de músculos. Además de ser una fuente de calcio que ayuda a el crecimiento de dientes definitivos en los niños y de la fortaleza ósea en adolescentes y adultos. También contiene Vitaminas La y D que ayudan a llevar mejor el oxígeno a la sangre y a que el calcio se absorbido de mejor manera por los huesos y músculos. Disfruta de este súper alimento natural, ¡100% leche de vaca!""]}",dataset/txt_limpios/13.txt,dataset/paginas_descargadas/13.html,ET,descartado,discard,0.10,excluded_keyword
14,Lacteos y huevo,"Leche entera ultrapasteurizada añadida con vitaminas A y D Santa Clara 1L tetra brick Disfruta del sabor de la leche entera Santa Clara, elaborada con leche 100% pura de vaca. Empaque tetrapack de 1lt.",Leche > 1L > 3019421,37.0,MXN,,Chedraui,unknown,MX,Lacteos y huevo,Leche,3019421.0,1L,37.00,MXN,$,$37.00,37.0,False,original,1.9871,1.9871,18.62,from_mexico_cambio_dolar,Leche entera ultrapasteurizada adicionada con vitaminas A y D Santa Clara 1L tetra brick,,Con leche 100% de vaca y ultrapasteurizada con vapor. | Añadido con vitaminas A y D3 | Contiene calcio | Refrigérese después de abrir,"Disfruta del sabor de la leche entera Santa Clara, elaborada con leche 100% pura de vaca. Empaque tetrapack de 1lt.",,,,"{""Información"": [""Leche entera ultrapasteurizada adicionada con vitaminas A y D Santa Clara 1L tetra brick""], ""Características"": [""Con leche 100% de vaca y ultrapasteurizada con vapor."", ""Adicionado con vitaminas A y D3"", ""Contiene calcio"", ""Refrigérese después de abrir""], ""Especificaciones"": [""Disfruta del sabor de la leche entera Santa Clara, elaborada con leche 100% pura de vaca. Empaque tetrapack de 1lt.""]}",dataset/txt_limpios/14.txt,dataset/paginas_descargadas/14.html,ET,leche,keep,0.60,heuristic_default
15,Lacteos y huevo,"Leche Entera Ultrapasteurizada Es un producto de alta calidad y gran sabor, Ideal para hacer preparación de café con un exquisito sabor cremoso con el cuerpo y textura deseados igual que en una cafetería.",Leche > 946ml > 3804250,39.0,MXN,,Chedraui,unknown,MX,Lacteos y huevo,Leche,3804250.0,946ml,39.00,MXN,$,$39.00,39.0,False,original,2.0945,2.0945,18.62,from_mexico_cambio_dolar,Leche Entera Ultrapasteurizada,,Ultrapasteurizada | Delicioso sabor | Cremoso,"Es un producto de alta calidad y gran sabor, Ideal para hacer preparación de café con un exquisito sabor cremoso con el cuerpo y textura deseados igual que en una cafetería.",,,,"{""Información"": [""Leche Entera Ultrapasteurizada""], ""Características"": [""Ultrapasteurizada"", ""Delicioso sabor"", ""Cremoso""], ""Especificaciones"": [""Es un producto de alta calidad y gran sabor, Ideal para hacer preparación de café con un exquisito sabor cremoso con el cuerpo y textura deseados igual que en una cafetería.""]}",dataset/txt_limpios/15.txt,dataset/paginas_descargadas/15.html,ET,leche,keep,0.60,heuristic_default
28,Lacteos y huevo,"Huevo Blanco fresco de gallina seleccionado 30 piezas. El complemento y ingrediente imprescindible de las recetas familiares. Ideal para su consumo en cualquier momento del día. Huevo Blanco 30 piezas Bachoco. Huevo fresco de gallina seleccionado. El complemento y ingrediente imprescindible de las recetas familiares. Ideal para su consumo en cualquier momento del día. Alto en proteína. Su sabor y frescura te encantarán. Te sugerimos servirlo en el desayuno, la comida la escena y disfrutarlos con tus familiares o amigos. | Instrucciones para cocinar: Se recomienda su consumo totalmente cocido | Método de conservación: Mantener en un lugar fresco y seco.",Huevos > 30 piezas > 3101196,106.0,MXN,,Chedraui,unknown,MX,Lacteos y huevo,Huevos,3101196.0,30 piezas,106.00,MXN,$,$106.00,106.0,False,original,5.6928,5.6928,18.62,from_mexico_cambio_dolar,Huevo Blanco fresco de gallina seleccionado 30 piezas. El complemento y ingrediente imprescindible de las recetas familiares. Ideal para su consumo en cualquier momento del día.,,Fresco | Alimento rico en vitaminas | Alimento rico en proteínas | Fuente de calcio,"Huevo Blanco 30 piezas Bachoco. Huevo fresco de gallina seleccionado. El complemento y ingrediente imprescindible de las recetas familiares. Ideal para su consumo en cualquier momento del día. Alto en proteína. Su sabor y frescura te encantarán. Te sugerimos servirlo en el desayuno, la comida la escena y disfrutarlos con tus familiares o amigos. | Instrucciones para cocinar: Se recomienda su consumo totalmente cocido | Método de conservación: Mantener en un lugar fresco y seco.",,,,"{""Información"": [""Huevo Blanco fresco de gallina seleccionado 30 piezas. El complemento y ingrediente imprescindible de las recetas familiares. Ideal para su consumo en cualquier momento del día.""], ""Características"": [""Fresco"", ""Alimento rico en vitaminas"", ""Alimento rico en proteínas"", ""Fuente de calcio""], ""Especificaciones"": [""Huevo Blanco 30 piezas Bachoco. Huevo fresco de gallina seleccionado. El complemento y ingrediente imprescindible de las recetas familiares. Ideal para su consumo en cualquier momento del día. Alto en proteína. Su sabor y frescura te encantarán. Te sugerimos servirlo en el desayuno, la comida la escena y disfrutarlos con tus familiares o amigos."", ""Instrucciones para cocinar: Se recomienda su consumo totalmente cocido"", ""Método de conservación: Mantener en un lugar fresco y seco.""]}",dataset/txt_limpios/28.txt,dataset/paginas_descargadas/28.html,ET,huevo,discard,0.30,heuristic_default
29,Lacteos y huevo,"Prepara  infinidad de postres, desayunos, comidas y cenas con Huevo San Juan, lleva a casa un alimento completo, nutritivo y fresco para tu familia.",Huevos > 30 Piezas > 3101215,87.5,MXN,,Chedraui,unknown,MX,Lacteos y huevo,Huevos,3101215.0,30 Piezas,87.50,MXN,$,$87.50,87.5,False,original,4.6992,4.6992,18.62,from_mexico_cambio_dolar,,,El único huevo en México con un código de frescura. | En tu tienda en menos de 36 horas después de su postura. | Comprueba su calidad sin abrir el empaque | Cuidamos sus nutrientes desde la alimentación de nuestras gallinas.,"Prepara  infinidad de postres, desayunos, comidas y cenas con Huevo San Juan, lleva a casa un alimento completo, nutritivo y fresco para tu familia.",,,,"{""Características"": [""El único huevo en México con un código de frescura."", ""En tu tienda en menos de 36 horas después de su postura."", ""Comprueba su calidad sin abrir el empaque"", ""Cuidamos sus nutrientes desde la alimentación de nuestras gallinas.""], ""Especificaciones"": [""Prepara  infinidad de postres, desayunos, comidas y cenas con Huevo San Juan, lleva a casa un alimento completo, nutritivo y fresco para tu familia.""]}",dataset/txt_limpios/29.txt,dataset/paginas_descargadas/29.html,EN,huevo,discard,0.30,heuristic_default
30,Lacteos y huevo,"30 Huevos Blancos Tehuacán para preparar ricos alimentos para toda la familia Huevo pero Fresco, Disfruta lo Natural, Ideal para preparar los Mejores Alimentos para Disfrutar con toda tu Familia",Huevos > 30 Piezas > 3101222,,MXN,,Chedraui,unknown,MX,Lacteos y huevo,Huevos,3101222.0,30 Piezas,,MXN,,,66.32,True,country_mean,,3.5617,18.62,from_mexico_cambio_dolar,30 Huevos Blancos Tehuacán para preparar ricos alimentos para toda la familia,,"Disfruta lo natural | Practico | Rico, nutritivo","Huevo mas Fresco, Disfruta lo Natural, Ideal para Preparar los Mejores Alimentos para Disfrutar con Toda tu Familia",,,,"{""Información"": [""30 Huevos Blancos Tehuacán para preparar ricos alimentos para toda la familia""], ""Características"": [""Disfruta lo natural"", ""Practico"", ""Rico, nutritivo""], ""Especificaciones"": [""Huevo mas Fresco, Disfruta lo Natural, Ideal para Preparar los Mejores Alimentos para Disfrutar con Toda tu Familia""]}",dataset/txt_limpios/30.txt,dataset/paginas_descargadas/30.html,ET,huevo,discard,0.30,price_parse_failed
32,Lacteos y huevo,Encuentra todo lo que necesitas para tu despensa en tu tienda online Chedraui.com.mx. Recibe en casa gracias al servicio a domicilio. Descarga la app.,Huevos > 30 Piezas > 3793290,190.0,MXN,,Chedraui,unknown,MX,Lacteos y huevo,Huevos,3793290.0,30 Piezas,190.00,MXN,$,$190.00,190.0,False,original,10.2041,10.2041,18.62,from_mexico_cambio_dolar,,,Menos grasa saturada | Disfruta en una variedad de recetas,Encuentra todo lo que necesitas para tu despensa en tu tienda online Chedraui.com.mx. Recibe en casa gracias al servicio a domicilio. Descarga la app.,,,,"{""Características"": [""Menos grasa saturada"", ""Disfruta en una variedad de recetas""], ""Especificaciones"": [""Encuentra todo lo que necesitas para tu despensa en tu tienda online Chedraui.com.mx. Recibe en casa gracias al servicio a domicilio. Descarga la app.""]}",dataset/txt_limpios/32.txt,dataset/paginas_descargadas/32.html,EN,descartado,discard,0.10,excluded_keyword
795,LECHE EQUILIBRIO TETRAPAK UHTLATTI 900ML,"Ingredientes | Componentes Nombre del producto: Leche Equilibrio UHT 900 mL - Latti Descripción del producto: La Leche Equilibrio UHT de Latti, en presentación de 900 mL, viene en envase Tetra Pak. Es una leche semidescremada de larga vida, ideal para uso diario gracias a su embalaje práctico y duradero. Tamaño: 15 cm x 12 cm Peso: 900 mL Modo de fabricación: Industrial Origen: Nacional RSA-0026943-2023 Alergenos: Contiene proteína láctea. Se produce en una planta que procesa avena, nueces y soja. Componentes: Leche semidescremada estandarizada Estabilizante (Tripolifosfato de sodio) ¡Queremos que tengas la mejor experiencia! Si tienes dudas sobre este producto el contenido, te invitamos a consultar nuestros Términos y condiciones para conocer malas sobre los reembolsos y nuestras políticas de reembolso. Ver más También puede interesarte ACEITE VEGETAL IMATÁ 3.000 ML HUEVO TIPO A SOL NACIENTE 30 UND ARROZ ESTÁNDAR ALBAR 2500G PANELA PASTILLA 1000 G ARROZ DIANA 500 G PAN TAJADO BLANCO HORNEADITOS 450 GRS Amor y amistad SALCHICHA TRADICIONAL VIANDE 400 G ACEITE VEGETAL IMATÁ 900 ML ARROZ ECONÓMICO ALBAR 2000 GRS",Unidades disponibles > 900ML,900.0,,,Desconocido,unknown,UNKNOWN,LECHE EQUILIBRIO TETRAPAK UHTLATTI 900ML,Unidades disponibles,,900ML,900.00,,,900,900.0,False,original,900.0,900.0,1.0,default_1usd,,"Ingredientes | Componentes Nombre del producto: Leche Equilibrio UHT 900 mL - Latti Descripción del producto: La Leche Equilibrio UHT de Latti, en presentación de 900 mL, viene en envase Tetra Pak. Es una leche semidescremada de larga vida, ideal para uso diario gracias a su embalaje práctico y duradero. Tamaño: 15 cm x 12 cm Peso: 900 mL Modo de fabricación: Industrial Origen: Nacional RSA-0026943-2023 Alergenos: Contiene proteína láctea. Se produce en una planta que procesa avena, nueces y soja. Componentes: Leche semidescremada estandarizada Estabilizante (Tripolifosfato de sodio) ¡Queremos que tengas la mejor experiencia! Si tienes dudas sobre este producto el contenido, te invitamos a consultar nuestros Términos y condiciones para conocer malas sobre los reembolsos y nuestras políticas de reembolso. Ver más También puede interesarte ACEITE VEGETAL IMATÁ 3.000 ML HUEVO TIPO A SOL NACIENTE 30 UND ARROZ ESTÁNDAR ALBAR 2500G PANELA PASTILLA 1000 G ARROZ DIANA 500 G PAN TAJADO BLANCO HORNEADITOS 450 GRS Amor y amistad SALCHICHA TRADICIONAL VIANDE 400 G ACEITE VEGETAL IMATÁ 900 ML ARROZ ECONÓMICO ALBAR 2000 GRS",,,,,,"{""Descripción"": [""Ingredientes | Componentes"", ""Nombre del producto: Leche Equilibrio UHT 900 mL - Latti"", ""Descripción del producto: La Leche Equilibrio UHT de Latti, en presentación de 900 mL, viene en envase Tetra Pak. Es una leche semidescremada de larga vida, ideal para uso diario gracias a su embalaje práctico y duradero."", ""Tamaño: 15 cm x 12 cm"", ""Peso: 900 mL"", ""Modo de fabricación: Industrial"", ""Origen: Nacional"", ""RSA-0026943-2023"", ""Alergenos: contiene proteína láctea. Se produce en una planta que procesa avena, nueces y soja."", ""Componentes: Leche semidescremada estandarizada"", ""Estabilizante (Tripolifosfato de sodio)"", ""¡Queremos que tengas la mejor experiencia! Si tienes dudas sobre este producto el contenido, te invitamos a consultar nuestros Términos y condiciones para conocer malas sobre los reembolsos y nuestras políticas de reembolso."", ""Ver más"", ""También puede interesarte"", ""ACEITE VEGETAL IMATÁ 3.000 ML"", ""HUEVO TIPO A SOL NACIENTE 30 UND"", ""ARROZ ESTÁNDAR ALBAR 2500G"", ""PANELA PASTILLA 1000 G"", ""ARROZ DIANA 500 G"", ""PAN TAJADO BLANCO HORNEADITOS 450 GRS"", ""Amor y amistad"", ""SALCHICHA TRADICIONAL VIANDE 400 G"", ""ACEITE VEGETAL IMATÁ 900 ML"", ""ARROZ ECONÓMICO ALBAR 2000 GRS""]}",dataset/txt_limpios/795.txt,dataset/paginas_descargadas/795.html,ET,leche,keep,0.60,heuristic_default
1343,LECHE LA LECHERA TETRABRIK 1 L ENTERA,"Ficha técnica Leche toda la vida UHT La Lechera®. Fortificada con vitamina D, que ayuda a la absorción del calcio. Sin conservantes añadidos, fuente de calcio. ¿Deseas recibir notificaciones? Remind me later Permitir Thank you! Please check your email inbox to confirm. ¡Oops! Notifications are disabled.",Comparar > 1 L,1.39,USD,,Desconocido,unknown,US,LECHE LA LECHERA TETRABRIK 1 L ENTERA,Comparar,,1 L,1.39,USD,$,"$1,39",1.39,False,original,1.39,1.39,1.0,default_1usd,"Ficha técnica Leche toda la vida UHT La Lechera®. Fortificada con vitamina D, que ayuda a la absorción del calcio. Sin conservantes añadidos, fuente de calcio. ¿Deseas recibir notificaciones? Remind me later Permitir Thank you! Please check your email inbox to confirm. ¡Oops! Notifications are disabled.",,,,,,,"{""Información"": [""Ficha técnica"", ""Leche toda la vida UHT La Lechera®. Fortificada con vitamina D, que ayuda a la absorción del calcio. Sin conservantes añadidos, fuente de calcio."", ""¿Deseas recibir notificaciones?"", ""Remind me later"", ""Permitir"", ""Thank you! Please check your email inbox to confirm."", ""Oops! Notifications are disabled.""]}",dataset/txt_limpios/1343.txt,dataset/paginas_descargadas/1343.html,ET,leche,keep,0.60,heuristic_default
