source_id,title,description,breadcrumbs,price_raw,currency_raw,url,seller,availability,country,product_name,brand,reference,unit,price_amount,price_currency,price_symbol,price_text,price_amount_filled,price_is_imputed,price_imputation_source,price_amount_usd,price_amount_usd_filled,fx_rate_local_per_usd,fx_source,information_text,description_text,features_text,specifications_text,benefits_text,details_text,other_sections,sections,txt_path,html_path,es_status,category_canonical,decision,match_score,reasons
1717,Panadería y Pastelería,"Pan de Molde sin Lactosa Blanco Castaño 570g | Actualizado al: 22-04-2025 Ingredientes: Harina de trigo, Agua, Levadura, Azúcar, Aceite de maravilla, Antioxidante tocoferoles, Sal, Gluten, Propionato de calcio, Ácido láctico, Mono y diglicéridos de ácidos grasos, Ácido sórbico, Ácido ascórbico. Alérgenos: Gluten. Trazas: Leche, Soya, Nueces, Avena, Maíz, Quinua, Semillas de amapola, Semillas de calabaza, Semillas de chía, Semillas de linaza, Semillas de maravilla, Semillas de sésamo. Certificados: Libre de Huevo Libre de Peces Libre de Mariscos Libre de Maní Libre de Sulfitos Libre de Lactosa Vegano Vegetariano Porción: 2 Rebanadas (48g) Porciones por envase: 12 100g 1 Porción Energía (kCal) 261 125.3 Proteínas (g) 9.2 4.4 Grasas Totales 3.9 1.9 Grasas saturadas (g) 0,5 0,2 Grasas encontradas (g) Grasas poliinsaturadas (g) 0.9 0.4 Grasas trans (g) 0 Colesterol (mg) Hidratos de carbono disponibles 47.1 22.6 Azúcar total (g) 2.1 1 Fibra 2.7 1.3 Sodio 371 178.1 Importante: La información del empaque y/o contenido del producto final puede diferir respecto a lo que mostramos en nuestro sitio web, tanto a nivel de ingredientes, trazas, información nutricional, sellos, modo de uso y/o modo de conservación. Usted debe basarse únicamente en la información que se muestra en nuestro sitio web y siempre debe leer las etiquetas, advertencias y instrucciones antes de usar el consumo de un producto. Información obtenida de PAN MOLDE BLANCO 570 GR Productos similares Pan de Molde Blanco Familiar Ver producto Pan de Molde Multigrano Pan de Molde Blanco Castaño 400 g Pan de Molde Blanco XL Castaño 700 g Pan Molde Multigrano Jirafa -41% Pan Pita Blanco Pan de Molde Blanco Tipo Brioche Castaño 400 g Pan de Molde Miga Sándwich Blanco Castaño 440 g Pan de Molde Blanco XL Pierre 700 g -28% Pan Molde Blanco sin Gluten Pan Pita Multigrano Pan Pita Perfecto Pan Pita Light Linaza + Chía ¡Juntos son mejores! Pechuga de Pavo Sopraval 125 g Jamón Pierna -26% Jamón Pierna Artesanal Grado 1 Receta del Abuelo a Granel KG -13% Queso Ranco Laminado -17% Jamón Acaramelado Pf a Granel -16% Atún Lomitos en Agua Tottus 160 g -21% Jamón Colonial Granel Queso Ranco Laminado Granel Atún Lomitos en Aceite Tottus 160 g -11% Pack Yoghurt Batido Colun 12 x 125 g -12% Jamón Pierna Artesanal Granel -22% Jamón Artesanal Pf a Granel",Panadería > 570 GR,2.49,,,Desconocido,unknown,UNKNOWN,Panadería y Pastelería,Panadería,,570 GR,2.49,,,2.49,2.49,False,original,2.49,2.49,1.0,default_1usd,,"Pan de Molde sin Lactosa Blanco Castaño 570g | Actualizado al: 22-04-2025 Ingredientes: Harina de trigo, Agua, Levadura, Azúcar, Aceite de maravilla, Antioxidante tocoferoles, Sal, Gluten, Propionato de calcio, Ácido láctico, Mono y diglicéridos de ácidos grasos, Ácido sórbico, Ácido ascórbico. Alérgenos: Gluten. Trazas: Leche, Soya, Nueces, Avena, Maíz, Quinua, Semillas de amapola, Semillas de calabaza, Semillas de chía, Semillas de linaza, Semillas de maravilla, Semillas de sésamo. Certificados: Libre de Huevo Libre de Peces Libre de Mariscos Libre de Maní Libre de Sulfitos Libre de Lactosa Vegano Vegetariano Porción: 2 Rebanadas (48g) Porciones por envase: 12 100g 1 Porción Energía (kCal) 261 125.3 Proteínas (g) 9.2 4.4 Grasas Totales 3.9 1.9 Grasas saturadas (g) 0,5 0,2 Grasas encontradas (g) Grasas poliinsaturadas (g) 0.9 0.4 Grasas trans (g) 0 Colesterol (mg) Hidratos de carbono disponibles 47.1 22.6 Azúcar total (g) 2.1 1 Fibra 2.7 1.3 Sodio 371 178.1 Importante: La información del empaque y/o contenido del producto final puede diferir respecto a lo que mostramos en nuestro sitio web, tanto a nivel de ingredientes, trazas, información nutricional, sellos, modo de uso y/o modo de conservación. Usted debe basarse únicamente en la información que se muestra en nuestro sitio web y siempre debe leer las etiquetas, advertencias y instrucciones antes de usar el consumo de un producto. Información obtenida de PAN MOLDE BLANCO 570 GR Productos similares Pan de Molde Blanco Familiar Ver producto Pan de Molde Multigrano Pan de Molde Blanco Castaño 400 g Pan de Molde Blanco XL Castaño 700 g Pan Molde Multigrano Jirafa -41% Pan Pita Blanco Pan de Molde Blanco Tipo Brioche Castaño 400 g Pan de Molde Miga Sándwich Blanco Castaño 440 g Pan de Molde Blanco XL Pierre 700 g -28% Pan Molde Blanco sin Gluten Pan Pita Multigrano Pan Pita Perfecto Pan Pita Light Linaza + Chía ¡Juntos son mejores! Pechuga de Pavo Sopraval 125 g Jamón Pierna -26% Jamón Pierna Artesanal Grado 1 Receta del Abuelo a Granel KG -13% Queso Ranco Laminado -17% Jamón Acaramelado Pf a Granel -16% Atún Lomitos en Agua Tottus 160 g -21% Jamón Colonial Granel Queso Ranco Laminado Granel Atún Lomitos en Aceite Tottus 160 g -11% Pack Yoghurt Batido Colun 12 x 125 g -12% Jamón Pierna Artesanal Granel -22% Jamón Artesanal Pf a Granel",,,,,,"{""Descripción"": [""Pan de Molde sin Lactosa Blanco Castaño"", ""570g | Actualizado al: 22-04-2025"", ""Ingredientes: Harina de trigo, Agua, Levadura, Azúcar, Aceite de maravilla, Antioxidante tocoferoles, Sal, Gluten, Propionato de calcio, Ácido láctico, Mono y diglicéridos de ácidos grasos, Ácido sórbico, Ácido ascórbico."", ""Alérgenos: Gluten."", ""Trazas: Leche, Soya, Nueces, Avena, Maíz, Quinua, Semillas de amapola, Semillas de calabaza, Semillas de chía, Semillas de linaza, Semillas de maravilla, Semillas de sésamo."", ""Certificados: Libre de Huevo"", ""Libre de Peces"", ""Libre de Mariscos"", ""Libre de Maní"", ""Libre de Sulfitos"", ""Libre de Lactosa"", ""Vegano"", ""Vegetariano"", ""Porción: 2 Rebanadas (48g)"", ""Porciones por envase: 12"", ""100g"", ""1 Porción"", ""Energía"", ""(kCal)"", ""261"", ""125.3"", ""Proteínas"", ""(g)"", ""9.2"", ""4.4"", ""Grasas Totales"", ""3.9"", ""1.9"", ""Grasas saturadas (g)"", ""0.5"", ""0.2"", ""Grasas monoinsaturadas (g)"", ""Grasas poliinsaturadas (g)"", ""0.9"", ""0.4"", ""Grasas trans (g)"", ""0"", ""Colesterol"", ""(mg)"", ""Hidratos de carbono disponibles"", ""47.1"", ""22.6"", ""Azúcar total (g)"", ""2.1"", ""1"", ""Fibra"", ""2.7"", ""1.3"", ""Sodio"", ""371"", ""178.1"", ""Importante: La información del empaque y/o contenido del producto final puede diferir respecto a lo que mostramos en nuestro sitio web, tanto a nivel de ingredientes, trazas, información nutricional, sellos, modo de uso y/o modo de conservación. Usted debe basarse únicamente en la información que se muestra en nuestro sitio web y siempre debe leer las etiquetas, advertencias y instrucciones antes de usar el consumo de un producto."", ""Información obtenida de"", ""PAN MOLDE BLANCO 570 GR"", ""Productos similares"", ""Pan de Molde Blanco Familiar"", ""Ver producto"", ""Pan de Molde Multigrano"", ""Pan de Molde Blanco Castaño 400 g"", ""Pan de Molde Blanco XL Castaño 700 g"", ""Pan Molde Multigrano Jirafa"", ""-41%"", ""Pan Pita Blanco"", ""Pan de Molde Blanco Tipo Brioche Castaño 400 g"", ""Pan de Molde Miga Sándwich Blanco Castaño 440 g"", ""Pan de Molde Blanco XL Pierre 700 g"", ""-28%"", ""Pan Molde Blanco sin Gluten"", ""Pan Pita Multigrano"", ""Pan Pita Perfecto"", ""Pan Pita Light Linaza + Chía"", ""¡Juntos son mejores!"", ""Pechuga de Pavo Cocida Sopraval 125 g"", ""Jamón Pierna"", ""-26%"", ""Jamón Pierna Artesanal Grado 1 Receta del Abuelo a Granel"", ""KG"", ""-13%"", ""Queso Ranco Laminado"", ""-17%"", ""Jamón Acaramelado Pf Granel"", ""-16%"", ""Atún Lomitos en Agua Tottus 160 g"", ""-21%"", ""Jamón Colonial Granel"", ""Queso Ranco Laminado Granel"", ""Atún Lomitos en Aceite Tottus 160 g"", ""-11%"", ""Pack Yoghurt Batido Colun 12 x 125 g"", ""-12%"", ""Jamón Pierna Artesanal Granel"", ""-22%"", ""Jamón Artesanal Pf Granel""]}",dataset/txt_limpios/1717.txt,dataset/paginas_descargadas/1717.html,ET,pan,keep,0.60,heuristic_default
1719,Panadería y Pastelería,"Pan de Molde Integral Grande Pan Pierre 580g | Actualizado al: 24-02-2025 Ingredientes: Harina de trigo, Harina de trigo integral de grano entero, Agua, Levadura, Salvado de trigo, Gluten de trigo, Aceite de soya, Aceite de maravilla, Antioxidante tbhq, Sal, Azúcar, Propionato de calcio, Goma guar, Ácido láctico, Mono y diglicéridos de ácidos grasos, Estearoil lactilato de sodio, Color caramelo, Ácido sórbico, Ácido ascórbico, Gluten. Alérgenos: Gluten. Trazas: Leche, Soya, Nueces, Semillas de sésamo. Certificados: Libre de Lactosa Libre de Huevo Libre de Peces Libre de Mariscos Libre de Maní Libre de Sulfitos Porción: 2 Rebanadas (48g) Porciones por envase: 12 100g 1 Porción Energía (kCal) 244 117.1 Proteínas (g) 10.8 5.2 Grasas Totales 2.9 1.4 Grasas saturadas (g) 0.8 0.4 Grasas monoinsaturadas (g) 0.7 0.3 Grasas poliinsaturadas (g) 1.5 Grasas trans (g) 0 Colesterol (mg) Hidratos de carbono disponibles 43 20.6 Azúcares totales (g) 2 1 Fibra 5.3 2.5 Sodio 397 190.6 Importante: La información del empaque y/o contenido del producto final puede diferir respecto a lo que mostramos en nuestro sitio web, tanto a nivel de ingredientes, trazas, información nutricional, sellos, modo de uso y/o modo de conservación. Usted no debe basarse únicamente en la información que se muestra en nuestro sitio web y siempre debe leer las etiquetas, advertencias e instrucciones antes de usar o consumir un producto. Información obtenida de PAN MOLDE INTEGRAL GRANDE 580 GR PAN PIERRE Productos similares Pan de Molde Integral XL Pierre 700 g -28% Ver producto Pan de Molde Artesano Integral Pan de Molde Blanco Familiar Pan de Molde Blanco XL Pierre 700 g Pan de Molde Integral Pan Pita Integral Pan Molde High Low Pan de Molde Integral Familiar Pan de Molde Integral XL Castaño 700 g Pan Pita Perfecto Pan de Molde Integral con Prebióticos Castaño 600 g Pan de Molde Multigrano Pan Molde Multigrano Jirafa -41% Pan Molde Blanco ¡Juntos son mejores! Pechuga de Pavo Cocida Corte Pluma Receta del Abuelo 125 g Yoghurt Batido Vainilla Jamón Colonial Granel KG -11% -21% Pack Yoghurt Batido Colun 12 x 125 g -12% Jamón Artesanal Pf  a Granel Jamón Acaramelado Pf a Granel -16% Jamón Pierna Artesanal Granel -22%",Panadería > 580 GR,2.99,,,Desconocido,unknown,UNKNOWN,Panadería y Pastelería,Panadería,,580 GR,2.99,,,2.99,2.99,False,original,2.99,2.99,1.0,default_1usd,,"Pan de Molde Integral Grande Pan Pierre 580g | Actualizado al: 24-02-2025 Ingredientes: Harina de trigo, Harina de trigo integral de grano entero, Agua, Levadura, Salvado de trigo, Gluten de trigo, Aceite de soya, Aceite de maravilla, Antioxidante tbhq, Sal, Azúcar, Propionato de calcio, Goma guar, Ácido láctico, Mono y diglicéridos de ácidos grasos, Estearoil lactilato de sodio, Color caramelo, Ácido sórbico, Ácido ascórbico, Gluten. Alérgenos: Gluten. Trazas: Leche, Soya, Nueces, Semillas de sésamo. Certificados: Libre de Lactosa Libre de Huevo Libre de Peces Libre de Mariscos Libre de Maní Libre de Sulfitos Porción: 2 Rebanadas (48g) Porciones por envase: 12 100g 1 Porción Energía (kCal) 244 117.1 Proteínas (g) 10.8 5.2 Grasas Totales 2.9 1.4 Grasas saturadas (g) 0.8 0.4 Grasas monoinsaturadas (g) 0.7 0.3 Grasas poliinsaturadas (g) 1.5 Grasas trans (g) 0 Colesterol (mg) Hidratos de carbono disponibles 43 20.6 Azúcares totales (g) 2 1 Fibra 5.3 2.5 Sodio 397 190.6 Importante: La información del empaque y/o contenido del producto final puede diferir respecto a lo que mostramos en nuestro sitio web, tanto a nivel de ingredientes, trazas, información nutricional, sellos, modo de uso y/o modo de conservación. Usted no debe basarse únicamente en la información que se muestra en nuestro sitio web y siempre debe leer las etiquetas, advertencias e instrucciones antes de usar o consumir un producto. Información obtenida de PAN MOLDE INTEGRAL GRANDE 580 GR PAN PIERRE Productos similares Pan de Molde Integral XL Pierre 700 g -28% Ver producto Pan de Molde Artesano Integral Pan de Molde Blanco Familiar Pan de Molde Blanco XL Pierre 700 g Pan de Molde Integral Pan Pita Integral Pan Molde High Low Pan de Molde Integral Familiar Pan de Molde Integral XL Castaño 700 g Pan Pita Perfecto Pan de Molde Integral con Prebióticos Castaño 600 g Pan de Molde Multigrano Pan Molde Multigrano Jirafa -41% Pan Molde Blanco ¡Juntos son mejores! Pechuga de Pavo Cocida Corte Pluma Receta del Abuelo 125 g Yoghurt Batido Vainilla Jamón Colonial Granel KG -11% -21% Pack Yoghurt Batido Colun 12 x 125 g -12% Jamón Artesanal Pf  a Granel Jamón Acaramelado Pf a Granel -16% Jamón Pierna Artesanal Granel -22%",,,,,,"{""Descripción"": [""Pan de Molde Integral Grande Pan Pierre"", ""580g | Actualizado al: 24-02-2025"", ""Ingredientes: Harina de trigo, Harina de trigo integral de grano entero, Agua, Levadura, Salvado de trigo, Gluten de trigo, Aceite de soya, Aceite de maravilla, Antioxidante tbhq, Sal, Azúcar, Propionato de calcio, Goma guar, Ácido láctico, Mono y diglicéridos de ácidos grasos, Estearoil lactilato de sodio, Color caramelo, Ácido sórbico, Ácido ascórbico, Gluten."", ""Alérgenos: Gluten."", ""Trazas: Leche, Soya, Nueces, Semillas de sésamo."", ""Certificados: Libre de Lactosa"", ""Libre de Huevo"", ""Libre de Peces"", ""Libre de Mariscos"", ""Libre de Maní"", ""Libre de Sulfitos"", ""Porción: 2 Rebanadas (48g)"", ""Porciones por envase: 12"", ""100g"", ""1 Porción"", ""Energía"", ""(kCal)"", ""244"", ""117.1"", ""Proteínas"", ""(g)"", ""10.8"", ""5.2"", ""Grasas Totales"", ""2.9"", ""1.4"", ""Grasas saturadas (g)"", ""0.8"", ""0.4"", ""Grasas monoinsaturadas (g)"", ""0.7"", ""0.3"", ""Grasas poliinsaturadas (g)"", ""1.5"", ""Grasas trans (g)"", ""0"", ""Colesterol"", ""(mg)"", ""Hidratos de carbono disponibles"", ""43"", ""20.6"", ""Azúcar total (g)"", ""2"", ""1"", ""Fibra"", ""5.3"", ""2.5"", ""Sodio"", ""397"", ""190.6"", ""Importante: La información del empaque y/o contenido del producto final puede diferir respecto a lo que mostramos en nuestro sitio web, tanto a nivel de ingredientes, trazas, información nutricional, sellos, modo de uso y/o modo de conservación. Usted debe basarse únicamente en la información que se muestra en nuestro sitio web y siempre debe leer las etiquetas, advertencias y instrucciones antes de usar el consumo de un producto."", ""Información obtenida de"", ""PAN MOLDE INTEGRAL GRANDE 580 GR PAN PIERRE"", ""Productos similares"", ""Pan de Molde Integral XL Pierre 700 g"", ""-28%"", ""Ver producto"", ""Pan de Molde Artesano Integral"", ""Pan de Molde Blanco Familiar"", ""Pan de Molde Blanco XL Pierre 700 g"", ""Pan de Molde Integral"", ""Pan Pita Integral"", ""Pan Molde High Low"", ""Pan de Molde Integral Familiar"", ""Pan de Molde Integral XL Castaño 700 g"", ""Pan Pita Perfecto"", ""Pan de Molde Integral con Prebióticos Castaño 600 g"", ""Pan de Molde Multigrano"", ""Pan Molde Multigrano Jirafa"", ""-41%"", ""Pan Molde Blanco"", ""¡Juntos son mejores!"", ""Pechuga de Pavo Cocida Corte Pluma Receta del Abuelo 125 g"", ""Yoghurt Batido Vainilla"", ""Jamón Colonial Granel"", ""KG"", ""-11%"", ""-21%"", ""Pack Yoghurt Batido Colun 12 x 125 g"", ""-12%"", ""Jamón Artesanal Pf Granel"", ""Jamón Acaramelado Pf Granel"", ""-16%"", ""Jamón Pierna Artesanal Granel"", ""-22%""]}",dataset/txt_limpios/1719.txt,dataset/paginas_descargadas/1719.html,ET,pan,keep,0.60,heuristic_default
