{"source_id": "411", "title": "Meu Desconto", "description": "", "breadcrumbs": "Minha Lista > 1kg", "price_raw": "22.9", "currency_raw": "BRL", "url": "", "seller": "Desconocido", "availability": "unknown", "country": "BR", "product_name": "Meu Desconto", "brand": "Minha Lista", "reference": "", "unit": "1kg", "price_amount": 22.9, "price_currency": "BRL", "price_symbol": "R$", "price_text": "R$22,90", "price_amount_filled": "22.9", "price_is_imputed": "False", "price_imputation_source": "original", "price_amount_usd": "4.2034", "price_amount_usd_filled": "4.2034", "fx_rate_local_per_usd": "5.448", "fx_source": "from_brasil_cambio_dolar", "information_text": "", "description_text": "", "features_text": "", "specifications_text": "", "benefits_text": "", "details_text": "", "other_sections": "", "sections": {}, "txt_path": "dataset/txt_limpios/411.txt", "html_path": "dataset/paginas_descargadas/411.html", "es_status": "EN", "category_canonical": "sin_categoria", "decision": "discard", "match_score": 0.3, "reasons": "no_category_detected"}
{"source_id": "413", "title": "Meu Desconto", "description": "", "breadcrumbs": "Minha Lista > 1kg", "price_raw": "5.09", "currency_raw": "BRL", "url": "", "seller": "Desconocido", "availability": "unknown", "country": "BR", "product_name": "Meu Desconto", "brand": "Minha Lista", "reference": "", "unit": "1kg", "price_amount": 5.09, "price_currency": "BRL", "price_symbol": "R$", "price_text": "R$5,09", "price_amount_filled": "5.09", "price_is_imputed": "False", "price_imputation_source": "original", "price_amount_usd": "0.9343", "price_amount_usd_filled": "0.9343", "fx_rate_local_per_usd": "5.448", "fx_source": "from_brasil_cambio_dolar", "information_text": "", "description_text": "", "features_text": "", "specifications_text": "", "benefits_text": "", "details_text": "", "other_sections": "", "sections": {}, "txt_path": "dataset/txt_limpios/413.txt", "html_path": "dataset/paginas_descargadas/413.html", "es_status": "EN", "category_canonical": "sin_categoria", "decision": "discard", "match_score": 0.3, "reasons": "no_category_detected"}
{"source_id": "414", "title": "Meu Desconto", "description": "", "breadcrumbs": "Minha Lista > 1Kg", "price_raw": "1.0", "currency_raw": "", "url": "", "seller": "Desconocido", "availability": "unknown", "country": "UNKNOWN", "product_name": "Meu Desconto", "brand": "Minha Lista", "reference": "", "unit": "1Kg", "price_amount": 1.0, "price_currency": "", "price_symbol": "", "price_text": "1", "price_amount_filled": "1.0", "price_is_imputed": "False", "price_imputation_source": "original", "price_amount_usd": "1.0", "price_amount_usd_filled": "1.0", "fx_rate_local_per_usd": "1.0", "fx_source": "default_1usd", "information_text": "", "description_text": "", "features_text": "", "specifications_text": "", "benefits_text": "", "details_text": "", "other_sections": "", "sections": {}, "txt_path": "dataset/txt_limpios/414.txt", "html_path": "dataset/paginas_descargadas/414.html", "es_status": "EN", "category_canonical": "sin_categoria", "decision": "discard", "match_score": 0.3, "reasons": "no_category_detected"}
{"source_id": "415", "title": "Meu Desconto", "description": "", "breadcrumbs": "Minha Lista > 1Kg", "price_raw": "4.29", "currency_raw": "BRL", "url": "", "seller": "Desconocido", "availability": "unknown", "country": "BR", "product_name": "Meu Desconto", "brand": "Minha Lista", "reference": "", "unit": "1Kg", "price_amount": 4.29, "price_currency": "BRL", "price_symbol": "R$", "price_text": "R$4,29", "price_amount_filled": "4.29", "price_is_imputed": "False", "price_imputation_source": "original", "price_amount_usd": "0.7874", "price_amount_usd_filled": "0.7874", "fx_rate_local_per_usd": "5.448", "fx_source": "from_brasil_cambio_dolar", "information_text": "", "description_text": "", "features_text": "", "specifications_text": "", "benefits_text": "", "details_text": "", "other_sections": "", "sections": {}, "txt_path": "dataset/txt_limpios/415.txt", "html_path": "dataset/paginas_descargadas/415.html", "es_status": "EN", "category_canonical": "sin_categoria", "decision": "discard", "match_score": 0.3, "reasons": "no_category_detected"}
{"source_id": "416", "title": "Meu Desconto", "description": "", "breadcrumbs": "Minha Lista > 1kg", "price_raw": "4.79", "currency_raw": "BRL", "url": "", "seller": "Desconocido", "availability": "unknown", "country": "BR", "product_name": "Meu Desconto", "brand": "Minha Lista", "reference": "", "unit": "1kg", "price_amount": 4.79, "price_currency": "BRL", "price_symbol": "R$", "price_text": "R$4,79", "price_amount_filled": "4.79", "price_is_imputed": "False", "price_imputation_source": "original", "price_amount_usd": "0.8792", "price_amount_usd_filled": "0.8792", "fx_rate_local_per_usd": "5.448", "fx_source": "from_brasil_cambio_dolar", "information_text": "", "description_text": "", "features_text": "", "specifications_text": "", "benefits_text": "", "details_text": "", "other_sections": "", "sections": {}, "txt_path": "dataset/txt_limpios/416.txt", "html_path": "dataset/paginas_descargadas/416.html", "es_status": "EN", "category_canonical": "sin_categoria", "decision": "discard", "match_score": 0.3, "reasons": "no_category_detected"}
{"source_id": "417", "title": "Meu Desconto", "description": "", "breadcrumbs": "Minha Lista > 1kg", "price_raw": "7.39", "currency_raw": "BRL", "url": "", "seller": "Desconocido", "availability": "unknown", "country": "BR", "product_name": "Meu Desconto", "brand": "Minha Lista", "reference": "", "unit": "1kg", "price_amount": 7.39, "price_currency": "BRL", "price_symbol": "R$", "price_text": "R$7,39", "price_amount_filled": "7.39", "price_is_imputed": "False", "price_imputation_source": "original", "price_amount_usd": "1.3565", "price_amount_usd_filled": "1.3565", "fx_rate_local_per_usd": "5.448", "fx_source": "from_brasil_cambio_dolar", "information_text": "", "description_text": "", "features_text": "", "specifications_text": "", "benefits_text": "", "details_text": "", "other_sections": "", "sections": {}, "txt_path": "dataset/txt_limpios/417.txt", "html_path": "dataset/paginas_descargadas/417.html", "es_status": "EN", "category_canonical": "sin_categoria", "decision": "discard", "match_score": 0.3, "reasons": "no_category_detected"}
{"source_id": "418", "title": "Meu Desconto", "description": "", "breadcrumbs": "Minha Lista > 1Kg", "price_raw": "6.39", "currency_raw": "BRL", "url": "", "seller": "Desconocido", "availability": "unknown", "country": "BR", "product_name": "Meu Desconto", "brand": "Minha Lista", "reference": "", "unit": "1Kg", "price_amount": 6.39, "price_currency": "BRL", "price_symbol": "R$", "price_text": "R$6,39", "price_amount_filled": "6.39", "price_is_imputed": "False", "price_imputation_source": "original", "price_amount_usd": "1.1729", "price_amount_usd_filled": "1.1729", "fx_rate_local_per_usd": "5.448", "fx_source": "from_brasil_cambio_dolar", "information_text": "", "description_text": "", "features_text": "", "specifications_text": "", "benefits_text": "", "details_text": "", "other_sections": "", "sections": {}, "txt_path": "dataset/txt_limpios/418.txt", "html_path": "dataset/paginas_descargadas/418.html", "es_status": "EN", "category_canonical": "sin_categoria", "decision": "discard", "match_score": 0.3, "reasons": "no_category_detected"}
{"source_id": "419", "title": "Meu Desconto", "description": "", "breadcrumbs": "Minha Lista > 1kg", "price_raw": "5.29", "currency_raw": "BRL", "url": "", "seller": "Desconocido", "availability": "unknown", "country": "BR", "product_name": "Meu Desconto", "brand": "Minha Lista", "reference": "", "unit": "1kg", "price_amount": 5.29, "price_currency": "BRL", "price_symbol": "R$", "price_text": "R$5,29", "price_amount_filled": "5.29", "price_is_imputed": "False", "price_imputation_source": "original", "price_amount_usd": "0.971", "price_amount_usd_filled": "0.971", "fx_rate_local_per_usd": "5.448", "fx_source": "from_brasil_cambio_dolar", "information_text": "", "description_text": "", "features_text": "", "specifications_text": "", "benefits_text": "", "details_text": "", "other_sections": "", "sections": {}, "txt_path": "dataset/txt_limpios/419.txt", "html_path": "dataset/paginas_descargadas/419.html", "es_status": "EN", "category_canonical": "sin_categoria", "decision": "discard", "match_score": 0.3, "reasons": "no_category_detected"}
{"source_id": "420", "title": "Meu Desconto", "description": "", "breadcrumbs": "Minha Lista > 1kg", "price_raw": "1.0", "currency_raw": "", "url": "", "seller": "Desconocido", "availability": "unknown", "country": "UNKNOWN", "product_name": "Meu Desconto", "brand": "Minha Lista", "reference": "", "unit": "1kg", "price_amount": 1.0, "price_currency": "", "price_symbol": "", "price_text": "1", "price_amount_filled": "1.0", "price_is_imputed": "False", "price_imputation_source": "original", "price_amount_usd": "1.0", "price_amount_usd_filled": "1.0", "fx_rate_local_per_usd": "1.0", "fx_source": "default_1usd", "information_text": "", "description_text": "", "features_text": "", "specifications_text": "", "benefits_text": "", "details_text": "", "other_sections": "", "sections": {}, "txt_path": "dataset/txt_limpios/420.txt", "html_path": "dataset/paginas_descargadas/420.html", "es_status": "EN", "category_canonical": "sin_categoria", "decision": "discard", "match_score": 0.3, "reasons": "no_category_detected"}
{"source_id": "421", "title": "Meu Desconto", "description": "", "breadcrumbs": "Minha Lista > 1kg", "price_raw": "5.09", "currency_raw": "BRL", "url": "", "seller": "Desconocido", "availability": "unknown", "country": "BR", "product_name": "Meu Desconto", "brand": "Minha Lista", "reference": "", "unit": "1kg", "price_amount": 5.09, "price_currency": "BRL", "price_symbol": "R$", "price_text": "R$5,09", "price_amount_filled": "5.09", "price_is_imputed": "False", "price_imputation_source": "original", "price_amount_usd": "0.9343", "price_amount_usd_filled": "0.9343", "fx_rate_local_per_usd": "5.448", "fx_source": "from_brasil_cambio_dolar", "information_text": "", "description_text": "", "features_text": "", "specifications_text": "", "benefits_text": "", "details_text": "", "other_sections": "", "sections": {}, "txt_path": "dataset/txt_limpios/421.txt", "html_path": "dataset/paginas_descargadas/421.html", "es_status": "EN", "category_canonical": "sin_categoria", "decision": "discard", "match_score": 0.3, "reasons": "no_category_detected"}
{"source_id": "42", "title": "Mis listas", "description": "", "breadcrumbs": "Mis pedidos > 907 g", "price_raw": "", "currency_raw": "MXN", "url": "", "seller": "Desconocido", "availability": "unknown", "country": "MX", "product_name": "Mis listas", "brand": "Mis pedidos", "reference": "", "unit": "907 g", "price_amount": null, "price_currency": "MXN", "price_symbol": "", "price_text": "", "price_amount_filled": "66.32", "price_is_imputed": "True", "price_imputation_source": "country_mean", "price_amount_usd": "", "price_amount_usd_filled": "3.5617", "fx_rate_local_per_usd": "18.62", "fx_source": "from_mexico_cambio_dolar", "information_text": "", "description_text": "", "features_text": "", "specifications_text": "", "benefits_text": "", "details_text": "", "other_sections": "", "sections": {}, "txt_path": "dataset/txt_limpios/42.txt", "html_path": "dataset/paginas_descargadas/42.html", "es_status": "EN", "category_canonical": "sin_categoria", "decision": "discard", "match_score": 0.3, "reasons": "no_category_detected;price_parse_failed"}
{"source_id": "49", "title": "Mis listas", "description": "", "breadcrumbs": "Mis pedidos > 1 L", "price_raw": "", "currency_raw": "MXN", "url": "", "seller": "Desconocido", "availability": "unknown", "country": "MX", "product_name": "Mis listas", "brand": "Mis pedidos", "reference": "", "unit": "1 L", "price_amount": null, "price_currency": "MXN", "price_symbol": "", "price_text": "", "price_amount_filled": "66.32", "price_is_imputed": "True", "price_imputation_source": "country_mean", "price_amount_usd": "", "price_amount_usd_filled": "3.5617", "fx_rate_local_per_usd": "18.62", "fx_source": "from_mexico_cambio_dolar", "information_text": "", "description_text": "", "features_text": "", "specifications_text": "", "benefits_text": "", "details_text": "", "other_sections": "", "sections": {}, "txt_path": "dataset/txt_limpios/49.txt", "html_path": "dataset/paginas_descargadas/49.html", "es_status": "EN", "category_canonical": "sin_categoria", "decision": "discard", "match_score": 0.3, "reasons": "no_category_detected;price_parse_failed"}
{"source_id": "66", "title": "Mis listas", "description": "", "breadcrumbs": "Mis pedidos", "price_raw": "", "currency_raw": "MXN", "url": "", "seller": "Desconocido", "availability": "unknown", "country": "MX", "product_name": "Mis listas", "brand": "Mis pedidos", "reference": "", "unit": "", "price_amount": null, "price_currency": "MXN", "price_symbol": "", "price_text": "", "price_amount_filled": "66.32", "price_is_imputed": "True", "price_imputation_source": "country_mean", "price_amount_usd": "", "price_amount_usd_filled": "3.5617", "fx_rate_local_per_usd": "18.62", "fx_source": "from_mexico_cambio_dolar", "information_text": "", "description_text": "", "features_text": "", "specifications_text": "", "benefits_text": "", "details_text": "", "other_sections": "", "sections": {}, "txt_path": "dataset/txt_limpios/66.txt", "html_path": "dataset/paginas_descargadas/66.html", "es_status": "EN", "category_canonical": "sin_categoria", "decision": "discard", "match_score": 0.3, "reasons": "no_category_detected;price_parse_failed"}
{"source_id": "1616", "title": "Multi Marca", "description": "Especificaciones Técnicas Papas Huerto del Ranco, 2kg País de origen: Chile Ingredientes: Papas. Porción: 1 Unidad Regular (150g) Porciones por envase: 13 100g 1 Porción Energía (kCal) 77 115.5 Proteínas (g) 2.02 3 Grasas Totales 0.09 0.1 Hidratos de carbono disponibles 17,5 26.3 Azúcar total (g) 16.6 24.9 Sodio (mg) 6 9 Importante: La información del empaque y/o contenido del producto final puede diferir respecto a lo que mostramos en nuestro sitio web, tanto a nivel de ingredientes, trazas, información nutricional, sellos, modo de uso y/o modo de conservación. Recuerda siempre leer las etiquetas, advertencias y instrucciones antes de usar el consumo de un producto. ¿Encontraste algún error? Repórtalo aquí Ficha actualizada el 12.05.2025 por Nuestras marcas Feedback", "breadcrumbs": "Papa Malla, 2 Kg > 2 Kg", "price_raw": "2.69", "currency_raw": "", "url": "", "seller": "Desconocido", "availability": "unknown", "country": "UNKNOWN", "product_name": "Multi Marca", "brand": "Papa Malla, 2 Kg", "reference": "", "unit": "2 Kg", "price_amount": 2.69, "price_currency": "", "price_symbol": "$", "price_text": "$2.69", "price_amount_filled": "2.69", "price_is_imputed": "False", "price_imputation_source": "original", "price_amount_usd": "2.69", "price_amount_usd_filled": "2.69", "fx_rate_local_per_usd": "1.0", "fx_source": "default_1usd", "information_text": "", "description_text": "Especificaciones Técnicas Papas Huerto del Ranco, 2kg País de origen: Chile Ingredientes: Papas. Porción: 1 Unidad Regular (150g) Porciones por envase: 13 100g 1 Porción Energía (kCal) 77 115.5 Proteínas (g) 2.02 3 Grasas Totales 0.09 0.1 Hidratos de carbono disponibles 17,5 26.3 Azúcar total (g) 16.6 24.9 Sodio (mg) 6 9 Importante: La información del empaque y/o contenido del producto final puede diferir respecto a lo que mostramos en nuestro sitio web, tanto a nivel de ingredientes, trazas, información nutricional, sellos, modo de uso y/o modo de conservación. Recuerda siempre leer las etiquetas, advertencias y instrucciones antes de usar el consumo de un producto. ¿Encontraste algún error? Repórtalo aquí Ficha actualizada el 12.05.2025 por Nuestras marcas Feedback", "features_text": "", "specifications_text": "", "benefits_text": "", "details_text": "", "other_sections": "", "sections": {"Descripción": ["Especificaciones Técnicas", "Papas  Huerto del Ranco, 2kg", "País de origen: Chile", "Ingredientes: Papas.", "Porción: 1 Unidad Regular (150g)", "Porciones por envase: 13", "100g", "1 Porción", "Energía", "(kCal)", "77", "115.5", "Proteínas", "(g)", "2.02", "3", "Grasas Totales", "0.09", "0.1", "Hidratos de carbono disponibles", "17.5", "26.3", "Azúcar total (g)", "16.6", "24.9", "Sodio", "(mg)", "6", "9", "Importante: La información del empaque y/o contenido del producto final puede diferir respecto a lo que mostramos en nuestro sitio web, tanto a nivel de ingredientes, trazas, información nutricional, sellos, modo de uso y/o modo de conservación. Recuerda siempre leer las etiquetas, advertencias y instrucciones antes de usar el consumo de un producto.", "¿Qué? ¿Has encontrado algún error?", "Repórtalo aquí", "Ficha actualizada el 12.05.2025 por", "Nuestras marcas", "Feedback"]}, "txt_path": "dataset/txt_limpios/1616.txt", "html_path": "dataset/paginas_descargadas/1616.html", "es_status": "ET", "category_canonical": "papa", "decision": "keep", "match_score": 0.6, "reasons": "heuristic_default"}
{"source_id": "1023", "title": "No se puede acceder a este sitio", "description": "", "breadcrumbs": "ERR_FAILED > 200ml", "price_raw": "", "currency_raw": "", "url": "", "seller": "Desconocido", "availability": "unknown", "country": "UNKNOWN", "product_name": "No se puede acceder a este sitio", "brand": "ERR_FAILED", "reference": "", "unit": "200ml", "price_amount": null, "price_currency": "", "price_symbol": "", "price_text": "", "price_amount_filled": "234.19", "price_is_imputed": "True", "price_imputation_source": "country_mean", "price_amount_usd": "", "price_amount_usd_filled": "234.1938", "fx_rate_local_per_usd": "1.0", "fx_source": "default_1usd", "information_text": "", "description_text": "", "features_text": "", "specifications_text": "", "benefits_text": "", "details_text": "", "other_sections": "", "sections": {}, "txt_path": "dataset/txt_limpios/1023.txt", "html_path": "dataset/paginas_descargadas/1023.html", "es_status": "EN", "category_canonical": "sin_categoria", "decision": "discard", "match_score": 0.3, "reasons": "no_category_detected;price_parse_failed"}
{"source_id": "1108", "title": "No se puede acceder a este sitio", "description": "", "breadcrumbs": "ERR_FAILED > 4kg", "price_raw": "", "currency_raw": "", "url": "", "seller": "Desconocido", "availability": "unknown", "country": "UNKNOWN", "product_name": "No se puede acceder a este sitio", "brand": "ERR_FAILED", "reference": "", "unit": "4kg", "price_amount": null, "price_currency": "", "price_symbol": "", "price_text": "", "price_amount_filled": "234.19", "price_is_imputed": "True", "price_imputation_source": "country_mean", "price_amount_usd": "", "price_amount_usd_filled": "234.1938", "fx_rate_local_per_usd": "1.0", "fx_source": "default_1usd", "information_text": "", "description_text": "", "features_text": "", "specifications_text": "", "benefits_text": "", "details_text": "", "other_sections": "", "sections": {}, "txt_path": "dataset/txt_limpios/1108.txt", "html_path": "dataset/paginas_descargadas/1108.html", "es_status": "EN", "category_canonical": "sin_categoria", "decision": "discard", "match_score": 0.3, "reasons": "no_category_detected;price_parse_failed"}
{"source_id": "1175", "title": "No se puede acceder a este sitio", "description": "", "breadcrumbs": "ERR_FAILED", "price_raw": "", "currency_raw": "", "url": "", "seller": "Desconocido", "availability": "unknown", "country": "UNKNOWN", "product_name": "No se puede acceder a este sitio", "brand": "ERR_FAILED", "reference": "", "unit": "", "price_amount": null, "price_currency": "", "price_symbol": "", "price_text": "", "price_amount_filled": "234.19", "price_is_imputed": "True", "price_imputation_source": "country_mean", "price_amount_usd": "", "price_amount_usd_filled": "234.1938", "fx_rate_local_per_usd": "1.0", "fx_source": "default_1usd", "information_text": "", "description_text": "", "features_text": "", "specifications_text": "", "benefits_text": "", "details_text": "", "other_sections": "", "sections": {}, "txt_path": "dataset/txt_limpios/1175.txt", "html_path": "dataset/paginas_descargadas/1175.html", "es_status": "EN", "category_canonical": "sin_categoria", "decision": "discard", "match_score": 0.3, "reasons": "no_category_detected;price_parse_failed"}
{"source_id": "1189", "title": "No se puede acceder a este sitio", "description": "", "breadcrumbs": "ERR_FAILED > 950g", "price_raw": "", "currency_raw": "", "url": "", "seller": "Desconocido", "availability": "unknown", "country": "UNKNOWN", "product_name": "No se puede acceder a este sitio", "brand": "ERR_FAILED", "reference": "", "unit": "950g", "price_amount": null, "price_currency": "", "price_symbol": "", "price_text": "", "price_amount_filled": "234.19", "price_is_imputed": "True", "price_imputation_source": "country_mean", "price_amount_usd": "", "price_amount_usd_filled": "234.1938", "fx_rate_local_per_usd": "1.0", "fx_source": "default_1usd", "information_text": "", "description_text": "", "features_text": "", "specifications_text": "", "benefits_text": "", "details_text": "", "other_sections": "", "sections": {}, "txt_path": "dataset/txt_limpios/1189.txt", "html_path": "dataset/paginas_descargadas/1189.html", "es_status": "EN", "category_canonical": "sin_categoria", "decision": "discard", "match_score": 0.3, "reasons": "no_category_detected;price_parse_failed"}
