{"source_id": "966", "title": "Desayuno y Dulces", "description": "Café Instantáneo en Polvo Tradición Nescafé 50g | Actualizado al: 29-07-2025 Ingredientes: 100% café. Certificados: Apto para APLV Libre de Lactosa Vegano Vegetariano Libre de Soya Libre de Huevo Libre de Peces Libre de Mariscos Libre de Maní Libre de Frutas Secos Libre de Nueces Libre de Sulfitos Libre de Trigo Kosher Importante: La información del empaque y/o contenido del producto final puede diferir respecto a lo que mostramos en nuestro sitio web, tanto a nivel de ingredientes, trazas, información nutricional, sellos, modo de uso y/o modo de conservación. Usted debe basarse únicamente en la información que se muestra en nuestro sitio web y siempre debe leer las etiquetas, advertencias y instrucciones antes de usar el consumo de un producto. Información obtenida de NESCAFE TRADICIONAL 50 GRS.11261035 Productos similares Café Instantáneo Nescafe Tradición Tarro 170 g -13% Ver producto Café Instantáneo Nescafe Dolca Tarro 170 g Café Instantáneo Nescafe Tradición Tarro 400 g NESCAFE DOLCA 50 GRS. 11261175 Café Tradición Tarro -18% Café Descafeinado Nescafe 100 g Café Starbucks Medium Roast 90 g -20% Café Instantáneo Primera Selección Gold 170 g -40% Café Instantáneo Granulado Nescafe Tradición Tarro 170 g Café Starbucks Dark Roast 90 g Café Nescafe Dolca Tarro 195 g DESCAFEINADO NESCAFE 170GR Café Melitta Tradicional 250 g Café Tradición Frasco Café Liofilizado Clásico Juan Valdez 40 g -30% Café Instantáneo Gold Primera Selección 400 g Café Instantáneo Liofilizado Cruzeiro 170 g Café Instantáneo Black Roast Nescafe 170 g Café Liofilizado Crucero Equilibrado 170 gr Café Instantáneo Primera Selección Café Instatáneo Wake Up Guatemala Marley Coffee 100 g Café Instantáneo Nescafe Fina Selección 200 g Café Tentaciones Capuccino 8 Sobres ¡Juntos son mejores! Té Ceylan -33% Té Ceylán Azúcar Blanca Granulada Tottus 860 g Azúcar Blanca Granulada Iansa 1 Kg Té Ceylán Premium Supremo 50 Un Azúcar Blanca Granulada Tottus 1 Kg Azúcar Granulada Iansa 900 g -24% Sal Fina Yodada Azúcar Té Negro Ceylán Mildred 100 Un Sal Fina Yodada Tottus 1 Kg FIDEO SPAGHETTI 5 400 GRS. 101409 C -10% Carpeta Spaghetti N°5 Lucchetti 400 g Té Ceylán Premium Supremo 100 Un -12% Carpeta Espiral N°56 Lucchetti 400 g FIDEO ESPIRAL 49 400 GRS. 111112 C Carpeta Corbata N°88 FIDEO CORBATA 80 400 GRS. 101302 C FIDEO CAB/CORTO 1 400 GRS. 111109 C FIDEO TALLARIN 87 400 GRS. 101407 C Espirales -22%", "breadcrumbs": "Café > 50 g", "price_raw": "2.85", "currency_raw": "", "url": "", "seller": "Desconocido", "availability": "unknown", "country": "UNKNOWN", "product_name": "Desayuno y Dulces", "brand": "Café", "reference": "", "unit": "50 g", "price_amount": 2.85, "price_currency": "", "price_symbol": "", "price_text": "2.85", "price_amount_filled": "2.85", "price_is_imputed": "False", "price_imputation_source": "original", "price_amount_usd": "2.85", "price_amount_usd_filled": "2.85", "fx_rate_local_per_usd": "1.0", "fx_source": "default_1usd", "information_text": "", "description_text": "Café Instantáneo en Polvo Tradición Nescafé 50g | Actualizado al: 29-07-2025 Ingredientes: 100% café. Certificados: Apto para APLV Libre de Lactosa Vegano Vegetariano Libre de Soya Libre de Huevo Libre de Peces Libre de Mariscos Libre de Maní Libre de Frutas Secos Libre de Nueces Libre de Sulfitos Libre de Trigo Kosher Importante: La información del empaque y/o contenido del producto final puede diferir respecto a lo que mostramos en nuestro sitio web, tanto a nivel de ingredientes, trazas, información nutricional, sellos, modo de uso y/o modo de conservación. Usted debe basarse únicamente en la información que se muestra en nuestro sitio web y siempre debe leer las etiquetas, advertencias y instrucciones antes de usar el consumo de un producto. Información obtenida de NESCAFE TRADICIONAL 50 GRS.11261035 Productos similares Café Instantáneo Nescafe Tradición Tarro 170 g -13% Ver producto Café Instantáneo Nescafe Dolca Tarro 170 g Café Instantáneo Nescafe Tradición Tarro 400 g NESCAFE DOLCA 50 GRS. 11261175 Café Tradición Tarro -18% Café Descafeinado Nescafe 100 g Café Starbucks Medium Roast 90 g -20% Café Instantáneo Primera Selección Gold 170 g -40% Café Instantáneo Granulado Nescafe Tradición Tarro 170 g Café Starbucks Dark Roast 90 g Café Nescafe Dolca Tarro 195 g DESCAFEINADO NESCAFE 170GR Café Melitta Tradicional 250 g Café Tradición Frasco Café Liofilizado Clásico Juan Valdez 40 g -30% Café Instantáneo Gold Primera Selección 400 g Café Instantáneo Liofilizado Cruzeiro 170 g Café Instantáneo Black Roast Nescafe 170 g Café Liofilizado Crucero Equilibrado 170 gr Café Instantáneo Primera Selección Café Instatáneo Wake Up Guatemala Marley Coffee 100 g Café Instantáneo Nescafe Fina Selección 200 g Café Tentaciones Capuccino 8 Sobres ¡Juntos son mejores! Té Ceylan -33% Té Ceylán Azúcar Blanca Granulada Tottus 860 g Azúcar Blanca Granulada Iansa 1 Kg Té Ceylán Premium Supremo 50 Un Azúcar Blanca Granulada Tottus 1 Kg Azúcar Granulada Iansa 900 g -24% Sal Fina Yodada Azúcar Té Negro Ceylán Mildred 100 Un Sal Fina Yodada Tottus 1 Kg FIDEO SPAGHETTI 5 400 GRS. 101409 C -10% Carpeta Spaghetti N°5 Lucchetti 400 g Té Ceylán Premium Supremo 100 Un -12% Carpeta Espiral N°56 Lucchetti 400 g FIDEO ESPIRAL 49 400 GRS. 111112 C Carpeta Corbata N°88 FIDEO CORBATA 80 400 GRS. 101302 C FIDEO CAB/CORTO 1 400 GRS. 111109 C FIDEO TALLARIN 87 400 GRS. 101407 C Espirales -22%", "features_text": "", "specifications_text": "", "benefits_text": "", "details_text": "", "other_sections": "", "sections": {"Descripción": ["Café Instantáneo en Polvo Tradición Nescafé", "50g | Actualizado al: 29-07-2025", "Ingredientes: 100% café.", "Certificados: Apto para APLV", "Libre de Lactosa", "Vegano", "Vegetariano", "Libre de Soya", "Libre de Huevo", "Libre de Peces", "Libre de Mariscos", "Libre de Maní", "Libre de Frutos Secos", "Libre de Nueces", "Libre de Sulfitos", "Libre de Trigo", "Kosher", "Importante: La información del empaque y/o contenido del producto final puede diferir respecto a lo que mostramos en nuestro sitio web, tanto a nivel de ingredientes, trazas, información nutricional, sellos, modo de uso y/o modo de conservación. Usted debe basarse únicamente en la información que se muestra en nuestro sitio web y siempre debe leer las etiquetas, advertencias y instrucciones antes de usar el consumo de un producto.", "Información obtenida de", "NESCAFE TRADICIONAL 50 GRS.11261035", "Productos similares", "Café Instantáneo Nescafe Tradición Tarro 170 g", "-13%", "Ver producto", "Café Instantáneo Nescafe Dolca Tarro 170 g", "Café Instantáneo Nescafe Tradición Tarro 400 g", "NESCAFE DOLCA 50 GRS. 11261175", "Café Tradición Tarro", "-18%", "Café Descafeinado Nescafe 100 g", "Café Starbucks Medium Roast 90 g", "-20%", "Café Instantáneo Primera Selección Gold 170 g", "-40%", "Café Instantáneo Granulado Nescafe Tradición Tarro 170 g", "Café Starbucks Dark Roast 90 g", "Café Nescafe Dolca Tarro 195 g", "DESCAFEINADO NESCAFE 170GR", "Café Melitta Tradicional 250 g", "Café Tradición Frasco", "Café Liofilizado Clásico Juan Valdez 40 g", "-30%", "Café Instantáneo Gold Primera Selección 400 g", "Café Instantáneo Liofilizado Cruzeiro 170 g", "Café Instantáneo Black Roast Nescafe 170 g", "Café Liofilizado Crucero Equilibrado 170 gr", "Café Instantáneo Primera Selección", "Café Instatáneo Wake Up Guatemala Marley Coffee 100 g", "Café Instantáneo Nescafe Fina Selección 200 g", "Café Tentaciones Capuccino 8 Sobres", "¡Juntos son mejores!", "Té Ceylan", "-33%", "Té Ceylán", "Azúcar Blanca Granulada Tottus 860 g", "Azúcar Blanca Granulada Iansa 1 Kg", "Té Ceylán Premium Supremo 50 Un", "Azúcar Blanca Granulada Tottus 1 Kg", "Azúcar Granulada Iansa 900 g", "-24%", "Sal Fina Yodada", "Azúcar", "Té Negro Ceylán Mildred 100 Un", "Sal Fina Yodada Tottus 1 Kg", "FIDEO SPAGHETTI 5  400 GRS. 101409 C", "-10%", "Pasta Spaghetti N°5 Lucchetti 400 g", "Té Ceylán Premium Supremo 100 Un", "-12%", "Pasta Espiral N°56 Lucchetti 400 g", "FIDEO ESPIRAL 49  400 GRS. 111112 C", "Pasta Corbata N°88", "FIDEO CORBATA 80  400 GRS. 101302 C", "FIDEO CAB/CORTO 1  400 GRS. 111109 C", "FIDEO TALLARIN 87  400 GRS. 101407 C", "Espirales", "-22%"]}, "txt_path": "dataset/txt_limpios/966.txt", "html_path": "dataset/paginas_descargadas/966.html", "es_status": "ET", "category_canonical": "cafe", "decision": "keep", "match_score": 0.6, "reasons": "heuristic_default"}
{"source_id": "508", "title": "Descripción del producto", "description": "", "breadcrumbs": "MARCA > 1l", "price_raw": "50.0", "currency_raw": "", "url": "", "seller": "Desconocido", "availability": "unknown", "country": "UNKNOWN", "product_name": "Descripción del producto", "brand": "MARCA", "reference": "", "unit": "1l", "price_amount": 50.0, "price_currency": "", "price_symbol": "", "price_text": "50", "price_amount_filled": "50.0", "price_is_imputed": "False", "price_imputation_source": "original", "price_amount_usd": "50.0", "price_amount_usd_filled": "50.0", "fx_rate_local_per_usd": "1.0", "fx_source": "default_1usd", "information_text": "", "description_text": "", "features_text": "MARCA | : FARGO | Últimos consultados | LLEVANDO 3 | 3X2 | Leche Larga Vida Entera LAS TRES NIÑAS Ttb 1l | PRECIO CON 3X2 | Ver planes de cuotas | Leche Larga Vida Entera VERONICA 1l | Leche Larga Vida Entera TREGAR Ttb 1 L | Leche Entera Larga Vida Ilolay Ttb 1 Ltr | EN ACUMULABLE CON OTRAS PROMOS | Leche Entera Clasica LA SERENISIMA Sachet 1l | OFERTA", "specifications_text": "", "benefits_text": "", "details_text": "", "other_sections": "", "sections": {"Características": ["MARCA", ": FARGO", "Últimos consultados", "LLEVANDO 3", "3X2", "Leche Larga Vida Entera LAS TRES NIÑAS Ttb 1l", "PRECIO CON 3X2", "Ver planes de cuotas", "Leche Larga Vida Entera VERONICA 1l", "Leche Larga Vida Entera TREGAR Ttb 1 L", "Leche Entera Larga Vida Ilolay Ttb 1 Ltr", "NO ACUMULABLE CON OTRAS PROMOS", "Leche Entera Clasica LA SERENISIMA Sachet 1l", "OFERTA"]}, "txt_path": "dataset/txt_limpios/508.txt", "html_path": "dataset/paginas_descargadas/508.html", "es_status": "ET", "category_canonical": "sin_categoria", "decision": "discard", "match_score": 0.3, "reasons": "no_category_detected"}
{"source_id": "509", "title": "Descripción del producto", "description": "", "breadcrumbs": "MARCA > 610g", "price_raw": "6550.0", "currency_raw": "", "url": "", "seller": "Desconocido", "availability": "unknown", "country": "UNKNOWN", "product_name": "Descripción del producto", "brand": "MARCA", "reference": "", "unit": "610g", "price_amount": 6550.0, "price_currency": "", "price_symbol": "$", "price_text": "$6.550,00", "price_amount_filled": "6550.0", "price_is_imputed": "False", "price_imputation_source": "original", "price_amount_usd": "6550.0", "price_amount_usd_filled": "6550.0", "fx_rate_local_per_usd": "1.0", "fx_source": "default_1usd", "information_text": "", "description_text": "", "features_text": "MARCA | : BIMBO | Últimos consultados | Pan Salvado FARGO 620g | Ver planes de cuotas | LLEVANDO 3 | 3X2 | Leche Larga Vida Entera LAS TRES NIÑAS Ttb 1l | PRECIO CON 3X2 | Leche Larga Vida Entera VERONICA 1l | Leche Larga Vida Entera TREGAR Ttb 1 L | Leche Entera Larga Vida Ilolay Ttb 1 Ltr", "specifications_text": "", "benefits_text": "", "details_text": "", "other_sections": "", "sections": {"Características": ["MARCA", ": BIMBO", "Últimos consultados", "Pan Salvado FARGO 620g", "Ver planes de cuotas", "LLEVANDO 3", "3X2", "Leche Larga Vida Entera LAS TRES NIÑAS Ttb 1l", "PRECIO CON 3X2", "Leche Larga Vida Entera VERONICA 1l", "Leche Larga Vida Entera TREGAR Ttb 1 L", "Leche Entera Larga Vida Ilolay Ttb 1 Ltr"]}, "txt_path": "dataset/txt_limpios/509.txt", "html_path": "dataset/paginas_descargadas/509.html", "es_status": "EN", "category_canonical": "sin_categoria", "decision": "discard", "match_score": 0.3, "reasons": "no_category_detected"}
{"source_id": "510", "title": "Descripción del producto", "description": "", "breadcrumbs": "MARCA > 550g", "price_raw": "6434.0", "currency_raw": "", "url": "", "seller": "Desconocido", "availability": "unknown", "country": "UNKNOWN", "product_name": "Descripción del producto", "brand": "MARCA", "reference": "", "unit": "550g", "price_amount": 6434.0, "price_currency": "", "price_symbol": "$", "price_text": "$6.434,00", "price_amount_filled": "6434.0", "price_is_imputed": "False", "price_imputation_source": "original", "price_amount_usd": "6434.0", "price_amount_usd_filled": "6434.0", "fx_rate_local_per_usd": "1.0", "fx_source": "default_1usd", "information_text": "", "description_text": "", "features_text": "MARCA | : LA PERLA | Últimos consultados | Pan Lacteado Blanco Rebanada Mas Grande Bimbo 610g | Ver planes de cuotas | Pan Salvado FARGO 620g | LLEVANDO 3 | 3X2 | Leche Larga Vida Entera LAS TRES NIÑAS Ttb 1l | PRECIO CON 3X2 | Leche Larga Vida Entera VERONICA 1l | Leche Larga Vida Entera TREGAR 1 L", "specifications_text": "", "benefits_text": "", "details_text": "", "other_sections": "", "sections": {"Características": ["MARCA", ": LA PERLA", "Últimos consultados", "Pan Lacteado Blanco Rebanada Mas Grande Bimbo 610g", "Ver planes de cuotas", "Pan Salvado FARGO 620g", "LLEVANDO 3", "3X2", "Leche Larga Vida Entera LAS TRES NIÑAS Ttb 1l", "PRECIO CON 3X2", "Leche Larga Vida Entera VERONICA 1l", "Leche Larga Vida Entera TREGAR Ttb 1 L"]}, "txt_path": "dataset/txt_limpios/510.txt", "html_path": "dataset/paginas_descargadas/510.html", "es_status": "ET", "category_canonical": "sin_categoria", "decision": "discard", "match_score": 0.3, "reasons": "no_category_detected"}
{"source_id": "511", "title": "Descripción del producto", "description": "", "breadcrumbs": "MARCA > 550g", "price_raw": "600.0", "currency_raw": "", "url": "", "seller": "Desconocido", "availability": "unknown", "country": "UNKNOWN", "product_name": "Descripción del producto", "brand": "MARCA", "reference": "", "unit": "550g", "price_amount": 600.0, "price_currency": "", "price_symbol": "", "price_text": "600", "price_amount_filled": "600.0", "price_is_imputed": "False", "price_imputation_source": "original", "price_amount_usd": "600.0", "price_amount_usd_filled": "600.0", "fx_rate_local_per_usd": "1.0", "fx_source": "default_1usd", "information_text": "", "description_text": "", "features_text": "MARCA | : NOLY | Últimos consultados | Pan De Mesa Grande La Perla 550g | Ver planes de cuotas | Pan Lacteado Blanco Rebanada Mas Grande Bimbo 610g | Pan Salvado FARGO 620g | LLEVANDO 3 | 3X2 | Leche Larga Vida Entera LAS TRES NIÑAS Ttb 1l | PRECIO CON 3X2 | Leche Larga Vida Entera VERONICA 1l", "specifications_text": "", "benefits_text": "", "details_text": "", "other_sections": "", "sections": {"Características": ["MARCA", ": NOLY", "Últimos consultados", "Pan De Mesa Grande La Perla 550g", "Ver planes de cuotas", "Pan Lacteado Blanco Rebanada Mas Grande Bimbo 610g", "Pan Salvado FARGO 620g", "LLEVANDO 3", "3X2", "Leche Larga Vida Entera LAS TRES NIÑAS Ttb 1l", "PRECIO CON 3X2", "Leche Larga Vida Entera VERONICA 1l"]}, "txt_path": "dataset/txt_limpios/511.txt", "html_path": "dataset/paginas_descargadas/511.html", "es_status": "EN", "category_canonical": "sin_categoria", "decision": "discard", "match_score": 0.3, "reasons": "no_category_detected"}
{"source_id": "513", "title": "Descripción del producto", "description": "", "breadcrumbs": "MARCA > 1kg", "price_raw": "1312.0", "currency_raw": "", "url": "", "seller": "Desconocido", "availability": "unknown", "country": "UNKNOWN", "product_name": "Descripción del producto", "brand": "MARCA", "reference": "", "unit": "1kg", "price_amount": 1312.0, "price_currency": "", "price_symbol": "$", "price_text": "$1.312,00", "price_amount_filled": "1312.0", "price_is_imputed": "False", "price_imputation_source": "original", "price_amount_usd": "1312.0", "price_amount_usd_filled": "1312.0", "fx_rate_local_per_usd": "1.0", "fx_source": "default_1usd", "information_text": "", "description_text": "", "features_text": "MARCA | : ledESMA | Últimos consultados | Baguette COTO | Ver planes de cuotas | LLEVANDO 2 | 70% 2DA | PRECIO CON 70% 2DA | Pan De Mesa Gran La Perla 550g | Pan Lacteado Blanco Rebanada Mas Grande Bimbo 610g | Pan Salvado FARGO 620g", "specifications_text": "", "benefits_text": "", "details_text": "", "other_sections": "", "sections": {"Características": ["MARCA", ": LEDESMA", "Últimos consultados", "Baguette COTO", "Ver planes de cuotas", "LLEVANDO 2", "70% 2DA", "PRECIO CON 70% 2DA", "Pan De Mesa Grande La Perla 550g", "Pan Lacteado Blanco Rebanada Mas Grande Bimbo 610g", "Pan Salvado FARGO 620g"]}, "txt_path": "dataset/txt_limpios/513.txt", "html_path": "dataset/paginas_descargadas/513.html", "es_status": "ET", "category_canonical": "sin_categoria", "decision": "discard", "match_score": 0.3, "reasons": "no_category_detected"}
{"source_id": "514", "title": "Descripción del producto", "description": "", "breadcrumbs": "MARCA > 1 Kg", "price_raw": "1299.0", "currency_raw": "", "url": "", "seller": "Desconocido", "availability": "unknown", "country": "UNKNOWN", "product_name": "Descripción del producto", "brand": "MARCA", "reference": "", "unit": "1 Kg", "price_amount": 1299.0, "price_currency": "", "price_symbol": "$", "price_text": "$1.299,00", "price_amount_filled": "1299.0", "price_is_imputed": "False", "price_imputation_source": "original", "price_amount_usd": "1299.0", "price_amount_usd_filled": "1299.0", "fx_rate_local_per_usd": "1.0", "fx_source": "default_1usd", "information_text": "", "description_text": "", "features_text": "MARCA | : LA PERLA | Últimos consultados | EL ACUMULABLE CON OTRAS PROMOS | Azúcar Superior Real LEDESMA 1kg | Ver planes de cuotas | Baguette COTO | LLEVANDO 2 | 70% 2DA | PRECIO CON 70% 2DA | Pan De Mesa Gran La Perla 550g | Pan Lacteado Blanco Rebanada Mas Grande Bimbo 610g", "specifications_text": "", "benefits_text": "", "details_text": "", "other_sections": "", "sections": {"Características": ["MARCA", ": LA PERLA", "Últimos consultados", "NO ACUMULABLE CON OTRAS PROMOS", "Azúcar Superior Real LEDESMA 1kg", "Ver planes de cuotas", "Baguette COTO", "LLEVANDO 2", "70% 2DA", "PRECIO CON 70% 2DA", "Pan De Mesa Grande La Perla 550g", "Pan Lacteado Blanco Rebanada Mas Grande Bimbo 610g"]}, "txt_path": "dataset/txt_limpios/514.txt", "html_path": "dataset/paginas_descargadas/514.html", "es_status": "ET", "category_canonical": "sin_categoria", "decision": "discard", "match_score": 0.3, "reasons": "no_category_detected"}
{"source_id": "515", "title": "Descripción del producto", "description": "", "breadcrumbs": "Azúcar Cristal Uniao 1kg > 1kg", "price_raw": "990.0", "currency_raw": "", "url": "", "seller": "Desconocido", "availability": "unknown", "country": "UNKNOWN", "product_name": "Descripción del producto", "brand": "Azúcar Cristal Uniao 1kg", "reference": "", "unit": "1kg", "price_amount": 990.0, "price_currency": "", "price_symbol": "$", "price_text": "$990,00", "price_amount_filled": "990.0", "price_is_imputed": "False", "price_imputation_source": "original", "price_amount_usd": "990.0", "price_amount_usd_filled": "990.0", "fx_rate_local_per_usd": "1.0", "fx_source": "default_1usd", "information_text": "", "description_text": "", "features_text": "MARCA | : UNIAO | Últimos consultados | Azúcar La Perla 1 Kg | Ver planes de cuotas | NO ACUMULABLE CON OTRAS PROMOS | Azúcar Superior Real ledESMA 1kg | Baguette COTO | LLEVANDO 2 | 70% 2DA | PRECIO CON 70% 2DA | Pan De Mesa Gran La Perla 550g", "specifications_text": "", "benefits_text": "", "details_text": "", "other_sections": "", "sections": {"Características": ["MARCA", ": UNIAO", "Últimos consultados", "Azúcar La Perla 1 Kg", "Ver planes de cuotas", "NO ACUMULABLE CON OTRAS PROMOS", "Azúcar Superior Real LEDESMA 1kg", "Baguette COTO", "LLEVANDO 2", "70% 2DA", "PRECIO CON 70% 2DA", "Pan De Mesa Grande La Perla 550g"]}, "txt_path": "dataset/txt_limpios/515.txt", "html_path": "dataset/paginas_descargadas/515.html", "es_status": "ET", "category_canonical": "azucar", "decision": "keep", "match_score": 0.6, "reasons": "heuristic_default"}
{"source_id": "516", "title": "Descripción del producto", "description": "", "breadcrumbs": "MARCA > 800g", "price_raw": "1699.0", "currency_raw": "", "url": "", "seller": "Desconocido", "availability": "unknown", "country": "UNKNOWN", "product_name": "Descripción del producto", "brand": "MARCA", "reference": "", "unit": "800g", "price_amount": 1699.0, "price_currency": "", "price_symbol": "$", "price_text": "$1.699,00", "price_amount_filled": "1699.0", "price_is_imputed": "False", "price_imputation_source": "original", "price_amount_usd": "1699.0", "price_amount_usd_filled": "1699.0", "fx_rate_local_per_usd": "1.0", "fx_source": "default_1usd", "information_text": "", "description_text": "", "features_text": "MARCA | : SUGAR POT | Últimos consultados | NO ACUMULABLE CON OTRAS PROMOS | Azúcar Cristal Uniao 1kg | Ver planes de cuotas | Azúcar La Perla 1 Kg | Azúcar Superior Real LEDESMA 1kg | Baguette COTO | LLEVANDO 2 | 70% 2DA | PRECIO CON 70% 2DA", "specifications_text": "", "benefits_text": "", "details_text": "", "other_sections": "", "sections": {"Características": ["MARCA", ": SUGAR POT", "Últimos consultados", "NO ACUMULABLE CON OTRAS PROMOS", "Azúcar Cristal Uniao 1kg", "Ver planes de cuotas", "Azúcar La Perla 1 Kg", "Azúcar Superior Real LEDESMA 1kg", "Baguette COTO", "LLEVANDO 2", "70% 2DA", "PRECIO CON 70% 2DA"]}, "txt_path": "dataset/txt_limpios/516.txt", "html_path": "dataset/paginas_descargadas/516.html", "es_status": "EN", "category_canonical": "sin_categoria", "decision": "discard", "match_score": 0.3, "reasons": "no_category_detected"}
