{"source_id": "281", "title": "Preços no Site e App podem ser diferentes das Lojas Físicas.", "description": "", "breadcrumbs": "Shipping > 2 Kg", "price_raw": "15.99", "currency_raw": "BRL", "url": "", "seller": "Desconocido", "availability": "unknown", "country": "BR", "product_name": "Preços no Site e App podem ser diferentes das Lojas Físicas.", "brand": "Shipping", "reference": "", "unit": "2 Kg", "price_amount": 15.99, "price_currency": "BRL", "price_symbol": "R$", "price_text": "R$15,99", "price_amount_filled": "15.99", "price_is_imputed": "False", "price_imputation_source": "original", "price_amount_usd": "2.935", "price_amount_usd_filled": "2.935", "fx_rate_local_per_usd": "5.448", "fx_source": "from_brasil_cambio_dolar", "information_text": "", "description_text": "", "features_text": "", "specifications_text": "", "benefits_text": "", "details_text": "", "other_sections": "", "sections": {}, "txt_path": "dataset/txt_limpios/281.txt", "html_path": "dataset/paginas_descargadas/281.html", "es_status": "EN", "category_canonical": "sin_categoria", "decision": "discard", "match_score": 0.3, "reasons": "no_category_detected"}
{"source_id": "283", "title": "Preços no Site e App podem ser diferentes das Lojas Físicas.", "description": "", "breadcrumbs": "Shipping > 250 G", "price_raw": "2.0", "currency_raw": "", "url": "", "seller": "Desconocido", "availability": "unknown", "country": "UNKNOWN", "product_name": "Preços no Site e App podem ser diferentes das Lojas Físicas.", "brand": "Shipping", "reference": "", "unit": "250 G", "price_amount": 2.0, "price_currency": "", "price_symbol": "", "price_text": "02", "price_amount_filled": "2.0", "price_is_imputed": "False", "price_imputation_source": "original", "price_amount_usd": "2.0", "price_amount_usd_filled": "2.0", "fx_rate_local_per_usd": "1.0", "fx_source": "default_1usd", "information_text": "", "description_text": "", "features_text": "", "specifications_text": "", "benefits_text": "", "details_text": "", "other_sections": "", "sections": {}, "txt_path": "dataset/txt_limpios/283.txt", "html_path": "dataset/paginas_descargadas/283.html", "es_status": "EN", "category_canonical": "sin_categoria", "decision": "discard", "match_score": 0.3, "reasons": "no_category_detected"}
{"source_id": "284", "title": "Preços no Site e App podem ser diferentes das Lojas Físicas.", "description": "", "breadcrumbs": "Shipping > 250g", "price_raw": "24.99", "currency_raw": "BRL", "url": "", "seller": "Desconocido", "availability": "unknown", "country": "BR", "product_name": "Preços no Site e App podem ser diferentes das Lojas Físicas.", "brand": "Shipping", "reference": "", "unit": "250g", "price_amount": 24.99, "price_currency": "BRL", "price_symbol": "R$", "price_text": "R$24,99", "price_amount_filled": "24.99", "price_is_imputed": "False", "price_imputation_source": "original", "price_amount_usd": "4.587", "price_amount_usd_filled": "4.587", "fx_rate_local_per_usd": "5.448", "fx_source": "from_brasil_cambio_dolar", "information_text": "", "description_text": "", "features_text": "", "specifications_text": "", "benefits_text": "", "details_text": "", "other_sections": "", "sections": {}, "txt_path": "dataset/txt_limpios/284.txt", "html_path": "dataset/paginas_descargadas/284.html", "es_status": "EN", "category_canonical": "sin_categoria", "decision": "discard", "match_score": 0.3, "reasons": "no_category_detected"}
{"source_id": "285", "title": "Preços no Site e App podem ser diferentes das Lojas Físicas.", "description": "", "breadcrumbs": "Shipping > 500 G", "price_raw": "24.99", "currency_raw": "BRL", "url": "", "seller": "Desconocido", "availability": "unknown", "country": "BR", "product_name": "Preços no Site e App podem ser diferentes das Lojas Físicas.", "brand": "Shipping", "reference": "", "unit": "500 G", "price_amount": 24.99, "price_currency": "BRL", "price_symbol": "R$", "price_text": "R$24,99", "price_amount_filled": "24.99", "price_is_imputed": "False", "price_imputation_source": "original", "price_amount_usd": "4.587", "price_amount_usd_filled": "4.587", "fx_rate_local_per_usd": "5.448", "fx_source": "from_brasil_cambio_dolar", "information_text": "", "description_text": "", "features_text": "", "specifications_text": "", "benefits_text": "", "details_text": "", "other_sections": "", "sections": {}, "txt_path": "dataset/txt_limpios/285.txt", "html_path": "dataset/paginas_descargadas/285.html", "es_status": "EN", "category_canonical": "sin_categoria", "decision": "discard", "match_score": 0.3, "reasons": "no_category_detected"}
{"source_id": "286", "title": "Preços no Site e App podem ser diferentes das Lojas Físicas.", "description": "", "breadcrumbs": "Shipping > 10 Unidades", "price_raw": "24.99", "currency_raw": "BRL", "url": "", "seller": "Desconocido", "availability": "unknown", "country": "BR", "product_name": "Preços no Site e App podem ser diferentes das Lojas Físicas.", "brand": "Shipping", "reference": "", "unit": "10 Unidades", "price_amount": 24.99, "price_currency": "BRL", "price_symbol": "R$", "price_text": "R$24,99", "price_amount_filled": "24.99", "price_is_imputed": "False", "price_imputation_source": "original", "price_amount_usd": "4.587", "price_amount_usd_filled": "4.587", "fx_rate_local_per_usd": "5.448", "fx_source": "from_brasil_cambio_dolar", "information_text": "", "description_text": "", "features_text": "", "specifications_text": "", "benefits_text": "", "details_text": "", "other_sections": "", "sections": {}, "txt_path": "dataset/txt_limpios/286.txt", "html_path": "dataset/paginas_descargadas/286.html", "es_status": "EN", "category_canonical": "sin_categoria", "decision": "discard", "match_score": 0.3, "reasons": "no_category_detected"}
{"source_id": "287", "title": "Preços no Site e App podem ser diferentes das Lojas Físicas.", "description": "", "breadcrumbs": "Shipping > 400g", "price_raw": "24.99", "currency_raw": "BRL", "url": "", "seller": "Desconocido", "availability": "unknown", "country": "BR", "product_name": "Preços no Site e App podem ser diferentes das Lojas Físicas.", "brand": "Shipping", "reference": "", "unit": "400g", "price_amount": 24.99, "price_currency": "BRL", "price_symbol": "R$", "price_text": "R$24,99", "price_amount_filled": "24.99", "price_is_imputed": "False", "price_imputation_source": "original", "price_amount_usd": "4.587", "price_amount_usd_filled": "4.587", "fx_rate_local_per_usd": "5.448", "fx_source": "from_brasil_cambio_dolar", "information_text": "", "description_text": "", "features_text": "", "specifications_text": "", "benefits_text": "", "details_text": "", "other_sections": "", "sections": {}, "txt_path": "dataset/txt_limpios/287.txt", "html_path": "dataset/paginas_descargadas/287.html", "es_status": "EN", "category_canonical": "sin_categoria", "decision": "discard", "match_score": 0.3, "reasons": "no_category_detected"}
{"source_id": "289", "title": "Preços no Site e App podem ser diferentes das Lojas Físicas.", "description": "", "breadcrumbs": "Shipping > 400 G", "price_raw": "400.0", "currency_raw": "", "url": "", "seller": "Desconocido", "availability": "unknown", "country": "UNKNOWN", "product_name": "Preços no Site e App podem ser diferentes das Lojas Físicas.", "brand": "Shipping", "reference": "", "unit": "400 G", "price_amount": 400.0, "price_currency": "", "price_symbol": "r", "price_text": "r400", "price_amount_filled": "400.0", "price_is_imputed": "False", "price_imputation_source": "original", "price_amount_usd": "400.0", "price_amount_usd_filled": "400.0", "fx_rate_local_per_usd": "1.0", "fx_source": "default_1usd", "information_text": "", "description_text": "", "features_text": "", "specifications_text": "", "benefits_text": "", "details_text": "", "other_sections": "", "sections": {}, "txt_path": "dataset/txt_limpios/289.txt", "html_path": "dataset/paginas_descargadas/289.html", "es_status": "EN", "category_canonical": "sin_categoria", "decision": "discard", "match_score": 0.3, "reasons": "no_category_detected"}
{"source_id": "290", "title": "Preços no Site e App podem ser diferentes das Lojas Físicas.", "description": "", "breadcrumbs": "Shipping > 500 G", "price_raw": "24.99", "currency_raw": "BRL", "url": "", "seller": "Desconocido", "availability": "unknown", "country": "BR", "product_name": "Preços no Site e App podem ser diferentes das Lojas Físicas.", "brand": "Shipping", "reference": "", "unit": "500 G", "price_amount": 24.99, "price_currency": "BRL", "price_symbol": "R$", "price_text": "R$24,99", "price_amount_filled": "24.99", "price_is_imputed": "False", "price_imputation_source": "original", "price_amount_usd": "4.587", "price_amount_usd_filled": "4.587", "fx_rate_local_per_usd": "5.448", "fx_source": "from_brasil_cambio_dolar", "information_text": "", "description_text": "", "features_text": "", "specifications_text": "", "benefits_text": "", "details_text": "", "other_sections": "", "sections": {}, "txt_path": "dataset/txt_limpios/290.txt", "html_path": "dataset/paginas_descargadas/290.html", "es_status": "EN", "category_canonical": "sin_categoria", "decision": "discard", "match_score": 0.3, "reasons": "no_category_detected"}
{"source_id": "292", "title": "Preços no Site e App podem ser diferentes das Lojas Físicas.", "description": "", "breadcrumbs": "Shipping > 350ML", "price_raw": "24.99", "currency_raw": "BRL", "url": "", "seller": "Desconocido", "availability": "unknown", "country": "BR", "product_name": "Preços no Site e App podem ser diferentes das Lojas Físicas.", "brand": "Shipping", "reference": "", "unit": "350ML", "price_amount": 24.99, "price_currency": "BRL", "price_symbol": "R$", "price_text": "R$24,99", "price_amount_filled": "24.99", "price_is_imputed": "False", "price_imputation_source": "original", "price_amount_usd": "4.587", "price_amount_usd_filled": "4.587", "fx_rate_local_per_usd": "5.448", "fx_source": "from_brasil_cambio_dolar", "information_text": "", "description_text": "", "features_text": "", "specifications_text": "", "benefits_text": "", "details_text": "", "other_sections": "", "sections": {}, "txt_path": "dataset/txt_limpios/292.txt", "html_path": "dataset/paginas_descargadas/292.html", "es_status": "EN", "category_canonical": "sin_categoria", "decision": "discard", "match_score": 0.3, "reasons": "no_category_detected"}
{"source_id": "293", "title": "Preços no Site e App podem ser diferentes das Lojas Físicas.", "description": "", "breadcrumbs": "Shipping > 2 L", "price_raw": "24.99", "currency_raw": "BRL", "url": "", "seller": "Desconocido", "availability": "unknown", "country": "BR", "product_name": "Preços no Site e App podem ser diferentes das Lojas Físicas.", "brand": "Shipping", "reference": "", "unit": "2 L", "price_amount": 24.99, "price_currency": "BRL", "price_symbol": "R$", "price_text": "R$24,99", "price_amount_filled": "24.99", "price_is_imputed": "False", "price_imputation_source": "original", "price_amount_usd": "4.587", "price_amount_usd_filled": "4.587", "fx_rate_local_per_usd": "5.448", "fx_source": "from_brasil_cambio_dolar", "information_text": "", "description_text": "", "features_text": "", "specifications_text": "", "benefits_text": "", "details_text": "", "other_sections": "", "sections": {}, "txt_path": "dataset/txt_limpios/293.txt", "html_path": "dataset/paginas_descargadas/293.html", "es_status": "EN", "category_canonical": "sin_categoria", "decision": "discard", "match_score": 0.3, "reasons": "no_category_detected"}
{"source_id": "294", "title": "Preços no Site e App podem ser diferentes das Lojas Físicas.", "description": "", "breadcrumbs": "Shipping > 255 Ml", "price_raw": "29.99", "currency_raw": "BRL", "url": "", "seller": "Desconocido", "availability": "unknown", "country": "BR", "product_name": "Preços no Site e App podem ser diferentes das Lojas Físicas.", "brand": "Shipping", "reference": "", "unit": "255 Ml", "price_amount": 29.99, "price_currency": "BRL", "price_symbol": "R$", "price_text": "R$29,99", "price_amount_filled": "29.99", "price_is_imputed": "False", "price_imputation_source": "original", "price_amount_usd": "5.5048", "price_amount_usd_filled": "5.5048", "fx_rate_local_per_usd": "5.448", "fx_source": "from_brasil_cambio_dolar", "information_text": "", "description_text": "", "features_text": "", "specifications_text": "", "benefits_text": "", "details_text": "", "other_sections": "", "sections": {}, "txt_path": "dataset/txt_limpios/294.txt", "html_path": "dataset/paginas_descargadas/294.html", "es_status": "EN", "category_canonical": "sin_categoria", "decision": "discard", "match_score": 0.3, "reasons": "no_category_detected"}
{"source_id": "295", "title": "Preços no Site e App podem ser diferentes das Lojas Físicas.", "description": "", "breadcrumbs": "Shipping > 500 G", "price_raw": "15.99", "currency_raw": "BRL", "url": "", "seller": "Desconocido", "availability": "unknown", "country": "BR", "product_name": "Preços no Site e App podem ser diferentes das Lojas Físicas.", "brand": "Shipping", "reference": "", "unit": "500 G", "price_amount": 15.99, "price_currency": "BRL", "price_symbol": "R$", "price_text": "R$15,99", "price_amount_filled": "15.99", "price_is_imputed": "False", "price_imputation_source": "original", "price_amount_usd": "2.935", "price_amount_usd_filled": "2.935", "fx_rate_local_per_usd": "5.448", "fx_source": "from_brasil_cambio_dolar", "information_text": "", "description_text": "", "features_text": "", "specifications_text": "", "benefits_text": "", "details_text": "", "other_sections": "", "sections": {}, "txt_path": "dataset/txt_limpios/295.txt", "html_path": "dataset/paginas_descargadas/295.html", "es_status": "EN", "category_canonical": "sin_categoria", "decision": "discard", "match_score": 0.3, "reasons": "no_category_detected"}
{"source_id": "303", "title": "Preços no Site e App podem ser diferentes das Lojas Físicas.", "description": "", "breadcrumbs": "Shipping > 1 Litro", "price_raw": "9.99", "currency_raw": "BRL", "url": "", "seller": "Desconocido", "availability": "unknown", "country": "BR", "product_name": "Preços no Site e App podem ser diferentes das Lojas Físicas.", "brand": "Shipping", "reference": "", "unit": "1 Litro", "price_amount": 9.99, "price_currency": "BRL", "price_symbol": "R$", "price_text": "R$9,99", "price_amount_filled": "9.99", "price_is_imputed": "False", "price_imputation_source": "original", "price_amount_usd": "1.8337", "price_amount_usd_filled": "1.8337", "fx_rate_local_per_usd": "5.448", "fx_source": "from_brasil_cambio_dolar", "information_text": "", "description_text": "", "features_text": "", "specifications_text": "", "benefits_text": "", "details_text": "", "other_sections": "", "sections": {}, "txt_path": "dataset/txt_limpios/303.txt", "html_path": "dataset/paginas_descargadas/303.html", "es_status": "EN", "category_canonical": "sin_categoria", "decision": "discard", "match_score": 0.3, "reasons": "no_category_detected"}
{"source_id": "307", "title": "Preços no Site e App podem ser diferentes das Lojas Físicas.", "description": "", "breadcrumbs": "Shipping > 600 Ml", "price_raw": "24.99", "currency_raw": "BRL", "url": "", "seller": "Desconocido", "availability": "unknown", "country": "BR", "product_name": "Preços no Site e App podem ser diferentes das Lojas Físicas.", "brand": "Shipping", "reference": "", "unit": "600 Ml", "price_amount": 24.99, "price_currency": "BRL", "price_symbol": "R$", "price_text": "R$24,99", "price_amount_filled": "24.99", "price_is_imputed": "False", "price_imputation_source": "original", "price_amount_usd": "4.587", "price_amount_usd_filled": "4.587", "fx_rate_local_per_usd": "5.448", "fx_source": "from_brasil_cambio_dolar", "information_text": "", "description_text": "", "features_text": "", "specifications_text": "", "benefits_text": "", "details_text": "", "other_sections": "", "sections": {}, "txt_path": "dataset/txt_limpios/307.txt", "html_path": "dataset/paginas_descargadas/307.html", "es_status": "EN", "category_canonical": "sin_categoria", "decision": "discard", "match_score": 0.3, "reasons": "no_category_detected"}
{"source_id": "308", "title": "Preços no Site e App podem ser diferentes das Lojas Físicas.", "description": "", "breadcrumbs": "Shipping > 350 Ml", "price_raw": "24.99", "currency_raw": "BRL", "url": "", "seller": "Desconocido", "availability": "unknown", "country": "BR", "product_name": "Preços no Site e App podem ser diferentes das Lojas Físicas.", "brand": "Shipping", "reference": "", "unit": "350 Ml", "price_amount": 24.99, "price_currency": "BRL", "price_symbol": "R$", "price_text": "R$24,99", "price_amount_filled": "24.99", "price_is_imputed": "False", "price_imputation_source": "original", "price_amount_usd": "4.587", "price_amount_usd_filled": "4.587", "fx_rate_local_per_usd": "5.448", "fx_source": "from_brasil_cambio_dolar", "information_text": "", "description_text": "", "features_text": "", "specifications_text": "", "benefits_text": "", "details_text": "", "other_sections": "", "sections": {}, "txt_path": "dataset/txt_limpios/308.txt", "html_path": "dataset/paginas_descargadas/308.html", "es_status": "EN", "category_canonical": "sin_categoria", "decision": "discard", "match_score": 0.3, "reasons": "no_category_detected"}
{"source_id": "309", "title": "Preços no Site e App podem ser diferentes das Lojas Físicas.", "description": "", "breadcrumbs": "Shipping > 750 G", "price_raw": "21.99", "currency_raw": "BRL", "url": "", "seller": "Desconocido", "availability": "unknown", "country": "BR", "product_name": "Preços no Site e App podem ser diferentes das Lojas Físicas.", "brand": "Shipping", "reference": "", "unit": "750 G", "price_amount": 21.99, "price_currency": "BRL", "price_symbol": "R$", "price_text": "R$21,99", "price_amount_filled": "21.99", "price_is_imputed": "False", "price_imputation_source": "original", "price_amount_usd": "4.0363", "price_amount_usd_filled": "4.0363", "fx_rate_local_per_usd": "5.448", "fx_source": "from_brasil_cambio_dolar", "information_text": "", "description_text": "", "features_text": "", "specifications_text": "", "benefits_text": "", "details_text": "", "other_sections": "", "sections": {}, "txt_path": "dataset/txt_limpios/309.txt", "html_path": "dataset/paginas_descargadas/309.html", "es_status": "EN", "category_canonical": "sin_categoria", "decision": "discard", "match_score": 0.3, "reasons": "no_category_detected"}
{"source_id": "310", "title": "Preços no Site e App podem ser diferentes das Lojas Físicas.", "description": "", "breadcrumbs": "Shipping > 750g", "price_raw": "21.99", "currency_raw": "BRL", "url": "", "seller": "Desconocido", "availability": "unknown", "country": "BR", "product_name": "Preços no Site e App podem ser diferentes das Lojas Físicas.", "brand": "Shipping", "reference": "", "unit": "750g", "price_amount": 21.99, "price_currency": "BRL", "price_symbol": "R$", "price_text": "R$21,99", "price_amount_filled": "21.99", "price_is_imputed": "False", "price_imputation_source": "original", "price_amount_usd": "4.0363", "price_amount_usd_filled": "4.0363", "fx_rate_local_per_usd": "5.448", "fx_source": "from_brasil_cambio_dolar", "information_text": "", "description_text": "", "features_text": "", "specifications_text": "", "benefits_text": "", "details_text": "", "other_sections": "", "sections": {}, "txt_path": "dataset/txt_limpios/310.txt", "html_path": "dataset/paginas_descargadas/310.html", "es_status": "EN", "category_canonical": "sin_categoria", "decision": "discard", "match_score": 0.3, "reasons": "no_category_detected"}
{"source_id": "311", "title": "Preços no Site e App podem ser diferentes das Lojas Físicas.", "description": "", "breadcrumbs": "Shipping > 300g", "price_raw": "15.99", "currency_raw": "BRL", "url": "", "seller": "Desconocido", "availability": "unknown", "country": "BR", "product_name": "Preços no Site e App podem ser diferentes das Lojas Físicas.", "brand": "Shipping", "reference": "", "unit": "300g", "price_amount": 15.99, "price_currency": "BRL", "price_symbol": "R$", "price_text": "R$15,99", "price_amount_filled": "15.99", "price_is_imputed": "False", "price_imputation_source": "original", "price_amount_usd": "2.935", "price_amount_usd_filled": "2.935", "fx_rate_local_per_usd": "5.448", "fx_source": "from_brasil_cambio_dolar", "information_text": "", "description_text": "", "features_text": "", "specifications_text": "", "benefits_text": "", "details_text": "", "other_sections": "", "sections": {}, "txt_path": "dataset/txt_limpios/311.txt", "html_path": "dataset/paginas_descargadas/311.html", "es_status": "EN", "category_canonical": "sin_categoria", "decision": "discard", "match_score": 0.3, "reasons": "no_category_detected"}
{"source_id": "312", "title": "Preços no Site e App podem ser diferentes das Lojas Físicas.", "description": "", "breadcrumbs": "Shipping > 750 G", "price_raw": "21.99", "currency_raw": "BRL", "url": "", "seller": "Desconocido", "availability": "unknown", "country": "BR", "product_name": "Preços no Site e App podem ser diferentes das Lojas Físicas.", "brand": "Shipping", "reference": "", "unit": "750 G", "price_amount": 21.99, "price_currency": "BRL", "price_symbol": "R$", "price_text": "R$21,99", "price_amount_filled": "21.99", "price_is_imputed": "False", "price_imputation_source": "original", "price_amount_usd": "4.0363", "price_amount_usd_filled": "4.0363", "fx_rate_local_per_usd": "5.448", "fx_source": "from_brasil_cambio_dolar", "information_text": "", "description_text": "", "features_text": "", "specifications_text": "", "benefits_text": "", "details_text": "", "other_sections": "", "sections": {}, "txt_path": "dataset/txt_limpios/312.txt", "html_path": "dataset/paginas_descargadas/312.html", "es_status": "EN", "category_canonical": "sin_categoria", "decision": "discard", "match_score": 0.3, "reasons": "no_category_detected"}
