{"source_id": "313", "title": "Preços no Site e App podem ser diferentes das Lojas Físicas.", "description": "", "breadcrumbs": "Shipping > 1kg", "price_raw": "15.99", "currency_raw": "BRL", "url": "", "seller": "Desconocido", "availability": "unknown", "country": "BR", "product_name": "Preços no Site e App podem ser diferentes das Lojas Físicas.", "brand": "Shipping", "reference": "", "unit": "1kg", "price_amount": 15.99, "price_currency": "BRL", "price_symbol": "R$", "price_text": "R$15,99", "price_amount_filled": "15.99", "price_is_imputed": "False", "price_imputation_source": "original", "price_amount_usd": "2.935", "price_amount_usd_filled": "2.935", "fx_rate_local_per_usd": "5.448", "fx_source": "from_brasil_cambio_dolar", "information_text": "", "description_text": "", "features_text": "", "specifications_text": "", "benefits_text": "", "details_text": "", "other_sections": "", "sections": {}, "txt_path": "dataset/txt_limpios/313.txt", "html_path": "dataset/paginas_descargadas/313.html", "es_status": "EN", "category_canonical": "sin_categoria", "decision": "discard", "match_score": 0.3, "reasons": "no_category_detected"}
{"source_id": "314", "title": "Preços no Site e App podem ser diferentes das Lojas Físicas.", "description": "", "breadcrumbs": "Shipping > 1 Kg", "price_raw": "36.99", "currency_raw": "BRL", "url": "", "seller": "Desconocido", "availability": "unknown", "country": "BR", "product_name": "Preços no Site e App podem ser diferentes das Lojas Físicas.", "brand": "Shipping", "reference": "", "unit": "1 Kg", "price_amount": 36.99, "price_currency": "BRL", "price_symbol": "R$", "price_text": "R$36,99", "price_amount_filled": "36.99", "price_is_imputed": "False", "price_imputation_source": "original", "price_amount_usd": "6.7896", "price_amount_usd_filled": "6.7896", "fx_rate_local_per_usd": "5.448", "fx_source": "from_brasil_cambio_dolar", "information_text": "", "description_text": "", "features_text": "", "specifications_text": "", "benefits_text": "", "details_text": "", "other_sections": "", "sections": {}, "txt_path": "dataset/txt_limpios/314.txt", "html_path": "dataset/paginas_descargadas/314.html", "es_status": "EN", "category_canonical": "sin_categoria", "decision": "discard", "match_score": 0.3, "reasons": "no_category_detected"}
{"source_id": "318", "title": "Preços no Site e App podem ser diferentes das Lojas Físicas.", "description": "", "breadcrumbs": "Shipping > 1 Kg", "price_raw": "1.0", "currency_raw": "", "url": "", "seller": "Desconocido", "availability": "unknown", "country": "UNKNOWN", "product_name": "Preços no Site e App podem ser diferentes das Lojas Físicas.", "brand": "Shipping", "reference": "", "unit": "1 Kg", "price_amount": 1.0, "price_currency": "", "price_symbol": "r", "price_text": "r1", "price_amount_filled": "1.0", "price_is_imputed": "False", "price_imputation_source": "original", "price_amount_usd": "1.0", "price_amount_usd_filled": "1.0", "fx_rate_local_per_usd": "1.0", "fx_source": "default_1usd", "information_text": "", "description_text": "", "features_text": "", "specifications_text": "", "benefits_text": "", "details_text": "", "other_sections": "", "sections": {}, "txt_path": "dataset/txt_limpios/318.txt", "html_path": "dataset/paginas_descargadas/318.html", "es_status": "EN", "category_canonical": "sin_categoria", "decision": "discard", "match_score": 0.3, "reasons": "no_category_detected"}
{"source_id": "319", "title": "Preços no Site e App podem ser diferentes das Lojas Físicas.", "description": "", "breadcrumbs": "Shipping > 1 Kg", "price_raw": "15.99", "currency_raw": "BRL", "url": "", "seller": "Desconocido", "availability": "unknown", "country": "BR", "product_name": "Preços no Site e App podem ser diferentes das Lojas Físicas.", "brand": "Shipping", "reference": "", "unit": "1 Kg", "price_amount": 15.99, "price_currency": "BRL", "price_symbol": "R$", "price_text": "R$15,99", "price_amount_filled": "15.99", "price_is_imputed": "False", "price_imputation_source": "original", "price_amount_usd": "2.935", "price_amount_usd_filled": "2.935", "fx_rate_local_per_usd": "5.448", "fx_source": "from_brasil_cambio_dolar", "information_text": "", "description_text": "", "features_text": "", "specifications_text": "", "benefits_text": "", "details_text": "", "other_sections": "", "sections": {}, "txt_path": "dataset/txt_limpios/319.txt", "html_path": "dataset/paginas_descargadas/319.html", "es_status": "EN", "category_canonical": "sin_categoria", "decision": "discard", "match_score": 0.3, "reasons": "no_category_detected"}
{"source_id": "321", "title": "Preços no Site e App podem ser diferentes das Lojas Físicas.", "description": "", "breadcrumbs": "Shipping > 250 G", "price_raw": "15.99", "currency_raw": "BRL", "url": "", "seller": "Desconocido", "availability": "unknown", "country": "BR", "product_name": "Preços no Site e App podem ser diferentes das Lojas Físicas.", "brand": "Shipping", "reference": "", "unit": "250 G", "price_amount": 15.99, "price_currency": "BRL", "price_symbol": "R$", "price_text": "R$15,99", "price_amount_filled": "15.99", "price_is_imputed": "False", "price_imputation_source": "original", "price_amount_usd": "2.935", "price_amount_usd_filled": "2.935", "fx_rate_local_per_usd": "5.448", "fx_source": "from_brasil_cambio_dolar", "information_text": "", "description_text": "", "features_text": "", "specifications_text": "", "benefits_text": "", "details_text": "", "other_sections": "", "sections": {}, "txt_path": "dataset/txt_limpios/321.txt", "html_path": "dataset/paginas_descargadas/321.html", "es_status": "EN", "category_canonical": "sin_categoria", "decision": "discard", "match_score": 0.3, "reasons": "no_category_detected"}
{"source_id": "322", "title": "Preços no Site e App podem ser diferentes das Lojas Físicas.", "description": "", "breadcrumbs": "Shipping > 450g", "price_raw": "15.99", "currency_raw": "BRL", "url": "", "seller": "Desconocido", "availability": "unknown", "country": "BR", "product_name": "Preços no Site e App podem ser diferentes das Lojas Físicas.", "brand": "Shipping", "reference": "", "unit": "450g", "price_amount": 15.99, "price_currency": "BRL", "price_symbol": "R$", "price_text": "R$15,99", "price_amount_filled": "15.99", "price_is_imputed": "False", "price_imputation_source": "original", "price_amount_usd": "2.935", "price_amount_usd_filled": "2.935", "fx_rate_local_per_usd": "5.448", "fx_source": "from_brasil_cambio_dolar", "information_text": "", "description_text": "", "features_text": "", "specifications_text": "", "benefits_text": "", "details_text": "", "other_sections": "", "sections": {}, "txt_path": "dataset/txt_limpios/322.txt", "html_path": "dataset/paginas_descargadas/322.html", "es_status": "EN", "category_canonical": "sin_categoria", "decision": "discard", "match_score": 0.3, "reasons": "no_category_detected"}
{"source_id": "631", "title": "Producto no disponible", "description": "", "breadcrumbs": "Enviar", "price_raw": "", "currency_raw": "", "url": "", "seller": "Desconocido", "availability": "unknown", "country": "UNKNOWN", "product_name": "Producto no disponible", "brand": "Enviar", "reference": "", "unit": "", "price_amount": null, "price_currency": "", "price_symbol": "", "price_text": "", "price_amount_filled": "234.19", "price_is_imputed": "True", "price_imputation_source": "country_mean", "price_amount_usd": "", "price_amount_usd_filled": "234.1938", "fx_rate_local_per_usd": "1.0", "fx_source": "default_1usd", "information_text": "", "description_text": "", "features_text": "", "specifications_text": "", "benefits_text": "", "details_text": "", "other_sections": "", "sections": {}, "txt_path": "dataset/txt_limpios/631.txt", "html_path": "dataset/paginas_descargadas/631.html", "es_status": "EN", "category_canonical": "sin_categoria", "decision": "discard", "match_score": 0.3, "reasons": "no_category_detected;price_parse_failed"}
{"source_id": "642", "title": "Producto no disponible", "description": "", "breadcrumbs": "Enviar > 500 gr", "price_raw": "500.0", "currency_raw": "", "url": "", "seller": "Desconocido", "availability": "unknown", "country": "UNKNOWN", "product_name": "Producto no disponible", "brand": "Enviar", "reference": "", "unit": "500 gr", "price_amount": 500.0, "price_currency": "", "price_symbol": "", "price_text": "500", "price_amount_filled": "500.0", "price_is_imputed": "False", "price_imputation_source": "original", "price_amount_usd": "500.0", "price_amount_usd_filled": "500.0", "fx_rate_local_per_usd": "1.0", "fx_source": "default_1usd", "information_text": "", "description_text": "", "features_text": "", "specifications_text": "", "benefits_text": "", "details_text": "", "other_sections": "", "sections": {}, "txt_path": "dataset/txt_limpios/642.txt", "html_path": "dataset/paginas_descargadas/642.html", "es_status": "EN", "category_canonical": "sin_categoria", "decision": "discard", "match_score": 0.3, "reasons": "no_category_detected"}
{"source_id": "648", "title": "Producto no disponible", "description": "", "breadcrumbs": "Enviar", "price_raw": "1000.0", "currency_raw": "", "url": "", "seller": "Desconocido", "availability": "unknown", "country": "UNKNOWN", "product_name": "Producto no disponible", "brand": "Enviar", "reference": "", "unit": "", "price_amount": 1000.0, "price_currency": "", "price_symbol": "", "price_text": "1000", "price_amount_filled": "1000.0", "price_is_imputed": "False", "price_imputation_source": "original", "price_amount_usd": "1000.0", "price_amount_usd_filled": "1000.0", "fx_rate_local_per_usd": "1.0", "fx_source": "default_1usd", "information_text": "", "description_text": "", "features_text": "", "specifications_text": "", "benefits_text": "", "details_text": "", "other_sections": "", "sections": {}, "txt_path": "dataset/txt_limpios/648.txt", "html_path": "dataset/paginas_descargadas/648.html", "es_status": "EN", "category_canonical": "sin_categoria", "decision": "discard", "match_score": 0.3, "reasons": "no_category_detected"}
{"source_id": "651", "title": "Producto no disponible", "description": "", "breadcrumbs": "Enviar", "price_raw": "7.0", "currency_raw": "", "url": "", "seller": "Desconocido", "availability": "unknown", "country": "UNKNOWN", "product_name": "Producto no disponible", "brand": "Enviar", "reference": "", "unit": "", "price_amount": 7.0, "price_currency": "", "price_symbol": "", "price_text": "7", "price_amount_filled": "7.0", "price_is_imputed": "False", "price_imputation_source": "original", "price_amount_usd": "7.0", "price_amount_usd_filled": "7.0", "fx_rate_local_per_usd": "1.0", "fx_source": "default_1usd", "information_text": "", "description_text": "", "features_text": "", "specifications_text": "", "benefits_text": "", "details_text": "", "other_sections": "", "sections": {}, "txt_path": "dataset/txt_limpios/651.txt", "html_path": "dataset/paginas_descargadas/651.html", "es_status": "EN", "category_canonical": "sin_categoria", "decision": "discard", "match_score": 0.3, "reasons": "no_category_detected"}
{"source_id": "751", "title": "Producto no disponible", "description": "", "breadcrumbs": "Enviar", "price_raw": "", "currency_raw": "", "url": "", "seller": "Desconocido", "availability": "unknown", "country": "UNKNOWN", "product_name": "Producto no disponible", "brand": "Enviar", "reference": "", "unit": "", "price_amount": null, "price_currency": "", "price_symbol": "", "price_text": "", "price_amount_filled": "234.19", "price_is_imputed": "True", "price_imputation_source": "country_mean", "price_amount_usd": "", "price_amount_usd_filled": "234.1938", "fx_rate_local_per_usd": "1.0", "fx_source": "default_1usd", "information_text": "", "description_text": "", "features_text": "", "specifications_text": "", "benefits_text": "", "details_text": "", "other_sections": "", "sections": {}, "txt_path": "dataset/txt_limpios/751.txt", "html_path": "dataset/paginas_descargadas/751.html", "es_status": "EN", "category_canonical": "sin_categoria", "decision": "discard", "match_score": 0.3, "reasons": "no_category_detected;price_parse_failed"}
{"source_id": "761", "title": "Producto no disponible", "description": "", "breadcrumbs": "Enviar", "price_raw": "", "currency_raw": "", "url": "", "seller": "Desconocido", "availability": "unknown", "country": "UNKNOWN", "product_name": "Producto no disponible", "brand": "Enviar", "reference": "", "unit": "", "price_amount": null, "price_currency": "", "price_symbol": "", "price_text": "", "price_amount_filled": "234.19", "price_is_imputed": "True", "price_imputation_source": "country_mean", "price_amount_usd": "", "price_amount_usd_filled": "234.1938", "fx_rate_local_per_usd": "1.0", "fx_source": "default_1usd", "information_text": "", "description_text": "", "features_text": "", "specifications_text": "", "benefits_text": "", "details_text": "", "other_sections": "", "sections": {}, "txt_path": "dataset/txt_limpios/761.txt", "html_path": "dataset/paginas_descargadas/761.html", "es_status": "EN", "category_canonical": "sin_categoria", "decision": "discard", "match_score": 0.3, "reasons": "no_category_detected;price_parse_failed"}
{"source_id": "762", "title": "Producto no disponible", "description": "", "breadcrumbs": "Enviar", "price_raw": "", "currency_raw": "", "url": "", "seller": "Desconocido", "availability": "unknown", "country": "UNKNOWN", "product_name": "Producto no disponible", "brand": "Enviar", "reference": "", "unit": "", "price_amount": null, "price_currency": "", "price_symbol": "", "price_text": "", "price_amount_filled": "234.19", "price_is_imputed": "True", "price_imputation_source": "country_mean", "price_amount_usd": "", "price_amount_usd_filled": "234.1938", "fx_rate_local_per_usd": "1.0", "fx_source": "default_1usd", "information_text": "", "description_text": "", "features_text": "", "specifications_text": "", "benefits_text": "", "details_text": "", "other_sections": "", "sections": {}, "txt_path": "dataset/txt_limpios/762.txt", "html_path": "dataset/paginas_descargadas/762.html", "es_status": "EN", "category_canonical": "sin_categoria", "decision": "discard", "match_score": 0.3, "reasons": "no_category_detected;price_parse_failed"}
{"source_id": "770", "title": "Producto no disponible", "description": "", "breadcrumbs": "Enviar", "price_raw": "", "currency_raw": "", "url": "", "seller": "Desconocido", "availability": "unknown", "country": "UNKNOWN", "product_name": "Producto no disponible", "brand": "Enviar", "reference": "", "unit": "", "price_amount": null, "price_currency": "", "price_symbol": "", "price_text": "", "price_amount_filled": "234.19", "price_is_imputed": "True", "price_imputation_source": "country_mean", "price_amount_usd": "", "price_amount_usd_filled": "234.1938", "fx_rate_local_per_usd": "1.0", "fx_source": "default_1usd", "information_text": "", "description_text": "", "features_text": "", "specifications_text": "", "benefits_text": "", "details_text": "", "other_sections": "", "sections": {}, "txt_path": "dataset/txt_limpios/770.txt", "html_path": "dataset/paginas_descargadas/770.html", "es_status": "EN", "category_canonical": "sin_categoria", "decision": "discard", "match_score": 0.3, "reasons": "no_category_detected;price_parse_failed"}
{"source_id": "776", "title": "Producto no disponible", "description": "", "breadcrumbs": "Enviar > 500 gr", "price_raw": "500.0", "currency_raw": "", "url": "", "seller": "Desconocido", "availability": "unknown", "country": "UNKNOWN", "product_name": "Producto no disponible", "brand": "Enviar", "reference": "", "unit": "500 gr", "price_amount": 500.0, "price_currency": "", "price_symbol": "", "price_text": "500", "price_amount_filled": "500.0", "price_is_imputed": "False", "price_imputation_source": "original", "price_amount_usd": "500.0", "price_amount_usd_filled": "500.0", "fx_rate_local_per_usd": "1.0", "fx_source": "default_1usd", "information_text": "", "description_text": "", "features_text": "", "specifications_text": "", "benefits_text": "", "details_text": "", "other_sections": "", "sections": {}, "txt_path": "dataset/txt_limpios/776.txt", "html_path": "dataset/paginas_descargadas/776.html", "es_status": "EN", "category_canonical": "sin_categoria", "decision": "discard", "match_score": 0.3, "reasons": "no_category_detected"}
{"source_id": "782", "title": "Producto no disponible", "description": "", "breadcrumbs": "Enviar", "price_raw": "400.0", "currency_raw": "", "url": "", "seller": "Desconocido", "availability": "unknown", "country": "UNKNOWN", "product_name": "Producto no disponible", "brand": "Enviar", "reference": "", "unit": "", "price_amount": 400.0, "price_currency": "", "price_symbol": "", "price_text": "400", "price_amount_filled": "400.0", "price_is_imputed": "False", "price_imputation_source": "original", "price_amount_usd": "400.0", "price_amount_usd_filled": "400.0", "fx_rate_local_per_usd": "1.0", "fx_source": "default_1usd", "information_text": "", "description_text": "", "features_text": "", "specifications_text": "", "benefits_text": "", "details_text": "", "other_sections": "", "sections": {}, "txt_path": "dataset/txt_limpios/782.txt", "html_path": "dataset/paginas_descargadas/782.html", "es_status": "EN", "category_canonical": "sin_categoria", "decision": "discard", "match_score": 0.3, "reasons": "no_category_detected"}
{"source_id": "787", "title": "Producto no disponible", "description": "", "breadcrumbs": "Enviar", "price_raw": "", "currency_raw": "", "url": "", "seller": "Desconocido", "availability": "unknown", "country": "UNKNOWN", "product_name": "Producto no disponible", "brand": "Enviar", "reference": "", "unit": "", "price_amount": null, "price_currency": "", "price_symbol": "", "price_text": "", "price_amount_filled": "234.19", "price_is_imputed": "True", "price_imputation_source": "country_mean", "price_amount_usd": "", "price_amount_usd_filled": "234.1938", "fx_rate_local_per_usd": "1.0", "fx_source": "default_1usd", "information_text": "", "description_text": "", "features_text": "", "specifications_text": "", "benefits_text": "", "details_text": "", "other_sections": "", "sections": {}, "txt_path": "dataset/txt_limpios/787.txt", "html_path": "dataset/paginas_descargadas/787.html", "es_status": "EN", "category_canonical": "sin_categoria", "decision": "discard", "match_score": 0.3, "reasons": "no_category_detected;price_parse_failed"}
{"source_id": "1598", "title": "Página não encontrada", "description": "", "breadcrumbs": "Voltar à Home", "price_raw": "", "currency_raw": "", "url": "", "seller": "Desconocido", "availability": "unknown", "country": "UNKNOWN", "product_name": "Página não encontrada", "brand": "Voltar à Home", "reference": "", "unit": "", "price_amount": null, "price_currency": "", "price_symbol": "", "price_text": "", "price_amount_filled": "234.19", "price_is_imputed": "True", "price_imputation_source": "country_mean", "price_amount_usd": "", "price_amount_usd_filled": "234.1938", "fx_rate_local_per_usd": "1.0", "fx_source": "default_1usd", "information_text": "", "description_text": "", "features_text": "", "specifications_text": "", "benefits_text": "", "details_text": "", "other_sections": "", "sections": {}, "txt_path": "dataset/txt_limpios/1598.txt", "html_path": "dataset/paginas_descargadas/1598.html", "es_status": "EN", "category_canonical": "sin_categoria", "decision": "discard", "match_score": 0.3, "reasons": "no_category_detected;price_parse_failed"}
{"source_id": "222", "title": "Página não encontrada", "description": "", "breadcrumbs": "Voltar à Home", "price_raw": "", "currency_raw": "", "url": "", "seller": "Desconocido", "availability": "unknown", "country": "UNKNOWN", "product_name": "Página não encontrada", "brand": "Voltar à Home", "reference": "", "unit": "", "price_amount": null, "price_currency": "", "price_symbol": "", "price_text": "", "price_amount_filled": "234.19", "price_is_imputed": "True", "price_imputation_source": "country_mean", "price_amount_usd": "", "price_amount_usd_filled": "234.1938", "fx_rate_local_per_usd": "1.0", "fx_source": "default_1usd", "information_text": "", "description_text": "", "features_text": "", "specifications_text": "", "benefits_text": "", "details_text": "", "other_sections": "", "sections": {}, "txt_path": "dataset/txt_limpios/222.txt", "html_path": "dataset/paginas_descargadas/222.html", "es_status": "EN", "category_canonical": "sin_categoria", "decision": "discard", "match_score": 0.3, "reasons": "no_category_detected;price_parse_failed"}
