{"source_id": "277", "title": "Meu Desconto", "description": "", "breadcrumbs": "Minha Lista > 1kg", "price_raw": "9.19", "currency_raw": "BRL", "url": "", "seller": "Desconocido", "availability": "unknown", "country": "BR", "product_name": "Meu Desconto", "brand": "Minha Lista", "reference": "", "unit": "1kg", "price_amount": 9.19, "price_currency": "BRL", "price_symbol": "R$", "price_text": "R$9,19", "price_amount_filled": "9.19", "price_is_imputed": "False", "price_imputation_source": "original", "price_amount_usd": "1.6869", "price_amount_usd_filled": "1.6869", "fx_rate_local_per_usd": "5.448", "fx_source": "from_brasil_cambio_dolar", "information_text": "", "description_text": "", "features_text": "", "specifications_text": "", "benefits_text": "", "details_text": "", "other_sections": "", "sections": {}, "txt_path": "dataset/txt_limpios/277.txt", "html_path": "dataset/paginas_descargadas/277.html", "es_status": "EN", "category_canonical": "sin_categoria", "decision": "discard", "match_score": 0.3, "reasons": "no_category_detected"}
{"source_id": "278", "title": "Meu Desconto", "description": "", "breadcrumbs": "Minha Lista > 1kg", "price_raw": "8.39", "currency_raw": "BRL", "url": "", "seller": "Desconocido", "availability": "unknown", "country": "BR", "product_name": "Meu Desconto", "brand": "Minha Lista", "reference": "", "unit": "1kg", "price_amount": 8.39, "price_currency": "BRL", "price_symbol": "R$", "price_text": "R$8,39", "price_amount_filled": "8.39", "price_is_imputed": "False", "price_imputation_source": "original", "price_amount_usd": "1.54", "price_amount_usd_filled": "1.54", "fx_rate_local_per_usd": "5.448", "fx_source": "from_brasil_cambio_dolar", "information_text": "", "description_text": "", "features_text": "", "specifications_text": "", "benefits_text": "", "details_text": "", "other_sections": "", "sections": {}, "txt_path": "dataset/txt_limpios/278.txt", "html_path": "dataset/paginas_descargadas/278.html", "es_status": "EN", "category_canonical": "sin_categoria", "decision": "discard", "match_score": 0.3, "reasons": "no_category_detected"}
{"source_id": "279", "title": "Meu Desconto", "description": "", "breadcrumbs": "Minha Lista > 250g", "price_raw": "12.29", "currency_raw": "BRL", "url": "", "seller": "Desconocido", "availability": "unknown", "country": "BR", "product_name": "Meu Desconto", "brand": "Minha Lista", "reference": "", "unit": "250g", "price_amount": 12.29, "price_currency": "BRL", "price_symbol": "R$", "price_text": "R$12,29", "price_amount_filled": "12.29", "price_is_imputed": "False", "price_imputation_source": "original", "price_amount_usd": "2.2559", "price_amount_usd_filled": "2.2559", "fx_rate_local_per_usd": "5.448", "fx_source": "from_brasil_cambio_dolar", "information_text": "", "description_text": "", "features_text": "", "specifications_text": "", "benefits_text": "", "details_text": "", "other_sections": "", "sections": {}, "txt_path": "dataset/txt_limpios/279.txt", "html_path": "dataset/paginas_descargadas/279.html", "es_status": "EN", "category_canonical": "sin_categoria", "decision": "discard", "match_score": 0.3, "reasons": "no_category_detected"}
{"source_id": "373", "title": "Meu Desconto", "description": "", "breadcrumbs": "Minha Lista > 5kg", "price_raw": "1.0", "currency_raw": "", "url": "", "seller": "Desconocido", "availability": "unknown", "country": "UNKNOWN", "product_name": "Meu Desconto", "brand": "Minha Lista", "reference": "", "unit": "5kg", "price_amount": 1.0, "price_currency": "", "price_symbol": "", "price_text": "1", "price_amount_filled": "1.0", "price_is_imputed": "False", "price_imputation_source": "original", "price_amount_usd": "1.0", "price_amount_usd_filled": "1.0", "fx_rate_local_per_usd": "1.0", "fx_source": "default_1usd", "information_text": "", "description_text": "", "features_text": "", "specifications_text": "", "benefits_text": "", "details_text": "", "other_sections": "", "sections": {}, "txt_path": "dataset/txt_limpios/373.txt", "html_path": "dataset/paginas_descargadas/373.html", "es_status": "EN", "category_canonical": "sin_categoria", "decision": "discard", "match_score": 0.3, "reasons": "no_category_detected"}
{"source_id": "374", "title": "Meu Desconto", "description": "", "breadcrumbs": "Minha Lista > 1kg", "price_raw": "5.09", "currency_raw": "BRL", "url": "", "seller": "Desconocido", "availability": "unknown", "country": "BR", "product_name": "Meu Desconto", "brand": "Minha Lista", "reference": "", "unit": "1kg", "price_amount": 5.09, "price_currency": "BRL", "price_symbol": "R$", "price_text": "R$5,09", "price_amount_filled": "5.09", "price_is_imputed": "False", "price_imputation_source": "original", "price_amount_usd": "0.9343", "price_amount_usd_filled": "0.9343", "fx_rate_local_per_usd": "5.448", "fx_source": "from_brasil_cambio_dolar", "information_text": "", "description_text": "", "features_text": "", "specifications_text": "", "benefits_text": "", "details_text": "", "other_sections": "", "sections": {}, "txt_path": "dataset/txt_limpios/374.txt", "html_path": "dataset/paginas_descargadas/374.html", "es_status": "EN", "category_canonical": "sin_categoria", "decision": "discard", "match_score": 0.3, "reasons": "no_category_detected"}
{"source_id": "375", "title": "Meu Desconto", "description": "", "breadcrumbs": "Minha Lista > 1kg", "price_raw": "7.29", "currency_raw": "BRL", "url": "", "seller": "Desconocido", "availability": "unknown", "country": "BR", "product_name": "Meu Desconto", "brand": "Minha Lista", "reference": "", "unit": "1kg", "price_amount": 7.29, "price_currency": "BRL", "price_symbol": "R$", "price_text": "R$7,29", "price_amount_filled": "7.29", "price_is_imputed": "False", "price_imputation_source": "original", "price_amount_usd": "1.3381", "price_amount_usd_filled": "1.3381", "fx_rate_local_per_usd": "5.448", "fx_source": "from_brasil_cambio_dolar", "information_text": "", "description_text": "", "features_text": "", "specifications_text": "", "benefits_text": "", "details_text": "", "other_sections": "", "sections": {}, "txt_path": "dataset/txt_limpios/375.txt", "html_path": "dataset/paginas_descargadas/375.html", "es_status": "EN", "category_canonical": "sin_categoria", "decision": "discard", "match_score": 0.3, "reasons": "no_category_detected"}
{"source_id": "376", "title": "Meu Desconto", "description": "", "breadcrumbs": "Minha Lista > 5kg", "price_raw": "17.99", "currency_raw": "BRL", "url": "", "seller": "Desconocido", "availability": "unknown", "country": "BR", "product_name": "Meu Desconto", "brand": "Minha Lista", "reference": "", "unit": "5kg", "price_amount": 17.99, "price_currency": "BRL", "price_symbol": "R$", "price_text": "R$17,99", "price_amount_filled": "17.99", "price_is_imputed": "False", "price_imputation_source": "original", "price_amount_usd": "3.3021", "price_amount_usd_filled": "3.3021", "fx_rate_local_per_usd": "5.448", "fx_source": "from_brasil_cambio_dolar", "information_text": "", "description_text": "", "features_text": "", "specifications_text": "", "benefits_text": "", "details_text": "", "other_sections": "", "sections": {}, "txt_path": "dataset/txt_limpios/376.txt", "html_path": "dataset/paginas_descargadas/376.html", "es_status": "EN", "category_canonical": "sin_categoria", "decision": "discard", "match_score": 0.3, "reasons": "no_category_detected"}
{"source_id": "377", "title": "Meu Desconto", "description": "", "breadcrumbs": "Minha Lista > 5kg", "price_raw": "28.99", "currency_raw": "BRL", "url": "", "seller": "Desconocido", "availability": "unknown", "country": "BR", "product_name": "Meu Desconto", "brand": "Minha Lista", "reference": "", "unit": "5kg", "price_amount": 28.99, "price_currency": "BRL", "price_symbol": "R$", "price_text": "R$28,99", "price_amount_filled": "28.99", "price_is_imputed": "False", "price_imputation_source": "original", "price_amount_usd": "5.3212", "price_amount_usd_filled": "5.3212", "fx_rate_local_per_usd": "5.448", "fx_source": "from_brasil_cambio_dolar", "information_text": "", "description_text": "", "features_text": "", "specifications_text": "", "benefits_text": "", "details_text": "", "other_sections": "", "sections": {}, "txt_path": "dataset/txt_limpios/377.txt", "html_path": "dataset/paginas_descargadas/377.html", "es_status": "EN", "category_canonical": "sin_categoria", "decision": "discard", "match_score": 0.3, "reasons": "no_category_detected"}
{"source_id": "378", "title": "Meu Desconto", "description": "", "breadcrumbs": "Minha Lista > 500g", "price_raw": "31.99", "currency_raw": "BRL", "url": "", "seller": "Desconocido", "availability": "unknown", "country": "BR", "product_name": "Meu Desconto", "brand": "Minha Lista", "reference": "", "unit": "500g", "price_amount": 31.99, "price_currency": "BRL", "price_symbol": "R$", "price_text": "R$31,99", "price_amount_filled": "31.99", "price_is_imputed": "False", "price_imputation_source": "original", "price_amount_usd": "5.8719", "price_amount_usd_filled": "5.8719", "fx_rate_local_per_usd": "5.448", "fx_source": "from_brasil_cambio_dolar", "information_text": "", "description_text": "", "features_text": "", "specifications_text": "", "benefits_text": "", "details_text": "", "other_sections": "", "sections": {}, "txt_path": "dataset/txt_limpios/378.txt", "html_path": "dataset/paginas_descargadas/378.html", "es_status": "EN", "category_canonical": "sin_categoria", "decision": "discard", "match_score": 0.3, "reasons": "no_category_detected"}
{"source_id": "379", "title": "Meu Desconto", "description": "", "breadcrumbs": "Minha Lista > 500g", "price_raw": "37.99", "currency_raw": "BRL", "url": "", "seller": "Desconocido", "availability": "unknown", "country": "BR", "product_name": "Meu Desconto", "brand": "Minha Lista", "reference": "", "unit": "500g", "price_amount": 37.99, "price_currency": "BRL", "price_symbol": "R$", "price_text": "R$37,99", "price_amount_filled": "37.99", "price_is_imputed": "False", "price_imputation_source": "original", "price_amount_usd": "6.9732", "price_amount_usd_filled": "6.9732", "fx_rate_local_per_usd": "5.448", "fx_source": "from_brasil_cambio_dolar", "information_text": "", "description_text": "", "features_text": "", "specifications_text": "", "benefits_text": "", "details_text": "", "other_sections": "", "sections": {}, "txt_path": "dataset/txt_limpios/379.txt", "html_path": "dataset/paginas_descargadas/379.html", "es_status": "EN", "category_canonical": "sin_categoria", "decision": "discard", "match_score": 0.3, "reasons": "no_category_detected"}
{"source_id": "380", "title": "Meu Desconto", "description": "", "breadcrumbs": "Minha Lista > 500g", "price_raw": "34.99", "currency_raw": "BRL", "url": "", "seller": "Desconocido", "availability": "unknown", "country": "BR", "product_name": "Meu Desconto", "brand": "Minha Lista", "reference": "", "unit": "500g", "price_amount": 34.99, "price_currency": "BRL", "price_symbol": "R$", "price_text": "R$34,99", "price_amount_filled": "34.99", "price_is_imputed": "False", "price_imputation_source": "original", "price_amount_usd": "6.4225", "price_amount_usd_filled": "6.4225", "fx_rate_local_per_usd": "5.448", "fx_source": "from_brasil_cambio_dolar", "information_text": "", "description_text": "", "features_text": "", "specifications_text": "", "benefits_text": "", "details_text": "", "other_sections": "", "sections": {}, "txt_path": "dataset/txt_limpios/380.txt", "html_path": "dataset/paginas_descargadas/380.html", "es_status": "EN", "category_canonical": "sin_categoria", "decision": "discard", "match_score": 0.3, "reasons": "no_category_detected"}
{"source_id": "381", "title": "Meu Desconto", "description": "", "breadcrumbs": "Minha Lista > 500g", "price_raw": "32.49", "currency_raw": "BRL", "url": "", "seller": "Desconocido", "availability": "unknown", "country": "BR", "product_name": "Meu Desconto", "brand": "Minha Lista", "reference": "", "unit": "500g", "price_amount": 32.49, "price_currency": "BRL", "price_symbol": "R$", "price_text": "R$32,49", "price_amount_filled": "32.49", "price_is_imputed": "False", "price_imputation_source": "original", "price_amount_usd": "5.9637", "price_amount_usd_filled": "5.9637", "fx_rate_local_per_usd": "5.448", "fx_source": "from_brasil_cambio_dolar", "information_text": "", "description_text": "", "features_text": "", "specifications_text": "", "benefits_text": "", "details_text": "", "other_sections": "", "sections": {}, "txt_path": "dataset/txt_limpios/381.txt", "html_path": "dataset/paginas_descargadas/381.html", "es_status": "EN", "category_canonical": "sin_categoria", "decision": "discard", "match_score": 0.3, "reasons": "no_category_detected"}
{"source_id": "382", "title": "Meu Desconto", "description": "", "breadcrumbs": "Minha Lista > 500g", "price_raw": "37.99", "currency_raw": "BRL", "url": "", "seller": "Desconocido", "availability": "unknown", "country": "BR", "product_name": "Meu Desconto", "brand": "Minha Lista", "reference": "", "unit": "500g", "price_amount": 37.99, "price_currency": "BRL", "price_symbol": "R$", "price_text": "R$37,99", "price_amount_filled": "37.99", "price_is_imputed": "False", "price_imputation_source": "original", "price_amount_usd": "6.9732", "price_amount_usd_filled": "6.9732", "fx_rate_local_per_usd": "5.448", "fx_source": "from_brasil_cambio_dolar", "information_text": "", "description_text": "", "features_text": "", "specifications_text": "", "benefits_text": "", "details_text": "", "other_sections": "", "sections": {}, "txt_path": "dataset/txt_limpios/382.txt", "html_path": "dataset/paginas_descargadas/382.html", "es_status": "EN", "category_canonical": "sin_categoria", "decision": "discard", "match_score": 0.3, "reasons": "no_category_detected"}
{"source_id": "383", "title": "Meu Desconto", "description": "", "breadcrumbs": "Minha Lista > 400g", "price_raw": "400.0", "currency_raw": "", "url": "", "seller": "Desconocido", "availability": "unknown", "country": "UNKNOWN", "product_name": "Meu Desconto", "brand": "Minha Lista", "reference": "", "unit": "400g", "price_amount": 400.0, "price_currency": "", "price_symbol": "", "price_text": "400", "price_amount_filled": "400.0", "price_is_imputed": "False", "price_imputation_source": "original", "price_amount_usd": "400.0", "price_amount_usd_filled": "400.0", "fx_rate_local_per_usd": "1.0", "fx_source": "default_1usd", "information_text": "", "description_text": "", "features_text": "", "specifications_text": "", "benefits_text": "", "details_text": "", "other_sections": "", "sections": {}, "txt_path": "dataset/txt_limpios/383.txt", "html_path": "dataset/paginas_descargadas/383.html", "es_status": "EN", "category_canonical": "sin_categoria", "decision": "discard", "match_score": 0.3, "reasons": "no_category_detected"}
{"source_id": "384", "title": "Meu Desconto", "description": "", "breadcrumbs": "Minha Lista > 450g", "price_raw": "6.99", "currency_raw": "BRL", "url": "", "seller": "Desconocido", "availability": "unknown", "country": "BR", "product_name": "Meu Desconto", "brand": "Minha Lista", "reference": "", "unit": "450g", "price_amount": 6.99, "price_currency": "BRL", "price_symbol": "R$", "price_text": "R$6,99", "price_amount_filled": "6.99", "price_is_imputed": "False", "price_imputation_source": "original", "price_amount_usd": "1.283", "price_amount_usd_filled": "1.283", "fx_rate_local_per_usd": "5.448", "fx_source": "from_brasil_cambio_dolar", "information_text": "", "description_text": "", "features_text": "", "specifications_text": "", "benefits_text": "", "details_text": "", "other_sections": "", "sections": {}, "txt_path": "dataset/txt_limpios/384.txt", "html_path": "dataset/paginas_descargadas/384.html", "es_status": "EN", "category_canonical": "sin_categoria", "decision": "discard", "match_score": 0.3, "reasons": "no_category_detected"}
{"source_id": "385", "title": "Meu Desconto", "description": "", "breadcrumbs": "Minha Lista > 480g", "price_raw": "9.99", "currency_raw": "BRL", "url": "", "seller": "Desconocido", "availability": "unknown", "country": "BR", "product_name": "Meu Desconto", "brand": "Minha Lista", "reference": "", "unit": "480g", "price_amount": 9.99, "price_currency": "BRL", "price_symbol": "R$", "price_text": "R$9,99", "price_amount_filled": "9.99", "price_is_imputed": "False", "price_imputation_source": "original", "price_amount_usd": "1.8337", "price_amount_usd_filled": "1.8337", "fx_rate_local_per_usd": "5.448", "fx_source": "from_brasil_cambio_dolar", "information_text": "", "description_text": "", "features_text": "", "specifications_text": "", "benefits_text": "", "details_text": "", "other_sections": "", "sections": {}, "txt_path": "dataset/txt_limpios/385.txt", "html_path": "dataset/paginas_descargadas/385.html", "es_status": "EN", "category_canonical": "sin_categoria", "decision": "discard", "match_score": 0.3, "reasons": "no_category_detected"}
{"source_id": "386", "title": "Meu Desconto", "description": "", "breadcrumbs": "Minha Lista > 480g", "price_raw": "9.99", "currency_raw": "BRL", "url": "", "seller": "Desconocido", "availability": "unknown", "country": "BR", "product_name": "Meu Desconto", "brand": "Minha Lista", "reference": "", "unit": "480g", "price_amount": 9.99, "price_currency": "BRL", "price_symbol": "R$", "price_text": "R$9,99", "price_amount_filled": "9.99", "price_is_imputed": "False", "price_imputation_source": "original", "price_amount_usd": "1.8337", "price_amount_usd_filled": "1.8337", "fx_rate_local_per_usd": "5.448", "fx_source": "from_brasil_cambio_dolar", "information_text": "", "description_text": "", "features_text": "", "specifications_text": "", "benefits_text": "", "details_text": "", "other_sections": "", "sections": {}, "txt_path": "dataset/txt_limpios/386.txt", "html_path": "dataset/paginas_descargadas/386.html", "es_status": "EN", "category_canonical": "sin_categoria", "decision": "discard", "match_score": 0.3, "reasons": "no_category_detected"}
{"source_id": "387", "title": "Meu Desconto", "description": "", "breadcrumbs": "Minha Lista > 400g", "price_raw": "5.99", "currency_raw": "BRL", "url": "", "seller": "Desconocido", "availability": "unknown", "country": "BR", "product_name": "Meu Desconto", "brand": "Minha Lista", "reference": "", "unit": "400g", "price_amount": 5.99, "price_currency": "BRL", "price_symbol": "R$", "price_text": "R$5,99", "price_amount_filled": "5.99", "price_is_imputed": "False", "price_imputation_source": "original", "price_amount_usd": "1.0995", "price_amount_usd_filled": "1.0995", "fx_rate_local_per_usd": "5.448", "fx_source": "from_brasil_cambio_dolar", "information_text": "", "description_text": "", "features_text": "", "specifications_text": "", "benefits_text": "", "details_text": "", "other_sections": "", "sections": {}, "txt_path": "dataset/txt_limpios/387.txt", "html_path": "dataset/paginas_descargadas/387.html", "es_status": "EN", "category_canonical": "sin_categoria", "decision": "discard", "match_score": 0.3, "reasons": "no_category_detected"}
{"source_id": "388", "title": "Meu Desconto", "description": "", "breadcrumbs": "Minha Lista > 350ml", "price_raw": "3.49", "currency_raw": "BRL", "url": "", "seller": "Desconocido", "availability": "unknown", "country": "BR", "product_name": "Meu Desconto", "brand": "Minha Lista", "reference": "", "unit": "350ml", "price_amount": 3.49, "price_currency": "BRL", "price_symbol": "R$", "price_text": "R$3,49", "price_amount_filled": "3.49", "price_is_imputed": "False", "price_imputation_source": "original", "price_amount_usd": "0.6406", "price_amount_usd_filled": "0.6406", "fx_rate_local_per_usd": "5.448", "fx_source": "from_brasil_cambio_dolar", "information_text": "", "description_text": "", "features_text": "", "specifications_text": "", "benefits_text": "", "details_text": "", "other_sections": "", "sections": {}, "txt_path": "dataset/txt_limpios/388.txt", "html_path": "dataset/paginas_descargadas/388.html", "es_status": "EN", "category_canonical": "sin_categoria", "decision": "discard", "match_score": 0.3, "reasons": "no_category_detected"}
{"source_id": "389", "title": "Meu Desconto", "description": "", "breadcrumbs": "Minha Lista > 2l", "price_raw": "11.99", "currency_raw": "BRL", "url": "", "seller": "Desconocido", "availability": "unknown", "country": "BR", "product_name": "Meu Desconto", "brand": "Minha Lista", "reference": "", "unit": "2l", "price_amount": 11.99, "price_currency": "BRL", "price_symbol": "R$", "price_text": "R$11,99", "price_amount_filled": "11.99", "price_is_imputed": "False", "price_imputation_source": "original", "price_amount_usd": "2.2008", "price_amount_usd_filled": "2.2008", "fx_rate_local_per_usd": "5.448", "fx_source": "from_brasil_cambio_dolar", "information_text": "", "description_text": "", "features_text": "", "specifications_text": "", "benefits_text": "", "details_text": "", "other_sections": "", "sections": {}, "txt_path": "dataset/txt_limpios/389.txt", "html_path": "dataset/paginas_descargadas/389.html", "es_status": "EN", "category_canonical": "sin_categoria", "decision": "discard", "match_score": 0.3, "reasons": "no_category_detected"}
