{"source_id": "1006", "title": "colaborar con nuestros estudios para marketing. También puede configurarlas.", "description": "Información de la marca", "breadcrumbs": "que podemos ofrecer. > 5Kg", "price_raw": "16.92", "currency_raw": "PEN", "url": "", "seller": "Desconocido", "availability": "unknown", "country": "PE", "product_name": "colaborar con nuestros estudios para marketing. También puede configurarlas.", "brand": "que podemos ofrecer.", "reference": "", "unit": "5Kg", "price_amount": 16.92, "price_currency": "PEN", "price_symbol": "S/", "price_text": "S/16.92", "price_amount_filled": "16.92", "price_is_imputed": "False", "price_imputation_source": "original", "price_amount_usd": "4.7662", "price_amount_usd_filled": "4.7662", "fx_rate_local_per_usd": "3.55", "fx_source": "from_peru_cambio_dolar", "information_text": "", "description_text": "Información de la marca", "features_text": "Presentación/Empaque | Bolsa | Producto Preparado | No | Arroz Pregraneado | Azúcares Porción | 0 | Calorías Porción | Carbohidratos Por Porción | Grasas Porción | Proteínas Porción | Sodio Porción | Advertencias De Almacenamiento | Almacenar en un lugar fresco y seco, lejos de agentes químicos, productos diferentes a alimentos. | Contenido Neto | 5kg | Denominación/Variedad | Extra | Advertencias de consumo | Consumir preferentemente antes de la fecha indicada en el envase. | Revisa todo | Importante destacar | El producto se debe almacenar en un ambiente cerrado, frescos y seco | Variedad: Extra | Presentación : Bolsa | Descripción del producto | plaza Vea | cuenta con una amplia variedad de | para que puedas elegir el que más se adecua a tus necesidades. | Uno de los ingredientes principales de la gastronomía peruana es el | . Este alimento acompaña muchos platos típicos de nuestro país como un Seco a la norteña, Lomo Saltado, Ají de pollo, Cau Cau entre otro más. Es que el arroz se ha ganado un espacio en el corazón de los peruanos, gracias a su sabor y textura lo convierten en el complemento perfecto para acompañar cualquier plato. | En | podrás encontrar diferentes presentaciones, tamaños y marcas. Por ejemplo, estás llevando una alimentación saludable te recomendamos revisar nuestro catálogo de | Arroz Integral y especiales | para que puedas elaborar tus recetas según tus requerimientos calóricos. | Recuerda que para lograr un | Arroz Graneadito | no debe faltar en tu cocina el | Aceite Vegetal | ! Gracias a su composición y versatilidad es perfecto para utilizarlo en cualquier receta, desde una fresca ensalada hasta un delicioso Arroz con pollo , graneadito y con el sabor preciso que a todos los peruanos nos encanta. ¡Qué esperas empieza a engreir a toda tu familia con tus mejores preparaciones! | - Conoce las distintas opciones en | en plazaVea Online! | *La imagen solo es referencial | \" Paisana es una de las marcas de arroz y menestras más queridas de las familias peruanas, ya que es el complemento perfecto para acompañar nuestra gastronomía. Paisana apoya la fusión e innovación y se preocupa por la nutrición de todos los peruanos, por eso también cuenta con su presentación de arroz Fortificado con hierro, zinc y 8 vitaminas y minerales para la nutrición de toda la familia.\" | ¿En qué búsqueda? Encuentra más variedades de | en plaza Vea | Componentes del Producto | Vendido por | En caso de que algo te guste: Puedes revisar nuestras | Políticas de cambios y/o devoluciones | y hacerlas efectivas en todas nuestras tiendas. | Productos | que te pueden interesar | Recomendado para ti", "specifications_text": "", "benefits_text": "", "details_text": "", "other_sections": "", "sections": {"Descripción": ["Información de la marca"], "Características": ["Presentación/Empaque", "Bolsa", "Producto Preparado", "No", "Arroz Pregraneado", "Azúcar por porción", "0", "Calorías Porción", "Carbohidratos Porción", "Grasas Porción", "Proteínas Porción", "Sodio Porción", "Advertencias De Almacenamiento", "Almacenar en un lugar fresco y seco, lejos de agentes químicos, productos diferentes a alimentos.", "Contenido Neto", "5kg", "Denominación/Variedad", "Extra", "Advertencias de consumo", "Consumir preferentemente antes de la fecha indicada en el envase.", "Revisa todo", "Importante destacar", "El producto se debe almacenar en un ambiente cerrado,fresco y seco", "Variedad: Extra", "Presentación : Bolsa", "Descripción del producto", "plazaVea", "cuenta con una amplia variedad de", "para que puedas elegir qué más se adecua a tus necesidades.", "Uno de los ingredientes principales de la gastronomía peruana es el", ". Este alimento acompaña muchos platos típicos de nuestro país como un Seco a la norteña, Lomo Saltado, Ají de pollo, Cau Cau entre otro más. Es que el arroz se ha ganado un espacio en el corazón de los peruanos, gracias a su sabor y textura lo convierten en el complemento perfecto para acompañar cualquier plato.", "En", "podrás encontrar diferentes presentaciones, tamaños y marcas. Por ejemplo, estás llevando una alimentación saludable te recomendamos revisar nuestro catálogo de", "Arroz Integral y especiales", "para que puedas elaborar tus recetas según tus requerimientos calóricos.", "¡Recuerda que para lograr un", "Arroz Graneadito", "no debe faltar en tu cocina el", "Aceite Vegetal", "! Gracias a su composición y versatilidad es perfecto para utilizar en cualquier receta, desde una fresca ensalada hasta un delicioso arroz con pollo , graneadito y con el sabor preciso que a todos los peruanos nos encanta. ¡Qué esperas empieza a engreir a toda tu familia con tus mejores preparaciones!", "¡Conoce las distintas opciones en", "en plazaVea Online!", "*La imagen solo es referencial", "\" Paisana es una de las marcas de arroz y menestras malas queridas de las familias peruanas, ya que es el complemento perfecto para acompañar nuestra gastronomía. Paisana apoya la fusión e innovación y se preocupa por la nutrición de todos los peruanos, por eso también cuenta con su presentación de arroz Fortificado con hierro, zinc y 8 vitaminas y minerales para la nutrición de toda la familia. \"", "¿En qué búsqueda? Encuentra más variedades de", "en plazaVea", "Componentes del Producto", "Vendido por", "En caso algo no vaya como gustes: Puedes revisar nuestras", "Politicas de cambios y/o devoluciones", "y hacerlas efectivas en todas nuestras tiendas.", "Productos", "que te pueden interesar", "Recomendado para ti"]}, "txt_path": "dataset/txt_limpios/1006.txt", "html_path": "dataset/paginas_descargadas/1006.html", "es_status": "ET", "category_canonical": "sin_categoria", "decision": "discard", "match_score": 0.3, "reasons": "no_category_detected"}
{"source_id": "1007", "title": "colaborar con nuestros estudios para marketing. También puede configurarlas.", "description": "Información de la marca", "breadcrumbs": "que podemos ofrecer. > 5Kg", "price_raw": "16.92", "currency_raw": "PEN", "url": "", "seller": "Desconocido", "availability": "unknown", "country": "PE", "product_name": "colaborar con nuestros estudios para marketing. También puede configurarlas.", "brand": "que podemos ofrecer.", "reference": "", "unit": "5Kg", "price_amount": 16.92, "price_currency": "PEN", "price_symbol": "S/", "price_text": "S/16.92", "price_amount_filled": "16.92", "price_is_imputed": "False", "price_imputation_source": "original", "price_amount_usd": "4.7662", "price_amount_usd_filled": "4.7662", "fx_rate_local_per_usd": "3.55", "fx_source": "from_peru_cambio_dolar", "information_text": "", "description_text": "Información de la marca", "features_text": "Presentación/Empaque | Bolsa | Producto Preparado | SI | Arroz Pregraneado | No | Azúcares Porción | 0 | Calorías Porción | Carbohidratos Por Porción | Grasas Porción | Proteínas Porción | Sodio Porción | Advertencias De Almacenamiento | Almacenar en un lugar cerrado, fresco y seco. | Contenido Neto | 5Kg | Denominación/Variedad | Extra Grado 1 | Advertencias de consumo | Consumir preferentemente antes de la fecha indicada en el envase. | Revisa todo | Importante destacar | El producto se debe almacenar en un ambiente cerrado, frescos y seco | Variedad: Extra Grado 1 | Presentación : Bolsa | Descripción del producto | plaza Vea | cuenta con una amplia variedad de | para que puedas elegir el que más se adecua a tus necesidades. | Uno de los ingredientes principales de la gastronomía peruana es el | . Este alimento acompaña muchos platos típicos de nuestro país como un Seco a la norteña, Lomo Saltado, Ají de pollo, Cau Cau entre otro más. Es que el arroz se ha ganado un espacio en el corazón de los peruanos, gracias a su sabor y textura lo convierten en el complemento perfecto para acompañar cualquier plato. | En | podrás encontrar diferentes presentaciones, tamaños y marcas. Por ejemplo, estás llevando una alimentación saludable te recomendamos revisar nuestro catálogo de | Arroz Integral y especiales | para que puedas elaborar tus recetas según tus requerimientos calóricos. | Recuerda que para lograr un | Arroz Graneadito | no debe faltar en tu cocina el | Aceite Vegetal | ! Gracias a su composición y versatilidad es perfecto para utilizarlo en cualquier receta, desde una fresca ensalada hasta un delicioso Arroz con pollo , graneadito y con el sabor preciso que a todos los peruanos nos encanta. ¡Qué esperas empieza a engreir a toda tu familia con tus mejores preparaciones! |. Conoce las distintas opciones en | en plazaVea Online! | *La imagen solo es referencial | Bell ́s | \"Bell's ofrece una alternativa accesible en torno a calidad y precio de sus productos; con el respaldo y garantía de plazaVea.\" | ¿En qué búsqueda? Encuentra más variedades de | en plaza Vea | Componentes del Producto | Vendido por | En caso de que algo te guste: Puedes revisar nuestras | Políticas de cambios y/o devoluciones | y hacerlas efectivas en todas nuestras tiendas. | Productos | que te pueden interesar | Recomendado para ti", "specifications_text": "", "benefits_text": "", "details_text": "", "other_sections": "", "sections": {"Descripción": ["Información de la marca"], "Características": ["Presentación/Empaque", "Bolsa", "Producto Preparado", "SI", "Arroz Pregraneado", "No", "Azúcar por porción", "0", "Calorías Porción", "Carbohidratos Porción", "Grasas Porción", "Proteínas Porción", "Sodio Porción", "Advertencias De Almacenamiento", "Almacenar en un lugar cerrado, fresco y seco.", "Contenido Neto", "5Kg", "Denominación/Variedad", "Extra Grado 1", "Advertencias de consumo", "Consumir preferentemente antes de la fecha indicada en el envase.", "Revisa todo", "Importante destacar", "El producto se debe almacenar en un ambiente cerrado,fresco y seco", "Variedad: Extra Grado 1", "Presentación : Bolsa", "Descripción del producto", "plazaVea", "cuenta con una amplia variedad de", "para que puedas elegir qué más se adecua a tus necesidades.", "Uno de los ingredientes principales de la gastronomía peruana es el", ". Este alimento acompaña muchos platos típicos de nuestro país como un Seco a la norteña, Lomo Saltado, Ají de pollo, Cau Cau entre otro más. Es que el arroz se ha ganado un espacio en el corazón de los peruanos, gracias a su sabor y textura lo convierten en el complemento perfecto para acompañar cualquier plato.", "En", "podrás encontrar diferentes presentaciones, tamaños y marcas. Por ejemplo, estás llevando una alimentación saludable te recomendamos revisar nuestro catálogo de", "Arroz Integral y especiales", "para que puedas elaborar tus recetas según tus requerimientos calóricos.", "¡Recuerda que para lograr un", "Arroz Graneadito", "no debe faltar en tu cocina el", "Aceite Vegetal", "! Gracias a su composición y versatilidad es perfecto para utilizar en cualquier receta, desde una fresca ensalada hasta un delicioso arroz con pollo , graneadito y con el sabor preciso que a todos los peruanos nos encanta. ¡Qué esperas empieza a engreir a toda tu familia con tus mejores preparaciones!", "¡Conoce las distintas opciones en", "en plazaVea Online!", "*La imagen solo es referencial", "Bell´s", "\"Bell's ofrece una alternativa accesible en torno a la calidad y precio de sus productos; con el respaldo y garantía de plaza Vea", "¿En qué búsqueda? Encuentra más variedades de", "en plazaVea", "Componentes del Producto", "Vendido por", "En caso algo no vaya como gustes: Puedes revisar nuestras", "Politicas de cambios y/o devoluciones", "y hacerlas efectivas en todas nuestras tiendas.", "Productos", "que te pueden interesar", "Recomendado para ti"]}, "txt_path": "dataset/txt_limpios/1007.txt", "html_path": "dataset/paginas_descargadas/1007.html", "es_status": "ET", "category_canonical": "sin_categoria", "decision": "discard", "match_score": 0.3, "reasons": "no_category_detected"}
{"source_id": "1008", "title": "colaborar con nuestros estudios para marketing. También puede configurarlas.", "description": "Información de la marca", "breadcrumbs": "que podemos ofrecer. > 5kg", "price_raw": "16.92", "currency_raw": "PEN", "url": "", "seller": "Desconocido", "availability": "unknown", "country": "PE", "product_name": "colaborar con nuestros estudios para marketing. También puede configurarlas.", "brand": "que podemos ofrecer.", "reference": "", "unit": "5kg", "price_amount": 16.92, "price_currency": "PEN", "price_symbol": "S/", "price_text": "S/16.92", "price_amount_filled": "16.92", "price_is_imputed": "False", "price_imputation_source": "original", "price_amount_usd": "4.7662", "price_amount_usd_filled": "4.7662", "fx_rate_local_per_usd": "3.55", "fx_source": "from_peru_cambio_dolar", "information_text": "", "description_text": "Información de la marca", "features_text": "Presentación/Empaque | Bolsa | Producto Preparado | No | Arroz Pregraneado | Porción Sugerida | 100g | Azúcares Porción | 0 | Calorías Porción | 361Kcal | Carbohidratos Porción | 79.5g | Grasas Porción | 0.6g | Proteínas Porción | 6.6g | Sodio Porción | 13mg | Advertencias De Almacenamiento | Almacenar en un lugar cerrado, fresco y seco. | Contenido Neto | 5Kg | Denominación/Variedad | Nir Añejo | Advertencias de consumo | Consumir preferentemente antes de la fecha indicada en el envase. | Revisa todo | Importante destacar | El producto se debe almacenar en un ambiente cerrado, frescos y seco | Variedad: Añejado | Presentación : Bolsa | Descripción del producto | plaza Vea | cuenta con una amplia variedad de | para que puedas elegir el que más se adecua a tus necesidades. | Uno de los ingredientes principales de la gastronomía peruana es el | . Este alimento acompaña muchos platos típicos de nuestro país como un Seco a la norteña, Lomo Saltado, Ají de pollo, Cau Cau entre otro más. Es que el arroz se ha ganado un espacio en el corazón de los peruanos, gracias a su sabor y textura lo convierten en el complemento perfecto para acompañar cualquier plato. | En | podrás encontrar diferentes presentaciones, tamaños y marcas. Por ejemplo, estás llevando una alimentación saludable te recomendamos revisar nuestro catálogo de | Arroz Integral y especiales | para que puedas elaborar tus recetas según tus requerimientos calóricos. | Recuerda que para lograr un | Arroz Graneadito | no debe faltar en tu cocina el | Aceite Vegetal | ! Gracias a su composición y versatilidad es perfecto para utilizarlo en cualquier receta, desde una fresca ensalada hasta un delicioso Arroz con pollo , graneadito y con el sabor preciso que a todos los peruanos nos encanta. ¡Qué esperas empieza a engreir a toda tu familia con tus mejores preparaciones! | - Conoce las distintas opciones en | en plazaVea Online! | *La imagen solo es referencial | ¿En qué búsqueda? Encuentra más variedades de | en plaza Vea | Componentes del Producto | Vendido por | En caso de que algo te guste: Puedes revisar nuestras | Políticas de cambios y/o devoluciones | y hacerlas efectivas en todas nuestras tiendas. | Productos | que te pueden interesar | Recomendado para ti", "specifications_text": "", "benefits_text": "", "details_text": "", "other_sections": "", "sections": {"Descripción": ["Información de la marca"], "Características": ["Presentación/Empaque", "Bolsa", "Producto Preparado", "No", "Arroz Pregraneado", "Porción sugerida", "100g", "Azúcar por porción", "0", "Calorías Porción", "361Kcal", "Carbohidratos Porción", "79.5g", "Grasas Porción", "0.6g", "Proteínas Porción", "6.6g", "Sodio Porción", "13mg", "Advertencias De Almacenamiento", "Almacenar en un lugar cerrado, fresco y seco.", "Contenido Neto", "5Kg", "Denominación/Variedad", "Nir Añejo", "Advertencias de consumo", "Consumir preferentemente antes de la fecha indicada en el envase.", "Revisa todo", "Importante destacar", "El producto se debe almacenar en un ambiente cerrado,fresco y seco", "Variedad: Añejado", "Presentación : Bolsa", "Descripción del producto", "plazaVea", "cuenta con una amplia variedad de", "para que puedas elegir qué más se adecua a tus necesidades.", "Uno de los ingredientes principales de la gastronomía peruana es el", ". Este alimento acompaña muchos platos típicos de nuestro país como un Seco a la norteña, Lomo Saltado, Ají de pollo, Cau Cau entre otro más. Es que el arroz se ha ganado un espacio en el corazón de los peruanos, gracias a su sabor y textura lo convierten en el complemento perfecto para acompañar cualquier plato.", "En", "podrás encontrar diferentes presentaciones, tamaños y marcas. Por ejemplo, estás llevando una alimentación saludable te recomendamos revisar nuestro catálogo de", "Arroz Integral y especiales", "para que puedas elaborar tus recetas según tus requerimientos calóricos.", "¡Recuerda que para lograr un", "Arroz Graneadito", "no debe faltar en tu cocina el", "Aceite Vegetal", "! Gracias a su composición y versatilidad es perfecto para utilizar en cualquier receta, desde una fresca ensalada hasta un delicioso arroz con pollo , graneadito y con el sabor preciso que a todos los peruanos nos encanta. ¡Qué esperas empieza a engreir a toda tu familia con tus mejores preparaciones!", "¡Conoce las distintas opciones en", "en plazaVea Online!", "*La imagen solo es referencial", "¿En qué búsqueda? Encuentra más variedades de", "en plazaVea", "Componentes del Producto", "Vendido por", "En caso algo no vaya como gustes: Puedes revisar nuestras", "Politicas de cambios y/o devoluciones", "y hacerlas efectivas en todas nuestras tiendas.", "Productos", "que te pueden interesar", "Recomendado para ti"]}, "txt_path": "dataset/txt_limpios/1008.txt", "html_path": "dataset/paginas_descargadas/1008.html", "es_status": "ET", "category_canonical": "sin_categoria", "decision": "discard", "match_score": 0.3, "reasons": "no_category_detected"}
