source_id,title,description,breadcrumbs,price_raw,currency_raw,url,seller,availability,country,product_name,brand,reference,unit,price_amount,price_currency,price_symbol,price_text,price_amount_filled,price_is_imputed,price_imputation_source,price_amount_usd,price_amount_usd_filled,fx_rate_local_per_usd,fx_source,information_text,description_text,features_text,specifications_text,benefits_text,details_text,other_sections,sections,txt_path,html_path,es_status,category_canonical,decision,match_score,reasons
125,¡Lo mejor te está esperando!,"El (T)Pan Blanco MyBrand de 680 gramos es la elección perfecta para tus comidas diarias. Su textura suave y su sabor delicado lo hacen ideal para acompañar cualquier platillo. Está hecho con ingredientes de alta calidad, gara | ... Ver más | Favoritos | Recomendados | Pan Blanco    Bimbo 350 G | 350 GR | 680 GR | Pan Blanco Perfect Crafted    Nature... | 624 GR | Pan Blanco Butter Top   Nature's Own... | 567 GR | Pan Integral   Mybrand 680 G | Pan Integral   Bimbo 350 G | Pan Artesano   Bimbo 567 G | Pan Thins Cero Cero     Bimbo 255 G | 255 GR | Pan Multigrano   Mybrand 567 G | Pan Crafted Multigrain   Nature's Ow... | Pan White    Sara Lee 567 G | Pan Honey Wheat   Nature's Own 567 G | Pan 45 Calories Multigrain   Sara Le... | Medias Noches Brioche   Bimbo 384 G | 384 GR | Pan Crafted Brioche   Nature's Own 6... | Medias Noches Parrilleros   Bimbo 52... | 526 GR | Pan 100 % Integral Whole Wheat   Nat... | Pan Integral 100% Whole Grain   Natu... | Pan Tostado Mini Mantequilla   Bimbo... | 115 GR | Pan Honey Wheat    Sara Lee 567 G | Pan Classic 100% Whole Wheat    Sara... | Pan 12 Granos   Webers 680 G | Pan Pita Natural   Jaye 680 G | Pan 100% Whole Wheat Honey 45 Calori... | AGOTADO | Pan Pita Pocket    Jaye 680 G | Mini Pita Integral   Jaye 500 G | 500 GR | Vino Blanco  Balero 750 Ml | 750 ML | Mini Pita Centeno Negro   Jaye 500 G | Tocino Ahumado  Chimex 170 Gr | 170 GR | Jugo Manzana  Unico Fresco 200 Ml | 200 ML | Mes patrio Herdez | Ver más | Adobo    Doña María 235 G | Mole Doña María Almendrado En Pasta ... | Mole Doña María Almendrado Listo Par... | Mole Doña María Poblano Con Cacao En... | Mole Doña Maria Poblano Con Cacao Li... | Mole Doña Mariía Rojo En Pasta   125... | Mole En Pasta 430 Gramos   Doña Mari... | Mole Listo Para Servir  Para Servir ... | Mole Rojo En Pasta  Doña Maria 235 G | Mole Verde En Pasta  Doña Maria 230 ... | Pipián En Pasta  Doña Maria 230 G | Salsa Cacahuate Picante Cremosa   He... | Salsa Casera Con Habanero   Herdez 4... | Salsa Casera  Herdez 210 G | Salsa Guacamole 15% Mas Guacamole He...",Descarga la app > 680 G,44.9,,,Desconocido,unknown,UNKNOWN,¡Lo mejor te está esperando!,Descarga la app,,680 G,44.90,,$,$44.90,44.9,False,original,44.9,44.9,1.0,default_1usd,,,,,,"El (T)Pan Blanco MyBrand de 680 gramos es la elección perfecta para tus comidas diarias. Su textura suave y su sabor delicado lo hacen ideal para acompañar cualquier platillo. Está hecho con ingredientes de alta calidad, gara | ... Ver más | Favoritos | Recomendados | Pan Blanco    Bimbo 350 G | 350 GR | 680 GR | Pan Blanco Perfect Crafted    Nature... | 624 GR | Pan Blanco Butter Top   Nature's Own... | 567 GR | Pan Integral   Mybrand 680 G | Pan Integral   Bimbo 350 G | Pan Artesano   Bimbo 567 G | Pan Thins Cero Cero     Bimbo 255 G | 255 GR | Pan Multigrano   Mybrand 567 G | Pan Crafted Multigrain   Nature's Ow... | Pan White    Sara Lee 567 G | Pan Honey Wheat   Nature's Own 567 G | Pan 45 Calories Multigrain   Sara Le... | Medias Noches Brioche   Bimbo 384 G | 384 GR | Pan Crafted Brioche   Nature's Own 6... | Medias Noches Parrilleros   Bimbo 52... | 526 GR | Pan 100 % Integral Whole Wheat   Nat... | Pan Integral 100% Whole Grain   Natu... | Pan Tostado Mini Mantequilla   Bimbo... | 115 GR | Pan Honey Wheat    Sara Lee 567 G | Pan Classic 100% Whole Wheat    Sara... | Pan 12 Granos   Webers 680 G | Pan Pita Natural   Jaye 680 G | Pan 100% Whole Wheat Honey 45 Calori... | AGOTADO | Pan Pita Pocket    Jaye 680 G | Mini Pita Integral   Jaye 500 G | 500 GR | Vino Blanco  Balero 750 Ml | 750 ML | Mini Pita Centeno Negro   Jaye 500 G | Tocino Ahumado  Chimex 170 Gr | 170 GR | Jugo Manzana  Unico Fresco 200 Ml | 200 ML | Mes patrio Herdez | Ver más | Adobo    Doña María 235 G | Mole Doña María Almendrado En Pasta ... | Mole Doña María Almendrado Listo Par... | Mole Doña María Poblano Con Cacao En... | Mole Doña Maria Poblano Con Cacao Li... | Mole Doña Mariía Rojo En Pasta   125... | Mole En Pasta 430 Gramos   Doña Mari... | Mole Listo Para Servir  Para Servir ... | Mole Rojo En Pasta  Doña Maria 235 G | Mole Verde En Pasta  Doña Maria 230 ... | Pipián En Pasta  Doña Maria 230 G | Salsa Cacahuate Picante Cremosa   He... | Salsa Casera Con Habanero   Herdez 4... | Salsa Casera  Herdez 210 G | Salsa Guacamole 15% Mas Guacamole He...",,"{""Detalles"": [""El (T)Pan Blanco MyBrand de 680 gramos es la elección perfecta para tus comidas diarias. Su textura suave y su sabor delicado lo hacen ideal para acompañar cualquier platillo. Está hecho con ingredientes de alta calidad, gara"", ""... Ver más"", ""Favoritos"", ""Recomendados"", ""Pan Blanco    Bimbo 350 G"", ""350 GR"", ""680 GR"", ""Pan Blanco Perfect Crafted    Nature..."", ""624 GR"", ""Pan Blanco Butter Top   Nature's Own..."", ""567 GR"", ""Pan Integral   Mybrand 680 G"", ""Pan Integral   Bimbo 350 G"", ""Pan Artesano   Bimbo 567 G"", ""Pan Thins Cero Cero     Bimbo 255 G"", ""255 GR"", ""Pan Multigrano   Mybrand 567 G"", ""Pan Crafted Multigrain   Nature's Ow..."", ""Pan White    Sara Lee 567 G"", ""Pan Honey Wheat   Nature's Own 567 G"", ""Pan 45 Calories Multigrain   Sara Le..."", ""Medias Noches Brioche   Bimbo 384 G"", ""384 GR"", ""Pan Crafted Brioche   Nature's Own 6..."", ""Medias Noches Parrilleros   Bimbo 52..."", ""526 GR"", ""Pan 100 % Integral Whole Wheat   Nat..."", ""Pan Integral 100% Whole Grain   Natu..."", ""Pan Tostado Mini Mantequilla   Bimbo..."", ""115 GR"", ""Pan Honey Wheat    Sara Lee 567 G"", ""Pan Classic 100% Whole Wheat    Sara..."", ""Pan 12 Granos   Webers 680 G"", ""Pan Pita Natural   Jaye 680 G"", ""Pan 100% Whole Wheat Honey 45 Calori..."", ""AGOTADO"", ""Pan Pita Pocket    Jaye 680 G"", ""Mini Pita Integral   Jaye 500 G"", ""500 GR"", ""Vino Blanco  Balero 750 Ml"", ""750 ML"", ""Mini Pita Centeno Negro   Jaye 500 G"", ""Tocino Ahumado  Chimex 170 Gr"", ""170 GR"", ""Jugo Manzana  Unico Fresco 200 Ml"", ""200 ML"", ""Mes patrio Herdez"", ""Ver más"", ""Adobo    Doña María 235 G"", ""Mole Doña María Almendrado En Pasta ..."", ""Mole Doña María Almendrado Listo Par..."", ""Mole Doña María Poblano Con Cacao En..."", ""Mole Doña Maria Poblano Con Cacao Li..."", ""Mole Doña Mariía Rojo En Pasta   125..."", ""Mole En Pasta 430 Gramos   Doña Mari..."", ""Mole Listo Para Servir  Para Servir ..."", ""Mole Rojo En Pasta  Doña Maria 235 G"", ""Mole Verde En Pasta  Doña Maria 230 ..."", ""Pipián En Pasta  Doña Maria 230 G"", ""Salsa Cacahuate Picante Cremosa   He..."", ""Salsa Casera Con Habanero   Herdez 4..."", ""Salsa Casera  Herdez 210 G"", ""Salsa Guacamole 15% Mas Guacamole He...""]}",dataset/txt_limpios/125.txt,dataset/paginas_descargadas/125.html,EN,pan,keep,0.60,heuristic_default
126,¡Lo mejor te está esperando!,"El (T)PAN BLANCO PERFECT CRAFTED de Nature's Own en presentación de 624 gramos es la elección perfecta para tus comidas. Con su textura suave y sabor delicioso, este pan hará que cada bocado sea una experiencia única. Ideal p | ... Ver más | Favoritos | Recomendados | Pan Blanco    Bimbo 350 G | 350 GR | Pan Blanco   Mybrand 680 G | 680 GR | Pan Blanco Perfect Crafted    Nature... | 624 GR | Pan Blanco Butter Top   Nature's Own... | 567 GR | Pan Integral   Mybrand 680 G | Pan Integral   Bimbo 350 G | Pan Artesano   Bimbo 567 G | Pan Thins Cero Cero     Bimbo 255 G | 255 GR | Pan Multigrano   Mybrand 567 G | Pan Crafted Multigrain   Nature's Ow... | Pan White    Sara Lee 567 G | Pan Honey Wheat   Nature's Own 567 G | Pan 45 Calories Multigrain   Sara Le... | Medias Noches Brioche   Bimbo 384 G | 384 GR | Pan Crafted Brioche   Nature's Own 6... | Medias Noches Parrilleros   Bimbo 52... | 526 GR | Pan 100 % Integral Whole Wheat   Nat... | Pan Integral 100% Whole Grain   Natu... | Pan Tostado Mini Mantequilla   Bimbo... | 115 GR | Pan Honey Wheat    Sara Lee 567 G | Pan Classic 100% Whole Wheat    Sara... | Pan 12 Granos   Webers 680 G | Pan Pita Natural   Jaye 680 G | Pan 100% Whole Wheat Honey 45 Calori... | AGOTADO | Pan Pita Pocket    Jaye 680 G | Mini Pita Integral   Jaye 500 G | 500 GR | Vino Blanco  Balero 750 Ml | 750 ML | Mini Pita Centeno Negro   Jaye 500 G | Tocino Ahumado  Chimex 170 Gr | 170 GR | Jugo Manzana  Unico Fresco 200 Ml | 200 ML | Mes patrio Herdez | Ver más | Adobo    Doña María 235 G | Mole Doña María Almendrado En Pasta ... | Mole Doña María Almendrado Listo Par... | Mole Doña María Poblano Con Cacao En... | Mole Doña Maria Poblano Con Cacao Li... | Mole Doña Mariía Rojo En Pasta   125... | Mole En Pasta 430 Gramos   Doña Mari... | Mole Listo Para Servir  Para Servir ... | Mole Rojo En Pasta  Doña Maria 235 G | Mole Verde En Pasta  Doña Maria 230 ... | Pipián En Pasta  Doña Maria 230 G | Salsa Cacahuate Picante Cremosa   He... | Salsa Casera Con Habanero   Herdez 4... | Salsa Casera  Herdez 210 G | Salsa Guacamole 15% Mas Guacamole He...",Descarga la app > 624 G,62.9,,,Desconocido,unknown,UNKNOWN,¡Lo mejor te está esperando!,Descarga la app,,624 G,62.90,,$,$62.90,62.9,False,original,62.9,62.9,1.0,default_1usd,,,,,,"El (T)PAN BLANCO PERFECT CRAFTED de Nature's Own en presentación de 624 gramos es la elección perfecta para tus comidas. Con su textura suave y sabor delicioso, este pan hará que cada bocado sea una experiencia única. Ideal p | ... Ver más | Favoritos | Recomendados | Pan Blanco    Bimbo 350 G | 350 GR | Pan Blanco   Mybrand 680 G | 680 GR | Pan Blanco Perfect Crafted    Nature... | 624 GR | Pan Blanco Butter Top   Nature's Own... | 567 GR | Pan Integral   Mybrand 680 G | Pan Integral   Bimbo 350 G | Pan Artesano   Bimbo 567 G | Pan Thins Cero Cero     Bimbo 255 G | 255 GR | Pan Multigrano   Mybrand 567 G | Pan Crafted Multigrain   Nature's Ow... | Pan White    Sara Lee 567 G | Pan Honey Wheat   Nature's Own 567 G | Pan 45 Calories Multigrain   Sara Le... | Medias Noches Brioche   Bimbo 384 G | 384 GR | Pan Crafted Brioche   Nature's Own 6... | Medias Noches Parrilleros   Bimbo 52... | 526 GR | Pan 100 % Integral Whole Wheat   Nat... | Pan Integral 100% Whole Grain   Natu... | Pan Tostado Mini Mantequilla   Bimbo... | 115 GR | Pan Honey Wheat    Sara Lee 567 G | Pan Classic 100% Whole Wheat    Sara... | Pan 12 Granos   Webers 680 G | Pan Pita Natural   Jaye 680 G | Pan 100% Whole Wheat Honey 45 Calori... | AGOTADO | Pan Pita Pocket    Jaye 680 G | Mini Pita Integral   Jaye 500 G | 500 GR | Vino Blanco  Balero 750 Ml | 750 ML | Mini Pita Centeno Negro   Jaye 500 G | Tocino Ahumado  Chimex 170 Gr | 170 GR | Jugo Manzana  Unico Fresco 200 Ml | 200 ML | Mes patrio Herdez | Ver más | Adobo    Doña María 235 G | Mole Doña María Almendrado En Pasta ... | Mole Doña María Almendrado Listo Par... | Mole Doña María Poblano Con Cacao En... | Mole Doña Maria Poblano Con Cacao Li... | Mole Doña Mariía Rojo En Pasta   125... | Mole En Pasta 430 Gramos   Doña Mari... | Mole Listo Para Servir  Para Servir ... | Mole Rojo En Pasta  Doña Maria 235 G | Mole Verde En Pasta  Doña Maria 230 ... | Pipián En Pasta  Doña Maria 230 G | Salsa Cacahuate Picante Cremosa   He... | Salsa Casera Con Habanero   Herdez 4... | Salsa Casera  Herdez 210 G | Salsa Guacamole 15% Mas Guacamole He...",,"{""Detalles"": [""El (T)PAN BLANCO PERFECT CRAFTED de Nature's Own en presentación de 624 gramos es la elección perfecta para tus comidas. Con su textura suave y sabor delicioso, este pan hará que cada bocado sea una experiencia única. Ideal p"", ""... Ver más"", ""Favoritos"", ""Recomendados"", ""Pan Blanco    Bimbo 350 G"", ""350 GR"", ""Pan Blanco   Mybrand 680 G"", ""680 GR"", ""Pan Blanco Perfect Crafted    Nature..."", ""624 GR"", ""Pan Blanco Butter Top   Nature's Own..."", ""567 GR"", ""Pan Integral   Mybrand 680 G"", ""Pan Integral   Bimbo 350 G"", ""Pan Artesano   Bimbo 567 G"", ""Pan Thins Cero Cero     Bimbo 255 G"", ""255 GR"", ""Pan Multigrano   Mybrand 567 G"", ""Pan Crafted Multigrain   Nature's Ow..."", ""Pan White    Sara Lee 567 G"", ""Pan Honey Wheat   Nature's Own 567 G"", ""Pan 45 Calories Multigrain   Sara Le..."", ""Medias Noches Brioche   Bimbo 384 G"", ""384 GR"", ""Pan Crafted Brioche   Nature's Own 6..."", ""Medias Noches Parrilleros   Bimbo 52..."", ""526 GR"", ""Pan 100 % Integral Whole Wheat   Nat..."", ""Pan Integral 100% Whole Grain   Natu..."", ""Pan Tostado Mini Mantequilla   Bimbo..."", ""115 GR"", ""Pan Honey Wheat    Sara Lee 567 G"", ""Pan Classic 100% Whole Wheat    Sara..."", ""Pan 12 Granos   Webers 680 G"", ""Pan Pita Natural   Jaye 680 G"", ""Pan 100% Whole Wheat Honey 45 Calori..."", ""AGOTADO"", ""Pan Pita Pocket    Jaye 680 G"", ""Mini Pita Integral   Jaye 500 G"", ""500 GR"", ""Vino Blanco  Balero 750 Ml"", ""750 ML"", ""Mini Pita Centeno Negro   Jaye 500 G"", ""Tocino Ahumado  Chimex 170 Gr"", ""170 GR"", ""Jugo Manzana  Unico Fresco 200 Ml"", ""200 ML"", ""Mes patrio Herdez"", ""Ver más"", ""Adobo    Doña María 235 G"", ""Mole Doña María Almendrado En Pasta ..."", ""Mole Doña María Almendrado Listo Par..."", ""Mole Doña María Poblano Con Cacao En..."", ""Mole Doña Maria Poblano Con Cacao Li..."", ""Mole Doña Mariía Rojo En Pasta   125..."", ""Mole En Pasta 430 Gramos   Doña Mari..."", ""Mole Listo Para Servir  Para Servir ..."", ""Mole Rojo En Pasta  Doña Maria 235 G"", ""Mole Verde En Pasta  Doña Maria 230 ..."", ""Pipián En Pasta  Doña Maria 230 G"", ""Salsa Cacahuate Picante Cremosa   He..."", ""Salsa Casera Con Habanero   Herdez 4..."", ""Salsa Casera  Herdez 210 G"", ""Salsa Guacamole 15% Mas Guacamole He...""]}",dataset/txt_limpios/126.txt,dataset/paginas_descargadas/126.html,EN,pan,keep,0.60,heuristic_default
127,¡Lo mejor te está esperando!,"Disfruta del delicioso sabor y la textura suave del Pan Blanco Bimbo en su práctico paquete de 620 gramos. Perfecto para tus desayunos y meriendas, este pan es un clásico que nunca pasa de moda. ¡No te quedes sin el tuyo! | ... Ver más | Favoritos | Recomendados | 620 GR | Pan Blanco    Bimbo 350 G | 350 GR | Pan Blanco   Mybrand 680 G | 680 GR | Pan Blanco Perfect Crafted    Nature... | 624 GR | Pan Blanco Butter Top   Nature's Own... | 567 GR | Pan Blanco Con Leche Y Ajonjoli   Wo... | -21% | Pan Blanco Sin Gluten  Real Natural ... | 200 GR | AGOTADO | Pan Blanco Rinde   Bimbo 620 Gramos | Chocolate De Mesa Marqueta  Abuelita... | 180 GR | Harina Precocida De Maiz Blanco  Pan... | 1 KG | Bolillo        1 Pza | 1 PZ | Telera Integral        1 Pza | Salchichon Rebanado  Chimex 400 Gr | 400 GR | Pan Frances        1 Pza | Pan  Grande Integral   Bimbo 620 G | Pan Integral   Mybrand 680 G | Pan Integral   Bimbo 350 G | Pan Cero Cero   Bimbo 610 G | 610 GR | Pan Multigrano Cero Cero   Bimbo 610... | Pan  Medias Noches   Bimbo 340 G | 340 GR | Pan De Muerto Tradicional De Azucar ... | Pan Molido   Bimbo 210 G | 210 GR | 190 GR | Pan Artesano   Bimbo 567 G | Pan Artesano Multigrano   Bimbo 610 ... | Jamon Real Pavo Rebanadas Sandwich  ... | 250 GR | Pan De Muerto Con Cajeta . . Pza | Mantequilla Con Sal  La Gloria  90 G | 90 GR | Pan De Muerto Con Crema Y Galleta Lo... | Pan Thins Cero Cero     Bimbo 255 G | 255 GR | Mes patrio Herdez | Ver más | Adobo    Doña María 235 G | Mole Doña María Almendrado En Pasta ... | Mole Doña María Almendrado Listo Par... | Mole Doña María Poblano Con Cacao En... | Mole Doña Maria Poblano Con Cacao Li... | Mole Doña Mariía Rojo En Pasta   125... | Mole En Pasta 430 Gramos   Doña Mari... | Mole Listo Para Servir  Para Servir ... | Mole Rojo En Pasta  Doña Maria 235 G | Mole Verde En Pasta  Doña Maria 230 ... | Pipián En Pasta  Doña Maria 230 G | Salsa Cacahuate Picante Cremosa   He... | Salsa Casera Con Habanero   Herdez 4... | Salsa Casera  Herdez 210 G | Salsa Guacamole 15% Mas Guacamole He...",Descarga la app > 620 G,54.9,,,Desconocido,unknown,UNKNOWN,¡Lo mejor te está esperando!,Descarga la app,,620 G,54.90,,$,$54.90,54.9,False,original,54.9,54.9,1.0,default_1usd,,,,,,"Disfruta del delicioso sabor y la textura suave del Pan Blanco Bimbo en su práctico paquete de 620 gramos. Perfecto para tus desayunos y meriendas, este pan es un clásico que nunca pasa de moda. ¡No te quedes sin el tuyo! | ... Ver más | Favoritos | Recomendados | 620 GR | Pan Blanco    Bimbo 350 G | 350 GR | Pan Blanco   Mybrand 680 G | 680 GR | Pan Blanco Perfect Crafted    Nature... | 624 GR | Pan Blanco Butter Top   Nature's Own... | 567 GR | Pan Blanco Con Leche Y Ajonjoli   Wo... | -21% | Pan Blanco Sin Gluten  Real Natural ... | 200 GR | AGOTADO | Pan Blanco Rinde   Bimbo 620 Gramos | Chocolate De Mesa Marqueta  Abuelita... | 180 GR | Harina Precocida De Maiz Blanco  Pan... | 1 KG | Bolillo        1 Pza | 1 PZ | Telera Integral        1 Pza | Salchichon Rebanado  Chimex 400 Gr | 400 GR | Pan Frances        1 Pza | Pan  Grande Integral   Bimbo 620 G | Pan Integral   Mybrand 680 G | Pan Integral   Bimbo 350 G | Pan Cero Cero   Bimbo 610 G | 610 GR | Pan Multigrano Cero Cero   Bimbo 610... | Pan  Medias Noches   Bimbo 340 G | 340 GR | Pan De Muerto Tradicional De Azucar ... | Pan Molido   Bimbo 210 G | 210 GR | 190 GR | Pan Artesano   Bimbo 567 G | Pan Artesano Multigrano   Bimbo 610 ... | Jamon Real Pavo Rebanadas Sandwich  ... | 250 GR | Pan De Muerto Con Cajeta . . Pza | Mantequilla Con Sal  La Gloria  90 G | 90 GR | Pan De Muerto Con Crema Y Galleta Lo... | Pan Thins Cero Cero     Bimbo 255 G | 255 GR | Mes patrio Herdez | Ver más | Adobo    Doña María 235 G | Mole Doña María Almendrado En Pasta ... | Mole Doña María Almendrado Listo Par... | Mole Doña María Poblano Con Cacao En... | Mole Doña Maria Poblano Con Cacao Li... | Mole Doña Mariía Rojo En Pasta   125... | Mole En Pasta 430 Gramos   Doña Mari... | Mole Listo Para Servir  Para Servir ... | Mole Rojo En Pasta  Doña Maria 235 G | Mole Verde En Pasta  Doña Maria 230 ... | Pipián En Pasta  Doña Maria 230 G | Salsa Cacahuate Picante Cremosa   He... | Salsa Casera Con Habanero   Herdez 4... | Salsa Casera  Herdez 210 G | Salsa Guacamole 15% Mas Guacamole He...",,"{""Detalles"": [""Disfruta del delicioso sabor y la textura suave del Pan Blanco Bimbo en su práctico paquete de 620 gramos. Perfecto para tus desayunos y meriendas, este pan es un clásico que nunca pasa de moda. ¡No te quedes sin el tuyo!"", ""... Ver más"", ""Favoritos"", ""Recomendados"", ""620 GR"", ""Pan Blanco    Bimbo 350 G"", ""350 GR"", ""Pan Blanco   Mybrand 680 G"", ""680 GR"", ""Pan Blanco Perfect Crafted    Nature..."", ""624 GR"", ""Pan Blanco Butter Top   Nature's Own..."", ""567 GR"", ""Pan Blanco Con Leche Y Ajonjoli   Wo..."", ""-21%"", ""Pan Blanco Sin Gluten  Real Natural ..."", ""200 GR"", ""AGOTADO"", ""Pan Blanco Rinde   Bimbo 620 Gramos"", ""Chocolate De Mesa Marqueta  Abuelita..."", ""180 GR"", ""Harina Precocida De Maiz Blanco  Pan..."", ""1 KG"", ""Bolillo        1 Pza"", ""1 PZ"", ""Telera Integral        1 Pza"", ""Salchichon Rebanado  Chimex 400 Gr"", ""400 GR"", ""Pan Frances        1 Pza"", ""Pan  Grande Integral   Bimbo 620 G"", ""Pan Integral   Mybrand 680 G"", ""Pan Integral   Bimbo 350 G"", ""Pan Cero Cero   Bimbo 610 G"", ""610 GR"", ""Pan Multigrano Cero Cero   Bimbo 610..."", ""Pan  Medias Noches   Bimbo 340 G"", ""340 GR"", ""Pan De Muerto Tradicional De Azucar ..."", ""Pan Molido   Bimbo 210 G"", ""210 GR"", ""190 GR"", ""Pan Artesano   Bimbo 567 G"", ""Pan Artesano Multigrano   Bimbo 610 ..."", ""Jamon Real Pavo Rebanadas Sandwich  ..."", ""250 GR"", ""Pan De Muerto Con Cajeta . . Pza"", ""Mantequilla Con Sal  La Gloria  90 G"", ""90 GR"", ""Pan De Muerto Con Crema Y Galleta Lo..."", ""Pan Thins Cero Cero     Bimbo 255 G"", ""255 GR"", ""Mes patrio Herdez"", ""Ver más"", ""Adobo    Doña María 235 G"", ""Mole Doña María Almendrado En Pasta ..."", ""Mole Doña María Almendrado Listo Par..."", ""Mole Doña María Poblano Con Cacao En..."", ""Mole Doña Maria Poblano Con Cacao Li..."", ""Mole Doña Mariía Rojo En Pasta   125..."", ""Mole En Pasta 430 Gramos   Doña Mari..."", ""Mole Listo Para Servir  Para Servir ..."", ""Mole Rojo En Pasta  Doña Maria 235 G"", ""Mole Verde En Pasta  Doña Maria 230 ..."", ""Pipián En Pasta  Doña Maria 230 G"", ""Salsa Cacahuate Picante Cremosa   He..."", ""Salsa Casera Con Habanero   Herdez 4..."", ""Salsa Casera  Herdez 210 G"", ""Salsa Guacamole 15% Mas Guacamole He...""]}",dataset/txt_limpios/127.txt,dataset/paginas_descargadas/127.html,EN,pan,keep,0.60,heuristic_default
