{"source_id": "807", "title": "ENDULZANTE CON STEVIA NATRI 180 G", "description": "Ingredientes | Componentes Nombre del producto: Endulzante con Stevia Natri 180g Descripción del producto: Disfruta del Endulzante con Stevia Natri, un endulzante en polvo base maltodextrina con stevia. Tamaño: 10cm x 7cm Peso: 180 g Modo de fabricación: Industrial Conservación: Después de abierto, consumir en el menor tiempo posible. Mantener en un lugar fresco y seco. Origen: Nacional NSA-0014022-2023 Alergenos: Este producto es elaborado en una planta que procesa derivados de leche y soya. Componentes: Maltodextrina Harina de arroz Edulcorante natural (Extracto de stevia) Anticompactante (Dióxido de silicio) Ver más Tratamiento de Datos Garantías Términos y condiciones Superintendencia de Industria y Comercio – SIC 0.17.168-hotfix-2.", "breadcrumbs": "Unidades disponibles > 180 G", "price_raw": "180.0", "currency_raw": "", "url": "", "seller": "Desconocido", "availability": "unknown", "country": "UNKNOWN", "product_name": "ENDULZANTE CON STEVIA NATRI 180 G", "brand": "Unidades disponibles", "reference": "", "unit": "180 G", "price_amount": 180.0, "price_currency": "", "price_symbol": "", "price_text": "180", "price_amount_filled": "180.0", "price_is_imputed": "False", "price_imputation_source": "original", "price_amount_usd": "180.0", "price_amount_usd_filled": "180.0", "fx_rate_local_per_usd": "1.0", "fx_source": "default_1usd", "information_text": "", "description_text": "Ingredientes | Componentes Nombre del producto: Endulzante con Stevia Natri 180g Descripción del producto: Disfruta del Endulzante con Stevia Natri, un endulzante en polvo base maltodextrina con stevia. Tamaño: 10cm x 7cm Peso: 180 g Modo de fabricación: Industrial Conservación: Después de abierto, consumir en el menor tiempo posible. Mantener en un lugar fresco y seco. Origen: Nacional NSA-0014022-2023 Alergenos: Este producto es elaborado en una planta que procesa derivados de leche y soya. Componentes: Maltodextrina Harina de arroz Edulcorante natural (Extracto de stevia) Anticompactante (Dióxido de silicio) Ver más Tratamiento de Datos Garantías Términos y condiciones Superintendencia de Industria y Comercio – SIC 0.17.168-hotfix-2.", "features_text": "", "specifications_text": "", "benefits_text": "", "details_text": "", "other_sections": "", "sections": {"Descripción": ["Ingredientes | Componentes", "Nombre del producto: Endulzante con Stevia Natri 180g", "Descripción del producto: Disfruta del Endulzante con Stevia Natri, un endulzante en polvo base maltodextrina con stevia.", "Tamaño: 10cm x 7cm", "Peso: 180 g", "Modo de fabricación: Industrial", "Conservación: Después de abierto, consumir en el menor tiempo posible. Mantener en un lugar fresco y seco.", "Origen: Nacional", "NSA-0014022-2023", "Alergenos: Este producto es elaborado en una planta que procesa derivados de leche y soya.", "Componentes: Maltodextrina", "Harina de arroz", "Edulcorante natural (Extracto de stevia)", "Anticompactante (Dióxido de silicio)", "Ver más", "Tratamiento de Datos", "Garantías", "Términos y condiciones", "Superintendencia de Industria y Comercio – SIC", "0.17.168-hotfix-2."]}, "txt_path": "dataset/txt_limpios/807.txt", "html_path": "dataset/paginas_descargadas/807.html", "es_status": "EN", "category_canonical": "descartado", "decision": "discard", "match_score": 0.1, "reasons": "excluded_keyword"}
{"source_id": "1514", "title": "Error 404: Página en la encontrada.", "description": "", "breadcrumbs": "Suscribirme", "price_raw": "", "currency_raw": "", "url": "", "seller": "Desconocido", "availability": "unknown", "country": "UNKNOWN", "product_name": "Error 404: Página en la encontrada.", "brand": "Suscribirme", "reference": "", "unit": "", "price_amount": null, "price_currency": "", "price_symbol": "", "price_text": "", "price_amount_filled": "234.19", "price_is_imputed": "True", "price_imputation_source": "country_mean", "price_amount_usd": "", "price_amount_usd_filled": "234.1938", "fx_rate_local_per_usd": "1.0", "fx_source": "default_1usd", "information_text": "", "description_text": "", "features_text": "", "specifications_text": "", "benefits_text": "", "details_text": "", "other_sections": "", "sections": {}, "txt_path": "dataset/txt_limpios/1514.txt", "html_path": "dataset/paginas_descargadas/1514.html", "es_status": "ET", "category_canonical": "sin_categoria", "decision": "discard", "match_score": 0.3, "reasons": "no_category_detected;price_parse_failed"}
{"source_id": "1559", "title": "Error 404: Página en la encontrada.", "description": "", "breadcrumbs": "Suscribirme", "price_raw": "", "currency_raw": "", "url": "", "seller": "Desconocido", "availability": "unknown", "country": "UNKNOWN", "product_name": "Error 404: Página en la encontrada.", "brand": "Suscribirme", "reference": "", "unit": "", "price_amount": null, "price_currency": "", "price_symbol": "", "price_text": "", "price_amount_filled": "234.19", "price_is_imputed": "True", "price_imputation_source": "country_mean", "price_amount_usd": "", "price_amount_usd_filled": "234.1938", "fx_rate_local_per_usd": "1.0", "fx_source": "default_1usd", "information_text": "", "description_text": "", "features_text": "", "specifications_text": "", "benefits_text": "", "details_text": "", "other_sections": "", "sections": {}, "txt_path": "dataset/txt_limpios/1559.txt", "html_path": "dataset/paginas_descargadas/1559.html", "es_status": "ET", "category_canonical": "sin_categoria", "decision": "discard", "match_score": 0.3, "reasons": "no_category_detected;price_parse_failed"}
{"source_id": "1289", "title": "Este gato no debería estar en esta caja, ni tú en esta página", "description": "", "breadcrumbs": "Live Chat", "price_raw": "", "currency_raw": "", "url": "", "seller": "Desconocido", "availability": "unknown", "country": "UNKNOWN", "product_name": "Este gato no debería estar en esta caja, ni tú en esta página", "brand": "Live Chat", "reference": "", "unit": "", "price_amount": null, "price_currency": "", "price_symbol": "", "price_text": "", "price_amount_filled": "234.19", "price_is_imputed": "True", "price_imputation_source": "country_mean", "price_amount_usd": "", "price_amount_usd_filled": "234.1938", "fx_rate_local_per_usd": "1.0", "fx_source": "default_1usd", "information_text": "", "description_text": "", "features_text": "", "specifications_text": "", "benefits_text": "", "details_text": "", "other_sections": "", "sections": {}, "txt_path": "dataset/txt_limpios/1289.txt", "html_path": "dataset/paginas_descargadas/1289.html", "es_status": "EN", "category_canonical": "sin_categoria", "decision": "discard", "match_score": 0.3, "reasons": "no_category_detected;price_parse_failed"}
{"source_id": "1297", "title": "Este gato no debería estar en esta caja, ni tú en esta página", "description": "", "breadcrumbs": "Live Chat", "price_raw": "", "currency_raw": "", "url": "", "seller": "Desconocido", "availability": "unknown", "country": "UNKNOWN", "product_name": "Este gato no debería estar en esta caja, ni tú en esta página", "brand": "Live Chat", "reference": "", "unit": "", "price_amount": null, "price_currency": "", "price_symbol": "", "price_text": "", "price_amount_filled": "234.19", "price_is_imputed": "True", "price_imputation_source": "country_mean", "price_amount_usd": "", "price_amount_usd_filled": "234.1938", "fx_rate_local_per_usd": "1.0", "fx_source": "default_1usd", "information_text": "", "description_text": "", "features_text": "", "specifications_text": "", "benefits_text": "", "details_text": "", "other_sections": "", "sections": {}, "txt_path": "dataset/txt_limpios/1297.txt", "html_path": "dataset/paginas_descargadas/1297.html", "es_status": "EN", "category_canonical": "sin_categoria", "decision": "discard", "match_score": 0.3, "reasons": "no_category_detected;price_parse_failed"}
{"source_id": "1738", "title": "Fiambres y Huevos", "description": "Huevos Gran Blanco Tottus 12Unidades | Actualizado al: 10-10-2024 Ingredientes: Huevo gran blanco. Certificados: Apto para APLV Libre de Lactosa Vegetariano Libre de Soya Libre de Peces Libre de Mariscos Libre de Maní Libre de Frutas Secos Libre de Nueces Libre de Sulfitos Libre de Trigo Porción: 1 Huevo (58g) Porciones por envase: 12 100g 1 Porción Energía (kCal) 124 71.9 Proteínas (g) 13 7.5 Grasas Totales 8 4.6 Grasas saturadas (g) 3 1.7 Grasas (g) 3.6 2.1 Grasas poliinsaturadas (g) 1.4 0,8 Grasas trans (g) 0 colesterol (mg) 388 225 Hidratos de carbono disponibles 0.5 0.3 Azúcar total (g) Sodio 138 80 Importante: La información del empaque y/o contenido del producto final puede diferir respecto a lo que mostramos en nuestro sitio web, tanto a nivel de ingredientes, trazas, información nutricional, sellos, modo de uso y/o modo de conservación. Usted debe basarse únicamente en la información que se muestra en nuestro sitio web y siempre debe leer las etiquetas, advertencias y instrucciones antes de usar el consumo de un producto. Información obtenida de HUEVO GRAND BLANC 12U TOTTUS 696 GR Productos similares Ver producto Huevo Gran Color Huevo Gran Gallina Libre Huevo Color Gran Huevo Blanco Extra Gran Huevo Blanco Gran Huevos Blanco Gran Huevos Blanco Grande Yemita 12 Un Huevos Blancos Grandes Don Vicho 12 Un Huevos de Color Gallinas Libre La Granja 12 Un ¡Juntos son mejores! Papa en Malla 2 Kg Plátano Extra Granel KG Cebolla en Malla 1 Kg Tomate Larga Vida a Granel Papa a Granel Cebolla a Granel Tomate en Malla 1 Kg Zanahoria en Bolsa 1 Kg Zanahoria Jugo en Bolsa 1 Kg", "breadcrumbs": "Huevos > 12Unidades", "price_raw": "3.85", "currency_raw": "", "url": "", "seller": "Desconocido", "availability": "unknown", "country": "UNKNOWN", "product_name": "Fiambres y Huevos", "brand": "Huevos", "reference": "", "unit": "12Unidades", "price_amount": 3.85, "price_currency": "", "price_symbol": "", "price_text": "3.85", "price_amount_filled": "3.85", "price_is_imputed": "False", "price_imputation_source": "original", "price_amount_usd": "3.85", "price_amount_usd_filled": "3.85", "fx_rate_local_per_usd": "1.0", "fx_source": "default_1usd", "information_text": "", "description_text": "Huevos Gran Blanco Tottus 12Unidades | Actualizado al: 10-10-2024 Ingredientes: Huevo gran blanco. Certificados: Apto para APLV Libre de Lactosa Vegetariano Libre de Soya Libre de Peces Libre de Mariscos Libre de Maní Libre de Frutas Secos Libre de Nueces Libre de Sulfitos Libre de Trigo Porción: 1 Huevo (58g) Porciones por envase: 12 100g 1 Porción Energía (kCal) 124 71.9 Proteínas (g) 13 7.5 Grasas Totales 8 4.6 Grasas saturadas (g) 3 1.7 Grasas (g) 3.6 2.1 Grasas poliinsaturadas (g) 1.4 0,8 Grasas trans (g) 0 colesterol (mg) 388 225 Hidratos de carbono disponibles 0.5 0.3 Azúcar total (g) Sodio 138 80 Importante: La información del empaque y/o contenido del producto final puede diferir respecto a lo que mostramos en nuestro sitio web, tanto a nivel de ingredientes, trazas, información nutricional, sellos, modo de uso y/o modo de conservación. Usted debe basarse únicamente en la información que se muestra en nuestro sitio web y siempre debe leer las etiquetas, advertencias y instrucciones antes de usar el consumo de un producto. Información obtenida de HUEVO GRAND BLANC 12U TOTTUS 696 GR Productos similares Ver producto Huevo Gran Color Huevo Gran Gallina Libre Huevo Color Gran Huevo Blanco Extra Gran Huevo Blanco Gran Huevos Blanco Gran Huevos Blanco Grande Yemita 12 Un Huevos Blancos Grandes Don Vicho 12 Un Huevos de Color Gallinas Libre La Granja 12 Un ¡Juntos son mejores! Papa en Malla 2 Kg Plátano Extra Granel KG Cebolla en Malla 1 Kg Tomate Larga Vida a Granel Papa a Granel Cebolla a Granel Tomate en Malla 1 Kg Zanahoria en Bolsa 1 Kg Zanahoria Jugo en Bolsa 1 Kg", "features_text": "", "specifications_text": "", "benefits_text": "", "details_text": "", "other_sections": "", "sections": {"Descripción": ["Huevos Grande Blanco  Tottus", "12Unidades | Actualizado al: 10-10-2024", "Ingredientes: Huevo grande blanco.", "Certificados: Apto para APLV", "Libre de Lactosa", "Vegetariano", "Libre de Soya", "Libre de Peces", "Libre de Mariscos", "Libre de Maní", "Libre de Frutos Secos", "Libre de Nueces", "Libre de Sulfitos", "Libre de Trigo", "Porción: 1 Huevo (58g)", "Porciones por envase: 12", "100g", "1 Porción", "Energía", "(kCal)", "124", "71.9", "Proteínas", "(g)", "13", "7.5", "Grasas Totales", "8", "4.6", "Grasas saturadas (g)", "3", "1.7", "Grasas monoinsaturadas (g)", "3.6", "2.1", "Grasas poliinsaturadas (g)", "1.4", "0.8", "Grasas trans (g)", "0", "Colesterol", "(mg)", "388", "225", "Hidratos de carbono disponibles", "0.5", "0.3", "Azúcar total (g)", "Sodio", "138", "80", "Importante: La información del empaque y/o contenido del producto final puede diferir respecto a lo que mostramos en nuestro sitio web, tanto a nivel de ingredientes, trazas, información nutricional, sellos, modo de uso y/o modo de conservación. Usted debe basarse únicamente en la información que se muestra en nuestro sitio web y siempre debe leer las etiquetas, advertencias y instrucciones antes de usar el consumo de un producto.", "Información obtenida de", "HUEVO  GRAND BLANC 12U  TOTTUS 696 GR", "Productos similares", "Ver producto", "Huevo Grande Color", "Huevo Grande Gallina Libre", "Huevo Color Grande", "Huevo Blanco Extra Grande", "Huevo Blanco Grande", "Huevos Blanco Grande", "Huevos Blanco Grande Yemita 12 Un", "Huevos Blancos Grandes Don Vicho 12 Un", "Huevos de Color Gallinas Libre La Granja 12 Un", "¡Juntos son mejores!", "Papa en Malla 2 Kg", "Plátano Extra Granel", "KG", "Cebolla en Malla 1 Kg", "Tomate Larga Vida a Granel", "Papa a Granel", "Cebolla a Granel", "Tomate en Malla 1 Kg", "Zanahoria en Bolsa 1 Kg", "Zanahoria Jugo en Bolsa 1 Kg"]}, "txt_path": "dataset/txt_limpios/1738.txt", "html_path": "dataset/paginas_descargadas/1738.html", "es_status": "ET", "category_canonical": "azucar", "decision": "keep", "match_score": 0.6, "reasons": "heuristic_default"}
{"source_id": "1751", "title": "Fiambres y Huevos", "description": "Huevos 12 Un Grande L Blanco Cintazul 648g | Actualizado al: 24-05-2025 Ingredientes: Huevos. Certificados: Apto para APLV Libre de Lactosa Vegetariano Libre de Soya Libre de Peces Libre de Mariscos Libre de Maní Libre de Frutas Secos Libre de Nueces Libre de Sulfitos Libre de Trigo Porción: 1 Huevo sin Cáscara (51g) Porciones por envase: 12 100g 1 Porción Energía (kCal) 149 76 Proteínas (g) 12 6.1 Grasas Totales 9.8 5 Grasas saturadas (g) 3.7 1.9 Grasas (g) 2.8 1.4 Grasas poliinsaturadas (g) 0.7 Grasas trans (g) 0,1 Colesterol (mg) 370 188.7 Hidratos de carbono disponibles Azúcar total (g) 0.5 0.3 Sodio 150 76.5 Importante: La información del empaque y/o contenido del producto final puede diferir respecto a lo que mostramos en nuestro sitio web, tanto a nivel de ingredientes, trazas, información nutricional, sellos, modo de uso y/o modo de conservación. Usted debe basarse únicamente en la información que se muestra en nuestro sitio web y siempre debe leer las etiquetas, advertencias y instrucciones antes de usar el consumo de un producto. Información obtenida de HUEVOGRANDE BLANCO CINTAZUL 12 UND Productos similares Huevos Blanco Grande Yemita 12 Un Ver producto Huevo Blanco Extra Grande Huevo Gallina Libre HUEVOS COLOR GRAN 12 UN. YEM Huevo Color Gran Huevo Gran Blanco Huevos de color Gallinas Libre La Granja 12 Un Huevos Blanco Extra Grande Yemita 12 Un Huevos Blanco Grande Huevo Primera Color Huevo Gran Gallina Libre Huevo de Color Gallina Libre La Granja 6 Un HUEVO EXTRA BLANCO 12 UN COLIUMO HUEVO GRAN LIBRE PASTO CINTAZUL 12 UND Huevo de Color Gallina Libre ¡Juntos son mejores! Papa en Malla 2 Kg Plátano Extra Granel KG Tomate Larga Vida a Granel Cebolla en Malla 1 Kg Zanahoria en Bolsa 1 Kg Tomate en Malla 1 Kg Zanahoria Jugo en Bolsa 1 Kg Cebolla Granel Papa a Granel", "breadcrumbs": "Huevos > 648g", "price_raw": "4.2", "currency_raw": "", "url": "", "seller": "Desconocido", "availability": "unknown", "country": "UNKNOWN", "product_name": "Fiambres y Huevos", "brand": "Huevos", "reference": "", "unit": "648g", "price_amount": 4.2, "price_currency": "", "price_symbol": "", "price_text": "4.20", "price_amount_filled": "4.2", "price_is_imputed": "False", "price_imputation_source": "original", "price_amount_usd": "4.2", "price_amount_usd_filled": "4.2", "fx_rate_local_per_usd": "1.0", "fx_source": "default_1usd", "information_text": "", "description_text": "Huevos 12 Un Grande L Blanco Cintazul 648g | Actualizado al: 24-05-2025 Ingredientes: Huevos. Certificados: Apto para APLV Libre de Lactosa Vegetariano Libre de Soya Libre de Peces Libre de Mariscos Libre de Maní Libre de Frutas Secos Libre de Nueces Libre de Sulfitos Libre de Trigo Porción: 1 Huevo sin Cáscara (51g) Porciones por envase: 12 100g 1 Porción Energía (kCal) 149 76 Proteínas (g) 12 6.1 Grasas Totales 9.8 5 Grasas saturadas (g) 3.7 1.9 Grasas (g) 2.8 1.4 Grasas poliinsaturadas (g) 0.7 Grasas trans (g) 0,1 Colesterol (mg) 370 188.7 Hidratos de carbono disponibles Azúcar total (g) 0.5 0.3 Sodio 150 76.5 Importante: La información del empaque y/o contenido del producto final puede diferir respecto a lo que mostramos en nuestro sitio web, tanto a nivel de ingredientes, trazas, información nutricional, sellos, modo de uso y/o modo de conservación. Usted debe basarse únicamente en la información que se muestra en nuestro sitio web y siempre debe leer las etiquetas, advertencias y instrucciones antes de usar el consumo de un producto. Información obtenida de HUEVOGRANDE BLANCO CINTAZUL 12 UND Productos similares Huevos Blanco Grande Yemita 12 Un Ver producto Huevo Blanco Extra Grande Huevo Gallina Libre HUEVOS COLOR GRAN 12 UN. YEM Huevo Color Gran Huevo Gran Blanco Huevos de color Gallinas Libre La Granja 12 Un Huevos Blanco Extra Grande Yemita 12 Un Huevos Blanco Grande Huevo Primera Color Huevo Gran Gallina Libre Huevo de Color Gallina Libre La Granja 6 Un HUEVO EXTRA BLANCO 12 UN COLIUMO HUEVO GRAN LIBRE PASTO CINTAZUL 12 UND Huevo de Color Gallina Libre ¡Juntos son mejores! Papa en Malla 2 Kg Plátano Extra Granel KG Tomate Larga Vida a Granel Cebolla en Malla 1 Kg Zanahoria en Bolsa 1 Kg Tomate en Malla 1 Kg Zanahoria Jugo en Bolsa 1 Kg Cebolla Granel Papa a Granel", "features_text": "", "specifications_text": "", "benefits_text": "", "details_text": "", "other_sections": "", "sections": {"Descripción": ["Huevos 12 Un Grande L Blanco Cintazul", "648g | Actualizado al: 24-05-2025", "Ingredientes: Huevos.", "Certificados: Apto para APLV", "Libre de Lactosa", "Vegetariano", "Libre de Soya", "Libre de Peces", "Libre de Mariscos", "Libre de Maní", "Libre de Frutos Secos", "Libre de Nueces", "Libre de Sulfitos", "Libre de Trigo", "Porción: 1 Huevo sin Cáscara (51g)", "Porciones por envase: 12", "100g", "1 Porción", "Energía", "(kCal)", "149", "76", "Proteínas", "(g)", "12", "6.1", "Grasas Totales", "9.8", "5", "Grasas saturadas (g)", "3.7", "1.9", "Grasas monoinsaturadas (g)", "2.8", "1.4", "Grasas poliinsaturadas (g)", "0.7", "Grasas trans (g)", "0.1", "Colesterol", "(mg)", "370", "188.7", "Hidratos de carbono disponibles", "Azúcar total (g)", "0.5", "0.3", "Sodio", "150", "76.5", "Importante: La información del empaque y/o contenido del producto final puede diferir respecto a lo que mostramos en nuestro sitio web, tanto a nivel de ingredientes, trazas, información nutricional, sellos, modo de uso y/o modo de conservación. Usted debe basarse únicamente en la información que se muestra en nuestro sitio web y siempre debe leer las etiquetas, advertencias y instrucciones antes de usar el consumo de un producto.", "Información obtenida de", "HUEVOGRANDE BLANCO CINTAZUL 12 UND", "Productos similares", "Huevos Blanco Grande Yemita 12 Un", "Ver producto", "Huevo Blanco Extra Grande", "Huevo Gallina Libre", "HUEVOS COLOR GRANDE 12 UN. YEM", "Huevo Color Grande", "Huevo Grande Blanco", "Huevos de Color Gallinas Libre La Granja 12 Un", "Huevos Blanco Extra Grande Yemita 12 Un", "Huevos Blanco Grande", "Huevo Primera Color", "Huevo Grande Gallina Libre", "Huevo de Color Gallina Libre La Granja 6 Un", "HUEVO EXTRA BLANCO 12 UN COLIUMO", "HUEVO GRAN LIBRE PASTO CINTAZUL 12 UND", "Huevo de Color Gallina Libre", "¡Juntos son mejores!", "Papa en Malla 2 Kg", "Plátano Extra Granel", "KG", "Tomate Larga Vida a Granel", "Cebolla en Malla 1 Kg", "Zanahoria en Bolsa 1 Kg", "Tomate en Malla 1 Kg", "Zanahoria Jugo en Bolsa 1 Kg", "Cebolla a Granel", "Papa a Granel"]}, "txt_path": "dataset/txt_limpios/1751.txt", "html_path": "dataset/paginas_descargadas/1751.html", "es_status": "ET", "category_canonical": "azucar", "decision": "keep", "match_score": 0.6, "reasons": "heuristic_default"}
