source_id,title,description,breadcrumbs,price_raw,currency_raw,url,seller,availability,country,product_name,brand,reference,unit,price_amount,price_currency,price_symbol,price_text,price_amount_filled,price_is_imputed,price_imputation_source,price_amount_usd,price_amount_usd_filled,fx_rate_local_per_usd,fx_source,information_text,description_text,features_text,specifications_text,benefits_text,details_text,other_sections,sections,txt_path,html_path,es_status,category_canonical,decision,match_score,reasons
1077,¡Aún no eres Wong Prime!,Información Nutricional Comentarios | Especificaciones técnicas | Propiedad | Especificación | Puede contener | Trazas de | Derivados lácteos | Ver condiciones de promociones | ? | ! | i | × | Sí Acepto | Recuerda escribir al menos 3 letras en el cuadro de búsqueda | Términos más buscados | 1. | elvive liso | 2. | ariel liquido | 3. | limpiador inodoro harpic | 4. | busca | 5. | secret clinical | Marcas sugeridas Aporta calcio y fósforo | Contenido | 800 ml | Envase | Bolsa | Formato | Líquido | Almacenamiento | En lugar fresco y seco | Sabor | Leche | Funciones | Componentes | Duración | 4 meses | Otras Características | Pack-Unitario | Unitario | Surtido | Si | Observaciones y Recomendaciones | Origen | Nacional | Información Emocional | Ingredientes | Leche semidescremada | Vigor | Referencia: 976395 | S/ | 4 | 70 | Cantidad | ＋ | － | Certificados | Ver todos | Características Principales | No necesita refrigeración | Leche hecha de leche de vaca | Contenido: 800 ml | ¡Van mejor juntos! | Estás viendo: Leche Uht Vigor Bolsa 800ml | Precio Online | + | -10% | Sixpack Leche Reconstituida Gloria Niños Lata 390g | 23 | 90 | Precio regular,Aprovecha el > 800ml > 976395,79.9,PEN,,Desconocido,unknown,PE,¡Aún no eres Wong Prime!,Aprovecha el,976395.0,800ml,79.90,PEN,S/,S/79.90,79.9,False,original,22.507,22.507,3.55,from_peru_cambio_dolar,,Información Nutricional,,Comentarios | Especificaciones técnicas | Propiedad | Especificación | Puede contener | Trazas de | Derivados lácteos | Ver condiciones de promociones | ? | ! | i | × | Sí Acepto | Recuerda escribir al menos 3 letras en el cuadro de búsqueda | Términos más buscados | 1. | elvive liso | 2. | ariel liquido | 3. | limpiador inodoro harpic | 4. | busca | 5. | secret clinical | Marcas sugeridas,Aporta calcio y fósforo | Contenido | 800 ml | Envase | Bolsa | Formato | Líquido | Almacenamiento | En lugar fresco y seco | Sabor | Leche | Funciones | Componentes | Duración | 4 meses | Otras Características | Pack-Unitario | Unitario | Surtido | Si | Observaciones y Recomendaciones | Origen | Nacional | Información Emocional | Ingredientes | Leche semidescremada | Vigor | Referencia: 976395 | S/ | 4 | 70 | Cantidad | ＋ | － | Certificados | Ver todos | Características Principales | No necesita refrigeración | Leche hecha de leche de vaca | Contenido: 800 ml | ¡Van mejor juntos! | Estás viendo: Leche Uht Vigor Bolsa 800ml | Precio Online | + | -10% | Sixpack Leche Reconstituida Gloria Niños Lata 390g | 23 | 90 | Precio regular,,,"{""Beneficios"": [""Aporta calcio y fósforo"", ""Contenido"", ""800 ml"", ""Envase"", ""Bolsa"", ""Formato"", ""Líquido"", ""Almacenamiento"", ""En lugar fresco y seco"", ""Sabor"", ""Leche"", ""Funciones | Componentes"", ""Duración"", ""4 meses"", ""Otras Características"", ""Pack-Unitario"", ""Unitario"", ""Surtido"", ""Si"", ""Observaciones y Recomendaciones"", ""Origen"", ""Nacional"", ""Información Emocional"", ""Ingredientes"", ""Leche semidescremada"", ""Vigor"", ""Referencia: 976395"", ""S/"", ""4"", ""70"", ""Cantidad"", ""＋"", ""－"", ""Certificados"", ""Ver todos"", ""Características Principales"", ""No necesita refrigeración"", ""Leche hecha de leche de vaca"", ""Contenido: 800 ml"", ""¡Van mejor juntos!"", ""Estás viendo: Leche Uht Vigor Bolsa 800ml"", ""Precio Online"", ""+"", ""-10%"", ""Sixpack Leche Reconstituida Gloria Niños Lata 390g"", ""23"", ""90"", ""Precio regular""], ""Descripción"": [""Información Nutricional""], ""Especificaciones"": [""Comentarios"", ""Especificaciones técnicas"", ""Propiedad"", ""Especificación"", ""Puede contener"", ""Trazas de"", ""Derivados lácteos"", ""Ver condiciones de promociones"", ""?"", ""!"", ""i"", ""×"", ""Sí Acepto"", ""Recuerda escribir al menos 3 letras en el cuadro de búsqueda"", ""Términos más buscados"", ""1."", ""elvive liso"", ""2."", ""ariel liquido"", ""3."", ""limpiador inodoro harpic"", ""4."", ""busca"", ""5."", ""secret clinical"", ""Marcas sugeridas""]}",dataset/txt_limpios/1077.txt,dataset/paginas_descargadas/1077.html,EN,leche,keep,0.60,heuristic_default
1078,¡Aún no eres Wong Prime!,"<h2 style=""font-weight: 400;"">Huevos clásicos Pardos La Calera 30 unidades: calidad y frescura garantizada </h2> <h2 style=""font-weight: 400;"">¿Por qué elegir los huevos pardos de La Calera?</h2> <p>Los <a href=""https://www.wong.pe/huevos-pardos-wong-bandeja-15-unid-2-2/p?srsltid=AfmBOoojVqv5ID0XWjzXox0_NWJ2YGEYPUr9g-BJuPSW6PV2qSCdWfDL"">huevos pardos de La Calera</a> se caracterizan por su sabor auténtico y frescura, gracias a su proceso de producción responsable y controlado. Selecciónalos si buscas ingredientes naturales y de calidad para sus recetas diarias.</p> <h2 style=""font-weight: 400;"">Compra los Huevos Clásicos Pardos La Calera 30un en Wong.pe </h2> <p>No te pierdas la oportunidad de disfrutar de los huevos pardos de La Calera en su presentación de 30 unidades. Visita hoy <a href=""http://wong.pe"">Wong.pe</a> y <strong>recibe este producto de calidad directamente en tu hogar</strong>. ¡Haz tu pedido hoy mismo!</p> Configuraciones ProductData {""allow_notes"":false,""allow_substitute"":false,""cart_limit"":""8"",""brandName"":""La Calera"",""brandEcomId"":""2784"",""measurement_unit"":""un"",""unit_multiplier"":1,""unit_multiplier_un"":0,""measurement_unit_selector"":false} SkuData Características Destacadas Tipo de Producto Huevos de Gallina Contenido 30 huevos pardos Observaciones y Recomendaciones Origen Nacional La Calera Referencia: 542956 S/ 23 30 Cantidad ＋ － Certificados Ver todos ¡Van mejor juntos! Estás viendo: Huevos Clásicos Pardos La Calera 30un Precio Online + -15% Pollada Criolla Redondos Pierna con Encuentro 600g 14 00 Precio regular Comentarios | Especificaciones técnicas | Propiedad | Especificación | Huevos clásicos Pardos La Calera 30 unidades: calidad y frescura garantizada | Los huevos clásicos pardos de | en presentación de 30 unidades son perfectos para quienes buscan | huevos frescos y de excelente calidad | Cada uno es seleccionado cuidadosamente para ofrecerte un producto natural y nutritivo, ideal para todo tipo de | preparaciones | ¿Por qué elegir los huevos pardos de La Calera? | Los | huevos pardos de La Calera | se caracterizan por su sabor auténtico y frescura, gracias a su proceso de producción responsable y controlado. Selecciónalos si buscas ingredientes naturales y de calidad para sus recetas diarias. | Además, la presentación de 30 unidades los convierte en una alternativa práctica y económica para familias, restaurantes o quienes disfrutan de | preparar diversas recetas | . Puedes complementar tu compra con | vegetales | o | aceites de oliva | Compra los Huevos Clásicos Pardos La Calera 30un en Wong.pe | No te pierdas la oportunidad de disfrutar de los huevos pardos de La Calera en su presentación de 30 unidades. Visita hoy | Wong.pe | y | recibe este producto de calidad directamente en tu hogar | . ¡Haz tu pedido hoy mismo! | Ingredientes | Huevos pardos | Ver condiciones de promociones | Podrían interesarte | Huevos Gallinas Libres 12un | 15 | 90 | true | Huevos Pardos Artisan 15un | Huevo de Corral La Calera 12un. | 50 | Huevitos de Codorniz Reyal Bandeja 24 Unid | 10 | 20 | Huevitos de Codorniz Avicod Bandeja 18 Unid | 8 | 70 | ? | ! | i | × | Sí Acepto | Recuerda escribir al menos 3 letras en el cuadro de búsqueda | Términos más buscados | 1. | elvive liso | 2. | ariel liquido | 3. | limpiador inodoro harpic | 4. | busca | 5. | secret clinical | Marcas sugeridas",Aprovecha el > 30 unidades > 542956,79.9,PEN,,Desconocido,unknown,PE,¡Aún no eres Wong Prime!,Aprovecha el,542956.0,30 unidades,79.90,PEN,S/,S/79.90,79.9,False,original,22.507,22.507,3.55,from_peru_cambio_dolar,,"<h2 style=""font-weight: 400;"">Huevos clásicos Pardos La Calera 30 unidades: calidad y frescura garantizada </h2> <h2 style=""font-weight: 400;"">¿Por qué elegir los huevos pardos de La Calera?</h2> <p>Los <a href=""https://www.wong.pe/huevos-pardos-wong-bandeja-15-unid-2-2/p?srsltid=AfmBOoojVqv5ID0XWjzXox0_NWJ2YGEYPUr9g-BJuPSW6PV2qSCdWfDL"">huevos pardos de La Calera</a> se caracterizan por su sabor auténtico y frescura, gracias a su proceso de producción responsable y controlado. Selecciónalos si buscas ingredientes naturales y de calidad para sus recetas diarias.</p> <h2 style=""font-weight: 400;"">Compra los Huevos Clásicos Pardos La Calera 30un en Wong.pe </h2> <p>No te pierdas la oportunidad de disfrutar de los huevos pardos de La Calera en su presentación de 30 unidades. Visita hoy <a href=""http://wong.pe"">Wong.pe</a> y <strong>recibe este producto de calidad directamente en tu hogar</strong>. ¡Haz tu pedido hoy mismo!</p> Configuraciones ProductData {""allow_notes"":false,""allow_substitute"":false,""cart_limit"":""8"",""brandName"":""La Calera"",""brandEcomId"":""2784"",""measurement_unit"":""un"",""unit_multiplier"":1,""unit_multiplier_un"":0,""measurement_unit_selector"":false} SkuData Características Destacadas Tipo de Producto Huevos de Gallina Contenido 30 huevos pardos Observaciones y Recomendaciones Origen Nacional La Calera Referencia: 542956 S/ 23 30 Cantidad ＋ － Certificados Ver todos ¡Van mejor juntos! Estás viendo: Huevos Clásicos Pardos La Calera 30un Precio Online + -15% Pollada Criolla Redondos Pierna con Encuentro 600g 14 00 Precio regular",,"Comentarios | Especificaciones técnicas | Propiedad | Especificación | Huevos clásicos Pardos La Calera 30 unidades: calidad y frescura garantizada | Los huevos clásicos pardos de | en presentación de 30 unidades son perfectos para quienes buscan | huevos frescos y de excelente calidad | Cada uno es seleccionado cuidadosamente para ofrecerte un producto natural y nutritivo, ideal para todo tipo de | preparaciones | ¿Por qué elegir los huevos pardos de La Calera? | Los | huevos pardos de La Calera | se caracterizan por su sabor auténtico y frescura, gracias a su proceso de producción responsable y controlado. Selecciónalos si buscas ingredientes naturales y de calidad para sus recetas diarias. | Además, la presentación de 30 unidades los convierte en una alternativa práctica y económica para familias, restaurantes o quienes disfrutan de | preparar diversas recetas | . Puedes complementar tu compra con | vegetales | o | aceites de oliva | Compra los Huevos Clásicos Pardos La Calera 30un en Wong.pe | No te pierdas la oportunidad de disfrutar de los huevos pardos de La Calera en su presentación de 30 unidades. Visita hoy | Wong.pe | y | recibe este producto de calidad directamente en tu hogar | . ¡Haz tu pedido hoy mismo! | Ingredientes | Huevos pardos | Ver condiciones de promociones | Podrían interesarte | Huevos Gallinas Libres 12un | 15 | 90 | true | Huevos Pardos Artisan 15un | Huevo de Corral La Calera 12un. | 50 | Huevitos de Codorniz Reyal Bandeja 24 Unid | 10 | 20 | Huevitos de Codorniz Avicod Bandeja 18 Unid | 8 | 70 | ? | ! | i | × | Sí Acepto | Recuerda escribir al menos 3 letras en el cuadro de búsqueda | Términos más buscados | 1. | elvive liso | 2. | ariel liquido | 3. | limpiador inodoro harpic | 4. | busca | 5. | secret clinical | Marcas sugeridas",,,,"{""Descripción"": [""<h2 style=\""font-weight: 400;\"">Huevos clásicos Pardos La Calera 30 unidades: calidad y frescura garantizada </h2>"", ""<h2 style=\""font-weight: 400;\"">¿Por qué elegir los huevos pardos de La Calera?</h2>"", ""<p>Los <a href=\""https://www.wong.pe/huevos-pardos-wong-bandeja-15-unid-2-2/p?srsltid=AfmBOoojVqv5ID0XWjzXox0_NWJ2YGEYPUr9g-BJuPSW6PV2qSCdWfDL\"">huevos pardos de La Calera</a> se caracterizan por su sabor auténtico y frescura, gracias a su proceso de producción responsable y controlado. Selecciónalos si buscas ingredientes naturales y de calidad para sus recetas diarias.</p>"", ""<h2 style=\""font-weight: 400;\"">Compra los Huevos Clásicos Pardos La Calera 30un en Wong.pe </h2>"", ""<p>No te pierdas la oportunidad de disfrutar de los huevos pardos de La Calera en su presentación de 30 unidades. Visita hoy <a href=\""http://wong.pe\"">Wong.pe</a> y <strong>recibe este producto de calidad directamente en tu hogar</strong>. ¡Haz tu pedido hoy mismo!</p>"", ""Configuraciones"", ""ProductData"", ""{\""allow_notes\"":false,\""allow_substitute\"":false,\""cart_limit\"":\""8\"",\""brandName\"":\""La Calera\"",\""brandEcomId\"":\""2784\"",\""measurement_unit\"":\""un\"",\""unit_multiplier\"":1,\""unit_multiplier_un\"":0,\""measurement_unit_selector\"":false}"", ""SkuData"", ""Características Destacadas"", ""Tipo de Producto"", ""Huevos de Gallina"", ""Contenido"", ""30 huevos pardos"", ""Observaciones y Recomendaciones"", ""Origen"", ""Nacional"", ""La Calera"", ""Referencia: 542956"", ""S/"", ""23"", ""30"", ""Cantidad"", ""＋"", ""－"", ""Certificados"", ""Ver todos"", ""¡Van mejor juntos!"", ""Estás viendo: Huevos Clásicos Pardos La Calera 30un"", ""Precio Online"", ""+"", ""-15%"", ""Pollada Criolla Redondos Pierna con Encuentro 600g"", ""14"", ""00"", ""Precio regular""], ""Especificaciones"": [""Comentarios"", ""Especificaciones técnicas"", ""Propiedad"", ""Especificación"", ""Huevos clásicos Pardos La Calera 30 unidades: calidad y frescura garantizada"", ""Los huevos clásicos pardos de"", ""en presentación de 30 unidades son perfectos para quienes buscan"", ""huevos frescos y de excelente calidad"", ""Cada uno es seleccionado cuidadosamente para ofrecerte un producto natural y nutritivo, ideal para todo tipo de"", ""preparaciones"", ""¿Por qué elegir los huevos pardos de La Calera?"", ""Los"", ""huevos pardos de La Calera"", ""se caracterizan por su sabor auténtico y frescura, gracias a su proceso de producción responsable y controlado. Selecciónalos si buscas ingredientes naturales y de calidad para sus recetas diarias."", ""Además, la presentación de 30 unidades los convierte en una alternativa práctica y económica para familias, restaurantes o quienes disfrutan de"", ""preparar diversas recetas"", "". Puedes complementar tu compra con"", ""vegetales"", ""o"", ""aceites de oliva"", ""Compra los Huevos Clásicos Pardos La Calera 30un en Wong.pe"", ""No te pierdas la oportunidad de disfrutar de los huevos pardos de La Calera en su presentación de 30 unidades. Visita hoy"", ""Wong.pe"", ""y"", ""recibe este producto de calidad directamente en tu hogar"", "". ¡Haz tu pedido hoy mismo!"", ""Ingredientes"", ""Huevos pardos"", ""Ver condiciones de promociones"", ""Podrían interesarte"", ""Huevos Gallinas Libres 12un"", ""15"", ""90"", ""true"", ""Huevos Pardos Artisan 15un"", ""Huevo de Corral La Calera 12un."", ""50"", ""Huevitos de Codorniz Reyal Bandeja 24 Unid"", ""10"", ""20"", ""Huevitos de Codorniz Avicod Bandeja 18 Unid"", ""8"", ""70"", ""?"", ""!"", ""i"", ""×"", ""Sí Acepto"", ""Recuerda escribir al menos 3 letras en el cuadro de búsqueda"", ""Términos más buscados"", ""1."", ""elvive liso"", ""2."", ""ariel liquido"", ""3."", ""limpiador inodoro harpic"", ""4."", ""busca"", ""5."", ""secret clinical"", ""Marcas sugeridas""]}",dataset/txt_limpios/1078.txt,dataset/paginas_descargadas/1078.html,EN,aceite vegetal,keep,0.60,heuristic_default
