source_id,title,description,breadcrumbs,price_raw,currency_raw,url,seller,availability,country,product_name,brand,reference,unit,price_amount,price_currency,price_symbol,price_text,price_amount_filled,price_is_imputed,price_imputation_source,price_amount_usd,price_amount_usd_filled,fx_rate_local_per_usd,fx_source,information_text,description_text,features_text,specifications_text,benefits_text,details_text,other_sections,sections,txt_path,html_path,es_status,category_canonical,decision,match_score,reasons
361,Tienda Online,,Institucional > 1kg,1.0,BRL,,Desconocido,unknown,BR,Tienda Online,Institucional,,1kg,1.00,BRL,r,r1,1.0,False,original,0.1836,0.1836,5.448,from_brasil_cambio_dolar,,,,,,,,{},dataset/txt_limpios/361.txt,dataset/paginas_descargadas/361.html,ET,sin_categoria,discard,0.30,no_category_detected
362,Tienda Online,,"Institucional > 2,008kg",47.79,BRL,,Desconocido,unknown,BR,Tienda Online,Institucional,,"2,008kg",47.79,BRL,R$,"R$47,79",47.79,False,original,8.772,8.772,5.448,from_brasil_cambio_dolar,,,,,,,,{},dataset/txt_limpios/362.txt,dataset/paginas_descargadas/362.html,ET,sin_categoria,discard,0.30,no_category_detected
363,Tienda Online,,Institucional > 1kg,4.98,BRL,,Desconocido,unknown,BR,Tienda Online,Institucional,,1kg,4.98,BRL,R$,"R$4,98",4.98,False,original,0.9141,0.9141,5.448,from_brasil_cambio_dolar,,,,,,,,{},dataset/txt_limpios/363.txt,dataset/paginas_descargadas/363.html,ET,sin_categoria,discard,0.30,no_category_detected
364,Tienda Online,,Institucional > 1kg,4.39,BRL,,Desconocido,unknown,BR,Tienda Online,Institucional,,1kg,4.39,BRL,R$,"R$4,39",4.39,False,original,0.8058,0.8058,5.448,from_brasil_cambio_dolar,,,,,,,,{},dataset/txt_limpios/364.txt,dataset/paginas_descargadas/364.html,ET,sin_categoria,discard,0.30,no_category_detected
365,Tienda Online,,Institucional > 1kg,3.99,BRL,,Desconocido,unknown,BR,Tienda Online,Institucional,,1kg,3.99,BRL,R$,"R$3,99",3.99,False,original,0.7324,0.7324,5.448,from_brasil_cambio_dolar,,,,,,,,{},dataset/txt_limpios/365.txt,dataset/paginas_descargadas/365.html,ET,sin_categoria,discard,0.30,no_category_detected
366,Tienda Online,,Institucional > 1kg,10.98,BRL,,Desconocido,unknown,BR,Tienda Online,Institucional,,1kg,10.98,BRL,R$,"R$10,98",10.98,False,original,2.0154,2.0154,5.448,from_brasil_cambio_dolar,,,,,,,,{},dataset/txt_limpios/366.txt,dataset/paginas_descargadas/366.html,ET,sin_categoria,discard,0.30,no_category_detected
367,Tienda Online,,Institucional,,BRL,,Desconocido,unknown,BR,Tienda Online,Institucional,,,,BRL,,,12.0,True,country_mean,,2.2024,5.448,from_brasil_cambio_dolar,,,,,,,,{},dataset/txt_limpios/367.txt,dataset/paginas_descargadas/367.html,ET,sin_categoria,discard,0.30,no_category_detected;price_parse_failed
368,Tienda Online,,Institucional > 1kg,5.49,BRL,,Desconocido,unknown,BR,Tienda Online,Institucional,,1kg,5.49,BRL,R$,"R$5,49",5.49,False,original,1.0077,1.0077,5.448,from_brasil_cambio_dolar,,,,,,,,{},dataset/txt_limpios/368.txt,dataset/paginas_descargadas/368.html,ET,sin_categoria,discard,0.30,no_category_detected
369,Tienda Online,,Institucional > 500g,3.02,BRL,,Desconocido,unknown,BR,Tienda Online,Institucional,,500g,3.02,BRL,R$,"R$3,02",3.02,False,original,0.5543,0.5543,5.448,from_brasil_cambio_dolar,,,,,,,,{},dataset/txt_limpios/369.txt,dataset/paginas_descargadas/369.html,ET,sin_categoria,discard,0.30,no_category_detected
370,Tienda Online,,Institucional > 1kg,4.89,BRL,,Desconocido,unknown,BR,Tienda Online,Institucional,,1kg,4.89,BRL,R$,"R$4,89",4.89,False,original,0.8976,0.8976,5.448,from_brasil_cambio_dolar,,,,,,,,{},dataset/txt_limpios/370.txt,dataset/paginas_descargadas/370.html,ET,sin_categoria,discard,0.30,no_category_detected
371,Tienda Online,,Institucional > 1kg,4.98,BRL,,Desconocido,unknown,BR,Tienda Online,Institucional,,1kg,4.98,BRL,R$,"R$4,98",4.98,False,original,0.9141,0.9141,5.448,from_brasil_cambio_dolar,,,,,,,,{},dataset/txt_limpios/371.txt,dataset/paginas_descargadas/371.html,ET,sin_categoria,discard,0.30,no_category_detected
372,Tienda Online,,Institucional > 490g,11.98,BRL,,Desconocido,unknown,BR,Tienda Online,Institucional,,490g,11.98,BRL,R$,"R$11,98",11.98,False,original,2.199,2.199,5.448,from_brasil_cambio_dolar,,,,,,,,{},dataset/txt_limpios/372.txt,dataset/paginas_descargadas/372.html,ET,sin_categoria,discard,0.30,no_category_detected
797,TOMATE CHONTO X 1000 G,"Nombre del producto: Tomate Chonto Descripción del producto: El tomate chonto es una variedad de tamaño mediano, piel lisa y color rojo intenso, ideal para todo tipo de preparaciones. Su pulpa jugosa y consistencia firme lo hacen perfecto para salsas, guisos, ensaladas, jugos y platos tradicionales. Es un ingrediente básico y versátil en la cocina del día a día. Presentación: 1000gr Modo de fabricación: Industrial Origen: Nacional Ver más También puede interesarte CEBOLLA CABEZONA X 1000G ZANAHORIA X 1000 G CEBOLLA LARGA 500 GR PIMENTÓN UNIDAD LIMON TAHITI X 1000 GR PLÁTANO X 1000G LECHUGA VERDE CRESPA X 180 G PAPA CAPIRA X 2500 G CEBOLLA ROJA X 1000 G D1 Top 100 BANANO UNIDAD",Unidades disponibles > 1000 G,1000.0,,,Desconocido,unknown,UNKNOWN,TOMATE CHONTO X 1000 G,Unidades disponibles,,1000 G,1000.00,,,1000,1000.0,False,original,1000.0,1000.0,1.0,default_1usd,,"Nombre del producto: Tomate Chonto Descripción del producto: El tomate chonto es una variedad de tamaño mediano, piel lisa y color rojo intenso, ideal para todo tipo de preparaciones. Su pulpa jugosa y consistencia firme lo hacen perfecto para salsas, guisos, ensaladas, jugos y platos tradicionales. Es un ingrediente básico y versátil en la cocina del día a día. Presentación: 1000gr Modo de fabricación: Industrial Origen: Nacional Ver más También puede interesarte CEBOLLA CABEZONA X 1000G ZANAHORIA X 1000 G CEBOLLA LARGA 500 GR PIMENTÓN UNIDAD LIMON TAHITI X 1000 GR PLÁTANO X 1000G LECHUGA VERDE CRESPA X 180 G PAPA CAPIRA X 2500 G CEBOLLA ROJA X 1000 G D1 Top 100 BANANO UNIDAD",,,,,,"{""Descripción"": [""Nombre del producto: Tomate Chonto"", ""Descripción del producto: El tomate chonto es una variedad de tamaño mediano, piel lisa y color rojo intenso, ideal para todo tipo de preparaciones. Su pulpa jugosa y consistencia firme lo hacen perfecto para salsas, guisos, ensaladas, jugos y platos tradicionales. Es un ingrediente básico y versátil en la cocina del día a día."", ""Presentación: 1000gr"", ""Modo de fabricación: Industrial"", ""Origen: Nacional"", ""Ver más"", ""También puede interesarte"", ""CEBOLLA CABEZONA X 1000G"", ""ZANAHORIA X 1000 G"", ""CEBOLLA LARGA 500 GR"", ""PIMENTÓN UNIDAD"", ""LIMON TAHITI X 1000 GR"", ""PLÁTANO X 1000G"", ""LECHUGA VERDE CRESPA X 180 G"", ""PAPA CAPIRA X 2500 G"", ""CEBOLLA ROJA X 1000 G"", ""D1 Top 100"", ""BANANO UNIDAD""]}",dataset/txt_limpios/797.txt,dataset/paginas_descargadas/797.html,EN,cebolla,keep,0.60,heuristic_default
798,TOMATES SECOS AINOA 180 G,"Ingredientes | Componentes Nombre del producto: Tomates Secos Ainoa X 180g Descripción del producto: Los Tomates Secos Ainoa son ideales para quienes buscan un sabor concentrado y delicioso. Son perfectos para acompañar ensaladas, pastas o para ser consumidos directamente como aperitivo. Tamaño: 7cm x 6.8cm Peso: 180 g Modo de fabricación: Industrial Conservación: Consérvese en un lugar fresco, limpio y seco. Después de abierto, consúmase en el menor tiempo posible y mantenga refrigerado. Origen: Nacional RSA-002656-2016 Componentes: Tomates secos (tomates, sal) Aceite de colza Mezcla de especias (orégano, albahaca) Azúcar ¡Queremos que tengas la mejor experiencia! Si tienes dudas sobre este producto o su contenido, te invitamos a consultar nuestros Términos y condiciones para conocer más sobre devoluciones y nuestras políticas de reembolsos. Ver más También puede interesarte PESTO VERDE DELIZIARE X 190 G PIMENTONES ASADOS 185G Amor y amistad JAMON SERRANO 80 GRS ACEITUNA EN LATA AINOA 200 GR CHORIZO VELA + SALAMI VALDECAVA 80 GR LONJAS DE ALMENDRA NUTHOS 100 GR",Unidades disponibles > 180 G,100.0,,,Desconocido,unknown,UNKNOWN,TOMATES SECOS AINOA 180 G,Unidades disponibles,,180 G,100.00,,,100,100.0,False,original,100.0,100.0,1.0,default_1usd,,"Ingredientes | Componentes Nombre del producto: Tomates Secos Ainoa X 180g Descripción del producto: Los Tomates Secos Ainoa son ideales para quienes buscan un sabor concentrado y delicioso. Son perfectos para acompañar ensaladas, pastas o para ser consumidos directamente como aperitivo. Tamaño: 7cm x 6.8cm Peso: 180 g Modo de fabricación: Industrial Conservación: Consérvese en un lugar fresco, limpio y seco. Después de abierto, consúmase en el menor tiempo posible y mantenga refrigerado. Origen: Nacional RSA-002656-2016 Componentes: Tomates secos (tomates, sal) Aceite de colza Mezcla de especias (orégano, albahaca) Azúcar ¡Queremos que tengas la mejor experiencia! Si tienes dudas sobre este producto o su contenido, te invitamos a consultar nuestros Términos y condiciones para conocer más sobre devoluciones y nuestras políticas de reembolsos. Ver más También puede interesarte PESTO VERDE DELIZIARE X 190 G PIMENTONES ASADOS 185G Amor y amistad JAMON SERRANO 80 GRS ACEITUNA EN LATA AINOA 200 GR CHORIZO VELA + SALAMI VALDECAVA 80 GR LONJAS DE ALMENDRA NUTHOS 100 GR",,,,,,"{""Descripción"": [""Ingredientes | Componentes"", ""Nombre del producto: Tomates Secos Ainoa X 180g"", ""Descripción del producto: Los Tomates Secos Ainoa son ideales para quienes buscan un sabor concentrado y delicioso. Son perfectos para acompañar ensaladas, pastas o para ser consumidos directamente como aperitivo."", ""Tamaño: 7cm x 6.8cm"", ""Peso: 180 g"", ""Modo de fabricación: Industrial"", ""Conservación: Consérvese en un lugar fresco, limpio y seco. Después de abierto, consúmase en el menor tiempo posible y mantenga refrigerado."", ""Origen: Nacional"", ""RSA-002656-2016"", ""Componentes: Tomates secos (tomates, sal)"", ""Aceite de colza"", ""Mezcla de especias (orégano, albahaca)"", ""Azúcar"", ""¡Queremos que tengas la mejor experiencia! Si tienes dudas sobre este producto el contenido, te invitamos a consultar nuestros Términos y condiciones para conocer malas sobre los reembolsos y nuestras políticas de reembolso."", ""Ver más"", ""También puede interesarte"", ""PESTO VERDE DELIZIARE X 190 G"", ""PIMENTONES ASADOS 185G"", ""Amor y amistad"", ""JAMON SERRANO 80 GRS"", ""ACEITUNA EN LATA AINOA 200 GR"", ""CHORIZO VELA + SALAMI VALDECAVA 80 GR"", ""LONJAS DE ALMENDRA NUTHOS 100 GR""]}",dataset/txt_limpios/798.txt,dataset/paginas_descargadas/798.html,ET,azucar,keep,0.60,heuristic_default
17,Tortilleria y pan empacados,Pan Butter Krust Blanco 567g. ¡Calidad y frescura en cada bocado! Encuentra todo lo que necesitas en tu tienda online Chedraui.com.mx. Recibe en casa gracias al servicio a domicilio. Descarga la app.,Butter Krust > 567g > 3851928,,MXN,,Chedraui,unknown,MX,Tortilleria y pan empacados,Butter Krust,3851928.0,567g,,MXN,,,66.32,True,country_mean,,3.5617,18.62,from_mexico_cambio_dolar,Pan Butter Krust Blanco 567g.,,,¡Calidad y frescura en cada bocado! Encuentra todo lo que necesitas en tu tienda online Chedraui.com.mx. Recibe en casa gracias al servicio a domicilio. Descarga la app.,,,,"{""Información"": [""Pan Butter Krust Blanco 567g.""], ""Especificaciones"": [""¡Calidad y frescura en cada bocado! Encuentra todo lo que necesitas en tu tienda online Chedraui.com.mx. Recibe en casa gracias al servicio a domicilio. Descarga la app.""]}",dataset/txt_limpios/17.txt,dataset/paginas_descargadas/17.html,EN,descartado,discard,0.10,excluded_keyword
18,Tortilleria y pan empacados,"Prepara tu despensa en unos cuantos clics y descubre nuestra gran variedad de productos. ¡En la sala de casa, te llevamos el súper!",Natures Own > 624g > 3750236,72.0,MXN,,Chedraui,unknown,MX,Tortilleria y pan empacados,Natures Own,3750236.0,624g,72.00,MXN,$,$72.00,72.0,False,original,3.8668,3.8668,18.62,from_mexico_cambio_dolar,,,Deliciosos sabores ricos favoritos de su familia | Rebanadas más gruesas con un acabado de estilo artesanal espolvoreado con harina | Con una textura suave,"Prepara tu despensa en unos cuantos clics y descubre nuestra gran variedad de productos. ¡En la sala de casa, te llevamos el súper!",,,,"{""Características"": [""Deliciosos sabores ricos favoritos de su familia"", ""Rebanadas más gruesas con un acabado de estilo artesanal espolvoreado con harina"", ""Con una textura suave""], ""Especificaciones"": [""Prepara tu despensa en unos cuantos clics y descubre nuestra gran variedad de productos. ¡En la sala de casa, te llevamos el súper!""]}",dataset/txt_limpios/18.txt,dataset/paginas_descargadas/18.html,ET,pan,keep,0.60,heuristic_default
1281,Valoramos tu privacidad,"incap_ses_* sesión opt_out gdpr Caducada _GRECAPTCHA 6 meses Un CAPTCHA te ayuda a protegerte del spam y del descifrado de contraseñas pidiéndote que completes una simple prueba que demuestre que eres humano y no un ordenador que intenta acceder a una cuenta protegida con contraseña. __cf_bm 1 hora rc::a Nunca caduca rc::c rc::f rc::b Funcionales SnapABugRef 2 horas SnapABugHistory SnapABugUserAlias SnapABugVisit Analíticas ___utmvc Menos de un minuto _gcl_au 3 meses _ga 1 año 1 mes 4 días _gid 1 día _gat_UA-* 1 minuto _ga_* uid 1 año 24 días _hjSessionUser_* _hjSession_* _fbp demdex _hjTLDTest Rendimiento Anuncio 15 minutos personalization_id muc_ads cto_bundle IDE uuid2 anj CMID CMPS CMPRO dpm mv_tokens 14 días 1 minuto cf Used to present the visitor with relevant content advertisement. cip Presents the user with relevant content and advertisements, and facilitates real-time bidding for advertisers. cnac car callback criteo_write_test YSC VISITOR_INFO1_LIVE VISITOR_PRIVACY_METADATA _ttp ab Nezaradené do kategórie ck_flagpv Description is currently not available. visitor-id No description available. data-c-ts 1 mes data-c mv_tokens_eu-v1 am_tokens am_tokens_eu-v1 criteo tvid tv_UICR optout cto_tld_test XANDR_PANID gpp ttcsid_CU8M57RC77U66G5CN100 ttcsid __Secure-ROLLOUT_TOKEN Guardar mis preferencias Powered by X App Frecuento Descárgala Gratis Ver en App Leches Leche Nutri Entera Cartón 1L Marca: Nutri Código - 40009228 Cantidad Pagar Realiza tus compras con seguridad Leche entera | Ultrapasteurizada, larga Vida | Producto comercialmente estéril | Llenado aséptico en envase esterilizado | Sellado herméticamente | Contenido: 1 Litro",Personalizar > 1L,1.17,,,Desconocido,unknown,UNKNOWN,Valoramos tu privacidad,Personalizar,,1L,1.17,,$,$1.17,1.17,False,original,1.17,1.17,1.0,default_1usd,,"incap_ses_* sesión opt_out gdpr Caducada _GRECAPTCHA 6 meses Un CAPTCHA te ayuda a protegerte del spam y del descifrado de contraseñas pidiéndote que completes una simple prueba que demuestre que eres humano y no un ordenador que intenta acceder a una cuenta protegida con contraseña. __cf_bm 1 hora rc::a Nunca caduca rc::c rc::f rc::b Funcionales SnapABugRef 2 horas SnapABugHistory SnapABugUserAlias SnapABugVisit Analíticas ___utmvc Menos de un minuto _gcl_au 3 meses _ga 1 año 1 mes 4 días _gid 1 día _gat_UA-* 1 minuto _ga_* uid 1 año 24 días _hjSessionUser_* _hjSession_* _fbp demdex _hjTLDTest Rendimiento Anuncio 15 minutos personalization_id muc_ads cto_bundle IDE uuid2 anj CMID CMPS CMPRO dpm mv_tokens 14 días 1 minuto cf Used to present the visitor with relevant content advertisement. cip Presents the user with relevant content and advertisements, and facilitates real-time bidding for advertisers. cnac car callback criteo_write_test YSC VISITOR_INFO1_LIVE VISITOR_PRIVACY_METADATA _ttp ab Nezaradené do kategórie ck_flagpv Description is currently not available. visitor-id No description available. data-c-ts 1 mes data-c mv_tokens_eu-v1 am_tokens am_tokens_eu-v1 criteo tvid tv_UICR optout cto_tld_test XANDR_PANID gpp ttcsid_CU8M57RC77U66G5CN100 ttcsid __Secure-ROLLOUT_TOKEN Guardar mis preferencias Powered by X App Frecuento Descárgala Gratis Ver en App Leches Leche Nutri Entera Cartón 1L Marca: Nutri Código - 40009228 Cantidad Pagar Realiza tus compras con seguridad",,,,"Leche entera | Ultrapasteurizada, larga Vida | Producto comercialmente estéril | Llenado aséptico en envase esterilizado | Sellado herméticamente | Contenido: 1 Litro",,"{""Descripción"": [""incap_ses_*"", ""sesión"", ""opt_out"", ""gdpr"", ""Caducada"", ""_GRECAPTCHA"", ""6 meses"", ""Un CAPTCHA te ayuda a protegerte del spam y del descifrado de contraseñas pidiéndote que completes una simple prueba que demuestre que eres humano y no un ordenador que intenta acceder a una cuenta protegida con contraseña."", ""__cf_bm"", ""1 hora"", ""rc::a"", ""Nunca caduca"", ""rc::c"", ""rc::f"", ""rc::b"", ""Funcionales"", ""SnapABugRef"", ""2 horas"", ""SnapABugHistory"", ""SnapABugUserAlias"", ""SnapABugVisit"", ""Analíticas"", ""___utmvc"", ""Menos de un minuto"", ""_gcl_au"", ""3 meses"", ""_ga"", ""1 año 1 mes 4 días"", ""_gid"", ""1 día"", ""_gat_UA-*"", ""1 minuto"", ""_ga_*"", ""uid"", ""1 año 24 días"", ""_hjSessionUser_*"", ""_hjSession_*"", ""_fbp"", ""demdex"", ""_hjTLDTest"", ""Rendimiento"", ""Anuncio"", ""15 minutos"", ""personalization_id"", ""muc_ads"", ""cto_bundle"", ""IDE"", ""uuid2"", ""anj"", ""CMID"", ""CMPS"", ""CMPRO"", ""dpm"", ""mv_tokens"", ""14 días 1 minuto"", ""cf"", ""Used to present the visitor with relevant content advertisement."", ""cip"", ""Presents the user with relevant content and advertisements, and facilitates real-time bidding for advertisers."", ""cnac"", ""car"", ""callback"", ""criteo_write_test"", ""YSC"", ""VISITOR_INFO1_LIVE"", ""VISITOR_PRIVACY_METADATA"", ""_ttp"", ""ab"", ""Nezaradené do kategórie"", ""ck_flagpv"", ""Description is currently not available."", ""visitor-id"", ""No description available."", ""data-c-ts"", ""1 mes"", ""data-c"", ""mv_tokens_eu-v1"", ""am_tokens"", ""am_tokens_eu-v1"", ""criteo"", ""tvid"", ""tv_UICR"", ""optout"", ""cto_tld_test"", ""XANDR_PANID"", ""gpp"", ""ttcsid_CU8M57RC77U66G5CN100"", ""ttcsid"", ""__Secure-ROLLOUT_TOKEN"", ""Guardar mis preferencias"", ""Powered by"", ""X"", ""App Frecuento"", ""Descárgala gratis"", ""Ver en App"", ""Leches"", ""Leche Nutri Entera Cartón 1L"", ""Marca: Nutri"", ""Código - 40009228"", ""Cantidad"", ""Pagar"", ""Realiza tus compras"", ""con seguridad""], ""Detalles"": [""Leche entera"", ""Ultrapasteurizada, larga Vida"", ""Producto comercialmente estéril"", ""Llenado aséptico en envase esterilizado"", ""Sellado herméticamente"", ""Contenido: 1 Litro""]}",dataset/txt_limpios/1281.txt,dataset/paginas_descargadas/1281.html,ET,leche,keep,0.60,heuristic_default
