{"source_id": "1730", "title": "Bebidas, Aguas y Jugos", "description": "Bebidas Gaseosa Naranja Crush 1.5lt | Actualizado al: 02-04-2025 Ingredientes: Agua carbonatada, Azúcar, Ácido cítrico, Saborizantes naturales, Sorbato de potasio, Benzoato de sodio, Sucralosa, Acesulfamo de potasio, Ácido ascórbico, Amarillo crepúsculo, Rojo allura ac. Certificados: Libre de Gluten / Sin TACC Apto para APLV Libre de Lactosa Vegano Vegetariano Libre de Soya Libre de Huevo Libre de Peces Libre de Mariscos Libre de Maní Libre de Frutas Secos Libre de Nueces Libre de Sulfitos Libre de Trigo Kosher Porción: 1 Vaso (200ml) Porciones por envase: 8 100ml 1 Porción Energía (kCal) 16 32 Proteínas (g) 0 Grasas Totales Hidratos de carbono disponibles 4 8 Azúcares totales (g) Sodio (mg) 14 28 Importante: La información del empaque y/o contenido del producto final puede diferir respecto a lo que mostramos en nuestro sitio web, tanto a nivel de ingredientes, trazas, información nutricional, sellos, modo de uso y/o modo de conservación. Usted debe basarse únicamente en la información que se muestra en nuestro sitio web y siempre debe leer las etiquetas, advertencias y instrucciones antes de usar el consumo de un producto. Información obtenida de BEBIDA CRUSH 1500 CC. DESECH. Productos similares Ver producto Bebida Kem Bebida Pap Bebidas Crush Zero 1.5 Lt Bebida Zero Bebida Kem Piña 3 L bebida Bilz Bebida Pap Lata -38% Bebidas Fanta Volverble Bebida Sprite -22% BEBIDA INCA KOLA 3 LT -29% bebida Crush 600 ml -26% bebida Crush Naranja 3 L Bebida Coca Cola Original 3 L -23% Bebidas Crush Zero 600 ml Bebidas Bilz Zero Bebida Kem Piña Zero 3 ¡L! ¡Juntos son mejores! Bebidas Limón Soda Zero Bebida Pepsi 1.5 L Bebida Coca Cola Original 1.5 L Bebida Coca Cola Sin Azúcar 1.5 L Bebida Coca Cola -33% Papas Fritas Corte Americano Lays 150 g Ramitas Sabor Original Evercrips 230 g -30% Bebida Coca Cola Original 2.5 L -25% Doritos de Queso Papas Fritas Marco Polo Caseras 200 g -17% Papas Fritas Corte Americano Bebida Sprite Sin Azúcar 1.5 L Bebida Pepsi 2 L Papas Fritas Marco Polo Americanas 200 g Ramitas Queso Papas Fritas Corte Americano Lays 200 g -35% Bebidas Coca Cola Zero 1 L Doritos Queso Bebida Coca Cola Sin Azúcar 3 L", "breadcrumbs": "Bebidas > 1.5 LT", "price_raw": "1.99", "currency_raw": "", "url": "", "seller": "Desconocido", "availability": "unknown", "country": "UNKNOWN", "product_name": "Bebidas, Aguas y Jugos", "brand": "Bebidas", "reference": "", "unit": "1.5 LT", "price_amount": 1.99, "price_currency": "", "price_symbol": "", "price_text": "1.99", "price_amount_filled": "1.99", "price_is_imputed": "False", "price_imputation_source": "original", "price_amount_usd": "1.99", "price_amount_usd_filled": "1.99", "fx_rate_local_per_usd": "1.0", "fx_source": "default_1usd", "information_text": "", "description_text": "Bebidas Gaseosa Naranja Crush 1.5lt | Actualizado al: 02-04-2025 Ingredientes: Agua carbonatada, Azúcar, Ácido cítrico, Saborizantes naturales, Sorbato de potasio, Benzoato de sodio, Sucralosa, Acesulfamo de potasio, Ácido ascórbico, Amarillo crepúsculo, Rojo allura ac. Certificados: Libre de Gluten / Sin TACC Apto para APLV Libre de Lactosa Vegano Vegetariano Libre de Soya Libre de Huevo Libre de Peces Libre de Mariscos Libre de Maní Libre de Frutas Secos Libre de Nueces Libre de Sulfitos Libre de Trigo Kosher Porción: 1 Vaso (200ml) Porciones por envase: 8 100ml 1 Porción Energía (kCal) 16 32 Proteínas (g) 0 Grasas Totales Hidratos de carbono disponibles 4 8 Azúcares totales (g) Sodio (mg) 14 28 Importante: La información del empaque y/o contenido del producto final puede diferir respecto a lo que mostramos en nuestro sitio web, tanto a nivel de ingredientes, trazas, información nutricional, sellos, modo de uso y/o modo de conservación. Usted debe basarse únicamente en la información que se muestra en nuestro sitio web y siempre debe leer las etiquetas, advertencias y instrucciones antes de usar el consumo de un producto. Información obtenida de BEBIDA CRUSH 1500 CC. DESECH. Productos similares Ver producto Bebida Kem Bebida Pap Bebidas Crush Zero 1.5 Lt Bebida Zero Bebida Kem Piña 3 L bebida Bilz Bebida Pap Lata -38% Bebidas Fanta Volverble Bebida Sprite -22% BEBIDA INCA KOLA 3 LT -29% bebida Crush 600 ml -26% bebida Crush Naranja 3 L Bebida Coca Cola Original 3 L -23% Bebidas Crush Zero 600 ml Bebidas Bilz Zero Bebida Kem Piña Zero 3 ¡L! ¡Juntos son mejores! Bebidas Limón Soda Zero Bebida Pepsi 1.5 L Bebida Coca Cola Original 1.5 L Bebida Coca Cola Sin Azúcar 1.5 L Bebida Coca Cola -33% Papas Fritas Corte Americano Lays 150 g Ramitas Sabor Original Evercrips 230 g -30% Bebida Coca Cola Original 2.5 L -25% Doritos de Queso Papas Fritas Marco Polo Caseras 200 g -17% Papas Fritas Corte Americano Bebida Sprite Sin Azúcar 1.5 L Bebida Pepsi 2 L Papas Fritas Marco Polo Americanas 200 g Ramitas Queso Papas Fritas Corte Americano Lays 200 g -35% Bebidas Coca Cola Zero 1 L Doritos Queso Bebida Coca Cola Sin Azúcar 3 L", "features_text": "", "specifications_text": "", "benefits_text": "", "details_text": "", "other_sections": "", "sections": {"Descripción": ["Bebida Gaseosa Naranja Crush", "1.5lt | Actualizado al: 02-04-2025", "Ingredientes: Agua carbonatada, Azúcar, Ácido cítrico, Saborizantes naturales, Sorbato de potasio, Benzoato de sodio, Sucralosa, Acesulfamo de potasio, Ácido ascórbico, Amarillo crepúsculo, Rojo allura ac.", "Certificados: Libre de Gluten / Sin TACC", "Apto para APLV", "Libre de Lactosa", "Vegano", "Vegetariano", "Libre de Soya", "Libre de Huevo", "Libre de Peces", "Libre de Mariscos", "Libre de Maní", "Libre de Frutos Secos", "Libre de Nueces", "Libre de Sulfitos", "Libre de Trigo", "Kosher", "Porción: 1 Vaso (200ml)", "Porciones por envase: 8", "100ml", "1 Porción", "Energía", "(kCal)", "16", "32", "Proteínas", "(g)", "0", "Grasas Totales", "Hidratos de carbono disponibles", "4", "8", "Azúcar total (g)", "Sodio", "(mg)", "14", "28", "Importante: La información del empaque y/o contenido del producto final puede diferir respecto a lo que mostramos en nuestro sitio web, tanto a nivel de ingredientes, trazas, información nutricional, sellos, modo de uso y/o modo de conservación. Usted debe basarse únicamente en la información que se muestra en nuestro sitio web y siempre debe leer las etiquetas, advertencias y instrucciones antes de usar el consumo de un producto.", "Información obtenida de", "BEBIDA CRUSH 1500 CC. DESECH.", "Productos similares", "Ver producto", "Bebida Kem", "Bebida Pap", "Bebida Crush Zero 1.5 Lt", "Bebida Zero", "Bebida Kem Piña 3 L", "Bebida Bilz", "Bebida Pap Lata", "-38%", "Bebida Fanta Retornable", "Bebida Sprite", "-22%", "BEBIDA INCA KOLA 3 LT", "-29%", "Bebida Crush 600 ml", "-26%", "Bebida Crush Naranja 3 L", "Bebida Coca Cola Original 3 L", "-23%", "Bebida Crush Zero 600 ml", "Bebida Bilz Zero", "Bebida Kem Piña Zero 3 L", "¡Juntos son mejores!", "Bebida limpia cero", "Bebida Pepsi 1.5 L", "Bebida Coca Cola Original 1.5 L", "Bebidas Coca Cola Sin Azúcar 1.5 L", "Bebida Coca Cola", "-33%", "Papas Fritas Corte Americano Lays 150 g", "Ramitas Sabor Original Evercrips 230 g", "-30%", "Bebida Coca Cola Original 2.5 L", "-25%", "Doritos de Queso", "Papas Fritas Marco Polo Caseras 200 g", "-17%", "Papas Fritas Corte Americano", "Bebidas Sprite Sin Azúcar 1.5 L", "Bebida Pepsi 2 L", "Papas Fritas Marco Polo Americanas 200 g", "Ramitas Queso", "Papas Fritas Corte Americano Lays 200 g", "-35%", "Bebida Coca Cola Zero 1 L", "Doritos Queso", "Bebida Coca Cola Sin Azúcar 3 L"]}, "txt_path": "dataset/txt_limpios/1730.txt", "html_path": "dataset/paginas_descargadas/1730.html", "es_status": "ET", "category_canonical": "papa", "decision": "keep", "match_score": 0.6, "reasons": "heuristic_default"}
{"source_id": "100", "title": "BUSCAR PRODUCTOS", "description": "Huevo fresco de granja. Estuche abre facil | x | Promociones | Cerrar | Más información", "breadcrumbs": "Ingresa > 30 piezas", "price_raw": "443.0", "currency_raw": "", "url": "", "seller": "Desconocido", "availability": "unknown", "country": "UNKNOWN", "product_name": "BUSCAR PRODUCTOS", "brand": "Ingresa", "reference": "", "unit": "30 piezas", "price_amount": 443.0, "price_currency": "", "price_symbol": "", "price_text": "443", "price_amount_filled": "443.0", "price_is_imputed": "False", "price_imputation_source": "original", "price_amount_usd": "443.0", "price_amount_usd_filled": "443.0", "fx_rate_local_per_usd": "1.0", "fx_source": "default_1usd", "information_text": "", "description_text": "", "features_text": "", "specifications_text": "", "benefits_text": "Huevo fresco de granja. Estuche abre facil | x | Promociones | Cerrar | Más información", "details_text": "", "other_sections": "", "sections": {"Beneficios": ["Huevo fresco de granja. Estuche abre facil", "x", "Promociones", "Cerrar", "Más información"]}, "txt_path": "dataset/txt_limpios/100.txt", "html_path": "dataset/paginas_descargadas/100.html", "es_status": "EN", "category_canonical": "huevo", "decision": "discard", "match_score": 0.3, "reasons": "heuristic_default"}
{"source_id": "101", "title": "BUSCAR PRODUCTOS", "description": "", "breadcrumbs": "Ingresa", "price_raw": "", "currency_raw": "", "url": "", "seller": "Desconocido", "availability": "unknown", "country": "UNKNOWN", "product_name": "BUSCAR PRODUCTOS", "brand": "Ingresa", "reference": "", "unit": "", "price_amount": null, "price_currency": "", "price_symbol": "", "price_text": "", "price_amount_filled": "234.19", "price_is_imputed": "True", "price_imputation_source": "country_mean", "price_amount_usd": "", "price_amount_usd_filled": "234.1938", "fx_rate_local_per_usd": "1.0", "fx_source": "default_1usd", "information_text": "", "description_text": "", "features_text": "", "specifications_text": "", "benefits_text": "", "details_text": "", "other_sections": "", "sections": {}, "txt_path": "dataset/txt_limpios/101.txt", "html_path": "dataset/paginas_descargadas/101.html", "es_status": "EN", "category_canonical": "sin_categoria", "decision": "discard", "match_score": 0.3, "reasons": "no_category_detected;price_parse_failed"}
{"source_id": "102", "title": "BUSCAR PRODUCTOS", "description": "", "breadcrumbs": "Ingresa", "price_raw": "443.0", "currency_raw": "", "url": "", "seller": "Desconocido", "availability": "unknown", "country": "UNKNOWN", "product_name": "BUSCAR PRODUCTOS", "brand": "Ingresa", "reference": "", "unit": "", "price_amount": 443.0, "price_currency": "", "price_symbol": "", "price_text": "443", "price_amount_filled": "443.0", "price_is_imputed": "False", "price_imputation_source": "original", "price_amount_usd": "443.0", "price_amount_usd_filled": "443.0", "fx_rate_local_per_usd": "1.0", "fx_source": "default_1usd", "information_text": "", "description_text": "", "features_text": "", "specifications_text": "", "benefits_text": "", "details_text": "", "other_sections": "", "sections": {}, "txt_path": "dataset/txt_limpios/102.txt", "html_path": "dataset/paginas_descargadas/102.html", "es_status": "EN", "category_canonical": "sin_categoria", "decision": "discard", "match_score": 0.3, "reasons": "no_category_detected"}
{"source_id": "103", "title": "BUSCAR PRODUCTOS", "description": "", "breadcrumbs": "Ingresa", "price_raw": "443.0", "currency_raw": "", "url": "", "seller": "Desconocido", "availability": "unknown", "country": "UNKNOWN", "product_name": "BUSCAR PRODUCTOS", "brand": "Ingresa", "reference": "", "unit": "", "price_amount": 443.0, "price_currency": "", "price_symbol": "", "price_text": "443", "price_amount_filled": "443.0", "price_is_imputed": "False", "price_imputation_source": "original", "price_amount_usd": "443.0", "price_amount_usd_filled": "443.0", "fx_rate_local_per_usd": "1.0", "fx_source": "default_1usd", "information_text": "", "description_text": "", "features_text": "", "specifications_text": "", "benefits_text": "", "details_text": "", "other_sections": "", "sections": {}, "txt_path": "dataset/txt_limpios/103.txt", "html_path": "dataset/paginas_descargadas/103.html", "es_status": "EN", "category_canonical": "sin_categoria", "decision": "discard", "match_score": 0.3, "reasons": "no_category_detected"}
{"source_id": "104", "title": "BUSCAR PRODUCTOS", "description": "", "breadcrumbs": "Ingresa", "price_raw": "443.0", "currency_raw": "", "url": "", "seller": "Desconocido", "availability": "unknown", "country": "UNKNOWN", "product_name": "BUSCAR PRODUCTOS", "brand": "Ingresa", "reference": "", "unit": "", "price_amount": 443.0, "price_currency": "", "price_symbol": "", "price_text": "443", "price_amount_filled": "443.0", "price_is_imputed": "False", "price_imputation_source": "original", "price_amount_usd": "443.0", "price_amount_usd_filled": "443.0", "fx_rate_local_per_usd": "1.0", "fx_source": "default_1usd", "information_text": "", "description_text": "", "features_text": "", "specifications_text": "", "benefits_text": "", "details_text": "", "other_sections": "", "sections": {}, "txt_path": "dataset/txt_limpios/104.txt", "html_path": "dataset/paginas_descargadas/104.html", "es_status": "EN", "category_canonical": "sin_categoria", "decision": "discard", "match_score": 0.3, "reasons": "no_category_detected"}
{"source_id": "105", "title": "BUSCAR PRODUCTOS", "description": "", "breadcrumbs": "Ingresa", "price_raw": "443.0", "currency_raw": "", "url": "", "seller": "Desconocido", "availability": "unknown", "country": "UNKNOWN", "product_name": "BUSCAR PRODUCTOS", "brand": "Ingresa", "reference": "", "unit": "", "price_amount": 443.0, "price_currency": "", "price_symbol": "", "price_text": "443", "price_amount_filled": "443.0", "price_is_imputed": "False", "price_imputation_source": "original", "price_amount_usd": "443.0", "price_amount_usd_filled": "443.0", "fx_rate_local_per_usd": "1.0", "fx_source": "default_1usd", "information_text": "", "description_text": "", "features_text": "", "specifications_text": "", "benefits_text": "", "details_text": "", "other_sections": "", "sections": {}, "txt_path": "dataset/txt_limpios/105.txt", "html_path": "dataset/paginas_descargadas/105.html", "es_status": "EN", "category_canonical": "sin_categoria", "decision": "discard", "match_score": 0.3, "reasons": "no_category_detected"}
{"source_id": "106", "title": "BUSCAR PRODUCTOS", "description": "", "breadcrumbs": "Ingresa", "price_raw": "443.0", "currency_raw": "", "url": "", "seller": "Desconocido", "availability": "unknown", "country": "UNKNOWN", "product_name": "BUSCAR PRODUCTOS", "brand": "Ingresa", "reference": "", "unit": "", "price_amount": 443.0, "price_currency": "", "price_symbol": "", "price_text": "443", "price_amount_filled": "443.0", "price_is_imputed": "False", "price_imputation_source": "original", "price_amount_usd": "443.0", "price_amount_usd_filled": "443.0", "fx_rate_local_per_usd": "1.0", "fx_source": "default_1usd", "information_text": "", "description_text": "", "features_text": "", "specifications_text": "", "benefits_text": "", "details_text": "", "other_sections": "", "sections": {}, "txt_path": "dataset/txt_limpios/106.txt", "html_path": "dataset/paginas_descargadas/106.html", "es_status": "EN", "category_canonical": "sin_categoria", "decision": "discard", "match_score": 0.3, "reasons": "no_category_detected"}
{"source_id": "107", "title": "BUSCAR PRODUCTOS", "description": "Aporta carbohidratos complejos y es una base esencial en la cocina mexicana tradicional y moderna. | INGREDIENTES | Harina de trigo, peróxido de benzoílo, hierro (fumarato ferroso), zinc (óxido de zinc), niacina, vitamina B1 (mononitrato de tiamina), vitamina B2 (riboflavina), ácido fólico (vitamina B9) y enzimas. | DECLARACIÓN NUTRIMENTAL | Contenido energético por envase 3 450 kcal (14 650 kJ) Tamaño de porción 100 G Porciones por envase 10 Contenido energético 345 kcal (1 465 kJ) Proteínas 11 G Grasas totales 1 G Grasas saturadas 0 G Grasas trans 0 MG Hidratos de carbono disponibles 73 G Azúcares 1 G Azúcares añadidos 0 G Fibra dietética 3 G Sodio 10 MG Nutrimento 100 G %VNR Vitamina B1 0,5 62.5 Vitamina B2 0.3 35.7 Niacina 3.5 31.8 Ácido fólico 0,2 52.6 Hierro 4 23.5 Zinc 4 40 | x | Promociones | Cerrar | Más información", "breadcrumbs": "Ingresa > 1 KG", "price_raw": "443.0", "currency_raw": "", "url": "", "seller": "Desconocido", "availability": "unknown", "country": "UNKNOWN", "product_name": "BUSCAR PRODUCTOS", "brand": "Ingresa", "reference": "", "unit": "1 KG", "price_amount": 443.0, "price_currency": "", "price_symbol": "", "price_text": "443", "price_amount_filled": "443.0", "price_is_imputed": "False", "price_imputation_source": "original", "price_amount_usd": "443.0", "price_amount_usd_filled": "443.0", "fx_rate_local_per_usd": "1.0", "fx_source": "default_1usd", "information_text": "", "description_text": "", "features_text": "", "specifications_text": "", "benefits_text": "Aporta carbohidratos complejos y es una base esencial en la cocina mexicana tradicional y moderna. | INGREDIENTES | Harina de trigo, peróxido de benzoílo, hierro (fumarato ferroso), zinc (óxido de zinc), niacina, vitamina B1 (mononitrato de tiamina), vitamina B2 (riboflavina), ácido fólico (vitamina B9) y enzimas. | DECLARACIÓN NUTRIMENTAL | Contenido energético por envase 3 450 kcal (14 650 kJ) Tamaño de porción 100 G Porciones por envase 10 Contenido energético 345 kcal (1 465 kJ) Proteínas 11 G Grasas totales 1 G Grasas saturadas 0 G Grasas trans 0 MG Hidratos de carbono disponibles 73 G Azúcares 1 G Azúcares añadidos 0 G Fibra dietética 3 G Sodio 10 MG Nutrimento 100 G %VNR Vitamina B1 0,5 62.5 Vitamina B2 0.3 35.7 Niacina 3.5 31.8 Ácido fólico 0,2 52.6 Hierro 4 23.5 Zinc 4 40 | x | Promociones | Cerrar | Más información", "details_text": "", "other_sections": "", "sections": {"Beneficios": ["Aporta carbohidratos complejos y es una base esencial en la cocina mexicana tradicional y moderna.", "INGREDIENTES", "Harina de trigo, peróxido de benzoílo, hierro (fumarato ferroso), zinc (óxido de zinc), niacina, vitamina B1 (mononitrato de tiamina), vitamina B2 (riboflavina), ácido fólico (vitamina B9) y enzimas.", "DECLARACIÓN NUTRIMENTAL", "Contenido energético por envase 3 450 kcal (14 650 kJ) Tamaño de porción 100 G Porciones por envase 10 Contenido energético 345 kcal (1 465 kJ) Proteínas 11 G Grasas totales 1 G Grasas saturadas 0 G Grasas trans 0 MG Hidratos de carbono disponibles 73 G Azúcares 1 G Azúcares añadidos 0 G Fibra dietética 3 G Sodio 10 MG Nutrimento 100 G %VNR Vitamina B1 0,5 62.5 Vitamina B2 0.3 35.7 Niacina 3.5 31.8 Ácido fólico 0,2 52.6 Hierro 4 23.5 Zinc 4 40", "x", "Promociones", "Cerrar", "Más información"]}, "txt_path": "dataset/txt_limpios/107.txt", "html_path": "dataset/paginas_descargadas/107.html", "es_status": "ET", "category_canonical": "harina de trigo", "decision": "keep", "match_score": 0.6, "reasons": "heuristic_default"}
{"source_id": "108", "title": "BUSCAR PRODUCTOS", "description": "Es esencial en cualquier dieta y su versatilidad te permitirá preparar diversos y ricos platillos. Tips y usos Para saber si una papa es de calidad, confirma que sea firme, tenga piel suave y su color sea blanco. Platillos destacados ¿Qué tal un acompañamiento de papas y berenjenas al romero para tu comida de hoy? Además, prepara purés, tortillas, papas fritas el úsala como ingrediente principal de otras recetas. Gracias a su contenido en carbohidratos, es una gran fuente natural de energía. | x | Promociones | Cerrar | Más información", "breadcrumbs": "Ingresa", "price_raw": "443.0", "currency_raw": "", "url": "", "seller": "Desconocido", "availability": "unknown", "country": "UNKNOWN", "product_name": "BUSCAR PRODUCTOS", "brand": "Ingresa", "reference": "", "unit": "", "price_amount": 443.0, "price_currency": "", "price_symbol": "", "price_text": "443", "price_amount_filled": "443.0", "price_is_imputed": "False", "price_imputation_source": "original", "price_amount_usd": "443.0", "price_amount_usd_filled": "443.0", "fx_rate_local_per_usd": "1.0", "fx_source": "default_1usd", "information_text": "", "description_text": "Es esencial en cualquier dieta y su versatilidad te permitirá preparar diversos y ricos platillos. Tips y usos Para saber si una papa es de calidad, confirma que sea firme, tenga piel suave y su color sea blanco. Platillos destacados ¿Qué tal un acompañamiento de papas y berenjenas al romero para tu comida de hoy? Además, prepara purés, tortillas, papas fritas el úsala como ingrediente principal de otras recetas.", "features_text": "", "specifications_text": "", "benefits_text": "Gracias a su contenido en carbohidratos, es una gran fuente natural de energía. | x | Promociones | Cerrar | Más información", "details_text": "", "other_sections": "", "sections": {"Descripción": ["Es esencial en cualquier dieta y su versatilidad te permitirá preparar diversos y ricos platillos.", "Tips y usos", "Para saber si una papa es de calidad, confirma que sea firme, tenga piel suave y su color sea blanco.", "Platillos destacados", "¿Qué tal un acompañamiento de papas y berenjenas al romero para tu comida de hoy? Además, prepara purés, tortillas, papas fritas el úsala como ingrediente principal de otras recetas."], "Beneficios": ["Gracias a su contenido en carbohidratos, es una gran fuente natural de energía.", "x", "Promociones", "Cerrar", "Más información"]}, "txt_path": "dataset/txt_limpios/108.txt", "html_path": "dataset/paginas_descargadas/108.html", "es_status": "ET", "category_canonical": "papa", "decision": "keep", "match_score": 0.6, "reasons": "heuristic_default"}
