source_id,title,description,breadcrumbs,price_raw,currency_raw,url,seller,availability,country,product_name,brand,reference,unit,price_amount,price_currency,price_symbol,price_text,price_amount_filled,price_is_imputed,price_imputation_source,price_amount_usd,price_amount_usd_filled,fx_rate_local_per_usd,fx_source,information_text,description_text,features_text,specifications_text,benefits_text,details_text,other_sections,sections,txt_path,html_path,es_status,category_canonical,decision,match_score,reasons
1317,El almacenamiento local parece estar deshabilitado en tu navegador.,"Leche 100% de vaca | Conserva todos los componentes el propiedades nutricionalesde la leche | Rica en grasa, calcio, minerales, proteínas y vitaminas A,D, B y E | Ayuda a mantener huesos fuertes y sanos | Empaque 100% reciclable | Contenido: 1 Litro | Detalles del producto | Reseñas | Escribir Su propia reseña | Estás revisando: Leche Entera Tru 1L | Su valoración | Rating | 1 stars | 2 stars | 3 stars | 4 stars | 5 stars | Apodo | Resumen | Reseña | Escribir una reseña | Unds. | Search engine powered by | ElasticSuite",Aprende más > 1L,1.33,,,Desconocido,unknown,UNKNOWN,El almacenamiento local parece estar deshabilitado en tu navegador.,Aprende,,1L,1.33,,$,"$1,33",1.33,False,original,1.33,1.33,1.0,default_1usd,,,,,,"Leche 100% de vaca | Conserva todos los componentes el propiedades nutricionalesde la leche | Rica en grasa, calcio, minerales, proteínas y vitaminas A,D, B y E | Ayuda a mantener huesos fuertes y sanos | Empaque 100% reciclable | Contenido: 1 Litro | Detalles del producto | Reseñas | Escribir Su propia reseña | Estás revisando: Leche Entera Tru 1L | Su valoración | Rating | 1 stars | 2 stars | 3 stars | 4 stars | 5 stars | Apodo | Resumen | Reseña | Escribir una reseña | Unds. | Search engine powered by | ElasticSuite",,"{""Detalles"": [""Leche 100% de vaca"", ""Conserva todos los componentes o propiedades nutricionalesde la leche"", ""Rica en grasa, calcio, minerales, proteínas y vitaminas A,D, B y E"", ""Ayuda a mantener huesos fuertes y sanos"", ""Empaque 100% reciclable"", ""Contenido: 1 Litro"", ""Detalles del producto"", ""Reseñas"", ""Escribir Su propia reseña"", ""Estás revisando: Leche Entera Tru 1L"", ""Su valoración"", ""Rating"", ""1 star"", ""2 stars"", ""3 stars"", ""4 stars"", ""5 stars"", ""Apodo"", ""Resumen"", ""Reseña"", ""Escribir una reseña"", ""Unds."", ""Search engine powered by"", ""ElasticSuite""]}",dataset/txt_limpios/1317.txt,dataset/paginas_descargadas/1317.html,ET,leche,keep,0.60,heuristic_default
1318,El almacenamiento local parece estar deshabilitado en tu navegador.,"Es el producto de un proceso térmico UHT de Leche Deslactosada | Comercialmente estéril, seguido de un llenado aséptico enenvase esterilizado y sellado herméticamente | Tiene una vida útil de 6 meses | Contenido: 1 litro | Detalles del producto | Reseñas | Escribir Su propia reseña | Estás revisando: Leche Deslactosada Nutri 1L | Su valoración | Rating | 1 stars | 2 stars | 3 stars | 4 stars | 5 stars | Apodo | Resumen | Reseña | Escribir una reseña | Unds. | Search engine powered by | ElasticSuite",Aprende más > 1L,1.5,,,Desconocido,unknown,UNKNOWN,El almacenamiento local parece estar deshabilitado en tu navegador.,Aprende,,1L,1.50,,$,"$1,50",1.5,False,original,1.5,1.5,1.0,default_1usd,,,,,,"Es el producto de un proceso térmico UHT de Leche Deslactosada | Comercialmente estéril, seguido de un llenado aséptico enenvase esterilizado y sellado herméticamente | Tiene una vida útil de 6 meses | Contenido: 1 litro | Detalles del producto | Reseñas | Escribir Su propia reseña | Estás revisando: Leche Deslactosada Nutri 1L | Su valoración | Rating | 1 stars | 2 stars | 3 stars | 4 stars | 5 stars | Apodo | Resumen | Reseña | Escribir una reseña | Unds. | Search engine powered by | ElasticSuite",,"{""Detalles"": [""Es el producto de un proceso térmico UHT de Leche Deslactosada"", ""Comercialmente estéril, seguido de un llenado aséptico enenvase esterilizado y sellado herméticamente"", ""Tiene una vida útil de 6 meses"", ""Contenido: 1 litro"", ""Detalles del producto"", ""Reseñas"", ""Escribir Su propia reseña"", ""Estás revisando: Leche Deslactosada Nutri 1L"", ""Su valoración"", ""Rating"", ""1 star"", ""2 stars"", ""3 stars"", ""4 stars"", ""5 stars"", ""Apodo"", ""Resumen"", ""Reseña"", ""Escribir una reseña"", ""Unds."", ""Search engine powered by"", ""ElasticSuite""]}",dataset/txt_limpios/1318.txt,dataset/paginas_descargadas/1318.html,ET,leche,keep,0.60,heuristic_default
1319,El almacenamiento local parece estar deshabilitado en tu navegador.,Leche semidescremada | 100% leche | No necesita refrigeración | 90 días de duración | Con vitaminas A y D | Contenido: 900ml | Detalles del producto | Reseñas | Escribir Su propia reseña | Estás revisando: LECHE SINIDESCREMADA ANDILAC 900 ML UHT | Su valoración | Rating | 1 stars | 2 stars | 3 stars | 4 stars | 5 stars | Apodo | Resumen | Reseña | Escribir una reseña | Unds. | Search engine powered by | ElasticSuite,Aprende más > 900 ML,0.89,,,Desconocido,unknown,UNKNOWN,El almacenamiento local parece estar deshabilitado en tu navegador.,Aprende,,900 ML,0.89,,$,"$0,89",0.89,False,original,0.89,0.89,1.0,default_1usd,,,,,,Leche semidescremada | 100% leche | No necesita refrigeración | 90 días de duración | Con vitaminas A y D | Contenido: 900ml | Detalles del producto | Reseñas | Escribir Su propia reseña | Estás revisando: LECHE SINIDESCREMADA ANDILAC 900 ML UHT | Su valoración | Rating | 1 stars | 2 stars | 3 stars | 4 stars | 5 stars | Apodo | Resumen | Reseña | Escribir una reseña | Unds. | Search engine powered by | ElasticSuite,,"{""Detalles"": [""Leche semidescremada"", ""100% leche"", ""No necesita refrigeración"", ""90 días de duración"", ""Con vitaminas A y D"", ""Contenido: 900ml"", ""Detalles del producto"", ""Reseñas"", ""Escribir Su propia reseña"", ""Estás revisando: LECHE SINIDESCREMADA ANDILAC 900 ML UHT"", ""Su valoración"", ""Rating"", ""1 star"", ""2 stars"", ""3 stars"", ""4 stars"", ""5 stars"", ""Apodo"", ""Resumen"", ""Reseña"", ""Escribir una reseña"", ""Unds."", ""Search engine powered by"", ""ElasticSuite""]}",dataset/txt_limpios/1319.txt,dataset/paginas_descargadas/1319.html,ET,leche,keep,0.60,heuristic_default
1320,El almacenamiento local parece estar deshabilitado en tu navegador.,Cerveza bastante refrescante | Se recomienda tomar bien fría | Porcentaje de alcohol: 5.1% | Color dorado | País de origen Italia | Incluye 6 Cervezas | Contenido: 330ml c/u | Detalles del producto | Reseñas | Escribir Su propia reseña | Estás revisando: CERVEZA PERONI NASTRO AZZURRO 330ML | Su valoración | 1 stars | 2 stars | 3 stars | 4 stars | 5 stars | Apodo | Resumen | Reseña | Escribir una reseña | Unds. | Search engine powered by | ElasticSuite,Aprende más > 330ML,2.2,,,Desconocido,unknown,UNKNOWN,El almacenamiento local parece estar deshabilitado en tu navegador.,Aprende,,330ML,2.20,,$,"$2,20",2.2,False,original,2.2,2.2,1.0,default_1usd,,,,,,Cerveza bastante refrescante | Se recomienda tomar bien fría | Porcentaje de alcohol: 5.1% | Color dorado | País de origen Italia | Incluye 6 Cervezas | Contenido: 330ml c/u | Detalles del producto | Reseñas | Escribir Su propia reseña | Estás revisando: CERVEZA PERONI NASTRO AZZURRO 330ML | Su valoración | 1 stars | 2 stars | 3 stars | 4 stars | 5 stars | Apodo | Resumen | Reseña | Escribir una reseña | Unds. | Search engine powered by | ElasticSuite,,"{""Detalles"": [""Cerveza bastante refrescante"", ""Si recomienda tomar bien fría"", ""Porcentaje de alcohol: 5.1%"", ""Color dorado"", ""País de origen Italia"", ""Incluye 6 Cervezas"", ""Contenido: 330ml c/u"", ""Detalles del producto"", ""Reseñas"", ""Escribir Su propia reseña"", ""Estás revisando: CERVEZA PERONI NASTRO AZZURRO 330ML"", ""Su valoración"", ""Rating"", ""1 star"", ""2 stars"", ""3 stars"", ""4 stars"", ""5 stars"", ""Apodo"", ""Resumen"", ""Reseña"", ""Escribir una reseña"", ""Unds."", ""Search engine powered by"", ""ElasticSuite""]}",dataset/txt_limpios/1320.txt,dataset/paginas_descargadas/1320.html,ET,cerveza,keep,0.60,heuristic_default
1321,El almacenamiento local parece estar deshabilitado en tu navegador.,,Aprende más > 500ML,3.23,,,Desconocido,unknown,UNKNOWN,El almacenamiento local parece estar deshabilitado en tu navegador.,Aprende,,500ML,3.23,,$,"$3,23",3.23,False,original,3.23,3.23,1.0,default_1usd,,,,,,,,{},dataset/txt_limpios/1321.txt,dataset/paginas_descargadas/1321.html,ET,sin_categoria,discard,0.30,no_category_detected
1322,El almacenamiento local parece estar deshabilitado en tu navegador.,Presentación en lata | Incluye 6 cervezas | Contenido: 355ml c/u | Detalles del producto | Reseñas | Escribir Su propia reseña | Estás revisando: CERVEZA SIX PACK EN LATA HEINEKEN 355ML/4590 | Su valoración | Rating | 1 stars | 2 stars | 3 stars | 4 stars | 5 stars | Apodo | Resumen | Reseña | Escribir una reseña | Unds. | Search engine powered by | ElasticSuite,Aprende más > 355ML,6.98,,,Desconocido,unknown,UNKNOWN,El almacenamiento local parece estar deshabilitado en tu navegador.,Aprende,,355ML,6.98,,$,"$6,98",6.98,False,original,6.98,6.98,1.0,default_1usd,,,,,,Presentación en lata | Incluye 6 cervezas | Contenido: 355ml c/u | Detalles del producto | Reseñas | Escribir Su propia reseña | Estás revisando: CERVEZA SIX PACK EN LATA HEINEKEN 355ML/4590 | Su valoración | Rating | 1 stars | 2 stars | 3 stars | 4 stars | 5 stars | Apodo | Resumen | Reseña | Escribir una reseña | Unds. | Search engine powered by | ElasticSuite,,"{""Detalles"": [""Presentación en lata"", ""Incluye 6 cervezas"", ""Contenido: 355ml c/u"", ""Detalles del producto"", ""Reseñas"", ""Escribir Su propia reseña"", ""Estás revisando: CERVEZA SIX PACK EN LATA HEINEKEN 355ML/4590"", ""Su valoración"", ""Rating"", ""1 star"", ""2 stars"", ""3 stars"", ""4 stars"", ""5 stars"", ""Apodo"", ""Resumen"", ""Reseña"", ""Escribir una reseña"", ""Unds."", ""Search engine powered by"", ""ElasticSuite""]}",dataset/txt_limpios/1322.txt,dataset/paginas_descargadas/1322.html,ET,cerveza,keep,0.60,heuristic_default
1324,El almacenamiento local parece estar deshabilitado en tu navegador.,Pura malta | Refrescante sabor | Incluye 6 Cervezas | Contenido: 355ml c/u | Detalles del producto | Reseñas | Escribir Su propia reseña | Estás revisando: CERVEZA PURA MALTA SIX PACK AMSTEL LAGER/4595 | Su valoración | 1 stars | 2 stars | 3 stars | 4 stars | Apodo | Resumen | Reseña | Escribir una reseña | Unds. | Search engine powered by | ElasticSuite,Aprende más > 355ml,5.81,,,Desconocido,unknown,UNKNOWN,El almacenamiento local parece estar deshabilitado en tu navegador.,Aprende,,355ml,5.81,,$,"$5,81",5.81,False,original,5.81,5.81,1.0,default_1usd,,,,,,Pura malta | Refrescante sabor | Incluye 6 Cervezas | Contenido: 355ml c/u | Detalles del producto | Reseñas | Escribir Su propia reseña | Estás revisando: CERVEZA PURA MALTA SIX PACK AMSTEL LAGER/4595 | Su valoración | 1 stars | 2 stars | 3 stars | 4 stars | Apodo | Resumen | Reseña | Escribir una reseña | Unds. | Search engine powered by | ElasticSuite,,"{""Detalles"": [""Pura malta"", ""Refrescante sabor"", ""Incluye 6 Cervezas"", ""Contenido: 355ml c/u"", ""Detalles del producto"", ""Reseñas"", ""Escribir Su propia reseña"", ""Estás revisando: CERVEZA PURA MALTA SIX PACK AMSTEL LAGER/4595"", ""Su valoración"", ""Rating"", ""1 star"", ""2 stars"", ""3 stars"", ""4 stars"", ""5 stars"", ""Apodo"", ""Resumen"", ""Reseña"", ""Escribir una reseña"", ""Unds."", ""Search engine powered by"", ""ElasticSuite""]}",dataset/txt_limpios/1324.txt,dataset/paginas_descargadas/1324.html,ET,cerveza,keep,0.60,heuristic_default
1325,El almacenamiento local parece estar deshabilitado en tu navegador.,Reseñas Escribir Su propia reseña Estás revisando: PAN DE MOLDE BLANCO 550GR 20 REBANADAS3 Su valoración Rating 1 star 2 stars 3 stars 4 stars 5 stars Apodo Resumen Reseña Escribir una reseña Unds. Search engine powered by ElasticSuite,Aprende más > 550GR,1.21,,,Desconocido,unknown,UNKNOWN,El almacenamiento local parece estar deshabilitado en tu navegador.,Aprende,,550GR,1.21,,$,"$1,21",1.21,False,original,1.21,1.21,1.0,default_1usd,Reseñas Escribir Su propia reseña Estás revisando: PAN DE MOLDE BLANCO 550GR 20 REBANADAS3 Su valoración Rating 1 star 2 stars 3 stars 4 stars 5 stars Apodo Resumen Reseña Escribir una reseña Unds. Search engine powered by ElasticSuite,,,,,,,"{""Información"": [""Reseñas"", ""Escribir Su propia reseña"", ""Estás revisando: PAN DE MOLDE BLANCO 550GR 20 REBANADAS3"", ""Su valoración"", ""Rating"", ""1 star"", ""2 stars"", ""3 stars"", ""4 stars"", ""5 stars"", ""Apodo"", ""Resumen"", ""Reseña"", ""Escribir una reseña"", ""Unds."", ""Search engine powered by"", ""ElasticSuite""]}",dataset/txt_limpios/1325.txt,dataset/paginas_descargadas/1325.html,ET,pan,keep,0.60,heuristic_default
1326,El almacenamiento local parece estar deshabilitado en tu navegador.,Pan de horno tipo artesanal. | Blanco. | Con rueda ancha y sabor delicioso. | Elaborado con Harina de trigo fortificada y Leche. | Contenido: 560g. | Detalles del producto | Reseñas | Escribir Su propia reseña | Estás revisando: PAN DE HORNO BLANCO ARTESANAL MODERNA 56 | Su valoración | 1 stars | 2 stars | 3 stars | 4 stars | 5 stars | Apodo | Resumen | Reseña | Escribir una reseña | Unds. | Search engine powered by | ElasticSuite,Aprende más > 560g,2.12,,,Desconocido,unknown,UNKNOWN,El almacenamiento local parece estar deshabilitado en tu navegador.,Aprende,,560g,2.12,,$,"$2,12",2.12,False,original,2.12,2.12,1.0,default_1usd,,,,,,Pan de horno tipo artesanal. | Blanco. | Con rueda ancha y sabor delicioso. | Elaborado con Harina de trigo fortificada y Leche. | Contenido: 560g. | Detalles del producto | Reseñas | Escribir Su propia reseña | Estás revisando: PAN DE HORNO BLANCO ARTESANAL MODERNA 56 | Su valoración | 1 stars | 2 stars | 3 stars | 4 stars | 5 stars | Apodo | Resumen | Reseña | Escribir una reseña | Unds. | Search engine powered by | ElasticSuite,,"{""Detalles"": [""Pan de horno tipo artesanal."", ""Blanco."", ""Con rueda ancha y sabor delicioso."", ""Elaborado con Harina de trigo fortificada y Leche."", ""Contenido: 560g."", ""Detalles del producto"", ""Reseñas"", ""Escribir Su propia reseña"", ""Estás revisando: PAN DE HORNO BLANCO ARTESANAL MODERNA 56"", ""Su valoración"", ""Rating"", ""1 star"", ""2 stars"", ""3 stars"", ""4 stars"", ""5 stars"", ""Apodo"", ""Resumen"", ""Reseña"", ""Escribir una reseña"", ""Unds."", ""Search engine powered by"", ""ElasticSuite""]}",dataset/txt_limpios/1326.txt,dataset/paginas_descargadas/1326.html,ET,harina de trigo,keep,0.60,heuristic_default
1327,El almacenamiento local parece estar deshabilitado en tu navegador.,Pan brioché conleche y huevo | Libre de saboresartificiales | 18 rebanadas | Contenido:580g | Detalles del producto | Reseñas | Escribir Su propia reseña | Estás revisando: Pan Molde Supan Brioché | 580g | Su valoración | Rating | 1 stars | 2 stars | 3 stars | 4 stars | Apodo | Resumen | Reseña | Escribir una reseña | Unds. | Search engine powered by | ElasticSuite,Aprende más > 580g,3.08,,,Desconocido,unknown,UNKNOWN,El almacenamiento local parece estar deshabilitado en tu navegador.,Aprende,,580g,3.08,,$,"$3,08",3.08,False,original,3.08,3.08,1.0,default_1usd,,,,,,Pan brioché conleche y huevo | Libre de saboresartificiales | 18 rebanadas | Contenido:580g | Detalles del producto | Reseñas | Escribir Su propia reseña | Estás revisando: Pan Molde Supan Brioché | 580g | Su valoración | Rating | 1 stars | 2 stars | 3 stars | 4 stars | Apodo | Resumen | Reseña | Escribir una reseña | Unds. | Search engine powered by | ElasticSuite,,"{""Detalles"": [""Pan brioché conleche y huevo"", ""Libre de saboresartificiales"", ""18 rebanadas"", ""Contenido:580g"", ""Detalles del producto"", ""Reseñas"", ""Escribir Su propia reseña"", ""Estás revisando: Pan Molde Supan Brioché | 580g"", ""Su valoración"", ""Rating"", ""1 star"", ""2 stars"", ""3 stars"", ""4 stars"", ""5 stars"", ""Apodo"", ""Resumen"", ""Reseña"", ""Escribir una reseña"", ""Unds."", ""Search engine powered by"", ""ElasticSuite""]}",dataset/txt_limpios/1327.txt,dataset/paginas_descargadas/1327.html,ET,pan,keep,0.60,heuristic_default
1328,El almacenamiento local parece estar deshabilitado en tu navegador.,"Tropical marca de refrescos ecuatorianos | Es el refresco de toda la vida en Ecuador | Con más de 60 años, suelo los buenos sabores duran tanto | Tropical marca de refrescos que han llegado a Europa desde Ecuador | Refresco de color rojo y sabor dulce | Contenido: 3.78 L | Detalles del producto | Reseñas | Escribir Su propia reseña | Estás revisando: Cola Tropical Fresa 3785Ml | Su valoración | Rating | 1 stars | 2 stars | 3 stars | 4 stars | 5 stars | Apodo | Resumen | Reseña | Escribir una reseña | Unds. | Search engine powered by | ElasticSuite",Aprende más > 3785Ml,1.97,,,Desconocido,unknown,UNKNOWN,El almacenamiento local parece estar deshabilitado en tu navegador.,Aprende,,3785Ml,1.97,,$,"$1,97",1.97,False,original,1.97,1.97,1.0,default_1usd,,,,,,"Tropical marca de refrescos ecuatorianos | Es el refresco de toda la vida en Ecuador | Con más de 60 años, suelo los buenos sabores duran tanto | Tropical marca de refrescos que han llegado a Europa desde Ecuador | Refresco de color rojo y sabor dulce | Contenido: 3.78 L | Detalles del producto | Reseñas | Escribir Su propia reseña | Estás revisando: Cola Tropical Fresa 3785Ml | Su valoración | Rating | 1 stars | 2 stars | 3 stars | 4 stars | 5 stars | Apodo | Resumen | Reseña | Escribir una reseña | Unds. | Search engine powered by | ElasticSuite",,"{""Detalles"": [""Tropical marca de refrescos ecuatorianos"", ""Es el refresco de toda la vida  en Ecuador"", ""Con más de 60 años, suelo los buenos sabores duran tanto"", ""Tropical marca de refrescos que han llegado a Europa desde Ecuador"", ""Refresco de color rojo y sabor dulce"", ""Contenido: 3.78 L"", ""Detalles del producto"", ""Reseñas"", ""Escribir Su propia reseña"", ""Estás revisando: Cola Tropical Fresa 3785Ml"", ""Su valoración"", ""Rating"", ""1 star"", ""2 stars"", ""3 stars"", ""4 stars"", ""5 stars"", ""Apodo"", ""Resumen"", ""Reseña"", ""Escribir una reseña"", ""Unds."", ""Search engine powered by"", ""ElasticSuite""]}",dataset/txt_limpios/1328.txt,dataset/paginas_descargadas/1328.html,ET,sin_categoria,discard,0.30,no_category_detected
1329,El almacenamiento local parece estar deshabilitado en tu navegador.,"Tropical marca de refrescos ecuatorianos | Es el refresco de toda la vida en Ecuador | Con más de 60 años, suelo los buenos sabores duran tanto | Tropical marca de refrescos que han llegado a Europa desde Ecuador | Refresco de color rojo y sabor dulce | Contenido: 3.78 L | Detalles del producto | Reseñas | Escribir Su propia reseña | Estás revisando: Cola Tropical Fresa 3785Ml | Su valoración | Rating | 1 stars | 2 stars | 3 stars | 4 stars | 5 stars | Apodo | Resumen | Reseña | Escribir una reseña | Unds. | Search engine powered by | ElasticSuite",Aprende más > 3785Ml,1.97,,,Desconocido,unknown,UNKNOWN,El almacenamiento local parece estar deshabilitado en tu navegador.,Aprende,,3785Ml,1.97,,$,"$1,97",1.97,False,original,1.97,1.97,1.0,default_1usd,,,,,,"Tropical marca de refrescos ecuatorianos | Es el refresco de toda la vida en Ecuador | Con más de 60 años, suelo los buenos sabores duran tanto | Tropical marca de refrescos que han llegado a Europa desde Ecuador | Refresco de color rojo y sabor dulce | Contenido: 3.78 L | Detalles del producto | Reseñas | Escribir Su propia reseña | Estás revisando: Cola Tropical Fresa 3785Ml | Su valoración | Rating | 1 stars | 2 stars | 3 stars | 4 stars | 5 stars | Apodo | Resumen | Reseña | Escribir una reseña | Unds. | Search engine powered by | ElasticSuite",,"{""Detalles"": [""Tropical marca de refrescos ecuatorianos"", ""Es el refresco de toda la vida  en Ecuador"", ""Con más de 60 años, suelo los buenos sabores duran tanto"", ""Tropical marca de refrescos que han llegado a Europa desde Ecuador"", ""Refresco de color rojo y sabor dulce"", ""Contenido: 3.78 L"", ""Detalles del producto"", ""Reseñas"", ""Escribir Su propia reseña"", ""Estás revisando: Cola Tropical Fresa 3785Ml"", ""Su valoración"", ""Rating"", ""1 star"", ""2 stars"", ""3 stars"", ""4 stars"", ""5 stars"", ""Apodo"", ""Resumen"", ""Reseña"", ""Escribir una reseña"", ""Unds."", ""Search engine powered by"", ""ElasticSuite""]}",dataset/txt_limpios/1329.txt,dataset/paginas_descargadas/1329.html,ET,sin_categoria,discard,0.30,no_category_detected
