source_id,title,description,breadcrumbs,price_raw,currency_raw,url,seller,availability,country,product_name,brand,reference,unit,price_amount,price_currency,price_symbol,price_text,price_amount_filled,price_is_imputed,price_imputation_source,price_amount_usd,price_amount_usd_filled,fx_rate_local_per_usd,fx_source,information_text,description_text,features_text,specifications_text,benefits_text,details_text,other_sections,sections,txt_path,html_path,es_status,category_canonical,decision,match_score,reasons
728,Selecciona tu,"+ | Especificaciones técnicas | Propiedad | Especificación | Complementa tu elección | Naranja Olimpica 2,5 Kg | 2500 Gramos | 19 | 7 | 7.980 | Aguacate Hass | 8 | 8.980 | Granadilla X Und | 9 | 900 | Mango Azúcar | 10 | 49 | 490 | Guatila X Und | 48 | 5.480 | Poderosa | Kit La Poderosa Recicla 65x90 Cm X3 Rollos | 3 Unidades | 830 | 14 | Ver más | Bocadillo | BANANO BOCADILLO | Fruta | Ofertas en celulares nuevos | Artículos para hogar | Comentarios | ☆ | 0 | (0 comentarios) | Por favor, inicia sesión para escribir un comentario. | Más reciente | Ordenar por: Más reciente | Más antiguo | Calificación más alta | Calificación más baja | Todos | Filtrar por: Todos | 1 estrella | 2 estrellas | 3 estrellas | 4 estrellas | 5 estrellas | No hay comentarios. | Términos más buscados | 1. | celulares | 2. | neveras | 3. | iphone | 4. | lavadora | 5. | aire | 6. | televisores | 7. | estufa | 8. | colchon | 9. | cafe | 10. | nevera | Evalúanos",Método de envío > 1000 Gramos,,COP,,Desconocido,unknown,CO,Selecciona tu,Método de envío,,1000 Gramos,,COP,,,97.32,True,category_country_mean,,0.024,4047.0,from_colombia_cambio_dolar,,,,"+ | Especificaciones técnicas | Propiedad | Especificación | Complementa tu elección | Naranja Olimpica 2,5 Kg | 2500 Gramos | 19 | 7 | 7.980 | Aguacate Hass | 8 | 8.980 | Granadilla X Und | 9 | 900 | Mango Azúcar | 10 | 49 | 490 | Guatila X Und | 48 | 5.480 | Poderosa | Kit La Poderosa Recicla 65x90 Cm X3 Rollos | 3 Unidades | 830 | 14 | Ver más | Bocadillo | BANANO BOCADILLO | Fruta | Ofertas en celulares nuevos | Artículos para hogar | Comentarios | ☆ | 0 | (0 comentarios) | Por favor, inicia sesión para escribir un comentario. | Más reciente | Ordenar por: Más reciente | Más antiguo | Calificación más alta | Calificación más baja | Todos | Filtrar por: Todos | 1 estrella | 2 estrellas | 3 estrellas | 4 estrellas | 5 estrellas | No hay comentarios. | Términos más buscados | 1. | celulares | 2. | neveras | 3. | iphone | 4. | lavadora | 5. | aire | 6. | televisores | 7. | estufa | 8. | colchon | 9. | cafe | 10. | nevera | Evalúanos",,,,"{""Especificaciones"": [""+"", ""Especificaciones técnicas"", ""Propiedad"", ""Especificación"", ""Complementa tu elección"", ""Naranja Olimpica 2,5 Kg"", ""2500 Gramos"", ""19"", ""7"", ""7.980"", ""Aguacate Hass"", ""8"", ""8.980"", ""Granadilla X Und"", ""9"", ""900"", ""Mango Azúcar"", ""10"", ""49"", ""490"", ""Guatila X Und"", ""48"", ""5.480"", ""Poderosa"", ""Kit La Poderosa Recicla 65x90 Cm X3 Rollos"", ""3 Unidades"", ""830"", ""14"", ""Ver más"", ""Bocadillo"", ""BANANO BOCADILLO"", ""Fruta"", ""Ofertas en celulares nuevos"", ""Artículos para hogar"", ""Comentarios"", ""☆"", ""0"", ""(0 comentarios)"", ""Por favor, inicia sesión para escribir un comentario."", ""Más reciente"", ""Ordenar por: Más reciente"", ""Más antiguo"", ""Calificación más alta"", ""Calificación más baja"", ""Todos"", ""Filtrar por: Todos"", ""1 estrella"", ""2 estrellas"", ""3 estrellas"", ""4 estrellas"", ""5 estrellas"", ""No hay comentarios."", ""Términos más buscados"", ""1."", ""celulares"", ""2."", ""neveras"", ""3."", ""iphone"", ""4."", ""lavadora"", ""5."", ""aire"", ""6."", ""televisores"", ""7."", ""estufa"", ""8."", ""colchon"", ""9."", ""cafe"", ""10."", ""nevera"", ""Evalúanos""]}",dataset/txt_limpios/728.txt,dataset/paginas_descargadas/728.html,EN,cafe,discard,0.60,price_parse_failed;price<=0
729,Selecciona tu,"+ | Especificaciones técnicas | Propiedad | Especificación | Comentarios | ☆ | 0 Calificación promedio | (0 comentarios) | Por favor, inicia sesión para escribir un comentario. | Más reciente | Ordenar por: Más reciente | Más antiguo | Calificación más alta | Calificación más baja | Todos | Filtrar por: Todos | 1 estrella | 2 estrellas | 3 estrellas | 4 estrellas | 5 estrellas | No hay comentarios. | Evalúanos",Método de envío,,COP,,Desconocido,unknown,CO,Selecciona tu,Método de envío,,,,COP,,,100.78,True,country_mean,,0.0249,4047.0,from_colombia_cambio_dolar,,,,"+ | Especificaciones técnicas | Propiedad | Especificación | Comentarios | ☆ | 0 Calificación promedio | (0 comentarios) | Por favor, inicia sesión para escribir un comentario. | Más reciente | Ordenar por: Más reciente | Más antiguo | Calificación más alta | Calificación más baja | Todos | Filtrar por: Todos | 1 estrella | 2 estrellas | 3 estrellas | 4 estrellas | 5 estrellas | No hay comentarios. | Evalúanos",,,,"{""Especificaciones"": [""+"", ""Especificaciones técnicas"", ""Propiedad"", ""Especificación"", ""Comentarios"", ""☆"", ""0 Calificación promedio"", ""(0 comentarios)"", ""Por favor, inicia sesión para escribir un comentario."", ""Más reciente"", ""Ordenar por: Más reciente"", ""Más antiguo"", ""Calificación más alta"", ""Calificación más baja"", ""Todos"", ""Filtrar por: Todos"", ""1 estrella"", ""2 estrellas"", ""3 estrellas"", ""4 estrellas"", ""5 estrellas"", ""No hay comentarios."", ""Evalúanos""]}",dataset/txt_limpios/729.txt,dataset/paginas_descargadas/729.html,EN,sin_categoria,discard,0.30,no_category_detected;price_parse_failed
730,Selecciona tu,"+ | Especificaciones técnicas | Propiedad | Especificación | Complementa tu elección | Olimpica | Papa Olimpica Pastusa X 2,5 Kg | 2500 Gramos | 56 | 8 | 900 | 8.900 | Papa Criolla Kg | 9 | 9.980 | Brócoli | 15 | Pepino Cohombro | La Granjita | Cebolla Junca 250 G | 250 Gramos | 17 | 92 | 4 | 4.480 | Pimentón Verde | 8.980 | Ver más | verdura | Blanca | Cebolla blanca | Cebolla Cabezona Blanca x 1 kg | Comentarios | ☆ | 0 | (0 comentarios) | Por favor, inicia sesión para escribir un comentario. | Más reciente | Ordenar por: Más reciente | Más antiguo | Calificación más alta | Calificación más baja | Todos | Filtrar por: Todos | 1 estrella | 2 estrellas | 3 estrellas | 4 estrellas | 5 estrellas | No hay comentarios. | Términos más buscados | 1. | celulares | 2. | neveras | 3. | iphone | 4. | lavadora | 5. | aire | 6. | televisores | 7. | estufa | 8. | colchon | 9. | cafe | 10. | nevera | Evalúanos",Método de envío > 1000 Gramos,,COP,,Desconocido,unknown,CO,Selecciona tu,Método de envío,,1000 Gramos,,COP,,,2755946.3,True,category_mean,,680.985,4047.0,from_colombia_cambio_dolar,,,,"+ | Especificaciones técnicas | Propiedad | Especificación | Complementa tu elección | Olimpica | Papa Olimpica Pastusa X 2,5 Kg | 2500 Gramos | 56 | 8 | 900 | 8.900 | Papa Criolla Kg | 9 | 9.980 | Brócoli | 15 | Pepino Cohombro | La Granjita | Cebolla Junca 250 G | 250 Gramos | 17 | 92 | 4 | 4.480 | Pimentón Verde | 8.980 | Ver más | verdura | Blanca | Cebolla blanca | Cebolla Cabezona Blanca x 1 kg | Comentarios | ☆ | 0 | (0 comentarios) | Por favor, inicia sesión para escribir un comentario. | Más reciente | Ordenar por: Más reciente | Más antiguo | Calificación más alta | Calificación más baja | Todos | Filtrar por: Todos | 1 estrella | 2 estrellas | 3 estrellas | 4 estrellas | 5 estrellas | No hay comentarios. | Términos más buscados | 1. | celulares | 2. | neveras | 3. | iphone | 4. | lavadora | 5. | aire | 6. | televisores | 7. | estufa | 8. | colchon | 9. | cafe | 10. | nevera | Evalúanos",,,,"{""Especificaciones"": [""+"", ""Especificaciones técnicas"", ""Propiedad"", ""Especificación"", ""Complementa tu elección"", ""Olimpica"", ""Papa Olimpica Pastusa X 2,5 Kg"", ""2500 Gramos"", ""56"", ""8"", ""900"", ""8.900"", ""Papa Criolla Kg"", ""9"", ""9.980"", ""Brócoli"", ""15"", ""Pepino Cohombro"", ""La Granjita"", ""Cebolla Junca 250 G"", ""250 Gramos"", ""17"", ""92"", ""4"", ""4.480"", ""Pimentón Verde"", ""8.980"", ""Ver más"", ""verdura"", ""Blanca"", ""Cebolla blanca"", ""Cebolla Cabezona Blanca x 1 kg"", ""Comentarios"", ""☆"", ""0"", ""(0 comentarios)"", ""Por favor, inicia sesión para escribir un comentario."", ""Más reciente"", ""Ordenar por: Más reciente"", ""Más antiguo"", ""Calificación más alta"", ""Calificación más baja"", ""Todos"", ""Filtrar por: Todos"", ""1 estrella"", ""2 estrellas"", ""3 estrellas"", ""4 estrellas"", ""5 estrellas"", ""No hay comentarios."", ""Términos más buscados"", ""1."", ""celulares"", ""2."", ""neveras"", ""3."", ""iphone"", ""4."", ""lavadora"", ""5."", ""aire"", ""6."", ""televisores"", ""7."", ""estufa"", ""8."", ""colchon"", ""9."", ""cafe"", ""10."", ""nevera"", ""Evalúanos""]}",dataset/txt_limpios/730.txt,dataset/paginas_descargadas/730.html,EN,cebolla,discard,0.60,price_parse_failed;price<=0
731,Selecciona tu,"+ | Especificaciones técnicas | Propiedad | Especificación | Ver más | Televisor | Ofertas del día | Hp 240 G9 | Aires acondicionados comprar | Ofertas televisores | Licores a domicilio | Comentarios | ☆ | 0 | (0 comentarios) | Por favor, inicia sesión para escribir un comentario. | Más reciente | Ordenar por: Más reciente | Más antiguo | Calificación más alta | Calificación más baja | Todos | Filtrar por: Todos | 1 estrella | 2 estrellas | 3 estrellas | 4 estrellas | 5 estrellas | No hay comentarios. | Términos más buscados | 1. | celulares | 2. | neveras | 3. | iphone | 4. | lavadora | 5. | aire | 6. | televisores | 7. | estufa | 8. | colchon | 9. | cafe | 10. | nevera | Evalúanos",Método de envío > 1 Kg,,COP,,Desconocido,unknown,CO,Selecciona tu,Método de envío,,1 Kg,,COP,,,97.32,True,category_country_mean,,0.024,4047.0,from_colombia_cambio_dolar,,,,"+ | Especificaciones técnicas | Propiedad | Especificación | Ver más | Televisor | Ofertas del día | Hp 240 G9 | Aires acondicionados comprar | Ofertas televisores | Licores a domicilio | Comentarios | ☆ | 0 | (0 comentarios) | Por favor, inicia sesión para escribir un comentario. | Más reciente | Ordenar por: Más reciente | Más antiguo | Calificación más alta | Calificación más baja | Todos | Filtrar por: Todos | 1 estrella | 2 estrellas | 3 estrellas | 4 estrellas | 5 estrellas | No hay comentarios. | Términos más buscados | 1. | celulares | 2. | neveras | 3. | iphone | 4. | lavadora | 5. | aire | 6. | televisores | 7. | estufa | 8. | colchon | 9. | cafe | 10. | nevera | Evalúanos",,,,"{""Especificaciones"": [""+"", ""Especificaciones técnicas"", ""Propiedad"", ""Especificación"", ""Ver más"", ""Televisor"", ""Ofertas del día"", ""Hp 240 G9"", ""Aires acondicionados comprar"", ""Ofertas televisores"", ""Licores a domicilio"", ""Comentarios"", ""☆"", ""0"", ""(0 comentarios)"", ""Por favor, inicia sesión para escribir un comentario."", ""Más reciente"", ""Ordenar por: Más reciente"", ""Más antiguo"", ""Calificación más alta"", ""Calificación más baja"", ""Todos"", ""Filtrar por: Todos"", ""1 estrella"", ""2 estrellas"", ""3 estrellas"", ""4 estrellas"", ""5 estrellas"", ""No hay comentarios."", ""Términos más buscados"", ""1."", ""celulares"", ""2."", ""neveras"", ""3."", ""iphone"", ""4."", ""lavadora"", ""5."", ""aire"", ""6."", ""televisores"", ""7."", ""estufa"", ""8."", ""colchon"", ""9."", ""cafe"", ""10."", ""nevera"", ""Evalúanos""]}",dataset/txt_limpios/731.txt,dataset/paginas_descargadas/731.html,EN,cafe,discard,0.60,price_parse_failed;price<=0
732,Selecciona tu,"+ | Especificaciones técnicas | Propiedad | Especificación | Complementa tu elección | QUNNO | 53 Gramos | 197 | 10 | 450 | Delipavo | Salchicha Delipavo Corriente 250 G | 39 | 900 | 20 | Nube Snuggy | Toalla de Cocina Nube Triple Hoja X120 Unds | 9 | 230 | 384 | Ahorra | 846 | 7.384 | Antes: $ | 9.230 | Vitad | Harina de almendras Vitad 400g | 49 | Salchicha Delipavo Campesina 250 G | 48 | Suva | 24 | 500 | Ver más | Computadores baratos | Artículos para hogar | Tarjeta Mastercard | Televisores | Comprar productos cocina online | Wt75R2500Hb/Co | Comentarios | ☆ | 0 | (0 comentarios) | Por favor, inicia sesión para escribir un comentario. | Más reciente | Ordenar por: Más reciente | Más antiguo | Calificación más alta | Calificación más baja | Todos | Filtrar por: Todos | 1 estrella | 2 estrellas | 3 estrellas | 4 estrellas | 5 estrellas | No hay comentarios. | Términos más buscados | 1. | celulares | 2. | neveras | 3. | iphone | 4. | lavadora | 5. | aire | 6. | 7. | estufa | 8. | colchon | 9. | cafe | 10. | nevera | Evalúanos","Método de envío > 2,5 Kg",53.0,COP,,Desconocido,unknown,CO,Selecciona tu,Método de envío,,"2,5 Kg",53.00,COP,,53,53.0,False,original,0.0131,0.0131,4047.0,from_colombia_cambio_dolar,,,,"+ | Especificaciones técnicas | Propiedad | Especificación | Complementa tu elección | QUNNO | 53 Gramos | 197 | 10 | 450 | Delipavo | Salchicha Delipavo Corriente 250 G | 39 | 900 | 20 | Nube Snuggy | Toalla de Cocina Nube Triple Hoja X120 Unds | 9 | 230 | 384 | Ahorra | 846 | 7.384 | Antes: $ | 9.230 | Vitad | Harina de almendras Vitad 400g | 49 | Salchicha Delipavo Campesina 250 G | 48 | Suva | 24 | 500 | Ver más | Computadores baratos | Artículos para hogar | Tarjeta Mastercard | Televisores | Comprar productos cocina online | Wt75R2500Hb/Co | Comentarios | ☆ | 0 | (0 comentarios) | Por favor, inicia sesión para escribir un comentario. | Más reciente | Ordenar por: Más reciente | Más antiguo | Calificación más alta | Calificación más baja | Todos | Filtrar por: Todos | 1 estrella | 2 estrellas | 3 estrellas | 4 estrellas | 5 estrellas | No hay comentarios. | Términos más buscados | 1. | celulares | 2. | neveras | 3. | iphone | 4. | lavadora | 5. | aire | 6. | 7. | estufa | 8. | colchon | 9. | cafe | 10. | nevera | Evalúanos",,,,"{""Especificaciones"": [""+"", ""Especificaciones técnicas"", ""Propiedad"", ""Especificación"", ""Complementa tu elección"", ""QUNNO"", ""53 Gramos"", ""197"", ""10"", ""450"", ""Delipavo"", ""Salchicha Delipavo Corriente 250 G"", ""39"", ""900"", ""20"", ""Nube Snuggy"", ""Toalla de Cocina Nube Triple Hoja X120 Unds"", ""9"", ""230"", ""384"", ""Ahorra"", ""846"", ""7.384"", ""Antes: $"", ""9.230"", ""Vitad"", ""Harina de almendras Vitad 400g"", ""49"", ""Salchicha Delipavo Campesina 250 G"", ""48"", ""Suva"", ""24"", ""500"", ""Ver más"", ""Computadores baratos"", ""Artículos para hogar"", ""Tarjeta Mastercard"", ""Televisores"", ""Comprar productos cocina online"", ""Wt75R2500Hb/Co"", ""Comentarios"", ""☆"", ""0"", ""(0 comentarios)"", ""Por favor, inicia sesión para escribir un comentario."", ""Más reciente"", ""Ordenar por: Más reciente"", ""Más antiguo"", ""Calificación más alta"", ""Calificación más baja"", ""Todos"", ""Filtrar por: Todos"", ""1 estrella"", ""2 estrellas"", ""3 estrellas"", ""4 estrellas"", ""5 estrellas"", ""No hay comentarios."", ""Términos más buscados"", ""1."", ""celulares"", ""2."", ""neveras"", ""3."", ""iphone"", ""4."", ""lavadora"", ""5."", ""aire"", ""6."", ""7."", ""estufa"", ""8."", ""colchon"", ""9."", ""cafe"", ""10."", ""nevera"", ""Evalúanos""]}",dataset/txt_limpios/732.txt,dataset/paginas_descargadas/732.html,EN,cafe,keep,0.60,heuristic_default
733,Selecciona tu,"+ | Especificaciones técnicas | Propiedad | Especificación | Comentarios | Cargando el resumen… | Por favor, inicia sesión para escribir un comentario. | Más reciente | Ordenar por: Más reciente | Más antiguo | Calificación más alta | Calificación más baja | Todos | Filtrar por: Todos | 1 estrella | 2 estrellas | 3 estrellas | 4 estrellas | 5 estrellas | Evalúanos","Método de envío > 2,5 Kg",,COP,,Desconocido,unknown,CO,Selecciona tu,Método de envío,,"2,5 Kg",,COP,,,100.78,True,country_mean,,0.0249,4047.0,from_colombia_cambio_dolar,,,,"+ | Especificaciones técnicas | Propiedad | Especificación | Comentarios | Cargando el resumen… | Por favor, inicia sesión para escribir un comentario. | Más reciente | Ordenar por: Más reciente | Más antiguo | Calificación más alta | Calificación más baja | Todos | Filtrar por: Todos | 1 estrella | 2 estrellas | 3 estrellas | 4 estrellas | 5 estrellas | Evalúanos",,,,"{""Especificaciones"": [""+"", ""Especificaciones técnicas"", ""Propiedad"", ""Especificación"", ""Comentarios"", ""Cargando el resumen…"", ""Por favor, inicia sesión para escribir un comentario."", ""Más reciente"", ""Ordenar por: Más reciente"", ""Más antiguo"", ""Calificación más alta"", ""Calificación más baja"", ""Todos"", ""Filtrar por: Todos"", ""1 estrella"", ""2 estrellas"", ""3 estrellas"", ""4 estrellas"", ""5 estrellas"", ""Evalúanos""]}",dataset/txt_limpios/733.txt,dataset/paginas_descargadas/733.html,EN,sin_categoria,discard,0.30,no_category_detected;price_parse_failed
734,Selecciona tu,"+ | Especificaciones técnicas | Propiedad | Especificación | Comentarios | Cargando el resumen… | Por favor, inicia sesión para escribir un comentario. | Más reciente | Ordenar por: Más reciente | Más antiguo | Calificación más alta | Calificación más baja | Todos | Filtrar por: Todos | 1 estrella | 2 estrellas | 3 estrellas | 4 estrellas | 5 estrellas | Evalúanos",Método de envío > 1 Kg,,COP,,Desconocido,unknown,CO,Selecciona tu,Método de envío,,1 Kg,,COP,,,100.78,True,country_mean,,0.0249,4047.0,from_colombia_cambio_dolar,,,,"+ | Especificaciones técnicas | Propiedad | Especificación | Comentarios | Cargando el resumen… | Por favor, inicia sesión para escribir un comentario. | Más reciente | Ordenar por: Más reciente | Más antiguo | Calificación más alta | Calificación más baja | Todos | Filtrar por: Todos | 1 estrella | 2 estrellas | 3 estrellas | 4 estrellas | 5 estrellas | Evalúanos",,,,"{""Especificaciones"": [""+"", ""Especificaciones técnicas"", ""Propiedad"", ""Especificación"", ""Comentarios"", ""Cargando el resumen…"", ""Por favor, inicia sesión para escribir un comentario."", ""Más reciente"", ""Ordenar por: Más reciente"", ""Más antiguo"", ""Calificación más alta"", ""Calificación más baja"", ""Todos"", ""Filtrar por: Todos"", ""1 estrella"", ""2 estrellas"", ""3 estrellas"", ""4 estrellas"", ""5 estrellas"", ""Evalúanos""]}",dataset/txt_limpios/734.txt,dataset/paginas_descargadas/734.html,EN,sin_categoria,discard,0.30,no_category_detected;price_parse_failed
735,Selecciona tu,"+ | Especificaciones técnicas | Propiedad | Especificación | Complementa tu elección | La Giralda | Pulpa La Giralda Mora Congelada 200 G | 3 | 200 | 3.200 | Pulpa La Giralda Fresa Congelada 200 G | Piko Riko | Hambuguesa de Pollo Piko Riko 500 G X6 Unds | 090 | Kari | PAPEL KARI BAKING 30m | 580 | SUNSHINE | CEREAL SUNSHINE MASMEL SUPER STARS 280G | 15 | P&I | Condimento P&I Ajo Picado en Aceite 220 G | Ver más | Medalla | verdura | Gastronomía de Francia | Vegetales | Wt75R2500Hb/Co | Descuentos tecnología | Comprar televisores en oferta | Comentarios | ☆ | 0 | (0 comentarios) | Por favor, inicia sesión para escribir un comentario. | Más reciente | Ordenar por: Más reciente | Más antiguo | Calificación más alta | Calificación más baja | Todos | Filtrar por: Todos | 1 estrella | 2 estrellas | 3 estrellas | 4 estrellas | 5 estrellas | No hay comentarios. | Términos más buscados | 1. | celulares | 2. | neveras | 3. | iphone | 4. | lavadora | 5. | aire | 6. | televisores | 7. | estufa | 8. | colchon | 9. | cafe | 10. | nevera | Evalúanos",Método de envío > 1000 G,,COP,,Desconocido,unknown,CO,Selecciona tu,Método de envío,,1000 G,,COP,,,97.32,True,category_country_mean,,0.024,4047.0,from_colombia_cambio_dolar,,,,"+ | Especificaciones técnicas | Propiedad | Especificación | Complementa tu elección | La Giralda | Pulpa La Giralda Mora Congelada 200 G | 3 | 200 | 3.200 | Pulpa La Giralda Fresa Congelada 200 G | Piko Riko | Hambuguesa de Pollo Piko Riko 500 G X6 Unds | 090 | Kari | PAPEL KARI BAKING 30m | 580 | SUNSHINE | CEREAL SUNSHINE MASMEL SUPER STARS 280G | 15 | P&I | Condimento P&I Ajo Picado en Aceite 220 G | Ver más | Medalla | verdura | Gastronomía de Francia | Vegetales | Wt75R2500Hb/Co | Descuentos tecnología | Comprar televisores en oferta | Comentarios | ☆ | 0 | (0 comentarios) | Por favor, inicia sesión para escribir un comentario. | Más reciente | Ordenar por: Más reciente | Más antiguo | Calificación más alta | Calificación más baja | Todos | Filtrar por: Todos | 1 estrella | 2 estrellas | 3 estrellas | 4 estrellas | 5 estrellas | No hay comentarios. | Términos más buscados | 1. | celulares | 2. | neveras | 3. | iphone | 4. | lavadora | 5. | aire | 6. | televisores | 7. | estufa | 8. | colchon | 9. | cafe | 10. | nevera | Evalúanos",,,,"{""Especificaciones"": [""+"", ""Especificaciones técnicas"", ""Propiedad"", ""Especificación"", ""Complementa tu elección"", ""La Giralda"", ""Pulpa La Giralda Mora Congelada 200 G"", ""3"", ""200"", ""3.200"", ""Pulpa La Giralda Fresa Congelada 200 G"", ""Piko Riko"", ""Hambuguesa de Pollo Piko Riko 500 G X6 Unds"", ""090"", ""Kari"", ""PAPEL KARI BAKING 30m"", ""580"", ""SUNSHINE"", ""CEREAL SUNSHINE MASMEL SUPER STARS 280G"", ""15"", ""P&I"", ""Condimento P&I Ajo Picado en Aceite 220 G"", ""Ver más"", ""Medalla"", ""verdura"", ""Gastronomía de Francia"", ""Vegetales"", ""Wt75R2500Hb/Co"", ""Descuentos tecnología"", ""Comprar televisores en oferta"", ""Comentarios"", ""☆"", ""0"", ""(0 comentarios)"", ""Por favor, inicia sesión para escribir un comentario."", ""Más reciente"", ""Ordenar por: Más reciente"", ""Más antiguo"", ""Calificación más alta"", ""Calificación más baja"", ""Todos"", ""Filtrar por: Todos"", ""1 estrella"", ""2 estrellas"", ""3 estrellas"", ""4 estrellas"", ""5 estrellas"", ""No hay comentarios."", ""Términos más buscados"", ""1."", ""celulares"", ""2."", ""neveras"", ""3."", ""iphone"", ""4."", ""lavadora"", ""5."", ""aire"", ""6."", ""televisores"", ""7."", ""estufa"", ""8."", ""colchon"", ""9."", ""cafe"", ""10."", ""nevera"", ""Evalúanos""]}",dataset/txt_limpios/735.txt,dataset/paginas_descargadas/735.html,EN,cafe,discard,0.60,price_parse_failed;price<=0
