{"source_id": "1747", "title": "Panadería y Pastelería", "description": "Pan de Molde Integral Ideal 580g | Actualizado al: 16-01-2025 Ingredientes: Harina de trigo integral de grano entero, Vitamina d3 vegetal, Harina de trigo, Vitamina d3 vegetal, Agua, Levadura, Gluten, Fibra de soya, Harina de trigo fermentada, Harina de cebada fermentada, Harina de centeno fermentada, Azúcar, Sal, Aceite de maravilla (tocoferoles), Ácido láctico de origen natural, Ácido ascórbico de origen natural, Saborizante natural, Soya. Alérgenos: Gluten, Soya. Trazas: Nuez. Certificados: Libre de Huevo Libre de Peces Libre de Mariscos Libre de Maní Libre de Sulfitos Libre de Lactosa Vegano Vegetariano Kosher Porción: 2 Unidades (50g) Porciones por envase: 12 100g 1 Porción Energía (kCal) 251 125.5 Proteínas (g) 11 5.5 Grasas Totales 3 1.5 Grasas saturadas (g) 0.5 0.3 Grasas monoinsaturadas (g) 0.7 0.4 Grasas poliinsaturadas (g) 1.7 0.9 Grasas trans (g) 0 Colesterol (mg) Hidratos de carbono disponibles 45 22.5 Azúcares totales (g) Fibra 5.8 2.9 Sodio 358 179 Importante: La información del empaque y/o contenido del producto final puede diferir respecto a lo que mostramos en nuestro sitio web, tanto a nivel de ingredientes, trazas, información nutricional, sellos, modo de uso y/o modo de conservación. Usted no debe basarse únicamente en la información que se muestra en nuestro sitio web y siempre debe leer las etiquetas, advertencias e instrucciones antes de usar o consumir un producto. Información obtenida de PAN INTEGRAL 580G IDEAL Productos similares Pan de Molde Artesano Integral Ver producto Pan de Molde Integral Bauducco 390 g Pan de Molde Integral XL Ideal 750 g Pan de Molde Integral XL Pierre 700 g -28% Pan de Molde Blanco Ideal 380 g PAN INTEGRAL CERO CERO 600G IDEAL Pan de Molde Blanco Ideal 580 g Pan Molde Integral Pan Sándwich Pan de Molde Integral Castaño 400 g Pan de Molde Blanco Sin Borde Ideal 400 g Pan de Completo Xl Pan de Molde Integral Grande Pan de Molde Integral Familiar Pan de Molde Multigrano Sin Gluten Tottus 400 g Pan de Molde Integral XL Castaño 700 g Pan de Molde Multigrano Pan de Molde Blanco XL Ideal 750 g -14% ¡Juntos son mejores! Yoghurt Light Sin Azúcar Sabor Chirimoya Queso Fresco sin Lactosa Bolsa Quesillo Fresco Yoghurt Protein+ Sabor Frutilla Soprole 155 g Pack Yoghurt Batido Colun 12 x 125 g -12% Yogur Griego No Endulzado Oikos 150 g", "breadcrumbs": "Panadería > 580 GR", "price_raw": "2.69", "currency_raw": "", "url": "", "seller": "Desconocido", "availability": "unknown", "country": "UNKNOWN", "product_name": "Panadería y Pastelería", "brand": "Panadería", "reference": "", "unit": "580 GR", "price_amount": 2.69, "price_currency": "", "price_symbol": "", "price_text": "2.69", "price_amount_filled": "2.69", "price_is_imputed": "False", "price_imputation_source": "original", "price_amount_usd": "2.69", "price_amount_usd_filled": "2.69", "fx_rate_local_per_usd": "1.0", "fx_source": "default_1usd", "information_text": "", "description_text": "Pan de Molde Integral Ideal 580g | Actualizado al: 16-01-2025 Ingredientes: Harina de trigo integral de grano entero, Vitamina d3 vegetal, Harina de trigo, Vitamina d3 vegetal, Agua, Levadura, Gluten, Fibra de soya, Harina de trigo fermentada, Harina de cebada fermentada, Harina de centeno fermentada, Azúcar, Sal, Aceite de maravilla (tocoferoles), Ácido láctico de origen natural, Ácido ascórbico de origen natural, Saborizante natural, Soya. Alérgenos: Gluten, Soya. Trazas: Nuez. Certificados: Libre de Huevo Libre de Peces Libre de Mariscos Libre de Maní Libre de Sulfitos Libre de Lactosa Vegano Vegetariano Kosher Porción: 2 Unidades (50g) Porciones por envase: 12 100g 1 Porción Energía (kCal) 251 125.5 Proteínas (g) 11 5.5 Grasas Totales 3 1.5 Grasas saturadas (g) 0.5 0.3 Grasas monoinsaturadas (g) 0.7 0.4 Grasas poliinsaturadas (g) 1.7 0.9 Grasas trans (g) 0 Colesterol (mg) Hidratos de carbono disponibles 45 22.5 Azúcares totales (g) Fibra 5.8 2.9 Sodio 358 179 Importante: La información del empaque y/o contenido del producto final puede diferir respecto a lo que mostramos en nuestro sitio web, tanto a nivel de ingredientes, trazas, información nutricional, sellos, modo de uso y/o modo de conservación. Usted no debe basarse únicamente en la información que se muestra en nuestro sitio web y siempre debe leer las etiquetas, advertencias e instrucciones antes de usar o consumir un producto. Información obtenida de PAN INTEGRAL 580G IDEAL Productos similares Pan de Molde Artesano Integral Ver producto Pan de Molde Integral Bauducco 390 g Pan de Molde Integral XL Ideal 750 g Pan de Molde Integral XL Pierre 700 g -28% Pan de Molde Blanco Ideal 380 g PAN INTEGRAL CERO CERO 600G IDEAL Pan de Molde Blanco Ideal 580 g Pan Molde Integral Pan Sándwich Pan de Molde Integral Castaño 400 g Pan de Molde Blanco Sin Borde Ideal 400 g Pan de Completo Xl Pan de Molde Integral Grande Pan de Molde Integral Familiar Pan de Molde Multigrano Sin Gluten Tottus 400 g Pan de Molde Integral XL Castaño 700 g Pan de Molde Multigrano Pan de Molde Blanco XL Ideal 750 g -14% ¡Juntos son mejores! Yoghurt Light Sin Azúcar Sabor Chirimoya Queso Fresco sin Lactosa Bolsa Quesillo Fresco Yoghurt Protein+ Sabor Frutilla Soprole 155 g Pack Yoghurt Batido Colun 12 x 125 g -12% Yogur Griego No Endulzado Oikos 150 g", "features_text": "", "specifications_text": "", "benefits_text": "", "details_text": "", "other_sections": "", "sections": {"Descripción": ["Pan de Molde Integral Ideal", "580g | Actualizado al: 16-01-2025", "Ingredientes: Harina de trigo integral de grano entero, Vitamina d3 vegetal, Harina de trigo, Vitamina d3 vegetal, Agua, Levadura, Gluten, Fibra de soya, Harina de trigo fermentada, Harina de cebada fermentada, Harina de centeno fermentada, Azúcar, Sal, Aceite de maravilla (tocoferoles), Ácido láctico de origen natural, Ácido ascórbico de origen natural, Saborizante natural, Soya.", "Alérgenos: Gluten, Soya.", "Trazas: Nuez.", "Certificados: Libre de Huevo", "Libre de Peces", "Libre de Mariscos", "Libre de Maní", "Libre de Sulfitos", "Libre de Lactosa", "Vegano", "Vegetariano", "Kosher", "Porción: 2 Unidades (50g)", "Porciones por envase: 12", "100g", "1 Porción", "Energía", "(kCal)", "251", "125.5", "Proteínas", "(g)", "11", "5.5", "Grasas Totales", "3", "1.5", "Grasas saturadas (g)", "0.5", "0.3", "Grasas monoinsaturadas (g)", "0.7", "0.4", "Grasas poliinsaturadas (g)", "1.7", "0.9", "Grasas trans (g)", "0", "Colesterol", "(mg)", "Hidratos de carbono disponibles", "45", "22.5", "Azúcar total (g)", "Fibra", "5.8", "2.9", "Sodio", "358", "179", "Importante: La información del empaque y/o contenido del producto final puede diferir respecto a lo que mostramos en nuestro sitio web, tanto a nivel de ingredientes, trazas, información nutricional, sellos, modo de uso y/o modo de conservación. Usted debe basarse únicamente en la información que se muestra en nuestro sitio web y siempre debe leer las etiquetas, advertencias y instrucciones antes de usar el consumo de un producto.", "Información obtenida de", "PAN INTEGRAL 580G IDEAL", "Productos similares", "Pan de Molde Artesano Integral", "Ver producto", "Pan de Molde Integral Bauducco 390 g", "Pan de Molde Integral XL Ideal 750 g", "Pan de Molde Integral XL Pierre 700 g", "-28%", "Pan de Molde Blanco Ideal 380 g", "PAN INTEGRAL CERO CERO 600G IDEAL", "Pan de Molde Blanco Ideal 580 g", "Pan Molde Integral", "Pan Sándwich", "Pan de Molde Integral Castaño 400 g", "Pan de Molde Blanco Sin Borde Ideal 400 g", "Pan de Completo Xl", "Pan de Molde Integral Grande", "Pan de Molde Integral Familiar", "Pan de Molde Multigrano Sin Gluten Tottus 400 g", "Pan de Molde Integral XL Castaño 700 g", "Pan de Molde Multigrano", "Pan de Molde Blanco XL Ideal 750 g", "-14%", "¡Juntos son mejores!", "Yoghurt Light Sin Azúcar Sabor Chirimoya", "Queso Fresco sin Lactosa Bolsa", "Quesillo Fresco", "Yoghurt Protein+ Sabor Frutilla Soprole 155 g", "Pack Yoghurt Batido Colun 12 x 125 g", "-12%", "Yogur Griego No Endulzado Oikos 150 g"]}, "txt_path": "dataset/txt_limpios/1747.txt", "html_path": "dataset/paginas_descargadas/1747.html", "es_status": "ET", "category_canonical": "pan", "decision": "keep", "match_score": 0.6, "reasons": "heuristic_default"}
{"source_id": "1753", "title": "Panadería y Pastelería", "description": "PAN MOLDE BLANCO TOTTUS 580 GRS Productos similares Pan de Molde Blanco XL Castaño 700 g Ver producto Pan Molde Integral Pan de Molde Blanco XL Ideal 750 g -14% Pan de Molde Blanco Ideal 580 g Pan de Molde Blanco XL Pierre 700 g -28% Pan de Hot Dog Blanco Tottus 8 Un 480 g Pan de Molde Integral XL Pierre 700 g Pan Hamburguesa Tipo Brioche Tottus 8 Un 600 g Pan de Molde Blanco Castaño 400 g Pan de Molde Integral Bauducco 390 g Pan de Molde Perfecto Kingsbury 580 g Pan de Molde Integral XL Ideal 750 g Pan de Hot Dog Sin Gluten Tottus 400 g Pan de Molde Blanco Tradicional Bauducco 390 g Pan Molde Blanco Pan de Hamburguesa Sin Gluten Tottus 400 g Pan de Molde Blanco Sin Borde Ideal 400 g ¡Juntos son mejores! Jamón Pierna -26% Jamón Pierna Artesanal Granel KG -22% Jamón Artesanal Pf  a Granel -21% Pack Yoghurt Batido Colun 12 x 125 g -12% Queso Ranco Laminado Granel -16% Jamón Acaramelado Pf a Granel Jamón Colonial Granel -11%", "breadcrumbs": "Panadería > 580 g", "price_raw": "2.59", "currency_raw": "", "url": "", "seller": "Desconocido", "availability": "unknown", "country": "UNKNOWN", "product_name": "Panadería y Pastelería", "brand": "Panadería", "reference": "", "unit": "580 g", "price_amount": 2.59, "price_currency": "", "price_symbol": "", "price_text": "2.59", "price_amount_filled": "2.59", "price_is_imputed": "False", "price_imputation_source": "original", "price_amount_usd": "2.59", "price_amount_usd_filled": "2.59", "fx_rate_local_per_usd": "1.0", "fx_source": "default_1usd", "information_text": "", "description_text": "PAN MOLDE BLANCO TOTTUS 580 GRS Productos similares Pan de Molde Blanco XL Castaño 700 g Ver producto Pan Molde Integral Pan de Molde Blanco XL Ideal 750 g -14% Pan de Molde Blanco Ideal 580 g Pan de Molde Blanco XL Pierre 700 g -28% Pan de Hot Dog Blanco Tottus 8 Un 480 g Pan de Molde Integral XL Pierre 700 g Pan Hamburguesa Tipo Brioche Tottus 8 Un 600 g Pan de Molde Blanco Castaño 400 g Pan de Molde Integral Bauducco 390 g Pan de Molde Perfecto Kingsbury 580 g Pan de Molde Integral XL Ideal 750 g Pan de Hot Dog Sin Gluten Tottus 400 g Pan de Molde Blanco Tradicional Bauducco 390 g Pan Molde Blanco Pan de Hamburguesa Sin Gluten Tottus 400 g Pan de Molde Blanco Sin Borde Ideal 400 g ¡Juntos son mejores! Jamón Pierna -26% Jamón Pierna Artesanal Granel KG -22% Jamón Artesanal Pf  a Granel -21% Pack Yoghurt Batido Colun 12 x 125 g -12% Queso Ranco Laminado Granel -16% Jamón Acaramelado Pf a Granel Jamón Colonial Granel -11%", "features_text": "", "specifications_text": "", "benefits_text": "", "details_text": "", "other_sections": "", "sections": {"Descripción": ["PAN MOLDE BLANCO TOTTUS 580 GRS", "Productos similares", "Pan de Molde Blanco XL Castaño 700 g", "Ver producto", "Pan Molde Integral", "Pan de Molde Blanco XL Ideal 750 g", "-14%", "Pan de Molde Blanco Ideal 580 g", "Pan de Molde Blanco XL Pierre 700 g", "-28%", "Pan de Hot Dog Blanco Tottus 8 Un 480 g", "Pan de Molde Integral XL Pierre 700 g", "Pan Hamburguesa Tipo Brioche Tottus 8 Un 600 g", "Pan de Molde Blanco Castaño 400 g", "Pan de Molde Integral Bauducco 390 g", "Pan de Molde Perfecto Kingsbury 580 g", "Pan de Molde Integral XL Ideal 750 g", "Pan de Hot Dog Sin Gluten Tottus 400 g", "Pan de Molde Blanco Tradicional Bauducco 390 g", "Pan Molde Blanco", "Pan de Hamburguesa Sin Gluten Tottus 400 g", "Pan de Molde Blanco Sin Borde Ideal 400 g", "¡Juntos son mejores!", "Jamón Pierna", "-26%", "Jamón Pierna Artesanal Granel", "KG", "-22%", "Jamón Artesanal Pf Granel", "-21%", "Pack Yoghurt Batido Colun 12 x 125 g", "-12%", "Queso Ranco Laminado Granel", "-16%", "Jamón Acaramelado Pf Granel", "Jamón Colonial Granel", "-11%"]}, "txt_path": "dataset/txt_limpios/1753.txt", "html_path": "dataset/paginas_descargadas/1753.html", "es_status": "ET", "category_canonical": "pan", "decision": "keep", "match_score": 0.6, "reasons": "heuristic_default"}
{"source_id": "892", "title": "Panadería y repostería", "description": "", "breadcrumbs": "Pan > 500 g", "price_raw": "1.95", "currency_raw": "", "url": "", "seller": "Desconocido", "availability": "unknown", "country": "UNKNOWN", "product_name": "Panadería y repostería", "brand": "Pan", "reference": "", "unit": "500 g", "price_amount": 1.95, "price_currency": "", "price_symbol": "$", "price_text": "$1.95", "price_amount_filled": "1.95", "price_is_imputed": "False", "price_imputation_source": "original", "price_amount_usd": "1.95", "price_amount_usd_filled": "1.95", "fx_rate_local_per_usd": "1.0", "fx_source": "default_1usd", "information_text": "", "description_text": "", "features_text": "", "specifications_text": "", "benefits_text": "", "details_text": "", "other_sections": "", "sections": {}, "txt_path": "dataset/txt_limpios/892.txt", "html_path": "dataset/paginas_descargadas/892.html", "es_status": "EN", "category_canonical": "pan", "decision": "keep", "match_score": 0.6, "reasons": "heuristic_default"}
{"source_id": "893", "title": "Panadería y repostería", "description": "", "breadcrumbs": "Pan > 750 g", "price_raw": "2.54", "currency_raw": "", "url": "", "seller": "Desconocido", "availability": "unknown", "country": "UNKNOWN", "product_name": "Panadería y repostería", "brand": "Pan", "reference": "", "unit": "750 g", "price_amount": 2.54, "price_currency": "", "price_symbol": "$", "price_text": "$2.54", "price_amount_filled": "2.54", "price_is_imputed": "False", "price_imputation_source": "original", "price_amount_usd": "2.54", "price_amount_usd_filled": "2.54", "fx_rate_local_per_usd": "1.0", "fx_source": "default_1usd", "information_text": "", "description_text": "", "features_text": "", "specifications_text": "", "benefits_text": "", "details_text": "", "other_sections": "", "sections": {}, "txt_path": "dataset/txt_limpios/893.txt", "html_path": "dataset/paginas_descargadas/893.html", "es_status": "EN", "category_canonical": "pan", "decision": "keep", "match_score": 0.6, "reasons": "heuristic_default"}
{"source_id": "894", "title": "Panadería y repostería", "description": "", "breadcrumbs": "Pan > 740 g", "price_raw": "2.19", "currency_raw": "", "url": "", "seller": "Desconocido", "availability": "unknown", "country": "UNKNOWN", "product_name": "Panadería y repostería", "brand": "Pan", "reference": "", "unit": "740 g", "price_amount": 2.19, "price_currency": "", "price_symbol": "$", "price_text": "$2.19", "price_amount_filled": "2.19", "price_is_imputed": "False", "price_imputation_source": "original", "price_amount_usd": "2.19", "price_amount_usd_filled": "2.19", "fx_rate_local_per_usd": "1.0", "fx_source": "default_1usd", "information_text": "", "description_text": "", "features_text": "", "specifications_text": "", "benefits_text": "", "details_text": "", "other_sections": "", "sections": {}, "txt_path": "dataset/txt_limpios/894.txt", "html_path": "dataset/paginas_descargadas/894.html", "es_status": "EN", "category_canonical": "pan", "decision": "keep", "match_score": 0.6, "reasons": "heuristic_default"}
{"source_id": "895", "title": "Panadería y repostería", "description": "", "breadcrumbs": "Pan > 800 g", "price_raw": "", "currency_raw": "", "url": "", "seller": "Desconocido", "availability": "unknown", "country": "UNKNOWN", "product_name": "Panadería y repostería", "brand": "Pan", "reference": "", "unit": "800 g", "price_amount": null, "price_currency": "", "price_symbol": "", "price_text": "", "price_amount_filled": "44.23", "price_is_imputed": "True", "price_imputation_source": "category_country_mean", "price_amount_usd": "", "price_amount_usd_filled": "44.2339", "fx_rate_local_per_usd": "1.0", "fx_source": "default_1usd", "information_text": "", "description_text": "", "features_text": "", "specifications_text": "", "benefits_text": "", "details_text": "", "other_sections": "", "sections": {}, "txt_path": "dataset/txt_limpios/895.txt", "html_path": "dataset/paginas_descargadas/895.html", "es_status": "EN", "category_canonical": "pan", "decision": "discard", "match_score": 0.6, "reasons": "price_parse_failed;price<=0"}
{"source_id": "896", "title": "Panadería y repostería", "description": "", "breadcrumbs": "Pan", "price_raw": "1.76", "currency_raw": "", "url": "", "seller": "Desconocido", "availability": "unknown", "country": "UNKNOWN", "product_name": "Panadería y repostería", "brand": "Pan", "reference": "", "unit": "", "price_amount": 1.76, "price_currency": "", "price_symbol": "$", "price_text": "$1.76", "price_amount_filled": "1.76", "price_is_imputed": "False", "price_imputation_source": "original", "price_amount_usd": "1.76", "price_amount_usd_filled": "1.76", "fx_rate_local_per_usd": "1.0", "fx_source": "default_1usd", "information_text": "", "description_text": "", "features_text": "", "specifications_text": "", "benefits_text": "", "details_text": "", "other_sections": "", "sections": {}, "txt_path": "dataset/txt_limpios/896.txt", "html_path": "dataset/paginas_descargadas/896.html", "es_status": "EN", "category_canonical": "pan", "decision": "keep", "match_score": 0.6, "reasons": "heuristic_default"}
{"source_id": "801", "title": "PAPA AIRFRYER MCCAIN X 500G", "description": "Ingredientes | Componentes Nombre del producto: Papa Airfryer McCain 500g Descripción del producto: Papas precocidas y/o prefritas congeladas, súper crocantes y rápidas de preparar, aptas para horno y airfryer (no apto microondas). Tamaño: 24cm x 23cm Peso: 500 g Modo de fabricación: Industrial Conservación: Mantener congelado a -18°C, no volver a congelar una vez descongelado Origen: Importado RSA-005918-2018 Alergenos: Puede contener proteína de arveja y harina de arroz (potenciales alérgenos para algunas personas). Componentes: Papas Aceite vegetal (canola, soya, algodón, girasol, maíz) - Origen Norteamérica Almidón de papa modificado Dextrina Dextrosa Levadura Fibra de arveja Proteína de arveja Harina de arroz Sal Pirofosfato ácido de sodio Goma xantana Cobertura (almidón modificado, harina de arroz, dextrina, goma xantana) - Origen Europa Aceite de girasol Ver más También puede interesarte Bajó de precio PAN DE YUCA BACKEREI 8 UNDS 160 G Amor y amistad SALCHICHA RANCHERA X 230 G X 7 UD JAMÓN PIETRÁN ESTANDAR 230G TOMATE CHERRY 250 GR MILANESA DE POLLO APANADA 320 G BRASSET EMPANADA CON CARNE TOASTATAS 12 UND 420 G... CHAMPIÑON 250 GR", "breadcrumbs": "Unidades disponibles > 500G", "price_raw": "500.0", "currency_raw": "", "url": "", "seller": "Desconocido", "availability": "unknown", "country": "UNKNOWN", "product_name": "PAPA AIRFRYER MCCAIN X 500G", "brand": "Unidades disponibles", "reference": "", "unit": "500G", "price_amount": 500.0, "price_currency": "", "price_symbol": "", "price_text": "500", "price_amount_filled": "500.0", "price_is_imputed": "False", "price_imputation_source": "original", "price_amount_usd": "500.0", "price_amount_usd_filled": "500.0", "fx_rate_local_per_usd": "1.0", "fx_source": "default_1usd", "information_text": "", "description_text": "Ingredientes | Componentes Nombre del producto: Papa Airfryer McCain 500g Descripción del producto: Papas precocidas y/o prefritas congeladas, súper crocantes y rápidas de preparar, aptas para horno y airfryer (no apto microondas). Tamaño: 24cm x 23cm Peso: 500 g Modo de fabricación: Industrial Conservación: Mantener congelado a -18°C, no volver a congelar una vez descongelado Origen: Importado RSA-005918-2018 Alergenos: Puede contener proteína de arveja y harina de arroz (potenciales alérgenos para algunas personas). Componentes: Papas Aceite vegetal (canola, soya, algodón, girasol, maíz) - Origen Norteamérica Almidón de papa modificado Dextrina Dextrosa Levadura Fibra de arveja Proteína de arveja Harina de arroz Sal Pirofosfato ácido de sodio Goma xantana Cobertura (almidón modificado, harina de arroz, dextrina, goma xantana) - Origen Europa Aceite de girasol Ver más También puede interesarte Bajó de precio PAN DE YUCA BACKEREI 8 UNDS 160 G Amor y amistad SALCHICHA RANCHERA X 230 G X 7 UD JAMÓN PIETRÁN ESTANDAR 230G TOMATE CHERRY 250 GR MILANESA DE POLLO APANADA 320 G BRASSET EMPANADA CON CARNE TOASTATAS 12 UND 420 G... CHAMPIÑON 250 GR", "features_text": "", "specifications_text": "", "benefits_text": "", "details_text": "", "other_sections": "", "sections": {"Descripción": ["Ingredientes | Componentes", "Nombre del producto: Papa Airfryer McCain 500g", "Descripción del producto: Papas precocidas y/o prefritas congeladas, súper crocantes y rápidas de preparar, aptas para horno y airfryer (no apto microondas).", "Tamaño: 24cm x 23cm", "Peso: 500 g", "Modo de fabricación: Industrial", "Conservación: Mantener congelado a -18°C, no volver a congelar una vez descongelado", "Origen: Importado", "RSA-005918-2018", "Alergenos: Puede contener proteína de arveja y harina de arroz (potenciales alérgenos para algunas personas).", "Componentes: Papas", "Aceite vegetal (canola, soya, algodón, girasol, maíz) - Origen Norteamérica", "Almidón de papa modificado", "Dextrina", "Dextrosa", "Levadura", "Fibra de arveja", "Proteína de arveja", "Harina de arroz", "Sal", "Pirofosfato ácido de sodio", "Goma xantana", "Cobertura (almidón modificado, harina de arroz, dextrina, goma xantana) - Origen Europa", "Aceite de girasol", "Ver más", "También puede interesarte", "Bajó de precio", "PAN DE YUCA BACKEREI 8 UNDS 160 G", "Amor y amistad", "SALCHICHA RANCHERA X 230 G X 7 UD", "JAMÓN PIETRÁN ESTANDAR 230G", "TOMATE CHERRY 250 GR", "MILANESA DE POLLO APANADA 320 G BRASSET", "EMPANADA CON CARNE TOASTATAS 12 UND 420 G...", "CHAMPIÑON 250 GR"]}, "txt_path": "dataset/txt_limpios/801.txt", "html_path": "dataset/paginas_descargadas/801.html", "es_status": "EN", "category_canonical": "papa", "decision": "keep", "match_score": 0.6, "reasons": "heuristic_default"}
