{"source_id": "1752", "title": "Fiambres y Huevos", "description": "Huevos 12 Un Gran Blanco L Yemita 648g | Actualizado al: 25-01-2025 Ingredientes: Huevo. Certificados: Apto para APLV Libre de Lactosa Vegetariano Libre de Soya Libre de Peces Libre de Mariscos Libre de Maní Libre de Frutas Secos Libre de Nueces Libre de Sulfitos Libre de Trigo Porción: 1 Huevo (51g) Porciones por envase: 12 100g 1 Porción Energía (kCal) 149 76 Proteínas (g) 12 6.1 Grasas Totales 9.8 5 Grasas saturadas (g) 3.7 1.9 Grasas (g) 2.8 1.4 Grasas poliinsaturadas (g) 0.7 Grasas trans (g) 0,1 Colesterol (mg) 370 188.7 Hidratos de carbono disponibles Azúcar total (g) 0.5 0.3 Sodio 150 76.5 Importante: La información del empaque y/o contenido del producto final puede diferir respecto a lo que mostramos en nuestro sitio web, tanto a nivel de ingredientes, trazas, información nutricional, sellos, modo de uso y/o modo de conservación. Usted debe basarse únicamente en la información que se muestra en nuestro sitio web y siempre debe leer las etiquetas, advertencias y instrucciones antes de usar el consumo de un producto. Información obtenida de HUEVOS BLANCO GRAN 12 UN. YEM. Productos similares HUEVOS COLOR GRAN 12 UN. YEM Ver producto Huevo Blanco Gran Huevos Blanco Extra Grande Yemita 12 Un Huevos de Color Gallinas Libre La Granja 12 Un Huevo Blanco Extra Grande Huevos de Color Gallinas Libres Medianos Ecoterra 12 Un Huevos Blanco Grande HUEVO EXTRA BLANCO 12 UN COLIUMO Huevo Gallina Libre Huevo Gran Blanco Huevo Primera Color HUEVO GRAN LIBRE PASTO CINTAZUL 12 UND Huevo Color Gran Huevos de Color Gallinas Libres Ecoterra 20 Un ¡Juntos son mejores! Papa en Malla 2 Kg Plátano Extra Granel KG Cebolla en Malla 1 Kg Tomate Larga Vida a Granel Tomate en Malla 1 Kg Zanahoria en Bolsa 1 Kg Cebolla a Granel Zanahoria Jugo en Bolsa 1 Kg Papa Granel", "breadcrumbs": "Huevos > 648g", "price_raw": "4.1", "currency_raw": "", "url": "", "seller": "Desconocido", "availability": "unknown", "country": "UNKNOWN", "product_name": "Fiambres y Huevos", "brand": "Huevos", "reference": "", "unit": "648g", "price_amount": 4.1, "price_currency": "", "price_symbol": "", "price_text": "4.10", "price_amount_filled": "4.1", "price_is_imputed": "False", "price_imputation_source": "original", "price_amount_usd": "4.1", "price_amount_usd_filled": "4.1", "fx_rate_local_per_usd": "1.0", "fx_source": "default_1usd", "information_text": "", "description_text": "Huevos 12 Un Gran Blanco L Yemita 648g | Actualizado al: 25-01-2025 Ingredientes: Huevo. Certificados: Apto para APLV Libre de Lactosa Vegetariano Libre de Soya Libre de Peces Libre de Mariscos Libre de Maní Libre de Frutas Secos Libre de Nueces Libre de Sulfitos Libre de Trigo Porción: 1 Huevo (51g) Porciones por envase: 12 100g 1 Porción Energía (kCal) 149 76 Proteínas (g) 12 6.1 Grasas Totales 9.8 5 Grasas saturadas (g) 3.7 1.9 Grasas (g) 2.8 1.4 Grasas poliinsaturadas (g) 0.7 Grasas trans (g) 0,1 Colesterol (mg) 370 188.7 Hidratos de carbono disponibles Azúcar total (g) 0.5 0.3 Sodio 150 76.5 Importante: La información del empaque y/o contenido del producto final puede diferir respecto a lo que mostramos en nuestro sitio web, tanto a nivel de ingredientes, trazas, información nutricional, sellos, modo de uso y/o modo de conservación. Usted debe basarse únicamente en la información que se muestra en nuestro sitio web y siempre debe leer las etiquetas, advertencias y instrucciones antes de usar el consumo de un producto. Información obtenida de HUEVOS BLANCO GRAN 12 UN. YEM. Productos similares HUEVOS COLOR GRAN 12 UN. YEM Ver producto Huevo Blanco Gran Huevos Blanco Extra Grande Yemita 12 Un Huevos de Color Gallinas Libre La Granja 12 Un Huevo Blanco Extra Grande Huevos de Color Gallinas Libres Medianos Ecoterra 12 Un Huevos Blanco Grande HUEVO EXTRA BLANCO 12 UN COLIUMO Huevo Gallina Libre Huevo Gran Blanco Huevo Primera Color HUEVO GRAN LIBRE PASTO CINTAZUL 12 UND Huevo Color Gran Huevos de Color Gallinas Libres Ecoterra 20 Un ¡Juntos son mejores! Papa en Malla 2 Kg Plátano Extra Granel KG Cebolla en Malla 1 Kg Tomate Larga Vida a Granel Tomate en Malla 1 Kg Zanahoria en Bolsa 1 Kg Cebolla a Granel Zanahoria Jugo en Bolsa 1 Kg Papa Granel", "features_text": "", "specifications_text": "", "benefits_text": "", "details_text": "", "other_sections": "", "sections": {"Descripción": ["Huevos 12 Un Grande Blanco L Yemita", "648g | Actualizado al: 25-01-2025", "Ingredientes: Huevo.", "Certificados: Apto para APLV", "Libre de Lactosa", "Vegetariano", "Libre de Soya", "Libre de Peces", "Libre de Mariscos", "Libre de Maní", "Libre de Frutos Secos", "Libre de Nueces", "Libre de Sulfitos", "Libre de Trigo", "Porción: 1 Huevo (51g)", "Porciones por envase: 12", "100g", "1 Porción", "Energía", "(kCal)", "149", "76", "Proteínas", "(g)", "12", "6.1", "Grasas Totales", "9.8", "5", "Grasas saturadas (g)", "3.7", "1.9", "Grasas monoinsaturadas (g)", "2.8", "1.4", "Grasas poliinsaturadas (g)", "0.7", "Grasas trans (g)", "0.1", "Colesterol", "(mg)", "370", "188.7", "Hidratos de carbono disponibles", "Azúcar total (g)", "0.5", "0.3", "Sodio", "150", "76.5", "Importante: La información del empaque y/o contenido del producto final puede diferir respecto a lo que mostramos en nuestro sitio web, tanto a nivel de ingredientes, trazas, información nutricional, sellos, modo de uso y/o modo de conservación. Usted debe basarse únicamente en la información que se muestra en nuestro sitio web y siempre debe leer las etiquetas, advertencias y instrucciones antes de usar el consumo de un producto.", "Información obtenida de", "HUEVOS BLANCO GRANDE 12 UN. YEM.", "Productos similares", "HUEVOS COLOR GRANDE 12 UN. YEM", "Ver producto", "Huevo Blanco Grande", "Huevos Blanco Extra Grande Yemita 12 Un", "Huevos de Color Gallinas Libre La Granja 12 Un", "Huevo Blanco Extra Grande", "Huevos de Color Gallinas Libres Medianos Ecoterra 12 Un", "Huevos Blanco Grande", "HUEVO EXTRA BLANCO 12 UN COLIUMO", "Huevo Gallina Libre", "Huevo Grande Blanco", "Huevo Primera Color", "HUEVO GRAN LIBRE PASTO CINTAZUL 12 UND", "Huevo Color Grande", "Huevos de Color Gallinas Libres Ecoterra 20 Un", "¡Juntos son mejores!", "Papa en Malla 2 Kg", "Plátano Extra Granel", "KG", "Cebolla en Malla 1 Kg", "Tomate Larga Vida a Granel", "Tomate en Malla 1 Kg", "Zanahoria en Bolsa 1 Kg", "Cebolla a Granel", "Zanahoria Jugo en Bolsa 1 Kg", "Papa a Granel"]}, "txt_path": "dataset/txt_limpios/1752.txt", "html_path": "dataset/paginas_descargadas/1752.html", "es_status": "ET", "category_canonical": "azucar", "decision": "keep", "match_score": 0.6, "reasons": "heuristic_default"}
{"source_id": "1754", "title": "Fiambres y Huevos", "description": "Huevos de Gallinas Libres 12 Un extra Color La Castellana 732g | Actualizado al: 27-05-2025 Ingredientes: Huevo. Alérgenos: Huevo. Certificados: Apto para APLV Libre de Lactosa Vegetariano Libre de Soya Libre de Peces Libre de Mariscos Libre de Maní Libre de Frutas Secos Libre de Nueces Libre de Sulfitos Libre de Trigo Porción: 1 Huevo (57g) Porciones por envase: 12 100g 1 Porción Energía (kCal) 149 84.9 Proteínas (g) 12 6.8 Grasas Totales 9.8 5.6 Grasas saturadas (g) 3.7 2.1 Grasas (g) 2.8 1.6 Grasas poliinsaturadas (g) 1.4 0,8 Grasas trans (g) 0,1 Colesterol (mg) 370 210.9 Hidratos de carbono disponibles Azúcar total (g) 0.48 0.3 Sodio 150 85.5 Importante: La información del empaque y/o contenido del producto final puede diferir respecto a lo que mostramos en nuestro sitio web, tanto a nivel de ingredientes, trazas, información nutricional, sellos, modo de uso y/o modo de conservación. Usted debe basarse únicamente en la información que se muestra en nuestro sitio web y siempre debe leer las etiquetas, advertencias y instrucciones antes de usar el consumo de un producto. Información obtenida de HUEVO COLOR EXTRA LA CASTELLANA 12 UND Productos similares Huevo Blanco Grande Ver producto Huevo Color Grande Huevo Primera Color Huevos de Color Gallinas Libres Medianos Ecoterra 12 Un Huevo de Color Gallina Libre Huevo de Color Gallina Libre La Granja 6 Un Huevos de Color Gallinas Libre La Granja 12 Un Huevos Blanco Grande Yemita 12 Un HUEVO EXTRA BLANCO 12 UN COLIUMO HUEVOS COLOR GRAN 12 UN. YEM Huevos de Color Gallinas Libres Ecoterra 20 Un Huevos de Color Gallinas Libres Ecoterra 10 Un -28% Huevo Blanco Extra Grande Huevo Grande Gallina Libre HUEVO GRAN LIBRE PASTO CINTAZUL 12 UND ¡Juntos son mejores! Papa en Malla 2 Kg Papel Higiénico Elite Doble Hoja 8 x 50 mts Papa Granel KG Toalla de papel Nueva Doble Hoja 2 x 26 mts -19% Toalla de Papel Nuevo Doble Hoja 100 mts -13% Cebolla en Malla 1 Kg Cebolla a Granel Toalla de Papel Nueva Clásica 3 x 12 mts Tomate en Malla 1 Kg Toalla de papel Ultra Nova 70 Mts -18%", "breadcrumbs": "Huevos > 732g", "price_raw": "4.69", "currency_raw": "", "url": "", "seller": "Desconocido", "availability": "unknown", "country": "UNKNOWN", "product_name": "Fiambres y Huevos", "brand": "Huevos", "reference": "", "unit": "732g", "price_amount": 4.69, "price_currency": "", "price_symbol": "", "price_text": "4.69", "price_amount_filled": "4.69", "price_is_imputed": "False", "price_imputation_source": "original", "price_amount_usd": "4.69", "price_amount_usd_filled": "4.69", "fx_rate_local_per_usd": "1.0", "fx_source": "default_1usd", "information_text": "", "description_text": "Huevos de Gallinas Libres 12 Un extra Color La Castellana 732g | Actualizado al: 27-05-2025 Ingredientes: Huevo. Alérgenos: Huevo. Certificados: Apto para APLV Libre de Lactosa Vegetariano Libre de Soya Libre de Peces Libre de Mariscos Libre de Maní Libre de Frutas Secos Libre de Nueces Libre de Sulfitos Libre de Trigo Porción: 1 Huevo (57g) Porciones por envase: 12 100g 1 Porción Energía (kCal) 149 84.9 Proteínas (g) 12 6.8 Grasas Totales 9.8 5.6 Grasas saturadas (g) 3.7 2.1 Grasas (g) 2.8 1.6 Grasas poliinsaturadas (g) 1.4 0,8 Grasas trans (g) 0,1 Colesterol (mg) 370 210.9 Hidratos de carbono disponibles Azúcar total (g) 0.48 0.3 Sodio 150 85.5 Importante: La información del empaque y/o contenido del producto final puede diferir respecto a lo que mostramos en nuestro sitio web, tanto a nivel de ingredientes, trazas, información nutricional, sellos, modo de uso y/o modo de conservación. Usted debe basarse únicamente en la información que se muestra en nuestro sitio web y siempre debe leer las etiquetas, advertencias y instrucciones antes de usar el consumo de un producto. Información obtenida de HUEVO COLOR EXTRA LA CASTELLANA 12 UND Productos similares Huevo Blanco Grande Ver producto Huevo Color Grande Huevo Primera Color Huevos de Color Gallinas Libres Medianos Ecoterra 12 Un Huevo de Color Gallina Libre Huevo de Color Gallina Libre La Granja 6 Un Huevos de Color Gallinas Libre La Granja 12 Un Huevos Blanco Grande Yemita 12 Un HUEVO EXTRA BLANCO 12 UN COLIUMO HUEVOS COLOR GRAN 12 UN. YEM Huevos de Color Gallinas Libres Ecoterra 20 Un Huevos de Color Gallinas Libres Ecoterra 10 Un -28% Huevo Blanco Extra Grande Huevo Grande Gallina Libre HUEVO GRAN LIBRE PASTO CINTAZUL 12 UND ¡Juntos son mejores! Papa en Malla 2 Kg Papel Higiénico Elite Doble Hoja 8 x 50 mts Papa Granel KG Toalla de papel Nueva Doble Hoja 2 x 26 mts -19% Toalla de Papel Nuevo Doble Hoja 100 mts -13% Cebolla en Malla 1 Kg Cebolla a Granel Toalla de Papel Nueva Clásica 3 x 12 mts Tomate en Malla 1 Kg Toalla de papel Ultra Nova 70 Mts -18%", "features_text": "", "specifications_text": "", "benefits_text": "", "details_text": "", "other_sections": "", "sections": {"Descripción": ["Huevos de Gallinas Libres 12 Un Extra Color La Castellana", "732g | Actualizado al: 27-05-2025", "Ingredientes: Huevo.", "Alérgenos: Huevo.", "Certificados: Apto para APLV", "Libre de Lactosa", "Vegetariano", "Libre de Soya", "Libre de Peces", "Libre de Mariscos", "Libre de Maní", "Libre de Frutos Secos", "Libre de Nueces", "Libre de Sulfitos", "Libre de Trigo", "Porción: 1 Huevo (57g)", "Porciones por envase: 12", "100g", "1 Porción", "Energía", "(kCal)", "149", "84.9", "Proteínas", "(g)", "12", "6.8", "Grasas Totales", "9.8", "5.6", "Grasas saturadas (g)", "3.7", "2.1", "Grasas monoinsaturadas (g)", "2.8", "1.6", "Grasas poliinsaturadas (g)", "1.4", "0.8", "Grasas trans (g)", "0.1", "Colesterol", "(mg)", "370", "210.9", "Hidratos de carbono disponibles", "Azúcar total (g)", "0.48", "0.3", "Sodio", "150", "85.5", "Importante: La información del empaque y/o contenido del producto final puede diferir respecto a lo que mostramos en nuestro sitio web, tanto a nivel de ingredientes, trazas, información nutricional, sellos, modo de uso y/o modo de conservación. Usted debe basarse únicamente en la información que se muestra en nuestro sitio web y siempre debe leer las etiquetas, advertencias y instrucciones antes de usar el consumo de un producto.", "Información obtenida de", "HUEVO COLOR EXTRA LA CASTELLANA 12 UND", "Productos similares", "Huevo Blanco Grande", "Ver producto", "Huevo Color Grande", "Huevo Primera Color", "Huevos de Color Gallinas Libres Medianos Ecoterra 12 Un", "Huevo de Color Gallina Libre", "Huevo de Color Gallina Libre La Granja 6 Un", "Huevos de Color Gallinas Libre La Granja 12 Un", "Huevos Blanco Grande Yemita 12 Un", "HUEVO EXTRA BLANCO 12 UN COLIUMO", "HUEVOS COLOR GRANDE 12 UN. YEM", "Huevos de Color Gallinas Libres Ecoterra 20 Un", "Huevos de Color Gallinas Libres Ecoterra 10 Un", "-28%", "Huevo Blanco Extra Grande", "Huevo Grande Gallina Libre", "HUEVO GRAN LIBRE PASTO CINTAZUL 12 UND", "¡Juntos son mejores!", "Papa en Malla 2 Kg", "Papel Higiénico Elite Doble Hoja 8 x 50 mts", "Papa a Granel", "KG", "Toalla de Papel Nova Doble Hoja 2 x 26 mts", "-19%", "Toalla de Papel Nova Doble Hoja 100 mts", "-13%", "Cebolla en Malla 1 Kg", "Cebolla a Granel", "Toalla de papel Nueva Clásica 3 x 12 mts", "Tomate en Malla 1 Kg", "Toalla de Papel Ultra Nova 70 Mts", "-18%"]}, "txt_path": "dataset/txt_limpios/1754.txt", "html_path": "dataset/paginas_descargadas/1754.html", "es_status": "ET", "category_canonical": "azucar", "decision": "keep", "match_score": 0.6, "reasons": "heuristic_default"}
{"source_id": "1755", "title": "Fiambres y Huevos", "description": "HUEVO GALLI LIB CERT BIEN ANI 648 G 12UN Productos similares Huevos de Color Gallinas Libre La Granja 12 Un Ver producto HUEVOS COLOR GRANDE 12 UN. YEM Huevos de Color Gallinas Libres Ecoterra 10 Un -28% Huevos de Color Gallinas Libres Ecoterra 20 Un HUEVO EXTRA BLANCO 12 UN COLIUMO Huevo Color Grande Huevo Primera Color Huevos Blanco Grande Yemita 12 Un Huevo Gallina Libre Huevos Blancos Grandes Don Vicho 12 Un Huevos de Color Grandes Don Vicho 12 Un Huevo Blanco Grande Huevo Grande Gallina Libre Huevo Grande Blanco Huevo de Color Gallina Libre ¡Juntos son mejores! Papa en Malla 2 Kg Cebolla a Granel KG Papa a Granel Cebolla en Malla 1 Kg Tomate en Malla 1 Kg Zanahoria en Bolsa 1 Kg Zanahoria Jugo en Bolsa 1 Kg", "breadcrumbs": "Huevos > 648 G", "price_raw": "5.9", "currency_raw": "", "url": "", "seller": "Desconocido", "availability": "unknown", "country": "UNKNOWN", "product_name": "Fiambres y Huevos", "brand": "Huevos", "reference": "", "unit": "648 G", "price_amount": 5.9, "price_currency": "", "price_symbol": "", "price_text": "5.90", "price_amount_filled": "5.9", "price_is_imputed": "False", "price_imputation_source": "original", "price_amount_usd": "5.9", "price_amount_usd_filled": "5.9", "fx_rate_local_per_usd": "1.0", "fx_source": "default_1usd", "information_text": "", "description_text": "HUEVO GALLI LIB CERT BIEN ANI 648 G 12UN Productos similares Huevos de Color Gallinas Libre La Granja 12 Un Ver producto HUEVOS COLOR GRANDE 12 UN. YEM Huevos de Color Gallinas Libres Ecoterra 10 Un -28% Huevos de Color Gallinas Libres Ecoterra 20 Un HUEVO EXTRA BLANCO 12 UN COLIUMO Huevo Color Grande Huevo Primera Color Huevos Blanco Grande Yemita 12 Un Huevo Gallina Libre Huevos Blancos Grandes Don Vicho 12 Un Huevos de Color Grandes Don Vicho 12 Un Huevo Blanco Grande Huevo Grande Gallina Libre Huevo Grande Blanco Huevo de Color Gallina Libre ¡Juntos son mejores! Papa en Malla 2 Kg Cebolla a Granel KG Papa a Granel Cebolla en Malla 1 Kg Tomate en Malla 1 Kg Zanahoria en Bolsa 1 Kg Zanahoria Jugo en Bolsa 1 Kg", "features_text": "", "specifications_text": "", "benefits_text": "", "details_text": "", "other_sections": "", "sections": {"Descripción": ["HUEVO GALLI LIB CERT BIEN ANI 648 G 12UN", "Productos similares", "Huevos de Color Gallinas Libre La Granja 12 Un", "Ver producto", "HUEVOS COLOR GRANDE 12 UN. YEM", "Huevos de Color Gallinas Libres Ecoterra 10 Un", "-28%", "Huevos de Color Gallinas Libres Ecoterra 20 Un", "HUEVO EXTRA BLANCO 12 UN COLIUMO", "Huevo Color Grande", "Huevo Primera Color", "Huevos Blanco Grande Yemita 12 Un", "Huevo Gallina Libre", "Huevos Blancos Grandes Don Vicho 12 Un", "Huevos de Color Grandes Don Vicho 12 Un", "Huevo Blanco Grande", "Huevo Grande Gallina Libre", "Huevo Grande Blanco", "Huevo de Color Gallina Libre", "¡Juntos son mejores!", "Papa en Malla 2 Kg", "Cebolla a Granel", "KG", "Papa a Granel", "Cebolla en Malla 1 Kg", "Tomate en Malla 1 Kg", "Zanahoria en Bolsa 1 Kg", "Zanahoria Jugo en Bolsa 1 Kg"]}, "txt_path": "dataset/txt_limpios/1755.txt", "html_path": "dataset/paginas_descargadas/1755.html", "es_status": "EN", "category_canonical": "huevo", "decision": "discard", "match_score": 0.3, "reasons": "heuristic_default"}
{"source_id": "753", "title": "Filtrado por", "description": "", "breadcrumbs": "Limpiar filtros", "price_raw": "7.9", "currency_raw": "", "url": "", "seller": "Desconocido", "availability": "unknown", "country": "UNKNOWN", "product_name": "Filtrado por", "brand": "Limpiar filtros", "reference": "", "unit": "", "price_amount": 7.9, "price_currency": "", "price_symbol": "$", "price_text": "$7.90", "price_amount_filled": "7.9", "price_is_imputed": "False", "price_imputation_source": "original", "price_amount_usd": "7.9", "price_amount_usd_filled": "7.9", "fx_rate_local_per_usd": "1.0", "fx_source": "default_1usd", "information_text": "", "description_text": "", "features_text": "", "specifications_text": "", "benefits_text": "", "details_text": "", "other_sections": "", "sections": {}, "txt_path": "dataset/txt_limpios/753.txt", "html_path": "dataset/paginas_descargadas/753.html", "es_status": "EN", "category_canonical": "sin_categoria", "decision": "discard", "match_score": 0.3, "reasons": "no_category_detected"}
{"source_id": "320", "title": "Frijones Negro 1 Kg Camil", "description": "", "breadcrumbs": "Descripción > 1 Kg", "price_raw": "15.99", "currency_raw": "BRL", "url": "", "seller": "Desconocido", "availability": "unknown", "country": "BR", "product_name": "Frijones Negro 1 Kg Camil", "brand": "Descripción", "reference": "", "unit": "1 Kg", "price_amount": 15.99, "price_currency": "BRL", "price_symbol": "R$", "price_text": "R$15,99", "price_amount_filled": "15.99", "price_is_imputed": "False", "price_imputation_source": "original", "price_amount_usd": "2.935", "price_amount_usd_filled": "2.935", "fx_rate_local_per_usd": "5.448", "fx_source": "from_brasil_cambio_dolar", "information_text": "", "description_text": "", "features_text": "", "specifications_text": "", "benefits_text": "", "details_text": "", "other_sections": "", "sections": {}, "txt_path": "dataset/txt_limpios/320.txt", "html_path": "dataset/paginas_descargadas/320.html", "es_status": "ET", "category_canonical": "sin_categoria", "decision": "discard", "match_score": 0.3, "reasons": "no_category_detected"}
{"source_id": "1710", "title": "Frutas y Verduras", "description": "PAPA (GRANEL) ¡Juntos son mejores! Cebolla Granel Ver producto Zapallo en Trozo UN Zapallo Picado en Bolsa 500 g Ajo Zapallo Cubito en Bolsa 500 g Pimentón Verde Ajo en Malla 2 Un Zanahoria en Bolsa 1 Kg Cebolla en Malla 1 Kg Zanahoria Jugo en Bolsa 1 Kg Ajo Desgranado en Malla 150 g", "breadcrumbs": "Verduras > 500 g", "price_raw": "1.69", "currency_raw": "", "url": "", "seller": "Desconocido", "availability": "unknown", "country": "UNKNOWN", "product_name": "Frutas y Verduras", "brand": "Verduras", "reference": "", "unit": "500 g", "price_amount": 1.69, "price_currency": "", "price_symbol": "", "price_text": "1.69", "price_amount_filled": "1.69", "price_is_imputed": "False", "price_imputation_source": "original", "price_amount_usd": "1.69", "price_amount_usd_filled": "1.69", "fx_rate_local_per_usd": "1.0", "fx_source": "default_1usd", "information_text": "", "description_text": "PAPA (GRANEL) ¡Juntos son mejores! Cebolla Granel Ver producto Zapallo en Trozo UN Zapallo Picado en Bolsa 500 g Ajo Zapallo Cubito en Bolsa 500 g Pimentón Verde Ajo en Malla 2 Un Zanahoria en Bolsa 1 Kg Cebolla en Malla 1 Kg Zanahoria Jugo en Bolsa 1 Kg Ajo Desgranado en Malla 150 g", "features_text": "", "specifications_text": "", "benefits_text": "", "details_text": "", "other_sections": "", "sections": {"Descripción": ["PAPA (GRANEL)", "¡Juntos son mejores!", "Cebolla a Granel", "Ver producto", "Zapallo en Trozo", "UN", "Zapallo Picado en Bolsa 500 g", "Ajo", "Zapallo Cubito en Bolsa 500 g", "Pimentón Verde", "Ajo en Malla 2 Un", "Zanahoria en Bolsa 1 Kg", "Cebolla en Malla 1 Kg", "Zanahoria Jugo en Bolsa 1 Kg", "Ajo Desgranado en Malla 150 g"]}, "txt_path": "dataset/txt_limpios/1710.txt", "html_path": "dataset/paginas_descargadas/1710.html", "es_status": "ET", "category_canonical": "cebolla", "decision": "keep", "match_score": 0.6, "reasons": "heuristic_default"}
