{"source_id": "700", "title": "ASESORAMOS TU COMPRA: 📞(601) 6672004, lun a sab de 7am.a 7pm dom hasta las 6pm", "description": "Endulza tus momentos con azúcar blanco Mayaguez, es azúcar procedente de caña que ha sido seleccionada y clasificada especialmente para ti. Este producto es vendido, facturado y entregado por Cencosud - Colombia Los precios de los productos pueden cambiar dependiendo de la región. Aplican Términos y Condiciones Desactivados Referencia: 0730904 $ 3 , 84 x gr MAYAGUEZ ☆ ¿Todavía tienes tu Tarjeta Cencosud? Solicítala en línea, úsala y obtén un . Aplican términos y condiciones. Solicítala aquí Mejores ofertas -29% Términos más buscados 1. kefir alpina 2. muebles 3. leche 4. leche alqueria 5. san jorge 6. papel higiénico 7. arroz 8. café 9. cerveza 10. neveras", "breadcrumbs": "otras ciudades consulta aquí > 0730904", "price_raw": "9.6", "currency_raw": "COP", "url": "", "seller": "Desconocido", "availability": "unknown", "country": "CO", "product_name": "ASESORAMOS TU COMPRA: 📞(601) 6672004, lun a sab de 7am.a 7pm dom hasta las 6pm", "brand": "otras ciudades consulta aquí", "reference": "730904.0", "unit": "", "price_amount": 9.6, "price_currency": "COP", "price_symbol": "$", "price_text": "$9.60", "price_amount_filled": "9.6", "price_is_imputed": "False", "price_imputation_source": "original", "price_amount_usd": "0.0024", "price_amount_usd_filled": "0.0024", "fx_rate_local_per_usd": "4047.0", "fx_source": "from_colombia_cambio_dolar", "information_text": "", "description_text": "Endulza tus momentos con azúcar blanco Mayaguez, es azúcar procedente de caña que ha sido seleccionada y clasificada especialmente para ti. Este producto es vendido, facturado y entregado por Cencosud - Colombia Los precios de los productos pueden cambiar dependiendo de la región. Aplican Términos y Condiciones Desactivados Referencia: 0730904 $ 3 , 84 x gr MAYAGUEZ ☆ ¿Todavía tienes tu Tarjeta Cencosud? Solicítala en línea, úsala y obtén un . Aplican términos y condiciones. Solicítala aquí Mejores ofertas -29% Términos más buscados 1. kefir alpina 2. muebles 3. leche 4. leche alqueria 5. san jorge 6. papel higiénico 7. arroz 8. café 9. cerveza 10. neveras", "features_text": "", "specifications_text": "", "benefits_text": "", "details_text": "", "other_sections": "", "sections": {"Descripción": ["Endulza tus momentos con azúcar blanco Mayaguez, es azúcar procedente de caña que ha sido seleccionada y clasificada especialmente para ti.", "Este producto es vendido, facturado y entregado por", "Cencosud - Colombia", "Los precios de los productos pueden cambiar dependiendo de la región.", "Aplican Términos y Condiciones", "Desactivado", "Referencia: 0730904", "$", "3", ",", "84", "x", "gr", "MAYAGUEZ", "☆", "¿Todavía tienes tu Tarjeta Cencosud?", "Solicítala en línea, úsala y obtén un", ". Aplican términos y condiciones.", "Solicítala aquí", "Mejores ofertas", "-29%", "Términos más buscados", "1.", "kefir alpina", "2.", "muebles", "3.", "leche", "4.", "leche alqueria", "5.", "san jorge", "6.", "papel higienico", "7.", "arroz", "8.", "cafe", "9.", "cerveza", "10.", "neveras"]}, "txt_path": "dataset/txt_limpios/700.txt", "html_path": "dataset/paginas_descargadas/700.html", "es_status": "ET", "category_canonical": "cafe", "decision": "keep", "match_score": 0.6, "reasons": "heuristic_default"}
{"source_id": "701", "title": "ASESORAMOS TU COMPRA: 📞(601) 6672004, lun a sab de 7am.a 7pm dom hasta las 6pm", "description": "Ingredientes Condición alimentaria Información nutricional Ideal para endulzar lo que más te gusta, con menos contenidos de impurezas. Este producto es vendido, facturado y entregado por Cencosud - Colombia Los precios de los productos pueden cambiar dependiendo de la región. Aplican Términos y Condiciones Desactivados Referencia: 0031055 $ 4 , 36 x gr PROVIDENCIA ¿Todavía tienes tu Tarjeta Cencosud? Solicítala en línea, úsala y obtén un . Aplican términos y condiciones. Solicítala aquí Mejores ofertas -13% Términos más buscados 1. kefir alpina 2. muebles 3. leche 4. leche alqueria 5. san jorge 6. papel higiénico 7. arroz 8. café 9. cerveza 10. neveras", "breadcrumbs": "otras ciudades consulta aquí > 5kg > 0031055", "price_raw": "10.89", "currency_raw": "COP", "url": "", "seller": "Desconocido", "availability": "unknown", "country": "CO", "product_name": "ASESORAMOS TU COMPRA: 📞(601) 6672004, lun a sab de 7am.a 7pm dom hasta las 6pm", "brand": "otras ciudades consulta aquí", "reference": "31055.0", "unit": "5kg", "price_amount": 10.89, "price_currency": "COP", "price_symbol": "$", "price_text": "$10.89", "price_amount_filled": "10.89", "price_is_imputed": "False", "price_imputation_source": "original", "price_amount_usd": "0.0027", "price_amount_usd_filled": "0.0027", "fx_rate_local_per_usd": "4047.0", "fx_source": "from_colombia_cambio_dolar", "information_text": "", "description_text": "Ingredientes Condición alimentaria Información nutricional Ideal para endulzar lo que más te gusta, con menos contenidos de impurezas. Este producto es vendido, facturado y entregado por Cencosud - Colombia Los precios de los productos pueden cambiar dependiendo de la región. Aplican Términos y Condiciones Desactivados Referencia: 0031055 $ 4 , 36 x gr PROVIDENCIA ¿Todavía tienes tu Tarjeta Cencosud? Solicítala en línea, úsala y obtén un . Aplican términos y condiciones. Solicítala aquí Mejores ofertas -13% Términos más buscados 1. kefir alpina 2. muebles 3. leche 4. leche alqueria 5. san jorge 6. papel higiénico 7. arroz 8. café 9. cerveza 10. neveras", "features_text": "", "specifications_text": "", "benefits_text": "", "details_text": "", "other_sections": "", "sections": {"Descripción": ["Ingredientes", "Condición alimentaria", "Información nutricional", "Ideal para endulzar lo que más te gusta, con menos contenidos de impurezas.", "Este producto es vendido, facturado y entregado por", "Cencosud - Colombia", "Los precios de los productos pueden cambiar dependiendo de la región.", "Aplican Términos y Condiciones", "Desactivado", "Referencia: 0031055", "$", "4", ",", "36", "x", "gr", "PROVIDENCIA", "¿Todavía tienes tu Tarjeta Cencosud?", "Solicítala en línea, úsala y obtén un", ". Aplican términos y condiciones.", "Solicítala aquí", "Mejores ofertas", "-13%", "Términos más buscados", "1.", "kefir alpina", "2.", "muebles", "3.", "leche", "4.", "leche alqueria", "5.", "san jorge", "6.", "papel higienico", "7.", "arroz", "8.", "cafe", "9.", "cerveza", "10.", "neveras"]}, "txt_path": "dataset/txt_limpios/701.txt", "html_path": "dataset/paginas_descargadas/701.html", "es_status": "ET", "category_canonical": "cafe", "decision": "keep", "match_score": 0.6, "reasons": "heuristic_default"}
{"source_id": "1583", "title": "Azógue y Peixaria", "description": "", "breadcrumbs": "Aves > 1,4Kg", "price_raw": "23.5", "currency_raw": "BRL", "url": "", "seller": "Desconocido", "availability": "unknown", "country": "BR", "product_name": "Azógue y Peixaria", "brand": "Aves", "reference": "", "unit": "1,4Kg", "price_amount": 23.5, "price_currency": "BRL", "price_symbol": "R$", "price_text": "R$23,50", "price_amount_filled": "23.5", "price_is_imputed": "False", "price_imputation_source": "original", "price_amount_usd": "4.3135", "price_amount_usd_filled": "4.3135", "fx_rate_local_per_usd": "5.448", "fx_source": "from_brasil_cambio_dolar", "information_text": "", "description_text": "", "features_text": "", "specifications_text": "", "benefits_text": "", "details_text": "", "other_sections": "", "sections": {}, "txt_path": "dataset/txt_limpios/1583.txt", "html_path": "dataset/paginas_descargadas/1583.html", "es_status": "ET", "category_canonical": "sin_categoria", "decision": "discard", "match_score": 0.3, "reasons": "no_category_detected"}
{"source_id": "1588", "title": "Azógue y Peixaria", "description": "", "breadcrumbs": "Aves > 1Kg", "price_raw": "21.99", "currency_raw": "BRL", "url": "", "seller": "Desconocido", "availability": "unknown", "country": "BR", "product_name": "Azógue y Peixaria", "brand": "Aves", "reference": "", "unit": "1Kg", "price_amount": 21.99, "price_currency": "BRL", "price_symbol": "R$", "price_text": "R$21,99", "price_amount_filled": "21.99", "price_is_imputed": "False", "price_imputation_source": "original", "price_amount_usd": "4.0363", "price_amount_usd_filled": "4.0363", "fx_rate_local_per_usd": "5.448", "fx_source": "from_brasil_cambio_dolar", "information_text": "", "description_text": "", "features_text": "", "specifications_text": "", "benefits_text": "", "details_text": "", "other_sections": "", "sections": {}, "txt_path": "dataset/txt_limpios/1588.txt", "html_path": "dataset/paginas_descargadas/1588.html", "es_status": "ET", "category_canonical": "sin_categoria", "decision": "discard", "match_score": 0.3, "reasons": "no_category_detected"}
{"source_id": "1590", "title": "Azógue y Peixaria", "description": "", "breadcrumbs": "Aves > 700g", "price_raw": "", "currency_raw": "", "url": "", "seller": "Desconocido", "availability": "unknown", "country": "UNKNOWN", "product_name": "Azógue y Peixaria", "brand": "Aves", "reference": "", "unit": "700g", "price_amount": null, "price_currency": "", "price_symbol": "", "price_text": "", "price_amount_filled": "234.19", "price_is_imputed": "True", "price_imputation_source": "country_mean", "price_amount_usd": "", "price_amount_usd_filled": "234.1938", "fx_rate_local_per_usd": "1.0", "fx_source": "default_1usd", "information_text": "", "description_text": "", "features_text": "", "specifications_text": "", "benefits_text": "", "details_text": "", "other_sections": "", "sections": {}, "txt_path": "dataset/txt_limpios/1590.txt", "html_path": "dataset/paginas_descargadas/1590.html", "es_status": "ET", "category_canonical": "sin_categoria", "decision": "discard", "match_score": 0.3, "reasons": "no_category_detected;price_parse_failed"}
{"source_id": "1592", "title": "Azógue y Peixaria", "description": "", "breadcrumbs": "Aves > 700g", "price_raw": "700.0", "currency_raw": "", "url": "", "seller": "Desconocido", "availability": "unknown", "country": "UNKNOWN", "product_name": "Azógue y Peixaria", "brand": "Aves", "reference": "", "unit": "700g", "price_amount": 700.0, "price_currency": "", "price_symbol": "r", "price_text": "r700", "price_amount_filled": "700.0", "price_is_imputed": "False", "price_imputation_source": "original", "price_amount_usd": "700.0", "price_amount_usd_filled": "700.0", "fx_rate_local_per_usd": "1.0", "fx_source": "default_1usd", "information_text": "", "description_text": "", "features_text": "", "specifications_text": "", "benefits_text": "", "details_text": "", "other_sections": "", "sections": {}, "txt_path": "dataset/txt_limpios/1592.txt", "html_path": "dataset/paginas_descargadas/1592.html", "es_status": "ET", "category_canonical": "sin_categoria", "decision": "discard", "match_score": 0.3, "reasons": "no_category_detected"}
{"source_id": "215", "title": "Azógue y Peixaria", "description": "", "breadcrumbs": "Aves > 1,4Kg", "price_raw": "25.19", "currency_raw": "BRL", "url": "", "seller": "Desconocido", "availability": "unknown", "country": "BR", "product_name": "Azógue y Peixaria", "brand": "Aves", "reference": "", "unit": "1,4Kg", "price_amount": 25.19, "price_currency": "BRL", "price_symbol": "R$", "price_text": "R$25,19", "price_amount_filled": "25.19", "price_is_imputed": "False", "price_imputation_source": "original", "price_amount_usd": "4.6237", "price_amount_usd_filled": "4.6237", "fx_rate_local_per_usd": "5.448", "fx_source": "from_brasil_cambio_dolar", "information_text": "", "description_text": "", "features_text": "", "specifications_text": "", "benefits_text": "", "details_text": "", "other_sections": "", "sections": {}, "txt_path": "dataset/txt_limpios/215.txt", "html_path": "dataset/paginas_descargadas/215.html", "es_status": "ET", "category_canonical": "sin_categoria", "decision": "discard", "match_score": 0.3, "reasons": "no_category_detected"}
{"source_id": "216", "title": "Azógue y Peixaria", "description": "", "breadcrumbs": "Aves > 1Kg", "price_raw": "22.99", "currency_raw": "BRL", "url": "", "seller": "Desconocido", "availability": "unknown", "country": "BR", "product_name": "Azógue y Peixaria", "brand": "Aves", "reference": "", "unit": "1Kg", "price_amount": 22.99, "price_currency": "BRL", "price_symbol": "R$", "price_text": "R$22,99", "price_amount_filled": "22.99", "price_is_imputed": "False", "price_imputation_source": "original", "price_amount_usd": "4.2199", "price_amount_usd_filled": "4.2199", "fx_rate_local_per_usd": "5.448", "fx_source": "from_brasil_cambio_dolar", "information_text": "", "description_text": "", "features_text": "", "specifications_text": "", "benefits_text": "", "details_text": "", "other_sections": "", "sections": {}, "txt_path": "dataset/txt_limpios/216.txt", "html_path": "dataset/paginas_descargadas/216.html", "es_status": "ET", "category_canonical": "sin_categoria", "decision": "discard", "match_score": 0.3, "reasons": "no_category_detected"}
{"source_id": "217", "title": "Azógue y Peixaria", "description": "", "breadcrumbs": "Aves > 1Kg", "price_raw": "26.99", "currency_raw": "BRL", "url": "", "seller": "Desconocido", "availability": "unknown", "country": "BR", "product_name": "Azógue y Peixaria", "brand": "Aves", "reference": "", "unit": "1Kg", "price_amount": 26.99, "price_currency": "BRL", "price_symbol": "R$", "price_text": "R$26,99", "price_amount_filled": "26.99", "price_is_imputed": "False", "price_imputation_source": "original", "price_amount_usd": "4.9541", "price_amount_usd_filled": "4.9541", "fx_rate_local_per_usd": "5.448", "fx_source": "from_brasil_cambio_dolar", "information_text": "", "description_text": "", "features_text": "", "specifications_text": "", "benefits_text": "", "details_text": "", "other_sections": "", "sections": {}, "txt_path": "dataset/txt_limpios/217.txt", "html_path": "dataset/paginas_descargadas/217.html", "es_status": "ET", "category_canonical": "sin_categoria", "decision": "discard", "match_score": 0.3, "reasons": "no_category_detected"}
{"source_id": "218", "title": "Azógue y Peixaria", "description": "", "breadcrumbs": "Aves > 700g", "price_raw": "", "currency_raw": "", "url": "", "seller": "Desconocido", "availability": "unknown", "country": "UNKNOWN", "product_name": "Azógue y Peixaria", "brand": "Aves", "reference": "", "unit": "700g", "price_amount": null, "price_currency": "", "price_symbol": "", "price_text": "", "price_amount_filled": "234.19", "price_is_imputed": "True", "price_imputation_source": "country_mean", "price_amount_usd": "", "price_amount_usd_filled": "234.1938", "fx_rate_local_per_usd": "1.0", "fx_source": "default_1usd", "information_text": "", "description_text": "", "features_text": "", "specifications_text": "", "benefits_text": "", "details_text": "", "other_sections": "", "sections": {}, "txt_path": "dataset/txt_limpios/218.txt", "html_path": "dataset/paginas_descargadas/218.html", "es_status": "ET", "category_canonical": "sin_categoria", "decision": "discard", "match_score": 0.3, "reasons": "no_category_detected;price_parse_failed"}
{"source_id": "219", "title": "Azógue y Peixaria", "description": "", "breadcrumbs": "Aves > 700g", "price_raw": "700.0", "currency_raw": "", "url": "", "seller": "Desconocido", "availability": "unknown", "country": "UNKNOWN", "product_name": "Azógue y Peixaria", "brand": "Aves", "reference": "", "unit": "700g", "price_amount": 700.0, "price_currency": "", "price_symbol": "r", "price_text": "r700", "price_amount_filled": "700.0", "price_is_imputed": "False", "price_imputation_source": "original", "price_amount_usd": "700.0", "price_amount_usd_filled": "700.0", "fx_rate_local_per_usd": "1.0", "fx_source": "default_1usd", "information_text": "", "description_text": "", "features_text": "", "specifications_text": "", "benefits_text": "", "details_text": "", "other_sections": "", "sections": {}, "txt_path": "dataset/txt_limpios/219.txt", "html_path": "dataset/paginas_descargadas/219.html", "es_status": "ET", "category_canonical": "sin_categoria", "decision": "discard", "match_score": 0.3, "reasons": "no_category_detected"}
{"source_id": "805", "title": "AZÚCAR BLANCA 1000 GRS", "description": "Ingredientes | Componentes Nombre del producto: Azúcar Blanca 1000 g Descripción del producto: Disfruta de la Azúcar Blanca, ideal para endulzar bebidas, preparar postres y realzar tus recetas favoritas. Tamaño: 20cm x 13cm Peso: 1000 g Modo de fabricación: Industrial Conservación: Mantener en un lugar fresco y seco Origen: Nacional NSA-0019249-2024 Componentes: Azúcar de caña refinada ¡Queremos que tengas la mejor experiencia! Si tienes dudas sobre este producto el contenido, te invitamos a consultar nuestros Términos y condiciones para conocer malas sobre devoluciones y nuestras políticas de reembolsos. Ver más También puede interesarte SAL REFISAL 1000 G ACEITE VEGETAL IMATÁ 3.000 ML LENTEJA EL ESTÍO 500 GRS CABELLO DE ÁNGEL CAPRÍSSIMA 250 GRS CREMA LAVALOZA BRILLA KING 500 GRS ACEITE VEGETAL IMATÁ 900 ML LECHE ENTERA BOLSA UHT LATTI 900 ML CAFÉ TOSTADO Y MOLIDO VIEJO MOLINO 500 G ESPARCIBLE VEGETAL DON OLIO 500 G", "breadcrumbs": "Unidades disponibles > 1000 g", "price_raw": "1000.0", "currency_raw": "", "url": "", "seller": "Desconocido", "availability": "unknown", "country": "UNKNOWN", "product_name": "AZÚCAR BLANCA 1000 GRS", "brand": "Unidades disponibles", "reference": "", "unit": "1000 g", "price_amount": 1000.0, "price_currency": "", "price_symbol": "", "price_text": "1000", "price_amount_filled": "1000.0", "price_is_imputed": "False", "price_imputation_source": "original", "price_amount_usd": "1000.0", "price_amount_usd_filled": "1000.0", "fx_rate_local_per_usd": "1.0", "fx_source": "default_1usd", "information_text": "", "description_text": "Ingredientes | Componentes Nombre del producto: Azúcar Blanca 1000 g Descripción del producto: Disfruta de la Azúcar Blanca, ideal para endulzar bebidas, preparar postres y realzar tus recetas favoritas. Tamaño: 20cm x 13cm Peso: 1000 g Modo de fabricación: Industrial Conservación: Mantener en un lugar fresco y seco Origen: Nacional NSA-0019249-2024 Componentes: Azúcar de caña refinada ¡Queremos que tengas la mejor experiencia! Si tienes dudas sobre este producto el contenido, te invitamos a consultar nuestros Términos y condiciones para conocer malas sobre devoluciones y nuestras políticas de reembolsos. Ver más También puede interesarte SAL REFISAL 1000 G ACEITE VEGETAL IMATÁ 3.000 ML LENTEJA EL ESTÍO 500 GRS CABELLO DE ÁNGEL CAPRÍSSIMA 250 GRS CREMA LAVALOZA BRILLA KING 500 GRS ACEITE VEGETAL IMATÁ 900 ML LECHE ENTERA BOLSA UHT LATTI 900 ML CAFÉ TOSTADO Y MOLIDO VIEJO MOLINO 500 G ESPARCIBLE VEGETAL DON OLIO 500 G", "features_text": "", "specifications_text": "", "benefits_text": "", "details_text": "", "other_sections": "", "sections": {"Descripción": ["Ingredientes | Componentes", "Nombre del producto: Azúcar Blanca 1000 g", "Descripción del producto: Disfruta de la Azúcar Blanca, ideal para endulzar bebidas, preparar postres y realzar tus recetas favoritas.", "Tamaño: 20cm x 13cm", "Peso: 1000 g", "Modo de fabricación: Industrial", "Conservación: Mantener en un lugar fresco y seco", "Origen: Nacional", "NSA-0019249-2024", "Componentes: Azúcar de caña refinada", "¡Queremos que tengas la mejor experiencia! Si tienes dudas sobre este producto el contenido, te invitamos a consultar nuestros Términos y condiciones para conocer malas sobre devoluciones y nuestras políticas de reembolsos.", "Ver más", "También puede interesarte", "SAL REFISAL 1000 G", "ACEITE VEGETAL IMATÁ 3.000 ML", "LENTEJA EL ESTÍO 500 GRS", "CABELLO DE ÁNGEL CAPRÍSSIMA 250 GRS", "CREMA LAVALOZA BRILLA KING 500 GRS", "ACEITE VEGETAL IMATÁ 900 ML", "LECHE ENTERA BOLSA UHT LATTI 900 ML", "CAFÉ TOSTADO Y MOLIDO VIEJO MOLINO 500 G", "ESPARCIBLE VEGETAL DON OLIO 500 G"]}, "txt_path": "dataset/txt_limpios/805.txt", "html_path": "dataset/paginas_descargadas/805.html", "es_status": "ET", "category_canonical": "leche", "decision": "keep", "match_score": 0.6, "reasons": "heuristic_default"}
