{"source_id": "916", "title": "Se interrumpió la conexión", "description": "", "breadcrumbs": "ERR_NETWORK_CHANGED", "price_raw": "", "currency_raw": "", "url": "", "seller": "Desconocido", "availability": "unknown", "country": "UNKNOWN", "product_name": "Se interrumpió la conexión", "brand": "ERR_NETWORK_CHANGED", "reference": "", "unit": "", "price_amount": null, "price_currency": "", "price_symbol": "", "price_text": "", "price_amount_filled": "234.19", "price_is_imputed": "True", "price_imputation_source": "country_mean", "price_amount_usd": "", "price_amount_usd_filled": "234.1938", "fx_rate_local_per_usd": "1.0", "fx_source": "default_1usd", "information_text": "", "description_text": "", "features_text": "", "specifications_text": "", "benefits_text": "", "details_text": "", "other_sections": "", "sections": {}, "txt_path": "dataset/txt_limpios/916.txt", "html_path": "dataset/paginas_descargadas/916.html", "es_status": "EN", "category_canonical": "sin_categoria", "decision": "discard", "match_score": 0.3, "reasons": "no_category_detected;price_parse_failed"}
{"source_id": "955", "title": "Se interrumpió la conexión", "description": "", "breadcrumbs": "ERR_NETWORK_CHANGED", "price_raw": "", "currency_raw": "", "url": "", "seller": "Desconocido", "availability": "unknown", "country": "UNKNOWN", "product_name": "Se interrumpió la conexión", "brand": "ERR_NETWORK_CHANGED", "reference": "", "unit": "", "price_amount": null, "price_currency": "", "price_symbol": "", "price_text": "", "price_amount_filled": "234.19", "price_is_imputed": "True", "price_imputation_source": "country_mean", "price_amount_usd": "", "price_amount_usd_filled": "234.1938", "fx_rate_local_per_usd": "1.0", "fx_source": "default_1usd", "information_text": "", "description_text": "", "features_text": "", "specifications_text": "", "benefits_text": "", "details_text": "", "other_sections": "", "sections": {}, "txt_path": "dataset/txt_limpios/955.txt", "html_path": "dataset/paginas_descargadas/955.html", "es_status": "EN", "category_canonical": "sin_categoria", "decision": "discard", "match_score": 0.3, "reasons": "no_category_detected;price_parse_failed"}
{"source_id": "1011", "title": "Seja Bem Vindo à Plaza Vea", "description": "", "breadcrumbs": "que podemos ofrecer.", "price_raw": "", "currency_raw": "", "url": "", "seller": "Desconocido", "availability": "unknown", "country": "UNKNOWN", "product_name": "Seja Bem Vindo à Plaza Vea", "brand": "que podemos ofrecer.", "reference": "", "unit": "", "price_amount": null, "price_currency": "", "price_symbol": "", "price_text": "", "price_amount_filled": "234.19", "price_is_imputed": "True", "price_imputation_source": "country_mean", "price_amount_usd": "", "price_amount_usd_filled": "234.1938", "fx_rate_local_per_usd": "1.0", "fx_source": "default_1usd", "information_text": "", "description_text": "", "features_text": "", "specifications_text": "", "benefits_text": "", "details_text": "", "other_sections": "", "sections": {}, "txt_path": "dataset/txt_limpios/1011.txt", "html_path": "dataset/paginas_descargadas/1011.html", "es_status": "EN", "category_canonical": "sin_categoria", "decision": "discard", "match_score": 0.3, "reasons": "no_category_detected;price_parse_failed"}
{"source_id": "1024", "title": "Seja Bem Vindo à Plaza Vea", "description": "", "breadcrumbs": "que podemos ofrecer.", "price_raw": "", "currency_raw": "", "url": "", "seller": "Desconocido", "availability": "unknown", "country": "UNKNOWN", "product_name": "Seja Bem Vindo à Plaza Vea", "brand": "que podemos ofrecer.", "reference": "", "unit": "", "price_amount": null, "price_currency": "", "price_symbol": "", "price_text": "", "price_amount_filled": "234.19", "price_is_imputed": "True", "price_imputation_source": "country_mean", "price_amount_usd": "", "price_amount_usd_filled": "234.1938", "fx_rate_local_per_usd": "1.0", "fx_source": "default_1usd", "information_text": "", "description_text": "", "features_text": "", "specifications_text": "", "benefits_text": "", "details_text": "", "other_sections": "", "sections": {}, "txt_path": "dataset/txt_limpios/1024.txt", "html_path": "dataset/paginas_descargadas/1024.html", "es_status": "EN", "category_canonical": "sin_categoria", "decision": "discard", "match_score": 0.3, "reasons": "no_category_detected;price_parse_failed"}
{"source_id": "1027", "title": "Seja Bem Vindo à Plaza Vea", "description": "", "breadcrumbs": "que podemos ofrecer.", "price_raw": "", "currency_raw": "", "url": "", "seller": "Desconocido", "availability": "unknown", "country": "UNKNOWN", "product_name": "Seja Bem Vindo à Plaza Vea", "brand": "que podemos ofrecer.", "reference": "", "unit": "", "price_amount": null, "price_currency": "", "price_symbol": "", "price_text": "", "price_amount_filled": "234.19", "price_is_imputed": "True", "price_imputation_source": "country_mean", "price_amount_usd": "", "price_amount_usd_filled": "234.1938", "fx_rate_local_per_usd": "1.0", "fx_source": "default_1usd", "information_text": "", "description_text": "", "features_text": "", "specifications_text": "", "benefits_text": "", "details_text": "", "other_sections": "", "sections": {}, "txt_path": "dataset/txt_limpios/1027.txt", "html_path": "dataset/paginas_descargadas/1027.html", "es_status": "EN", "category_canonical": "sin_categoria", "decision": "discard", "match_score": 0.3, "reasons": "no_category_detected;price_parse_failed"}
{"source_id": "1036", "title": "Seja Bem Vindo à Plaza Vea", "description": "", "breadcrumbs": "que podemos ofrecer.", "price_raw": "", "currency_raw": "", "url": "", "seller": "Desconocido", "availability": "unknown", "country": "UNKNOWN", "product_name": "Seja Bem Vindo à Plaza Vea", "brand": "que podemos ofrecer.", "reference": "", "unit": "", "price_amount": null, "price_currency": "", "price_symbol": "", "price_text": "", "price_amount_filled": "234.19", "price_is_imputed": "True", "price_imputation_source": "country_mean", "price_amount_usd": "", "price_amount_usd_filled": "234.1938", "fx_rate_local_per_usd": "1.0", "fx_source": "default_1usd", "information_text": "", "description_text": "", "features_text": "", "specifications_text": "", "benefits_text": "", "details_text": "", "other_sections": "", "sections": {}, "txt_path": "dataset/txt_limpios/1036.txt", "html_path": "dataset/paginas_descargadas/1036.html", "es_status": "EN", "category_canonical": "sin_categoria", "decision": "discard", "match_score": 0.3, "reasons": "no_category_detected;price_parse_failed"}
{"source_id": "1199", "title": "Seja Bem Vindo à Plaza Vea", "description": "Información de la marca", "breadcrumbs": "Abarrotes > 10Kg", "price_raw": "43.0", "currency_raw": "PEN", "url": "", "seller": "Desconocido", "availability": "unknown", "country": "PE", "product_name": "Seja Bem Vindo à Plaza Vea", "brand": "Abarrotes", "reference": "", "unit": "10Kg", "price_amount": 43.0, "price_currency": "PEN", "price_symbol": "S/", "price_text": "S/43", "price_amount_filled": "43.0", "price_is_imputed": "False", "price_imputation_source": "original", "price_amount_usd": "12.1127", "price_amount_usd_filled": "12.1127", "fx_rate_local_per_usd": "3.55", "fx_source": "from_peru_cambio_dolar", "information_text": "", "description_text": "Información de la marca", "features_text": "Advertencias De Almacenamiento | Almacenar en un ambiente fresco y seco | Denominación/Variedad | Arroz cocina receta | Revisa todo | Componentes del Producto | Vendido por | plazaVea | En caso algo no vaya como gustes: Puedes revisar nuestras | Politicas de cambios y/o devoluciones | y hacerlas efectivas en todas nuestras tiendas. | Productos | que te pueden interesar | similares | Multiplicador-de-unidad: MAKRO-Bi-Precio|Vigente Oculto | Arroz Superior COSTEÑO Bolsa 5Kg | .00 | un | 3 | productos agregados | Agrega indicaciones | Guardar | MAKRO-Bi-Precio|Vigente Oculto | Arroz Familiar M&K Bolsa 750g | M&K | Arroz Añejo Amarillo FARAÓN G3 Bolsa 1Kg | Arroz Superior Aro Nir X5Kg | Arroz Superior Añejo ARO Bolsa 10kg | Arroz Superior GRAN CHALAN Gran Añejo Bolsa 5Kg | Arroz Despuntado ARO Nir Bolsa x10Kg | Arroz Superior CUSI CUSA Saco 10Kg | CUSI CUSA | Recomendado para ti", "specifications_text": "", "benefits_text": "", "details_text": "", "other_sections": "", "sections": {"Descripción": ["Información de la marca"], "Características": ["Advertencias De Almacenamiento", "Almacenar en un ambiente fresco y seco", "Denominación/Variedad", "Arroz cocina receta", "Revisa todo", "Componentes del Producto", "Vendido por", "plazaVea", "En caso algo no vaya como gustes: Puedes revisar nuestras", "Politicas de cambios y/o devoluciones", "y hacerlas efectivas en todas nuestras tiendas.", "Productos", "que te pueden interesar", "similares", "Multiplicador-de-unidad: MAKRO-Bi-Precio|Vigente Oculto", "Arroz Superior COSTEÑO Bolsa 5Kg", ".00", "un", "3", "productos agregados", "Agrega indicaciones", "Guardar", "MAKRO-Bi-Precio|Vigente Oculto", "Arroz Familiar M&K Bolsa 750g", "M&K", "Arroz Añejo Amarillo FARAÓN G3 Bolsa 1Kg", "Arroz Superior Aro Nir X5Kg", "Arroz Superior Añejo ARO Bolsa 10kg", "Arroz Superior GRAN CHALAN Gran Añejo Bolsa 5Kg", "Arroz Despuntado ARO Nir Bolsa x10Kg", "Arroz Superior CUSI CUSA Saco 10Kg", "CUSI CUSA", "Recomendado para ti"]}, "txt_path": "dataset/txt_limpios/1199.txt", "html_path": "dataset/paginas_descargadas/1199.html", "es_status": "EN", "category_canonical": "sin_categoria", "decision": "discard", "match_score": 0.3, "reasons": "no_category_detected"}
{"source_id": "1200", "title": "Seja Bem Vindo à Plaza Vea", "description": "Información de la marca", "breadcrumbs": "Abarrotes > 5Kg", "price_raw": "27.0", "currency_raw": "PEN", "url": "", "seller": "Desconocido", "availability": "unknown", "country": "PE", "product_name": "Seja Bem Vindo à Plaza Vea", "brand": "Abarrotes", "reference": "", "unit": "5Kg", "price_amount": 27.0, "price_currency": "PEN", "price_symbol": "S/", "price_text": "S/27", "price_amount_filled": "27.0", "price_is_imputed": "False", "price_imputation_source": "original", "price_amount_usd": "7.6056", "price_amount_usd_filled": "7.6056", "fx_rate_local_per_usd": "3.55", "fx_source": "from_peru_cambio_dolar", "information_text": "", "description_text": "Información de la marca", "features_text": "Presentación/Empaque | Bolsa | Producto Preparado | No | Arroz Pregraneado | Porción Sugerida | 1 | Alérgenos Declarados | Ninguno | Azúcares Por Porción | 0 | Calorías Por Porción | 638 | Carbohidratos Por Porción | 143.3 | Grasas Por Porción | Proteínas Por Porción | 15.3 | Sodio Por Porción | 14.2 | Peso Neto (g) | 5kg | Advertencias De Almacenamiento | Temperatura ambiente | Denominación/Variedad | Arroz Campero Reserva Extra Añejo 5kg | Uso | Consumo previa cocción | Advertencias de consumo | Previa cocción | Revisa todo | Componentes del Producto | Vendido por | plazaVea | En caso algo no vaya como gustes: Puedes revisar nuestras | Politicas de cambios y/o devoluciones | y hacerlas efectivas en todas nuestras tiendas. | Productos | que te pueden interesar | similares | Multiplicador-de-unidad: MAKRO-Bi-Precio|Vigente Oculto | Vea Days Supermercado marzo | Ver todo | .00 | un | 3 | productos agregados | Agrega indicaciones | Guardar | Multiplicador-de-unidad: Express | Arroz Extra COSTEÑITO Importado Saco 50kg | COSTEÑITO | Arroz Extra Añejo ARO Bolsa 10kg | Arroz Extra PACASMAYO Saco 49Kg | PACASMAYO | Arroz Extra VALLENORTE Gran Reserva Bolsa 750g | Arroz Extra CAMPERO Granel Saco 25Kg | Arroz Extra PAISANA Bolsa 1Kg | Recomendado para ti", "specifications_text": "", "benefits_text": "", "details_text": "", "other_sections": "", "sections": {"Descripción": ["Información de la marca"], "Características": ["Presentación/Empaque", "Bolsa", "Producto Preparado", "No", "Arroz Pregraneado", "Porción sugerida", "1", "Alérgenos Declarados", "Ninguno", "Azúcar por porción", "0", "Calorías Porción", "638", "Carbohidratos Porción", "143.3", "Grasas Porción", "Proteínas Porción", "15.3", "Sodio Porción", "14.2", "Peso Neto (g)", "5kg", "Advertencias De Almacenamiento", "Temperatura ambiente", "Denominación/Variedad", "Arroz Campero Reserva Extra Añejo 5kg", "Uso", "Consumo previa cocción", "Advertencias de consumo", "Previa cocción", "Revisa todo", "Componentes del Producto", "Vendido por", "plazaVea", "En caso algo no vaya como gustes: Puedes revisar nuestras", "Politicas de cambios y/o devoluciones", "y hacerlas efectivas en todas nuestras tiendas.", "Productos", "que te pueden interesar", "similares", "Multiplicador-de-unidad: MAKRO-Bi-Precio|Vigente Oculto", "Vea Days Supermercado marzo | Ver todo", ".00", "un", "3", "productos agregados", "Agrega indicaciones", "Guardar", "Multiplicador-de-unidad: Express", "Arroz Extra COSTEÑITO Importado Saco 50kg", "COSTEÑITO", "Arroz Extra Añejo ARO Bolsa 10kg", "Arroz Extra PACASMAYO Saco 49Kg", "PACASMAYO", "Arroz Extra VALLENORTE Gran Reserva Bolsa 750g", "Arroz Extra CAMPERO Granel Saco 25Kg", "Arroz Extra PAISANA Bolsa 1Kg", "Recomendado para ti"]}, "txt_path": "dataset/txt_limpios/1200.txt", "html_path": "dataset/paginas_descargadas/1200.html", "es_status": "ET", "category_canonical": "sin_categoria", "decision": "discard", "match_score": 0.3, "reasons": "no_category_detected"}
{"source_id": "1201", "title": "Seja Bem Vindo à Plaza Vea", "description": "Información de la marca", "breadcrumbs": "Abarrotes > 49Kg", "price_raw": "174.0", "currency_raw": "PEN", "url": "", "seller": "Desconocido", "availability": "unknown", "country": "PE", "product_name": "Seja Bem Vindo à Plaza Vea", "brand": "Abarrotes", "reference": "", "unit": "49Kg", "price_amount": 174.0, "price_currency": "PEN", "price_symbol": "S/", "price_text": "S/174", "price_amount_filled": "174.0", "price_is_imputed": "False", "price_imputation_source": "original", "price_amount_usd": "49.0141", "price_amount_usd_filled": "49.0141", "fx_rate_local_per_usd": "3.55", "fx_source": "from_peru_cambio_dolar", "information_text": "", "description_text": "Información de la marca", "features_text": "Revisa todo | Componentes del Producto | Vendido por | plazaVea | En caso algo no vaya como gustes: Puedes revisar nuestras | Politicas de cambios y/o devoluciones | y hacerlas efectivas en todas nuestras tiendas. | Productos | que te pueden interesar | similares | Multiplicador-de-unidad: MAKRO-Bi-Precio|Vigente Oculto | Arroz Superior COSTEÑO Bolsa 5Kg | .00 | un | 3 | productos agregados | Agrega indicaciones | Guardar | Arroz Familiar COSECHA NORTEÑA Bolsa 10Kg | COSECHA NORTEÑA | MAKRO-Bi-Precio|Vigente Oculto | Arroz Añejo Amarillo FARAÓN G3 Bolsa 1Kg | Arroz Superior Añejo ARO Saco 25kg | Arroz Superior GRAN CHALAN Gran Añejo Bolsa 5Kg | Multiplicador-de-unidad: Express | Arroz Familiar COSECHA NORTEÑA Saco 49Kg | Arroz Familiar COSECHA NORTEÑA Saco 25Kg | Recomendado para ti", "specifications_text": "", "benefits_text": "", "details_text": "", "other_sections": "", "sections": {"Descripción": ["Información de la marca"], "Características": ["Revisa todo", "Componentes del Producto", "Vendido por", "plazaVea", "En caso algo no vaya como gustes: Puedes revisar nuestras", "Politicas de cambios y/o devoluciones", "y hacerlas efectivas en todas nuestras tiendas.", "Productos", "que te pueden interesar", "similares", "Multiplicador-de-unidad: MAKRO-Bi-Precio|Vigente Oculto", "Arroz Superior COSTEÑO Bolsa 5Kg", ".00", "un", "3", "productos agregados", "Agrega indicaciones", "Guardar", "Arroz Familiar COSECHA NORTEÑA Bolsa 10Kg", "COSECHA NORTEÑA", "MAKRO-Bi-Precio|Vigente Oculto", "Arroz Añejo Amarillo FARAÓN G3 Bolsa 1Kg", "Arroz Superior Añejo ARO Saco 25kg", "Arroz Superior GRAN CHALAN Gran Añejo Bolsa 5Kg", "Multiplicador-de-unidad: Express", "Arroz Familiar COSECHA NORTEÑA Saco 49Kg", "Arroz Familiar COSECHA NORTEÑA Saco 25Kg", "Recomendado para ti"]}, "txt_path": "dataset/txt_limpios/1201.txt", "html_path": "dataset/paginas_descargadas/1201.html", "es_status": "EN", "category_canonical": "sin_categoria", "decision": "discard", "match_score": 0.3, "reasons": "no_category_detected"}
