{"source_id": "1174", "title": "Centro de preferencia de la privacidad", "description": "", "breadcrumbs": "Activas siempre > 800ml", "price_raw": "", "currency_raw": "PEN", "url": "", "seller": "Desconocido", "availability": "unknown", "country": "PE", "product_name": "Centro de preferencia de la privacidad", "brand": "Activas siempre", "reference": "", "unit": "800ml", "price_amount": null, "price_currency": "PEN", "price_symbol": "", "price_text": "", "price_amount_filled": "55.14", "price_is_imputed": "True", "price_imputation_source": "country_mean", "price_amount_usd": "", "price_amount_usd_filled": "15.5336", "fx_rate_local_per_usd": "3.55", "fx_source": "from_peru_cambio_dolar", "information_text": "", "description_text": "", "features_text": "TE RECOMENDAMOS | LAIVE | Leche LAIVE UHT Light Caja 946ml Paquete 4un | 23 | 90 | PIAMONTE | Leche Entera PIAMONTE Bolsa 946ml | 7 | GLORIA | Leche UHT GLORIA Entera Bolsa 800ml Paquete 3un | 15 | -17% | ORASI | Bebidas de arroz Orasi Caja 1L | 16 | 20 | 13 | 50 | 17% | -12% | Leche UHT LAIVE Entera Sin Lactosa Bolsa 900ml | 5 | 60 | 12% | DANLAC | Leche Chocolatada DANLAC Botella 900ml | No disponible | Leche UHT GLORIA Entera Caja 946ml Paquete 3un | 18 | Leche Light UHT GLORIA Bolsa 800ml | NATURE'S HEART | Bebida de Coco NATURES HEART sin Azúcar Botella 946ml | Leche LAIVE UHT Light Tetrapack 946ml | 6 | ¡Entérate de eventos exclusivos y promociones especiales que tenemos para ti! | SUSCRIBIRME | Acepto las políticas de tratamientos de datos personales | Razón Social: Compañía Food Retail S.A.C. RUC: 20608300393. Todos los derechos reservados Vivanda 2023. | | | Hola! | Encuentra todo lo que necesitas en Vivanda online | Términos más buscados | 1. | quesos | 2. | vino | 3. | café | 4. | quark 500g | 5. | 6. | pollo | 7. | yogurt | 8. | lunch florencia | 9. | agua | 10 | vinos", "specifications_text": "", "benefits_text": "", "details_text": "", "other_sections": "", "sections": {"Características": ["TE RECOMENDAMOS", "LAIVE", "Leche LAIVE UHT Light Caja 946ml Paquete 4un", "23", "90", "PIAMONTE", "Leche Entera PIAMONTE Bolsa 946ml", "7", "GLORIA", "Leche UHT GLORIA Entera Bolsa 800ml Paquete 3un", "15", "-17%", "ORASI", "Bebida de Arroz Orasi Caja 1L", "16", "20", "13", "50", "17%", "-12%", "Leche UHT LAIVE Entera Sin Lactosa Bolsa 900ml", "5", "60", "12%", "DANLAC", "Leche Chocolatada DANLAC Botella 900ml", "No disponible", "Leche UHT GLORIA Entera Caja 946ml Paquete 3un", "18", "Leche Light UHT GLORIA Bolsa 800ml", "NATURE'S HEART", "Bebidas de Coco NATURES HEART sin Azúcar Botella 946ml", "Leche LAIVE UHT Light Tetrapack 946ml", "6", "¡Entérate de eventos exclusivos y promociones especiales que tenemos para ti!", "SUSCRIBIRME", "Acepto las políticas de tratamiento de datos personales", "Razón social: Compañía Food Retail S.A.C. RUC: 20608300393. Todos los derechos reservados Vivanda 2023.", "¡Hola!", "Encuentra todo lo que necesitas en Vivanda online", "Términos más buscados", "1.", "quesos", "2.", "vino", "3.", "cafe", "4.", "quark 500g", "5.", "6.", "pollo", "7.", "yogurt", "8.", "lunch florencia", "9.", "agua", "10.", "vinos"]}, "txt_path": "dataset/txt_limpios/1174.txt", "html_path": "dataset/paginas_descargadas/1174.html", "es_status": "ET", "category_canonical": "sin_categoria", "decision": "discard", "match_score": 0.3, "reasons": "no_category_detected;price_parse_failed"}
{"source_id": "1176", "title": "Centro de preferencia de la privacidad", "description": "", "breadcrumbs": "Activas siempre > 500g", "price_raw": "", "currency_raw": "PEN", "url": "", "seller": "Desconocido", "availability": "unknown", "country": "PE", "product_name": "Centro de preferencia de la privacidad", "brand": "Activas siempre", "reference": "", "unit": "500g", "price_amount": null, "price_currency": "PEN", "price_symbol": "", "price_text": "", "price_amount_filled": "55.14", "price_is_imputed": "True", "price_imputation_source": "country_mean", "price_amount_usd": "", "price_amount_usd_filled": "15.5336", "fx_rate_local_per_usd": "3.55", "fx_source": "from_peru_cambio_dolar", "information_text": "", "description_text": "", "features_text": "TE RECOMENDAMOS | BELL'S | Huevos Pardos BELL'S Bandeja 30un | 21 | 30 | LA CALERA | Huevos Blancos LA CALERA Paquete 15un | 50 | Huevos de Codorniz BELL'S Bandeja 18un | 7 | Huevos para el Ande LA CALERA Paquete 15un | ENKEL FOODS | Claras de Huevo ENKEL FOODS Tetrapack 500g | 22 | Huevos de Gallina LA CALERA Pardos Jumbo Bandeja 15un | 13 | 20 | Huevos Pardos LA CALERA Paquete 30un | 23 | -20% | Huevos de Gallina LA CALERA de Corral Bandeja 12un | Huevos Pardos LA CALERA Bandeja 15un | 70 | ¡Entérate de eventos exclusivos y promociones especiales que tenemos para ti! | SUSCRIBIRME | Acepto las políticas de tratamientos de datos personales | Razón Social: Compañía Food Retail S.A.C. RUC: 20608300393. Todos los derechos reservados Vivanda 2023. | | Hola! | Encuentra todo lo que necesitas en Vivanda online | Términos más buscados | 1. | quesos | 2. | vino | 3. | café | 4. | quark 500g | 5. | leche | 6. | pollo | 7. | yogurt | 8. | lunch florencia | 9. | agua | 10 | vinos", "specifications_text": "", "benefits_text": "", "details_text": "", "other_sections": "", "sections": {"Características": ["TE RECOMENDAMOS", "BELL'S", "Huevos Pardos BELL'S Bandeja 30un", "21", "30", "LA CALERA", "Huevos Blancos LA CALERA Paquete 15un", "50", "Huevos de Codorniz BELL'S Bandeja 18un", "7", "Huevos para el Ande LA CALERA Paquete 15un", "ENKEL FOODS", "Claras de Huevo ENKEL FOODS Tetrapack 500g", "22", "Huevos de Gallina LA CALERA Pardos Jumbo Bandeja 15un", "13", "20", "Huevos Pardos LA CALERA Paquete 30un", "23", "-20%", "Huevos de Gallina LA CALERA de Corral Bandeja 12un", "Huevos Pardos LA CALERA Bandeja 15un", "70", "¡Entérate de eventos exclusivos y promociones especiales que tenemos para ti!", "SUSCRIBIRME", "Acepto las políticas de tratamiento de datos personales", "Razón social: Compañía Food Retail S.A.C. RUC: 20608300393. Todos los derechos reservados Vivanda 2023.", "¡Hola!", "Encuentra todo lo que necesitas en Vivanda online", "Términos más buscados", "1.", "quesos", "2.", "vino", "3.", "cafe", "4.", "quark 500g", "5.", "leche", "6.", "pollo", "7.", "yogurt", "8.", "lunch florencia", "9.", "agua", "10.", "vinos"]}, "txt_path": "dataset/txt_limpios/1176.txt", "html_path": "dataset/paginas_descargadas/1176.html", "es_status": "ET", "category_canonical": "sin_categoria", "decision": "discard", "match_score": 0.3, "reasons": "no_category_detected;price_parse_failed"}
{"source_id": "1177", "title": "Centro de preferencia de la privacidad", "description": "", "breadcrumbs": "Activas siempre > 500g", "price_raw": "", "currency_raw": "PEN", "url": "", "seller": "Desconocido", "availability": "unknown", "country": "PE", "product_name": "Centro de preferencia de la privacidad", "brand": "Activas siempre", "reference": "", "unit": "500g", "price_amount": null, "price_currency": "PEN", "price_symbol": "", "price_text": "", "price_amount_filled": "55.14", "price_is_imputed": "True", "price_imputation_source": "country_mean", "price_amount_usd": "", "price_amount_usd_filled": "15.5336", "fx_rate_local_per_usd": "3.55", "fx_source": "from_peru_cambio_dolar", "information_text": "", "description_text": "", "features_text": "TE RECOMENDAMOS | Huevos de Codorniz BELL'S Bandeja 24un | 9 | Huevos de Codorniz BELL'S Bandeja 18un | 7 | LA CALERA | Huevos de Codorniz LA CALERA Bandeja 18un | 60 | Huevos para el Ande LA CALERA Paquete 15un | 90 | ENKEL FOODS | Claras de Huevo ENKEL FOODS Tetrapack 500g | 22 | Huevos Pardo LA CALERA Bandeja 17un + Huevo Sorpresa | No disponible | Huevos Pardos LA CALERA Paquete 30un | 23 | 30 | Huevos Pardos GALLINAS LIBRES Bandeja 12un | 15 | Huevos de Gallina LA CALERA de Corral Bandeja 12un | 14 | 50 | Huevos Pardos LA CALERA Bandeja 15un | 70 | ¡Entérate de eventos exclusivos y promociones especiales que tenemos para ti! | SUSCRIBIRME | Acepto las políticas de tratamientos de datos personales | Razón Social: Compañía Food Retail S.A.C. RUC: 20608300393. Todos los derechos reservados Vivanda 2023. | | Hola! | Encuentra todo lo que necesitas en Vivanda online | Términos más buscados | 1. | quesos | 2. | vino | 3. | café | 4. | quark 500g | 5. | leche | 6. | pollo | 7. | yogurt | 8. | lunch florencia | 9. | agua | 10 | vinos", "specifications_text": "", "benefits_text": "", "details_text": "", "other_sections": "", "sections": {"Características": ["TE RECOMENDAMOS", "Huevos de Codorniz BELL'S Bandeja 24un", "9", "Huevos de Codorniz BELL'S Bandeja 18un", "7", "LA CALERA", "Huevos de Codorniz LA CALERA Bandeja 18un", "60", "Huevos para el Ande LA CALERA Paquete 15un", "90", "ENKEL FOODS", "Claras de Huevo ENKEL FOODS Tetrapack 500g", "22", "Huevos Pardo LA CALERA Bandeja 17un + Huevo Sorpresa", "No disponible", "Huevos Pardos LA CALERA Paquete 30un", "23", "30", "Huevos Pardos GALLINAS LIBRES Bandeja 12un", "15", "Huevos de Gallina LA CALERA de Corral Bandeja 12un", "14", "50", "Huevos Pardos LA CALERA Bandeja 15un", "70", "¡Entérate de eventos exclusivos y promociones especiales que tenemos para ti!", "SUSCRIBIRME", "Acepto las políticas de tratamiento de datos personales", "Razón social: Compañía Food Retail S.A.C. RUC: 20608300393. Todos los derechos reservados Vivanda 2023.", "¡Hola!", "Encuentra todo lo que necesitas en Vivanda online", "Términos más buscados", "1.", "quesos", "2.", "vino", "3.", "cafe", "4.", "quark 500g", "5.", "leche", "6.", "pollo", "7.", "yogurt", "8.", "lunch florencia", "9.", "agua", "10.", "vinos"]}, "txt_path": "dataset/txt_limpios/1177.txt", "html_path": "dataset/paginas_descargadas/1177.html", "es_status": "ET", "category_canonical": "sin_categoria", "decision": "discard", "match_score": 0.3, "reasons": "no_category_detected;price_parse_failed"}
{"source_id": "1178", "title": "Centro de preferencia de la privacidad", "description": "", "breadcrumbs": "Activas siempre > 500g", "price_raw": "", "currency_raw": "PEN", "url": "", "seller": "Desconocido", "availability": "unknown", "country": "PE", "product_name": "Centro de preferencia de la privacidad", "brand": "Activas siempre", "reference": "", "unit": "500g", "price_amount": null, "price_currency": "PEN", "price_symbol": "", "price_text": "", "price_amount_filled": "55.14", "price_is_imputed": "True", "price_imputation_source": "country_mean", "price_amount_usd": "", "price_amount_usd_filled": "15.5336", "fx_rate_local_per_usd": "3.55", "fx_source": "from_peru_cambio_dolar", "information_text": "", "description_text": "", "features_text": "TE RECOMENDAMOS | BELL'S | Huevos Pardos BELL'S Bandeja 30un | 21 | 30 | LA CALERA | Huevos Blancos LA CALERA Paquete 15un | 11 | 50 | Huevos de Codorniz BELL'S Bandeja 18un | 7 | Huevos para el Ande LA CALERA Paquete 15un | ENKEL FOODS | Claras de Huevo ENKEL FOODS Tetrapack 500g | 22 | Huevos Pardo LA CALERA Bandeja 17un + Huevo Sorpresa | No disponible | Huevos Pardos LA CALERA Paquete 30un | 23 | Huevos de Gallina LA CALERA de Corral Bandeja 12un | 14 | Huevos de Gallina BELL'S Pardos Bandeja 15un | 10 | Huevos Pardos LA CALERA Bandeja 15un | 70 | ¡Entérate de eventos exclusivos y promociones especiales que tenemos para ti! | SUSCRIBIRME | Acepto las políticas de tratamientos de datos personales | Razón Social: Compañía Food Retail S.A.C. RUC: 20608300393. Todos los derechos reservados Vivanda 2023. | | Hola! | Encuentra todo lo que necesitas en Vivanda online | Términos más buscados | 1. | quesos | 2. | vino | 3. | café | 4. | quark 500g | 5. | leche | 6. | pollo | 7. | yogurt | 8. | lunch florencia | 9. | agua | 10 | vinos", "specifications_text": "", "benefits_text": "", "details_text": "", "other_sections": "", "sections": {"Características": ["TE RECOMENDAMOS", "BELL'S", "Huevos Pardos BELL'S Bandeja 30un", "21", "30", "LA CALERA", "Huevos Blancos LA CALERA Paquete 15un", "11", "50", "Huevos de Codorniz BELL'S Bandeja 18un", "7", "Huevos para el Ande LA CALERA Paquete 15un", "ENKEL FOODS", "Claras de Huevo ENKEL FOODS Tetrapack 500g", "22", "Huevos Pardo LA CALERA Bandeja 17un + Huevo Sorpresa", "No disponible", "Huevos Pardos LA CALERA Paquete 30un", "23", "Huevos de Gallina LA CALERA de Corral Bandeja 12un", "14", "Huevos de Gallina BELL'S Pardos Bandeja 15un", "10", "Huevos Pardos LA CALERA Bandeja 15un", "70", "¡Entérate de eventos exclusivos y promociones especiales que tenemos para ti!", "SUSCRIBIRME", "Acepto las políticas de tratamiento de datos personales", "Razón social: Compañía Food Retail S.A.C. RUC: 20608300393. Todos los derechos reservados Vivanda 2023.", "¡Hola!", "Encuentra todo lo que necesitas en Vivanda online", "Términos más buscados", "1.", "quesos", "2.", "vino", "3.", "cafe", "4.", "quark 500g", "5.", "leche", "6.", "pollo", "7.", "yogurt", "8.", "lunch florencia", "9.", "agua", "10.", "vinos"]}, "txt_path": "dataset/txt_limpios/1178.txt", "html_path": "dataset/paginas_descargadas/1178.html", "es_status": "ET", "category_canonical": "sin_categoria", "decision": "discard", "match_score": 0.3, "reasons": "no_category_detected;price_parse_failed"}
{"source_id": "1179", "title": "Centro de preferencia de la privacidad", "description": "", "breadcrumbs": "Activas siempre > 1Kg", "price_raw": "", "currency_raw": "PEN", "url": "", "seller": "Desconocido", "availability": "unknown", "country": "PE", "product_name": "Centro de preferencia de la privacidad", "brand": "Activas siempre", "reference": "", "unit": "1Kg", "price_amount": null, "price_currency": "PEN", "price_symbol": "", "price_text": "", "price_amount_filled": "55.14", "price_is_imputed": "True", "price_imputation_source": "country_mean", "price_amount_usd": "", "price_amount_usd_filled": "15.5336", "fx_rate_local_per_usd": "3.55", "fx_source": "from_peru_cambio_dolar", "information_text": "", "description_text": "", "features_text": "TE RECOMENDAMOS | DULFINA | Azúcar Rubia DULFINA Bolsa 2Kg | 9 | 80 | Azúcar Rubia DULFINA Bolsa 5Kg | 22 | BELL'S | Azúcar Rubia BELL'S Caja 60un | 7 | 30 | ONZA | Azúcar Rubia ONZA Light con Stevia Doypack 500g | Azúcar Rubia CARTAVIO Bolsa 5Kg | 23 | -4% | Azúcar Rubia DULFINA Bolsa 1Kg | 4 | 99 | 4% | Azúcar Rubia BELL'S Bolsa 5Kg | 20 | Azúcar Rubia BELL'S Bolsa 2Kg | 8 | 70 | Azúcar Rubia BELL'S Bolsa 1Kg | 10 | ¡Entérate de eventos exclusivos y promociones especiales que tenemos para ti! | SUSCRIBIRME | Acepto las políticas de tratamientos de datos personales | Razón Social: Compañía Food Retail S.A.C. RUC: 20608300393. Todos los derechos reservados Vivanda 2023. | | Hola! | Encuentra todo lo que necesitas en Vivanda online | Términos más buscados | 1. | quesos | 2. | vino | 3. | café | 4. | quark 500g | 5. | leche | 6. | pollo | 7. | yogurt | 8. | lunch florencia | 9. | agua | 10 | vinos", "specifications_text": "", "benefits_text": "", "details_text": "", "other_sections": "", "sections": {"Características": ["TE RECOMENDAMOS", "DULFINA", "Azúcar Rubia DULFINA Bolsa 2Kg", "9", "80", "Azúcar Rubia DULFINA Bolsa 5Kg", "22", "BELL'S", "Azúcar Rubia BELL'S Caja 60un", "7", "30", "ONZA", "Azúcar Rubia ONZA Light con Stevia Doypack 500g", "Azúcar Rubia CARTAVIO Bolsa 5Kg", "23", "-4%", "Azúcar Rubia DULFINA Bolsa 1Kg", "4", "99", "4%", "Azúcar Rubia BELL'S Bolsa 5Kg", "20", "Azúcar Rubia BELL'S Bolsa 2Kg", "8", "70", "Azúcar Rubia BELL'S Bolsa 1Kg", "10", "¡Entérate de eventos exclusivos y promociones especiales que tenemos para ti!", "SUSCRIBIRME", "Acepto las políticas de tratamiento de datos personales", "Razón social: Compañía Food Retail S.A.C. RUC: 20608300393. Todos los derechos reservados Vivanda 2023.", "¡Hola!", "Encuentra todo lo que necesitas en Vivanda online", "Términos más buscados", "1.", "quesos", "2.", "vino", "3.", "cafe", "4.", "quark 500g", "5.", "leche", "6.", "pollo", "7.", "yogurt", "8.", "lunch florencia", "9.", "agua", "10.", "vinos"]}, "txt_path": "dataset/txt_limpios/1179.txt", "html_path": "dataset/paginas_descargadas/1179.html", "es_status": "ET", "category_canonical": "sin_categoria", "decision": "discard", "match_score": 0.3, "reasons": "no_category_detected;price_parse_failed"}
{"source_id": "1180", "title": "Centro de preferencia de la privacidad", "description": "", "breadcrumbs": "Activas siempre > 1Kg", "price_raw": "", "currency_raw": "PEN", "url": "", "seller": "Desconocido", "availability": "unknown", "country": "PE", "product_name": "Centro de preferencia de la privacidad", "brand": "Activas siempre", "reference": "", "unit": "1Kg", "price_amount": null, "price_currency": "PEN", "price_symbol": "", "price_text": "", "price_amount_filled": "55.14", "price_is_imputed": "True", "price_imputation_source": "country_mean", "price_amount_usd": "", "price_amount_usd_filled": "15.5336", "fx_rate_local_per_usd": "3.55", "fx_source": "from_peru_cambio_dolar", "information_text": "", "description_text": "", "features_text": "TE RECOMENDAMOS | DULFINA | Azúcar Rubia DULFINA Bolsa 2Kg | 9 | 80 | Azúcar Rubia DULFINA Bolsa 5Kg | 22 | Azúcar Rubia BELL'S Caja 60un | 7 | 30 | ONZA | Azúcar Rubia ONZA Light con Stevia Doypack 500g | CARTAVIO | Azúcar Rubia CARTAVIO Bolsa 5Kg | 23 | Azúcar Rubia CARTAVIO Bolsa 1Kg | No disponible | -4% | Azúcar Rubia DULFINA Bolsa 1Kg | 99 | 4% | Azúcar Rubia BELL'S Bolsa 5Kg | 20 | Azúcar Rubia BELL'S Bolsa 2Kg | 8 | 70 | ¡Entérate de eventos exclusivos y promociones especiales que tenemos para ti! | SUSCRIBIRME | Acepto las políticas de tratamientos de datos personales | Razón Social: Compañía Food Retail S.A.C. RUC: 20608300393. Todos los derechos reservados Vivanda 2023. | | Hola! | Encuentra todo lo que necesitas en Vivanda online | Términos más buscados | 1. | quesos | 2. | vino | 3. | café | 4. | quark 500g | 5. | leche | 6. | pollo | 7. | yogurt | 8. | lunch florencia | 9. | agua | 10 | vinos", "specifications_text": "", "benefits_text": "", "details_text": "", "other_sections": "", "sections": {"Características": ["TE RECOMENDAMOS", "DULFINA", "Azúcar Rubia DULFINA Bolsa 2Kg", "9", "80", "Azúcar Rubia DULFINA Bolsa 5Kg", "22", "Azúcar Rubia BELL'S Caja 60un", "7", "30", "ONZA", "Azúcar Rubia ONZA Light con Stevia Doypack 500g", "CARTAVIO", "Azúcar Rubia CARTAVIO Bolsa 5Kg", "23", "Azúcar Rubia CARTAVIO Bolsa 1Kg", "No disponible", "-4%", "Azúcar Rubia DULFINA Bolsa 1Kg", "99", "4%", "Azúcar Rubia BELL'S Bolsa 5Kg", "20", "Azúcar Rubia BELL'S Bolsa 2Kg", "8", "70", "¡Entérate de eventos exclusivos y promociones especiales que tenemos para ti!", "SUSCRIBIRME", "Acepto las políticas de tratamiento de datos personales", "Razón social: Compañía Food Retail S.A.C. RUC: 20608300393. Todos los derechos reservados Vivanda 2023.", "¡Hola!", "Encuentra todo lo que necesitas en Vivanda online", "Términos más buscados", "1.", "quesos", "2.", "vino", "3.", "cafe", "4.", "quark 500g", "5.", "leche", "6.", "pollo", "7.", "yogurt", "8.", "lunch florencia", "9.", "agua", "10.", "vinos"]}, "txt_path": "dataset/txt_limpios/1180.txt", "html_path": "dataset/paginas_descargadas/1180.html", "es_status": "ET", "category_canonical": "sin_categoria", "decision": "discard", "match_score": 0.3, "reasons": "no_category_detected;price_parse_failed"}
