source_id,title,description,breadcrumbs,price_raw,currency_raw,url,seller,availability,country,product_name,brand,reference,unit,price_amount,price_currency,price_symbol,price_text,price_amount_filled,price_is_imputed,price_imputation_source,price_amount_usd,price_amount_usd_filled,fx_rate_local_per_usd,fx_source,information_text,description_text,features_text,specifications_text,benefits_text,details_text,other_sections,sections,txt_path,html_path,es_status,category_canonical,decision,match_score,reasons
736,Selecciona tu,"+ | Especificaciones técnicas | Propiedad | Especificación | Complementa tu elección | Zenu | Empanada Zenú Coctel 300 G | 12 | Nuggets Kokoriko Coma 300 G X20 Unds | 300 Gramos | 63 | 18 | Super Ricas | PASABOCA PAPA SUP CROKANT FRT C/CASCAR 115G | 10 | 380 | Zen | AGUA ZEN LIMONADA CEREZADA 540 ML | 2 | 2.500 | AGUA ZEN DURAZNO 540 ML | Balance | Desodorante Balance Crema Clinical Invisible Hombre 2 x 50 Gr | 43 | 680 | Ver más | Papa Francesa Papafacil 1000g | Papa | Papa McCain | Solanum tuberosum | Francesa | Gastronomía de Francia | Papa Fácil | Comentarios | ☆ | 0 | (0 comentarios) | Por favor, inicia sesión para escribir un comentario. | Más reciente | Ordenar por: Más reciente | Más antiguo | Calificación más alta | Calificación más baja | Todos | Filtrar por: Todos | 1 estrella | 2 estrellas | 3 estrellas | 4 estrellas | 5 estrellas | No hay comentarios. | Términos más buscados | 1. | celulares | 2. | neveras | 3. | iphone | 4. | lavadora | 5. | aire | 6. | televisores | 7. | estufa | 8. | colchon | 9. | cafe | 10. | nevera | Evalúanos",Método de envío > 1 Kg,,COP,,Desconocido,unknown,CO,Selecciona tu,Método de envío,,1 Kg,,COP,,,97.32,True,category_country_mean,,0.024,4047.0,from_colombia_cambio_dolar,,,,"+ | Especificaciones técnicas | Propiedad | Especificación | Complementa tu elección | Zenu | Empanada Zenú Coctel 300 G | 12 | Nuggets Kokoriko Coma 300 G X20 Unds | 300 Gramos | 63 | 18 | Super Ricas | PASABOCA PAPA SUP CROKANT FRT C/CASCAR 115G | 10 | 380 | Zen | AGUA ZEN LIMONADA CEREZADA 540 ML | 2 | 2.500 | AGUA ZEN DURAZNO 540 ML | Balance | Desodorante Balance Crema Clinical Invisible Hombre 2 x 50 Gr | 43 | 680 | Ver más | Papa Francesa Papafacil 1000g | Papa | Papa McCain | Solanum tuberosum | Francesa | Gastronomía de Francia | Papa Fácil | Comentarios | ☆ | 0 | (0 comentarios) | Por favor, inicia sesión para escribir un comentario. | Más reciente | Ordenar por: Más reciente | Más antiguo | Calificación más alta | Calificación más baja | Todos | Filtrar por: Todos | 1 estrella | 2 estrellas | 3 estrellas | 4 estrellas | 5 estrellas | No hay comentarios. | Términos más buscados | 1. | celulares | 2. | neveras | 3. | iphone | 4. | lavadora | 5. | aire | 6. | televisores | 7. | estufa | 8. | colchon | 9. | cafe | 10. | nevera | Evalúanos",,,,"{""Especificaciones"": [""+"", ""Especificaciones técnicas"", ""Propiedad"", ""Especificación"", ""Complementa tu elección"", ""Zenu"", ""Empanada Zenú Coctel 300 G"", ""12"", ""Nuggets Kokoriko Coma 300 G X20 Unds"", ""300 Gramos"", ""63"", ""18"", ""Super Ricas"", ""PASABOCA PAPA SUP CROKANT FRT C/CASCAR 115G"", ""10"", ""380"", ""Zen"", ""AGUA ZEN LIMONADA CEREZADA 540 ML"", ""2"", ""2.500"", ""AGUA ZEN DURAZNO 540 ML"", ""Balance"", ""Desodorante Balance Crema Clinical Invisible Hombre 2 x 50 Gr"", ""43"", ""680"", ""Ver más"", ""Papa Francesa Papafacil 1000g"", ""Papa"", ""Papa McCain"", ""Solanum tuberosum"", ""Francesa"", ""Gastronomía de Francia"", ""Papa Fácil"", ""Comentarios"", ""☆"", ""0"", ""(0 comentarios)"", ""Por favor, inicia sesión para escribir un comentario."", ""Más reciente"", ""Ordenar por: Más reciente"", ""Más antiguo"", ""Calificación más alta"", ""Calificación más baja"", ""Todos"", ""Filtrar por: Todos"", ""1 estrella"", ""2 estrellas"", ""3 estrellas"", ""4 estrellas"", ""5 estrellas"", ""No hay comentarios."", ""Términos más buscados"", ""1."", ""celulares"", ""2."", ""neveras"", ""3."", ""iphone"", ""4."", ""lavadora"", ""5."", ""aire"", ""6."", ""televisores"", ""7."", ""estufa"", ""8."", ""colchon"", ""9."", ""cafe"", ""10."", ""nevera"", ""Evalúanos""]}",dataset/txt_limpios/736.txt,dataset/paginas_descargadas/736.html,EN,cafe,discard,0.60,price_parse_failed;price<=0
737,Selecciona tu,"+ | Especificaciones técnicas | Propiedad | Especificación | Tipo de Lácteo | Queso | Comentarios | ☆ | 0 Calificación promedio | (0 comentarios) | Por favor, inicia sesión para escribir un comentario. | Más reciente | Ordenar por: Más reciente | Más antiguo | Calificación más alta | Calificación más baja | Todos | Filtrar por: Todos | 1 estrella | 2 estrellas | 3 estrellas | 4 estrellas | 5 estrellas | No hay comentarios. | Evalúanos | Términos más buscados | 1. | celulares | 2. | neveras | 3. | iphone | 4. | lavadora | 5. | aire | 6. | televisores | 7. | estufa | 8. | colchon | 9. | cafe | 10. | nevera",Método de envío > 500 G,500.0,COP,,Desconocido,unknown,CO,Selecciona tu,Método de envío,,500 G,500.00,COP,,500,500.0,False,original,0.1235,0.1235,4047.0,from_colombia_cambio_dolar,,,,"+ | Especificaciones técnicas | Propiedad | Especificación | Tipo de Lácteo | Queso | Comentarios | ☆ | 0 Calificación promedio | (0 comentarios) | Por favor, inicia sesión para escribir un comentario. | Más reciente | Ordenar por: Más reciente | Más antiguo | Calificación más alta | Calificación más baja | Todos | Filtrar por: Todos | 1 estrella | 2 estrellas | 3 estrellas | 4 estrellas | 5 estrellas | No hay comentarios. | Evalúanos | Términos más buscados | 1. | celulares | 2. | neveras | 3. | iphone | 4. | lavadora | 5. | aire | 6. | televisores | 7. | estufa | 8. | colchon | 9. | cafe | 10. | nevera",,,,"{""Especificaciones"": [""+"", ""Especificaciones técnicas"", ""Propiedad"", ""Especificación"", ""Tipo de Lácteo"", ""Queso"", ""Comentarios"", ""☆"", ""0 Calificación promedio"", ""(0 comentarios)"", ""Por favor, inicia sesión para escribir un comentario."", ""Más reciente"", ""Ordenar por: Más reciente"", ""Más antiguo"", ""Calificación más alta"", ""Calificación más baja"", ""Todos"", ""Filtrar por: Todos"", ""1 estrella"", ""2 estrellas"", ""3 estrellas"", ""4 estrellas"", ""5 estrellas"", ""No hay comentarios."", ""Evalúanos"", ""Términos más buscados"", ""1."", ""celulares"", ""2."", ""neveras"", ""3."", ""iphone"", ""4."", ""lavadora"", ""5."", ""aire"", ""6."", ""televisores"", ""7."", ""estufa"", ""8."", ""colchon"", ""9."", ""cafe"", ""10."", ""nevera""]}",dataset/txt_limpios/737.txt,dataset/paginas_descargadas/737.html,EN,cafe,keep,0.60,heuristic_default
738,Selecciona tu,"+ | Especificaciones técnicas | Propiedad | Especificación | Tipo de Lácteo | Queso | Comentarios | ☆ | 0 Calificación promedio | (0 comentarios) | Por favor, inicia sesión para escribir un comentario. | Más reciente | Ordenar por: Más reciente | Más antiguo | Calificación más alta | Calificación más baja | Todos | Filtrar por: Todos | 1 estrella | 2 estrellas | 3 estrellas | 4 estrellas | 5 estrellas | No hay comentarios. | Evalúanos | Términos más buscados | 1. | celulares | 2. | neveras | 3. | iphone | 4. | lavadora | 5. | aire | 6. | televisores | 7. | estufa | 8. | colchon | 9. | cafe | 10. | nevera",Método de envío > 375 G,375.0,COP,,Desconocido,unknown,CO,Selecciona tu,Método de envío,,375 G,375.00,COP,,375,375.0,False,original,0.0927,0.0927,4047.0,from_colombia_cambio_dolar,,,,"+ | Especificaciones técnicas | Propiedad | Especificación | Tipo de Lácteo | Queso | Comentarios | ☆ | 0 Calificación promedio | (0 comentarios) | Por favor, inicia sesión para escribir un comentario. | Más reciente | Ordenar por: Más reciente | Más antiguo | Calificación más alta | Calificación más baja | Todos | Filtrar por: Todos | 1 estrella | 2 estrellas | 3 estrellas | 4 estrellas | 5 estrellas | No hay comentarios. | Evalúanos | Términos más buscados | 1. | celulares | 2. | neveras | 3. | iphone | 4. | lavadora | 5. | aire | 6. | televisores | 7. | estufa | 8. | colchon | 9. | cafe | 10. | nevera",,,,"{""Especificaciones"": [""+"", ""Especificaciones técnicas"", ""Propiedad"", ""Especificación"", ""Tipo de Lácteo"", ""Queso"", ""Comentarios"", ""☆"", ""0 Calificación promedio"", ""(0 comentarios)"", ""Por favor, inicia sesión para escribir un comentario."", ""Más reciente"", ""Ordenar por: Más reciente"", ""Más antiguo"", ""Calificación más alta"", ""Calificación más baja"", ""Todos"", ""Filtrar por: Todos"", ""1 estrella"", ""2 estrellas"", ""3 estrellas"", ""4 estrellas"", ""5 estrellas"", ""No hay comentarios."", ""Evalúanos"", ""Términos más buscados"", ""1."", ""celulares"", ""2."", ""neveras"", ""3."", ""iphone"", ""4."", ""lavadora"", ""5."", ""aire"", ""6."", ""televisores"", ""7."", ""estufa"", ""8."", ""colchon"", ""9."", ""cafe"", ""10."", ""nevera""]}",dataset/txt_limpios/738.txt,dataset/paginas_descargadas/738.html,EN,cafe,keep,0.60,heuristic_default
739,Selecciona tu,"+ | Especificaciones técnicas | Propiedad | Especificación | Comentarios | Cargando el resumen… | Por favor, inicia sesión para escribir un comentario. | Más reciente | Ordenar por: Más reciente | Más antiguo | Calificación más alta | Calificación más baja | Todos | Filtrar por: Todos | 1 estrella | 2 estrellas | 3 estrellas | 4 estrellas | 5 estrellas | Evalúanos",Método de envío > 210gr,210.0,COP,,Desconocido,unknown,CO,Selecciona tu,Método de envío,,210gr,210.00,COP,,210,210.0,False,original,0.0519,0.0519,4047.0,from_colombia_cambio_dolar,,,,"+ | Especificaciones técnicas | Propiedad | Especificación | Comentarios | Cargando el resumen… | Por favor, inicia sesión para escribir un comentario. | Más reciente | Ordenar por: Más reciente | Más antiguo | Calificación más alta | Calificación más baja | Todos | Filtrar por: Todos | 1 estrella | 2 estrellas | 3 estrellas | 4 estrellas | 5 estrellas | Evalúanos",,,,"{""Especificaciones"": [""+"", ""Especificaciones técnicas"", ""Propiedad"", ""Especificación"", ""Comentarios"", ""Cargando el resumen…"", ""Por favor, inicia sesión para escribir un comentario."", ""Más reciente"", ""Ordenar por: Más reciente"", ""Más antiguo"", ""Calificación más alta"", ""Calificación más baja"", ""Todos"", ""Filtrar por: Todos"", ""1 estrella"", ""2 estrellas"", ""3 estrellas"", ""4 estrellas"", ""5 estrellas"", ""Evalúanos""]}",dataset/txt_limpios/739.txt,dataset/paginas_descargadas/739.html,EN,sin_categoria,discard,0.30,no_category_detected
741,Selecciona tu,"+ | Especificaciones técnicas | Propiedad | Especificación | Tipo de Lácteo | No Aplica | Complementa tu elección | Pan Mauka de Sagú Tajado sin Gluten 450 G | 14 | 190 | El Dorado | Pasta El Dorado Coditos Lenteja 250 G | 250 Gramos | 8 | 950 | Boggy | Gelatina Boggy Premio de Mora 108 G | 3 | 220 | QUNNO | 53 Gramos | 197 | 10 | 450 | Lok | Miel de Abeja Lok Natural 500 G | 29 | 900 | Gelatina Boggy Premio de Fresa 108 G | Ver más | Avena | Nature’s Heart | Violife Mozzarella Flavour | Pan | Bebida | Te | Nature&#39;s Heart | Queso | Comentarios | ☆ | 0 | (0 comentarios) | Por favor, inicia sesión para escribir un comentario. | Más reciente | Ordenar por: Más reciente | Más antiguo | Calificación más alta | Calificación más baja | Todos | Filtrar por: Todos | 1 estrella | 2 estrellas | 3 estrellas | 4 estrellas | 5 estrellas | No hay comentarios. | Términos más buscados | 1. | celulares | 2. | neveras | 3. | iphone | 4. | lavadora | 5. | aire | 6. | televisores | 7. | estufa | 8. | colchon | 9. | cafe | 10. | nevera | Evalúanos",Método de envío > 200 G,200.0,COP,,Desconocido,unknown,CO,Selecciona tu,Método de envío,,200 G,200.00,COP,,200,200.0,False,original,0.0494,0.0494,4047.0,from_colombia_cambio_dolar,,,,"+ | Especificaciones técnicas | Propiedad | Especificación | Tipo de Lácteo | No Aplica | Complementa tu elección | Pan Mauka de Sagú Tajado sin Gluten 450 G | 14 | 190 | El Dorado | Pasta El Dorado Coditos Lenteja 250 G | 250 Gramos | 8 | 950 | Boggy | Gelatina Boggy Premio de Mora 108 G | 3 | 220 | QUNNO | 53 Gramos | 197 | 10 | 450 | Lok | Miel de Abeja Lok Natural 500 G | 29 | 900 | Gelatina Boggy Premio de Fresa 108 G | Ver más | Avena | Nature’s Heart | Violife Mozzarella Flavour | Pan | Bebida | Te | Nature&#39;s Heart | Queso | Comentarios | ☆ | 0 | (0 comentarios) | Por favor, inicia sesión para escribir un comentario. | Más reciente | Ordenar por: Más reciente | Más antiguo | Calificación más alta | Calificación más baja | Todos | Filtrar por: Todos | 1 estrella | 2 estrellas | 3 estrellas | 4 estrellas | 5 estrellas | No hay comentarios. | Términos más buscados | 1. | celulares | 2. | neveras | 3. | iphone | 4. | lavadora | 5. | aire | 6. | televisores | 7. | estufa | 8. | colchon | 9. | cafe | 10. | nevera | Evalúanos",,,,"{""Especificaciones"": [""+"", ""Especificaciones técnicas"", ""Propiedad"", ""Especificación"", ""Tipo de Lácteo"", ""No Aplica"", ""Complementa tu elección"", ""Pan Mauka de Sagú Tajado sin Gluten 450 G"", ""14"", ""190"", ""El Dorado"", ""Pasta El Dorado Coditos Lenteja 250 G"", ""250 Gramos"", ""8"", ""950"", ""Boggy"", ""Gelatina Boggy Premio de Mora 108 G"", ""3"", ""220"", ""QUNNO"", ""53 Gramos"", ""197"", ""10"", ""450"", ""Lok"", ""Miel de Abeja Lok Natural 500 G"", ""29"", ""900"", ""Gelatina Boggy Premio de Fresa 108 G"", ""Ver más"", ""Avena"", ""Nature’s Heart"", ""Violife Mozzarella Flavour"", ""Pan"", ""Bebida"", ""Te"", ""Nature&#39;s Heart"", ""Queso"", ""Comentarios"", ""☆"", ""0"", ""(0 comentarios)"", ""Por favor, inicia sesión para escribir un comentario."", ""Más reciente"", ""Ordenar por: Más reciente"", ""Más antiguo"", ""Calificación más alta"", ""Calificación más baja"", ""Todos"", ""Filtrar por: Todos"", ""1 estrella"", ""2 estrellas"", ""3 estrellas"", ""4 estrellas"", ""5 estrellas"", ""No hay comentarios."", ""Términos más buscados"", ""1."", ""celulares"", ""2."", ""neveras"", ""3."", ""iphone"", ""4."", ""lavadora"", ""5."", ""aire"", ""6."", ""televisores"", ""7."", ""estufa"", ""8."", ""colchon"", ""9."", ""cafe"", ""10."", ""nevera"", ""Evalúanos""]}",dataset/txt_limpios/741.txt,dataset/paginas_descargadas/741.html,EN,cafe,keep,0.60,heuristic_default
742,Selecciona tu,"+ | Especificaciones técnicas | Propiedad | Especificación | Tipo de Endulzantes | Azúcar Blanca | Ver más | Sustitutos del azúcar | Azúcar Blanca Riopaila | Azúcar blanco | Edulcorantes | Azúcar Riopaila Blanca | Azúcar | Comentarios | ☆ | 0 | (0 comentarios) | Por favor, inicia sesión para escribir un comentario. | Más reciente | Ordenar por: Más reciente | Más antiguo | Calificación más alta | Calificación más baja | Todos | Filtrar por: Todos | 1 estrella | 2 estrellas | 3 estrellas | 4 estrellas | 5 estrellas | No hay comentarios. | Términos más buscados | 1. | celulares | 2. | neveras | 3. | iphone | 4. | lavadora | 5. | aire | 6. | televisores | 7. | estufa | 8. | colchon | 9. | cafe | 10. | nevera | Evalúanos",Método de envío > 500 G,,COP,,Desconocido,unknown,CO,Selecciona tu,Método de envío,,500 G,,COP,,,97.32,True,category_country_mean,,0.024,4047.0,from_colombia_cambio_dolar,,,,"+ | Especificaciones técnicas | Propiedad | Especificación | Tipo de Endulzantes | Azúcar Blanca | Ver más | Sustitutos del azúcar | Azúcar Blanca Riopaila | Azúcar blanco | Edulcorantes | Azúcar Riopaila Blanca | Azúcar | Comentarios | ☆ | 0 | (0 comentarios) | Por favor, inicia sesión para escribir un comentario. | Más reciente | Ordenar por: Más reciente | Más antiguo | Calificación más alta | Calificación más baja | Todos | Filtrar por: Todos | 1 estrella | 2 estrellas | 3 estrellas | 4 estrellas | 5 estrellas | No hay comentarios. | Términos más buscados | 1. | celulares | 2. | neveras | 3. | iphone | 4. | lavadora | 5. | aire | 6. | televisores | 7. | estufa | 8. | colchon | 9. | cafe | 10. | nevera | Evalúanos",,,,"{""Especificaciones"": [""+"", ""Especificaciones técnicas"", ""Propiedad"", ""Especificación"", ""Tipo de Endulzantes"", ""Azúcar Blanca"", ""Ver más"", ""Sustitutos del azúcar"", ""Azúcar Blanca Riopaila"", ""Azúcar blanco"", ""Edulcorantes"", ""Azúcar Riopaila Blanca"", ""Azúcar"", ""Comentarios"", ""☆"", ""0"", ""(0 comentarios)"", ""Por favor, inicia sesión para escribir un comentario."", ""Más reciente"", ""Ordenar por: Más reciente"", ""Más antiguo"", ""Calificación más alta"", ""Calificación más baja"", ""Todos"", ""Filtrar por: Todos"", ""1 estrella"", ""2 estrellas"", ""3 estrellas"", ""4 estrellas"", ""5 estrellas"", ""No hay comentarios."", ""Términos más buscados"", ""1."", ""celulares"", ""2."", ""neveras"", ""3."", ""iphone"", ""4."", ""lavadora"", ""5."", ""aire"", ""6."", ""televisores"", ""7."", ""estufa"", ""8."", ""colchon"", ""9."", ""cafe"", ""10."", ""nevera"", ""Evalúanos""]}",dataset/txt_limpios/742.txt,dataset/paginas_descargadas/742.html,EN,cafe,discard,0.60,price_parse_failed;price<=0
743,Selecciona tu,"+ | Especificaciones técnicas | Propiedad | Especificación | Tipo de Endulzantes | Azúcar Blanca | Ver más | Azúcar Manuelita | Sustitutos del azúcar | Manuelita Azúcar Blanca Alta Pureza | Azúcar | Edulcorantes | Comentarios | ☆ | 0 Calificación promedio | (0 comentarios) | Por favor, inicia sesión para escribir un comentario. | Más reciente | Ordenar por: Más reciente | Más antiguo | Calificación más alta | Calificación más baja | Todos | Filtrar por: Todos | 1 estrella | 2 estrellas | 3 estrellas | 4 estrellas | 5 estrellas | No hay comentarios. | Evalúanos | Términos más buscados | 1. | celulares | 2. | neveras | 3. | iphone | 4. | lavadora | 5. | aire | 6. | televisores | 7. | estufa | 8. | colchon | 9. | cafe | 10. | nevera",Método de envío > 1 Kg,,COP,,Desconocido,unknown,CO,Selecciona tu,Método de envío,,1 Kg,,COP,,,97.32,True,category_country_mean,,0.024,4047.0,from_colombia_cambio_dolar,,,,"+ | Especificaciones técnicas | Propiedad | Especificación | Tipo de Endulzantes | Azúcar Blanca | Ver más | Azúcar Manuelita | Sustitutos del azúcar | Manuelita Azúcar Blanca Alta Pureza | Azúcar | Edulcorantes | Comentarios | ☆ | 0 Calificación promedio | (0 comentarios) | Por favor, inicia sesión para escribir un comentario. | Más reciente | Ordenar por: Más reciente | Más antiguo | Calificación más alta | Calificación más baja | Todos | Filtrar por: Todos | 1 estrella | 2 estrellas | 3 estrellas | 4 estrellas | 5 estrellas | No hay comentarios. | Evalúanos | Términos más buscados | 1. | celulares | 2. | neveras | 3. | iphone | 4. | lavadora | 5. | aire | 6. | televisores | 7. | estufa | 8. | colchon | 9. | cafe | 10. | nevera",,,,"{""Especificaciones"": [""+"", ""Especificaciones técnicas"", ""Propiedad"", ""Especificación"", ""Tipo de Endulzantes"", ""Azúcar Blanca"", ""Ver más"", ""Azúcar Manuelita"", ""Sustitutos del azúcar"", ""Manuelita Azúcar Blanca Alta Pureza"", ""Azúcar"", ""Edulcorantes"", ""Comentarios"", ""☆"", ""0 Calificación promedio"", ""(0 comentarios)"", ""Por favor, inicia sesión para escribir un comentario."", ""Más reciente"", ""Ordenar por: Más reciente"", ""Más antiguo"", ""Calificación más alta"", ""Calificación más baja"", ""Todos"", ""Filtrar por: Todos"", ""1 estrella"", ""2 estrellas"", ""3 estrellas"", ""4 estrellas"", ""5 estrellas"", ""No hay comentarios."", ""Evalúanos"", ""Términos más buscados"", ""1."", ""celulares"", ""2."", ""neveras"", ""3."", ""iphone"", ""4."", ""lavadora"", ""5."", ""aire"", ""6."", ""televisores"", ""7."", ""estufa"", ""8."", ""colchon"", ""9."", ""cafe"", ""10."", ""nevera""]}",dataset/txt_limpios/743.txt,dataset/paginas_descargadas/743.html,EN,cafe,discard,0.60,price_parse_failed;price<=0
744,Selecciona tu,"+ | Especificaciones técnicas | Propiedad | Especificación | Tipo de Endulzantes | Azúcar Blanca | Ver más | Feria de cocina | Ofertas tecnología descuentos | Viajar Olímpica destinos baratos | Comprar productos supermercado | Comentarios | Cargando el resumen… | Por favor, inicia sesión para escribir un comentario. | Más reciente | Ordenar por: Más reciente | Más antiguo | Calificación más alta | Calificación más baja | Todos | Filtrar por: Todos | 1 estrella | 2 estrellas | 3 estrellas | 4 estrellas | 5 estrellas | Evalúanos",Método de envío > 1 Kg,,COP,,Desconocido,unknown,CO,Selecciona tu,Método de envío,,1 Kg,,COP,,,604582.9,True,category_mean,,149.3904,4047.0,from_colombia_cambio_dolar,,,,"+ | Especificaciones técnicas | Propiedad | Especificación | Tipo de Endulzantes | Azúcar Blanca | Ver más | Feria de cocina | Ofertas tecnología descuentos | Viajar Olímpica destinos baratos | Comprar productos supermercado | Comentarios | Cargando el resumen… | Por favor, inicia sesión para escribir un comentario. | Más reciente | Ordenar por: Más reciente | Más antiguo | Calificación más alta | Calificación más baja | Todos | Filtrar por: Todos | 1 estrella | 2 estrellas | 3 estrellas | 4 estrellas | 5 estrellas | Evalúanos",,,,"{""Especificaciones"": [""+"", ""Especificaciones técnicas"", ""Propiedad"", ""Especificación"", ""Tipo de Endulzantes"", ""Azúcar Blanca"", ""Ver más"", ""Feria de cocina"", ""Ofertas tecnología descuentos"", ""Viajar Olímpica destinos baratos"", ""Comprar productos supermercado"", ""Comentarios"", ""Cargando el resumen…"", ""Por favor, inicia sesión para escribir un comentario."", ""Más reciente"", ""Ordenar por: Más reciente"", ""Más antiguo"", ""Calificación más alta"", ""Calificación más baja"", ""Todos"", ""Filtrar por: Todos"", ""1 estrella"", ""2 estrellas"", ""3 estrellas"", ""4 estrellas"", ""5 estrellas"", ""Evalúanos""]}",dataset/txt_limpios/744.txt,dataset/paginas_descargadas/744.html,EN,azucar,discard,0.60,price_parse_failed;price<=0
