{"source_id": "586", "title": "DALE VIDA A TU JARDIN", "description": "Datos técnicos Descripción del producto El pan Lactal es nuestro pan clásico que acompaña tu mesa desde hace pero de 100 años. ¡Suscribite a nuestro boletín! Recibí las ofertas y novedades en tu correo. Suscribirme Seguridad y confianza © Libertad 2023. Todos los derechos reservados. Términos y Condiciones Direcciôn General de Defensa y protecciôn al Consumidor, para consultas y/o denuncias ingresa a los Términos más buscados 1. leche 2. cerveza 3. aceptada 4. yerba 5. cafe 6. pañales 7. queso 8. arroz 9. fideos 10. fernet", "breadcrumbs": "🌷🌻​🌼​ > 560g", "price_raw": "4693.39", "currency_raw": "ARS", "url": "", "seller": "Desconocido", "availability": "unknown", "country": "AR", "product_name": "DALE VIDA A TU JARDIN", "brand": "🌷🌻​🌼​", "reference": "", "unit": "560g", "price_amount": 4693.39, "price_currency": "ARS", "price_symbol": "$", "price_text": "$4.693,39", "price_amount_filled": "4693.39", "price_is_imputed": "False", "price_imputation_source": "original", "price_amount_usd": "3.7398", "price_amount_usd_filled": "3.7398", "fx_rate_local_per_usd": "1255.0", "fx_source": "from_argentina_cambio_dolar", "information_text": "", "description_text": "Datos técnicos Descripción del producto El pan Lactal es nuestro pan clásico que acompaña tu mesa desde hace pero de 100 años. ¡Suscribite a nuestro boletín! Recibí las ofertas y novedades en tu correo. Suscribirme Seguridad y confianza © Libertad 2023. Todos los derechos reservados. Términos y Condiciones Direcciôn General de Defensa y protecciôn al Consumidor, para consultas y/o denuncias ingresa a los Términos más buscados 1. leche 2. cerveza 3. aceptada 4. yerba 5. cafe 6. pañales 7. queso 8. arroz 9. fideos 10. fernet", "features_text": "", "specifications_text": "", "benefits_text": "", "details_text": "", "other_sections": "", "sections": {"Descripción": ["Datos técnicos", "Descripción del producto", "El pan Lactal es nuestro pan clásico que acompaña tu mesa desde hace pero de 100 años.", "¡Suscribite a nuestro newsletter!", "Recibí las ofertas y novedades en tu correo.", "Suscribirme", "Seguridad y confianza", "© Libertad 2023. Todos los derechos reservados.", "Términos y Condiciones", "Dirección General de Defensa y Protección al Consumidor para consultas y/o denuncias", "introduzca aquí", "Términos más buscados", "1.", "leche", "2.", "cerveza", "3.", "aceite", "4.", "yerba", "5.", "cafe", "6.", "pañales", "7.", "queso", "8.", "arroz", "9.", "fideos", "10.", "fernet"]}, "txt_path": "dataset/txt_limpios/586.txt", "html_path": "dataset/paginas_descargadas/586.html", "es_status": "ET", "category_canonical": "cafe", "decision": "keep", "match_score": 0.6, "reasons": "heuristic_default"}
{"source_id": "587", "title": "DALE VIDA A TU JARDIN", "description": "Datos técnicos Descripción del producto ¡Suscribite a nuestro boletín! Recibí las ofertas y novedades en tu correo. Suscribirme Seguridad y confianza © Libertad 2023. Todos los derechos reservados. Términos y Condiciones Direcciôn General de Defensa y protecciôn al Consumidor, para consultas y/o denuncias ingresa a los Términos más buscados 1. leche 2. cerveza 3. aceptada 4. yerba 5. cafe 6. pañales 7. queso 8. arroz 9. fideos 10. fernet", "breadcrumbs": "🌷🌻​🌼​ > 600 Gr", "price_raw": "2652.07", "currency_raw": "ARS", "url": "", "seller": "Desconocido", "availability": "unknown", "country": "AR", "product_name": "DALE VIDA A TU JARDIN", "brand": "🌷🌻​🌼​", "reference": "", "unit": "600 Gr", "price_amount": 2652.07, "price_currency": "ARS", "price_symbol": "$", "price_text": "$2.652,07", "price_amount_filled": "2652.07", "price_is_imputed": "False", "price_imputation_source": "original", "price_amount_usd": "2.1132", "price_amount_usd_filled": "2.1132", "fx_rate_local_per_usd": "1255.0", "fx_source": "from_argentina_cambio_dolar", "information_text": "", "description_text": "Datos técnicos Descripción del producto ¡Suscribite a nuestro boletín! Recibí las ofertas y novedades en tu correo. Suscribirme Seguridad y confianza © Libertad 2023. Todos los derechos reservados. Términos y Condiciones Direcciôn General de Defensa y protecciôn al Consumidor, para consultas y/o denuncias ingresa a los Términos más buscados 1. leche 2. cerveza 3. aceptada 4. yerba 5. cafe 6. pañales 7. queso 8. arroz 9. fideos 10. fernet", "features_text": "", "specifications_text": "", "benefits_text": "", "details_text": "", "other_sections": "", "sections": {"Descripción": ["Datos técnicos", "Descripción del producto", "¡Suscribite a nuestro newsletter!", "Recibí las ofertas y novedades en tu correo.", "Suscribirme", "Seguridad y confianza", "© Libertad 2023. Todos los derechos reservados.", "Términos y Condiciones", "Dirección General de Defensa y Protección al Consumidor para consultas y/o denuncias", "introduzca aquí", "Términos más buscados", "1.", "leche", "2.", "cerveza", "3.", "aceite", "4.", "yerba", "5.", "cafe", "6.", "pañales", "7.", "queso", "8.", "arroz", "9.", "fideos", "10.", "fernet"]}, "txt_path": "dataset/txt_limpios/587.txt", "html_path": "dataset/paginas_descargadas/587.html", "es_status": "ET", "category_canonical": "cafe", "decision": "keep", "match_score": 0.6, "reasons": "heuristic_default"}
{"source_id": "588", "title": "DALE VIDA A TU JARDIN", "description": "Datos técnicos Descripción del producto ¡Suscribite a nuestro boletín! Recibí las ofertas y novedades en tu correo. Suscribirme Seguridad y confianza © Libertad 2023. Todos los derechos reservados. Términos y Condiciones Direcciôn General de Defensa y protecciôn al Consumidor, para consultas y/o denuncias ingresa a los Términos más buscados 1. leche 2. cerveza 3. aceptada 4. yerba 5. cafe 6. pañales 7. queso 8. arroz 9. fideos 10. fernet", "breadcrumbs": "🌷🌻​🌼​ > 500 G", "price_raw": "1561.98", "currency_raw": "ARS", "url": "", "seller": "Desconocido", "availability": "unknown", "country": "AR", "product_name": "DALE VIDA A TU JARDIN", "brand": "🌷🌻​🌼​", "reference": "", "unit": "500 G", "price_amount": 1561.98, "price_currency": "ARS", "price_symbol": "$", "price_text": "$1.561,98", "price_amount_filled": "1561.98", "price_is_imputed": "False", "price_imputation_source": "original", "price_amount_usd": "1.2446", "price_amount_usd_filled": "1.2446", "fx_rate_local_per_usd": "1255.0", "fx_source": "from_argentina_cambio_dolar", "information_text": "", "description_text": "Datos técnicos Descripción del producto ¡Suscribite a nuestro boletín! Recibí las ofertas y novedades en tu correo. Suscribirme Seguridad y confianza © Libertad 2023. Todos los derechos reservados. Términos y Condiciones Direcciôn General de Defensa y protecciôn al Consumidor, para consultas y/o denuncias ingresa a los Términos más buscados 1. leche 2. cerveza 3. aceptada 4. yerba 5. cafe 6. pañales 7. queso 8. arroz 9. fideos 10. fernet", "features_text": "", "specifications_text": "", "benefits_text": "", "details_text": "", "other_sections": "", "sections": {"Descripción": ["Datos técnicos", "Descripción del producto", "¡Suscribite a nuestro newsletter!", "Recibí las ofertas y novedades en tu correo.", "Suscribirme", "Seguridad y confianza", "© Libertad 2023. Todos los derechos reservados.", "Términos y Condiciones", "Dirección General de Defensa y Protección al Consumidor para consultas y/o denuncias", "introduzca aquí", "Términos más buscados", "1.", "leche", "2.", "cerveza", "3.", "aceite", "4.", "yerba", "5.", "cafe", "6.", "pañales", "7.", "queso", "8.", "arroz", "9.", "fideos", "10.", "fernet"]}, "txt_path": "dataset/txt_limpios/588.txt", "html_path": "dataset/paginas_descargadas/588.html", "es_status": "ET", "category_canonical": "cafe", "decision": "keep", "match_score": 0.6, "reasons": "heuristic_default"}
{"source_id": "589", "title": "DALE VIDA A TU JARDIN", "description": "Datos técnicos Descripción del producto ¡Suscribite a nuestro boletín! Recibí las ofertas y novedades en tu correo. Suscribirme Seguridad y confianza © Libertad 2023. Todos los derechos reservados. Términos y Condiciones Direcciôn General de Defensa y protecciôn al Consumidor, para consultas y/o denuncias ingresa a los Términos más buscados 1. leche 2. cerveza 3. aceptada 4. yerba 5. cafe 6. pañales 7. queso 8. arroz 9. fideos 10. fernet", "breadcrumbs": "🌷🌻​🌼​", "price_raw": "1090.08", "currency_raw": "ARS", "url": "", "seller": "Desconocido", "availability": "unknown", "country": "AR", "product_name": "DALE VIDA A TU JARDIN", "brand": "🌷🌻​🌼​", "reference": "", "unit": "", "price_amount": 1090.08, "price_currency": "ARS", "price_symbol": "$", "price_text": "$1.090,08", "price_amount_filled": "1090.08", "price_is_imputed": "False", "price_imputation_source": "original", "price_amount_usd": "0.8686", "price_amount_usd_filled": "0.8686", "fx_rate_local_per_usd": "1255.0", "fx_source": "from_argentina_cambio_dolar", "information_text": "", "description_text": "Datos técnicos Descripción del producto ¡Suscribite a nuestro boletín! Recibí las ofertas y novedades en tu correo. Suscribirme Seguridad y confianza © Libertad 2023. Todos los derechos reservados. Términos y Condiciones Direcciôn General de Defensa y protecciôn al Consumidor, para consultas y/o denuncias ingresa a los Términos más buscados 1. leche 2. cerveza 3. aceptada 4. yerba 5. cafe 6. pañales 7. queso 8. arroz 9. fideos 10. fernet", "features_text": "", "specifications_text": "", "benefits_text": "", "details_text": "", "other_sections": "", "sections": {"Descripción": ["Datos técnicos", "Descripción del producto", "¡Suscribite a nuestro newsletter!", "Recibí las ofertas y novedades en tu correo.", "Suscribirme", "Seguridad y confianza", "© Libertad 2023. Todos los derechos reservados.", "Términos y Condiciones", "Dirección General de Defensa y Protección al Consumidor para consultas y/o denuncias", "introduzca aquí", "Términos más buscados", "1.", "leche", "2.", "cerveza", "3.", "aceite", "4.", "yerba", "5.", "cafe", "6.", "pañales", "7.", "queso", "8.", "arroz", "9.", "fideos", "10.", "fernet"]}, "txt_path": "dataset/txt_limpios/589.txt", "html_path": "dataset/paginas_descargadas/589.html", "es_status": "ET", "category_canonical": "cafe", "decision": "keep", "match_score": 0.6, "reasons": "heuristic_default"}
{"source_id": "590", "title": "DALE VIDA A TU JARDIN", "description": "Datos técnicos Descripción del producto ¡Suscribite a nuestro boletín! Recibí las ofertas y novedades en tu correo. Suscribirme Seguridad y confianza © Libertad 2023. Todos los derechos reservados. Términos y Condiciones Direcciôn General de Defensa y protecciôn al Consumidor, para consultas y/o denuncias ingresa a los Términos más buscados 1. leche 2. cerveza 3. aceptada 4. yerba 5. cafe 6. pañales 7. queso 8. arroz 9. fideos 10. fernet", "breadcrumbs": "🌷🌻​🌼​", "price_raw": "718.18", "currency_raw": "ARS", "url": "", "seller": "Desconocido", "availability": "unknown", "country": "AR", "product_name": "DALE VIDA A TU JARDIN", "brand": "🌷🌻​🌼​", "reference": "", "unit": "", "price_amount": 718.18, "price_currency": "ARS", "price_symbol": "$", "price_text": "$718,18", "price_amount_filled": "718.18", "price_is_imputed": "False", "price_imputation_source": "original", "price_amount_usd": "0.5723", "price_amount_usd_filled": "0.5723", "fx_rate_local_per_usd": "1255.0", "fx_source": "from_argentina_cambio_dolar", "information_text": "", "description_text": "Datos técnicos Descripción del producto ¡Suscribite a nuestro boletín! Recibí las ofertas y novedades en tu correo. Suscribirme Seguridad y confianza © Libertad 2023. Todos los derechos reservados. Términos y Condiciones Direcciôn General de Defensa y protecciôn al Consumidor, para consultas y/o denuncias ingresa a los Términos más buscados 1. leche 2. cerveza 3. aceptada 4. yerba 5. cafe 6. pañales 7. queso 8. arroz 9. fideos 10. fernet", "features_text": "", "specifications_text": "", "benefits_text": "", "details_text": "", "other_sections": "", "sections": {"Descripción": ["Datos técnicos", "Descripción del producto", "¡Suscribite a nuestro newsletter!", "Recibí las ofertas y novedades en tu correo.", "Suscribirme", "Seguridad y confianza", "© Libertad 2023. Todos los derechos reservados.", "Términos y Condiciones", "Dirección General de Defensa y Protección al Consumidor para consultas y/o denuncias", "introduzca aquí", "Términos más buscados", "1.", "leche", "2.", "cerveza", "3.", "aceite", "4.", "yerba", "5.", "cafe", "6.", "pañales", "7.", "queso", "8.", "arroz", "9.", "fideos", "10.", "fernet"]}, "txt_path": "dataset/txt_limpios/590.txt", "html_path": "dataset/paginas_descargadas/590.html", "es_status": "ET", "category_canonical": "cafe", "decision": "keep", "match_score": 0.6, "reasons": "heuristic_default"}
{"source_id": "591", "title": "DALE VIDA A TU JARDIN", "description": "Datos técnicos Descripción del producto ¡Suscribite a nuestro boletín! Recibí las ofertas y novedades en tu correo. Suscribirme Seguridad y confianza © Libertad 2023. Todos los derechos reservados. Términos y Condiciones Direcciôn General de Defensa y protecciôn al Consumidor, para consultas y/o denuncias ingresa a los Términos más buscados 1. leche 2. cerveza 3. aceptada 4. yerba 5. cafe 6. pañales 7. queso 8. arroz 9. fideos 10. fernet", "breadcrumbs": "🌷🌻​🌼​", "price_raw": "990.91", "currency_raw": "ARS", "url": "", "seller": "Desconocido", "availability": "unknown", "country": "AR", "product_name": "DALE VIDA A TU JARDIN", "brand": "🌷🌻​🌼​", "reference": "", "unit": "", "price_amount": 990.91, "price_currency": "ARS", "price_symbol": "$", "price_text": "$990,91", "price_amount_filled": "990.91", "price_is_imputed": "False", "price_imputation_source": "original", "price_amount_usd": "0.7896", "price_amount_usd_filled": "0.7896", "fx_rate_local_per_usd": "1255.0", "fx_source": "from_argentina_cambio_dolar", "information_text": "", "description_text": "Datos técnicos Descripción del producto ¡Suscribite a nuestro boletín! Recibí las ofertas y novedades en tu correo. Suscribirme Seguridad y confianza © Libertad 2023. Todos los derechos reservados. Términos y Condiciones Direcciôn General de Defensa y protecciôn al Consumidor, para consultas y/o denuncias ingresa a los Términos más buscados 1. leche 2. cerveza 3. aceptada 4. yerba 5. cafe 6. pañales 7. queso 8. arroz 9. fideos 10. fernet", "features_text": "", "specifications_text": "", "benefits_text": "", "details_text": "", "other_sections": "", "sections": {"Descripción": ["Datos técnicos", "Descripción del producto", "¡Suscribite a nuestro newsletter!", "Recibí las ofertas y novedades en tu correo.", "Suscribirme", "Seguridad y confianza", "© Libertad 2023. Todos los derechos reservados.", "Términos y Condiciones", "Dirección General de Defensa y Protección al Consumidor para consultas y/o denuncias", "introduzca aquí", "Términos más buscados", "1.", "leche", "2.", "cerveza", "3.", "aceite", "4.", "yerba", "5.", "cafe", "6.", "pañales", "7.", "queso", "8.", "arroz", "9.", "fideos", "10.", "fernet"]}, "txt_path": "dataset/txt_limpios/591.txt", "html_path": "dataset/paginas_descargadas/591.html", "es_status": "ET", "category_canonical": "cafe", "decision": "keep", "match_score": 0.6, "reasons": "heuristic_default"}
{"source_id": "592", "title": "DALE VIDA A TU JARDIN", "description": "Datos técnicos Descripción del producto ¡Suscribite a nuestro boletín! Recibí las ofertas y novedades en tu correo. Suscribirme Seguridad y confianza © Libertad 2023. Todos los derechos reservados. Términos y Condiciones Direcciôn General de Defensa y protecciôn al Consumidor, para consultas y/o denuncias ingresa a los Términos más buscados 1. leche 2. cerveza 3. aceptada 4. yerba 5. cafe 6. pañales 7. queso 8. arroz 9. fideos 10. fernet", "breadcrumbs": "🌷🌻​🌼​", "price_raw": "726.45", "currency_raw": "ARS", "url": "", "seller": "Desconocido", "availability": "unknown", "country": "AR", "product_name": "DALE VIDA A TU JARDIN", "brand": "🌷🌻​🌼​", "reference": "", "unit": "", "price_amount": 726.45, "price_currency": "ARS", "price_symbol": "$", "price_text": "$726,45", "price_amount_filled": "726.45", "price_is_imputed": "False", "price_imputation_source": "original", "price_amount_usd": "0.5788", "price_amount_usd_filled": "0.5788", "fx_rate_local_per_usd": "1255.0", "fx_source": "from_argentina_cambio_dolar", "information_text": "", "description_text": "Datos técnicos Descripción del producto ¡Suscribite a nuestro boletín! Recibí las ofertas y novedades en tu correo. Suscribirme Seguridad y confianza © Libertad 2023. Todos los derechos reservados. Términos y Condiciones Direcciôn General de Defensa y protecciôn al Consumidor, para consultas y/o denuncias ingresa a los Términos más buscados 1. leche 2. cerveza 3. aceptada 4. yerba 5. cafe 6. pañales 7. queso 8. arroz 9. fideos 10. fernet", "features_text": "", "specifications_text": "", "benefits_text": "", "details_text": "", "other_sections": "", "sections": {"Descripción": ["Datos técnicos", "Descripción del producto", "¡Suscribite a nuestro newsletter!", "Recibí las ofertas y novedades en tu correo.", "Suscribirme", "Seguridad y confianza", "© Libertad 2023. Todos los derechos reservados.", "Términos y Condiciones", "Dirección General de Defensa y Protección al Consumidor para consultas y/o denuncias", "introduzca aquí", "Términos más buscados", "1.", "leche", "2.", "cerveza", "3.", "aceite", "4.", "yerba", "5.", "cafe", "6.", "pañales", "7.", "queso", "8.", "arroz", "9.", "fideos", "10.", "fernet"]}, "txt_path": "dataset/txt_limpios/592.txt", "html_path": "dataset/paginas_descargadas/592.html", "es_status": "ET", "category_canonical": "cafe", "decision": "keep", "match_score": 0.6, "reasons": "heuristic_default"}
{"source_id": "593", "title": "DALE VIDA A TU JARDIN", "description": "Datos técnicos Descripción del producto ¡Suscribite a nuestro boletín! Recibí las ofertas y novedades en tu correo. Suscribirme Seguridad y confianza © Libertad 2023. Todos los derechos reservados. Términos y Condiciones Direcciôn General de Defensa y protecciôn al Consumidor, para consultas y/o denuncias ingresa a los Términos más buscados 1. leche 2. cerveza 3. aceptada 4. yerba 5. cafe 6. pañales 7. queso 8. arroz 9. fideos 10. fernet", "breadcrumbs": "🌷🌻​🌼​ > 500G", "price_raw": "742.98", "currency_raw": "ARS", "url": "", "seller": "Desconocido", "availability": "unknown", "country": "AR", "product_name": "DALE VIDA A TU JARDIN", "brand": "🌷🌻​🌼​", "reference": "", "unit": "500G", "price_amount": 742.98, "price_currency": "ARS", "price_symbol": "$", "price_text": "$742,98", "price_amount_filled": "742.98", "price_is_imputed": "False", "price_imputation_source": "original", "price_amount_usd": "0.592", "price_amount_usd_filled": "0.592", "fx_rate_local_per_usd": "1255.0", "fx_source": "from_argentina_cambio_dolar", "information_text": "", "description_text": "Datos técnicos Descripción del producto ¡Suscribite a nuestro boletín! Recibí las ofertas y novedades en tu correo. Suscribirme Seguridad y confianza © Libertad 2023. Todos los derechos reservados. Términos y Condiciones Direcciôn General de Defensa y protecciôn al Consumidor, para consultas y/o denuncias ingresa a los Términos más buscados 1. leche 2. cerveza 3. aceptada 4. yerba 5. cafe 6. pañales 7. queso 8. arroz 9. fideos 10. fernet", "features_text": "", "specifications_text": "", "benefits_text": "", "details_text": "", "other_sections": "", "sections": {"Descripción": ["Datos técnicos", "Descripción del producto", "¡Suscribite a nuestro newsletter!", "Recibí las ofertas y novedades en tu correo.", "Suscribirme", "Seguridad y confianza", "© Libertad 2023. Todos los derechos reservados.", "Términos y Condiciones", "Dirección General de Defensa y Protección al Consumidor para consultas y/o denuncias", "introduzca aquí", "Términos más buscados", "1.", "leche", "2.", "cerveza", "3.", "aceite", "4.", "yerba", "5.", "cafe", "6.", "pañales", "7.", "queso", "8.", "arroz", "9.", "fideos", "10.", "fernet"]}, "txt_path": "dataset/txt_limpios/593.txt", "html_path": "dataset/paginas_descargadas/593.html", "es_status": "ET", "category_canonical": "cafe", "decision": "keep", "match_score": 0.6, "reasons": "heuristic_default"}
