source_id,title,description,breadcrumbs,price_raw,currency_raw,url,seller,availability,country,product_name,brand,reference,unit,price_amount,price_currency,price_symbol,price_text,price_amount_filled,price_is_imputed,price_imputation_source,price_amount_usd,price_amount_usd_filled,fx_rate_local_per_usd,fx_source,information_text,description_text,features_text,specifications_text,benefits_text,details_text,other_sections,sections,txt_path,html_path,es_status,category_canonical,decision,match_score,reasons
408,Meu Desconto,,Minha Lista > 1kg,28.9,BRL,,Desconocido,unknown,BR,Meu Desconto,Minha Lista,,1kg,28.90,BRL,R$,"R$28,90",28.9,False,original,5.3047,5.3047,5.448,from_brasil_cambio_dolar,,,,,,,,{},dataset/txt_limpios/408.txt,dataset/paginas_descargadas/408.html,EN,sin_categoria,discard,0.30,no_category_detected
409,Meu Desconto,,Minha Lista > 1kg,1.0,,,Desconocido,unknown,UNKNOWN,Meu Desconto,Minha Lista,,1kg,1.00,,,1,1.0,False,original,1.0,1.0,1.0,default_1usd,,,,,,,,{},dataset/txt_limpios/409.txt,dataset/paginas_descargadas/409.html,EN,sin_categoria,discard,0.30,no_category_detected
410,Meu Desconto,,Minha Lista > 800g,21.9,BRL,,Desconocido,unknown,BR,Meu Desconto,Minha Lista,,800g,21.90,BRL,R$,"R$21,90",21.9,False,original,4.0198,4.0198,5.448,from_brasil_cambio_dolar,,,,,,,,{},dataset/txt_limpios/410.txt,dataset/paginas_descargadas/410.html,EN,sin_categoria,discard,0.30,no_category_detected
411,Meu Desconto,,Minha Lista > 1kg,22.9,BRL,,Desconocido,unknown,BR,Meu Desconto,Minha Lista,,1kg,22.90,BRL,R$,"R$22,90",22.9,False,original,4.2034,4.2034,5.448,from_brasil_cambio_dolar,,,,,,,,{},dataset/txt_limpios/411.txt,dataset/paginas_descargadas/411.html,EN,sin_categoria,discard,0.30,no_category_detected
413,Meu Desconto,,Minha Lista > 1kg,5.09,BRL,,Desconocido,unknown,BR,Meu Desconto,Minha Lista,,1kg,5.09,BRL,R$,"R$5,09",5.09,False,original,0.9343,0.9343,5.448,from_brasil_cambio_dolar,,,,,,,,{},dataset/txt_limpios/413.txt,dataset/paginas_descargadas/413.html,EN,sin_categoria,discard,0.30,no_category_detected
414,Meu Desconto,,Minha Lista > 1Kg,1.0,,,Desconocido,unknown,UNKNOWN,Meu Desconto,Minha Lista,,1Kg,1.00,,,1,1.0,False,original,1.0,1.0,1.0,default_1usd,,,,,,,,{},dataset/txt_limpios/414.txt,dataset/paginas_descargadas/414.html,EN,sin_categoria,discard,0.30,no_category_detected
415,Meu Desconto,,Minha Lista > 1Kg,4.29,BRL,,Desconocido,unknown,BR,Meu Desconto,Minha Lista,,1Kg,4.29,BRL,R$,"R$4,29",4.29,False,original,0.7874,0.7874,5.448,from_brasil_cambio_dolar,,,,,,,,{},dataset/txt_limpios/415.txt,dataset/paginas_descargadas/415.html,EN,sin_categoria,discard,0.30,no_category_detected
416,Meu Desconto,,Minha Lista > 1kg,4.79,BRL,,Desconocido,unknown,BR,Meu Desconto,Minha Lista,,1kg,4.79,BRL,R$,"R$4,79",4.79,False,original,0.8792,0.8792,5.448,from_brasil_cambio_dolar,,,,,,,,{},dataset/txt_limpios/416.txt,dataset/paginas_descargadas/416.html,EN,sin_categoria,discard,0.30,no_category_detected
417,Meu Desconto,,Minha Lista > 1kg,7.39,BRL,,Desconocido,unknown,BR,Meu Desconto,Minha Lista,,1kg,7.39,BRL,R$,"R$7,39",7.39,False,original,1.3565,1.3565,5.448,from_brasil_cambio_dolar,,,,,,,,{},dataset/txt_limpios/417.txt,dataset/paginas_descargadas/417.html,EN,sin_categoria,discard,0.30,no_category_detected
418,Meu Desconto,,Minha Lista > 1Kg,6.39,BRL,,Desconocido,unknown,BR,Meu Desconto,Minha Lista,,1Kg,6.39,BRL,R$,"R$6,39",6.39,False,original,1.1729,1.1729,5.448,from_brasil_cambio_dolar,,,,,,,,{},dataset/txt_limpios/418.txt,dataset/paginas_descargadas/418.html,EN,sin_categoria,discard,0.30,no_category_detected
419,Meu Desconto,,Minha Lista > 1kg,5.29,BRL,,Desconocido,unknown,BR,Meu Desconto,Minha Lista,,1kg,5.29,BRL,R$,"R$5,29",5.29,False,original,0.971,0.971,5.448,from_brasil_cambio_dolar,,,,,,,,{},dataset/txt_limpios/419.txt,dataset/paginas_descargadas/419.html,EN,sin_categoria,discard,0.30,no_category_detected
420,Meu Desconto,,Minha Lista > 1kg,1.0,,,Desconocido,unknown,UNKNOWN,Meu Desconto,Minha Lista,,1kg,1.00,,,1,1.0,False,original,1.0,1.0,1.0,default_1usd,,,,,,,,{},dataset/txt_limpios/420.txt,dataset/paginas_descargadas/420.html,EN,sin_categoria,discard,0.30,no_category_detected
421,Meu Desconto,,Minha Lista > 1kg,5.09,BRL,,Desconocido,unknown,BR,Meu Desconto,Minha Lista,,1kg,5.09,BRL,R$,"R$5,09",5.09,False,original,0.9343,0.9343,5.448,from_brasil_cambio_dolar,,,,,,,,{},dataset/txt_limpios/421.txt,dataset/paginas_descargadas/421.html,EN,sin_categoria,discard,0.30,no_category_detected
42,Mis listas,,Mis pedidos > 907 g,,MXN,,Desconocido,unknown,MX,Mis listas,Mis pedidos,,907 g,,MXN,,,66.32,True,country_mean,,3.5617,18.62,from_mexico_cambio_dolar,,,,,,,,{},dataset/txt_limpios/42.txt,dataset/paginas_descargadas/42.html,EN,sin_categoria,discard,0.30,no_category_detected;price_parse_failed
49,Mis listas,,Mis pedidos > 1 L,,MXN,,Desconocido,unknown,MX,Mis listas,Mis pedidos,,1 L,,MXN,,,66.32,True,country_mean,,3.5617,18.62,from_mexico_cambio_dolar,,,,,,,,{},dataset/txt_limpios/49.txt,dataset/paginas_descargadas/49.html,EN,sin_categoria,discard,0.30,no_category_detected;price_parse_failed
66,Mis listas,,Mis pedidos,,MXN,,Desconocido,unknown,MX,Mis listas,Mis pedidos,,,,MXN,,,66.32,True,country_mean,,3.5617,18.62,from_mexico_cambio_dolar,,,,,,,,{},dataset/txt_limpios/66.txt,dataset/paginas_descargadas/66.html,EN,sin_categoria,discard,0.30,no_category_detected;price_parse_failed
1616,Multi Marca,"Especificaciones Técnicas Papas Huerto del Ranco, 2kg País de origen: Chile Ingredientes: Papas. Porción: 1 Unidad Regular (150g) Porciones por envase: 13 100g 1 Porción Energía (kCal) 77 115.5 Proteínas (g) 2.02 3 Grasas Totales 0.09 0.1 Hidratos de carbono disponibles 17,5 26.3 Azúcar total (g) 16.6 24.9 Sodio (mg) 6 9 Importante: La información del empaque y/o contenido del producto final puede diferir respecto a lo que mostramos en nuestro sitio web, tanto a nivel de ingredientes, trazas, información nutricional, sellos, modo de uso y/o modo de conservación. Recuerda siempre leer las etiquetas, advertencias y instrucciones antes de usar el consumo de un producto. ¿Encontraste algún error? Repórtalo aquí Ficha actualizada el 12.05.2025 por Nuestras marcas Feedback","Papa Malla, 2 Kg > 2 Kg",2.69,,,Desconocido,unknown,UNKNOWN,Multi Marca,"Papa Malla, 2 Kg",,2 Kg,2.69,,$,$2.69,2.69,False,original,2.69,2.69,1.0,default_1usd,,"Especificaciones Técnicas Papas Huerto del Ranco, 2kg País de origen: Chile Ingredientes: Papas. Porción: 1 Unidad Regular (150g) Porciones por envase: 13 100g 1 Porción Energía (kCal) 77 115.5 Proteínas (g) 2.02 3 Grasas Totales 0.09 0.1 Hidratos de carbono disponibles 17,5 26.3 Azúcar total (g) 16.6 24.9 Sodio (mg) 6 9 Importante: La información del empaque y/o contenido del producto final puede diferir respecto a lo que mostramos en nuestro sitio web, tanto a nivel de ingredientes, trazas, información nutricional, sellos, modo de uso y/o modo de conservación. Recuerda siempre leer las etiquetas, advertencias y instrucciones antes de usar el consumo de un producto. ¿Encontraste algún error? Repórtalo aquí Ficha actualizada el 12.05.2025 por Nuestras marcas Feedback",,,,,,"{""Descripción"": [""Especificaciones Técnicas"", ""Papas  Huerto del Ranco, 2kg"", ""País de origen: Chile"", ""Ingredientes: Papas."", ""Porción: 1 Unidad Regular (150g)"", ""Porciones por envase: 13"", ""100g"", ""1 Porción"", ""Energía"", ""(kCal)"", ""77"", ""115.5"", ""Proteínas"", ""(g)"", ""2.02"", ""3"", ""Grasas Totales"", ""0.09"", ""0.1"", ""Hidratos de carbono disponibles"", ""17.5"", ""26.3"", ""Azúcar total (g)"", ""16.6"", ""24.9"", ""Sodio"", ""(mg)"", ""6"", ""9"", ""Importante: La información del empaque y/o contenido del producto final puede diferir respecto a lo que mostramos en nuestro sitio web, tanto a nivel de ingredientes, trazas, información nutricional, sellos, modo de uso y/o modo de conservación. Recuerda siempre leer las etiquetas, advertencias y instrucciones antes de usar el consumo de un producto."", ""¿Qué? ¿Has encontrado algún error?"", ""Repórtalo aquí"", ""Ficha actualizada el 12.05.2025 por"", ""Nuestras marcas"", ""Feedback""]}",dataset/txt_limpios/1616.txt,dataset/paginas_descargadas/1616.html,ET,papa,keep,0.60,heuristic_default
1023,No se puede acceder a este sitio,,ERR_FAILED > 200ml,,,,Desconocido,unknown,UNKNOWN,No se puede acceder a este sitio,ERR_FAILED,,200ml,,,,,234.19,True,country_mean,,234.1938,1.0,default_1usd,,,,,,,,{},dataset/txt_limpios/1023.txt,dataset/paginas_descargadas/1023.html,EN,sin_categoria,discard,0.30,no_category_detected;price_parse_failed
1108,No se puede acceder a este sitio,,ERR_FAILED > 4kg,,,,Desconocido,unknown,UNKNOWN,No se puede acceder a este sitio,ERR_FAILED,,4kg,,,,,234.19,True,country_mean,,234.1938,1.0,default_1usd,,,,,,,,{},dataset/txt_limpios/1108.txt,dataset/paginas_descargadas/1108.html,EN,sin_categoria,discard,0.30,no_category_detected;price_parse_failed
1175,No se puede acceder a este sitio,,ERR_FAILED,,,,Desconocido,unknown,UNKNOWN,No se puede acceder a este sitio,ERR_FAILED,,,,,,,234.19,True,country_mean,,234.1938,1.0,default_1usd,,,,,,,,{},dataset/txt_limpios/1175.txt,dataset/paginas_descargadas/1175.html,EN,sin_categoria,discard,0.30,no_category_detected;price_parse_failed
1189,No se puede acceder a este sitio,,ERR_FAILED > 950g,,,,Desconocido,unknown,UNKNOWN,No se puede acceder a este sitio,ERR_FAILED,,950g,,,,,234.19,True,country_mean,,234.1938,1.0,default_1usd,,,,,,,,{},dataset/txt_limpios/1189.txt,dataset/paginas_descargadas/1189.html,EN,sin_categoria,discard,0.30,no_category_detected;price_parse_failed
38,No se puede acceder a este sitio,,ERR_FAILED,,,,Desconocido,unknown,UNKNOWN,No se puede acceder a este sitio,ERR_FAILED,,,,,,,234.19,True,country_mean,,234.1938,1.0,default_1usd,,,,,,,,{},dataset/txt_limpios/38.txt,dataset/paginas_descargadas/38.html,EN,sin_categoria,discard,0.30,no_category_detected;price_parse_failed
63,No se puede acceder a este sitio,,ERR_FAILED,,,,Desconocido,unknown,UNKNOWN,No se puede acceder a este sitio,ERR_FAILED,,,,,,,234.19,True,country_mean,,234.1938,1.0,default_1usd,,,,,,,,{},dataset/txt_limpios/63.txt,dataset/paginas_descargadas/63.html,EN,sin_categoria,discard,0.30,no_category_detected;price_parse_failed
72,No se puede acceder a este sitio,,ERR_FAILED,,,,Desconocido,unknown,UNKNOWN,No se puede acceder a este sitio,ERR_FAILED,,,,,,,234.19,True,country_mean,,234.1938,1.0,default_1usd,,,,,,,,{},dataset/txt_limpios/72.txt,dataset/paginas_descargadas/72.html,EN,sin_categoria,discard,0.30,no_category_detected;price_parse_failed
902,nuestra cocina,Arroz Nuestra Cocina G2 grano largo ancho bolsa 1 Kg,1 Kg > 1 Kg,1.59,,,Desconocido,unknown,UNKNOWN,nuestra cocina,1 Kg,,1 Kg,1.59,,$,$1.59,1.59,False,original,1.59,1.59,1.0,default_1usd,,Arroz Nuestra Cocina G2 grano largo ancho bolsa 1 Kg,,,,,,"{""Descripción"": [""Arroz Nuestra Cocina G2 grano largo ancho bolsa 1 Kg""]}",dataset/txt_limpios/902.txt,dataset/paginas_descargadas/902.html,EN,arroz,keep,0.60,heuristic_default
1544,Padaria e Matinais,,Panes y Torradas > 500g,8.78,BRL,,Desconocido,unknown,BR,Padaria e Matinais,Panes y Torradas,,500g,8.78,BRL,R$,"R$8,78",8.78,False,original,1.6116,1.6116,5.448,from_brasil_cambio_dolar,,,,,,,,{},dataset/txt_limpios/1544.txt,dataset/paginas_descargadas/1544.html,ET,pan,keep,0.60,heuristic_default
1548,Padaria e Matinais,,Panes y Torradas > 450g,13.99,BRL,,Desconocido,unknown,BR,Padaria e Matinais,Panes y Torradas,,450g,13.99,BRL,R$,"R$13,99",13.99,False,original,2.5679,2.5679,5.448,from_brasil_cambio_dolar,,,,,,,,{},dataset/txt_limpios/1548.txt,dataset/paginas_descargadas/1548.html,ET,pan,keep,0.60,heuristic_default
1555,Padaria e Matinais,,Panes y Torradas > 400g,8.78,BRL,,Desconocido,unknown,BR,Padaria e Matinais,Panes y Torradas,,400g,8.78,BRL,R$,"R$8,78",8.78,False,original,1.6116,1.6116,5.448,from_brasil_cambio_dolar,,,,,,,,{},dataset/txt_limpios/1555.txt,dataset/paginas_descargadas/1555.html,ET,pan,keep,0.60,heuristic_default
1564,Padaria e Matinais,,Leites > 1 L,33.14,BRL,,Desconocido,unknown,BR,Padaria e Matinais,Leites,,1 L,33.14,BRL,R$,"R$33,14",33.14,False,original,6.083,6.083,5.448,from_brasil_cambio_dolar,,,,,,,,{},dataset/txt_limpios/1564.txt,dataset/paginas_descargadas/1564.html,EN,sin_categoria,discard,0.30,no_category_detected
1565,Padaria e Matinais,,Leites > 1 L,33.14,BRL,,Desconocido,unknown,BR,Padaria e Matinais,Leites,,1 L,33.14,BRL,R$,"R$33,14",33.14,False,original,6.083,6.083,5.448,from_brasil_cambio_dolar,,,,,,,,{},dataset/txt_limpios/1565.txt,dataset/paginas_descargadas/1565.html,EN,sin_categoria,discard,0.30,no_category_detected
1566,Padaria e Matinais,,Leites > 1L,5.99,BRL,,Desconocido,unknown,BR,Padaria e Matinais,Leites,,1L,5.99,BRL,R$,"R$5,99",5.99,False,original,1.0995,1.0995,5.448,from_brasil_cambio_dolar,,,,,,,,{},dataset/txt_limpios/1566.txt,dataset/paginas_descargadas/1566.html,EN,sin_categoria,discard,0.30,no_category_detected
1568,Padaria e Matinais,,Panes y Torradas > 450g,33.14,BRL,,Desconocido,unknown,BR,Padaria e Matinais,Panes y Torradas,,450g,33.14,BRL,R$,"R$33,14",33.14,False,original,6.083,6.083,5.448,from_brasil_cambio_dolar,,,,,,,,{},dataset/txt_limpios/1568.txt,dataset/paginas_descargadas/1568.html,ET,pan,keep,0.60,heuristic_default
1614,Padaria e Matinais,,Panes y Torradas > 450g,11.9,BRL,,Desconocido,unknown,BR,Padaria e Matinais,Panes y Torradas,,450g,11.90,BRL,R$,"R$11,90",11.9,False,original,2.1843,2.1843,5.448,from_brasil_cambio_dolar,,,,,,,,{},dataset/txt_limpios/1614.txt,dataset/paginas_descargadas/1614.html,ET,pan,keep,0.60,heuristic_default
1737,Padaria e Matinais,,Leites > 1 Litro,5.15,BRL,,Desconocido,unknown,BR,Padaria e Matinais,Leites,,1 Litro,5.15,BRL,R$,"R$5,15",5.15,False,original,0.9453,0.9453,5.448,from_brasil_cambio_dolar,,,,,,,,{},dataset/txt_limpios/1737.txt,dataset/paginas_descargadas/1737.html,EN,sin_categoria,discard,0.30,no_category_detected
1740,Padaria e Matinais,,Leites > 1L,5.99,BRL,,Desconocido,unknown,BR,Padaria e Matinais,Leites,,1L,5.99,BRL,R$,"R$5,99",5.99,False,original,1.0995,1.0995,5.448,from_brasil_cambio_dolar,,,,,,,,{},dataset/txt_limpios/1740.txt,dataset/paginas_descargadas/1740.html,EN,sin_categoria,discard,0.30,no_category_detected
190,Padaria e Matinais,,Panes y Torradas > 500g,9.49,BRL,,Desconocido,unknown,BR,Padaria e Matinais,Panes y Torradas,,500g,9.49,BRL,R$,"R$9,49",9.49,False,original,1.7419,1.7419,5.448,from_brasil_cambio_dolar,,,,,,,,{},dataset/txt_limpios/190.txt,dataset/paginas_descargadas/190.html,ET,pan,keep,0.60,heuristic_default
191,Padaria e Matinais,,Panes y Torradas > 400g,9.69,BRL,,Desconocido,unknown,BR,Padaria e Matinais,Panes y Torradas,,400g,9.69,BRL,R$,"R$9,69",9.69,False,original,1.7786,1.7786,5.448,from_brasil_cambio_dolar,,,,,,,,{},dataset/txt_limpios/191.txt,dataset/paginas_descargadas/191.html,ET,pan,keep,0.60,heuristic_default
192,Padaria e Matinais,,Panes y Torradas > 450g,,,,Desconocido,unknown,UNKNOWN,Padaria e Matinais,Panes y Torradas,,450g,,,,,44.23,True,category_country_mean,,44.2339,1.0,default_1usd,,,,,,,,{},dataset/txt_limpios/192.txt,dataset/paginas_descargadas/192.html,ET,pan,discard,0.60,price_parse_failed;price<=0
193,Padaria e Matinais,,Panes y Torradas > 450g,17.59,BRL,,Desconocido,unknown,BR,Padaria e Matinais,Panes y Torradas,,450g,17.59,BRL,R$,"R$17,59",17.59,False,original,3.2287,3.2287,5.448,from_brasil_cambio_dolar,,,,,,,,{},dataset/txt_limpios/193.txt,dataset/paginas_descargadas/193.html,ET,pan,keep,0.60,heuristic_default
194,Padaria e Matinais,,Panes y Torradas > 450g,6.19,BRL,,Desconocido,unknown,BR,Padaria e Matinais,Panes y Torradas,,450g,6.19,BRL,R$,"R$6,19",6.19,False,original,1.1362,1.1362,5.448,from_brasil_cambio_dolar,,,,,,,,{},dataset/txt_limpios/194.txt,dataset/paginas_descargadas/194.html,ET,pan,keep,0.60,heuristic_default
205,Padaria e Matinais,,Leites > 1 Litro,,,,Desconocido,unknown,UNKNOWN,Padaria e Matinais,Leites,,1 Litro,,,,,234.19,True,country_mean,,234.1938,1.0,default_1usd,,,,,,,,{},dataset/txt_limpios/205.txt,dataset/paginas_descargadas/205.html,EN,sin_categoria,discard,0.30,no_category_detected;price_parse_failed
206,Padaria e Matinais,,Leites > 1L,6.09,BRL,,Desconocido,unknown,BR,Padaria e Matinais,Leites,,1L,6.09,BRL,R$,"R$6,09",6.09,False,original,1.1178,1.1178,5.448,from_brasil_cambio_dolar,,,,,,,,{},dataset/txt_limpios/206.txt,dataset/paginas_descargadas/206.html,EN,sin_categoria,discard,0.30,no_category_detected
207,Padaria e Matinais,,Leites > 1 L,4.79,BRL,,Desconocido,unknown,BR,Padaria e Matinais,Leites,,1 L,4.79,BRL,R$,"R$4,79",4.79,False,original,0.8792,0.8792,5.448,from_brasil_cambio_dolar,,,,,,,,{},dataset/txt_limpios/207.txt,dataset/paginas_descargadas/207.html,EN,sin_categoria,discard,0.30,no_category_detected
208,Padaria e Matinais,,Leites > 1 L,,,,Desconocido,unknown,UNKNOWN,Padaria e Matinais,Leites,,1 L,,,,,234.19,True,country_mean,,234.1938,1.0,default_1usd,,,,,,,,{},dataset/txt_limpios/208.txt,dataset/paginas_descargadas/208.html,EN,sin_categoria,discard,0.30,no_category_detected;price_parse_failed
209,Padaria e Matinais,,Leites > 1L,,,,Desconocido,unknown,UNKNOWN,Padaria e Matinais,Leites,,1L,,,,,234.19,True,country_mean,,234.1938,1.0,default_1usd,,,,,,,,{},dataset/txt_limpios/209.txt,dataset/paginas_descargadas/209.html,EN,sin_categoria,discard,0.30,no_category_detected;price_parse_failed
1351,PAN MOLDE BLANCO FLOR DE ORO 550 G,¿Deseas recibir notificaciones? Remind me later Permitir Thank you! Please check your email inbox to confirm. Oops! Notifications are disabled.,Comparar > 550 G,1.05,USD,,Desconocido,unknown,US,PAN MOLDE BLANCO FLOR DE ORO 550 G,Comparar,,550 G,1.05,USD,$,"$1,05",1.05,False,original,1.05,1.05,1.0,default_1usd,¿Deseas recibir notificaciones? Remind me later Permitir Thank you! Please check your email inbox to confirm. Oops! Notifications are disabled.,,,,,,,"{""Información"": [""¿Deseas recibir notificaciones?"", ""Remind me later"", ""Permitir"", ""Thank you! Please check your email inbox to confirm."", ""Oops! Notifications are disabled.""]}",dataset/txt_limpios/1351.txt,dataset/paginas_descargadas/1351.html,EN,pan,keep,0.60,heuristic_default
1352,PAN MOLDE BLANCO MODERNA 550 G,Ficha técnica Pan molde blanco Moderna 550 g ¿Deseas recibir notificaciones? Remind me later Permitir Thank you! Please check your email inbox to confirm. ¡Oops! Notifications are disabled.,Comparar > 550 G,1.59,USD,,Desconocido,unknown,US,PAN MOLDE BLANCO MODERNA 550 G,Comparar,,550 G,1.59,USD,$,"$1,59",1.59,False,original,1.59,1.59,1.0,default_1usd,Ficha técnica Pan molde blanco Moderna 550 g ¿Deseas recibir notificaciones? Remind me later Permitir Thank you! Please check your email inbox to confirm. ¡Oops! Notifications are disabled.,,,,,,,"{""Información"": [""Ficha técnica"", ""Pan molde blanco  Moderna 550 g"", ""¿Deseas recibir notificaciones?"", ""Remind me later"", ""Permitir"", ""Thank you! Please check your email inbox to confirm."", ""Oops! Notifications are disabled.""]}",dataset/txt_limpios/1352.txt,dataset/paginas_descargadas/1352.html,ET,pan,keep,0.60,heuristic_default
1350,PAN MOLDE BLANCO SUPAN 550 G,¿Deseas recibir notificaciones? Remind me later Permitir Thank you! Please check your email inbox to confirm. Oops! Notifications are disabled.,Comparar > 550 G,1.56,USD,,Desconocido,unknown,US,PAN MOLDE BLANCO SUPAN 550 G,Comparar,,550 G,1.56,USD,$,"$1,56",1.56,False,original,1.56,1.56,1.0,default_1usd,¿Deseas recibir notificaciones? Remind me later Permitir Thank you! Please check your email inbox to confirm. Oops! Notifications are disabled.,,,,,,,"{""Información"": [""¿Deseas recibir notificaciones?"", ""Remind me later"", ""Permitir"", ""Thank you! Please check your email inbox to confirm."", ""Oops! Notifications are disabled.""]}",dataset/txt_limpios/1350.txt,dataset/paginas_descargadas/1350.html,EN,pan,keep,0.60,heuristic_default
