{"source_id": "823", "title": "Saltar menú Cenco", "description": "Ingredientes Condición alimentaria Información nutricional Tipo de Producto Bebidas Gaseosas Cantidad 1 un. Envase Botella plástico desechable (bebidas) Gasificado Sí País de Origen Chile Sabor Cola Contenido Entre 1 y 2 lt Garantía Mínima Legal Válida hasta su fecha de caducidad Te podrían interesar Kryzpo Papas Fritas Kryzpo Original 130 g Oferta 25% dcto. La Crianza Hamburguesa de Vacuno La Crianza 1 kg 10 un. Pomarola Salsa de Tomate Pomarola 200 g 6 un. Centro de preferencia de privacidad Gestionar las preferencias de consentimiento Activas siempre Back Button Search Icon Filter Icon Clear checkbox label label Apply Cancel Consent Leg.Interest Permitir todas Rechazar todas Confirmar mis preferencias", "breadcrumbs": "Exclusivo online > 1.5 L", "price_raw": "3.0", "currency_raw": "", "url": "", "seller": "Desconocido", "availability": "unknown", "country": "UNKNOWN", "product_name": "Saltar menú Cenco", "brand": "Exclusivo online", "reference": "", "unit": "1.5 L", "price_amount": 3.0, "price_currency": "", "price_symbol": "", "price_text": "3", "price_amount_filled": "3.0", "price_is_imputed": "False", "price_imputation_source": "original", "price_amount_usd": "3.0", "price_amount_usd_filled": "3.0", "fx_rate_local_per_usd": "1.0", "fx_source": "default_1usd", "information_text": "", "description_text": "Ingredientes Condición alimentaria Información nutricional Tipo de Producto Bebidas Gaseosas Cantidad 1 un. Envase Botella plástico desechable (bebidas) Gasificado Sí País de Origen Chile Sabor Cola Contenido Entre 1 y 2 lt Garantía Mínima Legal Válida hasta su fecha de caducidad Te podrían interesar Kryzpo Papas Fritas Kryzpo Original 130 g Oferta 25% dcto. La Crianza Hamburguesa de Vacuno La Crianza 1 kg 10 un. Pomarola Salsa de Tomate Pomarola 200 g 6 un. Centro de preferencia de privacidad Gestionar las preferencias de consentimiento Activas siempre Back Button Search Icon Filter Icon Clear checkbox label label Apply Cancel Consent Leg.Interest Permitir todas Rechazar todas Confirmar mis preferencias", "features_text": "", "specifications_text": "", "benefits_text": "", "details_text": "", "other_sections": "", "sections": {"Descripción": ["Ingredientes", "Condición alimentaria", "Información nutricional", "Tipo de Producto", "Bebidas Gaseosas", "Cantidad", "1 un.", "Envase", "Botella plástico desechable (bebidas)", "Gasificado", "Sí", "País de origen", "Chile", "Sabor", "Cola", "Contenido", "Entre 1 y 2 lt", "Garantía Mínima Legal", "Válida hasta su fecha de caducidad", "Te podrían interesar", "Kryzpo", "Papas Fritas Kryzpo Original 130 g", "Oferta", "25% dcto.", "La Crianza", "Hamburguesa de Vacuno La Crianza 1 kg 10 un.", "Pomarola", "Salsa de Tomate Pomarola 200 g 6 un.", "Centro de preferencia de privacidad", "Gestionar las preferencias de consentimiento", "Activas siempre", "Back Button", "Search Icon", "Filter Icon", "Clear", "checkbox label", "label", "Apply", "Cancel", "Consent", "Leg.Interest", "Permitir todas", "Rechazar todas", "Confirmar mis preferencias"]}, "txt_path": "dataset/txt_limpios/823.txt", "html_path": "dataset/paginas_descargadas/823.html", "es_status": "ET", "category_canonical": "descartado", "decision": "discard", "match_score": 0.1, "reasons": "excluded_keyword"}
{"source_id": "824", "title": "Saltar menú Cenco", "description": "Ingredientes Condición alimentaria Información nutricional Tipo de Producto Bebidas Gaseosas Cantidad 1 un. Envase Botella plástico desechable (bebidas) Gasificado Sí País de Origen Chile Sabor Ginger Ale Contenido Entre 1 y 2 lt Garantía Mínima Legal Válida hasta su fecha de caducidad Te podrían interesar Kryzpo Papas Fritas Kryzpo Original 130 g Pomarola Salsa de Tomate Pomarola 200 g 6 un. 25% dcto. La Crianza Hamburguesa de Vacuno La Crianza 1 kg 10 un. 3.8 Centro de preferencia de privacidad Gestionar las preferencias de consentimiento Activas siempre Back Button Search Icon Filter Icon Clear checkbox label label Apply Cancel Consent Leg.Interest Permitir todas Rechazar todas Confirmar mis preferencias", "breadcrumbs": "Exclusivo online > 1.5 L", "price_raw": "3.0", "currency_raw": "", "url": "", "seller": "Desconocido", "availability": "unknown", "country": "UNKNOWN", "product_name": "Saltar menú Cenco", "brand": "Exclusivo online", "reference": "", "unit": "1.5 L", "price_amount": 3.0, "price_currency": "", "price_symbol": "", "price_text": "3", "price_amount_filled": "3.0", "price_is_imputed": "False", "price_imputation_source": "original", "price_amount_usd": "3.0", "price_amount_usd_filled": "3.0", "fx_rate_local_per_usd": "1.0", "fx_source": "default_1usd", "information_text": "", "description_text": "Ingredientes Condición alimentaria Información nutricional Tipo de Producto Bebidas Gaseosas Cantidad 1 un. Envase Botella plástico desechable (bebidas) Gasificado Sí País de Origen Chile Sabor Ginger Ale Contenido Entre 1 y 2 lt Garantía Mínima Legal Válida hasta su fecha de caducidad Te podrían interesar Kryzpo Papas Fritas Kryzpo Original 130 g Pomarola Salsa de Tomate Pomarola 200 g 6 un. 25% dcto. La Crianza Hamburguesa de Vacuno La Crianza 1 kg 10 un. 3.8 Centro de preferencia de privacidad Gestionar las preferencias de consentimiento Activas siempre Back Button Search Icon Filter Icon Clear checkbox label label Apply Cancel Consent Leg.Interest Permitir todas Rechazar todas Confirmar mis preferencias", "features_text": "", "specifications_text": "", "benefits_text": "", "details_text": "", "other_sections": "", "sections": {"Descripción": ["Ingredientes", "Condición alimentaria", "Información nutricional", "Tipo de Producto", "Bebidas Gaseosas", "Cantidad", "1 un.", "Envase", "Botella plástico desechable (bebidas)", "Gasificado", "Sí", "País de origen", "Chile", "Sabor", "Ginger Ale", "Contenido", "Entre 1 y 2 lt", "Garantía Mínima Legal", "Válida hasta su fecha de caducidad", "Te podrían interesar", "Kryzpo", "Papas Fritas Kryzpo Original 130 g", "Pomarola", "Salsa de Tomate Pomarola 200 g 6 un.", "25% dcto.", "La Crianza", "Hamburguesa de Vacuno La Crianza 1 kg 10 un.", "3.8", "Centro de preferencia de privacidad", "Gestionar las preferencias de consentimiento", "Activas siempre", "Back Button", "Search Icon", "Filter Icon", "Clear", "checkbox label", "label", "Apply", "Cancel", "Consent", "Leg.Interest", "Permitir todas", "Rechazar todas", "Confirmar mis preferencias"]}, "txt_path": "dataset/txt_limpios/824.txt", "html_path": "dataset/paginas_descargadas/824.html", "es_status": "ET", "category_canonical": "descartado", "decision": "discard", "match_score": 0.1, "reasons": "excluded_keyword"}
{"source_id": "825", "title": "Saltar menú Cenco", "description": "Ingredientes Condición alimentaria Información nutricional Tipo de Producto Bebidas Gaseosas Cantidad 1 un. Envase Botella plástico desechable (bebidas) Gasificado Sí País de Origen Chile Sabor Piña Contenido Entre 1 y 2 lt Garantía Mínima Legal Válida hasta su fecha de caducidad Te podrían interesar Soprole Mantequilla Soprole Untable Pote 350 g 3.0 Quillayes 4.8 Receta del Abuelo Jamón Pierna Artesanal Receta del Abuelo Corte Pluma 125 g 4.0 Centro de preferencia de privacidad Gestionar las preferencias de consentimiento Activas siempre Back Button Search Icon Filter Icon Clear checkbox label label Apply Cancel Consent Leg.Interest Permitir todas Rechazar todas Confirmar mis preferencias", "breadcrumbs": "Exclusivo online > 1.5 L", "price_raw": "3.0", "currency_raw": "", "url": "", "seller": "Desconocido", "availability": "unknown", "country": "UNKNOWN", "product_name": "Saltar menú Cenco", "brand": "Exclusivo online", "reference": "", "unit": "1.5 L", "price_amount": 3.0, "price_currency": "", "price_symbol": "", "price_text": "3", "price_amount_filled": "3.0", "price_is_imputed": "False", "price_imputation_source": "original", "price_amount_usd": "3.0", "price_amount_usd_filled": "3.0", "fx_rate_local_per_usd": "1.0", "fx_source": "default_1usd", "information_text": "", "description_text": "Ingredientes Condición alimentaria Información nutricional Tipo de Producto Bebidas Gaseosas Cantidad 1 un. Envase Botella plástico desechable (bebidas) Gasificado Sí País de Origen Chile Sabor Piña Contenido Entre 1 y 2 lt Garantía Mínima Legal Válida hasta su fecha de caducidad Te podrían interesar Soprole Mantequilla Soprole Untable Pote 350 g 3.0 Quillayes 4.8 Receta del Abuelo Jamón Pierna Artesanal Receta del Abuelo Corte Pluma 125 g 4.0 Centro de preferencia de privacidad Gestionar las preferencias de consentimiento Activas siempre Back Button Search Icon Filter Icon Clear checkbox label label Apply Cancel Consent Leg.Interest Permitir todas Rechazar todas Confirmar mis preferencias", "features_text": "", "specifications_text": "", "benefits_text": "", "details_text": "", "other_sections": "", "sections": {"Descripción": ["Ingredientes", "Condición alimentaria", "Información nutricional", "Tipo de Producto", "Bebidas Gaseosas", "Cantidad", "1 un.", "Envase", "Botella plástico desechable (bebidas)", "Gasificado", "Sí", "País de origen", "Chile", "Sabor", "Piña", "Contenido", "Entre 1 y 2 lt", "Garantía Mínima Legal", "Válida hasta su fecha de caducidad", "Te podrían interesar", "Soprole", "Mantequilla Soprole Untable Pote 350 g", "3.0", "Quillayes", "4.8", "Receta del Abuelo", "Jamón Pierna Artesanal Receta del Abuelo Corte Pluma 125 g", "4.0", "Centro de preferencia de privacidad", "Gestionar las preferencias de consentimiento", "Activas siempre", "Back Button", "Search Icon", "Filter Icon", "Clear", "checkbox label", "label", "Apply", "Cancel", "Consent", "Leg.Interest", "Permitir todas", "Rechazar todas", "Confirmar mis preferencias"]}, "txt_path": "dataset/txt_limpios/825.txt", "html_path": "dataset/paginas_descargadas/825.html", "es_status": "ET", "category_canonical": "descartado", "decision": "discard", "match_score": 0.1, "reasons": "excluded_keyword"}
{"source_id": "826", "title": "Saltar menú Cenco", "description": "Ingredientes Condición alimentaria Información nutricional Tipo de Producto Bebidas Gaseosas Cantidad 1 un. Envase Botella plástico desechable (bebidas) Gasificado Sí País de Origen Chile Sabor Naranja Contenido Entre 1 y 2 lt Te podrían interesar Centro de preferencia de privacidad Gestionar las preferencias de consentimiento Activas siempre Back Button Search Icon Filter Icon Clear checkbox label label Apply Cancel Consent Leg.Interest Permitir todas Rechazar todas Confirmar mis preferencias", "breadcrumbs": "Agotado > 1.5 L", "price_raw": "3.0", "currency_raw": "", "url": "", "seller": "Desconocido", "availability": "unknown", "country": "UNKNOWN", "product_name": "Saltar menú Cenco", "brand": "Agotado", "reference": "", "unit": "1.5 L", "price_amount": 3.0, "price_currency": "", "price_symbol": "", "price_text": "3", "price_amount_filled": "3.0", "price_is_imputed": "False", "price_imputation_source": "original", "price_amount_usd": "3.0", "price_amount_usd_filled": "3.0", "fx_rate_local_per_usd": "1.0", "fx_source": "default_1usd", "information_text": "", "description_text": "Ingredientes Condición alimentaria Información nutricional Tipo de Producto Bebidas Gaseosas Cantidad 1 un. Envase Botella plástico desechable (bebidas) Gasificado Sí País de Origen Chile Sabor Naranja Contenido Entre 1 y 2 lt Te podrían interesar Centro de preferencia de privacidad Gestionar las preferencias de consentimiento Activas siempre Back Button Search Icon Filter Icon Clear checkbox label label Apply Cancel Consent Leg.Interest Permitir todas Rechazar todas Confirmar mis preferencias", "features_text": "", "specifications_text": "", "benefits_text": "", "details_text": "", "other_sections": "", "sections": {"Descripción": ["Ingredientes", "Condición alimentaria", "Información nutricional", "Tipo de Producto", "Bebidas Gaseosas", "Cantidad", "1 un.", "Envase", "Botella plástico desechable (bebidas)", "Gasificado", "Sí", "País de origen", "Chile", "Sabor", "Naranja", "Contenido", "Entre 1 y 2 lt", "Te podrían interesar", "Centro de preferencia de privacidad", "Gestionar las preferencias de consentimiento", "Activas siempre", "Back Button", "Search Icon", "Filter Icon", "Clear", "checkbox label", "label", "Apply", "Cancel", "Consent", "Leg.Interest", "Permitir todas", "Rechazar todas", "Confirmar mis preferencias"]}, "txt_path": "dataset/txt_limpios/826.txt", "html_path": "dataset/paginas_descargadas/826.html", "es_status": "ET", "category_canonical": "sin_categoria", "decision": "discard", "match_score": 0.3, "reasons": "no_category_detected"}
{"source_id": "827", "title": "Saltar menú Cenco", "description": "Tipo de Producto Tomate Larga Vida Grupo Tomates Te podrían interesar Plátano Extra Granel (1 A 2 un. Aprox) Panadería Propia Pan Marraqueta Grande Granel Cebolla Malla 3 un. Centro de preferencia de privacidad Gestionar las preferencias de consentimiento Activas siempre Back Button Search Icon Filter Icon Clear checkbox label label Apply Cancel Consent Leg.Interest Permitir todas Rechazar todas Confirmar mis preferencias", "breadcrumbs": "Frutas y Verduras Propias", "price_raw": "995.0", "currency_raw": "", "url": "", "seller": "Desconocido", "availability": "unknown", "country": "UNKNOWN", "product_name": "Saltar menú Cenco", "brand": "Frutas y Verduras Propias", "reference": "", "unit": "", "price_amount": 995.0, "price_currency": "", "price_symbol": "$", "price_text": "$995", "price_amount_filled": "995.0", "price_is_imputed": "False", "price_imputation_source": "original", "price_amount_usd": "995.0", "price_amount_usd_filled": "995.0", "fx_rate_local_per_usd": "1.0", "fx_source": "default_1usd", "information_text": "", "description_text": "Tipo de Producto Tomate Larga Vida Grupo Tomates Te podrían interesar Plátano Extra Granel (1 A 2 un. Aprox) Panadería Propia Pan Marraqueta Grande Granel Cebolla Malla 3 un. Centro de preferencia de privacidad Gestionar las preferencias de consentimiento Activas siempre Back Button Search Icon Filter Icon Clear checkbox label label Apply Cancel Consent Leg.Interest Permitir todas Rechazar todas Confirmar mis preferencias", "features_text": "", "specifications_text": "", "benefits_text": "", "details_text": "", "other_sections": "", "sections": {"Descripción": ["Tipo de Producto", "Tomate Larga Vida", "Grupo", "Tomates", "Te podrían interesar", "Plátano Extra Granel (1 A 2 un. Aprox)", "Panadería Propia", "Pan Marraqueta Grande Granel", "Cebolla Malla 3 un.", "Centro de preferencia de privacidad", "Gestionar las preferencias de consentimiento", "Activas siempre", "Back Button", "Search Icon", "Filter Icon", "Clear", "checkbox label", "label", "Apply", "Cancel", "Consent", "Leg.Interest", "Permitir todas", "Rechazar todas", "Confirmar mis preferencias"]}, "txt_path": "dataset/txt_limpios/827.txt", "html_path": "dataset/paginas_descargadas/827.html", "es_status": "EN", "category_canonical": "banano", "decision": "keep", "match_score": 0.6, "reasons": "heuristic_default"}
{"source_id": "828", "title": "Saltar menú Cenco", "description": "", "breadcrumbs": "Frutas y verduras", "price_raw": "", "currency_raw": "", "url": "", "seller": "Desconocido", "availability": "unknown", "country": "UNKNOWN", "product_name": "Saltar menú Cenco", "brand": "Frutas y verduras", "reference": "", "unit": "", "price_amount": null, "price_currency": "", "price_symbol": "", "price_text": "", "price_amount_filled": "234.19", "price_is_imputed": "True", "price_imputation_source": "country_mean", "price_amount_usd": "", "price_amount_usd_filled": "234.1938", "fx_rate_local_per_usd": "1.0", "fx_source": "default_1usd", "information_text": "", "description_text": "", "features_text": "", "specifications_text": "", "benefits_text": "", "details_text": "", "other_sections": "", "sections": {}, "txt_path": "dataset/txt_limpios/828.txt", "html_path": "dataset/paginas_descargadas/828.html", "es_status": "EN", "category_canonical": "sin_categoria", "decision": "discard", "match_score": 0.3, "reasons": "no_category_detected;price_parse_failed"}
{"source_id": "829", "title": "Saltar menú Cenco", "description": "Ingredientes Condición alimentaria Información nutricional Tipo de Producto Huevo de Gallina Color Blanco Cantidad 12 unidades Envase Bandeja País de Origen Chile Tamaño del Huevo Grande [[\"\"]] Te podrían interesar Lobos Sal Lobos Fina 1 kg Exclusivo online Frutas y Verduras Propias Pepino Ensalada 1 un. Cuisine & Co Pimienta Negra Entera 15 g Centro de preferencia de privacidad Gestionar las preferencias de consentimiento Activas siempre Back Button Search Icon Filter Icon Clear checkbox label label Apply Cancel Consent Leg.Interest Permitir todas Rechazar todas Confirmar mis preferencias", "breadcrumbs": "Cintazul > 12 unidades", "price_raw": "4.19", "currency_raw": "", "url": "", "seller": "Desconocido", "availability": "unknown", "country": "UNKNOWN", "product_name": "Saltar menú Cenco", "brand": "Cintazul", "reference": "", "unit": "12 unidades", "price_amount": 4.19, "price_currency": "", "price_symbol": "$", "price_text": "$4.19", "price_amount_filled": "4.19", "price_is_imputed": "False", "price_imputation_source": "original", "price_amount_usd": "4.19", "price_amount_usd_filled": "4.19", "fx_rate_local_per_usd": "1.0", "fx_source": "default_1usd", "information_text": "", "description_text": "Ingredientes Condición alimentaria Información nutricional Tipo de Producto Huevo de Gallina Color Blanco Cantidad 12 unidades Envase Bandeja País de Origen Chile Tamaño del Huevo Grande [[\"\"]] Te podrían interesar Lobos Sal Lobos Fina 1 kg Exclusivo online Frutas y Verduras Propias Pepino Ensalada 1 un. Cuisine & Co Pimienta Negra Entera 15 g Centro de preferencia de privacidad Gestionar las preferencias de consentimiento Activas siempre Back Button Search Icon Filter Icon Clear checkbox label label Apply Cancel Consent Leg.Interest Permitir todas Rechazar todas Confirmar mis preferencias", "features_text": "", "specifications_text": "", "benefits_text": "", "details_text": "", "other_sections": "", "sections": {"Descripción": ["Ingredientes", "Condición alimentaria", "Información nutricional", "Tipo de Producto", "Huevo de Gallina", "Color", "Blanco", "Cantidad", "12 unidades", "Envase", "Bandeja", "País de origen", "Chile", "Tamaño del Huevo", "Grande", "[[\"\"]]", "Te podrían interesar", "Lobos", "Sal Lobos Fina 1 kg", "Exclusivo online", "Frutas y Verduras Propias", "Pepino Ensalada 1 un.", "Cuisine & Co", "Pimienta Negra Entera 15 g", "Centro de preferencia de privacidad", "Gestionar las preferencias de consentimiento", "Activas siempre", "Back Button", "Search Icon", "Filter Icon", "Clear", "checkbox label", "label", "Apply", "Cancel", "Consent", "Leg.Interest", "Permitir todas", "Rechazar todas", "Confirmar mis preferencias"]}, "txt_path": "dataset/txt_limpios/829.txt", "html_path": "dataset/paginas_descargadas/829.html", "es_status": "ET", "category_canonical": "huevo", "decision": "discard", "match_score": 0.3, "reasons": "heuristic_default"}
{"source_id": "830", "title": "Saltar menú Cenco", "description": "Ingredientes Condición alimentaria Información nutricional Tipo de Producto Huevo de Gallina Envase Bandeja País de Origen Chile Garantía Mínima Legal Válida hasta su fecha de caducidad Te podrían interesar Leche Cuisine & Co Entera 1 L Soprole Mantequilla Soprole Untable Pote 350 g Centro de preferencia de privacidad Gestionar las preferencias de consentimiento Activas siempre Back Button Search Icon Filter Icon Clear checkbox label label Apply Cancel Consent Leg.Interest Permitir todas Rechazar todas Confirmar mis preferencias", "breadcrumbs": "Cuisine & Co > 1 L", "price_raw": "3.89", "currency_raw": "", "url": "", "seller": "Desconocido", "availability": "unknown", "country": "UNKNOWN", "product_name": "Saltar menú Cenco", "brand": "Cuisine & Co", "reference": "", "unit": "1 L", "price_amount": 3.89, "price_currency": "", "price_symbol": "$", "price_text": "$3.89", "price_amount_filled": "3.89", "price_is_imputed": "False", "price_imputation_source": "original", "price_amount_usd": "3.89", "price_amount_usd_filled": "3.89", "fx_rate_local_per_usd": "1.0", "fx_source": "default_1usd", "information_text": "", "description_text": "Ingredientes Condición alimentaria Información nutricional Tipo de Producto Huevo de Gallina Envase Bandeja País de Origen Chile Garantía Mínima Legal Válida hasta su fecha de caducidad Te podrían interesar Leche Cuisine & Co Entera 1 L Soprole Mantequilla Soprole Untable Pote 350 g Centro de preferencia de privacidad Gestionar las preferencias de consentimiento Activas siempre Back Button Search Icon Filter Icon Clear checkbox label label Apply Cancel Consent Leg.Interest Permitir todas Rechazar todas Confirmar mis preferencias", "features_text": "", "specifications_text": "", "benefits_text": "", "details_text": "", "other_sections": "", "sections": {"Descripción": ["Ingredientes", "Condición alimentaria", "Información nutricional", "Tipo de Producto", "Huevo de Gallina", "Envase", "Bandeja", "País de origen", "Chile", "Garantía Mínima Legal", "Válida hasta su fecha de caducidad", "Te podrían interesar", "Leche Cuisine & Co Entera 1 L", "Soprole", "Mantequilla Soprole Untable Pote 350 g", "Centro de preferencia de privacidad", "Gestionar las preferencias de consentimiento", "Activas siempre", "Back Button", "Search Icon", "Filter Icon", "Clear", "checkbox label", "label", "Apply", "Cancel", "Consent", "Leg.Interest", "Permitir todas", "Rechazar todas", "Confirmar mis preferencias"]}, "txt_path": "dataset/txt_limpios/830.txt", "html_path": "dataset/paginas_descargadas/830.html", "es_status": "ET", "category_canonical": "descartado", "decision": "discard", "match_score": 0.1, "reasons": "excluded_keyword"}
