{"source_id": "35", "title": "Harinas y reposteria", "description": "Prepara tu despensa en unos cuantos clics y descubre nuestra gran variedad de productos. ¡En la sala de casa, te llevamos el súper!", "breadcrumbs": "Harina Chedraui Trigo 1Kg > 1Kg > 3793489", "price_raw": "", "currency_raw": "MXN", "url": "", "seller": "Chedraui", "availability": "unknown", "country": "MX", "product_name": "Harinas y reposteria", "brand": "Harina Chedraui Trigo 1Kg", "reference": "3793489.0", "unit": "1Kg", "price_amount": null, "price_currency": "MXN", "price_symbol": "", "price_text": "", "price_amount_filled": "66.32", "price_is_imputed": "True", "price_imputation_source": "country_mean", "price_amount_usd": "", "price_amount_usd_filled": "3.5617", "fx_rate_local_per_usd": "18.62", "fx_source": "from_mexico_cambio_dolar", "information_text": "", "description_text": "", "features_text": "", "specifications_text": "Prepara tu despensa en unos cuantos clics y descubre nuestra gran variedad de productos. ¡En la sala de casa, te llevamos el súper!", "benefits_text": "", "details_text": "", "other_sections": "", "sections": {"Especificaciones": ["Prepara tu despensa en unos cuantos clics y descubre nuestra gran variedad de productos. ¡En la sala de casa, te llevamos el súper!"]}, "txt_path": "dataset/txt_limpios/35.txt", "html_path": "dataset/paginas_descargadas/35.html", "es_status": "ET", "category_canonical": "sin_categoria", "decision": "discard", "match_score": 0.3, "reasons": "no_category_detected;price_parse_failed"}
{"source_id": "36", "title": "Harinas y reposteria", "description": "Harina de trigo extrafina para todo uso en la cocina La harina de trigo La Moderna está elaborada con trigos de buena calidad con la que puedes preparar todo tipo de platillos.", "breadcrumbs": "La Moderna > 1kg > 3256831", "price_raw": "", "currency_raw": "MXN", "url": "", "seller": "Chedraui", "availability": "unknown", "country": "MX", "product_name": "Harinas y reposteria", "brand": "La Moderna", "reference": "3256831.0", "unit": "1kg", "price_amount": null, "price_currency": "MXN", "price_symbol": "", "price_text": "", "price_amount_filled": "2902.4", "price_is_imputed": "True", "price_imputation_source": "category_mean", "price_amount_usd": "", "price_amount_usd_filled": "155.8757", "fx_rate_local_per_usd": "18.62", "fx_source": "from_mexico_cambio_dolar", "information_text": "Harina de trigo extrafina para todo uso en la cocina", "description_text": "", "features_text": "", "specifications_text": "La harina de trigo La Moderna está elaborada con trigos de buena calidad con la que puedes preparar todo tipo de platillos.", "benefits_text": "", "details_text": "", "other_sections": "", "sections": {"Información": ["Harina de trigo extrafina para todo uso en la cocina"], "Especificaciones": ["La harina de trigo La Moderna está elaborada con trigos de buena calidad con la que puedes preparar todo tipo de platillos."]}, "txt_path": "dataset/txt_limpios/36.txt", "html_path": "dataset/paginas_descargadas/36.html", "es_status": "EN", "category_canonical": "harina de trigo", "decision": "discard", "match_score": 0.6, "reasons": "price_parse_failed;price<=0"}
{"source_id": "37", "title": "Harinas y reposteria", "description": "Sol de Oro, es una harina de trigo fuerte diseñada a base ingredientes naturales y añadida con vitaminas y minerales, ideal para preparar gran variedad de platillos y postres. Por su preparación e ingredientes, Sol de Oro es una harina que permite a los hogares y negocios contar con una harina de alto rendimiento que permite obtener mayor cantidad de producto. La harina de trigo Sol de Oro es la harina ideal para el tu hogar el negocio, ya que al ser una harina multiproposito permite la elaboración de gran variedad de platillos hechos la base de harina de trigo, la harina de trigo sol de oro por sus ingredientes y proceso de elaboración es una gran opción para los hogares que utilizan harina de trigo para la elaboración de sus platillos.", "breadcrumbs": "Sol de Oro > 1kg > 3168625", "price_raw": "", "currency_raw": "MXN", "url": "", "seller": "Chedraui", "availability": "unknown", "country": "MX", "product_name": "Harinas y reposteria", "brand": "Sol de Oro", "reference": "3168625.0", "unit": "1kg", "price_amount": null, "price_currency": "MXN", "price_symbol": "", "price_text": "", "price_amount_filled": "2902.4", "price_is_imputed": "True", "price_imputation_source": "category_mean", "price_amount_usd": "", "price_amount_usd_filled": "155.8757", "fx_rate_local_per_usd": "18.62", "fx_source": "from_mexico_cambio_dolar", "information_text": "Sol de Oro, es una harina de trigo fuerte diseñada a base ingredientes naturales y añadida con vitaminas y minerales, ideal para preparar gran variedad de platillos y postres. Por su preparación e ingredientes, Sol de Oro es una harina que permite a los hogares y negocios contar con una harina de alto rendimiento que permite obtener mayor cantidad de producto.", "description_text": "", "features_text": "", "specifications_text": "La harina de trigo Sol de Oro es la harina ideal para el tu hogar el negocio, ya que al ser una harina multiproposito permite la elaboración de gran variedad de platillos hechos la base de harina de trigo, la harina de trigo sol de oro por sus ingredientes y proceso de elaboración es una gran opción para los hogares que utilizan harina de trigo para la elaboración de sus platillos.", "benefits_text": "", "details_text": "", "other_sections": "", "sections": {"Información": ["Sol de Oro, es una harina de trigo fuerte diseñada a base ingredientes naturales y añadida con vitaminas y minerales, ideal para preparar gran variedad de platillos y postres. Por su preparación e ingredientes, Sol de Oro es una harina que permite a los hogares y negocios contar con una harina de alto rendimiento que permite obtener mayor cantidad de producto."], "Especificaciones": ["La harina de trigo Sol de Oro es la harina ideal para el tu hogar el negocio, ya que al ser una harina multiproposito permite la elaboración de gran variedad de platillos hechos la base de harina de trigo, la harina de trigo sol de oro por sus ingredientes y proceso de elaboración es una gran opción para los hogares que utilizan harina de trigo para la elaboración de sus platillos."]}, "txt_path": "dataset/txt_limpios/37.txt", "html_path": "dataset/paginas_descargadas/37.html", "es_status": "ET", "category_canonical": "harina de trigo", "decision": "discard", "match_score": 0.6, "reasons": "price_parse_failed;price<=0"}
{"source_id": "546", "title": "Hola, Limpía tú cache", "description": "", "breadcrumbs": "IR AL PAGO > 1 Lt > 8480017006080", "price_raw": "1.59", "currency_raw": "ARS", "url": "", "seller": "Desconocido", "availability": "unknown", "country": "AR", "product_name": "Hola, Limpía tú cache", "brand": "IR AL PAGO", "reference": "8480017006080.0", "unit": "1 Lt", "price_amount": 1.59, "price_currency": "ARS", "price_symbol": "$", "price_text": "$1.59", "price_amount_filled": "1.59", "price_is_imputed": "False", "price_imputation_source": "original", "price_amount_usd": "0.0013", "price_amount_usd_filled": "0.0013", "fx_rate_local_per_usd": "1255.0", "fx_source": "from_argentina_cambio_dolar", "information_text": "", "description_text": "", "features_text": "", "specifications_text": "", "benefits_text": "", "details_text": "", "other_sections": "", "sections": {}, "txt_path": "dataset/txt_limpios/546.txt", "html_path": "dataset/paginas_descargadas/546.html", "es_status": "EN", "category_canonical": "sin_categoria", "decision": "discard", "match_score": 0.3, "reasons": "no_category_detected"}
{"source_id": "547", "title": "Hola, Limpía tú cache", "description": "", "breadcrumbs": "IR AL PAGO > 1 Lt > 7790742192301", "price_raw": "1.2", "currency_raw": "ARS", "url": "", "seller": "Desconocido", "availability": "unknown", "country": "AR", "product_name": "Hola, Limpía tú cache", "brand": "IR AL PAGO", "reference": "7790742192301.0", "unit": "1 Lt", "price_amount": 1.2, "price_currency": "ARS", "price_symbol": "$", "price_text": "$1.20", "price_amount_filled": "1.2", "price_is_imputed": "False", "price_imputation_source": "original", "price_amount_usd": "0.001", "price_amount_usd_filled": "0.001", "fx_rate_local_per_usd": "1255.0", "fx_source": "from_argentina_cambio_dolar", "information_text": "", "description_text": "", "features_text": "", "specifications_text": "", "benefits_text": "", "details_text": "", "other_sections": "", "sections": {}, "txt_path": "dataset/txt_limpios/547.txt", "html_path": "dataset/paginas_descargadas/547.html", "es_status": "EN", "category_canonical": "sin_categoria", "decision": "discard", "match_score": 0.3, "reasons": "no_category_detected"}
{"source_id": "552", "title": "Hola, Limpía tú cache", "description": "El pan Lactal es nuestro pan clásico que acompaña tu mesa desde hace pero de 100 años. Pan con salvado familiar. Harina de trigo 000*, agua, salvado de trigo, levadura, azúcar, aceite vegetal, gluten de trigo, sal, cloruro de potasio, suero de leche en polvo, conservadores: INS 282, INS 200, regulador de acidez: INS 270, mejorador de la harina: INS 300, aromatizantes naturales. CONTIENE DERIVADOS DE TRIGO Y DE LECHE. PUEDE CONTENER SOJA, AVENA, DERIVADOS DE CEBADA Y DE CENTENO. (*) Harina de trigo enriquecido según Ley N° 25.630 con: hierro (30 mg/kg); ácido fólico (2,2 mg/kg); tiamina B1 (6,3 mg/kg); riboflavina B2 (1,3 mg/kg); niacina (13 mg/kg). Ver más", "breadcrumbs": "¿Quéres terminar tu compra? > 560 Gr > 7793890258783", "price_raw": "5.01", "currency_raw": "ARS", "url": "", "seller": "Desconocido", "availability": "unknown", "country": "AR", "product_name": "Hola, Limpía tú cache", "brand": "¿Quéres terminar tu compra?", "reference": "7793890258783.0", "unit": "560 Gr", "price_amount": 5.01, "price_currency": "ARS", "price_symbol": "$", "price_text": "$5.01", "price_amount_filled": "5.01", "price_is_imputed": "False", "price_imputation_source": "original", "price_amount_usd": "0.004", "price_amount_usd_filled": "0.004", "fx_rate_local_per_usd": "1255.0", "fx_source": "from_argentina_cambio_dolar", "information_text": "", "description_text": "El pan Lactal es nuestro pan clásico que acompaña tu mesa desde hace pero de 100 años. Pan con salvado familiar. Harina de trigo 000*, agua, salvado de trigo, levadura, azúcar, aceite vegetal, gluten de trigo, sal, cloruro de potasio, suero de leche en polvo, conservadores: INS 282, INS 200, regulador de acidez: INS 270, mejorador de la harina: INS 300, aromatizantes naturales. CONTIENE DERIVADOS DE TRIGO Y DE LECHE. PUEDE CONTENER SOJA, AVENA, DERIVADOS DE CEBADA Y DE CENTENO. (*) Harina de trigo enriquecido según Ley N° 25.630 con: hierro (30 mg/kg); ácido fólico (2,2 mg/kg); tiamina B1 (6,3 mg/kg); riboflavina B2 (1,3 mg/kg); niacina (13 mg/kg). Ver más", "features_text": "", "specifications_text": "", "benefits_text": "", "details_text": "", "other_sections": "", "sections": {"Descripción": ["El pan Lactal es nuestro pan clásico que acompaña tu mesa desde hace pero de 100 años.", "Pan con salvado familiar.", "Harina de trigo 000*, agua, salvado de trigo, levadura, azúcar, aceite vegetal, gluten de trigo, sal, cloruro de potasio, suero de leche en polvo, conservadores: INS 282, INS 200, regulador de acidez: INS 270, mejorador de la harina: INS 300, aromatizantes naturales. CONTIENE DERIVADOS DE TRIGO Y DE LECHE. PUEDE CONTENER SOJA, AVENA, DERIVADOS DE CEBADA Y DE CENTENO. (*) Harina de trigo enriquecido según Ley N° 25.630 con: hierro (30 mg/kg); ácido fólico (2,2 mg/kg); tiamina B1 (6,3 mg/kg); riboflavina B2 (1,3 mg/kg); niacina (13 mg/kg).", "Ver más"]}, "txt_path": "dataset/txt_limpios/552.txt", "html_path": "dataset/paginas_descargadas/552.html", "es_status": "ET", "category_canonical": "leche", "decision": "keep", "match_score": 0.6, "reasons": "heuristic_default"}
{"source_id": "554", "title": "Hola, Limpía tú cache", "description": "", "breadcrumbs": "¿Quéres terminar tu compra? > 1 Kg > 7792540250450", "price_raw": "1.3", "currency_raw": "ARS", "url": "", "seller": "Desconocido", "availability": "unknown", "country": "AR", "product_name": "Hola, Limpía tú cache", "brand": "¿Quéres terminar tu compra?", "reference": "7792540250450.0", "unit": "1 Kg", "price_amount": 1.3, "price_currency": "ARS", "price_symbol": "$", "price_text": "$1.30", "price_amount_filled": "1.3", "price_is_imputed": "False", "price_imputation_source": "original", "price_amount_usd": "0.001", "price_amount_usd_filled": "0.001", "fx_rate_local_per_usd": "1255.0", "fx_source": "from_argentina_cambio_dolar", "information_text": "", "description_text": "", "features_text": "", "specifications_text": "", "benefits_text": "", "details_text": "", "other_sections": "", "sections": {}, "txt_path": "dataset/txt_limpios/554.txt", "html_path": "dataset/paginas_descargadas/554.html", "es_status": "ET", "category_canonical": "sin_categoria", "decision": "discard", "match_score": 0.3, "reasons": "no_category_detected"}
{"source_id": "563", "title": "Hola, Limpía tú cache", "description": "", "breadcrumbs": "¿Quéres terminar tu compra? > 500 Gr > 7790070320285", "price_raw": "965.0", "currency_raw": "ARS", "url": "", "seller": "Desconocido", "availability": "unknown", "country": "AR", "product_name": "Hola, Limpía tú cache", "brand": "¿Quéres terminar tu compra?", "reference": "7790070320285.0", "unit": "500 Gr", "price_amount": 965.0, "price_currency": "ARS", "price_symbol": "$", "price_text": "$965", "price_amount_filled": "965.0", "price_is_imputed": "False", "price_imputation_source": "original", "price_amount_usd": "0.7689", "price_amount_usd_filled": "0.7689", "fx_rate_local_per_usd": "1255.0", "fx_source": "from_argentina_cambio_dolar", "information_text": "", "description_text": "", "features_text": "", "specifications_text": "", "benefits_text": "", "details_text": "", "other_sections": "", "sections": {}, "txt_path": "dataset/txt_limpios/563.txt", "html_path": "dataset/paginas_descargadas/563.html", "es_status": "ET", "category_canonical": "sin_categoria", "decision": "discard", "match_score": 0.3, "reasons": "no_category_detected"}
{"source_id": "570", "title": "Hola, Limpía tú cache", "description": "", "breadcrumbs": "¿Quéres terminar tu compra? > 500 Gr > 2683614", "price_raw": "500.0", "currency_raw": "ARS", "url": "", "seller": "Desconocido", "availability": "unknown", "country": "AR", "product_name": "Hola, Limpía tú cache", "brand": "¿Quéres terminar tu compra?", "reference": "2683614.0", "unit": "500 Gr", "price_amount": 500.0, "price_currency": "ARS", "price_symbol": "", "price_text": "500", "price_amount_filled": "500.0", "price_is_imputed": "False", "price_imputation_source": "original", "price_amount_usd": "0.3984", "price_amount_usd_filled": "0.3984", "fx_rate_local_per_usd": "1255.0", "fx_source": "from_argentina_cambio_dolar", "information_text": "", "description_text": "", "features_text": "", "specifications_text": "", "benefits_text": "", "details_text": "", "other_sections": "", "sections": {}, "txt_path": "dataset/txt_limpios/570.txt", "html_path": "dataset/paginas_descargadas/570.html", "es_status": "ET", "category_canonical": "sin_categoria", "decision": "discard", "match_score": 0.3, "reasons": "no_category_detected"}
{"source_id": "574", "title": "Hola, Limpía tú cache", "description": "", "breadcrumbs": "¿Quéres terminar tu compra? > 1,5 Lt > 8480017248411", "price_raw": "800.0", "currency_raw": "ARS", "url": "", "seller": "Desconocido", "availability": "unknown", "country": "AR", "product_name": "Hola, Limpía tú cache", "brand": "¿Quéres terminar tu compra?", "reference": "8480017248411.0", "unit": "1,5 Lt", "price_amount": 800.0, "price_currency": "ARS", "price_symbol": "$", "price_text": "$800", "price_amount_filled": "800.0", "price_is_imputed": "False", "price_imputation_source": "original", "price_amount_usd": "0.6375", "price_amount_usd_filled": "0.6375", "fx_rate_local_per_usd": "1255.0", "fx_source": "from_argentina_cambio_dolar", "information_text": "", "description_text": "", "features_text": "", "specifications_text": "", "benefits_text": "", "details_text": "", "other_sections": "", "sections": {}, "txt_path": "dataset/txt_limpios/574.txt", "html_path": "dataset/paginas_descargadas/574.html", "es_status": "ET", "category_canonical": "sin_categoria", "decision": "discard", "match_score": 0.3, "reasons": "no_category_detected"}
{"source_id": "1367", "title": "Horarios de entrega", "description": "", "breadcrumbs": "LISTA > 1 Litro", "price_raw": "", "currency_raw": "", "url": "", "seller": "Desconocido", "availability": "unknown", "country": "UNKNOWN", "product_name": "Horarios de entrega", "brand": "LISTA", "reference": "", "unit": "1 Litro", "price_amount": null, "price_currency": "", "price_symbol": "", "price_text": "", "price_amount_filled": "234.19", "price_is_imputed": "True", "price_imputation_source": "country_mean", "price_amount_usd": "", "price_amount_usd_filled": "234.1938", "fx_rate_local_per_usd": "1.0", "fx_source": "default_1usd", "information_text": "", "description_text": "", "features_text": "", "specifications_text": "", "benefits_text": "", "details_text": "", "other_sections": "", "sections": {}, "txt_path": "dataset/txt_limpios/1367.txt", "html_path": "dataset/paginas_descargadas/1367.html", "es_status": "EN", "category_canonical": "sin_categoria", "decision": "discard", "match_score": 0.3, "reasons": "no_category_detected;price_parse_failed"}
{"source_id": "1369", "title": "Horarios de entrega", "description": "", "breadcrumbs": "LISTA > 1LT", "price_raw": "", "currency_raw": "", "url": "", "seller": "Desconocido", "availability": "unknown", "country": "UNKNOWN", "product_name": "Horarios de entrega", "brand": "LISTA", "reference": "", "unit": "1LT", "price_amount": null, "price_currency": "", "price_symbol": "", "price_text": "", "price_amount_filled": "234.19", "price_is_imputed": "True", "price_imputation_source": "country_mean", "price_amount_usd": "", "price_amount_usd_filled": "234.1938", "fx_rate_local_per_usd": "1.0", "fx_source": "default_1usd", "information_text": "", "description_text": "", "features_text": "", "specifications_text": "", "benefits_text": "", "details_text": "", "other_sections": "", "sections": {}, "txt_path": "dataset/txt_limpios/1369.txt", "html_path": "dataset/paginas_descargadas/1369.html", "es_status": "EN", "category_canonical": "sin_categoria", "decision": "discard", "match_score": 0.3, "reasons": "no_category_detected;price_parse_failed"}
{"source_id": "1370", "title": "Horarios de entrega", "description": "", "breadcrumbs": "LISTA > 500 GR", "price_raw": "500.0", "currency_raw": "", "url": "", "seller": "Desconocido", "availability": "unknown", "country": "UNKNOWN", "product_name": "Horarios de entrega", "brand": "LISTA", "reference": "", "unit": "500 GR", "price_amount": 500.0, "price_currency": "", "price_symbol": "", "price_text": "500", "price_amount_filled": "500.0", "price_is_imputed": "False", "price_imputation_source": "original", "price_amount_usd": "500.0", "price_amount_usd_filled": "500.0", "fx_rate_local_per_usd": "1.0", "fx_source": "default_1usd", "information_text": "", "description_text": "", "features_text": "", "specifications_text": "", "benefits_text": "", "details_text": "", "other_sections": "", "sections": {}, "txt_path": "dataset/txt_limpios/1370.txt", "html_path": "dataset/paginas_descargadas/1370.html", "es_status": "EN", "category_canonical": "sin_categoria", "decision": "discard", "match_score": 0.3, "reasons": "no_category_detected"}
{"source_id": "1371", "title": "Horarios de entrega", "description": "", "breadcrumbs": "LISTA > 1 LITRO", "price_raw": "", "currency_raw": "", "url": "", "seller": "Desconocido", "availability": "unknown", "country": "UNKNOWN", "product_name": "Horarios de entrega", "brand": "LISTA", "reference": "", "unit": "1 LITRO", "price_amount": null, "price_currency": "", "price_symbol": "", "price_text": "", "price_amount_filled": "234.19", "price_is_imputed": "True", "price_imputation_source": "country_mean", "price_amount_usd": "", "price_amount_usd_filled": "234.1938", "fx_rate_local_per_usd": "1.0", "fx_source": "default_1usd", "information_text": "", "description_text": "", "features_text": "", "specifications_text": "", "benefits_text": "", "details_text": "", "other_sections": "", "sections": {}, "txt_path": "dataset/txt_limpios/1371.txt", "html_path": "dataset/paginas_descargadas/1371.html", "es_status": "EN", "category_canonical": "sin_categoria", "decision": "discard", "match_score": 0.3, "reasons": "no_category_detected;price_parse_failed"}
{"source_id": "1372", "title": "Horarios de entrega", "description": "", "breadcrumbs": "LISTA > 1KG", "price_raw": "1.0", "currency_raw": "", "url": "", "seller": "Desconocido", "availability": "unknown", "country": "UNKNOWN", "product_name": "Horarios de entrega", "brand": "LISTA", "reference": "", "unit": "1KG", "price_amount": 1.0, "price_currency": "", "price_symbol": "", "price_text": "1", "price_amount_filled": "1.0", "price_is_imputed": "False", "price_imputation_source": "original", "price_amount_usd": "1.0", "price_amount_usd_filled": "1.0", "fx_rate_local_per_usd": "1.0", "fx_source": "default_1usd", "information_text": "", "description_text": "", "features_text": "", "specifications_text": "", "benefits_text": "", "details_text": "", "other_sections": "", "sections": {}, "txt_path": "dataset/txt_limpios/1372.txt", "html_path": "dataset/paginas_descargadas/1372.html", "es_status": "EN", "category_canonical": "sin_categoria", "decision": "discard", "match_score": 0.3, "reasons": "no_category_detected"}
