{"source_id": "686", "title": "ASESORAMOS TU COMPRA: 📞(601) 6672004, lun a sab de 7am.a 7pm dom hasta las 6pm", "description": "Este producto es vendido, facturado y entregado por Cencosud - Colombia Los precios de los productos pueden cambiar dependiendo de la región. Aplican Términos y Condiciones Desactivados Referencia: 0906601 $ 17 , 99 x gr DISTRIBUIDORA DE ALIMENTOS NO ☆ ¿Todavía tienes tu Tarjeta Cencosud? Solicítala en línea, úsala y obtén un . Aplican términos y condiciones. Solicítala aquí Términos más buscados 1. kefir alpina 2. muebles 3. leche 4. leche alqueria 5. san jorge 6. papel higiénico 7. arroz 8. café 9. cerveza 10. neveras", "breadcrumbs": "otras ciudades consulta aquí > 1000gr > 0906601", "price_raw": "17.99", "currency_raw": "COP", "url": "", "seller": "Desconocido", "availability": "unknown", "country": "CO", "product_name": "ASESORAMOS TU COMPRA: 📞(601) 6672004, lun a sab de 7am.a 7pm dom hasta las 6pm", "brand": "otras ciudades consulta aquí", "reference": "906601.0", "unit": "1000gr", "price_amount": 17.99, "price_currency": "COP", "price_symbol": "$", "price_text": "$17.99", "price_amount_filled": "17.99", "price_is_imputed": "False", "price_imputation_source": "original", "price_amount_usd": "0.0044", "price_amount_usd_filled": "0.0044", "fx_rate_local_per_usd": "4047.0", "fx_source": "from_colombia_cambio_dolar", "information_text": "", "description_text": "Este producto es vendido, facturado y entregado por Cencosud - Colombia Los precios de los productos pueden cambiar dependiendo de la región. Aplican Términos y Condiciones Desactivados Referencia: 0906601 $ 17 , 99 x gr DISTRIBUIDORA DE ALIMENTOS NO ☆ ¿Todavía tienes tu Tarjeta Cencosud? Solicítala en línea, úsala y obtén un . Aplican términos y condiciones. Solicítala aquí Términos más buscados 1. kefir alpina 2. muebles 3. leche 4. leche alqueria 5. san jorge 6. papel higiénico 7. arroz 8. café 9. cerveza 10. neveras", "features_text": "", "specifications_text": "", "benefits_text": "", "details_text": "", "other_sections": "", "sections": {"Descripción": ["Este producto es vendido, facturado y entregado por", "Cencosud - Colombia", "Los precios de los productos pueden cambiar dependiendo de la región.", "Aplican Términos y Condiciones", "Desactivado", "Referencia: 0906601", "$", "17", ",", "99", "x", "gr", "DISTRIBUIDORA DE ALIMENTOS NO", "☆", "¿Todavía tienes tu Tarjeta Cencosud?", "Solicítala en línea, úsala y obtén un", ". Aplican términos y condiciones.", "Solicítala aquí", "Términos más buscados", "1.", "kefir alpina", "2.", "muebles", "3.", "leche", "4.", "leche alqueria", "5.", "san jorge", "6.", "papel higienico", "7.", "arroz", "8.", "cafe", "9.", "cerveza", "10.", "neveras"]}, "txt_path": "dataset/txt_limpios/686.txt", "html_path": "dataset/paginas_descargadas/686.html", "es_status": "ET", "category_canonical": "cafe", "decision": "keep", "match_score": 0.6, "reasons": "heuristic_default"}
{"source_id": "687", "title": "ASESORAMOS TU COMPRA: 📞(601) 6672004, lun a sab de 7am.a 7pm dom hasta las 6pm", "description": "", "breadcrumbs": "otras ciudades consulta aquí > 500gr > 0090135", "price_raw": "1.69", "currency_raw": "COP", "url": "", "seller": "Desconocido", "availability": "unknown", "country": "CO", "product_name": "ASESORAMOS TU COMPRA: 📞(601) 6672004, lun a sab de 7am.a 7pm dom hasta las 6pm", "brand": "otras ciudades consulta aquí", "reference": "90135.0", "unit": "500gr", "price_amount": 1.69, "price_currency": "COP", "price_symbol": "$", "price_text": "$1.69", "price_amount_filled": "1.69", "price_is_imputed": "False", "price_imputation_source": "original", "price_amount_usd": "0.0004", "price_amount_usd_filled": "0.0004", "fx_rate_local_per_usd": "4047.0", "fx_source": "from_colombia_cambio_dolar", "information_text": "", "description_text": "", "features_text": "", "specifications_text": "", "benefits_text": "", "details_text": "", "other_sections": "", "sections": {}, "txt_path": "dataset/txt_limpios/687.txt", "html_path": "dataset/paginas_descargadas/687.html", "es_status": "ET", "category_canonical": "sin_categoria", "decision": "discard", "match_score": 0.3, "reasons": "no_category_detected"}
{"source_id": "688", "title": "ASESORAMOS TU COMPRA: 📞(601) 6672004, lun a sab de 7am.a 7pm dom hasta las 6pm", "description": "Lleva tu casa lo mejor en frutas y hortalizas, que han sido seleccionadas y clasificadas, con los mejores estándares de calidad que te ofrece Jumbo.co. Este producto es vendido, facturado y entregado por Cencosud - Colombia Los precios de los productos pueden cambiar dependiendo de la región. Aplican Términos y Condiciones Desactivados Referencia: 0059548 $ 3 , 58 x gr A GRANEL ☆ ¿Todavía tienes tu Tarjeta Cencosud? Solicítala en línea, úsala y obtén un . Aplican términos y condiciones. Solicítala aquí Términos más buscados 1. kefir alpina 2. muebles 3. leche 4. leche alqueria 5. san jorge 6. papel higiénico 7. arroz 8. café 9. cerveza 10. neveras", "breadcrumbs": "otras ciudades consulta aquí > 0059548", "price_raw": "1.79", "currency_raw": "COP", "url": "", "seller": "Desconocido", "availability": "unknown", "country": "CO", "product_name": "ASESORAMOS TU COMPRA: 📞(601) 6672004, lun a sab de 7am.a 7pm dom hasta las 6pm", "brand": "otras ciudades consulta aquí", "reference": "59548.0", "unit": "", "price_amount": 1.79, "price_currency": "COP", "price_symbol": "$", "price_text": "$1.79", "price_amount_filled": "1.79", "price_is_imputed": "False", "price_imputation_source": "original", "price_amount_usd": "0.0004", "price_amount_usd_filled": "0.0004", "fx_rate_local_per_usd": "4047.0", "fx_source": "from_colombia_cambio_dolar", "information_text": "", "description_text": "Lleva tu casa lo mejor en frutas y hortalizas, que han sido seleccionadas y clasificadas, con los mejores estándares de calidad que te ofrece Jumbo.co. Este producto es vendido, facturado y entregado por Cencosud - Colombia Los precios de los productos pueden cambiar dependiendo de la región. Aplican Términos y Condiciones Desactivados Referencia: 0059548 $ 3 , 58 x gr A GRANEL ☆ ¿Todavía tienes tu Tarjeta Cencosud? Solicítala en línea, úsala y obtén un . Aplican términos y condiciones. Solicítala aquí Términos más buscados 1. kefir alpina 2. muebles 3. leche 4. leche alqueria 5. san jorge 6. papel higiénico 7. arroz 8. café 9. cerveza 10. neveras", "features_text": "", "specifications_text": "", "benefits_text": "", "details_text": "", "other_sections": "", "sections": {"Descripción": ["Lleva tu casa lo mejor en frutas y hortalizas, que han sido seleccionadas y clasificadas, con los mejores estándares de calidad que te ofrece Jumbo.co", "Este producto es vendido, facturado y entregado por", "Cencosud - Colombia", "Los precios de los productos pueden cambiar dependiendo de la región.", "Aplican Términos y Condiciones", "Desactivado", "Referencia: 0059548", "$", "3", ",", "58", "x", "gr", "A GRANEL", "☆", "¿Todavía tienes tu Tarjeta Cencosud?", "Solicítala en línea, úsala y obtén un", ". Aplican términos y condiciones.", "Solicítala aquí", "Términos más buscados", "1.", "kefir alpina", "2.", "muebles", "3.", "leche", "4.", "leche alqueria", "5.", "san jorge", "6.", "papel higienico", "7.", "arroz", "8.", "cafe", "9.", "cerveza", "10.", "neveras"]}, "txt_path": "dataset/txt_limpios/688.txt", "html_path": "dataset/paginas_descargadas/688.html", "es_status": "ET", "category_canonical": "cafe", "decision": "keep", "match_score": 0.6, "reasons": "heuristic_default"}
{"source_id": "689", "title": "ASESORAMOS TU COMPRA: 📞(601) 6672004, lun a sab de 7am.a 7pm dom hasta las 6pm", "description": "Disfruta con tu familia y amigos todas las deliciosas recetas que puedes preparar con los productos más frescos que traemos para ti. Este producto es vendido, facturado y entregado por Cencosud - Colombia Los precios de los productos pueden cambiar dependiendo de la región. Aplican Términos y Condiciones Desactivados Referencia: 0258508 $ 2 x gr MAXIMA MP ☆ ¿Todavía tienes tu Tarjeta Cencosud? Solicítala en línea, úsala y obtén un . Aplican términos y condiciones. Solicítala aquí Términos más buscados 1. kefir alpina 2. muebles 3. leche 4. leche alqueria 5. san jorge 6. papel higiénico 7. arroz 8. café 9. cerveza 10. neveras", "breadcrumbs": "otras ciudades consulta aquí > 2500gr > 0258508", "price_raw": "4.99", "currency_raw": "COP", "url": "", "seller": "Desconocido", "availability": "unknown", "country": "CO", "product_name": "ASESORAMOS TU COMPRA: 📞(601) 6672004, lun a sab de 7am.a 7pm dom hasta las 6pm", "brand": "otras ciudades consulta aquí", "reference": "258508.0", "unit": "2500gr", "price_amount": 4.99, "price_currency": "COP", "price_symbol": "$", "price_text": "$4.99", "price_amount_filled": "4.99", "price_is_imputed": "False", "price_imputation_source": "original", "price_amount_usd": "0.0012", "price_amount_usd_filled": "0.0012", "fx_rate_local_per_usd": "4047.0", "fx_source": "from_colombia_cambio_dolar", "information_text": "", "description_text": "Disfruta con tu familia y amigos todas las deliciosas recetas que puedes preparar con los productos más frescos que traemos para ti. Este producto es vendido, facturado y entregado por Cencosud - Colombia Los precios de los productos pueden cambiar dependiendo de la región. Aplican Términos y Condiciones Desactivados Referencia: 0258508 $ 2 x gr MAXIMA MP ☆ ¿Todavía tienes tu Tarjeta Cencosud? Solicítala en línea, úsala y obtén un . Aplican términos y condiciones. Solicítala aquí Términos más buscados 1. kefir alpina 2. muebles 3. leche 4. leche alqueria 5. san jorge 6. papel higiénico 7. arroz 8. café 9. cerveza 10. neveras", "features_text": "", "specifications_text": "", "benefits_text": "", "details_text": "", "other_sections": "", "sections": {"Descripción": ["Disfruta con tu familia y amigos todas las deliciosas recetas que puedes preparar con los productos más frescos que traemos para ti.", "Este producto es vendido, facturado y entregado por", "Cencosud - Colombia", "Los precios de los productos pueden cambiar dependiendo de la región.", "Aplican Términos y Condiciones", "Desactivado", "Referencia: 0258508", "$", "2", "x", "gr", "MAXIMA MP", "☆", "¿Todavía tienes tu Tarjeta Cencosud?", "Solicítala en línea, úsala y obtén un", ". Aplican términos y condiciones.", "Solicítala aquí", "Términos más buscados", "1.", "kefir alpina", "2.", "muebles", "3.", "leche", "4.", "leche alqueria", "5.", "san jorge", "6.", "papel higienico", "7.", "arroz", "8.", "cafe", "9.", "cerveza", "10.", "neveras"]}, "txt_path": "dataset/txt_limpios/689.txt", "html_path": "dataset/paginas_descargadas/689.html", "es_status": "ET", "category_canonical": "cafe", "decision": "keep", "match_score": 0.6, "reasons": "heuristic_default"}
{"source_id": "690", "title": "ASESORAMOS TU COMPRA: 📞(601) 6672004, lun a sab de 7am.a 7pm dom hasta las 6pm", "description": "Las papas McCain son las mejores para acompañar tus deseos y platos especiales Este producto es vendido, facturado y entregado por Cencosud - Colombia Los precios de los productos pueden cambiar dependiendo de la región. Aplican Términos y Condiciones APLICACIÓN PARA Referencia: 3364715 $ 26 , 39 x gr MC CAIN ☆ ¿Todavía tienes tu Tarjeta Cencosud? Solicítala en línea, úsala y obtén un . Aplican términos y condiciones. Solicítala aquí Mejores ofertas -5% Términos más buscados 1. kefir alpina 2. muebles 3. leche 4. leche alqueria 5. san jorge 6. papel higiénico 7. arroz 8. café 9. cerveza 10. neveras", "breadcrumbs": "otras ciudades consulta aquí > 3364715", "price_raw": "26.39", "currency_raw": "COP", "url": "", "seller": "Desconocido", "availability": "unknown", "country": "CO", "product_name": "ASESORAMOS TU COMPRA: 📞(601) 6672004, lun a sab de 7am.a 7pm dom hasta las 6pm", "brand": "otras ciudades consulta aquí", "reference": "3364715.0", "unit": "", "price_amount": 26.39, "price_currency": "COP", "price_symbol": "$", "price_text": "$26.39", "price_amount_filled": "26.39", "price_is_imputed": "False", "price_imputation_source": "original", "price_amount_usd": "0.0065", "price_amount_usd_filled": "0.0065", "fx_rate_local_per_usd": "4047.0", "fx_source": "from_colombia_cambio_dolar", "information_text": "", "description_text": "Las papas McCain son las mejores para acompañar tus deseos y platos especiales Este producto es vendido, facturado y entregado por Cencosud - Colombia Los precios de los productos pueden cambiar dependiendo de la región. Aplican Términos y Condiciones APLICACIÓN PARA Referencia: 3364715 $ 26 , 39 x gr MC CAIN ☆ ¿Todavía tienes tu Tarjeta Cencosud? Solicítala en línea, úsala y obtén un . Aplican términos y condiciones. Solicítala aquí Mejores ofertas -5% Términos más buscados 1. kefir alpina 2. muebles 3. leche 4. leche alqueria 5. san jorge 6. papel higiénico 7. arroz 8. café 9. cerveza 10. neveras", "features_text": "", "specifications_text": "", "benefits_text": "", "details_text": "", "other_sections": "", "sections": {"Descripción": ["Las papas McCain son las mejores para acompañar tus antojos y platos especiales", "Este producto es vendido, facturado y entregado por", "Cencosud - Colombia", "Los precios de los productos pueden cambiar dependiendo de la región.", "Aplican Términos y Condiciones", "APLICA PARA", "Referencia: 3364715", "$", "26", ",", "39", "x", "gr", "MC CAIN", "☆", "¿Todavía tienes tu Tarjeta Cencosud?", "Solicítala en línea, úsala y obtén un", ". Aplican términos y condiciones.", "Solicítala aquí", "Mejores ofertas", "-5%", "Términos más buscados", "1.", "kefir alpina", "2.", "muebles", "3.", "leche", "4.", "leche alqueria", "5.", "san jorge", "6.", "papel higienico", "7.", "arroz", "8.", "cafe", "9.", "cerveza", "10.", "neveras"]}, "txt_path": "dataset/txt_limpios/690.txt", "html_path": "dataset/paginas_descargadas/690.html", "es_status": "ET", "category_canonical": "papa", "decision": "keep", "match_score": 0.6, "reasons": "heuristic_default"}
{"source_id": "691", "title": "ASESORAMOS TU COMPRA: 📞(601) 6672004, lun a sab de 7am.a 7pm dom hasta las 6pm", "description": "Ingredientes Condición alimentaria Información nutricional Acompaña tus comidas con el delicioso sabor del queso Colanta. Fresco, rico y versatil. Este producto es vendido, facturado y entregado por Cencosud - Colombia Los precios de los productos pueden cambiar dependiendo de la región. Aplican Términos y Condiciones Referencia: 0019252 $ 27, 37 x gr COLANTA ☆ ¿Todavía tienes tu Tarjeta Cencosud? Solicítala en línea, úsala y obtén un . Aplican términos y condiciones. Solicítala aquí Mejores ofertas -25% -19% Términos más buscados 1. kefir alpina 2. muebles 3. leche 4. leche alqueria 5. san jorge 6. papel higiénico 7. arroz 8. café 9. cerveza 10. neveras", "breadcrumbs": "otras ciudades consulta aquí > 0019252", "price_raw": "500.0", "currency_raw": "COP", "url": "", "seller": "Desconocido", "availability": "unknown", "country": "CO", "product_name": "ASESORAMOS TU COMPRA: 📞(601) 6672004, lun a sab de 7am.a 7pm dom hasta las 6pm", "brand": "otras ciudades consulta aquí", "reference": "19252.0", "unit": "", "price_amount": 500.0, "price_currency": "COP", "price_symbol": "", "price_text": "500", "price_amount_filled": "500.0", "price_is_imputed": "False", "price_imputation_source": "original", "price_amount_usd": "0.1235", "price_amount_usd_filled": "0.1235", "fx_rate_local_per_usd": "4047.0", "fx_source": "from_colombia_cambio_dolar", "information_text": "", "description_text": "Ingredientes Condición alimentaria Información nutricional Acompaña tus comidas con el delicioso sabor del queso Colanta. Fresco, rico y versatil. Este producto es vendido, facturado y entregado por Cencosud - Colombia Los precios de los productos pueden cambiar dependiendo de la región. Aplican Términos y Condiciones Referencia: 0019252 $ 27, 37 x gr COLANTA ☆ ¿Todavía tienes tu Tarjeta Cencosud? Solicítala en línea, úsala y obtén un . Aplican términos y condiciones. Solicítala aquí Mejores ofertas -25% -19% Términos más buscados 1. kefir alpina 2. muebles 3. leche 4. leche alqueria 5. san jorge 6. papel higiénico 7. arroz 8. café 9. cerveza 10. neveras", "features_text": "", "specifications_text": "", "benefits_text": "", "details_text": "", "other_sections": "", "sections": {"Descripción": ["Ingredientes", "Condición alimentaria", "Información nutricional", "Acompaña tus comidas con el delicioso sabor del queso Colanta. Fresco, rico y versatil.", "Este producto es vendido, facturado y entregado por", "Cencosud - Colombia", "Los precios de los productos pueden cambiar dependiendo de la región.", "Aplican Términos y Condiciones", "Referencia: 0019252", "$", "27", ",", "37", "x", "gr", "COLANTA", "☆", "¿Todavía tienes tu Tarjeta Cencosud?", "Solicítala en línea, úsala y obtén un", ". Aplican términos y condiciones.", "Solicítala aquí", "Mejores ofertas", "-25%", "-19%", "Términos más buscados", "1.", "kefir alpina", "2.", "muebles", "3.", "leche", "4.", "leche alqueria", "5.", "san jorge", "6.", "papel higienico", "7.", "arroz", "8.", "cafe", "9.", "cerveza", "10.", "neveras"]}, "txt_path": "dataset/txt_limpios/691.txt", "html_path": "dataset/paginas_descargadas/691.html", "es_status": "ET", "category_canonical": "cafe", "decision": "keep", "match_score": 0.6, "reasons": "heuristic_default"}
{"source_id": "692", "title": "ASESORAMOS TU COMPRA: 📞(601) 6672004, lun a sab de 7am.a 7pm dom hasta las 6pm", "description": "Ingredientes Condición alimentaria Información nutricional Prepara y disfruta deliciosas recetas con queso mozarella Alpina. Este producto es vendido, facturado y entregado por Cencosud - Colombia Los precios de los productos pueden cambiar dependiendo de la región. Aplican Términos y Condiciones Desactivados Referencia: 0098841 $ 56, 38 x gr ALPINA ☆ ¿Todavía tienes tu Tarjeta Cencosud? Solicítala en línea, úsala y obtén un . Aplican términos y condiciones. Solicítala aquí Términos más buscados 1. kefir alpina 2. muebles 3. leche 4. leche alqueria 5. san jorge 6. papel higiénico 7. arroz 8. café 9. cerveza 10. neveras", "breadcrumbs": "otras ciudades consulta aquí > 0098841", "price_raw": "25.0", "currency_raw": "COP", "url": "", "seller": "Desconocido", "availability": "unknown", "country": "CO", "product_name": "ASESORAMOS TU COMPRA: 📞(601) 6672004, lun a sab de 7am.a 7pm dom hasta las 6pm", "brand": "otras ciudades consulta aquí", "reference": "98841.0", "unit": "", "price_amount": 25.0, "price_currency": "COP", "price_symbol": "", "price_text": "25", "price_amount_filled": "25.0", "price_is_imputed": "False", "price_imputation_source": "original", "price_amount_usd": "0.0062", "price_amount_usd_filled": "0.0062", "fx_rate_local_per_usd": "4047.0", "fx_source": "from_colombia_cambio_dolar", "information_text": "", "description_text": "Ingredientes Condición alimentaria Información nutricional Prepara y disfruta deliciosas recetas con queso mozarella Alpina. Este producto es vendido, facturado y entregado por Cencosud - Colombia Los precios de los productos pueden cambiar dependiendo de la región. Aplican Términos y Condiciones Desactivados Referencia: 0098841 $ 56, 38 x gr ALPINA ☆ ¿Todavía tienes tu Tarjeta Cencosud? Solicítala en línea, úsala y obtén un . Aplican términos y condiciones. Solicítala aquí Términos más buscados 1. kefir alpina 2. muebles 3. leche 4. leche alqueria 5. san jorge 6. papel higiénico 7. arroz 8. café 9. cerveza 10. neveras", "features_text": "", "specifications_text": "", "benefits_text": "", "details_text": "", "other_sections": "", "sections": {"Descripción": ["Ingredientes", "Condición alimentaria", "Información nutricional", "Prepara y disfruta deliciosas recetas con queso mozarella Alpina.", "Este producto es vendido, facturado y entregado por", "Cencosud - Colombia", "Los precios de los productos pueden cambiar dependiendo de la región.", "Aplican Términos y Condiciones", "Desactivado", "Referencia: 0098841", "$", "56", ",", "38", "x", "gr", "ALPINA", "☆", "¿Todavía tienes tu Tarjeta Cencosud?", "Solicítala en línea, úsala y obtén un", ". Aplican términos y condiciones.", "Solicítala aquí", "Términos más buscados", "1.", "kefir alpina", "2.", "muebles", "3.", "leche", "4.", "leche alqueria", "5.", "san jorge", "6.", "papel higienico", "7.", "arroz", "8.", "cafe", "9.", "cerveza", "10.", "neveras"]}, "txt_path": "dataset/txt_limpios/692.txt", "html_path": "dataset/paginas_descargadas/692.html", "es_status": "ET", "category_canonical": "cafe", "decision": "keep", "match_score": 0.6, "reasons": "heuristic_default"}
