source_id,title,description,breadcrumbs,price_raw,currency_raw,url,seller,availability,country,product_name,brand,reference,unit,price_amount,price_currency,price_symbol,price_text,price_amount_filled,price_is_imputed,price_imputation_source,price_amount_usd,price_amount_usd_filled,fx_rate_local_per_usd,fx_source,information_text,description_text,features_text,specifications_text,benefits_text,details_text,other_sections,sections,txt_path,html_path,es_status,category_canonical,decision,match_score,reasons
1738,Fiambres y Huevos,"Huevos Gran Blanco Tottus 12Unidades | Actualizado al: 10-10-2024 Ingredientes: Huevo gran blanco. Certificados: Apto para APLV Libre de Lactosa Vegetariano Libre de Soya Libre de Peces Libre de Mariscos Libre de Maní Libre de Frutas Secos Libre de Nueces Libre de Sulfitos Libre de Trigo Porción: 1 Huevo (58g) Porciones por envase: 12 100g 1 Porción Energía (kCal) 124 71.9 Proteínas (g) 13 7.5 Grasas Totales 8 4.6 Grasas saturadas (g) 3 1.7 Grasas (g) 3.6 2.1 Grasas poliinsaturadas (g) 1.4 0,8 Grasas trans (g) 0 colesterol (mg) 388 225 Hidratos de carbono disponibles 0.5 0.3 Azúcar total (g) Sodio 138 80 Importante: La información del empaque y/o contenido del producto final puede diferir respecto a lo que mostramos en nuestro sitio web, tanto a nivel de ingredientes, trazas, información nutricional, sellos, modo de uso y/o modo de conservación. Usted debe basarse únicamente en la información que se muestra en nuestro sitio web y siempre debe leer las etiquetas, advertencias y instrucciones antes de usar el consumo de un producto. Información obtenida de HUEVO GRAND BLANC 12U TOTTUS 696 GR Productos similares Ver producto Huevo Gran Color Huevo Gran Gallina Libre Huevo Color Gran Huevo Blanco Extra Gran Huevo Blanco Gran Huevos Blanco Gran Huevos Blanco Grande Yemita 12 Un Huevos Blancos Grandes Don Vicho 12 Un Huevos de Color Gallinas Libre La Granja 12 Un ¡Juntos son mejores! Papa en Malla 2 Kg Plátano Extra Granel KG Cebolla en Malla 1 Kg Tomate Larga Vida a Granel Papa a Granel Cebolla a Granel Tomate en Malla 1 Kg Zanahoria en Bolsa 1 Kg Zanahoria Jugo en Bolsa 1 Kg",Huevos > 12Unidades,3.85,,,Desconocido,unknown,UNKNOWN,Fiambres y Huevos,Huevos,,12Unidades,3.85,,,3.85,3.85,False,original,3.85,3.85,1.0,default_1usd,,"Huevos Gran Blanco Tottus 12Unidades | Actualizado al: 10-10-2024 Ingredientes: Huevo gran blanco. Certificados: Apto para APLV Libre de Lactosa Vegetariano Libre de Soya Libre de Peces Libre de Mariscos Libre de Maní Libre de Frutas Secos Libre de Nueces Libre de Sulfitos Libre de Trigo Porción: 1 Huevo (58g) Porciones por envase: 12 100g 1 Porción Energía (kCal) 124 71.9 Proteínas (g) 13 7.5 Grasas Totales 8 4.6 Grasas saturadas (g) 3 1.7 Grasas (g) 3.6 2.1 Grasas poliinsaturadas (g) 1.4 0,8 Grasas trans (g) 0 colesterol (mg) 388 225 Hidratos de carbono disponibles 0.5 0.3 Azúcar total (g) Sodio 138 80 Importante: La información del empaque y/o contenido del producto final puede diferir respecto a lo que mostramos en nuestro sitio web, tanto a nivel de ingredientes, trazas, información nutricional, sellos, modo de uso y/o modo de conservación. Usted debe basarse únicamente en la información que se muestra en nuestro sitio web y siempre debe leer las etiquetas, advertencias y instrucciones antes de usar el consumo de un producto. Información obtenida de HUEVO GRAND BLANC 12U TOTTUS 696 GR Productos similares Ver producto Huevo Gran Color Huevo Gran Gallina Libre Huevo Color Gran Huevo Blanco Extra Gran Huevo Blanco Gran Huevos Blanco Gran Huevos Blanco Grande Yemita 12 Un Huevos Blancos Grandes Don Vicho 12 Un Huevos de Color Gallinas Libre La Granja 12 Un ¡Juntos son mejores! Papa en Malla 2 Kg Plátano Extra Granel KG Cebolla en Malla 1 Kg Tomate Larga Vida a Granel Papa a Granel Cebolla a Granel Tomate en Malla 1 Kg Zanahoria en Bolsa 1 Kg Zanahoria Jugo en Bolsa 1 Kg",,,,,,"{""Descripción"": [""Huevos Grande Blanco  Tottus"", ""12Unidades | Actualizado al: 10-10-2024"", ""Ingredientes: Huevo grande blanco."", ""Certificados: Apto para APLV"", ""Libre de Lactosa"", ""Vegetariano"", ""Libre de Soya"", ""Libre de Peces"", ""Libre de Mariscos"", ""Libre de Maní"", ""Libre de Frutos Secos"", ""Libre de Nueces"", ""Libre de Sulfitos"", ""Libre de Trigo"", ""Porción: 1 Huevo (58g)"", ""Porciones por envase: 12"", ""100g"", ""1 Porción"", ""Energía"", ""(kCal)"", ""124"", ""71.9"", ""Proteínas"", ""(g)"", ""13"", ""7.5"", ""Grasas Totales"", ""8"", ""4.6"", ""Grasas saturadas (g)"", ""3"", ""1.7"", ""Grasas monoinsaturadas (g)"", ""3.6"", ""2.1"", ""Grasas poliinsaturadas (g)"", ""1.4"", ""0.8"", ""Grasas trans (g)"", ""0"", ""Colesterol"", ""(mg)"", ""388"", ""225"", ""Hidratos de carbono disponibles"", ""0.5"", ""0.3"", ""Azúcar total (g)"", ""Sodio"", ""138"", ""80"", ""Importante: La información del empaque y/o contenido del producto final puede diferir respecto a lo que mostramos en nuestro sitio web, tanto a nivel de ingredientes, trazas, información nutricional, sellos, modo de uso y/o modo de conservación. Usted debe basarse únicamente en la información que se muestra en nuestro sitio web y siempre debe leer las etiquetas, advertencias y instrucciones antes de usar el consumo de un producto."", ""Información obtenida de"", ""HUEVO  GRAND BLANC 12U  TOTTUS 696 GR"", ""Productos similares"", ""Ver producto"", ""Huevo Grande Color"", ""Huevo Grande Gallina Libre"", ""Huevo Color Grande"", ""Huevo Blanco Extra Grande"", ""Huevo Blanco Grande"", ""Huevos Blanco Grande"", ""Huevos Blanco Grande Yemita 12 Un"", ""Huevos Blancos Grandes Don Vicho 12 Un"", ""Huevos de Color Gallinas Libre La Granja 12 Un"", ""¡Juntos son mejores!"", ""Papa en Malla 2 Kg"", ""Plátano Extra Granel"", ""KG"", ""Cebolla en Malla 1 Kg"", ""Tomate Larga Vida a Granel"", ""Papa a Granel"", ""Cebolla a Granel"", ""Tomate en Malla 1 Kg"", ""Zanahoria en Bolsa 1 Kg"", ""Zanahoria Jugo en Bolsa 1 Kg""]}",dataset/txt_limpios/1738.txt,dataset/paginas_descargadas/1738.html,ET,azucar,keep,0.60,heuristic_default
1751,Fiambres y Huevos,"Huevos 12 Un Grande L Blanco Cintazul 648g | Actualizado al: 24-05-2025 Ingredientes: Huevos. Certificados: Apto para APLV Libre de Lactosa Vegetariano Libre de Soya Libre de Peces Libre de Mariscos Libre de Maní Libre de Frutas Secos Libre de Nueces Libre de Sulfitos Libre de Trigo Porción: 1 Huevo sin Cáscara (51g) Porciones por envase: 12 100g 1 Porción Energía (kCal) 149 76 Proteínas (g) 12 6.1 Grasas Totales 9.8 5 Grasas saturadas (g) 3.7 1.9 Grasas (g) 2.8 1.4 Grasas poliinsaturadas (g) 0.7 Grasas trans (g) 0,1 Colesterol (mg) 370 188.7 Hidratos de carbono disponibles Azúcar total (g) 0.5 0.3 Sodio 150 76.5 Importante: La información del empaque y/o contenido del producto final puede diferir respecto a lo que mostramos en nuestro sitio web, tanto a nivel de ingredientes, trazas, información nutricional, sellos, modo de uso y/o modo de conservación. Usted debe basarse únicamente en la información que se muestra en nuestro sitio web y siempre debe leer las etiquetas, advertencias y instrucciones antes de usar el consumo de un producto. Información obtenida de HUEVOGRANDE BLANCO CINTAZUL 12 UND Productos similares Huevos Blanco Grande Yemita 12 Un Ver producto Huevo Blanco Extra Grande Huevo Gallina Libre HUEVOS COLOR GRAN 12 UN. YEM Huevo Color Gran Huevo Gran Blanco Huevos de color Gallinas Libre La Granja 12 Un Huevos Blanco Extra Grande Yemita 12 Un Huevos Blanco Grande Huevo Primera Color Huevo Gran Gallina Libre Huevo de Color Gallina Libre La Granja 6 Un HUEVO EXTRA BLANCO 12 UN COLIUMO HUEVO GRAN LIBRE PASTO CINTAZUL 12 UND Huevo de Color Gallina Libre ¡Juntos son mejores! Papa en Malla 2 Kg Plátano Extra Granel KG Tomate Larga Vida a Granel Cebolla en Malla 1 Kg Zanahoria en Bolsa 1 Kg Tomate en Malla 1 Kg Zanahoria Jugo en Bolsa 1 Kg Cebolla Granel Papa a Granel",Huevos > 648g,4.2,,,Desconocido,unknown,UNKNOWN,Fiambres y Huevos,Huevos,,648g,4.20,,,4.20,4.2,False,original,4.2,4.2,1.0,default_1usd,,"Huevos 12 Un Grande L Blanco Cintazul 648g | Actualizado al: 24-05-2025 Ingredientes: Huevos. Certificados: Apto para APLV Libre de Lactosa Vegetariano Libre de Soya Libre de Peces Libre de Mariscos Libre de Maní Libre de Frutas Secos Libre de Nueces Libre de Sulfitos Libre de Trigo Porción: 1 Huevo sin Cáscara (51g) Porciones por envase: 12 100g 1 Porción Energía (kCal) 149 76 Proteínas (g) 12 6.1 Grasas Totales 9.8 5 Grasas saturadas (g) 3.7 1.9 Grasas (g) 2.8 1.4 Grasas poliinsaturadas (g) 0.7 Grasas trans (g) 0,1 Colesterol (mg) 370 188.7 Hidratos de carbono disponibles Azúcar total (g) 0.5 0.3 Sodio 150 76.5 Importante: La información del empaque y/o contenido del producto final puede diferir respecto a lo que mostramos en nuestro sitio web, tanto a nivel de ingredientes, trazas, información nutricional, sellos, modo de uso y/o modo de conservación. Usted debe basarse únicamente en la información que se muestra en nuestro sitio web y siempre debe leer las etiquetas, advertencias y instrucciones antes de usar el consumo de un producto. Información obtenida de HUEVOGRANDE BLANCO CINTAZUL 12 UND Productos similares Huevos Blanco Grande Yemita 12 Un Ver producto Huevo Blanco Extra Grande Huevo Gallina Libre HUEVOS COLOR GRAN 12 UN. YEM Huevo Color Gran Huevo Gran Blanco Huevos de color Gallinas Libre La Granja 12 Un Huevos Blanco Extra Grande Yemita 12 Un Huevos Blanco Grande Huevo Primera Color Huevo Gran Gallina Libre Huevo de Color Gallina Libre La Granja 6 Un HUEVO EXTRA BLANCO 12 UN COLIUMO HUEVO GRAN LIBRE PASTO CINTAZUL 12 UND Huevo de Color Gallina Libre ¡Juntos son mejores! Papa en Malla 2 Kg Plátano Extra Granel KG Tomate Larga Vida a Granel Cebolla en Malla 1 Kg Zanahoria en Bolsa 1 Kg Tomate en Malla 1 Kg Zanahoria Jugo en Bolsa 1 Kg Cebolla Granel Papa a Granel",,,,,,"{""Descripción"": [""Huevos 12 Un Grande L Blanco Cintazul"", ""648g | Actualizado al: 24-05-2025"", ""Ingredientes: Huevos."", ""Certificados: Apto para APLV"", ""Libre de Lactosa"", ""Vegetariano"", ""Libre de Soya"", ""Libre de Peces"", ""Libre de Mariscos"", ""Libre de Maní"", ""Libre de Frutos Secos"", ""Libre de Nueces"", ""Libre de Sulfitos"", ""Libre de Trigo"", ""Porción: 1 Huevo sin Cáscara (51g)"", ""Porciones por envase: 12"", ""100g"", ""1 Porción"", ""Energía"", ""(kCal)"", ""149"", ""76"", ""Proteínas"", ""(g)"", ""12"", ""6.1"", ""Grasas Totales"", ""9.8"", ""5"", ""Grasas saturadas (g)"", ""3.7"", ""1.9"", ""Grasas monoinsaturadas (g)"", ""2.8"", ""1.4"", ""Grasas poliinsaturadas (g)"", ""0.7"", ""Grasas trans (g)"", ""0.1"", ""Colesterol"", ""(mg)"", ""370"", ""188.7"", ""Hidratos de carbono disponibles"", ""Azúcar total (g)"", ""0.5"", ""0.3"", ""Sodio"", ""150"", ""76.5"", ""Importante: La información del empaque y/o contenido del producto final puede diferir respecto a lo que mostramos en nuestro sitio web, tanto a nivel de ingredientes, trazas, información nutricional, sellos, modo de uso y/o modo de conservación. Usted debe basarse únicamente en la información que se muestra en nuestro sitio web y siempre debe leer las etiquetas, advertencias y instrucciones antes de usar el consumo de un producto."", ""Información obtenida de"", ""HUEVOGRANDE BLANCO CINTAZUL 12 UND"", ""Productos similares"", ""Huevos Blanco Grande Yemita 12 Un"", ""Ver producto"", ""Huevo Blanco Extra Grande"", ""Huevo Gallina Libre"", ""HUEVOS COLOR GRANDE 12 UN. YEM"", ""Huevo Color Grande"", ""Huevo Grande Blanco"", ""Huevos de Color Gallinas Libre La Granja 12 Un"", ""Huevos Blanco Extra Grande Yemita 12 Un"", ""Huevos Blanco Grande"", ""Huevo Primera Color"", ""Huevo Grande Gallina Libre"", ""Huevo de Color Gallina Libre La Granja 6 Un"", ""HUEVO EXTRA BLANCO 12 UN COLIUMO"", ""HUEVO GRAN LIBRE PASTO CINTAZUL 12 UND"", ""Huevo de Color Gallina Libre"", ""¡Juntos son mejores!"", ""Papa en Malla 2 Kg"", ""Plátano Extra Granel"", ""KG"", ""Tomate Larga Vida a Granel"", ""Cebolla en Malla 1 Kg"", ""Zanahoria en Bolsa 1 Kg"", ""Tomate en Malla 1 Kg"", ""Zanahoria Jugo en Bolsa 1 Kg"", ""Cebolla a Granel"", ""Papa a Granel""]}",dataset/txt_limpios/1751.txt,dataset/paginas_descargadas/1751.html,ET,azucar,keep,0.60,heuristic_default
1752,Fiambres y Huevos,"Huevos 12 Un Gran Blanco L Yemita 648g | Actualizado al: 25-01-2025 Ingredientes: Huevo. Certificados: Apto para APLV Libre de Lactosa Vegetariano Libre de Soya Libre de Peces Libre de Mariscos Libre de Maní Libre de Frutas Secos Libre de Nueces Libre de Sulfitos Libre de Trigo Porción: 1 Huevo (51g) Porciones por envase: 12 100g 1 Porción Energía (kCal) 149 76 Proteínas (g) 12 6.1 Grasas Totales 9.8 5 Grasas saturadas (g) 3.7 1.9 Grasas (g) 2.8 1.4 Grasas poliinsaturadas (g) 0.7 Grasas trans (g) 0,1 Colesterol (mg) 370 188.7 Hidratos de carbono disponibles Azúcar total (g) 0.5 0.3 Sodio 150 76.5 Importante: La información del empaque y/o contenido del producto final puede diferir respecto a lo que mostramos en nuestro sitio web, tanto a nivel de ingredientes, trazas, información nutricional, sellos, modo de uso y/o modo de conservación. Usted debe basarse únicamente en la información que se muestra en nuestro sitio web y siempre debe leer las etiquetas, advertencias y instrucciones antes de usar el consumo de un producto. Información obtenida de HUEVOS BLANCO GRAN 12 UN. YEM. Productos similares HUEVOS COLOR GRAN 12 UN. YEM Ver producto Huevo Blanco Gran Huevos Blanco Extra Grande Yemita 12 Un Huevos de Color Gallinas Libre La Granja 12 Un Huevo Blanco Extra Grande Huevos de Color Gallinas Libres Medianos Ecoterra 12 Un Huevos Blanco Grande HUEVO EXTRA BLANCO 12 UN COLIUMO Huevo Gallina Libre Huevo Gran Blanco Huevo Primera Color HUEVO GRAN LIBRE PASTO CINTAZUL 12 UND Huevo Color Gran Huevos de Color Gallinas Libres Ecoterra 20 Un ¡Juntos son mejores! Papa en Malla 2 Kg Plátano Extra Granel KG Cebolla en Malla 1 Kg Tomate Larga Vida a Granel Tomate en Malla 1 Kg Zanahoria en Bolsa 1 Kg Cebolla a Granel Zanahoria Jugo en Bolsa 1 Kg Papa Granel",Huevos > 648g,4.1,,,Desconocido,unknown,UNKNOWN,Fiambres y Huevos,Huevos,,648g,4.10,,,4.10,4.1,False,original,4.1,4.1,1.0,default_1usd,,"Huevos 12 Un Gran Blanco L Yemita 648g | Actualizado al: 25-01-2025 Ingredientes: Huevo. Certificados: Apto para APLV Libre de Lactosa Vegetariano Libre de Soya Libre de Peces Libre de Mariscos Libre de Maní Libre de Frutas Secos Libre de Nueces Libre de Sulfitos Libre de Trigo Porción: 1 Huevo (51g) Porciones por envase: 12 100g 1 Porción Energía (kCal) 149 76 Proteínas (g) 12 6.1 Grasas Totales 9.8 5 Grasas saturadas (g) 3.7 1.9 Grasas (g) 2.8 1.4 Grasas poliinsaturadas (g) 0.7 Grasas trans (g) 0,1 Colesterol (mg) 370 188.7 Hidratos de carbono disponibles Azúcar total (g) 0.5 0.3 Sodio 150 76.5 Importante: La información del empaque y/o contenido del producto final puede diferir respecto a lo que mostramos en nuestro sitio web, tanto a nivel de ingredientes, trazas, información nutricional, sellos, modo de uso y/o modo de conservación. Usted debe basarse únicamente en la información que se muestra en nuestro sitio web y siempre debe leer las etiquetas, advertencias y instrucciones antes de usar el consumo de un producto. Información obtenida de HUEVOS BLANCO GRAN 12 UN. YEM. Productos similares HUEVOS COLOR GRAN 12 UN. YEM Ver producto Huevo Blanco Gran Huevos Blanco Extra Grande Yemita 12 Un Huevos de Color Gallinas Libre La Granja 12 Un Huevo Blanco Extra Grande Huevos de Color Gallinas Libres Medianos Ecoterra 12 Un Huevos Blanco Grande HUEVO EXTRA BLANCO 12 UN COLIUMO Huevo Gallina Libre Huevo Gran Blanco Huevo Primera Color HUEVO GRAN LIBRE PASTO CINTAZUL 12 UND Huevo Color Gran Huevos de Color Gallinas Libres Ecoterra 20 Un ¡Juntos son mejores! Papa en Malla 2 Kg Plátano Extra Granel KG Cebolla en Malla 1 Kg Tomate Larga Vida a Granel Tomate en Malla 1 Kg Zanahoria en Bolsa 1 Kg Cebolla a Granel Zanahoria Jugo en Bolsa 1 Kg Papa Granel",,,,,,"{""Descripción"": [""Huevos 12 Un Grande Blanco L Yemita"", ""648g | Actualizado al: 25-01-2025"", ""Ingredientes: Huevo."", ""Certificados: Apto para APLV"", ""Libre de Lactosa"", ""Vegetariano"", ""Libre de Soya"", ""Libre de Peces"", ""Libre de Mariscos"", ""Libre de Maní"", ""Libre de Frutos Secos"", ""Libre de Nueces"", ""Libre de Sulfitos"", ""Libre de Trigo"", ""Porción: 1 Huevo (51g)"", ""Porciones por envase: 12"", ""100g"", ""1 Porción"", ""Energía"", ""(kCal)"", ""149"", ""76"", ""Proteínas"", ""(g)"", ""12"", ""6.1"", ""Grasas Totales"", ""9.8"", ""5"", ""Grasas saturadas (g)"", ""3.7"", ""1.9"", ""Grasas monoinsaturadas (g)"", ""2.8"", ""1.4"", ""Grasas poliinsaturadas (g)"", ""0.7"", ""Grasas trans (g)"", ""0.1"", ""Colesterol"", ""(mg)"", ""370"", ""188.7"", ""Hidratos de carbono disponibles"", ""Azúcar total (g)"", ""0.5"", ""0.3"", ""Sodio"", ""150"", ""76.5"", ""Importante: La información del empaque y/o contenido del producto final puede diferir respecto a lo que mostramos en nuestro sitio web, tanto a nivel de ingredientes, trazas, información nutricional, sellos, modo de uso y/o modo de conservación. Usted debe basarse únicamente en la información que se muestra en nuestro sitio web y siempre debe leer las etiquetas, advertencias y instrucciones antes de usar el consumo de un producto."", ""Información obtenida de"", ""HUEVOS BLANCO GRANDE 12 UN. YEM."", ""Productos similares"", ""HUEVOS COLOR GRANDE 12 UN. YEM"", ""Ver producto"", ""Huevo Blanco Grande"", ""Huevos Blanco Extra Grande Yemita 12 Un"", ""Huevos de Color Gallinas Libre La Granja 12 Un"", ""Huevo Blanco Extra Grande"", ""Huevos de Color Gallinas Libres Medianos Ecoterra 12 Un"", ""Huevos Blanco Grande"", ""HUEVO EXTRA BLANCO 12 UN COLIUMO"", ""Huevo Gallina Libre"", ""Huevo Grande Blanco"", ""Huevo Primera Color"", ""HUEVO GRAN LIBRE PASTO CINTAZUL 12 UND"", ""Huevo Color Grande"", ""Huevos de Color Gallinas Libres Ecoterra 20 Un"", ""¡Juntos son mejores!"", ""Papa en Malla 2 Kg"", ""Plátano Extra Granel"", ""KG"", ""Cebolla en Malla 1 Kg"", ""Tomate Larga Vida a Granel"", ""Tomate en Malla 1 Kg"", ""Zanahoria en Bolsa 1 Kg"", ""Cebolla a Granel"", ""Zanahoria Jugo en Bolsa 1 Kg"", ""Papa a Granel""]}",dataset/txt_limpios/1752.txt,dataset/paginas_descargadas/1752.html,ET,azucar,keep,0.60,heuristic_default
