{"source_id": "1188", "title": "Centro de preferencia de la privacidad", "description": "", "breadcrumbs": "Activas siempre > 560g", "price_raw": "", "currency_raw": "PEN", "url": "", "seller": "Desconocido", "availability": "unknown", "country": "PE", "product_name": "Centro de preferencia de la privacidad", "brand": "Activas siempre", "reference": "", "unit": "560g", "price_amount": null, "price_currency": "PEN", "price_symbol": "", "price_text": "", "price_amount_filled": "55.14", "price_is_imputed": "True", "price_imputation_source": "country_mean", "price_amount_usd": "", "price_amount_usd_filled": "15.5336", "fx_rate_local_per_usd": "3.55", "fx_source": "from_peru_cambio_dolar", "information_text": "", "description_text": "", "features_text": "TE RECOMENDAMOS | BIMBO | Pan Blanco sin Bordes BIMBO Bolsa 650g | 16 | 90 | -7% | UNIÓN | Pan de Molde UNIÓN Fibra Multicereal Bolsa 540g | 60 | 12 | 7% | BELL'S | Pan de Molde Integral BELL'S Mediano Bolsa 500g | 8 | 10 | LA FLORENCIA | Pan de Molde LA FLORENCIA Integal Bolsa 350g | 7 | Pan de Molde UNIÓN Multisemillas y Avena Bolsa 540g | Pan de Molde Marmoleado DON MAMINO sin Corteza Bolsa 560g | 50 | Pan de Molde BIMBO Blanco Familiar Bolsa 590g | Pan de Molde Integral UNIÓN Mediano Bolsa 360g | 9 | 70 | Pan de Molde Integral BIMBO sin Bordes Bolsa 650g | Pan de Molde Integral Multicereal LA FLORENCIA Bolsa 500g | 20 | ¡Entérate de eventos exclusivos y promociones especiales que tenemos para ti! | SUSCRIBIRME | Acepto las políticas de tratamientos de datos personales | Razón Social: Compañía Food Retail S.A.C. RUC: 20608300393. Todos los derechos reservados Vivanda 2023. | | Hola! | Encuentra todo lo que necesitas en Vivanda online | Términos más buscados | 1. | quesos | 2. | vino | 3. | café | 4. | quark 500g | 5. | leche | 6. | pollo | 7. | yogurt | 8. | lunch florencia | 9. | agua | 10 | vinos", "specifications_text": "", "benefits_text": "", "details_text": "", "other_sections": "", "sections": {"Características": ["TE RECOMENDAMOS", "BIMBO", "Pan Blanco sin Bordes BIMBO Bolsa 650g", "16", "90", "-7%", "UNIÓN", "Pan de Molde UNIÓN Fibra Multicereal Bolsa 540g", "60", "12", "7%", "BELL'S", "Pan de Molde Integral BELL'S Mediano Bolsa 500g", "8", "10", "LA FLORENCIA", "Pan de Molde LA FLORENCIA Integal Bolsa 350g", "7", "Pan de Molde UNIÓN Multisemillas y Avena Bolsa 540g", "Pan de Molde Marmoleado DON MAMINO sin Corteza Bolsa 560g", "50", "Pan de Molde BIMBO Blanco Familiar Bolsa 590g", "Pan de Molde Integral UNIÓN Mediano Bolsa 360g", "9", "70", "Pan de Molde Integral BIMBO sin Bordes Bolsa 650g", "Pan de Molde Integral Multicereal LA FLORENCIA Bolsa 500g", "20", "¡Entérate de eventos exclusivos y promociones especiales que tenemos para ti!", "SUSCRIBIRME", "Acepto las políticas de tratamiento de datos personales", "Razón social: Compañía Food Retail S.A.C. RUC: 20608300393. Todos los derechos reservados Vivanda 2023.", "¡Hola!", "Encuentra todo lo que necesitas en Vivanda online", "Términos más buscados", "1.", "quesos", "2.", "vino", "3.", "cafe", "4.", "quark 500g", "5.", "leche", "6.", "pollo", "7.", "yogurt", "8.", "lunch florencia", "9.", "agua", "10.", "vinos"]}, "txt_path": "dataset/txt_limpios/1188.txt", "html_path": "dataset/paginas_descargadas/1188.html", "es_status": "ET", "category_canonical": "sin_categoria", "decision": "discard", "match_score": 0.3, "reasons": "no_category_detected;price_parse_failed"}
{"source_id": "1190", "title": "Centro de preferencia de la privacidad", "description": "", "breadcrumbs": "Activas siempre > 500g", "price_raw": "", "currency_raw": "PEN", "url": "", "seller": "Desconocido", "availability": "unknown", "country": "PE", "product_name": "Centro de preferencia de la privacidad", "brand": "Activas siempre", "reference": "", "unit": "500g", "price_amount": null, "price_currency": "PEN", "price_symbol": "", "price_text": "", "price_amount_filled": "55.14", "price_is_imputed": "True", "price_imputation_source": "country_mean", "price_amount_usd": "", "price_amount_usd_filled": "15.5336", "fx_rate_local_per_usd": "3.55", "fx_source": "from_peru_cambio_dolar", "information_text": "", "description_text": "", "features_text": "", "specifications_text": "", "benefits_text": "", "details_text": "", "other_sections": "", "sections": {}, "txt_path": "dataset/txt_limpios/1190.txt", "html_path": "dataset/paginas_descargadas/1190.html", "es_status": "EN", "category_canonical": "sin_categoria", "decision": "discard", "match_score": 0.3, "reasons": "no_category_detected;price_parse_failed"}
{"source_id": "1191", "title": "Centro de preferencia de la privacidad", "description": "", "breadcrumbs": "Activas siempre > 500g", "price_raw": "", "currency_raw": "PEN", "url": "", "seller": "Desconocido", "availability": "unknown", "country": "PE", "product_name": "Centro de preferencia de la privacidad", "brand": "Activas siempre", "reference": "", "unit": "500g", "price_amount": null, "price_currency": "PEN", "price_symbol": "", "price_text": "", "price_amount_filled": "55.14", "price_is_imputed": "True", "price_imputation_source": "country_mean", "price_amount_usd": "", "price_amount_usd_filled": "15.5336", "fx_rate_local_per_usd": "3.55", "fx_source": "from_peru_cambio_dolar", "information_text": "", "description_text": "", "features_text": "TE RECOMENDAMOS | -23% | NICOLINI | Fideos NICOLINI Spaghetti Bolsa 1Kg | 5 | 4 | 30 | 23% | AGE | Fideos Fettuccini Integral AGE Bolsa 500g | 16 | 50 | Fideos Tallarín Grueso NICOLINI Bolsa 500g | 3 | 99 | -26% | AGNESI Spaghettini Bolsa 500g | 17 | 13 | 26% | LA MONTANARA | Fideos Tagliatelle de Huevo LA MONTANARAARA Bolsa 500g | 8 | Fideos Cabello de Ángel de Huevo LA MONTANARA Bolsa 250g | 40 | REGGIA | Carpeta Fusilli Tricollore REGGIA Bolsa 500g | 11 | GAROFALO | Fideos GAROFALO Fusilli Bolsa 500g | 20 | MOLITALIA | Fideos Tallarín MOLITALIA Bolsa 450g | ¡Entérate de eventos exclusivos y promociones especiales que tenemos para ti! | SUSCRIBIRME | Acepto las políticas de tratamientos de datos personales | Razón Social: Compañía Food Retail S.A.C. RUC: 20608300393. Todos los derechos reservados Vivanda 2023. | | Hola! | Encuentra todo lo que necesitas en Vivanda online | Términos más buscados | 1. | quesos | 2. | vino | 3. | café | 4. | quark 500g | 5. | leche | 6. | pollo | 7. | yogurt | 8. | lunch florencia | 9. | agua | 10 | vinos", "specifications_text": "", "benefits_text": "", "details_text": "", "other_sections": "", "sections": {"Características": ["TE RECOMENDAMOS", "-23%", "NICOLINI", "Fideos NICOLINI Spaghetti Bolsa 1Kg", "5", "4", "30", "23%", "AGE", "Fideos Fettuccini Integral AGE Bolsa 500g", "16", "50", "Fideos Tallarín Grueso NICOLINI Bolsa 500g", "3", "99", "-26%", "AGNESI", "Fideos AGNESI Spaghettini Bolsa 500g", "17", "13", "26%", "LA MONTANARA", "Fideos Tagliatelle de Huevo LA MONTANARA Bolsa 500g", "8", "Fideos Cabello de Ángel de Huevo LA MONTANARA Bolsa 250g", "40", "REGGIA", "Pasta Fusilli Tricollore REGGIA Bolsa 500g", "11", "GAROFALO", "Fideos GAROFALO Fusilli Bolsa 500g", "20", "MOLITALIA", "Fideos Tallarín MOLITALIA Bolsa 450g", "¡Entérate de eventos exclusivos y promociones especiales que tenemos para ti!", "SUSCRIBIRME", "Acepto las políticas de tratamiento de datos personales", "Razón social: Compañía Food Retail S.A.C. RUC: 20608300393. Todos los derechos reservados Vivanda 2023.", "¡Hola!", "Encuentra todo lo que necesitas en Vivanda online", "Términos más buscados", "1.", "quesos", "2.", "vino", "3.", "cafe", "4.", "quark 500g", "5.", "leche", "6.", "pollo", "7.", "yogurt", "8.", "lunch florencia", "9.", "agua", "10.", "vinos"]}, "txt_path": "dataset/txt_limpios/1191.txt", "html_path": "dataset/paginas_descargadas/1191.html", "es_status": "ET", "category_canonical": "sin_categoria", "decision": "discard", "match_score": 0.3, "reasons": "no_category_detected;price_parse_failed"}
{"source_id": "1192", "title": "Centro de preferencia de la privacidad", "description": "", "breadcrumbs": "Activas siempre > 450g", "price_raw": "", "currency_raw": "PEN", "url": "", "seller": "Desconocido", "availability": "unknown", "country": "PE", "product_name": "Centro de preferencia de la privacidad", "brand": "Activas siempre", "reference": "", "unit": "450g", "price_amount": null, "price_currency": "PEN", "price_symbol": "", "price_text": "", "price_amount_filled": "55.14", "price_is_imputed": "True", "price_imputation_source": "country_mean", "price_amount_usd": "", "price_amount_usd_filled": "15.5336", "fx_rate_local_per_usd": "3.55", "fx_source": "from_peru_cambio_dolar", "information_text": "", "description_text": "", "features_text": "TE RECOMENDAMOS | -11% | DON VITTORIO | Fideos DON VITTORIO Fettuccini Bolsa 950g | 6 | 20 | 5 | 50 | 11% | -17% | BARILLA | Fideo Spaghettoni BARILLA N°7 Caja 500g | 14 | 12 | 17% | -29% | AGNESI | Fideos AGNESI Fettucine Flat Bolsa 500g | 18 | 13 | 29% | Fideos Spaghetti BARILLA sin Gluten Caja 400g | 22 | 10 | AGE | Fideos Fettuccini Integral AGE Bolsa 500g | 16 | Fideos con Huevo SANTA CATALINA Bolsa 400g | Fideos DON VITTORIO Spaghetti Bolsa 950g | REGGIA | Pasta Fusilli Tricollore REGGIA Bolsa 500g | 11 | Fideos Caracol DON VITTORIO Bolsa 250g | 2 | DALLA COSTA | Carpeta Dinosaurio DALLA COSTA Tricolor Bolsa 250g | 40 | ¡Entérate de eventos exclusivos y promociones especiales que tenemos para ti! | SUSCRIBIRME | Acepto las políticas de tratamientos de datos personales | Razón Social: Compañía Food Retail S.A.C. RUC: 20608300393. Todos los derechos reservados Vivanda 2023. | | Hola! | Encuentra todo lo que necesitas en Vivanda online | Términos más buscados | 1. | quesos | 2. | vino | 3. | café | 4. | quark 500g | 5. | leche | 6. | pollo | 7. | yogurt | 8. | lunch florencia | 9. | agua | 10 | vinos", "specifications_text": "", "benefits_text": "", "details_text": "", "other_sections": "", "sections": {"Características": ["TE RECOMENDAMOS", "-11%", "DON VITTORIO", "Fideos DON VITTORIO Fettuccini Bolsa 950g", "6", "20", "5", "50", "11%", "-17%", "BARILLA", "Fideo Spaghettoni BARILLA N°7 Caja 500g", "14", "12", "17%", "-29%", "AGNESI", "Fideos AGNESI Fettucine Flat Bolsa 500g", "18", "13", "29%", "Fideos Spaghetti BARILLA sin Gluten Caja 400g", "22", "10", "AGE", "Fideos Fettuccini Integral AGE Bolsa 500g", "16", "Fideos con Huevo SANTA CATALINA Bolsa 400g", "Fideos DON VITTORIO Spaghetti Bolsa 950g", "REGGIA", "Pasta Fusilli Tricollore REGGIA Bolsa 500g", "11", "Fideos Caracol DON VITTORIO Bolsa 250g", "2", "DALLA COSTA", "Pasta Dinosaurio DALLA COSTA Tricolor Bolsa 250g", "40", "¡Entérate de eventos exclusivos y promociones especiales que tenemos para ti!", "SUSCRIBIRME", "Acepto las políticas de tratamiento de datos personales", "Razón social: Compañía Food Retail S.A.C. RUC: 20608300393. Todos los derechos reservados Vivanda 2023.", "¡Hola!", "Encuentra todo lo que necesitas en Vivanda online", "Términos más buscados", "1.", "quesos", "2.", "vino", "3.", "cafe", "4.", "quark 500g", "5.", "leche", "6.", "pollo", "7.", "yogurt", "8.", "lunch florencia", "9.", "agua", "10.", "vinos"]}, "txt_path": "dataset/txt_limpios/1192.txt", "html_path": "dataset/paginas_descargadas/1192.html", "es_status": "ET", "category_canonical": "sin_categoria", "decision": "discard", "match_score": 0.3, "reasons": "no_category_detected;price_parse_failed"}
{"source_id": "1193", "title": "Centro de preferencia de la privacidad", "description": "", "breadcrumbs": "Activas siempre > 500g", "price_raw": "", "currency_raw": "PEN", "url": "", "seller": "Desconocido", "availability": "unknown", "country": "PE", "product_name": "Centro de preferencia de la privacidad", "brand": "Activas siempre", "reference": "", "unit": "500g", "price_amount": null, "price_currency": "PEN", "price_symbol": "", "price_text": "", "price_amount_filled": "55.14", "price_is_imputed": "True", "price_imputation_source": "country_mean", "price_amount_usd": "", "price_amount_usd_filled": "15.5336", "fx_rate_local_per_usd": "3.55", "fx_source": "from_peru_cambio_dolar", "information_text": "", "description_text": "", "features_text": "TE RECOMENDAMOS | AGNESI | Fideos Integral AGNESI Spachetti Bolsa 500g | 20 | Fideos Spaghetti BARILLA sin Gluten Caja 400g | 22 | 10 | AGE | Fideos Fettuccini Integral AGE Bolsa 500g | 16 | -26% | Fideos AGNESI Spaghettini Bolsa 500g | 17 | 13 | 26% | Fideo Farfalle BARILLA Caja 500g | -17% | Fideos Spaghettini BARILLA Caja 500g | DON VITTORIO | Fideos Codo Chico DON VITTORIO Bolsa 250g | 2 | Fideos Codo Rayado DON VITTORIO Bolsa 250g | Fideos Tornillo DON VITTORIO Bolsa 250g | BELL'S | Fideos Spaghetti BELL'S Bolsa 900g | 4 | Entérate de eventos exclusivos y promociones especiales que tenemos para ti! | SUSCRIBIRME | Acepto las políticas de tratamientos de datos personales | Razón Social: Compañía Food Retail S.A.C. RUC: 20608300393. Todos los derechos reservados Vivanda 2023. | | Hola! | Encuentra todo lo que necesitas en Vivanda online | Términos más buscados | 1. | quesos | 2. | vino | 3. | café | 4. | quark 500g | 5. | leche | 6. | pollo | 7. | yogurt | 8. | lunch florencia | 9. | agua | 10 | vinos", "specifications_text": "", "benefits_text": "", "details_text": "", "other_sections": "", "sections": {"Características": ["TE RECOMENDAMOS", "AGNESI", "Fideos Integral AGNESI Spachetti Bolsa 500g", "20", "Fideos Spaghetti BARILLA sin Gluten Caja 400g", "22", "10", "AGE", "Fideos Fettuccini Integral AGE Bolsa 500g", "16", "-26%", "Fideos AGNESI Spaghettini Bolsa 500g", "17", "13", "26%", "Fideo Farfalle BARILLA Caja 500g", "-17%", "Fideos Spaghettini BARILLA Caja 500g", "DON VITTORIO", "Fideos Codo Chico DON VITTORIO Bolsa 250g", "2", "Fideos Codo Rayado DON VITTORIO Bolsa 250g", "Fideos Tornillo DON VITTORIO Bolsa 250g", "BELL'S", "Fideos Spaghetti BELL'S Bolsa 900g", "4", "¡Entérate de eventos exclusivos y promociones especiales que tenemos para ti!", "SUSCRIBIRME", "Acepto las políticas de tratamiento de datos personales", "Razón social: Compañía Food Retail S.A.C. RUC: 20608300393. Todos los derechos reservados Vivanda 2023.", "¡Hola!", "Encuentra todo lo que necesitas en Vivanda online", "Términos más buscados", "1.", "quesos", "2.", "vino", "3.", "cafe", "4.", "quark 500g", "5.", "leche", "6.", "pollo", "7.", "yogurt", "8.", "lunch florencia", "9.", "agua", "10.", "vinos"]}, "txt_path": "dataset/txt_limpios/1193.txt", "html_path": "dataset/paginas_descargadas/1193.html", "es_status": "ET", "category_canonical": "sin_categoria", "decision": "discard", "match_score": 0.3, "reasons": "no_category_detected;price_parse_failed"}
{"source_id": "1194", "title": "Centro de preferencia de la privacidad", "description": "", "breadcrumbs": "Activas siempre > 140g", "price_raw": "", "currency_raw": "PEN", "url": "", "seller": "Desconocido", "availability": "unknown", "country": "PE", "product_name": "Centro de preferencia de la privacidad", "brand": "Activas siempre", "reference": "", "unit": "140g", "price_amount": null, "price_currency": "PEN", "price_symbol": "", "price_text": "", "price_amount_filled": "55.14", "price_is_imputed": "True", "price_imputation_source": "country_mean", "price_amount_usd": "", "price_amount_usd_filled": "15.5336", "fx_rate_local_per_usd": "3.55", "fx_source": "from_peru_cambio_dolar", "information_text": "", "description_text": "", "features_text": "TE RECOMENDAMOS | BELL'S | Filete de Atún BELL'S en Agua Lata 150gr | 4 | 90 | Filete de caballa en Aceite BELL'S Lata 170g | 50 | -2% | GLORIA | Trozos de Atún en Aceite Vegetal GLORIA Lata 140g | 70 | 2% | -16% | Trozos de Atún FLORIDA en Aceite Vegetal Lata 140g | 16% | SANTORINI | Anchoveta en Salsa de Tomate SANTORINI Lata 200g | No disponible | REAL | Sólido de Atún REAL en Aceite Girasol Lata 140g | CAMPOMAR | Filete de Atún en Agua CAMPOMAR Lata 150g | Filete de Atún Artesanal CAMPOMAR Gourmet Frasco 160g | 7 | 60 | Trozos de Jurel BELL'S Lata 170g | 20 | EL CORTE INGLÉS | Lomos de Atún en Aceite de Girasol EL CORTE INGLÉS Pack 3 Lata 56g | 30 | ¡Entérate de eventos exclusivos y promociones especiales que tenemos para ti! | SUSCRIBIRME | Acepto las políticas de tratamientos de datos personales | Razón Social: Compañía Food Retail S.A.C. RUC: 20608300393. Todos los derechos reservados Vivanda 2023. | | Hola! | Encuentra todo lo que necesitas en Vivanda online | Términos más buscados | 1. | quesos | 2. | vino | 3. | café | 4. | quark 500g | 5. | leche | 6. | pollo | 7. | yogurt | 8. | lunch florencia | 9. | agua | 10 | vinos", "specifications_text": "", "benefits_text": "", "details_text": "", "other_sections": "", "sections": {"Características": ["TE RECOMENDAMOS", "BELL'S", "Filete de Atún BELL'S en Agua Lata 150gr", "4", "90", "Filete de Caballa en Aceite BELL'S Lata 170g", "50", "-2%", "GLORIA", "Trozos de Atún en Aceite Vegetal GLORIA Lata 140g", "70", "2%", "-16%", "Trozos de Atún FLORIDA en Aceite Vegetal Lata 140g", "16%", "SANTORINI", "Anchoveta en Salsa de Tomate SANTORINI Lata 200g", "No disponible", "REAL", "Sólido de Atún REAL en Aceite Girasol Lata 140g", "CAMPOMAR", "Filete de Atún en Agua CAMPOMAR Lata 150g", "Filete de Atún Artesanal CAMPOMAR Gourmet Frasco 160g", "7", "60", "Trozos de Jurel BELL'S Lata 170g", "20", "EL CORTE INGLÉS", "Lomos de Atún en Aceite de Girasol EL CORTE INGLÉS Pack 3 Lata 56g", "30", "¡Entérate de eventos exclusivos y promociones especiales que tenemos para ti!", "SUSCRIBIRME", "Acepto las políticas de tratamiento de datos personales", "Razón social: Compañía Food Retail S.A.C. RUC: 20608300393. Todos los derechos reservados Vivanda 2023.", "¡Hola!", "Encuentra todo lo que necesitas en Vivanda online", "Términos más buscados", "1.", "quesos", "2.", "vino", "3.", "cafe", "4.", "quark 500g", "5.", "leche", "6.", "pollo", "7.", "yogurt", "8.", "lunch florencia", "9.", "agua", "10.", "vinos"]}, "txt_path": "dataset/txt_limpios/1194.txt", "html_path": "dataset/paginas_descargadas/1194.html", "es_status": "ET", "category_canonical": "sin_categoria", "decision": "discard", "match_score": 0.3, "reasons": "no_category_detected;price_parse_failed"}
{"source_id": "1195", "title": "Centro de preferencia de la privacidad", "description": "", "breadcrumbs": "Activas siempre > 150g", "price_raw": "", "currency_raw": "PEN", "url": "", "seller": "Desconocido", "availability": "unknown", "country": "PE", "product_name": "Centro de preferencia de la privacidad", "brand": "Activas siempre", "reference": "", "unit": "150g", "price_amount": null, "price_currency": "PEN", "price_symbol": "", "price_text": "", "price_amount_filled": "55.14", "price_is_imputed": "True", "price_imputation_source": "country_mean", "price_amount_usd": "", "price_amount_usd_filled": "15.5336", "fx_rate_local_per_usd": "3.55", "fx_source": "from_peru_cambio_dolar", "information_text": "", "description_text": "", "features_text": "TE RECOMENDAMOS | BELL'S | Filete de Atún BELL'S en Aceite Lata 150gr | 4 | 90 | Sólido de Atún BELL'S en Agua Lata 150gr | 5 | 30 | LA GITANA | Conserva de Sardina LA GITANA Caja 125g | 10 | -2% | GLORIA | Trozos de Atún en Aceite Vegetal GLORIA Lata 140g | 80 | 70 | 2% | -15% | PRIMOR | Trozos de Atún PRIMOR en Aceite Vegetal Lata 140g | 50 | 15% | REAL | Sólido de Atún REAL en Aceite de Oliva Lata 140g | No disponible | Filete de Atún Artesanal CAMPOMAR Gourmet Frasco 160g | 7 | 60 | SANTORINI | Anchoveta con Aceite Vegetal SANTORINI Lata 125g | 3 | EL CORTE INGLÉS | Lomos de Atún en Aceite de Girasol EL CORTE INGLÉS Pack 3 Lata 56g | 20 | Trozos de Atún BELL'S en Acepto Lata 150gr | Entérate de eventos exclusivos y promociones especiales que tenemos para ti! | SUSCRIBIRME | Acepto las políticas de tratamientos de datos personales | Razón Social: Compañía Food Retail S.A.C. RUC: 20608300393. Todos los derechos reservados Vivanda 2023. | | Hola! | Encuentra todo lo que necesitas en Vivanda online | Términos más buscados | 1. | quesos | 2. | vino | 3. | café | 4. | quark 500g | 5. | leche | 6. | pollo | 7. | yogurt | 8. | lunch florencia | 9. | agua | 10 | vinos", "specifications_text": "", "benefits_text": "", "details_text": "", "other_sections": "", "sections": {"Características": ["TE RECOMENDAMOS", "BELL'S", "Filete de Atún BELL'S en Ace Lata 150gr", "4", "90", "Sólido de Atún BELL'S en Agua Lata 150gr", "5", "30", "LA GITANA", "Conserva de Sardina LA GITANA Caja 125g", "10", "-2%", "GLORIA", "Trozos de Atún en Aceite Vegetal GLORIA Lata 140g", "80", "70", "2%", "-15%", "PRIMOR", "Trozos de Atún PRIMOR en Aceite Vegetal Lata 140g", "50", "15%", "REAL", "Sólido de Atún REAL en Aceite de Oliva Lata 140g", "No disponible", "Filete de Atún Artesanal CAMPOMAR Gourmet Frasco 160g", "7", "60", "SANTORINI", "Anchoveta con Aceite Vegetal SANTORINI Lata 125g", "3", "EL CORTE INGLÉS", "Lomos de Atún en Aceite de Girasol EL CORTE INGLÉS Pack 3 Lata 56g", "20", "Trozos de Atún BELL'S en Aceite Lata 150gr", "¡Entérate de eventos exclusivos y promociones especiales que tenemos para ti!", "SUSCRIBIRME", "Acepto las políticas de tratamiento de datos personales", "Razón social: Compañía Food Retail S.A.C. RUC: 20608300393. Todos los derechos reservados Vivanda 2023.", "¡Hola!", "Encuentra todo lo que necesitas en Vivanda online", "Términos más buscados", "1.", "quesos", "2.", "vino", "3.", "cafe", "4.", "quark 500g", "5.", "leche", "6.", "pollo", "7.", "yogurt", "8.", "lunch florencia", "9.", "agua", "10.", "vinos"]}, "txt_path": "dataset/txt_limpios/1195.txt", "html_path": "dataset/paginas_descargadas/1195.html", "es_status": "ET", "category_canonical": "sin_categoria", "decision": "discard", "match_score": 0.3, "reasons": "no_category_detected;price_parse_failed"}
