{"source_id": "1052", "title": "colaborar con nuestros estudios para marketing. También puede configurarlas.", "description": "Información de la marca", "breadcrumbs": "que podemos ofrecer. > 140g", "price_raw": "16.92", "currency_raw": "PEN", "url": "", "seller": "Desconocido", "availability": "unknown", "country": "PE", "product_name": "colaborar con nuestros estudios para marketing. También puede configurarlas.", "brand": "que podemos ofrecer.", "reference": "", "unit": "140g", "price_amount": 16.92, "price_currency": "PEN", "price_symbol": "S/", "price_text": "S/16.92", "price_amount_filled": "16.92", "price_is_imputed": "False", "price_imputation_source": "original", "price_amount_usd": "4.7662", "price_amount_usd_filled": "4.7662", "fx_rate_local_per_usd": "3.55", "fx_source": "from_peru_cambio_dolar", "information_text": "", "description_text": "Información de la marca", "features_text": "Presentación/Empaque | Lata | Porción sugerida | 1 | Alérgenos Declarados | Atun | Azúcares Porción | 0G | Calorías Porción | 210 KCAL | Carbohidratos Porción | Descripción Nutricional | Trozos de atún | Primor 140g | Grasas Porción | 11G | Proteínas Porción | 28G | Sodio Porción | 390MG | Advertencias De Almacenamiento | A temperatura ambiente, en lugar fresco y seco. Una vez abierto vaciar el contenido en otro recipiente y mantener refrigerado. | Contenido Neto | 140g | Revisa todo | Componentes del Producto | Vendido por | plaza Ver | En caso de que algo te guste: Puedes revisar nuestras | Políticas de cambios y/o devoluciones | y hacerlas efectivas en todas nuestras tiendas. | Productos | que te pueden interesar | Recomendado para ti", "specifications_text": "", "benefits_text": "", "details_text": "", "other_sections": "", "sections": {"Descripción": ["Información de la marca"], "Características": ["Presentación/Empaque", "Lata", "Porción sugerida", "1", "Alérgenos Declarados", "Atun", "Azúcar por porción", "0G", "Calorías Porción", "210 KCAL", "Carbohidratos Porción", "Descripción Nutricional", "Trozos de atún - Primor 140g", "Grasas Porción", "11G", "Proteínas Porción", "28G", "Sodio Porción", "390MG", "Advertencias De Almacenamiento", "A temperatura ambiente, en lugar fresco y seco. Una vez abierto vaciar el contenido en otro recipiente y mantener refrigerado.", "Contenido Neto", "140g", "Revisa todo", "Componentes del Producto", "Vendido por", "plazaVea", "En caso algo no vaya como gustes: Puedes revisar nuestras", "Politicas de cambios y/o devoluciones", "y hacerlas efectivas en todas nuestras tiendas.", "Productos", "que te pueden interesar", "Recomendado para ti"]}, "txt_path": "dataset/txt_limpios/1052.txt", "html_path": "dataset/paginas_descargadas/1052.html", "es_status": "ET", "category_canonical": "sin_categoria", "decision": "discard", "match_score": 0.3, "reasons": "no_category_detected"}
{"source_id": "891", "title": "Comida congelada", "description": "Papas duquesa congeladas Frutos del Maipo 1 Kg", "breadcrumbs": "frutos del maipo > 1 Kg", "price_raw": "4.19", "currency_raw": "", "url": "", "seller": "Desconocido", "availability": "unknown", "country": "UNKNOWN", "product_name": "Comida congelada", "brand": "frutos del maipo", "reference": "", "unit": "1 Kg", "price_amount": 4.19, "price_currency": "", "price_symbol": "$", "price_text": "$4.19", "price_amount_filled": "4.19", "price_is_imputed": "False", "price_imputation_source": "original", "price_amount_usd": "4.19", "price_amount_usd_filled": "4.19", "fx_rate_local_per_usd": "1.0", "fx_source": "default_1usd", "information_text": "", "description_text": "Papas duquesa congeladas Frutos del Maipo 1 Kg", "features_text": "", "specifications_text": "", "benefits_text": "", "details_text": "", "other_sections": "", "sections": {"Descripción": ["Papas duquesa congeladas Frutos del Maipo 1 Kg"]}, "txt_path": "dataset/txt_limpios/891.txt", "html_path": "dataset/paginas_descargadas/891.html", "es_status": "EN", "category_canonical": "papa", "decision": "keep", "match_score": 0.6, "reasons": "heuristic_default"}
{"source_id": "392", "title": "COMUNICADO IMPORTANTE!", "description": "", "breadcrumbs": "Caro cliente, > 2l", "price_raw": "5.99", "currency_raw": "BRL", "url": "", "seller": "Desconocido", "availability": "unknown", "country": "BR", "product_name": "COMUNICADO IMPORTANTE!", "brand": "Caro cliente,", "reference": "", "unit": "2l", "price_amount": 5.99, "price_currency": "BRL", "price_symbol": "R$", "price_text": "R$5,99", "price_amount_filled": "5.99", "price_is_imputed": "False", "price_imputation_source": "original", "price_amount_usd": "1.0995", "price_amount_usd_filled": "1.0995", "fx_rate_local_per_usd": "5.448", "fx_source": "from_brasil_cambio_dolar", "information_text": "", "description_text": "", "features_text": "Comentarios de los clientes | Descripción del producto | El Refrigerante de Guaraná Kuat es conocido por su sabor irresistible y refrescante. Esta es una bebida que viene en un envase de 2 litros, ideal para compartir con amigos y familiares, y su embalaje es una botella PET, que debe ser conservada en un lugar fresco y seco, lejos del calor y de la luz directa para mantener la calidad del producto. El Refrigerante de Guaraná Kuat es perfecto para matar la sede y proporcionar momentos de refracncia, siendo una excelente elección para fiestas, reuniones familiares o simplemente para disfrutar en casa. Al elegir ese Refrigerante de Guaraná Kuat, opta por un producto de calidad que es ampliamente apreciado y reconocido. | Ver más | Productos Relacionados | Refrigerante Fanta Misterio Beetlejuice Lata 310ml | Disponible en breve | Refrigerante Fanta Misterio Lata 350ml | Refrigerante Sprite s/ Garrafa Retornable 2l | Refrigerante Fanta Naranja Splash 500ml | Refrigerante Fanta Guaraná Pet 200ml | Refrigerante It Naranja Pet 2 Litros | Refrigerante Pepsi Pet 2 Litros | Refrigerante Pepsi Pet 2 Litro | 7 | 59 | Refrigerante Soda Limonada Antarctica Lata 350ml | 2 | Refrigerante Guaraná Antarctica Lata 269ml | Refrigerante Pepsi Lata 350ml | 3 | 29 | Términos más buscados | 1o | leche | 2o | café | 3o | cerveza | 4o | jabón polvo | 5o | arroz | 6o | leche condensada | 7o | yogur | 8o | huevo | 9o | pollo | 10o | oleo | Su privacidad | Siempre activos | Back Button | Back | Vendor Search | Filter Button | Consent | Leg. Interest | checkbox label | label | Clear | Apply | Cancel | Guardar configuración | Rechazar todos | Configurar privacidad", "specifications_text": "", "benefits_text": "", "details_text": "", "other_sections": "", "sections": {"Características": ["Comentarios de los clientes", "Descripción del producto", "El Refrigerante de Guaraná Kuat es conocido por su sabor irresistible y refrescante. Esta es una bebida que viene en un envase de 2 litros, ideal para compartir con amigos y familiares, y su embalaje es una botella PET, que debe ser conservada en un lugar fresco y seco, lejos del calor y de la luz directa para mantener la calidad del producto. El Refrigerante de Guaraná Kuat es perfecto para matar la sede y proporcionar momentos de refracncia, siendo una excelente elección para fiestas, reuniones familiares o simplemente para disfrutar en casa. Al elegir ese Refrigerante de Guaraná Kuat, opta por un producto de calidad que es ampliamente apreciado y reconocido.", "Ver mais", "Productos relacionados", "Refrigerante Fanta Misterio Beetlejuice Lata 310ml", "Disponible en breve", "Refrigerante Fanta Misterio Lata 350ml", "Refrigerante Sprite s/ Garrafa Retornable 2l", "Refrigerante Fanta Laranja Splash 500ml", "Refrigerante Fanta Guaraná Pet 200ml", "Refrigerante It Laranja Pet 2 Litros", "Refrigerante Pepsi Pet 2 Litro", "7", "59", "Refrigerante Soda Limonada Antarctica Lata 350ml", "2", "Refrigerante Guaraná Antarctica Lata 269ml", "Refrigerante Pepsi Lata 350ml", "3", "29", "Termos mais buscados", "1º", "leite", "2º", "cafe", "3º", "cerveja", "4º", "jabón polvo", "5º", "arroz", "6º", "leite condensado", "7º", "iogurte", "8º", "ovo", "9º", "frango", "10º", "oleo", "Sua privacidade", "Sempre ativos", "Back Button", "Back", "Vendor Search", "Filter Button", "Consent", "Leg.Interest", "checkbox label", "label", "Clear", "Apply", "Cancel", "Guardar configuración", "Rejeitar todos", "Configurar privacidade"]}, "txt_path": "dataset/txt_limpios/392.txt", "html_path": "dataset/paginas_descargadas/392.html", "es_status": "ET", "category_canonical": "sin_categoria", "decision": "discard", "match_score": 0.3, "reasons": "no_category_detected"}
{"source_id": "579", "title": "DALE VIDA A TU JARDIN", "description": "Datos técnicos Descripción del producto ¡Suscribite a nuestro boletín! Recibí las ofertas y novedades en tu correo. Suscribirme Seguridad y confianza © Libertad 2023. Todos los derechos reservados. Términos y Condiciones Direcciôn General de Defensa y protecciôn al Consumidor, para consultas y/o denuncias ingresa a los Términos más buscados 1. leche 2. cerveza 3. aceptada 4. yerba 5. cafe 6. pañales 7. queso 8. arroz 9. fideos 10. fernet", "breadcrumbs": "🌷🌻​🌼​ > 1 L", "price_raw": "1437.19", "currency_raw": "ARS", "url": "", "seller": "Desconocido", "availability": "unknown", "country": "AR", "product_name": "DALE VIDA A TU JARDIN", "brand": "🌷🌻​🌼​", "reference": "", "unit": "1 L", "price_amount": 1437.19, "price_currency": "ARS", "price_symbol": "$", "price_text": "$1.437,19", "price_amount_filled": "1437.19", "price_is_imputed": "False", "price_imputation_source": "original", "price_amount_usd": "1.1452", "price_amount_usd_filled": "1.1452", "fx_rate_local_per_usd": "1255.0", "fx_source": "from_argentina_cambio_dolar", "information_text": "", "description_text": "Datos técnicos Descripción del producto ¡Suscribite a nuestro boletín! Recibí las ofertas y novedades en tu correo. Suscribirme Seguridad y confianza © Libertad 2023. Todos los derechos reservados. Términos y Condiciones Direcciôn General de Defensa y protecciôn al Consumidor, para consultas y/o denuncias ingresa a los Términos más buscados 1. leche 2. cerveza 3. aceptada 4. yerba 5. cafe 6. pañales 7. queso 8. arroz 9. fideos 10. fernet", "features_text": "", "specifications_text": "", "benefits_text": "", "details_text": "", "other_sections": "", "sections": {"Descripción": ["Datos técnicos", "Descripción del producto", "¡Suscribite a nuestro newsletter!", "Recibí las ofertas y novedades en tu correo.", "Suscribirme", "Seguridad y confianza", "© Libertad 2023. Todos los derechos reservados.", "Términos y Condiciones", "Dirección General de Defensa y Protección al Consumidor para consultas y/o denuncias", "introduzca aquí", "Términos más buscados", "1.", "leche", "2.", "cerveza", "3.", "aceite", "4.", "yerba", "5.", "cafe", "6.", "pañales", "7.", "queso", "8.", "arroz", "9.", "fideos", "10.", "fernet"]}, "txt_path": "dataset/txt_limpios/579.txt", "html_path": "dataset/paginas_descargadas/579.html", "es_status": "ET", "category_canonical": "cafe", "decision": "keep", "match_score": 0.6, "reasons": "heuristic_default"}
{"source_id": "580", "title": "DALE VIDA A TU JARDIN", "description": "Datos técnicos Descripción del producto ¡Suscribite a nuestro boletín! Recibí las ofertas y novedades en tu correo. Suscribirme Seguridad y confianza © Libertad 2023. Todos los derechos reservados. Términos y Condiciones Direcciôn General de Defensa y protecciôn al Consumidor, para consultas y/o denuncias ingresa a los Términos más buscados 1. leche 2. cerveza 3. aceptada 4. yerba 5. cafe 6. pañales 7. queso 8. arroz 9. fideos 10. fernet", "breadcrumbs": "🌷🌻​🌼​ > 1 L", "price_raw": "1597.52", "currency_raw": "ARS", "url": "", "seller": "Desconocido", "availability": "unknown", "country": "AR", "product_name": "DALE VIDA A TU JARDIN", "brand": "🌷🌻​🌼​", "reference": "", "unit": "1 L", "price_amount": 1597.52, "price_currency": "ARS", "price_symbol": "$", "price_text": "$1.597,52", "price_amount_filled": "1597.52", "price_is_imputed": "False", "price_imputation_source": "original", "price_amount_usd": "1.2729", "price_amount_usd_filled": "1.2729", "fx_rate_local_per_usd": "1255.0", "fx_source": "from_argentina_cambio_dolar", "information_text": "", "description_text": "Datos técnicos Descripción del producto ¡Suscribite a nuestro boletín! Recibí las ofertas y novedades en tu correo. Suscribirme Seguridad y confianza © Libertad 2023. Todos los derechos reservados. Términos y Condiciones Direcciôn General de Defensa y protecciôn al Consumidor, para consultas y/o denuncias ingresa a los Términos más buscados 1. leche 2. cerveza 3. aceptada 4. yerba 5. cafe 6. pañales 7. queso 8. arroz 9. fideos 10. fernet", "features_text": "", "specifications_text": "", "benefits_text": "", "details_text": "", "other_sections": "", "sections": {"Descripción": ["Datos técnicos", "Descripción del producto", "¡Suscribite a nuestro newsletter!", "Recibí las ofertas y novedades en tu correo.", "Suscribirme", "Seguridad y confianza", "© Libertad 2023. Todos los derechos reservados.", "Términos y Condiciones", "Dirección General de Defensa y Protección al Consumidor para consultas y/o denuncias", "introduzca aquí", "Términos más buscados", "1.", "leche", "2.", "cerveza", "3.", "aceite", "4.", "yerba", "5.", "cafe", "6.", "pañales", "7.", "queso", "8.", "arroz", "9.", "fideos", "10.", "fernet"]}, "txt_path": "dataset/txt_limpios/580.txt", "html_path": "dataset/paginas_descargadas/580.html", "es_status": "ET", "category_canonical": "cafe", "decision": "keep", "match_score": 0.6, "reasons": "heuristic_default"}
{"source_id": "581", "title": "DALE VIDA A TU JARDIN", "description": "Datos técnicos Descripción del producto ¡Suscribite a nuestro boletín! Recibí las ofertas y novedades en tu correo. Suscribirme Seguridad y confianza © Libertad 2023. Todos los derechos reservados. Términos y Condiciones Direcciôn General de Defensa y protecciôn al Consumidor, para consultas y/o denuncias ingresa a los Términos más buscados 1. leche 2. cerveza 3. aceptada 4. yerba 5. cafe 6. pañales 7. queso 8. arroz 9. fideos 10. fernet", "breadcrumbs": "🌷🌻​🌼​ > 1L", "price_raw": "1145.45", "currency_raw": "ARS", "url": "", "seller": "Desconocido", "availability": "unknown", "country": "AR", "product_name": "DALE VIDA A TU JARDIN", "brand": "🌷🌻​🌼​", "reference": "", "unit": "1L", "price_amount": 1145.45, "price_currency": "ARS", "price_symbol": "$", "price_text": "$1.145,45", "price_amount_filled": "1145.45", "price_is_imputed": "False", "price_imputation_source": "original", "price_amount_usd": "0.9127", "price_amount_usd_filled": "0.9127", "fx_rate_local_per_usd": "1255.0", "fx_source": "from_argentina_cambio_dolar", "information_text": "", "description_text": "Datos técnicos Descripción del producto ¡Suscribite a nuestro boletín! Recibí las ofertas y novedades en tu correo. Suscribirme Seguridad y confianza © Libertad 2023. Todos los derechos reservados. Términos y Condiciones Direcciôn General de Defensa y protecciôn al Consumidor, para consultas y/o denuncias ingresa a los Términos más buscados 1. leche 2. cerveza 3. aceptada 4. yerba 5. cafe 6. pañales 7. queso 8. arroz 9. fideos 10. fernet", "features_text": "", "specifications_text": "", "benefits_text": "", "details_text": "", "other_sections": "", "sections": {"Descripción": ["Datos técnicos", "Descripción del producto", "¡Suscribite a nuestro newsletter!", "Recibí las ofertas y novedades en tu correo.", "Suscribirme", "Seguridad y confianza", "© Libertad 2023. Todos los derechos reservados.", "Términos y Condiciones", "Dirección General de Defensa y Protección al Consumidor para consultas y/o denuncias", "introduzca aquí", "Términos más buscados", "1.", "leche", "2.", "cerveza", "3.", "aceite", "4.", "yerba", "5.", "cafe", "6.", "pañales", "7.", "queso", "8.", "arroz", "9.", "fideos", "10.", "fernet"]}, "txt_path": "dataset/txt_limpios/581.txt", "html_path": "dataset/paginas_descargadas/581.html", "es_status": "ET", "category_canonical": "cafe", "decision": "keep", "match_score": 0.6, "reasons": "heuristic_default"}
{"source_id": "582", "title": "DALE VIDA A TU JARDIN", "description": "Datos técnicos Descripción del producto ¡Suscribite a nuestro boletín! Recibí las ofertas y novedades en tu correo. Suscribirme Seguridad y confianza © Libertad 2023. Todos los derechos reservados. Términos y Condiciones Direcciôn General de Defensa y protecciôn al Consumidor, para consultas y/o denuncias ingresa a los Términos más buscados 1. leche 2. cerveza 3. aceptada 4. yerba 5. cafe 6. pañales 7. queso 8. arroz 9. fideos 10. fernet", "breadcrumbs": "🌷🌻​🌼​", "price_raw": "1643.8", "currency_raw": "ARS", "url": "", "seller": "Desconocido", "availability": "unknown", "country": "AR", "product_name": "DALE VIDA A TU JARDIN", "brand": "🌷🌻​🌼​", "reference": "", "unit": "", "price_amount": 1643.8, "price_currency": "ARS", "price_symbol": "$", "price_text": "$1.643,80", "price_amount_filled": "1643.8", "price_is_imputed": "False", "price_imputation_source": "original", "price_amount_usd": "1.3098", "price_amount_usd_filled": "1.3098", "fx_rate_local_per_usd": "1255.0", "fx_source": "from_argentina_cambio_dolar", "information_text": "", "description_text": "Datos técnicos Descripción del producto ¡Suscribite a nuestro boletín! Recibí las ofertas y novedades en tu correo. Suscribirme Seguridad y confianza © Libertad 2023. Todos los derechos reservados. Términos y Condiciones Direcciôn General de Defensa y protecciôn al Consumidor, para consultas y/o denuncias ingresa a los Términos más buscados 1. leche 2. cerveza 3. aceptada 4. yerba 5. cafe 6. pañales 7. queso 8. arroz 9. fideos 10. fernet", "features_text": "", "specifications_text": "", "benefits_text": "", "details_text": "", "other_sections": "", "sections": {"Descripción": ["Datos técnicos", "Descripción del producto", "¡Suscribite a nuestro newsletter!", "Recibí las ofertas y novedades en tu correo.", "Suscribirme", "Seguridad y confianza", "© Libertad 2023. Todos los derechos reservados.", "Términos y Condiciones", "Dirección General de Defensa y Protección al Consumidor para consultas y/o denuncias", "introduzca aquí", "Términos más buscados", "1.", "leche", "2.", "cerveza", "3.", "aceite", "4.", "yerba", "5.", "cafe", "6.", "pañales", "7.", "queso", "8.", "arroz", "9.", "fideos", "10.", "fernet"]}, "txt_path": "dataset/txt_limpios/582.txt", "html_path": "dataset/paginas_descargadas/582.html", "es_status": "ET", "category_canonical": "cafe", "decision": "keep", "match_score": 0.6, "reasons": "heuristic_default"}
{"source_id": "583", "title": "DALE VIDA A TU JARDIN", "description": "", "breadcrumbs": "🌷🌻​🌼​", "price_raw": "", "currency_raw": "ARS", "url": "", "seller": "Desconocido", "availability": "unknown", "country": "AR", "product_name": "DALE VIDA A TU JARDIN", "brand": "🌷🌻​🌼​", "reference": "", "unit": "", "price_amount": null, "price_currency": "ARS", "price_symbol": "", "price_text": "", "price_amount_filled": "1663.58", "price_is_imputed": "True", "price_imputation_source": "country_mean", "price_amount_usd": "", "price_amount_usd_filled": "1.3256", "fx_rate_local_per_usd": "1255.0", "fx_source": "from_argentina_cambio_dolar", "information_text": "", "description_text": "", "features_text": "", "specifications_text": "", "benefits_text": "", "details_text": "", "other_sections": "", "sections": {}, "txt_path": "dataset/txt_limpios/583.txt", "html_path": "dataset/paginas_descargadas/583.html", "es_status": "EN", "category_canonical": "sin_categoria", "decision": "discard", "match_score": 0.3, "reasons": "no_category_detected;price_parse_failed"}
{"source_id": "584", "title": "DALE VIDA A TU JARDIN", "description": "", "breadcrumbs": "🌷🌻​🌼​", "price_raw": "", "currency_raw": "ARS", "url": "", "seller": "Desconocido", "availability": "unknown", "country": "AR", "product_name": "DALE VIDA A TU JARDIN", "brand": "🌷🌻​🌼​", "reference": "", "unit": "", "price_amount": null, "price_currency": "ARS", "price_symbol": "", "price_text": "", "price_amount_filled": "1663.58", "price_is_imputed": "True", "price_imputation_source": "country_mean", "price_amount_usd": "", "price_amount_usd_filled": "1.3256", "fx_rate_local_per_usd": "1255.0", "fx_source": "from_argentina_cambio_dolar", "information_text": "", "description_text": "", "features_text": "", "specifications_text": "", "benefits_text": "", "details_text": "", "other_sections": "", "sections": {}, "txt_path": "dataset/txt_limpios/584.txt", "html_path": "dataset/paginas_descargadas/584.html", "es_status": "EN", "category_canonical": "sin_categoria", "decision": "discard", "match_score": 0.3, "reasons": "no_category_detected;price_parse_failed"}
{"source_id": "585", "title": "DALE VIDA A TU JARDIN", "description": "", "breadcrumbs": "🌷🌻​🌼​", "price_raw": "", "currency_raw": "ARS", "url": "", "seller": "Desconocido", "availability": "unknown", "country": "AR", "product_name": "DALE VIDA A TU JARDIN", "brand": "🌷🌻​🌼​", "reference": "", "unit": "", "price_amount": null, "price_currency": "ARS", "price_symbol": "", "price_text": "", "price_amount_filled": "1663.58", "price_is_imputed": "True", "price_imputation_source": "country_mean", "price_amount_usd": "", "price_amount_usd_filled": "1.3256", "fx_rate_local_per_usd": "1255.0", "fx_source": "from_argentina_cambio_dolar", "information_text": "", "description_text": "", "features_text": "", "specifications_text": "", "benefits_text": "", "details_text": "", "other_sections": "", "sections": {}, "txt_path": "dataset/txt_limpios/585.txt", "html_path": "dataset/paginas_descargadas/585.html", "es_status": "EN", "category_canonical": "sin_categoria", "decision": "discard", "match_score": 0.3, "reasons": "no_category_detected;price_parse_failed"}
