{"source_id": "1455", "title": "Horarios de entrega", "description": "", "breadcrumbs": "LISTA > 1 LITRO", "price_raw": "", "currency_raw": "", "url": "", "seller": "Desconocido", "availability": "unknown", "country": "UNKNOWN", "product_name": "Horarios de entrega", "brand": "LISTA", "reference": "", "unit": "1 LITRO", "price_amount": null, "price_currency": "", "price_symbol": "", "price_text": "", "price_amount_filled": "234.19", "price_is_imputed": "True", "price_imputation_source": "country_mean", "price_amount_usd": "", "price_amount_usd_filled": "234.1938", "fx_rate_local_per_usd": "1.0", "fx_source": "default_1usd", "information_text": "", "description_text": "", "features_text": "", "specifications_text": "", "benefits_text": "", "details_text": "", "other_sections": "", "sections": {}, "txt_path": "dataset/txt_limpios/1455.txt", "html_path": "dataset/paginas_descargadas/1455.html", "es_status": "EN", "category_canonical": "sin_categoria", "decision": "discard", "match_score": 0.3, "reasons": "no_category_detected;price_parse_failed"}
{"source_id": "1457", "title": "Horarios de entrega", "description": "", "breadcrumbs": "LISTA > 1 LITRO", "price_raw": "", "currency_raw": "", "url": "", "seller": "Desconocido", "availability": "unknown", "country": "UNKNOWN", "product_name": "Horarios de entrega", "brand": "LISTA", "reference": "", "unit": "1 LITRO", "price_amount": null, "price_currency": "", "price_symbol": "", "price_text": "", "price_amount_filled": "234.19", "price_is_imputed": "True", "price_imputation_source": "country_mean", "price_amount_usd": "", "price_amount_usd_filled": "234.1938", "fx_rate_local_per_usd": "1.0", "fx_source": "default_1usd", "information_text": "", "description_text": "", "features_text": "", "specifications_text": "", "benefits_text": "", "details_text": "", "other_sections": "", "sections": {}, "txt_path": "dataset/txt_limpios/1457.txt", "html_path": "dataset/paginas_descargadas/1457.html", "es_status": "EN", "category_canonical": "sin_categoria", "decision": "discard", "match_score": 0.3, "reasons": "no_category_detected;price_parse_failed"}
{"source_id": "1458", "title": "Horarios de entrega", "description": "", "breadcrumbs": "LISTA > 1 LITRO", "price_raw": "", "currency_raw": "", "url": "", "seller": "Desconocido", "availability": "unknown", "country": "UNKNOWN", "product_name": "Horarios de entrega", "brand": "LISTA", "reference": "", "unit": "1 LITRO", "price_amount": null, "price_currency": "", "price_symbol": "", "price_text": "", "price_amount_filled": "234.19", "price_is_imputed": "True", "price_imputation_source": "country_mean", "price_amount_usd": "", "price_amount_usd_filled": "234.1938", "fx_rate_local_per_usd": "1.0", "fx_source": "default_1usd", "information_text": "", "description_text": "", "features_text": "", "specifications_text": "", "benefits_text": "", "details_text": "", "other_sections": "", "sections": {}, "txt_path": "dataset/txt_limpios/1458.txt", "html_path": "dataset/paginas_descargadas/1458.html", "es_status": "EN", "category_canonical": "sin_categoria", "decision": "discard", "match_score": 0.3, "reasons": "no_category_detected;price_parse_failed"}
{"source_id": "1459", "title": "Horarios de entrega", "description": "", "breadcrumbs": "LISTA > 100GR", "price_raw": "", "currency_raw": "", "url": "", "seller": "Desconocido", "availability": "unknown", "country": "UNKNOWN", "product_name": "Horarios de entrega", "brand": "LISTA", "reference": "", "unit": "100GR", "price_amount": null, "price_currency": "", "price_symbol": "", "price_text": "", "price_amount_filled": "234.19", "price_is_imputed": "True", "price_imputation_source": "country_mean", "price_amount_usd": "", "price_amount_usd_filled": "234.1938", "fx_rate_local_per_usd": "1.0", "fx_source": "default_1usd", "information_text": "", "description_text": "", "features_text": "", "specifications_text": "", "benefits_text": "", "details_text": "", "other_sections": "", "sections": {}, "txt_path": "dataset/txt_limpios/1459.txt", "html_path": "dataset/paginas_descargadas/1459.html", "es_status": "EN", "category_canonical": "sin_categoria", "decision": "discard", "match_score": 0.3, "reasons": "no_category_detected;price_parse_failed"}
{"source_id": "1460", "title": "Horarios de entrega", "description": "", "breadcrumbs": "LISTA > 400 GRAMOS", "price_raw": "", "currency_raw": "", "url": "", "seller": "Desconocido", "availability": "unknown", "country": "UNKNOWN", "product_name": "Horarios de entrega", "brand": "LISTA", "reference": "", "unit": "400 GRAMOS", "price_amount": null, "price_currency": "", "price_symbol": "", "price_text": "", "price_amount_filled": "234.19", "price_is_imputed": "True", "price_imputation_source": "country_mean", "price_amount_usd": "", "price_amount_usd_filled": "234.1938", "fx_rate_local_per_usd": "1.0", "fx_source": "default_1usd", "information_text": "", "description_text": "", "features_text": "", "specifications_text": "", "benefits_text": "", "details_text": "", "other_sections": "", "sections": {}, "txt_path": "dataset/txt_limpios/1460.txt", "html_path": "dataset/paginas_descargadas/1460.html", "es_status": "EN", "category_canonical": "sin_categoria", "decision": "discard", "match_score": 0.3, "reasons": "no_category_detected;price_parse_failed"}
{"source_id": "1462", "title": "Horarios de entrega", "description": "", "breadcrumbs": "LISTA > 1 LITRO", "price_raw": "", "currency_raw": "", "url": "", "seller": "Desconocido", "availability": "unknown", "country": "UNKNOWN", "product_name": "Horarios de entrega", "brand": "LISTA", "reference": "", "unit": "1 LITRO", "price_amount": null, "price_currency": "", "price_symbol": "", "price_text": "", "price_amount_filled": "234.19", "price_is_imputed": "True", "price_imputation_source": "country_mean", "price_amount_usd": "", "price_amount_usd_filled": "234.1938", "fx_rate_local_per_usd": "1.0", "fx_source": "default_1usd", "information_text": "", "description_text": "", "features_text": "", "specifications_text": "", "benefits_text": "", "details_text": "", "other_sections": "", "sections": {}, "txt_path": "dataset/txt_limpios/1462.txt", "html_path": "dataset/paginas_descargadas/1462.html", "es_status": "EN", "category_canonical": "sin_categoria", "decision": "discard", "match_score": 0.3, "reasons": "no_category_detected;price_parse_failed"}
{"source_id": "1465", "title": "Horarios de entrega", "description": "", "breadcrumbs": "LISTA > 1 LITRO", "price_raw": "", "currency_raw": "", "url": "", "seller": "Desconocido", "availability": "unknown", "country": "UNKNOWN", "product_name": "Horarios de entrega", "brand": "LISTA", "reference": "", "unit": "1 LITRO", "price_amount": null, "price_currency": "", "price_symbol": "", "price_text": "", "price_amount_filled": "234.19", "price_is_imputed": "True", "price_imputation_source": "country_mean", "price_amount_usd": "", "price_amount_usd_filled": "234.1938", "fx_rate_local_per_usd": "1.0", "fx_source": "default_1usd", "information_text": "", "description_text": "", "features_text": "", "specifications_text": "", "benefits_text": "", "details_text": "", "other_sections": "", "sections": {}, "txt_path": "dataset/txt_limpios/1465.txt", "html_path": "dataset/paginas_descargadas/1465.html", "es_status": "EN", "category_canonical": "sin_categoria", "decision": "discard", "match_score": 0.3, "reasons": "no_category_detected;price_parse_failed"}
{"source_id": "1466", "title": "Horarios de entrega", "description": "", "breadcrumbs": "LISTA > 1 LITRO", "price_raw": "", "currency_raw": "", "url": "", "seller": "Desconocido", "availability": "unknown", "country": "UNKNOWN", "product_name": "Horarios de entrega", "brand": "LISTA", "reference": "", "unit": "1 LITRO", "price_amount": null, "price_currency": "", "price_symbol": "", "price_text": "", "price_amount_filled": "234.19", "price_is_imputed": "True", "price_imputation_source": "country_mean", "price_amount_usd": "", "price_amount_usd_filled": "234.1938", "fx_rate_local_per_usd": "1.0", "fx_source": "default_1usd", "information_text": "", "description_text": "", "features_text": "", "specifications_text": "", "benefits_text": "", "details_text": "", "other_sections": "", "sections": {}, "txt_path": "dataset/txt_limpios/1466.txt", "html_path": "dataset/paginas_descargadas/1466.html", "es_status": "EN", "category_canonical": "sin_categoria", "decision": "discard", "match_score": 0.3, "reasons": "no_category_detected;price_parse_failed"}
{"source_id": "1468", "title": "Horarios de entrega", "description": "", "breadcrumbs": "LISTA > 500 ML", "price_raw": "2.0", "currency_raw": "", "url": "", "seller": "Desconocido", "availability": "unknown", "country": "UNKNOWN", "product_name": "Horarios de entrega", "brand": "LISTA", "reference": "", "unit": "500 ML", "price_amount": 2.0, "price_currency": "", "price_symbol": "", "price_text": "2", "price_amount_filled": "2.0", "price_is_imputed": "False", "price_imputation_source": "original", "price_amount_usd": "2.0", "price_amount_usd_filled": "2.0", "fx_rate_local_per_usd": "1.0", "fx_source": "default_1usd", "information_text": "", "description_text": "", "features_text": "", "specifications_text": "", "benefits_text": "", "details_text": "", "other_sections": "", "sections": {}, "txt_path": "dataset/txt_limpios/1468.txt", "html_path": "dataset/paginas_descargadas/1468.html", "es_status": "EN", "category_canonical": "sin_categoria", "decision": "discard", "match_score": 0.3, "reasons": "no_category_detected"}
{"source_id": "1469", "title": "Horarios de entrega", "description": "", "breadcrumbs": "LISTA > 1 LITRO", "price_raw": "", "currency_raw": "", "url": "", "seller": "Desconocido", "availability": "unknown", "country": "UNKNOWN", "product_name": "Horarios de entrega", "brand": "LISTA", "reference": "", "unit": "1 LITRO", "price_amount": null, "price_currency": "", "price_symbol": "", "price_text": "", "price_amount_filled": "234.19", "price_is_imputed": "True", "price_imputation_source": "country_mean", "price_amount_usd": "", "price_amount_usd_filled": "234.1938", "fx_rate_local_per_usd": "1.0", "fx_source": "default_1usd", "information_text": "", "description_text": "", "features_text": "", "specifications_text": "", "benefits_text": "", "details_text": "", "other_sections": "", "sections": {}, "txt_path": "dataset/txt_limpios/1469.txt", "html_path": "dataset/paginas_descargadas/1469.html", "es_status": "EN", "category_canonical": "sin_categoria", "decision": "discard", "match_score": 0.3, "reasons": "no_category_detected;price_parse_failed"}
{"source_id": "1472", "title": "Horarios de entrega", "description": "", "breadcrumbs": "LISTA > 1 LITRO", "price_raw": "", "currency_raw": "", "url": "", "seller": "Desconocido", "availability": "unknown", "country": "UNKNOWN", "product_name": "Horarios de entrega", "brand": "LISTA", "reference": "", "unit": "1 LITRO", "price_amount": null, "price_currency": "", "price_symbol": "", "price_text": "", "price_amount_filled": "234.19", "price_is_imputed": "True", "price_imputation_source": "country_mean", "price_amount_usd": "", "price_amount_usd_filled": "234.1938", "fx_rate_local_per_usd": "1.0", "fx_source": "default_1usd", "information_text": "", "description_text": "", "features_text": "", "specifications_text": "", "benefits_text": "", "details_text": "", "other_sections": "", "sections": {}, "txt_path": "dataset/txt_limpios/1472.txt", "html_path": "dataset/paginas_descargadas/1472.html", "es_status": "EN", "category_canonical": "sin_categoria", "decision": "discard", "match_score": 0.3, "reasons": "no_category_detected;price_parse_failed"}
{"source_id": "1473", "title": "Horarios de entrega", "description": "", "breadcrumbs": "LISTA > 500 GRAMOS", "price_raw": "500.0", "currency_raw": "", "url": "", "seller": "Desconocido", "availability": "unknown", "country": "UNKNOWN", "product_name": "Horarios de entrega", "brand": "LISTA", "reference": "", "unit": "500 GRAMOS", "price_amount": 500.0, "price_currency": "", "price_symbol": "", "price_text": "500", "price_amount_filled": "500.0", "price_is_imputed": "False", "price_imputation_source": "original", "price_amount_usd": "500.0", "price_amount_usd_filled": "500.0", "fx_rate_local_per_usd": "1.0", "fx_source": "default_1usd", "information_text": "", "description_text": "", "features_text": "", "specifications_text": "", "benefits_text": "", "details_text": "", "other_sections": "", "sections": {}, "txt_path": "dataset/txt_limpios/1473.txt", "html_path": "dataset/paginas_descargadas/1473.html", "es_status": "EN", "category_canonical": "sin_categoria", "decision": "discard", "match_score": 0.3, "reasons": "no_category_detected"}
{"source_id": "1474", "title": "Horarios de entrega", "description": "", "breadcrumbs": "LISTA > 1 KG", "price_raw": "", "currency_raw": "", "url": "", "seller": "Desconocido", "availability": "unknown", "country": "UNKNOWN", "product_name": "Horarios de entrega", "brand": "LISTA", "reference": "", "unit": "1 KG", "price_amount": null, "price_currency": "", "price_symbol": "", "price_text": "", "price_amount_filled": "234.19", "price_is_imputed": "True", "price_imputation_source": "country_mean", "price_amount_usd": "", "price_amount_usd_filled": "234.1938", "fx_rate_local_per_usd": "1.0", "fx_source": "default_1usd", "information_text": "", "description_text": "", "features_text": "", "specifications_text": "", "benefits_text": "", "details_text": "", "other_sections": "", "sections": {}, "txt_path": "dataset/txt_limpios/1474.txt", "html_path": "dataset/paginas_descargadas/1474.html", "es_status": "EN", "category_canonical": "sin_categoria", "decision": "discard", "match_score": 0.3, "reasons": "no_category_detected;price_parse_failed"}
{"source_id": "1475", "title": "Horarios de entrega", "description": "", "breadcrumbs": "LISTA > 1 LITRO", "price_raw": "500.0", "currency_raw": "", "url": "", "seller": "Desconocido", "availability": "unknown", "country": "UNKNOWN", "product_name": "Horarios de entrega", "brand": "LISTA", "reference": "", "unit": "1 LITRO", "price_amount": 500.0, "price_currency": "", "price_symbol": "", "price_text": "500", "price_amount_filled": "500.0", "price_is_imputed": "False", "price_imputation_source": "original", "price_amount_usd": "500.0", "price_amount_usd_filled": "500.0", "fx_rate_local_per_usd": "1.0", "fx_source": "default_1usd", "information_text": "", "description_text": "", "features_text": "", "specifications_text": "", "benefits_text": "", "details_text": "", "other_sections": "", "sections": {}, "txt_path": "dataset/txt_limpios/1475.txt", "html_path": "dataset/paginas_descargadas/1475.html", "es_status": "EN", "category_canonical": "sin_categoria", "decision": "discard", "match_score": 0.3, "reasons": "no_category_detected"}
{"source_id": "1476", "title": "Horarios de entrega", "description": "", "breadcrumbs": "LISTA > 500 GRAMOS", "price_raw": "24.0", "currency_raw": "", "url": "", "seller": "Desconocido", "availability": "unknown", "country": "UNKNOWN", "product_name": "Horarios de entrega", "brand": "LISTA", "reference": "", "unit": "500 GRAMOS", "price_amount": 24.0, "price_currency": "", "price_symbol": "D", "price_text": "D24", "price_amount_filled": "24.0", "price_is_imputed": "False", "price_imputation_source": "original", "price_amount_usd": "24.0", "price_amount_usd_filled": "24.0", "fx_rate_local_per_usd": "1.0", "fx_source": "default_1usd", "information_text": "", "description_text": "", "features_text": "", "specifications_text": "", "benefits_text": "", "details_text": "", "other_sections": "", "sections": {}, "txt_path": "dataset/txt_limpios/1476.txt", "html_path": "dataset/paginas_descargadas/1476.html", "es_status": "EN", "category_canonical": "sin_categoria", "decision": "discard", "match_score": 0.3, "reasons": "no_category_detected"}
{"source_id": "1477", "title": "Horarios de entrega", "description": "", "breadcrumbs": "LISTA > 400GR", "price_raw": "400.0", "currency_raw": "", "url": "", "seller": "Desconocido", "availability": "unknown", "country": "UNKNOWN", "product_name": "Horarios de entrega", "brand": "LISTA", "reference": "", "unit": "400GR", "price_amount": 400.0, "price_currency": "", "price_symbol": "", "price_text": "400", "price_amount_filled": "400.0", "price_is_imputed": "False", "price_imputation_source": "original", "price_amount_usd": "400.0", "price_amount_usd_filled": "400.0", "fx_rate_local_per_usd": "1.0", "fx_source": "default_1usd", "information_text": "", "description_text": "", "features_text": "", "specifications_text": "", "benefits_text": "", "details_text": "", "other_sections": "", "sections": {}, "txt_path": "dataset/txt_limpios/1477.txt", "html_path": "dataset/paginas_descargadas/1477.html", "es_status": "EN", "category_canonical": "sin_categoria", "decision": "discard", "match_score": 0.3, "reasons": "no_category_detected"}
{"source_id": "1478", "title": "Horarios de entrega", "description": "", "breadcrumbs": "LISTA > 400 GR", "price_raw": "", "currency_raw": "", "url": "", "seller": "Desconocido", "availability": "unknown", "country": "UNKNOWN", "product_name": "Horarios de entrega", "brand": "LISTA", "reference": "", "unit": "400 GR", "price_amount": null, "price_currency": "", "price_symbol": "", "price_text": "", "price_amount_filled": "234.19", "price_is_imputed": "True", "price_imputation_source": "country_mean", "price_amount_usd": "", "price_amount_usd_filled": "234.1938", "fx_rate_local_per_usd": "1.0", "fx_source": "default_1usd", "information_text": "", "description_text": "", "features_text": "", "specifications_text": "", "benefits_text": "", "details_text": "", "other_sections": "", "sections": {}, "txt_path": "dataset/txt_limpios/1478.txt", "html_path": "dataset/paginas_descargadas/1478.html", "es_status": "EN", "category_canonical": "sin_categoria", "decision": "discard", "match_score": 0.3, "reasons": "no_category_detected;price_parse_failed"}
{"source_id": "1479", "title": "Horarios de entrega", "description": "", "breadcrumbs": "LISTA > 400 GRAMOS", "price_raw": "40.0", "currency_raw": "", "url": "", "seller": "Desconocido", "availability": "unknown", "country": "UNKNOWN", "product_name": "Horarios de entrega", "brand": "LISTA", "reference": "", "unit": "400 GRAMOS", "price_amount": 40.0, "price_currency": "", "price_symbol": "", "price_text": "40", "price_amount_filled": "40.0", "price_is_imputed": "False", "price_imputation_source": "original", "price_amount_usd": "40.0", "price_amount_usd_filled": "40.0", "fx_rate_local_per_usd": "1.0", "fx_source": "default_1usd", "information_text": "", "description_text": "", "features_text": "", "specifications_text": "", "benefits_text": "", "details_text": "", "other_sections": "", "sections": {}, "txt_path": "dataset/txt_limpios/1479.txt", "html_path": "dataset/paginas_descargadas/1479.html", "es_status": "EN", "category_canonical": "sin_categoria", "decision": "discard", "match_score": 0.3, "reasons": "no_category_detected"}
{"source_id": "1480", "title": "Horarios de entrega", "description": "", "breadcrumbs": "LISTA > 108 GR", "price_raw": "", "currency_raw": "", "url": "", "seller": "Desconocido", "availability": "unknown", "country": "UNKNOWN", "product_name": "Horarios de entrega", "brand": "LISTA", "reference": "", "unit": "108 GR", "price_amount": null, "price_currency": "", "price_symbol": "", "price_text": "", "price_amount_filled": "234.19", "price_is_imputed": "True", "price_imputation_source": "country_mean", "price_amount_usd": "", "price_amount_usd_filled": "234.1938", "fx_rate_local_per_usd": "1.0", "fx_source": "default_1usd", "information_text": "", "description_text": "", "features_text": "", "specifications_text": "", "benefits_text": "", "details_text": "", "other_sections": "", "sections": {}, "txt_path": "dataset/txt_limpios/1480.txt", "html_path": "dataset/paginas_descargadas/1480.html", "es_status": "EN", "category_canonical": "sin_categoria", "decision": "discard", "match_score": 0.3, "reasons": "no_category_detected;price_parse_failed"}
{"source_id": "1481", "title": "Horarios de entrega", "description": "", "breadcrumbs": "LISTA > 200 GR", "price_raw": "", "currency_raw": "", "url": "", "seller": "Desconocido", "availability": "unknown", "country": "UNKNOWN", "product_name": "Horarios de entrega", "brand": "LISTA", "reference": "", "unit": "200 GR", "price_amount": null, "price_currency": "", "price_symbol": "", "price_text": "", "price_amount_filled": "234.19", "price_is_imputed": "True", "price_imputation_source": "country_mean", "price_amount_usd": "", "price_amount_usd_filled": "234.1938", "fx_rate_local_per_usd": "1.0", "fx_source": "default_1usd", "information_text": "", "description_text": "", "features_text": "", "specifications_text": "", "benefits_text": "", "details_text": "", "other_sections": "", "sections": {}, "txt_path": "dataset/txt_limpios/1481.txt", "html_path": "dataset/paginas_descargadas/1481.html", "es_status": "EN", "category_canonical": "sin_categoria", "decision": "discard", "match_score": 0.3, "reasons": "no_category_detected;price_parse_failed"}
