source_id,title,description,breadcrumbs,price_raw,currency_raw,url,seller,availability,country,product_name,brand,reference,unit,price_amount,price_currency,price_symbol,price_text,price_amount_filled,price_is_imputed,price_imputation_source,price_amount_usd,price_amount_usd_filled,fx_rate_local_per_usd,fx_source,information_text,description_text,features_text,specifications_text,benefits_text,details_text,other_sections,sections,txt_path,html_path,es_status,category_canonical,decision,match_score,reasons
720,Selecciona tu,"+ | Especificaciones técnicas | Propiedad | Especificación | Ver más | Leche Alquería Original | Leche Sabor Original Alquería 1100 ml | Leche | Pedir medicamentos online | Televisores | Aires acondicionados | Comentarios | ☆ | 0 | (0 comentarios) | Por favor, inicia sesión para escribir un comentario. | Más reciente | Ordenar por: Más reciente | Más antiguo | Calificación más alta | Calificación más baja | Todos | Filtrar por: Todos | 1 estrella | 2 estrellas | 3 estrellas | 4 estrellas | 5 estrellas | No hay comentarios. | Términos más buscados | 1. | celulares | 2. | neveras | 3. | iphone | 4. | lavadora | 5. | aire | 6. | 7. | estufa | 8. | colchon | 9. | cafe | 10. | nevera | Evalúanos","Método de envío > 1,1 Lt",,COP,,Desconocido,unknown,CO,Selecciona tu,Método de envío,,"1,1 Lt",,COP,,,97.32,True,category_country_mean,,0.024,4047.0,from_colombia_cambio_dolar,,,,"+ | Especificaciones técnicas | Propiedad | Especificación | Ver más | Leche Alquería Original | Leche Sabor Original Alquería 1100 ml | Leche | Pedir medicamentos online | Televisores | Aires acondicionados | Comentarios | ☆ | 0 | (0 comentarios) | Por favor, inicia sesión para escribir un comentario. | Más reciente | Ordenar por: Más reciente | Más antiguo | Calificación más alta | Calificación más baja | Todos | Filtrar por: Todos | 1 estrella | 2 estrellas | 3 estrellas | 4 estrellas | 5 estrellas | No hay comentarios. | Términos más buscados | 1. | celulares | 2. | neveras | 3. | iphone | 4. | lavadora | 5. | aire | 6. | 7. | estufa | 8. | colchon | 9. | cafe | 10. | nevera | Evalúanos",,,,"{""Especificaciones"": [""+"", ""Especificaciones técnicas"", ""Propiedad"", ""Especificación"", ""Ver más"", ""Leche Alquería Original"", ""Leche Sabor Original Alquería 1100 ml"", ""Leche"", ""Pedir medicamentos online"", ""Televisores"", ""Aires acondicionados"", ""Comentarios"", ""☆"", ""0"", ""(0 comentarios)"", ""Por favor, inicia sesión para escribir un comentario."", ""Más reciente"", ""Ordenar por: Más reciente"", ""Más antiguo"", ""Calificación más alta"", ""Calificación más baja"", ""Todos"", ""Filtrar por: Todos"", ""1 estrella"", ""2 estrellas"", ""3 estrellas"", ""4 estrellas"", ""5 estrellas"", ""No hay comentarios."", ""Términos más buscados"", ""1."", ""celulares"", ""2."", ""neveras"", ""3."", ""iphone"", ""4."", ""lavadora"", ""5."", ""aire"", ""6."", ""7."", ""estufa"", ""8."", ""colchon"", ""9."", ""cafe"", ""10."", ""nevera"", ""Evalúanos""]}",dataset/txt_limpios/720.txt,dataset/paginas_descargadas/720.html,EN,cafe,discard,0.60,price_parse_failed;price<=0
721,Selecciona tu,"+ | Especificaciones técnicas | Propiedad | Especificación | Comentarios | ☆ | 0 Calificación promedio | (0 comentarios) | Por favor, inicia sesión para escribir un comentario. | Más reciente | Ordenar por: Más reciente | Más antiguo | Calificación más alta | Calificación más baja | Todos | Filtrar por: Todos | 1 estrella | 2 estrellas | 3 estrellas | 4 estrellas | 5 estrellas | No hay comentarios. | Evalúanos",Método de envío > 800 Ml,,COP,,Desconocido,unknown,CO,Selecciona tu,Método de envío,,800 Ml,,COP,,,100.78,True,country_mean,,0.0249,4047.0,from_colombia_cambio_dolar,,,,"+ | Especificaciones técnicas | Propiedad | Especificación | Comentarios | ☆ | 0 Calificación promedio | (0 comentarios) | Por favor, inicia sesión para escribir un comentario. | Más reciente | Ordenar por: Más reciente | Más antiguo | Calificación más alta | Calificación más baja | Todos | Filtrar por: Todos | 1 estrella | 2 estrellas | 3 estrellas | 4 estrellas | 5 estrellas | No hay comentarios. | Evalúanos",,,,"{""Especificaciones"": [""+"", ""Especificaciones técnicas"", ""Propiedad"", ""Especificación"", ""Comentarios"", ""☆"", ""0 Calificación promedio"", ""(0 comentarios)"", ""Por favor, inicia sesión para escribir un comentario."", ""Más reciente"", ""Ordenar por: Más reciente"", ""Más antiguo"", ""Calificación más alta"", ""Calificación más baja"", ""Todos"", ""Filtrar por: Todos"", ""1 estrella"", ""2 estrellas"", ""3 estrellas"", ""4 estrellas"", ""5 estrellas"", ""No hay comentarios."", ""Evalúanos""]}",dataset/txt_limpios/721.txt,dataset/paginas_descargadas/721.html,EN,sin_categoria,discard,0.30,no_category_detected;price_parse_failed
723,Selecciona tu,"+ | Complementa tu elección | Zanahoria Primera | Plátano Verde 1,5 Kg | 5 | 790 | 5.790 | La Giralda | LECHUGA HIDROPONICA VERDE CRESPA LA GIRALDA 180g | 3 | 990 | 3.990 | Olimpica | Papa Empacada 1,5 Kg Oferta | 3.980 | Papa R12 sin Lavar Seleccionada | 58 | 580 | 1.580 | La Granjita | Cebolla Junca 250 G | 250 Gramos | 17 | 92 | 4 | 4.480 | Comentarios | ☆ | 0 | (0 comentarios) | Por favor, inicia sesión para escribir un comentario. | Más reciente | Ordenar por: Más reciente | Más antiguo | Calificación más alta | Calificación más baja | Todos | Filtrar por: Todos | 1 estrella | 2 estrellas | 3 estrellas | 4 estrellas | 5 estrellas | No hay comentarios. | Términos más buscados | 1. | celulares | 2. | neveras | 3. | iphone | 4. | lavadora | 5. | aire | 6. | televisores | 7. | estufa | 8. | colchon | 9. | cafe | 10. | nevera | Evalúanos",Método de envío > 1 Kg,,COP,,Desconocido,unknown,CO,Selecciona tu,Método de envío,,1 Kg,,COP,,,2755946.3,True,category_mean,,680.985,4047.0,from_colombia_cambio_dolar,,,,"+ | Complementa tu elección | Zanahoria Primera | Plátano Verde 1,5 Kg | 5 | 790 | 5.790 | La Giralda | LECHUGA HIDROPONICA VERDE CRESPA LA GIRALDA 180g | 3 | 990 | 3.990 | Olimpica | Papa Empacada 1,5 Kg Oferta | 3.980 | Papa R12 sin Lavar Seleccionada | 58 | 580 | 1.580 | La Granjita | Cebolla Junca 250 G | 250 Gramos | 17 | 92 | 4 | 4.480 | Comentarios | ☆ | 0 | (0 comentarios) | Por favor, inicia sesión para escribir un comentario. | Más reciente | Ordenar por: Más reciente | Más antiguo | Calificación más alta | Calificación más baja | Todos | Filtrar por: Todos | 1 estrella | 2 estrellas | 3 estrellas | 4 estrellas | 5 estrellas | No hay comentarios. | Términos más buscados | 1. | celulares | 2. | neveras | 3. | iphone | 4. | lavadora | 5. | aire | 6. | televisores | 7. | estufa | 8. | colchon | 9. | cafe | 10. | nevera | Evalúanos",,,,"{""Especificaciones"": [""+"", ""Complementa tu elección"", ""Zanahoria Primera"", ""Plátano Verde 1,5 Kg"", ""5"", ""790"", ""5.790"", ""La Giralda"", ""LECHUGA HIDROPONICA VERDE CRESPA LA GIRALDA 180g"", ""3"", ""990"", ""3.990"", ""Olimpica"", ""Papa Empacada 1,5 Kg Oferta"", ""3.980"", ""Papa R12 sin Lavar Seleccionada"", ""58"", ""580"", ""1.580"", ""La Granjita"", ""Cebolla Junca 250 G"", ""250 Gramos"", ""17"", ""92"", ""4"", ""4.480"", ""Comentarios"", ""☆"", ""0"", ""(0 comentarios)"", ""Por favor, inicia sesión para escribir un comentario."", ""Más reciente"", ""Ordenar por: Más reciente"", ""Más antiguo"", ""Calificación más alta"", ""Calificación más baja"", ""Todos"", ""Filtrar por: Todos"", ""1 estrella"", ""2 estrellas"", ""3 estrellas"", ""4 estrellas"", ""5 estrellas"", ""No hay comentarios."", ""Términos más buscados"", ""1."", ""celulares"", ""2."", ""neveras"", ""3."", ""iphone"", ""4."", ""lavadora"", ""5."", ""aire"", ""6."", ""televisores"", ""7."", ""estufa"", ""8."", ""colchon"", ""9."", ""cafe"", ""10."", ""nevera"", ""Evalúanos""]}",dataset/txt_limpios/723.txt,dataset/paginas_descargadas/723.html,EN,cebolla,discard,0.60,price_parse_failed;price<=0
724,Selecciona tu,"+ | Especificaciones técnicas | Propiedad | Especificación | Ver más | Supermercado en línea | Precio aire acondicionado Olimpo | Aires Acondicionados | Ropa deportiva | Comprar artículos deportivos | Comentarios | ☆ | 0 | (0 comentarios) | Por favor, inicia sesión para escribir un comentario. | Más reciente | Ordenar por: Más reciente | Más antiguo | Calificación más alta | Calificación más baja | Todos | Filtrar por: Todos | 1 estrella | 2 estrellas | 3 estrellas | 4 estrellas | 5 estrellas | No hay comentarios. | Términos más buscados | 1. | celulares | 2. | neveras | 3. | iphone | 4. | lavadora | 5. | aire | 6. | televisores | 7. | estufa | 8. | colchon | 9. | cafe | 10. | nevera | Evalúanos",Método de envío > 1000 Gramos,,COP,,Desconocido,unknown,CO,Selecciona tu,Método de envío,,1000 Gramos,,COP,,,97.32,True,category_country_mean,,0.024,4047.0,from_colombia_cambio_dolar,,,,"+ | Especificaciones técnicas | Propiedad | Especificación | Ver más | Supermercado en línea | Precio aire acondicionado Olimpo | Aires Acondicionados | Ropa deportiva | Comprar artículos deportivos | Comentarios | ☆ | 0 | (0 comentarios) | Por favor, inicia sesión para escribir un comentario. | Más reciente | Ordenar por: Más reciente | Más antiguo | Calificación más alta | Calificación más baja | Todos | Filtrar por: Todos | 1 estrella | 2 estrellas | 3 estrellas | 4 estrellas | 5 estrellas | No hay comentarios. | Términos más buscados | 1. | celulares | 2. | neveras | 3. | iphone | 4. | lavadora | 5. | aire | 6. | televisores | 7. | estufa | 8. | colchon | 9. | cafe | 10. | nevera | Evalúanos",,,,"{""Especificaciones"": [""+"", ""Especificaciones técnicas"", ""Propiedad"", ""Especificación"", ""Ver más"", ""Supermercado en línea"", ""Precio aire acondicionado Olimpo"", ""Aires Acondicionados"", ""Ropa deportiva"", ""Comprar artículos deportivos"", ""Comentarios"", ""☆"", ""0"", ""(0 comentarios)"", ""Por favor, inicia sesión para escribir un comentario."", ""Más reciente"", ""Ordenar por: Más reciente"", ""Más antiguo"", ""Calificación más alta"", ""Calificación más baja"", ""Todos"", ""Filtrar por: Todos"", ""1 estrella"", ""2 estrellas"", ""3 estrellas"", ""4 estrellas"", ""5 estrellas"", ""No hay comentarios."", ""Términos más buscados"", ""1."", ""celulares"", ""2."", ""neveras"", ""3."", ""iphone"", ""4."", ""lavadora"", ""5."", ""aire"", ""6."", ""televisores"", ""7."", ""estufa"", ""8."", ""colchon"", ""9."", ""cafe"", ""10."", ""nevera"", ""Evalúanos""]}",dataset/txt_limpios/724.txt,dataset/paginas_descargadas/724.html,EN,cafe,discard,0.60,price_parse_failed;price<=0
725,Selecciona tu,"+ | Especificaciones técnicas | Propiedad | Especificación | Ver más | Descuentos tecnología | Ofertas en celulares nuevos | Ofertas exclusivas | Televisor | Televisores envío gratis | Viajes económicos | Feria de cocina | Comentarios | ☆ | 0 Calificación promedio | (0 comentarios) | Por favor, inicia sesión para escribir un comentario. | Más reciente | Ordenar por: Más reciente | Más antiguo | Calificación más alta | Calificación más baja | Todos | Filtrar por: Todos | 1 estrella | 2 estrellas | 3 estrellas | 4 estrellas | 5 estrellas | No hay comentarios. | Evalúanos | Términos más buscados | 1. | celulares | 2. | neveras | 3. | iphone | 4. | lavadora | 5. | aire | 6. | televisores | 7. | estufa | 8. | colchon | 9. | cafe | 10. | nevera",Método de envío > 1000 Gramos,,COP,,Desconocido,unknown,CO,Selecciona tu,Método de envío,,1000 Gramos,,COP,,,97.32,True,category_country_mean,,0.024,4047.0,from_colombia_cambio_dolar,,,,"+ | Especificaciones técnicas | Propiedad | Especificación | Ver más | Descuentos tecnología | Ofertas en celulares nuevos | Ofertas exclusivas | Televisor | Televisores envío gratis | Viajes económicos | Feria de cocina | Comentarios | ☆ | 0 Calificación promedio | (0 comentarios) | Por favor, inicia sesión para escribir un comentario. | Más reciente | Ordenar por: Más reciente | Más antiguo | Calificación más alta | Calificación más baja | Todos | Filtrar por: Todos | 1 estrella | 2 estrellas | 3 estrellas | 4 estrellas | 5 estrellas | No hay comentarios. | Evalúanos | Términos más buscados | 1. | celulares | 2. | neveras | 3. | iphone | 4. | lavadora | 5. | aire | 6. | televisores | 7. | estufa | 8. | colchon | 9. | cafe | 10. | nevera",,,,"{""Especificaciones"": [""+"", ""Especificaciones técnicas"", ""Propiedad"", ""Especificación"", ""Ver más"", ""Descuentos tecnología"", ""Ofertas en celulares nuevos"", ""Ofertas exclusivas"", ""Televisor"", ""Televisores envío gratis"", ""Viajes económicos"", ""Feria de cocina"", ""Comentarios"", ""☆"", ""0 Calificación promedio"", ""(0 comentarios)"", ""Por favor, inicia sesión para escribir un comentario."", ""Más reciente"", ""Ordenar por: Más reciente"", ""Más antiguo"", ""Calificación más alta"", ""Calificación más baja"", ""Todos"", ""Filtrar por: Todos"", ""1 estrella"", ""2 estrellas"", ""3 estrellas"", ""4 estrellas"", ""5 estrellas"", ""No hay comentarios."", ""Evalúanos"", ""Términos más buscados"", ""1."", ""celulares"", ""2."", ""neveras"", ""3."", ""iphone"", ""4."", ""lavadora"", ""5."", ""aire"", ""6."", ""televisores"", ""7."", ""estufa"", ""8."", ""colchon"", ""9."", ""cafe"", ""10."", ""nevera""]}",dataset/txt_limpios/725.txt,dataset/paginas_descargadas/725.html,EN,cafe,discard,0.60,price_parse_failed;price<=0
726,Selecciona tu,"+ | Especificaciones técnicas | Propiedad | Especificación | Comentarios | ☆ | 0 | (0 comentarios) | Por favor, inicia sesión para escribir un comentario. | Más reciente | Ordenar por: Más reciente | Más antiguo | Calificación más alta | Calificación más baja | Todos | Filtrar por: Todos | 1 estrella | 2 estrellas | 3 estrellas | 4 estrellas | 5 estrellas | No hay comentarios. | Evalúanos | Términos más buscados | 1. | celulares | 2. | neveras | 3. | iphone | 4. | lavadora | 5. | aire | 6. | televisores | 7. | estufa | 8. | colchon | 9. | cafe | 10. | nevera",Método de envío > 1000 Gramos,,COP,,Desconocido,unknown,CO,Selecciona tu,Método de envío,,1000 Gramos,,COP,,,97.32,True,category_country_mean,,0.024,4047.0,from_colombia_cambio_dolar,,,,"+ | Especificaciones técnicas | Propiedad | Especificación | Comentarios | ☆ | 0 | (0 comentarios) | Por favor, inicia sesión para escribir un comentario. | Más reciente | Ordenar por: Más reciente | Más antiguo | Calificación más alta | Calificación más baja | Todos | Filtrar por: Todos | 1 estrella | 2 estrellas | 3 estrellas | 4 estrellas | 5 estrellas | No hay comentarios. | Evalúanos | Términos más buscados | 1. | celulares | 2. | neveras | 3. | iphone | 4. | lavadora | 5. | aire | 6. | televisores | 7. | estufa | 8. | colchon | 9. | cafe | 10. | nevera",,,,"{""Especificaciones"": [""+"", ""Especificaciones técnicas"", ""Propiedad"", ""Especificación"", ""Comentarios"", ""☆"", ""0"", ""(0 comentarios)"", ""Por favor, inicia sesión para escribir un comentario."", ""Más reciente"", ""Ordenar por: Más reciente"", ""Más antiguo"", ""Calificación más alta"", ""Calificación más baja"", ""Todos"", ""Filtrar por: Todos"", ""1 estrella"", ""2 estrellas"", ""3 estrellas"", ""4 estrellas"", ""5 estrellas"", ""No hay comentarios."", ""Evalúanos"", ""Términos más buscados"", ""1."", ""celulares"", ""2."", ""neveras"", ""3."", ""iphone"", ""4."", ""lavadora"", ""5."", ""aire"", ""6."", ""televisores"", ""7."", ""estufa"", ""8."", ""colchon"", ""9."", ""cafe"", ""10."", ""nevera""]}",dataset/txt_limpios/726.txt,dataset/paginas_descargadas/726.html,EN,cafe,discard,0.60,price_parse_failed;price<=0
727,Selecciona tu,"+ | Especificaciones técnicas | Propiedad | Especificación | Tipo de Vegetales Envasados | Otros Vegetales Envasados | Complementa tu elección | Del Alba | Pasaboca del Alba Almendra Salada 100 G | 080 | Why Not | Esparcible Why Not Choco Avellana 284 G | 140 | Pesco | Langostino Pesco Jumbo 300 G | 38 | 000 | Greco | Galleta Greco Kurabié Mediterráneas Almendra 200 G | 19 | 550 | Alamos | Vino Blanco Alamos Chardonnay 750 Ml | 95 | Portillo | Vino Tinto Portillo Merlot 750 Ml | 750 Mililitros | Mililitro | 117 | 33 | 88 | Ver más | Ofertas televisores | Ofertas tarjetas de crédito | Artículos para hogar | Ofertas exclusivas | Comprar computadores baratos | Viajar barato | Comentarios | ☆ | 0 | (0 comentarios) | Por favor, inicia sesión para escribir un comentario. | Más reciente | Ordenar por: Más reciente | Más antiguo | Calificación más alta | Calificación más baja | Todos | Filtrar por: Todos | 1 estrella | 2 estrellas | 3 estrellas | 4 estrellas | 5 estrellas | No hay comentarios. | Términos más buscados | 1. | celulares | 2. | neveras | 3. | iphone | 4. | lavadora | 5. | aire | 6. | televisores | 7. | estufa | 8. | colchon | 9. | cafe | 10. | nevera | Evalúanos",Método de envío > 411 G,,COP,,Desconocido,unknown,CO,Selecciona tu,Método de envío,,411 G,,COP,,,97.32,True,category_country_mean,,0.024,4047.0,from_colombia_cambio_dolar,,,,"+ | Especificaciones técnicas | Propiedad | Especificación | Tipo de Vegetales Envasados | Otros Vegetales Envasados | Complementa tu elección | Del Alba | Pasaboca del Alba Almendra Salada 100 G | 080 | Why Not | Esparcible Why Not Choco Avellana 284 G | 140 | Pesco | Langostino Pesco Jumbo 300 G | 38 | 000 | Greco | Galleta Greco Kurabié Mediterráneas Almendra 200 G | 19 | 550 | Alamos | Vino Blanco Alamos Chardonnay 750 Ml | 95 | Portillo | Vino Tinto Portillo Merlot 750 Ml | 750 Mililitros | Mililitro | 117 | 33 | 88 | Ver más | Ofertas televisores | Ofertas tarjetas de crédito | Artículos para hogar | Ofertas exclusivas | Comprar computadores baratos | Viajar barato | Comentarios | ☆ | 0 | (0 comentarios) | Por favor, inicia sesión para escribir un comentario. | Más reciente | Ordenar por: Más reciente | Más antiguo | Calificación más alta | Calificación más baja | Todos | Filtrar por: Todos | 1 estrella | 2 estrellas | 3 estrellas | 4 estrellas | 5 estrellas | No hay comentarios. | Términos más buscados | 1. | celulares | 2. | neveras | 3. | iphone | 4. | lavadora | 5. | aire | 6. | televisores | 7. | estufa | 8. | colchon | 9. | cafe | 10. | nevera | Evalúanos",,,,"{""Especificaciones"": [""+"", ""Especificaciones técnicas"", ""Propiedad"", ""Especificación"", ""Tipo de Vegetales Envasados"", ""Otros Vegetales Envasados"", ""Complementa tu elección"", ""Del Alba"", ""Pasaboca del Alba Almendra Salada 100 G"", ""080"", ""Why Not"", ""Esparcible Why Not Choco Avellana 284 G"", ""140"", ""Pesco"", ""Langostino Pesco Jumbo 300 G"", ""38"", ""000"", ""Greco"", ""Galleta Greco Kurabié Mediterráneas Almendra 200 G"", ""19"", ""550"", ""Alamos"", ""Vino Blanco Alamos Chardonnay 750 Ml"", ""95"", ""Portillo"", ""Vino Tinto Portillo Merlot 750 Ml"", ""750 Mililitros"", ""Mililitro"", ""117"", ""33"", ""88"", ""Ver más"", ""Ofertas televisores"", ""Ofertas tarjetas de crédito"", ""Artículos para hogar"", ""Ofertas exclusivas"", ""Comprar computadores baratos"", ""Viajar barato"", ""Comentarios"", ""☆"", ""0"", ""(0 comentarios)"", ""Por favor, inicia sesión para escribir un comentario."", ""Más reciente"", ""Ordenar por: Más reciente"", ""Más antiguo"", ""Calificación más alta"", ""Calificación más baja"", ""Todos"", ""Filtrar por: Todos"", ""1 estrella"", ""2 estrellas"", ""3 estrellas"", ""4 estrellas"", ""5 estrellas"", ""No hay comentarios."", ""Términos más buscados"", ""1."", ""celulares"", ""2."", ""neveras"", ""3."", ""iphone"", ""4."", ""lavadora"", ""5."", ""aire"", ""6."", ""televisores"", ""7."", ""estufa"", ""8."", ""colchon"", ""9."", ""cafe"", ""10."", ""nevera"", ""Evalúanos""]}",dataset/txt_limpios/727.txt,dataset/paginas_descargadas/727.html,EN,cafe,discard,0.60,price_parse_failed;price<=0
