source_id,title,description,breadcrumbs,price_raw,currency_raw,url,seller,availability,country,product_name,brand,reference,unit,price_amount,price_currency,price_symbol,price_text,price_amount_filled,price_is_imputed,price_imputation_source,price_amount_usd,price_amount_usd_filled,fx_rate_local_per_usd,fx_source,information_text,description_text,features_text,specifications_text,benefits_text,details_text,other_sections,sections,txt_path,html_path,es_status,category_canonical,decision,match_score,reasons
1178,Centro de preferencia de la privacidad,,Activas siempre > 500g,,PEN,,Desconocido,unknown,PE,Centro de preferencia de la privacidad,Activas siempre,,500g,,PEN,,,55.14,True,country_mean,,15.5336,3.55,from_peru_cambio_dolar,,,TE RECOMENDAMOS | BELL'S | Huevos Pardos BELL'S Bandeja 30un | 21 | 30 | LA CALERA | Huevos Blancos LA CALERA Paquete 15un | 11 | 50 | Huevos de Codorniz BELL'S Bandeja 18un | 7 | Huevos para el Ande LA CALERA Paquete 15un | ENKEL FOODS | Claras de Huevo ENKEL FOODS Tetrapack 500g | 22 | Huevos Pardo LA CALERA Bandeja 17un + Huevo Sorpresa | No disponible | Huevos Pardos LA CALERA Paquete 30un | 23 | Huevos de Gallina LA CALERA de Corral Bandeja 12un | 14 | Huevos de Gallina BELL'S Pardos Bandeja 15un | 10 | Huevos Pardos LA CALERA Bandeja 15un | 70 | ¡Entérate de eventos exclusivos y promociones especiales que tenemos para ti! | SUSCRIBIRME | Acepto las políticas de tratamientos de datos personales | Razón Social: Compañía Food Retail S.A.C. RUC: 20608300393. Todos los derechos reservados Vivanda 2023. | | Hola! | Encuentra todo lo que necesitas en Vivanda online | Términos más buscados | 1. | quesos | 2. | vino | 3. | café | 4. | quark 500g | 5. | leche | 6. | pollo | 7. | yogurt | 8. | lunch florencia | 9. | agua | 10 | vinos,,,,,"{""Características"": [""TE RECOMENDAMOS"", ""BELL'S"", ""Huevos Pardos BELL'S Bandeja 30un"", ""21"", ""30"", ""LA CALERA"", ""Huevos Blancos LA CALERA Paquete 15un"", ""11"", ""50"", ""Huevos de Codorniz BELL'S Bandeja 18un"", ""7"", ""Huevos para el Ande LA CALERA Paquete 15un"", ""ENKEL FOODS"", ""Claras de Huevo ENKEL FOODS Tetrapack 500g"", ""22"", ""Huevos Pardo LA CALERA Bandeja 17un + Huevo Sorpresa"", ""No disponible"", ""Huevos Pardos LA CALERA Paquete 30un"", ""23"", ""Huevos de Gallina LA CALERA de Corral Bandeja 12un"", ""14"", ""Huevos de Gallina BELL'S Pardos Bandeja 15un"", ""10"", ""Huevos Pardos LA CALERA Bandeja 15un"", ""70"", ""¡Entérate de eventos exclusivos y promociones especiales que tenemos para ti!"", ""SUSCRIBIRME"", ""Acepto las políticas de tratamiento de datos personales"", ""Razón social: Compañía Food Retail S.A.C. RUC: 20608300393. Todos los derechos reservados Vivanda 2023."", ""¡Hola!"", ""Encuentra todo lo que necesitas en Vivanda online"", ""Términos más buscados"", ""1."", ""quesos"", ""2."", ""vino"", ""3."", ""cafe"", ""4."", ""quark 500g"", ""5."", ""leche"", ""6."", ""pollo"", ""7."", ""yogurt"", ""8."", ""lunch florencia"", ""9."", ""agua"", ""10."", ""vinos""]}",dataset/txt_limpios/1178.txt,dataset/paginas_descargadas/1178.html,ET,sin_categoria,discard,0.30,no_category_detected;price_parse_failed
1179,Centro de preferencia de la privacidad,,Activas siempre > 1Kg,,PEN,,Desconocido,unknown,PE,Centro de preferencia de la privacidad,Activas siempre,,1Kg,,PEN,,,55.14,True,country_mean,,15.5336,3.55,from_peru_cambio_dolar,,,TE RECOMENDAMOS | DULFINA | Azúcar Rubia DULFINA Bolsa 2Kg | 9 | 80 | Azúcar Rubia DULFINA Bolsa 5Kg | 22 | BELL'S | Azúcar Rubia BELL'S Caja 60un | 7 | 30 | ONZA | Azúcar Rubia ONZA Light con Stevia Doypack 500g | Azúcar Rubia CARTAVIO Bolsa 5Kg | 23 | -4% | Azúcar Rubia DULFINA Bolsa 1Kg | 4 | 99 | 4% | Azúcar Rubia BELL'S Bolsa 5Kg | 20 | Azúcar Rubia BELL'S Bolsa 2Kg | 8 | 70 | Azúcar Rubia BELL'S Bolsa 1Kg | 10 | ¡Entérate de eventos exclusivos y promociones especiales que tenemos para ti! | SUSCRIBIRME | Acepto las políticas de tratamientos de datos personales | Razón Social: Compañía Food Retail S.A.C. RUC: 20608300393. Todos los derechos reservados Vivanda 2023. | | Hola! | Encuentra todo lo que necesitas en Vivanda online | Términos más buscados | 1. | quesos | 2. | vino | 3. | café | 4. | quark 500g | 5. | leche | 6. | pollo | 7. | yogurt | 8. | lunch florencia | 9. | agua | 10 | vinos,,,,,"{""Características"": [""TE RECOMENDAMOS"", ""DULFINA"", ""Azúcar Rubia DULFINA Bolsa 2Kg"", ""9"", ""80"", ""Azúcar Rubia DULFINA Bolsa 5Kg"", ""22"", ""BELL'S"", ""Azúcar Rubia BELL'S Caja 60un"", ""7"", ""30"", ""ONZA"", ""Azúcar Rubia ONZA Light con Stevia Doypack 500g"", ""Azúcar Rubia CARTAVIO Bolsa 5Kg"", ""23"", ""-4%"", ""Azúcar Rubia DULFINA Bolsa 1Kg"", ""4"", ""99"", ""4%"", ""Azúcar Rubia BELL'S Bolsa 5Kg"", ""20"", ""Azúcar Rubia BELL'S Bolsa 2Kg"", ""8"", ""70"", ""Azúcar Rubia BELL'S Bolsa 1Kg"", ""10"", ""¡Entérate de eventos exclusivos y promociones especiales que tenemos para ti!"", ""SUSCRIBIRME"", ""Acepto las políticas de tratamiento de datos personales"", ""Razón social: Compañía Food Retail S.A.C. RUC: 20608300393. Todos los derechos reservados Vivanda 2023."", ""¡Hola!"", ""Encuentra todo lo que necesitas en Vivanda online"", ""Términos más buscados"", ""1."", ""quesos"", ""2."", ""vino"", ""3."", ""cafe"", ""4."", ""quark 500g"", ""5."", ""leche"", ""6."", ""pollo"", ""7."", ""yogurt"", ""8."", ""lunch florencia"", ""9."", ""agua"", ""10."", ""vinos""]}",dataset/txt_limpios/1179.txt,dataset/paginas_descargadas/1179.html,ET,sin_categoria,discard,0.30,no_category_detected;price_parse_failed
1180,Centro de preferencia de la privacidad,,Activas siempre > 1Kg,,PEN,,Desconocido,unknown,PE,Centro de preferencia de la privacidad,Activas siempre,,1Kg,,PEN,,,55.14,True,country_mean,,15.5336,3.55,from_peru_cambio_dolar,,,TE RECOMENDAMOS | DULFINA | Azúcar Rubia DULFINA Bolsa 2Kg | 9 | 80 | Azúcar Rubia DULFINA Bolsa 5Kg | 22 | Azúcar Rubia BELL'S Caja 60un | 7 | 30 | ONZA | Azúcar Rubia ONZA Light con Stevia Doypack 500g | CARTAVIO | Azúcar Rubia CARTAVIO Bolsa 5Kg | 23 | Azúcar Rubia CARTAVIO Bolsa 1Kg | No disponible | -4% | Azúcar Rubia DULFINA Bolsa 1Kg | 99 | 4% | Azúcar Rubia BELL'S Bolsa 5Kg | 20 | Azúcar Rubia BELL'S Bolsa 2Kg | 8 | 70 | ¡Entérate de eventos exclusivos y promociones especiales que tenemos para ti! | SUSCRIBIRME | Acepto las políticas de tratamientos de datos personales | Razón Social: Compañía Food Retail S.A.C. RUC: 20608300393. Todos los derechos reservados Vivanda 2023. | | Hola! | Encuentra todo lo que necesitas en Vivanda online | Términos más buscados | 1. | quesos | 2. | vino | 3. | café | 4. | quark 500g | 5. | leche | 6. | pollo | 7. | yogurt | 8. | lunch florencia | 9. | agua | 10 | vinos,,,,,"{""Características"": [""TE RECOMENDAMOS"", ""DULFINA"", ""Azúcar Rubia DULFINA Bolsa 2Kg"", ""9"", ""80"", ""Azúcar Rubia DULFINA Bolsa 5Kg"", ""22"", ""Azúcar Rubia BELL'S Caja 60un"", ""7"", ""30"", ""ONZA"", ""Azúcar Rubia ONZA Light con Stevia Doypack 500g"", ""CARTAVIO"", ""Azúcar Rubia CARTAVIO Bolsa 5Kg"", ""23"", ""Azúcar Rubia CARTAVIO Bolsa 1Kg"", ""No disponible"", ""-4%"", ""Azúcar Rubia DULFINA Bolsa 1Kg"", ""99"", ""4%"", ""Azúcar Rubia BELL'S Bolsa 5Kg"", ""20"", ""Azúcar Rubia BELL'S Bolsa 2Kg"", ""8"", ""70"", ""¡Entérate de eventos exclusivos y promociones especiales que tenemos para ti!"", ""SUSCRIBIRME"", ""Acepto las políticas de tratamiento de datos personales"", ""Razón social: Compañía Food Retail S.A.C. RUC: 20608300393. Todos los derechos reservados Vivanda 2023."", ""¡Hola!"", ""Encuentra todo lo que necesitas en Vivanda online"", ""Términos más buscados"", ""1."", ""quesos"", ""2."", ""vino"", ""3."", ""cafe"", ""4."", ""quark 500g"", ""5."", ""leche"", ""6."", ""pollo"", ""7."", ""yogurt"", ""8."", ""lunch florencia"", ""9."", ""agua"", ""10."", ""vinos""]}",dataset/txt_limpios/1180.txt,dataset/paginas_descargadas/1180.html,ET,sin_categoria,discard,0.30,no_category_detected;price_parse_failed
1181,Centro de preferencia de la privacidad,,Activas siempre > 2Kg,,PEN,,Desconocido,unknown,PE,Centro de preferencia de la privacidad,Activas siempre,,2Kg,,PEN,,,55.14,True,country_mean,,15.5336,3.55,from_peru_cambio_dolar,,,TE RECOMENDAMOS | Azúcar Rubia DULFINA Bolsa 5Kg | 22 | BELL'S | Azúcar Rubia BELL'S Caja 60un | 7 | 30 | ONZA | Azúcar Rubia ONZA Light con Stevia Doypack 500g | CARTAVIO | Azúcar Rubia CARTAVIO Bolsa 5Kg | 23 | Azúcar Rubia CARTAVIO Bolsa 1Kg | No disponible | -4% | Azúcar Rubia DULFINA Bolsa 1Kg | 4 | 99 | 4% | Azúcar Rubia BELL'S Bolsa 5Kg | 20 | Azúcar Rubia BELL'S Bolsa 2Kg | 8 | 70 | Azúcar Rubia BELL'S Bolsa 1Kg | 10 | ¡Entérate de eventos exclusivos y promociones especiales que tenemos para ti! | SUSCRIBIRME | Acepto las políticas de tratamientos de datos personales | Razón Social: Compañía Food Retail S.A.C. RUC: 20608300393. Todos los derechos reservados Vivanda 2023. | | Hola! | Encuentra todo lo que necesitas en Vivanda online | Términos más buscados | 1. | quesos | 2. | vino | 3. | café | 4. | quark 500g | 5. | leche | 6. | pollo | 7. | yogurt | 8. | lunch florencia | 9. | agua | 10 | vinos,,,,,"{""Características"": [""TE RECOMENDAMOS"", ""Azúcar Rubia DULFINA Bolsa 5Kg"", ""22"", ""BELL'S"", ""Azúcar Rubia BELL'S Caja 60un"", ""7"", ""30"", ""ONZA"", ""Azúcar Rubia ONZA Light con Stevia Doypack 500g"", ""CARTAVIO"", ""Azúcar Rubia CARTAVIO Bolsa 5Kg"", ""23"", ""Azúcar Rubia CARTAVIO Bolsa 1Kg"", ""No disponible"", ""-4%"", ""Azúcar Rubia DULFINA Bolsa 1Kg"", ""4"", ""99"", ""4%"", ""Azúcar Rubia BELL'S Bolsa 5Kg"", ""20"", ""Azúcar Rubia BELL'S Bolsa 2Kg"", ""8"", ""70"", ""Azúcar Rubia BELL'S Bolsa 1Kg"", ""10"", ""¡Entérate de eventos exclusivos y promociones especiales que tenemos para ti!"", ""SUSCRIBIRME"", ""Acepto las políticas de tratamiento de datos personales"", ""Razón social: Compañía Food Retail S.A.C. RUC: 20608300393. Todos los derechos reservados Vivanda 2023."", ""¡Hola!"", ""Encuentra todo lo que necesitas en Vivanda online"", ""Términos más buscados"", ""1."", ""quesos"", ""2."", ""vino"", ""3."", ""cafe"", ""4."", ""quark 500g"", ""5."", ""leche"", ""6."", ""pollo"", ""7."", ""yogurt"", ""8."", ""lunch florencia"", ""9."", ""agua"", ""10."", ""vinos""]}",dataset/txt_limpios/1181.txt,dataset/paginas_descargadas/1181.html,ET,sin_categoria,discard,0.30,no_category_detected;price_parse_failed
1182,Centro de preferencia de la privacidad,,Activas siempre > 500g,,PEN,,Desconocido,unknown,PE,Centro de preferencia de la privacidad,Activas siempre,,500g,,PEN,,,55.14,True,country_mean,,15.5336,3.55,from_peru_cambio_dolar,,,,,,,,{},dataset/txt_limpios/1182.txt,dataset/paginas_descargadas/1182.html,EN,sin_categoria,discard,0.30,no_category_detected;price_parse_failed
1183,Centro de preferencia de la privacidad,,Activas siempre > 200g,,PEN,,Desconocido,unknown,PE,Centro de preferencia de la privacidad,Activas siempre,,200g,,PEN,,,55.14,True,country_mean,,15.5336,3.55,from_peru_cambio_dolar,,,TE RECOMENDAMOS | HERSHEY'S | Chips de Chocolate Semidulce HERSHEY'S Bolsa 340g | 31 | NESTLE | Cobertura de Chocolate Bitter NESTLÉ Tableta 500 g | 21 | 90 | MONTBLANC | Chocolate Bitter MONTBLANC Tableta Caja 80g | 18 | Chocolate Bitter MONTBLANC Tableta 190g | 26 | BADIA | Especia BADIA Canela en polvo Acerca de 14.2Gr | 4 | -37% | KARINO | Canela Molida KARIÑO Acerca de 12g | 30 | Canela Entera KARIÑO Sobre 9g | Canela en Polvo BADIA Frasco 56.7g | 9 | 70 | UMSHA | Esencia de Vainila UMSHA Botella 90ml | Entérate de eventos exclusivos y promociones especiales que tenemos para ti! | SUSCRIBIRME | Acepto las políticas de tratamientos de datos personales | Razón Social: Compañía Food Retail S.A.C. RUC: 20608300393. Todos los derechos reservados Vivanda 2023. | | Hola! | Encuentra todo lo que necesitas en Vivanda online | Términos más buscados | 1. | quesos | 2. | vino | 3. | café | 4. | quark 500g | 5. | leche | 6. | pollo | 7. | yogurt | 8. | lunch florencia | 9. | agua | 10 | vinos,,,,,"{""Características"": [""TE RECOMENDAMOS"", ""HERSHEY'S"", ""Chips de Chocolate Semidulce HERSHEY'S Bolsa 340g"", ""31"", ""NESTLE"", ""Cubierta de Chocolate Bitter NESTLÉ Tableta 500 g"", ""21"", ""90"", ""MONTBLANC"", ""Chocolate Bitter MONTBLANC Tableta Caja 80g"", ""18"", ""Chocolate Bitter MONTBLANC Tableta 190g"", ""26"", ""BADIA"", ""Especia BADIA Canela en polvo Sobre 14.2Gr"", ""4"", ""-37%"", ""KARINO"", ""Canela Molida KARIÑO Sobre 12g"", ""30"", ""Canela Entera KARIÑO Sobre 9g"", ""Canela en Polvo BADIA Frasco 56.7g"", ""9"", ""70"", ""UMSHA"", ""Esencia de Vainila UMSHA Botella 90ml"", ""¡Entérate de eventos exclusivos y promociones especiales que tenemos para ti!"", ""SUSCRIBIRME"", ""Acepto las políticas de tratamiento de datos personales"", ""Razón social: Compañía Food Retail S.A.C. RUC: 20608300393. Todos los derechos reservados Vivanda 2023."", ""¡Hola!"", ""Encuentra todo lo que necesitas en Vivanda online"", ""Términos más buscados"", ""1."", ""quesos"", ""2."", ""vino"", ""3."", ""cafe"", ""4."", ""quark 500g"", ""5."", ""leche"", ""6."", ""pollo"", ""7."", ""yogurt"", ""8."", ""lunch florencia"", ""9."", ""agua"", ""10."", ""vinos""]}",dataset/txt_limpios/1183.txt,dataset/paginas_descargadas/1183.html,ET,sin_categoria,discard,0.30,no_category_detected;price_parse_failed
1184,Centro de preferencia de la privacidad,,Activas siempre > 810g,600.0,PEN,,Desconocido,unknown,PE,Centro de preferencia de la privacidad,Activas siempre,,810g,600.00,PEN,,600,600.0,False,original,169.0141,169.0141,3.55,from_peru_cambio_dolar,,,TE RECOMENDAMOS | Pan de Molde BIMBO Integral Cero Cero Bolsa 650g | 20 | BELL'S | Pan de Molde Integral BELL'S Mediano Bolsa 500g | 8 | 10 | DON MAMINO | Pan de Molde Blanco DON MAMINO Pullman Corte Horizontal Bolsa 560g | 13 | 50 | Pan de Molde Blanco BELL'S Mediano Bolsa 500g | UNIÓN | Pan de Molde Integral UNIÓN Bolsa 495g | 14 | 60 | Pan de Molde Blanco UNIÓN Fuente Bolsa 780g | No disponible | LA FLORENCIA | Pan de Molde Integral 6 Semillas LA FLORENCIA Bolsa 500g | Pan de Molde Blanco XL BIMBO Extra Gran Bolsa 770g | 80 | ¡Entérate de eventos exclusivos y promociones especiales que tenemos para ti! | SUSCRIBIRME | Acepto las políticas de tratamientos de datos personales | Razón Social: Compañía Food Retail S.A.C. RUC: 20608300393. Todos los derechos reservados Vivanda 2023. | | Hola! | Encuentra todo lo que necesitas en Vivanda online | Términos más buscados | 1. | quesos | 2. | vino | 3. | café | 4. | quark 500g | 5. | leche | 6. | pollo | 7. | yogurt | 8. | lunch florencia | 9. | agua | 10 | vinos,,,,,"{""Características"": [""TE RECOMENDAMOS"", ""Pan de Molde BIMBO Integral Cero Cero Bolsa 650g"", ""20"", ""BELL'S"", ""Pan de Molde Integral BELL'S Mediano Bolsa 500g"", ""8"", ""10"", ""DON MAMINO"", ""Pan de Molde Blanco DON MAMINO Pullman Corte Horizontal Bolsa 560g"", ""13"", ""50"", ""Pan de Molde Blanco BELL'S Mediano Bolsa 500g"", ""UNIÓN"", ""Pan de Molde Integral UNIÓN Bolsa 495g"", ""14"", ""60"", ""Pan de Molde Blanco UNIÓN Fuente Bolsa 780g"", ""No disponible"", ""LA FLORENCIA"", ""Pan de Molde Integral 6 Semillas LA FLORENCIA Bolsa 500g"", ""Pan de Molde Blanco XL BIMBO Extra Grande Bolsa 770g"", ""80"", ""¡Entérate de eventos exclusivos y promociones especiales que tenemos para ti!"", ""SUSCRIBIRME"", ""Acepto las políticas de tratamiento de datos personales"", ""Razón social: Compañía Food Retail S.A.C. RUC: 20608300393. Todos los derechos reservados Vivanda 2023."", ""¡Hola!"", ""Encuentra todo lo que necesitas en Vivanda online"", ""Términos más buscados"", ""1."", ""quesos"", ""2."", ""vino"", ""3."", ""cafe"", ""4."", ""quark 500g"", ""5."", ""leche"", ""6."", ""pollo"", ""7."", ""yogurt"", ""8."", ""lunch florencia"", ""9."", ""agua"", ""10."", ""vinos""]}",dataset/txt_limpios/1184.txt,dataset/paginas_descargadas/1184.html,ET,sin_categoria,discard,0.30,no_category_detected
1185,Centro de preferencia de la privacidad,,Activas siempre > 500g,,PEN,,Desconocido,unknown,PE,Centro de preferencia de la privacidad,Activas siempre,,500g,,PEN,,,55.14,True,country_mean,,15.5336,3.55,from_peru_cambio_dolar,,,,,,,,{},dataset/txt_limpios/1185.txt,dataset/paginas_descargadas/1185.html,EN,sin_categoria,discard,0.30,no_category_detected;price_parse_failed
1186,Centro de preferencia de la privacidad,,Activas siempre > 500g,,PEN,,Desconocido,unknown,PE,Centro de preferencia de la privacidad,Activas siempre,,500g,,PEN,,,55.14,True,country_mean,,15.5336,3.55,from_peru_cambio_dolar,,,TE RECOMENDAMOS | Pan de Molde Integral BELL'S Mediano Bolsa 500g | DON MAMINO | Pan de Molde Blanco DON MAMINO Pullman Corte Horizontal Bolsa 560g | 13 | 50 | MOLINOS DEL MUNDO | Pan de Molde MOLINOS DEL MUNDO Sin Gluten y Sin Lactosa Bolsa 480g | 19 | 90 | LA FLORENCIA | Pan de Molde LA FLORENCIA Bolsa 350g | 7 | UNIÓN | Pan de Molde Blanco UNIÓN Fuente Bolsa 780g | No disponible | Pan de Molde Blanco BELL’S Tipo Fuente Corte Vertical sin Corteza Bolsa 500g | Pan de Molde Integral Multicereal LA FLORENCIA Bolsa 500g | 20 | Pan de Molde Integral MOLINOS DEL MUNDO Sin Gluten y Sin Lactosa Bolsa 480g | 21 | BIMBO | Pan de Molde Integral BIMBO Vital Multicereal Bolsa 600g | 14 | 80 | Pan de Molde Blanco BIMBO Vital de Semillas Bolsa 600g | ¡Entérate de eventos exclusivos y promociones especiales que tenemos para ti! | SUSCRIBIRME | Acepto las políticas de tratamientos de datos personales | Razón Social: Compañía Food Retail S.A.C. RUC: 20608300393. Todos los derechos reservados Vivanda 2023. | | Hola! | Encuentra todo lo que necesitas en Vivanda online | Términos más buscados | 1. | quesos | 2. | vino | 3. | café | 4. | quark 500g | 5. | leche | 6. | pollo | 7. | yogurt | 8. | lunch florencia | 9. | agua | 10 | vinos,,,,,"{""Características"": [""TE RECOMENDAMOS"", ""Pan de Molde Integral BELL'S Mediano Bolsa 500g"", ""DON MAMINO"", ""Pan de Molde Blanco DON MAMINO Pullman Corte Horizontal Bolsa 560g"", ""13"", ""50"", ""MOLINOS DEL MUNDO"", ""Pan de Molde MOLINOS DEL MUNDO Sin Gluten y Sin Lactosa Bolsa 480g"", ""19"", ""90"", ""LA FLORENCIA"", ""Pan de Molde LA FLORENCIA Bolsa 350g"", ""7"", ""UNIÓN"", ""Pan de Molde Blanco UNIÓN Fuente Bolsa 780g"", ""No disponible"", ""Pan de Molde Blanco BELL’S Tipo Fuente Corte Vertical sin Corteza Bolsa 500g"", ""Pan de Molde Integral Multicereal LA FLORENCIA Bolsa 500g"", ""20"", ""Pan de Molde Integral MOLINOS DEL MUNDO Sin Gluten y Sin Lactosa Bolsa 480g"", ""21"", ""BIMBO"", ""Pan de Molde Integral BIMBO Vital Multicereal Bolsa 600g"", ""14"", ""80"", ""Pan de Molde Blanco BIMBO Vital de Semillas Bolsa 600g"", ""¡Entérate de eventos exclusivos y promociones especiales que tenemos para ti!"", ""SUSCRIBIRME"", ""Acepto las políticas de tratamiento de datos personales"", ""Razón social: Compañía Food Retail S.A.C. RUC: 20608300393. Todos los derechos reservados Vivanda 2023."", ""¡Hola!"", ""Encuentra todo lo que necesitas en Vivanda online"", ""Términos más buscados"", ""1."", ""quesos"", ""2."", ""vino"", ""3."", ""cafe"", ""4."", ""quark 500g"", ""5."", ""leche"", ""6."", ""pollo"", ""7."", ""yogurt"", ""8."", ""lunch florencia"", ""9."", ""agua"", ""10."", ""vinos""]}",dataset/txt_limpios/1186.txt,dataset/paginas_descargadas/1186.html,ET,sin_categoria,discard,0.30,no_category_detected;price_parse_failed
