source_id,title,description,breadcrumbs,price_raw,currency_raw,url,seller,availability,country,product_name,brand,reference,unit,price_amount,price_currency,price_symbol,price_text,price_amount_filled,price_is_imputed,price_imputation_source,price_amount_usd,price_amount_usd_filled,fx_rate_local_per_usd,fx_source,information_text,description_text,features_text,specifications_text,benefits_text,details_text,other_sections,sections,txt_path,html_path,es_status,category_canonical,decision,match_score,reasons
1697,Elige un método de entrega,Loading...,Unimarc > 300 g,1.99,,,Desconocido,unknown,UNKNOWN,Elige un método de entrega,Unimarc,,300 g,1.99,,$,$1.99,1.99,False,original,1.99,1.99,1.0,default_1usd,,Loading...,,,,,,"{""Descripción"": [""Loading...""]}",dataset/txt_limpios/1697.txt,dataset/paginas_descargadas/1697.html,EN,sin_categoria,discard,0.30,no_category_detected
1698,Elige un método de entrega,"El tomate es rico en vitaminas y minerales: esta huerta aporta vitamina C, un potente antioxidante natural, además de vitamina A, K, hierro y potasio. Loading...",Unimarc > 500 g,1.14,,,Desconocido,unknown,UNKNOWN,Elige un método de entrega,Unimarc,,500 g,1.14,,$,$1.14,1.14,False,original,1.14,1.14,1.0,default_1usd,,"El tomate es rico en vitaminas y minerales: esta huerta aporta vitamina C, un potente antioxidante natural, además de vitamina A, K, hierro y potasio. Loading...",,,,,,"{""Descripción"": [""El tomate es rico en vitaminas y minerales: esta hortalizas aporta vitamina C, un potente antioxidante natural, además de vitamina A, K, hierro y potasio."", ""Loading...""]}",dataset/txt_limpios/1698.txt,dataset/paginas_descargadas/1698.html,ET,sin_categoria,discard,0.30,no_category_detected
1699,Elige un método de entrega,Loading...,Unimarc > 250 g,1.25,,,Desconocido,unknown,UNKNOWN,Elige un método de entrega,Unimarc,,250 g,1.25,,$,$1.25,1.25,False,original,1.25,1.25,1.0,default_1usd,,Loading...,,,,,,"{""Descripción"": [""Loading...""]}",dataset/txt_limpios/1699.txt,dataset/paginas_descargadas/1699.html,EN,sin_categoria,discard,0.30,no_category_detected
1700,Elige un método de entrega,Loading...,Unimarc > 1 Kg,1.8,,,Desconocido,unknown,UNKNOWN,Elige un método de entrega,Unimarc,,1 Kg,1.80,,$,$1.80,1.8,False,original,1.8,1.8,1.0,default_1usd,,Loading...,,,,,,"{""Descripción"": [""Loading...""]}",dataset/txt_limpios/1700.txt,dataset/paginas_descargadas/1700.html,EN,sin_categoria,discard,0.30,no_category_detected
1701,Elige un método de entrega,"Los huevos Yemita son un alimento completo y nutritivo que aporta alto contenido de proteínas y vitaminas; este tipo de alimento es esencial en la alimentación humana para el crecimiento, desarrollo y buena salud.",Unimarc > 12 unidad,4.09,,,Desconocido,unknown,UNKNOWN,Elige un método de entrega,Unimarc,,12 unidad,4.09,,$,$4.09,4.09,False,original,4.09,4.09,1.0,default_1usd,,"Los huevos Yemita son un alimento completo y nutritivo que aporta alto contenido de proteínas y vitaminas; este tipo de alimento es esencial en la alimentación humana para el crecimiento, desarrollo y buena salud.",Huevos gallina - Yemita - Gallina normal - Tipo blanco - Contenido 12 unidades. | Loading...,,,,,"{""Descripción"": [""Los huevos Yemita son un alimento completo y nutritivo que aporta alto contenido de proteínas y vitaminas; este tipo de alimento es esencial en la alimentación humana para el crecimiento, desarrollo y buena salud.""], ""Características"": [""Huevos gallina - Yemita - Gallina normal - Tipo blanco - Contenido 12 unidades."", ""Loading...""]}",dataset/txt_limpios/1701.txt,dataset/paginas_descargadas/1701.html,ET,huevo,discard,0.30,heuristic_default
1702,Elige un método de entrega,Loading...,Unimarc > 12 unidad,3.89,,,Desconocido,unknown,UNKNOWN,Elige un método de entrega,Unimarc,,12 unidad,3.89,,$,$3.89,3.89,False,original,3.89,3.89,1.0,default_1usd,,Loading...,,,,,,"{""Descripción"": [""Loading...""]}",dataset/txt_limpios/1702.txt,dataset/paginas_descargadas/1702.html,EN,sin_categoria,discard,0.30,no_category_detected
1703,Elige un método de entrega,"Bebida Piri cola zero, 2 L Loading...",Unimarc > 2 L,2.0,,,Desconocido,unknown,UNKNOWN,Elige un método de entrega,Unimarc,,2 L,2.00,,,2,2.0,False,original,2.0,2.0,1.0,default_1usd,,"Bebida Piri cola zero, 2 L Loading...",,,,,,"{""Descripción"": [""Bebida Piri cola zero, 2 L"", ""Loading...""]}",dataset/txt_limpios/1703.txt,dataset/paginas_descargadas/1703.html,EN,sin_categoria,discard,0.30,no_category_detected
1705,Elige un método de entrega,Loading...,Unimarc > 20 unidad,6.59,,,Desconocido,unknown,UNKNOWN,Elige un método de entrega,Unimarc,,20 unidad,6.59,,$,$6.59,6.59,False,original,6.59,6.59,1.0,default_1usd,,Loading...,,,,,,"{""Descripción"": [""Loading...""]}",dataset/txt_limpios/1705.txt,dataset/paginas_descargadas/1705.html,EN,sin_categoria,discard,0.30,no_category_detected
1707,Elige un método de entrega,Loading...,Unimarc > 12 unidad,3.97,,,Desconocido,unknown,UNKNOWN,Elige un método de entrega,Unimarc,,12 unidad,3.97,,$,$3.97,3.97,False,original,3.97,3.97,1.0,default_1usd,,Loading...,,,,,,"{""Descripción"": [""Loading...""]}",dataset/txt_limpios/1707.txt,dataset/paginas_descargadas/1707.html,EN,sin_categoria,discard,0.30,no_category_detected
1709,Elige un método de entrega,"Los huevos la granja son de gallinas Libre de Jaula o ?Cage Free? las gallinas viven en galpones 100% libres de jaulas, donde pueden desarrollar comportamientos naturales como perchar, anidar, aletear y socializar con otras gallinas, en un ambiente seguro y protegido.",Unimarc > 12 unidad,5.19,,,Desconocido,unknown,UNKNOWN,Elige un método de entrega,Unimarc,,12 unidad,5.19,,$,$5.19,5.19,False,original,5.19,5.19,1.0,default_1usd,,"Los huevos la granja son de gallinas Libre de Jaula o ?Cage Free? las gallinas viven en galpones 100% libres de jaulas, donde pueden desarrollar comportamientos naturales como perchar, anidar, aletear y socializar con otras gallinas, en un ambiente seguro y protegido.",Huevos gallina - La Granja - Gallina normal - Tipo color - Contenido 12 unidades. | Loading...,,,,,"{""Descripción"": [""Los huevos la granja son de gallinas Libre de Jaula o ?Cage Free? las gallinas viven en galpones 100% libres de jaulas, donde pueden desarrollar comportamientos naturales como perchar, anidar, aletear y socializar con otras gallinas, en un ambiente seguro y protegido.""], ""Características"": [""Huevos gallina - La Granja - Gallina normal - Tipo color - Contenido 12 unidades."", ""Loading...""]}",dataset/txt_limpios/1709.txt,dataset/paginas_descargadas/1709.html,EN,huevo,discard,0.30,heuristic_default
1711,Elige un método de entrega,Loading...,Unimarc > 1 L,1.25,,,Desconocido,unknown,UNKNOWN,Elige un método de entrega,Unimarc,,1 L,1.25,,$,$1.25,1.25,False,original,1.25,1.25,1.0,default_1usd,,Loading...,,,,,,"{""Descripción"": [""Loading...""]}",dataset/txt_limpios/1711.txt,dataset/paginas_descargadas/1711.html,EN,sin_categoria,discard,0.30,no_category_detected
1713,Elige un método de entrega,La leche entera de larga vida Colun es elaborada a partir de pura leche natural de vacas sanas que pastan en praderas verdes de la lluviosa región de los Rios de Chile. Producto sin gluten certificado por fundación convivir. Producto certificado Kosher. Características: Leches blancas - Colun - Entera - Sin gluten - Sin sellos - Envase tetra - Formato familiar - Contenido 1 L. Loading...,Unimarc > 1 L,1.3,,,Desconocido,unknown,UNKNOWN,Elige un método de entrega,Unimarc,,1 L,1.30,,$,$1.30,1.3,False,original,1.3,1.3,1.0,default_1usd,,La leche entera de larga vida Colun es elaborada a partir de pura leche natural de vacas sanas que pastan en praderas verdes de la lluviosa región de los Rios de Chile. Producto sin gluten certificado por fundación convivir. Producto certificado Kosher. Características: Leches blancas - Colun - Entera - Sin gluten - Sin sellos - Envase tetra - Formato familiar - Contenido 1 L. Loading...,,,,,,"{""Descripción"": [""La leche entera de larga vida Colun es elaborada a partir de pura leche natural de vacas sanas que pastan en praderas verdes de la lluviosa región de los Rios de Chile. Producto sin gluten certificado por fundación convivir. Producto certificado Kosher. Características: Leches blancas - Colun - Entera - Sin gluten - Sin sellos - Envase tetra - Formato familiar - Contenido 1 L."", ""Loading...""]}",dataset/txt_limpios/1713.txt,dataset/paginas_descargadas/1713.html,ET,descartado,discard,0.10,excluded_keyword
1716,Elige un método de entrega,"La mayoría de la población adulta en el mundo en el digiere adecuadamente la lactosa de la leche, es por eso que la leche sin lactosa entera Loncoleche entrega una alternativa a las personas que tienen este problema. Producto sin gluten certificado por fundación convivir. Producto certificado Kosher. Características: Leche sin lactosa - Loncoleche - Entera - Sin lactosa - Sin sellos - Envase Caja - Formato familiar - Contenido 1 L. Loading...",Unimarc > 1 L,1.08,,,Desconocido,unknown,UNKNOWN,Elige un método de entrega,Unimarc,,1 L,1.08,,$,$1.08,1.08,False,original,1.08,1.08,1.0,default_1usd,,"La mayoría de la población adulta en el mundo en el digiere adecuadamente la lactosa de la leche, es por eso que la leche sin lactosa entera Loncoleche entrega una alternativa a las personas que tienen este problema. Producto sin gluten certificado por fundación convivir. Producto certificado Kosher. Características: Leche sin lactosa - Loncoleche - Entera - Sin lactosa - Sin sellos - Envase Caja - Formato familiar - Contenido 1 L. Loading...",,,,,,"{""Descripción"": [""La mayoría de la población adulta en el mundo en el digiere adecuadamente la lactosa de la leche, es por eso que la leche sin lactosa entera Loncoleche entrega una alternativa a las personas que tienen este problema. Producto sin gluten certificado por fundación convivir. Producto certificado Kosher. Características: Leche sin lactosa - Loncoleche - Entera - Sin lactosa - Sin sellos - Envase Caja - Formato familiar - Contenido 1 L."", ""Loading...""]}",dataset/txt_limpios/1716.txt,dataset/paginas_descargadas/1716.html,ET,descartado,discard,0.10,excluded_keyword
1718,Elige un método de entrega,"Esta manzana de color rojo (del rojo más claro al más oscuro) es una de las más populares. SABOR Dulce, con un equilibrado aroma y con baja acidez. TEXTURA Pequeña, firme y crujiente... ¡Simplemente deliciosa! Loading...",Unimarc > 500 g,1.29,,,Desconocido,unknown,UNKNOWN,Elige un método de entrega,Unimarc,,500 g,1.29,,$,$1.29,1.29,False,original,1.29,1.29,1.0,default_1usd,,"Esta manzana de color rojo (del rojo más claro al más oscuro) es una de las más populares. SABOR Dulce, con un equilibrado aroma y con baja acidez. TEXTURA Pequeña, firme y crujiente... ¡Simplemente deliciosa! Loading...",,,,,,"{""Descripción"": [""Esta manzana de color rojo (del rojo más claro al más oscuro) es una de las más populares. SABOR Dulce, con un equilibrado aroma y con baja acidez. TEXTURA Pequeña, firme y crujiente... ¡Simplemente deliciosa!"", ""Loading...""]}",dataset/txt_limpios/1718.txt,dataset/paginas_descargadas/1718.html,EN,sin_categoria,discard,0.30,no_category_detected
1720,Elige un método de entrega,Semola de trigos duros seleccionados. Características: Largos - Carozzi - Envase bolsa - Formato familiar - Contenido 400 g. Loading...,Unimarc > 400 g,690.0,,,Desconocido,unknown,UNKNOWN,Elige un método de entrega,Unimarc,,400 g,690.00,,$,$690,690.0,False,original,690.0,690.0,1.0,default_1usd,,Semola de trigos duros seleccionados. Características: Largos - Carozzi - Envase bolsa - Formato familiar - Contenido 400 g. Loading...,,,,,,"{""Descripción"": [""Semola de trigos duros seleccionados. Características: Largos - Carozzi - Envase bolsa - Formato familiar - Contenido 400 g."", ""Loading...""]}",dataset/txt_limpios/1720.txt,dataset/paginas_descargadas/1720.html,EN,sin_categoria,discard,0.30,no_category_detected
1723,Elige un método de entrega,"Todas las carpetas talliani están hechas de huevos frescos evocando la alta gastronomía italiana. Esto se traduce en una carpeta con una textura inconfundible y ligeramente rugosa, con lo que se adhiere mejor la salsa de tomates. Producto certificado Kosher. Características: Largos - Talliani - Envase bolsa - Formato familiar - Contenido 400 g. Loading...",Unimarc > 400 g,1.33,,,Desconocido,unknown,UNKNOWN,Elige un método de entrega,Unimarc,,400 g,1.33,,$,$1.33,1.33,False,original,1.33,1.33,1.0,default_1usd,,"Todas las carpetas talliani están hechas de huevos frescos evocando la alta gastronomía italiana. Esto se traduce en una carpeta con una textura inconfundible y ligeramente rugosa, con lo que se adhiere mejor la salsa de tomates. Producto certificado Kosher. Características: Largos - Talliani - Envase bolsa - Formato familiar - Contenido 400 g. Loading...",,,,,,"{""Descripción"": [""Todas las carpetas talliani están hechas de huevos frescos evocando la alta gastronomía italiana. Esto se traduce en una carpeta con una textura inconfundible y ligeramente rugosa, con lo que se adhiere mejor la salsa de tomates. Producto certificado Kosher. Características: Largos - Talliani - Envase bolsa - Formato familiar - Contenido 400 g."", ""Loading...""]}",dataset/txt_limpios/1723.txt,dataset/paginas_descargadas/1723.html,ET,huevo,discard,0.30,heuristic_default
1725,Elige un método de entrega,"Carpeta libre de colesterol, con bajo aporte en grasas y buena fuente de proteína. Rinde 5 porciones. Características: Largos - Lucchetti - Envase bolsa - Formato familiar - Contenido 400 g. Loading...",Unimarc > 400 g,2.0,,,Desconocido,unknown,UNKNOWN,Elige un método de entrega,Unimarc,,400 g,2.00,,,2,2.0,False,original,2.0,2.0,1.0,default_1usd,,"Carpeta libre de colesterol, con bajo aporte en grasas y buena fuente de proteína. Rinde 5 porciones. Características: Largos - Lucchetti - Envase bolsa - Formato familiar - Contenido 400 g. Loading...",,,,,,"{""Descripción"": [""Carpeta libre de colesterol, con bajo aporte en grasas y buena fuente de proteína. Rinde 5 porciones. Características: Largos - Lucchetti - Envase bolsa - Formato familiar - Contenido 400 g."", ""Loading...""]}",dataset/txt_limpios/1725.txt,dataset/paginas_descargadas/1725.html,ET,sin_categoria,discard,0.30,no_category_detected
1727,Elige un método de entrega,"Pollo Entero con menudencia Ariztía. Los precios de los productos son por kilo y el peso indicado es aproximado, por lo que en su boleta se cobrará el peso y valor exacto. Producto sin gluten certificado por fundación convivir. Loading...",Unimarc > 2.5 Kg,9.97,,,Desconocido,unknown,UNKNOWN,Elige un método de entrega,Unimarc,,2.5 Kg,9.97,,$,$9.97,9.97,False,original,9.97,9.97,1.0,default_1usd,,"Pollo Entero con menudencia Ariztía. Los precios de los productos son por kilo y el peso indicado es aproximado, por lo que en su boleta se cobrará el peso y valor exacto. Producto sin gluten certificado por fundación convivir. Loading...",,,,,,"{""Descripción"": [""Pollo Entero con menudencia Ariztía. Los precios de los productos son por kilo y el peso indicado es aproximado, por lo que en su boleta se cobrará el peso y valor exacto. Producto sin gluten certificado por fundación convivir."", ""Loading...""]}",dataset/txt_limpios/1727.txt,dataset/paginas_descargadas/1727.html,EN,descartado,discard,0.10,excluded_keyword
1729,Elige un método de entrega,Loading...,Unimarc > 3 Kg,11.97,,,Desconocido,unknown,UNKNOWN,Elige un método de entrega,Unimarc,,3 Kg,11.97,,$,$11.97,11.97,False,original,11.97,11.97,1.0,default_1usd,,Loading...,,,,,,"{""Descripción"": [""Loading...""]}",dataset/txt_limpios/1729.txt,dataset/paginas_descargadas/1729.html,EN,sin_categoria,discard,0.30,no_category_detected
1731,Elige un método de entrega,"Pasta spaghetti N°5 Merkat, 400 g Loading...",Unimarc > 400 g,490.0,,,Desconocido,unknown,UNKNOWN,Elige un método de entrega,Unimarc,,400 g,490.00,,$,$490,490.0,False,original,490.0,490.0,1.0,default_1usd,,"Pasta spaghetti N°5 Merkat, 400 g Loading...",,,,,,"{""Descripción"": [""Pasta spaghetti N°5 Merkat, 400 g"", ""Loading...""]}",dataset/txt_limpios/1731.txt,dataset/paginas_descargadas/1731.html,EN,sin_categoria,discard,0.30,no_category_detected
807,ENDULZANTE CON STEVIA NATRI 180 G,"Ingredientes | Componentes Nombre del producto: Endulzante con Stevia Natri 180g Descripción del producto: Disfruta del Endulzante con Stevia Natri, un endulzante en polvo base maltodextrina con stevia. Tamaño: 10cm x 7cm Peso: 180 g Modo de fabricación: Industrial Conservación: Después de abierto, consumir en el menor tiempo posible. Mantener en un lugar fresco y seco. Origen: Nacional NSA-0014022-2023 Alergenos: Este producto es elaborado en una planta que procesa derivados de leche y soya. Componentes: Maltodextrina Harina de arroz Edulcorante natural (Extracto de stevia) Anticompactante (Dióxido de silicio) Ver más Tratamiento de Datos Garantías Términos y condiciones Superintendencia de Industria y Comercio – SIC 0.17.168-hotfix-2.",Unidades disponibles > 180 G,180.0,,,Desconocido,unknown,UNKNOWN,ENDULZANTE CON STEVIA NATRI 180 G,Unidades disponibles,,180 G,180.00,,,180,180.0,False,original,180.0,180.0,1.0,default_1usd,,"Ingredientes | Componentes Nombre del producto: Endulzante con Stevia Natri 180g Descripción del producto: Disfruta del Endulzante con Stevia Natri, un endulzante en polvo base maltodextrina con stevia. Tamaño: 10cm x 7cm Peso: 180 g Modo de fabricación: Industrial Conservación: Después de abierto, consumir en el menor tiempo posible. Mantener en un lugar fresco y seco. Origen: Nacional NSA-0014022-2023 Alergenos: Este producto es elaborado en una planta que procesa derivados de leche y soya. Componentes: Maltodextrina Harina de arroz Edulcorante natural (Extracto de stevia) Anticompactante (Dióxido de silicio) Ver más Tratamiento de Datos Garantías Términos y condiciones Superintendencia de Industria y Comercio – SIC 0.17.168-hotfix-2.",,,,,,"{""Descripción"": [""Ingredientes | Componentes"", ""Nombre del producto: Endulzante con Stevia Natri 180g"", ""Descripción del producto: Disfruta del Endulzante con Stevia Natri, un endulzante en polvo base maltodextrina con stevia."", ""Tamaño: 10cm x 7cm"", ""Peso: 180 g"", ""Modo de fabricación: Industrial"", ""Conservación: Después de abierto, consumir en el menor tiempo posible. Mantener en un lugar fresco y seco."", ""Origen: Nacional"", ""NSA-0014022-2023"", ""Alergenos: Este producto es elaborado en una planta que procesa derivados de leche y soya."", ""Componentes: Maltodextrina"", ""Harina de arroz"", ""Edulcorante natural (Extracto de stevia)"", ""Anticompactante (Dióxido de silicio)"", ""Ver más"", ""Tratamiento de Datos"", ""Garantías"", ""Términos y condiciones"", ""Superintendencia de Industria y Comercio – SIC"", ""0.17.168-hotfix-2.""]}",dataset/txt_limpios/807.txt,dataset/paginas_descargadas/807.html,EN,descartado,discard,0.10,excluded_keyword
1514,Error 404: Página en la encontrada.,,Suscribirme,,,,Desconocido,unknown,UNKNOWN,Error 404: Página en la encontrada.,Suscribirme,,,,,,,234.19,True,country_mean,,234.1938,1.0,default_1usd,,,,,,,,{},dataset/txt_limpios/1514.txt,dataset/paginas_descargadas/1514.html,ET,sin_categoria,discard,0.30,no_category_detected;price_parse_failed
1559,Error 404: Página en la encontrada.,,Suscribirme,,,,Desconocido,unknown,UNKNOWN,Error 404: Página en la encontrada.,Suscribirme,,,,,,,234.19,True,country_mean,,234.1938,1.0,default_1usd,,,,,,,,{},dataset/txt_limpios/1559.txt,dataset/paginas_descargadas/1559.html,ET,sin_categoria,discard,0.30,no_category_detected;price_parse_failed
1289,"Este gato no debería estar en esta caja, ni tú en esta página",,Live Chat,,,,Desconocido,unknown,UNKNOWN,"Este gato no debería estar en esta caja, ni tú en esta página",Live Chat,,,,,,,234.19,True,country_mean,,234.1938,1.0,default_1usd,,,,,,,,{},dataset/txt_limpios/1289.txt,dataset/paginas_descargadas/1289.html,EN,sin_categoria,discard,0.30,no_category_detected;price_parse_failed
1297,"Este gato no debería estar en esta caja, ni tú en esta página",,Live Chat,,,,Desconocido,unknown,UNKNOWN,"Este gato no debería estar en esta caja, ni tú en esta página",Live Chat,,,,,,,234.19,True,country_mean,,234.1938,1.0,default_1usd,,,,,,,,{},dataset/txt_limpios/1297.txt,dataset/paginas_descargadas/1297.html,EN,sin_categoria,discard,0.30,no_category_detected;price_parse_failed
