{"source_id": "1040", "title": "colaborar con nuestros estudios para marketing. También puede configurarlas.", "description": "Información de la marca", "breadcrumbs": "que podemos ofrecer. > 540g", "price_raw": "16.92", "currency_raw": "PEN", "url": "", "seller": "Desconocido", "availability": "unknown", "country": "PE", "product_name": "colaborar con nuestros estudios para marketing. También puede configurarlas.", "brand": "que podemos ofrecer.", "reference": "", "unit": "540g", "price_amount": 16.92, "price_currency": "PEN", "price_symbol": "S/", "price_text": "S/16.92", "price_amount_filled": "16.92", "price_is_imputed": "False", "price_imputation_source": "original", "price_amount_usd": "4.7662", "price_amount_usd_filled": "4.7662", "fx_rate_local_per_usd": "3.55", "fx_source": "from_peru_cambio_dolar", "information_text": "", "description_text": "Información de la marca", "features_text": "Presentación/Empaque | Bolsa | Porción sugerida | No especifica | Alérgenos Declarados | Contiene gluten y leche | Azúcares Porción | 1. 96gr | Calorías Por Porción | 144. 54kcal | Carbohidratos Porción | 23.42gr | Descripción Nutricional | No | Grasas Porción | 4. 03gr | Proteínas Porción | 4.28gr | Sodio Porción | 229. 37mg | Composición | Harina de trigo fortificada, azucar, salvado de trigo, sal , levadura | Advertencias De Almacenamiento | Mantener en lugar fresco, seco, libre de olores extraños y limpio. Evite la exposición directa a la luz del sol y el calor | Contenido Neto | 540gr | Denominación/Variedad | Revisa todo | Importante destacar | Pan empacado | Ideal para los desayunos y sándwiches | Conservar en lugar fresco y seco | Descripción del producto | PAN DE LA CASA Y PAN ENVASADO | -Disfruta de los mejores insumos de | en la página online de plaza ¡Mira! Ingresando la sección de | Panadería, Pastelería y Comidas | podrás elegir entre una variedad de deliciosos productos, todos elaborados por expertos en la cocina. | Ingresa la web de | plaza Vea | y déjate atrapar por todo nuestro sordo de | y | Pan de la Casa | , ideales para esos momentos especiales en familia, celebraciones, simplemente darte un gustito al día. Tenemos presentaciones de | pan a granel | , | bollería fina | pan pita y árabe | , además de pan relleno tanto dulce como salado para brindarte una mayor diversidad de opciones. | ¿Conoce la mejor variedad de Pan Envasado y Pan de la Casa en plazaVea Online? | ¿En qué búsqueda? Encuentra más | Pan Envasado y Pan de la casa | en plaza Vea | Componentes del Producto | Vendido por | En caso de que algo te guste: Puedes revisar nuestras | Políticas de cambios y/o devoluciones | y hacerlas efectivas en todas nuestras tiendas. | Productos | que te pueden interesar | Recomendado para ti", "specifications_text": "", "benefits_text": "", "details_text": "", "other_sections": "", "sections": {"Descripción": ["Información de la marca"], "Características": ["Presentación/Empaque", "Bolsa", "Porción sugerida", "No especifica", "Alérgenos Declarados", "Contiene gluten y leche", "Azúcar por porción", "1. 96gr", "Calorías Porción", "144. 54kcal", "Carbohidratos Porción", "23. 42gr", "Descripción Nutricional", "No", "Grasas Porción", "4. 03gr", "Proteínas Porción", "4. 28gr", "Sodio Porción", "229. 37mg", "Composición", "Harina de trigo fortificada, azucar, salvado de trigo, sal , levadura", "Advertencias De Almacenamiento", "Mantener en lugar fresco, seco, libre de olores extraños y limpio. Evite la exposición directa a la luz del sol y el calor", "Contenido Neto", "540gr", "Denominación/Variedad", "Revisa todo", "Importante destacar", "Pan empacado", "Ideal para los desayunos y sándwiches", "Conservar en lugar fresco y seco", "Descripción del producto", "PAN DE LA CASA Y PAN ENVASADO", "¡Disfruta de los mejores insumos de", "en la página online de plaza ¡Mira! Ingresando la sección de", "Panadería, Pastelería y Comidas", "podrás elegir entre una variedad de deliciosos productos, todos elaborados por expertos en la cocina.", "Ingresa a la web de", "plazaVea", "y déjate atrapar por todo nuestro sordo", "y", "Pan de la Casa", ", ideales para esos momentos especiales en familia, celebraciones, el simplemente darte un gustito al día. Tenemos presentaciones", "pan a granel", ",", "bollería fina", "pan pita y árabe", ", además de pan relleno tanto dulce como salado para brindarte una mayor diversidad de opciones.", "¡Conoce la mejor variedad de Pan Envasado y Pan de la Casa en plazaVea Online!", "¿En qué búsqueda? Encuentra más", "Pan Envasado y Pan de la casa", "en plazaVea", "Componentes del Producto", "Vendido por", "En caso algo no vaya como gustes: Puedes revisar nuestras", "Politicas de cambios y/o devoluciones", "y hacerlas efectivas en todas nuestras tiendas.", "Productos", "que te pueden interesar", "Recomendado para ti"]}, "txt_path": "dataset/txt_limpios/1040.txt", "html_path": "dataset/paginas_descargadas/1040.html", "es_status": "ET", "category_canonical": "sin_categoria", "decision": "discard", "match_score": 0.3, "reasons": "no_category_detected"}
{"source_id": "1041", "title": "colaborar con nuestros estudios para marketing. También puede configurarlas.", "description": "Información de la marca", "breadcrumbs": "que podemos ofrecer. > 560g", "price_raw": "16.92", "currency_raw": "PEN", "url": "", "seller": "Desconocido", "availability": "unknown", "country": "PE", "product_name": "colaborar con nuestros estudios para marketing. También puede configurarlas.", "brand": "que podemos ofrecer.", "reference": "", "unit": "560g", "price_amount": 16.92, "price_currency": "PEN", "price_symbol": "S/", "price_text": "S/16.92", "price_amount_filled": "16.92", "price_is_imputed": "False", "price_imputation_source": "original", "price_amount_usd": "4.7662", "price_amount_usd_filled": "4.7662", "fx_rate_local_per_usd": "3.55", "fx_source": "from_peru_cambio_dolar", "information_text": "", "description_text": "Información de la marca", "features_text": "Importante destacar | Pan empacado | Ideal para los desayunos y sándwiches | Conservar en lugar fresco y seco | Descripción del producto | PAN DE LA CASA Y PAN ENVASADO | Disfruta de los mejores insumos de | en la página online de plaza ¡Mira! Ingresando la sección de | Panadería, Pastelería y Comidas | podrás elegir entre una variedad de deliciosos productos, todos elaborados por expertos en la cocina. | Ingresa la web de | plaza Vea | y déjate atrapar por todo nuestro sordo de | y | Pan de la Casa | , ideales para esos momentos especiales en familia, celebraciones, simplemente darte un gustito al día. Tenemos presentaciones de | pan a granel | , | bollería fina | pan pita y árabe | , además de pan relleno tanto dulce como salado para brindarte una mayor diversidad de opciones. | ¿Conoce la mejor variedad de Pan Envasado y Pan de la Casa en plazaVea Online? | ¿En qué búsqueda? Encuentra más | Pan Envasado y Pan de la casa | en plaza Vea | Revisa todo | Componentes del Producto | Vendido por | En caso de que algo te guste: Puedes revisar nuestras | Políticas de cambios y/o devoluciones | y hacerlas efectivas en todas nuestras tiendas. | Productos | que te pueden interesar | Recomendado para ti", "specifications_text": "", "benefits_text": "", "details_text": "", "other_sections": "", "sections": {"Descripción": ["Información de la marca"], "Características": ["Importante destacar", "Pan empacado", "Ideal para los desayunos y sándwiches", "Conservar en lugar fresco y seco", "Descripción del producto", "PAN DE LA CASA Y PAN ENVASADO", "¡Disfruta de los mejores insumos de", "en la página online de plaza ¡Mira! Ingresando la sección de", "Panadería, Pastelería y Comidas", "podrás elegir entre una variedad de deliciosos productos, todos elaborados por expertos en la cocina.", "Ingresa a la web de", "plazaVea", "y déjate atrapar por todo nuestro sordo", "y", "Pan de la Casa", ", ideales para esos momentos especiales en familia, celebraciones, el simplemente darte un gustito al día. Tenemos presentaciones", "pan a granel", ",", "bollería fina", "pan pita y árabe", ", además de pan relleno tanto dulce como salado para brindarte una mayor diversidad de opciones.", "¡Conoce la mejor variedad de Pan Envasado y Pan de la Casa en plazaVea Online!", "¿En qué búsqueda? Encuentra más", "Pan Envasado y Pan de la casa", "en plazaVea", "Revisa todo", "Componentes del Producto", "Vendido por", "En caso algo no vaya como gustes: Puedes revisar nuestras", "Politicas de cambios y/o devoluciones", "y hacerlas efectivas en todas nuestras tiendas.", "Productos", "que te pueden interesar", "Recomendado para ti"]}, "txt_path": "dataset/txt_limpios/1041.txt", "html_path": "dataset/paginas_descargadas/1041.html", "es_status": "ET", "category_canonical": "sin_categoria", "decision": "discard", "match_score": 0.3, "reasons": "no_category_detected"}
{"source_id": "1042", "title": "colaborar con nuestros estudios para marketing. También puede configurarlas.", "description": "Descripción del producto Importante destacar Pan empacado Ideal para los desayunos y sándwiches Conservar en lugar fresco y seco PAN DE LA CASA Y PAN ENVASADO ¡Disfruta de los mejores insumos de la página online de plaza! ¡Mira! Ingresando la sección de Panadería, Pastelería y Comidas podrás elegir entre una variedad de deliciosos productos, todos elaborados por expertos en la cocina. Ingresa la web de y déjate atrapar por todo nuestro surtido de y Pan de la Casa , ideales para esos momentos especiales en familia, celebraciones, simplemente darte un gustito al día. Tenemos presentaciones de pan a granel, bollería fina pan pita y árabe, además de pan relleno tanto dulce como salado para brindarte una mayor diversidad de opciones. ¡Conoce la mejor variedad de Pan Envasado y Pan de la Casa en plazaVea Online! ¿En qué búsqueda? Encuentra más Pan Envasado y Pan de la casa en plazaVea En caso de que algo te guste: Puedes revisar nuestras Políticas de cambios y/o devoluciones y hacerlas efectivas en todas nuestras tiendas. Productos que te pueden interesar Recomendado para ti", "breadcrumbs": "que podemos ofrecer. > 600g", "price_raw": "16.92", "currency_raw": "PEN", "url": "", "seller": "Desconocido", "availability": "unknown", "country": "PE", "product_name": "colaborar con nuestros estudios para marketing. También puede configurarlas.", "brand": "que podemos ofrecer.", "reference": "", "unit": "600g", "price_amount": 16.92, "price_currency": "PEN", "price_symbol": "S/", "price_text": "S/16.92", "price_amount_filled": "16.92", "price_is_imputed": "False", "price_imputation_source": "original", "price_amount_usd": "4.7662", "price_amount_usd_filled": "4.7662", "fx_rate_local_per_usd": "3.55", "fx_source": "from_peru_cambio_dolar", "information_text": "", "description_text": "Descripción del producto Importante destacar Pan empacado Ideal para los desayunos y sándwiches Conservar en lugar fresco y seco PAN DE LA CASA Y PAN ENVASADO ¡Disfruta de los mejores insumos de la página online de plaza! ¡Mira! Ingresando la sección de Panadería, Pastelería y Comidas podrás elegir entre una variedad de deliciosos productos, todos elaborados por expertos en la cocina. Ingresa la web de y déjate atrapar por todo nuestro surtido de y Pan de la Casa , ideales para esos momentos especiales en familia, celebraciones, simplemente darte un gustito al día. Tenemos presentaciones de pan a granel, bollería fina pan pita y árabe, además de pan relleno tanto dulce como salado para brindarte una mayor diversidad de opciones. ¡Conoce la mejor variedad de Pan Envasado y Pan de la Casa en plazaVea Online! ¿En qué búsqueda? Encuentra más Pan Envasado y Pan de la casa en plazaVea En caso de que algo te guste: Puedes revisar nuestras Políticas de cambios y/o devoluciones y hacerlas efectivas en todas nuestras tiendas. Productos que te pueden interesar Recomendado para ti", "features_text": "", "specifications_text": "", "benefits_text": "", "details_text": "", "other_sections": "", "sections": {"Descripción": ["Descripción del producto", "Importante destacar", "Pan empacado", "Ideal para los desayunos y sándwiches", "Conservar en lugar fresco y seco", "PAN DE LA CASA Y PAN ENVASADO", "¡Disfruta de los mejores insumos de", "en la página online de plaza ¡Mira! Ingresando la sección de", "Panadería, Pastelería y Comidas", "podrás elegir entre una variedad de deliciosos productos, todos elaborados por expertos en la cocina.", "Ingresa a la web de", "y déjate atrapar por todo nuestro sordo", "y", "Pan de la Casa", ", ideales para esos momentos especiales en familia, celebraciones, el simplemente darte un gustito al día. Tenemos presentaciones", "pan a granel", ",", "bollería fina", "pan pita y árabe", ", además de pan relleno tanto dulce como salado para brindarte una mayor diversidad de opciones.", "¡Conoce la mejor variedad de Pan Envasado y Pan de la Casa en plazaVea Online!", "¿En qué búsqueda? Encuentra más", "Pan Envasado y Pan de la casa", "en plazaVea", "En caso algo no vaya como gustes: Puedes revisar nuestras", "Politicas de cambios y/o devoluciones", "y hacerlas efectivas en todas nuestras tiendas.", "Productos", "que te pueden interesar", "Recomendado para ti"]}, "txt_path": "dataset/txt_limpios/1042.txt", "html_path": "dataset/paginas_descargadas/1042.html", "es_status": "ET", "category_canonical": "pan", "decision": "keep", "match_score": 0.6, "reasons": "heuristic_default"}
{"source_id": "1043", "title": "colaborar con nuestros estudios para marketing. También puede configurarlas.", "description": "Información de la marca", "breadcrumbs": "que podemos ofrecer. > 950g", "price_raw": "16.92", "currency_raw": "PEN", "url": "", "seller": "Desconocido", "availability": "unknown", "country": "PE", "product_name": "colaborar con nuestros estudios para marketing. También puede configurarlas.", "brand": "que podemos ofrecer.", "reference": "", "unit": "950g", "price_amount": 16.92, "price_currency": "PEN", "price_symbol": "S/", "price_text": "S/16.92", "price_amount_filled": "16.92", "price_is_imputed": "False", "price_imputation_source": "original", "price_amount_usd": "4.7662", "price_amount_usd_filled": "4.7662", "fx_rate_local_per_usd": "3.55", "fx_source": "from_peru_cambio_dolar", "information_text": "", "description_text": "Información de la marca", "features_text": "Presentación/Empaque | Bolsa | Producto Preparado | No | Relleno | 0 | Porción sugerida | 80g | Alérgenos Declarados | Gluten | Azúcares Porción | 3g | Calorías Porción | 280 | Carbohidratos Porción | 59g | Descripción Nutricional | Semola de trigo fortificada | Grasas Porción | 1.6g | Proteínas Porción | 11g | Sodio Porción | 4mg | Peso Neto (g) | Advertencias De Almacenamiento | Conservar en un ambiente frescos, limpio, seco y libre de contamicación. Referencia menor a 20 grados y 65%HR | Advertencias de consumo | Contiene gluten, puede contener trazas de huevo | Revisa todo | Componentes del Producto | Vendido por | plaza Vea | En caso de que algo te guste: Puedes revisar nuestras | Políticas de cambios y/o devoluciones | y hacerlas efectivas en todas nuestras tiendas. | Productos | que te pueden interesar | Recomendado para ti", "specifications_text": "", "benefits_text": "", "details_text": "", "other_sections": "", "sections": {"Descripción": ["Información de la marca"], "Características": ["Presentación/Empaque", "Bolsa", "Producto Preparado", "No", "Relleno", "0", "Porción sugerida", "80g", "Alérgenos Declarados", "Gluten", "Azúcar por porción", "3g", "Calorías Porción", "280", "Carbohidratos Porción", "59g", "Descripción Nutricional", "Semola de trigo fortificada", "Grasas Porción", "1.6g", "Proteínas Porción", "11g", "Sodio Porción", "4mg", "Peso Neto (g)", "Advertencias De Almacenamiento", "Conservar en un ambiente frescos, limpio, seco y libre de contamicacion. Referencia menor a 20 grados y 65%HR", "Advertencias de consumo", "Contiene gluten, puede contener trazas de huevo", "Revisa todo", "Componentes del Producto", "Vendido por", "plazaVea", "En caso algo no vaya como gustes: Puedes revisar nuestras", "Politicas de cambios y/o devoluciones", "y hacerlas efectivas en todas nuestras tiendas.", "Productos", "que te pueden interesar", "Recomendado para ti"]}, "txt_path": "dataset/txt_limpios/1043.txt", "html_path": "dataset/paginas_descargadas/1043.html", "es_status": "ET", "category_canonical": "sin_categoria", "decision": "discard", "match_score": 0.3, "reasons": "no_category_detected"}
{"source_id": "1044", "title": "colaborar con nuestros estudios para marketing. También puede configurarlas.", "description": "Información de la marca", "breadcrumbs": "que podemos ofrecer. > 250g", "price_raw": "16.92", "currency_raw": "PEN", "url": "", "seller": "Desconocido", "availability": "unknown", "country": "PE", "product_name": "colaborar con nuestros estudios para marketing. También puede configurarlas.", "brand": "que podemos ofrecer.", "reference": "", "unit": "250g", "price_amount": 16.92, "price_currency": "PEN", "price_symbol": "S/", "price_text": "S/16.92", "price_amount_filled": "16.92", "price_is_imputed": "False", "price_imputation_source": "original", "price_amount_usd": "4.7662", "price_amount_usd_filled": "4.7662", "fx_rate_local_per_usd": "3.55", "fx_source": "from_peru_cambio_dolar", "information_text": "", "description_text": "Información de la marca", "features_text": "Importante destacar | Paquete de fideos | Conservar en lugar fresco y seco | Marca: LAVAGGI | Descripción del producto | FIDEOS Y PASTAS | plaza Vea | cuenta con una amplia variedad de | para que puedas elegir el que más se adecua a tus necesidades. | Dentro de los | encontramos | Jamón | y | Quesos | la combinación de ambos será un deleite en tu paladar. | Vino Tinto | .Por otro lado, si la salsa incluye albahaca, aceptada de oliva y queso parmesano , un | Vino Blanco | con elevada acidez y aromas de flores el frutas puede aportar un buen equilibrio de sabores. | - Conoce las distintas opciones en | en plazaVea Online! | *La imagen solo es referencial | ¿En qué búsqueda? Encuentra más | en plaza Vea | Revisa todo | Componentes del Producto | Vendido por | En caso de que algo te guste: Puedes revisar nuestras | Políticas de cambios y/o devoluciones | y hacerlas efectivas en todas nuestras tiendas. | Productos | que te pueden interesar | Recomendado para ti", "specifications_text": "", "benefits_text": "", "details_text": "", "other_sections": "", "sections": {"Descripción": ["Información de la marca"], "Características": ["Importante destacar", "Paquete de fideos", "Conservar en lugar fresco y seco", "Marca: LAVAGGI", "Descripción del producto", "FIDEOS Y PASTAS", "plazaVea", "cuenta con una amplia variedad de", "para que puedas elegir qué más se adecua a tus necesidades.", "Dentro de los", "encontramos", "Jamón", "y", "Quesos", "la combinación de ambos será un deleite en tu paladar.", "Vino Tinto", ".Por otro lado, si la salsa incluye albahaca, aceite de oliva y queso parmesano , un", "Vino Blanco", "con elevada acidez y aromas de flores, las frutas pueden aportar un buen equilibrio de sabores.", "¡Conoce las distintas opciones en", "en plazaVea Online!", "*La imagen solo es referencial", "¿En qué búsqueda? Encuentra más", "en plazaVea", "Revisa todo", "Componentes del Producto", "Vendido por", "En caso algo no vaya como gustes: Puedes revisar nuestras", "Politicas de cambios y/o devoluciones", "y hacerlas efectivas en todas nuestras tiendas.", "Productos", "que te pueden interesar", "Recomendado para ti"]}, "txt_path": "dataset/txt_limpios/1044.txt", "html_path": "dataset/paginas_descargadas/1044.html", "es_status": "ET", "category_canonical": "sin_categoria", "decision": "discard", "match_score": 0.3, "reasons": "no_category_detected"}
