source_id,title,description,breadcrumbs,price_raw,currency_raw,url,seller,availability,country,product_name,brand,reference,unit,price_amount,price_currency,price_symbol,price_text,price_amount_filled,price_is_imputed,price_imputation_source,price_amount_usd,price_amount_usd_filled,fx_rate_local_per_usd,fx_source,information_text,description_text,features_text,specifications_text,benefits_text,details_text,other_sections,sections,txt_path,html_path,es_status,category_canonical,decision,match_score,reasons
1309,Valoramos tu privacidad,"incap_ses_* sesión opt_out gdpr Caducada _GRECAPTCHA 6 meses Un CAPTCHA te ayuda a protegerte del spam y del descifrado de contraseñas pidiéndote que completes una simple prueba que demuestre que eres humano y no un ordenador que intenta acceder a una cuenta protegida con contraseña. __cf_bm 1 hora rc::a Nunca caduca rc::c rc::f rc::b Funcionales SnapABugRef 2 horas SnapABugHistory SnapABugUserAlias SnapABugVisit Analíticas ___utmvc Menos de un minuto _gcl_au 3 meses _ga 1 año 1 mes 4 días _gid 1 día _gat_UA-* 1 minuto _ga_* uid 1 año 24 días _hjSessionUser_* _hjSession_* _fbp demdex _hjTLDTest Rendimiento Anuncio 15 minutos personalization_id muc_ads cto_bundle IDE uuid2 anj CMID CMPS CMPRO dpm mv_tokens 14 días 1 minuto cf Used to present the visitor with relevant content advertisement. cip Presents the user with relevant content and advertisements, and facilitates real-time bidding for advertisers. cnac car callback criteo_write_test YSC VISITOR_INFO1_LIVE VISITOR_PRIVACY_METADATA _ttp ab Nezaradené do kategórie ck_flagpv Description is currently not available. visitor-id No description available. data-c-ts 1 mes data-c mv_tokens_eu-v1 am_tokens am_tokens_eu-v1 criteo tvid tv_UICR optout cto_tld_test XANDR_PANID gpp ttcsid_CU8M57RC77U66G5CN100 ttcsid __Secure-ROLLOUT_TOKEN Guardar mis preferencias Powered by Este gato no debería estar en esta caja, ni tú en esta página Puede que haya expirado. Intenta la búsqueda con otras palabras o tal vez puedas encontrarla desde el homepage. Live Chat",Personalizar,,,,Desconocido,unknown,UNKNOWN,Valoramos tu privacidad,Personalizar,,,,,,,234.19,True,country_mean,,234.1938,1.0,default_1usd,,"incap_ses_* sesión opt_out gdpr Caducada _GRECAPTCHA 6 meses Un CAPTCHA te ayuda a protegerte del spam y del descifrado de contraseñas pidiéndote que completes una simple prueba que demuestre que eres humano y no un ordenador que intenta acceder a una cuenta protegida con contraseña. __cf_bm 1 hora rc::a Nunca caduca rc::c rc::f rc::b Funcionales SnapABugRef 2 horas SnapABugHistory SnapABugUserAlias SnapABugVisit Analíticas ___utmvc Menos de un minuto _gcl_au 3 meses _ga 1 año 1 mes 4 días _gid 1 día _gat_UA-* 1 minuto _ga_* uid 1 año 24 días _hjSessionUser_* _hjSession_* _fbp demdex _hjTLDTest Rendimiento Anuncio 15 minutos personalization_id muc_ads cto_bundle IDE uuid2 anj CMID CMPS CMPRO dpm mv_tokens 14 días 1 minuto cf Used to present the visitor with relevant content advertisement. cip Presents the user with relevant content and advertisements, and facilitates real-time bidding for advertisers. cnac car callback criteo_write_test YSC VISITOR_INFO1_LIVE VISITOR_PRIVACY_METADATA _ttp ab Nezaradené do kategórie ck_flagpv Description is currently not available. visitor-id No description available. data-c-ts 1 mes data-c mv_tokens_eu-v1 am_tokens am_tokens_eu-v1 criteo tvid tv_UICR optout cto_tld_test XANDR_PANID gpp ttcsid_CU8M57RC77U66G5CN100 ttcsid __Secure-ROLLOUT_TOKEN Guardar mis preferencias Powered by Este gato no debería estar en esta caja, ni tú en esta página Puede que haya expirado. Intenta la búsqueda con otras palabras o tal vez puedas encontrarla desde el homepage. Live Chat",,,,,,"{""Descripción"": [""incap_ses_*"", ""sesión"", ""opt_out"", ""gdpr"", ""Caducada"", ""_GRECAPTCHA"", ""6 meses"", ""Un CAPTCHA te ayuda a protegerte del spam y del descifrado de contraseñas pidiéndote que completes una simple prueba que demuestre que eres humano y no un ordenador que intenta acceder a una cuenta protegida con contraseña."", ""__cf_bm"", ""1 hora"", ""rc::a"", ""Nunca caduca"", ""rc::c"", ""rc::f"", ""rc::b"", ""Funcionales"", ""SnapABugRef"", ""2 horas"", ""SnapABugHistory"", ""SnapABugUserAlias"", ""SnapABugVisit"", ""Analíticas"", ""___utmvc"", ""Menos de un minuto"", ""_gcl_au"", ""3 meses"", ""_ga"", ""1 año 1 mes 4 días"", ""_gid"", ""1 día"", ""_gat_UA-*"", ""1 minuto"", ""_ga_*"", ""uid"", ""1 año 24 días"", ""_hjSessionUser_*"", ""_hjSession_*"", ""_fbp"", ""demdex"", ""_hjTLDTest"", ""Rendimiento"", ""Anuncio"", ""15 minutos"", ""personalization_id"", ""muc_ads"", ""cto_bundle"", ""IDE"", ""uuid2"", ""anj"", ""CMID"", ""CMPS"", ""CMPRO"", ""dpm"", ""mv_tokens"", ""14 días 1 minuto"", ""cf"", ""Used to present the visitor with relevant content advertisement."", ""cip"", ""Presents the user with relevant content and advertisements, and facilitates real-time bidding for advertisers."", ""cnac"", ""car"", ""callback"", ""criteo_write_test"", ""YSC"", ""VISITOR_INFO1_LIVE"", ""VISITOR_PRIVACY_METADATA"", ""_ttp"", ""ab"", ""Nezaradené do kategórie"", ""ck_flagpv"", ""Description is currently not available."", ""visitor-id"", ""No description available."", ""data-c-ts"", ""1 mes"", ""data-c"", ""mv_tokens_eu-v1"", ""am_tokens"", ""am_tokens_eu-v1"", ""criteo"", ""tvid"", ""tv_UICR"", ""optout"", ""cto_tld_test"", ""XANDR_PANID"", ""gpp"", ""ttcsid_CU8M57RC77U66G5CN100"", ""ttcsid"", ""__Secure-ROLLOUT_TOKEN"", ""Guardar mis preferencias"", ""Powered by"", ""Este gato no debería estar en esta caja, ni tú en esta página"", ""Puede que haya expirado. Intenta la búsqueda con otras palabras o tal vez puedas encontrarla desde el homepage."", ""Live Chat""]}",dataset/txt_limpios/1309.txt,dataset/paginas_descargadas/1309.html,EN,sin_categoria,discard,0.30,no_category_detected;price_parse_failed
1310,Valoramos tu privacidad,"incap_ses_* sesión opt_out gdpr Caducada _GRECAPTCHA 6 meses Un CAPTCHA te ayuda a protegerte del spam y del descifrado de contraseñas pidiéndote que completes una simple prueba que demuestre que eres humano y no un ordenador que intenta acceder a una cuenta protegida con contraseña. __cf_bm 1 hora rc::a Nunca caduca rc::c rc::f rc::b Funcionales SnapABugRef 2 horas SnapABugHistory SnapABugUserAlias SnapABugVisit Analíticas ___utmvc Menos de un minuto _gcl_au 3 meses _ga 1 año 1 mes 4 días _gid 1 día _gat_UA-* 1 minuto _ga_* uid 1 año 24 días _hjSessionUser_* _hjSession_* _fbp demdex _hjTLDTest Rendimiento Anuncio 15 minutos personalization_id muc_ads cto_bundle IDE uuid2 anj CMID CMPS CMPRO dpm mv_tokens 14 días 1 minuto cf Used to present the visitor with relevant content advertisement. cip Presents the user with relevant content and advertisements, and facilitates real-time bidding for advertisers. cnac car callback criteo_write_test YSC VISITOR_INFO1_LIVE VISITOR_PRIVACY_METADATA _ttp ab Nezaradené do kategórie ck_flagpv Description is currently not available. visitor-id No description available. data-c-ts 1 mes data-c mv_tokens_eu-v1 am_tokens am_tokens_eu-v1 criteo tvid tv_UICR optout cto_tld_test XANDR_PANID gpp ttcsid_CU8M57RC77U66G5CN100 ttcsid __Secure-ROLLOUT_TOKEN Guardar mis preferencias Powered by X App Frecuento Descárgala Gratis Ver en App Arroz, Granos y Pastas Fideo Spaghetti N°5 Toscana 400g Marca: Toscana Código - 40252077 Cantidad Pagar Realiza tus compras con seguridad Tipo de fideo: spaghetti | Número 5 | Elaborado a base sémola de trigo | 2 veces más proteína que el arroz | Fortificado con vitaminas  B1, B2 y | minerales como ácido fólico y hierro | Ideal para preparar una variedad de | recetas | Sin preservantes ni aditivos | Contiene gluten | Mantener en un lugar fresco y seco | Contenido neto: 400g",Personalizar > 400g,1.14,,,Desconocido,unknown,UNKNOWN,Valoramos tu privacidad,Personalizar,,400g,1.14,,$,$1.14,1.14,False,original,1.14,1.14,1.0,default_1usd,,"incap_ses_* sesión opt_out gdpr Caducada _GRECAPTCHA 6 meses Un CAPTCHA te ayuda a protegerte del spam y del descifrado de contraseñas pidiéndote que completes una simple prueba que demuestre que eres humano y no un ordenador que intenta acceder a una cuenta protegida con contraseña. __cf_bm 1 hora rc::a Nunca caduca rc::c rc::f rc::b Funcionales SnapABugRef 2 horas SnapABugHistory SnapABugUserAlias SnapABugVisit Analíticas ___utmvc Menos de un minuto _gcl_au 3 meses _ga 1 año 1 mes 4 días _gid 1 día _gat_UA-* 1 minuto _ga_* uid 1 año 24 días _hjSessionUser_* _hjSession_* _fbp demdex _hjTLDTest Rendimiento Anuncio 15 minutos personalization_id muc_ads cto_bundle IDE uuid2 anj CMID CMPS CMPRO dpm mv_tokens 14 días 1 minuto cf Used to present the visitor with relevant content advertisement. cip Presents the user with relevant content and advertisements, and facilitates real-time bidding for advertisers. cnac car callback criteo_write_test YSC VISITOR_INFO1_LIVE VISITOR_PRIVACY_METADATA _ttp ab Nezaradené do kategórie ck_flagpv Description is currently not available. visitor-id No description available. data-c-ts 1 mes data-c mv_tokens_eu-v1 am_tokens am_tokens_eu-v1 criteo tvid tv_UICR optout cto_tld_test XANDR_PANID gpp ttcsid_CU8M57RC77U66G5CN100 ttcsid __Secure-ROLLOUT_TOKEN Guardar mis preferencias Powered by X App Frecuento Descárgala Gratis Ver en App Arroz, Granos y Pastas Fideo Spaghetti N°5 Toscana 400g Marca: Toscana Código - 40252077 Cantidad Pagar Realiza tus compras con seguridad",,,,"Tipo de fideo: spaghetti | Número 5 | Elaborado a base sémola de trigo | 2 veces más proteína que el arroz | Fortificado con vitaminas  B1, B2 y | minerales como ácido fólico y hierro | Ideal para preparar una variedad de | recetas | Sin preservantes ni aditivos | Contiene gluten | Mantener en un lugar fresco y seco | Contenido neto: 400g",,"{""Descripción"": [""incap_ses_*"", ""sesión"", ""opt_out"", ""gdpr"", ""Caducada"", ""_GRECAPTCHA"", ""6 meses"", ""Un CAPTCHA te ayuda a protegerte del spam y del descifrado de contraseñas pidiéndote que completes una simple prueba que demuestre que eres humano y no un ordenador que intenta acceder a una cuenta protegida con contraseña."", ""__cf_bm"", ""1 hora"", ""rc::a"", ""Nunca caduca"", ""rc::c"", ""rc::f"", ""rc::b"", ""Funcionales"", ""SnapABugRef"", ""2 horas"", ""SnapABugHistory"", ""SnapABugUserAlias"", ""SnapABugVisit"", ""Analíticas"", ""___utmvc"", ""Menos de un minuto"", ""_gcl_au"", ""3 meses"", ""_ga"", ""1 año 1 mes 4 días"", ""_gid"", ""1 día"", ""_gat_UA-*"", ""1 minuto"", ""_ga_*"", ""uid"", ""1 año 24 días"", ""_hjSessionUser_*"", ""_hjSession_*"", ""_fbp"", ""demdex"", ""_hjTLDTest"", ""Rendimiento"", ""Anuncio"", ""15 minutos"", ""personalization_id"", ""muc_ads"", ""cto_bundle"", ""IDE"", ""uuid2"", ""anj"", ""CMID"", ""CMPS"", ""CMPRO"", ""dpm"", ""mv_tokens"", ""14 días 1 minuto"", ""cf"", ""Used to present the visitor with relevant content advertisement."", ""cip"", ""Presents the user with relevant content and advertisements, and facilitates real-time bidding for advertisers."", ""cnac"", ""car"", ""callback"", ""criteo_write_test"", ""YSC"", ""VISITOR_INFO1_LIVE"", ""VISITOR_PRIVACY_METADATA"", ""_ttp"", ""ab"", ""Nezaradené do kategórie"", ""ck_flagpv"", ""Description is currently not available."", ""visitor-id"", ""No description available."", ""data-c-ts"", ""1 mes"", ""data-c"", ""mv_tokens_eu-v1"", ""am_tokens"", ""am_tokens_eu-v1"", ""criteo"", ""tvid"", ""tv_UICR"", ""optout"", ""cto_tld_test"", ""XANDR_PANID"", ""gpp"", ""ttcsid_CU8M57RC77U66G5CN100"", ""ttcsid"", ""__Secure-ROLLOUT_TOKEN"", ""Guardar mis preferencias"", ""Powered by"", ""X"", ""App Frecuento"", ""Descárgala gratis"", ""Ver en App"", ""Arroz, Granos y Pastas"", ""Fideo Spaghetti N°5 Toscana 400g"", ""Marca: Toscana"", ""Código - 40252077"", ""Cantidad"", ""Pagar"", ""Realiza tus compras"", ""con seguridad""], ""Detalles"": [""Tipo de fideo: spaghetti"", ""Número 5"", ""Elaborado a base sémola de trigo"", ""2 veces más proteína que el arroz"", ""Fortificado con vitaminas  B1, B2 y"", ""minerales como ácido fólico y hierro"", ""Ideal para preparar una variedad de"", ""recetas"", ""Sin preservantes ni aditivos"", ""Contiene gluten"", ""Mantener en un lugar fresco y seco"", ""Contenido neto: 400g""]}",dataset/txt_limpios/1310.txt,dataset/paginas_descargadas/1310.html,ET,arroz,keep,0.60,heuristic_default
1311,Valoramos tu privacidad,"incap_ses_* sesión opt_out gdpr Caducada _GRECAPTCHA 6 meses Un CAPTCHA te ayuda a protegerte del spam y del descifrado de contraseñas pidiéndote que completes una simple prueba que demuestre que eres humano y no un ordenador que intenta acceder a una cuenta protegida con contraseña. __cf_bm 1 hora rc::a Nunca caduca rc::c rc::f rc::b Funcionales SnapABugRef 2 horas SnapABugHistory SnapABugUserAlias SnapABugVisit Analíticas ___utmvc Menos de un minuto _gcl_au 3 meses _ga 1 año 1 mes 4 días _gid 1 día _gat_UA-* 1 minuto _ga_* uid 1 año 24 días _hjSessionUser_* _hjSession_* _fbp demdex _hjTLDTest Rendimiento Anuncio 15 minutos personalization_id muc_ads cto_bundle IDE uuid2 anj CMID CMPS CMPRO dpm mv_tokens 14 días 1 minuto cf Used to present the visitor with relevant content advertisement. cip Presents the user with relevant content and advertisements, and facilitates real-time bidding for advertisers. cnac car callback criteo_write_test YSC VISITOR_INFO1_LIVE VISITOR_PRIVACY_METADATA _ttp ab Nezaradené do kategórie ck_flagpv Description is currently not available. visitor-id No description available. data-c-ts 1 mes data-c mv_tokens_eu-v1 am_tokens am_tokens_eu-v1 criteo tvid tv_UICR optout cto_tld_test XANDR_PANID gpp ttcsid_CU8M57RC77U66G5CN100 ttcsid __Secure-ROLLOUT_TOKEN Guardar mis preferencias Powered by X App Frecuento Descárgala Gratis Ver en App Arroz, Granos y Pastas Pasta Spaghetti N°5 Barilla 500g Marca: Barilla Código - 40105920 Cantidad Pagar Realiza tus compras con seguridad Tipo de pasta: spaghetti | Gran fuente de energía | Enriquecido con hierro y vitamina B | Bajo índice glucémico | Cocción de 9 a 11 minutos | Sémola de trigo duro | Contenido: 500g",Personalizar > 500g,2.25,,,Desconocido,unknown,UNKNOWN,Valoramos tu privacidad,Personalizar,,500g,2.25,,$,$2.25,2.25,False,original,2.25,2.25,1.0,default_1usd,,"incap_ses_* sesión opt_out gdpr Caducada _GRECAPTCHA 6 meses Un CAPTCHA te ayuda a protegerte del spam y del descifrado de contraseñas pidiéndote que completes una simple prueba que demuestre que eres humano y no un ordenador que intenta acceder a una cuenta protegida con contraseña. __cf_bm 1 hora rc::a Nunca caduca rc::c rc::f rc::b Funcionales SnapABugRef 2 horas SnapABugHistory SnapABugUserAlias SnapABugVisit Analíticas ___utmvc Menos de un minuto _gcl_au 3 meses _ga 1 año 1 mes 4 días _gid 1 día _gat_UA-* 1 minuto _ga_* uid 1 año 24 días _hjSessionUser_* _hjSession_* _fbp demdex _hjTLDTest Rendimiento Anuncio 15 minutos personalization_id muc_ads cto_bundle IDE uuid2 anj CMID CMPS CMPRO dpm mv_tokens 14 días 1 minuto cf Used to present the visitor with relevant content advertisement. cip Presents the user with relevant content and advertisements, and facilitates real-time bidding for advertisers. cnac car callback criteo_write_test YSC VISITOR_INFO1_LIVE VISITOR_PRIVACY_METADATA _ttp ab Nezaradené do kategórie ck_flagpv Description is currently not available. visitor-id No description available. data-c-ts 1 mes data-c mv_tokens_eu-v1 am_tokens am_tokens_eu-v1 criteo tvid tv_UICR optout cto_tld_test XANDR_PANID gpp ttcsid_CU8M57RC77U66G5CN100 ttcsid __Secure-ROLLOUT_TOKEN Guardar mis preferencias Powered by X App Frecuento Descárgala Gratis Ver en App Arroz, Granos y Pastas Pasta Spaghetti N°5 Barilla 500g Marca: Barilla Código - 40105920 Cantidad Pagar Realiza tus compras con seguridad",,,,Tipo de pasta: spaghetti | Gran fuente de energía | Enriquecido con hierro y vitamina B | Bajo índice glucémico | Cocción de 9 a 11 minutos | Sémola de trigo duro | Contenido: 500g,,"{""Descripción"": [""incap_ses_*"", ""sesión"", ""opt_out"", ""gdpr"", ""Caducada"", ""_GRECAPTCHA"", ""6 meses"", ""Un CAPTCHA te ayuda a protegerte del spam y del descifrado de contraseñas pidiéndote que completes una simple prueba que demuestre que eres humano y no un ordenador que intenta acceder a una cuenta protegida con contraseña."", ""__cf_bm"", ""1 hora"", ""rc::a"", ""Nunca caduca"", ""rc::c"", ""rc::f"", ""rc::b"", ""Funcionales"", ""SnapABugRef"", ""2 horas"", ""SnapABugHistory"", ""SnapABugUserAlias"", ""SnapABugVisit"", ""Analíticas"", ""___utmvc"", ""Menos de un minuto"", ""_gcl_au"", ""3 meses"", ""_ga"", ""1 año 1 mes 4 días"", ""_gid"", ""1 día"", ""_gat_UA-*"", ""1 minuto"", ""_ga_*"", ""uid"", ""1 año 24 días"", ""_hjSessionUser_*"", ""_hjSession_*"", ""_fbp"", ""demdex"", ""_hjTLDTest"", ""Rendimiento"", ""Anuncio"", ""15 minutos"", ""personalization_id"", ""muc_ads"", ""cto_bundle"", ""IDE"", ""uuid2"", ""anj"", ""CMID"", ""CMPS"", ""CMPRO"", ""dpm"", ""mv_tokens"", ""14 días 1 minuto"", ""cf"", ""Used to present the visitor with relevant content advertisement."", ""cip"", ""Presents the user with relevant content and advertisements, and facilitates real-time bidding for advertisers."", ""cnac"", ""car"", ""callback"", ""criteo_write_test"", ""YSC"", ""VISITOR_INFO1_LIVE"", ""VISITOR_PRIVACY_METADATA"", ""_ttp"", ""ab"", ""Nezaradené do kategórie"", ""ck_flagpv"", ""Description is currently not available."", ""visitor-id"", ""No description available."", ""data-c-ts"", ""1 mes"", ""data-c"", ""mv_tokens_eu-v1"", ""am_tokens"", ""am_tokens_eu-v1"", ""criteo"", ""tvid"", ""tv_UICR"", ""optout"", ""cto_tld_test"", ""XANDR_PANID"", ""gpp"", ""ttcsid_CU8M57RC77U66G5CN100"", ""ttcsid"", ""__Secure-ROLLOUT_TOKEN"", ""Guardar mis preferencias"", ""Powered by"", ""X"", ""App Frecuento"", ""Descárgala gratis"", ""Ver en App"", ""Arroz, Granos y Pastas"", ""Pasta Spaghetti N°5 Barilla 500g"", ""Marca: Barilla"", ""Código - 40105920"", ""Cantidad"", ""Pagar"", ""Realiza tus compras"", ""con seguridad""], ""Detalles"": [""Tipo de pasta: spaghetti"", ""Gran fuente de energía"", ""Enriquecido con hierro y vitamina B"", ""Bajo índice glucémico"", ""Cocción de 9 a 11 minutos"", ""Sémola de trigo duro"", ""Contenido: 500g""]}",dataset/txt_limpios/1311.txt,dataset/paginas_descargadas/1311.html,ET,arroz,keep,0.60,heuristic_default
