{"source_id": "784", "title": "(Gr a $ 68)", "description": "", "breadcrumbs": "$ 14.400", "price_raw": "68.0", "currency_raw": "", "url": "", "seller": "Desconocido", "availability": "unknown", "country": "UNKNOWN", "product_name": "(Gr a $ 68)", "brand": "$ 14.400", "reference": "", "unit": "", "price_amount": 68.0, "price_currency": "", "price_symbol": "$", "price_text": "$68", "price_amount_filled": "68.0", "price_is_imputed": "False", "price_imputation_source": "original", "price_amount_usd": "68.0", "price_amount_usd_filled": "68.0", "fx_rate_local_per_usd": "1.0", "fx_source": "default_1usd", "information_text": "", "description_text": "", "features_text": "", "specifications_text": "", "benefits_text": "", "details_text": "", "other_sections": "", "sections": {}, "txt_path": "dataset/txt_limpios/784.txt", "html_path": "dataset/paginas_descargadas/784.html", "es_status": "EN", "category_canonical": "sin_categoria", "decision": "discard", "match_score": 0.3, "reasons": "no_category_detected"}
{"source_id": "645", "title": "(Gr a $ 8)", "description": "", "breadcrumbs": "$ 8.200", "price_raw": "8.0", "currency_raw": "", "url": "", "seller": "Desconocido", "availability": "unknown", "country": "UNKNOWN", "product_name": "(Gr a $ 8)", "brand": "$ 8.200", "reference": "", "unit": "", "price_amount": 8.0, "price_currency": "", "price_symbol": "$", "price_text": "$8", "price_amount_filled": "8.0", "price_is_imputed": "False", "price_imputation_source": "original", "price_amount_usd": "8.0", "price_amount_usd_filled": "8.0", "fx_rate_local_per_usd": "1.0", "fx_source": "default_1usd", "information_text": "", "description_text": "", "features_text": "", "specifications_text": "", "benefits_text": "", "details_text": "", "other_sections": "", "sections": {}, "txt_path": "dataset/txt_limpios/645.txt", "html_path": "dataset/paginas_descargadas/645.html", "es_status": "EN", "category_canonical": "sin_categoria", "decision": "discard", "match_score": 0.3, "reasons": "no_category_detected"}
{"source_id": "646", "title": "(Gr a $ 9)", "description": "", "breadcrumbs": "$ 9.980", "price_raw": "9.0", "currency_raw": "", "url": "", "seller": "Desconocido", "availability": "unknown", "country": "UNKNOWN", "product_name": "(Gr a $ 9)", "brand": "$ 9.980", "reference": "", "unit": "", "price_amount": 9.0, "price_currency": "", "price_symbol": "$", "price_text": "$9", "price_amount_filled": "9.0", "price_is_imputed": "False", "price_imputation_source": "original", "price_amount_usd": "9.0", "price_amount_usd_filled": "9.0", "fx_rate_local_per_usd": "1.0", "fx_source": "default_1usd", "information_text": "", "description_text": "", "features_text": "", "specifications_text": "", "benefits_text": "", "details_text": "", "other_sections": "", "sections": {}, "txt_path": "dataset/txt_limpios/646.txt", "html_path": "dataset/paginas_descargadas/646.html", "es_status": "EN", "category_canonical": "sin_categoria", "decision": "discard", "match_score": 0.3, "reasons": "no_category_detected"}
{"source_id": "779", "title": "(Gr a $ 90)", "description": "", "breadcrumbs": "$ 21.600", "price_raw": "90.0", "currency_raw": "", "url": "", "seller": "Desconocido", "availability": "unknown", "country": "UNKNOWN", "product_name": "(Gr a $ 90)", "brand": "$ 21.600", "reference": "", "unit": "", "price_amount": 90.0, "price_currency": "", "price_symbol": "$", "price_text": "$90", "price_amount_filled": "90.0", "price_is_imputed": "False", "price_imputation_source": "original", "price_amount_usd": "90.0", "price_amount_usd_filled": "90.0", "fx_rate_local_per_usd": "1.0", "fx_source": "default_1usd", "information_text": "", "description_text": "", "features_text": "", "specifications_text": "", "benefits_text": "", "details_text": "", "other_sections": "", "sections": {}, "txt_path": "dataset/txt_limpios/779.txt", "html_path": "dataset/paginas_descargadas/779.html", "es_status": "EN", "category_canonical": "sin_categoria", "decision": "discard", "match_score": 0.3, "reasons": "no_category_detected"}
{"source_id": "635", "title": "(Ml a $ 3)", "description": "", "breadcrumbs": "$ 17.040", "price_raw": "3.0", "currency_raw": "", "url": "", "seller": "Desconocido", "availability": "unknown", "country": "UNKNOWN", "product_name": "(Ml a $ 3)", "brand": "$ 17.040", "reference": "", "unit": "", "price_amount": 3.0, "price_currency": "", "price_symbol": "$", "price_text": "$3", "price_amount_filled": "3.0", "price_is_imputed": "False", "price_imputation_source": "original", "price_amount_usd": "3.0", "price_amount_usd_filled": "3.0", "fx_rate_local_per_usd": "1.0", "fx_source": "default_1usd", "information_text": "", "description_text": "", "features_text": "", "specifications_text": "", "benefits_text": "", "details_text": "", "other_sections": "", "sections": {}, "txt_path": "dataset/txt_limpios/635.txt", "html_path": "dataset/paginas_descargadas/635.html", "es_status": "EN", "category_canonical": "sin_categoria", "decision": "discard", "match_score": 0.3, "reasons": "no_category_detected"}
{"source_id": "771", "title": "(Ml a $ 3)", "description": "", "breadcrumbs": "$ 3.330", "price_raw": "3.0", "currency_raw": "", "url": "", "seller": "Desconocido", "availability": "unknown", "country": "UNKNOWN", "product_name": "(Ml a $ 3)", "brand": "$ 3.330", "reference": "", "unit": "", "price_amount": 3.0, "price_currency": "", "price_symbol": "$", "price_text": "$3", "price_amount_filled": "3.0", "price_is_imputed": "False", "price_imputation_source": "original", "price_amount_usd": "3.0", "price_amount_usd_filled": "3.0", "fx_rate_local_per_usd": "1.0", "fx_source": "default_1usd", "information_text": "", "description_text": "", "features_text": "", "specifications_text": "", "benefits_text": "", "details_text": "", "other_sections": "", "sections": {}, "txt_path": "dataset/txt_limpios/771.txt", "html_path": "dataset/paginas_descargadas/771.html", "es_status": "EN", "category_canonical": "sin_categoria", "decision": "discard", "match_score": 0.3, "reasons": "no_category_detected"}
{"source_id": "632", "title": "(Ml a $ 4)", "description": "", "breadcrumbs": "25 > 1100ml", "price_raw": "4.0", "currency_raw": "", "url": "", "seller": "Desconocido", "availability": "unknown", "country": "UNKNOWN", "product_name": "(Ml a $ 4)", "brand": "25", "reference": "", "unit": "1100ml", "price_amount": 4.0, "price_currency": "", "price_symbol": "$", "price_text": "$4", "price_amount_filled": "4.0", "price_is_imputed": "False", "price_imputation_source": "original", "price_amount_usd": "4.0", "price_amount_usd_filled": "4.0", "fx_rate_local_per_usd": "1.0", "fx_source": "default_1usd", "information_text": "", "description_text": "", "features_text": "", "specifications_text": "", "benefits_text": "", "details_text": "", "other_sections": "", "sections": {}, "txt_path": "dataset/txt_limpios/632.txt", "html_path": "dataset/paginas_descargadas/632.html", "es_status": "EN", "category_canonical": "sin_categoria", "decision": "discard", "match_score": 0.3, "reasons": "no_category_detected"}
{"source_id": "633", "title": "(Ml a $ 4)", "description": "", "breadcrumbs": "$ 30.350", "price_raw": "4.0", "currency_raw": "", "url": "", "seller": "Desconocido", "availability": "unknown", "country": "UNKNOWN", "product_name": "(Ml a $ 4)", "brand": "$ 30.350", "reference": "", "unit": "", "price_amount": 4.0, "price_currency": "", "price_symbol": "$", "price_text": "$4", "price_amount_filled": "4.0", "price_is_imputed": "False", "price_imputation_source": "original", "price_amount_usd": "4.0", "price_amount_usd_filled": "4.0", "fx_rate_local_per_usd": "1.0", "fx_source": "default_1usd", "information_text": "", "description_text": "", "features_text": "", "specifications_text": "", "benefits_text": "", "details_text": "", "other_sections": "", "sections": {}, "txt_path": "dataset/txt_limpios/633.txt", "html_path": "dataset/paginas_descargadas/633.html", "es_status": "EN", "category_canonical": "sin_categoria", "decision": "discard", "match_score": 0.3, "reasons": "no_category_detected"}
{"source_id": "634", "title": "(Ml a $ 5)", "description": "", "breadcrumbs": "$ 6.980", "price_raw": "5.0", "currency_raw": "", "url": "", "seller": "Desconocido", "availability": "unknown", "country": "UNKNOWN", "product_name": "(Ml a $ 5)", "brand": "$ 6.980", "reference": "", "unit": "", "price_amount": 5.0, "price_currency": "", "price_symbol": "$", "price_text": "$5", "price_amount_filled": "5.0", "price_is_imputed": "False", "price_imputation_source": "original", "price_amount_usd": "5.0", "price_amount_usd_filled": "5.0", "fx_rate_local_per_usd": "1.0", "fx_source": "default_1usd", "information_text": "", "description_text": "", "features_text": "", "specifications_text": "", "benefits_text": "", "details_text": "", "other_sections": "", "sections": {}, "txt_path": "dataset/txt_limpios/634.txt", "html_path": "dataset/paginas_descargadas/634.html", "es_status": "EN", "category_canonical": "sin_categoria", "decision": "discard", "match_score": 0.3, "reasons": "no_category_detected"}
{"source_id": "769", "title": "(Ml a $ 5)", "description": "", "breadcrumbs": "$ 4.900", "price_raw": "5.0", "currency_raw": "", "url": "", "seller": "Desconocido", "availability": "unknown", "country": "UNKNOWN", "product_name": "(Ml a $ 5)", "brand": "$ 4.900", "reference": "", "unit": "", "price_amount": 5.0, "price_currency": "", "price_symbol": "$", "price_text": "$5", "price_amount_filled": "5.0", "price_is_imputed": "False", "price_imputation_source": "original", "price_amount_usd": "5.0", "price_amount_usd_filled": "5.0", "fx_rate_local_per_usd": "1.0", "fx_source": "default_1usd", "information_text": "", "description_text": "", "features_text": "", "specifications_text": "", "benefits_text": "", "details_text": "", "other_sections": "", "sections": {}, "txt_path": "dataset/txt_limpios/769.txt", "html_path": "dataset/paginas_descargadas/769.html", "es_status": "EN", "category_canonical": "sin_categoria", "decision": "discard", "match_score": 0.3, "reasons": "no_category_detected"}
{"source_id": "768", "title": "(Ml a $ 6)", "description": "", "breadcrumbs": "$ 40.800 > 1100ml", "price_raw": "6.0", "currency_raw": "", "url": "", "seller": "Desconocido", "availability": "unknown", "country": "UNKNOWN", "product_name": "(Ml a $ 6)", "brand": "$ 40.800", "reference": "", "unit": "1100ml", "price_amount": 6.0, "price_currency": "", "price_symbol": "$", "price_text": "$6", "price_amount_filled": "6.0", "price_is_imputed": "False", "price_imputation_source": "original", "price_amount_usd": "6.0", "price_amount_usd_filled": "6.0", "fx_rate_local_per_usd": "1.0", "fx_source": "default_1usd", "information_text": "", "description_text": "", "features_text": "", "specifications_text": "", "benefits_text": "", "details_text": "", "other_sections": "", "sections": {}, "txt_path": "dataset/txt_limpios/768.txt", "html_path": "dataset/paginas_descargadas/768.html", "es_status": "EN", "category_canonical": "sin_categoria", "decision": "discard", "match_score": 0.3, "reasons": "no_category_detected"}
{"source_id": "619", "title": "(Und a $ 1.231)", "description": "", "breadcrumbs": "$ 39.400", "price_raw": "1.23", "currency_raw": "", "url": "", "seller": "Desconocido", "availability": "unknown", "country": "UNKNOWN", "product_name": "(Und a $ 1.231)", "brand": "$ 39.400", "reference": "", "unit": "", "price_amount": 1.23, "price_currency": "", "price_symbol": "$", "price_text": "$1.23", "price_amount_filled": "1.23", "price_is_imputed": "False", "price_imputation_source": "original", "price_amount_usd": "1.23", "price_amount_usd_filled": "1.23", "fx_rate_local_per_usd": "1.0", "fx_source": "default_1usd", "information_text": "", "description_text": "", "features_text": "", "specifications_text": "", "benefits_text": "", "details_text": "", "other_sections": "", "sections": {}, "txt_path": "dataset/txt_limpios/619.txt", "html_path": "dataset/paginas_descargadas/619.html", "es_status": "EN", "category_canonical": "sin_categoria", "decision": "discard", "match_score": 0.3, "reasons": "no_category_detected"}
{"source_id": "775", "title": "(Und a $ 1.312)", "description": "", "breadcrumbs": "20", "price_raw": "1.31", "currency_raw": "", "url": "", "seller": "Desconocido", "availability": "unknown", "country": "UNKNOWN", "product_name": "(Und a $ 1.312)", "brand": "20", "reference": "", "unit": "", "price_amount": 1.31, "price_currency": "", "price_symbol": "$", "price_text": "$1.31", "price_amount_filled": "1.31", "price_is_imputed": "False", "price_imputation_source": "original", "price_amount_usd": "1.31", "price_amount_usd_filled": "1.31", "fx_rate_local_per_usd": "1.0", "fx_source": "default_1usd", "information_text": "", "description_text": "", "features_text": "", "specifications_text": "", "benefits_text": "", "details_text": "", "other_sections": "", "sections": {}, "txt_path": "dataset/txt_limpios/775.txt", "html_path": "dataset/paginas_descargadas/775.html", "es_status": "EN", "category_canonical": "sin_categoria", "decision": "discard", "match_score": 0.3, "reasons": "no_category_detected"}
{"source_id": "644", "title": "(Und a $ 1.540)", "description": "", "breadcrumbs": "$ 1.540", "price_raw": "1.54", "currency_raw": "", "url": "", "seller": "Desconocido", "availability": "unknown", "country": "UNKNOWN", "product_name": "(Und a $ 1.540)", "brand": "$ 1.540", "reference": "", "unit": "", "price_amount": 1.54, "price_currency": "", "price_symbol": "$", "price_text": "$1.54", "price_amount_filled": "1.54", "price_is_imputed": "False", "price_imputation_source": "original", "price_amount_usd": "1.54", "price_amount_usd_filled": "1.54", "fx_rate_local_per_usd": "1.0", "fx_source": "default_1usd", "information_text": "", "description_text": "", "features_text": "", "specifications_text": "", "benefits_text": "", "details_text": "", "other_sections": "", "sections": {}, "txt_path": "dataset/txt_limpios/644.txt", "html_path": "dataset/paginas_descargadas/644.html", "es_status": "EN", "category_canonical": "sin_categoria", "decision": "discard", "match_score": 0.3, "reasons": "no_category_detected"}
{"source_id": "636", "title": "(Und a $ 500)", "description": "", "breadcrumbs": "16", "price_raw": "500.0", "currency_raw": "", "url": "", "seller": "Desconocido", "availability": "unknown", "country": "UNKNOWN", "product_name": "(Und a $ 500)", "brand": "16", "reference": "", "unit": "", "price_amount": 500.0, "price_currency": "", "price_symbol": "$", "price_text": "$500", "price_amount_filled": "500.0", "price_is_imputed": "False", "price_imputation_source": "original", "price_amount_usd": "500.0", "price_amount_usd_filled": "500.0", "fx_rate_local_per_usd": "1.0", "fx_source": "default_1usd", "information_text": "", "description_text": "", "features_text": "", "specifications_text": "", "benefits_text": "", "details_text": "", "other_sections": "", "sections": {}, "txt_path": "dataset/txt_limpios/636.txt", "html_path": "dataset/paginas_descargadas/636.html", "es_status": "EN", "category_canonical": "sin_categoria", "decision": "discard", "match_score": 0.3, "reasons": "no_category_detected"}
{"source_id": "639", "title": "(Und a $ 544)", "description": "", "breadcrumbs": "20", "price_raw": "544.0", "currency_raw": "", "url": "", "seller": "Desconocido", "availability": "unknown", "country": "UNKNOWN", "product_name": "(Und a $ 544)", "brand": "20", "reference": "", "unit": "", "price_amount": 544.0, "price_currency": "", "price_symbol": "$", "price_text": "$544", "price_amount_filled": "544.0", "price_is_imputed": "False", "price_imputation_source": "original", "price_amount_usd": "544.0", "price_amount_usd_filled": "544.0", "fx_rate_local_per_usd": "1.0", "fx_source": "default_1usd", "information_text": "", "description_text": "", "features_text": "", "specifications_text": "", "benefits_text": "", "details_text": "", "other_sections": "", "sections": {}, "txt_path": "dataset/txt_limpios/639.txt", "html_path": "dataset/paginas_descargadas/639.html", "es_status": "EN", "category_canonical": "sin_categoria", "decision": "discard", "match_score": 0.3, "reasons": "no_category_detected"}
{"source_id": "774", "title": "(Und a $ 544)", "description": "", "breadcrumbs": "20", "price_raw": "544.0", "currency_raw": "", "url": "", "seller": "Desconocido", "availability": "unknown", "country": "UNKNOWN", "product_name": "(Und a $ 544)", "brand": "20", "reference": "", "unit": "", "price_amount": 544.0, "price_currency": "", "price_symbol": "$", "price_text": "$544", "price_amount_filled": "544.0", "price_is_imputed": "False", "price_imputation_source": "original", "price_amount_usd": "544.0", "price_amount_usd_filled": "544.0", "fx_rate_local_per_usd": "1.0", "fx_source": "default_1usd", "information_text": "", "description_text": "", "features_text": "", "specifications_text": "", "benefits_text": "", "details_text": "", "other_sections": "", "sections": {}, "txt_path": "dataset/txt_limpios/774.txt", "html_path": "dataset/paginas_descargadas/774.html", "es_status": "EN", "category_canonical": "sin_categoria", "decision": "discard", "match_score": 0.3, "reasons": "no_category_detected"}
{"source_id": "615", "title": "(Und a $ 750)", "description": "", "breadcrumbs": "$ 24.500", "price_raw": "750.0", "currency_raw": "", "url": "", "seller": "Desconocido", "availability": "unknown", "country": "UNKNOWN", "product_name": "(Und a $ 750)", "brand": "$ 24.500", "reference": "", "unit": "", "price_amount": 750.0, "price_currency": "", "price_symbol": "$", "price_text": "$750", "price_amount_filled": "750.0", "price_is_imputed": "False", "price_imputation_source": "original", "price_amount_usd": "750.0", "price_amount_usd_filled": "750.0", "fx_rate_local_per_usd": "1.0", "fx_source": "default_1usd", "information_text": "", "description_text": "", "features_text": "", "specifications_text": "", "benefits_text": "", "details_text": "", "other_sections": "", "sections": {}, "txt_path": "dataset/txt_limpios/615.txt", "html_path": "dataset/paginas_descargadas/615.html", "es_status": "EN", "category_canonical": "sin_categoria", "decision": "discard", "match_score": 0.3, "reasons": "no_category_detected"}
{"source_id": "618", "title": "(Und a $ 796)", "description": "", "breadcrumbs": "$ 23.900", "price_raw": "796.0", "currency_raw": "", "url": "", "seller": "Desconocido", "availability": "unknown", "country": "UNKNOWN", "product_name": "(Und a $ 796)", "brand": "$ 23.900", "reference": "", "unit": "", "price_amount": 796.0, "price_currency": "", "price_symbol": "$", "price_text": "$796", "price_amount_filled": "796.0", "price_is_imputed": "False", "price_imputation_source": "original", "price_amount_usd": "796.0", "price_amount_usd_filled": "796.0", "fx_rate_local_per_usd": "1.0", "fx_source": "default_1usd", "information_text": "", "description_text": "", "features_text": "", "specifications_text": "", "benefits_text": "", "details_text": "", "other_sections": "", "sections": {}, "txt_path": "dataset/txt_limpios/618.txt", "html_path": "dataset/paginas_descargadas/618.html", "es_status": "EN", "category_canonical": "sin_categoria", "decision": "discard", "match_score": 0.3, "reasons": "no_category_detected"}
{"source_id": "772", "title": "(Und a $ 840)", "description": "", "breadcrumbs": "$ 860", "price_raw": "840.0", "currency_raw": "", "url": "", "seller": "Desconocido", "availability": "unknown", "country": "UNKNOWN", "product_name": "(Und a $ 840)", "brand": "$ 860", "reference": "", "unit": "", "price_amount": 840.0, "price_currency": "", "price_symbol": "$", "price_text": "$840", "price_amount_filled": "840.0", "price_is_imputed": "False", "price_imputation_source": "original", "price_amount_usd": "840.0", "price_amount_usd_filled": "840.0", "fx_rate_local_per_usd": "1.0", "fx_source": "default_1usd", "information_text": "", "description_text": "", "features_text": "", "specifications_text": "", "benefits_text": "", "details_text": "", "other_sections": "", "sections": {}, "txt_path": "dataset/txt_limpios/772.txt", "html_path": "dataset/paginas_descargadas/772.html", "es_status": "EN", "category_canonical": "sin_categoria", "decision": "discard", "match_score": 0.3, "reasons": "no_category_detected"}
{"source_id": "616", "title": "(Und a $ 850)", "description": "", "breadcrumbs": "$ 25.500", "price_raw": "850.0", "currency_raw": "", "url": "", "seller": "Desconocido", "availability": "unknown", "country": "UNKNOWN", "product_name": "(Und a $ 850)", "brand": "$ 25.500", "reference": "", "unit": "", "price_amount": 850.0, "price_currency": "", "price_symbol": "$", "price_text": "$850", "price_amount_filled": "850.0", "price_is_imputed": "False", "price_imputation_source": "original", "price_amount_usd": "850.0", "price_amount_usd_filled": "850.0", "fx_rate_local_per_usd": "1.0", "fx_source": "default_1usd", "information_text": "", "description_text": "", "features_text": "", "specifications_text": "", "benefits_text": "", "details_text": "", "other_sections": "", "sections": {}, "txt_path": "dataset/txt_limpios/616.txt", "html_path": "dataset/paginas_descargadas/616.html", "es_status": "EN", "category_canonical": "sin_categoria", "decision": "discard", "match_score": 0.3, "reasons": "no_category_detected"}
