{"source_id": "802", "title": "PAPA CAPIRA X 2500 G", "description": "Nombre del producto: Papa Capira Descripción del producto: Disfruta de la papa capira es una variedad de piel amarilla y textura firme, muy apreciada por su sabor y versatilidad en la cocina. Es ideal para freír, hervir, hornear o preparar guisos y sopas. Su tamaño uniforme y su excelente consistencia la hacen una opción práctica para todo tipo de recetas caseras o profesionales. Presentación: 2500g Modo de fabricación: Industrial Origen: Nacional Ver más También puede interesarte Nuevo PAPA CRIOLLA 1000G TOMATE CHONTO X 1000 G CEBOLLA CABEZONA X 1000G ZANAHORIA X 1000 G PLÁTANO X 1000G CEBOLLA ROJA X 1000 G PIMENTÓN UNIDAD LIMON TAHITI X 1000 GR CEBOLLA LARGA 500 GR ESPINACA X 200G", "breadcrumbs": "Unidades disponibles > 2500 G", "price_raw": "2500.0", "currency_raw": "", "url": "", "seller": "Desconocido", "availability": "unknown", "country": "UNKNOWN", "product_name": "PAPA CAPIRA X 2500 G", "brand": "Unidades disponibles", "reference": "", "unit": "2500 G", "price_amount": 2500.0, "price_currency": "", "price_symbol": "", "price_text": "2500", "price_amount_filled": "2500.0", "price_is_imputed": "False", "price_imputation_source": "original", "price_amount_usd": "2500.0", "price_amount_usd_filled": "2500.0", "fx_rate_local_per_usd": "1.0", "fx_source": "default_1usd", "information_text": "", "description_text": "Nombre del producto: Papa Capira Descripción del producto: Disfruta de la papa capira es una variedad de piel amarilla y textura firme, muy apreciada por su sabor y versatilidad en la cocina. Es ideal para freír, hervir, hornear o preparar guisos y sopas. Su tamaño uniforme y su excelente consistencia la hacen una opción práctica para todo tipo de recetas caseras o profesionales. Presentación: 2500g Modo de fabricación: Industrial Origen: Nacional Ver más También puede interesarte Nuevo PAPA CRIOLLA 1000G TOMATE CHONTO X 1000 G CEBOLLA CABEZONA X 1000G ZANAHORIA X 1000 G PLÁTANO X 1000G CEBOLLA ROJA X 1000 G PIMENTÓN UNIDAD LIMON TAHITI X 1000 GR CEBOLLA LARGA 500 GR ESPINACA X 200G", "features_text": "", "specifications_text": "", "benefits_text": "", "details_text": "", "other_sections": "", "sections": {"Descripción": ["Nombre del producto: Papa Capira", "Descripción del producto: Disfruta de la papa capira es una variedad de piel amarilla y textura firme, muy apreciada por su sabor y versatilidad en la cocina. Es ideal para freír, hervir, hornear o preparar guisos y sopas. Su tamaño uniforme y su excelente consistencia la hacen una opción práctica para todo tipo de recetas caseras o profesionales.", "Presentación: 2500g", "Modo de fabricación: Industrial", "Origen: Nacional", "Ver más", "También puede interesarte", "Nuevo", "PAPA CRIOLLA 1000G", "TOMATE CHONTO X 1000 G", "CEBOLLA CABEZONA X 1000G", "ZANAHORIA X 1000 G", "PLÁTANO X 1000G", "CEBOLLA ROJA X 1000 G", "PIMENTÓN UNIDAD", "LIMON TAHITI X 1000 GR", "CEBOLLA LARGA 500 GR", "ESPINACA X 200G"]}, "txt_path": "dataset/txt_limpios/802.txt", "html_path": "dataset/paginas_descargadas/802.html", "es_status": "EN", "category_canonical": "cebolla", "decision": "keep", "match_score": 0.6, "reasons": "heuristic_default"}
{"source_id": "518", "title": "Pasta Seca, Lista Y Rellenas", "description": "", "breadcrumbs": "Pastas Secas > 500g", "price_raw": "990.0", "currency_raw": "", "url": "", "seller": "Desconocido", "availability": "unknown", "country": "UNKNOWN", "product_name": "Pasta Seca, Lista Y Rellenas", "brand": "Pastas Secas", "reference": "", "unit": "500g", "price_amount": 990.0, "price_currency": "", "price_symbol": "$", "price_text": "$990,00", "price_amount_filled": "990.0", "price_is_imputed": "False", "price_imputation_source": "original", "price_amount_usd": "990.0", "price_amount_usd_filled": "990.0", "fx_rate_local_per_usd": "1.0", "fx_source": "default_1usd", "information_text": "", "description_text": "", "features_text": "MARCA | : LUCCHETTI | Últimos consultados | NO ACUMULABLE CON OTRAS PROMOS | Azúcar AZUCEL 1kg | Ver planes de cuotas | Azúcar Organica Sugar Pot 800g | Azúcar Cristal Uniao 1kg | Azúcar La Perla 1 Kg | Azúcar Superior Real LEDESMA 1kg", "specifications_text": "", "benefits_text": "", "details_text": "", "other_sections": "", "sections": {"Características": ["MARCA", ": LUCCHETTI", "Últimos consultados", "NO ACUMULABLE CON OTRAS PROMOS", "Azúcar AZUCEL 1kg", "Ver planes de cuotas", "Azúcar Organica Sugar Pot 800g", "Azúcar Cristal Uniao 1kg", "Azúcar La Perla 1 Kg", "Azúcar Superior Real LEDESMA 1kg"]}, "txt_path": "dataset/txt_limpios/518.txt", "html_path": "dataset/paginas_descargadas/518.html", "es_status": "EN", "category_canonical": "pasta seca", "decision": "keep", "match_score": 0.6, "reasons": "heuristic_default"}
{"source_id": "519", "title": "Pasta Seca, Lista Y Rellenas", "description": "", "breadcrumbs": "Pastas Secas > 500g", "price_raw": "975.0", "currency_raw": "", "url": "", "seller": "Desconocido", "availability": "unknown", "country": "UNKNOWN", "product_name": "Pasta Seca, Lista Y Rellenas", "brand": "Pastas Secas", "reference": "", "unit": "500g", "price_amount": 975.0, "price_currency": "", "price_symbol": "$", "price_text": "$975,00", "price_amount_filled": "975.0", "price_is_imputed": "False", "price_imputation_source": "original", "price_amount_usd": "975.0", "price_amount_usd_filled": "975.0", "fx_rate_local_per_usd": "1.0", "fx_source": "default_1usd", "information_text": "", "description_text": "", "features_text": "MARCA | : MATARAZZO | Últimos consultados | 35%DTO | Fideos Tallarin N5 Lucchetti 500g | PRECIO CON 35%DTO | Ver planes de cuotas | NO ACUMULABLE CON OTRAS PROMOS | Azúcar AZUCEL 1kg | Azúcar Organica Sugar Pot 800g | Azúcar Cristal Uniao 1kg | Azúcar La Perla 1 Kg", "specifications_text": "", "benefits_text": "", "details_text": "", "other_sections": "", "sections": {"Características": ["MARCA", ": MATARAZZO", "Últimos consultados", "35%DTO", "Fideos Tallarin N5 Lucchetti 500g", "PRECIO CON 35%DTO", "Ver planes de cuotas", "NO ACUMULABLE CON OTRAS PROMOS", "Azúcar AZUCEL 1kg", "Azúcar Organica Sugar Pot 800g", "Azúcar Cristal Uniao 1kg", "Azúcar La Perla 1 Kg"]}, "txt_path": "dataset/txt_limpios/519.txt", "html_path": "dataset/paginas_descargadas/519.html", "es_status": "EN", "category_canonical": "pasta seca", "decision": "keep", "match_score": 0.6, "reasons": "heuristic_default"}
{"source_id": "520", "title": "Pasta Seca, Lista Y Rellenas", "description": "", "breadcrumbs": "Pastas Secas > 500 GR", "price_raw": "1137.5", "currency_raw": "", "url": "", "seller": "Desconocido", "availability": "unknown", "country": "UNKNOWN", "product_name": "Pasta Seca, Lista Y Rellenas", "brand": "Pastas Secas", "reference": "", "unit": "500 GR", "price_amount": 1137.5, "price_currency": "", "price_symbol": "$", "price_text": "$1.137,50", "price_amount_filled": "1137.5", "price_is_imputed": "False", "price_imputation_source": "original", "price_amount_usd": "1137.5", "price_amount_usd_filled": "1137.5", "fx_rate_local_per_usd": "1.0", "fx_source": "default_1usd", "information_text": "", "description_text": "", "features_text": "TIPO DE PASTA | : ESPAGUETI | MARCA | : BARILLA | AL HUEVO | : NO | RELLENA | TIPO DE ENVASE | : CAJA | PESO | : 500 GR | SIN TACC | Últimos consultados | 35%DTO | Fideos Tallarin N° 5 Matarazzo 500g | PRECIO CON 35%DTO | Ver planes de cuotas | Fideos Tallarin N5 Lucchetti 500g | NO ACUMULABLE CON OTRAS PROMOS | Azúcar AZUCEL 1kg | Azúcar Organica Sugar Pot 800g | Azúcar Cristal Uniao 1kg", "specifications_text": "", "benefits_text": "", "details_text": "", "other_sections": "", "sections": {"Características": ["TIPO DE PASTA", ": ESPAGUETI", "MARCA", ": BARILLA", "AL HUEVO", ": NO", "RELLENA", "TIPO DE ENVASE", ": CAJA", "PESO", ": 500 GR", "SIN TACC", "Últimos consultados", "35%DTO", "Fideos Tallarin N° 5 Matarazzo 500g", "PRECIO CON 35%DTO", "Ver planes de cuotas", "Fideos Tallarin N5 Lucchetti 500g", "NO ACUMULABLE CON OTRAS PROMOS", "Azúcar AZUCEL 1kg", "Azúcar Organica Sugar Pot 800g", "Azúcar Cristal Uniao 1kg"]}, "txt_path": "dataset/txt_limpios/520.txt", "html_path": "dataset/paginas_descargadas/520.html", "es_status": "EN", "category_canonical": "pasta seca", "decision": "keep", "match_score": 0.6, "reasons": "heuristic_default"}
{"source_id": "521", "title": "Pasta Seca, Lista Y Rellenas", "description": "", "breadcrumbs": "Pastas Secas > 500 Gr", "price_raw": "4224.35", "currency_raw": "", "url": "", "seller": "Desconocido", "availability": "unknown", "country": "UNKNOWN", "product_name": "Pasta Seca, Lista Y Rellenas", "brand": "Pastas Secas", "reference": "", "unit": "500 Gr", "price_amount": 4224.35, "price_currency": "", "price_symbol": "$", "price_text": "$4.224,35", "price_amount_filled": "4224.35", "price_is_imputed": "False", "price_imputation_source": "original", "price_amount_usd": "4224.35", "price_amount_usd_filled": "4224.35", "fx_rate_local_per_usd": "1.0", "fx_source": "default_1usd", "information_text": "", "description_text": "", "features_text": "MARCA | : DELVERDE | SIN TACC | : NO | Últimos consultados | 35%DTO | Espagueti BARILLA Caja 500 Gr | PRECIO CON 35%DTO | Ver planes de cuotas | Fideos Tallarin N° 5 Matarazzo 500g | Fideos Tallarin N5 Lucchetti 500g | NO ACUMULABLE CON OTRAS PROMOS | Azúcar AZUCEL 1kg | Azúcar Organica Sugar Pot 800g", "specifications_text": "", "benefits_text": "", "details_text": "", "other_sections": "", "sections": {"Características": ["MARCA", ": DELVERDE", "SIN TACC", ": NO", "Últimos consultados", "35%DTO", "Espagueti BARILLA Caja 500 Gr", "PRECIO CON 35%DTO", "Ver planes de cuotas", "Fideos Tallarin N° 5 Matarazzo 500g", "Fideos Tallarin N5 Lucchetti 500g", "NO ACUMULABLE CON OTRAS PROMOS", "Azúcar AZUCEL 1kg", "Azúcar Organica Sugar Pot 800g"]}, "txt_path": "dataset/txt_limpios/521.txt", "html_path": "dataset/paginas_descargadas/521.html", "es_status": "EN", "category_canonical": "pasta seca", "decision": "keep", "match_score": 0.6, "reasons": "heuristic_default"}
{"source_id": "522", "title": "Pasta Seca, Lista Y Rellenas", "description": "", "breadcrumbs": "Pastas Secas > 500 GR", "price_raw": "4088.5", "currency_raw": "", "url": "", "seller": "Desconocido", "availability": "unknown", "country": "UNKNOWN", "product_name": "Pasta Seca, Lista Y Rellenas", "brand": "Pastas Secas", "reference": "", "unit": "500 GR", "price_amount": 4088.5, "price_currency": "", "price_symbol": "$", "price_text": "$4.088,50", "price_amount_filled": "4088.5", "price_is_imputed": "False", "price_imputation_source": "original", "price_amount_usd": "4088.5", "price_amount_usd_filled": "4088.5", "fx_rate_local_per_usd": "1.0", "fx_source": "default_1usd", "information_text": "", "description_text": "", "features_text": "TIPO DE PASTA | : ESPAGUETI | MARCA | : FAVORITA | AL HUEVO | : NO | RELLENA | PESO | : 500 GR | SIN TACC | Últimos consultados | 35%DTO | Fid.Lar.Sem Spaghetti Nuev Delverde Paq 500 Grm | PRECIO CON 35%DTO | Ver planes de cuotas | Espagueti BARILLA Caja 500 Gr | Fideos Tallarin N° 5 Matarazzo 500g | Fideos Tallarin N5 Lucchetti 500g | NO ACUMULABLE CON OTRAS PROMOS | Azúcar AZUCEL 1kg", "specifications_text": "", "benefits_text": "", "details_text": "", "other_sections": "", "sections": {"Características": ["TIPO DE PASTA", ": ESPAGUETI", "MARCA", ": FAVORITA", "AL HUEVO", ": NO", "RELLENA", "PESO", ": 500 GR", "SIN TACC", "Últimos consultados", "35%DTO", "Fid.Lar.Sem Spaghetti Nuev Delverde Paq 500 Grm", "PRECIO CON 35%DTO", "Ver planes de cuotas", "Espagueti BARILLA Caja 500 Gr", "Fideos Tallarin N° 5 Matarazzo 500g", "Fideos Tallarin N5 Lucchetti 500g", "NO ACUMULABLE CON OTRAS PROMOS", "Azúcar AZUCEL 1kg"]}, "txt_path": "dataset/txt_limpios/522.txt", "html_path": "dataset/paginas_descargadas/522.html", "es_status": "EN", "category_canonical": "pasta seca", "decision": "keep", "match_score": 0.6, "reasons": "heuristic_default"}
{"source_id": "926", "title": "Pasta spaghetti integral", "description": "Pasta spaghetti integral Carozzi 400 g", "breadcrumbs": "400 g > 400 g", "price_raw": "950.0", "currency_raw": "", "url": "", "seller": "Desconocido", "availability": "unknown", "country": "UNKNOWN", "product_name": "Pasta spaghetti integral", "brand": "400 g", "reference": "", "unit": "400 g", "price_amount": 950.0, "price_currency": "", "price_symbol": "$", "price_text": "$950", "price_amount_filled": "950.0", "price_is_imputed": "False", "price_imputation_source": "original", "price_amount_usd": "950.0", "price_amount_usd_filled": "950.0", "fx_rate_local_per_usd": "1.0", "fx_source": "default_1usd", "information_text": "", "description_text": "Pasta spaghetti integral Carozzi 400 g", "features_text": "", "specifications_text": "", "benefits_text": "", "details_text": "", "other_sections": "", "sections": {"Descripción": ["Pasta spaghetti integral Carozzi 400 g"]}, "txt_path": "dataset/txt_limpios/926.txt", "html_path": "dataset/paginas_descargadas/926.html", "es_status": "EN", "category_canonical": "sin_categoria", "decision": "discard", "match_score": 0.3, "reasons": "no_category_detected"}
{"source_id": "923", "title": "Pasta spaghetti n°5", "description": "Pasta spaghetti N°5 Lucchetti 400 g", "breadcrumbs": "400 g > 400 g", "price_raw": "680.0", "currency_raw": "", "url": "", "seller": "Desconocido", "availability": "unknown", "country": "UNKNOWN", "product_name": "Pasta spaghetti n°5", "brand": "400 g", "reference": "", "unit": "400 g", "price_amount": 680.0, "price_currency": "", "price_symbol": "$", "price_text": "$680", "price_amount_filled": "680.0", "price_is_imputed": "False", "price_imputation_source": "original", "price_amount_usd": "680.0", "price_amount_usd_filled": "680.0", "fx_rate_local_per_usd": "1.0", "fx_source": "default_1usd", "information_text": "", "description_text": "Pasta spaghetti N°5 Lucchetti 400 g", "features_text": "", "specifications_text": "", "benefits_text": "", "details_text": "", "other_sections": "", "sections": {"Descripción": ["Pasta spaghetti N°5 Lucchetti 400 g"]}, "txt_path": "dataset/txt_limpios/923.txt", "html_path": "dataset/paginas_descargadas/923.html", "es_status": "EN", "category_canonical": "sin_categoria", "decision": "discard", "match_score": 0.3, "reasons": "no_category_detected"}
{"source_id": "925", "title": "Pasta spaghetti n°5", "description": "Pasta spaghetti N°5 Merkat 400 g", "breadcrumbs": "400 g > 400 g", "price_raw": "470.0", "currency_raw": "", "url": "", "seller": "Desconocido", "availability": "unknown", "country": "UNKNOWN", "product_name": "Pasta spaghetti n°5", "brand": "400 g", "reference": "", "unit": "400 g", "price_amount": 470.0, "price_currency": "", "price_symbol": "$", "price_text": "$470", "price_amount_filled": "470.0", "price_is_imputed": "False", "price_imputation_source": "original", "price_amount_usd": "470.0", "price_amount_usd_filled": "470.0", "fx_rate_local_per_usd": "1.0", "fx_source": "default_1usd", "information_text": "", "description_text": "Pasta spaghetti N°5 Merkat 400 g", "features_text": "", "specifications_text": "", "benefits_text": "", "details_text": "", "other_sections": "", "sections": {"Descripción": ["Pasta spaghetti N°5 Merkat 400 g"]}, "txt_path": "dataset/txt_limpios/925.txt", "html_path": "dataset/paginas_descargadas/925.html", "es_status": "EN", "category_canonical": "sin_categoria", "decision": "discard", "match_score": 0.3, "reasons": "no_category_detected"}
{"source_id": "924", "title": "Pasta spaghetti n°5 al huevo", "description": "Pasta spaghetti N°5 Talliani al huevo 400 g", "breadcrumbs": "400 g > 400 g", "price_raw": "1.22", "currency_raw": "", "url": "", "seller": "Desconocido", "availability": "unknown", "country": "UNKNOWN", "product_name": "Pasta spaghetti n°5 al huevo", "brand": "400 g", "reference": "", "unit": "400 g", "price_amount": 1.22, "price_currency": "", "price_symbol": "$", "price_text": "$1.22", "price_amount_filled": "1.22", "price_is_imputed": "False", "price_imputation_source": "original", "price_amount_usd": "1.22", "price_amount_usd_filled": "1.22", "fx_rate_local_per_usd": "1.0", "fx_source": "default_1usd", "information_text": "", "description_text": "Pasta spaghetti N°5 Talliani al huevo 400 g", "features_text": "", "specifications_text": "", "benefits_text": "", "details_text": "", "other_sections": "", "sections": {"Descripción": ["Pasta spaghetti N°5 Talliani al huevo 400 g"]}, "txt_path": "dataset/txt_limpios/924.txt", "html_path": "dataset/paginas_descargadas/924.html", "es_status": "EN", "category_canonical": "huevo", "decision": "discard", "match_score": 0.3, "reasons": "heuristic_default"}
{"source_id": "910", "title": "Pechuga deshuesada de pollo co...", "description": "Pechuga deshuesada pollo iqf", "breadcrumbs": "4.5 Kg > 4.5 Kg", "price_raw": "", "currency_raw": "", "url": "", "seller": "Desconocido", "availability": "unknown", "country": "UNKNOWN", "product_name": "Pechuga deshuesada de pollo co...", "brand": "4.5 Kg", "reference": "", "unit": "4.5 Kg", "price_amount": null, "price_currency": "", "price_symbol": "", "price_text": "", "price_amount_filled": "234.19", "price_is_imputed": "True", "price_imputation_source": "country_mean", "price_amount_usd": "", "price_amount_usd_filled": "234.1938", "fx_rate_local_per_usd": "1.0", "fx_source": "default_1usd", "information_text": "", "description_text": "Pechuga deshuesada pollo iqf", "features_text": "", "specifications_text": "", "benefits_text": "", "details_text": "", "other_sections": "", "sections": {"Descripción": ["Pechuga deshuesada pollo iqf"]}, "txt_path": "dataset/txt_limpios/910.txt", "html_path": "dataset/paginas_descargadas/910.html", "es_status": "EN", "category_canonical": "sin_categoria", "decision": "discard", "match_score": 0.3, "reasons": "no_category_detected;price_parse_failed"}
{"source_id": "1562", "title": "Pratos Prontos e Massas Frescas", "description": "", "breadcrumbs": "Massas Frescas > 500g", "price_raw": "9.49", "currency_raw": "BRL", "url": "", "seller": "Desconocido", "availability": "unknown", "country": "BR", "product_name": "Pratos Prontos e Massas Frescas", "brand": "Massas Frescas", "reference": "", "unit": "500g", "price_amount": 9.49, "price_currency": "BRL", "price_symbol": "R$", "price_text": "R$9,49", "price_amount_filled": "9.49", "price_is_imputed": "False", "price_imputation_source": "original", "price_amount_usd": "1.7419", "price_amount_usd_filled": "1.7419", "fx_rate_local_per_usd": "5.448", "fx_source": "from_brasil_cambio_dolar", "information_text": "", "description_text": "", "features_text": "", "specifications_text": "", "benefits_text": "", "details_text": "", "other_sections": "", "sections": {}, "txt_path": "dataset/txt_limpios/1562.txt", "html_path": "dataset/paginas_descargadas/1562.html", "es_status": "EN", "category_canonical": "sin_categoria", "decision": "discard", "match_score": 0.3, "reasons": "no_category_detected"}
{"source_id": "203", "title": "Pratos Prontos e Massas Frescas", "description": "", "breadcrumbs": "Massas Frescas > 500g", "price_raw": "10.79", "currency_raw": "BRL", "url": "", "seller": "Desconocido", "availability": "unknown", "country": "BR", "product_name": "Pratos Prontos e Massas Frescas", "brand": "Massas Frescas", "reference": "", "unit": "500g", "price_amount": 10.79, "price_currency": "BRL", "price_symbol": "R$", "price_text": "R$10,79", "price_amount_filled": "10.79", "price_is_imputed": "False", "price_imputation_source": "original", "price_amount_usd": "1.9805", "price_amount_usd_filled": "1.9805", "fx_rate_local_per_usd": "5.448", "fx_source": "from_brasil_cambio_dolar", "information_text": "", "description_text": "", "features_text": "", "specifications_text": "", "benefits_text": "", "details_text": "", "other_sections": "", "sections": {}, "txt_path": "dataset/txt_limpios/203.txt", "html_path": "dataset/paginas_descargadas/203.html", "es_status": "EN", "category_canonical": "sin_categoria", "decision": "discard", "match_score": 0.3, "reasons": "no_category_detected"}
{"source_id": "280", "title": "Preços no Site e App podem ser diferentes das Lojas Físicas.", "description": "", "breadcrumbs": "Shipping > 1 Kg", "price_raw": "1.0", "currency_raw": "", "url": "", "seller": "Desconocido", "availability": "unknown", "country": "UNKNOWN", "product_name": "Preços no Site e App podem ser diferentes das Lojas Físicas.", "brand": "Shipping", "reference": "", "unit": "1 Kg", "price_amount": 1.0, "price_currency": "", "price_symbol": "r", "price_text": "r1", "price_amount_filled": "1.0", "price_is_imputed": "False", "price_imputation_source": "original", "price_amount_usd": "1.0", "price_amount_usd_filled": "1.0", "fx_rate_local_per_usd": "1.0", "fx_source": "default_1usd", "information_text": "", "description_text": "", "features_text": "", "specifications_text": "", "benefits_text": "", "details_text": "", "other_sections": "", "sections": {}, "txt_path": "dataset/txt_limpios/280.txt", "html_path": "dataset/paginas_descargadas/280.html", "es_status": "EN", "category_canonical": "sin_categoria", "decision": "discard", "match_score": 0.3, "reasons": "no_category_detected"}
