{"source_id": "206", "title": "Padaria e Matinais", "description": "", "breadcrumbs": "Leites > 1L", "price_raw": "6.09", "currency_raw": "BRL", "url": "", "seller": "Desconocido", "availability": "unknown", "country": "BR", "product_name": "Padaria e Matinais", "brand": "Leites", "reference": "", "unit": "1L", "price_amount": 6.09, "price_currency": "BRL", "price_symbol": "R$", "price_text": "R$6,09", "price_amount_filled": "6.09", "price_is_imputed": "False", "price_imputation_source": "original", "price_amount_usd": "1.1178", "price_amount_usd_filled": "1.1178", "fx_rate_local_per_usd": "5.448", "fx_source": "from_brasil_cambio_dolar", "information_text": "", "description_text": "", "features_text": "", "specifications_text": "", "benefits_text": "", "details_text": "", "other_sections": "", "sections": {}, "txt_path": "dataset/txt_limpios/206.txt", "html_path": "dataset/paginas_descargadas/206.html", "es_status": "EN", "category_canonical": "sin_categoria", "decision": "discard", "match_score": 0.3, "reasons": "no_category_detected"}
{"source_id": "207", "title": "Padaria e Matinais", "description": "", "breadcrumbs": "Leites > 1 L", "price_raw": "4.79", "currency_raw": "BRL", "url": "", "seller": "Desconocido", "availability": "unknown", "country": "BR", "product_name": "Padaria e Matinais", "brand": "Leites", "reference": "", "unit": "1 L", "price_amount": 4.79, "price_currency": "BRL", "price_symbol": "R$", "price_text": "R$4,79", "price_amount_filled": "4.79", "price_is_imputed": "False", "price_imputation_source": "original", "price_amount_usd": "0.8792", "price_amount_usd_filled": "0.8792", "fx_rate_local_per_usd": "5.448", "fx_source": "from_brasil_cambio_dolar", "information_text": "", "description_text": "", "features_text": "", "specifications_text": "", "benefits_text": "", "details_text": "", "other_sections": "", "sections": {}, "txt_path": "dataset/txt_limpios/207.txt", "html_path": "dataset/paginas_descargadas/207.html", "es_status": "EN", "category_canonical": "sin_categoria", "decision": "discard", "match_score": 0.3, "reasons": "no_category_detected"}
{"source_id": "208", "title": "Padaria e Matinais", "description": "", "breadcrumbs": "Leites > 1 L", "price_raw": "", "currency_raw": "", "url": "", "seller": "Desconocido", "availability": "unknown", "country": "UNKNOWN", "product_name": "Padaria e Matinais", "brand": "Leites", "reference": "", "unit": "1 L", "price_amount": null, "price_currency": "", "price_symbol": "", "price_text": "", "price_amount_filled": "234.19", "price_is_imputed": "True", "price_imputation_source": "country_mean", "price_amount_usd": "", "price_amount_usd_filled": "234.1938", "fx_rate_local_per_usd": "1.0", "fx_source": "default_1usd", "information_text": "", "description_text": "", "features_text": "", "specifications_text": "", "benefits_text": "", "details_text": "", "other_sections": "", "sections": {}, "txt_path": "dataset/txt_limpios/208.txt", "html_path": "dataset/paginas_descargadas/208.html", "es_status": "EN", "category_canonical": "sin_categoria", "decision": "discard", "match_score": 0.3, "reasons": "no_category_detected;price_parse_failed"}
{"source_id": "209", "title": "Padaria e Matinais", "description": "", "breadcrumbs": "Leites > 1L", "price_raw": "", "currency_raw": "", "url": "", "seller": "Desconocido", "availability": "unknown", "country": "UNKNOWN", "product_name": "Padaria e Matinais", "brand": "Leites", "reference": "", "unit": "1L", "price_amount": null, "price_currency": "", "price_symbol": "", "price_text": "", "price_amount_filled": "234.19", "price_is_imputed": "True", "price_imputation_source": "country_mean", "price_amount_usd": "", "price_amount_usd_filled": "234.1938", "fx_rate_local_per_usd": "1.0", "fx_source": "default_1usd", "information_text": "", "description_text": "", "features_text": "", "specifications_text": "", "benefits_text": "", "details_text": "", "other_sections": "", "sections": {}, "txt_path": "dataset/txt_limpios/209.txt", "html_path": "dataset/paginas_descargadas/209.html", "es_status": "EN", "category_canonical": "sin_categoria", "decision": "discard", "match_score": 0.3, "reasons": "no_category_detected;price_parse_failed"}
{"source_id": "1351", "title": "PAN MOLDE BLANCO FLOR DE ORO 550 G", "description": "¿Deseas recibir notificaciones? Remind me later Permitir Thank you! Please check your email inbox to confirm. Oops! Notifications are disabled.", "breadcrumbs": "Comparar > 550 G", "price_raw": "1.05", "currency_raw": "USD", "url": "", "seller": "Desconocido", "availability": "unknown", "country": "US", "product_name": "PAN MOLDE BLANCO FLOR DE ORO 550 G", "brand": "Comparar", "reference": "", "unit": "550 G", "price_amount": 1.05, "price_currency": "USD", "price_symbol": "$", "price_text": "$1,05", "price_amount_filled": "1.05", "price_is_imputed": "False", "price_imputation_source": "original", "price_amount_usd": "1.05", "price_amount_usd_filled": "1.05", "fx_rate_local_per_usd": "1.0", "fx_source": "default_1usd", "information_text": "¿Deseas recibir notificaciones? Remind me later Permitir Thank you! Please check your email inbox to confirm. Oops! Notifications are disabled.", "description_text": "", "features_text": "", "specifications_text": "", "benefits_text": "", "details_text": "", "other_sections": "", "sections": {"Información": ["¿Deseas recibir notificaciones?", "Remind me later", "Permitir", "Thank you! Please check your email inbox to confirm.", "Oops! Notifications are disabled."]}, "txt_path": "dataset/txt_limpios/1351.txt", "html_path": "dataset/paginas_descargadas/1351.html", "es_status": "EN", "category_canonical": "pan", "decision": "keep", "match_score": 0.6, "reasons": "heuristic_default"}
{"source_id": "1352", "title": "PAN MOLDE BLANCO MODERNA 550 G", "description": "Ficha técnica Pan molde blanco Moderna 550 g ¿Deseas recibir notificaciones? Remind me later Permitir Thank you! Please check your email inbox to confirm. ¡Oops! Notifications are disabled.", "breadcrumbs": "Comparar > 550 G", "price_raw": "1.59", "currency_raw": "USD", "url": "", "seller": "Desconocido", "availability": "unknown", "country": "US", "product_name": "PAN MOLDE BLANCO MODERNA 550 G", "brand": "Comparar", "reference": "", "unit": "550 G", "price_amount": 1.59, "price_currency": "USD", "price_symbol": "$", "price_text": "$1,59", "price_amount_filled": "1.59", "price_is_imputed": "False", "price_imputation_source": "original", "price_amount_usd": "1.59", "price_amount_usd_filled": "1.59", "fx_rate_local_per_usd": "1.0", "fx_source": "default_1usd", "information_text": "Ficha técnica Pan molde blanco Moderna 550 g ¿Deseas recibir notificaciones? Remind me later Permitir Thank you! Please check your email inbox to confirm. ¡Oops! Notifications are disabled.", "description_text": "", "features_text": "", "specifications_text": "", "benefits_text": "", "details_text": "", "other_sections": "", "sections": {"Información": ["Ficha técnica", "Pan molde blanco  Moderna 550 g", "¿Deseas recibir notificaciones?", "Remind me later", "Permitir", "Thank you! Please check your email inbox to confirm.", "Oops! Notifications are disabled."]}, "txt_path": "dataset/txt_limpios/1352.txt", "html_path": "dataset/paginas_descargadas/1352.html", "es_status": "ET", "category_canonical": "pan", "decision": "keep", "match_score": 0.6, "reasons": "heuristic_default"}
{"source_id": "1350", "title": "PAN MOLDE BLANCO SUPAN 550 G", "description": "¿Deseas recibir notificaciones? Remind me later Permitir Thank you! Please check your email inbox to confirm. Oops! Notifications are disabled.", "breadcrumbs": "Comparar > 550 G", "price_raw": "1.56", "currency_raw": "USD", "url": "", "seller": "Desconocido", "availability": "unknown", "country": "US", "product_name": "PAN MOLDE BLANCO SUPAN 550 G", "brand": "Comparar", "reference": "", "unit": "550 G", "price_amount": 1.56, "price_currency": "USD", "price_symbol": "$", "price_text": "$1,56", "price_amount_filled": "1.56", "price_is_imputed": "False", "price_imputation_source": "original", "price_amount_usd": "1.56", "price_amount_usd_filled": "1.56", "fx_rate_local_per_usd": "1.0", "fx_source": "default_1usd", "information_text": "¿Deseas recibir notificaciones? Remind me later Permitir Thank you! Please check your email inbox to confirm. Oops! Notifications are disabled.", "description_text": "", "features_text": "", "specifications_text": "", "benefits_text": "", "details_text": "", "other_sections": "", "sections": {"Información": ["¿Deseas recibir notificaciones?", "Remind me later", "Permitir", "Thank you! Please check your email inbox to confirm.", "Oops! Notifications are disabled."]}, "txt_path": "dataset/txt_limpios/1350.txt", "html_path": "dataset/paginas_descargadas/1350.html", "es_status": "EN", "category_canonical": "pan", "decision": "keep", "match_score": 0.6, "reasons": "heuristic_default"}
{"source_id": "793", "title": "PAN TAJADO MANTEQUILLA 450G", "description": "Ingredientes | Componentes Nombre del producto: Pan Tajado Mantequilla 450g Descripción del producto: Pan tajado con sabor mantequilla, suave y esponjoso, ideal para acompañar desayunos, meriendas para preparar sándwiches. Elaborado de forma industrial con ingredientes seleccionados para conservar su frescura y sabor. Tamaño: 40cm x 12cm x 10cm Peso: 450 g Modo de fabricación: Industrial Conservación: Después de abierto el empaque, consumir en el menor tiempo posible. Almacenar en un lugar fresco y seco. Origen: Nacional NSA-0007272-2019 Alergenos: Contiene gluten y tartrazina. Puede contener trazas de ajonjolí blanco y/o negro, huevo, leche, soya y sulfitos. Componentes: Harina de trigo fortificada (niacina, hierro, vitamina B1, B2, ácido fólico) Agua Azúcar Aceite de girasol Leudante biológico (levadura) Sal Regulador de acidez (ácido láctico) Emulsionantes (mono y diglicéridos, goma xantana) Conservantes (propionato de calcio, ácido sórbico) Acondicionador de masa (fosfato monocálcico) Mantequilla Enzimas (fúngicas y/o bacterianas) Esencia de mantequilla Color artificial amarillo No 5 Ver más También puede interesarte LECHE ENTERA BOLSA UHT LATTI 900 ML Amor y amistad JAMÓN DE CERDO VIANDÉ 400 GRS SALCHICHA CAMPESTRE VIANDÉ 400 GR LECHE DESLACTOSADA BOLSA UHT LATTI 900ML D1 Top 100 PANELA PASTILLA 1000 G PAN CHIPS DE CHOCOLATE HORNEADITOS 210 G JAMÓN DE CERDO/SAND PREMI VIANDÉ 300 GRS", "breadcrumbs": "Unidades disponibles > 450G", "price_raw": "450.0", "currency_raw": "", "url": "", "seller": "Desconocido", "availability": "unknown", "country": "UNKNOWN", "product_name": "PAN TAJADO MANTEQUILLA 450G", "brand": "Unidades disponibles", "reference": "", "unit": "450G", "price_amount": 450.0, "price_currency": "", "price_symbol": "", "price_text": "450", "price_amount_filled": "450.0", "price_is_imputed": "False", "price_imputation_source": "original", "price_amount_usd": "450.0", "price_amount_usd_filled": "450.0", "fx_rate_local_per_usd": "1.0", "fx_source": "default_1usd", "information_text": "", "description_text": "Ingredientes | Componentes Nombre del producto: Pan Tajado Mantequilla 450g Descripción del producto: Pan tajado con sabor mantequilla, suave y esponjoso, ideal para acompañar desayunos, meriendas para preparar sándwiches. Elaborado de forma industrial con ingredientes seleccionados para conservar su frescura y sabor. Tamaño: 40cm x 12cm x 10cm Peso: 450 g Modo de fabricación: Industrial Conservación: Después de abierto el empaque, consumir en el menor tiempo posible. Almacenar en un lugar fresco y seco. Origen: Nacional NSA-0007272-2019 Alergenos: Contiene gluten y tartrazina. Puede contener trazas de ajonjolí blanco y/o negro, huevo, leche, soya y sulfitos. Componentes: Harina de trigo fortificada (niacina, hierro, vitamina B1, B2, ácido fólico) Agua Azúcar Aceite de girasol Leudante biológico (levadura) Sal Regulador de acidez (ácido láctico) Emulsionantes (mono y diglicéridos, goma xantana) Conservantes (propionato de calcio, ácido sórbico) Acondicionador de masa (fosfato monocálcico) Mantequilla Enzimas (fúngicas y/o bacterianas) Esencia de mantequilla Color artificial amarillo No 5 Ver más También puede interesarte LECHE ENTERA BOLSA UHT LATTI 900 ML Amor y amistad JAMÓN DE CERDO VIANDÉ 400 GRS SALCHICHA CAMPESTRE VIANDÉ 400 GR LECHE DESLACTOSADA BOLSA UHT LATTI 900ML D1 Top 100 PANELA PASTILLA 1000 G PAN CHIPS DE CHOCOLATE HORNEADITOS 210 G JAMÓN DE CERDO/SAND PREMI VIANDÉ 300 GRS", "features_text": "", "specifications_text": "", "benefits_text": "", "details_text": "", "other_sections": "", "sections": {"Descripción": ["Ingredientes | Componentes", "Nombre del producto: Pan Tajado Mantequilla 450g", "Descripción del producto: Pan tajado con sabor mantequilla, suave y esponjoso, ideal para acompañar desayunos, meriendas para preparar sándwiches. Elaborado de forma industrial con ingredientes seleccionados para conservar su frescura y sabor.", "Tamaño: 40cm x 12cm x 10cm", "Peso: 450 g", "Modo de fabricación: Industrial", "Conservación: Después de abierto el empaque, consumir en el menor tiempo posible. Almacenar en un lugar fresco y seco.", "Origen: Nacional", "NSA-0007272-2019", "Alergenos: Contiene gluten y tartrazina. Puede contener trazas de ajonjolí blanco y/o negro, huevo, leche, soya y sulfitos.", "Componentes: Harina de trigo fortificada (niacina, hierro, vitamina B1, B2, ácido fólico)", "Agua", "Azúcar", "Aceite de girasol", "Leudante biológico (levadura)", "Sal", "Regulador de acidez (ácido láctico)", "Emulsionantes (mono y diglicéridos, goma xantana)", "Conservantes (propionato de calcio, ácido sórbico)", "Acondicionador de masa (fosfato monocálcico)", "Mantequilla", "Enzimas (fúngicas y/o bacterianas)", "Esencia de mantequilla", "Color artificial amarillo N.º 5", "Ver más", "También puede interesarte", "LECHE ENTERA BOLSA UHT LATTI 900 ML", "Amor y amistad", "JAMÓN DE CERDO VIANDÉ 400 GRS", "SALCHICHA CAMPESTRE VIANDÉ 400 GR", "LECHE DESLACTOSADA BOLSA UHT LATTI 900ML", "D1 Top 100", "PANELA PASTILLA 1000 G", "PAN CHIPS DE CHOCOLATE HORNEADITOS 210 G", "JAMÓN DE CERDO/SAND PREMI VIANDÉ 300 GRS"]}, "txt_path": "dataset/txt_limpios/793.txt", "html_path": "dataset/paginas_descargadas/793.html", "es_status": "ET", "category_canonical": "leche", "decision": "keep", "match_score": 0.6, "reasons": "heuristic_default"}
{"source_id": "792", "title": "PAN TAJADO MULTIGRANOS 450 G", "description": "Ingredientes | Componentes Nombre del producto: Pan Tajado Multigranos 450 g Descripción del producto: El Pan Tajado Multigranos es una deliciosa opción para quienes buscan un pan más nutritivo. Su textura suave y su mezcla única de ingredientes hacen de este pan una opción ideal para tu día a día. Tamaño: 37 cm x 13 cm x 10 cm Peso: 450 g Modo de fabricación: Industrial Conservación: Conservar el producto dentro del embalaje bien cerrado, en un lugar limpio, fresco y seco, alejado de sustancias que puedan interferir en las características propias del mismo. Después de abierto el empaque, consumir en el menor tiempo posible. Origen: Nacional NSA-0007272-2019 Alergenos: Contiene gluten. Puede contener trazas de leche, huevo, soya y sulfitos. Componentes: Harina de trigo fortificada (niacina, hierro, vitamina B1, vitamina B2, ácido fólico) Harina de trigo integral fortificada (niacina, hierro, vitamina B1, vitamina B2, ácido fólico) Agua Azúcar Uvas pasas Levadura Salvado de trigo Aceite de girasol Harina de centeno Semillas de chía Sal Sustituto de sodio (cloruro de potasio) Masa madre Regulador de acidez (ácido láctico) Conservantes (propionato de calcio, ácido sórbico) Emulsificantes (mono y diglicéridos y goma xantana) Acondicionador de masa (fosfato monocálcico) Enzimas (fúngicas y/o bacterianas) Esencia de vainilla Decorado con ajonjolí blanco, negro y hojuelas de avena Ver más También puede interesarte AREPA DE MAÍZ INTEGRAL MULTIGRANOS 400 G PAN MULTIGRANOS NATRI 0 AZUCAR 450 G Nuevo TOSTADA INTEGRAL NATRI 110 GRS TOMATE CHERRY 250 GR YOGURT GRIEGO NATURAL VITA LATTI 850 GR CHAMPIÑON 250 GR Amor y amistad JAMON DE PAVO FINAS HIERBAS BROCOLI CONGELADO COOLTIVO 500G ESPINACA X 200G JAMON PECHUGA PAVO WHITE HOLLAND X 230 G", "breadcrumbs": "Unidades disponibles > 450 G", "price_raw": "450.0", "currency_raw": "", "url": "", "seller": "Desconocido", "availability": "unknown", "country": "UNKNOWN", "product_name": "PAN TAJADO MULTIGRANOS 450 G", "brand": "Unidades disponibles", "reference": "", "unit": "450 G", "price_amount": 450.0, "price_currency": "", "price_symbol": "", "price_text": "450", "price_amount_filled": "450.0", "price_is_imputed": "False", "price_imputation_source": "original", "price_amount_usd": "450.0", "price_amount_usd_filled": "450.0", "fx_rate_local_per_usd": "1.0", "fx_source": "default_1usd", "information_text": "", "description_text": "Ingredientes | Componentes Nombre del producto: Pan Tajado Multigranos 450 g Descripción del producto: El Pan Tajado Multigranos es una deliciosa opción para quienes buscan un pan más nutritivo. Su textura suave y su mezcla única de ingredientes hacen de este pan una opción ideal para tu día a día. Tamaño: 37 cm x 13 cm x 10 cm Peso: 450 g Modo de fabricación: Industrial Conservación: Conservar el producto dentro del embalaje bien cerrado, en un lugar limpio, fresco y seco, alejado de sustancias que puedan interferir en las características propias del mismo. Después de abierto el empaque, consumir en el menor tiempo posible. Origen: Nacional NSA-0007272-2019 Alergenos: Contiene gluten. Puede contener trazas de leche, huevo, soya y sulfitos. Componentes: Harina de trigo fortificada (niacina, hierro, vitamina B1, vitamina B2, ácido fólico) Harina de trigo integral fortificada (niacina, hierro, vitamina B1, vitamina B2, ácido fólico) Agua Azúcar Uvas pasas Levadura Salvado de trigo Aceite de girasol Harina de centeno Semillas de chía Sal Sustituto de sodio (cloruro de potasio) Masa madre Regulador de acidez (ácido láctico) Conservantes (propionato de calcio, ácido sórbico) Emulsificantes (mono y diglicéridos y goma xantana) Acondicionador de masa (fosfato monocálcico) Enzimas (fúngicas y/o bacterianas) Esencia de vainilla Decorado con ajonjolí blanco, negro y hojuelas de avena Ver más También puede interesarte AREPA DE MAÍZ INTEGRAL MULTIGRANOS 400 G PAN MULTIGRANOS NATRI 0 AZUCAR 450 G Nuevo TOSTADA INTEGRAL NATRI 110 GRS TOMATE CHERRY 250 GR YOGURT GRIEGO NATURAL VITA LATTI 850 GR CHAMPIÑON 250 GR Amor y amistad JAMON DE PAVO FINAS HIERBAS BROCOLI CONGELADO COOLTIVO 500G ESPINACA X 200G JAMON PECHUGA PAVO WHITE HOLLAND X 230 G", "features_text": "", "specifications_text": "", "benefits_text": "", "details_text": "", "other_sections": "", "sections": {"Descripción": ["Ingredientes | Componentes", "Nombre del producto: Pan Tajado Multigranos 450 g", "Descripción del producto: El Pan Tajado Multigranos es una deliciosa opción para quienes buscan un pan más nutritivo. Su textura suave y su mezcla única de ingredientes hacen de este pan una opción ideal para tu día a día.", "Tamaño: 37 cm x 13 cm x 10 cm", "Peso: 450 g", "Modo de fabricación: Industrial", "Conservación: Conservar el producto dentro del embalaje bien cerrado, en un lugar limpio, fresco y seco, alejado de sustancias que puedan interferir en las características propias del mismo. Después de abierto el empaque, consumir en el menor tiempo posible.", "Origen: Nacional", "NSA-0007272-2019", "Alergenos: Contiene gluten. Puede contener trazas de leche, huevo, soya y sulfitos.", "Componentes: Harina de trigo fortificada (niacina, hierro, vitamina B1, vitamina B2, ácido fólico)", "Harina de trigo integral fortificada (niacina, hierro, vitamina B1, vitamina B2, ácido fólico)", "Agua", "Azúcar", "Uvas pasas", "Levadura", "Salvado de trigo", "Aceite de girasol", "Harina de centeno", "Semillas de chía", "Sal", "Sustituto de sodio (cloruro de potasio)", "Masa madre", "Regulador de acidez (ácido láctico)", "Conservantes (propionato de calcio, ácido sórbico)", "Emulsificantes (mono y diglicéridos y goma xantana)", "Acondicionador de masa (fosfato monocálcico)", "Enzimas (fúngicas y/o bacterianas)", "Esencia de vainilla", "Decorado con ajonjolí blanco, negro y hojuelas de avena", "Ver más", "También puede interesarte", "AREPA DE MAÍZ INTEGRAL MULTIGRANOS 400 G", "PAN MULTIGRANOS NATRI 0 AZUCAR 450 G", "Nuevo", "TOSTADA INTEGRAL NATRI 110 GRS", "TOMATE CHERRY 250 GR", "YOGURT GRIEGO NATURAL VITA LATTI 850 GR", "CHAMPIÑON 250 GR", "Amor y amistad", "JAMON DE PAVO FINAS HIERBAS", "BROCOLI CONGELADO COOLTIVO 500G", "ESPINACA X 200G", "JAMON PECHUGA PAVO WHITE HOLLAND X 230 G"]}, "txt_path": "dataset/txt_limpios/792.txt", "html_path": "dataset/paginas_descargadas/792.html", "es_status": "ET", "category_canonical": "pan", "decision": "keep", "match_score": 0.6, "reasons": "heuristic_default"}
