source_id,title,description,breadcrumbs,price_raw,currency_raw,url,seller,availability,country,product_name,brand,reference,unit,price_amount,price_currency,price_symbol,price_text,price_amount_filled,price_is_imputed,price_imputation_source,price_amount_usd,price_amount_usd_filled,fx_rate_local_per_usd,fx_source,information_text,description_text,features_text,specifications_text,benefits_text,details_text,other_sections,sections,txt_path,html_path,es_status,category_canonical,decision,match_score,reasons
1013,colaborar con nuestros estudios para marketing. También puede configurarlas.,Información de la marca,que podemos ofrecer. > 1Kg,42.87,PEN,,Desconocido,unknown,PE,colaborar con nuestros estudios para marketing. También puede configurarlas.,que podemos ofrecer.,,1Kg,42.87,PEN,S/,S/42.87,42.87,False,original,12.0761,12.0761,3.55,from_peru_cambio_dolar,,Información de la marca,"Presentación/Empaque | Bolsa | Con Piel | Sí | Deshuesado | No | Aderezado | Formato comestibles | Entero | Congelado | Marinado | Empanizado | Número de Unidades | 1 | Alérgenos Declarados | Preparación Sugerida | Requiere Cocción completa | Advertencias de Almacenamiento | Refrigeración de 0 C° a 4°C. | Contenido Neto | 2.2Kg | Denominación/Variedad | ARTISAN Pollo Entero S/M X Kg | Revisa todo | Importante destacar | Marca: ARTISAN | Conservar refrigerado | Es parte de la dieta diaria recomendada | Descripción del producto | CARNES AVES Y PESCADOS | plaza Vea | para que revises nuestra gran variedad de productos y puedas elegir todos los ingredientes que necesitas para engreir a tus seres queridos. | Por ejemplo si quieres preparar una deliciosa parrilla, lo más importante es contar una buena carne, ya sea de | Res | , | o | Chancho | . Puedes usar | Aderezos y Sazonadores | para realzar el sabor y darle un toque especial. Te recomendamos complementar tu parrilla con papas doradas el una fresca ensalada de verduras. | Por otro lado, si quieres cocinar comida marina en | también encontrarás | Pescados | y | Mariscos | para que sorprendas a todos con un exquisito ceviche, chupe de pescado, pescado frito, fetuccini con langostinos , entre otras delicias. | - Conoce las distintas opciones en | Carnes, Aves y Pescados | en plazaVea Online! | *La imagen solo es referencial | ¿En qué búsqueda? Encuentra más | Carnes de Res | en plaza Vea | Componentes del Producto | Vendido por | En caso de que algo te guste: Puedes revisar nuestras | Políticas de cambios y/o devoluciones | y hacerlas efectivas en todas nuestras tiendas. | Productos | que te pueden interesar | Recomendado para ti",,,,,"{""Descripción"": [""Información de la marca""], ""Características"": [""Presentación/Empaque"", ""Bolsa"", ""Con Piel"", ""Sí"", ""Deshuesado"", ""No"", ""Aderezado"", ""Formato comestibles"", ""Entero"", ""Congelado"", ""Marinado"", ""Empanizado"", ""Número de unidades"", ""1"", ""Alérgenos Declarados"", ""Preparación sugerida"", ""Requiere Cocción completa"", ""Advertencias De Almacenamiento"", ""Refrigeración de 0 C° a 4°C."", ""Contenido Neto"", ""2.2Kg"", ""Denominación/Variedad"", ""ARTISAN Pollo Entero S/M X Kg"", ""Revisa todo"", ""Importante destacar"", ""Marca: ARTISAN"", ""Conservar refrigerado"", ""Es parte de la dieta alimenticia diaria recomendad"", ""Descripción del producto"", ""CARNES AVES Y PESCADOS"", ""plazaVea"", ""para que revises nuestra gran variedad de productos y puedas elegir todos los ingredientes que necesitas para engreir a tus seres queridos."", ""Por ejemplo, si quieres preparar una deliciosa parrilla, lo más importante es contar una buena carne, ya sea de"", ""Res"", "","", ""o"", ""Chancho"", "". Puedes utilizar"", ""Aderezos y Sazonadores"", ""para realzar el sabor y darle un toque especial. Te recomendamos complementar tu parrilla con papas doradas el una fresca ensalada de verduras."", ""Por otro lado, si deseas cocinar comida marina en"", ""la encontrarás"", ""Pescados"", ""y"", ""Mariscos"", ""para que sorprendas a todos con un exquisito ceviche, chupe de pescado, pescado frito, fetuccini con langostinos , entre otras delicias."", ""¡Conoce las distintas opciones en"", ""Carnes , Aves y Pescados"", ""en plazaVea Online!"", ""*La imagen solo es referencial"", ""¿En qué búsqueda? Encuentra más"", ""Carnes de Res"", ""en plazaVea"", ""Componentes del Producto"", ""Vendido por"", ""En caso algo no vaya como gustes: Puedes revisar nuestras"", ""Politicas de cambios y/o devoluciones"", ""y hacerlas efectivas en todas nuestras tiendas."", ""Productos"", ""que te pueden interesar"", ""Recomendado para ti""]}",dataset/txt_limpios/1013.txt,dataset/paginas_descargadas/1013.html,ET,sin_categoria,discard,0.30,no_category_detected
1014,colaborar con nuestros estudios para marketing. También puede configurarlas.,Información de la marca,que podemos ofrecer. > 200g,16.92,PEN,,Desconocido,unknown,PE,colaborar con nuestros estudios para marketing. También puede configurarlas.,que podemos ofrecer.,,200g,16.92,PEN,S/,S/16.92,16.92,False,original,4.7662,4.7662,3.55,from_peru_cambio_dolar,,Información de la marca,Presentación/Empaque | Caja | Libre De Cafeína | No | Orgánico | Descripción Técnica | NESCAFE FINA SELECCION Frasco 12x200g PE | Porción Sugerida | 2gr | Formato | Polvo | Azúcares Porción | 0.00gr | Carbohidratos Porción | Grasas Porción | Proteínas Porción | Advertencias De Almacenamiento | Conserva en un lugras fresco | Contenido Neto | 200gr | Revisa todo | Componentes del Producto | Vendido por | plaza Ver | En caso de que algo te guste: Puedes revisar nuestras | Políticas de cambios y/o devoluciones | y hacerlas efectivas en todas nuestras tiendas. | Productos | que te pueden interesar | Recomendado para ti,,,,,"{""Descripción"": [""Información de la marca""], ""Características"": [""Presentación/Empaque"", ""Caja"", ""Libre De Cafeína"", ""No"", ""Orgánico"", ""Descripción técnica"", ""NESCAFE FINA SELECCION Frasco 12x200g PE"", ""Porción sugerida"", ""2gr"", ""Formato"", ""Polvo"", ""Azúcar por porción"", ""0.00gr"", ""Carbohidratos Porción"", ""Grasas Porción"", ""Proteínas Porción"", ""Advertencias De Almacenamiento"", ""Conserva en un lugras fresco"", ""Contenido Neto"", ""200gr"", ""Revisa todo"", ""Componentes del Producto"", ""Vendido por"", ""plazaVea"", ""En caso algo no vaya como gustes: Puedes revisar nuestras"", ""Politicas de cambios y/o devoluciones"", ""y hacerlas efectivas en todas nuestras tiendas."", ""Productos"", ""que te pueden interesar"", ""Recomendado para ti""]}",dataset/txt_limpios/1014.txt,dataset/paginas_descargadas/1014.html,ET,sin_categoria,discard,0.30,no_category_detected
1015,colaborar con nuestros estudios para marketing. También puede configurarlas.,Información de la marca,que podemos ofrecer. > 190g,16.92,PEN,,Desconocido,unknown,PE,colaborar con nuestros estudios para marketing. También puede configurarlas.,que podemos ofrecer.,,190g,16.92,PEN,S/,S/16.92,16.92,False,original,4.7662,4.7662,3.55,from_peru_cambio_dolar,,Información de la marca,Denominación Dietética | Revisa todo | Componentes del Producto | Vendido por | plaza Vea | En caso de que algo te guste: Puedes revisar nuestras | Políticas de cambios y/o devoluciones | y hacerlas efectivas en todas nuestras tiendas. | Productos | que te pueden interesar | Recomendado para ti,,,,,"{""Descripción"": [""Información de la marca""], ""Características"": [""Denominación Dietética"", ""Revisa todo"", ""Componentes del Producto"", ""Vendido por"", ""plazaVea"", ""En caso algo no vaya como gustes: Puedes revisar nuestras"", ""Politicas de cambios y/o devoluciones"", ""y hacerlas efectivas en todas nuestras tiendas."", ""Productos"", ""que te pueden interesar"", ""Recomendado para ti""]}",dataset/txt_limpios/1015.txt,dataset/paginas_descargadas/1015.html,ET,sin_categoria,discard,0.30,no_category_detected
1016,colaborar con nuestros estudios para marketing. También puede configurarlas.,Información de la marca,que podemos ofrecer. > 170g,16.92,PEN,,Desconocido,unknown,PE,colaborar con nuestros estudios para marketing. También puede configurarlas.,que podemos ofrecer.,,170g,16.92,PEN,S/,S/16.92,16.92,False,original,4.7662,4.7662,3.55,from_peru_cambio_dolar,,Información de la marca,"Presentación/Empaque | Frasco | Café Puro | Sí | Libre De Cafeína | No | Formato | Polvo | Azúcares Porción | 0.20 g/ 100 g | Calorías Porción | 332.76 kcal | Carbohidratos Porción | 63.58 g/ 100 g | Descripción Nutricional | 0.20 g, Grasa: 0.00 g, Grasas Saturadas: 0.01 g, Sodio: 133.94 mg. | Grasas Porción | 0.00 g/ 100 g | Proteínas Porción | 19.61 g/ 100 g | Sodio Porción | 133.94 mg/ 100 g | Origen Del Grano | Nacional | Advertencias De Almacenamiento | Almacenar en un lugar fresco, seco y libre de olores extraños | Contenido Neto | 170 g | Revisa todo | Componentes del Producto | Vendido por | plaza Vea | En caso de que algo te guste: Puedes revisar nuestras | Políticas de cambios y/o devoluciones | y hacerlas efectivas en todas nuestras tiendas. | Productos | que te pueden interesar | Recomendado para ti",,,,,"{""Descripción"": [""Información de la marca""], ""Características"": [""Presentación/Empaque"", ""Frasco"", ""Café Puro"", ""Sí"", ""Libre De Cafeína"", ""No"", ""Formato"", ""Polvo"", ""Azúcar por porción"", ""0.20 g / 100 g"", ""Calorías Porción"", ""332.76 kcal"", ""Carbohidratos Porción"", ""63.58 g / 100 g"", ""Descripción Nutricional"", ""0.20 g, Grasa: 0.00 g, Grasas Saturadas: 0.01 g, Sodio: 133.94 mg."", ""Grasas Porción"", ""0.00 g / 100 g"", ""Proteínas Porción"", ""19.61 g / 100 g"", ""Sodio Porción"", ""133.94 mg / 100 g"", ""Origen Del Grano"", ""Nacional"", ""Advertencias De Almacenamiento"", ""Almacenar en un lugar fresco, seco y libre de olores extraños"", ""Contenido Neto"", ""170 g"", ""Revisa todo"", ""Componentes del Producto"", ""Vendido por"", ""plazaVea"", ""En caso algo no vaya como gustes: Puedes revisar nuestras"", ""Politicas de cambios y/o devoluciones"", ""y hacerlas efectivas en todas nuestras tiendas."", ""Productos"", ""que te pueden interesar"", ""Recomendado para ti""]}",dataset/txt_limpios/1016.txt,dataset/paginas_descargadas/1016.html,ET,sin_categoria,discard,0.30,no_category_detected
1017,colaborar con nuestros estudios para marketing. También puede configurarlas.,Información de la marca,que podemos ofrecer. > 900g,16.92,PEN,,Desconocido,unknown,PE,colaborar con nuestros estudios para marketing. También puede configurarlas.,que podemos ofrecer.,,900g,16.92,PEN,S/,S/16.92,16.92,False,original,4.7662,4.7662,3.55,from_peru_cambio_dolar,,Información de la marca,"Importante destacar | Producto de calidad | Ideal para tu desayuno | Gran sabor | Descripción del producto | La alimentación juega un papel muy importante en nuestras vidas. Es por ello que debemos tener una equilibrada incorporación de nutrientes a nuestro organismo, para el desarrollo de la vida y de las distintas actividades cotidianas. Por ello | plaza Vea | pone tu disposición una amplia variedad de | Abarrotes | para que puedas elegir el que más se adecua a tus necesidades. | El desayuno es el primer alimento del día. Esta primera comida nos aportará en buen porcentaje de energía para iniciar con fuerza nuestras actividades diarias. Por ello | te ofrece una gran variedad de productos para que pueda preparar | deliciosos. Si eres un amante del café y en el pued falta en tus mañanas. Puedes preparte algo rápido y sencillo . Una taza con | Café | y una crocantes | Tostadas | con | Mermelada. | Otro opción para tu desayuno son los | Cereales | los que puedes combinarlos con | Leche | o | Yogurt | ¡Realiza tus combinaciones y descrubre un mundo de posibilidades! | - Conoce los distintos productos para preparar | deliciosos en plazaVea Online! | *La imagen solo es referencial | Cafetal/b> | ""Cafetal es un café tostado único, con un inigualable aroma, cuerpo y sabor que lo caracteriza. Es una marca pionera de café pasado en el Perú y desde su fundación en 1957 ofrecen el mejor café arábica 100% peruano de las mejores zonas cafeteras."" | ¿No es lo que buscas? Encuentra más productos para tus | en plaza Vea | Revisa todo | Componentes del Producto | Vendido por | En caso de que algo te guste: Puedes revisar nuestras | Políticas de cambios y/o devoluciones | y hacerlas efectivas en todas nuestras tiendas. | Productos | que te pueden interesar | Recomendado para ti",,,,,"{""Descripción"": [""Información de la marca""], ""Características"": [""Importante destacar"", ""Producto de calidad"", ""Ideal para tu desayuno"", ""Gran sabor"", ""Descripción del producto"", ""La alimentación juega un papel muy importante en nuestras vidas. Es por ello que debemos tener una equilibrada incorporación de nutrientes a nuestro organismo, para el desarrollo de la vida y de las distintas actividades cotidianas. Por ello"", ""plazaVea"", ""pone a tu disposición una amplia variedad de"", ""Abarrotes"", ""para que puedas elegir qué más se adecua a tus necesidades."", ""El desayuno es el primer alimento del día. Esta primera comida nos aportará en buen porcentaje de energía para iniciar con fuerza nuestras actividades diarias. Por ello"", ""te ofrece una gran variedad de productos para que puedar preparar"", ""deliciosos. Si eres un amante del café y en el pued falta en tus mañanas. Puedes preparte algo rápido y sencillo . Una taza con"", ""Café"", ""y una crocantes"", ""Tostadas"", ""con"", ""Mermelada."", ""Otra opción para tu desayuno son los"", ""Cereales"", ""los cuales puedes combinarlos con"", ""Leche"", ""o"", ""Yogurt"", ""¡Realiza tus combinaciones y descrubre un mundo de posibilidades!"", ""¡Conoce los distintos productos para preparar"", ""deliciosos en plazaVea Online!"", ""*La imagen solo es referencial"", ""Cafetal/b>"", ""\""Cafetal es un café tostado único, con un inigualable aroma, cuerpo y sabor que lo caracteriza. Es una marca pionera de café pasado en el Perú y desde su fundación en 1957 ofrecen el mejor café arábica 100% peruano de las mejores zonas cafeteras. \"""", ""¿En qué búsqueda? Encuentra más productos para tus"", ""en plazaVea"", ""Revisa todo"", ""Componentes del Producto"", ""Vendido por"", ""En caso algo no vaya como gustes: Puedes revisar nuestras"", ""Politicas de cambios y/o devoluciones"", ""y hacerlas efectivas en todas nuestras tiendas."", ""Productos"", ""que te pueden interesar"", ""Recomendado para ti""]}",dataset/txt_limpios/1017.txt,dataset/paginas_descargadas/1017.html,ET,sin_categoria,discard,0.30,no_category_detected
1018,colaborar con nuestros estudios para marketing. También puede configurarlas.,Información de la marca,que podemos ofrecer. > 200g,16.92,PEN,,Desconocido,unknown,PE,colaborar con nuestros estudios para marketing. También puede configurarlas.,que podemos ofrecer.,,200g,16.92,PEN,S/,S/16.92,16.92,False,original,4.7662,4.7662,3.55,from_peru_cambio_dolar,,Información de la marca,"Importante destacar | Producto de calidad | Ideal para tu desayuno | Gran sabor | Descripción del producto | La alimentación juega un papel muy importante en nuestras vidas. Es por ello que debemos tener una equilibrada incorporación de nutrientes a nuestro organismo, para el desarrollo de la vida y de las distintas actividades cotidianas. Por ello | plaza Vea | pone tu disposición una amplia variedad de | Abarrotes | para que puedas elegir el que más se adecua a tus necesidades. | El desayuno es el primer alimento del día. Esta primera comida nos aportará en buen porcentaje de energía para iniciar con fuerza nuestras actividades diarias. Por ello | te ofrece una gran variedad de productos para que pueda preparar | deliciosos. Si eres un amante del café y en el pued falta en tus mañanas. Puedes preparte algo rápido y sencillo . Una taza con | Café | y una crocantes | Tostadas | con | Mermelada. | Otro opción para tu desayuno son los | Cereales | los que puedes combinarlos con | Leche | o | Yogurt | ¡Realiza tus combinaciones y descrubre un mundo de posibilidades! | - Conoce los distintos productos para preparar | deliciosos en plazaVea Online! | *La imagen solo es referencial | Bell ́s | ""Bell's ofrece una alternativa accesible en torno a calidad y precio de sus productos; con el respaldo y garantía de plazaVea."" | ¿En qué búsqueda? Encuentra más productos para tus | en plaza Vea | Revisa todo | Componentes del Producto | Vendido por | En caso de que algo te guste: Puedes revisar nuestras | Políticas de cambios y/o devoluciones | y hacerlas efectivas en todas nuestras tiendas. | Productos | que te pueden interesar | Recomendado para ti",,,,,"{""Descripción"": [""Información de la marca""], ""Características"": [""Importante destacar"", ""Producto de calidad"", ""Ideal para tu desayuno"", ""Gran sabor"", ""Descripción del producto"", ""La alimentación juega un papel muy importante en nuestras vidas. Es por ello que debemos tener una equilibrada incorporación de nutrientes a nuestro organismo, para el desarrollo de la vida y de las distintas actividades cotidianas. Por ello"", ""plazaVea"", ""pone a tu disposición una amplia variedad de"", ""Abarrotes"", ""para que puedas elegir qué más se adecua a tus necesidades."", ""El desayuno es el primer alimento del día. Esta primera comida nos aportará en buen porcentaje de energía para iniciar con fuerza nuestras actividades diarias. Por ello"", ""te ofrece una gran variedad de productos para que puedar preparar"", ""deliciosos. Si eres un amante del café y en el pued falta en tus mañanas. Puedes preparte algo rápido y sencillo . Una taza con"", ""Café"", ""y una crocantes"", ""Tostadas"", ""con"", ""Mermelada."", ""Otra opción para tu desayuno son los"", ""Cereales"", ""los cuales puedes combinarlos con"", ""Leche"", ""o"", ""Yogurt"", ""¡Realiza tus combinaciones y descrubre un mundo de posibilidades!"", ""¡Conoce los distintos productos para preparar"", ""deliciosos en plazaVea Online!"", ""*La imagen solo es referencial"", ""Bell´s"", ""\""Bell's ofrece una alternativa accesible en torno a la calidad y precio de sus productos; con el respaldo y garantía de plaza Vea"", ""¿En qué búsqueda? Encuentra más productos para tus"", ""en plazaVea"", ""Revisa todo"", ""Componentes del Producto"", ""Vendido por"", ""En caso algo no vaya como gustes: Puedes revisar nuestras"", ""Politicas de cambios y/o devoluciones"", ""y hacerlas efectivas en todas nuestras tiendas."", ""Productos"", ""que te pueden interesar"", ""Recomendado para ti""]}",dataset/txt_limpios/1018.txt,dataset/paginas_descargadas/1018.html,ET,sin_categoria,discard,0.30,no_category_detected
1019,colaborar con nuestros estudios para marketing. También puede configurarlas.,Información de la marca,que podemos ofrecer. > 900ml,16.92,PEN,,Desconocido,unknown,PE,colaborar con nuestros estudios para marketing. También puede configurarlas.,que podemos ofrecer.,,900ml,16.92,PEN,S/,S/16.92,16.92,False,original,4.7662,4.7662,3.55,from_peru_cambio_dolar,,Información de la marca,"Presentación/Empaque | Botella | Porción sugerida | 14g | Azúcares Porción | 0g | Calorías Porción | 130kcal | Carbohidratos Porción | Descripción Nutricional | Grasas Porción | Proteínas Porción | Sodio Porción | 0mg | Composición/Origen | Aceite 100% vegetal | Advertencias De Almacenamiento | Consérvese en recipiente cerrado, en lugar fresco, seco y seguro | Contenido Neto | 900ml | Revisa todo | Componentes del Producto | Vendido por | plaza Ver | En caso de que algo te guste: Puedes revisar nuestras | Políticas de cambios y/o devoluciones | y hacerlas efectivas en todas nuestras tiendas. | Productos | que te pueden interesar | Recomendado para ti",,,,,"{""Descripción"": [""Información de la marca""], ""Características"": [""Presentación/Empaque"", ""Botella"", ""Porción sugerida"", ""14g"", ""Azúcar por porción"", ""0g"", ""Calorías Porción"", ""130kcal"", ""Carbohidratos Porción"", ""Descripción Nutricional"", ""Grasas Porción"", ""Proteínas Porción"", ""Sodio Porción"", ""0mg"", ""Composición/Origen"", ""Aceite 100% vegetal"", ""Advertencias De Almacenamiento"", ""Consérvese en un recipiente cerrado, en lugar fresco, seco y seguro"", ""Contenido Neto"", ""900ml"", ""Revisa todo"", ""Componentes del Producto"", ""Vendido por"", ""plazaVea"", ""En caso algo no vaya como gustes: Puedes revisar nuestras"", ""Politicas de cambios y/o devoluciones"", ""y hacerlas efectivas en todas nuestras tiendas."", ""Productos"", ""que te pueden interesar"", ""Recomendado para ti""]}",dataset/txt_limpios/1019.txt,dataset/paginas_descargadas/1019.html,ET,sin_categoria,discard,0.30,no_category_detected
