source_id,title,description,breadcrumbs,price_raw,currency_raw,url,seller,availability,country,product_name,brand,reference,unit,price_amount,price_currency,price_symbol,price_text,price_amount_filled,price_is_imputed,price_imputation_source,price_amount_usd,price_amount_usd_filled,fx_rate_local_per_usd,fx_source,information_text,description_text,features_text,specifications_text,benefits_text,details_text,other_sections,sections,txt_path,html_path,es_status,category_canonical,decision,match_score,reasons
113,¡Lo mejor te está esperando!,"¡Disfruta del delicioso sabor y la calidad premium del Arroz Super Extra MyBrand en tu mesa! Con un peso de 906 gramos, este arroz es perfecto para tus comidas diarias y recetas especiales. Su grano largo, textura firme y exc | ... Ver más | Favoritos | Recomendados | Arroz Super Extra   Verde Valle 900 ... | 900 GR | 906 GR | Arroz Super Extra  Verde Valle 2 Kg | 2 KG | Arroz Super Extra Grueso   Sos 907 G | 907 GR | Arroz Super Extra Precocido  Sos 907... | Arroz Super Extra  Diamante 750 G | 750 GR | Arroz   Cazerola 907 G | Arroz Grano Largo  Gran Cosecha 900 ... | Arroz Jazmin   Verde Valle 750 G | Arroz Blanco Orgánico   Aires De Cam... | 1 KG | -25% | Arroz Organico Integral  Aires De Ca... | Grano De Elote  Dorado  Clemente Jaq... | 410 GR | -21% | Atun En Agua   Tuny 130 G | 130 GR | 220 GR | -29% | Arroz Extra    Mimarca 906 G | Cerveza Six Pack Lata Light  Budligh... | 330 ML | Cacahuates Japones  Karate 127 G | 127 GR | Alimento Humedo P/perro Todas Las Ra... | 100 GR | Atun Jumbo En Agua  Tuny 295 G | 295 GR | Arroz Con Leche   Lala 125 G | 125 GR | Arroz Impegable   Verde Valle 750 G | Galletas De Arroz Integrales   Okko ... | 140 GR | Galletas De Arroz Con Quinoa   Okko ... | Atun En Aceite   Tuny 130 G | Ensalada Campesina   La Costeña 410 ... | Salsa De Soya  Maggi 290 Ml | 290 ML | Cereal Choco Krispis    Kelloggs 540... | 540 GR | Caldo De Pollo 12 Cubos  Knorr 126 G... | 126 GR | Alimendo Humedo Para Perro Adulto Po... | 85 GR | Arroz Impegable Precocido  Mybrand 9... | AGOTADO | Mes patrio Herdez | Ver más | Adobo    Doña María 235 G | Mole Doña María Almendrado En Pasta ... | Mole Doña María Almendrado Listo Par... | Mole Doña María Poblano Con Cacao En... | Mole Doña Maria Poblano Con Cacao Li... | Mole Doña Mariía Rojo En Pasta   125... | Mole En Pasta 430 Gramos   Doña Mari... | Mole Listo Para Servir  Para Servir ... | Mole Rojo En Pasta  Doña Maria 235 G | Mole Verde En Pasta  Doña Maria 230 ... | Pipián En Pasta  Doña Maria 230 G | Salsa Cacahuate Picante Cremosa   He... | Salsa Casera Con Habanero   Herdez 4... | Salsa Casera  Herdez 210 G | Salsa Guacamole 15% Mas Guacamole He...",Descarga la app > 906 G,23.9,,,Desconocido,unknown,UNKNOWN,¡Lo mejor te está esperando!,Descarga la app,,906 G,23.90,,$,$23.90,23.9,False,original,23.9,23.9,1.0,default_1usd,,,,,,"¡Disfruta del delicioso sabor y la calidad premium del Arroz Super Extra MyBrand en tu mesa! Con un peso de 906 gramos, este arroz es perfecto para tus comidas diarias y recetas especiales. Su grano largo, textura firme y exc | ... Ver más | Favoritos | Recomendados | Arroz Super Extra   Verde Valle 900 ... | 900 GR | 906 GR | Arroz Super Extra  Verde Valle 2 Kg | 2 KG | Arroz Super Extra Grueso   Sos 907 G | 907 GR | Arroz Super Extra Precocido  Sos 907... | Arroz Super Extra  Diamante 750 G | 750 GR | Arroz   Cazerola 907 G | Arroz Grano Largo  Gran Cosecha 900 ... | Arroz Jazmin   Verde Valle 750 G | Arroz Blanco Orgánico   Aires De Cam... | 1 KG | -25% | Arroz Organico Integral  Aires De Ca... | Grano De Elote  Dorado  Clemente Jaq... | 410 GR | -21% | Atun En Agua   Tuny 130 G | 130 GR | 220 GR | -29% | Arroz Extra    Mimarca 906 G | Cerveza Six Pack Lata Light  Budligh... | 330 ML | Cacahuates Japones  Karate 127 G | 127 GR | Alimento Humedo P/perro Todas Las Ra... | 100 GR | Atun Jumbo En Agua  Tuny 295 G | 295 GR | Arroz Con Leche   Lala 125 G | 125 GR | Arroz Impegable   Verde Valle 750 G | Galletas De Arroz Integrales   Okko ... | 140 GR | Galletas De Arroz Con Quinoa   Okko ... | Atun En Aceite   Tuny 130 G | Ensalada Campesina   La Costeña 410 ... | Salsa De Soya  Maggi 290 Ml | 290 ML | Cereal Choco Krispis    Kelloggs 540... | 540 GR | Caldo De Pollo 12 Cubos  Knorr 126 G... | 126 GR | Alimendo Humedo Para Perro Adulto Po... | 85 GR | Arroz Impegable Precocido  Mybrand 9... | AGOTADO | Mes patrio Herdez | Ver más | Adobo    Doña María 235 G | Mole Doña María Almendrado En Pasta ... | Mole Doña María Almendrado Listo Par... | Mole Doña María Poblano Con Cacao En... | Mole Doña Maria Poblano Con Cacao Li... | Mole Doña Mariía Rojo En Pasta   125... | Mole En Pasta 430 Gramos   Doña Mari... | Mole Listo Para Servir  Para Servir ... | Mole Rojo En Pasta  Doña Maria 235 G | Mole Verde En Pasta  Doña Maria 230 ... | Pipián En Pasta  Doña Maria 230 G | Salsa Cacahuate Picante Cremosa   He... | Salsa Casera Con Habanero   Herdez 4... | Salsa Casera  Herdez 210 G | Salsa Guacamole 15% Mas Guacamole He...",,"{""Detalles"": [""¡Disfruta del delicioso sabor y la calidad premium del Arroz Super Extra MyBrand en tu mesa! Con un peso de 906 gramos, este arroz es perfecto para tus comidas diarias y recetas especiales. Su grano largo, textura firme y exc"", ""... Ver más"", ""Favoritos"", ""Recomendados"", ""Arroz Super Extra   Verde Valle 900 ..."", ""900 GR"", ""906 GR"", ""Arroz Super Extra  Verde Valle 2 Kg"", ""2 KG"", ""Arroz Super Extra Grueso   Sos 907 G"", ""907 GR"", ""Arroz Super Extra Precocido  Sos 907..."", ""Arroz Super Extra  Diamante 750 G"", ""750 GR"", ""Arroz   Cazerola 907 G"", ""Arroz Grano Largo  Gran Cosecha 900 ..."", ""Arroz Jazmin   Verde Valle 750 G"", ""Arroz Blanco Orgánico   Aires De Cam..."", ""1 KG"", ""-25%"", ""Arroz Organico Integral  Aires De Ca..."", ""Grano De Elote  Dorado  Clemente Jaq..."", ""410 GR"", ""-21%"", ""Atun En Agua   Tuny 130 G"", ""130 GR"", ""220 GR"", ""-29%"", ""Arroz Extra    Mimarca 906 G"", ""Cerveza Six Pack Lata Light  Budligh..."", ""330 ML"", ""Cacahuates Japones  Karate 127 G"", ""127 GR"", ""Alimento Humedo P/perro Todas Las Ra..."", ""100 GR"", ""Atun Jumbo En Agua  Tuny 295 G"", ""295 GR"", ""Arroz Con Leche   Lala 125 G"", ""125 GR"", ""Arroz Impegable   Verde Valle 750 G"", ""Galletas De Arroz Integrales   Okko ..."", ""140 GR"", ""Galletas De Arroz Con Quinoa   Okko ..."", ""Atun En Aceite   Tuny 130 G"", ""Ensalada Campesina   La Costeña 410 ..."", ""Salsa De Soya  Maggi 290 Ml"", ""290 ML"", ""Cereal Choco Krispis    Kelloggs 540..."", ""540 GR"", ""Caldo De Pollo 12 Cubos  Knorr 126 G..."", ""126 GR"", ""Alimendo Humedo Para Perro Adulto Po..."", ""85 GR"", ""Arroz Impegable Precocido  Mybrand 9..."", ""AGOTADO"", ""Mes patrio Herdez"", ""Ver más"", ""Adobo    Doña María 235 G"", ""Mole Doña María Almendrado En Pasta ..."", ""Mole Doña María Almendrado Listo Par..."", ""Mole Doña María Poblano Con Cacao En..."", ""Mole Doña Maria Poblano Con Cacao Li..."", ""Mole Doña Mariía Rojo En Pasta   125..."", ""Mole En Pasta 430 Gramos   Doña Mari..."", ""Mole Listo Para Servir  Para Servir ..."", ""Mole Rojo En Pasta  Doña Maria 235 G"", ""Mole Verde En Pasta  Doña Maria 230 ..."", ""Pipián En Pasta  Doña Maria 230 G"", ""Salsa Cacahuate Picante Cremosa   He..."", ""Salsa Casera Con Habanero   Herdez 4..."", ""Salsa Casera  Herdez 210 G"", ""Salsa Guacamole 15% Mas Guacamole He...""]}",dataset/txt_limpios/113.txt,dataset/paginas_descargadas/113.html,EN,atun,keep,0.60,heuristic_default
114,¡Lo mejor te está esperando!,"Con Arroz Blanco Knorr® tendrás una opción deliciosa, fácil y rápida de preparar para todas tus comidas. Dale un giro a tus platillos de todos los días en tan sólo 10 minutos, ideal para preparar una guarnición fácil y rápida | ... Ver más | Favoritos | Recomendados | Arroz Instantaneo A La Poblana  Knor... | 155 GR | Arroz Blanco Instantaneo  Knorr 155 ... | Arroz A La Mexicana Instantaneo  Kno... | Arroz A La Española Instantaneo  Kno... | Arroz Estilo Risotto Con Champiñones... | 150 GR | Grano De Elote  Dorado  Clemente Jaq... | 410 GR | Arroz Super Extra   Verde Valle 900 ... | 900 GR | -21% | Atun En Agua   Tuny 130 G | 130 GR | 220 GR | -29% | Arroz Extra    Mimarca 906 G | 906 GR | Cerveza Six Pack Lata Light  Budligh... | 330 ML | Cacahuates Japones  Karate 127 G | 127 GR | Arroz   Cazerola 907 G | 907 GR | Alimento Humedo P/perro Todas Las Ra... | 100 GR | Atun Jumbo En Agua  Tuny 295 G | 295 GR | Arroz Con Leche   Lala 125 G | 125 GR | Arroz Impegable   Verde Valle 750 G | 750 GR | Galletas De Arroz Integrales   Okko ... | 140 GR | Galletas De Arroz Con Quinoa   Okko ... | Atun En Aceite   Tuny 130 G | Ensalada Campesina   La Costeña 410 ... | Salsa De Soya  Maggi 290 Ml | 290 ML | Cereal Choco Krispis    Kelloggs 540... | 540 GR | Caldo De Pollo 12 Cubos  Knorr 126 G... | 126 GR | Alimendo Humedo Para Perro Adulto Po... | 85 GR | Arroz Impegable Precocido  Mybrand 9... | AGOTADO | Arroz A La Mexicana Precocido  Verde... | Arroz Super Extra   Mybrand 906 G | Arroz A La Mexicana     0.25 Lt | 0.25 LT | Alimento Humedo Para Perro Adulto Mi... | Mes patrio Herdez | Ver más | Adobo    Doña María 235 G | Mole Doña María Almendrado En Pasta ... | Mole Doña María Almendrado Listo Par... | Mole Doña María Poblano Con Cacao En... | Mole Doña Maria Poblano Con Cacao Li... | Mole Doña Mariía Rojo En Pasta   125... | Mole En Pasta 430 Gramos   Doña Mari... | Mole Listo Para Servir  Para Servir ... | Mole Rojo En Pasta  Doña Maria 235 G | Mole Verde En Pasta  Doña Maria 230 ... | Pipián En Pasta  Doña Maria 230 G | Salsa Cacahuate Picante Cremosa   He... | Salsa Casera Con Habanero   Herdez 4... | Salsa Casera  Herdez 210 G | Salsa Guacamole 15% Mas Guacamole He...",Descarga la app > 155 G,39.9,,,Desconocido,unknown,UNKNOWN,¡Lo mejor te está esperando!,Descarga la app,,155 G,39.90,,$,$39.90,39.9,False,original,39.9,39.9,1.0,default_1usd,,,,,,"Con Arroz Blanco Knorr® tendrás una opción deliciosa, fácil y rápida de preparar para todas tus comidas. Dale un giro a tus platillos de todos los días en tan sólo 10 minutos, ideal para preparar una guarnición fácil y rápida | ... Ver más | Favoritos | Recomendados | Arroz Instantaneo A La Poblana  Knor... | 155 GR | Arroz Blanco Instantaneo  Knorr 155 ... | Arroz A La Mexicana Instantaneo  Kno... | Arroz A La Española Instantaneo  Kno... | Arroz Estilo Risotto Con Champiñones... | 150 GR | Grano De Elote  Dorado  Clemente Jaq... | 410 GR | Arroz Super Extra   Verde Valle 900 ... | 900 GR | -21% | Atun En Agua   Tuny 130 G | 130 GR | 220 GR | -29% | Arroz Extra    Mimarca 906 G | 906 GR | Cerveza Six Pack Lata Light  Budligh... | 330 ML | Cacahuates Japones  Karate 127 G | 127 GR | Arroz   Cazerola 907 G | 907 GR | Alimento Humedo P/perro Todas Las Ra... | 100 GR | Atun Jumbo En Agua  Tuny 295 G | 295 GR | Arroz Con Leche   Lala 125 G | 125 GR | Arroz Impegable   Verde Valle 750 G | 750 GR | Galletas De Arroz Integrales   Okko ... | 140 GR | Galletas De Arroz Con Quinoa   Okko ... | Atun En Aceite   Tuny 130 G | Ensalada Campesina   La Costeña 410 ... | Salsa De Soya  Maggi 290 Ml | 290 ML | Cereal Choco Krispis    Kelloggs 540... | 540 GR | Caldo De Pollo 12 Cubos  Knorr 126 G... | 126 GR | Alimendo Humedo Para Perro Adulto Po... | 85 GR | Arroz Impegable Precocido  Mybrand 9... | AGOTADO | Arroz A La Mexicana Precocido  Verde... | Arroz Super Extra   Mybrand 906 G | Arroz A La Mexicana     0.25 Lt | 0.25 LT | Alimento Humedo Para Perro Adulto Mi... | Mes patrio Herdez | Ver más | Adobo    Doña María 235 G | Mole Doña María Almendrado En Pasta ... | Mole Doña María Almendrado Listo Par... | Mole Doña María Poblano Con Cacao En... | Mole Doña Maria Poblano Con Cacao Li... | Mole Doña Mariía Rojo En Pasta   125... | Mole En Pasta 430 Gramos   Doña Mari... | Mole Listo Para Servir  Para Servir ... | Mole Rojo En Pasta  Doña Maria 235 G | Mole Verde En Pasta  Doña Maria 230 ... | Pipián En Pasta  Doña Maria 230 G | Salsa Cacahuate Picante Cremosa   He... | Salsa Casera Con Habanero   Herdez 4... | Salsa Casera  Herdez 210 G | Salsa Guacamole 15% Mas Guacamole He...",,"{""Detalles"": [""Con Arroz Blanco Knorr® tendrás una opción deliciosa, fácil y rápida de preparar para todas tus comidas. Dale un giro a tus platillos de todos los días en tan sólo 10 minutos, ideal para preparar una guarnición fácil y rápida"", ""... Ver más"", ""Favoritos"", ""Recomendados"", ""Arroz Instantaneo A La Poblana  Knor..."", ""155 GR"", ""Arroz Blanco Instantaneo  Knorr 155 ..."", ""Arroz A La Mexicana Instantaneo  Kno..."", ""Arroz A La Española Instantaneo  Kno..."", ""Arroz Estilo Risotto Con Champiñones..."", ""150 GR"", ""Grano De Elote  Dorado  Clemente Jaq..."", ""410 GR"", ""Arroz Super Extra   Verde Valle 900 ..."", ""900 GR"", ""-21%"", ""Atun En Agua   Tuny 130 G"", ""130 GR"", ""220 GR"", ""-29%"", ""Arroz Extra    Mimarca 906 G"", ""906 GR"", ""Cerveza Six Pack Lata Light  Budligh..."", ""330 ML"", ""Cacahuates Japones  Karate 127 G"", ""127 GR"", ""Arroz   Cazerola 907 G"", ""907 GR"", ""Alimento Humedo P/perro Todas Las Ra..."", ""100 GR"", ""Atun Jumbo En Agua  Tuny 295 G"", ""295 GR"", ""Arroz Con Leche   Lala 125 G"", ""125 GR"", ""Arroz Impegable   Verde Valle 750 G"", ""750 GR"", ""Galletas De Arroz Integrales   Okko ..."", ""140 GR"", ""Galletas De Arroz Con Quinoa   Okko ..."", ""Atun En Aceite   Tuny 130 G"", ""Ensalada Campesina   La Costeña 410 ..."", ""Salsa De Soya  Maggi 290 Ml"", ""290 ML"", ""Cereal Choco Krispis    Kelloggs 540..."", ""540 GR"", ""Caldo De Pollo 12 Cubos  Knorr 126 G..."", ""126 GR"", ""Alimendo Humedo Para Perro Adulto Po..."", ""85 GR"", ""Arroz Impegable Precocido  Mybrand 9..."", ""AGOTADO"", ""Arroz A La Mexicana Precocido  Verde..."", ""Arroz Super Extra   Mybrand 906 G"", ""Arroz A La Mexicana     0.25 Lt"", ""0.25 LT"", ""Alimento Humedo Para Perro Adulto Mi..."", ""Mes patrio Herdez"", ""Ver más"", ""Adobo    Doña María 235 G"", ""Mole Doña María Almendrado En Pasta ..."", ""Mole Doña María Almendrado Listo Par..."", ""Mole Doña María Poblano Con Cacao En..."", ""Mole Doña Maria Poblano Con Cacao Li..."", ""Mole Doña Mariía Rojo En Pasta   125..."", ""Mole En Pasta 430 Gramos   Doña Mari..."", ""Mole Listo Para Servir  Para Servir ..."", ""Mole Rojo En Pasta  Doña Maria 235 G"", ""Mole Verde En Pasta  Doña Maria 230 ..."", ""Pipián En Pasta  Doña Maria 230 G"", ""Salsa Cacahuate Picante Cremosa   He..."", ""Salsa Casera Con Habanero   Herdez 4..."", ""Salsa Casera  Herdez 210 G"", ""Salsa Guacamole 15% Mas Guacamole He...""]}",dataset/txt_limpios/114.txt,dataset/paginas_descargadas/114.html,EN,atun,keep,0.60,heuristic_default
115,¡Lo mejor te está esperando!,"El ACEITE VEGETAL MIMARCA de 800 mililitros es un imprescindible en tu despensa. Su alta calidad y versatilidad lo hacen perfecto para cocinar, freír y aderezar tus platillos favoritos. Cuida tu salud y disfruta de una alimen | ... Ver más | Ver más | Favoritos | Recomendados | 800 ML | Aceite Vegetal  123 1 Lt | 1 LT | Aceite Vegetal  Ave 850 Ml | 850 ML | Aceite Vegetal De Canola  Capullo 84... | 840 ML | Aceite Vegetal De Maíz  Mazola 765 M... | 765 ML | Aceite Vegetal De Canola  Capullo 40... | 400 ML | Aceite Vegetal  Kartamus 900 Ml | 900 ML | Aceite Puro De Maiz   123    1 Litro | Aceite Vegetal Comestible Aerosol  A... | 170 GR | Aceite Vegetal De Cártamo  Capullo 7... | 750 ML | Aceite Vegetal De Soya Y Canola  Sab... | -21% | Aceite Vegetal De Soya  Capullo 750 ... | Aceite Vegetal De Ajonjoli Y Soya   ... | 250 ML | Aceite De Soya  Nutrioli 850 Ml | -29% | Margarina Con Sal  Iberia 400 G | 400 GR | Mantequilla Sin Sal  La Gloria  90 G | 90 GR | Mantequilla Con Sal  La Gloria  90 G | Manteca De Cerdo   Morrell 454 G | 454 GR | Aceite De Soya  Nutrioli 400 Ml | Mantequilla Sin Sal  La Gloria 360 G | 360 GR | -24% | Margarina Con Sal  Iberia   90 G | Aceite De Soya Antigoteo  Nutrioli 7... | 700 ML | Margarina Con Sal  Chantilly 190 G | 190 GR | Manteca De Cerdo  Mybrand 454 Gramos | Aceite De Oliva Para Freir  Ines 750... | Margarina Sin Sal  Chantilly 190 G | Margarina Con Sal  Primavera  90 G | Mantequilla Con Sal  La Gloria 360 G | Sustituto De Crema Liquido Vainilla ... | 237 ML | Sustituto De Crema Liquido Avellana ... | Mes patrio Herdez | Adobo    Doña María 235 G | Mole Doña María Almendrado En Pasta ... | Mole Doña María Almendrado Listo Par... | Mole Doña María Poblano Con Cacao En... | Mole Doña Maria Poblano Con Cacao Li... | Mole Doña Mariía Rojo En Pasta   125... | Mole En Pasta 430 Gramos   Doña Mari... | Mole Listo Para Servir  Para Servir ... | Mole Rojo En Pasta  Doña Maria 235 G | Mole Verde En Pasta  Doña Maria 230 ... | Pipián En Pasta  Doña Maria 230 G | Salsa Cacahuate Picante Cremosa   He... | Salsa Casera Con Habanero   Herdez 4... | Salsa Casera  Herdez 210 G | Salsa Guacamole 15% Mas Guacamole He...",Descarga la app > 800 Ml,29.9,,,Desconocido,unknown,UNKNOWN,¡Lo mejor te está esperando!,Descarga la app,,800 Ml,29.90,,$,$29.90,29.9,False,original,29.9,29.9,1.0,default_1usd,,,,,,"El ACEITE VEGETAL MIMARCA de 800 mililitros es un imprescindible en tu despensa. Su alta calidad y versatilidad lo hacen perfecto para cocinar, freír y aderezar tus platillos favoritos. Cuida tu salud y disfruta de una alimen | ... Ver más | Ver más | Favoritos | Recomendados | 800 ML | Aceite Vegetal  123 1 Lt | 1 LT | Aceite Vegetal  Ave 850 Ml | 850 ML | Aceite Vegetal De Canola  Capullo 84... | 840 ML | Aceite Vegetal De Maíz  Mazola 765 M... | 765 ML | Aceite Vegetal De Canola  Capullo 40... | 400 ML | Aceite Vegetal  Kartamus 900 Ml | 900 ML | Aceite Puro De Maiz   123    1 Litro | Aceite Vegetal Comestible Aerosol  A... | 170 GR | Aceite Vegetal De Cártamo  Capullo 7... | 750 ML | Aceite Vegetal De Soya Y Canola  Sab... | -21% | Aceite Vegetal De Soya  Capullo 750 ... | Aceite Vegetal De Ajonjoli Y Soya   ... | 250 ML | Aceite De Soya  Nutrioli 850 Ml | -29% | Margarina Con Sal  Iberia 400 G | 400 GR | Mantequilla Sin Sal  La Gloria  90 G | 90 GR | Mantequilla Con Sal  La Gloria  90 G | Manteca De Cerdo   Morrell 454 G | 454 GR | Aceite De Soya  Nutrioli 400 Ml | Mantequilla Sin Sal  La Gloria 360 G | 360 GR | -24% | Margarina Con Sal  Iberia   90 G | Aceite De Soya Antigoteo  Nutrioli 7... | 700 ML | Margarina Con Sal  Chantilly 190 G | 190 GR | Manteca De Cerdo  Mybrand 454 Gramos | Aceite De Oliva Para Freir  Ines 750... | Margarina Sin Sal  Chantilly 190 G | Margarina Con Sal  Primavera  90 G | Mantequilla Con Sal  La Gloria 360 G | Sustituto De Crema Liquido Vainilla ... | 237 ML | Sustituto De Crema Liquido Avellana ... | Mes patrio Herdez | Adobo    Doña María 235 G | Mole Doña María Almendrado En Pasta ... | Mole Doña María Almendrado Listo Par... | Mole Doña María Poblano Con Cacao En... | Mole Doña Maria Poblano Con Cacao Li... | Mole Doña Mariía Rojo En Pasta   125... | Mole En Pasta 430 Gramos   Doña Mari... | Mole Listo Para Servir  Para Servir ... | Mole Rojo En Pasta  Doña Maria 235 G | Mole Verde En Pasta  Doña Maria 230 ... | Pipián En Pasta  Doña Maria 230 G | Salsa Cacahuate Picante Cremosa   He... | Salsa Casera Con Habanero   Herdez 4... | Salsa Casera  Herdez 210 G | Salsa Guacamole 15% Mas Guacamole He...",,"{""Detalles"": [""El ACEITE VEGETAL MIMARCA de 800 mililitros es un imprescindible en tu despensa. Su alta calidad y versatilidad lo hacen perfecto para cocinar, freír y aderezar tus platillos favoritos. Cuida tu salud y disfruta de una alimen"", ""... Ver más"", ""Ver más"", ""Favoritos"", ""Recomendados"", ""800 ML"", ""Aceite Vegetal  123 1 Lt"", ""1 LT"", ""Aceite Vegetal  Ave 850 Ml"", ""850 ML"", ""Aceite Vegetal De Canola  Capullo 84..."", ""840 ML"", ""Aceite Vegetal De Maíz  Mazola 765 M..."", ""765 ML"", ""Aceite Vegetal De Canola  Capullo 40..."", ""400 ML"", ""Aceite Vegetal  Kartamus 900 Ml"", ""900 ML"", ""Aceite Puro De Maiz   123    1 Litro"", ""Aceite Vegetal Comestible Aerosol  A..."", ""170 GR"", ""Aceite Vegetal De Cártamo  Capullo 7..."", ""750 ML"", ""Aceite Vegetal De Soya Y Canola  Sab..."", ""-21%"", ""Aceite Vegetal De Soya  Capullo 750 ..."", ""Aceite Vegetal De Ajonjoli Y Soya   ..."", ""250 ML"", ""Aceite De Soya  Nutrioli 850 Ml"", ""-29%"", ""Margarina Con Sal  Iberia 400 G"", ""400 GR"", ""Mantequilla Sin Sal  La Gloria  90 G"", ""90 GR"", ""Mantequilla Con Sal  La Gloria  90 G"", ""Manteca De Cerdo   Morrell 454 G"", ""454 GR"", ""Aceite De Soya  Nutrioli 400 Ml"", ""Mantequilla Sin Sal  La Gloria 360 G"", ""360 GR"", ""-24%"", ""Margarina Con Sal  Iberia   90 G"", ""Aceite De Soya Antigoteo  Nutrioli 7..."", ""700 ML"", ""Margarina Con Sal  Chantilly 190 G"", ""190 GR"", ""Manteca De Cerdo  Mybrand 454 Gramos"", ""Aceite De Oliva Para Freir  Ines 750..."", ""Margarina Sin Sal  Chantilly 190 G"", ""Margarina Con Sal  Primavera  90 G"", ""Mantequilla Con Sal  La Gloria 360 G"", ""Sustituto De Crema Liquido Vainilla ..."", ""237 ML"", ""Sustituto De Crema Liquido Avellana ..."", ""Mes patrio Herdez"", ""Adobo    Doña María 235 G"", ""Mole Doña María Almendrado En Pasta ..."", ""Mole Doña María Almendrado Listo Par..."", ""Mole Doña María Poblano Con Cacao En..."", ""Mole Doña Maria Poblano Con Cacao Li..."", ""Mole Doña Mariía Rojo En Pasta   125..."", ""Mole En Pasta 430 Gramos   Doña Mari..."", ""Mole Listo Para Servir  Para Servir ..."", ""Mole Rojo En Pasta  Doña Maria 235 G"", ""Mole Verde En Pasta  Doña Maria 230 ..."", ""Pipián En Pasta  Doña Maria 230 G"", ""Salsa Cacahuate Picante Cremosa   He..."", ""Salsa Casera Con Habanero   Herdez 4..."", ""Salsa Casera  Herdez 210 G"", ""Salsa Guacamole 15% Mas Guacamole He...""]}",dataset/txt_limpios/115.txt,dataset/paginas_descargadas/115.html,EN,aceite vegetal,keep,0.60,heuristic_default
