source_id,title,description,breadcrumbs,price_raw,currency_raw,url,seller,availability,country,product_name,brand,reference,unit,price_amount,price_currency,price_symbol,price_text,price_amount_filled,price_is_imputed,price_imputation_source,price_amount_usd,price_amount_usd_filled,fx_rate_local_per_usd,fx_source,information_text,description_text,features_text,specifications_text,benefits_text,details_text,other_sections,sections,txt_path,html_path,es_status,category_canonical,decision,match_score,reasons
1726,"Bebidas, Aguas y Jugos","Bebidas de Fantasía Ginger Ale Canada Dry 1.5lt | Actualizado al: 28-01-2025 Ingredientes: Agua carbonatada, Azúcar, Ácido cítrico, Saborizante natural, Benzoato de sodio, Colorante caramelo. Certificados: Apto para APLV Libre de Lactosa Vegano Vegetariano Libre de Soya Libre de Huevo Libre de Peces Libre de Mariscos Libre de Maní Libre de Frutas Secos Libre de Nueces Libre de Sulfitos Libre de Trigo Kosher Porción: 1 Vaso (200ml) Porciones por envase: 8 100ml 1 Porción Energía (kCal) 36 72 Proteínas (g) 0 Grasas Totales Hidratos de carbono disponibles 9 18 Azúcares totales (g) Sodio (mg) 7 14 Importante: La información del empaque y/o contenido del producto final puede diferir respecto a lo que mostramos en nuestro sitio web, tanto a nivel de ingredientes, trazas, información nutricional, sellos, modo de uso y/o modo de conservación. Usted debe basarse únicamente en la información que se muestra en nuestro sitio web y siempre debe leer las etiquetas, advertencias y instrucciones antes de usar el consumo de un producto. Información obtenida de BEBIDA GINGER ALE CANADA DRY DESECH 1.5 LT.. Productos similares Ver producto Bebidas Ginger Ale Canada Dry 3 L Bebida Ginger Ale -13% Bebidas Ginger Ale Lata -38% Bebidas Canada Dry Ginger Ale Zero Lata Bebidas Light Bebida Zero Bebidas Ginger Ale Sin Azúcar Bebida Canadá Dry Sin Azúcar 3 L Bebidas Agua Tonica Lata Gaseosa Zero Limon Soda Bebidas Agua Tónica Ginger Ale Canada Dry 1.5 L bebida Kem Piña Zero 3 L Bebida Mango Inca Kola 1.45 lt Bebida Sprite Sin Azúcar 3 L -29% Bebidas Sprite Bebidas Sprite ¡Juntos son mejores! Bebidas Pepsi 1.5 L Bebida Limón Soda Zero Bebida Coca Cola Original 1.5 L Bebida Coca Cola Sin Azúcar 1.5 L Papas Fritas Rústicas Sal de Mar Marco Polo 185 g Ramitas Sabor Original Evercrips 230 g -30% papas Fritas Corte Americano Bebida Coca Cola Original 2.5 L Bebida Coca Cola -33% Ramitas Queso Papas Fritas Corte Americano Lays 200 g -35% Bebidas Sprite Sin Azúcar 1.5 L Doritos de Queso -25% Bebidas Pepsi 2 L Papas Mediterráneas Sabor Jamón Serrano Lay's 180 g -37% Bebida Coca Cola Original 3 L -23% Doritos Queso -26% Papas Fritas Marco Polo Americanas 200 g -17% Papas Fritas Original Kryzpo Lata 130 g -19% Papas Fritas Stax Sabor Crema y Cebolla Lays 134 g -32% Bebida Coca Cola Zero 1 L",Bebidas > 1.5 LT,1.99,,,Desconocido,unknown,UNKNOWN,"Bebidas, Aguas y Jugos",Bebidas,,1.5 LT,1.99,,,1.99,1.99,False,original,1.99,1.99,1.0,default_1usd,,"Bebidas de Fantasía Ginger Ale Canada Dry 1.5lt | Actualizado al: 28-01-2025 Ingredientes: Agua carbonatada, Azúcar, Ácido cítrico, Saborizante natural, Benzoato de sodio, Colorante caramelo. Certificados: Apto para APLV Libre de Lactosa Vegano Vegetariano Libre de Soya Libre de Huevo Libre de Peces Libre de Mariscos Libre de Maní Libre de Frutas Secos Libre de Nueces Libre de Sulfitos Libre de Trigo Kosher Porción: 1 Vaso (200ml) Porciones por envase: 8 100ml 1 Porción Energía (kCal) 36 72 Proteínas (g) 0 Grasas Totales Hidratos de carbono disponibles 9 18 Azúcares totales (g) Sodio (mg) 7 14 Importante: La información del empaque y/o contenido del producto final puede diferir respecto a lo que mostramos en nuestro sitio web, tanto a nivel de ingredientes, trazas, información nutricional, sellos, modo de uso y/o modo de conservación. Usted debe basarse únicamente en la información que se muestra en nuestro sitio web y siempre debe leer las etiquetas, advertencias y instrucciones antes de usar el consumo de un producto. Información obtenida de BEBIDA GINGER ALE CANADA DRY DESECH 1.5 LT.. Productos similares Ver producto Bebidas Ginger Ale Canada Dry 3 L Bebida Ginger Ale -13% Bebidas Ginger Ale Lata -38% Bebidas Canada Dry Ginger Ale Zero Lata Bebidas Light Bebida Zero Bebidas Ginger Ale Sin Azúcar Bebida Canadá Dry Sin Azúcar 3 L Bebidas Agua Tonica Lata Gaseosa Zero Limon Soda Bebidas Agua Tónica Ginger Ale Canada Dry 1.5 L bebida Kem Piña Zero 3 L Bebida Mango Inca Kola 1.45 lt Bebida Sprite Sin Azúcar 3 L -29% Bebidas Sprite Bebidas Sprite ¡Juntos son mejores! Bebidas Pepsi 1.5 L Bebida Limón Soda Zero Bebida Coca Cola Original 1.5 L Bebida Coca Cola Sin Azúcar 1.5 L Papas Fritas Rústicas Sal de Mar Marco Polo 185 g Ramitas Sabor Original Evercrips 230 g -30% papas Fritas Corte Americano Bebida Coca Cola Original 2.5 L Bebida Coca Cola -33% Ramitas Queso Papas Fritas Corte Americano Lays 200 g -35% Bebidas Sprite Sin Azúcar 1.5 L Doritos de Queso -25% Bebidas Pepsi 2 L Papas Mediterráneas Sabor Jamón Serrano Lay's 180 g -37% Bebida Coca Cola Original 3 L -23% Doritos Queso -26% Papas Fritas Marco Polo Americanas 200 g -17% Papas Fritas Original Kryzpo Lata 130 g -19% Papas Fritas Stax Sabor Crema y Cebolla Lays 134 g -32% Bebida Coca Cola Zero 1 L",,,,,,"{""Descripción"": [""Bebidas de Fantasía Ginger Ale Canada Dry"", ""1.5lt | Actualizado al: 28-01-2025"", ""Ingredientes: Agua carbonatada, Azúcar, Ácido cítrico, Saborizante natural, Benzoato de sodio, Colorante caramelo."", ""Certificados: Apto para APLV"", ""Libre de Lactosa"", ""Vegano"", ""Vegetariano"", ""Libre de Soya"", ""Libre de Huevo"", ""Libre de Peces"", ""Libre de Mariscos"", ""Libre de Maní"", ""Libre de Frutos Secos"", ""Libre de Nueces"", ""Libre de Sulfitos"", ""Libre de Trigo"", ""Kosher"", ""Porción: 1 Vaso (200ml)"", ""Porciones por envase: 8"", ""100ml"", ""1 Porción"", ""Energía"", ""(kCal)"", ""36"", ""72"", ""Proteínas"", ""(g)"", ""0"", ""Grasas Totales"", ""Hidratos de carbono disponibles"", ""9"", ""18"", ""Azúcar total (g)"", ""Sodio"", ""(mg)"", ""7"", ""14"", ""Importante: La información del empaque y/o contenido del producto final puede diferir respecto a lo que mostramos en nuestro sitio web, tanto a nivel de ingredientes, trazas, información nutricional, sellos, modo de uso y/o modo de conservación. Usted debe basarse únicamente en la información que se muestra en nuestro sitio web y siempre debe leer las etiquetas, advertencias y instrucciones antes de usar el consumo de un producto."", ""Información obtenida de"", ""BEBIDA GINGER ALE CANADA DRY DESECH 1.5 LT.."", ""Productos similares"", ""Ver producto"", ""Bebida Ginger Ale Canada Dry 3 L"", ""Bebida Ginger Ale"", ""-13%"", ""Bebidas Ginger Ale Lata"", ""-38%"", ""Bebidas Canada Dry Ginger Ale Zero Lata"", ""Bebida Light"", ""Bebida Zero"", ""Bebidas Ginger Ale Sin Azúcar"", ""Bebidas Canadá Dry Sin Azúcar 3 L"", ""Bebidas Agua Tonica Lata"", ""Gaseosa  Zero Limon Soda"", ""Bebidas Agua Tónica Ginger Ale Canada Dry 1.5 L"", ""Bebida Kem Piña Zero 3 L"", ""Bebida Mango Inca Kola 1.45 lt"", ""Bebidas Sprite Sin Azúcar 3 L"", ""-29%"", ""Bebida Sprite"", ""Bebida Sprite Retornable"", ""¡Juntos son mejores!"", ""Bebida Pepsi 1.5 L"", ""Bebida limpia cero"", ""Bebida Coca Cola Original 1.5 L"", ""Bebidas Coca Cola Sin Azúcar 1.5 L"", ""Papas Fritas Rústicas Sal de Mar Marco Polo 185 g"", ""Ramitas Sabor Original Evercrips 230 g"", ""-30%"", ""Papas Fritas Corte Americano"", ""Bebida Coca Cola Original 2.5 L"", ""Bebida Coca Cola"", ""-33%"", ""Ramitas Queso"", ""Papas Fritas Corte Americano Lays 200 g"", ""-35%"", ""Bebidas Sprite Sin Azúcar 1.5 L"", ""Doritos de Queso"", ""-25%"", ""Bebida Pepsi 2 L"", ""Papas mediterráneos Sabor Jamón Serrano Lay's 180 g"", ""-37%"", ""Bebida Coca Cola Original 3 L"", ""-23%"", ""Doritos Queso"", ""-26%"", ""Papas Fritas Marco Polo Americanas 200 g"", ""-17%"", ""Papas Fritas Original Kryzpo Lata 130 g"", ""-19%"", ""Papas Fritas Stax Sabor Crema y Cebolla Lays 134 g"", ""-32%"", ""Bebida Coca Cola Zero 1 L""]}",dataset/txt_limpios/1726.txt,dataset/paginas_descargadas/1726.html,ET,papa,keep,0.60,heuristic_default
1728,"Bebidas, Aguas y Jugos","Bebidas de Fantasía Original Inca Kola 1.5lt | Actualizado al: 28-04-2025 Ingredientes: Agua carbonatada, Azúcar, Ácido cítrico, Benzoato de sodio, Cafeína, Saborizantes naturales, Saborizantes artificiales, Tartrazina. Certificados: Apto para APLV Libre de Lactosa Vegano Vegetariano Libre de Soya Libre de Huevo Libre de Peces Libre de Mariscos Libre de Maní Libre de Frutas Secos Libre de Nueces Libre de Sulfitos Libre de Trigo Porción: 1 Vaso (200ml) Porciones por envase: 8 100ml 1 Porción Energía (kCal) 42 84 Proteínas (g) 0 Grasas Totales Hidratos de carbono disponibles 10 20 Azúcar total (g) 10.2 20.4 Sodio (mg) Importante: La información del empaque y/o contenido del producto final puede diferir respecto a lo que mostramos en nuestro sitio web, tanto a nivel de ingredientes, trazas, información nutricional, sellos, modo de uso y/o modo de conservación. Usted debe basarse únicamente en la información que se muestra en nuestro sitio web y siempre debe leer las etiquetas, advertencias y instrucciones antes de usar el consumo de un producto. Información obtenida de productos similares BEBIDA INCA KOLA 3 LT -29% Ver producto bebida Kem Piña Zero 3 L BEBIDA INCA KOLA ZERO 1500 CC DES. bebida Sprite Sin Azúcar 1.5 L Bebida Sprite 2.5 L BEBIDA PEPSI 2.5 LT DESECHABLE. Bebidas Fanta Original 1.5 Lt Bebida Inca Kola Original 1.75 L Bebida Pap 3 L Bebida Pap Zero 3 L Bebida Pepsi 3 L -27% Bebidas Kem Zero 600 ml -26% bebida Kem Piña 3 L Bebida Pepsi 1.5 L Bebida Fanta Sin Azúcar 1.45 lt ¡Juntos son mejores! Bebidas Sprite Bebidas Ginger Ale -13% Bebidas Ginger Ale Sin Azúcar Bebida Coca Cola Original 1.5 L Bebida Pepsi 2 L Doritos Queso Bebida Coca Cola Original 3 L -23% Bebidas Coca Cola Sin Azúcar 1.5 L Bebida Coca Cola -33% Ramitas Queso -30% Papas Fritas Corte Americano Papas Fritas Corte Americano Lays 200 g -35% Papas Fritas Stax Sabor Crema y Cebolla Lays 134 g -32% Bebida Coca Cola Zero 1 L Bebida Coca Cola Sin Azúcar 3 L",Bebidas > 1.5 LT,1.99,,,Desconocido,unknown,UNKNOWN,"Bebidas, Aguas y Jugos",Bebidas,,1.5 LT,1.99,,,1.99,1.99,False,original,1.99,1.99,1.0,default_1usd,,"Bebidas de Fantasía Original Inca Kola 1.5lt | Actualizado al: 28-04-2025 Ingredientes: Agua carbonatada, Azúcar, Ácido cítrico, Benzoato de sodio, Cafeína, Saborizantes naturales, Saborizantes artificiales, Tartrazina. Certificados: Apto para APLV Libre de Lactosa Vegano Vegetariano Libre de Soya Libre de Huevo Libre de Peces Libre de Mariscos Libre de Maní Libre de Frutas Secos Libre de Nueces Libre de Sulfitos Libre de Trigo Porción: 1 Vaso (200ml) Porciones por envase: 8 100ml 1 Porción Energía (kCal) 42 84 Proteínas (g) 0 Grasas Totales Hidratos de carbono disponibles 10 20 Azúcar total (g) 10.2 20.4 Sodio (mg) Importante: La información del empaque y/o contenido del producto final puede diferir respecto a lo que mostramos en nuestro sitio web, tanto a nivel de ingredientes, trazas, información nutricional, sellos, modo de uso y/o modo de conservación. Usted debe basarse únicamente en la información que se muestra en nuestro sitio web y siempre debe leer las etiquetas, advertencias y instrucciones antes de usar el consumo de un producto. Información obtenida de productos similares BEBIDA INCA KOLA 3 LT -29% Ver producto bebida Kem Piña Zero 3 L BEBIDA INCA KOLA ZERO 1500 CC DES. bebida Sprite Sin Azúcar 1.5 L Bebida Sprite 2.5 L BEBIDA PEPSI 2.5 LT DESECHABLE. Bebidas Fanta Original 1.5 Lt Bebida Inca Kola Original 1.75 L Bebida Pap 3 L Bebida Pap Zero 3 L Bebida Pepsi 3 L -27% Bebidas Kem Zero 600 ml -26% bebida Kem Piña 3 L Bebida Pepsi 1.5 L Bebida Fanta Sin Azúcar 1.45 lt ¡Juntos son mejores! Bebidas Sprite Bebidas Ginger Ale -13% Bebidas Ginger Ale Sin Azúcar Bebida Coca Cola Original 1.5 L Bebida Pepsi 2 L Doritos Queso Bebida Coca Cola Original 3 L -23% Bebidas Coca Cola Sin Azúcar 1.5 L Bebida Coca Cola -33% Ramitas Queso -30% Papas Fritas Corte Americano Papas Fritas Corte Americano Lays 200 g -35% Papas Fritas Stax Sabor Crema y Cebolla Lays 134 g -32% Bebida Coca Cola Zero 1 L Bebida Coca Cola Sin Azúcar 3 L",,,,,,"{""Descripción"": [""Bebidas de Fantasía Original Inca Kola"", ""1.5lt | Actualizado al: 28-04-2025"", ""Ingredientes: Agua carbonatada, Azúcar, Ácido cítrico, Benzoato de sodio, Cafeína, Saborizantes naturales, Saborizantes artificiales, Tartrazina."", ""Certificados: Apto para APLV"", ""Libre de Lactosa"", ""Vegano"", ""Vegetariano"", ""Libre de Soya"", ""Libre de Huevo"", ""Libre de Peces"", ""Libre de Mariscos"", ""Libre de Maní"", ""Libre de Frutos Secos"", ""Libre de Nueces"", ""Libre de Sulfitos"", ""Libre de Trigo"", ""Porción: 1 Vaso (200ml)"", ""Porciones por envase: 8"", ""100ml"", ""1 Porción"", ""Energía"", ""(kCal)"", ""42"", ""84"", ""Proteínas"", ""(g)"", ""0"", ""Grasas Totales"", ""Hidratos de carbono disponibles"", ""10"", ""20"", ""Azúcar total (g)"", ""10.2"", ""20.4"", ""Sodio"", ""(mg)"", ""Importante: La información del empaque y/o contenido del producto final puede diferir respecto a lo que mostramos en nuestro sitio web, tanto a nivel de ingredientes, trazas, información nutricional, sellos, modo de uso y/o modo de conservación. Usted debe basarse únicamente en la información que se muestra en nuestro sitio web y siempre debe leer las etiquetas, advertencias y instrucciones antes de usar el consumo de un producto."", ""Información obtenida de"", ""Productos similares"", ""BEBIDA INCA KOLA 3 LT"", ""-29%"", ""Ver producto"", ""Bebida Kem Piña Zero 3 L"", ""BEBIDA INCA KOLA ZERO 1500 CC DES."", ""Bebidas Sprite Sin Azúcar 1.5 L"", ""Bebida Sprite 2.5 L"", ""BEBIDA PEPSI 2.5 LT DESECHABLE.."", ""Bebida Fanta Original 1.5 Lt"", ""Bebida Inca Kola Original 1.75 L"", ""Bebida Pap 3 L"", ""Bebida Pap Zero 3 L"", ""Bebida Pepsi 3 L"", ""-27%"", ""Bebida Kem Zero 600 ml"", ""-26%"", ""Bebida Kem Piña 3 L"", ""Bebida Pepsi 1.5 L"", ""Bebidas Fanta Sin Azúcar 1.45 lt"", ""¡Juntos son mejores!"", ""Bebida Sprite"", ""Bebida Ginger Ale"", ""-13%"", ""Bebidas Ginger Ale Sin Azúcar"", ""Bebida Coca Cola Original 1.5 L"", ""Bebida Pepsi 2 L"", ""Doritos Queso"", ""Bebida Coca Cola Original 3 L"", ""-23%"", ""Bebidas Coca Cola Sin Azúcar 1.5 L"", ""Bebida Coca Cola"", ""-33%"", ""Ramitas Queso"", ""-30%"", ""Papas Fritas Corte Americano"", ""Papas Fritas Corte Americano Lays 200 g"", ""-35%"", ""Papas Fritas Stax Sabor Crema y Cebolla Lays 134 g"", ""-32%"", ""Bebida Coca Cola Zero 1 L"", ""Bebida Coca Cola Sin Azúcar 3 L""]}",dataset/txt_limpios/1728.txt,dataset/paginas_descargadas/1728.html,ET,papa,keep,0.60,heuristic_default
1730,"Bebidas, Aguas y Jugos","Bebidas Gaseosa Naranja Crush 1.5lt | Actualizado al: 02-04-2025 Ingredientes: Agua carbonatada, Azúcar, Ácido cítrico, Saborizantes naturales, Sorbato de potasio, Benzoato de sodio, Sucralosa, Acesulfamo de potasio, Ácido ascórbico, Amarillo crepúsculo, Rojo allura ac. Certificados: Libre de Gluten / Sin TACC Apto para APLV Libre de Lactosa Vegano Vegetariano Libre de Soya Libre de Huevo Libre de Peces Libre de Mariscos Libre de Maní Libre de Frutas Secos Libre de Nueces Libre de Sulfitos Libre de Trigo Kosher Porción: 1 Vaso (200ml) Porciones por envase: 8 100ml 1 Porción Energía (kCal) 16 32 Proteínas (g) 0 Grasas Totales Hidratos de carbono disponibles 4 8 Azúcares totales (g) Sodio (mg) 14 28 Importante: La información del empaque y/o contenido del producto final puede diferir respecto a lo que mostramos en nuestro sitio web, tanto a nivel de ingredientes, trazas, información nutricional, sellos, modo de uso y/o modo de conservación. Usted debe basarse únicamente en la información que se muestra en nuestro sitio web y siempre debe leer las etiquetas, advertencias y instrucciones antes de usar el consumo de un producto. Información obtenida de BEBIDA CRUSH 1500 CC. DESECH. Productos similares Ver producto Bebida Kem Bebida Pap Bebidas Crush Zero 1.5 Lt Bebida Zero Bebida Kem Piña 3 L bebida Bilz Bebida Pap Lata -38% Bebidas Fanta Volverble Bebida Sprite -22% BEBIDA INCA KOLA 3 LT -29% bebida Crush 600 ml -26% bebida Crush Naranja 3 L Bebida Coca Cola Original 3 L -23% Bebidas Crush Zero 600 ml Bebidas Bilz Zero Bebida Kem Piña Zero 3 ¡L! ¡Juntos son mejores! Bebidas Limón Soda Zero Bebida Pepsi 1.5 L Bebida Coca Cola Original 1.5 L Bebida Coca Cola Sin Azúcar 1.5 L Bebida Coca Cola -33% Papas Fritas Corte Americano Lays 150 g Ramitas Sabor Original Evercrips 230 g -30% Bebida Coca Cola Original 2.5 L -25% Doritos de Queso Papas Fritas Marco Polo Caseras 200 g -17% Papas Fritas Corte Americano Bebida Sprite Sin Azúcar 1.5 L Bebida Pepsi 2 L Papas Fritas Marco Polo Americanas 200 g Ramitas Queso Papas Fritas Corte Americano Lays 200 g -35% Bebidas Coca Cola Zero 1 L Doritos Queso Bebida Coca Cola Sin Azúcar 3 L",Bebidas > 1.5 LT,1.99,,,Desconocido,unknown,UNKNOWN,"Bebidas, Aguas y Jugos",Bebidas,,1.5 LT,1.99,,,1.99,1.99,False,original,1.99,1.99,1.0,default_1usd,,"Bebidas Gaseosa Naranja Crush 1.5lt | Actualizado al: 02-04-2025 Ingredientes: Agua carbonatada, Azúcar, Ácido cítrico, Saborizantes naturales, Sorbato de potasio, Benzoato de sodio, Sucralosa, Acesulfamo de potasio, Ácido ascórbico, Amarillo crepúsculo, Rojo allura ac. Certificados: Libre de Gluten / Sin TACC Apto para APLV Libre de Lactosa Vegano Vegetariano Libre de Soya Libre de Huevo Libre de Peces Libre de Mariscos Libre de Maní Libre de Frutas Secos Libre de Nueces Libre de Sulfitos Libre de Trigo Kosher Porción: 1 Vaso (200ml) Porciones por envase: 8 100ml 1 Porción Energía (kCal) 16 32 Proteínas (g) 0 Grasas Totales Hidratos de carbono disponibles 4 8 Azúcares totales (g) Sodio (mg) 14 28 Importante: La información del empaque y/o contenido del producto final puede diferir respecto a lo que mostramos en nuestro sitio web, tanto a nivel de ingredientes, trazas, información nutricional, sellos, modo de uso y/o modo de conservación. Usted debe basarse únicamente en la información que se muestra en nuestro sitio web y siempre debe leer las etiquetas, advertencias y instrucciones antes de usar el consumo de un producto. Información obtenida de BEBIDA CRUSH 1500 CC. DESECH. Productos similares Ver producto Bebida Kem Bebida Pap Bebidas Crush Zero 1.5 Lt Bebida Zero Bebida Kem Piña 3 L bebida Bilz Bebida Pap Lata -38% Bebidas Fanta Volverble Bebida Sprite -22% BEBIDA INCA KOLA 3 LT -29% bebida Crush 600 ml -26% bebida Crush Naranja 3 L Bebida Coca Cola Original 3 L -23% Bebidas Crush Zero 600 ml Bebidas Bilz Zero Bebida Kem Piña Zero 3 ¡L! ¡Juntos son mejores! Bebidas Limón Soda Zero Bebida Pepsi 1.5 L Bebida Coca Cola Original 1.5 L Bebida Coca Cola Sin Azúcar 1.5 L Bebida Coca Cola -33% Papas Fritas Corte Americano Lays 150 g Ramitas Sabor Original Evercrips 230 g -30% Bebida Coca Cola Original 2.5 L -25% Doritos de Queso Papas Fritas Marco Polo Caseras 200 g -17% Papas Fritas Corte Americano Bebida Sprite Sin Azúcar 1.5 L Bebida Pepsi 2 L Papas Fritas Marco Polo Americanas 200 g Ramitas Queso Papas Fritas Corte Americano Lays 200 g -35% Bebidas Coca Cola Zero 1 L Doritos Queso Bebida Coca Cola Sin Azúcar 3 L",,,,,,"{""Descripción"": [""Bebida Gaseosa Naranja Crush"", ""1.5lt | Actualizado al: 02-04-2025"", ""Ingredientes: Agua carbonatada, Azúcar, Ácido cítrico, Saborizantes naturales, Sorbato de potasio, Benzoato de sodio, Sucralosa, Acesulfamo de potasio, Ácido ascórbico, Amarillo crepúsculo, Rojo allura ac."", ""Certificados: Libre de Gluten / Sin TACC"", ""Apto para APLV"", ""Libre de Lactosa"", ""Vegano"", ""Vegetariano"", ""Libre de Soya"", ""Libre de Huevo"", ""Libre de Peces"", ""Libre de Mariscos"", ""Libre de Maní"", ""Libre de Frutos Secos"", ""Libre de Nueces"", ""Libre de Sulfitos"", ""Libre de Trigo"", ""Kosher"", ""Porción: 1 Vaso (200ml)"", ""Porciones por envase: 8"", ""100ml"", ""1 Porción"", ""Energía"", ""(kCal)"", ""16"", ""32"", ""Proteínas"", ""(g)"", ""0"", ""Grasas Totales"", ""Hidratos de carbono disponibles"", ""4"", ""8"", ""Azúcar total (g)"", ""Sodio"", ""(mg)"", ""14"", ""28"", ""Importante: La información del empaque y/o contenido del producto final puede diferir respecto a lo que mostramos en nuestro sitio web, tanto a nivel de ingredientes, trazas, información nutricional, sellos, modo de uso y/o modo de conservación. Usted debe basarse únicamente en la información que se muestra en nuestro sitio web y siempre debe leer las etiquetas, advertencias y instrucciones antes de usar el consumo de un producto."", ""Información obtenida de"", ""BEBIDA CRUSH 1500 CC. DESECH."", ""Productos similares"", ""Ver producto"", ""Bebida Kem"", ""Bebida Pap"", ""Bebida Crush Zero 1.5 Lt"", ""Bebida Zero"", ""Bebida Kem Piña 3 L"", ""Bebida Bilz"", ""Bebida Pap Lata"", ""-38%"", ""Bebida Fanta Retornable"", ""Bebida Sprite"", ""-22%"", ""BEBIDA INCA KOLA 3 LT"", ""-29%"", ""Bebida Crush 600 ml"", ""-26%"", ""Bebida Crush Naranja 3 L"", ""Bebida Coca Cola Original 3 L"", ""-23%"", ""Bebida Crush Zero 600 ml"", ""Bebida Bilz Zero"", ""Bebida Kem Piña Zero 3 L"", ""¡Juntos son mejores!"", ""Bebida limpia cero"", ""Bebida Pepsi 1.5 L"", ""Bebida Coca Cola Original 1.5 L"", ""Bebidas Coca Cola Sin Azúcar 1.5 L"", ""Bebida Coca Cola"", ""-33%"", ""Papas Fritas Corte Americano Lays 150 g"", ""Ramitas Sabor Original Evercrips 230 g"", ""-30%"", ""Bebida Coca Cola Original 2.5 L"", ""-25%"", ""Doritos de Queso"", ""Papas Fritas Marco Polo Caseras 200 g"", ""-17%"", ""Papas Fritas Corte Americano"", ""Bebidas Sprite Sin Azúcar 1.5 L"", ""Bebida Pepsi 2 L"", ""Papas Fritas Marco Polo Americanas 200 g"", ""Ramitas Queso"", ""Papas Fritas Corte Americano Lays 200 g"", ""-35%"", ""Bebida Coca Cola Zero 1 L"", ""Doritos Queso"", ""Bebida Coca Cola Sin Azúcar 3 L""]}",dataset/txt_limpios/1730.txt,dataset/paginas_descargadas/1730.html,ET,papa,keep,0.60,heuristic_default
