{"source_id": "1153", "title": "Centro de preferencia de la privacidad", "description": "", "breadcrumbs": "Activas siempre > 5Kg", "price_raw": "", "currency_raw": "PEN", "url": "", "seller": "Desconocido", "availability": "unknown", "country": "PE", "product_name": "Centro de preferencia de la privacidad", "brand": "Activas siempre", "reference": "", "unit": "5Kg", "price_amount": null, "price_currency": "PEN", "price_symbol": "", "price_text": "", "price_amount_filled": "55.14", "price_is_imputed": "True", "price_imputation_source": "country_mean", "price_amount_usd": "", "price_amount_usd_filled": "15.5336", "fx_rate_local_per_usd": "3.55", "fx_source": "from_peru_cambio_dolar", "information_text": "", "description_text": "", "features_text": "TE RECOMENDAMOS | Arroz Superior PAISANA Bolsa 1Kg | 6 | 30 | -18% | VALLENORTE | Arroz Superior VALLENORTE Bolsa 750g | 4 | -19% | Arroz Superior VALLENORTE Bolsa 5Kg | 25 | 20 | 19% | BELL'S | Arroz Superior BELL'S Bolsa 750g | 3 | 50 | Arroz Superior BELL'S Bolsa 5Kg | 19 | FARAON | Arroz Añejo Amarillo FARAÓN G3 Bolsa 1Kg | 5 | 10 | -17% | Arroz Superior Añejo VALLENORTE Bolsa 5Kg | 27 | 22 | 17% | Arroz Superior Añejo VALLENORTE Bolsa 750g | 80 | Arroz FARAON Añejo Amarillo G3 Bolsa 5kg | ¡Entérate de eventos exclusivos y promociones especiales que tenemos para ti! | SUSCRIBIRME | Acepto las políticas de tratamientos de datos personales | Razón Social: Compañía Food Retail S.A.C. RUC: 20608300393. Todos los derechos reservados Vivanda 2023. | | Hola! | Encuentra todo lo que necesitas en Vivanda online | Términos más buscados | 1. | quesos | 2. | vino | 3. | café | 4. | quark 500g | 5. | leche | 6. | pollo | 7. | yogurt | 8. | lunch florencia | 9. | agua | 10 | vinos", "specifications_text": "", "benefits_text": "", "details_text": "", "other_sections": "", "sections": {"Características": ["TE RECOMENDAMOS", "Arroz Superior PAISANA Bolsa 1Kg", "6", "30", "-18%", "VALLENORTE", "Arroz Superior VALLENORTE Bolsa 750g", "4", "-19%", "Arroz Superior VALLENORTE Bolsa 5Kg", "25", "20", "19%", "BELL'S", "Arroz Superior BELL'S Bolsa 750g", "3", "50", "Arroz Superior BELL'S Bolsa 5Kg", "19", "FARAON", "Arroz Añejo Amarillo FARAÓN G3 Bolsa 1Kg", "5", "10", "-17%", "Arroz Superior Añejo VALLENORTE Bolsa 5Kg", "27", "22", "17%", "Arroz Superior Añejo VALLENORTE Bolsa 750g", "80", "Arroz FARAON Añejo Amarillo G3 Bolsa 5kg", "¡Entérate de eventos exclusivos y promociones especiales que tenemos para ti!", "SUSCRIBIRME", "Acepto las políticas de tratamiento de datos personales", "Razón social: Compañía Food Retail S.A.C. RUC: 20608300393. Todos los derechos reservados Vivanda 2023.", "¡Hola!", "Encuentra todo lo que necesitas en Vivanda online", "Términos más buscados", "1.", "quesos", "2.", "vino", "3.", "cafe", "4.", "quark 500g", "5.", "leche", "6.", "pollo", "7.", "yogurt", "8.", "lunch florencia", "9.", "agua", "10.", "vinos"]}, "txt_path": "dataset/txt_limpios/1153.txt", "html_path": "dataset/paginas_descargadas/1153.html", "es_status": "ET", "category_canonical": "sin_categoria", "decision": "discard", "match_score": 0.3, "reasons": "no_category_detected;price_parse_failed"}
{"source_id": "1154", "title": "Centro de preferencia de la privacidad", "description": "", "breadcrumbs": "Activas siempre > 750gr", "price_raw": "", "currency_raw": "PEN", "url": "", "seller": "Desconocido", "availability": "unknown", "country": "PE", "product_name": "Centro de preferencia de la privacidad", "brand": "Activas siempre", "reference": "", "unit": "750gr", "price_amount": null, "price_currency": "PEN", "price_symbol": "", "price_text": "", "price_amount_filled": "55.14", "price_is_imputed": "True", "price_imputation_source": "country_mean", "price_amount_usd": "", "price_amount_usd_filled": "15.5336", "fx_rate_local_per_usd": "3.55", "fx_source": "from_peru_cambio_dolar", "information_text": "", "description_text": "", "features_text": "", "specifications_text": "", "benefits_text": "", "details_text": "", "other_sections": "", "sections": {}, "txt_path": "dataset/txt_limpios/1154.txt", "html_path": "dataset/paginas_descargadas/1154.html", "es_status": "EN", "category_canonical": "sin_categoria", "decision": "discard", "match_score": 0.3, "reasons": "no_category_detected;price_parse_failed"}
{"source_id": "1155", "title": "Centro de preferencia de la privacidad", "description": "", "breadcrumbs": "Activas siempre > 8 Piezas", "price_raw": "", "currency_raw": "PEN", "url": "", "seller": "Desconocido", "availability": "unknown", "country": "PE", "product_name": "Centro de preferencia de la privacidad", "brand": "Activas siempre", "reference": "", "unit": "8 Piezas", "price_amount": null, "price_currency": "PEN", "price_symbol": "", "price_text": "", "price_amount_filled": "55.14", "price_is_imputed": "True", "price_imputation_source": "country_mean", "price_amount_usd": "", "price_amount_usd_filled": "15.5336", "fx_rate_local_per_usd": "3.55", "fx_source": "from_peru_cambio_dolar", "information_text": "", "description_text": "", "features_text": "TE RECOMENDAMOS | VIVANDA | Pollo Entero Fresco con Menudencia | 9 | 50 | REDONDOS | Baby Chicken Congelado REDONDOS | 21 | 99 | Pollo Entero sin Piel ARTISAN Light x Kg | En el disponible | Pollo Fresco con Menúdencia Trozado en 8 Piezas | Pollo Fresco Light Sin Piel | ¡Entérate de eventos exclusivos y promociones especiales que tenemos para ti! | SUSCRIBIRME | Acepto las políticas de tratamientos de datos personales | Razón Social: Compañía Food Retail S.A.C. RUC: 20608300393. Todos los derechos reservados Vivanda 2023. | |Hola! | Encuentra todo lo que necesitas en Vivanda online | Términos más buscados | 1. | quesos | 2. | vino | 3. | café | 4. | quark 500g | 5. | leche | 6. | yogurt | 8. | lunch florencia | 9. | agua | 10 | vinos", "specifications_text": "", "benefits_text": "", "details_text": "", "other_sections": "", "sections": {"Características": ["TE RECOMENDAMOS", "VIVANDA", "Pollo Entero Fresco con Menudencia", "9", "50", "REDONDOS", "Baby Chicken Congelado REDONDOS", "21", "99", "Pollo Entero sin Piel ARTISAN Light x Kg", "No disponible", "Pollo Fresco con Menudencia Trozado en 8 Piezas", "Pollo Fresco Light Sin Piel", "¡Entérate de eventos exclusivos y promociones especiales que tenemos para ti!", "SUSCRIBIRME", "Acepto las políticas de tratamiento de datos personales", "Razón social: Compañía Food Retail S.A.C. RUC: 20608300393. Todos los derechos reservados Vivanda 2023.", "¡Hola!", "Encuentra todo lo que necesitas en Vivanda online", "Términos más buscados", "1.", "quesos", "2.", "vino", "3.", "cafe", "4.", "quark 500g", "5.", "leche", "6.", "7.", "yogurt", "8.", "lunch florencia", "9.", "agua", "10.", "vinos"]}, "txt_path": "dataset/txt_limpios/1155.txt", "html_path": "dataset/paginas_descargadas/1155.html", "es_status": "ET", "category_canonical": "sin_categoria", "decision": "discard", "match_score": 0.3, "reasons": "no_category_detected;price_parse_failed"}
{"source_id": "1156", "title": "Centro de preferencia de la privacidad", "description": "", "breadcrumbs": "Activas siempre > 500g", "price_raw": "", "currency_raw": "PEN", "url": "", "seller": "Desconocido", "availability": "unknown", "country": "PE", "product_name": "Centro de preferencia de la privacidad", "brand": "Activas siempre", "reference": "", "unit": "500g", "price_amount": null, "price_currency": "PEN", "price_symbol": "", "price_text": "", "price_amount_filled": "55.14", "price_is_imputed": "True", "price_imputation_source": "country_mean", "price_amount_usd": "", "price_amount_usd_filled": "15.5336", "fx_rate_local_per_usd": "3.55", "fx_source": "from_peru_cambio_dolar", "information_text": "", "description_text": "", "features_text": "", "specifications_text": "", "benefits_text": "", "details_text": "", "other_sections": "", "sections": {}, "txt_path": "dataset/txt_limpios/1156.txt", "html_path": "dataset/paginas_descargadas/1156.html", "es_status": "EN", "category_canonical": "sin_categoria", "decision": "discard", "match_score": 0.3, "reasons": "no_category_detected;price_parse_failed"}
{"source_id": "1157", "title": "Centro de preferencia de la privacidad", "description": "", "breadcrumbs": "Activas siempre > 1.4Kg", "price_raw": "", "currency_raw": "PEN", "url": "", "seller": "Desconocido", "availability": "unknown", "country": "PE", "product_name": "Centro de preferencia de la privacidad", "brand": "Activas siempre", "reference": "", "unit": "1.4Kg", "price_amount": null, "price_currency": "PEN", "price_symbol": "", "price_text": "", "price_amount_filled": "55.14", "price_is_imputed": "True", "price_imputation_source": "country_mean", "price_amount_usd": "", "price_amount_usd_filled": "15.5336", "fx_rate_local_per_usd": "3.55", "fx_source": "from_peru_cambio_dolar", "information_text": "", "description_text": "", "features_text": "TE RECOMENDAMOS | REDONDOS | Piernas y Muslos Aderezo Criollo REDONDOS Bolsa 780g | 17 | 89 | Piernas y Muslos Aderezo Estofado REDONDOS Bolsa 780g | 20 | Pollada Criolla REDONDOS Media Pechuga y Pierna con Encuentro Bolsa 800g | 90 | Pollada Criolla REDONDOS Pierna con Encuentro Bolsa 780g | 16 | 50 | EL AVIADOR | Alitas de Pollo Buffalo Maceradas EL AVIADOR Bolsa 16un | No disponible | Sangrecita de Pollo REDONDOS Bolsa 500g | AVINKA | Carne Molida de Pollo AVINKA | Precio x kg | 24 | Pollo Trozado Macerado SAN FERNANDO ¡Asu Olla! Sazón Pollo Pollada Bolsa 800g | 18 | Piernas y Muslos Aderezo Oriental REDONDOS Bolsa 780g | ¡Entérate de eventos exclusivos y promociones especiales que tenemos para ti! | SUSCRIBIRME | Acepto las políticas de tratamientos de datos personales | Razón Social: Compañía Food Retail S.A.C. RUC: 20608300393. Todos los derechos reservados Vivanda 2023. | |Hola! | Encuentra todo lo que necesitas en Vivanda online | Términos más buscados | 1. | quesos | 2. | vino | 3. | café | 4. | quark 500g | 5. | leche | 6. | yogurt | 8. | lunch florencia | 9. | agua | 10 | vinos", "specifications_text": "", "benefits_text": "", "details_text": "", "other_sections": "", "sections": {"Características": ["TE RECOMENDAMOS", "REDONDOS", "Piernas y Muslos Aderezo Criollo REDONDOS Bolsa 780g", "17", "89", "Piernas y Muslos Aderezo Estofado REDONDOS Bolsa 780g", "20", "Pollada Criolla REDONDOS Media Pechuga y Pierna con Encuentro Bolsa 800g", "90", "Pollada Criolla REDONDOS Pierna con Encuentro Bolsa 780g", "16", "50", "EL AVIADOR", "Alitas de Pollo Buffalo Maceradas EL AVIADOR Bolsa 16un", "No disponible", "Sangrecita de Pollo REDONDOS Bolsa 500g", "AVINKA", "Carne Molida de Pollo AVINKA", "Precio x kg", "24", "Pollo Trozado Macerado SAN FERNANDO ¡Asu Olla! Sazón Pollo Pollada Bolsa 800g", "18", "Piernas y Muslos Aderezo Oriental REDONDOS Bolsa 780g", "¡Entérate de eventos exclusivos y promociones especiales que tenemos para ti!", "SUSCRIBIRME", "Acepto las políticas de tratamiento de datos personales", "Razón social: Compañía Food Retail S.A.C. RUC: 20608300393. Todos los derechos reservados Vivanda 2023.", "¡Hola!", "Encuentra todo lo que necesitas en Vivanda online", "Términos más buscados", "1.", "quesos", "2.", "vino", "3.", "cafe", "4.", "quark 500g", "5.", "leche", "6.", "7.", "yogurt", "8.", "lunch florencia", "9.", "agua", "10.", "vinos"]}, "txt_path": "dataset/txt_limpios/1157.txt", "html_path": "dataset/paginas_descargadas/1157.html", "es_status": "ET", "category_canonical": "sin_categoria", "decision": "discard", "match_score": 0.3, "reasons": "no_category_detected;price_parse_failed"}
{"source_id": "1158", "title": "Centro de preferencia de la privacidad", "description": "", "breadcrumbs": "Activas siempre > 1Kg", "price_raw": "", "currency_raw": "PEN", "url": "", "seller": "Desconocido", "availability": "unknown", "country": "PE", "product_name": "Centro de preferencia de la privacidad", "brand": "Activas siempre", "reference": "", "unit": "1Kg", "price_amount": null, "price_currency": "PEN", "price_symbol": "", "price_text": "", "price_amount_filled": "55.14", "price_is_imputed": "True", "price_imputation_source": "country_mean", "price_amount_usd": "", "price_amount_usd_filled": "15.5336", "fx_rate_local_per_usd": "3.55", "fx_source": "from_peru_cambio_dolar", "information_text": "", "description_text": "", "features_text": "TE RECOMENDAMOS | Piernas y Muslos Aderezo Pachamanca REDONDOS Bolsa 780g | 17 | Piernas y Muslos Aderezo Oriental REDONDOS Bolsa 780g | Piernas y Muslos Aderezo Estofado REDONDOS Bolsa 780g | Filete de Pechuga de Pollo Oriental REDONDOS Bandeja 620g | 40 | EL AVIADOR | Alitas Orientales Maceradas EL AVIADOR Bolsa 16un | No disponible | Sangrecita de Pollo REDONDOS Bolsa 500g | SAN FERNANDO | Alitas Maceradas Orientales SAN FERNANDO Paquete 1kg | 26 | 80 | AVINKA | Carne Molida de Pollo AVINKA | Precio x kg | 24 | Pollo Trozado Macerado SAN FERNANDO ¡Asu Olla! Sazón Pollo Al Horno Bolsa 800g | Pollo Trozado Macerado SAN FERNANDO Asu Olla! Sazón Pollo Oriental Bolsa 800g | ¡Entérate de eventos exclusivos y promociones especiales que tenemos para ti! | SUSCRIBIRME | Acepto las políticas de tratamientos de datos personales | Razón Social: Compañía Food Retail S.A.C. RUC: 20608300393. Todos los derechos reservados Vivanda 2023. | |Hola! | Encuentra todo lo que necesitas en Vivanda online | Términos más buscados | 1. | quesos | 2. | vino | 3. | café | 4. | quark 500g | 5. | leche | 6. | yogurt | 8. | lunch florencia | 9. | agua | 10 | vinos", "specifications_text": "", "benefits_text": "", "details_text": "", "other_sections": "", "sections": {"Características": ["TE RECOMENDAMOS", "Piernas y Muslos Aderezo Pachamanca REDONDOS Bolsa 780g", "17", "Piernas y Muslos Aderezo Oriental REDONDOS Bolsa 780g", "Piernas y Muslos Aderezo Estofado REDONDOS Bolsa 780g", "Filete de Pechuga de Pollo Oriental REDONDOS Bandeja 620g", "40", "EL AVIADOR", "Alitas Orientales Maceradas EL AVIADOR Bolsa 16un", "No disponible", "Sangrecita de Pollo REDONDOS Bolsa 500g", "SAN FERNANDO", "Alitas Maceradas Orientales SAN FERNANDO Paquete 1kg", "26", "80", "AVINKA", "Carne Molida de Pollo AVINKA", "Precio x kg", "24", "Pollo Trozado Macerado SAN FERNANDO ¡Asu Olla! Sazón Pollo Al Horno Bolsa 800g", "Pollo Trozado Macerado SAN FERNANDO ¡Asu Olla! Sazón Pollo Oriental Bolsa 800g", "¡Entérate de eventos exclusivos y promociones especiales que tenemos para ti!", "SUSCRIBIRME", "Acepto las políticas de tratamiento de datos personales", "Razón social: Compañía Food Retail S.A.C. RUC: 20608300393. Todos los derechos reservados Vivanda 2023.", "¡Hola!", "Encuentra todo lo que necesitas en Vivanda online", "Términos más buscados", "1.", "quesos", "2.", "vino", "3.", "cafe", "4.", "quark 500g", "5.", "leche", "6.", "7.", "yogurt", "8.", "lunch florencia", "9.", "agua", "10.", "vinos"]}, "txt_path": "dataset/txt_limpios/1158.txt", "html_path": "dataset/paginas_descargadas/1158.html", "es_status": "ET", "category_canonical": "sin_categoria", "decision": "discard", "match_score": 0.3, "reasons": "no_category_detected;price_parse_failed"}
{"source_id": "1159", "title": "Centro de preferencia de la privacidad", "description": "", "breadcrumbs": "Activas siempre > 500g", "price_raw": "", "currency_raw": "PEN", "url": "", "seller": "Desconocido", "availability": "unknown", "country": "PE", "product_name": "Centro de preferencia de la privacidad", "brand": "Activas siempre", "reference": "", "unit": "500g", "price_amount": null, "price_currency": "PEN", "price_symbol": "", "price_text": "", "price_amount_filled": "55.14", "price_is_imputed": "True", "price_imputation_source": "country_mean", "price_amount_usd": "", "price_amount_usd_filled": "15.5336", "fx_rate_local_per_usd": "3.55", "fx_source": "from_peru_cambio_dolar", "information_text": "", "description_text": "", "features_text": "", "specifications_text": "", "benefits_text": "", "details_text": "", "other_sections": "", "sections": {}, "txt_path": "dataset/txt_limpios/1159.txt", "html_path": "dataset/paginas_descargadas/1159.html", "es_status": "EN", "category_canonical": "sin_categoria", "decision": "discard", "match_score": 0.3, "reasons": "no_category_detected;price_parse_failed"}
{"source_id": "1160", "title": "Centro de preferencia de la privacidad", "description": "", "breadcrumbs": "Activas siempre > 200g", "price_raw": "", "currency_raw": "PEN", "url": "", "seller": "Desconocido", "availability": "unknown", "country": "PE", "product_name": "Centro de preferencia de la privacidad", "brand": "Activas siempre", "reference": "", "unit": "200g", "price_amount": null, "price_currency": "PEN", "price_symbol": "", "price_text": "", "price_amount_filled": "55.14", "price_is_imputed": "True", "price_imputation_source": "country_mean", "price_amount_usd": "", "price_amount_usd_filled": "15.5336", "fx_rate_local_per_usd": "3.55", "fx_source": "from_peru_cambio_dolar", "information_text": "", "description_text": "", "features_text": "TE RECOMENDAMOS | Café Gourmet Americano CAFETAL Bolsa 450g | 39 | JUAN VALDEZ | Café Molido JUAN VALDEZ Volcán Bolsa 250g | 38 | 70 | -9% | ARTIDORO | Café Molido ARTIDORO RODRIGUEZ Cajamarca Bolsa 250g | 43 | 90 | SELLO ROJO | Café Molido SELLO ROJO Tradición Bolsa 425g | 27 | 60 | VILLA RICA | Café Molido VILLA RICA Gourmet Bolsa 250g | 40 | 20 | ZENA | Café Molido ZENA Selecto Doypack 200g | 17 | Café Gourmet Espresso CAFETAL Bolsa 200g | 25 | ALTOMAYO | Café Tostado Molido ALTOMAYO Gourmet Bolsa 200g | 24 | Café Molido CAFETAL Gourmet Americano Chanchamayo Bolsa 200g | Café Molido SELLO ROJO Tradición Bolsa 850g | 52 | ¡Entérate de eventos exclusivos y promociones especiales que tenemos para ti! | SUSCRIBIRME | Acepto las políticas de tratamientos de datos personales | Razón Social: Compañía Food Retail S.A.C. RUC: 20608300393. Todos los derechos reservados Vivanda 2023. | | Hola! | Encuentra todo lo que necesitas en Vivanda online | Términos más buscados | 1. | quesos | 2. | vino | 3. | café | 4. | quark 500g | 5. | leche | 6. | pollo | 7. | yogurt | 8. | lunch florencia | 9. | agua | 10 | vinos", "specifications_text": "", "benefits_text": "", "details_text": "", "other_sections": "", "sections": {"Características": ["TE RECOMENDAMOS", "Café Gourmet Americano CAFETAL Bolsa 450g", "39", "JUAN VALDEZ", "Café Molido JUAN VALDEZ Volcán Bolsa 250g", "38", "70", "-9%", "ARTIDORO", "Café Molido ARTIDORO RODRIGUEZ Cajamarca Bolsa 250g", "43", "90", "SELLO ROJO", "Café Molido SELLO ROJO Tradición Bolsa 425g", "27", "60", "VILLA RICA", "Café Molido VILLA RICA Gourmet Bolsa 250g", "40", "20", "ZENA", "Café Molido ZENA Selecto Doypack 200g", "17", "Café Gourmet Espresso CAFETAL Bolsa 200g", "25", "ALTOMAYO", "Café Tostado Molido ALTOMAYO Gourmet Bolsa 200g", "24", "Café Molido CAFETAL Gourmet Americano Chanchamayo Bolsa 200g", "Café Molido SELLO ROJO Tradición Bolsa 850g", "52", "¡Entérate de eventos exclusivos y promociones especiales que tenemos para ti!", "SUSCRIBIRME", "Acepto las políticas de tratamiento de datos personales", "Razón social: Compañía Food Retail S.A.C. RUC: 20608300393. Todos los derechos reservados Vivanda 2023.", "¡Hola!", "Encuentra todo lo que necesitas en Vivanda online", "Términos más buscados", "1.", "quesos", "2.", "vino", "3.", "cafe", "4.", "quark 500g", "5.", "leche", "6.", "pollo", "7.", "yogurt", "8.", "lunch florencia", "9.", "agua", "10.", "vinos"]}, "txt_path": "dataset/txt_limpios/1160.txt", "html_path": "dataset/paginas_descargadas/1160.html", "es_status": "ET", "category_canonical": "sin_categoria", "decision": "discard", "match_score": 0.3, "reasons": "no_category_detected;price_parse_failed"}
