source_id,title,description,breadcrumbs,price_raw,currency_raw,url,seller,availability,country,product_name,brand,reference,unit,price_amount,price_currency,price_symbol,price_text,price_amount_filled,price_is_imputed,price_imputation_source,price_amount_usd,price_amount_usd_filled,fx_rate_local_per_usd,fx_source,information_text,description_text,features_text,specifications_text,benefits_text,details_text,other_sections,sections,txt_path,html_path,es_status,category_canonical,decision,match_score,reasons
157,Verifica tu identidad,,,,,,Desconocido,unknown,UNKNOWN,Verifica tu identidad,,,,,,,,234.19,True,country_mean,,234.1938,1.0,default_1usd,,,,,,,,{},dataset/txt_limpios/157.txt,dataset/paginas_descargadas/157.html,EN,sin_categoria,discard,0.30,no_category_detected;price_parse_failed
158,Verifica tu identidad,,,,,,Desconocido,unknown,UNKNOWN,Verifica tu identidad,,,,,,,,234.19,True,country_mean,,234.1938,1.0,default_1usd,,,,,,,,{},dataset/txt_limpios/158.txt,dataset/paginas_descargadas/158.html,EN,sin_categoria,discard,0.30,no_category_detected;price_parse_failed
159,Verifica tu identidad,,,,,,Desconocido,unknown,UNKNOWN,Verifica tu identidad,,,,,,,,234.19,True,country_mean,,234.1938,1.0,default_1usd,,,,,,,,{},dataset/txt_limpios/159.txt,dataset/paginas_descargadas/159.html,EN,sin_categoria,discard,0.30,no_category_detected;price_parse_failed
160,Verifica tu identidad,,,,,,Desconocido,unknown,UNKNOWN,Verifica tu identidad,,,,,,,,234.19,True,country_mean,,234.1938,1.0,default_1usd,,,,,,,,{},dataset/txt_limpios/160.txt,dataset/paginas_descargadas/160.html,EN,sin_categoria,discard,0.30,no_category_detected;price_parse_failed
161,Verifica tu identidad,,,,,,Desconocido,unknown,UNKNOWN,Verifica tu identidad,,,,,,,,234.19,True,country_mean,,234.1938,1.0,default_1usd,,,,,,,,{},dataset/txt_limpios/161.txt,dataset/paginas_descargadas/161.html,EN,sin_categoria,discard,0.30,no_category_detected;price_parse_failed
162,Verifica tu identidad,,,,,,Desconocido,unknown,UNKNOWN,Verifica tu identidad,,,,,,,,234.19,True,country_mean,,234.1938,1.0,default_1usd,,,,,,,,{},dataset/txt_limpios/162.txt,dataset/paginas_descargadas/162.html,EN,sin_categoria,discard,0.30,no_category_detected;price_parse_failed
163,Verifica tu identidad,,,,,,Desconocido,unknown,UNKNOWN,Verifica tu identidad,,,,,,,,234.19,True,country_mean,,234.1938,1.0,default_1usd,,,,,,,,{},dataset/txt_limpios/163.txt,dataset/paginas_descargadas/163.html,EN,sin_categoria,discard,0.30,no_category_detected;price_parse_failed
164,Verifica tu identidad,,,,,,Desconocido,unknown,UNKNOWN,Verifica tu identidad,,,,,,,,234.19,True,country_mean,,234.1938,1.0,default_1usd,,,,,,,,{},dataset/txt_limpios/164.txt,dataset/paginas_descargadas/164.html,EN,sin_categoria,discard,0.30,no_category_detected;price_parse_failed
165,Verifica tu identidad,,,,,,Desconocido,unknown,UNKNOWN,Verifica tu identidad,,,,,,,,234.19,True,country_mean,,234.1938,1.0,default_1usd,,,,,,,,{},dataset/txt_limpios/165.txt,dataset/paginas_descargadas/165.html,EN,sin_categoria,discard,0.30,no_category_detected;price_parse_failed
166,Verifica tu identidad,,,,,,Desconocido,unknown,UNKNOWN,Verifica tu identidad,,,,,,,,234.19,True,country_mean,,234.1938,1.0,default_1usd,,,,,,,,{},dataset/txt_limpios/166.txt,dataset/paginas_descargadas/166.html,EN,sin_categoria,discard,0.30,no_category_detected;price_parse_failed
167,Verifica tu identidad,,,,,,Desconocido,unknown,UNKNOWN,Verifica tu identidad,,,,,,,,234.19,True,country_mean,,234.1938,1.0,default_1usd,,,,,,,,{},dataset/txt_limpios/167.txt,dataset/paginas_descargadas/167.html,EN,sin_categoria,discard,0.30,no_category_detected;price_parse_failed
168,Verifica tu identidad,,,,,,Desconocido,unknown,UNKNOWN,Verifica tu identidad,,,,,,,,234.19,True,country_mean,,234.1938,1.0,default_1usd,,,,,,,,{},dataset/txt_limpios/168.txt,dataset/paginas_descargadas/168.html,EN,sin_categoria,discard,0.30,no_category_detected;price_parse_failed
169,Verifica tu identidad,,,,,,Desconocido,unknown,UNKNOWN,Verifica tu identidad,,,,,,,,234.19,True,country_mean,,234.1938,1.0,default_1usd,,,,,,,,{},dataset/txt_limpios/169.txt,dataset/paginas_descargadas/169.html,EN,sin_categoria,discard,0.30,no_category_detected;price_parse_failed
170,Verifica tu identidad,,,,,,Desconocido,unknown,UNKNOWN,Verifica tu identidad,,,,,,,,234.19,True,country_mean,,234.1938,1.0,default_1usd,,,,,,,,{},dataset/txt_limpios/170.txt,dataset/paginas_descargadas/170.html,EN,sin_categoria,discard,0.30,no_category_detected;price_parse_failed
171,Verifica tu identidad,,,,,,Desconocido,unknown,UNKNOWN,Verifica tu identidad,,,,,,,,234.19,True,country_mean,,234.1938,1.0,default_1usd,,,,,,,,{},dataset/txt_limpios/171.txt,dataset/paginas_descargadas/171.html,EN,sin_categoria,discard,0.30,no_category_detected;price_parse_failed
172,Verifica tu identidad,,,,,,Desconocido,unknown,UNKNOWN,Verifica tu identidad,,,,,,,,234.19,True,country_mean,,234.1938,1.0,default_1usd,,,,,,,,{},dataset/txt_limpios/172.txt,dataset/paginas_descargadas/172.html,EN,sin_categoria,discard,0.30,no_category_detected;price_parse_failed
173,Verifica tu identidad,,,,,,Desconocido,unknown,UNKNOWN,Verifica tu identidad,,,,,,,,234.19,True,country_mean,,234.1938,1.0,default_1usd,,,,,,,,{},dataset/txt_limpios/173.txt,dataset/paginas_descargadas/173.html,EN,sin_categoria,discard,0.30,no_category_detected;price_parse_failed
174,Verifica tu identidad,,,,,,Desconocido,unknown,UNKNOWN,Verifica tu identidad,,,,,,,,234.19,True,country_mean,,234.1938,1.0,default_1usd,,,,,,,,{},dataset/txt_limpios/174.txt,dataset/paginas_descargadas/174.html,EN,sin_categoria,discard,0.30,no_category_detected;price_parse_failed
175,Verifica tu identidad,,,,,,Desconocido,unknown,UNKNOWN,Verifica tu identidad,,,,,,,,234.19,True,country_mean,,234.1938,1.0,default_1usd,,,,,,,,{},dataset/txt_limpios/175.txt,dataset/paginas_descargadas/175.html,EN,sin_categoria,discard,0.30,no_category_detected;price_parse_failed
176,Verifica tu identidad,,,,,,Desconocido,unknown,UNKNOWN,Verifica tu identidad,,,,,,,,234.19,True,country_mean,,234.1938,1.0,default_1usd,,,,,,,,{},dataset/txt_limpios/176.txt,dataset/paginas_descargadas/176.html,EN,sin_categoria,discard,0.30,no_category_detected;price_parse_failed
177,Verifica tu identidad,,,,,,Desconocido,unknown,UNKNOWN,Verifica tu identidad,,,,,,,,234.19,True,country_mean,,234.1938,1.0,default_1usd,,,,,,,,{},dataset/txt_limpios/177.txt,dataset/paginas_descargadas/177.html,EN,sin_categoria,discard,0.30,no_category_detected;price_parse_failed
178,Verifica tu identidad,,,,,,Desconocido,unknown,UNKNOWN,Verifica tu identidad,,,,,,,,234.19,True,country_mean,,234.1938,1.0,default_1usd,,,,,,,,{},dataset/txt_limpios/178.txt,dataset/paginas_descargadas/178.html,EN,sin_categoria,discard,0.30,no_category_detected;price_parse_failed
179,Verifica tu identidad,,,,,,Desconocido,unknown,UNKNOWN,Verifica tu identidad,,,,,,,,234.19,True,country_mean,,234.1938,1.0,default_1usd,,,,,,,,{},dataset/txt_limpios/179.txt,dataset/paginas_descargadas/179.html,EN,sin_categoria,discard,0.30,no_category_detected;price_parse_failed
1000,Verificar que usted es un ser humano. Esto podría tardar algunos segundos.,,Verificación exitosa,,,,Desconocido,unknown,UNKNOWN,Verificar que usted es un ser humano. Esto podría tardar algunos segundos.,Verificación exitosa,,,,,,,234.19,True,country_mean,,234.1938,1.0,default_1usd,,,,,,,,{},dataset/txt_limpios/1000.txt,dataset/paginas_descargadas/1000.html,EN,sin_categoria,discard,0.30,no_category_detected;price_parse_failed
1001,Verificar que usted es un ser humano. Esto podría tardar algunos segundos.,,Verificación exitosa,,,,Desconocido,unknown,UNKNOWN,Verificar que usted es un ser humano. Esto podría tardar algunos segundos.,Verificación exitosa,,,,,,,234.19,True,country_mean,,234.1938,1.0,default_1usd,,,,,,,,{},dataset/txt_limpios/1001.txt,dataset/paginas_descargadas/1001.html,EN,sin_categoria,discard,0.30,no_category_detected;price_parse_failed
1002,Verificar que usted es un ser humano. Esto podría tardar algunos segundos.,,Verificación exitosa,,,,Desconocido,unknown,UNKNOWN,Verificar que usted es un ser humano. Esto podría tardar algunos segundos.,Verificación exitosa,,,,,,,234.19,True,country_mean,,234.1938,1.0,default_1usd,,,,,,,,{},dataset/txt_limpios/1002.txt,dataset/paginas_descargadas/1002.html,EN,sin_categoria,discard,0.30,no_category_detected;price_parse_failed
1003,Verificar que usted es un ser humano. Esto podría tardar algunos segundos.,,Verificación exitosa,,,,Desconocido,unknown,UNKNOWN,Verificar que usted es un ser humano. Esto podría tardar algunos segundos.,Verificación exitosa,,,,,,,234.19,True,country_mean,,234.1938,1.0,default_1usd,,,,,,,,{},dataset/txt_limpios/1003.txt,dataset/paginas_descargadas/1003.html,EN,sin_categoria,discard,0.30,no_category_detected;price_parse_failed
967,Verificar que usted es un ser humano. Esto podría tardar algunos segundos.,,Verificación exitosa,,,,Desconocido,unknown,UNKNOWN,Verificar que usted es un ser humano. Esto podría tardar algunos segundos.,Verificación exitosa,,,,,,,234.19,True,country_mean,,234.1938,1.0,default_1usd,,,,,,,,{},dataset/txt_limpios/967.txt,dataset/paginas_descargadas/967.html,EN,sin_categoria,discard,0.30,no_category_detected;price_parse_failed
968,Verificar que usted es un ser humano. Esto podría tardar algunos segundos.,,Verificación exitosa,,,,Desconocido,unknown,UNKNOWN,Verificar que usted es un ser humano. Esto podría tardar algunos segundos.,Verificación exitosa,,,,,,,234.19,True,country_mean,,234.1938,1.0,default_1usd,,,,,,,,{},dataset/txt_limpios/968.txt,dataset/paginas_descargadas/968.html,EN,sin_categoria,discard,0.30,no_category_detected;price_parse_failed
969,Verificar que usted es un ser humano. Esto podría tardar algunos segundos.,,Verificación exitosa,,,,Desconocido,unknown,UNKNOWN,Verificar que usted es un ser humano. Esto podría tardar algunos segundos.,Verificación exitosa,,,,,,,234.19,True,country_mean,,234.1938,1.0,default_1usd,,,,,,,,{},dataset/txt_limpios/969.txt,dataset/paginas_descargadas/969.html,EN,sin_categoria,discard,0.30,no_category_detected;price_parse_failed
970,Verificar que usted es un ser humano. Esto podría tardar algunos segundos.,,Verificación exitosa,,,,Desconocido,unknown,UNKNOWN,Verificar que usted es un ser humano. Esto podría tardar algunos segundos.,Verificación exitosa,,,,,,,234.19,True,country_mean,,234.1938,1.0,default_1usd,,,,,,,,{},dataset/txt_limpios/970.txt,dataset/paginas_descargadas/970.html,EN,sin_categoria,discard,0.30,no_category_detected;price_parse_failed
971,Verificar que usted es un ser humano. Esto podría tardar algunos segundos.,,Verificación exitosa,,,,Desconocido,unknown,UNKNOWN,Verificar que usted es un ser humano. Esto podría tardar algunos segundos.,Verificación exitosa,,,,,,,234.19,True,country_mean,,234.1938,1.0,default_1usd,,,,,,,,{},dataset/txt_limpios/971.txt,dataset/paginas_descargadas/971.html,EN,sin_categoria,discard,0.30,no_category_detected;price_parse_failed
972,Verificar que usted es un ser humano. Esto podría tardar algunos segundos.,,Verificación exitosa,,,,Desconocido,unknown,UNKNOWN,Verificar que usted es un ser humano. Esto podría tardar algunos segundos.,Verificación exitosa,,,,,,,234.19,True,country_mean,,234.1938,1.0,default_1usd,,,,,,,,{},dataset/txt_limpios/972.txt,dataset/paginas_descargadas/972.html,EN,sin_categoria,discard,0.30,no_category_detected;price_parse_failed
973,Verificar que usted es un ser humano. Esto podría tardar algunos segundos.,,Verificación exitosa,,,,Desconocido,unknown,UNKNOWN,Verificar que usted es un ser humano. Esto podría tardar algunos segundos.,Verificación exitosa,,,,,,,234.19,True,country_mean,,234.1938,1.0,default_1usd,,,,,,,,{},dataset/txt_limpios/973.txt,dataset/paginas_descargadas/973.html,EN,sin_categoria,discard,0.30,no_category_detected;price_parse_failed
974,Verificar que usted es un ser humano. Esto podría tardar algunos segundos.,,Verificación exitosa,,,,Desconocido,unknown,UNKNOWN,Verificar que usted es un ser humano. Esto podría tardar algunos segundos.,Verificación exitosa,,,,,,,234.19,True,country_mean,,234.1938,1.0,default_1usd,,,,,,,,{},dataset/txt_limpios/974.txt,dataset/paginas_descargadas/974.html,EN,sin_categoria,discard,0.30,no_category_detected;price_parse_failed
975,Verificar que usted es un ser humano. Esto podría tardar algunos segundos.,,Verificación exitosa,,,,Desconocido,unknown,UNKNOWN,Verificar que usted es un ser humano. Esto podría tardar algunos segundos.,Verificación exitosa,,,,,,,234.19,True,country_mean,,234.1938,1.0,default_1usd,,,,,,,,{},dataset/txt_limpios/975.txt,dataset/paginas_descargadas/975.html,EN,sin_categoria,discard,0.30,no_category_detected;price_parse_failed
976,Verificar que usted es un ser humano. Esto podría tardar algunos segundos.,,Verificación exitosa,,,,Desconocido,unknown,UNKNOWN,Verificar que usted es un ser humano. Esto podría tardar algunos segundos.,Verificación exitosa,,,,,,,234.19,True,country_mean,,234.1938,1.0,default_1usd,,,,,,,,{},dataset/txt_limpios/976.txt,dataset/paginas_descargadas/976.html,EN,sin_categoria,discard,0.30,no_category_detected;price_parse_failed
977,Verificar que usted es un ser humano. Esto podría tardar algunos segundos.,,Verificación exitosa,,,,Desconocido,unknown,UNKNOWN,Verificar que usted es un ser humano. Esto podría tardar algunos segundos.,Verificación exitosa,,,,,,,234.19,True,country_mean,,234.1938,1.0,default_1usd,,,,,,,,{},dataset/txt_limpios/977.txt,dataset/paginas_descargadas/977.html,EN,sin_categoria,discard,0.30,no_category_detected;price_parse_failed
978,Verificar que usted es un ser humano. Esto podría tardar algunos segundos.,,Verificación exitosa,,,,Desconocido,unknown,UNKNOWN,Verificar que usted es un ser humano. Esto podría tardar algunos segundos.,Verificación exitosa,,,,,,,234.19,True,country_mean,,234.1938,1.0,default_1usd,,,,,,,,{},dataset/txt_limpios/978.txt,dataset/paginas_descargadas/978.html,EN,sin_categoria,discard,0.30,no_category_detected;price_parse_failed
979,Verificar que usted es un ser humano. Esto podría tardar algunos segundos.,,Verificación exitosa,,,,Desconocido,unknown,UNKNOWN,Verificar que usted es un ser humano. Esto podría tardar algunos segundos.,Verificación exitosa,,,,,,,234.19,True,country_mean,,234.1938,1.0,default_1usd,,,,,,,,{},dataset/txt_limpios/979.txt,dataset/paginas_descargadas/979.html,EN,sin_categoria,discard,0.30,no_category_detected;price_parse_failed
980,Verificar que usted es un ser humano. Esto podría tardar algunos segundos.,,Verificación exitosa,,,,Desconocido,unknown,UNKNOWN,Verificar que usted es un ser humano. Esto podría tardar algunos segundos.,Verificación exitosa,,,,,,,234.19,True,country_mean,,234.1938,1.0,default_1usd,,,,,,,,{},dataset/txt_limpios/980.txt,dataset/paginas_descargadas/980.html,EN,sin_categoria,discard,0.30,no_category_detected;price_parse_failed
981,Verificar que usted es un ser humano. Esto podría tardar algunos segundos.,,Verificación exitosa,,,,Desconocido,unknown,UNKNOWN,Verificar que usted es un ser humano. Esto podría tardar algunos segundos.,Verificación exitosa,,,,,,,234.19,True,country_mean,,234.1938,1.0,default_1usd,,,,,,,,{},dataset/txt_limpios/981.txt,dataset/paginas_descargadas/981.html,EN,sin_categoria,discard,0.30,no_category_detected;price_parse_failed
982,Verificar que usted es un ser humano. Esto podría tardar algunos segundos.,,Verificación exitosa,,,,Desconocido,unknown,UNKNOWN,Verificar que usted es un ser humano. Esto podría tardar algunos segundos.,Verificación exitosa,,,,,,,234.19,True,country_mean,,234.1938,1.0,default_1usd,,,,,,,,{},dataset/txt_limpios/982.txt,dataset/paginas_descargadas/982.html,EN,sin_categoria,discard,0.30,no_category_detected;price_parse_failed
983,Verificar que usted es un ser humano. Esto podría tardar algunos segundos.,,Verificación exitosa,,,,Desconocido,unknown,UNKNOWN,Verificar que usted es un ser humano. Esto podría tardar algunos segundos.,Verificación exitosa,,,,,,,234.19,True,country_mean,,234.1938,1.0,default_1usd,,,,,,,,{},dataset/txt_limpios/983.txt,dataset/paginas_descargadas/983.html,EN,sin_categoria,discard,0.30,no_category_detected;price_parse_failed
984,Verificar que usted es un ser humano. Esto podría tardar algunos segundos.,,Verificación exitosa,,,,Desconocido,unknown,UNKNOWN,Verificar que usted es un ser humano. Esto podría tardar algunos segundos.,Verificación exitosa,,,,,,,234.19,True,country_mean,,234.1938,1.0,default_1usd,,,,,,,,{},dataset/txt_limpios/984.txt,dataset/paginas_descargadas/984.html,EN,sin_categoria,discard,0.30,no_category_detected;price_parse_failed
985,Verificar que usted es un ser humano. Esto podría tardar algunos segundos.,,Verificación exitosa,,,,Desconocido,unknown,UNKNOWN,Verificar que usted es un ser humano. Esto podría tardar algunos segundos.,Verificación exitosa,,,,,,,234.19,True,country_mean,,234.1938,1.0,default_1usd,,,,,,,,{},dataset/txt_limpios/985.txt,dataset/paginas_descargadas/985.html,EN,sin_categoria,discard,0.30,no_category_detected;price_parse_failed
986,Verificar que usted es un ser humano. Esto podría tardar algunos segundos.,,Verificación exitosa,,,,Desconocido,unknown,UNKNOWN,Verificar que usted es un ser humano. Esto podría tardar algunos segundos.,Verificación exitosa,,,,,,,234.19,True,country_mean,,234.1938,1.0,default_1usd,,,,,,,,{},dataset/txt_limpios/986.txt,dataset/paginas_descargadas/986.html,EN,sin_categoria,discard,0.30,no_category_detected;price_parse_failed
987,Verificar que usted es un ser humano. Esto podría tardar algunos segundos.,,Verificación exitosa,,,,Desconocido,unknown,UNKNOWN,Verificar que usted es un ser humano. Esto podría tardar algunos segundos.,Verificación exitosa,,,,,,,234.19,True,country_mean,,234.1938,1.0,default_1usd,,,,,,,,{},dataset/txt_limpios/987.txt,dataset/paginas_descargadas/987.html,EN,sin_categoria,discard,0.30,no_category_detected;price_parse_failed
988,Verificar que usted es un ser humano. Esto podría tardar algunos segundos.,,Verificación exitosa,,,,Desconocido,unknown,UNKNOWN,Verificar que usted es un ser humano. Esto podría tardar algunos segundos.,Verificación exitosa,,,,,,,234.19,True,country_mean,,234.1938,1.0,default_1usd,,,,,,,,{},dataset/txt_limpios/988.txt,dataset/paginas_descargadas/988.html,EN,sin_categoria,discard,0.30,no_category_detected;price_parse_failed
989,Verificar que usted es un ser humano. Esto podría tardar algunos segundos.,,Verificación exitosa,,,,Desconocido,unknown,UNKNOWN,Verificar que usted es un ser humano. Esto podría tardar algunos segundos.,Verificación exitosa,,,,,,,234.19,True,country_mean,,234.1938,1.0,default_1usd,,,,,,,,{},dataset/txt_limpios/989.txt,dataset/paginas_descargadas/989.html,EN,sin_categoria,discard,0.30,no_category_detected;price_parse_failed
990,Verificar que usted es un ser humano. Esto podría tardar algunos segundos.,,Verificación exitosa,,,,Desconocido,unknown,UNKNOWN,Verificar que usted es un ser humano. Esto podría tardar algunos segundos.,Verificación exitosa,,,,,,,234.19,True,country_mean,,234.1938,1.0,default_1usd,,,,,,,,{},dataset/txt_limpios/990.txt,dataset/paginas_descargadas/990.html,EN,sin_categoria,discard,0.30,no_category_detected;price_parse_failed
991,Verificar que usted es un ser humano. Esto podría tardar algunos segundos.,,Verificación exitosa,,,,Desconocido,unknown,UNKNOWN,Verificar que usted es un ser humano. Esto podría tardar algunos segundos.,Verificación exitosa,,,,,,,234.19,True,country_mean,,234.1938,1.0,default_1usd,,,,,,,,{},dataset/txt_limpios/991.txt,dataset/paginas_descargadas/991.html,EN,sin_categoria,discard,0.30,no_category_detected;price_parse_failed
992,Verificar que usted es un ser humano. Esto podría tardar algunos segundos.,,Verificación exitosa,,,,Desconocido,unknown,UNKNOWN,Verificar que usted es un ser humano. Esto podría tardar algunos segundos.,Verificación exitosa,,,,,,,234.19,True,country_mean,,234.1938,1.0,default_1usd,,,,,,,,{},dataset/txt_limpios/992.txt,dataset/paginas_descargadas/992.html,EN,sin_categoria,discard,0.30,no_category_detected;price_parse_failed
993,Verificar que usted es un ser humano. Esto podría tardar algunos segundos.,,Verificación exitosa,,,,Desconocido,unknown,UNKNOWN,Verificar que usted es un ser humano. Esto podría tardar algunos segundos.,Verificación exitosa,,,,,,,234.19,True,country_mean,,234.1938,1.0,default_1usd,,,,,,,,{},dataset/txt_limpios/993.txt,dataset/paginas_descargadas/993.html,EN,sin_categoria,discard,0.30,no_category_detected;price_parse_failed
994,Verificar que usted es un ser humano. Esto podría tardar algunos segundos.,,Verificación exitosa,,,,Desconocido,unknown,UNKNOWN,Verificar que usted es un ser humano. Esto podría tardar algunos segundos.,Verificación exitosa,,,,,,,234.19,True,country_mean,,234.1938,1.0,default_1usd,,,,,,,,{},dataset/txt_limpios/994.txt,dataset/paginas_descargadas/994.html,EN,sin_categoria,discard,0.30,no_category_detected;price_parse_failed
995,Verificar que usted es un ser humano. Esto podría tardar algunos segundos.,,Verificación exitosa,,,,Desconocido,unknown,UNKNOWN,Verificar que usted es un ser humano. Esto podría tardar algunos segundos.,Verificación exitosa,,,,,,,234.19,True,country_mean,,234.1938,1.0,default_1usd,,,,,,,,{},dataset/txt_limpios/995.txt,dataset/paginas_descargadas/995.html,EN,sin_categoria,discard,0.30,no_category_detected;price_parse_failed
996,Verificar que usted es un ser humano. Esto podría tardar algunos segundos.,,Verificación exitosa,,,,Desconocido,unknown,UNKNOWN,Verificar que usted es un ser humano. Esto podría tardar algunos segundos.,Verificación exitosa,,,,,,,234.19,True,country_mean,,234.1938,1.0,default_1usd,,,,,,,,{},dataset/txt_limpios/996.txt,dataset/paginas_descargadas/996.html,EN,sin_categoria,discard,0.30,no_category_detected;price_parse_failed
