source_id,title,description,breadcrumbs,price_raw,currency_raw,url,seller,availability,country,product_name,brand,reference,unit,price_amount,price_currency,price_symbol,price_text,price_amount_filled,price_is_imputed,price_imputation_source,price_amount_usd,price_amount_usd_filled,fx_rate_local_per_usd,fx_source,information_text,description_text,features_text,specifications_text,benefits_text,details_text,other_sections,sections,txt_path,html_path,es_status,category_canonical,decision,match_score,reasons
136,¡Lo mejor te está esperando!,Huevo Blanco 30 piezas Bachoco. Huevo fresco de gallina seleccionado. El complemento e ingrediente imprescindible de las recetas familiares. Ideal para su consumo en cualquier momento del dia. Alto en proteina. Su sabor y fre | ... Ver más | Favoritos | Recomendados | Huevo Blanco Con 30  Bachoco 1 Carte... | 1 CA | Huevo Blanco Con 30  San Juan 1 Cart... | Huevo Blanco Con 18  Bachoco 1 Carte... | -22% | Huevo Blanco Con 12  Bachoco 1 Carte... | Huevo Blanco Con 30  Huizache 1 Cart... | Huevo Blanco Con 12  San Juan 1 Cart... | Huevo Blanco Con 30  Huevissimo 1 Ca... | Huevo Blanco Con 30  Mybrand 1 Carte... | Huevo Blanco Con 18  San Juan 1 Cart... | Huevo Blanco Con 12  Huizache  1 Car... | Huevo Blanco Jumbo Con 20  Mybrand 1... | Huevo Blanco Cage Free Con 12  Bacho... | Huevo Blanco Con 12  Mybrand 1 Carte... | Huevo Blanco Organico 12 Pzs  Campo ... | -21% | Mayonesa    Hellmanns 790 G | 790 GR | Yoghurth Griego Flip Key Lime    Cho... | 128 GR | Mostaza Preparada   French's 340 G | 340 GR | Leche Evaporada   Carnation 360 G | 360 GR | -24% | Crema Acida   Lala 426 Ml | 426 ML | Leche Fresca Entera   Zaragoza  1.8 ... | 1.8 LT | Leche Entera   Lala  1.8 Lt | Leche Uht Deslactosada Semidescremad... | 1 LT | Leche Uht Deslactosada Light Baja En... | Bebida Lactofermentada    Yakult    ... | 5 PZ | Leche Uht 100 Sin Lactosa Reducida E... | Leche Uht 100 Sin Lactosa Semidescre... | Mantequilla  Natural  Lala  90 G | 90 GR | Leche Saborizada Chocolate   Santa C... | 180 ML | Leche Condensada   La Lechera 375 G | 375 GR | Leche Fresca Lala 100 Con Proteina S... | Mes patrio Herdez | Ver más | Adobo    Doña María 235 G | Mole Doña María Almendrado En Pasta ... | Mole Doña María Almendrado Listo Par... | Mole Doña María Poblano Con Cacao En... | Mole Doña Maria Poblano Con Cacao Li... | Mole Doña Mariía Rojo En Pasta   125... | Mole En Pasta 430 Gramos   Doña Mari... | Mole Listo Para Servir  Para Servir ... | Mole Rojo En Pasta  Doña Maria 235 G | Mole Verde En Pasta  Doña Maria 230 ... | Pipián En Pasta  Doña Maria 230 G | Salsa Cacahuate Picante Cremosa   He... | Salsa Casera Con Habanero   Herdez 4... | Salsa Casera  Herdez 210 G | Salsa Guacamole 15% Mas Guacamole He...,Descarga la app > 30 piezas,99.9,,,Desconocido,unknown,UNKNOWN,¡Lo mejor te está esperando!,Descarga la app,,30 piezas,99.90,,$,$99.90,99.9,False,original,99.9,99.9,1.0,default_1usd,,,,,,Huevo Blanco 30 piezas Bachoco. Huevo fresco de gallina seleccionado. El complemento e ingrediente imprescindible de las recetas familiares. Ideal para su consumo en cualquier momento del dia. Alto en proteina. Su sabor y fre | ... Ver más | Favoritos | Recomendados | Huevo Blanco Con 30  Bachoco 1 Carte... | 1 CA | Huevo Blanco Con 30  San Juan 1 Cart... | Huevo Blanco Con 18  Bachoco 1 Carte... | -22% | Huevo Blanco Con 12  Bachoco 1 Carte... | Huevo Blanco Con 30  Huizache 1 Cart... | Huevo Blanco Con 12  San Juan 1 Cart... | Huevo Blanco Con 30  Huevissimo 1 Ca... | Huevo Blanco Con 30  Mybrand 1 Carte... | Huevo Blanco Con 18  San Juan 1 Cart... | Huevo Blanco Con 12  Huizache  1 Car... | Huevo Blanco Jumbo Con 20  Mybrand 1... | Huevo Blanco Cage Free Con 12  Bacho... | Huevo Blanco Con 12  Mybrand 1 Carte... | Huevo Blanco Organico 12 Pzs  Campo ... | -21% | Mayonesa    Hellmanns 790 G | 790 GR | Yoghurth Griego Flip Key Lime    Cho... | 128 GR | Mostaza Preparada   French's 340 G | 340 GR | Leche Evaporada   Carnation 360 G | 360 GR | -24% | Crema Acida   Lala 426 Ml | 426 ML | Leche Fresca Entera   Zaragoza  1.8 ... | 1.8 LT | Leche Entera   Lala  1.8 Lt | Leche Uht Deslactosada Semidescremad... | 1 LT | Leche Uht Deslactosada Light Baja En... | Bebida Lactofermentada    Yakult    ... | 5 PZ | Leche Uht 100 Sin Lactosa Reducida E... | Leche Uht 100 Sin Lactosa Semidescre... | Mantequilla  Natural  Lala  90 G | 90 GR | Leche Saborizada Chocolate   Santa C... | 180 ML | Leche Condensada   La Lechera 375 G | 375 GR | Leche Fresca Lala 100 Con Proteina S... | Mes patrio Herdez | Ver más | Adobo    Doña María 235 G | Mole Doña María Almendrado En Pasta ... | Mole Doña María Almendrado Listo Par... | Mole Doña María Poblano Con Cacao En... | Mole Doña Maria Poblano Con Cacao Li... | Mole Doña Mariía Rojo En Pasta   125... | Mole En Pasta 430 Gramos   Doña Mari... | Mole Listo Para Servir  Para Servir ... | Mole Rojo En Pasta  Doña Maria 235 G | Mole Verde En Pasta  Doña Maria 230 ... | Pipián En Pasta  Doña Maria 230 G | Salsa Cacahuate Picante Cremosa   He... | Salsa Casera Con Habanero   Herdez 4... | Salsa Casera  Herdez 210 G | Salsa Guacamole 15% Mas Guacamole He...,,"{""Detalles"": [""Huevo Blanco 30 piezas Bachoco. Huevo fresco de gallina seleccionado. El complemento e ingrediente imprescindible de las recetas familiares. Ideal para su consumo en cualquier momento del dia. Alto en proteina. Su sabor y fre"", ""... Ver más"", ""Favoritos"", ""Recomendados"", ""Huevo Blanco Con 30  Bachoco 1 Carte..."", ""1 CA"", ""Huevo Blanco Con 30  San Juan 1 Cart..."", ""Huevo Blanco Con 18  Bachoco 1 Carte..."", ""-22%"", ""Huevo Blanco Con 12  Bachoco 1 Carte..."", ""Huevo Blanco Con 30  Huizache 1 Cart..."", ""Huevo Blanco Con 12  San Juan 1 Cart..."", ""Huevo Blanco Con 30  Huevissimo 1 Ca..."", ""Huevo Blanco Con 30  Mybrand 1 Carte..."", ""Huevo Blanco Con 18  San Juan 1 Cart..."", ""Huevo Blanco Con 12  Huizache  1 Car..."", ""Huevo Blanco Jumbo Con 20  Mybrand 1..."", ""Huevo Blanco Cage Free Con 12  Bacho..."", ""Huevo Blanco Con 12  Mybrand 1 Carte..."", ""Huevo Blanco Organico 12 Pzs  Campo ..."", ""-21%"", ""Mayonesa    Hellmanns 790 G"", ""790 GR"", ""Yoghurth Griego Flip Key Lime    Cho..."", ""128 GR"", ""Mostaza Preparada   French's 340 G"", ""340 GR"", ""Leche Evaporada   Carnation 360 G"", ""360 GR"", ""-24%"", ""Crema Acida   Lala 426 Ml"", ""426 ML"", ""Leche Fresca Entera   Zaragoza  1.8 ..."", ""1.8 LT"", ""Leche Entera   Lala  1.8 Lt"", ""Leche Uht Deslactosada Semidescremad..."", ""1 LT"", ""Leche Uht Deslactosada Light Baja En..."", ""Bebida Lactofermentada    Yakult    ..."", ""5 PZ"", ""Leche Uht 100 Sin Lactosa Reducida E..."", ""Leche Uht 100 Sin Lactosa Semidescre..."", ""Mantequilla  Natural  Lala  90 G"", ""90 GR"", ""Leche Saborizada Chocolate   Santa C..."", ""180 ML"", ""Leche Condensada   La Lechera 375 G"", ""375 GR"", ""Leche Fresca Lala 100 Con Proteina S..."", ""Mes patrio Herdez"", ""Ver más"", ""Adobo    Doña María 235 G"", ""Mole Doña María Almendrado En Pasta ..."", ""Mole Doña María Almendrado Listo Par..."", ""Mole Doña María Poblano Con Cacao En..."", ""Mole Doña Maria Poblano Con Cacao Li..."", ""Mole Doña Mariía Rojo En Pasta   125..."", ""Mole En Pasta 430 Gramos   Doña Mari..."", ""Mole Listo Para Servir  Para Servir ..."", ""Mole Rojo En Pasta  Doña Maria 235 G"", ""Mole Verde En Pasta  Doña Maria 230 ..."", ""Pipián En Pasta  Doña Maria 230 G"", ""Salsa Cacahuate Picante Cremosa   He..."", ""Salsa Casera Con Habanero   Herdez 4..."", ""Salsa Casera  Herdez 210 G"", ""Salsa Guacamole 15% Mas Guacamole He...""]}",dataset/txt_limpios/136.txt,dataset/paginas_descargadas/136.html,EN,leche,keep,0.60,heuristic_default
138,¡Lo mejor te está esperando!,"Descubre la excelencia en cada desayuno con nuestros huevos blancos Huizache con 30 unidades. Provenientes de gallinas felices y alimentadas con una dieta balanceada, estos huevos destacan por su frescura y calidad excepciona | ... Ver más | Favoritos | Recomendados | Huevo Blanco Con 30  Bachoco 1 Carte... | 1 CA | Huevo Blanco Con 30  San Juan 1 Cart... | Huevo Blanco Con 18  Bachoco 1 Carte... | -22% | Huevo Blanco Con 12  Bachoco 1 Carte... | Huevo Blanco Con 30  Huizache 1 Cart... | Huevo Blanco Con 12  San Juan 1 Cart... | Huevo Blanco Con 30  Huevissimo 1 Ca... | Huevo Blanco Con 30  Mybrand 1 Carte... | Huevo Blanco Con 18  San Juan 1 Cart... | Huevo Blanco Con 12  Huizache  1 Car... | Huevo Blanco Jumbo Con 20  Mybrand 1... | Huevo Blanco Cage Free Con 12  Bacho... | Huevo Blanco Con 12  Mybrand 1 Carte... | Huevo Blanco Organico 12 Pzs  Campo ... | -21% | Mayonesa    Hellmanns 790 G | 790 GR | Yoghurth Griego Flip Key Lime    Cho... | 128 GR | Mostaza Preparada   French's 340 G | 340 GR | Leche Evaporada   Carnation 360 G | 360 GR | -24% | Crema Acida   Lala 426 Ml | 426 ML | Leche Fresca Entera   Zaragoza  1.8 ... | 1.8 LT | Leche Entera   Lala  1.8 Lt | Leche Uht Deslactosada Semidescremad... | 1 LT | Leche Uht Deslactosada Light Baja En... | Bebida Lactofermentada    Yakult    ... | 5 PZ | Leche Uht 100 Sin Lactosa Reducida E... | Leche Uht 100 Sin Lactosa Semidescre... | Mantequilla  Natural  Lala  90 G | 90 GR | Leche Saborizada Chocolate   Santa C... | 180 ML | Leche Condensada   La Lechera 375 G | 375 GR | Leche Fresca Lala 100 Con Proteina S... | Mes patrio Herdez | Ver más | Adobo    Doña María 235 G | Mole Doña María Almendrado En Pasta ... | Mole Doña María Almendrado Listo Par... | Mole Doña María Poblano Con Cacao En... | Mole Doña Maria Poblano Con Cacao Li... | Mole Doña Mariía Rojo En Pasta   125... | Mole En Pasta 430 Gramos   Doña Mari... | Mole Listo Para Servir  Para Servir ... | Mole Rojo En Pasta  Doña Maria 235 G | Mole Verde En Pasta  Doña Maria 230 ... | Pipián En Pasta  Doña Maria 230 G | Salsa Cacahuate Picante Cremosa   He... | Salsa Casera Con Habanero   Herdez 4... | Salsa Casera  Herdez 210 G | Salsa Guacamole 15% Mas Guacamole He...",Descarga la app > 30 unidades,91.9,,,Desconocido,unknown,UNKNOWN,¡Lo mejor te está esperando!,Descarga la app,,30 unidades,91.90,,$,$91.90,91.9,False,original,91.9,91.9,1.0,default_1usd,,,,,,"Descubre la excelencia en cada desayuno con nuestros huevos blancos Huizache con 30 unidades. Provenientes de gallinas felices y alimentadas con una dieta balanceada, estos huevos destacan por su frescura y calidad excepciona | ... Ver más | Favoritos | Recomendados | Huevo Blanco Con 30  Bachoco 1 Carte... | 1 CA | Huevo Blanco Con 30  San Juan 1 Cart... | Huevo Blanco Con 18  Bachoco 1 Carte... | -22% | Huevo Blanco Con 12  Bachoco 1 Carte... | Huevo Blanco Con 30  Huizache 1 Cart... | Huevo Blanco Con 12  San Juan 1 Cart... | Huevo Blanco Con 30  Huevissimo 1 Ca... | Huevo Blanco Con 30  Mybrand 1 Carte... | Huevo Blanco Con 18  San Juan 1 Cart... | Huevo Blanco Con 12  Huizache  1 Car... | Huevo Blanco Jumbo Con 20  Mybrand 1... | Huevo Blanco Cage Free Con 12  Bacho... | Huevo Blanco Con 12  Mybrand 1 Carte... | Huevo Blanco Organico 12 Pzs  Campo ... | -21% | Mayonesa    Hellmanns 790 G | 790 GR | Yoghurth Griego Flip Key Lime    Cho... | 128 GR | Mostaza Preparada   French's 340 G | 340 GR | Leche Evaporada   Carnation 360 G | 360 GR | -24% | Crema Acida   Lala 426 Ml | 426 ML | Leche Fresca Entera   Zaragoza  1.8 ... | 1.8 LT | Leche Entera   Lala  1.8 Lt | Leche Uht Deslactosada Semidescremad... | 1 LT | Leche Uht Deslactosada Light Baja En... | Bebida Lactofermentada    Yakult    ... | 5 PZ | Leche Uht 100 Sin Lactosa Reducida E... | Leche Uht 100 Sin Lactosa Semidescre... | Mantequilla  Natural  Lala  90 G | 90 GR | Leche Saborizada Chocolate   Santa C... | 180 ML | Leche Condensada   La Lechera 375 G | 375 GR | Leche Fresca Lala 100 Con Proteina S... | Mes patrio Herdez | Ver más | Adobo    Doña María 235 G | Mole Doña María Almendrado En Pasta ... | Mole Doña María Almendrado Listo Par... | Mole Doña María Poblano Con Cacao En... | Mole Doña Maria Poblano Con Cacao Li... | Mole Doña Mariía Rojo En Pasta   125... | Mole En Pasta 430 Gramos   Doña Mari... | Mole Listo Para Servir  Para Servir ... | Mole Rojo En Pasta  Doña Maria 235 G | Mole Verde En Pasta  Doña Maria 230 ... | Pipián En Pasta  Doña Maria 230 G | Salsa Cacahuate Picante Cremosa   He... | Salsa Casera Con Habanero   Herdez 4... | Salsa Casera  Herdez 210 G | Salsa Guacamole 15% Mas Guacamole He...",,"{""Detalles"": [""Descubre la excelencia en cada desayuno con nuestros huevos blancos Huizache con 30 unidades. Provenientes de gallinas felices y alimentadas con una dieta balanceada, estos huevos destacan por su frescura y calidad excepciona"", ""... Ver más"", ""Favoritos"", ""Recomendados"", ""Huevo Blanco Con 30  Bachoco 1 Carte..."", ""1 CA"", ""Huevo Blanco Con 30  San Juan 1 Cart..."", ""Huevo Blanco Con 18  Bachoco 1 Carte..."", ""-22%"", ""Huevo Blanco Con 12  Bachoco 1 Carte..."", ""Huevo Blanco Con 30  Huizache 1 Cart..."", ""Huevo Blanco Con 12  San Juan 1 Cart..."", ""Huevo Blanco Con 30  Huevissimo 1 Ca..."", ""Huevo Blanco Con 30  Mybrand 1 Carte..."", ""Huevo Blanco Con 18  San Juan 1 Cart..."", ""Huevo Blanco Con 12  Huizache  1 Car..."", ""Huevo Blanco Jumbo Con 20  Mybrand 1..."", ""Huevo Blanco Cage Free Con 12  Bacho..."", ""Huevo Blanco Con 12  Mybrand 1 Carte..."", ""Huevo Blanco Organico 12 Pzs  Campo ..."", ""-21%"", ""Mayonesa    Hellmanns 790 G"", ""790 GR"", ""Yoghurth Griego Flip Key Lime    Cho..."", ""128 GR"", ""Mostaza Preparada   French's 340 G"", ""340 GR"", ""Leche Evaporada   Carnation 360 G"", ""360 GR"", ""-24%"", ""Crema Acida   Lala 426 Ml"", ""426 ML"", ""Leche Fresca Entera   Zaragoza  1.8 ..."", ""1.8 LT"", ""Leche Entera   Lala  1.8 Lt"", ""Leche Uht Deslactosada Semidescremad..."", ""1 LT"", ""Leche Uht Deslactosada Light Baja En..."", ""Bebida Lactofermentada    Yakult    ..."", ""5 PZ"", ""Leche Uht 100 Sin Lactosa Reducida E..."", ""Leche Uht 100 Sin Lactosa Semidescre..."", ""Mantequilla  Natural  Lala  90 G"", ""90 GR"", ""Leche Saborizada Chocolate   Santa C..."", ""180 ML"", ""Leche Condensada   La Lechera 375 G"", ""375 GR"", ""Leche Fresca Lala 100 Con Proteina S..."", ""Mes patrio Herdez"", ""Ver más"", ""Adobo    Doña María 235 G"", ""Mole Doña María Almendrado En Pasta ..."", ""Mole Doña María Almendrado Listo Par..."", ""Mole Doña María Poblano Con Cacao En..."", ""Mole Doña Maria Poblano Con Cacao Li..."", ""Mole Doña Mariía Rojo En Pasta   125..."", ""Mole En Pasta 430 Gramos   Doña Mari..."", ""Mole Listo Para Servir  Para Servir ..."", ""Mole Rojo En Pasta  Doña Maria 235 G"", ""Mole Verde En Pasta  Doña Maria 230 ..."", ""Pipián En Pasta  Doña Maria 230 G"", ""Salsa Cacahuate Picante Cremosa   He..."", ""Salsa Casera Con Habanero   Herdez 4..."", ""Salsa Casera  Herdez 210 G"", ""Salsa Guacamole 15% Mas Guacamole He...""]}",dataset/txt_limpios/138.txt,dataset/paginas_descargadas/138.html,EN,leche,keep,0.60,heuristic_default
139,¡Lo mejor te está esperando!,Nuestros huevos blancos MyBrand en paquete de 30 piezas son ideales para hogares con mayor demanda. Aprovecha su frescura y calidad para disfrutar de tus platillos favoritos con la mejor calidad. | ... Ver más | Favoritos | Recomendados | Huevo Blanco Con 30  Bachoco 1 Carte... | 1 CA | Huevo Blanco Con 30  San Juan 1 Cart... | Huevo Blanco Con 18  Bachoco 1 Carte... | -22% | Huevo Blanco Con 12  Bachoco 1 Carte... | Huevo Blanco Con 30  Huizache 1 Cart... | Huevo Blanco Con 12  San Juan 1 Cart... | Huevo Blanco Con 30  Huevissimo 1 Ca... | Huevo Blanco Con 30  Mybrand 1 Carte... | Huevo Blanco Con 18  San Juan 1 Cart... | Huevo Blanco Con 12  Huizache  1 Car... | Huevo Blanco Jumbo Con 20  Mybrand 1... | Huevo Blanco Cage Free Con 12  Bacho... | Huevo Blanco Con 12  Mybrand 1 Carte... | Huevo Blanco Organico 12 Pzs  Campo ... | -21% | Mayonesa    Hellmanns 790 G | 790 GR | Yoghurth Griego Flip Key Lime    Cho... | 128 GR | Mostaza Preparada   French's 340 G | 340 GR | Leche Evaporada   Carnation 360 G | 360 GR | -24% | Crema Acida   Lala 426 Ml | 426 ML | Leche Fresca Entera   Zaragoza  1.8 ... | 1.8 LT | Leche Entera   Lala  1.8 Lt | Leche Uht Deslactosada Semidescremad... | 1 LT | Leche Uht Deslactosada Light Baja En... | Bebida Lactofermentada    Yakult    ... | 5 PZ | Leche Uht 100 Sin Lactosa Reducida E... | Leche Uht 100 Sin Lactosa Semidescre... | Mantequilla  Natural  Lala  90 G | 90 GR | Leche Saborizada Chocolate   Santa C... | 180 ML | Leche Condensada   La Lechera 375 G | 375 GR | Leche Fresca Lala 100 Con Proteina S... | Mes patrio Herdez | Ver más | Adobo    Doña María 235 G | Mole Doña María Almendrado En Pasta ... | Mole Doña María Almendrado Listo Par... | Mole Doña María Poblano Con Cacao En... | Mole Doña Maria Poblano Con Cacao Li... | Mole Doña Mariía Rojo En Pasta   125... | Mole En Pasta 430 Gramos   Doña Mari... | Mole Listo Para Servir  Para Servir ... | Mole Rojo En Pasta  Doña Maria 235 G | Mole Verde En Pasta  Doña Maria 230 ... | Pipián En Pasta  Doña Maria 230 G | Salsa Cacahuate Picante Cremosa   He... | Salsa Casera Con Habanero   Herdez 4... | Salsa Casera  Herdez 210 G | Salsa Guacamole 15% Mas Guacamole He...,Descarga la app > 30 piezas,91.9,,,Desconocido,unknown,UNKNOWN,¡Lo mejor te está esperando!,Descarga la app,,30 piezas,91.90,,$,$91.90,91.9,False,original,91.9,91.9,1.0,default_1usd,,,,,,Nuestros huevos blancos MyBrand en paquete de 30 piezas son ideales para hogares con mayor demanda. Aprovecha su frescura y calidad para disfrutar de tus platillos favoritos con la mejor calidad. | ... Ver más | Favoritos | Recomendados | Huevo Blanco Con 30  Bachoco 1 Carte... | 1 CA | Huevo Blanco Con 30  San Juan 1 Cart... | Huevo Blanco Con 18  Bachoco 1 Carte... | -22% | Huevo Blanco Con 12  Bachoco 1 Carte... | Huevo Blanco Con 30  Huizache 1 Cart... | Huevo Blanco Con 12  San Juan 1 Cart... | Huevo Blanco Con 30  Huevissimo 1 Ca... | Huevo Blanco Con 30  Mybrand 1 Carte... | Huevo Blanco Con 18  San Juan 1 Cart... | Huevo Blanco Con 12  Huizache  1 Car... | Huevo Blanco Jumbo Con 20  Mybrand 1... | Huevo Blanco Cage Free Con 12  Bacho... | Huevo Blanco Con 12  Mybrand 1 Carte... | Huevo Blanco Organico 12 Pzs  Campo ... | -21% | Mayonesa    Hellmanns 790 G | 790 GR | Yoghurth Griego Flip Key Lime    Cho... | 128 GR | Mostaza Preparada   French's 340 G | 340 GR | Leche Evaporada   Carnation 360 G | 360 GR | -24% | Crema Acida   Lala 426 Ml | 426 ML | Leche Fresca Entera   Zaragoza  1.8 ... | 1.8 LT | Leche Entera   Lala  1.8 Lt | Leche Uht Deslactosada Semidescremad... | 1 LT | Leche Uht Deslactosada Light Baja En... | Bebida Lactofermentada    Yakult    ... | 5 PZ | Leche Uht 100 Sin Lactosa Reducida E... | Leche Uht 100 Sin Lactosa Semidescre... | Mantequilla  Natural  Lala  90 G | 90 GR | Leche Saborizada Chocolate   Santa C... | 180 ML | Leche Condensada   La Lechera 375 G | 375 GR | Leche Fresca Lala 100 Con Proteina S... | Mes patrio Herdez | Ver más | Adobo    Doña María 235 G | Mole Doña María Almendrado En Pasta ... | Mole Doña María Almendrado Listo Par... | Mole Doña María Poblano Con Cacao En... | Mole Doña Maria Poblano Con Cacao Li... | Mole Doña Mariía Rojo En Pasta   125... | Mole En Pasta 430 Gramos   Doña Mari... | Mole Listo Para Servir  Para Servir ... | Mole Rojo En Pasta  Doña Maria 235 G | Mole Verde En Pasta  Doña Maria 230 ... | Pipián En Pasta  Doña Maria 230 G | Salsa Cacahuate Picante Cremosa   He... | Salsa Casera Con Habanero   Herdez 4... | Salsa Casera  Herdez 210 G | Salsa Guacamole 15% Mas Guacamole He...,,"{""Detalles"": [""Nuestros huevos blancos MyBrand en paquete de 30 piezas son ideales para hogares con mayor demanda. Aprovecha su frescura y calidad para disfrutar de tus platillos favoritos con la mejor calidad."", ""... Ver más"", ""Favoritos"", ""Recomendados"", ""Huevo Blanco Con 30  Bachoco 1 Carte..."", ""1 CA"", ""Huevo Blanco Con 30  San Juan 1 Cart..."", ""Huevo Blanco Con 18  Bachoco 1 Carte..."", ""-22%"", ""Huevo Blanco Con 12  Bachoco 1 Carte..."", ""Huevo Blanco Con 30  Huizache 1 Cart..."", ""Huevo Blanco Con 12  San Juan 1 Cart..."", ""Huevo Blanco Con 30  Huevissimo 1 Ca..."", ""Huevo Blanco Con 30  Mybrand 1 Carte..."", ""Huevo Blanco Con 18  San Juan 1 Cart..."", ""Huevo Blanco Con 12  Huizache  1 Car..."", ""Huevo Blanco Jumbo Con 20  Mybrand 1..."", ""Huevo Blanco Cage Free Con 12  Bacho..."", ""Huevo Blanco Con 12  Mybrand 1 Carte..."", ""Huevo Blanco Organico 12 Pzs  Campo ..."", ""-21%"", ""Mayonesa    Hellmanns 790 G"", ""790 GR"", ""Yoghurth Griego Flip Key Lime    Cho..."", ""128 GR"", ""Mostaza Preparada   French's 340 G"", ""340 GR"", ""Leche Evaporada   Carnation 360 G"", ""360 GR"", ""-24%"", ""Crema Acida   Lala 426 Ml"", ""426 ML"", ""Leche Fresca Entera   Zaragoza  1.8 ..."", ""1.8 LT"", ""Leche Entera   Lala  1.8 Lt"", ""Leche Uht Deslactosada Semidescremad..."", ""1 LT"", ""Leche Uht Deslactosada Light Baja En..."", ""Bebida Lactofermentada    Yakult    ..."", ""5 PZ"", ""Leche Uht 100 Sin Lactosa Reducida E..."", ""Leche Uht 100 Sin Lactosa Semidescre..."", ""Mantequilla  Natural  Lala  90 G"", ""90 GR"", ""Leche Saborizada Chocolate   Santa C..."", ""180 ML"", ""Leche Condensada   La Lechera 375 G"", ""375 GR"", ""Leche Fresca Lala 100 Con Proteina S..."", ""Mes patrio Herdez"", ""Ver más"", ""Adobo    Doña María 235 G"", ""Mole Doña María Almendrado En Pasta ..."", ""Mole Doña María Almendrado Listo Par..."", ""Mole Doña María Poblano Con Cacao En..."", ""Mole Doña Maria Poblano Con Cacao Li..."", ""Mole Doña Mariía Rojo En Pasta   125..."", ""Mole En Pasta 430 Gramos   Doña Mari..."", ""Mole Listo Para Servir  Para Servir ..."", ""Mole Rojo En Pasta  Doña Maria 235 G"", ""Mole Verde En Pasta  Doña Maria 230 ..."", ""Pipián En Pasta  Doña Maria 230 G"", ""Salsa Cacahuate Picante Cremosa   He..."", ""Salsa Casera Con Habanero   Herdez 4..."", ""Salsa Casera  Herdez 210 G"", ""Salsa Guacamole 15% Mas Guacamole He...""]}",dataset/txt_limpios/139.txt,dataset/paginas_descargadas/139.html,EN,leche,keep,0.60,heuristic_default
