{"source_id": "237", "title": "Meu Desconto", "description": "", "breadcrumbs": "Minha Lista > 500g", "price_raw": "46.49", "currency_raw": "BRL", "url": "", "seller": "Desconocido", "availability": "unknown", "country": "BR", "product_name": "Meu Desconto", "brand": "Minha Lista", "reference": "", "unit": "500g", "price_amount": 46.49, "price_currency": "BRL", "price_symbol": "R$", "price_text": "R$46,49", "price_amount_filled": "46.49", "price_is_imputed": "False", "price_imputation_source": "original", "price_amount_usd": "8.5334", "price_amount_usd_filled": "8.5334", "fx_rate_local_per_usd": "5.448", "fx_source": "from_brasil_cambio_dolar", "information_text": "", "description_text": "", "features_text": "", "specifications_text": "", "benefits_text": "", "details_text": "", "other_sections": "", "sections": {}, "txt_path": "dataset/txt_limpios/237.txt", "html_path": "dataset/paginas_descargadas/237.html", "es_status": "EN", "category_canonical": "sin_categoria", "decision": "discard", "match_score": 0.3, "reasons": "no_category_detected"}
{"source_id": "238", "title": "Meu Desconto", "description": "", "breadcrumbs": "Minha Lista > 500g", "price_raw": "38.99", "currency_raw": "BRL", "url": "", "seller": "Desconocido", "availability": "unknown", "country": "BR", "product_name": "Meu Desconto", "brand": "Minha Lista", "reference": "", "unit": "500g", "price_amount": 38.99, "price_currency": "BRL", "price_symbol": "R$", "price_text": "R$38,99", "price_amount_filled": "38.99", "price_is_imputed": "False", "price_imputation_source": "original", "price_amount_usd": "7.1568", "price_amount_usd_filled": "7.1568", "fx_rate_local_per_usd": "5.448", "fx_source": "from_brasil_cambio_dolar", "information_text": "", "description_text": "", "features_text": "", "specifications_text": "", "benefits_text": "", "details_text": "", "other_sections": "", "sections": {}, "txt_path": "dataset/txt_limpios/238.txt", "html_path": "dataset/paginas_descargadas/238.html", "es_status": "EN", "category_canonical": "sin_categoria", "decision": "discard", "match_score": 0.3, "reasons": "no_category_detected"}
{"source_id": "239", "title": "Meu Desconto", "description": "", "breadcrumbs": "Minha Lista > 250g", "price_raw": "26.99", "currency_raw": "BRL", "url": "", "seller": "Desconocido", "availability": "unknown", "country": "BR", "product_name": "Meu Desconto", "brand": "Minha Lista", "reference": "", "unit": "250g", "price_amount": 26.99, "price_currency": "BRL", "price_symbol": "R$", "price_text": "R$26,99", "price_amount_filled": "26.99", "price_is_imputed": "False", "price_imputation_source": "original", "price_amount_usd": "4.9541", "price_amount_usd_filled": "4.9541", "fx_rate_local_per_usd": "5.448", "fx_source": "from_brasil_cambio_dolar", "information_text": "", "description_text": "", "features_text": "", "specifications_text": "", "benefits_text": "", "details_text": "", "other_sections": "", "sections": {}, "txt_path": "dataset/txt_limpios/239.txt", "html_path": "dataset/paginas_descargadas/239.html", "es_status": "EN", "category_canonical": "sin_categoria", "decision": "discard", "match_score": 0.3, "reasons": "no_category_detected"}
{"source_id": "240", "title": "Meu Desconto", "description": "", "breadcrumbs": "Minha Lista > 480g", "price_raw": "10.29", "currency_raw": "BRL", "url": "", "seller": "Desconocido", "availability": "unknown", "country": "BR", "product_name": "Meu Desconto", "brand": "Minha Lista", "reference": "", "unit": "480g", "price_amount": 10.29, "price_currency": "BRL", "price_symbol": "R$", "price_text": "R$10,29", "price_amount_filled": "10.29", "price_is_imputed": "False", "price_imputation_source": "original", "price_amount_usd": "1.8888", "price_amount_usd_filled": "1.8888", "fx_rate_local_per_usd": "5.448", "fx_source": "from_brasil_cambio_dolar", "information_text": "", "description_text": "", "features_text": "", "specifications_text": "", "benefits_text": "", "details_text": "", "other_sections": "", "sections": {}, "txt_path": "dataset/txt_limpios/240.txt", "html_path": "dataset/paginas_descargadas/240.html", "es_status": "EN", "category_canonical": "sin_categoria", "decision": "discard", "match_score": 0.3, "reasons": "no_category_detected"}
{"source_id": "241", "title": "Meu Desconto", "description": "", "breadcrumbs": "Minha Lista > 500g", "price_raw": "11.49", "currency_raw": "BRL", "url": "", "seller": "Desconocido", "availability": "unknown", "country": "BR", "product_name": "Meu Desconto", "brand": "Minha Lista", "reference": "", "unit": "500g", "price_amount": 11.49, "price_currency": "BRL", "price_symbol": "R$", "price_text": "R$11,49", "price_amount_filled": "11.49", "price_is_imputed": "False", "price_imputation_source": "original", "price_amount_usd": "2.109", "price_amount_usd_filled": "2.109", "fx_rate_local_per_usd": "5.448", "fx_source": "from_brasil_cambio_dolar", "information_text": "", "description_text": "", "features_text": "", "specifications_text": "", "benefits_text": "", "details_text": "", "other_sections": "", "sections": {}, "txt_path": "dataset/txt_limpios/241.txt", "html_path": "dataset/paginas_descargadas/241.html", "es_status": "EN", "category_canonical": "sin_categoria", "decision": "discard", "match_score": 0.3, "reasons": "no_category_detected"}
{"source_id": "242", "title": "Meu Desconto", "description": "", "breadcrumbs": "Minha Lista > 450g", "price_raw": "7.19", "currency_raw": "BRL", "url": "", "seller": "Desconocido", "availability": "unknown", "country": "BR", "product_name": "Meu Desconto", "brand": "Minha Lista", "reference": "", "unit": "450g", "price_amount": 7.19, "price_currency": "BRL", "price_symbol": "R$", "price_text": "R$7,19", "price_amount_filled": "7.19", "price_is_imputed": "False", "price_imputation_source": "original", "price_amount_usd": "1.3198", "price_amount_usd_filled": "1.3198", "fx_rate_local_per_usd": "5.448", "fx_source": "from_brasil_cambio_dolar", "information_text": "", "description_text": "", "features_text": "", "specifications_text": "", "benefits_text": "", "details_text": "", "other_sections": "", "sections": {}, "txt_path": "dataset/txt_limpios/242.txt", "html_path": "dataset/paginas_descargadas/242.html", "es_status": "EN", "category_canonical": "sin_categoria", "decision": "discard", "match_score": 0.3, "reasons": "no_category_detected"}
{"source_id": "243", "title": "Meu Desconto", "description": "", "breadcrumbs": "Minha Lista > 500g", "price_raw": "15.29", "currency_raw": "BRL", "url": "", "seller": "Desconocido", "availability": "unknown", "country": "BR", "product_name": "Meu Desconto", "brand": "Minha Lista", "reference": "", "unit": "500g", "price_amount": 15.29, "price_currency": "BRL", "price_symbol": "R$", "price_text": "R$15,29", "price_amount_filled": "15.29", "price_is_imputed": "False", "price_imputation_source": "original", "price_amount_usd": "2.8065", "price_amount_usd_filled": "2.8065", "fx_rate_local_per_usd": "5.448", "fx_source": "from_brasil_cambio_dolar", "information_text": "", "description_text": "", "features_text": "", "specifications_text": "", "benefits_text": "", "details_text": "", "other_sections": "", "sections": {}, "txt_path": "dataset/txt_limpios/243.txt", "html_path": "dataset/paginas_descargadas/243.html", "es_status": "EN", "category_canonical": "sin_categoria", "decision": "discard", "match_score": 0.3, "reasons": "no_category_detected"}
{"source_id": "244", "title": "Meu Desconto", "description": "", "breadcrumbs": "Minha Lista > 400g", "price_raw": "400.0", "currency_raw": "", "url": "", "seller": "Desconocido", "availability": "unknown", "country": "UNKNOWN", "product_name": "Meu Desconto", "brand": "Minha Lista", "reference": "", "unit": "400g", "price_amount": 400.0, "price_currency": "", "price_symbol": "", "price_text": "400", "price_amount_filled": "400.0", "price_is_imputed": "False", "price_imputation_source": "original", "price_amount_usd": "400.0", "price_amount_usd_filled": "400.0", "fx_rate_local_per_usd": "1.0", "fx_source": "default_1usd", "information_text": "", "description_text": "", "features_text": "", "specifications_text": "", "benefits_text": "", "details_text": "", "other_sections": "", "sections": {}, "txt_path": "dataset/txt_limpios/244.txt", "html_path": "dataset/paginas_descargadas/244.html", "es_status": "EN", "category_canonical": "sin_categoria", "decision": "discard", "match_score": 0.3, "reasons": "no_category_detected"}
{"source_id": "245", "title": "Meu Desconto", "description": "", "breadcrumbs": "Minha Lista > 1,5l", "price_raw": "8.49", "currency_raw": "BRL", "url": "", "seller": "Desconocido", "availability": "unknown", "country": "BR", "product_name": "Meu Desconto", "brand": "Minha Lista", "reference": "", "unit": "1,5l", "price_amount": 8.49, "price_currency": "BRL", "price_symbol": "R$", "price_text": "R$8,49", "price_amount_filled": "8.49", "price_is_imputed": "False", "price_imputation_source": "original", "price_amount_usd": "1.5584", "price_amount_usd_filled": "1.5584", "fx_rate_local_per_usd": "5.448", "fx_source": "from_brasil_cambio_dolar", "information_text": "", "description_text": "", "features_text": "", "specifications_text": "", "benefits_text": "", "details_text": "", "other_sections": "", "sections": {}, "txt_path": "dataset/txt_limpios/245.txt", "html_path": "dataset/paginas_descargadas/245.html", "es_status": "EN", "category_canonical": "sin_categoria", "decision": "discard", "match_score": 0.3, "reasons": "no_category_detected"}
{"source_id": "246", "title": "Meu Desconto", "description": "", "breadcrumbs": "Minha Lista > 600ml", "price_raw": "5.39", "currency_raw": "BRL", "url": "", "seller": "Desconocido", "availability": "unknown", "country": "BR", "product_name": "Meu Desconto", "brand": "Minha Lista", "reference": "", "unit": "600ml", "price_amount": 5.39, "price_currency": "BRL", "price_symbol": "R$", "price_text": "R$5,39", "price_amount_filled": "5.39", "price_is_imputed": "False", "price_imputation_source": "original", "price_amount_usd": "0.9894", "price_amount_usd_filled": "0.9894", "fx_rate_local_per_usd": "5.448", "fx_source": "from_brasil_cambio_dolar", "information_text": "", "description_text": "", "features_text": "", "specifications_text": "", "benefits_text": "", "details_text": "", "other_sections": "", "sections": {}, "txt_path": "dataset/txt_limpios/246.txt", "html_path": "dataset/paginas_descargadas/246.html", "es_status": "EN", "category_canonical": "sin_categoria", "decision": "discard", "match_score": 0.3, "reasons": "no_category_detected"}
{"source_id": "247", "title": "Meu Desconto", "description": "", "breadcrumbs": "Minha Lista > 1,5l", "price_raw": "8.99", "currency_raw": "BRL", "url": "", "seller": "Desconocido", "availability": "unknown", "country": "BR", "product_name": "Meu Desconto", "brand": "Minha Lista", "reference": "", "unit": "1,5l", "price_amount": 8.99, "price_currency": "BRL", "price_symbol": "R$", "price_text": "R$8,99", "price_amount_filled": "8.99", "price_is_imputed": "False", "price_imputation_source": "original", "price_amount_usd": "1.6501", "price_amount_usd_filled": "1.6501", "fx_rate_local_per_usd": "5.448", "fx_source": "from_brasil_cambio_dolar", "information_text": "", "description_text": "", "features_text": "", "specifications_text": "", "benefits_text": "", "details_text": "", "other_sections": "", "sections": {}, "txt_path": "dataset/txt_limpios/247.txt", "html_path": "dataset/paginas_descargadas/247.html", "es_status": "EN", "category_canonical": "sin_categoria", "decision": "discard", "match_score": 0.3, "reasons": "no_category_detected"}
{"source_id": "248", "title": "Meu Desconto", "description": "", "breadcrumbs": "Minha Lista > 1,5l", "price_raw": "8.99", "currency_raw": "BRL", "url": "", "seller": "Desconocido", "availability": "unknown", "country": "BR", "product_name": "Meu Desconto", "brand": "Minha Lista", "reference": "", "unit": "1,5l", "price_amount": 8.99, "price_currency": "BRL", "price_symbol": "R$", "price_text": "R$8,99", "price_amount_filled": "8.99", "price_is_imputed": "False", "price_imputation_source": "original", "price_amount_usd": "1.6501", "price_amount_usd_filled": "1.6501", "fx_rate_local_per_usd": "5.448", "fx_source": "from_brasil_cambio_dolar", "information_text": "", "description_text": "", "features_text": "", "specifications_text": "", "benefits_text": "", "details_text": "", "other_sections": "", "sections": {}, "txt_path": "dataset/txt_limpios/248.txt", "html_path": "dataset/paginas_descargadas/248.html", "es_status": "EN", "category_canonical": "sin_categoria", "decision": "discard", "match_score": 0.3, "reasons": "no_category_detected"}
{"source_id": "249", "title": "Meu Desconto", "description": "", "breadcrumbs": "Minha Lista > 1,5l", "price_raw": "7.29", "currency_raw": "BRL", "url": "", "seller": "Desconocido", "availability": "unknown", "country": "BR", "product_name": "Meu Desconto", "brand": "Minha Lista", "reference": "", "unit": "1,5l", "price_amount": 7.29, "price_currency": "BRL", "price_symbol": "R$", "price_text": "R$7,29", "price_amount_filled": "7.29", "price_is_imputed": "False", "price_imputation_source": "original", "price_amount_usd": "1.3381", "price_amount_usd_filled": "1.3381", "fx_rate_local_per_usd": "5.448", "fx_source": "from_brasil_cambio_dolar", "information_text": "", "description_text": "", "features_text": "", "specifications_text": "", "benefits_text": "", "details_text": "", "other_sections": "", "sections": {}, "txt_path": "dataset/txt_limpios/249.txt", "html_path": "dataset/paginas_descargadas/249.html", "es_status": "EN", "category_canonical": "sin_categoria", "decision": "discard", "match_score": 0.3, "reasons": "no_category_detected"}
{"source_id": "250", "title": "Meu Desconto", "description": "", "breadcrumbs": "Minha Lista > 500g", "price_raw": "5.19", "currency_raw": "BRL", "url": "", "seller": "Desconocido", "availability": "unknown", "country": "BR", "product_name": "Meu Desconto", "brand": "Minha Lista", "reference": "", "unit": "500g", "price_amount": 5.19, "price_currency": "BRL", "price_symbol": "R$", "price_text": "R$5,19", "price_amount_filled": "5.19", "price_is_imputed": "False", "price_imputation_source": "original", "price_amount_usd": "0.9526", "price_amount_usd_filled": "0.9526", "fx_rate_local_per_usd": "5.448", "fx_source": "from_brasil_cambio_dolar", "information_text": "", "description_text": "", "features_text": "", "specifications_text": "", "benefits_text": "", "details_text": "", "other_sections": "", "sections": {}, "txt_path": "dataset/txt_limpios/250.txt", "html_path": "dataset/paginas_descargadas/250.html", "es_status": "EN", "category_canonical": "sin_categoria", "decision": "discard", "match_score": 0.3, "reasons": "no_category_detected"}
{"source_id": "251", "title": "Meu Desconto", "description": "", "breadcrumbs": "Minha Lista > 500g", "price_raw": "5.19", "currency_raw": "BRL", "url": "", "seller": "Desconocido", "availability": "unknown", "country": "BR", "product_name": "Meu Desconto", "brand": "Minha Lista", "reference": "", "unit": "500g", "price_amount": 5.19, "price_currency": "BRL", "price_symbol": "R$", "price_text": "R$5,19", "price_amount_filled": "5.19", "price_is_imputed": "False", "price_imputation_source": "original", "price_amount_usd": "0.9526", "price_amount_usd_filled": "0.9526", "fx_rate_local_per_usd": "5.448", "fx_source": "from_brasil_cambio_dolar", "information_text": "", "description_text": "", "features_text": "", "specifications_text": "", "benefits_text": "", "details_text": "", "other_sections": "", "sections": {}, "txt_path": "dataset/txt_limpios/251.txt", "html_path": "dataset/paginas_descargadas/251.html", "es_status": "EN", "category_canonical": "sin_categoria", "decision": "discard", "match_score": 0.3, "reasons": "no_category_detected"}
{"source_id": "252", "title": "Meu Desconto", "description": "", "breadcrumbs": "Minha Lista > 500g", "price_raw": "4.49", "currency_raw": "BRL", "url": "", "seller": "Desconocido", "availability": "unknown", "country": "BR", "product_name": "Meu Desconto", "brand": "Minha Lista", "reference": "", "unit": "500g", "price_amount": 4.49, "price_currency": "BRL", "price_symbol": "R$", "price_text": "R$4,49", "price_amount_filled": "4.49", "price_is_imputed": "False", "price_imputation_source": "original", "price_amount_usd": "0.8242", "price_amount_usd_filled": "0.8242", "fx_rate_local_per_usd": "5.448", "fx_source": "from_brasil_cambio_dolar", "information_text": "", "description_text": "", "features_text": "", "specifications_text": "", "benefits_text": "", "details_text": "", "other_sections": "", "sections": {}, "txt_path": "dataset/txt_limpios/252.txt", "html_path": "dataset/paginas_descargadas/252.html", "es_status": "EN", "category_canonical": "sin_categoria", "decision": "discard", "match_score": 0.3, "reasons": "no_category_detected"}
{"source_id": "253", "title": "Meu Desconto", "description": "", "breadcrumbs": "Minha Lista > 500g", "price_raw": "4.49", "currency_raw": "BRL", "url": "", "seller": "Desconocido", "availability": "unknown", "country": "BR", "product_name": "Meu Desconto", "brand": "Minha Lista", "reference": "", "unit": "500g", "price_amount": 4.49, "price_currency": "BRL", "price_symbol": "R$", "price_text": "R$4,49", "price_amount_filled": "4.49", "price_is_imputed": "False", "price_imputation_source": "original", "price_amount_usd": "0.8242", "price_amount_usd_filled": "0.8242", "fx_rate_local_per_usd": "5.448", "fx_source": "from_brasil_cambio_dolar", "information_text": "", "description_text": "", "features_text": "", "specifications_text": "", "benefits_text": "", "details_text": "", "other_sections": "", "sections": {}, "txt_path": "dataset/txt_limpios/253.txt", "html_path": "dataset/paginas_descargadas/253.html", "es_status": "EN", "category_canonical": "sin_categoria", "decision": "discard", "match_score": 0.3, "reasons": "no_category_detected"}
{"source_id": "254", "title": "Meu Desconto", "description": "", "breadcrumbs": "Minha Lista > 500g", "price_raw": "4.99", "currency_raw": "BRL", "url": "", "seller": "Desconocido", "availability": "unknown", "country": "BR", "product_name": "Meu Desconto", "brand": "Minha Lista", "reference": "", "unit": "500g", "price_amount": 4.99, "price_currency": "BRL", "price_symbol": "R$", "price_text": "R$4,99", "price_amount_filled": "4.99", "price_is_imputed": "False", "price_imputation_source": "original", "price_amount_usd": "0.9159", "price_amount_usd_filled": "0.9159", "fx_rate_local_per_usd": "5.448", "fx_source": "from_brasil_cambio_dolar", "information_text": "", "description_text": "", "features_text": "", "specifications_text": "", "benefits_text": "", "details_text": "", "other_sections": "", "sections": {}, "txt_path": "dataset/txt_limpios/254.txt", "html_path": "dataset/paginas_descargadas/254.html", "es_status": "EN", "category_canonical": "sin_categoria", "decision": "discard", "match_score": 0.3, "reasons": "no_category_detected"}
{"source_id": "255", "title": "Meu Desconto", "description": "", "breadcrumbs": "Minha Lista > 1 Litro", "price_raw": "1.0", "currency_raw": "", "url": "", "seller": "Desconocido", "availability": "unknown", "country": "UNKNOWN", "product_name": "Meu Desconto", "brand": "Minha Lista", "reference": "", "unit": "1 Litro", "price_amount": 1.0, "price_currency": "", "price_symbol": "", "price_text": "1", "price_amount_filled": "1.0", "price_is_imputed": "False", "price_imputation_source": "original", "price_amount_usd": "1.0", "price_amount_usd_filled": "1.0", "fx_rate_local_per_usd": "1.0", "fx_source": "default_1usd", "information_text": "", "description_text": "", "features_text": "", "specifications_text": "", "benefits_text": "", "details_text": "", "other_sections": "", "sections": {}, "txt_path": "dataset/txt_limpios/255.txt", "html_path": "dataset/paginas_descargadas/255.html", "es_status": "EN", "category_canonical": "sin_categoria", "decision": "discard", "match_score": 0.3, "reasons": "no_category_detected"}
{"source_id": "256", "title": "Meu Desconto", "description": "", "breadcrumbs": "Minha Lista > 1L", "price_raw": "8.39", "currency_raw": "BRL", "url": "", "seller": "Desconocido", "availability": "unknown", "country": "BR", "product_name": "Meu Desconto", "brand": "Minha Lista", "reference": "", "unit": "1L", "price_amount": 8.39, "price_currency": "BRL", "price_symbol": "R$", "price_text": "R$8,39", "price_amount_filled": "8.39", "price_is_imputed": "False", "price_imputation_source": "original", "price_amount_usd": "1.54", "price_amount_usd_filled": "1.54", "fx_rate_local_per_usd": "5.448", "fx_source": "from_brasil_cambio_dolar", "information_text": "", "description_text": "", "features_text": "", "specifications_text": "", "benefits_text": "", "details_text": "", "other_sections": "", "sections": {}, "txt_path": "dataset/txt_limpios/256.txt", "html_path": "dataset/paginas_descargadas/256.html", "es_status": "EN", "category_canonical": "sin_categoria", "decision": "discard", "match_score": 0.3, "reasons": "no_category_detected"}
