{"source_id": "594", "title": "DALE VIDA A TU JARDIN", "description": "Datos técnicos Descripción del producto ¡Suscribite a nuestro boletín! Recibí las ofertas y novedades en tu correo. Suscribirme Seguridad y confianza © Libertad 2023. Todos los derechos reservados. Términos y Condiciones Direcciôn General de Defensa y protecciôn al Consumidor, para consultas y/o denuncias ingresa a los Términos más buscados 1. leche 2. cerveza 3. aceptada 4. yerba 5. cafe 6. pañales 7. queso 8. arroz 9. fideos 10. fernet", "breadcrumbs": "🌷🌻​🌼​ > 500 GR", "price_raw": "1404.13", "currency_raw": "ARS", "url": "", "seller": "Desconocido", "availability": "unknown", "country": "AR", "product_name": "DALE VIDA A TU JARDIN", "brand": "🌷🌻​🌼​", "reference": "", "unit": "500 GR", "price_amount": 1404.13, "price_currency": "ARS", "price_symbol": "$", "price_text": "$1.404,13", "price_amount_filled": "1404.13", "price_is_imputed": "False", "price_imputation_source": "original", "price_amount_usd": "1.1188", "price_amount_usd_filled": "1.1188", "fx_rate_local_per_usd": "1255.0", "fx_source": "from_argentina_cambio_dolar", "information_text": "", "description_text": "Datos técnicos Descripción del producto ¡Suscribite a nuestro boletín! Recibí las ofertas y novedades en tu correo. Suscribirme Seguridad y confianza © Libertad 2023. Todos los derechos reservados. Términos y Condiciones Direcciôn General de Defensa y protecciôn al Consumidor, para consultas y/o denuncias ingresa a los Términos más buscados 1. leche 2. cerveza 3. aceptada 4. yerba 5. cafe 6. pañales 7. queso 8. arroz 9. fideos 10. fernet", "features_text": "", "specifications_text": "", "benefits_text": "", "details_text": "", "other_sections": "", "sections": {"Descripción": ["Datos técnicos", "Descripción del producto", "¡Suscribite a nuestro newsletter!", "Recibí las ofertas y novedades en tu correo.", "Suscribirme", "Seguridad y confianza", "© Libertad 2023. Todos los derechos reservados.", "Términos y Condiciones", "Dirección General de Defensa y Protección al Consumidor para consultas y/o denuncias", "introduzca aquí", "Términos más buscados", "1.", "leche", "2.", "cerveza", "3.", "aceite", "4.", "yerba", "5.", "cafe", "6.", "pañales", "7.", "queso", "8.", "arroz", "9.", "fideos", "10.", "fernet"]}, "txt_path": "dataset/txt_limpios/594.txt", "html_path": "dataset/paginas_descargadas/594.html", "es_status": "ET", "category_canonical": "cafe", "decision": "keep", "match_score": 0.6, "reasons": "heuristic_default"}
{"source_id": "595", "title": "DALE VIDA A TU JARDIN", "description": "Datos técnicos Descripción del producto ¡Suscribite a nuestro boletín! Recibí las ofertas y novedades en tu correo. Suscribirme Seguridad y confianza © Libertad 2023. Todos los derechos reservados. Términos y Condiciones Direcciôn General de Defensa y protecciôn al Consumidor, para consultas y/o denuncias ingresa a los Términos más buscados 1. leche 2. cerveza 3. aceptada 4. yerba 5. cafe 6. pañales 7. queso 8. arroz 9. fideos 10. fernet", "breadcrumbs": "🌷🌻​🌼​ > 500G", "price_raw": "926.45", "currency_raw": "ARS", "url": "", "seller": "Desconocido", "availability": "unknown", "country": "AR", "product_name": "DALE VIDA A TU JARDIN", "brand": "🌷🌻​🌼​", "reference": "", "unit": "500G", "price_amount": 926.45, "price_currency": "ARS", "price_symbol": "$", "price_text": "$926,45", "price_amount_filled": "926.45", "price_is_imputed": "False", "price_imputation_source": "original", "price_amount_usd": "0.7382", "price_amount_usd_filled": "0.7382", "fx_rate_local_per_usd": "1255.0", "fx_source": "from_argentina_cambio_dolar", "information_text": "", "description_text": "Datos técnicos Descripción del producto ¡Suscribite a nuestro boletín! Recibí las ofertas y novedades en tu correo. Suscribirme Seguridad y confianza © Libertad 2023. Todos los derechos reservados. Términos y Condiciones Direcciôn General de Defensa y protecciôn al Consumidor, para consultas y/o denuncias ingresa a los Términos más buscados 1. leche 2. cerveza 3. aceptada 4. yerba 5. cafe 6. pañales 7. queso 8. arroz 9. fideos 10. fernet", "features_text": "", "specifications_text": "", "benefits_text": "", "details_text": "", "other_sections": "", "sections": {"Descripción": ["Datos técnicos", "Descripción del producto", "¡Suscribite a nuestro newsletter!", "Recibí las ofertas y novedades en tu correo.", "Suscribirme", "Seguridad y confianza", "© Libertad 2023. Todos los derechos reservados.", "Términos y Condiciones", "Dirección General de Defensa y Protección al Consumidor para consultas y/o denuncias", "introduzca aquí", "Términos más buscados", "1.", "leche", "2.", "cerveza", "3.", "aceite", "4.", "yerba", "5.", "cafe", "6.", "pañales", "7.", "queso", "8.", "arroz", "9.", "fideos", "10.", "fernet"]}, "txt_path": "dataset/txt_limpios/595.txt", "html_path": "dataset/paginas_descargadas/595.html", "es_status": "ET", "category_canonical": "cafe", "decision": "keep", "match_score": 0.6, "reasons": "heuristic_default"}
{"source_id": "596", "title": "DALE VIDA A TU JARDIN", "description": "", "breadcrumbs": "🌷🌻​🌼​", "price_raw": "", "currency_raw": "ARS", "url": "", "seller": "Desconocido", "availability": "unknown", "country": "AR", "product_name": "DALE VIDA A TU JARDIN", "brand": "🌷🌻​🌼​", "reference": "", "unit": "", "price_amount": null, "price_currency": "ARS", "price_symbol": "", "price_text": "", "price_amount_filled": "1663.58", "price_is_imputed": "True", "price_imputation_source": "country_mean", "price_amount_usd": "", "price_amount_usd_filled": "1.3256", "fx_rate_local_per_usd": "1255.0", "fx_source": "from_argentina_cambio_dolar", "information_text": "", "description_text": "", "features_text": "", "specifications_text": "", "benefits_text": "", "details_text": "", "other_sections": "", "sections": {}, "txt_path": "dataset/txt_limpios/596.txt", "html_path": "dataset/paginas_descargadas/596.html", "es_status": "EN", "category_canonical": "sin_categoria", "decision": "discard", "match_score": 0.3, "reasons": "no_category_detected;price_parse_failed"}
{"source_id": "597", "title": "DALE VIDA A TU JARDIN", "description": "Datos técnicos Descripción del producto ¡Suscribite a nuestro boletín! Recibí las ofertas y novedades en tu correo. Suscribirme Seguridad y confianza © Libertad 2023. Todos los derechos reservados. Términos y Condiciones Direcciôn General de Defensa y protecciôn al Consumidor, para consultas y/o denuncias ingresa a los Términos más buscados 1. leche 2. cerveza 3. aceptada 4. yerba 5. cafe 6. pañales 7. queso 8. arroz 9. fideos 10. fernet", "breadcrumbs": "🌷🌻​🌼​ > 500G", "price_raw": "2536.36", "currency_raw": "ARS", "url": "", "seller": "Desconocido", "availability": "unknown", "country": "AR", "product_name": "DALE VIDA A TU JARDIN", "brand": "🌷🌻​🌼​", "reference": "", "unit": "500G", "price_amount": 2536.36, "price_currency": "ARS", "price_symbol": "$", "price_text": "$2.536,36", "price_amount_filled": "2536.36", "price_is_imputed": "False", "price_imputation_source": "original", "price_amount_usd": "2.021", "price_amount_usd_filled": "2.021", "fx_rate_local_per_usd": "1255.0", "fx_source": "from_argentina_cambio_dolar", "information_text": "", "description_text": "Datos técnicos Descripción del producto ¡Suscribite a nuestro boletín! Recibí las ofertas y novedades en tu correo. Suscribirme Seguridad y confianza © Libertad 2023. Todos los derechos reservados. Términos y Condiciones Direcciôn General de Defensa y protecciôn al Consumidor, para consultas y/o denuncias ingresa a los Términos más buscados 1. leche 2. cerveza 3. aceptada 4. yerba 5. cafe 6. pañales 7. queso 8. arroz 9. fideos 10. fernet", "features_text": "", "specifications_text": "", "benefits_text": "", "details_text": "", "other_sections": "", "sections": {"Descripción": ["Datos técnicos", "Descripción del producto", "¡Suscribite a nuestro newsletter!", "Recibí las ofertas y novedades en tu correo.", "Suscribirme", "Seguridad y confianza", "© Libertad 2023. Todos los derechos reservados.", "Términos y Condiciones", "Dirección General de Defensa y Protección al Consumidor para consultas y/o denuncias", "introduzca aquí", "Términos más buscados", "1.", "leche", "2.", "cerveza", "3.", "aceite", "4.", "yerba", "5.", "cafe", "6.", "pañales", "7.", "queso", "8.", "arroz", "9.", "fideos", "10.", "fernet"]}, "txt_path": "dataset/txt_limpios/597.txt", "html_path": "dataset/paginas_descargadas/597.html", "es_status": "ET", "category_canonical": "cafe", "decision": "keep", "match_score": 0.6, "reasons": "heuristic_default"}
{"source_id": "598", "title": "DALE VIDA A TU JARDIN", "description": "Datos técnicos Descripción del producto ¡Suscribite a nuestro boletín! Recibí las ofertas y novedades en tu correo. Suscribirme Seguridad y confianza © Libertad 2023. Todos los derechos reservados. Términos y Condiciones Direcciôn General de Defensa y protecciôn al Consumidor, para consultas y/o denuncias ingresa a los Términos más buscados 1. leche 2. cerveza 3. aceptada 4. yerba 5. cafe 6. pañales 7. queso 8. arroz 9. fideos 10. fernet", "breadcrumbs": "🌷🌻​🌼​ > 2,5KG", "price_raw": "8316.74", "currency_raw": "ARS", "url": "", "seller": "Desconocido", "availability": "unknown", "country": "AR", "product_name": "DALE VIDA A TU JARDIN", "brand": "🌷🌻​🌼​", "reference": "", "unit": "2,5KG", "price_amount": 8316.74, "price_currency": "ARS", "price_symbol": "$", "price_text": "$8.316,74", "price_amount_filled": "8316.74", "price_is_imputed": "False", "price_imputation_source": "original", "price_amount_usd": "6.6269", "price_amount_usd_filled": "6.6269", "fx_rate_local_per_usd": "1255.0", "fx_source": "from_argentina_cambio_dolar", "information_text": "", "description_text": "Datos técnicos Descripción del producto ¡Suscribite a nuestro boletín! Recibí las ofertas y novedades en tu correo. Suscribirme Seguridad y confianza © Libertad 2023. Todos los derechos reservados. Términos y Condiciones Direcciôn General de Defensa y protecciôn al Consumidor, para consultas y/o denuncias ingresa a los Términos más buscados 1. leche 2. cerveza 3. aceptada 4. yerba 5. cafe 6. pañales 7. queso 8. arroz 9. fideos 10. fernet", "features_text": "", "specifications_text": "", "benefits_text": "", "details_text": "", "other_sections": "", "sections": {"Descripción": ["Datos técnicos", "Descripción del producto", "¡Suscribite a nuestro newsletter!", "Recibí las ofertas y novedades en tu correo.", "Suscribirme", "Seguridad y confianza", "© Libertad 2023. Todos los derechos reservados.", "Términos y Condiciones", "Dirección General de Defensa y Protección al Consumidor para consultas y/o denuncias", "introduzca aquí", "Términos más buscados", "1.", "leche", "2.", "cerveza", "3.", "aceite", "4.", "yerba", "5.", "cafe", "6.", "pañales", "7.", "queso", "8.", "arroz", "9.", "fideos", "10.", "fernet"]}, "txt_path": "dataset/txt_limpios/598.txt", "html_path": "dataset/paginas_descargadas/598.html", "es_status": "ET", "category_canonical": "cafe", "decision": "keep", "match_score": 0.6, "reasons": "heuristic_default"}
{"source_id": "599", "title": "DALE VIDA A TU JARDIN", "description": "Datos técnicos Descripción del producto ¡Suscribite a nuestro boletín! Recibí las ofertas y novedades en tu correo. Suscribirme Seguridad y confianza © Libertad 2023. Todos los derechos reservados. Términos y Condiciones Direcciôn General de Defensa y protecciôn al Consumidor, para consultas y/o denuncias ingresa a los Términos más buscados 1. leche 2. cerveza 3. aceptada 4. yerba 5. cafe 6. pañales 7. queso 8. arroz 9. fideos 10. fernet", "breadcrumbs": "🌷🌻​🌼​ > 800 GR", "price_raw": "800.0", "currency_raw": "ARS", "url": "", "seller": "Desconocido", "availability": "unknown", "country": "AR", "product_name": "DALE VIDA A TU JARDIN", "brand": "🌷🌻​🌼​", "reference": "", "unit": "800 GR", "price_amount": 800.0, "price_currency": "ARS", "price_symbol": "", "price_text": "800", "price_amount_filled": "800.0", "price_is_imputed": "False", "price_imputation_source": "original", "price_amount_usd": "0.6375", "price_amount_usd_filled": "0.6375", "fx_rate_local_per_usd": "1255.0", "fx_source": "from_argentina_cambio_dolar", "information_text": "", "description_text": "Datos técnicos Descripción del producto ¡Suscribite a nuestro boletín! Recibí las ofertas y novedades en tu correo. Suscribirme Seguridad y confianza © Libertad 2023. Todos los derechos reservados. Términos y Condiciones Direcciôn General de Defensa y protecciôn al Consumidor, para consultas y/o denuncias ingresa a los Términos más buscados 1. leche 2. cerveza 3. aceptada 4. yerba 5. cafe 6. pañales 7. queso 8. arroz 9. fideos 10. fernet", "features_text": "", "specifications_text": "", "benefits_text": "", "details_text": "", "other_sections": "", "sections": {"Descripción": ["Datos técnicos", "Descripción del producto", "¡Suscribite a nuestro newsletter!", "Recibí las ofertas y novedades en tu correo.", "Suscribirme", "Seguridad y confianza", "© Libertad 2023. Todos los derechos reservados.", "Términos y Condiciones", "Dirección General de Defensa y Protección al Consumidor para consultas y/o denuncias", "introduzca aquí", "Términos más buscados", "1.", "leche", "2.", "cerveza", "3.", "aceite", "4.", "yerba", "5.", "cafe", "6.", "pañales", "7.", "queso", "8.", "arroz", "9.", "fideos", "10.", "fernet"]}, "txt_path": "dataset/txt_limpios/599.txt", "html_path": "dataset/paginas_descargadas/599.html", "es_status": "ET", "category_canonical": "cafe", "decision": "keep", "match_score": 0.6, "reasons": "heuristic_default"}
{"source_id": "600", "title": "DALE VIDA A TU JARDIN", "description": "Datos técnicos Descripción del producto ¡Suscribite a nuestro boletín! Recibí las ofertas y novedades en tu correo. Suscribirme Seguridad y confianza © Libertad 2023. Todos los derechos reservados. Términos y Condiciones Direcciôn General de Defensa y protecciôn al Consumidor, para consultas y/o denuncias ingresa a los Términos más buscados 1. leche 2. cerveza 3. aceptada 4. yerba 5. cafe 6. pañales 7. queso 8. arroz 9. fideos 10. fernet", "breadcrumbs": "🌷🌻​🌼​", "price_raw": "1363.64", "currency_raw": "ARS", "url": "", "seller": "Desconocido", "availability": "unknown", "country": "AR", "product_name": "DALE VIDA A TU JARDIN", "brand": "🌷🌻​🌼​", "reference": "", "unit": "", "price_amount": 1363.64, "price_currency": "ARS", "price_symbol": "$", "price_text": "$1.363,64", "price_amount_filled": "1363.64", "price_is_imputed": "False", "price_imputation_source": "original", "price_amount_usd": "1.0866", "price_amount_usd_filled": "1.0866", "fx_rate_local_per_usd": "1255.0", "fx_source": "from_argentina_cambio_dolar", "information_text": "", "description_text": "Datos técnicos Descripción del producto ¡Suscribite a nuestro boletín! Recibí las ofertas y novedades en tu correo. Suscribirme Seguridad y confianza © Libertad 2023. Todos los derechos reservados. Términos y Condiciones Direcciôn General de Defensa y protecciôn al Consumidor, para consultas y/o denuncias ingresa a los Términos más buscados 1. leche 2. cerveza 3. aceptada 4. yerba 5. cafe 6. pañales 7. queso 8. arroz 9. fideos 10. fernet", "features_text": "", "specifications_text": "", "benefits_text": "", "details_text": "", "other_sections": "", "sections": {"Descripción": ["Datos técnicos", "Descripción del producto", "¡Suscribite a nuestro newsletter!", "Recibí las ofertas y novedades en tu correo.", "Suscribirme", "Seguridad y confianza", "© Libertad 2023. Todos los derechos reservados.", "Términos y Condiciones", "Dirección General de Defensa y Protección al Consumidor para consultas y/o denuncias", "introduzca aquí", "Términos más buscados", "1.", "leche", "2.", "cerveza", "3.", "aceite", "4.", "yerba", "5.", "cafe", "6.", "pañales", "7.", "queso", "8.", "arroz", "9.", "fideos", "10.", "fernet"]}, "txt_path": "dataset/txt_limpios/600.txt", "html_path": "dataset/paginas_descargadas/600.html", "es_status": "ET", "category_canonical": "cafe", "decision": "keep", "match_score": 0.6, "reasons": "heuristic_default"}
{"source_id": "601", "title": "DALE VIDA A TU JARDIN", "description": "Datos técnicos Descripción del producto ¡Suscribite a nuestro boletín! Recibí las ofertas y novedades en tu correo. Suscribirme Seguridad y confianza © Libertad 2023. Todos los derechos reservados. Términos y Condiciones Direcciôn General de Defensa y protecciôn al Consumidor, para consultas y/o denuncias ingresa a los Términos más buscados 1. leche 2. cerveza 3. aceptada 4. yerba 5. cafe 6. pañales 7. queso 8. arroz 9. fideos 10. fernet", "breadcrumbs": "🌷🌻​🌼​", "price_raw": "3178.51", "currency_raw": "ARS", "url": "", "seller": "Desconocido", "availability": "unknown", "country": "AR", "product_name": "DALE VIDA A TU JARDIN", "brand": "🌷🌻​🌼​", "reference": "", "unit": "", "price_amount": 3178.51, "price_currency": "ARS", "price_symbol": "$", "price_text": "$3.178,51", "price_amount_filled": "3178.51", "price_is_imputed": "False", "price_imputation_source": "original", "price_amount_usd": "2.5327", "price_amount_usd_filled": "2.5327", "fx_rate_local_per_usd": "1255.0", "fx_source": "from_argentina_cambio_dolar", "information_text": "", "description_text": "Datos técnicos Descripción del producto ¡Suscribite a nuestro boletín! Recibí las ofertas y novedades en tu correo. Suscribirme Seguridad y confianza © Libertad 2023. Todos los derechos reservados. Términos y Condiciones Direcciôn General de Defensa y protecciôn al Consumidor, para consultas y/o denuncias ingresa a los Términos más buscados 1. leche 2. cerveza 3. aceptada 4. yerba 5. cafe 6. pañales 7. queso 8. arroz 9. fideos 10. fernet", "features_text": "", "specifications_text": "", "benefits_text": "", "details_text": "", "other_sections": "", "sections": {"Descripción": ["Datos técnicos", "Descripción del producto", "¡Suscribite a nuestro newsletter!", "Recibí las ofertas y novedades en tu correo.", "Suscribirme", "Seguridad y confianza", "© Libertad 2023. Todos los derechos reservados.", "Términos y Condiciones", "Dirección General de Defensa y Protección al Consumidor para consultas y/o denuncias", "introduzca aquí", "Términos más buscados", "1.", "leche", "2.", "cerveza", "3.", "aceite", "4.", "yerba", "5.", "cafe", "6.", "pañales", "7.", "queso", "8.", "arroz", "9.", "fideos", "10.", "fernet"]}, "txt_path": "dataset/txt_limpios/601.txt", "html_path": "dataset/paginas_descargadas/601.html", "es_status": "ET", "category_canonical": "cafe", "decision": "keep", "match_score": 0.6, "reasons": "heuristic_default"}
{"source_id": "602", "title": "DALE VIDA A TU JARDIN", "description": "", "breadcrumbs": "🌷🌻​🌼​", "price_raw": "", "currency_raw": "ARS", "url": "", "seller": "Desconocido", "availability": "unknown", "country": "AR", "product_name": "DALE VIDA A TU JARDIN", "brand": "🌷🌻​🌼​", "reference": "", "unit": "", "price_amount": null, "price_currency": "ARS", "price_symbol": "", "price_text": "", "price_amount_filled": "1663.58", "price_is_imputed": "True", "price_imputation_source": "country_mean", "price_amount_usd": "", "price_amount_usd_filled": "1.3256", "fx_rate_local_per_usd": "1255.0", "fx_source": "from_argentina_cambio_dolar", "information_text": "", "description_text": "", "features_text": "", "specifications_text": "", "benefits_text": "", "details_text": "", "other_sections": "", "sections": {}, "txt_path": "dataset/txt_limpios/602.txt", "html_path": "dataset/paginas_descargadas/602.html", "es_status": "EN", "category_canonical": "sin_categoria", "decision": "discard", "match_score": 0.3, "reasons": "no_category_detected;price_parse_failed"}
