source_id,title,description,breadcrumbs,price_raw,currency_raw,url,seller,availability,country,product_name,brand,reference,unit,price_amount,price_currency,price_symbol,price_text,price_amount_filled,price_is_imputed,price_imputation_source,price_amount_usd,price_amount_usd_filled,fx_rate_local_per_usd,fx_source,information_text,description_text,features_text,specifications_text,benefits_text,details_text,other_sections,sections,txt_path,html_path,es_status,category_canonical,decision,match_score,reasons
1290,Valoramos tu privacidad,"incap_ses_* sesión opt_out gdpr Caducada _GRECAPTCHA 6 meses Un CAPTCHA te ayuda a protegerte del spam y del descifrado de contraseñas pidiéndote que completes una simple prueba que demuestre que eres humano y no un ordenador que intenta acceder a una cuenta protegida con contraseña. __cf_bm 1 hora rc::a Nunca caduca rc::c rc::f rc::b Funcionales SnapABugRef 2 horas SnapABugHistory SnapABugUserAlias SnapABugVisit Analíticas ___utmvc Menos de un minuto _gcl_au 3 meses _ga 1 año 1 mes 4 días _gid 1 día _gat_UA-* 1 minuto _ga_* uid 1 año 24 días _hjSessionUser_* _hjSession_* _fbp demdex _hjTLDTest Rendimiento Anuncio 15 minutos personalization_id muc_ads cto_bundle IDE uuid2 anj CMID CMPS CMPRO dpm mv_tokens 14 días 1 minuto cf Used to present the visitor with relevant content advertisement. cip Presents the user with relevant content and advertisements, and facilitates real-time bidding for advertisers. cnac car callback criteo_write_test YSC VISITOR_INFO1_LIVE VISITOR_PRIVACY_METADATA _ttp ab Nezaradené do kategórie ck_flagpv Description is currently not available. visitor-id No description available. data-c-ts 1 mes data-c mv_tokens_eu-v1 am_tokens am_tokens_eu-v1 criteo tvid tv_UICR optout cto_tld_test XANDR_PANID gpp ttcsid_CU8M57RC77U66G5CN100 ttcsid __Secure-ROLLOUT_TOKEN Guardar mis preferencias Powered by Este gato no debería estar en esta caja, ni tú en esta página Puede que haya expirado. Intenta la búsqueda con otras palabras o tal vez puedas encontrarla desde el homepage. Live Chat",Personalizar,,,,Desconocido,unknown,UNKNOWN,Valoramos tu privacidad,Personalizar,,,,,,,234.19,True,country_mean,,234.1938,1.0,default_1usd,,"incap_ses_* sesión opt_out gdpr Caducada _GRECAPTCHA 6 meses Un CAPTCHA te ayuda a protegerte del spam y del descifrado de contraseñas pidiéndote que completes una simple prueba que demuestre que eres humano y no un ordenador que intenta acceder a una cuenta protegida con contraseña. __cf_bm 1 hora rc::a Nunca caduca rc::c rc::f rc::b Funcionales SnapABugRef 2 horas SnapABugHistory SnapABugUserAlias SnapABugVisit Analíticas ___utmvc Menos de un minuto _gcl_au 3 meses _ga 1 año 1 mes 4 días _gid 1 día _gat_UA-* 1 minuto _ga_* uid 1 año 24 días _hjSessionUser_* _hjSession_* _fbp demdex _hjTLDTest Rendimiento Anuncio 15 minutos personalization_id muc_ads cto_bundle IDE uuid2 anj CMID CMPS CMPRO dpm mv_tokens 14 días 1 minuto cf Used to present the visitor with relevant content advertisement. cip Presents the user with relevant content and advertisements, and facilitates real-time bidding for advertisers. cnac car callback criteo_write_test YSC VISITOR_INFO1_LIVE VISITOR_PRIVACY_METADATA _ttp ab Nezaradené do kategórie ck_flagpv Description is currently not available. visitor-id No description available. data-c-ts 1 mes data-c mv_tokens_eu-v1 am_tokens am_tokens_eu-v1 criteo tvid tv_UICR optout cto_tld_test XANDR_PANID gpp ttcsid_CU8M57RC77U66G5CN100 ttcsid __Secure-ROLLOUT_TOKEN Guardar mis preferencias Powered by Este gato no debería estar en esta caja, ni tú en esta página Puede que haya expirado. Intenta la búsqueda con otras palabras o tal vez puedas encontrarla desde el homepage. Live Chat",,,,,,"{""Descripción"": [""incap_ses_*"", ""sesión"", ""opt_out"", ""gdpr"", ""Caducada"", ""_GRECAPTCHA"", ""6 meses"", ""Un CAPTCHA te ayuda a protegerte del spam y del descifrado de contraseñas pidiéndote que completes una simple prueba que demuestre que eres humano y no un ordenador que intenta acceder a una cuenta protegida con contraseña."", ""__cf_bm"", ""1 hora"", ""rc::a"", ""Nunca caduca"", ""rc::c"", ""rc::f"", ""rc::b"", ""Funcionales"", ""SnapABugRef"", ""2 horas"", ""SnapABugHistory"", ""SnapABugUserAlias"", ""SnapABugVisit"", ""Analíticas"", ""___utmvc"", ""Menos de un minuto"", ""_gcl_au"", ""3 meses"", ""_ga"", ""1 año 1 mes 4 días"", ""_gid"", ""1 día"", ""_gat_UA-*"", ""1 minuto"", ""_ga_*"", ""uid"", ""1 año 24 días"", ""_hjSessionUser_*"", ""_hjSession_*"", ""_fbp"", ""demdex"", ""_hjTLDTest"", ""Rendimiento"", ""Anuncio"", ""15 minutos"", ""personalization_id"", ""muc_ads"", ""cto_bundle"", ""IDE"", ""uuid2"", ""anj"", ""CMID"", ""CMPS"", ""CMPRO"", ""dpm"", ""mv_tokens"", ""14 días 1 minuto"", ""cf"", ""Used to present the visitor with relevant content advertisement."", ""cip"", ""Presents the user with relevant content and advertisements, and facilitates real-time bidding for advertisers."", ""cnac"", ""car"", ""callback"", ""criteo_write_test"", ""YSC"", ""VISITOR_INFO1_LIVE"", ""VISITOR_PRIVACY_METADATA"", ""_ttp"", ""ab"", ""Nezaradené do kategórie"", ""ck_flagpv"", ""Description is currently not available."", ""visitor-id"", ""No description available."", ""data-c-ts"", ""1 mes"", ""data-c"", ""mv_tokens_eu-v1"", ""am_tokens"", ""am_tokens_eu-v1"", ""criteo"", ""tvid"", ""tv_UICR"", ""optout"", ""cto_tld_test"", ""XANDR_PANID"", ""gpp"", ""ttcsid_CU8M57RC77U66G5CN100"", ""ttcsid"", ""__Secure-ROLLOUT_TOKEN"", ""Guardar mis preferencias"", ""Powered by"", ""Este gato no debería estar en esta caja, ni tú en esta página"", ""Puede que haya expirado. Intenta la búsqueda con otras palabras o tal vez puedas encontrarla desde el homepage."", ""Live Chat""]}",dataset/txt_limpios/1290.txt,dataset/paginas_descargadas/1290.html,EN,sin_categoria,discard,0.30,no_category_detected;price_parse_failed
1291,Valoramos tu privacidad,"incap_ses_* sesión opt_out gdpr Caducada _GRECAPTCHA 6 meses Un CAPTCHA te ayuda a protegerte del spam y del descifrado de contraseñas pidiéndote que completes una simple prueba que demuestre que eres humano y no un ordenador que intenta acceder a una cuenta protegida con contraseña. __cf_bm 1 hora rc::a Nunca caduca rc::c rc::f rc::b Funcionales SnapABugRef 2 horas SnapABugHistory SnapABugUserAlias SnapABugVisit Analíticas ___utmvc Menos de un minuto _gcl_au 3 meses _ga 1 año 1 mes 4 días _gid 1 día _gat_UA-* 1 minuto _ga_* uid 1 año 24 días _hjSessionUser_* _hjSession_* _fbp demdex _hjTLDTest Rendimiento Anuncio 15 minutos personalization_id muc_ads cto_bundle IDE uuid2 anj CMID CMPS CMPRO dpm mv_tokens 14 días 1 minuto cf Used to present the visitor with relevant content advertisement. cip Presents the user with relevant content and advertisements, and facilitates real-time bidding for advertisers. cnac car callback criteo_write_test YSC VISITOR_INFO1_LIVE VISITOR_PRIVACY_METADATA _ttp ab Nezaradené do kategórie ck_flagpv Description is currently not available. visitor-id No description available. data-c-ts 1 mes data-c mv_tokens_eu-v1 am_tokens am_tokens_eu-v1 criteo tvid tv_UICR optout cto_tld_test XANDR_PANID gpp ttcsid_CU8M57RC77U66G5CN100 ttcsid __Secure-ROLLOUT_TOKEN Guardar mis preferencias Powered by X App Frecuento Descárgala Gratis Ver en App Panes y Derivados Pan Molde Blanco Dandy 450g Marca: Dandy Código - 40278028 Cantidad Pagar Realiza tus compras con seguridad Pan de molde blanco | Elaborado con Harina de trigo fortificada | 0% Grasas Trans y 0% Colesterol | Incluye 22 rebanadas | Contenido neto 450g",Personalizar > 450g,0.99,,,Desconocido,unknown,UNKNOWN,Valoramos tu privacidad,Personalizar,,450g,0.99,,$,$0.99,0.99,False,original,0.99,0.99,1.0,default_1usd,,"incap_ses_* sesión opt_out gdpr Caducada _GRECAPTCHA 6 meses Un CAPTCHA te ayuda a protegerte del spam y del descifrado de contraseñas pidiéndote que completes una simple prueba que demuestre que eres humano y no un ordenador que intenta acceder a una cuenta protegida con contraseña. __cf_bm 1 hora rc::a Nunca caduca rc::c rc::f rc::b Funcionales SnapABugRef 2 horas SnapABugHistory SnapABugUserAlias SnapABugVisit Analíticas ___utmvc Menos de un minuto _gcl_au 3 meses _ga 1 año 1 mes 4 días _gid 1 día _gat_UA-* 1 minuto _ga_* uid 1 año 24 días _hjSessionUser_* _hjSession_* _fbp demdex _hjTLDTest Rendimiento Anuncio 15 minutos personalization_id muc_ads cto_bundle IDE uuid2 anj CMID CMPS CMPRO dpm mv_tokens 14 días 1 minuto cf Used to present the visitor with relevant content advertisement. cip Presents the user with relevant content and advertisements, and facilitates real-time bidding for advertisers. cnac car callback criteo_write_test YSC VISITOR_INFO1_LIVE VISITOR_PRIVACY_METADATA _ttp ab Nezaradené do kategórie ck_flagpv Description is currently not available. visitor-id No description available. data-c-ts 1 mes data-c mv_tokens_eu-v1 am_tokens am_tokens_eu-v1 criteo tvid tv_UICR optout cto_tld_test XANDR_PANID gpp ttcsid_CU8M57RC77U66G5CN100 ttcsid __Secure-ROLLOUT_TOKEN Guardar mis preferencias Powered by X App Frecuento Descárgala Gratis Ver en App Panes y Derivados Pan Molde Blanco Dandy 450g Marca: Dandy Código - 40278028 Cantidad Pagar Realiza tus compras con seguridad",,,,Pan de molde blanco | Elaborado con Harina de trigo fortificada | 0% Grasas Trans y 0% Colesterol | Incluye 22 rebanadas | Contenido neto 450g,,"{""Descripción"": [""incap_ses_*"", ""sesión"", ""opt_out"", ""gdpr"", ""Caducada"", ""_GRECAPTCHA"", ""6 meses"", ""Un CAPTCHA te ayuda a protegerte del spam y del descifrado de contraseñas pidiéndote que completes una simple prueba que demuestre que eres humano y no un ordenador que intenta acceder a una cuenta protegida con contraseña."", ""__cf_bm"", ""1 hora"", ""rc::a"", ""Nunca caduca"", ""rc::c"", ""rc::f"", ""rc::b"", ""Funcionales"", ""SnapABugRef"", ""2 horas"", ""SnapABugHistory"", ""SnapABugUserAlias"", ""SnapABugVisit"", ""Analíticas"", ""___utmvc"", ""Menos de un minuto"", ""_gcl_au"", ""3 meses"", ""_ga"", ""1 año 1 mes 4 días"", ""_gid"", ""1 día"", ""_gat_UA-*"", ""1 minuto"", ""_ga_*"", ""uid"", ""1 año 24 días"", ""_hjSessionUser_*"", ""_hjSession_*"", ""_fbp"", ""demdex"", ""_hjTLDTest"", ""Rendimiento"", ""Anuncio"", ""15 minutos"", ""personalization_id"", ""muc_ads"", ""cto_bundle"", ""IDE"", ""uuid2"", ""anj"", ""CMID"", ""CMPS"", ""CMPRO"", ""dpm"", ""mv_tokens"", ""14 días 1 minuto"", ""cf"", ""Used to present the visitor with relevant content advertisement."", ""cip"", ""Presents the user with relevant content and advertisements, and facilitates real-time bidding for advertisers."", ""cnac"", ""car"", ""callback"", ""criteo_write_test"", ""YSC"", ""VISITOR_INFO1_LIVE"", ""VISITOR_PRIVACY_METADATA"", ""_ttp"", ""ab"", ""Nezaradené do kategórie"", ""ck_flagpv"", ""Description is currently not available."", ""visitor-id"", ""No description available."", ""data-c-ts"", ""1 mes"", ""data-c"", ""mv_tokens_eu-v1"", ""am_tokens"", ""am_tokens_eu-v1"", ""criteo"", ""tvid"", ""tv_UICR"", ""optout"", ""cto_tld_test"", ""XANDR_PANID"", ""gpp"", ""ttcsid_CU8M57RC77U66G5CN100"", ""ttcsid"", ""__Secure-ROLLOUT_TOKEN"", ""Guardar mis preferencias"", ""Powered by"", ""X"", ""App Frecuento"", ""Descárgala gratis"", ""Ver en App"", ""Panes y Derivados"", ""Pan Molde Blanco Dandy 450g"", ""Marca: Dandy"", ""Código - 40278028"", ""Cantidad"", ""Pagar"", ""Realiza tus compras"", ""con seguridad""], ""Detalles"": [""Pan de molde blanco"", ""Elaborado con Harina de trigo fortificada"", ""0% Grasas Trans y 0% Colesterol"", ""Incluye 22 rebanadas"", ""Contenido neto 450g""]}",dataset/txt_limpios/1291.txt,dataset/paginas_descargadas/1291.html,ET,pan,keep,0.60,heuristic_default
1292,Valoramos tu privacidad,"incap_ses_* sesión opt_out gdpr Caducada _GRECAPTCHA 6 meses Un CAPTCHA te ayuda a protegerte del spam y del descifrado de contraseñas pidiéndote que completes una simple prueba que demuestre que eres humano y no un ordenador que intenta acceder a una cuenta protegida con contraseña. __cf_bm 1 hora rc::a Nunca caduca rc::c rc::f rc::b Funcionales SnapABugRef 2 horas SnapABugHistory SnapABugUserAlias SnapABugVisit Analíticas ___utmvc Menos de un minuto _gcl_au 3 meses _ga 1 año 1 mes 4 días _gid 1 día _gat_UA-* 1 minuto _ga_* uid 1 año 24 días _hjSessionUser_* _hjSession_* _fbp demdex _hjTLDTest Rendimiento Anuncio 15 minutos personalization_id muc_ads cto_bundle IDE uuid2 anj CMID CMPS CMPRO dpm mv_tokens 14 días 1 minuto cf Used to present the visitor with relevant content advertisement. cip Presents the user with relevant content and advertisements, and facilitates real-time bidding for advertisers. cnac car callback criteo_write_test YSC VISITOR_INFO1_LIVE VISITOR_PRIVACY_METADATA _ttp ab Nezaradené do kategórie ck_flagpv Description is currently not available. visitor-id No description available. data-c-ts 1 mes data-c mv_tokens_eu-v1 am_tokens am_tokens_eu-v1 criteo tvid tv_UICR optout cto_tld_test XANDR_PANID gpp ttcsid_CU8M57RC77U66G5CN100 ttcsid __Secure-ROLLOUT_TOKEN Guardar mis preferencias Powered by X App Frecuento Descárgala Gratis Ver en App Panes y Derivados Pan Molde Supán Blanco 750g Marca: Supán Código - 40410822 Cantidad Pagar Realiza tus compras con seguridad Detalles del producto: Pan Molde Supan Blanco Pan blanco extra grande | Contiene: 30 rebanadas. | Libre de grasa trans. | Empaque biodegradable. | Contenido: 750g.",Personalizar > 750g,1.89,,,Desconocido,unknown,UNKNOWN,Valoramos tu privacidad,Personalizar,,750g,1.89,,$,$1.89,1.89,False,original,1.89,1.89,1.0,default_1usd,,"incap_ses_* sesión opt_out gdpr Caducada _GRECAPTCHA 6 meses Un CAPTCHA te ayuda a protegerte del spam y del descifrado de contraseñas pidiéndote que completes una simple prueba que demuestre que eres humano y no un ordenador que intenta acceder a una cuenta protegida con contraseña. __cf_bm 1 hora rc::a Nunca caduca rc::c rc::f rc::b Funcionales SnapABugRef 2 horas SnapABugHistory SnapABugUserAlias SnapABugVisit Analíticas ___utmvc Menos de un minuto _gcl_au 3 meses _ga 1 año 1 mes 4 días _gid 1 día _gat_UA-* 1 minuto _ga_* uid 1 año 24 días _hjSessionUser_* _hjSession_* _fbp demdex _hjTLDTest Rendimiento Anuncio 15 minutos personalization_id muc_ads cto_bundle IDE uuid2 anj CMID CMPS CMPRO dpm mv_tokens 14 días 1 minuto cf Used to present the visitor with relevant content advertisement. cip Presents the user with relevant content and advertisements, and facilitates real-time bidding for advertisers. cnac car callback criteo_write_test YSC VISITOR_INFO1_LIVE VISITOR_PRIVACY_METADATA _ttp ab Nezaradené do kategórie ck_flagpv Description is currently not available. visitor-id No description available. data-c-ts 1 mes data-c mv_tokens_eu-v1 am_tokens am_tokens_eu-v1 criteo tvid tv_UICR optout cto_tld_test XANDR_PANID gpp ttcsid_CU8M57RC77U66G5CN100 ttcsid __Secure-ROLLOUT_TOKEN Guardar mis preferencias Powered by X App Frecuento Descárgala Gratis Ver en App Panes y Derivados Pan Molde Supán Blanco 750g Marca: Supán Código - 40410822 Cantidad Pagar Realiza tus compras con seguridad Detalles del producto: Pan Molde Supan Blanco",,,,Pan blanco extra grande | Contiene: 30 rebanadas. | Libre de grasa trans. | Empaque biodegradable. | Contenido: 750g.,,"{""Descripción"": [""incap_ses_*"", ""sesión"", ""opt_out"", ""gdpr"", ""Caducada"", ""_GRECAPTCHA"", ""6 meses"", ""Un CAPTCHA te ayuda a protegerte del spam y del descifrado de contraseñas pidiéndote que completes una simple prueba que demuestre que eres humano y no un ordenador que intenta acceder a una cuenta protegida con contraseña."", ""__cf_bm"", ""1 hora"", ""rc::a"", ""Nunca caduca"", ""rc::c"", ""rc::f"", ""rc::b"", ""Funcionales"", ""SnapABugRef"", ""2 horas"", ""SnapABugHistory"", ""SnapABugUserAlias"", ""SnapABugVisit"", ""Analíticas"", ""___utmvc"", ""Menos de un minuto"", ""_gcl_au"", ""3 meses"", ""_ga"", ""1 año 1 mes 4 días"", ""_gid"", ""1 día"", ""_gat_UA-*"", ""1 minuto"", ""_ga_*"", ""uid"", ""1 año 24 días"", ""_hjSessionUser_*"", ""_hjSession_*"", ""_fbp"", ""demdex"", ""_hjTLDTest"", ""Rendimiento"", ""Anuncio"", ""15 minutos"", ""personalization_id"", ""muc_ads"", ""cto_bundle"", ""IDE"", ""uuid2"", ""anj"", ""CMID"", ""CMPS"", ""CMPRO"", ""dpm"", ""mv_tokens"", ""14 días 1 minuto"", ""cf"", ""Used to present the visitor with relevant content advertisement."", ""cip"", ""Presents the user with relevant content and advertisements, and facilitates real-time bidding for advertisers."", ""cnac"", ""car"", ""callback"", ""criteo_write_test"", ""YSC"", ""VISITOR_INFO1_LIVE"", ""VISITOR_PRIVACY_METADATA"", ""_ttp"", ""ab"", ""Nezaradené do kategórie"", ""ck_flagpv"", ""Description is currently not available."", ""visitor-id"", ""No description available."", ""data-c-ts"", ""1 mes"", ""data-c"", ""mv_tokens_eu-v1"", ""am_tokens"", ""am_tokens_eu-v1"", ""criteo"", ""tvid"", ""tv_UICR"", ""optout"", ""cto_tld_test"", ""XANDR_PANID"", ""gpp"", ""ttcsid_CU8M57RC77U66G5CN100"", ""ttcsid"", ""__Secure-ROLLOUT_TOKEN"", ""Guardar mis preferencias"", ""Powered by"", ""X"", ""App Frecuento"", ""Descárgala gratis"", ""Ver en App"", ""Panes y Derivados"", ""Pan Molde Supán Blanco 750g"", ""Marca: Supán"", ""Código - 40410822"", ""Cantidad"", ""Pagar"", ""Realiza tus compras"", ""con seguridad"", ""Detalles del producto: Pan Molde Supan Blanco""], ""Detalles"": [""Pan blanco extra grande"", ""Contiene: 30 rebanadas."", ""Libre de grasa trans."", ""Empaque biodegradable."", ""Contenido: 750g.""]}",dataset/txt_limpios/1292.txt,dataset/paginas_descargadas/1292.html,ET,pan,keep,0.60,heuristic_default
