source_id,title,description,breadcrumbs,price_raw,currency_raw,url,seller,availability,country,product_name,brand,reference,unit,price_amount,price_currency,price_symbol,price_text,price_amount_filled,price_is_imputed,price_imputation_source,price_amount_usd,price_amount_usd_filled,fx_rate_local_per_usd,fx_source,information_text,description_text,features_text,specifications_text,benefits_text,details_text,other_sections,sections,txt_path,html_path,es_status,category_canonical,decision,match_score,reasons
1086,¡Aún no eres Wong Prime!,Comentarios | Especificaciones técnicas | Propiedad | Especificación | Ver condiciones de promociones | Podrían interesarte | Panela Orgánica Cuisine & Co 1kg | 14 | 60 | true | Azúcar rubia light Onza Con Stevia Doy Pack 500 g | 7 | 30 | Panela Orgánica Granulada Panela de Piura Frasco 200 g | 23 | 90 | Azúcar de Coco Orgánico Coco-Sugar Doypack 454 g | Azúcar Rubia Con Stevia Cuisine&Co Doypack 500 g | ? | ! | i | × | Sí Acepto | Recuerda escribir al menos 3 letras en el cuadro de búsqueda | Términos más buscados | 1. | elvive liso | 2. | ariel liquido | 3. | limpiador inodoro harpic | 4. | busca | 5. | secret clinical | Marcas sugeridas,Aprovecha el > 1kg > 902154,79.9,PEN,,Desconocido,unknown,PE,¡Aún no eres Wong Prime!,Aprovecha el,902154.0,1kg,79.90,PEN,S/,S/79.90,79.9,False,original,22.507,22.507,3.55,from_peru_cambio_dolar,,,,Comentarios | Especificaciones técnicas | Propiedad | Especificación | Ver condiciones de promociones | Podrían interesarte | Panela Orgánica Cuisine & Co 1kg | 14 | 60 | true | Azúcar rubia light Onza Con Stevia Doy Pack 500 g | 7 | 30 | Panela Orgánica Granulada Panela de Piura Frasco 200 g | 23 | 90 | Azúcar de Coco Orgánico Coco-Sugar Doypack 454 g | Azúcar Rubia Con Stevia Cuisine&Co Doypack 500 g | ? | ! | i | × | Sí Acepto | Recuerda escribir al menos 3 letras en el cuadro de búsqueda | Términos más buscados | 1. | elvive liso | 2. | ariel liquido | 3. | limpiador inodoro harpic | 4. | busca | 5. | secret clinical | Marcas sugeridas,,,,"{""Especificaciones"": [""Comentarios"", ""Especificaciones técnicas"", ""Propiedad"", ""Especificación"", ""Ver condiciones de promociones"", ""Podrían interesarte"", ""Panela Orgánica Cuisine & Co 1kg"", ""14"", ""60"", ""true"", ""Azúcar rubia light Onza Con Stevia Doy Pack 500 g"", ""7"", ""30"", ""Panela Orgánica Granulada Panela de Piura Frasco 200 g"", ""23"", ""90"", ""Azúcar de Coco Orgánico Coco-Sugar Doypack 454 g"", ""Azúcar Rubia Con Stevia Cuisine&Co Doypack 500 g"", ""?"", ""!"", ""i"", ""×"", ""Sí Acepto"", ""Recuerda escribir al menos 3 letras en el cuadro de búsqueda"", ""Términos más buscados"", ""1."", ""elvive liso"", ""2."", ""ariel liquido"", ""3."", ""limpiador inodoro harpic"", ""4."", ""busca"", ""5."", ""secret clinical"", ""Marcas sugeridas""]}",dataset/txt_limpios/1086.txt,dataset/paginas_descargadas/1086.html,EN,azucar,keep,0.60,heuristic_default
1088,¡Aún no eres Wong Prime!,"Información Nutricional Comentarios | Especificaciones técnicas | Propiedad | Especificación | Ingredientes | Harina de trigo, Hierro, Tiamina, Riboflavina, Niacina, ácido fólico, Levadura, Azúcar, Gluten de trigo, Grasa vegetal, Sal, Sustancia conservadora sin 282, Sustancia conservadora sin 200, Sustancia conservadora sin 202, Emulsionante sin 471, Emulsionante sin 472e, Regulador de acidez sin 270, Vitamina d, Agente de tratamiento de las harinas sin 300, Fibra de trigo, Gluten, Soya | Puede contener | Trazas de | Leche, Derivados de leche | Ver condiciones de promociones | ? | ! | i | × | Sí Acepto | Recuerda escribir al menos 3 letras en el cuadro de búsqueda | Términos más buscados | 1. | elvive liso | 2. | ariel liquido | 3. | limpiador inodoro harpic | 4. | busca | 5. | secret clinical | Marcas sugeridas",Aprovecha el > 770g > 1033017,79.9,PEN,,Desconocido,unknown,PE,¡Aún no eres Wong Prime!,Aprovecha el,1033017.0,770g,79.90,PEN,S/,S/79.90,79.9,False,original,22.507,22.507,3.55,from_peru_cambio_dolar,,Información Nutricional,,"Comentarios | Especificaciones técnicas | Propiedad | Especificación | Ingredientes | Harina de trigo, Hierro, Tiamina, Riboflavina, Niacina, ácido fólico, Levadura, Azúcar, Gluten de trigo, Grasa vegetal, Sal, Sustancia conservadora sin 282, Sustancia conservadora sin 200, Sustancia conservadora sin 202, Emulsionante sin 471, Emulsionante sin 472e, Regulador de acidez sin 270, Vitamina d, Agente de tratamiento de las harinas sin 300, Fibra de trigo, Gluten, Soya | Puede contener | Trazas de | Leche, Derivados de leche | Ver condiciones de promociones | ? | ! | i | × | Sí Acepto | Recuerda escribir al menos 3 letras en el cuadro de búsqueda | Términos más buscados | 1. | elvive liso | 2. | ariel liquido | 3. | limpiador inodoro harpic | 4. | busca | 5. | secret clinical | Marcas sugeridas",,,,"{""Descripción"": [""Información Nutricional""], ""Especificaciones"": [""Comentarios"", ""Especificaciones técnicas"", ""Propiedad"", ""Especificación"", ""Ingredientes"", ""Harina de trigo, Hierro, Tiamina, Riboflavina, Niacina, ácido fólico, Levadura, Azúcar, Gluten de trigo, Grasa vegetal, Sal, Sustancia conservadora sin 282, Sustancia conservadora sin 200, Sustancia conservadora sin 202, Emulsionante sin 471, Emulsionante sin 472e, Regulador de acidez sin 270, Vitamina d, Agente de tratamiento de las harinas sin 300, Fibra de trigo, Gluten, Soya"", ""Puede contener"", ""Trazas de"", ""Leche, Derivados de leche"", ""Ver condiciones de promociones"", ""?"", ""!"", ""i"", ""×"", ""Sí Acepto"", ""Recuerda escribir al menos 3 letras en el cuadro de búsqueda"", ""Términos más buscados"", ""1."", ""elvive liso"", ""2."", ""ariel liquido"", ""3."", ""limpiador inodoro harpic"", ""4."", ""busca"", ""5."", ""secret clinical"", ""Marcas sugeridas""]}",dataset/txt_limpios/1088.txt,dataset/paginas_descargadas/1088.html,EN,azucar,keep,0.60,heuristic_default
1089,¡Aún no eres Wong Prime!,"Información Nutricional Comentarios | Especificaciones técnicas | Propiedad | Especificación | Ingredientes | Harina de trigo fortificada, Hierro, Tiamina, Riboflavina, Niacina, ácido fólico, Semilla de linaza, Semilla de girasol, Semilla de chía, Levadura, Azúcar, Gluten de trigo, Avena en hojuelas 2%, Harina de trigo fermentada, Hierro, Tiamina, Riboflavina, Niacina, ácido fólico, Fibra de avena, Aceite vegetal, Sal, Regulador de acidez ácido láctico, Harina de cebada malteada y torrefactada, Suero de leche en polvo, Gluten, Leche, Soya | Ver condiciones de promociones | Podrían interesarte | 10% | Filete de Pechuga de Pollo x kg | Precio Online | 22 | x | kg | Precio regular | x kg | true | 8% | Papa Amarilla Tumbay Procesada x kg | 8 | 29 | 7% | Tomate Italiano x kg | 79 | 12% | Palta Fuerte Verde x kg | 49 | Zanahoria x kg | 5 | ? | ! | i | × | Sí Acepto | Recuerda escribir al menos 3 letras en el cuadro de búsqueda | Términos más buscados | 1. | elvive liso | 2. | ariel liquido | 3. | limpiador inodoro harpic | 4. | busca | 5. | secret clinical | Marcas sugeridas",Aprovecha el > 360 g > 930951,79.9,PEN,,Desconocido,unknown,PE,¡Aún no eres Wong Prime!,Aprovecha el,930951.0,360 g,79.90,PEN,S/,S/79.90,79.9,False,original,22.507,22.507,3.55,from_peru_cambio_dolar,,Información Nutricional,,"Comentarios | Especificaciones técnicas | Propiedad | Especificación | Ingredientes | Harina de trigo fortificada, Hierro, Tiamina, Riboflavina, Niacina, ácido fólico, Semilla de linaza, Semilla de girasol, Semilla de chía, Levadura, Azúcar, Gluten de trigo, Avena en hojuelas 2%, Harina de trigo fermentada, Hierro, Tiamina, Riboflavina, Niacina, ácido fólico, Fibra de avena, Aceite vegetal, Sal, Regulador de acidez ácido láctico, Harina de cebada malteada y torrefactada, Suero de leche en polvo, Gluten, Leche, Soya | Ver condiciones de promociones | Podrían interesarte | 10% | Filete de Pechuga de Pollo x kg | Precio Online | 22 | x | kg | Precio regular | x kg | true | 8% | Papa Amarilla Tumbay Procesada x kg | 8 | 29 | 7% | Tomate Italiano x kg | 79 | 12% | Palta Fuerte Verde x kg | 49 | Zanahoria x kg | 5 | ? | ! | i | × | Sí Acepto | Recuerda escribir al menos 3 letras en el cuadro de búsqueda | Términos más buscados | 1. | elvive liso | 2. | ariel liquido | 3. | limpiador inodoro harpic | 4. | busca | 5. | secret clinical | Marcas sugeridas",,,,"{""Descripción"": [""Información Nutricional""], ""Especificaciones"": [""Comentarios"", ""Especificaciones técnicas"", ""Propiedad"", ""Especificación"", ""Ingredientes"", ""Harina de trigo fortificada, Hierro, Tiamina, Riboflavina, Niacina, ácido fólico, Semilla de linaza, Semilla de girasol, Semilla de chía, Levadura, Azúcar, Gluten de trigo, Avena en hojuelas 2%, Harina de trigo fermentada, Hierro, Tiamina, Riboflavina, Niacina, ácido fólico, Fibra de avena, Aceite vegetal, Sal, Regulador de acidez ácido láctico, Harina de cebada malteada y torrefactada, Suero de leche en polvo, Gluten, Leche, Soya"", ""Ver condiciones de promociones"", ""Podrían interesarte"", ""10%"", ""Filete de Pechuga de Pollo x kg"", ""Precio Online"", ""22"", ""x"", ""kg"", ""Precio regular"", ""x kg"", ""true"", ""8%"", ""Papa Amarilla Tumbay Procesada x kg"", ""8"", ""29"", ""7%"", ""Tomate Italiano x kg"", ""79"", ""12%"", ""Palta Fuerte Verde x kg"", ""49"", ""Zanahoria x kg"", ""5"", ""?"", ""!"", ""i"", ""×"", ""Sí Acepto"", ""Recuerda escribir al menos 3 letras en el cuadro de búsqueda"", ""Términos más buscados"", ""1."", ""elvive liso"", ""2."", ""ariel liquido"", ""3."", ""limpiador inodoro harpic"", ""4."", ""busca"", ""5."", ""secret clinical"", ""Marcas sugeridas""]}",dataset/txt_limpios/1089.txt,dataset/paginas_descargadas/1089.html,EN,leche,keep,0.60,heuristic_default
1090,¡Aún no eres Wong Prime!,"Comentarios | Especificaciones técnicas | Propiedad | Especificación | Ingredientes | Harina de trigo fortificada, Hierro, Tiamina, Riboflavina, Niacina, ácido fólico, Huevo, Azúcar, Manteca vegetal de palma, Aceite vegetal refinado de palma, Agua, Sal, Regulador de acidez (sin 330), Colorante (sin 160 a(iii)), Leche fresca, Agua, Levadura, Emulsionante (sin 471), Sal, Agente de tratamiento de las harinas (sin 300), Agente de tratamiento de las harinas (sin 1100), Saborizante (sin 150 d), Ajonjolí, Sustancia conservadora (sin 282), Sustancia conservadora (sin 211), Gluten (trigo), Leche | Puede contener | Trazas de | Nueces | Ver condiciones de promociones | Podrían interesarte | ? | ! | i | × | Sí Acepto | Recuerda escribir al menos 3 letras en el cuadro de búsqueda | Términos más buscados | 1. | elvive liso | 2. | ariel liquido | 3. | limpiador inodoro harpic | 4. | busca | 5. | secret clinical | Marcas sugeridas",Aprovecha el > 300g > 926991,79.9,PEN,,Desconocido,unknown,PE,¡Aún no eres Wong Prime!,Aprovecha el,926991.0,300g,79.90,PEN,S/,S/79.90,79.9,False,original,22.507,22.507,3.55,from_peru_cambio_dolar,,,,"Comentarios | Especificaciones técnicas | Propiedad | Especificación | Ingredientes | Harina de trigo fortificada, Hierro, Tiamina, Riboflavina, Niacina, ácido fólico, Huevo, Azúcar, Manteca vegetal de palma, Aceite vegetal refinado de palma, Agua, Sal, Regulador de acidez (sin 330), Colorante (sin 160 a(iii)), Leche fresca, Agua, Levadura, Emulsionante (sin 471), Sal, Agente de tratamiento de las harinas (sin 300), Agente de tratamiento de las harinas (sin 1100), Saborizante (sin 150 d), Ajonjolí, Sustancia conservadora (sin 282), Sustancia conservadora (sin 211), Gluten (trigo), Leche | Puede contener | Trazas de | Nueces | Ver condiciones de promociones | Podrían interesarte | ? | ! | i | × | Sí Acepto | Recuerda escribir al menos 3 letras en el cuadro de búsqueda | Términos más buscados | 1. | elvive liso | 2. | ariel liquido | 3. | limpiador inodoro harpic | 4. | busca | 5. | secret clinical | Marcas sugeridas",,,,"{""Especificaciones"": [""Comentarios"", ""Especificaciones técnicas"", ""Propiedad"", ""Especificación"", ""Ingredientes"", ""Harina de trigo fortificada, Hierro, Tiamina, Riboflavina, Niacina, ácido fólico, Huevo, Azúcar, Manteca vegetal de palma, Aceite vegetal refinado de palma, Agua, Sal, Regulador de acidez (sin 330), Colorante (sin 160 a(iii)), Leche fresca, Agua, Levadura, Emulsionante (sin 471), Sal, Agente de tratamiento de las harinas (sin 300), Agente de tratamiento de las harinas (sin 1100), Saborizante (sin 150 d), Ajonjolí, Sustancia conservadora (sin 282), Sustancia conservadora (sin 211), Gluten (trigo), Leche"", ""Puede contener"", ""Trazas de"", ""Nueces"", ""Ver condiciones de promociones"", ""Podrían interesarte"", ""?"", ""!"", ""i"", ""×"", ""Sí Acepto"", ""Recuerda escribir al menos 3 letras en el cuadro de búsqueda"", ""Términos más buscados"", ""1."", ""elvive liso"", ""2."", ""ariel liquido"", ""3."", ""limpiador inodoro harpic"", ""4."", ""busca"", ""5."", ""secret clinical"", ""Marcas sugeridas""]}",dataset/txt_limpios/1090.txt,dataset/paginas_descargadas/1090.html,EN,azucar,keep,0.60,heuristic_default
1091,¡Aún no eres Wong Prime!,,Aprovecha el > 400g > 1026507,79.9,PEN,,Desconocido,unknown,PE,¡Aún no eres Wong Prime!,Aprovecha el,1026507.0,400g,79.90,PEN,S/,S/79.90,79.9,False,original,22.507,22.507,3.55,from_peru_cambio_dolar,,,,,,,,{},dataset/txt_limpios/1091.txt,dataset/paginas_descargadas/1091.html,EN,sin_categoria,discard,0.30,no_category_detected
1092,¡Aún no eres Wong Prime!,Comentarios | Especificaciones técnicas | Propiedad | Especificación | Ver condiciones de promociones | Podrían interesarte | Pan de Molde Blanco Bimbo Cero Cero 530g | 12 | true | Pan para Hamburguesa Sin Gluten Molinos del Mundo Bolsa 300 g | 16 | Pan Pita Linaza Bimbo Bolsa 10 unid | 7 | 70 | Pan de Molde Don Mamino Pullman Corte Horizontal Bolsa 560 g | Pan de Molde Blanco Cuisine & Co Bolsa 500 gr | ? | ! | i | × | Sí Acepto | Recuerda escribir al menos 3 letras en el cuadro de búsqueda | Términos más buscados | 1. | elvive liso | 2. | ariel liquido | 3. | limpiador inodoro harpic | 4. | busca | 5. | secret clinical | Marcas sugeridas,Aprovecha el > 560 g > 286017,79.9,PEN,,Desconocido,unknown,PE,¡Aún no eres Wong Prime!,Aprovecha el,286017.0,560 g,79.90,PEN,S/,S/79.90,79.9,False,original,22.507,22.507,3.55,from_peru_cambio_dolar,,,,Comentarios | Especificaciones técnicas | Propiedad | Especificación | Ver condiciones de promociones | Podrían interesarte | Pan de Molde Blanco Bimbo Cero Cero 530g | 12 | true | Pan para Hamburguesa Sin Gluten Molinos del Mundo Bolsa 300 g | 16 | Pan Pita Linaza Bimbo Bolsa 10 unid | 7 | 70 | Pan de Molde Don Mamino Pullman Corte Horizontal Bolsa 560 g | Pan de Molde Blanco Cuisine & Co Bolsa 500 gr | ? | ! | i | × | Sí Acepto | Recuerda escribir al menos 3 letras en el cuadro de búsqueda | Términos más buscados | 1. | elvive liso | 2. | ariel liquido | 3. | limpiador inodoro harpic | 4. | busca | 5. | secret clinical | Marcas sugeridas,,,,"{""Especificaciones"": [""Comentarios"", ""Especificaciones técnicas"", ""Propiedad"", ""Especificación"", ""Ver condiciones de promociones"", ""Podrían interesarte"", ""Pan de Molde Blanco Bimbo Cero Cero 530g"", ""12"", ""true"", ""Pan para Hamburguesa Sin Gluten Molinos del Mundo Bolsa 300 g"", ""16"", ""Pan Pita Linaza Bimbo Bolsa 10 unid"", ""7"", ""70"", ""Pan de Molde Don Mamino Pullman Corte Horizontal Bolsa 560 g"", ""Pan de Molde Blanco Cuisine & Co Bolsa 500 gr"", ""?"", ""!"", ""i"", ""×"", ""Sí Acepto"", ""Recuerda escribir al menos 3 letras en el cuadro de búsqueda"", ""Términos más buscados"", ""1."", ""elvive liso"", ""2."", ""ariel liquido"", ""3."", ""limpiador inodoro harpic"", ""4."", ""busca"", ""5."", ""secret clinical"", ""Marcas sugeridas""]}",dataset/txt_limpios/1092.txt,dataset/paginas_descargadas/1092.html,EN,pan,keep,0.60,heuristic_default
1093,¡Aún no eres Wong Prime!,"Información Nutricional Comentarios | Especificaciones técnicas | Propiedad | Especificación | Ingredientes | Sémola de trigo seleccionada, Hierro, Niacina, Tiamina, Riboflavina, ácido fólico, Harina de trigo seleccionado, Hierro, Niacina, Tiamina, Riboflavina, ácido fólico, Colorante betacarotenos vegetales, Gluten | Puede contener | Trazas de | Huevo | Ver condiciones de promociones | ? | ! | i | × | Sí Acepto | Recuerda escribir al menos 3 letras en el cuadro de búsqueda | Términos más buscados | 1. | elvive liso | 2. | ariel liquido | 3. | limpiador inodoro harpic | 4. | busca | 5. | secret clinical | Marcas sugeridas",Aprovecha el > 950g > 962240,79.9,PEN,,Desconocido,unknown,PE,¡Aún no eres Wong Prime!,Aprovecha el,962240.0,950g,79.90,PEN,S/,S/79.90,79.9,False,original,22.507,22.507,3.55,from_peru_cambio_dolar,,Información Nutricional,,"Comentarios | Especificaciones técnicas | Propiedad | Especificación | Ingredientes | Sémola de trigo seleccionada, Hierro, Niacina, Tiamina, Riboflavina, ácido fólico, Harina de trigo seleccionado, Hierro, Niacina, Tiamina, Riboflavina, ácido fólico, Colorante betacarotenos vegetales, Gluten | Puede contener | Trazas de | Huevo | Ver condiciones de promociones | ? | ! | i | × | Sí Acepto | Recuerda escribir al menos 3 letras en el cuadro de búsqueda | Términos más buscados | 1. | elvive liso | 2. | ariel liquido | 3. | limpiador inodoro harpic | 4. | busca | 5. | secret clinical | Marcas sugeridas",,,,"{""Descripción"": [""Información Nutricional""], ""Especificaciones"": [""Comentarios"", ""Especificaciones técnicas"", ""Propiedad"", ""Especificación"", ""Ingredientes"", ""Sémola de trigo seleccionada, Hierro, Niacina, Tiamina, Riboflavina, ácido fólico, Harina de trigo seleccionado, Hierro, Niacina, Tiamina, Riboflavina, ácido fólico, Colorante betacarotenos vegetales, Gluten"", ""Puede contener"", ""Trazas de"", ""Huevo"", ""Ver condiciones de promociones"", ""?"", ""!"", ""i"", ""×"", ""Sí Acepto"", ""Recuerda escribir al menos 3 letras en el cuadro de búsqueda"", ""Términos más buscados"", ""1."", ""elvive liso"", ""2."", ""ariel liquido"", ""3."", ""limpiador inodoro harpic"", ""4."", ""busca"", ""5."", ""secret clinical"", ""Marcas sugeridas""]}",dataset/txt_limpios/1093.txt,dataset/paginas_descargadas/1093.html,EN,huevo,discard,0.30,heuristic_default
1094,¡Aún no eres Wong Prime!,"Información Nutricional Comentarios | Especificaciones técnicas | Propiedad | Especificación | Ingredientes | Harina de arroz integral 34.5%, Harina de maíz amarillo 30%, Harina de maíz blanco 15%, Harina de arroz blanco, Tapioca, Harina de quinoa 3%, Emu (ins 471) 0.5% mono y diglicéridos de ácidos grasos | Ver condiciones de promociones | Podrían interesarte | 18 | true | Pasta Fetuccini Sin Gluten Molinos del Mundo Bolsa 400 g | 24 | Fideo Fusilli Tricolore De Cecco 500 g | 30 | Gnocchi de Papa Granoro Bolsa 500 g | 10 | SODIO | Fideos a Base de Huevo Jin Jue Shi 410g | 14 | 50 | ? | ! | i | × | Sí Acepto | Recuerda escribir al menos 3 letras en el cuadro de búsqueda | Términos más buscados | 1. | elvive liso | 2. | ariel liquido | 3. | limpiador inodoro harpic | 4. | busca | 5. | secret clinical | Marcas sugeridas",Aprovecha el > 400 g > 712505,79.9,PEN,,Desconocido,unknown,PE,¡Aún no eres Wong Prime!,Aprovecha el,712505.0,400 g,79.90,PEN,S/,S/79.90,79.9,False,original,22.507,22.507,3.55,from_peru_cambio_dolar,,Información Nutricional,,"Comentarios | Especificaciones técnicas | Propiedad | Especificación | Ingredientes | Harina de arroz integral 34.5%, Harina de maíz amarillo 30%, Harina de maíz blanco 15%, Harina de arroz blanco, Tapioca, Harina de quinoa 3%, Emu (ins 471) 0.5% mono y diglicéridos de ácidos grasos | Ver condiciones de promociones | Podrían interesarte | 18 | true | Pasta Fetuccini Sin Gluten Molinos del Mundo Bolsa 400 g | 24 | Fideo Fusilli Tricolore De Cecco 500 g | 30 | Gnocchi de Papa Granoro Bolsa 500 g | 10 | SODIO | Fideos a Base de Huevo Jin Jue Shi 410g | 14 | 50 | ? | ! | i | × | Sí Acepto | Recuerda escribir al menos 3 letras en el cuadro de búsqueda | Términos más buscados | 1. | elvive liso | 2. | ariel liquido | 3. | limpiador inodoro harpic | 4. | busca | 5. | secret clinical | Marcas sugeridas",,,,"{""Descripción"": [""Información Nutricional""], ""Especificaciones"": [""Comentarios"", ""Especificaciones técnicas"", ""Propiedad"", ""Especificación"", ""Ingredientes"", ""Harina de arroz integral 34.5%, Harina de maíz amarillo 30%, Harina de maíz blanco 15%, Harina de arroz blanco, Tapioca, Harina de quinoa 3%, Emu (ins 471) 0.5% mono y diglicéridos de ácidos grasos"", ""Ver condiciones de promociones"", ""Podrían interesarte"", ""18"", ""true"", ""Pasta Fetuccini Sin Gluten Molinos del Mundo Bolsa 400 g"", ""24"", ""Fideo Fusilli Tricolore De Cecco 500 g"", ""30"", ""Gnocchi de Papa Granoro Bolsa 500 g"", ""10"", ""SODIO"", ""Fideos a Base de Huevo Jin Jue Shi 410g"", ""14"", ""50"", ""?"", ""!"", ""i"", ""×"", ""Sí Acepto"", ""Recuerda escribir al menos 3 letras en el cuadro de búsqueda"", ""Términos más buscados"", ""1."", ""elvive liso"", ""2."", ""ariel liquido"", ""3."", ""limpiador inodoro harpic"", ""4."", ""busca"", ""5."", ""secret clinical"", ""Marcas sugeridas""]}",dataset/txt_limpios/1094.txt,dataset/paginas_descargadas/1094.html,EN,huevo,discard,0.30,heuristic_default
