source_id,title,description,breadcrumbs,price_raw,currency_raw,url,seller,availability,country,product_name,brand,reference,unit,price_amount,price_currency,price_symbol,price_text,price_amount_filled,price_is_imputed,price_imputation_source,price_amount_usd,price_amount_usd_filled,fx_rate_local_per_usd,fx_source,information_text,description_text,features_text,specifications_text,benefits_text,details_text,other_sections,sections,txt_path,html_path,es_status,category_canonical,decision,match_score,reasons
1020,colaborar con nuestros estudios para marketing. También puede configurarlas.,Información de la marca,que podemos ofrecer. > 1L,16.92,PEN,,Desconocido,unknown,PE,colaborar con nuestros estudios para marketing. También puede configurarlas.,que podemos ofrecer.,,1L,16.92,PEN,S/,S/16.92,16.92,False,original,4.7662,4.7662,3.55,from_peru_cambio_dolar,,Información de la marca,"Presentación/Empaque | Botella | Porción sugerida | 100 ml | Alérgenos Declarados | NO | Azúcares Porción | 0 g | Calorías Porción | 828 Kcal/ 3404 KJ | Carbohidratos Porción | Grasas Porción | 92 G | Proteínas Porción | Sodio Porción | Sodio Porción | 0 mg | Composición/Origen | Aceites comestibles de girasol y aceite de oliva vírgenes extra ( España) | Grado | n/a | % De Acidez | 0,30 | Advertencias De Almacenamiento | mantener en un lugar seco y alejado de la luz | Contenido Neto | 1 L | Advertencias de consumo | Ninguna | Revisa todo | Componentes del Producto | Vendido por | plaza Vea | En caso de que algo te guste: Puedes revisar nuestras | Políticas de cambios y/o devoluciones | y hacerlas efectivas en todas nuestras tiendas. | Productos | que te pueden interesar | Recomendado para ti",,,,,"{""Descripción"": [""Información de la marca""], ""Características"": [""Presentación/Empaque"", ""Botella"", ""Porción sugerida"", ""100 ml"", ""Alérgenos Declarados"", ""NO"", ""Azúcar por porción"", ""0 g"", ""Calorías Porción"", ""828 Kcal / 3404 KJ"", ""Carbohidratos Porción"", ""Grasas Porción"", ""92 G"", ""Proteínas Porción"", ""Sodio Porción"", ""0 mg"", ""Composición/Origen"", ""Aceites comestibles de girasol y aceite de oliva virgen extra ( España)"", ""Grado"", ""n/a"", ""% De Acidez"", ""0,30"", ""Advertencias De Almacenamiento"", ""mantener en un lugar seco y alejado de la luz"", ""Contenido Neto"", ""1 L"", ""Advertencias de consumo"", ""Ninguna"", ""Revisa todo"", ""Componentes del Producto"", ""Vendido por"", ""plazaVea"", ""En caso algo no vaya como gustes: Puedes revisar nuestras"", ""Politicas de cambios y/o devoluciones"", ""y hacerlas efectivas en todas nuestras tiendas."", ""Productos"", ""que te pueden interesar"", ""Recomendado para ti""]}",dataset/txt_limpios/1020.txt,dataset/paginas_descargadas/1020.html,ET,sin_categoria,discard,0.30,no_category_detected
1021,colaborar con nuestros estudios para marketing. También puede configurarlas.,Información de la marca,que podemos ofrecer. > 900ml,16.92,PEN,,Desconocido,unknown,PE,colaborar con nuestros estudios para marketing. También puede configurarlas.,que podemos ofrecer.,,900ml,16.92,PEN,S/,S/16.92,16.92,False,original,4.7662,4.7662,3.55,from_peru_cambio_dolar,,Información de la marca,"Presentación/Empaque | Botella | Porción sugerida | 14g | Azúcares Porción | 0g | Calorías Porción | 130kcal | Carbohidratos Porción | Descripción Nutricional | Grasas Porción | Proteínas Porción | Sodio Porción | 0mg | Composición/Origen | Aceite 100% vegetal | Advertencias De Almacenamiento | Consérvese en recipiente cerrado, en lugar fresco, seco y seguro | Contenido Neto | 900ml | Revisa todo | Componentes del Producto | Vendido por | plaza Ver | En caso de que algo te guste: Puedes revisar nuestras | Políticas de cambios y/o devoluciones | y hacerlas efectivas en todas nuestras tiendas. | Productos | que te pueden interesar | Recomendado para ti",,,,,"{""Descripción"": [""Información de la marca""], ""Características"": [""Presentación/Empaque"", ""Botella"", ""Porción sugerida"", ""14g"", ""Azúcar por porción"", ""0g"", ""Calorías Porción"", ""130kcal"", ""Carbohidratos Porción"", ""Descripción Nutricional"", ""Grasas Porción"", ""Proteínas Porción"", ""Sodio Porción"", ""0mg"", ""Composición/Origen"", ""Aceite 100% vegetal"", ""Advertencias De Almacenamiento"", ""Consérvese en un recipiente cerrado, en lugar fresco, seco y seguro"", ""Contenido Neto"", ""900ml"", ""Revisa todo"", ""Componentes del Producto"", ""Vendido por"", ""plazaVea"", ""En caso algo no vaya como gustes: Puedes revisar nuestras"", ""Politicas de cambios y/o devoluciones"", ""y hacerlas efectivas en todas nuestras tiendas."", ""Productos"", ""que te pueden interesar"", ""Recomendado para ti""]}",dataset/txt_limpios/1021.txt,dataset/paginas_descargadas/1021.html,ET,sin_categoria,discard,0.30,no_category_detected
1022,colaborar con nuestros estudios para marketing. También puede configurarlas.,Información de la marca,que podemos ofrecer. > 900ml,16.92,PEN,,Desconocido,unknown,PE,colaborar con nuestros estudios para marketing. También puede configurarlas.,que podemos ofrecer.,,900ml,16.92,PEN,S/,S/16.92,16.92,False,original,4.7662,4.7662,3.55,from_peru_cambio_dolar,,Información de la marca,"Presentación/Empaque | Botella | Porción sugerida | 13ml | Alérgenos Declarados | Contiene Soja. | Azúcares Porción | 0 | Calorías Porción | 108Kcal | Carbohidratos Porción | 0g | Descripción Nutricional | Exento de colesterol. Fuente de vitamina E. Exento de gluten. | Grasas Porción | 12g | Proteínas Porción | Sodio Porción | 0mg | Composición/Origen | Vegetal | % De Acidez | Advertencias de Almacenamiento | Almacenar en lugar fresco, seco y alejado de la luz solar directa. | Contenido Neto | 900ml | Denominación/Variedad | Advertencias de consumo | Fecha de vencimiento,fabricación y lote impresos en la botella. | Revisa todo | Importante destacar | Calorías por porción: 108Kcal | Composición: Vegetal | Contenido Neto: 900ml | Variedad: Vegetal | Presentación: Botella | Descripción del producto | plaza Vea | cuenta con una amplia variedad de | para que puedas elegir el que más se adecua a tus necesidades. | Dentro de los | encontramos al aceptado , un producto muy usado en la cocina gracias a su versatilidad. Por ejemplo el | Aceite de Oliva | cuenta con un alto contenido en ácidos grasos monoinsaturados y poliinsaturados que permitirán aportar grandes beneficios en nuestro organismo como: Eleva los niveles de colesterol HDL (bueno), Disminuye el colesterol LDL-c (colesterol malo), beneficia el control de la hipertensión arterial, entre otros. | Es ideal para consumirlo de manera directa, ya sea en ensaladas como complemento alimentario, de este modo podrás absorber al máximo sus nutrientes. | También puedes optar por el | que gracias a su composición es perfecto para la preparación de cualquier receta. Desde un delicioso arroz con pollo hasta unas crocantes papitas fritas. Encuentralo en diferentes presentaciones y en las mejores marcas del mercado. Complenta tus comidas con nuestra variedad de | Arroces | para que engrías a toda tu familia con tus mejores preparaciones. | - Conoce las distintas opciones en | Aceites | en plazaVea Online! | *La imagen solo es referencial | Bell ́s | ""Bell's ofrece una alternativa accesible en torno a calidad y precio de sus productos; con el respaldo y garantía de plazaVea."" | ¿En qué búsqueda? Encuentra más | en plaza Vea | Componentes del Producto | Vendido por | En caso de que algo te guste: Puedes revisar nuestras | Políticas de cambios y/o devoluciones | y hacerlas efectivas en todas nuestras tiendas. | Productos | que te pueden interesar | Recomendado para ti",,,,,"{""Descripción"": [""Información de la marca""], ""Características"": [""Presentación/Empaque"", ""Botella"", ""Porción sugerida"", ""13ml"", ""Alérgenos Declarados"", ""Contiene Soja."", ""Azúcar por porción"", ""0"", ""Calorías Porción"", ""108Kcal"", ""Carbohidratos Porción"", ""0g"", ""Descripción Nutricional"", ""Exento de colesterol. Fuente de vitamina E. Exento de gluten."", ""Grasas Porción"", ""12g"", ""Proteínas Porción"", ""Sodio Porción"", ""0mg"", ""Composición/Origen"", ""Vegetal"", ""% De Acidez"", ""Advertencias De Almacenamiento"", ""Almacenar en lugar fresco, seco y alejado de la luz solar directa."", ""Contenido Neto"", ""900ml"", ""Denominación/Variedad"", ""Advertencias de consumo"", ""Fecha de vencimiento, fabricación y lote impresos en la botella."", ""Revisa todo"", ""Importante destacar"", ""Calorías por parte: 108Kcal"", ""Composición : Vegetal"", ""Contenido Neto : 900ml"", ""Variedad: Vegetal"", ""Presentación : Botella"", ""Descripción del producto"", ""plazaVea"", ""cuenta con una amplia variedad de"", ""para que puedas elegir qué más se adecua a tus necesidades."", ""Dentro de los"", ""encontramos al aceite , un producto muy usado en la cocina gracias a su versatilidad. Por ejemplo el"", ""Aceite de Oliva"", ""cuenta con un alto contenido en ácidos grasos monoinsaturados y poliinsaturados que permitirán aportar grandes beneficios en nuestro organismo como: Eleva los niveles de colesterol HDL (bueno), Disminuye el colesterol LDL-c (colesterol malo), beneficia el control de la hipertensión arterial, entre otros."", ""Es ideal para consumirlo de manera directa, ya sea en ensaladas como complemento alimentario, de este modo podrás absorber al máximo sus nutrientes."", ""También puedes optar por el"", ""que gracias a su composición es perfecto para la preparación de cualquier receta. Desde un delicioso arroz con pollo hasta unas crocantes papitas fritas. Encuentralo en diferentes presentaciones y en las mejores marcas del mercado. Complenta tus comidas con nuestra variedad de"", ""Arroces"", ""para que engrias a toda tu familia con tus mejores preparaciones."", ""¡Conoce las distintas opciones en"", ""Aceites"", ""en plazaVea Online!"", ""*La imagen solo es referencial"", ""Bell´s"", ""\""Bell's ofrece una alternativa accesible en torno a la calidad y precio de sus productos; con el respaldo y garantía de plaza Vea"", ""¿En qué búsqueda? Encuentra más"", ""en plazaVea"", ""Componentes del Producto"", ""Vendido por"", ""En caso algo no vaya como gustes: Puedes revisar nuestras"", ""Politicas de cambios y/o devoluciones"", ""y hacerlas efectivas en todas nuestras tiendas."", ""Productos"", ""que te pueden interesar"", ""Recomendado para ti""]}",dataset/txt_limpios/1022.txt,dataset/paginas_descargadas/1022.html,ET,sin_categoria,discard,0.30,no_category_detected
1025,colaborar con nuestros estudios para marketing. También puede configurarlas.,Información de la marca,que podemos ofrecer. > 900ml,16.92,PEN,,Desconocido,unknown,PE,colaborar con nuestros estudios para marketing. También puede configurarlas.,que podemos ofrecer.,,900ml,16.92,PEN,S/,S/16.92,16.92,False,original,4.7662,4.7662,3.55,from_peru_cambio_dolar,,Información de la marca,"Presentación/Empaque | Bolsa | Denominación Contenido De Grasa | Entera | Libre De Lactosa | No | Descripción Técnica | Leche entera UHT. | Porción sugerida | 200ml | Formato | Líquido | Alérgenos Declarados | Contiene leche. | Calorías Porción | 119Kcal | Carbohidratos Porción | 10g | Proteínas Porción | 6g | Sodio Porción | 93mg | Composición/Origen | Animal | Libre De Aditivos | Preservantes | Advertencias de Almacenamiento | Almacenar en un lugar fresco y seco. Refrigerar después de abrir. | Contenido Neto | 946ml | Denominación/Variedad | Advertencias de consumo | Este producto NO sustituye la leche materna. NO neceSIta hervir. Listo para consumir. | Revisa todo | Importante destacar | Leche Fresca Entera | Presentación en bolsa | Contenido de 900ml | Descripción del producto | LECHES | plaza Vea | presenta lo mejor en productos de | para que acompañes tus | desayunos | , | meriendas | y | diversas recetas | con insumos de alta calidad. Descubre las marcas más destacadas en | y elige tu favorita. | En la web de plaza Vea Online, tendrás diferentes presentaciones de | , variedad ideal para preparar los más sabrosos jugos para el desayuno, el tan solo beberla acompañada de unas deliciosas galletas en la media tarde. Por otro lado, están las | Leches Evaporadas y Mezclas Lácteas | con las que se pueden cocinar distintos platillos de la cocina nacional e internacional, así como mezclar con una buena taza de agua hirviendo para el clásico | café con leche | de todas las mañanas. Si lo tuyo es la preparación más instantánea y de sabor único, puedes elegir entre las distintas opciones de | Leche en Polvo | que | Leche de Soya y Otras Bebidas Vegetales | es perfecta para ellas. | Complementa tu compra ingresando nuestra sección de | y descubre toda la variedad de productos que plazaVea Online tiene para ti pensando en brindarte lo mejor para tu | alimentación | y nutrición. | - Conoce las distintas opciones de | en plazaVea Online! | ¿En qué búsqueda? Encuentra más | en plaza Vea | Componentes del Producto | Vendido por | En caso de que algo te guste: Puedes revisar nuestras | Políticas de cambios y/o devoluciones | y hacerlas efectivas en todas nuestras tiendas. | Productos | que te pueden interesar | Recomendado para ti",,,,,"{""Descripción"": [""Información de la marca""], ""Características"": [""Presentación/Empaque"", ""Bolsa"", ""Denominación Contenido De Grasa"", ""Entera"", ""Libre De Lactosa"", ""No"", ""Descripción técnica"", ""Leche entera UHT."", ""Porción sugerida"", ""200ml"", ""Formato"", ""Líquido"", ""Alérgenos Declarados"", ""Contiene leche."", ""Calorías Porción"", ""119Kcal"", ""Carbohidratos Porción"", ""10g"", ""Proteínas Porción"", ""6g"", ""Sodio Porción"", ""93mg"", ""Composición/Origen"", ""Animal"", ""Libre De Aditivos"", ""Preservantes"", ""Advertencias De Almacenamiento"", ""Almacenar en un lugar fresco y seco. Refrigerar después de abrir."", ""Contenido Neto"", ""946ml"", ""Denominación/Variedad"", ""Advertencias de consumo"", ""Este producto NO sustituye la leche materna. NO neceSIta hervir. Listo para consumir."", ""Revisa todo"", ""Importante destacar"", ""Leche Fresca Entera"", ""Presentación en bolsa"", ""Contenido de 900ml"", ""Descripción del producto"", ""LECHES"", ""plazaVea"", ""presenta lo mejor en productos de"", ""para que acompañes tus"", ""desayunos"", "","", ""meriendas"", ""y"", ""diversas recetas"", ""con insumos de alta calidad. Descubre las marcas más destacadas en"", ""y elige tu favorita."", ""En la web de plaza Vea Online, tendrás diferentes presentaciones de"", "", variedad ideal para preparar los más sabrosos jugos para el desayuno, el tan solo beberla acompañada de unas deliciosas galletas en la media tarde. Por otro lado, están las"", ""Leches Evaporadas y Mezclas Lácteas"", ""con las que se pueden cocinar distintos platillos de la cocina nacional e internacional, así como mezclar con una buena taza de agua hirviendo para el clásico"", ""café con leche"", ""de todas las mañanas. Si lo tuyo es la preparación más instantánea y de sabor único, puedes elegir entre las distintas opciones de"", ""Leche en Polvo"", ""que"", ""Leche de Soya y Otras Bebidas Vegetales"", ""es perfecta para ellas."", ""Complementa tu compra ingresando nuestra sección de"", ""y descubre toda la variedad de productos que plazaVea Online tiene para ti pensando en brindarte lo mejor para tu"", ""alimentación"", ""y nutrición."", ""¡Conoce las distintas opciones de"", ""en plazaVea Online!"", ""¿En qué búsqueda? Encuentra más"", ""en plazaVea"", ""Componentes del Producto"", ""Vendido por"", ""En caso algo no vaya como gustes: Puedes revisar nuestras"", ""Politicas de cambios y/o devoluciones"", ""y hacerlas efectivas en todas nuestras tiendas."", ""Productos"", ""que te pueden interesar"", ""Recomendado para ti""]}",dataset/txt_limpios/1025.txt,dataset/paginas_descargadas/1025.html,ET,sin_categoria,discard,0.30,no_category_detected
1026,colaborar con nuestros estudios para marketing. También puede configurarlas.,Información de la marca,que podemos ofrecer. > 800ml,16.92,PEN,,Desconocido,unknown,PE,colaborar con nuestros estudios para marketing. También puede configurarlas.,que podemos ofrecer.,,800ml,16.92,PEN,S/,S/16.92,16.92,False,original,4.7662,4.7662,3.55,from_peru_cambio_dolar,,Información de la marca,"Presentación/Empaque | Denominación Contenido De Grasa | Semidescremada | Libre De Lactosa | No | Porción Sugerida | 8.4 g | Alérgenos Declarados | Azúcares Porción | 8.8 g | Calorías Porción | 110 kcal | Carbohidratos Porción | 838 g | Proteínas Porción | 128.7 mg | Sodio Porción | Libre De Aditivos | 1 | Advertencias De Almacenamiento | conservar en un lugar fresco y seco | Contenido Neto | 800 ml | Advertencias de consumo | consumir antes de la fecha indicada en el embalaje | Revisa todo | Importante destacar | Consumir antes de la fecha de vencimiento | Presentación: Caja | Descripción del producto | LECHES | plaza Vea | presenta lo mejor en productos de | para que acompañes tus | desayunos | , | meriendas | y | diversas recetas | con insumos de alta calidad. Descubre las marcas más destacadas en | y elige tu favorita. | En la web de plaza Vea Online, tendrás diferentes presentaciones de | , variedad ideal para preparar los más sabrosos jugos para el desayuno, el tan solo beberla acompañada de unas deliciosas galletas en la media tarde. Por otro lado, están las | Leches Evaporadas y Mezclas Lácteas | con las que se pueden cocinar distintos platillos de la cocina nacional e internacional, así como mezclar con una buena taza de agua hirviendo para el clásico | café con leche | de todas las mañanas. Si lo tuyo es la preparación más instantánea y de sabor único, puedes elegir entre las distintas opciones de | Leche en Polvo | que | Leche de Soya y Otras Bebidas Vegetales | es perfecta para ellas. | Complementa tu compra ingresando nuestra sección de | y descubre toda la variedad de productos que plazaVea Online tiene para ti pensando en brindarte lo mejor para tu | alimentación | y nutrición. | - Conoce las distintas opciones de | en plazaVea Online! | ¿En qué búsqueda? Encuentra más | en plaza Vea | Componentes del Producto | Vendido por | En caso de que algo te guste: Puedes revisar nuestras | Políticas de cambios y/o devoluciones | y hacerlas efectivas en todas nuestras tiendas. | Productos | que te pueden interesar | Recomendado para ti",,,,,"{""Descripción"": [""Información de la marca""], ""Características"": [""Presentación/Empaque"", ""Caja"", ""Denominación Contenido De Grasa"", ""Semidescremada"", ""Libre De Lactosa"", ""No"", ""Porción sugerida"", ""8.4 g"", ""Alérgenos Declarados"", ""Azúcar por porción"", ""8.8 g"", ""Calorías Porción"", ""110 kcal"", ""Carbohidratos Porción"", ""838 g"", ""Proteínas Porción"", ""128.7 mg"", ""Sodio Porción"", ""Libre De Aditivos"", ""1"", ""Advertencias De Almacenamiento"", ""conservar en un lugar fresco y seco"", ""Contenido Neto"", ""800 ml"", ""Advertencias de consumo"", ""consumir antes de la fecha indicada en el empaque"", ""Revisa todo"", ""Importante destacar"", ""Consumir antes de la fecha de vencimiento"", ""Presentación : Caja"", ""Descripción del producto"", ""LECHES"", ""plazaVea"", ""presenta lo mejor en productos de"", ""para que acompañes tus"", ""desayunos"", "","", ""meriendas"", ""y"", ""diversas recetas"", ""con insumos de alta calidad. Descubre las marcas más destacadas en"", ""y elige tu favorita."", ""En la web de plaza Vea Online, tendrás diferentes presentaciones de"", "", variedad ideal para preparar los más sabrosos jugos para el desayuno, el tan solo beberla acompañada de unas deliciosas galletas en la media tarde. Por otro lado, están las"", ""Leches Evaporadas y Mezclas Lácteas"", ""con las que se pueden cocinar distintos platillos de la cocina nacional e internacional, así como mezclar con una buena taza de agua hirviendo para el clásico"", ""café con leche"", ""de todas las mañanas. Si lo tuyo es la preparación más instantánea y de sabor único, puedes elegir entre las distintas opciones de"", ""Leche en Polvo"", ""que"", ""Leche de Soya y Otras Bebidas Vegetales"", ""es perfecta para ellas."", ""Complementa tu compra ingresando nuestra sección de"", ""y descubre toda la variedad de productos que plazaVea Online tiene para ti pensando en brindarte lo mejor para tu"", ""alimentación"", ""y nutrición."", ""¡Conoce las distintas opciones de"", ""en plazaVea Online!"", ""¿En qué búsqueda? Encuentra más"", ""en plazaVea"", ""Componentes del Producto"", ""Vendido por"", ""En caso algo no vaya como gustes: Puedes revisar nuestras"", ""Politicas de cambios y/o devoluciones"", ""y hacerlas efectivas en todas nuestras tiendas."", ""Productos"", ""que te pueden interesar"", ""Recomendado para ti""]}",dataset/txt_limpios/1026.txt,dataset/paginas_descargadas/1026.html,ET,sin_categoria,discard,0.30,no_category_detected
