source_id,title,description,breadcrumbs,price_raw,currency_raw,url,seller,availability,country,product_name,brand,reference,unit,price_amount,price_currency,price_symbol,price_text,price_amount_filled,price_is_imputed,price_imputation_source,price_amount_usd,price_amount_usd_filled,fx_rate_local_per_usd,fx_source,information_text,description_text,features_text,specifications_text,benefits_text,details_text,other_sections,sections,txt_path,html_path,es_status,category_canonical,decision,match_score,reasons
833,Saltar menú Cenco,Ingredientes Condición alimentaria Información nutricional Tipo de Producto Huevo de Gallina Libre/Feliz Envase Bandeja País de Origen Chile Te podrían interesar Centro de preferencia de privacidad Gestionar las preferencias de consentimiento Activas siempre Back Button Search Icon Filter Icon Clear checkbox label label Apply Cancel Consent Leg.Interest Permitir todas Rechazar todas Confirmar mis preferencias,Ecoterra,5.89,,,Desconocido,unknown,UNKNOWN,Saltar menú Cenco,Ecoterra,,,5.89,,$,$5.89,5.89,False,original,5.89,5.89,1.0,default_1usd,,Ingredientes Condición alimentaria Información nutricional Tipo de Producto Huevo de Gallina Libre/Feliz Envase Bandeja País de Origen Chile Te podrían interesar Centro de preferencia de privacidad Gestionar las preferencias de consentimiento Activas siempre Back Button Search Icon Filter Icon Clear checkbox label label Apply Cancel Consent Leg.Interest Permitir todas Rechazar todas Confirmar mis preferencias,,,,,,"{""Descripción"": [""Ingredientes"", ""Condición alimentaria"", ""Información nutricional"", ""Tipo de Producto"", ""Huevo de Gallina Libre/Feliz"", ""Envase"", ""Bandeja"", ""País de origen"", ""Chile"", ""Te podrían interesar"", ""Centro de preferencia de privacidad"", ""Gestionar las preferencias de consentimiento"", ""Activas siempre"", ""Back Button"", ""Search Icon"", ""Filter Icon"", ""Clear"", ""checkbox label"", ""label"", ""Apply"", ""Cancel"", ""Consent"", ""Leg.Interest"", ""Permitir todas"", ""Rechazar todas"", ""Confirmar mis preferencias""]}",dataset/txt_limpios/833.txt,dataset/paginas_descargadas/833.html,ET,huevo,discard,0.30,heuristic_default
834,Saltar menú Cenco,Tipo de Producto Pollo Te podrían interesar Kryzpo Papas Fritas Kryzpo Original 130 g Frutas y Verduras Propias Lechuga Escarola 1 un. 3.4 Exclusivo online Pomarola Salsa de Tomate Pomarola 200 g 6 un. Centro de preferencia de privacidad Gestionar las preferencias de consentimiento Activas siempre Back Button Search Icon Filter Icon Clear checkbox label label Apply Cancel Consent Leg.Interest Permitir todas Rechazar todas Confirmar mis preferencias,Ariztía > 480 g,8.78,,,Desconocido,unknown,UNKNOWN,Saltar menú Cenco,Ariztía,,480 g,8.78,,$,$8.78,8.78,False,original,8.78,8.78,1.0,default_1usd,,Tipo de Producto Pollo Te podrían interesar Kryzpo Papas Fritas Kryzpo Original 130 g Frutas y Verduras Propias Lechuga Escarola 1 un. 3.4 Exclusivo online Pomarola Salsa de Tomate Pomarola 200 g 6 un. Centro de preferencia de privacidad Gestionar las preferencias de consentimiento Activas siempre Back Button Search Icon Filter Icon Clear checkbox label label Apply Cancel Consent Leg.Interest Permitir todas Rechazar todas Confirmar mis preferencias,,,,,,"{""Descripción"": [""Tipo de Producto"", ""Pollo"", ""Te podrían interesar"", ""Kryzpo"", ""Papas Fritas Kryzpo Original 130 g"", ""Frutas y Verduras Propias"", ""Lechuga Escarola 1 un."", ""3.4"", ""Exclusivo online"", ""Pomarola"", ""Salsa de Tomate Pomarola 200 g 6 un."", ""Centro de preferencia de privacidad"", ""Gestionar las preferencias de consentimiento"", ""Activas siempre"", ""Back Button"", ""Search Icon"", ""Filter Icon"", ""Clear"", ""checkbox label"", ""label"", ""Apply"", ""Cancel"", ""Consent"", ""Leg.Interest"", ""Permitir todas"", ""Rechazar todas"", ""Confirmar mis preferencias""]}",dataset/txt_limpios/834.txt,dataset/paginas_descargadas/834.html,EN,papa,keep,0.60,heuristic_default
835,Saltar menú Cenco,Tipo de Producto Pollo Uso Recomendado Horno Envase Bolsa Variedad Pollo Entero Marinado Sí Contenido A granel Almacenamiento Mantener almacenado entre -2C y 2C Te podrían interesar Centro de preferencia de privacidad Gestionar las preferencias de consentimiento Activas siempre Back Button Search Icon Filter Icon Clear checkbox label label Apply Cancel Consent Leg.Interest Permitir todas Rechazar todas Confirmar mis preferencias,Agotado > 2.3 kg,8.78,,,Desconocido,unknown,UNKNOWN,Saltar menú Cenco,Agotado,,2.3 kg,8.78,,$,$8.78,8.78,False,original,8.78,8.78,1.0,default_1usd,,Tipo de Producto Pollo Uso Recomendado Horno Envase Bolsa Variedad Pollo Entero Marinado Sí Contenido A granel Almacenamiento Mantener almacenado entre -2C y 2C Te podrían interesar Centro de preferencia de privacidad Gestionar las preferencias de consentimiento Activas siempre Back Button Search Icon Filter Icon Clear checkbox label label Apply Cancel Consent Leg.Interest Permitir todas Rechazar todas Confirmar mis preferencias,,,,,,"{""Descripción"": [""Tipo de Producto"", ""Pollo"", ""Uso Recomendado"", ""Horno"", ""Envase"", ""Bolsa"", ""Variedad"", ""Pollo Entero"", ""Marinado"", ""Sí"", ""Contenido"", ""A granel"", ""Almacenamiento"", ""Mantener almacenado entre -2C y 2C"", ""Te podrían interesar"", ""Centro de preferencia de privacidad"", ""Gestionar las preferencias de consentimiento"", ""Activas siempre"", ""Back Button"", ""Search Icon"", ""Filter Icon"", ""Clear"", ""checkbox label"", ""label"", ""Apply"", ""Cancel"", ""Consent"", ""Leg.Interest"", ""Permitir todas"", ""Rechazar todas"", ""Confirmar mis preferencias""]}",dataset/txt_limpios/835.txt,dataset/paginas_descargadas/835.html,EN,pollo entero,keep,0.60,heuristic_default
836,Saltar menú Cenco,Tipo de Producto Pollo Te podrían interesar Marco Polo Papas Fritas Marco Polo Rústicas Sal de Mar 380 g 3.7 Exclusivo online Pomarola Salsa de Tomate Pomarola 200 g 6 un. 5.0 Frutas y Verduras Propias Lechuga Escarola 1 un. 3.4 Centro de preferencia de privacidad Gestionar las preferencias de consentimiento Activas siempre Back Button Search Icon Filter Icon Clear checkbox label label Apply Cancel Consent Leg.Interest Permitir todas Rechazar todas Confirmar mis preferencias,Agotado > 380 g,5.75,,,Desconocido,unknown,UNKNOWN,Saltar menú Cenco,Agotado,,380 g,5.75,,$,$5.75,5.75,False,original,5.75,5.75,1.0,default_1usd,,Tipo de Producto Pollo Te podrían interesar Marco Polo Papas Fritas Marco Polo Rústicas Sal de Mar 380 g 3.7 Exclusivo online Pomarola Salsa de Tomate Pomarola 200 g 6 un. 5.0 Frutas y Verduras Propias Lechuga Escarola 1 un. 3.4 Centro de preferencia de privacidad Gestionar las preferencias de consentimiento Activas siempre Back Button Search Icon Filter Icon Clear checkbox label label Apply Cancel Consent Leg.Interest Permitir todas Rechazar todas Confirmar mis preferencias,,,,,,"{""Descripción"": [""Tipo de Producto"", ""Pollo"", ""Te podrían interesar"", ""Marco Polo"", ""Papas Fritas Marco Polo Rústicas Sal de Mar 380 g"", ""3.7"", ""Exclusivo online"", ""Pomarola"", ""Salsa de Tomate Pomarola 200 g 6 un."", ""5.0"", ""Frutas y Verduras Propias"", ""Lechuga Escarola 1 un."", ""3.4"", ""Centro de preferencia de privacidad"", ""Gestionar las preferencias de consentimiento"", ""Activas siempre"", ""Back Button"", ""Search Icon"", ""Filter Icon"", ""Clear"", ""checkbox label"", ""label"", ""Apply"", ""Cancel"", ""Consent"", ""Leg.Interest"", ""Permitir todas"", ""Rechazar todas"", ""Confirmar mis preferencias""]}",dataset/txt_limpios/836.txt,dataset/paginas_descargadas/836.html,EN,papa,keep,0.60,heuristic_default
837,Saltar menú Cenco,Tipo de Producto Pollo Te podrían interesar Kryzpo Papas Fritas Kryzpo Original 130 g 5.0 Fresh Cut Mix Salad Fresh Cut 150 g 4.5 Kraft Mayonesa Kraft 850 g Centro de preferencia de privacidad Gestionar las preferencias de consentimiento Activas siempre Back Button Search Icon Filter Icon Clear checkbox label label Apply Cancel Consent Leg.Interest Permitir todas Rechazar todas Confirmar mis preferencias,Canto del Gallo > 550 g,8.98,,,Desconocido,unknown,UNKNOWN,Saltar menú Cenco,Canto del Gallo,,550 g,8.98,,$,$8.98,8.98,False,original,8.98,8.98,1.0,default_1usd,,Tipo de Producto Pollo Te podrían interesar Kryzpo Papas Fritas Kryzpo Original 130 g 5.0 Fresh Cut Mix Salad Fresh Cut 150 g 4.5 Kraft Mayonesa Kraft 850 g Centro de preferencia de privacidad Gestionar las preferencias de consentimiento Activas siempre Back Button Search Icon Filter Icon Clear checkbox label label Apply Cancel Consent Leg.Interest Permitir todas Rechazar todas Confirmar mis preferencias,,,,,,"{""Descripción"": [""Tipo de Producto"", ""Pollo"", ""Te podrían interesar"", ""Kryzpo"", ""Papas Fritas Kryzpo Original 130 g"", ""5.0"", ""Fresh Cut"", ""Mix Salad Fresh Cut 150 g"", ""4.5"", ""Kraft"", ""Mayonesa Kraft 850 g"", ""Centro de preferencia de privacidad"", ""Gestionar las preferencias de consentimiento"", ""Activas siempre"", ""Back Button"", ""Search Icon"", ""Filter Icon"", ""Clear"", ""checkbox label"", ""label"", ""Apply"", ""Cancel"", ""Consent"", ""Leg.Interest"", ""Permitir todas"", ""Rechazar todas"", ""Confirmar mis preferencias""]}",dataset/txt_limpios/837.txt,dataset/paginas_descargadas/837.html,EN,papa,keep,0.60,heuristic_default
838,Saltar menú Cenco,,,,,,Desconocido,unknown,UNKNOWN,Saltar menú Cenco,,,,,,,,234.19,True,country_mean,,234.1938,1.0,default_1usd,,,,,,,,{},dataset/txt_limpios/838.txt,dataset/paginas_descargadas/838.html,EN,sin_categoria,discard,0.30,no_category_detected;price_parse_failed
839,Saltar menú Cenco,Ingredientes Condición alimentaria Información nutricional Tipo de Producto Leche Entera Cantidad 1 L Formato Caja Envase Tetrapack País de Origen Chile Variedad Entera Natural Estado Líquido Tamaño Familiar Contenido Almacenamiento Refrigerar entre 2–6 °C; consumir en pocos días tras abrir. Garantía Mínima Legal Válida hasta su fecha de caducidad Te podrían interesar Natur Cereal Natur Maíz 20 g Haiti Café Molido Haiti Super Moka 3 Bolsa 250 g 4.5 Iansa Azúcar Blanca Iansa 1 kg 4.8 Centro de preferencia de privacidad Gestionar las preferencias de consentimiento Activas siempre Back Button Search Icon Filter Icon Clear checkbox label label Apply Cancel Consent Leg.Interest Permitir todas Rechazar todas Confirmar mis preferencias,Exclusivo online > 1 L,2.0,,,Desconocido,unknown,UNKNOWN,Saltar menú Cenco,Exclusivo online,,1 L,2.00,,,2,2.0,False,original,2.0,2.0,1.0,default_1usd,,Ingredientes Condición alimentaria Información nutricional Tipo de Producto Leche Entera Cantidad 1 L Formato Caja Envase Tetrapack País de Origen Chile Variedad Entera Natural Estado Líquido Tamaño Familiar Contenido Almacenamiento Refrigerar entre 2–6 °C; consumir en pocos días tras abrir. Garantía Mínima Legal Válida hasta su fecha de caducidad Te podrían interesar Natur Cereal Natur Maíz 20 g Haiti Café Molido Haiti Super Moka 3 Bolsa 250 g 4.5 Iansa Azúcar Blanca Iansa 1 kg 4.8 Centro de preferencia de privacidad Gestionar las preferencias de consentimiento Activas siempre Back Button Search Icon Filter Icon Clear checkbox label label Apply Cancel Consent Leg.Interest Permitir todas Rechazar todas Confirmar mis preferencias,,,,,,"{""Descripción"": [""Ingredientes"", ""Condición alimentaria"", ""Información nutricional"", ""Tipo de Producto"", ""Leche Entera"", ""Cantidad"", ""1 L"", ""Formato"", ""Caja"", ""Envase"", ""Tetrapack"", ""País de origen"", ""Chile"", ""Variedad"", ""Entera Natural"", ""Estado"", ""Líquido"", ""Tamaño"", ""Familiar"", ""Contenido"", ""Almacenamiento"", ""Refrigerar entre 2–6 °C; consumir en pocos días tras abrir."", ""Garantía Mínima Legal"", ""Válida hasta su fecha de caducidad"", ""Te podrían interesar"", ""Natur"", ""Cereal Natur Maíz 20 g"", ""Haiti"", ""Café Molido Haiti Super Moka 3 Bolsa 250 g"", ""4.5"", ""Iansa"", ""Azúcar Blanca Iansa 1 kg"", ""4.8"", ""Centro de preferencia de privacidad"", ""Gestionar las preferencias de consentimiento"", ""Activas siempre"", ""Back Button"", ""Search Icon"", ""Filter Icon"", ""Clear"", ""checkbox label"", ""label"", ""Apply"", ""Cancel"", ""Consent"", ""Leg.Interest"", ""Permitir todas"", ""Rechazar todas"", ""Confirmar mis preferencias""]}",dataset/txt_limpios/839.txt,dataset/paginas_descargadas/839.html,ET,descartado,discard,0.10,excluded_keyword
840,Saltar menú Cenco,Ingredientes Condición alimentaria Información nutricional Tipo de Producto Leche Entera Envase Tetrapack País de Origen Chile Garantía Mínima Legal Válida hasta su fecha de caducidad Te podrían interesar Natur Cereal Natur Maíz 20 g Haiti Café Molido Haiti Super Moka 3 Bolsa 250 g 4.5 Azúcar Cuisine & Co Blanca Granulada 1 kg Centro de preferencia de privacidad Gestionar las preferencias de consentimiento Activas siempre Back Button Search Icon Filter Icon Clear checkbox label label Apply Cancel Consent Leg.Interest Permitir todas Rechazar todas Confirmar mis preferencias,Loncoleche > 1 L,1.19,,,Desconocido,unknown,UNKNOWN,Saltar menú Cenco,Loncoleche,,1 L,1.19,,$,$1.19,1.19,False,original,1.19,1.19,1.0,default_1usd,,Ingredientes Condición alimentaria Información nutricional Tipo de Producto Leche Entera Envase Tetrapack País de Origen Chile Garantía Mínima Legal Válida hasta su fecha de caducidad Te podrían interesar Natur Cereal Natur Maíz 20 g Haiti Café Molido Haiti Super Moka 3 Bolsa 250 g 4.5 Azúcar Cuisine & Co Blanca Granulada 1 kg Centro de preferencia de privacidad Gestionar las preferencias de consentimiento Activas siempre Back Button Search Icon Filter Icon Clear checkbox label label Apply Cancel Consent Leg.Interest Permitir todas Rechazar todas Confirmar mis preferencias,,,,,,"{""Descripción"": [""Ingredientes"", ""Condición alimentaria"", ""Información nutricional"", ""Tipo de Producto"", ""Leche Entera"", ""Envase"", ""Tetrapack"", ""País de origen"", ""Chile"", ""Garantía Mínima Legal"", ""Válida hasta su fecha de caducidad"", ""Te podrían interesar"", ""Natur"", ""Cereal Natur Maíz 20 g"", ""Haiti"", ""Café Molido Haiti Super Moka 3 Bolsa 250 g"", ""4.5"", ""Azúcar Cuisine & Co Blanca Granulada 1 kg"", ""Centro de preferencia de privacidad"", ""Gestionar las preferencias de consentimiento"", ""Activas siempre"", ""Back Button"", ""Search Icon"", ""Filter Icon"", ""Clear"", ""checkbox label"", ""label"", ""Apply"", ""Cancel"", ""Consent"", ""Leg.Interest"", ""Permitir todas"", ""Rechazar todas"", ""Confirmar mis preferencias""]}",dataset/txt_limpios/840.txt,dataset/paginas_descargadas/840.html,ET,descartado,discard,0.10,excluded_keyword
842,Saltar menú Cenco,Ingredientes Condición alimentaria Información nutricional Tipo de Producto Leche Entera Envase Tetrapack País de Origen Chile Te podrían interesar Exclusivo online 30% dcto. Quaker Haiti Café Molido Haiti Super Moka 3 Bolsa 250 g 4.5 Azúcar Cuisine & Co Blanca Granulada 1 kg Centro de preferencia de privacidad Gestionar las preferencias de consentimiento Activas siempre Back Button Search Icon Filter Icon Clear checkbox label label Apply Cancel Consent Leg.Interest Permitir todas Rechazar todas Confirmar mis preferencias,Cuisine & Co > 1 L,1.11,,,Desconocido,unknown,UNKNOWN,Saltar menú Cenco,Cuisine & Co,,1 L,1.11,,$,$1.11,1.11,False,original,1.11,1.11,1.0,default_1usd,,Ingredientes Condición alimentaria Información nutricional Tipo de Producto Leche Entera Envase Tetrapack País de Origen Chile Te podrían interesar Exclusivo online 30% dcto. Quaker Haiti Café Molido Haiti Super Moka 3 Bolsa 250 g 4.5 Azúcar Cuisine & Co Blanca Granulada 1 kg Centro de preferencia de privacidad Gestionar las preferencias de consentimiento Activas siempre Back Button Search Icon Filter Icon Clear checkbox label label Apply Cancel Consent Leg.Interest Permitir todas Rechazar todas Confirmar mis preferencias,,,,,,"{""Descripción"": [""Ingredientes"", ""Condición alimentaria"", ""Información nutricional"", ""Tipo de Producto"", ""Leche Entera"", ""Envase"", ""Tetrapack"", ""País de origen"", ""Chile"", ""Te podrían interesar"", ""Exclusivo online"", ""30% dcto."", ""Quaker"", ""Haiti"", ""Café Molido Haiti Super Moka 3 Bolsa 250 g"", ""4.5"", ""Azúcar Cuisine & Co Blanca Granulada 1 kg"", ""Centro de preferencia de privacidad"", ""Gestionar las preferencias de consentimiento"", ""Activas siempre"", ""Back Button"", ""Search Icon"", ""Filter Icon"", ""Clear"", ""checkbox label"", ""label"", ""Apply"", ""Cancel"", ""Consent"", ""Leg.Interest"", ""Permitir todas"", ""Rechazar todas"", ""Confirmar mis preferencias""]}",dataset/txt_limpios/842.txt,dataset/paginas_descargadas/842.html,ET,leche,keep,0.60,heuristic_default
843,Saltar menú Cenco,Tipo de Producto Manzana Royal Gala Grupo Manzanas - Peras y Otros Envase Granel Variedad Fruta Contenido A granel Te podrían interesar Naranja Granel Importada (2 A 3 un. Aprox) Plátano Extra Granel (1 A 2 un. Aprox) Perejil 1 un. Centro de preferencia de privacidad Gestionar las preferencias de consentimiento Activas siempre Back Button Search Icon Filter Icon Clear checkbox label label Apply Cancel Consent Leg.Interest Permitir todas Rechazar todas Confirmar mis preferencias,Frutas y Verduras Propias > 1 kg,1.29,,,Desconocido,unknown,UNKNOWN,Saltar menú Cenco,Frutas y Verduras Propias,,1 kg,1.29,,$,$1.29,1.29,False,original,1.29,1.29,1.0,default_1usd,,Tipo de Producto Manzana Royal Gala Grupo Manzanas - Peras y Otros Envase Granel Variedad Fruta Contenido A granel Te podrían interesar Naranja Granel Importada (2 A 3 un. Aprox) Plátano Extra Granel (1 A 2 un. Aprox) Perejil 1 un. Centro de preferencia de privacidad Gestionar las preferencias de consentimiento Activas siempre Back Button Search Icon Filter Icon Clear checkbox label label Apply Cancel Consent Leg.Interest Permitir todas Rechazar todas Confirmar mis preferencias,,,,,,"{""Descripción"": [""Tipo de Producto"", ""Manzana Royal Gala"", ""Grupo"", ""Manzanas - Peras y Otros"", ""Envase"", ""Granel"", ""Variedad"", ""Fruta"", ""Contenido"", ""A granel"", ""Te podrían interesar"", ""Naranja Granel Importada (2 A 3 un. Aprox)"", ""Plátano Extra Granel (1 A 2 un. Aprox)"", ""Perejil 1 un."", ""Centro de preferencia de privacidad"", ""Gestionar las preferencias de consentimiento"", ""Activas siempre"", ""Back Button"", ""Search Icon"", ""Filter Icon"", ""Clear"", ""checkbox label"", ""label"", ""Apply"", ""Cancel"", ""Consent"", ""Leg.Interest"", ""Permitir todas"", ""Rechazar todas"", ""Confirmar mis preferencias""]}",dataset/txt_limpios/843.txt,dataset/paginas_descargadas/843.html,EN,banano,keep,0.60,heuristic_default
844,Saltar menú Cenco,Ingredientes Condición alimentaria Información nutricional Tipo de Producto Spaghettis Cantidad 1 un. Formato N°5 Envase Paquete País de Origen Chile Variedad Contenido 400 g Garantía Mínima Legal Válida hasta su fecha de caducidad Te podrían interesar Pomarola Salsa de Tomate Pomarola 200 g 6 un. Oferta Colun 4.5 Gourmet Caldo Gourmet Polvo Sabor Carne 48 g 6 un. Centro de preferencia de privacidad Gestionar las preferencias de consentimiento Activas siempre Back Button Search Icon Filter Icon Clear checkbox label label Apply Cancel Consent Leg.Interest Permitir todas Rechazar todas Confirmar mis preferencias,Exclusivo online > 400 g,3.0,,,Desconocido,unknown,UNKNOWN,Saltar menú Cenco,Exclusivo online,,400 g,3.00,,,3,3.0,False,original,3.0,3.0,1.0,default_1usd,,Ingredientes Condición alimentaria Información nutricional Tipo de Producto Spaghettis Cantidad 1 un. Formato N°5 Envase Paquete País de Origen Chile Variedad Contenido 400 g Garantía Mínima Legal Válida hasta su fecha de caducidad Te podrían interesar Pomarola Salsa de Tomate Pomarola 200 g 6 un. Oferta Colun 4.5 Gourmet Caldo Gourmet Polvo Sabor Carne 48 g 6 un. Centro de preferencia de privacidad Gestionar las preferencias de consentimiento Activas siempre Back Button Search Icon Filter Icon Clear checkbox label label Apply Cancel Consent Leg.Interest Permitir todas Rechazar todas Confirmar mis preferencias,,,,,,"{""Descripción"": [""Ingredientes"", ""Condición alimentaria"", ""Información nutricional"", ""Tipo de Producto"", ""Spaghettis"", ""Cantidad"", ""1 un."", ""Formato"", ""N°5"", ""Envase"", ""Paquete"", ""País de origen"", ""Chile"", ""Variedad"", ""Contenido"", ""400 g"", ""Garantía Mínima Legal"", ""Válida hasta su fecha de caducidad"", ""Te podrían interesar"", ""Pomarola"", ""Salsa de Tomate Pomarola 200 g 6 un."", ""Oferta"", ""Colun"", ""4.5"", ""Gourmet"", ""Caldo Gourmet Polvo Sabor Carne 48 g 6 un."", ""Centro de preferencia de privacidad"", ""Gestionar las preferencias de consentimiento"", ""Activas siempre"", ""Back Button"", ""Search Icon"", ""Filter Icon"", ""Clear"", ""checkbox label"", ""label"", ""Apply"", ""Cancel"", ""Consent"", ""Leg.Interest"", ""Permitir todas"", ""Rechazar todas"", ""Confirmar mis preferencias""]}",dataset/txt_limpios/844.txt,dataset/paginas_descargadas/844.html,ET,descartado,discard,0.10,excluded_keyword
