source_id,title,description,breadcrumbs,price_raw,currency_raw,url,seller,availability,country,product_name,brand,reference,unit,price_amount,price_currency,price_symbol,price_text,price_amount_filled,price_is_imputed,price_imputation_source,price_amount_usd,price_amount_usd_filled,fx_rate_local_per_usd,fx_source,information_text,description_text,features_text,specifications_text,benefits_text,details_text,other_sections,sections,txt_path,html_path,es_status,category_canonical,decision,match_score,reasons
997,Verificar que usted es un ser humano. Esto podría tardar algunos segundos.,,Verificación exitosa,,,,Desconocido,unknown,UNKNOWN,Verificar que usted es un ser humano. Esto podría tardar algunos segundos.,Verificación exitosa,,,,,,,234.19,True,country_mean,,234.1938,1.0,default_1usd,,,,,,,,{},dataset/txt_limpios/997.txt,dataset/paginas_descargadas/997.html,EN,sin_categoria,discard,0.30,no_category_detected;price_parse_failed
998,Verificar que usted es un ser humano. Esto podría tardar algunos segundos.,,Verificación exitosa,,,,Desconocido,unknown,UNKNOWN,Verificar que usted es un ser humano. Esto podría tardar algunos segundos.,Verificación exitosa,,,,,,,234.19,True,country_mean,,234.1938,1.0,default_1usd,,,,,,,,{},dataset/txt_limpios/998.txt,dataset/paginas_descargadas/998.html,EN,sin_categoria,discard,0.30,no_category_detected;price_parse_failed
999,Verificar que usted es un ser humano. Esto podría tardar algunos segundos.,,Verificación exitosa,,,,Desconocido,unknown,UNKNOWN,Verificar que usted es un ser humano. Esto podría tardar algunos segundos.,Verificación exitosa,,,,,,,234.19,True,country_mean,,234.1938,1.0,default_1usd,,,,,,,,{},dataset/txt_limpios/999.txt,dataset/paginas_descargadas/999.html,EN,sin_categoria,discard,0.30,no_category_detected;price_parse_failed
1053,¡Aún no eres Wong Prime!,,Aprovecha el > 5 Kg > 107169,79.9,PEN,,Desconocido,unknown,PE,¡Aún no eres Wong Prime!,Aprovecha el,107169.0,5 Kg,79.90,PEN,S/,S/79.90,79.9,False,original,22.507,22.507,3.55,from_peru_cambio_dolar,,,,,,,,{},dataset/txt_limpios/1053.txt,dataset/paginas_descargadas/1053.html,EN,sin_categoria,discard,0.30,no_category_detected
1054,¡Aún no eres Wong Prime!,Comentarios | Especificaciones técnicas | Propiedad | Especificación | Ingredientes | 100% arroz | Ver condiciones de promociones | ? | ! | i | × | Sí Acepto | Recuerda escribir al menos 3 letras en el cuadro de búsqueda | Términos más buscados | 1. | elvive liso | 2. | ariel liquido | 3. | limpiador inodoro harpic | 4. | busca | 5. | secret clinical | Marcas sugeridas,Aprovecha el > 5 kg > 576339,79.9,PEN,,Desconocido,unknown,PE,¡Aún no eres Wong Prime!,Aprovecha el,576339.0,5 kg,79.90,PEN,S/,S/79.90,79.9,False,original,22.507,22.507,3.55,from_peru_cambio_dolar,,,,Comentarios | Especificaciones técnicas | Propiedad | Especificación | Ingredientes | 100% arroz | Ver condiciones de promociones | ? | ! | i | × | Sí Acepto | Recuerda escribir al menos 3 letras en el cuadro de búsqueda | Términos más buscados | 1. | elvive liso | 2. | ariel liquido | 3. | limpiador inodoro harpic | 4. | busca | 5. | secret clinical | Marcas sugeridas,,,,"{""Especificaciones"": [""Comentarios"", ""Especificaciones técnicas"", ""Propiedad"", ""Especificación"", ""Ingredientes"", ""100% arroz"", ""Ver condiciones de promociones"", ""?"", ""!"", ""i"", ""×"", ""Sí Acepto"", ""Recuerda escribir al menos 3 letras en el cuadro de búsqueda"", ""Términos más buscados"", ""1."", ""elvive liso"", ""2."", ""ariel liquido"", ""3."", ""limpiador inodoro harpic"", ""4."", ""busca"", ""5."", ""secret clinical"", ""Marcas sugeridas""]}",dataset/txt_limpios/1054.txt,dataset/paginas_descargadas/1054.html,EN,arroz,keep,0.60,heuristic_default
