source_id,title,description,breadcrumbs,price_raw,currency_raw,url,seller,availability,country,product_name,brand,reference,unit,price_amount,price_currency,price_symbol,price_text,price_amount_filled,price_is_imputed,price_imputation_source,price_amount_usd,price_amount_usd_filled,fx_rate_local_per_usd,fx_source,information_text,description_text,features_text,specifications_text,benefits_text,details_text,other_sections,sections,txt_path,html_path,es_status,category_canonical,decision,match_score,reasons
1754,Fiambres y Huevos,"Huevos de Gallinas Libres 12 Un extra Color La Castellana 732g | Actualizado al: 27-05-2025 Ingredientes: Huevo. Alérgenos: Huevo. Certificados: Apto para APLV Libre de Lactosa Vegetariano Libre de Soya Libre de Peces Libre de Mariscos Libre de Maní Libre de Frutas Secos Libre de Nueces Libre de Sulfitos Libre de Trigo Porción: 1 Huevo (57g) Porciones por envase: 12 100g 1 Porción Energía (kCal) 149 84.9 Proteínas (g) 12 6.8 Grasas Totales 9.8 5.6 Grasas saturadas (g) 3.7 2.1 Grasas (g) 2.8 1.6 Grasas poliinsaturadas (g) 1.4 0,8 Grasas trans (g) 0,1 Colesterol (mg) 370 210.9 Hidratos de carbono disponibles Azúcar total (g) 0.48 0.3 Sodio 150 85.5 Importante: La información del empaque y/o contenido del producto final puede diferir respecto a lo que mostramos en nuestro sitio web, tanto a nivel de ingredientes, trazas, información nutricional, sellos, modo de uso y/o modo de conservación. Usted debe basarse únicamente en la información que se muestra en nuestro sitio web y siempre debe leer las etiquetas, advertencias y instrucciones antes de usar el consumo de un producto. Información obtenida de HUEVO COLOR EXTRA LA CASTELLANA 12 UND Productos similares Huevo Blanco Grande Ver producto Huevo Color Grande Huevo Primera Color Huevos de Color Gallinas Libres Medianos Ecoterra 12 Un Huevo de Color Gallina Libre Huevo de Color Gallina Libre La Granja 6 Un Huevos de Color Gallinas Libre La Granja 12 Un Huevos Blanco Grande Yemita 12 Un HUEVO EXTRA BLANCO 12 UN COLIUMO HUEVOS COLOR GRAN 12 UN. YEM Huevos de Color Gallinas Libres Ecoterra 20 Un Huevos de Color Gallinas Libres Ecoterra 10 Un -28% Huevo Blanco Extra Grande Huevo Grande Gallina Libre HUEVO GRAN LIBRE PASTO CINTAZUL 12 UND ¡Juntos son mejores! Papa en Malla 2 Kg Papel Higiénico Elite Doble Hoja 8 x 50 mts Papa Granel KG Toalla de papel Nueva Doble Hoja 2 x 26 mts -19% Toalla de Papel Nuevo Doble Hoja 100 mts -13% Cebolla en Malla 1 Kg Cebolla a Granel Toalla de Papel Nueva Clásica 3 x 12 mts Tomate en Malla 1 Kg Toalla de papel Ultra Nova 70 Mts -18%",Huevos > 732g,4.69,,,Desconocido,unknown,UNKNOWN,Fiambres y Huevos,Huevos,,732g,4.69,,,4.69,4.69,False,original,4.69,4.69,1.0,default_1usd,,"Huevos de Gallinas Libres 12 Un extra Color La Castellana 732g | Actualizado al: 27-05-2025 Ingredientes: Huevo. Alérgenos: Huevo. Certificados: Apto para APLV Libre de Lactosa Vegetariano Libre de Soya Libre de Peces Libre de Mariscos Libre de Maní Libre de Frutas Secos Libre de Nueces Libre de Sulfitos Libre de Trigo Porción: 1 Huevo (57g) Porciones por envase: 12 100g 1 Porción Energía (kCal) 149 84.9 Proteínas (g) 12 6.8 Grasas Totales 9.8 5.6 Grasas saturadas (g) 3.7 2.1 Grasas (g) 2.8 1.6 Grasas poliinsaturadas (g) 1.4 0,8 Grasas trans (g) 0,1 Colesterol (mg) 370 210.9 Hidratos de carbono disponibles Azúcar total (g) 0.48 0.3 Sodio 150 85.5 Importante: La información del empaque y/o contenido del producto final puede diferir respecto a lo que mostramos en nuestro sitio web, tanto a nivel de ingredientes, trazas, información nutricional, sellos, modo de uso y/o modo de conservación. Usted debe basarse únicamente en la información que se muestra en nuestro sitio web y siempre debe leer las etiquetas, advertencias y instrucciones antes de usar el consumo de un producto. Información obtenida de HUEVO COLOR EXTRA LA CASTELLANA 12 UND Productos similares Huevo Blanco Grande Ver producto Huevo Color Grande Huevo Primera Color Huevos de Color Gallinas Libres Medianos Ecoterra 12 Un Huevo de Color Gallina Libre Huevo de Color Gallina Libre La Granja 6 Un Huevos de Color Gallinas Libre La Granja 12 Un Huevos Blanco Grande Yemita 12 Un HUEVO EXTRA BLANCO 12 UN COLIUMO HUEVOS COLOR GRAN 12 UN. YEM Huevos de Color Gallinas Libres Ecoterra 20 Un Huevos de Color Gallinas Libres Ecoterra 10 Un -28% Huevo Blanco Extra Grande Huevo Grande Gallina Libre HUEVO GRAN LIBRE PASTO CINTAZUL 12 UND ¡Juntos son mejores! Papa en Malla 2 Kg Papel Higiénico Elite Doble Hoja 8 x 50 mts Papa Granel KG Toalla de papel Nueva Doble Hoja 2 x 26 mts -19% Toalla de Papel Nuevo Doble Hoja 100 mts -13% Cebolla en Malla 1 Kg Cebolla a Granel Toalla de Papel Nueva Clásica 3 x 12 mts Tomate en Malla 1 Kg Toalla de papel Ultra Nova 70 Mts -18%",,,,,,"{""Descripción"": [""Huevos de Gallinas Libres 12 Un Extra Color La Castellana"", ""732g | Actualizado al: 27-05-2025"", ""Ingredientes: Huevo."", ""Alérgenos: Huevo."", ""Certificados: Apto para APLV"", ""Libre de Lactosa"", ""Vegetariano"", ""Libre de Soya"", ""Libre de Peces"", ""Libre de Mariscos"", ""Libre de Maní"", ""Libre de Frutos Secos"", ""Libre de Nueces"", ""Libre de Sulfitos"", ""Libre de Trigo"", ""Porción: 1 Huevo (57g)"", ""Porciones por envase: 12"", ""100g"", ""1 Porción"", ""Energía"", ""(kCal)"", ""149"", ""84.9"", ""Proteínas"", ""(g)"", ""12"", ""6.8"", ""Grasas Totales"", ""9.8"", ""5.6"", ""Grasas saturadas (g)"", ""3.7"", ""2.1"", ""Grasas monoinsaturadas (g)"", ""2.8"", ""1.6"", ""Grasas poliinsaturadas (g)"", ""1.4"", ""0.8"", ""Grasas trans (g)"", ""0.1"", ""Colesterol"", ""(mg)"", ""370"", ""210.9"", ""Hidratos de carbono disponibles"", ""Azúcar total (g)"", ""0.48"", ""0.3"", ""Sodio"", ""150"", ""85.5"", ""Importante: La información del empaque y/o contenido del producto final puede diferir respecto a lo que mostramos en nuestro sitio web, tanto a nivel de ingredientes, trazas, información nutricional, sellos, modo de uso y/o modo de conservación. Usted debe basarse únicamente en la información que se muestra en nuestro sitio web y siempre debe leer las etiquetas, advertencias y instrucciones antes de usar el consumo de un producto."", ""Información obtenida de"", ""HUEVO COLOR EXTRA LA CASTELLANA 12 UND"", ""Productos similares"", ""Huevo Blanco Grande"", ""Ver producto"", ""Huevo Color Grande"", ""Huevo Primera Color"", ""Huevos de Color Gallinas Libres Medianos Ecoterra 12 Un"", ""Huevo de Color Gallina Libre"", ""Huevo de Color Gallina Libre La Granja 6 Un"", ""Huevos de Color Gallinas Libre La Granja 12 Un"", ""Huevos Blanco Grande Yemita 12 Un"", ""HUEVO EXTRA BLANCO 12 UN COLIUMO"", ""HUEVOS COLOR GRANDE 12 UN. YEM"", ""Huevos de Color Gallinas Libres Ecoterra 20 Un"", ""Huevos de Color Gallinas Libres Ecoterra 10 Un"", ""-28%"", ""Huevo Blanco Extra Grande"", ""Huevo Grande Gallina Libre"", ""HUEVO GRAN LIBRE PASTO CINTAZUL 12 UND"", ""¡Juntos son mejores!"", ""Papa en Malla 2 Kg"", ""Papel Higiénico Elite Doble Hoja 8 x 50 mts"", ""Papa a Granel"", ""KG"", ""Toalla de Papel Nova Doble Hoja 2 x 26 mts"", ""-19%"", ""Toalla de Papel Nova Doble Hoja 100 mts"", ""-13%"", ""Cebolla en Malla 1 Kg"", ""Cebolla a Granel"", ""Toalla de papel Nueva Clásica 3 x 12 mts"", ""Tomate en Malla 1 Kg"", ""Toalla de Papel Ultra Nova 70 Mts"", ""-18%""]}",dataset/txt_limpios/1754.txt,dataset/paginas_descargadas/1754.html,ET,azucar,keep,0.60,heuristic_default
1755,Fiambres y Huevos,HUEVO GALLI LIB CERT BIEN ANI 648 G 12UN Productos similares Huevos de Color Gallinas Libre La Granja 12 Un Ver producto HUEVOS COLOR GRANDE 12 UN. YEM Huevos de Color Gallinas Libres Ecoterra 10 Un -28% Huevos de Color Gallinas Libres Ecoterra 20 Un HUEVO EXTRA BLANCO 12 UN COLIUMO Huevo Color Grande Huevo Primera Color Huevos Blanco Grande Yemita 12 Un Huevo Gallina Libre Huevos Blancos Grandes Don Vicho 12 Un Huevos de Color Grandes Don Vicho 12 Un Huevo Blanco Grande Huevo Grande Gallina Libre Huevo Grande Blanco Huevo de Color Gallina Libre ¡Juntos son mejores! Papa en Malla 2 Kg Cebolla a Granel KG Papa a Granel Cebolla en Malla 1 Kg Tomate en Malla 1 Kg Zanahoria en Bolsa 1 Kg Zanahoria Jugo en Bolsa 1 Kg,Huevos > 648 G,5.9,,,Desconocido,unknown,UNKNOWN,Fiambres y Huevos,Huevos,,648 G,5.90,,,5.90,5.9,False,original,5.9,5.9,1.0,default_1usd,,HUEVO GALLI LIB CERT BIEN ANI 648 G 12UN Productos similares Huevos de Color Gallinas Libre La Granja 12 Un Ver producto HUEVOS COLOR GRANDE 12 UN. YEM Huevos de Color Gallinas Libres Ecoterra 10 Un -28% Huevos de Color Gallinas Libres Ecoterra 20 Un HUEVO EXTRA BLANCO 12 UN COLIUMO Huevo Color Grande Huevo Primera Color Huevos Blanco Grande Yemita 12 Un Huevo Gallina Libre Huevos Blancos Grandes Don Vicho 12 Un Huevos de Color Grandes Don Vicho 12 Un Huevo Blanco Grande Huevo Grande Gallina Libre Huevo Grande Blanco Huevo de Color Gallina Libre ¡Juntos son mejores! Papa en Malla 2 Kg Cebolla a Granel KG Papa a Granel Cebolla en Malla 1 Kg Tomate en Malla 1 Kg Zanahoria en Bolsa 1 Kg Zanahoria Jugo en Bolsa 1 Kg,,,,,,"{""Descripción"": [""HUEVO GALLI LIB CERT BIEN ANI 648 G 12UN"", ""Productos similares"", ""Huevos de Color Gallinas Libre La Granja 12 Un"", ""Ver producto"", ""HUEVOS COLOR GRANDE 12 UN. YEM"", ""Huevos de Color Gallinas Libres Ecoterra 10 Un"", ""-28%"", ""Huevos de Color Gallinas Libres Ecoterra 20 Un"", ""HUEVO EXTRA BLANCO 12 UN COLIUMO"", ""Huevo Color Grande"", ""Huevo Primera Color"", ""Huevos Blanco Grande Yemita 12 Un"", ""Huevo Gallina Libre"", ""Huevos Blancos Grandes Don Vicho 12 Un"", ""Huevos de Color Grandes Don Vicho 12 Un"", ""Huevo Blanco Grande"", ""Huevo Grande Gallina Libre"", ""Huevo Grande Blanco"", ""Huevo de Color Gallina Libre"", ""¡Juntos son mejores!"", ""Papa en Malla 2 Kg"", ""Cebolla a Granel"", ""KG"", ""Papa a Granel"", ""Cebolla en Malla 1 Kg"", ""Tomate en Malla 1 Kg"", ""Zanahoria en Bolsa 1 Kg"", ""Zanahoria Jugo en Bolsa 1 Kg""]}",dataset/txt_limpios/1755.txt,dataset/paginas_descargadas/1755.html,EN,huevo,discard,0.30,heuristic_default
753,Filtrado por,,Limpiar filtros,7.9,,,Desconocido,unknown,UNKNOWN,Filtrado por,Limpiar filtros,,,7.90,,$,$7.90,7.9,False,original,7.9,7.9,1.0,default_1usd,,,,,,,,{},dataset/txt_limpios/753.txt,dataset/paginas_descargadas/753.html,EN,sin_categoria,discard,0.30,no_category_detected
320,Frijones Negro 1 Kg Camil,,Descripción > 1 Kg,15.99,BRL,,Desconocido,unknown,BR,Frijones Negro 1 Kg Camil,Descripción,,1 Kg,15.99,BRL,R$,"R$15,99",15.99,False,original,2.935,2.935,5.448,from_brasil_cambio_dolar,,,,,,,,{},dataset/txt_limpios/320.txt,dataset/paginas_descargadas/320.html,ET,sin_categoria,discard,0.30,no_category_detected
1710,Frutas y Verduras,PAPA (GRANEL) ¡Juntos son mejores! Cebolla Granel Ver producto Zapallo en Trozo UN Zapallo Picado en Bolsa 500 g Ajo Zapallo Cubito en Bolsa 500 g Pimentón Verde Ajo en Malla 2 Un Zanahoria en Bolsa 1 Kg Cebolla en Malla 1 Kg Zanahoria Jugo en Bolsa 1 Kg Ajo Desgranado en Malla 150 g,Verduras > 500 g,1.69,,,Desconocido,unknown,UNKNOWN,Frutas y Verduras,Verduras,,500 g,1.69,,,1.69,1.69,False,original,1.69,1.69,1.0,default_1usd,,PAPA (GRANEL) ¡Juntos son mejores! Cebolla Granel Ver producto Zapallo en Trozo UN Zapallo Picado en Bolsa 500 g Ajo Zapallo Cubito en Bolsa 500 g Pimentón Verde Ajo en Malla 2 Un Zanahoria en Bolsa 1 Kg Cebolla en Malla 1 Kg Zanahoria Jugo en Bolsa 1 Kg Ajo Desgranado en Malla 150 g,,,,,,"{""Descripción"": [""PAPA (GRANEL)"", ""¡Juntos son mejores!"", ""Cebolla a Granel"", ""Ver producto"", ""Zapallo en Trozo"", ""UN"", ""Zapallo Picado en Bolsa 500 g"", ""Ajo"", ""Zapallo Cubito en Bolsa 500 g"", ""Pimentón Verde"", ""Ajo en Malla 2 Un"", ""Zanahoria en Bolsa 1 Kg"", ""Cebolla en Malla 1 Kg"", ""Zanahoria Jugo en Bolsa 1 Kg"", ""Ajo Desgranado en Malla 150 g""]}",dataset/txt_limpios/1710.txt,dataset/paginas_descargadas/1710.html,ET,cebolla,keep,0.60,heuristic_default
1734,Frutas y Verduras,"TOMATE LARGA VIDA Productos similares Tomate Beef Granel Ver producto ¡Juntos son mejores! Cebolla Granel Pepino Ensalada UN Ají Verde Extra Granel Cebolla en Malla 1 Kg Papa en Malla 2 Kg Papa Granel Advertencias de almacenamiento | Almacenar en un lugar fresco, seco y alejado del calor",Verduras > 1 Kg,2.19,,,Desconocido,unknown,UNKNOWN,Frutas y Verduras,Verduras,,1 Kg,2.19,,,2.19,2.19,False,original,2.19,2.19,1.0,default_1usd,,TOMATE LARGA VIDA Productos similares Tomate Beef Granel Ver producto ¡Juntos son mejores! Cebolla Granel Pepino Ensalada UN Ají Verde Extra Granel Cebolla en Malla 1 Kg Papa en Malla 2 Kg Papa Granel,,"Advertencias de almacenamiento | Almacenar en un lugar fresco, seco y alejado del calor",,,,"{""Especificaciones"": [""Advertencias de almacenamiento"", ""Almacenar en un lugar fresco, seco y alejado del calor""], ""Descripción"": [""TOMATE LARGA VIDA"", ""Productos similares"", ""Tomate Beef a Granel"", ""Ver producto"", ""¡Juntos son mejores!"", ""Cebolla a Granel"", ""Pepino Ensalada"", ""UN"", ""Ají Verde Extra Granel"", ""Cebolla en Malla 1 Kg"", ""Papa en Malla 2 Kg"", ""Papa a Granel""]}",dataset/txt_limpios/1734.txt,dataset/paginas_descargadas/1734.html,ET,cebolla,keep,0.60,heuristic_default
1739,Frutas y Verduras,TOMATE REGY 250 GR Productos similares Tomate Cherry en Pote 250 g Ver producto Mix Tomate de Cocktail Rocky Pote 250 g Tomates Cocktail Tomateens Pote 100 g Tomate Cherry Cocktail Envasado 250 g ¡Juntos son mejores! Albahaca Selección Envasada 30 g Albahaca en Bolsa 100 g FRUTILLA POTE 300 GRS Lechuga Hidropónica Llollo Rosa Lechuga Hidropónica Española Lechuga Hidropónica Llollo Bionda Lechuga Roble,Verduras > 250 g,1.92,,,Desconocido,unknown,UNKNOWN,Frutas y Verduras,Verduras,,250 g,1.92,,,1.92,1.92,False,original,1.92,1.92,1.0,default_1usd,,TOMATE REGY 250 GR Productos similares Tomate Cherry en Pote 250 g Ver producto Mix Tomate de Cocktail Rocky Pote 250 g Tomates Cocktail Tomateens Pote 100 g Tomate Cherry Cocktail Envasado 250 g ¡Juntos son mejores! Albahaca Selección Envasada 30 g Albahaca en Bolsa 100 g FRUTILLA POTE 300 GRS Lechuga Hidropónica Llollo Rosa Lechuga Hidropónica Española Lechuga Hidropónica Llollo Bionda Lechuga Roble,,,,,,"{""Descripción"": [""TOMATE REGY 250 GR"", ""Productos similares"", ""Tomate Cherry en Pote 250 g"", ""Ver producto"", ""Mix Tomate de Cocktail Rocky Pote 250 g"", ""Tomates de Cocktail Tomateens Pote 100 g"", ""Tomate Cherry Cocktail Envasado 250 g"", ""¡Juntos son mejores!"", ""Albahaca Selección Envasada 30 g"", ""Albahaca en Bolsa 100 g"", ""FRUTILLA POTE 300 GRS"", ""Lechuga Hidropónica Llollo Rosa"", ""Lechuga Hidropónica Española"", ""Lechuga Hidropónica Llollo Bionda"", ""Lechuga Roble""]}",dataset/txt_limpios/1739.txt,dataset/paginas_descargadas/1739.html,ET,tomates,keep,0.60,heuristic_default
39,Frutas y verduras,"Cebolla Blanca por kilo. Las verduras son un complemento necesario para la comida diaria, ya que aportan una gran variedad de nutrientes que tu cuerpo necesita. Las verduras contribuyen con vitaminas y minerales, además de proporcionar agua al cuerpo. También contienen fibra, antioxidantes y algunas de ellas un alto contenido en potasio lo que te ayuda a eliminar el exceso de líquidos en el cuerpo. Todos estos valores agregados de las verduras las hacen ser importantes para el sano cuidado de la salud. Encuentra todo tipo de verduras y frutas en Chedraui. com",Verduras > 3102851,,MXN,,Chedraui,unknown,MX,Frutas y verduras,Verduras,3102851.0,,,MXN,,,12679.94,True,category_mean,,680.985,18.62,from_mexico_cambio_dolar,Cebolla Blanca por kilo.,,,"Las verduras son un complemento necesario para la comida diaria, ya que aportan una gran variedad de nutrientes que tu cuerpo necesita. Las verduras contribuyen con vitaminas y minerales, además de proporcionar agua al cuerpo. También contienen fibra, antioxidantes y algunas de ellas un alto contenido en potasio lo que te ayuda a eliminar el exceso de líquidos en el cuerpo. Todos estos valores agregados de las verduras las hacen ser importantes para el sano cuidado de la salud. Encuentra todo tipo de verduras y frutas en Chedraui. com",,,,"{""Información"": [""Cebolla Blanca por kilo.""], ""Especificaciones"": [""Las verduras son un complemento necesario para la comida diaria, ya que aportan una gran variedad de nutrientes que tu cuerpo necesita. Las verduras contribuyen con vitaminas y minerales, además de proporcionar agua al cuerpo. También contienen fibra, antioxidantes y algunas de ellas un alto contenido en potasio lo que te ayuda a eliminar el exceso de líquidos en el cuerpo. Todos estos valores agregados de las verduras las hacen ser importantes para el sano cuidado de la salud. Encuentra todo tipo de verduras y frutas en Chedraui. com""]}",dataset/txt_limpios/39.txt,dataset/paginas_descargadas/39.html,ET,cebolla,discard,0.60,price_parse_failed;price<=0
538,Frutas Y Verduras,,Verduras > 2.25 L,2300.0,,,Desconocido,unknown,UNKNOWN,Frutas Y Verduras,Verduras,,2.25 L,2300.00,,$,"$2.300,00",2300.0,False,original,2300.0,2300.0,1.0,default_1usd,,,"Últimos consultados | Gaseosa PRITTY Limón Botella 2.25 L | Ver planes de cuotas | 20%DTO | Gaseosa Cola Cunnington 1500cmq | PRECIO CON 20%DTO | 25%DTO | Gaseosa PASO DE LOS TOROS Botella 2.25 L | PRECIO CON 25%DTO | LLEVANDO 2 | 2X1 | Gaseosa Cola Pepsi 2l | PRECIO CON 2X1 | NO ACUMULABLE CON OTRAS PROMOS | Gaseosa Coca-Cola Sabor Original 2,25 Lt | PRECIO CON 50% 2DA",,,,,"{""Características"": [""Últimos consultados"", ""Gaseosa PRITTY Limón Botella 2.25 L"", ""Ver planes de cuotas"", ""20%DTO"", ""Gaseosa Cola Cunnington 1500cmq"", ""PRECIO CON 20%DTO"", ""25%DTO"", ""Gaseosa PASO DE LOS TOROS    Botella 2.25 L"", ""PRECIO CON 25%DTO"", ""LLEVANDO 2"", ""2X1"", ""Gaseosa Cola Pepsi 2l"", ""PRECIO CON 2X1"", ""NO ACUMULABLE CON OTRAS PROMOS"", ""Gaseosa Coca-Cola Sabor Original 2,25 Lt"", ""PRECIO CON 50% 2DA""]}",dataset/txt_limpios/538.txt,dataset/paginas_descargadas/538.html,ET,sin_categoria,discard,0.30,no_category_detected
539,Frutas Y Verduras,,Verduras > 500g,599.0,,,Desconocido,unknown,UNKNOWN,Frutas Y Verduras,Verduras,,500g,599.00,,$,"$599,00",599.0,False,original,599.0,599.0,1.0,default_1usd,,,MARCA | : SANTA MARIA | Últimos consultados | NO ACUMULABLE CON OTRAS PROMOS | Papa Negra Selección X Kg | OFERTA | Ver planes de cuotas | Gaseosa PRITTY Limón Botella 2.25 L | 20%DTO | Gaseosa Cola Cunnington 1500cmq | PRECIO CON 20%DTO | 25%DTO | Gaseosa PASO DE LOS TOROS Botella 2.25 L | PRECIO CON 25%DTO | LLEVANDO 2 | 2X1 | Gaseosa Cola Pepsi 2l | PRECIO CON 2X1,,,,,"{""Características"": [""MARCA"", "": SANTA MARIA"", ""Últimos consultados"", ""NO ACUMULABLE CON OTRAS PROMOS"", ""Papa Negra Selección X Kg"", ""OFERTA"", ""Ver planes de cuotas"", ""Gaseosa PRITTY Limón Botella 2.25 L"", ""20%DTO"", ""Gaseosa Cola Cunnington 1500cmq"", ""PRECIO CON 20%DTO"", ""25%DTO"", ""Gaseosa PASO DE LOS TOROS    Botella 2.25 L"", ""PRECIO CON 25%DTO"", ""LLEVANDO 2"", ""2X1"", ""Gaseosa Cola Pepsi 2l"", ""PRECIO CON 2X1""]}",dataset/txt_limpios/539.txt,dataset/paginas_descargadas/539.html,ET,sin_categoria,discard,0.30,no_category_detected
540,Frutas Y Verduras,,Verduras > 600 Gr,3049.0,,,Desconocido,unknown,UNKNOWN,Frutas Y Verduras,Verduras,,600 Gr,3049.00,,$,"$3.049,00",3049.0,False,original,3049.0,3049.0,1.0,default_1usd,,,MARCA | : SUEÑO VERDE | Últimos consultados | NO ACUMULABLE CON OTRAS PROMOS | Papa Natural Cortada Precocida Santa Maria 500g | OFERTA | Ver planes de cuotas | Papa Negra Selección X Kg | Gaseosa PRITTY Limón Botella 2.25 L | 20%DTO | Gaseosa Cola Cunnington 1500cmq | PRECIO CON 20%DTO | 25%DTO | Gaseosa PASO DE LOS TOROS Botella 2.25 L | PRECIO CON 25%DTO,,,,,"{""Características"": [""MARCA"", "": SUEÑO VERDE"", ""Últimos consultados"", ""NO ACUMULABLE CON OTRAS PROMOS"", ""Papa Natural Cortada Precocida Santa Maria 500g"", ""OFERTA"", ""Ver planes de cuotas"", ""Papa Negra Selección X Kg"", ""Gaseosa PRITTY Limón Botella 2.25 L"", ""20%DTO"", ""Gaseosa Cola Cunnington 1500cmq"", ""PRECIO CON 20%DTO"", ""25%DTO"", ""Gaseosa PASO DE LOS TOROS    Botella 2.25 L"", ""PRECIO CON 25%DTO""]}",dataset/txt_limpios/540.txt,dataset/paginas_descargadas/540.html,ET,sin_categoria,discard,0.30,no_category_detected
541,Frutas Y Verduras,,Verduras > 600 Gr,7999.0,,,Desconocido,unknown,UNKNOWN,Frutas Y Verduras,Verduras,,600 Gr,7999.00,,$,"$7.999,00",7999.0,False,original,7999.0,7999.0,1.0,default_1usd,,,Últimos consultados | NO ACUMULABLE CON OTRAS PROMOS | Papas Andinas SUEÑO VERDE X 600 Gr | OFERTA | Ver planes de cuotas | Papa Natural Cortada Precocida Santa Maria 500g | Papa Negra Selección X Kg | Gaseosa PRITTY Limón Botella 2.25 L | 20%DTO | Gaseosa Cola Cunnington 1500cmq | PRECIO CON 20%DTO,,,,,"{""Características"": [""Últimos consultados"", ""NO ACUMULABLE CON OTRAS PROMOS"", ""Papas Andinas SUEÑO VERDE X 600 Gr"", ""OFERTA"", ""Ver planes de cuotas"", ""Papa Natural Cortada Precocida Santa Maria 500g"", ""Papa Negra Selección X Kg"", ""Gaseosa PRITTY Limón Botella 2.25 L"", ""20%DTO"", ""Gaseosa Cola Cunnington 1500cmq"", ""PRECIO CON 20%DTO""]}",dataset/txt_limpios/541.txt,dataset/paginas_descargadas/541.html,ET,sin_categoria,discard,0.30,no_category_detected
