{"source_id": "1206", "title": "Cambio de modalidad", "description": "", "breadcrumbs": "jainernieto@gmail. com. > 10 unidades", "price_raw": "18.99", "currency_raw": "PEN", "url": "", "seller": "Desconocido", "availability": "unknown", "country": "PE", "product_name": "Cambio de modalidad", "brand": "jainernieto@gmail.com.", "reference": "", "unit": "10 unidades", "price_amount": 18.99, "price_currency": "PEN", "price_symbol": "S/", "price_text": "S/18.99", "price_amount_filled": "18.99", "price_is_imputed": "False", "price_imputation_source": "original", "price_amount_usd": "5.3493", "price_amount_usd_filled": "5.3493", "fx_rate_local_per_usd": "3.55", "fx_source": "from_peru_cambio_dolar", "information_text": "", "description_text": "", "features_text": "", "specifications_text": "", "benefits_text": "", "details_text": "", "other_sections": "", "sections": {}, "txt_path": "dataset/txt_limpios/1206.txt", "html_path": "dataset/paginas_descargadas/1206.html", "es_status": "ET", "category_canonical": "sin_categoria", "decision": "discard", "match_score": 0.3, "reasons": "no_category_detected"}
{"source_id": "1210", "title": "Cambio de modalidad", "description": "", "breadcrumbs": "jainernieto@gmail. com. > 10 unidades", "price_raw": "18.99", "currency_raw": "PEN", "url": "", "seller": "Desconocido", "availability": "unknown", "country": "PE", "product_name": "Cambio de modalidad", "brand": "jainernieto@gmail.com.", "reference": "", "unit": "10 unidades", "price_amount": 18.99, "price_currency": "PEN", "price_symbol": "S/", "price_text": "S/18.99", "price_amount_filled": "18.99", "price_is_imputed": "False", "price_imputation_source": "original", "price_amount_usd": "5.3493", "price_amount_usd_filled": "5.3493", "fx_rate_local_per_usd": "3.55", "fx_source": "from_peru_cambio_dolar", "information_text": "", "description_text": "", "features_text": "", "specifications_text": "", "benefits_text": "", "details_text": "", "other_sections": "", "sections": {}, "txt_path": "dataset/txt_limpios/1210.txt", "html_path": "dataset/paginas_descargadas/1210.html", "es_status": "ET", "category_canonical": "sin_categoria", "decision": "discard", "match_score": 0.3, "reasons": "no_category_detected"}
{"source_id": "1220", "title": "Cambio de modalidad", "description": "", "breadcrumbs": "jainernieto@gmail. com. > 10 unidades", "price_raw": "18.99", "currency_raw": "PEN", "url": "", "seller": "Desconocido", "availability": "unknown", "country": "PE", "product_name": "Cambio de modalidad", "brand": "jainernieto@gmail.com.", "reference": "", "unit": "10 unidades", "price_amount": 18.99, "price_currency": "PEN", "price_symbol": "S/", "price_text": "S/18.99", "price_amount_filled": "18.99", "price_is_imputed": "False", "price_imputation_source": "original", "price_amount_usd": "5.3493", "price_amount_usd_filled": "5.3493", "fx_rate_local_per_usd": "3.55", "fx_source": "from_peru_cambio_dolar", "information_text": "", "description_text": "", "features_text": "", "specifications_text": "", "benefits_text": "", "details_text": "", "other_sections": "", "sections": {}, "txt_path": "dataset/txt_limpios/1220.txt", "html_path": "dataset/paginas_descargadas/1220.html", "es_status": "ET", "category_canonical": "sin_categoria", "decision": "discard", "match_score": 0.3, "reasons": "no_category_detected"}
{"source_id": "1235", "title": "Cambio de modalidad", "description": "", "breadcrumbs": "jainernieto@gmail. com. > 10 unidades", "price_raw": "18.99", "currency_raw": "PEN", "url": "", "seller": "Desconocido", "availability": "unknown", "country": "PE", "product_name": "Cambio de modalidad", "brand": "jainernieto@gmail.com.", "reference": "", "unit": "10 unidades", "price_amount": 18.99, "price_currency": "PEN", "price_symbol": "S/", "price_text": "S/18.99", "price_amount_filled": "18.99", "price_is_imputed": "False", "price_imputation_source": "original", "price_amount_usd": "5.3493", "price_amount_usd_filled": "5.3493", "fx_rate_local_per_usd": "3.55", "fx_source": "from_peru_cambio_dolar", "information_text": "", "description_text": "", "features_text": "", "specifications_text": "", "benefits_text": "", "details_text": "", "other_sections": "", "sections": {}, "txt_path": "dataset/txt_limpios/1235.txt", "html_path": "dataset/paginas_descargadas/1235.html", "es_status": "ET", "category_canonical": "sin_categoria", "decision": "discard", "match_score": 0.3, "reasons": "no_category_detected"}
{"source_id": "1236", "title": "Cambio de modalidad", "description": "", "breadcrumbs": "jainernieto@gmail. com. > 10 unidades", "price_raw": "18.99", "currency_raw": "PEN", "url": "", "seller": "Desconocido", "availability": "unknown", "country": "PE", "product_name": "Cambio de modalidad", "brand": "jainernieto@gmail.com.", "reference": "", "unit": "10 unidades", "price_amount": 18.99, "price_currency": "PEN", "price_symbol": "S/", "price_text": "S/18.99", "price_amount_filled": "18.99", "price_is_imputed": "False", "price_imputation_source": "original", "price_amount_usd": "5.3493", "price_amount_usd_filled": "5.3493", "fx_rate_local_per_usd": "3.55", "fx_source": "from_peru_cambio_dolar", "information_text": "", "description_text": "", "features_text": "", "specifications_text": "", "benefits_text": "", "details_text": "", "other_sections": "", "sections": {}, "txt_path": "dataset/txt_limpios/1236.txt", "html_path": "dataset/paginas_descargadas/1236.html", "es_status": "ET", "category_canonical": "sin_categoria", "decision": "discard", "match_score": 0.3, "reasons": "no_category_detected"}
{"source_id": "1240", "title": "Cambio de modalidad", "description": "", "breadcrumbs": "jainernieto@gmail. com. > 10 unidades", "price_raw": "18.99", "currency_raw": "PEN", "url": "", "seller": "Desconocido", "availability": "unknown", "country": "PE", "product_name": "Cambio de modalidad", "brand": "jainernieto@gmail.com.", "reference": "", "unit": "10 unidades", "price_amount": 18.99, "price_currency": "PEN", "price_symbol": "S/", "price_text": "S/18.99", "price_amount_filled": "18.99", "price_is_imputed": "False", "price_imputation_source": "original", "price_amount_usd": "5.3493", "price_amount_usd_filled": "5.3493", "fx_rate_local_per_usd": "3.55", "fx_source": "from_peru_cambio_dolar", "information_text": "", "description_text": "", "features_text": "", "specifications_text": "", "benefits_text": "", "details_text": "", "other_sections": "", "sections": {}, "txt_path": "dataset/txt_limpios/1240.txt", "html_path": "dataset/paginas_descargadas/1240.html", "es_status": "ET", "category_canonical": "sin_categoria", "decision": "discard", "match_score": 0.3, "reasons": "no_category_detected"}
{"source_id": "643", "title": "Cebolla Blanca  1  und", "description": "", "breadcrumbs": "(", "price_raw": "", "currency_raw": "", "url": "", "seller": "Desconocido", "availability": "unknown", "country": "UNKNOWN", "product_name": "Cebolla Blanca  1  und", "brand": "(", "reference": "", "unit": "", "price_amount": null, "price_currency": "", "price_symbol": "", "price_text": "", "price_amount_filled": "680.98", "price_is_imputed": "True", "price_imputation_source": "category_country_mean", "price_amount_usd": "", "price_amount_usd_filled": "680.985", "fx_rate_local_per_usd": "1.0", "fx_source": "default_1usd", "information_text": "", "description_text": "", "features_text": "", "specifications_text": "", "benefits_text": "", "details_text": "", "other_sections": "", "sections": {}, "txt_path": "dataset/txt_limpios/643.txt", "html_path": "dataset/paginas_descargadas/643.html", "es_status": "EN", "category_canonical": "cebolla", "decision": "discard", "match_score": 0.6, "reasons": "price_parse_failed;price<=0"}
{"source_id": "800", "title": "CEBOLLA CABEZONA X 1000G", "description": "Nombre del producto: Cebolla Cabezona Descripción del producto: La cebolla cabezona es un ingrediente básico en la cocina, apreciado por su sabor característico y su versatilidad. Con una textura firme y una piel externa seca, es ideal para sufrir, asar, detener el uso como base en todo tipo de preparaciones. Aporta aroma y profundidad a tus platos favoritos, desde recetas tradicionales hasta creaciones más elaboradas. Presentación: 1000gr Modo de fabricación: Industrial Origen: Nacional Ver más También puede interesarte TOMATE CHONTO X 1000 G CEBOLLA LARGA 500 GR ZANAHORIA X 1000 G PIMENTÓN UNIDAD LIMON TAHITI X 1000 GR PLÁTANO X 1000G PAPA CAPIRA X 2500 G LECHUGA VERDE CRESPA X 180 G AJO MALLA 3 UNIDADES - 100 G D1 Top 100 BANANO UNIDAD", "breadcrumbs": "Unidades disponibles > 1000G", "price_raw": "1000.0", "currency_raw": "", "url": "", "seller": "Desconocido", "availability": "unknown", "country": "UNKNOWN", "product_name": "CEBOLLA CABEZONA X 1000G", "brand": "Unidades disponibles", "reference": "", "unit": "1000G", "price_amount": 1000.0, "price_currency": "", "price_symbol": "", "price_text": "1000", "price_amount_filled": "1000.0", "price_is_imputed": "False", "price_imputation_source": "original", "price_amount_usd": "1000.0", "price_amount_usd_filled": "1000.0", "fx_rate_local_per_usd": "1.0", "fx_source": "default_1usd", "information_text": "", "description_text": "Nombre del producto: Cebolla Cabezona Descripción del producto: La cebolla cabezona es un ingrediente básico en la cocina, apreciado por su sabor característico y su versatilidad. Con una textura firme y una piel externa seca, es ideal para sufrir, asar, detener el uso como base en todo tipo de preparaciones. Aporta aroma y profundidad a tus platos favoritos, desde recetas tradicionales hasta creaciones más elaboradas. Presentación: 1000gr Modo de fabricación: Industrial Origen: Nacional Ver más También puede interesarte TOMATE CHONTO X 1000 G CEBOLLA LARGA 500 GR ZANAHORIA X 1000 G PIMENTÓN UNIDAD LIMON TAHITI X 1000 GR PLÁTANO X 1000G PAPA CAPIRA X 2500 G LECHUGA VERDE CRESPA X 180 G AJO MALLA 3 UNIDADES - 100 G D1 Top 100 BANANO UNIDAD", "features_text": "", "specifications_text": "", "benefits_text": "", "details_text": "", "other_sections": "", "sections": {"Descripción": ["Nombre del producto: Cebolla Cabezona", "Descripción del producto: La cebolla cabezona es un ingrediente básico en la cocina, apreciado por su sabor característico y su versatilidad. Con una textura firme y una piel externa seca, es ideal para sufrir, asar, detener el uso como base en todo tipo de preparaciones.", "Aporta aroma y profundidad a tus platos favoritos, desde recetas tradicionales hasta creaciones más elaboradas.", "Presentación", ": 1000gr", "Modo de fabricación: Industrial", "Origen: Nacional", "Ver más", "También puede interesarte", "TOMATE CHONTO X 1000 G", "CEBOLLA LARGA 500 GR", "ZANAHORIA X 1000 G", "PIMENTÓN UNIDAD", "LIMON TAHITI X 1000 GR", "PLÁTANO X 1000G", "PAPA CAPIRA X 2500 G", "LECHUGA VERDE CRESPA X 180 G", "AJO MALLA 3 UNIDADES - 100 G", "D1 Top 100", "BANANO UNIDAD"]}, "txt_path": "dataset/txt_limpios/800.txt", "html_path": "dataset/paginas_descargadas/800.html", "es_status": "ET", "category_canonical": "cebolla", "decision": "keep", "match_score": 0.6, "reasons": "heuristic_default"}
{"source_id": "1150", "title": "Centro de preferencia de la privacidad", "description": "", "breadcrumbs": "Activas siempre > 750g", "price_raw": "", "currency_raw": "PEN", "url": "", "seller": "Desconocido", "availability": "unknown", "country": "PE", "product_name": "Centro de preferencia de la privacidad", "brand": "Activas siempre", "reference": "", "unit": "750g", "price_amount": null, "price_currency": "PEN", "price_symbol": "", "price_text": "", "price_amount_filled": "55.14", "price_is_imputed": "True", "price_imputation_source": "country_mean", "price_amount_usd": "", "price_amount_usd_filled": "15.5336", "fx_rate_local_per_usd": "3.55", "fx_source": "from_peru_cambio_dolar", "information_text": "", "description_text": "", "features_text": "TE RECOMENDAMOS | GRAN CHALAN | Arroz GRAN CHALAN Extra Añejo Bolsa 750gr | 5 | -16% | Arroz Añejo Extra COSTEÑO Bolsa 5kg | 29 | 60 | 24 | 16% | Arroz Extra GRAN CHALAN Bolsa 5Kg | 26 | 80 | FARAON | Arroz Extra FARAON Bolsa 750g | 50 | PAISANA | Arroz Extra PAISANA Bolsa 1Kg | 6 | BELL'S | Arroz Extra BELL'S Bolsa 5Kg | 21 | 40 | -2% | VALLENORTE | Arroz Extra VALLENORTE Gran Reserva Bolsa 750g | 2% | Arroz Extra COSTEÑO Bolsa 5Kg | -11% | Arroz Extra Añejo VALLENORTE Gran Reserva Bolsa 5Kg | 28 | 25 | 11% | Arroz Extra Añejo FARAON Naranja Bolsa 5kg | ¡Entérate de eventos exclusivos y promociones especiales que tenemos para ti! | SUSCRIBIRME | Acepto las políticas de tratamientos de datos personales | Razón Social: Compañía Food Retail S.A.C. RUC: 20608300393. Todos los derechos reservados Vivanda 2023. | | Hola! | Encuentra todo lo que necesitas en Vivanda online | Términos más buscados | 1. | quesos | 2. | vino | 3. | café | 4. | quark 500g | 5. | leche | 6. | pollo | 7. | yogurt | 8. | lunch florencia | 9. | agua | 10 | vinos", "specifications_text": "", "benefits_text": "", "details_text": "", "other_sections": "", "sections": {"Características": ["TE RECOMENDAMOS", "GRAN CHALAN", "Arroz GRAN CHALAN Extra Añejo Bolsa 750gr", "5", "-16%", "Arroz Añejo Extra COSTEÑO Bolsa 5kg", "29", "60", "24", "16%", "Arroz Extra GRAN CHALAN Bolsa 5Kg", "26", "80", "FARAON", "Arroz Extra FARAON Bolsa 750g", "50", "PAISANA", "Arroz Extra PAISANA Bolsa 1Kg", "6", "BELL'S", "Arroz Extra BELL'S Bolsa 5Kg", "21", "40", "-2%", "VALLENORTE", "Arroz Extra VALLENORTE Gran Reserva Bolsa 750g", "2%", "Arroz Extra COSTEÑO Bolsa 5Kg", "-11%", "Arroz Extra Añejo VALLENORTE Gran Reserva Bolsa 5Kg", "28", "25", "11%", "Arroz Extra Añejo FARAON Naranja Bolsa 5kg", "¡Entérate de eventos exclusivos y promociones especiales que tenemos para ti!", "SUSCRIBIRME", "Acepto las políticas de tratamiento de datos personales", "Razón social: Compañía Food Retail S.A.C. RUC: 20608300393. Todos los derechos reservados Vivanda 2023.", "¡Hola!", "Encuentra todo lo que necesitas en Vivanda online", "Términos más buscados", "1.", "quesos", "2.", "vino", "3.", "cafe", "4.", "quark 500g", "5.", "leche", "6.", "pollo", "7.", "yogurt", "8.", "lunch florencia", "9.", "agua", "10.", "vinos"]}, "txt_path": "dataset/txt_limpios/1150.txt", "html_path": "dataset/paginas_descargadas/1150.html", "es_status": "ET", "category_canonical": "sin_categoria", "decision": "discard", "match_score": 0.3, "reasons": "no_category_detected;price_parse_failed"}
{"source_id": "1151", "title": "Centro de preferencia de la privacidad", "description": "", "breadcrumbs": "Activas siempre > 750g", "price_raw": "", "currency_raw": "PEN", "url": "", "seller": "Desconocido", "availability": "unknown", "country": "PE", "product_name": "Centro de preferencia de la privacidad", "brand": "Activas siempre", "reference": "", "unit": "750g", "price_amount": null, "price_currency": "PEN", "price_symbol": "", "price_text": "", "price_amount_filled": "55.14", "price_is_imputed": "True", "price_imputation_source": "country_mean", "price_amount_usd": "", "price_amount_usd_filled": "15.5336", "fx_rate_local_per_usd": "3.55", "fx_source": "from_peru_cambio_dolar", "information_text": "", "description_text": "", "features_text": "TE RECOMENDAMOS | -3% | PAISANA | Arroz Extra PAISANA Bolsa 5Kg | 23 | 70 | 22 | 3% | GRAN CHALAN | Arroz Extra Gourmet Añejo GRAN CHALAN Paquete 5Kg | 26 | 60 | -16% | COSTENO | Arroz Añejo Extra COSTEÑO Bolsa 5kg | 29 | 24 | 16% | Arroz Extra GRAN CHALAN Bolsa 5Kg | FARAON | Arroz Extra FARAON Bolsa 750g | 50 | Arroz Blanco FARAON Extra Añejo Negro Bolsa 5Kg | No disponible | -2% | Arroz Extra COSTEÑO Bolsa 5Kg | Arroz Extra COSTEÑO Bolsa 750g | -11% | Arroz Extra Añejo VALLENORTE Gran Reserva Bolsa 5Kg | 28 | 25 | 40 | 11% | ¡Entérate de eventos exclusivos y promociones especiales que tenemos para ti! | SUSCRIBIRME | Acepto las políticas de tratamientos de datos personales | Razón Social: Compañía Food Retail S.A.C. RUC: 20608300393. Todos los derechos reservados Vivanda 2023. | | Hola! | Encuentra todo lo que necesitas en Vivanda online | Términos más buscados | 1. | quesos | 2. | vino | 3. | café | 4. | quark 500g | 5. | leche | 6. | pollo | 7. | yogurt | 8. | lunch florencia | 9. | agua | 10 | vinos", "specifications_text": "", "benefits_text": "", "details_text": "", "other_sections": "", "sections": {"Características": ["TE RECOMENDAMOS", "-3%", "PAISANA", "Arroz Extra PAISANA Bolsa 5Kg", "23", "70", "22", "3%", "GRAN CHALAN", "Arroz Extra Gourmet  Añejo GRAN CHALAN Paquete 5Kg", "26", "60", "-16%", "COSTENO", "Arroz Añejo Extra COSTEÑO Bolsa 5kg", "29", "24", "16%", "Arroz Extra GRAN CHALAN Bolsa 5Kg", "FARAON", "Arroz Extra FARAON Bolsa 750g", "50", "Arroz Blanco FARAON Extra Añejo Negro Bolsa 5Kg", "No disponible", "-2%", "Arroz Extra COSTEÑO Bolsa 5Kg", "Arroz Extra COSTEÑO Bolsa 750g", "-11%", "Arroz Extra Añejo VALLENORTE Gran Reserva Bolsa 5Kg", "28", "25", "40", "11%", "¡Entérate de eventos exclusivos y promociones especiales que tenemos para ti!", "SUSCRIBIRME", "Acepto las políticas de tratamiento de datos personales", "Razón social: Compañía Food Retail S.A.C. RUC: 20608300393. Todos los derechos reservados Vivanda 2023.", "¡Hola!", "Encuentra todo lo que necesitas en Vivanda online", "Términos más buscados", "1.", "quesos", "2.", "vino", "3.", "cafe", "4.", "quark 500g", "5.", "leche", "6.", "pollo", "7.", "yogurt", "8.", "lunch florencia", "9.", "agua", "10.", "vinos"]}, "txt_path": "dataset/txt_limpios/1151.txt", "html_path": "dataset/paginas_descargadas/1151.html", "es_status": "ET", "category_canonical": "sin_categoria", "decision": "discard", "match_score": 0.3, "reasons": "no_category_detected;price_parse_failed"}
{"source_id": "1152", "title": "Centro de preferencia de la privacidad", "description": "", "breadcrumbs": "Activas siempre > 1Kg", "price_raw": "", "currency_raw": "PEN", "url": "", "seller": "Desconocido", "availability": "unknown", "country": "PE", "product_name": "Centro de preferencia de la privacidad", "brand": "Activas siempre", "reference": "", "unit": "1Kg", "price_amount": null, "price_currency": "PEN", "price_symbol": "", "price_text": "", "price_amount_filled": "55.14", "price_is_imputed": "True", "price_imputation_source": "country_mean", "price_amount_usd": "", "price_amount_usd_filled": "15.5336", "fx_rate_local_per_usd": "3.55", "fx_source": "from_peru_cambio_dolar", "information_text": "", "description_text": "", "features_text": "TE RECOMENDAMOS | ¡Entérate de eventos exclusivos y promociones especiales que tenemos para ti! | SUSCRIBIRME | Acepto las políticas de tratamientos de datos personales | Razón Social: Compañía Food Retail S.A.C. RUC: 20608300393. Todos los derechos reservados Vivanda 2023. | | Hola! | Encuentra todo lo que necesitas en Vivanda online | Términos más buscados | 1. | quesos | 2. | vino | 3. | café | 4. | quark 500g | 5. | leche | 6. | pollo | 7. | yogurt | 8. | lunch florencia | 9. | agua | 10 | vinos", "specifications_text": "", "benefits_text": "", "details_text": "", "other_sections": "", "sections": {"Características": ["TE RECOMENDAMOS", "¡Entérate de eventos exclusivos y promociones especiales que tenemos para ti!", "SUSCRIBIRME", "Acepto las políticas de tratamiento de datos personales", "Razón social: Compañía Food Retail S.A.C. RUC: 20608300393. Todos los derechos reservados Vivanda 2023.", "¡Hola!", "Encuentra todo lo que necesitas en Vivanda online", "Términos más buscados", "1.", "quesos", "2.", "vino", "3.", "cafe", "4.", "quark 500g", "5.", "leche", "6.", "pollo", "7.", "yogurt", "8.", "lunch florencia", "9.", "agua", "10.", "vinos"]}, "txt_path": "dataset/txt_limpios/1152.txt", "html_path": "dataset/paginas_descargadas/1152.html", "es_status": "ET", "category_canonical": "sin_categoria", "decision": "discard", "match_score": 0.3, "reasons": "no_category_detected;price_parse_failed"}
