{"source_id": "831", "title": "Saltar menú Cenco", "description": "Ingredientes Condición alimentaria Información nutricional Tipo de Producto Huevo de Gallina Envase Bandeja País de Origen Chile Garantía Mínima Legal Válida hasta su fecha de caducidad Te podrían interesar Exclusivo online 20% dcto. Jumbo Artesanal Pan Molde Proteína Clean Label 780 g Cuisine & Co Leche Cuisine & Co Entera 1 L Soprole Mantequilla Soprole Untable Pote 350 g Centro de preferencia de privacidad Gestionar las preferencias de consentimiento Activas siempre Back Button Search Icon Filter Icon Clear checkbox label label Apply Cancel Consent Leg.Interest Permitir todas Rechazar todas Confirmar mis preferencias", "breadcrumbs": "Santa Marta > 780 g", "price_raw": "4.45", "currency_raw": "", "url": "", "seller": "Desconocido", "availability": "unknown", "country": "UNKNOWN", "product_name": "Saltar menú Cenco", "brand": "Santa Marta", "reference": "", "unit": "780 g", "price_amount": 4.45, "price_currency": "", "price_symbol": "$", "price_text": "$4.45", "price_amount_filled": "4.45", "price_is_imputed": "False", "price_imputation_source": "original", "price_amount_usd": "4.45", "price_amount_usd_filled": "4.45", "fx_rate_local_per_usd": "1.0", "fx_source": "default_1usd", "information_text": "", "description_text": "Ingredientes Condición alimentaria Información nutricional Tipo de Producto Huevo de Gallina Envase Bandeja País de Origen Chile Garantía Mínima Legal Válida hasta su fecha de caducidad Te podrían interesar Exclusivo online 20% dcto. Jumbo Artesanal Pan Molde Proteína Clean Label 780 g Cuisine & Co Leche Cuisine & Co Entera 1 L Soprole Mantequilla Soprole Untable Pote 350 g Centro de preferencia de privacidad Gestionar las preferencias de consentimiento Activas siempre Back Button Search Icon Filter Icon Clear checkbox label label Apply Cancel Consent Leg.Interest Permitir todas Rechazar todas Confirmar mis preferencias", "features_text": "", "specifications_text": "", "benefits_text": "", "details_text": "", "other_sections": "", "sections": {"Descripción": ["Ingredientes", "Condición alimentaria", "Información nutricional", "Tipo de Producto", "Huevo de Gallina", "Envase", "Bandeja", "País de origen", "Chile", "Garantía Mínima Legal", "Válida hasta su fecha de caducidad", "Te podrían interesar", "Exclusivo online", "20% dcto.", "Jumbo Artesanal", "Pan Molde Proteína Clean Label 780 g", "Cuisine & Co", "Leche Cuisine & Co Entera 1 L", "Soprole", "Mantequilla Soprole Untable Pote 350 g", "Centro de preferencia de privacidad", "Gestionar las preferencias de consentimiento", "Activas siempre", "Back Button", "Search Icon", "Filter Icon", "Clear", "checkbox label", "label", "Apply", "Cancel", "Consent", "Leg.Interest", "Permitir todas", "Rechazar todas", "Confirmar mis preferencias"]}, "txt_path": "dataset/txt_limpios/831.txt", "html_path": "dataset/paginas_descargadas/831.html", "es_status": "ET", "category_canonical": "descartado", "decision": "discard", "match_score": 0.1, "reasons": "excluded_keyword"}
{"source_id": "832", "title": "Saltar menú Cenco", "description": "Ingredientes Condición alimentaria Información nutricional Tipo de Producto Huevo de Gallina Número de Personas 6 o + Personas Envase Bandeja País de Origen Chile Tamaño del Huevo Grande Tamaño Familiar Almacenamiento Mantener en lugar fresco y seco Centro de preferencia de privacidad Gestionar las preferencias de consentimiento Activas siempre Back Button Search Icon Filter Icon Clear checkbox label label Apply Cancel Consent Leg.Interest Permitir todas Rechazar todas Confirmar mis preferencias", "breadcrumbs": "Coliumo", "price_raw": "3.99", "currency_raw": "", "url": "", "seller": "Desconocido", "availability": "unknown", "country": "UNKNOWN", "product_name": "Saltar menú Cenco", "brand": "Coliumo", "reference": "", "unit": "", "price_amount": 3.99, "price_currency": "", "price_symbol": "$", "price_text": "$3.99", "price_amount_filled": "3.99", "price_is_imputed": "False", "price_imputation_source": "original", "price_amount_usd": "3.99", "price_amount_usd_filled": "3.99", "fx_rate_local_per_usd": "1.0", "fx_source": "default_1usd", "information_text": "", "description_text": "Ingredientes Condición alimentaria Información nutricional Tipo de Producto Huevo de Gallina Número de Personas 6 o + Personas Envase Bandeja País de Origen Chile Tamaño del Huevo Grande Tamaño Familiar Almacenamiento Mantener en lugar fresco y seco Centro de preferencia de privacidad Gestionar las preferencias de consentimiento Activas siempre Back Button Search Icon Filter Icon Clear checkbox label label Apply Cancel Consent Leg.Interest Permitir todas Rechazar todas Confirmar mis preferencias", "features_text": "", "specifications_text": "", "benefits_text": "", "details_text": "", "other_sections": "", "sections": {"Descripción": ["Ingredientes", "Condición alimentaria", "Información nutricional", "Tipo de Producto", "Huevo de Gallina", "Número de Personas", "6 o + Personas", "Envase", "Bandeja", "País de origen", "Chile", "Tamaño del Huevo", "Grande", "Tamaño", "Familiar", "Almacenamiento", "Mantener en lugar fresco y seco", "Centro de preferencia de privacidad", "Gestionar las preferencias de consentimiento", "Activas siempre", "Back Button", "Search Icon", "Filter Icon", "Clear", "checkbox label", "label", "Apply", "Cancel", "Consent", "Leg.Interest", "Permitir todas", "Rechazar todas", "Confirmar mis preferencias"]}, "txt_path": "dataset/txt_limpios/832.txt", "html_path": "dataset/paginas_descargadas/832.html", "es_status": "ET", "category_canonical": "huevo", "decision": "discard", "match_score": 0.3, "reasons": "heuristic_default"}
{"source_id": "833", "title": "Saltar menú Cenco", "description": "Ingredientes Condición alimentaria Información nutricional Tipo de Producto Huevo de Gallina Libre/Feliz Envase Bandeja País de Origen Chile Te podrían interesar Centro de preferencia de privacidad Gestionar las preferencias de consentimiento Activas siempre Back Button Search Icon Filter Icon Clear checkbox label label Apply Cancel Consent Leg.Interest Permitir todas Rechazar todas Confirmar mis preferencias", "breadcrumbs": "Ecoterra", "price_raw": "5.89", "currency_raw": "", "url": "", "seller": "Desconocido", "availability": "unknown", "country": "UNKNOWN", "product_name": "Saltar menú Cenco", "brand": "Ecoterra", "reference": "", "unit": "", "price_amount": 5.89, "price_currency": "", "price_symbol": "$", "price_text": "$5.89", "price_amount_filled": "5.89", "price_is_imputed": "False", "price_imputation_source": "original", "price_amount_usd": "5.89", "price_amount_usd_filled": "5.89", "fx_rate_local_per_usd": "1.0", "fx_source": "default_1usd", "information_text": "", "description_text": "Ingredientes Condición alimentaria Información nutricional Tipo de Producto Huevo de Gallina Libre/Feliz Envase Bandeja País de Origen Chile Te podrían interesar Centro de preferencia de privacidad Gestionar las preferencias de consentimiento Activas siempre Back Button Search Icon Filter Icon Clear checkbox label label Apply Cancel Consent Leg.Interest Permitir todas Rechazar todas Confirmar mis preferencias", "features_text": "", "specifications_text": "", "benefits_text": "", "details_text": "", "other_sections": "", "sections": {"Descripción": ["Ingredientes", "Condición alimentaria", "Información nutricional", "Tipo de Producto", "Huevo de Gallina Libre/Feliz", "Envase", "Bandeja", "País de origen", "Chile", "Te podrían interesar", "Centro de preferencia de privacidad", "Gestionar las preferencias de consentimiento", "Activas siempre", "Back Button", "Search Icon", "Filter Icon", "Clear", "checkbox label", "label", "Apply", "Cancel", "Consent", "Leg.Interest", "Permitir todas", "Rechazar todas", "Confirmar mis preferencias"]}, "txt_path": "dataset/txt_limpios/833.txt", "html_path": "dataset/paginas_descargadas/833.html", "es_status": "ET", "category_canonical": "huevo", "decision": "discard", "match_score": 0.3, "reasons": "heuristic_default"}
{"source_id": "834", "title": "Saltar menú Cenco", "description": "Tipo de Producto Pollo Te podrían interesar Kryzpo Papas Fritas Kryzpo Original 130 g Frutas y Verduras Propias Lechuga Escarola 1 un. 3.4 Exclusivo online Pomarola Salsa de Tomate Pomarola 200 g 6 un. Centro de preferencia de privacidad Gestionar las preferencias de consentimiento Activas siempre Back Button Search Icon Filter Icon Clear checkbox label label Apply Cancel Consent Leg.Interest Permitir todas Rechazar todas Confirmar mis preferencias", "breadcrumbs": "Ariztía > 480 g", "price_raw": "8.78", "currency_raw": "", "url": "", "seller": "Desconocido", "availability": "unknown", "country": "UNKNOWN", "product_name": "Saltar menú Cenco", "brand": "Ariztía", "reference": "", "unit": "480 g", "price_amount": 8.78, "price_currency": "", "price_symbol": "$", "price_text": "$8.78", "price_amount_filled": "8.78", "price_is_imputed": "False", "price_imputation_source": "original", "price_amount_usd": "8.78", "price_amount_usd_filled": "8.78", "fx_rate_local_per_usd": "1.0", "fx_source": "default_1usd", "information_text": "", "description_text": "Tipo de Producto Pollo Te podrían interesar Kryzpo Papas Fritas Kryzpo Original 130 g Frutas y Verduras Propias Lechuga Escarola 1 un. 3.4 Exclusivo online Pomarola Salsa de Tomate Pomarola 200 g 6 un. Centro de preferencia de privacidad Gestionar las preferencias de consentimiento Activas siempre Back Button Search Icon Filter Icon Clear checkbox label label Apply Cancel Consent Leg.Interest Permitir todas Rechazar todas Confirmar mis preferencias", "features_text": "", "specifications_text": "", "benefits_text": "", "details_text": "", "other_sections": "", "sections": {"Descripción": ["Tipo de Producto", "Pollo", "Te podrían interesar", "Kryzpo", "Papas Fritas Kryzpo Original 130 g", "Frutas y Verduras Propias", "Lechuga Escarola 1 un.", "3.4", "Exclusivo online", "Pomarola", "Salsa de Tomate Pomarola 200 g 6 un.", "Centro de preferencia de privacidad", "Gestionar las preferencias de consentimiento", "Activas siempre", "Back Button", "Search Icon", "Filter Icon", "Clear", "checkbox label", "label", "Apply", "Cancel", "Consent", "Leg.Interest", "Permitir todas", "Rechazar todas", "Confirmar mis preferencias"]}, "txt_path": "dataset/txt_limpios/834.txt", "html_path": "dataset/paginas_descargadas/834.html", "es_status": "EN", "category_canonical": "papa", "decision": "keep", "match_score": 0.6, "reasons": "heuristic_default"}
{"source_id": "835", "title": "Saltar menú Cenco", "description": "Tipo de Producto Pollo Uso Recomendado Horno Envase Bolsa Variedad Pollo Entero Marinado Sí Contenido A granel Almacenamiento Mantener almacenado entre -2C y 2C Te podrían interesar Centro de preferencia de privacidad Gestionar las preferencias de consentimiento Activas siempre Back Button Search Icon Filter Icon Clear checkbox label label Apply Cancel Consent Leg.Interest Permitir todas Rechazar todas Confirmar mis preferencias", "breadcrumbs": "Agotado > 2.3 kg", "price_raw": "8.78", "currency_raw": "", "url": "", "seller": "Desconocido", "availability": "unknown", "country": "UNKNOWN", "product_name": "Saltar menú Cenco", "brand": "Agotado", "reference": "", "unit": "2.3 kg", "price_amount": 8.78, "price_currency": "", "price_symbol": "$", "price_text": "$8.78", "price_amount_filled": "8.78", "price_is_imputed": "False", "price_imputation_source": "original", "price_amount_usd": "8.78", "price_amount_usd_filled": "8.78", "fx_rate_local_per_usd": "1.0", "fx_source": "default_1usd", "information_text": "", "description_text": "Tipo de Producto Pollo Uso Recomendado Horno Envase Bolsa Variedad Pollo Entero Marinado Sí Contenido A granel Almacenamiento Mantener almacenado entre -2C y 2C Te podrían interesar Centro de preferencia de privacidad Gestionar las preferencias de consentimiento Activas siempre Back Button Search Icon Filter Icon Clear checkbox label label Apply Cancel Consent Leg.Interest Permitir todas Rechazar todas Confirmar mis preferencias", "features_text": "", "specifications_text": "", "benefits_text": "", "details_text": "", "other_sections": "", "sections": {"Descripción": ["Tipo de Producto", "Pollo", "Uso Recomendado", "Horno", "Envase", "Bolsa", "Variedad", "Pollo Entero", "Marinado", "Sí", "Contenido", "A granel", "Almacenamiento", "Mantener almacenado entre -2C y 2C", "Te podrían interesar", "Centro de preferencia de privacidad", "Gestionar las preferencias de consentimiento", "Activas siempre", "Back Button", "Search Icon", "Filter Icon", "Clear", "checkbox label", "label", "Apply", "Cancel", "Consent", "Leg.Interest", "Permitir todas", "Rechazar todas", "Confirmar mis preferencias"]}, "txt_path": "dataset/txt_limpios/835.txt", "html_path": "dataset/paginas_descargadas/835.html", "es_status": "EN", "category_canonical": "pollo entero", "decision": "keep", "match_score": 0.6, "reasons": "heuristic_default"}
{"source_id": "836", "title": "Saltar menú Cenco", "description": "Tipo de Producto Pollo Te podrían interesar Marco Polo Papas Fritas Marco Polo Rústicas Sal de Mar 380 g 3.7 Exclusivo online Pomarola Salsa de Tomate Pomarola 200 g 6 un. 5.0 Frutas y Verduras Propias Lechuga Escarola 1 un. 3.4 Centro de preferencia de privacidad Gestionar las preferencias de consentimiento Activas siempre Back Button Search Icon Filter Icon Clear checkbox label label Apply Cancel Consent Leg.Interest Permitir todas Rechazar todas Confirmar mis preferencias", "breadcrumbs": "Agotado > 380 g", "price_raw": "5.75", "currency_raw": "", "url": "", "seller": "Desconocido", "availability": "unknown", "country": "UNKNOWN", "product_name": "Saltar menú Cenco", "brand": "Agotado", "reference": "", "unit": "380 g", "price_amount": 5.75, "price_currency": "", "price_symbol": "$", "price_text": "$5.75", "price_amount_filled": "5.75", "price_is_imputed": "False", "price_imputation_source": "original", "price_amount_usd": "5.75", "price_amount_usd_filled": "5.75", "fx_rate_local_per_usd": "1.0", "fx_source": "default_1usd", "information_text": "", "description_text": "Tipo de Producto Pollo Te podrían interesar Marco Polo Papas Fritas Marco Polo Rústicas Sal de Mar 380 g 3.7 Exclusivo online Pomarola Salsa de Tomate Pomarola 200 g 6 un. 5.0 Frutas y Verduras Propias Lechuga Escarola 1 un. 3.4 Centro de preferencia de privacidad Gestionar las preferencias de consentimiento Activas siempre Back Button Search Icon Filter Icon Clear checkbox label label Apply Cancel Consent Leg.Interest Permitir todas Rechazar todas Confirmar mis preferencias", "features_text": "", "specifications_text": "", "benefits_text": "", "details_text": "", "other_sections": "", "sections": {"Descripción": ["Tipo de Producto", "Pollo", "Te podrían interesar", "Marco Polo", "Papas Fritas Marco Polo Rústicas Sal de Mar 380 g", "3.7", "Exclusivo online", "Pomarola", "Salsa de Tomate Pomarola 200 g 6 un.", "5.0", "Frutas y Verduras Propias", "Lechuga Escarola 1 un.", "3.4", "Centro de preferencia de privacidad", "Gestionar las preferencias de consentimiento", "Activas siempre", "Back Button", "Search Icon", "Filter Icon", "Clear", "checkbox label", "label", "Apply", "Cancel", "Consent", "Leg.Interest", "Permitir todas", "Rechazar todas", "Confirmar mis preferencias"]}, "txt_path": "dataset/txt_limpios/836.txt", "html_path": "dataset/paginas_descargadas/836.html", "es_status": "EN", "category_canonical": "papa", "decision": "keep", "match_score": 0.6, "reasons": "heuristic_default"}
{"source_id": "837", "title": "Saltar menú Cenco", "description": "Tipo de Producto Pollo Te podrían interesar Kryzpo Papas Fritas Kryzpo Original 130 g 5.0 Fresh Cut Mix Salad Fresh Cut 150 g 4.5 Kraft Mayonesa Kraft 850 g Centro de preferencia de privacidad Gestionar las preferencias de consentimiento Activas siempre Back Button Search Icon Filter Icon Clear checkbox label label Apply Cancel Consent Leg.Interest Permitir todas Rechazar todas Confirmar mis preferencias", "breadcrumbs": "Canto del Gallo > 550 g", "price_raw": "8.98", "currency_raw": "", "url": "", "seller": "Desconocido", "availability": "unknown", "country": "UNKNOWN", "product_name": "Saltar menú Cenco", "brand": "Canto del Gallo", "reference": "", "unit": "550 g", "price_amount": 8.98, "price_currency": "", "price_symbol": "$", "price_text": "$8.98", "price_amount_filled": "8.98", "price_is_imputed": "False", "price_imputation_source": "original", "price_amount_usd": "8.98", "price_amount_usd_filled": "8.98", "fx_rate_local_per_usd": "1.0", "fx_source": "default_1usd", "information_text": "", "description_text": "Tipo de Producto Pollo Te podrían interesar Kryzpo Papas Fritas Kryzpo Original 130 g 5.0 Fresh Cut Mix Salad Fresh Cut 150 g 4.5 Kraft Mayonesa Kraft 850 g Centro de preferencia de privacidad Gestionar las preferencias de consentimiento Activas siempre Back Button Search Icon Filter Icon Clear checkbox label label Apply Cancel Consent Leg.Interest Permitir todas Rechazar todas Confirmar mis preferencias", "features_text": "", "specifications_text": "", "benefits_text": "", "details_text": "", "other_sections": "", "sections": {"Descripción": ["Tipo de Producto", "Pollo", "Te podrían interesar", "Kryzpo", "Papas Fritas Kryzpo Original 130 g", "5.0", "Fresh Cut", "Mix Salad Fresh Cut 150 g", "4.5", "Kraft", "Mayonesa Kraft 850 g", "Centro de preferencia de privacidad", "Gestionar las preferencias de consentimiento", "Activas siempre", "Back Button", "Search Icon", "Filter Icon", "Clear", "checkbox label", "label", "Apply", "Cancel", "Consent", "Leg.Interest", "Permitir todas", "Rechazar todas", "Confirmar mis preferencias"]}, "txt_path": "dataset/txt_limpios/837.txt", "html_path": "dataset/paginas_descargadas/837.html", "es_status": "EN", "category_canonical": "papa", "decision": "keep", "match_score": 0.6, "reasons": "heuristic_default"}
{"source_id": "838", "title": "Saltar menú Cenco", "description": "", "breadcrumbs": "", "price_raw": "", "currency_raw": "", "url": "", "seller": "Desconocido", "availability": "unknown", "country": "UNKNOWN", "product_name": "Saltar menú Cenco", "brand": "", "reference": "", "unit": "", "price_amount": null, "price_currency": "", "price_symbol": "", "price_text": "", "price_amount_filled": "234.19", "price_is_imputed": "True", "price_imputation_source": "country_mean", "price_amount_usd": "", "price_amount_usd_filled": "234.1938", "fx_rate_local_per_usd": "1.0", "fx_source": "default_1usd", "information_text": "", "description_text": "", "features_text": "", "specifications_text": "", "benefits_text": "", "details_text": "", "other_sections": "", "sections": {}, "txt_path": "dataset/txt_limpios/838.txt", "html_path": "dataset/paginas_descargadas/838.html", "es_status": "EN", "category_canonical": "sin_categoria", "decision": "discard", "match_score": 0.3, "reasons": "no_category_detected;price_parse_failed"}
