{"source_id": "839", "title": "Saltar menú Cenco", "description": "Ingredientes Condición alimentaria Información nutricional Tipo de Producto Leche Entera Cantidad 1 L Formato Caja Envase Tetrapack País de Origen Chile Variedad Entera Natural Estado Líquido Tamaño Familiar Contenido Almacenamiento Refrigerar entre 2–6 °C; consumir en pocos días tras abrir. Garantía Mínima Legal Válida hasta su fecha de caducidad Te podrían interesar Natur Cereal Natur Maíz 20 g Haiti Café Molido Haiti Super Moka 3 Bolsa 250 g 4.5 Iansa Azúcar Blanca Iansa 1 kg 4.8 Centro de preferencia de privacidad Gestionar las preferencias de consentimiento Activas siempre Back Button Search Icon Filter Icon Clear checkbox label label Apply Cancel Consent Leg.Interest Permitir todas Rechazar todas Confirmar mis preferencias", "breadcrumbs": "Exclusivo online > 1 L", "price_raw": "2.0", "currency_raw": "", "url": "", "seller": "Desconocido", "availability": "unknown", "country": "UNKNOWN", "product_name": "Saltar menú Cenco", "brand": "Exclusivo online", "reference": "", "unit": "1 L", "price_amount": 2.0, "price_currency": "", "price_symbol": "", "price_text": "2", "price_amount_filled": "2.0", "price_is_imputed": "False", "price_imputation_source": "original", "price_amount_usd": "2.0", "price_amount_usd_filled": "2.0", "fx_rate_local_per_usd": "1.0", "fx_source": "default_1usd", "information_text": "", "description_text": "Ingredientes Condición alimentaria Información nutricional Tipo de Producto Leche Entera Cantidad 1 L Formato Caja Envase Tetrapack País de Origen Chile Variedad Entera Natural Estado Líquido Tamaño Familiar Contenido Almacenamiento Refrigerar entre 2–6 °C; consumir en pocos días tras abrir. Garantía Mínima Legal Válida hasta su fecha de caducidad Te podrían interesar Natur Cereal Natur Maíz 20 g Haiti Café Molido Haiti Super Moka 3 Bolsa 250 g 4.5 Iansa Azúcar Blanca Iansa 1 kg 4.8 Centro de preferencia de privacidad Gestionar las preferencias de consentimiento Activas siempre Back Button Search Icon Filter Icon Clear checkbox label label Apply Cancel Consent Leg.Interest Permitir todas Rechazar todas Confirmar mis preferencias", "features_text": "", "specifications_text": "", "benefits_text": "", "details_text": "", "other_sections": "", "sections": {"Descripción": ["Ingredientes", "Condición alimentaria", "Información nutricional", "Tipo de Producto", "Leche Entera", "Cantidad", "1 L", "Formato", "Caja", "Envase", "Tetrapack", "País de origen", "Chile", "Variedad", "Entera Natural", "Estado", "Líquido", "Tamaño", "Familiar", "Contenido", "Almacenamiento", "Refrigerar entre 2–6 °C; consumir en pocos días tras abrir.", "Garantía Mínima Legal", "Válida hasta su fecha de caducidad", "Te podrían interesar", "Natur", "Cereal Natur Maíz 20 g", "Haiti", "Café Molido Haiti Super Moka 3 Bolsa 250 g", "4.5", "Iansa", "Azúcar Blanca Iansa 1 kg", "4.8", "Centro de preferencia de privacidad", "Gestionar las preferencias de consentimiento", "Activas siempre", "Back Button", "Search Icon", "Filter Icon", "Clear", "checkbox label", "label", "Apply", "Cancel", "Consent", "Leg.Interest", "Permitir todas", "Rechazar todas", "Confirmar mis preferencias"]}, "txt_path": "dataset/txt_limpios/839.txt", "html_path": "dataset/paginas_descargadas/839.html", "es_status": "ET", "category_canonical": "descartado", "decision": "discard", "match_score": 0.1, "reasons": "excluded_keyword"}
{"source_id": "840", "title": "Saltar menú Cenco", "description": "Ingredientes Condición alimentaria Información nutricional Tipo de Producto Leche Entera Envase Tetrapack País de Origen Chile Garantía Mínima Legal Válida hasta su fecha de caducidad Te podrían interesar Natur Cereal Natur Maíz 20 g Haiti Café Molido Haiti Super Moka 3 Bolsa 250 g 4.5 Azúcar Cuisine & Co Blanca Granulada 1 kg Centro de preferencia de privacidad Gestionar las preferencias de consentimiento Activas siempre Back Button Search Icon Filter Icon Clear checkbox label label Apply Cancel Consent Leg.Interest Permitir todas Rechazar todas Confirmar mis preferencias", "breadcrumbs": "Loncoleche > 1 L", "price_raw": "1.19", "currency_raw": "", "url": "", "seller": "Desconocido", "availability": "unknown", "country": "UNKNOWN", "product_name": "Saltar menú Cenco", "brand": "Loncoleche", "reference": "", "unit": "1 L", "price_amount": 1.19, "price_currency": "", "price_symbol": "$", "price_text": "$1.19", "price_amount_filled": "1.19", "price_is_imputed": "False", "price_imputation_source": "original", "price_amount_usd": "1.19", "price_amount_usd_filled": "1.19", "fx_rate_local_per_usd": "1.0", "fx_source": "default_1usd", "information_text": "", "description_text": "Ingredientes Condición alimentaria Información nutricional Tipo de Producto Leche Entera Envase Tetrapack País de Origen Chile Garantía Mínima Legal Válida hasta su fecha de caducidad Te podrían interesar Natur Cereal Natur Maíz 20 g Haiti Café Molido Haiti Super Moka 3 Bolsa 250 g 4.5 Azúcar Cuisine & Co Blanca Granulada 1 kg Centro de preferencia de privacidad Gestionar las preferencias de consentimiento Activas siempre Back Button Search Icon Filter Icon Clear checkbox label label Apply Cancel Consent Leg.Interest Permitir todas Rechazar todas Confirmar mis preferencias", "features_text": "", "specifications_text": "", "benefits_text": "", "details_text": "", "other_sections": "", "sections": {"Descripción": ["Ingredientes", "Condición alimentaria", "Información nutricional", "Tipo de Producto", "Leche Entera", "Envase", "Tetrapack", "País de origen", "Chile", "Garantía Mínima Legal", "Válida hasta su fecha de caducidad", "Te podrían interesar", "Natur", "Cereal Natur Maíz 20 g", "Haiti", "Café Molido Haiti Super Moka 3 Bolsa 250 g", "4.5", "Azúcar Cuisine & Co Blanca Granulada 1 kg", "Centro de preferencia de privacidad", "Gestionar las preferencias de consentimiento", "Activas siempre", "Back Button", "Search Icon", "Filter Icon", "Clear", "checkbox label", "label", "Apply", "Cancel", "Consent", "Leg.Interest", "Permitir todas", "Rechazar todas", "Confirmar mis preferencias"]}, "txt_path": "dataset/txt_limpios/840.txt", "html_path": "dataset/paginas_descargadas/840.html", "es_status": "ET", "category_canonical": "descartado", "decision": "discard", "match_score": 0.1, "reasons": "excluded_keyword"}
{"source_id": "842", "title": "Saltar menú Cenco", "description": "Ingredientes Condición alimentaria Información nutricional Tipo de Producto Leche Entera Envase Tetrapack País de Origen Chile Te podrían interesar Exclusivo online 30% dcto. Quaker Haiti Café Molido Haiti Super Moka 3 Bolsa 250 g 4.5 Azúcar Cuisine & Co Blanca Granulada 1 kg Centro de preferencia de privacidad Gestionar las preferencias de consentimiento Activas siempre Back Button Search Icon Filter Icon Clear checkbox label label Apply Cancel Consent Leg.Interest Permitir todas Rechazar todas Confirmar mis preferencias", "breadcrumbs": "Cuisine & Co > 1 L", "price_raw": "1.11", "currency_raw": "", "url": "", "seller": "Desconocido", "availability": "unknown", "country": "UNKNOWN", "product_name": "Saltar menú Cenco", "brand": "Cuisine & Co", "reference": "", "unit": "1 L", "price_amount": 1.11, "price_currency": "", "price_symbol": "$", "price_text": "$1.11", "price_amount_filled": "1.11", "price_is_imputed": "False", "price_imputation_source": "original", "price_amount_usd": "1.11", "price_amount_usd_filled": "1.11", "fx_rate_local_per_usd": "1.0", "fx_source": "default_1usd", "information_text": "", "description_text": "Ingredientes Condición alimentaria Información nutricional Tipo de Producto Leche Entera Envase Tetrapack País de Origen Chile Te podrían interesar Exclusivo online 30% dcto. Quaker Haiti Café Molido Haiti Super Moka 3 Bolsa 250 g 4.5 Azúcar Cuisine & Co Blanca Granulada 1 kg Centro de preferencia de privacidad Gestionar las preferencias de consentimiento Activas siempre Back Button Search Icon Filter Icon Clear checkbox label label Apply Cancel Consent Leg.Interest Permitir todas Rechazar todas Confirmar mis preferencias", "features_text": "", "specifications_text": "", "benefits_text": "", "details_text": "", "other_sections": "", "sections": {"Descripción": ["Ingredientes", "Condición alimentaria", "Información nutricional", "Tipo de Producto", "Leche Entera", "Envase", "Tetrapack", "País de origen", "Chile", "Te podrían interesar", "Exclusivo online", "30% dcto.", "Quaker", "Haiti", "Café Molido Haiti Super Moka 3 Bolsa 250 g", "4.5", "Azúcar Cuisine & Co Blanca Granulada 1 kg", "Centro de preferencia de privacidad", "Gestionar las preferencias de consentimiento", "Activas siempre", "Back Button", "Search Icon", "Filter Icon", "Clear", "checkbox label", "label", "Apply", "Cancel", "Consent", "Leg.Interest", "Permitir todas", "Rechazar todas", "Confirmar mis preferencias"]}, "txt_path": "dataset/txt_limpios/842.txt", "html_path": "dataset/paginas_descargadas/842.html", "es_status": "ET", "category_canonical": "leche", "decision": "keep", "match_score": 0.6, "reasons": "heuristic_default"}
{"source_id": "843", "title": "Saltar menú Cenco", "description": "Tipo de Producto Manzana Royal Gala Grupo Manzanas - Peras y Otros Envase Granel Variedad Fruta Contenido A granel Te podrían interesar Naranja Granel Importada (2 A 3 un. Aprox) Plátano Extra Granel (1 A 2 un. Aprox) Perejil 1 un. Centro de preferencia de privacidad Gestionar las preferencias de consentimiento Activas siempre Back Button Search Icon Filter Icon Clear checkbox label label Apply Cancel Consent Leg.Interest Permitir todas Rechazar todas Confirmar mis preferencias", "breadcrumbs": "Frutas y Verduras Propias > 1 kg", "price_raw": "1.29", "currency_raw": "", "url": "", "seller": "Desconocido", "availability": "unknown", "country": "UNKNOWN", "product_name": "Saltar menú Cenco", "brand": "Frutas y Verduras Propias", "reference": "", "unit": "1 kg", "price_amount": 1.29, "price_currency": "", "price_symbol": "$", "price_text": "$1.29", "price_amount_filled": "1.29", "price_is_imputed": "False", "price_imputation_source": "original", "price_amount_usd": "1.29", "price_amount_usd_filled": "1.29", "fx_rate_local_per_usd": "1.0", "fx_source": "default_1usd", "information_text": "", "description_text": "Tipo de Producto Manzana Royal Gala Grupo Manzanas - Peras y Otros Envase Granel Variedad Fruta Contenido A granel Te podrían interesar Naranja Granel Importada (2 A 3 un. Aprox) Plátano Extra Granel (1 A 2 un. Aprox) Perejil 1 un. Centro de preferencia de privacidad Gestionar las preferencias de consentimiento Activas siempre Back Button Search Icon Filter Icon Clear checkbox label label Apply Cancel Consent Leg.Interest Permitir todas Rechazar todas Confirmar mis preferencias", "features_text": "", "specifications_text": "", "benefits_text": "", "details_text": "", "other_sections": "", "sections": {"Descripción": ["Tipo de Producto", "Manzana Royal Gala", "Grupo", "Manzanas - Peras y Otros", "Envase", "Granel", "Variedad", "Fruta", "Contenido", "A granel", "Te podrían interesar", "Naranja Granel Importada (2 A 3 un. Aprox)", "Plátano Extra Granel (1 A 2 un. Aprox)", "Perejil 1 un.", "Centro de preferencia de privacidad", "Gestionar las preferencias de consentimiento", "Activas siempre", "Back Button", "Search Icon", "Filter Icon", "Clear", "checkbox label", "label", "Apply", "Cancel", "Consent", "Leg.Interest", "Permitir todas", "Rechazar todas", "Confirmar mis preferencias"]}, "txt_path": "dataset/txt_limpios/843.txt", "html_path": "dataset/paginas_descargadas/843.html", "es_status": "EN", "category_canonical": "banano", "decision": "keep", "match_score": 0.6, "reasons": "heuristic_default"}
{"source_id": "844", "title": "Saltar menú Cenco", "description": "Ingredientes Condición alimentaria Información nutricional Tipo de Producto Spaghettis Cantidad 1 un. Formato N°5 Envase Paquete País de Origen Chile Variedad Contenido 400 g Garantía Mínima Legal Válida hasta su fecha de caducidad Te podrían interesar Pomarola Salsa de Tomate Pomarola 200 g 6 un. Oferta Colun 4.5 Gourmet Caldo Gourmet Polvo Sabor Carne 48 g 6 un. Centro de preferencia de privacidad Gestionar las preferencias de consentimiento Activas siempre Back Button Search Icon Filter Icon Clear checkbox label label Apply Cancel Consent Leg.Interest Permitir todas Rechazar todas Confirmar mis preferencias", "breadcrumbs": "Exclusivo online > 400 g", "price_raw": "3.0", "currency_raw": "", "url": "", "seller": "Desconocido", "availability": "unknown", "country": "UNKNOWN", "product_name": "Saltar menú Cenco", "brand": "Exclusivo online", "reference": "", "unit": "400 g", "price_amount": 3.0, "price_currency": "", "price_symbol": "", "price_text": "3", "price_amount_filled": "3.0", "price_is_imputed": "False", "price_imputation_source": "original", "price_amount_usd": "3.0", "price_amount_usd_filled": "3.0", "fx_rate_local_per_usd": "1.0", "fx_source": "default_1usd", "information_text": "", "description_text": "Ingredientes Condición alimentaria Información nutricional Tipo de Producto Spaghettis Cantidad 1 un. Formato N°5 Envase Paquete País de Origen Chile Variedad Contenido 400 g Garantía Mínima Legal Válida hasta su fecha de caducidad Te podrían interesar Pomarola Salsa de Tomate Pomarola 200 g 6 un. Oferta Colun 4.5 Gourmet Caldo Gourmet Polvo Sabor Carne 48 g 6 un. Centro de preferencia de privacidad Gestionar las preferencias de consentimiento Activas siempre Back Button Search Icon Filter Icon Clear checkbox label label Apply Cancel Consent Leg.Interest Permitir todas Rechazar todas Confirmar mis preferencias", "features_text": "", "specifications_text": "", "benefits_text": "", "details_text": "", "other_sections": "", "sections": {"Descripción": ["Ingredientes", "Condición alimentaria", "Información nutricional", "Tipo de Producto", "Spaghettis", "Cantidad", "1 un.", "Formato", "N°5", "Envase", "Paquete", "País de origen", "Chile", "Variedad", "Contenido", "400 g", "Garantía Mínima Legal", "Válida hasta su fecha de caducidad", "Te podrían interesar", "Pomarola", "Salsa de Tomate Pomarola 200 g 6 un.", "Oferta", "Colun", "4.5", "Gourmet", "Caldo Gourmet Polvo Sabor Carne 48 g 6 un.", "Centro de preferencia de privacidad", "Gestionar las preferencias de consentimiento", "Activas siempre", "Back Button", "Search Icon", "Filter Icon", "Clear", "checkbox label", "label", "Apply", "Cancel", "Consent", "Leg.Interest", "Permitir todas", "Rechazar todas", "Confirmar mis preferencias"]}, "txt_path": "dataset/txt_limpios/844.txt", "html_path": "dataset/paginas_descargadas/844.html", "es_status": "ET", "category_canonical": "descartado", "decision": "discard", "match_score": 0.1, "reasons": "excluded_keyword"}
{"source_id": "845", "title": "Saltar menú Cenco", "description": "Ingredientes Condición alimentaria Información nutricional Tipo de Producto Spaghettis Cantidad 1 un. Formato Envasado Envase Paquete País de Origen Chile Variedad N°5 Contenido 400 g Garantía Mínima Legal Válida hasta su fecha de caducidad Te podrían interesar Cuisine & Co Pomarola Salsa de Tomate Pomarola 200 g 6 un. Salsa de Tomate Carozzi Toscana Bolognesa 200 g Centro de preferencia de privacidad Gestionar las preferencias de consentimiento Activas siempre Back Button Search Icon Filter Icon Clear checkbox label label Apply Cancel Consent Leg.Interest Permitir todas Rechazar todas Confirmar mis preferencias", "breadcrumbs": "Lucchetti > 400 g", "price_raw": "1.04", "currency_raw": "", "url": "", "seller": "Desconocido", "availability": "unknown", "country": "UNKNOWN", "product_name": "Saltar menú Cenco", "brand": "Lucchetti", "reference": "", "unit": "400 g", "price_amount": 1.04, "price_currency": "", "price_symbol": "$", "price_text": "$1.04", "price_amount_filled": "1.04", "price_is_imputed": "False", "price_imputation_source": "original", "price_amount_usd": "1.04", "price_amount_usd_filled": "1.04", "fx_rate_local_per_usd": "1.0", "fx_source": "default_1usd", "information_text": "", "description_text": "Ingredientes Condición alimentaria Información nutricional Tipo de Producto Spaghettis Cantidad 1 un. Formato Envasado Envase Paquete País de Origen Chile Variedad N°5 Contenido 400 g Garantía Mínima Legal Válida hasta su fecha de caducidad Te podrían interesar Cuisine & Co Pomarola Salsa de Tomate Pomarola 200 g 6 un. Salsa de Tomate Carozzi Toscana Bolognesa 200 g Centro de preferencia de privacidad Gestionar las preferencias de consentimiento Activas siempre Back Button Search Icon Filter Icon Clear checkbox label label Apply Cancel Consent Leg.Interest Permitir todas Rechazar todas Confirmar mis preferencias", "features_text": "", "specifications_text": "", "benefits_text": "", "details_text": "", "other_sections": "", "sections": {"Descripción": ["Ingredientes", "Condición alimentaria", "Información nutricional", "Tipo de Producto", "Spaghettis", "Cantidad", "1 un.", "Formato", "Envasado", "Envase", "Paquete", "País de origen", "Chile", "Variedad", "N°5", "Contenido", "400 g", "Garantía Mínima Legal", "Válida hasta su fecha de caducidad", "Te podrían interesar", "Cuisine & Co", "Pomarola", "Salsa de Tomate Pomarola 200 g 6 un.", "Salsa de Tomate Carozzi Toscana Bolognesa 200 g", "Centro de preferencia de privacidad", "Gestionar las preferencias de consentimiento", "Activas siempre", "Back Button", "Search Icon", "Filter Icon", "Clear", "checkbox label", "label", "Apply", "Cancel", "Consent", "Leg.Interest", "Permitir todas", "Rechazar todas", "Confirmar mis preferencias"]}, "txt_path": "dataset/txt_limpios/845.txt", "html_path": "dataset/paginas_descargadas/845.html", "es_status": "ET", "category_canonical": "descartado", "decision": "discard", "match_score": 0.1, "reasons": "excluded_keyword"}
{"source_id": "846", "title": "Saltar menú Cenco", "description": "", "breadcrumbs": "Frutas y verduras", "price_raw": "", "currency_raw": "", "url": "", "seller": "Desconocido", "availability": "unknown", "country": "UNKNOWN", "product_name": "Saltar menú Cenco", "brand": "Frutas y verduras", "reference": "", "unit": "", "price_amount": null, "price_currency": "", "price_symbol": "", "price_text": "", "price_amount_filled": "234.19", "price_is_imputed": "True", "price_imputation_source": "country_mean", "price_amount_usd": "", "price_amount_usd_filled": "234.1938", "fx_rate_local_per_usd": "1.0", "fx_source": "default_1usd", "information_text": "", "description_text": "", "features_text": "", "specifications_text": "", "benefits_text": "", "details_text": "", "other_sections": "", "sections": {}, "txt_path": "dataset/txt_limpios/846.txt", "html_path": "dataset/paginas_descargadas/846.html", "es_status": "EN", "category_canonical": "sin_categoria", "decision": "discard", "match_score": 0.3, "reasons": "no_category_detected;price_parse_failed"}
{"source_id": "847", "title": "Saltar menú Cenco", "description": "Ingredientes Condición alimentaria Información nutricional Tipo de Producto Spaghettis Envase Paquete País de Origen Chile Te podrían interesar Exclusivo online Pomarola Salsa de Tomate Pomarola 200 g 6 un. Oferta Colun 4.5 Frutas y Verduras Propias Albahaca 30 g 4.3 Centro de preferencia de privacidad Gestionar las preferencias de consentimiento Activas siempre Back Button Search Icon Filter Icon Clear checkbox label label Apply Cancel Consent Leg.Interest Permitir todas Rechazar todas Confirmar mis preferencias", "breadcrumbs": "Trattoria > 400 g", "price_raw": "1.25", "currency_raw": "", "url": "", "seller": "Desconocido", "availability": "unknown", "country": "UNKNOWN", "product_name": "Saltar menú Cenco", "brand": "Trattoria", "reference": "", "unit": "400 g", "price_amount": 1.25, "price_currency": "", "price_symbol": "$", "price_text": "$1.25", "price_amount_filled": "1.25", "price_is_imputed": "False", "price_imputation_source": "original", "price_amount_usd": "1.25", "price_amount_usd_filled": "1.25", "fx_rate_local_per_usd": "1.0", "fx_source": "default_1usd", "information_text": "", "description_text": "Ingredientes Condición alimentaria Información nutricional Tipo de Producto Spaghettis Envase Paquete País de Origen Chile Te podrían interesar Exclusivo online Pomarola Salsa de Tomate Pomarola 200 g 6 un. Oferta Colun 4.5 Frutas y Verduras Propias Albahaca 30 g 4.3 Centro de preferencia de privacidad Gestionar las preferencias de consentimiento Activas siempre Back Button Search Icon Filter Icon Clear checkbox label label Apply Cancel Consent Leg.Interest Permitir todas Rechazar todas Confirmar mis preferencias", "features_text": "", "specifications_text": "", "benefits_text": "", "details_text": "", "other_sections": "", "sections": {"Descripción": ["Ingredientes", "Condición alimentaria", "Información nutricional", "Tipo de Producto", "Spaghettis", "Envase", "Paquete", "País de origen", "Chile", "Te podrían interesar", "Exclusivo online", "Pomarola", "Salsa de Tomate Pomarola 200 g 6 un.", "Oferta", "Colun", "4.5", "Frutas y Verduras Propias", "Albahaca 30 g", "4.3", "Centro de preferencia de privacidad", "Gestionar las preferencias de consentimiento", "Activas siempre", "Back Button", "Search Icon", "Filter Icon", "Clear", "checkbox label", "label", "Apply", "Cancel", "Consent", "Leg.Interest", "Permitir todas", "Rechazar todas", "Confirmar mis preferencias"]}, "txt_path": "dataset/txt_limpios/847.txt", "html_path": "dataset/paginas_descargadas/847.html", "es_status": "ET", "category_canonical": "sin_categoria", "decision": "discard", "match_score": 0.3, "reasons": "no_category_detected"}
