{"source_id": "517", "title": "Descripción del producto", "description": "", "breadcrumbs": "Azúcar AZUCEL 1kg > 1kg", "price_raw": "4399.0", "currency_raw": "", "url": "", "seller": "Desconocido", "availability": "unknown", "country": "UNKNOWN", "product_name": "Descripción del producto", "brand": "Azúcar AZUCEL 1kg", "reference": "", "unit": "1kg", "price_amount": 4399.0, "price_currency": "", "price_symbol": "$", "price_text": "$4.399,00", "price_amount_filled": "4399.0", "price_is_imputed": "False", "price_imputation_source": "original", "price_amount_usd": "4399.0", "price_amount_usd_filled": "4399.0", "fx_rate_local_per_usd": "1.0", "fx_source": "default_1usd", "information_text": "", "description_text": "", "features_text": "MARCA | : AZUCEL | Últimos consultados | Azúcar Organica Sugar Pot 800g | Ver planes de cuotas | NO ACUMULABLE CON OTRAS PROMOS | Azúcar Cristal Uniao 1kg | Azúcar La Perla 1 Kg | Azúcar Superior Real LEDESMA 1kg | Baguette COTO", "specifications_text": "", "benefits_text": "", "details_text": "", "other_sections": "", "sections": {"Características": ["MARCA", ": AZUCEL", "Últimos consultados", "Azúcar Organica Sugar Pot 800g", "Ver planes de cuotas", "NO ACUMULABLE CON OTRAS PROMOS", "Azúcar Cristal Uniao 1kg", "Azúcar La Perla 1 Kg", "Azúcar Superior Real LEDESMA 1kg", "Baguette COTO"]}, "txt_path": "dataset/txt_limpios/517.txt", "html_path": "dataset/paginas_descargadas/517.html", "es_status": "EN", "category_canonical": "azucar", "decision": "keep", "match_score": 0.6, "reasons": "heuristic_default"}
{"source_id": "1756", "title": "Devolver este producto es gratis", "description": "POLLOS 1RA. SUPER C/M ¡Juntos son mejores! Costillar de Cerdo Tradicional Super Cerdo Peso Variable -42% Ver producto Arvejas Congeladas Minuto Verde 500 g UN Sal Fina Yodada Costillar de Cerdo a la Chilena Super Cerdo Peso Variable Aceite Vegetal Belmont 1 L -20% Sal Fina Yodada Tottus 1 Kg Aceite Vegetal Tottus 900 ml Aceite vegetal Precio Un 900 ml Arroz Tottus G2 Grano Largo Fino 1 Kg Arroz Precio Uno G2 Grano Largo Fino 1 Kg Tipo de corte | Pollo Entero | Uso Recomendado | Cacerola,Olla Multicook,Horno,Airfryer | Origen | Nacional | País de Origen | Chile | Tipo de Envase | Bolsa | Advertencias de Almacenamiento | Mantener Refrigerado entre -2°C a 2 °C | Tipo de Refrigeración | Refrigerado | Refrigerado | Refrigerado | Refrigerado | Refrigerado | Refrigerado | Refrigerado | Refrigerado | Refrigerado | Refrigerado | Refrigerado | Refrigerado | Refrigerado | Refrigerado | Refrigerado | Refrigerado | Refrigerado | Refrigerado | Refrigerado | Refrigerado | Refrigerado | Refrigerado | Refrigerado | Refrigerado | Refrigerado | Refrigerado | Refrigerado | Refrigerado | Refrigerado | Refrigerado | Refrigerado | Refrigerado | Refrigerado | Refrigerado | Refrigerado | Refrigerado | Refrigerado | Refrigerado | Refrigerado | Refrigerado | Refrigerado | Refrigerado | Refrigerado | Refrigerado | Refrigerado | Refrigerado | Refrigerado | Refrigerado | Refrigerado | Refrigerado | Refrigerado | Refrigerado | Refrigerado", "breadcrumbs": "SUPER POLLO > 500 g", "price_raw": "3.99", "currency_raw": "", "url": "", "seller": "Desconocido", "availability": "unknown", "country": "UNKNOWN", "product_name": "Devolver este producto es gratis", "brand": "SUPER POLLO", "reference": "", "unit": "500 g", "price_amount": 3.99, "price_currency": "", "price_symbol": "", "price_text": "3.99", "price_amount_filled": "3.99", "price_is_imputed": "False", "price_imputation_source": "original", "price_amount_usd": "3.99", "price_amount_usd_filled": "3.99", "fx_rate_local_per_usd": "1.0", "fx_source": "default_1usd", "information_text": "", "description_text": "POLLOS 1RA. SUPER C/M ¡Juntos son mejores! Costillar de Cerdo Tradicional Super Cerdo Peso Variable -42% Ver producto Arvejas Congeladas Minuto Verde 500 g UN Sal Fina Yodada Costillar de Cerdo a la Chilena Super Cerdo Peso Variable Aceite Vegetal Belmont 1 L -20% Sal Fina Yodada Tottus 1 Kg Aceite Vegetal Tottus 900 ml Aceite Vegetal Precio Uno 900 ml Arroz Tottus G2 Grano Largo Fino 1 Kg Arroz Precio Uno G2 Grano Largo Fino 1 Kg", "features_text": "", "specifications_text": "Tipo de corte | Pollo Entero | Uso Recomendado | Cacerola,Olla Multicook,Horno,Airfryer | Origen | Nacional | País de Origen | Chile | Tipo de Envase | Bolsa | Advertencias de Almacenamiento | Mantener Refrigerado entre -2°C a 2 °C | Tipo de Refrigeración | Refrigerado | Refrigerado | Refrigerado | Refrigerado | Refrigerado | Refrigerado | Refrigerado | Refrigerado | Refrigerado | Refrigerado | Refrigerado | Refrigerado | Refrigerado | Refrigerado | Refrigerado | Refrigerado | Refrigerado | Refrigerado | Refrigerado | Refrigerado | Refrigerado | Refrigerado | Refrigerado | Refrigerado | Refrigerado | Refrigerado | Refrigerado | Refrigerado | Refrigerado | Refrigerado | Refrigerado | Refrigerado | Refrigerado | Refrigerado | Refrigerado | Refrigerado | Refrigerado | Refrigerado | Refrigerado | Refrigerado | Refrigerado | Refrigerado | Refrigerado | Refrigerado | Refrigerado | Refrigerado | Refrigerado | Refrigerado | Refrigerado | Refrigerado | Refrigerado | Refrigerado | Refrigerado", "benefits_text": "", "details_text": "", "other_sections": "", "sections": {"Especificaciones": ["Tipo de Corte", "Pollo Entero", "Uso Recomendado", "Cacerola,Olla Multicook,Horno,Airfryer", "Origen", "Nacional", "País de origen", "Chile", "Tipo de Envase", "Bolsa", "Advertencias de Almacenamiento", "Mantener Refrigerado entre -2°C a 2°C", "Tipo de refrigeración", "Refrigerado"], "Descripción": ["POLLOS 1RA. SUPER C/M", "¡Juntos son mejores!", "Costillar de Cerdo Tradicional Super Cerdo Peso Variable", "-42%", "Ver producto", "Arvejas Congeladas Minuto Verde 500 g", "UN", "Sal Fina Yodada", "Costillar de Cerdo a la Chilena Super Cerdo Peso Variable", "Aceite Vegetal Belmont 1 L", "-20%", "Sal Fina Yodada Tottus 1 Kg", "Aceite Vegetal Tottus 900 ml", "Aceite Vegetal Precio Uno 900 ml", "Arroz Tottus G2 Grano Largo Fino 1 Kg", "Arroz Precio Uno G2 Grano Largo Fino 1 Kg"]}, "txt_path": "dataset/txt_limpios/1756.txt", "html_path": "dataset/paginas_descargadas/1756.html", "es_status": "ET", "category_canonical": "aceite vegetal", "decision": "keep", "match_score": 0.6, "reasons": "heuristic_default"}
{"source_id": "1316", "title": "El almacenamiento local parece estar deshabilitado en tu navegador.", "description": "", "breadcrumbs": "Aprende más > 1L", "price_raw": "2.05", "currency_raw": "USD", "url": "", "seller": "Desconocido", "availability": "unknown", "country": "US", "product_name": "El almacenamiento local parece estar deshabilitado en tu navegador.", "brand": "Aprende", "reference": "", "unit": "1L", "price_amount": 2.05, "price_currency": "USD", "price_symbol": "$", "price_text": "$2,05", "price_amount_filled": "2.05", "price_is_imputed": "False", "price_imputation_source": "original", "price_amount_usd": "2.05", "price_amount_usd_filled": "2.05", "fx_rate_local_per_usd": "1.0", "fx_source": "default_1usd", "information_text": "", "description_text": "", "features_text": "", "specifications_text": "", "benefits_text": "", "details_text": "", "other_sections": "", "sections": {}, "txt_path": "dataset/txt_limpios/1316.txt", "html_path": "dataset/paginas_descargadas/1316.html", "es_status": "ET", "category_canonical": "sin_categoria", "decision": "discard", "match_score": 0.3, "reasons": "no_category_detected"}
{"source_id": "1317", "title": "El almacenamiento local parece estar deshabilitado en tu navegador.", "description": "Leche 100% de vaca | Conserva todos los componentes el propiedades nutricionalesde la leche | Rica en grasa, calcio, minerales, proteínas y vitaminas A,D, B y E | Ayuda a mantener huesos fuertes y sanos | Empaque 100% reciclable | Contenido: 1 Litro | Detalles del producto | Reseñas | Escribir Su propia reseña | Estás revisando: Leche Entera Tru 1L | Su valoración | Rating | 1 stars | 2 stars | 3 stars | 4 stars | 5 stars | Apodo | Resumen | Reseña | Escribir una reseña | Unds. | Search engine powered by | ElasticSuite", "breadcrumbs": "Aprende más > 1L", "price_raw": "1.33", "currency_raw": "", "url": "", "seller": "Desconocido", "availability": "unknown", "country": "UNKNOWN", "product_name": "El almacenamiento local parece estar deshabilitado en tu navegador.", "brand": "Aprende", "reference": "", "unit": "1L", "price_amount": 1.33, "price_currency": "", "price_symbol": "$", "price_text": "$1,33", "price_amount_filled": "1.33", "price_is_imputed": "False", "price_imputation_source": "original", "price_amount_usd": "1.33", "price_amount_usd_filled": "1.33", "fx_rate_local_per_usd": "1.0", "fx_source": "default_1usd", "information_text": "", "description_text": "", "features_text": "", "specifications_text": "", "benefits_text": "", "details_text": "Leche 100% de vaca | Conserva todos los componentes el propiedades nutricionalesde la leche | Rica en grasa, calcio, minerales, proteínas y vitaminas A,D, B y E | Ayuda a mantener huesos fuertes y sanos | Empaque 100% reciclable | Contenido: 1 Litro | Detalles del producto | Reseñas | Escribir Su propia reseña | Estás revisando: Leche Entera Tru 1L | Su valoración | Rating | 1 stars | 2 stars | 3 stars | 4 stars | 5 stars | Apodo | Resumen | Reseña | Escribir una reseña | Unds. | Search engine powered by | ElasticSuite", "other_sections": "", "sections": {"Detalles": ["Leche 100% de vaca", "Conserva todos los componentes o propiedades nutricionalesde la leche", "Rica en grasa, calcio, minerales, proteínas y vitaminas A,D, B y E", "Ayuda a mantener huesos fuertes y sanos", "Empaque 100% reciclable", "Contenido: 1 Litro", "Detalles del producto", "Reseñas", "Escribir Su propia reseña", "Estás revisando: Leche Entera Tru 1L", "Su valoración", "Rating", "1 star", "2 stars", "3 stars", "4 stars", "5 stars", "Apodo", "Resumen", "Reseña", "Escribir una reseña", "Unds.", "Search engine powered by", "ElasticSuite"]}, "txt_path": "dataset/txt_limpios/1317.txt", "html_path": "dataset/paginas_descargadas/1317.html", "es_status": "ET", "category_canonical": "leche", "decision": "keep", "match_score": 0.6, "reasons": "heuristic_default"}
{"source_id": "1318", "title": "El almacenamiento local parece estar deshabilitado en tu navegador.", "description": "Es el producto de un proceso térmico UHT de Leche Deslactosada | Comercialmente estéril, seguido de un llenado aséptico enenvase esterilizado y sellado herméticamente | Tiene una vida útil de 6 meses | Contenido: 1 litro | Detalles del producto | Reseñas | Escribir Su propia reseña | Estás revisando: Leche Deslactosada Nutri 1L | Su valoración | Rating | 1 stars | 2 stars | 3 stars | 4 stars | 5 stars | Apodo | Resumen | Reseña | Escribir una reseña | Unds. | Search engine powered by | ElasticSuite", "breadcrumbs": "Aprende más > 1L", "price_raw": "1.5", "currency_raw": "", "url": "", "seller": "Desconocido", "availability": "unknown", "country": "UNKNOWN", "product_name": "El almacenamiento local parece estar deshabilitado en tu navegador.", "brand": "Aprende", "reference": "", "unit": "1L", "price_amount": 1.5, "price_currency": "", "price_symbol": "$", "price_text": "$1,50", "price_amount_filled": "1.5", "price_is_imputed": "False", "price_imputation_source": "original", "price_amount_usd": "1.5", "price_amount_usd_filled": "1.5", "fx_rate_local_per_usd": "1.0", "fx_source": "default_1usd", "information_text": "", "description_text": "", "features_text": "", "specifications_text": "", "benefits_text": "", "details_text": "Es el producto de un proceso térmico UHT de Leche Deslactosada | Comercialmente estéril, seguido de un llenado aséptico enenvase esterilizado y sellado herméticamente | Tiene una vida útil de 6 meses | Contenido: 1 litro | Detalles del producto | Reseñas | Escribir Su propia reseña | Estás revisando: Leche Deslactosada Nutri 1L | Su valoración | Rating | 1 stars | 2 stars | 3 stars | 4 stars | 5 stars | Apodo | Resumen | Reseña | Escribir una reseña | Unds. | Search engine powered by | ElasticSuite", "other_sections": "", "sections": {"Detalles": ["Es el producto de un proceso térmico UHT de Leche Deslactosada", "Comercialmente estéril, seguido de un llenado aséptico enenvase esterilizado y sellado herméticamente", "Tiene una vida útil de 6 meses", "Contenido: 1 litro", "Detalles del producto", "Reseñas", "Escribir Su propia reseña", "Estás revisando: Leche Deslactosada Nutri 1L", "Su valoración", "Rating", "1 star", "2 stars", "3 stars", "4 stars", "5 stars", "Apodo", "Resumen", "Reseña", "Escribir una reseña", "Unds.", "Search engine powered by", "ElasticSuite"]}, "txt_path": "dataset/txt_limpios/1318.txt", "html_path": "dataset/paginas_descargadas/1318.html", "es_status": "ET", "category_canonical": "leche", "decision": "keep", "match_score": 0.6, "reasons": "heuristic_default"}
{"source_id": "1319", "title": "El almacenamiento local parece estar deshabilitado en tu navegador.", "description": "Leche semidescremada | 100% leche | No necesita refrigeración | 90 días de duración | Con vitaminas A y D | Contenido: 900ml | Detalles del producto | Reseñas | Escribir Su propia reseña | Estás revisando: LECHE SINIDESCREMADA ANDILAC 900 ML UHT | Su valoración | Rating | 1 stars | 2 stars | 3 stars | 4 stars | 5 stars | Apodo | Resumen | Reseña | Escribir una reseña | Unds. | Search engine powered by | ElasticSuite", "breadcrumbs": "Aprende más > 900 ML", "price_raw": "0.89", "currency_raw": "", "url": "", "seller": "Desconocido", "availability": "unknown", "country": "UNKNOWN", "product_name": "El almacenamiento local parece estar deshabilitado en tu navegador.", "brand": "Aprende", "reference": "", "unit": "900 ML", "price_amount": 0.89, "price_currency": "", "price_symbol": "$", "price_text": "$0,89", "price_amount_filled": "0.89", "price_is_imputed": "False", "price_imputation_source": "original", "price_amount_usd": "0.89", "price_amount_usd_filled": "0.89", "fx_rate_local_per_usd": "1.0", "fx_source": "default_1usd", "information_text": "", "description_text": "", "features_text": "", "specifications_text": "", "benefits_text": "", "details_text": "Leche semidescremada | 100% leche | No necesita refrigeración | 90 días de duración | Con vitaminas A y D | Contenido: 900ml | Detalles del producto | Reseñas | Escribir Su propia reseña | Estás revisando: LECHE SINIDESCREMADA ANDILAC 900 ML UHT | Su valoración | Rating | 1 stars | 2 stars | 3 stars | 4 stars | 5 stars | Apodo | Resumen | Reseña | Escribir una reseña | Unds. | Search engine powered by | ElasticSuite", "other_sections": "", "sections": {"Detalles": ["Leche semidescremada", "100% leche", "No necesita refrigeración", "90 días de duración", "Con vitaminas A y D", "Contenido: 900ml", "Detalles del producto", "Reseñas", "Escribir Su propia reseña", "Estás revisando: LECHE SINIDESCREMADA ANDILAC 900 ML UHT", "Su valoración", "Rating", "1 star", "2 stars", "3 stars", "4 stars", "5 stars", "Apodo", "Resumen", "Reseña", "Escribir una reseña", "Unds.", "Search engine powered by", "ElasticSuite"]}, "txt_path": "dataset/txt_limpios/1319.txt", "html_path": "dataset/paginas_descargadas/1319.html", "es_status": "ET", "category_canonical": "leche", "decision": "keep", "match_score": 0.6, "reasons": "heuristic_default"}
{"source_id": "1320", "title": "El almacenamiento local parece estar deshabilitado en tu navegador.", "description": "Cerveza bastante refrescante | Se recomienda tomar bien fría | Porcentaje de alcohol: 5.1% | Color dorado | País de origen Italia | Incluye 6 Cervezas | Contenido: 330ml c/u | Detalles del producto | Reseñas | Escribir Su propia reseña | Estás revisando: CERVEZA PERONI NASTRO AZZURRO 330ML | Su valoración | 1 stars | 2 stars | 3 stars | 4 stars | 5 stars | Apodo | Resumen | Reseña | Escribir una reseña | Unds. | Search engine powered by | ElasticSuite", "breadcrumbs": "Aprende más > 330ML", "price_raw": "2.2", "currency_raw": "", "url": "", "seller": "Desconocido", "availability": "unknown", "country": "UNKNOWN", "product_name": "El almacenamiento local parece estar deshabilitado en tu navegador.", "brand": "Aprende", "reference": "", "unit": "330ML", "price_amount": 2.2, "price_currency": "", "price_symbol": "$", "price_text": "$2,20", "price_amount_filled": "2.2", "price_is_imputed": "False", "price_imputation_source": "original", "price_amount_usd": "2.2", "price_amount_usd_filled": "2.2", "fx_rate_local_per_usd": "1.0", "fx_source": "default_1usd", "information_text": "", "description_text": "", "features_text": "", "specifications_text": "", "benefits_text": "", "details_text": "Cerveza bastante refrescante | Se recomienda tomar bien fría | Porcentaje de alcohol: 5.1% | Color dorado | País de origen Italia | Incluye 6 Cervezas | Contenido: 330ml c/u | Detalles del producto | Reseñas | Escribir Su propia reseña | Estás revisando: CERVEZA PERONI NASTRO AZZURRO 330ML | Su valoración | 1 stars | 2 stars | 3 stars | 4 stars | 5 stars | Apodo | Resumen | Reseña | Escribir una reseña | Unds. | Search engine powered by | ElasticSuite", "other_sections": "", "sections": {"Detalles": ["Cerveza bastante refrescante", "Si recomienda tomar bien fría", "Porcentaje de alcohol: 5.1%", "Color dorado", "País de origen Italia", "Incluye 6 Cervezas", "Contenido: 330ml c/u", "Detalles del producto", "Reseñas", "Escribir Su propia reseña", "Estás revisando: CERVEZA PERONI NASTRO AZZURRO 330ML", "Su valoración", "Rating", "1 star", "2 stars", "3 stars", "4 stars", "5 stars", "Apodo", "Resumen", "Reseña", "Escribir una reseña", "Unds.", "Search engine powered by", "ElasticSuite"]}, "txt_path": "dataset/txt_limpios/1320.txt", "html_path": "dataset/paginas_descargadas/1320.html", "es_status": "ET", "category_canonical": "cerveza", "decision": "keep", "match_score": 0.6, "reasons": "heuristic_default"}
{"source_id": "1321", "title": "El almacenamiento local parece estar deshabilitado en tu navegador.", "description": "", "breadcrumbs": "Aprende más > 500ML", "price_raw": "3.23", "currency_raw": "", "url": "", "seller": "Desconocido", "availability": "unknown", "country": "UNKNOWN", "product_name": "El almacenamiento local parece estar deshabilitado en tu navegador.", "brand": "Aprende", "reference": "", "unit": "500ML", "price_amount": 3.23, "price_currency": "", "price_symbol": "$", "price_text": "$3,23", "price_amount_filled": "3.23", "price_is_imputed": "False", "price_imputation_source": "original", "price_amount_usd": "3.23", "price_amount_usd_filled": "3.23", "fx_rate_local_per_usd": "1.0", "fx_source": "default_1usd", "information_text": "", "description_text": "", "features_text": "", "specifications_text": "", "benefits_text": "", "details_text": "", "other_sections": "", "sections": {}, "txt_path": "dataset/txt_limpios/1321.txt", "html_path": "dataset/paginas_descargadas/1321.html", "es_status": "ET", "category_canonical": "sin_categoria", "decision": "discard", "match_score": 0.3, "reasons": "no_category_detected"}
{"source_id": "1322", "title": "El almacenamiento local parece estar deshabilitado en tu navegador.", "description": "Presentación en lata | Incluye 6 cervezas | Contenido: 355ml c/u | Detalles del producto | Reseñas | Escribir Su propia reseña | Estás revisando: CERVEZA SIX PACK EN LATA HEINEKEN 355ML/4590 | Su valoración | Rating | 1 stars | 2 stars | 3 stars | 4 stars | 5 stars | Apodo | Resumen | Reseña | Escribir una reseña | Unds. | Search engine powered by | ElasticSuite", "breadcrumbs": "Aprende más > 355ML", "price_raw": "6.98", "currency_raw": "", "url": "", "seller": "Desconocido", "availability": "unknown", "country": "UNKNOWN", "product_name": "El almacenamiento local parece estar deshabilitado en tu navegador.", "brand": "Aprende", "reference": "", "unit": "355ML", "price_amount": 6.98, "price_currency": "", "price_symbol": "$", "price_text": "$6,98", "price_amount_filled": "6.98", "price_is_imputed": "False", "price_imputation_source": "original", "price_amount_usd": "6.98", "price_amount_usd_filled": "6.98", "fx_rate_local_per_usd": "1.0", "fx_source": "default_1usd", "information_text": "", "description_text": "", "features_text": "", "specifications_text": "", "benefits_text": "", "details_text": "Presentación en lata | Incluye 6 cervezas | Contenido: 355ml c/u | Detalles del producto | Reseñas | Escribir Su propia reseña | Estás revisando: CERVEZA SIX PACK EN LATA HEINEKEN 355ML/4590 | Su valoración | Rating | 1 stars | 2 stars | 3 stars | 4 stars | 5 stars | Apodo | Resumen | Reseña | Escribir una reseña | Unds. | Search engine powered by | ElasticSuite", "other_sections": "", "sections": {"Detalles": ["Presentación en lata", "Incluye 6 cervezas", "Contenido: 355ml c/u", "Detalles del producto", "Reseñas", "Escribir Su propia reseña", "Estás revisando: CERVEZA SIX PACK EN LATA HEINEKEN 355ML/4590", "Su valoración", "Rating", "1 star", "2 stars", "3 stars", "4 stars", "5 stars", "Apodo", "Resumen", "Reseña", "Escribir una reseña", "Unds.", "Search engine powered by", "ElasticSuite"]}, "txt_path": "dataset/txt_limpios/1322.txt", "html_path": "dataset/paginas_descargadas/1322.html", "es_status": "ET", "category_canonical": "cerveza", "decision": "keep", "match_score": 0.6, "reasons": "heuristic_default"}
