{"source_id": "1196", "title": "Centro de preferencia de la privacidad", "description": "", "breadcrumbs": "Activas siempre > 150gr", "price_raw": "", "currency_raw": "PEN", "url": "", "seller": "Desconocido", "availability": "unknown", "country": "PE", "product_name": "Centro de preferencia de la privacidad", "brand": "Activas siempre", "reference": "", "unit": "150gr", "price_amount": null, "price_currency": "PEN", "price_symbol": "", "price_text": "", "price_amount_filled": "55.14", "price_is_imputed": "True", "price_imputation_source": "country_mean", "price_amount_usd": "", "price_amount_usd_filled": "15.5336", "fx_rate_local_per_usd": "3.55", "fx_source": "from_peru_cambio_dolar", "information_text": "", "description_text": "", "features_text": "TE RECOMENDAMOS | -2% | GLORIA | Filete de Atún en Agua y Sal GLORIA Lata 140g | 5 | 80 | 2% | CAMPOMAR | Duo Pack Trozos de Atún CAMPOMAR Lata 150g x 2un | 11 | 60 | -15% | PRIMOR | Trozos de Atún PRIMOR en Aceite Vegetal Lata 140g | 6 | 50 | 15% | FLORIDA | Filete de Atún en Aceite Vegetal FLORIDA Lata 80g Paquete 3un | No disponible | REAL | Sólido de Atún REAL en Aceite Girasol Lata 140g | Sólido de Atún REAL en Aceite de Oliva Lata 140g | Lomos de Atún en Aceite Vegetal CAMPOMAR Lata 150g | 30 | Filete de Atún CAMPOMAR en Aceite Vegetal Lata 150g | Filete de Atún Claro en Aceite Vegetal CAMPOMAR Lata 150g | Trozos de Caballa en Aceite BELL'S Lata 170g | 40 | Entérate de eventos exclusivos y promociones especiales que tenemos para ti! | SUSCRIBIRME | Acepto las políticas de tratamientos de datos personales | Razón Social: Compañía Food Retail S.A.C. RUC: 20608300393. Todos los derechos reservados Vivanda 2023. | | Hola! | Encuentra todo lo que necesitas en Vivanda online | Términos más buscados | 1. | quesos | 2. | vino | 3. | café | 4. | quark 500g | 5. | leche | 6. | pollo | 7. | yogurt | 8. | lunch florencia | 9. | agua | 10 | vinos", "specifications_text": "", "benefits_text": "", "details_text": "", "other_sections": "", "sections": {"Características": ["TE RECOMENDAMOS", "-2%", "GLORIA", "Filete de Atún en Agua y Sal GLORIA Lata 140g", "5", "80", "2%", "CAMPOMAR", "Duo Pack Trozos de Atún CAMPOMAR Lata 150g x 2un", "11", "60", "-15%", "PRIMOR", "Trozos de Atún PRIMOR en Aceite Vegetal Lata 140g", "6", "50", "15%", "FLORIDA", "Filete de Atún en Aceite Vegetal FLORIDA Lata 80g Paquete 3un", "No disponible", "REAL", "Sólido de Atún REAL en Aceite Girasol Lata 140g", "Sólido de Atún REAL en Aceite de Oliva Lata 140g", "Lomos de Atún en Ace Vegetales CAMPOMAR Lata 150g", "30", "Filete de Atún CAMPOMAR en Aceite Vegetal Lata 150g", "Filete de Atún Claro en Ace Vegetales CAMPOMAR Lata 150g", "Trozos de Caballa en Aceite BELL'S Lata 170g", "40", "¡Entérate de eventos exclusivos y promociones especiales que tenemos para ti!", "SUSCRIBIRME", "Acepto las políticas de tratamiento de datos personales", "Razón social: Compañía Food Retail S.A.C. RUC: 20608300393. Todos los derechos reservados Vivanda 2023.", "¡Hola!", "Encuentra todo lo que necesitas en Vivanda online", "Términos más buscados", "1.", "quesos", "2.", "vino", "3.", "cafe", "4.", "quark 500g", "5.", "leche", "6.", "pollo", "7.", "yogurt", "8.", "lunch florencia", "9.", "agua", "10.", "vinos"]}, "txt_path": "dataset/txt_limpios/1196.txt", "html_path": "dataset/paginas_descargadas/1196.html", "es_status": "ET", "category_canonical": "sin_categoria", "decision": "discard", "match_score": 0.3, "reasons": "no_category_detected;price_parse_failed"}
{"source_id": "1197", "title": "Centro de preferencia de la privacidad", "description": "", "breadcrumbs": "Activas siempre > 140g", "price_raw": "", "currency_raw": "PEN", "url": "", "seller": "Desconocido", "availability": "unknown", "country": "PE", "product_name": "Centro de preferencia de la privacidad", "brand": "Activas siempre", "reference": "", "unit": "140g", "price_amount": null, "price_currency": "PEN", "price_symbol": "", "price_text": "", "price_amount_filled": "55.14", "price_is_imputed": "True", "price_imputation_source": "country_mean", "price_amount_usd": "", "price_amount_usd_filled": "15.5336", "fx_rate_local_per_usd": "3.55", "fx_source": "from_peru_cambio_dolar", "information_text": "", "description_text": "", "features_text": "", "specifications_text": "", "benefits_text": "", "details_text": "", "other_sections": "", "sections": {}, "txt_path": "dataset/txt_limpios/1197.txt", "html_path": "dataset/paginas_descargadas/1197.html", "es_status": "EN", "category_canonical": "sin_categoria", "decision": "discard", "match_score": 0.3, "reasons": "no_category_detected;price_parse_failed"}
{"source_id": "1198", "title": "Centro de preferencia de la privacidad", "description": "", "breadcrumbs": "Activas siempre > 140g", "price_raw": "", "currency_raw": "PEN", "url": "", "seller": "Desconocido", "availability": "unknown", "country": "PE", "product_name": "Centro de preferencia de la privacidad", "brand": "Activas siempre", "reference": "", "unit": "140g", "price_amount": null, "price_currency": "PEN", "price_symbol": "", "price_text": "", "price_amount_filled": "55.14", "price_is_imputed": "True", "price_imputation_source": "country_mean", "price_amount_usd": "", "price_amount_usd_filled": "15.5336", "fx_rate_local_per_usd": "3.55", "fx_source": "from_peru_cambio_dolar", "information_text": "", "description_text": "", "features_text": "TE RECOMENDAMOS | -15% | FLORIDA | Filete de Atún FLORIDA en Aceite Girasol Lata 140g | 6 | 80 | 5 | 15% | CAMPOMAR | Duo Pack Trozos de Atún CAMPOMAR Lata 150g x 2un | 11 | 60 | Trozos de Atún en Aceite Vegetal CAMPOMAR Lata 150g | 20 | Filete de Atún CAMPOMAR en Aceite Lata 150g Paquete 2un | 12 | Sólido de Atún REAL en Aceite de Oliva Lata 140g | EL CORTE INGLÉS | Lomos de Atún en Aceite de Girasol EL CORTE INGLÉS Pack 3 Lata 56g | 30 | BELL'S | Filete de Atún BELL'S en Agua Lata 150gr | 4 | 90 | LA GITANA | Conserva de Sardina LA GITANA Caja 125g | 10 | -2% | GLORIA | Filete de Atún en Agua y Sal GLORIA Lata 140g | 2% | - Entérate de eventos exclusivos y promociones especiales que tenemos para ti! | SUSCRIBIRME | Acepto las políticas de tratamientos de datos personales | Razón Social: Compañía Food Retail S.A.C. RUC: 20608300393. Todos los derechos reservados Vivanda 2023. | | Hola! | Encuentra todo lo que necesitas en Vivanda online | Términos más buscados | 1. | quesos | 2. | vino | 3. | café | 4. | quark 500g | 5. | leche | 6. | pollo | 7. | yogurt | 8. | lunch florencia | 9. | agua | 10 | vinos", "specifications_text": "", "benefits_text": "", "details_text": "", "other_sections": "", "sections": {"Características": ["TE RECOMENDAMOS", "-15%", "FLORIDA", "Filete de Atún FLORIDA en Aceite Girasol Lata 140g", "6", "80", "5", "15%", "CAMPOMAR", "Duo Pack Trozos de Atún CAMPOMAR Lata 150g x 2un", "11", "60", "Trozos de Atún en Aceite Vegetal CAMPOMAR Lata 150g", "20", "Filete de Atún CAMPOMAR en Aceite Lata 150g Paquete 2un", "12", "Sólido de Atún REAL en Aceite de Oliva Lata 140g", "EL CORTE INGLÉS", "Lomos de Atún en Aceite de Girasol EL CORTE INGLÉS Pack 3 Lata 56g", "30", "BELL'S", "Filete de Atún BELL'S en Agua Lata 150gr", "4", "90", "LA GITANA", "Conserva de Sardina LA GITANA Caja 125g", "10", "-2%", "GLORIA", "Filete de Atún en Agua y Sal GLORIA Lata 140g", "2%", "¡Entérate de eventos exclusivos y promociones especiales que tenemos para ti!", "SUSCRIBIRME", "Acepto las políticas de tratamiento de datos personales", "Razón social: Compañía Food Retail S.A.C. RUC: 20608300393. Todos los derechos reservados Vivanda 2023.", "¡Hola!", "Encuentra todo lo que necesitas en Vivanda online", "Términos más buscados", "1.", "quesos", "2.", "vino", "3.", "cafe", "4.", "quark 500g", "5.", "leche", "6.", "pollo", "7.", "yogurt", "8.", "lunch florencia", "9.", "agua", "10.", "vinos"]}, "txt_path": "dataset/txt_limpios/1198.txt", "html_path": "dataset/paginas_descargadas/1198.html", "es_status": "ET", "category_canonical": "sin_categoria", "decision": "discard", "match_score": 0.3, "reasons": "no_category_detected;price_parse_failed"}
{"source_id": "304", "title": "Cerveja Praya Witbier 600ml", "description": "", "breadcrumbs": "Descripción > 600ml", "price_raw": "", "currency_raw": "", "url": "", "seller": "Desconocido", "availability": "unknown", "country": "UNKNOWN", "product_name": "Cerveja Praya Witbier 600ml", "brand": "Descripción", "reference": "", "unit": "600ml", "price_amount": null, "price_currency": "", "price_symbol": "", "price_text": "", "price_amount_filled": "127.27", "price_is_imputed": "True", "price_imputation_source": "category_country_mean", "price_amount_usd": "", "price_amount_usd_filled": "127.2675", "fx_rate_local_per_usd": "1.0", "fx_source": "default_1usd", "information_text": "", "description_text": "", "features_text": "", "specifications_text": "", "benefits_text": "", "details_text": "", "other_sections": "", "sections": {}, "txt_path": "dataset/txt_limpios/304.txt", "html_path": "dataset/paginas_descargadas/304.html", "es_status": "ET", "category_canonical": "cerveza", "decision": "discard", "match_score": 0.6, "reasons": "price_parse_failed;price<=0"}
{"source_id": "1567", "title": "Cervejas Tradicionais", "description": "", "breadcrumbs": "Cerveja Heineken Garrafa 600ml > 600ml", "price_raw": "13.19", "currency_raw": "BRL", "url": "", "seller": "Desconocido", "availability": "unknown", "country": "BR", "product_name": "Cervejas Tradicionais", "brand": "Cerveja Heineken Garrafa 600ml", "reference": "", "unit": "600ml", "price_amount": 13.19, "price_currency": "BRL", "price_symbol": "R$", "price_text": "R$13,19", "price_amount_filled": "13.19", "price_is_imputed": "False", "price_imputation_source": "original", "price_amount_usd": "2.4211", "price_amount_usd_filled": "2.4211", "fx_rate_local_per_usd": "5.448", "fx_source": "from_brasil_cambio_dolar", "information_text": "", "description_text": "", "features_text": "", "specifications_text": "", "benefits_text": "", "details_text": "", "other_sections": "", "sections": {}, "txt_path": "dataset/txt_limpios/1567.txt", "html_path": "dataset/paginas_descargadas/1567.html", "es_status": "EN", "category_canonical": "cerveza", "decision": "keep", "match_score": 0.6, "reasons": "heuristic_default"}
{"source_id": "1570", "title": "Cervejas Tradicionais", "description": "", "breadcrumbs": "R$ 6,39 > 330ml", "price_raw": "6.39", "currency_raw": "BRL", "url": "", "seller": "Desconocido", "availability": "unknown", "country": "BR", "product_name": "Cervejas Tradicionais", "brand": "R$ 6,39", "reference": "", "unit": "330ml", "price_amount": 6.39, "price_currency": "BRL", "price_symbol": "R$", "price_text": "R$6,39", "price_amount_filled": "6.39", "price_is_imputed": "False", "price_imputation_source": "original", "price_amount_usd": "1.1729", "price_amount_usd_filled": "1.1729", "fx_rate_local_per_usd": "5.448", "fx_source": "from_brasil_cambio_dolar", "information_text": "", "description_text": "", "features_text": "", "specifications_text": "", "benefits_text": "", "details_text": "", "other_sections": "", "sections": {}, "txt_path": "dataset/txt_limpios/1570.txt", "html_path": "dataset/paginas_descargadas/1570.html", "es_status": "EN", "category_canonical": "sin_categoria", "decision": "discard", "match_score": 0.3, "reasons": "no_category_detected"}
{"source_id": "1574", "title": "Cervejas Tradicionais", "description": "", "breadcrumbs": "de > 350ml", "price_raw": "3.99", "currency_raw": "BRL", "url": "", "seller": "Desconocido", "availability": "unknown", "country": "BR", "product_name": "Cervejas Tradicionais", "brand": "de", "reference": "", "unit": "350ml", "price_amount": 3.99, "price_currency": "BRL", "price_symbol": "R$", "price_text": "R$3,99", "price_amount_filled": "3.99", "price_is_imputed": "False", "price_imputation_source": "original", "price_amount_usd": "0.7324", "price_amount_usd_filled": "0.7324", "fx_rate_local_per_usd": "5.448", "fx_source": "from_brasil_cambio_dolar", "information_text": "", "description_text": "", "features_text": "", "specifications_text": "", "benefits_text": "", "details_text": "", "other_sections": "", "sections": {}, "txt_path": "dataset/txt_limpios/1574.txt", "html_path": "dataset/paginas_descargadas/1574.html", "es_status": "EN", "category_canonical": "sin_categoria", "decision": "discard", "match_score": 0.3, "reasons": "no_category_detected"}
{"source_id": "1578", "title": "Cervejas Tradicionais", "description": "", "breadcrumbs": "R$ 5,59 > 330ml", "price_raw": "5.59", "currency_raw": "BRL", "url": "", "seller": "Desconocido", "availability": "unknown", "country": "BR", "product_name": "Cervejas Tradicionais", "brand": "R$ 5,59", "reference": "", "unit": "330ml", "price_amount": 5.59, "price_currency": "BRL", "price_symbol": "R$", "price_text": "R$5,59", "price_amount_filled": "5.59", "price_is_imputed": "False", "price_imputation_source": "original", "price_amount_usd": "1.0261", "price_amount_usd_filled": "1.0261", "fx_rate_local_per_usd": "5.448", "fx_source": "from_brasil_cambio_dolar", "information_text": "", "description_text": "", "features_text": "", "specifications_text": "", "benefits_text": "", "details_text": "", "other_sections": "", "sections": {}, "txt_path": "dataset/txt_limpios/1578.txt", "html_path": "dataset/paginas_descargadas/1578.html", "es_status": "EN", "category_canonical": "sin_categoria", "decision": "discard", "match_score": 0.3, "reasons": "no_category_detected"}
{"source_id": "1581", "title": "Cervejas Tradicionais", "description": "", "breadcrumbs": "R$ 5,19 > 330ml", "price_raw": "5.19", "currency_raw": "BRL", "url": "", "seller": "Desconocido", "availability": "unknown", "country": "BR", "product_name": "Cervejas Tradicionais", "brand": "R$ 5,19", "reference": "", "unit": "330ml", "price_amount": 5.19, "price_currency": "BRL", "price_symbol": "R$", "price_text": "R$5,19", "price_amount_filled": "5.19", "price_is_imputed": "False", "price_imputation_source": "original", "price_amount_usd": "0.9526", "price_amount_usd_filled": "0.9526", "fx_rate_local_per_usd": "5.448", "fx_source": "from_brasil_cambio_dolar", "information_text": "", "description_text": "", "features_text": "", "specifications_text": "", "benefits_text": "", "details_text": "", "other_sections": "", "sections": {}, "txt_path": "dataset/txt_limpios/1581.txt", "html_path": "dataset/paginas_descargadas/1581.html", "es_status": "EN", "category_canonical": "sin_categoria", "decision": "discard", "match_score": 0.3, "reasons": "no_category_detected"}
{"source_id": "210", "title": "Cervejas Tradicionais", "description": "", "breadcrumbs": "Cerveja Heineken Garrafa 600ml > 600ml", "price_raw": "13.49", "currency_raw": "BRL", "url": "", "seller": "Desconocido", "availability": "unknown", "country": "BR", "product_name": "Cervejas Tradicionais", "brand": "Cerveja Heineken Garrafa 600ml", "reference": "", "unit": "600ml", "price_amount": 13.49, "price_currency": "BRL", "price_symbol": "R$", "price_text": "R$13,49", "price_amount_filled": "13.49", "price_is_imputed": "False", "price_imputation_source": "original", "price_amount_usd": "2.4761", "price_amount_usd_filled": "2.4761", "fx_rate_local_per_usd": "5.448", "fx_source": "from_brasil_cambio_dolar", "information_text": "", "description_text": "", "features_text": "", "specifications_text": "", "benefits_text": "", "details_text": "", "other_sections": "", "sections": {}, "txt_path": "dataset/txt_limpios/210.txt", "html_path": "dataset/paginas_descargadas/210.html", "es_status": "EN", "category_canonical": "cerveza", "decision": "keep", "match_score": 0.6, "reasons": "heuristic_default"}
{"source_id": "211", "title": "Cervejas Tradicionais", "description": "", "breadcrumbs": "R$ 6,49 > 330ml", "price_raw": "6.49", "currency_raw": "BRL", "url": "", "seller": "Desconocido", "availability": "unknown", "country": "BR", "product_name": "Cervejas Tradicionais", "brand": "R$ 6,49", "reference": "", "unit": "330ml", "price_amount": 6.49, "price_currency": "BRL", "price_symbol": "R$", "price_text": "R$6,49", "price_amount_filled": "6.49", "price_is_imputed": "False", "price_imputation_source": "original", "price_amount_usd": "1.1913", "price_amount_usd_filled": "1.1913", "fx_rate_local_per_usd": "5.448", "fx_source": "from_brasil_cambio_dolar", "information_text": "", "description_text": "", "features_text": "", "specifications_text": "", "benefits_text": "", "details_text": "", "other_sections": "", "sections": {}, "txt_path": "dataset/txt_limpios/211.txt", "html_path": "dataset/paginas_descargadas/211.html", "es_status": "EN", "category_canonical": "sin_categoria", "decision": "discard", "match_score": 0.3, "reasons": "no_category_detected"}
{"source_id": "212", "title": "Cervejas Tradicionais", "description": "", "breadcrumbs": "R$ 3,99 > 350ml", "price_raw": "3.99", "currency_raw": "BRL", "url": "", "seller": "Desconocido", "availability": "unknown", "country": "BR", "product_name": "Cervejas Tradicionais", "brand": "R$ 3,99", "reference": "", "unit": "350ml", "price_amount": 3.99, "price_currency": "BRL", "price_symbol": "R$", "price_text": "R$3,99", "price_amount_filled": "3.99", "price_is_imputed": "False", "price_imputation_source": "original", "price_amount_usd": "0.7324", "price_amount_usd_filled": "0.7324", "fx_rate_local_per_usd": "5.448", "fx_source": "from_brasil_cambio_dolar", "information_text": "", "description_text": "", "features_text": "", "specifications_text": "", "benefits_text": "", "details_text": "", "other_sections": "", "sections": {}, "txt_path": "dataset/txt_limpios/212.txt", "html_path": "dataset/paginas_descargadas/212.html", "es_status": "EN", "category_canonical": "sin_categoria", "decision": "discard", "match_score": 0.3, "reasons": "no_category_detected"}
{"source_id": "213", "title": "Cervejas Tradicionais", "description": "", "breadcrumbs": "R$ 5,79 > 330ml", "price_raw": "5.79", "currency_raw": "BRL", "url": "", "seller": "Desconocido", "availability": "unknown", "country": "BR", "product_name": "Cervejas Tradicionais", "brand": "R$ 5,79", "reference": "", "unit": "330ml", "price_amount": 5.79, "price_currency": "BRL", "price_symbol": "R$", "price_text": "R$5,79", "price_amount_filled": "5.79", "price_is_imputed": "False", "price_imputation_source": "original", "price_amount_usd": "1.0628", "price_amount_usd_filled": "1.0628", "fx_rate_local_per_usd": "5.448", "fx_source": "from_brasil_cambio_dolar", "information_text": "", "description_text": "", "features_text": "", "specifications_text": "", "benefits_text": "", "details_text": "", "other_sections": "", "sections": {}, "txt_path": "dataset/txt_limpios/213.txt", "html_path": "dataset/paginas_descargadas/213.html", "es_status": "EN", "category_canonical": "sin_categoria", "decision": "discard", "match_score": 0.3, "reasons": "no_category_detected"}
{"source_id": "214", "title": "Cervejas Tradicionais", "description": "", "breadcrumbs": "R$ 5,69 > 330ml", "price_raw": "5.69", "currency_raw": "BRL", "url": "", "seller": "Desconocido", "availability": "unknown", "country": "BR", "product_name": "Cervejas Tradicionais", "brand": "R$ 5,69", "reference": "", "unit": "330ml", "price_amount": 5.69, "price_currency": "BRL", "price_symbol": "R$", "price_text": "R$5,69", "price_amount_filled": "5.69", "price_is_imputed": "False", "price_imputation_source": "original", "price_amount_usd": "1.0444", "price_amount_usd_filled": "1.0444", "fx_rate_local_per_usd": "5.448", "fx_source": "from_brasil_cambio_dolar", "information_text": "", "description_text": "", "features_text": "", "specifications_text": "", "benefits_text": "", "details_text": "", "other_sections": "", "sections": {}, "txt_path": "dataset/txt_limpios/214.txt", "html_path": "dataset/paginas_descargadas/214.html", "es_status": "EN", "category_canonical": "sin_categoria", "decision": "discard", "match_score": 0.3, "reasons": "no_category_detected"}
{"source_id": "1349", "title": "CERVEZA AMSTEL LATA 355 ML", "description": "¿Deseas recibir notificaciones? Remind me later Permitir Thank you! Please check your email inbox to confirm. Oops! Notifications are disabled.", "breadcrumbs": "Comparar > 355 ML", "price_raw": "1.2", "currency_raw": "USD", "url": "", "seller": "Desconocido", "availability": "unknown", "country": "US", "product_name": "CERVEZA AMSTEL LATA 355 ML", "brand": "Comparar", "reference": "", "unit": "355 ML", "price_amount": 1.2, "price_currency": "USD", "price_symbol": "$", "price_text": "$1,20", "price_amount_filled": "1.2", "price_is_imputed": "False", "price_imputation_source": "original", "price_amount_usd": "1.2", "price_amount_usd_filled": "1.2", "fx_rate_local_per_usd": "1.0", "fx_source": "default_1usd", "information_text": "¿Deseas recibir notificaciones? Remind me later Permitir Thank you! Please check your email inbox to confirm. Oops! Notifications are disabled.", "description_text": "", "features_text": "", "specifications_text": "", "benefits_text": "", "details_text": "", "other_sections": "", "sections": {"Información": ["¿Deseas recibir notificaciones?", "Remind me later", "Permitir", "Thank you! Please check your email inbox to confirm.", "Oops! Notifications are disabled."]}, "txt_path": "dataset/txt_limpios/1349.txt", "html_path": "dataset/paginas_descargadas/1349.html", "es_status": "EN", "category_canonical": "cerveza", "decision": "keep", "match_score": 0.6, "reasons": "heuristic_default"}
