{"source_id": "621", "title": "(Gr a $ 4)", "description": "", "breadcrumbs": "$ 5.070", "price_raw": "4.0", "currency_raw": "", "url": "", "seller": "Desconocido", "availability": "unknown", "country": "UNKNOWN", "product_name": "(Gr a $ 4)", "brand": "$ 5.070", "reference": "", "unit": "", "price_amount": 4.0, "price_currency": "", "price_symbol": "$", "price_text": "$4", "price_amount_filled": "4.0", "price_is_imputed": "False", "price_imputation_source": "original", "price_amount_usd": "4.0", "price_amount_usd_filled": "4.0", "fx_rate_local_per_usd": "1.0", "fx_source": "default_1usd", "information_text": "", "description_text": "", "features_text": "", "specifications_text": "", "benefits_text": "", "details_text": "", "other_sections": "", "sections": {}, "txt_path": "dataset/txt_limpios/621.txt", "html_path": "dataset/paginas_descargadas/621.html", "es_status": "EN", "category_canonical": "sin_categoria", "decision": "discard", "match_score": 0.3, "reasons": "no_category_detected"}
{"source_id": "622", "title": "(Gr a $ 4)", "description": "", "breadcrumbs": "$ 4.680", "price_raw": "4.0", "currency_raw": "", "url": "", "seller": "Desconocido", "availability": "unknown", "country": "UNKNOWN", "product_name": "(Gr a $ 4)", "brand": "$ 4.680", "reference": "", "unit": "", "price_amount": 4.0, "price_currency": "", "price_symbol": "$", "price_text": "$4", "price_amount_filled": "4.0", "price_is_imputed": "False", "price_imputation_source": "original", "price_amount_usd": "4.0", "price_amount_usd_filled": "4.0", "fx_rate_local_per_usd": "1.0", "fx_source": "default_1usd", "information_text": "", "description_text": "", "features_text": "", "specifications_text": "", "benefits_text": "", "details_text": "", "other_sections": "", "sections": {}, "txt_path": "dataset/txt_limpios/622.txt", "html_path": "dataset/paginas_descargadas/622.html", "es_status": "EN", "category_canonical": "sin_categoria", "decision": "discard", "match_score": 0.3, "reasons": "no_category_detected"}
{"source_id": "623", "title": "(Gr a $ 4)", "description": "", "breadcrumbs": "$ 4.460", "price_raw": "4.0", "currency_raw": "", "url": "", "seller": "Desconocido", "availability": "unknown", "country": "UNKNOWN", "product_name": "(Gr a $ 4)", "brand": "$ 4.460", "reference": "", "unit": "", "price_amount": 4.0, "price_currency": "", "price_symbol": "$", "price_text": "$4", "price_amount_filled": "4.0", "price_is_imputed": "False", "price_imputation_source": "original", "price_amount_usd": "4.0", "price_amount_usd_filled": "4.0", "fx_rate_local_per_usd": "1.0", "fx_source": "default_1usd", "information_text": "", "description_text": "", "features_text": "", "specifications_text": "", "benefits_text": "", "details_text": "", "other_sections": "", "sections": {}, "txt_path": "dataset/txt_limpios/623.txt", "html_path": "dataset/paginas_descargadas/623.html", "es_status": "EN", "category_canonical": "sin_categoria", "decision": "discard", "match_score": 0.3, "reasons": "no_category_detected"}
{"source_id": "624", "title": "(Gr a $ 4)", "description": "", "breadcrumbs": "$ 10.650", "price_raw": "4.0", "currency_raw": "", "url": "", "seller": "Desconocido", "availability": "unknown", "country": "UNKNOWN", "product_name": "(Gr a $ 4)", "brand": "$ 10.650", "reference": "", "unit": "", "price_amount": 4.0, "price_currency": "", "price_symbol": "$", "price_text": "$4", "price_amount_filled": "4.0", "price_is_imputed": "False", "price_imputation_source": "original", "price_amount_usd": "4.0", "price_amount_usd_filled": "4.0", "fx_rate_local_per_usd": "1.0", "fx_source": "default_1usd", "information_text": "", "description_text": "", "features_text": "", "specifications_text": "", "benefits_text": "", "details_text": "", "other_sections": "", "sections": {}, "txt_path": "dataset/txt_limpios/624.txt", "html_path": "dataset/paginas_descargadas/624.html", "es_status": "EN", "category_canonical": "sin_categoria", "decision": "discard", "match_score": 0.3, "reasons": "no_category_detected"}
{"source_id": "655", "title": "(Gr a $ 4)", "description": "", "breadcrumbs": "$ 4.830", "price_raw": "4.0", "currency_raw": "", "url": "", "seller": "Desconocido", "availability": "unknown", "country": "UNKNOWN", "product_name": "(Gr a $ 4)", "brand": "$ 4.830", "reference": "", "unit": "", "price_amount": 4.0, "price_currency": "", "price_symbol": "$", "price_text": "$4", "price_amount_filled": "4.0", "price_is_imputed": "False", "price_imputation_source": "original", "price_amount_usd": "4.0", "price_amount_usd_filled": "4.0", "fx_rate_local_per_usd": "1.0", "fx_source": "default_1usd", "information_text": "", "description_text": "", "features_text": "", "specifications_text": "", "benefits_text": "", "details_text": "", "other_sections": "", "sections": {}, "txt_path": "dataset/txt_limpios/655.txt", "html_path": "dataset/paginas_descargadas/655.html", "es_status": "EN", "category_canonical": "sin_categoria", "decision": "discard", "match_score": 0.3, "reasons": "no_category_detected"}
{"source_id": "656", "title": "(Gr a $ 4)", "description": "", "breadcrumbs": "19", "price_raw": "4.0", "currency_raw": "", "url": "", "seller": "Desconocido", "availability": "unknown", "country": "UNKNOWN", "product_name": "(Gr a $ 4)", "brand": "19", "reference": "", "unit": "", "price_amount": 4.0, "price_currency": "", "price_symbol": "$", "price_text": "$4", "price_amount_filled": "4.0", "price_is_imputed": "False", "price_imputation_source": "original", "price_amount_usd": "4.0", "price_amount_usd_filled": "4.0", "fx_rate_local_per_usd": "1.0", "fx_source": "default_1usd", "information_text": "", "description_text": "", "features_text": "", "specifications_text": "", "benefits_text": "", "details_text": "", "other_sections": "", "sections": {}, "txt_path": "dataset/txt_limpios/656.txt", "html_path": "dataset/paginas_descargadas/656.html", "es_status": "EN", "category_canonical": "sin_categoria", "decision": "discard", "match_score": 0.3, "reasons": "no_category_detected"}
{"source_id": "754", "title": "(Gr a $ 4)", "description": "", "breadcrumbs": "10", "price_raw": "4.0", "currency_raw": "", "url": "", "seller": "Desconocido", "availability": "unknown", "country": "UNKNOWN", "product_name": "(Gr a $ 4)", "brand": "10", "reference": "", "unit": "", "price_amount": 4.0, "price_currency": "", "price_symbol": "$", "price_text": "$4", "price_amount_filled": "4.0", "price_is_imputed": "False", "price_imputation_source": "original", "price_amount_usd": "4.0", "price_amount_usd_filled": "4.0", "fx_rate_local_per_usd": "1.0", "fx_source": "default_1usd", "information_text": "", "description_text": "", "features_text": "", "specifications_text": "", "benefits_text": "", "details_text": "", "other_sections": "", "sections": {}, "txt_path": "dataset/txt_limpios/754.txt", "html_path": "dataset/paginas_descargadas/754.html", "es_status": "EN", "category_canonical": "sin_categoria", "decision": "discard", "match_score": 0.3, "reasons": "no_category_detected"}
{"source_id": "755", "title": "(Gr a $ 4)", "description": "", "breadcrumbs": "$ 4.900", "price_raw": "4.0", "currency_raw": "", "url": "", "seller": "Desconocido", "availability": "unknown", "country": "UNKNOWN", "product_name": "(Gr a $ 4)", "brand": "$ 4.900", "reference": "", "unit": "", "price_amount": 4.0, "price_currency": "", "price_symbol": "$", "price_text": "$4", "price_amount_filled": "4.0", "price_is_imputed": "False", "price_imputation_source": "original", "price_amount_usd": "4.0", "price_amount_usd_filled": "4.0", "fx_rate_local_per_usd": "1.0", "fx_source": "default_1usd", "information_text": "", "description_text": "", "features_text": "", "specifications_text": "", "benefits_text": "", "details_text": "", "other_sections": "", "sections": {}, "txt_path": "dataset/txt_limpios/755.txt", "html_path": "dataset/paginas_descargadas/755.html", "es_status": "EN", "category_canonical": "sin_categoria", "decision": "discard", "match_score": 0.3, "reasons": "no_category_detected"}
{"source_id": "756", "title": "(Gr a $ 4)", "description": "", "breadcrumbs": "$ 2.500", "price_raw": "4.0", "currency_raw": "", "url": "", "seller": "Desconocido", "availability": "unknown", "country": "UNKNOWN", "product_name": "(Gr a $ 4)", "brand": "$ 2.500", "reference": "", "unit": "", "price_amount": 4.0, "price_currency": "", "price_symbol": "$", "price_text": "$4", "price_amount_filled": "4.0", "price_is_imputed": "False", "price_imputation_source": "original", "price_amount_usd": "4.0", "price_amount_usd_filled": "4.0", "fx_rate_local_per_usd": "1.0", "fx_source": "default_1usd", "information_text": "", "description_text": "", "features_text": "", "specifications_text": "", "benefits_text": "", "details_text": "", "other_sections": "", "sections": {}, "txt_path": "dataset/txt_limpios/756.txt", "html_path": "dataset/paginas_descargadas/756.html", "es_status": "EN", "category_canonical": "sin_categoria", "decision": "discard", "match_score": 0.3, "reasons": "no_category_detected"}
{"source_id": "758", "title": "(Gr a $ 4)", "description": "", "breadcrumbs": "$ 2.100", "price_raw": "4.0", "currency_raw": "", "url": "", "seller": "Desconocido", "availability": "unknown", "country": "UNKNOWN", "product_name": "(Gr a $ 4)", "brand": "$ 2.100", "reference": "", "unit": "", "price_amount": 4.0, "price_currency": "", "price_symbol": "$", "price_text": "$4", "price_amount_filled": "4.0", "price_is_imputed": "False", "price_imputation_source": "original", "price_amount_usd": "4.0", "price_amount_usd_filled": "4.0", "fx_rate_local_per_usd": "1.0", "fx_source": "default_1usd", "information_text": "", "description_text": "", "features_text": "", "specifications_text": "", "benefits_text": "", "details_text": "", "other_sections": "", "sections": {}, "txt_path": "dataset/txt_limpios/758.txt", "html_path": "dataset/paginas_descargadas/758.html", "es_status": "EN", "category_canonical": "sin_categoria", "decision": "discard", "match_score": 0.3, "reasons": "no_category_detected"}
{"source_id": "777", "title": "(Gr a $ 4)", "description": "", "breadcrumbs": "12", "price_raw": "4.0", "currency_raw": "", "url": "", "seller": "Desconocido", "availability": "unknown", "country": "UNKNOWN", "product_name": "(Gr a $ 4)", "brand": "12", "reference": "", "unit": "", "price_amount": 4.0, "price_currency": "", "price_symbol": "$", "price_text": "$4", "price_amount_filled": "4.0", "price_is_imputed": "False", "price_imputation_source": "original", "price_amount_usd": "4.0", "price_amount_usd_filled": "4.0", "fx_rate_local_per_usd": "1.0", "fx_source": "default_1usd", "information_text": "", "description_text": "", "features_text": "", "specifications_text": "", "benefits_text": "", "details_text": "", "other_sections": "", "sections": {}, "txt_path": "dataset/txt_limpios/777.txt", "html_path": "dataset/paginas_descargadas/777.html", "es_status": "EN", "category_canonical": "sin_categoria", "decision": "discard", "match_score": 0.3, "reasons": "no_category_detected"}
{"source_id": "650", "title": "(Gr a $ 42)", "description": "", "breadcrumbs": "$ 17.000 > 6 g", "price_raw": "42.0", "currency_raw": "", "url": "", "seller": "Desconocido", "availability": "unknown", "country": "UNKNOWN", "product_name": "(Gr a $ 42)", "brand": "$ 17.000", "reference": "", "unit": "6 g", "price_amount": 42.0, "price_currency": "", "price_symbol": "$", "price_text": "$42", "price_amount_filled": "42.0", "price_is_imputed": "False", "price_imputation_source": "original", "price_amount_usd": "42.0", "price_amount_usd_filled": "42.0", "fx_rate_local_per_usd": "1.0", "fx_source": "default_1usd", "information_text": "", "description_text": "", "features_text": "", "specifications_text": "", "benefits_text": "", "details_text": "", "other_sections": "", "sections": {}, "txt_path": "dataset/txt_limpios/650.txt", "html_path": "dataset/paginas_descargadas/650.html", "es_status": "EN", "category_canonical": "sin_categoria", "decision": "discard", "match_score": 0.3, "reasons": "no_category_detected"}
{"source_id": "649", "title": "(Gr a $ 45)", "description": "", "breadcrumbs": "20", "price_raw": "45.0", "currency_raw": "", "url": "", "seller": "Desconocido", "availability": "unknown", "country": "UNKNOWN", "product_name": "(Gr a $ 45)", "brand": "20", "reference": "", "unit": "", "price_amount": 45.0, "price_currency": "", "price_symbol": "$", "price_text": "$45", "price_amount_filled": "45.0", "price_is_imputed": "False", "price_imputation_source": "original", "price_amount_usd": "45.0", "price_amount_usd_filled": "45.0", "fx_rate_local_per_usd": "1.0", "fx_source": "default_1usd", "information_text": "", "description_text": "", "features_text": "", "specifications_text": "", "benefits_text": "", "details_text": "", "other_sections": "", "sections": {}, "txt_path": "dataset/txt_limpios/649.txt", "html_path": "dataset/paginas_descargadas/649.html", "es_status": "EN", "category_canonical": "sin_categoria", "decision": "discard", "match_score": 0.3, "reasons": "no_category_detected"}
{"source_id": "780", "title": "(Gr a $ 46)", "description": "", "breadcrumbs": "$ 7.635", "price_raw": "46.0", "currency_raw": "", "url": "", "seller": "Desconocido", "availability": "unknown", "country": "UNKNOWN", "product_name": "(Gr a $ 46)", "brand": "$ 7.635", "reference": "", "unit": "", "price_amount": 46.0, "price_currency": "", "price_symbol": "$", "price_text": "$46", "price_amount_filled": "46.0", "price_is_imputed": "False", "price_imputation_source": "original", "price_amount_usd": "46.0", "price_amount_usd_filled": "46.0", "fx_rate_local_per_usd": "1.0", "fx_source": "default_1usd", "information_text": "", "description_text": "", "features_text": "", "specifications_text": "", "benefits_text": "", "details_text": "", "other_sections": "", "sections": {}, "txt_path": "dataset/txt_limpios/780.txt", "html_path": "dataset/paginas_descargadas/780.html", "es_status": "EN", "category_canonical": "sin_categoria", "decision": "discard", "match_score": 0.3, "reasons": "no_category_detected"}
{"source_id": "781", "title": "(Gr a $ 47)", "description": "", "breadcrumbs": "20", "price_raw": "47.0", "currency_raw": "", "url": "", "seller": "Desconocido", "availability": "unknown", "country": "UNKNOWN", "product_name": "(Gr a $ 47)", "brand": "20", "reference": "", "unit": "", "price_amount": 47.0, "price_currency": "", "price_symbol": "$", "price_text": "$47", "price_amount_filled": "47.0", "price_is_imputed": "False", "price_imputation_source": "original", "price_amount_usd": "47.0", "price_amount_usd_filled": "47.0", "fx_rate_local_per_usd": "1.0", "fx_source": "default_1usd", "information_text": "", "description_text": "", "features_text": "", "specifications_text": "", "benefits_text": "", "details_text": "", "other_sections": "", "sections": {}, "txt_path": "dataset/txt_limpios/781.txt", "html_path": "dataset/paginas_descargadas/781.html", "es_status": "EN", "category_canonical": "sin_categoria", "decision": "discard", "match_score": 0.3, "reasons": "no_category_detected"}
{"source_id": "625", "title": "(Gr a $ 5)", "description": "", "breadcrumbs": "20", "price_raw": "5.0", "currency_raw": "", "url": "", "seller": "Desconocido", "availability": "unknown", "country": "UNKNOWN", "product_name": "(Gr a $ 5)", "brand": "20", "reference": "", "unit": "", "price_amount": 5.0, "price_currency": "", "price_symbol": "$", "price_text": "$5", "price_amount_filled": "5.0", "price_is_imputed": "False", "price_imputation_source": "original", "price_amount_usd": "5.0", "price_amount_usd_filled": "5.0", "fx_rate_local_per_usd": "1.0", "fx_source": "default_1usd", "information_text": "", "description_text": "", "features_text": "", "specifications_text": "", "benefits_text": "", "details_text": "", "other_sections": "", "sections": {}, "txt_path": "dataset/txt_limpios/625.txt", "html_path": "dataset/paginas_descargadas/625.html", "es_status": "EN", "category_canonical": "sin_categoria", "decision": "discard", "match_score": 0.3, "reasons": "no_category_detected"}
{"source_id": "658", "title": "(Gr a $ 5)", "description": "", "breadcrumbs": "20", "price_raw": "5.0", "currency_raw": "", "url": "", "seller": "Desconocido", "availability": "unknown", "country": "UNKNOWN", "product_name": "(Gr a $ 5)", "brand": "20", "reference": "", "unit": "", "price_amount": 5.0, "price_currency": "", "price_symbol": "$", "price_text": "$5", "price_amount_filled": "5.0", "price_is_imputed": "False", "price_imputation_source": "original", "price_amount_usd": "5.0", "price_amount_usd_filled": "5.0", "fx_rate_local_per_usd": "1.0", "fx_source": "default_1usd", "information_text": "", "description_text": "", "features_text": "", "specifications_text": "", "benefits_text": "", "details_text": "", "other_sections": "", "sections": {}, "txt_path": "dataset/txt_limpios/658.txt", "html_path": "dataset/paginas_descargadas/658.html", "es_status": "EN", "category_canonical": "sin_categoria", "decision": "discard", "match_score": 0.3, "reasons": "no_category_detected"}
{"source_id": "783", "title": "(Gr a $ 55)", "description": "", "breadcrumbs": "$ 11.100", "price_raw": "55.0", "currency_raw": "", "url": "", "seller": "Desconocido", "availability": "unknown", "country": "UNKNOWN", "product_name": "(Gr a $ 55)", "brand": "$ 11.100", "reference": "", "unit": "", "price_amount": 55.0, "price_currency": "", "price_symbol": "$", "price_text": "$55", "price_amount_filled": "55.0", "price_is_imputed": "False", "price_imputation_source": "original", "price_amount_usd": "55.0", "price_amount_usd_filled": "55.0", "fx_rate_local_per_usd": "1.0", "fx_source": "default_1usd", "information_text": "", "description_text": "", "features_text": "", "specifications_text": "", "benefits_text": "", "details_text": "", "other_sections": "", "sections": {}, "txt_path": "dataset/txt_limpios/783.txt", "html_path": "dataset/paginas_descargadas/783.html", "es_status": "EN", "category_canonical": "sin_categoria", "decision": "discard", "match_score": 0.3, "reasons": "no_category_detected"}
{"source_id": "652", "title": "(Gr a $ 64)", "description": "", "breadcrumbs": "$ 13.500", "price_raw": "64.0", "currency_raw": "", "url": "", "seller": "Desconocido", "availability": "unknown", "country": "UNKNOWN", "product_name": "(Gr a $ 64)", "brand": "$ 13.500", "reference": "", "unit": "", "price_amount": 64.0, "price_currency": "", "price_symbol": "$", "price_text": "$64", "price_amount_filled": "64.0", "price_is_imputed": "False", "price_imputation_source": "original", "price_amount_usd": "64.0", "price_amount_usd_filled": "64.0", "fx_rate_local_per_usd": "1.0", "fx_source": "default_1usd", "information_text": "", "description_text": "", "features_text": "", "specifications_text": "", "benefits_text": "", "details_text": "", "other_sections": "", "sections": {}, "txt_path": "dataset/txt_limpios/652.txt", "html_path": "dataset/paginas_descargadas/652.html", "es_status": "EN", "category_canonical": "sin_categoria", "decision": "discard", "match_score": 0.3, "reasons": "no_category_detected"}
{"source_id": "638", "title": "(Gr a $ 65)", "description": "", "breadcrumbs": "$ 18.100", "price_raw": "65.0", "currency_raw": "", "url": "", "seller": "Desconocido", "availability": "unknown", "country": "UNKNOWN", "product_name": "(Gr a $ 65)", "brand": "$ 18.100", "reference": "", "unit": "", "price_amount": 65.0, "price_currency": "", "price_symbol": "$", "price_text": "$65", "price_amount_filled": "65.0", "price_is_imputed": "False", "price_imputation_source": "original", "price_amount_usd": "65.0", "price_amount_usd_filled": "65.0", "fx_rate_local_per_usd": "1.0", "fx_source": "default_1usd", "information_text": "", "description_text": "", "features_text": "", "specifications_text": "", "benefits_text": "", "details_text": "", "other_sections": "", "sections": {}, "txt_path": "dataset/txt_limpios/638.txt", "html_path": "dataset/paginas_descargadas/638.html", "es_status": "EN", "category_canonical": "sin_categoria", "decision": "discard", "match_score": 0.3, "reasons": "no_category_detected"}
{"source_id": "653", "title": "(Gr a $ 67)", "description": "", "breadcrumbs": "$ 30.400", "price_raw": "67.0", "currency_raw": "", "url": "", "seller": "Desconocido", "availability": "unknown", "country": "UNKNOWN", "product_name": "(Gr a $ 67)", "brand": "$ 30.400", "reference": "", "unit": "", "price_amount": 67.0, "price_currency": "", "price_symbol": "$", "price_text": "$67", "price_amount_filled": "67.0", "price_is_imputed": "False", "price_imputation_source": "original", "price_amount_usd": "67.0", "price_amount_usd_filled": "67.0", "fx_rate_local_per_usd": "1.0", "fx_source": "default_1usd", "information_text": "", "description_text": "", "features_text": "", "specifications_text": "", "benefits_text": "", "details_text": "", "other_sections": "", "sections": {}, "txt_path": "dataset/txt_limpios/653.txt", "html_path": "dataset/paginas_descargadas/653.html", "es_status": "EN", "category_canonical": "sin_categoria", "decision": "discard", "match_score": 0.3, "reasons": "no_category_detected"}
