source_id,title,description,breadcrumbs,price_raw,currency_raw,url,seller,availability,country,product_name,brand,reference,unit,price_amount,price_currency,price_symbol,price_text,price_amount_filled,price_is_imputed,price_imputation_source,price_amount_usd,price_amount_usd_filled,fx_rate_local_per_usd,fx_source,information_text,description_text,features_text,specifications_text,benefits_text,details_text,other_sections,sections,txt_path,html_path,es_status,category_canonical,decision,match_score,reasons
1344,LECHE PARMALAT 900 ML ENTERA,Ficha técnica ¿Deseas recibir notificaciones? Remind me later Permitir Thank you! Please check your email inbox to confirm. ¡Oops! Notifications are disabled.,Comparar > 900 ML,0.99,USD,,Desconocido,unknown,US,LECHE PARMALAT 900 ML ENTERA,Comparar,,900 ML,0.99,USD,$,"$0,99",0.99,False,original,0.99,0.99,1.0,default_1usd,Ficha técnica ¿Deseas recibir notificaciones? Remind me later Permitir Thank you! Please check your email inbox to confirm. ¡Oops! Notifications are disabled.,,,,,,,"{""Información"": [""Ficha técnica"", ""¿Deseas recibir notificaciones?"", ""Remind me later"", ""Permitir"", ""Thank you! Please check your email inbox to confirm."", ""Oops! Notifications are disabled.""]}",dataset/txt_limpios/1344.txt,dataset/paginas_descargadas/1344.html,ET,leche,keep,0.60,heuristic_default
796,LECHE SABORIZADA ALPIN PACK X3 185ML,"Ingredientes | Componentes Nombre del producto: Leche Saborizada Alpin Pack x3 185 mL Descripción del producto: La Leche Saborizada Alpin es una bebida láctea lista para consumir, perfecta para cualquier momento del día. Tamaño: 15 cm x 12 cm Peso: 555 mL (3 x 185 mL) Modo de fabricación: Industrial Origen: Nacional SA-000987-2016 Alergenos: Puede contener leche. Componentes: Leche Azúcar Saborizantes (chocolate) Vitaminas (B1, B2, A, Niacina) Ver más También puede interesarte BONYURT 4 UND ALPINA 680 G YOX SURTIDO FRESA Y MELOCOTÓN ALPINA 4 UND - 40... ALPINITO SURTIDO FRESA EL MELOCOTÓN 4 UND - 180 ... AVENA ALPINA VASO 250 ML PONY MALTA GO PET 200 ML LONCHERA SURTIDA FRITOLAY 10 UN 236GR TE HATSU SURTIDO 200 ML CHOCORAMO 65G X 3 UNIDADES Amor y amistad SALCHICHA RANCHERA X 230 G X 7 UD Tratamiento de Datos Garantías Términos y condiciones Superintendencia de Industria y Comercio – SIC 0.17.168-hotfix-2.",Unidades disponibles > 185ML,555.0,,,Desconocido,unknown,UNKNOWN,LECHE SABORIZADA ALPIN PACK X3 185ML,Unidades disponibles,,185ML,555.00,,,555,555.0,False,original,555.0,555.0,1.0,default_1usd,,"Ingredientes | Componentes Nombre del producto: Leche Saborizada Alpin Pack x3 185 mL Descripción del producto: La Leche Saborizada Alpin es una bebida láctea lista para consumir, perfecta para cualquier momento del día. Tamaño: 15 cm x 12 cm Peso: 555 mL (3 x 185 mL) Modo de fabricación: Industrial Origen: Nacional SA-000987-2016 Alergenos: Puede contener leche. Componentes: Leche Azúcar Saborizantes (chocolate) Vitaminas (B1, B2, A, Niacina) Ver más También puede interesarte BONYURT 4 UND ALPINA 680 G YOX SURTIDO FRESA Y MELOCOTÓN ALPINA 4 UND - 40... ALPINITO SURTIDO FRESA EL MELOCOTÓN 4 UND - 180 ... AVENA ALPINA VASO 250 ML PONY MALTA GO PET 200 ML LONCHERA SURTIDA FRITOLAY 10 UN 236GR TE HATSU SURTIDO 200 ML CHOCORAMO 65G X 3 UNIDADES Amor y amistad SALCHICHA RANCHERA X 230 G X 7 UD Tratamiento de Datos Garantías Términos y condiciones Superintendencia de Industria y Comercio – SIC 0.17.168-hotfix-2.",,,,,,"{""Descripción"": [""Ingredientes | Componentes"", ""Nombre del producto: Leche Saborizada Alpin Pack x3 185 mL"", ""Descripción del producto: La Leche Saborizada Alpin es una bebida láctea lista para consumir, perfecta para cualquier momento del día."", ""Tamaño: 15 cm x 12 cm"", ""Peso: 555 mL (3 x 185 mL)"", ""Modo de fabricación: Industrial"", ""Origen: Nacional"", ""SA-000987-2016"", ""Alergenos: Puede contener leche."", ""Componentes: Leche"", ""Azúcar"", ""Saborizantes (chocolate)"", ""Vitaminas (B1, B2, A, Niacina)"", ""Ver más"", ""También puede interesarte"", ""BONYURT 4 UND ALPINA 680 G"", ""YOX SURTIDO FRESA Y MELOCOTÓN ALPINA 4 UND - 40..."", ""ALPINITO SURTIDO FRESA EL MELOCOTÓN 4 UND - 180 ..."", ""AVENA ALPINA VASO 250 ML"", ""PONY MALTA GO PET 200 ML"", ""LONCHERA SURTIDA FRITOLAY 10 UN 236GR"", ""TE HATSU SURTIDO 200 ML"", ""CHOCORAMO 65G X 3 UNIDADES"", ""Amor y amistad"", ""SALCHICHA RANCHERA X 230 G X 7 UD"", ""Tratamiento de Datos"", ""Garantías"", ""Términos y condiciones"", ""Superintendencia de Industria y Comercio – SIC"", ""0.17.168-hotfix-2.""]}",dataset/txt_limpios/796.txt,dataset/paginas_descargadas/796.html,ET,descartado,discard,0.10,excluded_keyword
1342,LECHE TONI TETRABRIK 1 L ENTERA,Ficha técnica Leche Toni Tetra Brik 1 ¿Deseas recibir notificaciones? Remind me later Permitir Thank you! Please check your email inbox to confirm. ¡Oops! Notifications are disabled.,Comparar > 1 L,1.45,USD,,Desconocido,unknown,US,LECHE TONI TETRABRIK 1 L ENTERA,Comparar,,1 L,1.45,USD,$,"$1,45",1.45,False,original,1.45,1.45,1.0,default_1usd,Ficha técnica Leche Toni Tetra Brik 1 ¿Deseas recibir notificaciones? Remind me later Permitir Thank you! Please check your email inbox to confirm. ¡Oops! Notifications are disabled.,,,,,,,"{""Información"": [""Ficha técnica"", ""Leche Toni Tetra Brik 1 L Entera"", ""¿Deseas recibir notificaciones?"", ""Remind me later"", ""Permitir"", ""Thank you! Please check your email inbox to confirm."", ""Oops! Notifications are disabled.""]}",dataset/txt_limpios/1342.txt,dataset/paginas_descargadas/1342.html,ET,leche,keep,0.60,heuristic_default
1341,LECHE VITA 900 ML ENTERA,Ficha técnica Leche Vita funda 900 ml entera ¿Deseas recibir notificaciones? Remind me later Permitir Thank you! Please check your email inbox to confirm. ¡Oops! Notifications are disabled.,Comparar > 900 ML,0.97,USD,,Desconocido,unknown,US,LECHE VITA 900 ML ENTERA,Comparar,,900 ML,0.97,USD,$,"$0,97",0.97,False,original,0.97,0.97,1.0,default_1usd,Ficha técnica Leche Vita funda 900 ml entera ¿Deseas recibir notificaciones? Remind me later Permitir Thank you! Please check your email inbox to confirm. ¡Oops! Notifications are disabled.,,,,,,,"{""Información"": [""Ficha técnica"", ""Leche Vita funda 900 ml entera"", ""¿Deseas recibir notificaciones?"", ""Remind me later"", ""Permitir"", ""Thank you! Please check your email inbox to confirm."", ""Oops! Notifications are disabled.""]}",dataset/txt_limpios/1341.txt,dataset/paginas_descargadas/1341.html,ET,descartado,discard,0.10,excluded_keyword
503,Leches Frescas,,Leches Enteras,,,,Desconocido,unknown,UNKNOWN,Leches Frescas,Leches Enteras,,,,,,,428.01,True,category_country_mean,,428.0052,1.0,default_1usd,,,MARCA | : LA SERENISIMA | SIN TACC | : SI,,,,,"{""Características"": [""MARCA"", "": LA SERENISIMA"", ""SIN TACC"", "": SI""]}",dataset/txt_limpios/503.txt,dataset/paginas_descargadas/503.html,EN,leche,discard,0.60,price_parse_failed;price<=0
504,Leches Larga Vida,,Leches Enteras > 1l,1380.0,,,Desconocido,unknown,UNKNOWN,Leches Larga Vida,Leches Enteras,,1l,1380.00,,$,"$1.380,00",1380.0,False,original,1380.0,1380.0,1.0,default_1usd,,,MARCA | : ILOLAY | Últimos consultados | NO ACUMULABLE CON OTRAS PROMOS | Leche Entera Clasica LA SERENISIMA Sachet 1l | OFERTA | Ver planes de cuotas,,,,,"{""Características"": [""MARCA"", "": ILOLAY"", ""Últimos consultados"", ""NO ACUMULABLE CON OTRAS PROMOS"", ""Leche Entera Clasica LA SERENISIMA Sachet 1l"", ""OFERTA"", ""Ver planes de cuotas""]}",dataset/txt_limpios/504.txt,dataset/paginas_descargadas/504.html,EN,leche,keep,0.60,heuristic_default
505,Leches Larga Vida,,Leches Enteras > 1l,2049.0,,,Desconocido,unknown,UNKNOWN,Leches Larga Vida,Leches Enteras,,1l,2049.00,,$,"$2.049,00",2049.0,False,original,2049.0,2049.0,1.0,default_1usd,,,MARCA | : TREGAR | SIN TACC | : SI | Últimos consultados | Leche Entera Larga Vida Ilolay Ttb 1 Ltr | Ver planes de cuotas | NO ACUMULABLE CON OTRAS PROMOS | Leche Entera Clasica LA SERENISIMA Sachet 1l | OFERTA,,,,,"{""Características"": [""MARCA"", "": TREGAR"", ""SIN TACC"", "": SI"", ""Últimos consultados"", ""Leche Entera Larga Vida Ilolay Ttb 1 Ltr"", ""Ver planes de cuotas"", ""NO ACUMULABLE CON OTRAS PROMOS"", ""Leche Entera Clasica LA SERENISIMA Sachet 1l"", ""OFERTA""]}",dataset/txt_limpios/505.txt,dataset/paginas_descargadas/505.html,EN,leche,keep,0.60,heuristic_default
506,Leches Larga Vida,,Leches Enteras > 1l,2040.0,,,Desconocido,unknown,UNKNOWN,Leches Larga Vida,Leches Enteras,,1l,2040.00,,$,"$2.040,00",2040.0,False,original,2040.0,2040.0,1.0,default_1usd,,,MARCA | : VERONICA | SIN TACC | : SI | Últimos consultados | Leche Larga Vida Entera TREGAR Ttb 1 L | Ver planes de cuotas | Leche Entera Larga Vida Ilolay Ttb 1 Ltr | EN ACUMULABLE CON OTRAS PROMOS | Leche Entera Clasica LA SERENISIMA Sachet 1l | OFERTA,,,,,"{""Características"": [""MARCA"", "": VERONICA"", ""SIN TACC"", "": SI"", ""Últimos consultados"", ""Leche Larga Vida Entera TREGAR Ttb 1 L"", ""Ver planes de cuotas"", ""Leche Entera Larga Vida Ilolay Ttb 1 Ltr"", ""NO ACUMULABLE CON OTRAS PROMOS"", ""Leche Entera Clasica LA SERENISIMA Sachet 1l"", ""OFERTA""]}",dataset/txt_limpios/506.txt,dataset/paginas_descargadas/506.html,ET,leche,keep,0.60,heuristic_default
507,Leches Larga Vida,,Leches Enteras > 1l,1911.0,,,Desconocido,unknown,UNKNOWN,Leches Larga Vida,Leches Enteras,,1l,1911.00,,$,"$1.911,00",1911.0,False,original,1911.0,1911.0,1.0,default_1usd,,,MARCA | : LAS TRES NIÑAS | SIN TACC | : SI | Últimos consultados | Leche Larga Vida Entera VERONICA 1l | Ver planes de cuotas | Leche Larga Vida Entera TREGAR Ttb 1 L | Leche Entera Larga Vida Ilolay Ttb 1 Ltr | EN ACUMULABLE CON OTRAS PROMOS | Leche Entera Clasica LA SERENISIMA Sachet 1l | OFERTA,,,,,"{""Características"": [""MARCA"", "": LAS TRES NIÑAS"", ""SIN TACC"", "": SI"", ""Últimos consultados"", ""Leche Larga Vida Entera VERONICA 1l"", ""Ver planes de cuotas"", ""Leche Larga Vida Entera TREGAR Ttb 1 L"", ""Leche Entera Larga Vida Ilolay Ttb 1 Ltr"", ""NO ACUMULABLE CON OTRAS PROMOS"", ""Leche Entera Clasica LA SERENISIMA Sachet 1l"", ""OFERTA""]}",dataset/txt_limpios/507.txt,dataset/paginas_descargadas/507.html,ET,leche,keep,0.60,heuristic_default
788,Lo sentimos,,,,,,Desconocido,unknown,UNKNOWN,Lo sentimos,,,,,,,,234.19,True,country_mean,,234.1938,1.0,default_1usd,,,,,,,,{},dataset/txt_limpios/788.txt,dataset/paginas_descargadas/788.html,EN,sin_categoria,discard,0.30,no_category_detected;price_parse_failed
1748,Lácteos y Quesos,LECHE ENTERA UHT C TAPA SOPROLE 1 LT Productos similares Leche Descremada Natural Ver producto Leche Entera Natural Cremosa Leche Semidescremada Natural Leche Entera Natural Surlat 1 L Leche Semi Descremada Surlat 1 L Leche Semidescremada Gold Café Capuccino Leche Enteral Natural Leche Semidescremada Sabor Frutilla Soprole 1 L Leche Entera A2 Sin Lactosa Colun 1 L Leche Semidescremada Sabor Frutilla Leche Descremada Surlat 1 L Leche Semidescremada Sabor Chocolate Blanco Soprole 1 L Leche Semidescremada Zerolacto Sabor Frutilla Soprole 1 ¡L! ¡Juntos son mejores! Aceite vegetal Precio Un 900 ml arroz Precio Uno G2 Grano Largo Fino 1 Kg FIDEO SPAGHETTI 5 400 GRS. 101409 C Azúcar Blanca Granulada Tottus 860 g Harina con Polvo -19% Azúcar Blanca Granulada Iansa 1 Kg Azúcar Aceite Vegetal Tottus 900 ml -11% FIDEO CORBATA 80 400 GRS. 101302 C Harina Especial con Polvo de Hornear Selecta 1 Kg -37% Arroz Tottus G2 Grano Largo Fino 1 Kg Carpeta Spaghetti N°5 Lucchetti 400 g Aceite vegetal Azúcar Granulada Iansa 900 g Arroz G2 Grano Largo Angosto -10% FIDEO TALLARIN 87 400 GRS. 101407 C Carpeta espiral N°56 Lucchetti 400 g Azúcar Blanca Granulada Tottus 1 Kg Harina sin polvo de Hornear Selecta 1 Kg,Leches > 1 LT,1.15,,,Desconocido,unknown,UNKNOWN,Lácteos y Quesos,Leches,,1 LT,1.15,,,1.15,1.15,False,original,1.15,1.15,1.0,default_1usd,,LECHE ENTERA UHT C TAPA SOPROLE 1 LT Productos similares Leche Descremada Natural Ver producto Leche Entera Natural Cremosa Leche Semidescremada Natural Leche Entera Natural Surlat 1 L Leche Semi Descremada Surlat 1 L Leche Semidescremada Gold Café Capuccino Leche Enteral Natural Leche Semidescremada Sabor Frutilla Soprole 1 L Leche Entera A2 Sin Lactosa Colun 1 L Leche Semidescremada Sabor Frutilla Leche Descremada Surlat 1 L Leche Semidescremada Sabor Chocolate Blanco Soprole 1 L Leche Semidescremada Zerolacto Sabor Frutilla Soprole 1 ¡L! ¡Juntos son mejores! Aceite vegetal Precio Un 900 ml arroz Precio Uno G2 Grano Largo Fino 1 Kg FIDEO SPAGHETTI 5 400 GRS. 101409 C Azúcar Blanca Granulada Tottus 860 g Harina con Polvo -19% Azúcar Blanca Granulada Iansa 1 Kg Azúcar Aceite Vegetal Tottus 900 ml -11% FIDEO CORBATA 80 400 GRS. 101302 C Harina Especial con Polvo de Hornear Selecta 1 Kg -37% Arroz Tottus G2 Grano Largo Fino 1 Kg Carpeta Spaghetti N°5 Lucchetti 400 g Aceite vegetal Azúcar Granulada Iansa 900 g Arroz G2 Grano Largo Angosto -10% FIDEO TALLARIN 87 400 GRS. 101407 C Carpeta espiral N°56 Lucchetti 400 g Azúcar Blanca Granulada Tottus 1 Kg Harina sin polvo de Hornear Selecta 1 Kg,,,,,,"{""Descripción"": [""LECHE ENTERA UHT C TAPA SOPROLE 1 LT"", ""Productos similares"", ""Leche Descremada Natural"", ""Ver producto"", ""Leche Entera Natural Cremosa"", ""Leche Semidescremada Natural"", ""Leche Entera Natural Surlat 1 L"", ""Leche Semi Descremada Surlat 1 L"", ""Leche Semidescremada Gold Café Capuccino"", ""Leche Enteral Natural"", ""Leche Semidescremada Sabor Frutilla Soprole 1 L"", ""Leche Entera A2 Sin Lactosa Colun 1 L"", ""Leche Semidescremada Sabor Frutilla"", ""Leche Descremada Surlat 1 L"", ""Leche Semidescremada Sabor Chocolate Blanco Soprole 1 L"", ""Leche Semidescremada Zerolacto Sabor Frutilla Soprole 1 L"", ""¡Juntos son mejores!"", ""Aceite Vegetal Precio Uno 900 ml"", ""Arroz Precio Uno G2 Grano Largo Fino 1 Kg"", ""FIDEO SPAGHETTI 5  400 GRS. 101409 C"", ""Azúcar Blanca Granulada Tottus 860 g"", ""Harina con Polvo"", ""-19%"", ""Azúcar Blanca Granulada Iansa 1 Kg"", ""Azúcar"", ""Aceite Vegetal Tottus 900 ml"", ""-11%"", ""FIDEO CORBATA 80  400 GRS. 101302 C"", ""Harina Especial con Polvo de Hornear Selecta 1 Kg"", ""-37%"", ""Arroz Tottus G2 Grano Largo Fino 1 Kg"", ""Pasta Spaghetti N°5 Lucchetti 400 g"", ""Aceite Vegetal"", ""Azúcar Granulada Iansa 900 g"", ""Arroz G2 Grano Largo Angosto"", ""-10%"", ""FIDEO TALLARIN 87  400 GRS. 101407 C"", ""Pasta Espiral N°56 Lucchetti 400 g"", ""Azúcar Blanca Granulada Tottus 1 Kg"", ""Harina sin Polvo de Hornear Selecta 1 Kg""]}",dataset/txt_limpios/1748.txt,dataset/paginas_descargadas/1748.html,ET,leche,keep,0.60,heuristic_default
1750,Lácteos y Quesos,"Leche Natural Entera Tottus 1lt | Actualizado al: 20-02-2025 Ingredientes: Leche natural entera, Leche (lactosa), Leche (caseína). Alérgenos: Leche (lactosa), Leche (caseína). Certificados: Vegetariano Libre de Soya Libre de Huevo Libre de Peces Libre de Mariscos Libre de Maní Libre de Frutas Secos Libre de Nueces Libre de Sulfitos Libre de Trigo Porción: 1 Taza (200ml) Porciones por envase: 5 100ml 1 Porción Energía (kCal) 59 118 Proteínas (g) 3.1 6.2 Grasas Totales Grasas saturadas (g) 1.8 3.6 Grasas (g) 0.8 1.6 Grasas poliinsaturadas (g) 0.20.4 Grasas trans (g) 0.1 Colesterol (mg) 9.4 18.8 Hhidratos de carbono disponibles 4.9 9.8 Azúcares totales (g) 4.7 Sodio 42 84 Importante: La información del empaque y/o contenido del producto final puede diferir respecto a lo que mostramos en nuestro sitio web, tanto a nivel de ingredientes, trazas, información nutricional, sellos, modo de uso y/o modo de conservación. Usted debe basarse únicamente en la información que se muestra en nuestro sitio web y siempre debe leer las etiquetas, advertencias y instrucciones antes de usar el consumo de un producto. Información obtenida de LECHE TOTTUS ENTERA 1LT Productos similares Leche Descremada Natural Ver producto Leche Semidescremada Natural Leche Semi Descremada Tottus 1 Lt Leche Descremada Tottus 1 Lt Leche Enteral Natural Leche Entera Natural Surlat 1 L -15% Leche Entera Natural Cremosa ¡Juntos son mejores! Azúcar -11% Arroz Precio Uno G2 Grano Largo Fino 1 Kg Aceite Vegetal Precio Un 900 ml Harina Con Polvo Azúcar Blanca Granulada Tottus 860 g Harina sin polvos de Hornear SPAGHETTI 5 TOTTUS 400 GR Arroz Tottus G2 Grano Largo Fino 1 Kg ESPIRALES TOTTUS 400 G Aceite Vegetal Tottus 900 ml Carpeta Caracol Tottus 400 g ESPIRALES TOTTUS 400 GR TALLARIN 87 TOTTUS 400 GR Azúcar Blanca Granulada Tottus 1 Kg Harina de Trigo con Polvo de Hornear Tottus 1 Kg TALLARIN TOTTUS 400 G CORBATAS TOTTUS 400 GR Aceite Vegetal Harina de Trigo sin polvo de Hornear Tottus 1 Kg",Leches > 1 LT,1.05,,,Desconocido,unknown,UNKNOWN,Lácteos y Quesos,Leches,,1 LT,1.05,,,1.05,1.05,False,original,1.05,1.05,1.0,default_1usd,,"Leche Natural Entera Tottus 1lt | Actualizado al: 20-02-2025 Ingredientes: Leche natural entera, Leche (lactosa), Leche (caseína). Alérgenos: Leche (lactosa), Leche (caseína). Certificados: Vegetariano Libre de Soya Libre de Huevo Libre de Peces Libre de Mariscos Libre de Maní Libre de Frutas Secos Libre de Nueces Libre de Sulfitos Libre de Trigo Porción: 1 Taza (200ml) Porciones por envase: 5 100ml 1 Porción Energía (kCal) 59 118 Proteínas (g) 3.1 6.2 Grasas Totales Grasas saturadas (g) 1.8 3.6 Grasas (g) 0.8 1.6 Grasas poliinsaturadas (g) 0.20.4 Grasas trans (g) 0.1 Colesterol (mg) 9.4 18.8 Hhidratos de carbono disponibles 4.9 9.8 Azúcares totales (g) 4.7 Sodio 42 84 Importante: La información del empaque y/o contenido del producto final puede diferir respecto a lo que mostramos en nuestro sitio web, tanto a nivel de ingredientes, trazas, información nutricional, sellos, modo de uso y/o modo de conservación. Usted debe basarse únicamente en la información que se muestra en nuestro sitio web y siempre debe leer las etiquetas, advertencias y instrucciones antes de usar el consumo de un producto. Información obtenida de LECHE TOTTUS ENTERA 1LT Productos similares Leche Descremada Natural Ver producto Leche Semidescremada Natural Leche Semi Descremada Tottus 1 Lt Leche Descremada Tottus 1 Lt Leche Enteral Natural Leche Entera Natural Surlat 1 L -15% Leche Entera Natural Cremosa ¡Juntos son mejores! Azúcar -11% Arroz Precio Uno G2 Grano Largo Fino 1 Kg Aceite Vegetal Precio Un 900 ml Harina Con Polvo Azúcar Blanca Granulada Tottus 860 g Harina sin polvos de Hornear SPAGHETTI 5 TOTTUS 400 GR Arroz Tottus G2 Grano Largo Fino 1 Kg ESPIRALES TOTTUS 400 G Aceite Vegetal Tottus 900 ml Carpeta Caracol Tottus 400 g ESPIRALES TOTTUS 400 GR TALLARIN 87 TOTTUS 400 GR Azúcar Blanca Granulada Tottus 1 Kg Harina de Trigo con Polvo de Hornear Tottus 1 Kg TALLARIN TOTTUS 400 G CORBATAS TOTTUS 400 GR Aceite Vegetal Harina de Trigo sin polvo de Hornear Tottus 1 Kg",,,,,,"{""Descripción"": [""Leche Natural Entera Tottus"", ""1lt | Actualizado al: 20-02-2025"", ""Ingredientes: Leche natural entera, Leche (lactosa), Leche (caseína)."", ""Alérgenos: Leche (lactosa), Leche (caseína)."", ""Certificados: Vegetariano"", ""Libre de Soya"", ""Libre de Huevo"", ""Libre de Peces"", ""Libre de Mariscos"", ""Libre de Maní"", ""Libre de Frutos Secos"", ""Libre de Nueces"", ""Libre de Sulfitos"", ""Libre de Trigo"", ""Porción: 1 Taza (200ml)"", ""Porciones por envase: 5"", ""100ml"", ""1 Porción"", ""Energía"", ""(kCal)"", ""59"", ""118"", ""Proteínas"", ""(g)"", ""3.1"", ""6.2"", ""Grasas Totales"", ""Grasas saturadas (g)"", ""1.8"", ""3.6"", ""Grasas monoinsaturadas (g)"", ""0.8"", ""1.6"", ""Grasas poliinsaturadas (g)"", ""0.2"", ""0.4"", ""Grasas trans (g)"", ""0.1"", ""Colesterol"", ""(mg)"", ""9.4"", ""18.8"", ""Hidratos de carbono disponibles"", ""4.9"", ""9.8"", ""Azúcar total (g)"", ""4.7"", ""Sodio"", ""42"", ""84"", ""Importante: La información del empaque y/o contenido del producto final puede diferir respecto a lo que mostramos en nuestro sitio web, tanto a nivel de ingredientes, trazas, información nutricional, sellos, modo de uso y/o modo de conservación. Usted debe basarse únicamente en la información que se muestra en nuestro sitio web y siempre debe leer las etiquetas, advertencias y instrucciones antes de usar el consumo de un producto."", ""Información obtenida de"", ""LECHE TOTTUS ENTERA 1LT"", ""Productos similares"", ""Leche Descremada Natural"", ""Ver producto"", ""Leche Semidescremada Natural"", ""Leche Semi Descremada Tottus 1 Lt"", ""Leche Descremada Tottus 1 Lt"", ""Leche Enteral Natural"", ""Leche Entera Natural Surlat 1 L"", ""-15%"", ""Leche Entera Natural Cremosa"", ""¡Juntos son mejores!"", ""Azúcar"", ""-11%"", ""Arroz Precio Uno G2 Grano Largo Fino 1 Kg"", ""Aceite Vegetal Precio Uno 900 ml"", ""Harina Con Polvo"", ""Azúcar Blanca Granulada Tottus 860 g"", ""Harina sin Polvos de Hornear"", ""SPAGHETTI 5   TOTTUS 400 GR"", ""Arroz Tottus G2 Grano Largo Fino 1 Kg"", ""ESPIRALES TOTTUS 400 G"", ""Aceite Vegetal Tottus 900 ml"", ""Pasta Caracol Tottus 400 g"", ""ESPIRALES   TOTTUS 400 GR"", ""TALLARIN 87   TOTTUS 400 GR"", ""Azúcar Blanca Granulada Tottus 1 Kg"", ""Harina de Trigo con Polvo de Hornear Tottus 1 Kg"", ""TALLARIN TOTTUS 400 G"", ""CORBATAS   TOTTUS 400 GR"", ""Aceite Vegetal"", ""Harina de Trigo sin Polvo de Hornear Tottus 1 Kg""]}",dataset/txt_limpios/1750.txt,dataset/paginas_descargadas/1750.html,ET,leche,keep,0.60,heuristic_default
913,"Lácteos, refrigerados y huevos",,Leches líquidos > 1 Litro,1.09,,,Desconocido,unknown,UNKNOWN,"Lácteos, refrigerados y huevos",Leches líquidas,,1 Litro,1.09,,$,$1.09,1.09,False,original,1.09,1.09,1.0,default_1usd,,,,,,,,{},dataset/txt_limpios/913.txt,dataset/paginas_descargadas/913.html,ET,leche,keep,0.60,heuristic_default
914,"Lácteos, refrigerados y huevos",Leche entera Los Peumos 1 L,Leches líquidos > 1 Litro,1.15,,,Desconocido,unknown,UNKNOWN,"Lácteos, refrigerados y huevos",Leches líquidas,,1 Litro,1.15,,$,$1.15,1.15,False,original,1.15,1.15,1.0,default_1usd,,Leche entera Los Peumos 1 L,,,,,,"{""Descripción"": [""Leche entera Los Peumos 1 L""]}",dataset/txt_limpios/914.txt,dataset/paginas_descargadas/914.html,ET,leche,keep,0.60,heuristic_default
