source_id,title,description,breadcrumbs,price_raw,currency_raw,url,seller,availability,country,product_name,brand,reference,unit,price_amount,price_currency,price_symbol,price_text,price_amount_filled,price_is_imputed,price_imputation_source,price_amount_usd,price_amount_usd_filled,fx_rate_local_per_usd,fx_source,information_text,description_text,features_text,specifications_text,benefits_text,details_text,other_sections,sections,txt_path,html_path,es_status,category_canonical,decision,match_score,reasons
1354,Resultados de búsqueda para: 'pan molde mas ahorro 550 g 259789000',,Ver como > 550 g,0.78,,,Desconocido,unknown,UNKNOWN,Resultados de búsqueda para: 'pan molde mas ahorro 550 g 259789000',Ver como,,550 g,0.78,,$,"$0,78",0.78,False,original,0.78,0.78,1.0,default_1usd,,,,,,,,{},dataset/txt_limpios/1354.txt,dataset/paginas_descargadas/1354.html,EN,pan,keep,0.60,heuristic_default
1353,Resultados de búsqueda para: 'pan molde ta riko 450 g n 259628000',,Ver como > 450 g,1.45,,,Desconocido,unknown,UNKNOWN,Resultados de búsqueda para: 'pan molde ta riko 450 g n 259628000',Ver como,,450 g,1.45,,$,"$1,45",1.45,False,original,1.45,1.45,1.0,default_1usd,,,,,,,,{},dataset/txt_limpios/1353.txt,dataset/paginas_descargadas/1353.html,EN,pan,keep,0.60,heuristic_default
1363,Resultados de búsqueda para: 'queso cremoso toni 500 g 270558000',,Ver como > 500 g,600.0,,,Desconocido,unknown,UNKNOWN,Resultados de búsqueda para: 'queso cremoso toni 500 g 270558000',Ver como,,500 g,600.00,,,600,600.0,False,original,600.0,600.0,1.0,default_1usd,,,,,,,,{},dataset/txt_limpios/1363.txt,dataset/paginas_descargadas/1363.html,EN,sin_categoria,discard,0.30,no_category_detected
849,Robot or human?,,,,,,Desconocido,unknown,UNKNOWN,Robot or human?,,,,,,,,234.19,True,country_mean,,234.1938,1.0,default_1usd,,,,,,,,{},dataset/txt_limpios/849.txt,dataset/paginas_descargadas/849.html,EN,sin_categoria,discard,0.30,no_category_detected;price_parse_failed
850,Robot or human?,,,,,,Desconocido,unknown,UNKNOWN,Robot or human?,,,,,,,,234.19,True,country_mean,,234.1938,1.0,default_1usd,,,,,,,,{},dataset/txt_limpios/850.txt,dataset/paginas_descargadas/850.html,EN,sin_categoria,discard,0.30,no_category_detected;price_parse_failed
851,Robot or human?,,,,,,Desconocido,unknown,UNKNOWN,Robot or human?,,,,,,,,234.19,True,country_mean,,234.1938,1.0,default_1usd,,,,,,,,{},dataset/txt_limpios/851.txt,dataset/paginas_descargadas/851.html,EN,sin_categoria,discard,0.30,no_category_detected;price_parse_failed
852,Robot or human?,,,,,,Desconocido,unknown,UNKNOWN,Robot or human?,,,,,,,,234.19,True,country_mean,,234.1938,1.0,default_1usd,,,,,,,,{},dataset/txt_limpios/852.txt,dataset/paginas_descargadas/852.html,EN,sin_categoria,discard,0.30,no_category_detected;price_parse_failed
853,Robot or human?,,,,,,Desconocido,unknown,UNKNOWN,Robot or human?,,,,,,,,234.19,True,country_mean,,234.1938,1.0,default_1usd,,,,,,,,{},dataset/txt_limpios/853.txt,dataset/paginas_descargadas/853.html,EN,sin_categoria,discard,0.30,no_category_detected;price_parse_failed
854,Robot or human?,,,,,,Desconocido,unknown,UNKNOWN,Robot or human?,,,,,,,,234.19,True,country_mean,,234.1938,1.0,default_1usd,,,,,,,,{},dataset/txt_limpios/854.txt,dataset/paginas_descargadas/854.html,EN,sin_categoria,discard,0.30,no_category_detected;price_parse_failed
855,Robot or human?,,,,,,Desconocido,unknown,UNKNOWN,Robot or human?,,,,,,,,234.19,True,country_mean,,234.1938,1.0,default_1usd,,,,,,,,{},dataset/txt_limpios/855.txt,dataset/paginas_descargadas/855.html,EN,sin_categoria,discard,0.30,no_category_detected;price_parse_failed
856,Robot or human?,,,,,,Desconocido,unknown,UNKNOWN,Robot or human?,,,,,,,,234.19,True,country_mean,,234.1938,1.0,default_1usd,,,,,,,,{},dataset/txt_limpios/856.txt,dataset/paginas_descargadas/856.html,EN,sin_categoria,discard,0.30,no_category_detected;price_parse_failed
857,Robot or human?,,,,,,Desconocido,unknown,UNKNOWN,Robot or human?,,,,,,,,234.19,True,country_mean,,234.1938,1.0,default_1usd,,,,,,,,{},dataset/txt_limpios/857.txt,dataset/paginas_descargadas/857.html,EN,sin_categoria,discard,0.30,no_category_detected;price_parse_failed
858,Robot or human?,,,,,,Desconocido,unknown,UNKNOWN,Robot or human?,,,,,,,,234.19,True,country_mean,,234.1938,1.0,default_1usd,,,,,,,,{},dataset/txt_limpios/858.txt,dataset/paginas_descargadas/858.html,EN,sin_categoria,discard,0.30,no_category_detected;price_parse_failed
859,Robot or human?,,,,,,Desconocido,unknown,UNKNOWN,Robot or human?,,,,,,,,234.19,True,country_mean,,234.1938,1.0,default_1usd,,,,,,,,{},dataset/txt_limpios/859.txt,dataset/paginas_descargadas/859.html,EN,sin_categoria,discard,0.30,no_category_detected;price_parse_failed
860,Robot or human?,,,,,,Desconocido,unknown,UNKNOWN,Robot or human?,,,,,,,,234.19,True,country_mean,,234.1938,1.0,default_1usd,,,,,,,,{},dataset/txt_limpios/860.txt,dataset/paginas_descargadas/860.html,EN,sin_categoria,discard,0.30,no_category_detected;price_parse_failed
861,Robot or human?,,,,,,Desconocido,unknown,UNKNOWN,Robot or human?,,,,,,,,234.19,True,country_mean,,234.1938,1.0,default_1usd,,,,,,,,{},dataset/txt_limpios/861.txt,dataset/paginas_descargadas/861.html,EN,sin_categoria,discard,0.30,no_category_detected;price_parse_failed
862,Robot or human?,,,,,,Desconocido,unknown,UNKNOWN,Robot or human?,,,,,,,,234.19,True,country_mean,,234.1938,1.0,default_1usd,,,,,,,,{},dataset/txt_limpios/862.txt,dataset/paginas_descargadas/862.html,EN,sin_categoria,discard,0.30,no_category_detected;price_parse_failed
863,Robot or human?,,,,,,Desconocido,unknown,UNKNOWN,Robot or human?,,,,,,,,234.19,True,country_mean,,234.1938,1.0,default_1usd,,,,,,,,{},dataset/txt_limpios/863.txt,dataset/paginas_descargadas/863.html,EN,sin_categoria,discard,0.30,no_category_detected;price_parse_failed
864,Robot or human?,,,,,,Desconocido,unknown,UNKNOWN,Robot or human?,,,,,,,,234.19,True,country_mean,,234.1938,1.0,default_1usd,,,,,,,,{},dataset/txt_limpios/864.txt,dataset/paginas_descargadas/864.html,EN,sin_categoria,discard,0.30,no_category_detected;price_parse_failed
865,Robot or human?,,,,,,Desconocido,unknown,UNKNOWN,Robot or human?,,,,,,,,234.19,True,country_mean,,234.1938,1.0,default_1usd,,,,,,,,{},dataset/txt_limpios/865.txt,dataset/paginas_descargadas/865.html,EN,sin_categoria,discard,0.30,no_category_detected;price_parse_failed
866,Robot or human?,,,,,,Desconocido,unknown,UNKNOWN,Robot or human?,,,,,,,,234.19,True,country_mean,,234.1938,1.0,default_1usd,,,,,,,,{},dataset/txt_limpios/866.txt,dataset/paginas_descargadas/866.html,EN,sin_categoria,discard,0.30,no_category_detected;price_parse_failed
867,Robot or human?,,,,,,Desconocido,unknown,UNKNOWN,Robot or human?,,,,,,,,234.19,True,country_mean,,234.1938,1.0,default_1usd,,,,,,,,{},dataset/txt_limpios/867.txt,dataset/paginas_descargadas/867.html,EN,sin_categoria,discard,0.30,no_category_detected;price_parse_failed
868,Robot or human?,,,,,,Desconocido,unknown,UNKNOWN,Robot or human?,,,,,,,,234.19,True,country_mean,,234.1938,1.0,default_1usd,,,,,,,,{},dataset/txt_limpios/868.txt,dataset/paginas_descargadas/868.html,EN,sin_categoria,discard,0.30,no_category_detected;price_parse_failed
869,Robot or human?,,,,,,Desconocido,unknown,UNKNOWN,Robot or human?,,,,,,,,234.19,True,country_mean,,234.1938,1.0,default_1usd,,,,,,,,{},dataset/txt_limpios/869.txt,dataset/paginas_descargadas/869.html,EN,sin_categoria,discard,0.30,no_category_detected;price_parse_failed
870,Robot or human?,,,,,,Desconocido,unknown,UNKNOWN,Robot or human?,,,,,,,,234.19,True,country_mean,,234.1938,1.0,default_1usd,,,,,,,,{},dataset/txt_limpios/870.txt,dataset/paginas_descargadas/870.html,EN,sin_categoria,discard,0.30,no_category_detected;price_parse_failed
871,Robot or human?,,,,,,Desconocido,unknown,UNKNOWN,Robot or human?,,,,,,,,234.19,True,country_mean,,234.1938,1.0,default_1usd,,,,,,,,{},dataset/txt_limpios/871.txt,dataset/paginas_descargadas/871.html,EN,sin_categoria,discard,0.30,no_category_detected;price_parse_failed
872,Robot or human?,,,,,,Desconocido,unknown,UNKNOWN,Robot or human?,,,,,,,,234.19,True,country_mean,,234.1938,1.0,default_1usd,,,,,,,,{},dataset/txt_limpios/872.txt,dataset/paginas_descargadas/872.html,EN,sin_categoria,discard,0.30,no_category_detected;price_parse_failed
873,Robot or human?,,,,,,Desconocido,unknown,UNKNOWN,Robot or human?,,,,,,,,234.19,True,country_mean,,234.1938,1.0,default_1usd,,,,,,,,{},dataset/txt_limpios/873.txt,dataset/paginas_descargadas/873.html,EN,sin_categoria,discard,0.30,no_category_detected;price_parse_failed
874,Robot or human?,,,,,,Desconocido,unknown,UNKNOWN,Robot or human?,,,,,,,,234.19,True,country_mean,,234.1938,1.0,default_1usd,,,,,,,,{},dataset/txt_limpios/874.txt,dataset/paginas_descargadas/874.html,EN,sin_categoria,discard,0.30,no_category_detected;price_parse_failed
875,Robot or human?,,,,,,Desconocido,unknown,UNKNOWN,Robot or human?,,,,,,,,234.19,True,country_mean,,234.1938,1.0,default_1usd,,,,,,,,{},dataset/txt_limpios/875.txt,dataset/paginas_descargadas/875.html,EN,sin_categoria,discard,0.30,no_category_detected;price_parse_failed
876,Robot or human?,,,,,,Desconocido,unknown,UNKNOWN,Robot or human?,,,,,,,,234.19,True,country_mean,,234.1938,1.0,default_1usd,,,,,,,,{},dataset/txt_limpios/876.txt,dataset/paginas_descargadas/876.html,EN,sin_categoria,discard,0.30,no_category_detected;price_parse_failed
877,Robot or human?,,,,,,Desconocido,unknown,UNKNOWN,Robot or human?,,,,,,,,234.19,True,country_mean,,234.1938,1.0,default_1usd,,,,,,,,{},dataset/txt_limpios/877.txt,dataset/paginas_descargadas/877.html,EN,sin_categoria,discard,0.30,no_category_detected;price_parse_failed
878,Robot or human?,,,,,,Desconocido,unknown,UNKNOWN,Robot or human?,,,,,,,,234.19,True,country_mean,,234.1938,1.0,default_1usd,,,,,,,,{},dataset/txt_limpios/878.txt,dataset/paginas_descargadas/878.html,EN,sin_categoria,discard,0.30,no_category_detected;price_parse_failed
879,Robot or human?,,,,,,Desconocido,unknown,UNKNOWN,Robot or human?,,,,,,,,234.19,True,country_mean,,234.1938,1.0,default_1usd,,,,,,,,{},dataset/txt_limpios/879.txt,dataset/paginas_descargadas/879.html,EN,sin_categoria,discard,0.30,no_category_detected;price_parse_failed
880,Robot or human?,,,,,,Desconocido,unknown,UNKNOWN,Robot or human?,,,,,,,,234.19,True,country_mean,,234.1938,1.0,default_1usd,,,,,,,,{},dataset/txt_limpios/880.txt,dataset/paginas_descargadas/880.html,EN,sin_categoria,discard,0.30,no_category_detected;price_parse_failed
881,Robot or human?,,,,,,Desconocido,unknown,UNKNOWN,Robot or human?,,,,,,,,234.19,True,country_mean,,234.1938,1.0,default_1usd,,,,,,,,{},dataset/txt_limpios/881.txt,dataset/paginas_descargadas/881.html,EN,sin_categoria,discard,0.30,no_category_detected;price_parse_failed
882,Robot or human?,,,,,,Desconocido,unknown,UNKNOWN,Robot or human?,,,,,,,,234.19,True,country_mean,,234.1938,1.0,default_1usd,,,,,,,,{},dataset/txt_limpios/882.txt,dataset/paginas_descargadas/882.html,EN,sin_categoria,discard,0.30,no_category_detected;price_parse_failed
883,Robot or human?,,,,,,Desconocido,unknown,UNKNOWN,Robot or human?,,,,,,,,234.19,True,country_mean,,234.1938,1.0,default_1usd,,,,,,,,{},dataset/txt_limpios/883.txt,dataset/paginas_descargadas/883.html,EN,sin_categoria,discard,0.30,no_category_detected;price_parse_failed
884,Robot or human?,,,,,,Desconocido,unknown,UNKNOWN,Robot or human?,,,,,,,,234.19,True,country_mean,,234.1938,1.0,default_1usd,,,,,,,,{},dataset/txt_limpios/884.txt,dataset/paginas_descargadas/884.html,EN,sin_categoria,discard,0.30,no_category_detected;price_parse_failed
885,Robot or human?,,,,,,Desconocido,unknown,UNKNOWN,Robot or human?,,,,,,,,234.19,True,country_mean,,234.1938,1.0,default_1usd,,,,,,,,{},dataset/txt_limpios/885.txt,dataset/paginas_descargadas/885.html,EN,sin_categoria,discard,0.30,no_category_detected;price_parse_failed
886,Robot or human?,,,,,,Desconocido,unknown,UNKNOWN,Robot or human?,,,,,,,,234.19,True,country_mean,,234.1938,1.0,default_1usd,,,,,,,,{},dataset/txt_limpios/886.txt,dataset/paginas_descargadas/886.html,EN,sin_categoria,discard,0.30,no_category_detected;price_parse_failed
1743,Saltar al contenido principal,,¿Cómo quieres tus artículos?,,MXN,,Desconocido,unknown,MX,Saltar al contenido principal,¿Cómo quieres tus artículos?,,,,MXN,,,66.32,True,country_mean,,3.5617,18.62,from_mexico_cambio_dolar,,,,,,,,{},dataset/txt_limpios/1743.txt,dataset/paginas_descargadas/1743.html,EN,sin_categoria,discard,0.30,no_category_detected;price_parse_failed
809,Saltar menú Cenco,Ingredientes Condición alimentaria Información nutricional Receta Tipo de Producto Café Instantáneo Económico Cantidad 1 un. Formato Polvo Envase Tarro País de Origen Chile Variedad Tradición Contenido 170 g Almacenamiento Conservar en lugar fresco y seco Garantía Mínima Legal Válida hasta su fecha de caducidad Te podrían interesar Cuisine & Co Leche Cuisine & Co Entera 1 L Azúcar Cuisine & Co Blanca Granulada 1 kg Iansa Cero K Endulzante Iansa Cero K Líquido Sucralosa 250 ml 5.0 Centro de preferencia de privacidad Gestionar las preferencias de consentimiento Activas siempre Back Button Search Icon Filter Icon Clear checkbox label label Apply Cancel Consent Leg.Interest Permitir todas Rechazar todas Confirmar mis preferencias,Exclusivo online > 170 g,2.0,,,Desconocido,unknown,UNKNOWN,Saltar menú Cenco,Exclusivo online,,170 g,2.00,,,2,2.0,False,original,2.0,2.0,1.0,default_1usd,,Ingredientes Condición alimentaria Información nutricional Receta Tipo de Producto Café Instantáneo Económico Cantidad 1 un. Formato Polvo Envase Tarro País de Origen Chile Variedad Tradición Contenido 170 g Almacenamiento Conservar en lugar fresco y seco Garantía Mínima Legal Válida hasta su fecha de caducidad Te podrían interesar Cuisine & Co Leche Cuisine & Co Entera 1 L Azúcar Cuisine & Co Blanca Granulada 1 kg Iansa Cero K Endulzante Iansa Cero K Líquido Sucralosa 250 ml 5.0 Centro de preferencia de privacidad Gestionar las preferencias de consentimiento Activas siempre Back Button Search Icon Filter Icon Clear checkbox label label Apply Cancel Consent Leg.Interest Permitir todas Rechazar todas Confirmar mis preferencias,,,,,,"{""Descripción"": [""Ingredientes"", ""Condición alimentaria"", ""Información nutricional"", ""Receta"", ""Tipo de Producto"", ""Café Instantáneo Económico"", ""Cantidad"", ""1 un."", ""Formato"", ""Polvo"", ""Envase"", ""Tarro"", ""País de origen"", ""Chile"", ""Variedad"", ""Tradición"", ""Contenido"", ""170 g"", ""Almacenamiento"", ""Conservar en lugar fresco y seco"", ""Garantía Mínima Legal"", ""Válida hasta su fecha de caducidad"", ""Te podrían interesar"", ""Cuisine & Co"", ""Leche Cuisine & Co Entera 1 L"", ""Azúcar Cuisine & Co Blanca Granulada 1 kg"", ""Iansa Cero K"", ""Endulzante Iansa Cero K Líquido Sucralosa 250 ml"", ""5.0"", ""Centro de preferencia de privacidad"", ""Gestionar las preferencias de consentimiento"", ""Activas siempre"", ""Back Button"", ""Search Icon"", ""Filter Icon"", ""Clear"", ""checkbox label"", ""label"", ""Apply"", ""Cancel"", ""Consent"", ""Leg.Interest"", ""Permitir todas"", ""Rechazar todas"", ""Confirmar mis preferencias""]}",dataset/txt_limpios/809.txt,dataset/paginas_descargadas/809.html,ET,descartado,discard,0.10,excluded_keyword
810,Saltar menú Cenco,Ingredientes Condición alimentaria Información nutricional Tipo de Producto Café Grano Molido Envase Paquete País de Origen Chile Te podrían interesar Iansa Azúcar Blanca Iansa 1 kg Cuisine & Co Leche Cuisine & Co Entera 1 L Cruzeiro Café Liofilizado Cruzeiro 170 g Centro de preferencia de privacidad Gestionar las preferencias de consentimiento Activas siempre Back Button Search Icon Filter Icon Clear checkbox label label Apply Cancel Consent Leg.Interest Permitir todas Rechazar todas Confirmar mis preferencias,Monterrey > 230 g,5.59,,,Desconocido,unknown,UNKNOWN,Saltar menú Cenco,Monterrey,,230 g,5.59,,$,$5.59,5.59,False,original,5.59,5.59,1.0,default_1usd,,Ingredientes Condición alimentaria Información nutricional Tipo de Producto Café Grano Molido Envase Paquete País de Origen Chile Te podrían interesar Iansa Azúcar Blanca Iansa 1 kg Cuisine & Co Leche Cuisine & Co Entera 1 L Cruzeiro Café Liofilizado Cruzeiro 170 g Centro de preferencia de privacidad Gestionar las preferencias de consentimiento Activas siempre Back Button Search Icon Filter Icon Clear checkbox label label Apply Cancel Consent Leg.Interest Permitir todas Rechazar todas Confirmar mis preferencias,,,,,,"{""Descripción"": [""Ingredientes"", ""Condición alimentaria"", ""Información nutricional"", ""Tipo de Producto"", ""Café Grano Molido"", ""Envase"", ""Paquete"", ""País de origen"", ""Chile"", ""Te podrían interesar"", ""Iansa"", ""Azúcar Blanca Iansa 1 kg"", ""Cuisine & Co"", ""Leche Cuisine & Co Entera 1 L"", ""Cruzeiro"", ""Café Liofilizado Cruzeiro 170 g"", ""Centro de preferencia de privacidad"", ""Gestionar las preferencias de consentimiento"", ""Activas siempre"", ""Back Button"", ""Search Icon"", ""Filter Icon"", ""Clear"", ""checkbox label"", ""label"", ""Apply"", ""Cancel"", ""Consent"", ""Leg.Interest"", ""Permitir todas"", ""Rechazar todas"", ""Confirmar mis preferencias""]}",dataset/txt_limpios/810.txt,dataset/paginas_descargadas/810.html,ET,cafe,keep,0.60,heuristic_default
811,Saltar menú Cenco,Ingredientes Condición alimentaria Información nutricional Receta Tipo de Producto Café Descafeinado Liofilizado Intensidad Media Envase Frasco País de Origen Ecuador Almacenamiento Mantener en lugar fresco y seco. Duración 24 meses Te podrían interesar Iansa Azúcar Blanca Iansa 1 kg Oferta Colun Leche Colun Entera 1 L AluSweet Endulzante Alusweet Alulosa 360 ml Centro de preferencia de privacidad Gestionar las preferencias de consentimiento Activas siempre Back Button Search Icon Filter Icon Clear checkbox label label Apply Cancel Consent Leg.Interest Permitir todas Rechazar todas Confirmar mis preferencias,Exclusivo online > 100 g,6.89,,,Desconocido,unknown,UNKNOWN,Saltar menú Cenco,Exclusivo online,,100 g,6.89,,$,$6.89,6.89,False,original,6.89,6.89,1.0,default_1usd,,Ingredientes Condición alimentaria Información nutricional Receta Tipo de Producto Café Descafeinado Liofilizado Intensidad Media Envase Frasco País de Origen Ecuador Almacenamiento Mantener en lugar fresco y seco. Duración 24 meses Te podrían interesar Iansa Azúcar Blanca Iansa 1 kg Oferta Colun Leche Colun Entera 1 L AluSweet Endulzante Alusweet Alulosa 360 ml Centro de preferencia de privacidad Gestionar las preferencias de consentimiento Activas siempre Back Button Search Icon Filter Icon Clear checkbox label label Apply Cancel Consent Leg.Interest Permitir todas Rechazar todas Confirmar mis preferencias,,,,,,"{""Descripción"": [""Ingredientes"", ""Condición alimentaria"", ""Información nutricional"", ""Receta"", ""Tipo de Producto"", ""Café Descafeinado Liofilizado"", ""Intensidad"", ""Media"", ""Envase"", ""Frasco"", ""País de origen"", ""Ecuador"", ""Almacenamiento"", ""Mantener en lugar fresco y seco."", ""Duración"", ""24 meses"", ""Te podrían interesar"", ""Iansa"", ""Azúcar Blanca Iansa 1 kg"", ""Oferta"", ""Colun"", ""Leche Colun Entera 1 L"", ""AluSweet"", ""Endulzante Alusweet Alulosa 360 ml"", ""Centro de preferencia de privacidad"", ""Gestionar las preferencias de consentimiento"", ""Activas siempre"", ""Back Button"", ""Search Icon"", ""Filter Icon"", ""Clear"", ""checkbox label"", ""label"", ""Apply"", ""Cancel"", ""Consent"", ""Leg.Interest"", ""Permitir todas"", ""Rechazar todas"", ""Confirmar mis preferencias""]}",dataset/txt_limpios/811.txt,dataset/paginas_descargadas/811.html,ET,cafe,keep,0.60,heuristic_default
