{"source_id": "1324", "title": "El almacenamiento local parece estar deshabilitado en tu navegador.", "description": "Pura malta | Refrescante sabor | Incluye 6 Cervezas | Contenido: 355ml c/u | Detalles del producto | Reseñas | Escribir Su propia reseña | Estás revisando: CERVEZA PURA MALTA SIX PACK AMSTEL LAGER/4595 | Su valoración | 1 stars | 2 stars | 3 stars | 4 stars | Apodo | Resumen | Reseña | Escribir una reseña | Unds. | Search engine powered by | ElasticSuite", "breadcrumbs": "Aprende más > 355ml", "price_raw": "5.81", "currency_raw": "", "url": "", "seller": "Desconocido", "availability": "unknown", "country": "UNKNOWN", "product_name": "El almacenamiento local parece estar deshabilitado en tu navegador.", "brand": "Aprende", "reference": "", "unit": "355ml", "price_amount": 5.81, "price_currency": "", "price_symbol": "$", "price_text": "$5,81", "price_amount_filled": "5.81", "price_is_imputed": "False", "price_imputation_source": "original", "price_amount_usd": "5.81", "price_amount_usd_filled": "5.81", "fx_rate_local_per_usd": "1.0", "fx_source": "default_1usd", "information_text": "", "description_text": "", "features_text": "", "specifications_text": "", "benefits_text": "", "details_text": "Pura malta | Refrescante sabor | Incluye 6 Cervezas | Contenido: 355ml c/u | Detalles del producto | Reseñas | Escribir Su propia reseña | Estás revisando: CERVEZA PURA MALTA SIX PACK AMSTEL LAGER/4595 | Su valoración | 1 stars | 2 stars | 3 stars | 4 stars | Apodo | Resumen | Reseña | Escribir una reseña | Unds. | Search engine powered by | ElasticSuite", "other_sections": "", "sections": {"Detalles": ["Pura malta", "Refrescante sabor", "Incluye 6 Cervezas", "Contenido: 355ml c/u", "Detalles del producto", "Reseñas", "Escribir Su propia reseña", "Estás revisando: CERVEZA PURA MALTA SIX PACK AMSTEL LAGER/4595", "Su valoración", "Rating", "1 star", "2 stars", "3 stars", "4 stars", "5 stars", "Apodo", "Resumen", "Reseña", "Escribir una reseña", "Unds.", "Search engine powered by", "ElasticSuite"]}, "txt_path": "dataset/txt_limpios/1324.txt", "html_path": "dataset/paginas_descargadas/1324.html", "es_status": "ET", "category_canonical": "cerveza", "decision": "keep", "match_score": 0.6, "reasons": "heuristic_default"}
{"source_id": "1325", "title": "El almacenamiento local parece estar deshabilitado en tu navegador.", "description": "Reseñas Escribir Su propia reseña Estás revisando: PAN DE MOLDE BLANCO 550GR 20 REBANADAS3 Su valoración Rating 1 star 2 stars 3 stars 4 stars 5 stars Apodo Resumen Reseña Escribir una reseña Unds. Search engine powered by ElasticSuite", "breadcrumbs": "Aprende más > 550GR", "price_raw": "1.21", "currency_raw": "", "url": "", "seller": "Desconocido", "availability": "unknown", "country": "UNKNOWN", "product_name": "El almacenamiento local parece estar deshabilitado en tu navegador.", "brand": "Aprende", "reference": "", "unit": "550GR", "price_amount": 1.21, "price_currency": "", "price_symbol": "$", "price_text": "$1,21", "price_amount_filled": "1.21", "price_is_imputed": "False", "price_imputation_source": "original", "price_amount_usd": "1.21", "price_amount_usd_filled": "1.21", "fx_rate_local_per_usd": "1.0", "fx_source": "default_1usd", "information_text": "Reseñas Escribir Su propia reseña Estás revisando: PAN DE MOLDE BLANCO 550GR 20 REBANADAS3 Su valoración Rating 1 star 2 stars 3 stars 4 stars 5 stars Apodo Resumen Reseña Escribir una reseña Unds. Search engine powered by ElasticSuite", "description_text": "", "features_text": "", "specifications_text": "", "benefits_text": "", "details_text": "", "other_sections": "", "sections": {"Información": ["Reseñas", "Escribir Su propia reseña", "Estás revisando: PAN DE MOLDE BLANCO 550GR 20 REBANADAS3", "Su valoración", "Rating", "1 star", "2 stars", "3 stars", "4 stars", "5 stars", "Apodo", "Resumen", "Reseña", "Escribir una reseña", "Unds.", "Search engine powered by", "ElasticSuite"]}, "txt_path": "dataset/txt_limpios/1325.txt", "html_path": "dataset/paginas_descargadas/1325.html", "es_status": "ET", "category_canonical": "pan", "decision": "keep", "match_score": 0.6, "reasons": "heuristic_default"}
{"source_id": "1326", "title": "El almacenamiento local parece estar deshabilitado en tu navegador.", "description": "Pan de horno tipo artesanal. | Blanco. | Con rueda ancha y sabor delicioso. | Elaborado con Harina de trigo fortificada y Leche. | Contenido: 560g. | Detalles del producto | Reseñas | Escribir Su propia reseña | Estás revisando: PAN DE HORNO BLANCO ARTESANAL MODERNA 56 | Su valoración | 1 stars | 2 stars | 3 stars | 4 stars | 5 stars | Apodo | Resumen | Reseña | Escribir una reseña | Unds. | Search engine powered by | ElasticSuite", "breadcrumbs": "Aprende más > 560g", "price_raw": "2.12", "currency_raw": "", "url": "", "seller": "Desconocido", "availability": "unknown", "country": "UNKNOWN", "product_name": "El almacenamiento local parece estar deshabilitado en tu navegador.", "brand": "Aprende", "reference": "", "unit": "560g", "price_amount": 2.12, "price_currency": "", "price_symbol": "$", "price_text": "$2,12", "price_amount_filled": "2.12", "price_is_imputed": "False", "price_imputation_source": "original", "price_amount_usd": "2.12", "price_amount_usd_filled": "2.12", "fx_rate_local_per_usd": "1.0", "fx_source": "default_1usd", "information_text": "", "description_text": "", "features_text": "", "specifications_text": "", "benefits_text": "", "details_text": "Pan de horno tipo artesanal. | Blanco. | Con rueda ancha y sabor delicioso. | Elaborado con Harina de trigo fortificada y Leche. | Contenido: 560g. | Detalles del producto | Reseñas | Escribir Su propia reseña | Estás revisando: PAN DE HORNO BLANCO ARTESANAL MODERNA 56 | Su valoración | 1 stars | 2 stars | 3 stars | 4 stars | 5 stars | Apodo | Resumen | Reseña | Escribir una reseña | Unds. | Search engine powered by | ElasticSuite", "other_sections": "", "sections": {"Detalles": ["Pan de horno tipo artesanal.", "Blanco.", "Con rueda ancha y sabor delicioso.", "Elaborado con Harina de trigo fortificada y Leche.", "Contenido: 560g.", "Detalles del producto", "Reseñas", "Escribir Su propia reseña", "Estás revisando: PAN DE HORNO BLANCO ARTESANAL MODERNA 56", "Su valoración", "Rating", "1 star", "2 stars", "3 stars", "4 stars", "5 stars", "Apodo", "Resumen", "Reseña", "Escribir una reseña", "Unds.", "Search engine powered by", "ElasticSuite"]}, "txt_path": "dataset/txt_limpios/1326.txt", "html_path": "dataset/paginas_descargadas/1326.html", "es_status": "ET", "category_canonical": "harina de trigo", "decision": "keep", "match_score": 0.6, "reasons": "heuristic_default"}
{"source_id": "1327", "title": "El almacenamiento local parece estar deshabilitado en tu navegador.", "description": "Pan brioché conleche y huevo | Libre de saboresartificiales | 18 rebanadas | Contenido:580g | Detalles del producto | Reseñas | Escribir Su propia reseña | Estás revisando: Pan Molde Supan Brioché | 580g | Su valoración | Rating | 1 stars | 2 stars | 3 stars | 4 stars | Apodo | Resumen | Reseña | Escribir una reseña | Unds. | Search engine powered by | ElasticSuite", "breadcrumbs": "Aprende más > 580g", "price_raw": "3.08", "currency_raw": "", "url": "", "seller": "Desconocido", "availability": "unknown", "country": "UNKNOWN", "product_name": "El almacenamiento local parece estar deshabilitado en tu navegador.", "brand": "Aprende", "reference": "", "unit": "580g", "price_amount": 3.08, "price_currency": "", "price_symbol": "$", "price_text": "$3,08", "price_amount_filled": "3.08", "price_is_imputed": "False", "price_imputation_source": "original", "price_amount_usd": "3.08", "price_amount_usd_filled": "3.08", "fx_rate_local_per_usd": "1.0", "fx_source": "default_1usd", "information_text": "", "description_text": "", "features_text": "", "specifications_text": "", "benefits_text": "", "details_text": "Pan brioché conleche y huevo | Libre de saboresartificiales | 18 rebanadas | Contenido:580g | Detalles del producto | Reseñas | Escribir Su propia reseña | Estás revisando: Pan Molde Supan Brioché | 580g | Su valoración | Rating | 1 stars | 2 stars | 3 stars | 4 stars | Apodo | Resumen | Reseña | Escribir una reseña | Unds. | Search engine powered by | ElasticSuite", "other_sections": "", "sections": {"Detalles": ["Pan brioché conleche y huevo", "Libre de saboresartificiales", "18 rebanadas", "Contenido:580g", "Detalles del producto", "Reseñas", "Escribir Su propia reseña", "Estás revisando: Pan Molde Supan Brioché | 580g", "Su valoración", "Rating", "1 star", "2 stars", "3 stars", "4 stars", "5 stars", "Apodo", "Resumen", "Reseña", "Escribir una reseña", "Unds.", "Search engine powered by", "ElasticSuite"]}, "txt_path": "dataset/txt_limpios/1327.txt", "html_path": "dataset/paginas_descargadas/1327.html", "es_status": "ET", "category_canonical": "pan", "decision": "keep", "match_score": 0.6, "reasons": "heuristic_default"}
{"source_id": "1328", "title": "El almacenamiento local parece estar deshabilitado en tu navegador.", "description": "Tropical marca de refrescos ecuatorianos | Es el refresco de toda la vida en Ecuador | Con más de 60 años, suelo los buenos sabores duran tanto | Tropical marca de refrescos que han llegado a Europa desde Ecuador | Refresco de color rojo y sabor dulce | Contenido: 3.78 L | Detalles del producto | Reseñas | Escribir Su propia reseña | Estás revisando: Cola Tropical Fresa 3785Ml | Su valoración | Rating | 1 stars | 2 stars | 3 stars | 4 stars | 5 stars | Apodo | Resumen | Reseña | Escribir una reseña | Unds. | Search engine powered by | ElasticSuite", "breadcrumbs": "Aprende más > 3785Ml", "price_raw": "1.97", "currency_raw": "", "url": "", "seller": "Desconocido", "availability": "unknown", "country": "UNKNOWN", "product_name": "El almacenamiento local parece estar deshabilitado en tu navegador.", "brand": "Aprende", "reference": "", "unit": "3785Ml", "price_amount": 1.97, "price_currency": "", "price_symbol": "$", "price_text": "$1,97", "price_amount_filled": "1.97", "price_is_imputed": "False", "price_imputation_source": "original", "price_amount_usd": "1.97", "price_amount_usd_filled": "1.97", "fx_rate_local_per_usd": "1.0", "fx_source": "default_1usd", "information_text": "", "description_text": "", "features_text": "", "specifications_text": "", "benefits_text": "", "details_text": "Tropical marca de refrescos ecuatorianos | Es el refresco de toda la vida en Ecuador | Con más de 60 años, suelo los buenos sabores duran tanto | Tropical marca de refrescos que han llegado a Europa desde Ecuador | Refresco de color rojo y sabor dulce | Contenido: 3.78 L | Detalles del producto | Reseñas | Escribir Su propia reseña | Estás revisando: Cola Tropical Fresa 3785Ml | Su valoración | Rating | 1 stars | 2 stars | 3 stars | 4 stars | 5 stars | Apodo | Resumen | Reseña | Escribir una reseña | Unds. | Search engine powered by | ElasticSuite", "other_sections": "", "sections": {"Detalles": ["Tropical marca de refrescos ecuatorianos", "Es el refresco de toda la vida  en Ecuador", "Con más de 60 años, suelo los buenos sabores duran tanto", "Tropical marca de refrescos que han llegado a Europa desde Ecuador", "Refresco de color rojo y sabor dulce", "Contenido: 3.78 L", "Detalles del producto", "Reseñas", "Escribir Su propia reseña", "Estás revisando: Cola Tropical Fresa 3785Ml", "Su valoración", "Rating", "1 star", "2 stars", "3 stars", "4 stars", "5 stars", "Apodo", "Resumen", "Reseña", "Escribir una reseña", "Unds.", "Search engine powered by", "ElasticSuite"]}, "txt_path": "dataset/txt_limpios/1328.txt", "html_path": "dataset/paginas_descargadas/1328.html", "es_status": "ET", "category_canonical": "sin_categoria", "decision": "discard", "match_score": 0.3, "reasons": "no_category_detected"}
{"source_id": "1329", "title": "El almacenamiento local parece estar deshabilitado en tu navegador.", "description": "Tropical marca de refrescos ecuatorianos | Es el refresco de toda la vida en Ecuador | Con más de 60 años, suelo los buenos sabores duran tanto | Tropical marca de refrescos que han llegado a Europa desde Ecuador | Refresco de color rojo y sabor dulce | Contenido: 3.78 L | Detalles del producto | Reseñas | Escribir Su propia reseña | Estás revisando: Cola Tropical Fresa 3785Ml | Su valoración | Rating | 1 stars | 2 stars | 3 stars | 4 stars | 5 stars | Apodo | Resumen | Reseña | Escribir una reseña | Unds. | Search engine powered by | ElasticSuite", "breadcrumbs": "Aprende más > 3785Ml", "price_raw": "1.97", "currency_raw": "", "url": "", "seller": "Desconocido", "availability": "unknown", "country": "UNKNOWN", "product_name": "El almacenamiento local parece estar deshabilitado en tu navegador.", "brand": "Aprende", "reference": "", "unit": "3785Ml", "price_amount": 1.97, "price_currency": "", "price_symbol": "$", "price_text": "$1,97", "price_amount_filled": "1.97", "price_is_imputed": "False", "price_imputation_source": "original", "price_amount_usd": "1.97", "price_amount_usd_filled": "1.97", "fx_rate_local_per_usd": "1.0", "fx_source": "default_1usd", "information_text": "", "description_text": "", "features_text": "", "specifications_text": "", "benefits_text": "", "details_text": "Tropical marca de refrescos ecuatorianos | Es el refresco de toda la vida en Ecuador | Con más de 60 años, suelo los buenos sabores duran tanto | Tropical marca de refrescos que han llegado a Europa desde Ecuador | Refresco de color rojo y sabor dulce | Contenido: 3.78 L | Detalles del producto | Reseñas | Escribir Su propia reseña | Estás revisando: Cola Tropical Fresa 3785Ml | Su valoración | Rating | 1 stars | 2 stars | 3 stars | 4 stars | 5 stars | Apodo | Resumen | Reseña | Escribir una reseña | Unds. | Search engine powered by | ElasticSuite", "other_sections": "", "sections": {"Detalles": ["Tropical marca de refrescos ecuatorianos", "Es el refresco de toda la vida  en Ecuador", "Con más de 60 años, suelo los buenos sabores duran tanto", "Tropical marca de refrescos que han llegado a Europa desde Ecuador", "Refresco de color rojo y sabor dulce", "Contenido: 3.78 L", "Detalles del producto", "Reseñas", "Escribir Su propia reseña", "Estás revisando: Cola Tropical Fresa 3785Ml", "Su valoración", "Rating", "1 star", "2 stars", "3 stars", "4 stars", "5 stars", "Apodo", "Resumen", "Reseña", "Escribir una reseña", "Unds.", "Search engine powered by", "ElasticSuite"]}, "txt_path": "dataset/txt_limpios/1329.txt", "html_path": "dataset/paginas_descargadas/1329.html", "es_status": "ET", "category_canonical": "sin_categoria", "decision": "discard", "match_score": 0.3, "reasons": "no_category_detected"}
{"source_id": "1330", "title": "El almacenamiento local parece estar deshabilitado en tu navegador.", "description": "Sabor original | Contiene edulcorante en calorías | Con menos azúcar | Contenido: 3.05 L | Detalles del producto | Reseñas | Escribir Su propia reseña | Estás revisando: COCA COLA ORIGINAL 3050 ML | Su valoración | 1 stars | 2 stars | 3 stars | 4 stars | 5 stars | Apodo | Resumen | Reseña | Escribir una reseña | Unds. | Search engine powered by | ElasticSuite", "breadcrumbs": "Aprende más > 3050 ML", "price_raw": "2.99", "currency_raw": "", "url": "", "seller": "Desconocido", "availability": "unknown", "country": "UNKNOWN", "product_name": "El almacenamiento local parece estar deshabilitado en tu navegador.", "brand": "Aprende", "reference": "", "unit": "3050 ML", "price_amount": 2.99, "price_currency": "", "price_symbol": "$", "price_text": "$2,99", "price_amount_filled": "2.99", "price_is_imputed": "False", "price_imputation_source": "original", "price_amount_usd": "2.99", "price_amount_usd_filled": "2.99", "fx_rate_local_per_usd": "1.0", "fx_source": "default_1usd", "information_text": "", "description_text": "", "features_text": "", "specifications_text": "", "benefits_text": "", "details_text": "Sabor original | Contiene edulcorante en calorías | Con menos azúcar | Contenido: 3.05 L | Detalles del producto | Reseñas | Escribir Su propia reseña | Estás revisando: COCA COLA ORIGINAL 3050 ML | Su valoración | 1 stars | 2 stars | 3 stars | 4 stars | 5 stars | Apodo | Resumen | Reseña | Escribir una reseña | Unds. | Search engine powered by | ElasticSuite", "other_sections": "", "sections": {"Detalles": ["Sabor original", "Contiene edulcorante en calorías", "Con menos azúcar", "Contenido: 3.05 L", "Detalles del producto", "Reseñas", "Escribir Su propia reseña", "Estás revisando: COCA COLA ORIGINAL 3050 ML", "Su valoración", "Rating", "1 star", "2 stars", "3 stars", "4 stars", "5 stars", "Apodo", "Resumen", "Reseña", "Escribir una reseña", "Unds.", "Search engine powered by", "ElasticSuite"]}, "txt_path": "dataset/txt_limpios/1330.txt", "html_path": "dataset/paginas_descargadas/1330.html", "es_status": "ET", "category_canonical": "azucar", "decision": "keep", "match_score": 0.6, "reasons": "heuristic_default"}
{"source_id": "1331", "title": "El almacenamiento local parece estar deshabilitado en tu navegador.", "description": "Bebidas gaseosas sin calorías | Sabor a lima limón | 100% saborizantes naturales | Sin azúcar | Contenido: 3L | Detalles del producto | Reseñas | Escribir Su propia reseña | Estás revisando: Bebidas Gaseosa Cola Sprite 3L | Su valoración | Rating | 1 stars | 2 stars | 3 stars | 4 stars | 5 stars | Apodo | Resumen | Reseña | Escribir una reseña | Unds. | Search engine powered by | ElasticSuite", "breadcrumbs": "Aprende más > 3L", "price_raw": "2.92", "currency_raw": "", "url": "", "seller": "Desconocido", "availability": "unknown", "country": "UNKNOWN", "product_name": "El almacenamiento local parece estar deshabilitado en tu navegador.", "brand": "Aprende", "reference": "", "unit": "3L", "price_amount": 2.92, "price_currency": "", "price_symbol": "$", "price_text": "$2,92", "price_amount_filled": "2.92", "price_is_imputed": "False", "price_imputation_source": "original", "price_amount_usd": "2.92", "price_amount_usd_filled": "2.92", "fx_rate_local_per_usd": "1.0", "fx_source": "default_1usd", "information_text": "", "description_text": "", "features_text": "", "specifications_text": "", "benefits_text": "", "details_text": "Bebidas gaseosas sin calorías | Sabor a lima limón | 100% saborizantes naturales | Sin azúcar | Contenido: 3L | Detalles del producto | Reseñas | Escribir Su propia reseña | Estás revisando: Bebidas Gaseosa Cola Sprite 3L | Su valoración | Rating | 1 stars | 2 stars | 3 stars | 4 stars | 5 stars | Apodo | Resumen | Reseña | Escribir una reseña | Unds. | Search engine powered by | ElasticSuite", "other_sections": "", "sections": {"Detalles": ["Bebidas gaseosas sin calorías", "Sabor lima limón", "100% saborizantes naturales", "Sin azúcar", "Contenido: 3L", "Detalles del producto", "Reseñas", "Escribir Su propia reseña", "Estás revisando: Bebidas Gaseosa Cola Sprite 3L", "Su valoración", "Rating", "1 star", "2 stars", "3 stars", "4 stars", "5 stars", "Apodo", "Resumen", "Reseña", "Escribir una reseña", "Unds.", "Search engine powered by", "ElasticSuite"]}, "txt_path": "dataset/txt_limpios/1331.txt", "html_path": "dataset/paginas_descargadas/1331.html", "es_status": "ET", "category_canonical": "azucar", "decision": "keep", "match_score": 0.6, "reasons": "heuristic_default"}
{"source_id": "1332", "title": "El almacenamiento local parece estar deshabilitado en tu navegador.", "description": "", "breadcrumbs": "Aprende más > 350G", "price_raw": "350.0", "currency_raw": "", "url": "", "seller": "Desconocido", "availability": "unknown", "country": "UNKNOWN", "product_name": "El almacenamiento local parece estar deshabilitado en tu navegador.", "brand": "Aprende", "reference": "", "unit": "350G", "price_amount": 350.0, "price_currency": "", "price_symbol": "s", "price_text": "s350", "price_amount_filled": "350.0", "price_is_imputed": "False", "price_imputation_source": "original", "price_amount_usd": "350.0", "price_amount_usd_filled": "350.0", "fx_rate_local_per_usd": "1.0", "fx_source": "default_1usd", "information_text": "", "description_text": "", "features_text": "", "specifications_text": "", "benefits_text": "", "details_text": "", "other_sections": "", "sections": {}, "txt_path": "dataset/txt_limpios/1332.txt", "html_path": "dataset/paginas_descargadas/1332.html", "es_status": "ET", "category_canonical": "sin_categoria", "decision": "discard", "match_score": 0.3, "reasons": "no_category_detected"}
{"source_id": "1333", "title": "El almacenamiento local parece estar deshabilitado en tu navegador.", "description": "", "breadcrumbs": "Aprende", "price_raw": "55.13", "currency_raw": "", "url": "", "seller": "Desconocido", "availability": "unknown", "country": "UNKNOWN", "product_name": "El almacenamiento local parece estar deshabilitado en tu navegador.", "brand": "Aprende", "reference": "", "unit": "", "price_amount": 55.13, "price_currency": "", "price_symbol": "$", "price_text": "$55,13", "price_amount_filled": "55.13", "price_is_imputed": "False", "price_imputation_source": "original", "price_amount_usd": "55.13", "price_amount_usd_filled": "55.13", "fx_rate_local_per_usd": "1.0", "fx_source": "default_1usd", "information_text": "", "description_text": "", "features_text": "", "specifications_text": "", "benefits_text": "", "details_text": "", "other_sections": "", "sections": {}, "txt_path": "dataset/txt_limpios/1333.txt", "html_path": "dataset/paginas_descargadas/1333.html", "es_status": "ET", "category_canonical": "sin_categoria", "decision": "discard", "match_score": 0.3, "reasons": "no_category_detected"}
