{"source_id": "4", "title": "Arroz Super Extra Chedraui 900g", "description": "Este cereal es el alimento básico más importante para una gran parte de la población de todo el mundo, principalmente por el alto valor energético que aporta. El arroz es considerado un alimento básico en México por su alta aportación en nutrientes, que se ocupa para acompañar diversos platillos.", "breadcrumbs": "Chedraui > 900g > 3250655", "price_raw": "", "currency_raw": "MXN", "url": "", "seller": "Chedraui", "availability": "unknown", "country": "MX", "product_name": "Arroz Super Extra Chedraui 900g", "brand": "Chedraui", "reference": "3250655.0", "unit": "900g", "price_amount": null, "price_currency": "MXN", "price_symbol": "", "price_text": "", "price_amount_filled": "20.4", "price_is_imputed": "True", "price_imputation_source": "category_country_mean", "price_amount_usd": "", "price_amount_usd_filled": "1.0956", "fx_rate_local_per_usd": "18.62", "fx_source": "from_mexico_cambio_dolar", "information_text": "Este cereal es el alimento básico más importante para una gran parte de la población de todo el mundo, principalmente por el alto valor energético que aporta.", "description_text": "", "features_text": "", "specifications_text": "El arroz es considerado un alimento básico en México por su alta aportación en nutrientes, que se ocupa para acompañar diversos platillos.", "benefits_text": "", "details_text": "", "other_sections": "", "sections": {"Información": ["Este cereal es el alimento básico más importante para una gran parte de la población de todo el mundo, principalmente por el alto valor energético que aporta."], "Especificaciones": ["El arroz es considerado un alimento básico en México por su alta aportación en nutrientes, que se ocupa para acompañar diversos platillos."]}, "txt_path": "dataset/txt_limpios/4.txt", "html_path": "dataset/paginas_descargadas/4.html", "es_status": "EN", "category_canonical": "arroz", "decision": "discard", "match_score": 0.6, "reasons": "price_parse_failed;price<=0"}
{"source_id": "2", "title": "Arroz Verde Valle Super Extra 900g", "description": "Arroz súper extra Verde Valle, es un arroz de la variedad grano largo y siendo ideal para todo tipo de platillos, es el más común en México y su calidad es “SUPER EXTRA” ya que contiene más del 95% de granos enteros. Consiga el arroz más blanco, entero y esponjadito con el arroz Super Extra Verde Valle. Prepárelo como usted prefiera y de él ese sazón especial, el arroz Super Extra Verde Valle es ideal para cualquier tipo de preparación. Le tomará solo 25 minutos prepararlo y tenerlo listo para deleitar su paladar. Es un arroz de la variedad grano largo y siendo ideal para todo tipo de platillos, es el más común en México y su calidad es “SUPER EXTRA” ya que contiene más del 95% de granos enteros.", "breadcrumbs": "Verde Valle > 900g > 3008380", "price_raw": "", "currency_raw": "MXN", "url": "", "seller": "Chedraui", "availability": "unknown", "country": "MX", "product_name": "Arroz Verde Valle Super Extra 900g", "brand": "Verde Valle", "reference": "3008380.0", "unit": "900g", "price_amount": null, "price_currency": "MXN", "price_symbol": "", "price_text": "", "price_amount_filled": "20.4", "price_is_imputed": "True", "price_imputation_source": "category_country_mean", "price_amount_usd": "", "price_amount_usd_filled": "1.0956", "fx_rate_local_per_usd": "18.62", "fx_source": "from_mexico_cambio_dolar", "information_text": "Arroz súper extra Verde Valle, es un arroz de la variedad grano largo y siendo ideal para todo tipo de platillos, es el más común en México y su calidad es “SUPER EXTRA” ya que contiene más del 95% de granos enteros.", "description_text": "", "features_text": "", "specifications_text": "Consiga el arroz más blanco, entero y esponjadito con el arroz Super Extra Verde Valle. Prepárelo como usted prefiera y de él ese sazón especial, el arroz Super Extra Verde Valle es ideal para cualquier tipo de preparación. Le tomará solo 25 minutos prepararlo y tenerlo listo para deleitar su paladar. Es un arroz de la variedad grano largo y siendo ideal para todo tipo de platillos, es el más común en México y su calidad es “SUPER EXTRA” ya que contiene más del 95% de granos enteros.", "benefits_text": "", "details_text": "", "other_sections": "", "sections": {"Información": ["Arroz súper extra Verde Valle, es un arroz de la variedad grano largo y siendo ideal para todo tipo de platillos, es el más común en México y su calidad es “SUPER EXTRA” ya que contiene más del 95% de granos enteros."], "Especificaciones": ["Consiga el arroz más blanco, entero y esponjadito con el arroz Super Extra Verde Valle. Prepárelo como usted prefiera y de él ese sazón especial, el arroz Super Extra Verde Valle es ideal para cualquier tipo de preparación. Le tomará solo 25 minutos prepararlo y tenerlo listo para deleitar su paladar. Es un arroz de la variedad grano largo y siendo ideal para todo tipo de platillos, es el más común en México y su calidad es “SUPER EXTRA” ya que contiene más del 95% de granos enteros."]}, "txt_path": "dataset/txt_limpios/2.txt", "html_path": "dataset/paginas_descargadas/2.html", "es_status": "ET", "category_canonical": "arroz", "decision": "discard", "match_score": 0.6, "reasons": "price_parse_failed;price<=0"}
{"source_id": "567", "title": "Asesoramos tu compra WEB: 📞(601) 6672004 -", "description": "", "breadcrumbs": "Otras Ciudades clic aquí, > 0098841", "price_raw": "25.0", "currency_raw": "COP", "url": "", "seller": "Desconocido", "availability": "unknown", "country": "CO", "product_name": "Asesoramos tu compra WEB: 📞(601) 6672004 -", "brand": "Otras Ciudades clic aquí,", "reference": "98841.0", "unit": "", "price_amount": 25.0, "price_currency": "COP", "price_symbol": "", "price_text": "25", "price_amount_filled": "25.0", "price_is_imputed": "False", "price_imputation_source": "original", "price_amount_usd": "0.0062", "price_amount_usd_filled": "0.0062", "fx_rate_local_per_usd": "4047.0", "fx_source": "from_colombia_cambio_dolar", "information_text": "", "description_text": "", "features_text": "", "specifications_text": "", "benefits_text": "", "details_text": "", "other_sections": "", "sections": {}, "txt_path": "dataset/txt_limpios/567.txt", "html_path": "dataset/paginas_descargadas/567.html", "es_status": "EN", "category_canonical": "sin_categoria", "decision": "discard", "match_score": 0.3, "reasons": "no_category_detected"}
{"source_id": "659", "title": "ASESORAMOS TU COMPRA: 📞(601) 6672004, lun a sab de 7am.a 7pm dom hasta las 6pm", "description": "Ingredientes Condición alimentaria Información nutricional Disfruta del gran sabor y calidad de los huevos Kikes. Prepara las recetas que más te gusten gracias a la versatilidad de este ingrediente. Este producto es vendido, facturado y entregado por Cencosud - Colombia Los precios de los productos pueden cambiar dependiendo de la región. Aplican Términos y Condiciones Desactivados Referencia: 0999469 $ 766, 33 x un KIKES ☆ ¿Todavía tienes tu Tarjeta Cencosud? Solicítala en línea, úsala y obtén un . Aplican términos y condiciones. Solicítala aquí Términos más buscados 1. kefir alpina 2. muebles 3. leche 4. leche alqueria 5. san jorge 6. papel higiénico 7. arroz 8. café 9. cerveza 10. neveras", "breadcrumbs": "otras ciudades consulta aquí > 0999469", "price_raw": "22.99", "currency_raw": "COP", "url": "", "seller": "Desconocido", "availability": "unknown", "country": "CO", "product_name": "ASESORAMOS TU COMPRA: 📞(601) 6672004, lun a sab de 7am.a 7pm dom hasta las 6pm", "brand": "otras ciudades consulta aquí", "reference": "999469.0", "unit": "", "price_amount": 22.99, "price_currency": "COP", "price_symbol": "$", "price_text": "$22.99", "price_amount_filled": "22.99", "price_is_imputed": "False", "price_imputation_source": "original", "price_amount_usd": "0.0057", "price_amount_usd_filled": "0.0057", "fx_rate_local_per_usd": "4047.0", "fx_source": "from_colombia_cambio_dolar", "information_text": "", "description_text": "Ingredientes Condición alimentaria Información nutricional Disfruta del gran sabor y calidad de los huevos Kikes. Prepara las recetas que más te gusten gracias a la versatilidad de este ingrediente. Este producto es vendido, facturado y entregado por Cencosud - Colombia Los precios de los productos pueden cambiar dependiendo de la región. Aplican Términos y Condiciones Desactivados Referencia: 0999469 $ 766, 33 x un KIKES ☆ ¿Todavía tienes tu Tarjeta Cencosud? Solicítala en línea, úsala y obtén un . Aplican términos y condiciones. Solicítala aquí Términos más buscados 1. kefir alpina 2. muebles 3. leche 4. leche alqueria 5. san jorge 6. papel higiénico 7. arroz 8. café 9. cerveza 10. neveras", "features_text": "", "specifications_text": "", "benefits_text": "", "details_text": "", "other_sections": "", "sections": {"Descripción": ["Ingredientes", "Condición alimentaria", "Información nutricional", "Disfruta del gran sabor y calidad de los huevos Kikes. Prepara las recetas que más te gusten gracias a la versatilidad de este ingrediente.", "Este producto es vendido, facturado y entregado por", "Cencosud - Colombia", "Los precios de los productos pueden cambiar dependiendo de la región.", "Aplican Términos y Condiciones", "Desactivado", "Referencia: 0999469", "$", "766", ",", "33", "x", "un", "KIKES", "☆", "¿Todavía tienes tu Tarjeta Cencosud?", "Solicítala en línea, úsala y obtén un", ". Aplican términos y condiciones.", "Solicítala aquí", "Términos más buscados", "1.", "kefir alpina", "2.", "muebles", "3.", "leche", "4.", "leche alqueria", "5.", "san jorge", "6.", "papel higienico", "7.", "arroz", "8.", "cafe", "9.", "cerveza", "10.", "neveras"]}, "txt_path": "dataset/txt_limpios/659.txt", "html_path": "dataset/paginas_descargadas/659.html", "es_status": "ET", "category_canonical": "cafe", "decision": "keep", "match_score": 0.6, "reasons": "heuristic_default"}
{"source_id": "660", "title": "ASESORAMOS TU COMPRA: 📞(601) 6672004, lun a sab de 7am.a 7pm dom hasta las 6pm", "description": "Ingredientes Condición alimentaria Información nutricional El huevo es considerado un alimento rico en proteína, libre de grasas, con alta fuente de hierro y vitaminas. Es ideal para cuidar de tu cuerpo. Este producto es vendido, facturado y entregado por Cencosud - Colombia Los precios de los productos pueden cambiar dependiendo de la región. Aplican Términos y Condiciones Desactivados Referencia: 0452500 $ 854 , 33 x un SANTA REYES ☆ ¿Todavía tienes tu Tarjeta Cencosud? Solicítala en línea, úsala y obtén un . Aplican términos y condiciones. Solicítala aquí Mejores ofertas -5% Términos más buscados 1. kefir alpina 2. muebles 3. leche 4. leche alqueria 5. san jorge 6. papel higiénico 7. arroz 8. café 9. cerveza 10. neveras", "breadcrumbs": "otras ciudades consulta aquí > 0452500", "price_raw": "25.63", "currency_raw": "COP", "url": "", "seller": "Desconocido", "availability": "unknown", "country": "CO", "product_name": "ASESORAMOS TU COMPRA: 📞(601) 6672004, lun a sab de 7am.a 7pm dom hasta las 6pm", "brand": "otras ciudades consulta aquí", "reference": "452500.0", "unit": "", "price_amount": 25.63, "price_currency": "COP", "price_symbol": "$", "price_text": "$25.63", "price_amount_filled": "25.63", "price_is_imputed": "False", "price_imputation_source": "original", "price_amount_usd": "0.0063", "price_amount_usd_filled": "0.0063", "fx_rate_local_per_usd": "4047.0", "fx_source": "from_colombia_cambio_dolar", "information_text": "", "description_text": "Ingredientes Condición alimentaria Información nutricional El huevo es considerado un alimento rico en proteína, libre de grasas, con alta fuente de hierro y vitaminas. Es ideal para cuidar de tu cuerpo. Este producto es vendido, facturado y entregado por Cencosud - Colombia Los precios de los productos pueden cambiar dependiendo de la región. Aplican Términos y Condiciones Desactivados Referencia: 0452500 $ 854 , 33 x un SANTA REYES ☆ ¿Todavía tienes tu Tarjeta Cencosud? Solicítala en línea, úsala y obtén un . Aplican términos y condiciones. Solicítala aquí Mejores ofertas -5% Términos más buscados 1. kefir alpina 2. muebles 3. leche 4. leche alqueria 5. san jorge 6. papel higiénico 7. arroz 8. café 9. cerveza 10. neveras", "features_text": "", "specifications_text": "", "benefits_text": "", "details_text": "", "other_sections": "", "sections": {"Descripción": ["Ingredientes", "Condición alimentaria", "Información nutricional", "El huevo es considerado un alimento rico en proteína, libre de grasas, con alta fuente de hierro y vitaminas. Es ideal para cuidar de tu cuerpo.", "Este producto es vendido, facturado y entregado por", "Cencosud - Colombia", "Los precios de los productos pueden cambiar dependiendo de la región.", "Aplican Términos y Condiciones", "Desactivado", "Referencia: 0452500", "$", "854", ",", "33", "x", "un", "SANTA REYES", "☆", "¿Todavía tienes tu Tarjeta Cencosud?", "Solicítala en línea, úsala y obtén un", ". Aplican términos y condiciones.", "Solicítala aquí", "Mejores ofertas", "-5%", "Términos más buscados", "1.", "kefir alpina", "2.", "muebles", "3.", "leche", "4.", "leche alqueria", "5.", "san jorge", "6.", "papel higienico", "7.", "arroz", "8.", "cafe", "9.", "cerveza", "10.", "neveras"]}, "txt_path": "dataset/txt_limpios/660.txt", "html_path": "dataset/paginas_descargadas/660.html", "es_status": "ET", "category_canonical": "cafe", "decision": "keep", "match_score": 0.6, "reasons": "heuristic_default"}
{"source_id": "661", "title": "ASESORAMOS TU COMPRA: 📞(601) 6672004, lun a sab de 7am.a 7pm dom hasta las 6pm", "description": "Huevos de gallinas alimentadas con cereales. Enriquecidos con omega 3 y vitamina E. Este producto es vendido, facturado y entregado por Cencosud - Colombia Los precios de los productos pueden cambiar dependiendo de la región. Aplican Términos y Condiciones Desactivados Referencia: 0603513 $ 796 , 33 x un SANTA ANITA ☆ ¿Todavía no tienes tu Tarjeta Cencosud? Solicítala en línea, úsala y obtén un . Aplican términos y condiciones. Solicítala aquí Términos más buscados 1. kefir alpina 2. muebles 3. leche 4. leche alqueria 5. san jorge 6. papel higiénico 7. arroz 8. café 9. cerveza 10. neveras", "breadcrumbs": "otras ciudades consulta aquí > 0603513", "price_raw": "23.89", "currency_raw": "COP", "url": "", "seller": "Desconocido", "availability": "unknown", "country": "CO", "product_name": "ASESORAMOS TU COMPRA: 📞(601) 6672004, lun a sab de 7am.a 7pm dom hasta las 6pm", "brand": "otras ciudades consulta aquí", "reference": "603513.0", "unit": "", "price_amount": 23.89, "price_currency": "COP", "price_symbol": "$", "price_text": "$23.89", "price_amount_filled": "23.89", "price_is_imputed": "False", "price_imputation_source": "original", "price_amount_usd": "0.0059", "price_amount_usd_filled": "0.0059", "fx_rate_local_per_usd": "4047.0", "fx_source": "from_colombia_cambio_dolar", "information_text": "", "description_text": "Huevos de gallinas alimentadas con cereales. Enriquecidos con omega 3 y vitamina E. Este producto es vendido, facturado y entregado por Cencosud - Colombia Los precios de los productos pueden cambiar dependiendo de la región. Aplican Términos y Condiciones Desactivados Referencia: 0603513 $ 796 , 33 x un SANTA ANITA ☆ ¿Todavía no tienes tu Tarjeta Cencosud? Solicítala en línea, úsala y obtén un . Aplican términos y condiciones. Solicítala aquí Términos más buscados 1. kefir alpina 2. muebles 3. leche 4. leche alqueria 5. san jorge 6. papel higiénico 7. arroz 8. café 9. cerveza 10. neveras", "features_text": "", "specifications_text": "", "benefits_text": "", "details_text": "", "other_sections": "", "sections": {"Descripción": ["Huevos de gallinas alimentadas con cereales. Enriquecidos con omega 3 y vitamina E.", "Este producto es vendido, facturado y entregado por", "Cencosud - Colombia", "Los precios de los productos pueden cambiar dependiendo de la región.", "Aplican Términos y Condiciones", "Desactivado", "Referencia: 0603513", "$", "796", ",", "33", "x", "un", "SANTA ANITA", "☆", "¿Todavía tienes tu Tarjeta Cencosud?", "Solicítala en línea, úsala y obtén un", ". Aplican términos y condiciones.", "Solicítala aquí", "Términos más buscados", "1.", "kefir alpina", "2.", "muebles", "3.", "leche", "4.", "leche alqueria", "5.", "san jorge", "6.", "papel higienico", "7.", "arroz", "8.", "cafe", "9.", "cerveza", "10.", "neveras"]}, "txt_path": "dataset/txt_limpios/661.txt", "html_path": "dataset/paginas_descargadas/661.html", "es_status": "ET", "category_canonical": "cafe", "decision": "keep", "match_score": 0.6, "reasons": "heuristic_default"}
{"source_id": "662", "title": "ASESORAMOS TU COMPRA: 📞(601) 6672004, lun a sab de 7am.a 7pm dom hasta las 6pm", "description": "De nuestras granjas tu cocina con la frescura y sabor superior del campo gracias a la alimentación natural de nuestras gallinas. Este producto es vendido, facturado y entregado por Cencosud - Colombia Los precios de los productos pueden cambiar dependiendo de la región. Aplican Términos y Condiciones Otros clientes también llevan Desactivado GRANEL Tomate chonto x 500gr ★ ☆ ALPINA CENCOSUD Banano Urabá x 500 gr Ajo importado malla x 3 un Referencia: 0731307 $ 669 , 67 x un HUEVOS ORO (1) ¿Todavía tienes tu Tarjeta Cencosud? Solicítala en línea, úsala y obtén un . Aplican términos y condiciones. Solicítala aquí Términos más buscados 1. kefir alpina 2. muebles 3. leche 4. leche alqueria 5. san jorge 6. papel higiénico 7. arroz 8. café 9. cerveza 10. neveras", "breadcrumbs": "otras ciudades consulta aquí > 500gr > 0731307", "price_raw": "2.5", "currency_raw": "COP", "url": "", "seller": "Desconocido", "availability": "unknown", "country": "CO", "product_name": "ASESORAMOS TU COMPRA: 📞(601) 6672004, lun a sab de 7am.a 7pm dom hasta las 6pm", "brand": "otras ciudades consulta aquí", "reference": "731307.0", "unit": "500gr", "price_amount": 2.5, "price_currency": "COP", "price_symbol": "$", "price_text": "$2.50", "price_amount_filled": "2.5", "price_is_imputed": "False", "price_imputation_source": "original", "price_amount_usd": "0.0006", "price_amount_usd_filled": "0.0006", "fx_rate_local_per_usd": "4047.0", "fx_source": "from_colombia_cambio_dolar", "information_text": "", "description_text": "De nuestras granjas tu cocina con la frescura y sabor superior del campo gracias a la alimentación natural de nuestras gallinas. Este producto es vendido, facturado y entregado por Cencosud - Colombia Los precios de los productos pueden cambiar dependiendo de la región. Aplican Términos y Condiciones Otros clientes también llevan Desactivado GRANEL Tomate chonto x 500gr ★ ☆ ALPINA CENCOSUD Banano Urabá x 500 gr Ajo importado malla x 3 un Referencia: 0731307 $ 669 , 67 x un HUEVOS ORO (1) ¿Todavía tienes tu Tarjeta Cencosud? Solicítala en línea, úsala y obtén un . Aplican términos y condiciones. Solicítala aquí Términos más buscados 1. kefir alpina 2. muebles 3. leche 4. leche alqueria 5. san jorge 6. papel higiénico 7. arroz 8. café 9. cerveza 10. neveras", "features_text": "", "specifications_text": "", "benefits_text": "", "details_text": "", "other_sections": "", "sections": {"Descripción": ["De nuestras granjas tu cocina con la frescura y sabor superior del campo gracias a la alimentación natural de nuestras gallinas.", "Este producto es vendido, facturado y entregado por", "Cencosud - Colombia", "Los precios de los productos pueden cambiar dependiendo de la región.", "Aplican Términos y Condiciones", "Otros clientes también llevan", "Desactivado", "A GRANEL", "Tomate chonto x 500gr", "★", "☆", "ALPINA", "CENCOSUD", "Banano Urabá x 500 gr", "Ajo importado malla x 3 un", "Referencia: 0731307", "$", "669", ",", "67", "x", "un", "HUEVOS ORO", "(1)", "¿Todavía tienes tu Tarjeta Cencosud?", "Solicítala en línea, úsala y obtén un", ". Aplican términos y condiciones.", "Solicítala aquí", "Términos más buscados", "1.", "kefir alpina", "2.", "muebles", "3.", "leche", "4.", "leche alqueria", "5.", "san jorge", "6.", "papel higienico", "7.", "arroz", "8.", "cafe", "9.", "cerveza", "10.", "neveras"]}, "txt_path": "dataset/txt_limpios/662.txt", "html_path": "dataset/paginas_descargadas/662.html", "es_status": "ET", "category_canonical": "cafe", "decision": "keep", "match_score": 0.6, "reasons": "heuristic_default"}
