source_id,title,description,breadcrumbs,price_raw,currency_raw,url,seller,availability,country,product_name,brand,reference,unit,price_amount,price_currency,price_symbol,price_text,price_amount_filled,price_is_imputed,price_imputation_source,price_amount_usd,price_amount_usd_filled,fx_rate_local_per_usd,fx_source,information_text,description_text,features_text,specifications_text,benefits_text,details_text,other_sections,sections,txt_path,html_path,es_status,category_canonical,decision,match_score,reasons
1608,Alimentos básicos,,Frijoles > 1 Kg,,,,Desconocido,unknown,UNKNOWN,Alimentos básicos,Frijoles,,1 Kg,,,,,1.02,True,category_mean,,1.02,1.0,default_1usd,,,,,,,,{},dataset/txt_limpios/1608.txt,dataset/paginas_descargadas/1608.html,ET,frijoles,discard,0.60,price_parse_failed;price<=0
1610,Alimentos básicos,,Frijoles > 1Kg,,,,Desconocido,unknown,UNKNOWN,Alimentos básicos,Frijoles,,1Kg,,,,,1.02,True,category_mean,,1.02,1.0,default_1usd,,,,,,,,{},dataset/txt_limpios/1610.txt,dataset/paginas_descargadas/1610.html,ET,frijoles,discard,0.60,price_parse_failed;price<=0
1612,Alimentos básicos,,Frijoles > 1 kg,,,,Desconocido,unknown,UNKNOWN,Alimentos básicos,Frijoles,,1 kg,,,,,1.02,True,category_mean,,1.02,1.0,default_1usd,,,,,,,,{},dataset/txt_limpios/1612.txt,dataset/paginas_descargadas/1612.html,ET,frijoles,discard,0.60,price_parse_failed;price<=0
180,Alimentos básicos,,Arroz > 5Kg,23.89,BRL,,Desconocido,unknown,BR,Alimentos básicos,Arroz,,5Kg,23.89,BRL,R$,"R$23,89",23.89,False,original,4.3851,4.3851,5.448,from_brasil_cambio_dolar,,,,,,,,{},dataset/txt_limpios/180.txt,dataset/paginas_descargadas/180.html,ET,arroz,keep,0.60,heuristic_default
181,Alimentos básicos,,Arroz > 5Kg,18.59,BRL,,Desconocido,unknown,BR,Alimentos básicos,Arroz,,5Kg,18.59,BRL,R$,"R$18,59",18.59,False,original,3.4123,3.4123,5.448,from_brasil_cambio_dolar,,,,,,,,{},dataset/txt_limpios/181.txt,dataset/paginas_descargadas/181.html,ET,arroz,keep,0.60,heuristic_default
182,Alimentos básicos,,Arroz > 2Kg,11.99,BRL,,Desconocido,unknown,BR,Alimentos básicos,Arroz,,2Kg,11.99,BRL,R$,"R$11,99",11.99,False,original,2.2008,2.2008,5.448,from_brasil_cambio_dolar,,,,,,,,{},dataset/txt_limpios/182.txt,dataset/paginas_descargadas/182.html,ET,arroz,keep,0.60,heuristic_default
183,Alimentos básicos,,Arroz > 5 kg,16.59,BRL,,Desconocido,unknown,BR,Alimentos básicos,Arroz,,5 kg,16.59,BRL,R$,"R$16,59",16.59,False,original,3.0452,3.0452,5.448,from_brasil_cambio_dolar,,,,,,,,{},dataset/txt_limpios/183.txt,dataset/paginas_descargadas/183.html,ET,arroz,keep,0.60,heuristic_default
184,Alimentos básicos,,Arroz > 5Kg,19.49,BRL,,Desconocido,unknown,BR,Alimentos básicos,Arroz,,5Kg,19.49,BRL,R$,"R$19,49",19.49,False,original,3.5775,3.5775,5.448,from_brasil_cambio_dolar,,,,,,,,{},dataset/txt_limpios/184.txt,dataset/paginas_descargadas/184.html,ET,arroz,keep,0.60,heuristic_default
185,Alimentos básicos,,Cafés > 40g,8.89,BRL,,Desconocido,unknown,BR,Alimentos básicos,Cafés,,40g,8.89,BRL,R$,"R$8,89",8.89,False,original,1.6318,1.6318,5.448,from_brasil_cambio_dolar,,,,,,,,{},dataset/txt_limpios/185.txt,dataset/paginas_descargadas/185.html,ET,sin_categoria,discard,0.30,no_category_detected
225,Alimentos básicos,,Frijoles > 1 Kg,5.29,BRL,,Desconocido,unknown,BR,Alimentos básicos,Frijoles,,1 Kg,5.29,BRL,R$,"R$5,29",5.29,False,original,0.971,0.971,5.448,from_brasil_cambio_dolar,,,,,,,,{},dataset/txt_limpios/225.txt,dataset/paginas_descargadas/225.html,ET,frijoles,keep,0.60,heuristic_default
226,Alimentos básicos,,Frijoles > 1Kg,,,,Desconocido,unknown,UNKNOWN,Alimentos básicos,Frijoles,,1Kg,,,,,1.02,True,category_mean,,1.02,1.0,default_1usd,,,,,,,,{},dataset/txt_limpios/226.txt,dataset/paginas_descargadas/226.html,ET,frijoles,discard,0.60,price_parse_failed;price<=0
227,Alimentos básicos,,Frijoles > 1 Kg,,,,Desconocido,unknown,UNKNOWN,Alimentos básicos,Frijoles,,1 Kg,,,,,1.02,True,category_mean,,1.02,1.0,default_1usd,,,,,,,,{},dataset/txt_limpios/227.txt,dataset/paginas_descargadas/227.html,ET,frijoles,discard,0.60,price_parse_failed;price<=0
228,Alimentos básicos,,Frijoles > 1Kg,4.49,BRL,,Desconocido,unknown,BR,Alimentos básicos,Frijoles,,1Kg,4.49,BRL,R$,"R$4,49",4.49,False,original,0.8242,0.8242,5.448,from_brasil_cambio_dolar,,,,,,,,{},dataset/txt_limpios/228.txt,dataset/paginas_descargadas/228.html,ET,frijoles,keep,0.60,heuristic_default
229,Alimentos básicos,,Frijoles > 1 kg,6.89,BRL,,Desconocido,unknown,BR,Alimentos básicos,Frijoles,,1 kg,6.89,BRL,R$,"R$6,89",6.89,False,original,1.2647,1.2647,5.448,from_brasil_cambio_dolar,,,,,,,,{},dataset/txt_limpios/229.txt,dataset/paginas_descargadas/229.html,ET,frijoles,keep,0.60,heuristic_default
1287,App Frecuento,"Elaborada con ingredientes naturales cebada, arroz y lúpulo | Sin saborizantes ni colorantes artificiales | Corona es una invitación para salir y relajarse | Su líquido dorado se elabora 100% en México y es la cerveza mexicana más popular del mundo | Corona ha estado complementando los momentos sencillos de la vida desde 1925, y ahora se disfruta en más de 180 países alrededor del mundo | Porcentaje de alcohol: 4.5% | Contiene: 6 botellas de cerveza de 330ml c/u",Descárgala gratis > 330ml,7.45,,,Desconocido,unknown,UNKNOWN,App Frecuento,Descárgala gratis,,330ml,7.45,,$,$7.45,7.45,False,original,7.45,7.45,1.0,default_1usd,,,,,,"Elaborada con ingredientes naturales cebada, arroz y lúpulo | Sin saborizantes ni colorantes artificiales | Corona es una invitación para salir y relajarse | Su líquido dorado se elabora 100% en México y es la cerveza mexicana más popular del mundo | Corona ha estado complementando los momentos sencillos de la vida desde 1925, y ahora se disfruta en más de 180 países alrededor del mundo | Porcentaje de alcohol: 4.5% | Contiene: 6 botellas de cerveza de 330ml c/u",,"{""Detalles"": [""Elaborada con ingredientes naturales cebada, arroz y lúpulo"", ""Sin saborizantes ni colorantes artificiales"", ""Corona es una invitación para salir y relajarse"", ""Su líquido dorado se elabora 100% en México y es la cerveza mexicana más popular del mundo"", ""Corona ha estado complementando los momentos sencillos de la vida desde 1925, y ahora se disfruta en más de 180 países alrededor del mundo"", ""Porcentaje de alcohol: 4.5%"", ""Contiene: 6 botellas de cerveza de 330ml c/u""]}",dataset/txt_limpios/1287.txt,dataset/paginas_descargadas/1287.html,ET,arroz,keep,0.60,heuristic_default
1366,ARROZ CONEJO SACO 20 LB,Ficha técnica Arroz 20 lb ¿Deseas recibir notificaciones? Remind me later Permitir Thank you! Please check your email inbox to confirm. ¡Oops! Notifications are disabled.,Comparar > 20 LB,9.99,USD,,Desconocido,unknown,US,ARROZ CONEJO SACO 20 LB,Comparar,,20 LB,9.99,USD,$,"$9,99",9.99,False,original,9.99,9.99,1.0,default_1usd,Ficha técnica Arroz 20 lb ¿Deseas recibir notificaciones? Remind me later Permitir Thank you! Please check your email inbox to confirm. ¡Oops! Notifications are disabled.,,,,,,,"{""Información"": [""Ficha técnica"", ""Arroz 20 lb"", ""¿Deseas recibir notificaciones?"", ""Remind me later"", ""Permitir"", ""Thank you! Please check your email inbox to confirm."", ""Oops! Notifications are disabled.""]}",dataset/txt_limpios/1366.txt,dataset/paginas_descargadas/1366.html,ET,arroz,keep,0.60,heuristic_default
790,ARROZ DIANA 500 G,"Ingredientes | Componentes Nombre del producto: Arroz Diana 500 g Descripción del producto: Arroz blanco de alta calidad, ideal para preparar tus comidas favoritas. Presentación de 500 gramos. Tamaño: 18 cm x 12cm Peso: 500 g Modo de fabricación: Industrial Conservación: Mantener en un lugar fresco y seco Origen: Nacional RSAT10I1302 Componentes: Arroz blanco Ver más También puede interesarte FIDEOS DORIA 250 GRS SPAGHETTI DORIA 250 G HARINA DE MAIZ BLANCA PAN 800 G Amor y amistad SALCHICHA RANCHERA X 230 G X 7 UD CEBOLLA CABEZONA X 1000G TOMATE CHONTO X 1000 G Bajó de precio ACEITE DE GIRASOL DON OLIO 900 ML SALSA DE TOMATE FRUCO 500G PANELA PASTILLA 1000 G JAMÓN PIETRÁN ESTANDAR 230G",Unidades disponibles > 500 G,500.0,,,Desconocido,unknown,UNKNOWN,ARROZ DIANA 500 G,Unidades disponibles,,500 G,500.00,,,500,500.0,False,original,500.0,500.0,1.0,default_1usd,,"Ingredientes | Componentes Nombre del producto: Arroz Diana 500 g Descripción del producto: Arroz blanco de alta calidad, ideal para preparar tus comidas favoritas. Presentación de 500 gramos. Tamaño: 18 cm x 12cm Peso: 500 g Modo de fabricación: Industrial Conservación: Mantener en un lugar fresco y seco Origen: Nacional RSAT10I1302 Componentes: Arroz blanco Ver más También puede interesarte FIDEOS DORIA 250 GRS SPAGHETTI DORIA 250 G HARINA DE MAIZ BLANCA PAN 800 G Amor y amistad SALCHICHA RANCHERA X 230 G X 7 UD CEBOLLA CABEZONA X 1000G TOMATE CHONTO X 1000 G Bajó de precio ACEITE DE GIRASOL DON OLIO 900 ML SALSA DE TOMATE FRUCO 500G PANELA PASTILLA 1000 G JAMÓN PIETRÁN ESTANDAR 230G",,,,,,"{""Descripción"": [""Ingredientes | Componentes"", ""Nombre del producto: Arroz Diana 500 g"", ""Descripción del producto: Arroz blanco de alta calidad, ideal para preparar tus comidas favoritas. Presentación de 500 gramos."", ""Tamaño: 18cm x 12cm"", ""Peso: 500 g"", ""Modo de fabricación: Industrial"", ""Conservación: Mantener en un lugar fresco y seco"", ""Origen: Nacional"", ""RSAT10I1302"", ""Componentes: Arroz blanco"", ""Ver más"", ""También puede interesarte"", ""FIDEOS DORIA 250 GRS"", ""SPAGHETTI DORIA 250 G"", ""HARINA DE MAIZ BLANCA PAN 800 G"", ""Amor y amistad"", ""SALCHICHA RANCHERA X 230 G X 7 UD"", ""CEBOLLA CABEZONA X 1000G"", ""TOMATE CHONTO X 1000 G"", ""Bajó de precio"", ""ACEITE DE GIRASOL DON OLIO 900 ML"", ""SALSA DE TOMATE FRUCO 500G"", ""PANELA PASTILLA 1000 G"", ""JAMÓN PIETRÁN ESTANDAR 230G""]}",dataset/txt_limpios/790.txt,dataset/paginas_descargadas/790.html,ET,cebolla,keep,0.60,heuristic_default
791,ARROZ ESTÁNDAR ALBAR 500 GRS,"Ingredientes | Componentes Nombre del producto: Arroz estándar 500g Descripción del producto: Arroz blanco seleccionado, ideal para preparaciones diarias. Presentación práctica de 500 gramos, excelente opción para hogares pequeños el para complementar tu despensa. Tamaño: 19cm x 11cm Peso: 500 g Modo de fabricación: Industrial Conservación: Debe mantenerse en un lugar fresco y seco, protegido de humedad, líquidos y productos con olor fuerte Origen: Nacional NSA-0007355-2019 Componentes: Arroz blanco ¡Queremos que tengas la mejor experiencia! Si tienes dudas sobre este producto el contenido, te invitamos a consultar nuestros Términos y condiciones para conocer malas sobre devoluciones y nuestras políticas de reembolsos. Ver más También puede interesarte SPAGUETTI CAPRÍSSIMA 250 GRS LENTEJA EL ESTÍO 500 GRS CABELLO DE ÁNGEL CAPRÍSSIMA 250 GRS CONCHA CAPRÍSSIMA 250 GRS AZÚCAR BLANCA 1000 GRS SAL REFISAL 1000 G Bajó de precio FRÍDOL CARGAMANTO ROJO EL ESTÍO 500 GRS BARRA ESPARCIBLE DON OLIO 125 G Amor y amistad GALLETAS SALADAS SALTISIMAS 6 TACOS 454 G...",Unidades disponibles > 500 g,500.0,,,Desconocido,unknown,UNKNOWN,ARROZ ESTÁNDAR ALBAR 500 GRS,Unidades disponibles,,500 g,500.00,,,500,500.0,False,original,500.0,500.0,1.0,default_1usd,,"Ingredientes | Componentes Nombre del producto: Arroz estándar 500g Descripción del producto: Arroz blanco seleccionado, ideal para preparaciones diarias. Presentación práctica de 500 gramos, excelente opción para hogares pequeños el para complementar tu despensa. Tamaño: 19cm x 11cm Peso: 500 g Modo de fabricación: Industrial Conservación: Debe mantenerse en un lugar fresco y seco, protegido de humedad, líquidos y productos con olor fuerte Origen: Nacional NSA-0007355-2019 Componentes: Arroz blanco ¡Queremos que tengas la mejor experiencia! Si tienes dudas sobre este producto el contenido, te invitamos a consultar nuestros Términos y condiciones para conocer malas sobre devoluciones y nuestras políticas de reembolsos. Ver más También puede interesarte SPAGUETTI CAPRÍSSIMA 250 GRS LENTEJA EL ESTÍO 500 GRS CABELLO DE ÁNGEL CAPRÍSSIMA 250 GRS CONCHA CAPRÍSSIMA 250 GRS AZÚCAR BLANCA 1000 GRS SAL REFISAL 1000 G Bajó de precio FRÍDOL CARGAMANTO ROJO EL ESTÍO 500 GRS BARRA ESPARCIBLE DON OLIO 125 G Amor y amistad GALLETAS SALADAS SALTISIMAS 6 TACOS 454 G...",,,,,,"{""Descripción"": [""Ingredientes | Componentes"", ""Nombre del producto: Arroz estándar 500g"", ""Descripción del producto: Arroz blanco seleccionado, ideal para preparaciones diarias. Presentación práctica de 500 gramos, excelente opción para hogares pequeños el para complementar tu despensa."", ""Tamaño: 19cm x 11cm"", ""Peso: 500 g"", ""Modo de fabricación: Industrial"", ""Conservación: Debe mantenerse en un lugar fresco y seco, protegido de humedad, líquidos y productos con olor fuerte"", ""Origen: Nacional"", ""NSA-0007355-2019"", ""Componentes: Arroz blanco"", ""¡Queremos que tengas la mejor experiencia! Si tienes dudas sobre este producto el contenido, te invitamos a consultar nuestros Términos y condiciones para conocer malas sobre devoluciones y nuestras políticas de reembolsos."", ""Ver más"", ""También puede interesarte"", ""SPAGUETTI CAPRÍSSIMA 250 GRS"", ""LENTEJA EL ESTÍO 500 GRS"", ""CABELLO DE ÁNGEL CAPRÍSSIMA 250 GRS"", ""CONCHA CAPRÍSSIMA 250 GRS"", ""AZÚCAR BLANCA 1000 GRS"", ""SAL REFISAL 1000 G"", ""Bajó de precio"", ""FRÍDOL CARGAMANTO ROJO EL ESTÍO 500 GRS"", ""BARRA ESPARCIBLE DON OLIO 125 G"", ""Amor y amistad"", ""GALLETAS SALADAS SALTISIMAS 6 TACOS 454 G...""]}",dataset/txt_limpios/791.txt,dataset/paginas_descargadas/791.html,ET,azucar,keep,0.60,heuristic_default
905,Arroz G1 largo ancho bolsa,Arroz Miraflores G1 largo ancho bolsa 1 Kg,1 Kg > 1 Kg,1.89,,,Desconocido,unknown,UNKNOWN,Arroz G1 largo ancho bolsa,1 Kg,,1 Kg,1.89,,$,$1.89,1.89,False,original,1.89,1.89,1.0,default_1usd,,Arroz Miraflores G1 largo ancho bolsa 1 Kg,,,,,,"{""Descripción"": [""Arroz Miraflores G1 largo ancho bolsa 1 Kg""]}",dataset/txt_limpios/905.txt,dataset/paginas_descargadas/905.html,EN,arroz,keep,0.60,heuristic_default
903,Arroz G2 gran selección ancha,Arroz Tucapel G2 gran Selección ancho 1 Kg,1 Kg > 1 Kg,1.37,,,Desconocido,unknown,UNKNOWN,Arroz G2 gran selección ancha,1 Kg,,1 Kg,1.37,,$,$1.37,1.37,False,original,1.37,1.37,1.0,default_1usd,,Arroz Tucapel G2 gran Selección ancho 1 Kg,,,,,,"{""Descripción"": [""Arroz Tucapel G2 gran Selección ancho 1 Kg""]}",dataset/txt_limpios/903.txt,dataset/paginas_descargadas/903.html,ET,arroz,keep,0.60,heuristic_default
904,Arroz G2 largo delgado,Arroz Merkat largo delgado grado 2 1 Kg,1 Kg > 1 Kg,1.02,,,Desconocido,unknown,UNKNOWN,Arroz G2 largo delgado,1 Kg,,1 Kg,1.02,,$,$1.02,1.02,False,original,1.02,1.02,1.0,default_1usd,,Arroz Merkat largo delgado grado 2 1 Kg,,,,,,"{""Descripción"": [""Arroz Merkat largo delgado grado 2 1 Kg""]}",dataset/txt_limpios/904.txt,dataset/paginas_descargadas/904.html,EN,arroz,keep,0.60,heuristic_default
906,Arroz grano largo delgado grad...,Arroz grano largo delgado grado 2 900G,900 g > 900 g,1.39,,,Desconocido,unknown,UNKNOWN,Arroz grano largo delgado grad...,900 g,,900 g,1.39,,$,$1.39,1.39,False,original,1.39,1.39,1.0,default_1usd,,Arroz grano largo delgado grado 2 900G,,,,,,"{""Descripción"": [""Arroz grano largo delgado grado 2 900G""]}",dataset/txt_limpios/906.txt,dataset/paginas_descargadas/906.html,EN,arroz,keep,0.60,heuristic_default
5,Arroz La Merced Super Extra 900g,"Arroz La Merced, el poderoso grano rico en nutrientes. Arroz Precocido La Merced es ideal para comer en el desayuno y comida debido a su alto contenido de nutrientes. Excelente como guarnición para tus platillos favoritos y en el tradicional arroz con leche.",La Merced > 900g > 3247692,21.0,MXN,,Chedraui,unknown,MX,Arroz La Merced Super Extra 900g,La Merced,3247692.0,900g,21.00,MXN,$,$21.00,21.0,False,original,1.1278,1.1278,18.62,from_mexico_cambio_dolar,"Arroz La Merced, el poderoso grano rico en nutrientes.",,"Fuente de proteína y además carbohidratos | Con los beneficios de los antioxidantes. | Contiene vitamina B, potasio y fósforo.",Arroz Precocido La Merced es ideal para comer en el desayuno y comida debido a su alto contenido de nutrientes. Excelente como guarnición para tus platillos favoritos y en el tradicional arroz con leche.,,,,"{""Información"": [""Arroz La Merced, el poderoso grano rico en nutrientes.""], ""Características"": [""Fuente de proteína y además carbohidratos"", ""Con los beneficios de los antioxidantes."", ""Contiene vitamina B, potasio y fósforo.""], ""Especificaciones"": [""Arroz Precocido La Merced es ideal para comer en el desayuno y comida debido a su alto contenido de nutrientes. Excelente como guarnición para tus platillos favoritos y en el tradicional arroz con leche.""]}",dataset/txt_limpios/5.txt,dataset/paginas_descargadas/5.html,EN,arroz,keep,0.60,heuristic_default
1365,ARROZ REAL 2 KG,Ficha técnica ¿Deseas recibir notificaciones? Remind me later Permitir Thank you! Please check your email inbox to confirm. ¡Oops! Notifications are disabled.,Comparar > 2 KG,2.99,USD,,Desconocido,unknown,US,ARROZ REAL 2 KG,Comparar,,2 KG,2.99,USD,$,"$2,99",2.99,False,original,2.99,2.99,1.0,default_1usd,Ficha técnica ¿Deseas recibir notificaciones? Remind me later Permitir Thank you! Please check your email inbox to confirm. ¡Oops! Notifications are disabled.,,,,,,,"{""Información"": [""Ficha técnica"", ""¿Deseas recibir notificaciones?"", ""Remind me later"", ""Permitir"", ""Thank you! Please check your email inbox to confirm."", ""Oops! Notifications are disabled.""]}",dataset/txt_limpios/1365.txt,dataset/paginas_descargadas/1365.html,ET,arroz,keep,0.60,heuristic_default
1,Arroz Schettino Verde 900g,"Arroz Grano Largo, color blanco libre de olore",Schettino > 900g > 3008386,19.8,MXN,,Chedraui,unknown,MX,Arroz Schettino Verde 900g,Schettino,3008386.0,900g,19.80,MXN,$,$19.80,19.8,False,original,1.0634,1.0634,18.62,from_mexico_cambio_dolar,"Arroz Grano Largo, color blanco libre de olore",,Aporta energía | Mejora la digestión | Fuente de fribra,,,,,"{""Información"": [""Arroz Grano Largo, color blanco libre de olore""], ""Características"": [""Aporta energía"", ""Mejora la digestión"", ""Fuente de fribra""]}",dataset/txt_limpios/1.txt,dataset/paginas_descargadas/1.html,EN,arroz,keep,0.60,heuristic_default
3,Arroz SOS Super Extra Rojo 900g,"Arroz Grano Largo, color blanco libre de olore",SOS > 900g > 3008327,,MXN,,Chedraui,unknown,MX,Arroz SOS Super Extra Rojo 900g,SOS,3008327.0,900g,,MXN,,,20.4,True,category_country_mean,,1.0956,18.62,from_mexico_cambio_dolar,"Arroz Grano Largo, color blanco libre de olore",,,,,,,"{""Información"": [""Arroz Grano Largo, color blanco libre de olore""]}",dataset/txt_limpios/3.txt,dataset/paginas_descargadas/3.html,EN,arroz,discard,0.60,price_parse_failed;price<=0
4,Arroz Super Extra Chedraui 900g,"Este cereal es el alimento básico más importante para una gran parte de la población de todo el mundo, principalmente por el alto valor energético que aporta. El arroz es considerado un alimento básico en México por su alta aportación en nutrientes, que se ocupa para acompañar diversos platillos.",Chedraui > 900g > 3250655,,MXN,,Chedraui,unknown,MX,Arroz Super Extra Chedraui 900g,Chedraui,3250655.0,900g,,MXN,,,20.4,True,category_country_mean,,1.0956,18.62,from_mexico_cambio_dolar,"Este cereal es el alimento básico más importante para una gran parte de la población de todo el mundo, principalmente por el alto valor energético que aporta.",,,"El arroz es considerado un alimento básico en México por su alta aportación en nutrientes, que se ocupa para acompañar diversos platillos.",,,,"{""Información"": [""Este cereal es el alimento básico más importante para una gran parte de la población de todo el mundo, principalmente por el alto valor energético que aporta.""], ""Especificaciones"": [""El arroz es considerado un alimento básico en México por su alta aportación en nutrientes, que se ocupa para acompañar diversos platillos.""]}",dataset/txt_limpios/4.txt,dataset/paginas_descargadas/4.html,EN,arroz,discard,0.60,price_parse_failed;price<=0
