source_id,title,description,breadcrumbs,price_raw,currency_raw,url,seller,availability,country,product_name,brand,reference,unit,price_amount,price_currency,price_symbol,price_text,price_amount_filled,price_is_imputed,price_imputation_source,price_amount_usd,price_amount_usd_filled,fx_rate_local_per_usd,fx_source,information_text,description_text,features_text,specifications_text,benefits_text,details_text,other_sections,sections,txt_path,html_path,es_status,category_canonical,decision,match_score,reasons
1079,¡Aún no eres Wong Prime!,"<h2 style=""font-weight: 400;"">Huevos pardos Wong bandeja 15 unid: frescura y sabor único</h2> <h2 style=""font-weight: 400;"">¿Por qué elegir los huevos pardos Wong? </h2> <p>Los <a href=""https://www.wong.pe/huevos-pardos-premium-wong-10un-2-2/p?srsltid=AfmBOoqMoBDnJx3Dg72LEHavD6tN808ZXPSIiOZ4dGC1_2goc8R54TbK"">huevos pardos Wong</a> ofrecen un sabor auténtico y una <strong>excelente frescura</strong>, garantizados por un proceso de producción responsable.&nbsp;</p> <h2 style=""font-weight: 400;"">Compra hoy mismo los huevos pardos Wong, bandeja 15 unidades</h2> Configuraciones ProductData {""allow_notes"":false,""allow_substitute"":false,""cart_limit"":""8"",""brandName"":""Wong"",""brandEcomId"":""994"",""measurement_unit"":""un"",""unit_multiplier"":1,""unit_multiplier_un"":0,""measurement_unit_selector"":false} SkuData {""37949"":{""ref_id"":""723464"",""cart_limit"":8,""allow_notes"":true,""allow_substitute"":true,""measurement_unit"":""un"",""unit_multiplier"":1,""promotions"":[""1057"",""17684"",""341883"",""461775"",""1998071"",""10067607"",""28328684"",""28328914"",""28329380"",""28330336"",""67507085"",""135779464"",""135780958"",""230856418"",""237242861"",""241610291"",""272566090""],""url_canonical"":"""",""unit_multiplier_un"":0,""measurement_unit_selector"":false,""release_data"":{""date_release"":""09-07-2018 00:00"",""date_release_end"":""08-08-2018 00:00"",""is_new"":false}}} Características Destacadas Tipo de Producto Huevos de Gallina Contenido 15 huevos pardos Observaciones y Recomendaciones Origen Nacional Wong Referencia: 723464 S/ 10 99 Cantidad ＋ － Certificados Ver todos ¡Van mejor juntos! Estás viendo: Huevos Pardos Wong Bandeja 15 Unid Precio Online + Filete de Pechuga Artisan x Kg.  Libre de Antibióticos 37 90 x kg 46 60 x kg Comentarios | Especificaciones técnicas | Propiedad | Especificación | Huevos pardos Wong bandeja 15 unid: frescura y sabor único | Los huevos pardos | en bandeja de 15 unidades son la | elección perfecta para quienes buscan calidad | , frescura y sabor en su alimentación. | La frescura de los | huevos pardos Wong | asegura que cada uno conserve su | sabor natural y propiedades nutricionales | , ideales para disfrutar en cualquier ocasión. | ¿Por qué elegir los huevos pardos Wong? | Los | ofrecen un sabor auténtico y una | excelente frescura | , garantizados por un proceso de producción responsable. | Es para quienes buscan un producto natural y nutritivo. Te proporcionan la energía que necesitas para comenzar el día o disfrutar de una | comida saludable | en cualquier momento. Además, su | calidad es alta | , asegurando que siempre obtendrás el mejor sabor. Para tus platos preferidos, puedes complementar tu compra con | arroz | o | verduras | Compra hoy mismo los huevos pardos Wong, bandeja 15 unidades | No te pierdas la oportunidad de disfrutar de los huevos pardos Wong. Obténlos en | Wong.pe | y recibe este delicioso y fresco producto directamente en tu hogar. Adquiérelo junto a | carnes | pescado | para una dieta rica en proteínas. ¡Haz tu pedido hoy mismo! | Ingredientes | Huevos pardos | Ver condiciones de promociones | Podrían interesarte | Huevos Pardos Artisan 15un | 14 | true | Huevos Gallinas Libres 12un | 15 | Huevo de Corral La Calera 12un. | 50 | Huevitos de Codorniz Avicod Bandeja 18 Unid | 8 | 70 | Huevos Pardos Premium Wong 10un | 12 | 30 | ? | ! | i | × | Sí Acepto | Recuerda escribir al menos 3 letras en el cuadro de búsqueda | Términos más buscados | 1. | elvive liso | 2. | ariel liquido | 3. | limpiador inodoro harpic | 4. | busca | 5. | secret clinical | Marcas sugeridas",Aprovecha el > 15 unidades > 723464,79.9,PEN,,Desconocido,unknown,PE,¡Aún no eres Wong Prime!,Aprovecha el,723464.0,15 unidades,79.90,PEN,S/,S/79.90,79.9,False,original,22.507,22.507,3.55,from_peru_cambio_dolar,,"<h2 style=""font-weight: 400;"">Huevos pardos Wong bandeja 15 unid: frescura y sabor único</h2> <h2 style=""font-weight: 400;"">¿Por qué elegir los huevos pardos Wong? </h2> <p>Los <a href=""https://www.wong.pe/huevos-pardos-premium-wong-10un-2-2/p?srsltid=AfmBOoqMoBDnJx3Dg72LEHavD6tN808ZXPSIiOZ4dGC1_2goc8R54TbK"">huevos pardos Wong</a> ofrecen un sabor auténtico y una <strong>excelente frescura</strong>, garantizados por un proceso de producción responsable.&nbsp;</p> <h2 style=""font-weight: 400;"">Compra hoy mismo los huevos pardos Wong, bandeja 15 unidades</h2> Configuraciones ProductData {""allow_notes"":false,""allow_substitute"":false,""cart_limit"":""8"",""brandName"":""Wong"",""brandEcomId"":""994"",""measurement_unit"":""un"",""unit_multiplier"":1,""unit_multiplier_un"":0,""measurement_unit_selector"":false} SkuData {""37949"":{""ref_id"":""723464"",""cart_limit"":8,""allow_notes"":true,""allow_substitute"":true,""measurement_unit"":""un"",""unit_multiplier"":1,""promotions"":[""1057"",""17684"",""341883"",""461775"",""1998071"",""10067607"",""28328684"",""28328914"",""28329380"",""28330336"",""67507085"",""135779464"",""135780958"",""230856418"",""237242861"",""241610291"",""272566090""],""url_canonical"":"""",""unit_multiplier_un"":0,""measurement_unit_selector"":false,""release_data"":{""date_release"":""09-07-2018 00:00"",""date_release_end"":""08-08-2018 00:00"",""is_new"":false}}} Características Destacadas Tipo de Producto Huevos de Gallina Contenido 15 huevos pardos Observaciones y Recomendaciones Origen Nacional Wong Referencia: 723464 S/ 10 99 Cantidad ＋ － Certificados Ver todos ¡Van mejor juntos! Estás viendo: Huevos Pardos Wong Bandeja 15 Unid Precio Online + Filete de Pechuga Artisan x Kg.  Libre de Antibióticos 37 90 x kg 46 60 x kg",,"Comentarios | Especificaciones técnicas | Propiedad | Especificación | Huevos pardos Wong bandeja 15 unid: frescura y sabor único | Los huevos pardos | en bandeja de 15 unidades son la | elección perfecta para quienes buscan calidad | , frescura y sabor en su alimentación. | La frescura de los | huevos pardos Wong | asegura que cada uno conserve su | sabor natural y propiedades nutricionales | , ideales para disfrutar en cualquier ocasión. | ¿Por qué elegir los huevos pardos Wong? | Los | ofrecen un sabor auténtico y una | excelente frescura | , garantizados por un proceso de producción responsable. | Es para quienes buscan un producto natural y nutritivo. Te proporcionan la energía que necesitas para comenzar el día o disfrutar de una | comida saludable | en cualquier momento. Además, su | calidad es alta | , asegurando que siempre obtendrás el mejor sabor. Para tus platos preferidos, puedes complementar tu compra con | arroz | o | verduras | Compra hoy mismo los huevos pardos Wong, bandeja 15 unidades | No te pierdas la oportunidad de disfrutar de los huevos pardos Wong. Obténlos en | Wong.pe | y recibe este delicioso y fresco producto directamente en tu hogar. Adquiérelo junto a | carnes | pescado | para una dieta rica en proteínas. ¡Haz tu pedido hoy mismo! | Ingredientes | Huevos pardos | Ver condiciones de promociones | Podrían interesarte | Huevos Pardos Artisan 15un | 14 | true | Huevos Gallinas Libres 12un | 15 | Huevo de Corral La Calera 12un. | 50 | Huevitos de Codorniz Avicod Bandeja 18 Unid | 8 | 70 | Huevos Pardos Premium Wong 10un | 12 | 30 | ? | ! | i | × | Sí Acepto | Recuerda escribir al menos 3 letras en el cuadro de búsqueda | Términos más buscados | 1. | elvive liso | 2. | ariel liquido | 3. | limpiador inodoro harpic | 4. | busca | 5. | secret clinical | Marcas sugeridas",,,,"{""Descripción"": [""<h2 style=\""font-weight: 400;\"">Huevos pardos Wong bandeja 15 unid: frescura y sabor único</h2>"", ""<h2 style=\""font-weight: 400;\"">¿Por qué elegir los huevos pardos Wong? </h2>"", ""<p>Los <a href=\""https://www.wong.pe/huevos-pardos-premium-wong-10un-2-2/p?srsltid=AfmBOoqMoBDnJx3Dg72LEHavD6tN808ZXPSIiOZ4dGC1_2goc8R54TbK\"">huevos pardos Wong</a> ofrecen un sabor auténtico y una <strong>excelente frescura</strong>, garantizados por un proceso de producción responsable.&nbsp;</p>"", ""<h2 style=\""font-weight: 400;\"">Compra hoy mismo los huevos pardos Wong, bandeja 15 unidades</h2>"", ""Configuraciones"", ""ProductData"", ""{\""allow_notes\"":false,\""allow_substitute\"":false,\""cart_limit\"":\""8\"",\""brandName\"":\""Wong\"",\""brandEcomId\"":\""994\"",\""measurement_unit\"":\""un\"",\""unit_multiplier\"":1,\""unit_multiplier_un\"":0,\""measurement_unit_selector\"":false}"", ""SkuData"", ""{\""37949\"":{\""ref_id\"":\""723464\"",\""cart_limit\"":8,\""allow_notes\"":true,\""allow_substitute\"":true,\""measurement_unit\"":\""un\"",\""unit_multiplier\"":1,\""promotions\"":[\""1057\"",\""17684\"",\""341883\"",\""461775\"",\""1998071\"",\""10067607\"",\""28328684\"",\""28328914\"",\""28329380\"",\""28330336\"",\""67507085\"",\""135779464\"",\""135780958\"",\""230856418\"",\""237242861\"",\""241610291\"",\""272566090\""],\""url_canonical\"":\""\"",\""unit_multiplier_un\"":0,\""measurement_unit_selector\"":false,\""release_data\"":{\""date_release\"":\""09-07-2018 00:00\"",\""date_release_end\"":\""08-08-2018 00:00\"",\""is_new\"":false}}}"", ""Características Destacadas"", ""Tipo de Producto"", ""Huevos de Gallina"", ""Contenido"", ""15 huevos pardos"", ""Observaciones y Recomendaciones"", ""Origen"", ""Nacional"", ""Wong"", ""Referencia: 723464"", ""S/"", ""10"", ""99"", ""Cantidad"", ""＋"", ""－"", ""Certificados"", ""Ver todos"", ""¡Van mejor juntos!"", ""Estás viendo: Huevos Pardos Wong Bandeja 15 Unid"", ""Precio Online"", ""+"", ""Filete de Pechuga Artisan x Kg.  Libre de Antibióticos"", ""37"", ""90"", ""x kg"", ""46"", ""60"", ""x"", ""kg""], ""Especificaciones"": [""Comentarios"", ""Especificaciones técnicas"", ""Propiedad"", ""Especificación"", ""Huevos pardos Wong bandeja 15 unid: frescura y sabor único"", ""Los huevos pardos"", ""en bandeja de 15 unidades son la"", ""elección perfecta para quienes buscan calidad"", "", frescura y sabor en su alimentación."", ""La frescura de los"", ""huevos pardos Wong"", ""asegura que cada uno conserve su"", ""sabor natural y propiedades nutricionales"", "", ideales para disfrutar en cualquier ocasión."", ""¿Por qué elegir los huevos pardos Wong?"", ""Los"", ""ofrecen un sabor auténtico y una"", ""excelente frescura"", "", garantizados por un proceso de producción responsable."", ""Es para quienes buscan un producto natural y nutritivo. Te proporcionan la energía que necesitas para comenzar el día o disfrutar de una"", ""comida saludable"", ""en cualquier momento. Además, su"", ""calidad es alta"", "", asegurando que siempre obtendrás el mejor sabor. Para tus platos preferidos, puedes complementar tu compra con"", ""arroz"", ""o"", ""verduras"", ""Compra hoy mismo los huevos pardos Wong, bandeja 15 unidades"", ""No te pierdas la oportunidad de disfrutar de los huevos pardos Wong. Obténlos en"", ""Wong.pe"", ""y recibe este delicioso y fresco producto directamente en tu hogar. Adquiérelo junto a"", ""carnes"", ""pescado"", ""para una dieta rica en proteínas. ¡Haz tu pedido hoy mismo!"", ""Ingredientes"", ""Huevos pardos"", ""Ver condiciones de promociones"", ""Podrían interesarte"", ""Huevos Pardos Artisan 15un"", ""14"", ""true"", ""Huevos Gallinas Libres 12un"", ""15"", ""Huevo de Corral La Calera 12un."", ""50"", ""Huevitos de Codorniz Avicod Bandeja 18 Unid"", ""8"", ""70"", ""Huevos Pardos Premium Wong 10un"", ""12"", ""30"", ""?"", ""!"", ""i"", ""×"", ""Sí Acepto"", ""Recuerda escribir al menos 3 letras en el cuadro de búsqueda"", ""Términos más buscados"", ""1."", ""elvive liso"", ""2."", ""ariel liquido"", ""3."", ""limpiador inodoro harpic"", ""4."", ""busca"", ""5."", ""secret clinical"", ""Marcas sugeridas""]}",dataset/txt_limpios/1079.txt,dataset/paginas_descargadas/1079.html,EN,huevo,discard,0.30,heuristic_default
1080,¡Aún no eres Wong Prime!,Comentarios | Especificaciones técnicas | Propiedad | Especificación | Ingredientes | Ver condiciones de promociones | Podrían interesarte | Huevos Gallinas Libres 12un | 15 | true | Huevo de Corral La Calera 12un. | 50 | Huevitos de Codorniz Avicod Bandeja 18 Unid | 8 | 70 | Huevos Pardos Premium Wong 10un | 12 | 30 | Huevos Pardos Wong Bandeja 8 Unid | 6 | 49 | ? | ! | i | × | Sí Acepto | Recuerda escribir al menos 3 letras en el cuadro de búsqueda | Términos más buscados | 1. | elvive liso | 2. | ariel liquido | 3. | limpiador inodoro harpic | 4. | busca | 5. | secret clinical | Marcas sugeridas,Aprovecha el > 15 unidades > 964245,79.9,PEN,,Desconocido,unknown,PE,¡Aún no eres Wong Prime!,Aprovecha el,964245.0,15 unidades,79.90,PEN,S/,S/79.90,79.9,False,original,22.507,22.507,3.55,from_peru_cambio_dolar,,,,Comentarios | Especificaciones técnicas | Propiedad | Especificación | Ingredientes | Ver condiciones de promociones | Podrían interesarte | Huevos Gallinas Libres 12un | 15 | true | Huevo de Corral La Calera 12un. | 50 | Huevitos de Codorniz Avicod Bandeja 18 Unid | 8 | 70 | Huevos Pardos Premium Wong 10un | 12 | 30 | Huevos Pardos Wong Bandeja 8 Unid | 6 | 49 | ? | ! | i | × | Sí Acepto | Recuerda escribir al menos 3 letras en el cuadro de búsqueda | Términos más buscados | 1. | elvive liso | 2. | ariel liquido | 3. | limpiador inodoro harpic | 4. | busca | 5. | secret clinical | Marcas sugeridas,,,,"{""Especificaciones"": [""Comentarios"", ""Especificaciones técnicas"", ""Propiedad"", ""Especificación"", ""Ingredientes"", ""Ver condiciones de promociones"", ""Podrían interesarte"", ""Huevos Gallinas Libres 12un"", ""15"", ""true"", ""Huevo de Corral La Calera 12un."", ""50"", ""Huevitos de Codorniz Avicod Bandeja 18 Unid"", ""8"", ""70"", ""Huevos Pardos Premium Wong 10un"", ""12"", ""30"", ""Huevos Pardos Wong Bandeja 8 Unid"", ""6"", ""49"", ""?"", ""!"", ""i"", ""×"", ""Sí Acepto"", ""Recuerda escribir al menos 3 letras en el cuadro de búsqueda"", ""Términos más buscados"", ""1."", ""elvive liso"", ""2."", ""ariel liquido"", ""3."", ""limpiador inodoro harpic"", ""4."", ""busca"", ""5."", ""secret clinical"", ""Marcas sugeridas""]}",dataset/txt_limpios/1080.txt,dataset/paginas_descargadas/1080.html,EN,huevo,discard,0.30,heuristic_default
1081,¡Aún no eres Wong Prime!,Comentarios | Especificaciones técnicas | Propiedad | Especificación | Ingredientes | Huevo | Ver condiciones de promociones | Podrían interesarte | Huevos Pardos Artisan 15un | Precio Online | 14 | true | Huevo de Corral La Calera 12un. | 50 | Huevitos de Codorniz Avicod Bandeja 18 Unid | 8 | 70 | Huevos Pardos Premium Wong 10un | 12 | 30 | Huevos Pardos Wong Bandeja 8 Unid | 6 | 49 | ? | ! | i | × | Sí Acepto | Recuerda escribir al menos 3 letras en el cuadro de búsqueda | Términos más buscados | 1. | elvive liso | 2. | ariel liquido | 3. | limpiador inodoro harpic | 4. | busca | 5. | secret clinical | Marcas sugeridas,Aprovecha el > 969114,79.9,PEN,,Desconocido,unknown,PE,¡Aún no eres Wong Prime!,Aprovecha el,969114.0,,79.90,PEN,S/,S/79.90,79.9,False,original,22.507,22.507,3.55,from_peru_cambio_dolar,,,,Comentarios | Especificaciones técnicas | Propiedad | Especificación | Ingredientes | Huevo | Ver condiciones de promociones | Podrían interesarte | Huevos Pardos Artisan 15un | Precio Online | 14 | true | Huevo de Corral La Calera 12un. | 50 | Huevitos de Codorniz Avicod Bandeja 18 Unid | 8 | 70 | Huevos Pardos Premium Wong 10un | 12 | 30 | Huevos Pardos Wong Bandeja 8 Unid | 6 | 49 | ? | ! | i | × | Sí Acepto | Recuerda escribir al menos 3 letras en el cuadro de búsqueda | Términos más buscados | 1. | elvive liso | 2. | ariel liquido | 3. | limpiador inodoro harpic | 4. | busca | 5. | secret clinical | Marcas sugeridas,,,,"{""Especificaciones"": [""Comentarios"", ""Especificaciones técnicas"", ""Propiedad"", ""Especificación"", ""Ingredientes"", ""Huevo"", ""Ver condiciones de promociones"", ""Podrían interesarte"", ""Huevos Pardos Artisan 15un"", ""Precio Online"", ""14"", ""true"", ""Huevo de Corral La Calera 12un."", ""50"", ""Huevitos de Codorniz Avicod Bandeja 18 Unid"", ""8"", ""70"", ""Huevos Pardos Premium Wong 10un"", ""12"", ""30"", ""Huevos Pardos Wong Bandeja 8 Unid"", ""6"", ""49"", ""?"", ""!"", ""i"", ""×"", ""Sí Acepto"", ""Recuerda escribir al menos 3 letras en el cuadro de búsqueda"", ""Términos más buscados"", ""1."", ""elvive liso"", ""2."", ""ariel liquido"", ""3."", ""limpiador inodoro harpic"", ""4."", ""busca"", ""5."", ""secret clinical"", ""Marcas sugeridas""]}",dataset/txt_limpios/1081.txt,dataset/paginas_descargadas/1081.html,EN,huevo,discard,0.30,heuristic_default
1082,¡Aún no eres Wong Prime!,Comentarios | Especificaciones técnicas | Propiedad | Especificación | Ingredientes | Ver condiciones de promociones | Podrían interesarte | ? | ! | i | × | Sí Acepto | Recuerda escribir al menos 3 letras en el cuadro de búsqueda | Términos más buscados | 1. | elvive liso | 2. | ariel liquido | 3. | limpiador inodoro harpic | 4. | busca | 5. | secret clinical | Marcas sugeridas,Aprovecha el > 987749,79.9,PEN,,Desconocido,unknown,PE,¡Aún no eres Wong Prime!,Aprovecha el,987749.0,,79.90,PEN,S/,S/79.90,79.9,False,original,22.507,22.507,3.55,from_peru_cambio_dolar,,,,Comentarios | Especificaciones técnicas | Propiedad | Especificación | Ingredientes | Ver condiciones de promociones | Podrían interesarte | ? | ! | i | × | Sí Acepto | Recuerda escribir al menos 3 letras en el cuadro de búsqueda | Términos más buscados | 1. | elvive liso | 2. | ariel liquido | 3. | limpiador inodoro harpic | 4. | busca | 5. | secret clinical | Marcas sugeridas,,,,"{""Especificaciones"": [""Comentarios"", ""Especificaciones técnicas"", ""Propiedad"", ""Especificación"", ""Ingredientes"", ""Ver condiciones de promociones"", ""Podrían interesarte"", ""?"", ""!"", ""i"", ""×"", ""Sí Acepto"", ""Recuerda escribir al menos 3 letras en el cuadro de búsqueda"", ""Términos más buscados"", ""1."", ""elvive liso"", ""2."", ""ariel liquido"", ""3."", ""limpiador inodoro harpic"", ""4."", ""busca"", ""5."", ""secret clinical"", ""Marcas sugeridas""]}",dataset/txt_limpios/1082.txt,dataset/paginas_descargadas/1082.html,EN,sin_categoria,discard,0.30,no_category_detected
1083,¡Aún no eres Wong Prime!,Información Nutricional Comentarios | Especificaciones técnicas | Propiedad | Especificación | Ingredientes | Jugo de caña de azúcar | Ver condiciones de promociones | ? | ! | i | × | Sí Acepto | Recuerda escribir al menos 3 letras en el cuadro de búsqueda | Términos más buscados | 1. | elvive liso | 2. | ariel liquido | 3. | limpiador inodoro harpic | 4. | busca | 5. | secret clinical | Marcas sugeridas,Aprovecha el > 5 kg > 166858,79.9,PEN,,Desconocido,unknown,PE,¡Aún no eres Wong Prime!,Aprovecha el,166858.0,5 kg,79.90,PEN,S/,S/79.90,79.9,False,original,22.507,22.507,3.55,from_peru_cambio_dolar,,Información Nutricional,,Comentarios | Especificaciones técnicas | Propiedad | Especificación | Ingredientes | Jugo de caña de azúcar | Ver condiciones de promociones | ? | ! | i | × | Sí Acepto | Recuerda escribir al menos 3 letras en el cuadro de búsqueda | Términos más buscados | 1. | elvive liso | 2. | ariel liquido | 3. | limpiador inodoro harpic | 4. | busca | 5. | secret clinical | Marcas sugeridas,,,,"{""Descripción"": [""Información Nutricional""], ""Especificaciones"": [""Comentarios"", ""Especificaciones técnicas"", ""Propiedad"", ""Especificación"", ""Ingredientes"", ""Jugo de caña de azúcar"", ""Ver condiciones de promociones"", ""?"", ""!"", ""i"", ""×"", ""Sí Acepto"", ""Recuerda escribir al menos 3 letras en el cuadro de búsqueda"", ""Términos más buscados"", ""1."", ""elvive liso"", ""2."", ""ariel liquido"", ""3."", ""limpiador inodoro harpic"", ""4."", ""busca"", ""5."", ""secret clinical"", ""Marcas sugeridas""]}",dataset/txt_limpios/1083.txt,dataset/paginas_descargadas/1083.html,EN,azucar,keep,0.60,heuristic_default
1084,¡Aún no eres Wong Prime!,Información Nutricional Comentarios | Especificaciones técnicas | Propiedad | Especificación | Ingredientes | Caña de azúcar | Ver condiciones de promociones | ? | ! | i | × | Sí Acepto,Aprovecha el > 2 kg > 371932,79.9,PEN,,Desconocido,unknown,PE,¡Aún no eres Wong Prime!,Aprovecha el,371932.0,2 kg,79.90,PEN,S/,S/79.90,79.9,False,original,22.507,22.507,3.55,from_peru_cambio_dolar,,Información Nutricional,,Comentarios | Especificaciones técnicas | Propiedad | Especificación | Ingredientes | Caña de azúcar | Ver condiciones de promociones | ? | ! | i | × | Sí Acepto,,,,"{""Descripción"": [""Información Nutricional""], ""Especificaciones"": [""Comentarios"", ""Especificaciones técnicas"", ""Propiedad"", ""Especificación"", ""Ingredientes"", ""Caña de azúcar"", ""Ver condiciones de promociones"", ""?"", ""!"", ""i"", ""×"", ""Sí Acepto""]}",dataset/txt_limpios/1084.txt,dataset/paginas_descargadas/1084.html,EN,azucar,keep,0.60,heuristic_default
1085,¡Aún no eres Wong Prime!,,Aprovecha el,79.9,PEN,,Desconocido,unknown,PE,¡Aún no eres Wong Prime!,Aprovecha el,,,79.90,PEN,S/,S/79.90,79.9,False,original,22.507,22.507,3.55,from_peru_cambio_dolar,,,,,,,,{},dataset/txt_limpios/1085.txt,dataset/paginas_descargadas/1085.html,EN,sin_categoria,discard,0.30,no_category_detected
