source_id,title,description,breadcrumbs,price_raw,currency_raw,url,seller,availability,country,product_name,brand,reference,unit,price_amount,price_currency,price_symbol,price_text,price_amount_filled,price_is_imputed,price_imputation_source,price_amount_usd,price_amount_usd_filled,fx_rate_local_per_usd,fx_source,information_text,description_text,features_text,specifications_text,benefits_text,details_text,other_sections,sections,txt_path,html_path,es_status,category_canonical,decision,match_score,reasons
1230,Seja Bem Vindo à Plaza Vea,Información de la marca,Panadería y Pastelería > 495g,11.0,PEN,,Desconocido,unknown,PE,Seja Bem Vindo à Plaza Vea,Panadería y Pastelería,,495g,11.00,PEN,S/,S/11,11.0,False,original,3.0986,3.0986,3.55,from_peru_cambio_dolar,,Información de la marca,"Importante destacar | Pan empacado | Ideal para los desayunos y sándwiches | Conservar en lugar fresco y seco | Descripción del producto | PAN DE LA CASA Y PAN ENVASADO | ¡Disfruta de los mejores insumos de | en la página online de plazaVea! Ingresando a la sección de | Panadería, Pastelería y Comidas | podrás elegir entre una variedad de deliciosos productos, todos elaborados por expertos en la cocina. | Ingresa a la web de | plazaVea | y déjate atrapar por todo nuestro surtido de | y | Pan de la Casa | , ideales para esos momentos especiales en familia, celebraciones, o simplemente darte un gustito al día. Tenemos presentaciones de | pan a granel | , | bollería fina | pan pita y árabe | , además de pan relleno tanto dulce como salado para brindarte una mayor diversidad de opciones. | ¡Conoce la mejor variedad de Pan Envasado y Pan de la Casa en plazaVea Online! | ¿No es lo que buscas? Encuentra más | Pan Envasado y Pan de la casa | en plazaVea | Revisa todo | Componentes del Producto | Vendido por | En caso algo no vaya como gustes: Puedes revisar nuestras | Politicas de cambios y/o devoluciones | y hacerlas efectivas en todas nuestras tiendas. | Productos | que te pueden interesar | similares | .00 | un | 3 | productos agregados | Agrega indicaciones | Guardar | Multiplicador-de-unidad: Express | Pan de Molde Integral BIMBO Vital Multicereal Bolsa 360g | Pan Molde Blanco ARO Bolsa 600g | Pan de Molde Integral BIMBO Vital Multicereal Bolsa 600g | Pan de Molde BIMBO Integral Familiar Bolsa 620g | Pan de Molde BIMBO Integral Cero Cero Bolsa 650g | Multiplicador-de-unidad: MAKRO-Bi-Precio|Vigente Oculto | Pan de Molde Integral PYC Mediano Bolsa 500g | PYC | Recomendado para ti",,,,,"{""Descripción"": [""Información de la marca""], ""Características"": [""Importante destacar"", ""Pan empacado"", ""Ideal para los desayunos y sándwiches"", ""Conservar en lugar fresco y seco"", ""Descripción del producto"", ""PAN DE LA CASA Y PAN ENVASADO"", ""¡Disfruta de los mejores insumos de"", ""en la página online de plaza ¡Mira! Ingresando la sección de"", ""Panadería, Pastelería y Comidas"", ""podrás elegir entre una variedad de deliciosos productos, todos elaborados por expertos en la cocina."", ""Ingresa a la web de"", ""plazaVea"", ""y déjate atrapar por todo nuestro sordo"", ""y"", ""Pan de la Casa"", "", ideales para esos momentos especiales en familia, celebraciones, el simplemente darte un gustito al día. Tenemos presentaciones"", ""pan a granel"", "","", ""bollería fina"", ""pan pita y árabe"", "", además de pan relleno tanto dulce como salado para brindarte una mayor diversidad de opciones."", ""¡Conoce la mejor variedad de Pan Envasado y Pan de la Casa en plazaVea Online!"", ""¿En qué búsqueda? Encuentra más"", ""Pan Envasado y Pan de la casa"", ""en plazaVea"", ""Revisa todo"", ""Componentes del Producto"", ""Vendido por"", ""En caso algo no vaya como gustes: Puedes revisar nuestras"", ""Politicas de cambios y/o devoluciones"", ""y hacerlas efectivas en todas nuestras tiendas."", ""Productos"", ""que te pueden interesar"", ""similares"", "".00"", ""un"", ""3"", ""productos agregados"", ""Agrega indicaciones"", ""Guardar"", ""Multiplicador-de-unidad: Express"", ""Pan de Molde Integral BIMBO Vital Multicereal Bolsa 360g"", ""Pan Molde Blanco ARO Bolsa 600g"", ""Pan de Molde Integral BIMBO Vital Multicereal Bolsa 600g"", ""Pan de Molde BIMBO Integral Familiar Bolsa 620g"", ""Pan de Molde BIMBO Integral Cero Cero Bolsa 650g"", ""Multiplicador-de-unidad: MAKRO-Bi-Precio|Vigente Oculto"", ""Pan de Molde Integral PYC Mediano Bolsa 500g"", ""PYC"", ""Recomendado para ti""]}",dataset/txt_limpios/1230.txt,dataset/paginas_descargadas/1230.html,ET,sin_categoria,discard,0.30,no_category_detected
1231,Seja Bem Vindo à Plaza Vea,Información de la marca,Panadería y Pastelería > 500g,8.0,PEN,,Desconocido,unknown,PE,Seja Bem Vindo à Plaza Vea,Panadería y Pastelería,,500g,8.00,PEN,S/,S/8,8.0,False,original,2.2535,2.2535,3.55,from_peru_cambio_dolar,,Información de la marca,"Importante destacar | Pan empacado | Ideal para los desayunos y sándwiches | Conservar en lugar fresco y seco | Descripción del producto | PAN DE LA CASA Y PAN ENVASADO | ¡Disfruta de los mejores insumos de | en la página online de plazaVea! Ingresando a la sección de | Panadería, Pastelería y Comidas | podrás elegir entre una variedad de deliciosos productos, todos elaborados por expertos en la cocina. | Ingresa a la web de | plazaVea | y déjate atrapar por todo nuestro surtido de | y | Pan de la Casa | , ideales para esos momentos especiales en familia, celebraciones, o simplemente darte un gustito al día. Tenemos presentaciones de | pan a granel | , | bollería fina | pan pita y árabe | , además de pan relleno tanto dulce como salado para brindarte una mayor diversidad de opciones. | ¡Conoce la mejor variedad de Pan Envasado y Pan de la Casa en plazaVea Online! | ¿No es lo que buscas? Encuentra más | Pan Envasado y Pan de la casa | en plazaVea | Revisa todo | Componentes del Producto | Vendido por | En caso algo no vaya como gustes: Puedes revisar nuestras | Politicas de cambios y/o devoluciones | y hacerlas efectivas en todas nuestras tiendas. | Productos | que te pueden interesar | similares | Pan de Molde BIMBO Blanco Familiar Bolsa 590g | .00 | un | 3 | productos agregados | Agrega indicaciones | Guardar | Pan de Molde PANIFICADORA INDUSTRIAL S.A.C. Bolsa 900g | PANIFICADORA INDUSTRIAL | Pan Blanco BAUDUCCO Bolsa 390g | BAUDUCCO | Pan Fuente UNIÓN Bolsa 780g | UNIÓN | Pan de Molde BIMBO Integral Cero Cero Bolsa 650g | Pan Integral BAUDUCCO Bolsa 390g | Multiplicador-de-unidad: MAKRO-Bi-Precio|Vigente Oculto | Pan de Molde UNIÓN Fibra Multicereal Bolsa 540g | Pan Pita UNIÓN Gran Andina Bolsa 300g | Recomendado para ti",,,,,"{""Descripción"": [""Información de la marca""], ""Características"": [""Importante destacar"", ""Pan empacado"", ""Ideal para los desayunos y sándwiches"", ""Conservar en lugar fresco y seco"", ""Descripción del producto"", ""PAN DE LA CASA Y PAN ENVASADO"", ""¡Disfruta de los mejores insumos de"", ""en la página online de plaza ¡Mira! Ingresando la sección de"", ""Panadería, Pastelería y Comidas"", ""podrás elegir entre una variedad de deliciosos productos, todos elaborados por expertos en la cocina."", ""Ingresa a la web de"", ""plazaVea"", ""y déjate atrapar por todo nuestro sordo"", ""y"", ""Pan de la Casa"", "", ideales para esos momentos especiales en familia, celebraciones, el simplemente darte un gustito al día. Tenemos presentaciones"", ""pan a granel"", "","", ""bollería fina"", ""pan pita y árabe"", "", además de pan relleno tanto dulce como salado para brindarte una mayor diversidad de opciones."", ""¡Conoce la mejor variedad de Pan Envasado y Pan de la Casa en plazaVea Online!"", ""¿En qué búsqueda? Encuentra más"", ""Pan Envasado y Pan de la casa"", ""en plazaVea"", ""Revisa todo"", ""Componentes del Producto"", ""Vendido por"", ""En caso algo no vaya como gustes: Puedes revisar nuestras"", ""Politicas de cambios y/o devoluciones"", ""y hacerlas efectivas en todas nuestras tiendas."", ""Productos"", ""que te pueden interesar"", ""similares"", ""Pan de Molde BIMBO Blanco Familiar Bolsa 590g"", "".00"", ""un"", ""3"", ""productos agregados"", ""Agrega indicaciones"", ""Guardar"", ""Pan de Molde PANIFICADORA INDUSTRIAL S.A.C. Bolsa 900g"", ""PANIFICADORA INDUSTRIAL"", ""Pan Blanco BAUDUCCO Bolsa 390g"", ""BAUDUCCO"", ""Pan Fuente UNIÓN Bolsa 780g"", ""UNIÓN"", ""Pan de Molde BIMBO Integral Cero Cero Bolsa 650g"", ""Pan Integral BAUDUCCO Bolsa 390g"", ""Multiplicador-de-unidad: MAKRO-Bi-Precio|Vigente Oculto"", ""Pan de Molde UNIÓN Fibra Multicereal Bolsa 540g"", ""Pan Pita UNIÓN Gran Andina Bolsa 300g"", ""Recomendado para ti""]}",dataset/txt_limpios/1231.txt,dataset/paginas_descargadas/1231.html,ET,sin_categoria,discard,0.30,no_category_detected
1232,Seja Bem Vindo à Plaza Vea,Información de la marca,Panadería y Pastelería > 500g,6.0,PEN,,Desconocido,unknown,PE,Seja Bem Vindo à Plaza Vea,Panadería y Pastelería,,500g,6.00,PEN,S/,S/6,6.0,False,original,1.6901,1.6901,3.55,from_peru_cambio_dolar,,Información de la marca,"Presentación/Empaque | Bolsa | Porción Sugerida | 45 g | Alérgenos Declarados | Contiene gluten y derivados lácteos | Azúcares Por Porción | 0.8 | Calorías Por Porción | 134 | Carbohidratos Por Porción | 24.7 | Descripción Nutricional | Grasas Por Porción | 1.8 | Proteínas Por Porción | 4.8 | Sodio Por Porción | 173 | Composición | Harina de trigo integral fortificada (Tiamina: 5.0 mg/kg, riboflavina: 4.0 mg/kg, niacina: 48 mg/kg, ácido fólico: 1.2 mg/kg, hierro: 55 mg/kg) y harina de trigo fortificada (Tiamina: 5.0 mg/kg, riboflavina: 4.0 mg/kg, niacina: 48 mg/kg, ácido fólico: 1.2 mg/kg, hierro: 55 mg/kg), agua, azúcar, manteca vegetal, gluten de trigo, sal refinada, levadura (Saccharomyces cerevisiae, aceite vegetal), suero de leche, mejorador [emulsionantes (SIN 471, SIN 481(i)), agente de tratamiento de las harinas (SIN 300, SIN 1100(i))] y sustancia conservadora (SIN 282). | Advertencias De Almacenamiento | Almacenar en lugar fresco y seco, alejado de fuentes de calor | Contenido Neto | 500 g | Revisa todo | Componentes del Producto | Vendido por | plazaVea | En caso algo no vaya como gustes: Puedes revisar nuestras | Politicas de cambios y/o devoluciones | y hacerlas efectivas en todas nuestras tiendas. | Productos | que te pueden interesar | similares | Multiplicador-de-unidad: Express | Pan de Molde Integral BIMBO Vital Multicereal Bolsa 360g | .00 | un | 3 | productos agregados | Agrega indicaciones | Guardar | Pan de Molde Blanco ARO sin Corteza Bolsa 1.2Kg | Pan de Molde BIMBO Blanco Familiar Bolsa 590g | Pan de Molde BIMBO Integral Familiar Bolsa 620g | Pan Integral BAUDUCCO Bolsa 390g | BAUDUCCO | Pan Americano Sandwich UNIÓN Bolsa 540g | UNIÓN | Pan Integral PANIFICADORA INDUSTRIAL Corte Vertical Bolsa 900g | PANIFICADORA INDUSTRIAL | Recomendado para ti",,,,,"{""Descripción"": [""Información de la marca""], ""Características"": [""Presentación/Empaque"", ""Bolsa"", ""Porción sugerida"", ""45 g"", ""Alérgenos Declarados"", ""Contiene gluten y derivados lácteos"", ""Azúcar por porción"", ""0.8"", ""Calorías Porción"", ""134"", ""Carbohidratos Porción"", ""24.7"", ""Descripción Nutricional"", ""Grasas Porción"", ""1.8"", ""Proteínas Porción"", ""4.8"", ""Sodio Porción"", ""173"", ""Composición"", ""Harina de trigo integral fortificada (Tiamina: 5.0 mg/kg, riboflavina: 4.0 mg/kg, niacina: 48 mg/kg, ácido fólico: 1.2 mg/kg, hierro: 55 mg/kg) y harina de trigo fortificada (Tiamina: 5.0 mg/kg, riboflavina: 4.0 mg/kg, niacina: 48 mg/kg, ácido fólico: 1.2 mg/kg, hierro: 55 mg/kg), agua, azúcar, manteca vegetal, gluten de trigo, sal refinada, levadura (Saccharomyces cerevisiae, aceite vegetal), suero de leche, mejorador [emulsionantes (SIN 471, SIN 481(i)), agente de tratamiento de las harinas (SIN 300, SIN 1100(i))] y sustancia conservadora (SIN 282)."", ""Advertencias De Almacenamiento"", ""Almacenar en lugar fresco y seco, alejado de fuentes de calor"", ""Contenido Neto"", ""500 g"", ""Revisa todo"", ""Componentes del Producto"", ""Vendido por"", ""plazaVea"", ""En caso algo no vaya como gustes: Puedes revisar nuestras"", ""Politicas de cambios y/o devoluciones"", ""y hacerlas efectivas en todas nuestras tiendas."", ""Productos"", ""que te pueden interesar"", ""similares"", ""Multiplicador-de-unidad: Express"", ""Pan de Molde Integral BIMBO Vital Multicereal Bolsa 360g"", "".00"", ""un"", ""3"", ""productos agregados"", ""Agrega indicaciones"", ""Guardar"", ""Pan de Molde Blanco ARO sin Corteza Bolsa 1.2Kg"", ""Pan de Molde BIMBO Blanco Familiar Bolsa 590g"", ""Pan de Molde BIMBO Integral Familiar Bolsa 620g"", ""Pan Integral BAUDUCCO Bolsa 390g"", ""BAUDUCCO"", ""Pan americano Sandwich UNIÓN Bolsa 540g"", ""UNIÓN"", ""Pan Integral PANIFICADORA INDUSTRIAL Corte Vertical Bolsa 900g"", ""PANIFICADORA INDUSTRIAL"", ""Recomendado para ti""]}",dataset/txt_limpios/1232.txt,dataset/paginas_descargadas/1232.html,ET,sin_categoria,discard,0.30,no_category_detected
1233,Seja Bem Vindo à Plaza Vea,Información de la marca,Panadería y Pastelería > 810g,11.0,PEN,,Desconocido,unknown,PE,Seja Bem Vindo à Plaza Vea,Panadería y Pastelería,,810g,11.00,PEN,S/,S/11,11.0,False,original,3.0986,3.0986,3.55,from_peru_cambio_dolar,,Información de la marca,"Presentación/Empaque | Bolsa | Denominación Dietética | Porción Sugerida | 2 | Alérgenos Declarados | Gluten y Soya | Azúcares Por Porción | 2g | Calorías Por Porción | 118kcal | Carbohidratos Por Porción | 18g | Descripción Nutricional | Pan de molde integral con granos enteros de trigo que son fuente de fibra, buena para tu sistema digestivo y proporciona energía de forma gradual. Contiene minerales, vitaminas y proteínas. | Grasas Por Porción | Proteínas Por Porción | 7 | Sodio Por Porción | 210mg | Advertencias De Almacenamiento | Mantener en lugar fresco, seco, libre de olores extraños y limpio. Evite la exposición directa a la luz del sol y el calor. | Contenido Neto | 810g | Denominación/Variedad | Revisa todo | Componentes del Producto | Vendido por | plazaVea | En caso algo no vaya como gustes: Puedes revisar nuestras | Politicas de cambios y/o devoluciones | y hacerlas efectivas en todas nuestras tiendas. | Productos | que te pueden interesar | similares | Multiplicador-de-unidad: MAKRO-Bi-Precio|Vigente Oculto | .00 | un | 3 | productos agregados | Agrega indicaciones | Guardar | Multiplicador-de-unidad: Express | Pan Molde Blanco ARO Bolsa 600g | Vea Days Supermercado marzo | Ver todo | Pan Blanco sin Bordes BIMBO Bolsa 650g | Pan de Molde UNIÓN Multisemillas y Avena Bolsa 540g | UNIÓN | Pan de Molde Integral BIMBO Vital Multicereal Bolsa 600g | Pan de Molde BIMBO Integral Familiar Bolsa 620g | Recomendado para ti",,,,,"{""Descripción"": [""Información de la marca""], ""Características"": [""Presentación/Empaque"", ""Bolsa"", ""Denominación Dietética"", ""Porción sugerida"", ""2"", ""Alérgenos Declarados"", ""Gluten y Soya"", ""Azúcar por porción"", ""2g"", ""Calorías Porción"", ""118kcal"", ""Carbohidratos Porción"", ""18g"", ""Descripción Nutricional"", ""Pan de molde integral con granos enteros de trigo que son fuente de fibra, buena para tu sistema digestivo y proporciona energía de forma gradual. Contiene minerales, vitaminas y proteínas."", ""Grasas Porción"", ""Proteínas Porción"", ""7"", ""Sodio Porción"", ""210mg"", ""Advertencias De Almacenamiento"", ""Mantener en lugar fresco, seco, libre de olores extraños y limpio. Evite la exposición directa a la luz del sol y el calor."", ""Contenido Neto"", ""810g"", ""Denominación/Variedad"", ""Revisa todo"", ""Componentes del Producto"", ""Vendido por"", ""plazaVea"", ""En caso algo no vaya como gustes: Puedes revisar nuestras"", ""Politicas de cambios y/o devoluciones"", ""y hacerlas efectivas en todas nuestras tiendas."", ""Productos"", ""que te pueden interesar"", ""similares"", ""Multiplicador-de-unidad: MAKRO-Bi-Precio|Vigente Oculto"", "".00"", ""un"", ""3"", ""productos agregados"", ""Agrega indicaciones"", ""Guardar"", ""Multiplicador-de-unidad: Express"", ""Pan Molde Blanco ARO Bolsa 600g"", ""Vea Days Supermercado marzo | Ver todo"", ""Pan Blanco sin Bordes BIMBO Bolsa 650g"", ""Pan de Molde UNIÓN Multisemillas y Avena Bolsa 540g"", ""UNIÓN"", ""Pan de Molde Integral BIMBO Vital Multicereal Bolsa 600g"", ""Pan de Molde BIMBO Integral Familiar Bolsa 620g"", ""Recomendado para ti""]}",dataset/txt_limpios/1233.txt,dataset/paginas_descargadas/1233.html,ET,sin_categoria,discard,0.30,no_category_detected
1234,Seja Bem Vindo à Plaza Vea,Información de la marca,Abarrotes > 500g,2.0,PEN,,Desconocido,unknown,PE,Seja Bem Vindo à Plaza Vea,Abarrotes,,500g,2.00,PEN,S/,S/2,2.0,False,original,0.5634,0.5634,3.55,from_peru_cambio_dolar,,Información de la marca,"Presentación/Empaque | Paquete | Producto Preparado | No | Porción Sugerida | 80g | Tipo De Producto | Spaghetti | Alérgenos Declarados | Contiene Gluten. | Calorías Por Porción | 286Kcal | Descripción Nutricional | Fortificada con hierro y vitaminas. | Proteínas Por Porción | 0 | Sodio Por Porción | Advertencias De Almacenamiento | Almacenar en un lugar fresco, limpio y seco. | Contenido Neto | 500g | Advertencias de consumo | Consumir antes de la fecha indicada en el envase. | Revisa todo | Componentes del Producto | Vendido por | plazaVea | En caso algo no vaya como gustes: Puedes revisar nuestras | Politicas de cambios y/o devoluciones | y hacerlas efectivas en todas nuestras tiendas. | Productos | que te pueden interesar | similares | Multiplicador-de-unidad: MAKRO-Bi-Precio|Vigente Oculto | Vea Days Supermercado marzo | Ver todo | .00 | un | 3 | productos agregados | Agrega indicaciones | Guardar | Fideos DON VITTORIO Linguini Grosso Bolsa 950g | Fideo Spaghetti SAN JORGE Bolsa 1Kg | SAN JORGE | Fideo Spaghetti LAVAGGI Bolsa 950g | LAVAGGI | Fideos Spaghetti DEL CIELO Bolsa 500g | DEL CIELO | Fideos Spaghetti SAN JORGE Bolsa 500g | Tallarín Trigo DEL CIELO 500g | Recomendado para ti",,,,,"{""Descripción"": [""Información de la marca""], ""Características"": [""Presentación/Empaque"", ""Paquete"", ""Producto Preparado"", ""No"", ""Porción sugerida"", ""80g"", ""Tipo De Producto"", ""Spaghetti"", ""Alérgenos Declarados"", ""Contiene Gluten."", ""Calorías Porción"", ""286Kcal"", ""Descripción Nutricional"", ""Fortificada con hierro y vitaminas."", ""Proteínas Porción"", ""0"", ""Sodio Porción"", ""Advertencias De Almacenamiento"", ""Almacenar en un lugar fresco, limpio y seco."", ""Contenido Neto"", ""500g"", ""Advertencias de consumo"", ""Consumir antes de la fecha indicada en el envase."", ""Revisa todo"", ""Componentes del Producto"", ""Vendido por"", ""plazaVea"", ""En caso algo no vaya como gustes: Puedes revisar nuestras"", ""Politicas de cambios y/o devoluciones"", ""y hacerlas efectivas en todas nuestras tiendas."", ""Productos"", ""que te pueden interesar"", ""similares"", ""Multiplicador-de-unidad: MAKRO-Bi-Precio|Vigente Oculto"", ""Vea Days Supermercado marzo | Ver todo"", "".00"", ""un"", ""3"", ""productos agregados"", ""Agrega indicaciones"", ""Guardar"", ""Fideos DON VITTORIO Linguini Grosso Bolsa 950g"", ""Fideo Spaghetti SAN JORGE Bolsa 1Kg"", ""SAN JORGE"", ""Fideo Spaghetti LAVAGGI Bolsa 950g"", ""LAVAGGI"", ""Fideos Spaghetti DEL CIELO Bolsa 500g"", ""DEL CIELO"", ""Fideos Spaghetti SAN JORGE Bolsa 500g"", ""Tallarín Trigo DEL CIELO 500g"", ""Recomendado para ti""]}",dataset/txt_limpios/1234.txt,dataset/paginas_descargadas/1234.html,ET,sin_categoria,discard,0.30,no_category_detected
