source_id,title,description,breadcrumbs,price_raw,currency_raw,url,seller,availability,country,product_name,brand,reference,unit,price_amount,price_currency,price_symbol,price_text,price_amount_filled,price_is_imputed,price_imputation_source,price_amount_usd,price_amount_usd_filled,fx_rate_local_per_usd,fx_source,information_text,description_text,features_text,specifications_text,benefits_text,details_text,other_sections,sections,txt_path,html_path,es_status,category_canonical,decision,match_score,reasons
100,BUSCAR PRODUCTOS,Huevo fresco de granja. Estuche abre facil | x | Promociones | Cerrar | Más información,Ingresa > 30 piezas,443.0,,,Desconocido,unknown,UNKNOWN,BUSCAR PRODUCTOS,Ingresa,,30 piezas,443.00,,,443,443.0,False,original,443.0,443.0,1.0,default_1usd,,,,,Huevo fresco de granja. Estuche abre facil | x | Promociones | Cerrar | Más información,,,"{""Beneficios"": [""Huevo fresco de granja. Estuche abre facil"", ""x"", ""Promociones"", ""Cerrar"", ""Más información""]}",dataset/txt_limpios/100.txt,dataset/paginas_descargadas/100.html,EN,huevo,discard,0.30,heuristic_default
101,BUSCAR PRODUCTOS,,Ingresa,,,,Desconocido,unknown,UNKNOWN,BUSCAR PRODUCTOS,Ingresa,,,,,,,234.19,True,country_mean,,234.1938,1.0,default_1usd,,,,,,,,{},dataset/txt_limpios/101.txt,dataset/paginas_descargadas/101.html,EN,sin_categoria,discard,0.30,no_category_detected;price_parse_failed
102,BUSCAR PRODUCTOS,,Ingresa,443.0,,,Desconocido,unknown,UNKNOWN,BUSCAR PRODUCTOS,Ingresa,,,443.00,,,443,443.0,False,original,443.0,443.0,1.0,default_1usd,,,,,,,,{},dataset/txt_limpios/102.txt,dataset/paginas_descargadas/102.html,EN,sin_categoria,discard,0.30,no_category_detected
103,BUSCAR PRODUCTOS,,Ingresa,443.0,,,Desconocido,unknown,UNKNOWN,BUSCAR PRODUCTOS,Ingresa,,,443.00,,,443,443.0,False,original,443.0,443.0,1.0,default_1usd,,,,,,,,{},dataset/txt_limpios/103.txt,dataset/paginas_descargadas/103.html,EN,sin_categoria,discard,0.30,no_category_detected
104,BUSCAR PRODUCTOS,,Ingresa,443.0,,,Desconocido,unknown,UNKNOWN,BUSCAR PRODUCTOS,Ingresa,,,443.00,,,443,443.0,False,original,443.0,443.0,1.0,default_1usd,,,,,,,,{},dataset/txt_limpios/104.txt,dataset/paginas_descargadas/104.html,EN,sin_categoria,discard,0.30,no_category_detected
105,BUSCAR PRODUCTOS,,Ingresa,443.0,,,Desconocido,unknown,UNKNOWN,BUSCAR PRODUCTOS,Ingresa,,,443.00,,,443,443.0,False,original,443.0,443.0,1.0,default_1usd,,,,,,,,{},dataset/txt_limpios/105.txt,dataset/paginas_descargadas/105.html,EN,sin_categoria,discard,0.30,no_category_detected
106,BUSCAR PRODUCTOS,,Ingresa,443.0,,,Desconocido,unknown,UNKNOWN,BUSCAR PRODUCTOS,Ingresa,,,443.00,,,443,443.0,False,original,443.0,443.0,1.0,default_1usd,,,,,,,,{},dataset/txt_limpios/106.txt,dataset/paginas_descargadas/106.html,EN,sin_categoria,discard,0.30,no_category_detected
107,BUSCAR PRODUCTOS,"Aporta carbohidratos complejos y es una base esencial en la cocina mexicana tradicional y moderna. | INGREDIENTES | Harina de trigo, peróxido de benzoílo, hierro (fumarato ferroso), zinc (óxido de zinc), niacina, vitamina B1 (mononitrato de tiamina), vitamina B2 (riboflavina), ácido fólico (vitamina B9) y enzimas. | DECLARACIÓN NUTRIMENTAL | Contenido energético por envase 3 450 kcal (14 650 kJ) Tamaño de porción 100 G Porciones por envase 10 Contenido energético 345 kcal (1 465 kJ) Proteínas 11 G Grasas totales 1 G Grasas saturadas 0 G Grasas trans 0 MG Hidratos de carbono disponibles 73 G Azúcares 1 G Azúcares añadidos 0 G Fibra dietética 3 G Sodio 10 MG Nutrimento 100 G %VNR Vitamina B1 0,5 62.5 Vitamina B2 0.3 35.7 Niacina 3.5 31.8 Ácido fólico 0,2 52.6 Hierro 4 23.5 Zinc 4 40 | x | Promociones | Cerrar | Más información",Ingresa > 1 KG,443.0,,,Desconocido,unknown,UNKNOWN,BUSCAR PRODUCTOS,Ingresa,,1 KG,443.00,,,443,443.0,False,original,443.0,443.0,1.0,default_1usd,,,,,"Aporta carbohidratos complejos y es una base esencial en la cocina mexicana tradicional y moderna. | INGREDIENTES | Harina de trigo, peróxido de benzoílo, hierro (fumarato ferroso), zinc (óxido de zinc), niacina, vitamina B1 (mononitrato de tiamina), vitamina B2 (riboflavina), ácido fólico (vitamina B9) y enzimas. | DECLARACIÓN NUTRIMENTAL | Contenido energético por envase 3 450 kcal (14 650 kJ) Tamaño de porción 100 G Porciones por envase 10 Contenido energético 345 kcal (1 465 kJ) Proteínas 11 G Grasas totales 1 G Grasas saturadas 0 G Grasas trans 0 MG Hidratos de carbono disponibles 73 G Azúcares 1 G Azúcares añadidos 0 G Fibra dietética 3 G Sodio 10 MG Nutrimento 100 G %VNR Vitamina B1 0,5 62.5 Vitamina B2 0.3 35.7 Niacina 3.5 31.8 Ácido fólico 0,2 52.6 Hierro 4 23.5 Zinc 4 40 | x | Promociones | Cerrar | Más información",,,"{""Beneficios"": [""Aporta carbohidratos complejos y es una base esencial en la cocina mexicana tradicional y moderna."", ""INGREDIENTES"", ""Harina de trigo, peróxido de benzoílo, hierro (fumarato ferroso), zinc (óxido de zinc), niacina, vitamina B1 (mononitrato de tiamina), vitamina B2 (riboflavina), ácido fólico (vitamina B9) y enzimas."", ""DECLARACIÓN NUTRIMENTAL"", ""Contenido energético por envase 3 450 kcal (14 650 kJ) Tamaño de porción 100 G Porciones por envase 10 Contenido energético 345 kcal (1 465 kJ) Proteínas 11 G Grasas totales 1 G Grasas saturadas 0 G Grasas trans 0 MG Hidratos de carbono disponibles 73 G Azúcares 1 G Azúcares añadidos 0 G Fibra dietética 3 G Sodio 10 MG Nutrimento 100 G %VNR Vitamina B1 0,5 62.5 Vitamina B2 0.3 35.7 Niacina 3.5 31.8 Ácido fólico 0,2 52.6 Hierro 4 23.5 Zinc 4 40"", ""x"", ""Promociones"", ""Cerrar"", ""Más información""]}",dataset/txt_limpios/107.txt,dataset/paginas_descargadas/107.html,ET,harina de trigo,keep,0.60,heuristic_default
108,BUSCAR PRODUCTOS,"Es esencial en cualquier dieta y su versatilidad te permitirá preparar diversos y ricos platillos. Tips y usos Para saber si una papa es de calidad, confirma que sea firme, tenga piel suave y su color sea blanco. Platillos destacados ¿Qué tal un acompañamiento de papas y berenjenas al romero para tu comida de hoy? Además, prepara purés, tortillas, papas fritas el úsala como ingrediente principal de otras recetas. Gracias a su contenido en carbohidratos, es una gran fuente natural de energía. | x | Promociones | Cerrar | Más información",Ingresa,443.0,,,Desconocido,unknown,UNKNOWN,BUSCAR PRODUCTOS,Ingresa,,,443.00,,,443,443.0,False,original,443.0,443.0,1.0,default_1usd,,"Es esencial en cualquier dieta y su versatilidad te permitirá preparar diversos y ricos platillos. Tips y usos Para saber si una papa es de calidad, confirma que sea firme, tenga piel suave y su color sea blanco. Platillos destacados ¿Qué tal un acompañamiento de papas y berenjenas al romero para tu comida de hoy? Además, prepara purés, tortillas, papas fritas el úsala como ingrediente principal de otras recetas.",,,"Gracias a su contenido en carbohidratos, es una gran fuente natural de energía. | x | Promociones | Cerrar | Más información",,,"{""Descripción"": [""Es esencial en cualquier dieta y su versatilidad te permitirá preparar diversos y ricos platillos."", ""Tips y usos"", ""Para saber si una papa es de calidad, confirma que sea firme, tenga piel suave y su color sea blanco."", ""Platillos destacados"", ""¿Qué tal un acompañamiento de papas y berenjenas al romero para tu comida de hoy? Además, prepara purés, tortillas, papas fritas el úsala como ingrediente principal de otras recetas.""], ""Beneficios"": [""Gracias a su contenido en carbohidratos, es una gran fuente natural de energía."", ""x"", ""Promociones"", ""Cerrar"", ""Más información""]}",dataset/txt_limpios/108.txt,dataset/paginas_descargadas/108.html,ET,papa,keep,0.60,heuristic_default
109,BUSCAR PRODUCTOS,"Tienen una vida útil relativamente corta, su sabor suave es distintivo de esta variedad. Tips y usos Son perfectas para comer crudas el asadas, tiene una amplia variedad de usos en guisos, sopas, carnes y ensaladas, por lo que es un básico en la cocina mexicana. Platillos destacados Uno de los platillos más comunes que tiene como protagonista la cebolla es la tinga, un platillo muy mexicano. Esta huerta ayuda a aliviar y combatir enfermedades respiratorias y cardiovasculares, también mejora la circulación sanguínea. | x | Promociones | Cerrar | Más información",Ingresa,443.0,,,Desconocido,unknown,UNKNOWN,BUSCAR PRODUCTOS,Ingresa,,,443.00,,,443,443.0,False,original,443.0,443.0,1.0,default_1usd,,"Tienen una vida útil relativamente corta, su sabor suave es distintivo de esta variedad. Tips y usos Son perfectas para comer crudas el asadas, tiene una amplia variedad de usos en guisos, sopas, carnes y ensaladas, por lo que es un básico en la cocina mexicana. Platillos destacados Uno de los platillos más comunes que tiene como protagonista la cebolla es la tinga, un platillo muy mexicano.",,,"Esta huerta ayuda a aliviar y combatir enfermedades respiratorias y cardiovasculares, también mejora la circulación sanguínea. | x | Promociones | Cerrar | Más información",,,"{""Descripción"": [""Tienen una vida útil relativamente corta, su sabor suave es distintivo de esta variedad."", ""Tips y usos"", ""Son perfectas para comer crudas el asadas, tiene una amplia variedad de usos en guisos, sopas, carnes y ensaladas, por lo que es un básico en la cocina mexicana."", ""Platillos destacados"", ""Uno de los platillos más comunes que tiene como protagonista la cebolla es la tinga, un platillo muy mexicano.""], ""Beneficios"": [""Esta huerta ayuda a aliviar y combatir enfermedades respiratorias y cardiovasculares, también mejora la circulación sanguínea."", ""x"", ""Promociones"", ""Cerrar"", ""Más información""]}",dataset/txt_limpios/109.txt,dataset/paginas_descargadas/109.html,ET,cebolla,keep,0.60,heuristic_default
71,BUSCAR PRODUCTOS,,Ingresa,443.0,,,Desconocido,unknown,UNKNOWN,BUSCAR PRODUCTOS,Ingresa,,,443.00,,,443,443.0,False,original,443.0,443.0,1.0,default_1usd,,,,,,,,{},dataset/txt_limpios/71.txt,dataset/paginas_descargadas/71.html,EN,sin_categoria,discard,0.30,no_category_detected
74,BUSCAR PRODUCTOS,,Ingresa,443.0,,,Desconocido,unknown,UNKNOWN,BUSCAR PRODUCTOS,Ingresa,,,443.00,,,443,443.0,False,original,443.0,443.0,1.0,default_1usd,,,,,,,,{},dataset/txt_limpios/74.txt,dataset/paginas_descargadas/74.html,EN,sin_categoria,discard,0.30,no_category_detected
75,BUSCAR PRODUCTOS,,Ingresa > 100.00 g,443.0,,,Desconocido,unknown,UNKNOWN,BUSCAR PRODUCTOS,Ingresa,,100.00 g,443.00,,,443,443.0,False,original,443.0,443.0,1.0,default_1usd,,,,,,,,{},dataset/txt_limpios/75.txt,dataset/paginas_descargadas/75.html,EN,sin_categoria,discard,0.30,no_category_detected
76,BUSCAR PRODUCTOS,,Ingresa,443.0,,,Desconocido,unknown,UNKNOWN,BUSCAR PRODUCTOS,Ingresa,,,443.00,,,443,443.0,False,original,443.0,443.0,1.0,default_1usd,,,,,,,,{},dataset/txt_limpios/76.txt,dataset/paginas_descargadas/76.html,EN,sin_categoria,discard,0.30,no_category_detected
77,BUSCAR PRODUCTOS,,Ingresa,443.0,,,Desconocido,unknown,UNKNOWN,BUSCAR PRODUCTOS,Ingresa,,,443.00,,,443,443.0,False,original,443.0,443.0,1.0,default_1usd,,,,,,,,{},dataset/txt_limpios/77.txt,dataset/paginas_descargadas/77.html,EN,sin_categoria,discard,0.30,no_category_detected
78,BUSCAR PRODUCTOS,,Ingresa,443.0,,,Desconocido,unknown,UNKNOWN,BUSCAR PRODUCTOS,Ingresa,,,443.00,,,443,443.0,False,original,443.0,443.0,1.0,default_1usd,,,,,,,,{},dataset/txt_limpios/78.txt,dataset/paginas_descargadas/78.html,EN,sin_categoria,discard,0.30,no_category_detected
79,BUSCAR PRODUCTOS,,Ingresa,28.7,,,Desconocido,unknown,UNKNOWN,BUSCAR PRODUCTOS,Ingresa,,,28.70,,$,$28.70,28.7,False,original,28.7,28.7,1.0,default_1usd,,,,,,,,{},dataset/txt_limpios/79.txt,dataset/paginas_descargadas/79.html,EN,sin_categoria,discard,0.30,no_category_detected
80,BUSCAR PRODUCTOS,,Ingresa > 100.00 ml,443.0,,,Desconocido,unknown,UNKNOWN,BUSCAR PRODUCTOS,Ingresa,,100.00 ml,443.00,,,443,443.0,False,original,443.0,443.0,1.0,default_1usd,,,,,,,,{},dataset/txt_limpios/80.txt,dataset/paginas_descargadas/80.html,EN,sin_categoria,discard,0.30,no_category_detected
81,BUSCAR PRODUCTOS,"Es fuente de ácidos grasos esenciales y vitamina Y, componente importante en la alimentación diaria. | INGREDIENTES | DECLARACIÓN NUTRIMENTAL | Contenido energético por envase 6 620 kcal (27 230 kJ) Tamaño de porción 100 ML Porciones por envase 8 Contenido energético 828 kcal (3 404 kJ) Proteínas 0 G Grasas totales 92 G Grasas saturadas 16 G Grasas trans 545 MG Hidratos de carbono disponibles 0 G Azúcar 0 G Azúcar añadido 0 G Fibra dietética 0 G Sodio 0 MG | x | Promociones | Cerrar | Más información",Ingresa > 800 ML,443.0,,,Desconocido,unknown,UNKNOWN,BUSCAR PRODUCTOS,Ingresa,,800 ML,443.00,,,443,443.0,False,original,443.0,443.0,1.0,default_1usd,,,,,"Es fuente de ácidos grasos esenciales y vitamina Y, componente importante en la alimentación diaria. | INGREDIENTES | DECLARACIÓN NUTRIMENTAL | Contenido energético por envase 6 620 kcal (27 230 kJ) Tamaño de porción 100 ML Porciones por envase 8 Contenido energético 828 kcal (3 404 kJ) Proteínas 0 G Grasas totales 92 G Grasas saturadas 16 G Grasas trans 545 MG Hidratos de carbono disponibles 0 G Azúcar 0 G Azúcar añadido 0 G Fibra dietética 0 G Sodio 0 MG | x | Promociones | Cerrar | Más información",,,"{""Beneficios"": [""Es fuente de ácidos grasos esenciales y vitamina Y, componente importante en la alimentación diaria."", ""INGREDIENTES"", ""DECLARACIÓN NUTRIMENTAL"", ""Contenido energético por envase 6 620 kcal (27 230 kJ) Tamaño de porción 100 ML Porciones por envase 8 Contenido energético 828 kcal (3 404 kJ) Proteínas 0 G Grasas totales 92 G Grasas saturadas 16 G Grasas trans 545 MG Hidratos de carbono disponibles 0 G Azúcar 0 G Azúcar añadido 0 G Fibra dietética 0 G Sodio 0 MG"", ""x"", ""Promociones"", ""Cerrar"", ""Más información""]}",dataset/txt_limpios/81.txt,dataset/paginas_descargadas/81.html,ET,azucar,keep,0.60,heuristic_default
82,BUSCAR PRODUCTOS,,Ingresa,443.0,,,Desconocido,unknown,UNKNOWN,BUSCAR PRODUCTOS,Ingresa,,,443.00,,,443,443.0,False,original,443.0,443.0,1.0,default_1usd,,,,,,,,{},dataset/txt_limpios/82.txt,dataset/paginas_descargadas/82.html,EN,sin_categoria,discard,0.30,no_category_detected
83,BUSCAR PRODUCTOS,,Ingresa > 100.00 ml,443.0,,,Desconocido,unknown,UNKNOWN,BUSCAR PRODUCTOS,Ingresa,,100.00 ml,443.00,,,443,443.0,False,original,443.0,443.0,1.0,default_1usd,,,,,,,,{},dataset/txt_limpios/83.txt,dataset/paginas_descargadas/83.html,EN,sin_categoria,discard,0.30,no_category_detected
84,BUSCAR PRODUCTOS,,Ingresa > 240.00 g,443.0,,,Desconocido,unknown,UNKNOWN,BUSCAR PRODUCTOS,Ingresa,,240.00 g,443.00,,,443,443.0,False,original,443.0,443.0,1.0,default_1usd,,,,,,,,{},dataset/txt_limpios/84.txt,dataset/paginas_descargadas/84.html,EN,sin_categoria,discard,0.30,no_category_detected
85,BUSCAR PRODUCTOS,,Ingresa,443.0,,,Desconocido,unknown,UNKNOWN,BUSCAR PRODUCTOS,Ingresa,,,443.00,,,443,443.0,False,original,443.0,443.0,1.0,default_1usd,,,,,,,,{},dataset/txt_limpios/85.txt,dataset/paginas_descargadas/85.html,EN,sin_categoria,discard,0.30,no_category_detected
86,BUSCAR PRODUCTOS,,Ingresa,443.0,,,Desconocido,unknown,UNKNOWN,BUSCAR PRODUCTOS,Ingresa,,,443.00,,,443,443.0,False,original,443.0,443.0,1.0,default_1usd,,,,,,,,{},dataset/txt_limpios/86.txt,dataset/paginas_descargadas/86.html,EN,sin_categoria,discard,0.30,no_category_detected
87,BUSCAR PRODUCTOS,,Ingresa > 1 LT,443.0,,,Desconocido,unknown,UNKNOWN,BUSCAR PRODUCTOS,Ingresa,,1 LT,443.00,,,443,443.0,False,original,443.0,443.0,1.0,default_1usd,,,,,,,,{},dataset/txt_limpios/87.txt,dataset/paginas_descargadas/87.html,EN,sin_categoria,discard,0.30,no_category_detected
88,BUSCAR PRODUCTOS,,Ingresa,443.0,,,Desconocido,unknown,UNKNOWN,BUSCAR PRODUCTOS,Ingresa,,,443.00,,,443,443.0,False,original,443.0,443.0,1.0,default_1usd,,,,,,,,{},dataset/txt_limpios/88.txt,dataset/paginas_descargadas/88.html,EN,sin_categoria,discard,0.30,no_category_detected
89,BUSCAR PRODUCTOS,,Ingresa,443.0,,,Desconocido,unknown,UNKNOWN,BUSCAR PRODUCTOS,Ingresa,,,443.00,,,443,443.0,False,original,443.0,443.0,1.0,default_1usd,,,,,,,,{},dataset/txt_limpios/89.txt,dataset/paginas_descargadas/89.html,EN,sin_categoria,discard,0.30,no_category_detected
90,BUSCAR PRODUCTOS,,Ingresa,443.0,,,Desconocido,unknown,UNKNOWN,BUSCAR PRODUCTOS,Ingresa,,,443.00,,,443,443.0,False,original,443.0,443.0,1.0,default_1usd,,,,,,,,{},dataset/txt_limpios/90.txt,dataset/paginas_descargadas/90.html,EN,sin_categoria,discard,0.30,no_category_detected
91,BUSCAR PRODUCTOS,,Ingresa,443.0,,,Desconocido,unknown,UNKNOWN,BUSCAR PRODUCTOS,Ingresa,,,443.00,,,443,443.0,False,original,443.0,443.0,1.0,default_1usd,,,,,,,,{},dataset/txt_limpios/91.txt,dataset/paginas_descargadas/91.html,EN,sin_categoria,discard,0.30,no_category_detected
92,BUSCAR PRODUCTOS,,Ingresa,443.0,,,Desconocido,unknown,UNKNOWN,BUSCAR PRODUCTOS,Ingresa,,,443.00,,,443,443.0,False,original,443.0,443.0,1.0,default_1usd,,,,,,,,{},dataset/txt_limpios/92.txt,dataset/paginas_descargadas/92.html,EN,sin_categoria,discard,0.30,no_category_detected
93,BUSCAR PRODUCTOS,,Ingresa,443.0,,,Desconocido,unknown,UNKNOWN,BUSCAR PRODUCTOS,Ingresa,,,443.00,,,443,443.0,False,original,443.0,443.0,1.0,default_1usd,,,,,,,,{},dataset/txt_limpios/93.txt,dataset/paginas_descargadas/93.html,EN,sin_categoria,discard,0.30,no_category_detected
94,BUSCAR PRODUCTOS,,Ingresa,443.0,,,Desconocido,unknown,UNKNOWN,BUSCAR PRODUCTOS,Ingresa,,,443.00,,,443,443.0,False,original,443.0,443.0,1.0,default_1usd,,,,,,,,{},dataset/txt_limpios/94.txt,dataset/paginas_descargadas/94.html,EN,sin_categoria,discard,0.30,no_category_detected
95,BUSCAR PRODUCTOS,,Ingresa,443.0,,,Desconocido,unknown,UNKNOWN,BUSCAR PRODUCTOS,Ingresa,,,443.00,,,443,443.0,False,original,443.0,443.0,1.0,default_1usd,,,,,,,,{},dataset/txt_limpios/95.txt,dataset/paginas_descargadas/95.html,EN,sin_categoria,discard,0.30,no_category_detected
96,BUSCAR PRODUCTOS,,Ingresa,443.0,,,Desconocido,unknown,UNKNOWN,BUSCAR PRODUCTOS,Ingresa,,,443.00,,,443,443.0,False,original,443.0,443.0,1.0,default_1usd,,,,,,,,{},dataset/txt_limpios/96.txt,dataset/paginas_descargadas/96.html,EN,sin_categoria,discard,0.30,no_category_detected
97,BUSCAR PRODUCTOS,,Ingresa > 100.00 ml,443.0,,,Desconocido,unknown,UNKNOWN,BUSCAR PRODUCTOS,Ingresa,,100.00 ml,443.00,,,443,443.0,False,original,443.0,443.0,1.0,default_1usd,,,,,,,,{},dataset/txt_limpios/97.txt,dataset/paginas_descargadas/97.html,EN,sin_categoria,discard,0.30,no_category_detected
98,BUSCAR PRODUCTOS,Huevo fresco de granja | x | Promociones | Cerrar | Más información,Ingresa > 30 piezas,443.0,,,Desconocido,unknown,UNKNOWN,BUSCAR PRODUCTOS,Ingresa,,30 piezas,443.00,,,443,443.0,False,original,443.0,443.0,1.0,default_1usd,,,,,Huevo fresco de granja | x | Promociones | Cerrar | Más información,,,"{""Beneficios"": [""Huevo fresco de granja"", ""x"", ""Promociones"", ""Cerrar"", ""Más información""]}",dataset/txt_limpios/98.txt,dataset/paginas_descargadas/98.html,EN,huevo,discard,0.30,heuristic_default
99,BUSCAR PRODUCTOS,,Ingresa > 100.00 g,443.0,,,Desconocido,unknown,UNKNOWN,BUSCAR PRODUCTOS,Ingresa,,100.00 g,443.00,,,443,443.0,False,original,443.0,443.0,1.0,default_1usd,,,,,,,,{},dataset/txt_limpios/99.txt,dataset/paginas_descargadas/99.html,EN,sin_categoria,discard,0.30,no_category_detected
23,Cafe y te,"Café Nescafé Clásico Nescafé Clásico en sus distintas variedades es el café soluble que ha invitado a varias generaciones de mexicanos a disfrutar a pleno de cada día y vivir la rutina al máximo desde el momento mismo del desayuno Esta variedad se elabora con granos de café robusta y arábica cuidadosamente seleccionados que, gracias a un proceso especial de secado, dan por resultado un café 100% soluble y de origen natural, con un aroma y sabor incomparables.",Café Nescafé Clásico 300g > 300g > 3822396,,MXN,,Chedraui,unknown,MX,Cafe y te,Café Nescafé Clásico 300g,3822396.0,300g,,MXN,,,114.48,True,category_country_mean,,6.1484,18.62,from_mexico_cambio_dolar,Café Nescafé Clásico,,,"Nescafé Clásico en sus distintas variedades es el café soluble que ha invitado a varias generaciones de mexicanos a disfrutar a pleno de cada día y vivir la rutina al máximo desde el momento mismo del desayuno Esta variedad se elabora con granos de café robusta y arábica cuidadosamente seleccionados que, gracias a un proceso especial de secado, dan por resultado un café 100% soluble y de origen natural, con un aroma y sabor incomparables.",,,,"{""Información"": [""Café Nescafé Clásico""], ""Especificaciones"": [""Nescafé Clásico en sus distintas variedades es el café soluble que ha invitado a varias generaciones de mexicanos a disfrutar a pleno de cada día y vivir la rutina al máximo desde el momento mismo del desayuno Esta variedad se elabora con granos de café robusta y arábica cuidadosamente seleccionados que, gracias a un proceso especial de secado, dan por resultado un café 100% soluble y de origen natural, con un aroma y sabor incomparables.""]}",dataset/txt_limpios/23.txt,dataset/paginas_descargadas/23.html,EN,cafe,discard,0.60,price_parse_failed;price<=0
24,Cafe y te,"Prepara tu despensa en unos cuantos clics y descubre nuestra gran variedad de productos. ¡En la sala de casa, te llevamos el súper!",Legal > 180 g > 3278434,88.0,MXN,,Chedraui,unknown,MX,Cafe y te,Legal,3278434.0,180 g,88.00,MXN,$,$88.00,88.0,False,original,4.7261,4.7261,18.62,from_mexico_cambio_dolar,,,"Soluble | Kosher | De grano, origen puro y natural","Prepara tu despensa en unos cuantos clics y descubre nuestra gran variedad de productos. ¡En la sala de casa, te llevamos el súper!",,,,"{""Características"": [""Soluble"", ""Kosher"", ""De grano, origen puro y natural""], ""Especificaciones"": [""Prepara tu despensa en unos cuantos clics y descubre nuestra gran variedad de productos. ¡En la sala de casa, te llevamos el súper!""]}",dataset/txt_limpios/24.txt,dataset/paginas_descargadas/24.html,ET,cafe,keep,0.60,heuristic_default
