source_id,title,description,breadcrumbs,price_raw,currency_raw,url,seller,availability,country,product_name,brand,reference,unit,price_amount,price_currency,price_symbol,price_text,price_amount_filled,price_is_imputed,price_imputation_source,price_amount_usd,price_amount_usd_filled,fx_rate_local_per_usd,fx_source,information_text,description_text,features_text,specifications_text,benefits_text,details_text,other_sections,sections,txt_path,html_path,es_status,category_canonical,decision,match_score,reasons
915,"Lácteos, refrigerados y huevos",,Leches líquidos > 1 Litro,970.0,,,Desconocido,unknown,UNKNOWN,"Lácteos, refrigerados y huevos",Leches líquidas,,1 Litro,970.00,,$,$970,970.0,False,original,970.0,970.0,1.0,default_1usd,,,,,,,,{},dataset/txt_limpios/915.txt,dataset/paginas_descargadas/915.html,ET,leche,keep,0.60,heuristic_default
297,Macarrão Italiano Spaghetti La Campofilone 500 G,,Descripción > 500 G,15.99,BRL,,Desconocido,unknown,BR,Macarrão Italiano Spaghetti La Campofilone 500 G,Descripción,,500 G,15.99,BRL,R$,"R$15,99",15.99,False,original,2.935,2.935,5.448,from_brasil_cambio_dolar,,,,,,,,{},dataset/txt_limpios/297.txt,dataset/paginas_descargadas/297.html,ET,pasta seca,keep,0.60,heuristic_default
298,Massa Italiana Integral Spaghetti La Molisana 500 G,,Descripción > 500 G,15.99,BRL,,Desconocido,unknown,BR,Massa Italiana Integral Spaghetti La Molisana 500 G,Descripción,,500 G,15.99,BRL,R$,"R$15,99",15.99,False,original,2.935,2.935,5.448,from_brasil_cambio_dolar,,,,,,,,{},dataset/txt_limpios/298.txt,dataset/paginas_descargadas/298.html,ET,sin_categoria,discard,0.30,no_category_detected
1554,Massas e Molhos,,Massas Grano Duro > 500g,69.98,BRL,,Desconocido,unknown,BR,Massas e Molhos,Massas Grano Duro,,500g,69.98,BRL,R$,"R$69,98",69.98,False,original,12.8451,12.8451,5.448,from_brasil_cambio_dolar,,,,,,,,{},dataset/txt_limpios/1554.txt,dataset/paginas_descargadas/1554.html,EN,sin_categoria,discard,0.30,no_category_detected
1556,Massas e Molhos,,de > 500g,3.89,BRL,,Desconocido,unknown,BR,Massas e Molhos,de,,500g,3.89,BRL,R$,"R$3,89",3.89,False,original,0.714,0.714,5.448,from_brasil_cambio_dolar,,,,,,,,{},dataset/txt_limpios/1556.txt,dataset/paginas_descargadas/1556.html,EN,sin_categoria,discard,0.30,no_category_detected
1557,Massas e Molhos,,Descripción del producto > 500g,,,,Desconocido,unknown,UNKNOWN,Massas e Molhos,Descripción del producto,,500g,,,,,234.19,True,country_mean,,234.1938,1.0,default_1usd,,,,,,,,{},dataset/txt_limpios/1557.txt,dataset/paginas_descargadas/1557.html,ET,sin_categoria,discard,0.30,no_category_detected;price_parse_failed
1561,Massas e Molhos,,Macarrón,2.0,,,Desconocido,unknown,UNKNOWN,Massas e Molhos,Macarrón,,,2.00,,s,s2,2.0,False,original,2.0,2.0,1.0,default_1usd,,,,,,,,{},dataset/txt_limpios/1561.txt,dataset/paginas_descargadas/1561.html,ET,sin_categoria,discard,0.30,no_category_detected
200,Massas e Molhos,,Massas Grano Duro > 500g,49.89,BRL,,Desconocido,unknown,BR,Massas e Molhos,Massas Grano Duro,,500g,49.89,BRL,R$,"R$49,89",49.89,False,original,9.1575,9.1575,5.448,from_brasil_cambio_dolar,,,,,,,,{},dataset/txt_limpios/200.txt,dataset/paginas_descargadas/200.html,EN,sin_categoria,discard,0.30,no_category_detected
201,Massas e Molhos,,"R$ 4,99 > 500g",4.99,BRL,,Desconocido,unknown,BR,Massas e Molhos,"R$ 4,99",,500g,4.99,BRL,R$,"R$4,99",4.99,False,original,0.9159,0.9159,5.448,from_brasil_cambio_dolar,,,,,,,,{},dataset/txt_limpios/201.txt,dataset/paginas_descargadas/201.html,EN,sin_categoria,discard,0.30,no_category_detected
202,Massas e Molhos,,fideos > 500g,,,,Desconocido,unknown,UNKNOWN,Massas e Molhos,fideos,,500g,,,,,234.19,True,country_mean,,234.1938,1.0,default_1usd,,,,,,,,{},dataset/txt_limpios/202.txt,dataset/paginas_descargadas/202.html,ET,sin_categoria,discard,0.30,no_category_detected;price_parse_failed
204,Massas e Molhos,,Macarrón,12.19,BRL,,Desconocido,unknown,BR,Massas e Molhos,Macarrón,,,12.19,BRL,R$,"R$12,19",12.19,False,original,2.2375,2.2375,5.448,from_brasil_cambio_dolar,,,,,,,,{},dataset/txt_limpios/204.txt,dataset/paginas_descargadas/204.html,ET,sin_categoria,discard,0.30,no_category_detected
1569,Meu Desconto,,Blog Pão > 1kg,7.49,BRL,,Desconocido,unknown,BR,Meu Desconto,Blog do Pão,,1kg,7.49,BRL,R$,"R$7,49",7.49,False,original,1.3748,1.3748,5.448,from_brasil_cambio_dolar,,,,,,,,{},dataset/txt_limpios/1569.txt,dataset/paginas_descargadas/1569.html,ET,pan,keep,0.60,heuristic_default
1571,Meu Desconto,,Blog Pão > 1kg,6.99,BRL,,Desconocido,unknown,BR,Meu Desconto,Blog do Pão,,1kg,6.99,BRL,R$,"R$6,99",6.99,False,original,1.283,1.283,5.448,from_brasil_cambio_dolar,,,,,,,,{},dataset/txt_limpios/1571.txt,dataset/paginas_descargadas/1571.html,ET,pan,keep,0.60,heuristic_default
1573,Meu Desconto,,Blog Pão > 5kg,23.99,BRL,,Desconocido,unknown,BR,Meu Desconto,Blog do Pão,,5kg,23.99,BRL,R$,"R$23,99",23.99,False,original,4.4035,4.4035,5.448,from_brasil_cambio_dolar,,,,,,,,{},dataset/txt_limpios/1573.txt,dataset/paginas_descargadas/1573.html,ET,pan,keep,0.60,heuristic_default
1575,Meu Desconto,,Blog Pão > 1kg,50.0,,,Desconocido,unknown,UNKNOWN,Meu Desconto,Blog do Pão,,1kg,50.00,,,50,50.0,False,original,50.0,50.0,1.0,default_1usd,,,,,,,,{},dataset/txt_limpios/1575.txt,dataset/paginas_descargadas/1575.html,ET,pan,keep,0.60,heuristic_default
1577,Meu Desconto,,Blog Pão > 5kg,1.0,,,Desconocido,unknown,UNKNOWN,Meu Desconto,Blog do Pão,,5kg,1.00,,,1,1.0,False,original,1.0,1.0,1.0,default_1usd,,,,,,,,{},dataset/txt_limpios/1577.txt,dataset/paginas_descargadas/1577.html,ET,pan,keep,0.60,heuristic_default
1580,Meu Desconto,,Blog Pão > 500g,31.99,BRL,,Desconocido,unknown,BR,Meu Desconto,Blog do Pão,,500g,31.99,BRL,R$,"R$31,99",31.99,False,original,5.8719,5.8719,5.448,from_brasil_cambio_dolar,,,,,,,,{},dataset/txt_limpios/1580.txt,dataset/paginas_descargadas/1580.html,ET,pan,keep,0.60,heuristic_default
1582,Meu Desconto,,Blog Pão > 500g,39.99,BRL,,Desconocido,unknown,BR,Meu Desconto,Blog do Pão,,500g,39.99,BRL,R$,"R$39,99",39.99,False,original,7.3403,7.3403,5.448,from_brasil_cambio_dolar,,,,,,,,{},dataset/txt_limpios/1582.txt,dataset/paginas_descargadas/1582.html,ET,pan,keep,0.60,heuristic_default
1584,Meu Desconto,,Blog Pão > 500g,39.99,BRL,,Desconocido,unknown,BR,Meu Desconto,Blog do Pão,,500g,39.99,BRL,R$,"R$39,99",39.99,False,original,7.3403,7.3403,5.448,from_brasil_cambio_dolar,,,,,,,,{},dataset/txt_limpios/1584.txt,dataset/paginas_descargadas/1584.html,ET,pan,keep,0.60,heuristic_default
1586,Meu Desconto,,Blog Pão > 500g,39.99,BRL,,Desconocido,unknown,BR,Meu Desconto,Blog do Pão,,500g,39.99,BRL,R$,"R$39,99",39.99,False,original,7.3403,7.3403,5.448,from_brasil_cambio_dolar,,,,,,,,{},dataset/txt_limpios/1586.txt,dataset/paginas_descargadas/1586.html,ET,pan,keep,0.60,heuristic_default
1587,Meu Desconto,,Blog Pão > 250g,27.99,BRL,,Desconocido,unknown,BR,Meu Desconto,Blog do Pão,,250g,27.99,BRL,R$,"R$27,99",27.99,False,original,5.1377,5.1377,5.448,from_brasil_cambio_dolar,,,,,,,,{},dataset/txt_limpios/1587.txt,dataset/paginas_descargadas/1587.html,ET,pan,keep,0.60,heuristic_default
1589,Meu Desconto,,Blog Pão > 480g,9.99,BRL,,Desconocido,unknown,BR,Meu Desconto,Blog do Pão,,480g,9.99,BRL,R$,"R$9,99",9.99,False,original,1.8337,1.8337,5.448,from_brasil_cambio_dolar,,,,,,,,{},dataset/txt_limpios/1589.txt,dataset/paginas_descargadas/1589.html,ET,pan,keep,0.60,heuristic_default
1591,Meu Desconto,,Blog Pão > 500g,9.99,BRL,,Desconocido,unknown,BR,Meu Desconto,Blog do Pão,,500g,9.99,BRL,R$,"R$9,99",9.99,False,original,1.8337,1.8337,5.448,from_brasil_cambio_dolar,,,,,,,,{},dataset/txt_limpios/1591.txt,dataset/paginas_descargadas/1591.html,ET,pan,keep,0.60,heuristic_default
1593,Meu Desconto,,Blog Pão > 450g,8.59,BRL,,Desconocido,unknown,BR,Meu Desconto,Blog do Pão,,450g,8.59,BRL,R$,"R$8,59",8.59,False,original,1.5767,1.5767,5.448,from_brasil_cambio_dolar,,,,,,,,{},dataset/txt_limpios/1593.txt,dataset/paginas_descargadas/1593.html,ET,pan,keep,0.60,heuristic_default
1595,Meu Desconto,,Blog Pão > 500g,14.29,BRL,,Desconocido,unknown,BR,Meu Desconto,Blog do Pão,,500g,14.29,BRL,R$,"R$14,29",14.29,False,original,2.623,2.623,5.448,from_brasil_cambio_dolar,,,,,,,,{},dataset/txt_limpios/1595.txt,dataset/paginas_descargadas/1595.html,ET,pan,keep,0.60,heuristic_default
1597,Meu Desconto,,Blog Pão > 400g,400.0,,,Desconocido,unknown,UNKNOWN,Meu Desconto,Blog do Pão,,400g,400.00,,,400,400.0,False,original,400.0,400.0,1.0,default_1usd,,,,,,,,{},dataset/txt_limpios/1597.txt,dataset/paginas_descargadas/1597.html,ET,pan,keep,0.60,heuristic_default
1599,Meu Desconto,,"Blog Pão > 1,5l",10.99,BRL,,Desconocido,unknown,BR,Meu Desconto,Blog do Pão,,"1,5l",10.99,BRL,R$,"R$10,99",10.99,False,original,2.0173,2.0173,5.448,from_brasil_cambio_dolar,,,,,,,,{},dataset/txt_limpios/1599.txt,dataset/paginas_descargadas/1599.html,ET,pan,keep,0.60,heuristic_default
1601,Meu Desconto,,Blog Pão > 600ml,4.49,BRL,,Desconocido,unknown,BR,Meu Desconto,Blog do Pão,,600ml,4.49,BRL,R$,"R$4,49",4.49,False,original,0.8242,0.8242,5.448,from_brasil_cambio_dolar,,,,,,,,{},dataset/txt_limpios/1601.txt,dataset/paginas_descargadas/1601.html,ET,pan,keep,0.60,heuristic_default
1603,Meu Desconto,,"Blog Pão > 1,5l",8.59,BRL,,Desconocido,unknown,BR,Meu Desconto,Blog do Pão,,"1,5l",8.59,BRL,R$,"R$8,59",8.59,False,original,1.5767,1.5767,5.448,from_brasil_cambio_dolar,,,,,,,,{},dataset/txt_limpios/1603.txt,dataset/paginas_descargadas/1603.html,ET,pan,keep,0.60,heuristic_default
1604,Meu Desconto,,"Blog Pão > 1,5l",8.59,BRL,,Desconocido,unknown,BR,Meu Desconto,Blog do Pão,,"1,5l",8.59,BRL,R$,"R$8,59",8.59,False,original,1.5767,1.5767,5.448,from_brasil_cambio_dolar,,,,,,,,{},dataset/txt_limpios/1604.txt,dataset/paginas_descargadas/1604.html,ET,pan,keep,0.60,heuristic_default
1607,Meu Desconto,,"Blog Pão > 1,5 Litros",7.89,BRL,,Desconocido,unknown,BR,Meu Desconto,Blog do Pão,,"1,5 Litros",7.89,BRL,R$,"R$7,89",7.89,False,original,1.4482,1.4482,5.448,from_brasil_cambio_dolar,,,,,,,,{},dataset/txt_limpios/1607.txt,dataset/paginas_descargadas/1607.html,ET,pan,keep,0.60,heuristic_default
1609,Meu Desconto,,Blog Pão > 500g,5.39,BRL,,Desconocido,unknown,BR,Meu Desconto,Blog do Pão,,500g,5.39,BRL,R$,"R$5,39",5.39,False,original,0.9894,0.9894,5.448,from_brasil_cambio_dolar,,,,,,,,{},dataset/txt_limpios/1609.txt,dataset/paginas_descargadas/1609.html,ET,pan,keep,0.60,heuristic_default
1611,Meu Desconto,,Blog Pão > 500g,4.29,BRL,,Desconocido,unknown,BR,Meu Desconto,Blog do Pão,,500g,4.29,BRL,R$,"R$4,29",4.29,False,original,0.7874,0.7874,5.448,from_brasil_cambio_dolar,,,,,,,,{},dataset/txt_limpios/1611.txt,dataset/paginas_descargadas/1611.html,ET,pan,keep,0.60,heuristic_default
1613,Meu Desconto,,Blog Pão > 500g,4.49,BRL,,Desconocido,unknown,BR,Meu Desconto,Blog do Pão,,500g,4.49,BRL,R$,"R$4,49",4.49,False,original,0.8242,0.8242,5.448,from_brasil_cambio_dolar,,,,,,,,{},dataset/txt_limpios/1613.txt,dataset/paginas_descargadas/1613.html,ET,pan,keep,0.60,heuristic_default
1615,Meu Desconto,,Blog Pão > 500g,4.49,BRL,,Desconocido,unknown,BR,Meu Desconto,Blog do Pão,,500g,4.49,BRL,R$,"R$4,49",4.49,False,original,0.8242,0.8242,5.448,from_brasil_cambio_dolar,,,,,,,,{},dataset/txt_limpios/1615.txt,dataset/paginas_descargadas/1615.html,ET,pan,keep,0.60,heuristic_default
1620,Meu Desconto,,Blog Pão > 500g,4.89,BRL,,Desconocido,unknown,BR,Meu Desconto,Blog do Pão,,500g,4.89,BRL,R$,"R$4,89",4.89,False,original,0.8976,0.8976,5.448,from_brasil_cambio_dolar,,,,,,,,{},dataset/txt_limpios/1620.txt,dataset/paginas_descargadas/1620.html,ET,pan,keep,0.60,heuristic_default
1623,Meu Desconto,,Blog Pão > 1L,7.99,BRL,,Desconocido,unknown,BR,Meu Desconto,Blog do Pão,,1L,7.99,BRL,R$,"R$7,99",7.99,False,original,1.4666,1.4666,5.448,from_brasil_cambio_dolar,,,,,,,,{},dataset/txt_limpios/1623.txt,dataset/paginas_descargadas/1623.html,ET,pan,keep,0.60,heuristic_default
1624,Meu Desconto,,Blog Pão > 1 Litro,1.0,,,Desconocido,unknown,UNKNOWN,Meu Desconto,Blog do Pão,,1 Litro,1.00,,,1,1.0,False,original,1.0,1.0,1.0,default_1usd,,,,,,,,{},dataset/txt_limpios/1624.txt,dataset/paginas_descargadas/1624.html,ET,pan,keep,0.60,heuristic_default
1627,Meu Desconto,,Blog Pão > 1 Litro,5.99,BRL,,Desconocido,unknown,BR,Meu Desconto,Blog do Pão,,1 Litro,5.99,BRL,R$,"R$5,99",5.99,False,original,1.0995,1.0995,5.448,from_brasil_cambio_dolar,,,,,,,,{},dataset/txt_limpios/1627.txt,dataset/paginas_descargadas/1627.html,ET,pan,keep,0.60,heuristic_default
1633,Meu Desconto,,Blog Pão > 1 Litro,18.0,,,Desconocido,unknown,UNKNOWN,Meu Desconto,Blog do Pão,,1 Litro,18.00,,,18,18.0,False,original,18.0,18.0,1.0,default_1usd,,,,,,,,{},dataset/txt_limpios/1633.txt,dataset/paginas_descargadas/1633.html,ET,pan,keep,0.60,heuristic_default
1634,Meu Desconto,,Blog Pão > 1L,7.99,BRL,,Desconocido,unknown,BR,Meu Desconto,Blog do Pão,,1L,7.99,BRL,R$,"R$7,99",7.99,False,original,1.4666,1.4666,5.448,from_brasil_cambio_dolar,,,,,,,,{},dataset/txt_limpios/1634.txt,dataset/paginas_descargadas/1634.html,ET,pan,keep,0.60,heuristic_default
1637,Meu Desconto,,Blog Pão > 330ml,6.59,BRL,,Desconocido,unknown,BR,Meu Desconto,Blog do Pão,,330ml,6.59,BRL,R$,"R$6,59",6.59,False,original,1.2096,1.2096,5.448,from_brasil_cambio_dolar,,,"Características gustativas | Frutado,Condimentada,Boa formación,persistente. | Cervezas del estilo American Lager son ligeros en color y cuerpo, tienen bajo amargor y suelen ser neutrales, refrescantes y bien carbonatadas. El sabor es sutil (es decir, ningún ingrediente puede dominar los demás). Hay un dulzor residual de malta y adjuntos y otras fuentes de azúcar pueden utilizarse. | Descargue la app | Institucional | Quienes somos | Trabaja Conosco | Política de privacidad y Términos de Uso | Términos Buscados | Heineken | Vinos | Fraldas | Mapa del sitio | Mapa de productos | Mapa de tiendas | Central de Atención | 0800 779 6761 | Mis Solicitudes | Encuentra una Tienda | Formas de Pago | Intercambios y descartes | Preguntas frecuentes | TripAdvisor Nuestros canales | Facebook | instagram | YouTube | Twitter | Estoy consciente",,,,,"{""Características"": [""Características gustativas"", ""Frutado,Condimentada,Boa formación,persistente."", ""Las cervezas del estilo American Lager son ligeras en color y cuerpo, tienen bajo amargor y suelen ser neutrales, refrescantes y bien carbonatadas. El sabor es sutil (es decir, ningún ingrediente puede dominar los demás). Hay un dulzor residual de malta y adjuntos y otras fuentes de azúcar pueden utilizarse."", ""baixe o app"", ""Institucional"", ""Quem somos"", ""Trabalhe Conosco"", ""Política de privacidad y Términos de uso"", ""Termos Buscados"", ""Heineken"", ""Vinhos"", ""Fraldas"", ""Mapa do site"", ""Mapa de productos"", ""Mapa de tiendas"", ""Central de Atendimento"", ""0800 779 6761"", ""Meus Pedidos"", ""Encuentra una tienda"", ""Formas de Pagamento"", ""Intercambios y descartes"", ""Preguntas frecuentes"", ""Nossos canais"", ""facebook"", ""instagram"", ""youtube"", ""twitter"", ""Estou ciente""]}",dataset/txt_limpios/1637.txt,dataset/paginas_descargadas/1637.html,ET,pan,keep,0.60,heuristic_default
1639,Meu Desconto,,Blog Pão > 350ml,5.29,BRL,,Desconocido,unknown,BR,Meu Desconto,Blog do Pão,,350ml,5.29,BRL,R$,"R$5,29",5.29,False,original,0.971,0.971,5.448,from_brasil_cambio_dolar,,,,,,,,{},dataset/txt_limpios/1639.txt,dataset/paginas_descargadas/1639.html,ET,pan,keep,0.60,heuristic_default
1643,Meu Desconto,,Blog Pão > 269ml,2.99,BRL,,Desconocido,unknown,BR,Meu Desconto,Blog do Pão,,269ml,2.99,BRL,R$,"R$2,99",2.99,False,original,0.5488,0.5488,5.448,from_brasil_cambio_dolar,,,,,,,,{},dataset/txt_limpios/1643.txt,dataset/paginas_descargadas/1643.html,ET,pan,keep,0.60,heuristic_default
230,Meu Desconto,,Minha Lista > 1kg,7.69,BRL,,Desconocido,unknown,BR,Meu Desconto,Minha Lista,,1kg,7.69,BRL,R$,"R$7,69",7.69,False,original,1.4115,1.4115,5.448,from_brasil_cambio_dolar,,,,,,,,{},dataset/txt_limpios/230.txt,dataset/paginas_descargadas/230.html,EN,sin_categoria,discard,0.30,no_category_detected
231,Meu Desconto,,Minha Lista > 1kg,6.59,BRL,,Desconocido,unknown,BR,Meu Desconto,Minha Lista,,1kg,6.59,BRL,R$,"R$6,59",6.59,False,original,1.2096,1.2096,5.448,from_brasil_cambio_dolar,,,,,,,,{},dataset/txt_limpios/231.txt,dataset/paginas_descargadas/231.html,EN,sin_categoria,discard,0.30,no_category_detected
232,Meu Desconto,,Minha Lista > 5kg,20.99,BRL,,Desconocido,unknown,BR,Meu Desconto,Minha Lista,,5kg,20.99,BRL,R$,"R$20,99",20.99,False,original,3.8528,3.8528,5.448,from_brasil_cambio_dolar,,,,,,,,{},dataset/txt_limpios/232.txt,dataset/paginas_descargadas/232.html,EN,sin_categoria,discard,0.30,no_category_detected
233,Meu Desconto,,Minha Lista > 1kg,18.99,BRL,,Desconocido,unknown,BR,Meu Desconto,Minha Lista,,1kg,18.99,BRL,R$,"R$18,99",18.99,False,original,3.4857,3.4857,5.448,from_brasil_cambio_dolar,,,,,,,,{},dataset/txt_limpios/233.txt,dataset/paginas_descargadas/233.html,EN,sin_categoria,discard,0.30,no_category_detected
234,Meu Desconto,,Minha Lista > 5kg,1.0,,,Desconocido,unknown,UNKNOWN,Meu Desconto,Minha Lista,,5kg,1.00,,,1,1.0,False,original,1.0,1.0,1.0,default_1usd,,,,,,,,{},dataset/txt_limpios/234.txt,dataset/paginas_descargadas/234.html,EN,sin_categoria,discard,0.30,no_category_detected
235,Meu Desconto,,Minha Lista > 500g,34.99,BRL,,Desconocido,unknown,BR,Meu Desconto,Minha Lista,,500g,34.99,BRL,R$,"R$34,99",34.99,False,original,6.4225,6.4225,5.448,from_brasil_cambio_dolar,,,,,,,,{},dataset/txt_limpios/235.txt,dataset/paginas_descargadas/235.html,EN,sin_categoria,discard,0.30,no_category_detected
236,Meu Desconto,,Minha Lista > 500g,41.49,BRL,,Desconocido,unknown,BR,Meu Desconto,Minha Lista,,500g,41.49,BRL,R$,"R$41,49",41.49,False,original,7.6156,7.6156,5.448,from_brasil_cambio_dolar,,,,,,,,{},dataset/txt_limpios/236.txt,dataset/paginas_descargadas/236.html,EN,sin_categoria,discard,0.30,no_category_detected
237,Meu Desconto,,Minha Lista > 500g,46.49,BRL,,Desconocido,unknown,BR,Meu Desconto,Minha Lista,,500g,46.49,BRL,R$,"R$46,49",46.49,False,original,8.5334,8.5334,5.448,from_brasil_cambio_dolar,,,,,,,,{},dataset/txt_limpios/237.txt,dataset/paginas_descargadas/237.html,EN,sin_categoria,discard,0.30,no_category_detected
238,Meu Desconto,,Minha Lista > 500g,38.99,BRL,,Desconocido,unknown,BR,Meu Desconto,Minha Lista,,500g,38.99,BRL,R$,"R$38,99",38.99,False,original,7.1568,7.1568,5.448,from_brasil_cambio_dolar,,,,,,,,{},dataset/txt_limpios/238.txt,dataset/paginas_descargadas/238.html,EN,sin_categoria,discard,0.30,no_category_detected
239,Meu Desconto,,Minha Lista > 250g,26.99,BRL,,Desconocido,unknown,BR,Meu Desconto,Minha Lista,,250g,26.99,BRL,R$,"R$26,99",26.99,False,original,4.9541,4.9541,5.448,from_brasil_cambio_dolar,,,,,,,,{},dataset/txt_limpios/239.txt,dataset/paginas_descargadas/239.html,EN,sin_categoria,discard,0.30,no_category_detected
240,Meu Desconto,,Minha Lista > 480g,10.29,BRL,,Desconocido,unknown,BR,Meu Desconto,Minha Lista,,480g,10.29,BRL,R$,"R$10,29",10.29,False,original,1.8888,1.8888,5.448,from_brasil_cambio_dolar,,,,,,,,{},dataset/txt_limpios/240.txt,dataset/paginas_descargadas/240.html,EN,sin_categoria,discard,0.30,no_category_detected
241,Meu Desconto,,Minha Lista > 500g,11.49,BRL,,Desconocido,unknown,BR,Meu Desconto,Minha Lista,,500g,11.49,BRL,R$,"R$11,49",11.49,False,original,2.109,2.109,5.448,from_brasil_cambio_dolar,,,,,,,,{},dataset/txt_limpios/241.txt,dataset/paginas_descargadas/241.html,EN,sin_categoria,discard,0.30,no_category_detected
242,Meu Desconto,,Minha Lista > 450g,7.19,BRL,,Desconocido,unknown,BR,Meu Desconto,Minha Lista,,450g,7.19,BRL,R$,"R$7,19",7.19,False,original,1.3198,1.3198,5.448,from_brasil_cambio_dolar,,,,,,,,{},dataset/txt_limpios/242.txt,dataset/paginas_descargadas/242.html,EN,sin_categoria,discard,0.30,no_category_detected
243,Meu Desconto,,Minha Lista > 500g,15.29,BRL,,Desconocido,unknown,BR,Meu Desconto,Minha Lista,,500g,15.29,BRL,R$,"R$15,29",15.29,False,original,2.8065,2.8065,5.448,from_brasil_cambio_dolar,,,,,,,,{},dataset/txt_limpios/243.txt,dataset/paginas_descargadas/243.html,EN,sin_categoria,discard,0.30,no_category_detected
244,Meu Desconto,,Minha Lista > 400g,400.0,,,Desconocido,unknown,UNKNOWN,Meu Desconto,Minha Lista,,400g,400.00,,,400,400.0,False,original,400.0,400.0,1.0,default_1usd,,,,,,,,{},dataset/txt_limpios/244.txt,dataset/paginas_descargadas/244.html,EN,sin_categoria,discard,0.30,no_category_detected
245,Meu Desconto,,"Minha Lista > 1,5l",8.49,BRL,,Desconocido,unknown,BR,Meu Desconto,Minha Lista,,"1,5l",8.49,BRL,R$,"R$8,49",8.49,False,original,1.5584,1.5584,5.448,from_brasil_cambio_dolar,,,,,,,,{},dataset/txt_limpios/245.txt,dataset/paginas_descargadas/245.html,EN,sin_categoria,discard,0.30,no_category_detected
246,Meu Desconto,,Minha Lista > 600ml,5.39,BRL,,Desconocido,unknown,BR,Meu Desconto,Minha Lista,,600ml,5.39,BRL,R$,"R$5,39",5.39,False,original,0.9894,0.9894,5.448,from_brasil_cambio_dolar,,,,,,,,{},dataset/txt_limpios/246.txt,dataset/paginas_descargadas/246.html,EN,sin_categoria,discard,0.30,no_category_detected
247,Meu Desconto,,"Minha Lista > 1,5l",8.99,BRL,,Desconocido,unknown,BR,Meu Desconto,Minha Lista,,"1,5l",8.99,BRL,R$,"R$8,99",8.99,False,original,1.6501,1.6501,5.448,from_brasil_cambio_dolar,,,,,,,,{},dataset/txt_limpios/247.txt,dataset/paginas_descargadas/247.html,EN,sin_categoria,discard,0.30,no_category_detected
248,Meu Desconto,,"Minha Lista > 1,5l",8.99,BRL,,Desconocido,unknown,BR,Meu Desconto,Minha Lista,,"1,5l",8.99,BRL,R$,"R$8,99",8.99,False,original,1.6501,1.6501,5.448,from_brasil_cambio_dolar,,,,,,,,{},dataset/txt_limpios/248.txt,dataset/paginas_descargadas/248.html,EN,sin_categoria,discard,0.30,no_category_detected
249,Meu Desconto,,"Minha Lista > 1,5l",7.29,BRL,,Desconocido,unknown,BR,Meu Desconto,Minha Lista,,"1,5l",7.29,BRL,R$,"R$7,29",7.29,False,original,1.3381,1.3381,5.448,from_brasil_cambio_dolar,,,,,,,,{},dataset/txt_limpios/249.txt,dataset/paginas_descargadas/249.html,EN,sin_categoria,discard,0.30,no_category_detected
