{"source_id": "1709", "title": "Elige un método de entrega", "description": "Los huevos la granja son de gallinas Libre de Jaula o ?Cage Free? las gallinas viven en galpones 100% libres de jaulas, donde pueden desarrollar comportamientos naturales como perchar, anidar, aletear y socializar con otras gallinas, en un ambiente seguro y protegido.", "breadcrumbs": "Unimarc > 12 unidad", "price_raw": "5.19", "currency_raw": "", "url": "", "seller": "Desconocido", "availability": "unknown", "country": "UNKNOWN", "product_name": "Elige un método de entrega", "brand": "Unimarc", "reference": "", "unit": "12 unidad", "price_amount": 5.19, "price_currency": "", "price_symbol": "$", "price_text": "$5.19", "price_amount_filled": "5.19", "price_is_imputed": "False", "price_imputation_source": "original", "price_amount_usd": "5.19", "price_amount_usd_filled": "5.19", "fx_rate_local_per_usd": "1.0", "fx_source": "default_1usd", "information_text": "", "description_text": "Los huevos la granja son de gallinas Libre de Jaula o ?Cage Free? las gallinas viven en galpones 100% libres de jaulas, donde pueden desarrollar comportamientos naturales como perchar, anidar, aletear y socializar con otras gallinas, en un ambiente seguro y protegido.", "features_text": "Huevos gallina - La Granja - Gallina normal - Tipo color - Contenido 12 unidades. | Loading...", "specifications_text": "", "benefits_text": "", "details_text": "", "other_sections": "", "sections": {"Descripción": ["Los huevos la granja son de gallinas Libre de Jaula o ?Cage Free? las gallinas viven en galpones 100% libres de jaulas, donde pueden desarrollar comportamientos naturales como perchar, anidar, aletear y socializar con otras gallinas, en un ambiente seguro y protegido."], "Características": ["Huevos gallina - La Granja - Gallina normal - Tipo color - Contenido 12 unidades.", "Loading..."]}, "txt_path": "dataset/txt_limpios/1709.txt", "html_path": "dataset/paginas_descargadas/1709.html", "es_status": "EN", "category_canonical": "huevo", "decision": "discard", "match_score": 0.3, "reasons": "heuristic_default"}
{"source_id": "1711", "title": "Elige un método de entrega", "description": "Loading...", "breadcrumbs": "Unimarc > 1 L", "price_raw": "1.25", "currency_raw": "", "url": "", "seller": "Desconocido", "availability": "unknown", "country": "UNKNOWN", "product_name": "Elige un método de entrega", "brand": "Unimarc", "reference": "", "unit": "1 L", "price_amount": 1.25, "price_currency": "", "price_symbol": "$", "price_text": "$1.25", "price_amount_filled": "1.25", "price_is_imputed": "False", "price_imputation_source": "original", "price_amount_usd": "1.25", "price_amount_usd_filled": "1.25", "fx_rate_local_per_usd": "1.0", "fx_source": "default_1usd", "information_text": "", "description_text": "Loading...", "features_text": "", "specifications_text": "", "benefits_text": "", "details_text": "", "other_sections": "", "sections": {"Descripción": ["Loading..."]}, "txt_path": "dataset/txt_limpios/1711.txt", "html_path": "dataset/paginas_descargadas/1711.html", "es_status": "EN", "category_canonical": "sin_categoria", "decision": "discard", "match_score": 0.3, "reasons": "no_category_detected"}
{"source_id": "1713", "title": "Elige un método de entrega", "description": "La leche entera de larga vida Colun es elaborada a partir de pura leche natural de vacas sanas que pastan en praderas verdes de la lluviosa región de los Rios de Chile. Producto sin gluten certificado por fundación convivir. Producto certificado Kosher. Características: Leches blancas - Colun - Entera - Sin gluten - Sin sellos - Envase tetra - Formato familiar - Contenido 1 L. Loading...", "breadcrumbs": "Unimarc > 1 L", "price_raw": "1.3", "currency_raw": "", "url": "", "seller": "Desconocido", "availability": "unknown", "country": "UNKNOWN", "product_name": "Elige un método de entrega", "brand": "Unimarc", "reference": "", "unit": "1 L", "price_amount": 1.3, "price_currency": "", "price_symbol": "$", "price_text": "$1.30", "price_amount_filled": "1.3", "price_is_imputed": "False", "price_imputation_source": "original", "price_amount_usd": "1.3", "price_amount_usd_filled": "1.3", "fx_rate_local_per_usd": "1.0", "fx_source": "default_1usd", "information_text": "", "description_text": "La leche entera de larga vida Colun es elaborada a partir de pura leche natural de vacas sanas que pastan en praderas verdes de la lluviosa región de los Rios de Chile. Producto sin gluten certificado por fundación convivir. Producto certificado Kosher. Características: Leches blancas - Colun - Entera - Sin gluten - Sin sellos - Envase tetra - Formato familiar - Contenido 1 L. Loading...", "features_text": "", "specifications_text": "", "benefits_text": "", "details_text": "", "other_sections": "", "sections": {"Descripción": ["La leche entera de larga vida Colun es elaborada a partir de pura leche natural de vacas sanas que pastan en praderas verdes de la lluviosa región de los Rios de Chile. Producto sin gluten certificado por fundación convivir. Producto certificado Kosher. Características: Leches blancas - Colun - Entera - Sin gluten - Sin sellos - Envase tetra - Formato familiar - Contenido 1 L.", "Loading..."]}, "txt_path": "dataset/txt_limpios/1713.txt", "html_path": "dataset/paginas_descargadas/1713.html", "es_status": "ET", "category_canonical": "descartado", "decision": "discard", "match_score": 0.1, "reasons": "excluded_keyword"}
{"source_id": "1716", "title": "Elige un método de entrega", "description": "La mayoría de la población adulta en el mundo en el digiere adecuadamente la lactosa de la leche, es por eso que la leche sin lactosa entera Loncoleche entrega una alternativa a las personas que tienen este problema. Producto sin gluten certificado por fundación convivir. Producto certificado Kosher. Características: Leche sin lactosa - Loncoleche - Entera - Sin lactosa - Sin sellos - Envase Caja - Formato familiar - Contenido 1 L. Loading...", "breadcrumbs": "Unimarc > 1 L", "price_raw": "1.08", "currency_raw": "", "url": "", "seller": "Desconocido", "availability": "unknown", "country": "UNKNOWN", "product_name": "Elige un método de entrega", "brand": "Unimarc", "reference": "", "unit": "1 L", "price_amount": 1.08, "price_currency": "", "price_symbol": "$", "price_text": "$1.08", "price_amount_filled": "1.08", "price_is_imputed": "False", "price_imputation_source": "original", "price_amount_usd": "1.08", "price_amount_usd_filled": "1.08", "fx_rate_local_per_usd": "1.0", "fx_source": "default_1usd", "information_text": "", "description_text": "La mayoría de la población adulta en el mundo en el digiere adecuadamente la lactosa de la leche, es por eso que la leche sin lactosa entera Loncoleche entrega una alternativa a las personas que tienen este problema. Producto sin gluten certificado por fundación convivir. Producto certificado Kosher. Características: Leche sin lactosa - Loncoleche - Entera - Sin lactosa - Sin sellos - Envase Caja - Formato familiar - Contenido 1 L. Loading...", "features_text": "", "specifications_text": "", "benefits_text": "", "details_text": "", "other_sections": "", "sections": {"Descripción": ["La mayoría de la población adulta en el mundo en el digiere adecuadamente la lactosa de la leche, es por eso que la leche sin lactosa entera Loncoleche entrega una alternativa a las personas que tienen este problema. Producto sin gluten certificado por fundación convivir. Producto certificado Kosher. Características: Leche sin lactosa - Loncoleche - Entera - Sin lactosa - Sin sellos - Envase Caja - Formato familiar - Contenido 1 L.", "Loading..."]}, "txt_path": "dataset/txt_limpios/1716.txt", "html_path": "dataset/paginas_descargadas/1716.html", "es_status": "ET", "category_canonical": "descartado", "decision": "discard", "match_score": 0.1, "reasons": "excluded_keyword"}
{"source_id": "1718", "title": "Elige un método de entrega", "description": "Esta manzana de color rojo (del rojo más claro al más oscuro) es una de las más populares. SABOR Dulce, con un equilibrado aroma y con baja acidez. TEXTURA Pequeña, firme y crujiente... ¡Simplemente deliciosa! Loading...", "breadcrumbs": "Unimarc > 500 g", "price_raw": "1.29", "currency_raw": "", "url": "", "seller": "Desconocido", "availability": "unknown", "country": "UNKNOWN", "product_name": "Elige un método de entrega", "brand": "Unimarc", "reference": "", "unit": "500 g", "price_amount": 1.29, "price_currency": "", "price_symbol": "$", "price_text": "$1.29", "price_amount_filled": "1.29", "price_is_imputed": "False", "price_imputation_source": "original", "price_amount_usd": "1.29", "price_amount_usd_filled": "1.29", "fx_rate_local_per_usd": "1.0", "fx_source": "default_1usd", "information_text": "", "description_text": "Esta manzana de color rojo (del rojo más claro al más oscuro) es una de las más populares. SABOR Dulce, con un equilibrado aroma y con baja acidez. TEXTURA Pequeña, firme y crujiente... ¡Simplemente deliciosa! Loading...", "features_text": "", "specifications_text": "", "benefits_text": "", "details_text": "", "other_sections": "", "sections": {"Descripción": ["Esta manzana de color rojo (del rojo más claro al más oscuro) es una de las más populares. SABOR Dulce, con un equilibrado aroma y con baja acidez. TEXTURA Pequeña, firme y crujiente... ¡Simplemente deliciosa!", "Loading..."]}, "txt_path": "dataset/txt_limpios/1718.txt", "html_path": "dataset/paginas_descargadas/1718.html", "es_status": "EN", "category_canonical": "sin_categoria", "decision": "discard", "match_score": 0.3, "reasons": "no_category_detected"}
{"source_id": "1720", "title": "Elige un método de entrega", "description": "Semola de trigos duros seleccionados. Características: Largos - Carozzi - Envase bolsa - Formato familiar - Contenido 400 g. Loading...", "breadcrumbs": "Unimarc > 400 g", "price_raw": "690.0", "currency_raw": "", "url": "", "seller": "Desconocido", "availability": "unknown", "country": "UNKNOWN", "product_name": "Elige un método de entrega", "brand": "Unimarc", "reference": "", "unit": "400 g", "price_amount": 690.0, "price_currency": "", "price_symbol": "$", "price_text": "$690", "price_amount_filled": "690.0", "price_is_imputed": "False", "price_imputation_source": "original", "price_amount_usd": "690.0", "price_amount_usd_filled": "690.0", "fx_rate_local_per_usd": "1.0", "fx_source": "default_1usd", "information_text": "", "description_text": "Semola de trigos duros seleccionados. Características: Largos - Carozzi - Envase bolsa - Formato familiar - Contenido 400 g. Loading...", "features_text": "", "specifications_text": "", "benefits_text": "", "details_text": "", "other_sections": "", "sections": {"Descripción": ["Semola de trigos duros seleccionados. Características: Largos - Carozzi - Envase bolsa - Formato familiar - Contenido 400 g.", "Loading..."]}, "txt_path": "dataset/txt_limpios/1720.txt", "html_path": "dataset/paginas_descargadas/1720.html", "es_status": "EN", "category_canonical": "sin_categoria", "decision": "discard", "match_score": 0.3, "reasons": "no_category_detected"}
{"source_id": "1723", "title": "Elige un método de entrega", "description": "Todas las carpetas talliani están hechas de huevos frescos evocando la alta gastronomía italiana. Esto se traduce en una carpeta con una textura inconfundible y ligeramente rugosa, con lo que se adhiere mejor la salsa de tomates. Producto certificado Kosher. Características: Largos - Talliani - Envase bolsa - Formato familiar - Contenido 400 g. Loading...", "breadcrumbs": "Unimarc > 400 g", "price_raw": "1.33", "currency_raw": "", "url": "", "seller": "Desconocido", "availability": "unknown", "country": "UNKNOWN", "product_name": "Elige un método de entrega", "brand": "Unimarc", "reference": "", "unit": "400 g", "price_amount": 1.33, "price_currency": "", "price_symbol": "$", "price_text": "$1.33", "price_amount_filled": "1.33", "price_is_imputed": "False", "price_imputation_source": "original", "price_amount_usd": "1.33", "price_amount_usd_filled": "1.33", "fx_rate_local_per_usd": "1.0", "fx_source": "default_1usd", "information_text": "", "description_text": "Todas las carpetas talliani están hechas de huevos frescos evocando la alta gastronomía italiana. Esto se traduce en una carpeta con una textura inconfundible y ligeramente rugosa, con lo que se adhiere mejor la salsa de tomates. Producto certificado Kosher. Características: Largos - Talliani - Envase bolsa - Formato familiar - Contenido 400 g. Loading...", "features_text": "", "specifications_text": "", "benefits_text": "", "details_text": "", "other_sections": "", "sections": {"Descripción": ["Todas las carpetas talliani están hechas de huevos frescos evocando la alta gastronomía italiana. Esto se traduce en una carpeta con una textura inconfundible y ligeramente rugosa, con lo que se adhiere mejor la salsa de tomates. Producto certificado Kosher. Características: Largos - Talliani - Envase bolsa - Formato familiar - Contenido 400 g.", "Loading..."]}, "txt_path": "dataset/txt_limpios/1723.txt", "html_path": "dataset/paginas_descargadas/1723.html", "es_status": "ET", "category_canonical": "huevo", "decision": "discard", "match_score": 0.3, "reasons": "heuristic_default"}
{"source_id": "1725", "title": "Elige un método de entrega", "description": "Carpeta libre de colesterol, con bajo aporte en grasas y buena fuente de proteína. Rinde 5 porciones. Características: Largos - Lucchetti - Envase bolsa - Formato familiar - Contenido 400 g. Loading...", "breadcrumbs": "Unimarc > 400 g", "price_raw": "2.0", "currency_raw": "", "url": "", "seller": "Desconocido", "availability": "unknown", "country": "UNKNOWN", "product_name": "Elige un método de entrega", "brand": "Unimarc", "reference": "", "unit": "400 g", "price_amount": 2.0, "price_currency": "", "price_symbol": "", "price_text": "2", "price_amount_filled": "2.0", "price_is_imputed": "False", "price_imputation_source": "original", "price_amount_usd": "2.0", "price_amount_usd_filled": "2.0", "fx_rate_local_per_usd": "1.0", "fx_source": "default_1usd", "information_text": "", "description_text": "Carpeta libre de colesterol, con bajo aporte en grasas y buena fuente de proteína. Rinde 5 porciones. Características: Largos - Lucchetti - Envase bolsa - Formato familiar - Contenido 400 g. Loading...", "features_text": "", "specifications_text": "", "benefits_text": "", "details_text": "", "other_sections": "", "sections": {"Descripción": ["Carpeta libre de colesterol, con bajo aporte en grasas y buena fuente de proteína. Rinde 5 porciones. Características: Largos - Lucchetti - Envase bolsa - Formato familiar - Contenido 400 g.", "Loading..."]}, "txt_path": "dataset/txt_limpios/1725.txt", "html_path": "dataset/paginas_descargadas/1725.html", "es_status": "ET", "category_canonical": "sin_categoria", "decision": "discard", "match_score": 0.3, "reasons": "no_category_detected"}
{"source_id": "1727", "title": "Elige un método de entrega", "description": "Pollo Entero con menudencia Ariztía. Los precios de los productos son por kilo y el peso indicado es aproximado, por lo que en su boleta se cobrará el peso y valor exacto. Producto sin gluten certificado por fundación convivir. Loading...", "breadcrumbs": "Unimarc > 2.5 Kg", "price_raw": "9.97", "currency_raw": "", "url": "", "seller": "Desconocido", "availability": "unknown", "country": "UNKNOWN", "product_name": "Elige un método de entrega", "brand": "Unimarc", "reference": "", "unit": "2.5 Kg", "price_amount": 9.97, "price_currency": "", "price_symbol": "$", "price_text": "$9.97", "price_amount_filled": "9.97", "price_is_imputed": "False", "price_imputation_source": "original", "price_amount_usd": "9.97", "price_amount_usd_filled": "9.97", "fx_rate_local_per_usd": "1.0", "fx_source": "default_1usd", "information_text": "", "description_text": "Pollo Entero con menudencia Ariztía. Los precios de los productos son por kilo y el peso indicado es aproximado, por lo que en su boleta se cobrará el peso y valor exacto. Producto sin gluten certificado por fundación convivir. Loading...", "features_text": "", "specifications_text": "", "benefits_text": "", "details_text": "", "other_sections": "", "sections": {"Descripción": ["Pollo Entero con menudencia Ariztía. Los precios de los productos son por kilo y el peso indicado es aproximado, por lo que en su boleta se cobrará el peso y valor exacto. Producto sin gluten certificado por fundación convivir.", "Loading..."]}, "txt_path": "dataset/txt_limpios/1727.txt", "html_path": "dataset/paginas_descargadas/1727.html", "es_status": "EN", "category_canonical": "descartado", "decision": "discard", "match_score": 0.1, "reasons": "excluded_keyword"}
{"source_id": "1729", "title": "Elige un método de entrega", "description": "Loading...", "breadcrumbs": "Unimarc > 3 Kg", "price_raw": "11.97", "currency_raw": "", "url": "", "seller": "Desconocido", "availability": "unknown", "country": "UNKNOWN", "product_name": "Elige un método de entrega", "brand": "Unimarc", "reference": "", "unit": "3 Kg", "price_amount": 11.97, "price_currency": "", "price_symbol": "$", "price_text": "$11.97", "price_amount_filled": "11.97", "price_is_imputed": "False", "price_imputation_source": "original", "price_amount_usd": "11.97", "price_amount_usd_filled": "11.97", "fx_rate_local_per_usd": "1.0", "fx_source": "default_1usd", "information_text": "", "description_text": "Loading...", "features_text": "", "specifications_text": "", "benefits_text": "", "details_text": "", "other_sections": "", "sections": {"Descripción": ["Loading..."]}, "txt_path": "dataset/txt_limpios/1729.txt", "html_path": "dataset/paginas_descargadas/1729.html", "es_status": "EN", "category_canonical": "sin_categoria", "decision": "discard", "match_score": 0.3, "reasons": "no_category_detected"}
{"source_id": "1731", "title": "Elige un método de entrega", "description": "Pasta spaghetti N°5 Merkat, 400 g Loading...", "breadcrumbs": "Unimarc > 400 g", "price_raw": "490.0", "currency_raw": "", "url": "", "seller": "Desconocido", "availability": "unknown", "country": "UNKNOWN", "product_name": "Elige un método de entrega", "brand": "Unimarc", "reference": "", "unit": "400 g", "price_amount": 490.0, "price_currency": "", "price_symbol": "$", "price_text": "$490", "price_amount_filled": "490.0", "price_is_imputed": "False", "price_imputation_source": "original", "price_amount_usd": "490.0", "price_amount_usd_filled": "490.0", "fx_rate_local_per_usd": "1.0", "fx_source": "default_1usd", "information_text": "", "description_text": "Pasta spaghetti N°5 Merkat, 400 g Loading...", "features_text": "", "specifications_text": "", "benefits_text": "", "details_text": "", "other_sections": "", "sections": {"Descripción": ["Pasta spaghetti N°5 Merkat, 400 g", "Loading..."]}, "txt_path": "dataset/txt_limpios/1731.txt", "html_path": "dataset/paginas_descargadas/1731.html", "es_status": "EN", "category_canonical": "sin_categoria", "decision": "discard", "match_score": 0.3, "reasons": "no_category_detected"}
