{"source_id": "1345", "title": "CERVEZA BIELA RESERVA LATA 355 ML", "description": "¿Deseas recibir notificaciones? Remind me later Permitir Thank you! Please check your email inbox to confirm. Oops! Notifications are disabled.", "breadcrumbs": "Comparar > 355 ML", "price_raw": "1.0", "currency_raw": "USD", "url": "", "seller": "Desconocido", "availability": "unknown", "country": "US", "product_name": "CERVEZA BIELA RESERVA LATA 355 ML", "brand": "Comparar", "reference": "", "unit": "355 ML", "price_amount": 1.0, "price_currency": "USD", "price_symbol": "$", "price_text": "$1,00", "price_amount_filled": "1.0", "price_is_imputed": "False", "price_imputation_source": "original", "price_amount_usd": "1.0", "price_amount_usd_filled": "1.0", "fx_rate_local_per_usd": "1.0", "fx_source": "default_1usd", "information_text": "¿Deseas recibir notificaciones? Remind me later Permitir Thank you! Please check your email inbox to confirm. Oops! Notifications are disabled.", "description_text": "", "features_text": "", "specifications_text": "", "benefits_text": "", "details_text": "", "other_sections": "", "sections": {"Información": ["¿Deseas recibir notificaciones?", "Remind me later", "Permitir", "Thank you! Please check your email inbox to confirm.", "Oops! Notifications are disabled."]}, "txt_path": "dataset/txt_limpios/1345.txt", "html_path": "dataset/paginas_descargadas/1345.html", "es_status": "EN", "category_canonical": "cerveza", "decision": "keep", "match_score": 0.6, "reasons": "heuristic_default"}
{"source_id": "1347", "title": "CERVEZA CLUB PLATINO 330 ML", "description": "Ficha técnica Cerveza tipo Lager, 100% malta, sabor extra fino. Decrease the quantity Increase the quantity ¿Deseas recibir notificaciones? Remind me later Permitir Thank you! Please check your email inbox to confirm. ¡Oops! Notifications are disabled.", "breadcrumbs": "CLUB > 330 ML", "price_raw": "1.45", "currency_raw": "USD", "url": "", "seller": "Desconocido", "availability": "unknown", "country": "US", "product_name": "CERVEZA CLUB PLATINO 330 ML", "brand": "CLUB", "reference": "", "unit": "330 ML", "price_amount": 1.45, "price_currency": "USD", "price_symbol": "$", "price_text": "$1,45", "price_amount_filled": "1.45", "price_is_imputed": "False", "price_imputation_source": "original", "price_amount_usd": "1.45", "price_amount_usd_filled": "1.45", "fx_rate_local_per_usd": "1.0", "fx_source": "default_1usd", "information_text": "Ficha técnica Cerveza tipo Lager, 100% malta, sabor extra fino. Decrease the quantity Increase the quantity ¿Deseas recibir notificaciones? Remind me later Permitir Thank you! Please check your email inbox to confirm. ¡Oops! Notifications are disabled.", "description_text": "", "features_text": "", "specifications_text": "", "benefits_text": "", "details_text": "", "other_sections": "", "sections": {"Información": ["Ficha técnica", "Cerveza tipo Lager, 100% malta, sabor extra fino.", "Decrease the quantity", "Increase the quantity", "¿Deseas recibir notificaciones?", "Remind me later", "Permitir", "Thank you! Please check your email inbox to confirm.", "Oops! Notifications are disabled."]}, "txt_path": "dataset/txt_limpios/1347.txt", "html_path": "dataset/paginas_descargadas/1347.html", "es_status": "ET", "category_canonical": "cerveza", "decision": "keep", "match_score": 0.6, "reasons": "heuristic_default"}
{"source_id": "1346", "title": "CERVEZA CORONITA EXTRA 210 ML", "description": "¿Deseas recibir notificaciones? Remind me later Permitir Thank you! Please check your email inbox to confirm. Oops! Notifications are disabled.", "breadcrumbs": "Comparar > 210 ML", "price_raw": "1.18", "currency_raw": "USD", "url": "", "seller": "Desconocido", "availability": "unknown", "country": "US", "product_name": "CERVEZA CORONITA EXTRA 210 ML", "brand": "Comparar", "reference": "", "unit": "210 ML", "price_amount": 1.18, "price_currency": "USD", "price_symbol": "$", "price_text": "$1,18", "price_amount_filled": "1.18", "price_is_imputed": "False", "price_imputation_source": "original", "price_amount_usd": "1.18", "price_amount_usd_filled": "1.18", "fx_rate_local_per_usd": "1.0", "fx_source": "default_1usd", "information_text": "¿Deseas recibir notificaciones? Remind me later Permitir Thank you! Please check your email inbox to confirm. Oops! Notifications are disabled.", "description_text": "", "features_text": "", "specifications_text": "", "benefits_text": "", "details_text": "", "other_sections": "", "sections": {"Información": ["¿Deseas recibir notificaciones?", "Remind me later", "Permitir", "Thank you! Please check your email inbox to confirm.", "Oops! Notifications are disabled."]}, "txt_path": "dataset/txt_limpios/1346.txt", "html_path": "dataset/paginas_descargadas/1346.html", "es_status": "EN", "category_canonical": "cerveza", "decision": "keep", "match_score": 0.6, "reasons": "heuristic_default"}
{"source_id": "917", "title": "Cerveza extra botella", "description": "", "breadcrumbs": "330 ml > 330 ml", "price_raw": "1.05", "currency_raw": "", "url": "", "seller": "Desconocido", "availability": "unknown", "country": "UNKNOWN", "product_name": "Cerveza extra botella", "brand": "330 ml", "reference": "", "unit": "330 ml", "price_amount": 1.05, "price_currency": "", "price_symbol": "$", "price_text": "$1.05", "price_amount_filled": "1.05", "price_is_imputed": "False", "price_imputation_source": "original", "price_amount_usd": "1.05", "price_amount_usd_filled": "1.05", "fx_rate_local_per_usd": "1.0", "fx_source": "default_1usd", "information_text": "", "description_text": "", "features_text": "", "specifications_text": "", "benefits_text": "", "details_text": "", "other_sections": "", "sections": {}, "txt_path": "dataset/txt_limpios/917.txt", "html_path": "dataset/paginas_descargadas/917.html", "es_status": "EN", "category_canonical": "cerveza", "decision": "keep", "match_score": 0.6, "reasons": "heuristic_default"}
{"source_id": "1348", "title": "CERVEZA PILSENER LATA 355 ML", "description": "¿Deseas recibir notificaciones? Remind me later Permitir Thank you! Please check your email inbox to confirm. Oops! Notifications are disabled.", "breadcrumbs": "Comparar > 355 ML", "price_raw": "0.99", "currency_raw": "USD", "url": "", "seller": "Desconocido", "availability": "unknown", "country": "US", "product_name": "CERVEZA PILSENER LATA 355 ML", "brand": "Comparar", "reference": "", "unit": "355 ML", "price_amount": 0.99, "price_currency": "USD", "price_symbol": "$", "price_text": "$0,99", "price_amount_filled": "0.99", "price_is_imputed": "False", "price_imputation_source": "original", "price_amount_usd": "0.99", "price_amount_usd_filled": "0.99", "fx_rate_local_per_usd": "1.0", "fx_source": "default_1usd", "information_text": "¿Deseas recibir notificaciones? Remind me later Permitir Thank you! Please check your email inbox to confirm. Oops! Notifications are disabled.", "description_text": "", "features_text": "", "specifications_text": "", "benefits_text": "", "details_text": "", "other_sections": "", "sections": {"Información": ["¿Deseas recibir notificaciones?", "Remind me later", "Permitir", "Thank you! Please check your email inbox to confirm.", "Oops! Notifications are disabled."]}, "txt_path": "dataset/txt_limpios/1348.txt", "html_path": "dataset/paginas_descargadas/1348.html", "es_status": "EN", "category_canonical": "cerveza", "decision": "keep", "match_score": 0.6, "reasons": "heuristic_default"}
{"source_id": "918", "title": "Cervezas, vinos y licores", "description": "", "breadcrumbs": "Cervezas > 473 ml", "price_raw": "1.18", "currency_raw": "", "url": "", "seller": "Desconocido", "availability": "unknown", "country": "UNKNOWN", "product_name": "Cervezas, vinos y licores", "brand": "Cervezas", "reference": "", "unit": "473 ml", "price_amount": 1.18, "price_currency": "", "price_symbol": "$", "price_text": "$1.18", "price_amount_filled": "1.18", "price_is_imputed": "False", "price_imputation_source": "original", "price_amount_usd": "1.18", "price_amount_usd_filled": "1.18", "fx_rate_local_per_usd": "1.0", "fx_source": "default_1usd", "information_text": "", "description_text": "", "features_text": "", "specifications_text": "", "benefits_text": "", "details_text": "", "other_sections": "", "sections": {}, "txt_path": "dataset/txt_limpios/918.txt", "html_path": "dataset/paginas_descargadas/918.html", "es_status": "EN", "category_canonical": "sin_categoria", "decision": "discard", "match_score": 0.3, "reasons": "no_category_detected"}
{"source_id": "920", "title": "Cervezas, vinos y licores", "description": "Cerveza Stella Artois, botella 330 cc", "breadcrumbs": "Cervezas > 330 ml", "price_raw": "990.0", "currency_raw": "", "url": "", "seller": "Desconocido", "availability": "unknown", "country": "UNKNOWN", "product_name": "Cervezas, vinos y licores", "brand": "Cervezas", "reference": "", "unit": "330 ml", "price_amount": 990.0, "price_currency": "", "price_symbol": "$", "price_text": "$990", "price_amount_filled": "990.0", "price_is_imputed": "False", "price_imputation_source": "original", "price_amount_usd": "990.0", "price_amount_usd_filled": "990.0", "fx_rate_local_per_usd": "1.0", "fx_source": "default_1usd", "information_text": "", "description_text": "Cerveza Stella Artois, botella 330 cc", "features_text": "", "specifications_text": "", "benefits_text": "", "details_text": "", "other_sections": "", "sections": {"Descripción": ["Cerveza Stella Artois, botella 330 cc"]}, "txt_path": "dataset/txt_limpios/920.txt", "html_path": "dataset/paginas_descargadas/920.html", "es_status": "EN", "category_canonical": "cerveza", "decision": "keep", "match_score": 0.6, "reasons": "heuristic_default"}
{"source_id": "1359", "title": "COLA COCA COLA 2 L ORIGINAL", "description": "Ficha técnica Pega coca cola 2 lt ¿Deseas recibir notificaciones? Remind me later Permitir Thank you! Please check your email inbox to confirm. ¡Oops! Notifications are disabled.", "breadcrumbs": "Comparar > 2 L", "price_raw": "1.86", "currency_raw": "USD", "url": "", "seller": "Desconocido", "availability": "unknown", "country": "US", "product_name": "COLA COCA COLA 2 L ORIGINAL", "brand": "Comparar", "reference": "", "unit": "2 L", "price_amount": 1.86, "price_currency": "USD", "price_symbol": "$", "price_text": "$1,86", "price_amount_filled": "1.86", "price_is_imputed": "False", "price_imputation_source": "original", "price_amount_usd": "1.86", "price_amount_usd_filled": "1.86", "fx_rate_local_per_usd": "1.0", "fx_source": "default_1usd", "information_text": "Ficha técnica Pega coca cola 2 lt ¿Deseas recibir notificaciones? Remind me later Permitir Thank you! Please check your email inbox to confirm. ¡Oops! Notifications are disabled.", "description_text": "", "features_text": "", "specifications_text": "", "benefits_text": "", "details_text": "", "other_sections": "", "sections": {"Información": ["Ficha técnica", "Cola coca cola 2 lt", "¿Deseas recibir notificaciones?", "Remind me later", "Permitir", "Thank you! Please check your email inbox to confirm.", "Oops! Notifications are disabled."]}, "txt_path": "dataset/txt_limpios/1359.txt", "html_path": "dataset/paginas_descargadas/1359.html", "es_status": "ET", "category_canonical": "sin_categoria", "decision": "discard", "match_score": 0.3, "reasons": "no_category_detected"}
{"source_id": "1356", "title": "COLA FANTA 500 ML NARANJA", "description": "¿Deseas recibir notificaciones? Remind me later Permitir Thank you! Please check your email inbox to confirm. Oops! Notifications are disabled.", "breadcrumbs": "Comparar > 500 ML", "price_raw": "0.49", "currency_raw": "USD", "url": "", "seller": "Desconocido", "availability": "unknown", "country": "US", "product_name": "COLA FANTA 500 ML NARANJA", "brand": "Comparar", "reference": "", "unit": "500 ML", "price_amount": 0.49, "price_currency": "USD", "price_symbol": "$", "price_text": "$0,49", "price_amount_filled": "0.49", "price_is_imputed": "False", "price_imputation_source": "original", "price_amount_usd": "0.49", "price_amount_usd_filled": "0.49", "fx_rate_local_per_usd": "1.0", "fx_source": "default_1usd", "information_text": "¿Deseas recibir notificaciones? Remind me later Permitir Thank you! Please check your email inbox to confirm. Oops! Notifications are disabled.", "description_text": "", "features_text": "", "specifications_text": "", "benefits_text": "", "details_text": "", "other_sections": "", "sections": {"Información": ["¿Deseas recibir notificaciones?", "Remind me later", "Permitir", "Thank you! Please check your email inbox to confirm.", "Oops! Notifications are disabled."]}, "txt_path": "dataset/txt_limpios/1356.txt", "html_path": "dataset/paginas_descargadas/1356.html", "es_status": "EN", "category_canonical": "sin_categoria", "decision": "discard", "match_score": 0.3, "reasons": "no_category_detected"}
{"source_id": "1358", "title": "COLA INCA KOLA 2 L", "description": "¿Deseas recibir notificaciones? Remind me later Permitir Thank you! Please check your email inbox to confirm. Oops! Notifications are disabled.", "breadcrumbs": "Comparar > 2 L", "price_raw": "1.18", "currency_raw": "USD", "url": "", "seller": "Desconocido", "availability": "unknown", "country": "US", "product_name": "COLA INCA KOLA 2 L", "brand": "Comparar", "reference": "", "unit": "2 L", "price_amount": 1.18, "price_currency": "USD", "price_symbol": "$", "price_text": "$1,18", "price_amount_filled": "1.18", "price_is_imputed": "False", "price_imputation_source": "original", "price_amount_usd": "1.18", "price_amount_usd_filled": "1.18", "fx_rate_local_per_usd": "1.0", "fx_source": "default_1usd", "information_text": "¿Deseas recibir notificaciones? Remind me later Permitir Thank you! Please check your email inbox to confirm. Oops! Notifications are disabled.", "description_text": "", "features_text": "", "specifications_text": "", "benefits_text": "", "details_text": "", "other_sections": "", "sections": {"Información": ["¿Deseas recibir notificaciones?", "Remind me later", "Permitir", "Thank you! Please check your email inbox to confirm.", "Oops! Notifications are disabled."]}, "txt_path": "dataset/txt_limpios/1358.txt", "html_path": "dataset/paginas_descargadas/1358.html", "es_status": "EN", "category_canonical": "sin_categoria", "decision": "discard", "match_score": 0.3, "reasons": "no_category_detected"}
{"source_id": "1355", "title": "COLA ORANGINE 3000 ML MANZANA", "description": "Ficha técnica ¿Deseas recibir notificaciones? Remind me later Permitir Thank you! Please check your email inbox to confirm. ¡Oops! Notifications are disabled.", "breadcrumbs": "Comparar > 3000 ML", "price_raw": "1.55", "currency_raw": "USD", "url": "", "seller": "Desconocido", "availability": "unknown", "country": "US", "product_name": "COLA ORANGINE 3000 ML MANZANA", "brand": "Comparar", "reference": "", "unit": "3000 ML", "price_amount": 1.55, "price_currency": "USD", "price_symbol": "$", "price_text": "$1,55", "price_amount_filled": "1.55", "price_is_imputed": "False", "price_imputation_source": "original", "price_amount_usd": "1.55", "price_amount_usd_filled": "1.55", "fx_rate_local_per_usd": "1.0", "fx_source": "default_1usd", "information_text": "Ficha técnica ¿Deseas recibir notificaciones? Remind me later Permitir Thank you! Please check your email inbox to confirm. ¡Oops! Notifications are disabled.", "description_text": "", "features_text": "", "specifications_text": "", "benefits_text": "", "details_text": "", "other_sections": "", "sections": {"Información": ["Ficha técnica", "¿Deseas recibir notificaciones?", "Remind me later", "Permitir", "Thank you! Please check your email inbox to confirm.", "Oops! Notifications are disabled."]}, "txt_path": "dataset/txt_limpios/1355.txt", "html_path": "dataset/paginas_descargadas/1355.html", "es_status": "ET", "category_canonical": "sin_categoria", "decision": "discard", "match_score": 0.3, "reasons": "no_category_detected"}
{"source_id": "1357", "title": "COLA SPRITE 1.35 L", "description": "Ficha técnica ¿Deseas recibir notificaciones? Remind me later Permitir Thank you! Please check your email inbox to confirm. ¡Oops! Notifications are disabled.", "breadcrumbs": "Comparar > 1.35 L", "price_raw": "1.09", "currency_raw": "USD", "url": "", "seller": "Desconocido", "availability": "unknown", "country": "US", "product_name": "COLA SPRITE 1.35 L", "brand": "Comparar", "reference": "", "unit": "1.35 L", "price_amount": 1.09, "price_currency": "USD", "price_symbol": "$", "price_text": "$1,09", "price_amount_filled": "1.09", "price_is_imputed": "False", "price_imputation_source": "original", "price_amount_usd": "1.09", "price_amount_usd_filled": "1.09", "fx_rate_local_per_usd": "1.0", "fx_source": "default_1usd", "information_text": "Ficha técnica ¿Deseas recibir notificaciones? Remind me later Permitir Thank you! Please check your email inbox to confirm. ¡Oops! Notifications are disabled.", "description_text": "", "features_text": "", "specifications_text": "", "benefits_text": "", "details_text": "", "other_sections": "", "sections": {"Información": ["Ficha técnica", "¿Deseas recibir notificaciones?", "Remind me later", "Permitir", "Thank you! Please check your email inbox to confirm.", "Oops! Notifications are disabled."]}, "txt_path": "dataset/txt_limpios/1357.txt", "html_path": "dataset/paginas_descargadas/1357.html", "es_status": "ET", "category_canonical": "sin_categoria", "decision": "discard", "match_score": 0.3, "reasons": "no_category_detected"}
