{"source_id": "693", "title": "ASESORAMOS TU COMPRA: 📞(601) 6672004, lun a sab de 7am.a 7pm dom hasta las 6pm", "description": "Queso fresco, semiblando y semiduro para disfrutar a cualquier hora del día. Este producto es vendido, facturado y entregado por Cencosud - Colombia Los precios de los productos pueden cambiar dependiendo de la región. Aplican Términos y Condiciones Desactivados Referencia: 3563010 $ 41, 48 x gr SUPERIOR ☆ ¿Todavía tienes tu Tarjeta Cencosud? Solicítala en línea, úsala y obtén un . Aplican términos y condiciones. Solicítala aquí Términos más buscados 1. kefir alpina 2. muebles 3. leche 4. leche alqueria 5. san jorge 6. papel higiénico 7. arroz 8. café 9. cerveza 10. neveras", "breadcrumbs": "otras ciudades consulta aquí > 3563010", "price_raw": "400.0", "currency_raw": "COP", "url": "", "seller": "Desconocido", "availability": "unknown", "country": "CO", "product_name": "ASESORAMOS TU COMPRA: 📞(601) 6672004, lun a sab de 7am.a 7pm dom hasta las 6pm", "brand": "otras ciudades consulta aquí", "reference": "3563010.0", "unit": "", "price_amount": 400.0, "price_currency": "COP", "price_symbol": "", "price_text": "400", "price_amount_filled": "400.0", "price_is_imputed": "False", "price_imputation_source": "original", "price_amount_usd": "0.0988", "price_amount_usd_filled": "0.0988", "fx_rate_local_per_usd": "4047.0", "fx_source": "from_colombia_cambio_dolar", "information_text": "", "description_text": "Queso fresco, semiblando y semiduro para disfrutar a cualquier hora del día. Este producto es vendido, facturado y entregado por Cencosud - Colombia Los precios de los productos pueden cambiar dependiendo de la región. Aplican Términos y Condiciones Desactivados Referencia: 3563010 $ 41, 48 x gr SUPERIOR ☆ ¿Todavía tienes tu Tarjeta Cencosud? Solicítala en línea, úsala y obtén un . Aplican términos y condiciones. Solicítala aquí Términos más buscados 1. kefir alpina 2. muebles 3. leche 4. leche alqueria 5. san jorge 6. papel higiénico 7. arroz 8. café 9. cerveza 10. neveras", "features_text": "", "specifications_text": "", "benefits_text": "", "details_text": "", "other_sections": "", "sections": {"Descripción": ["Queso fresco, semiblando y semiduro para disfrutar a cualquier hora del día.", "Este producto es vendido, facturado y entregado por", "Cencosud - Colombia", "Los precios de los productos pueden cambiar dependiendo de la región.", "Aplican Términos y Condiciones", "Desactivado", "Referencia: 3563010", "$", "41", ",", "48", "x", "gr", "SUPERIOR", "☆", "¿Todavía tienes tu Tarjeta Cencosud?", "Solicítala en línea, úsala y obtén un", ". Aplican términos y condiciones.", "Solicítala aquí", "Términos más buscados", "1.", "kefir alpina", "2.", "muebles", "3.", "leche", "4.", "leche alqueria", "5.", "san jorge", "6.", "papel higienico", "7.", "arroz", "8.", "cafe", "9.", "cerveza", "10.", "neveras"]}, "txt_path": "dataset/txt_limpios/693.txt", "html_path": "dataset/paginas_descargadas/693.html", "es_status": "ET", "category_canonical": "cafe", "decision": "keep", "match_score": 0.6, "reasons": "heuristic_default"}
{"source_id": "694", "title": "ASESORAMOS TU COMPRA: 📞(601) 6672004, lun a sab de 7am.a 7pm dom hasta las 6pm", "description": "Prueba el irresistible sabor del queso mozzarella Campo Real y combínalo con lo que más te guste. Este producto es vendido, facturado y entregado por Cencosud - Colombia Los precios de los productos pueden cambiar dependiendo de la región. Aplican Términos y Condiciones Referencia: 3551925 $ 40 , 3 x gr CAMPO REAL ☆ ¿Todavía tienes tu Tarjeta Cencosud? Solicítala en línea, úsala y obtén un . Aplican términos y condiciones. Solicítala aquí Mejores ofertas -35% -24% Términos más buscados 1. kefir alpina 2. muebles 3. leche 4. leche alqueria 5. san jorge 6. papel higiénico 7. arroz 8. café 9. cerveza 10. neveras", "breadcrumbs": "otras ciudades consulta aquí > 3551925", "price_raw": "500.0", "currency_raw": "COP", "url": "", "seller": "Desconocido", "availability": "unknown", "country": "CO", "product_name": "ASESORAMOS TU COMPRA: 📞(601) 6672004, lun a sab de 7am.a 7pm dom hasta las 6pm", "brand": "otras ciudades consulta aquí", "reference": "3551925.0", "unit": "", "price_amount": 500.0, "price_currency": "COP", "price_symbol": "", "price_text": "500", "price_amount_filled": "500.0", "price_is_imputed": "False", "price_imputation_source": "original", "price_amount_usd": "0.1235", "price_amount_usd_filled": "0.1235", "fx_rate_local_per_usd": "4047.0", "fx_source": "from_colombia_cambio_dolar", "information_text": "", "description_text": "Prueba el irresistible sabor del queso mozzarella Campo Real y combínalo con lo que más te guste. Este producto es vendido, facturado y entregado por Cencosud - Colombia Los precios de los productos pueden cambiar dependiendo de la región. Aplican Términos y Condiciones Referencia: 3551925 $ 40 , 3 x gr CAMPO REAL ☆ ¿Todavía tienes tu Tarjeta Cencosud? Solicítala en línea, úsala y obtén un . Aplican términos y condiciones. Solicítala aquí Mejores ofertas -35% -24% Términos más buscados 1. kefir alpina 2. muebles 3. leche 4. leche alqueria 5. san jorge 6. papel higiénico 7. arroz 8. café 9. cerveza 10. neveras", "features_text": "", "specifications_text": "", "benefits_text": "", "details_text": "", "other_sections": "", "sections": {"Descripción": ["Prueba el irresistible sabor del queso mozzarella Campo Real y combínalo con lo que más te guste.", "Este producto es vendido, facturado y entregado por", "Cencosud - Colombia", "Los precios de los productos pueden cambiar dependiendo de la región.", "Aplican Términos y Condiciones", "Referencia: 3551925", "$", "40", ",", "3", "x", "gr", "CAMPO REAL", "☆", "¿Todavía tienes tu Tarjeta Cencosud?", "Solicítala en línea, úsala y obtén un", ". Aplican términos y condiciones.", "Solicítala aquí", "Mejores ofertas", "-35%", "-24%", "Términos más buscados", "1.", "kefir alpina", "2.", "muebles", "3.", "leche", "4.", "leche alqueria", "5.", "san jorge", "6.", "papel higienico", "7.", "arroz", "8.", "cafe", "9.", "cerveza", "10.", "neveras"]}, "txt_path": "dataset/txt_limpios/694.txt", "html_path": "dataset/paginas_descargadas/694.html", "es_status": "ET", "category_canonical": "cafe", "decision": "keep", "match_score": 0.6, "reasons": "heuristic_default"}
{"source_id": "695", "title": "ASESORAMOS TU COMPRA: 📞(601) 6672004, lun a sab de 7am.a 7pm dom hasta las 6pm", "description": "Ingredientes Condición alimentaria Información nutricional Incluye en tus recetas este delicioso queso mozzarella light que le brindará un sabor especial a cada uno de tus platos. Este producto es vendido, facturado y entregado por Cencosud - Colombia Los precios de los productos pueden cambiar dependiendo de la región. Aplican Términos y Condiciones Desactivados Referencia: 0850318 $ 70 x gr PASCO ☆ ¿Todavía tienes tu Tarjeta Cencosud? Solicítala en línea, úsala y obtén un . Aplican términos y condiciones. Solicítala aquí Términos más buscados 1. kefir alpina 2. muebles 3. leche 4. leche alqueria 5. san jorge 6. papel higiénico 7. arroz 8. café 9. cerveza 10. neveras", "breadcrumbs": "otras ciudades consulta aquí > 0850318", "price_raw": "450.0", "currency_raw": "COP", "url": "", "seller": "Desconocido", "availability": "unknown", "country": "CO", "product_name": "ASESORAMOS TU COMPRA: 📞(601) 6672004, lun a sab de 7am.a 7pm dom hasta las 6pm", "brand": "otras ciudades consulta aquí", "reference": "850318.0", "unit": "", "price_amount": 450.0, "price_currency": "COP", "price_symbol": "", "price_text": "450", "price_amount_filled": "450.0", "price_is_imputed": "False", "price_imputation_source": "original", "price_amount_usd": "0.1112", "price_amount_usd_filled": "0.1112", "fx_rate_local_per_usd": "4047.0", "fx_source": "from_colombia_cambio_dolar", "information_text": "", "description_text": "Ingredientes Condición alimentaria Información nutricional Incluye en tus recetas este delicioso queso mozzarella light que le brindará un sabor especial a cada uno de tus platos. Este producto es vendido, facturado y entregado por Cencosud - Colombia Los precios de los productos pueden cambiar dependiendo de la región. Aplican Términos y Condiciones Desactivados Referencia: 0850318 $ 70 x gr PASCO ☆ ¿Todavía tienes tu Tarjeta Cencosud? Solicítala en línea, úsala y obtén un . Aplican términos y condiciones. Solicítala aquí Términos más buscados 1. kefir alpina 2. muebles 3. leche 4. leche alqueria 5. san jorge 6. papel higiénico 7. arroz 8. café 9. cerveza 10. neveras", "features_text": "", "specifications_text": "", "benefits_text": "", "details_text": "", "other_sections": "", "sections": {"Descripción": ["Ingredientes", "Condición alimentaria", "Información nutricional", "Incluye en tus recetas este delicioso queso mozzarella light que le brindará un sabor especial a cada uno de tus platos.", "Este producto es vendido, facturado y entregado por", "Cencosud - Colombia", "Los precios de los productos pueden cambiar dependiendo de la región.", "Aplican Términos y Condiciones", "Desactivado", "Referencia: 0850318", "$", "70", "x", "gr", "PASCO", "☆", "¿Todavía tienes tu Tarjeta Cencosud?", "Solicítala en línea, úsala y obtén un", ". Aplican términos y condiciones.", "Solicítala aquí", "Términos más buscados", "1.", "kefir alpina", "2.", "muebles", "3.", "leche", "4.", "leche alqueria", "5.", "san jorge", "6.", "papel higienico", "7.", "arroz", "8.", "cafe", "9.", "cerveza", "10.", "neveras"]}, "txt_path": "dataset/txt_limpios/695.txt", "html_path": "dataset/paginas_descargadas/695.html", "es_status": "ET", "category_canonical": "cafe", "decision": "keep", "match_score": 0.6, "reasons": "heuristic_default"}
{"source_id": "696", "title": "ASESORAMOS TU COMPRA: 📞(601) 6672004, lun a sab de 7am.a 7pm dom hasta las 6pm", "description": "Este producto es vendido, facturado y entregado por Cencosud - Colombia Los precios de los productos pueden cambiar dependiendo de la región. Aplican Términos y Condiciones APLICA PARA Referencia: 0064565 $ 71 , 86 x gr VECCHIO ☆ ¿Todavía tienes tu Tarjeta Cencosud? Solicítala en línea, úsala y obtén un . Aplican términos y condiciones. Solicítala aquí Términos más buscados 1. kefir alpina 2. muebles 3. leche 4. leche alqueria 5. san jorge 6. papel higiénico 7. arroz 8. café 9. cerveza 10. neveras", "breadcrumbs": "otras ciudades consulta aquí > 70g > 0064565", "price_raw": "70.0", "currency_raw": "COP", "url": "", "seller": "Desconocido", "availability": "unknown", "country": "CO", "product_name": "ASESORAMOS TU COMPRA: 📞(601) 6672004, lun a sab de 7am.a 7pm dom hasta las 6pm", "brand": "otras ciudades consulta aquí", "reference": "64565.0", "unit": "70g", "price_amount": 70.0, "price_currency": "COP", "price_symbol": "", "price_text": "70", "price_amount_filled": "70.0", "price_is_imputed": "False", "price_imputation_source": "original", "price_amount_usd": "0.0173", "price_amount_usd_filled": "0.0173", "fx_rate_local_per_usd": "4047.0", "fx_source": "from_colombia_cambio_dolar", "information_text": "", "description_text": "Este producto es vendido, facturado y entregado por Cencosud - Colombia Los precios de los productos pueden cambiar dependiendo de la región. Aplican Términos y Condiciones APLICA PARA Referencia: 0064565 $ 71 , 86 x gr VECCHIO ☆ ¿Todavía tienes tu Tarjeta Cencosud? Solicítala en línea, úsala y obtén un . Aplican términos y condiciones. Solicítala aquí Términos más buscados 1. kefir alpina 2. muebles 3. leche 4. leche alqueria 5. san jorge 6. papel higiénico 7. arroz 8. café 9. cerveza 10. neveras", "features_text": "", "specifications_text": "", "benefits_text": "", "details_text": "", "other_sections": "", "sections": {"Descripción": ["Este producto es vendido, facturado y entregado por", "Cencosud - Colombia", "Los precios de los productos pueden cambiar dependiendo de la región.", "Aplican Términos y Condiciones", "APLICA PARA", "Referencia: 0064565", "$", "71", ",", "86", "x", "gr", "VECCHIO", "☆", "¿Todavía tienes tu Tarjeta Cencosud?", "Solicítala en línea, úsala y obtén un", ". Aplican términos y condiciones.", "Solicítala aquí", "Términos más buscados", "1.", "kefir alpina", "2.", "muebles", "3.", "leche", "4.", "leche alqueria", "5.", "san jorge", "6.", "papel higienico", "7.", "arroz", "8.", "cafe", "9.", "cerveza", "10.", "neveras"]}, "txt_path": "dataset/txt_limpios/696.txt", "html_path": "dataset/paginas_descargadas/696.html", "es_status": "ET", "category_canonical": "cafe", "decision": "keep", "match_score": 0.6, "reasons": "heuristic_default"}
{"source_id": "697", "title": "ASESORAMOS TU COMPRA: 📞(601) 6672004, lun a sab de 7am.a 7pm dom hasta las 6pm", "description": "Ingredientes Condición alimentaria Información nutricional Este producto es vendido, facturado y entregado por Cencosud - Colombia Los precios de los productos pueden cambiar dependiendo de la región. Aplican Términos y Condiciones Desactivados Referencia: 0001612 $ 5, 08 x gr RIOPAILA ☆ ¿Todavía tienes tu Tarjeta Cencosud? Solicítala en línea, úsala y obtén un . Aplican términos y condiciones. Solicítala aquí Términos más buscados 1. kefir alpina 2. muebles 3. leche 4. leche alqueria 5. san jorge 6. papel higiénico 7. arroz 8. café 9. cerveza 10. neveras", "breadcrumbs": "otras ciudades consulta aquí > 0001612", "price_raw": "5.08", "currency_raw": "COP", "url": "", "seller": "Desconocido", "availability": "unknown", "country": "CO", "product_name": "ASESORAMOS TU COMPRA: 📞(601) 6672004, lun a sab de 7am.a 7pm dom hasta las 6pm", "brand": "otras ciudades consulta aquí", "reference": "1612.0", "unit": "", "price_amount": 5.08, "price_currency": "COP", "price_symbol": "$", "price_text": "$5.08", "price_amount_filled": "5.08", "price_is_imputed": "False", "price_imputation_source": "original", "price_amount_usd": "0.0013", "price_amount_usd_filled": "0.0013", "fx_rate_local_per_usd": "4047.0", "fx_source": "from_colombia_cambio_dolar", "information_text": "", "description_text": "Ingredientes Condición alimentaria Información nutricional Este producto es vendido, facturado y entregado por Cencosud - Colombia Los precios de los productos pueden cambiar dependiendo de la región. Aplican Términos y Condiciones Desactivados Referencia: 0001612 $ 5, 08 x gr RIOPAILA ☆ ¿Todavía tienes tu Tarjeta Cencosud? Solicítala en línea, úsala y obtén un . Aplican términos y condiciones. Solicítala aquí Términos más buscados 1. kefir alpina 2. muebles 3. leche 4. leche alqueria 5. san jorge 6. papel higiénico 7. arroz 8. café 9. cerveza 10. neveras", "features_text": "", "specifications_text": "", "benefits_text": "", "details_text": "", "other_sections": "", "sections": {"Descripción": ["Ingredientes", "Condición alimentaria", "Información nutricional", "Este producto es vendido, facturado y entregado por", "Cencosud - Colombia", "Los precios de los productos pueden cambiar dependiendo de la región.", "Aplican Términos y Condiciones", "Desactivado", "Referencia: 0001612", "$", "5", ",", "08", "x", "gr", "RIOPAILA", "☆", "¿Todavía tienes tu Tarjeta Cencosud?", "Solicítala en línea, úsala y obtén un", ". Aplican términos y condiciones.", "Solicítala aquí", "Términos más buscados", "1.", "kefir alpina", "2.", "muebles", "3.", "leche", "4.", "leche alqueria", "5.", "san jorge", "6.", "papel higienico", "7.", "arroz", "8.", "cafe", "9.", "cerveza", "10.", "neveras"]}, "txt_path": "dataset/txt_limpios/697.txt", "html_path": "dataset/paginas_descargadas/697.html", "es_status": "ET", "category_canonical": "cafe", "decision": "keep", "match_score": 0.6, "reasons": "heuristic_default"}
{"source_id": "698", "title": "ASESORAMOS TU COMPRA: 📞(601) 6672004, lun a sab de 7am.a 7pm dom hasta las 6pm", "description": "En el contiene residuos químicos, impurezas o elementos artificiales, en el cambio del sabor natural de los alimentos. Este producto es vendido, facturado y entregado por Cencosud - Colombia Los precios de los productos pueden cambiar dependiendo de la región. Aplican Términos y Condiciones Desactivados Referencia: 0082359 $ 5 , 69 x gr MANUELITA ☆ ¿Todavía tienes tu Tarjeta Cencosud? Solicítala en línea, úsala y obtén un . Aplican términos y condiciones. Solicítala aquí Términos más buscados 1. kefir alpina 2. muebles 3. leche 4. leche alqueria 5. san jorge 6. papel higiénico 7. arroz 8. café 9. cerveza 10. neveras", "breadcrumbs": "otras ciudades consulta aquí > 0082359", "price_raw": "5.69", "currency_raw": "COP", "url": "", "seller": "Desconocido", "availability": "unknown", "country": "CO", "product_name": "ASESORAMOS TU COMPRA: 📞(601) 6672004, lun a sab de 7am.a 7pm dom hasta las 6pm", "brand": "otras ciudades consulta aquí", "reference": "82359.0", "unit": "", "price_amount": 5.69, "price_currency": "COP", "price_symbol": "$", "price_text": "$5.69", "price_amount_filled": "5.69", "price_is_imputed": "False", "price_imputation_source": "original", "price_amount_usd": "0.0014", "price_amount_usd_filled": "0.0014", "fx_rate_local_per_usd": "4047.0", "fx_source": "from_colombia_cambio_dolar", "information_text": "", "description_text": "En el contiene residuos químicos, impurezas o elementos artificiales, en el cambio del sabor natural de los alimentos. Este producto es vendido, facturado y entregado por Cencosud - Colombia Los precios de los productos pueden cambiar dependiendo de la región. Aplican Términos y Condiciones Desactivados Referencia: 0082359 $ 5 , 69 x gr MANUELITA ☆ ¿Todavía tienes tu Tarjeta Cencosud? Solicítala en línea, úsala y obtén un . Aplican términos y condiciones. Solicítala aquí Términos más buscados 1. kefir alpina 2. muebles 3. leche 4. leche alqueria 5. san jorge 6. papel higiénico 7. arroz 8. café 9. cerveza 10. neveras", "features_text": "", "specifications_text": "", "benefits_text": "", "details_text": "", "other_sections": "", "sections": {"Descripción": ["En el contiene residuos químicos, impurezas o elementos artificiales, en el cambio del sabor natural de los alimentos.", "Este producto es vendido, facturado y entregado por", "Cencosud - Colombia", "Los precios de los productos pueden cambiar dependiendo de la región.", "Aplican Términos y Condiciones", "Desactivado", "Referencia: 0082359", "$", "5", ",", "69", "x", "gr", "MANUELITA", "☆", "¿Todavía tienes tu Tarjeta Cencosud?", "Solicítala en línea, úsala y obtén un", ". Aplican términos y condiciones.", "Solicítala aquí", "Términos más buscados", "1.", "kefir alpina", "2.", "muebles", "3.", "leche", "4.", "leche alqueria", "5.", "san jorge", "6.", "papel higienico", "7.", "arroz", "8.", "cafe", "9.", "cerveza", "10.", "neveras"]}, "txt_path": "dataset/txt_limpios/698.txt", "html_path": "dataset/paginas_descargadas/698.html", "es_status": "ET", "category_canonical": "cafe", "decision": "keep", "match_score": 0.6, "reasons": "heuristic_default"}
{"source_id": "699", "title": "ASESORAMOS TU COMPRA: 📞(601) 6672004, lun a sab de 7am.a 7pm dom hasta las 6pm", "description": "", "breadcrumbs": "otras ciudades consulta aquí", "price_raw": "", "currency_raw": "COP", "url": "", "seller": "Desconocido", "availability": "unknown", "country": "CO", "product_name": "ASESORAMOS TU COMPRA: 📞(601) 6672004, lun a sab de 7am.a 7pm dom hasta las 6pm", "brand": "otras ciudades consulta aquí", "reference": "", "unit": "", "price_amount": null, "price_currency": "COP", "price_symbol": "", "price_text": "", "price_amount_filled": "100.78", "price_is_imputed": "True", "price_imputation_source": "country_mean", "price_amount_usd": "", "price_amount_usd_filled": "0.0249", "fx_rate_local_per_usd": "4047.0", "fx_source": "from_colombia_cambio_dolar", "information_text": "", "description_text": "", "features_text": "", "specifications_text": "", "benefits_text": "", "details_text": "", "other_sections": "", "sections": {}, "txt_path": "dataset/txt_limpios/699.txt", "html_path": "dataset/paginas_descargadas/699.html", "es_status": "ET", "category_canonical": "sin_categoria", "decision": "discard", "match_score": 0.3, "reasons": "no_category_detected;price_parse_failed"}
