source_id,title,description,breadcrumbs,price_raw,currency_raw,url,seller,availability,country,product_name,brand,reference,unit,price_amount,price_currency,price_symbol,price_text,price_amount_filled,price_is_imputed,price_imputation_source,price_amount_usd,price_amount_usd_filled,fx_rate_local_per_usd,fx_source,information_text,description_text,features_text,specifications_text,benefits_text,details_text,other_sections,sections,txt_path,html_path,es_status,category_canonical,decision,match_score,reasons
1315,Valoramos tu privacidad,"incap_ses_* sesión opt_out gdpr Caducada _GRECAPTCHA 6 meses Un CAPTCHA te ayuda a protegerte del spam y del descifrado de contraseñas pidiéndote que completes una simple prueba que demuestre que eres humano y no un ordenador que intenta acceder a una cuenta protegida con contraseña. __cf_bm 1 hora rc::a Nunca caduca rc::c rc::f rc::b Funcionales SnapABugRef 2 horas SnapABugHistory SnapABugUserAlias SnapABugVisit Analíticas ___utmvc Menos de un minuto _gcl_au 3 meses _ga 1 año 1 mes 4 días _gid 1 día _gat_UA-* 1 minuto _ga_* uid 1 año 24 días _hjSessionUser_* _hjSession_* _fbp demdex _hjTLDTest Rendimiento Anuncio 15 minutos personalization_id muc_ads cto_bundle IDE uuid2 anj CMID CMPS CMPRO dpm mv_tokens 14 días 1 minuto cf Used to present the visitor with relevant content advertisement. cip Presents the user with relevant content and advertisements, and facilitates real-time bidding for advertisers. cnac car callback criteo_write_test YSC VISITOR_INFO1_LIVE VISITOR_PRIVACY_METADATA _ttp ab Nezaradené do kategórie ck_flagpv Description is currently not available. visitor-id No description available. data-c-ts 1 mes data-c mv_tokens_eu-v1 am_tokens am_tokens_eu-v1 criteo tvid tv_UICR optout cto_tld_test XANDR_PANID gpp ttcsid_CU8M57RC77U66G5CN100 ttcsid __Secure-ROLLOUT_TOKEN Guardar mis preferencias Powered by Este gato no debería estar en esta caja, ni tú en esta página Puede que haya expirado. Intenta la búsqueda con otras palabras o tal vez puedas encontrarla desde el homepage. Live Chat",Personalizar,,,,Desconocido,unknown,UNKNOWN,Valoramos tu privacidad,Personalizar,,,,,,,234.19,True,country_mean,,234.1938,1.0,default_1usd,,"incap_ses_* sesión opt_out gdpr Caducada _GRECAPTCHA 6 meses Un CAPTCHA te ayuda a protegerte del spam y del descifrado de contraseñas pidiéndote que completes una simple prueba que demuestre que eres humano y no un ordenador que intenta acceder a una cuenta protegida con contraseña. __cf_bm 1 hora rc::a Nunca caduca rc::c rc::f rc::b Funcionales SnapABugRef 2 horas SnapABugHistory SnapABugUserAlias SnapABugVisit Analíticas ___utmvc Menos de un minuto _gcl_au 3 meses _ga 1 año 1 mes 4 días _gid 1 día _gat_UA-* 1 minuto _ga_* uid 1 año 24 días _hjSessionUser_* _hjSession_* _fbp demdex _hjTLDTest Rendimiento Anuncio 15 minutos personalization_id muc_ads cto_bundle IDE uuid2 anj CMID CMPS CMPRO dpm mv_tokens 14 días 1 minuto cf Used to present the visitor with relevant content advertisement. cip Presents the user with relevant content and advertisements, and facilitates real-time bidding for advertisers. cnac car callback criteo_write_test YSC VISITOR_INFO1_LIVE VISITOR_PRIVACY_METADATA _ttp ab Nezaradené do kategórie ck_flagpv Description is currently not available. visitor-id No description available. data-c-ts 1 mes data-c mv_tokens_eu-v1 am_tokens am_tokens_eu-v1 criteo tvid tv_UICR optout cto_tld_test XANDR_PANID gpp ttcsid_CU8M57RC77U66G5CN100 ttcsid __Secure-ROLLOUT_TOKEN Guardar mis preferencias Powered by Este gato no debería estar en esta caja, ni tú en esta página Puede que haya expirado. Intenta la búsqueda con otras palabras o tal vez puedas encontrarla desde el homepage. Live Chat",,,,,,"{""Descripción"": [""incap_ses_*"", ""sesión"", ""opt_out"", ""gdpr"", ""Caducada"", ""_GRECAPTCHA"", ""6 meses"", ""Un CAPTCHA te ayuda a protegerte del spam y del descifrado de contraseñas pidiéndote que completes una simple prueba que demuestre que eres humano y no un ordenador que intenta acceder a una cuenta protegida con contraseña."", ""__cf_bm"", ""1 hora"", ""rc::a"", ""Nunca caduca"", ""rc::c"", ""rc::f"", ""rc::b"", ""Funcionales"", ""SnapABugRef"", ""2 horas"", ""SnapABugHistory"", ""SnapABugUserAlias"", ""SnapABugVisit"", ""Analíticas"", ""___utmvc"", ""Menos de un minuto"", ""_gcl_au"", ""3 meses"", ""_ga"", ""1 año 1 mes 4 días"", ""_gid"", ""1 día"", ""_gat_UA-*"", ""1 minuto"", ""_ga_*"", ""uid"", ""1 año 24 días"", ""_hjSessionUser_*"", ""_hjSession_*"", ""_fbp"", ""demdex"", ""_hjTLDTest"", ""Rendimiento"", ""Anuncio"", ""15 minutos"", ""personalization_id"", ""muc_ads"", ""cto_bundle"", ""IDE"", ""uuid2"", ""anj"", ""CMID"", ""CMPS"", ""CMPRO"", ""dpm"", ""mv_tokens"", ""14 días 1 minuto"", ""cf"", ""Used to present the visitor with relevant content advertisement."", ""cip"", ""Presents the user with relevant content and advertisements, and facilitates real-time bidding for advertisers."", ""cnac"", ""car"", ""callback"", ""criteo_write_test"", ""YSC"", ""VISITOR_INFO1_LIVE"", ""VISITOR_PRIVACY_METADATA"", ""_ttp"", ""ab"", ""Nezaradené do kategórie"", ""ck_flagpv"", ""Description is currently not available."", ""visitor-id"", ""No description available."", ""data-c-ts"", ""1 mes"", ""data-c"", ""mv_tokens_eu-v1"", ""am_tokens"", ""am_tokens_eu-v1"", ""criteo"", ""tvid"", ""tv_UICR"", ""optout"", ""cto_tld_test"", ""XANDR_PANID"", ""gpp"", ""ttcsid_CU8M57RC77U66G5CN100"", ""ttcsid"", ""__Secure-ROLLOUT_TOKEN"", ""Guardar mis preferencias"", ""Powered by"", ""Este gato no debería estar en esta caja, ni tú en esta página"", ""Puede que haya expirado. Intenta la búsqueda con otras palabras o tal vez puedas encontrarla desde el homepage."", ""Live Chat""]}",dataset/txt_limpios/1315.txt,dataset/paginas_descargadas/1315.html,EN,sin_categoria,discard,0.30,no_category_detected;price_parse_failed
1736,Ver todo,,Selecciona una ubicación > 454 gr,,USD,,Desconocido,unknown,US,Ver todo,Selecciona una ubicación,,454 gr,,USD,,,2.06,True,country_mean,,2.0638,1.0,default_1usd,,,Descripción del producto | Compra Frijoles Nutritos 454 gr Negro 786465012153.  Vive la experiencia de comprar en el super que te ofrece las mejores ofertas y precios en todo Panamá. | FICHA TÉCNICA | COMPLETA | TU COMPRA | TAMBIÉN TE PUEDE | INTERESAR | ¿Quieres recibir ofertas y promociones? | Suscribirme | SITIO SEGURO | © Super Xtra. All Rights Reserved,,,,,"{""Características"": [""Descripción del producto"", ""Compra Frijoles Nutritos 454 gr Negro 786465012153.  Vive la experiencia de comprar en el super que te ofrece las mejores ofertas y precios en todo Panamá."", ""FICHA TÉCNICA"", ""COMPLETA"", ""TU COMPRA"", ""TAMBIÉN TE PUEDE"", ""INTERESAR"", ""¿Quieres recibir ofertas y promociones?"", ""Suscribirme"", ""SITIO SEGURO"", ""© Super Xtra. All Rights Reserved""]}",dataset/txt_limpios/1736.txt,dataset/paginas_descargadas/1736.html,EN,sin_categoria,discard,0.30,no_category_detected;price_parse_failed
1715,Verduras Congeladas,"Papas Congeladas Duquesas Frutos del Maipo 1kg | Actualizado al: 12-05-2025 Ingredientes: Papas, Aceite de maravilla, Sal, Dextrosa, Pimienta blanca, Hidroxipropilmetilcelulosa. Certificados: Libre de Gluten / Sin TACC Apto para APLV Libre de Lactosa Libre de Soya Libre de Huevo Libre de Peces Libre de Mariscos Libre de Maní Libre de Frutos Secos Libre de Nueces Libre de Sulfitos Libre de Trigo Vegano Vegetariano Porción: 13 Unidades Aprox (85g) Porciones por envase: 12 100g 1 Porción Energía (kCal) 159 135.2 Proteínas (g) 2.4 2 Grasas Totales 6.7 5.7 Grasas saturadas (g) 0.7 0.6 Grasas monoinsaturadas (g) 2.3 Grasas poliinsaturadas (g) 3.7 3.1 Grasas trans (g) 0 Colesterol (mg) 10 8.5 Hidratos de carbono disponibles 22.3 19 Azúcares totales (g) 0.5 Fibra 2.6 2.2 Sodio 305 259.3 Importante: La información del empaque y/o contenido del producto final puede diferir respecto a lo que mostramos en nuestro sitio web, tanto a nivel de ingredientes, trazas, información nutricional, sellos, modo de uso y/o modo de conservación. Usted no debe basarse únicamente en la información que se muestra en nuestro sitio web y siempre debe leer las etiquetas, advertencias e instrucciones antes de usar o consumir un producto. Información obtenida de Productos similares Papas Prefritas Congeladas Frutos de Maipo 1 Kg -15% Ver producto Papas en Cubo Congeladas Frutos de Maipo 750 g Papas Duquesas Sabor Pastelera Congeladas Frutos del Maipo 350 g Papas en Rodajas Congeladas Frutos de Maipo 500 g Papas Gajos con Piel Congeladas Frutos de Maipo 500 g Papas Prefritas Duquesas Congeladas Tottus 1 Kg -35% Papas Duquesas Congeladas Minutos Verde 1 Kg -18% Porotos Granados Congelados Frutos de Maipo 500 g Zapallo en Cubo Congelado Frutos de Maipo 350 g Papas Prefritas Congeladas Minuto Verde 1 Kg Choclo en Grano Congelado Frutos de Maipo 500 g Cebolla en Cubo Congelada Frutos de Maipo 150 g Pasta de Choclo con Albahaca Congelada Frutos del Maipo 1 Kg Sofrito Congelado Frutos del Maipo 150 g Papas Prefritas Congeladas Minuto Verde 500 g Mix de Pimentones Congelados Frutos del Maipo 150 g Champiñones Laminados Congelados Frutos del Maipo 350 g Pasta de Choclo con Albahaca Congelada Frutos del Maipo 500 g Papas Prefritas Fina Congeladas Minuto Verde 800 g -24% ¡Juntos son mejores! Choclo en Granos Congelados Minuto Verde 500 g Choclo en Granos Congelado Tottus 500 g -30% Nuggets de Pollo Congelados Super Pollo 1 Kg -43% Poroto Verde -19% Choclo Grano Sofrito con Ajo Congelado Minuto Verde 150 g Hamburguesa de Vacuno La Crianza 100 g -46% Nugget de Pollo Bolsa Super Pollo 275 g -38%",FRUTOS DEL MAIPO > 1 Kg,3.99,,,Desconocido,unknown,UNKNOWN,Verduras Congeladas,FRUTOS DEL MAIPO,,1 Kg,3.99,,,3.99,3.99,False,original,3.99,3.99,1.0,default_1usd,,"Papas Congeladas Duquesas Frutos del Maipo 1kg | Actualizado al: 12-05-2025 Ingredientes: Papas, Aceite de maravilla, Sal, Dextrosa, Pimienta blanca, Hidroxipropilmetilcelulosa. Certificados: Libre de Gluten / Sin TACC Apto para APLV Libre de Lactosa Libre de Soya Libre de Huevo Libre de Peces Libre de Mariscos Libre de Maní Libre de Frutos Secos Libre de Nueces Libre de Sulfitos Libre de Trigo Vegano Vegetariano Porción: 13 Unidades Aprox (85g) Porciones por envase: 12 100g 1 Porción Energía (kCal) 159 135.2 Proteínas (g) 2.4 2 Grasas Totales 6.7 5.7 Grasas saturadas (g) 0.7 0.6 Grasas monoinsaturadas (g) 2.3 Grasas poliinsaturadas (g) 3.7 3.1 Grasas trans (g) 0 Colesterol (mg) 10 8.5 Hidratos de carbono disponibles 22.3 19 Azúcares totales (g) 0.5 Fibra 2.6 2.2 Sodio 305 259.3 Importante: La información del empaque y/o contenido del producto final puede diferir respecto a lo que mostramos en nuestro sitio web, tanto a nivel de ingredientes, trazas, información nutricional, sellos, modo de uso y/o modo de conservación. Usted no debe basarse únicamente en la información que se muestra en nuestro sitio web y siempre debe leer las etiquetas, advertencias e instrucciones antes de usar o consumir un producto. Información obtenida de Productos similares Papas Prefritas Congeladas Frutos de Maipo 1 Kg -15% Ver producto Papas en Cubo Congeladas Frutos de Maipo 750 g Papas Duquesas Sabor Pastelera Congeladas Frutos del Maipo 350 g Papas en Rodajas Congeladas Frutos de Maipo 500 g Papas Gajos con Piel Congeladas Frutos de Maipo 500 g Papas Prefritas Duquesas Congeladas Tottus 1 Kg -35% Papas Duquesas Congeladas Minutos Verde 1 Kg -18% Porotos Granados Congelados Frutos de Maipo 500 g Zapallo en Cubo Congelado Frutos de Maipo 350 g Papas Prefritas Congeladas Minuto Verde 1 Kg Choclo en Grano Congelado Frutos de Maipo 500 g Cebolla en Cubo Congelada Frutos de Maipo 150 g Pasta de Choclo con Albahaca Congelada Frutos del Maipo 1 Kg Sofrito Congelado Frutos del Maipo 150 g Papas Prefritas Congeladas Minuto Verde 500 g Mix de Pimentones Congelados Frutos del Maipo 150 g Champiñones Laminados Congelados Frutos del Maipo 350 g Pasta de Choclo con Albahaca Congelada Frutos del Maipo 500 g Papas Prefritas Fina Congeladas Minuto Verde 800 g -24% ¡Juntos son mejores! Choclo en Granos Congelados Minuto Verde 500 g Choclo en Granos Congelado Tottus 500 g -30% Nuggets de Pollo Congelados Super Pollo 1 Kg -43% Poroto Verde -19% Choclo Grano Sofrito con Ajo Congelado Minuto Verde 150 g Hamburguesa de Vacuno La Crianza 100 g -46% Nugget de Pollo Bolsa Super Pollo 275 g -38%",,,,,,"{""Descripción"": [""Papas Congeladas Duquesas Frutos del Maipo"", ""1kg | Actualizado al: 12-05-2025"", ""Ingredientes: Papas, Aceite de maravilla, Sal, Dextrosa, Pimienta blanca, Hidroxipropilmetilcelulosa."", ""Certificados: Libre de Gluten / Sin TACC"", ""Apto para APLV"", ""Libre de Lactosa"", ""Libre de Soya"", ""Libre de Huevo"", ""Libre de Peces"", ""Libre de Mariscos"", ""Libre de Maní"", ""Libre de Frutos Secos"", ""Libre de Nueces"", ""Libre de Sulfitos"", ""Libre de Trigo"", ""Vegano"", ""Vegetariano"", ""Porción: 13 Unidades Aprox (85g)"", ""Porciones por envase: 12"", ""100g"", ""1 Porción"", ""Energía"", ""(kCal)"", ""159"", ""135.2"", ""Proteínas"", ""(g)"", ""2.4"", ""2"", ""Grasas Totales"", ""6.7"", ""5.7"", ""Grasas saturadas (g)"", ""0.7"", ""0.6"", ""Grasas monoinsaturadas (g)"", ""2.3"", ""Grasas poliinsaturadas (g)"", ""3.7"", ""3.1"", ""Grasas trans (g)"", ""0"", ""Colesterol"", ""(mg)"", ""10"", ""8.5"", ""Hidratos de carbono disponibles"", ""22.3"", ""19"", ""Azúcar total (g)"", ""0.5"", ""Fibra"", ""2.6"", ""2.2"", ""Sodio"", ""305"", ""259.3"", ""Importante: La información del empaque y/o contenido del producto final puede diferir respecto a lo que mostramos en nuestro sitio web, tanto a nivel de ingredientes, trazas, información nutricional, sellos, modo de uso y/o modo de conservación. Usted debe basarse únicamente en la información que se muestra en nuestro sitio web y siempre debe leer las etiquetas, advertencias y instrucciones antes de usar el consumo de un producto."", ""Información obtenida de"", ""Productos similares"", ""Papas Prefritas Congeladas Frutos de Maipo 1 Kg"", ""-15%"", ""Ver producto"", ""Papas en Cubo Congeladas Frutos de Maipo 750 g"", ""Papas Duquesas Sabor Pastelera Congeladas Frutos del Maipo 350 g"", ""Papas en Rodajas Congeladas Frutos de Maipo 500 g"", ""Papas Gajos con Piel Congeladas Frutos de Maipo 500 g"", ""Papas Prefritas Duquesas Congeladas Tottus 1 Kg"", ""-35%"", ""Papas Duquesas Congeladas Minutos Verde 1 Kg"", ""-18%"", ""Porotos Granados Congelados Frutos de Maipo 500 g"", ""Zapallo en Cubo Congelado Frutos de Maipo 350 g"", ""Papas Prefritas Congeladas Minuto Verde 1 Kg"", ""Choclo en Grano Congelado Frutos de Maipo 500 g"", ""Cebolla en Cubo Congelada Frutos de Maipo 150 g"", ""Pasta de Choclo con Albahaca Congelada Frutos del Maipo 1 Kg"", ""Sofrito Congelado Frutos del Maipo 150 g"", ""Papas Prefritas Congeladas Minuto Verde 500 g"", ""Mix de Pimentones Congelados Frutos del Maipo 150 g"", ""Champiñones Laminados Congelados Frutos del Maipo 350 g"", ""Pasta de Choclo con Albahaca Congelada Frutos del Maipo 500 g"", ""Papas Prefritas Fina Congeladas Minuto Verde 800 g"", ""-24%"", ""¡Juntos son mejores!"", ""Choclo en Granos Congelados Minuto Verde 500 g"", ""Choclo en Granos Congelado Tottus 500 g"", ""-30%"", ""Nuggets de Pollo Congelados Super Pollo 1 Kg"", ""-43%"", ""Poroto Verde"", ""-19%"", ""Choclo Grano"", ""Sofrito con Ajo Congelado Minuto Verde 150 g"", ""Hamburguesa de Vacuno La Crianza 100 g"", ""-46%"", ""Nugget de Pollo Bolsa Super Pollo 275 g"", ""-38%""]}",dataset/txt_limpios/1715.txt,dataset/paginas_descargadas/1715.html,ET,papa,keep,0.60,heuristic_default
124,Verifica tu identidad,,,,,,Desconocido,unknown,UNKNOWN,Verifica tu identidad,,,,,,,,234.19,True,country_mean,,234.1938,1.0,default_1usd,,,,,,,,{},dataset/txt_limpios/124.txt,dataset/paginas_descargadas/124.html,EN,sin_categoria,discard,0.30,no_category_detected;price_parse_failed
128,Verifica tu identidad,,,,,,Desconocido,unknown,UNKNOWN,Verifica tu identidad,,,,,,,,234.19,True,country_mean,,234.1938,1.0,default_1usd,,,,,,,,{},dataset/txt_limpios/128.txt,dataset/paginas_descargadas/128.html,EN,sin_categoria,discard,0.30,no_category_detected;price_parse_failed
130,Verifica tu identidad,,,,,,Desconocido,unknown,UNKNOWN,Verifica tu identidad,,,,,,,,234.19,True,country_mean,,234.1938,1.0,default_1usd,,,,,,,,{},dataset/txt_limpios/130.txt,dataset/paginas_descargadas/130.html,EN,sin_categoria,discard,0.30,no_category_detected;price_parse_failed
148,Verifica tu identidad,,,,,,Desconocido,unknown,UNKNOWN,Verifica tu identidad,,,,,,,,234.19,True,country_mean,,234.1938,1.0,default_1usd,,,,,,,,{},dataset/txt_limpios/148.txt,dataset/paginas_descargadas/148.html,EN,sin_categoria,discard,0.30,no_category_detected;price_parse_failed
149,Verifica tu identidad,,,,,,Desconocido,unknown,UNKNOWN,Verifica tu identidad,,,,,,,,234.19,True,country_mean,,234.1938,1.0,default_1usd,,,,,,,,{},dataset/txt_limpios/149.txt,dataset/paginas_descargadas/149.html,EN,sin_categoria,discard,0.30,no_category_detected;price_parse_failed
150,Verifica tu identidad,,,,,,Desconocido,unknown,UNKNOWN,Verifica tu identidad,,,,,,,,234.19,True,country_mean,,234.1938,1.0,default_1usd,,,,,,,,{},dataset/txt_limpios/150.txt,dataset/paginas_descargadas/150.html,EN,sin_categoria,discard,0.30,no_category_detected;price_parse_failed
151,Verifica tu identidad,,,,,,Desconocido,unknown,UNKNOWN,Verifica tu identidad,,,,,,,,234.19,True,country_mean,,234.1938,1.0,default_1usd,,,,,,,,{},dataset/txt_limpios/151.txt,dataset/paginas_descargadas/151.html,EN,sin_categoria,discard,0.30,no_category_detected;price_parse_failed
152,Verifica tu identidad,,,,,,Desconocido,unknown,UNKNOWN,Verifica tu identidad,,,,,,,,234.19,True,country_mean,,234.1938,1.0,default_1usd,,,,,,,,{},dataset/txt_limpios/152.txt,dataset/paginas_descargadas/152.html,EN,sin_categoria,discard,0.30,no_category_detected;price_parse_failed
1528,Verifica tu identidad,,,,,,Desconocido,unknown,UNKNOWN,Verifica tu identidad,,,,,,,,234.19,True,country_mean,,234.1938,1.0,default_1usd,,,,,,,,{},dataset/txt_limpios/1528.txt,dataset/paginas_descargadas/1528.html,EN,sin_categoria,discard,0.30,no_category_detected;price_parse_failed
1529,Verifica tu identidad,,,,,,Desconocido,unknown,UNKNOWN,Verifica tu identidad,,,,,,,,234.19,True,country_mean,,234.1938,1.0,default_1usd,,,,,,,,{},dataset/txt_limpios/1529.txt,dataset/paginas_descargadas/1529.html,EN,sin_categoria,discard,0.30,no_category_detected;price_parse_failed
153,Verifica tu identidad,,,,,,Desconocido,unknown,UNKNOWN,Verifica tu identidad,,,,,,,,234.19,True,country_mean,,234.1938,1.0,default_1usd,,,,,,,,{},dataset/txt_limpios/153.txt,dataset/paginas_descargadas/153.html,EN,sin_categoria,discard,0.30,no_category_detected;price_parse_failed
1531,Verifica tu identidad,,,,,,Desconocido,unknown,UNKNOWN,Verifica tu identidad,,,,,,,,234.19,True,country_mean,,234.1938,1.0,default_1usd,,,,,,,,{},dataset/txt_limpios/1531.txt,dataset/paginas_descargadas/1531.html,EN,sin_categoria,discard,0.30,no_category_detected;price_parse_failed
1533,Verifica tu identidad,,,,,,Desconocido,unknown,UNKNOWN,Verifica tu identidad,,,,,,,,234.19,True,country_mean,,234.1938,1.0,default_1usd,,,,,,,,{},dataset/txt_limpios/1533.txt,dataset/paginas_descargadas/1533.html,EN,sin_categoria,discard,0.30,no_category_detected;price_parse_failed
1535,Verifica tu identidad,,,,,,Desconocido,unknown,UNKNOWN,Verifica tu identidad,,,,,,,,234.19,True,country_mean,,234.1938,1.0,default_1usd,,,,,,,,{},dataset/txt_limpios/1535.txt,dataset/paginas_descargadas/1535.html,EN,sin_categoria,discard,0.30,no_category_detected;price_parse_failed
1537,Verifica tu identidad,,,,,,Desconocido,unknown,UNKNOWN,Verifica tu identidad,,,,,,,,234.19,True,country_mean,,234.1938,1.0,default_1usd,,,,,,,,{},dataset/txt_limpios/1537.txt,dataset/paginas_descargadas/1537.html,EN,sin_categoria,discard,0.30,no_category_detected;price_parse_failed
154,Verifica tu identidad,,,,,,Desconocido,unknown,UNKNOWN,Verifica tu identidad,,,,,,,,234.19,True,country_mean,,234.1938,1.0,default_1usd,,,,,,,,{},dataset/txt_limpios/154.txt,dataset/paginas_descargadas/154.html,EN,sin_categoria,discard,0.30,no_category_detected;price_parse_failed
1543,Verifica tu identidad,,,,,,Desconocido,unknown,UNKNOWN,Verifica tu identidad,,,,,,,,234.19,True,country_mean,,234.1938,1.0,default_1usd,,,,,,,,{},dataset/txt_limpios/1543.txt,dataset/paginas_descargadas/1543.html,EN,sin_categoria,discard,0.30,no_category_detected;price_parse_failed
155,Verifica tu identidad,,,,,,Desconocido,unknown,UNKNOWN,Verifica tu identidad,,,,,,,,234.19,True,country_mean,,234.1938,1.0,default_1usd,,,,,,,,{},dataset/txt_limpios/155.txt,dataset/paginas_descargadas/155.html,EN,sin_categoria,discard,0.30,no_category_detected;price_parse_failed
1551,Verifica tu identidad,,,,,,Desconocido,unknown,UNKNOWN,Verifica tu identidad,,,,,,,,234.19,True,country_mean,,234.1938,1.0,default_1usd,,,,,,,,{},dataset/txt_limpios/1551.txt,dataset/paginas_descargadas/1551.html,EN,sin_categoria,discard,0.30,no_category_detected;price_parse_failed
1552,Verifica tu identidad,,,,,,Desconocido,unknown,UNKNOWN,Verifica tu identidad,,,,,,,,234.19,True,country_mean,,234.1938,1.0,default_1usd,,,,,,,,{},dataset/txt_limpios/1552.txt,dataset/paginas_descargadas/1552.html,EN,sin_categoria,discard,0.30,no_category_detected;price_parse_failed
1558,Verifica tu identidad,,,,,,Desconocido,unknown,UNKNOWN,Verifica tu identidad,,,,,,,,234.19,True,country_mean,,234.1938,1.0,default_1usd,,,,,,,,{},dataset/txt_limpios/1558.txt,dataset/paginas_descargadas/1558.html,EN,sin_categoria,discard,0.30,no_category_detected;price_parse_failed
156,Verifica tu identidad,,,,,,Desconocido,unknown,UNKNOWN,Verifica tu identidad,,,,,,,,234.19,True,country_mean,,234.1938,1.0,default_1usd,,,,,,,,{},dataset/txt_limpios/156.txt,dataset/paginas_descargadas/156.html,EN,sin_categoria,discard,0.30,no_category_detected;price_parse_failed
