source_id,title,description,breadcrumbs,price_raw,currency_raw,url,seller,availability,country,product_name,brand,reference,unit,price_amount,price_currency,price_symbol,price_text,price_amount_filled,price_is_imputed,price_imputation_source,price_amount_usd,price_amount_usd_filled,fx_rate_local_per_usd,fx_source,information_text,description_text,features_text,specifications_text,benefits_text,details_text,other_sections,sections,txt_path,html_path,es_status,category_canonical,decision,match_score,reasons
1050,colaborar con nuestros estudios para marketing. También puede configurarlas.,Información de la marca,que podemos ofrecer. > 150gr,16.92,PEN,,Desconocido,unknown,PE,colaborar con nuestros estudios para marketing. También puede configurarlas.,que podemos ofrecer.,,150gr,16.92,PEN,S/,S/16.92,16.92,False,original,4.7662,4.7662,3.55,from_peru_cambio_dolar,,Información de la marca,"Presentación/Empaque | Lata | Porción sugerida | 100 g | Alérgenos Declarados | CONTIENE PESCADO Y SOYA | Calorías Porción | 133.3 | Certificaciones | DOLPHIN SAFE | Contenido Escurrido | Grasas Porción | 2.3 | Medio De Conservación | UNA VEZ ABIERTO EL ENVASE, TRANSVASAR EL CONTENIDO A OTRO RECIPIENTE CON TAPA Y MANTENER EN REFRIGERACION | Proteínas Porción | 28.1 | Advertencias De Almacenamiento | ALMACENAR EN LUGAR FRESCO Y SECO A TEMPERATURA AMBIENTE | Contenido Neto | 150 g | Denominación/Variedad | BELL'S TROZOS ATUN EN ACEITE LA 150GR | Revisa todo | Componentes del Producto | Vendido por | plaza Vea | En caso de que algo te guste: Puedes revisar nuestras | Políticas de cambios y/o devoluciones | y hacerlas efectivas en todas nuestras tiendas. | Productos | que te pueden interesar | Recomendado para ti",,,,,"{""Descripción"": [""Información de la marca""], ""Características"": [""Presentación/Empaque"", ""Lata"", ""Porción sugerida"", ""100 g"", ""Alérgenos Declarados"", ""CONTIENE PESCADO Y SOYA"", ""Calorías Porción"", ""133.3"", ""Certificaciones"", ""DOLPHIN SAFE"", ""Contenido Escurrido"", ""Grasas Porción"", ""2.3"", ""Medio de conservación"", ""UNA VEZ ABIERTO EL ENVASE, TRANSVASAR EL CONTENIDO A OTRO RECIPIENTE CON TAPA Y MANTENER EN REFRIGERACION"", ""Proteínas Porción"", ""28.1"", ""Advertencias De Almacenamiento"", ""ALMACENAR EN LUGAR FRESCO Y SECO A TEMPERATURA AMBIENTE"", ""Contenido Neto"", ""150 g"", ""Denominación/Variedad"", ""BELL'S TROZOS ATUN EN ACEITE LA 150GR"", ""Revisa todo"", ""Componentes del Producto"", ""Vendido por"", ""plazaVea"", ""En caso algo no vaya como gustes: Puedes revisar nuestras"", ""Politicas de cambios y/o devoluciones"", ""y hacerlas efectivas en todas nuestras tiendas."", ""Productos"", ""que te pueden interesar"", ""Recomendado para ti""]}",dataset/txt_limpios/1050.txt,dataset/paginas_descargadas/1050.html,ET,sin_categoria,discard,0.30,no_category_detected
1051,colaborar con nuestros estudios para marketing. También puede configurarlas.,Información de la marca,que podemos ofrecer. > 140g,16.92,PEN,,Desconocido,unknown,PE,colaborar con nuestros estudios para marketing. También puede configurarlas.,que podemos ofrecer.,,140g,16.92,PEN,S/,S/16.92,16.92,False,original,4.7662,4.7662,3.55,from_peru_cambio_dolar,,Información de la marca,"Presentación/Empaque | Lata | Porción sugerida | 100 GR | Alérgenos Declarados | Sí | Azúcares Porción | 113 | Carbohidratos Porción | Descripción Nutricional | OBTENIDA POR DIGESA | Proteínas Porción | 26.3 GR | Sodio Porción | 249 GR | Advertencias De Almacenamiento | Mantener la temperatura ambiente/ conservar en un lugar fresco | Contenido Neto | 140G | Denominación/Variedad | GLORIA, CONSERVAS, PESCADO, ALIMENTO, FILETE, ATÚN, AGUA, LATA | Revisa todo | Componentes del Producto | Vendido por | plaza Vea | En caso de que algo te guste: Puedes revisar nuestras | Políticas de cambios y/o devoluciones | y hacerlas efectivas en todas nuestras tiendas. | Productos | que te pueden interesar | Recomendado para ti",,,,,"{""Descripción"": [""Información de la marca""], ""Características"": [""Presentación/Empaque"", ""Lata"", ""Porción sugerida"", ""100 GR"", ""Alérgenos Declarados"", ""Sí"", ""Azúcar por porción"", ""0"", ""Calorías Porción"", ""113"", ""Carbohidratos Porción"", ""Descripción Nutricional"", ""OBTENIDA POR DIGESA"", ""Proteínas Porción"", ""26.3 GR"", ""Sodio Porción"", ""249 GR"", ""Advertencias De Almacenamiento"", ""Mantener a temperatura ambiente/ conservar en un lugar fresco"", ""Contenido Neto"", ""140G"", ""Denominación/Variedad"", ""GLORIA, CONSERVAS, PESCADO, ALIMENTO, FILETE, ATÚN, AGUA, LATA"", ""Revisa todo"", ""Componentes del Producto"", ""Vendido por"", ""plazaVea"", ""En caso algo no vaya como gustes: Puedes revisar nuestras"", ""Politicas de cambios y/o devoluciones"", ""y hacerlas efectivas en todas nuestras tiendas."", ""Productos"", ""que te pueden interesar"", ""Recomendado para ti""]}",dataset/txt_limpios/1051.txt,dataset/paginas_descargadas/1051.html,ET,sin_categoria,discard,0.30,no_category_detected
1052,colaborar con nuestros estudios para marketing. También puede configurarlas.,Información de la marca,que podemos ofrecer. > 140g,16.92,PEN,,Desconocido,unknown,PE,colaborar con nuestros estudios para marketing. También puede configurarlas.,que podemos ofrecer.,,140g,16.92,PEN,S/,S/16.92,16.92,False,original,4.7662,4.7662,3.55,from_peru_cambio_dolar,,Información de la marca,"Presentación/Empaque | Lata | Porción sugerida | 1 | Alérgenos Declarados | Atun | Azúcares Porción | 0G | Calorías Porción | 210 KCAL | Carbohidratos Porción | Descripción Nutricional | Trozos de atún | Primor 140g | Grasas Porción | 11G | Proteínas Porción | 28G | Sodio Porción | 390MG | Advertencias De Almacenamiento | A temperatura ambiente, en lugar fresco y seco. Una vez abierto vaciar el contenido en otro recipiente y mantener refrigerado. | Contenido Neto | 140g | Revisa todo | Componentes del Producto | Vendido por | plaza Ver | En caso de que algo te guste: Puedes revisar nuestras | Políticas de cambios y/o devoluciones | y hacerlas efectivas en todas nuestras tiendas. | Productos | que te pueden interesar | Recomendado para ti",,,,,"{""Descripción"": [""Información de la marca""], ""Características"": [""Presentación/Empaque"", ""Lata"", ""Porción sugerida"", ""1"", ""Alérgenos Declarados"", ""Atun"", ""Azúcar por porción"", ""0G"", ""Calorías Porción"", ""210 KCAL"", ""Carbohidratos Porción"", ""Descripción Nutricional"", ""Trozos de atún - Primor 140g"", ""Grasas Porción"", ""11G"", ""Proteínas Porción"", ""28G"", ""Sodio Porción"", ""390MG"", ""Advertencias De Almacenamiento"", ""A temperatura ambiente, en lugar fresco y seco. Una vez abierto vaciar el contenido en otro recipiente y mantener refrigerado."", ""Contenido Neto"", ""140g"", ""Revisa todo"", ""Componentes del Producto"", ""Vendido por"", ""plazaVea"", ""En caso algo no vaya como gustes: Puedes revisar nuestras"", ""Politicas de cambios y/o devoluciones"", ""y hacerlas efectivas en todas nuestras tiendas."", ""Productos"", ""que te pueden interesar"", ""Recomendado para ti""]}",dataset/txt_limpios/1052.txt,dataset/paginas_descargadas/1052.html,ET,sin_categoria,discard,0.30,no_category_detected
891,Comida congelada,Papas duquesa congeladas Frutos del Maipo 1 Kg,frutos del maipo > 1 Kg,4.19,,,Desconocido,unknown,UNKNOWN,Comida congelada,frutos del maipo,,1 Kg,4.19,,$,$4.19,4.19,False,original,4.19,4.19,1.0,default_1usd,,Papas duquesa congeladas Frutos del Maipo 1 Kg,,,,,,"{""Descripción"": [""Papas duquesa congeladas Frutos del Maipo 1 Kg""]}",dataset/txt_limpios/891.txt,dataset/paginas_descargadas/891.html,EN,papa,keep,0.60,heuristic_default
392,COMUNICADO IMPORTANTE!,,"Caro cliente, > 2l",5.99,BRL,,Desconocido,unknown,BR,COMUNICADO IMPORTANTE!,"Caro cliente,",,2l,5.99,BRL,R$,"R$5,99",5.99,False,original,1.0995,1.0995,5.448,from_brasil_cambio_dolar,,,"Comentarios de los clientes | Descripción del producto | El Refrigerante de Guaraná Kuat es conocido por su sabor irresistible y refrescante. Esta es una bebida que viene en un envase de 2 litros, ideal para compartir con amigos y familiares, y su embalaje es una botella PET, que debe ser conservada en un lugar fresco y seco, lejos del calor y de la luz directa para mantener la calidad del producto. El Refrigerante de Guaraná Kuat es perfecto para matar la sede y proporcionar momentos de refracncia, siendo una excelente elección para fiestas, reuniones familiares o simplemente para disfrutar en casa. Al elegir ese Refrigerante de Guaraná Kuat, opta por un producto de calidad que es ampliamente apreciado y reconocido. | Ver más | Productos Relacionados | Refrigerante Fanta Misterio Beetlejuice Lata 310ml | Disponible en breve | Refrigerante Fanta Misterio Lata 350ml | Refrigerante Sprite s/ Garrafa Retornable 2l | Refrigerante Fanta Naranja Splash 500ml | Refrigerante Fanta Guaraná Pet 200ml | Refrigerante It Naranja Pet 2 Litros | Refrigerante Pepsi Pet 2 Litros | Refrigerante Pepsi Pet 2 Litro | 7 | 59 | Refrigerante Soda Limonada Antarctica Lata 350ml | 2 | Refrigerante Guaraná Antarctica Lata 269ml | Refrigerante Pepsi Lata 350ml | 3 | 29 | Términos más buscados | 1o | leche | 2o | café | 3o | cerveza | 4o | jabón polvo | 5o | arroz | 6o | leche condensada | 7o | yogur | 8o | huevo | 9o | pollo | 10o | oleo | Su privacidad | Siempre activos | Back Button | Back | Vendor Search | Filter Button | Consent | Leg. Interest | checkbox label | label | Clear | Apply | Cancel | Guardar configuración | Rechazar todos | Configurar privacidad",,,,,"{""Características"": [""Comentarios de los clientes"", ""Descripción del producto"", ""El Refrigerante de Guaraná Kuat es conocido por su sabor irresistible y refrescante. Esta es una bebida que viene en un envase de 2 litros, ideal para compartir con amigos y familiares, y su embalaje es una botella PET, que debe ser conservada en un lugar fresco y seco, lejos del calor y de la luz directa para mantener la calidad del producto. El Refrigerante de Guaraná Kuat es perfecto para matar la sede y proporcionar momentos de refracncia, siendo una excelente elección para fiestas, reuniones familiares o simplemente para disfrutar en casa. Al elegir ese Refrigerante de Guaraná Kuat, opta por un producto de calidad que es ampliamente apreciado y reconocido."", ""Ver mais"", ""Productos relacionados"", ""Refrigerante Fanta Misterio Beetlejuice Lata 310ml"", ""Disponible en breve"", ""Refrigerante Fanta Misterio Lata 350ml"", ""Refrigerante Sprite s/ Garrafa Retornable 2l"", ""Refrigerante Fanta Laranja Splash 500ml"", ""Refrigerante Fanta Guaraná Pet 200ml"", ""Refrigerante It Laranja Pet 2 Litros"", ""Refrigerante Pepsi Pet 2 Litro"", ""7"", ""59"", ""Refrigerante Soda Limonada Antarctica Lata 350ml"", ""2"", ""Refrigerante Guaraná Antarctica Lata 269ml"", ""Refrigerante Pepsi Lata 350ml"", ""3"", ""29"", ""Termos mais buscados"", ""1º"", ""leite"", ""2º"", ""cafe"", ""3º"", ""cerveja"", ""4º"", ""jabón polvo"", ""5º"", ""arroz"", ""6º"", ""leite condensado"", ""7º"", ""iogurte"", ""8º"", ""ovo"", ""9º"", ""frango"", ""10º"", ""oleo"", ""Sua privacidade"", ""Sempre ativos"", ""Back Button"", ""Back"", ""Vendor Search"", ""Filter Button"", ""Consent"", ""Leg.Interest"", ""checkbox label"", ""label"", ""Clear"", ""Apply"", ""Cancel"", ""Guardar configuración"", ""Rejeitar todos"", ""Configurar privacidade""]}",dataset/txt_limpios/392.txt,dataset/paginas_descargadas/392.html,ET,sin_categoria,discard,0.30,no_category_detected
579,DALE VIDA A TU JARDIN,"Datos técnicos Descripción del producto ¡Suscribite a nuestro boletín! Recibí las ofertas y novedades en tu correo. Suscribirme Seguridad y confianza © Libertad 2023. Todos los derechos reservados. Términos y Condiciones Direcciôn General de Defensa y protecciôn al Consumidor, para consultas y/o denuncias ingresa a los Términos más buscados 1. leche 2. cerveza 3. aceptada 4. yerba 5. cafe 6. pañales 7. queso 8. arroz 9. fideos 10. fernet",🌷🌻​🌼​ > 1 L,1437.19,ARS,,Desconocido,unknown,AR,DALE VIDA A TU JARDIN,🌷🌻​🌼​,,1 L,1437.19,ARS,$,"$1.437,19",1437.19,False,original,1.1452,1.1452,1255.0,from_argentina_cambio_dolar,,"Datos técnicos Descripción del producto ¡Suscribite a nuestro boletín! Recibí las ofertas y novedades en tu correo. Suscribirme Seguridad y confianza © Libertad 2023. Todos los derechos reservados. Términos y Condiciones Direcciôn General de Defensa y protecciôn al Consumidor, para consultas y/o denuncias ingresa a los Términos más buscados 1. leche 2. cerveza 3. aceptada 4. yerba 5. cafe 6. pañales 7. queso 8. arroz 9. fideos 10. fernet",,,,,,"{""Descripción"": [""Datos técnicos"", ""Descripción del producto"", ""¡Suscribite a nuestro newsletter!"", ""Recibí las ofertas y novedades en tu correo."", ""Suscribirme"", ""Seguridad y confianza"", ""© Libertad 2023. Todos los derechos reservados."", ""Términos y Condiciones"", ""Dirección General de Defensa y Protección al Consumidor para consultas y/o denuncias"", ""introduzca aquí"", ""Términos más buscados"", ""1."", ""leche"", ""2."", ""cerveza"", ""3."", ""aceite"", ""4."", ""yerba"", ""5."", ""cafe"", ""6."", ""pañales"", ""7."", ""queso"", ""8."", ""arroz"", ""9."", ""fideos"", ""10."", ""fernet""]}",dataset/txt_limpios/579.txt,dataset/paginas_descargadas/579.html,ET,cafe,keep,0.60,heuristic_default
580,DALE VIDA A TU JARDIN,"Datos técnicos Descripción del producto ¡Suscribite a nuestro boletín! Recibí las ofertas y novedades en tu correo. Suscribirme Seguridad y confianza © Libertad 2023. Todos los derechos reservados. Términos y Condiciones Direcciôn General de Defensa y protecciôn al Consumidor, para consultas y/o denuncias ingresa a los Términos más buscados 1. leche 2. cerveza 3. aceptada 4. yerba 5. cafe 6. pañales 7. queso 8. arroz 9. fideos 10. fernet",🌷🌻​🌼​ > 1 L,1597.52,ARS,,Desconocido,unknown,AR,DALE VIDA A TU JARDIN,🌷🌻​🌼​,,1 L,1597.52,ARS,$,"$1.597,52",1597.52,False,original,1.2729,1.2729,1255.0,from_argentina_cambio_dolar,,"Datos técnicos Descripción del producto ¡Suscribite a nuestro boletín! Recibí las ofertas y novedades en tu correo. Suscribirme Seguridad y confianza © Libertad 2023. Todos los derechos reservados. Términos y Condiciones Direcciôn General de Defensa y protecciôn al Consumidor, para consultas y/o denuncias ingresa a los Términos más buscados 1. leche 2. cerveza 3. aceptada 4. yerba 5. cafe 6. pañales 7. queso 8. arroz 9. fideos 10. fernet",,,,,,"{""Descripción"": [""Datos técnicos"", ""Descripción del producto"", ""¡Suscribite a nuestro newsletter!"", ""Recibí las ofertas y novedades en tu correo."", ""Suscribirme"", ""Seguridad y confianza"", ""© Libertad 2023. Todos los derechos reservados."", ""Términos y Condiciones"", ""Dirección General de Defensa y Protección al Consumidor para consultas y/o denuncias"", ""introduzca aquí"", ""Términos más buscados"", ""1."", ""leche"", ""2."", ""cerveza"", ""3."", ""aceite"", ""4."", ""yerba"", ""5."", ""cafe"", ""6."", ""pañales"", ""7."", ""queso"", ""8."", ""arroz"", ""9."", ""fideos"", ""10."", ""fernet""]}",dataset/txt_limpios/580.txt,dataset/paginas_descargadas/580.html,ET,cafe,keep,0.60,heuristic_default
581,DALE VIDA A TU JARDIN,"Datos técnicos Descripción del producto ¡Suscribite a nuestro boletín! Recibí las ofertas y novedades en tu correo. Suscribirme Seguridad y confianza © Libertad 2023. Todos los derechos reservados. Términos y Condiciones Direcciôn General de Defensa y protecciôn al Consumidor, para consultas y/o denuncias ingresa a los Términos más buscados 1. leche 2. cerveza 3. aceptada 4. yerba 5. cafe 6. pañales 7. queso 8. arroz 9. fideos 10. fernet",🌷🌻​🌼​ > 1L,1145.45,ARS,,Desconocido,unknown,AR,DALE VIDA A TU JARDIN,🌷🌻​🌼​,,1L,1145.45,ARS,$,"$1.145,45",1145.45,False,original,0.9127,0.9127,1255.0,from_argentina_cambio_dolar,,"Datos técnicos Descripción del producto ¡Suscribite a nuestro boletín! Recibí las ofertas y novedades en tu correo. Suscribirme Seguridad y confianza © Libertad 2023. Todos los derechos reservados. Términos y Condiciones Direcciôn General de Defensa y protecciôn al Consumidor, para consultas y/o denuncias ingresa a los Términos más buscados 1. leche 2. cerveza 3. aceptada 4. yerba 5. cafe 6. pañales 7. queso 8. arroz 9. fideos 10. fernet",,,,,,"{""Descripción"": [""Datos técnicos"", ""Descripción del producto"", ""¡Suscribite a nuestro newsletter!"", ""Recibí las ofertas y novedades en tu correo."", ""Suscribirme"", ""Seguridad y confianza"", ""© Libertad 2023. Todos los derechos reservados."", ""Términos y Condiciones"", ""Dirección General de Defensa y Protección al Consumidor para consultas y/o denuncias"", ""introduzca aquí"", ""Términos más buscados"", ""1."", ""leche"", ""2."", ""cerveza"", ""3."", ""aceite"", ""4."", ""yerba"", ""5."", ""cafe"", ""6."", ""pañales"", ""7."", ""queso"", ""8."", ""arroz"", ""9."", ""fideos"", ""10."", ""fernet""]}",dataset/txt_limpios/581.txt,dataset/paginas_descargadas/581.html,ET,cafe,keep,0.60,heuristic_default
582,DALE VIDA A TU JARDIN,"Datos técnicos Descripción del producto ¡Suscribite a nuestro boletín! Recibí las ofertas y novedades en tu correo. Suscribirme Seguridad y confianza © Libertad 2023. Todos los derechos reservados. Términos y Condiciones Direcciôn General de Defensa y protecciôn al Consumidor, para consultas y/o denuncias ingresa a los Términos más buscados 1. leche 2. cerveza 3. aceptada 4. yerba 5. cafe 6. pañales 7. queso 8. arroz 9. fideos 10. fernet",🌷🌻​🌼​,1643.8,ARS,,Desconocido,unknown,AR,DALE VIDA A TU JARDIN,🌷🌻​🌼​,,,1643.80,ARS,$,"$1.643,80",1643.8,False,original,1.3098,1.3098,1255.0,from_argentina_cambio_dolar,,"Datos técnicos Descripción del producto ¡Suscribite a nuestro boletín! Recibí las ofertas y novedades en tu correo. Suscribirme Seguridad y confianza © Libertad 2023. Todos los derechos reservados. Términos y Condiciones Direcciôn General de Defensa y protecciôn al Consumidor, para consultas y/o denuncias ingresa a los Términos más buscados 1. leche 2. cerveza 3. aceptada 4. yerba 5. cafe 6. pañales 7. queso 8. arroz 9. fideos 10. fernet",,,,,,"{""Descripción"": [""Datos técnicos"", ""Descripción del producto"", ""¡Suscribite a nuestro newsletter!"", ""Recibí las ofertas y novedades en tu correo."", ""Suscribirme"", ""Seguridad y confianza"", ""© Libertad 2023. Todos los derechos reservados."", ""Términos y Condiciones"", ""Dirección General de Defensa y Protección al Consumidor para consultas y/o denuncias"", ""introduzca aquí"", ""Términos más buscados"", ""1."", ""leche"", ""2."", ""cerveza"", ""3."", ""aceite"", ""4."", ""yerba"", ""5."", ""cafe"", ""6."", ""pañales"", ""7."", ""queso"", ""8."", ""arroz"", ""9."", ""fideos"", ""10."", ""fernet""]}",dataset/txt_limpios/582.txt,dataset/paginas_descargadas/582.html,ET,cafe,keep,0.60,heuristic_default
583,DALE VIDA A TU JARDIN,,🌷🌻​🌼​,,ARS,,Desconocido,unknown,AR,DALE VIDA A TU JARDIN,🌷🌻​🌼​,,,,ARS,,,1663.58,True,country_mean,,1.3256,1255.0,from_argentina_cambio_dolar,,,,,,,,{},dataset/txt_limpios/583.txt,dataset/paginas_descargadas/583.html,EN,sin_categoria,discard,0.30,no_category_detected;price_parse_failed
584,DALE VIDA A TU JARDIN,,🌷🌻​🌼​,,ARS,,Desconocido,unknown,AR,DALE VIDA A TU JARDIN,🌷🌻​🌼​,,,,ARS,,,1663.58,True,country_mean,,1.3256,1255.0,from_argentina_cambio_dolar,,,,,,,,{},dataset/txt_limpios/584.txt,dataset/paginas_descargadas/584.html,EN,sin_categoria,discard,0.30,no_category_detected;price_parse_failed
585,DALE VIDA A TU JARDIN,,🌷🌻​🌼​,,ARS,,Desconocido,unknown,AR,DALE VIDA A TU JARDIN,🌷🌻​🌼​,,,,ARS,,,1663.58,True,country_mean,,1.3256,1255.0,from_argentina_cambio_dolar,,,,,,,,{},dataset/txt_limpios/585.txt,dataset/paginas_descargadas/585.html,EN,sin_categoria,discard,0.30,no_category_detected;price_parse_failed
586,DALE VIDA A TU JARDIN,"Datos técnicos Descripción del producto El pan Lactal es nuestro pan clásico que acompaña tu mesa desde hace pero de 100 años. ¡Suscribite a nuestro boletín! Recibí las ofertas y novedades en tu correo. Suscribirme Seguridad y confianza © Libertad 2023. Todos los derechos reservados. Términos y Condiciones Direcciôn General de Defensa y protecciôn al Consumidor, para consultas y/o denuncias ingresa a los Términos más buscados 1. leche 2. cerveza 3. aceptada 4. yerba 5. cafe 6. pañales 7. queso 8. arroz 9. fideos 10. fernet",🌷🌻​🌼​ > 560g,4693.39,ARS,,Desconocido,unknown,AR,DALE VIDA A TU JARDIN,🌷🌻​🌼​,,560g,4693.39,ARS,$,"$4.693,39",4693.39,False,original,3.7398,3.7398,1255.0,from_argentina_cambio_dolar,,"Datos técnicos Descripción del producto El pan Lactal es nuestro pan clásico que acompaña tu mesa desde hace pero de 100 años. ¡Suscribite a nuestro boletín! Recibí las ofertas y novedades en tu correo. Suscribirme Seguridad y confianza © Libertad 2023. Todos los derechos reservados. Términos y Condiciones Direcciôn General de Defensa y protecciôn al Consumidor, para consultas y/o denuncias ingresa a los Términos más buscados 1. leche 2. cerveza 3. aceptada 4. yerba 5. cafe 6. pañales 7. queso 8. arroz 9. fideos 10. fernet",,,,,,"{""Descripción"": [""Datos técnicos"", ""Descripción del producto"", ""El pan Lactal es nuestro pan clásico que acompaña tu mesa desde hace pero de 100 años."", ""¡Suscribite a nuestro newsletter!"", ""Recibí las ofertas y novedades en tu correo."", ""Suscribirme"", ""Seguridad y confianza"", ""© Libertad 2023. Todos los derechos reservados."", ""Términos y Condiciones"", ""Dirección General de Defensa y Protección al Consumidor para consultas y/o denuncias"", ""introduzca aquí"", ""Términos más buscados"", ""1."", ""leche"", ""2."", ""cerveza"", ""3."", ""aceite"", ""4."", ""yerba"", ""5."", ""cafe"", ""6."", ""pañales"", ""7."", ""queso"", ""8."", ""arroz"", ""9."", ""fideos"", ""10."", ""fernet""]}",dataset/txt_limpios/586.txt,dataset/paginas_descargadas/586.html,ET,cafe,keep,0.60,heuristic_default
