source_id,title,description,breadcrumbs,price_raw,currency_raw,url,seller,availability,country,product_name,brand,reference,unit,price_amount,price_currency,price_symbol,price_text,price_amount_filled,price_is_imputed,price_imputation_source,price_amount_usd,price_amount_usd_filled,fx_rate_local_per_usd,fx_source,information_text,description_text,features_text,specifications_text,benefits_text,details_text,other_sections,sections,txt_path,html_path,es_status,category_canonical,decision,match_score,reasons
1004,colaborar con nuestros estudios para marketing. También puede configurarlas.,Información de la marca,que podemos ofrecer. > 5Kg,16.92,PEN,,Desconocido,unknown,PE,colaborar con nuestros estudios para marketing. También puede configurarlas.,que podemos ofrecer.,,5Kg,16.92,PEN,S/,S/16.92,16.92,False,original,4.7662,4.7662,3.55,from_peru_cambio_dolar,,Información de la marca,"Presentación/Empaque | Bolsa | Producto Preparado | Sí | Arroz Pregraneado | No | Azúcares Porción | 0 | Calorías Porción | Carbohidratos Por Porción | Grasas Porción | Proteínas Porción | Sodio Porción | Advertencias De Almacenamiento | Almacenar en un lugar fresco y seco, lejos de agentes químicos, productos diferentes a alimentos. | Contenido Neto | 5Kg | Denominación/Variedad | Extra Graneadito | Advertencias de consumo | Consumir preferentemente antes de la fecha indicada en el envase. | Revisa todo | Importante destacar | El producto se debe almacenar en un ambiente cerrado, frescos y seco | Variedad: Extra Graneadito | Presentación : Bolsa | Descripción del producto | plaza Vea | cuenta con una amplia variedad de | para que puedas elegir el que más se adecua a tus necesidades. | Uno de los ingredientes principales de la gastronomía peruana es el | . Este alimento acompaña muchos platos típicos de nuestro país como un Seco a la norteña, Lomo Saltado, Ají de pollo, Cau Cau entre otro más. Es que el arroz se ha ganado un espacio en el corazón de los peruanos, gracias a su sabor y textura lo convierten en el complemento perfecto para acompañar cualquier plato. | En | podrás encontrar diferentes presentaciones, tamaños y marcas. Por ejemplo, estás llevando una alimentación saludable te recomendamos revisar nuestro catálogo de | Arroz Integral y especiales | para que puedas elaborar tus recetas según tus requerimientos calóricos. | Recuerda que para lograr un | Arroz Graneadito | no debe faltar en tu cocina el | Aceite Vegetal | ! Gracias a su composición y versatilidad es perfecto para utilizarlo en cualquier receta, desde una fresca ensalada hasta un delicioso Arroz con pollo , graneadito y con el sabor preciso que a todos los peruanos nos encanta. ¡Qué esperas empieza a engreir a toda tu familia con tus mejores preparaciones! | - Conoce las distintas opciones en | en plazaVea Online! | *La imagen solo es referencial | ""Reconocida por su calidad y variedad, Costeño está hecho para satisfacer cada una las necesidades de un mercado como el nuestro. Gracias a sus procesos, amplios almacenes y moderna planta de selección y envasado, le han permitido obtener la certificación HCCP. Su especialidad es la comercialización de arroz, pero también cuentan con una línea completa de la mejor calidad en aceite vegetal, azúcar, cereales, envasados y menestras"" | ¿No es lo que buscas? Encuentra más variedades de | en plaza Vea | Componentes del Producto | Vendido por | En caso de que algo te guste: Puedes revisar nuestras | Políticas de cambios y/o devoluciones | y hacerlas efectivas en todas nuestras tiendas. | Productos | que te pueden interesar | Recomendado para ti",,,,,"{""Descripción"": [""Información de la marca""], ""Características"": [""Presentación/Empaque"", ""Bolsa"", ""Producto Preparado"", ""Sí"", ""Arroz Pregraneado"", ""No"", ""Azúcar por porción"", ""0"", ""Calorías Porción"", ""Carbohidratos Porción"", ""Grasas Porción"", ""Proteínas Porción"", ""Sodio Porción"", ""Advertencias De Almacenamiento"", ""Almacenar en un lugar fresco y seco, lejos de agentes químicos, productos diferentes a alimentos."", ""Contenido Neto"", ""5Kg"", ""Denominación/Variedad"", ""Extra Graneadito"", ""Advertencias de consumo"", ""Consumir preferentemente antes de la fecha indicada en el envase."", ""Revisa todo"", ""Importante destacar"", ""El producto se debe almacenar en un ambiente cerrado,fresco y seco"", ""Variedad: Extra Graneadito"", ""Presentación : Bolsa"", ""Descripción del producto"", ""plazaVea"", ""cuenta con una amplia variedad de"", ""para que puedas elegir qué más se adecua a tus necesidades."", ""Uno de los ingredientes principales de la gastronomía peruana es el"", "". Este alimento acompaña muchos platos típicos de nuestro país como un Seco a la norteña, Lomo Saltado, Ají de pollo, Cau Cau entre otro más. Es que el arroz se ha ganado un espacio en el corazón de los peruanos, gracias a su sabor y textura lo convierten en el complemento perfecto para acompañar cualquier plato."", ""En"", ""podrás encontrar diferentes presentaciones, tamaños y marcas. Por ejemplo, estás llevando una alimentación saludable te recomendamos revisar nuestro catálogo de"", ""Arroz Integral y especiales"", ""para que puedas elaborar tus recetas según tus requerimientos calóricos."", ""¡Recuerda que para lograr un"", ""Arroz Graneadito"", ""no debe faltar en tu cocina el"", ""Aceite Vegetal"", ""! Gracias a su composición y versatilidad es perfecto para utilizar en cualquier receta, desde una fresca ensalada hasta un delicioso arroz con pollo , graneadito y con el sabor preciso que a todos los peruanos nos encanta. ¡Qué esperas empieza a engreir a toda tu familia con tus mejores preparaciones!"", ""¡Conoce las distintas opciones en"", ""en plazaVea Online!"", ""*La imagen solo es referencial"", ""\"" Reconocida por su calidad y variedad, Costeño está hecho para satisfacer cada una las necesidades de un mercado como el nuestro. Gracias a sus procesos, amplios almacenes y moderna planta de selección y envasado, le han permitido obtener la certificación HCCP. Su especialidad es la comercialización de arroz, pero también cuentan con una línea completa de la mejor calidad en aceite vegetal, azúcar, cereales, envasados y menestras\"""", ""¿En qué búsqueda? Encuentra más variedades de"", ""en plazaVea"", ""Componentes del Producto"", ""Vendido por"", ""En caso algo no vaya como gustes: Puedes revisar nuestras"", ""Politicas de cambios y/o devoluciones"", ""y hacerlas efectivas en todas nuestras tiendas."", ""Productos"", ""que te pueden interesar"", ""Recomendado para ti""]}",dataset/txt_limpios/1004.txt,dataset/paginas_descargadas/1004.html,ET,sin_categoria,discard,0.30,no_category_detected
1005,colaborar con nuestros estudios para marketing. También puede configurarlas.,"Descripción del producto Importante destacar El producto se debe almacenar en un ambiente cerrado, frescos y seco Variedad: Extra Mejorado Presentación: Bolsa cuenta con una amplia variedad de para que puedas elegir el que más se adecua a tus necesidades. Uno de los ingredientes principales de la gastronomía peruana es el . Este alimento acompaña muchos platos típicos de nuestro país como un Seco a la norteña, Lomo Saltado, Ají de pollo, Cau Cau entre otro más. Es que el arroz se ha ganado un espacio en el corazón de los peruanos, gracias a su sabor y textura lo convierten en el complemento perfecto para acompañar cualquier plato. En podrás encontrar diferentes presentaciones, tamaños y marcas. Por ejemplo, estás llevando una alimentación saludable te recomendamos revisar nuestro catálogo de Arroz Integral y especiales para que puedas elaborar tus recetas según tus requerimientos calóricos. ¡Recuerda que para lograr un arroz Graneadito no debe faltar en tu cocina el Aceite Vegetal! Gracias a su composición y versatilidad es perfecto para utilizar en cualquier receta, desde una fresca ensalada hasta un delicioso arroz con pollo , graneadito y con el sabor preciso que a todos los peruanos nos encanta. ¡Qué esperas empieza a engreir a toda tu familia con tus mejores preparaciones! Conoce las distintas opciones en plaza ¡Mira en línea! *La imagen solo es referencial ""En 1996, Don Luis Gasco Bravo decide iniciar sus esfuerzos en las tierras de Lambayeque, para forjar el cimiento empresarial del reconocido Grupo Vallenorte . Esta empresa nace con la visión de crecer y desarrollarse en la Comercialización e Industrialización de Alimentos y Bebidas"". ¿En qué búsqueda? Encuentra más variedades de en plaza Ver Presentación/Empaque | Bolsa | Producto Preparado | Sí | Arroz Pregraneado | En | Porción sugerida | 185g | Azúcares Porción | 0 | Calorías Porción | 649.7Kcal | Carbohidratos Porción | 150.8g | Grasas Porción | 0.6g | Proteínas Porción | 11.8g | Sodio Porción | Advertencias De Almacenamiento | Almacenar en un lugar fresco y seco, lejos de agentes químicos, productos diferentes a alimentos. | Contenido Neto | 5Kg | Denominación/Variedad | Extra Mejorado | Advertencias de consumo | Consumir preferentemente antes de la fecha indicada en el envase. | En caso de que algo te guste: Puedes revisar nuestras | Políticas de cambios y/o devoluciones | y hacerlas efectivas en todas nuestras tiendas. | Productos | que te pueden interesar | Recomendado para ti",que podemos ofrecer. > 5Kg,16.92,PEN,,Desconocido,unknown,PE,colaborar con nuestros estudios para marketing. También puede configurarlas.,que podemos ofrecer.,,5Kg,16.92,PEN,S/,S/16.92,16.92,False,original,4.7662,4.7662,3.55,from_peru_cambio_dolar,,"Descripción del producto Importante destacar El producto se debe almacenar en un ambiente cerrado, frescos y seco Variedad: Extra Mejorado Presentación: Bolsa cuenta con una amplia variedad de para que puedas elegir el que más se adecua a tus necesidades. Uno de los ingredientes principales de la gastronomía peruana es el . Este alimento acompaña muchos platos típicos de nuestro país como un Seco a la norteña, Lomo Saltado, Ají de pollo, Cau Cau entre otro más. Es que el arroz se ha ganado un espacio en el corazón de los peruanos, gracias a su sabor y textura lo convierten en el complemento perfecto para acompañar cualquier plato. En podrás encontrar diferentes presentaciones, tamaños y marcas. Por ejemplo, estás llevando una alimentación saludable te recomendamos revisar nuestro catálogo de Arroz Integral y especiales para que puedas elaborar tus recetas según tus requerimientos calóricos. ¡Recuerda que para lograr un arroz Graneadito no debe faltar en tu cocina el Aceite Vegetal! Gracias a su composición y versatilidad es perfecto para utilizar en cualquier receta, desde una fresca ensalada hasta un delicioso arroz con pollo , graneadito y con el sabor preciso que a todos los peruanos nos encanta. ¡Qué esperas empieza a engreir a toda tu familia con tus mejores preparaciones! Conoce las distintas opciones en plaza ¡Mira en línea! *La imagen solo es referencial ""En 1996, Don Luis Gasco Bravo decide iniciar sus esfuerzos en las tierras de Lambayeque, para forjar el cimiento empresarial del reconocido Grupo Vallenorte . Esta empresa nace con la visión de crecer y desarrollarse en la Comercialización e Industrialización de Alimentos y Bebidas"". ¿En qué búsqueda? Encuentra más variedades de en plaza Ver",,"Presentación/Empaque | Bolsa | Producto Preparado | Sí | Arroz Pregraneado | No | Porción Sugerida | 185g | Azúcares Porción | 0 | Calorías Porción | 649.7Kcal | Carbohidratos Porción | 150.8g | Grasas Porción | 0.6g | Proteínas Porción | 11.8g | Sodio Porción | Advertencias De Almacenamiento | Almacenar en un lugar fresco y seco, lejos de agentes químicos, productos diferentes a alimentos. | Contenido Neto | 5Kg | Denominación/Variedad | Extra Mejorado | Advertencias de consumo | Consumir preferentemente antes de la fecha indicada en el envase. | En caso de que algo te guste: Puedes revisar nuestras | Políticas de cambios y/o devoluciones | y hacerlas efectivas en todas nuestras tiendas. | Productos | que te pueden interesar | Recomendado para ti",,,,"{""Descripción"": [""Descripción del producto"", ""Importante destacar"", ""El producto se debe almacenar en un ambiente cerrado,fresco y seco"", ""Variedad: Extra Mejorado"", ""Presentación : Bolsa"", ""cuenta con una amplia variedad de"", ""para que puedas elegir qué más se adecua a tus necesidades."", ""Uno de los ingredientes principales de la gastronomía peruana es el"", "". Este alimento acompaña muchos platos típicos de nuestro país como un Seco a la norteña, Lomo Saltado, Ají de pollo, Cau Cau entre otro más. Es que el arroz se ha ganado un espacio en el corazón de los peruanos, gracias a su sabor y textura lo convierten en el complemento perfecto para acompañar cualquier plato."", ""En"", ""podrás encontrar diferentes presentaciones, tamaños y marcas. Por ejemplo, estás llevando una alimentación saludable te recomendamos revisar nuestro catálogo de"", ""Arroz Integral y especiales"", ""para que puedas elaborar tus recetas según tus requerimientos calóricos."", ""¡Recuerda que para lograr un"", ""Arroz Graneadito"", ""no debe faltar en tu cocina el"", ""Aceite Vegetal"", ""! Gracias a su composición y versatilidad es perfecto para utilizar en cualquier receta, desde una fresca ensalada hasta un delicioso arroz con pollo , graneadito y con el sabor preciso que a todos los peruanos nos encanta. ¡Qué esperas empieza a engreir a toda tu familia con tus mejores preparaciones!"", ""¡Conoce las distintas opciones en"", ""en plazaVea Online!"", ""*La imagen solo es referencial"", ""\""En 1996, Don Luis Gasco Bravo decide iniciar sus esfuerzos en las tierras de Lambayeque, para forjar el cimiento empresarial del reconocido Grupo Vallenorte . Esta empresa nace con la visión de crecer y desarrollarse en la Comercialización e Industrialización de Alimentos y Bebidas. \"""", ""¿En qué búsqueda? Encuentra más variedades de"", ""en plazaVea""], ""Especificaciones"": [""Presentación/Empaque"", ""Bolsa"", ""Producto Preparado"", ""Sí"", ""Arroz Pregraneado"", ""No"", ""Porción sugerida"", ""185g"", ""Azúcar por porción"", ""0"", ""Calorías Porción"", ""649.7Kcal"", ""Carbohidratos Porción"", ""150.8g"", ""Grasas Porción"", ""0.6g"", ""Proteínas Porción"", ""11.8g"", ""Sodio Porción"", ""Advertencias De Almacenamiento"", ""Almacenar en un lugar fresco y seco, lejos de agentes químicos, productos diferentes a alimentos."", ""Contenido Neto"", ""5Kg"", ""Denominación/Variedad"", ""Extra Mejorado"", ""Advertencias de consumo"", ""Consumir preferentemente antes de la fecha indicada en el envase."", ""En caso algo no vaya como gustes: Puedes revisar nuestras"", ""Politicas de cambios y/o devoluciones"", ""y hacerlas efectivas en todas nuestras tiendas."", ""Productos"", ""que te pueden interesar"", ""Recomendado para ti""]}",dataset/txt_limpios/1005.txt,dataset/paginas_descargadas/1005.html,ET,aceite vegetal,keep,0.60,heuristic_default
1006,colaborar con nuestros estudios para marketing. También puede configurarlas.,Información de la marca,que podemos ofrecer. > 5Kg,16.92,PEN,,Desconocido,unknown,PE,colaborar con nuestros estudios para marketing. También puede configurarlas.,que podemos ofrecer.,,5Kg,16.92,PEN,S/,S/16.92,16.92,False,original,4.7662,4.7662,3.55,from_peru_cambio_dolar,,Información de la marca,"Presentación/Empaque | Bolsa | Producto Preparado | No | Arroz Pregraneado | Azúcares Porción | 0 | Calorías Porción | Carbohidratos Por Porción | Grasas Porción | Proteínas Porción | Sodio Porción | Advertencias De Almacenamiento | Almacenar en un lugar fresco y seco, lejos de agentes químicos, productos diferentes a alimentos. | Contenido Neto | 5kg | Denominación/Variedad | Extra | Advertencias de consumo | Consumir preferentemente antes de la fecha indicada en el envase. | Revisa todo | Importante destacar | El producto se debe almacenar en un ambiente cerrado, frescos y seco | Variedad: Extra | Presentación : Bolsa | Descripción del producto | plaza Vea | cuenta con una amplia variedad de | para que puedas elegir el que más se adecua a tus necesidades. | Uno de los ingredientes principales de la gastronomía peruana es el | . Este alimento acompaña muchos platos típicos de nuestro país como un Seco a la norteña, Lomo Saltado, Ají de pollo, Cau Cau entre otro más. Es que el arroz se ha ganado un espacio en el corazón de los peruanos, gracias a su sabor y textura lo convierten en el complemento perfecto para acompañar cualquier plato. | En | podrás encontrar diferentes presentaciones, tamaños y marcas. Por ejemplo, estás llevando una alimentación saludable te recomendamos revisar nuestro catálogo de | Arroz Integral y especiales | para que puedas elaborar tus recetas según tus requerimientos calóricos. | Recuerda que para lograr un | Arroz Graneadito | no debe faltar en tu cocina el | Aceite Vegetal | ! Gracias a su composición y versatilidad es perfecto para utilizarlo en cualquier receta, desde una fresca ensalada hasta un delicioso Arroz con pollo , graneadito y con el sabor preciso que a todos los peruanos nos encanta. ¡Qué esperas empieza a engreir a toda tu familia con tus mejores preparaciones! | - Conoce las distintas opciones en | en plazaVea Online! | *La imagen solo es referencial | "" Paisana es una de las marcas de arroz y menestras más queridas de las familias peruanas, ya que es el complemento perfecto para acompañar nuestra gastronomía. Paisana apoya la fusión e innovación y se preocupa por la nutrición de todos los peruanos, por eso también cuenta con su presentación de arroz Fortificado con hierro, zinc y 8 vitaminas y minerales para la nutrición de toda la familia."" | ¿En qué búsqueda? Encuentra más variedades de | en plaza Vea | Componentes del Producto | Vendido por | En caso de que algo te guste: Puedes revisar nuestras | Políticas de cambios y/o devoluciones | y hacerlas efectivas en todas nuestras tiendas. | Productos | que te pueden interesar | Recomendado para ti",,,,,"{""Descripción"": [""Información de la marca""], ""Características"": [""Presentación/Empaque"", ""Bolsa"", ""Producto Preparado"", ""No"", ""Arroz Pregraneado"", ""Azúcar por porción"", ""0"", ""Calorías Porción"", ""Carbohidratos Porción"", ""Grasas Porción"", ""Proteínas Porción"", ""Sodio Porción"", ""Advertencias De Almacenamiento"", ""Almacenar en un lugar fresco y seco, lejos de agentes químicos, productos diferentes a alimentos."", ""Contenido Neto"", ""5kg"", ""Denominación/Variedad"", ""Extra"", ""Advertencias de consumo"", ""Consumir preferentemente antes de la fecha indicada en el envase."", ""Revisa todo"", ""Importante destacar"", ""El producto se debe almacenar en un ambiente cerrado,fresco y seco"", ""Variedad: Extra"", ""Presentación : Bolsa"", ""Descripción del producto"", ""plazaVea"", ""cuenta con una amplia variedad de"", ""para que puedas elegir qué más se adecua a tus necesidades."", ""Uno de los ingredientes principales de la gastronomía peruana es el"", "". Este alimento acompaña muchos platos típicos de nuestro país como un Seco a la norteña, Lomo Saltado, Ají de pollo, Cau Cau entre otro más. Es que el arroz se ha ganado un espacio en el corazón de los peruanos, gracias a su sabor y textura lo convierten en el complemento perfecto para acompañar cualquier plato."", ""En"", ""podrás encontrar diferentes presentaciones, tamaños y marcas. Por ejemplo, estás llevando una alimentación saludable te recomendamos revisar nuestro catálogo de"", ""Arroz Integral y especiales"", ""para que puedas elaborar tus recetas según tus requerimientos calóricos."", ""¡Recuerda que para lograr un"", ""Arroz Graneadito"", ""no debe faltar en tu cocina el"", ""Aceite Vegetal"", ""! Gracias a su composición y versatilidad es perfecto para utilizar en cualquier receta, desde una fresca ensalada hasta un delicioso arroz con pollo , graneadito y con el sabor preciso que a todos los peruanos nos encanta. ¡Qué esperas empieza a engreir a toda tu familia con tus mejores preparaciones!"", ""¡Conoce las distintas opciones en"", ""en plazaVea Online!"", ""*La imagen solo es referencial"", ""\"" Paisana es una de las marcas de arroz y menestras malas queridas de las familias peruanas, ya que es el complemento perfecto para acompañar nuestra gastronomía. Paisana apoya la fusión e innovación y se preocupa por la nutrición de todos los peruanos, por eso también cuenta con su presentación de arroz Fortificado con hierro, zinc y 8 vitaminas y minerales para la nutrición de toda la familia. \"""", ""¿En qué búsqueda? Encuentra más variedades de"", ""en plazaVea"", ""Componentes del Producto"", ""Vendido por"", ""En caso algo no vaya como gustes: Puedes revisar nuestras"", ""Politicas de cambios y/o devoluciones"", ""y hacerlas efectivas en todas nuestras tiendas."", ""Productos"", ""que te pueden interesar"", ""Recomendado para ti""]}",dataset/txt_limpios/1006.txt,dataset/paginas_descargadas/1006.html,ET,sin_categoria,discard,0.30,no_category_detected
