source_id,title,description,breadcrumbs,price_raw,currency_raw,url,seller,availability,country,product_name,brand,reference,unit,price_amount,price_currency,price_symbol,price_text,price_amount_filled,price_is_imputed,price_imputation_source,price_amount_usd,price_amount_usd_filled,fx_rate_local_per_usd,fx_source,information_text,description_text,features_text,specifications_text,benefits_text,details_text,other_sections,sections,txt_path,html_path,es_status,category_canonical,decision,match_score,reasons
1056,¡Aún no eres Wong Prime!,Comentarios | Especificaciones técnicas | Propiedad | Especificación | Ver condiciones de promociones | Podrían interesarte | Arroz Añejo Superior Valle Norte 5kg | 27 | true | Arroz Añejo Superior Valle Norte 750g | 4 | 80 | Arroz Superior Añejo Faraón Rojo 750g | 00 | Arroz Extra Tesoro Del Campo Bolsa 5 Kg | 30 | Arroz Superior Añejo Faraón Rojo 5kg | ? | ! | i | × | Sí Acepto | Recuerda escribir al menos 3 letras en el cuadro de búsqueda | Términos más buscados | 1. | elvive liso | 2. | ariel liquido | 3. | limpiador inodoro harpic | 4. | busca | 5. | secret clinical | Marcas sugeridas,Aprovecha el > 5 kg > 789685,79.9,PEN,,Desconocido,unknown,PE,¡Aún no eres Wong Prime!,Aprovecha el,789685.0,5 kg,79.90,PEN,S/,S/79.90,79.9,False,original,22.507,22.507,3.55,from_peru_cambio_dolar,,,,Comentarios | Especificaciones técnicas | Propiedad | Especificación | Ver condiciones de promociones | Podrían interesarte | Arroz Añejo Superior Valle Norte 5kg | 27 | true | Arroz Añejo Superior Valle Norte 750g | 4 | 80 | Arroz Superior Añejo Faraón Rojo 750g | 00 | Arroz Extra Tesoro Del Campo Bolsa 5 Kg | 30 | Arroz Superior Añejo Faraón Rojo 5kg | ? | ! | i | × | Sí Acepto | Recuerda escribir al menos 3 letras en el cuadro de búsqueda | Términos más buscados | 1. | elvive liso | 2. | ariel liquido | 3. | limpiador inodoro harpic | 4. | busca | 5. | secret clinical | Marcas sugeridas,,,,"{""Especificaciones"": [""Comentarios"", ""Especificaciones técnicas"", ""Propiedad"", ""Especificación"", ""Ver condiciones de promociones"", ""Podrían interesarte"", ""Arroz Añejo Superior Valle Norte 5kg"", ""27"", ""true"", ""Arroz Añejo Superior Valle Norte 750g"", ""4"", ""80"", ""Arroz Superior Añejo Faraón Rojo 750g"", ""00"", ""Arroz Extra Tesoro Del Campo Bolsa 5 Kg"", ""30"", ""Arroz Superior Añejo Faraón Rojo 5kg"", ""?"", ""!"", ""i"", ""×"", ""Sí Acepto"", ""Recuerda escribir al menos 3 letras en el cuadro de búsqueda"", ""Términos más buscados"", ""1."", ""elvive liso"", ""2."", ""ariel liquido"", ""3."", ""limpiador inodoro harpic"", ""4."", ""busca"", ""5."", ""secret clinical"", ""Marcas sugeridas""]}",dataset/txt_limpios/1056.txt,dataset/paginas_descargadas/1056.html,EN,arroz,keep,0.60,heuristic_default
1057,¡Aún no eres Wong Prime!,Información Nutricional Comentarios | Especificaciones técnicas | Propiedad | Especificación | Ingredientes | Arroz blanco extra grado 1 | Ver condiciones de promociones | Podrían interesarte | Arroz Añejo Superior Valle Norte 5kg | 27 | true | Arroz Añejo Superior Valle Norte 750g | 4 | 80 | Arroz Superior Añejo Faraón Rojo 750g | 00 | Arroz Extra Tesoro Del Campo Bolsa 5 Kg | 30 | Arroz Superior Añejo Faraón Rojo 5kg | ? | ! | i | × | Sí Acepto | Recuerda escribir al menos 3 letras en el cuadro de búsqueda | Términos más buscados | 1. | elvive liso | 2. | ariel liquido | 3. | limpiador inodoro harpic | 4. | busca | 5. | secret clinical | Marcas sugeridas,Aprovecha el > 5kg > 570522,79.9,PEN,,Desconocido,unknown,PE,¡Aún no eres Wong Prime!,Aprovecha el,570522.0,5kg,79.90,PEN,S/,S/79.90,79.9,False,original,22.507,22.507,3.55,from_peru_cambio_dolar,,Información Nutricional,,Comentarios | Especificaciones técnicas | Propiedad | Especificación | Ingredientes | Arroz blanco extra grado 1 | Ver condiciones de promociones | Podrían interesarte | Arroz Añejo Superior Valle Norte 5kg | 27 | true | Arroz Añejo Superior Valle Norte 750g | 4 | 80 | Arroz Superior Añejo Faraón Rojo 750g | 00 | Arroz Extra Tesoro Del Campo Bolsa 5 Kg | 30 | Arroz Superior Añejo Faraón Rojo 5kg | ? | ! | i | × | Sí Acepto | Recuerda escribir al menos 3 letras en el cuadro de búsqueda | Términos más buscados | 1. | elvive liso | 2. | ariel liquido | 3. | limpiador inodoro harpic | 4. | busca | 5. | secret clinical | Marcas sugeridas,,,,"{""Descripción"": [""Información Nutricional""], ""Especificaciones"": [""Comentarios"", ""Especificaciones técnicas"", ""Propiedad"", ""Especificación"", ""Ingredientes"", ""Arroz blanco extra grado 1"", ""Ver condiciones de promociones"", ""Podrían interesarte"", ""Arroz Añejo Superior Valle Norte 5kg"", ""27"", ""true"", ""Arroz Añejo Superior Valle Norte 750g"", ""4"", ""80"", ""Arroz Superior Añejo Faraón Rojo 750g"", ""00"", ""Arroz Extra Tesoro Del Campo Bolsa 5 Kg"", ""30"", ""Arroz Superior Añejo Faraón Rojo 5kg"", ""?"", ""!"", ""i"", ""×"", ""Sí Acepto"", ""Recuerda escribir al menos 3 letras en el cuadro de búsqueda"", ""Términos más buscados"", ""1."", ""elvive liso"", ""2."", ""ariel liquido"", ""3."", ""limpiador inodoro harpic"", ""4."", ""busca"", ""5."", ""secret clinical"", ""Marcas sugeridas""]}",dataset/txt_limpios/1057.txt,dataset/paginas_descargadas/1057.html,EN,arroz,keep,0.60,heuristic_default
1058,¡Aún no eres Wong Prime!,Comentarios | Especificaciones técnicas | Propiedad | Especificación | Ver condiciones de promociones | Podrían interesarte | Pollo Entero Light  x kg | 12 | 30 | true | Pollo Fresco Sin Menudencia Artisan Libre de Antibióticos x kg | 19 | 49 | Pollo Entero sin Menudencia x kg | 70 | Pollo Entero con Menudencia x kg | ? | ! | i | × | Sí Acepto | Recuerda escribir al menos 3 letras en el cuadro de búsqueda | Términos más buscados | 1. | elvive liso | 2. | ariel liquido | 3. | limpiador inodoro harpic | 4. | busca | 5. | secret clinical | Marcas sugeridas,Aprovecha el > 1007298,79.9,PEN,,Desconocido,unknown,PE,¡Aún no eres Wong Prime!,Aprovecha el,1007298.0,,79.90,PEN,S/,S/79.90,79.9,False,original,22.507,22.507,3.55,from_peru_cambio_dolar,,,,Comentarios | Especificaciones técnicas | Propiedad | Especificación | Ver condiciones de promociones | Podrían interesarte | Pollo Entero Light  x kg | 12 | 30 | true | Pollo Fresco Sin Menudencia Artisan Libre de Antibióticos x kg | 19 | 49 | Pollo Entero sin Menudencia x kg | 70 | Pollo Entero con Menudencia x kg | ? | ! | i | × | Sí Acepto | Recuerda escribir al menos 3 letras en el cuadro de búsqueda | Términos más buscados | 1. | elvive liso | 2. | ariel liquido | 3. | limpiador inodoro harpic | 4. | busca | 5. | secret clinical | Marcas sugeridas,,,,"{""Especificaciones"": [""Comentarios"", ""Especificaciones técnicas"", ""Propiedad"", ""Especificación"", ""Ver condiciones de promociones"", ""Podrían interesarte"", ""Pollo Entero Light  x kg"", ""12"", ""30"", ""true"", ""Pollo Fresco Sin Menudencia Artisan Libre de Antibióticos x kg"", ""19"", ""49"", ""Pollo Entero sin Menudencia x kg"", ""70"", ""Pollo Entero con Menudencia x kg"", ""?"", ""!"", ""i"", ""×"", ""Sí Acepto"", ""Recuerda escribir al menos 3 letras en el cuadro de búsqueda"", ""Términos más buscados"", ""1."", ""elvive liso"", ""2."", ""ariel liquido"", ""3."", ""limpiador inodoro harpic"", ""4."", ""busca"", ""5."", ""secret clinical"", ""Marcas sugeridas""]}",dataset/txt_limpios/1058.txt,dataset/paginas_descargadas/1058.html,EN,pollo entero,keep,0.60,heuristic_default
1059,¡Aún no eres Wong Prime!,Comentarios | Especificaciones técnicas | Propiedad | Especificación | Ver condiciones de promociones | Podrían interesarte | Pollo Entero Light  x kg | 12 | true | Pollo Fresco Sin Menudencia Artisan Libre de Antibióticos x kg | 19 | 49 | Pollo Entero sin Menudencia x kg | 70 | Pollo Entero con Menudencia x kg | ? | ! | i | × | Sí Acepto | Recuerda escribir al menos 3 letras en el cuadro de búsqueda | Términos más buscados | 1. | elvive liso | 2. | ariel liquido | 3. | limpiador inodoro harpic | 4. | busca | 5. | secret clinical | Marcas sugeridas,Aprovecha el > 1013433,79.9,PEN,,Desconocido,unknown,PE,¡Aún no eres Wong Prime!,Aprovecha el,1013433.0,,79.90,PEN,S/,S/79.90,79.9,False,original,22.507,22.507,3.55,from_peru_cambio_dolar,,,,Comentarios | Especificaciones técnicas | Propiedad | Especificación | Ver condiciones de promociones | Podrían interesarte | Pollo Entero Light  x kg | 12 | true | Pollo Fresco Sin Menudencia Artisan Libre de Antibióticos x kg | 19 | 49 | Pollo Entero sin Menudencia x kg | 70 | Pollo Entero con Menudencia x kg | ? | ! | i | × | Sí Acepto | Recuerda escribir al menos 3 letras en el cuadro de búsqueda | Términos más buscados | 1. | elvive liso | 2. | ariel liquido | 3. | limpiador inodoro harpic | 4. | busca | 5. | secret clinical | Marcas sugeridas,,,,"{""Especificaciones"": [""Comentarios"", ""Especificaciones técnicas"", ""Propiedad"", ""Especificación"", ""Ver condiciones de promociones"", ""Podrían interesarte"", ""Pollo Entero Light  x kg"", ""12"", ""true"", ""Pollo Fresco Sin Menudencia Artisan Libre de Antibióticos x kg"", ""19"", ""49"", ""Pollo Entero sin Menudencia x kg"", ""70"", ""Pollo Entero con Menudencia x kg"", ""?"", ""!"", ""i"", ""×"", ""Sí Acepto"", ""Recuerda escribir al menos 3 letras en el cuadro de búsqueda"", ""Términos más buscados"", ""1."", ""elvive liso"", ""2."", ""ariel liquido"", ""3."", ""limpiador inodoro harpic"", ""4."", ""busca"", ""5."", ""secret clinical"", ""Marcas sugeridas""]}",dataset/txt_limpios/1059.txt,dataset/paginas_descargadas/1059.html,EN,pollo entero,keep,0.60,heuristic_default
1060,¡Aún no eres Wong Prime!,,Aprovecha el > 903179,79.9,PEN,,Desconocido,unknown,PE,¡Aún no eres Wong Prime!,Aprovecha el,903179.0,,79.90,PEN,S/,S/79.90,79.9,False,original,22.507,22.507,3.55,from_peru_cambio_dolar,,,,,,,,{},dataset/txt_limpios/1060.txt,dataset/paginas_descargadas/1060.html,EN,sin_categoria,discard,0.30,no_category_detected
1061,¡Aún no eres Wong Prime!,Comentarios | Especificaciones técnicas | Propiedad | Especificación | Ver condiciones de promociones | Podrían interesarte | Pollo Entero Light  x kg | 12 | 30 | true | Pollo Fresco Sin Menudencia Artisan Libre de Antibióticos x kg | 19 | 49 | Pollo Entero sin Menudencia x kg | 70 | Pollo Entero con Menudencia x kg | 9 | ? | ! | i | × | Sí Acepto | Recuerda escribir al menos 3 letras en el cuadro de búsqueda | Términos más buscados | 1. | elvive liso | 2. | ariel liquido | 3. | limpiador inodoro harpic | 4. | busca | 5. | secret clinical | Marcas sugeridas,Aprovecha el > 1013434,79.9,PEN,,Desconocido,unknown,PE,¡Aún no eres Wong Prime!,Aprovecha el,1013434.0,,79.90,PEN,S/,S/79.90,79.9,False,original,22.507,22.507,3.55,from_peru_cambio_dolar,,,,Comentarios | Especificaciones técnicas | Propiedad | Especificación | Ver condiciones de promociones | Podrían interesarte | Pollo Entero Light  x kg | 12 | 30 | true | Pollo Fresco Sin Menudencia Artisan Libre de Antibióticos x kg | 19 | 49 | Pollo Entero sin Menudencia x kg | 70 | Pollo Entero con Menudencia x kg | 9 | ? | ! | i | × | Sí Acepto | Recuerda escribir al menos 3 letras en el cuadro de búsqueda | Términos más buscados | 1. | elvive liso | 2. | ariel liquido | 3. | limpiador inodoro harpic | 4. | busca | 5. | secret clinical | Marcas sugeridas,,,,"{""Especificaciones"": [""Comentarios"", ""Especificaciones técnicas"", ""Propiedad"", ""Especificación"", ""Ver condiciones de promociones"", ""Podrían interesarte"", ""Pollo Entero Light  x kg"", ""12"", ""30"", ""true"", ""Pollo Fresco Sin Menudencia Artisan Libre de Antibióticos x kg"", ""19"", ""49"", ""Pollo Entero sin Menudencia x kg"", ""70"", ""Pollo Entero con Menudencia x kg"", ""9"", ""?"", ""!"", ""i"", ""×"", ""Sí Acepto"", ""Recuerda escribir al menos 3 letras en el cuadro de búsqueda"", ""Términos más buscados"", ""1."", ""elvive liso"", ""2."", ""ariel liquido"", ""3."", ""limpiador inodoro harpic"", ""4."", ""busca"", ""5."", ""secret clinical"", ""Marcas sugeridas""]}",dataset/txt_limpios/1061.txt,dataset/paginas_descargadas/1061.html,EN,pollo entero,keep,0.60,heuristic_default
1062,¡Aún no eres Wong Prime!,"Comentarios | Especificaciones técnicas | Propiedad | Especificación | Ingredientes | Pollo trozado, Agua, Ají panca en pasta, Vinagre blanco, Ajo molido, Sal, Azúcar cultivado, Salsa de soya, Azúcar, Aceite vegetal de soya, Ají amarillo en pasta, Comino, Pimienta negra, Ají mirasol en pasta, Acentuador de sabor sin 621, Ajo en polvo, Cebolla en polvo, Orégano en polvo, Espesante sin 415, Soya | Puede contener | Trazas de | Soya, Gluten, Derivado lácteo | Ver condiciones de promociones | Podrían interesarte | Piezas de Pollo Maceradas Pollo Pachamanca San Fernando Asu Olla 650g | 15 | 60 | true | Alitas Orientales San Fernando 1kg | 26 | GRASAS-SAT | Alitas Buffalo San Fernando 1kg | Pollo Entero Marinado Sazón Brasa San Fernando 1.4kg | 40 | 15% | Corazón de Pollo Anticuchero Bolsa 400 g | 7 | 64 | Precio regular | ? | ! | i | × | Sí Acepto | Recuerda escribir al menos 3 letras en el cuadro de búsqueda | Términos más buscados | 1. | elvive liso | 2. | ariel liquido | 3. | limpiador inodoro harpic | 4. | busca | 5. | secret clinical | Marcas sugeridas",Aprovecha el > 800 g > 908065,79.9,PEN,,Desconocido,unknown,PE,¡Aún no eres Wong Prime!,Aprovecha el,908065.0,800 g,79.90,PEN,S/,S/79.90,79.9,False,original,22.507,22.507,3.55,from_peru_cambio_dolar,,,,"Comentarios | Especificaciones técnicas | Propiedad | Especificación | Ingredientes | Pollo trozado, Agua, Ají panca en pasta, Vinagre blanco, Ajo molido, Sal, Azúcar cultivado, Salsa de soya, Azúcar, Aceite vegetal de soya, Ají amarillo en pasta, Comino, Pimienta negra, Ají mirasol en pasta, Acentuador de sabor sin 621, Ajo en polvo, Cebolla en polvo, Orégano en polvo, Espesante sin 415, Soya | Puede contener | Trazas de | Soya, Gluten, Derivado lácteo | Ver condiciones de promociones | Podrían interesarte | Piezas de Pollo Maceradas Pollo Pachamanca San Fernando Asu Olla 650g | 15 | 60 | true | Alitas Orientales San Fernando 1kg | 26 | GRASAS-SAT | Alitas Buffalo San Fernando 1kg | Pollo Entero Marinado Sazón Brasa San Fernando 1.4kg | 40 | 15% | Corazón de Pollo Anticuchero Bolsa 400 g | 7 | 64 | Precio regular | ? | ! | i | × | Sí Acepto | Recuerda escribir al menos 3 letras en el cuadro de búsqueda | Términos más buscados | 1. | elvive liso | 2. | ariel liquido | 3. | limpiador inodoro harpic | 4. | busca | 5. | secret clinical | Marcas sugeridas",,,,"{""Especificaciones"": [""Comentarios"", ""Especificaciones técnicas"", ""Propiedad"", ""Especificación"", ""Ingredientes"", ""Pollo trozado, Agua, Ají panca en pasta, Vinagre blanco, Ajo molido, Sal, Azúcar cultivado, Salsa de soya, Azúcar, Aceite vegetal de soya, Ají amarillo en pasta, Comino, Pimienta negra, Ají mirasol en pasta, Acentuador de sabor sin 621, Ajo en polvo, Cebolla en polvo, Orégano en polvo, Espesante sin 415, Soya"", ""Puede contener"", ""Trazas de"", ""Soya, Gluten, Derivado lácteo"", ""Ver condiciones de promociones"", ""Podrían interesarte"", ""Piezas de Pollo Maceradas Pollo Pachamanca San Fernando Asu Olla 650g"", ""15"", ""60"", ""true"", ""Alitas Orientales San Fernando 1kg"", ""26"", ""GRASAS-SAT"", ""Alitas Buffalo San Fernando 1kg"", ""Pollo Entero Marinado Sazón Brasa San Fernando 1.4kg"", ""40"", ""15%"", ""Corazón de Pollo Anticuchero Bolsa 400 g"", ""7"", ""64"", ""Precio regular"", ""?"", ""!"", ""i"", ""×"", ""Sí Acepto"", ""Recuerda escribir al menos 3 letras en el cuadro de búsqueda"", ""Términos más buscados"", ""1."", ""elvive liso"", ""2."", ""ariel liquido"", ""3."", ""limpiador inodoro harpic"", ""4."", ""busca"", ""5."", ""secret clinical"", ""Marcas sugeridas""]}",dataset/txt_limpios/1062.txt,dataset/paginas_descargadas/1062.html,EN,azucar,keep,0.60,heuristic_default
1063,¡Aún no eres Wong Prime!,,Aprovecha el,79.9,PEN,,Desconocido,unknown,PE,¡Aún no eres Wong Prime!,Aprovecha el,,,79.90,PEN,S/,S/79.90,79.9,False,original,22.507,22.507,3.55,from_peru_cambio_dolar,,,,,,,,{},dataset/txt_limpios/1063.txt,dataset/paginas_descargadas/1063.html,EN,sin_categoria,discard,0.30,no_category_detected
1064,¡Aún no eres Wong Prime!,,Aprovecha el,79.9,PEN,,Desconocido,unknown,PE,¡Aún no eres Wong Prime!,Aprovecha el,,,79.90,PEN,S/,S/79.90,79.9,False,original,22.507,22.507,3.55,from_peru_cambio_dolar,,,,,,,,{},dataset/txt_limpios/1064.txt,dataset/paginas_descargadas/1064.html,EN,sin_categoria,discard,0.30,no_category_detected
1065,¡Aún no eres Wong Prime!,Información Nutricional Comentarios | Especificaciones técnicas | Propiedad | Especificación | Ingredientes | 100% puro café arábico peruano | Ver condiciones de promociones | Podrían interesarte | Café Grano Artidoro Rodríguez Bolsa 250 g | 45 | true | Café Molido Illy Espresso 250g | 59 | 90 | Café Molido Tueste Claro Britt 250g | 51 | Café en Grano Valle Sagrado Britt 250g | Café Molido Tunki Tipo Americano 215g | 35 | 70 | ? | ! | i | × | Sí Acepto | Recuerda escribir al menos 3 letras en el cuadro de búsqueda | Términos más buscados | 1. | elvive liso | 2. | ariel liquido | 3. | limpiador inodoro harpic | 4. | busca | 5. | secret clinical | Marcas sugeridas,Aprovecha el > 900g > 755202,79.9,PEN,,Desconocido,unknown,PE,¡Aún no eres Wong Prime!,Aprovecha el,755202.0,900g,79.90,PEN,S/,S/79.90,79.9,False,original,22.507,22.507,3.55,from_peru_cambio_dolar,,Información Nutricional,,Comentarios | Especificaciones técnicas | Propiedad | Especificación | Ingredientes | 100% puro café arábico peruano | Ver condiciones de promociones | Podrían interesarte | Café Grano Artidoro Rodríguez Bolsa 250 g | 45 | true | Café Molido Illy Espresso 250g | 59 | 90 | Café Molido Tueste Claro Britt 250g | 51 | Café en Grano Valle Sagrado Britt 250g | Café Molido Tunki Tipo Americano 215g | 35 | 70 | ? | ! | i | × | Sí Acepto | Recuerda escribir al menos 3 letras en el cuadro de búsqueda | Términos más buscados | 1. | elvive liso | 2. | ariel liquido | 3. | limpiador inodoro harpic | 4. | busca | 5. | secret clinical | Marcas sugeridas,,,,"{""Descripción"": [""Información Nutricional""], ""Especificaciones"": [""Comentarios"", ""Especificaciones técnicas"", ""Propiedad"", ""Especificación"", ""Ingredientes"", ""100% puro café arábico peruano"", ""Ver condiciones de promociones"", ""Podrían interesarte"", ""Café Grano Artidoro Rodríguez Bolsa 250 g"", ""45"", ""true"", ""Café Molido Illy Espresso 250g"", ""59"", ""90"", ""Café Molido Tueste Claro Britt 250g"", ""51"", ""Café en Grano Valle Sagrado Britt 250g"", ""Café Molido Tunki Tipo Americano 215g"", ""35"", ""70"", ""?"", ""!"", ""i"", ""×"", ""Sí Acepto"", ""Recuerda escribir al menos 3 letras en el cuadro de búsqueda"", ""Términos más buscados"", ""1."", ""elvive liso"", ""2."", ""ariel liquido"", ""3."", ""limpiador inodoro harpic"", ""4."", ""busca"", ""5."", ""secret clinical"", ""Marcas sugeridas""]}",dataset/txt_limpios/1065.txt,dataset/paginas_descargadas/1065.html,EN,cafe,keep,0.60,heuristic_default
1067,¡Aún no eres Wong Prime!,Comentarios | Especificaciones técnicas | Propiedad | Especificación | Ver condiciones de promociones | Podrían interesarte | Café Grano Artidoro Rodríguez Bolsa 250 g | 45 | true | Café Molido Illy Espresso 250g | 59 | Café Molido Tueste Claro Britt 250g | 51 | Café en Grano Valle Sagrado Britt 250g | Café Molido Tunki Tipo Americano 215g | 35 | 70 | ? | ! | i | × | Sí Acepto | Recuerda escribir al menos 3 letras en el cuadro de búsqueda | Términos más buscados | 1. | elvive liso | 2. | ariel liquido | 3. | limpiador inodoro harpic | 4. | busca | 5. | secret clinical | Marcas sugeridas,Aprovecha el > 500g > 932780,79.9,PEN,,Desconocido,unknown,PE,¡Aún no eres Wong Prime!,Aprovecha el,932780.0,500g,79.90,PEN,S/,S/79.90,79.9,False,original,22.507,22.507,3.55,from_peru_cambio_dolar,,,,Comentarios | Especificaciones técnicas | Propiedad | Especificación | Ver condiciones de promociones | Podrían interesarte | Café Grano Artidoro Rodríguez Bolsa 250 g | 45 | true | Café Molido Illy Espresso 250g | 59 | Café Molido Tueste Claro Britt 250g | 51 | Café en Grano Valle Sagrado Britt 250g | Café Molido Tunki Tipo Americano 215g | 35 | 70 | ? | ! | i | × | Sí Acepto | Recuerda escribir al menos 3 letras en el cuadro de búsqueda | Términos más buscados | 1. | elvive liso | 2. | ariel liquido | 3. | limpiador inodoro harpic | 4. | busca | 5. | secret clinical | Marcas sugeridas,,,,"{""Especificaciones"": [""Comentarios"", ""Especificaciones técnicas"", ""Propiedad"", ""Especificación"", ""Ver condiciones de promociones"", ""Podrían interesarte"", ""Café Grano Artidoro Rodríguez Bolsa 250 g"", ""45"", ""true"", ""Café Molido Illy Espresso 250g"", ""59"", ""Café Molido Tueste Claro Britt 250g"", ""51"", ""Café en Grano Valle Sagrado Britt 250g"", ""Café Molido Tunki Tipo Americano 215g"", ""35"", ""70"", ""?"", ""!"", ""i"", ""×"", ""Sí Acepto"", ""Recuerda escribir al menos 3 letras en el cuadro de búsqueda"", ""Términos más buscados"", ""1."", ""elvive liso"", ""2."", ""ariel liquido"", ""3."", ""limpiador inodoro harpic"", ""4."", ""busca"", ""5."", ""secret clinical"", ""Marcas sugeridas""]}",dataset/txt_limpios/1067.txt,dataset/paginas_descargadas/1067.html,EN,cafe,keep,0.60,heuristic_default
