source_id,title,description,breadcrumbs,price_raw,currency_raw,url,seller,availability,country,product_name,brand,reference,unit,price_amount,price_currency,price_symbol,price_text,price_amount_filled,price_is_imputed,price_imputation_source,price_amount_usd,price_amount_usd_filled,fx_rate_local_per_usd,fx_source,information_text,description_text,features_text,specifications_text,benefits_text,details_text,other_sections,sections,txt_path,html_path,es_status,category_canonical,decision,match_score,reasons
1007,colaborar con nuestros estudios para marketing. También puede configurarlas.,Información de la marca,que podemos ofrecer. > 5Kg,16.92,PEN,,Desconocido,unknown,PE,colaborar con nuestros estudios para marketing. También puede configurarlas.,que podemos ofrecer.,,5Kg,16.92,PEN,S/,S/16.92,16.92,False,original,4.7662,4.7662,3.55,from_peru_cambio_dolar,,Información de la marca,"Presentación/Empaque | Bolsa | Producto Preparado | SI | Arroz Pregraneado | No | Azúcares Porción | 0 | Calorías Porción | Carbohidratos Por Porción | Grasas Porción | Proteínas Porción | Sodio Porción | Advertencias De Almacenamiento | Almacenar en un lugar cerrado, fresco y seco. | Contenido Neto | 5Kg | Denominación/Variedad | Extra Grado 1 | Advertencias de consumo | Consumir preferentemente antes de la fecha indicada en el envase. | Revisa todo | Importante destacar | El producto se debe almacenar en un ambiente cerrado, frescos y seco | Variedad: Extra Grado 1 | Presentación : Bolsa | Descripción del producto | plaza Vea | cuenta con una amplia variedad de | para que puedas elegir el que más se adecua a tus necesidades. | Uno de los ingredientes principales de la gastronomía peruana es el | . Este alimento acompaña muchos platos típicos de nuestro país como un Seco a la norteña, Lomo Saltado, Ají de pollo, Cau Cau entre otro más. Es que el arroz se ha ganado un espacio en el corazón de los peruanos, gracias a su sabor y textura lo convierten en el complemento perfecto para acompañar cualquier plato. | En | podrás encontrar diferentes presentaciones, tamaños y marcas. Por ejemplo, estás llevando una alimentación saludable te recomendamos revisar nuestro catálogo de | Arroz Integral y especiales | para que puedas elaborar tus recetas según tus requerimientos calóricos. | Recuerda que para lograr un | Arroz Graneadito | no debe faltar en tu cocina el | Aceite Vegetal | ! Gracias a su composición y versatilidad es perfecto para utilizarlo en cualquier receta, desde una fresca ensalada hasta un delicioso Arroz con pollo , graneadito y con el sabor preciso que a todos los peruanos nos encanta. ¡Qué esperas empieza a engreir a toda tu familia con tus mejores preparaciones! |. Conoce las distintas opciones en | en plazaVea Online! | *La imagen solo es referencial | Bell ́s | ""Bell's ofrece una alternativa accesible en torno a calidad y precio de sus productos; con el respaldo y garantía de plazaVea."" | ¿En qué búsqueda? Encuentra más variedades de | en plaza Vea | Componentes del Producto | Vendido por | En caso de que algo te guste: Puedes revisar nuestras | Políticas de cambios y/o devoluciones | y hacerlas efectivas en todas nuestras tiendas. | Productos | que te pueden interesar | Recomendado para ti",,,,,"{""Descripción"": [""Información de la marca""], ""Características"": [""Presentación/Empaque"", ""Bolsa"", ""Producto Preparado"", ""SI"", ""Arroz Pregraneado"", ""No"", ""Azúcar por porción"", ""0"", ""Calorías Porción"", ""Carbohidratos Porción"", ""Grasas Porción"", ""Proteínas Porción"", ""Sodio Porción"", ""Advertencias De Almacenamiento"", ""Almacenar en un lugar cerrado, fresco y seco."", ""Contenido Neto"", ""5Kg"", ""Denominación/Variedad"", ""Extra Grado 1"", ""Advertencias de consumo"", ""Consumir preferentemente antes de la fecha indicada en el envase."", ""Revisa todo"", ""Importante destacar"", ""El producto se debe almacenar en un ambiente cerrado,fresco y seco"", ""Variedad: Extra Grado 1"", ""Presentación : Bolsa"", ""Descripción del producto"", ""plazaVea"", ""cuenta con una amplia variedad de"", ""para que puedas elegir qué más se adecua a tus necesidades."", ""Uno de los ingredientes principales de la gastronomía peruana es el"", "". Este alimento acompaña muchos platos típicos de nuestro país como un Seco a la norteña, Lomo Saltado, Ají de pollo, Cau Cau entre otro más. Es que el arroz se ha ganado un espacio en el corazón de los peruanos, gracias a su sabor y textura lo convierten en el complemento perfecto para acompañar cualquier plato."", ""En"", ""podrás encontrar diferentes presentaciones, tamaños y marcas. Por ejemplo, estás llevando una alimentación saludable te recomendamos revisar nuestro catálogo de"", ""Arroz Integral y especiales"", ""para que puedas elaborar tus recetas según tus requerimientos calóricos."", ""¡Recuerda que para lograr un"", ""Arroz Graneadito"", ""no debe faltar en tu cocina el"", ""Aceite Vegetal"", ""! Gracias a su composición y versatilidad es perfecto para utilizar en cualquier receta, desde una fresca ensalada hasta un delicioso arroz con pollo , graneadito y con el sabor preciso que a todos los peruanos nos encanta. ¡Qué esperas empieza a engreir a toda tu familia con tus mejores preparaciones!"", ""¡Conoce las distintas opciones en"", ""en plazaVea Online!"", ""*La imagen solo es referencial"", ""Bell´s"", ""\""Bell's ofrece una alternativa accesible en torno a la calidad y precio de sus productos; con el respaldo y garantía de plaza Vea"", ""¿En qué búsqueda? Encuentra más variedades de"", ""en plazaVea"", ""Componentes del Producto"", ""Vendido por"", ""En caso algo no vaya como gustes: Puedes revisar nuestras"", ""Politicas de cambios y/o devoluciones"", ""y hacerlas efectivas en todas nuestras tiendas."", ""Productos"", ""que te pueden interesar"", ""Recomendado para ti""]}",dataset/txt_limpios/1007.txt,dataset/paginas_descargadas/1007.html,ET,sin_categoria,discard,0.30,no_category_detected
1008,colaborar con nuestros estudios para marketing. También puede configurarlas.,Información de la marca,que podemos ofrecer. > 5kg,16.92,PEN,,Desconocido,unknown,PE,colaborar con nuestros estudios para marketing. También puede configurarlas.,que podemos ofrecer.,,5kg,16.92,PEN,S/,S/16.92,16.92,False,original,4.7662,4.7662,3.55,from_peru_cambio_dolar,,Información de la marca,"Presentación/Empaque | Bolsa | Producto Preparado | No | Arroz Pregraneado | Porción Sugerida | 100g | Azúcares Porción | 0 | Calorías Porción | 361Kcal | Carbohidratos Porción | 79.5g | Grasas Porción | 0.6g | Proteínas Porción | 6.6g | Sodio Porción | 13mg | Advertencias De Almacenamiento | Almacenar en un lugar cerrado, fresco y seco. | Contenido Neto | 5Kg | Denominación/Variedad | Nir Añejo | Advertencias de consumo | Consumir preferentemente antes de la fecha indicada en el envase. | Revisa todo | Importante destacar | El producto se debe almacenar en un ambiente cerrado, frescos y seco | Variedad: Añejado | Presentación : Bolsa | Descripción del producto | plaza Vea | cuenta con una amplia variedad de | para que puedas elegir el que más se adecua a tus necesidades. | Uno de los ingredientes principales de la gastronomía peruana es el | . Este alimento acompaña muchos platos típicos de nuestro país como un Seco a la norteña, Lomo Saltado, Ají de pollo, Cau Cau entre otro más. Es que el arroz se ha ganado un espacio en el corazón de los peruanos, gracias a su sabor y textura lo convierten en el complemento perfecto para acompañar cualquier plato. | En | podrás encontrar diferentes presentaciones, tamaños y marcas. Por ejemplo, estás llevando una alimentación saludable te recomendamos revisar nuestro catálogo de | Arroz Integral y especiales | para que puedas elaborar tus recetas según tus requerimientos calóricos. | Recuerda que para lograr un | Arroz Graneadito | no debe faltar en tu cocina el | Aceite Vegetal | ! Gracias a su composición y versatilidad es perfecto para utilizarlo en cualquier receta, desde una fresca ensalada hasta un delicioso Arroz con pollo , graneadito y con el sabor preciso que a todos los peruanos nos encanta. ¡Qué esperas empieza a engreir a toda tu familia con tus mejores preparaciones! | - Conoce las distintas opciones en | en plazaVea Online! | *La imagen solo es referencial | ¿En qué búsqueda? Encuentra más variedades de | en plaza Vea | Componentes del Producto | Vendido por | En caso de que algo te guste: Puedes revisar nuestras | Políticas de cambios y/o devoluciones | y hacerlas efectivas en todas nuestras tiendas. | Productos | que te pueden interesar | Recomendado para ti",,,,,"{""Descripción"": [""Información de la marca""], ""Características"": [""Presentación/Empaque"", ""Bolsa"", ""Producto Preparado"", ""No"", ""Arroz Pregraneado"", ""Porción sugerida"", ""100g"", ""Azúcar por porción"", ""0"", ""Calorías Porción"", ""361Kcal"", ""Carbohidratos Porción"", ""79.5g"", ""Grasas Porción"", ""0.6g"", ""Proteínas Porción"", ""6.6g"", ""Sodio Porción"", ""13mg"", ""Advertencias De Almacenamiento"", ""Almacenar en un lugar cerrado, fresco y seco."", ""Contenido Neto"", ""5Kg"", ""Denominación/Variedad"", ""Nir Añejo"", ""Advertencias de consumo"", ""Consumir preferentemente antes de la fecha indicada en el envase."", ""Revisa todo"", ""Importante destacar"", ""El producto se debe almacenar en un ambiente cerrado,fresco y seco"", ""Variedad: Añejado"", ""Presentación : Bolsa"", ""Descripción del producto"", ""plazaVea"", ""cuenta con una amplia variedad de"", ""para que puedas elegir qué más se adecua a tus necesidades."", ""Uno de los ingredientes principales de la gastronomía peruana es el"", "". Este alimento acompaña muchos platos típicos de nuestro país como un Seco a la norteña, Lomo Saltado, Ají de pollo, Cau Cau entre otro más. Es que el arroz se ha ganado un espacio en el corazón de los peruanos, gracias a su sabor y textura lo convierten en el complemento perfecto para acompañar cualquier plato."", ""En"", ""podrás encontrar diferentes presentaciones, tamaños y marcas. Por ejemplo, estás llevando una alimentación saludable te recomendamos revisar nuestro catálogo de"", ""Arroz Integral y especiales"", ""para que puedas elaborar tus recetas según tus requerimientos calóricos."", ""¡Recuerda que para lograr un"", ""Arroz Graneadito"", ""no debe faltar en tu cocina el"", ""Aceite Vegetal"", ""! Gracias a su composición y versatilidad es perfecto para utilizar en cualquier receta, desde una fresca ensalada hasta un delicioso arroz con pollo , graneadito y con el sabor preciso que a todos los peruanos nos encanta. ¡Qué esperas empieza a engreir a toda tu familia con tus mejores preparaciones!"", ""¡Conoce las distintas opciones en"", ""en plazaVea Online!"", ""*La imagen solo es referencial"", ""¿En qué búsqueda? Encuentra más variedades de"", ""en plazaVea"", ""Componentes del Producto"", ""Vendido por"", ""En caso algo no vaya como gustes: Puedes revisar nuestras"", ""Politicas de cambios y/o devoluciones"", ""y hacerlas efectivas en todas nuestras tiendas."", ""Productos"", ""que te pueden interesar"", ""Recomendado para ti""]}",dataset/txt_limpios/1008.txt,dataset/paginas_descargadas/1008.html,ET,sin_categoria,discard,0.30,no_category_detected
1009,colaborar con nuestros estudios para marketing. También puede configurarlas.,Información de la marca,que podemos ofrecer. > 780g,16.92,PEN,,Desconocido,unknown,PE,colaborar con nuestros estudios para marketing. También puede configurarlas.,que podemos ofrecer.,,780g,16.92,PEN,S/,S/16.92,16.92,False,original,4.7662,4.7662,3.55,from_peru_cambio_dolar,,Información de la marca,"Importante destacar | Corte de pollo | Mantener refrigerado | Se recomienda el consumo 3 veces por semana | Descripción del producto | CARNES AVES Y PESCADOS | plaza Vea | para que revises nuestra gran variedad de productos y puedas elegir todos los ingredientes que necesitas para engreir a tus seres queridos. | Por ejemplo si quieres preparar una deliciosa parrilla, lo más importante es contar una buena carne, ya sea de | Res | , | o | Chancho | . Puedes usar | Aderezos y Sazonadores | para realzar el sabor y darle un toque especial. Te recomendamos complementar tu parrilla con papas doradas el una fresca ensalada de verduras. | Por otro lado, si quieres cocinar comida marina en | también encontrarás | Pescados | y | Mariscos | para que sorprendas a todos con un exquisito ceviche, chupe de pescado, pescado frito, fetuccini con langostinos , entre otras delicias. | - Conoce las distintas opciones en | Carnes, Aves y Pescados | en plazaVea Online! | *La imagen solo es referencial | Revisa todo | Componentes del Producto | Vendido por | En caso de que algo no vaya como gustes: Puedes revisar nuestras | Políticas de cambios y/o devoluciones | y hacerlas efectivas en todas nuestras tiendas. | Productos | que te pueden interesar | Recomendado para ti",,,,,"{""Descripción"": [""Información de la marca""], ""Características"": [""Importante destacar"", ""Corte de pollo"", ""Mantener refrigerado"", ""Se recomienda consumo 3 veces por semana"", ""Descripción del producto"", ""CARNES AVES Y PESCADOS"", ""plazaVea"", ""para que revises nuestra gran variedad de productos y puedas elegir todos los ingredientes que necesitas para engreir a tus seres queridos."", ""Por ejemplo, si quieres preparar una deliciosa parrilla, lo más importante es contar una buena carne, ya sea de"", ""Res"", "","", ""o"", ""Chancho"", "". Puedes utilizar"", ""Aderezos y Sazonadores"", ""para realzar el sabor y darle un toque especial. Te recomendamos complementar tu parrilla con papas doradas el una fresca ensalada de verduras."", ""Por otro lado, si deseas cocinar comida marina en"", ""la encontrarás"", ""Pescados"", ""y"", ""Mariscos"", ""para que sorprendas a todos con un exquisito ceviche, chupe de pescado, pescado frito, fetuccini con langostinos , entre otras delicias."", ""¡Conoce las distintas opciones en"", ""Carnes , Aves y Pescados"", ""en plazaVea Online!"", ""*La imagen solo es referencial"", ""Revisa todo"", ""Componentes del Producto"", ""Vendido por"", ""En caso algo no vaya como gustes: Puedes revisar nuestras"", ""Politicas de cambios y/o devoluciones"", ""y hacerlas efectivas en todas nuestras tiendas."", ""Productos"", ""que te pueden interesar"", ""Recomendado para ti""]}",dataset/txt_limpios/1009.txt,dataset/paginas_descargadas/1009.html,ET,sin_categoria,discard,0.30,no_category_detected
1010,colaborar con nuestros estudios para marketing. También puede configurarlas.,Información de la marca,que podemos ofrecer. > 1Kg,16.92,PEN,,Desconocido,unknown,PE,colaborar con nuestros estudios para marketing. También puede configurarlas.,que podemos ofrecer.,,1Kg,16.92,PEN,S/,S/16.92,16.92,False,original,4.7662,4.7662,3.55,from_peru_cambio_dolar,,Información de la marca,"Importante destacar | Producto de calidad | Mantener refrigerado | Fuente de proteínas | Descripción del producto | CARNES AVES Y PESCADOS | plaza Vea | para que revises nuestra gran variedad de productos y puedas elegir todos los ingredientes que necesitas para engreir a tus seres queridos. | Por ejemplo si quieres preparar una deliciosa parrilla, lo más importante es contar una buena carne, ya sea de | Res | , | o | Chancho | . Puedes usar | Aderezos y Sazonadores | para realzar el sabor y darle un toque especial. Te recomendamos complementar tu parrilla con papas doradas el una fresca ensalada de verduras. | Por otro lado, si quieres cocinar comida marina en | también encontrarás | Pescados | y | Mariscos | para que sorprendas a todos con un exquisito ceviche, chupe de pescado, pescado frito, fetuccini con langostinos , entre otras delicias. | - Conoce las distintas opciones en | Carnes, Aves y Pescados | en plazaVea Online! | *La imagen solo es referencial | ""Esta empresa comienza sus actividades en 1944. Hoy en día, Sadia ofrece más de 300 tipos de productos, que van desde los productos de carne de cerdo hasta los postres más deliciosos. "" | ¿No es lo que buscas? Encuentra más | Carne de Pollo | en plaza Vea | Revisa todo | Componentes del Producto | Vendido por | En caso de que algo te guste: Puedes revisar nuestras | Políticas de cambios y/o devoluciones | y hacerlas efectivas en todas nuestras tiendas. | Productos | que te pueden interesar | Recomendado para ti",,,,,"{""Descripción"": [""Información de la marca""], ""Características"": [""Importante destacar"", ""Producto de calidad"", ""Mantener refrigerado"", ""Fuente de proteínas"", ""Descripción del producto"", ""CARNES AVES Y PESCADOS"", ""plazaVea"", ""para que revises nuestra gran variedad de productos y puedas elegir todos los ingredientes que necesitas para engreir a tus seres queridos."", ""Por ejemplo, si quieres preparar una deliciosa parrilla, lo más importante es contar una buena carne, ya sea de"", ""Res"", "","", ""o"", ""Chancho"", "". Puedes utilizar"", ""Aderezos y Sazonadores"", ""para realzar el sabor y darle un toque especial. Te recomendamos complementar tu parrilla con papas doradas el una fresca ensalada de verduras."", ""Por otro lado, si deseas cocinar comida marina en"", ""la encontrarás"", ""Pescados"", ""y"", ""Mariscos"", ""para que sorprendas a todos con un exquisito ceviche, chupe de pescado, pescado frito, fetuccini con langostinos , entre otras delicias."", ""¡Conoce las distintas opciones en"", ""Carnes , Aves y Pescados"", ""en plazaVea Online!"", ""*La imagen solo es referencial"", ""\""Esta empresa comienza sus actividades en 1944. Hoy en día, Sadia ofrece más de 300 tipos de productos, que van desde los productos de carne de cerdo hasta los postres más deliciosos. \"""", ""¿En qué búsqueda? Encuentra más"", ""Carne de Pollo"", ""en plazaVea"", ""Revisa todo"", ""Componentes del Producto"", ""Vendido por"", ""En caso algo no vaya como gustes: Puedes revisar nuestras"", ""Politicas de cambios y/o devoluciones"", ""y hacerlas efectivas en todas nuestras tiendas."", ""Productos"", ""que te pueden interesar"", ""Recomendado para ti""]}",dataset/txt_limpios/1010.txt,dataset/paginas_descargadas/1010.html,ET,sin_categoria,discard,0.30,no_category_detected
1012,colaborar con nuestros estudios para marketing. También puede configurarlas.,Información de la marca,que podemos ofrecer. > 1300g,16.92,PEN,,Desconocido,unknown,PE,colaborar con nuestros estudios para marketing. También puede configurarlas.,que podemos ofrecer.,,1300g,16.92,PEN,S/,S/16.92,16.92,False,original,4.7662,4.7662,3.55,from_peru_cambio_dolar,,Información de la marca,Revisa todo | Componentes del Producto | Vendido por | plazaVea | En caso algo no vaya como gustes: Puedes revisar nuestras | Politicas de cambios y/o devoluciones | y hacerlas efectivas en todas nuestras tiendas. | Productos | que te pueden interesar | Recomendado para ti,,,,,"{""Descripción"": [""Información de la marca""], ""Características"": [""Revisa todo"", ""Componentes del Producto"", ""Vendido por"", ""plazaVea"", ""En caso algo no vaya como gustes: Puedes revisar nuestras"", ""Politicas de cambios y/o devoluciones"", ""y hacerlas efectivas en todas nuestras tiendas."", ""Productos"", ""que te pueden interesar"", ""Recomendado para ti""]}",dataset/txt_limpios/1012.txt,dataset/paginas_descargadas/1012.html,EN,sin_categoria,discard,0.30,no_category_detected
