source_id,title,description,breadcrumbs,price_raw,currency_raw,url,seller,availability,country,product_name,brand,reference,unit,price_amount,price_currency,price_symbol,price_text,price_amount_filled,price_is_imputed,price_imputation_source,price_amount_usd,price_amount_usd_filled,fx_rate_local_per_usd,fx_source,information_text,description_text,features_text,specifications_text,benefits_text,details_text,other_sections,sections,txt_path,html_path,es_status,category_canonical,decision,match_score,reasons
140,¡Lo mejor te está esperando!,Disfruta de la frescura y calidad de nuestros huevos blancos San Juan en un paquete de 30 piezas. Cada huevo es seleccionado cuidadosamente y empacado para asegurar su frescura. Ideales para tus recetas y preparaciones diaria | ... Ver más | Favoritos | Recomendados | Huevo Blanco Con 30  Bachoco 1 Carte... | 1 CA | Huevo Blanco Con 30  San Juan 1 Cart... | Huevo Blanco Con 18  Bachoco 1 Carte... | -22% | Huevo Blanco Con 12  Bachoco 1 Carte... | Huevo Blanco Con 30  Huizache 1 Cart... | Huevo Blanco Con 12  San Juan 1 Cart... | Huevo Blanco Con 30  Huevissimo 1 Ca... | Huevo Blanco Con 30  Mybrand 1 Carte... | Huevo Blanco Con 18  San Juan 1 Cart... | Huevo Blanco Con 12  Huizache  1 Car... | Huevo Blanco Jumbo Con 20  Mybrand 1... | Huevo Blanco Cage Free Con 12  Bacho... | Huevo Blanco Con 12  Mybrand 1 Carte... | Huevo Blanco Organico 12 Pzs  Campo ... | -21% | Mayonesa    Hellmanns 790 G | 790 GR | Yoghurth Griego Flip Key Lime    Cho... | 128 GR | Mostaza Preparada   French's 340 G | 340 GR | Leche Evaporada   Carnation 360 G | 360 GR | -24% | Crema Acida   Lala 426 Ml | 426 ML | Leche Fresca Entera   Zaragoza  1.8 ... | 1.8 LT | Leche Entera   Lala  1.8 Lt | Leche Uht Deslactosada Semidescremad... | 1 LT | Leche Uht Deslactosada Light Baja En... | Bebida Lactofermentada    Yakult    ... | 5 PZ | Leche Uht 100 Sin Lactosa Reducida E... | Leche Uht 100 Sin Lactosa Semidescre... | Mantequilla  Natural  Lala  90 G | 90 GR | Leche Saborizada Chocolate   Santa C... | 180 ML | Leche Condensada   La Lechera 375 G | 375 GR | Leche Fresca Lala 100 Con Proteina S... | Mes patrio Herdez | Ver más | Adobo    Doña María 235 G | Mole Doña María Almendrado En Pasta ... | Mole Doña María Almendrado Listo Par... | Mole Doña María Poblano Con Cacao En... | Mole Doña Maria Poblano Con Cacao Li... | Mole Doña Mariía Rojo En Pasta   125... | Mole En Pasta 430 Gramos   Doña Mari... | Mole Listo Para Servir  Para Servir ... | Mole Rojo En Pasta  Doña Maria 235 G | Mole Verde En Pasta  Doña Maria 230 ... | Pipián En Pasta  Doña Maria 230 G | Salsa Cacahuate Picante Cremosa   He... | Salsa Casera Con Habanero   Herdez 4... | Salsa Casera  Herdez 210 G | Salsa Guacamole 15% Mas Guacamole He...,Descarga la app > 30 piezas,98.9,,,Desconocido,unknown,UNKNOWN,¡Lo mejor te está esperando!,Descarga la app,,30 piezas,98.90,,$,$98.90,98.9,False,original,98.9,98.9,1.0,default_1usd,,,,,,Disfruta de la frescura y calidad de nuestros huevos blancos San Juan en un paquete de 30 piezas. Cada huevo es seleccionado cuidadosamente y empacado para asegurar su frescura. Ideales para tus recetas y preparaciones diaria | ... Ver más | Favoritos | Recomendados | Huevo Blanco Con 30  Bachoco 1 Carte... | 1 CA | Huevo Blanco Con 30  San Juan 1 Cart... | Huevo Blanco Con 18  Bachoco 1 Carte... | -22% | Huevo Blanco Con 12  Bachoco 1 Carte... | Huevo Blanco Con 30  Huizache 1 Cart... | Huevo Blanco Con 12  San Juan 1 Cart... | Huevo Blanco Con 30  Huevissimo 1 Ca... | Huevo Blanco Con 30  Mybrand 1 Carte... | Huevo Blanco Con 18  San Juan 1 Cart... | Huevo Blanco Con 12  Huizache  1 Car... | Huevo Blanco Jumbo Con 20  Mybrand 1... | Huevo Blanco Cage Free Con 12  Bacho... | Huevo Blanco Con 12  Mybrand 1 Carte... | Huevo Blanco Organico 12 Pzs  Campo ... | -21% | Mayonesa    Hellmanns 790 G | 790 GR | Yoghurth Griego Flip Key Lime    Cho... | 128 GR | Mostaza Preparada   French's 340 G | 340 GR | Leche Evaporada   Carnation 360 G | 360 GR | -24% | Crema Acida   Lala 426 Ml | 426 ML | Leche Fresca Entera   Zaragoza  1.8 ... | 1.8 LT | Leche Entera   Lala  1.8 Lt | Leche Uht Deslactosada Semidescremad... | 1 LT | Leche Uht Deslactosada Light Baja En... | Bebida Lactofermentada    Yakult    ... | 5 PZ | Leche Uht 100 Sin Lactosa Reducida E... | Leche Uht 100 Sin Lactosa Semidescre... | Mantequilla  Natural  Lala  90 G | 90 GR | Leche Saborizada Chocolate   Santa C... | 180 ML | Leche Condensada   La Lechera 375 G | 375 GR | Leche Fresca Lala 100 Con Proteina S... | Mes patrio Herdez | Ver más | Adobo    Doña María 235 G | Mole Doña María Almendrado En Pasta ... | Mole Doña María Almendrado Listo Par... | Mole Doña María Poblano Con Cacao En... | Mole Doña Maria Poblano Con Cacao Li... | Mole Doña Mariía Rojo En Pasta   125... | Mole En Pasta 430 Gramos   Doña Mari... | Mole Listo Para Servir  Para Servir ... | Mole Rojo En Pasta  Doña Maria 235 G | Mole Verde En Pasta  Doña Maria 230 ... | Pipián En Pasta  Doña Maria 230 G | Salsa Cacahuate Picante Cremosa   He... | Salsa Casera Con Habanero   Herdez 4... | Salsa Casera  Herdez 210 G | Salsa Guacamole 15% Mas Guacamole He...,,"{""Detalles"": [""Disfruta de la frescura y calidad de nuestros huevos blancos San Juan en un paquete de 30 piezas. Cada huevo es seleccionado cuidadosamente y empacado para asegurar su frescura. Ideales para tus recetas y preparaciones diaria"", ""... Ver más"", ""Favoritos"", ""Recomendados"", ""Huevo Blanco Con 30  Bachoco 1 Carte..."", ""1 CA"", ""Huevo Blanco Con 30  San Juan 1 Cart..."", ""Huevo Blanco Con 18  Bachoco 1 Carte..."", ""-22%"", ""Huevo Blanco Con 12  Bachoco 1 Carte..."", ""Huevo Blanco Con 30  Huizache 1 Cart..."", ""Huevo Blanco Con 12  San Juan 1 Cart..."", ""Huevo Blanco Con 30  Huevissimo 1 Ca..."", ""Huevo Blanco Con 30  Mybrand 1 Carte..."", ""Huevo Blanco Con 18  San Juan 1 Cart..."", ""Huevo Blanco Con 12  Huizache  1 Car..."", ""Huevo Blanco Jumbo Con 20  Mybrand 1..."", ""Huevo Blanco Cage Free Con 12  Bacho..."", ""Huevo Blanco Con 12  Mybrand 1 Carte..."", ""Huevo Blanco Organico 12 Pzs  Campo ..."", ""-21%"", ""Mayonesa    Hellmanns 790 G"", ""790 GR"", ""Yoghurth Griego Flip Key Lime    Cho..."", ""128 GR"", ""Mostaza Preparada   French's 340 G"", ""340 GR"", ""Leche Evaporada   Carnation 360 G"", ""360 GR"", ""-24%"", ""Crema Acida   Lala 426 Ml"", ""426 ML"", ""Leche Fresca Entera   Zaragoza  1.8 ..."", ""1.8 LT"", ""Leche Entera   Lala  1.8 Lt"", ""Leche Uht Deslactosada Semidescremad..."", ""1 LT"", ""Leche Uht Deslactosada Light Baja En..."", ""Bebida Lactofermentada    Yakult    ..."", ""5 PZ"", ""Leche Uht 100 Sin Lactosa Reducida E..."", ""Leche Uht 100 Sin Lactosa Semidescre..."", ""Mantequilla  Natural  Lala  90 G"", ""90 GR"", ""Leche Saborizada Chocolate   Santa C..."", ""180 ML"", ""Leche Condensada   La Lechera 375 G"", ""375 GR"", ""Leche Fresca Lala 100 Con Proteina S..."", ""Mes patrio Herdez"", ""Ver más"", ""Adobo    Doña María 235 G"", ""Mole Doña María Almendrado En Pasta ..."", ""Mole Doña María Almendrado Listo Par..."", ""Mole Doña María Poblano Con Cacao En..."", ""Mole Doña Maria Poblano Con Cacao Li..."", ""Mole Doña Mariía Rojo En Pasta   125..."", ""Mole En Pasta 430 Gramos   Doña Mari..."", ""Mole Listo Para Servir  Para Servir ..."", ""Mole Rojo En Pasta  Doña Maria 235 G"", ""Mole Verde En Pasta  Doña Maria 230 ..."", ""Pipián En Pasta  Doña Maria 230 G"", ""Salsa Cacahuate Picante Cremosa   He..."", ""Salsa Casera Con Habanero   Herdez 4..."", ""Salsa Casera  Herdez 210 G"", ""Salsa Guacamole 15% Mas Guacamole He...""]}",dataset/txt_limpios/140.txt,dataset/paginas_descargadas/140.html,EN,leche,keep,0.60,heuristic_default
141,¡Lo mejor te está esperando!,"¡Lleva la auténtica experiencia italiana a tu cocina con la (D)Harina de Trigo Pasta Fresca 5 Stagioni de 1 kilogramo! Esta harina de alta calidad es perfecta para crear deliciosas pastas frescas caseras, garantizando una tex | ... Ver más | Favoritos | Recomendados | -38% | Harina Fina De Trigo  El Globo 1 Kg | 1 KG | -37% | Harina De Trigo   Mimarca 1 Kg | -24% | Harina De Maíz Nixtamalizado  Maseca... | -22% | Harina De Trigo  Selecta 1 Kg | Harina De Trigo Integral  Aldeana 1 ... | Tortiharinas Grande   Del Pueblo 1 K... | Tortiharinas Mediana   Del Pueblo 1 ... | -47% | Harina Para Hot Cakes Caja  Pronto 8... | 800 GR | Harina De Maiz Para Antojitos  Masec... | -27% | Harina De Maiz Azul  Maseca 1 Kg | -21% | Harina De Maiz  Mimarca 1 Kg | Harina Para Hot Cakes Paquete  Cueta... | Harina De Maiz Amarillo  Maseca 1 Kg | -41% | Harina Para Hot Cakes  Pronto 500 Gr | 500 GR | -39% | Harina Para Hot Cakes  Pronto 350 Gr | 350 GR | Harina Para Hotcakes  Complete Butte... | 907 GR | Harina Para Hot Cakes Caja Original ... | Harina De Arroz    Tres Estrellas 25... | 250 GR | Harina Para Tamal Norteño  Maseca 1 ... | Harina De Almendra  Nature´s Heart 4... | 400 GR | Harina De Arroz    Tres Estrellas 50... | Harina De Coco   A De Coco 300 G | 300 GR | Harina De Almendra  Okko 400 G | Harina De Avena   Morama 350 G | Harina Para Pastel Blanco  Mybrand 4... | 468 GR | Harina Para Pastel Devils Chocolate ... | Harina Para Pizza  5 Stagioni 1 Kg | Harina Para Galletas Chocolate Chip ... | 17.5 OZ | Harina Para Hot Cakes Chocolate   Mo... | -36% | Harina Fina De Trigo  El Globo 5 Kg | 5 KG | Mes patrio Herdez | Ver más | Adobo    Doña María 235 G | Mole Doña María Almendrado En Pasta ... | Mole Doña María Almendrado Listo Par... | Mole Doña María Poblano Con Cacao En... | Mole Doña Maria Poblano Con Cacao Li... | Mole Doña Mariía Rojo En Pasta   125... | Mole En Pasta 430 Gramos   Doña Mari... | Mole Listo Para Servir  Para Servir ... | Mole Rojo En Pasta  Doña Maria 235 G | Mole Verde En Pasta  Doña Maria 230 ... | Pipián En Pasta  Doña Maria 230 G | Salsa Cacahuate Picante Cremosa   He... | Salsa Casera Con Habanero   Herdez 4... | Salsa Casera  Herdez 210 G | Salsa Guacamole 15% Mas Guacamole He...",Descarga la app > 1 Kg,104.9,,,Desconocido,unknown,UNKNOWN,¡Lo mejor te está esperando!,Descarga la app,,1 Kg,104.90,,$,$104.90,104.9,False,original,104.9,104.9,1.0,default_1usd,,,,,,"¡Lleva la auténtica experiencia italiana a tu cocina con la (D)Harina de Trigo Pasta Fresca 5 Stagioni de 1 kilogramo! Esta harina de alta calidad es perfecta para crear deliciosas pastas frescas caseras, garantizando una tex | ... Ver más | Favoritos | Recomendados | -38% | Harina Fina De Trigo  El Globo 1 Kg | 1 KG | -37% | Harina De Trigo   Mimarca 1 Kg | -24% | Harina De Maíz Nixtamalizado  Maseca... | -22% | Harina De Trigo  Selecta 1 Kg | Harina De Trigo Integral  Aldeana 1 ... | Tortiharinas Grande   Del Pueblo 1 K... | Tortiharinas Mediana   Del Pueblo 1 ... | -47% | Harina Para Hot Cakes Caja  Pronto 8... | 800 GR | Harina De Maiz Para Antojitos  Masec... | -27% | Harina De Maiz Azul  Maseca 1 Kg | -21% | Harina De Maiz  Mimarca 1 Kg | Harina Para Hot Cakes Paquete  Cueta... | Harina De Maiz Amarillo  Maseca 1 Kg | -41% | Harina Para Hot Cakes  Pronto 500 Gr | 500 GR | -39% | Harina Para Hot Cakes  Pronto 350 Gr | 350 GR | Harina Para Hotcakes  Complete Butte... | 907 GR | Harina Para Hot Cakes Caja Original ... | Harina De Arroz    Tres Estrellas 25... | 250 GR | Harina Para Tamal Norteño  Maseca 1 ... | Harina De Almendra  Nature´s Heart 4... | 400 GR | Harina De Arroz    Tres Estrellas 50... | Harina De Coco   A De Coco 300 G | 300 GR | Harina De Almendra  Okko 400 G | Harina De Avena   Morama 350 G | Harina Para Pastel Blanco  Mybrand 4... | 468 GR | Harina Para Pastel Devils Chocolate ... | Harina Para Pizza  5 Stagioni 1 Kg | Harina Para Galletas Chocolate Chip ... | 17.5 OZ | Harina Para Hot Cakes Chocolate   Mo... | -36% | Harina Fina De Trigo  El Globo 5 Kg | 5 KG | Mes patrio Herdez | Ver más | Adobo    Doña María 235 G | Mole Doña María Almendrado En Pasta ... | Mole Doña María Almendrado Listo Par... | Mole Doña María Poblano Con Cacao En... | Mole Doña Maria Poblano Con Cacao Li... | Mole Doña Mariía Rojo En Pasta   125... | Mole En Pasta 430 Gramos   Doña Mari... | Mole Listo Para Servir  Para Servir ... | Mole Rojo En Pasta  Doña Maria 235 G | Mole Verde En Pasta  Doña Maria 230 ... | Pipián En Pasta  Doña Maria 230 G | Salsa Cacahuate Picante Cremosa   He... | Salsa Casera Con Habanero   Herdez 4... | Salsa Casera  Herdez 210 G | Salsa Guacamole 15% Mas Guacamole He...",,"{""Detalles"": [""¡Lleva la auténtica experiencia italiana a tu cocina con la (D)Harina de Trigo Pasta Fresca 5 Stagioni de 1 kilogramo! Esta harina de alta calidad es perfecta para crear deliciosas pastas frescas caseras, garantizando una tex"", ""... Ver más"", ""Favoritos"", ""Recomendados"", ""-38%"", ""Harina Fina De Trigo  El Globo 1 Kg"", ""1 KG"", ""-37%"", ""Harina De Trigo   Mimarca 1 Kg"", ""-24%"", ""Harina De Maíz Nixtamalizado  Maseca..."", ""-22%"", ""Harina De Trigo  Selecta 1 Kg"", ""Harina De Trigo Integral  Aldeana 1 ..."", ""Tortiharinas Grande   Del Pueblo 1 K..."", ""Tortiharinas Mediana   Del Pueblo 1 ..."", ""-47%"", ""Harina Para Hot Cakes Caja  Pronto 8..."", ""800 GR"", ""Harina De Maiz Para Antojitos  Masec..."", ""-27%"", ""Harina De Maiz Azul  Maseca 1 Kg"", ""-21%"", ""Harina De Maiz  Mimarca 1 Kg"", ""Harina Para Hot Cakes Paquete  Cueta..."", ""Harina De Maiz Amarillo  Maseca 1 Kg"", ""-41%"", ""Harina Para Hot Cakes  Pronto 500 Gr"", ""500 GR"", ""-39%"", ""Harina Para Hot Cakes  Pronto 350 Gr"", ""350 GR"", ""Harina Para Hotcakes  Complete Butte..."", ""907 GR"", ""Harina Para Hot Cakes Caja Original ..."", ""Harina De Arroz    Tres Estrellas 25..."", ""250 GR"", ""Harina Para Tamal Norteño  Maseca 1 ..."", ""Harina De Almendra  Nature´s Heart 4..."", ""400 GR"", ""Harina De Arroz    Tres Estrellas 50..."", ""Harina De Coco   A De Coco 300 G"", ""300 GR"", ""Harina De Almendra  Okko 400 G"", ""Harina De Avena   Morama 350 G"", ""Harina Para Pastel Blanco  Mybrand 4..."", ""468 GR"", ""Harina Para Pastel Devils Chocolate ..."", ""Harina Para Pizza  5 Stagioni 1 Kg"", ""Harina Para Galletas Chocolate Chip ..."", ""17.5 OZ"", ""Harina Para Hot Cakes Chocolate   Mo..."", ""-36%"", ""Harina Fina De Trigo  El Globo 5 Kg"", ""5 KG"", ""Mes patrio Herdez"", ""Ver más"", ""Adobo    Doña María 235 G"", ""Mole Doña María Almendrado En Pasta ..."", ""Mole Doña María Almendrado Listo Par..."", ""Mole Doña María Poblano Con Cacao En..."", ""Mole Doña Maria Poblano Con Cacao Li..."", ""Mole Doña Mariía Rojo En Pasta   125..."", ""Mole En Pasta 430 Gramos   Doña Mari..."", ""Mole Listo Para Servir  Para Servir ..."", ""Mole Rojo En Pasta  Doña Maria 235 G"", ""Mole Verde En Pasta  Doña Maria 230 ..."", ""Pipián En Pasta  Doña Maria 230 G"", ""Salsa Cacahuate Picante Cremosa   He..."", ""Salsa Casera Con Habanero   Herdez 4..."", ""Salsa Casera  Herdez 210 G"", ""Salsa Guacamole 15% Mas Guacamole He...""]}",dataset/txt_limpios/141.txt,dataset/paginas_descargadas/141.html,EN,arroz,keep,0.60,heuristic_default
142,¡Lo mejor te está esperando!,harina de trigo usada generalmente para la elaboracion de tortillas y reposteria como galletas asi como para la empanizacion de alimentos | ... Ver más | -38% | Favoritos | Recomendados | -34% | Harina De Trigo Integral Extrafina  ... | 5 KG | 1 KG | Tortillas De Harina Chihuahua 10 Pz ... | 535 GR | -21% | Frituras De Harina   Mimarca 400 G | 400 GR | Tortillinas   Tia Rosa 288 G | 288 GR | -27% | Harina De Maiz Azul  Maseca 1 Kg | Tortillinas   Tia Rosa 418 G | 418 GR | Harina De Maiz Amarillo  Maseca 1 Kg | Harina De Arroz    Tres Estrellas 25... | 250 GR | Harina De Arroz    Tres Estrellas 50... | 500 GR | Harina Para Hot Cakes Y Waffles   Ba... | 450 GR | Harina Bread Artisan    Bobs Red Mil... | 5 LB | -36% | Harina Fina De Trigo  El Globo 5 Kg | Harina Precocida De Maiz Amarillo  P... | Harina Para Hot Cakes Caja Suaves Y ... | 800 GR | Harina Para Pizza   Delallo 35.3 Oz | 35.3 OZ | Tostadas De Tomate   Tomatillas 150 ... | 150 GR | Harina De Maiz    Campo Vivo 800 G | Tortillas De Maiz Con Tomate    Toma... | 454 GR | Tortilla De Harina 8 Pzas Mantequill... | 1 BO | Tortilla De Harina 8 Pzas Tradiciona... | Telera Integral        1 Pza | 1 PZ | Bolillo Integral        1 Pza | Tortilla De Harina 8 Pzas Integral  ... | Pan Integral   Mybrand 680 G | 680 GR | Tocino Ahumado  Chimex 170 Gr | 170 GR | Pan Blanco    Bimbo 350 G | 350 GR | Pan Integral   Bimbo 350 G | Harina Para Hot Cakes Tradicional  G... | 700 GR | Baguette        1 Pza | Mes patrio Herdez | Ver más | Adobo    Doña María 235 G | Mole Doña María Almendrado En Pasta ... | Mole Doña María Almendrado Listo Par... | Mole Doña María Poblano Con Cacao En... | Mole Doña Maria Poblano Con Cacao Li... | Mole Doña Mariía Rojo En Pasta   125... | Mole En Pasta 430 Gramos   Doña Mari... | Mole Listo Para Servir  Para Servir ... | Mole Rojo En Pasta  Doña Maria 235 G | Mole Verde En Pasta  Doña Maria 230 ... | Pipián En Pasta  Doña Maria 230 G | Salsa Cacahuate Picante Cremosa   He... | Salsa Casera Con Habanero   Herdez 4... | Salsa Casera  Herdez 210 G | Salsa Guacamole 15% Mas Guacamole He...,Descarga la app > 1 Kg,16.9,,,Desconocido,unknown,UNKNOWN,¡Lo mejor te está esperando!,Descarga la app,,1 Kg,16.90,,$,$16.90,16.9,False,original,16.9,16.9,1.0,default_1usd,,,,,,harina de trigo usada generalmente para la elaboracion de tortillas y reposteria como galletas asi como para la empanizacion de alimentos | ... Ver más | -38% | Favoritos | Recomendados | -34% | Harina De Trigo Integral Extrafina  ... | 5 KG | 1 KG | Tortillas De Harina Chihuahua 10 Pz ... | 535 GR | -21% | Frituras De Harina   Mimarca 400 G | 400 GR | Tortillinas   Tia Rosa 288 G | 288 GR | -27% | Harina De Maiz Azul  Maseca 1 Kg | Tortillinas   Tia Rosa 418 G | 418 GR | Harina De Maiz Amarillo  Maseca 1 Kg | Harina De Arroz    Tres Estrellas 25... | 250 GR | Harina De Arroz    Tres Estrellas 50... | 500 GR | Harina Para Hot Cakes Y Waffles   Ba... | 450 GR | Harina Bread Artisan    Bobs Red Mil... | 5 LB | -36% | Harina Fina De Trigo  El Globo 5 Kg | Harina Precocida De Maiz Amarillo  P... | Harina Para Hot Cakes Caja Suaves Y ... | 800 GR | Harina Para Pizza   Delallo 35.3 Oz | 35.3 OZ | Tostadas De Tomate   Tomatillas 150 ... | 150 GR | Harina De Maiz    Campo Vivo 800 G | Tortillas De Maiz Con Tomate    Toma... | 454 GR | Tortilla De Harina 8 Pzas Mantequill... | 1 BO | Tortilla De Harina 8 Pzas Tradiciona... | Telera Integral        1 Pza | 1 PZ | Bolillo Integral        1 Pza | Tortilla De Harina 8 Pzas Integral  ... | Pan Integral   Mybrand 680 G | 680 GR | Tocino Ahumado  Chimex 170 Gr | 170 GR | Pan Blanco    Bimbo 350 G | 350 GR | Pan Integral   Bimbo 350 G | Harina Para Hot Cakes Tradicional  G... | 700 GR | Baguette        1 Pza | Mes patrio Herdez | Ver más | Adobo    Doña María 235 G | Mole Doña María Almendrado En Pasta ... | Mole Doña María Almendrado Listo Par... | Mole Doña María Poblano Con Cacao En... | Mole Doña Maria Poblano Con Cacao Li... | Mole Doña Mariía Rojo En Pasta   125... | Mole En Pasta 430 Gramos   Doña Mari... | Mole Listo Para Servir  Para Servir ... | Mole Rojo En Pasta  Doña Maria 235 G | Mole Verde En Pasta  Doña Maria 230 ... | Pipián En Pasta  Doña Maria 230 G | Salsa Cacahuate Picante Cremosa   He... | Salsa Casera Con Habanero   Herdez 4... | Salsa Casera  Herdez 210 G | Salsa Guacamole 15% Mas Guacamole He...,,"{""Detalles"": [""harina de trigo usada generalmente para la elaboracion de tortillas y reposteria como galletas asi como para la empanizacion de alimentos"", ""... Ver más"", ""-38%"", ""Favoritos"", ""Recomendados"", ""-34%"", ""Harina De Trigo Integral Extrafina  ..."", ""5 KG"", ""1 KG"", ""Tortillas De Harina Chihuahua 10 Pz ..."", ""535 GR"", ""-21%"", ""Frituras De Harina   Mimarca 400 G"", ""400 GR"", ""Tortillinas   Tia Rosa 288 G"", ""288 GR"", ""-27%"", ""Harina De Maiz Azul  Maseca 1 Kg"", ""Tortillinas   Tia Rosa 418 G"", ""418 GR"", ""Harina De Maiz Amarillo  Maseca 1 Kg"", ""Harina De Arroz    Tres Estrellas 25..."", ""250 GR"", ""Harina De Arroz    Tres Estrellas 50..."", ""500 GR"", ""Harina Para Hot Cakes Y Waffles   Ba..."", ""450 GR"", ""Harina Bread Artisan    Bobs Red Mil..."", ""5 LB"", ""-36%"", ""Harina Fina De Trigo  El Globo 5 Kg"", ""Harina Precocida De Maiz Amarillo  P..."", ""Harina Para Hot Cakes Caja Suaves Y ..."", ""800 GR"", ""Harina Para Pizza   Delallo 35.3 Oz"", ""35.3 OZ"", ""Tostadas De Tomate   Tomatillas 150 ..."", ""150 GR"", ""Harina De Maiz    Campo Vivo 800 G"", ""Tortillas De Maiz Con Tomate    Toma..."", ""454 GR"", ""Tortilla De Harina 8 Pzas Mantequill..."", ""1 BO"", ""Tortilla De Harina 8 Pzas Tradiciona..."", ""Telera Integral        1 Pza"", ""1 PZ"", ""Bolillo Integral        1 Pza"", ""Tortilla De Harina 8 Pzas Integral  ..."", ""Pan Integral   Mybrand 680 G"", ""680 GR"", ""Tocino Ahumado  Chimex 170 Gr"", ""170 GR"", ""Pan Blanco    Bimbo 350 G"", ""350 GR"", ""Pan Integral   Bimbo 350 G"", ""Harina Para Hot Cakes Tradicional  G..."", ""700 GR"", ""Baguette        1 Pza"", ""Mes patrio Herdez"", ""Ver más"", ""Adobo    Doña María 235 G"", ""Mole Doña María Almendrado En Pasta ..."", ""Mole Doña María Almendrado Listo Par..."", ""Mole Doña María Poblano Con Cacao En..."", ""Mole Doña Maria Poblano Con Cacao Li..."", ""Mole Doña Mariía Rojo En Pasta   125..."", ""Mole En Pasta 430 Gramos   Doña Mari..."", ""Mole Listo Para Servir  Para Servir ..."", ""Mole Rojo En Pasta  Doña Maria 235 G"", ""Mole Verde En Pasta  Doña Maria 230 ..."", ""Pipián En Pasta  Doña Maria 230 G"", ""Salsa Cacahuate Picante Cremosa   He..."", ""Salsa Casera Con Habanero   Herdez 4..."", ""Salsa Casera  Herdez 210 G"", ""Salsa Guacamole 15% Mas Guacamole He...""]}",dataset/txt_limpios/142.txt,dataset/paginas_descargadas/142.html,EN,pan,keep,0.60,heuristic_default
