source_id,title,description,breadcrumbs,price_raw,currency_raw,url,seller,availability,country,product_name,brand,reference,unit,price_amount,price_currency,price_symbol,price_text,price_amount_filled,price_is_imputed,price_imputation_source,price_amount_usd,price_amount_usd_filled,fx_rate_local_per_usd,fx_source,information_text,description_text,features_text,specifications_text,benefits_text,details_text,other_sections,sections,txt_path,html_path,es_status,category_canonical,decision,match_score,reasons
1330,El almacenamiento local parece estar deshabilitado en tu navegador.,Sabor original | Contiene edulcorante en calorías | Con menos azúcar | Contenido: 3.05 L | Detalles del producto | Reseñas | Escribir Su propia reseña | Estás revisando: COCA COLA ORIGINAL 3050 ML | Su valoración | 1 stars | 2 stars | 3 stars | 4 stars | 5 stars | Apodo | Resumen | Reseña | Escribir una reseña | Unds. | Search engine powered by | ElasticSuite,Aprende más > 3050 ML,2.99,,,Desconocido,unknown,UNKNOWN,El almacenamiento local parece estar deshabilitado en tu navegador.,Aprende,,3050 ML,2.99,,$,"$2,99",2.99,False,original,2.99,2.99,1.0,default_1usd,,,,,,Sabor original | Contiene edulcorante en calorías | Con menos azúcar | Contenido: 3.05 L | Detalles del producto | Reseñas | Escribir Su propia reseña | Estás revisando: COCA COLA ORIGINAL 3050 ML | Su valoración | 1 stars | 2 stars | 3 stars | 4 stars | 5 stars | Apodo | Resumen | Reseña | Escribir una reseña | Unds. | Search engine powered by | ElasticSuite,,"{""Detalles"": [""Sabor original"", ""Contiene edulcorante en calorías"", ""Con menos azúcar"", ""Contenido: 3.05 L"", ""Detalles del producto"", ""Reseñas"", ""Escribir Su propia reseña"", ""Estás revisando: COCA COLA ORIGINAL 3050 ML"", ""Su valoración"", ""Rating"", ""1 star"", ""2 stars"", ""3 stars"", ""4 stars"", ""5 stars"", ""Apodo"", ""Resumen"", ""Reseña"", ""Escribir una reseña"", ""Unds."", ""Search engine powered by"", ""ElasticSuite""]}",dataset/txt_limpios/1330.txt,dataset/paginas_descargadas/1330.html,ET,azucar,keep,0.60,heuristic_default
1331,El almacenamiento local parece estar deshabilitado en tu navegador.,Bebidas gaseosas sin calorías | Sabor a lima limón | 100% saborizantes naturales | Sin azúcar | Contenido: 3L | Detalles del producto | Reseñas | Escribir Su propia reseña | Estás revisando: Bebidas Gaseosa Cola Sprite 3L | Su valoración | Rating | 1 stars | 2 stars | 3 stars | 4 stars | 5 stars | Apodo | Resumen | Reseña | Escribir una reseña | Unds. | Search engine powered by | ElasticSuite,Aprende más > 3L,2.92,,,Desconocido,unknown,UNKNOWN,El almacenamiento local parece estar deshabilitado en tu navegador.,Aprende,,3L,2.92,,$,"$2,92",2.92,False,original,2.92,2.92,1.0,default_1usd,,,,,,Bebidas gaseosas sin calorías | Sabor a lima limón | 100% saborizantes naturales | Sin azúcar | Contenido: 3L | Detalles del producto | Reseñas | Escribir Su propia reseña | Estás revisando: Bebidas Gaseosa Cola Sprite 3L | Su valoración | Rating | 1 stars | 2 stars | 3 stars | 4 stars | 5 stars | Apodo | Resumen | Reseña | Escribir una reseña | Unds. | Search engine powered by | ElasticSuite,,"{""Detalles"": [""Bebidas gaseosas sin calorías"", ""Sabor lima limón"", ""100% saborizantes naturales"", ""Sin azúcar"", ""Contenido: 3L"", ""Detalles del producto"", ""Reseñas"", ""Escribir Su propia reseña"", ""Estás revisando: Bebidas Gaseosa Cola Sprite 3L"", ""Su valoración"", ""Rating"", ""1 star"", ""2 stars"", ""3 stars"", ""4 stars"", ""5 stars"", ""Apodo"", ""Resumen"", ""Reseña"", ""Escribir una reseña"", ""Unds."", ""Search engine powered by"", ""ElasticSuite""]}",dataset/txt_limpios/1331.txt,dataset/paginas_descargadas/1331.html,ET,azucar,keep,0.60,heuristic_default
1332,El almacenamiento local parece estar deshabilitado en tu navegador.,,Aprende más > 350G,350.0,,,Desconocido,unknown,UNKNOWN,El almacenamiento local parece estar deshabilitado en tu navegador.,Aprende,,350G,350.00,,s,s350,350.0,False,original,350.0,350.0,1.0,default_1usd,,,,,,,,{},dataset/txt_limpios/1332.txt,dataset/paginas_descargadas/1332.html,ET,sin_categoria,discard,0.30,no_category_detected
1333,El almacenamiento local parece estar deshabilitado en tu navegador.,,Aprende,55.13,,,Desconocido,unknown,UNKNOWN,El almacenamiento local parece estar deshabilitado en tu navegador.,Aprende,,,55.13,,$,"$55,13",55.13,False,original,55.13,55.13,1.0,default_1usd,,,,,,,,{},dataset/txt_limpios/1333.txt,dataset/paginas_descargadas/1333.html,ET,sin_categoria,discard,0.30,no_category_detected
1334,El almacenamiento local parece estar deshabilitado en tu navegador.,,Aprende más > 4Lb,2.25,,,Desconocido,unknown,UNKNOWN,El almacenamiento local parece estar deshabilitado en tu navegador.,Aprende,,4Lb,2.25,,$,"$2,25",2.25,False,original,2.25,2.25,1.0,default_1usd,,,,,,,,{},dataset/txt_limpios/1334.txt,dataset/paginas_descargadas/1334.html,ET,sin_categoria,discard,0.30,no_category_detected
1335,El almacenamiento local parece estar deshabilitado en tu navegador.,Tipo de carpeta: Fusilli | Número 98 | Elaborado con sémola de trigo duro | Gran fuente de energía | Enriquecido con hierro y vitamina B | Bajo índice glucémico | Cocción en 11 minutos | Contenido: 500g | Detalles del producto | Reseñas | Escribir Su propia reseña | Estás revisando: PASTA FUSILLI REGGIA 500G | Su valoración | Rating | 1 stars | 2 stars | 3 stars | 4 stars | 5 stars | Apodo | Resumen | Reseña | Escribir una reseña | Unds. | Search engine powered by | ElasticSuite,Aprende más > 500G,1.75,,,Desconocido,unknown,UNKNOWN,El almacenamiento local parece estar deshabilitado en tu navegador.,Aprende,,500G,1.75,,$,"$1,75",1.75,False,original,1.75,1.75,1.0,default_1usd,,,,,,Tipo de carpeta: Fusilli | Número 98 | Elaborado con sémola de trigo duro | Gran fuente de energía | Enriquecido con hierro y vitamina B | Bajo índice glucémico | Cocción en 11 minutos | Contenido: 500g | Detalles del producto | Reseñas | Escribir Su propia reseña | Estás revisando: PASTA FUSILLI REGGIA 500G | Su valoración | Rating | 1 stars | 2 stars | 3 stars | 4 stars | 5 stars | Apodo | Resumen | Reseña | Escribir una reseña | Unds. | Search engine powered by | ElasticSuite,,"{""Detalles"": [""Tipo de pasta: Fusilli"", ""Número 98"", ""Elaborado con sémola de trigo duro"", ""Gran fuente de energía"", ""Enriquecido con hierro y vitamina B"", ""Bajo índice glucémico"", ""Cocción en 11 minutos"", ""Contenido: 500g"", ""Detalles del producto"", ""Reseñas"", ""Escribir Su propia reseña"", ""Estás revisando: PASTA FUSILLI REGGIA 500G"", ""Su valoración"", ""Rating"", ""1 star"", ""2 stars"", ""3 stars"", ""4 stars"", ""5 stars"", ""Apodo"", ""Resumen"", ""Reseña"", ""Escribir una reseña"", ""Unds."", ""Search engine powered by"", ""ElasticSuite""]}",dataset/txt_limpios/1335.txt,dataset/paginas_descargadas/1335.html,ET,sin_categoria,discard,0.30,no_category_detected
1336,El almacenamiento local parece estar deshabilitado en tu navegador.,,Aprende,3.41,,,Desconocido,unknown,UNKNOWN,El almacenamiento local parece estar deshabilitado en tu navegador.,Aprende,,,3.41,,$,"$3,41",3.41,False,original,3.41,3.41,1.0,default_1usd,,,,,,,,{},dataset/txt_limpios/1336.txt,dataset/paginas_descargadas/1336.html,ET,sin_categoria,discard,0.30,no_category_detected
1337,El almacenamiento local parece estar deshabilitado en tu navegador.,,Aprende más > 200G,0.41,,,Desconocido,unknown,UNKNOWN,El almacenamiento local parece estar deshabilitado en tu navegador.,Aprende,,200G,0.41,,$,"$0,41",0.41,False,original,0.41,0.41,1.0,default_1usd,,,,,,,,{},dataset/txt_limpios/1337.txt,dataset/paginas_descargadas/1337.html,ET,sin_categoria,discard,0.30,no_category_detected
1338,El almacenamiento local parece estar deshabilitado en tu navegador.,Azúcar blanca granulada | Obtenido directamente del yugo de la caña de azúcar | Contenido: 1 kg | Detalles del producto | Reseñas | Escribir Su propia reseña | Estás revisando: Azucar Blanca Valdez 1Kg | Su valoración | Rating | 1 stars | 2 stars | 3 stars | 4 stars | 5 stars | Apodo | Resumen | Reseña | Escribir una reseña | Unds. | Search engine powered by | ElasticSuite,Aprende más > 1Kg,1.16,,,Desconocido,unknown,UNKNOWN,El almacenamiento local parece estar deshabilitado en tu navegador.,Aprende,,1Kg,1.16,,$,"$1,16",1.16,False,original,1.16,1.16,1.0,default_1usd,,,,,,Azúcar blanca granulada | Obtenido directamente del yugo de la caña de azúcar | Contenido: 1 kg | Detalles del producto | Reseñas | Escribir Su propia reseña | Estás revisando: Azucar Blanca Valdez 1Kg | Su valoración | Rating | 1 stars | 2 stars | 3 stars | 4 stars | 5 stars | Apodo | Resumen | Reseña | Escribir una reseña | Unds. | Search engine powered by | ElasticSuite,,"{""Detalles"": [""Azúcar blanca granulada"", ""Obtenido directamente del jugo de la caña de azúcar"", ""Contenido: 1 kg"", ""Detalles del producto"", ""Reseñas"", ""Escribir Su propia reseña"", ""Estás revisando: Azucar Blanca Valdez 1Kg"", ""Su valoración"", ""Rating"", ""1 star"", ""2 stars"", ""3 stars"", ""4 stars"", ""5 stars"", ""Apodo"", ""Resumen"", ""Reseña"", ""Escribir una reseña"", ""Unds."", ""Search engine powered by"", ""ElasticSuite""]}",dataset/txt_limpios/1338.txt,dataset/paginas_descargadas/1338.html,ET,azucar,keep,0.60,heuristic_default
1339,El almacenamiento local parece estar deshabilitado en tu navegador.,,Aprende más > 1Kg,1.12,,,Desconocido,unknown,UNKNOWN,El almacenamiento local parece estar deshabilitado en tu navegador.,Aprende,,1Kg,1.12,,$,"$1,12",1.12,False,original,1.12,1.12,1.0,default_1usd,,,,,,,,{},dataset/txt_limpios/1339.txt,dataset/paginas_descargadas/1339.html,ET,sin_categoria,discard,0.30,no_category_detected
544,Elegí tu envío,"Leche ultrapasteurizada homogeneizada, fortificada con vitaminas A y D. Libre de gluten. Fuente de vitaminas C y E. Ver más Términos más buscados 1. leche 2. cerveza 3. flamin 4. galletitas 5. café","Hola, Limpía tú cache > 1 Lt > 7790742348302",1.38,ARS,,Desconocido,unknown,AR,Elegí tu envío,"Hola, Limpía tú cache",7790742348302.0,1 Lt,1.38,ARS,$,$1.38,1.38,False,original,0.0011,0.0011,1255.0,from_argentina_cambio_dolar,,"Leche ultrapasteurizada homogeneizada, fortificada con vitaminas A y D. Libre de gluten. Fuente de vitaminas C y E. Ver más Términos más buscados 1. leche 2. cerveza 3. flamin 4. galletitas 5. café",,,,,,"{""Descripción"": [""Leche ultrapasteurizada homogeneizada, fortificada con vitaminas A y D. Libre de gluten. Fuente de vitaminas C y E."", ""Ver más"", ""Términos más buscados"", ""1."", ""leche"", ""2."", ""cerveza"", ""3."", ""flamin"", ""4."", ""galletitas"", ""5."", ""cafe""]}",dataset/txt_limpios/544.txt,dataset/paginas_descargadas/544.html,ET,cafe,keep,0.60,heuristic_default
545,Elegí tu envío,,"Hola, Limpía tú cache",,ARS,,Desconocido,unknown,AR,Elegí tu envío,"Hola, Limpía tú cache",,,,ARS,,,1663.58,True,country_mean,,1.3256,1255.0,from_argentina_cambio_dolar,,,,,,,,{},dataset/txt_limpios/545.txt,dataset/paginas_descargadas/545.html,EN,sin_categoria,discard,0.30,no_category_detected;price_parse_failed
548,Elegí tu envío,,"Hola, Limpía tú cache > 1 Lt > 7798338290028",2.18,ARS,,Desconocido,unknown,AR,Elegí tu envío,"Hola, Limpía tú cache",7798338290028.0,1 Lt,2.18,ARS,$,$2.18,2.18,False,original,0.0017,0.0017,1255.0,from_argentina_cambio_dolar,,,,,,,,{},dataset/txt_limpios/548.txt,dataset/paginas_descargadas/548.html,EN,sin_categoria,discard,0.30,no_category_detected
549,Elegí tu envío,"El pan Frago es el pan que combina recetas tradicionales mejoradas en el tiempo, con ingredientes nobles, frescura y rico sabor. Con más de 50 años de trayectoria, contamos con un portafolio variado con distintos formatos para compartir en casa. Pan integral, fresco y rico sabor Harina integral, harina de trigo 000*, agua, levadura, gluten de trigo, azúcar, salvado de trigo, aceite vegetal, germen de trigo, sal, cloruro de potasio, suero de leche en polvo, aromatizantes naturales, conservadores: INS 282, INS 200, regulador de acidez: INS 270, mejorador de la harina: INS 300. CONTIENE DERIVADOS DE TRIGO Y DE LECHE. PUEDE CONTENER AVENA, SOJA, DERIVADOS DE CEBADA Y DE CENTENO. (*) Harina de trigo enriquecido según Ley N° 25.630 con: hierro (30 mg/kg); ácido fólico (2,2 mg/kg); tiamina B1 (6,3 mg/kg); riboflavina B2 (1,3 mg/kg); niacina (13 mg/kg). Ver más Términos más buscados 1. leche 2. cerveza 3. flamin 4. galletitas 5. café","Hola, Limpía tú cache > 400 Gr > 7793890261486",4.8,ARS,,Desconocido,unknown,AR,Elegí tu envío,"Hola, Limpía tú cache",7793890261486.0,400 Gr,4.80,ARS,$,$4.80,4.8,False,original,0.0038,0.0038,1255.0,from_argentina_cambio_dolar,,"El pan Frago es el pan que combina recetas tradicionales mejoradas en el tiempo, con ingredientes nobles, frescura y rico sabor. Con más de 50 años de trayectoria, contamos con un portafolio variado con distintos formatos para compartir en casa. Pan integral, fresco y rico sabor Harina integral, harina de trigo 000*, agua, levadura, gluten de trigo, azúcar, salvado de trigo, aceite vegetal, germen de trigo, sal, cloruro de potasio, suero de leche en polvo, aromatizantes naturales, conservadores: INS 282, INS 200, regulador de acidez: INS 270, mejorador de la harina: INS 300. CONTIENE DERIVADOS DE TRIGO Y DE LECHE. PUEDE CONTENER AVENA, SOJA, DERIVADOS DE CEBADA Y DE CENTENO. (*) Harina de trigo enriquecido según Ley N° 25.630 con: hierro (30 mg/kg); ácido fólico (2,2 mg/kg); tiamina B1 (6,3 mg/kg); riboflavina B2 (1,3 mg/kg); niacina (13 mg/kg). Ver más Términos más buscados 1. leche 2. cerveza 3. flamin 4. galletitas 5. café",,,,,,"{""Descripción"": [""El pan Frago es el pan que combina recetas tradicionales mejoradas en el tiempo, con ingredientes nobles, frescura y rico sabor. Con más de 50 años de trayectoria, contamos con un portafolio variado con distintos formatos para compartir en casa."", ""Pan integral, fresco y rico sabor"", ""Harina integral, harina de trigo 000*, agua, levadura, gluten de trigo, azúcar, salvado de trigo, aceite vegetal, germen de trigo, sal, cloruro de potasio, suero de leche en polvo, aromatizantes naturales, conservadores: INS 282, INS 200, regulador de acidez: INS 270, mejorador de la harina: INS 300. CONTIENE DERIVADOS DE TRIGO Y DE LECHE. PUEDE CONTENER AVENA, SOJA, DERIVADOS DE CEBADA Y DE CENTENO. (*) Harina de trigo enriquecido según Ley N° 25.630 con: hierro (30 mg/kg); ácido fólico (2,2 mg/kg); tiamina B1 (6,3 mg/kg); riboflavina B2 (1,3 mg/kg); niacina (13 mg/kg)."", ""Ver más"", ""Términos más buscados"", ""1."", ""leche"", ""2."", ""cerveza"", ""3."", ""flamin"", ""4."", ""galletitas"", ""5."", ""cafe""]}",dataset/txt_limpios/549.txt,dataset/paginas_descargadas/549.html,ET,leche,keep,0.60,heuristic_default
550,Elegí tu envío,"El pan Blanco Bimbo ahora con rebanada más grande, suave y esponjoso. Nuestra receta está elaborada con la bondad del trigo y con FERMENTACIÓN NATURAL, para que tengas siempre en tu mesa un pan suave, esponjoso y con un gran sabor. Pan con suavidad y textura única. Reabanada más grande. Harina de trigo 000*, agua, levadura, azúcar, gluten de trigo, aceite vegetal, leche en polvo descremada, sal, cloruro de potasio, vitamina D, suero de leche en polvo, conservadores: INS 282, INS 200, regulador de acidez: INS 270, mejorador de la harina: INS 300, aromatizante natural. CONTIENE LECHE Y DERIVADOS DE TRIGO. PUEDE CONTENER SOJA, AVENA, DERIVADOS DE CENTENO Y DE CEBADA. (*) Harina de trigo enriquecido según Ley N° 25.630 con: hierro (30 mg/kg); ácido fólico (2,2 mg/kg); tiamina B1 (6,3 mg/kg); riboflavina B2 (1,3 mg/kg); niacina (13 mg/kg). Ver más Términos más buscados 1. leche 2. cerveza 3. flamin 4. galletitas 5. café","Hola, Limpía tú cache > 610 Gr > 7793890261189",6.43,ARS,,Desconocido,unknown,AR,Elegí tu envío,"Hola, Limpía tú cache",7793890261189.0,610 Gr,6.43,ARS,$,$6.43,6.43,False,original,0.0051,0.0051,1255.0,from_argentina_cambio_dolar,,"El pan Blanco Bimbo ahora con rebanada más grande, suave y esponjoso. Nuestra receta está elaborada con la bondad del trigo y con FERMENTACIÓN NATURAL, para que tengas siempre en tu mesa un pan suave, esponjoso y con un gran sabor. Pan con suavidad y textura única. Reabanada más grande. Harina de trigo 000*, agua, levadura, azúcar, gluten de trigo, aceite vegetal, leche en polvo descremada, sal, cloruro de potasio, vitamina D, suero de leche en polvo, conservadores: INS 282, INS 200, regulador de acidez: INS 270, mejorador de la harina: INS 300, aromatizante natural. CONTIENE LECHE Y DERIVADOS DE TRIGO. PUEDE CONTENER SOJA, AVENA, DERIVADOS DE CENTENO Y DE CEBADA. (*) Harina de trigo enriquecido según Ley N° 25.630 con: hierro (30 mg/kg); ácido fólico (2,2 mg/kg); tiamina B1 (6,3 mg/kg); riboflavina B2 (1,3 mg/kg); niacina (13 mg/kg). Ver más Términos más buscados 1. leche 2. cerveza 3. flamin 4. galletitas 5. café",,,,,,"{""Descripción"": [""El pan Blanco Bimbo ahora con rebanada más grande, suave y esponjoso. Nuestra receta está elaborada con la bondad del trigo y con FERMENTACIÓN NATURAL, para que tengas siempre en tu mesa un pan suave, esponjoso y con un gran sabor."", ""Pan con suavidad y textura única. Reabanada más grande."", ""Harina de trigo 000*, agua, levadura, azúcar, gluten de trigo, aceite vegetal, leche en polvo descremada, sal, cloruro de potasio, vitamina D, suero de leche en polvo, conservadores: INS 282, INS 200, regulador de acidez: INS 270, mejorador de la harina: INS 300, aromatizante natural. CONTIENE LECHE Y DERIVADOS DE TRIGO. PUEDE CONTENER SOJA, AVENA, DERIVADOS DE CENTENO Y DE CEBADA. (*) Harina de trigo enriquecido según Ley N° 25.630 con: hierro (30 mg/kg); ácido fólico (2,2 mg/kg); tiamina B1 (6,3 mg/kg); riboflavina B2 (1,3 mg/kg); niacina (13 mg/kg)."", ""Ver más"", ""Términos más buscados"", ""1."", ""leche"", ""2."", ""cerveza"", ""3."", ""flamin"", ""4."", ""galletitas"", ""5."", ""cafe""]}",dataset/txt_limpios/550.txt,dataset/paginas_descargadas/550.html,ET,leche,keep,0.60,heuristic_default
551,Elegí tu envío,,"Hola, Limpía tú cache > 600 Gr > 7790606000391",3.49,ARS,,Desconocido,unknown,AR,Elegí tu envío,"Hola, Limpía tú cache",7790606000391.0,600 Gr,3.49,ARS,$,$3.49,3.49,False,original,0.0028,0.0028,1255.0,from_argentina_cambio_dolar,,,,,,,,{},dataset/txt_limpios/551.txt,dataset/paginas_descargadas/551.html,EN,sin_categoria,discard,0.30,no_category_detected
553,Elegí tu envío,,"Hola, Limpía tú cache",,ARS,,Desconocido,unknown,AR,Elegí tu envío,"Hola, Limpía tú cache",,,,ARS,,,1663.58,True,country_mean,,1.3256,1255.0,from_argentina_cambio_dolar,,,,,,,,{},dataset/txt_limpios/553.txt,dataset/paginas_descargadas/553.html,EN,sin_categoria,discard,0.30,no_category_detected;price_parse_failed
555,Elegí tu envío,El Azúcar Plus DIA Común tipo A 1 Kg . Es un producto de alta calidad. Ideal para infectar tus bebidas favoritas y preparar tus postres caseros. Su formato de 1 Kg. te asegura tener suficiente azúcar para todas tus recetas. Disfrutá del dulce sabor que este azúcar aporta a tus creaciones culinarias. ¡No puedes faltar en tu despensa! Ver más Términos más buscados 1. leche 2. cerveza 3. flamin 4. galletitas 5. café,"Hola, Limpía tú cache > 1 Kg > 8480017298515",990.0,ARS,,Desconocido,unknown,AR,Elegí tu envío,"Hola, Limpía tú cache",8480017298515.0,1 Kg,990.00,ARS,$,$990,990.0,False,original,0.7888,0.7888,1255.0,from_argentina_cambio_dolar,,El Azúcar Plus DIA Común tipo A 1 Kg . Es un producto de alta calidad. Ideal para infectar tus bebidas favoritas y preparar tus postres caseros. Su formato de 1 Kg. te asegura tener suficiente azúcar para todas tus recetas. Disfrutá del dulce sabor que este azúcar aporta a tus creaciones culinarias. ¡No puedes faltar en tu despensa! Ver más Términos más buscados 1. leche 2. cerveza 3. flamin 4. galletitas 5. café,,,,,,"{""Descripción"": [""El Azúcar Plus DIA Común tipo A 1 Kg"", "". Es un producto de alta calidad. Ideal para infectar tus bebidas favoritas y preparar tus postres caseros. Su formato de 1 Kg. te asegura tener suficiente azúcar para todas tus recetas. Disfrutá del dulce sabor que este azúcar aporta a tus creaciones culinarias."", ""¡No puede faltar en tu despensa!"", ""Ver más"", ""Términos más buscados"", ""1."", ""leche"", ""2."", ""cerveza"", ""3."", ""flamin"", ""4."", ""galletitas"", ""5."", ""cafe""]}",dataset/txt_limpios/555.txt,dataset/paginas_descargadas/555.html,ET,cafe,keep,0.60,heuristic_default
556,Elegí tu envío,,"Hola, Limpía tú cache",,ARS,,Desconocido,unknown,AR,Elegí tu envío,"Hola, Limpía tú cache",,,,ARS,,,1663.58,True,country_mean,,1.3256,1255.0,from_argentina_cambio_dolar,,,,,,,,{},dataset/txt_limpios/556.txt,dataset/paginas_descargadas/556.html,EN,sin_categoria,discard,0.30,no_category_detected;price_parse_failed
557,Elegí tu envío,,"Hola, Limpía tú cache",,ARS,,Desconocido,unknown,AR,Elegí tu envío,"Hola, Limpía tú cache",,,,ARS,,,1663.58,True,country_mean,,1.3256,1255.0,from_argentina_cambio_dolar,,,,,,,,{},dataset/txt_limpios/557.txt,dataset/paginas_descargadas/557.html,EN,sin_categoria,discard,0.30,no_category_detected;price_parse_failed
558,Elegí tu envío,,"Hola, Limpía tú cache > 500 Gr > 7798174970269",590.0,ARS,,Desconocido,unknown,AR,Elegí tu envío,"Hola, Limpía tú cache",7798174970269.0,500 Gr,590.00,ARS,$,$590,590.0,False,original,0.4701,0.4701,1255.0,from_argentina_cambio_dolar,,,,,,,,{},dataset/txt_limpios/558.txt,dataset/paginas_descargadas/558.html,EN,sin_categoria,discard,0.30,no_category_detected
559,Elegí tu envío,,"Hola, Limpía tú cache > 500 Gr > 7790070336385",1.5,ARS,,Desconocido,unknown,AR,Elegí tu envío,"Hola, Limpía tú cache",7790070336385.0,500 Gr,1.50,ARS,$,$1.50,1.5,False,original,0.0012,0.0012,1255.0,from_argentina_cambio_dolar,,,,,,,,{},dataset/txt_limpios/559.txt,dataset/paginas_descargadas/559.html,EN,sin_categoria,discard,0.30,no_category_detected
