{"source_id": "1569", "title": "Meu Desconto", "description": "", "breadcrumbs": "Blog Pão > 1kg", "price_raw": "7.49", "currency_raw": "BRL", "url": "", "seller": "Desconocido", "availability": "unknown", "country": "BR", "product_name": "Meu Desconto", "brand": "Blog do Pão", "reference": "", "unit": "1kg", "price_amount": 7.49, "price_currency": "BRL", "price_symbol": "R$", "price_text": "R$7,49", "price_amount_filled": "7.49", "price_is_imputed": "False", "price_imputation_source": "original", "price_amount_usd": "1.3748", "price_amount_usd_filled": "1.3748", "fx_rate_local_per_usd": "5.448", "fx_source": "from_brasil_cambio_dolar", "information_text": "", "description_text": "", "features_text": "", "specifications_text": "", "benefits_text": "", "details_text": "", "other_sections": "", "sections": {}, "txt_path": "dataset/txt_limpios/1569.txt", "html_path": "dataset/paginas_descargadas/1569.html", "es_status": "ET", "category_canonical": "pan", "decision": "keep", "match_score": 0.6, "reasons": "heuristic_default"}
{"source_id": "1571", "title": "Meu Desconto", "description": "", "breadcrumbs": "Blog Pão > 1kg", "price_raw": "6.99", "currency_raw": "BRL", "url": "", "seller": "Desconocido", "availability": "unknown", "country": "BR", "product_name": "Meu Desconto", "brand": "Blog do Pão", "reference": "", "unit": "1kg", "price_amount": 6.99, "price_currency": "BRL", "price_symbol": "R$", "price_text": "R$6,99", "price_amount_filled": "6.99", "price_is_imputed": "False", "price_imputation_source": "original", "price_amount_usd": "1.283", "price_amount_usd_filled": "1.283", "fx_rate_local_per_usd": "5.448", "fx_source": "from_brasil_cambio_dolar", "information_text": "", "description_text": "", "features_text": "", "specifications_text": "", "benefits_text": "", "details_text": "", "other_sections": "", "sections": {}, "txt_path": "dataset/txt_limpios/1571.txt", "html_path": "dataset/paginas_descargadas/1571.html", "es_status": "ET", "category_canonical": "pan", "decision": "keep", "match_score": 0.6, "reasons": "heuristic_default"}
{"source_id": "1573", "title": "Meu Desconto", "description": "", "breadcrumbs": "Blog Pão > 5kg", "price_raw": "23.99", "currency_raw": "BRL", "url": "", "seller": "Desconocido", "availability": "unknown", "country": "BR", "product_name": "Meu Desconto", "brand": "Blog do Pão", "reference": "", "unit": "5kg", "price_amount": 23.99, "price_currency": "BRL", "price_symbol": "R$", "price_text": "R$23,99", "price_amount_filled": "23.99", "price_is_imputed": "False", "price_imputation_source": "original", "price_amount_usd": "4.4035", "price_amount_usd_filled": "4.4035", "fx_rate_local_per_usd": "5.448", "fx_source": "from_brasil_cambio_dolar", "information_text": "", "description_text": "", "features_text": "", "specifications_text": "", "benefits_text": "", "details_text": "", "other_sections": "", "sections": {}, "txt_path": "dataset/txt_limpios/1573.txt", "html_path": "dataset/paginas_descargadas/1573.html", "es_status": "ET", "category_canonical": "pan", "decision": "keep", "match_score": 0.6, "reasons": "heuristic_default"}
{"source_id": "1575", "title": "Meu Desconto", "description": "", "breadcrumbs": "Blog Pão > 1kg", "price_raw": "50.0", "currency_raw": "", "url": "", "seller": "Desconocido", "availability": "unknown", "country": "UNKNOWN", "product_name": "Meu Desconto", "brand": "Blog do Pão", "reference": "", "unit": "1kg", "price_amount": 50.0, "price_currency": "", "price_symbol": "", "price_text": "50", "price_amount_filled": "50.0", "price_is_imputed": "False", "price_imputation_source": "original", "price_amount_usd": "50.0", "price_amount_usd_filled": "50.0", "fx_rate_local_per_usd": "1.0", "fx_source": "default_1usd", "information_text": "", "description_text": "", "features_text": "", "specifications_text": "", "benefits_text": "", "details_text": "", "other_sections": "", "sections": {}, "txt_path": "dataset/txt_limpios/1575.txt", "html_path": "dataset/paginas_descargadas/1575.html", "es_status": "ET", "category_canonical": "pan", "decision": "keep", "match_score": 0.6, "reasons": "heuristic_default"}
{"source_id": "1577", "title": "Meu Desconto", "description": "", "breadcrumbs": "Blog Pão > 5kg", "price_raw": "1.0", "currency_raw": "", "url": "", "seller": "Desconocido", "availability": "unknown", "country": "UNKNOWN", "product_name": "Meu Desconto", "brand": "Blog do Pão", "reference": "", "unit": "5kg", "price_amount": 1.0, "price_currency": "", "price_symbol": "", "price_text": "1", "price_amount_filled": "1.0", "price_is_imputed": "False", "price_imputation_source": "original", "price_amount_usd": "1.0", "price_amount_usd_filled": "1.0", "fx_rate_local_per_usd": "1.0", "fx_source": "default_1usd", "information_text": "", "description_text": "", "features_text": "", "specifications_text": "", "benefits_text": "", "details_text": "", "other_sections": "", "sections": {}, "txt_path": "dataset/txt_limpios/1577.txt", "html_path": "dataset/paginas_descargadas/1577.html", "es_status": "ET", "category_canonical": "pan", "decision": "keep", "match_score": 0.6, "reasons": "heuristic_default"}
{"source_id": "1580", "title": "Meu Desconto", "description": "", "breadcrumbs": "Blog Pão > 500g", "price_raw": "31.99", "currency_raw": "BRL", "url": "", "seller": "Desconocido", "availability": "unknown", "country": "BR", "product_name": "Meu Desconto", "brand": "Blog do Pão", "reference": "", "unit": "500g", "price_amount": 31.99, "price_currency": "BRL", "price_symbol": "R$", "price_text": "R$31,99", "price_amount_filled": "31.99", "price_is_imputed": "False", "price_imputation_source": "original", "price_amount_usd": "5.8719", "price_amount_usd_filled": "5.8719", "fx_rate_local_per_usd": "5.448", "fx_source": "from_brasil_cambio_dolar", "information_text": "", "description_text": "", "features_text": "", "specifications_text": "", "benefits_text": "", "details_text": "", "other_sections": "", "sections": {}, "txt_path": "dataset/txt_limpios/1580.txt", "html_path": "dataset/paginas_descargadas/1580.html", "es_status": "ET", "category_canonical": "pan", "decision": "keep", "match_score": 0.6, "reasons": "heuristic_default"}
{"source_id": "1582", "title": "Meu Desconto", "description": "", "breadcrumbs": "Blog Pão > 500g", "price_raw": "39.99", "currency_raw": "BRL", "url": "", "seller": "Desconocido", "availability": "unknown", "country": "BR", "product_name": "Meu Desconto", "brand": "Blog do Pão", "reference": "", "unit": "500g", "price_amount": 39.99, "price_currency": "BRL", "price_symbol": "R$", "price_text": "R$39,99", "price_amount_filled": "39.99", "price_is_imputed": "False", "price_imputation_source": "original", "price_amount_usd": "7.3403", "price_amount_usd_filled": "7.3403", "fx_rate_local_per_usd": "5.448", "fx_source": "from_brasil_cambio_dolar", "information_text": "", "description_text": "", "features_text": "", "specifications_text": "", "benefits_text": "", "details_text": "", "other_sections": "", "sections": {}, "txt_path": "dataset/txt_limpios/1582.txt", "html_path": "dataset/paginas_descargadas/1582.html", "es_status": "ET", "category_canonical": "pan", "decision": "keep", "match_score": 0.6, "reasons": "heuristic_default"}
{"source_id": "1584", "title": "Meu Desconto", "description": "", "breadcrumbs": "Blog Pão > 500g", "price_raw": "39.99", "currency_raw": "BRL", "url": "", "seller": "Desconocido", "availability": "unknown", "country": "BR", "product_name": "Meu Desconto", "brand": "Blog do Pão", "reference": "", "unit": "500g", "price_amount": 39.99, "price_currency": "BRL", "price_symbol": "R$", "price_text": "R$39,99", "price_amount_filled": "39.99", "price_is_imputed": "False", "price_imputation_source": "original", "price_amount_usd": "7.3403", "price_amount_usd_filled": "7.3403", "fx_rate_local_per_usd": "5.448", "fx_source": "from_brasil_cambio_dolar", "information_text": "", "description_text": "", "features_text": "", "specifications_text": "", "benefits_text": "", "details_text": "", "other_sections": "", "sections": {}, "txt_path": "dataset/txt_limpios/1584.txt", "html_path": "dataset/paginas_descargadas/1584.html", "es_status": "ET", "category_canonical": "pan", "decision": "keep", "match_score": 0.6, "reasons": "heuristic_default"}
{"source_id": "1586", "title": "Meu Desconto", "description": "", "breadcrumbs": "Blog Pão > 500g", "price_raw": "39.99", "currency_raw": "BRL", "url": "", "seller": "Desconocido", "availability": "unknown", "country": "BR", "product_name": "Meu Desconto", "brand": "Blog do Pão", "reference": "", "unit": "500g", "price_amount": 39.99, "price_currency": "BRL", "price_symbol": "R$", "price_text": "R$39,99", "price_amount_filled": "39.99", "price_is_imputed": "False", "price_imputation_source": "original", "price_amount_usd": "7.3403", "price_amount_usd_filled": "7.3403", "fx_rate_local_per_usd": "5.448", "fx_source": "from_brasil_cambio_dolar", "information_text": "", "description_text": "", "features_text": "", "specifications_text": "", "benefits_text": "", "details_text": "", "other_sections": "", "sections": {}, "txt_path": "dataset/txt_limpios/1586.txt", "html_path": "dataset/paginas_descargadas/1586.html", "es_status": "ET", "category_canonical": "pan", "decision": "keep", "match_score": 0.6, "reasons": "heuristic_default"}
{"source_id": "1587", "title": "Meu Desconto", "description": "", "breadcrumbs": "Blog Pão > 250g", "price_raw": "27.99", "currency_raw": "BRL", "url": "", "seller": "Desconocido", "availability": "unknown", "country": "BR", "product_name": "Meu Desconto", "brand": "Blog do Pão", "reference": "", "unit": "250g", "price_amount": 27.99, "price_currency": "BRL", "price_symbol": "R$", "price_text": "R$27,99", "price_amount_filled": "27.99", "price_is_imputed": "False", "price_imputation_source": "original", "price_amount_usd": "5.1377", "price_amount_usd_filled": "5.1377", "fx_rate_local_per_usd": "5.448", "fx_source": "from_brasil_cambio_dolar", "information_text": "", "description_text": "", "features_text": "", "specifications_text": "", "benefits_text": "", "details_text": "", "other_sections": "", "sections": {}, "txt_path": "dataset/txt_limpios/1587.txt", "html_path": "dataset/paginas_descargadas/1587.html", "es_status": "ET", "category_canonical": "pan", "decision": "keep", "match_score": 0.6, "reasons": "heuristic_default"}
{"source_id": "1589", "title": "Meu Desconto", "description": "", "breadcrumbs": "Blog Pão > 480g", "price_raw": "9.99", "currency_raw": "BRL", "url": "", "seller": "Desconocido", "availability": "unknown", "country": "BR", "product_name": "Meu Desconto", "brand": "Blog do Pão", "reference": "", "unit": "480g", "price_amount": 9.99, "price_currency": "BRL", "price_symbol": "R$", "price_text": "R$9,99", "price_amount_filled": "9.99", "price_is_imputed": "False", "price_imputation_source": "original", "price_amount_usd": "1.8337", "price_amount_usd_filled": "1.8337", "fx_rate_local_per_usd": "5.448", "fx_source": "from_brasil_cambio_dolar", "information_text": "", "description_text": "", "features_text": "", "specifications_text": "", "benefits_text": "", "details_text": "", "other_sections": "", "sections": {}, "txt_path": "dataset/txt_limpios/1589.txt", "html_path": "dataset/paginas_descargadas/1589.html", "es_status": "ET", "category_canonical": "pan", "decision": "keep", "match_score": 0.6, "reasons": "heuristic_default"}
{"source_id": "1591", "title": "Meu Desconto", "description": "", "breadcrumbs": "Blog Pão > 500g", "price_raw": "9.99", "currency_raw": "BRL", "url": "", "seller": "Desconocido", "availability": "unknown", "country": "BR", "product_name": "Meu Desconto", "brand": "Blog do Pão", "reference": "", "unit": "500g", "price_amount": 9.99, "price_currency": "BRL", "price_symbol": "R$", "price_text": "R$9,99", "price_amount_filled": "9.99", "price_is_imputed": "False", "price_imputation_source": "original", "price_amount_usd": "1.8337", "price_amount_usd_filled": "1.8337", "fx_rate_local_per_usd": "5.448", "fx_source": "from_brasil_cambio_dolar", "information_text": "", "description_text": "", "features_text": "", "specifications_text": "", "benefits_text": "", "details_text": "", "other_sections": "", "sections": {}, "txt_path": "dataset/txt_limpios/1591.txt", "html_path": "dataset/paginas_descargadas/1591.html", "es_status": "ET", "category_canonical": "pan", "decision": "keep", "match_score": 0.6, "reasons": "heuristic_default"}
{"source_id": "1593", "title": "Meu Desconto", "description": "", "breadcrumbs": "Blog Pão > 450g", "price_raw": "8.59", "currency_raw": "BRL", "url": "", "seller": "Desconocido", "availability": "unknown", "country": "BR", "product_name": "Meu Desconto", "brand": "Blog do Pão", "reference": "", "unit": "450g", "price_amount": 8.59, "price_currency": "BRL", "price_symbol": "R$", "price_text": "R$8,59", "price_amount_filled": "8.59", "price_is_imputed": "False", "price_imputation_source": "original", "price_amount_usd": "1.5767", "price_amount_usd_filled": "1.5767", "fx_rate_local_per_usd": "5.448", "fx_source": "from_brasil_cambio_dolar", "information_text": "", "description_text": "", "features_text": "", "specifications_text": "", "benefits_text": "", "details_text": "", "other_sections": "", "sections": {}, "txt_path": "dataset/txt_limpios/1593.txt", "html_path": "dataset/paginas_descargadas/1593.html", "es_status": "ET", "category_canonical": "pan", "decision": "keep", "match_score": 0.6, "reasons": "heuristic_default"}
{"source_id": "1595", "title": "Meu Desconto", "description": "", "breadcrumbs": "Blog Pão > 500g", "price_raw": "14.29", "currency_raw": "BRL", "url": "", "seller": "Desconocido", "availability": "unknown", "country": "BR", "product_name": "Meu Desconto", "brand": "Blog do Pão", "reference": "", "unit": "500g", "price_amount": 14.29, "price_currency": "BRL", "price_symbol": "R$", "price_text": "R$14,29", "price_amount_filled": "14.29", "price_is_imputed": "False", "price_imputation_source": "original", "price_amount_usd": "2.623", "price_amount_usd_filled": "2.623", "fx_rate_local_per_usd": "5.448", "fx_source": "from_brasil_cambio_dolar", "information_text": "", "description_text": "", "features_text": "", "specifications_text": "", "benefits_text": "", "details_text": "", "other_sections": "", "sections": {}, "txt_path": "dataset/txt_limpios/1595.txt", "html_path": "dataset/paginas_descargadas/1595.html", "es_status": "ET", "category_canonical": "pan", "decision": "keep", "match_score": 0.6, "reasons": "heuristic_default"}
{"source_id": "1597", "title": "Meu Desconto", "description": "", "breadcrumbs": "Blog Pão > 400g", "price_raw": "400.0", "currency_raw": "", "url": "", "seller": "Desconocido", "availability": "unknown", "country": "UNKNOWN", "product_name": "Meu Desconto", "brand": "Blog do Pão", "reference": "", "unit": "400g", "price_amount": 400.0, "price_currency": "", "price_symbol": "", "price_text": "400", "price_amount_filled": "400.0", "price_is_imputed": "False", "price_imputation_source": "original", "price_amount_usd": "400.0", "price_amount_usd_filled": "400.0", "fx_rate_local_per_usd": "1.0", "fx_source": "default_1usd", "information_text": "", "description_text": "", "features_text": "", "specifications_text": "", "benefits_text": "", "details_text": "", "other_sections": "", "sections": {}, "txt_path": "dataset/txt_limpios/1597.txt", "html_path": "dataset/paginas_descargadas/1597.html", "es_status": "ET", "category_canonical": "pan", "decision": "keep", "match_score": 0.6, "reasons": "heuristic_default"}
{"source_id": "1599", "title": "Meu Desconto", "description": "", "breadcrumbs": "Blog Pão > 1,5l", "price_raw": "10.99", "currency_raw": "BRL", "url": "", "seller": "Desconocido", "availability": "unknown", "country": "BR", "product_name": "Meu Desconto", "brand": "Blog do Pão", "reference": "", "unit": "1,5l", "price_amount": 10.99, "price_currency": "BRL", "price_symbol": "R$", "price_text": "R$10,99", "price_amount_filled": "10.99", "price_is_imputed": "False", "price_imputation_source": "original", "price_amount_usd": "2.0173", "price_amount_usd_filled": "2.0173", "fx_rate_local_per_usd": "5.448", "fx_source": "from_brasil_cambio_dolar", "information_text": "", "description_text": "", "features_text": "", "specifications_text": "", "benefits_text": "", "details_text": "", "other_sections": "", "sections": {}, "txt_path": "dataset/txt_limpios/1599.txt", "html_path": "dataset/paginas_descargadas/1599.html", "es_status": "ET", "category_canonical": "pan", "decision": "keep", "match_score": 0.6, "reasons": "heuristic_default"}
{"source_id": "1601", "title": "Meu Desconto", "description": "", "breadcrumbs": "Blog Pão > 600ml", "price_raw": "4.49", "currency_raw": "BRL", "url": "", "seller": "Desconocido", "availability": "unknown", "country": "BR", "product_name": "Meu Desconto", "brand": "Blog do Pão", "reference": "", "unit": "600ml", "price_amount": 4.49, "price_currency": "BRL", "price_symbol": "R$", "price_text": "R$4,49", "price_amount_filled": "4.49", "price_is_imputed": "False", "price_imputation_source": "original", "price_amount_usd": "0.8242", "price_amount_usd_filled": "0.8242", "fx_rate_local_per_usd": "5.448", "fx_source": "from_brasil_cambio_dolar", "information_text": "", "description_text": "", "features_text": "", "specifications_text": "", "benefits_text": "", "details_text": "", "other_sections": "", "sections": {}, "txt_path": "dataset/txt_limpios/1601.txt", "html_path": "dataset/paginas_descargadas/1601.html", "es_status": "ET", "category_canonical": "pan", "decision": "keep", "match_score": 0.6, "reasons": "heuristic_default"}
{"source_id": "1603", "title": "Meu Desconto", "description": "", "breadcrumbs": "Blog Pão > 1,5l", "price_raw": "8.59", "currency_raw": "BRL", "url": "", "seller": "Desconocido", "availability": "unknown", "country": "BR", "product_name": "Meu Desconto", "brand": "Blog do Pão", "reference": "", "unit": "1,5l", "price_amount": 8.59, "price_currency": "BRL", "price_symbol": "R$", "price_text": "R$8,59", "price_amount_filled": "8.59", "price_is_imputed": "False", "price_imputation_source": "original", "price_amount_usd": "1.5767", "price_amount_usd_filled": "1.5767", "fx_rate_local_per_usd": "5.448", "fx_source": "from_brasil_cambio_dolar", "information_text": "", "description_text": "", "features_text": "", "specifications_text": "", "benefits_text": "", "details_text": "", "other_sections": "", "sections": {}, "txt_path": "dataset/txt_limpios/1603.txt", "html_path": "dataset/paginas_descargadas/1603.html", "es_status": "ET", "category_canonical": "pan", "decision": "keep", "match_score": 0.6, "reasons": "heuristic_default"}
{"source_id": "1604", "title": "Meu Desconto", "description": "", "breadcrumbs": "Blog Pão > 1,5l", "price_raw": "8.59", "currency_raw": "BRL", "url": "", "seller": "Desconocido", "availability": "unknown", "country": "BR", "product_name": "Meu Desconto", "brand": "Blog do Pão", "reference": "", "unit": "1,5l", "price_amount": 8.59, "price_currency": "BRL", "price_symbol": "R$", "price_text": "R$8,59", "price_amount_filled": "8.59", "price_is_imputed": "False", "price_imputation_source": "original", "price_amount_usd": "1.5767", "price_amount_usd_filled": "1.5767", "fx_rate_local_per_usd": "5.448", "fx_source": "from_brasil_cambio_dolar", "information_text": "", "description_text": "", "features_text": "", "specifications_text": "", "benefits_text": "", "details_text": "", "other_sections": "", "sections": {}, "txt_path": "dataset/txt_limpios/1604.txt", "html_path": "dataset/paginas_descargadas/1604.html", "es_status": "ET", "category_canonical": "pan", "decision": "keep", "match_score": 0.6, "reasons": "heuristic_default"}
{"source_id": "1607", "title": "Meu Desconto", "description": "", "breadcrumbs": "Blog Pão > 1,5 Litros", "price_raw": "7.89", "currency_raw": "BRL", "url": "", "seller": "Desconocido", "availability": "unknown", "country": "BR", "product_name": "Meu Desconto", "brand": "Blog do Pão", "reference": "", "unit": "1,5 Litros", "price_amount": 7.89, "price_currency": "BRL", "price_symbol": "R$", "price_text": "R$7,89", "price_amount_filled": "7.89", "price_is_imputed": "False", "price_imputation_source": "original", "price_amount_usd": "1.4482", "price_amount_usd_filled": "1.4482", "fx_rate_local_per_usd": "5.448", "fx_source": "from_brasil_cambio_dolar", "information_text": "", "description_text": "", "features_text": "", "specifications_text": "", "benefits_text": "", "details_text": "", "other_sections": "", "sections": {}, "txt_path": "dataset/txt_limpios/1607.txt", "html_path": "dataset/paginas_descargadas/1607.html", "es_status": "ET", "category_canonical": "pan", "decision": "keep", "match_score": 0.6, "reasons": "heuristic_default"}
{"source_id": "1609", "title": "Meu Desconto", "description": "", "breadcrumbs": "Blog Pão > 500g", "price_raw": "5.39", "currency_raw": "BRL", "url": "", "seller": "Desconocido", "availability": "unknown", "country": "BR", "product_name": "Meu Desconto", "brand": "Blog do Pão", "reference": "", "unit": "500g", "price_amount": 5.39, "price_currency": "BRL", "price_symbol": "R$", "price_text": "R$5,39", "price_amount_filled": "5.39", "price_is_imputed": "False", "price_imputation_source": "original", "price_amount_usd": "0.9894", "price_amount_usd_filled": "0.9894", "fx_rate_local_per_usd": "5.448", "fx_source": "from_brasil_cambio_dolar", "information_text": "", "description_text": "", "features_text": "", "specifications_text": "", "benefits_text": "", "details_text": "", "other_sections": "", "sections": {}, "txt_path": "dataset/txt_limpios/1609.txt", "html_path": "dataset/paginas_descargadas/1609.html", "es_status": "ET", "category_canonical": "pan", "decision": "keep", "match_score": 0.6, "reasons": "heuristic_default"}
