source_id,title,description,breadcrumbs,price_raw,currency_raw,url,seller,availability,country,product_name,brand,reference,unit,price_amount,price_currency,price_symbol,price_text,price_amount_filled,price_is_imputed,price_imputation_source,price_amount_usd,price_amount_usd_filled,fx_rate_local_per_usd,fx_source,information_text,description_text,features_text,specifications_text,benefits_text,details_text,other_sections,sections,txt_path,html_path,es_status,category_canonical,decision,match_score,reasons
250,Meu Desconto,,Minha Lista > 500g,5.19,BRL,,Desconocido,unknown,BR,Meu Desconto,Minha Lista,,500g,5.19,BRL,R$,"R$5,19",5.19,False,original,0.9526,0.9526,5.448,from_brasil_cambio_dolar,,,,,,,,{},dataset/txt_limpios/250.txt,dataset/paginas_descargadas/250.html,EN,sin_categoria,discard,0.30,no_category_detected
251,Meu Desconto,,Minha Lista > 500g,5.19,BRL,,Desconocido,unknown,BR,Meu Desconto,Minha Lista,,500g,5.19,BRL,R$,"R$5,19",5.19,False,original,0.9526,0.9526,5.448,from_brasil_cambio_dolar,,,,,,,,{},dataset/txt_limpios/251.txt,dataset/paginas_descargadas/251.html,EN,sin_categoria,discard,0.30,no_category_detected
252,Meu Desconto,,Minha Lista > 500g,4.49,BRL,,Desconocido,unknown,BR,Meu Desconto,Minha Lista,,500g,4.49,BRL,R$,"R$4,49",4.49,False,original,0.8242,0.8242,5.448,from_brasil_cambio_dolar,,,,,,,,{},dataset/txt_limpios/252.txt,dataset/paginas_descargadas/252.html,EN,sin_categoria,discard,0.30,no_category_detected
253,Meu Desconto,,Minha Lista > 500g,4.49,BRL,,Desconocido,unknown,BR,Meu Desconto,Minha Lista,,500g,4.49,BRL,R$,"R$4,49",4.49,False,original,0.8242,0.8242,5.448,from_brasil_cambio_dolar,,,,,,,,{},dataset/txt_limpios/253.txt,dataset/paginas_descargadas/253.html,EN,sin_categoria,discard,0.30,no_category_detected
254,Meu Desconto,,Minha Lista > 500g,4.99,BRL,,Desconocido,unknown,BR,Meu Desconto,Minha Lista,,500g,4.99,BRL,R$,"R$4,99",4.99,False,original,0.9159,0.9159,5.448,from_brasil_cambio_dolar,,,,,,,,{},dataset/txt_limpios/254.txt,dataset/paginas_descargadas/254.html,EN,sin_categoria,discard,0.30,no_category_detected
255,Meu Desconto,,Minha Lista > 1 Litro,1.0,,,Desconocido,unknown,UNKNOWN,Meu Desconto,Minha Lista,,1 Litro,1.00,,,1,1.0,False,original,1.0,1.0,1.0,default_1usd,,,,,,,,{},dataset/txt_limpios/255.txt,dataset/paginas_descargadas/255.html,EN,sin_categoria,discard,0.30,no_category_detected
256,Meu Desconto,,Minha Lista > 1L,8.39,BRL,,Desconocido,unknown,BR,Meu Desconto,Minha Lista,,1L,8.39,BRL,R$,"R$8,39",8.39,False,original,1.54,1.54,5.448,from_brasil_cambio_dolar,,,,,,,,{},dataset/txt_limpios/256.txt,dataset/paginas_descargadas/256.html,EN,sin_categoria,discard,0.30,no_category_detected
257,Meu Desconto,,Minha Lista > 1 Litro,6.19,BRL,,Desconocido,unknown,BR,Meu Desconto,Minha Lista,,1 Litro,6.19,BRL,R$,"R$6,19",6.19,False,original,1.1362,1.1362,5.448,from_brasil_cambio_dolar,,,,,,,,{},dataset/txt_limpios/257.txt,dataset/paginas_descargadas/257.html,EN,sin_categoria,discard,0.30,no_category_detected
258,Meu Desconto,,Minha Lista > 1L,8.39,BRL,,Desconocido,unknown,BR,Meu Desconto,Minha Lista,,1L,8.39,BRL,R$,"R$8,39",8.39,False,original,1.54,1.54,5.448,from_brasil_cambio_dolar,,,,,,,,{},dataset/txt_limpios/258.txt,dataset/paginas_descargadas/258.html,EN,sin_categoria,discard,0.30,no_category_detected
259,Meu Desconto,,Minha Lista > 1 Litro,6.29,BRL,,Desconocido,unknown,BR,Meu Desconto,Minha Lista,,1 Litro,6.29,BRL,R$,"R$6,29",6.29,False,original,1.1546,1.1546,5.448,from_brasil_cambio_dolar,,,,,,,,{},dataset/txt_limpios/259.txt,dataset/paginas_descargadas/259.html,EN,sin_categoria,discard,0.30,no_category_detected
260,Meu Desconto,,Minha Lista > 350ml,5.59,BRL,,Desconocido,unknown,BR,Meu Desconto,Minha Lista,,350ml,5.59,BRL,R$,"R$5,59",5.59,False,original,1.0261,1.0261,5.448,from_brasil_cambio_dolar,,,,,,,,{},dataset/txt_limpios/260.txt,dataset/paginas_descargadas/260.html,EN,sin_categoria,discard,0.30,no_category_detected
261,Meu Desconto,,Minha Lista > 330ml,4.99,BRL,,Desconocido,unknown,BR,Meu Desconto,Minha Lista,,330ml,4.99,BRL,R$,"R$4,99",4.99,False,original,0.9159,0.9159,5.448,from_brasil_cambio_dolar,,,"Características gustativas | Frutado,Condimentada,Boa formación,persistente. | Cervezas del estilo American Lager son ligeros en color y cuerpo, tienen bajo amargor y suelen ser neutrales, refrescantes y bien carbonatadas. El sabor es sutil (es decir, ningún ingrediente puede dominar los demás). Hay un dulzor residual de malta y adjuntos y otras fuentes de azúcar pueden utilizarse. | Descargue la app | Institucional | ¿Quién somos | Trabaja Conosco | Política de privacidad y Términos de Uso | Términos Buscados | Heineken | Vinos | Fraldas | Mapa del sitio | Mapa de productos | Mapa de tiendas | Central de Atención | 0800 779 6761 | Mis Solicitudes | Encuentra una Tienda | Formas de Pago | Intercambios y descartes | Preguntas frecuentes | Nuestros canales | facebook | instagram | tiktok | whatsapp | YouTube | x | Estoy consciente",,,,,"{""Características"": [""Características gustativas"", ""Frutado,Condimentada,Boa formación,persistente."", ""Las cervezas del estilo American Lager son ligeras en color y cuerpo, tienen bajo amargor y suelen ser neutrales, refrescantes y bien carbonatadas. El sabor es sutil (es decir, ningún ingrediente puede dominar los demás). Hay un dulzor residual de malta y adjuntos y otras fuentes de azúcar pueden utilizarse."", ""baixe o app"", ""Institucional"", ""Quem somos"", ""Trabalhe Conosco"", ""Política de privacidad y Términos de uso"", ""Termos Buscados"", ""Heineken"", ""Vinhos"", ""Fraldas"", ""Mapa do site"", ""Mapa de productos"", ""Mapa de tiendas"", ""Central de Atendimento"", ""0800 779 6761"", ""Meus Pedidos"", ""Encuentra una tienda"", ""Formas de Pagamento"", ""Intercambios y descartes"", ""Preguntas frecuentes"", ""Nossos canais"", ""facebook"", ""instagram"", ""tiktok"", ""whatsapp"", ""youtube"", ""x"", ""Estou ciente""]}",dataset/txt_limpios/261.txt,dataset/paginas_descargadas/261.html,ET,sin_categoria,discard,0.30,no_category_detected
262,Meu Desconto,,Minha Lista > 269ml,3.39,BRL,,Desconocido,unknown,BR,Meu Desconto,Minha Lista,,269ml,3.39,BRL,R$,"R$3,39",3.39,False,original,0.6222,0.6222,5.448,from_brasil_cambio_dolar,,,,,,,,{},dataset/txt_limpios/262.txt,dataset/paginas_descargadas/262.html,EN,sin_categoria,discard,0.30,no_category_detected
263,Meu Desconto,,Minha Lista,18.0,,,Desconocido,unknown,UNKNOWN,Meu Desconto,Minha Lista,,,18.00,,,18,18.0,False,original,18.0,18.0,1.0,default_1usd,,,,,,,,{},dataset/txt_limpios/263.txt,dataset/paginas_descargadas/263.html,EN,sin_categoria,discard,0.30,no_category_detected
264,Meu Desconto,,Minha Lista > 350ml,5.19,BRL,,Desconocido,unknown,BR,Meu Desconto,Minha Lista,,350ml,5.19,BRL,R$,"R$5,19",5.19,False,original,0.9526,0.9526,5.448,from_brasil_cambio_dolar,,,,,,,,{},dataset/txt_limpios/264.txt,dataset/paginas_descargadas/264.html,EN,sin_categoria,discard,0.30,no_category_detected
265,Meu Desconto,,Minha Lista,18.0,,,Desconocido,unknown,UNKNOWN,Meu Desconto,Minha Lista,,,18.00,,,18,18.0,False,original,18.0,18.0,1.0,default_1usd,,,,,,,,{},dataset/txt_limpios/265.txt,dataset/paginas_descargadas/265.html,EN,sin_categoria,discard,0.30,no_category_detected
266,Meu Desconto,,Minha Lista > 800g,15.9,BRL,,Desconocido,unknown,BR,Meu Desconto,Minha Lista,,800g,15.90,BRL,R$,"R$15,90",15.9,False,original,2.9185,2.9185,5.448,from_brasil_cambio_dolar,,,,,,,,{},dataset/txt_limpios/266.txt,dataset/paginas_descargadas/266.html,EN,sin_categoria,discard,0.30,no_category_detected
267,Meu Desconto,,"Minha Lista > 2,2Kg",28.99,BRL,,Desconocido,unknown,BR,Meu Desconto,Minha Lista,,"2,2Kg",28.99,BRL,R$,"R$28,99",28.99,False,original,5.3212,5.3212,5.448,from_brasil_cambio_dolar,,,,,,,,{},dataset/txt_limpios/267.txt,dataset/paginas_descargadas/267.html,EN,sin_categoria,discard,0.30,no_category_detected
268,Meu Desconto,,Minha Lista > 700g,33.99,BRL,,Desconocido,unknown,BR,Meu Desconto,Minha Lista,,700g,33.99,BRL,R$,"R$33,99",33.99,False,original,6.239,6.239,5.448,from_brasil_cambio_dolar,,,,,,,,{},dataset/txt_limpios/268.txt,dataset/paginas_descargadas/268.html,EN,sin_categoria,discard,0.30,no_category_detected
270,Meu Desconto,,Minha Lista > 1kg,5.49,BRL,,Desconocido,unknown,BR,Meu Desconto,Minha Lista,,1kg,5.49,BRL,R$,"R$5,49",5.49,False,original,1.0077,1.0077,5.448,from_brasil_cambio_dolar,,,,,,,,{},dataset/txt_limpios/270.txt,dataset/paginas_descargadas/270.html,EN,sin_categoria,discard,0.30,no_category_detected
271,Meu Desconto,,Minha Lista > 1kg,4.29,BRL,,Desconocido,unknown,BR,Meu Desconto,Minha Lista,,1kg,4.29,BRL,R$,"R$4,29",4.29,False,original,0.7874,0.7874,5.448,from_brasil_cambio_dolar,,,,,,,,{},dataset/txt_limpios/271.txt,dataset/paginas_descargadas/271.html,EN,sin_categoria,discard,0.30,no_category_detected
272,Meu Desconto,,Minha Lista > 1kg,4.99,BRL,,Desconocido,unknown,BR,Meu Desconto,Minha Lista,,1kg,4.99,BRL,R$,"R$4,99",4.99,False,original,0.9159,0.9159,5.448,from_brasil_cambio_dolar,,,,,,,,{},dataset/txt_limpios/272.txt,dataset/paginas_descargadas/272.html,EN,sin_categoria,discard,0.30,no_category_detected
273,Meu Desconto,,Minha Lista > 1kg,9.19,BRL,,Desconocido,unknown,BR,Meu Desconto,Minha Lista,,1kg,9.19,BRL,R$,"R$9,19",9.19,False,original,1.6869,1.6869,5.448,from_brasil_cambio_dolar,,,,,,,,{},dataset/txt_limpios/273.txt,dataset/paginas_descargadas/273.html,EN,sin_categoria,discard,0.30,no_category_detected
274,Meu Desconto,,Minha Lista > 1kg,7.99,BRL,,Desconocido,unknown,BR,Meu Desconto,Minha Lista,,1kg,7.99,BRL,R$,"R$7,99",7.99,False,original,1.4666,1.4666,5.448,from_brasil_cambio_dolar,,,,,,,,{},dataset/txt_limpios/274.txt,dataset/paginas_descargadas/274.html,EN,sin_categoria,discard,0.30,no_category_detected
275,Meu Desconto,,Minha Lista > 500g,10.29,BRL,,Desconocido,unknown,BR,Meu Desconto,Minha Lista,,500g,10.29,BRL,R$,"R$10,29",10.29,False,original,1.8888,1.8888,5.448,from_brasil_cambio_dolar,,,,,,,,{},dataset/txt_limpios/275.txt,dataset/paginas_descargadas/275.html,EN,sin_categoria,discard,0.30,no_category_detected
276,Meu Desconto,,Minha Lista > 500g,7.99,BRL,,Desconocido,unknown,BR,Meu Desconto,Minha Lista,,500g,7.99,BRL,R$,"R$7,99",7.99,False,original,1.4666,1.4666,5.448,from_brasil_cambio_dolar,,,,,,,,{},dataset/txt_limpios/276.txt,dataset/paginas_descargadas/276.html,EN,sin_categoria,discard,0.30,no_category_detected
277,Meu Desconto,,Minha Lista > 1kg,9.19,BRL,,Desconocido,unknown,BR,Meu Desconto,Minha Lista,,1kg,9.19,BRL,R$,"R$9,19",9.19,False,original,1.6869,1.6869,5.448,from_brasil_cambio_dolar,,,,,,,,{},dataset/txt_limpios/277.txt,dataset/paginas_descargadas/277.html,EN,sin_categoria,discard,0.30,no_category_detected
278,Meu Desconto,,Minha Lista > 1kg,8.39,BRL,,Desconocido,unknown,BR,Meu Desconto,Minha Lista,,1kg,8.39,BRL,R$,"R$8,39",8.39,False,original,1.54,1.54,5.448,from_brasil_cambio_dolar,,,,,,,,{},dataset/txt_limpios/278.txt,dataset/paginas_descargadas/278.html,EN,sin_categoria,discard,0.30,no_category_detected
279,Meu Desconto,,Minha Lista > 250g,12.29,BRL,,Desconocido,unknown,BR,Meu Desconto,Minha Lista,,250g,12.29,BRL,R$,"R$12,29",12.29,False,original,2.2559,2.2559,5.448,from_brasil_cambio_dolar,,,,,,,,{},dataset/txt_limpios/279.txt,dataset/paginas_descargadas/279.html,EN,sin_categoria,discard,0.30,no_category_detected
373,Meu Desconto,,Minha Lista > 5kg,1.0,,,Desconocido,unknown,UNKNOWN,Meu Desconto,Minha Lista,,5kg,1.00,,,1,1.0,False,original,1.0,1.0,1.0,default_1usd,,,,,,,,{},dataset/txt_limpios/373.txt,dataset/paginas_descargadas/373.html,EN,sin_categoria,discard,0.30,no_category_detected
374,Meu Desconto,,Minha Lista > 1kg,5.09,BRL,,Desconocido,unknown,BR,Meu Desconto,Minha Lista,,1kg,5.09,BRL,R$,"R$5,09",5.09,False,original,0.9343,0.9343,5.448,from_brasil_cambio_dolar,,,,,,,,{},dataset/txt_limpios/374.txt,dataset/paginas_descargadas/374.html,EN,sin_categoria,discard,0.30,no_category_detected
375,Meu Desconto,,Minha Lista > 1kg,7.29,BRL,,Desconocido,unknown,BR,Meu Desconto,Minha Lista,,1kg,7.29,BRL,R$,"R$7,29",7.29,False,original,1.3381,1.3381,5.448,from_brasil_cambio_dolar,,,,,,,,{},dataset/txt_limpios/375.txt,dataset/paginas_descargadas/375.html,EN,sin_categoria,discard,0.30,no_category_detected
376,Meu Desconto,,Minha Lista > 5kg,17.99,BRL,,Desconocido,unknown,BR,Meu Desconto,Minha Lista,,5kg,17.99,BRL,R$,"R$17,99",17.99,False,original,3.3021,3.3021,5.448,from_brasil_cambio_dolar,,,,,,,,{},dataset/txt_limpios/376.txt,dataset/paginas_descargadas/376.html,EN,sin_categoria,discard,0.30,no_category_detected
377,Meu Desconto,,Minha Lista > 5kg,28.99,BRL,,Desconocido,unknown,BR,Meu Desconto,Minha Lista,,5kg,28.99,BRL,R$,"R$28,99",28.99,False,original,5.3212,5.3212,5.448,from_brasil_cambio_dolar,,,,,,,,{},dataset/txt_limpios/377.txt,dataset/paginas_descargadas/377.html,EN,sin_categoria,discard,0.30,no_category_detected
378,Meu Desconto,,Minha Lista > 500g,31.99,BRL,,Desconocido,unknown,BR,Meu Desconto,Minha Lista,,500g,31.99,BRL,R$,"R$31,99",31.99,False,original,5.8719,5.8719,5.448,from_brasil_cambio_dolar,,,,,,,,{},dataset/txt_limpios/378.txt,dataset/paginas_descargadas/378.html,EN,sin_categoria,discard,0.30,no_category_detected
379,Meu Desconto,,Minha Lista > 500g,37.99,BRL,,Desconocido,unknown,BR,Meu Desconto,Minha Lista,,500g,37.99,BRL,R$,"R$37,99",37.99,False,original,6.9732,6.9732,5.448,from_brasil_cambio_dolar,,,,,,,,{},dataset/txt_limpios/379.txt,dataset/paginas_descargadas/379.html,EN,sin_categoria,discard,0.30,no_category_detected
380,Meu Desconto,,Minha Lista > 500g,34.99,BRL,,Desconocido,unknown,BR,Meu Desconto,Minha Lista,,500g,34.99,BRL,R$,"R$34,99",34.99,False,original,6.4225,6.4225,5.448,from_brasil_cambio_dolar,,,,,,,,{},dataset/txt_limpios/380.txt,dataset/paginas_descargadas/380.html,EN,sin_categoria,discard,0.30,no_category_detected
381,Meu Desconto,,Minha Lista > 500g,32.49,BRL,,Desconocido,unknown,BR,Meu Desconto,Minha Lista,,500g,32.49,BRL,R$,"R$32,49",32.49,False,original,5.9637,5.9637,5.448,from_brasil_cambio_dolar,,,,,,,,{},dataset/txt_limpios/381.txt,dataset/paginas_descargadas/381.html,EN,sin_categoria,discard,0.30,no_category_detected
382,Meu Desconto,,Minha Lista > 500g,37.99,BRL,,Desconocido,unknown,BR,Meu Desconto,Minha Lista,,500g,37.99,BRL,R$,"R$37,99",37.99,False,original,6.9732,6.9732,5.448,from_brasil_cambio_dolar,,,,,,,,{},dataset/txt_limpios/382.txt,dataset/paginas_descargadas/382.html,EN,sin_categoria,discard,0.30,no_category_detected
383,Meu Desconto,,Minha Lista > 400g,400.0,,,Desconocido,unknown,UNKNOWN,Meu Desconto,Minha Lista,,400g,400.00,,,400,400.0,False,original,400.0,400.0,1.0,default_1usd,,,,,,,,{},dataset/txt_limpios/383.txt,dataset/paginas_descargadas/383.html,EN,sin_categoria,discard,0.30,no_category_detected
384,Meu Desconto,,Minha Lista > 450g,6.99,BRL,,Desconocido,unknown,BR,Meu Desconto,Minha Lista,,450g,6.99,BRL,R$,"R$6,99",6.99,False,original,1.283,1.283,5.448,from_brasil_cambio_dolar,,,,,,,,{},dataset/txt_limpios/384.txt,dataset/paginas_descargadas/384.html,EN,sin_categoria,discard,0.30,no_category_detected
385,Meu Desconto,,Minha Lista > 480g,9.99,BRL,,Desconocido,unknown,BR,Meu Desconto,Minha Lista,,480g,9.99,BRL,R$,"R$9,99",9.99,False,original,1.8337,1.8337,5.448,from_brasil_cambio_dolar,,,,,,,,{},dataset/txt_limpios/385.txt,dataset/paginas_descargadas/385.html,EN,sin_categoria,discard,0.30,no_category_detected
386,Meu Desconto,,Minha Lista > 480g,9.99,BRL,,Desconocido,unknown,BR,Meu Desconto,Minha Lista,,480g,9.99,BRL,R$,"R$9,99",9.99,False,original,1.8337,1.8337,5.448,from_brasil_cambio_dolar,,,,,,,,{},dataset/txt_limpios/386.txt,dataset/paginas_descargadas/386.html,EN,sin_categoria,discard,0.30,no_category_detected
387,Meu Desconto,,Minha Lista > 400g,5.99,BRL,,Desconocido,unknown,BR,Meu Desconto,Minha Lista,,400g,5.99,BRL,R$,"R$5,99",5.99,False,original,1.0995,1.0995,5.448,from_brasil_cambio_dolar,,,,,,,,{},dataset/txt_limpios/387.txt,dataset/paginas_descargadas/387.html,EN,sin_categoria,discard,0.30,no_category_detected
388,Meu Desconto,,Minha Lista > 350ml,3.49,BRL,,Desconocido,unknown,BR,Meu Desconto,Minha Lista,,350ml,3.49,BRL,R$,"R$3,49",3.49,False,original,0.6406,0.6406,5.448,from_brasil_cambio_dolar,,,,,,,,{},dataset/txt_limpios/388.txt,dataset/paginas_descargadas/388.html,EN,sin_categoria,discard,0.30,no_category_detected
389,Meu Desconto,,Minha Lista > 2l,11.99,BRL,,Desconocido,unknown,BR,Meu Desconto,Minha Lista,,2l,11.99,BRL,R$,"R$11,99",11.99,False,original,2.2008,2.2008,5.448,from_brasil_cambio_dolar,,,,,,,,{},dataset/txt_limpios/389.txt,dataset/paginas_descargadas/389.html,EN,sin_categoria,discard,0.30,no_category_detected
390,Meu Desconto,,Minha Lista > 2l,7.99,BRL,,Desconocido,unknown,BR,Meu Desconto,Minha Lista,,2l,7.99,BRL,R$,"R$7,99",7.99,False,original,1.4666,1.4666,5.448,from_brasil_cambio_dolar,,,,,,,,{},dataset/txt_limpios/390.txt,dataset/paginas_descargadas/390.html,EN,sin_categoria,discard,0.30,no_category_detected
391,Meu Desconto,,Minha Lista > 200ml,1.89,BRL,,Desconocido,unknown,BR,Meu Desconto,Minha Lista,,200ml,1.89,BRL,R$,"R$1,89",1.89,False,original,0.3469,0.3469,5.448,from_brasil_cambio_dolar,,,,,,,,{},dataset/txt_limpios/391.txt,dataset/paginas_descargadas/391.html,EN,sin_categoria,discard,0.30,no_category_detected
393,Meu Desconto,,Minha Lista > 500g,3.89,BRL,,Desconocido,unknown,BR,Meu Desconto,Minha Lista,,500g,3.89,BRL,R$,"R$3,89",3.89,False,original,0.714,0.714,5.448,from_brasil_cambio_dolar,,,,,,,,{},dataset/txt_limpios/393.txt,dataset/paginas_descargadas/393.html,EN,sin_categoria,discard,0.30,no_category_detected
394,Meu Desconto,,Minha Lista > 500g,5.59,BRL,,Desconocido,unknown,BR,Meu Desconto,Minha Lista,,500g,5.59,BRL,R$,"R$5,59",5.59,False,original,1.0261,1.0261,5.448,from_brasil_cambio_dolar,,,,,,,,{},dataset/txt_limpios/394.txt,dataset/paginas_descargadas/394.html,EN,sin_categoria,discard,0.30,no_category_detected
395,Meu Desconto,,Minha Lista > 500g,2.0,,,Desconocido,unknown,UNKNOWN,Meu Desconto,Minha Lista,,500g,2.00,,,2,2.0,False,original,2.0,2.0,1.0,default_1usd,,,,,,,,{},dataset/txt_limpios/395.txt,dataset/paginas_descargadas/395.html,EN,sin_categoria,discard,0.30,no_category_detected
396,Meu Desconto,,Minha Lista > 500g,11.49,BRL,,Desconocido,unknown,BR,Meu Desconto,Minha Lista,,500g,11.49,BRL,R$,"R$11,49",11.49,False,original,2.109,2.109,5.448,from_brasil_cambio_dolar,,,,,,,,{},dataset/txt_limpios/396.txt,dataset/paginas_descargadas/396.html,EN,sin_categoria,discard,0.30,no_category_detected
397,Meu Desconto,,Minha Lista > 500g,5.59,BRL,,Desconocido,unknown,BR,Meu Desconto,Minha Lista,,500g,5.59,BRL,R$,"R$5,59",5.59,False,original,1.0261,1.0261,5.448,from_brasil_cambio_dolar,,,,,,,,{},dataset/txt_limpios/397.txt,dataset/paginas_descargadas/397.html,EN,sin_categoria,discard,0.30,no_category_detected
398,Meu Desconto,,Minha Lista > 1l,1.0,,,Desconocido,unknown,UNKNOWN,Meu Desconto,Minha Lista,,1l,1.00,,,1,1.0,False,original,1.0,1.0,1.0,default_1usd,,,,,,,,{},dataset/txt_limpios/398.txt,dataset/paginas_descargadas/398.html,EN,sin_categoria,discard,0.30,no_category_detected
399,Meu Desconto,,Minha Lista > 1 Litro,4.69,BRL,,Desconocido,unknown,BR,Meu Desconto,Minha Lista,,1 Litro,4.69,BRL,R$,"R$4,69",4.69,False,original,0.8609,0.8609,5.448,from_brasil_cambio_dolar,,,,,,,,{},dataset/txt_limpios/399.txt,dataset/paginas_descargadas/399.html,EN,sin_categoria,discard,0.30,no_category_detected
400,Meu Desconto,,Minha Lista > 1l,4.49,BRL,,Desconocido,unknown,BR,Meu Desconto,Minha Lista,,1l,4.49,BRL,R$,"R$4,49",4.49,False,original,0.8242,0.8242,5.448,from_brasil_cambio_dolar,,,,,,,,{},dataset/txt_limpios/400.txt,dataset/paginas_descargadas/400.html,EN,sin_categoria,discard,0.30,no_category_detected
401,Meu Desconto,,Minha Lista > 1L,4.99,BRL,,Desconocido,unknown,BR,Meu Desconto,Minha Lista,,1L,4.99,BRL,R$,"R$4,99",4.99,False,original,0.9159,0.9159,5.448,from_brasil_cambio_dolar,,,,,,,,{},dataset/txt_limpios/401.txt,dataset/paginas_descargadas/401.html,EN,sin_categoria,discard,0.30,no_category_detected
402,Meu Desconto,,Minha Lista > 1 Litro,4.69,BRL,,Desconocido,unknown,BR,Meu Desconto,Minha Lista,,1 Litro,4.69,BRL,R$,"R$4,69",4.69,False,original,0.8609,0.8609,5.448,from_brasil_cambio_dolar,,,,,,,,{},dataset/txt_limpios/402.txt,dataset/paginas_descargadas/402.html,EN,sin_categoria,discard,0.30,no_category_detected
403,Meu Desconto,,Minha Lista > 269ml,3.49,BRL,,Desconocido,unknown,BR,Meu Desconto,Minha Lista,,269ml,3.49,BRL,R$,"R$3,49",3.49,False,original,0.6406,0.6406,5.448,from_brasil_cambio_dolar,,,,,,,,{},dataset/txt_limpios/403.txt,dataset/paginas_descargadas/403.html,EN,sin_categoria,discard,0.30,no_category_detected
404,Meu Desconto,,Minha Lista > 350ml,5.59,BRL,,Desconocido,unknown,BR,Meu Desconto,Minha Lista,,350ml,5.59,BRL,R$,"R$5,59",5.59,False,original,1.0261,1.0261,5.448,from_brasil_cambio_dolar,,,,,,,,{},dataset/txt_limpios/404.txt,dataset/paginas_descargadas/404.html,EN,sin_categoria,discard,0.30,no_category_detected
405,Meu Desconto,,Minha Lista > 330ml,6.79,BRL,,Desconocido,unknown,BR,Meu Desconto,Minha Lista,,330ml,6.79,BRL,R$,"R$6,79",6.79,False,original,1.2463,1.2463,5.448,from_brasil_cambio_dolar,,,,,,,,{},dataset/txt_limpios/405.txt,dataset/paginas_descargadas/405.html,EN,sin_categoria,discard,0.30,no_category_detected
406,Meu Desconto,,Minha Lista > 350ml,3.79,BRL,,Desconocido,unknown,BR,Meu Desconto,Minha Lista,,350ml,3.79,BRL,R$,"R$3,79",3.79,False,original,0.6957,0.6957,5.448,from_brasil_cambio_dolar,,,,,,,,{},dataset/txt_limpios/406.txt,dataset/paginas_descargadas/406.html,EN,sin_categoria,discard,0.30,no_category_detected
407,Meu Desconto,,Minha Lista > 269ml,3.19,BRL,,Desconocido,unknown,BR,Meu Desconto,Minha Lista,,269ml,3.19,BRL,R$,"R$3,19",3.19,False,original,0.5855,0.5855,5.448,from_brasil_cambio_dolar,,,,,,,,{},dataset/txt_limpios/407.txt,dataset/paginas_descargadas/407.html,EN,sin_categoria,discard,0.30,no_category_detected
