source_id,title,description,breadcrumbs,price_raw,currency_raw,url,seller,availability,country,product_name,brand,reference,unit,price_amount,price_currency,price_symbol,price_text,price_amount_filled,price_is_imputed,price_imputation_source,price_amount_usd,price_amount_usd_filled,fx_rate_local_per_usd,fx_source,information_text,description_text,features_text,specifications_text,benefits_text,details_text,other_sections,sections,txt_path,html_path,es_status,category_canonical,decision,match_score,reasons
133,¡Lo mejor te está esperando!,"Descubre el sabor clásico y la comodidad del Café Soluble Clásico Nescafé en presentación de 200 gramos. Disfruta de la calidad y el aroma inigualable de Nescafé en cada taza, perfecta para empezar tu día con energía. Este ca | ... Ver más | AGOTADO | Favoritos | Recomendados | Cafe Soluble Liofilizado Diamante  O... | 180 GR | Cafe Soluble Clãsico  Nescafe 300 G | 300 GR | Cafe Soluble Clasico  Nescafe 120 G | 120 GR | Cafe Soluble Dolca     170g | 170 GR | Cafe Soluble Clasico  Nescafe  60 G | 60 GR | Cafe Soluble Clasico Doypack Clasico... | 85 GR | Cafe Soluble Dolca     46gr | 46 GR | Cafe Soluble Decaf  Descafeinado  Ne... | 40 GR | Cafe Soluble Decaf Descafeinado  Nes... | Cafe Soluble Reserva Xiapan  Nescafe... | Cafe Soluble  Mezclado Con Azucar   ... | 100 GR | Cafe Soluble Gourmet  Garat 125 G | 125 GR | Cafe Soluble Nescaf Ice   Nescafe 17... | Cafe Soluble 24 Kilates  Oro 160 G | 160 GR | Cafe Soluble Gourmet Gold   Los Port... | Cafe Soluble  Reserva Verarica  Nesc... | Cafe Soluble Dolca     80gr | 80 GR | Cafe Soluble Reserva Oahan  Nescafe ... | Cafe Soluble Decaf Sin Cafeina  Nesc... | Cafe Soluble De Olla  Nescafe 170 G | Cafe Soluble De Olla  Legal 180 G | Cafe Soluble Dolca   Nescafe  260 G | 260 GR | Cafe Soluble    El Marino  50 G | 50 GR | Cafe Soluble Gourmet Suave Blend  Ja... | 95 GR | Cafe Soluble 24 Kilates  Oro  75 G | 75 GR | Cafe Soluble Regular   Mybrand 205 G | 205 GR | 200 GR | Cafe Soluble Con Azucar  Legal 100 G | Cafe Soluble Gourmet Intenso Blend  ... | Mes patrio Herdez | Ver más | Adobo    Doña María 235 G | Mole Doña María Almendrado En Pasta ... | Mole Doña María Almendrado Listo Par... | Mole Doña María Poblano Con Cacao En... | Mole Doña Maria Poblano Con Cacao Li... | Mole Doña Mariía Rojo En Pasta   125... | Mole En Pasta 430 Gramos   Doña Mari... | Mole Listo Para Servir  Para Servir ... | Mole Rojo En Pasta  Doña Maria 235 G | Mole Verde En Pasta  Doña Maria 230 ... | Pipián En Pasta  Doña Maria 230 G | Salsa Cacahuate Picante Cremosa   He... | Salsa Casera Con Habanero   Herdez 4... | Salsa Casera  Herdez 210 G | Salsa Guacamole 15% Mas Guacamole He...",Descarga la app > 200 G,149.9,,,Desconocido,unknown,UNKNOWN,¡Lo mejor te está esperando!,Descarga la app,,200 G,149.90,,$,$149.90,149.9,False,original,149.9,149.9,1.0,default_1usd,,,,,,"Descubre el sabor clásico y la comodidad del Café Soluble Clásico Nescafé en presentación de 200 gramos. Disfruta de la calidad y el aroma inigualable de Nescafé en cada taza, perfecta para empezar tu día con energía. Este ca | ... Ver más | AGOTADO | Favoritos | Recomendados | Cafe Soluble Liofilizado Diamante  O... | 180 GR | Cafe Soluble Clãsico  Nescafe 300 G | 300 GR | Cafe Soluble Clasico  Nescafe 120 G | 120 GR | Cafe Soluble Dolca     170g | 170 GR | Cafe Soluble Clasico  Nescafe  60 G | 60 GR | Cafe Soluble Clasico Doypack Clasico... | 85 GR | Cafe Soluble Dolca     46gr | 46 GR | Cafe Soluble Decaf  Descafeinado  Ne... | 40 GR | Cafe Soluble Decaf Descafeinado  Nes... | Cafe Soluble Reserva Xiapan  Nescafe... | Cafe Soluble  Mezclado Con Azucar   ... | 100 GR | Cafe Soluble Gourmet  Garat 125 G | 125 GR | Cafe Soluble Nescaf Ice   Nescafe 17... | Cafe Soluble 24 Kilates  Oro 160 G | 160 GR | Cafe Soluble Gourmet Gold   Los Port... | Cafe Soluble  Reserva Verarica  Nesc... | Cafe Soluble Dolca     80gr | 80 GR | Cafe Soluble Reserva Oahan  Nescafe ... | Cafe Soluble Decaf Sin Cafeina  Nesc... | Cafe Soluble De Olla  Nescafe 170 G | Cafe Soluble De Olla  Legal 180 G | Cafe Soluble Dolca   Nescafe  260 G | 260 GR | Cafe Soluble    El Marino  50 G | 50 GR | Cafe Soluble Gourmet Suave Blend  Ja... | 95 GR | Cafe Soluble 24 Kilates  Oro  75 G | 75 GR | Cafe Soluble Regular   Mybrand 205 G | 205 GR | 200 GR | Cafe Soluble Con Azucar  Legal 100 G | Cafe Soluble Gourmet Intenso Blend  ... | Mes patrio Herdez | Ver más | Adobo    Doña María 235 G | Mole Doña María Almendrado En Pasta ... | Mole Doña María Almendrado Listo Par... | Mole Doña María Poblano Con Cacao En... | Mole Doña Maria Poblano Con Cacao Li... | Mole Doña Mariía Rojo En Pasta   125... | Mole En Pasta 430 Gramos   Doña Mari... | Mole Listo Para Servir  Para Servir ... | Mole Rojo En Pasta  Doña Maria 235 G | Mole Verde En Pasta  Doña Maria 230 ... | Pipián En Pasta  Doña Maria 230 G | Salsa Cacahuate Picante Cremosa   He... | Salsa Casera Con Habanero   Herdez 4... | Salsa Casera  Herdez 210 G | Salsa Guacamole 15% Mas Guacamole He...",,"{""Detalles"": [""Descubre el sabor clásico y la comodidad del Café Soluble Clásico Nescafé en presentación de 200 gramos. Disfruta de la calidad y el aroma inigualable de Nescafé en cada taza, perfecta para empezar tu día con energía. Este ca"", ""... Ver más"", ""AGOTADO"", ""Favoritos"", ""Recomendados"", ""Cafe Soluble Liofilizado Diamante  O..."", ""180 GR"", ""Cafe Soluble Clãsico  Nescafe 300 G"", ""300 GR"", ""Cafe Soluble Clasico  Nescafe 120 G"", ""120 GR"", ""Cafe Soluble Dolca     170g"", ""170 GR"", ""Cafe Soluble Clasico  Nescafe  60 G"", ""60 GR"", ""Cafe Soluble Clasico Doypack Clasico..."", ""85 GR"", ""Cafe Soluble Dolca     46gr"", ""46 GR"", ""Cafe Soluble Decaf  Descafeinado  Ne..."", ""40 GR"", ""Cafe Soluble Decaf Descafeinado  Nes..."", ""Cafe Soluble Reserva Xiapan  Nescafe..."", ""Cafe Soluble  Mezclado Con Azucar   ..."", ""100 GR"", ""Cafe Soluble Gourmet  Garat 125 G"", ""125 GR"", ""Cafe Soluble Nescaf Ice   Nescafe 17..."", ""Cafe Soluble 24 Kilates  Oro 160 G"", ""160 GR"", ""Cafe Soluble Gourmet Gold   Los Port..."", ""Cafe Soluble  Reserva Verarica  Nesc..."", ""Cafe Soluble Dolca     80gr"", ""80 GR"", ""Cafe Soluble Reserva Oahan  Nescafe ..."", ""Cafe Soluble Decaf Sin Cafeina  Nesc..."", ""Cafe Soluble De Olla  Nescafe 170 G"", ""Cafe Soluble De Olla  Legal 180 G"", ""Cafe Soluble Dolca   Nescafe  260 G"", ""260 GR"", ""Cafe Soluble    El Marino  50 G"", ""50 GR"", ""Cafe Soluble Gourmet Suave Blend  Ja..."", ""95 GR"", ""Cafe Soluble 24 Kilates  Oro  75 G"", ""75 GR"", ""Cafe Soluble Regular   Mybrand 205 G"", ""205 GR"", ""200 GR"", ""Cafe Soluble Con Azucar  Legal 100 G"", ""Cafe Soluble Gourmet Intenso Blend  ..."", ""Mes patrio Herdez"", ""Ver más"", ""Adobo    Doña María 235 G"", ""Mole Doña María Almendrado En Pasta ..."", ""Mole Doña María Almendrado Listo Par..."", ""Mole Doña María Poblano Con Cacao En..."", ""Mole Doña Maria Poblano Con Cacao Li..."", ""Mole Doña Mariía Rojo En Pasta   125..."", ""Mole En Pasta 430 Gramos   Doña Mari..."", ""Mole Listo Para Servir  Para Servir ..."", ""Mole Rojo En Pasta  Doña Maria 235 G"", ""Mole Verde En Pasta  Doña Maria 230 ..."", ""Pipián En Pasta  Doña Maria 230 G"", ""Salsa Cacahuate Picante Cremosa   He..."", ""Salsa Casera Con Habanero   Herdez 4..."", ""Salsa Casera  Herdez 210 G"", ""Salsa Guacamole 15% Mas Guacamole He...""]}",dataset/txt_limpios/133.txt,dataset/paginas_descargadas/133.html,EN,cafe,keep,0.60,heuristic_default
134,¡Lo mejor te está esperando!,Disfruta del sabor y aroma del café en cualquier momento con el Café Instantáneo Folgers en su presentación de 226 gramos. Este café instantáneo de alta calidad está elaborado con granos seleccionados y tostados con esmero pa | ... Ver más | Favoritos | Recomendados | Cafe Soluble Moka & Chocolate Mix   ... | 224 GR | Sustituto De Crema Liquido Para Cafe... | 680 ML | Cafe Soluble Clãsico  Nescafe 300 G | 300 GR | Cafe Soluble Clasico  Nescafe 120 G | 120 GR | Cafe Molido Tostado Con Azucar  Comb... | 250 GR | Filtros Para Cafetera 100 Pzs   Brew... | 100 PZ | Cafe Soluble Dolca     170g | 170 GR | Cafe Soluble Clasico  Nescafe  60 G | 60 GR | Cafe Soluble Clasico Doypack Clasico... | 85 GR | Cafe Con Leche Uht   Lala 960 Ml | 960 ML | Cafe Soluble Dolca     46gr | 46 GR | Cafe Soluble Decaf  Descafeinado  Ne... | 40 GR | Cafe Molido Lavado De Altura  Combat... | 500 GR | Cafe Molido Gourmet  Cafe Mexicano 4... | 400 GR | Cafe Soluble Decaf Descafeinado  Nes... | Cafe Vainilla  Ole 281 Ml | 281 ML | Cafe Soluble Reserva Xiapan  Nescafe... | 180 GR | Cafe Molido Con Azucar  Combate 250 ... | Cafe Soluble  Mezclado Con Azucar   ... | 100 GR | Cafe Molido Tostado  La Parroquia 50... | Cafe Soluble Gourmet  Garat 125 G | 125 GR | Cafe Soluble Nescaf Ice   Nescafe 17... | Cafe Soluble 24 Kilates  Oro 160 G | 160 GR | Cafe Soluble Gourmet Gold   Los Port... | AGOTADO | Cafe Soluble  Reserva Verarica  Nesc... | Cafe Soluble Dolca     80gr | 80 GR | Cafe Molido Y Tostado Medio Gourmet ... | 340 GR | Cafe Soluble Reserva Oahan  Nescafe ... | Cafe Soluble Decaf Sin Cafeina  Nesc... | Mes patrio Herdez | Ver más | Adobo    Doña María 235 G | Mole Doña María Almendrado En Pasta ... | Mole Doña María Almendrado Listo Par... | Mole Doña María Poblano Con Cacao En... | Mole Doña Maria Poblano Con Cacao Li... | Mole Doña Mariía Rojo En Pasta   125... | Mole En Pasta 430 Gramos   Doña Mari... | Mole Listo Para Servir  Para Servir ... | Mole Rojo En Pasta  Doña Maria 235 G | Mole Verde En Pasta  Doña Maria 230 ... | Pipián En Pasta  Doña Maria 230 G | Salsa Cacahuate Picante Cremosa   He... | Salsa Casera Con Habanero   Herdez 4... | Salsa Casera  Herdez 210 G | Salsa Guacamole 15% Mas Guacamole He...,Descarga la app > 226 G,224.9,,,Desconocido,unknown,UNKNOWN,¡Lo mejor te está esperando!,Descarga la app,,226 G,224.90,,$,$224.90,224.9,False,original,224.9,224.9,1.0,default_1usd,,,,,,Disfruta del sabor y aroma del café en cualquier momento con el Café Instantáneo Folgers en su presentación de 226 gramos. Este café instantáneo de alta calidad está elaborado con granos seleccionados y tostados con esmero pa | ... Ver más | Favoritos | Recomendados | Cafe Soluble Moka & Chocolate Mix   ... | 224 GR | Sustituto De Crema Liquido Para Cafe... | 680 ML | Cafe Soluble Clãsico  Nescafe 300 G | 300 GR | Cafe Soluble Clasico  Nescafe 120 G | 120 GR | Cafe Molido Tostado Con Azucar  Comb... | 250 GR | Filtros Para Cafetera 100 Pzs   Brew... | 100 PZ | Cafe Soluble Dolca     170g | 170 GR | Cafe Soluble Clasico  Nescafe  60 G | 60 GR | Cafe Soluble Clasico Doypack Clasico... | 85 GR | Cafe Con Leche Uht   Lala 960 Ml | 960 ML | Cafe Soluble Dolca     46gr | 46 GR | Cafe Soluble Decaf  Descafeinado  Ne... | 40 GR | Cafe Molido Lavado De Altura  Combat... | 500 GR | Cafe Molido Gourmet  Cafe Mexicano 4... | 400 GR | Cafe Soluble Decaf Descafeinado  Nes... | Cafe Vainilla  Ole 281 Ml | 281 ML | Cafe Soluble Reserva Xiapan  Nescafe... | 180 GR | Cafe Molido Con Azucar  Combate 250 ... | Cafe Soluble  Mezclado Con Azucar   ... | 100 GR | Cafe Molido Tostado  La Parroquia 50... | Cafe Soluble Gourmet  Garat 125 G | 125 GR | Cafe Soluble Nescaf Ice   Nescafe 17... | Cafe Soluble 24 Kilates  Oro 160 G | 160 GR | Cafe Soluble Gourmet Gold   Los Port... | AGOTADO | Cafe Soluble  Reserva Verarica  Nesc... | Cafe Soluble Dolca     80gr | 80 GR | Cafe Molido Y Tostado Medio Gourmet ... | 340 GR | Cafe Soluble Reserva Oahan  Nescafe ... | Cafe Soluble Decaf Sin Cafeina  Nesc... | Mes patrio Herdez | Ver más | Adobo    Doña María 235 G | Mole Doña María Almendrado En Pasta ... | Mole Doña María Almendrado Listo Par... | Mole Doña María Poblano Con Cacao En... | Mole Doña Maria Poblano Con Cacao Li... | Mole Doña Mariía Rojo En Pasta   125... | Mole En Pasta 430 Gramos   Doña Mari... | Mole Listo Para Servir  Para Servir ... | Mole Rojo En Pasta  Doña Maria 235 G | Mole Verde En Pasta  Doña Maria 230 ... | Pipián En Pasta  Doña Maria 230 G | Salsa Cacahuate Picante Cremosa   He... | Salsa Casera Con Habanero   Herdez 4... | Salsa Casera  Herdez 210 G | Salsa Guacamole 15% Mas Guacamole He...,,"{""Detalles"": [""Disfruta del sabor y aroma del café en cualquier momento con el Café Instantáneo Folgers en su presentación de 226 gramos. Este café instantáneo de alta calidad está elaborado con granos seleccionados y tostados con esmero pa"", ""... Ver más"", ""Favoritos"", ""Recomendados"", ""Cafe Soluble Moka & Chocolate Mix   ..."", ""224 GR"", ""Sustituto De Crema Liquido Para Cafe..."", ""680 ML"", ""Cafe Soluble Clãsico  Nescafe 300 G"", ""300 GR"", ""Cafe Soluble Clasico  Nescafe 120 G"", ""120 GR"", ""Cafe Molido Tostado Con Azucar  Comb..."", ""250 GR"", ""Filtros Para Cafetera 100 Pzs   Brew..."", ""100 PZ"", ""Cafe Soluble Dolca     170g"", ""170 GR"", ""Cafe Soluble Clasico  Nescafe  60 G"", ""60 GR"", ""Cafe Soluble Clasico Doypack Clasico..."", ""85 GR"", ""Cafe Con Leche Uht   Lala 960 Ml"", ""960 ML"", ""Cafe Soluble Dolca     46gr"", ""46 GR"", ""Cafe Soluble Decaf  Descafeinado  Ne..."", ""40 GR"", ""Cafe Molido Lavado De Altura  Combat..."", ""500 GR"", ""Cafe Molido Gourmet  Cafe Mexicano 4..."", ""400 GR"", ""Cafe Soluble Decaf Descafeinado  Nes..."", ""Cafe Vainilla  Ole 281 Ml"", ""281 ML"", ""Cafe Soluble Reserva Xiapan  Nescafe..."", ""180 GR"", ""Cafe Molido Con Azucar  Combate 250 ..."", ""Cafe Soluble  Mezclado Con Azucar   ..."", ""100 GR"", ""Cafe Molido Tostado  La Parroquia 50..."", ""Cafe Soluble Gourmet  Garat 125 G"", ""125 GR"", ""Cafe Soluble Nescaf Ice   Nescafe 17..."", ""Cafe Soluble 24 Kilates  Oro 160 G"", ""160 GR"", ""Cafe Soluble Gourmet Gold   Los Port..."", ""AGOTADO"", ""Cafe Soluble  Reserva Verarica  Nesc..."", ""Cafe Soluble Dolca     80gr"", ""80 GR"", ""Cafe Molido Y Tostado Medio Gourmet ..."", ""340 GR"", ""Cafe Soluble Reserva Oahan  Nescafe ..."", ""Cafe Soluble Decaf Sin Cafeina  Nesc..."", ""Mes patrio Herdez"", ""Ver más"", ""Adobo    Doña María 235 G"", ""Mole Doña María Almendrado En Pasta ..."", ""Mole Doña María Almendrado Listo Par..."", ""Mole Doña María Poblano Con Cacao En..."", ""Mole Doña Maria Poblano Con Cacao Li..."", ""Mole Doña Mariía Rojo En Pasta   125..."", ""Mole En Pasta 430 Gramos   Doña Mari..."", ""Mole Listo Para Servir  Para Servir ..."", ""Mole Rojo En Pasta  Doña Maria 235 G"", ""Mole Verde En Pasta  Doña Maria 230 ..."", ""Pipián En Pasta  Doña Maria 230 G"", ""Salsa Cacahuate Picante Cremosa   He..."", ""Salsa Casera Con Habanero   Herdez 4..."", ""Salsa Casera  Herdez 210 G"", ""Salsa Guacamole 15% Mas Guacamole He...""]}",dataset/txt_limpios/134.txt,dataset/paginas_descargadas/134.html,EN,cafe,keep,0.60,heuristic_default
135,¡Lo mejor te está esperando!,"Disfruta de una taza de café excepcional con nuestro Café Tostado y Molido Gourmet Combate de 250 gramos. Este café de alta calidad es perfecto para tu despensa, ofreciendo un sabor y aroma únicos en cada sorbo. Experimenta e | ... Ver más | Favoritos | Recomendados | Cafe Tostado Y Molido De Altura Cafe... | 908 GR | Cafe Tostado Y Molido Medio  Costa 5... | 500 GR | Cafe Tostado Y Molido Medio  Costa 2... | 250 GR | Cafe Tostado Y Molido Gourmet  Cafe ... | Cafe Tostado Y Molido Clasico  Folge... | 272 GR | Cafe Tostado Y Molido Avellana  Gara... | Cafe Tostado Y Molido Gourmet  Comba... | Café Tostado Y Molido Gourmet House ... | 380 GR | Cafe Tostado Y Molido Vainilla Franc... | Cafe Tostado Y Molido Mediano Cafe  ... | Cafe Tostado Molido Tradicional  Los... | 340 GR | Cafe Tostado Y Molido Crema Irlandes... | Cafe Puro Tostado Y Molido Gourmet R... | 300 GR | Cafe Tostado Y Molido Americano  Int... | 400 GR | Cafe Tostado Y Molido Volcan Fuerte ... | Cafe Tostado En Grano Antioquia  Bal... | 454 GR | Cafe Tostado Molido Gourmet  52 True... | Cafe Tostado Molido Deluxe  52 True ... | Cafe Tostado Y Molido Crema E Gusto ... | Cafe Tostado Y Molido Dolcevita  Lav... | -76% | Cafe Tostado Y Molido Costiera  Lava... | AGOTADO | Cafe Tostado Y Molido Espresso Lata ... | Cafe Tostado Molido Espresso   La Fi... | Cafe Molido Tostado Con Azucar  Comb... | Cerveza Botella Stout  Minerva 355 M... | 355 ML | Cafe Molido Tostado  La Parroquia 50... | Cafe Molido Y Tostado Medio Gourmet ... | Cafe Soluble Reserva Oahan  Nescafe ... | 180 GR | Mes patrio Herdez | Ver más | Adobo    Doña María 235 G | Mole Doña María Almendrado En Pasta ... | Mole Doña María Almendrado Listo Par... | Mole Doña María Poblano Con Cacao En... | Mole Doña Maria Poblano Con Cacao Li... | Mole Doña Mariía Rojo En Pasta   125... | Mole En Pasta 430 Gramos   Doña Mari... | Mole Listo Para Servir  Para Servir ... | Mole Rojo En Pasta  Doña Maria 235 G | Mole Verde En Pasta  Doña Maria 230 ... | Pipián En Pasta  Doña Maria 230 G | Salsa Cacahuate Picante Cremosa   He... | Salsa Casera Con Habanero   Herdez 4... | Salsa Casera  Herdez 210 G | Salsa Guacamole 15% Mas Guacamole He...",Descarga la app > 250 Gr,114.9,,,Desconocido,unknown,UNKNOWN,¡Lo mejor te está esperando!,Descarga la app,,250 Gr,114.90,,$,$114.90,114.9,False,original,114.9,114.9,1.0,default_1usd,,,,,,"Disfruta de una taza de café excepcional con nuestro Café Tostado y Molido Gourmet Combate de 250 gramos. Este café de alta calidad es perfecto para tu despensa, ofreciendo un sabor y aroma únicos en cada sorbo. Experimenta e | ... Ver más | Favoritos | Recomendados | Cafe Tostado Y Molido De Altura Cafe... | 908 GR | Cafe Tostado Y Molido Medio  Costa 5... | 500 GR | Cafe Tostado Y Molido Medio  Costa 2... | 250 GR | Cafe Tostado Y Molido Gourmet  Cafe ... | Cafe Tostado Y Molido Clasico  Folge... | 272 GR | Cafe Tostado Y Molido Avellana  Gara... | Cafe Tostado Y Molido Gourmet  Comba... | Café Tostado Y Molido Gourmet House ... | 380 GR | Cafe Tostado Y Molido Vainilla Franc... | Cafe Tostado Y Molido Mediano Cafe  ... | Cafe Tostado Molido Tradicional  Los... | 340 GR | Cafe Tostado Y Molido Crema Irlandes... | Cafe Puro Tostado Y Molido Gourmet R... | 300 GR | Cafe Tostado Y Molido Americano  Int... | 400 GR | Cafe Tostado Y Molido Volcan Fuerte ... | Cafe Tostado En Grano Antioquia  Bal... | 454 GR | Cafe Tostado Molido Gourmet  52 True... | Cafe Tostado Molido Deluxe  52 True ... | Cafe Tostado Y Molido Crema E Gusto ... | Cafe Tostado Y Molido Dolcevita  Lav... | -76% | Cafe Tostado Y Molido Costiera  Lava... | AGOTADO | Cafe Tostado Y Molido Espresso Lata ... | Cafe Tostado Molido Espresso   La Fi... | Cafe Molido Tostado Con Azucar  Comb... | Cerveza Botella Stout  Minerva 355 M... | 355 ML | Cafe Molido Tostado  La Parroquia 50... | Cafe Molido Y Tostado Medio Gourmet ... | Cafe Soluble Reserva Oahan  Nescafe ... | 180 GR | Mes patrio Herdez | Ver más | Adobo    Doña María 235 G | Mole Doña María Almendrado En Pasta ... | Mole Doña María Almendrado Listo Par... | Mole Doña María Poblano Con Cacao En... | Mole Doña Maria Poblano Con Cacao Li... | Mole Doña Mariía Rojo En Pasta   125... | Mole En Pasta 430 Gramos   Doña Mari... | Mole Listo Para Servir  Para Servir ... | Mole Rojo En Pasta  Doña Maria 235 G | Mole Verde En Pasta  Doña Maria 230 ... | Pipián En Pasta  Doña Maria 230 G | Salsa Cacahuate Picante Cremosa   He... | Salsa Casera Con Habanero   Herdez 4... | Salsa Casera  Herdez 210 G | Salsa Guacamole 15% Mas Guacamole He...",,"{""Detalles"": [""Disfruta de una taza de café excepcional con nuestro Café Tostado y Molido Gourmet Combate de 250 gramos. Este café de alta calidad es perfecto para tu despensa, ofreciendo un sabor y aroma únicos en cada sorbo. Experimenta e"", ""... Ver más"", ""Favoritos"", ""Recomendados"", ""Cafe Tostado Y Molido De Altura Cafe..."", ""908 GR"", ""Cafe Tostado Y Molido Medio  Costa 5..."", ""500 GR"", ""Cafe Tostado Y Molido Medio  Costa 2..."", ""250 GR"", ""Cafe Tostado Y Molido Gourmet  Cafe ..."", ""Cafe Tostado Y Molido Clasico  Folge..."", ""272 GR"", ""Cafe Tostado Y Molido Avellana  Gara..."", ""Cafe Tostado Y Molido Gourmet  Comba..."", ""Café Tostado Y Molido Gourmet House ..."", ""380 GR"", ""Cafe Tostado Y Molido Vainilla Franc..."", ""Cafe Tostado Y Molido Mediano Cafe  ..."", ""Cafe Tostado Molido Tradicional  Los..."", ""340 GR"", ""Cafe Tostado Y Molido Crema Irlandes..."", ""Cafe Puro Tostado Y Molido Gourmet R..."", ""300 GR"", ""Cafe Tostado Y Molido Americano  Int..."", ""400 GR"", ""Cafe Tostado Y Molido Volcan Fuerte ..."", ""Cafe Tostado En Grano Antioquia  Bal..."", ""454 GR"", ""Cafe Tostado Molido Gourmet  52 True..."", ""Cafe Tostado Molido Deluxe  52 True ..."", ""Cafe Tostado Y Molido Crema E Gusto ..."", ""Cafe Tostado Y Molido Dolcevita  Lav..."", ""-76%"", ""Cafe Tostado Y Molido Costiera  Lava..."", ""AGOTADO"", ""Cafe Tostado Y Molido Espresso Lata ..."", ""Cafe Tostado Molido Espresso   La Fi..."", ""Cafe Molido Tostado Con Azucar  Comb..."", ""Cerveza Botella Stout  Minerva 355 M..."", ""355 ML"", ""Cafe Molido Tostado  La Parroquia 50..."", ""Cafe Molido Y Tostado Medio Gourmet ..."", ""Cafe Soluble Reserva Oahan  Nescafe ..."", ""180 GR"", ""Mes patrio Herdez"", ""Ver más"", ""Adobo    Doña María 235 G"", ""Mole Doña María Almendrado En Pasta ..."", ""Mole Doña María Almendrado Listo Par..."", ""Mole Doña María Poblano Con Cacao En..."", ""Mole Doña Maria Poblano Con Cacao Li..."", ""Mole Doña Mariía Rojo En Pasta   125..."", ""Mole En Pasta 430 Gramos   Doña Mari..."", ""Mole Listo Para Servir  Para Servir ..."", ""Mole Rojo En Pasta  Doña Maria 235 G"", ""Mole Verde En Pasta  Doña Maria 230 ..."", ""Pipián En Pasta  Doña Maria 230 G"", ""Salsa Cacahuate Picante Cremosa   He..."", ""Salsa Casera Con Habanero   Herdez 4..."", ""Salsa Casera  Herdez 210 G"", ""Salsa Guacamole 15% Mas Guacamole He...""]}",dataset/txt_limpios/135.txt,dataset/paginas_descargadas/135.html,EN,cafe,keep,0.60,heuristic_default
