{"source_id": "603", "title": "DALE VIDA A TU JARDIN", "description": "Datos técnicos Descripción del producto ¡Suscribite a nuestro boletín! Recibí las ofertas y novedades en tu correo. Suscribirme Seguridad y confianza © Libertad 2023. Todos los derechos reservados. Términos y Condiciones Direcciôn General de Defensa y protecciôn al Consumidor, para consultas y/o denuncias ingresa a los Términos más buscados 1. leche 2. cerveza 3. aceptada 4. yerba 5. cafe 6. pañales 7. queso 8. arroz 9. fideos 10. fernet", "breadcrumbs": "🌷🌻​🌼​ > 450G", "price_raw": "450.0", "currency_raw": "ARS", "url": "", "seller": "Desconocido", "availability": "unknown", "country": "AR", "product_name": "DALE VIDA A TU JARDIN", "brand": "🌷🌻​🌼​", "reference": "", "unit": "450G", "price_amount": 450.0, "price_currency": "ARS", "price_symbol": "", "price_text": "450", "price_amount_filled": "450.0", "price_is_imputed": "False", "price_imputation_source": "original", "price_amount_usd": "0.3586", "price_amount_usd_filled": "0.3586", "fx_rate_local_per_usd": "1255.0", "fx_source": "from_argentina_cambio_dolar", "information_text": "", "description_text": "Datos técnicos Descripción del producto ¡Suscribite a nuestro boletín! Recibí las ofertas y novedades en tu correo. Suscribirme Seguridad y confianza © Libertad 2023. Todos los derechos reservados. Términos y Condiciones Direcciôn General de Defensa y protecciôn al Consumidor, para consultas y/o denuncias ingresa a los Términos más buscados 1. leche 2. cerveza 3. aceptada 4. yerba 5. cafe 6. pañales 7. queso 8. arroz 9. fideos 10. fernet", "features_text": "", "specifications_text": "", "benefits_text": "", "details_text": "", "other_sections": "", "sections": {"Descripción": ["Datos técnicos", "Descripción del producto", "¡Suscribite a nuestro newsletter!", "Recibí las ofertas y novedades en tu correo.", "Suscribirme", "Seguridad y confianza", "© Libertad 2023. Todos los derechos reservados.", "Términos y Condiciones", "Dirección General de Defensa y Protección al Consumidor para consultas y/o denuncias", "introduzca aquí", "Términos más buscados", "1.", "leche", "2.", "cerveza", "3.", "aceite", "4.", "yerba", "5.", "cafe", "6.", "pañales", "7.", "queso", "8.", "arroz", "9.", "fideos", "10.", "fernet"]}, "txt_path": "dataset/txt_limpios/603.txt", "html_path": "dataset/paginas_descargadas/603.html", "es_status": "ET", "category_canonical": "cafe", "decision": "keep", "match_score": 0.6, "reasons": "heuristic_default"}
{"source_id": "604", "title": "DALE VIDA A TU JARDIN", "description": "", "breadcrumbs": "🌷🌻​🌼​", "price_raw": "", "currency_raw": "ARS", "url": "", "seller": "Desconocido", "availability": "unknown", "country": "AR", "product_name": "DALE VIDA A TU JARDIN", "brand": "🌷🌻​🌼​", "reference": "", "unit": "", "price_amount": null, "price_currency": "ARS", "price_symbol": "", "price_text": "", "price_amount_filled": "1663.58", "price_is_imputed": "True", "price_imputation_source": "country_mean", "price_amount_usd": "", "price_amount_usd_filled": "1.3256", "fx_rate_local_per_usd": "1255.0", "fx_source": "from_argentina_cambio_dolar", "information_text": "", "description_text": "", "features_text": "", "specifications_text": "", "benefits_text": "", "details_text": "", "other_sections": "", "sections": {}, "txt_path": "dataset/txt_limpios/604.txt", "html_path": "dataset/paginas_descargadas/604.html", "es_status": "EN", "category_canonical": "sin_categoria", "decision": "discard", "match_score": 0.3, "reasons": "no_category_detected;price_parse_failed"}
{"source_id": "605", "title": "DALE VIDA A TU JARDIN", "description": "Datos técnicos Descripción del producto ¡Suscribite a nuestro boletín! Recibí las ofertas y novedades en tu correo. Suscribirme Seguridad y confianza © Libertad 2023. Todos los derechos reservados. Términos y Condiciones Direcciôn General de Defensa y protecciôn al Consumidor, para consultas y/o denuncias ingresa a los Términos más buscados 1. leche 2. cerveza 3. aceptada 4. yerba 5. cafe 6. pañales 7. queso 8. arroz 9. fideos 10. fernet", "breadcrumbs": "🌷🌻​🌼​ > 250 GR", "price_raw": "250.0", "currency_raw": "ARS", "url": "", "seller": "Desconocido", "availability": "unknown", "country": "AR", "product_name": "DALE VIDA A TU JARDIN", "brand": "🌷🌻​🌼​", "reference": "", "unit": "250 GR", "price_amount": 250.0, "price_currency": "ARS", "price_symbol": "", "price_text": "250", "price_amount_filled": "250.0", "price_is_imputed": "False", "price_imputation_source": "original", "price_amount_usd": "0.1992", "price_amount_usd_filled": "0.1992", "fx_rate_local_per_usd": "1255.0", "fx_source": "from_argentina_cambio_dolar", "information_text": "", "description_text": "Datos técnicos Descripción del producto ¡Suscribite a nuestro boletín! Recibí las ofertas y novedades en tu correo. Suscribirme Seguridad y confianza © Libertad 2023. Todos los derechos reservados. Términos y Condiciones Direcciôn General de Defensa y protecciôn al Consumidor, para consultas y/o denuncias ingresa a los Términos más buscados 1. leche 2. cerveza 3. aceptada 4. yerba 5. cafe 6. pañales 7. queso 8. arroz 9. fideos 10. fernet", "features_text": "", "specifications_text": "", "benefits_text": "", "details_text": "", "other_sections": "", "sections": {"Descripción": ["Datos técnicos", "Descripción del producto", "¡Suscribite a nuestro newsletter!", "Recibí las ofertas y novedades en tu correo.", "Suscribirme", "Seguridad y confianza", "© Libertad 2023. Todos los derechos reservados.", "Términos y Condiciones", "Dirección General de Defensa y Protección al Consumidor para consultas y/o denuncias", "introduzca aquí", "Términos más buscados", "1.", "leche", "2.", "cerveza", "3.", "aceite", "4.", "yerba", "5.", "cafe", "6.", "pañales", "7.", "queso", "8.", "arroz", "9.", "fideos", "10.", "fernet"]}, "txt_path": "dataset/txt_limpios/605.txt", "html_path": "dataset/paginas_descargadas/605.html", "es_status": "ET", "category_canonical": "cafe", "decision": "keep", "match_score": 0.6, "reasons": "heuristic_default"}
{"source_id": "606", "title": "DALE VIDA A TU JARDIN", "description": "Datos técnicos Descripción del producto ¡Suscribite a nuestro boletín! Recibí las ofertas y novedades en tu correo. Suscribirme Seguridad y confianza © Libertad 2023. Todos los derechos reservados. Términos y Condiciones Direcciôn General de Defensa y protecciôn al Consumidor, para consultas y/o denuncias ingresa a los Términos más buscados 1. leche 2. cerveza 3. aceptada 4. yerba 5. cafe 6. pañales 7. queso 8. arroz 9. fideos 10. fernet", "breadcrumbs": "🌷🌻​🌼​ > 250 G", "price_raw": "250.0", "currency_raw": "ARS", "url": "", "seller": "Desconocido", "availability": "unknown", "country": "AR", "product_name": "DALE VIDA A TU JARDIN", "brand": "🌷🌻​🌼​", "reference": "", "unit": "250 G", "price_amount": 250.0, "price_currency": "ARS", "price_symbol": "", "price_text": "250", "price_amount_filled": "250.0", "price_is_imputed": "False", "price_imputation_source": "original", "price_amount_usd": "0.1992", "price_amount_usd_filled": "0.1992", "fx_rate_local_per_usd": "1255.0", "fx_source": "from_argentina_cambio_dolar", "information_text": "", "description_text": "Datos técnicos Descripción del producto ¡Suscribite a nuestro boletín! Recibí las ofertas y novedades en tu correo. Suscribirme Seguridad y confianza © Libertad 2023. Todos los derechos reservados. Términos y Condiciones Direcciôn General de Defensa y protecciôn al Consumidor, para consultas y/o denuncias ingresa a los Términos más buscados 1. leche 2. cerveza 3. aceptada 4. yerba 5. cafe 6. pañales 7. queso 8. arroz 9. fideos 10. fernet", "features_text": "", "specifications_text": "", "benefits_text": "", "details_text": "", "other_sections": "", "sections": {"Descripción": ["Datos técnicos", "Descripción del producto", "¡Suscribite a nuestro newsletter!", "Recibí las ofertas y novedades en tu correo.", "Suscribirme", "Seguridad y confianza", "© Libertad 2023. Todos los derechos reservados.", "Términos y Condiciones", "Dirección General de Defensa y Protección al Consumidor para consultas y/o denuncias", "introduzca aquí", "Términos más buscados", "1.", "leche", "2.", "cerveza", "3.", "aceite", "4.", "yerba", "5.", "cafe", "6.", "pañales", "7.", "queso", "8.", "arroz", "9.", "fideos", "10.", "fernet"]}, "txt_path": "dataset/txt_limpios/606.txt", "html_path": "dataset/paginas_descargadas/606.html", "es_status": "ET", "category_canonical": "cafe", "decision": "keep", "match_score": 0.6, "reasons": "heuristic_default"}
{"source_id": "607", "title": "DALE VIDA A TU JARDIN", "description": "Datos técnicos Descripción del producto Nada supera el sabor de una Coca-Cola. Diseñado para acompañar cada momento, el sabor de la Coca-Cola es un clásico que perdura desde hace más de 130 años. Deliciosa y refrescante. ¡Suscribite a nuestro boletín! Recibí las ofertas y novedades en tu correo. Suscribirme Seguridad y confianza © Libertad 2023. Todos los derechos reservados. Términos y Condiciones Direcciôn General de Defensa y protecciôn al Consumidor, para consultas y/o denuncias ingresa a los Términos más buscados 1. leche 2. cerveza 3. aceptada 4. yerba 5. cafe 6. pañales 7. queso 8. arroz 9. fideos 10. fernet", "breadcrumbs": "🌷🌻​🌼​ > 1,5 Lt", "price_raw": "2553.72", "currency_raw": "ARS", "url": "", "seller": "Desconocido", "availability": "unknown", "country": "AR", "product_name": "DALE VIDA A TU JARDIN", "brand": "🌷🌻​🌼​", "reference": "", "unit": "1,5 Lt", "price_amount": 2553.72, "price_currency": "ARS", "price_symbol": "$", "price_text": "$2.553,72", "price_amount_filled": "2553.72", "price_is_imputed": "False", "price_imputation_source": "original", "price_amount_usd": "2.0348", "price_amount_usd_filled": "2.0348", "fx_rate_local_per_usd": "1255.0", "fx_source": "from_argentina_cambio_dolar", "information_text": "", "description_text": "Datos técnicos Descripción del producto Nada supera el sabor de una Coca-Cola. Diseñado para acompañar cada momento, el sabor de la Coca-Cola es un clásico que perdura desde hace más de 130 años. Deliciosa y refrescante. ¡Suscribite a nuestro boletín! Recibí las ofertas y novedades en tu correo. Suscribirme Seguridad y confianza © Libertad 2023. Todos los derechos reservados. Términos y Condiciones Direcciôn General de Defensa y protecciôn al Consumidor, para consultas y/o denuncias ingresa a los Términos más buscados 1. leche 2. cerveza 3. aceptada 4. yerba 5. cafe 6. pañales 7. queso 8. arroz 9. fideos 10. fernet", "features_text": "", "specifications_text": "", "benefits_text": "", "details_text": "", "other_sections": "", "sections": {"Descripción": ["Datos técnicos", "Descripción del producto", "Nada supera el sabor de una Coca-Cola. Diseñado para acompañar cada momento, el sabor de la Coca-Cola es un clásico que perdura desde hace más de 130 años. Deliciosa y refrescante.", "¡Suscribite a nuestro newsletter!", "Recibí las ofertas y novedades en tu correo.", "Suscribirme", "Seguridad y confianza", "© Libertad 2023. Todos los derechos reservados.", "Términos y Condiciones", "Dirección General de Defensa y Protección al Consumidor para consultas y/o denuncias", "introduzca aquí", "Términos más buscados", "1.", "leche", "2.", "cerveza", "3.", "aceite", "4.", "yerba", "5.", "cafe", "6.", "pañales", "7.", "queso", "8.", "arroz", "9.", "fideos", "10.", "fernet"]}, "txt_path": "dataset/txt_limpios/607.txt", "html_path": "dataset/paginas_descargadas/607.html", "es_status": "ET", "category_canonical": "cafe", "decision": "keep", "match_score": 0.6, "reasons": "heuristic_default"}
{"source_id": "608", "title": "DALE VIDA A TU JARDIN", "description": "Datos técnicos Descripción del producto ¡Suscribite a nuestro boletín! Recibí las ofertas y novedades en tu correo. Suscribirme Seguridad y confianza © Libertad 2023. Todos los derechos reservados. Términos y Condiciones Direcciôn General de Defensa y protecciôn al Consumidor, para consultas y/o denuncias ingresa a los Términos más buscados 1. leche 2. cerveza 3. aceptada 4. yerba 5. cafe 6. pañales 7. queso 8. arroz 9. fideos 10. fernet", "breadcrumbs": "🌷🌻​🌼​ > 2000CC", "price_raw": "2644.63", "currency_raw": "ARS", "url": "", "seller": "Desconocido", "availability": "unknown", "country": "AR", "product_name": "DALE VIDA A TU JARDIN", "brand": "🌷🌻​🌼​", "reference": "", "unit": "2000CC", "price_amount": 2644.63, "price_currency": "ARS", "price_symbol": "$", "price_text": "$2.644,63", "price_amount_filled": "2644.63", "price_is_imputed": "False", "price_imputation_source": "original", "price_amount_usd": "2.1073", "price_amount_usd_filled": "2.1073", "fx_rate_local_per_usd": "1255.0", "fx_source": "from_argentina_cambio_dolar", "information_text": "", "description_text": "Datos técnicos Descripción del producto ¡Suscribite a nuestro boletín! Recibí las ofertas y novedades en tu correo. Suscribirme Seguridad y confianza © Libertad 2023. Todos los derechos reservados. Términos y Condiciones Direcciôn General de Defensa y protecciôn al Consumidor, para consultas y/o denuncias ingresa a los Términos más buscados 1. leche 2. cerveza 3. aceptada 4. yerba 5. cafe 6. pañales 7. queso 8. arroz 9. fideos 10. fernet", "features_text": "", "specifications_text": "", "benefits_text": "", "details_text": "", "other_sections": "", "sections": {"Descripción": ["Datos técnicos", "Descripción del producto", "¡Suscribite a nuestro newsletter!", "Recibí las ofertas y novedades en tu correo.", "Suscribirme", "Seguridad y confianza", "© Libertad 2023. Todos los derechos reservados.", "Términos y Condiciones", "Dirección General de Defensa y Protección al Consumidor para consultas y/o denuncias", "introduzca aquí", "Términos más buscados", "1.", "leche", "2.", "cerveza", "3.", "aceite", "4.", "yerba", "5.", "cafe", "6.", "pañales", "7.", "queso", "8.", "arroz", "9.", "fideos", "10.", "fernet"]}, "txt_path": "dataset/txt_limpios/608.txt", "html_path": "dataset/paginas_descargadas/608.html", "es_status": "ET", "category_canonical": "cafe", "decision": "keep", "match_score": 0.6, "reasons": "heuristic_default"}
{"source_id": "609", "title": "DALE VIDA A TU JARDIN", "description": "Datos técnicos Descripción del producto ¡Suscribite a nuestro boletín! Recibí las ofertas y novedades en tu correo. Suscribirme Seguridad y confianza © Libertad 2023. Todos los derechos reservados. Términos y Condiciones Direcciôn General de Defensa y protecciôn al Consumidor, para consultas y/o denuncias ingresa a los Términos más buscados 1. leche 2. cerveza 3. aceptada 4. yerba 5. cafe 6. pañales 7. queso 8. arroz 9. fideos 10. fernet", "breadcrumbs": "🌷🌻​🌼​ > 2.25 Lt", "price_raw": "1900.83", "currency_raw": "ARS", "url": "", "seller": "Desconocido", "availability": "unknown", "country": "AR", "product_name": "DALE VIDA A TU JARDIN", "brand": "🌷🌻​🌼​", "reference": "", "unit": "2.25 Lt", "price_amount": 1900.83, "price_currency": "ARS", "price_symbol": "$", "price_text": "$1.900,83", "price_amount_filled": "1900.83", "price_is_imputed": "False", "price_imputation_source": "original", "price_amount_usd": "1.5146", "price_amount_usd_filled": "1.5146", "fx_rate_local_per_usd": "1255.0", "fx_source": "from_argentina_cambio_dolar", "information_text": "", "description_text": "Datos técnicos Descripción del producto ¡Suscribite a nuestro boletín! Recibí las ofertas y novedades en tu correo. Suscribirme Seguridad y confianza © Libertad 2023. Todos los derechos reservados. Términos y Condiciones Direcciôn General de Defensa y protecciôn al Consumidor, para consultas y/o denuncias ingresa a los Términos más buscados 1. leche 2. cerveza 3. aceptada 4. yerba 5. cafe 6. pañales 7. queso 8. arroz 9. fideos 10. fernet", "features_text": "", "specifications_text": "", "benefits_text": "", "details_text": "", "other_sections": "", "sections": {"Descripción": ["Datos técnicos", "Descripción del producto", "¡Suscribite a nuestro newsletter!", "Recibí las ofertas y novedades en tu correo.", "Suscribirme", "Seguridad y confianza", "© Libertad 2023. Todos los derechos reservados.", "Términos y Condiciones", "Dirección General de Defensa y Protección al Consumidor para consultas y/o denuncias", "introduzca aquí", "Términos más buscados", "1.", "leche", "2.", "cerveza", "3.", "aceite", "4.", "yerba", "5.", "cafe", "6.", "pañales", "7.", "queso", "8.", "arroz", "9.", "fideos", "10.", "fernet"]}, "txt_path": "dataset/txt_limpios/609.txt", "html_path": "dataset/paginas_descargadas/609.html", "es_status": "ET", "category_canonical": "cafe", "decision": "keep", "match_score": 0.6, "reasons": "heuristic_default"}
{"source_id": "610", "title": "DALE VIDA A TU JARDIN", "description": "", "breadcrumbs": "🌷🌻​🌼​", "price_raw": "", "currency_raw": "ARS", "url": "", "seller": "Desconocido", "availability": "unknown", "country": "AR", "product_name": "DALE VIDA A TU JARDIN", "brand": "🌷🌻​🌼​", "reference": "", "unit": "", "price_amount": null, "price_currency": "ARS", "price_symbol": "", "price_text": "", "price_amount_filled": "1663.58", "price_is_imputed": "True", "price_imputation_source": "country_mean", "price_amount_usd": "", "price_amount_usd_filled": "1.3256", "fx_rate_local_per_usd": "1255.0", "fx_source": "from_argentina_cambio_dolar", "information_text": "", "description_text": "", "features_text": "", "specifications_text": "", "benefits_text": "", "details_text": "", "other_sections": "", "sections": {}, "txt_path": "dataset/txt_limpios/610.txt", "html_path": "dataset/paginas_descargadas/610.html", "es_status": "EN", "category_canonical": "sin_categoria", "decision": "discard", "match_score": 0.3, "reasons": "no_category_detected;price_parse_failed"}
{"source_id": "611", "title": "DALE VIDA A TU JARDIN", "description": "Datos técnicos Descripción del producto ¡Suscribite a nuestro boletín! Recibí las ofertas y novedades en tu correo. Suscribirme Seguridad y confianza © Libertad 2023. Todos los derechos reservados. Términos y Condiciones Direcciôn General de Defensa y protecciôn al Consumidor, para consultas y/o denuncias ingresa a los Términos más buscados 1. leche 2. cerveza 3. aceptada 4. yerba 5. cafe 6. pañales 7. queso 8. arroz 9. fideos 10. fernet", "breadcrumbs": "🌷🌻​🌼​ > 2.25 L", "price_raw": "1809.92", "currency_raw": "ARS", "url": "", "seller": "Desconocido", "availability": "unknown", "country": "AR", "product_name": "DALE VIDA A TU JARDIN", "brand": "🌷🌻​🌼​", "reference": "", "unit": "2.25 L", "price_amount": 1809.92, "price_currency": "ARS", "price_symbol": "$", "price_text": "$1.809,92", "price_amount_filled": "1809.92", "price_is_imputed": "False", "price_imputation_source": "original", "price_amount_usd": "1.4422", "price_amount_usd_filled": "1.4422", "fx_rate_local_per_usd": "1255.0", "fx_source": "from_argentina_cambio_dolar", "information_text": "", "description_text": "Datos técnicos Descripción del producto ¡Suscribite a nuestro boletín! Recibí las ofertas y novedades en tu correo. Suscribirme Seguridad y confianza © Libertad 2023. Todos los derechos reservados. Términos y Condiciones Direcciôn General de Defensa y protecciôn al Consumidor, para consultas y/o denuncias ingresa a los Términos más buscados 1. leche 2. cerveza 3. aceptada 4. yerba 5. cafe 6. pañales 7. queso 8. arroz 9. fideos 10. fernet", "features_text": "", "specifications_text": "", "benefits_text": "", "details_text": "", "other_sections": "", "sections": {"Descripción": ["Datos técnicos", "Descripción del producto", "¡Suscribite a nuestro newsletter!", "Recibí las ofertas y novedades en tu correo.", "Suscribirme", "Seguridad y confianza", "© Libertad 2023. Todos los derechos reservados.", "Términos y Condiciones", "Dirección General de Defensa y Protección al Consumidor para consultas y/o denuncias", "introduzca aquí", "Términos más buscados", "1.", "leche", "2.", "cerveza", "3.", "aceite", "4.", "yerba", "5.", "cafe", "6.", "pañales", "7.", "queso", "8.", "arroz", "9.", "fideos", "10.", "fernet"]}, "txt_path": "dataset/txt_limpios/611.txt", "html_path": "dataset/paginas_descargadas/611.html", "es_status": "ET", "category_canonical": "cafe", "decision": "keep", "match_score": 0.6, "reasons": "heuristic_default"}
