{"source_id": "799", "title": "BANANO UNIDAD", "description": "Nombre del producto: Banano Descripción del producto: Disfruta del banano es una fruta tropical de pulpa suave, dulce y de sabor agradable. Su cáscara fácil de pelar lo convierte en una opción práctica para consumir en cualquier momento del día, ya sea suelo, en batidos, postres, desayunos como ingrediente en múltiples recetas. Presentación : Unidad Modo de fabricación: Industrial Origen: Nacional Ver más También puede interesarte MANGO VARIEDAD UNIDAD TOMATE CHONTO X 1000 G PAPAYA UNIDAD AGUACATE HASS UNIDAD AGUACATE UNIDAD ZANAHORIA X 1000 G PLÁTANO X 1000G CEBOLLA CABEZONA X 1000G LIMON TAHITI X 1000 GR PIMENTÓN UNIDAD", "breadcrumbs": "Unidades disponibles > 1000 G", "price_raw": "1.0", "currency_raw": "", "url": "", "seller": "Desconocido", "availability": "unknown", "country": "UNKNOWN", "product_name": "BANANO UNIDAD", "brand": "Unidades disponibles", "reference": "", "unit": "1000 G", "price_amount": 1.0, "price_currency": "", "price_symbol": "", "price_text": "1", "price_amount_filled": "1.0", "price_is_imputed": "False", "price_imputation_source": "original", "price_amount_usd": "1.0", "price_amount_usd_filled": "1.0", "fx_rate_local_per_usd": "1.0", "fx_source": "default_1usd", "information_text": "", "description_text": "Nombre del producto: Banano Descripción del producto: Disfruta del banano es una fruta tropical de pulpa suave, dulce y de sabor agradable. Su cáscara fácil de pelar lo convierte en una opción práctica para consumir en cualquier momento del día, ya sea suelo, en batidos, postres, desayunos como ingrediente en múltiples recetas. Presentación : Unidad Modo de fabricación: Industrial Origen: Nacional Ver más También puede interesarte MANGO VARIEDAD UNIDAD TOMATE CHONTO X 1000 G PAPAYA UNIDAD AGUACATE HASS UNIDAD AGUACATE UNIDAD ZANAHORIA X 1000 G PLÁTANO X 1000G CEBOLLA CABEZONA X 1000G LIMON TAHITI X 1000 GR PIMENTÓN UNIDAD", "features_text": "", "specifications_text": "", "benefits_text": "", "details_text": "", "other_sections": "", "sections": {"Descripción": ["Nombre del producto: Banano", "Descripción del producto: Disfruta del banano es una fruta tropical de pulpa suave, dulce y de sabor agradable. Su cáscara fácil de pelar lo convierte en una opción práctica para consumir en cualquier momento del día, ya sea suelo, en batidos, postres, desayunos como ingrediente en múltiples recetas.", "Presentación", ": Unidad", "Modo de fabricación: Industrial", "Origen: Nacional", "Ver más", "También puede interesarte", "MANGO VARIEDAD UNIDAD", "TOMATE CHONTO X 1000 G", "PAPAYA UNIDAD", "AGUACATE HASS UNIDAD", "AGUACATE UNIDAD", "ZANAHORIA X 1000 G", "PLÁTANO X 1000G", "CEBOLLA CABEZONA X 1000G", "LIMON TAHITI X 1000 GR", "PIMENTÓN UNIDAD"]}, "txt_path": "dataset/txt_limpios/799.txt", "html_path": "dataset/paginas_descargadas/799.html", "es_status": "ET", "category_canonical": "cebolla", "decision": "keep", "match_score": 0.6, "reasons": "heuristic_default"}
{"source_id": "898", "title": "Bebida desechable", "description": "", "breadcrumbs": "1.5 Litro > 1.5 Litro", "price_raw": "1.39", "currency_raw": "", "url": "", "seller": "Desconocido", "availability": "unknown", "country": "UNKNOWN", "product_name": "Bebida desechable", "brand": "1.5 Litro", "reference": "", "unit": "1.5 Litro", "price_amount": 1.39, "price_currency": "", "price_symbol": "$", "price_text": "$1.39", "price_amount_filled": "1.39", "price_is_imputed": "False", "price_imputation_source": "original", "price_amount_usd": "1.39", "price_amount_usd_filled": "1.39", "fx_rate_local_per_usd": "1.0", "fx_source": "default_1usd", "information_text": "", "description_text": "", "features_text": "", "specifications_text": "", "benefits_text": "", "details_text": "", "other_sections": "", "sections": {}, "txt_path": "dataset/txt_limpios/898.txt", "html_path": "dataset/paginas_descargadas/898.html", "es_status": "EN", "category_canonical": "sin_categoria", "decision": "discard", "match_score": 0.3, "reasons": "no_category_detected"}
{"source_id": "533", "title": "Bebidas Sin Alcohol", "description": "", "breadcrumbs": "Gaseosas > 2.25 L", "price_raw": "130.0", "currency_raw": "", "url": "", "seller": "Desconocido", "availability": "unknown", "country": "UNKNOWN", "product_name": "Bebidas Sin Alcohol", "brand": "Gaseosas", "reference": "", "unit": "2.25 L", "price_amount": 130.0, "price_currency": "", "price_symbol": "", "price_text": "130", "price_amount_filled": "130.0", "price_is_imputed": "False", "price_imputation_source": "original", "price_amount_usd": "130.0", "price_amount_usd_filled": "130.0", "fx_rate_local_per_usd": "1.0", "fx_source": "default_1usd", "information_text": "", "description_text": "", "features_text": "MARCA | : COCA COLA | VARIANTE | : SABOR ORIGINAL | SABOR | SABOR | : COLA | EMPAQUE | : BOTELLA | CONTENIDO | : 2.25 L | BOTELLA RETORNABLE | : NO | Últimos consultados | NO ACUMULABLE CON OTRAS PROMOS | OFERTA | Ver planes de cuotas | Queso Cremoso PUNTA DEL AGUA X Kg | Queso Cremoso Fraccionado LA PAULINA Xkg", "specifications_text": "", "benefits_text": "", "details_text": "", "other_sections": "", "sections": {"Características": ["MARCA", ": COCA COLA", "VARIANTE", ": SABOR ORIGINAL", "SABOR", ": COLA", "EMPAQUE", ": BOTELLA", "CONTENIDO", ": 2.25 L", "BOTELLA RETORNABLE", ": NO", "Últimos consultados", "NO ACUMULABLE CON OTRAS PROMOS", "OFERTA", "Ver planes de cuotas", "Queso Cremoso PUNTA DEL AGUA X Kg", "Queso Cremoso Fraccionado LA PAULINA Xkg"]}, "txt_path": "dataset/txt_limpios/533.txt", "html_path": "dataset/paginas_descargadas/533.html", "es_status": "ET", "category_canonical": "sin_categoria", "decision": "discard", "match_score": 0.3, "reasons": "no_category_detected"}
{"source_id": "534", "title": "Bebidas Sin Alcohol", "description": "", "breadcrumbs": "Gaseosas > 2l", "price_raw": "3450.0", "currency_raw": "", "url": "", "seller": "Desconocido", "availability": "unknown", "country": "UNKNOWN", "product_name": "Bebidas Sin Alcohol", "brand": "Gaseosas", "reference": "", "unit": "2l", "price_amount": 3450.0, "price_currency": "", "price_symbol": "$", "price_text": "$3.450,00", "price_amount_filled": "3450.0", "price_is_imputed": "False", "price_imputation_source": "original", "price_amount_usd": "3450.0", "price_amount_usd_filled": "3450.0", "fx_rate_local_per_usd": "1.0", "fx_source": "default_1usd", "information_text": "", "description_text": "", "features_text": "MARCA | : PEPSI | Últimos consultados | NO ACUMULABLE CON OTRAS PROMOS | Gaseosa Coca-Cola Sabor Original 2,25 Lt | PRECIO CON 50% 2DA | Ver planes de cuotas | OFERTA | Queso Cremoso PUNTA DEL AGUA X Kg | Queso Cremoso Fraccionado LA PAULINA Xkg", "specifications_text": "", "benefits_text": "", "details_text": "", "other_sections": "", "sections": {"Características": ["MARCA", ": PEPSI", "Últimos consultados", "NO ACUMULABLE CON OTRAS PROMOS", "Gaseosa Coca-Cola Sabor Original 2,25 Lt", "PRECIO CON 50% 2DA", "Ver planes de cuotas", "OFERTA", "Queso Cremoso PUNTA DEL AGUA X Kg", "Queso Cremoso Fraccionado LA PAULINA Xkg"]}, "txt_path": "dataset/txt_limpios/534.txt", "html_path": "dataset/paginas_descargadas/534.html", "es_status": "ET", "category_canonical": "sin_categoria", "decision": "discard", "match_score": 0.3, "reasons": "no_category_detected"}
{"source_id": "535", "title": "Bebidas Sin Alcohol", "description": "", "breadcrumbs": "Gaseosas > 2.25 L", "price_raw": "1750.0", "currency_raw": "", "url": "", "seller": "Desconocido", "availability": "unknown", "country": "UNKNOWN", "product_name": "Bebidas Sin Alcohol", "brand": "Gaseosas", "reference": "", "unit": "2.25 L", "price_amount": 1750.0, "price_currency": "", "price_symbol": "$", "price_text": "$1.750,00", "price_amount_filled": "1750.0", "price_is_imputed": "False", "price_imputation_source": "original", "price_amount_usd": "1750.0", "price_amount_usd_filled": "1750.0", "fx_rate_local_per_usd": "1.0", "fx_source": "default_1usd", "information_text": "", "description_text": "", "features_text": "MARCA | : PASO DE LOS TOROS | SABOR | : POMELO | BOTELLA RETORNABLE | : NO | ENVASE | : BOTELLA | CONTENIDO | : 2.25 L | Últimos consultados | LLEVANDO 2 | 2X1 | Gaseosa Cola Pepsi 2l | PRECIO CON 2X1 | Ver planes de cuotas | NO ACUMULABLE CON OTRAS PROMOS | Gaseosa Coca-Cola Sabor Original 2,25 Lt | PRECIO CON 50% 2DA | OFERTA | Queso Cremoso PUNTA DEL AGUA X Kg", "specifications_text": "", "benefits_text": "", "details_text": "", "other_sections": "", "sections": {"Características": ["MARCA", ": PASO DE LOS TOROS", "SABOR", ": POMELO", "BOTELLA RETORNABLE", ": NO", "ENVASE", ": BOTELLA", "CONTENIDO", ": 2.25 L", "Últimos consultados", "LLEVANDO 2", "2X1", "Gaseosa Cola Pepsi 2l", "PRECIO CON 2X1", "Ver planes de cuotas", "NO ACUMULABLE CON OTRAS PROMOS", "Gaseosa Coca-Cola Sabor Original 2,25 Lt", "PRECIO CON 50% 2DA", "OFERTA", "Queso Cremoso PUNTA DEL AGUA X Kg"]}, "txt_path": "dataset/txt_limpios/535.txt", "html_path": "dataset/paginas_descargadas/535.html", "es_status": "ET", "category_canonical": "sin_categoria", "decision": "discard", "match_score": 0.3, "reasons": "no_category_detected"}
{"source_id": "536", "title": "Bebidas Sin Alcohol", "description": "", "breadcrumbs": "Gaseosas > 2.25 L", "price_raw": "3225.0", "currency_raw": "", "url": "", "seller": "Desconocido", "availability": "unknown", "country": "UNKNOWN", "product_name": "Bebidas Sin Alcohol", "brand": "Gaseosas", "reference": "", "unit": "2.25 L", "price_amount": 3225.0, "price_currency": "", "price_symbol": "$", "price_text": "$3.225,00", "price_amount_filled": "3225.0", "price_is_imputed": "False", "price_imputation_source": "original", "price_amount_usd": "3225.0", "price_amount_usd_filled": "3225.0", "fx_rate_local_per_usd": "1.0", "fx_source": "default_1usd", "information_text": "", "description_text": "", "features_text": "MARCA | : CUNNINGTON | SIN TACC | : SI | Últimos consultados | 25%DTO | Gaseosa PASO DE LOS TOROS Botella 2.25 L | PRECIO CON 25%DTO | Ver planes de cuotas | LLEVANDO 2 | 2X1 | Gaseosa Cola Pepsi 2l | PRECIO CON 2X1 | NO ACUMULABLE CON OTRAS PROMOS | Gaseosa Coca-Cola Sabor Original 2,25 Lt | PRECIO CON 50% 2DA | OFERTA", "specifications_text": "", "benefits_text": "", "details_text": "", "other_sections": "", "sections": {"Características": ["MARCA", ": CUNNINGTON", "SIN TACC", ": SI", "Últimos consultados", "25%DTO", "Gaseosa PASO DE LOS TOROS    Botella 2.25 L", "PRECIO CON 25%DTO", "Ver planes de cuotas", "LLEVANDO 2", "2X1", "Gaseosa Cola Pepsi 2l", "PRECIO CON 2X1", "NO ACUMULABLE CON OTRAS PROMOS", "Gaseosa Coca-Cola Sabor Original 2,25 Lt", "PRECIO CON 50% 2DA", "OFERTA"]}, "txt_path": "dataset/txt_limpios/536.txt", "html_path": "dataset/paginas_descargadas/536.html", "es_status": "ET", "category_canonical": "sin_categoria", "decision": "discard", "match_score": 0.3, "reasons": "no_category_detected"}
{"source_id": "537", "title": "Bebidas Sin Alcohol", "description": "", "breadcrumbs": "Gaseosas > 2.25 L", "price_raw": "1265.6", "currency_raw": "", "url": "", "seller": "Desconocido", "availability": "unknown", "country": "UNKNOWN", "product_name": "Bebidas Sin Alcohol", "brand": "Gaseosas", "reference": "", "unit": "2.25 L", "price_amount": 1265.6, "price_currency": "", "price_symbol": "$", "price_text": "$1.265,60", "price_amount_filled": "1265.6", "price_is_imputed": "False", "price_imputation_source": "original", "price_amount_usd": "1265.6", "price_amount_usd_filled": "1265.6", "fx_rate_local_per_usd": "1.0", "fx_source": "default_1usd", "information_text": "", "description_text": "", "features_text": "MARCA | : PRITTY | SABOR | : LIMÓN | BOTELLA RETORNABLE | : NO | ENVASE | : BOTELLA | CONTENIDO | : 2.25 L | Últimos consultados | 20%DTO | Gaseosa Cola Cunnington 1500cmq | PRECIO CON 20%DTO | Ver planes de cuotas | 25%DTO | Gaseosa PASO DE LOS TOROS Botella 2.25 L | PRECIO CON 25%DTO | LLEVANDO 2 | 2X1 | Gaseosa Cola Pepsi 2l | PRECIO CON 2X1 | NO ACUMULABLE CON OTRAS PROMOS | Gaseosa Coca-Cola Sabor Original 2,25 Lt | PRECIO CON 50% 2DA | OFERTA", "specifications_text": "", "benefits_text": "", "details_text": "", "other_sections": "", "sections": {"Características": ["MARCA", ": PRITTY", "SABOR", ": LIMÓN", "BOTELLA RETORNABLE", ": NO", "ENVASE", ": BOTELLA", "CONTENIDO", ": 2.25 L", "Últimos consultados", "20%DTO", "Gaseosa Cola Cunnington 1500cmq", "PRECIO CON 20%DTO", "Ver planes de cuotas", "25%DTO", "Gaseosa PASO DE LOS TOROS    Botella 2.25 L", "PRECIO CON 25%DTO", "LLEVANDO 2", "2X1", "Gaseosa Cola Pepsi 2l", "PRECIO CON 2X1", "NO ACUMULABLE CON OTRAS PROMOS", "Gaseosa Coca-Cola Sabor Original 2,25 Lt", "PRECIO CON 50% 2DA", "OFERTA"]}, "txt_path": "dataset/txt_limpios/537.txt", "html_path": "dataset/paginas_descargadas/537.html", "es_status": "ET", "category_canonical": "sin_categoria", "decision": "discard", "match_score": 0.3, "reasons": "no_category_detected"}
{"source_id": "1722", "title": "Bebidas, Aguas y Jugos", "description": "Bebidas Gaseosa Original Coca-Cola 1.5lt | Actualizado al: 23-03-2025 Ingredientes: Agua carbonatada, Azúcar, Color caramelo, Ácido fosfórico, Saborizantes naturales, Cafeína, Sucralosa. Certificados: Apto para APLV Libre de Lactosa Vegano Vegetariano Libre de Soya Libre de Huevo Libre de Peces Libre de Mariscos Libre de Maní Libre de Frutas Secos Libre de Nueces Libre de Sulfitos Libre de Trigo Kosher Porción: 1 Vaso (200ml) Porciones por envase: 8 100ml 1 Porción Energía (kCal) 32 64 Proteínas (g) 0 Grasas Totales Hidratos de carbono disponibles 7.8 15.6 Azúcar total (g) Sodio (mg) Importante: La información del empaque y/o contenido del producto final puede diferir respecto a lo que mostramos en nuestro sitio web, tanto a nivel de ingredientes, trazas, información nutricional, sellos, modo de uso y/o modo de conservación. Usted debe basarse únicamente en la información que se muestra en nuestro sitio web y siempre debe leer las etiquetas, advertencias y instrucciones antes de usar el consumo de un producto. Información obtenida de BEBIDA COCA COLA 1500 CC. DES. Productos similares bebida Coca Cola Light 1.5 L Ver producto Bebida Coca Cola Original 2.5 L Bebida Coca Cola Sin Azúcar 1.5 L Bebida Coca Cola Original 3 L -23% Bebidas Coca Cola Zero 1 L -33% BEBIDA COCA COLA LIGHT 1 LT. DES. -22% Bebidas Coca Cola Light 2.5 L bebida Coca Cola Sin Azúcar 2.5 L bebida Coca Cola bebida Coca Cola Light 3 L Bebida Coca Cola Sin Azúcar 3 L Tripack Bebida Coca Cola 2 x 3 Lt + Bebida Fanta 3 Lt bebida Bilz 1.5 L BEBIDA INCA KOLA 3 LT -29% bebida Bilz 600 ml -26% bebida Coca Cola Light Botella bebida Bilz Zero 3 L Pack Bebidas Coca Cola Original + Sprite 3 x 3 L Bebida Sprite Sin Azúcar 1.5 L ¡Juntos son mejores! Bebidas Sprite Papas Fritas Corte Americano Lays 200 g -35% Papas Fritas Corte Americano Doritos Queso", "breadcrumbs": "Bebidas > 1.5 L", "price_raw": "1.99", "currency_raw": "", "url": "", "seller": "Desconocido", "availability": "unknown", "country": "UNKNOWN", "product_name": "Bebidas, Aguas y Jugos", "brand": "Bebidas", "reference": "", "unit": "1.5 L", "price_amount": 1.99, "price_currency": "", "price_symbol": "", "price_text": "1.99", "price_amount_filled": "1.99", "price_is_imputed": "False", "price_imputation_source": "original", "price_amount_usd": "1.99", "price_amount_usd_filled": "1.99", "fx_rate_local_per_usd": "1.0", "fx_source": "default_1usd", "information_text": "", "description_text": "Bebidas Gaseosa Original Coca-Cola 1.5lt | Actualizado al: 23-03-2025 Ingredientes: Agua carbonatada, Azúcar, Color caramelo, Ácido fosfórico, Saborizantes naturales, Cafeína, Sucralosa. Certificados: Apto para APLV Libre de Lactosa Vegano Vegetariano Libre de Soya Libre de Huevo Libre de Peces Libre de Mariscos Libre de Maní Libre de Frutas Secos Libre de Nueces Libre de Sulfitos Libre de Trigo Kosher Porción: 1 Vaso (200ml) Porciones por envase: 8 100ml 1 Porción Energía (kCal) 32 64 Proteínas (g) 0 Grasas Totales Hidratos de carbono disponibles 7.8 15.6 Azúcar total (g) Sodio (mg) Importante: La información del empaque y/o contenido del producto final puede diferir respecto a lo que mostramos en nuestro sitio web, tanto a nivel de ingredientes, trazas, información nutricional, sellos, modo de uso y/o modo de conservación. Usted debe basarse únicamente en la información que se muestra en nuestro sitio web y siempre debe leer las etiquetas, advertencias y instrucciones antes de usar el consumo de un producto. Información obtenida de BEBIDA COCA COLA 1500 CC. DES. Productos similares bebida Coca Cola Light 1.5 L Ver producto Bebida Coca Cola Original 2.5 L Bebida Coca Cola Sin Azúcar 1.5 L Bebida Coca Cola Original 3 L -23% Bebidas Coca Cola Zero 1 L -33% BEBIDA COCA COLA LIGHT 1 LT. DES. -22% Bebidas Coca Cola Light 2.5 L bebida Coca Cola Sin Azúcar 2.5 L bebida Coca Cola bebida Coca Cola Light 3 L Bebida Coca Cola Sin Azúcar 3 L Tripack Bebida Coca Cola 2 x 3 Lt + Bebida Fanta 3 Lt bebida Bilz 1.5 L BEBIDA INCA KOLA 3 LT -29% bebida Bilz 600 ml -26% bebida Coca Cola Light Botella bebida Bilz Zero 3 L Pack Bebidas Coca Cola Original + Sprite 3 x 3 L Bebida Sprite Sin Azúcar 1.5 L ¡Juntos son mejores! Bebidas Sprite Papas Fritas Corte Americano Lays 200 g -35% Papas Fritas Corte Americano Doritos Queso", "features_text": "", "specifications_text": "", "benefits_text": "", "details_text": "", "other_sections": "", "sections": {"Descripción": ["Bebida Gaseosa Original Coca-Cola", "1.5lt | Actualizado al: 23-03-2025", "Ingredientes: Agua carbonatada, Azúcar, Color caramelo, Ácido fosfórico, Saborizantes naturales, Cafeína, Sucralosa.", "Certificados: Apto para APLV", "Libre de Lactosa", "Vegano", "Vegetariano", "Libre de Soya", "Libre de Huevo", "Libre de Peces", "Libre de Mariscos", "Libre de Maní", "Libre de Frutos Secos", "Libre de Nueces", "Libre de Sulfitos", "Libre de Trigo", "Kosher", "Porción: 1 Vaso (200ml)", "Porciones por envase: 8", "100ml", "1 Porción", "Energía", "(kCal)", "32", "64", "Proteínas", "(g)", "0", "Grasas Totales", "Hidratos de carbono disponibles", "7.8", "15.6", "Azúcar total (g)", "Sodio", "(mg)", "Importante: La información del empaque y/o contenido del producto final puede diferir respecto a lo que mostramos en nuestro sitio web, tanto a nivel de ingredientes, trazas, información nutricional, sellos, modo de uso y/o modo de conservación. Usted debe basarse únicamente en la información que se muestra en nuestro sitio web y siempre debe leer las etiquetas, advertencias y instrucciones antes de usar el consumo de un producto.", "Información obtenida de", "BEBIDA COCA COLA 1500 CC. DES..", "Productos similares", "Bebida Coca Cola Light 1.5 L", "Ver producto", "Bebida Coca Cola Original 2.5 L", "Bebidas Coca Cola Sin Azúcar 1.5 L", "Bebida Coca Cola Original 3 L", "-23%", "Bebida Coca Cola Zero 1 L", "-33%", "BEBIDA COCA COLA LIGHT 1 LT. DES.", "-22%", "Bebida Coca Cola Light 2.5 L", "Bebida Coca Cola Sin Azúcar 2.5 L", "Bebida Coca Cola", "Bebida Coca Cola Light 3 L", "Bebida Coca Cola Sin Azúcar 3 L", "Tripack Bebida Coca Cola 2 x 3 Lt + Bebida Fanta 3 Lt", "Bebida Bilz 1.5 L", "BEBIDA INCA KOLA 3 LT", "-29%", "Bebida Bilz 600 ml", "-26%", "Bebida Coca Cola Light Botella", "Bebida Bilz Zero 3 L", "Pack Bebidas Coca Cola Original + Sprite 3 x 3 L", "Bebidas Sprite Sin Azúcar 1.5 L", "¡Juntos son mejores!", "Bebida Sprite", "Papas Fritas Corte Americano Lays 200 g", "-35%", "Papas Fritas Corte Americano", "Doritos Queso"]}, "txt_path": "dataset/txt_limpios/1722.txt", "html_path": "dataset/paginas_descargadas/1722.html", "es_status": "ET", "category_canonical": "papa", "decision": "keep", "match_score": 0.6, "reasons": "heuristic_default"}
