source_id,title,description,breadcrumbs,price_raw,currency_raw,url,seller,availability,country,product_name,brand,reference,unit,price_amount,price_currency,price_symbol,price_text,price_amount_filled,price_is_imputed,price_imputation_source,price_amount_usd,price_amount_usd_filled,fx_rate_local_per_usd,fx_source,information_text,description_text,features_text,specifications_text,benefits_text,details_text,other_sections,sections,txt_path,html_path,es_status,category_canonical,decision,match_score,reasons
1215,Seja Bem Vindo à Plaza Vea,"Descripción del producto Importante destacar Calorías por porción : 124kcal Composición : Oliva Contenido Neto : 1L Variedad: 100% puro Presentación : Botella cuenta con una amplia variedad de para que puedas elegir el que más se adecua a tus necesidades. Dentro de los encontramos al aceite , un producto muy usado en la cocina gracias a su versatilidad. Por ejemplo el cuenta con un alto contenido en ácidos grasos monoinsaturados  y poliinsaturados que permitirán aportar grandes beneficios en nuestro organismo como : Eleva los niveles de colesterol HDL (bueno), Disminuye el colesterol LDL-c (colesterol malo), Beneficia el control de la hipertensión arterial, entre otros. Es ideal para consumirlo de manera directa, ya sea en ensaladas o como complemento alimentario, de este modo podrás absorver al máximo sus nutrientes. Además también puedes optar por el Aceite Vegetal que gracias a su composición es perfecto para la preparación de cualquier receta. Desde un delicioso arroz con pollo hasta unas crocantes papitas fritas. Encuentralo en diferentes presentaciones y en las mejores marcas del mercado. Complenta tus comidas con nuestra variedad de Arroces para que engrias a toda tu familia con tus mejores preparaciones. ¡Conoce las distintas opciones en Aceites en plazaVea Online! *La imagen sólo es referencial Olivar ""Proensa se funda en 1986 inicialmente dicada a deshuesar y rellenar aceitunas dándoles un valor agregado, lanzándolas al mercado embolsadas con la marca El Olivar. Las aceitunas son 100% naturales y se producen con un delicado cuidado del ecosistema."" ¿No es lo que buscas? Encuentra más en plazaVea En caso algo no vaya como gustes: Puedes revisar nuestras Politicas de cambios y/o devoluciones y hacerlas efectivas en todas nuestras tiendas. Productos que te pueden interesar similares Aceite de Oliva Extra Virgen SAN ISIDORO Botella 1L SAN ISIDORO .90 .00 un 3 productos agregados Agrega indicaciones Guardar Aceite de Oliva Extra Virgen SAN ISIDORO Botella 2L Aceite de Oliva Sabor Suave EL OLIVAR x 1L EL OLIVAR Aceite de Oliva Extravirgen ARO Botella 2L ARO Multiplicador-de-unidad: MAKRO-Bi-Precio|Vigente Oculto Aceite de Oliva Puro EL OLIVAR Galonera 3.785L Aceite de Oliva Puro ARO Botella 2L Aceite de Oliva HUERTO ALAMEIN Extra Virgen Botella 500ml HUERTO ALAMEIN Aceite de Oliva OLIVOS DEL SUR Extra Virgen Botella 1L OLIVOS DEL SUR Recomendado para ti",Makro > 1L,16.92,PEN,,Desconocido,unknown,PE,Seja Bem Vindo à Plaza Vea,Makro,,1L,16.92,PEN,S/,S/16.92,16.92,False,original,4.7662,4.7662,3.55,from_peru_cambio_dolar,,"Descripción del producto Importante destacar Calorías por porción : 124kcal Composición : Oliva Contenido Neto : 1L Variedad: 100% puro Presentación : Botella cuenta con una amplia variedad de para que puedas elegir el que más se adecua a tus necesidades. Dentro de los encontramos al aceite , un producto muy usado en la cocina gracias a su versatilidad. Por ejemplo el cuenta con un alto contenido en ácidos grasos monoinsaturados  y poliinsaturados que permitirán aportar grandes beneficios en nuestro organismo como : Eleva los niveles de colesterol HDL (bueno), Disminuye el colesterol LDL-c (colesterol malo), Beneficia el control de la hipertensión arterial, entre otros. Es ideal para consumirlo de manera directa, ya sea en ensaladas o como complemento alimentario, de este modo podrás absorver al máximo sus nutrientes. Además también puedes optar por el Aceite Vegetal que gracias a su composición es perfecto para la preparación de cualquier receta. Desde un delicioso arroz con pollo hasta unas crocantes papitas fritas. Encuentralo en diferentes presentaciones y en las mejores marcas del mercado. Complenta tus comidas con nuestra variedad de Arroces para que engrias a toda tu familia con tus mejores preparaciones. ¡Conoce las distintas opciones en Aceites en plazaVea Online! *La imagen sólo es referencial Olivar ""Proensa se funda en 1986 inicialmente dicada a deshuesar y rellenar aceitunas dándoles un valor agregado, lanzándolas al mercado embolsadas con la marca El Olivar. Las aceitunas son 100% naturales y se producen con un delicado cuidado del ecosistema."" ¿No es lo que buscas? Encuentra más en plazaVea En caso algo no vaya como gustes: Puedes revisar nuestras Politicas de cambios y/o devoluciones y hacerlas efectivas en todas nuestras tiendas. Productos que te pueden interesar similares Aceite de Oliva Extra Virgen SAN ISIDORO Botella 1L SAN ISIDORO .90 .00 un 3 productos agregados Agrega indicaciones Guardar Aceite de Oliva Extra Virgen SAN ISIDORO Botella 2L Aceite de Oliva Sabor Suave EL OLIVAR x 1L EL OLIVAR Aceite de Oliva Extravirgen ARO Botella 2L ARO Multiplicador-de-unidad: MAKRO-Bi-Precio|Vigente Oculto Aceite de Oliva Puro EL OLIVAR Galonera 3.785L Aceite de Oliva Puro ARO Botella 2L Aceite de Oliva HUERTO ALAMEIN Extra Virgen Botella 500ml HUERTO ALAMEIN Aceite de Oliva OLIVOS DEL SUR Extra Virgen Botella 1L OLIVOS DEL SUR Recomendado para ti",,,,,,"{""Descripción"": [""Descripción del producto"", ""Importante destacar"", ""Calorías por porción : 124kcal"", ""Composición : Oliva"", ""Contenido Neto : 1L"", ""Variedad: 100% puro"", ""Presentación : Botella"", ""cuenta con una amplia variedad de"", ""para que puedas elegir qué más se adecua a tus necesidades."", ""Dentro de los"", ""encontramos al aceite , un producto muy usado en la cocina gracias a su versatilidad. Por ejemplo el"", ""cuenta con un alto contenido en ácidos grasos monoinsaturados y poliinsaturados que permitirán aportar grandes beneficios en nuestro organismo como: Eleva los niveles de colesterol HDL (bueno), Disminuye el colesterol LDL-c (colesterol malo), beneficia el control de la hipertensión arterial, entre otros."", ""Es ideal para consumirlo de manera directa, ya sea en ensaladas como complemento alimentario, de este modo podrás absorber al máximo sus nutrientes."", ""También puedes optar por el"", ""Aceite Vegetal"", ""que gracias a su composición es perfecto para la preparación de cualquier receta. Desde un delicioso arroz con pollo hasta unas crocantes papitas fritas. Encuentralo en diferentes presentaciones y en las mejores marcas del mercado. Complenta tus comidas con nuestra variedad de"", ""Arroces"", ""para que engrias a toda tu familia con tus mejores preparaciones."", ""¡Conoce las distintas opciones en"", ""Aceites"", ""en plazaVea Online!"", ""*La imagen solo es referencial"", ""Olivar"", ""\""Proensa se funda en 1986 inicialmente dicada a deshuesar y rellenar aceitunas dándoles un valor agregado, lanzándolas al mercado embolsadas con la marca El Olivar. Las aceitunas son 100% naturales y se producen con un delicado cuidado del ecosistema.\"""", ""¿En qué búsqueda? Encuentra más"", ""en plazaVea"", ""En caso algo no vaya como gustes: Puedes revisar nuestras"", ""Politicas de cambios y/o devoluciones"", ""y hacerlas efectivas en todas nuestras tiendas."", ""Productos"", ""que te pueden interesar"", ""similares"", ""Aceite de Oliva Extra Virgen SAN ISIDORO Botella 1L"", ""SAN ISIDORO"", "".90"", "".00"", ""un"", ""3"", ""productos agregados"", ""Agrega indicaciones"", ""Guardar"", ""Aceite de Oliva Extra Virgen SAN ISIDORO Botella 2L"", ""Aceite de Oliva Sabor Suave EL OLIVAR x 1L"", ""EL OLIVAR"", ""Aceite de Oliva Extravirgen ARO Botella 2L"", ""ARO"", ""Multiplicador-de-unidad: MAKRO-Bi-Precio|Vigente Oculto"", ""Aceite de Oliva Puro EL OLIVAR Galonera 3.785L"", ""Aceite de Oliva Puro ARO Botella 2L"", ""Aceite de Oliva HUERTO ALAMEIN Extra Virgen Botella 500ml"", ""HUERTO ALAMEIN"", ""Aceite de Oliva OLIVOS DEL SUR Extra Virgen Botella 1L"", ""OLIVOS DEL SUR"", ""Recomendado para ti""]}",dataset/txt_limpios/1215.txt,dataset/paginas_descargadas/1215.html,ET,descartado,discard,0.10,excluded_keyword
1216,Seja Bem Vindo à Plaza Vea,Información de la marca,Abarrotes > 5L,34.0,PEN,,Desconocido,unknown,PE,Seja Bem Vindo à Plaza Vea,Abarrotes,,5L,34.00,PEN,S/,S/34,34.0,False,original,9.5775,9.5775,3.55,from_peru_cambio_dolar,,Información de la marca,"Presentación/Empaque | Bidón | Porción Sugerida | 14g | Alérgenos Declarados | N/A | Azúcares Por Porción | 0 | Calorías Por Porción | 126 | Carbohidratos Por Porción | Descripción Nutricional | Aceite De Soya y Palma refinado, blanqueado y desodorizado. Tiene excelente estabilidad oxidativa. Posee olor y sabor neutro | Grasas Por Porción | 14 | Proteínas Por Porción | Sodio Por Porción | Composición/Origen | Aceite de Soya y Palma. | Grado | % De Acidez | Máximo 0.06% | Advertencias De Almacenamiento | Consérvese en recipiente cerrado, en un lugar fresco, seco y evitar exposición directa a la luz solar. La exposición a la luz solar disminuye la estabilidad del producto. No almacenar a temperaturas frías, menor de 5ºC. | Contenido Neto | 5L | Advertencias de consumo | Apto para público en general. | Revisa todo | Componentes del Producto | Vendido por | plazaVea | En caso algo no vaya como gustes: Puedes revisar nuestras | Politicas de cambios y/o devoluciones | y hacerlas efectivas en todas nuestras tiendas. | Productos | que te pueden interesar | similares | .00 | un | 3 | productos agregados | Agrega indicaciones | Guardar | Multiplicador-de-unidad: MAKRO-Bi-Precio|Vigente Oculto | Aceite Vegetal DELEITE Premium Botella 900ml | Aceite Fritura Profesional ARO Chef Botella 5L | Aceite de Ajonjolí OLIVOS DEL SUR Botella 100ml Paquete 6un | OLIVOS DEL SUR | Aceite Vegetal BELTRAN Botella 900ml | BELTRAN | Aceite Vegetal BELTRÁN Paquete 24 Botellas 200ml c/u | Recomendado para ti",,,,,"{""Descripción"": [""Información de la marca""], ""Características"": [""Presentación/Empaque"", ""Bidón"", ""Porción sugerida"", ""14g"", ""Alérgenos Declarados"", ""N/A"", ""Azúcar por porción"", ""0"", ""Calorías Porción"", ""126"", ""Carbohidratos Porción"", ""Descripción Nutricional"", ""Aceite De Soya y Palma refinado, blanqueado y desodorizado. Tiene excelente estabilidad oxidativa. Posee olor y sabor neutro"", ""Grasas Porción"", ""14"", ""Proteínas Porción"", ""Sodio Porción"", ""Composición/Origen"", ""Aceite de Soya y Palma."", ""Grado"", ""% De Acidez"", ""Máximo 0.06%"", ""Advertencias De Almacenamiento"", ""Consérvese en recipiente cerrado, en un lugar fresco, seco y evitar exposición directa a la luz solar. La exposición a la luz solar disminuye la estabilidad del producto. No almacenar a temperaturas frías, menor de 5ºC."", ""Contenido Neto"", ""5L"", ""Advertencias de consumo"", ""Apto para público en general."", ""Revisa todo"", ""Componentes del Producto"", ""Vendido por"", ""plazaVea"", ""En caso algo no vaya como gustes: Puedes revisar nuestras"", ""Politicas de cambios y/o devoluciones"", ""y hacerlas efectivas en todas nuestras tiendas."", ""Productos"", ""que te pueden interesar"", ""similares"", "".00"", ""un"", ""3"", ""productos agregados"", ""Agrega indicaciones"", ""Guardar"", ""Multiplicador-de-unidad: MAKRO-Bi-Precio|Vigente Oculto"", ""Aceite Vegetal DELEITE Premium Botella 900ml"", ""Aceite Fritura Profesional ARO Chef Botella 5L"", ""Aceite de Ajonjolí OLIVOS DEL SUR Botella 100ml Paquete 6un"", ""OLIVOS DEL SUR"", ""Aceite Vegetal BELTRAN Botella 900ml"", ""BELTRAN"", ""Aceite Vegetal BELTRÁN Paquete 24 Botellas 200ml c/u"", ""Recomendado para ti""]}",dataset/txt_limpios/1216.txt,dataset/paginas_descargadas/1216.html,ET,sin_categoria,discard,0.30,no_category_detected
1217,Seja Bem Vindo à Plaza Vea,Información de la marca,Abarrotes > 900ml,8.0,PEN,,Desconocido,unknown,PE,Seja Bem Vindo à Plaza Vea,Abarrotes,,900ml,8.00,PEN,S/,S/8,8.0,False,original,2.2535,2.2535,3.55,from_peru_cambio_dolar,,Información de la marca,"Presentación/Empaque | Botella | Porción Sugerida | 14g | Azúcares Por Porción | 0g | Calorías Por Porción | 130kcal | Carbohidratos Por Porción | Descripción Nutricional | Grasas Por Porción | Proteínas Por Porción | Sodio Por Porción | 0mg | Composición/Origen | Aceite 100% vegetal | Advertencias De Almacenamiento | Consérvese en recipiente cerrado, en lugar fresco, seco y seguro | Contenido Neto | 900ml | Revisa todo | Componentes del Producto | Vendido por | plazaVea | En caso algo no vaya como gustes: Puedes revisar nuestras | Politicas de cambios y/o devoluciones | y hacerlas efectivas en todas nuestras tiendas. | Productos | que te pueden interesar | similares | Multiplicador-de-unidad: MAKRO-Bi-Precio|Vigente Oculto | .00 | un | 3 | productos agregados | Agrega indicaciones | Guardar | Aceite Vegetal BELTRAN Botella 1L | BELTRAN | Aceite Vegetal DELEITE Premium Botella 900ml | Aceite de Soya Vegetal BELTRAN Galonera 3L | Recomendado para ti",,,,,"{""Descripción"": [""Información de la marca""], ""Características"": [""Presentación/Empaque"", ""Botella"", ""Porción sugerida"", ""14g"", ""Azúcar por porción"", ""0g"", ""Calorías Porción"", ""130kcal"", ""Carbohidratos Porción"", ""Descripción Nutricional"", ""Grasas Porción"", ""Proteínas Porción"", ""Sodio Porción"", ""0mg"", ""Composición/Origen"", ""Aceite 100% vegetal"", ""Advertencias De Almacenamiento"", ""Consérvese en un recipiente cerrado, en lugar fresco, seco y seguro"", ""Contenido Neto"", ""900ml"", ""Revisa todo"", ""Componentes del Producto"", ""Vendido por"", ""plazaVea"", ""En caso algo no vaya como gustes: Puedes revisar nuestras"", ""Politicas de cambios y/o devoluciones"", ""y hacerlas efectivas en todas nuestras tiendas."", ""Productos"", ""que te pueden interesar"", ""similares"", ""Multiplicador-de-unidad: MAKRO-Bi-Precio|Vigente Oculto"", "".00"", ""un"", ""3"", ""productos agregados"", ""Agrega indicaciones"", ""Guardar"", ""Aceite Vegetal BELTRAN Botella 1L"", ""BELTRAN"", ""Aceite Vegetal DELEITE Premium Botella 900ml"", ""Aceite de Soya Vegetal BELTRAN Galonera 3L"", ""Recomendado para ti""]}",dataset/txt_limpios/1217.txt,dataset/paginas_descargadas/1217.html,ET,sin_categoria,discard,0.30,no_category_detected
