{"source_id": "573", "title": "Elegí tu envío", "description": "", "breadcrumbs": "Hola, Limpía tú cache > 2 Lt > 7791813888468", "price_raw": "4.3", "currency_raw": "ARS", "url": "", "seller": "Desconocido", "availability": "unknown", "country": "AR", "product_name": "Elegí tu envío", "brand": "Hola, Limpía tú cache", "reference": "7791813888468.0", "unit": "2 Lt", "price_amount": 4.3, "price_currency": "ARS", "price_symbol": "$", "price_text": "$4.30", "price_amount_filled": "4.3", "price_is_imputed": "False", "price_imputation_source": "original", "price_amount_usd": "0.0034", "price_amount_usd_filled": "0.0034", "fx_rate_local_per_usd": "1255.0", "fx_source": "from_argentina_cambio_dolar", "information_text": "", "description_text": "", "features_text": "", "specifications_text": "", "benefits_text": "", "details_text": "", "other_sections": "", "sections": {}, "txt_path": "dataset/txt_limpios/573.txt", "html_path": "dataset/paginas_descargadas/573.html", "es_status": "EN", "category_canonical": "sin_categoria", "decision": "discard", "match_score": 0.3, "reasons": "no_category_detected"}
{"source_id": "575", "title": "Elegí tu envío", "description": "", "breadcrumbs": "Hola, Limpía tú cache > 2,25 Lt > 7790639003437", "price_raw": "1.5", "currency_raw": "ARS", "url": "", "seller": "Desconocido", "availability": "unknown", "country": "AR", "product_name": "Elegí tu envío", "brand": "Hola, Limpía tú cache", "reference": "7790639003437.0", "unit": "2,25 Lt", "price_amount": 1.5, "price_currency": "ARS", "price_symbol": "$", "price_text": "$1.50", "price_amount_filled": "1.5", "price_is_imputed": "False", "price_imputation_source": "original", "price_amount_usd": "0.0012", "price_amount_usd_filled": "0.0012", "fx_rate_local_per_usd": "1255.0", "fx_source": "from_argentina_cambio_dolar", "information_text": "", "description_text": "", "features_text": "", "specifications_text": "", "benefits_text": "", "details_text": "", "other_sections": "", "sections": {}, "txt_path": "dataset/txt_limpios/575.txt", "html_path": "dataset/paginas_descargadas/575.html", "es_status": "EN", "category_canonical": "sin_categoria", "decision": "discard", "match_score": 0.3, "reasons": "no_category_detected"}
{"source_id": "576", "title": "Elegí tu envío", "description": "", "breadcrumbs": "Hola, Limpía tú cache", "price_raw": "", "currency_raw": "ARS", "url": "", "seller": "Desconocido", "availability": "unknown", "country": "AR", "product_name": "Elegí tu envío", "brand": "Hola, Limpía tú cache", "reference": "", "unit": "", "price_amount": null, "price_currency": "ARS", "price_symbol": "", "price_text": "", "price_amount_filled": "1663.58", "price_is_imputed": "True", "price_imputation_source": "country_mean", "price_amount_usd": "", "price_amount_usd_filled": "1.3256", "fx_rate_local_per_usd": "1255.0", "fx_source": "from_argentina_cambio_dolar", "information_text": "", "description_text": "", "features_text": "", "specifications_text": "", "benefits_text": "", "details_text": "", "other_sections": "", "sections": {}, "txt_path": "dataset/txt_limpios/576.txt", "html_path": "dataset/paginas_descargadas/576.html", "es_status": "EN", "category_canonical": "sin_categoria", "decision": "discard", "match_score": 0.3, "reasons": "no_category_detected;price_parse_failed"}
{"source_id": "577", "title": "Elegí tu envío", "description": "", "breadcrumbs": "Hola, Limpía tú cache > 1 Kg > 2490094000000", "price_raw": "890.0", "currency_raw": "ARS", "url": "", "seller": "Desconocido", "availability": "unknown", "country": "AR", "product_name": "Elegí tu envío", "brand": "Hola, Limpía tú cache", "reference": "2490094000000.0", "unit": "1 Kg", "price_amount": 890.0, "price_currency": "ARS", "price_symbol": "$", "price_text": "$890", "price_amount_filled": "890.0", "price_is_imputed": "False", "price_imputation_source": "original", "price_amount_usd": "0.7092", "price_amount_usd_filled": "0.7092", "fx_rate_local_per_usd": "1255.0", "fx_source": "from_argentina_cambio_dolar", "information_text": "", "description_text": "", "features_text": "", "specifications_text": "", "benefits_text": "", "details_text": "", "other_sections": "", "sections": {}, "txt_path": "dataset/txt_limpios/577.txt", "html_path": "dataset/paginas_descargadas/577.html", "es_status": "EN", "category_canonical": "sin_categoria", "decision": "discard", "match_score": 0.3, "reasons": "no_category_detected"}
{"source_id": "578", "title": "Elegí tu envío", "description": "", "breadcrumbs": "Hola, Limpía tú cache > 1 Kg > 2490127000000", "price_raw": "4.69", "currency_raw": "ARS", "url": "", "seller": "Desconocido", "availability": "unknown", "country": "AR", "product_name": "Elegí tu envío", "brand": "Hola, Limpía tú cache", "reference": "2490127000000.0", "unit": "1 Kg", "price_amount": 4.69, "price_currency": "ARS", "price_symbol": "$", "price_text": "$4.69", "price_amount_filled": "4.69", "price_is_imputed": "False", "price_imputation_source": "original", "price_amount_usd": "0.0037", "price_amount_usd_filled": "0.0037", "fx_rate_local_per_usd": "1255.0", "fx_source": "from_argentina_cambio_dolar", "information_text": "", "description_text": "", "features_text": "", "specifications_text": "", "benefits_text": "", "details_text": "", "other_sections": "", "sections": {}, "txt_path": "dataset/txt_limpios/578.txt", "html_path": "dataset/paginas_descargadas/578.html", "es_status": "EN", "category_canonical": "sin_categoria", "decision": "discard", "match_score": 0.3, "reasons": "no_category_detected"}
{"source_id": "1666", "title": "Elige un método de entrega", "description": "Café Nescafé Tradición el café de todos los días, en una cómoda presentación para llevar contigo a todas partes. Formato 170 g. Loading...", "breadcrumbs": "Unimarc > 170 g", "price_raw": "6.2", "currency_raw": "", "url": "", "seller": "Desconocido", "availability": "unknown", "country": "UNKNOWN", "product_name": "Elige un método de entrega", "brand": "Unimarc", "reference": "", "unit": "170 g", "price_amount": 6.2, "price_currency": "", "price_symbol": "$", "price_text": "$6.20", "price_amount_filled": "6.2", "price_is_imputed": "False", "price_imputation_source": "original", "price_amount_usd": "6.2", "price_amount_usd_filled": "6.2", "fx_rate_local_per_usd": "1.0", "fx_source": "default_1usd", "information_text": "", "description_text": "Café Nescafé Tradición el café de todos los días, en una cómoda presentación para llevar contigo a todas partes. Formato 170 g. Loading...", "features_text": "", "specifications_text": "", "benefits_text": "", "details_text": "", "other_sections": "", "sections": {"Descripción": ["Café Nescafé Tradición el café de todos los días, en una cómoda presentación para llevar contigo a todas partes. Formato 170 g.", "Loading..."]}, "txt_path": "dataset/txt_limpios/1666.txt", "html_path": "dataset/paginas_descargadas/1666.html", "es_status": "EN", "category_canonical": "cafe", "decision": "keep", "match_score": 0.6, "reasons": "heuristic_default"}
{"source_id": "1668", "title": "Elige un método de entrega", "description": "Café Waitrose italiano molida. Características: Café grano y molido - Waitrose - Envase doy pack - Formato familiar - Contenido 227 g. Loading...", "breadcrumbs": "Unimarc > 227 g", "price_raw": "7.35", "currency_raw": "", "url": "", "seller": "Desconocido", "availability": "unknown", "country": "UNKNOWN", "product_name": "Elige un método de entrega", "brand": "Unimarc", "reference": "", "unit": "227 g", "price_amount": 7.35, "price_currency": "", "price_symbol": "$", "price_text": "$7.35", "price_amount_filled": "7.35", "price_is_imputed": "False", "price_imputation_source": "original", "price_amount_usd": "7.35", "price_amount_usd_filled": "7.35", "fx_rate_local_per_usd": "1.0", "fx_source": "default_1usd", "information_text": "", "description_text": "Café Waitrose italiano molida. Características: Café grano y molido - Waitrose - Envase doy pack - Formato familiar - Contenido 227 g. Loading...", "features_text": "", "specifications_text": "", "benefits_text": "", "details_text": "", "other_sections": "", "sections": {"Descripción": ["Café Waitrose italiano molida. Características: Café grano y molido - Waitrose - Envase doy pack - Formato familiar - Contenido 227 g.", "Loading..."]}, "txt_path": "dataset/txt_limpios/1668.txt", "html_path": "dataset/paginas_descargadas/1668.html", "es_status": "EN", "category_canonical": "cafe", "decision": "keep", "match_score": 0.6, "reasons": "heuristic_default"}
{"source_id": "1670", "title": "Elige un método de entrega", "description": "Café de gusto suave y fuertemente aromático producto de una mezcla de cafés provenientes de Colombia, Brasil, Perú y Ecuador. Este café molido ha sido sometido a un proceso de tostado lo que permite obtener un café uniforme y agradable. Características: Café grano y molido - Haití - Envase doy pack - Formato familiar - Contenido 250 g. Loading...", "breadcrumbs": "Unimarc > 250 g", "price_raw": "5.29", "currency_raw": "", "url": "", "seller": "Desconocido", "availability": "unknown", "country": "UNKNOWN", "product_name": "Elige un método de entrega", "brand": "Unimarc", "reference": "", "unit": "250 g", "price_amount": 5.29, "price_currency": "", "price_symbol": "$", "price_text": "$5.29", "price_amount_filled": "5.29", "price_is_imputed": "False", "price_imputation_source": "original", "price_amount_usd": "5.29", "price_amount_usd_filled": "5.29", "fx_rate_local_per_usd": "1.0", "fx_source": "default_1usd", "information_text": "", "description_text": "Café de gusto suave y fuertemente aromático producto de una mezcla de cafés provenientes de Colombia, Brasil, Perú y Ecuador. Este café molido ha sido sometido a un proceso de tostado lo que permite obtener un café uniforme y agradable. Características: Café grano y molido - Haití - Envase doy pack - Formato familiar - Contenido 250 g. Loading...", "features_text": "", "specifications_text": "", "benefits_text": "", "details_text": "", "other_sections": "", "sections": {"Descripción": ["Café de gusto suave y fuertemente aromático producto de una mezcla de cafés provenientes de Colombia, Brasil, Perú y Ecuador. Este café molido ha sido sometido a un proceso de tostado lo que permite obtener un café uniforme y agradable. Características: Café grano y molido - Haití - Envase doy pack - Formato familiar - Contenido 250 g.", "Loading..."]}, "txt_path": "dataset/txt_limpios/1670.txt", "html_path": "dataset/paginas_descargadas/1670.html", "es_status": "EN", "category_canonical": "cafe", "decision": "keep", "match_score": 0.6, "reasons": "heuristic_default"}
{"source_id": "1671", "title": "Elige un método de entrega", "description": "Las papas tienen grandes propiedades curativas, en la medicina china tradicional, utilizan las papas como un alimento con gran poder curativo. Entre sus principales propiedades se encuentran: Protege de enfermedades relacionadas con el páncreas,Trata la debilidad, fatiga y falta de energía,Da energía al cuerpo,Calma el estómago,Lubrica los intestinos,Promueve los movimientos intestinales. Loading...", "breadcrumbs": "Unimarc > 2 Kg", "price_raw": "2.39", "currency_raw": "", "url": "", "seller": "Desconocido", "availability": "unknown", "country": "UNKNOWN", "product_name": "Elige un método de entrega", "brand": "Unimarc", "reference": "", "unit": "2 Kg", "price_amount": 2.39, "price_currency": "", "price_symbol": "$", "price_text": "$2.39", "price_amount_filled": "2.39", "price_is_imputed": "False", "price_imputation_source": "original", "price_amount_usd": "2.39", "price_amount_usd_filled": "2.39", "fx_rate_local_per_usd": "1.0", "fx_source": "default_1usd", "information_text": "", "description_text": "Las papas tienen grandes propiedades curativas, en la medicina china tradicional, utilizan las papas como un alimento con gran poder curativo. Entre sus principales propiedades se encuentran: Protege de enfermedades relacionadas con el páncreas,Trata la debilidad, fatiga y falta de energía,Da energía al cuerpo,Calma el estómago,Lubrica los intestinos,Promueve los movimientos intestinales. Loading...", "features_text": "", "specifications_text": "", "benefits_text": "", "details_text": "", "other_sections": "", "sections": {"Descripción": ["Las papas tienen grandes propiedades curativas, en la medicina china tradicional, utilizan las papas como un alimento con gran poder curativo. Entre sus principales propiedades se encuentran: Protege de enfermedades relacionadas con el páncreas,Trata la debilidad, fatiga y falta de energía,Da energía al cuerpo,Calma el estómago,Lubrica los intestinos,Promueve los movimientos intestinales.", "Loading..."]}, "txt_path": "dataset/txt_limpios/1671.txt", "html_path": "dataset/paginas_descargadas/1671.html", "es_status": "ET", "category_canonical": "papa", "decision": "keep", "match_score": 0.6, "reasons": "heuristic_default"}
{"source_id": "1673", "title": "Elige un método de entrega", "description": "Una mezcla nacida de la naturaleza, que ofrece un aroma y sabor intensos para disfrutar en cualquier momento. Tiene un matiz ahumado y chocolateado. Este es el sabor perfecto para aquellos que buscan un café tostado que les energice durante el día, acompañado de su música favorita. Este envase contiene 227 gramos de café molido. Loading...", "breadcrumbs": "Unimarc > 227 g", "price_raw": "14.19", "currency_raw": "", "url": "", "seller": "Desconocido", "availability": "unknown", "country": "UNKNOWN", "product_name": "Elige un método de entrega", "brand": "Unimarc", "reference": "", "unit": "227 g", "price_amount": 14.19, "price_currency": "", "price_symbol": "$", "price_text": "$14.19", "price_amount_filled": "14.19", "price_is_imputed": "False", "price_imputation_source": "original", "price_amount_usd": "14.19", "price_amount_usd_filled": "14.19", "fx_rate_local_per_usd": "1.0", "fx_source": "default_1usd", "information_text": "", "description_text": "Una mezcla nacida de la naturaleza, que ofrece un aroma y sabor intensos para disfrutar en cualquier momento. Tiene un matiz ahumado y chocolateado. Este es el sabor perfecto para aquellos que buscan un café tostado que les energice durante el día, acompañado de su música favorita. Este envase contiene 227 gramos de café molido. Loading...", "features_text": "", "specifications_text": "", "benefits_text": "", "details_text": "", "other_sections": "", "sections": {"Descripción": ["Una mezcla nacida de la naturaleza, que ofrece un aroma y sabor intensos para disfrutar en cualquier momento. Tiene un matiz ahumado y chocolateado. Este es el sabor perfecto para aquellos que buscan un café tostado que les energice durante el día, acompañado de su música favorita. Este envase contiene 227 gramos de café molido.", "Loading..."]}, "txt_path": "dataset/txt_limpios/1673.txt", "html_path": "dataset/paginas_descargadas/1673.html", "es_status": "EN", "category_canonical": "cafe", "decision": "keep", "match_score": 0.6, "reasons": "heuristic_default"}
{"source_id": "1677", "title": "Elige un método de entrega", "description": "Papas Huertos del Ranco, malla 1.3 Kg Loading...", "breadcrumbs": "Unimarc > 1.3 Kg", "price_raw": "1.79", "currency_raw": "", "url": "", "seller": "Desconocido", "availability": "unknown", "country": "UNKNOWN", "product_name": "Elige un método de entrega", "brand": "Unimarc", "reference": "", "unit": "1.3 Kg", "price_amount": 1.79, "price_currency": "", "price_symbol": "$", "price_text": "$1.79", "price_amount_filled": "1.79", "price_is_imputed": "False", "price_imputation_source": "original", "price_amount_usd": "1.79", "price_amount_usd_filled": "1.79", "fx_rate_local_per_usd": "1.0", "fx_source": "default_1usd", "information_text": "", "description_text": "Papas Huertos del Ranco, malla 1.3 Kg Loading...", "features_text": "", "specifications_text": "", "benefits_text": "", "details_text": "", "other_sections": "", "sections": {"Descripción": ["Papas Huertos del Ranco, malla 1.3 Kg", "Loading..."]}, "txt_path": "dataset/txt_limpios/1677.txt", "html_path": "dataset/paginas_descargadas/1677.html", "es_status": "EN", "category_canonical": "papa", "decision": "keep", "match_score": 0.6, "reasons": "heuristic_default"}
{"source_id": "1678", "title": "Elige un método de entrega", "description": "Elaborada con la selección y mezcla (blending) de granos de café de variedad arábica, proveniente de distintas haciendas caficultoras de Brasil y Colombia para luego ser tostado en chile por nuestro sistema de tueste al aire el que retiene todo el aroma del café.100% arábica. Mezcla de variedades arábicas. Cultivado en Brasil y Colombia. Tostado y mezclado en chile. Características: Café grano y molido - Excels - Envase doy pack - Formato familiar - Contenido 250 g. Loading...", "breadcrumbs": "Unimarc > 250 g", "price_raw": "5.49", "currency_raw": "", "url": "", "seller": "Desconocido", "availability": "unknown", "country": "UNKNOWN", "product_name": "Elige un método de entrega", "brand": "Unimarc", "reference": "", "unit": "250 g", "price_amount": 5.49, "price_currency": "", "price_symbol": "$", "price_text": "$5.49", "price_amount_filled": "5.49", "price_is_imputed": "False", "price_imputation_source": "original", "price_amount_usd": "5.49", "price_amount_usd_filled": "5.49", "fx_rate_local_per_usd": "1.0", "fx_source": "default_1usd", "information_text": "", "description_text": "Elaborada con la selección y mezcla (blending) de granos de café de variedad arábica, proveniente de distintas haciendas caficultoras de Brasil y Colombia para luego ser tostado en chile por nuestro sistema de tueste al aire el que retiene todo el aroma del café.100% arábica. Mezcla de variedades arábicas. Cultivado en Brasil y Colombia. Tostado y mezclado en chile. Características: Café grano y molido - Excels - Envase doy pack - Formato familiar - Contenido 250 g. Loading...", "features_text": "", "specifications_text": "", "benefits_text": "", "details_text": "", "other_sections": "", "sections": {"Descripción": ["Elaborada con la selección y mezcla (blending) de granos de café de variedad arábica, proveniente de distintas haciendas caficultoras de Brasil y Colombia para luego ser tostado en chile por nuestro sistema de tueste al aire el que retiene todo el aroma del café.100% arábica. Mezcla de variedades arábicas. Cultivado en Brasil y Colombia. Tostado y mezclado en chile. Características: Café grano y molido - Excels - Envase doy pack - Formato familiar - Contenido 250 g.", "Loading..."]}, "txt_path": "dataset/txt_limpios/1678.txt", "html_path": "dataset/paginas_descargadas/1678.html", "es_status": "ET", "category_canonical": "cafe", "decision": "keep", "match_score": 0.6, "reasons": "heuristic_default"}
{"source_id": "1682", "title": "Elige un método de entrega", "description": "Papas, granel 500 g Loading...", "breadcrumbs": "Unimarc > 500 g", "price_raw": "695.0", "currency_raw": "", "url": "", "seller": "Desconocido", "availability": "unknown", "country": "UNKNOWN", "product_name": "Elige un método de entrega", "brand": "Unimarc", "reference": "", "unit": "500 g", "price_amount": 695.0, "price_currency": "", "price_symbol": "$", "price_text": "$695", "price_amount_filled": "695.0", "price_is_imputed": "False", "price_imputation_source": "original", "price_amount_usd": "695.0", "price_amount_usd_filled": "695.0", "fx_rate_local_per_usd": "1.0", "fx_source": "default_1usd", "information_text": "", "description_text": "Papas, granel 500 g Loading...", "features_text": "", "specifications_text": "", "benefits_text": "", "details_text": "", "other_sections": "", "sections": {"Descripción": ["Papas, granel 500 g", "Loading..."]}, "txt_path": "dataset/txt_limpios/1682.txt", "html_path": "dataset/paginas_descargadas/1682.html", "es_status": "EN", "category_canonical": "papa", "decision": "keep", "match_score": 0.6, "reasons": "heuristic_default"}
{"source_id": "1685", "title": "Elige un método de entrega", "description": "Pan De Molde Blanco Grande, Con Un 30 % Más De Rebanadas. Producto certificado Kosher. Características: Pan molde y pita - Ideal - Sin sellos - Envase bolsa - Formato familiar - Contenido 752 g. Loading...", "breadcrumbs": "Unimarc > 750 g", "price_raw": "2.95", "currency_raw": "", "url": "", "seller": "Desconocido", "availability": "unknown", "country": "UNKNOWN", "product_name": "Elige un método de entrega", "brand": "Unimarc", "reference": "", "unit": "750 g", "price_amount": 2.95, "price_currency": "", "price_symbol": "$", "price_text": "$2.95", "price_amount_filled": "2.95", "price_is_imputed": "False", "price_imputation_source": "original", "price_amount_usd": "2.95", "price_amount_usd_filled": "2.95", "fx_rate_local_per_usd": "1.0", "fx_source": "default_1usd", "information_text": "", "description_text": "Pan De Molde Blanco Grande, Con Un 30 % Más De Rebanadas. Producto certificado Kosher. Características: Pan molde y pita - Ideal - Sin sellos - Envase bolsa - Formato familiar - Contenido 752 g. Loading...", "features_text": "", "specifications_text": "", "benefits_text": "", "details_text": "", "other_sections": "", "sections": {"Descripción": ["Pan De Molde Blanco Grande, Con Un 30 % Más De Rebanadas. Producto certificado Kosher. Características: Pan molde y pita - Ideal - Sin sellos - Envase bolsa - Formato familiar - Contenido 752 g.", "Loading..."]}, "txt_path": "dataset/txt_limpios/1685.txt", "html_path": "dataset/paginas_descargadas/1685.html", "es_status": "ET", "category_canonical": "pan", "decision": "keep", "match_score": 0.6, "reasons": "heuristic_default"}
