{"source_id": "796", "title": "LECHE SABORIZADA ALPIN PACK X3 185ML", "description": "Ingredientes | Componentes Nombre del producto: Leche Saborizada Alpin Pack x3 185 mL Descripción del producto: La Leche Saborizada Alpin es una bebida láctea lista para consumir, perfecta para cualquier momento del día. Tamaño: 15 cm x 12 cm Peso: 555 mL (3 x 185 mL) Modo de fabricación: Industrial Origen: Nacional SA-000987-2016 Alergenos: Puede contener leche. Componentes: Leche Azúcar Saborizantes (chocolate) Vitaminas (B1, B2, A, Niacina) Ver más También puede interesarte BONYURT 4 UND ALPINA 680 G YOX SURTIDO FRESA Y MELOCOTÓN ALPINA 4 UND - 40... ALPINITO SURTIDO FRESA EL MELOCOTÓN 4 UND - 180 ... AVENA ALPINA VASO 250 ML PONY MALTA GO PET 200 ML LONCHERA SURTIDA FRITOLAY 10 UN 236GR TE HATSU SURTIDO 200 ML CHOCORAMO 65G X 3 UNIDADES Amor y amistad SALCHICHA RANCHERA X 230 G X 7 UD Tratamiento de Datos Garantías Términos y condiciones Superintendencia de Industria y Comercio – SIC 0.17.168-hotfix-2.", "breadcrumbs": "Unidades disponibles > 185ML", "price_raw": "555.0", "currency_raw": "", "url": "", "seller": "Desconocido", "availability": "unknown", "country": "UNKNOWN", "product_name": "LECHE SABORIZADA ALPIN PACK X3 185ML", "brand": "Unidades disponibles", "reference": "", "unit": "185ML", "price_amount": 555.0, "price_currency": "", "price_symbol": "", "price_text": "555", "price_amount_filled": "555.0", "price_is_imputed": "False", "price_imputation_source": "original", "price_amount_usd": "555.0", "price_amount_usd_filled": "555.0", "fx_rate_local_per_usd": "1.0", "fx_source": "default_1usd", "information_text": "", "description_text": "Ingredientes | Componentes Nombre del producto: Leche Saborizada Alpin Pack x3 185 mL Descripción del producto: La Leche Saborizada Alpin es una bebida láctea lista para consumir, perfecta para cualquier momento del día. Tamaño: 15 cm x 12 cm Peso: 555 mL (3 x 185 mL) Modo de fabricación: Industrial Origen: Nacional SA-000987-2016 Alergenos: Puede contener leche. Componentes: Leche Azúcar Saborizantes (chocolate) Vitaminas (B1, B2, A, Niacina) Ver más También puede interesarte BONYURT 4 UND ALPINA 680 G YOX SURTIDO FRESA Y MELOCOTÓN ALPINA 4 UND - 40... ALPINITO SURTIDO FRESA EL MELOCOTÓN 4 UND - 180 ... AVENA ALPINA VASO 250 ML PONY MALTA GO PET 200 ML LONCHERA SURTIDA FRITOLAY 10 UN 236GR TE HATSU SURTIDO 200 ML CHOCORAMO 65G X 3 UNIDADES Amor y amistad SALCHICHA RANCHERA X 230 G X 7 UD Tratamiento de Datos Garantías Términos y condiciones Superintendencia de Industria y Comercio – SIC 0.17.168-hotfix-2.", "features_text": "", "specifications_text": "", "benefits_text": "", "details_text": "", "other_sections": "", "sections": {"Descripción": ["Ingredientes | Componentes", "Nombre del producto: Leche Saborizada Alpin Pack x3 185 mL", "Descripción del producto: La Leche Saborizada Alpin es una bebida láctea lista para consumir, perfecta para cualquier momento del día.", "Tamaño: 15 cm x 12 cm", "Peso: 555 mL (3 x 185 mL)", "Modo de fabricación: Industrial", "Origen: Nacional", "SA-000987-2016", "Alergenos: Puede contener leche.", "Componentes: Leche", "Azúcar", "Saborizantes (chocolate)", "Vitaminas (B1, B2, A, Niacina)", "Ver más", "También puede interesarte", "BONYURT 4 UND ALPINA 680 G", "YOX SURTIDO FRESA Y MELOCOTÓN ALPINA 4 UND - 40...", "ALPINITO SURTIDO FRESA EL MELOCOTÓN 4 UND - 180 ...", "AVENA ALPINA VASO 250 ML", "PONY MALTA GO PET 200 ML", "LONCHERA SURTIDA FRITOLAY 10 UN 236GR", "TE HATSU SURTIDO 200 ML", "CHOCORAMO 65G X 3 UNIDADES", "Amor y amistad", "SALCHICHA RANCHERA X 230 G X 7 UD", "Tratamiento de Datos", "Garantías", "Términos y condiciones", "Superintendencia de Industria y Comercio – SIC", "0.17.168-hotfix-2."]}, "txt_path": "dataset/txt_limpios/796.txt", "html_path": "dataset/paginas_descargadas/796.html", "es_status": "ET", "category_canonical": "descartado", "decision": "discard", "match_score": 0.1, "reasons": "excluded_keyword"}
{"source_id": "1342", "title": "LECHE TONI TETRABRIK 1 L ENTERA", "description": "Ficha técnica Leche Toni Tetra Brik 1 ¿Deseas recibir notificaciones? Remind me later Permitir Thank you! Please check your email inbox to confirm. ¡Oops! Notifications are disabled.", "breadcrumbs": "Comparar > 1 L", "price_raw": "1.45", "currency_raw": "USD", "url": "", "seller": "Desconocido", "availability": "unknown", "country": "US", "product_name": "LECHE TONI TETRABRIK 1 L ENTERA", "brand": "Comparar", "reference": "", "unit": "1 L", "price_amount": 1.45, "price_currency": "USD", "price_symbol": "$", "price_text": "$1,45", "price_amount_filled": "1.45", "price_is_imputed": "False", "price_imputation_source": "original", "price_amount_usd": "1.45", "price_amount_usd_filled": "1.45", "fx_rate_local_per_usd": "1.0", "fx_source": "default_1usd", "information_text": "Ficha técnica Leche Toni Tetra Brik 1 ¿Deseas recibir notificaciones? Remind me later Permitir Thank you! Please check your email inbox to confirm. ¡Oops! Notifications are disabled.", "description_text": "", "features_text": "", "specifications_text": "", "benefits_text": "", "details_text": "", "other_sections": "", "sections": {"Información": ["Ficha técnica", "Leche Toni Tetra Brik 1 L Entera", "¿Deseas recibir notificaciones?", "Remind me later", "Permitir", "Thank you! Please check your email inbox to confirm.", "Oops! Notifications are disabled."]}, "txt_path": "dataset/txt_limpios/1342.txt", "html_path": "dataset/paginas_descargadas/1342.html", "es_status": "ET", "category_canonical": "leche", "decision": "keep", "match_score": 0.6, "reasons": "heuristic_default"}
{"source_id": "1341", "title": "LECHE VITA 900 ML ENTERA", "description": "Ficha técnica Leche Vita funda 900 ml entera ¿Deseas recibir notificaciones? Remind me later Permitir Thank you! Please check your email inbox to confirm. ¡Oops! Notifications are disabled.", "breadcrumbs": "Comparar > 900 ML", "price_raw": "0.97", "currency_raw": "USD", "url": "", "seller": "Desconocido", "availability": "unknown", "country": "US", "product_name": "LECHE VITA 900 ML ENTERA", "brand": "Comparar", "reference": "", "unit": "900 ML", "price_amount": 0.97, "price_currency": "USD", "price_symbol": "$", "price_text": "$0,97", "price_amount_filled": "0.97", "price_is_imputed": "False", "price_imputation_source": "original", "price_amount_usd": "0.97", "price_amount_usd_filled": "0.97", "fx_rate_local_per_usd": "1.0", "fx_source": "default_1usd", "information_text": "Ficha técnica Leche Vita funda 900 ml entera ¿Deseas recibir notificaciones? Remind me later Permitir Thank you! Please check your email inbox to confirm. ¡Oops! Notifications are disabled.", "description_text": "", "features_text": "", "specifications_text": "", "benefits_text": "", "details_text": "", "other_sections": "", "sections": {"Información": ["Ficha técnica", "Leche Vita funda 900 ml entera", "¿Deseas recibir notificaciones?", "Remind me later", "Permitir", "Thank you! Please check your email inbox to confirm.", "Oops! Notifications are disabled."]}, "txt_path": "dataset/txt_limpios/1341.txt", "html_path": "dataset/paginas_descargadas/1341.html", "es_status": "ET", "category_canonical": "descartado", "decision": "discard", "match_score": 0.1, "reasons": "excluded_keyword"}
{"source_id": "503", "title": "Leches Frescas", "description": "", "breadcrumbs": "Leches Enteras", "price_raw": "", "currency_raw": "", "url": "", "seller": "Desconocido", "availability": "unknown", "country": "UNKNOWN", "product_name": "Leches Frescas", "brand": "Leches Enteras", "reference": "", "unit": "", "price_amount": null, "price_currency": "", "price_symbol": "", "price_text": "", "price_amount_filled": "428.01", "price_is_imputed": "True", "price_imputation_source": "category_country_mean", "price_amount_usd": "", "price_amount_usd_filled": "428.0052", "fx_rate_local_per_usd": "1.0", "fx_source": "default_1usd", "information_text": "", "description_text": "", "features_text": "MARCA | : LA SERENISIMA | SIN TACC | : SI", "specifications_text": "", "benefits_text": "", "details_text": "", "other_sections": "", "sections": {"Características": ["MARCA", ": LA SERENISIMA", "SIN TACC", ": SI"]}, "txt_path": "dataset/txt_limpios/503.txt", "html_path": "dataset/paginas_descargadas/503.html", "es_status": "EN", "category_canonical": "leche", "decision": "discard", "match_score": 0.6, "reasons": "price_parse_failed;price<=0"}
{"source_id": "504", "title": "Leches Larga Vida", "description": "", "breadcrumbs": "Leches Enteras > 1l", "price_raw": "1380.0", "currency_raw": "", "url": "", "seller": "Desconocido", "availability": "unknown", "country": "UNKNOWN", "product_name": "Leches Larga Vida", "brand": "Leches Enteras", "reference": "", "unit": "1l", "price_amount": 1380.0, "price_currency": "", "price_symbol": "$", "price_text": "$1.380,00", "price_amount_filled": "1380.0", "price_is_imputed": "False", "price_imputation_source": "original", "price_amount_usd": "1380.0", "price_amount_usd_filled": "1380.0", "fx_rate_local_per_usd": "1.0", "fx_source": "default_1usd", "information_text": "", "description_text": "", "features_text": "MARCA | : ILOLAY | Últimos consultados | NO ACUMULABLE CON OTRAS PROMOS | Leche Entera Clasica LA SERENISIMA Sachet 1l | OFERTA | Ver planes de cuotas", "specifications_text": "", "benefits_text": "", "details_text": "", "other_sections": "", "sections": {"Características": ["MARCA", ": ILOLAY", "Últimos consultados", "NO ACUMULABLE CON OTRAS PROMOS", "Leche Entera Clasica LA SERENISIMA Sachet 1l", "OFERTA", "Ver planes de cuotas"]}, "txt_path": "dataset/txt_limpios/504.txt", "html_path": "dataset/paginas_descargadas/504.html", "es_status": "EN", "category_canonical": "leche", "decision": "keep", "match_score": 0.6, "reasons": "heuristic_default"}
{"source_id": "505", "title": "Leches Larga Vida", "description": "", "breadcrumbs": "Leches Enteras > 1l", "price_raw": "2049.0", "currency_raw": "", "url": "", "seller": "Desconocido", "availability": "unknown", "country": "UNKNOWN", "product_name": "Leches Larga Vida", "brand": "Leches Enteras", "reference": "", "unit": "1l", "price_amount": 2049.0, "price_currency": "", "price_symbol": "$", "price_text": "$2.049,00", "price_amount_filled": "2049.0", "price_is_imputed": "False", "price_imputation_source": "original", "price_amount_usd": "2049.0", "price_amount_usd_filled": "2049.0", "fx_rate_local_per_usd": "1.0", "fx_source": "default_1usd", "information_text": "", "description_text": "", "features_text": "MARCA | : TREGAR | SIN TACC | : SI | Últimos consultados | Leche Entera Larga Vida Ilolay Ttb 1 Ltr | Ver planes de cuotas | NO ACUMULABLE CON OTRAS PROMOS | Leche Entera Clasica LA SERENISIMA Sachet 1l | OFERTA", "specifications_text": "", "benefits_text": "", "details_text": "", "other_sections": "", "sections": {"Características": ["MARCA", ": TREGAR", "SIN TACC", ": SI", "Últimos consultados", "Leche Entera Larga Vida Ilolay Ttb 1 Ltr", "Ver planes de cuotas", "NO ACUMULABLE CON OTRAS PROMOS", "Leche Entera Clasica LA SERENISIMA Sachet 1l", "OFERTA"]}, "txt_path": "dataset/txt_limpios/505.txt", "html_path": "dataset/paginas_descargadas/505.html", "es_status": "EN", "category_canonical": "leche", "decision": "keep", "match_score": 0.6, "reasons": "heuristic_default"}
{"source_id": "506", "title": "Leches Larga Vida", "description": "", "breadcrumbs": "Leches Enteras > 1l", "price_raw": "2040.0", "currency_raw": "", "url": "", "seller": "Desconocido", "availability": "unknown", "country": "UNKNOWN", "product_name": "Leches Larga Vida", "brand": "Leches Enteras", "reference": "", "unit": "1l", "price_amount": 2040.0, "price_currency": "", "price_symbol": "$", "price_text": "$2.040,00", "price_amount_filled": "2040.0", "price_is_imputed": "False", "price_imputation_source": "original", "price_amount_usd": "2040.0", "price_amount_usd_filled": "2040.0", "fx_rate_local_per_usd": "1.0", "fx_source": "default_1usd", "information_text": "", "description_text": "", "features_text": "MARCA | : VERONICA | SIN TACC | : SI | Últimos consultados | Leche Larga Vida Entera TREGAR Ttb 1 L | Ver planes de cuotas | Leche Entera Larga Vida Ilolay Ttb 1 Ltr | EN ACUMULABLE CON OTRAS PROMOS | Leche Entera Clasica LA SERENISIMA Sachet 1l | OFERTA", "specifications_text": "", "benefits_text": "", "details_text": "", "other_sections": "", "sections": {"Características": ["MARCA", ": VERONICA", "SIN TACC", ": SI", "Últimos consultados", "Leche Larga Vida Entera TREGAR Ttb 1 L", "Ver planes de cuotas", "Leche Entera Larga Vida Ilolay Ttb 1 Ltr", "NO ACUMULABLE CON OTRAS PROMOS", "Leche Entera Clasica LA SERENISIMA Sachet 1l", "OFERTA"]}, "txt_path": "dataset/txt_limpios/506.txt", "html_path": "dataset/paginas_descargadas/506.html", "es_status": "ET", "category_canonical": "leche", "decision": "keep", "match_score": 0.6, "reasons": "heuristic_default"}
{"source_id": "507", "title": "Leches Larga Vida", "description": "", "breadcrumbs": "Leches Enteras > 1l", "price_raw": "1911.0", "currency_raw": "", "url": "", "seller": "Desconocido", "availability": "unknown", "country": "UNKNOWN", "product_name": "Leches Larga Vida", "brand": "Leches Enteras", "reference": "", "unit": "1l", "price_amount": 1911.0, "price_currency": "", "price_symbol": "$", "price_text": "$1.911,00", "price_amount_filled": "1911.0", "price_is_imputed": "False", "price_imputation_source": "original", "price_amount_usd": "1911.0", "price_amount_usd_filled": "1911.0", "fx_rate_local_per_usd": "1.0", "fx_source": "default_1usd", "information_text": "", "description_text": "", "features_text": "MARCA | : LAS TRES NIÑAS | SIN TACC | : SI | Últimos consultados | Leche Larga Vida Entera VERONICA 1l | Ver planes de cuotas | Leche Larga Vida Entera TREGAR Ttb 1 L | Leche Entera Larga Vida Ilolay Ttb 1 Ltr | EN ACUMULABLE CON OTRAS PROMOS | Leche Entera Clasica LA SERENISIMA Sachet 1l | OFERTA", "specifications_text": "", "benefits_text": "", "details_text": "", "other_sections": "", "sections": {"Características": ["MARCA", ": LAS TRES NIÑAS", "SIN TACC", ": SI", "Últimos consultados", "Leche Larga Vida Entera VERONICA 1l", "Ver planes de cuotas", "Leche Larga Vida Entera TREGAR Ttb 1 L", "Leche Entera Larga Vida Ilolay Ttb 1 Ltr", "NO ACUMULABLE CON OTRAS PROMOS", "Leche Entera Clasica LA SERENISIMA Sachet 1l", "OFERTA"]}, "txt_path": "dataset/txt_limpios/507.txt", "html_path": "dataset/paginas_descargadas/507.html", "es_status": "ET", "category_canonical": "leche", "decision": "keep", "match_score": 0.6, "reasons": "heuristic_default"}
{"source_id": "788", "title": "Lo sentimos", "description": "", "breadcrumbs": "", "price_raw": "", "currency_raw": "", "url": "", "seller": "Desconocido", "availability": "unknown", "country": "UNKNOWN", "product_name": "Lo sentimos", "brand": "", "reference": "", "unit": "", "price_amount": null, "price_currency": "", "price_symbol": "", "price_text": "", "price_amount_filled": "234.19", "price_is_imputed": "True", "price_imputation_source": "country_mean", "price_amount_usd": "", "price_amount_usd_filled": "234.1938", "fx_rate_local_per_usd": "1.0", "fx_source": "default_1usd", "information_text": "", "description_text": "", "features_text": "", "specifications_text": "", "benefits_text": "", "details_text": "", "other_sections": "", "sections": {}, "txt_path": "dataset/txt_limpios/788.txt", "html_path": "dataset/paginas_descargadas/788.html", "es_status": "EN", "category_canonical": "sin_categoria", "decision": "discard", "match_score": 0.3, "reasons": "no_category_detected;price_parse_failed"}
{"source_id": "1748", "title": "Lácteos y Quesos", "description": "LECHE ENTERA UHT C TAPA SOPROLE 1 LT Productos similares Leche Descremada Natural Ver producto Leche Entera Natural Cremosa Leche Semidescremada Natural Leche Entera Natural Surlat 1 L Leche Semi Descremada Surlat 1 L Leche Semidescremada Gold Café Capuccino Leche Enteral Natural Leche Semidescremada Sabor Frutilla Soprole 1 L Leche Entera A2 Sin Lactosa Colun 1 L Leche Semidescremada Sabor Frutilla Leche Descremada Surlat 1 L Leche Semidescremada Sabor Chocolate Blanco Soprole 1 L Leche Semidescremada Zerolacto Sabor Frutilla Soprole 1 ¡L! ¡Juntos son mejores! Aceite vegetal Precio Un 900 ml arroz Precio Uno G2 Grano Largo Fino 1 Kg FIDEO SPAGHETTI 5 400 GRS. 101409 C Azúcar Blanca Granulada Tottus 860 g Harina con Polvo -19% Azúcar Blanca Granulada Iansa 1 Kg Azúcar Aceite Vegetal Tottus 900 ml -11% FIDEO CORBATA 80 400 GRS. 101302 C Harina Especial con Polvo de Hornear Selecta 1 Kg -37% Arroz Tottus G2 Grano Largo Fino 1 Kg Carpeta Spaghetti N°5 Lucchetti 400 g Aceite vegetal Azúcar Granulada Iansa 900 g Arroz G2 Grano Largo Angosto -10% FIDEO TALLARIN 87 400 GRS. 101407 C Carpeta espiral N°56 Lucchetti 400 g Azúcar Blanca Granulada Tottus 1 Kg Harina sin polvo de Hornear Selecta 1 Kg", "breadcrumbs": "Leches > 1 LT", "price_raw": "1.15", "currency_raw": "", "url": "", "seller": "Desconocido", "availability": "unknown", "country": "UNKNOWN", "product_name": "Lácteos y Quesos", "brand": "Leches", "reference": "", "unit": "1 LT", "price_amount": 1.15, "price_currency": "", "price_symbol": "", "price_text": "1.15", "price_amount_filled": "1.15", "price_is_imputed": "False", "price_imputation_source": "original", "price_amount_usd": "1.15", "price_amount_usd_filled": "1.15", "fx_rate_local_per_usd": "1.0", "fx_source": "default_1usd", "information_text": "", "description_text": "LECHE ENTERA UHT C TAPA SOPROLE 1 LT Productos similares Leche Descremada Natural Ver producto Leche Entera Natural Cremosa Leche Semidescremada Natural Leche Entera Natural Surlat 1 L Leche Semi Descremada Surlat 1 L Leche Semidescremada Gold Café Capuccino Leche Enteral Natural Leche Semidescremada Sabor Frutilla Soprole 1 L Leche Entera A2 Sin Lactosa Colun 1 L Leche Semidescremada Sabor Frutilla Leche Descremada Surlat 1 L Leche Semidescremada Sabor Chocolate Blanco Soprole 1 L Leche Semidescremada Zerolacto Sabor Frutilla Soprole 1 ¡L! ¡Juntos son mejores! Aceite vegetal Precio Un 900 ml arroz Precio Uno G2 Grano Largo Fino 1 Kg FIDEO SPAGHETTI 5 400 GRS. 101409 C Azúcar Blanca Granulada Tottus 860 g Harina con Polvo -19% Azúcar Blanca Granulada Iansa 1 Kg Azúcar Aceite Vegetal Tottus 900 ml -11% FIDEO CORBATA 80 400 GRS. 101302 C Harina Especial con Polvo de Hornear Selecta 1 Kg -37% Arroz Tottus G2 Grano Largo Fino 1 Kg Carpeta Spaghetti N°5 Lucchetti 400 g Aceite vegetal Azúcar Granulada Iansa 900 g Arroz G2 Grano Largo Angosto -10% FIDEO TALLARIN 87 400 GRS. 101407 C Carpeta espiral N°56 Lucchetti 400 g Azúcar Blanca Granulada Tottus 1 Kg Harina sin polvo de Hornear Selecta 1 Kg", "features_text": "", "specifications_text": "", "benefits_text": "", "details_text": "", "other_sections": "", "sections": {"Descripción": ["LECHE ENTERA UHT C TAPA SOPROLE 1 LT", "Productos similares", "Leche Descremada Natural", "Ver producto", "Leche Entera Natural Cremosa", "Leche Semidescremada Natural", "Leche Entera Natural Surlat 1 L", "Leche Semi Descremada Surlat 1 L", "Leche Semidescremada Gold Café Capuccino", "Leche Enteral Natural", "Leche Semidescremada Sabor Frutilla Soprole 1 L", "Leche Entera A2 Sin Lactosa Colun 1 L", "Leche Semidescremada Sabor Frutilla", "Leche Descremada Surlat 1 L", "Leche Semidescremada Sabor Chocolate Blanco Soprole 1 L", "Leche Semidescremada Zerolacto Sabor Frutilla Soprole 1 L", "¡Juntos son mejores!", "Aceite Vegetal Precio Uno 900 ml", "Arroz Precio Uno G2 Grano Largo Fino 1 Kg", "FIDEO SPAGHETTI 5  400 GRS. 101409 C", "Azúcar Blanca Granulada Tottus 860 g", "Harina con Polvo", "-19%", "Azúcar Blanca Granulada Iansa 1 Kg", "Azúcar", "Aceite Vegetal Tottus 900 ml", "-11%", "FIDEO CORBATA 80  400 GRS. 101302 C", "Harina Especial con Polvo de Hornear Selecta 1 Kg", "-37%", "Arroz Tottus G2 Grano Largo Fino 1 Kg", "Pasta Spaghetti N°5 Lucchetti 400 g", "Aceite Vegetal", "Azúcar Granulada Iansa 900 g", "Arroz G2 Grano Largo Angosto", "-10%", "FIDEO TALLARIN 87  400 GRS. 101407 C", "Pasta Espiral N°56 Lucchetti 400 g", "Azúcar Blanca Granulada Tottus 1 Kg", "Harina sin Polvo de Hornear Selecta 1 Kg"]}, "txt_path": "dataset/txt_limpios/1748.txt", "html_path": "dataset/paginas_descargadas/1748.html", "es_status": "ET", "category_canonical": "leche", "decision": "keep", "match_score": 0.6, "reasons": "heuristic_default"}
