source_id,title,description,breadcrumbs,price_raw,currency_raw,url,seller,availability,country,product_name,brand,reference,unit,price_amount,price_currency,price_symbol,price_text,price_amount_filled,price_is_imputed,price_imputation_source,price_amount_usd,price_amount_usd_filled,fx_rate_local_per_usd,fx_source,information_text,description_text,features_text,specifications_text,benefits_text,details_text,other_sections,sections,txt_path,html_path,es_status,category_canonical,decision,match_score,reasons
587,DALE VIDA A TU JARDIN,"Datos técnicos Descripción del producto ¡Suscribite a nuestro boletín! Recibí las ofertas y novedades en tu correo. Suscribirme Seguridad y confianza © Libertad 2023. Todos los derechos reservados. Términos y Condiciones Direcciôn General de Defensa y protecciôn al Consumidor, para consultas y/o denuncias ingresa a los Términos más buscados 1. leche 2. cerveza 3. aceptada 4. yerba 5. cafe 6. pañales 7. queso 8. arroz 9. fideos 10. fernet",🌷🌻​🌼​ > 600 Gr,2652.07,ARS,,Desconocido,unknown,AR,DALE VIDA A TU JARDIN,🌷🌻​🌼​,,600 Gr,2652.07,ARS,$,"$2.652,07",2652.07,False,original,2.1132,2.1132,1255.0,from_argentina_cambio_dolar,,"Datos técnicos Descripción del producto ¡Suscribite a nuestro boletín! Recibí las ofertas y novedades en tu correo. Suscribirme Seguridad y confianza © Libertad 2023. Todos los derechos reservados. Términos y Condiciones Direcciôn General de Defensa y protecciôn al Consumidor, para consultas y/o denuncias ingresa a los Términos más buscados 1. leche 2. cerveza 3. aceptada 4. yerba 5. cafe 6. pañales 7. queso 8. arroz 9. fideos 10. fernet",,,,,,"{""Descripción"": [""Datos técnicos"", ""Descripción del producto"", ""¡Suscribite a nuestro newsletter!"", ""Recibí las ofertas y novedades en tu correo."", ""Suscribirme"", ""Seguridad y confianza"", ""© Libertad 2023. Todos los derechos reservados."", ""Términos y Condiciones"", ""Dirección General de Defensa y Protección al Consumidor para consultas y/o denuncias"", ""introduzca aquí"", ""Términos más buscados"", ""1."", ""leche"", ""2."", ""cerveza"", ""3."", ""aceite"", ""4."", ""yerba"", ""5."", ""cafe"", ""6."", ""pañales"", ""7."", ""queso"", ""8."", ""arroz"", ""9."", ""fideos"", ""10."", ""fernet""]}",dataset/txt_limpios/587.txt,dataset/paginas_descargadas/587.html,ET,cafe,keep,0.60,heuristic_default
588,DALE VIDA A TU JARDIN,"Datos técnicos Descripción del producto ¡Suscribite a nuestro boletín! Recibí las ofertas y novedades en tu correo. Suscribirme Seguridad y confianza © Libertad 2023. Todos los derechos reservados. Términos y Condiciones Direcciôn General de Defensa y protecciôn al Consumidor, para consultas y/o denuncias ingresa a los Términos más buscados 1. leche 2. cerveza 3. aceptada 4. yerba 5. cafe 6. pañales 7. queso 8. arroz 9. fideos 10. fernet",🌷🌻​🌼​ > 500 G,1561.98,ARS,,Desconocido,unknown,AR,DALE VIDA A TU JARDIN,🌷🌻​🌼​,,500 G,1561.98,ARS,$,"$1.561,98",1561.98,False,original,1.2446,1.2446,1255.0,from_argentina_cambio_dolar,,"Datos técnicos Descripción del producto ¡Suscribite a nuestro boletín! Recibí las ofertas y novedades en tu correo. Suscribirme Seguridad y confianza © Libertad 2023. Todos los derechos reservados. Términos y Condiciones Direcciôn General de Defensa y protecciôn al Consumidor, para consultas y/o denuncias ingresa a los Términos más buscados 1. leche 2. cerveza 3. aceptada 4. yerba 5. cafe 6. pañales 7. queso 8. arroz 9. fideos 10. fernet",,,,,,"{""Descripción"": [""Datos técnicos"", ""Descripción del producto"", ""¡Suscribite a nuestro newsletter!"", ""Recibí las ofertas y novedades en tu correo."", ""Suscribirme"", ""Seguridad y confianza"", ""© Libertad 2023. Todos los derechos reservados."", ""Términos y Condiciones"", ""Dirección General de Defensa y Protección al Consumidor para consultas y/o denuncias"", ""introduzca aquí"", ""Términos más buscados"", ""1."", ""leche"", ""2."", ""cerveza"", ""3."", ""aceite"", ""4."", ""yerba"", ""5."", ""cafe"", ""6."", ""pañales"", ""7."", ""queso"", ""8."", ""arroz"", ""9."", ""fideos"", ""10."", ""fernet""]}",dataset/txt_limpios/588.txt,dataset/paginas_descargadas/588.html,ET,cafe,keep,0.60,heuristic_default
589,DALE VIDA A TU JARDIN,"Datos técnicos Descripción del producto ¡Suscribite a nuestro boletín! Recibí las ofertas y novedades en tu correo. Suscribirme Seguridad y confianza © Libertad 2023. Todos los derechos reservados. Términos y Condiciones Direcciôn General de Defensa y protecciôn al Consumidor, para consultas y/o denuncias ingresa a los Términos más buscados 1. leche 2. cerveza 3. aceptada 4. yerba 5. cafe 6. pañales 7. queso 8. arroz 9. fideos 10. fernet",🌷🌻​🌼​,1090.08,ARS,,Desconocido,unknown,AR,DALE VIDA A TU JARDIN,🌷🌻​🌼​,,,1090.08,ARS,$,"$1.090,08",1090.08,False,original,0.8686,0.8686,1255.0,from_argentina_cambio_dolar,,"Datos técnicos Descripción del producto ¡Suscribite a nuestro boletín! Recibí las ofertas y novedades en tu correo. Suscribirme Seguridad y confianza © Libertad 2023. Todos los derechos reservados. Términos y Condiciones Direcciôn General de Defensa y protecciôn al Consumidor, para consultas y/o denuncias ingresa a los Términos más buscados 1. leche 2. cerveza 3. aceptada 4. yerba 5. cafe 6. pañales 7. queso 8. arroz 9. fideos 10. fernet",,,,,,"{""Descripción"": [""Datos técnicos"", ""Descripción del producto"", ""¡Suscribite a nuestro newsletter!"", ""Recibí las ofertas y novedades en tu correo."", ""Suscribirme"", ""Seguridad y confianza"", ""© Libertad 2023. Todos los derechos reservados."", ""Términos y Condiciones"", ""Dirección General de Defensa y Protección al Consumidor para consultas y/o denuncias"", ""introduzca aquí"", ""Términos más buscados"", ""1."", ""leche"", ""2."", ""cerveza"", ""3."", ""aceite"", ""4."", ""yerba"", ""5."", ""cafe"", ""6."", ""pañales"", ""7."", ""queso"", ""8."", ""arroz"", ""9."", ""fideos"", ""10."", ""fernet""]}",dataset/txt_limpios/589.txt,dataset/paginas_descargadas/589.html,ET,cafe,keep,0.60,heuristic_default
590,DALE VIDA A TU JARDIN,"Datos técnicos Descripción del producto ¡Suscribite a nuestro boletín! Recibí las ofertas y novedades en tu correo. Suscribirme Seguridad y confianza © Libertad 2023. Todos los derechos reservados. Términos y Condiciones Direcciôn General de Defensa y protecciôn al Consumidor, para consultas y/o denuncias ingresa a los Términos más buscados 1. leche 2. cerveza 3. aceptada 4. yerba 5. cafe 6. pañales 7. queso 8. arroz 9. fideos 10. fernet",🌷🌻​🌼​,718.18,ARS,,Desconocido,unknown,AR,DALE VIDA A TU JARDIN,🌷🌻​🌼​,,,718.18,ARS,$,"$718,18",718.18,False,original,0.5723,0.5723,1255.0,from_argentina_cambio_dolar,,"Datos técnicos Descripción del producto ¡Suscribite a nuestro boletín! Recibí las ofertas y novedades en tu correo. Suscribirme Seguridad y confianza © Libertad 2023. Todos los derechos reservados. Términos y Condiciones Direcciôn General de Defensa y protecciôn al Consumidor, para consultas y/o denuncias ingresa a los Términos más buscados 1. leche 2. cerveza 3. aceptada 4. yerba 5. cafe 6. pañales 7. queso 8. arroz 9. fideos 10. fernet",,,,,,"{""Descripción"": [""Datos técnicos"", ""Descripción del producto"", ""¡Suscribite a nuestro newsletter!"", ""Recibí las ofertas y novedades en tu correo."", ""Suscribirme"", ""Seguridad y confianza"", ""© Libertad 2023. Todos los derechos reservados."", ""Términos y Condiciones"", ""Dirección General de Defensa y Protección al Consumidor para consultas y/o denuncias"", ""introduzca aquí"", ""Términos más buscados"", ""1."", ""leche"", ""2."", ""cerveza"", ""3."", ""aceite"", ""4."", ""yerba"", ""5."", ""cafe"", ""6."", ""pañales"", ""7."", ""queso"", ""8."", ""arroz"", ""9."", ""fideos"", ""10."", ""fernet""]}",dataset/txt_limpios/590.txt,dataset/paginas_descargadas/590.html,ET,cafe,keep,0.60,heuristic_default
591,DALE VIDA A TU JARDIN,"Datos técnicos Descripción del producto ¡Suscribite a nuestro boletín! Recibí las ofertas y novedades en tu correo. Suscribirme Seguridad y confianza © Libertad 2023. Todos los derechos reservados. Términos y Condiciones Direcciôn General de Defensa y protecciôn al Consumidor, para consultas y/o denuncias ingresa a los Términos más buscados 1. leche 2. cerveza 3. aceptada 4. yerba 5. cafe 6. pañales 7. queso 8. arroz 9. fideos 10. fernet",🌷🌻​🌼​,990.91,ARS,,Desconocido,unknown,AR,DALE VIDA A TU JARDIN,🌷🌻​🌼​,,,990.91,ARS,$,"$990,91",990.91,False,original,0.7896,0.7896,1255.0,from_argentina_cambio_dolar,,"Datos técnicos Descripción del producto ¡Suscribite a nuestro boletín! Recibí las ofertas y novedades en tu correo. Suscribirme Seguridad y confianza © Libertad 2023. Todos los derechos reservados. Términos y Condiciones Direcciôn General de Defensa y protecciôn al Consumidor, para consultas y/o denuncias ingresa a los Términos más buscados 1. leche 2. cerveza 3. aceptada 4. yerba 5. cafe 6. pañales 7. queso 8. arroz 9. fideos 10. fernet",,,,,,"{""Descripción"": [""Datos técnicos"", ""Descripción del producto"", ""¡Suscribite a nuestro newsletter!"", ""Recibí las ofertas y novedades en tu correo."", ""Suscribirme"", ""Seguridad y confianza"", ""© Libertad 2023. Todos los derechos reservados."", ""Términos y Condiciones"", ""Dirección General de Defensa y Protección al Consumidor para consultas y/o denuncias"", ""introduzca aquí"", ""Términos más buscados"", ""1."", ""leche"", ""2."", ""cerveza"", ""3."", ""aceite"", ""4."", ""yerba"", ""5."", ""cafe"", ""6."", ""pañales"", ""7."", ""queso"", ""8."", ""arroz"", ""9."", ""fideos"", ""10."", ""fernet""]}",dataset/txt_limpios/591.txt,dataset/paginas_descargadas/591.html,ET,cafe,keep,0.60,heuristic_default
592,DALE VIDA A TU JARDIN,"Datos técnicos Descripción del producto ¡Suscribite a nuestro boletín! Recibí las ofertas y novedades en tu correo. Suscribirme Seguridad y confianza © Libertad 2023. Todos los derechos reservados. Términos y Condiciones Direcciôn General de Defensa y protecciôn al Consumidor, para consultas y/o denuncias ingresa a los Términos más buscados 1. leche 2. cerveza 3. aceptada 4. yerba 5. cafe 6. pañales 7. queso 8. arroz 9. fideos 10. fernet",🌷🌻​🌼​,726.45,ARS,,Desconocido,unknown,AR,DALE VIDA A TU JARDIN,🌷🌻​🌼​,,,726.45,ARS,$,"$726,45",726.45,False,original,0.5788,0.5788,1255.0,from_argentina_cambio_dolar,,"Datos técnicos Descripción del producto ¡Suscribite a nuestro boletín! Recibí las ofertas y novedades en tu correo. Suscribirme Seguridad y confianza © Libertad 2023. Todos los derechos reservados. Términos y Condiciones Direcciôn General de Defensa y protecciôn al Consumidor, para consultas y/o denuncias ingresa a los Términos más buscados 1. leche 2. cerveza 3. aceptada 4. yerba 5. cafe 6. pañales 7. queso 8. arroz 9. fideos 10. fernet",,,,,,"{""Descripción"": [""Datos técnicos"", ""Descripción del producto"", ""¡Suscribite a nuestro newsletter!"", ""Recibí las ofertas y novedades en tu correo."", ""Suscribirme"", ""Seguridad y confianza"", ""© Libertad 2023. Todos los derechos reservados."", ""Términos y Condiciones"", ""Dirección General de Defensa y Protección al Consumidor para consultas y/o denuncias"", ""introduzca aquí"", ""Términos más buscados"", ""1."", ""leche"", ""2."", ""cerveza"", ""3."", ""aceite"", ""4."", ""yerba"", ""5."", ""cafe"", ""6."", ""pañales"", ""7."", ""queso"", ""8."", ""arroz"", ""9."", ""fideos"", ""10."", ""fernet""]}",dataset/txt_limpios/592.txt,dataset/paginas_descargadas/592.html,ET,cafe,keep,0.60,heuristic_default
593,DALE VIDA A TU JARDIN,"Datos técnicos Descripción del producto ¡Suscribite a nuestro boletín! Recibí las ofertas y novedades en tu correo. Suscribirme Seguridad y confianza © Libertad 2023. Todos los derechos reservados. Términos y Condiciones Direcciôn General de Defensa y protecciôn al Consumidor, para consultas y/o denuncias ingresa a los Términos más buscados 1. leche 2. cerveza 3. aceptada 4. yerba 5. cafe 6. pañales 7. queso 8. arroz 9. fideos 10. fernet",🌷🌻​🌼​ > 500G,742.98,ARS,,Desconocido,unknown,AR,DALE VIDA A TU JARDIN,🌷🌻​🌼​,,500G,742.98,ARS,$,"$742,98",742.98,False,original,0.592,0.592,1255.0,from_argentina_cambio_dolar,,"Datos técnicos Descripción del producto ¡Suscribite a nuestro boletín! Recibí las ofertas y novedades en tu correo. Suscribirme Seguridad y confianza © Libertad 2023. Todos los derechos reservados. Términos y Condiciones Direcciôn General de Defensa y protecciôn al Consumidor, para consultas y/o denuncias ingresa a los Términos más buscados 1. leche 2. cerveza 3. aceptada 4. yerba 5. cafe 6. pañales 7. queso 8. arroz 9. fideos 10. fernet",,,,,,"{""Descripción"": [""Datos técnicos"", ""Descripción del producto"", ""¡Suscribite a nuestro newsletter!"", ""Recibí las ofertas y novedades en tu correo."", ""Suscribirme"", ""Seguridad y confianza"", ""© Libertad 2023. Todos los derechos reservados."", ""Términos y Condiciones"", ""Dirección General de Defensa y Protección al Consumidor para consultas y/o denuncias"", ""introduzca aquí"", ""Términos más buscados"", ""1."", ""leche"", ""2."", ""cerveza"", ""3."", ""aceite"", ""4."", ""yerba"", ""5."", ""cafe"", ""6."", ""pañales"", ""7."", ""queso"", ""8."", ""arroz"", ""9."", ""fideos"", ""10."", ""fernet""]}",dataset/txt_limpios/593.txt,dataset/paginas_descargadas/593.html,ET,cafe,keep,0.60,heuristic_default
594,DALE VIDA A TU JARDIN,"Datos técnicos Descripción del producto ¡Suscribite a nuestro boletín! Recibí las ofertas y novedades en tu correo. Suscribirme Seguridad y confianza © Libertad 2023. Todos los derechos reservados. Términos y Condiciones Direcciôn General de Defensa y protecciôn al Consumidor, para consultas y/o denuncias ingresa a los Términos más buscados 1. leche 2. cerveza 3. aceptada 4. yerba 5. cafe 6. pañales 7. queso 8. arroz 9. fideos 10. fernet",🌷🌻​🌼​ > 500 GR,1404.13,ARS,,Desconocido,unknown,AR,DALE VIDA A TU JARDIN,🌷🌻​🌼​,,500 GR,1404.13,ARS,$,"$1.404,13",1404.13,False,original,1.1188,1.1188,1255.0,from_argentina_cambio_dolar,,"Datos técnicos Descripción del producto ¡Suscribite a nuestro boletín! Recibí las ofertas y novedades en tu correo. Suscribirme Seguridad y confianza © Libertad 2023. Todos los derechos reservados. Términos y Condiciones Direcciôn General de Defensa y protecciôn al Consumidor, para consultas y/o denuncias ingresa a los Términos más buscados 1. leche 2. cerveza 3. aceptada 4. yerba 5. cafe 6. pañales 7. queso 8. arroz 9. fideos 10. fernet",,,,,,"{""Descripción"": [""Datos técnicos"", ""Descripción del producto"", ""¡Suscribite a nuestro newsletter!"", ""Recibí las ofertas y novedades en tu correo."", ""Suscribirme"", ""Seguridad y confianza"", ""© Libertad 2023. Todos los derechos reservados."", ""Términos y Condiciones"", ""Dirección General de Defensa y Protección al Consumidor para consultas y/o denuncias"", ""introduzca aquí"", ""Términos más buscados"", ""1."", ""leche"", ""2."", ""cerveza"", ""3."", ""aceite"", ""4."", ""yerba"", ""5."", ""cafe"", ""6."", ""pañales"", ""7."", ""queso"", ""8."", ""arroz"", ""9."", ""fideos"", ""10."", ""fernet""]}",dataset/txt_limpios/594.txt,dataset/paginas_descargadas/594.html,ET,cafe,keep,0.60,heuristic_default
595,DALE VIDA A TU JARDIN,"Datos técnicos Descripción del producto ¡Suscribite a nuestro boletín! Recibí las ofertas y novedades en tu correo. Suscribirme Seguridad y confianza © Libertad 2023. Todos los derechos reservados. Términos y Condiciones Direcciôn General de Defensa y protecciôn al Consumidor, para consultas y/o denuncias ingresa a los Términos más buscados 1. leche 2. cerveza 3. aceptada 4. yerba 5. cafe 6. pañales 7. queso 8. arroz 9. fideos 10. fernet",🌷🌻​🌼​ > 500G,926.45,ARS,,Desconocido,unknown,AR,DALE VIDA A TU JARDIN,🌷🌻​🌼​,,500G,926.45,ARS,$,"$926,45",926.45,False,original,0.7382,0.7382,1255.0,from_argentina_cambio_dolar,,"Datos técnicos Descripción del producto ¡Suscribite a nuestro boletín! Recibí las ofertas y novedades en tu correo. Suscribirme Seguridad y confianza © Libertad 2023. Todos los derechos reservados. Términos y Condiciones Direcciôn General de Defensa y protecciôn al Consumidor, para consultas y/o denuncias ingresa a los Términos más buscados 1. leche 2. cerveza 3. aceptada 4. yerba 5. cafe 6. pañales 7. queso 8. arroz 9. fideos 10. fernet",,,,,,"{""Descripción"": [""Datos técnicos"", ""Descripción del producto"", ""¡Suscribite a nuestro newsletter!"", ""Recibí las ofertas y novedades en tu correo."", ""Suscribirme"", ""Seguridad y confianza"", ""© Libertad 2023. Todos los derechos reservados."", ""Términos y Condiciones"", ""Dirección General de Defensa y Protección al Consumidor para consultas y/o denuncias"", ""introduzca aquí"", ""Términos más buscados"", ""1."", ""leche"", ""2."", ""cerveza"", ""3."", ""aceite"", ""4."", ""yerba"", ""5."", ""cafe"", ""6."", ""pañales"", ""7."", ""queso"", ""8."", ""arroz"", ""9."", ""fideos"", ""10."", ""fernet""]}",dataset/txt_limpios/595.txt,dataset/paginas_descargadas/595.html,ET,cafe,keep,0.60,heuristic_default
596,DALE VIDA A TU JARDIN,,🌷🌻​🌼​,,ARS,,Desconocido,unknown,AR,DALE VIDA A TU JARDIN,🌷🌻​🌼​,,,,ARS,,,1663.58,True,country_mean,,1.3256,1255.0,from_argentina_cambio_dolar,,,,,,,,{},dataset/txt_limpios/596.txt,dataset/paginas_descargadas/596.html,EN,sin_categoria,discard,0.30,no_category_detected;price_parse_failed
597,DALE VIDA A TU JARDIN,"Datos técnicos Descripción del producto ¡Suscribite a nuestro boletín! Recibí las ofertas y novedades en tu correo. Suscribirme Seguridad y confianza © Libertad 2023. Todos los derechos reservados. Términos y Condiciones Direcciôn General de Defensa y protecciôn al Consumidor, para consultas y/o denuncias ingresa a los Términos más buscados 1. leche 2. cerveza 3. aceptada 4. yerba 5. cafe 6. pañales 7. queso 8. arroz 9. fideos 10. fernet",🌷🌻​🌼​ > 500G,2536.36,ARS,,Desconocido,unknown,AR,DALE VIDA A TU JARDIN,🌷🌻​🌼​,,500G,2536.36,ARS,$,"$2.536,36",2536.36,False,original,2.021,2.021,1255.0,from_argentina_cambio_dolar,,"Datos técnicos Descripción del producto ¡Suscribite a nuestro boletín! Recibí las ofertas y novedades en tu correo. Suscribirme Seguridad y confianza © Libertad 2023. Todos los derechos reservados. Términos y Condiciones Direcciôn General de Defensa y protecciôn al Consumidor, para consultas y/o denuncias ingresa a los Términos más buscados 1. leche 2. cerveza 3. aceptada 4. yerba 5. cafe 6. pañales 7. queso 8. arroz 9. fideos 10. fernet",,,,,,"{""Descripción"": [""Datos técnicos"", ""Descripción del producto"", ""¡Suscribite a nuestro newsletter!"", ""Recibí las ofertas y novedades en tu correo."", ""Suscribirme"", ""Seguridad y confianza"", ""© Libertad 2023. Todos los derechos reservados."", ""Términos y Condiciones"", ""Dirección General de Defensa y Protección al Consumidor para consultas y/o denuncias"", ""introduzca aquí"", ""Términos más buscados"", ""1."", ""leche"", ""2."", ""cerveza"", ""3."", ""aceite"", ""4."", ""yerba"", ""5."", ""cafe"", ""6."", ""pañales"", ""7."", ""queso"", ""8."", ""arroz"", ""9."", ""fideos"", ""10."", ""fernet""]}",dataset/txt_limpios/597.txt,dataset/paginas_descargadas/597.html,ET,cafe,keep,0.60,heuristic_default
598,DALE VIDA A TU JARDIN,"Datos técnicos Descripción del producto ¡Suscribite a nuestro boletín! Recibí las ofertas y novedades en tu correo. Suscribirme Seguridad y confianza © Libertad 2023. Todos los derechos reservados. Términos y Condiciones Direcciôn General de Defensa y protecciôn al Consumidor, para consultas y/o denuncias ingresa a los Términos más buscados 1. leche 2. cerveza 3. aceptada 4. yerba 5. cafe 6. pañales 7. queso 8. arroz 9. fideos 10. fernet","🌷🌻​🌼​ > 2,5KG",8316.74,ARS,,Desconocido,unknown,AR,DALE VIDA A TU JARDIN,🌷🌻​🌼​,,"2,5KG",8316.74,ARS,$,"$8.316,74",8316.74,False,original,6.6269,6.6269,1255.0,from_argentina_cambio_dolar,,"Datos técnicos Descripción del producto ¡Suscribite a nuestro boletín! Recibí las ofertas y novedades en tu correo. Suscribirme Seguridad y confianza © Libertad 2023. Todos los derechos reservados. Términos y Condiciones Direcciôn General de Defensa y protecciôn al Consumidor, para consultas y/o denuncias ingresa a los Términos más buscados 1. leche 2. cerveza 3. aceptada 4. yerba 5. cafe 6. pañales 7. queso 8. arroz 9. fideos 10. fernet",,,,,,"{""Descripción"": [""Datos técnicos"", ""Descripción del producto"", ""¡Suscribite a nuestro newsletter!"", ""Recibí las ofertas y novedades en tu correo."", ""Suscribirme"", ""Seguridad y confianza"", ""© Libertad 2023. Todos los derechos reservados."", ""Términos y Condiciones"", ""Dirección General de Defensa y Protección al Consumidor para consultas y/o denuncias"", ""introduzca aquí"", ""Términos más buscados"", ""1."", ""leche"", ""2."", ""cerveza"", ""3."", ""aceite"", ""4."", ""yerba"", ""5."", ""cafe"", ""6."", ""pañales"", ""7."", ""queso"", ""8."", ""arroz"", ""9."", ""fideos"", ""10."", ""fernet""]}",dataset/txt_limpios/598.txt,dataset/paginas_descargadas/598.html,ET,cafe,keep,0.60,heuristic_default
