source_id,title,description,breadcrumbs,price_raw,currency_raw,url,seller,availability,country,product_name,brand,reference,unit,price_amount,price_currency,price_symbol,price_text,price_amount_filled,price_is_imputed,price_imputation_source,price_amount_usd,price_amount_usd_filled,fx_rate_local_per_usd,fx_source,information_text,description_text,features_text,specifications_text,benefits_text,details_text,other_sections,sections,txt_path,html_path,es_status,category_canonical,decision,match_score,reasons
1068,¡Aún no eres Wong Prime!,Información Nutricional Comentarios | Especificaciones técnicas | Propiedad | Especificación | Ingredientes | Aceite 100% vegetal de soya | Ver condiciones de promociones | Podrían interesarte | Aceite Oleico de Carmano 380g | 41 | 40 | true | Aceite Oleico de Carmano 946ml | 42 | 90 | 12% | Aceite Vegetal Cuisine & Co 900ml | 7 | 50 | Aceite De Cartamo Oléico Botella 710 ml | 33 | 60 | Aceite De Cartamo Oléico Spray 170 g | 24 | ? | ! | i | × | Sí Acepto | Recuerda escribir al menos 3 letras en el cuadro de búsqueda | Términos más buscados | 1. | elvive liso | 2. | ariel liquido | 3. | limpiador inodoro harpic | 4. | busca | 5. | secret clinical | Marcas sugeridas,Aprovecha el > 1.8L > 929686,79.9,PEN,,Desconocido,unknown,PE,¡Aún no eres Wong Prime!,Aprovecha el,929686.0,1.8L,79.90,PEN,S/,S/79.90,79.9,False,original,22.507,22.507,3.55,from_peru_cambio_dolar,,Información Nutricional,,Comentarios | Especificaciones técnicas | Propiedad | Especificación | Ingredientes | Aceite 100% vegetal de soya | Ver condiciones de promociones | Podrían interesarte | Aceite Oleico de Carmano 380g | 41 | 40 | true | Aceite Oleico de Carmano 946ml | 42 | 90 | 12% | Aceite Vegetal Cuisine & Co 900ml | 7 | 50 | Aceite De Cartamo Oléico Botella 710 ml | 33 | 60 | Aceite De Cartamo Oléico Spray 170 g | 24 | ? | ! | i | × | Sí Acepto | Recuerda escribir al menos 3 letras en el cuadro de búsqueda | Términos más buscados | 1. | elvive liso | 2. | ariel liquido | 3. | limpiador inodoro harpic | 4. | busca | 5. | secret clinical | Marcas sugeridas,,,,"{""Descripción"": [""Información Nutricional""], ""Especificaciones"": [""Comentarios"", ""Especificaciones técnicas"", ""Propiedad"", ""Especificación"", ""Ingredientes"", ""Aceite 100% vegetal de soya"", ""Ver condiciones de promociones"", ""Podrían interesarte"", ""Aceite Oleico de Carmano 380g"", ""41"", ""40"", ""true"", ""Aceite Oleico de Carmano 946ml"", ""42"", ""90"", ""12%"", ""Aceite Vegetal Cuisine & Co 900ml"", ""7"", ""50"", ""Aceite De Cartamo Oléico Botella 710 ml"", ""33"", ""60"", ""Aceite De Cartamo Oléico Spray 170 g"", ""24"", ""?"", ""!"", ""i"", ""×"", ""Sí Acepto"", ""Recuerda escribir al menos 3 letras en el cuadro de búsqueda"", ""Términos más buscados"", ""1."", ""elvive liso"", ""2."", ""ariel liquido"", ""3."", ""limpiador inodoro harpic"", ""4."", ""busca"", ""5."", ""secret clinical"", ""Marcas sugeridas""]}",dataset/txt_limpios/1068.txt,dataset/paginas_descargadas/1068.html,EN,aceite vegetal,keep,0.60,heuristic_default
1069,¡Aún no eres Wong Prime!,Información Nutricional Comentarios | Especificaciones técnicas | Propiedad | Especificación | Ingredientes | Aceite de oliva virgen extra | Ver condiciones de promociones | ? | ! | i | × | Sí Acepto | Recuerda escribir al menos 3 letras en el cuadro de búsqueda | Términos más buscados | 1. | elvive liso | 2. | ariel liquido | 3. | limpiador inodoro harpic | 4. | busca | 5. | secret clinical | Marcas sugeridas,Aprovecha el > 1 Litro > 701283,79.9,PEN,,Desconocido,unknown,PE,¡Aún no eres Wong Prime!,Aprovecha el,701283.0,1 Litro,79.90,PEN,S/,S/79.90,79.9,False,original,22.507,22.507,3.55,from_peru_cambio_dolar,,Información Nutricional,,Comentarios | Especificaciones técnicas | Propiedad | Especificación | Ingredientes | Aceite de oliva virgen extra | Ver condiciones de promociones | ? | ! | i | × | Sí Acepto | Recuerda escribir al menos 3 letras en el cuadro de búsqueda | Términos más buscados | 1. | elvive liso | 2. | ariel liquido | 3. | limpiador inodoro harpic | 4. | busca | 5. | secret clinical | Marcas sugeridas,,,,"{""Descripción"": [""Información Nutricional""], ""Especificaciones"": [""Comentarios"", ""Especificaciones técnicas"", ""Propiedad"", ""Especificación"", ""Ingredientes"", ""Aceite de oliva virgen extra"", ""Ver condiciones de promociones"", ""?"", ""!"", ""i"", ""×"", ""Sí Acepto"", ""Recuerda escribir al menos 3 letras en el cuadro de búsqueda"", ""Términos más buscados"", ""1."", ""elvive liso"", ""2."", ""ariel liquido"", ""3."", ""limpiador inodoro harpic"", ""4."", ""busca"", ""5."", ""secret clinical"", ""Marcas sugeridas""]}",dataset/txt_limpios/1069.txt,dataset/paginas_descargadas/1069.html,EN,sin_categoria,discard,0.30,no_category_detected
