source_id,title,description,breadcrumbs,price_raw,currency_raw,url,seller,availability,country,product_name,brand,reference,unit,price_amount,price_currency,price_symbol,price_text,price_amount_filled,price_is_imputed,price_imputation_source,price_amount_usd,price_amount_usd_filled,fx_rate_local_per_usd,fx_source,information_text,description_text,features_text,specifications_text,benefits_text,details_text,other_sections,sections,txt_path,html_path,es_status,category_canonical,decision,match_score,reasons
129,¡Lo mejor te está esperando!,"Ideal para endulzar todo tipo de alimentos y bebidas. Al consumirse con moderación, es la opción natural de mejor sabor.La extracción del jugo de caña es por métodos físicos, lo que permite que conserve todos sus nutrientes. | ... Ver más | Favoritos | Recomendados | Azucar Organica   Aires De Campo 1 K... | 1 KG | Bebida Organica Almendra  Sin Azucar... | 1 LT | -22% | Bebida Organica Uht De Avena Sin Azu... | Bebida De Coco Organica Sin Gluten  ... | 300 GR | Bebida Organica De Coco Uht Sin Azuc... | Matcha Organica    Okko  60 G | 60 GR | Edulcorante Liquido Stevia Y Sucralo... | 180 ML | Pure Organico  Manzana & Ciruela   M... | 100 GR | Papilla Organica Manzana Camote Zana... | 90 GR | Papilla Organica Pera Mango  Smiley ... | Papilla Gerber Orgánico Pouch Etapa ... | Papilla Organica Pera Platano Mango ... | Crema De Avellana Sin Azucar   Nucol... | 350 GR | Pure Organico Manzana Platano & C  M... | Pure Organico Pera Kiwi & Espinac  M... | Papilla Organica Manzana Platano Ara... | Papilla Organica Manzana Pera Canela... | Alimento Para Lactantes Gerber Orgá¡... | Papilla Organica Manzana Ciruela  Sm... | Jugo Deshidratado Limon  Natures Fac... | Papilla Organica Manzana Arandano  S... | Papilla Organica Pera Platano  Smile... | Pulpa De Tamarindo Deshidratada  Nat... | 210 GR | Crema De Almendra Sin Azucar   Moram... | 200 GR | Cocoa Organica   Aires De Campo 150 ... | 150 GR | Pure Organico Manzana & Mora Azul  M... | Jarabe De Maple Grado A Organica  Ca... | 250 ML | Untable De Semilla De Girasol  Once ... | 340 GR | Calm Gomitas De Magnesio  Naranja Na... | 120 PZ | Mes patrio Herdez | Ver más | Adobo    Doña María 235 G | Mole Doña María Almendrado En Pasta ... | Mole Doña María Almendrado Listo Par... | Mole Doña María Poblano Con Cacao En... | Mole Doña Maria Poblano Con Cacao Li... | Mole Doña Mariía Rojo En Pasta   125... | Mole En Pasta 430 Gramos   Doña Mari... | Mole Listo Para Servir  Para Servir ... | Mole Rojo En Pasta  Doña Maria 235 G | Mole Verde En Pasta  Doña Maria 230 ... | Pipián En Pasta  Doña Maria 230 G | Salsa Cacahuate Picante Cremosa   He... | Salsa Casera Con Habanero   Herdez 4... | Salsa Casera  Herdez 210 G | Salsa Guacamole 15% Mas Guacamole He...",Descarga la app > 1 Kg,112.9,,,Desconocido,unknown,UNKNOWN,¡Lo mejor te está esperando!,Descarga la app,,1 Kg,112.90,,$,$112.90,112.9,False,original,112.9,112.9,1.0,default_1usd,,,,,,"Ideal para endulzar todo tipo de alimentos y bebidas. Al consumirse con moderación, es la opción natural de mejor sabor.La extracción del jugo de caña es por métodos físicos, lo que permite que conserve todos sus nutrientes. | ... Ver más | Favoritos | Recomendados | Azucar Organica   Aires De Campo 1 K... | 1 KG | Bebida Organica Almendra  Sin Azucar... | 1 LT | -22% | Bebida Organica Uht De Avena Sin Azu... | Bebida De Coco Organica Sin Gluten  ... | 300 GR | Bebida Organica De Coco Uht Sin Azuc... | Matcha Organica    Okko  60 G | 60 GR | Edulcorante Liquido Stevia Y Sucralo... | 180 ML | Pure Organico  Manzana & Ciruela   M... | 100 GR | Papilla Organica Manzana Camote Zana... | 90 GR | Papilla Organica Pera Mango  Smiley ... | Papilla Gerber Orgánico Pouch Etapa ... | Papilla Organica Pera Platano Mango ... | Crema De Avellana Sin Azucar   Nucol... | 350 GR | Pure Organico Manzana Platano & C  M... | Pure Organico Pera Kiwi & Espinac  M... | Papilla Organica Manzana Platano Ara... | Papilla Organica Manzana Pera Canela... | Alimento Para Lactantes Gerber Orgá¡... | Papilla Organica Manzana Ciruela  Sm... | Jugo Deshidratado Limon  Natures Fac... | Papilla Organica Manzana Arandano  S... | Papilla Organica Pera Platano  Smile... | Pulpa De Tamarindo Deshidratada  Nat... | 210 GR | Crema De Almendra Sin Azucar   Moram... | 200 GR | Cocoa Organica   Aires De Campo 150 ... | 150 GR | Pure Organico Manzana & Mora Azul  M... | Jarabe De Maple Grado A Organica  Ca... | 250 ML | Untable De Semilla De Girasol  Once ... | 340 GR | Calm Gomitas De Magnesio  Naranja Na... | 120 PZ | Mes patrio Herdez | Ver más | Adobo    Doña María 235 G | Mole Doña María Almendrado En Pasta ... | Mole Doña María Almendrado Listo Par... | Mole Doña María Poblano Con Cacao En... | Mole Doña Maria Poblano Con Cacao Li... | Mole Doña Mariía Rojo En Pasta   125... | Mole En Pasta 430 Gramos   Doña Mari... | Mole Listo Para Servir  Para Servir ... | Mole Rojo En Pasta  Doña Maria 235 G | Mole Verde En Pasta  Doña Maria 230 ... | Pipián En Pasta  Doña Maria 230 G | Salsa Cacahuate Picante Cremosa   He... | Salsa Casera Con Habanero   Herdez 4... | Salsa Casera  Herdez 210 G | Salsa Guacamole 15% Mas Guacamole He...",,"{""Detalles"": [""Ideal para endulzar todo tipo de alimentos y bebidas. Al consumirse con moderación, es la opción natural de mejor sabor.La extracción del jugo de caña es por métodos físicos, lo que permite que conserve todos sus nutrientes."", ""... Ver más"", ""Favoritos"", ""Recomendados"", ""Azucar Organica   Aires De Campo 1 K..."", ""1 KG"", ""Bebida Organica Almendra  Sin Azucar..."", ""1 LT"", ""-22%"", ""Bebida Organica Uht De Avena Sin Azu..."", ""Bebida De Coco Organica Sin Gluten  ..."", ""300 GR"", ""Bebida Organica De Coco Uht Sin Azuc..."", ""Matcha Organica    Okko  60 G"", ""60 GR"", ""Edulcorante Liquido Stevia Y Sucralo..."", ""180 ML"", ""Pure Organico  Manzana & Ciruela   M..."", ""100 GR"", ""Papilla Organica Manzana Camote Zana..."", ""90 GR"", ""Papilla Organica Pera Mango  Smiley ..."", ""Papilla Gerber Orgánico Pouch Etapa ..."", ""Papilla Organica Pera Platano Mango ..."", ""Crema De Avellana Sin Azucar   Nucol..."", ""350 GR"", ""Pure Organico Manzana Platano & C  M..."", ""Pure Organico Pera Kiwi & Espinac  M..."", ""Papilla Organica Manzana Platano Ara..."", ""Papilla Organica Manzana Pera Canela..."", ""Alimento Para Lactantes Gerber Orgá¡..."", ""Papilla Organica Manzana Ciruela  Sm..."", ""Jugo Deshidratado Limon  Natures Fac..."", ""Papilla Organica Manzana Arandano  S..."", ""Papilla Organica Pera Platano  Smile..."", ""Pulpa De Tamarindo Deshidratada  Nat..."", ""210 GR"", ""Crema De Almendra Sin Azucar   Moram..."", ""200 GR"", ""Cocoa Organica   Aires De Campo 150 ..."", ""150 GR"", ""Pure Organico Manzana & Mora Azul  M..."", ""Jarabe De Maple Grado A Organica  Ca..."", ""250 ML"", ""Untable De Semilla De Girasol  Once ..."", ""340 GR"", ""Calm Gomitas De Magnesio  Naranja Na..."", ""120 PZ"", ""Mes patrio Herdez"", ""Ver más"", ""Adobo    Doña María 235 G"", ""Mole Doña María Almendrado En Pasta ..."", ""Mole Doña María Almendrado Listo Par..."", ""Mole Doña María Poblano Con Cacao En..."", ""Mole Doña Maria Poblano Con Cacao Li..."", ""Mole Doña Mariía Rojo En Pasta   125..."", ""Mole En Pasta 430 Gramos   Doña Mari..."", ""Mole Listo Para Servir  Para Servir ..."", ""Mole Rojo En Pasta  Doña Maria 235 G"", ""Mole Verde En Pasta  Doña Maria 230 ..."", ""Pipián En Pasta  Doña Maria 230 G"", ""Salsa Cacahuate Picante Cremosa   He..."", ""Salsa Casera Con Habanero   Herdez 4..."", ""Salsa Casera  Herdez 210 G"", ""Salsa Guacamole 15% Mas Guacamole He...""]}",dataset/txt_limpios/129.txt,dataset/paginas_descargadas/129.html,EN,azucar,keep,0.60,heuristic_default
131,¡Lo mejor te está esperando!,"El Café Soluble El Marino de 100 gramos es la elección perfecta para los amantes del buen café. Disfruta de su sabor intenso y aromático en cualquier momento del día. Este café de alta calidad se disuelve rápidamente, brindán | ... Ver más | Favoritos | Recomendados | Cafe Soluble Liofilizado Diamante  O... | 180 GR | Cafe Soluble Clãsico  Nescafe 300 G | 300 GR | Cafe Soluble Clasico  Nescafe 120 G | 120 GR | Cafe Soluble Dolca     170g | 170 GR | Cafe Soluble Clasico  Nescafe  60 G | 60 GR | Cafe Soluble Clasico Doypack Clasico... | 85 GR | Cafe Soluble Dolca     46gr | 46 GR | Cafe Soluble Decaf  Descafeinado  Ne... | 40 GR | Cafe Soluble Decaf Descafeinado  Nes... | Cafe Soluble Reserva Xiapan  Nescafe... | Cafe Soluble  Mezclado Con Azucar   ... | 100 GR | Cafe Soluble Gourmet  Garat 125 G | 125 GR | Cafe Soluble Nescaf Ice   Nescafe 17... | Cafe Soluble 24 Kilates  Oro 160 G | 160 GR | Cafe Soluble Gourmet Gold   Los Port... | AGOTADO | Cafe Soluble  Reserva Verarica  Nesc... | Cafe Soluble Dolca     80gr | 80 GR | Cafe Soluble Reserva Oahan  Nescafe ... | Cafe Soluble Decaf Sin Cafeina  Nesc... | Cafe Soluble De Olla  Nescafe 170 G | Cafe Soluble De Olla  Legal 180 G | Cafe Soluble Dolca   Nescafe  260 G | 260 GR | Cafe Soluble    El Marino  50 G | 50 GR | Cafe Soluble Gourmet Suave Blend  Ja... | 95 GR | Cafe Soluble 24 Kilates  Oro  75 G | 75 GR | Cafe Soluble Regular   Mybrand 205 G | 205 GR | 200 GR | Cafe Soluble Con Azucar  Legal 100 G | Cafe Soluble Gourmet Intenso Blend  ... | Mes patrio Herdez | Ver más | Adobo    Doña María 235 G | Mole Doña María Almendrado En Pasta ... | Mole Doña María Almendrado Listo Par... | Mole Doña María Poblano Con Cacao En... | Mole Doña Maria Poblano Con Cacao Li... | Mole Doña Mariía Rojo En Pasta   125... | Mole En Pasta 430 Gramos   Doña Mari... | Mole Listo Para Servir  Para Servir ... | Mole Rojo En Pasta  Doña Maria 235 G | Mole Verde En Pasta  Doña Maria 230 ... | Pipián En Pasta  Doña Maria 230 G | Salsa Cacahuate Picante Cremosa   He... | Salsa Casera Con Habanero   Herdez 4... | Salsa Casera  Herdez 210 G | Salsa Guacamole 15% Mas Guacamole He...",Descarga la app > 100 G,54.9,,,Desconocido,unknown,UNKNOWN,¡Lo mejor te está esperando!,Descarga la app,,100 G,54.90,,$,$54.90,54.9,False,original,54.9,54.9,1.0,default_1usd,,,,,,"El Café Soluble El Marino de 100 gramos es la elección perfecta para los amantes del buen café. Disfruta de su sabor intenso y aromático en cualquier momento del día. Este café de alta calidad se disuelve rápidamente, brindán | ... Ver más | Favoritos | Recomendados | Cafe Soluble Liofilizado Diamante  O... | 180 GR | Cafe Soluble Clãsico  Nescafe 300 G | 300 GR | Cafe Soluble Clasico  Nescafe 120 G | 120 GR | Cafe Soluble Dolca     170g | 170 GR | Cafe Soluble Clasico  Nescafe  60 G | 60 GR | Cafe Soluble Clasico Doypack Clasico... | 85 GR | Cafe Soluble Dolca     46gr | 46 GR | Cafe Soluble Decaf  Descafeinado  Ne... | 40 GR | Cafe Soluble Decaf Descafeinado  Nes... | Cafe Soluble Reserva Xiapan  Nescafe... | Cafe Soluble  Mezclado Con Azucar   ... | 100 GR | Cafe Soluble Gourmet  Garat 125 G | 125 GR | Cafe Soluble Nescaf Ice   Nescafe 17... | Cafe Soluble 24 Kilates  Oro 160 G | 160 GR | Cafe Soluble Gourmet Gold   Los Port... | AGOTADO | Cafe Soluble  Reserva Verarica  Nesc... | Cafe Soluble Dolca     80gr | 80 GR | Cafe Soluble Reserva Oahan  Nescafe ... | Cafe Soluble Decaf Sin Cafeina  Nesc... | Cafe Soluble De Olla  Nescafe 170 G | Cafe Soluble De Olla  Legal 180 G | Cafe Soluble Dolca   Nescafe  260 G | 260 GR | Cafe Soluble    El Marino  50 G | 50 GR | Cafe Soluble Gourmet Suave Blend  Ja... | 95 GR | Cafe Soluble 24 Kilates  Oro  75 G | 75 GR | Cafe Soluble Regular   Mybrand 205 G | 205 GR | 200 GR | Cafe Soluble Con Azucar  Legal 100 G | Cafe Soluble Gourmet Intenso Blend  ... | Mes patrio Herdez | Ver más | Adobo    Doña María 235 G | Mole Doña María Almendrado En Pasta ... | Mole Doña María Almendrado Listo Par... | Mole Doña María Poblano Con Cacao En... | Mole Doña Maria Poblano Con Cacao Li... | Mole Doña Mariía Rojo En Pasta   125... | Mole En Pasta 430 Gramos   Doña Mari... | Mole Listo Para Servir  Para Servir ... | Mole Rojo En Pasta  Doña Maria 235 G | Mole Verde En Pasta  Doña Maria 230 ... | Pipián En Pasta  Doña Maria 230 G | Salsa Cacahuate Picante Cremosa   He... | Salsa Casera Con Habanero   Herdez 4... | Salsa Casera  Herdez 210 G | Salsa Guacamole 15% Mas Guacamole He...",,"{""Detalles"": [""El Café Soluble El Marino de 100 gramos es la elección perfecta para los amantes del buen café. Disfruta de su sabor intenso y aromático en cualquier momento del día. Este café de alta calidad se disuelve rápidamente, brindán"", ""... Ver más"", ""Favoritos"", ""Recomendados"", ""Cafe Soluble Liofilizado Diamante  O..."", ""180 GR"", ""Cafe Soluble Clãsico  Nescafe 300 G"", ""300 GR"", ""Cafe Soluble Clasico  Nescafe 120 G"", ""120 GR"", ""Cafe Soluble Dolca     170g"", ""170 GR"", ""Cafe Soluble Clasico  Nescafe  60 G"", ""60 GR"", ""Cafe Soluble Clasico Doypack Clasico..."", ""85 GR"", ""Cafe Soluble Dolca     46gr"", ""46 GR"", ""Cafe Soluble Decaf  Descafeinado  Ne..."", ""40 GR"", ""Cafe Soluble Decaf Descafeinado  Nes..."", ""Cafe Soluble Reserva Xiapan  Nescafe..."", ""Cafe Soluble  Mezclado Con Azucar   ..."", ""100 GR"", ""Cafe Soluble Gourmet  Garat 125 G"", ""125 GR"", ""Cafe Soluble Nescaf Ice   Nescafe 17..."", ""Cafe Soluble 24 Kilates  Oro 160 G"", ""160 GR"", ""Cafe Soluble Gourmet Gold   Los Port..."", ""AGOTADO"", ""Cafe Soluble  Reserva Verarica  Nesc..."", ""Cafe Soluble Dolca     80gr"", ""80 GR"", ""Cafe Soluble Reserva Oahan  Nescafe ..."", ""Cafe Soluble Decaf Sin Cafeina  Nesc..."", ""Cafe Soluble De Olla  Nescafe 170 G"", ""Cafe Soluble De Olla  Legal 180 G"", ""Cafe Soluble Dolca   Nescafe  260 G"", ""260 GR"", ""Cafe Soluble    El Marino  50 G"", ""50 GR"", ""Cafe Soluble Gourmet Suave Blend  Ja..."", ""95 GR"", ""Cafe Soluble 24 Kilates  Oro  75 G"", ""75 GR"", ""Cafe Soluble Regular   Mybrand 205 G"", ""205 GR"", ""200 GR"", ""Cafe Soluble Con Azucar  Legal 100 G"", ""Cafe Soluble Gourmet Intenso Blend  ..."", ""Mes patrio Herdez"", ""Ver más"", ""Adobo    Doña María 235 G"", ""Mole Doña María Almendrado En Pasta ..."", ""Mole Doña María Almendrado Listo Par..."", ""Mole Doña María Poblano Con Cacao En..."", ""Mole Doña Maria Poblano Con Cacao Li..."", ""Mole Doña Mariía Rojo En Pasta   125..."", ""Mole En Pasta 430 Gramos   Doña Mari..."", ""Mole Listo Para Servir  Para Servir ..."", ""Mole Rojo En Pasta  Doña Maria 235 G"", ""Mole Verde En Pasta  Doña Maria 230 ..."", ""Pipián En Pasta  Doña Maria 230 G"", ""Salsa Cacahuate Picante Cremosa   He..."", ""Salsa Casera Con Habanero   Herdez 4..."", ""Salsa Casera  Herdez 210 G"", ""Salsa Guacamole 15% Mas Guacamole He...""]}",dataset/txt_limpios/131.txt,dataset/paginas_descargadas/131.html,EN,cafe,keep,0.60,heuristic_default
132,¡Lo mejor te está esperando!,"Descubre el exquisito sabor del Café Soluble Oro en su presentación de 100 gramos. Disfruta de un café instantáneo de alta calidad, con un sabor intenso y aroma irresistible. Perfecto para esos momentos de pausa y energía. ¡H | ... Ver más | Favoritos | Recomendados | Cafe Soluble Liofilizado Diamante  O... | 180 GR | Cafe Soluble Clãsico  Nescafe 300 G | 300 GR | Cafe Soluble Clasico  Nescafe 120 G | 120 GR | Cafe Soluble Dolca     170g | 170 GR | Cafe Soluble Clasico  Nescafe  60 G | 60 GR | Cafe Soluble Clasico Doypack Clasico... | 85 GR | Cafe Soluble Dolca     46gr | 46 GR | Cafe Soluble Decaf  Descafeinado  Ne... | 40 GR | Cafe Soluble Decaf Descafeinado  Nes... | Cafe Soluble Reserva Xiapan  Nescafe... | Cafe Soluble  Mezclado Con Azucar   ... | 100 GR | Cafe Soluble Gourmet  Garat 125 G | 125 GR | Cafe Soluble Nescaf Ice   Nescafe 17... | Cafe Soluble 24 Kilates  Oro 160 G | 160 GR | Cafe Soluble Gourmet Gold   Los Port... | AGOTADO | Cafe Soluble  Reserva Verarica  Nesc... | Cafe Soluble Dolca     80gr | 80 GR | Cafe Soluble Reserva Oahan  Nescafe ... | Cafe Soluble Decaf Sin Cafeina  Nesc... | Cafe Soluble De Olla  Nescafe 170 G | Cafe Soluble De Olla  Legal 180 G | Cafe Soluble Dolca   Nescafe  260 G | 260 GR | Cafe Soluble    El Marino  50 G | 50 GR | Cafe Soluble Gourmet Suave Blend  Ja... | 95 GR | Cafe Soluble 24 Kilates  Oro  75 G | 75 GR | Cafe Soluble Regular   Mybrand 205 G | 205 GR | 200 GR | Cafe Soluble Con Azucar  Legal 100 G | Cafe Soluble Gourmet Intenso Blend  ... | Mes patrio Herdez | Ver más | Adobo    Doña María 235 G | Mole Doña María Almendrado En Pasta ... | Mole Doña María Almendrado Listo Par... | Mole Doña María Poblano Con Cacao En... | Mole Doña Maria Poblano Con Cacao Li... | Mole Doña Mariía Rojo En Pasta   125... | Mole En Pasta 430 Gramos   Doña Mari... | Mole Listo Para Servir  Para Servir ... | Mole Rojo En Pasta  Doña Maria 235 G | Mole Verde En Pasta  Doña Maria 230 ... | Pipián En Pasta  Doña Maria 230 G | Salsa Cacahuate Picante Cremosa   He... | Salsa Casera Con Habanero   Herdez 4... | Salsa Casera  Herdez 210 G | Salsa Guacamole 15% Mas Guacamole He...",Descarga la app > 100 G,69.9,,,Desconocido,unknown,UNKNOWN,¡Lo mejor te está esperando!,Descarga la app,,100 G,69.90,,$,$69.90,69.9,False,original,69.9,69.9,1.0,default_1usd,,,,,,"Descubre el exquisito sabor del Café Soluble Oro en su presentación de 100 gramos. Disfruta de un café instantáneo de alta calidad, con un sabor intenso y aroma irresistible. Perfecto para esos momentos de pausa y energía. ¡H | ... Ver más | Favoritos | Recomendados | Cafe Soluble Liofilizado Diamante  O... | 180 GR | Cafe Soluble Clãsico  Nescafe 300 G | 300 GR | Cafe Soluble Clasico  Nescafe 120 G | 120 GR | Cafe Soluble Dolca     170g | 170 GR | Cafe Soluble Clasico  Nescafe  60 G | 60 GR | Cafe Soluble Clasico Doypack Clasico... | 85 GR | Cafe Soluble Dolca     46gr | 46 GR | Cafe Soluble Decaf  Descafeinado  Ne... | 40 GR | Cafe Soluble Decaf Descafeinado  Nes... | Cafe Soluble Reserva Xiapan  Nescafe... | Cafe Soluble  Mezclado Con Azucar   ... | 100 GR | Cafe Soluble Gourmet  Garat 125 G | 125 GR | Cafe Soluble Nescaf Ice   Nescafe 17... | Cafe Soluble 24 Kilates  Oro 160 G | 160 GR | Cafe Soluble Gourmet Gold   Los Port... | AGOTADO | Cafe Soluble  Reserva Verarica  Nesc... | Cafe Soluble Dolca     80gr | 80 GR | Cafe Soluble Reserva Oahan  Nescafe ... | Cafe Soluble Decaf Sin Cafeina  Nesc... | Cafe Soluble De Olla  Nescafe 170 G | Cafe Soluble De Olla  Legal 180 G | Cafe Soluble Dolca   Nescafe  260 G | 260 GR | Cafe Soluble    El Marino  50 G | 50 GR | Cafe Soluble Gourmet Suave Blend  Ja... | 95 GR | Cafe Soluble 24 Kilates  Oro  75 G | 75 GR | Cafe Soluble Regular   Mybrand 205 G | 205 GR | 200 GR | Cafe Soluble Con Azucar  Legal 100 G | Cafe Soluble Gourmet Intenso Blend  ... | Mes patrio Herdez | Ver más | Adobo    Doña María 235 G | Mole Doña María Almendrado En Pasta ... | Mole Doña María Almendrado Listo Par... | Mole Doña María Poblano Con Cacao En... | Mole Doña Maria Poblano Con Cacao Li... | Mole Doña Mariía Rojo En Pasta   125... | Mole En Pasta 430 Gramos   Doña Mari... | Mole Listo Para Servir  Para Servir ... | Mole Rojo En Pasta  Doña Maria 235 G | Mole Verde En Pasta  Doña Maria 230 ... | Pipián En Pasta  Doña Maria 230 G | Salsa Cacahuate Picante Cremosa   He... | Salsa Casera Con Habanero   Herdez 4... | Salsa Casera  Herdez 210 G | Salsa Guacamole 15% Mas Guacamole He...",,"{""Detalles"": [""Descubre el exquisito sabor del Café Soluble Oro en su presentación de 100 gramos. Disfruta de un café instantáneo de alta calidad, con un sabor intenso y aroma irresistible. Perfecto para esos momentos de pausa y energía. ¡H"", ""... Ver más"", ""Favoritos"", ""Recomendados"", ""Cafe Soluble Liofilizado Diamante  O..."", ""180 GR"", ""Cafe Soluble Clãsico  Nescafe 300 G"", ""300 GR"", ""Cafe Soluble Clasico  Nescafe 120 G"", ""120 GR"", ""Cafe Soluble Dolca     170g"", ""170 GR"", ""Cafe Soluble Clasico  Nescafe  60 G"", ""60 GR"", ""Cafe Soluble Clasico Doypack Clasico..."", ""85 GR"", ""Cafe Soluble Dolca     46gr"", ""46 GR"", ""Cafe Soluble Decaf  Descafeinado  Ne..."", ""40 GR"", ""Cafe Soluble Decaf Descafeinado  Nes..."", ""Cafe Soluble Reserva Xiapan  Nescafe..."", ""Cafe Soluble  Mezclado Con Azucar   ..."", ""100 GR"", ""Cafe Soluble Gourmet  Garat 125 G"", ""125 GR"", ""Cafe Soluble Nescaf Ice   Nescafe 17..."", ""Cafe Soluble 24 Kilates  Oro 160 G"", ""160 GR"", ""Cafe Soluble Gourmet Gold   Los Port..."", ""AGOTADO"", ""Cafe Soluble  Reserva Verarica  Nesc..."", ""Cafe Soluble Dolca     80gr"", ""80 GR"", ""Cafe Soluble Reserva Oahan  Nescafe ..."", ""Cafe Soluble Decaf Sin Cafeina  Nesc..."", ""Cafe Soluble De Olla  Nescafe 170 G"", ""Cafe Soluble De Olla  Legal 180 G"", ""Cafe Soluble Dolca   Nescafe  260 G"", ""260 GR"", ""Cafe Soluble    El Marino  50 G"", ""50 GR"", ""Cafe Soluble Gourmet Suave Blend  Ja..."", ""95 GR"", ""Cafe Soluble 24 Kilates  Oro  75 G"", ""75 GR"", ""Cafe Soluble Regular   Mybrand 205 G"", ""205 GR"", ""200 GR"", ""Cafe Soluble Con Azucar  Legal 100 G"", ""Cafe Soluble Gourmet Intenso Blend  ..."", ""Mes patrio Herdez"", ""Ver más"", ""Adobo    Doña María 235 G"", ""Mole Doña María Almendrado En Pasta ..."", ""Mole Doña María Almendrado Listo Par..."", ""Mole Doña María Poblano Con Cacao En..."", ""Mole Doña Maria Poblano Con Cacao Li..."", ""Mole Doña Mariía Rojo En Pasta   125..."", ""Mole En Pasta 430 Gramos   Doña Mari..."", ""Mole Listo Para Servir  Para Servir ..."", ""Mole Rojo En Pasta  Doña Maria 235 G"", ""Mole Verde En Pasta  Doña Maria 230 ..."", ""Pipián En Pasta  Doña Maria 230 G"", ""Salsa Cacahuate Picante Cremosa   He..."", ""Salsa Casera Con Habanero   Herdez 4..."", ""Salsa Casera  Herdez 210 G"", ""Salsa Guacamole 15% Mas Guacamole He...""]}",dataset/txt_limpios/132.txt,dataset/paginas_descargadas/132.html,EN,cafe,keep,0.60,heuristic_default
