{"source_id": "804", "title": "QUESITO ALPINA 185 G", "description": "Ingredientes | Componentes Descripción del producto: Disfruta del delicioso Quesito Alpina, un queso fresco, blando y semigraso, ideal para acompañar tus comidas o consumir directamente del envase. Tamaño: 11.5 cm x 4 cm Peso: 185 g Modo de fabricación: Industrial Origen: Nacional RSA-005113-2018 Alergenos: Puede contener leche Componentes: Leche Cultivos lácticos Sal Ver más También puede interesarte YOX SURTIDO FRESA Y MELOCOTÓN ALPINA 4 UND - 40... SIXPACK CHEESE STICK VITA LATTI 180GR TOMATE CHERRY 250 GR JAMÓN PIETRÁN ESTANDAR 230G", "breadcrumbs": "Unidades disponibles > 185 G", "price_raw": "185.0", "currency_raw": "", "url": "", "seller": "Desconocido", "availability": "unknown", "country": "UNKNOWN", "product_name": "QUESITO ALPINA 185 G", "brand": "Unidades disponibles", "reference": "", "unit": "185 G", "price_amount": 185.0, "price_currency": "", "price_symbol": "", "price_text": "185", "price_amount_filled": "185.0", "price_is_imputed": "False", "price_imputation_source": "original", "price_amount_usd": "185.0", "price_amount_usd_filled": "185.0", "fx_rate_local_per_usd": "1.0", "fx_source": "default_1usd", "information_text": "", "description_text": "Ingredientes | Componentes Descripción del producto: Disfruta del delicioso Quesito Alpina, un queso fresco, blando y semigraso, ideal para acompañar tus comidas o consumir directamente del envase. Tamaño: 11.5 cm x 4 cm Peso: 185 g Modo de fabricación: Industrial Origen: Nacional RSA-005113-2018 Alergenos: Puede contener leche Componentes: Leche Cultivos lácticos Sal Ver más También puede interesarte YOX SURTIDO FRESA Y MELOCOTÓN ALPINA 4 UND - 40... SIXPACK CHEESE STICK VITA LATTI 180GR TOMATE CHERRY 250 GR JAMÓN PIETRÁN ESTANDAR 230G", "features_text": "", "specifications_text": "", "benefits_text": "", "details_text": "", "other_sections": "", "sections": {"Descripción": ["Ingredientes | Componentes", "Descripción del producto: Disfruta del delicioso Quesito Alpina, un queso fresco, blando y semigraso, ideal para acompañar tus comidas o consumir directamente del envase.", "Tamaño: 11.5 cm x 4 cm", "Peso: 185 g", "Modo de fabricación: Industrial", "Origen: Nacional", "RSA-005113-2018", "Alergenos: Puede contener leche", "Componentes: Leche", "Cultivos lácticos", "Sal", "Ver más", "También puede interesarte", "YOX SURTIDO FRESA Y MELOCOTÓN ALPINA 4 UND - 40...", "SIXPACK CHEESE STICK VITA LATTI 180GR", "TOMATE CHERRY 250 GR", "JAMÓN PIETRÁN ESTANDAR 230G"]}, "txt_path": "dataset/txt_limpios/804.txt", "html_path": "dataset/paginas_descargadas/804.html", "es_status": "EN", "category_canonical": "leche", "decision": "keep", "match_score": 0.6, "reasons": "heuristic_default"}
{"source_id": "1364", "title": "QUESO FRESCO LUCILITA 250 G", "description": "Ficha técnica ¿Deseas recibir notificaciones? Remind me later Permitir Thank you! Please check your email inbox to confirm. ¡Oops! Notifications are disabled.", "breadcrumbs": "Comparar > 250 G", "price_raw": "250.0", "currency_raw": "USD", "url": "", "seller": "Desconocido", "availability": "unknown", "country": "US", "product_name": "QUESO FRESCO LUCILITA 250 G", "brand": "Comparar", "reference": "", "unit": "250 G", "price_amount": 250.0, "price_currency": "USD", "price_symbol": "", "price_text": "250", "price_amount_filled": "250.0", "price_is_imputed": "False", "price_imputation_source": "original", "price_amount_usd": "250.0", "price_amount_usd_filled": "250.0", "fx_rate_local_per_usd": "1.0", "fx_source": "default_1usd", "information_text": "Ficha técnica ¿Deseas recibir notificaciones? Remind me later Permitir Thank you! Please check your email inbox to confirm. ¡Oops! Notifications are disabled.", "description_text": "", "features_text": "", "specifications_text": "", "benefits_text": "", "details_text": "", "other_sections": "", "sections": {"Información": ["Ficha técnica", "¿Deseas recibir notificaciones?", "Remind me later", "Permitir", "Thank you! Please check your email inbox to confirm.", "Oops! Notifications are disabled."]}, "txt_path": "dataset/txt_limpios/1364.txt", "html_path": "dataset/paginas_descargadas/1364.html", "es_status": "ET", "category_canonical": "sin_categoria", "decision": "discard", "match_score": 0.3, "reasons": "no_category_detected"}
{"source_id": "1361", "title": "QUESO FRESCO NANDITO 500 G", "description": "¿Deseas recibir notificaciones? Remind me later Permitir Thank you! Please check your email inbox to confirm. Oops! Notifications are disabled.", "breadcrumbs": "Comparar > 500 G", "price_raw": "500.0", "currency_raw": "USD", "url": "", "seller": "Desconocido", "availability": "unknown", "country": "US", "product_name": "QUESO FRESCO NANDITO 500 G", "brand": "Comparar", "reference": "", "unit": "500 G", "price_amount": 500.0, "price_currency": "USD", "price_symbol": "", "price_text": "500", "price_amount_filled": "500.0", "price_is_imputed": "False", "price_imputation_source": "original", "price_amount_usd": "500.0", "price_amount_usd_filled": "500.0", "fx_rate_local_per_usd": "1.0", "fx_source": "default_1usd", "information_text": "¿Deseas recibir notificaciones? Remind me later Permitir Thank you! Please check your email inbox to confirm. Oops! Notifications are disabled.", "description_text": "", "features_text": "", "specifications_text": "", "benefits_text": "", "details_text": "", "other_sections": "", "sections": {"Información": ["¿Deseas recibir notificaciones?", "Remind me later", "Permitir", "Thank you! Please check your email inbox to confirm.", "Oops! Notifications are disabled."]}, "txt_path": "dataset/txt_limpios/1361.txt", "html_path": "dataset/paginas_descargadas/1361.html", "es_status": "EN", "category_canonical": "sin_categoria", "decision": "discard", "match_score": 0.3, "reasons": "no_category_detected"}
{"source_id": "1362", "title": "QUESO FRESCO REYQUESO 700 G", "description": "¿Deseas recibir notificaciones? Remind me later Permitir Thank you! Please check your email inbox to confirm. Oops! Notifications are disabled.", "breadcrumbs": "Comparar > 700 G", "price_raw": "700.0", "currency_raw": "USD", "url": "", "seller": "Desconocido", "availability": "unknown", "country": "US", "product_name": "QUESO FRESCO REYQUESO 700 G", "brand": "Comparar", "reference": "", "unit": "700 G", "price_amount": 700.0, "price_currency": "USD", "price_symbol": "", "price_text": "700", "price_amount_filled": "700.0", "price_is_imputed": "False", "price_imputation_source": "original", "price_amount_usd": "700.0", "price_amount_usd_filled": "700.0", "fx_rate_local_per_usd": "1.0", "fx_source": "default_1usd", "information_text": "¿Deseas recibir notificaciones? Remind me later Permitir Thank you! Please check your email inbox to confirm. Oops! Notifications are disabled.", "description_text": "", "features_text": "", "specifications_text": "", "benefits_text": "", "details_text": "", "other_sections": "", "sections": {"Información": ["¿Deseas recibir notificaciones?", "Remind me later", "Permitir", "Thank you! Please check your email inbox to confirm.", "Oops! Notifications are disabled."]}, "txt_path": "dataset/txt_limpios/1362.txt", "html_path": "dataset/paginas_descargadas/1362.html", "es_status": "EN", "category_canonical": "sin_categoria", "decision": "discard", "match_score": 0.3, "reasons": "no_category_detected"}
{"source_id": "803", "title": "QUESO MOZZARELLA TAJADO X 250G LATTI", "description": "Ingredientes | Componentes Tamaño: 12.8 cm x 12.5 cm x 4 cm Peso: 250 g Modo de fabricación: Industrial Origen: Nacional RSA-006514-2018 Alergenos: Contiene leche y productos lácteos. Componentes: Leche pasteurizada parcialmente descremada Sal Cultivos de quesos Enzimas Palmitato de vitamina A Ver más También puede interesarte Tratamiento de Datos Garantías Términos y condiciones Superintendencia de Industria y Comercio – SIC 0.17.168-hotfix-2.", "breadcrumbs": "Unidades disponibles > 250G", "price_raw": "250.0", "currency_raw": "", "url": "", "seller": "Desconocido", "availability": "unknown", "country": "UNKNOWN", "product_name": "QUESO MOZZARELLA TAJADO X 250G LATTI", "brand": "Unidades disponibles", "reference": "", "unit": "250G", "price_amount": 250.0, "price_currency": "", "price_symbol": "", "price_text": "250", "price_amount_filled": "250.0", "price_is_imputed": "False", "price_imputation_source": "original", "price_amount_usd": "250.0", "price_amount_usd_filled": "250.0", "fx_rate_local_per_usd": "1.0", "fx_source": "default_1usd", "information_text": "", "description_text": "Ingredientes | Componentes Tamaño: 12.8 cm x 12.5 cm x 4 cm Peso: 250 g Modo de fabricación: Industrial Origen: Nacional RSA-006514-2018 Alergenos: Contiene leche y productos lácteos. Componentes: Leche pasteurizada parcialmente descremada Sal Cultivos de quesos Enzimas Palmitato de vitamina A Ver más También puede interesarte Tratamiento de Datos Garantías Términos y condiciones Superintendencia de Industria y Comercio – SIC 0.17.168-hotfix-2.", "features_text": "", "specifications_text": "", "benefits_text": "", "details_text": "", "other_sections": "", "sections": {"Descripción": ["Ingredientes | Componentes", "Tamaño: 12.8 cm x 12.5 cm x 4 cm", "Peso: 250 g", "Modo de fabricación: Industrial", "Origen: Nacional", "RSA-006514-2018", "Alergenos: Contiene leche y productos lácteos.", "Componentes: Leche pasteurizada parcialmente descremada", "Sal", "Cultivos de quesos", "Enzimas", "Palmitato de vitamina A", "Ver más", "También puede interesarte", "Tratamiento de Datos", "Garantías", "Términos y condiciones", "Superintendencia de Industria y Comercio – SIC", "0.17.168-hotfix-2."]}, "txt_path": "dataset/txt_limpios/803.txt", "html_path": "dataset/paginas_descargadas/803.html", "es_status": "EN", "category_canonical": "descartado", "decision": "discard", "match_score": 0.1, "reasons": "excluded_keyword"}
{"source_id": "532", "title": "Queso Semiduro", "description": "", "breadcrumbs": "Danbo > 1kg", "price_raw": "1.0", "currency_raw": "", "url": "", "seller": "Desconocido", "availability": "unknown", "country": "UNKNOWN", "product_name": "Queso Semiduro", "brand": "Danbo", "reference": "", "unit": "1kg", "price_amount": 1.0, "price_currency": "", "price_symbol": "", "price_text": "1", "price_amount_filled": "1.0", "price_is_imputed": "False", "price_imputation_source": "original", "price_amount_usd": "1.0", "price_amount_usd_filled": "1.0", "fx_rate_local_per_usd": "1.0", "fx_source": "default_1usd", "information_text": "", "description_text": "", "features_text": "MARCA | : LAS TRES NIÑAS | Últimos consultados | Ver planes de cuotas | Queso Cremoso PUNTA DEL AGUA X Kg | NO ACUMULABLE CON OTRAS PROMOS | Queso Cremoso Fraccionado LA PAULINA Xkg | OFERTA | Huevo Color Libre Jaula CARNAVE 6 Uni", "specifications_text": "", "benefits_text": "", "details_text": "", "other_sections": "", "sections": {"Características": ["MARCA", ": LAS TRES NIÑAS", "Últimos consultados", "Ver planes de cuotas", "Queso Cremoso PUNTA DEL AGUA X Kg", "NO ACUMULABLE CON OTRAS PROMOS", "Queso Cremoso Fraccionado LA PAULINA Xkg", "OFERTA", "Huevo Color Libre Jaula CARNAVE 6 Uni"]}, "txt_path": "dataset/txt_limpios/532.txt", "html_path": "dataset/paginas_descargadas/532.html", "es_status": "EN", "category_canonical": "sin_categoria", "decision": "discard", "match_score": 0.3, "reasons": "no_category_detected"}
{"source_id": "528", "title": "Quesos Blandos", "description": "", "breadcrumbs": "Queso Muzzarella > 500g", "price_raw": "500.0", "currency_raw": "", "url": "", "seller": "Desconocido", "availability": "unknown", "country": "UNKNOWN", "product_name": "Quesos Blandos", "brand": "Queso Muzzarella", "reference": "", "unit": "500g", "price_amount": 500.0, "price_currency": "", "price_symbol": "", "price_text": "500", "price_amount_filled": "500.0", "price_is_imputed": "False", "price_imputation_source": "original", "price_amount_usd": "500.0", "price_amount_usd_filled": "500.0", "fx_rate_local_per_usd": "1.0", "fx_source": "default_1usd", "information_text": "", "description_text": "", "features_text": "MARCA | : LA SERENISIMA | SIN TACC | : SI | Últimos consultados | Huevo Color Libre Jaula CARNAVE 6 Uni | Ver planes de cuotas | 20%DTO | Huevo Blanco Grande 6u | PRECIO CON 20%DTO | 15%DTO | Huevo Blanco . Coto Bli 12 Uni | PRECIO CON 15%DTO | Huevo Blanco Extra 12u | 35%DTO | Espagueti FAVORITA      500 Gr | PRECIO CON 35%DTO", "specifications_text": "", "benefits_text": "", "details_text": "", "other_sections": "", "sections": {"Características": ["MARCA", ": LA SERENISIMA", "SIN TACC", ": SI", "Últimos consultados", "Huevo Color Libre Jaula CARNAVE 6 Uni", "Ver planes de cuotas", "20%DTO", "Huevo Blanco Grande 6u", "PRECIO CON 20%DTO", "15%DTO", "Huevo Blanco . Coto Bli 12 Uni", "PRECIO CON 15%DTO", "Huevo Blanco Extra 12u", "35%DTO", "Espagueti FAVORITA      500 Gr", "PRECIO CON 35%DTO"]}, "txt_path": "dataset/txt_limpios/528.txt", "html_path": "dataset/paginas_descargadas/528.html", "es_status": "EN", "category_canonical": "sin_categoria", "decision": "discard", "match_score": 0.3, "reasons": "no_category_detected"}
{"source_id": "529", "title": "Quesos Blandos", "description": "", "breadcrumbs": "Queso Cremoso > 500g", "price_raw": "500.0", "currency_raw": "", "url": "", "seller": "Desconocido", "availability": "unknown", "country": "UNKNOWN", "product_name": "Quesos Blandos", "brand": "Queso Cremoso", "reference": "", "unit": "500g", "price_amount": 500.0, "price_currency": "", "price_symbol": "", "price_text": "500", "price_amount_filled": "500.0", "price_is_imputed": "False", "price_imputation_source": "original", "price_amount_usd": "500.0", "price_amount_usd_filled": "500.0", "fx_rate_local_per_usd": "1.0", "fx_source": "default_1usd", "information_text": "", "description_text": "", "features_text": "MARCA | : LA PAULINA | SIN TACC | : NO | Últimos consultados | Ver planes de cuotas | Huevo Color Libre Jaula CARNAVE 6 Uni | 20%DTO | Huevo Blanco Grande 6u | PRECIO CON 20%DTO | 15%DTO | Huevo Blanco . Coto Bli 12 Uni | PRECIO CON 15%DTO | Huevo Blanco Extra 12u", "specifications_text": "", "benefits_text": "", "details_text": "", "other_sections": "", "sections": {"Características": ["MARCA", ": LA PAULINA", "SIN TACC", ": NO", "Últimos consultados", "Ver planes de cuotas", "Huevo Color Libre Jaula CARNAVE 6 Uni", "20%DTO", "Huevo Blanco Grande 6u", "PRECIO CON 20%DTO", "15%DTO", "Huevo Blanco . Coto Bli 12 Uni", "PRECIO CON 15%DTO", "Huevo Blanco Extra 12u"]}, "txt_path": "dataset/txt_limpios/529.txt", "html_path": "dataset/paginas_descargadas/529.html", "es_status": "EN", "category_canonical": "sin_categoria", "decision": "discard", "match_score": 0.3, "reasons": "no_category_detected"}
{"source_id": "530", "title": "Quesos Blandos", "description": "", "breadcrumbs": "Queso Cremoso > 500g", "price_raw": "8999.0", "currency_raw": "", "url": "", "seller": "Desconocido", "availability": "unknown", "country": "UNKNOWN", "product_name": "Quesos Blandos", "brand": "Queso Cremoso", "reference": "", "unit": "500g", "price_amount": 8999.0, "price_currency": "", "price_symbol": "$", "price_text": "$8.999,00", "price_amount_filled": "8999.0", "price_is_imputed": "False", "price_imputation_source": "original", "price_amount_usd": "8999.0", "price_amount_usd_filled": "8999.0", "fx_rate_local_per_usd": "1.0", "fx_source": "default_1usd", "information_text": "", "description_text": "", "features_text": "MARCA | : PUNTA DEL AGUA | SIN TACC | : SI | ORIGEN | : ARGENTINA | Últimos consultados | NO ACUMULABLE CON OTRAS PROMOS | Queso Cremoso Fraccionado LA PAULINA Xkg | OFERTA | Ver planes de cuotas | Huevo Color Libre Jaula CARNAVE 6 Uni | 20%DTO | Huevo Blanco Grande 6u | PRECIO CON 20%DTO | 15%DTO | Huevo Blanco . Coto Bli 12 Uni | PRECIO CON 15%DTO", "specifications_text": "", "benefits_text": "", "details_text": "", "other_sections": "", "sections": {"Características": ["MARCA", ": PUNTA DEL AGUA", "SIN TACC", ": SI", "ORIGEN", ": ARGENTINA", "Últimos consultados", "NO ACUMULABLE CON OTRAS PROMOS", "Queso Cremoso Fraccionado LA PAULINA Xkg", "OFERTA", "Ver planes de cuotas", "Huevo Color Libre Jaula CARNAVE 6 Uni", "20%DTO", "Huevo Blanco Grande 6u", "PRECIO CON 20%DTO", "15%DTO", "Huevo Blanco . Coto Bli 12 Uni", "PRECIO CON 15%DTO"]}, "txt_path": "dataset/txt_limpios/530.txt", "html_path": "dataset/paginas_descargadas/530.html", "es_status": "EN", "category_canonical": "sin_categoria", "decision": "discard", "match_score": 0.3, "reasons": "no_category_detected"}
{"source_id": "531", "title": "Quesos Blandos", "description": "", "breadcrumbs": "Queso Muzzarella > 170g", "price_raw": "170.0", "currency_raw": "", "url": "", "seller": "Desconocido", "availability": "unknown", "country": "UNKNOWN", "product_name": "Quesos Blandos", "brand": "Queso Muzzarella", "reference": "", "unit": "170g", "price_amount": 170.0, "price_currency": "", "price_symbol": "", "price_text": "170", "price_amount_filled": "170.0", "price_is_imputed": "False", "price_imputation_source": "original", "price_amount_usd": "170.0", "price_amount_usd_filled": "170.0", "fx_rate_local_per_usd": "1.0", "fx_source": "default_1usd", "information_text": "", "description_text": "", "features_text": "MARCA | : DOÑA AURORA | SIN TACC | : SI | Últimos consultados | Queso Cremoso PUNTA DEL AGUA X Kg | Ver planes de cuotas | NO ACUMULABLE CON OTRAS PROMOS | Queso Cremoso Fraccionado LA PAULINA Xkg | OFERTA | Huevo Color Libre Jaula CARNAVE 6 Uni | 20%DTO | Huevo Blanco Grande 6u | PRECIO CON 20%DTO", "specifications_text": "", "benefits_text": "", "details_text": "", "other_sections": "", "sections": {"Características": ["MARCA", ": DOÑA AURORA", "SIN TACC", ": SI", "Últimos consultados", "Queso Cremoso PUNTA DEL AGUA X Kg", "Ver planes de cuotas", "NO ACUMULABLE CON OTRAS PROMOS", "Queso Cremoso Fraccionado LA PAULINA Xkg", "OFERTA", "Huevo Color Libre Jaula CARNAVE 6 Uni", "20%DTO", "Huevo Blanco Grande 6u", "PRECIO CON 20%DTO"]}, "txt_path": "dataset/txt_limpios/531.txt", "html_path": "dataset/paginas_descargadas/531.html", "es_status": "EN", "category_canonical": "sin_categoria", "decision": "discard", "match_score": 0.3, "reasons": "no_category_detected"}
{"source_id": "1572", "title": "Refrigerante Coca-Cola Garrafa 2 L", "description": "", "breadcrumbs": "R$ 10,99 > 2 L", "price_raw": "10.99", "currency_raw": "BRL", "url": "", "seller": "Desconocido", "availability": "unknown", "country": "BR", "product_name": "Refrigerante Coca-Cola Garrafa 2 L", "brand": "R$ 10,99", "reference": "", "unit": "2 L", "price_amount": 10.99, "price_currency": "BRL", "price_symbol": "R$", "price_text": "R$10,99", "price_amount_filled": "10.99", "price_is_imputed": "False", "price_imputation_source": "original", "price_amount_usd": "2.0173", "price_amount_usd_filled": "2.0173", "fx_rate_local_per_usd": "5.448", "fx_source": "from_brasil_cambio_dolar", "information_text": "", "description_text": "", "features_text": "", "specifications_text": "", "benefits_text": "", "details_text": "", "other_sections": "", "sections": {}, "txt_path": "dataset/txt_limpios/1572.txt", "html_path": "dataset/paginas_descargadas/1572.html", "es_status": "EN", "category_canonical": "sin_categoria", "decision": "discard", "match_score": 0.3, "reasons": "no_category_detected"}
{"source_id": "195", "title": "Refrigerante Coca-Cola Garrafa 2 L", "description": "", "breadcrumbs": "R$ 11,49 > 2 L", "price_raw": "11.49", "currency_raw": "BRL", "url": "", "seller": "Desconocido", "availability": "unknown", "country": "BR", "product_name": "Refrigerante Coca-Cola Garrafa 2 L", "brand": "R$ 11,49", "reference": "", "unit": "2 L", "price_amount": 11.49, "price_currency": "BRL", "price_symbol": "R$", "price_text": "R$11,49", "price_amount_filled": "11.49", "price_is_imputed": "False", "price_imputation_source": "original", "price_amount_usd": "2.109", "price_amount_usd_filled": "2.109", "fx_rate_local_per_usd": "5.448", "fx_source": "from_brasil_cambio_dolar", "information_text": "", "description_text": "", "features_text": "", "specifications_text": "", "benefits_text": "", "details_text": "", "other_sections": "", "sections": {}, "txt_path": "dataset/txt_limpios/195.txt", "html_path": "dataset/paginas_descargadas/195.html", "es_status": "EN", "category_canonical": "sin_categoria", "decision": "discard", "match_score": 0.3, "reasons": "no_category_detected"}
{"source_id": "1585", "title": "Refrigerante Fanta Laranja 2L", "description": "", "breadcrumbs": "R$ 9,69 > 2L", "price_raw": "9.69", "currency_raw": "BRL", "url": "", "seller": "Desconocido", "availability": "unknown", "country": "BR", "product_name": "Refrigerante Fanta Laranja 2L", "brand": "R$ 9,69", "reference": "", "unit": "2L", "price_amount": 9.69, "price_currency": "BRL", "price_symbol": "R$", "price_text": "R$9,69", "price_amount_filled": "9.69", "price_is_imputed": "False", "price_imputation_source": "original", "price_amount_usd": "1.7786", "price_amount_usd_filled": "1.7786", "fx_rate_local_per_usd": "5.448", "fx_source": "from_brasil_cambio_dolar", "information_text": "", "description_text": "", "features_text": "", "specifications_text": "", "benefits_text": "", "details_text": "", "other_sections": "", "sections": {}, "txt_path": "dataset/txt_limpios/1585.txt", "html_path": "dataset/paginas_descargadas/1585.html", "es_status": "EN", "category_canonical": "sin_categoria", "decision": "discard", "match_score": 0.3, "reasons": "no_category_detected"}
