{"source_id": "1366", "title": "ARROZ CONEJO SACO 20 LB", "description": "Ficha técnica Arroz 20 lb ¿Deseas recibir notificaciones? Remind me later Permitir Thank you! Please check your email inbox to confirm. ¡Oops! Notifications are disabled.", "breadcrumbs": "Comparar > 20 LB", "price_raw": "9.99", "currency_raw": "USD", "url": "", "seller": "Desconocido", "availability": "unknown", "country": "US", "product_name": "ARROZ CONEJO SACO 20 LB", "brand": "Comparar", "reference": "", "unit": "20 LB", "price_amount": 9.99, "price_currency": "USD", "price_symbol": "$", "price_text": "$9,99", "price_amount_filled": "9.99", "price_is_imputed": "False", "price_imputation_source": "original", "price_amount_usd": "9.99", "price_amount_usd_filled": "9.99", "fx_rate_local_per_usd": "1.0", "fx_source": "default_1usd", "information_text": "Ficha técnica Arroz 20 lb ¿Deseas recibir notificaciones? Remind me later Permitir Thank you! Please check your email inbox to confirm. ¡Oops! Notifications are disabled.", "description_text": "", "features_text": "", "specifications_text": "", "benefits_text": "", "details_text": "", "other_sections": "", "sections": {"Información": ["Ficha técnica", "Arroz 20 lb", "¿Deseas recibir notificaciones?", "Remind me later", "Permitir", "Thank you! Please check your email inbox to confirm.", "Oops! Notifications are disabled."]}, "txt_path": "dataset/txt_limpios/1366.txt", "html_path": "dataset/paginas_descargadas/1366.html", "es_status": "ET", "category_canonical": "arroz", "decision": "keep", "match_score": 0.6, "reasons": "heuristic_default"}
{"source_id": "790", "title": "ARROZ DIANA 500 G", "description": "Ingredientes | Componentes Nombre del producto: Arroz Diana 500 g Descripción del producto: Arroz blanco de alta calidad, ideal para preparar tus comidas favoritas. Presentación de 500 gramos. Tamaño: 18 cm x 12cm Peso: 500 g Modo de fabricación: Industrial Conservación: Mantener en un lugar fresco y seco Origen: Nacional RSAT10I1302 Componentes: Arroz blanco Ver más También puede interesarte FIDEOS DORIA 250 GRS SPAGHETTI DORIA 250 G HARINA DE MAIZ BLANCA PAN 800 G Amor y amistad SALCHICHA RANCHERA X 230 G X 7 UD CEBOLLA CABEZONA X 1000G TOMATE CHONTO X 1000 G Bajó de precio ACEITE DE GIRASOL DON OLIO 900 ML SALSA DE TOMATE FRUCO 500G PANELA PASTILLA 1000 G JAMÓN PIETRÁN ESTANDAR 230G", "breadcrumbs": "Unidades disponibles > 500 G", "price_raw": "500.0", "currency_raw": "", "url": "", "seller": "Desconocido", "availability": "unknown", "country": "UNKNOWN", "product_name": "ARROZ DIANA 500 G", "brand": "Unidades disponibles", "reference": "", "unit": "500 G", "price_amount": 500.0, "price_currency": "", "price_symbol": "", "price_text": "500", "price_amount_filled": "500.0", "price_is_imputed": "False", "price_imputation_source": "original", "price_amount_usd": "500.0", "price_amount_usd_filled": "500.0", "fx_rate_local_per_usd": "1.0", "fx_source": "default_1usd", "information_text": "", "description_text": "Ingredientes | Componentes Nombre del producto: Arroz Diana 500 g Descripción del producto: Arroz blanco de alta calidad, ideal para preparar tus comidas favoritas. Presentación de 500 gramos. Tamaño: 18 cm x 12cm Peso: 500 g Modo de fabricación: Industrial Conservación: Mantener en un lugar fresco y seco Origen: Nacional RSAT10I1302 Componentes: Arroz blanco Ver más También puede interesarte FIDEOS DORIA 250 GRS SPAGHETTI DORIA 250 G HARINA DE MAIZ BLANCA PAN 800 G Amor y amistad SALCHICHA RANCHERA X 230 G X 7 UD CEBOLLA CABEZONA X 1000G TOMATE CHONTO X 1000 G Bajó de precio ACEITE DE GIRASOL DON OLIO 900 ML SALSA DE TOMATE FRUCO 500G PANELA PASTILLA 1000 G JAMÓN PIETRÁN ESTANDAR 230G", "features_text": "", "specifications_text": "", "benefits_text": "", "details_text": "", "other_sections": "", "sections": {"Descripción": ["Ingredientes | Componentes", "Nombre del producto: Arroz Diana 500 g", "Descripción del producto: Arroz blanco de alta calidad, ideal para preparar tus comidas favoritas. Presentación de 500 gramos.", "Tamaño: 18cm x 12cm", "Peso: 500 g", "Modo de fabricación: Industrial", "Conservación: Mantener en un lugar fresco y seco", "Origen: Nacional", "RSAT10I1302", "Componentes: Arroz blanco", "Ver más", "También puede interesarte", "FIDEOS DORIA 250 GRS", "SPAGHETTI DORIA 250 G", "HARINA DE MAIZ BLANCA PAN 800 G", "Amor y amistad", "SALCHICHA RANCHERA X 230 G X 7 UD", "CEBOLLA CABEZONA X 1000G", "TOMATE CHONTO X 1000 G", "Bajó de precio", "ACEITE DE GIRASOL DON OLIO 900 ML", "SALSA DE TOMATE FRUCO 500G", "PANELA PASTILLA 1000 G", "JAMÓN PIETRÁN ESTANDAR 230G"]}, "txt_path": "dataset/txt_limpios/790.txt", "html_path": "dataset/paginas_descargadas/790.html", "es_status": "ET", "category_canonical": "cebolla", "decision": "keep", "match_score": 0.6, "reasons": "heuristic_default"}
{"source_id": "791", "title": "ARROZ ESTÁNDAR ALBAR 500 GRS", "description": "Ingredientes | Componentes Nombre del producto: Arroz estándar 500g Descripción del producto: Arroz blanco seleccionado, ideal para preparaciones diarias. Presentación práctica de 500 gramos, excelente opción para hogares pequeños el para complementar tu despensa. Tamaño: 19cm x 11cm Peso: 500 g Modo de fabricación: Industrial Conservación: Debe mantenerse en un lugar fresco y seco, protegido de humedad, líquidos y productos con olor fuerte Origen: Nacional NSA-0007355-2019 Componentes: Arroz blanco ¡Queremos que tengas la mejor experiencia! Si tienes dudas sobre este producto el contenido, te invitamos a consultar nuestros Términos y condiciones para conocer malas sobre devoluciones y nuestras políticas de reembolsos. Ver más También puede interesarte SPAGUETTI CAPRÍSSIMA 250 GRS LENTEJA EL ESTÍO 500 GRS CABELLO DE ÁNGEL CAPRÍSSIMA 250 GRS CONCHA CAPRÍSSIMA 250 GRS AZÚCAR BLANCA 1000 GRS SAL REFISAL 1000 G Bajó de precio FRÍDOL CARGAMANTO ROJO EL ESTÍO 500 GRS BARRA ESPARCIBLE DON OLIO 125 G Amor y amistad GALLETAS SALADAS SALTISIMAS 6 TACOS 454 G...", "breadcrumbs": "Unidades disponibles > 500 g", "price_raw": "500.0", "currency_raw": "", "url": "", "seller": "Desconocido", "availability": "unknown", "country": "UNKNOWN", "product_name": "ARROZ ESTÁNDAR ALBAR 500 GRS", "brand": "Unidades disponibles", "reference": "", "unit": "500 g", "price_amount": 500.0, "price_currency": "", "price_symbol": "", "price_text": "500", "price_amount_filled": "500.0", "price_is_imputed": "False", "price_imputation_source": "original", "price_amount_usd": "500.0", "price_amount_usd_filled": "500.0", "fx_rate_local_per_usd": "1.0", "fx_source": "default_1usd", "information_text": "", "description_text": "Ingredientes | Componentes Nombre del producto: Arroz estándar 500g Descripción del producto: Arroz blanco seleccionado, ideal para preparaciones diarias. Presentación práctica de 500 gramos, excelente opción para hogares pequeños el para complementar tu despensa. Tamaño: 19cm x 11cm Peso: 500 g Modo de fabricación: Industrial Conservación: Debe mantenerse en un lugar fresco y seco, protegido de humedad, líquidos y productos con olor fuerte Origen: Nacional NSA-0007355-2019 Componentes: Arroz blanco ¡Queremos que tengas la mejor experiencia! Si tienes dudas sobre este producto el contenido, te invitamos a consultar nuestros Términos y condiciones para conocer malas sobre devoluciones y nuestras políticas de reembolsos. Ver más También puede interesarte SPAGUETTI CAPRÍSSIMA 250 GRS LENTEJA EL ESTÍO 500 GRS CABELLO DE ÁNGEL CAPRÍSSIMA 250 GRS CONCHA CAPRÍSSIMA 250 GRS AZÚCAR BLANCA 1000 GRS SAL REFISAL 1000 G Bajó de precio FRÍDOL CARGAMANTO ROJO EL ESTÍO 500 GRS BARRA ESPARCIBLE DON OLIO 125 G Amor y amistad GALLETAS SALADAS SALTISIMAS 6 TACOS 454 G...", "features_text": "", "specifications_text": "", "benefits_text": "", "details_text": "", "other_sections": "", "sections": {"Descripción": ["Ingredientes | Componentes", "Nombre del producto: Arroz estándar 500g", "Descripción del producto: Arroz blanco seleccionado, ideal para preparaciones diarias. Presentación práctica de 500 gramos, excelente opción para hogares pequeños el para complementar tu despensa.", "Tamaño: 19cm x 11cm", "Peso: 500 g", "Modo de fabricación: Industrial", "Conservación: Debe mantenerse en un lugar fresco y seco, protegido de humedad, líquidos y productos con olor fuerte", "Origen: Nacional", "NSA-0007355-2019", "Componentes: Arroz blanco", "¡Queremos que tengas la mejor experiencia! Si tienes dudas sobre este producto el contenido, te invitamos a consultar nuestros Términos y condiciones para conocer malas sobre devoluciones y nuestras políticas de reembolsos.", "Ver más", "También puede interesarte", "SPAGUETTI CAPRÍSSIMA 250 GRS", "LENTEJA EL ESTÍO 500 GRS", "CABELLO DE ÁNGEL CAPRÍSSIMA 250 GRS", "CONCHA CAPRÍSSIMA 250 GRS", "AZÚCAR BLANCA 1000 GRS", "SAL REFISAL 1000 G", "Bajó de precio", "FRÍDOL CARGAMANTO ROJO EL ESTÍO 500 GRS", "BARRA ESPARCIBLE DON OLIO 125 G", "Amor y amistad", "GALLETAS SALADAS SALTISIMAS 6 TACOS 454 G..."]}, "txt_path": "dataset/txt_limpios/791.txt", "html_path": "dataset/paginas_descargadas/791.html", "es_status": "ET", "category_canonical": "azucar", "decision": "keep", "match_score": 0.6, "reasons": "heuristic_default"}
{"source_id": "905", "title": "Arroz G1 largo ancho bolsa", "description": "Arroz Miraflores G1 largo ancho bolsa 1 Kg", "breadcrumbs": "1 Kg > 1 Kg", "price_raw": "1.89", "currency_raw": "", "url": "", "seller": "Desconocido", "availability": "unknown", "country": "UNKNOWN", "product_name": "Arroz G1 largo ancho bolsa", "brand": "1 Kg", "reference": "", "unit": "1 Kg", "price_amount": 1.89, "price_currency": "", "price_symbol": "$", "price_text": "$1.89", "price_amount_filled": "1.89", "price_is_imputed": "False", "price_imputation_source": "original", "price_amount_usd": "1.89", "price_amount_usd_filled": "1.89", "fx_rate_local_per_usd": "1.0", "fx_source": "default_1usd", "information_text": "", "description_text": "Arroz Miraflores G1 largo ancho bolsa 1 Kg", "features_text": "", "specifications_text": "", "benefits_text": "", "details_text": "", "other_sections": "", "sections": {"Descripción": ["Arroz Miraflores G1 largo ancho bolsa 1 Kg"]}, "txt_path": "dataset/txt_limpios/905.txt", "html_path": "dataset/paginas_descargadas/905.html", "es_status": "EN", "category_canonical": "arroz", "decision": "keep", "match_score": 0.6, "reasons": "heuristic_default"}
{"source_id": "903", "title": "Arroz G2 gran selección ancha", "description": "Arroz Tucapel G2 gran Selección ancho 1 Kg", "breadcrumbs": "1 Kg > 1 Kg", "price_raw": "1.37", "currency_raw": "", "url": "", "seller": "Desconocido", "availability": "unknown", "country": "UNKNOWN", "product_name": "Arroz G2 gran selección ancha", "brand": "1 Kg", "reference": "", "unit": "1 Kg", "price_amount": 1.37, "price_currency": "", "price_symbol": "$", "price_text": "$1.37", "price_amount_filled": "1.37", "price_is_imputed": "False", "price_imputation_source": "original", "price_amount_usd": "1.37", "price_amount_usd_filled": "1.37", "fx_rate_local_per_usd": "1.0", "fx_source": "default_1usd", "information_text": "", "description_text": "Arroz Tucapel G2 gran Selección ancho 1 Kg", "features_text": "", "specifications_text": "", "benefits_text": "", "details_text": "", "other_sections": "", "sections": {"Descripción": ["Arroz Tucapel G2 gran Selección ancho 1 Kg"]}, "txt_path": "dataset/txt_limpios/903.txt", "html_path": "dataset/paginas_descargadas/903.html", "es_status": "ET", "category_canonical": "arroz", "decision": "keep", "match_score": 0.6, "reasons": "heuristic_default"}
{"source_id": "904", "title": "Arroz G2 largo delgado", "description": "Arroz Merkat largo delgado grado 2 1 Kg", "breadcrumbs": "1 Kg > 1 Kg", "price_raw": "1.02", "currency_raw": "", "url": "", "seller": "Desconocido", "availability": "unknown", "country": "UNKNOWN", "product_name": "Arroz G2 largo delgado", "brand": "1 Kg", "reference": "", "unit": "1 Kg", "price_amount": 1.02, "price_currency": "", "price_symbol": "$", "price_text": "$1.02", "price_amount_filled": "1.02", "price_is_imputed": "False", "price_imputation_source": "original", "price_amount_usd": "1.02", "price_amount_usd_filled": "1.02", "fx_rate_local_per_usd": "1.0", "fx_source": "default_1usd", "information_text": "", "description_text": "Arroz Merkat largo delgado grado 2 1 Kg", "features_text": "", "specifications_text": "", "benefits_text": "", "details_text": "", "other_sections": "", "sections": {"Descripción": ["Arroz Merkat largo delgado grado 2 1 Kg"]}, "txt_path": "dataset/txt_limpios/904.txt", "html_path": "dataset/paginas_descargadas/904.html", "es_status": "EN", "category_canonical": "arroz", "decision": "keep", "match_score": 0.6, "reasons": "heuristic_default"}
{"source_id": "906", "title": "Arroz grano largo delgado grad...", "description": "Arroz grano largo delgado grado 2 900G", "breadcrumbs": "900 g > 900 g", "price_raw": "1.39", "currency_raw": "", "url": "", "seller": "Desconocido", "availability": "unknown", "country": "UNKNOWN", "product_name": "Arroz grano largo delgado grad...", "brand": "900 g", "reference": "", "unit": "900 g", "price_amount": 1.39, "price_currency": "", "price_symbol": "$", "price_text": "$1.39", "price_amount_filled": "1.39", "price_is_imputed": "False", "price_imputation_source": "original", "price_amount_usd": "1.39", "price_amount_usd_filled": "1.39", "fx_rate_local_per_usd": "1.0", "fx_source": "default_1usd", "information_text": "", "description_text": "Arroz grano largo delgado grado 2 900G", "features_text": "", "specifications_text": "", "benefits_text": "", "details_text": "", "other_sections": "", "sections": {"Descripción": ["Arroz grano largo delgado grado 2 900G"]}, "txt_path": "dataset/txt_limpios/906.txt", "html_path": "dataset/paginas_descargadas/906.html", "es_status": "EN", "category_canonical": "arroz", "decision": "keep", "match_score": 0.6, "reasons": "heuristic_default"}
{"source_id": "5", "title": "Arroz La Merced Super Extra 900g", "description": "Arroz La Merced, el poderoso grano rico en nutrientes. Arroz Precocido La Merced es ideal para comer en el desayuno y comida debido a su alto contenido de nutrientes. Excelente como guarnición para tus platillos favoritos y en el tradicional arroz con leche.", "breadcrumbs": "La Merced > 900g > 3247692", "price_raw": "21.0", "currency_raw": "MXN", "url": "", "seller": "Chedraui", "availability": "unknown", "country": "MX", "product_name": "Arroz La Merced Super Extra 900g", "brand": "La Merced", "reference": "3247692.0", "unit": "900g", "price_amount": 21.0, "price_currency": "MXN", "price_symbol": "$", "price_text": "$21.00", "price_amount_filled": "21.0", "price_is_imputed": "False", "price_imputation_source": "original", "price_amount_usd": "1.1278", "price_amount_usd_filled": "1.1278", "fx_rate_local_per_usd": "18.62", "fx_source": "from_mexico_cambio_dolar", "information_text": "Arroz La Merced, el poderoso grano rico en nutrientes.", "description_text": "", "features_text": "Fuente de proteína y además carbohidratos | Con los beneficios de los antioxidantes. | Contiene vitamina B, potasio y fósforo.", "specifications_text": "Arroz Precocido La Merced es ideal para comer en el desayuno y comida debido a su alto contenido de nutrientes. Excelente como guarnición para tus platillos favoritos y en el tradicional arroz con leche.", "benefits_text": "", "details_text": "", "other_sections": "", "sections": {"Información": ["Arroz La Merced, el poderoso grano rico en nutrientes."], "Características": ["Fuente de proteína y además carbohidratos", "Con los beneficios de los antioxidantes.", "Contiene vitamina B, potasio y fósforo."], "Especificaciones": ["Arroz Precocido La Merced es ideal para comer en el desayuno y comida debido a su alto contenido de nutrientes. Excelente como guarnición para tus platillos favoritos y en el tradicional arroz con leche."]}, "txt_path": "dataset/txt_limpios/5.txt", "html_path": "dataset/paginas_descargadas/5.html", "es_status": "EN", "category_canonical": "arroz", "decision": "keep", "match_score": 0.6, "reasons": "heuristic_default"}
{"source_id": "1365", "title": "ARROZ REAL 2 KG", "description": "Ficha técnica ¿Deseas recibir notificaciones? Remind me later Permitir Thank you! Please check your email inbox to confirm. ¡Oops! Notifications are disabled.", "breadcrumbs": "Comparar > 2 KG", "price_raw": "2.99", "currency_raw": "USD", "url": "", "seller": "Desconocido", "availability": "unknown", "country": "US", "product_name": "ARROZ REAL 2 KG", "brand": "Comparar", "reference": "", "unit": "2 KG", "price_amount": 2.99, "price_currency": "USD", "price_symbol": "$", "price_text": "$2,99", "price_amount_filled": "2.99", "price_is_imputed": "False", "price_imputation_source": "original", "price_amount_usd": "2.99", "price_amount_usd_filled": "2.99", "fx_rate_local_per_usd": "1.0", "fx_source": "default_1usd", "information_text": "Ficha técnica ¿Deseas recibir notificaciones? Remind me later Permitir Thank you! Please check your email inbox to confirm. ¡Oops! Notifications are disabled.", "description_text": "", "features_text": "", "specifications_text": "", "benefits_text": "", "details_text": "", "other_sections": "", "sections": {"Información": ["Ficha técnica", "¿Deseas recibir notificaciones?", "Remind me later", "Permitir", "Thank you! Please check your email inbox to confirm.", "Oops! Notifications are disabled."]}, "txt_path": "dataset/txt_limpios/1365.txt", "html_path": "dataset/paginas_descargadas/1365.html", "es_status": "ET", "category_canonical": "arroz", "decision": "keep", "match_score": 0.6, "reasons": "heuristic_default"}
{"source_id": "1", "title": "Arroz Schettino Verde 900g", "description": "Arroz Grano Largo, color blanco libre de olore", "breadcrumbs": "Schettino > 900g > 3008386", "price_raw": "19.8", "currency_raw": "MXN", "url": "", "seller": "Chedraui", "availability": "unknown", "country": "MX", "product_name": "Arroz Schettino Verde 900g", "brand": "Schettino", "reference": "3008386.0", "unit": "900g", "price_amount": 19.8, "price_currency": "MXN", "price_symbol": "$", "price_text": "$19.80", "price_amount_filled": "19.8", "price_is_imputed": "False", "price_imputation_source": "original", "price_amount_usd": "1.0634", "price_amount_usd_filled": "1.0634", "fx_rate_local_per_usd": "18.62", "fx_source": "from_mexico_cambio_dolar", "information_text": "Arroz Grano Largo, color blanco libre de olore", "description_text": "", "features_text": "Aporta energía | Mejora la digestión | Fuente de fribra", "specifications_text": "", "benefits_text": "", "details_text": "", "other_sections": "", "sections": {"Información": ["Arroz Grano Largo, color blanco libre de olore"], "Características": ["Aporta energía", "Mejora la digestión", "Fuente de fribra"]}, "txt_path": "dataset/txt_limpios/1.txt", "html_path": "dataset/paginas_descargadas/1.html", "es_status": "EN", "category_canonical": "arroz", "decision": "keep", "match_score": 0.6, "reasons": "heuristic_default"}
{"source_id": "3", "title": "Arroz SOS Super Extra Rojo 900g", "description": "Arroz Grano Largo, color blanco libre de olore", "breadcrumbs": "SOS > 900g > 3008327", "price_raw": "", "currency_raw": "MXN", "url": "", "seller": "Chedraui", "availability": "unknown", "country": "MX", "product_name": "Arroz SOS Super Extra Rojo 900g", "brand": "SOS", "reference": "3008327.0", "unit": "900g", "price_amount": null, "price_currency": "MXN", "price_symbol": "", "price_text": "", "price_amount_filled": "20.4", "price_is_imputed": "True", "price_imputation_source": "category_country_mean", "price_amount_usd": "", "price_amount_usd_filled": "1.0956", "fx_rate_local_per_usd": "18.62", "fx_source": "from_mexico_cambio_dolar", "information_text": "Arroz Grano Largo, color blanco libre de olore", "description_text": "", "features_text": "", "specifications_text": "", "benefits_text": "", "details_text": "", "other_sections": "", "sections": {"Información": ["Arroz Grano Largo, color blanco libre de olore"]}, "txt_path": "dataset/txt_limpios/3.txt", "html_path": "dataset/paginas_descargadas/3.html", "es_status": "EN", "category_canonical": "arroz", "decision": "discard", "match_score": 0.6, "reasons": "price_parse_failed;price<=0"}
