{"source_id": "109", "title": "BUSCAR PRODUCTOS", "description": "Tienen una vida útil relativamente corta, su sabor suave es distintivo de esta variedad. Tips y usos Son perfectas para comer crudas el asadas, tiene una amplia variedad de usos en guisos, sopas, carnes y ensaladas, por lo que es un básico en la cocina mexicana. Platillos destacados Uno de los platillos más comunes que tiene como protagonista la cebolla es la tinga, un platillo muy mexicano. Esta huerta ayuda a aliviar y combatir enfermedades respiratorias y cardiovasculares, también mejora la circulación sanguínea. | x | Promociones | Cerrar | Más información", "breadcrumbs": "Ingresa", "price_raw": "443.0", "currency_raw": "", "url": "", "seller": "Desconocido", "availability": "unknown", "country": "UNKNOWN", "product_name": "BUSCAR PRODUCTOS", "brand": "Ingresa", "reference": "", "unit": "", "price_amount": 443.0, "price_currency": "", "price_symbol": "", "price_text": "443", "price_amount_filled": "443.0", "price_is_imputed": "False", "price_imputation_source": "original", "price_amount_usd": "443.0", "price_amount_usd_filled": "443.0", "fx_rate_local_per_usd": "1.0", "fx_source": "default_1usd", "information_text": "", "description_text": "Tienen una vida útil relativamente corta, su sabor suave es distintivo de esta variedad. Tips y usos Son perfectas para comer crudas el asadas, tiene una amplia variedad de usos en guisos, sopas, carnes y ensaladas, por lo que es un básico en la cocina mexicana. Platillos destacados Uno de los platillos más comunes que tiene como protagonista la cebolla es la tinga, un platillo muy mexicano.", "features_text": "", "specifications_text": "", "benefits_text": "Esta huerta ayuda a aliviar y combatir enfermedades respiratorias y cardiovasculares, también mejora la circulación sanguínea. | x | Promociones | Cerrar | Más información", "details_text": "", "other_sections": "", "sections": {"Descripción": ["Tienen una vida útil relativamente corta, su sabor suave es distintivo de esta variedad.", "Tips y usos", "Son perfectas para comer crudas el asadas, tiene una amplia variedad de usos en guisos, sopas, carnes y ensaladas, por lo que es un básico en la cocina mexicana.", "Platillos destacados", "Uno de los platillos más comunes que tiene como protagonista la cebolla es la tinga, un platillo muy mexicano."], "Beneficios": ["Esta huerta ayuda a aliviar y combatir enfermedades respiratorias y cardiovasculares, también mejora la circulación sanguínea.", "x", "Promociones", "Cerrar", "Más información"]}, "txt_path": "dataset/txt_limpios/109.txt", "html_path": "dataset/paginas_descargadas/109.html", "es_status": "ET", "category_canonical": "cebolla", "decision": "keep", "match_score": 0.6, "reasons": "heuristic_default"}
{"source_id": "71", "title": "BUSCAR PRODUCTOS", "description": "", "breadcrumbs": "Ingresa", "price_raw": "443.0", "currency_raw": "", "url": "", "seller": "Desconocido", "availability": "unknown", "country": "UNKNOWN", "product_name": "BUSCAR PRODUCTOS", "brand": "Ingresa", "reference": "", "unit": "", "price_amount": 443.0, "price_currency": "", "price_symbol": "", "price_text": "443", "price_amount_filled": "443.0", "price_is_imputed": "False", "price_imputation_source": "original", "price_amount_usd": "443.0", "price_amount_usd_filled": "443.0", "fx_rate_local_per_usd": "1.0", "fx_source": "default_1usd", "information_text": "", "description_text": "", "features_text": "", "specifications_text": "", "benefits_text": "", "details_text": "", "other_sections": "", "sections": {}, "txt_path": "dataset/txt_limpios/71.txt", "html_path": "dataset/paginas_descargadas/71.html", "es_status": "EN", "category_canonical": "sin_categoria", "decision": "discard", "match_score": 0.3, "reasons": "no_category_detected"}
{"source_id": "74", "title": "BUSCAR PRODUCTOS", "description": "", "breadcrumbs": "Ingresa", "price_raw": "443.0", "currency_raw": "", "url": "", "seller": "Desconocido", "availability": "unknown", "country": "UNKNOWN", "product_name": "BUSCAR PRODUCTOS", "brand": "Ingresa", "reference": "", "unit": "", "price_amount": 443.0, "price_currency": "", "price_symbol": "", "price_text": "443", "price_amount_filled": "443.0", "price_is_imputed": "False", "price_imputation_source": "original", "price_amount_usd": "443.0", "price_amount_usd_filled": "443.0", "fx_rate_local_per_usd": "1.0", "fx_source": "default_1usd", "information_text": "", "description_text": "", "features_text": "", "specifications_text": "", "benefits_text": "", "details_text": "", "other_sections": "", "sections": {}, "txt_path": "dataset/txt_limpios/74.txt", "html_path": "dataset/paginas_descargadas/74.html", "es_status": "EN", "category_canonical": "sin_categoria", "decision": "discard", "match_score": 0.3, "reasons": "no_category_detected"}
{"source_id": "75", "title": "BUSCAR PRODUCTOS", "description": "", "breadcrumbs": "Ingresa > 100.00 g", "price_raw": "443.0", "currency_raw": "", "url": "", "seller": "Desconocido", "availability": "unknown", "country": "UNKNOWN", "product_name": "BUSCAR PRODUCTOS", "brand": "Ingresa", "reference": "", "unit": "100.00 g", "price_amount": 443.0, "price_currency": "", "price_symbol": "", "price_text": "443", "price_amount_filled": "443.0", "price_is_imputed": "False", "price_imputation_source": "original", "price_amount_usd": "443.0", "price_amount_usd_filled": "443.0", "fx_rate_local_per_usd": "1.0", "fx_source": "default_1usd", "information_text": "", "description_text": "", "features_text": "", "specifications_text": "", "benefits_text": "", "details_text": "", "other_sections": "", "sections": {}, "txt_path": "dataset/txt_limpios/75.txt", "html_path": "dataset/paginas_descargadas/75.html", "es_status": "EN", "category_canonical": "sin_categoria", "decision": "discard", "match_score": 0.3, "reasons": "no_category_detected"}
{"source_id": "76", "title": "BUSCAR PRODUCTOS", "description": "", "breadcrumbs": "Ingresa", "price_raw": "443.0", "currency_raw": "", "url": "", "seller": "Desconocido", "availability": "unknown", "country": "UNKNOWN", "product_name": "BUSCAR PRODUCTOS", "brand": "Ingresa", "reference": "", "unit": "", "price_amount": 443.0, "price_currency": "", "price_symbol": "", "price_text": "443", "price_amount_filled": "443.0", "price_is_imputed": "False", "price_imputation_source": "original", "price_amount_usd": "443.0", "price_amount_usd_filled": "443.0", "fx_rate_local_per_usd": "1.0", "fx_source": "default_1usd", "information_text": "", "description_text": "", "features_text": "", "specifications_text": "", "benefits_text": "", "details_text": "", "other_sections": "", "sections": {}, "txt_path": "dataset/txt_limpios/76.txt", "html_path": "dataset/paginas_descargadas/76.html", "es_status": "EN", "category_canonical": "sin_categoria", "decision": "discard", "match_score": 0.3, "reasons": "no_category_detected"}
{"source_id": "77", "title": "BUSCAR PRODUCTOS", "description": "", "breadcrumbs": "Ingresa", "price_raw": "443.0", "currency_raw": "", "url": "", "seller": "Desconocido", "availability": "unknown", "country": "UNKNOWN", "product_name": "BUSCAR PRODUCTOS", "brand": "Ingresa", "reference": "", "unit": "", "price_amount": 443.0, "price_currency": "", "price_symbol": "", "price_text": "443", "price_amount_filled": "443.0", "price_is_imputed": "False", "price_imputation_source": "original", "price_amount_usd": "443.0", "price_amount_usd_filled": "443.0", "fx_rate_local_per_usd": "1.0", "fx_source": "default_1usd", "information_text": "", "description_text": "", "features_text": "", "specifications_text": "", "benefits_text": "", "details_text": "", "other_sections": "", "sections": {}, "txt_path": "dataset/txt_limpios/77.txt", "html_path": "dataset/paginas_descargadas/77.html", "es_status": "EN", "category_canonical": "sin_categoria", "decision": "discard", "match_score": 0.3, "reasons": "no_category_detected"}
{"source_id": "78", "title": "BUSCAR PRODUCTOS", "description": "", "breadcrumbs": "Ingresa", "price_raw": "443.0", "currency_raw": "", "url": "", "seller": "Desconocido", "availability": "unknown", "country": "UNKNOWN", "product_name": "BUSCAR PRODUCTOS", "brand": "Ingresa", "reference": "", "unit": "", "price_amount": 443.0, "price_currency": "", "price_symbol": "", "price_text": "443", "price_amount_filled": "443.0", "price_is_imputed": "False", "price_imputation_source": "original", "price_amount_usd": "443.0", "price_amount_usd_filled": "443.0", "fx_rate_local_per_usd": "1.0", "fx_source": "default_1usd", "information_text": "", "description_text": "", "features_text": "", "specifications_text": "", "benefits_text": "", "details_text": "", "other_sections": "", "sections": {}, "txt_path": "dataset/txt_limpios/78.txt", "html_path": "dataset/paginas_descargadas/78.html", "es_status": "EN", "category_canonical": "sin_categoria", "decision": "discard", "match_score": 0.3, "reasons": "no_category_detected"}
{"source_id": "79", "title": "BUSCAR PRODUCTOS", "description": "", "breadcrumbs": "Ingresa", "price_raw": "28.7", "currency_raw": "", "url": "", "seller": "Desconocido", "availability": "unknown", "country": "UNKNOWN", "product_name": "BUSCAR PRODUCTOS", "brand": "Ingresa", "reference": "", "unit": "", "price_amount": 28.7, "price_currency": "", "price_symbol": "$", "price_text": "$28.70", "price_amount_filled": "28.7", "price_is_imputed": "False", "price_imputation_source": "original", "price_amount_usd": "28.7", "price_amount_usd_filled": "28.7", "fx_rate_local_per_usd": "1.0", "fx_source": "default_1usd", "information_text": "", "description_text": "", "features_text": "", "specifications_text": "", "benefits_text": "", "details_text": "", "other_sections": "", "sections": {}, "txt_path": "dataset/txt_limpios/79.txt", "html_path": "dataset/paginas_descargadas/79.html", "es_status": "EN", "category_canonical": "sin_categoria", "decision": "discard", "match_score": 0.3, "reasons": "no_category_detected"}
{"source_id": "80", "title": "BUSCAR PRODUCTOS", "description": "", "breadcrumbs": "Ingresa > 100.00 ml", "price_raw": "443.0", "currency_raw": "", "url": "", "seller": "Desconocido", "availability": "unknown", "country": "UNKNOWN", "product_name": "BUSCAR PRODUCTOS", "brand": "Ingresa", "reference": "", "unit": "100.00 ml", "price_amount": 443.0, "price_currency": "", "price_symbol": "", "price_text": "443", "price_amount_filled": "443.0", "price_is_imputed": "False", "price_imputation_source": "original", "price_amount_usd": "443.0", "price_amount_usd_filled": "443.0", "fx_rate_local_per_usd": "1.0", "fx_source": "default_1usd", "information_text": "", "description_text": "", "features_text": "", "specifications_text": "", "benefits_text": "", "details_text": "", "other_sections": "", "sections": {}, "txt_path": "dataset/txt_limpios/80.txt", "html_path": "dataset/paginas_descargadas/80.html", "es_status": "EN", "category_canonical": "sin_categoria", "decision": "discard", "match_score": 0.3, "reasons": "no_category_detected"}
{"source_id": "81", "title": "BUSCAR PRODUCTOS", "description": "Es fuente de ácidos grasos esenciales y vitamina Y, componente importante en la alimentación diaria. | INGREDIENTES | DECLARACIÓN NUTRIMENTAL | Contenido energético por envase 6 620 kcal (27 230 kJ) Tamaño de porción 100 ML Porciones por envase 8 Contenido energético 828 kcal (3 404 kJ) Proteínas 0 G Grasas totales 92 G Grasas saturadas 16 G Grasas trans 545 MG Hidratos de carbono disponibles 0 G Azúcar 0 G Azúcar añadido 0 G Fibra dietética 0 G Sodio 0 MG | x | Promociones | Cerrar | Más información", "breadcrumbs": "Ingresa > 800 ML", "price_raw": "443.0", "currency_raw": "", "url": "", "seller": "Desconocido", "availability": "unknown", "country": "UNKNOWN", "product_name": "BUSCAR PRODUCTOS", "brand": "Ingresa", "reference": "", "unit": "800 ML", "price_amount": 443.0, "price_currency": "", "price_symbol": "", "price_text": "443", "price_amount_filled": "443.0", "price_is_imputed": "False", "price_imputation_source": "original", "price_amount_usd": "443.0", "price_amount_usd_filled": "443.0", "fx_rate_local_per_usd": "1.0", "fx_source": "default_1usd", "information_text": "", "description_text": "", "features_text": "", "specifications_text": "", "benefits_text": "Es fuente de ácidos grasos esenciales y vitamina Y, componente importante en la alimentación diaria. | INGREDIENTES | DECLARACIÓN NUTRIMENTAL | Contenido energético por envase 6 620 kcal (27 230 kJ) Tamaño de porción 100 ML Porciones por envase 8 Contenido energético 828 kcal (3 404 kJ) Proteínas 0 G Grasas totales 92 G Grasas saturadas 16 G Grasas trans 545 MG Hidratos de carbono disponibles 0 G Azúcar 0 G Azúcar añadido 0 G Fibra dietética 0 G Sodio 0 MG | x | Promociones | Cerrar | Más información", "details_text": "", "other_sections": "", "sections": {"Beneficios": ["Es fuente de ácidos grasos esenciales y vitamina Y, componente importante en la alimentación diaria.", "INGREDIENTES", "DECLARACIÓN NUTRIMENTAL", "Contenido energético por envase 6 620 kcal (27 230 kJ) Tamaño de porción 100 ML Porciones por envase 8 Contenido energético 828 kcal (3 404 kJ) Proteínas 0 G Grasas totales 92 G Grasas saturadas 16 G Grasas trans 545 MG Hidratos de carbono disponibles 0 G Azúcar 0 G Azúcar añadido 0 G Fibra dietética 0 G Sodio 0 MG", "x", "Promociones", "Cerrar", "Más información"]}, "txt_path": "dataset/txt_limpios/81.txt", "html_path": "dataset/paginas_descargadas/81.html", "es_status": "ET", "category_canonical": "azucar", "decision": "keep", "match_score": 0.6, "reasons": "heuristic_default"}
{"source_id": "82", "title": "BUSCAR PRODUCTOS", "description": "", "breadcrumbs": "Ingresa", "price_raw": "443.0", "currency_raw": "", "url": "", "seller": "Desconocido", "availability": "unknown", "country": "UNKNOWN", "product_name": "BUSCAR PRODUCTOS", "brand": "Ingresa", "reference": "", "unit": "", "price_amount": 443.0, "price_currency": "", "price_symbol": "", "price_text": "443", "price_amount_filled": "443.0", "price_is_imputed": "False", "price_imputation_source": "original", "price_amount_usd": "443.0", "price_amount_usd_filled": "443.0", "fx_rate_local_per_usd": "1.0", "fx_source": "default_1usd", "information_text": "", "description_text": "", "features_text": "", "specifications_text": "", "benefits_text": "", "details_text": "", "other_sections": "", "sections": {}, "txt_path": "dataset/txt_limpios/82.txt", "html_path": "dataset/paginas_descargadas/82.html", "es_status": "EN", "category_canonical": "sin_categoria", "decision": "discard", "match_score": 0.3, "reasons": "no_category_detected"}
{"source_id": "83", "title": "BUSCAR PRODUCTOS", "description": "", "breadcrumbs": "Ingresa > 100.00 ml", "price_raw": "443.0", "currency_raw": "", "url": "", "seller": "Desconocido", "availability": "unknown", "country": "UNKNOWN", "product_name": "BUSCAR PRODUCTOS", "brand": "Ingresa", "reference": "", "unit": "100.00 ml", "price_amount": 443.0, "price_currency": "", "price_symbol": "", "price_text": "443", "price_amount_filled": "443.0", "price_is_imputed": "False", "price_imputation_source": "original", "price_amount_usd": "443.0", "price_amount_usd_filled": "443.0", "fx_rate_local_per_usd": "1.0", "fx_source": "default_1usd", "information_text": "", "description_text": "", "features_text": "", "specifications_text": "", "benefits_text": "", "details_text": "", "other_sections": "", "sections": {}, "txt_path": "dataset/txt_limpios/83.txt", "html_path": "dataset/paginas_descargadas/83.html", "es_status": "EN", "category_canonical": "sin_categoria", "decision": "discard", "match_score": 0.3, "reasons": "no_category_detected"}
{"source_id": "84", "title": "BUSCAR PRODUCTOS", "description": "", "breadcrumbs": "Ingresa > 240.00 g", "price_raw": "443.0", "currency_raw": "", "url": "", "seller": "Desconocido", "availability": "unknown", "country": "UNKNOWN", "product_name": "BUSCAR PRODUCTOS", "brand": "Ingresa", "reference": "", "unit": "240.00 g", "price_amount": 443.0, "price_currency": "", "price_symbol": "", "price_text": "443", "price_amount_filled": "443.0", "price_is_imputed": "False", "price_imputation_source": "original", "price_amount_usd": "443.0", "price_amount_usd_filled": "443.0", "fx_rate_local_per_usd": "1.0", "fx_source": "default_1usd", "information_text": "", "description_text": "", "features_text": "", "specifications_text": "", "benefits_text": "", "details_text": "", "other_sections": "", "sections": {}, "txt_path": "dataset/txt_limpios/84.txt", "html_path": "dataset/paginas_descargadas/84.html", "es_status": "EN", "category_canonical": "sin_categoria", "decision": "discard", "match_score": 0.3, "reasons": "no_category_detected"}
{"source_id": "85", "title": "BUSCAR PRODUCTOS", "description": "", "breadcrumbs": "Ingresa", "price_raw": "443.0", "currency_raw": "", "url": "", "seller": "Desconocido", "availability": "unknown", "country": "UNKNOWN", "product_name": "BUSCAR PRODUCTOS", "brand": "Ingresa", "reference": "", "unit": "", "price_amount": 443.0, "price_currency": "", "price_symbol": "", "price_text": "443", "price_amount_filled": "443.0", "price_is_imputed": "False", "price_imputation_source": "original", "price_amount_usd": "443.0", "price_amount_usd_filled": "443.0", "fx_rate_local_per_usd": "1.0", "fx_source": "default_1usd", "information_text": "", "description_text": "", "features_text": "", "specifications_text": "", "benefits_text": "", "details_text": "", "other_sections": "", "sections": {}, "txt_path": "dataset/txt_limpios/85.txt", "html_path": "dataset/paginas_descargadas/85.html", "es_status": "EN", "category_canonical": "sin_categoria", "decision": "discard", "match_score": 0.3, "reasons": "no_category_detected"}
{"source_id": "86", "title": "BUSCAR PRODUCTOS", "description": "", "breadcrumbs": "Ingresa", "price_raw": "443.0", "currency_raw": "", "url": "", "seller": "Desconocido", "availability": "unknown", "country": "UNKNOWN", "product_name": "BUSCAR PRODUCTOS", "brand": "Ingresa", "reference": "", "unit": "", "price_amount": 443.0, "price_currency": "", "price_symbol": "", "price_text": "443", "price_amount_filled": "443.0", "price_is_imputed": "False", "price_imputation_source": "original", "price_amount_usd": "443.0", "price_amount_usd_filled": "443.0", "fx_rate_local_per_usd": "1.0", "fx_source": "default_1usd", "information_text": "", "description_text": "", "features_text": "", "specifications_text": "", "benefits_text": "", "details_text": "", "other_sections": "", "sections": {}, "txt_path": "dataset/txt_limpios/86.txt", "html_path": "dataset/paginas_descargadas/86.html", "es_status": "EN", "category_canonical": "sin_categoria", "decision": "discard", "match_score": 0.3, "reasons": "no_category_detected"}
{"source_id": "87", "title": "BUSCAR PRODUCTOS", "description": "", "breadcrumbs": "Ingresa > 1 LT", "price_raw": "443.0", "currency_raw": "", "url": "", "seller": "Desconocido", "availability": "unknown", "country": "UNKNOWN", "product_name": "BUSCAR PRODUCTOS", "brand": "Ingresa", "reference": "", "unit": "1 LT", "price_amount": 443.0, "price_currency": "", "price_symbol": "", "price_text": "443", "price_amount_filled": "443.0", "price_is_imputed": "False", "price_imputation_source": "original", "price_amount_usd": "443.0", "price_amount_usd_filled": "443.0", "fx_rate_local_per_usd": "1.0", "fx_source": "default_1usd", "information_text": "", "description_text": "", "features_text": "", "specifications_text": "", "benefits_text": "", "details_text": "", "other_sections": "", "sections": {}, "txt_path": "dataset/txt_limpios/87.txt", "html_path": "dataset/paginas_descargadas/87.html", "es_status": "EN", "category_canonical": "sin_categoria", "decision": "discard", "match_score": 0.3, "reasons": "no_category_detected"}
{"source_id": "88", "title": "BUSCAR PRODUCTOS", "description": "", "breadcrumbs": "Ingresa", "price_raw": "443.0", "currency_raw": "", "url": "", "seller": "Desconocido", "availability": "unknown", "country": "UNKNOWN", "product_name": "BUSCAR PRODUCTOS", "brand": "Ingresa", "reference": "", "unit": "", "price_amount": 443.0, "price_currency": "", "price_symbol": "", "price_text": "443", "price_amount_filled": "443.0", "price_is_imputed": "False", "price_imputation_source": "original", "price_amount_usd": "443.0", "price_amount_usd_filled": "443.0", "fx_rate_local_per_usd": "1.0", "fx_source": "default_1usd", "information_text": "", "description_text": "", "features_text": "", "specifications_text": "", "benefits_text": "", "details_text": "", "other_sections": "", "sections": {}, "txt_path": "dataset/txt_limpios/88.txt", "html_path": "dataset/paginas_descargadas/88.html", "es_status": "EN", "category_canonical": "sin_categoria", "decision": "discard", "match_score": 0.3, "reasons": "no_category_detected"}
{"source_id": "89", "title": "BUSCAR PRODUCTOS", "description": "", "breadcrumbs": "Ingresa", "price_raw": "443.0", "currency_raw": "", "url": "", "seller": "Desconocido", "availability": "unknown", "country": "UNKNOWN", "product_name": "BUSCAR PRODUCTOS", "brand": "Ingresa", "reference": "", "unit": "", "price_amount": 443.0, "price_currency": "", "price_symbol": "", "price_text": "443", "price_amount_filled": "443.0", "price_is_imputed": "False", "price_imputation_source": "original", "price_amount_usd": "443.0", "price_amount_usd_filled": "443.0", "fx_rate_local_per_usd": "1.0", "fx_source": "default_1usd", "information_text": "", "description_text": "", "features_text": "", "specifications_text": "", "benefits_text": "", "details_text": "", "other_sections": "", "sections": {}, "txt_path": "dataset/txt_limpios/89.txt", "html_path": "dataset/paginas_descargadas/89.html", "es_status": "EN", "category_canonical": "sin_categoria", "decision": "discard", "match_score": 0.3, "reasons": "no_category_detected"}
