source_id,title,description,breadcrumbs,price_raw,currency_raw,url,seller,availability,country,product_name,brand,reference,unit,price_amount,price_currency,price_symbol,price_text,price_amount_filled,price_is_imputed,price_imputation_source,price_amount_usd,price_amount_usd_filled,fx_rate_local_per_usd,fx_source,information_text,description_text,features_text,specifications_text,benefits_text,details_text,other_sections,sections,txt_path,html_path,es_status,category_canonical,decision,match_score,reasons
676,"ASESORAMOS TU COMPRA: 📞(601) 6672004, lun a sab de 7am.a 7pm dom hasta las 6pm","Buena fuente de proteina y calcio con un sabor inigualable. Combinala con cereales, pasteles, galletas y más. Este producto es vendido, facturado y entregado por Cencosud - Colombia Los precios de los productos pueden cambiar dependiendo de la región. Aplican Términos y Condiciones Desactivados Referencia: 3509862 $ 3 , 82 x ml COLANTA ★ (1) ¿Todavía tienes tu Tarjeta Cencosud? Solicítala en línea, úsala y obtén un . Aplican términos y condiciones. Solicítala aquí Mejores ofertas -28% Términos más buscados 1. kefir alpina 2. muebles 3. 4. leche alqueria 5. san jorge 6. papel higienico 7. arroz 8. café 9. cerveza 10. neveras",otras ciudades consulta aquí > 3509862,22.89,COP,,Desconocido,unknown,CO,"ASESORAMOS TU COMPRA: 📞(601) 6672004, lun a sab de 7am.a 7pm dom hasta las 6pm",otras ciudades consulta aquí,3509862.0,,22.89,COP,$,$22.89,22.89,False,original,0.0057,0.0057,4047.0,from_colombia_cambio_dolar,,"Buena fuente de proteina y calcio con un sabor inigualable. Combinala con cereales, pasteles, galletas y más. Este producto es vendido, facturado y entregado por Cencosud - Colombia Los precios de los productos pueden cambiar dependiendo de la región. Aplican Términos y Condiciones Desactivados Referencia: 3509862 $ 3 , 82 x ml COLANTA ★ (1) ¿Todavía tienes tu Tarjeta Cencosud? Solicítala en línea, úsala y obtén un . Aplican términos y condiciones. Solicítala aquí Mejores ofertas -28% Términos más buscados 1. kefir alpina 2. muebles 3. 4. leche alqueria 5. san jorge 6. papel higienico 7. arroz 8. café 9. cerveza 10. neveras",,,,,,"{""Descripción"": [""Buena fuente de proteina y calcio con un sabor inigualable. Combinala con cereales, pasteles, galletas y más."", ""Este producto es vendido, facturado y entregado por"", ""Cencosud - Colombia"", ""Los precios de los productos pueden cambiar dependiendo de la región."", ""Aplican Términos y Condiciones"", ""Desactivado"", ""Referencia: 3509862"", ""$"", ""3"", "","", ""82"", ""x"", ""ml"", ""COLANTA"", ""★"", ""(1)"", ""¿Todavía tienes tu Tarjeta Cencosud?"", ""Solicítala en línea, úsala y obtén un"", "". Aplican términos y condiciones."", ""Solicítala aquí"", ""Mejores ofertas"", ""-28%"", ""Términos más buscados"", ""1."", ""kefir alpina"", ""2."", ""muebles"", ""3."", ""4."", ""leche alqueria"", ""5."", ""san jorge"", ""6."", ""papel higienico"", ""7."", ""arroz"", ""8."", ""cafe"", ""9."", ""cerveza"", ""10."", ""neveras""]}",dataset/txt_limpios/676.txt,dataset/paginas_descargadas/676.html,ET,cafe,keep,0.60,heuristic_default
677,"ASESORAMOS TU COMPRA: 📞(601) 6672004, lun a sab de 7am.a 7pm dom hasta las 6pm",,otras ciudades consulta aquí,,COP,,Desconocido,unknown,CO,"ASESORAMOS TU COMPRA: 📞(601) 6672004, lun a sab de 7am.a 7pm dom hasta las 6pm",otras ciudades consulta aquí,,,,COP,,,100.78,True,country_mean,,0.0249,4047.0,from_colombia_cambio_dolar,,,,,,,,{},dataset/txt_limpios/677.txt,dataset/paginas_descargadas/677.html,ET,sin_categoria,discard,0.30,no_category_detected;price_parse_failed
678,"ASESORAMOS TU COMPRA: 📞(601) 6672004, lun a sab de 7am.a 7pm dom hasta las 6pm","Disfruta de su rico sabor y combinala con lo que más te guste. Este producto es vendido, facturado y entregado por Cencosud - Colombia Los precios de los productos pueden cambiar dependiendo de la región. Aplican Términos y Condiciones Desactivados Referencia: 0906769 $ 4 , 11 x ml MAXIMA MP ☆ ¿Todavía tienes tu Tarjeta Cencosud? Solicítala en línea, úsala y obtén un . Aplican términos y condiciones. Solicítala aquí Términos más buscados 1. kefir alpina 2. muebles 3. 4. leche alqueria 5. san jorge 6. papel higienico 7. arroz 8. café 9. cerveza 10. neveras",otras ciudades consulta aquí > 0906769,3.7,COP,,Desconocido,unknown,CO,"ASESORAMOS TU COMPRA: 📞(601) 6672004, lun a sab de 7am.a 7pm dom hasta las 6pm",otras ciudades consulta aquí,906769.0,,3.70,COP,$,$3.70,3.7,False,original,0.0009,0.0009,4047.0,from_colombia_cambio_dolar,,"Disfruta de su rico sabor y combinala con lo que más te guste. Este producto es vendido, facturado y entregado por Cencosud - Colombia Los precios de los productos pueden cambiar dependiendo de la región. Aplican Términos y Condiciones Desactivados Referencia: 0906769 $ 4 , 11 x ml MAXIMA MP ☆ ¿Todavía tienes tu Tarjeta Cencosud? Solicítala en línea, úsala y obtén un . Aplican términos y condiciones. Solicítala aquí Términos más buscados 1. kefir alpina 2. muebles 3. 4. leche alqueria 5. san jorge 6. papel higienico 7. arroz 8. café 9. cerveza 10. neveras",,,,,,"{""Descripción"": [""Disfruta de su rico sabor y combinala con lo que más te guste."", ""Este producto es vendido, facturado y entregado por"", ""Cencosud - Colombia"", ""Los precios de los productos pueden cambiar dependiendo de la región."", ""Aplican Términos y Condiciones"", ""Desactivado"", ""Referencia: 0906769"", ""$"", ""4"", "","", ""11"", ""x"", ""ml"", ""MAXIMA MP"", ""☆"", ""¿Todavía tienes tu Tarjeta Cencosud?"", ""Solicítala en línea, úsala y obtén un"", "". Aplican términos y condiciones."", ""Solicítala aquí"", ""Términos más buscados"", ""1."", ""kefir alpina"", ""2."", ""muebles"", ""3."", ""4."", ""leche alqueria"", ""5."", ""san jorge"", ""6."", ""papel higienico"", ""7."", ""arroz"", ""8."", ""cafe"", ""9."", ""cerveza"", ""10."", ""neveras""]}",dataset/txt_limpios/678.txt,dataset/paginas_descargadas/678.html,ET,cafe,keep,0.60,heuristic_default
679,"ASESORAMOS TU COMPRA: 📞(601) 6672004, lun a sab de 7am.a 7pm dom hasta las 6pm","Disfruta con tu familia y amigos todas las deliciosas recetas, que puedes preparar con los productos que encuentras en nuestras tienda jumbo .com Este producto es vendido, facturado y entregado por Cencosud - Colombia Los precios de los productos pueden cambiar dependiendo de la región. Aplican Términos y Condiciones Desactivados Referencia: 0000259 $ 9, 98 x gr CENCOSUD ☆ ¿Todavía tienes tu Tarjeta Cencosud? Solicítala en línea, úsala y obtén un . Aplican términos y condiciones. Solicítala aquí Términos más buscados 1. kefir alpina 2. muebles 3. leche 4. leche alqueria 5. san jorge 6. papel higiénico 7. arroz 8. café 9. cerveza 10. neveras",otras ciudades consulta aquí > 500gr > 0000259,4.99,COP,,Desconocido,unknown,CO,"ASESORAMOS TU COMPRA: 📞(601) 6672004, lun a sab de 7am.a 7pm dom hasta las 6pm",otras ciudades consulta aquí,259.0,500gr,4.99,COP,$,$4.99,4.99,False,original,0.0012,0.0012,4047.0,from_colombia_cambio_dolar,,"Disfruta con tu familia y amigos todas las deliciosas recetas, que puedes preparar con los productos que encuentras en nuestras tienda jumbo .com Este producto es vendido, facturado y entregado por Cencosud - Colombia Los precios de los productos pueden cambiar dependiendo de la región. Aplican Términos y Condiciones Desactivados Referencia: 0000259 $ 9, 98 x gr CENCOSUD ☆ ¿Todavía tienes tu Tarjeta Cencosud? Solicítala en línea, úsala y obtén un . Aplican términos y condiciones. Solicítala aquí Términos más buscados 1. kefir alpina 2. muebles 3. leche 4. leche alqueria 5. san jorge 6. papel higiénico 7. arroz 8. café 9. cerveza 10. neveras",,,,,,"{""Descripción"": [""Disfruta con tu familia y amigos todas las deliciosas recetas, que puedes preparar con los productos que encuentras en nuestras tienda jumbo .com"", ""Este producto es vendido, facturado y entregado por"", ""Cencosud - Colombia"", ""Los precios de los productos pueden cambiar dependiendo de la región."", ""Aplican Términos y Condiciones"", ""Desactivado"", ""Referencia: 0000259"", ""$"", ""9"", "","", ""98"", ""x"", ""gr"", ""CENCOSUD"", ""☆"", ""¿Todavía tienes tu Tarjeta Cencosud?"", ""Solicítala en línea, úsala y obtén un"", "". Aplican términos y condiciones."", ""Solicítala aquí"", ""Términos más buscados"", ""1."", ""kefir alpina"", ""2."", ""muebles"", ""3."", ""leche"", ""4."", ""leche alqueria"", ""5."", ""san jorge"", ""6."", ""papel higienico"", ""7."", ""arroz"", ""8."", ""cafe"", ""9."", ""cerveza"", ""10."", ""neveras""]}",dataset/txt_limpios/679.txt,dataset/paginas_descargadas/679.html,ET,cafe,keep,0.60,heuristic_default
680,"ASESORAMOS TU COMPRA: 📞(601) 6672004, lun a sab de 7am.a 7pm dom hasta las 6pm","Disfruta con tu familia y amigos todas las deliciosas recetas, que puedes preparar con los productos que encuentras en nuestras tienda jumbo .com Este producto es vendido, facturado y entregado por Cencosud - Colombia Los precios de los productos pueden cambiar dependiendo de la región. Aplican Términos y Condiciones Desactivados Referencia: 0002432 $ 5 x gr A GRANEL ★ ☆ (3) ¿Todavía tienes tu Tarjeta Cencosud? Solicítala en línea, úsala y obtén un . Aplican términos y condiciones. Solicítala aquí Términos más buscados 1. kefir alpina 2. muebles 3. leche 4. leche alqueria 5. san jorge 6. papel higiénico 7. arroz 8. café 9. cerveza 10. neveras",otras ciudades consulta aquí > 500gr > 0002432,2.5,COP,,Desconocido,unknown,CO,"ASESORAMOS TU COMPRA: 📞(601) 6672004, lun a sab de 7am.a 7pm dom hasta las 6pm",otras ciudades consulta aquí,2432.0,500gr,2.50,COP,$,$2.50,2.5,False,original,0.0006,0.0006,4047.0,from_colombia_cambio_dolar,,"Disfruta con tu familia y amigos todas las deliciosas recetas, que puedes preparar con los productos que encuentras en nuestras tienda jumbo .com Este producto es vendido, facturado y entregado por Cencosud - Colombia Los precios de los productos pueden cambiar dependiendo de la región. Aplican Términos y Condiciones Desactivados Referencia: 0002432 $ 5 x gr A GRANEL ★ ☆ (3) ¿Todavía tienes tu Tarjeta Cencosud? Solicítala en línea, úsala y obtén un . Aplican términos y condiciones. Solicítala aquí Términos más buscados 1. kefir alpina 2. muebles 3. leche 4. leche alqueria 5. san jorge 6. papel higiénico 7. arroz 8. café 9. cerveza 10. neveras",,,,,,"{""Descripción"": [""Disfruta con tu familia y amigos todas las deliciosas recetas, que puedes preparar con los productos que encuentras en nuestras tienda jumbo .com"", ""Este producto es vendido, facturado y entregado por"", ""Cencosud - Colombia"", ""Los precios de los productos pueden cambiar dependiendo de la región."", ""Aplican Términos y Condiciones"", ""Desactivado"", ""Referencia: 0002432"", ""$"", ""5"", ""x"", ""gr"", ""A GRANEL"", ""★"", ""☆"", ""(3)"", ""¿Todavía tienes tu Tarjeta Cencosud?"", ""Solicítala en línea, úsala y obtén un"", "". Aplican términos y condiciones."", ""Solicítala aquí"", ""Términos más buscados"", ""1."", ""kefir alpina"", ""2."", ""muebles"", ""3."", ""leche"", ""4."", ""leche alqueria"", ""5."", ""san jorge"", ""6."", ""papel higienico"", ""7."", ""arroz"", ""8."", ""cafe"", ""9."", ""cerveza"", ""10."", ""neveras""]}",dataset/txt_limpios/680.txt,dataset/paginas_descargadas/680.html,ET,cafe,keep,0.60,heuristic_default
681,"ASESORAMOS TU COMPRA: 📞(601) 6672004, lun a sab de 7am.a 7pm dom hasta las 6pm","Este producto es vendido, facturado y entregado por Cencosud - Colombia Los precios de los productos pueden cambiar dependiendo de la región. Aplican Términos y Condiciones Desactivados Referencia: 0821572 $ 19, 49 x gr DISTRIBUIDORA DE ALIMENTOS NO ☆ ¿Todavía tienes tu Tarjeta Cencosud? Solicítala en línea, úsala y obtén un . Aplican términos y condiciones. Solicítala aquí Términos más buscados 1. kefir alpina 2. muebles 3. leche 4. leche alqueria 5. san jorge 6. papel higiénico 7. arroz 8. café 9. cerveza 10. neveras",otras ciudades consulta aquí > 1000 gr > 0821572,19.49,COP,,Desconocido,unknown,CO,"ASESORAMOS TU COMPRA: 📞(601) 6672004, lun a sab de 7am.a 7pm dom hasta las 6pm",otras ciudades consulta aquí,821572.0,1000 gr,19.49,COP,$,$19.49,19.49,False,original,0.0048,0.0048,4047.0,from_colombia_cambio_dolar,,"Este producto es vendido, facturado y entregado por Cencosud - Colombia Los precios de los productos pueden cambiar dependiendo de la región. Aplican Términos y Condiciones Desactivados Referencia: 0821572 $ 19, 49 x gr DISTRIBUIDORA DE ALIMENTOS NO ☆ ¿Todavía tienes tu Tarjeta Cencosud? Solicítala en línea, úsala y obtén un . Aplican términos y condiciones. Solicítala aquí Términos más buscados 1. kefir alpina 2. muebles 3. leche 4. leche alqueria 5. san jorge 6. papel higiénico 7. arroz 8. café 9. cerveza 10. neveras",,,,,,"{""Descripción"": [""Este producto es vendido, facturado y entregado por"", ""Cencosud - Colombia"", ""Los precios de los productos pueden cambiar dependiendo de la región."", ""Aplican Términos y Condiciones"", ""Desactivado"", ""Referencia: 0821572"", ""$"", ""19"", "","", ""49"", ""x"", ""gr"", ""DISTRIBUIDORA DE ALIMENTOS NO"", ""☆"", ""¿Todavía tienes tu Tarjeta Cencosud?"", ""Solicítala en línea, úsala y obtén un"", "". Aplican términos y condiciones."", ""Solicítala aquí"", ""Términos más buscados"", ""1."", ""kefir alpina"", ""2."", ""muebles"", ""3."", ""leche"", ""4."", ""leche alqueria"", ""5."", ""san jorge"", ""6."", ""papel higienico"", ""7."", ""arroz"", ""8."", ""cafe"", ""9."", ""cerveza"", ""10."", ""neveras""]}",dataset/txt_limpios/681.txt,dataset/paginas_descargadas/681.html,ET,cafe,keep,0.60,heuristic_default
682,"ASESORAMOS TU COMPRA: 📞(601) 6672004, lun a sab de 7am.a 7pm dom hasta las 6pm","Disfruta de una deliciosa fruta ideal para alimentar tu cuerpo con propiedades de gran beneficio. Este producto es vendido, facturado y entregado por Cencosud - Colombia Los precios de los productos pueden cambiar dependiendo de la región. Aplican Términos y Condiciones Desactivados Referencia: 0011567 $ 3 , 68 x gr CENCOSUD ☆ ¿Todavía tienes tu Tarjeta Cencosud? Solicítala en línea, úsala y obtén un . Aplican términos y condiciones. Solicítala aquí Términos más buscados 1. kefir alpina 2. muebles 3. leche 4. leche alqueria 5. san jorge 6. papel higiénico 7. arroz 8. café 9. cerveza 10. neveras",otras ciudades consulta aquí > 500 gr > 0011567,1.84,COP,,Desconocido,unknown,CO,"ASESORAMOS TU COMPRA: 📞(601) 6672004, lun a sab de 7am.a 7pm dom hasta las 6pm",otras ciudades consulta aquí,11567.0,500 gr,1.84,COP,$,$1.84,1.84,False,original,0.0005,0.0005,4047.0,from_colombia_cambio_dolar,,"Disfruta de una deliciosa fruta ideal para alimentar tu cuerpo con propiedades de gran beneficio. Este producto es vendido, facturado y entregado por Cencosud - Colombia Los precios de los productos pueden cambiar dependiendo de la región. Aplican Términos y Condiciones Desactivados Referencia: 0011567 $ 3 , 68 x gr CENCOSUD ☆ ¿Todavía tienes tu Tarjeta Cencosud? Solicítala en línea, úsala y obtén un . Aplican términos y condiciones. Solicítala aquí Términos más buscados 1. kefir alpina 2. muebles 3. leche 4. leche alqueria 5. san jorge 6. papel higiénico 7. arroz 8. café 9. cerveza 10. neveras",,,,,,"{""Descripción"": [""Disfruta de una deliciosa fruto ideal para alimentar tu cuerpo con propiedades de gran beneficio."", ""Este producto es vendido, facturado y entregado por"", ""Cencosud - Colombia"", ""Los precios de los productos pueden cambiar dependiendo de la región."", ""Aplican Términos y Condiciones"", ""Desactivado"", ""Referencia: 0011567"", ""$"", ""3"", "","", ""68"", ""x"", ""gr"", ""CENCOSUD"", ""☆"", ""¿Todavía tienes tu Tarjeta Cencosud?"", ""Solicítala en línea, úsala y obtén un"", "". Aplican términos y condiciones."", ""Solicítala aquí"", ""Términos más buscados"", ""1."", ""kefir alpina"", ""2."", ""muebles"", ""3."", ""leche"", ""4."", ""leche alqueria"", ""5."", ""san jorge"", ""6."", ""papel higienico"", ""7."", ""arroz"", ""8."", ""cafe"", ""9."", ""cerveza"", ""10."", ""neveras""]}",dataset/txt_limpios/682.txt,dataset/paginas_descargadas/682.html,ET,cafe,keep,0.60,heuristic_default
683,"ASESORAMOS TU COMPRA: 📞(601) 6672004, lun a sab de 7am.a 7pm dom hasta las 6pm","Consume estos deliciosos frutos secos el emplealos para acompañar tus preparaciones favoritas, aprovecha los beneficios que estos brindan a tu cuerpo y pidelo ahora en tiendasjumbo.co Este producto es vendido, facturado y entregado por Cencosud - Colombia Los precios de los productos pueden cambiar dependiendo de la región. Aplican Términos y Condiciones Desactivados Referencia: 0786758 $ 59 , 9 x gr INSUALIMENTOS ☆ ¿Todavía tienes tu Tarjeta Cencosud? Solicítala en línea, úsala y obtén un . Aplican términos y condiciones. Solicítala aquí Términos más buscados 1. kefir alpina 2. muebles 3. leche 4. leche alqueria 5. san jorge 6. papel higiénico 7. arroz 8. café 9. cerveza 10. neveras",otras ciudades consulta aquí > 200 gr > 0786758,11.98,COP,,Desconocido,unknown,CO,"ASESORAMOS TU COMPRA: 📞(601) 6672004, lun a sab de 7am.a 7pm dom hasta las 6pm",otras ciudades consulta aquí,786758.0,200 gr,11.98,COP,$,$11.98,11.98,False,original,0.003,0.003,4047.0,from_colombia_cambio_dolar,,"Consume estos deliciosos frutos secos el emplealos para acompañar tus preparaciones favoritas, aprovecha los beneficios que estos brindan a tu cuerpo y pidelo ahora en tiendasjumbo.co Este producto es vendido, facturado y entregado por Cencosud - Colombia Los precios de los productos pueden cambiar dependiendo de la región. Aplican Términos y Condiciones Desactivados Referencia: 0786758 $ 59 , 9 x gr INSUALIMENTOS ☆ ¿Todavía tienes tu Tarjeta Cencosud? Solicítala en línea, úsala y obtén un . Aplican términos y condiciones. Solicítala aquí Términos más buscados 1. kefir alpina 2. muebles 3. leche 4. leche alqueria 5. san jorge 6. papel higiénico 7. arroz 8. café 9. cerveza 10. neveras",,,,,,"{""Descripción"": [""Consume estos deliciosos frutos secos o emplealos para acompañar tus preparaciones favoritas, aprovecha los beneficios que estos brindan a tu cuerpo y pidelo ahora en tiendasjumbo.co"", ""Este producto es vendido, facturado y entregado por"", ""Cencosud - Colombia"", ""Los precios de los productos pueden cambiar dependiendo de la región."", ""Aplican Términos y Condiciones"", ""Desactivado"", ""Referencia: 0786758"", ""$"", ""59"", "","", ""9"", ""x"", ""gr"", ""INSUALIMENTOS"", ""☆"", ""¿Todavía tienes tu Tarjeta Cencosud?"", ""Solicítala en línea, úsala y obtén un"", "". Aplican términos y condiciones."", ""Solicítala aquí"", ""Términos más buscados"", ""1."", ""kefir alpina"", ""2."", ""muebles"", ""3."", ""leche"", ""4."", ""leche alqueria"", ""5."", ""san jorge"", ""6."", ""papel higienico"", ""7."", ""arroz"", ""8."", ""cafe"", ""9."", ""cerveza"", ""10."", ""neveras""]}",dataset/txt_limpios/683.txt,dataset/paginas_descargadas/683.html,ET,cafe,keep,0.60,heuristic_default
684,"ASESORAMOS TU COMPRA: 📞(601) 6672004, lun a sab de 7am.a 7pm dom hasta las 6pm",,otras ciudades consulta aquí > 500gr > 0002429,3.29,COP,,Desconocido,unknown,CO,"ASESORAMOS TU COMPRA: 📞(601) 6672004, lun a sab de 7am.a 7pm dom hasta las 6pm",otras ciudades consulta aquí,2429.0,500gr,3.29,COP,$,$3.29,3.29,False,original,0.0008,0.0008,4047.0,from_colombia_cambio_dolar,,,,,,,,{},dataset/txt_limpios/684.txt,dataset/paginas_descargadas/684.html,ET,sin_categoria,discard,0.30,no_category_detected
685,"ASESORAMOS TU COMPRA: 📞(601) 6672004, lun a sab de 7am.a 7pm dom hasta las 6pm","Este producto no puede faltar en tu cocina, disfruta de todo su sabor. Este producto es vendido, facturado y entregado por Cencosud - Colombia Los precios de los productos pueden cambiar dependiendo de la región. Aplican Términos y Condiciones Desactivados Referencia: 0225307 $ 9 x gr CENCOSUD ☆ ¿Todavía tienes tu Tarjeta Cencosud? Solicítala en línea, úsala y obtén un . Aplican términos y condiciones. Solicítala aquí Términos más buscados 1. kefir alpina 2. muebles 3. leche 4. leche alqueria 5. san jorge 6. papel higiénico 7. arroz 8. café 9. cerveza 10. neveras",otras ciudades consulta aquí > 0225307,17.99,COP,,Desconocido,unknown,CO,"ASESORAMOS TU COMPRA: 📞(601) 6672004, lun a sab de 7am.a 7pm dom hasta las 6pm",otras ciudades consulta aquí,225307.0,,17.99,COP,$,$17.99,17.99,False,original,0.0044,0.0044,4047.0,from_colombia_cambio_dolar,,"Este producto no puede faltar en tu cocina, disfruta de todo su sabor. Este producto es vendido, facturado y entregado por Cencosud - Colombia Los precios de los productos pueden cambiar dependiendo de la región. Aplican Términos y Condiciones Desactivados Referencia: 0225307 $ 9 x gr CENCOSUD ☆ ¿Todavía tienes tu Tarjeta Cencosud? Solicítala en línea, úsala y obtén un . Aplican términos y condiciones. Solicítala aquí Términos más buscados 1. kefir alpina 2. muebles 3. leche 4. leche alqueria 5. san jorge 6. papel higiénico 7. arroz 8. café 9. cerveza 10. neveras",,,,,,"{""Descripción"": [""Este producto no puede faltar en tu cocina, disfruta de todo su sabor."", ""Este producto es vendido, facturado y entregado por"", ""Cencosud - Colombia"", ""Los precios de los productos pueden cambiar dependiendo de la región."", ""Aplican Términos y Condiciones"", ""Desactivado"", ""Referencia: 0225307"", ""$"", ""9"", ""x"", ""gr"", ""CENCOSUD"", ""☆"", ""¿Todavía tienes tu Tarjeta Cencosud?"", ""Solicítala en línea, úsala y obtén un"", "". Aplican términos y condiciones."", ""Solicítala aquí"", ""Términos más buscados"", ""1."", ""kefir alpina"", ""2."", ""muebles"", ""3."", ""leche"", ""4."", ""leche alqueria"", ""5."", ""san jorge"", ""6."", ""papel higienico"", ""7."", ""arroz"", ""8."", ""cafe"", ""9."", ""cerveza"", ""10."", ""neveras""]}",dataset/txt_limpios/685.txt,dataset/paginas_descargadas/685.html,ET,cafe,keep,0.60,heuristic_default
