source_id,title,description,breadcrumbs,price_raw,currency_raw,url,seller,availability,country,product_name,brand,reference,unit,price_amount,price_currency,price_symbol,price_text,price_amount_filled,price_is_imputed,price_imputation_source,price_amount_usd,price_amount_usd_filled,fx_rate_local_per_usd,fx_source,information_text,description_text,features_text,specifications_text,benefits_text,details_text,other_sections,sections,txt_path,html_path,es_status,category_canonical,decision,match_score,reasons
966,Desayuno y Dulces,"Café Instantáneo en Polvo Tradición Nescafé 50g | Actualizado al: 29-07-2025 Ingredientes: 100% café. Certificados: Apto para APLV Libre de Lactosa Vegano Vegetariano Libre de Soya Libre de Huevo Libre de Peces Libre de Mariscos Libre de Maní Libre de Frutas Secos Libre de Nueces Libre de Sulfitos Libre de Trigo Kosher Importante: La información del empaque y/o contenido del producto final puede diferir respecto a lo que mostramos en nuestro sitio web, tanto a nivel de ingredientes, trazas, información nutricional, sellos, modo de uso y/o modo de conservación. Usted debe basarse únicamente en la información que se muestra en nuestro sitio web y siempre debe leer las etiquetas, advertencias y instrucciones antes de usar el consumo de un producto. Información obtenida de NESCAFE TRADICIONAL 50 GRS.11261035 Productos similares Café Instantáneo Nescafe Tradición Tarro 170 g -13% Ver producto Café Instantáneo Nescafe Dolca Tarro 170 g Café Instantáneo Nescafe Tradición Tarro 400 g NESCAFE DOLCA 50 GRS. 11261175 Café Tradición Tarro -18% Café Descafeinado Nescafe 100 g Café Starbucks Medium Roast 90 g -20% Café Instantáneo Primera Selección Gold 170 g -40% Café Instantáneo Granulado Nescafe Tradición Tarro 170 g Café Starbucks Dark Roast 90 g Café Nescafe Dolca Tarro 195 g DESCAFEINADO NESCAFE 170GR Café Melitta Tradicional 250 g Café Tradición Frasco Café Liofilizado Clásico Juan Valdez 40 g -30% Café Instantáneo Gold Primera Selección 400 g Café Instantáneo Liofilizado Cruzeiro 170 g Café Instantáneo Black Roast Nescafe 170 g Café Liofilizado Crucero Equilibrado 170 gr Café Instantáneo Primera Selección Café Instatáneo Wake Up Guatemala Marley Coffee 100 g Café Instantáneo Nescafe Fina Selección 200 g Café Tentaciones Capuccino 8 Sobres ¡Juntos son mejores! Té Ceylan -33% Té Ceylán Azúcar Blanca Granulada Tottus 860 g Azúcar Blanca Granulada Iansa 1 Kg Té Ceylán Premium Supremo 50 Un Azúcar Blanca Granulada Tottus 1 Kg Azúcar Granulada Iansa 900 g -24% Sal Fina Yodada Azúcar Té Negro Ceylán Mildred 100 Un Sal Fina Yodada Tottus 1 Kg FIDEO SPAGHETTI 5 400 GRS. 101409 C -10% Carpeta Spaghetti N°5 Lucchetti 400 g Té Ceylán Premium Supremo 100 Un -12% Carpeta Espiral N°56 Lucchetti 400 g FIDEO ESPIRAL 49 400 GRS. 111112 C Carpeta Corbata N°88 FIDEO CORBATA 80 400 GRS. 101302 C FIDEO CAB/CORTO 1 400 GRS. 111109 C FIDEO TALLARIN 87 400 GRS. 101407 C Espirales -22%",Café > 50 g,2.85,,,Desconocido,unknown,UNKNOWN,Desayuno y Dulces,Café,,50 g,2.85,,,2.85,2.85,False,original,2.85,2.85,1.0,default_1usd,,"Café Instantáneo en Polvo Tradición Nescafé 50g | Actualizado al: 29-07-2025 Ingredientes: 100% café. Certificados: Apto para APLV Libre de Lactosa Vegano Vegetariano Libre de Soya Libre de Huevo Libre de Peces Libre de Mariscos Libre de Maní Libre de Frutas Secos Libre de Nueces Libre de Sulfitos Libre de Trigo Kosher Importante: La información del empaque y/o contenido del producto final puede diferir respecto a lo que mostramos en nuestro sitio web, tanto a nivel de ingredientes, trazas, información nutricional, sellos, modo de uso y/o modo de conservación. Usted debe basarse únicamente en la información que se muestra en nuestro sitio web y siempre debe leer las etiquetas, advertencias y instrucciones antes de usar el consumo de un producto. Información obtenida de NESCAFE TRADICIONAL 50 GRS.11261035 Productos similares Café Instantáneo Nescafe Tradición Tarro 170 g -13% Ver producto Café Instantáneo Nescafe Dolca Tarro 170 g Café Instantáneo Nescafe Tradición Tarro 400 g NESCAFE DOLCA 50 GRS. 11261175 Café Tradición Tarro -18% Café Descafeinado Nescafe 100 g Café Starbucks Medium Roast 90 g -20% Café Instantáneo Primera Selección Gold 170 g -40% Café Instantáneo Granulado Nescafe Tradición Tarro 170 g Café Starbucks Dark Roast 90 g Café Nescafe Dolca Tarro 195 g DESCAFEINADO NESCAFE 170GR Café Melitta Tradicional 250 g Café Tradición Frasco Café Liofilizado Clásico Juan Valdez 40 g -30% Café Instantáneo Gold Primera Selección 400 g Café Instantáneo Liofilizado Cruzeiro 170 g Café Instantáneo Black Roast Nescafe 170 g Café Liofilizado Crucero Equilibrado 170 gr Café Instantáneo Primera Selección Café Instatáneo Wake Up Guatemala Marley Coffee 100 g Café Instantáneo Nescafe Fina Selección 200 g Café Tentaciones Capuccino 8 Sobres ¡Juntos son mejores! Té Ceylan -33% Té Ceylán Azúcar Blanca Granulada Tottus 860 g Azúcar Blanca Granulada Iansa 1 Kg Té Ceylán Premium Supremo 50 Un Azúcar Blanca Granulada Tottus 1 Kg Azúcar Granulada Iansa 900 g -24% Sal Fina Yodada Azúcar Té Negro Ceylán Mildred 100 Un Sal Fina Yodada Tottus 1 Kg FIDEO SPAGHETTI 5 400 GRS. 101409 C -10% Carpeta Spaghetti N°5 Lucchetti 400 g Té Ceylán Premium Supremo 100 Un -12% Carpeta Espiral N°56 Lucchetti 400 g FIDEO ESPIRAL 49 400 GRS. 111112 C Carpeta Corbata N°88 FIDEO CORBATA 80 400 GRS. 101302 C FIDEO CAB/CORTO 1 400 GRS. 111109 C FIDEO TALLARIN 87 400 GRS. 101407 C Espirales -22%",,,,,,"{""Descripción"": [""Café Instantáneo en Polvo Tradición Nescafé"", ""50g | Actualizado al: 29-07-2025"", ""Ingredientes: 100% café."", ""Certificados: Apto para APLV"", ""Libre de Lactosa"", ""Vegano"", ""Vegetariano"", ""Libre de Soya"", ""Libre de Huevo"", ""Libre de Peces"", ""Libre de Mariscos"", ""Libre de Maní"", ""Libre de Frutos Secos"", ""Libre de Nueces"", ""Libre de Sulfitos"", ""Libre de Trigo"", ""Kosher"", ""Importante: La información del empaque y/o contenido del producto final puede diferir respecto a lo que mostramos en nuestro sitio web, tanto a nivel de ingredientes, trazas, información nutricional, sellos, modo de uso y/o modo de conservación. Usted debe basarse únicamente en la información que se muestra en nuestro sitio web y siempre debe leer las etiquetas, advertencias y instrucciones antes de usar el consumo de un producto."", ""Información obtenida de"", ""NESCAFE TRADICIONAL 50 GRS.11261035"", ""Productos similares"", ""Café Instantáneo Nescafe Tradición Tarro 170 g"", ""-13%"", ""Ver producto"", ""Café Instantáneo Nescafe Dolca Tarro 170 g"", ""Café Instantáneo Nescafe Tradición Tarro 400 g"", ""NESCAFE DOLCA 50 GRS. 11261175"", ""Café Tradición Tarro"", ""-18%"", ""Café Descafeinado Nescafe 100 g"", ""Café Starbucks Medium Roast 90 g"", ""-20%"", ""Café Instantáneo Primera Selección Gold 170 g"", ""-40%"", ""Café Instantáneo Granulado Nescafe Tradición Tarro 170 g"", ""Café Starbucks Dark Roast 90 g"", ""Café Nescafe Dolca Tarro 195 g"", ""DESCAFEINADO NESCAFE 170GR"", ""Café Melitta Tradicional 250 g"", ""Café Tradición Frasco"", ""Café Liofilizado Clásico Juan Valdez 40 g"", ""-30%"", ""Café Instantáneo Gold Primera Selección 400 g"", ""Café Instantáneo Liofilizado Cruzeiro 170 g"", ""Café Instantáneo Black Roast Nescafe 170 g"", ""Café Liofilizado Crucero Equilibrado 170 gr"", ""Café Instantáneo Primera Selección"", ""Café Instatáneo Wake Up Guatemala Marley Coffee 100 g"", ""Café Instantáneo Nescafe Fina Selección 200 g"", ""Café Tentaciones Capuccino 8 Sobres"", ""¡Juntos son mejores!"", ""Té Ceylan"", ""-33%"", ""Té Ceylán"", ""Azúcar Blanca Granulada Tottus 860 g"", ""Azúcar Blanca Granulada Iansa 1 Kg"", ""Té Ceylán Premium Supremo 50 Un"", ""Azúcar Blanca Granulada Tottus 1 Kg"", ""Azúcar Granulada Iansa 900 g"", ""-24%"", ""Sal Fina Yodada"", ""Azúcar"", ""Té Negro Ceylán Mildred 100 Un"", ""Sal Fina Yodada Tottus 1 Kg"", ""FIDEO SPAGHETTI 5  400 GRS. 101409 C"", ""-10%"", ""Pasta Spaghetti N°5 Lucchetti 400 g"", ""Té Ceylán Premium Supremo 100 Un"", ""-12%"", ""Pasta Espiral N°56 Lucchetti 400 g"", ""FIDEO ESPIRAL 49  400 GRS. 111112 C"", ""Pasta Corbata N°88"", ""FIDEO CORBATA 80  400 GRS. 101302 C"", ""FIDEO CAB/CORTO 1  400 GRS. 111109 C"", ""FIDEO TALLARIN 87  400 GRS. 101407 C"", ""Espirales"", ""-22%""]}",dataset/txt_limpios/966.txt,dataset/paginas_descargadas/966.html,ET,cafe,keep,0.60,heuristic_default
508,Descripción del producto,,MARCA > 1l,50.0,,,Desconocido,unknown,UNKNOWN,Descripción del producto,MARCA,,1l,50.00,,,50,50.0,False,original,50.0,50.0,1.0,default_1usd,,,MARCA | : FARGO | Últimos consultados | LLEVANDO 3 | 3X2 | Leche Larga Vida Entera LAS TRES NIÑAS Ttb 1l | PRECIO CON 3X2 | Ver planes de cuotas | Leche Larga Vida Entera VERONICA 1l | Leche Larga Vida Entera TREGAR Ttb 1 L | Leche Entera Larga Vida Ilolay Ttb 1 Ltr | EN ACUMULABLE CON OTRAS PROMOS | Leche Entera Clasica LA SERENISIMA Sachet 1l | OFERTA,,,,,"{""Características"": [""MARCA"", "": FARGO"", ""Últimos consultados"", ""LLEVANDO 3"", ""3X2"", ""Leche Larga Vida Entera LAS TRES NIÑAS Ttb 1l"", ""PRECIO CON 3X2"", ""Ver planes de cuotas"", ""Leche Larga Vida Entera VERONICA 1l"", ""Leche Larga Vida Entera TREGAR Ttb 1 L"", ""Leche Entera Larga Vida Ilolay Ttb 1 Ltr"", ""NO ACUMULABLE CON OTRAS PROMOS"", ""Leche Entera Clasica LA SERENISIMA Sachet 1l"", ""OFERTA""]}",dataset/txt_limpios/508.txt,dataset/paginas_descargadas/508.html,ET,sin_categoria,discard,0.30,no_category_detected
509,Descripción del producto,,MARCA > 610g,6550.0,,,Desconocido,unknown,UNKNOWN,Descripción del producto,MARCA,,610g,6550.00,,$,"$6.550,00",6550.0,False,original,6550.0,6550.0,1.0,default_1usd,,,MARCA | : BIMBO | Últimos consultados | Pan Salvado FARGO 620g | Ver planes de cuotas | LLEVANDO 3 | 3X2 | Leche Larga Vida Entera LAS TRES NIÑAS Ttb 1l | PRECIO CON 3X2 | Leche Larga Vida Entera VERONICA 1l | Leche Larga Vida Entera TREGAR Ttb 1 L | Leche Entera Larga Vida Ilolay Ttb 1 Ltr,,,,,"{""Características"": [""MARCA"", "": BIMBO"", ""Últimos consultados"", ""Pan Salvado FARGO 620g"", ""Ver planes de cuotas"", ""LLEVANDO 3"", ""3X2"", ""Leche Larga Vida Entera LAS TRES NIÑAS Ttb 1l"", ""PRECIO CON 3X2"", ""Leche Larga Vida Entera VERONICA 1l"", ""Leche Larga Vida Entera TREGAR Ttb 1 L"", ""Leche Entera Larga Vida Ilolay Ttb 1 Ltr""]}",dataset/txt_limpios/509.txt,dataset/paginas_descargadas/509.html,EN,sin_categoria,discard,0.30,no_category_detected
510,Descripción del producto,,MARCA > 550g,6434.0,,,Desconocido,unknown,UNKNOWN,Descripción del producto,MARCA,,550g,6434.00,,$,"$6.434,00",6434.0,False,original,6434.0,6434.0,1.0,default_1usd,,,MARCA | : LA PERLA | Últimos consultados | Pan Lacteado Blanco Rebanada Mas Grande Bimbo 610g | Ver planes de cuotas | Pan Salvado FARGO 620g | LLEVANDO 3 | 3X2 | Leche Larga Vida Entera LAS TRES NIÑAS Ttb 1l | PRECIO CON 3X2 | Leche Larga Vida Entera VERONICA 1l | Leche Larga Vida Entera TREGAR 1 L,,,,,"{""Características"": [""MARCA"", "": LA PERLA"", ""Últimos consultados"", ""Pan Lacteado Blanco Rebanada Mas Grande Bimbo 610g"", ""Ver planes de cuotas"", ""Pan Salvado FARGO 620g"", ""LLEVANDO 3"", ""3X2"", ""Leche Larga Vida Entera LAS TRES NIÑAS Ttb 1l"", ""PRECIO CON 3X2"", ""Leche Larga Vida Entera VERONICA 1l"", ""Leche Larga Vida Entera TREGAR Ttb 1 L""]}",dataset/txt_limpios/510.txt,dataset/paginas_descargadas/510.html,ET,sin_categoria,discard,0.30,no_category_detected
511,Descripción del producto,,MARCA > 550g,600.0,,,Desconocido,unknown,UNKNOWN,Descripción del producto,MARCA,,550g,600.00,,,600,600.0,False,original,600.0,600.0,1.0,default_1usd,,,MARCA | : NOLY | Últimos consultados | Pan De Mesa Grande La Perla 550g | Ver planes de cuotas | Pan Lacteado Blanco Rebanada Mas Grande Bimbo 610g | Pan Salvado FARGO 620g | LLEVANDO 3 | 3X2 | Leche Larga Vida Entera LAS TRES NIÑAS Ttb 1l | PRECIO CON 3X2 | Leche Larga Vida Entera VERONICA 1l,,,,,"{""Características"": [""MARCA"", "": NOLY"", ""Últimos consultados"", ""Pan De Mesa Grande La Perla 550g"", ""Ver planes de cuotas"", ""Pan Lacteado Blanco Rebanada Mas Grande Bimbo 610g"", ""Pan Salvado FARGO 620g"", ""LLEVANDO 3"", ""3X2"", ""Leche Larga Vida Entera LAS TRES NIÑAS Ttb 1l"", ""PRECIO CON 3X2"", ""Leche Larga Vida Entera VERONICA 1l""]}",dataset/txt_limpios/511.txt,dataset/paginas_descargadas/511.html,EN,sin_categoria,discard,0.30,no_category_detected
513,Descripción del producto,,MARCA > 1kg,1312.0,,,Desconocido,unknown,UNKNOWN,Descripción del producto,MARCA,,1kg,1312.00,,$,"$1.312,00",1312.0,False,original,1312.0,1312.0,1.0,default_1usd,,,MARCA | : ledESMA | Últimos consultados | Baguette COTO | Ver planes de cuotas | LLEVANDO 2 | 70% 2DA | PRECIO CON 70% 2DA | Pan De Mesa Gran La Perla 550g | Pan Lacteado Blanco Rebanada Mas Grande Bimbo 610g | Pan Salvado FARGO 620g,,,,,"{""Características"": [""MARCA"", "": LEDESMA"", ""Últimos consultados"", ""Baguette COTO"", ""Ver planes de cuotas"", ""LLEVANDO 2"", ""70% 2DA"", ""PRECIO CON 70% 2DA"", ""Pan De Mesa Grande La Perla 550g"", ""Pan Lacteado Blanco Rebanada Mas Grande Bimbo 610g"", ""Pan Salvado FARGO 620g""]}",dataset/txt_limpios/513.txt,dataset/paginas_descargadas/513.html,ET,sin_categoria,discard,0.30,no_category_detected
514,Descripción del producto,,MARCA > 1 Kg,1299.0,,,Desconocido,unknown,UNKNOWN,Descripción del producto,MARCA,,1 Kg,1299.00,,$,"$1.299,00",1299.0,False,original,1299.0,1299.0,1.0,default_1usd,,,MARCA | : LA PERLA | Últimos consultados | EL ACUMULABLE CON OTRAS PROMOS | Azúcar Superior Real LEDESMA 1kg | Ver planes de cuotas | Baguette COTO | LLEVANDO 2 | 70% 2DA | PRECIO CON 70% 2DA | Pan De Mesa Gran La Perla 550g | Pan Lacteado Blanco Rebanada Mas Grande Bimbo 610g,,,,,"{""Características"": [""MARCA"", "": LA PERLA"", ""Últimos consultados"", ""NO ACUMULABLE CON OTRAS PROMOS"", ""Azúcar Superior Real LEDESMA 1kg"", ""Ver planes de cuotas"", ""Baguette COTO"", ""LLEVANDO 2"", ""70% 2DA"", ""PRECIO CON 70% 2DA"", ""Pan De Mesa Grande La Perla 550g"", ""Pan Lacteado Blanco Rebanada Mas Grande Bimbo 610g""]}",dataset/txt_limpios/514.txt,dataset/paginas_descargadas/514.html,ET,sin_categoria,discard,0.30,no_category_detected
515,Descripción del producto,,Azúcar Cristal Uniao 1kg > 1kg,990.0,,,Desconocido,unknown,UNKNOWN,Descripción del producto,Azúcar Cristal Uniao 1kg,,1kg,990.00,,$,"$990,00",990.0,False,original,990.0,990.0,1.0,default_1usd,,,MARCA | : UNIAO | Últimos consultados | Azúcar La Perla 1 Kg | Ver planes de cuotas | NO ACUMULABLE CON OTRAS PROMOS | Azúcar Superior Real ledESMA 1kg | Baguette COTO | LLEVANDO 2 | 70% 2DA | PRECIO CON 70% 2DA | Pan De Mesa Gran La Perla 550g,,,,,"{""Características"": [""MARCA"", "": UNIAO"", ""Últimos consultados"", ""Azúcar La Perla 1 Kg"", ""Ver planes de cuotas"", ""NO ACUMULABLE CON OTRAS PROMOS"", ""Azúcar Superior Real LEDESMA 1kg"", ""Baguette COTO"", ""LLEVANDO 2"", ""70% 2DA"", ""PRECIO CON 70% 2DA"", ""Pan De Mesa Grande La Perla 550g""]}",dataset/txt_limpios/515.txt,dataset/paginas_descargadas/515.html,ET,azucar,keep,0.60,heuristic_default
516,Descripción del producto,,MARCA > 800g,1699.0,,,Desconocido,unknown,UNKNOWN,Descripción del producto,MARCA,,800g,1699.00,,$,"$1.699,00",1699.0,False,original,1699.0,1699.0,1.0,default_1usd,,,MARCA | : SUGAR POT | Últimos consultados | NO ACUMULABLE CON OTRAS PROMOS | Azúcar Cristal Uniao 1kg | Ver planes de cuotas | Azúcar La Perla 1 Kg | Azúcar Superior Real LEDESMA 1kg | Baguette COTO | LLEVANDO 2 | 70% 2DA | PRECIO CON 70% 2DA,,,,,"{""Características"": [""MARCA"", "": SUGAR POT"", ""Últimos consultados"", ""NO ACUMULABLE CON OTRAS PROMOS"", ""Azúcar Cristal Uniao 1kg"", ""Ver planes de cuotas"", ""Azúcar La Perla 1 Kg"", ""Azúcar Superior Real LEDESMA 1kg"", ""Baguette COTO"", ""LLEVANDO 2"", ""70% 2DA"", ""PRECIO CON 70% 2DA""]}",dataset/txt_limpios/516.txt,dataset/paginas_descargadas/516.html,EN,sin_categoria,discard,0.30,no_category_detected
517,Descripción del producto,,Azúcar AZUCEL 1kg > 1kg,4399.0,,,Desconocido,unknown,UNKNOWN,Descripción del producto,Azúcar AZUCEL 1kg,,1kg,4399.00,,$,"$4.399,00",4399.0,False,original,4399.0,4399.0,1.0,default_1usd,,,MARCA | : AZUCEL | Últimos consultados | Azúcar Organica Sugar Pot 800g | Ver planes de cuotas | NO ACUMULABLE CON OTRAS PROMOS | Azúcar Cristal Uniao 1kg | Azúcar La Perla 1 Kg | Azúcar Superior Real LEDESMA 1kg | Baguette COTO,,,,,"{""Características"": [""MARCA"", "": AZUCEL"", ""Últimos consultados"", ""Azúcar Organica Sugar Pot 800g"", ""Ver planes de cuotas"", ""NO ACUMULABLE CON OTRAS PROMOS"", ""Azúcar Cristal Uniao 1kg"", ""Azúcar La Perla 1 Kg"", ""Azúcar Superior Real LEDESMA 1kg"", ""Baguette COTO""]}",dataset/txt_limpios/517.txt,dataset/paginas_descargadas/517.html,EN,azucar,keep,0.60,heuristic_default
1756,Devolver este producto es gratis,"POLLOS 1RA. SUPER C/M ¡Juntos son mejores! Costillar de Cerdo Tradicional Super Cerdo Peso Variable -42% Ver producto Arvejas Congeladas Minuto Verde 500 g UN Sal Fina Yodada Costillar de Cerdo a la Chilena Super Cerdo Peso Variable Aceite Vegetal Belmont 1 L -20% Sal Fina Yodada Tottus 1 Kg Aceite Vegetal Tottus 900 ml Aceite vegetal Precio Un 900 ml Arroz Tottus G2 Grano Largo Fino 1 Kg Arroz Precio Uno G2 Grano Largo Fino 1 Kg Tipo de corte | Pollo Entero | Uso Recomendado | Cacerola,Olla Multicook,Horno,Airfryer | Origen | Nacional | País de Origen | Chile | Tipo de Envase | Bolsa | Advertencias de Almacenamiento | Mantener Refrigerado entre -2°C a 2 °C | Tipo de Refrigeración | Refrigerado | Refrigerado | Refrigerado | Refrigerado | Refrigerado | Refrigerado | Refrigerado | Refrigerado | Refrigerado | Refrigerado | Refrigerado | Refrigerado | Refrigerado | Refrigerado | Refrigerado | Refrigerado | Refrigerado | Refrigerado | Refrigerado | Refrigerado | Refrigerado | Refrigerado | Refrigerado | Refrigerado | Refrigerado | Refrigerado | Refrigerado | Refrigerado | Refrigerado | Refrigerado | Refrigerado | Refrigerado | Refrigerado | Refrigerado | Refrigerado | Refrigerado | Refrigerado | Refrigerado | Refrigerado | Refrigerado | Refrigerado | Refrigerado | Refrigerado | Refrigerado | Refrigerado | Refrigerado | Refrigerado | Refrigerado | Refrigerado | Refrigerado | Refrigerado | Refrigerado | Refrigerado",SUPER POLLO > 500 g,3.99,,,Desconocido,unknown,UNKNOWN,Devolver este producto es gratis,SUPER POLLO,,500 g,3.99,,,3.99,3.99,False,original,3.99,3.99,1.0,default_1usd,,POLLOS 1RA. SUPER C/M ¡Juntos son mejores! Costillar de Cerdo Tradicional Super Cerdo Peso Variable -42% Ver producto Arvejas Congeladas Minuto Verde 500 g UN Sal Fina Yodada Costillar de Cerdo a la Chilena Super Cerdo Peso Variable Aceite Vegetal Belmont 1 L -20% Sal Fina Yodada Tottus 1 Kg Aceite Vegetal Tottus 900 ml Aceite Vegetal Precio Uno 900 ml Arroz Tottus G2 Grano Largo Fino 1 Kg Arroz Precio Uno G2 Grano Largo Fino 1 Kg,,"Tipo de corte | Pollo Entero | Uso Recomendado | Cacerola,Olla Multicook,Horno,Airfryer | Origen | Nacional | País de Origen | Chile | Tipo de Envase | Bolsa | Advertencias de Almacenamiento | Mantener Refrigerado entre -2°C a 2 °C | Tipo de Refrigeración | Refrigerado | Refrigerado | Refrigerado | Refrigerado | Refrigerado | Refrigerado | Refrigerado | Refrigerado | Refrigerado | Refrigerado | Refrigerado | Refrigerado | Refrigerado | Refrigerado | Refrigerado | Refrigerado | Refrigerado | Refrigerado | Refrigerado | Refrigerado | Refrigerado | Refrigerado | Refrigerado | Refrigerado | Refrigerado | Refrigerado | Refrigerado | Refrigerado | Refrigerado | Refrigerado | Refrigerado | Refrigerado | Refrigerado | Refrigerado | Refrigerado | Refrigerado | Refrigerado | Refrigerado | Refrigerado | Refrigerado | Refrigerado | Refrigerado | Refrigerado | Refrigerado | Refrigerado | Refrigerado | Refrigerado | Refrigerado | Refrigerado | Refrigerado | Refrigerado | Refrigerado | Refrigerado",,,,"{""Especificaciones"": [""Tipo de Corte"", ""Pollo Entero"", ""Uso Recomendado"", ""Cacerola,Olla Multicook,Horno,Airfryer"", ""Origen"", ""Nacional"", ""País de origen"", ""Chile"", ""Tipo de Envase"", ""Bolsa"", ""Advertencias de Almacenamiento"", ""Mantener Refrigerado entre -2°C a 2°C"", ""Tipo de refrigeración"", ""Refrigerado""], ""Descripción"": [""POLLOS 1RA. SUPER C/M"", ""¡Juntos son mejores!"", ""Costillar de Cerdo Tradicional Super Cerdo Peso Variable"", ""-42%"", ""Ver producto"", ""Arvejas Congeladas Minuto Verde 500 g"", ""UN"", ""Sal Fina Yodada"", ""Costillar de Cerdo a la Chilena Super Cerdo Peso Variable"", ""Aceite Vegetal Belmont 1 L"", ""-20%"", ""Sal Fina Yodada Tottus 1 Kg"", ""Aceite Vegetal Tottus 900 ml"", ""Aceite Vegetal Precio Uno 900 ml"", ""Arroz Tottus G2 Grano Largo Fino 1 Kg"", ""Arroz Precio Uno G2 Grano Largo Fino 1 Kg""]}",dataset/txt_limpios/1756.txt,dataset/paginas_descargadas/1756.html,ET,aceite vegetal,keep,0.60,heuristic_default
1316,El almacenamiento local parece estar deshabilitado en tu navegador.,,Aprende más > 1L,2.05,USD,,Desconocido,unknown,US,El almacenamiento local parece estar deshabilitado en tu navegador.,Aprende,,1L,2.05,USD,$,"$2,05",2.05,False,original,2.05,2.05,1.0,default_1usd,,,,,,,,{},dataset/txt_limpios/1316.txt,dataset/paginas_descargadas/1316.html,ET,sin_categoria,discard,0.30,no_category_detected
