source_id,title,description,breadcrumbs,price_raw,currency_raw,url,seller,availability,country,product_name,brand,reference,unit,price_amount,price_currency,price_symbol,price_text,price_amount_filled,price_is_imputed,price_imputation_source,price_amount_usd,price_amount_usd_filled,fx_rate_local_per_usd,fx_source,information_text,description_text,features_text,specifications_text,benefits_text,details_text,other_sections,sections,txt_path,html_path,es_status,category_canonical,decision,match_score,reasons
110,¡Lo mejor te está esperando!,"Consiga un arroz más blanco, entero y esponjadito con el arroz súper extra Verde Valle. Prepárelo como usted prefiera y dele esa sazón especial. Es ideal para cualquier tipo de preparación. Le tomará muy pocos minutos prepara | ... Ver más | Favoritos | Recomendados | Arroz Super Extra   Verde Valle 900 ... | 900 GR | Arroz Super Extra   Mybrand 906 G | 906 GR | 2 KG | Arroz Super Extra Grueso   Sos 907 G | 907 GR | Arroz Super Extra Precocido  Sos 907... | Arroz Super Extra  Diamante 750 G | 750 GR | Arroz   Cazerola 907 G | Arroz Grano Largo  Gran Cosecha 900 ... | Arroz Jazmin   Verde Valle 750 G | Arroz Blanco Orgánico   Aires De Cam... | 1 KG | -25% | Arroz Organico Integral  Aires De Ca... | Grano De Elote  Dorado  Clemente Jaq... | 410 GR | -21% | Atun En Agua   Tuny 130 G | 130 GR | 220 GR | -29% | Arroz Extra    Mimarca 906 G | Cerveza Six Pack Lata Light  Budligh... | 330 ML | Cacahuates Japones  Karate 127 G | 127 GR | Alimento Humedo P/perro Todas Las Ra... | 100 GR | Atun Jumbo En Agua  Tuny 295 G | 295 GR | Arroz Con Leche   Lala 125 G | 125 GR | Arroz Impegable   Verde Valle 750 G | Galletas De Arroz Integrales   Okko ... | 140 GR | Galletas De Arroz Con Quinoa   Okko ... | Atun En Aceite   Tuny 130 G | Ensalada Campesina   La Costeña 410 ... | Salsa De Soya  Maggi 290 Ml | 290 ML | Cereal Choco Krispis    Kelloggs 540... | 540 GR | Caldo De Pollo 12 Cubos  Knorr 126 G... | 126 GR | Alimendo Humedo Para Perro Adulto Po... | 85 GR | Arroz Impegable Precocido  Mybrand 9... | AGOTADO | Mes patrio Herdez | Ver más | Adobo    Doña María 235 G | Mole Doña María Almendrado En Pasta ... | Mole Doña María Almendrado Listo Par... | Mole Doña María Poblano Con Cacao En... | Mole Doña Maria Poblano Con Cacao Li... | Mole Doña Mariía Rojo En Pasta   125... | Mole En Pasta 430 Gramos   Doña Mari... | Mole Listo Para Servir  Para Servir ... | Mole Rojo En Pasta  Doña Maria 235 G | Mole Verde En Pasta  Doña Maria 230 ... | Pipián En Pasta  Doña Maria 230 G | Salsa Cacahuate Picante Cremosa   He... | Salsa Casera Con Habanero   Herdez 4... | Salsa Casera  Herdez 210 G | Salsa Guacamole 15% Mas Guacamole He...",Descarga la app > 2 Kg,74.9,,,Desconocido,unknown,UNKNOWN,¡Lo mejor te está esperando!,Descarga la app,,2 Kg,74.90,,$,$74.90,74.9,False,original,74.9,74.9,1.0,default_1usd,,,,,,"Consiga un arroz más blanco, entero y esponjadito con el arroz súper extra Verde Valle. Prepárelo como usted prefiera y dele esa sazón especial. Es ideal para cualquier tipo de preparación. Le tomará muy pocos minutos prepara | ... Ver más | Favoritos | Recomendados | Arroz Super Extra   Verde Valle 900 ... | 900 GR | Arroz Super Extra   Mybrand 906 G | 906 GR | 2 KG | Arroz Super Extra Grueso   Sos 907 G | 907 GR | Arroz Super Extra Precocido  Sos 907... | Arroz Super Extra  Diamante 750 G | 750 GR | Arroz   Cazerola 907 G | Arroz Grano Largo  Gran Cosecha 900 ... | Arroz Jazmin   Verde Valle 750 G | Arroz Blanco Orgánico   Aires De Cam... | 1 KG | -25% | Arroz Organico Integral  Aires De Ca... | Grano De Elote  Dorado  Clemente Jaq... | 410 GR | -21% | Atun En Agua   Tuny 130 G | 130 GR | 220 GR | -29% | Arroz Extra    Mimarca 906 G | Cerveza Six Pack Lata Light  Budligh... | 330 ML | Cacahuates Japones  Karate 127 G | 127 GR | Alimento Humedo P/perro Todas Las Ra... | 100 GR | Atun Jumbo En Agua  Tuny 295 G | 295 GR | Arroz Con Leche   Lala 125 G | 125 GR | Arroz Impegable   Verde Valle 750 G | Galletas De Arroz Integrales   Okko ... | 140 GR | Galletas De Arroz Con Quinoa   Okko ... | Atun En Aceite   Tuny 130 G | Ensalada Campesina   La Costeña 410 ... | Salsa De Soya  Maggi 290 Ml | 290 ML | Cereal Choco Krispis    Kelloggs 540... | 540 GR | Caldo De Pollo 12 Cubos  Knorr 126 G... | 126 GR | Alimendo Humedo Para Perro Adulto Po... | 85 GR | Arroz Impegable Precocido  Mybrand 9... | AGOTADO | Mes patrio Herdez | Ver más | Adobo    Doña María 235 G | Mole Doña María Almendrado En Pasta ... | Mole Doña María Almendrado Listo Par... | Mole Doña María Poblano Con Cacao En... | Mole Doña Maria Poblano Con Cacao Li... | Mole Doña Mariía Rojo En Pasta   125... | Mole En Pasta 430 Gramos   Doña Mari... | Mole Listo Para Servir  Para Servir ... | Mole Rojo En Pasta  Doña Maria 235 G | Mole Verde En Pasta  Doña Maria 230 ... | Pipián En Pasta  Doña Maria 230 G | Salsa Cacahuate Picante Cremosa   He... | Salsa Casera Con Habanero   Herdez 4... | Salsa Casera  Herdez 210 G | Salsa Guacamole 15% Mas Guacamole He...",,"{""Detalles"": [""Consiga un arroz más blanco, entero y esponjadito con el arroz súper extra Verde Valle. Prepárelo como usted prefiera y dele esa sazón especial. Es ideal para cualquier tipo de preparación. Le tomará muy pocos minutos prepara"", ""... Ver más"", ""Favoritos"", ""Recomendados"", ""Arroz Super Extra   Verde Valle 900 ..."", ""900 GR"", ""Arroz Super Extra   Mybrand 906 G"", ""906 GR"", ""2 KG"", ""Arroz Super Extra Grueso   Sos 907 G"", ""907 GR"", ""Arroz Super Extra Precocido  Sos 907..."", ""Arroz Super Extra  Diamante 750 G"", ""750 GR"", ""Arroz   Cazerola 907 G"", ""Arroz Grano Largo  Gran Cosecha 900 ..."", ""Arroz Jazmin   Verde Valle 750 G"", ""Arroz Blanco Orgánico   Aires De Cam..."", ""1 KG"", ""-25%"", ""Arroz Organico Integral  Aires De Ca..."", ""Grano De Elote  Dorado  Clemente Jaq..."", ""410 GR"", ""-21%"", ""Atun En Agua   Tuny 130 G"", ""130 GR"", ""220 GR"", ""-29%"", ""Arroz Extra    Mimarca 906 G"", ""Cerveza Six Pack Lata Light  Budligh..."", ""330 ML"", ""Cacahuates Japones  Karate 127 G"", ""127 GR"", ""Alimento Humedo P/perro Todas Las Ra..."", ""100 GR"", ""Atun Jumbo En Agua  Tuny 295 G"", ""295 GR"", ""Arroz Con Leche   Lala 125 G"", ""125 GR"", ""Arroz Impegable   Verde Valle 750 G"", ""Galletas De Arroz Integrales   Okko ..."", ""140 GR"", ""Galletas De Arroz Con Quinoa   Okko ..."", ""Atun En Aceite   Tuny 130 G"", ""Ensalada Campesina   La Costeña 410 ..."", ""Salsa De Soya  Maggi 290 Ml"", ""290 ML"", ""Cereal Choco Krispis    Kelloggs 540..."", ""540 GR"", ""Caldo De Pollo 12 Cubos  Knorr 126 G..."", ""126 GR"", ""Alimendo Humedo Para Perro Adulto Po..."", ""85 GR"", ""Arroz Impegable Precocido  Mybrand 9..."", ""AGOTADO"", ""Mes patrio Herdez"", ""Ver más"", ""Adobo    Doña María 235 G"", ""Mole Doña María Almendrado En Pasta ..."", ""Mole Doña María Almendrado Listo Par..."", ""Mole Doña María Poblano Con Cacao En..."", ""Mole Doña Maria Poblano Con Cacao Li..."", ""Mole Doña Mariía Rojo En Pasta   125..."", ""Mole En Pasta 430 Gramos   Doña Mari..."", ""Mole Listo Para Servir  Para Servir ..."", ""Mole Rojo En Pasta  Doña Maria 235 G"", ""Mole Verde En Pasta  Doña Maria 230 ..."", ""Pipián En Pasta  Doña Maria 230 G"", ""Salsa Cacahuate Picante Cremosa   He..."", ""Salsa Casera Con Habanero   Herdez 4..."", ""Salsa Casera  Herdez 210 G"", ""Salsa Guacamole 15% Mas Guacamole He...""]}",dataset/txt_limpios/110.txt,dataset/paginas_descargadas/110.html,EN,atun,keep,0.60,heuristic_default
111,¡Lo mejor te está esperando!,"Si quieres preparar un arroz delicioso en sus múltiples variedades, elige Arroz Cazerola, el gran sabor del campo directo hasta tu cocina.Ya que además de tener numerosos beneficios, es una fuente inmediata de energía para el | ... Ver más | Favoritos | Recomendados | Arroz Super Extra   Verde Valle 900 ... | 900 GR | -29% | Arroz Extra    Mimarca 906 G | 906 GR | 907 GR | Arroz Con Leche   Lala 125 G | 125 GR | Arroz Impegable   Verde Valle 750 G | 750 GR | Arroz Impegable Precocido  Mybrand 9... | AGOTADO | Arroz A La Mexicana Precocido  Verde... | 140 GR | Arroz Super Extra   Mybrand 906 G | Arroz A La Mexicana     0.25 Lt | 0.25 LT | Arroz Con Leche   Lala 500 G | 500 GR | Arroz Jardinera Precocido  Verde Val... | Arroz Blanco     0.25 Lt | Arroz A La Mexicana      0.5 Lt | 0.5 LT | Arroz Blanco Instantaneo  Knorr 155 ... | 155 GR | Arroz A La Mexicana Instantaneo  Kno... | Arroz Blanco Precocido  Verde Valle ... | Arroz Grano Grueso  Verde Valle 1 Kg | 1 KG | Arroz Blanco      0.5 Lt | Arroz Grano Largo  Gran Cosecha 900 ... | Arroz Super Extra  Verde Valle 2 Kg | 2 KG | Arroz Grano Extra Largo  Diamante 90... | Arroz Integral  Verde Valle 900 G | Arroz Precocido Blanco  Verde Valle ... | 300 GR | Arroz Con Leche   Tia Sara 200 G | 200 GR | Arroz Super Extra Grueso   Sos 907 G | Arroz A La Española Instantaneo  Kno... | Arroz Instantaneo A La Poblana  Knor... | -23% | Arroz Para Sushi   Verde Valle 1 Kg | Arroz Con Atun Dolores 220 Gramos   ... | 220 GR | Arroz Integral Precocido   Verde Val... | 250 GR | Mes patrio Herdez | Ver más | Adobo    Doña María 235 G | Mole Doña María Almendrado En Pasta ... | Mole Doña María Almendrado Listo Par... | Mole Doña María Poblano Con Cacao En... | Mole Doña Maria Poblano Con Cacao Li... | Mole Doña Mariía Rojo En Pasta   125... | Mole En Pasta 430 Gramos   Doña Mari... | Mole Listo Para Servir  Para Servir ... | Mole Rojo En Pasta  Doña Maria 235 G | Mole Verde En Pasta  Doña Maria 230 ... | Pipián En Pasta  Doña Maria 230 G | Salsa Cacahuate Picante Cremosa   He... | Salsa Casera Con Habanero   Herdez 4... | Salsa Casera  Herdez 210 G | Salsa Guacamole 15% Mas Guacamole He...",Descarga la app > 907 G,23.9,,,Desconocido,unknown,UNKNOWN,¡Lo mejor te está esperando!,Descarga la app,,907 G,23.90,,$,$23.90,23.9,False,original,23.9,23.9,1.0,default_1usd,,,,,,"Si quieres preparar un arroz delicioso en sus múltiples variedades, elige Arroz Cazerola, el gran sabor del campo directo hasta tu cocina.Ya que además de tener numerosos beneficios, es una fuente inmediata de energía para el | ... Ver más | Favoritos | Recomendados | Arroz Super Extra   Verde Valle 900 ... | 900 GR | -29% | Arroz Extra    Mimarca 906 G | 906 GR | 907 GR | Arroz Con Leche   Lala 125 G | 125 GR | Arroz Impegable   Verde Valle 750 G | 750 GR | Arroz Impegable Precocido  Mybrand 9... | AGOTADO | Arroz A La Mexicana Precocido  Verde... | 140 GR | Arroz Super Extra   Mybrand 906 G | Arroz A La Mexicana     0.25 Lt | 0.25 LT | Arroz Con Leche   Lala 500 G | 500 GR | Arroz Jardinera Precocido  Verde Val... | Arroz Blanco     0.25 Lt | Arroz A La Mexicana      0.5 Lt | 0.5 LT | Arroz Blanco Instantaneo  Knorr 155 ... | 155 GR | Arroz A La Mexicana Instantaneo  Kno... | Arroz Blanco Precocido  Verde Valle ... | Arroz Grano Grueso  Verde Valle 1 Kg | 1 KG | Arroz Blanco      0.5 Lt | Arroz Grano Largo  Gran Cosecha 900 ... | Arroz Super Extra  Verde Valle 2 Kg | 2 KG | Arroz Grano Extra Largo  Diamante 90... | Arroz Integral  Verde Valle 900 G | Arroz Precocido Blanco  Verde Valle ... | 300 GR | Arroz Con Leche   Tia Sara 200 G | 200 GR | Arroz Super Extra Grueso   Sos 907 G | Arroz A La Española Instantaneo  Kno... | Arroz Instantaneo A La Poblana  Knor... | -23% | Arroz Para Sushi   Verde Valle 1 Kg | Arroz Con Atun Dolores 220 Gramos   ... | 220 GR | Arroz Integral Precocido   Verde Val... | 250 GR | Mes patrio Herdez | Ver más | Adobo    Doña María 235 G | Mole Doña María Almendrado En Pasta ... | Mole Doña María Almendrado Listo Par... | Mole Doña María Poblano Con Cacao En... | Mole Doña Maria Poblano Con Cacao Li... | Mole Doña Mariía Rojo En Pasta   125... | Mole En Pasta 430 Gramos   Doña Mari... | Mole Listo Para Servir  Para Servir ... | Mole Rojo En Pasta  Doña Maria 235 G | Mole Verde En Pasta  Doña Maria 230 ... | Pipián En Pasta  Doña Maria 230 G | Salsa Cacahuate Picante Cremosa   He... | Salsa Casera Con Habanero   Herdez 4... | Salsa Casera  Herdez 210 G | Salsa Guacamole 15% Mas Guacamole He...",,"{""Detalles"": [""Si quieres preparar un arroz delicioso en sus múltiples variedades, elige Arroz Cazerola, el gran sabor del campo directo hasta tu cocina.Ya que además de tener numerosos beneficios, es una fuente inmediata de energía para el"", ""... Ver más"", ""Favoritos"", ""Recomendados"", ""Arroz Super Extra   Verde Valle 900 ..."", ""900 GR"", ""-29%"", ""Arroz Extra    Mimarca 906 G"", ""906 GR"", ""907 GR"", ""Arroz Con Leche   Lala 125 G"", ""125 GR"", ""Arroz Impegable   Verde Valle 750 G"", ""750 GR"", ""Arroz Impegable Precocido  Mybrand 9..."", ""AGOTADO"", ""Arroz A La Mexicana Precocido  Verde..."", ""140 GR"", ""Arroz Super Extra   Mybrand 906 G"", ""Arroz A La Mexicana     0.25 Lt"", ""0.25 LT"", ""Arroz Con Leche   Lala 500 G"", ""500 GR"", ""Arroz Jardinera Precocido  Verde Val..."", ""Arroz Blanco     0.25 Lt"", ""Arroz A La Mexicana      0.5 Lt"", ""0.5 LT"", ""Arroz Blanco Instantaneo  Knorr 155 ..."", ""155 GR"", ""Arroz A La Mexicana Instantaneo  Kno..."", ""Arroz Blanco Precocido  Verde Valle ..."", ""Arroz Grano Grueso  Verde Valle 1 Kg"", ""1 KG"", ""Arroz Blanco      0.5 Lt"", ""Arroz Grano Largo  Gran Cosecha 900 ..."", ""Arroz Super Extra  Verde Valle 2 Kg"", ""2 KG"", ""Arroz Grano Extra Largo  Diamante 90..."", ""Arroz Integral  Verde Valle 900 G"", ""Arroz Precocido Blanco  Verde Valle ..."", ""300 GR"", ""Arroz Con Leche   Tia Sara 200 G"", ""200 GR"", ""Arroz Super Extra Grueso   Sos 907 G"", ""Arroz A La Española Instantaneo  Kno..."", ""Arroz Instantaneo A La Poblana  Knor..."", ""-23%"", ""Arroz Para Sushi   Verde Valle 1 Kg"", ""Arroz Con Atun Dolores 220 Gramos   ..."", ""220 GR"", ""Arroz Integral Precocido   Verde Val..."", ""250 GR"", ""Mes patrio Herdez"", ""Ver más"", ""Adobo    Doña María 235 G"", ""Mole Doña María Almendrado En Pasta ..."", ""Mole Doña María Almendrado Listo Par..."", ""Mole Doña María Poblano Con Cacao En..."", ""Mole Doña Maria Poblano Con Cacao Li..."", ""Mole Doña Mariía Rojo En Pasta   125..."", ""Mole En Pasta 430 Gramos   Doña Mari..."", ""Mole Listo Para Servir  Para Servir ..."", ""Mole Rojo En Pasta  Doña Maria 235 G"", ""Mole Verde En Pasta  Doña Maria 230 ..."", ""Pipián En Pasta  Doña Maria 230 G"", ""Salsa Cacahuate Picante Cremosa   He..."", ""Salsa Casera Con Habanero   Herdez 4..."", ""Salsa Casera  Herdez 210 G"", ""Salsa Guacamole 15% Mas Guacamole He...""]}",dataset/txt_limpios/111.txt,dataset/paginas_descargadas/111.html,EN,arroz,keep,0.60,heuristic_default
112,¡Lo mejor te está esperando!,"El Arroz Extra de MiMarca en presentación de 906 gramos es la elección perfecta para tus comidas. Este arroz de alta calidad garantiza gran sabor y textura en cada bocado. Ideal para preparar tus platillos favoritos, desde pa | ... Ver más | -29% | Favoritos | Recomendados | 906 GR | Arroz Super Extra   Verde Valle 900 ... | 900 GR | Arroz Super Extra   Mybrand 906 G | Arroz Grano Largo  Gran Cosecha 900 ... | Arroz Super Extra  Verde Valle 2 Kg | 2 KG | Arroz Grano Extra Largo  Diamante 90... | Arroz Super Extra Grueso   Sos 907 G | 907 GR | Arroz Blanco Orgánico   Aires De Cam... | 1 KG | Arroz Super Extra Precocido  Sos 907... | Arroz Super Extra  Diamante 750 G | 750 GR | Arroz Grano Extra Largo En Caja  Ric... | 454 GR | -25% | Arroz Organico Integral  Aires De Ca... | Cerveza Botella Rice Lager  Asahi 33... | 330 ML | Salsa De Soya Con Chiles  Kikkoman 2... | 200 GR | Grano De Elote  Dorado  Clemente Jaq... | 410 GR | -21% | Atun En Agua   Tuny 130 G | 130 GR | 220 GR | Cerveza Six Pack Lata Light  Budligh... | Cacahuates Japones  Karate 127 G | 127 GR | Arroz   Cazerola 907 G | Alimento Humedo P/perro Todas Las Ra... | 100 GR | Atun Jumbo En Agua  Tuny 295 G | 295 GR | Arroz Con Leche   Lala 125 G | 125 GR | Arroz Impegable   Verde Valle 750 G | Galletas De Arroz Integrales   Okko ... | 140 GR | Galletas De Arroz Con Quinoa   Okko ... | Atun En Aceite   Tuny 130 G | Ensalada Campesina   La Costeña 410 ... | Salsa De Soya  Maggi 290 Ml | 290 ML | Cereal Choco Krispis    Kelloggs 540... | 540 GR | Mes patrio Herdez | Ver más | Adobo    Doña María 235 G | Mole Doña María Almendrado En Pasta ... | Mole Doña María Almendrado Listo Par... | Mole Doña María Poblano Con Cacao En... | Mole Doña Maria Poblano Con Cacao Li... | Mole Doña Mariía Rojo En Pasta   125... | Mole En Pasta 430 Gramos   Doña Mari... | Mole Listo Para Servir  Para Servir ... | Mole Rojo En Pasta  Doña Maria 235 G | Mole Verde En Pasta  Doña Maria 230 ... | Pipián En Pasta  Doña Maria 230 G | Salsa Cacahuate Picante Cremosa   He... | Salsa Casera Con Habanero   Herdez 4... | Salsa Casera  Herdez 210 G | Salsa Guacamole 15% Mas Guacamole He...",Descarga la app > 906 G,17.9,,,Desconocido,unknown,UNKNOWN,¡Lo mejor te está esperando!,Descarga la app,,906 G,17.90,,$,$17.90,17.9,False,original,17.9,17.9,1.0,default_1usd,,,,,,"El Arroz Extra de MiMarca en presentación de 906 gramos es la elección perfecta para tus comidas. Este arroz de alta calidad garantiza gran sabor y textura en cada bocado. Ideal para preparar tus platillos favoritos, desde pa | ... Ver más | -29% | Favoritos | Recomendados | 906 GR | Arroz Super Extra   Verde Valle 900 ... | 900 GR | Arroz Super Extra   Mybrand 906 G | Arroz Grano Largo  Gran Cosecha 900 ... | Arroz Super Extra  Verde Valle 2 Kg | 2 KG | Arroz Grano Extra Largo  Diamante 90... | Arroz Super Extra Grueso   Sos 907 G | 907 GR | Arroz Blanco Orgánico   Aires De Cam... | 1 KG | Arroz Super Extra Precocido  Sos 907... | Arroz Super Extra  Diamante 750 G | 750 GR | Arroz Grano Extra Largo En Caja  Ric... | 454 GR | -25% | Arroz Organico Integral  Aires De Ca... | Cerveza Botella Rice Lager  Asahi 33... | 330 ML | Salsa De Soya Con Chiles  Kikkoman 2... | 200 GR | Grano De Elote  Dorado  Clemente Jaq... | 410 GR | -21% | Atun En Agua   Tuny 130 G | 130 GR | 220 GR | Cerveza Six Pack Lata Light  Budligh... | Cacahuates Japones  Karate 127 G | 127 GR | Arroz   Cazerola 907 G | Alimento Humedo P/perro Todas Las Ra... | 100 GR | Atun Jumbo En Agua  Tuny 295 G | 295 GR | Arroz Con Leche   Lala 125 G | 125 GR | Arroz Impegable   Verde Valle 750 G | Galletas De Arroz Integrales   Okko ... | 140 GR | Galletas De Arroz Con Quinoa   Okko ... | Atun En Aceite   Tuny 130 G | Ensalada Campesina   La Costeña 410 ... | Salsa De Soya  Maggi 290 Ml | 290 ML | Cereal Choco Krispis    Kelloggs 540... | 540 GR | Mes patrio Herdez | Ver más | Adobo    Doña María 235 G | Mole Doña María Almendrado En Pasta ... | Mole Doña María Almendrado Listo Par... | Mole Doña María Poblano Con Cacao En... | Mole Doña Maria Poblano Con Cacao Li... | Mole Doña Mariía Rojo En Pasta   125... | Mole En Pasta 430 Gramos   Doña Mari... | Mole Listo Para Servir  Para Servir ... | Mole Rojo En Pasta  Doña Maria 235 G | Mole Verde En Pasta  Doña Maria 230 ... | Pipián En Pasta  Doña Maria 230 G | Salsa Cacahuate Picante Cremosa   He... | Salsa Casera Con Habanero   Herdez 4... | Salsa Casera  Herdez 210 G | Salsa Guacamole 15% Mas Guacamole He...",,"{""Detalles"": [""El Arroz Extra de MiMarca en presentación de 906 gramos es la elección perfecta para tus comidas. Este arroz de alta calidad garantiza gran sabor y textura en cada bocado. Ideal para preparar tus platillos favoritos, desde pa"", ""... Ver más"", ""-29%"", ""Favoritos"", ""Recomendados"", ""906 GR"", ""Arroz Super Extra   Verde Valle 900 ..."", ""900 GR"", ""Arroz Super Extra   Mybrand 906 G"", ""Arroz Grano Largo  Gran Cosecha 900 ..."", ""Arroz Super Extra  Verde Valle 2 Kg"", ""2 KG"", ""Arroz Grano Extra Largo  Diamante 90..."", ""Arroz Super Extra Grueso   Sos 907 G"", ""907 GR"", ""Arroz Blanco Orgánico   Aires De Cam..."", ""1 KG"", ""Arroz Super Extra Precocido  Sos 907..."", ""Arroz Super Extra  Diamante 750 G"", ""750 GR"", ""Arroz Grano Extra Largo En Caja  Ric..."", ""454 GR"", ""-25%"", ""Arroz Organico Integral  Aires De Ca..."", ""Cerveza Botella Rice Lager  Asahi 33..."", ""330 ML"", ""Salsa De Soya Con Chiles  Kikkoman 2..."", ""200 GR"", ""Grano De Elote  Dorado  Clemente Jaq..."", ""410 GR"", ""-21%"", ""Atun En Agua   Tuny 130 G"", ""130 GR"", ""220 GR"", ""Cerveza Six Pack Lata Light  Budligh..."", ""Cacahuates Japones  Karate 127 G"", ""127 GR"", ""Arroz   Cazerola 907 G"", ""Alimento Humedo P/perro Todas Las Ra..."", ""100 GR"", ""Atun Jumbo En Agua  Tuny 295 G"", ""295 GR"", ""Arroz Con Leche   Lala 125 G"", ""125 GR"", ""Arroz Impegable   Verde Valle 750 G"", ""Galletas De Arroz Integrales   Okko ..."", ""140 GR"", ""Galletas De Arroz Con Quinoa   Okko ..."", ""Atun En Aceite   Tuny 130 G"", ""Ensalada Campesina   La Costeña 410 ..."", ""Salsa De Soya  Maggi 290 Ml"", ""290 ML"", ""Cereal Choco Krispis    Kelloggs 540..."", ""540 GR"", ""Mes patrio Herdez"", ""Ver más"", ""Adobo    Doña María 235 G"", ""Mole Doña María Almendrado En Pasta ..."", ""Mole Doña María Almendrado Listo Par..."", ""Mole Doña María Poblano Con Cacao En..."", ""Mole Doña Maria Poblano Con Cacao Li..."", ""Mole Doña Mariía Rojo En Pasta   125..."", ""Mole En Pasta 430 Gramos   Doña Mari..."", ""Mole Listo Para Servir  Para Servir ..."", ""Mole Rojo En Pasta  Doña Maria 235 G"", ""Mole Verde En Pasta  Doña Maria 230 ..."", ""Pipián En Pasta  Doña Maria 230 G"", ""Salsa Cacahuate Picante Cremosa   He..."", ""Salsa Casera Con Habanero   Herdez 4..."", ""Salsa Casera  Herdez 210 G"", ""Salsa Guacamole 15% Mas Guacamole He...""]}",dataset/txt_limpios/112.txt,dataset/paginas_descargadas/112.html,EN,atun,keep,0.60,heuristic_default
