source_id,title,description,breadcrumbs,price_raw,currency_raw,url,seller,availability,country,product_name,brand,reference,unit,price_amount,price_currency,price_symbol,price_text,price_amount_filled,price_is_imputed,price_imputation_source,price_amount_usd,price_amount_usd_filled,fx_rate_local_per_usd,fx_source,information_text,description_text,features_text,specifications_text,benefits_text,details_text,other_sections,sections,txt_path,html_path,es_status,category_canonical,decision,match_score,reasons
1222,Seja Bem Vindo à Plaza Vea,Información de la marca,Lácteos y Huevos > 900ml,7.0,PEN,,Desconocido,unknown,PE,Seja Bem Vindo à Plaza Vea,Lácteos y Huevos,,900ml,7.00,PEN,S/,S/7,7.0,False,original,1.9718,1.9718,3.55,from_peru_cambio_dolar,,Información de la marca,"Presentación/Empaque | Botella | Denominación Contenido De Grasa | Entera | Libre De Lactosa | No | Descripción Técnica | Leche entera pasteurizada. | Porción Sugerida | 200ml | Formato | Líquido | Tipo De Producto | Leche Entera | Calorías Por Porción | 116.4Kcal | Carbohidratos Por Porción | 8.9g | Proteínas Por Porción | 5.9g | Composición/Origen | Animal | Advertencias De Almacenamiento | Mantener refrigerado. | Contenido Neto | 900ml | Denominación/Variedad | Advertencias de consumo | Este producto NO es un sustituto de la leche materna. Mantener refrigerado una vez abierto. | Revisa todo | Importante destacar | Leche Fresca | Presentación en botella | Contenido de 900ml/li> | Descripción del producto | LECHES | plazaVea | presenta lo mejor en productos de | para que acompañes tus | desayunos | , | meriendas | y | diversas recetas | con insumos de alta calidad. Descubre las marcas más destacadas en | y elige tu favorita. | En la web de plazaVea Online, tendrás a tu alcance distintas presentaciones de | , variedad ideal para preparar los más sabrosos jugos para el desayuno, o tan solo beberla acompañada de unas deliciosas galletas en la media tarde. Por otro lado, están las | Leches Evaporadas y Mezclas Lácteas | con las que se pueden cocinar distintos platillos de la cocina nacional e internacional, así como mezclar con una buena taza de agua hirviendo para el clásico | café con leche | de todas las mañanas. Si lo tuyo es la preparación más instantánea y de sabor único, puedes elegir entre las distintas opciones de | Leche en Polvo | que | Leche de Soya y Otras Bebidas Vegetales | es perfecta para ellas. | Complementa tu compra ingresando a nuestra sección de | y descubre toda la variedad de productos que plazaVea Online tiene para ti pensando en brindarte lo mejor para tu | alimentación | y nutrición. | ¡Conoce las distintas opciones de | en plazaVea Online! | ""La Leche Pasteurizada Danlac es elaborada a partir de 100% leche, sin adición de leche en polvo, ni reconstituyentes químicos, ni preservantes, ni grasas vegetales. Es 100% natural y 100% pura."" | Descubre todas las variedades de | que te ofrece la | tienda Online de plazaVea | . Elige tu favorita, busca tus complementos, | arma tu pedido desde donde estés | y compra de forma rápida y práctica. | ¿No es lo que buscas? Encuentra más | en plazaVea | Componentes del Producto | Vendido por | En caso algo no vaya como gustes: Puedes revisar nuestras | Politicas de cambios y/o devoluciones | y hacerlas efectivas en todas nuestras tiendas. | Productos | que te pueden interesar | similares | .00 | un | 3 | productos agregados | Agrega indicaciones | Guardar | Leche Modificada UHT LA PREFERIDA Bolsa 800ml | LA PREFERIDA | Bebida Almendra sin Endulzar LAIVE Vio Caja 946ml Paquete 4un | Leche SBELT UHT Descremada Caja 946ml Paquete 4un | SBELT | Bebida Láctea YOPI Sabor a Chocolate Paquete 6un | Leche sin Lactosa LAIVE UHT Tetrapack 946ml | Leche sin Lactosa LAIVE UHT Light Tetrapack 946ml | Leche LAIVE UHT Light Tetrapack 946ml | Recomendado para ti",,,,,"{""Descripción"": [""Información de la marca""], ""Características"": [""Presentación/Empaque"", ""Botella"", ""Denominación Contenido De Grasa"", ""Entera"", ""Libre De Lactosa"", ""No"", ""Descripción técnica"", ""Leche entera pasteurizada."", ""Porción sugerida"", ""200ml"", ""Formato"", ""Líquido"", ""Tipo De Producto"", ""Leche Entera"", ""Calorías Porción"", ""116.4Kcal"", ""Carbohidratos Porción"", ""8.9g"", ""Proteínas Porción"", ""5.9g"", ""Composición/Origen"", ""Animal"", ""Advertencias De Almacenamiento"", ""Mantener refrigerado."", ""Contenido Neto"", ""900ml"", ""Denominación/Variedad"", ""Advertencias de consumo"", ""Este producto NO es un sustituto de la leche materna. Mantener refrigerado una vez abierto."", ""Revisa todo"", ""Importante destacar"", ""Leche Fresca"", ""Presentación en botella"", ""Contenido de 900ml/li>"", ""Descripción del producto"", ""LECHES"", ""plazaVea"", ""presenta lo mejor en productos de"", ""para que acompañes tus"", ""desayunos"", "","", ""meriendas"", ""y"", ""diversas recetas"", ""con insumos de alta calidad. Descubre las marcas más destacadas en"", ""y elige tu favorita."", ""En la web de plaza Vea Online, tendrás diferentes presentaciones de"", "", variedad ideal para preparar los más sabrosos jugos para el desayuno, el tan solo beberla acompañada de unas deliciosas galletas en la media tarde. Por otro lado, están las"", ""Leches Evaporadas y Mezclas Lácteas"", ""con las que se pueden cocinar distintos platillos de la cocina nacional e internacional, así como mezclar con una buena taza de agua hirviendo para el clásico"", ""café con leche"", ""de todas las mañanas. Si lo tuyo es la preparación más instantánea y de sabor único, puedes elegir entre las distintas opciones de"", ""Leche en Polvo"", ""que"", ""Leche de Soya y Otras Bebidas Vegetales"", ""es perfecta para ellas."", ""Complementa tu compra ingresando nuestra sección de"", ""y descubre toda la variedad de productos que plazaVea Online tiene para ti pensando en brindarte lo mejor para tu"", ""alimentación"", ""y nutrición."", ""¡Conoce las distintas opciones de"", ""en plazaVea Online!"", ""\""La Leche Pasteurizada Danlac es elaborada a partir de 100% leche, sin adición de leche en polvo, ni reconstituyentes químicos, ni preservantes, ni grasas vegetales. Es 100% natural y 100% pura.\"""", ""Descubre todas las variedades de"", ""que te ofrece la"", ""tienda Online de plazaVea"", "". Elige tu favorita, busca tus complementos,"", ""arma tu pedido desde donde estés"", ""y compra de forma rápida y práctica."", ""¿En qué búsqueda? Encuentra más"", ""en plazaVea"", ""Componentes del Producto"", ""Vendido por"", ""En caso algo no vaya como gustes: Puedes revisar nuestras"", ""Politicas de cambios y/o devoluciones"", ""y hacerlas efectivas en todas nuestras tiendas."", ""Productos"", ""que te pueden interesar"", ""similares"", "".00"", ""un"", ""3"", ""productos agregados"", ""Agrega indicaciones"", ""Guardar"", ""Leche Modificada UHT LA PREFERIDA Bolsa 800ml"", ""LA PREFERIDA"", ""Bebida Almendra sin Endulzar LAIVE Vio Caja 946ml Paquete 4un"", ""Leche SBELT UHT Descremada Caja 946ml Paquete 4un"", ""SBELT"", ""Bebida Láctea YOPI Sabor a Chocolate Paquete 6un"", ""Leche sin Lactosa LAIVE UHT Tetrapack 946ml"", ""Leche sin Lactosa LAIVE UHT Light Tetrapack 946ml"", ""Leche LAIVE UHT Light Tetrapack 946ml"", ""Recomendado para ti""]}",dataset/txt_limpios/1222.txt,dataset/paginas_descargadas/1222.html,ET,huevo,discard,0.30,heuristic_default
1223,Seja Bem Vindo à Plaza Vea,Información de la marca,Lácteos y Huevos > 1Kg,13.0,PEN,,Desconocido,unknown,PE,Seja Bem Vindo à Plaza Vea,Lácteos y Huevos,,1Kg,13.00,PEN,S/,S/13,13.0,False,original,3.662,3.662,3.55,from_peru_cambio_dolar,,Información de la marca,Revisa todo | Componentes del Producto | Vendido por | plazaVea | En caso algo no vaya como gustes: Puedes revisar nuestras | Politicas de cambios y/o devoluciones | y hacerlas efectivas en todas nuestras tiendas. | Productos | que te pueden interesar | similares | .00 | un | 3 | productos agregados | Agrega indicaciones | Guardar | Multiplicador-de-unidad: Express | Huevo Rosado de Corral ARO Bandeja 30un | Huevos de Codorniz TRUMPER'S Paquete 18un | LA VERÓNICA | Recomendado para ti,,,,,"{""Descripción"": [""Información de la marca""], ""Características"": [""Revisa todo"", ""Componentes del Producto"", ""Vendido por"", ""plazaVea"", ""En caso algo no vaya como gustes: Puedes revisar nuestras"", ""Politicas de cambios y/o devoluciones"", ""y hacerlas efectivas en todas nuestras tiendas."", ""Productos"", ""que te pueden interesar"", ""similares"", "".00"", ""un"", ""3"", ""productos agregados"", ""Agrega indicaciones"", ""Guardar"", ""Multiplicador-de-unidad: Express"", ""Huevo Rosado de Corral ARO Bandeja 30un"", ""Huevos de Codorniz TRUMPER'S Paquete 18un"", ""LA VERÓNICA"", ""Recomendado para ti""]}",dataset/txt_limpios/1223.txt,dataset/paginas_descargadas/1223.html,EN,huevo,discard,0.30,heuristic_default
1224,Seja Bem Vindo à Plaza Vea,Información de la marca,Abarrotes > 5Kg,16.0,PEN,,Desconocido,unknown,PE,Seja Bem Vindo à Plaza Vea,Abarrotes,,5Kg,16.00,PEN,S/,S/16,16.0,False,original,4.507,4.507,3.55,from_peru_cambio_dolar,,Información de la marca,Denominación/Variedad | ARO AZUCAR RUBIA BL X5KG | Revisa todo | Componentes del Producto | Vendido por | plazaVea | En caso algo no vaya como gustes: Puedes revisar nuestras | Politicas de cambios y/o devoluciones | y hacerlas efectivas en todas nuestras tiendas. | Productos | que te pueden interesar | similares | .00 | un | 3 | productos agregados | Agrega indicaciones | Guardar | Multiplicador-de-unidad: MAKRO-Bi-Precio|Vigente Oculto | Azúcar Rubia LA BODEGUITA Bolsa 1Kg | LA BODEGUITA | Azúcar Rubia San Jacinto 25 Kg | SAN JACINTO | Azúcar Rubia DULCEOLMOS Saco 50Kg | DULCEOLMOS | Recomendado para ti,,,,,"{""Descripción"": [""Información de la marca""], ""Características"": [""Denominación/Variedad"", ""ARO AZUCAR RUBIA BL X5KG"", ""Revisa todo"", ""Componentes del Producto"", ""Vendido por"", ""plazaVea"", ""En caso algo no vaya como gustes: Puedes revisar nuestras"", ""Politicas de cambios y/o devoluciones"", ""y hacerlas efectivas en todas nuestras tiendas."", ""Productos"", ""que te pueden interesar"", ""similares"", "".00"", ""un"", ""3"", ""productos agregados"", ""Agrega indicaciones"", ""Guardar"", ""Multiplicador-de-unidad: MAKRO-Bi-Precio|Vigente Oculto"", ""Azúcar Rubia LA BODEGUITA Bolsa 1Kg"", ""LA BODEGUITA"", ""Azúcar Rubia San Jacinto 25 Kg"", ""SAN JACINTO"", ""Azúcar Rubia DULCEOLMOS Saco 50Kg"", ""DULCEOLMOS"", ""Recomendado para ti""]}",dataset/txt_limpios/1224.txt,dataset/paginas_descargadas/1224.html,EN,sin_categoria,discard,0.30,no_category_detected
1225,Seja Bem Vindo à Plaza Vea,Información de la marca,Abarrotes > 5Kg,21.0,PEN,,Desconocido,unknown,PE,Seja Bem Vindo à Plaza Vea,Abarrotes,,5Kg,21.00,PEN,S/,S/21,21.0,False,original,5.9155,5.9155,3.55,from_peru_cambio_dolar,,Información de la marca,"Importante destacar | Contenido de 5 kilos | Marca: CARTAVIO | Descripción del producto | AZÚCARES Y ENDULZANTES | plazaVea | cuenta con una amplia variedad de | para que puedas elegir el que más se adecúe a tus necesidades. | Dentro de los | encontramos los | , un producto muy utilizado en la cocina y repostería gracias a su versatilidad. Por ejemplo el | Azúcar Blanca | es perfecta para preparar postres debido al color y brillo que le otorga a los postres. Además también puedes optar por alguna variedad de | Endulzantes | para ponerle sabor a tus refrescos de mesa, y preparar postres para personas que son intolerantes al azúcar. | ¡Conoce las distintas opciones en | en plazaVea Online! | *La imagen solo es referencial | ¿No es lo que buscas? Encuentra más | en plazaVea | Revisa todo | Componentes del Producto | Vendido por | En caso algo no vaya como gustes: Puedes revisar nuestras | Politicas de cambios y/o devoluciones | y hacerlas efectivas en todas nuestras tiendas. | Productos | que te pueden interesar | similares | .00 | un | 3 | productos agregados | Agrega indicaciones | Guardar | Multiplicador-de-unidad: MAKRO-Bi-Precio|Vigente Oculto | Azúcar Rubia LA BODEGUITA Bolsa 1Kg | LA BODEGUITA | Azúcar Rubia SAN JACINTO x 50Kg | SAN JACINTO | Azúcar Rubia DULCEOLMOS Saco 50Kg | DULCEOLMOS | Recomendado para ti",,,,,"{""Descripción"": [""Información de la marca""], ""Características"": [""Importante destacar"", ""Contenido de 5 kilos"", ""Marca: CARTAVIO"", ""Descripción del producto"", ""AZÚCARES Y ENDULZANTES"", ""plazaVea"", ""cuenta con una amplia variedad de"", ""para que puedas elegir qué más se adecúe a tus necesidades."", ""Dentro de los"", ""encontramos los"", "", un producto muy utilizado en la cocina y repostería gracias a su versatilidad. Por ejemplo el"", ""Azúcar Blanca"", ""es perfecta para preparar postres debido al color y brillo que le otorga a los postres. También puedes optar por alguna variedad de"", ""Endulzantes"", ""para ponerle sabor a tus refrescos de mesa, y preparar postres para personas que son intolerantes al azúcar."", ""¡Conoce las distintas opciones en"", ""en plazaVea Online!"", ""*La imagen solo es referencial"", ""¿En qué búsqueda? Encuentra más"", ""en plazaVea"", ""Revisa todo"", ""Componentes del Producto"", ""Vendido por"", ""En caso algo no vaya como gustes: Puedes revisar nuestras"", ""Politicas de cambios y/o devoluciones"", ""y hacerlas efectivas en todas nuestras tiendas."", ""Productos"", ""que te pueden interesar"", ""similares"", "".00"", ""un"", ""3"", ""productos agregados"", ""Agrega indicaciones"", ""Guardar"", ""Multiplicador-de-unidad: MAKRO-Bi-Precio|Vigente Oculto"", ""Azúcar Rubia LA BODEGUITA Bolsa 1Kg"", ""LA BODEGUITA"", ""Azúcar Rubia SAN JACINTO x 50Kg"", ""SAN JACINTO"", ""Azúcar Rubia DULCEOLMOS Saco 50Kg"", ""DULCEOLMOS"", ""Recomendado para ti""]}",dataset/txt_limpios/1225.txt,dataset/paginas_descargadas/1225.html,ET,sin_categoria,discard,0.30,no_category_detected
1226,Seja Bem Vindo à Plaza Vea,Información de la marca,Abarrotes > 1Kg,4.0,PEN,,Desconocido,unknown,PE,Seja Bem Vindo à Plaza Vea,Abarrotes,,1Kg,4.00,PEN,S/,S/4,4.0,False,original,1.1268,1.1268,3.55,from_peru_cambio_dolar,,Información de la marca,Revisa todo | Componentes del Producto | Vendido por | plazaVea | En caso algo no vaya como gustes: Puedes revisar nuestras | Politicas de cambios y/o devoluciones | y hacerlas efectivas en todas nuestras tiendas. | Productos | que te pueden interesar | similares | un | 3 | productos agregados | Agrega indicaciones | Guardar | Multiplicador-de-unidad: MAKRO-Bi-Precio|Vigente Oculto | Multiplicador-de-unidad: Express | Azucar Rubia PANTALEON Bolsa 50Kg | PANTALEON | Azúcar Rubia San Jacinto 25 Kg | SAN JACINTO | Azúcar Rubia SAN JACINTO x 50Kg | Azúcar Rubia DULFINA Bolsa 500g | Recomendado para ti,,,,,"{""Descripción"": [""Información de la marca""], ""Características"": [""Revisa todo"", ""Componentes del Producto"", ""Vendido por"", ""plazaVea"", ""En caso algo no vaya como gustes: Puedes revisar nuestras"", ""Politicas de cambios y/o devoluciones"", ""y hacerlas efectivas en todas nuestras tiendas."", ""Productos"", ""que te pueden interesar"", ""similares"", ""un"", ""3"", ""productos agregados"", ""Agrega indicaciones"", ""Guardar"", ""Multiplicador-de-unidad: MAKRO-Bi-Precio|Vigente Oculto"", ""Multiplicador-de-unidad: Express"", ""Azucar Rubia PANTALEON Bolsa 50Kg"", ""PANTALEON"", ""Azúcar Rubia San Jacinto 25 Kg"", ""SAN JACINTO"", ""Azúcar Rubia SAN JACINTO x 50Kg"", ""Azúcar Rubia DULFINA Bolsa 500g"", ""Recomendado para ti""]}",dataset/txt_limpios/1226.txt,dataset/paginas_descargadas/1226.html,EN,sin_categoria,discard,0.30,no_category_detected
1227,Seja Bem Vindo à Plaza Vea,Información de la marca,Abarrotes > 1Kg,4.0,PEN,,Desconocido,unknown,PE,Seja Bem Vindo à Plaza Vea,Abarrotes,,1Kg,4.00,PEN,S/,S/4,4.0,False,original,1.1268,1.1268,3.55,from_peru_cambio_dolar,,Información de la marca,Denominación/Variedad | M&K AZUCAR BLANCA BL X 1 KG | Revisa todo | Componentes del Producto | Vendido por | plazaVea | En caso algo no vaya como gustes: Puedes revisar nuestras | Politicas de cambios y/o devoluciones | y hacerlas efectivas en todas nuestras tiendas. | Productos | que te pueden interesar | similares | .00 | un | 3 | productos agregados | Agrega indicaciones | Guardar | Multiplicador-de-unidad: Express | Azúcar Blanca Refinada Paramonga Bolsa 50 Kg | Azúcar Blanca ARO Sachet x500un | Azúcar Blanca SAN JACINTO Saco 50kg | SAN JACINTO | Azúcar Blanca Refinada Industrial PARAMONGA x 50Kg | Recomendado para ti,,,,,"{""Descripción"": [""Información de la marca""], ""Características"": [""Denominación/Variedad"", ""M&K AZUCAR BLANCA BL X 1 KG"", ""Revisa todo"", ""Componentes del Producto"", ""Vendido por"", ""plazaVea"", ""En caso algo no vaya como gustes: Puedes revisar nuestras"", ""Politicas de cambios y/o devoluciones"", ""y hacerlas efectivas en todas nuestras tiendas."", ""Productos"", ""que te pueden interesar"", ""similares"", "".00"", ""un"", ""3"", ""productos agregados"", ""Agrega indicaciones"", ""Guardar"", ""Multiplicador-de-unidad: Express"", ""Azúcar Blanca Refinada Paramonga Bolsa 50 Kg"", ""Azúcar Blanca ARO Sachet x500un"", ""Azúcar Blanca SAN JACINTO Saco 50kg"", ""SAN JACINTO"", ""Azúcar Blanca Refinada Industrial PARAMONGA x 50Kg"", ""Recomendado para ti""]}",dataset/txt_limpios/1227.txt,dataset/paginas_descargadas/1227.html,EN,sin_categoria,discard,0.30,no_category_detected
1229,Seja Bem Vindo à Plaza Vea,Información de la marca,Panadería y Pastelería > 600g,8.0,PEN,,Desconocido,unknown,PE,Seja Bem Vindo à Plaza Vea,Panadería y Pastelería,,600g,8.00,PEN,S/,S/8,8.0,False,original,2.2535,2.2535,3.55,from_peru_cambio_dolar,,Información de la marca,Revisa todo | Componentes del Producto | Vendido por | plazaVea | En caso algo no vaya como gustes: Puedes revisar nuestras | Politicas de cambios y/o devoluciones | y hacerlas efectivas en todas nuestras tiendas. | Productos | que te pueden interesar | similares | MAKRO-Bi-Precio|Vigente Oculto | Pan Molde Blanco ARO Bolsa 600g | .00 | un | 3 | productos agregados | Agrega indicaciones | Guardar | Pan Hot Dog Junior ARO Bolsa 400g Paquete 8un | Pan de Molde Blanco DOLCEZZA Bolsa 500g | DOLCEZZA | Pan Integral BAUDUCCO Bolsa 390g | BAUDUCCO | Pan Hot Dog Jumbo ARO 640g Paquete 8un | Pan Pita UNIÓN Gran Andina Bolsa 300g | UNIÓN | Multiplicador-de-unidad: MAKRO-Bi-Precio|Vigente Oculto | Pan de Molde Integral SUPERBOM Familiar Bolsa 495g | SUPERBOM | Recomendado para ti,,,,,"{""Descripción"": [""Información de la marca""], ""Características"": [""Revisa todo"", ""Componentes del Producto"", ""Vendido por"", ""plazaVea"", ""En caso algo no vaya como gustes: Puedes revisar nuestras"", ""Politicas de cambios y/o devoluciones"", ""y hacerlas efectivas en todas nuestras tiendas."", ""Productos"", ""que te pueden interesar"", ""similares"", ""MAKRO-Bi-Precio|Vigente Oculto"", ""Pan Molde Blanco ARO Bolsa 600g"", "".00"", ""un"", ""3"", ""productos agregados"", ""Agrega indicaciones"", ""Guardar"", ""Pan Hot Dog Junior ARO Bolsa 400g Paquete 8un"", ""Pan de Molde Blanco DOLCEZZA Bolsa 500g"", ""DOLCEZZA"", ""Pan Integral BAUDUCCO Bolsa 390g"", ""BAUDUCCO"", ""Pan Hot Dog Jumbo ARO 640g Paquete 8un"", ""Pan Pita UNIÓN Gran Andina Bolsa 300g"", ""UNIÓN"", ""Multiplicador-de-unidad: MAKRO-Bi-Precio|Vigente Oculto"", ""Pan de Molde Integral SUPERBOM Familiar Bolsa 495g"", ""SUPERBOM"", ""Recomendado para ti""]}",dataset/txt_limpios/1229.txt,dataset/paginas_descargadas/1229.html,EN,sin_categoria,discard,0.30,no_category_detected
