source_id,title,description,breadcrumbs,price_raw,currency_raw,url,seller,availability,country,product_name,brand,reference,unit,price_amount,price_currency,price_symbol,price_text,price_amount_filled,price_is_imputed,price_imputation_source,price_amount_usd,price_amount_usd_filled,fx_rate_local_per_usd,fx_source,information_text,description_text,features_text,specifications_text,benefits_text,details_text,other_sections,sections,txt_path,html_path,es_status,category_canonical,decision,match_score,reasons
1237,Seja Bem Vindo à Plaza Vea,Información de la marca,Abarrotes > 950g,5.0,PEN,,Desconocido,unknown,PE,Seja Bem Vindo à Plaza Vea,Abarrotes,,950g,5.00,PEN,S/,S/5,5.0,False,original,1.4085,1.4085,3.55,from_peru_cambio_dolar,,Información de la marca,"Presentación/Empaque | Bolsa | Producto Preparado | No | Relleno | 0 | Porción Sugerida | 80g | Alérgenos Declarados | Gluten | Azúcares Por Porción | 3g | Calorías Por Porción | 280 | Carbohidratos Por Porción | 59g | Descripción Nutricional | Semola de trigo fortificada | Grasas Por Porción | 1.6g | Proteínas Por Porción | 11g | Sodio Por Porción | 4mg | Peso Neto (g) | Advertencias De Almacenamiento | Conservar en un ambiente frescos, limpio, seco y libre de contamicacion. Referencia menor a 20 grados y 65%HR | Advertencias de consumo | Contiene gluten, puede contener trazas de huevo | Revisa todo | Componentes del Producto | Vendido por | plazaVea | En caso algo no vaya como gustes: Puedes revisar nuestras | Politicas de cambios y/o devoluciones | y hacerlas efectivas en todas nuestras tiendas. | Productos | que te pueden interesar | similares | Multiplicador-de-unidad: MAKRO-Bi-Precio|Vigente Oculto | .00 | un | 3 | productos agregados | Agrega indicaciones | Guardar | Fideos Tallarin ARO Bola x1Kg | Fideo Tallarín LAVAGGI Bolsa 950g | LAVAGGI | Fideo Spaghetti LAVAGGI Bolsa 950g | Fideos Spaghetti N°5 BARILLA Caja 1Kg | BARILLA | Fideos Spaghetti LAVAGGI Bolsa 450g | Fideos AGNESI Spaghetti Bolsa 500g | AGNESI | Fideos AGNESI Linguini Bolsa 500g | Recomendado para ti",,,,,"{""Descripción"": [""Información de la marca""], ""Características"": [""Presentación/Empaque"", ""Bolsa"", ""Producto Preparado"", ""No"", ""Relleno"", ""0"", ""Porción sugerida"", ""80g"", ""Alérgenos Declarados"", ""Gluten"", ""Azúcar por porción"", ""3g"", ""Calorías Porción"", ""280"", ""Carbohidratos Porción"", ""59g"", ""Descripción Nutricional"", ""Semola de trigo fortificada"", ""Grasas Porción"", ""1.6g"", ""Proteínas Porción"", ""11g"", ""Sodio Porción"", ""4mg"", ""Peso Neto (g)"", ""Advertencias De Almacenamiento"", ""Conservar en un ambiente frescos, limpio, seco y libre de contamicacion. Referencia menor a 20 grados y 65%HR"", ""Advertencias de consumo"", ""Contiene gluten, puede contener trazas de huevo"", ""Revisa todo"", ""Componentes del Producto"", ""Vendido por"", ""plazaVea"", ""En caso algo no vaya como gustes: Puedes revisar nuestras"", ""Politicas de cambios y/o devoluciones"", ""y hacerlas efectivas en todas nuestras tiendas."", ""Productos"", ""que te pueden interesar"", ""similares"", ""Multiplicador-de-unidad: MAKRO-Bi-Precio|Vigente Oculto"", "".00"", ""un"", ""3"", ""productos agregados"", ""Agrega indicaciones"", ""Guardar"", ""Fideos Tallarin ARO Bola x1Kg"", ""Fideo Tallarín LAVAGGI Bolsa 950g"", ""LAVAGGI"", ""Fideo Spaghetti LAVAGGI Bolsa 950g"", ""Fideos Spaghetti N°5 BARILLA Caja 1Kg"", ""BARILLA"", ""Fideos Spaghetti LAVAGGI Bolsa 450g"", ""Fideos AGNESI Spaghetti Bolsa 500g"", ""AGNESI"", ""Fideos AGNESI Linguini Bolsa 500g"", ""Recomendado para ti""]}",dataset/txt_limpios/1237.txt,dataset/paginas_descargadas/1237.html,ET,sin_categoria,discard,0.30,no_category_detected
1238,Seja Bem Vindo à Plaza Vea,Información de la marca,Abarrotes > 500g,11.0,PEN,,Desconocido,unknown,PE,Seja Bem Vindo à Plaza Vea,Abarrotes,,500g,11.00,PEN,S/,S/11,11.0,False,original,3.0986,3.0986,3.55,from_peru_cambio_dolar,,Información de la marca,"Presentación/Empaque | Caja | Producto Preparado | No | Porción Sugerida | 85g | Tipo De Producto | Spaghetti | Alérgenos Declarados | Puede contener Soja y Huevo. | Calorías Por Porción | 305Kcal | Carbohidratos Por Porción | 58g | Grasas Por Porción | 1.6g | Proteínas Por Porción | 9.1g | Sodio Por Porción | 0mg | Advertencias De Almacenamiento | Almacenar en un lugar fresco y seco. | Contenido Neto | 500g | Denominación/Variedad | N°5 | Advertencias de consumo | Consumir antes de la fecha indicada en el envase. | Revisa todo | Importante destacar | Pasta de fácil cocción | Conservar en lugar fresco y seco | Descripción del producto | FIDEOS Y PASTAS | plazaVea | cuenta con una amplia variedad de | para que puedas elegir el que más se adecua a tus necesidades. | Dentro de los | encontramos | Jamón | y | Quesos | la combinación de ambos será un deleite en tu paladar. | Vino Tinto | .Por otro lado, si la salsa incluye albahaca, aceite de oliva y queso parmesano , un | Vino Blanco | con elevada acidez y aromas de flores o frutas puede aportar un buen equilibrio de sabores. | ¡Conoce las distintas opciones en | en plazaVea Online! | *La imagen sólo es referencial | Componentes del Producto | Vendido por | En caso algo no vaya como gustes: Puedes revisar nuestras | Politicas de cambios y/o devoluciones | y hacerlas efectivas en todas nuestras tiendas. | Productos | que te pueden interesar | similares | Multiplicador-de-unidad: MAKRO-Bi-Precio|Vigente Oculto | un | 3 | productos agregados | Agrega indicaciones | Guardar | Fideos DON VITTORIO Linguini Grosso Bolsa 950g | Fideos Cabello de Ángel MOLITALIA Bolsa 250g | Fideos NICOLINI Tallarín Grueso Bolsa 1kg | NICOLINI | Fideo Spaghetti SAN JORGE Bolsa 1Kg | SAN JORGE | Fideos Tallarín LAVAGGI Bolsa 450g | LAVAGGI | Fideos AGNESI Spaghetti Bolsa 500g | AGNESI | Recomendado para ti",,,,,"{""Descripción"": [""Información de la marca""], ""Características"": [""Presentación/Empaque"", ""Caja"", ""Producto Preparado"", ""No"", ""Porción sugerida"", ""85g"", ""Tipo De Producto"", ""Spaghetti"", ""Alérgenos Declarados"", ""Puede contener Soja y Huevo."", ""Calorías Porción"", ""305Kcal"", ""Carbohidratos Porción"", ""58g"", ""Grasas Porción"", ""1.6g"", ""Proteínas Porción"", ""9.1g"", ""Sodio Porción"", ""0mg"", ""Advertencias De Almacenamiento"", ""Almacenar en un lugar fresco y seco."", ""Contenido Neto"", ""500g"", ""Denominación/Variedad"", ""N°5"", ""Advertencias de consumo"", ""Consumir antes de la fecha indicada en el envase."", ""Revisa todo"", ""Importante destacar"", ""Carpeta de fácil cocción"", ""Conservar en lugar fresco y seco"", ""Descripción del producto"", ""FIDEOS Y PASTAS"", ""plazaVea"", ""cuenta con una amplia variedad de"", ""para que puedas elegir qué más se adecua a tus necesidades."", ""Dentro de los"", ""encontramos"", ""Jamón"", ""y"", ""Quesos"", ""la combinación de ambos será un deleite en tu paladar."", ""Vino Tinto"", "".Por otro lado, si la salsa incluye albahaca, aceite de oliva y queso parmesano , un"", ""Vino Blanco"", ""con elevada acidez y aromas de flores, las frutas pueden aportar un buen equilibrio de sabores."", ""¡Conoce las distintas opciones en"", ""en plazaVea Online!"", ""*La imagen solo es referencial"", ""Componentes del Producto"", ""Vendido por"", ""En caso algo no vaya como gustes: Puedes revisar nuestras"", ""Politicas de cambios y/o devoluciones"", ""y hacerlas efectivas en todas nuestras tiendas."", ""Productos"", ""que te pueden interesar"", ""similares"", ""Multiplicador-de-unidad: MAKRO-Bi-Precio|Vigente Oculto"", ""un"", ""3"", ""productos agregados"", ""Agrega indicaciones"", ""Guardar"", ""Fideos DON VITTORIO Linguini Grosso Bolsa 950g"", ""Fideos Cabello de Ángel MOLITALIA Bolsa 250g"", ""Fideos NICOLINI Tallarín Grueso Bolsa 1kg"", ""NICOLINI"", ""Fideo Spaghetti SAN JORGE Bolsa 1Kg"", ""SAN JORGE"", ""Fideos Tallarín LAVAGGI Bolsa 450g"", ""LAVAGGI"", ""Fideos AGNESI Spaghetti Bolsa 500g"", ""AGNESI"", ""Recomendado para ti""]}",dataset/txt_limpios/1238.txt,dataset/paginas_descargadas/1238.html,ET,sin_categoria,discard,0.30,no_category_detected
1239,Seja Bem Vindo à Plaza Vea,Información de la marca,Abarrotes > 160g,19.0,PEN,,Desconocido,unknown,PE,Seja Bem Vindo à Plaza Vea,Abarrotes,,160g,19.00,PEN,S/,S/19,19.0,False,original,5.3521,5.3521,3.55,from_peru_cambio_dolar,,Información de la marca,"Presentación/Empaque | Lata | Porción Sugerida | 2 | Alérgenos Declarados | Atun, aceite vegetal (Soya) | Azúcares Por Porción | 0g / 100g | Calorías Por Porción | 236.7 Kcal/100g | Carbohidratos Por Porción | Certificaciones | safe | Contenido Escurrido | 110gr | Descripción Nutricional | Contiene Omega 3. | Grasas Por Porción | 16.5 g/100g | Medio De Conservación | Aceite vegetal | Proteínas Por Porción | 21.7g/100g | Sodio Por Porción | 336.7 mg/100 g | Advertencias De Almacenamiento | Mantener en un lugar fresco y seco,refrigerar una vez abierto | Contenido Neto | 160gr | Denominación/Variedad | Grated Campomar 6pack | Revisa todo | Componentes del Producto | Vendido por | plazaVea | En caso algo no vaya como gustes: Puedes revisar nuestras | Politicas de cambios y/o devoluciones | y hacerlas efectivas en todas nuestras tiendas. | Productos | que te pueden interesar | similares | Trozos de Atún en Aceite Vegetal y Sal GLORIA Lata 140g Paquete 6un | .00 | un | 3 | productos agregados | Agrega indicaciones | Guardar | Filete de Atún FLORIDA en Aceite Vegetal Lata 140g Paquete 6un | Trozos de Atún MARINERO en Aceite Vegetal Lata 140g Paquete 6un | MARINERO | Filete de Atún en Aceite Vegetal A1 Lata 140g Paquete 6un | A1 | Conserva FRESCOMAR Trozos de Caballa Lata 170g Paquete 6un | FRESCOMAR | Trozos De Jurel Frescomar Lata 170g Paquete 6un | Trozos de Jurel M&K Lata 170g | M&K | Filete de Bonito DORITA en Aceite Vegetal Lata 170g | DORITA | Recomendado para ti",,,,,"{""Descripción"": [""Información de la marca""], ""Características"": [""Presentación/Empaque"", ""Lata"", ""Porción sugerida"", ""2"", ""Alérgenos Declarados"", ""Atun, aceite vegetal (Soya)"", ""Azúcar por porción"", ""0g / 100g"", ""Calorías Porción"", ""236.7 Kcal/100g"", ""Carbohidratos Porción"", ""Certificaciones"", ""safe"", ""Contenido Escurrido"", ""110gr"", ""Descripción Nutricional"", ""Contiene Omega 3."", ""Grasas Porción"", ""16.5 g/100g"", ""Medio de conservación"", ""Aceite vegetal"", ""Proteínas Porción"", ""21.7g/100g"", ""Sodio Porción"", ""336.7 mg/100 g"", ""Advertencias De Almacenamiento"", ""Mantener en un lugar fresco y seco,refrigerar una vez abierto"", ""Contenido Neto"", ""160gr"", ""Denominación/Variedad"", ""Grated Campomar 6pack"", ""Revisa todo"", ""Componentes del Producto"", ""Vendido por"", ""plazaVea"", ""En caso algo no vaya como gustes: Puedes revisar nuestras"", ""Politicas de cambios y/o devoluciones"", ""y hacerlas efectivas en todas nuestras tiendas."", ""Productos"", ""que te pueden interesar"", ""similares"", ""Trozos de Atún en Aceite Vegetal y Sal GLORIA Lata 140g Paquete 6un"", "".00"", ""un"", ""3"", ""productos agregados"", ""Agrega indicaciones"", ""Guardar"", ""Filete de Atún FLORIDA en Aceite Vegetal Lata 140g Paquete 6un"", ""Trozos de Atún MARINERO en Aceite Vegetal Lata 140g Paquete 6un"", ""MARINERO"", ""Filete de Atún en Aceite Vegetal A1 Lata 140g Paquete 6un"", ""A1"", ""Conserva FRESCOMAR Trozos de Caballa Lata 170g Paquete 6un"", ""FRESCOMAR"", ""Trozos De Jurel Frescomar Lata 170g Paquete 6un"", ""Trozos de Jurel M&K Lata 170g"", ""M&K"", ""Filete de Bonito DORITA en Aceite Vegetal Lata 170g"", ""DORITA"", ""Recomendado para ti""]}",dataset/txt_limpios/1239.txt,dataset/paginas_descargadas/1239.html,ET,sin_categoria,discard,0.30,no_category_detected
1241,Seja Bem Vindo à Plaza Vea,Información de la marca,Abarrotes > 170g,25.0,PEN,,Desconocido,unknown,PE,Seja Bem Vindo à Plaza Vea,Abarrotes,,170g,25.00,PEN,S/,S/25,25.0,False,original,7.0423,7.0423,3.55,from_peru_cambio_dolar,,Información de la marca,Denominación/Variedad | Filete de bonito av | Revisa todo | Componentes del Producto | Vendido por | plazaVea | En caso algo no vaya como gustes: Puedes revisar nuestras | Politicas de cambios y/o devoluciones | y hacerlas efectivas en todas nuestras tiendas. | Productos | que te pueden interesar | similares | Filete de Atún ARO en Agua y Sal Lata 150g Paquete 6un | .00 | un | 3 | productos agregados | Agrega indicaciones | Guardar | MAKRO-Bi-Precio|Oh-Pay Oculto | Filete Atún En Aceite Vegetal Beltran 170g Paquete 6un | Trozos de Atún en Aceite Vegetal FLORIDA Lata 140g Paquete 6un | Multiplicador-de-unidad: MAKRO-Bi-Precio|Vigente Oculto | Filete de Atún FLORIDA en Aceite Girasol Paquete 6un Lata 140g | Filete de Atún en Aceite M&K Lata 150g Paquete 6un | M&K | Grated de Atún en Aceite Vegetal MARINERO Lata 140g Paquete 6un | MARINERO | Recomendado para ti,,,,,"{""Descripción"": [""Información de la marca""], ""Características"": [""Denominación/Variedad"", ""Filete de bonito av"", ""Revisa todo"", ""Componentes del Producto"", ""Vendido por"", ""plazaVea"", ""En caso algo no vaya como gustes: Puedes revisar nuestras"", ""Politicas de cambios y/o devoluciones"", ""y hacerlas efectivas en todas nuestras tiendas."", ""Productos"", ""que te pueden interesar"", ""similares"", ""Filete de Atún ARO en Agua y Sal Lata 150g Paquete 6un"", "".00"", ""un"", ""3"", ""productos agregados"", ""Agrega indicaciones"", ""Guardar"", ""MAKRO-Bi-Precio|Oh-Pay Oculto"", ""Filete Atún En Aceite Vegetal Beltran 170g Paquete 6un"", ""Trozos de Atún en Aceite Vegetal FLORIDA Lata 140g Paquete 6un"", ""Multiplicador-de-unidad: MAKRO-Bi-Precio|Vigente Oculto"", ""Filete de Atún FLORIDA en Aceite Girasol Paquete 6un Lata 140g"", ""Filete de Atún en Aceite M&K Lata 150g Paquete 6un"", ""M&K"", ""Grated de Atún en Aceite Vegetal MARINERO Lata 140g Paquete 6un"", ""MARINERO"", ""Recomendado para ti""]}",dataset/txt_limpios/1241.txt,dataset/paginas_descargadas/1241.html,EN,sin_categoria,discard,0.30,no_category_detected
1618,Selecciona tu,"+ | Especificaciones técnicas | Propiedad | Especificación | Comentarios | Cargando el resumen… | Por favor, inicia sesión para escribir un comentario. | Más reciente | Ordenar por: Más reciente | Más antiguo | Calificación más alta | Calificación más baja | Todos | Filtrar por: Todos | 1 estrella | 2 estrellas | 3 estrellas | 4 estrellas | 5 estrellas",Método de envío > 500 G,,COP,,Desconocido,unknown,CO,Selecciona tu,Método de envío,,500 G,,COP,,,100.78,True,country_mean,,0.0249,4047.0,from_colombia_cambio_dolar,,,,"+ | Especificaciones técnicas | Propiedad | Especificación | Comentarios | Cargando el resumen… | Por favor, inicia sesión para escribir un comentario. | Más reciente | Ordenar por: Más reciente | Más antiguo | Calificación más alta | Calificación más baja | Todos | Filtrar por: Todos | 1 estrella | 2 estrellas | 3 estrellas | 4 estrellas | 5 estrellas",,,,"{""Especificaciones"": [""+"", ""Especificaciones técnicas"", ""Propiedad"", ""Especificación"", ""Comentarios"", ""Cargando el resumen…"", ""Por favor, inicia sesión para escribir un comentario."", ""Más reciente"", ""Ordenar por: Más reciente"", ""Más antiguo"", ""Calificación más alta"", ""Calificación más baja"", ""Todos"", ""Filtrar por: Todos"", ""1 estrella"", ""2 estrellas"", ""3 estrellas"", ""4 estrellas"", ""5 estrellas""]}",dataset/txt_limpios/1618.txt,dataset/paginas_descargadas/1618.html,EN,sin_categoria,discard,0.30,no_category_detected;price_parse_failed
1625,Selecciona tu,"+ | Especificaciones técnicas | Propiedad | Especificación | Tipo de Panadería Fresca | Pan Fresco | Comentarios | Cargando el resumen… | Por favor, inicia sesión para escribir un comentario. | Más reciente | Ordenar por: Más reciente | Más antiguo | Calificación más alta | Calificación más baja | Todos | Filtrar por: Todos | 1 estrella | 2 estrellas | 3 estrellas | 4 estrellas | 5 estrellas",Método de envío > 540 G,,COP,,Desconocido,unknown,CO,Selecciona tu,Método de envío,,540 G,,COP,,,7.69,True,category_country_mean,,0.0019,4047.0,from_colombia_cambio_dolar,,,,"+ | Especificaciones técnicas | Propiedad | Especificación | Tipo de Panadería Fresca | Pan Fresco | Comentarios | Cargando el resumen… | Por favor, inicia sesión para escribir un comentario. | Más reciente | Ordenar por: Más reciente | Más antiguo | Calificación más alta | Calificación más baja | Todos | Filtrar por: Todos | 1 estrella | 2 estrellas | 3 estrellas | 4 estrellas | 5 estrellas",,,,"{""Especificaciones"": [""+"", ""Especificaciones técnicas"", ""Propiedad"", ""Especificación"", ""Tipo de Panadería Fresca"", ""Pan Fresco"", ""Comentarios"", ""Cargando el resumen…"", ""Por favor, inicia sesión para escribir un comentario."", ""Más reciente"", ""Ordenar por: Más reciente"", ""Más antiguo"", ""Calificación más alta"", ""Calificación más baja"", ""Todos"", ""Filtrar por: Todos"", ""1 estrella"", ""2 estrellas"", ""3 estrellas"", ""4 estrellas"", ""5 estrellas""]}",dataset/txt_limpios/1625.txt,dataset/paginas_descargadas/1625.html,EN,pan,discard,0.60,price_parse_failed;price<=0
1741,Selecciona tu,"+ | Especificaciones técnicas | Propiedad | Especificación | Comentarios | ☆ | 0 | (0 comentarios) | Por favor, inicia sesión para escribir un comentario. | Más reciente | Ordenar por: Más reciente | Más antiguo | Calificación más alta | Calificación más baja | Todos | Filtrar por: Todos | 1 estrella | 2 estrellas | 3 estrellas | 4 estrellas | 5 estrellas | No hay comentarios. | Términos más buscados | 1. | lavadora | 2. | celulares | 3. | neveras | 4. | gillette desodorantes | 5. | iphone | 6. | estufa | 7. | televisores | 8. | colchones | 9. | leche | 10. | cafe | Evalúanos",Método de envío > 450 G,,COP,,Desconocido,unknown,CO,Selecciona tu,Método de envío,,450 G,,COP,,,97.32,True,category_country_mean,,0.024,4047.0,from_colombia_cambio_dolar,,,,"+ | Especificaciones técnicas | Propiedad | Especificación | Comentarios | ☆ | 0 | (0 comentarios) | Por favor, inicia sesión para escribir un comentario. | Más reciente | Ordenar por: Más reciente | Más antiguo | Calificación más alta | Calificación más baja | Todos | Filtrar por: Todos | 1 estrella | 2 estrellas | 3 estrellas | 4 estrellas | 5 estrellas | No hay comentarios. | Términos más buscados | 1. | lavadora | 2. | celulares | 3. | neveras | 4. | gillette desodorantes | 5. | iphone | 6. | estufa | 7. | televisores | 8. | colchones | 9. | leche | 10. | cafe | Evalúanos",,,,"{""Especificaciones"": [""+"", ""Especificaciones técnicas"", ""Propiedad"", ""Especificación"", ""Comentarios"", ""☆"", ""0"", ""(0 comentarios)"", ""Por favor, inicia sesión para escribir un comentario."", ""Más reciente"", ""Ordenar por: Más reciente"", ""Más antiguo"", ""Calificación más alta"", ""Calificación más baja"", ""Todos"", ""Filtrar por: Todos"", ""1 estrella"", ""2 estrellas"", ""3 estrellas"", ""4 estrellas"", ""5 estrellas"", ""No hay comentarios."", ""Términos más buscados"", ""1."", ""lavadora"", ""2."", ""celulares"", ""3."", ""neveras"", ""4."", ""gillette desodorantes"", ""5."", ""iphone"", ""6."", ""estufa"", ""7."", ""televisores"", ""8."", ""colchones"", ""9."", ""leche"", ""10."", ""cafe"", ""Evalúanos""]}",dataset/txt_limpios/1741.txt,dataset/paginas_descargadas/1741.html,EN,cafe,discard,0.60,price_parse_failed;price<=0
702,Selecciona tu,"+ | Especificaciones técnicas | Propiedad | Especificación | Ver más | Huevo | Santa Anita Huevo Rojo AA | Televisores envío gratis | Comprar productos supermercado | Precios Rojos | Comentarios | Cargando el resumen… | Por favor, inicia sesión para escribir un comentario. | Más reciente | Ordenar por: Más reciente | Más antiguo | Calificación más alta | Calificación más baja | Todos | Filtrar por: Todos | 1 estrella | 2 estrellas | 3 estrellas | 4 estrellas | 5 estrellas | Evalúanos",Método de envío,,COP,,Desconocido,unknown,CO,Selecciona tu,Método de envío,,,,COP,,,100.78,True,country_mean,,0.0249,4047.0,from_colombia_cambio_dolar,,,,"+ | Especificaciones técnicas | Propiedad | Especificación | Ver más | Huevo | Santa Anita Huevo Rojo AA | Televisores envío gratis | Comprar productos supermercado | Precios Rojos | Comentarios | Cargando el resumen… | Por favor, inicia sesión para escribir un comentario. | Más reciente | Ordenar por: Más reciente | Más antiguo | Calificación más alta | Calificación más baja | Todos | Filtrar por: Todos | 1 estrella | 2 estrellas | 3 estrellas | 4 estrellas | 5 estrellas | Evalúanos",,,,"{""Especificaciones"": [""+"", ""Especificaciones técnicas"", ""Propiedad"", ""Especificación"", ""Ver más"", ""Huevo"", ""Santa Anita Huevo Rojo AA"", ""Televisores envío gratis"", ""Comprar productos supermercado"", ""Precios Rojos"", ""Comentarios"", ""Cargando el resumen…"", ""Por favor, inicia sesión para escribir un comentario."", ""Más reciente"", ""Ordenar por: Más reciente"", ""Más antiguo"", ""Calificación más alta"", ""Calificación más baja"", ""Todos"", ""Filtrar por: Todos"", ""1 estrella"", ""2 estrellas"", ""3 estrellas"", ""4 estrellas"", ""5 estrellas"", ""Evalúanos""]}",dataset/txt_limpios/702.txt,dataset/paginas_descargadas/702.html,EN,huevo,discard,0.30,price_parse_failed
