source_id,title,description,breadcrumbs,price_raw,currency_raw,url,seller,availability,country,product_name,brand,reference,unit,price_amount,price_currency,price_symbol,price_text,price_amount_filled,price_is_imputed,price_imputation_source,price_amount_usd,price_amount_usd_filled,fx_rate_local_per_usd,fx_source,information_text,description_text,features_text,specifications_text,benefits_text,details_text,other_sections,sections,txt_path,html_path,es_status,category_canonical,decision,match_score,reasons
599,DALE VIDA A TU JARDIN,"Datos técnicos Descripción del producto ¡Suscribite a nuestro boletín! Recibí las ofertas y novedades en tu correo. Suscribirme Seguridad y confianza © Libertad 2023. Todos los derechos reservados. Términos y Condiciones Direcciôn General de Defensa y protecciôn al Consumidor, para consultas y/o denuncias ingresa a los Términos más buscados 1. leche 2. cerveza 3. aceptada 4. yerba 5. cafe 6. pañales 7. queso 8. arroz 9. fideos 10. fernet",🌷🌻​🌼​ > 800 GR,800.0,ARS,,Desconocido,unknown,AR,DALE VIDA A TU JARDIN,🌷🌻​🌼​,,800 GR,800.00,ARS,,800,800.0,False,original,0.6375,0.6375,1255.0,from_argentina_cambio_dolar,,"Datos técnicos Descripción del producto ¡Suscribite a nuestro boletín! Recibí las ofertas y novedades en tu correo. Suscribirme Seguridad y confianza © Libertad 2023. Todos los derechos reservados. Términos y Condiciones Direcciôn General de Defensa y protecciôn al Consumidor, para consultas y/o denuncias ingresa a los Términos más buscados 1. leche 2. cerveza 3. aceptada 4. yerba 5. cafe 6. pañales 7. queso 8. arroz 9. fideos 10. fernet",,,,,,"{""Descripción"": [""Datos técnicos"", ""Descripción del producto"", ""¡Suscribite a nuestro newsletter!"", ""Recibí las ofertas y novedades en tu correo."", ""Suscribirme"", ""Seguridad y confianza"", ""© Libertad 2023. Todos los derechos reservados."", ""Términos y Condiciones"", ""Dirección General de Defensa y Protección al Consumidor para consultas y/o denuncias"", ""introduzca aquí"", ""Términos más buscados"", ""1."", ""leche"", ""2."", ""cerveza"", ""3."", ""aceite"", ""4."", ""yerba"", ""5."", ""cafe"", ""6."", ""pañales"", ""7."", ""queso"", ""8."", ""arroz"", ""9."", ""fideos"", ""10."", ""fernet""]}",dataset/txt_limpios/599.txt,dataset/paginas_descargadas/599.html,ET,cafe,keep,0.60,heuristic_default
600,DALE VIDA A TU JARDIN,"Datos técnicos Descripción del producto ¡Suscribite a nuestro boletín! Recibí las ofertas y novedades en tu correo. Suscribirme Seguridad y confianza © Libertad 2023. Todos los derechos reservados. Términos y Condiciones Direcciôn General de Defensa y protecciôn al Consumidor, para consultas y/o denuncias ingresa a los Términos más buscados 1. leche 2. cerveza 3. aceptada 4. yerba 5. cafe 6. pañales 7. queso 8. arroz 9. fideos 10. fernet",🌷🌻​🌼​,1363.64,ARS,,Desconocido,unknown,AR,DALE VIDA A TU JARDIN,🌷🌻​🌼​,,,1363.64,ARS,$,"$1.363,64",1363.64,False,original,1.0866,1.0866,1255.0,from_argentina_cambio_dolar,,"Datos técnicos Descripción del producto ¡Suscribite a nuestro boletín! Recibí las ofertas y novedades en tu correo. Suscribirme Seguridad y confianza © Libertad 2023. Todos los derechos reservados. Términos y Condiciones Direcciôn General de Defensa y protecciôn al Consumidor, para consultas y/o denuncias ingresa a los Términos más buscados 1. leche 2. cerveza 3. aceptada 4. yerba 5. cafe 6. pañales 7. queso 8. arroz 9. fideos 10. fernet",,,,,,"{""Descripción"": [""Datos técnicos"", ""Descripción del producto"", ""¡Suscribite a nuestro newsletter!"", ""Recibí las ofertas y novedades en tu correo."", ""Suscribirme"", ""Seguridad y confianza"", ""© Libertad 2023. Todos los derechos reservados."", ""Términos y Condiciones"", ""Dirección General de Defensa y Protección al Consumidor para consultas y/o denuncias"", ""introduzca aquí"", ""Términos más buscados"", ""1."", ""leche"", ""2."", ""cerveza"", ""3."", ""aceite"", ""4."", ""yerba"", ""5."", ""cafe"", ""6."", ""pañales"", ""7."", ""queso"", ""8."", ""arroz"", ""9."", ""fideos"", ""10."", ""fernet""]}",dataset/txt_limpios/600.txt,dataset/paginas_descargadas/600.html,ET,cafe,keep,0.60,heuristic_default
601,DALE VIDA A TU JARDIN,"Datos técnicos Descripción del producto ¡Suscribite a nuestro boletín! Recibí las ofertas y novedades en tu correo. Suscribirme Seguridad y confianza © Libertad 2023. Todos los derechos reservados. Términos y Condiciones Direcciôn General de Defensa y protecciôn al Consumidor, para consultas y/o denuncias ingresa a los Términos más buscados 1. leche 2. cerveza 3. aceptada 4. yerba 5. cafe 6. pañales 7. queso 8. arroz 9. fideos 10. fernet",🌷🌻​🌼​,3178.51,ARS,,Desconocido,unknown,AR,DALE VIDA A TU JARDIN,🌷🌻​🌼​,,,3178.51,ARS,$,"$3.178,51",3178.51,False,original,2.5327,2.5327,1255.0,from_argentina_cambio_dolar,,"Datos técnicos Descripción del producto ¡Suscribite a nuestro boletín! Recibí las ofertas y novedades en tu correo. Suscribirme Seguridad y confianza © Libertad 2023. Todos los derechos reservados. Términos y Condiciones Direcciôn General de Defensa y protecciôn al Consumidor, para consultas y/o denuncias ingresa a los Términos más buscados 1. leche 2. cerveza 3. aceptada 4. yerba 5. cafe 6. pañales 7. queso 8. arroz 9. fideos 10. fernet",,,,,,"{""Descripción"": [""Datos técnicos"", ""Descripción del producto"", ""¡Suscribite a nuestro newsletter!"", ""Recibí las ofertas y novedades en tu correo."", ""Suscribirme"", ""Seguridad y confianza"", ""© Libertad 2023. Todos los derechos reservados."", ""Términos y Condiciones"", ""Dirección General de Defensa y Protección al Consumidor para consultas y/o denuncias"", ""introduzca aquí"", ""Términos más buscados"", ""1."", ""leche"", ""2."", ""cerveza"", ""3."", ""aceite"", ""4."", ""yerba"", ""5."", ""cafe"", ""6."", ""pañales"", ""7."", ""queso"", ""8."", ""arroz"", ""9."", ""fideos"", ""10."", ""fernet""]}",dataset/txt_limpios/601.txt,dataset/paginas_descargadas/601.html,ET,cafe,keep,0.60,heuristic_default
602,DALE VIDA A TU JARDIN,,🌷🌻​🌼​,,ARS,,Desconocido,unknown,AR,DALE VIDA A TU JARDIN,🌷🌻​🌼​,,,,ARS,,,1663.58,True,country_mean,,1.3256,1255.0,from_argentina_cambio_dolar,,,,,,,,{},dataset/txt_limpios/602.txt,dataset/paginas_descargadas/602.html,EN,sin_categoria,discard,0.30,no_category_detected;price_parse_failed
603,DALE VIDA A TU JARDIN,"Datos técnicos Descripción del producto ¡Suscribite a nuestro boletín! Recibí las ofertas y novedades en tu correo. Suscribirme Seguridad y confianza © Libertad 2023. Todos los derechos reservados. Términos y Condiciones Direcciôn General de Defensa y protecciôn al Consumidor, para consultas y/o denuncias ingresa a los Términos más buscados 1. leche 2. cerveza 3. aceptada 4. yerba 5. cafe 6. pañales 7. queso 8. arroz 9. fideos 10. fernet",🌷🌻​🌼​ > 450G,450.0,ARS,,Desconocido,unknown,AR,DALE VIDA A TU JARDIN,🌷🌻​🌼​,,450G,450.00,ARS,,450,450.0,False,original,0.3586,0.3586,1255.0,from_argentina_cambio_dolar,,"Datos técnicos Descripción del producto ¡Suscribite a nuestro boletín! Recibí las ofertas y novedades en tu correo. Suscribirme Seguridad y confianza © Libertad 2023. Todos los derechos reservados. Términos y Condiciones Direcciôn General de Defensa y protecciôn al Consumidor, para consultas y/o denuncias ingresa a los Términos más buscados 1. leche 2. cerveza 3. aceptada 4. yerba 5. cafe 6. pañales 7. queso 8. arroz 9. fideos 10. fernet",,,,,,"{""Descripción"": [""Datos técnicos"", ""Descripción del producto"", ""¡Suscribite a nuestro newsletter!"", ""Recibí las ofertas y novedades en tu correo."", ""Suscribirme"", ""Seguridad y confianza"", ""© Libertad 2023. Todos los derechos reservados."", ""Términos y Condiciones"", ""Dirección General de Defensa y Protección al Consumidor para consultas y/o denuncias"", ""introduzca aquí"", ""Términos más buscados"", ""1."", ""leche"", ""2."", ""cerveza"", ""3."", ""aceite"", ""4."", ""yerba"", ""5."", ""cafe"", ""6."", ""pañales"", ""7."", ""queso"", ""8."", ""arroz"", ""9."", ""fideos"", ""10."", ""fernet""]}",dataset/txt_limpios/603.txt,dataset/paginas_descargadas/603.html,ET,cafe,keep,0.60,heuristic_default
604,DALE VIDA A TU JARDIN,,🌷🌻​🌼​,,ARS,,Desconocido,unknown,AR,DALE VIDA A TU JARDIN,🌷🌻​🌼​,,,,ARS,,,1663.58,True,country_mean,,1.3256,1255.0,from_argentina_cambio_dolar,,,,,,,,{},dataset/txt_limpios/604.txt,dataset/paginas_descargadas/604.html,EN,sin_categoria,discard,0.30,no_category_detected;price_parse_failed
605,DALE VIDA A TU JARDIN,"Datos técnicos Descripción del producto ¡Suscribite a nuestro boletín! Recibí las ofertas y novedades en tu correo. Suscribirme Seguridad y confianza © Libertad 2023. Todos los derechos reservados. Términos y Condiciones Direcciôn General de Defensa y protecciôn al Consumidor, para consultas y/o denuncias ingresa a los Términos más buscados 1. leche 2. cerveza 3. aceptada 4. yerba 5. cafe 6. pañales 7. queso 8. arroz 9. fideos 10. fernet",🌷🌻​🌼​ > 250 GR,250.0,ARS,,Desconocido,unknown,AR,DALE VIDA A TU JARDIN,🌷🌻​🌼​,,250 GR,250.00,ARS,,250,250.0,False,original,0.1992,0.1992,1255.0,from_argentina_cambio_dolar,,"Datos técnicos Descripción del producto ¡Suscribite a nuestro boletín! Recibí las ofertas y novedades en tu correo. Suscribirme Seguridad y confianza © Libertad 2023. Todos los derechos reservados. Términos y Condiciones Direcciôn General de Defensa y protecciôn al Consumidor, para consultas y/o denuncias ingresa a los Términos más buscados 1. leche 2. cerveza 3. aceptada 4. yerba 5. cafe 6. pañales 7. queso 8. arroz 9. fideos 10. fernet",,,,,,"{""Descripción"": [""Datos técnicos"", ""Descripción del producto"", ""¡Suscribite a nuestro newsletter!"", ""Recibí las ofertas y novedades en tu correo."", ""Suscribirme"", ""Seguridad y confianza"", ""© Libertad 2023. Todos los derechos reservados."", ""Términos y Condiciones"", ""Dirección General de Defensa y Protección al Consumidor para consultas y/o denuncias"", ""introduzca aquí"", ""Términos más buscados"", ""1."", ""leche"", ""2."", ""cerveza"", ""3."", ""aceite"", ""4."", ""yerba"", ""5."", ""cafe"", ""6."", ""pañales"", ""7."", ""queso"", ""8."", ""arroz"", ""9."", ""fideos"", ""10."", ""fernet""]}",dataset/txt_limpios/605.txt,dataset/paginas_descargadas/605.html,ET,cafe,keep,0.60,heuristic_default
606,DALE VIDA A TU JARDIN,"Datos técnicos Descripción del producto ¡Suscribite a nuestro boletín! Recibí las ofertas y novedades en tu correo. Suscribirme Seguridad y confianza © Libertad 2023. Todos los derechos reservados. Términos y Condiciones Direcciôn General de Defensa y protecciôn al Consumidor, para consultas y/o denuncias ingresa a los Términos más buscados 1. leche 2. cerveza 3. aceptada 4. yerba 5. cafe 6. pañales 7. queso 8. arroz 9. fideos 10. fernet",🌷🌻​🌼​ > 250 G,250.0,ARS,,Desconocido,unknown,AR,DALE VIDA A TU JARDIN,🌷🌻​🌼​,,250 G,250.00,ARS,,250,250.0,False,original,0.1992,0.1992,1255.0,from_argentina_cambio_dolar,,"Datos técnicos Descripción del producto ¡Suscribite a nuestro boletín! Recibí las ofertas y novedades en tu correo. Suscribirme Seguridad y confianza © Libertad 2023. Todos los derechos reservados. Términos y Condiciones Direcciôn General de Defensa y protecciôn al Consumidor, para consultas y/o denuncias ingresa a los Términos más buscados 1. leche 2. cerveza 3. aceptada 4. yerba 5. cafe 6. pañales 7. queso 8. arroz 9. fideos 10. fernet",,,,,,"{""Descripción"": [""Datos técnicos"", ""Descripción del producto"", ""¡Suscribite a nuestro newsletter!"", ""Recibí las ofertas y novedades en tu correo."", ""Suscribirme"", ""Seguridad y confianza"", ""© Libertad 2023. Todos los derechos reservados."", ""Términos y Condiciones"", ""Dirección General de Defensa y Protección al Consumidor para consultas y/o denuncias"", ""introduzca aquí"", ""Términos más buscados"", ""1."", ""leche"", ""2."", ""cerveza"", ""3."", ""aceite"", ""4."", ""yerba"", ""5."", ""cafe"", ""6."", ""pañales"", ""7."", ""queso"", ""8."", ""arroz"", ""9."", ""fideos"", ""10."", ""fernet""]}",dataset/txt_limpios/606.txt,dataset/paginas_descargadas/606.html,ET,cafe,keep,0.60,heuristic_default
607,DALE VIDA A TU JARDIN,"Datos técnicos Descripción del producto Nada supera el sabor de una Coca-Cola. Diseñado para acompañar cada momento, el sabor de la Coca-Cola es un clásico que perdura desde hace más de 130 años. Deliciosa y refrescante. ¡Suscribite a nuestro boletín! Recibí las ofertas y novedades en tu correo. Suscribirme Seguridad y confianza © Libertad 2023. Todos los derechos reservados. Términos y Condiciones Direcciôn General de Defensa y protecciôn al Consumidor, para consultas y/o denuncias ingresa a los Términos más buscados 1. leche 2. cerveza 3. aceptada 4. yerba 5. cafe 6. pañales 7. queso 8. arroz 9. fideos 10. fernet","🌷🌻​🌼​ > 1,5 Lt",2553.72,ARS,,Desconocido,unknown,AR,DALE VIDA A TU JARDIN,🌷🌻​🌼​,,"1,5 Lt",2553.72,ARS,$,"$2.553,72",2553.72,False,original,2.0348,2.0348,1255.0,from_argentina_cambio_dolar,,"Datos técnicos Descripción del producto Nada supera el sabor de una Coca-Cola. Diseñado para acompañar cada momento, el sabor de la Coca-Cola es un clásico que perdura desde hace más de 130 años. Deliciosa y refrescante. ¡Suscribite a nuestro boletín! Recibí las ofertas y novedades en tu correo. Suscribirme Seguridad y confianza © Libertad 2023. Todos los derechos reservados. Términos y Condiciones Direcciôn General de Defensa y protecciôn al Consumidor, para consultas y/o denuncias ingresa a los Términos más buscados 1. leche 2. cerveza 3. aceptada 4. yerba 5. cafe 6. pañales 7. queso 8. arroz 9. fideos 10. fernet",,,,,,"{""Descripción"": [""Datos técnicos"", ""Descripción del producto"", ""Nada supera el sabor de una Coca-Cola. Diseñado para acompañar cada momento, el sabor de la Coca-Cola es un clásico que perdura desde hace más de 130 años. Deliciosa y refrescante."", ""¡Suscribite a nuestro newsletter!"", ""Recibí las ofertas y novedades en tu correo."", ""Suscribirme"", ""Seguridad y confianza"", ""© Libertad 2023. Todos los derechos reservados."", ""Términos y Condiciones"", ""Dirección General de Defensa y Protección al Consumidor para consultas y/o denuncias"", ""introduzca aquí"", ""Términos más buscados"", ""1."", ""leche"", ""2."", ""cerveza"", ""3."", ""aceite"", ""4."", ""yerba"", ""5."", ""cafe"", ""6."", ""pañales"", ""7."", ""queso"", ""8."", ""arroz"", ""9."", ""fideos"", ""10."", ""fernet""]}",dataset/txt_limpios/607.txt,dataset/paginas_descargadas/607.html,ET,cafe,keep,0.60,heuristic_default
608,DALE VIDA A TU JARDIN,"Datos técnicos Descripción del producto ¡Suscribite a nuestro boletín! Recibí las ofertas y novedades en tu correo. Suscribirme Seguridad y confianza © Libertad 2023. Todos los derechos reservados. Términos y Condiciones Direcciôn General de Defensa y protecciôn al Consumidor, para consultas y/o denuncias ingresa a los Términos más buscados 1. leche 2. cerveza 3. aceptada 4. yerba 5. cafe 6. pañales 7. queso 8. arroz 9. fideos 10. fernet",🌷🌻​🌼​ > 2000CC,2644.63,ARS,,Desconocido,unknown,AR,DALE VIDA A TU JARDIN,🌷🌻​🌼​,,2000CC,2644.63,ARS,$,"$2.644,63",2644.63,False,original,2.1073,2.1073,1255.0,from_argentina_cambio_dolar,,"Datos técnicos Descripción del producto ¡Suscribite a nuestro boletín! Recibí las ofertas y novedades en tu correo. Suscribirme Seguridad y confianza © Libertad 2023. Todos los derechos reservados. Términos y Condiciones Direcciôn General de Defensa y protecciôn al Consumidor, para consultas y/o denuncias ingresa a los Términos más buscados 1. leche 2. cerveza 3. aceptada 4. yerba 5. cafe 6. pañales 7. queso 8. arroz 9. fideos 10. fernet",,,,,,"{""Descripción"": [""Datos técnicos"", ""Descripción del producto"", ""¡Suscribite a nuestro newsletter!"", ""Recibí las ofertas y novedades en tu correo."", ""Suscribirme"", ""Seguridad y confianza"", ""© Libertad 2023. Todos los derechos reservados."", ""Términos y Condiciones"", ""Dirección General de Defensa y Protección al Consumidor para consultas y/o denuncias"", ""introduzca aquí"", ""Términos más buscados"", ""1."", ""leche"", ""2."", ""cerveza"", ""3."", ""aceite"", ""4."", ""yerba"", ""5."", ""cafe"", ""6."", ""pañales"", ""7."", ""queso"", ""8."", ""arroz"", ""9."", ""fideos"", ""10."", ""fernet""]}",dataset/txt_limpios/608.txt,dataset/paginas_descargadas/608.html,ET,cafe,keep,0.60,heuristic_default
609,DALE VIDA A TU JARDIN,"Datos técnicos Descripción del producto ¡Suscribite a nuestro boletín! Recibí las ofertas y novedades en tu correo. Suscribirme Seguridad y confianza © Libertad 2023. Todos los derechos reservados. Términos y Condiciones Direcciôn General de Defensa y protecciôn al Consumidor, para consultas y/o denuncias ingresa a los Términos más buscados 1. leche 2. cerveza 3. aceptada 4. yerba 5. cafe 6. pañales 7. queso 8. arroz 9. fideos 10. fernet",🌷🌻​🌼​ > 2.25 Lt,1900.83,ARS,,Desconocido,unknown,AR,DALE VIDA A TU JARDIN,🌷🌻​🌼​,,2.25 Lt,1900.83,ARS,$,"$1.900,83",1900.83,False,original,1.5146,1.5146,1255.0,from_argentina_cambio_dolar,,"Datos técnicos Descripción del producto ¡Suscribite a nuestro boletín! Recibí las ofertas y novedades en tu correo. Suscribirme Seguridad y confianza © Libertad 2023. Todos los derechos reservados. Términos y Condiciones Direcciôn General de Defensa y protecciôn al Consumidor, para consultas y/o denuncias ingresa a los Términos más buscados 1. leche 2. cerveza 3. aceptada 4. yerba 5. cafe 6. pañales 7. queso 8. arroz 9. fideos 10. fernet",,,,,,"{""Descripción"": [""Datos técnicos"", ""Descripción del producto"", ""¡Suscribite a nuestro newsletter!"", ""Recibí las ofertas y novedades en tu correo."", ""Suscribirme"", ""Seguridad y confianza"", ""© Libertad 2023. Todos los derechos reservados."", ""Términos y Condiciones"", ""Dirección General de Defensa y Protección al Consumidor para consultas y/o denuncias"", ""introduzca aquí"", ""Términos más buscados"", ""1."", ""leche"", ""2."", ""cerveza"", ""3."", ""aceite"", ""4."", ""yerba"", ""5."", ""cafe"", ""6."", ""pañales"", ""7."", ""queso"", ""8."", ""arroz"", ""9."", ""fideos"", ""10."", ""fernet""]}",dataset/txt_limpios/609.txt,dataset/paginas_descargadas/609.html,ET,cafe,keep,0.60,heuristic_default
610,DALE VIDA A TU JARDIN,,🌷🌻​🌼​,,ARS,,Desconocido,unknown,AR,DALE VIDA A TU JARDIN,🌷🌻​🌼​,,,,ARS,,,1663.58,True,country_mean,,1.3256,1255.0,from_argentina_cambio_dolar,,,,,,,,{},dataset/txt_limpios/610.txt,dataset/paginas_descargadas/610.html,EN,sin_categoria,discard,0.30,no_category_detected;price_parse_failed
611,DALE VIDA A TU JARDIN,"Datos técnicos Descripción del producto ¡Suscribite a nuestro boletín! Recibí las ofertas y novedades en tu correo. Suscribirme Seguridad y confianza © Libertad 2023. Todos los derechos reservados. Términos y Condiciones Direcciôn General de Defensa y protecciôn al Consumidor, para consultas y/o denuncias ingresa a los Términos más buscados 1. leche 2. cerveza 3. aceptada 4. yerba 5. cafe 6. pañales 7. queso 8. arroz 9. fideos 10. fernet",🌷🌻​🌼​ > 2.25 L,1809.92,ARS,,Desconocido,unknown,AR,DALE VIDA A TU JARDIN,🌷🌻​🌼​,,2.25 L,1809.92,ARS,$,"$1.809,92",1809.92,False,original,1.4422,1.4422,1255.0,from_argentina_cambio_dolar,,"Datos técnicos Descripción del producto ¡Suscribite a nuestro boletín! Recibí las ofertas y novedades en tu correo. Suscribirme Seguridad y confianza © Libertad 2023. Todos los derechos reservados. Términos y Condiciones Direcciôn General de Defensa y protecciôn al Consumidor, para consultas y/o denuncias ingresa a los Términos más buscados 1. leche 2. cerveza 3. aceptada 4. yerba 5. cafe 6. pañales 7. queso 8. arroz 9. fideos 10. fernet",,,,,,"{""Descripción"": [""Datos técnicos"", ""Descripción del producto"", ""¡Suscribite a nuestro newsletter!"", ""Recibí las ofertas y novedades en tu correo."", ""Suscribirme"", ""Seguridad y confianza"", ""© Libertad 2023. Todos los derechos reservados."", ""Términos y Condiciones"", ""Dirección General de Defensa y Protección al Consumidor para consultas y/o denuncias"", ""introduzca aquí"", ""Términos más buscados"", ""1."", ""leche"", ""2."", ""cerveza"", ""3."", ""aceite"", ""4."", ""yerba"", ""5."", ""cafe"", ""6."", ""pañales"", ""7."", ""queso"", ""8."", ""arroz"", ""9."", ""fideos"", ""10."", ""fernet""]}",dataset/txt_limpios/611.txt,dataset/paginas_descargadas/611.html,ET,cafe,keep,0.60,heuristic_default
