source_id,title,description,breadcrumbs,price_raw,currency_raw,url,seller,availability,country,product_name,brand,reference,unit,price_amount,price_currency,price_symbol,price_text,price_amount_filled,price_is_imputed,price_imputation_source,price_amount_usd,price_amount_usd_filled,fx_rate_local_per_usd,fx_source,information_text,description_text,features_text,specifications_text,benefits_text,details_text,other_sections,sections,txt_path,html_path,es_status,category_canonical,decision,match_score,reasons
1721,Panadería y Pastelería,"Pan de Molde Blanco Familiar Xl Cena 740g | Actualizado al: 24-04-2025 Ingredientes: Harina de trigo, Agua, Levadura, Azúcar, Gluten, Sal, Aceite de maravilla, Tocoferoles, Ácido láctico, Ácido sórbico, Datem, Propionato de calcio, Mono y diglicéridos de ácidos grasos, Ácido ascórbico, Fibra de soya, Saborizante natural, Soya. Alérgenos: Gluten, Soya. Trazas: Nuez. Certificados: Libre de Huevo Libre de Peces Libre de Mariscos Libre de Maní Libre de Sulfitos Libre de Lactosa Porción: 2 Unidades (51g) Porciones por envase: 15 100g 1 Porción Energía (kCal) 241 122.9 Proteínas (g) 10 5.1 Grasas Totales 1.9 1 Grasas saturadas (g) 0.5 0.3 Grasas monoinsaturadas (g) 0.2 Grasas poliinsaturadas (g) 0.9 Grasas trans (g) 0 Colesterol (mg) Hidratos de carbono disponibles 46 23.5 Azúcares totales (g) 3.4 1.7 Sodio 386 196.9 Importante: La información del empaque y/o contenido del producto final puede diferir respecto a lo que mostramos en nuestro sitio web, tanto a nivel de ingredientes, trazas, información nutricional, sellos, modo de uso y/o modo de conservación. Usted no debe basarse únicamente en la información que se muestra en nuestro sitio web y siempre debe leer las etiquetas, advertencias e instrucciones antes de usar o consumir un producto. Información obtenida de PAN BLANCO XL CENA 740 GR Productos similares Pan de Molde Blanco XL Castaño 700 g Ver producto Pan de Molde Blanco XL Pierre 700 g -28% Pan de Molde Integral Fibra XL Cena 750 g Pan de Molde Blanco XL Ideal 750 g -14% Pan de Molde Blanco Tradicional Bauducco 390 g Pan de Molde Integral XL Castaño 700 g Pan de Molde Blanco Tipo Brioche Castaño 400 g Pan de Molde Blanco Ideal 580 g Pan de Molde Blanco Sin Gluten Tottus 400 g Pan de Molde Perfecto Kingsbury 580 g PAN BLANCO ARTESANO 550G IDEAL PAN BLANCO CERO CERO 580G IDEAL Pan de Molde Blanco Castaño 400 g Pan de Molde Integral XL Pierre 700 g Pan de Molde Miga Sándwich Blanco Castaño 440 g Pan de Molde Integral Bauducco 390 g ¡Juntos son mejores! -21% Atún Lomitos en Aceite Tottus 160 g Pack Yoghurt Batido Colun 12 x 125 g -12% Jamón Pierna Artesanal Granel KG -22% Jamón Sándwich Granel Jamón Artesanal Pf  a Granel Yoghurt Batido Yoghito Sabor Frutilla Queso Ranco Laminado Granel -16% Jamón de Cerdo Artesanal a Granel Atún Lomitos en Agua Tottus 160 g Jamón Acaramelado Pf a Granel -26% Jamón Colonial Granel -11%",Panadería > 740 g,2.59,,,Desconocido,unknown,UNKNOWN,Panadería y Pastelería,Panadería,,740 g,2.59,,,2.59,2.59,False,original,2.59,2.59,1.0,default_1usd,,"Pan de Molde Blanco Familiar Xl Cena 740g | Actualizado al: 24-04-2025 Ingredientes: Harina de trigo, Agua, Levadura, Azúcar, Gluten, Sal, Aceite de maravilla, Tocoferoles, Ácido láctico, Ácido sórbico, Datem, Propionato de calcio, Mono y diglicéridos de ácidos grasos, Ácido ascórbico, Fibra de soya, Saborizante natural, Soya. Alérgenos: Gluten, Soya. Trazas: Nuez. Certificados: Libre de Huevo Libre de Peces Libre de Mariscos Libre de Maní Libre de Sulfitos Libre de Lactosa Porción: 2 Unidades (51g) Porciones por envase: 15 100g 1 Porción Energía (kCal) 241 122.9 Proteínas (g) 10 5.1 Grasas Totales 1.9 1 Grasas saturadas (g) 0.5 0.3 Grasas monoinsaturadas (g) 0.2 Grasas poliinsaturadas (g) 0.9 Grasas trans (g) 0 Colesterol (mg) Hidratos de carbono disponibles 46 23.5 Azúcares totales (g) 3.4 1.7 Sodio 386 196.9 Importante: La información del empaque y/o contenido del producto final puede diferir respecto a lo que mostramos en nuestro sitio web, tanto a nivel de ingredientes, trazas, información nutricional, sellos, modo de uso y/o modo de conservación. Usted no debe basarse únicamente en la información que se muestra en nuestro sitio web y siempre debe leer las etiquetas, advertencias e instrucciones antes de usar o consumir un producto. Información obtenida de PAN BLANCO XL CENA 740 GR Productos similares Pan de Molde Blanco XL Castaño 700 g Ver producto Pan de Molde Blanco XL Pierre 700 g -28% Pan de Molde Integral Fibra XL Cena 750 g Pan de Molde Blanco XL Ideal 750 g -14% Pan de Molde Blanco Tradicional Bauducco 390 g Pan de Molde Integral XL Castaño 700 g Pan de Molde Blanco Tipo Brioche Castaño 400 g Pan de Molde Blanco Ideal 580 g Pan de Molde Blanco Sin Gluten Tottus 400 g Pan de Molde Perfecto Kingsbury 580 g PAN BLANCO ARTESANO 550G IDEAL PAN BLANCO CERO CERO 580G IDEAL Pan de Molde Blanco Castaño 400 g Pan de Molde Integral XL Pierre 700 g Pan de Molde Miga Sándwich Blanco Castaño 440 g Pan de Molde Integral Bauducco 390 g ¡Juntos son mejores! -21% Atún Lomitos en Aceite Tottus 160 g Pack Yoghurt Batido Colun 12 x 125 g -12% Jamón Pierna Artesanal Granel KG -22% Jamón Sándwich Granel Jamón Artesanal Pf  a Granel Yoghurt Batido Yoghito Sabor Frutilla Queso Ranco Laminado Granel -16% Jamón de Cerdo Artesanal a Granel Atún Lomitos en Agua Tottus 160 g Jamón Acaramelado Pf a Granel -26% Jamón Colonial Granel -11%",,,,,,"{""Descripción"": [""Pan de Molde Blanco Familiar Xl Cena"", ""740g | Actualizado al: 24-04-2025"", ""Ingredientes: Harina de trigo, Agua, Levadura, Azúcar, Gluten, Sal, Aceite de maravilla, Tocoferoles, Ácido láctico, Ácido sórbico, Datem, Propionato de calcio, Mono y diglicéridos de ácidos grasos, Ácido ascórbico, Fibra de soya, Saborizante natural, Soya."", ""Alérgenos: Gluten, Soya."", ""Trazas: Nuez."", ""Certificados: Libre de Huevo"", ""Libre de Peces"", ""Libre de Mariscos"", ""Libre de Maní"", ""Libre de Sulfitos"", ""Libre de Lactosa"", ""Porción: 2 Unidades (51g)"", ""Porciones por envase: 15"", ""100g"", ""1 Porción"", ""Energía"", ""(kCal)"", ""241"", ""122.9"", ""Proteínas"", ""(g)"", ""10"", ""5.1"", ""Grasas Totales"", ""1.9"", ""1"", ""Grasas saturadas (g)"", ""0.5"", ""0.3"", ""Grasas monoinsaturadas (g)"", ""0.2"", ""Grasas poliinsaturadas (g)"", ""0.9"", ""Grasas trans (g)"", ""0"", ""Colesterol"", ""(mg)"", ""Hidratos de carbono disponibles"", ""46"", ""23.5"", ""Azúcar total (g)"", ""3.4"", ""1.7"", ""Sodio"", ""386"", ""196.9"", ""Importante: La información del empaque y/o contenido del producto final puede diferir respecto a lo que mostramos en nuestro sitio web, tanto a nivel de ingredientes, trazas, información nutricional, sellos, modo de uso y/o modo de conservación. Usted debe basarse únicamente en la información que se muestra en nuestro sitio web y siempre debe leer las etiquetas, advertencias y instrucciones antes de usar el consumo de un producto."", ""Información obtenida de"", ""PAN BLANCO XL CENA 740 GR"", ""Productos similares"", ""Pan de Molde Blanco XL Castaño 700 g"", ""Ver producto"", ""Pan de Molde Blanco XL Pierre 700 g"", ""-28%"", ""Pan de Molde Integral Fibra XL Cena 750 g"", ""Pan de Molde Blanco XL Ideal 750 g"", ""-14%"", ""Pan de Molde Blanco Tradicional Bauducco 390 g"", ""Pan de Molde Integral XL Castaño 700 g"", ""Pan de Molde Blanco Tipo Brioche Castaño 400 g"", ""Pan de Molde Blanco Ideal 580 g"", ""Pan de Molde Blanco Sin Gluten Tottus 400 g"", ""Pan de Molde Perfecto Kingsbury 580 g"", ""PAN BLANCO ARTESANO 550G IDEAL"", ""PAN BLANCO CERO CERO 580G IDEAL"", ""Pan de Molde Blanco Castaño 400 g"", ""Pan de Molde Integral XL Pierre 700 g"", ""Pan de Molde Miga Sándwich Blanco Castaño 440 g"", ""Pan de Molde Integral Bauducco 390 g"", ""¡Juntos son mejores!"", ""-21%"", ""Atún Lomitos en Aceite Tottus 160 g"", ""Pack Yoghurt Batido Colun 12 x 125 g"", ""-12%"", ""Jamón Pierna Artesanal Granel"", ""KG"", ""-22%"", ""Jamón Sándwich Granel"", ""Jamón Artesanal Pf Granel"", ""Yoghurt Batido Yoghito Sabor Frutilla"", ""Queso Ranco Laminado Granel"", ""-16%"", ""Jamón de Cerdo Artesanal a Granel"", ""Atún Lomitos en Agua Tottus 160 g"", ""Jamón Acaramelado Pf Granel"", ""-26%"", ""Jamón Colonial Granel"", ""-11%""]}",dataset/txt_limpios/1721.txt,dataset/paginas_descargadas/1721.html,ET,pan,keep,0.60,heuristic_default
1747,Panadería y Pastelería,"Pan de Molde Integral Ideal 580g | Actualizado al: 16-01-2025 Ingredientes: Harina de trigo integral de grano entero, Vitamina d3 vegetal, Harina de trigo, Vitamina d3 vegetal, Agua, Levadura, Gluten, Fibra de soya, Harina de trigo fermentada, Harina de cebada fermentada, Harina de centeno fermentada, Azúcar, Sal, Aceite de maravilla (tocoferoles), Ácido láctico de origen natural, Ácido ascórbico de origen natural, Saborizante natural, Soya. Alérgenos: Gluten, Soya. Trazas: Nuez. Certificados: Libre de Huevo Libre de Peces Libre de Mariscos Libre de Maní Libre de Sulfitos Libre de Lactosa Vegano Vegetariano Kosher Porción: 2 Unidades (50g) Porciones por envase: 12 100g 1 Porción Energía (kCal) 251 125.5 Proteínas (g) 11 5.5 Grasas Totales 3 1.5 Grasas saturadas (g) 0.5 0.3 Grasas monoinsaturadas (g) 0.7 0.4 Grasas poliinsaturadas (g) 1.7 0.9 Grasas trans (g) 0 Colesterol (mg) Hidratos de carbono disponibles 45 22.5 Azúcares totales (g) Fibra 5.8 2.9 Sodio 358 179 Importante: La información del empaque y/o contenido del producto final puede diferir respecto a lo que mostramos en nuestro sitio web, tanto a nivel de ingredientes, trazas, información nutricional, sellos, modo de uso y/o modo de conservación. Usted no debe basarse únicamente en la información que se muestra en nuestro sitio web y siempre debe leer las etiquetas, advertencias e instrucciones antes de usar o consumir un producto. Información obtenida de PAN INTEGRAL 580G IDEAL Productos similares Pan de Molde Artesano Integral Ver producto Pan de Molde Integral Bauducco 390 g Pan de Molde Integral XL Ideal 750 g Pan de Molde Integral XL Pierre 700 g -28% Pan de Molde Blanco Ideal 380 g PAN INTEGRAL CERO CERO 600G IDEAL Pan de Molde Blanco Ideal 580 g Pan Molde Integral Pan Sándwich Pan de Molde Integral Castaño 400 g Pan de Molde Blanco Sin Borde Ideal 400 g Pan de Completo Xl Pan de Molde Integral Grande Pan de Molde Integral Familiar Pan de Molde Multigrano Sin Gluten Tottus 400 g Pan de Molde Integral XL Castaño 700 g Pan de Molde Multigrano Pan de Molde Blanco XL Ideal 750 g -14% ¡Juntos son mejores! Yoghurt Light Sin Azúcar Sabor Chirimoya Queso Fresco sin Lactosa Bolsa Quesillo Fresco Yoghurt Protein+ Sabor Frutilla Soprole 155 g Pack Yoghurt Batido Colun 12 x 125 g -12% Yogur Griego No Endulzado Oikos 150 g",Panadería > 580 GR,2.69,,,Desconocido,unknown,UNKNOWN,Panadería y Pastelería,Panadería,,580 GR,2.69,,,2.69,2.69,False,original,2.69,2.69,1.0,default_1usd,,"Pan de Molde Integral Ideal 580g | Actualizado al: 16-01-2025 Ingredientes: Harina de trigo integral de grano entero, Vitamina d3 vegetal, Harina de trigo, Vitamina d3 vegetal, Agua, Levadura, Gluten, Fibra de soya, Harina de trigo fermentada, Harina de cebada fermentada, Harina de centeno fermentada, Azúcar, Sal, Aceite de maravilla (tocoferoles), Ácido láctico de origen natural, Ácido ascórbico de origen natural, Saborizante natural, Soya. Alérgenos: Gluten, Soya. Trazas: Nuez. Certificados: Libre de Huevo Libre de Peces Libre de Mariscos Libre de Maní Libre de Sulfitos Libre de Lactosa Vegano Vegetariano Kosher Porción: 2 Unidades (50g) Porciones por envase: 12 100g 1 Porción Energía (kCal) 251 125.5 Proteínas (g) 11 5.5 Grasas Totales 3 1.5 Grasas saturadas (g) 0.5 0.3 Grasas monoinsaturadas (g) 0.7 0.4 Grasas poliinsaturadas (g) 1.7 0.9 Grasas trans (g) 0 Colesterol (mg) Hidratos de carbono disponibles 45 22.5 Azúcares totales (g) Fibra 5.8 2.9 Sodio 358 179 Importante: La información del empaque y/o contenido del producto final puede diferir respecto a lo que mostramos en nuestro sitio web, tanto a nivel de ingredientes, trazas, información nutricional, sellos, modo de uso y/o modo de conservación. Usted no debe basarse únicamente en la información que se muestra en nuestro sitio web y siempre debe leer las etiquetas, advertencias e instrucciones antes de usar o consumir un producto. Información obtenida de PAN INTEGRAL 580G IDEAL Productos similares Pan de Molde Artesano Integral Ver producto Pan de Molde Integral Bauducco 390 g Pan de Molde Integral XL Ideal 750 g Pan de Molde Integral XL Pierre 700 g -28% Pan de Molde Blanco Ideal 380 g PAN INTEGRAL CERO CERO 600G IDEAL Pan de Molde Blanco Ideal 580 g Pan Molde Integral Pan Sándwich Pan de Molde Integral Castaño 400 g Pan de Molde Blanco Sin Borde Ideal 400 g Pan de Completo Xl Pan de Molde Integral Grande Pan de Molde Integral Familiar Pan de Molde Multigrano Sin Gluten Tottus 400 g Pan de Molde Integral XL Castaño 700 g Pan de Molde Multigrano Pan de Molde Blanco XL Ideal 750 g -14% ¡Juntos son mejores! Yoghurt Light Sin Azúcar Sabor Chirimoya Queso Fresco sin Lactosa Bolsa Quesillo Fresco Yoghurt Protein+ Sabor Frutilla Soprole 155 g Pack Yoghurt Batido Colun 12 x 125 g -12% Yogur Griego No Endulzado Oikos 150 g",,,,,,"{""Descripción"": [""Pan de Molde Integral Ideal"", ""580g | Actualizado al: 16-01-2025"", ""Ingredientes: Harina de trigo integral de grano entero, Vitamina d3 vegetal, Harina de trigo, Vitamina d3 vegetal, Agua, Levadura, Gluten, Fibra de soya, Harina de trigo fermentada, Harina de cebada fermentada, Harina de centeno fermentada, Azúcar, Sal, Aceite de maravilla (tocoferoles), Ácido láctico de origen natural, Ácido ascórbico de origen natural, Saborizante natural, Soya."", ""Alérgenos: Gluten, Soya."", ""Trazas: Nuez."", ""Certificados: Libre de Huevo"", ""Libre de Peces"", ""Libre de Mariscos"", ""Libre de Maní"", ""Libre de Sulfitos"", ""Libre de Lactosa"", ""Vegano"", ""Vegetariano"", ""Kosher"", ""Porción: 2 Unidades (50g)"", ""Porciones por envase: 12"", ""100g"", ""1 Porción"", ""Energía"", ""(kCal)"", ""251"", ""125.5"", ""Proteínas"", ""(g)"", ""11"", ""5.5"", ""Grasas Totales"", ""3"", ""1.5"", ""Grasas saturadas (g)"", ""0.5"", ""0.3"", ""Grasas monoinsaturadas (g)"", ""0.7"", ""0.4"", ""Grasas poliinsaturadas (g)"", ""1.7"", ""0.9"", ""Grasas trans (g)"", ""0"", ""Colesterol"", ""(mg)"", ""Hidratos de carbono disponibles"", ""45"", ""22.5"", ""Azúcar total (g)"", ""Fibra"", ""5.8"", ""2.9"", ""Sodio"", ""358"", ""179"", ""Importante: La información del empaque y/o contenido del producto final puede diferir respecto a lo que mostramos en nuestro sitio web, tanto a nivel de ingredientes, trazas, información nutricional, sellos, modo de uso y/o modo de conservación. Usted debe basarse únicamente en la información que se muestra en nuestro sitio web y siempre debe leer las etiquetas, advertencias y instrucciones antes de usar el consumo de un producto."", ""Información obtenida de"", ""PAN INTEGRAL 580G IDEAL"", ""Productos similares"", ""Pan de Molde Artesano Integral"", ""Ver producto"", ""Pan de Molde Integral Bauducco 390 g"", ""Pan de Molde Integral XL Ideal 750 g"", ""Pan de Molde Integral XL Pierre 700 g"", ""-28%"", ""Pan de Molde Blanco Ideal 380 g"", ""PAN INTEGRAL CERO CERO 600G IDEAL"", ""Pan de Molde Blanco Ideal 580 g"", ""Pan Molde Integral"", ""Pan Sándwich"", ""Pan de Molde Integral Castaño 400 g"", ""Pan de Molde Blanco Sin Borde Ideal 400 g"", ""Pan de Completo Xl"", ""Pan de Molde Integral Grande"", ""Pan de Molde Integral Familiar"", ""Pan de Molde Multigrano Sin Gluten Tottus 400 g"", ""Pan de Molde Integral XL Castaño 700 g"", ""Pan de Molde Multigrano"", ""Pan de Molde Blanco XL Ideal 750 g"", ""-14%"", ""¡Juntos son mejores!"", ""Yoghurt Light Sin Azúcar Sabor Chirimoya"", ""Queso Fresco sin Lactosa Bolsa"", ""Quesillo Fresco"", ""Yoghurt Protein+ Sabor Frutilla Soprole 155 g"", ""Pack Yoghurt Batido Colun 12 x 125 g"", ""-12%"", ""Yogur Griego No Endulzado Oikos 150 g""]}",dataset/txt_limpios/1747.txt,dataset/paginas_descargadas/1747.html,ET,pan,keep,0.60,heuristic_default
1753,Panadería y Pastelería,PAN MOLDE BLANCO TOTTUS 580 GRS Productos similares Pan de Molde Blanco XL Castaño 700 g Ver producto Pan Molde Integral Pan de Molde Blanco XL Ideal 750 g -14% Pan de Molde Blanco Ideal 580 g Pan de Molde Blanco XL Pierre 700 g -28% Pan de Hot Dog Blanco Tottus 8 Un 480 g Pan de Molde Integral XL Pierre 700 g Pan Hamburguesa Tipo Brioche Tottus 8 Un 600 g Pan de Molde Blanco Castaño 400 g Pan de Molde Integral Bauducco 390 g Pan de Molde Perfecto Kingsbury 580 g Pan de Molde Integral XL Ideal 750 g Pan de Hot Dog Sin Gluten Tottus 400 g Pan de Molde Blanco Tradicional Bauducco 390 g Pan Molde Blanco Pan de Hamburguesa Sin Gluten Tottus 400 g Pan de Molde Blanco Sin Borde Ideal 400 g ¡Juntos son mejores! Jamón Pierna -26% Jamón Pierna Artesanal Granel KG -22% Jamón Artesanal Pf  a Granel -21% Pack Yoghurt Batido Colun 12 x 125 g -12% Queso Ranco Laminado Granel -16% Jamón Acaramelado Pf a Granel Jamón Colonial Granel -11%,Panadería > 580 g,2.59,,,Desconocido,unknown,UNKNOWN,Panadería y Pastelería,Panadería,,580 g,2.59,,,2.59,2.59,False,original,2.59,2.59,1.0,default_1usd,,PAN MOLDE BLANCO TOTTUS 580 GRS Productos similares Pan de Molde Blanco XL Castaño 700 g Ver producto Pan Molde Integral Pan de Molde Blanco XL Ideal 750 g -14% Pan de Molde Blanco Ideal 580 g Pan de Molde Blanco XL Pierre 700 g -28% Pan de Hot Dog Blanco Tottus 8 Un 480 g Pan de Molde Integral XL Pierre 700 g Pan Hamburguesa Tipo Brioche Tottus 8 Un 600 g Pan de Molde Blanco Castaño 400 g Pan de Molde Integral Bauducco 390 g Pan de Molde Perfecto Kingsbury 580 g Pan de Molde Integral XL Ideal 750 g Pan de Hot Dog Sin Gluten Tottus 400 g Pan de Molde Blanco Tradicional Bauducco 390 g Pan Molde Blanco Pan de Hamburguesa Sin Gluten Tottus 400 g Pan de Molde Blanco Sin Borde Ideal 400 g ¡Juntos son mejores! Jamón Pierna -26% Jamón Pierna Artesanal Granel KG -22% Jamón Artesanal Pf  a Granel -21% Pack Yoghurt Batido Colun 12 x 125 g -12% Queso Ranco Laminado Granel -16% Jamón Acaramelado Pf a Granel Jamón Colonial Granel -11%,,,,,,"{""Descripción"": [""PAN MOLDE BLANCO TOTTUS 580 GRS"", ""Productos similares"", ""Pan de Molde Blanco XL Castaño 700 g"", ""Ver producto"", ""Pan Molde Integral"", ""Pan de Molde Blanco XL Ideal 750 g"", ""-14%"", ""Pan de Molde Blanco Ideal 580 g"", ""Pan de Molde Blanco XL Pierre 700 g"", ""-28%"", ""Pan de Hot Dog Blanco Tottus 8 Un 480 g"", ""Pan de Molde Integral XL Pierre 700 g"", ""Pan Hamburguesa Tipo Brioche Tottus 8 Un 600 g"", ""Pan de Molde Blanco Castaño 400 g"", ""Pan de Molde Integral Bauducco 390 g"", ""Pan de Molde Perfecto Kingsbury 580 g"", ""Pan de Molde Integral XL Ideal 750 g"", ""Pan de Hot Dog Sin Gluten Tottus 400 g"", ""Pan de Molde Blanco Tradicional Bauducco 390 g"", ""Pan Molde Blanco"", ""Pan de Hamburguesa Sin Gluten Tottus 400 g"", ""Pan de Molde Blanco Sin Borde Ideal 400 g"", ""¡Juntos son mejores!"", ""Jamón Pierna"", ""-26%"", ""Jamón Pierna Artesanal Granel"", ""KG"", ""-22%"", ""Jamón Artesanal Pf Granel"", ""-21%"", ""Pack Yoghurt Batido Colun 12 x 125 g"", ""-12%"", ""Queso Ranco Laminado Granel"", ""-16%"", ""Jamón Acaramelado Pf Granel"", ""Jamón Colonial Granel"", ""-11%""]}",dataset/txt_limpios/1753.txt,dataset/paginas_descargadas/1753.html,ET,pan,keep,0.60,heuristic_default
892,Panadería y repostería,,Pan > 500 g,1.95,,,Desconocido,unknown,UNKNOWN,Panadería y repostería,Pan,,500 g,1.95,,$,$1.95,1.95,False,original,1.95,1.95,1.0,default_1usd,,,,,,,,{},dataset/txt_limpios/892.txt,dataset/paginas_descargadas/892.html,EN,pan,keep,0.60,heuristic_default
893,Panadería y repostería,,Pan > 750 g,2.54,,,Desconocido,unknown,UNKNOWN,Panadería y repostería,Pan,,750 g,2.54,,$,$2.54,2.54,False,original,2.54,2.54,1.0,default_1usd,,,,,,,,{},dataset/txt_limpios/893.txt,dataset/paginas_descargadas/893.html,EN,pan,keep,0.60,heuristic_default
894,Panadería y repostería,,Pan > 740 g,2.19,,,Desconocido,unknown,UNKNOWN,Panadería y repostería,Pan,,740 g,2.19,,$,$2.19,2.19,False,original,2.19,2.19,1.0,default_1usd,,,,,,,,{},dataset/txt_limpios/894.txt,dataset/paginas_descargadas/894.html,EN,pan,keep,0.60,heuristic_default
895,Panadería y repostería,,Pan > 800 g,,,,Desconocido,unknown,UNKNOWN,Panadería y repostería,Pan,,800 g,,,,,44.23,True,category_country_mean,,44.2339,1.0,default_1usd,,,,,,,,{},dataset/txt_limpios/895.txt,dataset/paginas_descargadas/895.html,EN,pan,discard,0.60,price_parse_failed;price<=0
896,Panadería y repostería,,Pan,1.76,,,Desconocido,unknown,UNKNOWN,Panadería y repostería,Pan,,,1.76,,$,$1.76,1.76,False,original,1.76,1.76,1.0,default_1usd,,,,,,,,{},dataset/txt_limpios/896.txt,dataset/paginas_descargadas/896.html,EN,pan,keep,0.60,heuristic_default
