{"source_id": "257", "title": "Meu Desconto", "description": "", "breadcrumbs": "Minha Lista > 1 Litro", "price_raw": "6.19", "currency_raw": "BRL", "url": "", "seller": "Desconocido", "availability": "unknown", "country": "BR", "product_name": "Meu Desconto", "brand": "Minha Lista", "reference": "", "unit": "1 Litro", "price_amount": 6.19, "price_currency": "BRL", "price_symbol": "R$", "price_text": "R$6,19", "price_amount_filled": "6.19", "price_is_imputed": "False", "price_imputation_source": "original", "price_amount_usd": "1.1362", "price_amount_usd_filled": "1.1362", "fx_rate_local_per_usd": "5.448", "fx_source": "from_brasil_cambio_dolar", "information_text": "", "description_text": "", "features_text": "", "specifications_text": "", "benefits_text": "", "details_text": "", "other_sections": "", "sections": {}, "txt_path": "dataset/txt_limpios/257.txt", "html_path": "dataset/paginas_descargadas/257.html", "es_status": "EN", "category_canonical": "sin_categoria", "decision": "discard", "match_score": 0.3, "reasons": "no_category_detected"}
{"source_id": "258", "title": "Meu Desconto", "description": "", "breadcrumbs": "Minha Lista > 1L", "price_raw": "8.39", "currency_raw": "BRL", "url": "", "seller": "Desconocido", "availability": "unknown", "country": "BR", "product_name": "Meu Desconto", "brand": "Minha Lista", "reference": "", "unit": "1L", "price_amount": 8.39, "price_currency": "BRL", "price_symbol": "R$", "price_text": "R$8,39", "price_amount_filled": "8.39", "price_is_imputed": "False", "price_imputation_source": "original", "price_amount_usd": "1.54", "price_amount_usd_filled": "1.54", "fx_rate_local_per_usd": "5.448", "fx_source": "from_brasil_cambio_dolar", "information_text": "", "description_text": "", "features_text": "", "specifications_text": "", "benefits_text": "", "details_text": "", "other_sections": "", "sections": {}, "txt_path": "dataset/txt_limpios/258.txt", "html_path": "dataset/paginas_descargadas/258.html", "es_status": "EN", "category_canonical": "sin_categoria", "decision": "discard", "match_score": 0.3, "reasons": "no_category_detected"}
{"source_id": "259", "title": "Meu Desconto", "description": "", "breadcrumbs": "Minha Lista > 1 Litro", "price_raw": "6.29", "currency_raw": "BRL", "url": "", "seller": "Desconocido", "availability": "unknown", "country": "BR", "product_name": "Meu Desconto", "brand": "Minha Lista", "reference": "", "unit": "1 Litro", "price_amount": 6.29, "price_currency": "BRL", "price_symbol": "R$", "price_text": "R$6,29", "price_amount_filled": "6.29", "price_is_imputed": "False", "price_imputation_source": "original", "price_amount_usd": "1.1546", "price_amount_usd_filled": "1.1546", "fx_rate_local_per_usd": "5.448", "fx_source": "from_brasil_cambio_dolar", "information_text": "", "description_text": "", "features_text": "", "specifications_text": "", "benefits_text": "", "details_text": "", "other_sections": "", "sections": {}, "txt_path": "dataset/txt_limpios/259.txt", "html_path": "dataset/paginas_descargadas/259.html", "es_status": "EN", "category_canonical": "sin_categoria", "decision": "discard", "match_score": 0.3, "reasons": "no_category_detected"}
{"source_id": "260", "title": "Meu Desconto", "description": "", "breadcrumbs": "Minha Lista > 350ml", "price_raw": "5.59", "currency_raw": "BRL", "url": "", "seller": "Desconocido", "availability": "unknown", "country": "BR", "product_name": "Meu Desconto", "brand": "Minha Lista", "reference": "", "unit": "350ml", "price_amount": 5.59, "price_currency": "BRL", "price_symbol": "R$", "price_text": "R$5,59", "price_amount_filled": "5.59", "price_is_imputed": "False", "price_imputation_source": "original", "price_amount_usd": "1.0261", "price_amount_usd_filled": "1.0261", "fx_rate_local_per_usd": "5.448", "fx_source": "from_brasil_cambio_dolar", "information_text": "", "description_text": "", "features_text": "", "specifications_text": "", "benefits_text": "", "details_text": "", "other_sections": "", "sections": {}, "txt_path": "dataset/txt_limpios/260.txt", "html_path": "dataset/paginas_descargadas/260.html", "es_status": "EN", "category_canonical": "sin_categoria", "decision": "discard", "match_score": 0.3, "reasons": "no_category_detected"}
{"source_id": "261", "title": "Meu Desconto", "description": "", "breadcrumbs": "Minha Lista > 330ml", "price_raw": "4.99", "currency_raw": "BRL", "url": "", "seller": "Desconocido", "availability": "unknown", "country": "BR", "product_name": "Meu Desconto", "brand": "Minha Lista", "reference": "", "unit": "330ml", "price_amount": 4.99, "price_currency": "BRL", "price_symbol": "R$", "price_text": "R$4,99", "price_amount_filled": "4.99", "price_is_imputed": "False", "price_imputation_source": "original", "price_amount_usd": "0.9159", "price_amount_usd_filled": "0.9159", "fx_rate_local_per_usd": "5.448", "fx_source": "from_brasil_cambio_dolar", "information_text": "", "description_text": "", "features_text": "Características gustativas | Frutado,Condimentada,Boa formación,persistente. | Cervezas del estilo American Lager son ligeros en color y cuerpo, tienen bajo amargor y suelen ser neutrales, refrescantes y bien carbonatadas. El sabor es sutil (es decir, ningún ingrediente puede dominar los demás). Hay un dulzor residual de malta y adjuntos y otras fuentes de azúcar pueden utilizarse. | Descargue la app | Institucional | ¿Quién somos | Trabaja Conosco | Política de privacidad y Términos de Uso | Términos Buscados | Heineken | Vinos | Fraldas | Mapa del sitio | Mapa de productos | Mapa de tiendas | Central de Atención | 0800 779 6761 | Mis Solicitudes | Encuentra una Tienda | Formas de Pago | Intercambios y descartes | Preguntas frecuentes | Nuestros canales | facebook | instagram | tiktok | whatsapp | YouTube | x | Estoy consciente", "specifications_text": "", "benefits_text": "", "details_text": "", "other_sections": "", "sections": {"Características": ["Características gustativas", "Frutado,Condimentada,Boa formación,persistente.", "Las cervezas del estilo American Lager son ligeras en color y cuerpo, tienen bajo amargor y suelen ser neutrales, refrescantes y bien carbonatadas. El sabor es sutil (es decir, ningún ingrediente puede dominar los demás). Hay un dulzor residual de malta y adjuntos y otras fuentes de azúcar pueden utilizarse.", "baixe o app", "Institucional", "Quem somos", "Trabalhe Conosco", "Política de privacidad y Términos de uso", "Termos Buscados", "Heineken", "Vinhos", "Fraldas", "Mapa do site", "Mapa de productos", "Mapa de tiendas", "Central de Atendimento", "0800 779 6761", "Meus Pedidos", "Encuentra una tienda", "Formas de Pagamento", "Intercambios y descartes", "Preguntas frecuentes", "Nossos canais", "facebook", "instagram", "tiktok", "whatsapp", "youtube", "x", "Estou ciente"]}, "txt_path": "dataset/txt_limpios/261.txt", "html_path": "dataset/paginas_descargadas/261.html", "es_status": "ET", "category_canonical": "sin_categoria", "decision": "discard", "match_score": 0.3, "reasons": "no_category_detected"}
{"source_id": "262", "title": "Meu Desconto", "description": "", "breadcrumbs": "Minha Lista > 269ml", "price_raw": "3.39", "currency_raw": "BRL", "url": "", "seller": "Desconocido", "availability": "unknown", "country": "BR", "product_name": "Meu Desconto", "brand": "Minha Lista", "reference": "", "unit": "269ml", "price_amount": 3.39, "price_currency": "BRL", "price_symbol": "R$", "price_text": "R$3,39", "price_amount_filled": "3.39", "price_is_imputed": "False", "price_imputation_source": "original", "price_amount_usd": "0.6222", "price_amount_usd_filled": "0.6222", "fx_rate_local_per_usd": "5.448", "fx_source": "from_brasil_cambio_dolar", "information_text": "", "description_text": "", "features_text": "", "specifications_text": "", "benefits_text": "", "details_text": "", "other_sections": "", "sections": {}, "txt_path": "dataset/txt_limpios/262.txt", "html_path": "dataset/paginas_descargadas/262.html", "es_status": "EN", "category_canonical": "sin_categoria", "decision": "discard", "match_score": 0.3, "reasons": "no_category_detected"}
{"source_id": "263", "title": "Meu Desconto", "description": "", "breadcrumbs": "Minha Lista", "price_raw": "18.0", "currency_raw": "", "url": "", "seller": "Desconocido", "availability": "unknown", "country": "UNKNOWN", "product_name": "Meu Desconto", "brand": "Minha Lista", "reference": "", "unit": "", "price_amount": 18.0, "price_currency": "", "price_symbol": "", "price_text": "18", "price_amount_filled": "18.0", "price_is_imputed": "False", "price_imputation_source": "original", "price_amount_usd": "18.0", "price_amount_usd_filled": "18.0", "fx_rate_local_per_usd": "1.0", "fx_source": "default_1usd", "information_text": "", "description_text": "", "features_text": "", "specifications_text": "", "benefits_text": "", "details_text": "", "other_sections": "", "sections": {}, "txt_path": "dataset/txt_limpios/263.txt", "html_path": "dataset/paginas_descargadas/263.html", "es_status": "EN", "category_canonical": "sin_categoria", "decision": "discard", "match_score": 0.3, "reasons": "no_category_detected"}
{"source_id": "264", "title": "Meu Desconto", "description": "", "breadcrumbs": "Minha Lista > 350ml", "price_raw": "5.19", "currency_raw": "BRL", "url": "", "seller": "Desconocido", "availability": "unknown", "country": "BR", "product_name": "Meu Desconto", "brand": "Minha Lista", "reference": "", "unit": "350ml", "price_amount": 5.19, "price_currency": "BRL", "price_symbol": "R$", "price_text": "R$5,19", "price_amount_filled": "5.19", "price_is_imputed": "False", "price_imputation_source": "original", "price_amount_usd": "0.9526", "price_amount_usd_filled": "0.9526", "fx_rate_local_per_usd": "5.448", "fx_source": "from_brasil_cambio_dolar", "information_text": "", "description_text": "", "features_text": "", "specifications_text": "", "benefits_text": "", "details_text": "", "other_sections": "", "sections": {}, "txt_path": "dataset/txt_limpios/264.txt", "html_path": "dataset/paginas_descargadas/264.html", "es_status": "EN", "category_canonical": "sin_categoria", "decision": "discard", "match_score": 0.3, "reasons": "no_category_detected"}
{"source_id": "265", "title": "Meu Desconto", "description": "", "breadcrumbs": "Minha Lista", "price_raw": "18.0", "currency_raw": "", "url": "", "seller": "Desconocido", "availability": "unknown", "country": "UNKNOWN", "product_name": "Meu Desconto", "brand": "Minha Lista", "reference": "", "unit": "", "price_amount": 18.0, "price_currency": "", "price_symbol": "", "price_text": "18", "price_amount_filled": "18.0", "price_is_imputed": "False", "price_imputation_source": "original", "price_amount_usd": "18.0", "price_amount_usd_filled": "18.0", "fx_rate_local_per_usd": "1.0", "fx_source": "default_1usd", "information_text": "", "description_text": "", "features_text": "", "specifications_text": "", "benefits_text": "", "details_text": "", "other_sections": "", "sections": {}, "txt_path": "dataset/txt_limpios/265.txt", "html_path": "dataset/paginas_descargadas/265.html", "es_status": "EN", "category_canonical": "sin_categoria", "decision": "discard", "match_score": 0.3, "reasons": "no_category_detected"}
{"source_id": "266", "title": "Meu Desconto", "description": "", "breadcrumbs": "Minha Lista > 800g", "price_raw": "15.9", "currency_raw": "BRL", "url": "", "seller": "Desconocido", "availability": "unknown", "country": "BR", "product_name": "Meu Desconto", "brand": "Minha Lista", "reference": "", "unit": "800g", "price_amount": 15.9, "price_currency": "BRL", "price_symbol": "R$", "price_text": "R$15,90", "price_amount_filled": "15.9", "price_is_imputed": "False", "price_imputation_source": "original", "price_amount_usd": "2.9185", "price_amount_usd_filled": "2.9185", "fx_rate_local_per_usd": "5.448", "fx_source": "from_brasil_cambio_dolar", "information_text": "", "description_text": "", "features_text": "", "specifications_text": "", "benefits_text": "", "details_text": "", "other_sections": "", "sections": {}, "txt_path": "dataset/txt_limpios/266.txt", "html_path": "dataset/paginas_descargadas/266.html", "es_status": "EN", "category_canonical": "sin_categoria", "decision": "discard", "match_score": 0.3, "reasons": "no_category_detected"}
{"source_id": "267", "title": "Meu Desconto", "description": "", "breadcrumbs": "Minha Lista > 2,2Kg", "price_raw": "28.99", "currency_raw": "BRL", "url": "", "seller": "Desconocido", "availability": "unknown", "country": "BR", "product_name": "Meu Desconto", "brand": "Minha Lista", "reference": "", "unit": "2,2Kg", "price_amount": 28.99, "price_currency": "BRL", "price_symbol": "R$", "price_text": "R$28,99", "price_amount_filled": "28.99", "price_is_imputed": "False", "price_imputation_source": "original", "price_amount_usd": "5.3212", "price_amount_usd_filled": "5.3212", "fx_rate_local_per_usd": "5.448", "fx_source": "from_brasil_cambio_dolar", "information_text": "", "description_text": "", "features_text": "", "specifications_text": "", "benefits_text": "", "details_text": "", "other_sections": "", "sections": {}, "txt_path": "dataset/txt_limpios/267.txt", "html_path": "dataset/paginas_descargadas/267.html", "es_status": "EN", "category_canonical": "sin_categoria", "decision": "discard", "match_score": 0.3, "reasons": "no_category_detected"}
{"source_id": "268", "title": "Meu Desconto", "description": "", "breadcrumbs": "Minha Lista > 700g", "price_raw": "33.99", "currency_raw": "BRL", "url": "", "seller": "Desconocido", "availability": "unknown", "country": "BR", "product_name": "Meu Desconto", "brand": "Minha Lista", "reference": "", "unit": "700g", "price_amount": 33.99, "price_currency": "BRL", "price_symbol": "R$", "price_text": "R$33,99", "price_amount_filled": "33.99", "price_is_imputed": "False", "price_imputation_source": "original", "price_amount_usd": "6.239", "price_amount_usd_filled": "6.239", "fx_rate_local_per_usd": "5.448", "fx_source": "from_brasil_cambio_dolar", "information_text": "", "description_text": "", "features_text": "", "specifications_text": "", "benefits_text": "", "details_text": "", "other_sections": "", "sections": {}, "txt_path": "dataset/txt_limpios/268.txt", "html_path": "dataset/paginas_descargadas/268.html", "es_status": "EN", "category_canonical": "sin_categoria", "decision": "discard", "match_score": 0.3, "reasons": "no_category_detected"}
{"source_id": "270", "title": "Meu Desconto", "description": "", "breadcrumbs": "Minha Lista > 1kg", "price_raw": "5.49", "currency_raw": "BRL", "url": "", "seller": "Desconocido", "availability": "unknown", "country": "BR", "product_name": "Meu Desconto", "brand": "Minha Lista", "reference": "", "unit": "1kg", "price_amount": 5.49, "price_currency": "BRL", "price_symbol": "R$", "price_text": "R$5,49", "price_amount_filled": "5.49", "price_is_imputed": "False", "price_imputation_source": "original", "price_amount_usd": "1.0077", "price_amount_usd_filled": "1.0077", "fx_rate_local_per_usd": "5.448", "fx_source": "from_brasil_cambio_dolar", "information_text": "", "description_text": "", "features_text": "", "specifications_text": "", "benefits_text": "", "details_text": "", "other_sections": "", "sections": {}, "txt_path": "dataset/txt_limpios/270.txt", "html_path": "dataset/paginas_descargadas/270.html", "es_status": "EN", "category_canonical": "sin_categoria", "decision": "discard", "match_score": 0.3, "reasons": "no_category_detected"}
{"source_id": "271", "title": "Meu Desconto", "description": "", "breadcrumbs": "Minha Lista > 1kg", "price_raw": "4.29", "currency_raw": "BRL", "url": "", "seller": "Desconocido", "availability": "unknown", "country": "BR", "product_name": "Meu Desconto", "brand": "Minha Lista", "reference": "", "unit": "1kg", "price_amount": 4.29, "price_currency": "BRL", "price_symbol": "R$", "price_text": "R$4,29", "price_amount_filled": "4.29", "price_is_imputed": "False", "price_imputation_source": "original", "price_amount_usd": "0.7874", "price_amount_usd_filled": "0.7874", "fx_rate_local_per_usd": "5.448", "fx_source": "from_brasil_cambio_dolar", "information_text": "", "description_text": "", "features_text": "", "specifications_text": "", "benefits_text": "", "details_text": "", "other_sections": "", "sections": {}, "txt_path": "dataset/txt_limpios/271.txt", "html_path": "dataset/paginas_descargadas/271.html", "es_status": "EN", "category_canonical": "sin_categoria", "decision": "discard", "match_score": 0.3, "reasons": "no_category_detected"}
{"source_id": "272", "title": "Meu Desconto", "description": "", "breadcrumbs": "Minha Lista > 1kg", "price_raw": "4.99", "currency_raw": "BRL", "url": "", "seller": "Desconocido", "availability": "unknown", "country": "BR", "product_name": "Meu Desconto", "brand": "Minha Lista", "reference": "", "unit": "1kg", "price_amount": 4.99, "price_currency": "BRL", "price_symbol": "R$", "price_text": "R$4,99", "price_amount_filled": "4.99", "price_is_imputed": "False", "price_imputation_source": "original", "price_amount_usd": "0.9159", "price_amount_usd_filled": "0.9159", "fx_rate_local_per_usd": "5.448", "fx_source": "from_brasil_cambio_dolar", "information_text": "", "description_text": "", "features_text": "", "specifications_text": "", "benefits_text": "", "details_text": "", "other_sections": "", "sections": {}, "txt_path": "dataset/txt_limpios/272.txt", "html_path": "dataset/paginas_descargadas/272.html", "es_status": "EN", "category_canonical": "sin_categoria", "decision": "discard", "match_score": 0.3, "reasons": "no_category_detected"}
{"source_id": "273", "title": "Meu Desconto", "description": "", "breadcrumbs": "Minha Lista > 1kg", "price_raw": "9.19", "currency_raw": "BRL", "url": "", "seller": "Desconocido", "availability": "unknown", "country": "BR", "product_name": "Meu Desconto", "brand": "Minha Lista", "reference": "", "unit": "1kg", "price_amount": 9.19, "price_currency": "BRL", "price_symbol": "R$", "price_text": "R$9,19", "price_amount_filled": "9.19", "price_is_imputed": "False", "price_imputation_source": "original", "price_amount_usd": "1.6869", "price_amount_usd_filled": "1.6869", "fx_rate_local_per_usd": "5.448", "fx_source": "from_brasil_cambio_dolar", "information_text": "", "description_text": "", "features_text": "", "specifications_text": "", "benefits_text": "", "details_text": "", "other_sections": "", "sections": {}, "txt_path": "dataset/txt_limpios/273.txt", "html_path": "dataset/paginas_descargadas/273.html", "es_status": "EN", "category_canonical": "sin_categoria", "decision": "discard", "match_score": 0.3, "reasons": "no_category_detected"}
{"source_id": "274", "title": "Meu Desconto", "description": "", "breadcrumbs": "Minha Lista > 1kg", "price_raw": "7.99", "currency_raw": "BRL", "url": "", "seller": "Desconocido", "availability": "unknown", "country": "BR", "product_name": "Meu Desconto", "brand": "Minha Lista", "reference": "", "unit": "1kg", "price_amount": 7.99, "price_currency": "BRL", "price_symbol": "R$", "price_text": "R$7,99", "price_amount_filled": "7.99", "price_is_imputed": "False", "price_imputation_source": "original", "price_amount_usd": "1.4666", "price_amount_usd_filled": "1.4666", "fx_rate_local_per_usd": "5.448", "fx_source": "from_brasil_cambio_dolar", "information_text": "", "description_text": "", "features_text": "", "specifications_text": "", "benefits_text": "", "details_text": "", "other_sections": "", "sections": {}, "txt_path": "dataset/txt_limpios/274.txt", "html_path": "dataset/paginas_descargadas/274.html", "es_status": "EN", "category_canonical": "sin_categoria", "decision": "discard", "match_score": 0.3, "reasons": "no_category_detected"}
{"source_id": "275", "title": "Meu Desconto", "description": "", "breadcrumbs": "Minha Lista > 500g", "price_raw": "10.29", "currency_raw": "BRL", "url": "", "seller": "Desconocido", "availability": "unknown", "country": "BR", "product_name": "Meu Desconto", "brand": "Minha Lista", "reference": "", "unit": "500g", "price_amount": 10.29, "price_currency": "BRL", "price_symbol": "R$", "price_text": "R$10,29", "price_amount_filled": "10.29", "price_is_imputed": "False", "price_imputation_source": "original", "price_amount_usd": "1.8888", "price_amount_usd_filled": "1.8888", "fx_rate_local_per_usd": "5.448", "fx_source": "from_brasil_cambio_dolar", "information_text": "", "description_text": "", "features_text": "", "specifications_text": "", "benefits_text": "", "details_text": "", "other_sections": "", "sections": {}, "txt_path": "dataset/txt_limpios/275.txt", "html_path": "dataset/paginas_descargadas/275.html", "es_status": "EN", "category_canonical": "sin_categoria", "decision": "discard", "match_score": 0.3, "reasons": "no_category_detected"}
{"source_id": "276", "title": "Meu Desconto", "description": "", "breadcrumbs": "Minha Lista > 500g", "price_raw": "7.99", "currency_raw": "BRL", "url": "", "seller": "Desconocido", "availability": "unknown", "country": "BR", "product_name": "Meu Desconto", "brand": "Minha Lista", "reference": "", "unit": "500g", "price_amount": 7.99, "price_currency": "BRL", "price_symbol": "R$", "price_text": "R$7,99", "price_amount_filled": "7.99", "price_is_imputed": "False", "price_imputation_source": "original", "price_amount_usd": "1.4666", "price_amount_usd_filled": "1.4666", "fx_rate_local_per_usd": "5.448", "fx_source": "from_brasil_cambio_dolar", "information_text": "", "description_text": "", "features_text": "", "specifications_text": "", "benefits_text": "", "details_text": "", "other_sections": "", "sections": {}, "txt_path": "dataset/txt_limpios/276.txt", "html_path": "dataset/paginas_descargadas/276.html", "es_status": "EN", "category_canonical": "sin_categoria", "decision": "discard", "match_score": 0.3, "reasons": "no_category_detected"}
