source_id,title,description,breadcrumbs,price_raw,currency_raw,url,seller,availability,country,product_name,brand,reference,unit,price_amount,price_currency,price_symbol,price_text,price_amount_filled,price_is_imputed,price_imputation_source,price_amount_usd,price_amount_usd_filled,fx_rate_local_per_usd,fx_source,information_text,description_text,features_text,specifications_text,benefits_text,details_text,other_sections,sections,txt_path,html_path,es_status,category_canonical,decision,match_score,reasons
1150,Centro de preferencia de la privacidad,,Activas siempre > 750g,,PEN,,Desconocido,unknown,PE,Centro de preferencia de la privacidad,Activas siempre,,750g,,PEN,,,55.14,True,country_mean,,15.5336,3.55,from_peru_cambio_dolar,,,TE RECOMENDAMOS | GRAN CHALAN | Arroz GRAN CHALAN Extra Añejo Bolsa 750gr | 5 | -16% | Arroz Añejo Extra COSTEÑO Bolsa 5kg | 29 | 60 | 24 | 16% | Arroz Extra GRAN CHALAN Bolsa 5Kg | 26 | 80 | FARAON | Arroz Extra FARAON Bolsa 750g | 50 | PAISANA | Arroz Extra PAISANA Bolsa 1Kg | 6 | BELL'S | Arroz Extra BELL'S Bolsa 5Kg | 21 | 40 | -2% | VALLENORTE | Arroz Extra VALLENORTE Gran Reserva Bolsa 750g | 2% | Arroz Extra COSTEÑO Bolsa 5Kg | -11% | Arroz Extra Añejo VALLENORTE Gran Reserva Bolsa 5Kg | 28 | 25 | 11% | Arroz Extra Añejo FARAON Naranja Bolsa 5kg | ¡Entérate de eventos exclusivos y promociones especiales que tenemos para ti! | SUSCRIBIRME | Acepto las políticas de tratamientos de datos personales | Razón Social: Compañía Food Retail S.A.C. RUC: 20608300393. Todos los derechos reservados Vivanda 2023. | | Hola! | Encuentra todo lo que necesitas en Vivanda online | Términos más buscados | 1. | quesos | 2. | vino | 3. | café | 4. | quark 500g | 5. | leche | 6. | pollo | 7. | yogurt | 8. | lunch florencia | 9. | agua | 10 | vinos,,,,,"{""Características"": [""TE RECOMENDAMOS"", ""GRAN CHALAN"", ""Arroz GRAN CHALAN Extra Añejo Bolsa 750gr"", ""5"", ""-16%"", ""Arroz Añejo Extra COSTEÑO Bolsa 5kg"", ""29"", ""60"", ""24"", ""16%"", ""Arroz Extra GRAN CHALAN Bolsa 5Kg"", ""26"", ""80"", ""FARAON"", ""Arroz Extra FARAON Bolsa 750g"", ""50"", ""PAISANA"", ""Arroz Extra PAISANA Bolsa 1Kg"", ""6"", ""BELL'S"", ""Arroz Extra BELL'S Bolsa 5Kg"", ""21"", ""40"", ""-2%"", ""VALLENORTE"", ""Arroz Extra VALLENORTE Gran Reserva Bolsa 750g"", ""2%"", ""Arroz Extra COSTEÑO Bolsa 5Kg"", ""-11%"", ""Arroz Extra Añejo VALLENORTE Gran Reserva Bolsa 5Kg"", ""28"", ""25"", ""11%"", ""Arroz Extra Añejo FARAON Naranja Bolsa 5kg"", ""¡Entérate de eventos exclusivos y promociones especiales que tenemos para ti!"", ""SUSCRIBIRME"", ""Acepto las políticas de tratamiento de datos personales"", ""Razón social: Compañía Food Retail S.A.C. RUC: 20608300393. Todos los derechos reservados Vivanda 2023."", ""¡Hola!"", ""Encuentra todo lo que necesitas en Vivanda online"", ""Términos más buscados"", ""1."", ""quesos"", ""2."", ""vino"", ""3."", ""cafe"", ""4."", ""quark 500g"", ""5."", ""leche"", ""6."", ""pollo"", ""7."", ""yogurt"", ""8."", ""lunch florencia"", ""9."", ""agua"", ""10."", ""vinos""]}",dataset/txt_limpios/1150.txt,dataset/paginas_descargadas/1150.html,ET,sin_categoria,discard,0.30,no_category_detected;price_parse_failed
1151,Centro de preferencia de la privacidad,,Activas siempre > 750g,,PEN,,Desconocido,unknown,PE,Centro de preferencia de la privacidad,Activas siempre,,750g,,PEN,,,55.14,True,country_mean,,15.5336,3.55,from_peru_cambio_dolar,,,TE RECOMENDAMOS | -3% | PAISANA | Arroz Extra PAISANA Bolsa 5Kg | 23 | 70 | 22 | 3% | GRAN CHALAN | Arroz Extra Gourmet Añejo GRAN CHALAN Paquete 5Kg | 26 | 60 | -16% | COSTENO | Arroz Añejo Extra COSTEÑO Bolsa 5kg | 29 | 24 | 16% | Arroz Extra GRAN CHALAN Bolsa 5Kg | FARAON | Arroz Extra FARAON Bolsa 750g | 50 | Arroz Blanco FARAON Extra Añejo Negro Bolsa 5Kg | No disponible | -2% | Arroz Extra COSTEÑO Bolsa 5Kg | Arroz Extra COSTEÑO Bolsa 750g | -11% | Arroz Extra Añejo VALLENORTE Gran Reserva Bolsa 5Kg | 28 | 25 | 40 | 11% | ¡Entérate de eventos exclusivos y promociones especiales que tenemos para ti! | SUSCRIBIRME | Acepto las políticas de tratamientos de datos personales | Razón Social: Compañía Food Retail S.A.C. RUC: 20608300393. Todos los derechos reservados Vivanda 2023. | | Hola! | Encuentra todo lo que necesitas en Vivanda online | Términos más buscados | 1. | quesos | 2. | vino | 3. | café | 4. | quark 500g | 5. | leche | 6. | pollo | 7. | yogurt | 8. | lunch florencia | 9. | agua | 10 | vinos,,,,,"{""Características"": [""TE RECOMENDAMOS"", ""-3%"", ""PAISANA"", ""Arroz Extra PAISANA Bolsa 5Kg"", ""23"", ""70"", ""22"", ""3%"", ""GRAN CHALAN"", ""Arroz Extra Gourmet  Añejo GRAN CHALAN Paquete 5Kg"", ""26"", ""60"", ""-16%"", ""COSTENO"", ""Arroz Añejo Extra COSTEÑO Bolsa 5kg"", ""29"", ""24"", ""16%"", ""Arroz Extra GRAN CHALAN Bolsa 5Kg"", ""FARAON"", ""Arroz Extra FARAON Bolsa 750g"", ""50"", ""Arroz Blanco FARAON Extra Añejo Negro Bolsa 5Kg"", ""No disponible"", ""-2%"", ""Arroz Extra COSTEÑO Bolsa 5Kg"", ""Arroz Extra COSTEÑO Bolsa 750g"", ""-11%"", ""Arroz Extra Añejo VALLENORTE Gran Reserva Bolsa 5Kg"", ""28"", ""25"", ""40"", ""11%"", ""¡Entérate de eventos exclusivos y promociones especiales que tenemos para ti!"", ""SUSCRIBIRME"", ""Acepto las políticas de tratamiento de datos personales"", ""Razón social: Compañía Food Retail S.A.C. RUC: 20608300393. Todos los derechos reservados Vivanda 2023."", ""¡Hola!"", ""Encuentra todo lo que necesitas en Vivanda online"", ""Términos más buscados"", ""1."", ""quesos"", ""2."", ""vino"", ""3."", ""cafe"", ""4."", ""quark 500g"", ""5."", ""leche"", ""6."", ""pollo"", ""7."", ""yogurt"", ""8."", ""lunch florencia"", ""9."", ""agua"", ""10."", ""vinos""]}",dataset/txt_limpios/1151.txt,dataset/paginas_descargadas/1151.html,ET,sin_categoria,discard,0.30,no_category_detected;price_parse_failed
1152,Centro de preferencia de la privacidad,,Activas siempre > 1Kg,,PEN,,Desconocido,unknown,PE,Centro de preferencia de la privacidad,Activas siempre,,1Kg,,PEN,,,55.14,True,country_mean,,15.5336,3.55,from_peru_cambio_dolar,,,TE RECOMENDAMOS | ¡Entérate de eventos exclusivos y promociones especiales que tenemos para ti! | SUSCRIBIRME | Acepto las políticas de tratamientos de datos personales | Razón Social: Compañía Food Retail S.A.C. RUC: 20608300393. Todos los derechos reservados Vivanda 2023. | | Hola! | Encuentra todo lo que necesitas en Vivanda online | Términos más buscados | 1. | quesos | 2. | vino | 3. | café | 4. | quark 500g | 5. | leche | 6. | pollo | 7. | yogurt | 8. | lunch florencia | 9. | agua | 10 | vinos,,,,,"{""Características"": [""TE RECOMENDAMOS"", ""¡Entérate de eventos exclusivos y promociones especiales que tenemos para ti!"", ""SUSCRIBIRME"", ""Acepto las políticas de tratamiento de datos personales"", ""Razón social: Compañía Food Retail S.A.C. RUC: 20608300393. Todos los derechos reservados Vivanda 2023."", ""¡Hola!"", ""Encuentra todo lo que necesitas en Vivanda online"", ""Términos más buscados"", ""1."", ""quesos"", ""2."", ""vino"", ""3."", ""cafe"", ""4."", ""quark 500g"", ""5."", ""leche"", ""6."", ""pollo"", ""7."", ""yogurt"", ""8."", ""lunch florencia"", ""9."", ""agua"", ""10."", ""vinos""]}",dataset/txt_limpios/1152.txt,dataset/paginas_descargadas/1152.html,ET,sin_categoria,discard,0.30,no_category_detected;price_parse_failed
1153,Centro de preferencia de la privacidad,,Activas siempre > 5Kg,,PEN,,Desconocido,unknown,PE,Centro de preferencia de la privacidad,Activas siempre,,5Kg,,PEN,,,55.14,True,country_mean,,15.5336,3.55,from_peru_cambio_dolar,,,TE RECOMENDAMOS | Arroz Superior PAISANA Bolsa 1Kg | 6 | 30 | -18% | VALLENORTE | Arroz Superior VALLENORTE Bolsa 750g | 4 | -19% | Arroz Superior VALLENORTE Bolsa 5Kg | 25 | 20 | 19% | BELL'S | Arroz Superior BELL'S Bolsa 750g | 3 | 50 | Arroz Superior BELL'S Bolsa 5Kg | 19 | FARAON | Arroz Añejo Amarillo FARAÓN G3 Bolsa 1Kg | 5 | 10 | -17% | Arroz Superior Añejo VALLENORTE Bolsa 5Kg | 27 | 22 | 17% | Arroz Superior Añejo VALLENORTE Bolsa 750g | 80 | Arroz FARAON Añejo Amarillo G3 Bolsa 5kg | ¡Entérate de eventos exclusivos y promociones especiales que tenemos para ti! | SUSCRIBIRME | Acepto las políticas de tratamientos de datos personales | Razón Social: Compañía Food Retail S.A.C. RUC: 20608300393. Todos los derechos reservados Vivanda 2023. | | Hola! | Encuentra todo lo que necesitas en Vivanda online | Términos más buscados | 1. | quesos | 2. | vino | 3. | café | 4. | quark 500g | 5. | leche | 6. | pollo | 7. | yogurt | 8. | lunch florencia | 9. | agua | 10 | vinos,,,,,"{""Características"": [""TE RECOMENDAMOS"", ""Arroz Superior PAISANA Bolsa 1Kg"", ""6"", ""30"", ""-18%"", ""VALLENORTE"", ""Arroz Superior VALLENORTE Bolsa 750g"", ""4"", ""-19%"", ""Arroz Superior VALLENORTE Bolsa 5Kg"", ""25"", ""20"", ""19%"", ""BELL'S"", ""Arroz Superior BELL'S Bolsa 750g"", ""3"", ""50"", ""Arroz Superior BELL'S Bolsa 5Kg"", ""19"", ""FARAON"", ""Arroz Añejo Amarillo FARAÓN G3 Bolsa 1Kg"", ""5"", ""10"", ""-17%"", ""Arroz Superior Añejo VALLENORTE Bolsa 5Kg"", ""27"", ""22"", ""17%"", ""Arroz Superior Añejo VALLENORTE Bolsa 750g"", ""80"", ""Arroz FARAON Añejo Amarillo G3 Bolsa 5kg"", ""¡Entérate de eventos exclusivos y promociones especiales que tenemos para ti!"", ""SUSCRIBIRME"", ""Acepto las políticas de tratamiento de datos personales"", ""Razón social: Compañía Food Retail S.A.C. RUC: 20608300393. Todos los derechos reservados Vivanda 2023."", ""¡Hola!"", ""Encuentra todo lo que necesitas en Vivanda online"", ""Términos más buscados"", ""1."", ""quesos"", ""2."", ""vino"", ""3."", ""cafe"", ""4."", ""quark 500g"", ""5."", ""leche"", ""6."", ""pollo"", ""7."", ""yogurt"", ""8."", ""lunch florencia"", ""9."", ""agua"", ""10."", ""vinos""]}",dataset/txt_limpios/1153.txt,dataset/paginas_descargadas/1153.html,ET,sin_categoria,discard,0.30,no_category_detected;price_parse_failed
1154,Centro de preferencia de la privacidad,,Activas siempre > 750gr,,PEN,,Desconocido,unknown,PE,Centro de preferencia de la privacidad,Activas siempre,,750gr,,PEN,,,55.14,True,country_mean,,15.5336,3.55,from_peru_cambio_dolar,,,,,,,,{},dataset/txt_limpios/1154.txt,dataset/paginas_descargadas/1154.html,EN,sin_categoria,discard,0.30,no_category_detected;price_parse_failed
1155,Centro de preferencia de la privacidad,,Activas siempre > 8 Piezas,,PEN,,Desconocido,unknown,PE,Centro de preferencia de la privacidad,Activas siempre,,8 Piezas,,PEN,,,55.14,True,country_mean,,15.5336,3.55,from_peru_cambio_dolar,,,TE RECOMENDAMOS | VIVANDA | Pollo Entero Fresco con Menudencia | 9 | 50 | REDONDOS | Baby Chicken Congelado REDONDOS | 21 | 99 | Pollo Entero sin Piel ARTISAN Light x Kg | En el disponible | Pollo Fresco con Menúdencia Trozado en 8 Piezas | Pollo Fresco Light Sin Piel | ¡Entérate de eventos exclusivos y promociones especiales que tenemos para ti! | SUSCRIBIRME | Acepto las políticas de tratamientos de datos personales | Razón Social: Compañía Food Retail S.A.C. RUC: 20608300393. Todos los derechos reservados Vivanda 2023. | |Hola! | Encuentra todo lo que necesitas en Vivanda online | Términos más buscados | 1. | quesos | 2. | vino | 3. | café | 4. | quark 500g | 5. | leche | 6. | yogurt | 8. | lunch florencia | 9. | agua | 10 | vinos,,,,,"{""Características"": [""TE RECOMENDAMOS"", ""VIVANDA"", ""Pollo Entero Fresco con Menudencia"", ""9"", ""50"", ""REDONDOS"", ""Baby Chicken Congelado REDONDOS"", ""21"", ""99"", ""Pollo Entero sin Piel ARTISAN Light x Kg"", ""No disponible"", ""Pollo Fresco con Menudencia Trozado en 8 Piezas"", ""Pollo Fresco Light Sin Piel"", ""¡Entérate de eventos exclusivos y promociones especiales que tenemos para ti!"", ""SUSCRIBIRME"", ""Acepto las políticas de tratamiento de datos personales"", ""Razón social: Compañía Food Retail S.A.C. RUC: 20608300393. Todos los derechos reservados Vivanda 2023."", ""¡Hola!"", ""Encuentra todo lo que necesitas en Vivanda online"", ""Términos más buscados"", ""1."", ""quesos"", ""2."", ""vino"", ""3."", ""cafe"", ""4."", ""quark 500g"", ""5."", ""leche"", ""6."", ""7."", ""yogurt"", ""8."", ""lunch florencia"", ""9."", ""agua"", ""10."", ""vinos""]}",dataset/txt_limpios/1155.txt,dataset/paginas_descargadas/1155.html,ET,sin_categoria,discard,0.30,no_category_detected;price_parse_failed
1156,Centro de preferencia de la privacidad,,Activas siempre > 500g,,PEN,,Desconocido,unknown,PE,Centro de preferencia de la privacidad,Activas siempre,,500g,,PEN,,,55.14,True,country_mean,,15.5336,3.55,from_peru_cambio_dolar,,,,,,,,{},dataset/txt_limpios/1156.txt,dataset/paginas_descargadas/1156.html,EN,sin_categoria,discard,0.30,no_category_detected;price_parse_failed
1157,Centro de preferencia de la privacidad,,Activas siempre > 1.4Kg,,PEN,,Desconocido,unknown,PE,Centro de preferencia de la privacidad,Activas siempre,,1.4Kg,,PEN,,,55.14,True,country_mean,,15.5336,3.55,from_peru_cambio_dolar,,,TE RECOMENDAMOS | REDONDOS | Piernas y Muslos Aderezo Criollo REDONDOS Bolsa 780g | 17 | 89 | Piernas y Muslos Aderezo Estofado REDONDOS Bolsa 780g | 20 | Pollada Criolla REDONDOS Media Pechuga y Pierna con Encuentro Bolsa 800g | 90 | Pollada Criolla REDONDOS Pierna con Encuentro Bolsa 780g | 16 | 50 | EL AVIADOR | Alitas de Pollo Buffalo Maceradas EL AVIADOR Bolsa 16un | No disponible | Sangrecita de Pollo REDONDOS Bolsa 500g | AVINKA | Carne Molida de Pollo AVINKA | Precio x kg | 24 | Pollo Trozado Macerado SAN FERNANDO ¡Asu Olla! Sazón Pollo Pollada Bolsa 800g | 18 | Piernas y Muslos Aderezo Oriental REDONDOS Bolsa 780g | ¡Entérate de eventos exclusivos y promociones especiales que tenemos para ti! | SUSCRIBIRME | Acepto las políticas de tratamientos de datos personales | Razón Social: Compañía Food Retail S.A.C. RUC: 20608300393. Todos los derechos reservados Vivanda 2023. | |Hola! | Encuentra todo lo que necesitas en Vivanda online | Términos más buscados | 1. | quesos | 2. | vino | 3. | café | 4. | quark 500g | 5. | leche | 6. | yogurt | 8. | lunch florencia | 9. | agua | 10 | vinos,,,,,"{""Características"": [""TE RECOMENDAMOS"", ""REDONDOS"", ""Piernas y Muslos Aderezo Criollo REDONDOS Bolsa 780g"", ""17"", ""89"", ""Piernas y Muslos Aderezo Estofado REDONDOS Bolsa 780g"", ""20"", ""Pollada Criolla REDONDOS Media Pechuga y Pierna con Encuentro Bolsa 800g"", ""90"", ""Pollada Criolla REDONDOS Pierna con Encuentro Bolsa 780g"", ""16"", ""50"", ""EL AVIADOR"", ""Alitas de Pollo Buffalo Maceradas EL AVIADOR Bolsa 16un"", ""No disponible"", ""Sangrecita de Pollo REDONDOS Bolsa 500g"", ""AVINKA"", ""Carne Molida de Pollo AVINKA"", ""Precio x kg"", ""24"", ""Pollo Trozado Macerado SAN FERNANDO ¡Asu Olla! Sazón Pollo Pollada Bolsa 800g"", ""18"", ""Piernas y Muslos Aderezo Oriental REDONDOS Bolsa 780g"", ""¡Entérate de eventos exclusivos y promociones especiales que tenemos para ti!"", ""SUSCRIBIRME"", ""Acepto las políticas de tratamiento de datos personales"", ""Razón social: Compañía Food Retail S.A.C. RUC: 20608300393. Todos los derechos reservados Vivanda 2023."", ""¡Hola!"", ""Encuentra todo lo que necesitas en Vivanda online"", ""Términos más buscados"", ""1."", ""quesos"", ""2."", ""vino"", ""3."", ""cafe"", ""4."", ""quark 500g"", ""5."", ""leche"", ""6."", ""7."", ""yogurt"", ""8."", ""lunch florencia"", ""9."", ""agua"", ""10."", ""vinos""]}",dataset/txt_limpios/1157.txt,dataset/paginas_descargadas/1157.html,ET,sin_categoria,discard,0.30,no_category_detected;price_parse_failed
1158,Centro de preferencia de la privacidad,,Activas siempre > 1Kg,,PEN,,Desconocido,unknown,PE,Centro de preferencia de la privacidad,Activas siempre,,1Kg,,PEN,,,55.14,True,country_mean,,15.5336,3.55,from_peru_cambio_dolar,,,TE RECOMENDAMOS | Piernas y Muslos Aderezo Pachamanca REDONDOS Bolsa 780g | 17 | Piernas y Muslos Aderezo Oriental REDONDOS Bolsa 780g | Piernas y Muslos Aderezo Estofado REDONDOS Bolsa 780g | Filete de Pechuga de Pollo Oriental REDONDOS Bandeja 620g | 40 | EL AVIADOR | Alitas Orientales Maceradas EL AVIADOR Bolsa 16un | No disponible | Sangrecita de Pollo REDONDOS Bolsa 500g | SAN FERNANDO | Alitas Maceradas Orientales SAN FERNANDO Paquete 1kg | 26 | 80 | AVINKA | Carne Molida de Pollo AVINKA | Precio x kg | 24 | Pollo Trozado Macerado SAN FERNANDO ¡Asu Olla! Sazón Pollo Al Horno Bolsa 800g | Pollo Trozado Macerado SAN FERNANDO Asu Olla! Sazón Pollo Oriental Bolsa 800g | ¡Entérate de eventos exclusivos y promociones especiales que tenemos para ti! | SUSCRIBIRME | Acepto las políticas de tratamientos de datos personales | Razón Social: Compañía Food Retail S.A.C. RUC: 20608300393. Todos los derechos reservados Vivanda 2023. | |Hola! | Encuentra todo lo que necesitas en Vivanda online | Términos más buscados | 1. | quesos | 2. | vino | 3. | café | 4. | quark 500g | 5. | leche | 6. | yogurt | 8. | lunch florencia | 9. | agua | 10 | vinos,,,,,"{""Características"": [""TE RECOMENDAMOS"", ""Piernas y Muslos Aderezo Pachamanca REDONDOS Bolsa 780g"", ""17"", ""Piernas y Muslos Aderezo Oriental REDONDOS Bolsa 780g"", ""Piernas y Muslos Aderezo Estofado REDONDOS Bolsa 780g"", ""Filete de Pechuga de Pollo Oriental REDONDOS Bandeja 620g"", ""40"", ""EL AVIADOR"", ""Alitas Orientales Maceradas EL AVIADOR Bolsa 16un"", ""No disponible"", ""Sangrecita de Pollo REDONDOS Bolsa 500g"", ""SAN FERNANDO"", ""Alitas Maceradas Orientales SAN FERNANDO Paquete 1kg"", ""26"", ""80"", ""AVINKA"", ""Carne Molida de Pollo AVINKA"", ""Precio x kg"", ""24"", ""Pollo Trozado Macerado SAN FERNANDO ¡Asu Olla! Sazón Pollo Al Horno Bolsa 800g"", ""Pollo Trozado Macerado SAN FERNANDO ¡Asu Olla! Sazón Pollo Oriental Bolsa 800g"", ""¡Entérate de eventos exclusivos y promociones especiales que tenemos para ti!"", ""SUSCRIBIRME"", ""Acepto las políticas de tratamiento de datos personales"", ""Razón social: Compañía Food Retail S.A.C. RUC: 20608300393. Todos los derechos reservados Vivanda 2023."", ""¡Hola!"", ""Encuentra todo lo que necesitas en Vivanda online"", ""Términos más buscados"", ""1."", ""quesos"", ""2."", ""vino"", ""3."", ""cafe"", ""4."", ""quark 500g"", ""5."", ""leche"", ""6."", ""7."", ""yogurt"", ""8."", ""lunch florencia"", ""9."", ""agua"", ""10."", ""vinos""]}",dataset/txt_limpios/1158.txt,dataset/paginas_descargadas/1158.html,ET,sin_categoria,discard,0.30,no_category_detected;price_parse_failed
1159,Centro de preferencia de la privacidad,,Activas siempre > 500g,,PEN,,Desconocido,unknown,PE,Centro de preferencia de la privacidad,Activas siempre,,500g,,PEN,,,55.14,True,country_mean,,15.5336,3.55,from_peru_cambio_dolar,,,,,,,,{},dataset/txt_limpios/1159.txt,dataset/paginas_descargadas/1159.html,EN,sin_categoria,discard,0.30,no_category_detected;price_parse_failed
1160,Centro de preferencia de la privacidad,,Activas siempre > 200g,,PEN,,Desconocido,unknown,PE,Centro de preferencia de la privacidad,Activas siempre,,200g,,PEN,,,55.14,True,country_mean,,15.5336,3.55,from_peru_cambio_dolar,,,TE RECOMENDAMOS | Café Gourmet Americano CAFETAL Bolsa 450g | 39 | JUAN VALDEZ | Café Molido JUAN VALDEZ Volcán Bolsa 250g | 38 | 70 | -9% | ARTIDORO | Café Molido ARTIDORO RODRIGUEZ Cajamarca Bolsa 250g | 43 | 90 | SELLO ROJO | Café Molido SELLO ROJO Tradición Bolsa 425g | 27 | 60 | VILLA RICA | Café Molido VILLA RICA Gourmet Bolsa 250g | 40 | 20 | ZENA | Café Molido ZENA Selecto Doypack 200g | 17 | Café Gourmet Espresso CAFETAL Bolsa 200g | 25 | ALTOMAYO | Café Tostado Molido ALTOMAYO Gourmet Bolsa 200g | 24 | Café Molido CAFETAL Gourmet Americano Chanchamayo Bolsa 200g | Café Molido SELLO ROJO Tradición Bolsa 850g | 52 | ¡Entérate de eventos exclusivos y promociones especiales que tenemos para ti! | SUSCRIBIRME | Acepto las políticas de tratamientos de datos personales | Razón Social: Compañía Food Retail S.A.C. RUC: 20608300393. Todos los derechos reservados Vivanda 2023. | | Hola! | Encuentra todo lo que necesitas en Vivanda online | Términos más buscados | 1. | quesos | 2. | vino | 3. | café | 4. | quark 500g | 5. | leche | 6. | pollo | 7. | yogurt | 8. | lunch florencia | 9. | agua | 10 | vinos,,,,,"{""Características"": [""TE RECOMENDAMOS"", ""Café Gourmet Americano CAFETAL Bolsa 450g"", ""39"", ""JUAN VALDEZ"", ""Café Molido JUAN VALDEZ Volcán Bolsa 250g"", ""38"", ""70"", ""-9%"", ""ARTIDORO"", ""Café Molido ARTIDORO RODRIGUEZ Cajamarca Bolsa 250g"", ""43"", ""90"", ""SELLO ROJO"", ""Café Molido SELLO ROJO Tradición Bolsa 425g"", ""27"", ""60"", ""VILLA RICA"", ""Café Molido VILLA RICA Gourmet Bolsa 250g"", ""40"", ""20"", ""ZENA"", ""Café Molido ZENA Selecto Doypack 200g"", ""17"", ""Café Gourmet Espresso CAFETAL Bolsa 200g"", ""25"", ""ALTOMAYO"", ""Café Tostado Molido ALTOMAYO Gourmet Bolsa 200g"", ""24"", ""Café Molido CAFETAL Gourmet Americano Chanchamayo Bolsa 200g"", ""Café Molido SELLO ROJO Tradición Bolsa 850g"", ""52"", ""¡Entérate de eventos exclusivos y promociones especiales que tenemos para ti!"", ""SUSCRIBIRME"", ""Acepto las políticas de tratamiento de datos personales"", ""Razón social: Compañía Food Retail S.A.C. RUC: 20608300393. Todos los derechos reservados Vivanda 2023."", ""¡Hola!"", ""Encuentra todo lo que necesitas en Vivanda online"", ""Términos más buscados"", ""1."", ""quesos"", ""2."", ""vino"", ""3."", ""cafe"", ""4."", ""quark 500g"", ""5."", ""leche"", ""6."", ""pollo"", ""7."", ""yogurt"", ""8."", ""lunch florencia"", ""9."", ""agua"", ""10."", ""vinos""]}",dataset/txt_limpios/1160.txt,dataset/paginas_descargadas/1160.html,ET,sin_categoria,discard,0.30,no_category_detected;price_parse_failed
