source_id,title,description,breadcrumbs,price_raw,currency_raw,url,seller,availability,country,product_name,brand,reference,unit,price_amount,price_currency,price_symbol,price_text,price_amount_filled,price_is_imputed,price_imputation_source,price_amount_usd,price_amount_usd_filled,fx_rate_local_per_usd,fx_source,information_text,description_text,features_text,specifications_text,benefits_text,details_text,other_sections,sections,txt_path,html_path,es_status,category_canonical,decision,match_score,reasons
805,AZÚCAR BLANCA 1000 GRS,"Ingredientes | Componentes Nombre del producto: Azúcar Blanca 1000 g Descripción del producto: Disfruta de la Azúcar Blanca, ideal para endulzar bebidas, preparar postres y realzar tus recetas favoritas. Tamaño: 20cm x 13cm Peso: 1000 g Modo de fabricación: Industrial Conservación: Mantener en un lugar fresco y seco Origen: Nacional NSA-0019249-2024 Componentes: Azúcar de caña refinada ¡Queremos que tengas la mejor experiencia! Si tienes dudas sobre este producto el contenido, te invitamos a consultar nuestros Términos y condiciones para conocer malas sobre devoluciones y nuestras políticas de reembolsos. Ver más También puede interesarte SAL REFISAL 1000 G ACEITE VEGETAL IMATÁ 3.000 ML LENTEJA EL ESTÍO 500 GRS CABELLO DE ÁNGEL CAPRÍSSIMA 250 GRS CREMA LAVALOZA BRILLA KING 500 GRS ACEITE VEGETAL IMATÁ 900 ML LECHE ENTERA BOLSA UHT LATTI 900 ML CAFÉ TOSTADO Y MOLIDO VIEJO MOLINO 500 G ESPARCIBLE VEGETAL DON OLIO 500 G",Unidades disponibles > 1000 g,1000.0,,,Desconocido,unknown,UNKNOWN,AZÚCAR BLANCA 1000 GRS,Unidades disponibles,,1000 g,1000.00,,,1000,1000.0,False,original,1000.0,1000.0,1.0,default_1usd,,"Ingredientes | Componentes Nombre del producto: Azúcar Blanca 1000 g Descripción del producto: Disfruta de la Azúcar Blanca, ideal para endulzar bebidas, preparar postres y realzar tus recetas favoritas. Tamaño: 20cm x 13cm Peso: 1000 g Modo de fabricación: Industrial Conservación: Mantener en un lugar fresco y seco Origen: Nacional NSA-0019249-2024 Componentes: Azúcar de caña refinada ¡Queremos que tengas la mejor experiencia! Si tienes dudas sobre este producto el contenido, te invitamos a consultar nuestros Términos y condiciones para conocer malas sobre devoluciones y nuestras políticas de reembolsos. Ver más También puede interesarte SAL REFISAL 1000 G ACEITE VEGETAL IMATÁ 3.000 ML LENTEJA EL ESTÍO 500 GRS CABELLO DE ÁNGEL CAPRÍSSIMA 250 GRS CREMA LAVALOZA BRILLA KING 500 GRS ACEITE VEGETAL IMATÁ 900 ML LECHE ENTERA BOLSA UHT LATTI 900 ML CAFÉ TOSTADO Y MOLIDO VIEJO MOLINO 500 G ESPARCIBLE VEGETAL DON OLIO 500 G",,,,,,"{""Descripción"": [""Ingredientes | Componentes"", ""Nombre del producto: Azúcar Blanca 1000 g"", ""Descripción del producto: Disfruta de la Azúcar Blanca, ideal para endulzar bebidas, preparar postres y realzar tus recetas favoritas."", ""Tamaño: 20cm x 13cm"", ""Peso: 1000 g"", ""Modo de fabricación: Industrial"", ""Conservación: Mantener en un lugar fresco y seco"", ""Origen: Nacional"", ""NSA-0019249-2024"", ""Componentes: Azúcar de caña refinada"", ""¡Queremos que tengas la mejor experiencia! Si tienes dudas sobre este producto el contenido, te invitamos a consultar nuestros Términos y condiciones para conocer malas sobre devoluciones y nuestras políticas de reembolsos."", ""Ver más"", ""También puede interesarte"", ""SAL REFISAL 1000 G"", ""ACEITE VEGETAL IMATÁ 3.000 ML"", ""LENTEJA EL ESTÍO 500 GRS"", ""CABELLO DE ÁNGEL CAPRÍSSIMA 250 GRS"", ""CREMA LAVALOZA BRILLA KING 500 GRS"", ""ACEITE VEGETAL IMATÁ 900 ML"", ""LECHE ENTERA BOLSA UHT LATTI 900 ML"", ""CAFÉ TOSTADO Y MOLIDO VIEJO MOLINO 500 G"", ""ESPARCIBLE VEGETAL DON OLIO 500 G""]}",dataset/txt_limpios/805.txt,dataset/paginas_descargadas/805.html,ET,leche,keep,0.60,heuristic_default
808,AZÚCAR BLANCA 1000 GRS,"Ingredientes | Componentes Nombre del producto: Azúcar Blanca 1000 g Descripción del producto: Disfruta de la Azúcar Blanca, ideal para endulzar bebidas, preparar postres y realzar tus recetas favoritas. Tamaño: 20cm x 13cm Peso: 1000 g Modo de fabricación: Industrial Conservación: Mantener en un lugar fresco y seco Origen: Nacional NSA-0019249-2024 Componentes: Azúcar de caña refinada ¡Queremos que tengas la mejor experiencia! Si tienes dudas sobre este producto el contenido, te invitamos a consultar nuestros Términos y condiciones para conocer malas sobre devoluciones y nuestras políticas de reembolsos. Ver más También puede interesarte SAL REFISAL 1000 G ACEITE VEGETAL IMATÁ 3.000 ML LENTEJA EL ESTÍO 500 GRS CABELLO DE ÁNGEL CAPRÍSSIMA 250 GRS CREMA LAVALOZA BRILLA KING 500 GRS ACEITE VEGETAL IMATÁ 900 ML LECHE ENTERA BOLSA UHT LATTI 900 ML CAFÉ TOSTADO Y MOLIDO VIEJO MOLINO 500 G ESPARCIBLE VEGETAL DON OLIO 500 G",Unidades disponibles > 1000 g,1000.0,,,Desconocido,unknown,UNKNOWN,AZÚCAR BLANCA 1000 GRS,Unidades disponibles,,1000 g,1000.00,,,1000,1000.0,False,original,1000.0,1000.0,1.0,default_1usd,,"Ingredientes | Componentes Nombre del producto: Azúcar Blanca 1000 g Descripción del producto: Disfruta de la Azúcar Blanca, ideal para endulzar bebidas, preparar postres y realzar tus recetas favoritas. Tamaño: 20cm x 13cm Peso: 1000 g Modo de fabricación: Industrial Conservación: Mantener en un lugar fresco y seco Origen: Nacional NSA-0019249-2024 Componentes: Azúcar de caña refinada ¡Queremos que tengas la mejor experiencia! Si tienes dudas sobre este producto el contenido, te invitamos a consultar nuestros Términos y condiciones para conocer malas sobre devoluciones y nuestras políticas de reembolsos. Ver más También puede interesarte SAL REFISAL 1000 G ACEITE VEGETAL IMATÁ 3.000 ML LENTEJA EL ESTÍO 500 GRS CABELLO DE ÁNGEL CAPRÍSSIMA 250 GRS CREMA LAVALOZA BRILLA KING 500 GRS ACEITE VEGETAL IMATÁ 900 ML LECHE ENTERA BOLSA UHT LATTI 900 ML CAFÉ TOSTADO Y MOLIDO VIEJO MOLINO 500 G ESPARCIBLE VEGETAL DON OLIO 500 G",,,,,,"{""Descripción"": [""Ingredientes | Componentes"", ""Nombre del producto: Azúcar Blanca 1000 g"", ""Descripción del producto: Disfruta de la Azúcar Blanca, ideal para endulzar bebidas, preparar postres y realzar tus recetas favoritas."", ""Tamaño: 20cm x 13cm"", ""Peso: 1000 g"", ""Modo de fabricación: Industrial"", ""Conservación: Mantener en un lugar fresco y seco"", ""Origen: Nacional"", ""NSA-0019249-2024"", ""Componentes: Azúcar de caña refinada"", ""¡Queremos que tengas la mejor experiencia! Si tienes dudas sobre este producto el contenido, te invitamos a consultar nuestros Términos y condiciones para conocer malas sobre devoluciones y nuestras políticas de reembolsos."", ""Ver más"", ""También puede interesarte"", ""SAL REFISAL 1000 G"", ""ACEITE VEGETAL IMATÁ 3.000 ML"", ""LENTEJA EL ESTÍO 500 GRS"", ""CABELLO DE ÁNGEL CAPRÍSSIMA 250 GRS"", ""CREMA LAVALOZA BRILLA KING 500 GRS"", ""ACEITE VEGETAL IMATÁ 900 ML"", ""LECHE ENTERA BOLSA UHT LATTI 900 ML"", ""CAFÉ TOSTADO Y MOLIDO VIEJO MOLINO 500 G"", ""ESPARCIBLE VEGETAL DON OLIO 500 G""]}",dataset/txt_limpios/808.txt,dataset/paginas_descargadas/808.html,ET,leche,keep,0.60,heuristic_default
315,Azúcar Mascavo Orgánico Native Organic 500 G,,Descripción > 500 G,15.99,BRL,,Desconocido,unknown,BR,Azúcar Mascavo Orgánico Native Organic 500 G,Descripción,,500 G,15.99,BRL,R$,"R$15,99",15.99,False,original,2.935,2.935,5.448,from_brasil_cambio_dolar,,,,,,,,{},dataset/txt_limpios/315.txt,dataset/paginas_descargadas/315.html,ET,azucar,keep,0.60,heuristic_default
806,AZÚCAR MORENA 1000 GRS,"Ingredientes | Componentes Nombre del producto: Azúcar Morena 1000g Descripción del producto: Disfruta de la Azúcar Morena de Mayagüez, un producto refinado y empacado industrialmente, ideal para endulzar tus recetas. Tamaño: 22cm x 13cm Peso: 1000 g Modo de fabricación: Industrial Conservación: Mantener en un lugar fresco y seco. Origen: Nacional NSA-0019958-2025 Componentes: Azúcar de caña morena ¡Queremos que tengas la mejor experiencia! Si tienes dudas sobre este producto el contenido, te invitamos a consultar nuestros Términos y condiciones para conocer malas sobre devoluciones y nuestras políticas de reembolsos. Ver más También puede interesarte SAL REFISAL 1000 G PANELA PASTILLA 1000 G LENTEJA EL ESTÍO 500 GRS ARROZ PREMIUM ALBAR 2500 G Bajó de precio FRÍDOL CARGAMANTO ROJO EL ESTÍO 500 GRS FRÍDOL BOLA ROJA EL ESTÍO 500 GRS CAFÉ TOSTADO Y MOLIDO VIEJO MOLINO 500 G CABELLO DE ÁNGEL CAPRÍSSIMA 250 GRS CHOCOLATE CLAVOS Y CANELA DE LA TAZA 500 G... GARBANZO EL ESTÍO 500 GRS",Unidades disponibles > 1000 g,1000.0,,,Desconocido,unknown,UNKNOWN,AZÚCAR MORENA 1000 GRS,Unidades disponibles,,1000 g,1000.00,,,1000,1000.0,False,original,1000.0,1000.0,1.0,default_1usd,,"Ingredientes | Componentes Nombre del producto: Azúcar Morena 1000g Descripción del producto: Disfruta de la Azúcar Morena de Mayagüez, un producto refinado y empacado industrialmente, ideal para endulzar tus recetas. Tamaño: 22cm x 13cm Peso: 1000 g Modo de fabricación: Industrial Conservación: Mantener en un lugar fresco y seco. Origen: Nacional NSA-0019958-2025 Componentes: Azúcar de caña morena ¡Queremos que tengas la mejor experiencia! Si tienes dudas sobre este producto el contenido, te invitamos a consultar nuestros Términos y condiciones para conocer malas sobre devoluciones y nuestras políticas de reembolsos. Ver más También puede interesarte SAL REFISAL 1000 G PANELA PASTILLA 1000 G LENTEJA EL ESTÍO 500 GRS ARROZ PREMIUM ALBAR 2500 G Bajó de precio FRÍDOL CARGAMANTO ROJO EL ESTÍO 500 GRS FRÍDOL BOLA ROJA EL ESTÍO 500 GRS CAFÉ TOSTADO Y MOLIDO VIEJO MOLINO 500 G CABELLO DE ÁNGEL CAPRÍSSIMA 250 GRS CHOCOLATE CLAVOS Y CANELA DE LA TAZA 500 G... GARBANZO EL ESTÍO 500 GRS",,,,,,"{""Descripción"": [""Ingredientes | Componentes"", ""Nombre del producto: Azúcar Morena 1000g"", ""Descripción del producto: Disfruta de la Azúcar Morena de Mayagüez, un producto refinado y empacado industrialmente, ideal para endulzar tus recetas."", ""Tamaño: 22cm x 13cm"", ""Peso: 1000 g"", ""Modo de fabricación: Industrial"", ""Conservación: Mantener en un lugar fresco y seco."", ""Origen: Nacional"", ""NSA-0019958-2025"", ""Componentes: Azúcar de caña morena"", ""¡Queremos que tengas la mejor experiencia! Si tienes dudas sobre este producto el contenido, te invitamos a consultar nuestros Términos y condiciones para conocer malas sobre devoluciones y nuestras políticas de reembolsos."", ""Ver más"", ""También puede interesarte"", ""SAL REFISAL 1000 G"", ""PANELA PASTILLA 1000 G"", ""LENTEJA EL ESTÍO 500 GRS"", ""ARROZ PREMIUM ALBAR 2500 G"", ""Bajó de precio"", ""FRÍDOL CARGAMANTO ROJO EL ESTÍO 500 GRS"", ""FRÍJOL BOLA ROJA EL ESTÍO 500 GRS"", ""CAFÉ TOSTADO Y MOLIDO VIEJO MOLINO 500 G"", ""CABELLO DE ÁNGEL CAPRÍSSIMA 250 GRS"", ""CHOCOLATE CLAVOS Y CANELA DE LA TAZA 500 G..."", ""GARBANZO EL ESTÍO 500 GRS""]}",dataset/txt_limpios/806.txt,dataset/paginas_descargadas/806.html,ET,cafe,keep,0.60,heuristic_default
1594,Azúcar y Adoçante,,Azúcar > 1kg,4.88,BRL,,Desconocido,unknown,BR,Azúcar y Adoçante,Azúcar,,1kg,4.88,BRL,R$,"R$4,88",4.88,False,original,0.8957,0.8957,5.448,from_brasil_cambio_dolar,,,,,,,,{},dataset/txt_limpios/1594.txt,dataset/paginas_descargadas/1594.html,ET,azucar,keep,0.60,heuristic_default
1596,Azúcar y Adoçante,,Azúcar > 1Kg,10.19,BRL,,Desconocido,unknown,BR,Azúcar y Adoçante,Azúcar,,1Kg,10.19,BRL,R$,"R$10,19",10.19,False,original,1.8704,1.8704,5.448,from_brasil_cambio_dolar,,,,,,,,{},dataset/txt_limpios/1596.txt,dataset/paginas_descargadas/1596.html,ET,azucar,keep,0.60,heuristic_default
1600,Azúcar y Adoçante,,Azúcar > 1kg,4.19,BRL,,Desconocido,unknown,BR,Azúcar y Adoçante,Azúcar,,1kg,4.19,BRL,R$,"R$4,19",4.19,False,original,0.7691,0.7691,5.448,from_brasil_cambio_dolar,,,,,,,,{},dataset/txt_limpios/1600.txt,dataset/paginas_descargadas/1600.html,ET,azucar,keep,0.60,heuristic_default
1602,Azúcar y Adoçante,,Azúcar > 500g,4.99,BRL,,Desconocido,unknown,BR,Azúcar y Adoçante,Azúcar,,500g,4.99,BRL,R$,"R$4,99",4.99,False,original,0.9159,0.9159,5.448,from_brasil_cambio_dolar,,,,,,,,{},dataset/txt_limpios/1602.txt,dataset/paginas_descargadas/1602.html,ET,azucar,keep,0.60,heuristic_default
220,Azúcar y Adoçante,,Azúcar > 1kg,4.89,BRL,,Desconocido,unknown,BR,Azúcar y Adoçante,Azúcar,,1kg,4.89,BRL,R$,"R$4,89",4.89,False,original,0.8976,0.8976,5.448,from_brasil_cambio_dolar,,,,,,,,{},dataset/txt_limpios/220.txt,dataset/paginas_descargadas/220.html,ET,azucar,keep,0.60,heuristic_default
221,Azúcar y Adoçante,,Azúcar > 1Kg,10.19,BRL,,Desconocido,unknown,BR,Azúcar y Adoçante,Azúcar,,1Kg,10.19,BRL,R$,"R$10,19",10.19,False,original,1.8704,1.8704,5.448,from_brasil_cambio_dolar,,,,,,,,{},dataset/txt_limpios/221.txt,dataset/paginas_descargadas/221.html,ET,azucar,keep,0.60,heuristic_default
223,Azúcar y Adoçante,,Azúcar > 1kg,3.99,BRL,,Desconocido,unknown,BR,Azúcar y Adoçante,Azúcar,,1kg,3.99,BRL,R$,"R$3,99",3.99,False,original,0.7324,0.7324,5.448,from_brasil_cambio_dolar,,,,,,,,{},dataset/txt_limpios/223.txt,dataset/paginas_descargadas/223.html,ET,azucar,keep,0.60,heuristic_default
224,Azúcar y Adoçante,,Azúcar > 500g,4.99,BRL,,Desconocido,unknown,BR,Azúcar y Adoçante,Azúcar,,500g,4.99,BRL,R$,"R$4,99",4.99,False,original,0.9159,0.9159,5.448,from_brasil_cambio_dolar,,,,,,,,{},dataset/txt_limpios/224.txt,dataset/paginas_descargadas/224.html,ET,azucar,keep,0.60,heuristic_default
1228,Azúcar y Endulzantes,,Azúcar Rubia > 25 Kg,16.92,PEN,,Desconocido,unknown,PE,Azúcar y Endulzantes,Azúcar Rubia,,25 Kg,16.92,PEN,S/,S/16.92,16.92,False,original,4.7662,4.7662,3.55,from_peru_cambio_dolar,,,,,,,,{},dataset/txt_limpios/1228.txt,dataset/paginas_descargadas/1228.html,EN,azucar,keep,0.60,heuristic_default
22,Azúcar Zulka Glass 500g,"Azúcar finamente pulverizada. La preferida por los expertos debido a su textura, consistencia y sabor. Especial para alta repostería, pastelería, confitería y repostería fina. Todas sus creaciones quedarán con una textura suave, desde un betún, fondant, rellenos de crema. Con un Dulzor perfecto en cualquier postre. Su sabor dulce de la azúcar se disuelva exquisitamente en tu boca. Zulka Glass es un azúcar perfecto para cubrir y dar un toque decorativo a tus postres brindándoles una textura suave y uniforme. Es un endulzante ideal para la pastelería , repostería y confitería por su fina textura el azúcar.",Zulka > 500g > 3546184,,MXN,,Chedraui,unknown,MX,Azúcar Zulka Glass 500g,Zulka,3546184.0,500g,,MXN,,,42.75,True,category_country_mean,,2.296,18.62,from_mexico_cambio_dolar,"Azúcar finamente pulverizada. La preferida por los expertos debido a su textura, consistencia y sabor. Especial para alta repostería, pastelería, confitería y repostería fina. Todas sus creaciones quedarán con una textura suave, desde un betún, fondant, rellenos de crema. Con un Dulzor perfecto en cualquier postre. Su sabor dulce de la azúcar se disuelva exquisitamente en tu boca.",,,"Zulka Glass es un azúcar perfecto para cubrir y dar un toque decorativo a tus postres brindándoles una textura suave y uniforme. Es un endulzante ideal para la pastelería , repostería y confitería por su fina textura el azúcar.",,,,"{""Información"": [""Azúcar finamente pulverizada. La preferida por los expertos debido a su textura, consistencia y sabor. Especial para alta repostería, pastelería, confitería y repostería fina. Todas sus creaciones quedarán con una textura suave, desde un betún, fondant, rellenos de crema. Con un Dulzor perfecto en cualquier postre. Su sabor dulce de la azúcar se disuelva exquisitamente en tu boca.""], ""Especificaciones"": [""Zulka Glass es un azúcar perfecto para cubrir y dar un toque decorativo a tus postres brindándoles una textura suave y uniforme. Es un endulzante ideal para la pastelería , repostería y confitería por su fina textura el azúcar.""]}",dataset/txt_limpios/22.txt,dataset/paginas_descargadas/22.html,ET,azucar,discard,0.60,price_parse_failed;price<=0
799,BANANO UNIDAD,"Nombre del producto: Banano Descripción del producto: Disfruta del banano es una fruta tropical de pulpa suave, dulce y de sabor agradable. Su cáscara fácil de pelar lo convierte en una opción práctica para consumir en cualquier momento del día, ya sea suelo, en batidos, postres, desayunos como ingrediente en múltiples recetas. Presentación : Unidad Modo de fabricación: Industrial Origen: Nacional Ver más También puede interesarte MANGO VARIEDAD UNIDAD TOMATE CHONTO X 1000 G PAPAYA UNIDAD AGUACATE HASS UNIDAD AGUACATE UNIDAD ZANAHORIA X 1000 G PLÁTANO X 1000G CEBOLLA CABEZONA X 1000G LIMON TAHITI X 1000 GR PIMENTÓN UNIDAD",Unidades disponibles > 1000 G,1.0,,,Desconocido,unknown,UNKNOWN,BANANO UNIDAD,Unidades disponibles,,1000 G,1.00,,,1,1.0,False,original,1.0,1.0,1.0,default_1usd,,"Nombre del producto: Banano Descripción del producto: Disfruta del banano es una fruta tropical de pulpa suave, dulce y de sabor agradable. Su cáscara fácil de pelar lo convierte en una opción práctica para consumir en cualquier momento del día, ya sea suelo, en batidos, postres, desayunos como ingrediente en múltiples recetas. Presentación : Unidad Modo de fabricación: Industrial Origen: Nacional Ver más También puede interesarte MANGO VARIEDAD UNIDAD TOMATE CHONTO X 1000 G PAPAYA UNIDAD AGUACATE HASS UNIDAD AGUACATE UNIDAD ZANAHORIA X 1000 G PLÁTANO X 1000G CEBOLLA CABEZONA X 1000G LIMON TAHITI X 1000 GR PIMENTÓN UNIDAD",,,,,,"{""Descripción"": [""Nombre del producto: Banano"", ""Descripción del producto: Disfruta del banano es una fruta tropical de pulpa suave, dulce y de sabor agradable. Su cáscara fácil de pelar lo convierte en una opción práctica para consumir en cualquier momento del día, ya sea suelo, en batidos, postres, desayunos como ingrediente en múltiples recetas."", ""Presentación"", "": Unidad"", ""Modo de fabricación: Industrial"", ""Origen: Nacional"", ""Ver más"", ""También puede interesarte"", ""MANGO VARIEDAD UNIDAD"", ""TOMATE CHONTO X 1000 G"", ""PAPAYA UNIDAD"", ""AGUACATE HASS UNIDAD"", ""AGUACATE UNIDAD"", ""ZANAHORIA X 1000 G"", ""PLÁTANO X 1000G"", ""CEBOLLA CABEZONA X 1000G"", ""LIMON TAHITI X 1000 GR"", ""PIMENTÓN UNIDAD""]}",dataset/txt_limpios/799.txt,dataset/paginas_descargadas/799.html,ET,cebolla,keep,0.60,heuristic_default
898,Bebida desechable,,1.5 Litro > 1.5 Litro,1.39,,,Desconocido,unknown,UNKNOWN,Bebida desechable,1.5 Litro,,1.5 Litro,1.39,,$,$1.39,1.39,False,original,1.39,1.39,1.0,default_1usd,,,,,,,,{},dataset/txt_limpios/898.txt,dataset/paginas_descargadas/898.html,EN,sin_categoria,discard,0.30,no_category_detected
533,Bebidas Sin Alcohol,,Gaseosas > 2.25 L,130.0,,,Desconocido,unknown,UNKNOWN,Bebidas Sin Alcohol,Gaseosas,,2.25 L,130.00,,,130,130.0,False,original,130.0,130.0,1.0,default_1usd,,,MARCA | : COCA COLA | VARIANTE | : SABOR ORIGINAL | SABOR | SABOR | : COLA | EMPAQUE | : BOTELLA | CONTENIDO | : 2.25 L | BOTELLA RETORNABLE | : NO | Últimos consultados | NO ACUMULABLE CON OTRAS PROMOS | OFERTA | Ver planes de cuotas | Queso Cremoso PUNTA DEL AGUA X Kg | Queso Cremoso Fraccionado LA PAULINA Xkg,,,,,"{""Características"": [""MARCA"", "": COCA COLA"", ""VARIANTE"", "": SABOR ORIGINAL"", ""SABOR"", "": COLA"", ""EMPAQUE"", "": BOTELLA"", ""CONTENIDO"", "": 2.25 L"", ""BOTELLA RETORNABLE"", "": NO"", ""Últimos consultados"", ""NO ACUMULABLE CON OTRAS PROMOS"", ""OFERTA"", ""Ver planes de cuotas"", ""Queso Cremoso PUNTA DEL AGUA X Kg"", ""Queso Cremoso Fraccionado LA PAULINA Xkg""]}",dataset/txt_limpios/533.txt,dataset/paginas_descargadas/533.html,ET,sin_categoria,discard,0.30,no_category_detected
534,Bebidas Sin Alcohol,,Gaseosas > 2l,3450.0,,,Desconocido,unknown,UNKNOWN,Bebidas Sin Alcohol,Gaseosas,,2l,3450.00,,$,"$3.450,00",3450.0,False,original,3450.0,3450.0,1.0,default_1usd,,,"MARCA | : PEPSI | Últimos consultados | NO ACUMULABLE CON OTRAS PROMOS | Gaseosa Coca-Cola Sabor Original 2,25 Lt | PRECIO CON 50% 2DA | Ver planes de cuotas | OFERTA | Queso Cremoso PUNTA DEL AGUA X Kg | Queso Cremoso Fraccionado LA PAULINA Xkg",,,,,"{""Características"": [""MARCA"", "": PEPSI"", ""Últimos consultados"", ""NO ACUMULABLE CON OTRAS PROMOS"", ""Gaseosa Coca-Cola Sabor Original 2,25 Lt"", ""PRECIO CON 50% 2DA"", ""Ver planes de cuotas"", ""OFERTA"", ""Queso Cremoso PUNTA DEL AGUA X Kg"", ""Queso Cremoso Fraccionado LA PAULINA Xkg""]}",dataset/txt_limpios/534.txt,dataset/paginas_descargadas/534.html,ET,sin_categoria,discard,0.30,no_category_detected
535,Bebidas Sin Alcohol,,Gaseosas > 2.25 L,1750.0,,,Desconocido,unknown,UNKNOWN,Bebidas Sin Alcohol,Gaseosas,,2.25 L,1750.00,,$,"$1.750,00",1750.0,False,original,1750.0,1750.0,1.0,default_1usd,,,"MARCA | : PASO DE LOS TOROS | SABOR | : POMELO | BOTELLA RETORNABLE | : NO | ENVASE | : BOTELLA | CONTENIDO | : 2.25 L | Últimos consultados | LLEVANDO 2 | 2X1 | Gaseosa Cola Pepsi 2l | PRECIO CON 2X1 | Ver planes de cuotas | NO ACUMULABLE CON OTRAS PROMOS | Gaseosa Coca-Cola Sabor Original 2,25 Lt | PRECIO CON 50% 2DA | OFERTA | Queso Cremoso PUNTA DEL AGUA X Kg",,,,,"{""Características"": [""MARCA"", "": PASO DE LOS TOROS"", ""SABOR"", "": POMELO"", ""BOTELLA RETORNABLE"", "": NO"", ""ENVASE"", "": BOTELLA"", ""CONTENIDO"", "": 2.25 L"", ""Últimos consultados"", ""LLEVANDO 2"", ""2X1"", ""Gaseosa Cola Pepsi 2l"", ""PRECIO CON 2X1"", ""Ver planes de cuotas"", ""NO ACUMULABLE CON OTRAS PROMOS"", ""Gaseosa Coca-Cola Sabor Original 2,25 Lt"", ""PRECIO CON 50% 2DA"", ""OFERTA"", ""Queso Cremoso PUNTA DEL AGUA X Kg""]}",dataset/txt_limpios/535.txt,dataset/paginas_descargadas/535.html,ET,sin_categoria,discard,0.30,no_category_detected
