source_id,title,description,breadcrumbs,price_raw,currency_raw,url,seller,availability,country,product_name,brand,reference,unit,price_amount,price_currency,price_symbol,price_text,price_amount_filled,price_is_imputed,price_imputation_source,price_amount_usd,price_amount_usd_filled,fx_rate_local_per_usd,fx_source,information_text,description_text,features_text,specifications_text,benefits_text,details_text,other_sections,sections,txt_path,html_path,es_status,category_canonical,decision,match_score,reasons
1196,Centro de preferencia de la privacidad,,Activas siempre > 150gr,,PEN,,Desconocido,unknown,PE,Centro de preferencia de la privacidad,Activas siempre,,150gr,,PEN,,,55.14,True,country_mean,,15.5336,3.55,from_peru_cambio_dolar,,,TE RECOMENDAMOS | -2% | GLORIA | Filete de Atún en Agua y Sal GLORIA Lata 140g | 5 | 80 | 2% | CAMPOMAR | Duo Pack Trozos de Atún CAMPOMAR Lata 150g x 2un | 11 | 60 | -15% | PRIMOR | Trozos de Atún PRIMOR en Aceite Vegetal Lata 140g | 6 | 50 | 15% | FLORIDA | Filete de Atún en Aceite Vegetal FLORIDA Lata 80g Paquete 3un | No disponible | REAL | Sólido de Atún REAL en Aceite Girasol Lata 140g | Sólido de Atún REAL en Aceite de Oliva Lata 140g | Lomos de Atún en Aceite Vegetal CAMPOMAR Lata 150g | 30 | Filete de Atún CAMPOMAR en Aceite Vegetal Lata 150g | Filete de Atún Claro en Aceite Vegetal CAMPOMAR Lata 150g | Trozos de Caballa en Aceite BELL'S Lata 170g | 40 | Entérate de eventos exclusivos y promociones especiales que tenemos para ti! | SUSCRIBIRME | Acepto las políticas de tratamientos de datos personales | Razón Social: Compañía Food Retail S.A.C. RUC: 20608300393. Todos los derechos reservados Vivanda 2023. | | Hola! | Encuentra todo lo que necesitas en Vivanda online | Términos más buscados | 1. | quesos | 2. | vino | 3. | café | 4. | quark 500g | 5. | leche | 6. | pollo | 7. | yogurt | 8. | lunch florencia | 9. | agua | 10 | vinos,,,,,"{""Características"": [""TE RECOMENDAMOS"", ""-2%"", ""GLORIA"", ""Filete de Atún en Agua y Sal GLORIA Lata 140g"", ""5"", ""80"", ""2%"", ""CAMPOMAR"", ""Duo Pack Trozos de Atún CAMPOMAR Lata 150g x 2un"", ""11"", ""60"", ""-15%"", ""PRIMOR"", ""Trozos de Atún PRIMOR en Aceite Vegetal Lata 140g"", ""6"", ""50"", ""15%"", ""FLORIDA"", ""Filete de Atún en Aceite Vegetal FLORIDA Lata 80g Paquete 3un"", ""No disponible"", ""REAL"", ""Sólido de Atún REAL en Aceite Girasol Lata 140g"", ""Sólido de Atún REAL en Aceite de Oliva Lata 140g"", ""Lomos de Atún en Ace Vegetales CAMPOMAR Lata 150g"", ""30"", ""Filete de Atún CAMPOMAR en Aceite Vegetal Lata 150g"", ""Filete de Atún Claro en Ace Vegetales CAMPOMAR Lata 150g"", ""Trozos de Caballa en Aceite BELL'S Lata 170g"", ""40"", ""¡Entérate de eventos exclusivos y promociones especiales que tenemos para ti!"", ""SUSCRIBIRME"", ""Acepto las políticas de tratamiento de datos personales"", ""Razón social: Compañía Food Retail S.A.C. RUC: 20608300393. Todos los derechos reservados Vivanda 2023."", ""¡Hola!"", ""Encuentra todo lo que necesitas en Vivanda online"", ""Términos más buscados"", ""1."", ""quesos"", ""2."", ""vino"", ""3."", ""cafe"", ""4."", ""quark 500g"", ""5."", ""leche"", ""6."", ""pollo"", ""7."", ""yogurt"", ""8."", ""lunch florencia"", ""9."", ""agua"", ""10."", ""vinos""]}",dataset/txt_limpios/1196.txt,dataset/paginas_descargadas/1196.html,ET,sin_categoria,discard,0.30,no_category_detected;price_parse_failed
1197,Centro de preferencia de la privacidad,,Activas siempre > 140g,,PEN,,Desconocido,unknown,PE,Centro de preferencia de la privacidad,Activas siempre,,140g,,PEN,,,55.14,True,country_mean,,15.5336,3.55,from_peru_cambio_dolar,,,,,,,,{},dataset/txt_limpios/1197.txt,dataset/paginas_descargadas/1197.html,EN,sin_categoria,discard,0.30,no_category_detected;price_parse_failed
1198,Centro de preferencia de la privacidad,,Activas siempre > 140g,,PEN,,Desconocido,unknown,PE,Centro de preferencia de la privacidad,Activas siempre,,140g,,PEN,,,55.14,True,country_mean,,15.5336,3.55,from_peru_cambio_dolar,,,TE RECOMENDAMOS | -15% | FLORIDA | Filete de Atún FLORIDA en Aceite Girasol Lata 140g | 6 | 80 | 5 | 15% | CAMPOMAR | Duo Pack Trozos de Atún CAMPOMAR Lata 150g x 2un | 11 | 60 | Trozos de Atún en Aceite Vegetal CAMPOMAR Lata 150g | 20 | Filete de Atún CAMPOMAR en Aceite Lata 150g Paquete 2un | 12 | Sólido de Atún REAL en Aceite de Oliva Lata 140g | EL CORTE INGLÉS | Lomos de Atún en Aceite de Girasol EL CORTE INGLÉS Pack 3 Lata 56g | 30 | BELL'S | Filete de Atún BELL'S en Agua Lata 150gr | 4 | 90 | LA GITANA | Conserva de Sardina LA GITANA Caja 125g | 10 | -2% | GLORIA | Filete de Atún en Agua y Sal GLORIA Lata 140g | 2% | - Entérate de eventos exclusivos y promociones especiales que tenemos para ti! | SUSCRIBIRME | Acepto las políticas de tratamientos de datos personales | Razón Social: Compañía Food Retail S.A.C. RUC: 20608300393. Todos los derechos reservados Vivanda 2023. | | Hola! | Encuentra todo lo que necesitas en Vivanda online | Términos más buscados | 1. | quesos | 2. | vino | 3. | café | 4. | quark 500g | 5. | leche | 6. | pollo | 7. | yogurt | 8. | lunch florencia | 9. | agua | 10 | vinos,,,,,"{""Características"": [""TE RECOMENDAMOS"", ""-15%"", ""FLORIDA"", ""Filete de Atún FLORIDA en Aceite Girasol Lata 140g"", ""6"", ""80"", ""5"", ""15%"", ""CAMPOMAR"", ""Duo Pack Trozos de Atún CAMPOMAR Lata 150g x 2un"", ""11"", ""60"", ""Trozos de Atún en Aceite Vegetal CAMPOMAR Lata 150g"", ""20"", ""Filete de Atún CAMPOMAR en Aceite Lata 150g Paquete 2un"", ""12"", ""Sólido de Atún REAL en Aceite de Oliva Lata 140g"", ""EL CORTE INGLÉS"", ""Lomos de Atún en Aceite de Girasol EL CORTE INGLÉS Pack 3 Lata 56g"", ""30"", ""BELL'S"", ""Filete de Atún BELL'S en Agua Lata 150gr"", ""4"", ""90"", ""LA GITANA"", ""Conserva de Sardina LA GITANA Caja 125g"", ""10"", ""-2%"", ""GLORIA"", ""Filete de Atún en Agua y Sal GLORIA Lata 140g"", ""2%"", ""¡Entérate de eventos exclusivos y promociones especiales que tenemos para ti!"", ""SUSCRIBIRME"", ""Acepto las políticas de tratamiento de datos personales"", ""Razón social: Compañía Food Retail S.A.C. RUC: 20608300393. Todos los derechos reservados Vivanda 2023."", ""¡Hola!"", ""Encuentra todo lo que necesitas en Vivanda online"", ""Términos más buscados"", ""1."", ""quesos"", ""2."", ""vino"", ""3."", ""cafe"", ""4."", ""quark 500g"", ""5."", ""leche"", ""6."", ""pollo"", ""7."", ""yogurt"", ""8."", ""lunch florencia"", ""9."", ""agua"", ""10."", ""vinos""]}",dataset/txt_limpios/1198.txt,dataset/paginas_descargadas/1198.html,ET,sin_categoria,discard,0.30,no_category_detected;price_parse_failed
304,Cerveja Praya Witbier 600ml,,Descripción > 600ml,,,,Desconocido,unknown,UNKNOWN,Cerveja Praya Witbier 600ml,Descripción,,600ml,,,,,127.27,True,category_country_mean,,127.2675,1.0,default_1usd,,,,,,,,{},dataset/txt_limpios/304.txt,dataset/paginas_descargadas/304.html,ET,cerveza,discard,0.60,price_parse_failed;price<=0
1567,Cervejas Tradicionais,,Cerveja Heineken Garrafa 600ml > 600ml,13.19,BRL,,Desconocido,unknown,BR,Cervejas Tradicionais,Cerveja Heineken Garrafa 600ml,,600ml,13.19,BRL,R$,"R$13,19",13.19,False,original,2.4211,2.4211,5.448,from_brasil_cambio_dolar,,,,,,,,{},dataset/txt_limpios/1567.txt,dataset/paginas_descargadas/1567.html,EN,cerveza,keep,0.60,heuristic_default
1570,Cervejas Tradicionais,,"R$ 6,39 > 330ml",6.39,BRL,,Desconocido,unknown,BR,Cervejas Tradicionais,"R$ 6,39",,330ml,6.39,BRL,R$,"R$6,39",6.39,False,original,1.1729,1.1729,5.448,from_brasil_cambio_dolar,,,,,,,,{},dataset/txt_limpios/1570.txt,dataset/paginas_descargadas/1570.html,EN,sin_categoria,discard,0.30,no_category_detected
1574,Cervejas Tradicionais,,de > 350ml,3.99,BRL,,Desconocido,unknown,BR,Cervejas Tradicionais,de,,350ml,3.99,BRL,R$,"R$3,99",3.99,False,original,0.7324,0.7324,5.448,from_brasil_cambio_dolar,,,,,,,,{},dataset/txt_limpios/1574.txt,dataset/paginas_descargadas/1574.html,EN,sin_categoria,discard,0.30,no_category_detected
1578,Cervejas Tradicionais,,"R$ 5,59 > 330ml",5.59,BRL,,Desconocido,unknown,BR,Cervejas Tradicionais,"R$ 5,59",,330ml,5.59,BRL,R$,"R$5,59",5.59,False,original,1.0261,1.0261,5.448,from_brasil_cambio_dolar,,,,,,,,{},dataset/txt_limpios/1578.txt,dataset/paginas_descargadas/1578.html,EN,sin_categoria,discard,0.30,no_category_detected
1581,Cervejas Tradicionais,,"R$ 5,19 > 330ml",5.19,BRL,,Desconocido,unknown,BR,Cervejas Tradicionais,"R$ 5,19",,330ml,5.19,BRL,R$,"R$5,19",5.19,False,original,0.9526,0.9526,5.448,from_brasil_cambio_dolar,,,,,,,,{},dataset/txt_limpios/1581.txt,dataset/paginas_descargadas/1581.html,EN,sin_categoria,discard,0.30,no_category_detected
210,Cervejas Tradicionais,,Cerveja Heineken Garrafa 600ml > 600ml,13.49,BRL,,Desconocido,unknown,BR,Cervejas Tradicionais,Cerveja Heineken Garrafa 600ml,,600ml,13.49,BRL,R$,"R$13,49",13.49,False,original,2.4761,2.4761,5.448,from_brasil_cambio_dolar,,,,,,,,{},dataset/txt_limpios/210.txt,dataset/paginas_descargadas/210.html,EN,cerveza,keep,0.60,heuristic_default
211,Cervejas Tradicionais,,"R$ 6,49 > 330ml",6.49,BRL,,Desconocido,unknown,BR,Cervejas Tradicionais,"R$ 6,49",,330ml,6.49,BRL,R$,"R$6,49",6.49,False,original,1.1913,1.1913,5.448,from_brasil_cambio_dolar,,,,,,,,{},dataset/txt_limpios/211.txt,dataset/paginas_descargadas/211.html,EN,sin_categoria,discard,0.30,no_category_detected
212,Cervejas Tradicionais,,"R$ 3,99 > 350ml",3.99,BRL,,Desconocido,unknown,BR,Cervejas Tradicionais,"R$ 3,99",,350ml,3.99,BRL,R$,"R$3,99",3.99,False,original,0.7324,0.7324,5.448,from_brasil_cambio_dolar,,,,,,,,{},dataset/txt_limpios/212.txt,dataset/paginas_descargadas/212.html,EN,sin_categoria,discard,0.30,no_category_detected
213,Cervejas Tradicionais,,"R$ 5,79 > 330ml",5.79,BRL,,Desconocido,unknown,BR,Cervejas Tradicionais,"R$ 5,79",,330ml,5.79,BRL,R$,"R$5,79",5.79,False,original,1.0628,1.0628,5.448,from_brasil_cambio_dolar,,,,,,,,{},dataset/txt_limpios/213.txt,dataset/paginas_descargadas/213.html,EN,sin_categoria,discard,0.30,no_category_detected
214,Cervejas Tradicionais,,"R$ 5,69 > 330ml",5.69,BRL,,Desconocido,unknown,BR,Cervejas Tradicionais,"R$ 5,69",,330ml,5.69,BRL,R$,"R$5,69",5.69,False,original,1.0444,1.0444,5.448,from_brasil_cambio_dolar,,,,,,,,{},dataset/txt_limpios/214.txt,dataset/paginas_descargadas/214.html,EN,sin_categoria,discard,0.30,no_category_detected
1349,CERVEZA AMSTEL LATA 355 ML,¿Deseas recibir notificaciones? Remind me later Permitir Thank you! Please check your email inbox to confirm. Oops! Notifications are disabled.,Comparar > 355 ML,1.2,USD,,Desconocido,unknown,US,CERVEZA AMSTEL LATA 355 ML,Comparar,,355 ML,1.20,USD,$,"$1,20",1.2,False,original,1.2,1.2,1.0,default_1usd,¿Deseas recibir notificaciones? Remind me later Permitir Thank you! Please check your email inbox to confirm. Oops! Notifications are disabled.,,,,,,,"{""Información"": [""¿Deseas recibir notificaciones?"", ""Remind me later"", ""Permitir"", ""Thank you! Please check your email inbox to confirm."", ""Oops! Notifications are disabled.""]}",dataset/txt_limpios/1349.txt,dataset/paginas_descargadas/1349.html,EN,cerveza,keep,0.60,heuristic_default
1345,CERVEZA BIELA RESERVA LATA 355 ML,¿Deseas recibir notificaciones? Remind me later Permitir Thank you! Please check your email inbox to confirm. Oops! Notifications are disabled.,Comparar > 355 ML,1.0,USD,,Desconocido,unknown,US,CERVEZA BIELA RESERVA LATA 355 ML,Comparar,,355 ML,1.00,USD,$,"$1,00",1.0,False,original,1.0,1.0,1.0,default_1usd,¿Deseas recibir notificaciones? Remind me later Permitir Thank you! Please check your email inbox to confirm. Oops! Notifications are disabled.,,,,,,,"{""Información"": [""¿Deseas recibir notificaciones?"", ""Remind me later"", ""Permitir"", ""Thank you! Please check your email inbox to confirm."", ""Oops! Notifications are disabled.""]}",dataset/txt_limpios/1345.txt,dataset/paginas_descargadas/1345.html,EN,cerveza,keep,0.60,heuristic_default
1347,CERVEZA CLUB PLATINO 330 ML,"Ficha técnica Cerveza tipo Lager, 100% malta, sabor extra fino. Decrease the quantity Increase the quantity ¿Deseas recibir notificaciones? Remind me later Permitir Thank you! Please check your email inbox to confirm. ¡Oops! Notifications are disabled.",CLUB > 330 ML,1.45,USD,,Desconocido,unknown,US,CERVEZA CLUB PLATINO 330 ML,CLUB,,330 ML,1.45,USD,$,"$1,45",1.45,False,original,1.45,1.45,1.0,default_1usd,"Ficha técnica Cerveza tipo Lager, 100% malta, sabor extra fino. Decrease the quantity Increase the quantity ¿Deseas recibir notificaciones? Remind me later Permitir Thank you! Please check your email inbox to confirm. ¡Oops! Notifications are disabled.",,,,,,,"{""Información"": [""Ficha técnica"", ""Cerveza tipo Lager, 100% malta, sabor extra fino."", ""Decrease the quantity"", ""Increase the quantity"", ""¿Deseas recibir notificaciones?"", ""Remind me later"", ""Permitir"", ""Thank you! Please check your email inbox to confirm."", ""Oops! Notifications are disabled.""]}",dataset/txt_limpios/1347.txt,dataset/paginas_descargadas/1347.html,ET,cerveza,keep,0.60,heuristic_default
1346,CERVEZA CORONITA EXTRA 210 ML,¿Deseas recibir notificaciones? Remind me later Permitir Thank you! Please check your email inbox to confirm. Oops! Notifications are disabled.,Comparar > 210 ML,1.18,USD,,Desconocido,unknown,US,CERVEZA CORONITA EXTRA 210 ML,Comparar,,210 ML,1.18,USD,$,"$1,18",1.18,False,original,1.18,1.18,1.0,default_1usd,¿Deseas recibir notificaciones? Remind me later Permitir Thank you! Please check your email inbox to confirm. Oops! Notifications are disabled.,,,,,,,"{""Información"": [""¿Deseas recibir notificaciones?"", ""Remind me later"", ""Permitir"", ""Thank you! Please check your email inbox to confirm."", ""Oops! Notifications are disabled.""]}",dataset/txt_limpios/1346.txt,dataset/paginas_descargadas/1346.html,EN,cerveza,keep,0.60,heuristic_default
917,Cerveza extra botella,,330 ml > 330 ml,1.05,,,Desconocido,unknown,UNKNOWN,Cerveza extra botella,330 ml,,330 ml,1.05,,$,$1.05,1.05,False,original,1.05,1.05,1.0,default_1usd,,,,,,,,{},dataset/txt_limpios/917.txt,dataset/paginas_descargadas/917.html,EN,cerveza,keep,0.60,heuristic_default
1348,CERVEZA PILSENER LATA 355 ML,¿Deseas recibir notificaciones? Remind me later Permitir Thank you! Please check your email inbox to confirm. Oops! Notifications are disabled.,Comparar > 355 ML,0.99,USD,,Desconocido,unknown,US,CERVEZA PILSENER LATA 355 ML,Comparar,,355 ML,0.99,USD,$,"$0,99",0.99,False,original,0.99,0.99,1.0,default_1usd,¿Deseas recibir notificaciones? Remind me later Permitir Thank you! Please check your email inbox to confirm. Oops! Notifications are disabled.,,,,,,,"{""Información"": [""¿Deseas recibir notificaciones?"", ""Remind me later"", ""Permitir"", ""Thank you! Please check your email inbox to confirm."", ""Oops! Notifications are disabled.""]}",dataset/txt_limpios/1348.txt,dataset/paginas_descargadas/1348.html,EN,cerveza,keep,0.60,heuristic_default
918,"Cervezas, vinos y licores",,Cervezas > 473 ml,1.18,,,Desconocido,unknown,UNKNOWN,"Cervezas, vinos y licores",Cervezas,,473 ml,1.18,,$,$1.18,1.18,False,original,1.18,1.18,1.0,default_1usd,,,,,,,,{},dataset/txt_limpios/918.txt,dataset/paginas_descargadas/918.html,EN,sin_categoria,discard,0.30,no_category_detected
920,"Cervezas, vinos y licores","Cerveza Stella Artois, botella 330 cc",Cervezas > 330 ml,990.0,,,Desconocido,unknown,UNKNOWN,"Cervezas, vinos y licores",Cervezas,,330 ml,990.00,,$,$990,990.0,False,original,990.0,990.0,1.0,default_1usd,,"Cerveza Stella Artois, botella 330 cc",,,,,,"{""Descripción"": [""Cerveza Stella Artois, botella 330 cc""]}",dataset/txt_limpios/920.txt,dataset/paginas_descargadas/920.html,EN,cerveza,keep,0.60,heuristic_default
1359,COLA COCA COLA 2 L ORIGINAL,Ficha técnica Pega coca cola 2 lt ¿Deseas recibir notificaciones? Remind me later Permitir Thank you! Please check your email inbox to confirm. ¡Oops! Notifications are disabled.,Comparar > 2 L,1.86,USD,,Desconocido,unknown,US,COLA COCA COLA 2 L ORIGINAL,Comparar,,2 L,1.86,USD,$,"$1,86",1.86,False,original,1.86,1.86,1.0,default_1usd,Ficha técnica Pega coca cola 2 lt ¿Deseas recibir notificaciones? Remind me later Permitir Thank you! Please check your email inbox to confirm. ¡Oops! Notifications are disabled.,,,,,,,"{""Información"": [""Ficha técnica"", ""Cola coca cola 2 lt"", ""¿Deseas recibir notificaciones?"", ""Remind me later"", ""Permitir"", ""Thank you! Please check your email inbox to confirm."", ""Oops! Notifications are disabled.""]}",dataset/txt_limpios/1359.txt,dataset/paginas_descargadas/1359.html,ET,sin_categoria,discard,0.30,no_category_detected
1356,COLA FANTA 500 ML NARANJA,¿Deseas recibir notificaciones? Remind me later Permitir Thank you! Please check your email inbox to confirm. Oops! Notifications are disabled.,Comparar > 500 ML,0.49,USD,,Desconocido,unknown,US,COLA FANTA 500 ML NARANJA,Comparar,,500 ML,0.49,USD,$,"$0,49",0.49,False,original,0.49,0.49,1.0,default_1usd,¿Deseas recibir notificaciones? Remind me later Permitir Thank you! Please check your email inbox to confirm. Oops! Notifications are disabled.,,,,,,,"{""Información"": [""¿Deseas recibir notificaciones?"", ""Remind me later"", ""Permitir"", ""Thank you! Please check your email inbox to confirm."", ""Oops! Notifications are disabled.""]}",dataset/txt_limpios/1356.txt,dataset/paginas_descargadas/1356.html,EN,sin_categoria,discard,0.30,no_category_detected
1358,COLA INCA KOLA 2 L,¿Deseas recibir notificaciones? Remind me later Permitir Thank you! Please check your email inbox to confirm. Oops! Notifications are disabled.,Comparar > 2 L,1.18,USD,,Desconocido,unknown,US,COLA INCA KOLA 2 L,Comparar,,2 L,1.18,USD,$,"$1,18",1.18,False,original,1.18,1.18,1.0,default_1usd,¿Deseas recibir notificaciones? Remind me later Permitir Thank you! Please check your email inbox to confirm. Oops! Notifications are disabled.,,,,,,,"{""Información"": [""¿Deseas recibir notificaciones?"", ""Remind me later"", ""Permitir"", ""Thank you! Please check your email inbox to confirm."", ""Oops! Notifications are disabled.""]}",dataset/txt_limpios/1358.txt,dataset/paginas_descargadas/1358.html,EN,sin_categoria,discard,0.30,no_category_detected
1355,COLA ORANGINE 3000 ML MANZANA,Ficha técnica ¿Deseas recibir notificaciones? Remind me later Permitir Thank you! Please check your email inbox to confirm. ¡Oops! Notifications are disabled.,Comparar > 3000 ML,1.55,USD,,Desconocido,unknown,US,COLA ORANGINE 3000 ML MANZANA,Comparar,,3000 ML,1.55,USD,$,"$1,55",1.55,False,original,1.55,1.55,1.0,default_1usd,Ficha técnica ¿Deseas recibir notificaciones? Remind me later Permitir Thank you! Please check your email inbox to confirm. ¡Oops! Notifications are disabled.,,,,,,,"{""Información"": [""Ficha técnica"", ""¿Deseas recibir notificaciones?"", ""Remind me later"", ""Permitir"", ""Thank you! Please check your email inbox to confirm."", ""Oops! Notifications are disabled.""]}",dataset/txt_limpios/1355.txt,dataset/paginas_descargadas/1355.html,ET,sin_categoria,discard,0.30,no_category_detected
1357,COLA SPRITE 1.35 L,Ficha técnica ¿Deseas recibir notificaciones? Remind me later Permitir Thank you! Please check your email inbox to confirm. ¡Oops! Notifications are disabled.,Comparar > 1.35 L,1.09,USD,,Desconocido,unknown,US,COLA SPRITE 1.35 L,Comparar,,1.35 L,1.09,USD,$,"$1,09",1.09,False,original,1.09,1.09,1.0,default_1usd,Ficha técnica ¿Deseas recibir notificaciones? Remind me later Permitir Thank you! Please check your email inbox to confirm. ¡Oops! Notifications are disabled.,,,,,,,"{""Información"": [""Ficha técnica"", ""¿Deseas recibir notificaciones?"", ""Remind me later"", ""Permitir"", ""Thank you! Please check your email inbox to confirm."", ""Oops! Notifications are disabled.""]}",dataset/txt_limpios/1357.txt,dataset/paginas_descargadas/1357.html,ET,sin_categoria,discard,0.30,no_category_detected
