source_id,title,description,breadcrumbs,price_raw,currency_raw,url,seller,availability,country,product_name,brand,reference,unit,price_amount,price_currency,price_symbol,price_text,price_amount_filled,price_is_imputed,price_imputation_source,price_amount_usd,price_amount_usd_filled,fx_rate_local_per_usd,fx_source,information_text,description_text,features_text,specifications_text,benefits_text,details_text,other_sections,sections,txt_path,html_path,es_status,category_canonical,decision,match_score,reasons
1550,1550,,,,,,Desconocido,unknown,UNKNOWN,,,,,,,,,234.19,True,country_mean,,234.1938,1.0,default_1usd,,,,,,,,{},dataset/txt_limpios/1550.txt,dataset/paginas_descargadas/1550.html,EN,sin_categoria,discard,0.30,no_category_detected;price_parse_failed
1553,1553,,,,,,Desconocido,unknown,UNKNOWN,,,,,,,,,234.19,True,country_mean,,234.1938,1.0,default_1usd,,,,,,,,{},dataset/txt_limpios/1553.txt,dataset/paginas_descargadas/1553.html,EN,sin_categoria,discard,0.30,no_category_detected;price_parse_failed
1560,1560,,,,,,Desconocido,unknown,UNKNOWN,,,,,,,,,234.19,True,country_mean,,234.1938,1.0,default_1usd,,,,,,,,{},dataset/txt_limpios/1560.txt,dataset/paginas_descargadas/1560.html,EN,sin_categoria,discard,0.30,no_category_detected;price_parse_failed
1563,1563,,,,,,Desconocido,unknown,UNKNOWN,,,,,,,,,234.19,True,country_mean,,234.1938,1.0,default_1usd,,,,,,,,{},dataset/txt_limpios/1563.txt,dataset/paginas_descargadas/1563.html,EN,sin_categoria,discard,0.30,no_category_detected;price_parse_failed
1617,1617,,,,,,Desconocido,unknown,UNKNOWN,,,,,,,,,234.19,True,country_mean,,234.1938,1.0,default_1usd,,,,,,,,{},dataset/txt_limpios/1617.txt,dataset/paginas_descargadas/1617.html,EN,sin_categoria,discard,0.30,no_category_detected;price_parse_failed
1628,1628,,,,,,Desconocido,unknown,UNKNOWN,,,,,,,,,234.19,True,country_mean,,234.1938,1.0,default_1usd,,,,,,,,{},dataset/txt_limpios/1628.txt,dataset/paginas_descargadas/1628.html,EN,sin_categoria,discard,0.30,no_category_detected;price_parse_failed
1631,1631,,,,,,Desconocido,unknown,UNKNOWN,,,,,,,,,234.19,True,country_mean,,234.1938,1.0,default_1usd,,,,,,,,{},dataset/txt_limpios/1631.txt,dataset/paginas_descargadas/1631.html,EN,sin_categoria,discard,0.30,no_category_detected;price_parse_failed
1632,1632,,,,,,Desconocido,unknown,UNKNOWN,,,,,,,,,234.19,True,country_mean,,234.1938,1.0,default_1usd,,,,,,,,{},dataset/txt_limpios/1632.txt,dataset/paginas_descargadas/1632.html,EN,sin_categoria,discard,0.30,no_category_detected;price_parse_failed
1638,1638,,,,,,Desconocido,unknown,UNKNOWN,,,,,,,,,234.19,True,country_mean,,234.1938,1.0,default_1usd,,,,,,,,{},dataset/txt_limpios/1638.txt,dataset/paginas_descargadas/1638.html,EN,sin_categoria,discard,0.30,no_category_detected;price_parse_failed
1640,1640,,,,,,Desconocido,unknown,UNKNOWN,,,,,,,,,234.19,True,country_mean,,234.1938,1.0,default_1usd,,,,,,,,{},dataset/txt_limpios/1640.txt,dataset/paginas_descargadas/1640.html,EN,sin_categoria,discard,0.30,no_category_detected;price_parse_failed
1642,1642,,,,,,Desconocido,unknown,UNKNOWN,,,,,,,,,234.19,True,country_mean,,234.1938,1.0,default_1usd,,,,,,,,{},dataset/txt_limpios/1642.txt,dataset/paginas_descargadas/1642.html,EN,sin_categoria,discard,0.30,no_category_detected;price_parse_failed
1645,1645,,,,,,Desconocido,unknown,UNKNOWN,,,,,,,,,234.19,True,country_mean,,234.1938,1.0,default_1usd,,,,,,,,{},dataset/txt_limpios/1645.txt,dataset/paginas_descargadas/1645.html,EN,sin_categoria,discard,0.30,no_category_detected;price_parse_failed
1647,1647,,,,,,Desconocido,unknown,UNKNOWN,,,,,,,,,234.19,True,country_mean,,234.1938,1.0,default_1usd,,,,,,,,{},dataset/txt_limpios/1647.txt,dataset/paginas_descargadas/1647.html,EN,sin_categoria,discard,0.30,no_category_detected;price_parse_failed
1649,1649,,,,,,Desconocido,unknown,UNKNOWN,,,,,,,,,234.19,True,country_mean,,234.1938,1.0,default_1usd,,,,,,,,{},dataset/txt_limpios/1649.txt,dataset/paginas_descargadas/1649.html,EN,sin_categoria,discard,0.30,no_category_detected;price_parse_failed
1651,1651,,,,,,Desconocido,unknown,UNKNOWN,,,,,,,,,234.19,True,country_mean,,234.1938,1.0,default_1usd,,,,,,,,{},dataset/txt_limpios/1651.txt,dataset/paginas_descargadas/1651.html,EN,sin_categoria,discard,0.30,no_category_detected;price_parse_failed
1652,1652,,,,,,Desconocido,unknown,UNKNOWN,,,,,,,,,234.19,True,country_mean,,234.1938,1.0,default_1usd,,,,,,,,{},dataset/txt_limpios/1652.txt,dataset/paginas_descargadas/1652.html,EN,sin_categoria,discard,0.30,no_category_detected;price_parse_failed
1653,1653,,,,,,Desconocido,unknown,UNKNOWN,,,,,,,,,234.19,True,country_mean,,234.1938,1.0,default_1usd,,,,,,,,{},dataset/txt_limpios/1653.txt,dataset/paginas_descargadas/1653.html,EN,sin_categoria,discard,0.30,no_category_detected;price_parse_failed
1654,1654,,,,,,Desconocido,unknown,UNKNOWN,,,,,,,,,234.19,True,country_mean,,234.1938,1.0,default_1usd,,,,,,,,{},dataset/txt_limpios/1654.txt,dataset/paginas_descargadas/1654.html,EN,sin_categoria,discard,0.30,no_category_detected;price_parse_failed
1655,1655,,,,,,Desconocido,unknown,UNKNOWN,,,,,,,,,234.19,True,country_mean,,234.1938,1.0,default_1usd,,,,,,,,{},dataset/txt_limpios/1655.txt,dataset/paginas_descargadas/1655.html,EN,sin_categoria,discard,0.30,no_category_detected;price_parse_failed
1656,1656,,,,,,Desconocido,unknown,UNKNOWN,,,,,,,,,234.19,True,country_mean,,234.1938,1.0,default_1usd,,,,,,,,{},dataset/txt_limpios/1656.txt,dataset/paginas_descargadas/1656.html,EN,sin_categoria,discard,0.30,no_category_detected;price_parse_failed
1657,1657,,,,,,Desconocido,unknown,UNKNOWN,,,,,,,,,234.19,True,country_mean,,234.1938,1.0,default_1usd,,,,,,,,{},dataset/txt_limpios/1657.txt,dataset/paginas_descargadas/1657.html,EN,sin_categoria,discard,0.30,no_category_detected;price_parse_failed
1658,1658,,,,,,Desconocido,unknown,UNKNOWN,,,,,,,,,234.19,True,country_mean,,234.1938,1.0,default_1usd,,,,,,,,{},dataset/txt_limpios/1658.txt,dataset/paginas_descargadas/1658.html,EN,sin_categoria,discard,0.30,no_category_detected;price_parse_failed
1659,1659,,,,,,Desconocido,unknown,UNKNOWN,,,,,,,,,234.19,True,country_mean,,234.1938,1.0,default_1usd,,,,,,,,{},dataset/txt_limpios/1659.txt,dataset/paginas_descargadas/1659.html,EN,sin_categoria,discard,0.30,no_category_detected;price_parse_failed
1660,1660,,,,,,Desconocido,unknown,UNKNOWN,,,,,,,,,234.19,True,country_mean,,234.1938,1.0,default_1usd,,,,,,,,{},dataset/txt_limpios/1660.txt,dataset/paginas_descargadas/1660.html,EN,sin_categoria,discard,0.30,no_category_detected;price_parse_failed
1661,1661,,,,,,Desconocido,unknown,UNKNOWN,,,,,,,,,234.19,True,country_mean,,234.1938,1.0,default_1usd,,,,,,,,{},dataset/txt_limpios/1661.txt,dataset/paginas_descargadas/1661.html,EN,sin_categoria,discard,0.30,no_category_detected;price_parse_failed
1662,1662,,,,,,Desconocido,unknown,UNKNOWN,,,,,,,,,234.19,True,country_mean,,234.1938,1.0,default_1usd,,,,,,,,{},dataset/txt_limpios/1662.txt,dataset/paginas_descargadas/1662.html,EN,sin_categoria,discard,0.30,no_category_detected;price_parse_failed
1663,1663,,,,,,Desconocido,unknown,UNKNOWN,,,,,,,,,234.19,True,country_mean,,234.1938,1.0,default_1usd,,,,,,,,{},dataset/txt_limpios/1663.txt,dataset/paginas_descargadas/1663.html,EN,sin_categoria,discard,0.30,no_category_detected;price_parse_failed
1664,1664,,,,,,Desconocido,unknown,UNKNOWN,,,,,,,,,234.19,True,country_mean,,234.1938,1.0,default_1usd,,,,,,,,{},dataset/txt_limpios/1664.txt,dataset/paginas_descargadas/1664.html,EN,sin_categoria,discard,0.30,no_category_detected;price_parse_failed
1665,1665,,,,,,Desconocido,unknown,UNKNOWN,,,,,,,,,234.19,True,country_mean,,234.1938,1.0,default_1usd,,,,,,,,{},dataset/txt_limpios/1665.txt,dataset/paginas_descargadas/1665.html,EN,sin_categoria,discard,0.30,no_category_detected;price_parse_failed
1667,1667,,,,,,Desconocido,unknown,UNKNOWN,,,,,,,,,234.19,True,country_mean,,234.1938,1.0,default_1usd,,,,,,,,{},dataset/txt_limpios/1667.txt,dataset/paginas_descargadas/1667.html,EN,sin_categoria,discard,0.30,no_category_detected;price_parse_failed
1669,1669,,,,,,Desconocido,unknown,UNKNOWN,,,,,,,,,234.19,True,country_mean,,234.1938,1.0,default_1usd,,,,,,,,{},dataset/txt_limpios/1669.txt,dataset/paginas_descargadas/1669.html,EN,sin_categoria,discard,0.30,no_category_detected;price_parse_failed
1672,1672,,,,,,Desconocido,unknown,UNKNOWN,,,,,,,,,234.19,True,country_mean,,234.1938,1.0,default_1usd,,,,,,,,{},dataset/txt_limpios/1672.txt,dataset/paginas_descargadas/1672.html,EN,sin_categoria,discard,0.30,no_category_detected;price_parse_failed
1674,1674,,,,,,Desconocido,unknown,UNKNOWN,,,,,,,,,234.19,True,country_mean,,234.1938,1.0,default_1usd,,,,,,,,{},dataset/txt_limpios/1674.txt,dataset/paginas_descargadas/1674.html,EN,sin_categoria,discard,0.30,no_category_detected;price_parse_failed
1675,1675,,,,,,Desconocido,unknown,UNKNOWN,,,,,,,,,234.19,True,country_mean,,234.1938,1.0,default_1usd,,,,,,,,{},dataset/txt_limpios/1675.txt,dataset/paginas_descargadas/1675.html,EN,sin_categoria,discard,0.30,no_category_detected;price_parse_failed
1676,1676,,,,,,Desconocido,unknown,UNKNOWN,,,,,,,,,234.19,True,country_mean,,234.1938,1.0,default_1usd,,,,,,,,{},dataset/txt_limpios/1676.txt,dataset/paginas_descargadas/1676.html,EN,sin_categoria,discard,0.30,no_category_detected;price_parse_failed
1679,1679,,,,,,Desconocido,unknown,UNKNOWN,,,,,,,,,234.19,True,country_mean,,234.1938,1.0,default_1usd,,,,,,,,{},dataset/txt_limpios/1679.txt,dataset/paginas_descargadas/1679.html,EN,sin_categoria,discard,0.30,no_category_detected;price_parse_failed
1681,1681,,,,,,Desconocido,unknown,UNKNOWN,,,,,,,,,234.19,True,country_mean,,234.1938,1.0,default_1usd,,,,,,,,{},dataset/txt_limpios/1681.txt,dataset/paginas_descargadas/1681.html,EN,sin_categoria,discard,0.30,no_category_detected;price_parse_failed
1684,1684,,,,,,Desconocido,unknown,UNKNOWN,,,,,,,,,234.19,True,country_mean,,234.1938,1.0,default_1usd,,,,,,,,{},dataset/txt_limpios/1684.txt,dataset/paginas_descargadas/1684.html,EN,sin_categoria,discard,0.30,no_category_detected;price_parse_failed
1687,1687,,,,,,Desconocido,unknown,UNKNOWN,,,,,,,,,234.19,True,country_mean,,234.1938,1.0,default_1usd,,,,,,,,{},dataset/txt_limpios/1687.txt,dataset/paginas_descargadas/1687.html,EN,sin_categoria,discard,0.30,no_category_detected;price_parse_failed
1689,1689,,,,,,Desconocido,unknown,UNKNOWN,,,,,,,,,234.19,True,country_mean,,234.1938,1.0,default_1usd,,,,,,,,{},dataset/txt_limpios/1689.txt,dataset/paginas_descargadas/1689.html,EN,sin_categoria,discard,0.30,no_category_detected;price_parse_failed
1691,1691,,,,,,Desconocido,unknown,UNKNOWN,,,,,,,,,234.19,True,country_mean,,234.1938,1.0,default_1usd,,,,,,,,{},dataset/txt_limpios/1691.txt,dataset/paginas_descargadas/1691.html,EN,sin_categoria,discard,0.30,no_category_detected;price_parse_failed
1692,1692,,,,,,Desconocido,unknown,UNKNOWN,,,,,,,,,234.19,True,country_mean,,234.1938,1.0,default_1usd,,,,,,,,{},dataset/txt_limpios/1692.txt,dataset/paginas_descargadas/1692.html,EN,sin_categoria,discard,0.30,no_category_detected;price_parse_failed
523,523,,,,,,Desconocido,unknown,UNKNOWN,,,,,,,,,234.19,True,country_mean,,234.1938,1.0,default_1usd,,,,,,,,{},dataset/txt_limpios/523.txt,dataset/paginas_descargadas/523.html,EN,sin_categoria,discard,0.30,no_category_detected;price_parse_failed
887,887,,,,,,Desconocido,unknown,UNKNOWN,,,,,,,,,234.19,True,country_mean,,234.1938,1.0,default_1usd,,,,,,,,{},dataset/txt_limpios/887.txt,dataset/paginas_descargadas/887.html,EN,sin_categoria,discard,0.30,no_category_detected;price_parse_failed
890,890,,,,,,Desconocido,unknown,UNKNOWN,,,,,,,,,234.19,True,country_mean,,234.1938,1.0,default_1usd,,,,,,,,{},dataset/txt_limpios/890.txt,dataset/paginas_descargadas/890.html,EN,sin_categoria,discard,0.30,no_category_detected;price_parse_failed
897,897,,,,,,Desconocido,unknown,UNKNOWN,,,,,,,,,234.19,True,country_mean,,234.1938,1.0,default_1usd,,,,,,,,{},dataset/txt_limpios/897.txt,dataset/paginas_descargadas/897.html,EN,sin_categoria,discard,0.30,no_category_detected;price_parse_failed
899,899,,,,,,Desconocido,unknown,UNKNOWN,,,,,,,,,234.19,True,country_mean,,234.1938,1.0,default_1usd,,,,,,,,{},dataset/txt_limpios/899.txt,dataset/paginas_descargadas/899.html,EN,sin_categoria,discard,0.30,no_category_detected;price_parse_failed
901,901,,,,,,Desconocido,unknown,UNKNOWN,,,,,,,,,234.19,True,country_mean,,234.1938,1.0,default_1usd,,,,,,,,{},dataset/txt_limpios/901.txt,dataset/paginas_descargadas/901.html,EN,sin_categoria,discard,0.30,no_category_detected;price_parse_failed
907,907,,,,,,Desconocido,unknown,UNKNOWN,,,,,,,,,234.19,True,country_mean,,234.1938,1.0,default_1usd,,,,,,,,{},dataset/txt_limpios/907.txt,dataset/paginas_descargadas/907.html,EN,sin_categoria,discard,0.30,no_category_detected;price_parse_failed
912,912,,,,,,Desconocido,unknown,UNKNOWN,,,,,,,,,234.19,True,country_mean,,234.1938,1.0,default_1usd,,,,,,,,{},dataset/txt_limpios/912.txt,dataset/paginas_descargadas/912.html,EN,sin_categoria,discard,0.30,no_category_detected;price_parse_failed
919,919,,,,,,Desconocido,unknown,UNKNOWN,,,,,,,,,234.19,True,country_mean,,234.1938,1.0,default_1usd,,,,,,,,{},dataset/txt_limpios/919.txt,dataset/paginas_descargadas/919.html,EN,sin_categoria,discard,0.30,no_category_detected;price_parse_failed
921,921,,,,,,Desconocido,unknown,UNKNOWN,,,,,,,,,234.19,True,country_mean,,234.1938,1.0,default_1usd,,,,,,,,{},dataset/txt_limpios/921.txt,dataset/paginas_descargadas/921.html,EN,sin_categoria,discard,0.30,no_category_detected;price_parse_failed
922,922,,,,,,Desconocido,unknown,UNKNOWN,,,,,,,,,234.19,True,country_mean,,234.1938,1.0,default_1usd,,,,,,,,{},dataset/txt_limpios/922.txt,dataset/paginas_descargadas/922.html,EN,sin_categoria,discard,0.30,no_category_detected;price_parse_failed
10,Aceites y vinagres,"Aceite 123 Vegetal te ayuda a preparar tus alimentos de una manera más sana ya que por su origen vegetal en el contiene colesterol, ademas intensifica el sabor de los ingredientes que uses al cocinar. Aceite Vegetal comestible 123,es elaborado por una empresa 100% mexicana, mezcla lo mejor de los semillas Girasol y Canola, lo que hace que sus alimentos sean cocinados de una manera saludable , también se puede consumir como complemento en adherizos para ensaladas si asi lo prefieres.",123 > 1L > 3009948,37.0,MXN,,Chedraui,unknown,MX,Aceites y vinagres,123,3009948.0,1L,37.00,MXN,$,$37.00,37.0,False,original,1.9871,1.9871,18.62,from_mexico_cambio_dolar,"Aceite 123 Vegetal te ayuda a preparar tus alimentos de una manera más sana ya que por su origen vegetal en el contiene colesterol, ademas intensifica el sabor de los ingredientes que uses al cocinar.",,Vegetal | Contiene vitamina E | No contiene colesterol | Antioxidante TBHQ,"Aceite Vegetal comestible 123,es elaborado por una empresa 100% mexicana,  mezcla lo mejor de dos semillas Girasol y Canola, lo que hace que sus alimentos sean cocinados de una manera saludable , tambien se puede consumir como complemento en aderezos para ensaladas si asi lo prefieres.",,,,"{""Información"": [""Aceite 123 Vegetal te ayuda a preparar tus alimentos de una manera más sana ya que por su origen vegetal en el contiene colesterol, ademas intensifica el sabor de los ingredientes que uses al cocinar.""], ""Características"": [""Vegetal"", ""Contiene vitamina E"", ""No contiene colesterol"", ""Antioxidante TBHQ""], ""Especificaciones"": [""Aceite Vegetal comestible 123,es elaborado por una empresa 100% mexicana,  mezcla lo mejor de dos semillas Girasol y Canola, lo que hace que sus alimentos sean cocinados de una manera saludable , tambien se puede consumir como complemento en aderezos para ensaladas si asi lo prefieres.""]}",dataset/txt_limpios/10.txt,dataset/paginas_descargadas/10.html,ET,aceite vegetal,keep,0.60,heuristic_default
6,Aceites y vinagres,"Nutrioli Antiguoteo, con tapa dosificadora para mayor control y limpieza, es un aceite100% puro con Omegas 3, 6 y 9 que favorece la salud cardiovascular, por su origen vegetal no contiene colestero y contiene vitamina Y, ideal para cocinar de forma práctica y sencilla Nutrioli Antiguoteo, con tapa dosificadora para mayor control y limpieza, es un aceptado para cocinar 100% puro de soya que cuida tu salud, ya que cuenta con Omegas 3, 6 y 9, que ayudan a elevar tus niveles de colesterol bueno y reducir el malo, por su origen vegetal en el contiene colesterol, es claro y su consistencia es muy ligera, además, contiene vitamina Y, ideal para cocinar de manera práctica y sencilla",Nutrioli > 700ml > 3738492,,MXN,,Chedraui,unknown,MX,Aceites y vinagres,Nutrioli,3738492.0,700ml,,MXN,,,33.3,True,category_country_mean,,1.7884,18.62,from_mexico_cambio_dolar,"Nutrioli Antiguoteo, con tapa dosificadora para mayor control y limpieza, es un aceite100% puro con Omegas 3, 6 y 9 que favorece la salud cardiovascular, por su origen vegetal no contiene colestero y contiene vitamina Y, ideal para cocinar de manera práctica y sencilla",,,"Nutrioli Antiguoteo, con tapa dosificadora para mayor control y limpieza, es un aceptado para cocinar 100% puro de soya que cuida tu salud, ya que cuenta con Omegas 3, 6 y 9, que ayudan a elevar tus niveles de colesterol bueno y reducir el malo, por su origen vegetal en el contiene colesterol, es claro y su consistencia es muy ligera, además, contiene vitamina Y, ideal para cocinar de manera práctica y sencilla",,,,"{""Información"": [""Nutrioli Antiguoteo, con tapa dosificadora para mayor control y limpieza, es un aceite100% puro con Omegas 3, 6 y 9 que favorece la salud cardiovascular, por su origen vegetal no contiene colestero y contiene vitamina Y, ideal para cocinar de manera práctica y sencilla""], ""Especificaciones"": [""Nutrioli Antiguoteo, con tapa dosificadora para mayor control y limpieza, es un aceptado para cocinar 100% puro de soya que cuida tu salud, ya que cuenta con Omegas 3, 6 y 9, que ayudan a elevar tus niveles de colesterol bueno y reducir el malo, por su origen vegetal en el contiene colesterol, es claro y su consistencia es muy ligera, además, contiene vitamina Y, ideal para cocinar de manera práctica y sencilla""]}",dataset/txt_limpios/6.txt,dataset/paginas_descargadas/6.html,ET,aceite vegetal,discard,0.60,price_parse_failed;price<=0
7,Aceites y vinagres,"Prepara tu despensa en unos cuantos clics y descubre nuestra gran variedad de productos. ¡En la sala de casa, te llevamos el súper!",Aceite Chedraui Mixto 800ml > 800ml > 3717376,28.0,MXN,,Chedraui,unknown,MX,Aceites y vinagres,Aceite Chedraui Mixto 800ml,3717376.0,800ml,28.00,MXN,$,$28.00,28.0,False,original,1.5038,1.5038,18.62,from_mexico_cambio_dolar,,,Aceite vegetal comestible | Consérvese en un lugar fresco | Ideal para freír,"Prepara tu despensa en unos cuantos clics y descubre nuestra gran variedad de productos. ¡En la sala de casa, te llevamos el súper!",,,,"{""Características"": [""Aceite vegetal comestible"", ""Consérvese en un lugar fresco"", ""Ideal para freír""], ""Especificaciones"": [""Prepara tu despensa en unos cuantos clics y descubre nuestra gran variedad de productos. ¡En la sala de casa, te llevamos el súper!""]}",dataset/txt_limpios/7.txt,dataset/paginas_descargadas/7.html,ET,aceite vegetal,keep,0.60,heuristic_default
8,Aceites y vinagres,Resalta el sabor y la textura de los alimentos Mezcla saludable de aceites vegetales insaturados,Patrona > 1 L > 3009886,,MXN,,Chedraui,unknown,MX,Aceites y vinagres,Patrona,3009886.0,1 L,,MXN,,,33.3,True,category_country_mean,,1.7884,18.62,from_mexico_cambio_dolar,Resalta el sabor y la textura de los alimentos,,,Mezcla saludable de aceites vegetales insaturados,,,,"{""Información"": [""Resalta el sabor y la textura de los alimentos""], ""Especificaciones"": [""Mezcla saludable de aceites vegetales insaturados""]}",dataset/txt_limpios/8.txt,dataset/paginas_descargadas/8.html,EN,aceite vegetal,discard,0.60,price_parse_failed;price<=0
433,Acerca de tu privacidad,,Más información,,ARS,,Desconocido,unknown,AR,Acerca de tu privacidad,Más información,,,,ARS,,,1663.58,True,country_mean,,1.3256,1255.0,from_argentina_cambio_dolar,,,,,,,,{},dataset/txt_limpios/433.txt,dataset/paginas_descargadas/433.html,EN,sin_categoria,discard,0.30,no_category_detected;price_parse_failed
448,Acerca de tu privacidad,,Más información,,ARS,,Desconocido,unknown,AR,Acerca de tu privacidad,Más información,,,,ARS,,,1663.58,True,country_mean,,1.3256,1255.0,from_argentina_cambio_dolar,,,,,,,,{},dataset/txt_limpios/448.txt,dataset/paginas_descargadas/448.html,EN,sin_categoria,discard,0.30,no_category_detected;price_parse_failed
454,Acerca de tu privacidad,,Más información,,ARS,,Desconocido,unknown,AR,Acerca de tu privacidad,Más información,,,,ARS,,,1663.58,True,country_mean,,1.3256,1255.0,from_argentina_cambio_dolar,,,,,,,,{},dataset/txt_limpios/454.txt,dataset/paginas_descargadas/454.html,EN,sin_categoria,discard,0.30,no_category_detected;price_parse_failed
269,"Al continuar navegando, usted acepta con nuestra",,Política de privacidad > 12 unidades,20.0,BRL,,Desconocido,unknown,BR,"Al continuar navegando, usted acepta con nuestra",Política de privacidad,,12 unidades,20.00,BRL,R$,"R$20,00",20.0,False,original,3.6711,3.6711,5.448,from_brasil_cambio_dolar,,,,,,,,{},dataset/txt_limpios/269.txt,dataset/paginas_descargadas/269.html,ET,sin_categoria,discard,0.30,no_category_detected
1605,Alimentos básicos,,Frijoles > 1 Kg,,,,Desconocido,unknown,UNKNOWN,Alimentos básicos,Frijoles,,1 Kg,,,,,1.02,True,category_mean,,1.02,1.0,default_1usd,,,,,,,,{},dataset/txt_limpios/1605.txt,dataset/paginas_descargadas/1605.html,ET,frijoles,discard,0.60,price_parse_failed;price<=0
1606,Alimentos básicos,,Frijoles > 1Kg,,,,Desconocido,unknown,UNKNOWN,Alimentos básicos,Frijoles,,1Kg,,,,,1.02,True,category_mean,,1.02,1.0,default_1usd,,,,,,,,{},dataset/txt_limpios/1606.txt,dataset/paginas_descargadas/1606.html,ET,frijoles,discard,0.60,price_parse_failed;price<=0
