source_id,title,description,breadcrumbs,price_raw,currency_raw,url,seller,availability,country,product_name,brand,reference,unit,price_amount,price_currency,price_symbol,price_text,price_amount_filled,price_is_imputed,price_imputation_source,price_amount_usd,price_amount_usd_filled,fx_rate_local_per_usd,fx_source,information_text,description_text,features_text,specifications_text,benefits_text,details_text,other_sections,sections,txt_path,html_path,es_status,category_canonical,decision,match_score,reasons
641,$ 12.800,,Ver detalles del producto > 15G,12.8,,,Desconocido,unknown,UNKNOWN,$ 12.800,Ver detalles del producto,,15G,12.80,,$,$12.80,12.8,False,original,12.8,12.8,1.0,default_1usd,,,,,,,,{},dataset/txt_limpios/641.txt,dataset/paginas_descargadas/641.html,EN,sin_categoria,discard,0.30,no_category_detected
640,$ 8.500,,$ 8.000,8.5,,,Desconocido,unknown,UNKNOWN,$ 8.500,$ 8.000,,,8.50,,$,$8.50,8.5,False,original,8.5,8.5,1.0,default_1usd,,,,,,,,{},dataset/txt_limpios/640.txt,dataset/paginas_descargadas/640.html,EN,sin_categoria,discard,0.30,no_category_detected
1368,(021) 729-7200,,Zona de Cobertura > 600GR,10.5,,,Desconocido,unknown,UNKNOWN,(021) 729-7200,Zona de Cobertura,,600GR,10.50,,.,.10.50,10.5,False,original,10.5,10.5,1.0,default_1usd,,,,,,,,{},dataset/txt_limpios/1368.txt,dataset/paginas_descargadas/1368.html,EN,sin_categoria,discard,0.30,no_category_detected
626,(Gr a $ 10),,$ 8.650 > 0.2 g,10.0,,,Desconocido,unknown,UNKNOWN,(Gr a $ 10),$ 8.650,,0.2 g,10.00,,$,$10,10.0,False,original,10.0,10.0,1.0,default_1usd,,,,,,,,{},dataset/txt_limpios/626.txt,dataset/paginas_descargadas/626.html,EN,sin_categoria,discard,0.30,no_category_detected
627,(Gr a $ 10),,20 > 480G,10.0,,,Desconocido,unknown,UNKNOWN,(Gr a $ 10),20,,480G,10.00,,$,$10,10.0,False,original,10.0,10.0,1.0,default_1usd,,,,,,,,{},dataset/txt_limpios/627.txt,dataset/paginas_descargadas/627.html,EN,sin_categoria,discard,0.30,no_category_detected
630,(Gr a $ 10),,20,10.0,,,Desconocido,unknown,UNKNOWN,(Gr a $ 10),20,,,10.00,,$,$10,10.0,False,original,10.0,10.0,1.0,default_1usd,,,,,,,,{},dataset/txt_limpios/630.txt,dataset/paginas_descargadas/630.html,EN,sin_categoria,discard,0.30,no_category_detected
766,(Gr a $ 11),,$ 6.700,11.0,,,Desconocido,unknown,UNKNOWN,(Gr a $ 11),$ 6.700,,,11.00,,$,$11,11.0,False,original,11.0,11.0,1.0,default_1usd,,,,,,,,{},dataset/txt_limpios/766.txt,dataset/paginas_descargadas/766.html,EN,sin_categoria,discard,0.30,no_category_detected
767,(Gr a $ 12),,$ 7.150,12.0,,,Desconocido,unknown,UNKNOWN,(Gr a $ 12),$ 7.150,,,12.00,,$,$12,12.0,False,original,12.0,12.0,1.0,default_1usd,,,,,,,,{},dataset/txt_limpios/767.txt,dataset/paginas_descargadas/767.html,EN,sin_categoria,discard,0.30,no_category_detected
778,(Gr a $ 19),,$ 39.000,19.0,,,Desconocido,unknown,UNKNOWN,(Gr a $ 19),$ 39.000,,,19.00,,$,$19,19.0,False,original,19.0,19.0,1.0,default_1usd,,,,,,,,{},dataset/txt_limpios/778.txt,dataset/paginas_descargadas/778.html,EN,sin_categoria,discard,0.30,no_category_detected
637,(Gr a $ 2),,36,2.0,,,Desconocido,unknown,UNKNOWN,(Gr a $ 2),36,,,2.00,,$,$2,2.0,False,original,2.0,2.0,1.0,default_1usd,,,,,,,,{},dataset/txt_limpios/637.txt,dataset/paginas_descargadas/637.html,EN,sin_categoria,discard,0.30,no_category_detected
773,(Gr a $ 2),,36,2.0,,,Desconocido,unknown,UNKNOWN,(Gr a $ 2),36,,,2.00,,$,$2,2.0,False,original,2.0,2.0,1.0,default_1usd,,,,,,,,{},dataset/txt_limpios/773.txt,dataset/paginas_descargadas/773.html,EN,sin_categoria,discard,0.30,no_category_detected
628,(Gr a $ 21),,$ 10.550,21.0,,,Desconocido,unknown,UNKNOWN,(Gr a $ 21),$ 10.550,,,21.00,,$,$21,21.0,False,original,21.0,21.0,1.0,default_1usd,,,,,,,,{},dataset/txt_limpios/628.txt,dataset/paginas_descargadas/628.html,EN,sin_categoria,discard,0.30,no_category_detected
765,(Gr a $ 21),,20,21.0,,,Desconocido,unknown,UNKNOWN,(Gr a $ 21),20,,,21.00,,$,$21,21.0,False,original,21.0,21.0,1.0,default_1usd,,,,,,,,{},dataset/txt_limpios/765.txt,dataset/paginas_descargadas/765.html,EN,sin_categoria,discard,0.30,no_category_detected
763,(Gr a $ 23),,$ 11.600,23.0,,,Desconocido,unknown,UNKNOWN,(Gr a $ 23),$ 11.600,,,23.00,,$,$23,23.0,False,original,23.0,23.0,1.0,default_1usd,,,,,,,,{},dataset/txt_limpios/763.txt,dataset/paginas_descargadas/763.html,EN,sin_categoria,discard,0.30,no_category_detected
629,(Gr a $ 29),,$ 13.450,29.0,,,Desconocido,unknown,UNKNOWN,(Gr a $ 29),$ 13.450,,,29.00,,$,$29,29.0,False,original,29.0,29.0,1.0,default_1usd,,,,,,,,{},dataset/txt_limpios/629.txt,dataset/paginas_descargadas/629.html,EN,sin_categoria,discard,0.30,no_category_detected
654,(Gr a $ 3),,30,3.0,,,Desconocido,unknown,UNKNOWN,(Gr a $ 3),30,,,3.00,,$,$3,3.0,False,original,3.0,3.0,1.0,default_1usd,,,,,,,,{},dataset/txt_limpios/654.txt,dataset/paginas_descargadas/654.html,EN,sin_categoria,discard,0.30,no_category_detected
657,(Gr a $ 3),,27,3.0,,,Desconocido,unknown,UNKNOWN,(Gr a $ 3),27,,,3.00,,$,$3,3.0,False,original,3.0,3.0,1.0,default_1usd,,,,,,,,{},dataset/txt_limpios/657.txt,dataset/paginas_descargadas/657.html,EN,sin_categoria,discard,0.30,no_category_detected
759,(Gr a $ 3),,20,3.0,,,Desconocido,unknown,UNKNOWN,(Gr a $ 3),20,,,3.00,,$,$3,3.0,False,original,3.0,3.0,1.0,default_1usd,,,,,,,,{},dataset/txt_limpios/759.txt,dataset/paginas_descargadas/759.html,EN,sin_categoria,discard,0.30,no_category_detected
760,(Gr a $ 3),,37,3.0,,,Desconocido,unknown,UNKNOWN,(Gr a $ 3),37,,,3.00,,$,$3,3.0,False,original,3.0,3.0,1.0,default_1usd,,,,,,,,{},dataset/txt_limpios/760.txt,dataset/paginas_descargadas/760.html,EN,sin_categoria,discard,0.30,no_category_detected
785,(Gr a $ 3),,30,3.0,,,Desconocido,unknown,UNKNOWN,(Gr a $ 3),30,,,3.00,,$,$3,3.0,False,original,3.0,3.0,1.0,default_1usd,,,,,,,,{},dataset/txt_limpios/785.txt,dataset/paginas_descargadas/785.html,EN,sin_categoria,discard,0.30,no_category_detected
764,(Gr a $ 34),,$ 15.700,34.0,,,Desconocido,unknown,UNKNOWN,(Gr a $ 34),$ 15.700,,,34.00,,$,$34,34.0,False,original,34.0,34.0,1.0,default_1usd,,,,,,,,{},dataset/txt_limpios/764.txt,dataset/paginas_descargadas/764.html,EN,sin_categoria,discard,0.30,no_category_detected
621,(Gr a $ 4),,$ 5.070,4.0,,,Desconocido,unknown,UNKNOWN,(Gr a $ 4),$ 5.070,,,4.00,,$,$4,4.0,False,original,4.0,4.0,1.0,default_1usd,,,,,,,,{},dataset/txt_limpios/621.txt,dataset/paginas_descargadas/621.html,EN,sin_categoria,discard,0.30,no_category_detected
622,(Gr a $ 4),,$ 4.680,4.0,,,Desconocido,unknown,UNKNOWN,(Gr a $ 4),$ 4.680,,,4.00,,$,$4,4.0,False,original,4.0,4.0,1.0,default_1usd,,,,,,,,{},dataset/txt_limpios/622.txt,dataset/paginas_descargadas/622.html,EN,sin_categoria,discard,0.30,no_category_detected
623,(Gr a $ 4),,$ 4.460,4.0,,,Desconocido,unknown,UNKNOWN,(Gr a $ 4),$ 4.460,,,4.00,,$,$4,4.0,False,original,4.0,4.0,1.0,default_1usd,,,,,,,,{},dataset/txt_limpios/623.txt,dataset/paginas_descargadas/623.html,EN,sin_categoria,discard,0.30,no_category_detected
624,(Gr a $ 4),,$ 10.650,4.0,,,Desconocido,unknown,UNKNOWN,(Gr a $ 4),$ 10.650,,,4.00,,$,$4,4.0,False,original,4.0,4.0,1.0,default_1usd,,,,,,,,{},dataset/txt_limpios/624.txt,dataset/paginas_descargadas/624.html,EN,sin_categoria,discard,0.30,no_category_detected
655,(Gr a $ 4),,$ 4.830,4.0,,,Desconocido,unknown,UNKNOWN,(Gr a $ 4),$ 4.830,,,4.00,,$,$4,4.0,False,original,4.0,4.0,1.0,default_1usd,,,,,,,,{},dataset/txt_limpios/655.txt,dataset/paginas_descargadas/655.html,EN,sin_categoria,discard,0.30,no_category_detected
656,(Gr a $ 4),,19,4.0,,,Desconocido,unknown,UNKNOWN,(Gr a $ 4),19,,,4.00,,$,$4,4.0,False,original,4.0,4.0,1.0,default_1usd,,,,,,,,{},dataset/txt_limpios/656.txt,dataset/paginas_descargadas/656.html,EN,sin_categoria,discard,0.30,no_category_detected
754,(Gr a $ 4),,10,4.0,,,Desconocido,unknown,UNKNOWN,(Gr a $ 4),10,,,4.00,,$,$4,4.0,False,original,4.0,4.0,1.0,default_1usd,,,,,,,,{},dataset/txt_limpios/754.txt,dataset/paginas_descargadas/754.html,EN,sin_categoria,discard,0.30,no_category_detected
755,(Gr a $ 4),,$ 4.900,4.0,,,Desconocido,unknown,UNKNOWN,(Gr a $ 4),$ 4.900,,,4.00,,$,$4,4.0,False,original,4.0,4.0,1.0,default_1usd,,,,,,,,{},dataset/txt_limpios/755.txt,dataset/paginas_descargadas/755.html,EN,sin_categoria,discard,0.30,no_category_detected
756,(Gr a $ 4),,$ 2.500,4.0,,,Desconocido,unknown,UNKNOWN,(Gr a $ 4),$ 2.500,,,4.00,,$,$4,4.0,False,original,4.0,4.0,1.0,default_1usd,,,,,,,,{},dataset/txt_limpios/756.txt,dataset/paginas_descargadas/756.html,EN,sin_categoria,discard,0.30,no_category_detected
758,(Gr a $ 4),,$ 2.100,4.0,,,Desconocido,unknown,UNKNOWN,(Gr a $ 4),$ 2.100,,,4.00,,$,$4,4.0,False,original,4.0,4.0,1.0,default_1usd,,,,,,,,{},dataset/txt_limpios/758.txt,dataset/paginas_descargadas/758.html,EN,sin_categoria,discard,0.30,no_category_detected
777,(Gr a $ 4),,12,4.0,,,Desconocido,unknown,UNKNOWN,(Gr a $ 4),12,,,4.00,,$,$4,4.0,False,original,4.0,4.0,1.0,default_1usd,,,,,,,,{},dataset/txt_limpios/777.txt,dataset/paginas_descargadas/777.html,EN,sin_categoria,discard,0.30,no_category_detected
650,(Gr a $ 42),,$ 17.000 > 6 g,42.0,,,Desconocido,unknown,UNKNOWN,(Gr a $ 42),$ 17.000,,6 g,42.00,,$,$42,42.0,False,original,42.0,42.0,1.0,default_1usd,,,,,,,,{},dataset/txt_limpios/650.txt,dataset/paginas_descargadas/650.html,EN,sin_categoria,discard,0.30,no_category_detected
649,(Gr a $ 45),,20,45.0,,,Desconocido,unknown,UNKNOWN,(Gr a $ 45),20,,,45.00,,$,$45,45.0,False,original,45.0,45.0,1.0,default_1usd,,,,,,,,{},dataset/txt_limpios/649.txt,dataset/paginas_descargadas/649.html,EN,sin_categoria,discard,0.30,no_category_detected
780,(Gr a $ 46),,$ 7.635,46.0,,,Desconocido,unknown,UNKNOWN,(Gr a $ 46),$ 7.635,,,46.00,,$,$46,46.0,False,original,46.0,46.0,1.0,default_1usd,,,,,,,,{},dataset/txt_limpios/780.txt,dataset/paginas_descargadas/780.html,EN,sin_categoria,discard,0.30,no_category_detected
781,(Gr a $ 47),,20,47.0,,,Desconocido,unknown,UNKNOWN,(Gr a $ 47),20,,,47.00,,$,$47,47.0,False,original,47.0,47.0,1.0,default_1usd,,,,,,,,{},dataset/txt_limpios/781.txt,dataset/paginas_descargadas/781.html,EN,sin_categoria,discard,0.30,no_category_detected
625,(Gr a $ 5),,20,5.0,,,Desconocido,unknown,UNKNOWN,(Gr a $ 5),20,,,5.00,,$,$5,5.0,False,original,5.0,5.0,1.0,default_1usd,,,,,,,,{},dataset/txt_limpios/625.txt,dataset/paginas_descargadas/625.html,EN,sin_categoria,discard,0.30,no_category_detected
658,(Gr a $ 5),,20,5.0,,,Desconocido,unknown,UNKNOWN,(Gr a $ 5),20,,,5.00,,$,$5,5.0,False,original,5.0,5.0,1.0,default_1usd,,,,,,,,{},dataset/txt_limpios/658.txt,dataset/paginas_descargadas/658.html,EN,sin_categoria,discard,0.30,no_category_detected
783,(Gr a $ 55),,$ 11.100,55.0,,,Desconocido,unknown,UNKNOWN,(Gr a $ 55),$ 11.100,,,55.00,,$,$55,55.0,False,original,55.0,55.0,1.0,default_1usd,,,,,,,,{},dataset/txt_limpios/783.txt,dataset/paginas_descargadas/783.html,EN,sin_categoria,discard,0.30,no_category_detected
652,(Gr a $ 64),,$ 13.500,64.0,,,Desconocido,unknown,UNKNOWN,(Gr a $ 64),$ 13.500,,,64.00,,$,$64,64.0,False,original,64.0,64.0,1.0,default_1usd,,,,,,,,{},dataset/txt_limpios/652.txt,dataset/paginas_descargadas/652.html,EN,sin_categoria,discard,0.30,no_category_detected
638,(Gr a $ 65),,$ 18.100,65.0,,,Desconocido,unknown,UNKNOWN,(Gr a $ 65),$ 18.100,,,65.00,,$,$65,65.0,False,original,65.0,65.0,1.0,default_1usd,,,,,,,,{},dataset/txt_limpios/638.txt,dataset/paginas_descargadas/638.html,EN,sin_categoria,discard,0.30,no_category_detected
653,(Gr a $ 67),,$ 30.400,67.0,,,Desconocido,unknown,UNKNOWN,(Gr a $ 67),$ 30.400,,,67.00,,$,$67,67.0,False,original,67.0,67.0,1.0,default_1usd,,,,,,,,{},dataset/txt_limpios/653.txt,dataset/paginas_descargadas/653.html,EN,sin_categoria,discard,0.30,no_category_detected
784,(Gr a $ 68),,$ 14.400,68.0,,,Desconocido,unknown,UNKNOWN,(Gr a $ 68),$ 14.400,,,68.00,,$,$68,68.0,False,original,68.0,68.0,1.0,default_1usd,,,,,,,,{},dataset/txt_limpios/784.txt,dataset/paginas_descargadas/784.html,EN,sin_categoria,discard,0.30,no_category_detected
645,(Gr a $ 8),,$ 8.200,8.0,,,Desconocido,unknown,UNKNOWN,(Gr a $ 8),$ 8.200,,,8.00,,$,$8,8.0,False,original,8.0,8.0,1.0,default_1usd,,,,,,,,{},dataset/txt_limpios/645.txt,dataset/paginas_descargadas/645.html,EN,sin_categoria,discard,0.30,no_category_detected
646,(Gr a $ 9),,$ 9.980,9.0,,,Desconocido,unknown,UNKNOWN,(Gr a $ 9),$ 9.980,,,9.00,,$,$9,9.0,False,original,9.0,9.0,1.0,default_1usd,,,,,,,,{},dataset/txt_limpios/646.txt,dataset/paginas_descargadas/646.html,EN,sin_categoria,discard,0.30,no_category_detected
779,(Gr a $ 90),,$ 21.600,90.0,,,Desconocido,unknown,UNKNOWN,(Gr a $ 90),$ 21.600,,,90.00,,$,$90,90.0,False,original,90.0,90.0,1.0,default_1usd,,,,,,,,{},dataset/txt_limpios/779.txt,dataset/paginas_descargadas/779.html,EN,sin_categoria,discard,0.30,no_category_detected
635,(Ml a $ 3),,$ 17.040,3.0,,,Desconocido,unknown,UNKNOWN,(Ml a $ 3),$ 17.040,,,3.00,,$,$3,3.0,False,original,3.0,3.0,1.0,default_1usd,,,,,,,,{},dataset/txt_limpios/635.txt,dataset/paginas_descargadas/635.html,EN,sin_categoria,discard,0.30,no_category_detected
771,(Ml a $ 3),,$ 3.330,3.0,,,Desconocido,unknown,UNKNOWN,(Ml a $ 3),$ 3.330,,,3.00,,$,$3,3.0,False,original,3.0,3.0,1.0,default_1usd,,,,,,,,{},dataset/txt_limpios/771.txt,dataset/paginas_descargadas/771.html,EN,sin_categoria,discard,0.30,no_category_detected
632,(Ml a $ 4),,25 > 1100ml,4.0,,,Desconocido,unknown,UNKNOWN,(Ml a $ 4),25,,1100ml,4.00,,$,$4,4.0,False,original,4.0,4.0,1.0,default_1usd,,,,,,,,{},dataset/txt_limpios/632.txt,dataset/paginas_descargadas/632.html,EN,sin_categoria,discard,0.30,no_category_detected
633,(Ml a $ 4),,$ 30.350,4.0,,,Desconocido,unknown,UNKNOWN,(Ml a $ 4),$ 30.350,,,4.00,,$,$4,4.0,False,original,4.0,4.0,1.0,default_1usd,,,,,,,,{},dataset/txt_limpios/633.txt,dataset/paginas_descargadas/633.html,EN,sin_categoria,discard,0.30,no_category_detected
634,(Ml a $ 5),,$ 6.980,5.0,,,Desconocido,unknown,UNKNOWN,(Ml a $ 5),$ 6.980,,,5.00,,$,$5,5.0,False,original,5.0,5.0,1.0,default_1usd,,,,,,,,{},dataset/txt_limpios/634.txt,dataset/paginas_descargadas/634.html,EN,sin_categoria,discard,0.30,no_category_detected
769,(Ml a $ 5),,$ 4.900,5.0,,,Desconocido,unknown,UNKNOWN,(Ml a $ 5),$ 4.900,,,5.00,,$,$5,5.0,False,original,5.0,5.0,1.0,default_1usd,,,,,,,,{},dataset/txt_limpios/769.txt,dataset/paginas_descargadas/769.html,EN,sin_categoria,discard,0.30,no_category_detected
768,(Ml a $ 6),,$ 40.800 > 1100ml,6.0,,,Desconocido,unknown,UNKNOWN,(Ml a $ 6),$ 40.800,,1100ml,6.00,,$,$6,6.0,False,original,6.0,6.0,1.0,default_1usd,,,,,,,,{},dataset/txt_limpios/768.txt,dataset/paginas_descargadas/768.html,EN,sin_categoria,discard,0.30,no_category_detected
619,(Und a $ 1.231),,$ 39.400,1.23,,,Desconocido,unknown,UNKNOWN,(Und a $ 1.231),$ 39.400,,,1.23,,$,$1.23,1.23,False,original,1.23,1.23,1.0,default_1usd,,,,,,,,{},dataset/txt_limpios/619.txt,dataset/paginas_descargadas/619.html,EN,sin_categoria,discard,0.30,no_category_detected
775,(Und a $ 1.312),,20,1.31,,,Desconocido,unknown,UNKNOWN,(Und a $ 1.312),20,,,1.31,,$,$1.31,1.31,False,original,1.31,1.31,1.0,default_1usd,,,,,,,,{},dataset/txt_limpios/775.txt,dataset/paginas_descargadas/775.html,EN,sin_categoria,discard,0.30,no_category_detected
644,(Und a $ 1.540),,$ 1.540,1.54,,,Desconocido,unknown,UNKNOWN,(Und a $ 1.540),$ 1.540,,,1.54,,$,$1.54,1.54,False,original,1.54,1.54,1.0,default_1usd,,,,,,,,{},dataset/txt_limpios/644.txt,dataset/paginas_descargadas/644.html,EN,sin_categoria,discard,0.30,no_category_detected
636,(Und a $ 500),,16,500.0,,,Desconocido,unknown,UNKNOWN,(Und a $ 500),16,,,500.00,,$,$500,500.0,False,original,500.0,500.0,1.0,default_1usd,,,,,,,,{},dataset/txt_limpios/636.txt,dataset/paginas_descargadas/636.html,EN,sin_categoria,discard,0.30,no_category_detected
639,(Und a $ 544),,20,544.0,,,Desconocido,unknown,UNKNOWN,(Und a $ 544),20,,,544.00,,$,$544,544.0,False,original,544.0,544.0,1.0,default_1usd,,,,,,,,{},dataset/txt_limpios/639.txt,dataset/paginas_descargadas/639.html,EN,sin_categoria,discard,0.30,no_category_detected
774,(Und a $ 544),,20,544.0,,,Desconocido,unknown,UNKNOWN,(Und a $ 544),20,,,544.00,,$,$544,544.0,False,original,544.0,544.0,1.0,default_1usd,,,,,,,,{},dataset/txt_limpios/774.txt,dataset/paginas_descargadas/774.html,EN,sin_categoria,discard,0.30,no_category_detected
615,(Und a $ 750),,$ 24.500,750.0,,,Desconocido,unknown,UNKNOWN,(Und a $ 750),$ 24.500,,,750.00,,$,$750,750.0,False,original,750.0,750.0,1.0,default_1usd,,,,,,,,{},dataset/txt_limpios/615.txt,dataset/paginas_descargadas/615.html,EN,sin_categoria,discard,0.30,no_category_detected
618,(Und a $ 796),,$ 23.900,796.0,,,Desconocido,unknown,UNKNOWN,(Und a $ 796),$ 23.900,,,796.00,,$,$796,796.0,False,original,796.0,796.0,1.0,default_1usd,,,,,,,,{},dataset/txt_limpios/618.txt,dataset/paginas_descargadas/618.html,EN,sin_categoria,discard,0.30,no_category_detected
772,(Und a $ 840),,$ 860,840.0,,,Desconocido,unknown,UNKNOWN,(Und a $ 840),$ 860,,,840.00,,$,$840,840.0,False,original,840.0,840.0,1.0,default_1usd,,,,,,,,{},dataset/txt_limpios/772.txt,dataset/paginas_descargadas/772.html,EN,sin_categoria,discard,0.30,no_category_detected
616,(Und a $ 850),,$ 25.500,850.0,,,Desconocido,unknown,UNKNOWN,(Und a $ 850),$ 25.500,,,850.00,,$,$850,850.0,False,original,850.0,850.0,1.0,default_1usd,,,,,,,,{},dataset/txt_limpios/616.txt,dataset/paginas_descargadas/616.html,EN,sin_categoria,discard,0.30,no_category_detected
749,(Und a $ 850),,$ 25.500,850.0,,,Desconocido,unknown,UNKNOWN,(Und a $ 850),$ 25.500,,,850.00,,$,$850,850.0,False,original,850.0,850.0,1.0,default_1usd,,,,,,,,{},dataset/txt_limpios/749.txt,dataset/paginas_descargadas/749.html,EN,sin_categoria,discard,0.30,no_category_detected
750,(Und a $ 858),,$ 10.300,858.0,,,Desconocido,unknown,UNKNOWN,(Und a $ 858),$ 10.300,,,858.00,,$,$858,858.0,False,original,858.0,858.0,1.0,default_1usd,,,,,,,,{},dataset/txt_limpios/750.txt,dataset/paginas_descargadas/750.html,EN,sin_categoria,discard,0.30,no_category_detected
1406,+595994 874276,,Selecciona método de entrega > 580 GR,,,,Desconocido,unknown,UNKNOWN,+595994 874276,Selecciona método de entrega,,580 GR,,,,,234.19,True,country_mean,,234.1938,1.0,default_1usd,,,,,,,,{},dataset/txt_limpios/1406.txt,dataset/paginas_descargadas/1406.html,EN,sin_categoria,discard,0.30,no_category_detected;price_parse_failed
1408,+595994 874276,,Selecciona método de entrega > 850 GR,,,,Desconocido,unknown,UNKNOWN,+595994 874276,Selecciona método de entrega,,850 GR,,,,,234.19,True,country_mean,,234.1938,1.0,default_1usd,,,,,,,,{},dataset/txt_limpios/1408.txt,dataset/paginas_descargadas/1408.html,EN,sin_categoria,discard,0.30,no_category_detected;price_parse_failed
1410,+595994 874276,,Selecciona método de entrega > 700 GR,,,,Desconocido,unknown,UNKNOWN,+595994 874276,Selecciona método de entrega,,700 GR,,,,,234.19,True,country_mean,,234.1938,1.0,default_1usd,,,,,,,,{},dataset/txt_limpios/1410.txt,dataset/paginas_descargadas/1410.html,EN,sin_categoria,discard,0.30,no_category_detected;price_parse_failed
1411,+595994 874276,,Selecciona método de entrega,,,,Desconocido,unknown,UNKNOWN,+595994 874276,Selecciona método de entrega,,,,,,,234.19,True,country_mean,,234.1938,1.0,default_1usd,,,,,,,,{},dataset/txt_limpios/1411.txt,dataset/paginas_descargadas/1411.html,EN,sin_categoria,discard,0.30,no_category_detected;price_parse_failed
1413,+595994 874276,,Selecciona método de entrega > 500 ML,,,,Desconocido,unknown,UNKNOWN,+595994 874276,Selecciona método de entrega,,500 ML,,,,,234.19,True,country_mean,,234.1938,1.0,default_1usd,,,,,,,,{},dataset/txt_limpios/1413.txt,dataset/paginas_descargadas/1413.html,EN,sin_categoria,discard,0.30,no_category_detected;price_parse_failed
1414,+595994 874276,,Selecciona método de entrega > 1 KG,,,,Desconocido,unknown,UNKNOWN,+595994 874276,Selecciona método de entrega,,1 KG,,,,,234.19,True,country_mean,,234.1938,1.0,default_1usd,,,,,,,,{},dataset/txt_limpios/1414.txt,dataset/paginas_descargadas/1414.html,EN,sin_categoria,discard,0.30,no_category_detected;price_parse_failed
1415,+595994 874276,,Selecciona método de entrega > 400 GR,,,,Desconocido,unknown,UNKNOWN,+595994 874276,Selecciona método de entrega,,400 GR,,,,,234.19,True,country_mean,,234.1938,1.0,default_1usd,,,,,,,,{},dataset/txt_limpios/1415.txt,dataset/paginas_descargadas/1415.html,EN,sin_categoria,discard,0.30,no_category_detected;price_parse_failed
1416,+595994 874276,,Selecciona método de entrega > 500 ML,,,,Desconocido,unknown,UNKNOWN,+595994 874276,Selecciona método de entrega,,500 ML,,,,,234.19,True,country_mean,,234.1938,1.0,default_1usd,,,,,,,,{},dataset/txt_limpios/1416.txt,dataset/paginas_descargadas/1416.html,EN,sin_categoria,discard,0.30,no_category_detected;price_parse_failed
1417,+595994 874276,,Selecciona método de entrega,,,,Desconocido,unknown,UNKNOWN,+595994 874276,Selecciona método de entrega,,,,,,,234.19,True,country_mean,,234.1938,1.0,default_1usd,,,,,,,,{},dataset/txt_limpios/1417.txt,dataset/paginas_descargadas/1417.html,EN,sin_categoria,discard,0.30,no_category_detected;price_parse_failed
1418,+595994 874276,,Selecciona método de entrega > 1 LT,,,,Desconocido,unknown,UNKNOWN,+595994 874276,Selecciona método de entrega,,1 LT,,,,,234.19,True,country_mean,,234.1938,1.0,default_1usd,,,,,,,,{},dataset/txt_limpios/1418.txt,dataset/paginas_descargadas/1418.html,EN,sin_categoria,discard,0.30,no_category_detected;price_parse_failed
