{"source_id": "815", "title": "Saltar menú Cenco", "description": "Ingredientes Condición alimentaria Información nutricional Tipo de Producto Papas Grupo Papas y Zapallos Envase Bolsa País de Origen Chile Te podrían interesar Centro de preferencia de privacidad Gestionar las preferencias de consentimiento Activas siempre Back Button Search Icon Filter Icon Clear checkbox label label Apply Cancel Consent Leg.Interest Permitir todas Rechazar todas Confirmar mis preferencias", "breadcrumbs": "Huertos del Ranco > 1 kg", "price_raw": "2.59", "currency_raw": "", "url": "", "seller": "Desconocido", "availability": "unknown", "country": "UNKNOWN", "product_name": "Saltar menú Cenco", "brand": "Huertos del Ranco", "reference": "", "unit": "1 kg", "price_amount": 2.59, "price_currency": "", "price_symbol": "$", "price_text": "$2.59", "price_amount_filled": "2.59", "price_is_imputed": "False", "price_imputation_source": "original", "price_amount_usd": "2.59", "price_amount_usd_filled": "2.59", "fx_rate_local_per_usd": "1.0", "fx_source": "default_1usd", "information_text": "", "description_text": "Ingredientes Condición alimentaria Información nutricional Tipo de Producto Papas Grupo Papas y Zapallos Envase Bolsa País de Origen Chile Te podrían interesar Centro de preferencia de privacidad Gestionar las preferencias de consentimiento Activas siempre Back Button Search Icon Filter Icon Clear checkbox label label Apply Cancel Consent Leg.Interest Permitir todas Rechazar todas Confirmar mis preferencias", "features_text": "", "specifications_text": "", "benefits_text": "", "details_text": "", "other_sections": "", "sections": {"Descripción": ["Ingredientes", "Condición alimentaria", "Información nutricional", "Tipo de Producto", "Papas", "Grupo", "Papas y Zapallos", "Envase", "Bolsa", "País de origen", "Chile", "Te podrían interesar", "Centro de preferencia de privacidad", "Gestionar las preferencias de consentimiento", "Activas siempre", "Back Button", "Search Icon", "Filter Icon", "Clear", "checkbox label", "label", "Apply", "Cancel", "Consent", "Leg.Interest", "Permitir todas", "Rechazar todas", "Confirmar mis preferencias"]}, "txt_path": "dataset/txt_limpios/815.txt", "html_path": "dataset/paginas_descargadas/815.html", "es_status": "ET", "category_canonical": "papa", "decision": "keep", "match_score": 0.6, "reasons": "heuristic_default"}
{"source_id": "816", "title": "Saltar menú Cenco", "description": "", "breadcrumbs": "Frutas y verduras", "price_raw": "", "currency_raw": "", "url": "", "seller": "Desconocido", "availability": "unknown", "country": "UNKNOWN", "product_name": "Saltar menú Cenco", "brand": "Frutas y verduras", "reference": "", "unit": "", "price_amount": null, "price_currency": "", "price_symbol": "", "price_text": "", "price_amount_filled": "234.19", "price_is_imputed": "True", "price_imputation_source": "country_mean", "price_amount_usd": "", "price_amount_usd_filled": "234.1938", "fx_rate_local_per_usd": "1.0", "fx_source": "default_1usd", "information_text": "", "description_text": "", "features_text": "", "specifications_text": "", "benefits_text": "", "details_text": "", "other_sections": "", "sections": {}, "txt_path": "dataset/txt_limpios/816.txt", "html_path": "dataset/paginas_descargadas/816.html", "es_status": "EN", "category_canonical": "sin_categoria", "decision": "discard", "match_score": 0.3, "reasons": "no_category_detected;price_parse_failed"}
{"source_id": "817", "title": "Saltar menú Cenco", "description": "", "breadcrumbs": "Activas siempre", "price_raw": "", "currency_raw": "", "url": "", "seller": "Desconocido", "availability": "unknown", "country": "UNKNOWN", "product_name": "Saltar menú Cenco", "brand": "Activas siempre", "reference": "", "unit": "", "price_amount": null, "price_currency": "", "price_symbol": "", "price_text": "", "price_amount_filled": "234.19", "price_is_imputed": "True", "price_imputation_source": "country_mean", "price_amount_usd": "", "price_amount_usd_filled": "234.1938", "fx_rate_local_per_usd": "1.0", "fx_source": "default_1usd", "information_text": "", "description_text": "", "features_text": "", "specifications_text": "", "benefits_text": "", "details_text": "", "other_sections": "", "sections": {}, "txt_path": "dataset/txt_limpios/817.txt", "html_path": "dataset/paginas_descargadas/817.html", "es_status": "EN", "category_canonical": "sin_categoria", "decision": "discard", "match_score": 0.3, "reasons": "no_category_detected;price_parse_failed"}
{"source_id": "818", "title": "Saltar menú Cenco", "description": "Ingredientes Condición alimentaria Información nutricional Hecho en Jumbo Tipo de Producto Pan de Molde Blanco Porciones 21 Porciones Formato Envasado Envase Bolsa País de Origen Chile Almacenamiento En un lugar fresco y seco Te podrían interesar Colun Mantequilla Colun con Sal 250 g La Preferida Jamón Pierna La Preferida Granel 4.6 Queso Gauda Colun Laminado Granel Centro de preferencia de privacidad Gestionar las preferencias de consentimiento Activas siempre Back Button Search Icon Filter Icon Clear checkbox label label Apply Cancel Consent Leg.Interest Permitir todas Rechazar todas Confirmar mis preferencias", "breadcrumbs": "Oferta > 750 g", "price_raw": "2.39", "currency_raw": "", "url": "", "seller": "Desconocido", "availability": "unknown", "country": "UNKNOWN", "product_name": "Saltar menú Cenco", "brand": "Oferta", "reference": "", "unit": "750 g", "price_amount": 2.39, "price_currency": "", "price_symbol": "$", "price_text": "$2.39", "price_amount_filled": "2.39", "price_is_imputed": "False", "price_imputation_source": "original", "price_amount_usd": "2.39", "price_amount_usd_filled": "2.39", "fx_rate_local_per_usd": "1.0", "fx_source": "default_1usd", "information_text": "", "description_text": "Ingredientes Condición alimentaria Información nutricional Hecho en Jumbo Tipo de Producto Pan de Molde Blanco Porciones 21 Porciones Formato Envasado Envase Bolsa País de Origen Chile Almacenamiento En un lugar fresco y seco Te podrían interesar Colun Mantequilla Colun con Sal 250 g La Preferida Jamón Pierna La Preferida Granel 4.6 Queso Gauda Colun Laminado Granel Centro de preferencia de privacidad Gestionar las preferencias de consentimiento Activas siempre Back Button Search Icon Filter Icon Clear checkbox label label Apply Cancel Consent Leg.Interest Permitir todas Rechazar todas Confirmar mis preferencias", "features_text": "", "specifications_text": "", "benefits_text": "", "details_text": "", "other_sections": "", "sections": {"Descripción": ["Ingredientes", "Condición alimentaria", "Información nutricional", "Hecho en Jumbo", "Tipo de Producto", "Pan de Molde Blanco", "Porciones", "21 Porciones", "Formato", "Envasado", "Envase", "Bolsa", "País de origen", "Chile", "Almacenamiento", "En un lugar fresco y seco", "Te podrían interesar", "Colun", "Mantequilla Colun con Sal 250 g", "La Preferida", "Jamón Pierna La Preferida Granel", "4.6", "Queso Gauda Colun Laminado Granel", "Centro de preferencia de privacidad", "Gestionar las preferencias de consentimiento", "Activas siempre", "Back Button", "Search Icon", "Filter Icon", "Clear", "checkbox label", "label", "Apply", "Cancel", "Consent", "Leg.Interest", "Permitir todas", "Rechazar todas", "Confirmar mis preferencias"]}, "txt_path": "dataset/txt_limpios/818.txt", "html_path": "dataset/paginas_descargadas/818.html", "es_status": "ET", "category_canonical": "pan", "decision": "keep", "match_score": 0.6, "reasons": "heuristic_default"}
{"source_id": "819", "title": "Saltar menú Cenco", "description": "Ingredientes Condición alimentaria Información nutricional Hecho en Jumbo Tipo de Producto Pan de Molde Integral Elaboración Sustentable Masa Madre Porciones 20 Porciones Formato Envasado Envase Bolsa País de Origen Chile Almacenamiento En un lugar fresco y seco Te podrían interesar La Preferida Jamón Pierna La Preferida Granel Colun Queso Gauda Colun Laminado Granel Kraft Mayonesa Kraft 850 g Centro de preferencia de privacidad Gestionar las preferencias de consentimiento Activas siempre Back Button Search Icon Filter Icon Clear checkbox label label Apply Cancel Consent Leg.Interest Permitir todas Rechazar todas Confirmar mis preferencias", "breadcrumbs": "Oferta > 600 g", "price_raw": "2.49", "currency_raw": "", "url": "", "seller": "Desconocido", "availability": "unknown", "country": "UNKNOWN", "product_name": "Saltar menú Cenco", "brand": "Oferta", "reference": "", "unit": "600 g", "price_amount": 2.49, "price_currency": "", "price_symbol": "$", "price_text": "$2.49", "price_amount_filled": "2.49", "price_is_imputed": "False", "price_imputation_source": "original", "price_amount_usd": "2.49", "price_amount_usd_filled": "2.49", "fx_rate_local_per_usd": "1.0", "fx_source": "default_1usd", "information_text": "", "description_text": "Ingredientes Condición alimentaria Información nutricional Hecho en Jumbo Tipo de Producto Pan de Molde Integral Elaboración Sustentable Masa Madre Porciones 20 Porciones Formato Envasado Envase Bolsa País de Origen Chile Almacenamiento En un lugar fresco y seco Te podrían interesar La Preferida Jamón Pierna La Preferida Granel Colun Queso Gauda Colun Laminado Granel Kraft Mayonesa Kraft 850 g Centro de preferencia de privacidad Gestionar las preferencias de consentimiento Activas siempre Back Button Search Icon Filter Icon Clear checkbox label label Apply Cancel Consent Leg.Interest Permitir todas Rechazar todas Confirmar mis preferencias", "features_text": "", "specifications_text": "", "benefits_text": "", "details_text": "", "other_sections": "", "sections": {"Descripción": ["Ingredientes", "Condición alimentaria", "Información nutricional", "Hecho en Jumbo", "Tipo de Producto", "Pan de Molde Integral", "Elaboración Sustentable", "Masa Madre", "Porciones", "20 Porciones", "Formato", "Envasado", "Envase", "Bolsa", "País de origen", "Chile", "Almacenamiento", "En un lugar fresco y seco", "Te podrían interesar", "La Preferida", "Jamón Pierna La Preferida Granel", "Colun", "Queso Gauda Colun Laminado Granel", "Kraft", "Mayonesa Kraft 850 g", "Centro de preferencia de privacidad", "Gestionar las preferencias de consentimiento", "Activas siempre", "Back Button", "Search Icon", "Filter Icon", "Clear", "checkbox label", "label", "Apply", "Cancel", "Consent", "Leg.Interest", "Permitir todas", "Rechazar todas", "Confirmar mis preferencias"]}, "txt_path": "dataset/txt_limpios/819.txt", "html_path": "dataset/paginas_descargadas/819.html", "es_status": "ET", "category_canonical": "pan", "decision": "keep", "match_score": 0.6, "reasons": "heuristic_default"}
{"source_id": "820", "title": "Saltar menú Cenco", "description": "Ingredientes Condición alimentaria Información nutricional Hecho en Jumbo Tipo de Producto Pan de Molde Blanco Envase Bolsa País de Origen Chile Te podrían interesar Río Bueno Receta del Abuelo Jamón Artesanal Receta del Abuelo Granel Frutas y Verduras Propias Tomate Larga Vida Granel (1 A 2 un. Aprox) Centro de preferencia de privacidad Gestionar las preferencias de consentimiento Activas siempre Back Button Search Icon Filter Icon Clear checkbox label label Apply Cancel Consent Leg.Interest Permitir todas Rechazar todas Confirmar mis preferencias", "breadcrumbs": "Castaño > 770 g", "price_raw": "2.99", "currency_raw": "", "url": "", "seller": "Desconocido", "availability": "unknown", "country": "UNKNOWN", "product_name": "Saltar menú Cenco", "brand": "Castaño", "reference": "", "unit": "770 g", "price_amount": 2.99, "price_currency": "", "price_symbol": "$", "price_text": "$2.99", "price_amount_filled": "2.99", "price_is_imputed": "False", "price_imputation_source": "original", "price_amount_usd": "2.99", "price_amount_usd_filled": "2.99", "fx_rate_local_per_usd": "1.0", "fx_source": "default_1usd", "information_text": "", "description_text": "Ingredientes Condición alimentaria Información nutricional Hecho en Jumbo Tipo de Producto Pan de Molde Blanco Envase Bolsa País de Origen Chile Te podrían interesar Río Bueno Receta del Abuelo Jamón Artesanal Receta del Abuelo Granel Frutas y Verduras Propias Tomate Larga Vida Granel (1 A 2 un. Aprox) Centro de preferencia de privacidad Gestionar las preferencias de consentimiento Activas siempre Back Button Search Icon Filter Icon Clear checkbox label label Apply Cancel Consent Leg.Interest Permitir todas Rechazar todas Confirmar mis preferencias", "features_text": "", "specifications_text": "", "benefits_text": "", "details_text": "", "other_sections": "", "sections": {"Descripción": ["Ingredientes", "Condición alimentaria", "Información nutricional", "Hecho en Jumbo", "Tipo de Producto", "Pan de Molde Blanco", "Envase", "Bolsa", "País de origen", "Chile", "Te podrían interesar", "Río Bueno", "Receta del Abuelo", "Jamón Artesanal Receta del Abuelo Granel", "Frutas y Verduras Propias", "Tomate Larga Vida Granel (1 A 2 un. Aprox)", "Centro de preferencia de privacidad", "Gestionar las preferencias de consentimiento", "Activas siempre", "Back Button", "Search Icon", "Filter Icon", "Clear", "checkbox label", "label", "Apply", "Cancel", "Consent", "Leg.Interest", "Permitir todas", "Rechazar todas", "Confirmar mis preferencias"]}, "txt_path": "dataset/txt_limpios/820.txt", "html_path": "dataset/paginas_descargadas/820.html", "es_status": "ET", "category_canonical": "pan", "decision": "keep", "match_score": 0.6, "reasons": "heuristic_default"}
{"source_id": "821", "title": "Saltar menú Cenco", "description": "Ingredientes Condición alimentaria Información nutricional Tipo de Producto Pan de Molde Blanco Envase Bolsa País de Origen Chile Contenido 550 g Almacenamiento Fresco y seco Garantía Mínima Legal Válida hasta su fecha de caducidad Te podrían interesar Quillayes Colun Mantequilla Colun con Sal 250 g Minuto Verde Choclo Congelado Minuto Verde 100% Natural 500 g Centro de preferencia de privacidad Gestionar las preferencias de consentimiento Activas siempre Back Button Search Icon Filter Icon Clear checkbox label label Apply Cancel Consent Leg.Interest Permitir todas Rechazar todas Confirmar mis preferencias", "breadcrumbs": "Exclusivo online > 550 g", "price_raw": "1.99", "currency_raw": "", "url": "", "seller": "Desconocido", "availability": "unknown", "country": "UNKNOWN", "product_name": "Saltar menú Cenco", "brand": "Exclusivo online", "reference": "", "unit": "550 g", "price_amount": 1.99, "price_currency": "", "price_symbol": "$", "price_text": "$1.99", "price_amount_filled": "1.99", "price_is_imputed": "False", "price_imputation_source": "original", "price_amount_usd": "1.99", "price_amount_usd_filled": "1.99", "fx_rate_local_per_usd": "1.0", "fx_source": "default_1usd", "information_text": "", "description_text": "Ingredientes Condición alimentaria Información nutricional Tipo de Producto Pan de Molde Blanco Envase Bolsa País de Origen Chile Contenido 550 g Almacenamiento Fresco y seco Garantía Mínima Legal Válida hasta su fecha de caducidad Te podrían interesar Quillayes Colun Mantequilla Colun con Sal 250 g Minuto Verde Choclo Congelado Minuto Verde 100% Natural 500 g Centro de preferencia de privacidad Gestionar las preferencias de consentimiento Activas siempre Back Button Search Icon Filter Icon Clear checkbox label label Apply Cancel Consent Leg.Interest Permitir todas Rechazar todas Confirmar mis preferencias", "features_text": "", "specifications_text": "", "benefits_text": "", "details_text": "", "other_sections": "", "sections": {"Descripción": ["Ingredientes", "Condición alimentaria", "Información nutricional", "Tipo de Producto", "Pan de Molde Blanco", "Envase", "Bolsa", "País de origen", "Chile", "Contenido", "550 g", "Almacenamiento", "Fresco y seco", "Garantía Mínima Legal", "Válida hasta su fecha de caducidad", "Te podrían interesar", "Quillayes", "Colun", "Mantequilla Colun con Sal 250 g", "Minuto Verde", "Choclo Congelado Minuto Verde 100% Natural 500 g", "Centro de preferencia de privacidad", "Gestionar las preferencias de consentimiento", "Activas siempre", "Back Button", "Search Icon", "Filter Icon", "Clear", "checkbox label", "label", "Apply", "Cancel", "Consent", "Leg.Interest", "Permitir todas", "Rechazar todas", "Confirmar mis preferencias"]}, "txt_path": "dataset/txt_limpios/821.txt", "html_path": "dataset/paginas_descargadas/821.html", "es_status": "ET", "category_canonical": "descartado", "decision": "discard", "match_score": 0.1, "reasons": "excluded_keyword"}
{"source_id": "822", "title": "Saltar menú Cenco", "description": "Ingredientes Condición alimentaria Información nutricional Tipo de Producto Bebidas Gaseosas Cantidad 1 un. Envase Botella plástico desechable (bebidas) Gasificado Sí País de Origen Chile Sabor Cola Variedad Original Tamaño Familiar Contenido Entre 1 y 2 lt Garantía Mínima Legal Válida hasta su fecha de caducidad Te podrían interesar Fiesta Hielo Fiesta 2 kg Kryzpo Papas Fritas Kryzpo Original 130 g 30% dcto. Evercrisp Evercrisp Maní Salado 380 g Centro de preferencia de privacidad Gestionar las preferencias de consentimiento Activas siempre Back Button Search Icon Filter Icon Clear checkbox label label Apply Cancel Consent Leg.Interest Permitir todas Rechazar todas Confirmar mis preferencias", "breadcrumbs": "Exclusivo online > 1.5 L", "price_raw": "6.0", "currency_raw": "", "url": "", "seller": "Desconocido", "availability": "unknown", "country": "UNKNOWN", "product_name": "Saltar menú Cenco", "brand": "Exclusivo online", "reference": "", "unit": "1.5 L", "price_amount": 6.0, "price_currency": "", "price_symbol": "", "price_text": "6", "price_amount_filled": "6.0", "price_is_imputed": "False", "price_imputation_source": "original", "price_amount_usd": "6.0", "price_amount_usd_filled": "6.0", "fx_rate_local_per_usd": "1.0", "fx_source": "default_1usd", "information_text": "", "description_text": "Ingredientes Condición alimentaria Información nutricional Tipo de Producto Bebidas Gaseosas Cantidad 1 un. Envase Botella plástico desechable (bebidas) Gasificado Sí País de Origen Chile Sabor Cola Variedad Original Tamaño Familiar Contenido Entre 1 y 2 lt Garantía Mínima Legal Válida hasta su fecha de caducidad Te podrían interesar Fiesta Hielo Fiesta 2 kg Kryzpo Papas Fritas Kryzpo Original 130 g 30% dcto. Evercrisp Evercrisp Maní Salado 380 g Centro de preferencia de privacidad Gestionar las preferencias de consentimiento Activas siempre Back Button Search Icon Filter Icon Clear checkbox label label Apply Cancel Consent Leg.Interest Permitir todas Rechazar todas Confirmar mis preferencias", "features_text": "", "specifications_text": "", "benefits_text": "", "details_text": "", "other_sections": "", "sections": {"Descripción": ["Ingredientes", "Condición alimentaria", "Información nutricional", "Tipo de Producto", "Bebidas Gaseosas", "Cantidad", "1 un.", "Envase", "Botella plástico desechable (bebidas)", "Gasificado", "Sí", "País de origen", "Chile", "Sabor", "Cola", "Variedad", "Original", "Tamaño", "Familiar", "Contenido", "Entre 1 y 2 lt", "Garantía Mínima Legal", "Válida hasta su fecha de caducidad", "Te podrían interesar", "Fiesta", "Hielo Fiesta 2 kg", "Kryzpo", "Papas Fritas Kryzpo Original 130 g", "30% dcto.", "Evercrisp", "Evercrisp Maní Salado 380 g", "Centro de preferencia de privacidad", "Gestionar las preferencias de consentimiento", "Activas siempre", "Back Button", "Search Icon", "Filter Icon", "Clear", "checkbox label", "label", "Apply", "Cancel", "Consent", "Leg.Interest", "Permitir todas", "Rechazar todas", "Confirmar mis preferencias"]}, "txt_path": "dataset/txt_limpios/822.txt", "html_path": "dataset/paginas_descargadas/822.html", "es_status": "ET", "category_canonical": "descartado", "decision": "discard", "match_score": 0.1, "reasons": "excluded_keyword"}
