{"source_id": "679", "title": "ASESORAMOS TU COMPRA: 📞(601) 6672004, lun a sab de 7am.a 7pm dom hasta las 6pm", "description": "Disfruta con tu familia y amigos todas las deliciosas recetas, que puedes preparar con los productos que encuentras en nuestras tienda jumbo .com Este producto es vendido, facturado y entregado por Cencosud - Colombia Los precios de los productos pueden cambiar dependiendo de la región. Aplican Términos y Condiciones Desactivados Referencia: 0000259 $ 9, 98 x gr CENCOSUD ☆ ¿Todavía tienes tu Tarjeta Cencosud? Solicítala en línea, úsala y obtén un . Aplican términos y condiciones. Solicítala aquí Términos más buscados 1. kefir alpina 2. muebles 3. leche 4. leche alqueria 5. san jorge 6. papel higiénico 7. arroz 8. café 9. cerveza 10. neveras", "breadcrumbs": "otras ciudades consulta aquí > 500gr > 0000259", "price_raw": "4.99", "currency_raw": "COP", "url": "", "seller": "Desconocido", "availability": "unknown", "country": "CO", "product_name": "ASESORAMOS TU COMPRA: 📞(601) 6672004, lun a sab de 7am.a 7pm dom hasta las 6pm", "brand": "otras ciudades consulta aquí", "reference": "259.0", "unit": "500gr", "price_amount": 4.99, "price_currency": "COP", "price_symbol": "$", "price_text": "$4.99", "price_amount_filled": "4.99", "price_is_imputed": "False", "price_imputation_source": "original", "price_amount_usd": "0.0012", "price_amount_usd_filled": "0.0012", "fx_rate_local_per_usd": "4047.0", "fx_source": "from_colombia_cambio_dolar", "information_text": "", "description_text": "Disfruta con tu familia y amigos todas las deliciosas recetas, que puedes preparar con los productos que encuentras en nuestras tienda jumbo .com Este producto es vendido, facturado y entregado por Cencosud - Colombia Los precios de los productos pueden cambiar dependiendo de la región. Aplican Términos y Condiciones Desactivados Referencia: 0000259 $ 9, 98 x gr CENCOSUD ☆ ¿Todavía tienes tu Tarjeta Cencosud? Solicítala en línea, úsala y obtén un . Aplican términos y condiciones. Solicítala aquí Términos más buscados 1. kefir alpina 2. muebles 3. leche 4. leche alqueria 5. san jorge 6. papel higiénico 7. arroz 8. café 9. cerveza 10. neveras", "features_text": "", "specifications_text": "", "benefits_text": "", "details_text": "", "other_sections": "", "sections": {"Descripción": ["Disfruta con tu familia y amigos todas las deliciosas recetas, que puedes preparar con los productos que encuentras en nuestras tienda jumbo .com", "Este producto es vendido, facturado y entregado por", "Cencosud - Colombia", "Los precios de los productos pueden cambiar dependiendo de la región.", "Aplican Términos y Condiciones", "Desactivado", "Referencia: 0000259", "$", "9", ",", "98", "x", "gr", "CENCOSUD", "☆", "¿Todavía tienes tu Tarjeta Cencosud?", "Solicítala en línea, úsala y obtén un", ". Aplican términos y condiciones.", "Solicítala aquí", "Términos más buscados", "1.", "kefir alpina", "2.", "muebles", "3.", "leche", "4.", "leche alqueria", "5.", "san jorge", "6.", "papel higienico", "7.", "arroz", "8.", "cafe", "9.", "cerveza", "10.", "neveras"]}, "txt_path": "dataset/txt_limpios/679.txt", "html_path": "dataset/paginas_descargadas/679.html", "es_status": "ET", "category_canonical": "cafe", "decision": "keep", "match_score": 0.6, "reasons": "heuristic_default"}
{"source_id": "680", "title": "ASESORAMOS TU COMPRA: 📞(601) 6672004, lun a sab de 7am.a 7pm dom hasta las 6pm", "description": "Disfruta con tu familia y amigos todas las deliciosas recetas, que puedes preparar con los productos que encuentras en nuestras tienda jumbo .com Este producto es vendido, facturado y entregado por Cencosud - Colombia Los precios de los productos pueden cambiar dependiendo de la región. Aplican Términos y Condiciones Desactivados Referencia: 0002432 $ 5 x gr A GRANEL ★ ☆ (3) ¿Todavía tienes tu Tarjeta Cencosud? Solicítala en línea, úsala y obtén un . Aplican términos y condiciones. Solicítala aquí Términos más buscados 1. kefir alpina 2. muebles 3. leche 4. leche alqueria 5. san jorge 6. papel higiénico 7. arroz 8. café 9. cerveza 10. neveras", "breadcrumbs": "otras ciudades consulta aquí > 500gr > 0002432", "price_raw": "2.5", "currency_raw": "COP", "url": "", "seller": "Desconocido", "availability": "unknown", "country": "CO", "product_name": "ASESORAMOS TU COMPRA: 📞(601) 6672004, lun a sab de 7am.a 7pm dom hasta las 6pm", "brand": "otras ciudades consulta aquí", "reference": "2432.0", "unit": "500gr", "price_amount": 2.5, "price_currency": "COP", "price_symbol": "$", "price_text": "$2.50", "price_amount_filled": "2.5", "price_is_imputed": "False", "price_imputation_source": "original", "price_amount_usd": "0.0006", "price_amount_usd_filled": "0.0006", "fx_rate_local_per_usd": "4047.0", "fx_source": "from_colombia_cambio_dolar", "information_text": "", "description_text": "Disfruta con tu familia y amigos todas las deliciosas recetas, que puedes preparar con los productos que encuentras en nuestras tienda jumbo .com Este producto es vendido, facturado y entregado por Cencosud - Colombia Los precios de los productos pueden cambiar dependiendo de la región. Aplican Términos y Condiciones Desactivados Referencia: 0002432 $ 5 x gr A GRANEL ★ ☆ (3) ¿Todavía tienes tu Tarjeta Cencosud? Solicítala en línea, úsala y obtén un . Aplican términos y condiciones. Solicítala aquí Términos más buscados 1. kefir alpina 2. muebles 3. leche 4. leche alqueria 5. san jorge 6. papel higiénico 7. arroz 8. café 9. cerveza 10. neveras", "features_text": "", "specifications_text": "", "benefits_text": "", "details_text": "", "other_sections": "", "sections": {"Descripción": ["Disfruta con tu familia y amigos todas las deliciosas recetas, que puedes preparar con los productos que encuentras en nuestras tienda jumbo .com", "Este producto es vendido, facturado y entregado por", "Cencosud - Colombia", "Los precios de los productos pueden cambiar dependiendo de la región.", "Aplican Términos y Condiciones", "Desactivado", "Referencia: 0002432", "$", "5", "x", "gr", "A GRANEL", "★", "☆", "(3)", "¿Todavía tienes tu Tarjeta Cencosud?", "Solicítala en línea, úsala y obtén un", ". Aplican términos y condiciones.", "Solicítala aquí", "Términos más buscados", "1.", "kefir alpina", "2.", "muebles", "3.", "leche", "4.", "leche alqueria", "5.", "san jorge", "6.", "papel higienico", "7.", "arroz", "8.", "cafe", "9.", "cerveza", "10.", "neveras"]}, "txt_path": "dataset/txt_limpios/680.txt", "html_path": "dataset/paginas_descargadas/680.html", "es_status": "ET", "category_canonical": "cafe", "decision": "keep", "match_score": 0.6, "reasons": "heuristic_default"}
{"source_id": "681", "title": "ASESORAMOS TU COMPRA: 📞(601) 6672004, lun a sab de 7am.a 7pm dom hasta las 6pm", "description": "Este producto es vendido, facturado y entregado por Cencosud - Colombia Los precios de los productos pueden cambiar dependiendo de la región. Aplican Términos y Condiciones Desactivados Referencia: 0821572 $ 19, 49 x gr DISTRIBUIDORA DE ALIMENTOS NO ☆ ¿Todavía tienes tu Tarjeta Cencosud? Solicítala en línea, úsala y obtén un . Aplican términos y condiciones. Solicítala aquí Términos más buscados 1. kefir alpina 2. muebles 3. leche 4. leche alqueria 5. san jorge 6. papel higiénico 7. arroz 8. café 9. cerveza 10. neveras", "breadcrumbs": "otras ciudades consulta aquí > 1000 gr > 0821572", "price_raw": "19.49", "currency_raw": "COP", "url": "", "seller": "Desconocido", "availability": "unknown", "country": "CO", "product_name": "ASESORAMOS TU COMPRA: 📞(601) 6672004, lun a sab de 7am.a 7pm dom hasta las 6pm", "brand": "otras ciudades consulta aquí", "reference": "821572.0", "unit": "1000 gr", "price_amount": 19.49, "price_currency": "COP", "price_symbol": "$", "price_text": "$19.49", "price_amount_filled": "19.49", "price_is_imputed": "False", "price_imputation_source": "original", "price_amount_usd": "0.0048", "price_amount_usd_filled": "0.0048", "fx_rate_local_per_usd": "4047.0", "fx_source": "from_colombia_cambio_dolar", "information_text": "", "description_text": "Este producto es vendido, facturado y entregado por Cencosud - Colombia Los precios de los productos pueden cambiar dependiendo de la región. Aplican Términos y Condiciones Desactivados Referencia: 0821572 $ 19, 49 x gr DISTRIBUIDORA DE ALIMENTOS NO ☆ ¿Todavía tienes tu Tarjeta Cencosud? Solicítala en línea, úsala y obtén un . Aplican términos y condiciones. Solicítala aquí Términos más buscados 1. kefir alpina 2. muebles 3. leche 4. leche alqueria 5. san jorge 6. papel higiénico 7. arroz 8. café 9. cerveza 10. neveras", "features_text": "", "specifications_text": "", "benefits_text": "", "details_text": "", "other_sections": "", "sections": {"Descripción": ["Este producto es vendido, facturado y entregado por", "Cencosud - Colombia", "Los precios de los productos pueden cambiar dependiendo de la región.", "Aplican Términos y Condiciones", "Desactivado", "Referencia: 0821572", "$", "19", ",", "49", "x", "gr", "DISTRIBUIDORA DE ALIMENTOS NO", "☆", "¿Todavía tienes tu Tarjeta Cencosud?", "Solicítala en línea, úsala y obtén un", ". Aplican términos y condiciones.", "Solicítala aquí", "Términos más buscados", "1.", "kefir alpina", "2.", "muebles", "3.", "leche", "4.", "leche alqueria", "5.", "san jorge", "6.", "papel higienico", "7.", "arroz", "8.", "cafe", "9.", "cerveza", "10.", "neveras"]}, "txt_path": "dataset/txt_limpios/681.txt", "html_path": "dataset/paginas_descargadas/681.html", "es_status": "ET", "category_canonical": "cafe", "decision": "keep", "match_score": 0.6, "reasons": "heuristic_default"}
{"source_id": "682", "title": "ASESORAMOS TU COMPRA: 📞(601) 6672004, lun a sab de 7am.a 7pm dom hasta las 6pm", "description": "Disfruta de una deliciosa fruta ideal para alimentar tu cuerpo con propiedades de gran beneficio. Este producto es vendido, facturado y entregado por Cencosud - Colombia Los precios de los productos pueden cambiar dependiendo de la región. Aplican Términos y Condiciones Desactivados Referencia: 0011567 $ 3 , 68 x gr CENCOSUD ☆ ¿Todavía tienes tu Tarjeta Cencosud? Solicítala en línea, úsala y obtén un . Aplican términos y condiciones. Solicítala aquí Términos más buscados 1. kefir alpina 2. muebles 3. leche 4. leche alqueria 5. san jorge 6. papel higiénico 7. arroz 8. café 9. cerveza 10. neveras", "breadcrumbs": "otras ciudades consulta aquí > 500 gr > 0011567", "price_raw": "1.84", "currency_raw": "COP", "url": "", "seller": "Desconocido", "availability": "unknown", "country": "CO", "product_name": "ASESORAMOS TU COMPRA: 📞(601) 6672004, lun a sab de 7am.a 7pm dom hasta las 6pm", "brand": "otras ciudades consulta aquí", "reference": "11567.0", "unit": "500 gr", "price_amount": 1.84, "price_currency": "COP", "price_symbol": "$", "price_text": "$1.84", "price_amount_filled": "1.84", "price_is_imputed": "False", "price_imputation_source": "original", "price_amount_usd": "0.0005", "price_amount_usd_filled": "0.0005", "fx_rate_local_per_usd": "4047.0", "fx_source": "from_colombia_cambio_dolar", "information_text": "", "description_text": "Disfruta de una deliciosa fruta ideal para alimentar tu cuerpo con propiedades de gran beneficio. Este producto es vendido, facturado y entregado por Cencosud - Colombia Los precios de los productos pueden cambiar dependiendo de la región. Aplican Términos y Condiciones Desactivados Referencia: 0011567 $ 3 , 68 x gr CENCOSUD ☆ ¿Todavía tienes tu Tarjeta Cencosud? Solicítala en línea, úsala y obtén un . Aplican términos y condiciones. Solicítala aquí Términos más buscados 1. kefir alpina 2. muebles 3. leche 4. leche alqueria 5. san jorge 6. papel higiénico 7. arroz 8. café 9. cerveza 10. neveras", "features_text": "", "specifications_text": "", "benefits_text": "", "details_text": "", "other_sections": "", "sections": {"Descripción": ["Disfruta de una deliciosa fruto ideal para alimentar tu cuerpo con propiedades de gran beneficio.", "Este producto es vendido, facturado y entregado por", "Cencosud - Colombia", "Los precios de los productos pueden cambiar dependiendo de la región.", "Aplican Términos y Condiciones", "Desactivado", "Referencia: 0011567", "$", "3", ",", "68", "x", "gr", "CENCOSUD", "☆", "¿Todavía tienes tu Tarjeta Cencosud?", "Solicítala en línea, úsala y obtén un", ". Aplican términos y condiciones.", "Solicítala aquí", "Términos más buscados", "1.", "kefir alpina", "2.", "muebles", "3.", "leche", "4.", "leche alqueria", "5.", "san jorge", "6.", "papel higienico", "7.", "arroz", "8.", "cafe", "9.", "cerveza", "10.", "neveras"]}, "txt_path": "dataset/txt_limpios/682.txt", "html_path": "dataset/paginas_descargadas/682.html", "es_status": "ET", "category_canonical": "cafe", "decision": "keep", "match_score": 0.6, "reasons": "heuristic_default"}
{"source_id": "683", "title": "ASESORAMOS TU COMPRA: 📞(601) 6672004, lun a sab de 7am.a 7pm dom hasta las 6pm", "description": "Consume estos deliciosos frutos secos el emplealos para acompañar tus preparaciones favoritas, aprovecha los beneficios que estos brindan a tu cuerpo y pidelo ahora en tiendasjumbo.co Este producto es vendido, facturado y entregado por Cencosud - Colombia Los precios de los productos pueden cambiar dependiendo de la región. Aplican Términos y Condiciones Desactivados Referencia: 0786758 $ 59 , 9 x gr INSUALIMENTOS ☆ ¿Todavía tienes tu Tarjeta Cencosud? Solicítala en línea, úsala y obtén un . Aplican términos y condiciones. Solicítala aquí Términos más buscados 1. kefir alpina 2. muebles 3. leche 4. leche alqueria 5. san jorge 6. papel higiénico 7. arroz 8. café 9. cerveza 10. neveras", "breadcrumbs": "otras ciudades consulta aquí > 200 gr > 0786758", "price_raw": "11.98", "currency_raw": "COP", "url": "", "seller": "Desconocido", "availability": "unknown", "country": "CO", "product_name": "ASESORAMOS TU COMPRA: 📞(601) 6672004, lun a sab de 7am.a 7pm dom hasta las 6pm", "brand": "otras ciudades consulta aquí", "reference": "786758.0", "unit": "200 gr", "price_amount": 11.98, "price_currency": "COP", "price_symbol": "$", "price_text": "$11.98", "price_amount_filled": "11.98", "price_is_imputed": "False", "price_imputation_source": "original", "price_amount_usd": "0.003", "price_amount_usd_filled": "0.003", "fx_rate_local_per_usd": "4047.0", "fx_source": "from_colombia_cambio_dolar", "information_text": "", "description_text": "Consume estos deliciosos frutos secos el emplealos para acompañar tus preparaciones favoritas, aprovecha los beneficios que estos brindan a tu cuerpo y pidelo ahora en tiendasjumbo.co Este producto es vendido, facturado y entregado por Cencosud - Colombia Los precios de los productos pueden cambiar dependiendo de la región. Aplican Términos y Condiciones Desactivados Referencia: 0786758 $ 59 , 9 x gr INSUALIMENTOS ☆ ¿Todavía tienes tu Tarjeta Cencosud? Solicítala en línea, úsala y obtén un . Aplican términos y condiciones. Solicítala aquí Términos más buscados 1. kefir alpina 2. muebles 3. leche 4. leche alqueria 5. san jorge 6. papel higiénico 7. arroz 8. café 9. cerveza 10. neveras", "features_text": "", "specifications_text": "", "benefits_text": "", "details_text": "", "other_sections": "", "sections": {"Descripción": ["Consume estos deliciosos frutos secos o emplealos para acompañar tus preparaciones favoritas, aprovecha los beneficios que estos brindan a tu cuerpo y pidelo ahora en tiendasjumbo.co", "Este producto es vendido, facturado y entregado por", "Cencosud - Colombia", "Los precios de los productos pueden cambiar dependiendo de la región.", "Aplican Términos y Condiciones", "Desactivado", "Referencia: 0786758", "$", "59", ",", "9", "x", "gr", "INSUALIMENTOS", "☆", "¿Todavía tienes tu Tarjeta Cencosud?", "Solicítala en línea, úsala y obtén un", ". Aplican términos y condiciones.", "Solicítala aquí", "Términos más buscados", "1.", "kefir alpina", "2.", "muebles", "3.", "leche", "4.", "leche alqueria", "5.", "san jorge", "6.", "papel higienico", "7.", "arroz", "8.", "cafe", "9.", "cerveza", "10.", "neveras"]}, "txt_path": "dataset/txt_limpios/683.txt", "html_path": "dataset/paginas_descargadas/683.html", "es_status": "ET", "category_canonical": "cafe", "decision": "keep", "match_score": 0.6, "reasons": "heuristic_default"}
{"source_id": "684", "title": "ASESORAMOS TU COMPRA: 📞(601) 6672004, lun a sab de 7am.a 7pm dom hasta las 6pm", "description": "", "breadcrumbs": "otras ciudades consulta aquí > 500gr > 0002429", "price_raw": "3.29", "currency_raw": "COP", "url": "", "seller": "Desconocido", "availability": "unknown", "country": "CO", "product_name": "ASESORAMOS TU COMPRA: 📞(601) 6672004, lun a sab de 7am.a 7pm dom hasta las 6pm", "brand": "otras ciudades consulta aquí", "reference": "2429.0", "unit": "500gr", "price_amount": 3.29, "price_currency": "COP", "price_symbol": "$", "price_text": "$3.29", "price_amount_filled": "3.29", "price_is_imputed": "False", "price_imputation_source": "original", "price_amount_usd": "0.0008", "price_amount_usd_filled": "0.0008", "fx_rate_local_per_usd": "4047.0", "fx_source": "from_colombia_cambio_dolar", "information_text": "", "description_text": "", "features_text": "", "specifications_text": "", "benefits_text": "", "details_text": "", "other_sections": "", "sections": {}, "txt_path": "dataset/txt_limpios/684.txt", "html_path": "dataset/paginas_descargadas/684.html", "es_status": "ET", "category_canonical": "sin_categoria", "decision": "discard", "match_score": 0.3, "reasons": "no_category_detected"}
{"source_id": "685", "title": "ASESORAMOS TU COMPRA: 📞(601) 6672004, lun a sab de 7am.a 7pm dom hasta las 6pm", "description": "Este producto no puede faltar en tu cocina, disfruta de todo su sabor. Este producto es vendido, facturado y entregado por Cencosud - Colombia Los precios de los productos pueden cambiar dependiendo de la región. Aplican Términos y Condiciones Desactivados Referencia: 0225307 $ 9 x gr CENCOSUD ☆ ¿Todavía tienes tu Tarjeta Cencosud? Solicítala en línea, úsala y obtén un . Aplican términos y condiciones. Solicítala aquí Términos más buscados 1. kefir alpina 2. muebles 3. leche 4. leche alqueria 5. san jorge 6. papel higiénico 7. arroz 8. café 9. cerveza 10. neveras", "breadcrumbs": "otras ciudades consulta aquí > 0225307", "price_raw": "17.99", "currency_raw": "COP", "url": "", "seller": "Desconocido", "availability": "unknown", "country": "CO", "product_name": "ASESORAMOS TU COMPRA: 📞(601) 6672004, lun a sab de 7am.a 7pm dom hasta las 6pm", "brand": "otras ciudades consulta aquí", "reference": "225307.0", "unit": "", "price_amount": 17.99, "price_currency": "COP", "price_symbol": "$", "price_text": "$17.99", "price_amount_filled": "17.99", "price_is_imputed": "False", "price_imputation_source": "original", "price_amount_usd": "0.0044", "price_amount_usd_filled": "0.0044", "fx_rate_local_per_usd": "4047.0", "fx_source": "from_colombia_cambio_dolar", "information_text": "", "description_text": "Este producto no puede faltar en tu cocina, disfruta de todo su sabor. Este producto es vendido, facturado y entregado por Cencosud - Colombia Los precios de los productos pueden cambiar dependiendo de la región. Aplican Términos y Condiciones Desactivados Referencia: 0225307 $ 9 x gr CENCOSUD ☆ ¿Todavía tienes tu Tarjeta Cencosud? Solicítala en línea, úsala y obtén un . Aplican términos y condiciones. Solicítala aquí Términos más buscados 1. kefir alpina 2. muebles 3. leche 4. leche alqueria 5. san jorge 6. papel higiénico 7. arroz 8. café 9. cerveza 10. neveras", "features_text": "", "specifications_text": "", "benefits_text": "", "details_text": "", "other_sections": "", "sections": {"Descripción": ["Este producto no puede faltar en tu cocina, disfruta de todo su sabor.", "Este producto es vendido, facturado y entregado por", "Cencosud - Colombia", "Los precios de los productos pueden cambiar dependiendo de la región.", "Aplican Términos y Condiciones", "Desactivado", "Referencia: 0225307", "$", "9", "x", "gr", "CENCOSUD", "☆", "¿Todavía tienes tu Tarjeta Cencosud?", "Solicítala en línea, úsala y obtén un", ". Aplican términos y condiciones.", "Solicítala aquí", "Términos más buscados", "1.", "kefir alpina", "2.", "muebles", "3.", "leche", "4.", "leche alqueria", "5.", "san jorge", "6.", "papel higienico", "7.", "arroz", "8.", "cafe", "9.", "cerveza", "10.", "neveras"]}, "txt_path": "dataset/txt_limpios/685.txt", "html_path": "dataset/paginas_descargadas/685.html", "es_status": "ET", "category_canonical": "cafe", "decision": "keep", "match_score": 0.6, "reasons": "heuristic_default"}
