source_id,title,description,breadcrumbs,price_raw,currency_raw,url,seller,availability,country,product_name,brand,reference,unit,price_amount,price_currency,price_symbol,price_text,price_amount_filled,price_is_imputed,price_imputation_source,price_amount_usd,price_amount_usd_filled,fx_rate_local_per_usd,fx_source,information_text,description_text,features_text,specifications_text,benefits_text,details_text,other_sections,sections,txt_path,html_path,es_status,category_canonical,decision,match_score,reasons
1419,+595994 874276,,Selecciona método de entrega > 1 LT,,,,Desconocido,unknown,UNKNOWN,+595994 874276,Selecciona método de entrega,,1 LT,,,,,234.19,True,country_mean,,234.1938,1.0,default_1usd,,,,,,,,{},dataset/txt_limpios/1419.txt,dataset/paginas_descargadas/1419.html,EN,sin_categoria,discard,0.30,no_category_detected;price_parse_failed
1420,+595994 874276,,Selecciona método de entrega > 2 LT,2.0,,,Desconocido,unknown,UNKNOWN,+595994 874276,Selecciona método de entrega,,2 LT,2.00,,,2,2.0,False,original,2.0,2.0,1.0,default_1usd,,,,,,,,{},dataset/txt_limpios/1420.txt,dataset/paginas_descargadas/1420.html,EN,sin_categoria,discard,0.30,no_category_detected
1421,+595994 874276,,Selecciona método de entrega > 750 ML,2.0,,,Desconocido,unknown,UNKNOWN,+595994 874276,Selecciona método de entrega,,750 ML,2.00,,,2,2.0,False,original,2.0,2.0,1.0,default_1usd,,,,,,,,{},dataset/txt_limpios/1421.txt,dataset/paginas_descargadas/1421.html,EN,sin_categoria,discard,0.30,no_category_detected
1422,+595994 874276,,Selecciona método de entrega > 1 KG,,,,Desconocido,unknown,UNKNOWN,+595994 874276,Selecciona método de entrega,,1 KG,,,,,234.19,True,country_mean,,234.1938,1.0,default_1usd,,,,,,,,{},dataset/txt_limpios/1422.txt,dataset/paginas_descargadas/1422.html,EN,sin_categoria,discard,0.30,no_category_detected;price_parse_failed
1423,+595994 874276,,Selecciona método de entrega,,,,Desconocido,unknown,UNKNOWN,+595994 874276,Selecciona método de entrega,,,,,,,234.19,True,country_mean,,234.1938,1.0,default_1usd,,,,,,,,{},dataset/txt_limpios/1423.txt,dataset/paginas_descargadas/1423.html,EN,sin_categoria,discard,0.30,no_category_detected;price_parse_failed
1424,+595994 874276,,Selecciona método de entrega > 400 GR,400.0,,,Desconocido,unknown,UNKNOWN,+595994 874276,Selecciona método de entrega,,400 GR,400.00,,,400,400.0,False,original,400.0,400.0,1.0,default_1usd,,,,,,,,{},dataset/txt_limpios/1424.txt,dataset/paginas_descargadas/1424.html,EN,sin_categoria,discard,0.30,no_category_detected
1425,+595994 874276,,Selecciona método de entrega > 250 GR,,,,Desconocido,unknown,UNKNOWN,+595994 874276,Selecciona método de entrega,,250 GR,,,,,234.19,True,country_mean,,234.1938,1.0,default_1usd,,,,,,,,{},dataset/txt_limpios/1425.txt,dataset/paginas_descargadas/1425.html,EN,sin_categoria,discard,0.30,no_category_detected;price_parse_failed
1426,+595994 874276,,Selecciona método de entrega > 2 LT,2.0,,,Desconocido,unknown,UNKNOWN,+595994 874276,Selecciona método de entrega,,2 LT,2.00,,,2,2.0,False,original,2.0,2.0,1.0,default_1usd,,,,,,,,{},dataset/txt_limpios/1426.txt,dataset/paginas_descargadas/1426.html,EN,sin_categoria,discard,0.30,no_category_detected
1427,+595994 874276,,Selecciona método de entrega > 500 GR,,,,Desconocido,unknown,UNKNOWN,+595994 874276,Selecciona método de entrega,,500 GR,,,,,234.19,True,country_mean,,234.1938,1.0,default_1usd,,,,,,,,{},dataset/txt_limpios/1427.txt,dataset/paginas_descargadas/1427.html,EN,sin_categoria,discard,0.30,no_category_detected;price_parse_failed
1428,+595994 874276,,Selecciona método de entrega > 120 GR,,,,Desconocido,unknown,UNKNOWN,+595994 874276,Selecciona método de entrega,,120 GR,,,,,234.19,True,country_mean,,234.1938,1.0,default_1usd,,,,,,,,{},dataset/txt_limpios/1428.txt,dataset/paginas_descargadas/1428.html,EN,sin_categoria,discard,0.30,no_category_detected;price_parse_failed
1429,+595994 874276,,Selecciona método de entrega > 500 GR,,,,Desconocido,unknown,UNKNOWN,+595994 874276,Selecciona método de entrega,,500 GR,,,,,234.19,True,country_mean,,234.1938,1.0,default_1usd,,,,,,,,{},dataset/txt_limpios/1429.txt,dataset/paginas_descargadas/1429.html,EN,sin_categoria,discard,0.30,no_category_detected;price_parse_failed
1430,+595994 874276,,Selecciona método de entrega > 500 GR,,,,Desconocido,unknown,UNKNOWN,+595994 874276,Selecciona método de entrega,,500 GR,,,,,234.19,True,country_mean,,234.1938,1.0,default_1usd,,,,,,,,{},dataset/txt_limpios/1430.txt,dataset/paginas_descargadas/1430.html,EN,sin_categoria,discard,0.30,no_category_detected;price_parse_failed
1431,+595994 874276,,Selecciona método de entrega > 1 LT,,,,Desconocido,unknown,UNKNOWN,+595994 874276,Selecciona método de entrega,,1 LT,,,,,234.19,True,country_mean,,234.1938,1.0,default_1usd,,,,,,,,{},dataset/txt_limpios/1431.txt,dataset/paginas_descargadas/1431.html,EN,sin_categoria,discard,0.30,no_category_detected;price_parse_failed
1432,+595994 874276,,Selecciona método de entrega > 500 GR,,,,Desconocido,unknown,UNKNOWN,+595994 874276,Selecciona método de entrega,,500 GR,,,,,234.19,True,country_mean,,234.1938,1.0,default_1usd,,,,,,,,{},dataset/txt_limpios/1432.txt,dataset/paginas_descargadas/1432.html,EN,sin_categoria,discard,0.30,no_category_detected;price_parse_failed
1433,+595994 874276,,Selecciona método de entrega > 500 GR,,,,Desconocido,unknown,UNKNOWN,+595994 874276,Selecciona método de entrega,,500 GR,,,,,234.19,True,country_mean,,234.1938,1.0,default_1usd,,,,,,,,{},dataset/txt_limpios/1433.txt,dataset/paginas_descargadas/1433.html,EN,sin_categoria,discard,0.30,no_category_detected;price_parse_failed
1434,+595994 874276,,Selecciona método de entrega > 500 ML,,,,Desconocido,unknown,UNKNOWN,+595994 874276,Selecciona método de entrega,,500 ML,,,,,234.19,True,country_mean,,234.1938,1.0,default_1usd,,,,,,,,{},dataset/txt_limpios/1434.txt,dataset/paginas_descargadas/1434.html,EN,sin_categoria,discard,0.30,no_category_detected;price_parse_failed
1435,+595994 874276,,Selecciona método de entrega > 2 LT,2.0,,,Desconocido,unknown,UNKNOWN,+595994 874276,Selecciona método de entrega,,2 LT,2.00,,,2,2.0,False,original,2.0,2.0,1.0,default_1usd,,,,,,,,{},dataset/txt_limpios/1435.txt,dataset/paginas_descargadas/1435.html,EN,sin_categoria,discard,0.30,no_category_detected
1436,+595994 874276,,Selecciona método de entrega > 750 ML,2.0,,,Desconocido,unknown,UNKNOWN,+595994 874276,Selecciona método de entrega,,750 ML,2.00,,,2,2.0,False,original,2.0,2.0,1.0,default_1usd,,,,,,,,{},dataset/txt_limpios/1436.txt,dataset/paginas_descargadas/1436.html,EN,sin_categoria,discard,0.30,no_category_detected
1437,+595994 874276,,Selecciona método de entrega,,,,Desconocido,unknown,UNKNOWN,+595994 874276,Selecciona método de entrega,,,,,,,234.19,True,country_mean,,234.1938,1.0,default_1usd,,,,,,,,{},dataset/txt_limpios/1437.txt,dataset/paginas_descargadas/1437.html,EN,sin_categoria,discard,0.30,no_category_detected;price_parse_failed
1438,+595994 874276,,Selecciona método de entrega > 1 LT,,,,Desconocido,unknown,UNKNOWN,+595994 874276,Selecciona método de entrega,,1 LT,,,,,234.19,True,country_mean,,234.1938,1.0,default_1usd,,,,,,,,{},dataset/txt_limpios/1438.txt,dataset/paginas_descargadas/1438.html,EN,sin_categoria,discard,0.30,no_category_detected;price_parse_failed
1439,+595994 874276,,Selecciona método de entrega > 500 ML,,,,Desconocido,unknown,UNKNOWN,+595994 874276,Selecciona método de entrega,,500 ML,,,,,234.19,True,country_mean,,234.1938,1.0,default_1usd,,,,,,,,{},dataset/txt_limpios/1439.txt,dataset/paginas_descargadas/1439.html,EN,sin_categoria,discard,0.30,no_category_detected;price_parse_failed
1440,+595994 874276,,Selecciona método de entrega > 1 LT,,,,Desconocido,unknown,UNKNOWN,+595994 874276,Selecciona método de entrega,,1 LT,,,,,234.19,True,country_mean,,234.1938,1.0,default_1usd,,,,,,,,{},dataset/txt_limpios/1440.txt,dataset/paginas_descargadas/1440.html,EN,sin_categoria,discard,0.30,no_category_detected;price_parse_failed
1441,+595994 874276,,Selecciona método de entrega > 1 LT,,,,Desconocido,unknown,UNKNOWN,+595994 874276,Selecciona método de entrega,,1 LT,,,,,234.19,True,country_mean,,234.1938,1.0,default_1usd,,,,,,,,{},dataset/txt_limpios/1441.txt,dataset/paginas_descargadas/1441.html,EN,sin_categoria,discard,0.30,no_category_detected;price_parse_failed
1442,+595994 874276,,Selecciona método de entrega > 900 ML,,,,Desconocido,unknown,UNKNOWN,+595994 874276,Selecciona método de entrega,,900 ML,,,,,234.19,True,country_mean,,234.1938,1.0,default_1usd,,,,,,,,{},dataset/txt_limpios/1442.txt,dataset/paginas_descargadas/1442.html,EN,sin_categoria,discard,0.30,no_category_detected;price_parse_failed
1443,+595994 874276,,Selecciona método de entrega > 4 KG,,,,Desconocido,unknown,UNKNOWN,+595994 874276,Selecciona método de entrega,,4 KG,,,,,234.19,True,country_mean,,234.1938,1.0,default_1usd,,,,,,,,{},dataset/txt_limpios/1443.txt,dataset/paginas_descargadas/1443.html,EN,sin_categoria,discard,0.30,no_category_detected;price_parse_failed
1444,+595994 874276,,Selecciona método de entrega > 1 KG,,,,Desconocido,unknown,UNKNOWN,+595994 874276,Selecciona método de entrega,,1 KG,,,,,234.19,True,country_mean,,234.1938,1.0,default_1usd,,,,,,,,{},dataset/txt_limpios/1444.txt,dataset/paginas_descargadas/1444.html,EN,sin_categoria,discard,0.30,no_category_detected;price_parse_failed
1445,+595994 874276,,Selecciona método de entrega > 1KG,,,,Desconocido,unknown,UNKNOWN,+595994 874276,Selecciona método de entrega,,1KG,,,,,234.19,True,country_mean,,234.1938,1.0,default_1usd,,,,,,,,{},dataset/txt_limpios/1445.txt,dataset/paginas_descargadas/1445.html,EN,sin_categoria,discard,0.30,no_category_detected;price_parse_failed
1446,+595994 874276,,Selecciona método de entrega > 750 ML,2.0,,,Desconocido,unknown,UNKNOWN,+595994 874276,Selecciona método de entrega,,750 ML,2.00,,,2,2.0,False,original,2.0,2.0,1.0,default_1usd,,,,,,,,{},dataset/txt_limpios/1446.txt,dataset/paginas_descargadas/1446.html,EN,sin_categoria,discard,0.30,no_category_detected
1448,+595994 874276,,Selecciona método de entrega > 750 ML,2.0,,,Desconocido,unknown,UNKNOWN,+595994 874276,Selecciona método de entrega,,750 ML,2.00,,,2,2.0,False,original,2.0,2.0,1.0,default_1usd,,,,,,,,{},dataset/txt_limpios/1448.txt,dataset/paginas_descargadas/1448.html,EN,sin_categoria,discard,0.30,no_category_detected
1449,+595994 874276,,Selecciona método de entrega > 2 LT,2.0,,,Desconocido,unknown,UNKNOWN,+595994 874276,Selecciona método de entrega,,2 LT,2.00,,,2,2.0,False,original,2.0,2.0,1.0,default_1usd,,,,,,,,{},dataset/txt_limpios/1449.txt,dataset/paginas_descargadas/1449.html,EN,sin_categoria,discard,0.30,no_category_detected
1450,+595994 874276,,Selecciona método de entrega > 1 KG,,,,Desconocido,unknown,UNKNOWN,+595994 874276,Selecciona método de entrega,,1 KG,,,,,234.19,True,country_mean,,234.1938,1.0,default_1usd,,,,,,,,{},dataset/txt_limpios/1450.txt,dataset/paginas_descargadas/1450.html,EN,sin_categoria,discard,0.30,no_category_detected;price_parse_failed
1454,+595994 874276,,Selecciona método de entrega > 750 ML,2.0,,,Desconocido,unknown,UNKNOWN,+595994 874276,Selecciona método de entrega,,750 ML,2.00,,,2,2.0,False,original,2.0,2.0,1.0,default_1usd,,,,,,,,{},dataset/txt_limpios/1454.txt,dataset/paginas_descargadas/1454.html,EN,sin_categoria,discard,0.30,no_category_detected
1456,+595994 874276,,Selecciona método de entrega > 2 LT,2.0,,,Desconocido,unknown,UNKNOWN,+595994 874276,Selecciona método de entrega,,2 LT,2.00,,,2,2.0,False,original,2.0,2.0,1.0,default_1usd,,,,,,,,{},dataset/txt_limpios/1456.txt,dataset/paginas_descargadas/1456.html,EN,sin_categoria,discard,0.30,no_category_detected
1461,+595994 874276,,Selecciona método de entrega > 5 KG,,,,Desconocido,unknown,UNKNOWN,+595994 874276,Selecciona método de entrega,,5 KG,,,,,234.19,True,country_mean,,234.1938,1.0,default_1usd,,,,,,,,{},dataset/txt_limpios/1461.txt,dataset/paginas_descargadas/1461.html,EN,sin_categoria,discard,0.30,no_category_detected;price_parse_failed
1463,+595994 874276,,Selecciona método de entrega,,,,Desconocido,unknown,UNKNOWN,+595994 874276,Selecciona método de entrega,,,,,,,234.19,True,country_mean,,234.1938,1.0,default_1usd,,,,,,,,{},dataset/txt_limpios/1463.txt,dataset/paginas_descargadas/1463.html,EN,sin_categoria,discard,0.30,no_category_detected;price_parse_failed
1464,+595994 874276,,Selecciona método de entrega > 700 GR,,,,Desconocido,unknown,UNKNOWN,+595994 874276,Selecciona método de entrega,,700 GR,,,,,234.19,True,country_mean,,234.1938,1.0,default_1usd,,,,,,,,{},dataset/txt_limpios/1464.txt,dataset/paginas_descargadas/1464.html,EN,sin_categoria,discard,0.30,no_category_detected;price_parse_failed
1467,+595994 874276,,Selecciona método de entrega > 125 GR,,,,Desconocido,unknown,UNKNOWN,+595994 874276,Selecciona método de entrega,,125 GR,,,,,234.19,True,country_mean,,234.1938,1.0,default_1usd,,,,,,,,{},dataset/txt_limpios/1467.txt,dataset/paginas_descargadas/1467.html,EN,sin_categoria,discard,0.30,no_category_detected;price_parse_failed
1470,+595994 874276,,Selecciona método de entrega > 450 GR,,,,Desconocido,unknown,UNKNOWN,+595994 874276,Selecciona método de entrega,,450 GR,,,,,234.19,True,country_mean,,234.1938,1.0,default_1usd,,,,,,,,{},dataset/txt_limpios/1470.txt,dataset/paginas_descargadas/1470.html,EN,sin_categoria,discard,0.30,no_category_detected;price_parse_failed
1471,+595994 874276,,"Selecciona método de entrega > 2,5 KG",,,,Desconocido,unknown,UNKNOWN,+595994 874276,Selecciona método de entrega,,"2,5 KG",,,,,234.19,True,country_mean,,234.1938,1.0,default_1usd,,,,,,,,{},dataset/txt_limpios/1471.txt,dataset/paginas_descargadas/1471.html,EN,sin_categoria,discard,0.30,no_category_detected;price_parse_failed
1340,1340,,,,USD,,Desconocido,unknown,US,,,,,,USD,,,2.06,True,country_mean,,2.0638,1.0,default_1usd,,,,,,,,{},dataset/txt_limpios/1340.txt,dataset/paginas_descargadas/1340.html,EN,sin_categoria,discard,0.30,no_category_detected;price_parse_failed
1491,1491,,,,,,Desconocido,unknown,UNKNOWN,,,,,,,,,234.19,True,country_mean,,234.1938,1.0,default_1usd,,,,,,,,{},dataset/txt_limpios/1491.txt,dataset/paginas_descargadas/1491.html,EN,sin_categoria,discard,0.30,no_category_detected;price_parse_failed
1493,1493,,,,,,Desconocido,unknown,UNKNOWN,,,,,,,,,234.19,True,country_mean,,234.1938,1.0,default_1usd,,,,,,,,{},dataset/txt_limpios/1493.txt,dataset/paginas_descargadas/1493.html,EN,sin_categoria,discard,0.30,no_category_detected;price_parse_failed
1495,1495,,,,,,Desconocido,unknown,UNKNOWN,,,,,,,,,234.19,True,country_mean,,234.1938,1.0,default_1usd,,,,,,,,{},dataset/txt_limpios/1495.txt,dataset/paginas_descargadas/1495.html,EN,sin_categoria,discard,0.30,no_category_detected;price_parse_failed
1496,1496,,,,,,Desconocido,unknown,UNKNOWN,,,,,,,,,234.19,True,country_mean,,234.1938,1.0,default_1usd,,,,,,,,{},dataset/txt_limpios/1496.txt,dataset/paginas_descargadas/1496.html,EN,sin_categoria,discard,0.30,no_category_detected;price_parse_failed
1498,1498,,,,,,Desconocido,unknown,UNKNOWN,,,,,,,,,234.19,True,country_mean,,234.1938,1.0,default_1usd,,,,,,,,{},dataset/txt_limpios/1498.txt,dataset/paginas_descargadas/1498.html,EN,sin_categoria,discard,0.30,no_category_detected;price_parse_failed
1501,1501,,,,,,Desconocido,unknown,UNKNOWN,,,,,,,,,234.19,True,country_mean,,234.1938,1.0,default_1usd,,,,,,,,{},dataset/txt_limpios/1501.txt,dataset/paginas_descargadas/1501.html,EN,sin_categoria,discard,0.30,no_category_detected;price_parse_failed
1502,1502,,,,,,Desconocido,unknown,UNKNOWN,,,,,,,,,234.19,True,country_mean,,234.1938,1.0,default_1usd,,,,,,,,{},dataset/txt_limpios/1502.txt,dataset/paginas_descargadas/1502.html,EN,sin_categoria,discard,0.30,no_category_detected;price_parse_failed
1505,1505,,,,,,Desconocido,unknown,UNKNOWN,,,,,,,,,234.19,True,country_mean,,234.1938,1.0,default_1usd,,,,,,,,{},dataset/txt_limpios/1505.txt,dataset/paginas_descargadas/1505.html,EN,sin_categoria,discard,0.30,no_category_detected;price_parse_failed
1507,1507,,,,,,Desconocido,unknown,UNKNOWN,,,,,,,,,234.19,True,country_mean,,234.1938,1.0,default_1usd,,,,,,,,{},dataset/txt_limpios/1507.txt,dataset/paginas_descargadas/1507.html,EN,sin_categoria,discard,0.30,no_category_detected;price_parse_failed
1509,1509,,,,,,Desconocido,unknown,UNKNOWN,,,,,,,,,234.19,True,country_mean,,234.1938,1.0,default_1usd,,,,,,,,{},dataset/txt_limpios/1509.txt,dataset/paginas_descargadas/1509.html,EN,sin_categoria,discard,0.30,no_category_detected;price_parse_failed
1511,1511,,,,,,Desconocido,unknown,UNKNOWN,,,,,,,,,234.19,True,country_mean,,234.1938,1.0,default_1usd,,,,,,,,{},dataset/txt_limpios/1511.txt,dataset/paginas_descargadas/1511.html,EN,sin_categoria,discard,0.30,no_category_detected;price_parse_failed
1513,1513,,,,,,Desconocido,unknown,UNKNOWN,,,,,,,,,234.19,True,country_mean,,234.1938,1.0,default_1usd,,,,,,,,{},dataset/txt_limpios/1513.txt,dataset/paginas_descargadas/1513.html,EN,sin_categoria,discard,0.30,no_category_detected;price_parse_failed
1518,1518,,,,,,Desconocido,unknown,UNKNOWN,,,,,,,,,234.19,True,country_mean,,234.1938,1.0,default_1usd,,,,,,,,{},dataset/txt_limpios/1518.txt,dataset/paginas_descargadas/1518.html,EN,sin_categoria,discard,0.30,no_category_detected;price_parse_failed
1519,1519,,,,,,Desconocido,unknown,UNKNOWN,,,,,,,,,234.19,True,country_mean,,234.1938,1.0,default_1usd,,,,,,,,{},dataset/txt_limpios/1519.txt,dataset/paginas_descargadas/1519.html,EN,sin_categoria,discard,0.30,no_category_detected;price_parse_failed
1520,1520,,,,,,Desconocido,unknown,UNKNOWN,,,,,,,,,234.19,True,country_mean,,234.1938,1.0,default_1usd,,,,,,,,{},dataset/txt_limpios/1520.txt,dataset/paginas_descargadas/1520.html,EN,sin_categoria,discard,0.30,no_category_detected;price_parse_failed
1521,1521,,,,,,Desconocido,unknown,UNKNOWN,,,,,,,,,234.19,True,country_mean,,234.1938,1.0,default_1usd,,,,,,,,{},dataset/txt_limpios/1521.txt,dataset/paginas_descargadas/1521.html,EN,sin_categoria,discard,0.30,no_category_detected;price_parse_failed
1522,1522,,,,,,Desconocido,unknown,UNKNOWN,,,,,,,,,234.19,True,country_mean,,234.1938,1.0,default_1usd,,,,,,,,{},dataset/txt_limpios/1522.txt,dataset/paginas_descargadas/1522.html,EN,sin_categoria,discard,0.30,no_category_detected;price_parse_failed
1523,1523,,,,,,Desconocido,unknown,UNKNOWN,,,,,,,,,234.19,True,country_mean,,234.1938,1.0,default_1usd,,,,,,,,{},dataset/txt_limpios/1523.txt,dataset/paginas_descargadas/1523.html,EN,sin_categoria,discard,0.30,no_category_detected;price_parse_failed
1524,1524,,,,,,Desconocido,unknown,UNKNOWN,,,,,,,,,234.19,True,country_mean,,234.1938,1.0,default_1usd,,,,,,,,{},dataset/txt_limpios/1524.txt,dataset/paginas_descargadas/1524.html,EN,sin_categoria,discard,0.30,no_category_detected;price_parse_failed
1525,1525,,,,,,Desconocido,unknown,UNKNOWN,,,,,,,,,234.19,True,country_mean,,234.1938,1.0,default_1usd,,,,,,,,{},dataset/txt_limpios/1525.txt,dataset/paginas_descargadas/1525.html,EN,sin_categoria,discard,0.30,no_category_detected;price_parse_failed
1526,1526,,,,,,Desconocido,unknown,UNKNOWN,,,,,,,,,234.19,True,country_mean,,234.1938,1.0,default_1usd,,,,,,,,{},dataset/txt_limpios/1526.txt,dataset/paginas_descargadas/1526.html,EN,sin_categoria,discard,0.30,no_category_detected;price_parse_failed
1527,1527,,,,,,Desconocido,unknown,UNKNOWN,,,,,,,,,234.19,True,country_mean,,234.1938,1.0,default_1usd,,,,,,,,{},dataset/txt_limpios/1527.txt,dataset/paginas_descargadas/1527.html,EN,sin_categoria,discard,0.30,no_category_detected;price_parse_failed
1530,1530,,,,,,Desconocido,unknown,UNKNOWN,,,,,,,,,234.19,True,country_mean,,234.1938,1.0,default_1usd,,,,,,,,{},dataset/txt_limpios/1530.txt,dataset/paginas_descargadas/1530.html,EN,sin_categoria,discard,0.30,no_category_detected;price_parse_failed
1532,1532,,,,,,Desconocido,unknown,UNKNOWN,,,,,,,,,234.19,True,country_mean,,234.1938,1.0,default_1usd,,,,,,,,{},dataset/txt_limpios/1532.txt,dataset/paginas_descargadas/1532.html,EN,sin_categoria,discard,0.30,no_category_detected;price_parse_failed
1534,1534,,,,,,Desconocido,unknown,UNKNOWN,,,,,,,,,234.19,True,country_mean,,234.1938,1.0,default_1usd,,,,,,,,{},dataset/txt_limpios/1534.txt,dataset/paginas_descargadas/1534.html,EN,sin_categoria,discard,0.30,no_category_detected;price_parse_failed
1536,1536,,,,,,Desconocido,unknown,UNKNOWN,,,,,,,,,234.19,True,country_mean,,234.1938,1.0,default_1usd,,,,,,,,{},dataset/txt_limpios/1536.txt,dataset/paginas_descargadas/1536.html,EN,sin_categoria,discard,0.30,no_category_detected;price_parse_failed
1539,1539,,,,,,Desconocido,unknown,UNKNOWN,,,,,,,,,234.19,True,country_mean,,234.1938,1.0,default_1usd,,,,,,,,{},dataset/txt_limpios/1539.txt,dataset/paginas_descargadas/1539.html,EN,sin_categoria,discard,0.30,no_category_detected;price_parse_failed
1540,1540,,,,,,Desconocido,unknown,UNKNOWN,,,,,,,,,234.19,True,country_mean,,234.1938,1.0,default_1usd,,,,,,,,{},dataset/txt_limpios/1540.txt,dataset/paginas_descargadas/1540.html,EN,sin_categoria,discard,0.30,no_category_detected;price_parse_failed
1541,1541,,,,,,Desconocido,unknown,UNKNOWN,,,,,,,,,234.19,True,country_mean,,234.1938,1.0,default_1usd,,,,,,,,{},dataset/txt_limpios/1541.txt,dataset/paginas_descargadas/1541.html,EN,sin_categoria,discard,0.30,no_category_detected;price_parse_failed
1545,1545,,,,,,Desconocido,unknown,UNKNOWN,,,,,,,,,234.19,True,country_mean,,234.1938,1.0,default_1usd,,,,,,,,{},dataset/txt_limpios/1545.txt,dataset/paginas_descargadas/1545.html,EN,sin_categoria,discard,0.30,no_category_detected;price_parse_failed
1546,1546,,,,,,Desconocido,unknown,UNKNOWN,,,,,,,,,234.19,True,country_mean,,234.1938,1.0,default_1usd,,,,,,,,{},dataset/txt_limpios/1546.txt,dataset/paginas_descargadas/1546.html,EN,sin_categoria,discard,0.30,no_category_detected;price_parse_failed
1549,1549,,,,,,Desconocido,unknown,UNKNOWN,,,,,,,,,234.19,True,country_mean,,234.1938,1.0,default_1usd,,,,,,,,{},dataset/txt_limpios/1549.txt,dataset/paginas_descargadas/1549.html,EN,sin_categoria,discard,0.30,no_category_detected;price_parse_failed
