{"source_id": "1515", "title": "Horarios de entrega", "description": "", "breadcrumbs": "LISTA > 400 GRAMOS", "price_raw": "400.0", "currency_raw": "", "url": "", "seller": "Desconocido", "availability": "unknown", "country": "UNKNOWN", "product_name": "Horarios de entrega", "brand": "LISTA", "reference": "", "unit": "400 GRAMOS", "price_amount": 400.0, "price_currency": "", "price_symbol": "", "price_text": "400", "price_amount_filled": "400.0", "price_is_imputed": "False", "price_imputation_source": "original", "price_amount_usd": "400.0", "price_amount_usd_filled": "400.0", "fx_rate_local_per_usd": "1.0", "fx_source": "default_1usd", "information_text": "", "description_text": "", "features_text": "", "specifications_text": "", "benefits_text": "", "details_text": "", "other_sections": "", "sections": {}, "txt_path": "dataset/txt_limpios/1515.txt", "html_path": "dataset/paginas_descargadas/1515.html", "es_status": "EN", "category_canonical": "sin_categoria", "decision": "discard", "match_score": 0.3, "reasons": "no_category_detected"}
{"source_id": "1516", "title": "Horarios de entrega", "description": "", "breadcrumbs": "LISTA > 1 KG", "price_raw": "1.0", "currency_raw": "", "url": "", "seller": "Desconocido", "availability": "unknown", "country": "UNKNOWN", "product_name": "Horarios de entrega", "brand": "LISTA", "reference": "", "unit": "1 KG", "price_amount": 1.0, "price_currency": "", "price_symbol": "", "price_text": "1", "price_amount_filled": "1.0", "price_is_imputed": "False", "price_imputation_source": "original", "price_amount_usd": "1.0", "price_amount_usd_filled": "1.0", "fx_rate_local_per_usd": "1.0", "fx_source": "default_1usd", "information_text": "", "description_text": "", "features_text": "", "specifications_text": "", "benefits_text": "", "details_text": "", "other_sections": "", "sections": {}, "txt_path": "dataset/txt_limpios/1516.txt", "html_path": "dataset/paginas_descargadas/1516.html", "es_status": "EN", "category_canonical": "sin_categoria", "decision": "discard", "match_score": 0.3, "reasons": "no_category_detected"}
{"source_id": "1517", "title": "Horarios de entrega", "description": "", "breadcrumbs": "LISTA > 1 LITRO", "price_raw": "", "currency_raw": "", "url": "", "seller": "Desconocido", "availability": "unknown", "country": "UNKNOWN", "product_name": "Horarios de entrega", "brand": "LISTA", "reference": "", "unit": "1 LITRO", "price_amount": null, "price_currency": "", "price_symbol": "", "price_text": "", "price_amount_filled": "234.19", "price_is_imputed": "True", "price_imputation_source": "country_mean", "price_amount_usd": "", "price_amount_usd_filled": "234.1938", "fx_rate_local_per_usd": "1.0", "fx_source": "default_1usd", "information_text": "", "description_text": "", "features_text": "", "specifications_text": "", "benefits_text": "", "details_text": "", "other_sections": "", "sections": {}, "txt_path": "dataset/txt_limpios/1517.txt", "html_path": "dataset/paginas_descargadas/1517.html", "es_status": "EN", "category_canonical": "sin_categoria", "decision": "discard", "match_score": 0.3, "reasons": "no_category_detected;price_parse_failed"}
{"source_id": "524", "title": "Huevos Blanco", "description": "", "breadcrumbs": "Descripción del producto > 500 Gr", "price_raw": "627.25", "currency_raw": "", "url": "", "seller": "Desconocido", "availability": "unknown", "country": "UNKNOWN", "product_name": "Huevos Blanco", "brand": "Descripción del producto", "reference": "", "unit": "500 Gr", "price_amount": 627.25, "price_currency": "", "price_symbol": "$", "price_text": "$627,25", "price_amount_filled": "627.25", "price_is_imputed": "False", "price_imputation_source": "original", "price_amount_usd": "627.25", "price_amount_usd_filled": "627.25", "fx_rate_local_per_usd": "1.0", "fx_source": "default_1usd", "information_text": "", "description_text": "", "features_text": "Últimos consultados | 35%DTO | Espagueti FAVORITA 500 Gr | PRECIO CON 35%DTO | Ver planes de cuotas | Fid.Lar. Sin Spaghetti Nuev Delverde Paq 500 Grm | Espagueti BARILLA Caja 500 Gr | Fideos Tallarin N° 5 Matarazzo 500g | Fideos Tallarin N5 Lucchetti 500g", "specifications_text": "", "benefits_text": "", "details_text": "", "other_sections": "", "sections": {"Características": ["Últimos consultados", "35%DTO", "Espagueti FAVORITA      500 Gr", "PRECIO CON 35%DTO", "Ver planes de cuotas", "Fid.Lar.Sem Spaghetti Nuev Delverde Paq 500 Grm", "Espagueti BARILLA Caja 500 Gr", "Fideos Tallarin N° 5 Matarazzo 500g", "Fideos Tallarin N5 Lucchetti 500g"]}, "txt_path": "dataset/txt_limpios/524.txt", "html_path": "dataset/paginas_descargadas/524.html", "es_status": "ET", "category_canonical": "huevo", "decision": "discard", "match_score": 0.3, "reasons": "heuristic_default"}
{"source_id": "525", "title": "Huevos Blanco", "description": "", "breadcrumbs": "Descripción del producto > 500 Gr", "price_raw": "3961.0", "currency_raw": "", "url": "", "seller": "Desconocido", "availability": "unknown", "country": "UNKNOWN", "product_name": "Huevos Blanco", "brand": "Descripción del producto", "reference": "", "unit": "500 Gr", "price_amount": 3961.0, "price_currency": "", "price_symbol": "$", "price_text": "$3.961,00", "price_amount_filled": "3961.0", "price_is_imputed": "False", "price_imputation_source": "original", "price_amount_usd": "3961.0", "price_amount_usd_filled": "3961.0", "fx_rate_local_per_usd": "1.0", "fx_source": "default_1usd", "information_text": "", "description_text": "", "features_text": "MARCA | : COTO | Últimos consultados | 15%DTO | Huevo Blanco Extra 12u | PRECIO CON 15%DTO | Ver planes de cuotas | 35%DTO | Espagueti FAVORITA 500 Gr | PRECIO CON 35%DTO | Fid.Lar. Sin Spaghetti Nuev Delverde Paq 500 Grm | Espagueti BARILLA Caja 500 Gr | Fideos Tallarin N° 5 Matarazzo 500g", "specifications_text": "", "benefits_text": "", "details_text": "", "other_sections": "", "sections": {"Características": ["MARCA", ": COTO", "Últimos consultados", "15%DTO", "Huevo Blanco Extra 12u", "PRECIO CON 15%DTO", "Ver planes de cuotas", "35%DTO", "Espagueti FAVORITA      500 Gr", "PRECIO CON 35%DTO", "Fid.Lar.Sem Spaghetti Nuev Delverde Paq 500 Grm", "Espagueti BARILLA Caja 500 Gr", "Fideos Tallarin N° 5 Matarazzo 500g"]}, "txt_path": "dataset/txt_limpios/525.txt", "html_path": "dataset/paginas_descargadas/525.html", "es_status": "ET", "category_canonical": "huevo", "decision": "discard", "match_score": 0.3, "reasons": "heuristic_default"}
{"source_id": "526", "title": "Huevos Blanco", "description": "", "breadcrumbs": "Descripción del producto > 500 Gr", "price_raw": "4241.5", "currency_raw": "", "url": "", "seller": "Desconocido", "availability": "unknown", "country": "UNKNOWN", "product_name": "Huevos Blanco", "brand": "Descripción del producto", "reference": "", "unit": "500 Gr", "price_amount": 4241.5, "price_currency": "", "price_symbol": "$", "price_text": "$4.241,50", "price_amount_filled": "4241.5", "price_is_imputed": "False", "price_imputation_source": "original", "price_amount_usd": "4241.5", "price_amount_usd_filled": "4241.5", "fx_rate_local_per_usd": "1.0", "fx_source": "default_1usd", "information_text": "", "description_text": "", "features_text": "MARCA | : AVICOLA BRANDSEN | Últimos consultados | 15%DTO | Huevo Blanco . Coto Bli 12 Uni | PRECIO CON 15%DTO | Ver planes de cuotas | Huevo Blanco Extra 12u | 35%DTO | Espagueti FAVORITA 500 Gr | PRECIO CON 35%DTO | Fid.Lar. Sin Spaghetti Nuev Delverde Paq 500 Grm | Espagueti BARILLA Caja 500 Gr", "specifications_text": "", "benefits_text": "", "details_text": "", "other_sections": "", "sections": {"Características": ["MARCA", ": AVICOLA BRANDSEN", "Últimos consultados", "15%DTO", "Huevo Blanco . Coto Bli 12 Uni", "PRECIO CON 15%DTO", "Ver planes de cuotas", "Huevo Blanco Extra 12u", "35%DTO", "Espagueti FAVORITA      500 Gr", "PRECIO CON 35%DTO", "Fid.Lar.Sem Spaghetti Nuev Delverde Paq 500 Grm", "Espagueti BARILLA Caja 500 Gr"]}, "txt_path": "dataset/txt_limpios/526.txt", "html_path": "dataset/paginas_descargadas/526.html", "es_status": "ET", "category_canonical": "huevo", "decision": "discard", "match_score": 0.3, "reasons": "heuristic_default"}
{"source_id": "908", "title": "Huevos blanco grande", "description": "Huevos grande blanco", "breadcrumbs": "12 un", "price_raw": "4.11", "currency_raw": "", "url": "", "seller": "Desconocido", "availability": "unknown", "country": "UNKNOWN", "product_name": "Huevos blanco grande", "brand": "12 un", "reference": "", "unit": "", "price_amount": 4.11, "price_currency": "", "price_symbol": "$", "price_text": "$4.11", "price_amount_filled": "4.11", "price_is_imputed": "False", "price_imputation_source": "original", "price_amount_usd": "4.11", "price_amount_usd_filled": "4.11", "fx_rate_local_per_usd": "1.0", "fx_source": "default_1usd", "information_text": "", "description_text": "Huevos grande blanco", "features_text": "", "specifications_text": "", "benefits_text": "", "details_text": "", "other_sections": "", "sections": {"Descripción": ["Huevos grande blanco"]}, "txt_path": "dataset/txt_limpios/908.txt", "html_path": "dataset/paginas_descargadas/908.html", "es_status": "EN", "category_canonical": "huevo", "decision": "discard", "match_score": 0.3, "reasons": "heuristic_default"}
{"source_id": "527", "title": "Huevos Color", "description": "", "breadcrumbs": "Descripción del producto > 500 Gr", "price_raw": "1596.0", "currency_raw": "", "url": "", "seller": "Desconocido", "availability": "unknown", "country": "UNKNOWN", "product_name": "Huevos Color", "brand": "Descripción del producto", "reference": "", "unit": "500 Gr", "price_amount": 1596.0, "price_currency": "", "price_symbol": "$", "price_text": "$1.596,00", "price_amount_filled": "1596.0", "price_is_imputed": "False", "price_imputation_source": "original", "price_amount_usd": "1596.0", "price_amount_usd_filled": "1596.0", "fx_rate_local_per_usd": "1.0", "fx_source": "default_1usd", "information_text": "", "description_text": "", "features_text": "MARCA | : CARNAVE | Últimos consultados | 20%DTO | Huevo Blanco Grande 6u | PRECIO CON 20%DTO | Ver planes de cuotas | 15%DTO | Huevo Blanco . Coto Bli 12 Uni | PRECIO CON 15%DTO | Huevo Blanco Extra 12u | 35%DTO | Espagueti FAVORITA 500 Gr | PRECIO CON 35%DTO | Fid.Lar. Sin Spaghetti Nuev Delverde Paq 500 Grm", "specifications_text": "", "benefits_text": "", "details_text": "", "other_sections": "", "sections": {"Características": ["MARCA", ": CARNAVE", "Últimos consultados", "20%DTO", "Huevo Blanco Grande 6u", "PRECIO CON 20%DTO", "Ver planes de cuotas", "15%DTO", "Huevo Blanco . Coto Bli 12 Uni", "PRECIO CON 15%DTO", "Huevo Blanco Extra 12u", "35%DTO", "Espagueti FAVORITA      500 Gr", "PRECIO CON 35%DTO", "Fid.Lar.Sem Spaghetti Nuev Delverde Paq 500 Grm"]}, "txt_path": "dataset/txt_limpios/527.txt", "html_path": "dataset/paginas_descargadas/527.html", "es_status": "ET", "category_canonical": "huevo", "decision": "discard", "match_score": 0.3, "reasons": "heuristic_default"}
{"source_id": "900", "title": "kem piña", "description": "", "breadcrumbs": "Bebida desechable > 1.5 Litro", "price_raw": "1.39", "currency_raw": "", "url": "", "seller": "Desconocido", "availability": "unknown", "country": "UNKNOWN", "product_name": "kem piña", "brand": "Bebida desechable", "reference": "", "unit": "1.5 Litro", "price_amount": 1.39, "price_currency": "", "price_symbol": "$", "price_text": "$1.39", "price_amount_filled": "1.39", "price_is_imputed": "False", "price_imputation_source": "original", "price_amount_usd": "1.39", "price_amount_usd_filled": "1.39", "fx_rate_local_per_usd": "1.0", "fx_source": "default_1usd", "information_text": "", "description_text": "", "features_text": "", "specifications_text": "", "benefits_text": "", "details_text": "", "other_sections": "", "sections": {}, "txt_path": "dataset/txt_limpios/900.txt", "html_path": "dataset/paginas_descargadas/900.html", "es_status": "EN", "category_canonical": "sin_categoria", "decision": "discard", "match_score": 0.3, "reasons": "no_category_detected"}
{"source_id": "909", "title": "la herradura", "description": "Huevo primera color La Herradura 30 un", "breadcrumbs": "Huevo primera color", "price_raw": "", "currency_raw": "", "url": "", "seller": "Desconocido", "availability": "unknown", "country": "UNKNOWN", "product_name": "la herradura", "brand": "Huevo primera color", "reference": "", "unit": "", "price_amount": null, "price_currency": "", "price_symbol": "", "price_text": "", "price_amount_filled": "234.19", "price_is_imputed": "True", "price_imputation_source": "country_mean", "price_amount_usd": "", "price_amount_usd_filled": "234.1938", "fx_rate_local_per_usd": "1.0", "fx_source": "default_1usd", "information_text": "", "description_text": "Huevo primera color La Herradura 30 un", "features_text": "", "specifications_text": "", "benefits_text": "", "details_text": "", "other_sections": "", "sections": {"Descripción": ["Huevo primera color La Herradura 30 un"]}, "txt_path": "dataset/txt_limpios/909.txt", "html_path": "dataset/paginas_descargadas/909.html", "es_status": "EN", "category_canonical": "huevo", "decision": "discard", "match_score": 0.3, "reasons": "price_parse_failed"}
{"source_id": "11", "title": "Lacteos y huevo", "description": "Leche Entera Pasteurizada en embalaje de plástico para disfrutar con la familia", "breadcrumbs": "Leche > 1L > 3012021", "price_raw": "", "currency_raw": "MXN", "url": "", "seller": "Chedraui", "availability": "unknown", "country": "MX", "product_name": "Lacteos y huevo", "brand": "Leche", "reference": "3012021.0", "unit": "1L", "price_amount": null, "price_currency": "MXN", "price_symbol": "", "price_text": "", "price_amount_filled": "38.0", "price_is_imputed": "True", "price_imputation_source": "category_country_mean", "price_amount_usd": "", "price_amount_usd_filled": "2.0408", "fx_rate_local_per_usd": "18.62", "fx_source": "from_mexico_cambio_dolar", "information_text": "Leche Entera Pasteurizada en embalaje de plástico para disfrutar con la familia", "description_text": "", "features_text": "", "specifications_text": "", "benefits_text": "", "details_text": "", "other_sections": "", "sections": {"Información": ["Leche Entera Pasteurizada en embalaje de plástico para disfrutar con la familia"]}, "txt_path": "dataset/txt_limpios/11.txt", "html_path": "dataset/paginas_descargadas/11.html", "es_status": "ET", "category_canonical": "leche", "decision": "discard", "match_score": 0.6, "reasons": "price_parse_failed;price<=0"}
{"source_id": "12", "title": "Lacteos y huevo", "description": "Como resultado de años de experiencia y pasión por la leche, nace Selecta, la leche Premium de alpura. Su cremosidad y consistencia se disfrutan a la perfección, sin importar si se toma sola el acompañada. Selecta, para los que saben. Selecta de alclaramiento es el resultado de nuestra experiencia y pasión por la leche. Calidad que se distingue por su delicioso sabor, cremosidad y consistencia.", "breadcrumbs": "Leche > 1L > 3019413", "price_raw": "", "currency_raw": "MXN", "url": "", "seller": "Chedraui", "availability": "unknown", "country": "MX", "product_name": "Lacteos y huevo", "brand": "Leche", "reference": "3019413.0", "unit": "1L", "price_amount": null, "price_currency": "MXN", "price_symbol": "", "price_text": "", "price_amount_filled": "66.32", "price_is_imputed": "True", "price_imputation_source": "country_mean", "price_amount_usd": "", "price_amount_usd_filled": "3.5617", "fx_rate_local_per_usd": "18.62", "fx_source": "from_mexico_cambio_dolar", "information_text": "Como resultado de años de experiencia y pasión por la leche, nace Selecta, la leche Premium de alpura. Su cremosidad y consistencia se disfrutan a la perfección, sin importar si se toma sola el acompañada. Selecta, para los que saben.", "description_text": "", "features_text": "", "specifications_text": "Selecta de alclaramiento es el resultado de nuestra experiencia y pasión por la leche. Calidad que se distingue por su delicioso sabor, cremosidad y consistencia.", "benefits_text": "", "details_text": "", "other_sections": "", "sections": {"Información": ["Como resultado de años de experiencia y pasión por la leche, nace Selecta, la leche Premium de alpura. Su cremosidad y consistencia se disfrutan a la perfección, sin importar si se toma sola el acompañada. Selecta, para los que saben."], "Especificaciones": ["Selecta de alclaramiento es el resultado de nuestra experiencia y pasión por la leche. Calidad que se distingue por su delicioso sabor, cremosidad y consistencia."]}, "txt_path": "dataset/txt_limpios/12.txt", "html_path": "dataset/paginas_descargadas/12.html", "es_status": "ET", "category_canonical": "huevo", "decision": "discard", "match_score": 0.3, "reasons": "price_parse_failed"}
{"source_id": "13", "title": "Lacteos y huevo", "description": "Leche Alpura Clásica 4 Pack 1L La leche Alpura Clásica es fundamental en tu despensa ya que contiene proteína propia de la leche que te de la energía para comenzar tu día y que ayuda al desarrollo de músculos. Además de ser una fuente de calcio que ayuda a el crecimiento de dientes definitivos en los niños y de la fortaleza ósea en adolescentes y adultos. También contiene Vitaminas La y D que ayudan a llevar mejor el oxígeno a la sangre y a que el calcio se absorbido de mejor manera por los huesos y músculos. Disfruta de este súper alimento natural, ¡100% leche de vaca!", "breadcrumbs": "Leche > 4 Piezas > 3713405", "price_raw": "", "currency_raw": "MXN", "url": "", "seller": "Chedraui", "availability": "unknown", "country": "MX", "product_name": "Lacteos y huevo", "brand": "Leche", "reference": "3713405.0", "unit": "4 Piezas", "price_amount": null, "price_currency": "MXN", "price_symbol": "", "price_text": "", "price_amount_filled": "66.32", "price_is_imputed": "True", "price_imputation_source": "country_mean", "price_amount_usd": "", "price_amount_usd_filled": "3.5617", "fx_rate_local_per_usd": "18.62", "fx_source": "from_mexico_cambio_dolar", "information_text": "Leche Alpura Clásica 4 Pack 1L", "description_text": "", "features_text": "", "specifications_text": "La leche Alpura Clásica es fundamental en tu despensa ya que contiene proteína propia de la leche que te de la energía para comenzar tu día y que ayuda al desarrollo de músculos. Además de ser una fuente de calcio que ayuda a el crecimiento de dientes definitivos en los niños y de la fortaleza ósea en adolescentes y adultos. También contiene Vitaminas La y D que ayudan a llevar mejor el oxígeno a la sangre y a que el calcio se absorbido de mejor manera por los huesos y músculos. Disfruta de este súper alimento natural, ¡100% leche de vaca!", "benefits_text": "", "details_text": "", "other_sections": "", "sections": {"Información": ["Leche Alpura Clásica 4 Pack 1L"], "Especificaciones": ["La leche Alpura Clásica es fundamental en tu despensa ya que contiene proteína propia de la leche que te de la energía para comenzar tu día y que ayuda al desarrollo de músculos. Además de ser una fuente de calcio que ayuda a el crecimiento de dientes definitivos en los niños y de la fortaleza ósea en adolescentes y adultos. También contiene Vitaminas La y D que ayudan a llevar mejor el oxígeno a la sangre y a que el calcio se absorbido de mejor manera por los huesos y músculos. Disfruta de este súper alimento natural, ¡100% leche de vaca!"]}, "txt_path": "dataset/txt_limpios/13.txt", "html_path": "dataset/paginas_descargadas/13.html", "es_status": "ET", "category_canonical": "descartado", "decision": "discard", "match_score": 0.1, "reasons": "excluded_keyword"}
{"source_id": "14", "title": "Lacteos y huevo", "description": "Leche entera ultrapasteurizada añadida con vitaminas A y D Santa Clara 1L tetra brick Disfruta del sabor de la leche entera Santa Clara, elaborada con leche 100% pura de vaca. Empaque tetrapack de 1lt.", "breadcrumbs": "Leche > 1L > 3019421", "price_raw": "37.0", "currency_raw": "MXN", "url": "", "seller": "Chedraui", "availability": "unknown", "country": "MX", "product_name": "Lacteos y huevo", "brand": "Leche", "reference": "3019421.0", "unit": "1L", "price_amount": 37.0, "price_currency": "MXN", "price_symbol": "$", "price_text": "$37.00", "price_amount_filled": "37.0", "price_is_imputed": "False", "price_imputation_source": "original", "price_amount_usd": "1.9871", "price_amount_usd_filled": "1.9871", "fx_rate_local_per_usd": "18.62", "fx_source": "from_mexico_cambio_dolar", "information_text": "Leche entera ultrapasteurizada adicionada con vitaminas A y D Santa Clara 1L tetra brick", "description_text": "", "features_text": "Con leche 100% de vaca y ultrapasteurizada con vapor. | Añadido con vitaminas A y D3 | Contiene calcio | Refrigérese después de abrir", "specifications_text": "Disfruta del sabor de la leche entera Santa Clara, elaborada con leche 100% pura de vaca. Empaque tetrapack de 1lt.", "benefits_text": "", "details_text": "", "other_sections": "", "sections": {"Información": ["Leche entera ultrapasteurizada adicionada con vitaminas A y D Santa Clara 1L tetra brick"], "Características": ["Con leche 100% de vaca y ultrapasteurizada con vapor.", "Adicionado con vitaminas A y D3", "Contiene calcio", "Refrigérese después de abrir"], "Especificaciones": ["Disfruta del sabor de la leche entera Santa Clara, elaborada con leche 100% pura de vaca. Empaque tetrapack de 1lt."]}, "txt_path": "dataset/txt_limpios/14.txt", "html_path": "dataset/paginas_descargadas/14.html", "es_status": "ET", "category_canonical": "leche", "decision": "keep", "match_score": 0.6, "reasons": "heuristic_default"}
