source_id,title,description,breadcrumbs,price_raw,currency_raw,url,seller,availability,country,product_name,brand,reference,unit,price_amount,price_currency,price_symbol,price_text,price_amount_filled,price_is_imputed,price_imputation_source,price_amount_usd,price_amount_usd_filled,fx_rate_local_per_usd,fx_source,information_text,description_text,features_text,specifications_text,benefits_text,details_text,other_sections,sections,txt_path,html_path,es_status,category_canonical,decision,match_score,reasons
1394,Horarios de entrega,,LISTA > 1.5L,,,,Desconocido,unknown,UNKNOWN,Horarios de entrega,LISTA,,1.5L,,,,,234.19,True,country_mean,,234.1938,1.0,default_1usd,,,,,,,,{},dataset/txt_limpios/1394.txt,dataset/paginas_descargadas/1394.html,EN,sin_categoria,discard,0.30,no_category_detected;price_parse_failed
1395,Horarios de entrega,,LISTA > 250ML,23.0,,,Desconocido,unknown,UNKNOWN,Horarios de entrega,LISTA,,250ML,23.00,,,23,23.0,False,original,23.0,23.0,1.0,default_1usd,,,,,,,,{},dataset/txt_limpios/1395.txt,dataset/paginas_descargadas/1395.html,EN,sin_categoria,discard,0.30,no_category_detected
1396,Horarios de entrega,,LISTA > 125ML,1.0,,,Desconocido,unknown,UNKNOWN,Horarios de entrega,LISTA,,125ML,1.00,,,1,1.0,False,original,1.0,1.0,1.0,default_1usd,,,,,,,,{},dataset/txt_limpios/1396.txt,dataset/paginas_descargadas/1396.html,EN,sin_categoria,discard,0.30,no_category_detected
1397,Horarios de entrega,,LISTA > 1 KG,,,,Desconocido,unknown,UNKNOWN,Horarios de entrega,LISTA,,1 KG,,,,,234.19,True,country_mean,,234.1938,1.0,default_1usd,,,,,,,,{},dataset/txt_limpios/1397.txt,dataset/paginas_descargadas/1397.html,EN,sin_categoria,discard,0.30,no_category_detected;price_parse_failed
1398,Horarios de entrega,,LISTA > 1Kg,,,,Desconocido,unknown,UNKNOWN,Horarios de entrega,LISTA,,1Kg,,,,,234.19,True,country_mean,,234.1938,1.0,default_1usd,,,,,,,,{},dataset/txt_limpios/1398.txt,dataset/paginas_descargadas/1398.html,EN,sin_categoria,discard,0.30,no_category_detected;price_parse_failed
1399,Horarios de entrega,,LISTA > 1KG,,,,Desconocido,unknown,UNKNOWN,Horarios de entrega,LISTA,,1KG,,,,,234.19,True,country_mean,,234.1938,1.0,default_1usd,,,,,,,,{},dataset/txt_limpios/1399.txt,dataset/paginas_descargadas/1399.html,EN,sin_categoria,discard,0.30,no_category_detected;price_parse_failed
1400,Horarios de entrega,,LISTA > 1KG,,,,Desconocido,unknown,UNKNOWN,Horarios de entrega,LISTA,,1KG,,,,,234.19,True,country_mean,,234.1938,1.0,default_1usd,,,,,,,,{},dataset/txt_limpios/1400.txt,dataset/paginas_descargadas/1400.html,EN,sin_categoria,discard,0.30,no_category_detected;price_parse_failed
1401,Horarios de entrega,,LISTA > 1KG,,,,Desconocido,unknown,UNKNOWN,Horarios de entrega,LISTA,,1KG,,,,,234.19,True,country_mean,,234.1938,1.0,default_1usd,,,,,,,,{},dataset/txt_limpios/1401.txt,dataset/paginas_descargadas/1401.html,EN,sin_categoria,discard,0.30,no_category_detected;price_parse_failed
1402,Horarios de entrega,,LISTA > 1KG,,,,Desconocido,unknown,UNKNOWN,Horarios de entrega,LISTA,,1KG,,,,,234.19,True,country_mean,,234.1938,1.0,default_1usd,,,,,,,,{},dataset/txt_limpios/1402.txt,dataset/paginas_descargadas/1402.html,EN,sin_categoria,discard,0.30,no_category_detected;price_parse_failed
1403,Horarios de entrega,,LISTA > 2 KG,,,,Desconocido,unknown,UNKNOWN,Horarios de entrega,LISTA,,2 KG,,,,,234.19,True,country_mean,,234.1938,1.0,default_1usd,,,,,,,,{},dataset/txt_limpios/1403.txt,dataset/paginas_descargadas/1403.html,EN,sin_categoria,discard,0.30,no_category_detected;price_parse_failed
1404,Horarios de entrega,,LISTA > 1 LITRO,,,,Desconocido,unknown,UNKNOWN,Horarios de entrega,LISTA,,1 LITRO,,,,,234.19,True,country_mean,,234.1938,1.0,default_1usd,,,,,,,,{},dataset/txt_limpios/1404.txt,dataset/paginas_descargadas/1404.html,EN,sin_categoria,discard,0.30,no_category_detected;price_parse_failed
1405,Horarios de entrega,,LISTA > 400GR,,,,Desconocido,unknown,UNKNOWN,Horarios de entrega,LISTA,,400GR,,,,,234.19,True,country_mean,,234.1938,1.0,default_1usd,,,,,,,,{},dataset/txt_limpios/1405.txt,dataset/paginas_descargadas/1405.html,EN,sin_categoria,discard,0.30,no_category_detected;price_parse_failed
1407,Horarios de entrega,,LISTA > 1 KG,1.0,,,Desconocido,unknown,UNKNOWN,Horarios de entrega,LISTA,,1 KG,1.00,,,1,1.0,False,original,1.0,1.0,1.0,default_1usd,,,,,,,,{},dataset/txt_limpios/1407.txt,dataset/paginas_descargadas/1407.html,EN,sin_categoria,discard,0.30,no_category_detected
1409,Horarios de entrega,,LISTA > 1 KG,1.0,,,Desconocido,unknown,UNKNOWN,Horarios de entrega,LISTA,,1 KG,1.00,,,1,1.0,False,original,1.0,1.0,1.0,default_1usd,,,,,,,,{},dataset/txt_limpios/1409.txt,dataset/paginas_descargadas/1409.html,EN,sin_categoria,discard,0.30,no_category_detected
1412,Horarios de entrega,,LISTA > 1 Litro,8.0,,,Desconocido,unknown,UNKNOWN,Horarios de entrega,LISTA,,1 Litro,8.00,,,8,8.0,False,original,8.0,8.0,1.0,default_1usd,,,,,,,,{},dataset/txt_limpios/1412.txt,dataset/paginas_descargadas/1412.html,EN,sin_categoria,discard,0.30,no_category_detected
1447,Horarios de entrega,,LISTA > 400GR,,,,Desconocido,unknown,UNKNOWN,Horarios de entrega,LISTA,,400GR,,,,,234.19,True,country_mean,,234.1938,1.0,default_1usd,,,,,,,,{},dataset/txt_limpios/1447.txt,dataset/paginas_descargadas/1447.html,EN,sin_categoria,discard,0.30,no_category_detected;price_parse_failed
1451,Horarios de entrega,,LISTA > 650GR,,,,Desconocido,unknown,UNKNOWN,Horarios de entrega,LISTA,,650GR,,,,,234.19,True,country_mean,,234.1938,1.0,default_1usd,,,,,,,,{},dataset/txt_limpios/1451.txt,dataset/paginas_descargadas/1451.html,EN,sin_categoria,discard,0.30,no_category_detected;price_parse_failed
1452,Horarios de entrega,,LISTA > 850GR,,,,Desconocido,unknown,UNKNOWN,Horarios de entrega,LISTA,,850GR,,,,,234.19,True,country_mean,,234.1938,1.0,default_1usd,,,,,,,,{},dataset/txt_limpios/1452.txt,dataset/paginas_descargadas/1452.html,EN,sin_categoria,discard,0.30,no_category_detected;price_parse_failed
1453,Horarios de entrega,,LISTA > 1 LITRO,,,,Desconocido,unknown,UNKNOWN,Horarios de entrega,LISTA,,1 LITRO,,,,,234.19,True,country_mean,,234.1938,1.0,default_1usd,,,,,,,,{},dataset/txt_limpios/1453.txt,dataset/paginas_descargadas/1453.html,EN,sin_categoria,discard,0.30,no_category_detected;price_parse_failed
1455,Horarios de entrega,,LISTA > 1 LITRO,,,,Desconocido,unknown,UNKNOWN,Horarios de entrega,LISTA,,1 LITRO,,,,,234.19,True,country_mean,,234.1938,1.0,default_1usd,,,,,,,,{},dataset/txt_limpios/1455.txt,dataset/paginas_descargadas/1455.html,EN,sin_categoria,discard,0.30,no_category_detected;price_parse_failed
1457,Horarios de entrega,,LISTA > 1 LITRO,,,,Desconocido,unknown,UNKNOWN,Horarios de entrega,LISTA,,1 LITRO,,,,,234.19,True,country_mean,,234.1938,1.0,default_1usd,,,,,,,,{},dataset/txt_limpios/1457.txt,dataset/paginas_descargadas/1457.html,EN,sin_categoria,discard,0.30,no_category_detected;price_parse_failed
1458,Horarios de entrega,,LISTA > 1 LITRO,,,,Desconocido,unknown,UNKNOWN,Horarios de entrega,LISTA,,1 LITRO,,,,,234.19,True,country_mean,,234.1938,1.0,default_1usd,,,,,,,,{},dataset/txt_limpios/1458.txt,dataset/paginas_descargadas/1458.html,EN,sin_categoria,discard,0.30,no_category_detected;price_parse_failed
1459,Horarios de entrega,,LISTA > 100GR,,,,Desconocido,unknown,UNKNOWN,Horarios de entrega,LISTA,,100GR,,,,,234.19,True,country_mean,,234.1938,1.0,default_1usd,,,,,,,,{},dataset/txt_limpios/1459.txt,dataset/paginas_descargadas/1459.html,EN,sin_categoria,discard,0.30,no_category_detected;price_parse_failed
1460,Horarios de entrega,,LISTA > 400 GRAMOS,,,,Desconocido,unknown,UNKNOWN,Horarios de entrega,LISTA,,400 GRAMOS,,,,,234.19,True,country_mean,,234.1938,1.0,default_1usd,,,,,,,,{},dataset/txt_limpios/1460.txt,dataset/paginas_descargadas/1460.html,EN,sin_categoria,discard,0.30,no_category_detected;price_parse_failed
1462,Horarios de entrega,,LISTA > 1 LITRO,,,,Desconocido,unknown,UNKNOWN,Horarios de entrega,LISTA,,1 LITRO,,,,,234.19,True,country_mean,,234.1938,1.0,default_1usd,,,,,,,,{},dataset/txt_limpios/1462.txt,dataset/paginas_descargadas/1462.html,EN,sin_categoria,discard,0.30,no_category_detected;price_parse_failed
1465,Horarios de entrega,,LISTA > 1 LITRO,,,,Desconocido,unknown,UNKNOWN,Horarios de entrega,LISTA,,1 LITRO,,,,,234.19,True,country_mean,,234.1938,1.0,default_1usd,,,,,,,,{},dataset/txt_limpios/1465.txt,dataset/paginas_descargadas/1465.html,EN,sin_categoria,discard,0.30,no_category_detected;price_parse_failed
1466,Horarios de entrega,,LISTA > 1 LITRO,,,,Desconocido,unknown,UNKNOWN,Horarios de entrega,LISTA,,1 LITRO,,,,,234.19,True,country_mean,,234.1938,1.0,default_1usd,,,,,,,,{},dataset/txt_limpios/1466.txt,dataset/paginas_descargadas/1466.html,EN,sin_categoria,discard,0.30,no_category_detected;price_parse_failed
1468,Horarios de entrega,,LISTA > 500 ML,2.0,,,Desconocido,unknown,UNKNOWN,Horarios de entrega,LISTA,,500 ML,2.00,,,2,2.0,False,original,2.0,2.0,1.0,default_1usd,,,,,,,,{},dataset/txt_limpios/1468.txt,dataset/paginas_descargadas/1468.html,EN,sin_categoria,discard,0.30,no_category_detected
1469,Horarios de entrega,,LISTA > 1 LITRO,,,,Desconocido,unknown,UNKNOWN,Horarios de entrega,LISTA,,1 LITRO,,,,,234.19,True,country_mean,,234.1938,1.0,default_1usd,,,,,,,,{},dataset/txt_limpios/1469.txt,dataset/paginas_descargadas/1469.html,EN,sin_categoria,discard,0.30,no_category_detected;price_parse_failed
1472,Horarios de entrega,,LISTA > 1 LITRO,,,,Desconocido,unknown,UNKNOWN,Horarios de entrega,LISTA,,1 LITRO,,,,,234.19,True,country_mean,,234.1938,1.0,default_1usd,,,,,,,,{},dataset/txt_limpios/1472.txt,dataset/paginas_descargadas/1472.html,EN,sin_categoria,discard,0.30,no_category_detected;price_parse_failed
1473,Horarios de entrega,,LISTA > 500 GRAMOS,500.0,,,Desconocido,unknown,UNKNOWN,Horarios de entrega,LISTA,,500 GRAMOS,500.00,,,500,500.0,False,original,500.0,500.0,1.0,default_1usd,,,,,,,,{},dataset/txt_limpios/1473.txt,dataset/paginas_descargadas/1473.html,EN,sin_categoria,discard,0.30,no_category_detected
1474,Horarios de entrega,,LISTA > 1 KG,,,,Desconocido,unknown,UNKNOWN,Horarios de entrega,LISTA,,1 KG,,,,,234.19,True,country_mean,,234.1938,1.0,default_1usd,,,,,,,,{},dataset/txt_limpios/1474.txt,dataset/paginas_descargadas/1474.html,EN,sin_categoria,discard,0.30,no_category_detected;price_parse_failed
1475,Horarios de entrega,,LISTA > 1 LITRO,500.0,,,Desconocido,unknown,UNKNOWN,Horarios de entrega,LISTA,,1 LITRO,500.00,,,500,500.0,False,original,500.0,500.0,1.0,default_1usd,,,,,,,,{},dataset/txt_limpios/1475.txt,dataset/paginas_descargadas/1475.html,EN,sin_categoria,discard,0.30,no_category_detected
1476,Horarios de entrega,,LISTA > 500 GRAMOS,24.0,,,Desconocido,unknown,UNKNOWN,Horarios de entrega,LISTA,,500 GRAMOS,24.00,,D,D24,24.0,False,original,24.0,24.0,1.0,default_1usd,,,,,,,,{},dataset/txt_limpios/1476.txt,dataset/paginas_descargadas/1476.html,EN,sin_categoria,discard,0.30,no_category_detected
1477,Horarios de entrega,,LISTA > 400GR,400.0,,,Desconocido,unknown,UNKNOWN,Horarios de entrega,LISTA,,400GR,400.00,,,400,400.0,False,original,400.0,400.0,1.0,default_1usd,,,,,,,,{},dataset/txt_limpios/1477.txt,dataset/paginas_descargadas/1477.html,EN,sin_categoria,discard,0.30,no_category_detected
1478,Horarios de entrega,,LISTA > 400 GR,,,,Desconocido,unknown,UNKNOWN,Horarios de entrega,LISTA,,400 GR,,,,,234.19,True,country_mean,,234.1938,1.0,default_1usd,,,,,,,,{},dataset/txt_limpios/1478.txt,dataset/paginas_descargadas/1478.html,EN,sin_categoria,discard,0.30,no_category_detected;price_parse_failed
1479,Horarios de entrega,,LISTA > 400 GRAMOS,40.0,,,Desconocido,unknown,UNKNOWN,Horarios de entrega,LISTA,,400 GRAMOS,40.00,,,40,40.0,False,original,40.0,40.0,1.0,default_1usd,,,,,,,,{},dataset/txt_limpios/1479.txt,dataset/paginas_descargadas/1479.html,EN,sin_categoria,discard,0.30,no_category_detected
1480,Horarios de entrega,,LISTA > 108 GR,,,,Desconocido,unknown,UNKNOWN,Horarios de entrega,LISTA,,108 GR,,,,,234.19,True,country_mean,,234.1938,1.0,default_1usd,,,,,,,,{},dataset/txt_limpios/1480.txt,dataset/paginas_descargadas/1480.html,EN,sin_categoria,discard,0.30,no_category_detected;price_parse_failed
1481,Horarios de entrega,,LISTA > 200 GR,,,,Desconocido,unknown,UNKNOWN,Horarios de entrega,LISTA,,200 GR,,,,,234.19,True,country_mean,,234.1938,1.0,default_1usd,,,,,,,,{},dataset/txt_limpios/1481.txt,dataset/paginas_descargadas/1481.html,EN,sin_categoria,discard,0.30,no_category_detected;price_parse_failed
1482,Horarios de entrega,,LISTA > 160GR,,,,Desconocido,unknown,UNKNOWN,Horarios de entrega,LISTA,,160GR,,,,,234.19,True,country_mean,,234.1938,1.0,default_1usd,,,,,,,,{},dataset/txt_limpios/1482.txt,dataset/paginas_descargadas/1482.html,EN,sin_categoria,discard,0.30,no_category_detected;price_parse_failed
1483,Horarios de entrega,,LISTA > 6 UNIDADES,160.0,,,Desconocido,unknown,UNKNOWN,Horarios de entrega,LISTA,,6 UNIDADES,160.00,,S,S160,160.0,False,original,160.0,160.0,1.0,default_1usd,,,,,,,,{},dataset/txt_limpios/1483.txt,dataset/paginas_descargadas/1483.html,EN,sin_categoria,discard,0.30,no_category_detected
1484,Horarios de entrega,,LISTA,,,,Desconocido,unknown,UNKNOWN,Horarios de entrega,LISTA,,,,,,,234.19,True,country_mean,,234.1938,1.0,default_1usd,,,,,,,,{},dataset/txt_limpios/1484.txt,dataset/paginas_descargadas/1484.html,EN,sin_categoria,discard,0.30,no_category_detected;price_parse_failed
1485,Horarios de entrega,,LISTA > 50 GRAMOS,40.0,,,Desconocido,unknown,UNKNOWN,Horarios de entrega,LISTA,,50 GRAMOS,40.00,,R,R40,40.0,False,original,40.0,40.0,1.0,default_1usd,,,,,,,,{},dataset/txt_limpios/1485.txt,dataset/paginas_descargadas/1485.html,EN,sin_categoria,discard,0.30,no_category_detected
1486,Horarios de entrega,,LISTA > 85 GRAMOS,,,,Desconocido,unknown,UNKNOWN,Horarios de entrega,LISTA,,85 GRAMOS,,,,,234.19,True,country_mean,,234.1938,1.0,default_1usd,,,,,,,,{},dataset/txt_limpios/1486.txt,dataset/paginas_descargadas/1486.html,EN,sin_categoria,discard,0.30,no_category_detected;price_parse_failed
1487,Horarios de entrega,,LISTA > 220 GR,,,,Desconocido,unknown,UNKNOWN,Horarios de entrega,LISTA,,220 GR,,,,,234.19,True,country_mean,,234.1938,1.0,default_1usd,,,,,,,,{},dataset/txt_limpios/1487.txt,dataset/paginas_descargadas/1487.html,EN,sin_categoria,discard,0.30,no_category_detected;price_parse_failed
1488,Horarios de entrega,,LISTA > 6 UNIDADES,6.0,,,Desconocido,unknown,UNKNOWN,Horarios de entrega,LISTA,,6 UNIDADES,6.00,,,6,6.0,False,original,6.0,6.0,1.0,default_1usd,,,,,,,,{},dataset/txt_limpios/1488.txt,dataset/paginas_descargadas/1488.html,EN,sin_categoria,discard,0.30,no_category_detected
1489,Horarios de entrega,,LISTA > 6 UNIDADES,6.0,,,Desconocido,unknown,UNKNOWN,Horarios de entrega,LISTA,,6 UNIDADES,6.00,,,6,6.0,False,original,6.0,6.0,1.0,default_1usd,,,,,,,,{},dataset/txt_limpios/1489.txt,dataset/paginas_descargadas/1489.html,EN,sin_categoria,discard,0.30,no_category_detected
1490,Horarios de entrega,,LISTA > 4 UNIDADES,4.0,,,Desconocido,unknown,UNKNOWN,Horarios de entrega,LISTA,,4 UNIDADES,4.00,,,4,4.0,False,original,4.0,4.0,1.0,default_1usd,,,,,,,,{},dataset/txt_limpios/1490.txt,dataset/paginas_descargadas/1490.html,EN,sin_categoria,discard,0.30,no_category_detected
1492,Horarios de entrega,,LISTA > 250 ML,,,,Desconocido,unknown,UNKNOWN,Horarios de entrega,LISTA,,250 ML,,,,,234.19,True,country_mean,,234.1938,1.0,default_1usd,,,,,,,,{},dataset/txt_limpios/1492.txt,dataset/paginas_descargadas/1492.html,EN,sin_categoria,discard,0.30,no_category_detected;price_parse_failed
1494,Horarios de entrega,,LISTA > 1.5L,,,,Desconocido,unknown,UNKNOWN,Horarios de entrega,LISTA,,1.5L,,,,,234.19,True,country_mean,,234.1938,1.0,default_1usd,,,,,,,,{},dataset/txt_limpios/1494.txt,dataset/paginas_descargadas/1494.html,EN,sin_categoria,discard,0.30,no_category_detected;price_parse_failed
1497,Horarios de entrega,,LISTA > 1.5L,180.0,,,Desconocido,unknown,UNKNOWN,Horarios de entrega,LISTA,,1.5L,180.00,,,180,180.0,False,original,180.0,180.0,1.0,default_1usd,,,,,,,,{},dataset/txt_limpios/1497.txt,dataset/paginas_descargadas/1497.html,EN,sin_categoria,discard,0.30,no_category_detected
1499,Horarios de entrega,,LISTA > 500 ML,,,,Desconocido,unknown,UNKNOWN,Horarios de entrega,LISTA,,500 ML,,,,,234.19,True,country_mean,,234.1938,1.0,default_1usd,,,,,,,,{},dataset/txt_limpios/1499.txt,dataset/paginas_descargadas/1499.html,EN,sin_categoria,discard,0.30,no_category_detected;price_parse_failed
1500,Horarios de entrega,,LISTA > 250 ML,,,,Desconocido,unknown,UNKNOWN,Horarios de entrega,LISTA,,250 ML,,,,,234.19,True,country_mean,,234.1938,1.0,default_1usd,,,,,,,,{},dataset/txt_limpios/1500.txt,dataset/paginas_descargadas/1500.html,EN,sin_categoria,discard,0.30,no_category_detected;price_parse_failed
1503,Horarios de entrega,,LISTA > 90 GR,200.0,,,Desconocido,unknown,UNKNOWN,Horarios de entrega,LISTA,,90 GR,200.00,,,200,200.0,False,original,200.0,200.0,1.0,default_1usd,,,,,,,,{},dataset/txt_limpios/1503.txt,dataset/paginas_descargadas/1503.html,EN,sin_categoria,discard,0.30,no_category_detected
1504,Horarios de entrega,,LISTA > 250 ML,,,,Desconocido,unknown,UNKNOWN,Horarios de entrega,LISTA,,250 ML,,,,,234.19,True,country_mean,,234.1938,1.0,default_1usd,,,,,,,,{},dataset/txt_limpios/1504.txt,dataset/paginas_descargadas/1504.html,EN,sin_categoria,discard,0.30,no_category_detected;price_parse_failed
1506,Horarios de entrega,,LISTA > 1KG,,,,Desconocido,unknown,UNKNOWN,Horarios de entrega,LISTA,,1KG,,,,,234.19,True,country_mean,,234.1938,1.0,default_1usd,,,,,,,,{},dataset/txt_limpios/1506.txt,dataset/paginas_descargadas/1506.html,EN,sin_categoria,discard,0.30,no_category_detected;price_parse_failed
1508,Horarios de entrega,,LISTA > 1KG,,,,Desconocido,unknown,UNKNOWN,Horarios de entrega,LISTA,,1KG,,,,,234.19,True,country_mean,,234.1938,1.0,default_1usd,,,,,,,,{},dataset/txt_limpios/1508.txt,dataset/paginas_descargadas/1508.html,EN,sin_categoria,discard,0.30,no_category_detected;price_parse_failed
1510,Horarios de entrega,,LISTA > 1KG,,,,Desconocido,unknown,UNKNOWN,Horarios de entrega,LISTA,,1KG,,,,,234.19,True,country_mean,,234.1938,1.0,default_1usd,,,,,,,,{},dataset/txt_limpios/1510.txt,dataset/paginas_descargadas/1510.html,EN,sin_categoria,discard,0.30,no_category_detected;price_parse_failed
1512,Horarios de entrega,,LISTA > 1 KG,,,,Desconocido,unknown,UNKNOWN,Horarios de entrega,LISTA,,1 KG,,,,,234.19,True,country_mean,,234.1938,1.0,default_1usd,,,,,,,,{},dataset/txt_limpios/1512.txt,dataset/paginas_descargadas/1512.html,EN,sin_categoria,discard,0.30,no_category_detected;price_parse_failed
1515,Horarios de entrega,,LISTA > 400 GRAMOS,400.0,,,Desconocido,unknown,UNKNOWN,Horarios de entrega,LISTA,,400 GRAMOS,400.00,,,400,400.0,False,original,400.0,400.0,1.0,default_1usd,,,,,,,,{},dataset/txt_limpios/1515.txt,dataset/paginas_descargadas/1515.html,EN,sin_categoria,discard,0.30,no_category_detected
1516,Horarios de entrega,,LISTA > 1 KG,1.0,,,Desconocido,unknown,UNKNOWN,Horarios de entrega,LISTA,,1 KG,1.00,,,1,1.0,False,original,1.0,1.0,1.0,default_1usd,,,,,,,,{},dataset/txt_limpios/1516.txt,dataset/paginas_descargadas/1516.html,EN,sin_categoria,discard,0.30,no_category_detected
1517,Horarios de entrega,,LISTA > 1 LITRO,,,,Desconocido,unknown,UNKNOWN,Horarios de entrega,LISTA,,1 LITRO,,,,,234.19,True,country_mean,,234.1938,1.0,default_1usd,,,,,,,,{},dataset/txt_limpios/1517.txt,dataset/paginas_descargadas/1517.html,EN,sin_categoria,discard,0.30,no_category_detected;price_parse_failed
524,Huevos Blanco,,Descripción del producto > 500 Gr,627.25,,,Desconocido,unknown,UNKNOWN,Huevos Blanco,Descripción del producto,,500 Gr,627.25,,$,"$627,25",627.25,False,original,627.25,627.25,1.0,default_1usd,,,Últimos consultados | 35%DTO | Espagueti FAVORITA 500 Gr | PRECIO CON 35%DTO | Ver planes de cuotas | Fid.Lar. Sin Spaghetti Nuev Delverde Paq 500 Grm | Espagueti BARILLA Caja 500 Gr | Fideos Tallarin N° 5 Matarazzo 500g | Fideos Tallarin N5 Lucchetti 500g,,,,,"{""Características"": [""Últimos consultados"", ""35%DTO"", ""Espagueti FAVORITA      500 Gr"", ""PRECIO CON 35%DTO"", ""Ver planes de cuotas"", ""Fid.Lar.Sem Spaghetti Nuev Delverde Paq 500 Grm"", ""Espagueti BARILLA Caja 500 Gr"", ""Fideos Tallarin N° 5 Matarazzo 500g"", ""Fideos Tallarin N5 Lucchetti 500g""]}",dataset/txt_limpios/524.txt,dataset/paginas_descargadas/524.html,ET,huevo,discard,0.30,heuristic_default
525,Huevos Blanco,,Descripción del producto > 500 Gr,3961.0,,,Desconocido,unknown,UNKNOWN,Huevos Blanco,Descripción del producto,,500 Gr,3961.00,,$,"$3.961,00",3961.0,False,original,3961.0,3961.0,1.0,default_1usd,,,MARCA | : COTO | Últimos consultados | 15%DTO | Huevo Blanco Extra 12u | PRECIO CON 15%DTO | Ver planes de cuotas | 35%DTO | Espagueti FAVORITA 500 Gr | PRECIO CON 35%DTO | Fid.Lar. Sin Spaghetti Nuev Delverde Paq 500 Grm | Espagueti BARILLA Caja 500 Gr | Fideos Tallarin N° 5 Matarazzo 500g,,,,,"{""Características"": [""MARCA"", "": COTO"", ""Últimos consultados"", ""15%DTO"", ""Huevo Blanco Extra 12u"", ""PRECIO CON 15%DTO"", ""Ver planes de cuotas"", ""35%DTO"", ""Espagueti FAVORITA      500 Gr"", ""PRECIO CON 35%DTO"", ""Fid.Lar.Sem Spaghetti Nuev Delverde Paq 500 Grm"", ""Espagueti BARILLA Caja 500 Gr"", ""Fideos Tallarin N° 5 Matarazzo 500g""]}",dataset/txt_limpios/525.txt,dataset/paginas_descargadas/525.html,ET,huevo,discard,0.30,heuristic_default
