source_id,title,description,breadcrumbs,price_raw,currency_raw,url,seller,availability,country,product_name,brand,reference,unit,price_amount,price_currency,price_symbol,price_text,price_amount_filled,price_is_imputed,price_imputation_source,price_amount_usd,price_amount_usd_filled,fx_rate_local_per_usd,fx_source,information_text,description_text,features_text,specifications_text,benefits_text,details_text,other_sections,sections,txt_path,html_path,es_status,category_canonical,decision,match_score,reasons
1070,¡Aún no eres Wong Prime!,"<h2>Aceite de Oliva Extra Virgen Cuisine &amp; Co 1L</h2> El <strong>Aceite de Oliva Extra Virgen Cuisine &amp; Co 1L </strong>es una opción de calidad premium diseñada para realzar el sabor de tus comidas mientras cuidas tu salud. Con una extracción en frío que preserva todas sus propiedades naturales, este producto se convierte en un aliado esencial en la cocina para quienes buscan ingredientes saludables y versátiles. <h2>Características</h2> <ul> <li aria-level=""1"">Presentación de 1 litro: Ideal para familias o amantes de la cocina que desean contar con un producto rendidor y de alta calidad.</li> <li aria-level=""1"">Extracción en frío: Este proceso conserva todas las propiedades del aceite, incluyendo sus beneficios antioxidantes y ácidos grasos esenciales.</li> </ul> <h3>Beneficios del Aceite de Oliva Extra Virgen</h3> <li aria-level=""1""><strong>Salud y bienestar:</strong> Gracias a su alto contenido de antioxidantes y grasas saludables, el aceite de oliva ayuda a reducir el colesterol malo y a mantener un corazón saludable.</li> <li aria-level=""1""><strong>Versatilidad en la cocina:</strong> Perfecto para aderezos, marinados, salteados e incluso para disfrutar en crudo, aportando un sabor único a tus recetas.</li> <li aria-level=""1""><strong>Cuida tu organismo:</strong> Los beneficios del aceite de oliva incluyen su capacidad para mejorar la digestión, fortalecer el sistema inmunológico y proteger las células de los radicales libres.</li> <h2>¿Por qué elegir Cuisine &amp; Co?</h2> Este aceite de oliva extra virgen destaca por su pureza, sabor y por su proceso de producción sostenible y de alta calidad. Su versatilidad y beneficios lo convierten en un ingrediente indispensable para quienes buscan llevar una alimentación saludable sin comprometer el sabor. <h2>Encuentra el Aceite de Oliva Cuisine &amp; Co en Wong.pe</h2> Compra el <strong>Aceite de Oliva Extra Virgen Cuisine &amp; Co 1L</strong> en <a href=""https://www.wong.pe/"">Wong.pe</a>, tu tienda confiable para productos de alta calidad. Descubre el mejor aceite de oliva a un precio accesible y disfruta de una experiencia de compra rápida y segura desde la comodidad de tu hogar. Dale un toque saludable a tus platillos con este aceite de oliva extra virgen. Cocina con el respaldo de<strong> Cuisine &amp; Co</strong> y aprovecha todas las propiedades y beneficios que este ingrediente puede ofrecerte. <strong>¡Adquiérelo ahora en Wong.pe y transforma tus comidas!</strong> Configuraciones ProductData {""allow_notes"":false,""allow_substitute"":false,""cart_limit"":""24"",""brandName"":""Cuisine & Co"",""brandEcomId"":""9885"",""measurement_unit"":""un"",""unit_multiplier"":1,""unit_multiplier_un"":0,""measurement_unit_selector"":false} SkuData {""39148758"":{""ref_id"":""769516"",""cart_limit"":24,""allow_notes"":true,""allow_substitute"":true,""measurement_unit"":""un"",""unit_multiplier"":1,""promotions"":[""58"",""90"",""292"",""294"",""326"",""364"",""366"",""408"",""414"",""416"",""494"",""519"",""1045"",""1065"",""1173"",""1179"",""1183"",""1184"",""1194"",""1196"",""18120"",""146325"",""146326"",""146597"",""146599"",""230560"",""230561"",""251083"",""251084"",""251085"",""251087"",""261935"",""329743"",""348899"",""348900"",""382859"",""490256"",""490257"",""490261"",""490263"",""28328684"",""28328914"",""28329380"",""28330336"",""34700744"",""67507085"",""135779464"",""135780958"",""202166997"",""219593135"",""220132509"",""220132511"",""220325913"",""226193030"",""229001859"",""230406787"",""232931212"",""236288198"",""236692623"",""237242860"",""237242861"",""238191142"",""238780839"",""242805685"",""251882905"",""267410396"",""274021792"",""277147293"",""280218422"",""280840419""],""url_canonical"":"""",""unit_multiplier_un"":0,""measurement_unit_selector"":false,""release_data"":{""date_release"":""12-02-2020 00:00"",""date_release_end"":""13-03-2020 00:00"",""is_new"":false}}} Características Destacadas Tipo de Producto Aceite de Oliva Observaciones y Recomendaciones Origen Importado Cuisine & Co Referencia: 769516 S/ 54 90 68 Cantidad ＋ － Certificados Ver todos Características Principales Contiene 1 litro Variedad: Extra Virgen Extracció en frío ¡Van mejor juntos! Estás viendo: -20% Precio Online Precio regular + Aceite de Mantequilla Fat Free Pam Spray 141 g 33 Comentarios | Especificaciones técnicas | Propiedad | Especificación | El | es una opción de calidad premium diseñada para realzar el sabor de tus comidas mientras cuidas tu salud.",Aprovecha el > 1L > 769516,79.9,PEN,,Desconocido,unknown,PE,¡Aún no eres Wong Prime!,Aprovecha el,769516.0,1L,79.90,PEN,S/,S/79.90,79.9,False,original,22.507,22.507,3.55,from_peru_cambio_dolar,,"<h2>Aceite de Oliva Extra Virgen Cuisine &amp; Co 1L</h2> El <strong>Aceite de Oliva Extra Virgen Cuisine &amp; Co 1L </strong>es una opción de calidad premium diseñada para realzar el sabor de tus comidas mientras cuidas tu salud. Con una extracción en frío que preserva todas sus propiedades naturales, este producto se convierte en un aliado esencial en la cocina para quienes buscan ingredientes saludables y versátiles. <h2>Características</h2> <ul> <li aria-level=""1"">Presentación de 1 litro: Ideal para familias o amantes de la cocina que desean contar con un producto rendidor y de alta calidad.</li> <li aria-level=""1"">Extracción en frío: Este proceso conserva todas las propiedades del aceite, incluyendo sus beneficios antioxidantes y ácidos grasos esenciales.</li> </ul> <h3>Beneficios del Aceite de Oliva Extra Virgen</h3> <li aria-level=""1""><strong>Salud y bienestar:</strong> Gracias a su alto contenido de antioxidantes y grasas saludables, el aceite de oliva ayuda a reducir el colesterol malo y a mantener un corazón saludable.</li> <li aria-level=""1""><strong>Versatilidad en la cocina:</strong> Perfecto para aderezos, marinados, salteados e incluso para disfrutar en crudo, aportando un sabor único a tus recetas.</li> <li aria-level=""1""><strong>Cuida tu organismo:</strong> Los beneficios del aceite de oliva incluyen su capacidad para mejorar la digestión, fortalecer el sistema inmunológico y proteger las células de los radicales libres.</li> <h2>¿Por qué elegir Cuisine &amp; Co?</h2> Este aceite de oliva extra virgen destaca por su pureza, sabor y por su proceso de producción sostenible y de alta calidad. Su versatilidad y beneficios lo convierten en un ingrediente indispensable para quienes buscan llevar una alimentación saludable sin comprometer el sabor. <h2>Encuentra el Aceite de Oliva Cuisine &amp; Co en Wong.pe</h2> Compra el <strong>Aceite de Oliva Extra Virgen Cuisine &amp; Co 1L</strong> en <a href=""https://www.wong.pe/"">Wong.pe</a>, tu tienda confiable para productos de alta calidad. Descubre el mejor aceite de oliva a un precio accesible y disfruta de una experiencia de compra rápida y segura desde la comodidad de tu hogar. Dale un toque saludable a tus platillos con este aceite de oliva extra virgen. Cocina con el respaldo de<strong> Cuisine &amp; Co</strong> y aprovecha todas las propiedades y beneficios que este ingrediente puede ofrecerte. <strong>¡Adquiérelo ahora en Wong.pe y transforma tus comidas!</strong> Configuraciones ProductData {""allow_notes"":false,""allow_substitute"":false,""cart_limit"":""24"",""brandName"":""Cuisine & Co"",""brandEcomId"":""9885"",""measurement_unit"":""un"",""unit_multiplier"":1,""unit_multiplier_un"":0,""measurement_unit_selector"":false} SkuData {""39148758"":{""ref_id"":""769516"",""cart_limit"":24,""allow_notes"":true,""allow_substitute"":true,""measurement_unit"":""un"",""unit_multiplier"":1,""promotions"":[""58"",""90"",""292"",""294"",""326"",""364"",""366"",""408"",""414"",""416"",""494"",""519"",""1045"",""1065"",""1173"",""1179"",""1183"",""1184"",""1194"",""1196"",""18120"",""146325"",""146326"",""146597"",""146599"",""230560"",""230561"",""251083"",""251084"",""251085"",""251087"",""261935"",""329743"",""348899"",""348900"",""382859"",""490256"",""490257"",""490261"",""490263"",""28328684"",""28328914"",""28329380"",""28330336"",""34700744"",""67507085"",""135779464"",""135780958"",""202166997"",""219593135"",""220132509"",""220132511"",""220325913"",""226193030"",""229001859"",""230406787"",""232931212"",""236288198"",""236692623"",""237242860"",""237242861"",""238191142"",""238780839"",""242805685"",""251882905"",""267410396"",""274021792"",""277147293"",""280218422"",""280840419""],""url_canonical"":"""",""unit_multiplier_un"":0,""measurement_unit_selector"":false,""release_data"":{""date_release"":""12-02-2020 00:00"",""date_release_end"":""13-03-2020 00:00"",""is_new"":false}}} Características Destacadas Tipo de Producto Aceite de Oliva Observaciones y Recomendaciones Origen Importado Cuisine & Co Referencia: 769516 S/ 54 90 68 Cantidad ＋ － Certificados Ver todos Características Principales Contiene 1 litro Variedad: Extra Virgen Extracció en frío ¡Van mejor juntos! Estás viendo: -20% Precio Online Precio regular + Aceite de Mantequilla Fat Free Pam Spray 141 g 33","Presentación de 1 litro: Ideal para familias o amantes de la cocina que desean contar con un producto rendidor y de alta calidad. | Aceite de oliva extra virgen: Elaborado a partir de | aceitunas | cuidadosamente seleccionadas, garantiza un sabor auténtico y una pureza excepcional. | Extracción en frío: Este proceso conserva todas las propiedades del aceite, incluyendo sus beneficios antioxidantes y ácidos grasos esenciales. | Beneficios del Aceite de Oliva Extra Virgen | Salud y bienestar: Gracias a su alto contenido de antioxidantes y grasas saludables, el aceite de oliva ayuda a reducir el colesterol malo y a mantener un corazón saludable. | Versatilidad en la cocina: Perfecto para aderezos, marinados, salteados e incluso para disfrutar en crudo, aportando un sabor único a tus recetas. | Cuida tu organismo: Los beneficios del aceite de oliva incluyen su capacidad para mejorar la digestión, fortalecer el sistema inmunológico y proteger las células de los radicales libres. | ¿Por qué elegir Cuisine & Co? | Encuentra el Aceite de Oliva Cuisine & Co en Wong.pe | Compra el | en | Wong.pe | , tu tienda confiable para productos de alta calidad. Descubre el mejor aceite de oliva a un precio accesible y disfruta de una experiencia de compra rápida y segura desde la comodidad de tu hogar. | Cocina con el respaldo de | y aprovecha todas las propiedades y beneficios que este ingrediente puede ofrecerte. | ¡Adquiérelo ahora en Wong.pe y transforma tus comidas! | Ver condiciones de promociones | Podrían interesarte | Aceite de Oliva El Olivar Virgen Botella 500 ml | true | Aceite de Oliva Extra Virgen Carbonell Botella 250 ml | 29 | Aceite de Oliva Borges Extra Virgen Botella 250 ml | 23 | Aceite de Oliva Filippo Berio Puro Botella 250ml | 21 | Aceite de Oliva Extra Virgen Orgánico Borges Botella 500 ml | 45 | Recuerda escribir al menos 3 letras en el cuadro de búsqueda | Términos más buscados | 1. | elvive liso | 2. | ariel liquido | 3. | limpiador inodoro harpic | 4. | busca | 5. | secret clinical | Marcas sugeridas | ? | ! | i | × | Sí Acepto",Comentarios | Especificaciones técnicas | Propiedad | Especificación | El | es una opción de calidad premium diseñada para realzar el sabor de tus comidas mientras cuidas tu salud.,,,,"{""Descripción"": [""<h2>Aceite de Oliva Extra Virgen Cuisine &amp; Co 1L</h2>"", ""El <strong>Aceite de Oliva Extra Virgen Cuisine &amp; Co 1L </strong>es una opción de calidad premium diseñada para realzar el sabor de tus comidas mientras cuidas tu salud."", ""Con una extracción en frío que preserva todas sus propiedades naturales, este producto se convierte en un aliado esencial en la cocina para quienes buscan ingredientes saludables y versátiles."", ""<h2>Características</h2>"", ""<ul>"", ""<li aria-level=\""1\"">Presentación de 1 litro: Ideal para familias o amantes de la cocina que desean contar con un producto rendidor y de alta calidad.</li>"", ""<li aria-level=\""1\"">Extracción en frío: Este proceso conserva todas las propiedades del aceite, incluyendo sus beneficios antioxidantes y ácidos grasos esenciales.</li>"", ""</ul>"", ""<h3>Beneficios del Aceite de Oliva Extra Virgen</h3>"", ""<li aria-level=\""1\""><strong>Salud y bienestar:</strong> Gracias a su alto contenido de antioxidantes y grasas saludables, el aceite de oliva ayuda a reducir el colesterol malo y a mantener un corazón saludable.</li>"", ""<li aria-level=\""1\""><strong>Versatilidad en la cocina:</strong> Perfecto para aderezos, marinados, salteados e incluso para disfrutar en crudo, aportando un sabor único a tus recetas.</li>"", ""<li aria-level=\""1\""><strong>Cuida tu organismo:</strong> Los beneficios del aceite de oliva incluyen su capacidad para mejorar la digestión, fortalecer el sistema inmunológico y proteger las células de los radicales libres.</li>"", ""<h2>¿Por qué elegir Cuisine &amp; Co?</h2>"", ""Este aceite de oliva extra virgen destaca por su pureza, sabor y por su proceso de producción sostenible y de alta calidad."", ""Su versatilidad y beneficios lo convierten en un ingrediente indispensable para quienes buscan llevar una alimentación saludable sin comprometer el sabor."", ""<h2>Encuentra el Aceite de Oliva Cuisine &amp; Co en Wong.pe</h2>"", ""Compra el <strong>Aceite de Oliva Extra Virgen Cuisine &amp; Co 1L</strong> en <a href=\""https://www.wong.pe/\"">Wong.pe</a>, tu tienda confiable para productos de alta calidad. Descubre el mejor aceite de oliva a un precio accesible y disfruta de una experiencia de compra rápida y segura desde la comodidad de tu hogar."", ""Dale un toque saludable a tus platillos con este aceite de oliva extra virgen."", ""Cocina con el respaldo de<strong> Cuisine &amp; Co</strong> y aprovecha todas las propiedades y beneficios que este ingrediente puede ofrecerte."", ""<strong>¡Adquiérelo ahora en Wong.pe y transforma tus comidas!</strong>"", ""Configuraciones"", ""ProductData"", ""{\""allow_notes\"":false,\""allow_substitute\"":false,\""cart_limit\"":\""24\"",\""brandName\"":\""Cuisine & Co\"",\""brandEcomId\"":\""9885\"",\""measurement_unit\"":\""un\"",\""unit_multiplier\"":1,\""unit_multiplier_un\"":0,\""measurement_unit_selector\"":false}"", ""SkuData"", ""{\""39148758\"":{\""ref_id\"":\""769516\"",\""cart_limit\"":24,\""allow_notes\"":true,\""allow_substitute\"":true,\""measurement_unit\"":\""un\"",\""unit_multiplier\"":1,\""promotions\"":[\""58\"",\""90\"",\""292\"",\""294\"",\""326\"",\""364\"",\""366\"",\""408\"",\""414\"",\""416\"",\""494\"",\""519\"",\""1045\"",\""1065\"",\""1173\"",\""1179\"",\""1183\"",\""1184\"",\""1194\"",\""1196\"",\""18120\"",\""146325\"",\""146326\"",\""146597\"",\""146599\"",\""230560\"",\""230561\"",\""251083\"",\""251084\"",\""251085\"",\""251087\"",\""261935\"",\""329743\"",\""348899\"",\""348900\"",\""382859\"",\""490256\"",\""490257\"",\""490261\"",\""490263\"",\""28328684\"",\""28328914\"",\""28329380\"",\""28330336\"",\""34700744\"",\""67507085\"",\""135779464\"",\""135780958\"",\""202166997\"",\""219593135\"",\""220132509\"",\""220132511\"",\""220325913\"",\""226193030\"",\""229001859\"",\""230406787\"",\""232931212\"",\""236288198\"",\""236692623\"",\""237242860\"",\""237242861\"",\""238191142\"",\""238780839\"",\""242805685\"",\""251882905\"",\""267410396\"",\""274021792\"",\""277147293\"",\""280218422\"",\""280840419\""],\""url_canonical\"":\""\"",\""unit_multiplier_un\"":0,\""measurement_unit_selector\"":false,\""release_data\"":{\""date_release\"":\""12-02-2020 00:00\"",\""date_release_end\"":\""13-03-2020 00:00\"",\""is_new\"":false}}}"", ""Características Destacadas"", ""Tipo de Producto"", ""Aceite de Oliva"", ""Observaciones y Recomendaciones"", ""Origen"", ""Importado"", ""Cuisine & Co"", ""Referencia: 769516"", ""S/"", ""54"", ""90"", ""68"", ""Cantidad"", ""＋"", ""－"", ""Certificados"", ""Ver todos"", ""Características Principales"", ""Contiene 1 litro"", ""Variedad: Extra Virgen"", ""Extracció en frío"", ""¡Van mejor juntos!"", ""Estás viendo: -20%"", ""Precio Online"", ""Precio regular"", ""+"", ""Aceite de Mantequilla Fat Free Pam Spray 141 g"", ""33""], ""Especificaciones"": [""Comentarios"", ""Especificaciones técnicas"", ""Propiedad"", ""Especificación"", ""El"", ""es una opción de calidad premium diseñada para realzar el sabor de tus comidas mientras cuidas tu salud.""], ""Características"": [""Presentación de 1 litro: Ideal para familias o amantes de la cocina que desean contar con un producto rendidor y de alta calidad."", ""Aceite de oliva extra virgen: Elaborado a partir de"", ""aceitunas"", ""cuidadosamente seleccionadas, garantiza un sabor auténtico y una pureza excepcional."", ""Extracción en frío: Este proceso conserva todas las propiedades del aceite, incluyendo sus beneficios antioxidantes y ácidos grasos esenciales."", ""Beneficios del Aceite de Oliva Extra Virgen"", ""Salud y bienestar: Gracias a su alto contenido de antioxidantes y grasas saludables, el aceite de oliva ayuda a reducir el colesterol malo y a mantener un corazón saludable."", ""Versatilidad en la cocina: Perfecto para aderezos, marinados, salteados e incluso para disfrutar en crudo, aportando un sabor único a tus recetas."", ""Cuida tu organismo: Los beneficios del aceite de oliva incluyen su capacidad para mejorar la digestión, fortalecer el sistema inmunológico y proteger las células de los radicales libres."", ""¿Por qué elegir Cuisine & Co?"", ""Encuentra el Aceite de Oliva Cuisine & Co en Wong.pe"", ""Compra el"", ""en"", ""Wong.pe"", "", tu tienda confiable para productos de alta calidad. Descubre el mejor aceite de oliva a un precio accesible y disfruta de una experiencia de compra rápida y segura desde la comodidad de tu hogar."", ""Cocina con el respaldo de"", ""y aprovecha todas las propiedades y beneficios que este ingrediente puede ofrecerte."", ""¡Adquiérelo ahora en Wong.pe y transforma tus comidas!"", ""Ver condiciones de promociones"", ""Podrían interesarte"", ""Aceite de Oliva El Olivar Virgen Botella 500 ml"", ""true"", ""Aceite de Oliva Extra Virgen Carbonell Botella 250 ml"", ""29"", ""Aceite de Oliva Borges Extra Virgen Botella 250 ml"", ""23"", ""Aceite de Oliva Filippo Berio Puro Botella 250ml"", ""21"", ""Aceite de Oliva Extra Virgen Orgánico Borges Botella 500 ml"", ""45"", ""Recuerda escribir al menos 3 letras en el cuadro de búsqueda"", ""Términos más buscados"", ""1."", ""elvive liso"", ""2."", ""ariel liquido"", ""3."", ""limpiador inodoro harpic"", ""4."", ""busca"", ""5."", ""secret clinical"", ""Marcas sugeridas"", ""?"", ""!"", ""i"", ""×"", ""Sí Acepto""]}",dataset/txt_limpios/1070.txt,dataset/paginas_descargadas/1070.html,EN,sin_categoria,discard,0.30,no_category_detected
1071,¡Aún no eres Wong Prime!,Comentarios | Especificaciones técnicas | Propiedad | Especificación | Ver condiciones de promociones | ? | ! | i | × | Sí Acepto | Recuerda escribir al menos 3 letras en el cuadro de búsqueda | Términos más buscados | 1. | elvive liso | 2. | ariel liquido | 3. | limpiador inodoro harpic | 4. | busca | 5. | secret clinical | Marcas sugeridas,Aprovecha el > 1L > 38332,79.9,PEN,,Desconocido,unknown,PE,¡Aún no eres Wong Prime!,Aprovecha el,38332.0,1L,79.90,PEN,S/,S/79.90,79.9,False,original,22.507,22.507,3.55,from_peru_cambio_dolar,,,,Comentarios | Especificaciones técnicas | Propiedad | Especificación | Ver condiciones de promociones | ? | ! | i | × | Sí Acepto | Recuerda escribir al menos 3 letras en el cuadro de búsqueda | Términos más buscados | 1. | elvive liso | 2. | ariel liquido | 3. | limpiador inodoro harpic | 4. | busca | 5. | secret clinical | Marcas sugeridas,,,,"{""Especificaciones"": [""Comentarios"", ""Especificaciones técnicas"", ""Propiedad"", ""Especificación"", ""Ver condiciones de promociones"", ""?"", ""!"", ""i"", ""×"", ""Sí Acepto"", ""Recuerda escribir al menos 3 letras en el cuadro de búsqueda"", ""Términos más buscados"", ""1."", ""elvive liso"", ""2."", ""ariel liquido"", ""3."", ""limpiador inodoro harpic"", ""4."", ""busca"", ""5."", ""secret clinical"", ""Marcas sugeridas""]}",dataset/txt_limpios/1071.txt,dataset/paginas_descargadas/1071.html,EN,sin_categoria,discard,0.30,no_category_detected
