source_id,title,description,breadcrumbs,price_raw,currency_raw,url,seller,availability,country,product_name,brand,reference,unit,price_amount,price_currency,price_symbol,price_text,price_amount_filled,price_is_imputed,price_imputation_source,price_amount_usd,price_amount_usd_filled,fx_rate_local_per_usd,fx_source,information_text,description_text,features_text,specifications_text,benefits_text,details_text,other_sections,sections,txt_path,html_path,es_status,category_canonical,decision,match_score,reasons
536,Bebidas Sin Alcohol,,Gaseosas > 2.25 L,3225.0,,,Desconocido,unknown,UNKNOWN,Bebidas Sin Alcohol,Gaseosas,,2.25 L,3225.00,,$,"$3.225,00",3225.0,False,original,3225.0,3225.0,1.0,default_1usd,,,"MARCA | : CUNNINGTON | SIN TACC | : SI | Últimos consultados | 25%DTO | Gaseosa PASO DE LOS TOROS Botella 2.25 L | PRECIO CON 25%DTO | Ver planes de cuotas | LLEVANDO 2 | 2X1 | Gaseosa Cola Pepsi 2l | PRECIO CON 2X1 | NO ACUMULABLE CON OTRAS PROMOS | Gaseosa Coca-Cola Sabor Original 2,25 Lt | PRECIO CON 50% 2DA | OFERTA",,,,,"{""Características"": [""MARCA"", "": CUNNINGTON"", ""SIN TACC"", "": SI"", ""Últimos consultados"", ""25%DTO"", ""Gaseosa PASO DE LOS TOROS    Botella 2.25 L"", ""PRECIO CON 25%DTO"", ""Ver planes de cuotas"", ""LLEVANDO 2"", ""2X1"", ""Gaseosa Cola Pepsi 2l"", ""PRECIO CON 2X1"", ""NO ACUMULABLE CON OTRAS PROMOS"", ""Gaseosa Coca-Cola Sabor Original 2,25 Lt"", ""PRECIO CON 50% 2DA"", ""OFERTA""]}",dataset/txt_limpios/536.txt,dataset/paginas_descargadas/536.html,ET,sin_categoria,discard,0.30,no_category_detected
537,Bebidas Sin Alcohol,,Gaseosas > 2.25 L,1265.6,,,Desconocido,unknown,UNKNOWN,Bebidas Sin Alcohol,Gaseosas,,2.25 L,1265.60,,$,"$1.265,60",1265.6,False,original,1265.6,1265.6,1.0,default_1usd,,,"MARCA | : PRITTY | SABOR | : LIMÓN | BOTELLA RETORNABLE | : NO | ENVASE | : BOTELLA | CONTENIDO | : 2.25 L | Últimos consultados | 20%DTO | Gaseosa Cola Cunnington 1500cmq | PRECIO CON 20%DTO | Ver planes de cuotas | 25%DTO | Gaseosa PASO DE LOS TOROS Botella 2.25 L | PRECIO CON 25%DTO | LLEVANDO 2 | 2X1 | Gaseosa Cola Pepsi 2l | PRECIO CON 2X1 | NO ACUMULABLE CON OTRAS PROMOS | Gaseosa Coca-Cola Sabor Original 2,25 Lt | PRECIO CON 50% 2DA | OFERTA",,,,,"{""Características"": [""MARCA"", "": PRITTY"", ""SABOR"", "": LIMÓN"", ""BOTELLA RETORNABLE"", "": NO"", ""ENVASE"", "": BOTELLA"", ""CONTENIDO"", "": 2.25 L"", ""Últimos consultados"", ""20%DTO"", ""Gaseosa Cola Cunnington 1500cmq"", ""PRECIO CON 20%DTO"", ""Ver planes de cuotas"", ""25%DTO"", ""Gaseosa PASO DE LOS TOROS    Botella 2.25 L"", ""PRECIO CON 25%DTO"", ""LLEVANDO 2"", ""2X1"", ""Gaseosa Cola Pepsi 2l"", ""PRECIO CON 2X1"", ""NO ACUMULABLE CON OTRAS PROMOS"", ""Gaseosa Coca-Cola Sabor Original 2,25 Lt"", ""PRECIO CON 50% 2DA"", ""OFERTA""]}",dataset/txt_limpios/537.txt,dataset/paginas_descargadas/537.html,ET,sin_categoria,discard,0.30,no_category_detected
1722,"Bebidas, Aguas y Jugos","Bebidas Gaseosa Original Coca-Cola 1.5lt | Actualizado al: 23-03-2025 Ingredientes: Agua carbonatada, Azúcar, Color caramelo, Ácido fosfórico, Saborizantes naturales, Cafeína, Sucralosa. Certificados: Apto para APLV Libre de Lactosa Vegano Vegetariano Libre de Soya Libre de Huevo Libre de Peces Libre de Mariscos Libre de Maní Libre de Frutas Secos Libre de Nueces Libre de Sulfitos Libre de Trigo Kosher Porción: 1 Vaso (200ml) Porciones por envase: 8 100ml 1 Porción Energía (kCal) 32 64 Proteínas (g) 0 Grasas Totales Hidratos de carbono disponibles 7.8 15.6 Azúcar total (g) Sodio (mg) Importante: La información del empaque y/o contenido del producto final puede diferir respecto a lo que mostramos en nuestro sitio web, tanto a nivel de ingredientes, trazas, información nutricional, sellos, modo de uso y/o modo de conservación. Usted debe basarse únicamente en la información que se muestra en nuestro sitio web y siempre debe leer las etiquetas, advertencias y instrucciones antes de usar el consumo de un producto. Información obtenida de BEBIDA COCA COLA 1500 CC. DES. Productos similares bebida Coca Cola Light 1.5 L Ver producto Bebida Coca Cola Original 2.5 L Bebida Coca Cola Sin Azúcar 1.5 L Bebida Coca Cola Original 3 L -23% Bebidas Coca Cola Zero 1 L -33% BEBIDA COCA COLA LIGHT 1 LT. DES. -22% Bebidas Coca Cola Light 2.5 L bebida Coca Cola Sin Azúcar 2.5 L bebida Coca Cola bebida Coca Cola Light 3 L Bebida Coca Cola Sin Azúcar 3 L Tripack Bebida Coca Cola 2 x 3 Lt + Bebida Fanta 3 Lt bebida Bilz 1.5 L BEBIDA INCA KOLA 3 LT -29% bebida Bilz 600 ml -26% bebida Coca Cola Light Botella bebida Bilz Zero 3 L Pack Bebidas Coca Cola Original + Sprite 3 x 3 L Bebida Sprite Sin Azúcar 1.5 L ¡Juntos son mejores! Bebidas Sprite Papas Fritas Corte Americano Lays 200 g -35% Papas Fritas Corte Americano Doritos Queso",Bebidas > 1.5 L,1.99,,,Desconocido,unknown,UNKNOWN,"Bebidas, Aguas y Jugos",Bebidas,,1.5 L,1.99,,,1.99,1.99,False,original,1.99,1.99,1.0,default_1usd,,"Bebidas Gaseosa Original Coca-Cola 1.5lt | Actualizado al: 23-03-2025 Ingredientes: Agua carbonatada, Azúcar, Color caramelo, Ácido fosfórico, Saborizantes naturales, Cafeína, Sucralosa. Certificados: Apto para APLV Libre de Lactosa Vegano Vegetariano Libre de Soya Libre de Huevo Libre de Peces Libre de Mariscos Libre de Maní Libre de Frutas Secos Libre de Nueces Libre de Sulfitos Libre de Trigo Kosher Porción: 1 Vaso (200ml) Porciones por envase: 8 100ml 1 Porción Energía (kCal) 32 64 Proteínas (g) 0 Grasas Totales Hidratos de carbono disponibles 7.8 15.6 Azúcar total (g) Sodio (mg) Importante: La información del empaque y/o contenido del producto final puede diferir respecto a lo que mostramos en nuestro sitio web, tanto a nivel de ingredientes, trazas, información nutricional, sellos, modo de uso y/o modo de conservación. Usted debe basarse únicamente en la información que se muestra en nuestro sitio web y siempre debe leer las etiquetas, advertencias y instrucciones antes de usar el consumo de un producto. Información obtenida de BEBIDA COCA COLA 1500 CC. DES. Productos similares bebida Coca Cola Light 1.5 L Ver producto Bebida Coca Cola Original 2.5 L Bebida Coca Cola Sin Azúcar 1.5 L Bebida Coca Cola Original 3 L -23% Bebidas Coca Cola Zero 1 L -33% BEBIDA COCA COLA LIGHT 1 LT. DES. -22% Bebidas Coca Cola Light 2.5 L bebida Coca Cola Sin Azúcar 2.5 L bebida Coca Cola bebida Coca Cola Light 3 L Bebida Coca Cola Sin Azúcar 3 L Tripack Bebida Coca Cola 2 x 3 Lt + Bebida Fanta 3 Lt bebida Bilz 1.5 L BEBIDA INCA KOLA 3 LT -29% bebida Bilz 600 ml -26% bebida Coca Cola Light Botella bebida Bilz Zero 3 L Pack Bebidas Coca Cola Original + Sprite 3 x 3 L Bebida Sprite Sin Azúcar 1.5 L ¡Juntos son mejores! Bebidas Sprite Papas Fritas Corte Americano Lays 200 g -35% Papas Fritas Corte Americano Doritos Queso",,,,,,"{""Descripción"": [""Bebida Gaseosa Original Coca-Cola"", ""1.5lt | Actualizado al: 23-03-2025"", ""Ingredientes: Agua carbonatada, Azúcar, Color caramelo, Ácido fosfórico, Saborizantes naturales, Cafeína, Sucralosa."", ""Certificados: Apto para APLV"", ""Libre de Lactosa"", ""Vegano"", ""Vegetariano"", ""Libre de Soya"", ""Libre de Huevo"", ""Libre de Peces"", ""Libre de Mariscos"", ""Libre de Maní"", ""Libre de Frutos Secos"", ""Libre de Nueces"", ""Libre de Sulfitos"", ""Libre de Trigo"", ""Kosher"", ""Porción: 1 Vaso (200ml)"", ""Porciones por envase: 8"", ""100ml"", ""1 Porción"", ""Energía"", ""(kCal)"", ""32"", ""64"", ""Proteínas"", ""(g)"", ""0"", ""Grasas Totales"", ""Hidratos de carbono disponibles"", ""7.8"", ""15.6"", ""Azúcar total (g)"", ""Sodio"", ""(mg)"", ""Importante: La información del empaque y/o contenido del producto final puede diferir respecto a lo que mostramos en nuestro sitio web, tanto a nivel de ingredientes, trazas, información nutricional, sellos, modo de uso y/o modo de conservación. Usted debe basarse únicamente en la información que se muestra en nuestro sitio web y siempre debe leer las etiquetas, advertencias y instrucciones antes de usar el consumo de un producto."", ""Información obtenida de"", ""BEBIDA COCA COLA 1500 CC. DES.."", ""Productos similares"", ""Bebida Coca Cola Light 1.5 L"", ""Ver producto"", ""Bebida Coca Cola Original 2.5 L"", ""Bebidas Coca Cola Sin Azúcar 1.5 L"", ""Bebida Coca Cola Original 3 L"", ""-23%"", ""Bebida Coca Cola Zero 1 L"", ""-33%"", ""BEBIDA COCA COLA LIGHT 1 LT. DES."", ""-22%"", ""Bebida Coca Cola Light 2.5 L"", ""Bebida Coca Cola Sin Azúcar 2.5 L"", ""Bebida Coca Cola"", ""Bebida Coca Cola Light 3 L"", ""Bebida Coca Cola Sin Azúcar 3 L"", ""Tripack Bebida Coca Cola 2 x 3 Lt + Bebida Fanta 3 Lt"", ""Bebida Bilz 1.5 L"", ""BEBIDA INCA KOLA 3 LT"", ""-29%"", ""Bebida Bilz 600 ml"", ""-26%"", ""Bebida Coca Cola Light Botella"", ""Bebida Bilz Zero 3 L"", ""Pack Bebidas Coca Cola Original + Sprite 3 x 3 L"", ""Bebidas Sprite Sin Azúcar 1.5 L"", ""¡Juntos son mejores!"", ""Bebida Sprite"", ""Papas Fritas Corte Americano Lays 200 g"", ""-35%"", ""Papas Fritas Corte Americano"", ""Doritos Queso""]}",dataset/txt_limpios/1722.txt,dataset/paginas_descargadas/1722.html,ET,papa,keep,0.60,heuristic_default
1724,"Bebidas, Aguas y Jugos","Bebidas de Fantasía Pepsi 1.5lt | Actualizado al: 21-05-2025 Ingredientes: Agua carbonatada, Azúcar, Colorante caramelo, Ácido fosfórico, Saborizantes naturales, Cafeína, Acesulfamo de potasio, Sucralosa. Certificados: Apto para APLV Libre de Lactosa Vegano Vegetariano Libre de Soya Libre de Huevo Libre de Peces Libre de Mariscos Libre de Maní Libre de Frutas Secos Libre de Nueces Libre de Sulfitos Libre de Trigo Kosher Porción: 1 Vaso (200ml) Porciones por envase: 8 100ml 1 Porción Energía (kCal) 28 56 Proteínas (g) 0 Grasas Totales Hidratos de carbono disponibles 7 14 Azúcares totales (g) Sodio (mg) 5 10 Importante: La información del empaque y/o contenido del producto final puede diferir respecto a lo que mostramos en nuestro sitio web, tanto a nivel de ingredientes, trazas, información nutricional, sellos, modo de uso y/o modo de conservación. Usted debe basarse únicamente en la información que se muestra en nuestro sitio web y siempre debe leer las etiquetas, advertencias y instrucciones antes de usar el consumo de un producto. Información obtenida de BEBIDA PEPSI 1500 CC. DESECH. Productos similares Bebidas Pepsi 3 L -27% Ver producto BEBIDA PEPSI 2.5 LT DESECHABLE.. Bebidas Bilz 1.5 L Bebida Pepsi Zero 3 L Bebida Pepsi 2 L Bebida Pap 3 L Bebida Pap Zero 3 L BEBIDA INCA KOLA 1.5 LT DES.. bebida Sprite Sin Azúcar 1.5 L Bebida Bilz Zero 3 L bebida Kem Piña Zero 3 L Bebida Fanta Original 1.5 Lt Bebida Sprite 3 L -29% Bebidas Sprite 2.5 L ¡Juntos son mejores! Bebidas Limón Soda Bebidas Kem Bebida Crush bebida Pap bebida Ginger Ale Canada Dry bebida Sprite Papas Fritas Marco Polo Americanas 200 g -17% Doritos Queso -26% Papas Fritas Corte Americano Lays 200 g -35%",Bebidas > 1.5 L,1.99,,,Desconocido,unknown,UNKNOWN,"Bebidas, Aguas y Jugos",Bebidas,,1.5 L,1.99,,,1.99,1.99,False,original,1.99,1.99,1.0,default_1usd,,"Bebidas de Fantasía Pepsi 1.5lt | Actualizado al: 21-05-2025 Ingredientes: Agua carbonatada, Azúcar, Colorante caramelo, Ácido fosfórico, Saborizantes naturales, Cafeína, Acesulfamo de potasio, Sucralosa. Certificados: Apto para APLV Libre de Lactosa Vegano Vegetariano Libre de Soya Libre de Huevo Libre de Peces Libre de Mariscos Libre de Maní Libre de Frutas Secos Libre de Nueces Libre de Sulfitos Libre de Trigo Kosher Porción: 1 Vaso (200ml) Porciones por envase: 8 100ml 1 Porción Energía (kCal) 28 56 Proteínas (g) 0 Grasas Totales Hidratos de carbono disponibles 7 14 Azúcares totales (g) Sodio (mg) 5 10 Importante: La información del empaque y/o contenido del producto final puede diferir respecto a lo que mostramos en nuestro sitio web, tanto a nivel de ingredientes, trazas, información nutricional, sellos, modo de uso y/o modo de conservación. Usted debe basarse únicamente en la información que se muestra en nuestro sitio web y siempre debe leer las etiquetas, advertencias y instrucciones antes de usar el consumo de un producto. Información obtenida de BEBIDA PEPSI 1500 CC. DESECH. Productos similares Bebidas Pepsi 3 L -27% Ver producto BEBIDA PEPSI 2.5 LT DESECHABLE.. Bebidas Bilz 1.5 L Bebida Pepsi Zero 3 L Bebida Pepsi 2 L Bebida Pap 3 L Bebida Pap Zero 3 L BEBIDA INCA KOLA 1.5 LT DES.. bebida Sprite Sin Azúcar 1.5 L Bebida Bilz Zero 3 L bebida Kem Piña Zero 3 L Bebida Fanta Original 1.5 Lt Bebida Sprite 3 L -29% Bebidas Sprite 2.5 L ¡Juntos son mejores! Bebidas Limón Soda Bebidas Kem Bebida Crush bebida Pap bebida Ginger Ale Canada Dry bebida Sprite Papas Fritas Marco Polo Americanas 200 g -17% Doritos Queso -26% Papas Fritas Corte Americano Lays 200 g -35%",,,,,,"{""Descripción"": [""Bebidas de Fantasía Pepsi"", ""1.5lt | Actualizado al: 21-05-2025"", ""Ingredientes: Agua carbonatada, Azúcar, Colorante caramelo, Ácido fosfórico, Saborizantes naturales, Cafeína, Acesulfamo de potasio, Sucralosa."", ""Certificados: Apto para APLV"", ""Libre de Lactosa"", ""Vegano"", ""Vegetariano"", ""Libre de Soya"", ""Libre de Huevo"", ""Libre de Peces"", ""Libre de Mariscos"", ""Libre de Maní"", ""Libre de Frutos Secos"", ""Libre de Nueces"", ""Libre de Sulfitos"", ""Libre de Trigo"", ""Kosher"", ""Porción: 1 Vaso (200ml)"", ""Porciones por envase: 8"", ""100ml"", ""1 Porción"", ""Energía"", ""(kCal)"", ""28"", ""56"", ""Proteínas"", ""(g)"", ""0"", ""Grasas Totales"", ""Hidratos de carbono disponibles"", ""7"", ""14"", ""Azúcar total (g)"", ""Sodio"", ""(mg)"", ""5"", ""10"", ""Importante: La información del empaque y/o contenido del producto final puede diferir respecto a lo que mostramos en nuestro sitio web, tanto a nivel de ingredientes, trazas, información nutricional, sellos, modo de uso y/o modo de conservación. Usted debe basarse únicamente en la información que se muestra en nuestro sitio web y siempre debe leer las etiquetas, advertencias y instrucciones antes de usar el consumo de un producto."", ""Información obtenida de"", ""BEBIDA PEPSI 1500 CC. DESECH.."", ""Productos similares"", ""Bebida Pepsi 3 L"", ""-27%"", ""Ver producto"", ""BEBIDA PEPSI 2.5 LT DESECHABLE.."", ""Bebida Bilz 1.5 L"", ""Bebida Pepsi Zero 3 L"", ""Bebida Pepsi 2 L"", ""Bebida Pap 3 L"", ""Bebida Pap Zero 3 L"", ""BEBIDA INCA KOLA 1.5 LT DES.."", ""Bebidas Sprite Sin Azúcar 1.5 L"", ""Bebida Bilz Zero 3 L"", ""Bebida Kem Piña Zero 3 L"", ""Bebida Fanta Original 1.5 Lt"", ""Bebida Sprite 3 L"", ""-29%"", ""Bebida Sprite 2.5 L"", ""¡Juntos son mejores!"", ""Bebidas Limón Soda"", ""Bebida Kem"", ""Bebida Crush"", ""Bebida Pap"", ""Bebida Ginger Ale Canada Dry"", ""Bebida Sprite"", ""Papas Fritas Marco Polo Americanas 200 g"", ""-17%"", ""Doritos Queso"", ""-26%"", ""Papas Fritas Corte Americano Lays 200 g"", ""-35%""]}",dataset/txt_limpios/1724.txt,dataset/paginas_descargadas/1724.html,ET,papa,keep,0.60,heuristic_default
