{"source_id": "1708", "title": "Desayuno y Dulces", "description": "Café Instantáneo en Polvo Tradición Nescafé 50g | Actualizado al: 13-05-2025 Ingredientes: 100% café. Certificados: Apto para APLV Libre de Lactosa Vegano Vegetariano Libre de Soya Libre de Huevo Libre de Peces Libre de Mariscos Libre de Maní Libre de Frutas Secos Libre de Nueces Libre de Sulfitos Libre de Trigo Kosher Importante: La información del empaque y/o contenido del producto final puede diferir respecto a lo que mostramos en nuestro sitio web, tanto a nivel de ingredientes, trazas, información nutricional, sellos, modo de uso y/o modo de conservación. Usted debe basarse únicamente en la información que se muestra en nuestro sitio web y siempre debe leer las etiquetas, advertencias y instrucciones antes de usar el consumo de un producto. Información obtenida de NESCAFE TRADICIONAL 50 GRS.11261035 Productos similares Café Instantáneo Nescafe Tradición Tarro 170 g Ver producto Café Instantáneo Nescafe Dolca Tarro 170 g Café Instantáneo Nescafe Tradición Tarro 400 g -40% Café Instantáneo Granulado Nescafe Tradición Tarro 170 g Café Tradición Tarro NESCAFE DOLCA 50 GRS. 11261175 Café Starbucks Medium Roast 90 g -27% Café Instantáneo Black Roast Nescafe 170 g Café Starbucks Dark Roast 90 g Café Instantáneo Liofilizado Cruzeiro 170 g -21% NESCAFE DOLCA TARRO 195GR -29% Café Instantáneo Primera Selección Gold 170 g -10% Café Descafeinado Nescafe 100 g ¡Juntos son mejores! Té Ceylan -33% Té Ceylán -20% Azúcar Blanca Granulada Iansa 1 Kg Azúcar Blanca Granulada Tottus 860 g Té Ceylán Premium Supremo 50 Un Azúcar Blanca Granulada Tottus 1 Kg Sal Fina Yodada Té -25% Azúcar Granulada Iansa 900 g Azúcar -11% FIDEO SPAGHETTI 5 400 GRS. 101409 C Sal Fina Yodada Tottus 1 Kg Carpeta Spaghetti N°5 Lucchetti 400 g Pasta Espiral N°56 Lucchetti 400 g Té Ceylán Premium Supremo 100 Un -12% FIDEO TALLARIN 87 400 GRS. 101407 C FIDEO CORBATA 80 400 GRS. 101302 C FIDEO CAB/CORTO 1 400 GRS. 111109 C ESPIRALES TOTTUS 400 G ESPIRALES TOTTUS 400 GR", "breadcrumbs": "Café > 50 g", "price_raw": "2.85", "currency_raw": "", "url": "", "seller": "Desconocido", "availability": "unknown", "country": "UNKNOWN", "product_name": "Desayuno y Dulces", "brand": "Café", "reference": "", "unit": "50 g", "price_amount": 2.85, "price_currency": "", "price_symbol": "", "price_text": "2.85", "price_amount_filled": "2.85", "price_is_imputed": "False", "price_imputation_source": "original", "price_amount_usd": "2.85", "price_amount_usd_filled": "2.85", "fx_rate_local_per_usd": "1.0", "fx_source": "default_1usd", "information_text": "", "description_text": "Café Instantáneo en Polvo Tradición Nescafé 50g | Actualizado al: 13-05-2025 Ingredientes: 100% café. Certificados: Apto para APLV Libre de Lactosa Vegano Vegetariano Libre de Soya Libre de Huevo Libre de Peces Libre de Mariscos Libre de Maní Libre de Frutas Secos Libre de Nueces Libre de Sulfitos Libre de Trigo Kosher Importante: La información del empaque y/o contenido del producto final puede diferir respecto a lo que mostramos en nuestro sitio web, tanto a nivel de ingredientes, trazas, información nutricional, sellos, modo de uso y/o modo de conservación. Usted debe basarse únicamente en la información que se muestra en nuestro sitio web y siempre debe leer las etiquetas, advertencias y instrucciones antes de usar el consumo de un producto. Información obtenida de NESCAFE TRADICIONAL 50 GRS.11261035 Productos similares Café Instantáneo Nescafe Tradición Tarro 170 g Ver producto Café Instantáneo Nescafe Dolca Tarro 170 g Café Instantáneo Nescafe Tradición Tarro 400 g -40% Café Instantáneo Granulado Nescafe Tradición Tarro 170 g Café Tradición Tarro NESCAFE DOLCA 50 GRS. 11261175 Café Starbucks Medium Roast 90 g -27% Café Instantáneo Black Roast Nescafe 170 g Café Starbucks Dark Roast 90 g Café Instantáneo Liofilizado Cruzeiro 170 g -21% NESCAFE DOLCA TARRO 195GR -29% Café Instantáneo Primera Selección Gold 170 g -10% Café Descafeinado Nescafe 100 g ¡Juntos son mejores! Té Ceylan -33% Té Ceylán -20% Azúcar Blanca Granulada Iansa 1 Kg Azúcar Blanca Granulada Tottus 860 g Té Ceylán Premium Supremo 50 Un Azúcar Blanca Granulada Tottus 1 Kg Sal Fina Yodada Té -25% Azúcar Granulada Iansa 900 g Azúcar -11% FIDEO SPAGHETTI 5 400 GRS. 101409 C Sal Fina Yodada Tottus 1 Kg Carpeta Spaghetti N°5 Lucchetti 400 g Pasta Espiral N°56 Lucchetti 400 g Té Ceylán Premium Supremo 100 Un -12% FIDEO TALLARIN 87 400 GRS. 101407 C FIDEO CORBATA 80 400 GRS. 101302 C FIDEO CAB/CORTO 1 400 GRS. 111109 C ESPIRALES TOTTUS 400 G ESPIRALES TOTTUS 400 GR", "features_text": "", "specifications_text": "", "benefits_text": "", "details_text": "", "other_sections": "", "sections": {"Descripción": ["Café Instantáneo en Polvo Tradición Nescafé", "50g | Actualizado al: 13-05-2025", "Ingredientes: 100% café.", "Certificados: Apto para APLV", "Libre de Lactosa", "Vegano", "Vegetariano", "Libre de Soya", "Libre de Huevo", "Libre de Peces", "Libre de Mariscos", "Libre de Maní", "Libre de Frutos Secos", "Libre de Nueces", "Libre de Sulfitos", "Libre de Trigo", "Kosher", "Importante: La información del empaque y/o contenido del producto final puede diferir respecto a lo que mostramos en nuestro sitio web, tanto a nivel de ingredientes, trazas, información nutricional, sellos, modo de uso y/o modo de conservación. Usted debe basarse únicamente en la información que se muestra en nuestro sitio web y siempre debe leer las etiquetas, advertencias y instrucciones antes de usar el consumo de un producto.", "Información obtenida de", "NESCAFE TRADICIONAL 50 GRS.11261035", "Productos similares", "Café Instantáneo Nescafe Tradición Tarro 170 g", "Ver producto", "Café Instantáneo Nescafe Dolca Tarro 170 g", "Café Instantáneo Nescafe Tradición Tarro 400 g", "-40%", "Café Instantáneo Granulado Nescafe Tradición Tarro 170 g", "Café Tradición Tarro", "NESCAFE DOLCA 50 GRS. 11261175", "Café Starbucks Medium Roast 90 g", "-27%", "Café Instantáneo Black Roast Nescafe 170 g", "Café Starbucks Dark Roast 90 g", "Café Instantáneo Liofilizado Cruzeiro 170 g", "-21%", "NESCAFE DOLCA TARRO 195GR", "-29%", "Café Instantáneo Primera Selección Gold 170 g", "-10%", "Café Descafeinado Nescafe 100 g", "¡Juntos son mejores!", "Té Ceylan", "-33%", "Té Ceylán", "-20%", "Azúcar Blanca Granulada Iansa 1 Kg", "Azúcar Blanca Granulada Tottus 860 g", "Té Ceylán Premium Supremo 50 Un", "Azúcar Blanca Granulada Tottus 1 Kg", "Sal Fina Yodada", "Té", "-25%", "Azúcar Granulada Iansa 900 g", "Azúcar", "-11%", "FIDEO SPAGHETTI 5  400 GRS. 101409 C", "Sal Fina Yodada Tottus 1 Kg", "Pasta Spaghetti N°5 Lucchetti 400 g", "Pasta Espiral N°56 Lucchetti 400 g", "Té Ceylán Premium Supremo 100 Un", "-12%", "FIDEO TALLARIN 87  400 GRS. 101407 C", "FIDEO CORBATA 80  400 GRS. 101302 C", "FIDEO CAB/CORTO 1  400 GRS. 111109 C", "ESPIRALES TOTTUS 400 G", "ESPIRALES   TOTTUS 400 GR"]}, "txt_path": "dataset/txt_limpios/1708.txt", "html_path": "dataset/paginas_descargadas/1708.html", "es_status": "ET", "category_canonical": "cafe", "decision": "keep", "match_score": 0.6, "reasons": "heuristic_default"}
{"source_id": "1712", "title": "Desayuno y Dulces", "description": "Café Liofilizado Café Gold 170g | Actualizado al: 30-05-2025 Ingredientes: 100% café. Certificados: Apto para APLV Libre de Lactosa Vegano Vegetariano Libre de Soya Libre de Huevo Libre de Peces Libre de Mariscos Libre de Maní Libre de Frutas Secos Libre de Nueces Libre de Sulfitos Libre de Trigo Importante: La información del empaque y/o contenido del producto final puede diferir respecto a lo que mostramos en nuestro sitio web, tanto a nivel de ingredientes, trazas, información nutricional, sellos, modo de uso y/o modo de conservación. Usted debe basarse únicamente en la información que se muestra en nuestro sitio web y siempre debe leer las etiquetas, advertencias y instrucciones antes de usar el consumo de un producto. Información obtenida de CAFE LIOFILIZADO ROBUSTA 170GR Productos similares Ver producto Café premier liofilizado Café Descafeinado -13% Café molido descafeinado Café premier frasco Café Liofilizado Café granulado Café Molido Excelso -18% Café Liofilizado Cronat Gold Jacobs 100 g -10% Café Instantáneo En Polvo Descafeinado Café Instantáneo Primera Selección Café Instantáneo Granulado Premier Gold 170 g -16% Café primera selección Café Instantáneo Primera Selección Gold 170 g Café Instantáneo Gold Primera Selección 400 g Café Molido Forte Gold 250 g -24% ¡Juntos son mejores! Té Ceylán Premium Supremo 100 Un -12% Azúcar Blanca Granulada Iansa 1 Kg Azúcar Sal Fina Yodada Té Ceylán Premium Supremo 50 Un Sal Fina Yodada Tottus 1 Kg Té Azúcar Granulada Iansa 900 g ESPIRALES TOTTUS 400 G ESPIRALES TOTTUS 400 GR CORBATAS TOTTUS 400 GR TALLARIN 87 TOTTUS 400 GR Carpeta espiral N°56 Lucchetti 400 g Azúcar Blanca Granulada Tottus 860 g FIDEO CORBATA 80 400 GRS. 101302 C Azúcar Blanca Granulada Tottus 1 Kg FIDEO TALLARIN 87 400 GRS. 101407 C Pasta Spaghetti N°5 Lucchetti 400 g FIDEO CAB/CORTO 1 400 GRS. 111109 C FIDEO SPAGHETTI 5 400 GRS. 101409 C -11%", "breadcrumbs": "Café > 170 GR", "price_raw": "7.49", "currency_raw": "", "url": "", "seller": "Desconocido", "availability": "unknown", "country": "UNKNOWN", "product_name": "Desayuno y Dulces", "brand": "Café", "reference": "", "unit": "170 GR", "price_amount": 7.49, "price_currency": "", "price_symbol": "", "price_text": "7.49", "price_amount_filled": "7.49", "price_is_imputed": "False", "price_imputation_source": "original", "price_amount_usd": "7.49", "price_amount_usd_filled": "7.49", "fx_rate_local_per_usd": "1.0", "fx_source": "default_1usd", "information_text": "", "description_text": "Café Liofilizado Café Gold 170g | Actualizado al: 30-05-2025 Ingredientes: 100% café. Certificados: Apto para APLV Libre de Lactosa Vegano Vegetariano Libre de Soya Libre de Huevo Libre de Peces Libre de Mariscos Libre de Maní Libre de Frutas Secos Libre de Nueces Libre de Sulfitos Libre de Trigo Importante: La información del empaque y/o contenido del producto final puede diferir respecto a lo que mostramos en nuestro sitio web, tanto a nivel de ingredientes, trazas, información nutricional, sellos, modo de uso y/o modo de conservación. Usted debe basarse únicamente en la información que se muestra en nuestro sitio web y siempre debe leer las etiquetas, advertencias y instrucciones antes de usar el consumo de un producto. Información obtenida de CAFE LIOFILIZADO ROBUSTA 170GR Productos similares Ver producto Café premier liofilizado Café Descafeinado -13% Café molido descafeinado Café premier frasco Café Liofilizado Café granulado Café Molido Excelso -18% Café Liofilizado Cronat Gold Jacobs 100 g -10% Café Instantáneo En Polvo Descafeinado Café Instantáneo Primera Selección Café Instantáneo Granulado Premier Gold 170 g -16% Café primera selección Café Instantáneo Primera Selección Gold 170 g Café Instantáneo Gold Primera Selección 400 g Café Molido Forte Gold 250 g -24% ¡Juntos son mejores! Té Ceylán Premium Supremo 100 Un -12% Azúcar Blanca Granulada Iansa 1 Kg Azúcar Sal Fina Yodada Té Ceylán Premium Supremo 50 Un Sal Fina Yodada Tottus 1 Kg Té Azúcar Granulada Iansa 900 g ESPIRALES TOTTUS 400 G ESPIRALES TOTTUS 400 GR CORBATAS TOTTUS 400 GR TALLARIN 87 TOTTUS 400 GR Carpeta espiral N°56 Lucchetti 400 g Azúcar Blanca Granulada Tottus 860 g FIDEO CORBATA 80 400 GRS. 101302 C Azúcar Blanca Granulada Tottus 1 Kg FIDEO TALLARIN 87 400 GRS. 101407 C Pasta Spaghetti N°5 Lucchetti 400 g FIDEO CAB/CORTO 1 400 GRS. 111109 C FIDEO SPAGHETTI 5 400 GRS. 101409 C -11%", "features_text": "", "specifications_text": "", "benefits_text": "", "details_text": "", "other_sections": "", "sections": {"Descripción": ["Café Liofilizado Café Gold", "170g | Actualizado al: 30-05-2025", "Ingredientes: 100% café.", "Certificados: Apto para APLV", "Libre de Lactosa", "Vegano", "Vegetariano", "Libre de Soya", "Libre de Huevo", "Libre de Peces", "Libre de Mariscos", "Libre de Maní", "Libre de Frutos Secos", "Libre de Nueces", "Libre de Sulfitos", "Libre de Trigo", "Importante: La información del empaque y/o contenido del producto final puede diferir respecto a lo que mostramos en nuestro sitio web, tanto a nivel de ingredientes, trazas, información nutricional, sellos, modo de uso y/o modo de conservación. Usted debe basarse únicamente en la información que se muestra en nuestro sitio web y siempre debe leer las etiquetas, advertencias y instrucciones antes de usar el consumo de un producto.", "Información obtenida de", "CAFE LIOFILIZADO ROBUSTA 170GR", "Productos similares", "Ver producto", "Café premier liofilizado", "Café Descafeinado", "-13%", "Café molido descafeinado", "Café premier frasco", "Café Liofilizado", "Café granulado", "Café Molido Excelso", "-18%", "Café Liofilizado Cronat Gold Jacobs 100 g", "-10%", "Café Instantáneo Polvo Descafeinado", "Café Instantáneo Primera Selección", "Café Instantáneo Granulado Premier Gold 170 g", "-16%", "Café primera selección", "Café Instantáneo Primera Selección Gold 170 g", "Café Instantáneo Gold Primera Selección 400 g", "Café Molido Forte Gold 250 g", "-24%", "¡Juntos son mejores!", "Té Ceylán Premium Supremo 100 Un", "-12%", "Azúcar Blanca Granulada Iansa 1 Kg", "Azúcar", "Sal Fina Yodada", "Té Ceylán Premium Supremo 50 Un", "Sal Fina Yodada Tottus 1 Kg", "Té", "Azúcar Granulada Iansa 900 g", "ESPIRALES TOTTUS 400 G", "ESPIRALES   TOTTUS 400 GR", "CORBATAS   TOTTUS 400 GR", "TALLARIN 87   TOTTUS 400 GR", "Pasta Espiral N°56 Lucchetti 400 g", "Azúcar Blanca Granulada Tottus 860 g", "FIDEO CORBATA 80  400 GRS. 101302 C", "Azúcar Blanca Granulada Tottus 1 Kg", "FIDEO TALLARIN 87  400 GRS. 101407 C", "Pasta Spaghetti N°5 Lucchetti 400 g", "FIDEO CAB/CORTO 1  400 GRS. 111109 C", "FIDEO SPAGHETTI 5  400 GRS. 101409 C", "-11%"]}, "txt_path": "dataset/txt_limpios/1712.txt", "html_path": "dataset/paginas_descargadas/1712.html", "es_status": "ET", "category_canonical": "cafe", "decision": "keep", "match_score": 0.6, "reasons": "heuristic_default"}
{"source_id": "1714", "title": "Desayuno y Dulces", "description": "Café Tostado y Molido Qualita Oro Lavazza 250g | Actualizado al: 02-06-2025 Ingredientes: Café tostado molido 100% arábica. Certificados: Apto para APLV Libre de Lactosa Vegano Vegetariano Libre de Soya Libre de Huevo Libre de Peces Libre de Mariscos Libre de Maní Libre de Frutas Secos Libre de Nueces Libre de Sulfitos Libre de Trigo Importante: La información del empaque y/o contenido del producto final puede diferir respecto a lo que mostramos en nuestro sitio web, tanto a nivel de ingredientes, trazas, información nutricional, sellos, modo de uso y/o modo de conservación. Usted debe basarse únicamente en la información que se muestra en nuestro sitio web y siempre debe leer las etiquetas, advertencias y instrucciones antes de usar el consumo de un producto. Información obtenida de productos similares Café Instantaneo Prontissimo Ver producto Café Starbucks Mocha 4 Un NESCAFE DOLCA TARRO 195GR -29% Café Fina Selección -10% Café Clásico DESCAFEINADO NESCAFE 170GR Café Liofilizado Café Instantáneo Lata Café Descafeinado Café Tradición Frasco Café Fina Selección Espresso Frasco -40% Café Tradición Tarro Café Liofilizado Café Moka Super Molido ¡Juntos son mejores! Café Instantáneo Nescafe Fina Selección 200 g Azúcar Rubia", "breadcrumbs": "Café > 250 GR", "price_raw": "13.2", "currency_raw": "", "url": "", "seller": "Desconocido", "availability": "unknown", "country": "UNKNOWN", "product_name": "Desayuno y Dulces", "brand": "Café", "reference": "", "unit": "250 GR", "price_amount": 13.2, "price_currency": "", "price_symbol": "", "price_text": "13.20", "price_amount_filled": "13.2", "price_is_imputed": "False", "price_imputation_source": "original", "price_amount_usd": "13.2", "price_amount_usd_filled": "13.2", "fx_rate_local_per_usd": "1.0", "fx_source": "default_1usd", "information_text": "", "description_text": "Café Tostado y Molido Qualita Oro Lavazza 250g | Actualizado al: 02-06-2025 Ingredientes: Café tostado molido 100% arábica. Certificados: Apto para APLV Libre de Lactosa Vegano Vegetariano Libre de Soya Libre de Huevo Libre de Peces Libre de Mariscos Libre de Maní Libre de Frutas Secos Libre de Nueces Libre de Sulfitos Libre de Trigo Importante: La información del empaque y/o contenido del producto final puede diferir respecto a lo que mostramos en nuestro sitio web, tanto a nivel de ingredientes, trazas, información nutricional, sellos, modo de uso y/o modo de conservación. Usted debe basarse únicamente en la información que se muestra en nuestro sitio web y siempre debe leer las etiquetas, advertencias y instrucciones antes de usar el consumo de un producto. Información obtenida de productos similares Café Instantaneo Prontissimo Ver producto Café Starbucks Mocha 4 Un NESCAFE DOLCA TARRO 195GR -29% Café Fina Selección -10% Café Clásico DESCAFEINADO NESCAFE 170GR Café Liofilizado Café Instantáneo Lata Café Descafeinado Café Tradición Frasco Café Fina Selección Espresso Frasco -40% Café Tradición Tarro Café Liofilizado Café Moka Super Molido ¡Juntos son mejores! Café Instantáneo Nescafe Fina Selección 200 g Azúcar Rubia", "features_text": "", "specifications_text": "", "benefits_text": "", "details_text": "", "other_sections": "", "sections": {"Descripción": ["Café Tostado y Molido Qualita Oro Lavazza", "250g | Actualizado al: 02-06-2025", "Ingredientes: Café tostado molido 100% arábica.", "Certificados: Apto para APLV", "Libre de Lactosa", "Vegano", "Vegetariano", "Libre de Soya", "Libre de Huevo", "Libre de Peces", "Libre de Mariscos", "Libre de Maní", "Libre de Frutos Secos", "Libre de Nueces", "Libre de Sulfitos", "Libre de Trigo", "Importante: La información del empaque y/o contenido del producto final puede diferir respecto a lo que mostramos en nuestro sitio web, tanto a nivel de ingredientes, trazas, información nutricional, sellos, modo de uso y/o modo de conservación. Usted debe basarse únicamente en la información que se muestra en nuestro sitio web y siempre debe leer las etiquetas, advertencias y instrucciones antes de usar el consumo de un producto.", "Información obtenida de", "Productos similares", "Café Instantaneo Prontissimo", "Ver producto", "Café Starbucks Mocha 4 Un", "NESCAFE DOLCA TARRO 195GR", "-29%", "Café Fina Selección", "-10%", "Café Clásico", "DESCAFEINADO NESCAFE 170GR", "Café Liofilizado", "Café Instantáneo Lata", "Café Descafeinado", "Café Tradición Frasco", "Café Fina Selección Espresso Frasco", "-40%", "Café Tradición Tarro", "Cafe Liofilizado", "Café Moka Super Molido", "¡Juntos son mejores!", "Café Instantáneo Nescafe Fina Selección 200 g", "Azúcar Rubia"]}, "txt_path": "dataset/txt_limpios/1714.txt", "html_path": "dataset/paginas_descargadas/1714.html", "es_status": "ET", "category_canonical": "cafe", "decision": "keep", "match_score": 0.6, "reasons": "heuristic_default"}
