source_id,title,description,breadcrumbs,price_raw,currency_raw,url,seller,availability,country,product_name,brand,reference,unit,price_amount,price_currency,price_symbol,price_text,price_amount_filled,price_is_imputed,price_imputation_source,price_amount_usd,price_amount_usd_filled,fx_rate_local_per_usd,fx_source,information_text,description_text,features_text,specifications_text,benefits_text,details_text,other_sections,sections,txt_path,html_path,es_status,category_canonical,decision,match_score,reasons
686,"ASESORAMOS TU COMPRA: 📞(601) 6672004, lun a sab de 7am.a 7pm dom hasta las 6pm","Este producto es vendido, facturado y entregado por Cencosud - Colombia Los precios de los productos pueden cambiar dependiendo de la región. Aplican Términos y Condiciones Desactivados Referencia: 0906601 $ 17 , 99 x gr DISTRIBUIDORA DE ALIMENTOS NO ☆ ¿Todavía tienes tu Tarjeta Cencosud? Solicítala en línea, úsala y obtén un . Aplican términos y condiciones. Solicítala aquí Términos más buscados 1. kefir alpina 2. muebles 3. leche 4. leche alqueria 5. san jorge 6. papel higiénico 7. arroz 8. café 9. cerveza 10. neveras",otras ciudades consulta aquí > 1000gr > 0906601,17.99,COP,,Desconocido,unknown,CO,"ASESORAMOS TU COMPRA: 📞(601) 6672004, lun a sab de 7am.a 7pm dom hasta las 6pm",otras ciudades consulta aquí,906601.0,1000gr,17.99,COP,$,$17.99,17.99,False,original,0.0044,0.0044,4047.0,from_colombia_cambio_dolar,,"Este producto es vendido, facturado y entregado por Cencosud - Colombia Los precios de los productos pueden cambiar dependiendo de la región. Aplican Términos y Condiciones Desactivados Referencia: 0906601 $ 17 , 99 x gr DISTRIBUIDORA DE ALIMENTOS NO ☆ ¿Todavía tienes tu Tarjeta Cencosud? Solicítala en línea, úsala y obtén un . Aplican términos y condiciones. Solicítala aquí Términos más buscados 1. kefir alpina 2. muebles 3. leche 4. leche alqueria 5. san jorge 6. papel higiénico 7. arroz 8. café 9. cerveza 10. neveras",,,,,,"{""Descripción"": [""Este producto es vendido, facturado y entregado por"", ""Cencosud - Colombia"", ""Los precios de los productos pueden cambiar dependiendo de la región."", ""Aplican Términos y Condiciones"", ""Desactivado"", ""Referencia: 0906601"", ""$"", ""17"", "","", ""99"", ""x"", ""gr"", ""DISTRIBUIDORA DE ALIMENTOS NO"", ""☆"", ""¿Todavía tienes tu Tarjeta Cencosud?"", ""Solicítala en línea, úsala y obtén un"", "". Aplican términos y condiciones."", ""Solicítala aquí"", ""Términos más buscados"", ""1."", ""kefir alpina"", ""2."", ""muebles"", ""3."", ""leche"", ""4."", ""leche alqueria"", ""5."", ""san jorge"", ""6."", ""papel higienico"", ""7."", ""arroz"", ""8."", ""cafe"", ""9."", ""cerveza"", ""10."", ""neveras""]}",dataset/txt_limpios/686.txt,dataset/paginas_descargadas/686.html,ET,cafe,keep,0.60,heuristic_default
687,"ASESORAMOS TU COMPRA: 📞(601) 6672004, lun a sab de 7am.a 7pm dom hasta las 6pm",,otras ciudades consulta aquí > 500gr > 0090135,1.69,COP,,Desconocido,unknown,CO,"ASESORAMOS TU COMPRA: 📞(601) 6672004, lun a sab de 7am.a 7pm dom hasta las 6pm",otras ciudades consulta aquí,90135.0,500gr,1.69,COP,$,$1.69,1.69,False,original,0.0004,0.0004,4047.0,from_colombia_cambio_dolar,,,,,,,,{},dataset/txt_limpios/687.txt,dataset/paginas_descargadas/687.html,ET,sin_categoria,discard,0.30,no_category_detected
688,"ASESORAMOS TU COMPRA: 📞(601) 6672004, lun a sab de 7am.a 7pm dom hasta las 6pm","Lleva tu casa lo mejor en frutas y hortalizas, que han sido seleccionadas y clasificadas, con los mejores estándares de calidad que te ofrece Jumbo.co. Este producto es vendido, facturado y entregado por Cencosud - Colombia Los precios de los productos pueden cambiar dependiendo de la región. Aplican Términos y Condiciones Desactivados Referencia: 0059548 $ 3 , 58 x gr A GRANEL ☆ ¿Todavía tienes tu Tarjeta Cencosud? Solicítala en línea, úsala y obtén un . Aplican términos y condiciones. Solicítala aquí Términos más buscados 1. kefir alpina 2. muebles 3. leche 4. leche alqueria 5. san jorge 6. papel higiénico 7. arroz 8. café 9. cerveza 10. neveras",otras ciudades consulta aquí > 0059548,1.79,COP,,Desconocido,unknown,CO,"ASESORAMOS TU COMPRA: 📞(601) 6672004, lun a sab de 7am.a 7pm dom hasta las 6pm",otras ciudades consulta aquí,59548.0,,1.79,COP,$,$1.79,1.79,False,original,0.0004,0.0004,4047.0,from_colombia_cambio_dolar,,"Lleva tu casa lo mejor en frutas y hortalizas, que han sido seleccionadas y clasificadas, con los mejores estándares de calidad que te ofrece Jumbo.co. Este producto es vendido, facturado y entregado por Cencosud - Colombia Los precios de los productos pueden cambiar dependiendo de la región. Aplican Términos y Condiciones Desactivados Referencia: 0059548 $ 3 , 58 x gr A GRANEL ☆ ¿Todavía tienes tu Tarjeta Cencosud? Solicítala en línea, úsala y obtén un . Aplican términos y condiciones. Solicítala aquí Términos más buscados 1. kefir alpina 2. muebles 3. leche 4. leche alqueria 5. san jorge 6. papel higiénico 7. arroz 8. café 9. cerveza 10. neveras",,,,,,"{""Descripción"": [""Lleva tu casa lo mejor en frutas y hortalizas, que han sido seleccionadas y clasificadas, con los mejores estándares de calidad que te ofrece Jumbo.co"", ""Este producto es vendido, facturado y entregado por"", ""Cencosud - Colombia"", ""Los precios de los productos pueden cambiar dependiendo de la región."", ""Aplican Términos y Condiciones"", ""Desactivado"", ""Referencia: 0059548"", ""$"", ""3"", "","", ""58"", ""x"", ""gr"", ""A GRANEL"", ""☆"", ""¿Todavía tienes tu Tarjeta Cencosud?"", ""Solicítala en línea, úsala y obtén un"", "". Aplican términos y condiciones."", ""Solicítala aquí"", ""Términos más buscados"", ""1."", ""kefir alpina"", ""2."", ""muebles"", ""3."", ""leche"", ""4."", ""leche alqueria"", ""5."", ""san jorge"", ""6."", ""papel higienico"", ""7."", ""arroz"", ""8."", ""cafe"", ""9."", ""cerveza"", ""10."", ""neveras""]}",dataset/txt_limpios/688.txt,dataset/paginas_descargadas/688.html,ET,cafe,keep,0.60,heuristic_default
689,"ASESORAMOS TU COMPRA: 📞(601) 6672004, lun a sab de 7am.a 7pm dom hasta las 6pm","Disfruta con tu familia y amigos todas las deliciosas recetas que puedes preparar con los productos más frescos que traemos para ti. Este producto es vendido, facturado y entregado por Cencosud - Colombia Los precios de los productos pueden cambiar dependiendo de la región. Aplican Términos y Condiciones Desactivados Referencia: 0258508 $ 2 x gr MAXIMA MP ☆ ¿Todavía tienes tu Tarjeta Cencosud? Solicítala en línea, úsala y obtén un . Aplican términos y condiciones. Solicítala aquí Términos más buscados 1. kefir alpina 2. muebles 3. leche 4. leche alqueria 5. san jorge 6. papel higiénico 7. arroz 8. café 9. cerveza 10. neveras",otras ciudades consulta aquí > 2500gr > 0258508,4.99,COP,,Desconocido,unknown,CO,"ASESORAMOS TU COMPRA: 📞(601) 6672004, lun a sab de 7am.a 7pm dom hasta las 6pm",otras ciudades consulta aquí,258508.0,2500gr,4.99,COP,$,$4.99,4.99,False,original,0.0012,0.0012,4047.0,from_colombia_cambio_dolar,,"Disfruta con tu familia y amigos todas las deliciosas recetas que puedes preparar con los productos más frescos que traemos para ti. Este producto es vendido, facturado y entregado por Cencosud - Colombia Los precios de los productos pueden cambiar dependiendo de la región. Aplican Términos y Condiciones Desactivados Referencia: 0258508 $ 2 x gr MAXIMA MP ☆ ¿Todavía tienes tu Tarjeta Cencosud? Solicítala en línea, úsala y obtén un . Aplican términos y condiciones. Solicítala aquí Términos más buscados 1. kefir alpina 2. muebles 3. leche 4. leche alqueria 5. san jorge 6. papel higiénico 7. arroz 8. café 9. cerveza 10. neveras",,,,,,"{""Descripción"": [""Disfruta con tu familia y amigos todas las deliciosas recetas que puedes preparar con los productos más frescos que traemos para ti."", ""Este producto es vendido, facturado y entregado por"", ""Cencosud - Colombia"", ""Los precios de los productos pueden cambiar dependiendo de la región."", ""Aplican Términos y Condiciones"", ""Desactivado"", ""Referencia: 0258508"", ""$"", ""2"", ""x"", ""gr"", ""MAXIMA MP"", ""☆"", ""¿Todavía tienes tu Tarjeta Cencosud?"", ""Solicítala en línea, úsala y obtén un"", "". Aplican términos y condiciones."", ""Solicítala aquí"", ""Términos más buscados"", ""1."", ""kefir alpina"", ""2."", ""muebles"", ""3."", ""leche"", ""4."", ""leche alqueria"", ""5."", ""san jorge"", ""6."", ""papel higienico"", ""7."", ""arroz"", ""8."", ""cafe"", ""9."", ""cerveza"", ""10."", ""neveras""]}",dataset/txt_limpios/689.txt,dataset/paginas_descargadas/689.html,ET,cafe,keep,0.60,heuristic_default
690,"ASESORAMOS TU COMPRA: 📞(601) 6672004, lun a sab de 7am.a 7pm dom hasta las 6pm","Las papas McCain son las mejores para acompañar tus deseos y platos especiales Este producto es vendido, facturado y entregado por Cencosud - Colombia Los precios de los productos pueden cambiar dependiendo de la región. Aplican Términos y Condiciones APLICACIÓN PARA Referencia: 3364715 $ 26 , 39 x gr MC CAIN ☆ ¿Todavía tienes tu Tarjeta Cencosud? Solicítala en línea, úsala y obtén un . Aplican términos y condiciones. Solicítala aquí Mejores ofertas -5% Términos más buscados 1. kefir alpina 2. muebles 3. leche 4. leche alqueria 5. san jorge 6. papel higiénico 7. arroz 8. café 9. cerveza 10. neveras",otras ciudades consulta aquí > 3364715,26.39,COP,,Desconocido,unknown,CO,"ASESORAMOS TU COMPRA: 📞(601) 6672004, lun a sab de 7am.a 7pm dom hasta las 6pm",otras ciudades consulta aquí,3364715.0,,26.39,COP,$,$26.39,26.39,False,original,0.0065,0.0065,4047.0,from_colombia_cambio_dolar,,"Las papas McCain son las mejores para acompañar tus deseos y platos especiales Este producto es vendido, facturado y entregado por Cencosud - Colombia Los precios de los productos pueden cambiar dependiendo de la región. Aplican Términos y Condiciones APLICACIÓN PARA Referencia: 3364715 $ 26 , 39 x gr MC CAIN ☆ ¿Todavía tienes tu Tarjeta Cencosud? Solicítala en línea, úsala y obtén un . Aplican términos y condiciones. Solicítala aquí Mejores ofertas -5% Términos más buscados 1. kefir alpina 2. muebles 3. leche 4. leche alqueria 5. san jorge 6. papel higiénico 7. arroz 8. café 9. cerveza 10. neveras",,,,,,"{""Descripción"": [""Las papas McCain son las mejores para acompañar tus antojos y platos especiales"", ""Este producto es vendido, facturado y entregado por"", ""Cencosud - Colombia"", ""Los precios de los productos pueden cambiar dependiendo de la región."", ""Aplican Términos y Condiciones"", ""APLICA PARA"", ""Referencia: 3364715"", ""$"", ""26"", "","", ""39"", ""x"", ""gr"", ""MC CAIN"", ""☆"", ""¿Todavía tienes tu Tarjeta Cencosud?"", ""Solicítala en línea, úsala y obtén un"", "". Aplican términos y condiciones."", ""Solicítala aquí"", ""Mejores ofertas"", ""-5%"", ""Términos más buscados"", ""1."", ""kefir alpina"", ""2."", ""muebles"", ""3."", ""leche"", ""4."", ""leche alqueria"", ""5."", ""san jorge"", ""6."", ""papel higienico"", ""7."", ""arroz"", ""8."", ""cafe"", ""9."", ""cerveza"", ""10."", ""neveras""]}",dataset/txt_limpios/690.txt,dataset/paginas_descargadas/690.html,ET,papa,keep,0.60,heuristic_default
691,"ASESORAMOS TU COMPRA: 📞(601) 6672004, lun a sab de 7am.a 7pm dom hasta las 6pm","Ingredientes Condición alimentaria Información nutricional Acompaña tus comidas con el delicioso sabor del queso Colanta. Fresco, rico y versatil. Este producto es vendido, facturado y entregado por Cencosud - Colombia Los precios de los productos pueden cambiar dependiendo de la región. Aplican Términos y Condiciones Referencia: 0019252 $ 27, 37 x gr COLANTA ☆ ¿Todavía tienes tu Tarjeta Cencosud? Solicítala en línea, úsala y obtén un . Aplican términos y condiciones. Solicítala aquí Mejores ofertas -25% -19% Términos más buscados 1. kefir alpina 2. muebles 3. leche 4. leche alqueria 5. san jorge 6. papel higiénico 7. arroz 8. café 9. cerveza 10. neveras",otras ciudades consulta aquí > 0019252,500.0,COP,,Desconocido,unknown,CO,"ASESORAMOS TU COMPRA: 📞(601) 6672004, lun a sab de 7am.a 7pm dom hasta las 6pm",otras ciudades consulta aquí,19252.0,,500.00,COP,,500,500.0,False,original,0.1235,0.1235,4047.0,from_colombia_cambio_dolar,,"Ingredientes Condición alimentaria Información nutricional Acompaña tus comidas con el delicioso sabor del queso Colanta. Fresco, rico y versatil. Este producto es vendido, facturado y entregado por Cencosud - Colombia Los precios de los productos pueden cambiar dependiendo de la región. Aplican Términos y Condiciones Referencia: 0019252 $ 27, 37 x gr COLANTA ☆ ¿Todavía tienes tu Tarjeta Cencosud? Solicítala en línea, úsala y obtén un . Aplican términos y condiciones. Solicítala aquí Mejores ofertas -25% -19% Términos más buscados 1. kefir alpina 2. muebles 3. leche 4. leche alqueria 5. san jorge 6. papel higiénico 7. arroz 8. café 9. cerveza 10. neveras",,,,,,"{""Descripción"": [""Ingredientes"", ""Condición alimentaria"", ""Información nutricional"", ""Acompaña tus comidas con el delicioso sabor del queso Colanta. Fresco, rico y versatil."", ""Este producto es vendido, facturado y entregado por"", ""Cencosud - Colombia"", ""Los precios de los productos pueden cambiar dependiendo de la región."", ""Aplican Términos y Condiciones"", ""Referencia: 0019252"", ""$"", ""27"", "","", ""37"", ""x"", ""gr"", ""COLANTA"", ""☆"", ""¿Todavía tienes tu Tarjeta Cencosud?"", ""Solicítala en línea, úsala y obtén un"", "". Aplican términos y condiciones."", ""Solicítala aquí"", ""Mejores ofertas"", ""-25%"", ""-19%"", ""Términos más buscados"", ""1."", ""kefir alpina"", ""2."", ""muebles"", ""3."", ""leche"", ""4."", ""leche alqueria"", ""5."", ""san jorge"", ""6."", ""papel higienico"", ""7."", ""arroz"", ""8."", ""cafe"", ""9."", ""cerveza"", ""10."", ""neveras""]}",dataset/txt_limpios/691.txt,dataset/paginas_descargadas/691.html,ET,cafe,keep,0.60,heuristic_default
692,"ASESORAMOS TU COMPRA: 📞(601) 6672004, lun a sab de 7am.a 7pm dom hasta las 6pm","Ingredientes Condición alimentaria Información nutricional Prepara y disfruta deliciosas recetas con queso mozarella Alpina. Este producto es vendido, facturado y entregado por Cencosud - Colombia Los precios de los productos pueden cambiar dependiendo de la región. Aplican Términos y Condiciones Desactivados Referencia: 0098841 $ 56, 38 x gr ALPINA ☆ ¿Todavía tienes tu Tarjeta Cencosud? Solicítala en línea, úsala y obtén un . Aplican términos y condiciones. Solicítala aquí Términos más buscados 1. kefir alpina 2. muebles 3. leche 4. leche alqueria 5. san jorge 6. papel higiénico 7. arroz 8. café 9. cerveza 10. neveras",otras ciudades consulta aquí > 0098841,25.0,COP,,Desconocido,unknown,CO,"ASESORAMOS TU COMPRA: 📞(601) 6672004, lun a sab de 7am.a 7pm dom hasta las 6pm",otras ciudades consulta aquí,98841.0,,25.00,COP,,25,25.0,False,original,0.0062,0.0062,4047.0,from_colombia_cambio_dolar,,"Ingredientes Condición alimentaria Información nutricional Prepara y disfruta deliciosas recetas con queso mozarella Alpina. Este producto es vendido, facturado y entregado por Cencosud - Colombia Los precios de los productos pueden cambiar dependiendo de la región. Aplican Términos y Condiciones Desactivados Referencia: 0098841 $ 56, 38 x gr ALPINA ☆ ¿Todavía tienes tu Tarjeta Cencosud? Solicítala en línea, úsala y obtén un . Aplican términos y condiciones. Solicítala aquí Términos más buscados 1. kefir alpina 2. muebles 3. leche 4. leche alqueria 5. san jorge 6. papel higiénico 7. arroz 8. café 9. cerveza 10. neveras",,,,,,"{""Descripción"": [""Ingredientes"", ""Condición alimentaria"", ""Información nutricional"", ""Prepara y disfruta deliciosas recetas con queso mozarella Alpina."", ""Este producto es vendido, facturado y entregado por"", ""Cencosud - Colombia"", ""Los precios de los productos pueden cambiar dependiendo de la región."", ""Aplican Términos y Condiciones"", ""Desactivado"", ""Referencia: 0098841"", ""$"", ""56"", "","", ""38"", ""x"", ""gr"", ""ALPINA"", ""☆"", ""¿Todavía tienes tu Tarjeta Cencosud?"", ""Solicítala en línea, úsala y obtén un"", "". Aplican términos y condiciones."", ""Solicítala aquí"", ""Términos más buscados"", ""1."", ""kefir alpina"", ""2."", ""muebles"", ""3."", ""leche"", ""4."", ""leche alqueria"", ""5."", ""san jorge"", ""6."", ""papel higienico"", ""7."", ""arroz"", ""8."", ""cafe"", ""9."", ""cerveza"", ""10."", ""neveras""]}",dataset/txt_limpios/692.txt,dataset/paginas_descargadas/692.html,ET,cafe,keep,0.60,heuristic_default
693,"ASESORAMOS TU COMPRA: 📞(601) 6672004, lun a sab de 7am.a 7pm dom hasta las 6pm","Queso fresco, semiblando y semiduro para disfrutar a cualquier hora del día. Este producto es vendido, facturado y entregado por Cencosud - Colombia Los precios de los productos pueden cambiar dependiendo de la región. Aplican Términos y Condiciones Desactivados Referencia: 3563010 $ 41, 48 x gr SUPERIOR ☆ ¿Todavía tienes tu Tarjeta Cencosud? Solicítala en línea, úsala y obtén un . Aplican términos y condiciones. Solicítala aquí Términos más buscados 1. kefir alpina 2. muebles 3. leche 4. leche alqueria 5. san jorge 6. papel higiénico 7. arroz 8. café 9. cerveza 10. neveras",otras ciudades consulta aquí > 3563010,400.0,COP,,Desconocido,unknown,CO,"ASESORAMOS TU COMPRA: 📞(601) 6672004, lun a sab de 7am.a 7pm dom hasta las 6pm",otras ciudades consulta aquí,3563010.0,,400.00,COP,,400,400.0,False,original,0.0988,0.0988,4047.0,from_colombia_cambio_dolar,,"Queso fresco, semiblando y semiduro para disfrutar a cualquier hora del día. Este producto es vendido, facturado y entregado por Cencosud - Colombia Los precios de los productos pueden cambiar dependiendo de la región. Aplican Términos y Condiciones Desactivados Referencia: 3563010 $ 41, 48 x gr SUPERIOR ☆ ¿Todavía tienes tu Tarjeta Cencosud? Solicítala en línea, úsala y obtén un . Aplican términos y condiciones. Solicítala aquí Términos más buscados 1. kefir alpina 2. muebles 3. leche 4. leche alqueria 5. san jorge 6. papel higiénico 7. arroz 8. café 9. cerveza 10. neveras",,,,,,"{""Descripción"": [""Queso fresco, semiblando y semiduro para disfrutar a cualquier hora del día."", ""Este producto es vendido, facturado y entregado por"", ""Cencosud - Colombia"", ""Los precios de los productos pueden cambiar dependiendo de la región."", ""Aplican Términos y Condiciones"", ""Desactivado"", ""Referencia: 3563010"", ""$"", ""41"", "","", ""48"", ""x"", ""gr"", ""SUPERIOR"", ""☆"", ""¿Todavía tienes tu Tarjeta Cencosud?"", ""Solicítala en línea, úsala y obtén un"", "". Aplican términos y condiciones."", ""Solicítala aquí"", ""Términos más buscados"", ""1."", ""kefir alpina"", ""2."", ""muebles"", ""3."", ""leche"", ""4."", ""leche alqueria"", ""5."", ""san jorge"", ""6."", ""papel higienico"", ""7."", ""arroz"", ""8."", ""cafe"", ""9."", ""cerveza"", ""10."", ""neveras""]}",dataset/txt_limpios/693.txt,dataset/paginas_descargadas/693.html,ET,cafe,keep,0.60,heuristic_default
694,"ASESORAMOS TU COMPRA: 📞(601) 6672004, lun a sab de 7am.a 7pm dom hasta las 6pm","Prueba el irresistible sabor del queso mozzarella Campo Real y combínalo con lo que más te guste. Este producto es vendido, facturado y entregado por Cencosud - Colombia Los precios de los productos pueden cambiar dependiendo de la región. Aplican Términos y Condiciones Referencia: 3551925 $ 40 , 3 x gr CAMPO REAL ☆ ¿Todavía tienes tu Tarjeta Cencosud? Solicítala en línea, úsala y obtén un . Aplican términos y condiciones. Solicítala aquí Mejores ofertas -35% -24% Términos más buscados 1. kefir alpina 2. muebles 3. leche 4. leche alqueria 5. san jorge 6. papel higiénico 7. arroz 8. café 9. cerveza 10. neveras",otras ciudades consulta aquí > 3551925,500.0,COP,,Desconocido,unknown,CO,"ASESORAMOS TU COMPRA: 📞(601) 6672004, lun a sab de 7am.a 7pm dom hasta las 6pm",otras ciudades consulta aquí,3551925.0,,500.00,COP,,500,500.0,False,original,0.1235,0.1235,4047.0,from_colombia_cambio_dolar,,"Prueba el irresistible sabor del queso mozzarella Campo Real y combínalo con lo que más te guste. Este producto es vendido, facturado y entregado por Cencosud - Colombia Los precios de los productos pueden cambiar dependiendo de la región. Aplican Términos y Condiciones Referencia: 3551925 $ 40 , 3 x gr CAMPO REAL ☆ ¿Todavía tienes tu Tarjeta Cencosud? Solicítala en línea, úsala y obtén un . Aplican términos y condiciones. Solicítala aquí Mejores ofertas -35% -24% Términos más buscados 1. kefir alpina 2. muebles 3. leche 4. leche alqueria 5. san jorge 6. papel higiénico 7. arroz 8. café 9. cerveza 10. neveras",,,,,,"{""Descripción"": [""Prueba el irresistible sabor del queso mozzarella Campo Real y combínalo con lo que más te guste."", ""Este producto es vendido, facturado y entregado por"", ""Cencosud - Colombia"", ""Los precios de los productos pueden cambiar dependiendo de la región."", ""Aplican Términos y Condiciones"", ""Referencia: 3551925"", ""$"", ""40"", "","", ""3"", ""x"", ""gr"", ""CAMPO REAL"", ""☆"", ""¿Todavía tienes tu Tarjeta Cencosud?"", ""Solicítala en línea, úsala y obtén un"", "". Aplican términos y condiciones."", ""Solicítala aquí"", ""Mejores ofertas"", ""-35%"", ""-24%"", ""Términos más buscados"", ""1."", ""kefir alpina"", ""2."", ""muebles"", ""3."", ""leche"", ""4."", ""leche alqueria"", ""5."", ""san jorge"", ""6."", ""papel higienico"", ""7."", ""arroz"", ""8."", ""cafe"", ""9."", ""cerveza"", ""10."", ""neveras""]}",dataset/txt_limpios/694.txt,dataset/paginas_descargadas/694.html,ET,cafe,keep,0.60,heuristic_default
