{"source_id": "454", "title": "Acerca de tu privacidad", "description": "", "breadcrumbs": "Más información", "price_raw": "", "currency_raw": "ARS", "url": "", "seller": "Desconocido", "availability": "unknown", "country": "AR", "product_name": "Acerca de tu privacidad", "brand": "Más información", "reference": "", "unit": "", "price_amount": null, "price_currency": "ARS", "price_symbol": "", "price_text": "", "price_amount_filled": "1663.58", "price_is_imputed": "True", "price_imputation_source": "country_mean", "price_amount_usd": "", "price_amount_usd_filled": "1.3256", "fx_rate_local_per_usd": "1255.0", "fx_source": "from_argentina_cambio_dolar", "information_text": "", "description_text": "", "features_text": "", "specifications_text": "", "benefits_text": "", "details_text": "", "other_sections": "", "sections": {}, "txt_path": "dataset/txt_limpios/454.txt", "html_path": "dataset/paginas_descargadas/454.html", "es_status": "EN", "category_canonical": "sin_categoria", "decision": "discard", "match_score": 0.3, "reasons": "no_category_detected;price_parse_failed"}
{"source_id": "269", "title": "Al continuar navegando, usted acepta con nuestra", "description": "", "breadcrumbs": "Política de privacidad > 12 unidades", "price_raw": "20.0", "currency_raw": "BRL", "url": "", "seller": "Desconocido", "availability": "unknown", "country": "BR", "product_name": "Al continuar navegando, usted acepta con nuestra", "brand": "Política de privacidad", "reference": "", "unit": "12 unidades", "price_amount": 20.0, "price_currency": "BRL", "price_symbol": "R$", "price_text": "R$20,00", "price_amount_filled": "20.0", "price_is_imputed": "False", "price_imputation_source": "original", "price_amount_usd": "3.6711", "price_amount_usd_filled": "3.6711", "fx_rate_local_per_usd": "5.448", "fx_source": "from_brasil_cambio_dolar", "information_text": "", "description_text": "", "features_text": "", "specifications_text": "", "benefits_text": "", "details_text": "", "other_sections": "", "sections": {}, "txt_path": "dataset/txt_limpios/269.txt", "html_path": "dataset/paginas_descargadas/269.html", "es_status": "ET", "category_canonical": "sin_categoria", "decision": "discard", "match_score": 0.3, "reasons": "no_category_detected"}
{"source_id": "1605", "title": "Alimentos básicos", "description": "", "breadcrumbs": "Frijoles > 1 Kg", "price_raw": "", "currency_raw": "", "url": "", "seller": "Desconocido", "availability": "unknown", "country": "UNKNOWN", "product_name": "Alimentos básicos", "brand": "Frijoles", "reference": "", "unit": "1 Kg", "price_amount": null, "price_currency": "", "price_symbol": "", "price_text": "", "price_amount_filled": "1.02", "price_is_imputed": "True", "price_imputation_source": "category_mean", "price_amount_usd": "", "price_amount_usd_filled": "1.02", "fx_rate_local_per_usd": "1.0", "fx_source": "default_1usd", "information_text": "", "description_text": "", "features_text": "", "specifications_text": "", "benefits_text": "", "details_text": "", "other_sections": "", "sections": {}, "txt_path": "dataset/txt_limpios/1605.txt", "html_path": "dataset/paginas_descargadas/1605.html", "es_status": "ET", "category_canonical": "frijoles", "decision": "discard", "match_score": 0.6, "reasons": "price_parse_failed;price<=0"}
{"source_id": "1606", "title": "Alimentos básicos", "description": "", "breadcrumbs": "Frijoles > 1Kg", "price_raw": "", "currency_raw": "", "url": "", "seller": "Desconocido", "availability": "unknown", "country": "UNKNOWN", "product_name": "Alimentos básicos", "brand": "Frijoles", "reference": "", "unit": "1Kg", "price_amount": null, "price_currency": "", "price_symbol": "", "price_text": "", "price_amount_filled": "1.02", "price_is_imputed": "True", "price_imputation_source": "category_mean", "price_amount_usd": "", "price_amount_usd_filled": "1.02", "fx_rate_local_per_usd": "1.0", "fx_source": "default_1usd", "information_text": "", "description_text": "", "features_text": "", "specifications_text": "", "benefits_text": "", "details_text": "", "other_sections": "", "sections": {}, "txt_path": "dataset/txt_limpios/1606.txt", "html_path": "dataset/paginas_descargadas/1606.html", "es_status": "ET", "category_canonical": "frijoles", "decision": "discard", "match_score": 0.6, "reasons": "price_parse_failed;price<=0"}
{"source_id": "1608", "title": "Alimentos básicos", "description": "", "breadcrumbs": "Frijoles > 1 Kg", "price_raw": "", "currency_raw": "", "url": "", "seller": "Desconocido", "availability": "unknown", "country": "UNKNOWN", "product_name": "Alimentos básicos", "brand": "Frijoles", "reference": "", "unit": "1 Kg", "price_amount": null, "price_currency": "", "price_symbol": "", "price_text": "", "price_amount_filled": "1.02", "price_is_imputed": "True", "price_imputation_source": "category_mean", "price_amount_usd": "", "price_amount_usd_filled": "1.02", "fx_rate_local_per_usd": "1.0", "fx_source": "default_1usd", "information_text": "", "description_text": "", "features_text": "", "specifications_text": "", "benefits_text": "", "details_text": "", "other_sections": "", "sections": {}, "txt_path": "dataset/txt_limpios/1608.txt", "html_path": "dataset/paginas_descargadas/1608.html", "es_status": "ET", "category_canonical": "frijoles", "decision": "discard", "match_score": 0.6, "reasons": "price_parse_failed;price<=0"}
{"source_id": "1610", "title": "Alimentos básicos", "description": "", "breadcrumbs": "Frijoles > 1Kg", "price_raw": "", "currency_raw": "", "url": "", "seller": "Desconocido", "availability": "unknown", "country": "UNKNOWN", "product_name": "Alimentos básicos", "brand": "Frijoles", "reference": "", "unit": "1Kg", "price_amount": null, "price_currency": "", "price_symbol": "", "price_text": "", "price_amount_filled": "1.02", "price_is_imputed": "True", "price_imputation_source": "category_mean", "price_amount_usd": "", "price_amount_usd_filled": "1.02", "fx_rate_local_per_usd": "1.0", "fx_source": "default_1usd", "information_text": "", "description_text": "", "features_text": "", "specifications_text": "", "benefits_text": "", "details_text": "", "other_sections": "", "sections": {}, "txt_path": "dataset/txt_limpios/1610.txt", "html_path": "dataset/paginas_descargadas/1610.html", "es_status": "ET", "category_canonical": "frijoles", "decision": "discard", "match_score": 0.6, "reasons": "price_parse_failed;price<=0"}
{"source_id": "1612", "title": "Alimentos básicos", "description": "", "breadcrumbs": "Frijoles > 1 kg", "price_raw": "", "currency_raw": "", "url": "", "seller": "Desconocido", "availability": "unknown", "country": "UNKNOWN", "product_name": "Alimentos básicos", "brand": "Frijoles", "reference": "", "unit": "1 kg", "price_amount": null, "price_currency": "", "price_symbol": "", "price_text": "", "price_amount_filled": "1.02", "price_is_imputed": "True", "price_imputation_source": "category_mean", "price_amount_usd": "", "price_amount_usd_filled": "1.02", "fx_rate_local_per_usd": "1.0", "fx_source": "default_1usd", "information_text": "", "description_text": "", "features_text": "", "specifications_text": "", "benefits_text": "", "details_text": "", "other_sections": "", "sections": {}, "txt_path": "dataset/txt_limpios/1612.txt", "html_path": "dataset/paginas_descargadas/1612.html", "es_status": "ET", "category_canonical": "frijoles", "decision": "discard", "match_score": 0.6, "reasons": "price_parse_failed;price<=0"}
{"source_id": "180", "title": "Alimentos básicos", "description": "", "breadcrumbs": "Arroz > 5Kg", "price_raw": "23.89", "currency_raw": "BRL", "url": "", "seller": "Desconocido", "availability": "unknown", "country": "BR", "product_name": "Alimentos básicos", "brand": "Arroz", "reference": "", "unit": "5Kg", "price_amount": 23.89, "price_currency": "BRL", "price_symbol": "R$", "price_text": "R$23,89", "price_amount_filled": "23.89", "price_is_imputed": "False", "price_imputation_source": "original", "price_amount_usd": "4.3851", "price_amount_usd_filled": "4.3851", "fx_rate_local_per_usd": "5.448", "fx_source": "from_brasil_cambio_dolar", "information_text": "", "description_text": "", "features_text": "", "specifications_text": "", "benefits_text": "", "details_text": "", "other_sections": "", "sections": {}, "txt_path": "dataset/txt_limpios/180.txt", "html_path": "dataset/paginas_descargadas/180.html", "es_status": "ET", "category_canonical": "arroz", "decision": "keep", "match_score": 0.6, "reasons": "heuristic_default"}
{"source_id": "181", "title": "Alimentos básicos", "description": "", "breadcrumbs": "Arroz > 5Kg", "price_raw": "18.59", "currency_raw": "BRL", "url": "", "seller": "Desconocido", "availability": "unknown", "country": "BR", "product_name": "Alimentos básicos", "brand": "Arroz", "reference": "", "unit": "5Kg", "price_amount": 18.59, "price_currency": "BRL", "price_symbol": "R$", "price_text": "R$18,59", "price_amount_filled": "18.59", "price_is_imputed": "False", "price_imputation_source": "original", "price_amount_usd": "3.4123", "price_amount_usd_filled": "3.4123", "fx_rate_local_per_usd": "5.448", "fx_source": "from_brasil_cambio_dolar", "information_text": "", "description_text": "", "features_text": "", "specifications_text": "", "benefits_text": "", "details_text": "", "other_sections": "", "sections": {}, "txt_path": "dataset/txt_limpios/181.txt", "html_path": "dataset/paginas_descargadas/181.html", "es_status": "ET", "category_canonical": "arroz", "decision": "keep", "match_score": 0.6, "reasons": "heuristic_default"}
{"source_id": "182", "title": "Alimentos básicos", "description": "", "breadcrumbs": "Arroz > 2Kg", "price_raw": "11.99", "currency_raw": "BRL", "url": "", "seller": "Desconocido", "availability": "unknown", "country": "BR", "product_name": "Alimentos básicos", "brand": "Arroz", "reference": "", "unit": "2Kg", "price_amount": 11.99, "price_currency": "BRL", "price_symbol": "R$", "price_text": "R$11,99", "price_amount_filled": "11.99", "price_is_imputed": "False", "price_imputation_source": "original", "price_amount_usd": "2.2008", "price_amount_usd_filled": "2.2008", "fx_rate_local_per_usd": "5.448", "fx_source": "from_brasil_cambio_dolar", "information_text": "", "description_text": "", "features_text": "", "specifications_text": "", "benefits_text": "", "details_text": "", "other_sections": "", "sections": {}, "txt_path": "dataset/txt_limpios/182.txt", "html_path": "dataset/paginas_descargadas/182.html", "es_status": "ET", "category_canonical": "arroz", "decision": "keep", "match_score": 0.6, "reasons": "heuristic_default"}
{"source_id": "183", "title": "Alimentos básicos", "description": "", "breadcrumbs": "Arroz > 5 kg", "price_raw": "16.59", "currency_raw": "BRL", "url": "", "seller": "Desconocido", "availability": "unknown", "country": "BR", "product_name": "Alimentos básicos", "brand": "Arroz", "reference": "", "unit": "5 kg", "price_amount": 16.59, "price_currency": "BRL", "price_symbol": "R$", "price_text": "R$16,59", "price_amount_filled": "16.59", "price_is_imputed": "False", "price_imputation_source": "original", "price_amount_usd": "3.0452", "price_amount_usd_filled": "3.0452", "fx_rate_local_per_usd": "5.448", "fx_source": "from_brasil_cambio_dolar", "information_text": "", "description_text": "", "features_text": "", "specifications_text": "", "benefits_text": "", "details_text": "", "other_sections": "", "sections": {}, "txt_path": "dataset/txt_limpios/183.txt", "html_path": "dataset/paginas_descargadas/183.html", "es_status": "ET", "category_canonical": "arroz", "decision": "keep", "match_score": 0.6, "reasons": "heuristic_default"}
{"source_id": "184", "title": "Alimentos básicos", "description": "", "breadcrumbs": "Arroz > 5Kg", "price_raw": "19.49", "currency_raw": "BRL", "url": "", "seller": "Desconocido", "availability": "unknown", "country": "BR", "product_name": "Alimentos básicos", "brand": "Arroz", "reference": "", "unit": "5Kg", "price_amount": 19.49, "price_currency": "BRL", "price_symbol": "R$", "price_text": "R$19,49", "price_amount_filled": "19.49", "price_is_imputed": "False", "price_imputation_source": "original", "price_amount_usd": "3.5775", "price_amount_usd_filled": "3.5775", "fx_rate_local_per_usd": "5.448", "fx_source": "from_brasil_cambio_dolar", "information_text": "", "description_text": "", "features_text": "", "specifications_text": "", "benefits_text": "", "details_text": "", "other_sections": "", "sections": {}, "txt_path": "dataset/txt_limpios/184.txt", "html_path": "dataset/paginas_descargadas/184.html", "es_status": "ET", "category_canonical": "arroz", "decision": "keep", "match_score": 0.6, "reasons": "heuristic_default"}
{"source_id": "185", "title": "Alimentos básicos", "description": "", "breadcrumbs": "Cafés > 40g", "price_raw": "8.89", "currency_raw": "BRL", "url": "", "seller": "Desconocido", "availability": "unknown", "country": "BR", "product_name": "Alimentos básicos", "brand": "Cafés", "reference": "", "unit": "40g", "price_amount": 8.89, "price_currency": "BRL", "price_symbol": "R$", "price_text": "R$8,89", "price_amount_filled": "8.89", "price_is_imputed": "False", "price_imputation_source": "original", "price_amount_usd": "1.6318", "price_amount_usd_filled": "1.6318", "fx_rate_local_per_usd": "5.448", "fx_source": "from_brasil_cambio_dolar", "information_text": "", "description_text": "", "features_text": "", "specifications_text": "", "benefits_text": "", "details_text": "", "other_sections": "", "sections": {}, "txt_path": "dataset/txt_limpios/185.txt", "html_path": "dataset/paginas_descargadas/185.html", "es_status": "ET", "category_canonical": "sin_categoria", "decision": "discard", "match_score": 0.3, "reasons": "no_category_detected"}
{"source_id": "225", "title": "Alimentos básicos", "description": "", "breadcrumbs": "Frijoles > 1 Kg", "price_raw": "5.29", "currency_raw": "BRL", "url": "", "seller": "Desconocido", "availability": "unknown", "country": "BR", "product_name": "Alimentos básicos", "brand": "Frijoles", "reference": "", "unit": "1 Kg", "price_amount": 5.29, "price_currency": "BRL", "price_symbol": "R$", "price_text": "R$5,29", "price_amount_filled": "5.29", "price_is_imputed": "False", "price_imputation_source": "original", "price_amount_usd": "0.971", "price_amount_usd_filled": "0.971", "fx_rate_local_per_usd": "5.448", "fx_source": "from_brasil_cambio_dolar", "information_text": "", "description_text": "", "features_text": "", "specifications_text": "", "benefits_text": "", "details_text": "", "other_sections": "", "sections": {}, "txt_path": "dataset/txt_limpios/225.txt", "html_path": "dataset/paginas_descargadas/225.html", "es_status": "ET", "category_canonical": "frijoles", "decision": "keep", "match_score": 0.6, "reasons": "heuristic_default"}
{"source_id": "226", "title": "Alimentos básicos", "description": "", "breadcrumbs": "Frijoles > 1Kg", "price_raw": "", "currency_raw": "", "url": "", "seller": "Desconocido", "availability": "unknown", "country": "UNKNOWN", "product_name": "Alimentos básicos", "brand": "Frijoles", "reference": "", "unit": "1Kg", "price_amount": null, "price_currency": "", "price_symbol": "", "price_text": "", "price_amount_filled": "1.02", "price_is_imputed": "True", "price_imputation_source": "category_mean", "price_amount_usd": "", "price_amount_usd_filled": "1.02", "fx_rate_local_per_usd": "1.0", "fx_source": "default_1usd", "information_text": "", "description_text": "", "features_text": "", "specifications_text": "", "benefits_text": "", "details_text": "", "other_sections": "", "sections": {}, "txt_path": "dataset/txt_limpios/226.txt", "html_path": "dataset/paginas_descargadas/226.html", "es_status": "ET", "category_canonical": "frijoles", "decision": "discard", "match_score": 0.6, "reasons": "price_parse_failed;price<=0"}
{"source_id": "227", "title": "Alimentos básicos", "description": "", "breadcrumbs": "Frijoles > 1 Kg", "price_raw": "", "currency_raw": "", "url": "", "seller": "Desconocido", "availability": "unknown", "country": "UNKNOWN", "product_name": "Alimentos básicos", "brand": "Frijoles", "reference": "", "unit": "1 Kg", "price_amount": null, "price_currency": "", "price_symbol": "", "price_text": "", "price_amount_filled": "1.02", "price_is_imputed": "True", "price_imputation_source": "category_mean", "price_amount_usd": "", "price_amount_usd_filled": "1.02", "fx_rate_local_per_usd": "1.0", "fx_source": "default_1usd", "information_text": "", "description_text": "", "features_text": "", "specifications_text": "", "benefits_text": "", "details_text": "", "other_sections": "", "sections": {}, "txt_path": "dataset/txt_limpios/227.txt", "html_path": "dataset/paginas_descargadas/227.html", "es_status": "ET", "category_canonical": "frijoles", "decision": "discard", "match_score": 0.6, "reasons": "price_parse_failed;price<=0"}
{"source_id": "228", "title": "Alimentos básicos", "description": "", "breadcrumbs": "Frijoles > 1Kg", "price_raw": "4.49", "currency_raw": "BRL", "url": "", "seller": "Desconocido", "availability": "unknown", "country": "BR", "product_name": "Alimentos básicos", "brand": "Frijoles", "reference": "", "unit": "1Kg", "price_amount": 4.49, "price_currency": "BRL", "price_symbol": "R$", "price_text": "R$4,49", "price_amount_filled": "4.49", "price_is_imputed": "False", "price_imputation_source": "original", "price_amount_usd": "0.8242", "price_amount_usd_filled": "0.8242", "fx_rate_local_per_usd": "5.448", "fx_source": "from_brasil_cambio_dolar", "information_text": "", "description_text": "", "features_text": "", "specifications_text": "", "benefits_text": "", "details_text": "", "other_sections": "", "sections": {}, "txt_path": "dataset/txt_limpios/228.txt", "html_path": "dataset/paginas_descargadas/228.html", "es_status": "ET", "category_canonical": "frijoles", "decision": "keep", "match_score": 0.6, "reasons": "heuristic_default"}
{"source_id": "229", "title": "Alimentos básicos", "description": "", "breadcrumbs": "Frijoles > 1 kg", "price_raw": "6.89", "currency_raw": "BRL", "url": "", "seller": "Desconocido", "availability": "unknown", "country": "BR", "product_name": "Alimentos básicos", "brand": "Frijoles", "reference": "", "unit": "1 kg", "price_amount": 6.89, "price_currency": "BRL", "price_symbol": "R$", "price_text": "R$6,89", "price_amount_filled": "6.89", "price_is_imputed": "False", "price_imputation_source": "original", "price_amount_usd": "1.2647", "price_amount_usd_filled": "1.2647", "fx_rate_local_per_usd": "5.448", "fx_source": "from_brasil_cambio_dolar", "information_text": "", "description_text": "", "features_text": "", "specifications_text": "", "benefits_text": "", "details_text": "", "other_sections": "", "sections": {}, "txt_path": "dataset/txt_limpios/229.txt", "html_path": "dataset/paginas_descargadas/229.html", "es_status": "ET", "category_canonical": "frijoles", "decision": "keep", "match_score": 0.6, "reasons": "heuristic_default"}
{"source_id": "1287", "title": "App Frecuento", "description": "Elaborada con ingredientes naturales cebada, arroz y lúpulo | Sin saborizantes ni colorantes artificiales | Corona es una invitación para salir y relajarse | Su líquido dorado se elabora 100% en México y es la cerveza mexicana más popular del mundo | Corona ha estado complementando los momentos sencillos de la vida desde 1925, y ahora se disfruta en más de 180 países alrededor del mundo | Porcentaje de alcohol: 4.5% | Contiene: 6 botellas de cerveza de 330ml c/u", "breadcrumbs": "Descárgala gratis > 330ml", "price_raw": "7.45", "currency_raw": "", "url": "", "seller": "Desconocido", "availability": "unknown", "country": "UNKNOWN", "product_name": "App Frecuento", "brand": "Descárgala gratis", "reference": "", "unit": "330ml", "price_amount": 7.45, "price_currency": "", "price_symbol": "$", "price_text": "$7.45", "price_amount_filled": "7.45", "price_is_imputed": "False", "price_imputation_source": "original", "price_amount_usd": "7.45", "price_amount_usd_filled": "7.45", "fx_rate_local_per_usd": "1.0", "fx_source": "default_1usd", "information_text": "", "description_text": "", "features_text": "", "specifications_text": "", "benefits_text": "", "details_text": "Elaborada con ingredientes naturales cebada, arroz y lúpulo | Sin saborizantes ni colorantes artificiales | Corona es una invitación para salir y relajarse | Su líquido dorado se elabora 100% en México y es la cerveza mexicana más popular del mundo | Corona ha estado complementando los momentos sencillos de la vida desde 1925, y ahora se disfruta en más de 180 países alrededor del mundo | Porcentaje de alcohol: 4.5% | Contiene: 6 botellas de cerveza de 330ml c/u", "other_sections": "", "sections": {"Detalles": ["Elaborada con ingredientes naturales cebada, arroz y lúpulo", "Sin saborizantes ni colorantes artificiales", "Corona es una invitación para salir y relajarse", "Su líquido dorado se elabora 100% en México y es la cerveza mexicana más popular del mundo", "Corona ha estado complementando los momentos sencillos de la vida desde 1925, y ahora se disfruta en más de 180 países alrededor del mundo", "Porcentaje de alcohol: 4.5%", "Contiene: 6 botellas de cerveza de 330ml c/u"]}, "txt_path": "dataset/txt_limpios/1287.txt", "html_path": "dataset/paginas_descargadas/1287.html", "es_status": "ET", "category_canonical": "arroz", "decision": "keep", "match_score": 0.6, "reasons": "heuristic_default"}
