source_id,title,description,breadcrumbs,price_raw,currency_raw,url,seller,availability,country,product_name,brand,reference,unit,price_amount,price_currency,price_symbol,price_text,price_amount_filled,price_is_imputed,price_imputation_source,price_amount_usd,price_amount_usd_filled,fx_rate_local_per_usd,fx_source,information_text,description_text,features_text,specifications_text,benefits_text,details_text,other_sections,sections,txt_path,html_path,es_status,category_canonical,decision,match_score,reasons
793,PAN TAJADO MANTEQUILLA 450G,"Ingredientes | Componentes Nombre del producto: Pan Tajado Mantequilla 450g Descripción del producto: Pan tajado con sabor mantequilla, suave y esponjoso, ideal para acompañar desayunos, meriendas para preparar sándwiches. Elaborado de forma industrial con ingredientes seleccionados para conservar su frescura y sabor. Tamaño: 40cm x 12cm x 10cm Peso: 450 g Modo de fabricación: Industrial Conservación: Después de abierto el empaque, consumir en el menor tiempo posible. Almacenar en un lugar fresco y seco. Origen: Nacional NSA-0007272-2019 Alergenos: Contiene gluten y tartrazina. Puede contener trazas de ajonjolí blanco y/o negro, huevo, leche, soya y sulfitos. Componentes: Harina de trigo fortificada (niacina, hierro, vitamina B1, B2, ácido fólico) Agua Azúcar Aceite de girasol Leudante biológico (levadura) Sal Regulador de acidez (ácido láctico) Emulsionantes (mono y diglicéridos, goma xantana) Conservantes (propionato de calcio, ácido sórbico) Acondicionador de masa (fosfato monocálcico) Mantequilla Enzimas (fúngicas y/o bacterianas) Esencia de mantequilla Color artificial amarillo No 5 Ver más También puede interesarte LECHE ENTERA BOLSA UHT LATTI 900 ML Amor y amistad JAMÓN DE CERDO VIANDÉ 400 GRS SALCHICHA CAMPESTRE VIANDÉ 400 GR LECHE DESLACTOSADA BOLSA UHT LATTI 900ML D1 Top 100 PANELA PASTILLA 1000 G PAN CHIPS DE CHOCOLATE HORNEADITOS 210 G JAMÓN DE CERDO/SAND PREMI VIANDÉ 300 GRS",Unidades disponibles > 450G,450.0,,,Desconocido,unknown,UNKNOWN,PAN TAJADO MANTEQUILLA 450G,Unidades disponibles,,450G,450.00,,,450,450.0,False,original,450.0,450.0,1.0,default_1usd,,"Ingredientes | Componentes Nombre del producto: Pan Tajado Mantequilla 450g Descripción del producto: Pan tajado con sabor mantequilla, suave y esponjoso, ideal para acompañar desayunos, meriendas para preparar sándwiches. Elaborado de forma industrial con ingredientes seleccionados para conservar su frescura y sabor. Tamaño: 40cm x 12cm x 10cm Peso: 450 g Modo de fabricación: Industrial Conservación: Después de abierto el empaque, consumir en el menor tiempo posible. Almacenar en un lugar fresco y seco. Origen: Nacional NSA-0007272-2019 Alergenos: Contiene gluten y tartrazina. Puede contener trazas de ajonjolí blanco y/o negro, huevo, leche, soya y sulfitos. Componentes: Harina de trigo fortificada (niacina, hierro, vitamina B1, B2, ácido fólico) Agua Azúcar Aceite de girasol Leudante biológico (levadura) Sal Regulador de acidez (ácido láctico) Emulsionantes (mono y diglicéridos, goma xantana) Conservantes (propionato de calcio, ácido sórbico) Acondicionador de masa (fosfato monocálcico) Mantequilla Enzimas (fúngicas y/o bacterianas) Esencia de mantequilla Color artificial amarillo No 5 Ver más También puede interesarte LECHE ENTERA BOLSA UHT LATTI 900 ML Amor y amistad JAMÓN DE CERDO VIANDÉ 400 GRS SALCHICHA CAMPESTRE VIANDÉ 400 GR LECHE DESLACTOSADA BOLSA UHT LATTI 900ML D1 Top 100 PANELA PASTILLA 1000 G PAN CHIPS DE CHOCOLATE HORNEADITOS 210 G JAMÓN DE CERDO/SAND PREMI VIANDÉ 300 GRS",,,,,,"{""Descripción"": [""Ingredientes | Componentes"", ""Nombre del producto: Pan Tajado Mantequilla 450g"", ""Descripción del producto: Pan tajado con sabor mantequilla, suave y esponjoso, ideal para acompañar desayunos, meriendas para preparar sándwiches. Elaborado de forma industrial con ingredientes seleccionados para conservar su frescura y sabor."", ""Tamaño: 40cm x 12cm x 10cm"", ""Peso: 450 g"", ""Modo de fabricación: Industrial"", ""Conservación: Después de abierto el empaque, consumir en el menor tiempo posible. Almacenar en un lugar fresco y seco."", ""Origen: Nacional"", ""NSA-0007272-2019"", ""Alergenos: Contiene gluten y tartrazina. Puede contener trazas de ajonjolí blanco y/o negro, huevo, leche, soya y sulfitos."", ""Componentes: Harina de trigo fortificada (niacina, hierro, vitamina B1, B2, ácido fólico)"", ""Agua"", ""Azúcar"", ""Aceite de girasol"", ""Leudante biológico (levadura)"", ""Sal"", ""Regulador de acidez (ácido láctico)"", ""Emulsionantes (mono y diglicéridos, goma xantana)"", ""Conservantes (propionato de calcio, ácido sórbico)"", ""Acondicionador de masa (fosfato monocálcico)"", ""Mantequilla"", ""Enzimas (fúngicas y/o bacterianas)"", ""Esencia de mantequilla"", ""Color artificial amarillo N.º 5"", ""Ver más"", ""También puede interesarte"", ""LECHE ENTERA BOLSA UHT LATTI 900 ML"", ""Amor y amistad"", ""JAMÓN DE CERDO VIANDÉ 400 GRS"", ""SALCHICHA CAMPESTRE VIANDÉ 400 GR"", ""LECHE DESLACTOSADA BOLSA UHT LATTI 900ML"", ""D1 Top 100"", ""PANELA PASTILLA 1000 G"", ""PAN CHIPS DE CHOCOLATE HORNEADITOS 210 G"", ""JAMÓN DE CERDO/SAND PREMI VIANDÉ 300 GRS""]}",dataset/txt_limpios/793.txt,dataset/paginas_descargadas/793.html,ET,leche,keep,0.60,heuristic_default
792,PAN TAJADO MULTIGRANOS 450 G,"Ingredientes | Componentes Nombre del producto: Pan Tajado Multigranos 450 g Descripción del producto: El Pan Tajado Multigranos es una deliciosa opción para quienes buscan un pan más nutritivo. Su textura suave y su mezcla única de ingredientes hacen de este pan una opción ideal para tu día a día. Tamaño: 37 cm x 13 cm x 10 cm Peso: 450 g Modo de fabricación: Industrial Conservación: Conservar el producto dentro del embalaje bien cerrado, en un lugar limpio, fresco y seco, alejado de sustancias que puedan interferir en las características propias del mismo. Después de abierto el empaque, consumir en el menor tiempo posible. Origen: Nacional NSA-0007272-2019 Alergenos: Contiene gluten. Puede contener trazas de leche, huevo, soya y sulfitos. Componentes: Harina de trigo fortificada (niacina, hierro, vitamina B1, vitamina B2, ácido fólico) Harina de trigo integral fortificada (niacina, hierro, vitamina B1, vitamina B2, ácido fólico) Agua Azúcar Uvas pasas Levadura Salvado de trigo Aceite de girasol Harina de centeno Semillas de chía Sal Sustituto de sodio (cloruro de potasio) Masa madre Regulador de acidez (ácido láctico) Conservantes (propionato de calcio, ácido sórbico) Emulsificantes (mono y diglicéridos y goma xantana) Acondicionador de masa (fosfato monocálcico) Enzimas (fúngicas y/o bacterianas) Esencia de vainilla Decorado con ajonjolí blanco, negro y hojuelas de avena Ver más También puede interesarte AREPA DE MAÍZ INTEGRAL MULTIGRANOS 400 G PAN MULTIGRANOS NATRI 0 AZUCAR 450 G Nuevo TOSTADA INTEGRAL NATRI 110 GRS TOMATE CHERRY 250 GR YOGURT GRIEGO NATURAL VITA LATTI 850 GR CHAMPIÑON 250 GR Amor y amistad JAMON DE PAVO FINAS HIERBAS BROCOLI CONGELADO COOLTIVO 500G ESPINACA X 200G JAMON PECHUGA PAVO WHITE HOLLAND X 230 G",Unidades disponibles > 450 G,450.0,,,Desconocido,unknown,UNKNOWN,PAN TAJADO MULTIGRANOS 450 G,Unidades disponibles,,450 G,450.00,,,450,450.0,False,original,450.0,450.0,1.0,default_1usd,,"Ingredientes | Componentes Nombre del producto: Pan Tajado Multigranos 450 g Descripción del producto: El Pan Tajado Multigranos es una deliciosa opción para quienes buscan un pan más nutritivo. Su textura suave y su mezcla única de ingredientes hacen de este pan una opción ideal para tu día a día. Tamaño: 37 cm x 13 cm x 10 cm Peso: 450 g Modo de fabricación: Industrial Conservación: Conservar el producto dentro del embalaje bien cerrado, en un lugar limpio, fresco y seco, alejado de sustancias que puedan interferir en las características propias del mismo. Después de abierto el empaque, consumir en el menor tiempo posible. Origen: Nacional NSA-0007272-2019 Alergenos: Contiene gluten. Puede contener trazas de leche, huevo, soya y sulfitos. Componentes: Harina de trigo fortificada (niacina, hierro, vitamina B1, vitamina B2, ácido fólico) Harina de trigo integral fortificada (niacina, hierro, vitamina B1, vitamina B2, ácido fólico) Agua Azúcar Uvas pasas Levadura Salvado de trigo Aceite de girasol Harina de centeno Semillas de chía Sal Sustituto de sodio (cloruro de potasio) Masa madre Regulador de acidez (ácido láctico) Conservantes (propionato de calcio, ácido sórbico) Emulsificantes (mono y diglicéridos y goma xantana) Acondicionador de masa (fosfato monocálcico) Enzimas (fúngicas y/o bacterianas) Esencia de vainilla Decorado con ajonjolí blanco, negro y hojuelas de avena Ver más También puede interesarte AREPA DE MAÍZ INTEGRAL MULTIGRANOS 400 G PAN MULTIGRANOS NATRI 0 AZUCAR 450 G Nuevo TOSTADA INTEGRAL NATRI 110 GRS TOMATE CHERRY 250 GR YOGURT GRIEGO NATURAL VITA LATTI 850 GR CHAMPIÑON 250 GR Amor y amistad JAMON DE PAVO FINAS HIERBAS BROCOLI CONGELADO COOLTIVO 500G ESPINACA X 200G JAMON PECHUGA PAVO WHITE HOLLAND X 230 G",,,,,,"{""Descripción"": [""Ingredientes | Componentes"", ""Nombre del producto: Pan Tajado Multigranos 450 g"", ""Descripción del producto: El Pan Tajado Multigranos es una deliciosa opción para quienes buscan un pan más nutritivo. Su textura suave y su mezcla única de ingredientes hacen de este pan una opción ideal para tu día a día."", ""Tamaño: 37 cm x 13 cm x 10 cm"", ""Peso: 450 g"", ""Modo de fabricación: Industrial"", ""Conservación: Conservar el producto dentro del embalaje bien cerrado, en un lugar limpio, fresco y seco, alejado de sustancias que puedan interferir en las características propias del mismo. Después de abierto el empaque, consumir en el menor tiempo posible."", ""Origen: Nacional"", ""NSA-0007272-2019"", ""Alergenos: Contiene gluten. Puede contener trazas de leche, huevo, soya y sulfitos."", ""Componentes: Harina de trigo fortificada (niacina, hierro, vitamina B1, vitamina B2, ácido fólico)"", ""Harina de trigo integral fortificada (niacina, hierro, vitamina B1, vitamina B2, ácido fólico)"", ""Agua"", ""Azúcar"", ""Uvas pasas"", ""Levadura"", ""Salvado de trigo"", ""Aceite de girasol"", ""Harina de centeno"", ""Semillas de chía"", ""Sal"", ""Sustituto de sodio (cloruro de potasio)"", ""Masa madre"", ""Regulador de acidez (ácido láctico)"", ""Conservantes (propionato de calcio, ácido sórbico)"", ""Emulsificantes (mono y diglicéridos y goma xantana)"", ""Acondicionador de masa (fosfato monocálcico)"", ""Enzimas (fúngicas y/o bacterianas)"", ""Esencia de vainilla"", ""Decorado con ajonjolí blanco, negro y hojuelas de avena"", ""Ver más"", ""También puede interesarte"", ""AREPA DE MAÍZ INTEGRAL MULTIGRANOS 400 G"", ""PAN MULTIGRANOS NATRI 0 AZUCAR 450 G"", ""Nuevo"", ""TOSTADA INTEGRAL NATRI 110 GRS"", ""TOMATE CHERRY 250 GR"", ""YOGURT GRIEGO NATURAL VITA LATTI 850 GR"", ""CHAMPIÑON 250 GR"", ""Amor y amistad"", ""JAMON DE PAVO FINAS HIERBAS"", ""BROCOLI CONGELADO COOLTIVO 500G"", ""ESPINACA X 200G"", ""JAMON PECHUGA PAVO WHITE HOLLAND X 230 G""]}",dataset/txt_limpios/792.txt,dataset/paginas_descargadas/792.html,ET,pan,keep,0.60,heuristic_default
794,PAN VITAL FRUTICEREAL 500 G,"Ingredientes | Componentes Nombre del producto: Pan Vital Fruticereal 500 G Descripción del producto: El Pan Vital Fruticereal de Bimbo es la opción perfecta para disfrutar en tus desayunos, meriendas los recetas favoritas. Este pan tajado con cereales y frutos deshidratados ofrece un sabor natural dulce y una textura suave que encantará a toda la familia. Fabricado con ingredientes de alta calidad, este delicioso pan es ideal para toda la familia. Además, es fácil de consumir directamente. Tamaño: 30 cm x 14 cm x 10 cm Peso: 500 g Modo fabricación: Industrial Origen: Nacional NSA-004822 Alérgenos: Contiene gluten y derivados Componentes: Harina de trigo (ingrediente principal) Cereales integrales (fuente de fibra) Frutos deshidratados (para sabor y textura) Azúcar (para endulzar) Aceite vegetal (para consistencia) Ver más También puede interesarte D1 Top 100 ARÁNDANOS 125 G Amor y amistad JAMÓN PIETRÁN ESTANDAR 230G GALLETA RELLENA DE FRUTA NATRI 145 G YOX SURTIDO FRESA Y MELOCOTÓN ALPINA 4 UND - 40... SALCHICHA RANCHERA X 230 G X 7 UD JAMON DE PAVO FINAS HIERBAS TOMATE CHERRY 250 GR YOGURT MELOCOTON LIGHT VITA LATTI 1000GR MANZANA VERDE 850 G CHAMPIÑON 250 GR",Unidades disponibles > 500 G,500.0,,,Desconocido,unknown,UNKNOWN,PAN VITAL FRUTICEREAL 500 G,Unidades disponibles,,500 G,500.00,,,500,500.0,False,original,500.0,500.0,1.0,default_1usd,,"Ingredientes | Componentes Nombre del producto: Pan Vital Fruticereal 500 G Descripción del producto: El Pan Vital Fruticereal de Bimbo es la opción perfecta para disfrutar en tus desayunos, meriendas los recetas favoritas. Este pan tajado con cereales y frutos deshidratados ofrece un sabor natural dulce y una textura suave que encantará a toda la familia. Fabricado con ingredientes de alta calidad, este delicioso pan es ideal para toda la familia. Además, es fácil de consumir directamente. Tamaño: 30 cm x 14 cm x 10 cm Peso: 500 g Modo fabricación: Industrial Origen: Nacional NSA-004822 Alérgenos: Contiene gluten y derivados Componentes: Harina de trigo (ingrediente principal) Cereales integrales (fuente de fibra) Frutos deshidratados (para sabor y textura) Azúcar (para endulzar) Aceite vegetal (para consistencia) Ver más También puede interesarte D1 Top 100 ARÁNDANOS 125 G Amor y amistad JAMÓN PIETRÁN ESTANDAR 230G GALLETA RELLENA DE FRUTA NATRI 145 G YOX SURTIDO FRESA Y MELOCOTÓN ALPINA 4 UND - 40... SALCHICHA RANCHERA X 230 G X 7 UD JAMON DE PAVO FINAS HIERBAS TOMATE CHERRY 250 GR YOGURT MELOCOTON LIGHT VITA LATTI 1000GR MANZANA VERDE 850 G CHAMPIÑON 250 GR",,,,,,"{""Descripción"": [""Ingredientes | Componentes"", ""Nombre del Producto: Pan Vital Fruticereal 500 G"", ""Descripción del producto: El Pan Vital Fruticereal de Bimbo es la opción perfecta para disfrutar en tus desayunos, meriendas los recetas favoritas. Este pan tajado con cereales y frutos deshidratados ofrece un sabor natural dulce y una textura suave que encantará a toda la familia. Fabricado con ingredientes de alta calidad, este delicioso pan es ideal para toda la familia. Además, es fácil de consumir directamente."", ""Tamaño: 30 cm x 14 cm x 10 cm"", ""Peso: 500 g"", ""Modo fabricación: Industrial"", ""Origen: Nacional"", ""NSA-004822"", ""Alérgenos: Contiene gluten y derivados"", ""Componentes: Harina de trigo (ingrediente principal)"", ""Cereales integrales (fuente de fibra)"", ""Frutos deshidratados (para sabor y textura)"", ""Azúcar (para endulzar)"", ""Aceite vegetal (para consistencia)"", ""Ver más"", ""También puede interesarte"", ""D1 Top 100"", ""ARÁNDANOS 125 G"", ""Amor y amistad"", ""JAMÓN PIETRÁN ESTANDAR 230G"", ""GALLETA RELLENA DE FRUTA NATRI 145 G"", ""YOX SURTIDO FRESA Y MELOCOTÓN ALPINA 4 UND - 40..."", ""SALCHICHA RANCHERA X 230 G X 7 UD"", ""JAMON DE PAVO FINAS HIERBAS"", ""TOMATE CHERRY 250 GR"", ""YOGURT MELOCOTON LIGHT VITA LATTI 1000GR"", ""MANZANA VERDE 850 G"", ""CHAMPIÑON 250 GR""]}",dataset/txt_limpios/794.txt,dataset/paginas_descargadas/794.html,ET,pan,keep,0.60,heuristic_default
512,Panaderia Propia,,Panificados > 550g,600.0,,,Desconocido,unknown,UNKNOWN,Panaderia Propia,Panificados,,550g,600.00,,,600,600.0,False,original,600.0,600.0,1.0,default_1usd,,,MARCA | : COTO | Últimos consultados | LLEVANDO 2 | 70% 2DA | PRECIO CON 70% 2DA | Ver planes de cuotas | Pan De Mesa Grande La Perla 550g | Pan Lacteado Blanco Rebanada Mas Grande Bimbo 610g | Pan Salvado FARGO 620g | LLEVANDO 3 | 3X2 | Leche Larga Vida Entera LAS TRES NIÑAS Ttb 1l | PRECIO CON 3X2,,,,,"{""Características"": [""MARCA"", "": COTO"", ""Últimos consultados"", ""LLEVANDO 2"", ""70% 2DA"", ""PRECIO CON 70% 2DA"", ""Ver planes de cuotas"", ""Pan De Mesa Grande La Perla 550g"", ""Pan Lacteado Blanco Rebanada Mas Grande Bimbo 610g"", ""Pan Salvado FARGO 620g"", ""LLEVANDO 3"", ""3X2"", ""Leche Larga Vida Entera LAS TRES NIÑAS Ttb 1l"", ""PRECIO CON 3X2""]}",dataset/txt_limpios/512.txt,dataset/paginas_descargadas/512.html,EN,sin_categoria,discard,0.30,no_category_detected
19,Panaderia y tortilleria,"Pan de caja blanco de la marca Selecto, elaborado con harina blanca. Delicioso pan de caja fresco elaborado con harina de trigo. Tú repostería favorita a la puerta de tu casa, gran variedad de pan solo en Chedraui. con.mx",Pan salado > 675g > 3105808,,MXN,,Chedraui,unknown,MX,Panaderia y tortilleria,Pan salado,3105808.0,675g,,MXN,,,72.0,True,category_country_mean,,3.8668,18.62,from_mexico_cambio_dolar,"Pan de caja blanco de la marca Selecto, elaborado con harina blanca.",,,"Delicioso pan de caja fresco elaborado con harina de trigo. Tú repostería favorita a la puerta de tu casa, gran variedad de pan solo en Chedraui. con.mx",,,,"{""Información"": [""Pan de caja blanco de la marca Selecto, elaborado con harina blanca.""], ""Especificaciones"": [""Delicioso pan de caja fresco elaborado con harina de trigo. Tú repostería favorita a la puerta de tu casa, gran variedad de pan solo en Chedraui. con.mx""]}",dataset/txt_limpios/19.txt,dataset/paginas_descargadas/19.html,ET,pan,discard,0.60,price_parse_failed;price<=0
