source_id,title,description,breadcrumbs,price_raw,currency_raw,url,seller,availability,country,product_name,brand,reference,unit,price_amount,price_currency,price_symbol,price_text,price_amount_filled,price_is_imputed,price_imputation_source,price_amount_usd,price_amount_usd_filled,fx_rate_local_per_usd,fx_source,information_text,description_text,features_text,specifications_text,benefits_text,details_text,other_sections,sections,txt_path,html_path,es_status,category_canonical,decision,match_score,reasons
1055,¡Aún no eres Wong Prime!,"<h2>Arroz Costeño Extra 5kg</h2> Llévate a casa la<strong> Bolsa de Arroz Costeño Extra de 5 Kg </strong>a un excelente precio y sorprende a tu familia con una variedad de platos exquisitos, desde un simple almuerzo hasta un postre especial para cerrar con broche de oro cualquier cena. <h3>Beneficios nutricionales del Arroz Costeño Extra</h3> El<strong> Arroz Costeño </strong>no es solo un acompañante ideal para tus comidas; es una fuente indispensable de nutrientes. Cargado de hidratos de carbono, este arroz te mantiene activo y energizado durante todo el día. Además, es rico en minerales esenciales como calcio, hierro, magnesio y potasio, que contribuyen significativamente a una dieta equilibrada. Este superalimento también aporta <strong>vitaminas D</strong> y <strong>B</strong>, <strong>omega 3</strong>, <strong>niacina</strong>, <strong>ácido</strong> <strong>fólico </strong>y <strong>tiamina</strong>. Estos componentes son cruciales para una mejor absorción de nutrientes cuando se combina con otros alimentos como legumbres y carnes, optimizando así los beneficios para tu salud. Además, el Arroz Costeño ayuda a facilitar la digestión y previene enfermedades gastrointestinales, convirtiéndolo en una elección perfecta para tu bienestar diario. <h3>Inspiración para cocinar con Arroz Costeño</h3> Si te preguntas cómo integrar el Arroz Costeño Extra en tu menú semanal, aquí te ofrecemos ideas creativas y deliciosas. Desde las tradicionales bolas de arroz y el sushi, hasta platos internacionales como risotto de setas o arroz chaufa. Sea cual sea tu elección, el <strong>Arroz Costeño</strong> Extra asegura platos llenos de sabor y calidad. <h2>¿Por qué elegir Arroz costeño extra?</h2> Disfruta de un producto superior con cada bolsa de <strong>Arroz Costeño 5 kg</strong>, ideal para todo tipo de recetas y garantizado para mejorar cualquier comida con su textura y sabor inigualables. Compra hoy tu bolsa de <strong>Arroz Costeño Extra de 5 kilos</strong> y disfruta del incomparable precio que solo Wong.pe puede ofrecerte. ¡Calidad y buen sabor, garantizados! Configuraciones ProductData {""allow_notes"":true,""allow_substitute"":true,""cart_limit"":""9"",""brandName"":""Coste\u00f1o"",""brandEcomId"":""204"",""measurement_unit"":""un"",""unit_multiplier"":1,""unit_multiplier_un"":0,""measurement_unit_selector"":false} SkuData {""521"":{""ref_id"":""14974"",""cart_limit"":9,""allow_notes"":true,""allow_substitute"":true,""measurement_unit"":""un"",""unit_multiplier"":1,""promotions"":[""90"",""171"",""284"",""292"",""294"",""326"",""364"",""366"",""414"",""416"",""519"",""1045"",""1065"",""1173"",""1179"",""1183"",""1184"",""1194"",""1196"",""146325"",""146326"",""146597"",""146599"",""231069"",""251083"",""251084"",""251085"",""251087"",""329743"",""382859"",""490256"",""490257"",""490261"",""490263"",""1994544"",""10735676"",""13966486"",""14541214"",""16271796"",""16714356"",""19141417"",""19163557"",""19325600"",""19326455"",""19327027"",""19327888"",""20037233"",""22620951"",""23846191"",""26351744"",""28328684"",""28328914"",""28329380"",""28330336"",""28778616"",""30830762"",""36519513"",""38110788"",""38113326"",""39065464"",""39075795"",""55180731"",""66534612"",""67507085"",""97011381"",""98981277"",""103809625"",""112346246"",""133332870"",""135233569"",""135779464"",""135780958"",""136237989"",""143249749"",""145162925"",""148831125"",""163277542"",""165273378"",""165562221"",""179887910"",""181925210"",""195881618"",""210387485"",""214410330"",""219453456"",""219572829"",""219593134"",""219642058"",""219751291"",""219753237"",""220100048"",""220369696"",""221126823"",""221390808"",""221673923"",""222132857"",""222233565"",""222537759"",""222647610"",""222647614"",""223631604"",""223947690"",""224784086"",""224997064"",""225519997"",""226092271"",""226806262"",""226953245"",""227562158"",""228036641"",""228175583"",""228854271"",""228866510"",""229014725"",""229200116"",""229797039"",""230148675"",""230815373"",""230883904"",""231529929"",""231659067"",""232946331"",""233312007"",""233743301"",""233743305"",""235361489"",""235492185"",""235954184"",""236593512"",""236676117"",""236949604"",""239255076"",""239512715"",""240821096"",""240821589"",""242489809"",""243343615"",""280439276"",""280609812"",""280663102"",""281369491""],""url_canonical"":"""",""unit_multiplier_un"":0,""measurement_unit_selector"":false,""release_data"":{""date_release"":""07-11-2016 00:00"",""date_release_end"":""07-12-2016 00:00"",""is_new"":false}}} Características Destacadas Tipo de Producto Arroz Extra Añejo Observaciones y Recomendaciones Origen Nacional Costeño Referencia: 14974 S/ 25 90 29 60 Cantidad ＋ － Certificados Ver todos Características Principales Contiene 5 kilos Arroz extra Comentarios | Especificaciones técnicas | Propiedad | Especificación | Arroz Costeño Extra 5kg | ¡El Arroz Costeño Extra 5 kg es tu mejor aliado en la cocina! | Obtén el mejor | precio para Arroz Costeño 5 kilos | y disfruta de la máxima calidad que solo | te puede ofrecer. | Llévate a casa la | Bolsa de Arroz Costeño Extra de 5 Kg | a un excelente precio y sorprende a tu familia con una variedad de platos exquisitos, desde un simple almuerzo hasta un postre especial para cerrar con broche de oro cualquier cena. | Beneficios nutricionales del Arroz Costeño Extra | El | Arroz Costeño | no es solo un acompañante ideal para tus comidas; es una fuente indispensable de nutrientes. Cargado de hidratos de carbono, este arroz te mantiene activo y energizado durante todo el día. | Este superalimento también aporta | vitaminas D | y | B | , | omega 3 | niacina | ácido | fólico | tiamina | . Estos componentes son cruciales para una mejor absorción de nutrientes cuando se combina con otros alimentos como legumbres y carnes, optimizando así los beneficios para tu salud. | Inspiración para cocinar con Arroz Costeño | Sea cual sea tu elección, el | Extra asegura platos llenos de sabor y calidad. | ¿Por qué elegir Arroz costeño extra? | A diferencia de otros tipos de | , el | Disfruta de un producto superior con cada bolsa de | Arroz Costeño 5 kg | , ideal para todo tipo de recetas y garantizado para mejorar cualquier comida con su textura y sabor inigualables. | Compra hoy tu bolsa de | Arroz Costeño Extra de 5 kilos | y disfruta del incomparable precio que solo Wong.pe puede ofrecerte. ¡Calidad y buen sabor, garantizados! | Ingredientes | 100% arroz | Ver condiciones de promociones | ? | ! | i | × | Sí Acepto | Recuerda escribir al menos 3 letras en el cuadro de búsqueda | Términos más buscados | 1. | elvive liso | 2. | ariel liquido | 3. | limpiador inodoro harpic | 4. | busca | 5. | secret clinical | Marcas sugeridas",Aprovecha el > 5kg > 14974,79.9,PEN,,Desconocido,unknown,PE,¡Aún no eres Wong Prime!,Aprovecha el,14974.0,5kg,79.90,PEN,S/,S/79.90,79.9,False,original,22.507,22.507,3.55,from_peru_cambio_dolar,,"<h2>Arroz Costeño Extra 5kg</h2> Llévate a casa la<strong> Bolsa de Arroz Costeño Extra de 5 Kg </strong>a un excelente precio y sorprende a tu familia con una variedad de platos exquisitos, desde un simple almuerzo hasta un postre especial para cerrar con broche de oro cualquier cena. <h3>Beneficios nutricionales del Arroz Costeño Extra</h3> El<strong> Arroz Costeño </strong>no es solo un acompañante ideal para tus comidas; es una fuente indispensable de nutrientes. Cargado de hidratos de carbono, este arroz te mantiene activo y energizado durante todo el día. Además, es rico en minerales esenciales como calcio, hierro, magnesio y potasio, que contribuyen significativamente a una dieta equilibrada. Este superalimento también aporta <strong>vitaminas D</strong> y <strong>B</strong>, <strong>omega 3</strong>, <strong>niacina</strong>, <strong>ácido</strong> <strong>fólico </strong>y <strong>tiamina</strong>. Estos componentes son cruciales para una mejor absorción de nutrientes cuando se combina con otros alimentos como legumbres y carnes, optimizando así los beneficios para tu salud. Además, el Arroz Costeño ayuda a facilitar la digestión y previene enfermedades gastrointestinales, convirtiéndolo en una elección perfecta para tu bienestar diario. <h3>Inspiración para cocinar con Arroz Costeño</h3> Si te preguntas cómo integrar el Arroz Costeño Extra en tu menú semanal, aquí te ofrecemos ideas creativas y deliciosas. Desde las tradicionales bolas de arroz y el sushi, hasta platos internacionales como risotto de setas o arroz chaufa. Sea cual sea tu elección, el <strong>Arroz Costeño</strong> Extra asegura platos llenos de sabor y calidad. <h2>¿Por qué elegir Arroz costeño extra?</h2> Disfruta de un producto superior con cada bolsa de <strong>Arroz Costeño 5 kg</strong>, ideal para todo tipo de recetas y garantizado para mejorar cualquier comida con su textura y sabor inigualables. Compra hoy tu bolsa de <strong>Arroz Costeño Extra de 5 kilos</strong> y disfruta del incomparable precio que solo Wong.pe puede ofrecerte. ¡Calidad y buen sabor, garantizados! Configuraciones ProductData {""allow_notes"":true,""allow_substitute"":true,""cart_limit"":""9"",""brandName"":""Coste\u00f1o"",""brandEcomId"":""204"",""measurement_unit"":""un"",""unit_multiplier"":1,""unit_multiplier_un"":0,""measurement_unit_selector"":false} SkuData {""521"":{""ref_id"":""14974"",""cart_limit"":9,""allow_notes"":true,""allow_substitute"":true,""measurement_unit"":""un"",""unit_multiplier"":1,""promotions"":[""90"",""171"",""284"",""292"",""294"",""326"",""364"",""366"",""414"",""416"",""519"",""1045"",""1065"",""1173"",""1179"",""1183"",""1184"",""1194"",""1196"",""146325"",""146326"",""146597"",""146599"",""231069"",""251083"",""251084"",""251085"",""251087"",""329743"",""382859"",""490256"",""490257"",""490261"",""490263"",""1994544"",""10735676"",""13966486"",""14541214"",""16271796"",""16714356"",""19141417"",""19163557"",""19325600"",""19326455"",""19327027"",""19327888"",""20037233"",""22620951"",""23846191"",""26351744"",""28328684"",""28328914"",""28329380"",""28330336"",""28778616"",""30830762"",""36519513"",""38110788"",""38113326"",""39065464"",""39075795"",""55180731"",""66534612"",""67507085"",""97011381"",""98981277"",""103809625"",""112346246"",""133332870"",""135233569"",""135779464"",""135780958"",""136237989"",""143249749"",""145162925"",""148831125"",""163277542"",""165273378"",""165562221"",""179887910"",""181925210"",""195881618"",""210387485"",""214410330"",""219453456"",""219572829"",""219593134"",""219642058"",""219751291"",""219753237"",""220100048"",""220369696"",""221126823"",""221390808"",""221673923"",""222132857"",""222233565"",""222537759"",""222647610"",""222647614"",""223631604"",""223947690"",""224784086"",""224997064"",""225519997"",""226092271"",""226806262"",""226953245"",""227562158"",""228036641"",""228175583"",""228854271"",""228866510"",""229014725"",""229200116"",""229797039"",""230148675"",""230815373"",""230883904"",""231529929"",""231659067"",""232946331"",""233312007"",""233743301"",""233743305"",""235361489"",""235492185"",""235954184"",""236593512"",""236676117"",""236949604"",""239255076"",""239512715"",""240821096"",""240821589"",""242489809"",""243343615"",""280439276"",""280609812"",""280663102"",""281369491""],""url_canonical"":"""",""unit_multiplier_un"":0,""measurement_unit_selector"":false,""release_data"":{""date_release"":""07-11-2016 00:00"",""date_release_end"":""07-12-2016 00:00"",""is_new"":false}}} Características Destacadas Tipo de Producto Arroz Extra Añejo Observaciones y Recomendaciones Origen Nacional Costeño Referencia: 14974 S/ 25 90 29 60 Cantidad ＋ － Certificados Ver todos Características Principales Contiene 5 kilos Arroz extra",,"Comentarios | Especificaciones técnicas | Propiedad | Especificación | Arroz Costeño Extra 5kg | ¡El Arroz Costeño Extra 5 kg es tu mejor aliado en la cocina! | Obtén el mejor | precio para Arroz Costeño 5 kilos | y disfruta de la máxima calidad que solo | te puede ofrecer. | Llévate a casa la | Bolsa de Arroz Costeño Extra de 5 Kg | a un excelente precio y sorprende a tu familia con una variedad de platos exquisitos, desde un simple almuerzo hasta un postre especial para cerrar con broche de oro cualquier cena. | Beneficios nutricionales del Arroz Costeño Extra | El | Arroz Costeño | no es solo un acompañante ideal para tus comidas; es una fuente indispensable de nutrientes. Cargado de hidratos de carbono, este arroz te mantiene activo y energizado durante todo el día. | Este superalimento también aporta | vitaminas D | y | B | , | omega 3 | niacina | ácido | fólico | tiamina | . Estos componentes son cruciales para una mejor absorción de nutrientes cuando se combina con otros alimentos como legumbres y carnes, optimizando así los beneficios para tu salud. | Inspiración para cocinar con Arroz Costeño | Sea cual sea tu elección, el | Extra asegura platos llenos de sabor y calidad. | ¿Por qué elegir Arroz costeño extra? | A diferencia de otros tipos de | , el | Disfruta de un producto superior con cada bolsa de | Arroz Costeño 5 kg | , ideal para todo tipo de recetas y garantizado para mejorar cualquier comida con su textura y sabor inigualables. | Compra hoy tu bolsa de | Arroz Costeño Extra de 5 kilos | y disfruta del incomparable precio que solo Wong.pe puede ofrecerte. ¡Calidad y buen sabor, garantizados! | Ingredientes | 100% arroz | Ver condiciones de promociones | ? | ! | i | × | Sí Acepto | Recuerda escribir al menos 3 letras en el cuadro de búsqueda | Términos más buscados | 1. | elvive liso | 2. | ariel liquido | 3. | limpiador inodoro harpic | 4. | busca | 5. | secret clinical | Marcas sugeridas",,,,"{""Descripción"": [""<h2>Arroz Costeño Extra 5kg</h2>"", ""Llévate a casa la<strong> Bolsa de Arroz Costeño Extra de 5 Kg </strong>a un excelente precio y sorprende a tu familia con una variedad de platos exquisitos, desde un simple almuerzo hasta un postre especial para cerrar con broche de oro cualquier cena."", ""<h3>Beneficios nutricionales del Arroz Costeño Extra</h3>"", ""El<strong> Arroz Costeño </strong>no es solo un acompañante ideal para tus comidas; es una fuente indispensable de nutrientes. Cargado de hidratos de carbono, este arroz te mantiene activo y energizado durante todo el día."", ""Además, es rico en minerales esenciales como calcio, hierro, magnesio y potasio, que contribuyen significativamente a una dieta equilibrada."", ""Este superalimento también aporta <strong>vitaminas D</strong> y <strong>B</strong>, <strong>omega 3</strong>, <strong>niacina</strong>, <strong>ácido</strong> <strong>fólico </strong>y <strong>tiamina</strong>. Estos componentes son cruciales para una mejor absorción de nutrientes cuando se combina con otros alimentos como legumbres y carnes, optimizando así los beneficios para tu salud."", ""Además, el Arroz Costeño ayuda a facilitar la digestión y previene enfermedades gastrointestinales, convirtiéndolo en una elección perfecta para tu bienestar diario."", ""<h3>Inspiración para cocinar con Arroz Costeño</h3>"", ""Si te preguntas cómo integrar el Arroz Costeño Extra en tu menú semanal, aquí te ofrecemos ideas creativas y deliciosas. Desde las tradicionales bolas de arroz y el sushi, hasta platos internacionales como risotto de setas o arroz chaufa."", ""Sea cual sea tu elección, el <strong>Arroz Costeño</strong> Extra asegura platos llenos de sabor y calidad."", ""<h2>¿Por qué elegir Arroz costeño extra?</h2>"", ""Disfruta de un producto superior con cada bolsa de <strong>Arroz Costeño 5 kg</strong>, ideal para todo tipo de recetas y garantizado para mejorar cualquier comida con su textura y sabor inigualables."", ""Compra hoy tu bolsa de <strong>Arroz Costeño Extra de 5 kilos</strong> y disfruta del incomparable precio que solo Wong.pe puede ofrecerte. ¡Calidad y buen sabor, garantizados!"", ""Configuraciones"", ""ProductData"", ""{\""allow_notes\"":true,\""allow_substitute\"":true,\""cart_limit\"":\""9\"",\""brandName\"":\""Coste\\u00f1o\"",\""brandEcomId\"":\""204\"",\""measurement_unit\"":\""un\"",\""unit_multiplier\"":1,\""unit_multiplier_un\"":0,\""measurement_unit_selector\"":false}"", ""SkuData"", ""{\""521\"":{\""ref_id\"":\""14974\"",\""cart_limit\"":9,\""allow_notes\"":true,\""allow_substitute\"":true,\""measurement_unit\"":\""un\"",\""unit_multiplier\"":1,\""promotions\"":[\""90\"",\""171\"",\""284\"",\""292\"",\""294\"",\""326\"",\""364\"",\""366\"",\""414\"",\""416\"",\""519\"",\""1045\"",\""1065\"",\""1173\"",\""1179\"",\""1183\"",\""1184\"",\""1194\"",\""1196\"",\""146325\"",\""146326\"",\""146597\"",\""146599\"",\""231069\"",\""251083\"",\""251084\"",\""251085\"",\""251087\"",\""329743\"",\""382859\"",\""490256\"",\""490257\"",\""490261\"",\""490263\"",\""1994544\"",\""10735676\"",\""13966486\"",\""14541214\"",\""16271796\"",\""16714356\"",\""19141417\"",\""19163557\"",\""19325600\"",\""19326455\"",\""19327027\"",\""19327888\"",\""20037233\"",\""22620951\"",\""23846191\"",\""26351744\"",\""28328684\"",\""28328914\"",\""28329380\"",\""28330336\"",\""28778616\"",\""30830762\"",\""36519513\"",\""38110788\"",\""38113326\"",\""39065464\"",\""39075795\"",\""55180731\"",\""66534612\"",\""67507085\"",\""97011381\"",\""98981277\"",\""103809625\"",\""112346246\"",\""133332870\"",\""135233569\"",\""135779464\"",\""135780958\"",\""136237989\"",\""143249749\"",\""145162925\"",\""148831125\"",\""163277542\"",\""165273378\"",\""165562221\"",\""179887910\"",\""181925210\"",\""195881618\"",\""210387485\"",\""214410330\"",\""219453456\"",\""219572829\"",\""219593134\"",\""219642058\"",\""219751291\"",\""219753237\"",\""220100048\"",\""220369696\"",\""221126823\"",\""221390808\"",\""221673923\"",\""222132857\"",\""222233565\"",\""222537759\"",\""222647610\"",\""222647614\"",\""223631604\"",\""223947690\"",\""224784086\"",\""224997064\"",\""225519997\"",\""226092271\"",\""226806262\"",\""226953245\"",\""227562158\"",\""228036641\"",\""228175583\"",\""228854271\"",\""228866510\"",\""229014725\"",\""229200116\"",\""229797039\"",\""230148675\"",\""230815373\"",\""230883904\"",\""231529929\"",\""231659067\"",\""232946331\"",\""233312007\"",\""233743301\"",\""233743305\"",\""235361489\"",\""235492185\"",\""235954184\"",\""236593512\"",\""236676117\"",\""236949604\"",\""239255076\"",\""239512715\"",\""240821096\"",\""240821589\"",\""242489809\"",\""243343615\"",\""280439276\"",\""280609812\"",\""280663102\"",\""281369491\""],\""url_canonical\"":\""\"",\""unit_multiplier_un\"":0,\""measurement_unit_selector\"":false,\""release_data\"":{\""date_release\"":\""07-11-2016 00:00\"",\""date_release_end\"":\""07-12-2016 00:00\"",\""is_new\"":false}}}"", ""Características Destacadas"", ""Tipo de Producto"", ""Arroz Extra Añejo"", ""Observaciones y Recomendaciones"", ""Origen"", ""Nacional"", ""Costeño"", ""Referencia: 14974"", ""S/"", ""25"", ""90"", ""29"", ""60"", ""Cantidad"", ""＋"", ""－"", ""Certificados"", ""Ver todos"", ""Características Principales"", ""Contiene 5 kilos"", ""Arroz extra""], ""Especificaciones"": [""Comentarios"", ""Especificaciones técnicas"", ""Propiedad"", ""Especificación"", ""Arroz Costeño Extra 5kg"", ""¡El Arroz Costeño Extra 5 kg es tu mejor aliado en la cocina!"", ""Obtén el mejor"", ""precio para Arroz Costeño 5 kilos"", ""y disfruta de la máxima calidad que solo"", ""te puede ofrecer."", ""Llévate a casa la"", ""Bolsa de Arroz Costeño Extra de 5 Kg"", ""a un excelente precio y sorprende a tu familia con una variedad de platos exquisitos, desde un simple almuerzo hasta un postre especial para cerrar con broche de oro cualquier cena."", ""Beneficios nutricionales del Arroz Costeño Extra"", ""El"", ""Arroz Costeño"", ""no es solo un acompañante ideal para tus comidas; es una fuente indispensable de nutrientes. Cargado de hidratos de carbono, este arroz te mantiene activo y energizado durante todo el día."", ""Este superalimento también aporta"", ""vitaminas D"", ""y"", ""B"", "","", ""omega 3"", ""niacina"", ""ácido"", ""fólico"", ""tiamina"", "". Estos componentes son cruciales para una mejor absorción de nutrientes cuando se combina con otros alimentos como legumbres y carnes, optimizando así los beneficios para tu salud."", ""Inspiración para cocinar con Arroz Costeño"", ""Sea cual sea tu elección, el"", ""Extra asegura platos llenos de sabor y calidad."", ""¿Por qué elegir Arroz costeño extra?"", ""A diferencia de otros tipos de"", "", el"", ""Disfruta de un producto superior con cada bolsa de"", ""Arroz Costeño 5 kg"", "", ideal para todo tipo de recetas y garantizado para mejorar cualquier comida con su textura y sabor inigualables."", ""Compra hoy tu bolsa de"", ""Arroz Costeño Extra de 5 kilos"", ""y disfruta del incomparable precio que solo Wong.pe puede ofrecerte. ¡Calidad y buen sabor, garantizados!"", ""Ingredientes"", ""100% arroz"", ""Ver condiciones de promociones"", ""?"", ""!"", ""i"", ""×"", ""Sí Acepto"", ""Recuerda escribir al menos 3 letras en el cuadro de búsqueda"", ""Términos más buscados"", ""1."", ""elvive liso"", ""2."", ""ariel liquido"", ""3."", ""limpiador inodoro harpic"", ""4."", ""busca"", ""5."", ""secret clinical"", ""Marcas sugeridas""]}",dataset/txt_limpios/1055.txt,dataset/paginas_descargadas/1055.html,EN,arroz,keep,0.60,heuristic_default
