{"source_id": "1334", "title": "El almacenamiento local parece estar deshabilitado en tu navegador.", "description": "", "breadcrumbs": "Aprende más > 4Lb", "price_raw": "2.25", "currency_raw": "", "url": "", "seller": "Desconocido", "availability": "unknown", "country": "UNKNOWN", "product_name": "El almacenamiento local parece estar deshabilitado en tu navegador.", "brand": "Aprende", "reference": "", "unit": "4Lb", "price_amount": 2.25, "price_currency": "", "price_symbol": "$", "price_text": "$2,25", "price_amount_filled": "2.25", "price_is_imputed": "False", "price_imputation_source": "original", "price_amount_usd": "2.25", "price_amount_usd_filled": "2.25", "fx_rate_local_per_usd": "1.0", "fx_source": "default_1usd", "information_text": "", "description_text": "", "features_text": "", "specifications_text": "", "benefits_text": "", "details_text": "", "other_sections": "", "sections": {}, "txt_path": "dataset/txt_limpios/1334.txt", "html_path": "dataset/paginas_descargadas/1334.html", "es_status": "ET", "category_canonical": "sin_categoria", "decision": "discard", "match_score": 0.3, "reasons": "no_category_detected"}
{"source_id": "1335", "title": "El almacenamiento local parece estar deshabilitado en tu navegador.", "description": "Tipo de carpeta: Fusilli | Número 98 | Elaborado con sémola de trigo duro | Gran fuente de energía | Enriquecido con hierro y vitamina B | Bajo índice glucémico | Cocción en 11 minutos | Contenido: 500g | Detalles del producto | Reseñas | Escribir Su propia reseña | Estás revisando: PASTA FUSILLI REGGIA 500G | Su valoración | Rating | 1 stars | 2 stars | 3 stars | 4 stars | 5 stars | Apodo | Resumen | Reseña | Escribir una reseña | Unds. | Search engine powered by | ElasticSuite", "breadcrumbs": "Aprende más > 500G", "price_raw": "1.75", "currency_raw": "", "url": "", "seller": "Desconocido", "availability": "unknown", "country": "UNKNOWN", "product_name": "El almacenamiento local parece estar deshabilitado en tu navegador.", "brand": "Aprende", "reference": "", "unit": "500G", "price_amount": 1.75, "price_currency": "", "price_symbol": "$", "price_text": "$1,75", "price_amount_filled": "1.75", "price_is_imputed": "False", "price_imputation_source": "original", "price_amount_usd": "1.75", "price_amount_usd_filled": "1.75", "fx_rate_local_per_usd": "1.0", "fx_source": "default_1usd", "information_text": "", "description_text": "", "features_text": "", "specifications_text": "", "benefits_text": "", "details_text": "Tipo de carpeta: Fusilli | Número 98 | Elaborado con sémola de trigo duro | Gran fuente de energía | Enriquecido con hierro y vitamina B | Bajo índice glucémico | Cocción en 11 minutos | Contenido: 500g | Detalles del producto | Reseñas | Escribir Su propia reseña | Estás revisando: PASTA FUSILLI REGGIA 500G | Su valoración | Rating | 1 stars | 2 stars | 3 stars | 4 stars | 5 stars | Apodo | Resumen | Reseña | Escribir una reseña | Unds. | Search engine powered by | ElasticSuite", "other_sections": "", "sections": {"Detalles": ["Tipo de pasta: Fusilli", "Número 98", "Elaborado con sémola de trigo duro", "Gran fuente de energía", "Enriquecido con hierro y vitamina B", "Bajo índice glucémico", "Cocción en 11 minutos", "Contenido: 500g", "Detalles del producto", "Reseñas", "Escribir Su propia reseña", "Estás revisando: PASTA FUSILLI REGGIA 500G", "Su valoración", "Rating", "1 star", "2 stars", "3 stars", "4 stars", "5 stars", "Apodo", "Resumen", "Reseña", "Escribir una reseña", "Unds.", "Search engine powered by", "ElasticSuite"]}, "txt_path": "dataset/txt_limpios/1335.txt", "html_path": "dataset/paginas_descargadas/1335.html", "es_status": "ET", "category_canonical": "sin_categoria", "decision": "discard", "match_score": 0.3, "reasons": "no_category_detected"}
{"source_id": "1336", "title": "El almacenamiento local parece estar deshabilitado en tu navegador.", "description": "", "breadcrumbs": "Aprende", "price_raw": "3.41", "currency_raw": "", "url": "", "seller": "Desconocido", "availability": "unknown", "country": "UNKNOWN", "product_name": "El almacenamiento local parece estar deshabilitado en tu navegador.", "brand": "Aprende", "reference": "", "unit": "", "price_amount": 3.41, "price_currency": "", "price_symbol": "$", "price_text": "$3,41", "price_amount_filled": "3.41", "price_is_imputed": "False", "price_imputation_source": "original", "price_amount_usd": "3.41", "price_amount_usd_filled": "3.41", "fx_rate_local_per_usd": "1.0", "fx_source": "default_1usd", "information_text": "", "description_text": "", "features_text": "", "specifications_text": "", "benefits_text": "", "details_text": "", "other_sections": "", "sections": {}, "txt_path": "dataset/txt_limpios/1336.txt", "html_path": "dataset/paginas_descargadas/1336.html", "es_status": "ET", "category_canonical": "sin_categoria", "decision": "discard", "match_score": 0.3, "reasons": "no_category_detected"}
{"source_id": "1337", "title": "El almacenamiento local parece estar deshabilitado en tu navegador.", "description": "", "breadcrumbs": "Aprende más > 200G", "price_raw": "0.41", "currency_raw": "", "url": "", "seller": "Desconocido", "availability": "unknown", "country": "UNKNOWN", "product_name": "El almacenamiento local parece estar deshabilitado en tu navegador.", "brand": "Aprende", "reference": "", "unit": "200G", "price_amount": 0.41, "price_currency": "", "price_symbol": "$", "price_text": "$0,41", "price_amount_filled": "0.41", "price_is_imputed": "False", "price_imputation_source": "original", "price_amount_usd": "0.41", "price_amount_usd_filled": "0.41", "fx_rate_local_per_usd": "1.0", "fx_source": "default_1usd", "information_text": "", "description_text": "", "features_text": "", "specifications_text": "", "benefits_text": "", "details_text": "", "other_sections": "", "sections": {}, "txt_path": "dataset/txt_limpios/1337.txt", "html_path": "dataset/paginas_descargadas/1337.html", "es_status": "ET", "category_canonical": "sin_categoria", "decision": "discard", "match_score": 0.3, "reasons": "no_category_detected"}
{"source_id": "1338", "title": "El almacenamiento local parece estar deshabilitado en tu navegador.", "description": "Azúcar blanca granulada | Obtenido directamente del yugo de la caña de azúcar | Contenido: 1 kg | Detalles del producto | Reseñas | Escribir Su propia reseña | Estás revisando: Azucar Blanca Valdez 1Kg | Su valoración | Rating | 1 stars | 2 stars | 3 stars | 4 stars | 5 stars | Apodo | Resumen | Reseña | Escribir una reseña | Unds. | Search engine powered by | ElasticSuite", "breadcrumbs": "Aprende más > 1Kg", "price_raw": "1.16", "currency_raw": "", "url": "", "seller": "Desconocido", "availability": "unknown", "country": "UNKNOWN", "product_name": "El almacenamiento local parece estar deshabilitado en tu navegador.", "brand": "Aprende", "reference": "", "unit": "1Kg", "price_amount": 1.16, "price_currency": "", "price_symbol": "$", "price_text": "$1,16", "price_amount_filled": "1.16", "price_is_imputed": "False", "price_imputation_source": "original", "price_amount_usd": "1.16", "price_amount_usd_filled": "1.16", "fx_rate_local_per_usd": "1.0", "fx_source": "default_1usd", "information_text": "", "description_text": "", "features_text": "", "specifications_text": "", "benefits_text": "", "details_text": "Azúcar blanca granulada | Obtenido directamente del yugo de la caña de azúcar | Contenido: 1 kg | Detalles del producto | Reseñas | Escribir Su propia reseña | Estás revisando: Azucar Blanca Valdez 1Kg | Su valoración | Rating | 1 stars | 2 stars | 3 stars | 4 stars | 5 stars | Apodo | Resumen | Reseña | Escribir una reseña | Unds. | Search engine powered by | ElasticSuite", "other_sections": "", "sections": {"Detalles": ["Azúcar blanca granulada", "Obtenido directamente del jugo de la caña de azúcar", "Contenido: 1 kg", "Detalles del producto", "Reseñas", "Escribir Su propia reseña", "Estás revisando: Azucar Blanca Valdez 1Kg", "Su valoración", "Rating", "1 star", "2 stars", "3 stars", "4 stars", "5 stars", "Apodo", "Resumen", "Reseña", "Escribir una reseña", "Unds.", "Search engine powered by", "ElasticSuite"]}, "txt_path": "dataset/txt_limpios/1338.txt", "html_path": "dataset/paginas_descargadas/1338.html", "es_status": "ET", "category_canonical": "azucar", "decision": "keep", "match_score": 0.6, "reasons": "heuristic_default"}
{"source_id": "1339", "title": "El almacenamiento local parece estar deshabilitado en tu navegador.", "description": "", "breadcrumbs": "Aprende más > 1Kg", "price_raw": "1.12", "currency_raw": "", "url": "", "seller": "Desconocido", "availability": "unknown", "country": "UNKNOWN", "product_name": "El almacenamiento local parece estar deshabilitado en tu navegador.", "brand": "Aprende", "reference": "", "unit": "1Kg", "price_amount": 1.12, "price_currency": "", "price_symbol": "$", "price_text": "$1,12", "price_amount_filled": "1.12", "price_is_imputed": "False", "price_imputation_source": "original", "price_amount_usd": "1.12", "price_amount_usd_filled": "1.12", "fx_rate_local_per_usd": "1.0", "fx_source": "default_1usd", "information_text": "", "description_text": "", "features_text": "", "specifications_text": "", "benefits_text": "", "details_text": "", "other_sections": "", "sections": {}, "txt_path": "dataset/txt_limpios/1339.txt", "html_path": "dataset/paginas_descargadas/1339.html", "es_status": "ET", "category_canonical": "sin_categoria", "decision": "discard", "match_score": 0.3, "reasons": "no_category_detected"}
{"source_id": "544", "title": "Elegí tu envío", "description": "Leche ultrapasteurizada homogeneizada, fortificada con vitaminas A y D. Libre de gluten. Fuente de vitaminas C y E. Ver más Términos más buscados 1. leche 2. cerveza 3. flamin 4. galletitas 5. café", "breadcrumbs": "Hola, Limpía tú cache > 1 Lt > 7790742348302", "price_raw": "1.38", "currency_raw": "ARS", "url": "", "seller": "Desconocido", "availability": "unknown", "country": "AR", "product_name": "Elegí tu envío", "brand": "Hola, Limpía tú cache", "reference": "7790742348302.0", "unit": "1 Lt", "price_amount": 1.38, "price_currency": "ARS", "price_symbol": "$", "price_text": "$1.38", "price_amount_filled": "1.38", "price_is_imputed": "False", "price_imputation_source": "original", "price_amount_usd": "0.0011", "price_amount_usd_filled": "0.0011", "fx_rate_local_per_usd": "1255.0", "fx_source": "from_argentina_cambio_dolar", "information_text": "", "description_text": "Leche ultrapasteurizada homogeneizada, fortificada con vitaminas A y D. Libre de gluten. Fuente de vitaminas C y E. Ver más Términos más buscados 1. leche 2. cerveza 3. flamin 4. galletitas 5. café", "features_text": "", "specifications_text": "", "benefits_text": "", "details_text": "", "other_sections": "", "sections": {"Descripción": ["Leche ultrapasteurizada homogeneizada, fortificada con vitaminas A y D. Libre de gluten. Fuente de vitaminas C y E.", "Ver más", "Términos más buscados", "1.", "leche", "2.", "cerveza", "3.", "flamin", "4.", "galletitas", "5.", "cafe"]}, "txt_path": "dataset/txt_limpios/544.txt", "html_path": "dataset/paginas_descargadas/544.html", "es_status": "ET", "category_canonical": "cafe", "decision": "keep", "match_score": 0.6, "reasons": "heuristic_default"}
{"source_id": "545", "title": "Elegí tu envío", "description": "", "breadcrumbs": "Hola, Limpía tú cache", "price_raw": "", "currency_raw": "ARS", "url": "", "seller": "Desconocido", "availability": "unknown", "country": "AR", "product_name": "Elegí tu envío", "brand": "Hola, Limpía tú cache", "reference": "", "unit": "", "price_amount": null, "price_currency": "ARS", "price_symbol": "", "price_text": "", "price_amount_filled": "1663.58", "price_is_imputed": "True", "price_imputation_source": "country_mean", "price_amount_usd": "", "price_amount_usd_filled": "1.3256", "fx_rate_local_per_usd": "1255.0", "fx_source": "from_argentina_cambio_dolar", "information_text": "", "description_text": "", "features_text": "", "specifications_text": "", "benefits_text": "", "details_text": "", "other_sections": "", "sections": {}, "txt_path": "dataset/txt_limpios/545.txt", "html_path": "dataset/paginas_descargadas/545.html", "es_status": "EN", "category_canonical": "sin_categoria", "decision": "discard", "match_score": 0.3, "reasons": "no_category_detected;price_parse_failed"}
{"source_id": "548", "title": "Elegí tu envío", "description": "", "breadcrumbs": "Hola, Limpía tú cache > 1 Lt > 7798338290028", "price_raw": "2.18", "currency_raw": "ARS", "url": "", "seller": "Desconocido", "availability": "unknown", "country": "AR", "product_name": "Elegí tu envío", "brand": "Hola, Limpía tú cache", "reference": "7798338290028.0", "unit": "1 Lt", "price_amount": 2.18, "price_currency": "ARS", "price_symbol": "$", "price_text": "$2.18", "price_amount_filled": "2.18", "price_is_imputed": "False", "price_imputation_source": "original", "price_amount_usd": "0.0017", "price_amount_usd_filled": "0.0017", "fx_rate_local_per_usd": "1255.0", "fx_source": "from_argentina_cambio_dolar", "information_text": "", "description_text": "", "features_text": "", "specifications_text": "", "benefits_text": "", "details_text": "", "other_sections": "", "sections": {}, "txt_path": "dataset/txt_limpios/548.txt", "html_path": "dataset/paginas_descargadas/548.html", "es_status": "EN", "category_canonical": "sin_categoria", "decision": "discard", "match_score": 0.3, "reasons": "no_category_detected"}
{"source_id": "549", "title": "Elegí tu envío", "description": "El pan Frago es el pan que combina recetas tradicionales mejoradas en el tiempo, con ingredientes nobles, frescura y rico sabor. Con más de 50 años de trayectoria, contamos con un portafolio variado con distintos formatos para compartir en casa. Pan integral, fresco y rico sabor Harina integral, harina de trigo 000*, agua, levadura, gluten de trigo, azúcar, salvado de trigo, aceite vegetal, germen de trigo, sal, cloruro de potasio, suero de leche en polvo, aromatizantes naturales, conservadores: INS 282, INS 200, regulador de acidez: INS 270, mejorador de la harina: INS 300. CONTIENE DERIVADOS DE TRIGO Y DE LECHE. PUEDE CONTENER AVENA, SOJA, DERIVADOS DE CEBADA Y DE CENTENO. (*) Harina de trigo enriquecido según Ley N° 25.630 con: hierro (30 mg/kg); ácido fólico (2,2 mg/kg); tiamina B1 (6,3 mg/kg); riboflavina B2 (1,3 mg/kg); niacina (13 mg/kg). Ver más Términos más buscados 1. leche 2. cerveza 3. flamin 4. galletitas 5. café", "breadcrumbs": "Hola, Limpía tú cache > 400 Gr > 7793890261486", "price_raw": "4.8", "currency_raw": "ARS", "url": "", "seller": "Desconocido", "availability": "unknown", "country": "AR", "product_name": "Elegí tu envío", "brand": "Hola, Limpía tú cache", "reference": "7793890261486.0", "unit": "400 Gr", "price_amount": 4.8, "price_currency": "ARS", "price_symbol": "$", "price_text": "$4.80", "price_amount_filled": "4.8", "price_is_imputed": "False", "price_imputation_source": "original", "price_amount_usd": "0.0038", "price_amount_usd_filled": "0.0038", "fx_rate_local_per_usd": "1255.0", "fx_source": "from_argentina_cambio_dolar", "information_text": "", "description_text": "El pan Frago es el pan que combina recetas tradicionales mejoradas en el tiempo, con ingredientes nobles, frescura y rico sabor. Con más de 50 años de trayectoria, contamos con un portafolio variado con distintos formatos para compartir en casa. Pan integral, fresco y rico sabor Harina integral, harina de trigo 000*, agua, levadura, gluten de trigo, azúcar, salvado de trigo, aceite vegetal, germen de trigo, sal, cloruro de potasio, suero de leche en polvo, aromatizantes naturales, conservadores: INS 282, INS 200, regulador de acidez: INS 270, mejorador de la harina: INS 300. CONTIENE DERIVADOS DE TRIGO Y DE LECHE. PUEDE CONTENER AVENA, SOJA, DERIVADOS DE CEBADA Y DE CENTENO. (*) Harina de trigo enriquecido según Ley N° 25.630 con: hierro (30 mg/kg); ácido fólico (2,2 mg/kg); tiamina B1 (6,3 mg/kg); riboflavina B2 (1,3 mg/kg); niacina (13 mg/kg). Ver más Términos más buscados 1. leche 2. cerveza 3. flamin 4. galletitas 5. café", "features_text": "", "specifications_text": "", "benefits_text": "", "details_text": "", "other_sections": "", "sections": {"Descripción": ["El pan Frago es el pan que combina recetas tradicionales mejoradas en el tiempo, con ingredientes nobles, frescura y rico sabor. Con más de 50 años de trayectoria, contamos con un portafolio variado con distintos formatos para compartir en casa.", "Pan integral, fresco y rico sabor", "Harina integral, harina de trigo 000*, agua, levadura, gluten de trigo, azúcar, salvado de trigo, aceite vegetal, germen de trigo, sal, cloruro de potasio, suero de leche en polvo, aromatizantes naturales, conservadores: INS 282, INS 200, regulador de acidez: INS 270, mejorador de la harina: INS 300. CONTIENE DERIVADOS DE TRIGO Y DE LECHE. PUEDE CONTENER AVENA, SOJA, DERIVADOS DE CEBADA Y DE CENTENO. (*) Harina de trigo enriquecido según Ley N° 25.630 con: hierro (30 mg/kg); ácido fólico (2,2 mg/kg); tiamina B1 (6,3 mg/kg); riboflavina B2 (1,3 mg/kg); niacina (13 mg/kg).", "Ver más", "Términos más buscados", "1.", "leche", "2.", "cerveza", "3.", "flamin", "4.", "galletitas", "5.", "cafe"]}, "txt_path": "dataset/txt_limpios/549.txt", "html_path": "dataset/paginas_descargadas/549.html", "es_status": "ET", "category_canonical": "leche", "decision": "keep", "match_score": 0.6, "reasons": "heuristic_default"}
{"source_id": "550", "title": "Elegí tu envío", "description": "El pan Blanco Bimbo ahora con rebanada más grande, suave y esponjoso. Nuestra receta está elaborada con la bondad del trigo y con FERMENTACIÓN NATURAL, para que tengas siempre en tu mesa un pan suave, esponjoso y con un gran sabor. Pan con suavidad y textura única. Reabanada más grande. Harina de trigo 000*, agua, levadura, azúcar, gluten de trigo, aceite vegetal, leche en polvo descremada, sal, cloruro de potasio, vitamina D, suero de leche en polvo, conservadores: INS 282, INS 200, regulador de acidez: INS 270, mejorador de la harina: INS 300, aromatizante natural. CONTIENE LECHE Y DERIVADOS DE TRIGO. PUEDE CONTENER SOJA, AVENA, DERIVADOS DE CENTENO Y DE CEBADA. (*) Harina de trigo enriquecido según Ley N° 25.630 con: hierro (30 mg/kg); ácido fólico (2,2 mg/kg); tiamina B1 (6,3 mg/kg); riboflavina B2 (1,3 mg/kg); niacina (13 mg/kg). Ver más Términos más buscados 1. leche 2. cerveza 3. flamin 4. galletitas 5. café", "breadcrumbs": "Hola, Limpía tú cache > 610 Gr > 7793890261189", "price_raw": "6.43", "currency_raw": "ARS", "url": "", "seller": "Desconocido", "availability": "unknown", "country": "AR", "product_name": "Elegí tu envío", "brand": "Hola, Limpía tú cache", "reference": "7793890261189.0", "unit": "610 Gr", "price_amount": 6.43, "price_currency": "ARS", "price_symbol": "$", "price_text": "$6.43", "price_amount_filled": "6.43", "price_is_imputed": "False", "price_imputation_source": "original", "price_amount_usd": "0.0051", "price_amount_usd_filled": "0.0051", "fx_rate_local_per_usd": "1255.0", "fx_source": "from_argentina_cambio_dolar", "information_text": "", "description_text": "El pan Blanco Bimbo ahora con rebanada más grande, suave y esponjoso. Nuestra receta está elaborada con la bondad del trigo y con FERMENTACIÓN NATURAL, para que tengas siempre en tu mesa un pan suave, esponjoso y con un gran sabor. Pan con suavidad y textura única. Reabanada más grande. Harina de trigo 000*, agua, levadura, azúcar, gluten de trigo, aceite vegetal, leche en polvo descremada, sal, cloruro de potasio, vitamina D, suero de leche en polvo, conservadores: INS 282, INS 200, regulador de acidez: INS 270, mejorador de la harina: INS 300, aromatizante natural. CONTIENE LECHE Y DERIVADOS DE TRIGO. PUEDE CONTENER SOJA, AVENA, DERIVADOS DE CENTENO Y DE CEBADA. (*) Harina de trigo enriquecido según Ley N° 25.630 con: hierro (30 mg/kg); ácido fólico (2,2 mg/kg); tiamina B1 (6,3 mg/kg); riboflavina B2 (1,3 mg/kg); niacina (13 mg/kg). Ver más Términos más buscados 1. leche 2. cerveza 3. flamin 4. galletitas 5. café", "features_text": "", "specifications_text": "", "benefits_text": "", "details_text": "", "other_sections": "", "sections": {"Descripción": ["El pan Blanco Bimbo ahora con rebanada más grande, suave y esponjoso. Nuestra receta está elaborada con la bondad del trigo y con FERMENTACIÓN NATURAL, para que tengas siempre en tu mesa un pan suave, esponjoso y con un gran sabor.", "Pan con suavidad y textura única. Reabanada más grande.", "Harina de trigo 000*, agua, levadura, azúcar, gluten de trigo, aceite vegetal, leche en polvo descremada, sal, cloruro de potasio, vitamina D, suero de leche en polvo, conservadores: INS 282, INS 200, regulador de acidez: INS 270, mejorador de la harina: INS 300, aromatizante natural. CONTIENE LECHE Y DERIVADOS DE TRIGO. PUEDE CONTENER SOJA, AVENA, DERIVADOS DE CENTENO Y DE CEBADA. (*) Harina de trigo enriquecido según Ley N° 25.630 con: hierro (30 mg/kg); ácido fólico (2,2 mg/kg); tiamina B1 (6,3 mg/kg); riboflavina B2 (1,3 mg/kg); niacina (13 mg/kg).", "Ver más", "Términos más buscados", "1.", "leche", "2.", "cerveza", "3.", "flamin", "4.", "galletitas", "5.", "cafe"]}, "txt_path": "dataset/txt_limpios/550.txt", "html_path": "dataset/paginas_descargadas/550.html", "es_status": "ET", "category_canonical": "leche", "decision": "keep", "match_score": 0.6, "reasons": "heuristic_default"}
