{"source_id": "1427", "title": "+595994 874276", "description": "", "breadcrumbs": "Selecciona método de entrega > 500 GR", "price_raw": "", "currency_raw": "", "url": "", "seller": "Desconocido", "availability": "unknown", "country": "UNKNOWN", "product_name": "+595994 874276", "brand": "Selecciona método de entrega", "reference": "", "unit": "500 GR", "price_amount": null, "price_currency": "", "price_symbol": "", "price_text": "", "price_amount_filled": "234.19", "price_is_imputed": "True", "price_imputation_source": "country_mean", "price_amount_usd": "", "price_amount_usd_filled": "234.1938", "fx_rate_local_per_usd": "1.0", "fx_source": "default_1usd", "information_text": "", "description_text": "", "features_text": "", "specifications_text": "", "benefits_text": "", "details_text": "", "other_sections": "", "sections": {}, "txt_path": "dataset/txt_limpios/1427.txt", "html_path": "dataset/paginas_descargadas/1427.html", "es_status": "EN", "category_canonical": "sin_categoria", "decision": "discard", "match_score": 0.3, "reasons": "no_category_detected;price_parse_failed"}
{"source_id": "1428", "title": "+595994 874276", "description": "", "breadcrumbs": "Selecciona método de entrega > 120 GR", "price_raw": "", "currency_raw": "", "url": "", "seller": "Desconocido", "availability": "unknown", "country": "UNKNOWN", "product_name": "+595994 874276", "brand": "Selecciona método de entrega", "reference": "", "unit": "120 GR", "price_amount": null, "price_currency": "", "price_symbol": "", "price_text": "", "price_amount_filled": "234.19", "price_is_imputed": "True", "price_imputation_source": "country_mean", "price_amount_usd": "", "price_amount_usd_filled": "234.1938", "fx_rate_local_per_usd": "1.0", "fx_source": "default_1usd", "information_text": "", "description_text": "", "features_text": "", "specifications_text": "", "benefits_text": "", "details_text": "", "other_sections": "", "sections": {}, "txt_path": "dataset/txt_limpios/1428.txt", "html_path": "dataset/paginas_descargadas/1428.html", "es_status": "EN", "category_canonical": "sin_categoria", "decision": "discard", "match_score": 0.3, "reasons": "no_category_detected;price_parse_failed"}
{"source_id": "1429", "title": "+595994 874276", "description": "", "breadcrumbs": "Selecciona método de entrega > 500 GR", "price_raw": "", "currency_raw": "", "url": "", "seller": "Desconocido", "availability": "unknown", "country": "UNKNOWN", "product_name": "+595994 874276", "brand": "Selecciona método de entrega", "reference": "", "unit": "500 GR", "price_amount": null, "price_currency": "", "price_symbol": "", "price_text": "", "price_amount_filled": "234.19", "price_is_imputed": "True", "price_imputation_source": "country_mean", "price_amount_usd": "", "price_amount_usd_filled": "234.1938", "fx_rate_local_per_usd": "1.0", "fx_source": "default_1usd", "information_text": "", "description_text": "", "features_text": "", "specifications_text": "", "benefits_text": "", "details_text": "", "other_sections": "", "sections": {}, "txt_path": "dataset/txt_limpios/1429.txt", "html_path": "dataset/paginas_descargadas/1429.html", "es_status": "EN", "category_canonical": "sin_categoria", "decision": "discard", "match_score": 0.3, "reasons": "no_category_detected;price_parse_failed"}
{"source_id": "1430", "title": "+595994 874276", "description": "", "breadcrumbs": "Selecciona método de entrega > 500 GR", "price_raw": "", "currency_raw": "", "url": "", "seller": "Desconocido", "availability": "unknown", "country": "UNKNOWN", "product_name": "+595994 874276", "brand": "Selecciona método de entrega", "reference": "", "unit": "500 GR", "price_amount": null, "price_currency": "", "price_symbol": "", "price_text": "", "price_amount_filled": "234.19", "price_is_imputed": "True", "price_imputation_source": "country_mean", "price_amount_usd": "", "price_amount_usd_filled": "234.1938", "fx_rate_local_per_usd": "1.0", "fx_source": "default_1usd", "information_text": "", "description_text": "", "features_text": "", "specifications_text": "", "benefits_text": "", "details_text": "", "other_sections": "", "sections": {}, "txt_path": "dataset/txt_limpios/1430.txt", "html_path": "dataset/paginas_descargadas/1430.html", "es_status": "EN", "category_canonical": "sin_categoria", "decision": "discard", "match_score": 0.3, "reasons": "no_category_detected;price_parse_failed"}
{"source_id": "1431", "title": "+595994 874276", "description": "", "breadcrumbs": "Selecciona método de entrega > 1 LT", "price_raw": "", "currency_raw": "", "url": "", "seller": "Desconocido", "availability": "unknown", "country": "UNKNOWN", "product_name": "+595994 874276", "brand": "Selecciona método de entrega", "reference": "", "unit": "1 LT", "price_amount": null, "price_currency": "", "price_symbol": "", "price_text": "", "price_amount_filled": "234.19", "price_is_imputed": "True", "price_imputation_source": "country_mean", "price_amount_usd": "", "price_amount_usd_filled": "234.1938", "fx_rate_local_per_usd": "1.0", "fx_source": "default_1usd", "information_text": "", "description_text": "", "features_text": "", "specifications_text": "", "benefits_text": "", "details_text": "", "other_sections": "", "sections": {}, "txt_path": "dataset/txt_limpios/1431.txt", "html_path": "dataset/paginas_descargadas/1431.html", "es_status": "EN", "category_canonical": "sin_categoria", "decision": "discard", "match_score": 0.3, "reasons": "no_category_detected;price_parse_failed"}
{"source_id": "1432", "title": "+595994 874276", "description": "", "breadcrumbs": "Selecciona método de entrega > 500 GR", "price_raw": "", "currency_raw": "", "url": "", "seller": "Desconocido", "availability": "unknown", "country": "UNKNOWN", "product_name": "+595994 874276", "brand": "Selecciona método de entrega", "reference": "", "unit": "500 GR", "price_amount": null, "price_currency": "", "price_symbol": "", "price_text": "", "price_amount_filled": "234.19", "price_is_imputed": "True", "price_imputation_source": "country_mean", "price_amount_usd": "", "price_amount_usd_filled": "234.1938", "fx_rate_local_per_usd": "1.0", "fx_source": "default_1usd", "information_text": "", "description_text": "", "features_text": "", "specifications_text": "", "benefits_text": "", "details_text": "", "other_sections": "", "sections": {}, "txt_path": "dataset/txt_limpios/1432.txt", "html_path": "dataset/paginas_descargadas/1432.html", "es_status": "EN", "category_canonical": "sin_categoria", "decision": "discard", "match_score": 0.3, "reasons": "no_category_detected;price_parse_failed"}
{"source_id": "1433", "title": "+595994 874276", "description": "", "breadcrumbs": "Selecciona método de entrega > 500 GR", "price_raw": "", "currency_raw": "", "url": "", "seller": "Desconocido", "availability": "unknown", "country": "UNKNOWN", "product_name": "+595994 874276", "brand": "Selecciona método de entrega", "reference": "", "unit": "500 GR", "price_amount": null, "price_currency": "", "price_symbol": "", "price_text": "", "price_amount_filled": "234.19", "price_is_imputed": "True", "price_imputation_source": "country_mean", "price_amount_usd": "", "price_amount_usd_filled": "234.1938", "fx_rate_local_per_usd": "1.0", "fx_source": "default_1usd", "information_text": "", "description_text": "", "features_text": "", "specifications_text": "", "benefits_text": "", "details_text": "", "other_sections": "", "sections": {}, "txt_path": "dataset/txt_limpios/1433.txt", "html_path": "dataset/paginas_descargadas/1433.html", "es_status": "EN", "category_canonical": "sin_categoria", "decision": "discard", "match_score": 0.3, "reasons": "no_category_detected;price_parse_failed"}
{"source_id": "1434", "title": "+595994 874276", "description": "", "breadcrumbs": "Selecciona método de entrega > 500 ML", "price_raw": "", "currency_raw": "", "url": "", "seller": "Desconocido", "availability": "unknown", "country": "UNKNOWN", "product_name": "+595994 874276", "brand": "Selecciona método de entrega", "reference": "", "unit": "500 ML", "price_amount": null, "price_currency": "", "price_symbol": "", "price_text": "", "price_amount_filled": "234.19", "price_is_imputed": "True", "price_imputation_source": "country_mean", "price_amount_usd": "", "price_amount_usd_filled": "234.1938", "fx_rate_local_per_usd": "1.0", "fx_source": "default_1usd", "information_text": "", "description_text": "", "features_text": "", "specifications_text": "", "benefits_text": "", "details_text": "", "other_sections": "", "sections": {}, "txt_path": "dataset/txt_limpios/1434.txt", "html_path": "dataset/paginas_descargadas/1434.html", "es_status": "EN", "category_canonical": "sin_categoria", "decision": "discard", "match_score": 0.3, "reasons": "no_category_detected;price_parse_failed"}
{"source_id": "1435", "title": "+595994 874276", "description": "", "breadcrumbs": "Selecciona método de entrega > 2 LT", "price_raw": "2.0", "currency_raw": "", "url": "", "seller": "Desconocido", "availability": "unknown", "country": "UNKNOWN", "product_name": "+595994 874276", "brand": "Selecciona método de entrega", "reference": "", "unit": "2 LT", "price_amount": 2.0, "price_currency": "", "price_symbol": "", "price_text": "2", "price_amount_filled": "2.0", "price_is_imputed": "False", "price_imputation_source": "original", "price_amount_usd": "2.0", "price_amount_usd_filled": "2.0", "fx_rate_local_per_usd": "1.0", "fx_source": "default_1usd", "information_text": "", "description_text": "", "features_text": "", "specifications_text": "", "benefits_text": "", "details_text": "", "other_sections": "", "sections": {}, "txt_path": "dataset/txt_limpios/1435.txt", "html_path": "dataset/paginas_descargadas/1435.html", "es_status": "EN", "category_canonical": "sin_categoria", "decision": "discard", "match_score": 0.3, "reasons": "no_category_detected"}
{"source_id": "1436", "title": "+595994 874276", "description": "", "breadcrumbs": "Selecciona método de entrega > 750 ML", "price_raw": "2.0", "currency_raw": "", "url": "", "seller": "Desconocido", "availability": "unknown", "country": "UNKNOWN", "product_name": "+595994 874276", "brand": "Selecciona método de entrega", "reference": "", "unit": "750 ML", "price_amount": 2.0, "price_currency": "", "price_symbol": "", "price_text": "2", "price_amount_filled": "2.0", "price_is_imputed": "False", "price_imputation_source": "original", "price_amount_usd": "2.0", "price_amount_usd_filled": "2.0", "fx_rate_local_per_usd": "1.0", "fx_source": "default_1usd", "information_text": "", "description_text": "", "features_text": "", "specifications_text": "", "benefits_text": "", "details_text": "", "other_sections": "", "sections": {}, "txt_path": "dataset/txt_limpios/1436.txt", "html_path": "dataset/paginas_descargadas/1436.html", "es_status": "EN", "category_canonical": "sin_categoria", "decision": "discard", "match_score": 0.3, "reasons": "no_category_detected"}
{"source_id": "1437", "title": "+595994 874276", "description": "", "breadcrumbs": "Selecciona método de entrega", "price_raw": "", "currency_raw": "", "url": "", "seller": "Desconocido", "availability": "unknown", "country": "UNKNOWN", "product_name": "+595994 874276", "brand": "Selecciona método de entrega", "reference": "", "unit": "", "price_amount": null, "price_currency": "", "price_symbol": "", "price_text": "", "price_amount_filled": "234.19", "price_is_imputed": "True", "price_imputation_source": "country_mean", "price_amount_usd": "", "price_amount_usd_filled": "234.1938", "fx_rate_local_per_usd": "1.0", "fx_source": "default_1usd", "information_text": "", "description_text": "", "features_text": "", "specifications_text": "", "benefits_text": "", "details_text": "", "other_sections": "", "sections": {}, "txt_path": "dataset/txt_limpios/1437.txt", "html_path": "dataset/paginas_descargadas/1437.html", "es_status": "EN", "category_canonical": "sin_categoria", "decision": "discard", "match_score": 0.3, "reasons": "no_category_detected;price_parse_failed"}
{"source_id": "1438", "title": "+595994 874276", "description": "", "breadcrumbs": "Selecciona método de entrega > 1 LT", "price_raw": "", "currency_raw": "", "url": "", "seller": "Desconocido", "availability": "unknown", "country": "UNKNOWN", "product_name": "+595994 874276", "brand": "Selecciona método de entrega", "reference": "", "unit": "1 LT", "price_amount": null, "price_currency": "", "price_symbol": "", "price_text": "", "price_amount_filled": "234.19", "price_is_imputed": "True", "price_imputation_source": "country_mean", "price_amount_usd": "", "price_amount_usd_filled": "234.1938", "fx_rate_local_per_usd": "1.0", "fx_source": "default_1usd", "information_text": "", "description_text": "", "features_text": "", "specifications_text": "", "benefits_text": "", "details_text": "", "other_sections": "", "sections": {}, "txt_path": "dataset/txt_limpios/1438.txt", "html_path": "dataset/paginas_descargadas/1438.html", "es_status": "EN", "category_canonical": "sin_categoria", "decision": "discard", "match_score": 0.3, "reasons": "no_category_detected;price_parse_failed"}
{"source_id": "1439", "title": "+595994 874276", "description": "", "breadcrumbs": "Selecciona método de entrega > 500 ML", "price_raw": "", "currency_raw": "", "url": "", "seller": "Desconocido", "availability": "unknown", "country": "UNKNOWN", "product_name": "+595994 874276", "brand": "Selecciona método de entrega", "reference": "", "unit": "500 ML", "price_amount": null, "price_currency": "", "price_symbol": "", "price_text": "", "price_amount_filled": "234.19", "price_is_imputed": "True", "price_imputation_source": "country_mean", "price_amount_usd": "", "price_amount_usd_filled": "234.1938", "fx_rate_local_per_usd": "1.0", "fx_source": "default_1usd", "information_text": "", "description_text": "", "features_text": "", "specifications_text": "", "benefits_text": "", "details_text": "", "other_sections": "", "sections": {}, "txt_path": "dataset/txt_limpios/1439.txt", "html_path": "dataset/paginas_descargadas/1439.html", "es_status": "EN", "category_canonical": "sin_categoria", "decision": "discard", "match_score": 0.3, "reasons": "no_category_detected;price_parse_failed"}
{"source_id": "1440", "title": "+595994 874276", "description": "", "breadcrumbs": "Selecciona método de entrega > 1 LT", "price_raw": "", "currency_raw": "", "url": "", "seller": "Desconocido", "availability": "unknown", "country": "UNKNOWN", "product_name": "+595994 874276", "brand": "Selecciona método de entrega", "reference": "", "unit": "1 LT", "price_amount": null, "price_currency": "", "price_symbol": "", "price_text": "", "price_amount_filled": "234.19", "price_is_imputed": "True", "price_imputation_source": "country_mean", "price_amount_usd": "", "price_amount_usd_filled": "234.1938", "fx_rate_local_per_usd": "1.0", "fx_source": "default_1usd", "information_text": "", "description_text": "", "features_text": "", "specifications_text": "", "benefits_text": "", "details_text": "", "other_sections": "", "sections": {}, "txt_path": "dataset/txt_limpios/1440.txt", "html_path": "dataset/paginas_descargadas/1440.html", "es_status": "EN", "category_canonical": "sin_categoria", "decision": "discard", "match_score": 0.3, "reasons": "no_category_detected;price_parse_failed"}
{"source_id": "1441", "title": "+595994 874276", "description": "", "breadcrumbs": "Selecciona método de entrega > 1 LT", "price_raw": "", "currency_raw": "", "url": "", "seller": "Desconocido", "availability": "unknown", "country": "UNKNOWN", "product_name": "+595994 874276", "brand": "Selecciona método de entrega", "reference": "", "unit": "1 LT", "price_amount": null, "price_currency": "", "price_symbol": "", "price_text": "", "price_amount_filled": "234.19", "price_is_imputed": "True", "price_imputation_source": "country_mean", "price_amount_usd": "", "price_amount_usd_filled": "234.1938", "fx_rate_local_per_usd": "1.0", "fx_source": "default_1usd", "information_text": "", "description_text": "", "features_text": "", "specifications_text": "", "benefits_text": "", "details_text": "", "other_sections": "", "sections": {}, "txt_path": "dataset/txt_limpios/1441.txt", "html_path": "dataset/paginas_descargadas/1441.html", "es_status": "EN", "category_canonical": "sin_categoria", "decision": "discard", "match_score": 0.3, "reasons": "no_category_detected;price_parse_failed"}
{"source_id": "1442", "title": "+595994 874276", "description": "", "breadcrumbs": "Selecciona método de entrega > 900 ML", "price_raw": "", "currency_raw": "", "url": "", "seller": "Desconocido", "availability": "unknown", "country": "UNKNOWN", "product_name": "+595994 874276", "brand": "Selecciona método de entrega", "reference": "", "unit": "900 ML", "price_amount": null, "price_currency": "", "price_symbol": "", "price_text": "", "price_amount_filled": "234.19", "price_is_imputed": "True", "price_imputation_source": "country_mean", "price_amount_usd": "", "price_amount_usd_filled": "234.1938", "fx_rate_local_per_usd": "1.0", "fx_source": "default_1usd", "information_text": "", "description_text": "", "features_text": "", "specifications_text": "", "benefits_text": "", "details_text": "", "other_sections": "", "sections": {}, "txt_path": "dataset/txt_limpios/1442.txt", "html_path": "dataset/paginas_descargadas/1442.html", "es_status": "EN", "category_canonical": "sin_categoria", "decision": "discard", "match_score": 0.3, "reasons": "no_category_detected;price_parse_failed"}
{"source_id": "1443", "title": "+595994 874276", "description": "", "breadcrumbs": "Selecciona método de entrega > 4 KG", "price_raw": "", "currency_raw": "", "url": "", "seller": "Desconocido", "availability": "unknown", "country": "UNKNOWN", "product_name": "+595994 874276", "brand": "Selecciona método de entrega", "reference": "", "unit": "4 KG", "price_amount": null, "price_currency": "", "price_symbol": "", "price_text": "", "price_amount_filled": "234.19", "price_is_imputed": "True", "price_imputation_source": "country_mean", "price_amount_usd": "", "price_amount_usd_filled": "234.1938", "fx_rate_local_per_usd": "1.0", "fx_source": "default_1usd", "information_text": "", "description_text": "", "features_text": "", "specifications_text": "", "benefits_text": "", "details_text": "", "other_sections": "", "sections": {}, "txt_path": "dataset/txt_limpios/1443.txt", "html_path": "dataset/paginas_descargadas/1443.html", "es_status": "EN", "category_canonical": "sin_categoria", "decision": "discard", "match_score": 0.3, "reasons": "no_category_detected;price_parse_failed"}
{"source_id": "1444", "title": "+595994 874276", "description": "", "breadcrumbs": "Selecciona método de entrega > 1 KG", "price_raw": "", "currency_raw": "", "url": "", "seller": "Desconocido", "availability": "unknown", "country": "UNKNOWN", "product_name": "+595994 874276", "brand": "Selecciona método de entrega", "reference": "", "unit": "1 KG", "price_amount": null, "price_currency": "", "price_symbol": "", "price_text": "", "price_amount_filled": "234.19", "price_is_imputed": "True", "price_imputation_source": "country_mean", "price_amount_usd": "", "price_amount_usd_filled": "234.1938", "fx_rate_local_per_usd": "1.0", "fx_source": "default_1usd", "information_text": "", "description_text": "", "features_text": "", "specifications_text": "", "benefits_text": "", "details_text": "", "other_sections": "", "sections": {}, "txt_path": "dataset/txt_limpios/1444.txt", "html_path": "dataset/paginas_descargadas/1444.html", "es_status": "EN", "category_canonical": "sin_categoria", "decision": "discard", "match_score": 0.3, "reasons": "no_category_detected;price_parse_failed"}
{"source_id": "1445", "title": "+595994 874276", "description": "", "breadcrumbs": "Selecciona método de entrega > 1KG", "price_raw": "", "currency_raw": "", "url": "", "seller": "Desconocido", "availability": "unknown", "country": "UNKNOWN", "product_name": "+595994 874276", "brand": "Selecciona método de entrega", "reference": "", "unit": "1KG", "price_amount": null, "price_currency": "", "price_symbol": "", "price_text": "", "price_amount_filled": "234.19", "price_is_imputed": "True", "price_imputation_source": "country_mean", "price_amount_usd": "", "price_amount_usd_filled": "234.1938", "fx_rate_local_per_usd": "1.0", "fx_source": "default_1usd", "information_text": "", "description_text": "", "features_text": "", "specifications_text": "", "benefits_text": "", "details_text": "", "other_sections": "", "sections": {}, "txt_path": "dataset/txt_limpios/1445.txt", "html_path": "dataset/paginas_descargadas/1445.html", "es_status": "EN", "category_canonical": "sin_categoria", "decision": "discard", "match_score": 0.3, "reasons": "no_category_detected;price_parse_failed"}
{"source_id": "1446", "title": "+595994 874276", "description": "", "breadcrumbs": "Selecciona método de entrega > 750 ML", "price_raw": "2.0", "currency_raw": "", "url": "", "seller": "Desconocido", "availability": "unknown", "country": "UNKNOWN", "product_name": "+595994 874276", "brand": "Selecciona método de entrega", "reference": "", "unit": "750 ML", "price_amount": 2.0, "price_currency": "", "price_symbol": "", "price_text": "2", "price_amount_filled": "2.0", "price_is_imputed": "False", "price_imputation_source": "original", "price_amount_usd": "2.0", "price_amount_usd_filled": "2.0", "fx_rate_local_per_usd": "1.0", "fx_source": "default_1usd", "information_text": "", "description_text": "", "features_text": "", "specifications_text": "", "benefits_text": "", "details_text": "", "other_sections": "", "sections": {}, "txt_path": "dataset/txt_limpios/1446.txt", "html_path": "dataset/paginas_descargadas/1446.html", "es_status": "EN", "category_canonical": "sin_categoria", "decision": "discard", "match_score": 0.3, "reasons": "no_category_detected"}
