{"source_id": "885", "title": "Robot or human?", "description": "", "breadcrumbs": "", "price_raw": "", "currency_raw": "", "url": "", "seller": "Desconocido", "availability": "unknown", "country": "UNKNOWN", "product_name": "Robot or human?", "brand": "", "reference": "", "unit": "", "price_amount": null, "price_currency": "", "price_symbol": "", "price_text": "", "price_amount_filled": "234.19", "price_is_imputed": "True", "price_imputation_source": "country_mean", "price_amount_usd": "", "price_amount_usd_filled": "234.1938", "fx_rate_local_per_usd": "1.0", "fx_source": "default_1usd", "information_text": "", "description_text": "", "features_text": "", "specifications_text": "", "benefits_text": "", "details_text": "", "other_sections": "", "sections": {}, "txt_path": "dataset/txt_limpios/885.txt", "html_path": "dataset/paginas_descargadas/885.html", "es_status": "EN", "category_canonical": "sin_categoria", "decision": "discard", "match_score": 0.3, "reasons": "no_category_detected;price_parse_failed"}
{"source_id": "886", "title": "Robot or human?", "description": "", "breadcrumbs": "", "price_raw": "", "currency_raw": "", "url": "", "seller": "Desconocido", "availability": "unknown", "country": "UNKNOWN", "product_name": "Robot or human?", "brand": "", "reference": "", "unit": "", "price_amount": null, "price_currency": "", "price_symbol": "", "price_text": "", "price_amount_filled": "234.19", "price_is_imputed": "True", "price_imputation_source": "country_mean", "price_amount_usd": "", "price_amount_usd_filled": "234.1938", "fx_rate_local_per_usd": "1.0", "fx_source": "default_1usd", "information_text": "", "description_text": "", "features_text": "", "specifications_text": "", "benefits_text": "", "details_text": "", "other_sections": "", "sections": {}, "txt_path": "dataset/txt_limpios/886.txt", "html_path": "dataset/paginas_descargadas/886.html", "es_status": "EN", "category_canonical": "sin_categoria", "decision": "discard", "match_score": 0.3, "reasons": "no_category_detected;price_parse_failed"}
{"source_id": "1743", "title": "Saltar al contenido principal", "description": "", "breadcrumbs": "¿Cómo quieres tus artículos?", "price_raw": "", "currency_raw": "MXN", "url": "", "seller": "Desconocido", "availability": "unknown", "country": "MX", "product_name": "Saltar al contenido principal", "brand": "¿Cómo quieres tus artículos?", "reference": "", "unit": "", "price_amount": null, "price_currency": "MXN", "price_symbol": "", "price_text": "", "price_amount_filled": "66.32", "price_is_imputed": "True", "price_imputation_source": "country_mean", "price_amount_usd": "", "price_amount_usd_filled": "3.5617", "fx_rate_local_per_usd": "18.62", "fx_source": "from_mexico_cambio_dolar", "information_text": "", "description_text": "", "features_text": "", "specifications_text": "", "benefits_text": "", "details_text": "", "other_sections": "", "sections": {}, "txt_path": "dataset/txt_limpios/1743.txt", "html_path": "dataset/paginas_descargadas/1743.html", "es_status": "EN", "category_canonical": "sin_categoria", "decision": "discard", "match_score": 0.3, "reasons": "no_category_detected;price_parse_failed"}
{"source_id": "809", "title": "Saltar menú Cenco", "description": "Ingredientes Condición alimentaria Información nutricional Receta Tipo de Producto Café Instantáneo Económico Cantidad 1 un. Formato Polvo Envase Tarro País de Origen Chile Variedad Tradición Contenido 170 g Almacenamiento Conservar en lugar fresco y seco Garantía Mínima Legal Válida hasta su fecha de caducidad Te podrían interesar Cuisine & Co Leche Cuisine & Co Entera 1 L Azúcar Cuisine & Co Blanca Granulada 1 kg Iansa Cero K Endulzante Iansa Cero K Líquido Sucralosa 250 ml 5.0 Centro de preferencia de privacidad Gestionar las preferencias de consentimiento Activas siempre Back Button Search Icon Filter Icon Clear checkbox label label Apply Cancel Consent Leg.Interest Permitir todas Rechazar todas Confirmar mis preferencias", "breadcrumbs": "Exclusivo online > 170 g", "price_raw": "2.0", "currency_raw": "", "url": "", "seller": "Desconocido", "availability": "unknown", "country": "UNKNOWN", "product_name": "Saltar menú Cenco", "brand": "Exclusivo online", "reference": "", "unit": "170 g", "price_amount": 2.0, "price_currency": "", "price_symbol": "", "price_text": "2", "price_amount_filled": "2.0", "price_is_imputed": "False", "price_imputation_source": "original", "price_amount_usd": "2.0", "price_amount_usd_filled": "2.0", "fx_rate_local_per_usd": "1.0", "fx_source": "default_1usd", "information_text": "", "description_text": "Ingredientes Condición alimentaria Información nutricional Receta Tipo de Producto Café Instantáneo Económico Cantidad 1 un. Formato Polvo Envase Tarro País de Origen Chile Variedad Tradición Contenido 170 g Almacenamiento Conservar en lugar fresco y seco Garantía Mínima Legal Válida hasta su fecha de caducidad Te podrían interesar Cuisine & Co Leche Cuisine & Co Entera 1 L Azúcar Cuisine & Co Blanca Granulada 1 kg Iansa Cero K Endulzante Iansa Cero K Líquido Sucralosa 250 ml 5.0 Centro de preferencia de privacidad Gestionar las preferencias de consentimiento Activas siempre Back Button Search Icon Filter Icon Clear checkbox label label Apply Cancel Consent Leg.Interest Permitir todas Rechazar todas Confirmar mis preferencias", "features_text": "", "specifications_text": "", "benefits_text": "", "details_text": "", "other_sections": "", "sections": {"Descripción": ["Ingredientes", "Condición alimentaria", "Información nutricional", "Receta", "Tipo de Producto", "Café Instantáneo Económico", "Cantidad", "1 un.", "Formato", "Polvo", "Envase", "Tarro", "País de origen", "Chile", "Variedad", "Tradición", "Contenido", "170 g", "Almacenamiento", "Conservar en lugar fresco y seco", "Garantía Mínima Legal", "Válida hasta su fecha de caducidad", "Te podrían interesar", "Cuisine & Co", "Leche Cuisine & Co Entera 1 L", "Azúcar Cuisine & Co Blanca Granulada 1 kg", "Iansa Cero K", "Endulzante Iansa Cero K Líquido Sucralosa 250 ml", "5.0", "Centro de preferencia de privacidad", "Gestionar las preferencias de consentimiento", "Activas siempre", "Back Button", "Search Icon", "Filter Icon", "Clear", "checkbox label", "label", "Apply", "Cancel", "Consent", "Leg.Interest", "Permitir todas", "Rechazar todas", "Confirmar mis preferencias"]}, "txt_path": "dataset/txt_limpios/809.txt", "html_path": "dataset/paginas_descargadas/809.html", "es_status": "ET", "category_canonical": "descartado", "decision": "discard", "match_score": 0.1, "reasons": "excluded_keyword"}
{"source_id": "810", "title": "Saltar menú Cenco", "description": "Ingredientes Condición alimentaria Información nutricional Tipo de Producto Café Grano Molido Envase Paquete País de Origen Chile Te podrían interesar Iansa Azúcar Blanca Iansa 1 kg Cuisine & Co Leche Cuisine & Co Entera 1 L Cruzeiro Café Liofilizado Cruzeiro 170 g Centro de preferencia de privacidad Gestionar las preferencias de consentimiento Activas siempre Back Button Search Icon Filter Icon Clear checkbox label label Apply Cancel Consent Leg.Interest Permitir todas Rechazar todas Confirmar mis preferencias", "breadcrumbs": "Monterrey > 230 g", "price_raw": "5.59", "currency_raw": "", "url": "", "seller": "Desconocido", "availability": "unknown", "country": "UNKNOWN", "product_name": "Saltar menú Cenco", "brand": "Monterrey", "reference": "", "unit": "230 g", "price_amount": 5.59, "price_currency": "", "price_symbol": "$", "price_text": "$5.59", "price_amount_filled": "5.59", "price_is_imputed": "False", "price_imputation_source": "original", "price_amount_usd": "5.59", "price_amount_usd_filled": "5.59", "fx_rate_local_per_usd": "1.0", "fx_source": "default_1usd", "information_text": "", "description_text": "Ingredientes Condición alimentaria Información nutricional Tipo de Producto Café Grano Molido Envase Paquete País de Origen Chile Te podrían interesar Iansa Azúcar Blanca Iansa 1 kg Cuisine & Co Leche Cuisine & Co Entera 1 L Cruzeiro Café Liofilizado Cruzeiro 170 g Centro de preferencia de privacidad Gestionar las preferencias de consentimiento Activas siempre Back Button Search Icon Filter Icon Clear checkbox label label Apply Cancel Consent Leg.Interest Permitir todas Rechazar todas Confirmar mis preferencias", "features_text": "", "specifications_text": "", "benefits_text": "", "details_text": "", "other_sections": "", "sections": {"Descripción": ["Ingredientes", "Condición alimentaria", "Información nutricional", "Tipo de Producto", "Café Grano Molido", "Envase", "Paquete", "País de origen", "Chile", "Te podrían interesar", "Iansa", "Azúcar Blanca Iansa 1 kg", "Cuisine & Co", "Leche Cuisine & Co Entera 1 L", "Cruzeiro", "Café Liofilizado Cruzeiro 170 g", "Centro de preferencia de privacidad", "Gestionar las preferencias de consentimiento", "Activas siempre", "Back Button", "Search Icon", "Filter Icon", "Clear", "checkbox label", "label", "Apply", "Cancel", "Consent", "Leg.Interest", "Permitir todas", "Rechazar todas", "Confirmar mis preferencias"]}, "txt_path": "dataset/txt_limpios/810.txt", "html_path": "dataset/paginas_descargadas/810.html", "es_status": "ET", "category_canonical": "cafe", "decision": "keep", "match_score": 0.6, "reasons": "heuristic_default"}
{"source_id": "811", "title": "Saltar menú Cenco", "description": "Ingredientes Condición alimentaria Información nutricional Receta Tipo de Producto Café Descafeinado Liofilizado Intensidad Media Envase Frasco País de Origen Ecuador Almacenamiento Mantener en lugar fresco y seco. Duración 24 meses Te podrían interesar Iansa Azúcar Blanca Iansa 1 kg Oferta Colun Leche Colun Entera 1 L AluSweet Endulzante Alusweet Alulosa 360 ml Centro de preferencia de privacidad Gestionar las preferencias de consentimiento Activas siempre Back Button Search Icon Filter Icon Clear checkbox label label Apply Cancel Consent Leg.Interest Permitir todas Rechazar todas Confirmar mis preferencias", "breadcrumbs": "Exclusivo online > 100 g", "price_raw": "6.89", "currency_raw": "", "url": "", "seller": "Desconocido", "availability": "unknown", "country": "UNKNOWN", "product_name": "Saltar menú Cenco", "brand": "Exclusivo online", "reference": "", "unit": "100 g", "price_amount": 6.89, "price_currency": "", "price_symbol": "$", "price_text": "$6.89", "price_amount_filled": "6.89", "price_is_imputed": "False", "price_imputation_source": "original", "price_amount_usd": "6.89", "price_amount_usd_filled": "6.89", "fx_rate_local_per_usd": "1.0", "fx_source": "default_1usd", "information_text": "", "description_text": "Ingredientes Condición alimentaria Información nutricional Receta Tipo de Producto Café Descafeinado Liofilizado Intensidad Media Envase Frasco País de Origen Ecuador Almacenamiento Mantener en lugar fresco y seco. Duración 24 meses Te podrían interesar Iansa Azúcar Blanca Iansa 1 kg Oferta Colun Leche Colun Entera 1 L AluSweet Endulzante Alusweet Alulosa 360 ml Centro de preferencia de privacidad Gestionar las preferencias de consentimiento Activas siempre Back Button Search Icon Filter Icon Clear checkbox label label Apply Cancel Consent Leg.Interest Permitir todas Rechazar todas Confirmar mis preferencias", "features_text": "", "specifications_text": "", "benefits_text": "", "details_text": "", "other_sections": "", "sections": {"Descripción": ["Ingredientes", "Condición alimentaria", "Información nutricional", "Receta", "Tipo de Producto", "Café Descafeinado Liofilizado", "Intensidad", "Media", "Envase", "Frasco", "País de origen", "Ecuador", "Almacenamiento", "Mantener en lugar fresco y seco.", "Duración", "24 meses", "Te podrían interesar", "Iansa", "Azúcar Blanca Iansa 1 kg", "Oferta", "Colun", "Leche Colun Entera 1 L", "AluSweet", "Endulzante Alusweet Alulosa 360 ml", "Centro de preferencia de privacidad", "Gestionar las preferencias de consentimiento", "Activas siempre", "Back Button", "Search Icon", "Filter Icon", "Clear", "checkbox label", "label", "Apply", "Cancel", "Consent", "Leg.Interest", "Permitir todas", "Rechazar todas", "Confirmar mis preferencias"]}, "txt_path": "dataset/txt_limpios/811.txt", "html_path": "dataset/paginas_descargadas/811.html", "es_status": "ET", "category_canonical": "cafe", "decision": "keep", "match_score": 0.6, "reasons": "heuristic_default"}
{"source_id": "812", "title": "Saltar menú Cenco", "description": "Ingredientes Condición alimentaria Tipo de Producto Café Grano Molido Cantidad 1 un. Formato Molido Envase Paquete País de Origen Colombia Sistema Cierre Al vacío Variedad Premium Aroma Suave Contenido 250 g Garantía Mínima Legal Válida hasta su fecha de caducidad Te podrían interesar Soprole Leche Soprole Sin Lactosa Descremada 1 L Iansa Azúcar Blanca Iansa 1 kg Nestlé Crema de Leche Nestlé Caja 200 ml Centro de preferencia de privacidad Gestionar las preferencias de consentimiento Activas siempre Back Button Search Icon Filter Icon Clear checkbox label label Apply Cancel Consent Leg.Interest Permitir todas Rechazar todas Confirmar mis preferencias", "breadcrumbs": "Exclusivo online > 250 g", "price_raw": "8.07", "currency_raw": "", "url": "", "seller": "Desconocido", "availability": "unknown", "country": "UNKNOWN", "product_name": "Saltar menú Cenco", "brand": "Exclusivo online", "reference": "", "unit": "250 g", "price_amount": 8.07, "price_currency": "", "price_symbol": "$", "price_text": "$8.07", "price_amount_filled": "8.07", "price_is_imputed": "False", "price_imputation_source": "original", "price_amount_usd": "8.07", "price_amount_usd_filled": "8.07", "fx_rate_local_per_usd": "1.0", "fx_source": "default_1usd", "information_text": "", "description_text": "Ingredientes Condición alimentaria Tipo de Producto Café Grano Molido Cantidad 1 un. Formato Molido Envase Paquete País de Origen Colombia Sistema Cierre Al vacío Variedad Premium Aroma Suave Contenido 250 g Garantía Mínima Legal Válida hasta su fecha de caducidad Te podrían interesar Soprole Leche Soprole Sin Lactosa Descremada 1 L Iansa Azúcar Blanca Iansa 1 kg Nestlé Crema de Leche Nestlé Caja 200 ml Centro de preferencia de privacidad Gestionar las preferencias de consentimiento Activas siempre Back Button Search Icon Filter Icon Clear checkbox label label Apply Cancel Consent Leg.Interest Permitir todas Rechazar todas Confirmar mis preferencias", "features_text": "", "specifications_text": "", "benefits_text": "", "details_text": "", "other_sections": "", "sections": {"Descripción": ["Ingredientes", "Condición alimentaria", "Tipo de Producto", "Café Grano Molido", "Cantidad", "1 un.", "Formato", "Molido", "Envase", "Paquete", "País de origen", "Colombia", "Sistema Cierre", "Al vacío", "Variedad", "Premium", "Aroma", "Suave", "Contenido", "250 g", "Garantía Mínima Legal", "Válida hasta su fecha de caducidad", "Te podrían interesar", "Soprole", "Leche Soprole Sin Lactosa Descremada 1 L", "Iansa", "Azúcar Blanca Iansa 1 kg", "Nestlé", "Crema de Leche Nestlé Caja 200 ml", "Centro de preferencia de privacidad", "Gestionar las preferencias de consentimiento", "Activas siempre", "Back Button", "Search Icon", "Filter Icon", "Clear", "checkbox label", "label", "Apply", "Cancel", "Consent", "Leg.Interest", "Permitir todas", "Rechazar todas", "Confirmar mis preferencias"]}, "txt_path": "dataset/txt_limpios/812.txt", "html_path": "dataset/paginas_descargadas/812.html", "es_status": "ET", "category_canonical": "descartado", "decision": "discard", "match_score": 0.1, "reasons": "excluded_keyword"}
{"source_id": "813", "title": "Saltar menú Cenco", "description": "Ingredientes Condición alimentaria Información nutricional Tipo de Producto Café Grano Molido Intensidad Media Formato Grano Envase Paquete País de Origen Brasil Tostado Alto Almacenamiento Mantener en lugar fresco y seco Te podrían interesar Iansa Azúcar Blanca Iansa 1 kg Exclusivo online Soprole Leche Soprole Sin Lactosa Descremada 1 L Nestlé Crema de Leche Nestlé Tarro 157 g Centro de preferencia de privacidad Gestionar las preferencias de consentimiento Activas siempre Back Button Search Icon Filter Icon Clear checkbox label label Apply Cancel Consent Leg.Interest Permitir todas Rechazar todas Confirmar mis preferencias", "breadcrumbs": "Cruzeiro > 250 g", "price_raw": "5.95", "currency_raw": "", "url": "", "seller": "Desconocido", "availability": "unknown", "country": "UNKNOWN", "product_name": "Saltar menú Cenco", "brand": "Cruzeiro", "reference": "", "unit": "250 g", "price_amount": 5.95, "price_currency": "", "price_symbol": "$", "price_text": "$5.95", "price_amount_filled": "5.95", "price_is_imputed": "False", "price_imputation_source": "original", "price_amount_usd": "5.95", "price_amount_usd_filled": "5.95", "fx_rate_local_per_usd": "1.0", "fx_source": "default_1usd", "information_text": "", "description_text": "Ingredientes Condición alimentaria Información nutricional Tipo de Producto Café Grano Molido Intensidad Media Formato Grano Envase Paquete País de Origen Brasil Tostado Alto Almacenamiento Mantener en lugar fresco y seco Te podrían interesar Iansa Azúcar Blanca Iansa 1 kg Exclusivo online Soprole Leche Soprole Sin Lactosa Descremada 1 L Nestlé Crema de Leche Nestlé Tarro 157 g Centro de preferencia de privacidad Gestionar las preferencias de consentimiento Activas siempre Back Button Search Icon Filter Icon Clear checkbox label label Apply Cancel Consent Leg.Interest Permitir todas Rechazar todas Confirmar mis preferencias", "features_text": "", "specifications_text": "", "benefits_text": "", "details_text": "", "other_sections": "", "sections": {"Descripción": ["Ingredientes", "Condición alimentaria", "Información nutricional", "Tipo de Producto", "Café Grano Molido", "Intensidad", "Media", "Formato", "Grano", "Envase", "Paquete", "País de origen", "Brasil", "Tostado", "Alto", "Almacenamiento", "Mantener en lugar fresco y seco", "Te podrían interesar", "Iansa", "Azúcar Blanca Iansa 1 kg", "Exclusivo online", "Soprole", "Leche Soprole Sin Lactosa Descremada 1 L", "Nestlé", "Crema de Leche Nestlé Tarro 157 g", "Centro de preferencia de privacidad", "Gestionar las preferencias de consentimiento", "Activas siempre", "Back Button", "Search Icon", "Filter Icon", "Clear", "checkbox label", "label", "Apply", "Cancel", "Consent", "Leg.Interest", "Permitir todas", "Rechazar todas", "Confirmar mis preferencias"]}, "txt_path": "dataset/txt_limpios/813.txt", "html_path": "dataset/paginas_descargadas/813.html", "es_status": "ET", "category_canonical": "cafe", "decision": "keep", "match_score": 0.6, "reasons": "heuristic_default"}
{"source_id": "814", "title": "Saltar menú Cenco", "description": "Tipo de Producto Papas Grupo Papas y Zapallos Envase Granel Variedad Verdura Contenido A granel Te podrían interesar Cebolla Malla 3 un. 4.3 Plátano Extra Granel (1 A 2 un. Aprox) 3.6 Jumbo Artesanal Jamón Pierna Acaramelado Granel 100 g 4.7 Centro de preferencia de privacidad Gestionar las preferencias de consentimiento Activas siempre Back Button Search Icon Filter Icon Clear checkbox label label Apply Cancel Consent Leg.Interest Permitir todas Rechazar todas Confirmar mis preferencias", "breadcrumbs": "Frutas y Verduras Propias > 2 kg", "price_raw": "495.0", "currency_raw": "", "url": "", "seller": "Desconocido", "availability": "unknown", "country": "UNKNOWN", "product_name": "Saltar menú Cenco", "brand": "Frutas y Verduras Propias", "reference": "", "unit": "2 kg", "price_amount": 495.0, "price_currency": "", "price_symbol": "$", "price_text": "$495", "price_amount_filled": "495.0", "price_is_imputed": "False", "price_imputation_source": "original", "price_amount_usd": "495.0", "price_amount_usd_filled": "495.0", "fx_rate_local_per_usd": "1.0", "fx_source": "default_1usd", "information_text": "", "description_text": "Tipo de Producto Papas Grupo Papas y Zapallos Envase Granel Variedad Verdura Contenido A granel Te podrían interesar Cebolla Malla 3 un. 4.3 Plátano Extra Granel (1 A 2 un. Aprox) 3.6 Jumbo Artesanal Jamón Pierna Acaramelado Granel 100 g 4.7 Centro de preferencia de privacidad Gestionar las preferencias de consentimiento Activas siempre Back Button Search Icon Filter Icon Clear checkbox label label Apply Cancel Consent Leg.Interest Permitir todas Rechazar todas Confirmar mis preferencias", "features_text": "", "specifications_text": "", "benefits_text": "", "details_text": "", "other_sections": "", "sections": {"Descripción": ["Tipo de Producto", "Papas", "Grupo", "Papas y Zapallos", "Envase", "Granel", "Variedad", "Verdura", "Contenido", "A granel", "Te podrían interesar", "Cebolla Malla 3 un.", "4.3", "Plátano Extra Granel (1 A 2 un. Aprox)", "3.6", "Jumbo Artesanal", "Jamón Pierna Acaramelado Granel 100 g", "4.7", "Centro de preferencia de privacidad", "Gestionar las preferencias de consentimiento", "Activas siempre", "Back Button", "Search Icon", "Filter Icon", "Clear", "checkbox label", "label", "Apply", "Cancel", "Consent", "Leg.Interest", "Permitir todas", "Rechazar todas", "Confirmar mis preferencias"]}, "txt_path": "dataset/txt_limpios/814.txt", "html_path": "dataset/paginas_descargadas/814.html", "es_status": "EN", "category_canonical": "papa", "decision": "keep", "match_score": 0.6, "reasons": "heuristic_default"}
