source_id,title,description,breadcrumbs,price_raw,currency_raw,url,seller,availability,country,product_name,brand,reference,unit,price_amount,price_currency,price_symbol,price_text,price_amount_filled,price_is_imputed,price_imputation_source,price_amount_usd,price_amount_usd_filled,fx_rate_local_per_usd,fx_source,information_text,description_text,features_text,specifications_text,benefits_text,details_text,other_sections,sections,txt_path,html_path,es_status,category_canonical,decision,match_score,reasons
560,Elegí tu envío,,"Hola, Limpía tú cache > 500 Gr > 7790070336309",1.75,ARS,,Desconocido,unknown,AR,Elegí tu envío,"Hola, Limpía tú cache",7790070336309.0,500 Gr,1.75,ARS,$,$1.75,1.75,False,original,0.0014,0.0014,1255.0,from_argentina_cambio_dolar,,,,,,,,{},dataset/txt_limpios/560.txt,dataset/paginas_descargadas/560.html,EN,sin_categoria,discard,0.30,no_category_detected
561,Elegí tu envío,,"Hola, Limpía tú cache > 500 Gr > 8480017268693",1.18,ARS,,Desconocido,unknown,AR,Elegí tu envío,"Hola, Limpía tú cache",8480017268693.0,500 Gr,1.18,ARS,$,$1.18,1.18,False,original,0.0009,0.0009,1255.0,from_argentina_cambio_dolar,,,,,,,,{},dataset/txt_limpios/561.txt,dataset/paginas_descargadas/561.html,EN,sin_categoria,discard,0.30,no_category_detected
562,Elegí tu envío,,"Hola, Limpía tú cache > 500 Gr > 7790070336576",3.19,ARS,,Desconocido,unknown,AR,Elegí tu envío,"Hola, Limpía tú cache",7790070336576.0,500 Gr,3.19,ARS,$,$3.19,3.19,False,original,0.0025,0.0025,1255.0,from_argentina_cambio_dolar,,,,,,,,{},dataset/txt_limpios/562.txt,dataset/paginas_descargadas/562.html,EN,sin_categoria,discard,0.30,no_category_detected
564,Elegí tu envío,,"Hola, Limpía tú cache > 800 Gr > 7798016102216",3.0,ARS,,Desconocido,unknown,AR,Elegí tu envío,"Hola, Limpía tú cache",7798016102216.0,800 Gr,3.00,ARS,,3,3.0,False,original,0.0024,0.0024,1255.0,from_argentina_cambio_dolar,,,,,,,,{},dataset/txt_limpios/564.txt,dataset/paginas_descargadas/564.html,EN,sin_categoria,discard,0.30,no_category_detected
565,Elegí tu envío,,"Hola, Limpía tú cache > 1 Kg > 2490150000000",2.79,ARS,,Desconocido,unknown,AR,Elegí tu envío,"Hola, Limpía tú cache",2490150000000.0,1 Kg,2.79,ARS,$,$2.79,2.79,False,original,0.0022,0.0022,1255.0,from_argentina_cambio_dolar,,,,,,,,{},dataset/txt_limpios/565.txt,dataset/paginas_descargadas/565.html,EN,sin_categoria,discard,0.30,no_category_detected
566,Elegí tu envío,,"Hola, Limpía tú cache > 7798064180143",4.19,ARS,,Desconocido,unknown,AR,Elegí tu envío,"Hola, Limpía tú cache",7798064180143.0,,4.19,ARS,$,$4.19,4.19,False,original,0.0033,0.0033,1255.0,from_argentina_cambio_dolar,,,,,,,,{},dataset/txt_limpios/566.txt,dataset/paginas_descargadas/566.html,EN,sin_categoria,discard,0.30,no_category_detected
568,Elegí tu envío,,"Hola, Limpía tú cache > 1 Kg > 2406887000009",11.9,ARS,,Desconocido,unknown,AR,Elegí tu envío,"Hola, Limpía tú cache",2406887000009.0,1 Kg,11.90,ARS,$,$11.90,11.9,False,original,0.0095,0.0095,1255.0,from_argentina_cambio_dolar,,,,,,,,{},dataset/txt_limpios/568.txt,dataset/paginas_descargadas/568.html,EN,sin_categoria,discard,0.30,no_category_detected
569,Elegí tu envío,,"Hola, Limpía tú cache > 400 Gr > 7790616000442",400.0,ARS,,Desconocido,unknown,AR,Elegí tu envío,"Hola, Limpía tú cache",7790616000442.0,400 Gr,400.00,ARS,,400,400.0,False,original,0.3187,0.3187,1255.0,from_argentina_cambio_dolar,,,,,,,,{},dataset/txt_limpios/569.txt,dataset/paginas_descargadas/569.html,EN,sin_categoria,discard,0.30,no_category_detected
571,Elegí tu envío,"El queso muzarella DIA de 250 gr es un producto de alta calidad que se destaca por su sabor suave y cremoso. Este queso es muy fácil de cortar y derretir, por lo que es una excelente opción para aquellos que buscan una opción práctica y deliciosa. Además, está elaborado con ingredientes naturales y frescos, por lo que es una alternativa saludable para toda la familia. Ver más Términos más buscados 1. leche 2. cerveza 3. flamin 4. galletitas 5. café","Hola, Limpía tú cache > 250 Gr > 8480017240941",250.0,ARS,,Desconocido,unknown,AR,Elegí tu envío,"Hola, Limpía tú cache",8480017240941.0,250 Gr,250.00,ARS,,250,250.0,False,original,0.1992,0.1992,1255.0,from_argentina_cambio_dolar,,"El queso muzarella DIA de 250 gr es un producto de alta calidad que se destaca por su sabor suave y cremoso. Este queso es muy fácil de cortar y derretir, por lo que es una excelente opción para aquellos que buscan una opción práctica y deliciosa. Además, está elaborado con ingredientes naturales y frescos, por lo que es una alternativa saludable para toda la familia. Ver más Términos más buscados 1. leche 2. cerveza 3. flamin 4. galletitas 5. café",,,,,,"{""Descripción"": [""El queso muzarella DIA de 250 gr es un producto de alta calidad que se destaca por su sabor suave y cremoso. Este queso es muy fácil de cortar y derretir, por lo que es una excelente opción para aquellos que buscan una opción práctica y deliciosa. Además, está elaborado con ingredientes naturales y frescos, por lo que es una alternativa saludable para toda la familia."", ""Ver más"", ""Términos más buscados"", ""1."", ""leche"", ""2."", ""cerveza"", ""3."", ""flamin"", ""4."", ""galletitas"", ""5."", ""cafe""]}",dataset/txt_limpios/571.txt,dataset/paginas_descargadas/571.html,ET,cafe,keep,0.60,heuristic_default
572,Elegí tu envío,,"Hola, Limpía tú cache > 2.25 Lt > 7790895000997",4.6,ARS,,Desconocido,unknown,AR,Elegí tu envío,"Hola, Limpía tú cache",7790895000997.0,2.25 Lt,4.60,ARS,$,$4.60,4.6,False,original,0.0037,0.0037,1255.0,from_argentina_cambio_dolar,,,,,,,,{},dataset/txt_limpios/572.txt,dataset/paginas_descargadas/572.html,EN,sin_categoria,discard,0.30,no_category_detected
573,Elegí tu envío,,"Hola, Limpía tú cache > 2 Lt > 7791813888468",4.3,ARS,,Desconocido,unknown,AR,Elegí tu envío,"Hola, Limpía tú cache",7791813888468.0,2 Lt,4.30,ARS,$,$4.30,4.3,False,original,0.0034,0.0034,1255.0,from_argentina_cambio_dolar,,,,,,,,{},dataset/txt_limpios/573.txt,dataset/paginas_descargadas/573.html,EN,sin_categoria,discard,0.30,no_category_detected
575,Elegí tu envío,,"Hola, Limpía tú cache > 2,25 Lt > 7790639003437",1.5,ARS,,Desconocido,unknown,AR,Elegí tu envío,"Hola, Limpía tú cache",7790639003437.0,"2,25 Lt",1.50,ARS,$,$1.50,1.5,False,original,0.0012,0.0012,1255.0,from_argentina_cambio_dolar,,,,,,,,{},dataset/txt_limpios/575.txt,dataset/paginas_descargadas/575.html,EN,sin_categoria,discard,0.30,no_category_detected
576,Elegí tu envío,,"Hola, Limpía tú cache",,ARS,,Desconocido,unknown,AR,Elegí tu envío,"Hola, Limpía tú cache",,,,ARS,,,1663.58,True,country_mean,,1.3256,1255.0,from_argentina_cambio_dolar,,,,,,,,{},dataset/txt_limpios/576.txt,dataset/paginas_descargadas/576.html,EN,sin_categoria,discard,0.30,no_category_detected;price_parse_failed
577,Elegí tu envío,,"Hola, Limpía tú cache > 1 Kg > 2490094000000",890.0,ARS,,Desconocido,unknown,AR,Elegí tu envío,"Hola, Limpía tú cache",2490094000000.0,1 Kg,890.00,ARS,$,$890,890.0,False,original,0.7092,0.7092,1255.0,from_argentina_cambio_dolar,,,,,,,,{},dataset/txt_limpios/577.txt,dataset/paginas_descargadas/577.html,EN,sin_categoria,discard,0.30,no_category_detected
578,Elegí tu envío,,"Hola, Limpía tú cache > 1 Kg > 2490127000000",4.69,ARS,,Desconocido,unknown,AR,Elegí tu envío,"Hola, Limpía tú cache",2490127000000.0,1 Kg,4.69,ARS,$,$4.69,4.69,False,original,0.0037,0.0037,1255.0,from_argentina_cambio_dolar,,,,,,,,{},dataset/txt_limpios/578.txt,dataset/paginas_descargadas/578.html,EN,sin_categoria,discard,0.30,no_category_detected
1666,Elige un método de entrega,"Café Nescafé Tradición el café de todos los días, en una cómoda presentación para llevar contigo a todas partes. Formato 170 g. Loading...",Unimarc > 170 g,6.2,,,Desconocido,unknown,UNKNOWN,Elige un método de entrega,Unimarc,,170 g,6.20,,$,$6.20,6.2,False,original,6.2,6.2,1.0,default_1usd,,"Café Nescafé Tradición el café de todos los días, en una cómoda presentación para llevar contigo a todas partes. Formato 170 g. Loading...",,,,,,"{""Descripción"": [""Café Nescafé Tradición el café de todos los días, en una cómoda presentación para llevar contigo a todas partes. Formato 170 g."", ""Loading...""]}",dataset/txt_limpios/1666.txt,dataset/paginas_descargadas/1666.html,EN,cafe,keep,0.60,heuristic_default
1668,Elige un método de entrega,Café Waitrose italiano molida. Características: Café grano y molido - Waitrose - Envase doy pack - Formato familiar - Contenido 227 g. Loading...,Unimarc > 227 g,7.35,,,Desconocido,unknown,UNKNOWN,Elige un método de entrega,Unimarc,,227 g,7.35,,$,$7.35,7.35,False,original,7.35,7.35,1.0,default_1usd,,Café Waitrose italiano molida. Características: Café grano y molido - Waitrose - Envase doy pack - Formato familiar - Contenido 227 g. Loading...,,,,,,"{""Descripción"": [""Café Waitrose italiano molida. Características: Café grano y molido - Waitrose - Envase doy pack - Formato familiar - Contenido 227 g."", ""Loading...""]}",dataset/txt_limpios/1668.txt,dataset/paginas_descargadas/1668.html,EN,cafe,keep,0.60,heuristic_default
1670,Elige un método de entrega,"Café de gusto suave y fuertemente aromático producto de una mezcla de cafés provenientes de Colombia, Brasil, Perú y Ecuador. Este café molido ha sido sometido a un proceso de tostado lo que permite obtener un café uniforme y agradable. Características: Café grano y molido - Haití - Envase doy pack - Formato familiar - Contenido 250 g. Loading...",Unimarc > 250 g,5.29,,,Desconocido,unknown,UNKNOWN,Elige un método de entrega,Unimarc,,250 g,5.29,,$,$5.29,5.29,False,original,5.29,5.29,1.0,default_1usd,,"Café de gusto suave y fuertemente aromático producto de una mezcla de cafés provenientes de Colombia, Brasil, Perú y Ecuador. Este café molido ha sido sometido a un proceso de tostado lo que permite obtener un café uniforme y agradable. Características: Café grano y molido - Haití - Envase doy pack - Formato familiar - Contenido 250 g. Loading...",,,,,,"{""Descripción"": [""Café de gusto suave y fuertemente aromático producto de una mezcla de cafés provenientes de Colombia, Brasil, Perú y Ecuador. Este café molido ha sido sometido a un proceso de tostado lo que permite obtener un café uniforme y agradable. Características: Café grano y molido - Haití - Envase doy pack - Formato familiar - Contenido 250 g."", ""Loading...""]}",dataset/txt_limpios/1670.txt,dataset/paginas_descargadas/1670.html,EN,cafe,keep,0.60,heuristic_default
1671,Elige un método de entrega,"Las papas tienen grandes propiedades curativas, en la medicina china tradicional, utilizan las papas como un alimento con gran poder curativo. Entre sus principales propiedades se encuentran: Protege de enfermedades relacionadas con el páncreas,Trata la debilidad, fatiga y falta de energía,Da energía al cuerpo,Calma el estómago,Lubrica los intestinos,Promueve los movimientos intestinales. Loading...",Unimarc > 2 Kg,2.39,,,Desconocido,unknown,UNKNOWN,Elige un método de entrega,Unimarc,,2 Kg,2.39,,$,$2.39,2.39,False,original,2.39,2.39,1.0,default_1usd,,"Las papas tienen grandes propiedades curativas, en la medicina china tradicional, utilizan las papas como un alimento con gran poder curativo. Entre sus principales propiedades se encuentran: Protege de enfermedades relacionadas con el páncreas,Trata la debilidad, fatiga y falta de energía,Da energía al cuerpo,Calma el estómago,Lubrica los intestinos,Promueve los movimientos intestinales. Loading...",,,,,,"{""Descripción"": [""Las papas tienen grandes propiedades curativas, en la medicina china tradicional, utilizan las papas como un alimento con gran poder curativo. Entre sus principales propiedades se encuentran: Protege de enfermedades relacionadas con el páncreas,Trata la debilidad, fatiga y falta de energía,Da energía al cuerpo,Calma el estómago,Lubrica los intestinos,Promueve los movimientos intestinales."", ""Loading...""]}",dataset/txt_limpios/1671.txt,dataset/paginas_descargadas/1671.html,ET,papa,keep,0.60,heuristic_default
1673,Elige un método de entrega,"Una mezcla nacida de la naturaleza, que ofrece un aroma y sabor intensos para disfrutar en cualquier momento. Tiene un matiz ahumado y chocolateado. Este es el sabor perfecto para aquellos que buscan un café tostado que les energice durante el día, acompañado de su música favorita. Este envase contiene 227 gramos de café molido. Loading...",Unimarc > 227 g,14.19,,,Desconocido,unknown,UNKNOWN,Elige un método de entrega,Unimarc,,227 g,14.19,,$,$14.19,14.19,False,original,14.19,14.19,1.0,default_1usd,,"Una mezcla nacida de la naturaleza, que ofrece un aroma y sabor intensos para disfrutar en cualquier momento. Tiene un matiz ahumado y chocolateado. Este es el sabor perfecto para aquellos que buscan un café tostado que les energice durante el día, acompañado de su música favorita. Este envase contiene 227 gramos de café molido. Loading...",,,,,,"{""Descripción"": [""Una mezcla nacida de la naturaleza, que ofrece un aroma y sabor intensos para disfrutar en cualquier momento. Tiene un matiz ahumado y chocolateado. Este es el sabor perfecto para aquellos que buscan un café tostado que les energice durante el día, acompañado de su música favorita. Este envase contiene 227 gramos de café molido."", ""Loading...""]}",dataset/txt_limpios/1673.txt,dataset/paginas_descargadas/1673.html,EN,cafe,keep,0.60,heuristic_default
1677,Elige un método de entrega,"Papas Huertos del Ranco, malla 1.3 Kg Loading...",Unimarc > 1.3 Kg,1.79,,,Desconocido,unknown,UNKNOWN,Elige un método de entrega,Unimarc,,1.3 Kg,1.79,,$,$1.79,1.79,False,original,1.79,1.79,1.0,default_1usd,,"Papas Huertos del Ranco, malla 1.3 Kg Loading...",,,,,,"{""Descripción"": [""Papas Huertos del Ranco, malla 1.3 Kg"", ""Loading...""]}",dataset/txt_limpios/1677.txt,dataset/paginas_descargadas/1677.html,EN,papa,keep,0.60,heuristic_default
1678,Elige un método de entrega,"Elaborada con la selección y mezcla (blending) de granos de café de variedad arábica, proveniente de distintas haciendas caficultoras de Brasil y Colombia para luego ser tostado en chile por nuestro sistema de tueste al aire el que retiene todo el aroma del café.100% arábica. Mezcla de variedades arábicas. Cultivado en Brasil y Colombia. Tostado y mezclado en chile. Características: Café grano y molido - Excels - Envase doy pack - Formato familiar - Contenido 250 g. Loading...",Unimarc > 250 g,5.49,,,Desconocido,unknown,UNKNOWN,Elige un método de entrega,Unimarc,,250 g,5.49,,$,$5.49,5.49,False,original,5.49,5.49,1.0,default_1usd,,"Elaborada con la selección y mezcla (blending) de granos de café de variedad arábica, proveniente de distintas haciendas caficultoras de Brasil y Colombia para luego ser tostado en chile por nuestro sistema de tueste al aire el que retiene todo el aroma del café.100% arábica. Mezcla de variedades arábicas. Cultivado en Brasil y Colombia. Tostado y mezclado en chile. Características: Café grano y molido - Excels - Envase doy pack - Formato familiar - Contenido 250 g. Loading...",,,,,,"{""Descripción"": [""Elaborada con la selección y mezcla (blending) de granos de café de variedad arábica, proveniente de distintas haciendas caficultoras de Brasil y Colombia para luego ser tostado en chile por nuestro sistema de tueste al aire el que retiene todo el aroma del café.100% arábica. Mezcla de variedades arábicas. Cultivado en Brasil y Colombia. Tostado y mezclado en chile. Características: Café grano y molido - Excels - Envase doy pack - Formato familiar - Contenido 250 g."", ""Loading...""]}",dataset/txt_limpios/1678.txt,dataset/paginas_descargadas/1678.html,ET,cafe,keep,0.60,heuristic_default
1682,Elige un método de entrega,"Papas, granel 500 g Loading...",Unimarc > 500 g,695.0,,,Desconocido,unknown,UNKNOWN,Elige un método de entrega,Unimarc,,500 g,695.00,,$,$695,695.0,False,original,695.0,695.0,1.0,default_1usd,,"Papas, granel 500 g Loading...",,,,,,"{""Descripción"": [""Papas, granel 500 g"", ""Loading...""]}",dataset/txt_limpios/1682.txt,dataset/paginas_descargadas/1682.html,EN,papa,keep,0.60,heuristic_default
1685,Elige un método de entrega,"Pan De Molde Blanco Grande, Con Un 30 % Más De Rebanadas. Producto certificado Kosher. Características: Pan molde y pita - Ideal - Sin sellos - Envase bolsa - Formato familiar - Contenido 752 g. Loading...",Unimarc > 750 g,2.95,,,Desconocido,unknown,UNKNOWN,Elige un método de entrega,Unimarc,,750 g,2.95,,$,$2.95,2.95,False,original,2.95,2.95,1.0,default_1usd,,"Pan De Molde Blanco Grande, Con Un 30 % Más De Rebanadas. Producto certificado Kosher. Características: Pan molde y pita - Ideal - Sin sellos - Envase bolsa - Formato familiar - Contenido 752 g. Loading...",,,,,,"{""Descripción"": [""Pan De Molde Blanco Grande, Con Un 30 % Más De Rebanadas. Producto certificado Kosher. Características: Pan molde y pita - Ideal - Sin sellos - Envase bolsa - Formato familiar - Contenido 752 g."", ""Loading...""]}",dataset/txt_limpios/1685.txt,dataset/paginas_descargadas/1685.html,ET,pan,keep,0.60,heuristic_default
1686,Elige un método de entrega,"Pan fibra familiar, pan blanco con salvado. Loading...",Unimarc > 750 g,2.75,,,Desconocido,unknown,UNKNOWN,Elige un método de entrega,Unimarc,,750 g,2.75,,$,$2.75,2.75,False,original,2.75,2.75,1.0,default_1usd,,"Pan fibra familiar, pan blanco con salvado. Loading...",,,,,,"{""Descripción"": [""Pan fibra familiar, pan blanco con salvado."", ""Loading...""]}",dataset/txt_limpios/1686.txt,dataset/paginas_descargadas/1686.html,EN,pan,keep,0.60,heuristic_default
1688,Elige un método de entrega,"Coca-Cola, chispeante y refrescante, es una bebida magnífica para mantener la energía y combatir el calor. El refresco de cola, es un gran complemento para cualquier ocasión tanto si estás trabajando en un picnic.",Unimarc > 1.5 L,1.99,,,Desconocido,unknown,UNKNOWN,Elige un método de entrega,Unimarc,,1.5 L,1.99,,$,$1.99,1.99,False,original,1.99,1.99,1.0,default_1usd,,"Coca-Cola, chispeante y refrescante, es una bebida magnífica para mantener la energía y combatir el calor. El refresco de cola, es un gran complemento para cualquier ocasión tanto si estás trabajando en un picnic.",Bebidas regulares - Coca Cola - Alto en azúcares - Envase botella - Formato familiar - Contenido 1.5 L. | Loading...,,,,,"{""Descripción"": [""Coca-Cola, chispeante y refrescante, es una bebida magnífica para mantener la energía y combatir el calor. El refresco de cola, es un gran complemento para cualquier ocasión tanto si estás trabajando en un picnic.""], ""Características"": [""Bebidas regulares - Coca Cola - Alto en azúcares - Envase botella - Formato familiar - Contenido 1.5 L."", ""Loading...""]}",dataset/txt_limpios/1688.txt,dataset/paginas_descargadas/1688.html,ET,refresco de cola,keep,0.60,heuristic_default
1690,Elige un método de entrega,"Si quieres disfrutar de una bebida que te refresque y a la vez te quite la sed, tienes que elegir Canada Dry Ginger ale.",Unimarc > 1.5 L,2.0,,,Desconocido,unknown,UNKNOWN,Elige un método de entrega,Unimarc,,1.5 L,2.00,,,2,2.0,False,original,2.0,2.0,1.0,default_1usd,,"Si quieres disfrutar de una bebida que te refresque y a la vez te quite la sed, tienes que elegir Canada Dry Ginger ale.",Bebidas regulares - Canda Dry - Alto en azúcares - Envase botella - Formato familiar - Contenido 1.5 L. | Loading...,,,,,"{""Descripción"": [""Si quieres disfrutar de una bebida que te refresque y a la vez te quite la sed, tienes que elegir Canada Dry Ginger ale.""], ""Características"": [""Bebidas regulares - Canda Dry - Alto en azúcares - Envase botella - Formato familiar - Contenido 1.5 L."", ""Loading...""]}",dataset/txt_limpios/1690.txt,dataset/paginas_descargadas/1690.html,EN,sin_categoria,discard,0.30,no_category_detected
1693,Elige un método de entrega,Pan de molde Amada Masa blanco XL 750 g Loading...,Unimarc > 750 g,2.51,,,Desconocido,unknown,UNKNOWN,Elige un método de entrega,Unimarc,,750 g,2.51,,$,$2.51,2.51,False,original,2.51,2.51,1.0,default_1usd,,Pan de molde Amada Masa blanco XL 750 g Loading...,,,,,,"{""Descripción"": [""Pan de molde Amada Masa blanco XL 750 g"", ""Loading...""]}",dataset/txt_limpios/1693.txt,dataset/paginas_descargadas/1693.html,EN,pan,keep,0.60,heuristic_default
1694,Elige un método de entrega,Loading...,Unimarc > 650 g,2.53,,,Desconocido,unknown,UNKNOWN,Elige un método de entrega,Unimarc,,650 g,2.53,,$,$2.53,2.53,False,original,2.53,2.53,1.0,default_1usd,,Loading...,,,,,,"{""Descripción"": [""Loading...""]}",dataset/txt_limpios/1694.txt,dataset/paginas_descargadas/1694.html,EN,sin_categoria,discard,0.30,no_category_detected
1695,Elige un método de entrega,Bebidas gaseosas de fantasía azucarada. Contiene cafeína.,Unimarc > 1.5 L,2.0,,,Desconocido,unknown,UNKNOWN,Elige un método de entrega,Unimarc,,1.5 L,2.00,,,2,2.0,False,original,2.0,2.0,1.0,default_1usd,,Bebidas gaseosas de fantasía azucarada. Contiene cafeína.,Bebidas regulares - Pepsi - Alto en azúcares - Envase botella - Formato familiar - Contenido 1.5 L. | Loading...,,,,,"{""Descripción"": [""Bebidas gaseosas de fantasía azucarada. Contiene cafeína.""], ""Características"": [""Bebidas regulares - Pepsi - Alto en azúcares - Envase botella - Formato familiar - Contenido 1.5 L."", ""Loading...""]}",dataset/txt_limpios/1695.txt,dataset/paginas_descargadas/1695.html,ET,sin_categoria,discard,0.30,no_category_detected
1696,Elige un método de entrega,Bebidas gaseosas de fantasía sabor piña.,Unimarc > 1.5 L,2.0,,,Desconocido,unknown,UNKNOWN,Elige un método de entrega,Unimarc,,1.5 L,2.00,,,2,2.0,False,original,2.0,2.0,1.0,default_1usd,,Bebidas gaseosas de fantasía sabor piña.,Bebidas regulares - Kem piña - Alto en azúcares - Envase botella - Formato familiar - Contenido 1.5 L. | Loading...,,,,,"{""Descripción"": [""Bebidas gaseosas de fantasía sabor piña.""], ""Características"": [""Bebidas regulares - Kem piña - Alto en azúcares - Envase botella - Formato familiar - Contenido 1.5 L."", ""Loading...""]}",dataset/txt_limpios/1696.txt,dataset/paginas_descargadas/1696.html,ET,sin_categoria,discard,0.30,no_category_detected
