{"source_id": "1750", "title": "Lácteos y Quesos", "description": "Leche Natural Entera Tottus 1lt | Actualizado al: 20-02-2025 Ingredientes: Leche natural entera, Leche (lactosa), Leche (caseína). Alérgenos: Leche (lactosa), Leche (caseína). Certificados: Vegetariano Libre de Soya Libre de Huevo Libre de Peces Libre de Mariscos Libre de Maní Libre de Frutas Secos Libre de Nueces Libre de Sulfitos Libre de Trigo Porción: 1 Taza (200ml) Porciones por envase: 5 100ml 1 Porción Energía (kCal) 59 118 Proteínas (g) 3.1 6.2 Grasas Totales Grasas saturadas (g) 1.8 3.6 Grasas (g) 0.8 1.6 Grasas poliinsaturadas (g) 0.20.4 Grasas trans (g) 0.1 Colesterol (mg) 9.4 18.8 Hhidratos de carbono disponibles 4.9 9.8 Azúcares totales (g) 4.7 Sodio 42 84 Importante: La información del empaque y/o contenido del producto final puede diferir respecto a lo que mostramos en nuestro sitio web, tanto a nivel de ingredientes, trazas, información nutricional, sellos, modo de uso y/o modo de conservación. Usted debe basarse únicamente en la información que se muestra en nuestro sitio web y siempre debe leer las etiquetas, advertencias y instrucciones antes de usar el consumo de un producto. Información obtenida de LECHE TOTTUS ENTERA 1LT Productos similares Leche Descremada Natural Ver producto Leche Semidescremada Natural Leche Semi Descremada Tottus 1 Lt Leche Descremada Tottus 1 Lt Leche Enteral Natural Leche Entera Natural Surlat 1 L -15% Leche Entera Natural Cremosa ¡Juntos son mejores! Azúcar -11% Arroz Precio Uno G2 Grano Largo Fino 1 Kg Aceite Vegetal Precio Un 900 ml Harina Con Polvo Azúcar Blanca Granulada Tottus 860 g Harina sin polvos de Hornear SPAGHETTI 5 TOTTUS 400 GR Arroz Tottus G2 Grano Largo Fino 1 Kg ESPIRALES TOTTUS 400 G Aceite Vegetal Tottus 900 ml Carpeta Caracol Tottus 400 g ESPIRALES TOTTUS 400 GR TALLARIN 87 TOTTUS 400 GR Azúcar Blanca Granulada Tottus 1 Kg Harina de Trigo con Polvo de Hornear Tottus 1 Kg TALLARIN TOTTUS 400 G CORBATAS TOTTUS 400 GR Aceite Vegetal Harina de Trigo sin polvo de Hornear Tottus 1 Kg", "breadcrumbs": "Leches > 1 LT", "price_raw": "1.05", "currency_raw": "", "url": "", "seller": "Desconocido", "availability": "unknown", "country": "UNKNOWN", "product_name": "Lácteos y Quesos", "brand": "Leches", "reference": "", "unit": "1 LT", "price_amount": 1.05, "price_currency": "", "price_symbol": "", "price_text": "1.05", "price_amount_filled": "1.05", "price_is_imputed": "False", "price_imputation_source": "original", "price_amount_usd": "1.05", "price_amount_usd_filled": "1.05", "fx_rate_local_per_usd": "1.0", "fx_source": "default_1usd", "information_text": "", "description_text": "Leche Natural Entera Tottus 1lt | Actualizado al: 20-02-2025 Ingredientes: Leche natural entera, Leche (lactosa), Leche (caseína). Alérgenos: Leche (lactosa), Leche (caseína). Certificados: Vegetariano Libre de Soya Libre de Huevo Libre de Peces Libre de Mariscos Libre de Maní Libre de Frutas Secos Libre de Nueces Libre de Sulfitos Libre de Trigo Porción: 1 Taza (200ml) Porciones por envase: 5 100ml 1 Porción Energía (kCal) 59 118 Proteínas (g) 3.1 6.2 Grasas Totales Grasas saturadas (g) 1.8 3.6 Grasas (g) 0.8 1.6 Grasas poliinsaturadas (g) 0.20.4 Grasas trans (g) 0.1 Colesterol (mg) 9.4 18.8 Hhidratos de carbono disponibles 4.9 9.8 Azúcares totales (g) 4.7 Sodio 42 84 Importante: La información del empaque y/o contenido del producto final puede diferir respecto a lo que mostramos en nuestro sitio web, tanto a nivel de ingredientes, trazas, información nutricional, sellos, modo de uso y/o modo de conservación. Usted debe basarse únicamente en la información que se muestra en nuestro sitio web y siempre debe leer las etiquetas, advertencias y instrucciones antes de usar el consumo de un producto. Información obtenida de LECHE TOTTUS ENTERA 1LT Productos similares Leche Descremada Natural Ver producto Leche Semidescremada Natural Leche Semi Descremada Tottus 1 Lt Leche Descremada Tottus 1 Lt Leche Enteral Natural Leche Entera Natural Surlat 1 L -15% Leche Entera Natural Cremosa ¡Juntos son mejores! Azúcar -11% Arroz Precio Uno G2 Grano Largo Fino 1 Kg Aceite Vegetal Precio Un 900 ml Harina Con Polvo Azúcar Blanca Granulada Tottus 860 g Harina sin polvos de Hornear SPAGHETTI 5 TOTTUS 400 GR Arroz Tottus G2 Grano Largo Fino 1 Kg ESPIRALES TOTTUS 400 G Aceite Vegetal Tottus 900 ml Carpeta Caracol Tottus 400 g ESPIRALES TOTTUS 400 GR TALLARIN 87 TOTTUS 400 GR Azúcar Blanca Granulada Tottus 1 Kg Harina de Trigo con Polvo de Hornear Tottus 1 Kg TALLARIN TOTTUS 400 G CORBATAS TOTTUS 400 GR Aceite Vegetal Harina de Trigo sin polvo de Hornear Tottus 1 Kg", "features_text": "", "specifications_text": "", "benefits_text": "", "details_text": "", "other_sections": "", "sections": {"Descripción": ["Leche Natural Entera Tottus", "1lt | Actualizado al: 20-02-2025", "Ingredientes: Leche natural entera, Leche (lactosa), Leche (caseína).", "Alérgenos: Leche (lactosa), Leche (caseína).", "Certificados: Vegetariano", "Libre de Soya", "Libre de Huevo", "Libre de Peces", "Libre de Mariscos", "Libre de Maní", "Libre de Frutos Secos", "Libre de Nueces", "Libre de Sulfitos", "Libre de Trigo", "Porción: 1 Taza (200ml)", "Porciones por envase: 5", "100ml", "1 Porción", "Energía", "(kCal)", "59", "118", "Proteínas", "(g)", "3.1", "6.2", "Grasas Totales", "Grasas saturadas (g)", "1.8", "3.6", "Grasas monoinsaturadas (g)", "0.8", "1.6", "Grasas poliinsaturadas (g)", "0.2", "0.4", "Grasas trans (g)", "0.1", "Colesterol", "(mg)", "9.4", "18.8", "Hidratos de carbono disponibles", "4.9", "9.8", "Azúcar total (g)", "4.7", "Sodio", "42", "84", "Importante: La información del empaque y/o contenido del producto final puede diferir respecto a lo que mostramos en nuestro sitio web, tanto a nivel de ingredientes, trazas, información nutricional, sellos, modo de uso y/o modo de conservación. Usted debe basarse únicamente en la información que se muestra en nuestro sitio web y siempre debe leer las etiquetas, advertencias y instrucciones antes de usar el consumo de un producto.", "Información obtenida de", "LECHE TOTTUS ENTERA 1LT", "Productos similares", "Leche Descremada Natural", "Ver producto", "Leche Semidescremada Natural", "Leche Semi Descremada Tottus 1 Lt", "Leche Descremada Tottus 1 Lt", "Leche Enteral Natural", "Leche Entera Natural Surlat 1 L", "-15%", "Leche Entera Natural Cremosa", "¡Juntos son mejores!", "Azúcar", "-11%", "Arroz Precio Uno G2 Grano Largo Fino 1 Kg", "Aceite Vegetal Precio Uno 900 ml", "Harina Con Polvo", "Azúcar Blanca Granulada Tottus 860 g", "Harina sin Polvos de Hornear", "SPAGHETTI 5   TOTTUS 400 GR", "Arroz Tottus G2 Grano Largo Fino 1 Kg", "ESPIRALES TOTTUS 400 G", "Aceite Vegetal Tottus 900 ml", "Pasta Caracol Tottus 400 g", "ESPIRALES   TOTTUS 400 GR", "TALLARIN 87   TOTTUS 400 GR", "Azúcar Blanca Granulada Tottus 1 Kg", "Harina de Trigo con Polvo de Hornear Tottus 1 Kg", "TALLARIN TOTTUS 400 G", "CORBATAS   TOTTUS 400 GR", "Aceite Vegetal", "Harina de Trigo sin Polvo de Hornear Tottus 1 Kg"]}, "txt_path": "dataset/txt_limpios/1750.txt", "html_path": "dataset/paginas_descargadas/1750.html", "es_status": "ET", "category_canonical": "leche", "decision": "keep", "match_score": 0.6, "reasons": "heuristic_default"}
{"source_id": "913", "title": "Lácteos, refrigerados y huevos", "description": "", "breadcrumbs": "Leches líquidos > 1 Litro", "price_raw": "1.09", "currency_raw": "", "url": "", "seller": "Desconocido", "availability": "unknown", "country": "UNKNOWN", "product_name": "Lácteos, refrigerados y huevos", "brand": "Leches líquidas", "reference": "", "unit": "1 Litro", "price_amount": 1.09, "price_currency": "", "price_symbol": "$", "price_text": "$1.09", "price_amount_filled": "1.09", "price_is_imputed": "False", "price_imputation_source": "original", "price_amount_usd": "1.09", "price_amount_usd_filled": "1.09", "fx_rate_local_per_usd": "1.0", "fx_source": "default_1usd", "information_text": "", "description_text": "", "features_text": "", "specifications_text": "", "benefits_text": "", "details_text": "", "other_sections": "", "sections": {}, "txt_path": "dataset/txt_limpios/913.txt", "html_path": "dataset/paginas_descargadas/913.html", "es_status": "ET", "category_canonical": "leche", "decision": "keep", "match_score": 0.6, "reasons": "heuristic_default"}
{"source_id": "914", "title": "Lácteos, refrigerados y huevos", "description": "Leche entera Los Peumos 1 L", "breadcrumbs": "Leches líquidos > 1 Litro", "price_raw": "1.15", "currency_raw": "", "url": "", "seller": "Desconocido", "availability": "unknown", "country": "UNKNOWN", "product_name": "Lácteos, refrigerados y huevos", "brand": "Leches líquidas", "reference": "", "unit": "1 Litro", "price_amount": 1.15, "price_currency": "", "price_symbol": "$", "price_text": "$1.15", "price_amount_filled": "1.15", "price_is_imputed": "False", "price_imputation_source": "original", "price_amount_usd": "1.15", "price_amount_usd_filled": "1.15", "fx_rate_local_per_usd": "1.0", "fx_source": "default_1usd", "information_text": "", "description_text": "Leche entera Los Peumos 1 L", "features_text": "", "specifications_text": "", "benefits_text": "", "details_text": "", "other_sections": "", "sections": {"Descripción": ["Leche entera Los Peumos 1 L"]}, "txt_path": "dataset/txt_limpios/914.txt", "html_path": "dataset/paginas_descargadas/914.html", "es_status": "ET", "category_canonical": "leche", "decision": "keep", "match_score": 0.6, "reasons": "heuristic_default"}
{"source_id": "915", "title": "Lácteos, refrigerados y huevos", "description": "", "breadcrumbs": "Leches líquidos > 1 Litro", "price_raw": "970.0", "currency_raw": "", "url": "", "seller": "Desconocido", "availability": "unknown", "country": "UNKNOWN", "product_name": "Lácteos, refrigerados y huevos", "brand": "Leches líquidas", "reference": "", "unit": "1 Litro", "price_amount": 970.0, "price_currency": "", "price_symbol": "$", "price_text": "$970", "price_amount_filled": "970.0", "price_is_imputed": "False", "price_imputation_source": "original", "price_amount_usd": "970.0", "price_amount_usd_filled": "970.0", "fx_rate_local_per_usd": "1.0", "fx_source": "default_1usd", "information_text": "", "description_text": "", "features_text": "", "specifications_text": "", "benefits_text": "", "details_text": "", "other_sections": "", "sections": {}, "txt_path": "dataset/txt_limpios/915.txt", "html_path": "dataset/paginas_descargadas/915.html", "es_status": "ET", "category_canonical": "leche", "decision": "keep", "match_score": 0.6, "reasons": "heuristic_default"}
{"source_id": "297", "title": "Macarrão Italiano Spaghetti La Campofilone 500 G", "description": "", "breadcrumbs": "Descripción > 500 G", "price_raw": "15.99", "currency_raw": "BRL", "url": "", "seller": "Desconocido", "availability": "unknown", "country": "BR", "product_name": "Macarrão Italiano Spaghetti La Campofilone 500 G", "brand": "Descripción", "reference": "", "unit": "500 G", "price_amount": 15.99, "price_currency": "BRL", "price_symbol": "R$", "price_text": "R$15,99", "price_amount_filled": "15.99", "price_is_imputed": "False", "price_imputation_source": "original", "price_amount_usd": "2.935", "price_amount_usd_filled": "2.935", "fx_rate_local_per_usd": "5.448", "fx_source": "from_brasil_cambio_dolar", "information_text": "", "description_text": "", "features_text": "", "specifications_text": "", "benefits_text": "", "details_text": "", "other_sections": "", "sections": {}, "txt_path": "dataset/txt_limpios/297.txt", "html_path": "dataset/paginas_descargadas/297.html", "es_status": "ET", "category_canonical": "pasta seca", "decision": "keep", "match_score": 0.6, "reasons": "heuristic_default"}
{"source_id": "298", "title": "Massa Italiana Integral Spaghetti La Molisana 500 G", "description": "", "breadcrumbs": "Descripción > 500 G", "price_raw": "15.99", "currency_raw": "BRL", "url": "", "seller": "Desconocido", "availability": "unknown", "country": "BR", "product_name": "Massa Italiana Integral Spaghetti La Molisana 500 G", "brand": "Descripción", "reference": "", "unit": "500 G", "price_amount": 15.99, "price_currency": "BRL", "price_symbol": "R$", "price_text": "R$15,99", "price_amount_filled": "15.99", "price_is_imputed": "False", "price_imputation_source": "original", "price_amount_usd": "2.935", "price_amount_usd_filled": "2.935", "fx_rate_local_per_usd": "5.448", "fx_source": "from_brasil_cambio_dolar", "information_text": "", "description_text": "", "features_text": "", "specifications_text": "", "benefits_text": "", "details_text": "", "other_sections": "", "sections": {}, "txt_path": "dataset/txt_limpios/298.txt", "html_path": "dataset/paginas_descargadas/298.html", "es_status": "ET", "category_canonical": "sin_categoria", "decision": "discard", "match_score": 0.3, "reasons": "no_category_detected"}
{"source_id": "1554", "title": "Massas e Molhos", "description": "", "breadcrumbs": "Massas Grano Duro > 500g", "price_raw": "69.98", "currency_raw": "BRL", "url": "", "seller": "Desconocido", "availability": "unknown", "country": "BR", "product_name": "Massas e Molhos", "brand": "Massas Grano Duro", "reference": "", "unit": "500g", "price_amount": 69.98, "price_currency": "BRL", "price_symbol": "R$", "price_text": "R$69,98", "price_amount_filled": "69.98", "price_is_imputed": "False", "price_imputation_source": "original", "price_amount_usd": "12.8451", "price_amount_usd_filled": "12.8451", "fx_rate_local_per_usd": "5.448", "fx_source": "from_brasil_cambio_dolar", "information_text": "", "description_text": "", "features_text": "", "specifications_text": "", "benefits_text": "", "details_text": "", "other_sections": "", "sections": {}, "txt_path": "dataset/txt_limpios/1554.txt", "html_path": "dataset/paginas_descargadas/1554.html", "es_status": "EN", "category_canonical": "sin_categoria", "decision": "discard", "match_score": 0.3, "reasons": "no_category_detected"}
{"source_id": "1556", "title": "Massas e Molhos", "description": "", "breadcrumbs": "de > 500g", "price_raw": "3.89", "currency_raw": "BRL", "url": "", "seller": "Desconocido", "availability": "unknown", "country": "BR", "product_name": "Massas e Molhos", "brand": "de", "reference": "", "unit": "500g", "price_amount": 3.89, "price_currency": "BRL", "price_symbol": "R$", "price_text": "R$3,89", "price_amount_filled": "3.89", "price_is_imputed": "False", "price_imputation_source": "original", "price_amount_usd": "0.714", "price_amount_usd_filled": "0.714", "fx_rate_local_per_usd": "5.448", "fx_source": "from_brasil_cambio_dolar", "information_text": "", "description_text": "", "features_text": "", "specifications_text": "", "benefits_text": "", "details_text": "", "other_sections": "", "sections": {}, "txt_path": "dataset/txt_limpios/1556.txt", "html_path": "dataset/paginas_descargadas/1556.html", "es_status": "EN", "category_canonical": "sin_categoria", "decision": "discard", "match_score": 0.3, "reasons": "no_category_detected"}
{"source_id": "1557", "title": "Massas e Molhos", "description": "", "breadcrumbs": "Descripción del producto > 500g", "price_raw": "", "currency_raw": "", "url": "", "seller": "Desconocido", "availability": "unknown", "country": "UNKNOWN", "product_name": "Massas e Molhos", "brand": "Descripción del producto", "reference": "", "unit": "500g", "price_amount": null, "price_currency": "", "price_symbol": "", "price_text": "", "price_amount_filled": "234.19", "price_is_imputed": "True", "price_imputation_source": "country_mean", "price_amount_usd": "", "price_amount_usd_filled": "234.1938", "fx_rate_local_per_usd": "1.0", "fx_source": "default_1usd", "information_text": "", "description_text": "", "features_text": "", "specifications_text": "", "benefits_text": "", "details_text": "", "other_sections": "", "sections": {}, "txt_path": "dataset/txt_limpios/1557.txt", "html_path": "dataset/paginas_descargadas/1557.html", "es_status": "ET", "category_canonical": "sin_categoria", "decision": "discard", "match_score": 0.3, "reasons": "no_category_detected;price_parse_failed"}
{"source_id": "1561", "title": "Massas e Molhos", "description": "", "breadcrumbs": "Macarrón", "price_raw": "2.0", "currency_raw": "", "url": "", "seller": "Desconocido", "availability": "unknown", "country": "UNKNOWN", "product_name": "Massas e Molhos", "brand": "Macarrón", "reference": "", "unit": "", "price_amount": 2.0, "price_currency": "", "price_symbol": "s", "price_text": "s2", "price_amount_filled": "2.0", "price_is_imputed": "False", "price_imputation_source": "original", "price_amount_usd": "2.0", "price_amount_usd_filled": "2.0", "fx_rate_local_per_usd": "1.0", "fx_source": "default_1usd", "information_text": "", "description_text": "", "features_text": "", "specifications_text": "", "benefits_text": "", "details_text": "", "other_sections": "", "sections": {}, "txt_path": "dataset/txt_limpios/1561.txt", "html_path": "dataset/paginas_descargadas/1561.html", "es_status": "ET", "category_canonical": "sin_categoria", "decision": "discard", "match_score": 0.3, "reasons": "no_category_detected"}
{"source_id": "200", "title": "Massas e Molhos", "description": "", "breadcrumbs": "Massas Grano Duro > 500g", "price_raw": "49.89", "currency_raw": "BRL", "url": "", "seller": "Desconocido", "availability": "unknown", "country": "BR", "product_name": "Massas e Molhos", "brand": "Massas Grano Duro", "reference": "", "unit": "500g", "price_amount": 49.89, "price_currency": "BRL", "price_symbol": "R$", "price_text": "R$49,89", "price_amount_filled": "49.89", "price_is_imputed": "False", "price_imputation_source": "original", "price_amount_usd": "9.1575", "price_amount_usd_filled": "9.1575", "fx_rate_local_per_usd": "5.448", "fx_source": "from_brasil_cambio_dolar", "information_text": "", "description_text": "", "features_text": "", "specifications_text": "", "benefits_text": "", "details_text": "", "other_sections": "", "sections": {}, "txt_path": "dataset/txt_limpios/200.txt", "html_path": "dataset/paginas_descargadas/200.html", "es_status": "EN", "category_canonical": "sin_categoria", "decision": "discard", "match_score": 0.3, "reasons": "no_category_detected"}
{"source_id": "201", "title": "Massas e Molhos", "description": "", "breadcrumbs": "R$ 4,99 > 500g", "price_raw": "4.99", "currency_raw": "BRL", "url": "", "seller": "Desconocido", "availability": "unknown", "country": "BR", "product_name": "Massas e Molhos", "brand": "R$ 4,99", "reference": "", "unit": "500g", "price_amount": 4.99, "price_currency": "BRL", "price_symbol": "R$", "price_text": "R$4,99", "price_amount_filled": "4.99", "price_is_imputed": "False", "price_imputation_source": "original", "price_amount_usd": "0.9159", "price_amount_usd_filled": "0.9159", "fx_rate_local_per_usd": "5.448", "fx_source": "from_brasil_cambio_dolar", "information_text": "", "description_text": "", "features_text": "", "specifications_text": "", "benefits_text": "", "details_text": "", "other_sections": "", "sections": {}, "txt_path": "dataset/txt_limpios/201.txt", "html_path": "dataset/paginas_descargadas/201.html", "es_status": "EN", "category_canonical": "sin_categoria", "decision": "discard", "match_score": 0.3, "reasons": "no_category_detected"}
{"source_id": "202", "title": "Massas e Molhos", "description": "", "breadcrumbs": "fideos > 500g", "price_raw": "", "currency_raw": "", "url": "", "seller": "Desconocido", "availability": "unknown", "country": "UNKNOWN", "product_name": "Massas e Molhos", "brand": "fideos", "reference": "", "unit": "500g", "price_amount": null, "price_currency": "", "price_symbol": "", "price_text": "", "price_amount_filled": "234.19", "price_is_imputed": "True", "price_imputation_source": "country_mean", "price_amount_usd": "", "price_amount_usd_filled": "234.1938", "fx_rate_local_per_usd": "1.0", "fx_source": "default_1usd", "information_text": "", "description_text": "", "features_text": "", "specifications_text": "", "benefits_text": "", "details_text": "", "other_sections": "", "sections": {}, "txt_path": "dataset/txt_limpios/202.txt", "html_path": "dataset/paginas_descargadas/202.html", "es_status": "ET", "category_canonical": "sin_categoria", "decision": "discard", "match_score": 0.3, "reasons": "no_category_detected;price_parse_failed"}
{"source_id": "204", "title": "Massas e Molhos", "description": "", "breadcrumbs": "Macarrón", "price_raw": "12.19", "currency_raw": "BRL", "url": "", "seller": "Desconocido", "availability": "unknown", "country": "BR", "product_name": "Massas e Molhos", "brand": "Macarrón", "reference": "", "unit": "", "price_amount": 12.19, "price_currency": "BRL", "price_symbol": "R$", "price_text": "R$12,19", "price_amount_filled": "12.19", "price_is_imputed": "False", "price_imputation_source": "original", "price_amount_usd": "2.2375", "price_amount_usd_filled": "2.2375", "fx_rate_local_per_usd": "5.448", "fx_source": "from_brasil_cambio_dolar", "information_text": "", "description_text": "", "features_text": "", "specifications_text": "", "benefits_text": "", "details_text": "", "other_sections": "", "sections": {}, "txt_path": "dataset/txt_limpios/204.txt", "html_path": "dataset/paginas_descargadas/204.html", "es_status": "ET", "category_canonical": "sin_categoria", "decision": "discard", "match_score": 0.3, "reasons": "no_category_detected"}
