{"source_id": "1734", "title": "Frutas y Verduras", "description": "TOMATE LARGA VIDA Productos similares Tomate Beef Granel Ver producto ¡Juntos son mejores! Cebolla Granel Pepino Ensalada UN Ají Verde Extra Granel Cebolla en Malla 1 Kg Papa en Malla 2 Kg Papa Granel Advertencias de almacenamiento | Almacenar en un lugar fresco, seco y alejado del calor", "breadcrumbs": "Verduras > 1 Kg", "price_raw": "2.19", "currency_raw": "", "url": "", "seller": "Desconocido", "availability": "unknown", "country": "UNKNOWN", "product_name": "Frutas y Verduras", "brand": "Verduras", "reference": "", "unit": "1 Kg", "price_amount": 2.19, "price_currency": "", "price_symbol": "", "price_text": "2.19", "price_amount_filled": "2.19", "price_is_imputed": "False", "price_imputation_source": "original", "price_amount_usd": "2.19", "price_amount_usd_filled": "2.19", "fx_rate_local_per_usd": "1.0", "fx_source": "default_1usd", "information_text": "", "description_text": "TOMATE LARGA VIDA Productos similares Tomate Beef Granel Ver producto ¡Juntos son mejores! Cebolla Granel Pepino Ensalada UN Ají Verde Extra Granel Cebolla en Malla 1 Kg Papa en Malla 2 Kg Papa Granel", "features_text": "", "specifications_text": "Advertencias de almacenamiento | Almacenar en un lugar fresco, seco y alejado del calor", "benefits_text": "", "details_text": "", "other_sections": "", "sections": {"Especificaciones": ["Advertencias de almacenamiento", "Almacenar en un lugar fresco, seco y alejado del calor"], "Descripción": ["TOMATE LARGA VIDA", "Productos similares", "Tomate Beef a Granel", "Ver producto", "¡Juntos son mejores!", "Cebolla a Granel", "Pepino Ensalada", "UN", "Ají Verde Extra Granel", "Cebolla en Malla 1 Kg", "Papa en Malla 2 Kg", "Papa a Granel"]}, "txt_path": "dataset/txt_limpios/1734.txt", "html_path": "dataset/paginas_descargadas/1734.html", "es_status": "ET", "category_canonical": "cebolla", "decision": "keep", "match_score": 0.6, "reasons": "heuristic_default"}
{"source_id": "1739", "title": "Frutas y Verduras", "description": "TOMATE REGY 250 GR Productos similares Tomate Cherry en Pote 250 g Ver producto Mix Tomate de Cocktail Rocky Pote 250 g Tomates Cocktail Tomateens Pote 100 g Tomate Cherry Cocktail Envasado 250 g ¡Juntos son mejores! Albahaca Selección Envasada 30 g Albahaca en Bolsa 100 g FRUTILLA POTE 300 GRS Lechuga Hidropónica Llollo Rosa Lechuga Hidropónica Española Lechuga Hidropónica Llollo Bionda Lechuga Roble", "breadcrumbs": "Verduras > 250 g", "price_raw": "1.92", "currency_raw": "", "url": "", "seller": "Desconocido", "availability": "unknown", "country": "UNKNOWN", "product_name": "Frutas y Verduras", "brand": "Verduras", "reference": "", "unit": "250 g", "price_amount": 1.92, "price_currency": "", "price_symbol": "", "price_text": "1.92", "price_amount_filled": "1.92", "price_is_imputed": "False", "price_imputation_source": "original", "price_amount_usd": "1.92", "price_amount_usd_filled": "1.92", "fx_rate_local_per_usd": "1.0", "fx_source": "default_1usd", "information_text": "", "description_text": "TOMATE REGY 250 GR Productos similares Tomate Cherry en Pote 250 g Ver producto Mix Tomate de Cocktail Rocky Pote 250 g Tomates Cocktail Tomateens Pote 100 g Tomate Cherry Cocktail Envasado 250 g ¡Juntos son mejores! Albahaca Selección Envasada 30 g Albahaca en Bolsa 100 g FRUTILLA POTE 300 GRS Lechuga Hidropónica Llollo Rosa Lechuga Hidropónica Española Lechuga Hidropónica Llollo Bionda Lechuga Roble", "features_text": "", "specifications_text": "", "benefits_text": "", "details_text": "", "other_sections": "", "sections": {"Descripción": ["TOMATE REGY 250 GR", "Productos similares", "Tomate Cherry en Pote 250 g", "Ver producto", "Mix Tomate de Cocktail Rocky Pote 250 g", "Tomates de Cocktail Tomateens Pote 100 g", "Tomate Cherry Cocktail Envasado 250 g", "¡Juntos son mejores!", "Albahaca Selección Envasada 30 g", "Albahaca en Bolsa 100 g", "FRUTILLA POTE 300 GRS", "Lechuga Hidropónica Llollo Rosa", "Lechuga Hidropónica Española", "Lechuga Hidropónica Llollo Bionda", "Lechuga Roble"]}, "txt_path": "dataset/txt_limpios/1739.txt", "html_path": "dataset/paginas_descargadas/1739.html", "es_status": "ET", "category_canonical": "tomates", "decision": "keep", "match_score": 0.6, "reasons": "heuristic_default"}
{"source_id": "39", "title": "Frutas y verduras", "description": "Cebolla Blanca por kilo. Las verduras son un complemento necesario para la comida diaria, ya que aportan una gran variedad de nutrientes que tu cuerpo necesita. Las verduras contribuyen con vitaminas y minerales, además de proporcionar agua al cuerpo. También contienen fibra, antioxidantes y algunas de ellas un alto contenido en potasio lo que te ayuda a eliminar el exceso de líquidos en el cuerpo. Todos estos valores agregados de las verduras las hacen ser importantes para el sano cuidado de la salud. Encuentra todo tipo de verduras y frutas en Chedraui. com", "breadcrumbs": "Verduras > 3102851", "price_raw": "", "currency_raw": "MXN", "url": "", "seller": "Chedraui", "availability": "unknown", "country": "MX", "product_name": "Frutas y verduras", "brand": "Verduras", "reference": "3102851.0", "unit": "", "price_amount": null, "price_currency": "MXN", "price_symbol": "", "price_text": "", "price_amount_filled": "12679.94", "price_is_imputed": "True", "price_imputation_source": "category_mean", "price_amount_usd": "", "price_amount_usd_filled": "680.985", "fx_rate_local_per_usd": "18.62", "fx_source": "from_mexico_cambio_dolar", "information_text": "Cebolla Blanca por kilo.", "description_text": "", "features_text": "", "specifications_text": "Las verduras son un complemento necesario para la comida diaria, ya que aportan una gran variedad de nutrientes que tu cuerpo necesita. Las verduras contribuyen con vitaminas y minerales, además de proporcionar agua al cuerpo. También contienen fibra, antioxidantes y algunas de ellas un alto contenido en potasio lo que te ayuda a eliminar el exceso de líquidos en el cuerpo. Todos estos valores agregados de las verduras las hacen ser importantes para el sano cuidado de la salud. Encuentra todo tipo de verduras y frutas en Chedraui. com", "benefits_text": "", "details_text": "", "other_sections": "", "sections": {"Información": ["Cebolla Blanca por kilo."], "Especificaciones": ["Las verduras son un complemento necesario para la comida diaria, ya que aportan una gran variedad de nutrientes que tu cuerpo necesita. Las verduras contribuyen con vitaminas y minerales, además de proporcionar agua al cuerpo. También contienen fibra, antioxidantes y algunas de ellas un alto contenido en potasio lo que te ayuda a eliminar el exceso de líquidos en el cuerpo. Todos estos valores agregados de las verduras las hacen ser importantes para el sano cuidado de la salud. Encuentra todo tipo de verduras y frutas en Chedraui. com"]}, "txt_path": "dataset/txt_limpios/39.txt", "html_path": "dataset/paginas_descargadas/39.html", "es_status": "ET", "category_canonical": "cebolla", "decision": "discard", "match_score": 0.6, "reasons": "price_parse_failed;price<=0"}
{"source_id": "538", "title": "Frutas Y Verduras", "description": "", "breadcrumbs": "Verduras > 2.25 L", "price_raw": "2300.0", "currency_raw": "", "url": "", "seller": "Desconocido", "availability": "unknown", "country": "UNKNOWN", "product_name": "Frutas Y Verduras", "brand": "Verduras", "reference": "", "unit": "2.25 L", "price_amount": 2300.0, "price_currency": "", "price_symbol": "$", "price_text": "$2.300,00", "price_amount_filled": "2300.0", "price_is_imputed": "False", "price_imputation_source": "original", "price_amount_usd": "2300.0", "price_amount_usd_filled": "2300.0", "fx_rate_local_per_usd": "1.0", "fx_source": "default_1usd", "information_text": "", "description_text": "", "features_text": "Últimos consultados | Gaseosa PRITTY Limón Botella 2.25 L | Ver planes de cuotas | 20%DTO | Gaseosa Cola Cunnington 1500cmq | PRECIO CON 20%DTO | 25%DTO | Gaseosa PASO DE LOS TOROS Botella 2.25 L | PRECIO CON 25%DTO | LLEVANDO 2 | 2X1 | Gaseosa Cola Pepsi 2l | PRECIO CON 2X1 | NO ACUMULABLE CON OTRAS PROMOS | Gaseosa Coca-Cola Sabor Original 2,25 Lt | PRECIO CON 50% 2DA", "specifications_text": "", "benefits_text": "", "details_text": "", "other_sections": "", "sections": {"Características": ["Últimos consultados", "Gaseosa PRITTY Limón Botella 2.25 L", "Ver planes de cuotas", "20%DTO", "Gaseosa Cola Cunnington 1500cmq", "PRECIO CON 20%DTO", "25%DTO", "Gaseosa PASO DE LOS TOROS    Botella 2.25 L", "PRECIO CON 25%DTO", "LLEVANDO 2", "2X1", "Gaseosa Cola Pepsi 2l", "PRECIO CON 2X1", "NO ACUMULABLE CON OTRAS PROMOS", "Gaseosa Coca-Cola Sabor Original 2,25 Lt", "PRECIO CON 50% 2DA"]}, "txt_path": "dataset/txt_limpios/538.txt", "html_path": "dataset/paginas_descargadas/538.html", "es_status": "ET", "category_canonical": "sin_categoria", "decision": "discard", "match_score": 0.3, "reasons": "no_category_detected"}
{"source_id": "539", "title": "Frutas Y Verduras", "description": "", "breadcrumbs": "Verduras > 500g", "price_raw": "599.0", "currency_raw": "", "url": "", "seller": "Desconocido", "availability": "unknown", "country": "UNKNOWN", "product_name": "Frutas Y Verduras", "brand": "Verduras", "reference": "", "unit": "500g", "price_amount": 599.0, "price_currency": "", "price_symbol": "$", "price_text": "$599,00", "price_amount_filled": "599.0", "price_is_imputed": "False", "price_imputation_source": "original", "price_amount_usd": "599.0", "price_amount_usd_filled": "599.0", "fx_rate_local_per_usd": "1.0", "fx_source": "default_1usd", "information_text": "", "description_text": "", "features_text": "MARCA | : SANTA MARIA | Últimos consultados | NO ACUMULABLE CON OTRAS PROMOS | Papa Negra Selección X Kg | OFERTA | Ver planes de cuotas | Gaseosa PRITTY Limón Botella 2.25 L | 20%DTO | Gaseosa Cola Cunnington 1500cmq | PRECIO CON 20%DTO | 25%DTO | Gaseosa PASO DE LOS TOROS Botella 2.25 L | PRECIO CON 25%DTO | LLEVANDO 2 | 2X1 | Gaseosa Cola Pepsi 2l | PRECIO CON 2X1", "specifications_text": "", "benefits_text": "", "details_text": "", "other_sections": "", "sections": {"Características": ["MARCA", ": SANTA MARIA", "Últimos consultados", "NO ACUMULABLE CON OTRAS PROMOS", "Papa Negra Selección X Kg", "OFERTA", "Ver planes de cuotas", "Gaseosa PRITTY Limón Botella 2.25 L", "20%DTO", "Gaseosa Cola Cunnington 1500cmq", "PRECIO CON 20%DTO", "25%DTO", "Gaseosa PASO DE LOS TOROS    Botella 2.25 L", "PRECIO CON 25%DTO", "LLEVANDO 2", "2X1", "Gaseosa Cola Pepsi 2l", "PRECIO CON 2X1"]}, "txt_path": "dataset/txt_limpios/539.txt", "html_path": "dataset/paginas_descargadas/539.html", "es_status": "ET", "category_canonical": "sin_categoria", "decision": "discard", "match_score": 0.3, "reasons": "no_category_detected"}
{"source_id": "540", "title": "Frutas Y Verduras", "description": "", "breadcrumbs": "Verduras > 600 Gr", "price_raw": "3049.0", "currency_raw": "", "url": "", "seller": "Desconocido", "availability": "unknown", "country": "UNKNOWN", "product_name": "Frutas Y Verduras", "brand": "Verduras", "reference": "", "unit": "600 Gr", "price_amount": 3049.0, "price_currency": "", "price_symbol": "$", "price_text": "$3.049,00", "price_amount_filled": "3049.0", "price_is_imputed": "False", "price_imputation_source": "original", "price_amount_usd": "3049.0", "price_amount_usd_filled": "3049.0", "fx_rate_local_per_usd": "1.0", "fx_source": "default_1usd", "information_text": "", "description_text": "", "features_text": "MARCA | : SUEÑO VERDE | Últimos consultados | NO ACUMULABLE CON OTRAS PROMOS | Papa Natural Cortada Precocida Santa Maria 500g | OFERTA | Ver planes de cuotas | Papa Negra Selección X Kg | Gaseosa PRITTY Limón Botella 2.25 L | 20%DTO | Gaseosa Cola Cunnington 1500cmq | PRECIO CON 20%DTO | 25%DTO | Gaseosa PASO DE LOS TOROS Botella 2.25 L | PRECIO CON 25%DTO", "specifications_text": "", "benefits_text": "", "details_text": "", "other_sections": "", "sections": {"Características": ["MARCA", ": SUEÑO VERDE", "Últimos consultados", "NO ACUMULABLE CON OTRAS PROMOS", "Papa Natural Cortada Precocida Santa Maria 500g", "OFERTA", "Ver planes de cuotas", "Papa Negra Selección X Kg", "Gaseosa PRITTY Limón Botella 2.25 L", "20%DTO", "Gaseosa Cola Cunnington 1500cmq", "PRECIO CON 20%DTO", "25%DTO", "Gaseosa PASO DE LOS TOROS    Botella 2.25 L", "PRECIO CON 25%DTO"]}, "txt_path": "dataset/txt_limpios/540.txt", "html_path": "dataset/paginas_descargadas/540.html", "es_status": "ET", "category_canonical": "sin_categoria", "decision": "discard", "match_score": 0.3, "reasons": "no_category_detected"}
{"source_id": "541", "title": "Frutas Y Verduras", "description": "", "breadcrumbs": "Verduras > 600 Gr", "price_raw": "7999.0", "currency_raw": "", "url": "", "seller": "Desconocido", "availability": "unknown", "country": "UNKNOWN", "product_name": "Frutas Y Verduras", "brand": "Verduras", "reference": "", "unit": "600 Gr", "price_amount": 7999.0, "price_currency": "", "price_symbol": "$", "price_text": "$7.999,00", "price_amount_filled": "7999.0", "price_is_imputed": "False", "price_imputation_source": "original", "price_amount_usd": "7999.0", "price_amount_usd_filled": "7999.0", "fx_rate_local_per_usd": "1.0", "fx_source": "default_1usd", "information_text": "", "description_text": "", "features_text": "Últimos consultados | NO ACUMULABLE CON OTRAS PROMOS | Papas Andinas SUEÑO VERDE X 600 Gr | OFERTA | Ver planes de cuotas | Papa Natural Cortada Precocida Santa Maria 500g | Papa Negra Selección X Kg | Gaseosa PRITTY Limón Botella 2.25 L | 20%DTO | Gaseosa Cola Cunnington 1500cmq | PRECIO CON 20%DTO", "specifications_text": "", "benefits_text": "", "details_text": "", "other_sections": "", "sections": {"Características": ["Últimos consultados", "NO ACUMULABLE CON OTRAS PROMOS", "Papas Andinas SUEÑO VERDE X 600 Gr", "OFERTA", "Ver planes de cuotas", "Papa Natural Cortada Precocida Santa Maria 500g", "Papa Negra Selección X Kg", "Gaseosa PRITTY Limón Botella 2.25 L", "20%DTO", "Gaseosa Cola Cunnington 1500cmq", "PRECIO CON 20%DTO"]}, "txt_path": "dataset/txt_limpios/541.txt", "html_path": "dataset/paginas_descargadas/541.html", "es_status": "ET", "category_canonical": "sin_categoria", "decision": "discard", "match_score": 0.3, "reasons": "no_category_detected"}
{"source_id": "542", "title": "Frutas Y Verduras", "description": "", "breadcrumbs": "Verduras > 600 Gr", "price_raw": "2799.0", "currency_raw": "", "url": "", "seller": "Desconocido", "availability": "unknown", "country": "UNKNOWN", "product_name": "Frutas Y Verduras", "brand": "Verduras", "reference": "", "unit": "600 Gr", "price_amount": 2799.0, "price_currency": "", "price_symbol": "$", "price_text": "$2.799,00", "price_amount_filled": "2799.0", "price_is_imputed": "False", "price_imputation_source": "original", "price_amount_usd": "2799.0", "price_amount_usd_filled": "2799.0", "fx_rate_local_per_usd": "1.0", "fx_source": "default_1usd", "information_text": "", "description_text": "", "features_text": "Últimos consultados | NO ACUMULABLE CON OTRAS PROMOS | Tomate Red X Kg | OFERTA | Ver planes de cuotas | Papas Andinas SUEÑO VERDE X 600 Gr | Papa Natural Cortada Precocida Santa Maria 500g | Papa Negra Selección X Kg | Gaseosa PRITTY Limón Botella 2.25 L", "specifications_text": "", "benefits_text": "", "details_text": "", "other_sections": "", "sections": {"Características": ["Últimos consultados", "NO ACUMULABLE CON OTRAS PROMOS", "Tomate Red X Kg", "OFERTA", "Ver planes de cuotas", "Papas Andinas SUEÑO VERDE X 600 Gr", "Papa Natural Cortada Precocida Santa Maria 500g", "Papa Negra Selección X Kg", "Gaseosa PRITTY Limón Botella 2.25 L"]}, "txt_path": "dataset/txt_limpios/542.txt", "html_path": "dataset/paginas_descargadas/542.html", "es_status": "ET", "category_canonical": "sin_categoria", "decision": "discard", "match_score": 0.3, "reasons": "no_category_detected"}
{"source_id": "543", "title": "Frutas Y Verduras", "description": "", "breadcrumbs": "Verduras > 300 Gr", "price_raw": "2999.0", "currency_raw": "", "url": "", "seller": "Desconocido", "availability": "unknown", "country": "UNKNOWN", "product_name": "Frutas Y Verduras", "brand": "Verduras", "reference": "", "unit": "300 Gr", "price_amount": 2999.0, "price_currency": "", "price_symbol": "$", "price_text": "$2.999,00", "price_amount_filled": "2999.0", "price_is_imputed": "False", "price_imputation_source": "original", "price_amount_usd": "2999.0", "price_amount_usd_filled": "2999.0", "fx_rate_local_per_usd": "1.0", "fx_source": "default_1usd", "information_text": "", "description_text": "", "features_text": "MARCA | : ROCKY | Últimos consultados | NO ACUMULABLE CON OTRAS PROMOS | Tomate Red Especial X Kg Xkg | OFERTA | Ver planes de cuotas | Tomate Red X Kg | Papas Andinas SUEÑO VERDE X 600 Gr | Papa Natural Cortada Precocida Santa Maria 500g | Papa Negra Selección X Kg", "specifications_text": "", "benefits_text": "", "details_text": "", "other_sections": "", "sections": {"Características": ["MARCA", ": ROCKY", "Últimos consultados", "NO ACUMULABLE CON OTRAS PROMOS", "Tomate Red Especial X Kg   Xkg", "OFERTA", "Ver planes de cuotas", "Tomate Red X Kg", "Papas Andinas SUEÑO VERDE X 600 Gr", "Papa Natural Cortada Precocida Santa Maria 500g", "Papa Negra Selección X Kg"]}, "txt_path": "dataset/txt_limpios/543.txt", "html_path": "dataset/paginas_descargadas/543.html", "es_status": "ET", "category_canonical": "sin_categoria", "decision": "discard", "match_score": 0.3, "reasons": "no_category_detected"}
{"source_id": "33", "title": "Harinas y reposteria", "description": "Harina de trigo San Blas, está elaborada con los trigos más selectos: ofreciendo una harina multiusos para utilizarse en casa el en todo tipo de repostería como pan francés, pan leudado, bizcochería fina, hojaldres, pan danés, pizza y muchos más. Harina de trigo San Blas, está elaborada con los trigos más selectos: ofreciendo una harina multiusos para utilizarse en casa el en todo tipo de repostería como pan francés, pan leudado, bizcochería fina, hojaldres, pan danés, pizza y muchos más. Gracias a su excelente versatilidad, se asegura el rendimiento, estabilidad en el horneo y una máxima versatilidad al preparar sus platillos. La harina se encuentra añadida con ácido fólico, zinc, hierro y vitaminas.", "breadcrumbs": "San Blas > 500g > 3775966", "price_raw": "", "currency_raw": "MXN", "url": "", "seller": "Chedraui", "availability": "unknown", "country": "MX", "product_name": "Harinas y reposteria", "brand": "San Blas", "reference": "3775966.0", "unit": "500g", "price_amount": null, "price_currency": "MXN", "price_symbol": "", "price_text": "", "price_amount_filled": "2902.4", "price_is_imputed": "True", "price_imputation_source": "category_mean", "price_amount_usd": "", "price_amount_usd_filled": "155.8757", "fx_rate_local_per_usd": "18.62", "fx_source": "from_mexico_cambio_dolar", "information_text": "Harina de trigo San Blas, está elaborada con los trigos más selectos: ofreciendo una harina multiusos para utilizarse en casa el en todo tipo de repostería como pan francés, pan leudado, bizcochería fina, hojaldres, pan danés, pizza y muchos más.", "description_text": "", "features_text": "", "specifications_text": "Harina de trigo San Blas, está elaborada con los trigos más selectos: ofreciendo una harina multiusos para utilizarse en casa el en todo tipo de repostería como pan francés, pan leudado, bizcochería fina, hojaldres, pan danés, pizza y muchos más. Gracias a su excelente versatilidad, se asegura el rendimiento, estabilidad en el horneo y una máxima versatilidad al preparar sus platillos. La harina se encuentra añadida con ácido fólico, zinc, hierro y vitaminas.", "benefits_text": "", "details_text": "", "other_sections": "", "sections": {"Información": ["Harina de trigo San Blas, está elaborada con los trigos más selectos: ofreciendo una harina multiusos para utilizarse en casa el en todo tipo de repostería como pan francés, pan leudado, bizcochería fina, hojaldres, pan danés, pizza y muchos más."], "Especificaciones": ["Harina de trigo San Blas, está elaborada con los trigos más selectos: ofreciendo una harina multiusos para utilizarse en casa el en todo tipo de repostería como pan francés, pan leudado, bizcochería fina, hojaldres, pan danés, pizza y muchos más. Gracias a su excelente versatilidad, se asegura el rendimiento, estabilidad en el horneo y una máxima versatilidad al preparar sus platillos. La harina se encuentra añadida con ácido fólico, zinc, hierro y vitaminas."]}, "txt_path": "dataset/txt_limpios/33.txt", "html_path": "dataset/paginas_descargadas/33.html", "es_status": "ET", "category_canonical": "harina de trigo", "decision": "discard", "match_score": 0.6, "reasons": "price_parse_failed;price<=0"}
