source_id,title,description,breadcrumbs,price_raw,currency_raw,url,seller,availability,country,product_name,brand,reference,unit,price_amount,price_currency,price_symbol,price_text,price_amount_filled,price_is_imputed,price_imputation_source,price_amount_usd,price_amount_usd_filled,fx_rate_local_per_usd,fx_source,information_text,description_text,features_text,specifications_text,benefits_text,details_text,other_sections,sections,txt_path,html_path,es_status,category_canonical,decision,match_score,reasons
695,"ASESORAMOS TU COMPRA: 📞(601) 6672004, lun a sab de 7am.a 7pm dom hasta las 6pm","Ingredientes Condición alimentaria Información nutricional Incluye en tus recetas este delicioso queso mozzarella light que le brindará un sabor especial a cada uno de tus platos. Este producto es vendido, facturado y entregado por Cencosud - Colombia Los precios de los productos pueden cambiar dependiendo de la región. Aplican Términos y Condiciones Desactivados Referencia: 0850318 $ 70 x gr PASCO ☆ ¿Todavía tienes tu Tarjeta Cencosud? Solicítala en línea, úsala y obtén un . Aplican términos y condiciones. Solicítala aquí Términos más buscados 1. kefir alpina 2. muebles 3. leche 4. leche alqueria 5. san jorge 6. papel higiénico 7. arroz 8. café 9. cerveza 10. neveras",otras ciudades consulta aquí > 0850318,450.0,COP,,Desconocido,unknown,CO,"ASESORAMOS TU COMPRA: 📞(601) 6672004, lun a sab de 7am.a 7pm dom hasta las 6pm",otras ciudades consulta aquí,850318.0,,450.00,COP,,450,450.0,False,original,0.1112,0.1112,4047.0,from_colombia_cambio_dolar,,"Ingredientes Condición alimentaria Información nutricional Incluye en tus recetas este delicioso queso mozzarella light que le brindará un sabor especial a cada uno de tus platos. Este producto es vendido, facturado y entregado por Cencosud - Colombia Los precios de los productos pueden cambiar dependiendo de la región. Aplican Términos y Condiciones Desactivados Referencia: 0850318 $ 70 x gr PASCO ☆ ¿Todavía tienes tu Tarjeta Cencosud? Solicítala en línea, úsala y obtén un . Aplican términos y condiciones. Solicítala aquí Términos más buscados 1. kefir alpina 2. muebles 3. leche 4. leche alqueria 5. san jorge 6. papel higiénico 7. arroz 8. café 9. cerveza 10. neveras",,,,,,"{""Descripción"": [""Ingredientes"", ""Condición alimentaria"", ""Información nutricional"", ""Incluye en tus recetas este delicioso queso mozzarella light que le brindará un sabor especial a cada uno de tus platos."", ""Este producto es vendido, facturado y entregado por"", ""Cencosud - Colombia"", ""Los precios de los productos pueden cambiar dependiendo de la región."", ""Aplican Términos y Condiciones"", ""Desactivado"", ""Referencia: 0850318"", ""$"", ""70"", ""x"", ""gr"", ""PASCO"", ""☆"", ""¿Todavía tienes tu Tarjeta Cencosud?"", ""Solicítala en línea, úsala y obtén un"", "". Aplican términos y condiciones."", ""Solicítala aquí"", ""Términos más buscados"", ""1."", ""kefir alpina"", ""2."", ""muebles"", ""3."", ""leche"", ""4."", ""leche alqueria"", ""5."", ""san jorge"", ""6."", ""papel higienico"", ""7."", ""arroz"", ""8."", ""cafe"", ""9."", ""cerveza"", ""10."", ""neveras""]}",dataset/txt_limpios/695.txt,dataset/paginas_descargadas/695.html,ET,cafe,keep,0.60,heuristic_default
696,"ASESORAMOS TU COMPRA: 📞(601) 6672004, lun a sab de 7am.a 7pm dom hasta las 6pm","Este producto es vendido, facturado y entregado por Cencosud - Colombia Los precios de los productos pueden cambiar dependiendo de la región. Aplican Términos y Condiciones APLICA PARA Referencia: 0064565 $ 71 , 86 x gr VECCHIO ☆ ¿Todavía tienes tu Tarjeta Cencosud? Solicítala en línea, úsala y obtén un . Aplican términos y condiciones. Solicítala aquí Términos más buscados 1. kefir alpina 2. muebles 3. leche 4. leche alqueria 5. san jorge 6. papel higiénico 7. arroz 8. café 9. cerveza 10. neveras",otras ciudades consulta aquí > 70g > 0064565,70.0,COP,,Desconocido,unknown,CO,"ASESORAMOS TU COMPRA: 📞(601) 6672004, lun a sab de 7am.a 7pm dom hasta las 6pm",otras ciudades consulta aquí,64565.0,70g,70.00,COP,,70,70.0,False,original,0.0173,0.0173,4047.0,from_colombia_cambio_dolar,,"Este producto es vendido, facturado y entregado por Cencosud - Colombia Los precios de los productos pueden cambiar dependiendo de la región. Aplican Términos y Condiciones APLICA PARA Referencia: 0064565 $ 71 , 86 x gr VECCHIO ☆ ¿Todavía tienes tu Tarjeta Cencosud? Solicítala en línea, úsala y obtén un . Aplican términos y condiciones. Solicítala aquí Términos más buscados 1. kefir alpina 2. muebles 3. leche 4. leche alqueria 5. san jorge 6. papel higiénico 7. arroz 8. café 9. cerveza 10. neveras",,,,,,"{""Descripción"": [""Este producto es vendido, facturado y entregado por"", ""Cencosud - Colombia"", ""Los precios de los productos pueden cambiar dependiendo de la región."", ""Aplican Términos y Condiciones"", ""APLICA PARA"", ""Referencia: 0064565"", ""$"", ""71"", "","", ""86"", ""x"", ""gr"", ""VECCHIO"", ""☆"", ""¿Todavía tienes tu Tarjeta Cencosud?"", ""Solicítala en línea, úsala y obtén un"", "". Aplican términos y condiciones."", ""Solicítala aquí"", ""Términos más buscados"", ""1."", ""kefir alpina"", ""2."", ""muebles"", ""3."", ""leche"", ""4."", ""leche alqueria"", ""5."", ""san jorge"", ""6."", ""papel higienico"", ""7."", ""arroz"", ""8."", ""cafe"", ""9."", ""cerveza"", ""10."", ""neveras""]}",dataset/txt_limpios/696.txt,dataset/paginas_descargadas/696.html,ET,cafe,keep,0.60,heuristic_default
697,"ASESORAMOS TU COMPRA: 📞(601) 6672004, lun a sab de 7am.a 7pm dom hasta las 6pm","Ingredientes Condición alimentaria Información nutricional Este producto es vendido, facturado y entregado por Cencosud - Colombia Los precios de los productos pueden cambiar dependiendo de la región. Aplican Términos y Condiciones Desactivados Referencia: 0001612 $ 5, 08 x gr RIOPAILA ☆ ¿Todavía tienes tu Tarjeta Cencosud? Solicítala en línea, úsala y obtén un . Aplican términos y condiciones. Solicítala aquí Términos más buscados 1. kefir alpina 2. muebles 3. leche 4. leche alqueria 5. san jorge 6. papel higiénico 7. arroz 8. café 9. cerveza 10. neveras",otras ciudades consulta aquí > 0001612,5.08,COP,,Desconocido,unknown,CO,"ASESORAMOS TU COMPRA: 📞(601) 6672004, lun a sab de 7am.a 7pm dom hasta las 6pm",otras ciudades consulta aquí,1612.0,,5.08,COP,$,$5.08,5.08,False,original,0.0013,0.0013,4047.0,from_colombia_cambio_dolar,,"Ingredientes Condición alimentaria Información nutricional Este producto es vendido, facturado y entregado por Cencosud - Colombia Los precios de los productos pueden cambiar dependiendo de la región. Aplican Términos y Condiciones Desactivados Referencia: 0001612 $ 5, 08 x gr RIOPAILA ☆ ¿Todavía tienes tu Tarjeta Cencosud? Solicítala en línea, úsala y obtén un . Aplican términos y condiciones. Solicítala aquí Términos más buscados 1. kefir alpina 2. muebles 3. leche 4. leche alqueria 5. san jorge 6. papel higiénico 7. arroz 8. café 9. cerveza 10. neveras",,,,,,"{""Descripción"": [""Ingredientes"", ""Condición alimentaria"", ""Información nutricional"", ""Este producto es vendido, facturado y entregado por"", ""Cencosud - Colombia"", ""Los precios de los productos pueden cambiar dependiendo de la región."", ""Aplican Términos y Condiciones"", ""Desactivado"", ""Referencia: 0001612"", ""$"", ""5"", "","", ""08"", ""x"", ""gr"", ""RIOPAILA"", ""☆"", ""¿Todavía tienes tu Tarjeta Cencosud?"", ""Solicítala en línea, úsala y obtén un"", "". Aplican términos y condiciones."", ""Solicítala aquí"", ""Términos más buscados"", ""1."", ""kefir alpina"", ""2."", ""muebles"", ""3."", ""leche"", ""4."", ""leche alqueria"", ""5."", ""san jorge"", ""6."", ""papel higienico"", ""7."", ""arroz"", ""8."", ""cafe"", ""9."", ""cerveza"", ""10."", ""neveras""]}",dataset/txt_limpios/697.txt,dataset/paginas_descargadas/697.html,ET,cafe,keep,0.60,heuristic_default
698,"ASESORAMOS TU COMPRA: 📞(601) 6672004, lun a sab de 7am.a 7pm dom hasta las 6pm","En el contiene residuos químicos, impurezas o elementos artificiales, en el cambio del sabor natural de los alimentos. Este producto es vendido, facturado y entregado por Cencosud - Colombia Los precios de los productos pueden cambiar dependiendo de la región. Aplican Términos y Condiciones Desactivados Referencia: 0082359 $ 5 , 69 x gr MANUELITA ☆ ¿Todavía tienes tu Tarjeta Cencosud? Solicítala en línea, úsala y obtén un . Aplican términos y condiciones. Solicítala aquí Términos más buscados 1. kefir alpina 2. muebles 3. leche 4. leche alqueria 5. san jorge 6. papel higiénico 7. arroz 8. café 9. cerveza 10. neveras",otras ciudades consulta aquí > 0082359,5.69,COP,,Desconocido,unknown,CO,"ASESORAMOS TU COMPRA: 📞(601) 6672004, lun a sab de 7am.a 7pm dom hasta las 6pm",otras ciudades consulta aquí,82359.0,,5.69,COP,$,$5.69,5.69,False,original,0.0014,0.0014,4047.0,from_colombia_cambio_dolar,,"En el contiene residuos químicos, impurezas o elementos artificiales, en el cambio del sabor natural de los alimentos. Este producto es vendido, facturado y entregado por Cencosud - Colombia Los precios de los productos pueden cambiar dependiendo de la región. Aplican Términos y Condiciones Desactivados Referencia: 0082359 $ 5 , 69 x gr MANUELITA ☆ ¿Todavía tienes tu Tarjeta Cencosud? Solicítala en línea, úsala y obtén un . Aplican términos y condiciones. Solicítala aquí Términos más buscados 1. kefir alpina 2. muebles 3. leche 4. leche alqueria 5. san jorge 6. papel higiénico 7. arroz 8. café 9. cerveza 10. neveras",,,,,,"{""Descripción"": [""En el contiene residuos químicos, impurezas o elementos artificiales, en el cambio del sabor natural de los alimentos."", ""Este producto es vendido, facturado y entregado por"", ""Cencosud - Colombia"", ""Los precios de los productos pueden cambiar dependiendo de la región."", ""Aplican Términos y Condiciones"", ""Desactivado"", ""Referencia: 0082359"", ""$"", ""5"", "","", ""69"", ""x"", ""gr"", ""MANUELITA"", ""☆"", ""¿Todavía tienes tu Tarjeta Cencosud?"", ""Solicítala en línea, úsala y obtén un"", "". Aplican términos y condiciones."", ""Solicítala aquí"", ""Términos más buscados"", ""1."", ""kefir alpina"", ""2."", ""muebles"", ""3."", ""leche"", ""4."", ""leche alqueria"", ""5."", ""san jorge"", ""6."", ""papel higienico"", ""7."", ""arroz"", ""8."", ""cafe"", ""9."", ""cerveza"", ""10."", ""neveras""]}",dataset/txt_limpios/698.txt,dataset/paginas_descargadas/698.html,ET,cafe,keep,0.60,heuristic_default
699,"ASESORAMOS TU COMPRA: 📞(601) 6672004, lun a sab de 7am.a 7pm dom hasta las 6pm",,otras ciudades consulta aquí,,COP,,Desconocido,unknown,CO,"ASESORAMOS TU COMPRA: 📞(601) 6672004, lun a sab de 7am.a 7pm dom hasta las 6pm",otras ciudades consulta aquí,,,,COP,,,100.78,True,country_mean,,0.0249,4047.0,from_colombia_cambio_dolar,,,,,,,,{},dataset/txt_limpios/699.txt,dataset/paginas_descargadas/699.html,ET,sin_categoria,discard,0.30,no_category_detected;price_parse_failed
700,"ASESORAMOS TU COMPRA: 📞(601) 6672004, lun a sab de 7am.a 7pm dom hasta las 6pm","Endulza tus momentos con azúcar blanco Mayaguez, es azúcar procedente de caña que ha sido seleccionada y clasificada especialmente para ti. Este producto es vendido, facturado y entregado por Cencosud - Colombia Los precios de los productos pueden cambiar dependiendo de la región. Aplican Términos y Condiciones Desactivados Referencia: 0730904 $ 3 , 84 x gr MAYAGUEZ ☆ ¿Todavía tienes tu Tarjeta Cencosud? Solicítala en línea, úsala y obtén un . Aplican términos y condiciones. Solicítala aquí Mejores ofertas -29% Términos más buscados 1. kefir alpina 2. muebles 3. leche 4. leche alqueria 5. san jorge 6. papel higiénico 7. arroz 8. café 9. cerveza 10. neveras",otras ciudades consulta aquí > 0730904,9.6,COP,,Desconocido,unknown,CO,"ASESORAMOS TU COMPRA: 📞(601) 6672004, lun a sab de 7am.a 7pm dom hasta las 6pm",otras ciudades consulta aquí,730904.0,,9.60,COP,$,$9.60,9.6,False,original,0.0024,0.0024,4047.0,from_colombia_cambio_dolar,,"Endulza tus momentos con azúcar blanco Mayaguez, es azúcar procedente de caña que ha sido seleccionada y clasificada especialmente para ti. Este producto es vendido, facturado y entregado por Cencosud - Colombia Los precios de los productos pueden cambiar dependiendo de la región. Aplican Términos y Condiciones Desactivados Referencia: 0730904 $ 3 , 84 x gr MAYAGUEZ ☆ ¿Todavía tienes tu Tarjeta Cencosud? Solicítala en línea, úsala y obtén un . Aplican términos y condiciones. Solicítala aquí Mejores ofertas -29% Términos más buscados 1. kefir alpina 2. muebles 3. leche 4. leche alqueria 5. san jorge 6. papel higiénico 7. arroz 8. café 9. cerveza 10. neveras",,,,,,"{""Descripción"": [""Endulza tus momentos con azúcar blanco Mayaguez, es azúcar procedente de caña que ha sido seleccionada y clasificada especialmente para ti."", ""Este producto es vendido, facturado y entregado por"", ""Cencosud - Colombia"", ""Los precios de los productos pueden cambiar dependiendo de la región."", ""Aplican Términos y Condiciones"", ""Desactivado"", ""Referencia: 0730904"", ""$"", ""3"", "","", ""84"", ""x"", ""gr"", ""MAYAGUEZ"", ""☆"", ""¿Todavía tienes tu Tarjeta Cencosud?"", ""Solicítala en línea, úsala y obtén un"", "". Aplican términos y condiciones."", ""Solicítala aquí"", ""Mejores ofertas"", ""-29%"", ""Términos más buscados"", ""1."", ""kefir alpina"", ""2."", ""muebles"", ""3."", ""leche"", ""4."", ""leche alqueria"", ""5."", ""san jorge"", ""6."", ""papel higienico"", ""7."", ""arroz"", ""8."", ""cafe"", ""9."", ""cerveza"", ""10."", ""neveras""]}",dataset/txt_limpios/700.txt,dataset/paginas_descargadas/700.html,ET,cafe,keep,0.60,heuristic_default
701,"ASESORAMOS TU COMPRA: 📞(601) 6672004, lun a sab de 7am.a 7pm dom hasta las 6pm","Ingredientes Condición alimentaria Información nutricional Ideal para endulzar lo que más te gusta, con menos contenidos de impurezas. Este producto es vendido, facturado y entregado por Cencosud - Colombia Los precios de los productos pueden cambiar dependiendo de la región. Aplican Términos y Condiciones Desactivados Referencia: 0031055 $ 4 , 36 x gr PROVIDENCIA ¿Todavía tienes tu Tarjeta Cencosud? Solicítala en línea, úsala y obtén un . Aplican términos y condiciones. Solicítala aquí Mejores ofertas -13% Términos más buscados 1. kefir alpina 2. muebles 3. leche 4. leche alqueria 5. san jorge 6. papel higiénico 7. arroz 8. café 9. cerveza 10. neveras",otras ciudades consulta aquí > 5kg > 0031055,10.89,COP,,Desconocido,unknown,CO,"ASESORAMOS TU COMPRA: 📞(601) 6672004, lun a sab de 7am.a 7pm dom hasta las 6pm",otras ciudades consulta aquí,31055.0,5kg,10.89,COP,$,$10.89,10.89,False,original,0.0027,0.0027,4047.0,from_colombia_cambio_dolar,,"Ingredientes Condición alimentaria Información nutricional Ideal para endulzar lo que más te gusta, con menos contenidos de impurezas. Este producto es vendido, facturado y entregado por Cencosud - Colombia Los precios de los productos pueden cambiar dependiendo de la región. Aplican Términos y Condiciones Desactivados Referencia: 0031055 $ 4 , 36 x gr PROVIDENCIA ¿Todavía tienes tu Tarjeta Cencosud? Solicítala en línea, úsala y obtén un . Aplican términos y condiciones. Solicítala aquí Mejores ofertas -13% Términos más buscados 1. kefir alpina 2. muebles 3. leche 4. leche alqueria 5. san jorge 6. papel higiénico 7. arroz 8. café 9. cerveza 10. neveras",,,,,,"{""Descripción"": [""Ingredientes"", ""Condición alimentaria"", ""Información nutricional"", ""Ideal para endulzar lo que más te gusta, con menos contenidos de impurezas."", ""Este producto es vendido, facturado y entregado por"", ""Cencosud - Colombia"", ""Los precios de los productos pueden cambiar dependiendo de la región."", ""Aplican Términos y Condiciones"", ""Desactivado"", ""Referencia: 0031055"", ""$"", ""4"", "","", ""36"", ""x"", ""gr"", ""PROVIDENCIA"", ""¿Todavía tienes tu Tarjeta Cencosud?"", ""Solicítala en línea, úsala y obtén un"", "". Aplican términos y condiciones."", ""Solicítala aquí"", ""Mejores ofertas"", ""-13%"", ""Términos más buscados"", ""1."", ""kefir alpina"", ""2."", ""muebles"", ""3."", ""leche"", ""4."", ""leche alqueria"", ""5."", ""san jorge"", ""6."", ""papel higienico"", ""7."", ""arroz"", ""8."", ""cafe"", ""9."", ""cerveza"", ""10."", ""neveras""]}",dataset/txt_limpios/701.txt,dataset/paginas_descargadas/701.html,ET,cafe,keep,0.60,heuristic_default
1583,Azógue y Peixaria,,"Aves > 1,4Kg",23.5,BRL,,Desconocido,unknown,BR,Azógue y Peixaria,Aves,,"1,4Kg",23.50,BRL,R$,"R$23,50",23.5,False,original,4.3135,4.3135,5.448,from_brasil_cambio_dolar,,,,,,,,{},dataset/txt_limpios/1583.txt,dataset/paginas_descargadas/1583.html,ET,sin_categoria,discard,0.30,no_category_detected
1588,Azógue y Peixaria,,Aves > 1Kg,21.99,BRL,,Desconocido,unknown,BR,Azógue y Peixaria,Aves,,1Kg,21.99,BRL,R$,"R$21,99",21.99,False,original,4.0363,4.0363,5.448,from_brasil_cambio_dolar,,,,,,,,{},dataset/txt_limpios/1588.txt,dataset/paginas_descargadas/1588.html,ET,sin_categoria,discard,0.30,no_category_detected
1590,Azógue y Peixaria,,Aves > 700g,,,,Desconocido,unknown,UNKNOWN,Azógue y Peixaria,Aves,,700g,,,,,234.19,True,country_mean,,234.1938,1.0,default_1usd,,,,,,,,{},dataset/txt_limpios/1590.txt,dataset/paginas_descargadas/1590.html,ET,sin_categoria,discard,0.30,no_category_detected;price_parse_failed
1592,Azógue y Peixaria,,Aves > 700g,700.0,,,Desconocido,unknown,UNKNOWN,Azógue y Peixaria,Aves,,700g,700.00,,r,r700,700.0,False,original,700.0,700.0,1.0,default_1usd,,,,,,,,{},dataset/txt_limpios/1592.txt,dataset/paginas_descargadas/1592.html,ET,sin_categoria,discard,0.30,no_category_detected
215,Azógue y Peixaria,,"Aves > 1,4Kg",25.19,BRL,,Desconocido,unknown,BR,Azógue y Peixaria,Aves,,"1,4Kg",25.19,BRL,R$,"R$25,19",25.19,False,original,4.6237,4.6237,5.448,from_brasil_cambio_dolar,,,,,,,,{},dataset/txt_limpios/215.txt,dataset/paginas_descargadas/215.html,ET,sin_categoria,discard,0.30,no_category_detected
216,Azógue y Peixaria,,Aves > 1Kg,22.99,BRL,,Desconocido,unknown,BR,Azógue y Peixaria,Aves,,1Kg,22.99,BRL,R$,"R$22,99",22.99,False,original,4.2199,4.2199,5.448,from_brasil_cambio_dolar,,,,,,,,{},dataset/txt_limpios/216.txt,dataset/paginas_descargadas/216.html,ET,sin_categoria,discard,0.30,no_category_detected
217,Azógue y Peixaria,,Aves > 1Kg,26.99,BRL,,Desconocido,unknown,BR,Azógue y Peixaria,Aves,,1Kg,26.99,BRL,R$,"R$26,99",26.99,False,original,4.9541,4.9541,5.448,from_brasil_cambio_dolar,,,,,,,,{},dataset/txt_limpios/217.txt,dataset/paginas_descargadas/217.html,ET,sin_categoria,discard,0.30,no_category_detected
218,Azógue y Peixaria,,Aves > 700g,,,,Desconocido,unknown,UNKNOWN,Azógue y Peixaria,Aves,,700g,,,,,234.19,True,country_mean,,234.1938,1.0,default_1usd,,,,,,,,{},dataset/txt_limpios/218.txt,dataset/paginas_descargadas/218.html,ET,sin_categoria,discard,0.30,no_category_detected;price_parse_failed
219,Azógue y Peixaria,,Aves > 700g,700.0,,,Desconocido,unknown,UNKNOWN,Azógue y Peixaria,Aves,,700g,700.00,,r,r700,700.0,False,original,700.0,700.0,1.0,default_1usd,,,,,,,,{},dataset/txt_limpios/219.txt,dataset/paginas_descargadas/219.html,ET,sin_categoria,discard,0.30,no_category_detected
