{"source_id": "1045", "title": "colaborar con nuestros estudios para marketing. También puede configurarlas.", "description": "Información de la marca", "breadcrumbs": "que podemos ofrecer. > 900g", "price_raw": "16.92", "currency_raw": "PEN", "url": "", "seller": "Desconocido", "availability": "unknown", "country": "PE", "product_name": "colaborar con nuestros estudios para marketing. También puede configurarlas.", "brand": "que podemos ofrecer.", "reference": "", "unit": "900g", "price_amount": 16.92, "price_currency": "PEN", "price_symbol": "S/", "price_text": "S/16.92", "price_amount_filled": "16.92", "price_is_imputed": "False", "price_imputation_source": "original", "price_amount_usd": "4.7662", "price_amount_usd_filled": "4.7662", "fx_rate_local_per_usd": "3.55", "fx_source": "from_peru_cambio_dolar", "information_text": "", "description_text": "Información de la marca", "features_text": "Presentación/Empaque | Bolsa | Producto Preparado | No | Relleno | N.A | Alérgenos Declarados | Contiene gluten. | Azúcares Porción | 2.3 g | Carbohidratos Porción | 69.7 g | Grasas Porción | 1.7 g | Proteínas Porción | 12.9 g | Sodio Porción | 6.8 mg | Peso Neto (g) | 900 | Advertencias De Almacenamiento | Almacenar en lugar fresco y seco. | Denominación/Variedad | Carpeta | Revisa todo | Componentes del Producto | Vendido por | plaza Vea | En caso de que algo te guste: Puedes revisar nuestras | Políticas de cambios y/o devoluciones | y hacerlas efectivas en todas nuestras tiendas. | Productos | que te pueden interesar | Recomendado para ti", "specifications_text": "", "benefits_text": "", "details_text": "", "other_sections": "", "sections": {"Descripción": ["Información de la marca"], "Características": ["Presentación/Empaque", "Bolsa", "Producto Preparado", "No", "Relleno", "N.A", "Alérgenos Declarados", "Contiene gluten.", "Azúcar por porción", "2.3 g", "Carbohidratos Porción", "69.7 g", "Grasas Porción", "1.7 g", "Proteínas Porción", "12.9 g", "Sodio Porción", "6.8 mg", "Peso Neto (g)", "900", "Advertencias De Almacenamiento", "Almacenar en lugar fresco y seco.", "Denominación/Variedad", "Pasta", "Revisa todo", "Componentes del Producto", "Vendido por", "plazaVea", "En caso algo no vaya como gustes: Puedes revisar nuestras", "Politicas de cambios y/o devoluciones", "y hacerlas efectivas en todas nuestras tiendas.", "Productos", "que te pueden interesar", "Recomendado para ti"]}, "txt_path": "dataset/txt_limpios/1045.txt", "html_path": "dataset/paginas_descargadas/1045.html", "es_status": "ET", "category_canonical": "sin_categoria", "decision": "discard", "match_score": 0.3, "reasons": "no_category_detected"}
{"source_id": "1046", "title": "colaborar con nuestros estudios para marketing. También puede configurarlas.", "description": "Información de la marca", "breadcrumbs": "que podemos ofrecer. > 500g", "price_raw": "16.92", "currency_raw": "PEN", "url": "", "seller": "Desconocido", "availability": "unknown", "country": "PE", "product_name": "colaborar con nuestros estudios para marketing. También puede configurarlas.", "brand": "que podemos ofrecer.", "reference": "", "unit": "500g", "price_amount": 16.92, "price_currency": "PEN", "price_symbol": "S/", "price_text": "S/16.92", "price_amount_filled": "16.92", "price_is_imputed": "False", "price_imputation_source": "original", "price_amount_usd": "4.7662", "price_amount_usd_filled": "4.7662", "fx_rate_local_per_usd": "3.55", "fx_source": "from_peru_cambio_dolar", "information_text": "", "description_text": "Información de la marca", "features_text": "Presentación/Empaque | Caja | Producto Preparado | No | Porción sugerida | 85g | Tipo de Producto | Spaghetti | Alérgenos Declarados | Puede contener Soja y Huevo. | Calorías Por Porción | 305Kcal | Carbohidratos Por Porción | 58g | Grasas Porción | 1.6g | Proteínas Porción | 9.1g | Sodio Porción | 0mg | Advertencias De Almacenamiento | Almacenar en un lugar fresco y seco. | Contenido Neto | 500g | Denominación/Variedad | N°5 | Advertencias de consumo | Consumir antes de la fecha indicada en el envase. | Revisa todo | Importante destacar | Carpeta de fácil cocción | Conservar en lugar fresco y seco | Descripción del producto | FIDEOS Y PASTAS | plaza Vea | cuenta con una amplia variedad de | para que puedas elegir el que más se adecua a tus necesidades. | Dentro de los | encontramos | Jamón | y | Quesos | la combinación de ambos será un deleite en tu paladar. | Vino Tinto | .Por otro lado, si la salsa incluye albahaca, aceptada de oliva y queso parmesano , un | Vino Blanco | con elevada acidez y aromas de flores el frutas puede aportar un buen equilibrio de sabores. | *La imagen solo es referencial | Componentes del Producto | Vendido por | En caso de que algo no vaya como gustes: Puedes revisar nuestras | Políticas de cambios y/o devoluciones | y hacerlas efectivas en todas nuestras tiendas. | Productos | que te pueden interesar | Recomendado para ti", "specifications_text": "", "benefits_text": "", "details_text": "", "other_sections": "", "sections": {"Descripción": ["Información de la marca"], "Características": ["Presentación/Empaque", "Caja", "Producto Preparado", "No", "Porción sugerida", "85g", "Tipo De Producto", "Spaghetti", "Alérgenos Declarados", "Puede contener Soja y Huevo.", "Calorías Porción", "305Kcal", "Carbohidratos Porción", "58g", "Grasas Porción", "1.6g", "Proteínas Porción", "9.1g", "Sodio Porción", "0mg", "Advertencias De Almacenamiento", "Almacenar en un lugar fresco y seco.", "Contenido Neto", "500g", "Denominación/Variedad", "N°5", "Advertencias de consumo", "Consumir antes de la fecha indicada en el envase.", "Revisa todo", "Importante destacar", "Carpeta de fácil cocción", "Conservar en lugar fresco y seco", "Descripción del producto", "FIDEOS Y PASTAS", "plazaVea", "cuenta con una amplia variedad de", "para que puedas elegir qué más se adecua a tus necesidades.", "Dentro de los", "encontramos", "Jamón", "y", "Quesos", "la combinación de ambos será un deleite en tu paladar.", "Vino Tinto", ".Por otro lado, si la salsa incluye albahaca, aceite de oliva y queso parmesano , un", "Vino Blanco", "con elevada acidez y aromas de flores, las frutas pueden aportar un buen equilibrio de sabores.", "¡Conoce las distintas opciones en", "en plazaVea Online!", "*La imagen solo es referencial", "Componentes del Producto", "Vendido por", "En caso algo no vaya como gustes: Puedes revisar nuestras", "Politicas de cambios y/o devoluciones", "y hacerlas efectivas en todas nuestras tiendas.", "Productos", "que te pueden interesar", "Recomendado para ti"]}, "txt_path": "dataset/txt_limpios/1046.txt", "html_path": "dataset/paginas_descargadas/1046.html", "es_status": "ET", "category_canonical": "sin_categoria", "decision": "discard", "match_score": 0.3, "reasons": "no_category_detected"}
{"source_id": "1047", "title": "colaborar con nuestros estudios para marketing. También puede configurarlas.", "description": "Información de la marca", "breadcrumbs": "que podemos ofrecer. > 500g", "price_raw": "16.92", "currency_raw": "PEN", "url": "", "seller": "Desconocido", "availability": "unknown", "country": "PE", "product_name": "colaborar con nuestros estudios para marketing. También puede configurarlas.", "brand": "que podemos ofrecer.", "reference": "", "unit": "500g", "price_amount": 16.92, "price_currency": "PEN", "price_symbol": "S/", "price_text": "S/16.92", "price_amount_filled": "16.92", "price_is_imputed": "False", "price_imputation_source": "original", "price_amount_usd": "4.7662", "price_amount_usd_filled": "4.7662", "fx_rate_local_per_usd": "3.55", "fx_source": "from_peru_cambio_dolar", "information_text": "", "description_text": "Información de la marca", "features_text": "Revisa todo | Componentes del Producto | Vendido por | plazaVea | En caso algo no vaya como gustes: Puedes revisar nuestras | Politicas de cambios y/o devoluciones | y hacerlas efectivas en todas nuestras tiendas. | Productos | que te pueden interesar | Recomendado para ti", "specifications_text": "", "benefits_text": "", "details_text": "", "other_sections": "", "sections": {"Descripción": ["Información de la marca"], "Características": ["Revisa todo", "Componentes del Producto", "Vendido por", "plazaVea", "En caso algo no vaya como gustes: Puedes revisar nuestras", "Politicas de cambios y/o devoluciones", "y hacerlas efectivas en todas nuestras tiendas.", "Productos", "que te pueden interesar", "Recomendado para ti"]}, "txt_path": "dataset/txt_limpios/1047.txt", "html_path": "dataset/paginas_descargadas/1047.html", "es_status": "EN", "category_canonical": "sin_categoria", "decision": "discard", "match_score": 0.3, "reasons": "no_category_detected"}
{"source_id": "1048", "title": "colaborar con nuestros estudios para marketing. También puede configurarlas.", "description": "Presentación/Empaque | Lata | Porción Sugerida | 100g | Azúcares Porción | sin azucar añadida | Calorías Porción | 150 kcal por Porción | 0 | Contenido Escurrido | 100 g | Descripción Nutricional | Especificado en ficha tecnica | Grasas Porción | 4.5 g | Medio De Conservación | Lugar Fresco y Seco | Proteínas Porción | 27 g | Sodio Porción | 410 mg | Advertencias De Almacenamiento | Contenido Neto | 140 g | Denominación/Variedad | Filete de Atun en Aceite Vegetal 140 g | | Filete de Atun en Aceite Vegetal 140 g | En caso de que algo te guste: Puedes revisar nuestras | Políticas de cambios y/o devoluciones | y hacerlas efectivas en todas nuestras tiendas. | Productos | que te pueden interesar | Recomendado para ti", "breadcrumbs": "que podemos ofrecer. > 140g", "price_raw": "16.92", "currency_raw": "PEN", "url": "", "seller": "Desconocido", "availability": "unknown", "country": "PE", "product_name": "colaborar con nuestros estudios para marketing. También puede configurarlas.", "brand": "que podemos ofrecer.", "reference": "", "unit": "140g", "price_amount": 16.92, "price_currency": "PEN", "price_symbol": "S/", "price_text": "S/16.92", "price_amount_filled": "16.92", "price_is_imputed": "False", "price_imputation_source": "original", "price_amount_usd": "4.7662", "price_amount_usd_filled": "4.7662", "fx_rate_local_per_usd": "3.55", "fx_source": "from_peru_cambio_dolar", "information_text": "", "description_text": "", "features_text": "", "specifications_text": "Presentación/Empaque | Lata | Porción Sugerida | 100g | Azúcares Porción | sin azucar añadida | Calorías Porción | 150 kcal por Porción | 0 | Contenido Escurrido | 100 g | Descripción Nutricional | Especificado en ficha tecnica | Grasas Porción | 4.5 g | Medio De Conservación | Lugar Fresco y Seco | Proteínas Porción | 27 g | Sodio Porción | 410 mg | Advertencias De Almacenamiento | Contenido Neto | 140 g | Denominación/Variedad | Filete de Atun en Aceite Vegetal 140 g | | Filete de Atun en Aceite Vegetal 140 g | En caso de que algo te guste: Puedes revisar nuestras | Políticas de cambios y/o devoluciones | y hacerlas efectivas en todas nuestras tiendas. | Productos | que te pueden interesar | Recomendado para ti", "benefits_text": "", "details_text": "", "other_sections": "", "sections": {"Especificaciones": ["Presentación/Empaque", "Lata", "Porción sugerida", "100g", "Azúcar por porción", "sin azucar añadida", "Calorías Porción", "150 kcal por 100 g", "Carbohidratos Porción", "0", "Contenido Escurrido", "100 g", "Descripción Nutricional", "Especificado en ficha tecnica", "Grasas Porción", "4.5 g", "Medio de conservación", "Lugar Fresco y Seco", "Proteínas Porción", "27 g", "Sodio Porción", "410 mg", "Advertencias De Almacenamiento", "Contenido Neto", "140 g", "Denominación/Variedad", "Filete de Atun en Aceite Vegetal 140 g", "En caso algo no vaya como gustes: Puedes revisar nuestras", "Politicas de cambios y/o devoluciones", "y hacerlas efectivas en todas nuestras tiendas.", "Productos", "que te pueden interesar", "Recomendado para ti"]}, "txt_path": "dataset/txt_limpios/1048.txt", "html_path": "dataset/paginas_descargadas/1048.html", "es_status": "ET", "category_canonical": "atun", "decision": "keep", "match_score": 0.6, "reasons": "heuristic_default"}
{"source_id": "1049", "title": "colaborar con nuestros estudios para marketing. También puede configurarlas.", "description": "Información de la marca", "breadcrumbs": "que podemos ofrecer. > 150g", "price_raw": "16.92", "currency_raw": "PEN", "url": "", "seller": "Desconocido", "availability": "unknown", "country": "PE", "product_name": "colaborar con nuestros estudios para marketing. También puede configurarlas.", "brand": "que podemos ofrecer.", "reference": "", "unit": "150g", "price_amount": 16.92, "price_currency": "PEN", "price_symbol": "S/", "price_text": "S/16.92", "price_amount_filled": "16.92", "price_is_imputed": "False", "price_imputation_source": "original", "price_amount_usd": "4.7662", "price_amount_usd_filled": "4.7662", "fx_rate_local_per_usd": "3.55", "fx_source": "from_peru_cambio_dolar", "information_text": "", "description_text": "Información de la marca", "features_text": "Presentación/Empaque | Lata | Porción sugerida | 2 | Alérgenos Declarados | Atun , aceptado vegetal (soya) | Azúcares Porción | 0g/ 100g | Calorías Porción | 268.2 Kcal/100g | Carbohidratos Por Porción | Certificaciones | safe | Contenido Escurrido | 105gr | Descripción Nutricional | Contiene Omega 3. | Grasas Porción | 20.8 g/100g | Medio De Conservación | Aceite vegetal | Proteínas Porción | 20.3g/100g | Sodio Porción | 269 mg/100 g | Advertencias De Almacenamiento | Mantener en un lugar fresco y seco,refrigerar una vez abierto | Contenido Neto | 150gr | Denominación/Variedad | Filete Campomar | Revisa todo | Componentes del Producto | Vendido por | plaza Vea | En caso de que algo te guste: Puedes revisar nuestras | Políticas de cambios y/o devoluciones | y hacerlas efectivas en todas nuestras tiendas. | Productos | que te pueden interesar | Recomendado para ti", "specifications_text": "", "benefits_text": "", "details_text": "", "other_sections": "", "sections": {"Descripción": ["Información de la marca"], "Características": ["Presentación/Empaque", "Lata", "Porción sugerida", "2", "Alérgenos Declarados", "Atun , aceite vegetal (soya)", "Azúcar por porción", "0g / 100g", "Calorías Porción", "268.2 Kcal/100g", "Carbohidratos Porción", "Certificaciones", "safe", "Contenido Escurrido", "105gr", "Descripción Nutricional", "Contiene Omega 3.", "Grasas Porción", "20.8 g/100g", "Medio de conservación", "Aceite vegetal", "Proteínas Porción", "20.3g/100g", "Sodio Porción", "269 mg/100 g", "Advertencias De Almacenamiento", "Mantener en un lugar fresco y seco,refrigerar una vez abierto", "Contenido Neto", "150gr", "Denominación/Variedad", "Filete Campomar", "Revisa todo", "Componentes del Producto", "Vendido por", "plazaVea", "En caso algo no vaya como gustes: Puedes revisar nuestras", "Politicas de cambios y/o devoluciones", "y hacerlas efectivas en todas nuestras tiendas.", "Productos", "que te pueden interesar", "Recomendado para ti"]}, "txt_path": "dataset/txt_limpios/1049.txt", "html_path": "dataset/paginas_descargadas/1049.html", "es_status": "ET", "category_canonical": "sin_categoria", "decision": "discard", "match_score": 0.3, "reasons": "no_category_detected"}
{"source_id": "1050", "title": "colaborar con nuestros estudios para marketing. También puede configurarlas.", "description": "Información de la marca", "breadcrumbs": "que podemos ofrecer. > 150gr", "price_raw": "16.92", "currency_raw": "PEN", "url": "", "seller": "Desconocido", "availability": "unknown", "country": "PE", "product_name": "colaborar con nuestros estudios para marketing. También puede configurarlas.", "brand": "que podemos ofrecer.", "reference": "", "unit": "150gr", "price_amount": 16.92, "price_currency": "PEN", "price_symbol": "S/", "price_text": "S/16.92", "price_amount_filled": "16.92", "price_is_imputed": "False", "price_imputation_source": "original", "price_amount_usd": "4.7662", "price_amount_usd_filled": "4.7662", "fx_rate_local_per_usd": "3.55", "fx_source": "from_peru_cambio_dolar", "information_text": "", "description_text": "Información de la marca", "features_text": "Presentación/Empaque | Lata | Porción sugerida | 100 g | Alérgenos Declarados | CONTIENE PESCADO Y SOYA | Calorías Porción | 133.3 | Certificaciones | DOLPHIN SAFE | Contenido Escurrido | Grasas Porción | 2.3 | Medio De Conservación | UNA VEZ ABIERTO EL ENVASE, TRANSVASAR EL CONTENIDO A OTRO RECIPIENTE CON TAPA Y MANTENER EN REFRIGERACION | Proteínas Porción | 28.1 | Advertencias De Almacenamiento | ALMACENAR EN LUGAR FRESCO Y SECO A TEMPERATURA AMBIENTE | Contenido Neto | 150 g | Denominación/Variedad | BELL'S TROZOS ATUN EN ACEITE LA 150GR | Revisa todo | Componentes del Producto | Vendido por | plaza Vea | En caso de que algo te guste: Puedes revisar nuestras | Políticas de cambios y/o devoluciones | y hacerlas efectivas en todas nuestras tiendas. | Productos | que te pueden interesar | Recomendado para ti", "specifications_text": "", "benefits_text": "", "details_text": "", "other_sections": "", "sections": {"Descripción": ["Información de la marca"], "Características": ["Presentación/Empaque", "Lata", "Porción sugerida", "100 g", "Alérgenos Declarados", "CONTIENE PESCADO Y SOYA", "Calorías Porción", "133.3", "Certificaciones", "DOLPHIN SAFE", "Contenido Escurrido", "Grasas Porción", "2.3", "Medio de conservación", "UNA VEZ ABIERTO EL ENVASE, TRANSVASAR EL CONTENIDO A OTRO RECIPIENTE CON TAPA Y MANTENER EN REFRIGERACION", "Proteínas Porción", "28.1", "Advertencias De Almacenamiento", "ALMACENAR EN LUGAR FRESCO Y SECO A TEMPERATURA AMBIENTE", "Contenido Neto", "150 g", "Denominación/Variedad", "BELL'S TROZOS ATUN EN ACEITE LA 150GR", "Revisa todo", "Componentes del Producto", "Vendido por", "plazaVea", "En caso algo no vaya como gustes: Puedes revisar nuestras", "Politicas de cambios y/o devoluciones", "y hacerlas efectivas en todas nuestras tiendas.", "Productos", "que te pueden interesar", "Recomendado para ti"]}, "txt_path": "dataset/txt_limpios/1050.txt", "html_path": "dataset/paginas_descargadas/1050.html", "es_status": "ET", "category_canonical": "sin_categoria", "decision": "discard", "match_score": 0.3, "reasons": "no_category_detected"}
{"source_id": "1051", "title": "colaborar con nuestros estudios para marketing. También puede configurarlas.", "description": "Información de la marca", "breadcrumbs": "que podemos ofrecer. > 140g", "price_raw": "16.92", "currency_raw": "PEN", "url": "", "seller": "Desconocido", "availability": "unknown", "country": "PE", "product_name": "colaborar con nuestros estudios para marketing. También puede configurarlas.", "brand": "que podemos ofrecer.", "reference": "", "unit": "140g", "price_amount": 16.92, "price_currency": "PEN", "price_symbol": "S/", "price_text": "S/16.92", "price_amount_filled": "16.92", "price_is_imputed": "False", "price_imputation_source": "original", "price_amount_usd": "4.7662", "price_amount_usd_filled": "4.7662", "fx_rate_local_per_usd": "3.55", "fx_source": "from_peru_cambio_dolar", "information_text": "", "description_text": "Información de la marca", "features_text": "Presentación/Empaque | Lata | Porción sugerida | 100 GR | Alérgenos Declarados | Sí | Azúcares Porción | 113 | Carbohidratos Porción | Descripción Nutricional | OBTENIDA POR DIGESA | Proteínas Porción | 26.3 GR | Sodio Porción | 249 GR | Advertencias De Almacenamiento | Mantener la temperatura ambiente/ conservar en un lugar fresco | Contenido Neto | 140G | Denominación/Variedad | GLORIA, CONSERVAS, PESCADO, ALIMENTO, FILETE, ATÚN, AGUA, LATA | Revisa todo | Componentes del Producto | Vendido por | plaza Vea | En caso de que algo te guste: Puedes revisar nuestras | Políticas de cambios y/o devoluciones | y hacerlas efectivas en todas nuestras tiendas. | Productos | que te pueden interesar | Recomendado para ti", "specifications_text": "", "benefits_text": "", "details_text": "", "other_sections": "", "sections": {"Descripción": ["Información de la marca"], "Características": ["Presentación/Empaque", "Lata", "Porción sugerida", "100 GR", "Alérgenos Declarados", "Sí", "Azúcar por porción", "0", "Calorías Porción", "113", "Carbohidratos Porción", "Descripción Nutricional", "OBTENIDA POR DIGESA", "Proteínas Porción", "26.3 GR", "Sodio Porción", "249 GR", "Advertencias De Almacenamiento", "Mantener a temperatura ambiente/ conservar en un lugar fresco", "Contenido Neto", "140G", "Denominación/Variedad", "GLORIA, CONSERVAS, PESCADO, ALIMENTO, FILETE, ATÚN, AGUA, LATA", "Revisa todo", "Componentes del Producto", "Vendido por", "plazaVea", "En caso algo no vaya como gustes: Puedes revisar nuestras", "Politicas de cambios y/o devoluciones", "y hacerlas efectivas en todas nuestras tiendas.", "Productos", "que te pueden interesar", "Recomendado para ti"]}, "txt_path": "dataset/txt_limpios/1051.txt", "html_path": "dataset/paginas_descargadas/1051.html", "es_status": "ET", "category_canonical": "sin_categoria", "decision": "discard", "match_score": 0.3, "reasons": "no_category_detected"}
