{"source_id": "612", "title": "DALE VIDA A TU JARDIN", "description": "Datos técnicos Descripción del producto ¡Suscribite a nuestro boletín! Recibí las ofertas y novedades en tu correo. Suscribirme Seguridad y confianza © Libertad 2023. Todos los derechos reservados. Términos y Condiciones Direcciôn General de Defensa y protecciôn al Consumidor, para consultas y/o denuncias ingresa a los Términos más buscados 1. leche 2. cerveza 3. aceptada 4. yerba 5. cafe 6. pañales 7. queso 8. arroz 9. fideos 10. fernet", "breadcrumbs": "🌷🌻​🌼​", "price_raw": "904.07", "currency_raw": "ARS", "url": "", "seller": "Desconocido", "availability": "unknown", "country": "AR", "product_name": "DALE VIDA A TU JARDIN", "brand": "🌷🌻​🌼​", "reference": "", "unit": "", "price_amount": 904.07, "price_currency": "ARS", "price_symbol": "$", "price_text": "$904,07", "price_amount_filled": "904.07", "price_is_imputed": "False", "price_imputation_source": "original", "price_amount_usd": "0.7204", "price_amount_usd_filled": "0.7204", "fx_rate_local_per_usd": "1255.0", "fx_source": "from_argentina_cambio_dolar", "information_text": "", "description_text": "Datos técnicos Descripción del producto ¡Suscribite a nuestro boletín! Recibí las ofertas y novedades en tu correo. Suscribirme Seguridad y confianza © Libertad 2023. Todos los derechos reservados. Términos y Condiciones Direcciôn General de Defensa y protecciôn al Consumidor, para consultas y/o denuncias ingresa a los Términos más buscados 1. leche 2. cerveza 3. aceptada 4. yerba 5. cafe 6. pañales 7. queso 8. arroz 9. fideos 10. fernet", "features_text": "", "specifications_text": "", "benefits_text": "", "details_text": "", "other_sections": "", "sections": {"Descripción": ["Datos técnicos", "Descripción del producto", "¡Suscribite a nuestro newsletter!", "Recibí las ofertas y novedades en tu correo.", "Suscribirme", "Seguridad y confianza", "© Libertad 2023. Todos los derechos reservados.", "Términos y Condiciones", "Dirección General de Defensa y Protección al Consumidor para consultas y/o denuncias", "introduzca aquí", "Términos más buscados", "1.", "leche", "2.", "cerveza", "3.", "aceite", "4.", "yerba", "5.", "cafe", "6.", "pañales", "7.", "queso", "8.", "arroz", "9.", "fideos", "10.", "fernet"]}, "txt_path": "dataset/txt_limpios/612.txt", "html_path": "dataset/paginas_descargadas/612.html", "es_status": "ET", "category_canonical": "cafe", "decision": "keep", "match_score": 0.6, "reasons": "heuristic_default"}
{"source_id": "613", "title": "DALE VIDA A TU JARDIN", "description": "Datos técnicos Descripción del producto ¡Suscribite a nuestro boletín! Recibí las ofertas y novedades en tu correo. Suscribirme Seguridad y confianza © Libertad 2023. Todos los derechos reservados. Términos y Condiciones Direcciôn General de Defensa y protecciôn al Consumidor, para consultas y/o denuncias ingresa a los Términos más buscados 1. leche 2. cerveza 3. aceptada 4. yerba 5. cafe 6. pañales 7. queso 8. arroz 9. fideos 10. fernet", "breadcrumbs": "🌷🌻​🌼​ > 600G", "price_raw": "6420.66", "currency_raw": "ARS", "url": "", "seller": "Desconocido", "availability": "unknown", "country": "AR", "product_name": "DALE VIDA A TU JARDIN", "brand": "🌷🌻​🌼​", "reference": "", "unit": "600G", "price_amount": 6420.66, "price_currency": "ARS", "price_symbol": "$", "price_text": "$6.420,66", "price_amount_filled": "6420.66", "price_is_imputed": "False", "price_imputation_source": "original", "price_amount_usd": "5.1161", "price_amount_usd_filled": "5.1161", "fx_rate_local_per_usd": "1255.0", "fx_source": "from_argentina_cambio_dolar", "information_text": "", "description_text": "Datos técnicos Descripción del producto ¡Suscribite a nuestro boletín! Recibí las ofertas y novedades en tu correo. Suscribirme Seguridad y confianza © Libertad 2023. Todos los derechos reservados. Términos y Condiciones Direcciôn General de Defensa y protecciôn al Consumidor, para consultas y/o denuncias ingresa a los Términos más buscados 1. leche 2. cerveza 3. aceptada 4. yerba 5. cafe 6. pañales 7. queso 8. arroz 9. fideos 10. fernet", "features_text": "", "specifications_text": "", "benefits_text": "", "details_text": "", "other_sections": "", "sections": {"Descripción": ["Datos técnicos", "Descripción del producto", "¡Suscribite a nuestro newsletter!", "Recibí las ofertas y novedades en tu correo.", "Suscribirme", "Seguridad y confianza", "© Libertad 2023. Todos los derechos reservados.", "Términos y Condiciones", "Dirección General de Defensa y Protección al Consumidor para consultas y/o denuncias", "introduzca aquí", "Términos más buscados", "1.", "leche", "2.", "cerveza", "3.", "aceite", "4.", "yerba", "5.", "cafe", "6.", "pañales", "7.", "queso", "8.", "arroz", "9.", "fideos", "10.", "fernet"]}, "txt_path": "dataset/txt_limpios/613.txt", "html_path": "dataset/paginas_descargadas/613.html", "es_status": "ET", "category_canonical": "cafe", "decision": "keep", "match_score": 0.6, "reasons": "heuristic_default"}
{"source_id": "614", "title": "DALE VIDA A TU JARDIN", "description": "Datos técnicos Descripción del producto ¡Suscribite a nuestro boletín! Recibí las ofertas y novedades en tu correo. Suscribirme Seguridad y confianza © Libertad 2023. Todos los derechos reservados. Términos y Condiciones Direcciôn General de Defensa y protecciôn al Consumidor, para consultas y/o denuncias ingresa a los Términos más buscados 1. leche 2. cerveza 3. aceptada 4. yerba 5. cafe 6. pañales 7. queso 8. arroz 9. fideos 10. fernet", "breadcrumbs": "🌷🌻​🌼​ > 500G", "price_raw": "2257.92", "currency_raw": "ARS", "url": "", "seller": "Desconocido", "availability": "unknown", "country": "AR", "product_name": "DALE VIDA A TU JARDIN", "brand": "🌷🌻​🌼​", "reference": "", "unit": "500G", "price_amount": 2257.92, "price_currency": "ARS", "price_symbol": "$", "price_text": "$2.257,92", "price_amount_filled": "2257.92", "price_is_imputed": "False", "price_imputation_source": "original", "price_amount_usd": "1.7991", "price_amount_usd_filled": "1.7991", "fx_rate_local_per_usd": "1255.0", "fx_source": "from_argentina_cambio_dolar", "information_text": "", "description_text": "Datos técnicos Descripción del producto ¡Suscribite a nuestro boletín! Recibí las ofertas y novedades en tu correo. Suscribirme Seguridad y confianza © Libertad 2023. Todos los derechos reservados. Términos y Condiciones Direcciôn General de Defensa y protecciôn al Consumidor, para consultas y/o denuncias ingresa a los Términos más buscados 1. leche 2. cerveza 3. aceptada 4. yerba 5. cafe 6. pañales 7. queso 8. arroz 9. fideos 10. fernet", "features_text": "", "specifications_text": "", "benefits_text": "", "details_text": "", "other_sections": "", "sections": {"Descripción": ["Datos técnicos", "Descripción del producto", "¡Suscribite a nuestro newsletter!", "Recibí las ofertas y novedades en tu correo.", "Suscribirme", "Seguridad y confianza", "© Libertad 2023. Todos los derechos reservados.", "Términos y Condiciones", "Dirección General de Defensa y Protección al Consumidor para consultas y/o denuncias", "introduzca aquí", "Términos más buscados", "1.", "leche", "2.", "cerveza", "3.", "aceite", "4.", "yerba", "5.", "cafe", "6.", "pañales", "7.", "queso", "8.", "arroz", "9.", "fideos", "10.", "fernet"]}, "txt_path": "dataset/txt_limpios/614.txt", "html_path": "dataset/paginas_descargadas/614.html", "es_status": "ET", "category_canonical": "cafe", "decision": "keep", "match_score": 0.6, "reasons": "heuristic_default"}
{"source_id": "1704", "title": "Desayuno y Dulces", "description": "Café Colina Tostado Molido Juan Valdez 250g | Actualizado al: 20-05-2025 Ingredientes: 100% café de colombiano tipo exportación, Café arábica. Certificados: Apto para APLV Libre de Lactosa Vegano Vegetariano Libre de Soya Libre de Huevo Libre de Peces Libre de Mariscos Libre de Maní Libre de Frutas Secos Libre de Nueces Libre de Sulfitos Libre de Trigo Kosher Importante: La información del empaque y/o contenido del producto final puede diferir respecto a lo que mostramos en nuestro sitio web, tanto a nivel de ingredientes, trazas, información nutricional, sellos, modo de uso y/o modo de conservación. Usted debe basarse únicamente en la información que se muestra en nuestro sitio web y siempre debe leer las etiquetas, advertencias y instrucciones antes de usar el consumo de un producto. Información obtenida de CAFE COLINA MOLIDO 250 GRS. Productos similares Café Grano Molido Cumbre (Fuerte) Ver producto Café grano volcán (fuerte) Café grano molido moka monterrey -18% Café Liofilizado Café Grano Moka CAFE GRANO ORO HAUSBRANDT 500 GR Café Grano Molido Copacabana 100% Arábico 250 g Café en Grano One Love Marley Coffee 227 g Cafe Grano Molido Buffalo Soilder Organico Café en Grano Catch Fire Marley Coffee 227 g Café Molido Caramel Nut Cream Marley Coffee 227 g Café Moka Super Molido Café French Vanilla Marley Coffee 227 g Café Molido Caribbean Soul Marley Coffee 227 g Café Molido Intenso -14% ¡Juntos son mejores! Café instantáneo en polvo Cappucino Vainilla Juan Valdez 6 Sobres Café Liofilizado Clásico Juan Valdez 40 g Café Instantáneo en Polvo Cappucino Avellana Juan Valdez 6 Sobres Cápsulas de Café Juan Valdez Paisaje 8 un Cápsulas de Café Juan Valdez Orgánico 8 un Café Dulce De Leche Liof. Juan Valdez 95 grs. Café instantáneo en polvo Cappucino Juan Valdez 6 Sobres Café Instantáneo en Polvo Mocaccino Juan Valdez 6 Sobres Cápsulas de Café Juan Valdez Mujeres 8 un Café Soluble Liofilizado Clásico Café Soluble Liofilizado Descafeinado 95g Café Avellana Liof. Juan Valdez Café Soluble Liofilizado Vanicanela 95g Café Soluble Liofilizado Chocolate Café Soluble Liofilizado Clásico 190g Café Soluble Liofilizado Clásico 50g", "breadcrumbs": "Café > 250 GR", "price_raw": "13.45", "currency_raw": "", "url": "", "seller": "Desconocido", "availability": "unknown", "country": "UNKNOWN", "product_name": "Desayuno y Dulces", "brand": "Café", "reference": "", "unit": "250 GR", "price_amount": 13.45, "price_currency": "", "price_symbol": "", "price_text": "13.45", "price_amount_filled": "13.45", "price_is_imputed": "False", "price_imputation_source": "original", "price_amount_usd": "13.45", "price_amount_usd_filled": "13.45", "fx_rate_local_per_usd": "1.0", "fx_source": "default_1usd", "information_text": "", "description_text": "Café Colina Tostado Molido Juan Valdez 250g | Actualizado al: 20-05-2025 Ingredientes: 100% café de colombiano tipo exportación, Café arábica. Certificados: Apto para APLV Libre de Lactosa Vegano Vegetariano Libre de Soya Libre de Huevo Libre de Peces Libre de Mariscos Libre de Maní Libre de Frutas Secos Libre de Nueces Libre de Sulfitos Libre de Trigo Kosher Importante: La información del empaque y/o contenido del producto final puede diferir respecto a lo que mostramos en nuestro sitio web, tanto a nivel de ingredientes, trazas, información nutricional, sellos, modo de uso y/o modo de conservación. Usted debe basarse únicamente en la información que se muestra en nuestro sitio web y siempre debe leer las etiquetas, advertencias y instrucciones antes de usar el consumo de un producto. Información obtenida de CAFE COLINA MOLIDO 250 GRS. Productos similares Café Grano Molido Cumbre (Fuerte) Ver producto Café grano volcán (fuerte) Café grano molido moka monterrey -18% Café Liofilizado Café Grano Moka CAFE GRANO ORO HAUSBRANDT 500 GR Café Grano Molido Copacabana 100% Arábico 250 g Café en Grano One Love Marley Coffee 227 g Cafe Grano Molido Buffalo Soilder Organico Café en Grano Catch Fire Marley Coffee 227 g Café Molido Caramel Nut Cream Marley Coffee 227 g Café Moka Super Molido Café French Vanilla Marley Coffee 227 g Café Molido Caribbean Soul Marley Coffee 227 g Café Molido Intenso -14% ¡Juntos son mejores! Café instantáneo en polvo Cappucino Vainilla Juan Valdez 6 Sobres Café Liofilizado Clásico Juan Valdez 40 g Café Instantáneo en Polvo Cappucino Avellana Juan Valdez 6 Sobres Cápsulas de Café Juan Valdez Paisaje 8 un Cápsulas de Café Juan Valdez Orgánico 8 un Café Dulce De Leche Liof. Juan Valdez 95 grs. Café instantáneo en polvo Cappucino Juan Valdez 6 Sobres Café Instantáneo en Polvo Mocaccino Juan Valdez 6 Sobres Cápsulas de Café Juan Valdez Mujeres 8 un Café Soluble Liofilizado Clásico Café Soluble Liofilizado Descafeinado 95g Café Avellana Liof. Juan Valdez Café Soluble Liofilizado Vanicanela 95g Café Soluble Liofilizado Chocolate Café Soluble Liofilizado Clásico 190g Café Soluble Liofilizado Clásico 50g", "features_text": "", "specifications_text": "", "benefits_text": "", "details_text": "", "other_sections": "", "sections": {"Descripción": ["Café Colina Tostado Molido Juan Valdez", "250g | Actualizado al: 20-05-2025", "Ingredientes: 100% café de colombiano tipo exportación, Café arábica.", "Certificados: Apto para APLV", "Libre de Lactosa", "Vegano", "Vegetariano", "Libre de Soya", "Libre de Huevo", "Libre de Peces", "Libre de Mariscos", "Libre de Maní", "Libre de Frutos Secos", "Libre de Nueces", "Libre de Sulfitos", "Libre de Trigo", "Kosher", "Importante: La información del empaque y/o contenido del producto final puede diferir respecto a lo que mostramos en nuestro sitio web, tanto a nivel de ingredientes, trazas, información nutricional, sellos, modo de uso y/o modo de conservación. Usted debe basarse únicamente en la información que se muestra en nuestro sitio web y siempre debe leer las etiquetas, advertencias y instrucciones antes de usar el consumo de un producto.", "Información obtenida de", "CAFE COLINA MOLIDO 250 GRS.", "Productos similares", "Café Grano Molido Cumbre (Fuerte)", "Ver producto", "Café grano volcán (fuerte)", "Cafe grano molido moka monterrey", "-18%", "Café Liofilizado", "Café Grano Moka", "CAFE GRANO ORO HAUSBRANDT 500 GR", "Café Grano Molido Copacabana 100% Arábico 250 g", "Café en Grano One Love Marley Coffee 227 g", "Cafe Grano Molido Buffalo Soilder Organico", "Café en Grano Catch Fire Marley Coffee 227 g", "Café Molido Caramel Nut Cream Marley Coffee 227 g", "Café Moka Super Molido", "Café Molido French Vanilla Marley Coffee 227 g", "Café Molido Caribbean Soul Marley Coffee 227 g", "Café Molido Intenso", "-14%", "¡Juntos son mejores!", "Café Instantáneo en Polvo Cappucino Vainilla Juan Valdez 6 Sobres", "Café Liofilizado Clásico Juan Valdez 40 g", "Café Instantáneo en Polvo Cappucino Avellana Juan Valdez 6 Sobres", "Cápsulas de Café Juan Valdez Paisaje 8 un", "Cápsulas de Café Juan Valdez Orgánico 8 un", "Cafe Dulce De Leche Liof. Juan Valdez 95  grs.", "Café Instantáneo en Polvo Cappucino Juan Valdez 6 Sobres", "Café Instantáneo en Polvo Mocaccino Juan Valdez 6 Sobres", "Cápsulas de Café Juan Valdez Mujeres 8 un", "Café Soluble Liofilizado Clásico", "Café Soluble Liofilizado Descafeinado 95g", "Cafe Avellana Liof. Juan Valdez", "Café Soluble Liofilizado Vanicanela 95g", "Café Soluble Liofilizado Chocolate", "Café Soluble Liofilizado Clásico 190g", "Café Soluble Liofilizado Clásico 50g"]}, "txt_path": "dataset/txt_limpios/1704.txt", "html_path": "dataset/paginas_descargadas/1704.html", "es_status": "ET", "category_canonical": "cafe", "decision": "keep", "match_score": 0.6, "reasons": "heuristic_default"}
{"source_id": "1706", "title": "Desayuno y Dulces", "description": "Café Tostado y Molido Tottus 250g | Actualizado al: 24-05-2025 Ingredientes: Café 100%. Certificados: Apto para APLV Libre de Lactosa Vegano Vegetariano Libre de Soya Libre de Huevo Libre de Peces Libre de Mariscos Libre de Maní Libre de Frutas Secos Libre de Nueces Libre de Sulfitos Libre de Trigo Porción: 6 G (6g) Porciones por envase: 42 100g 1 Porción Energía (kCal) 428 25.7 Proteínas (g) 17 1 Grasas Totales 9.9 0.6 Hhidratos de carbono disponibles 68 4.1 Azúcar total (g) 0 Sodio (mg) 12 0.7 Importante: La información del empaque y/o contenido del producto final puede diferir respecto a lo que mostramos en nuestro sitio web, tanto a nivel de ingredientes, trazas, información nutricional, sellos, modo de uso y/o modo de conservación. Usted debe basarse únicamente en la información que se muestra en nuestro sitio web y siempre debe leer las etiquetas, advertencias y instrucciones antes de usar el consumo de un producto. Información obtenida de productos similares CAFE MOLIDO TOTTUS 500 G Ver producto Café Molido Intenso -14% Café Molido Balanceado CAFE EXPRESS MOLIDO 250 GRS. CAP CAFE DESCAFEINAD TOTTUS PREMIUM 50 G -25% Café Grano Molido Copacabana 100% Arábico 250 g Café Molido French Vanilla Marley Coffee 227 g Cápsula Café Ristretto Cápsula Café Lungo Café Marley Cappuccino de Vainilla 160 g + Mug Café Moka Super Molido Café Molido Caribbean Soul Marley Coffee 227 g Cápsula Café Puro Arábica Café Granulado ¡Juntos son mejores! Azúcar Rubia", "breadcrumbs": "Café > 250 G", "price_raw": "3.99", "currency_raw": "", "url": "", "seller": "Desconocido", "availability": "unknown", "country": "UNKNOWN", "product_name": "Desayuno y Dulces", "brand": "Café", "reference": "", "unit": "250 G", "price_amount": 3.99, "price_currency": "", "price_symbol": "", "price_text": "3.99", "price_amount_filled": "3.99", "price_is_imputed": "False", "price_imputation_source": "original", "price_amount_usd": "3.99", "price_amount_usd_filled": "3.99", "fx_rate_local_per_usd": "1.0", "fx_source": "default_1usd", "information_text": "", "description_text": "Café Tostado y Molido Tottus 250g | Actualizado al: 24-05-2025 Ingredientes: Café 100%. Certificados: Apto para APLV Libre de Lactosa Vegano Vegetariano Libre de Soya Libre de Huevo Libre de Peces Libre de Mariscos Libre de Maní Libre de Frutas Secos Libre de Nueces Libre de Sulfitos Libre de Trigo Porción: 6 G (6g) Porciones por envase: 42 100g 1 Porción Energía (kCal) 428 25.7 Proteínas (g) 17 1 Grasas Totales 9.9 0.6 Hhidratos de carbono disponibles 68 4.1 Azúcar total (g) 0 Sodio (mg) 12 0.7 Importante: La información del empaque y/o contenido del producto final puede diferir respecto a lo que mostramos en nuestro sitio web, tanto a nivel de ingredientes, trazas, información nutricional, sellos, modo de uso y/o modo de conservación. Usted debe basarse únicamente en la información que se muestra en nuestro sitio web y siempre debe leer las etiquetas, advertencias y instrucciones antes de usar el consumo de un producto. Información obtenida de productos similares CAFE MOLIDO TOTTUS 500 G Ver producto Café Molido Intenso -14% Café Molido Balanceado CAFE EXPRESS MOLIDO 250 GRS. CAP CAFE DESCAFEINAD TOTTUS PREMIUM 50 G -25% Café Grano Molido Copacabana 100% Arábico 250 g Café Molido French Vanilla Marley Coffee 227 g Cápsula Café Ristretto Cápsula Café Lungo Café Marley Cappuccino de Vainilla 160 g + Mug Café Moka Super Molido Café Molido Caribbean Soul Marley Coffee 227 g Cápsula Café Puro Arábica Café Granulado ¡Juntos son mejores! Azúcar Rubia", "features_text": "", "specifications_text": "", "benefits_text": "", "details_text": "", "other_sections": "", "sections": {"Descripción": ["Café Tostado y Molido Tottus", "250g | Actualizado al: 24-05-2025", "Ingredientes: Café 100%.", "Certificados: Apto para APLV", "Libre de Lactosa", "Vegano", "Vegetariano", "Libre de Soya", "Libre de Huevo", "Libre de Peces", "Libre de Mariscos", "Libre de Maní", "Libre de Frutos Secos", "Libre de Nueces", "Libre de Sulfitos", "Libre de Trigo", "Porción: 6 G (6g)", "Porciones por envase: 42", "100g", "1 Porción", "Energía", "(kCal)", "428", "25.7", "Proteínas", "(g)", "17", "1", "Grasas Totales", "9.9", "0.6", "Hidratos de carbono disponibles", "68", "4.1", "Azúcar total (g)", "0", "Sodio", "(mg)", "12", "0.7", "Importante: La información del empaque y/o contenido del producto final puede diferir respecto a lo que mostramos en nuestro sitio web, tanto a nivel de ingredientes, trazas, información nutricional, sellos, modo de uso y/o modo de conservación. Usted debe basarse únicamente en la información que se muestra en nuestro sitio web y siempre debe leer las etiquetas, advertencias y instrucciones antes de usar el consumo de un producto.", "Información obtenida de", "Productos similares", "CAFE MOLIDO   TOTTUS 500 G", "Ver producto", "Café Molido Intenso", "-14%", "Café Molido Balanceado", "CAFE EXPRESS MOLIDO 250 GRS.", "CAP CAFE DESCAFEINAD TOTTUS PREMIUM 50 G", "-25%", "Café Grano Molido Copacabana 100% Arábico 250 g", "Café Molido French Vanilla Marley Coffee 227 g", "Cápsula Café Ristretto", "Cápsula Café Lungo", "Café Marley Cappuccino de Vainilla 160 g + Mug", "Café Moka Super Molido", "Café Molido Caribbean Soul Marley Coffee 227 g", "Cápsula Café Puro Arábica", "Café Granulado", "¡Juntos son mejores!", "Azúcar Rubia"]}, "txt_path": "dataset/txt_limpios/1706.txt", "html_path": "dataset/paginas_descargadas/1706.html", "es_status": "ET", "category_canonical": "cafe", "decision": "keep", "match_score": 0.6, "reasons": "heuristic_default"}
