source_id,title,description,breadcrumbs,price_raw,currency_raw,url,seller,availability,country,product_name,brand,reference,unit,price_amount,price_currency,price_symbol,price_text,price_amount_filled,price_is_imputed,price_imputation_source,price_amount_usd,price_amount_usd_filled,fx_rate_local_per_usd,fx_source,information_text,description_text,features_text,specifications_text,benefits_text,details_text,other_sections,sections,txt_path,html_path,es_status,category_canonical,decision,match_score,reasons
812,Saltar menú Cenco,Ingredientes Condición alimentaria Tipo de Producto Café Grano Molido Cantidad 1 un. Formato Molido Envase Paquete País de Origen Colombia Sistema Cierre Al vacío Variedad Premium Aroma Suave Contenido 250 g Garantía Mínima Legal Válida hasta su fecha de caducidad Te podrían interesar Soprole Leche Soprole Sin Lactosa Descremada 1 L Iansa Azúcar Blanca Iansa 1 kg Nestlé Crema de Leche Nestlé Caja 200 ml Centro de preferencia de privacidad Gestionar las preferencias de consentimiento Activas siempre Back Button Search Icon Filter Icon Clear checkbox label label Apply Cancel Consent Leg.Interest Permitir todas Rechazar todas Confirmar mis preferencias,Exclusivo online > 250 g,8.07,,,Desconocido,unknown,UNKNOWN,Saltar menú Cenco,Exclusivo online,,250 g,8.07,,$,$8.07,8.07,False,original,8.07,8.07,1.0,default_1usd,,Ingredientes Condición alimentaria Tipo de Producto Café Grano Molido Cantidad 1 un. Formato Molido Envase Paquete País de Origen Colombia Sistema Cierre Al vacío Variedad Premium Aroma Suave Contenido 250 g Garantía Mínima Legal Válida hasta su fecha de caducidad Te podrían interesar Soprole Leche Soprole Sin Lactosa Descremada 1 L Iansa Azúcar Blanca Iansa 1 kg Nestlé Crema de Leche Nestlé Caja 200 ml Centro de preferencia de privacidad Gestionar las preferencias de consentimiento Activas siempre Back Button Search Icon Filter Icon Clear checkbox label label Apply Cancel Consent Leg.Interest Permitir todas Rechazar todas Confirmar mis preferencias,,,,,,"{""Descripción"": [""Ingredientes"", ""Condición alimentaria"", ""Tipo de Producto"", ""Café Grano Molido"", ""Cantidad"", ""1 un."", ""Formato"", ""Molido"", ""Envase"", ""Paquete"", ""País de origen"", ""Colombia"", ""Sistema Cierre"", ""Al vacío"", ""Variedad"", ""Premium"", ""Aroma"", ""Suave"", ""Contenido"", ""250 g"", ""Garantía Mínima Legal"", ""Válida hasta su fecha de caducidad"", ""Te podrían interesar"", ""Soprole"", ""Leche Soprole Sin Lactosa Descremada 1 L"", ""Iansa"", ""Azúcar Blanca Iansa 1 kg"", ""Nestlé"", ""Crema de Leche Nestlé Caja 200 ml"", ""Centro de preferencia de privacidad"", ""Gestionar las preferencias de consentimiento"", ""Activas siempre"", ""Back Button"", ""Search Icon"", ""Filter Icon"", ""Clear"", ""checkbox label"", ""label"", ""Apply"", ""Cancel"", ""Consent"", ""Leg.Interest"", ""Permitir todas"", ""Rechazar todas"", ""Confirmar mis preferencias""]}",dataset/txt_limpios/812.txt,dataset/paginas_descargadas/812.html,ET,descartado,discard,0.10,excluded_keyword
813,Saltar menú Cenco,Ingredientes Condición alimentaria Información nutricional Tipo de Producto Café Grano Molido Intensidad Media Formato Grano Envase Paquete País de Origen Brasil Tostado Alto Almacenamiento Mantener en lugar fresco y seco Te podrían interesar Iansa Azúcar Blanca Iansa 1 kg Exclusivo online Soprole Leche Soprole Sin Lactosa Descremada 1 L Nestlé Crema de Leche Nestlé Tarro 157 g Centro de preferencia de privacidad Gestionar las preferencias de consentimiento Activas siempre Back Button Search Icon Filter Icon Clear checkbox label label Apply Cancel Consent Leg.Interest Permitir todas Rechazar todas Confirmar mis preferencias,Cruzeiro > 250 g,5.95,,,Desconocido,unknown,UNKNOWN,Saltar menú Cenco,Cruzeiro,,250 g,5.95,,$,$5.95,5.95,False,original,5.95,5.95,1.0,default_1usd,,Ingredientes Condición alimentaria Información nutricional Tipo de Producto Café Grano Molido Intensidad Media Formato Grano Envase Paquete País de Origen Brasil Tostado Alto Almacenamiento Mantener en lugar fresco y seco Te podrían interesar Iansa Azúcar Blanca Iansa 1 kg Exclusivo online Soprole Leche Soprole Sin Lactosa Descremada 1 L Nestlé Crema de Leche Nestlé Tarro 157 g Centro de preferencia de privacidad Gestionar las preferencias de consentimiento Activas siempre Back Button Search Icon Filter Icon Clear checkbox label label Apply Cancel Consent Leg.Interest Permitir todas Rechazar todas Confirmar mis preferencias,,,,,,"{""Descripción"": [""Ingredientes"", ""Condición alimentaria"", ""Información nutricional"", ""Tipo de Producto"", ""Café Grano Molido"", ""Intensidad"", ""Media"", ""Formato"", ""Grano"", ""Envase"", ""Paquete"", ""País de origen"", ""Brasil"", ""Tostado"", ""Alto"", ""Almacenamiento"", ""Mantener en lugar fresco y seco"", ""Te podrían interesar"", ""Iansa"", ""Azúcar Blanca Iansa 1 kg"", ""Exclusivo online"", ""Soprole"", ""Leche Soprole Sin Lactosa Descremada 1 L"", ""Nestlé"", ""Crema de Leche Nestlé Tarro 157 g"", ""Centro de preferencia de privacidad"", ""Gestionar las preferencias de consentimiento"", ""Activas siempre"", ""Back Button"", ""Search Icon"", ""Filter Icon"", ""Clear"", ""checkbox label"", ""label"", ""Apply"", ""Cancel"", ""Consent"", ""Leg.Interest"", ""Permitir todas"", ""Rechazar todas"", ""Confirmar mis preferencias""]}",dataset/txt_limpios/813.txt,dataset/paginas_descargadas/813.html,ET,cafe,keep,0.60,heuristic_default
814,Saltar menú Cenco,Tipo de Producto Papas Grupo Papas y Zapallos Envase Granel Variedad Verdura Contenido A granel Te podrían interesar Cebolla Malla 3 un. 4.3 Plátano Extra Granel (1 A 2 un. Aprox) 3.6 Jumbo Artesanal Jamón Pierna Acaramelado Granel 100 g 4.7 Centro de preferencia de privacidad Gestionar las preferencias de consentimiento Activas siempre Back Button Search Icon Filter Icon Clear checkbox label label Apply Cancel Consent Leg.Interest Permitir todas Rechazar todas Confirmar mis preferencias,Frutas y Verduras Propias > 2 kg,495.0,,,Desconocido,unknown,UNKNOWN,Saltar menú Cenco,Frutas y Verduras Propias,,2 kg,495.00,,$,$495,495.0,False,original,495.0,495.0,1.0,default_1usd,,Tipo de Producto Papas Grupo Papas y Zapallos Envase Granel Variedad Verdura Contenido A granel Te podrían interesar Cebolla Malla 3 un. 4.3 Plátano Extra Granel (1 A 2 un. Aprox) 3.6 Jumbo Artesanal Jamón Pierna Acaramelado Granel 100 g 4.7 Centro de preferencia de privacidad Gestionar las preferencias de consentimiento Activas siempre Back Button Search Icon Filter Icon Clear checkbox label label Apply Cancel Consent Leg.Interest Permitir todas Rechazar todas Confirmar mis preferencias,,,,,,"{""Descripción"": [""Tipo de Producto"", ""Papas"", ""Grupo"", ""Papas y Zapallos"", ""Envase"", ""Granel"", ""Variedad"", ""Verdura"", ""Contenido"", ""A granel"", ""Te podrían interesar"", ""Cebolla Malla 3 un."", ""4.3"", ""Plátano Extra Granel (1 A 2 un. Aprox)"", ""3.6"", ""Jumbo Artesanal"", ""Jamón Pierna Acaramelado Granel 100 g"", ""4.7"", ""Centro de preferencia de privacidad"", ""Gestionar las preferencias de consentimiento"", ""Activas siempre"", ""Back Button"", ""Search Icon"", ""Filter Icon"", ""Clear"", ""checkbox label"", ""label"", ""Apply"", ""Cancel"", ""Consent"", ""Leg.Interest"", ""Permitir todas"", ""Rechazar todas"", ""Confirmar mis preferencias""]}",dataset/txt_limpios/814.txt,dataset/paginas_descargadas/814.html,EN,papa,keep,0.60,heuristic_default
815,Saltar menú Cenco,Ingredientes Condición alimentaria Información nutricional Tipo de Producto Papas Grupo Papas y Zapallos Envase Bolsa País de Origen Chile Te podrían interesar Centro de preferencia de privacidad Gestionar las preferencias de consentimiento Activas siempre Back Button Search Icon Filter Icon Clear checkbox label label Apply Cancel Consent Leg.Interest Permitir todas Rechazar todas Confirmar mis preferencias,Huertos del Ranco > 1 kg,2.59,,,Desconocido,unknown,UNKNOWN,Saltar menú Cenco,Huertos del Ranco,,1 kg,2.59,,$,$2.59,2.59,False,original,2.59,2.59,1.0,default_1usd,,Ingredientes Condición alimentaria Información nutricional Tipo de Producto Papas Grupo Papas y Zapallos Envase Bolsa País de Origen Chile Te podrían interesar Centro de preferencia de privacidad Gestionar las preferencias de consentimiento Activas siempre Back Button Search Icon Filter Icon Clear checkbox label label Apply Cancel Consent Leg.Interest Permitir todas Rechazar todas Confirmar mis preferencias,,,,,,"{""Descripción"": [""Ingredientes"", ""Condición alimentaria"", ""Información nutricional"", ""Tipo de Producto"", ""Papas"", ""Grupo"", ""Papas y Zapallos"", ""Envase"", ""Bolsa"", ""País de origen"", ""Chile"", ""Te podrían interesar"", ""Centro de preferencia de privacidad"", ""Gestionar las preferencias de consentimiento"", ""Activas siempre"", ""Back Button"", ""Search Icon"", ""Filter Icon"", ""Clear"", ""checkbox label"", ""label"", ""Apply"", ""Cancel"", ""Consent"", ""Leg.Interest"", ""Permitir todas"", ""Rechazar todas"", ""Confirmar mis preferencias""]}",dataset/txt_limpios/815.txt,dataset/paginas_descargadas/815.html,ET,papa,keep,0.60,heuristic_default
816,Saltar menú Cenco,,Frutas y verduras,,,,Desconocido,unknown,UNKNOWN,Saltar menú Cenco,Frutas y verduras,,,,,,,234.19,True,country_mean,,234.1938,1.0,default_1usd,,,,,,,,{},dataset/txt_limpios/816.txt,dataset/paginas_descargadas/816.html,EN,sin_categoria,discard,0.30,no_category_detected;price_parse_failed
817,Saltar menú Cenco,,Activas siempre,,,,Desconocido,unknown,UNKNOWN,Saltar menú Cenco,Activas siempre,,,,,,,234.19,True,country_mean,,234.1938,1.0,default_1usd,,,,,,,,{},dataset/txt_limpios/817.txt,dataset/paginas_descargadas/817.html,EN,sin_categoria,discard,0.30,no_category_detected;price_parse_failed
818,Saltar menú Cenco,Ingredientes Condición alimentaria Información nutricional Hecho en Jumbo Tipo de Producto Pan de Molde Blanco Porciones 21 Porciones Formato Envasado Envase Bolsa País de Origen Chile Almacenamiento En un lugar fresco y seco Te podrían interesar Colun Mantequilla Colun con Sal 250 g La Preferida Jamón Pierna La Preferida Granel 4.6 Queso Gauda Colun Laminado Granel Centro de preferencia de privacidad Gestionar las preferencias de consentimiento Activas siempre Back Button Search Icon Filter Icon Clear checkbox label label Apply Cancel Consent Leg.Interest Permitir todas Rechazar todas Confirmar mis preferencias,Oferta > 750 g,2.39,,,Desconocido,unknown,UNKNOWN,Saltar menú Cenco,Oferta,,750 g,2.39,,$,$2.39,2.39,False,original,2.39,2.39,1.0,default_1usd,,Ingredientes Condición alimentaria Información nutricional Hecho en Jumbo Tipo de Producto Pan de Molde Blanco Porciones 21 Porciones Formato Envasado Envase Bolsa País de Origen Chile Almacenamiento En un lugar fresco y seco Te podrían interesar Colun Mantequilla Colun con Sal 250 g La Preferida Jamón Pierna La Preferida Granel 4.6 Queso Gauda Colun Laminado Granel Centro de preferencia de privacidad Gestionar las preferencias de consentimiento Activas siempre Back Button Search Icon Filter Icon Clear checkbox label label Apply Cancel Consent Leg.Interest Permitir todas Rechazar todas Confirmar mis preferencias,,,,,,"{""Descripción"": [""Ingredientes"", ""Condición alimentaria"", ""Información nutricional"", ""Hecho en Jumbo"", ""Tipo de Producto"", ""Pan de Molde Blanco"", ""Porciones"", ""21 Porciones"", ""Formato"", ""Envasado"", ""Envase"", ""Bolsa"", ""País de origen"", ""Chile"", ""Almacenamiento"", ""En un lugar fresco y seco"", ""Te podrían interesar"", ""Colun"", ""Mantequilla Colun con Sal 250 g"", ""La Preferida"", ""Jamón Pierna La Preferida Granel"", ""4.6"", ""Queso Gauda Colun Laminado Granel"", ""Centro de preferencia de privacidad"", ""Gestionar las preferencias de consentimiento"", ""Activas siempre"", ""Back Button"", ""Search Icon"", ""Filter Icon"", ""Clear"", ""checkbox label"", ""label"", ""Apply"", ""Cancel"", ""Consent"", ""Leg.Interest"", ""Permitir todas"", ""Rechazar todas"", ""Confirmar mis preferencias""]}",dataset/txt_limpios/818.txt,dataset/paginas_descargadas/818.html,ET,pan,keep,0.60,heuristic_default
819,Saltar menú Cenco,Ingredientes Condición alimentaria Información nutricional Hecho en Jumbo Tipo de Producto Pan de Molde Integral Elaboración Sustentable Masa Madre Porciones 20 Porciones Formato Envasado Envase Bolsa País de Origen Chile Almacenamiento En un lugar fresco y seco Te podrían interesar La Preferida Jamón Pierna La Preferida Granel Colun Queso Gauda Colun Laminado Granel Kraft Mayonesa Kraft 850 g Centro de preferencia de privacidad Gestionar las preferencias de consentimiento Activas siempre Back Button Search Icon Filter Icon Clear checkbox label label Apply Cancel Consent Leg.Interest Permitir todas Rechazar todas Confirmar mis preferencias,Oferta > 600 g,2.49,,,Desconocido,unknown,UNKNOWN,Saltar menú Cenco,Oferta,,600 g,2.49,,$,$2.49,2.49,False,original,2.49,2.49,1.0,default_1usd,,Ingredientes Condición alimentaria Información nutricional Hecho en Jumbo Tipo de Producto Pan de Molde Integral Elaboración Sustentable Masa Madre Porciones 20 Porciones Formato Envasado Envase Bolsa País de Origen Chile Almacenamiento En un lugar fresco y seco Te podrían interesar La Preferida Jamón Pierna La Preferida Granel Colun Queso Gauda Colun Laminado Granel Kraft Mayonesa Kraft 850 g Centro de preferencia de privacidad Gestionar las preferencias de consentimiento Activas siempre Back Button Search Icon Filter Icon Clear checkbox label label Apply Cancel Consent Leg.Interest Permitir todas Rechazar todas Confirmar mis preferencias,,,,,,"{""Descripción"": [""Ingredientes"", ""Condición alimentaria"", ""Información nutricional"", ""Hecho en Jumbo"", ""Tipo de Producto"", ""Pan de Molde Integral"", ""Elaboración Sustentable"", ""Masa Madre"", ""Porciones"", ""20 Porciones"", ""Formato"", ""Envasado"", ""Envase"", ""Bolsa"", ""País de origen"", ""Chile"", ""Almacenamiento"", ""En un lugar fresco y seco"", ""Te podrían interesar"", ""La Preferida"", ""Jamón Pierna La Preferida Granel"", ""Colun"", ""Queso Gauda Colun Laminado Granel"", ""Kraft"", ""Mayonesa Kraft 850 g"", ""Centro de preferencia de privacidad"", ""Gestionar las preferencias de consentimiento"", ""Activas siempre"", ""Back Button"", ""Search Icon"", ""Filter Icon"", ""Clear"", ""checkbox label"", ""label"", ""Apply"", ""Cancel"", ""Consent"", ""Leg.Interest"", ""Permitir todas"", ""Rechazar todas"", ""Confirmar mis preferencias""]}",dataset/txt_limpios/819.txt,dataset/paginas_descargadas/819.html,ET,pan,keep,0.60,heuristic_default
820,Saltar menú Cenco,Ingredientes Condición alimentaria Información nutricional Hecho en Jumbo Tipo de Producto Pan de Molde Blanco Envase Bolsa País de Origen Chile Te podrían interesar Río Bueno Receta del Abuelo Jamón Artesanal Receta del Abuelo Granel Frutas y Verduras Propias Tomate Larga Vida Granel (1 A 2 un. Aprox) Centro de preferencia de privacidad Gestionar las preferencias de consentimiento Activas siempre Back Button Search Icon Filter Icon Clear checkbox label label Apply Cancel Consent Leg.Interest Permitir todas Rechazar todas Confirmar mis preferencias,Castaño > 770 g,2.99,,,Desconocido,unknown,UNKNOWN,Saltar menú Cenco,Castaño,,770 g,2.99,,$,$2.99,2.99,False,original,2.99,2.99,1.0,default_1usd,,Ingredientes Condición alimentaria Información nutricional Hecho en Jumbo Tipo de Producto Pan de Molde Blanco Envase Bolsa País de Origen Chile Te podrían interesar Río Bueno Receta del Abuelo Jamón Artesanal Receta del Abuelo Granel Frutas y Verduras Propias Tomate Larga Vida Granel (1 A 2 un. Aprox) Centro de preferencia de privacidad Gestionar las preferencias de consentimiento Activas siempre Back Button Search Icon Filter Icon Clear checkbox label label Apply Cancel Consent Leg.Interest Permitir todas Rechazar todas Confirmar mis preferencias,,,,,,"{""Descripción"": [""Ingredientes"", ""Condición alimentaria"", ""Información nutricional"", ""Hecho en Jumbo"", ""Tipo de Producto"", ""Pan de Molde Blanco"", ""Envase"", ""Bolsa"", ""País de origen"", ""Chile"", ""Te podrían interesar"", ""Río Bueno"", ""Receta del Abuelo"", ""Jamón Artesanal Receta del Abuelo Granel"", ""Frutas y Verduras Propias"", ""Tomate Larga Vida Granel (1 A 2 un. Aprox)"", ""Centro de preferencia de privacidad"", ""Gestionar las preferencias de consentimiento"", ""Activas siempre"", ""Back Button"", ""Search Icon"", ""Filter Icon"", ""Clear"", ""checkbox label"", ""label"", ""Apply"", ""Cancel"", ""Consent"", ""Leg.Interest"", ""Permitir todas"", ""Rechazar todas"", ""Confirmar mis preferencias""]}",dataset/txt_limpios/820.txt,dataset/paginas_descargadas/820.html,ET,pan,keep,0.60,heuristic_default
821,Saltar menú Cenco,Ingredientes Condición alimentaria Información nutricional Tipo de Producto Pan de Molde Blanco Envase Bolsa País de Origen Chile Contenido 550 g Almacenamiento Fresco y seco Garantía Mínima Legal Válida hasta su fecha de caducidad Te podrían interesar Quillayes Colun Mantequilla Colun con Sal 250 g Minuto Verde Choclo Congelado Minuto Verde 100% Natural 500 g Centro de preferencia de privacidad Gestionar las preferencias de consentimiento Activas siempre Back Button Search Icon Filter Icon Clear checkbox label label Apply Cancel Consent Leg.Interest Permitir todas Rechazar todas Confirmar mis preferencias,Exclusivo online > 550 g,1.99,,,Desconocido,unknown,UNKNOWN,Saltar menú Cenco,Exclusivo online,,550 g,1.99,,$,$1.99,1.99,False,original,1.99,1.99,1.0,default_1usd,,Ingredientes Condición alimentaria Información nutricional Tipo de Producto Pan de Molde Blanco Envase Bolsa País de Origen Chile Contenido 550 g Almacenamiento Fresco y seco Garantía Mínima Legal Válida hasta su fecha de caducidad Te podrían interesar Quillayes Colun Mantequilla Colun con Sal 250 g Minuto Verde Choclo Congelado Minuto Verde 100% Natural 500 g Centro de preferencia de privacidad Gestionar las preferencias de consentimiento Activas siempre Back Button Search Icon Filter Icon Clear checkbox label label Apply Cancel Consent Leg.Interest Permitir todas Rechazar todas Confirmar mis preferencias,,,,,,"{""Descripción"": [""Ingredientes"", ""Condición alimentaria"", ""Información nutricional"", ""Tipo de Producto"", ""Pan de Molde Blanco"", ""Envase"", ""Bolsa"", ""País de origen"", ""Chile"", ""Contenido"", ""550 g"", ""Almacenamiento"", ""Fresco y seco"", ""Garantía Mínima Legal"", ""Válida hasta su fecha de caducidad"", ""Te podrían interesar"", ""Quillayes"", ""Colun"", ""Mantequilla Colun con Sal 250 g"", ""Minuto Verde"", ""Choclo Congelado Minuto Verde 100% Natural 500 g"", ""Centro de preferencia de privacidad"", ""Gestionar las preferencias de consentimiento"", ""Activas siempre"", ""Back Button"", ""Search Icon"", ""Filter Icon"", ""Clear"", ""checkbox label"", ""label"", ""Apply"", ""Cancel"", ""Consent"", ""Leg.Interest"", ""Permitir todas"", ""Rechazar todas"", ""Confirmar mis preferencias""]}",dataset/txt_limpios/821.txt,dataset/paginas_descargadas/821.html,ET,descartado,discard,0.10,excluded_keyword
822,Saltar menú Cenco,Ingredientes Condición alimentaria Información nutricional Tipo de Producto Bebidas Gaseosas Cantidad 1 un. Envase Botella plástico desechable (bebidas) Gasificado Sí País de Origen Chile Sabor Cola Variedad Original Tamaño Familiar Contenido Entre 1 y 2 lt Garantía Mínima Legal Válida hasta su fecha de caducidad Te podrían interesar Fiesta Hielo Fiesta 2 kg Kryzpo Papas Fritas Kryzpo Original 130 g 30% dcto. Evercrisp Evercrisp Maní Salado 380 g Centro de preferencia de privacidad Gestionar las preferencias de consentimiento Activas siempre Back Button Search Icon Filter Icon Clear checkbox label label Apply Cancel Consent Leg.Interest Permitir todas Rechazar todas Confirmar mis preferencias,Exclusivo online > 1.5 L,6.0,,,Desconocido,unknown,UNKNOWN,Saltar menú Cenco,Exclusivo online,,1.5 L,6.00,,,6,6.0,False,original,6.0,6.0,1.0,default_1usd,,Ingredientes Condición alimentaria Información nutricional Tipo de Producto Bebidas Gaseosas Cantidad 1 un. Envase Botella plástico desechable (bebidas) Gasificado Sí País de Origen Chile Sabor Cola Variedad Original Tamaño Familiar Contenido Entre 1 y 2 lt Garantía Mínima Legal Válida hasta su fecha de caducidad Te podrían interesar Fiesta Hielo Fiesta 2 kg Kryzpo Papas Fritas Kryzpo Original 130 g 30% dcto. Evercrisp Evercrisp Maní Salado 380 g Centro de preferencia de privacidad Gestionar las preferencias de consentimiento Activas siempre Back Button Search Icon Filter Icon Clear checkbox label label Apply Cancel Consent Leg.Interest Permitir todas Rechazar todas Confirmar mis preferencias,,,,,,"{""Descripción"": [""Ingredientes"", ""Condición alimentaria"", ""Información nutricional"", ""Tipo de Producto"", ""Bebidas Gaseosas"", ""Cantidad"", ""1 un."", ""Envase"", ""Botella plástico desechable (bebidas)"", ""Gasificado"", ""Sí"", ""País de origen"", ""Chile"", ""Sabor"", ""Cola"", ""Variedad"", ""Original"", ""Tamaño"", ""Familiar"", ""Contenido"", ""Entre 1 y 2 lt"", ""Garantía Mínima Legal"", ""Válida hasta su fecha de caducidad"", ""Te podrían interesar"", ""Fiesta"", ""Hielo Fiesta 2 kg"", ""Kryzpo"", ""Papas Fritas Kryzpo Original 130 g"", ""30% dcto."", ""Evercrisp"", ""Evercrisp Maní Salado 380 g"", ""Centro de preferencia de privacidad"", ""Gestionar las preferencias de consentimiento"", ""Activas siempre"", ""Back Button"", ""Search Icon"", ""Filter Icon"", ""Clear"", ""checkbox label"", ""label"", ""Apply"", ""Cancel"", ""Consent"", ""Leg.Interest"", ""Permitir todas"", ""Rechazar todas"", ""Confirmar mis preferencias""]}",dataset/txt_limpios/822.txt,dataset/paginas_descargadas/822.html,ET,descartado,discard,0.10,excluded_keyword
