source_id,title,description,breadcrumbs,price_raw,currency_raw,url,seller,availability,country,product_name,brand,reference,unit,price_amount,price_currency,price_symbol,price_text,price_amount_filled,price_is_imputed,price_imputation_source,price_amount_usd,price_amount_usd_filled,fx_rate_local_per_usd,fx_source,information_text,description_text,features_text,specifications_text,benefits_text,details_text,other_sections,sections,txt_path,html_path,es_status,category_canonical,decision,match_score,reasons
1201,Seja Bem Vindo à Plaza Vea,Información de la marca,Abarrotes > 49Kg,174.0,PEN,,Desconocido,unknown,PE,Seja Bem Vindo à Plaza Vea,Abarrotes,,49Kg,174.00,PEN,S/,S/174,174.0,False,original,49.0141,49.0141,3.55,from_peru_cambio_dolar,,Información de la marca,Revisa todo | Componentes del Producto | Vendido por | plazaVea | En caso algo no vaya como gustes: Puedes revisar nuestras | Politicas de cambios y/o devoluciones | y hacerlas efectivas en todas nuestras tiendas. | Productos | que te pueden interesar | similares | Multiplicador-de-unidad: MAKRO-Bi-Precio|Vigente Oculto | Arroz Superior COSTEÑO Bolsa 5Kg | .00 | un | 3 | productos agregados | Agrega indicaciones | Guardar | Arroz Familiar COSECHA NORTEÑA Bolsa 10Kg | COSECHA NORTEÑA | MAKRO-Bi-Precio|Vigente Oculto | Arroz Añejo Amarillo FARAÓN G3 Bolsa 1Kg | Arroz Superior Añejo ARO Saco 25kg | Arroz Superior GRAN CHALAN Gran Añejo Bolsa 5Kg | Multiplicador-de-unidad: Express | Arroz Familiar COSECHA NORTEÑA Saco 49Kg | Arroz Familiar COSECHA NORTEÑA Saco 25Kg | Recomendado para ti,,,,,"{""Descripción"": [""Información de la marca""], ""Características"": [""Revisa todo"", ""Componentes del Producto"", ""Vendido por"", ""plazaVea"", ""En caso algo no vaya como gustes: Puedes revisar nuestras"", ""Politicas de cambios y/o devoluciones"", ""y hacerlas efectivas en todas nuestras tiendas."", ""Productos"", ""que te pueden interesar"", ""similares"", ""Multiplicador-de-unidad: MAKRO-Bi-Precio|Vigente Oculto"", ""Arroz Superior COSTEÑO Bolsa 5Kg"", "".00"", ""un"", ""3"", ""productos agregados"", ""Agrega indicaciones"", ""Guardar"", ""Arroz Familiar COSECHA NORTEÑA Bolsa 10Kg"", ""COSECHA NORTEÑA"", ""MAKRO-Bi-Precio|Vigente Oculto"", ""Arroz Añejo Amarillo FARAÓN G3 Bolsa 1Kg"", ""Arroz Superior Añejo ARO Saco 25kg"", ""Arroz Superior GRAN CHALAN Gran Añejo Bolsa 5Kg"", ""Multiplicador-de-unidad: Express"", ""Arroz Familiar COSECHA NORTEÑA Saco 49Kg"", ""Arroz Familiar COSECHA NORTEÑA Saco 25Kg"", ""Recomendado para ti""]}",dataset/txt_limpios/1201.txt,dataset/paginas_descargadas/1201.html,EN,sin_categoria,discard,0.30,no_category_detected
1202,Seja Bem Vindo à Plaza Vea,Información de la marca,Abarrotes > 49kg,210.0,PEN,,Desconocido,unknown,PE,Seja Bem Vindo à Plaza Vea,Abarrotes,,49kg,210.00,PEN,S/,S/210,210.0,False,original,59.1549,59.1549,3.55,from_peru_cambio_dolar,,Información de la marca,"Presentación/Empaque | Bolsa | Producto Preparado | No | Arroz Pregraneado | Advertencias De Almacenamiento | El producto se almacena en palets  en un ambiente cerrado,fresco y seco. Las unidades de transporte deben estar en condiciones salubres y contar con certificado de fumigación. | Uso | comestible | Advertencias de consumo | consumir preferentemente hasta 12 meses después de fecha de producción. | Importante destacar | Graneadito | Conservar en lugar fresco y seco | Consumir preferentemente antes de la fecha indicada en el envase | Descripción del producto | plazaVea | cuenta con una amplia variedad de | para que puedas elegir el que más se adecua a tus necesidades. | Uno de los ingredientes principales de la gastronomía peruana es el | . Este alimento acompaña muchos platos típicos de nuestro país como un Seco a la norteña, Lomo Saltado, Ají de pollo, Cau Cau entre otro más. Es que el Arroz se ha ganado un espacio en el corazón de los peruanos, gracias a su sabor y textura lo convierten en el complemento perfecto para acompañar cualquier plato. | En | podrás encontrar distintas presentaciones, tamaños y marcas. Por ejemplo si estás llevando una alimentación saludable te recomendamos revisar nuestro catálogo de | Arroz Integral y especiales | para que puedas elaborar tus recetas según tus requerimientos calóricos. | ¡Recuerda que para lograr un | Arroz Graneadito | no debe faltar en tu cocina el | Aceite Vegetal | ! Gracias a su composición y versatilidad es perfecto para utilizarlo en cualquier receta, desde una fresca ensalada hasta un delicioso Arroz con pollo , graneadito y con el sabor preciso que a todos los peruanos nos encanta. ¡Que esperas empieza a engreir a toda tu familia con tus mejores preparaciones! | ¡Conoce las distintas opciones en | en plazaVea Online! | *La imagen sólo es referencial | Revisa todo | Componentes del Producto | Vendido por | En caso algo no vaya como gustes: Puedes revisar nuestras | Politicas de cambios y/o devoluciones | y hacerlas efectivas en todas nuestras tiendas. | Productos | que te pueden interesar | similares | un | 3 | productos agregados | Agrega indicaciones | Guardar | Multiplicador-de-unidad: Express | Arroz FARAON Añejo Amarillo G3 Bolsa 5kg | Arroz Superior CUSI CUSA x 49Kg | CUSI CUSA | Arroz Familiar Nir CASSERITA x 25Kg | CASSERITA | Arroz Superior GRAN PACASMAYO Rojo Saco x 49kg | Arroz Despuntado ARO Nir Bolsa x10Kg | MAKRO-Bi-Precio|Vigente Oculto | Arroz Superior VALLENORTE Bolsa 750g | Recomendado para ti",,,,,"{""Descripción"": [""Información de la marca""], ""Características"": [""Presentación/Empaque"", ""Bolsa"", ""Producto Preparado"", ""No"", ""Arroz Pregraneado"", ""Advertencias De Almacenamiento"", ""El producto se almacena en palets  en un ambiente cerrado,fresco y seco. Las unidades de transporte deben estar en condiciones salubres y contar con certificado de fumigación."", ""Uso"", ""comestible"", ""Advertencias de consumo"", ""consumir preferentemente hasta 12 meses después de fecha de producción."", ""Importante destacar"", ""Graneadito"", ""Conservar en lugar fresco y seco"", ""Consumir preferentemente antes de la fecha indicada en el envase"", ""Descripción del producto"", ""plazaVea"", ""cuenta con una amplia variedad de"", ""para que puedas elegir qué más se adecua a tus necesidades."", ""Uno de los ingredientes principales de la gastronomía peruana es el"", "". Este alimento acompaña muchos platos típicos de nuestro país como un Seco a la norteña, Lomo Saltado, Ají de pollo, Cau Cau entre otro más. Es que el arroz se ha ganado un espacio en el corazón de los peruanos, gracias a su sabor y textura lo convierten en el complemento perfecto para acompañar cualquier plato."", ""En"", ""podrás encontrar distintas presentaciones, tamaños y marcas. Por ejemplo si estás llevando una alimentación saludable te recomendamos revisar nuestro catálogo de"", ""Arroz Integral y especiales"", ""para que puedas elaborar tus recetas según tus requerimientos calóricos."", ""¡Recuerda que para lograr un"", ""Arroz Graneadito"", ""no debe faltar en tu cocina el"", ""Aceite Vegetal"", ""! Gracias a su composición y versatilidad es perfecto para utilizarlo en cualquier receta, desde una fresca ensalada hasta un delicioso Arroz con pollo , graneadito y con el sabor preciso que a todos los peruanos nos encanta. ¡Que esperas empieza a engreir a toda tu familia con tus mejores preparaciones!"", ""¡Conoce las distintas opciones en"", ""en plazaVea Online!"", ""*La imagen solo es referencial"", ""Revisa todo"", ""Componentes del Producto"", ""Vendido por"", ""En caso algo no vaya como gustes: Puedes revisar nuestras"", ""Politicas de cambios y/o devoluciones"", ""y hacerlas efectivas en todas nuestras tiendas."", ""Productos"", ""que te pueden interesar"", ""similares"", ""un"", ""3"", ""productos agregados"", ""Agrega indicaciones"", ""Guardar"", ""Multiplicador-de-unidad: Express"", ""Arroz FARAON Añejo Amarillo G3 Bolsa 5kg"", ""Arroz Superior CUSI CUSA x 49Kg"", ""CUSI CUSA"", ""Arroz Familiar Nir CASSERITA x 25Kg"", ""CASSERITA"", ""Arroz Superior GRAN PACASMAYO Rojo Saco x 49kg"", ""Arroz Despuntado ARO Nir Bolsa x10Kg"", ""MAKRO-Bi-Precio|Vigente Oculto"", ""Arroz Superior VALLENORTE Bolsa 750g"", ""Recomendado para ti""]}",dataset/txt_limpios/1202.txt,dataset/paginas_descargadas/1202.html,ET,sin_categoria,discard,0.30,no_category_detected
1203,Seja Bem Vindo à Plaza Vea,Información de la marca,Abarrotes > 5Kg,20.0,PEN,,Desconocido,unknown,PE,Seja Bem Vindo à Plaza Vea,Abarrotes,,5Kg,20.00,PEN,S/,S/20,20.0,False,original,5.6338,5.6338,3.55,from_peru_cambio_dolar,,Información de la marca,"Presentación/Empaque | Bolsa | Producto Preparado | No | Arroz Pregraneado | Porción Sugerida | 185g | Azúcares Por Porción | 0 | Calorías Por Porción | 649.7Kcal | Carbohidratos Por Porción | 150.8g | Grasas Por Porción | 0.6g | Proteínas Por Porción | 11.8g | Sodio Por Porción | Advertencias De Almacenamiento | Almacenar en un lugar fresco y seco, lejos de agentes químicos, productos diferentes a alimentos. | Contenido Neto | 5Kg | Denominación/Variedad | Superior | Advertencias de consumo | Consumir preferentemente antes de la fecha indicada en el envase. | Revisa todo | Importante destacar | El producto se debe almacenar en un ambiente cerrado,fresco y seco | Variedad: Superior | Presentación : Bolsa | Descripción del producto | plazaVea | cuenta con una amplia variedad de | para que puedas elegir el que más se adecua a tus necesidades. | Uno de los ingredientes principales de la gastronomía peruana es el | . Este alimento acompaña muchos platos típicos de nuestro país como un Seco a la norteña, Lomo Saltado, Ají de pollo, Cau Cau entre otro más. Es que el Arroz se ha ganado un espacio en el corazón de los peruanos, gracias a su sabor y textura lo convierten en el complemento perfecto para acompañar cualquier plato. | En | podrás encontrar distintas presentaciones, tamaños y marcas.  Por ejemplo si estás llevando una alimentación saludable te recomendamos revisar nuestro catálogo de | Arroz Integral y especiales | para que puedas elaborar tus recetas según tus requerimientos calóricos. | ¡Recuerda que para lograr un | Arroz Graneadito | no debe faltar en tu cocina el | Aceite Vegetal | ! Gracias a su composición y versatilidad es perfecto para utilizarlo en cualquier receta, desde una fresca ensalada hasta un delicioso Arroz con pollo , graneadito y con el sabor preciso que a todos los peruanos nos encanta.  ¡Que esperas empieza a engreir a toda tu familia con tus mejores preparaciones! | ¡Conoce las distintas opciones en | en plazaVea Online! | *La imagen sólo es referencial | ""En 1996, Don Luis Gasco Bravo decide iniciar sus esforzadas acciones en las tierras de Lambayeque, para forjar el cimiento empresarial del reconocido Grupo Vallenorte . Esta empresa nace con la visión de crecer y desarrollarse en la Comercialización e Industrialización de Alimentos y Bebidas."" | ¿No es lo que buscas? Encuentra más variedades de | en plazaVea | Componentes del Producto | Vendido por | En caso algo no vaya como gustes: Puedes revisar nuestras | Politicas de cambios y/o devoluciones | y hacerlas efectivas en todas nuestras tiendas. | Productos | que te pueden interesar | similares | Multiplicador-de-unidad: Express | .00 | un | 3 | productos agregados | Agrega indicaciones | Guardar | Multiplicador-de-unidad: MAKRO-Bi-Precio|Vigente Oculto | Arroz Superior FARAÓN Rojo Bolsa 10Kg | Arroz Familiar M&K Bolsa 750g | M&K | Arroz Familiar M&K 25Kg | COFFEE DELIGHT | Arroz Superior GRAN PACASMAYO Rojo Saco x 49kg | GRAN ARROZ PACASMAYO | Arroz Familiar COSECHA NORTEÑA Saco 49Kg | COSECHA NORTEÑA | Recomendado para ti",,,,,"{""Descripción"": [""Información de la marca""], ""Características"": [""Presentación/Empaque"", ""Bolsa"", ""Producto Preparado"", ""No"", ""Arroz Pregraneado"", ""Porción sugerida"", ""185g"", ""Azúcar por porción"", ""0"", ""Calorías Porción"", ""649.7Kcal"", ""Carbohidratos Porción"", ""150.8g"", ""Grasas Porción"", ""0.6g"", ""Proteínas Porción"", ""11.8g"", ""Sodio Porción"", ""Advertencias De Almacenamiento"", ""Almacenar en un lugar fresco y seco, lejos de agentes químicos, productos diferentes a alimentos."", ""Contenido Neto"", ""5Kg"", ""Denominación/Variedad"", ""Superior"", ""Advertencias de consumo"", ""Consumir preferentemente antes de la fecha indicada en el envase."", ""Revisa todo"", ""Importante destacar"", ""El producto se debe almacenar en un ambiente cerrado,fresco y seco"", ""Variedad: Superior"", ""Presentación : Bolsa"", ""Descripción del producto"", ""plazaVea"", ""cuenta con una amplia variedad de"", ""para que puedas elegir qué más se adecua a tus necesidades."", ""Uno de los ingredientes principales de la gastronomía peruana es el"", "". Este alimento acompaña muchos platos típicos de nuestro país como un Seco a la norteña, Lomo Saltado, Ají de pollo, Cau Cau entre otro más. Es que el arroz se ha ganado un espacio en el corazón de los peruanos, gracias a su sabor y textura lo convierten en el complemento perfecto para acompañar cualquier plato."", ""En"", ""podrás encontrar diferentes presentaciones, tamaños y marcas. Por ejemplo, estás llevando una alimentación saludable te recomendamos revisar nuestro catálogo de"", ""Arroz Integral y especiales"", ""para que puedas elaborar tus recetas según tus requerimientos calóricos."", ""¡Recuerda que para lograr un"", ""Arroz Graneadito"", ""no debe faltar en tu cocina el"", ""Aceite Vegetal"", ""! Gracias a su composición y versatilidad es perfecto para utilizar en cualquier receta, desde una fresca ensalada hasta un delicioso arroz con pollo , graneadito y con el sabor preciso que a todos los peruanos nos encanta. ¡Qué esperas empieza a engreir a toda tu familia con tus mejores preparaciones!"", ""¡Conoce las distintas opciones en"", ""en plazaVea Online!"", ""*La imagen solo es referencial"", ""\""En 1996, Don Luis Gasco Bravo decide iniciar sus esfuerzos en las tierras de Lambayeque, para forjar el cimiento empresarial del reconocido Grupo Vallenorte . Esta empresa nace con la visión de crecer y desarrollarse en la Comercialización e Industrialización de Alimentos y Bebidas. \"""", ""¿En qué búsqueda? Encuentra más variedades de"", ""en plazaVea"", ""Componentes del Producto"", ""Vendido por"", ""En caso algo no vaya como gustes: Puedes revisar nuestras"", ""Politicas de cambios y/o devoluciones"", ""y hacerlas efectivas en todas nuestras tiendas."", ""Productos"", ""que te pueden interesar"", ""similares"", ""Multiplicador-de-unidad: Express"", "".00"", ""un"", ""3"", ""productos agregados"", ""Agrega indicaciones"", ""Guardar"", ""Multiplicador-de-unidad: MAKRO-Bi-Precio|Vigente Oculto"", ""Arroz Superior FARAÓN Rojo Bolsa 10Kg"", ""Arroz Familiar M&K Bolsa 750g"", ""M&K"", ""Arroz Familiar M&K 25Kg"", ""COFFEE DELIGHT"", ""Arroz Superior GRAN PACASMAYO Rojo Saco x 49kg"", ""GRAN ARROZ PACASMAYO"", ""Arroz Familiar COSECHA NORTEÑA Saco 49Kg"", ""COSECHA NORTEÑA"", ""Recomendado para ti""]}",dataset/txt_limpios/1203.txt,dataset/paginas_descargadas/1203.html,ET,sin_categoria,discard,0.30,no_category_detected
1204,Seja Bem Vindo à Plaza Vea,Información de la marca,"Carnes, Aves y Pescados > 1.5Kg",14.0,PEN,,Desconocido,unknown,PE,Seja Bem Vindo à Plaza Vea,"Carnes, Aves y Pescados",,1.5Kg,14.00,PEN,S/,S/14,14.0,False,original,3.9437,3.9437,3.55,from_peru_cambio_dolar,,Información de la marca,Revisa todo | Componentes del Producto | Vendido por | plazaVea | En caso algo no vaya como gustes: Puedes revisar nuestras | Politicas de cambios y/o devoluciones | y hacerlas efectivas en todas nuestras tiendas. | Productos | que te pueden interesar | similares | .00 | un | 3 | productos agregados | Agrega indicaciones | Guardar | Multiplicador-de-unidad: Garantía de calidad | Pollo Fresco con Menudencia Trozado en 8 Piezas | PLAZA VEA | Pollo AVINKA x Kg | AVINKA | Pollo Fresco AVINKA x kg | Recomendado para ti,,,,,"{""Descripción"": [""Información de la marca""], ""Características"": [""Revisa todo"", ""Componentes del Producto"", ""Vendido por"", ""plazaVea"", ""En caso algo no vaya como gustes: Puedes revisar nuestras"", ""Politicas de cambios y/o devoluciones"", ""y hacerlas efectivas en todas nuestras tiendas."", ""Productos"", ""que te pueden interesar"", ""similares"", "".00"", ""un"", ""3"", ""productos agregados"", ""Agrega indicaciones"", ""Guardar"", ""Multiplicador-de-unidad: Garantía de calidad"", ""Pollo Fresco con Menudencia Trozado en 8 Piezas"", ""PLAZA VEA"", ""Pollo AVINKA x Kg"", ""AVINKA"", ""Pollo Fresco AVINKA x kg"", ""Recomendado para ti""]}",dataset/txt_limpios/1204.txt,dataset/paginas_descargadas/1204.html,EN,sin_categoria,discard,0.30,no_category_detected
1205,Seja Bem Vindo à Plaza Vea,Información de la marca,"Carnes, Aves y Pescados > 1.3Kg",7.0,PEN,,Desconocido,unknown,PE,Seja Bem Vindo à Plaza Vea,"Carnes, Aves y Pescados",,1.3Kg,7.00,PEN,S/,S/7,7.0,False,original,1.9718,1.9718,3.55,from_peru_cambio_dolar,,Información de la marca,Denominación/Variedad | POLLO ENTERO 1.3 | Revisa todo | Componentes del Producto | Vendido por | plazaVea | En caso algo no vaya como gustes: Puedes revisar nuestras | Politicas de cambios y/o devoluciones | y hacerlas efectivas en todas nuestras tiendas. | Productos | que te pueden interesar | similares | .00 | un | 3 | productos agregados | Agrega indicaciones | Guardar | Multiplicador-de-unidad: Garantía de calidad | Pollo Entero PERDIX sin Menudencia Congelado Bolsa 1.5Kg | PERDIX | Pollo Mercado AVINKA Frasco xKg | AVINKA | Pollo Entero sin Menudencia Congelado PERDIX 1300g | MAKRO-Bi-Precio|Vigente Oculto | Pollo Entero Congelado PERDIX sin menudencia Bolsa 1.4 kg | Pollo Sin Menudencia a Granel SAN FERNANDO x Kg | Recomendado para ti,,,,,"{""Descripción"": [""Información de la marca""], ""Características"": [""Denominación/Variedad"", ""POLLO ENTERO 1.3"", ""Revisa todo"", ""Componentes del Producto"", ""Vendido por"", ""plazaVea"", ""En caso algo no vaya como gustes: Puedes revisar nuestras"", ""Politicas de cambios y/o devoluciones"", ""y hacerlas efectivas en todas nuestras tiendas."", ""Productos"", ""que te pueden interesar"", ""similares"", "".00"", ""un"", ""3"", ""productos agregados"", ""Agrega indicaciones"", ""Guardar"", ""Multiplicador-de-unidad: Garantía de calidad"", ""Pollo Entero PERDIX sin Menudencia Congelado Bolsa 1.5Kg"", ""PERDIX"", ""Pollo Mercado AVINKA Frasco xKg"", ""AVINKA"", ""Pollo Entero sin Menudencia Congelado PERDIX 1300g"", ""MAKRO-Bi-Precio|Vigente Oculto"", ""Pollo Entero Congelado PERDIX sin menudencia Bolsa 1.4 kg"", ""Pollo Sin Menudencia a Granel SAN FERNANDO x Kg"", ""Recomendado para ti""]}",dataset/txt_limpios/1205.txt,dataset/paginas_descargadas/1205.html,EN,sin_categoria,discard,0.30,no_category_detected
1207,Seja Bem Vindo à Plaza Vea,Información de la marca,"Carnes, Aves y Pescados > 1Kg",12.0,PEN,,Desconocido,unknown,PE,Seja Bem Vindo à Plaza Vea,"Carnes, Aves y Pescados",,1Kg,12.00,PEN,S/,S/12,12.0,False,original,3.3803,3.3803,3.55,from_peru_cambio_dolar,,Información de la marca,Revisa todo | Componentes del Producto | Vendido por | plazaVea | En caso algo no vaya como gustes: Puedes revisar nuestras | Politicas de cambios y/o devoluciones | y hacerlas efectivas en todas nuestras tiendas. | Productos | que te pueden interesar | similares | Pollo Mercado AVINKA Frasco xKg | Precio x | kg | .00 | un | 3 | productos agregados | Agrega indicaciones | Guardar | Pollo Fresco AVINKA x kg | Multiplicador-de-unidad: 1.3 | Pollo sin Menudencia Importada Congelada x Kg | PLAZA VEA | Recomendado para ti,,,,,"{""Descripción"": [""Información de la marca""], ""Características"": [""Revisa todo"", ""Componentes del Producto"", ""Vendido por"", ""plazaVea"", ""En caso algo no vaya como gustes: Puedes revisar nuestras"", ""Politicas de cambios y/o devoluciones"", ""y hacerlas efectivas en todas nuestras tiendas."", ""Productos"", ""que te pueden interesar"", ""similares"", ""Pollo Mercado AVINKA Frasco xKg"", ""Precio x"", ""kg"", "".00"", ""un"", ""3"", ""productos agregados"", ""Agrega indicaciones"", ""Guardar"", ""Pollo Fresco AVINKA x kg"", ""Multiplicador-de-unidad: 1.3"", ""Pollo sin Menudencia Importada Congelada x Kg"", ""PLAZA VEA"", ""Recomendado para ti""]}",dataset/txt_limpios/1207.txt,dataset/paginas_descargadas/1207.html,EN,sin_categoria,discard,0.30,no_category_detected
