source_id,title,description,breadcrumbs,price_raw,currency_raw,url,seller,availability,country,product_name,brand,reference,unit,price_amount,price_currency,price_symbol,price_text,price_amount_filled,price_is_imputed,price_imputation_source,price_amount_usd,price_amount_usd_filled,fx_rate_local_per_usd,fx_source,information_text,description_text,features_text,specifications_text,benefits_text,details_text,other_sections,sections,txt_path,html_path,es_status,category_canonical,decision,match_score,reasons
666,"ASESORAMOS TU COMPRA: 📞(601) 6672004, lun a sab de 7am.a 7pm dom hasta las 6pm","Arroz descascarado al que se le ha eliminado totalmente por elaboración el germen y el salvado con adición de vitamina A y acido fólico Este producto es vendido, facturado y entregado por Cencosud - Colombia Los precios de los productos pueden cambiar dependiendo de la región. Aplican Términos y Condiciones Desactivados Referencia: 0008448 $ 4 , 69 x gr FLORHUILA ☆ ¿Todavía tienes tu Tarjeta Cencosud? Solicítala en línea, úsala y obtén un . Aplican términos y condiciones. Solicítala aquí Mejores ofertas -5% Términos más buscados 1. kefir alpina 2. muebles 3. leche 4. leche alqueria 5. san jorge 6. papel higiénico 7. arroz 8. café 9. cerveza 10. neveras",otras ciudades consulta aquí > 0008448,46.94,COP,,Desconocido,unknown,CO,"ASESORAMOS TU COMPRA: 📞(601) 6672004, lun a sab de 7am.a 7pm dom hasta las 6pm",otras ciudades consulta aquí,8448.0,,46.94,COP,$,$46.94,46.94,False,original,0.0116,0.0116,4047.0,from_colombia_cambio_dolar,,"Arroz descascarado al que se le ha eliminado totalmente por elaboración el germen y el salvado con adición de vitamina A y acido fólico Este producto es vendido, facturado y entregado por Cencosud - Colombia Los precios de los productos pueden cambiar dependiendo de la región. Aplican Términos y Condiciones Desactivados Referencia: 0008448 $ 4 , 69 x gr FLORHUILA ☆ ¿Todavía tienes tu Tarjeta Cencosud? Solicítala en línea, úsala y obtén un . Aplican términos y condiciones. Solicítala aquí Mejores ofertas -5% Términos más buscados 1. kefir alpina 2. muebles 3. leche 4. leche alqueria 5. san jorge 6. papel higiénico 7. arroz 8. café 9. cerveza 10. neveras",,,,,,"{""Descripción"": [""Arroz descascarado al que se le ha eliminado totalmente por elaboración el germen y el salvado con adición de vitamina A y acido fólico"", ""Este producto es vendido, facturado y entregado por"", ""Cencosud - Colombia"", ""Los precios de los productos pueden cambiar dependiendo de la región."", ""Aplican Términos y Condiciones"", ""Desactivado"", ""Referencia: 0008448"", ""$"", ""4"", "","", ""69"", ""x"", ""gr"", ""FLORHUILA"", ""☆"", ""¿Todavía tienes tu Tarjeta Cencosud?"", ""Solicítala en línea, úsala y obtén un"", "". Aplican términos y condiciones."", ""Solicítala aquí"", ""Mejores ofertas"", ""-5%"", ""Términos más buscados"", ""1."", ""kefir alpina"", ""2."", ""muebles"", ""3."", ""leche"", ""4."", ""leche alqueria"", ""5."", ""san jorge"", ""6."", ""papel higienico"", ""7."", ""arroz"", ""8."", ""cafe"", ""9."", ""cerveza"", ""10."", ""neveras""]}",dataset/txt_limpios/666.txt,dataset/paginas_descargadas/666.html,ET,cafe,keep,0.60,heuristic_default
667,"ASESORAMOS TU COMPRA: 📞(601) 6672004, lun a sab de 7am.a 7pm dom hasta las 6pm","Un arroz perfecto para crear deliciosas recetas Este producto es vendido, facturado y entregado por Cencosud - Colombia Los precios de los productos pueden cambiar dependiendo de la región. Aplican Términos y Condiciones Desactivados Referencia: 3419212 $ 9, 38 x gr CASTELLANO ☆ ¿Todavía tienes tu Tarjeta Cencosud? Solicítala en línea, úsala y obtén un . Aplican términos y condiciones. Solicítala aquí Mejores ofertas -25% -24% Términos más buscados 1. kefir alpina 2. muebles 3. leche 4. leche alqueria 5. san jorge 6. papel higiénico 7. arroz 8. café 9. cerveza 10. neveras",otras ciudades consulta aquí > 3419212,37.52,COP,,Desconocido,unknown,CO,"ASESORAMOS TU COMPRA: 📞(601) 6672004, lun a sab de 7am.a 7pm dom hasta las 6pm",otras ciudades consulta aquí,3419212.0,,37.52,COP,$,$37.52,37.52,False,original,0.0093,0.0093,4047.0,from_colombia_cambio_dolar,,"Un arroz perfecto para crear deliciosas recetas Este producto es vendido, facturado y entregado por Cencosud - Colombia Los precios de los productos pueden cambiar dependiendo de la región. Aplican Términos y Condiciones Desactivados Referencia: 3419212 $ 9, 38 x gr CASTELLANO ☆ ¿Todavía tienes tu Tarjeta Cencosud? Solicítala en línea, úsala y obtén un . Aplican términos y condiciones. Solicítala aquí Mejores ofertas -25% -24% Términos más buscados 1. kefir alpina 2. muebles 3. leche 4. leche alqueria 5. san jorge 6. papel higiénico 7. arroz 8. café 9. cerveza 10. neveras",,,,,,"{""Descripción"": [""Un arroz perfecto para crear deliciosas recetas"", ""Este producto es vendido, facturado y entregado por"", ""Cencosud - Colombia"", ""Los precios de los productos pueden cambiar dependiendo de la región."", ""Aplican Términos y Condiciones"", ""Desactivado"", ""Referencia: 3419212"", ""$"", ""9"", "","", ""38"", ""x"", ""gr"", ""CASTELLANO"", ""☆"", ""¿Todavía tienes tu Tarjeta Cencosud?"", ""Solicítala en línea, úsala y obtén un"", "". Aplican términos y condiciones."", ""Solicítala aquí"", ""Mejores ofertas"", ""-25%"", ""-24%"", ""Términos más buscados"", ""1."", ""kefir alpina"", ""2."", ""muebles"", ""3."", ""leche"", ""4."", ""leche alqueria"", ""5."", ""san jorge"", ""6."", ""papel higienico"", ""7."", ""arroz"", ""8."", ""cafe"", ""9."", ""cerveza"", ""10."", ""neveras""]}",dataset/txt_limpios/667.txt,dataset/paginas_descargadas/667.html,ET,cafe,keep,0.60,heuristic_default
668,"ASESORAMOS TU COMPRA: 📞(601) 6672004, lun a sab de 7am.a 7pm dom hasta las 6pm","Este producto es vendido, facturado y entregado por Cencosud - Colombia Los precios de los productos pueden cambiar dependiendo de la región. Aplican Términos y Condiciones Desactivados Referencia: 0330114 SONORA ☆ ¿Todavía tienes tu Tarjeta Cencosud? Solicítala en línea, úsala y obtén un . Aplican términos y condiciones. Solicítala aquí Mejores ofertas -5% Términos más buscados 1. kefir alpina 2. muebles 3. leche 4. leche alqueria 5. san jorge 6. papel higiénico 7. arroz 8. café 9. cerveza 10. neveras",otras ciudades consulta aquí > 0330114,14.09,COP,,Desconocido,unknown,CO,"ASESORAMOS TU COMPRA: 📞(601) 6672004, lun a sab de 7am.a 7pm dom hasta las 6pm",otras ciudades consulta aquí,330114.0,,14.09,COP,$,$14.09,14.09,False,original,0.0035,0.0035,4047.0,from_colombia_cambio_dolar,,"Este producto es vendido, facturado y entregado por Cencosud - Colombia Los precios de los productos pueden cambiar dependiendo de la región. Aplican Términos y Condiciones Desactivados Referencia: 0330114 SONORA ☆ ¿Todavía tienes tu Tarjeta Cencosud? Solicítala en línea, úsala y obtén un . Aplican términos y condiciones. Solicítala aquí Mejores ofertas -5% Términos más buscados 1. kefir alpina 2. muebles 3. leche 4. leche alqueria 5. san jorge 6. papel higiénico 7. arroz 8. café 9. cerveza 10. neveras",,,,,,"{""Descripción"": [""Este producto es vendido, facturado y entregado por"", ""Cencosud - Colombia"", ""Los precios de los productos pueden cambiar dependiendo de la región."", ""Aplican Términos y Condiciones"", ""Desactivado"", ""Referencia: 0330114"", ""SONORA"", ""☆"", ""¿Todavía tienes tu Tarjeta Cencosud?"", ""Solicítala en línea, úsala y obtén un"", "". Aplican términos y condiciones."", ""Solicítala aquí"", ""Mejores ofertas"", ""-5%"", ""Términos más buscados"", ""1."", ""kefir alpina"", ""2."", ""muebles"", ""3."", ""leche"", ""4."", ""leche alqueria"", ""5."", ""san jorge"", ""6."", ""papel higienico"", ""7."", ""arroz"", ""8."", ""cafe"", ""9."", ""cerveza"", ""10."", ""neveras""]}",dataset/txt_limpios/668.txt,dataset/paginas_descargadas/668.html,ET,cafe,keep,0.60,heuristic_default
669,"ASESORAMOS TU COMPRA: 📞(601) 6672004, lun a sab de 7am.a 7pm dom hasta las 6pm",,otras ciudades consulta aquí,,COP,,Desconocido,unknown,CO,"ASESORAMOS TU COMPRA: 📞(601) 6672004, lun a sab de 7am.a 7pm dom hasta las 6pm",otras ciudades consulta aquí,,,,COP,,,100.78,True,country_mean,,0.0249,4047.0,from_colombia_cambio_dolar,,,,,,,,{},dataset/txt_limpios/669.txt,dataset/paginas_descargadas/669.html,ET,sin_categoria,discard,0.30,no_category_detected;price_parse_failed
670,"ASESORAMOS TU COMPRA: 📞(601) 6672004, lun a sab de 7am.a 7pm dom hasta las 6pm","Este producto es vendido, facturado y entregado por Cencosud - Colombia Los precios de los productos pueden cambiar dependiendo de la región. Aplican Términos y Condiciones Desactivados Referencia: 3643446 $ 17 , 06 x gr BIMBO ☆ ¿Todavía tienes tu Tarjeta Cencosud? Solicítala en línea, úsala y obtén un . Aplican términos y condiciones. Solicítala aquí Términos más buscados 1. kefir alpina 2. muebles 3. leche 4. leche alqueria 5. san jorge 6. papel higiénico 7. arroz 8. café 9. cerveza 10. neveras",otras ciudades consulta aquí > 480G > 3643446,8.19,COP,,Desconocido,unknown,CO,"ASESORAMOS TU COMPRA: 📞(601) 6672004, lun a sab de 7am.a 7pm dom hasta las 6pm",otras ciudades consulta aquí,3643446.0,480G,8.19,COP,$,$8.19,8.19,False,original,0.002,0.002,4047.0,from_colombia_cambio_dolar,,"Este producto es vendido, facturado y entregado por Cencosud - Colombia Los precios de los productos pueden cambiar dependiendo de la región. Aplican Términos y Condiciones Desactivados Referencia: 3643446 $ 17 , 06 x gr BIMBO ☆ ¿Todavía tienes tu Tarjeta Cencosud? Solicítala en línea, úsala y obtén un . Aplican términos y condiciones. Solicítala aquí Términos más buscados 1. kefir alpina 2. muebles 3. leche 4. leche alqueria 5. san jorge 6. papel higiénico 7. arroz 8. café 9. cerveza 10. neveras",,,,,,"{""Descripción"": [""Este producto es vendido, facturado y entregado por"", ""Cencosud - Colombia"", ""Los precios de los productos pueden cambiar dependiendo de la región."", ""Aplican Términos y Condiciones"", ""Desactivado"", ""Referencia: 3643446"", ""$"", ""17"", "","", ""06"", ""x"", ""gr"", ""BIMBO"", ""☆"", ""¿Todavía tienes tu Tarjeta Cencosud?"", ""Solicítala en línea, úsala y obtén un"", "". Aplican términos y condiciones."", ""Solicítala aquí"", ""Términos más buscados"", ""1."", ""kefir alpina"", ""2."", ""muebles"", ""3."", ""leche"", ""4."", ""leche alqueria"", ""5."", ""san jorge"", ""6."", ""papel higienico"", ""7."", ""arroz"", ""8."", ""cafe"", ""9."", ""cerveza"", ""10."", ""neveras""]}",dataset/txt_limpios/670.txt,dataset/paginas_descargadas/670.html,ET,cafe,keep,0.60,heuristic_default
671,"ASESORAMOS TU COMPRA: 📞(601) 6672004, lun a sab de 7am.a 7pm dom hasta las 6pm","Ingredientes Condición alimentaria Información nutricional El pan tajado es un buen complemento para los desayunos y en cualquier hora del día. Disfruta de su delicioso sabor. Este producto es vendido, facturado y entregado por Cencosud - Colombia Los precios de los productos pueden cambiar dependiendo de la región. Aplican Términos y Condiciones Desactivados Referencia: 0016832 $ 10, 18 x gr COMAPAN ☆ ¿Todavía no tienes tu Tarjeta Cencosud? Solicítala en línea, úsala y obtén un . Aplican términos y condiciones. Solicítala aquí Mejores ofertas -35% -24% Términos más buscados 1. kefir alpina 2. muebles 3. leche 4. leche alqueria 5. san jorge 6. papel higiénico 7. arroz 8. café 9. cerveza 10. neveras",otras ciudades consulta aquí > 750 g > 0016832,7.63,COP,,Desconocido,unknown,CO,"ASESORAMOS TU COMPRA: 📞(601) 6672004, lun a sab de 7am.a 7pm dom hasta las 6pm",otras ciudades consulta aquí,16832.0,750 g,7.63,COP,$,$7.63,7.63,False,original,0.0019,0.0019,4047.0,from_colombia_cambio_dolar,,"Ingredientes Condición alimentaria Información nutricional El pan tajado es un buen complemento para los desayunos y en cualquier hora del día. Disfruta de su delicioso sabor. Este producto es vendido, facturado y entregado por Cencosud - Colombia Los precios de los productos pueden cambiar dependiendo de la región. Aplican Términos y Condiciones Desactivados Referencia: 0016832 $ 10, 18 x gr COMAPAN ☆ ¿Todavía no tienes tu Tarjeta Cencosud? Solicítala en línea, úsala y obtén un . Aplican términos y condiciones. Solicítala aquí Mejores ofertas -35% -24% Términos más buscados 1. kefir alpina 2. muebles 3. leche 4. leche alqueria 5. san jorge 6. papel higiénico 7. arroz 8. café 9. cerveza 10. neveras",,,,,,"{""Descripción"": [""Ingredientes"", ""Condición alimentaria"", ""Información nutricional"", ""El pan tajado es un buen complemento para los desayunos y en cualquier hora del día. Disfruta de su delicioso sabor."", ""Este producto es vendido, facturado y entregado por"", ""Cencosud - Colombia"", ""Los precios de los productos pueden cambiar dependiendo de la región."", ""Aplican Términos y Condiciones"", ""Desactivado"", ""Referencia: 0016832"", ""$"", ""10"", "","", ""18"", ""x"", ""gr"", ""COMAPAN"", ""☆"", ""¿Todavía tienes tu Tarjeta Cencosud?"", ""Solicítala en línea, úsala y obtén un"", "". Aplican términos y condiciones."", ""Solicítala aquí"", ""Mejores ofertas"", ""-35%"", ""-24%"", ""Términos más buscados"", ""1."", ""kefir alpina"", ""2."", ""muebles"", ""3."", ""leche"", ""4."", ""leche alqueria"", ""5."", ""san jorge"", ""6."", ""papel higienico"", ""7."", ""arroz"", ""8."", ""cafe"", ""9."", ""cerveza"", ""10."", ""neveras""]}",dataset/txt_limpios/671.txt,dataset/paginas_descargadas/671.html,ET,pan,keep,0.60,heuristic_default
672,"ASESORAMOS TU COMPRA: 📞(601) 6672004, lun a sab de 7am.a 7pm dom hasta las 6pm","Ingredientes Condición alimentaria Información nutricional Pan Bimbo, acompañando momentos desde generaciones atrás. Este producto es vendido, facturado y entregado por Cencosud - Colombia Los precios de los productos pueden cambiar dependiendo de la región. Aplican Términos y Condiciones Desactivados Referencia: 3255424 $ 22, 93 x gr BIMBO ☆ ¿Todavía tienes tu Tarjeta Cencosud? Solicítala en línea, úsala y obtén un . Aplican términos y condiciones. Solicítala aquí Términos más buscados 1. kefir alpina 2. muebles 3. leche 4. leche alqueria 5. san jorge 6. papel higiénico 7. arroz 8. café 9. cerveza 10. neveras",otras ciudades consulta aquí > 460 g > 3255424,10.55,COP,,Desconocido,unknown,CO,"ASESORAMOS TU COMPRA: 📞(601) 6672004, lun a sab de 7am.a 7pm dom hasta las 6pm",otras ciudades consulta aquí,3255424.0,460 g,10.55,COP,$,$10.55,10.55,False,original,0.0026,0.0026,4047.0,from_colombia_cambio_dolar,,"Ingredientes Condición alimentaria Información nutricional Pan Bimbo, acompañando momentos desde generaciones atrás. Este producto es vendido, facturado y entregado por Cencosud - Colombia Los precios de los productos pueden cambiar dependiendo de la región. Aplican Términos y Condiciones Desactivados Referencia: 3255424 $ 22, 93 x gr BIMBO ☆ ¿Todavía tienes tu Tarjeta Cencosud? Solicítala en línea, úsala y obtén un . Aplican términos y condiciones. Solicítala aquí Términos más buscados 1. kefir alpina 2. muebles 3. leche 4. leche alqueria 5. san jorge 6. papel higiénico 7. arroz 8. café 9. cerveza 10. neveras",,,,,,"{""Descripción"": [""Ingredientes"", ""Condición alimentaria"", ""Información nutricional"", ""Pan Bimbo, acompañando momentos desde generaciones atrás."", ""Este producto es vendido, facturado y entregado por"", ""Cencosud - Colombia"", ""Los precios de los productos pueden cambiar dependiendo de la región."", ""Aplican Términos y Condiciones"", ""Desactivado"", ""Referencia: 3255424"", ""$"", ""22"", "","", ""93"", ""x"", ""gr"", ""BIMBO"", ""☆"", ""¿Todavía tienes tu Tarjeta Cencosud?"", ""Solicítala en línea, úsala y obtén un"", "". Aplican términos y condiciones."", ""Solicítala aquí"", ""Términos más buscados"", ""1."", ""kefir alpina"", ""2."", ""muebles"", ""3."", ""leche"", ""4."", ""leche alqueria"", ""5."", ""san jorge"", ""6."", ""papel higienico"", ""7."", ""arroz"", ""8."", ""cafe"", ""9."", ""cerveza"", ""10."", ""neveras""]}",dataset/txt_limpios/672.txt,dataset/paginas_descargadas/672.html,ET,cafe,keep,0.60,heuristic_default
673,"ASESORAMOS TU COMPRA: 📞(601) 6672004, lun a sab de 7am.a 7pm dom hasta las 6pm","Ingredientes Condición alimentaria Información nutricional Lleva tu Pan Mauka sagu tajado sin gluten x450g Este producto es vendido, facturado y entregado por Cencosud - Colombia Los precios de los productos pueden cambiar dependiendo de la región. Aplican Términos y Condiciones Desactivados Referencia: 3445100 $ 29 , 22 x gr MAUKA ☆ ¿Todavía tienes tu Tarjeta Cencosud? Solicítala en línea, úsala y obtén un . Aplican términos y condiciones. Solicítala aquí Mejores ofertas -15% Términos más buscados 1. kefir alpina 2. muebles 3. leche 4. leche alqueria 5. san jorge 6. papel higiénico 7. arroz 8. café 9. cerveza 10. neveras",otras ciudades consulta aquí > 3445100,13.15,COP,,Desconocido,unknown,CO,"ASESORAMOS TU COMPRA: 📞(601) 6672004, lun a sab de 7am.a 7pm dom hasta las 6pm",otras ciudades consulta aquí,3445100.0,,13.15,COP,$,$13.15,13.15,False,original,0.0032,0.0032,4047.0,from_colombia_cambio_dolar,,"Ingredientes Condición alimentaria Información nutricional Lleva tu Pan Mauka sagu tajado sin gluten x450g Este producto es vendido, facturado y entregado por Cencosud - Colombia Los precios de los productos pueden cambiar dependiendo de la región. Aplican Términos y Condiciones Desactivados Referencia: 3445100 $ 29 , 22 x gr MAUKA ☆ ¿Todavía tienes tu Tarjeta Cencosud? Solicítala en línea, úsala y obtén un . Aplican términos y condiciones. Solicítala aquí Mejores ofertas -15% Términos más buscados 1. kefir alpina 2. muebles 3. leche 4. leche alqueria 5. san jorge 6. papel higiénico 7. arroz 8. café 9. cerveza 10. neveras",,,,,,"{""Descripción"": [""Ingredientes"", ""Condición alimentaria"", ""Información nutricional"", ""Lleva tu Pan Mauka sagu tajado sin gluten x450g"", ""Este producto es vendido, facturado y entregado por"", ""Cencosud - Colombia"", ""Los precios de los productos pueden cambiar dependiendo de la región."", ""Aplican Términos y Condiciones"", ""Desactivado"", ""Referencia: 3445100"", ""$"", ""29"", "","", ""22"", ""x"", ""gr"", ""MAUKA"", ""☆"", ""¿Todavía tienes tu Tarjeta Cencosud?"", ""Solicítala en línea, úsala y obtén un"", "". Aplican términos y condiciones."", ""Solicítala aquí"", ""Mejores ofertas"", ""-15%"", ""Términos más buscados"", ""1."", ""kefir alpina"", ""2."", ""muebles"", ""3."", ""leche"", ""4."", ""leche alqueria"", ""5."", ""san jorge"", ""6."", ""papel higienico"", ""7."", ""arroz"", ""8."", ""cafe"", ""9."", ""cerveza"", ""10."", ""neveras""]}",dataset/txt_limpios/673.txt,dataset/paginas_descargadas/673.html,ET,cafe,keep,0.60,heuristic_default
674,"ASESORAMOS TU COMPRA: 📞(601) 6672004, lun a sab de 7am.a 7pm dom hasta las 6pm",,otras ciudades consulta aquí > 550 g > 0620253,6.89,COP,,Desconocido,unknown,CO,"ASESORAMOS TU COMPRA: 📞(601) 6672004, lun a sab de 7am.a 7pm dom hasta las 6pm",otras ciudades consulta aquí,620253.0,550 g,6.89,COP,$,$6.89,6.89,False,original,0.0017,0.0017,4047.0,from_colombia_cambio_dolar,,,,,,,,{},dataset/txt_limpios/674.txt,dataset/paginas_descargadas/674.html,ET,sin_categoria,discard,0.30,no_category_detected
675,"ASESORAMOS TU COMPRA: 📞(601) 6672004, lun a sab de 7am.a 7pm dom hasta las 6pm",,otras ciudades consulta aquí > 0460684,39.09,COP,,Desconocido,unknown,CO,"ASESORAMOS TU COMPRA: 📞(601) 6672004, lun a sab de 7am.a 7pm dom hasta las 6pm",otras ciudades consulta aquí,460684.0,,39.09,COP,$,$39.09,39.09,False,original,0.0097,0.0097,4047.0,from_colombia_cambio_dolar,,,,,,,,{},dataset/txt_limpios/675.txt,dataset/paginas_descargadas/675.html,ET,sin_categoria,discard,0.30,no_category_detected
