{"source_id": "1167", "title": "Centro de preferencia de la privacidad", "description": "", "breadcrumbs": "Activas siempre > 1L", "price_raw": "", "currency_raw": "PEN", "url": "", "seller": "Desconocido", "availability": "unknown", "country": "PE", "product_name": "Centro de preferencia de la privacidad", "brand": "Activas siempre", "reference": "", "unit": "1L", "price_amount": null, "price_currency": "PEN", "price_symbol": "", "price_text": "", "price_amount_filled": "55.14", "price_is_imputed": "True", "price_imputation_source": "country_mean", "price_amount_usd": "", "price_amount_usd_filled": "15.5336", "fx_rate_local_per_usd": "3.55", "fx_source": "from_peru_cambio_dolar", "information_text": "", "description_text": "", "features_text": "TE RECOMENDAMOS | CREMONINI | Aceite de Oliva CREMONINI Extra Virgen Botella 250ml | 29 | 50 | HUERTO ALAMEIN | Aceite de Oliva HUERTO ALAMEIN Extra Virgen Botella 500ml | 39 | 30 | -19% | OLIVOS DEL SUR | Aceite de Oliva OLIVOS DEL SUR Extra Virgen Botella 200ml | 25 | 90 | 19 % | Aceite de Oliva BELL'S Puro Botella 200ml | 13 | VALDEPORRES | Aceite de Oliva VALDEPORRES Virgen Botella 1L | 61 | 10 | -2% | ACAVILLE | Aceite de Oliva ACAVILLE Extra Virgen Botella 200ml | 15 | 14 | 2% | EL CORTE INGLÉS | Aceite de Oliva EL CORTE INGLÉS Extra Virgen Botella 1L | 56 | Aceite de Oliva Extra Virgen OLIVOS DEL SUR Botella 1L | 71 | Aceite de Oliva OLIVOS DEL SUR Extra Virgen Kids Botella 250ml | 42 | 80 | -12% | GATTI | Aceite de Oliva GATTI Extra Virgen Botella 500ml | 43 | 38 | 70 | 12% | - Entérate de eventos exclusivos y promociones especiales que tenemos para ti! | SUSCRIBIRME | Acepto las políticas de tratamientos de datos personales | Razón Social: Compañía Food Retail S.A.C. RUC: 20608300393. Todos los derechos reservados Vivanda 2023. | | Hola! | Encuentra todo lo que necesitas en Vivanda online | Términos más buscados | 1. | quesos | 2. | vino | 3. | café | 4. | quark 500g | 5. | leche | 6. | pollo | 7. | yogurt | 8. | lunch florencia | 9. | agua | 10 | vinos", "specifications_text": "", "benefits_text": "", "details_text": "", "other_sections": "", "sections": {"Características": ["TE RECOMENDAMOS", "CREMONINI", "Aceite de Oliva CREMONINI Extra Virgen Botella 250ml", "29", "50", "HUERTO ALAMEIN", "Aceite de Oliva HUERTO ALAMEIN Extra Virgen Botella 500ml", "39", "30", "-19%", "OLIVOS DEL SUR", "Aceite de Oliva OLIVOS DEL SUR Extra Virgen Botella 200ml", "25", "90", "20", "19%", "Aceite de Oliva BELL'S Puro Botella 200ml", "13", "VALDEPORRES", "Aceite de Oliva VALDEPORRES Virgen Botella 1L", "61", "10", "-2%", "ACAVILLE", "Aceite de Oliva ACAVILLE Extra Virgen Botella 200ml", "15", "14", "2%", "EL CORTE INGLÉS", "Aceite de Oliva EL CORTE INGLÉS Extra Virgen Botella 1L", "56", "Aceite de Oliva Extra Virgen OLIVOS DEL SUR Botella 1L", "71", "Aceite de Oliva OLIVOS DEL SUR Extra Virgen Kids Botella 250ml", "42", "80", "-12%", "GATTI", "Aceite de Oliva GATTI Extra Virgen Botella 500ml", "43", "38", "70", "12%", "¡Entérate de eventos exclusivos y promociones especiales que tenemos para ti!", "SUSCRIBIRME", "Acepto las políticas de tratamiento de datos personales", "Razón social: Compañía Food Retail S.A.C. RUC: 20608300393. Todos los derechos reservados Vivanda 2023.", "¡Hola!", "Encuentra todo lo que necesitas en Vivanda online", "Términos más buscados", "1.", "quesos", "2.", "vino", "3.", "cafe", "4.", "quark 500g", "5.", "leche", "6.", "pollo", "7.", "yogurt", "8.", "lunch florencia", "9.", "agua", "10.", "vinos"]}, "txt_path": "dataset/txt_limpios/1167.txt", "html_path": "dataset/paginas_descargadas/1167.html", "es_status": "ET", "category_canonical": "sin_categoria", "decision": "discard", "match_score": 0.3, "reasons": "no_category_detected;price_parse_failed"}
{"source_id": "1168", "title": "Centro de preferencia de la privacidad", "description": "", "breadcrumbs": "Activas siempre > 1L", "price_raw": "", "currency_raw": "PEN", "url": "", "seller": "Desconocido", "availability": "unknown", "country": "PE", "product_name": "Centro de preferencia de la privacidad", "brand": "Activas siempre", "reference": "", "unit": "1L", "price_amount": null, "price_currency": "PEN", "price_symbol": "", "price_text": "", "price_amount_filled": "55.14", "price_is_imputed": "True", "price_imputation_source": "country_mean", "price_amount_usd": "", "price_amount_usd_filled": "15.5336", "fx_rate_local_per_usd": "3.55", "fx_source": "from_peru_cambio_dolar", "information_text": "", "description_text": "", "features_text": "TE RECOMENDAMOS | -15% | GATTI | Aceite de Oliva GATTI Extra Virgen Botella 250ml | 26 | 50 | 22 | 15% | -2% | OLIVOS DEL SUR | Aceite de Oliva Extra Virgen OLIVO DEL SUR Premium Botella 750ml | 52 | 90 | 51 | 2% | Aceite de Oliva CARBONELL Puro Frasco 200ml | 40 | HUERTO ALAMEIN | Aceite de Oliva HUERTO ALAMEIN Extra Virgen Spray 275ml | 25 | VALDEPORRES | Aceite de Oliva VALDEPORRES Suave Botella 1L | 61 | 10 | Aceite de Oliva CARBONELL Sabor Afrutado Intenso Botella 500ml | 45 | 80 | EL OLIVAR | Aceite de Oliva EL OLIVAR Extra Virgen Botella 500ml | 38 | EL CORTE INGLÉS | Aceite de Oliva EL CORTE INGLÉS Extra Virgen Botella 1L | 56 | Aceite de Oliva VALDEPORRES Extra Virgen Botella 1L | 74 | Aceite de Oliva Extra Virgen OLIVOS DEL SUR Botella 1L | 30 | ¡Entérate de eventos exclusivos y promociones especiales que tenemos para ti! | SUSCRIBIRME | Acepto las políticas de tratamientos de datos personales | Razón Social: Compañía Food Retail S.A.C. RUC: 20608300393. Todos los derechos reservados Vivanda 2023. | | Hola! | Encuentra todo lo que necesitas en Vivanda online | Términos más buscados | 1. | quesos | 2. | vino | 3. | café | 4. | quark 500g | 5. | leche | 6. | pollo | 7. | yogurt | 8. | lunch florencia | 9. | agua | 10 | vinos", "specifications_text": "", "benefits_text": "", "details_text": "", "other_sections": "", "sections": {"Características": ["TE RECOMENDAMOS", "-15%", "GATTI", "Aceite de Oliva GATTI Extra Virgen Botella 250ml", "26", "50", "22", "15%", "-2%", "OLIVOS DEL SUR", "Aceite de Oliva Extra Virgen OLIVO DEL SUR Premium Botella 750ml", "52", "90", "51", "2%", "Aceite de Oliva CARBONELL Puro Frasco 200ml", "40", "HUERTO ALAMEIN", "Aceite de Oliva HUERTO ALAMEIN Extra Virgen Spray 275ml", "25", "VALDEPORRES", "Aceite de Oliva VALDEPORRES Suave Botella 1L", "61", "10", "Aceite de Oliva CARBONELL Sabor Afrutado Intenso Botella 500ml", "45", "80", "EL OLIVAR", "Aceite de Oliva EL OLIVAR Extra Virgen Botella 500ml", "38", "EL CORTE INGLÉS", "Aceite de Oliva EL CORTE INGLÉS Extra Virgen Botella 1L", "56", "Aceite de Oliva VALDEPORRES Extra Virgen Botella 1L", "74", "Aceite de Oliva Extra Virgen OLIVOS DEL SUR Botella 1L", "30", "¡Entérate de eventos exclusivos y promociones especiales que tenemos para ti!", "SUSCRIBIRME", "Acepto las políticas de tratamiento de datos personales", "Razón social: Compañía Food Retail S.A.C. RUC: 20608300393. Todos los derechos reservados Vivanda 2023.", "¡Hola!", "Encuentra todo lo que necesitas en Vivanda online", "Términos más buscados", "1.", "quesos", "2.", "vino", "3.", "cafe", "4.", "quark 500g", "5.", "leche", "6.", "pollo", "7.", "yogurt", "8.", "lunch florencia", "9.", "agua", "10.", "vinos"]}, "txt_path": "dataset/txt_limpios/1168.txt", "html_path": "dataset/paginas_descargadas/1168.html", "es_status": "ET", "category_canonical": "sin_categoria", "decision": "discard", "match_score": 0.3, "reasons": "no_category_detected;price_parse_failed"}
{"source_id": "1169", "title": "Centro de preferencia de la privacidad", "description": "", "breadcrumbs": "Activas siempre > 900ml", "price_raw": "", "currency_raw": "PEN", "url": "", "seller": "Desconocido", "availability": "unknown", "country": "PE", "product_name": "Centro de preferencia de la privacidad", "brand": "Activas siempre", "reference": "", "unit": "900ml", "price_amount": null, "price_currency": "PEN", "price_symbol": "", "price_text": "", "price_amount_filled": "55.14", "price_is_imputed": "True", "price_imputation_source": "country_mean", "price_amount_usd": "", "price_amount_usd_filled": "15.5336", "fx_rate_local_per_usd": "3.55", "fx_source": "from_peru_cambio_dolar", "information_text": "", "description_text": "", "features_text": "TE RECOMENDAMOS | FLORIDA | Aceite de Maíz FLORIDA Botella 900ml | 14 | 90 | -4% | BELL'S SELECCIÓN | Acepto Girasol BELL'S SELECCIÓN Botella 900ml | 7 | -Entérate de eventos exclusivos y promociones especiales que tenemos para ti! | SUSCRIBIRME | Acepto las políticas de tratamientos de datos personales | Razón Social: Compañía Food Retail S.A.C. RUC: 20608300393. Todos los derechos reservados Vivanda 2023. | | Hola! | Encuentra todo lo que necesitas en Vivanda online | Términos más buscados | 1. | quesos | 2. | vino | 3. | café | 4. | quark 500g | 5. | leche | 6. | pollo | 7. | yogurt | 8. | lunch florencia | 9. | agua | 10 | vinos", "specifications_text": "", "benefits_text": "", "details_text": "", "other_sections": "", "sections": {"Características": ["TE RECOMENDAMOS", "FLORIDA", "Aceite de Maíz FLORIDA Botella 900ml", "14", "90", "-4%", "BELL'S SELECCIÓN", "Aceite Girasol BELL'S SELECCIÓN Botella 900ml", "7", "¡Entérate de eventos exclusivos y promociones especiales que tenemos para ti!", "SUSCRIBIRME", "Acepto las políticas de tratamiento de datos personales", "Razón social: Compañía Food Retail S.A.C. RUC: 20608300393. Todos los derechos reservados Vivanda 2023.", "¡Hola!", "Encuentra todo lo que necesitas en Vivanda online", "Términos más buscados", "1.", "quesos", "2.", "vino", "3.", "cafe", "4.", "quark 500g", "5.", "leche", "6.", "pollo", "7.", "yogurt", "8.", "lunch florencia", "9.", "agua", "10.", "vinos"]}, "txt_path": "dataset/txt_limpios/1169.txt", "html_path": "dataset/paginas_descargadas/1169.html", "es_status": "ET", "category_canonical": "sin_categoria", "decision": "discard", "match_score": 0.3, "reasons": "no_category_detected;price_parse_failed"}
{"source_id": "1170", "title": "Centro de preferencia de la privacidad", "description": "", "breadcrumbs": "Activas siempre > 500g", "price_raw": "", "currency_raw": "PEN", "url": "", "seller": "Desconocido", "availability": "unknown", "country": "PE", "product_name": "Centro de preferencia de la privacidad", "brand": "Activas siempre", "reference": "", "unit": "500g", "price_amount": null, "price_currency": "PEN", "price_symbol": "", "price_text": "", "price_amount_filled": "55.14", "price_is_imputed": "True", "price_imputation_source": "country_mean", "price_amount_usd": "", "price_amount_usd_filled": "15.5336", "fx_rate_local_per_usd": "3.55", "fx_source": "from_peru_cambio_dolar", "information_text": "", "description_text": "", "features_text": "", "specifications_text": "", "benefits_text": "", "details_text": "", "other_sections": "", "sections": {}, "txt_path": "dataset/txt_limpios/1170.txt", "html_path": "dataset/paginas_descargadas/1170.html", "es_status": "EN", "category_canonical": "sin_categoria", "decision": "discard", "match_score": 0.3, "reasons": "no_category_detected;price_parse_failed"}
{"source_id": "1171", "title": "Centro de preferencia de la privacidad", "description": "", "breadcrumbs": "Activas siempre > 946ml", "price_raw": "", "currency_raw": "PEN", "url": "", "seller": "Desconocido", "availability": "unknown", "country": "PE", "product_name": "Centro de preferencia de la privacidad", "brand": "Activas siempre", "reference": "", "unit": "946ml", "price_amount": null, "price_currency": "PEN", "price_symbol": "", "price_text": "", "price_amount_filled": "55.14", "price_is_imputed": "True", "price_imputation_source": "country_mean", "price_amount_usd": "", "price_amount_usd_filled": "15.5336", "fx_rate_local_per_usd": "3.55", "fx_source": "from_peru_cambio_dolar", "information_text": "", "description_text": "", "features_text": "TE RECOMENDAMOS | GLORIA | Leche UHT GLORIA Niños Sabor a Chocolate Caja 180ml Paquete 6un | 10 | 80 | BELL'S | Leche Light BELL'S Caja 1L | 5 | 30 | Leche sin Lactosa LAIVE UHT Tetrapack 946ml | Leche UHT GLORIA Entera Bolsa 800ml Paquete 3un | 15 | 70 | VAKIMU | Leche Pasteurizada VAKIMU Botella 900ml | 8 | DANLAC | Leche DANLAC Pasteurizada Chocolate Botella 250ml | No disponible | Leche UHT sin Lactosa GLORIA Zero Caja 946ml Paquete 3un | 18 | 50 | Leche UHT GLORIA Entera Caja 946ml Paquete 3un | Leche UHT GLORIA Light Caja 946ml Paquete 3un | -7% | Leche sin Lactosa LAIVE UHT Light Caja 946ml Paquete 4un | 23 | 60 | 21 | 90 | 7% | ¡Entérate de eventos exclusivos y promociones especiales que tenemos para ti! | SUSCRIBIRME | Acepto las políticas de tratamientos de datos personales | Razón Social: Compañía Food Retail S.A.C. RUC: 20608300393. Todos los derechos reservados Vivanda 2023. | | | Hola! | Encuentra todo lo que necesitas en Vivanda online | Términos más buscados | 1. | quesos | 2. | vino | 3. | café | 4. | quark 500g | 5. | 6. | pollo | 7. | yogurt | 8. | lunch florencia | 9. | agua | 10 | vinos", "specifications_text": "", "benefits_text": "", "details_text": "", "other_sections": "", "sections": {"Características": ["TE RECOMENDAMOS", "GLORIA", "Leche UHT GLORIA Niños Sabor a Chocolate Caja 180ml Paquete 6un", "10", "80", "BELL'S", "Leche Light BELL'S Caja 1L", "5", "30", "Leche sin Lactosa LAIVE UHT Tetrapack 946ml", "Leche UHT GLORIA Entera Bolsa 800ml Paquete 3un", "15", "70", "VAKIMU", "Leche Pasteurizada VAKIMU Botella 900ml", "8", "DANLAC", "Leche DANLAC Pasteurizada Chocolate Botella 250ml", "No disponible", "Leche UHT sin Lactosa GLORIA Zero Caja 946ml Paquete 3un", "18", "50", "Leche UHT GLORIA Entera Caja 946ml Paquete 3un", "Leche UHT GLORIA Light Caja 946ml Paquete 3un", "-7%", "Leche sin Lactosa LAIVE UHT Light Caja 946ml Paquete 4un", "23", "60", "21", "90", "7%", "¡Entérate de eventos exclusivos y promociones especiales que tenemos para ti!", "SUSCRIBIRME", "Acepto las políticas de tratamiento de datos personales", "Razón social: Compañía Food Retail S.A.C. RUC: 20608300393. Todos los derechos reservados Vivanda 2023.", "¡Hola!", "Encuentra todo lo que necesitas en Vivanda online", "Términos más buscados", "1.", "quesos", "2.", "vino", "3.", "cafe", "4.", "quark 500g", "5.", "6.", "pollo", "7.", "yogurt", "8.", "lunch florencia", "9.", "agua", "10.", "vinos"]}, "txt_path": "dataset/txt_limpios/1171.txt", "html_path": "dataset/paginas_descargadas/1171.html", "es_status": "ET", "category_canonical": "sin_categoria", "decision": "discard", "match_score": 0.3, "reasons": "no_category_detected;price_parse_failed"}
{"source_id": "1172", "title": "Centro de preferencia de la privacidad", "description": "", "breadcrumbs": "Activas siempre > 900ml", "price_raw": "", "currency_raw": "PEN", "url": "", "seller": "Desconocido", "availability": "unknown", "country": "PE", "product_name": "Centro de preferencia de la privacidad", "brand": "Activas siempre", "reference": "", "unit": "900ml", "price_amount": null, "price_currency": "PEN", "price_symbol": "", "price_text": "", "price_amount_filled": "55.14", "price_is_imputed": "True", "price_imputation_source": "country_mean", "price_amount_usd": "", "price_amount_usd_filled": "15.5336", "fx_rate_local_per_usd": "3.55", "fx_source": "from_peru_cambio_dolar", "information_text": "", "description_text": "", "features_text": "", "specifications_text": "", "benefits_text": "", "details_text": "", "other_sections": "", "sections": {}, "txt_path": "dataset/txt_limpios/1172.txt", "html_path": "dataset/paginas_descargadas/1172.html", "es_status": "EN", "category_canonical": "sin_categoria", "decision": "discard", "match_score": 0.3, "reasons": "no_category_detected;price_parse_failed"}
{"source_id": "1173", "title": "Centro de preferencia de la privacidad", "description": "", "breadcrumbs": "Activas siempre > 1L", "price_raw": "", "currency_raw": "PEN", "url": "", "seller": "Desconocido", "availability": "unknown", "country": "PE", "product_name": "Centro de preferencia de la privacidad", "brand": "Activas siempre", "reference": "", "unit": "1L", "price_amount": null, "price_currency": "PEN", "price_symbol": "", "price_text": "", "price_amount_filled": "55.14", "price_is_imputed": "True", "price_imputation_source": "country_mean", "price_amount_usd": "", "price_amount_usd_filled": "15.5336", "fx_rate_local_per_usd": "3.55", "fx_source": "from_peru_cambio_dolar", "information_text": "", "description_text": "", "features_text": "TE RECOMENDAMOS | LAIVE | Leche sin Lactosa LAIVE UHT Tetrapack 946ml | 6 | VAKIMU | Leche Pasteurizada VAKIMU Botella 900ml | 8 | 10 | -17% | ORASI | Bebida de Arroz Orasi Caja 1L | 16 | 13 | 50 | 17% | GLORIA | Leche UHT GLORIA Niños Pack 3un x 1L | 18 | Leche Pasteurizada VAKIMU Chocolatada Botella 900ml | No disponible | DANLAC | Leche DANLAC Pasteurizada Chocolate Botella 250ml | Leche UHT LAIVE Entera Light Bolsa 900ml | Leche Light BELL'S Caja 1L | 30 | Leche LAIVE UHT Entera Tetrapack 946ml | Leche LAIVE UHT Light Caja 946ml Paquete 4un | 23 | 90 | ¡Entérate de eventos exclusivos y promociones especiales que tenemos para ti! | SUSCRIBIRME | Acepto las políticas de tratamientos de datos personales | Razón Social: Compañía Food Retail S.A.C. RUC: 20608300393. Todos los derechos reservados Vivanda 2023. | | | Hola! | Encuentra todo lo que necesitas en Vivanda online | Términos más buscados | 1. | quesos | 2. | vino | 3. | café | 4. | quark 500g | 5. | 6. | pollo | 7. | yogurt | 8. | lunch florencia | 9. | agua | 10 | vinos", "specifications_text": "", "benefits_text": "", "details_text": "", "other_sections": "", "sections": {"Características": ["TE RECOMENDAMOS", "LAIVE", "Leche sin Lactosa LAIVE UHT Tetrapack 946ml", "6", "VAKIMU", "Leche Pasteurizada VAKIMU Botella 900ml", "8", "10", "-17%", "ORASI", "Bebida de Arroz Orasi Caja 1L", "16", "13", "50", "17%", "GLORIA", "Leche UHT GLORIA Niños Pack 3un x 1L", "18", "Leche Pasteurizada VAKIMU Chocolatada Botella 900ml", "No disponible", "DANLAC", "Leche DANLAC Pasteurizada Chocolate Botella 250ml", "Leche UHT LAIVE Entera Light Bolsa 900ml", "Leche Light BELL'S Caja 1L", "30", "Leche LAIVE UHT Entera Tetrapack 946ml", "Leche LAIVE UHT Light Caja 946ml Paquete 4un", "23", "90", "¡Entérate de eventos exclusivos y promociones especiales que tenemos para ti!", "SUSCRIBIRME", "Acepto las políticas de tratamiento de datos personales", "Razón social: Compañía Food Retail S.A.C. RUC: 20608300393. Todos los derechos reservados Vivanda 2023.", "¡Hola!", "Encuentra todo lo que necesitas en Vivanda online", "Términos más buscados", "1.", "quesos", "2.", "vino", "3.", "cafe", "4.", "quark 500g", "5.", "6.", "pollo", "7.", "yogurt", "8.", "lunch florencia", "9.", "agua", "10.", "vinos"]}, "txt_path": "dataset/txt_limpios/1173.txt", "html_path": "dataset/paginas_descargadas/1173.html", "es_status": "ET", "category_canonical": "sin_categoria", "decision": "discard", "match_score": 0.3, "reasons": "no_category_detected;price_parse_failed"}
