{"source_id": "1719", "title": "Panadería y Pastelería", "description": "Pan de Molde Integral Grande Pan Pierre 580g | Actualizado al: 24-02-2025 Ingredientes: Harina de trigo, Harina de trigo integral de grano entero, Agua, Levadura, Salvado de trigo, Gluten de trigo, Aceite de soya, Aceite de maravilla, Antioxidante tbhq, Sal, Azúcar, Propionato de calcio, Goma guar, Ácido láctico, Mono y diglicéridos de ácidos grasos, Estearoil lactilato de sodio, Color caramelo, Ácido sórbico, Ácido ascórbico, Gluten. Alérgenos: Gluten. Trazas: Leche, Soya, Nueces, Semillas de sésamo. Certificados: Libre de Lactosa Libre de Huevo Libre de Peces Libre de Mariscos Libre de Maní Libre de Sulfitos Porción: 2 Rebanadas (48g) Porciones por envase: 12 100g 1 Porción Energía (kCal) 244 117.1 Proteínas (g) 10.8 5.2 Grasas Totales 2.9 1.4 Grasas saturadas (g) 0.8 0.4 Grasas monoinsaturadas (g) 0.7 0.3 Grasas poliinsaturadas (g) 1.5 Grasas trans (g) 0 Colesterol (mg) Hidratos de carbono disponibles 43 20.6 Azúcares totales (g) 2 1 Fibra 5.3 2.5 Sodio 397 190.6 Importante: La información del empaque y/o contenido del producto final puede diferir respecto a lo que mostramos en nuestro sitio web, tanto a nivel de ingredientes, trazas, información nutricional, sellos, modo de uso y/o modo de conservación. Usted no debe basarse únicamente en la información que se muestra en nuestro sitio web y siempre debe leer las etiquetas, advertencias e instrucciones antes de usar o consumir un producto. Información obtenida de PAN MOLDE INTEGRAL GRANDE 580 GR PAN PIERRE Productos similares Pan de Molde Integral XL Pierre 700 g -28% Ver producto Pan de Molde Artesano Integral Pan de Molde Blanco Familiar Pan de Molde Blanco XL Pierre 700 g Pan de Molde Integral Pan Pita Integral Pan Molde High Low Pan de Molde Integral Familiar Pan de Molde Integral XL Castaño 700 g Pan Pita Perfecto Pan de Molde Integral con Prebióticos Castaño 600 g Pan de Molde Multigrano Pan Molde Multigrano Jirafa -41% Pan Molde Blanco ¡Juntos son mejores! Pechuga de Pavo Cocida Corte Pluma Receta del Abuelo 125 g Yoghurt Batido Vainilla Jamón Colonial Granel KG -11% -21% Pack Yoghurt Batido Colun 12 x 125 g -12% Jamón Artesanal Pf  a Granel Jamón Acaramelado Pf a Granel -16% Jamón Pierna Artesanal Granel -22%", "breadcrumbs": "Panadería > 580 GR", "price_raw": "2.99", "currency_raw": "", "url": "", "seller": "Desconocido", "availability": "unknown", "country": "UNKNOWN", "product_name": "Panadería y Pastelería", "brand": "Panadería", "reference": "", "unit": "580 GR", "price_amount": 2.99, "price_currency": "", "price_symbol": "", "price_text": "2.99", "price_amount_filled": "2.99", "price_is_imputed": "False", "price_imputation_source": "original", "price_amount_usd": "2.99", "price_amount_usd_filled": "2.99", "fx_rate_local_per_usd": "1.0", "fx_source": "default_1usd", "information_text": "", "description_text": "Pan de Molde Integral Grande Pan Pierre 580g | Actualizado al: 24-02-2025 Ingredientes: Harina de trigo, Harina de trigo integral de grano entero, Agua, Levadura, Salvado de trigo, Gluten de trigo, Aceite de soya, Aceite de maravilla, Antioxidante tbhq, Sal, Azúcar, Propionato de calcio, Goma guar, Ácido láctico, Mono y diglicéridos de ácidos grasos, Estearoil lactilato de sodio, Color caramelo, Ácido sórbico, Ácido ascórbico, Gluten. Alérgenos: Gluten. Trazas: Leche, Soya, Nueces, Semillas de sésamo. Certificados: Libre de Lactosa Libre de Huevo Libre de Peces Libre de Mariscos Libre de Maní Libre de Sulfitos Porción: 2 Rebanadas (48g) Porciones por envase: 12 100g 1 Porción Energía (kCal) 244 117.1 Proteínas (g) 10.8 5.2 Grasas Totales 2.9 1.4 Grasas saturadas (g) 0.8 0.4 Grasas monoinsaturadas (g) 0.7 0.3 Grasas poliinsaturadas (g) 1.5 Grasas trans (g) 0 Colesterol (mg) Hidratos de carbono disponibles 43 20.6 Azúcares totales (g) 2 1 Fibra 5.3 2.5 Sodio 397 190.6 Importante: La información del empaque y/o contenido del producto final puede diferir respecto a lo que mostramos en nuestro sitio web, tanto a nivel de ingredientes, trazas, información nutricional, sellos, modo de uso y/o modo de conservación. Usted no debe basarse únicamente en la información que se muestra en nuestro sitio web y siempre debe leer las etiquetas, advertencias e instrucciones antes de usar o consumir un producto. Información obtenida de PAN MOLDE INTEGRAL GRANDE 580 GR PAN PIERRE Productos similares Pan de Molde Integral XL Pierre 700 g -28% Ver producto Pan de Molde Artesano Integral Pan de Molde Blanco Familiar Pan de Molde Blanco XL Pierre 700 g Pan de Molde Integral Pan Pita Integral Pan Molde High Low Pan de Molde Integral Familiar Pan de Molde Integral XL Castaño 700 g Pan Pita Perfecto Pan de Molde Integral con Prebióticos Castaño 600 g Pan de Molde Multigrano Pan Molde Multigrano Jirafa -41% Pan Molde Blanco ¡Juntos son mejores! Pechuga de Pavo Cocida Corte Pluma Receta del Abuelo 125 g Yoghurt Batido Vainilla Jamón Colonial Granel KG -11% -21% Pack Yoghurt Batido Colun 12 x 125 g -12% Jamón Artesanal Pf  a Granel Jamón Acaramelado Pf a Granel -16% Jamón Pierna Artesanal Granel -22%", "features_text": "", "specifications_text": "", "benefits_text": "", "details_text": "", "other_sections": "", "sections": {"Descripción": ["Pan de Molde Integral Grande Pan Pierre", "580g | Actualizado al: 24-02-2025", "Ingredientes: Harina de trigo, Harina de trigo integral de grano entero, Agua, Levadura, Salvado de trigo, Gluten de trigo, Aceite de soya, Aceite de maravilla, Antioxidante tbhq, Sal, Azúcar, Propionato de calcio, Goma guar, Ácido láctico, Mono y diglicéridos de ácidos grasos, Estearoil lactilato de sodio, Color caramelo, Ácido sórbico, Ácido ascórbico, Gluten.", "Alérgenos: Gluten.", "Trazas: Leche, Soya, Nueces, Semillas de sésamo.", "Certificados: Libre de Lactosa", "Libre de Huevo", "Libre de Peces", "Libre de Mariscos", "Libre de Maní", "Libre de Sulfitos", "Porción: 2 Rebanadas (48g)", "Porciones por envase: 12", "100g", "1 Porción", "Energía", "(kCal)", "244", "117.1", "Proteínas", "(g)", "10.8", "5.2", "Grasas Totales", "2.9", "1.4", "Grasas saturadas (g)", "0.8", "0.4", "Grasas monoinsaturadas (g)", "0.7", "0.3", "Grasas poliinsaturadas (g)", "1.5", "Grasas trans (g)", "0", "Colesterol", "(mg)", "Hidratos de carbono disponibles", "43", "20.6", "Azúcar total (g)", "2", "1", "Fibra", "5.3", "2.5", "Sodio", "397", "190.6", "Importante: La información del empaque y/o contenido del producto final puede diferir respecto a lo que mostramos en nuestro sitio web, tanto a nivel de ingredientes, trazas, información nutricional, sellos, modo de uso y/o modo de conservación. Usted debe basarse únicamente en la información que se muestra en nuestro sitio web y siempre debe leer las etiquetas, advertencias y instrucciones antes de usar el consumo de un producto.", "Información obtenida de", "PAN MOLDE INTEGRAL GRANDE 580 GR PAN PIERRE", "Productos similares", "Pan de Molde Integral XL Pierre 700 g", "-28%", "Ver producto", "Pan de Molde Artesano Integral", "Pan de Molde Blanco Familiar", "Pan de Molde Blanco XL Pierre 700 g", "Pan de Molde Integral", "Pan Pita Integral", "Pan Molde High Low", "Pan de Molde Integral Familiar", "Pan de Molde Integral XL Castaño 700 g", "Pan Pita Perfecto", "Pan de Molde Integral con Prebióticos Castaño 600 g", "Pan de Molde Multigrano", "Pan Molde Multigrano Jirafa", "-41%", "Pan Molde Blanco", "¡Juntos son mejores!", "Pechuga de Pavo Cocida Corte Pluma Receta del Abuelo 125 g", "Yoghurt Batido Vainilla", "Jamón Colonial Granel", "KG", "-11%", "-21%", "Pack Yoghurt Batido Colun 12 x 125 g", "-12%", "Jamón Artesanal Pf Granel", "Jamón Acaramelado Pf Granel", "-16%", "Jamón Pierna Artesanal Granel", "-22%"]}, "txt_path": "dataset/txt_limpios/1719.txt", "html_path": "dataset/paginas_descargadas/1719.html", "es_status": "ET", "category_canonical": "pan", "decision": "keep", "match_score": 0.6, "reasons": "heuristic_default"}
{"source_id": "1721", "title": "Panadería y Pastelería", "description": "Pan de Molde Blanco Familiar Xl Cena 740g | Actualizado al: 24-04-2025 Ingredientes: Harina de trigo, Agua, Levadura, Azúcar, Gluten, Sal, Aceite de maravilla, Tocoferoles, Ácido láctico, Ácido sórbico, Datem, Propionato de calcio, Mono y diglicéridos de ácidos grasos, Ácido ascórbico, Fibra de soya, Saborizante natural, Soya. Alérgenos: Gluten, Soya. Trazas: Nuez. Certificados: Libre de Huevo Libre de Peces Libre de Mariscos Libre de Maní Libre de Sulfitos Libre de Lactosa Porción: 2 Unidades (51g) Porciones por envase: 15 100g 1 Porción Energía (kCal) 241 122.9 Proteínas (g) 10 5.1 Grasas Totales 1.9 1 Grasas saturadas (g) 0.5 0.3 Grasas monoinsaturadas (g) 0.2 Grasas poliinsaturadas (g) 0.9 Grasas trans (g) 0 Colesterol (mg) Hidratos de carbono disponibles 46 23.5 Azúcares totales (g) 3.4 1.7 Sodio 386 196.9 Importante: La información del empaque y/o contenido del producto final puede diferir respecto a lo que mostramos en nuestro sitio web, tanto a nivel de ingredientes, trazas, información nutricional, sellos, modo de uso y/o modo de conservación. Usted no debe basarse únicamente en la información que se muestra en nuestro sitio web y siempre debe leer las etiquetas, advertencias e instrucciones antes de usar o consumir un producto. Información obtenida de PAN BLANCO XL CENA 740 GR Productos similares Pan de Molde Blanco XL Castaño 700 g Ver producto Pan de Molde Blanco XL Pierre 700 g -28% Pan de Molde Integral Fibra XL Cena 750 g Pan de Molde Blanco XL Ideal 750 g -14% Pan de Molde Blanco Tradicional Bauducco 390 g Pan de Molde Integral XL Castaño 700 g Pan de Molde Blanco Tipo Brioche Castaño 400 g Pan de Molde Blanco Ideal 580 g Pan de Molde Blanco Sin Gluten Tottus 400 g Pan de Molde Perfecto Kingsbury 580 g PAN BLANCO ARTESANO 550G IDEAL PAN BLANCO CERO CERO 580G IDEAL Pan de Molde Blanco Castaño 400 g Pan de Molde Integral XL Pierre 700 g Pan de Molde Miga Sándwich Blanco Castaño 440 g Pan de Molde Integral Bauducco 390 g ¡Juntos son mejores! -21% Atún Lomitos en Aceite Tottus 160 g Pack Yoghurt Batido Colun 12 x 125 g -12% Jamón Pierna Artesanal Granel KG -22% Jamón Sándwich Granel Jamón Artesanal Pf  a Granel Yoghurt Batido Yoghito Sabor Frutilla Queso Ranco Laminado Granel -16% Jamón de Cerdo Artesanal a Granel Atún Lomitos en Agua Tottus 160 g Jamón Acaramelado Pf a Granel -26% Jamón Colonial Granel -11%", "breadcrumbs": "Panadería > 740 g", "price_raw": "2.59", "currency_raw": "", "url": "", "seller": "Desconocido", "availability": "unknown", "country": "UNKNOWN", "product_name": "Panadería y Pastelería", "brand": "Panadería", "reference": "", "unit": "740 g", "price_amount": 2.59, "price_currency": "", "price_symbol": "", "price_text": "2.59", "price_amount_filled": "2.59", "price_is_imputed": "False", "price_imputation_source": "original", "price_amount_usd": "2.59", "price_amount_usd_filled": "2.59", "fx_rate_local_per_usd": "1.0", "fx_source": "default_1usd", "information_text": "", "description_text": "Pan de Molde Blanco Familiar Xl Cena 740g | Actualizado al: 24-04-2025 Ingredientes: Harina de trigo, Agua, Levadura, Azúcar, Gluten, Sal, Aceite de maravilla, Tocoferoles, Ácido láctico, Ácido sórbico, Datem, Propionato de calcio, Mono y diglicéridos de ácidos grasos, Ácido ascórbico, Fibra de soya, Saborizante natural, Soya. Alérgenos: Gluten, Soya. Trazas: Nuez. Certificados: Libre de Huevo Libre de Peces Libre de Mariscos Libre de Maní Libre de Sulfitos Libre de Lactosa Porción: 2 Unidades (51g) Porciones por envase: 15 100g 1 Porción Energía (kCal) 241 122.9 Proteínas (g) 10 5.1 Grasas Totales 1.9 1 Grasas saturadas (g) 0.5 0.3 Grasas monoinsaturadas (g) 0.2 Grasas poliinsaturadas (g) 0.9 Grasas trans (g) 0 Colesterol (mg) Hidratos de carbono disponibles 46 23.5 Azúcares totales (g) 3.4 1.7 Sodio 386 196.9 Importante: La información del empaque y/o contenido del producto final puede diferir respecto a lo que mostramos en nuestro sitio web, tanto a nivel de ingredientes, trazas, información nutricional, sellos, modo de uso y/o modo de conservación. Usted no debe basarse únicamente en la información que se muestra en nuestro sitio web y siempre debe leer las etiquetas, advertencias e instrucciones antes de usar o consumir un producto. Información obtenida de PAN BLANCO XL CENA 740 GR Productos similares Pan de Molde Blanco XL Castaño 700 g Ver producto Pan de Molde Blanco XL Pierre 700 g -28% Pan de Molde Integral Fibra XL Cena 750 g Pan de Molde Blanco XL Ideal 750 g -14% Pan de Molde Blanco Tradicional Bauducco 390 g Pan de Molde Integral XL Castaño 700 g Pan de Molde Blanco Tipo Brioche Castaño 400 g Pan de Molde Blanco Ideal 580 g Pan de Molde Blanco Sin Gluten Tottus 400 g Pan de Molde Perfecto Kingsbury 580 g PAN BLANCO ARTESANO 550G IDEAL PAN BLANCO CERO CERO 580G IDEAL Pan de Molde Blanco Castaño 400 g Pan de Molde Integral XL Pierre 700 g Pan de Molde Miga Sándwich Blanco Castaño 440 g Pan de Molde Integral Bauducco 390 g ¡Juntos son mejores! -21% Atún Lomitos en Aceite Tottus 160 g Pack Yoghurt Batido Colun 12 x 125 g -12% Jamón Pierna Artesanal Granel KG -22% Jamón Sándwich Granel Jamón Artesanal Pf  a Granel Yoghurt Batido Yoghito Sabor Frutilla Queso Ranco Laminado Granel -16% Jamón de Cerdo Artesanal a Granel Atún Lomitos en Agua Tottus 160 g Jamón Acaramelado Pf a Granel -26% Jamón Colonial Granel -11%", "features_text": "", "specifications_text": "", "benefits_text": "", "details_text": "", "other_sections": "", "sections": {"Descripción": ["Pan de Molde Blanco Familiar Xl Cena", "740g | Actualizado al: 24-04-2025", "Ingredientes: Harina de trigo, Agua, Levadura, Azúcar, Gluten, Sal, Aceite de maravilla, Tocoferoles, Ácido láctico, Ácido sórbico, Datem, Propionato de calcio, Mono y diglicéridos de ácidos grasos, Ácido ascórbico, Fibra de soya, Saborizante natural, Soya.", "Alérgenos: Gluten, Soya.", "Trazas: Nuez.", "Certificados: Libre de Huevo", "Libre de Peces", "Libre de Mariscos", "Libre de Maní", "Libre de Sulfitos", "Libre de Lactosa", "Porción: 2 Unidades (51g)", "Porciones por envase: 15", "100g", "1 Porción", "Energía", "(kCal)", "241", "122.9", "Proteínas", "(g)", "10", "5.1", "Grasas Totales", "1.9", "1", "Grasas saturadas (g)", "0.5", "0.3", "Grasas monoinsaturadas (g)", "0.2", "Grasas poliinsaturadas (g)", "0.9", "Grasas trans (g)", "0", "Colesterol", "(mg)", "Hidratos de carbono disponibles", "46", "23.5", "Azúcar total (g)", "3.4", "1.7", "Sodio", "386", "196.9", "Importante: La información del empaque y/o contenido del producto final puede diferir respecto a lo que mostramos en nuestro sitio web, tanto a nivel de ingredientes, trazas, información nutricional, sellos, modo de uso y/o modo de conservación. Usted debe basarse únicamente en la información que se muestra en nuestro sitio web y siempre debe leer las etiquetas, advertencias y instrucciones antes de usar el consumo de un producto.", "Información obtenida de", "PAN BLANCO XL CENA 740 GR", "Productos similares", "Pan de Molde Blanco XL Castaño 700 g", "Ver producto", "Pan de Molde Blanco XL Pierre 700 g", "-28%", "Pan de Molde Integral Fibra XL Cena 750 g", "Pan de Molde Blanco XL Ideal 750 g", "-14%", "Pan de Molde Blanco Tradicional Bauducco 390 g", "Pan de Molde Integral XL Castaño 700 g", "Pan de Molde Blanco Tipo Brioche Castaño 400 g", "Pan de Molde Blanco Ideal 580 g", "Pan de Molde Blanco Sin Gluten Tottus 400 g", "Pan de Molde Perfecto Kingsbury 580 g", "PAN BLANCO ARTESANO 550G IDEAL", "PAN BLANCO CERO CERO 580G IDEAL", "Pan de Molde Blanco Castaño 400 g", "Pan de Molde Integral XL Pierre 700 g", "Pan de Molde Miga Sándwich Blanco Castaño 440 g", "Pan de Molde Integral Bauducco 390 g", "¡Juntos son mejores!", "-21%", "Atún Lomitos en Aceite Tottus 160 g", "Pack Yoghurt Batido Colun 12 x 125 g", "-12%", "Jamón Pierna Artesanal Granel", "KG", "-22%", "Jamón Sándwich Granel", "Jamón Artesanal Pf Granel", "Yoghurt Batido Yoghito Sabor Frutilla", "Queso Ranco Laminado Granel", "-16%", "Jamón de Cerdo Artesanal a Granel", "Atún Lomitos en Agua Tottus 160 g", "Jamón Acaramelado Pf Granel", "-26%", "Jamón Colonial Granel", "-11%"]}, "txt_path": "dataset/txt_limpios/1721.txt", "html_path": "dataset/paginas_descargadas/1721.html", "es_status": "ET", "category_canonical": "pan", "decision": "keep", "match_score": 0.6, "reasons": "heuristic_default"}
