source_id,title,description,breadcrumbs,price_raw,currency_raw,url,seller,availability,country,product_name,brand,reference,unit,price_amount,price_currency,price_symbol,price_text,price_amount_filled,price_is_imputed,price_imputation_source,price_amount_usd,price_amount_usd_filled,fx_rate_local_per_usd,fx_source,information_text,description_text,features_text,specifications_text,benefits_text,details_text,other_sections,sections,txt_path,html_path,es_status,category_canonical,decision,match_score,reasons
542,Frutas Y Verduras,,Verduras > 600 Gr,2799.0,,,Desconocido,unknown,UNKNOWN,Frutas Y Verduras,Verduras,,600 Gr,2799.00,,$,"$2.799,00",2799.0,False,original,2799.0,2799.0,1.0,default_1usd,,,Últimos consultados | NO ACUMULABLE CON OTRAS PROMOS | Tomate Red X Kg | OFERTA | Ver planes de cuotas | Papas Andinas SUEÑO VERDE X 600 Gr | Papa Natural Cortada Precocida Santa Maria 500g | Papa Negra Selección X Kg | Gaseosa PRITTY Limón Botella 2.25 L,,,,,"{""Características"": [""Últimos consultados"", ""NO ACUMULABLE CON OTRAS PROMOS"", ""Tomate Red X Kg"", ""OFERTA"", ""Ver planes de cuotas"", ""Papas Andinas SUEÑO VERDE X 600 Gr"", ""Papa Natural Cortada Precocida Santa Maria 500g"", ""Papa Negra Selección X Kg"", ""Gaseosa PRITTY Limón Botella 2.25 L""]}",dataset/txt_limpios/542.txt,dataset/paginas_descargadas/542.html,ET,sin_categoria,discard,0.30,no_category_detected
543,Frutas Y Verduras,,Verduras > 300 Gr,2999.0,,,Desconocido,unknown,UNKNOWN,Frutas Y Verduras,Verduras,,300 Gr,2999.00,,$,"$2.999,00",2999.0,False,original,2999.0,2999.0,1.0,default_1usd,,,MARCA | : ROCKY | Últimos consultados | NO ACUMULABLE CON OTRAS PROMOS | Tomate Red Especial X Kg Xkg | OFERTA | Ver planes de cuotas | Tomate Red X Kg | Papas Andinas SUEÑO VERDE X 600 Gr | Papa Natural Cortada Precocida Santa Maria 500g | Papa Negra Selección X Kg,,,,,"{""Características"": [""MARCA"", "": ROCKY"", ""Últimos consultados"", ""NO ACUMULABLE CON OTRAS PROMOS"", ""Tomate Red Especial X Kg   Xkg"", ""OFERTA"", ""Ver planes de cuotas"", ""Tomate Red X Kg"", ""Papas Andinas SUEÑO VERDE X 600 Gr"", ""Papa Natural Cortada Precocida Santa Maria 500g"", ""Papa Negra Selección X Kg""]}",dataset/txt_limpios/543.txt,dataset/paginas_descargadas/543.html,ET,sin_categoria,discard,0.30,no_category_detected
33,Harinas y reposteria,"Harina de trigo San Blas, está elaborada con los trigos más selectos: ofreciendo una harina multiusos para utilizarse en casa el en todo tipo de repostería como pan francés, pan leudado, bizcochería fina, hojaldres, pan danés, pizza y muchos más. Harina de trigo San Blas, está elaborada con los trigos más selectos: ofreciendo una harina multiusos para utilizarse en casa el en todo tipo de repostería como pan francés, pan leudado, bizcochería fina, hojaldres, pan danés, pizza y muchos más. Gracias a su excelente versatilidad, se asegura el rendimiento, estabilidad en el horneo y una máxima versatilidad al preparar sus platillos. La harina se encuentra añadida con ácido fólico, zinc, hierro y vitaminas.",San Blas > 500g > 3775966,,MXN,,Chedraui,unknown,MX,Harinas y reposteria,San Blas,3775966.0,500g,,MXN,,,2902.4,True,category_mean,,155.8757,18.62,from_mexico_cambio_dolar,"Harina de trigo San Blas, está elaborada con los trigos más selectos: ofreciendo una harina multiusos para utilizarse en casa el en todo tipo de repostería como pan francés, pan leudado, bizcochería fina, hojaldres, pan danés, pizza y muchos más.",,,"Harina de trigo San Blas, está elaborada con los trigos más selectos: ofreciendo una harina multiusos para utilizarse en casa el en todo tipo de repostería como pan francés, pan leudado, bizcochería fina, hojaldres, pan danés, pizza y muchos más. Gracias a su excelente versatilidad, se asegura el rendimiento, estabilidad en el horneo y una máxima versatilidad al preparar sus platillos. La harina se encuentra añadida con ácido fólico, zinc, hierro y vitaminas.",,,,"{""Información"": [""Harina de trigo San Blas, está elaborada con los trigos más selectos: ofreciendo una harina multiusos para utilizarse en casa el en todo tipo de repostería como pan francés, pan leudado, bizcochería fina, hojaldres, pan danés, pizza y muchos más.""], ""Especificaciones"": [""Harina de trigo San Blas, está elaborada con los trigos más selectos: ofreciendo una harina multiusos para utilizarse en casa el en todo tipo de repostería como pan francés, pan leudado, bizcochería fina, hojaldres, pan danés, pizza y muchos más. Gracias a su excelente versatilidad, se asegura el rendimiento, estabilidad en el horneo y una máxima versatilidad al preparar sus platillos. La harina se encuentra añadida con ácido fólico, zinc, hierro y vitaminas.""]}",dataset/txt_limpios/33.txt,dataset/paginas_descargadas/33.html,ET,harina de trigo,discard,0.60,price_parse_failed;price<=0
35,Harinas y reposteria,"Prepara tu despensa en unos cuantos clics y descubre nuestra gran variedad de productos. ¡En la sala de casa, te llevamos el súper!",Harina Chedraui Trigo 1Kg > 1Kg > 3793489,,MXN,,Chedraui,unknown,MX,Harinas y reposteria,Harina Chedraui Trigo 1Kg,3793489.0,1Kg,,MXN,,,66.32,True,country_mean,,3.5617,18.62,from_mexico_cambio_dolar,,,,"Prepara tu despensa en unos cuantos clics y descubre nuestra gran variedad de productos. ¡En la sala de casa, te llevamos el súper!",,,,"{""Especificaciones"": [""Prepara tu despensa en unos cuantos clics y descubre nuestra gran variedad de productos. ¡En la sala de casa, te llevamos el súper!""]}",dataset/txt_limpios/35.txt,dataset/paginas_descargadas/35.html,ET,sin_categoria,discard,0.30,no_category_detected;price_parse_failed
36,Harinas y reposteria,Harina de trigo extrafina para todo uso en la cocina La harina de trigo La Moderna está elaborada con trigos de buena calidad con la que puedes preparar todo tipo de platillos.,La Moderna > 1kg > 3256831,,MXN,,Chedraui,unknown,MX,Harinas y reposteria,La Moderna,3256831.0,1kg,,MXN,,,2902.4,True,category_mean,,155.8757,18.62,from_mexico_cambio_dolar,Harina de trigo extrafina para todo uso en la cocina,,,La harina de trigo La Moderna está elaborada con trigos de buena calidad con la que puedes preparar todo tipo de platillos.,,,,"{""Información"": [""Harina de trigo extrafina para todo uso en la cocina""], ""Especificaciones"": [""La harina de trigo La Moderna está elaborada con trigos de buena calidad con la que puedes preparar todo tipo de platillos.""]}",dataset/txt_limpios/36.txt,dataset/paginas_descargadas/36.html,EN,harina de trigo,discard,0.60,price_parse_failed;price<=0
37,Harinas y reposteria,"Sol de Oro, es una harina de trigo fuerte diseñada a base ingredientes naturales y añadida con vitaminas y minerales, ideal para preparar gran variedad de platillos y postres. Por su preparación e ingredientes, Sol de Oro es una harina que permite a los hogares y negocios contar con una harina de alto rendimiento que permite obtener mayor cantidad de producto. La harina de trigo Sol de Oro es la harina ideal para el tu hogar el negocio, ya que al ser una harina multiproposito permite la elaboración de gran variedad de platillos hechos la base de harina de trigo, la harina de trigo sol de oro por sus ingredientes y proceso de elaboración es una gran opción para los hogares que utilizan harina de trigo para la elaboración de sus platillos.",Sol de Oro > 1kg > 3168625,,MXN,,Chedraui,unknown,MX,Harinas y reposteria,Sol de Oro,3168625.0,1kg,,MXN,,,2902.4,True,category_mean,,155.8757,18.62,from_mexico_cambio_dolar,"Sol de Oro, es una harina de trigo fuerte diseñada a base ingredientes naturales y añadida con vitaminas y minerales, ideal para preparar gran variedad de platillos y postres. Por su preparación e ingredientes, Sol de Oro es una harina que permite a los hogares y negocios contar con una harina de alto rendimiento que permite obtener mayor cantidad de producto.",,,"La harina de trigo Sol de Oro es la harina ideal para el tu hogar el negocio, ya que al ser una harina multiproposito permite la elaboración de gran variedad de platillos hechos la base de harina de trigo, la harina de trigo sol de oro por sus ingredientes y proceso de elaboración es una gran opción para los hogares que utilizan harina de trigo para la elaboración de sus platillos.",,,,"{""Información"": [""Sol de Oro, es una harina de trigo fuerte diseñada a base ingredientes naturales y añadida con vitaminas y minerales, ideal para preparar gran variedad de platillos y postres. Por su preparación e ingredientes, Sol de Oro es una harina que permite a los hogares y negocios contar con una harina de alto rendimiento que permite obtener mayor cantidad de producto.""], ""Especificaciones"": [""La harina de trigo Sol de Oro es la harina ideal para el tu hogar el negocio, ya que al ser una harina multiproposito permite la elaboración de gran variedad de platillos hechos la base de harina de trigo, la harina de trigo sol de oro por sus ingredientes y proceso de elaboración es una gran opción para los hogares que utilizan harina de trigo para la elaboración de sus platillos.""]}",dataset/txt_limpios/37.txt,dataset/paginas_descargadas/37.html,ET,harina de trigo,discard,0.60,price_parse_failed;price<=0
546,"Hola, Limpía tú cache",,IR AL PAGO > 1 Lt > 8480017006080,1.59,ARS,,Desconocido,unknown,AR,"Hola, Limpía tú cache",IR AL PAGO,8480017006080.0,1 Lt,1.59,ARS,$,$1.59,1.59,False,original,0.0013,0.0013,1255.0,from_argentina_cambio_dolar,,,,,,,,{},dataset/txt_limpios/546.txt,dataset/paginas_descargadas/546.html,EN,sin_categoria,discard,0.30,no_category_detected
547,"Hola, Limpía tú cache",,IR AL PAGO > 1 Lt > 7790742192301,1.2,ARS,,Desconocido,unknown,AR,"Hola, Limpía tú cache",IR AL PAGO,7790742192301.0,1 Lt,1.20,ARS,$,$1.20,1.2,False,original,0.001,0.001,1255.0,from_argentina_cambio_dolar,,,,,,,,{},dataset/txt_limpios/547.txt,dataset/paginas_descargadas/547.html,EN,sin_categoria,discard,0.30,no_category_detected
552,"Hola, Limpía tú cache","El pan Lactal es nuestro pan clásico que acompaña tu mesa desde hace pero de 100 años. Pan con salvado familiar. Harina de trigo 000*, agua, salvado de trigo, levadura, azúcar, aceite vegetal, gluten de trigo, sal, cloruro de potasio, suero de leche en polvo, conservadores: INS 282, INS 200, regulador de acidez: INS 270, mejorador de la harina: INS 300, aromatizantes naturales. CONTIENE DERIVADOS DE TRIGO Y DE LECHE. PUEDE CONTENER SOJA, AVENA, DERIVADOS DE CEBADA Y DE CENTENO. (*) Harina de trigo enriquecido según Ley N° 25.630 con: hierro (30 mg/kg); ácido fólico (2,2 mg/kg); tiamina B1 (6,3 mg/kg); riboflavina B2 (1,3 mg/kg); niacina (13 mg/kg). Ver más",¿Quéres terminar tu compra? > 560 Gr > 7793890258783,5.01,ARS,,Desconocido,unknown,AR,"Hola, Limpía tú cache",¿Quéres terminar tu compra?,7793890258783.0,560 Gr,5.01,ARS,$,$5.01,5.01,False,original,0.004,0.004,1255.0,from_argentina_cambio_dolar,,"El pan Lactal es nuestro pan clásico que acompaña tu mesa desde hace pero de 100 años. Pan con salvado familiar. Harina de trigo 000*, agua, salvado de trigo, levadura, azúcar, aceite vegetal, gluten de trigo, sal, cloruro de potasio, suero de leche en polvo, conservadores: INS 282, INS 200, regulador de acidez: INS 270, mejorador de la harina: INS 300, aromatizantes naturales. CONTIENE DERIVADOS DE TRIGO Y DE LECHE. PUEDE CONTENER SOJA, AVENA, DERIVADOS DE CEBADA Y DE CENTENO. (*) Harina de trigo enriquecido según Ley N° 25.630 con: hierro (30 mg/kg); ácido fólico (2,2 mg/kg); tiamina B1 (6,3 mg/kg); riboflavina B2 (1,3 mg/kg); niacina (13 mg/kg). Ver más",,,,,,"{""Descripción"": [""El pan Lactal es nuestro pan clásico que acompaña tu mesa desde hace pero de 100 años."", ""Pan con salvado familiar."", ""Harina de trigo 000*, agua, salvado de trigo, levadura, azúcar, aceite vegetal, gluten de trigo, sal, cloruro de potasio, suero de leche en polvo, conservadores: INS 282, INS 200, regulador de acidez: INS 270, mejorador de la harina: INS 300, aromatizantes naturales. CONTIENE DERIVADOS DE TRIGO Y DE LECHE. PUEDE CONTENER SOJA, AVENA, DERIVADOS DE CEBADA Y DE CENTENO. (*) Harina de trigo enriquecido según Ley N° 25.630 con: hierro (30 mg/kg); ácido fólico (2,2 mg/kg); tiamina B1 (6,3 mg/kg); riboflavina B2 (1,3 mg/kg); niacina (13 mg/kg)."", ""Ver más""]}",dataset/txt_limpios/552.txt,dataset/paginas_descargadas/552.html,ET,leche,keep,0.60,heuristic_default
554,"Hola, Limpía tú cache",,¿Quéres terminar tu compra? > 1 Kg > 7792540250450,1.3,ARS,,Desconocido,unknown,AR,"Hola, Limpía tú cache",¿Quéres terminar tu compra?,7792540250450.0,1 Kg,1.30,ARS,$,$1.30,1.3,False,original,0.001,0.001,1255.0,from_argentina_cambio_dolar,,,,,,,,{},dataset/txt_limpios/554.txt,dataset/paginas_descargadas/554.html,ET,sin_categoria,discard,0.30,no_category_detected
563,"Hola, Limpía tú cache",,¿Quéres terminar tu compra? > 500 Gr > 7790070320285,965.0,ARS,,Desconocido,unknown,AR,"Hola, Limpía tú cache",¿Quéres terminar tu compra?,7790070320285.0,500 Gr,965.00,ARS,$,$965,965.0,False,original,0.7689,0.7689,1255.0,from_argentina_cambio_dolar,,,,,,,,{},dataset/txt_limpios/563.txt,dataset/paginas_descargadas/563.html,ET,sin_categoria,discard,0.30,no_category_detected
570,"Hola, Limpía tú cache",,¿Quéres terminar tu compra? > 500 Gr > 2683614,500.0,ARS,,Desconocido,unknown,AR,"Hola, Limpía tú cache",¿Quéres terminar tu compra?,2683614.0,500 Gr,500.00,ARS,,500,500.0,False,original,0.3984,0.3984,1255.0,from_argentina_cambio_dolar,,,,,,,,{},dataset/txt_limpios/570.txt,dataset/paginas_descargadas/570.html,ET,sin_categoria,discard,0.30,no_category_detected
574,"Hola, Limpía tú cache",,"¿Quéres terminar tu compra? > 1,5 Lt > 8480017248411",800.0,ARS,,Desconocido,unknown,AR,"Hola, Limpía tú cache",¿Quéres terminar tu compra?,8480017248411.0,"1,5 Lt",800.00,ARS,$,$800,800.0,False,original,0.6375,0.6375,1255.0,from_argentina_cambio_dolar,,,,,,,,{},dataset/txt_limpios/574.txt,dataset/paginas_descargadas/574.html,ET,sin_categoria,discard,0.30,no_category_detected
1367,Horarios de entrega,,LISTA > 1 Litro,,,,Desconocido,unknown,UNKNOWN,Horarios de entrega,LISTA,,1 Litro,,,,,234.19,True,country_mean,,234.1938,1.0,default_1usd,,,,,,,,{},dataset/txt_limpios/1367.txt,dataset/paginas_descargadas/1367.html,EN,sin_categoria,discard,0.30,no_category_detected;price_parse_failed
1369,Horarios de entrega,,LISTA > 1LT,,,,Desconocido,unknown,UNKNOWN,Horarios de entrega,LISTA,,1LT,,,,,234.19,True,country_mean,,234.1938,1.0,default_1usd,,,,,,,,{},dataset/txt_limpios/1369.txt,dataset/paginas_descargadas/1369.html,EN,sin_categoria,discard,0.30,no_category_detected;price_parse_failed
1370,Horarios de entrega,,LISTA > 500 GR,500.0,,,Desconocido,unknown,UNKNOWN,Horarios de entrega,LISTA,,500 GR,500.00,,,500,500.0,False,original,500.0,500.0,1.0,default_1usd,,,,,,,,{},dataset/txt_limpios/1370.txt,dataset/paginas_descargadas/1370.html,EN,sin_categoria,discard,0.30,no_category_detected
1371,Horarios de entrega,,LISTA > 1 LITRO,,,,Desconocido,unknown,UNKNOWN,Horarios de entrega,LISTA,,1 LITRO,,,,,234.19,True,country_mean,,234.1938,1.0,default_1usd,,,,,,,,{},dataset/txt_limpios/1371.txt,dataset/paginas_descargadas/1371.html,EN,sin_categoria,discard,0.30,no_category_detected;price_parse_failed
1372,Horarios de entrega,,LISTA > 1KG,1.0,,,Desconocido,unknown,UNKNOWN,Horarios de entrega,LISTA,,1KG,1.00,,,1,1.0,False,original,1.0,1.0,1.0,default_1usd,,,,,,,,{},dataset/txt_limpios/1372.txt,dataset/paginas_descargadas/1372.html,EN,sin_categoria,discard,0.30,no_category_detected
1373,Horarios de entrega,,LISTA > 1 KG,,,,Desconocido,unknown,UNKNOWN,Horarios de entrega,LISTA,,1 KG,,,,,234.19,True,country_mean,,234.1938,1.0,default_1usd,,,,,,,,{},dataset/txt_limpios/1373.txt,dataset/paginas_descargadas/1373.html,EN,sin_categoria,discard,0.30,no_category_detected;price_parse_failed
1374,Horarios de entrega,,LISTA > 1 KG,,,,Desconocido,unknown,UNKNOWN,Horarios de entrega,LISTA,,1 KG,,,,,234.19,True,country_mean,,234.1938,1.0,default_1usd,,,,,,,,{},dataset/txt_limpios/1374.txt,dataset/paginas_descargadas/1374.html,EN,sin_categoria,discard,0.30,no_category_detected;price_parse_failed
1375,Horarios de entrega,,LISTA,,,,Desconocido,unknown,UNKNOWN,Horarios de entrega,LISTA,,,,,,,234.19,True,country_mean,,234.1938,1.0,default_1usd,,,,,,,,{},dataset/txt_limpios/1375.txt,dataset/paginas_descargadas/1375.html,EN,sin_categoria,discard,0.30,no_category_detected;price_parse_failed
1376,Horarios de entrega,,LISTA > 500GR,500.0,,,Desconocido,unknown,UNKNOWN,Horarios de entrega,LISTA,,500GR,500.00,,,500,500.0,False,original,500.0,500.0,1.0,default_1usd,,,,,,,,{},dataset/txt_limpios/1376.txt,dataset/paginas_descargadas/1376.html,EN,sin_categoria,discard,0.30,no_category_detected
1377,Horarios de entrega,,LISTA > 500ML,,,,Desconocido,unknown,UNKNOWN,Horarios de entrega,LISTA,,500ML,,,,,234.19,True,country_mean,,234.1938,1.0,default_1usd,,,,,,,,{},dataset/txt_limpios/1377.txt,dataset/paginas_descargadas/1377.html,EN,sin_categoria,discard,0.30,no_category_detected;price_parse_failed
1378,Horarios de entrega,,LISTA > 1Litro,,,,Desconocido,unknown,UNKNOWN,Horarios de entrega,LISTA,,1Litro,,,,,234.19,True,country_mean,,234.1938,1.0,default_1usd,,,,,,,,{},dataset/txt_limpios/1378.txt,dataset/paginas_descargadas/1378.html,EN,sin_categoria,discard,0.30,no_category_detected;price_parse_failed
1379,Horarios de entrega,,LISTA > 400GR,400.0,,,Desconocido,unknown,UNKNOWN,Horarios de entrega,LISTA,,400GR,400.00,,,400,400.0,False,original,400.0,400.0,1.0,default_1usd,,,,,,,,{},dataset/txt_limpios/1379.txt,dataset/paginas_descargadas/1379.html,EN,sin_categoria,discard,0.30,no_category_detected
1380,Horarios de entrega,,LISTA > 500 GR,,,,Desconocido,unknown,UNKNOWN,Horarios de entrega,LISTA,,500 GR,,,,,234.19,True,country_mean,,234.1938,1.0,default_1usd,,,,,,,,{},dataset/txt_limpios/1380.txt,dataset/paginas_descargadas/1380.html,EN,sin_categoria,discard,0.30,no_category_detected;price_parse_failed
1381,Horarios de entrega,,LISTA > 1 KG,1.0,,,Desconocido,unknown,UNKNOWN,Horarios de entrega,LISTA,,1 KG,1.00,,,1,1.0,False,original,1.0,1.0,1.0,default_1usd,,,,,,,,{},dataset/txt_limpios/1381.txt,dataset/paginas_descargadas/1381.html,EN,sin_categoria,discard,0.30,no_category_detected
1382,Horarios de entrega,,LISTA > 400 GR,,,,Desconocido,unknown,UNKNOWN,Horarios de entrega,LISTA,,400 GR,,,,,234.19,True,country_mean,,234.1938,1.0,default_1usd,,,,,,,,{},dataset/txt_limpios/1382.txt,dataset/paginas_descargadas/1382.html,EN,sin_categoria,discard,0.30,no_category_detected;price_parse_failed
1383,Horarios de entrega,,LISTA > 100 GR,1.0,,,Desconocido,unknown,UNKNOWN,Horarios de entrega,LISTA,,100 GR,1.00,,,1,1.0,False,original,1.0,1.0,1.0,default_1usd,,,,,,,,{},dataset/txt_limpios/1383.txt,dataset/paginas_descargadas/1383.html,EN,sin_categoria,discard,0.30,no_category_detected
1384,Horarios de entrega,,LISTA > 250GR,250.0,,,Desconocido,unknown,UNKNOWN,Horarios de entrega,LISTA,,250GR,250.00,,,250,250.0,False,original,250.0,250.0,1.0,default_1usd,,,,,,,,{},dataset/txt_limpios/1384.txt,dataset/paginas_descargadas/1384.html,EN,sin_categoria,discard,0.30,no_category_detected
1385,Horarios de entrega,,LISTA > 1 LITRO,,,,Desconocido,unknown,UNKNOWN,Horarios de entrega,LISTA,,1 LITRO,,,,,234.19,True,country_mean,,234.1938,1.0,default_1usd,,,,,,,,{},dataset/txt_limpios/1385.txt,dataset/paginas_descargadas/1385.html,EN,sin_categoria,discard,0.30,no_category_detected;price_parse_failed
1386,Horarios de entrega,,LISTA > 160GR,23.0,,,Desconocido,unknown,UNKNOWN,Horarios de entrega,LISTA,,160GR,23.00,,,23,23.0,False,original,23.0,23.0,1.0,default_1usd,,,,,,,,{},dataset/txt_limpios/1386.txt,dataset/paginas_descargadas/1386.html,EN,sin_categoria,discard,0.30,no_category_detected
1387,Horarios de entrega,,LISTA > 170GR,1.0,,,Desconocido,unknown,UNKNOWN,Horarios de entrega,LISTA,,170GR,1.00,,,1,1.0,False,original,1.0,1.0,1.0,default_1usd,,,,,,,,{},dataset/txt_limpios/1387.txt,dataset/paginas_descargadas/1387.html,EN,sin_categoria,discard,0.30,no_category_detected
1388,Horarios de entrega,,LISTA > 1 KG,,,,Desconocido,unknown,UNKNOWN,Horarios de entrega,LISTA,,1 KG,,,,,234.19,True,country_mean,,234.1938,1.0,default_1usd,,,,,,,,{},dataset/txt_limpios/1388.txt,dataset/paginas_descargadas/1388.html,EN,sin_categoria,discard,0.30,no_category_detected;price_parse_failed
1389,Horarios de entrega,,LISTA > 1 KG,1.0,,,Desconocido,unknown,UNKNOWN,Horarios de entrega,LISTA,,1 KG,1.00,,,1,1.0,False,original,1.0,1.0,1.0,default_1usd,,,,,,,,{},dataset/txt_limpios/1389.txt,dataset/paginas_descargadas/1389.html,EN,sin_categoria,discard,0.30,no_category_detected
1390,Horarios de entrega,,LISTA > 1.5LT,100.0,,,Desconocido,unknown,UNKNOWN,Horarios de entrega,LISTA,,1.5LT,100.00,,,100,100.0,False,original,100.0,100.0,1.0,default_1usd,,,,,,,,{},dataset/txt_limpios/1390.txt,dataset/paginas_descargadas/1390.html,EN,sin_categoria,discard,0.30,no_category_detected
1391,Horarios de entrega,,LISTA > 1LT,,,,Desconocido,unknown,UNKNOWN,Horarios de entrega,LISTA,,1LT,,,,,234.19,True,country_mean,,234.1938,1.0,default_1usd,,,,,,,,{},dataset/txt_limpios/1391.txt,dataset/paginas_descargadas/1391.html,EN,sin_categoria,discard,0.30,no_category_detected;price_parse_failed
1392,Horarios de entrega,,LISTA > 1 Litro,,,,Desconocido,unknown,UNKNOWN,Horarios de entrega,LISTA,,1 Litro,,,,,234.19,True,country_mean,,234.1938,1.0,default_1usd,,,,,,,,{},dataset/txt_limpios/1392.txt,dataset/paginas_descargadas/1392.html,EN,sin_categoria,discard,0.30,no_category_detected;price_parse_failed
1393,Horarios de entrega,,LISTA > 250ML,,,,Desconocido,unknown,UNKNOWN,Horarios de entrega,LISTA,,250ML,,,,,234.19,True,country_mean,,234.1938,1.0,default_1usd,,,,,,,,{},dataset/txt_limpios/1393.txt,dataset/paginas_descargadas/1393.html,EN,sin_categoria,discard,0.30,no_category_detected;price_parse_failed
