{"source_id": "887", "title": "887", "description": "", "breadcrumbs": "", "price_raw": "", "currency_raw": "", "url": "", "seller": "Desconocido", "availability": "unknown", "country": "UNKNOWN", "product_name": "", "brand": "", "reference": "", "unit": "", "price_amount": null, "price_currency": "", "price_symbol": "", "price_text": "", "price_amount_filled": "234.19", "price_is_imputed": "True", "price_imputation_source": "country_mean", "price_amount_usd": "", "price_amount_usd_filled": "234.1938", "fx_rate_local_per_usd": "1.0", "fx_source": "default_1usd", "information_text": "", "description_text": "", "features_text": "", "specifications_text": "", "benefits_text": "", "details_text": "", "other_sections": "", "sections": {}, "txt_path": "dataset/txt_limpios/887.txt", "html_path": "dataset/paginas_descargadas/887.html", "es_status": "EN", "category_canonical": "sin_categoria", "decision": "discard", "match_score": 0.3, "reasons": "no_category_detected;price_parse_failed"}
{"source_id": "890", "title": "890", "description": "", "breadcrumbs": "", "price_raw": "", "currency_raw": "", "url": "", "seller": "Desconocido", "availability": "unknown", "country": "UNKNOWN", "product_name": "", "brand": "", "reference": "", "unit": "", "price_amount": null, "price_currency": "", "price_symbol": "", "price_text": "", "price_amount_filled": "234.19", "price_is_imputed": "True", "price_imputation_source": "country_mean", "price_amount_usd": "", "price_amount_usd_filled": "234.1938", "fx_rate_local_per_usd": "1.0", "fx_source": "default_1usd", "information_text": "", "description_text": "", "features_text": "", "specifications_text": "", "benefits_text": "", "details_text": "", "other_sections": "", "sections": {}, "txt_path": "dataset/txt_limpios/890.txt", "html_path": "dataset/paginas_descargadas/890.html", "es_status": "EN", "category_canonical": "sin_categoria", "decision": "discard", "match_score": 0.3, "reasons": "no_category_detected;price_parse_failed"}
{"source_id": "897", "title": "897", "description": "", "breadcrumbs": "", "price_raw": "", "currency_raw": "", "url": "", "seller": "Desconocido", "availability": "unknown", "country": "UNKNOWN", "product_name": "", "brand": "", "reference": "", "unit": "", "price_amount": null, "price_currency": "", "price_symbol": "", "price_text": "", "price_amount_filled": "234.19", "price_is_imputed": "True", "price_imputation_source": "country_mean", "price_amount_usd": "", "price_amount_usd_filled": "234.1938", "fx_rate_local_per_usd": "1.0", "fx_source": "default_1usd", "information_text": "", "description_text": "", "features_text": "", "specifications_text": "", "benefits_text": "", "details_text": "", "other_sections": "", "sections": {}, "txt_path": "dataset/txt_limpios/897.txt", "html_path": "dataset/paginas_descargadas/897.html", "es_status": "EN", "category_canonical": "sin_categoria", "decision": "discard", "match_score": 0.3, "reasons": "no_category_detected;price_parse_failed"}
{"source_id": "899", "title": "899", "description": "", "breadcrumbs": "", "price_raw": "", "currency_raw": "", "url": "", "seller": "Desconocido", "availability": "unknown", "country": "UNKNOWN", "product_name": "", "brand": "", "reference": "", "unit": "", "price_amount": null, "price_currency": "", "price_symbol": "", "price_text": "", "price_amount_filled": "234.19", "price_is_imputed": "True", "price_imputation_source": "country_mean", "price_amount_usd": "", "price_amount_usd_filled": "234.1938", "fx_rate_local_per_usd": "1.0", "fx_source": "default_1usd", "information_text": "", "description_text": "", "features_text": "", "specifications_text": "", "benefits_text": "", "details_text": "", "other_sections": "", "sections": {}, "txt_path": "dataset/txt_limpios/899.txt", "html_path": "dataset/paginas_descargadas/899.html", "es_status": "EN", "category_canonical": "sin_categoria", "decision": "discard", "match_score": 0.3, "reasons": "no_category_detected;price_parse_failed"}
{"source_id": "901", "title": "901", "description": "", "breadcrumbs": "", "price_raw": "", "currency_raw": "", "url": "", "seller": "Desconocido", "availability": "unknown", "country": "UNKNOWN", "product_name": "", "brand": "", "reference": "", "unit": "", "price_amount": null, "price_currency": "", "price_symbol": "", "price_text": "", "price_amount_filled": "234.19", "price_is_imputed": "True", "price_imputation_source": "country_mean", "price_amount_usd": "", "price_amount_usd_filled": "234.1938", "fx_rate_local_per_usd": "1.0", "fx_source": "default_1usd", "information_text": "", "description_text": "", "features_text": "", "specifications_text": "", "benefits_text": "", "details_text": "", "other_sections": "", "sections": {}, "txt_path": "dataset/txt_limpios/901.txt", "html_path": "dataset/paginas_descargadas/901.html", "es_status": "EN", "category_canonical": "sin_categoria", "decision": "discard", "match_score": 0.3, "reasons": "no_category_detected;price_parse_failed"}
{"source_id": "907", "title": "907", "description": "", "breadcrumbs": "", "price_raw": "", "currency_raw": "", "url": "", "seller": "Desconocido", "availability": "unknown", "country": "UNKNOWN", "product_name": "", "brand": "", "reference": "", "unit": "", "price_amount": null, "price_currency": "", "price_symbol": "", "price_text": "", "price_amount_filled": "234.19", "price_is_imputed": "True", "price_imputation_source": "country_mean", "price_amount_usd": "", "price_amount_usd_filled": "234.1938", "fx_rate_local_per_usd": "1.0", "fx_source": "default_1usd", "information_text": "", "description_text": "", "features_text": "", "specifications_text": "", "benefits_text": "", "details_text": "", "other_sections": "", "sections": {}, "txt_path": "dataset/txt_limpios/907.txt", "html_path": "dataset/paginas_descargadas/907.html", "es_status": "EN", "category_canonical": "sin_categoria", "decision": "discard", "match_score": 0.3, "reasons": "no_category_detected;price_parse_failed"}
{"source_id": "912", "title": "912", "description": "", "breadcrumbs": "", "price_raw": "", "currency_raw": "", "url": "", "seller": "Desconocido", "availability": "unknown", "country": "UNKNOWN", "product_name": "", "brand": "", "reference": "", "unit": "", "price_amount": null, "price_currency": "", "price_symbol": "", "price_text": "", "price_amount_filled": "234.19", "price_is_imputed": "True", "price_imputation_source": "country_mean", "price_amount_usd": "", "price_amount_usd_filled": "234.1938", "fx_rate_local_per_usd": "1.0", "fx_source": "default_1usd", "information_text": "", "description_text": "", "features_text": "", "specifications_text": "", "benefits_text": "", "details_text": "", "other_sections": "", "sections": {}, "txt_path": "dataset/txt_limpios/912.txt", "html_path": "dataset/paginas_descargadas/912.html", "es_status": "EN", "category_canonical": "sin_categoria", "decision": "discard", "match_score": 0.3, "reasons": "no_category_detected;price_parse_failed"}
{"source_id": "919", "title": "919", "description": "", "breadcrumbs": "", "price_raw": "", "currency_raw": "", "url": "", "seller": "Desconocido", "availability": "unknown", "country": "UNKNOWN", "product_name": "", "brand": "", "reference": "", "unit": "", "price_amount": null, "price_currency": "", "price_symbol": "", "price_text": "", "price_amount_filled": "234.19", "price_is_imputed": "True", "price_imputation_source": "country_mean", "price_amount_usd": "", "price_amount_usd_filled": "234.1938", "fx_rate_local_per_usd": "1.0", "fx_source": "default_1usd", "information_text": "", "description_text": "", "features_text": "", "specifications_text": "", "benefits_text": "", "details_text": "", "other_sections": "", "sections": {}, "txt_path": "dataset/txt_limpios/919.txt", "html_path": "dataset/paginas_descargadas/919.html", "es_status": "EN", "category_canonical": "sin_categoria", "decision": "discard", "match_score": 0.3, "reasons": "no_category_detected;price_parse_failed"}
{"source_id": "921", "title": "921", "description": "", "breadcrumbs": "", "price_raw": "", "currency_raw": "", "url": "", "seller": "Desconocido", "availability": "unknown", "country": "UNKNOWN", "product_name": "", "brand": "", "reference": "", "unit": "", "price_amount": null, "price_currency": "", "price_symbol": "", "price_text": "", "price_amount_filled": "234.19", "price_is_imputed": "True", "price_imputation_source": "country_mean", "price_amount_usd": "", "price_amount_usd_filled": "234.1938", "fx_rate_local_per_usd": "1.0", "fx_source": "default_1usd", "information_text": "", "description_text": "", "features_text": "", "specifications_text": "", "benefits_text": "", "details_text": "", "other_sections": "", "sections": {}, "txt_path": "dataset/txt_limpios/921.txt", "html_path": "dataset/paginas_descargadas/921.html", "es_status": "EN", "category_canonical": "sin_categoria", "decision": "discard", "match_score": 0.3, "reasons": "no_category_detected;price_parse_failed"}
{"source_id": "922", "title": "922", "description": "", "breadcrumbs": "", "price_raw": "", "currency_raw": "", "url": "", "seller": "Desconocido", "availability": "unknown", "country": "UNKNOWN", "product_name": "", "brand": "", "reference": "", "unit": "", "price_amount": null, "price_currency": "", "price_symbol": "", "price_text": "", "price_amount_filled": "234.19", "price_is_imputed": "True", "price_imputation_source": "country_mean", "price_amount_usd": "", "price_amount_usd_filled": "234.1938", "fx_rate_local_per_usd": "1.0", "fx_source": "default_1usd", "information_text": "", "description_text": "", "features_text": "", "specifications_text": "", "benefits_text": "", "details_text": "", "other_sections": "", "sections": {}, "txt_path": "dataset/txt_limpios/922.txt", "html_path": "dataset/paginas_descargadas/922.html", "es_status": "EN", "category_canonical": "sin_categoria", "decision": "discard", "match_score": 0.3, "reasons": "no_category_detected;price_parse_failed"}
{"source_id": "10", "title": "Aceites y vinagres", "description": "Aceite 123 Vegetal te ayuda a preparar tus alimentos de una manera más sana ya que por su origen vegetal en el contiene colesterol, ademas intensifica el sabor de los ingredientes que uses al cocinar. Aceite Vegetal comestible 123,es elaborado por una empresa 100% mexicana, mezcla lo mejor de los semillas Girasol y Canola, lo que hace que sus alimentos sean cocinados de una manera saludable , también se puede consumir como complemento en adherizos para ensaladas si asi lo prefieres.", "breadcrumbs": "123 > 1L > 3009948", "price_raw": "37.0", "currency_raw": "MXN", "url": "", "seller": "Chedraui", "availability": "unknown", "country": "MX", "product_name": "Aceites y vinagres", "brand": "123", "reference": "3009948.0", "unit": "1L", "price_amount": 37.0, "price_currency": "MXN", "price_symbol": "$", "price_text": "$37.00", "price_amount_filled": "37.0", "price_is_imputed": "False", "price_imputation_source": "original", "price_amount_usd": "1.9871", "price_amount_usd_filled": "1.9871", "fx_rate_local_per_usd": "18.62", "fx_source": "from_mexico_cambio_dolar", "information_text": "Aceite 123 Vegetal te ayuda a preparar tus alimentos de una manera más sana ya que por su origen vegetal en el contiene colesterol, ademas intensifica el sabor de los ingredientes que uses al cocinar.", "description_text": "", "features_text": "Vegetal | Contiene vitamina E | No contiene colesterol | Antioxidante TBHQ", "specifications_text": "Aceite Vegetal comestible 123,es elaborado por una empresa 100% mexicana,  mezcla lo mejor de dos semillas Girasol y Canola, lo que hace que sus alimentos sean cocinados de una manera saludable , tambien se puede consumir como complemento en aderezos para ensaladas si asi lo prefieres.", "benefits_text": "", "details_text": "", "other_sections": "", "sections": {"Información": ["Aceite 123 Vegetal te ayuda a preparar tus alimentos de una manera más sana ya que por su origen vegetal en el contiene colesterol, ademas intensifica el sabor de los ingredientes que uses al cocinar."], "Características": ["Vegetal", "Contiene vitamina E", "No contiene colesterol", "Antioxidante TBHQ"], "Especificaciones": ["Aceite Vegetal comestible 123,es elaborado por una empresa 100% mexicana,  mezcla lo mejor de dos semillas Girasol y Canola, lo que hace que sus alimentos sean cocinados de una manera saludable , tambien se puede consumir como complemento en aderezos para ensaladas si asi lo prefieres."]}, "txt_path": "dataset/txt_limpios/10.txt", "html_path": "dataset/paginas_descargadas/10.html", "es_status": "ET", "category_canonical": "aceite vegetal", "decision": "keep", "match_score": 0.6, "reasons": "heuristic_default"}
{"source_id": "6", "title": "Aceites y vinagres", "description": "Nutrioli Antiguoteo, con tapa dosificadora para mayor control y limpieza, es un aceite100% puro con Omegas 3, 6 y 9 que favorece la salud cardiovascular, por su origen vegetal no contiene colestero y contiene vitamina Y, ideal para cocinar de forma práctica y sencilla Nutrioli Antiguoteo, con tapa dosificadora para mayor control y limpieza, es un aceptado para cocinar 100% puro de soya que cuida tu salud, ya que cuenta con Omegas 3, 6 y 9, que ayudan a elevar tus niveles de colesterol bueno y reducir el malo, por su origen vegetal en el contiene colesterol, es claro y su consistencia es muy ligera, además, contiene vitamina Y, ideal para cocinar de manera práctica y sencilla", "breadcrumbs": "Nutrioli > 700ml > 3738492", "price_raw": "", "currency_raw": "MXN", "url": "", "seller": "Chedraui", "availability": "unknown", "country": "MX", "product_name": "Aceites y vinagres", "brand": "Nutrioli", "reference": "3738492.0", "unit": "700ml", "price_amount": null, "price_currency": "MXN", "price_symbol": "", "price_text": "", "price_amount_filled": "33.3", "price_is_imputed": "True", "price_imputation_source": "category_country_mean", "price_amount_usd": "", "price_amount_usd_filled": "1.7884", "fx_rate_local_per_usd": "18.62", "fx_source": "from_mexico_cambio_dolar", "information_text": "Nutrioli Antiguoteo, con tapa dosificadora para mayor control y limpieza, es un aceite100% puro con Omegas 3, 6 y 9 que favorece la salud cardiovascular, por su origen vegetal no contiene colestero y contiene vitamina Y, ideal para cocinar de manera práctica y sencilla", "description_text": "", "features_text": "", "specifications_text": "Nutrioli Antiguoteo, con tapa dosificadora para mayor control y limpieza, es un aceptado para cocinar 100% puro de soya que cuida tu salud, ya que cuenta con Omegas 3, 6 y 9, que ayudan a elevar tus niveles de colesterol bueno y reducir el malo, por su origen vegetal en el contiene colesterol, es claro y su consistencia es muy ligera, además, contiene vitamina Y, ideal para cocinar de manera práctica y sencilla", "benefits_text": "", "details_text": "", "other_sections": "", "sections": {"Información": ["Nutrioli Antiguoteo, con tapa dosificadora para mayor control y limpieza, es un aceite100% puro con Omegas 3, 6 y 9 que favorece la salud cardiovascular, por su origen vegetal no contiene colestero y contiene vitamina Y, ideal para cocinar de manera práctica y sencilla"], "Especificaciones": ["Nutrioli Antiguoteo, con tapa dosificadora para mayor control y limpieza, es un aceptado para cocinar 100% puro de soya que cuida tu salud, ya que cuenta con Omegas 3, 6 y 9, que ayudan a elevar tus niveles de colesterol bueno y reducir el malo, por su origen vegetal en el contiene colesterol, es claro y su consistencia es muy ligera, además, contiene vitamina Y, ideal para cocinar de manera práctica y sencilla"]}, "txt_path": "dataset/txt_limpios/6.txt", "html_path": "dataset/paginas_descargadas/6.html", "es_status": "ET", "category_canonical": "aceite vegetal", "decision": "discard", "match_score": 0.6, "reasons": "price_parse_failed;price<=0"}
{"source_id": "7", "title": "Aceites y vinagres", "description": "Prepara tu despensa en unos cuantos clics y descubre nuestra gran variedad de productos. ¡En la sala de casa, te llevamos el súper!", "breadcrumbs": "Aceite Chedraui Mixto 800ml > 800ml > 3717376", "price_raw": "28.0", "currency_raw": "MXN", "url": "", "seller": "Chedraui", "availability": "unknown", "country": "MX", "product_name": "Aceites y vinagres", "brand": "Aceite Chedraui Mixto 800ml", "reference": "3717376.0", "unit": "800ml", "price_amount": 28.0, "price_currency": "MXN", "price_symbol": "$", "price_text": "$28.00", "price_amount_filled": "28.0", "price_is_imputed": "False", "price_imputation_source": "original", "price_amount_usd": "1.5038", "price_amount_usd_filled": "1.5038", "fx_rate_local_per_usd": "18.62", "fx_source": "from_mexico_cambio_dolar", "information_text": "", "description_text": "", "features_text": "Aceite vegetal comestible | Consérvese en un lugar fresco | Ideal para freír", "specifications_text": "Prepara tu despensa en unos cuantos clics y descubre nuestra gran variedad de productos. ¡En la sala de casa, te llevamos el súper!", "benefits_text": "", "details_text": "", "other_sections": "", "sections": {"Características": ["Aceite vegetal comestible", "Consérvese en un lugar fresco", "Ideal para freír"], "Especificaciones": ["Prepara tu despensa en unos cuantos clics y descubre nuestra gran variedad de productos. ¡En la sala de casa, te llevamos el súper!"]}, "txt_path": "dataset/txt_limpios/7.txt", "html_path": "dataset/paginas_descargadas/7.html", "es_status": "ET", "category_canonical": "aceite vegetal", "decision": "keep", "match_score": 0.6, "reasons": "heuristic_default"}
{"source_id": "8", "title": "Aceites y vinagres", "description": "Resalta el sabor y la textura de los alimentos Mezcla saludable de aceites vegetales insaturados", "breadcrumbs": "Patrona > 1 L > 3009886", "price_raw": "", "currency_raw": "MXN", "url": "", "seller": "Chedraui", "availability": "unknown", "country": "MX", "product_name": "Aceites y vinagres", "brand": "Patrona", "reference": "3009886.0", "unit": "1 L", "price_amount": null, "price_currency": "MXN", "price_symbol": "", "price_text": "", "price_amount_filled": "33.3", "price_is_imputed": "True", "price_imputation_source": "category_country_mean", "price_amount_usd": "", "price_amount_usd_filled": "1.7884", "fx_rate_local_per_usd": "18.62", "fx_source": "from_mexico_cambio_dolar", "information_text": "Resalta el sabor y la textura de los alimentos", "description_text": "", "features_text": "", "specifications_text": "Mezcla saludable de aceites vegetales insaturados", "benefits_text": "", "details_text": "", "other_sections": "", "sections": {"Información": ["Resalta el sabor y la textura de los alimentos"], "Especificaciones": ["Mezcla saludable de aceites vegetales insaturados"]}, "txt_path": "dataset/txt_limpios/8.txt", "html_path": "dataset/paginas_descargadas/8.html", "es_status": "EN", "category_canonical": "aceite vegetal", "decision": "discard", "match_score": 0.6, "reasons": "price_parse_failed;price<=0"}
{"source_id": "433", "title": "Acerca de tu privacidad", "description": "", "breadcrumbs": "Más información", "price_raw": "", "currency_raw": "ARS", "url": "", "seller": "Desconocido", "availability": "unknown", "country": "AR", "product_name": "Acerca de tu privacidad", "brand": "Más información", "reference": "", "unit": "", "price_amount": null, "price_currency": "ARS", "price_symbol": "", "price_text": "", "price_amount_filled": "1663.58", "price_is_imputed": "True", "price_imputation_source": "country_mean", "price_amount_usd": "", "price_amount_usd_filled": "1.3256", "fx_rate_local_per_usd": "1255.0", "fx_source": "from_argentina_cambio_dolar", "information_text": "", "description_text": "", "features_text": "", "specifications_text": "", "benefits_text": "", "details_text": "", "other_sections": "", "sections": {}, "txt_path": "dataset/txt_limpios/433.txt", "html_path": "dataset/paginas_descargadas/433.html", "es_status": "EN", "category_canonical": "sin_categoria", "decision": "discard", "match_score": 0.3, "reasons": "no_category_detected;price_parse_failed"}
{"source_id": "448", "title": "Acerca de tu privacidad", "description": "", "breadcrumbs": "Más información", "price_raw": "", "currency_raw": "ARS", "url": "", "seller": "Desconocido", "availability": "unknown", "country": "AR", "product_name": "Acerca de tu privacidad", "brand": "Más información", "reference": "", "unit": "", "price_amount": null, "price_currency": "ARS", "price_symbol": "", "price_text": "", "price_amount_filled": "1663.58", "price_is_imputed": "True", "price_imputation_source": "country_mean", "price_amount_usd": "", "price_amount_usd_filled": "1.3256", "fx_rate_local_per_usd": "1255.0", "fx_source": "from_argentina_cambio_dolar", "information_text": "", "description_text": "", "features_text": "", "specifications_text": "", "benefits_text": "", "details_text": "", "other_sections": "", "sections": {}, "txt_path": "dataset/txt_limpios/448.txt", "html_path": "dataset/paginas_descargadas/448.html", "es_status": "EN", "category_canonical": "sin_categoria", "decision": "discard", "match_score": 0.3, "reasons": "no_category_detected;price_parse_failed"}
