source_id,title,description,breadcrumbs,price_raw,currency_raw,url,seller,availability,country,product_name,brand,reference,unit,price_amount,price_currency,price_symbol,price_text,price_amount_filled,price_is_imputed,price_imputation_source,price_amount_usd,price_amount_usd_filled,fx_rate_local_per_usd,fx_source,information_text,description_text,features_text,specifications_text,benefits_text,details_text,other_sections,sections,txt_path,html_path,es_status,category_canonical,decision,match_score,reasons
1035,colaborar con nuestros estudios para marketing. También puede configurarlas.,Información de la marca,que podemos ofrecer. > 1Kg,16.92,PEN,,Desconocido,unknown,PE,colaborar con nuestros estudios para marketing. También puede configurarlas.,que podemos ofrecer.,,1Kg,16.92,PEN,S/,S/16.92,16.92,False,original,4.7662,4.7662,3.55,from_peru_cambio_dolar,,Información de la marca,"Presentación/Empaque | Bolsa | Porción sugerida | No aplica | Alérgenos Declarados | Azúcares Porción | Calorías Porción | Carbohidratos Porción | Grasas Porción | Composición/Origen | Azúcar de caña sin refinar/Colombia, Guatemala | Advertencias de Almacenamiento | Contenido Neto | 1 Kg | Denominación/Variedad | Revisa todo | Importante destacar | Mantener la temperatura ambiente | Presentación: Bolsa | Descripción del producto | Endulza y realza el sabor de tus bebidas favoritas con las mejores marcas de Azúcar y Endulzantes .Olvídate del tráfico y de las largas colas e ingresa a | plaza Vea | y encuentra azúcar morena, olla, azúcar impalpable, azúcar rubí, azúcar negro, azúcar blanca, azúcar granulada, azúcar refinada, azúcar en polvo, azúcar integral, olla y más. | Si llevas una alimentación especial y en debes consumir azúcares tradicionales te recomendamos utilizar | Endulzantes | de Stevia, los que proporcionarán dulsor a tus bebidas y alimentos sin aportar calorías. | - ¿Conoce lo mejor en Azúcar y Endulzantes en plazaVea | *La imagen es solo referencial | Bell ́s | ""Bell's ofrece una alternativa accesible en torno a calidad y precio de sus productos; con el respaldo y garantía de plazaVea."" | ¿En qué búsqueda? Encuentra más productos | en plaza Vea | Componentes del Producto | Vendido por | En caso de que algo te guste: Puedes revisar nuestras | Políticas de cambios y/o devoluciones | y hacerlas efectivas en todas nuestras tiendas. | Productos | que te pueden interesar | Recomendado para ti",,,,,"{""Descripción"": [""Información de la marca""], ""Características"": [""Presentación/Empaque"", ""Bolsa"", ""Porción sugerida"", ""No aplica"", ""Alérgenos Declarados"", ""Azúcar por porción"", ""Calorías Porción"", ""Carbohidratos Porción"", ""Descripción Nutricional"", ""Grasas Porción"", ""Composición/Origen"", ""Azúcar de caña sin refinar/Colombia, Guatemala"", ""Advertencias De Almacenamiento"", ""Temperatura ambiente"", ""Contenido Neto"", ""1 Kg"", ""Denominación/Variedad"", ""Revisa todo"", ""Importante destacar"", ""Mantener a temperatura ambiente"", ""Presentación : Bolsa"", ""Descripción del producto"", ""Endulza y realza el sabor de tus bebidas favoritas con las mejores marcas de Azúcar y Endulzantes .Olvídate del tráfico y de las largas colas e ingresa a"", ""plazaVea"", ""y encuentra azúcar morena, olla, azúcar impalpable, azúcar rubí, azúcar negro, azúcar blanca, azúcar granulada, azúcar refinada, azúcar en polvo, azúcar integral, olla y más."", ""Si llevas una alimentación especial y no debes consumir azúcares tradicionales te recomendamos utilizar"", ""Endulzantes"", ""de Stevia, los que proporcionarán dulsor a tus bebidas y alimentos sin aportar calorías."", ""Conoce lo mejor en Azúcar y Endulzantes en plaza Ver"", ""*La imagen es solo referencial"", ""Bell´s"", ""\""Bell's ofrece una alternativa accesible en torno a la calidad y precio de sus productos; con el respaldo y garantía de plaza Vea"", ""¿En qué búsqueda? Encuentra más productos"", ""en plazaVea"", ""Componentes del Producto"", ""Vendido por"", ""En caso algo no vaya como gustes: Puedes revisar nuestras"", ""Politicas de cambios y/o devoluciones"", ""y hacerlas efectivas en todas nuestras tiendas."", ""Productos"", ""que te pueden interesar"", ""Recomendado para ti""]}",dataset/txt_limpios/1035.txt,dataset/paginas_descargadas/1035.html,ET,sin_categoria,discard,0.30,no_category_detected
1037,colaborar con nuestros estudios para marketing. También puede configurarlas.,Información de la marca,que podemos ofrecer. > 5Kg,16.92,PEN,,Desconocido,unknown,PE,colaborar con nuestros estudios para marketing. También puede configurarlas.,que podemos ofrecer.,,5Kg,16.92,PEN,S/,S/16.92,16.92,False,original,4.7662,4.7662,3.55,from_peru_cambio_dolar,,Información de la marca,"Presentación/Empaque | Bolsa | Porción sugerida | 4g | Alérgenos Declarados | NO | Azúcares Porción | Calorías Porción | 66.5 KJ | Carbohidratos Porción | 4 g | Grasas Porción | 0 | Proteínas Porción | 0.09 | Sodio Porción | Composición/Origen | Caña de Azúcar | Advertencias De Almacenamiento | Lugar fresco y seco | Contenido Neto | 5kg | Denominación/Variedad | Revisa todo | Importante destacar | Contenido de 5 kilos | Marca: CASA GRAN | Descripción del producto | AZÚCARES Y ENDULZANTES | plaza Vea | cuenta con una amplia variedad de | para que puedas elegir el que más se adecúe a tus necesidades. | Dentro de los | encontramos los | , un producto muy utilizado en la cocina y repostería gracias a su versatilidad. Por ejemplo el | Azúcar Blanca | es perfecta para preparar postres debido al color y brillo que le otorga a los postres. También puedes optar por alguna variedad de | Endulzantes | para ponerle sabor a tus refrescos de mesa, y preparar postres para personas que son intolerantes al azúcar. | - Conoce las distintas opciones en | en plazaVea Online! | *La imagen solo es referencial | ¿En qué búsqueda? Encuentra más | en plaza Vea | Componentes del Producto | Vendido por | En caso de que algo te guste: Puedes revisar nuestras | Políticas de cambios y/o devoluciones | y hacerlas efectivas en todas nuestras tiendas. | Productos | que te pueden interesar | Recomendado para ti",,,,,"{""Descripción"": [""Información de la marca""], ""Características"": [""Presentación/Empaque"", ""Bolsa"", ""Porción sugerida"", ""4g"", ""Alérgenos Declarados"", ""NO"", ""Azúcar por porción"", ""Calorías Porción"", ""66.5 KJ"", ""Carbohidratos Porción"", ""4 g"", ""Grasas Porción"", ""0"", ""Proteínas Porción"", ""0.09"", ""Sodio Porción"", ""Composición/Origen"", ""Caña de Azúcar"", ""Advertencias De Almacenamiento"", ""Lugar fresco y seco"", ""Contenido Neto"", ""5kg"", ""Denominación/Variedad"", ""Revisa todo"", ""Importante destacar"", ""Contenido de 5 kilos"", ""Marca: CASA GRANDE"", ""Descripción del producto"", ""AZÚCARES Y ENDULZANTES"", ""plazaVea"", ""cuenta con una amplia variedad de"", ""para que puedas elegir qué más se adecúe a tus necesidades."", ""Dentro de los"", ""encontramos los"", "", un producto muy utilizado en la cocina y repostería gracias a su versatilidad. Por ejemplo el"", ""Azúcar Blanca"", ""es perfecta para preparar postres debido al color y brillo que le otorga a los postres. También puedes optar por alguna variedad de"", ""Endulzantes"", ""para ponerle sabor a tus refrescos de mesa, y preparar postres para personas que son intolerantes al azúcar."", ""¡Conoce las distintas opciones en"", ""en plazaVea Online!"", ""*La imagen solo es referencial"", ""¿En qué búsqueda? Encuentra más"", ""en plazaVea"", ""Componentes del Producto"", ""Vendido por"", ""En caso algo no vaya como gustes: Puedes revisar nuestras"", ""Politicas de cambios y/o devoluciones"", ""y hacerlas efectivas en todas nuestras tiendas."", ""Productos"", ""que te pueden interesar"", ""Recomendado para ti""]}",dataset/txt_limpios/1037.txt,dataset/paginas_descargadas/1037.html,ET,sin_categoria,discard,0.30,no_category_detected
1038,colaborar con nuestros estudios para marketing. También puede configurarlas.,Información de la marca,que podemos ofrecer. > 770g,16.92,PEN,,Desconocido,unknown,PE,colaborar con nuestros estudios para marketing. También puede configurarlas.,que podemos ofrecer.,,770g,16.92,PEN,S/,S/16.92,16.92,False,original,4.7662,4.7662,3.55,from_peru_cambio_dolar,,Información de la marca,"Presentación/Empaque | Bolsa | Denominación Dietética | Porción sugerida | 2 | Alérgenos Declarados | Gluten y Soya | Azúcares Porción | 2g | Calorías Porción | 125.5kcal | Carbohidratos Por Porción | 23g | Descripción Nutricional | Nuestra receta está elaborada con la bondad del trigo y con fermentación natural, para que tengas siempre en tu mesa un pan suave, esponjoso y con el mejor sabor. | Grasas Porción | 1.5g | Proteínas Porción | 5 | Sodio Porción | 200mg | Advertencias de Almacenamiento | Mantener en lugar fresco, seco, libre de olores extraños y limpio. Evite la exposición directa a la luz del sol y el calor. | Contenido Neto | 770g | Denominación/Variedad | Revisa todo | Componentes del Producto | Vendido por | plaza Vea | En caso de que algo te guste: Puedes revisar nuestras | Políticas de cambios y/o devoluciones | y hacerlas efectivas en todas nuestras tiendas. | Productos | que te pueden interesar | Recomendado para ti",,,,,"{""Descripción"": [""Información de la marca""], ""Características"": [""Presentación/Empaque"", ""Bolsa"", ""Denominación Dietética"", ""Porción sugerida"", ""2"", ""Alérgenos Declarados"", ""Gluten y Soya"", ""Azúcar por porción"", ""2g"", ""Calorías Porción"", ""125.5kcal"", ""Carbohidratos Porción"", ""23g"", ""Descripción Nutricional"", ""Nuestra receta está elaborada con la bondad del trigo y con fermentación natural, para que tengas siempre en tu mesa un pan suave, esponjoso y con el mejor sabor."", ""Grasas Porción"", ""1.5g"", ""Proteínas Porción"", ""5"", ""Sodio Porción"", ""200mg"", ""Advertencias De Almacenamiento"", ""Mantener en lugar fresco, seco, libre de olores extraños y limpio. Evite la exposición directa a la luz del sol y el calor."", ""Contenido Neto"", ""770g"", ""Denominación/Variedad"", ""Revisa todo"", ""Componentes del Producto"", ""Vendido por"", ""plazaVea"", ""En caso algo no vaya como gustes: Puedes revisar nuestras"", ""Politicas de cambios y/o devoluciones"", ""y hacerlas efectivas en todas nuestras tiendas."", ""Productos"", ""que te pueden interesar"", ""Recomendado para ti""]}",dataset/txt_limpios/1038.txt,dataset/paginas_descargadas/1038.html,ET,sin_categoria,discard,0.30,no_category_detected
1039,colaborar con nuestros estudios para marketing. También puede configurarlas.,Información de la marca,que podemos ofrecer. > 500g,16.92,PEN,,Desconocido,unknown,PE,colaborar con nuestros estudios para marketing. También puede configurarlas.,que podemos ofrecer.,,500g,16.92,PEN,S/,S/16.92,16.92,False,original,4.7662,4.7662,3.55,from_peru_cambio_dolar,,Información de la marca,"Importante destacar | Pan empacado | Ideal para los desayunos y sándwiches | Conservar en lugar fresco y seco | Descripción del producto | PAN DE LA CASA Y PAN ENVASADO | Disfruta de los mejores insumos de | en la página online de plaza ¡Mira! Ingresando la sección de | Panadería, Pastelería y Comidas | podrás elegir entre una variedad de deliciosos productos, todos elaborados por expertos en la cocina. | Ingresa la web de | plaza Vea | y déjate atrapar por todo nuestro sordo de | y | Pan de la Casa | , ideales para esos momentos especiales en familia, celebraciones, simplemente darte un gustito al día. Tenemos presentaciones de | pan a granel | , | bollería fina | pan pita y árabe | , además de pan relleno tanto dulce como salado para brindarte una mayor diversidad de opciones. | ¿Conoce la mejor variedad de Pan Envasado y Pan de la Casa en plazaVea Online? | ¿En qué búsqueda? Encuentra más | Pan Envasado y Pan de la casa | en plaza Vea | Revisa todo | Componentes del Producto | Vendido por | En caso de que algo te guste: Puedes revisar nuestras | Políticas de cambios y/o devoluciones | y hacerlas efectivas en todas nuestras tiendas. | Productos | que te pueden interesar | Recomendado para ti",,,,,"{""Descripción"": [""Información de la marca""], ""Características"": [""Importante destacar"", ""Pan empacado"", ""Ideal para los desayunos y sándwiches"", ""Conservar en lugar fresco y seco"", ""Descripción del producto"", ""PAN DE LA CASA Y PAN ENVASADO"", ""¡Disfruta de los mejores insumos de"", ""en la página online de plaza ¡Mira! Ingresando la sección de"", ""Panadería, Pastelería y Comidas"", ""podrás elegir entre una variedad de deliciosos productos, todos elaborados por expertos en la cocina."", ""Ingresa a la web de"", ""plazaVea"", ""y déjate atrapar por todo nuestro sordo"", ""y"", ""Pan de la Casa"", "", ideales para esos momentos especiales en familia, celebraciones, el simplemente darte un gustito al día. Tenemos presentaciones"", ""pan a granel"", "","", ""bollería fina"", ""pan pita y árabe"", "", además de pan relleno tanto dulce como salado para brindarte una mayor diversidad de opciones."", ""¡Conoce la mejor variedad de Pan Envasado y Pan de la Casa en plazaVea Online!"", ""¿En qué búsqueda? Encuentra más"", ""Pan Envasado y Pan de la casa"", ""en plazaVea"", ""Revisa todo"", ""Componentes del Producto"", ""Vendido por"", ""En caso algo no vaya como gustes: Puedes revisar nuestras"", ""Politicas de cambios y/o devoluciones"", ""y hacerlas efectivas en todas nuestras tiendas."", ""Productos"", ""que te pueden interesar"", ""Recomendado para ti""]}",dataset/txt_limpios/1039.txt,dataset/paginas_descargadas/1039.html,ET,sin_categoria,discard,0.30,no_category_detected
1040,colaborar con nuestros estudios para marketing. También puede configurarlas.,Información de la marca,que podemos ofrecer. > 540g,16.92,PEN,,Desconocido,unknown,PE,colaborar con nuestros estudios para marketing. También puede configurarlas.,que podemos ofrecer.,,540g,16.92,PEN,S/,S/16.92,16.92,False,original,4.7662,4.7662,3.55,from_peru_cambio_dolar,,Información de la marca,"Presentación/Empaque | Bolsa | Porción sugerida | No especifica | Alérgenos Declarados | Contiene gluten y leche | Azúcares Porción | 1. 96gr | Calorías Por Porción | 144. 54kcal | Carbohidratos Porción | 23.42gr | Descripción Nutricional | No | Grasas Porción | 4. 03gr | Proteínas Porción | 4.28gr | Sodio Porción | 229. 37mg | Composición | Harina de trigo fortificada, azucar, salvado de trigo, sal , levadura | Advertencias De Almacenamiento | Mantener en lugar fresco, seco, libre de olores extraños y limpio. Evite la exposición directa a la luz del sol y el calor | Contenido Neto | 540gr | Denominación/Variedad | Revisa todo | Importante destacar | Pan empacado | Ideal para los desayunos y sándwiches | Conservar en lugar fresco y seco | Descripción del producto | PAN DE LA CASA Y PAN ENVASADO | -Disfruta de los mejores insumos de | en la página online de plaza ¡Mira! Ingresando la sección de | Panadería, Pastelería y Comidas | podrás elegir entre una variedad de deliciosos productos, todos elaborados por expertos en la cocina. | Ingresa la web de | plaza Vea | y déjate atrapar por todo nuestro sordo de | y | Pan de la Casa | , ideales para esos momentos especiales en familia, celebraciones, simplemente darte un gustito al día. Tenemos presentaciones de | pan a granel | , | bollería fina | pan pita y árabe | , además de pan relleno tanto dulce como salado para brindarte una mayor diversidad de opciones. | ¿Conoce la mejor variedad de Pan Envasado y Pan de la Casa en plazaVea Online? | ¿En qué búsqueda? Encuentra más | Pan Envasado y Pan de la casa | en plaza Vea | Componentes del Producto | Vendido por | En caso de que algo te guste: Puedes revisar nuestras | Políticas de cambios y/o devoluciones | y hacerlas efectivas en todas nuestras tiendas. | Productos | que te pueden interesar | Recomendado para ti",,,,,"{""Descripción"": [""Información de la marca""], ""Características"": [""Presentación/Empaque"", ""Bolsa"", ""Porción sugerida"", ""No especifica"", ""Alérgenos Declarados"", ""Contiene gluten y leche"", ""Azúcar por porción"", ""1. 96gr"", ""Calorías Porción"", ""144. 54kcal"", ""Carbohidratos Porción"", ""23. 42gr"", ""Descripción Nutricional"", ""No"", ""Grasas Porción"", ""4. 03gr"", ""Proteínas Porción"", ""4. 28gr"", ""Sodio Porción"", ""229. 37mg"", ""Composición"", ""Harina de trigo fortificada, azucar, salvado de trigo, sal , levadura"", ""Advertencias De Almacenamiento"", ""Mantener en lugar fresco, seco, libre de olores extraños y limpio. Evite la exposición directa a la luz del sol y el calor"", ""Contenido Neto"", ""540gr"", ""Denominación/Variedad"", ""Revisa todo"", ""Importante destacar"", ""Pan empacado"", ""Ideal para los desayunos y sándwiches"", ""Conservar en lugar fresco y seco"", ""Descripción del producto"", ""PAN DE LA CASA Y PAN ENVASADO"", ""¡Disfruta de los mejores insumos de"", ""en la página online de plaza ¡Mira! Ingresando la sección de"", ""Panadería, Pastelería y Comidas"", ""podrás elegir entre una variedad de deliciosos productos, todos elaborados por expertos en la cocina."", ""Ingresa a la web de"", ""plazaVea"", ""y déjate atrapar por todo nuestro sordo"", ""y"", ""Pan de la Casa"", "", ideales para esos momentos especiales en familia, celebraciones, el simplemente darte un gustito al día. Tenemos presentaciones"", ""pan a granel"", "","", ""bollería fina"", ""pan pita y árabe"", "", además de pan relleno tanto dulce como salado para brindarte una mayor diversidad de opciones."", ""¡Conoce la mejor variedad de Pan Envasado y Pan de la Casa en plazaVea Online!"", ""¿En qué búsqueda? Encuentra más"", ""Pan Envasado y Pan de la casa"", ""en plazaVea"", ""Componentes del Producto"", ""Vendido por"", ""En caso algo no vaya como gustes: Puedes revisar nuestras"", ""Politicas de cambios y/o devoluciones"", ""y hacerlas efectivas en todas nuestras tiendas."", ""Productos"", ""que te pueden interesar"", ""Recomendado para ti""]}",dataset/txt_limpios/1040.txt,dataset/paginas_descargadas/1040.html,ET,sin_categoria,discard,0.30,no_category_detected
1041,colaborar con nuestros estudios para marketing. También puede configurarlas.,Información de la marca,que podemos ofrecer. > 560g,16.92,PEN,,Desconocido,unknown,PE,colaborar con nuestros estudios para marketing. También puede configurarlas.,que podemos ofrecer.,,560g,16.92,PEN,S/,S/16.92,16.92,False,original,4.7662,4.7662,3.55,from_peru_cambio_dolar,,Información de la marca,"Importante destacar | Pan empacado | Ideal para los desayunos y sándwiches | Conservar en lugar fresco y seco | Descripción del producto | PAN DE LA CASA Y PAN ENVASADO | Disfruta de los mejores insumos de | en la página online de plaza ¡Mira! Ingresando la sección de | Panadería, Pastelería y Comidas | podrás elegir entre una variedad de deliciosos productos, todos elaborados por expertos en la cocina. | Ingresa la web de | plaza Vea | y déjate atrapar por todo nuestro sordo de | y | Pan de la Casa | , ideales para esos momentos especiales en familia, celebraciones, simplemente darte un gustito al día. Tenemos presentaciones de | pan a granel | , | bollería fina | pan pita y árabe | , además de pan relleno tanto dulce como salado para brindarte una mayor diversidad de opciones. | ¿Conoce la mejor variedad de Pan Envasado y Pan de la Casa en plazaVea Online? | ¿En qué búsqueda? Encuentra más | Pan Envasado y Pan de la casa | en plaza Vea | Revisa todo | Componentes del Producto | Vendido por | En caso de que algo te guste: Puedes revisar nuestras | Políticas de cambios y/o devoluciones | y hacerlas efectivas en todas nuestras tiendas. | Productos | que te pueden interesar | Recomendado para ti",,,,,"{""Descripción"": [""Información de la marca""], ""Características"": [""Importante destacar"", ""Pan empacado"", ""Ideal para los desayunos y sándwiches"", ""Conservar en lugar fresco y seco"", ""Descripción del producto"", ""PAN DE LA CASA Y PAN ENVASADO"", ""¡Disfruta de los mejores insumos de"", ""en la página online de plaza ¡Mira! Ingresando la sección de"", ""Panadería, Pastelería y Comidas"", ""podrás elegir entre una variedad de deliciosos productos, todos elaborados por expertos en la cocina."", ""Ingresa a la web de"", ""plazaVea"", ""y déjate atrapar por todo nuestro sordo"", ""y"", ""Pan de la Casa"", "", ideales para esos momentos especiales en familia, celebraciones, el simplemente darte un gustito al día. Tenemos presentaciones"", ""pan a granel"", "","", ""bollería fina"", ""pan pita y árabe"", "", además de pan relleno tanto dulce como salado para brindarte una mayor diversidad de opciones."", ""¡Conoce la mejor variedad de Pan Envasado y Pan de la Casa en plazaVea Online!"", ""¿En qué búsqueda? Encuentra más"", ""Pan Envasado y Pan de la casa"", ""en plazaVea"", ""Revisa todo"", ""Componentes del Producto"", ""Vendido por"", ""En caso algo no vaya como gustes: Puedes revisar nuestras"", ""Politicas de cambios y/o devoluciones"", ""y hacerlas efectivas en todas nuestras tiendas."", ""Productos"", ""que te pueden interesar"", ""Recomendado para ti""]}",dataset/txt_limpios/1041.txt,dataset/paginas_descargadas/1041.html,ET,sin_categoria,discard,0.30,no_category_detected
