source_id,title,description,breadcrumbs,price_raw,currency_raw,url,seller,availability,country,product_name,brand,reference,unit,price_amount,price_currency,price_symbol,price_text,price_amount_filled,price_is_imputed,price_imputation_source,price_amount_usd,price_amount_usd_filled,fx_rate_local_per_usd,fx_source,information_text,description_text,features_text,specifications_text,benefits_text,details_text,other_sections,sections,txt_path,html_path,es_status,category_canonical,decision,match_score,reasons
1218,Seja Bem Vindo à Plaza Vea,"Descripción del producto Importante destacar Leche UHT Presentación en caja Contenido de 1 litro LECHES presenta lo mejor en productos de para que acompañes tus desayunos , meriendas y diversas recetas con insumos de alta calidad. Descubre las marcas más destacadas en y elige tu favorita. En la web de plazaVea Online, tendrás a tu alcance distintas presentaciones de , variedad ideal para preparar los más sabrosos jugos para el desayuno, o tan solo beberla acompañada de unas deliciosas galletas en la media tarde. Por otro lado, están las Leches Evaporadas y Mezclas Lácteas con las que se pueden cocinar distintos platillos de la cocina nacional e internacional, así como mezclar con una buena taza de agua hirviendo para el clásico café con leche de todas las mañanas. Si lo tuyo es la preparación más instantánea y de sabor único, puedes elegir entre las distintas opciones de Leche en Polvo que Leche de Soya y Otras Bebidas Vegetales es perfecta para ellas. Complementa tu compra ingresando a nuestra sección de y descubre toda la variedad de productos que plazaVea Online tiene para ti pensando en brindarte lo mejor para tu alimentación y nutrición. ¡Conoce las distintas opciones de en plazaVea Online! ¿No es lo que buscas? Encuentra más en plazaVea Presentación/Empaque | Caja | Denominación Contenido De Grasa | Semidescremada | Libre De Lactosa | No | Descripción Técnica | Leche parcialmente descremada UHT, endulzada, con DHA. | Porción Sugerida | 240ml | Formato | Líquido | Alérgenos Declarados | Gluten y soja. | Azúcares Por Porción | 16.3g | Calorías Por Porción | 158Kcal | Carbohidratos Por Porción | 16.8g | Descripción Nutricional | Leche con Zinc y 10 vitaminas. | Proteínas Por Porción | 7g | Sodio Por Porción | 125mg | Composición/Origen | Animal | Advertencias De Almacenamiento | Almacenar en un lugar fresco y seco. | Contenido Neto | 1L | Denominación/Variedad | Niños | Advertencias de consumo | Este producto NO sustituye la leche materna. Agítese antes de usar. Mantener refrigerado una vez abierto. | En caso algo no vaya como gustes: Puedes revisar nuestras | Politicas de cambios y/o devoluciones | y hacerlas efectivas en todas nuestras tiendas. | Productos | que te pueden interesar | similares | Leche UHT sin Lactosa GLORIA Zero Caja 946ml | GLORIA | .90 | .00 | un | 3 | productos agregados | Agrega indicaciones | Guardar | Leche UHT GLORIA Entera Bolsa 800ml Paquete 3un | Multiplicador-de-unidad: MAKRO-Bi-Precio|Vigente Oculto | Leche UHT GLORIA Entera Bolsa 800ml | Leche UHT VIGOR Bolsa 800ml | VIGOR | Leche Modificada UHT LA PREFERIDA Bolsa 800ml | LA PREFERIDA | Leche LAIVE UHT Light Caja 946ml Paquete 4un | LAIVE | Vea Days Supermercado marzo | Ver todo | Leche Deslactosada Light DANLAC Botella 900ml | DANLAC | Leche LAIVE UHT Entera Tetrapack 946ml | Recomendado para ti",Makro > 1L,16.92,PEN,,Desconocido,unknown,PE,Seja Bem Vindo à Plaza Vea,Makro,,1L,16.92,PEN,S/,S/16.92,16.92,False,original,4.7662,4.7662,3.55,from_peru_cambio_dolar,,"Descripción del producto Importante destacar Leche UHT Presentación en caja Contenido de 1 litro LECHES presenta lo mejor en productos de para que acompañes tus desayunos , meriendas y diversas recetas con insumos de alta calidad. Descubre las marcas más destacadas en y elige tu favorita. En la web de plazaVea Online, tendrás a tu alcance distintas presentaciones de , variedad ideal para preparar los más sabrosos jugos para el desayuno, o tan solo beberla acompañada de unas deliciosas galletas en la media tarde. Por otro lado, están las Leches Evaporadas y Mezclas Lácteas con las que se pueden cocinar distintos platillos de la cocina nacional e internacional, así como mezclar con una buena taza de agua hirviendo para el clásico café con leche de todas las mañanas. Si lo tuyo es la preparación más instantánea y de sabor único, puedes elegir entre las distintas opciones de Leche en Polvo que Leche de Soya y Otras Bebidas Vegetales es perfecta para ellas. Complementa tu compra ingresando a nuestra sección de y descubre toda la variedad de productos que plazaVea Online tiene para ti pensando en brindarte lo mejor para tu alimentación y nutrición. ¡Conoce las distintas opciones de en plazaVea Online! ¿No es lo que buscas? Encuentra más en plazaVea",,"Presentación/Empaque | Caja | Denominación Contenido De Grasa | Semidescremada | Libre De Lactosa | No | Descripción Técnica | Leche parcialmente descremada UHT, endulzada, con DHA. | Porción Sugerida | 240ml | Formato | Líquido | Alérgenos Declarados | Gluten y soja. | Azúcares Por Porción | 16.3g | Calorías Por Porción | 158Kcal | Carbohidratos Por Porción | 16.8g | Descripción Nutricional | Leche con Zinc y 10 vitaminas. | Proteínas Por Porción | 7g | Sodio Por Porción | 125mg | Composición/Origen | Animal | Advertencias De Almacenamiento | Almacenar en un lugar fresco y seco. | Contenido Neto | 1L | Denominación/Variedad | Niños | Advertencias de consumo | Este producto NO sustituye la leche materna. Agítese antes de usar. Mantener refrigerado una vez abierto. | En caso algo no vaya como gustes: Puedes revisar nuestras | Politicas de cambios y/o devoluciones | y hacerlas efectivas en todas nuestras tiendas. | Productos | que te pueden interesar | similares | Leche UHT sin Lactosa GLORIA Zero Caja 946ml | GLORIA | .90 | .00 | un | 3 | productos agregados | Agrega indicaciones | Guardar | Leche UHT GLORIA Entera Bolsa 800ml Paquete 3un | Multiplicador-de-unidad: MAKRO-Bi-Precio|Vigente Oculto | Leche UHT GLORIA Entera Bolsa 800ml | Leche UHT VIGOR Bolsa 800ml | VIGOR | Leche Modificada UHT LA PREFERIDA Bolsa 800ml | LA PREFERIDA | Leche LAIVE UHT Light Caja 946ml Paquete 4un | LAIVE | Vea Days Supermercado marzo | Ver todo | Leche Deslactosada Light DANLAC Botella 900ml | DANLAC | Leche LAIVE UHT Entera Tetrapack 946ml | Recomendado para ti",,,,"{""Descripción"": [""Descripción del producto"", ""Importante destacar"", ""Leche UHT"", ""Presentación en caja"", ""Contenido de 1 litro"", ""LECHES"", ""presenta lo mejor en productos de"", ""para que acompañes tus"", ""desayunos"", "","", ""meriendas"", ""y"", ""diversas recetas"", ""con insumos de alta calidad. Descubre las marcas más destacadas en"", ""y elige tu favorita."", ""En la web de plaza Vea Online, tendrás diferentes presentaciones de"", "", variedad ideal para preparar los más sabrosos jugos para el desayuno, el tan solo beberla acompañada de unas deliciosas galletas en la media tarde. Por otro lado, están las"", ""Leches Evaporadas y Mezclas Lácteas"", ""con las que se pueden cocinar distintos platillos de la cocina nacional e internacional, así como mezclar con una buena taza de agua hirviendo para el clásico"", ""café con leche"", ""de todas las mañanas. Si lo tuyo es la preparación más instantánea y de sabor único, puedes elegir entre las distintas opciones de"", ""Leche en Polvo"", ""que"", ""Leche de Soya y Otras Bebidas Vegetales"", ""es perfecta para ellas."", ""Complementa tu compra ingresando nuestra sección de"", ""y descubre toda la variedad de productos que plazaVea Online tiene para ti pensando en brindarte lo mejor para tu"", ""alimentación"", ""y nutrición."", ""¡Conoce las distintas opciones de"", ""en plazaVea Online!"", ""¿En qué búsqueda? Encuentra más"", ""en plazaVea""], ""Especificaciones"": [""Presentación/Empaque"", ""Caja"", ""Denominación Contenido De Grasa"", ""Semidescremada"", ""Libre De Lactosa"", ""No"", ""Descripción técnica"", ""Leche parcialmente descremada UHT, endulzada, con DHA."", ""Porción sugerida"", ""240ml"", ""Formato"", ""Líquido"", ""Alérgenos Declarados"", ""Gluten y soja."", ""Azúcar por porción"", ""16.3g"", ""Calorías Porción"", ""158Kcal"", ""Carbohidratos Porción"", ""16.8g"", ""Descripción Nutricional"", ""Leche con Zinc y 10 vitaminas."", ""Proteínas Porción"", ""7g"", ""Sodio Porción"", ""125mg"", ""Composición/Origen"", ""Animal"", ""Advertencias De Almacenamiento"", ""Almacenar en un lugar fresco y seco."", ""Contenido Neto"", ""1L"", ""Denominación/Variedad"", ""Niños"", ""Advertencias de consumo"", ""Este producto NO sustituye la leche materna. Agítese antes de usar. Mantener refrigerado una vez abierto."", ""En caso algo no vaya como gustes: Puedes revisar nuestras"", ""Politicas de cambios y/o devoluciones"", ""y hacerlas efectivas en todas nuestras tiendas."", ""Productos"", ""que te pueden interesar"", ""similares"", ""Leche UHT sin Lactosa GLORIA Zero Caja 946ml"", ""GLORIA"", "".90"", "".00"", ""un"", ""3"", ""productos agregados"", ""Agrega indicaciones"", ""Guardar"", ""Leche UHT GLORIA Entera Bolsa 800ml Paquete 3un"", ""Multiplicador-de-unidad: MAKRO-Bi-Precio|Vigente Oculto"", ""Leche UHT GLORIA Entera Bolsa 800ml"", ""Leche UHT VIGOR Bolsa 800ml"", ""VIGOR"", ""Leche Modificada UHT LA PREFERIDA Bolsa 800ml"", ""LA PREFERIDA"", ""Leche LAIVE UHT Light Caja 946ml Paquete 4un"", ""LAIVE"", ""Vea Days Supermercado marzo | Ver todo"", ""Leche Deslactosada Light DANLAC Botella 900ml"", ""DANLAC"", ""Leche LAIVE UHT Entera Tetrapack 946ml"", ""Recomendado para ti""]}",dataset/txt_limpios/1218.txt,dataset/paginas_descargadas/1218.html,ET,leche,keep,0.60,heuristic_default
1219,Seja Bem Vindo à Plaza Vea,Información de la marca,Lácteos y Huevos > 800ml,4.0,PEN,,Desconocido,unknown,PE,Seja Bem Vindo à Plaza Vea,Lácteos y Huevos,,800ml,4.00,PEN,S/,S/4,4.0,False,original,1.1268,1.1268,3.55,from_peru_cambio_dolar,,Información de la marca,"Presentación/Empaque | Bolsa | Denominación Dietética | Denominación Contenido De Grasa | Semidescremada | Libre De Lactosa | SÍ | Descripción Técnica | Leche parcialmente descremada y deslactosada UHT | Porción Sugerida | 200 | Sabor | Característico | Formato | Líquido | Alérgenos Declarados | Azúcares Por Porción | 9.8 | Calorías Por Porción | 105.0 | Carbohidratos Por Porción | Descripción Nutricional | Leche deslactosada | Proteínas Por Porción | 6.5 | Sodio Por Porción | 92.5 | Libre De Aditivos | SI | Advertencias De Almacenamiento | No necesita refrigeración, conservar en un lugar fresco y seco. | Contenido Neto | 800 | Denominación/Variedad | Advertencias de consumo | No necesita hervis, listo para su consumo. | Revisa todo | Componentes del Producto | Vendido por | plazaVea | En caso algo no vaya como gustes: Puedes revisar nuestras | Politicas de cambios y/o devoluciones | y hacerlas efectivas en todas nuestras tiendas. | Productos | que te pueden interesar | similares | Leche sin Lactosa LAIVE UHT Caja 946ml Paquete 4un | .00 | un | 3 | productos agregados | Agrega indicaciones | Guardar | Leche Descremada GLORIA Slim UHT Triple Zero Caja 946ml | Leche sin Lactosa LAIVE UHT Light Caja 946ml Paquete 4un | Leche UHT VIGOR Bolsa 800ml | Leche UHT LAIVE Entera Light Bolsa 900ml | Leche Entera ARO UHT Caja 1L | ARO | Bebida Coco sin Endulzar LAIVE Vio Caja 946ml Paquete 2un | Recomendado para ti",,,,,"{""Descripción"": [""Información de la marca""], ""Características"": [""Presentación/Empaque"", ""Bolsa"", ""Denominación Dietética"", ""Denominación Contenido De Grasa"", ""Semidescremada"", ""Libre De Lactosa"", ""SÍ"", ""Descripción técnica"", ""Leche parcialmente descremada y deslactosada UHT"", ""Porción sugerida"", ""200"", ""Sabor"", ""Característico"", ""Formato"", ""Líquido"", ""Alérgenos Declarados"", ""Azúcar por porción"", ""9.8"", ""Calorías Porción"", ""105.0"", ""Carbohidratos Porción"", ""Descripción Nutricional"", ""Leche deslactosada"", ""Proteínas Porción"", ""6.5"", ""Sodio Porción"", ""92.5"", ""Libre De Aditivos"", ""SI"", ""Advertencias De Almacenamiento"", ""No necesita refrigeración, conservar en un lugar fresco y seco."", ""Contenido Neto"", ""800"", ""Denominación/Variedad"", ""Advertencias de consumo"", ""No necesita hervis, listo para su consumo."", ""Revisa todo"", ""Componentes del Producto"", ""Vendido por"", ""plazaVea"", ""En caso algo no vaya como gustes: Puedes revisar nuestras"", ""Politicas de cambios y/o devoluciones"", ""y hacerlas efectivas en todas nuestras tiendas."", ""Productos"", ""que te pueden interesar"", ""similares"", ""Leche sin Lactosa LAIVE UHT Caja 946ml Paquete 4un"", "".00"", ""un"", ""3"", ""productos agregados"", ""Agrega indicaciones"", ""Guardar"", ""Leche Descremada GLORIA Slim UHT Triple Zero Caja 946ml"", ""Leche sin Lactosa LAIVE UHT Light Caja 946ml Paquete 4un"", ""Leche UHT VIGOR Bolsa 800ml"", ""Leche UHT LAIVE Entera Light Bolsa 900ml"", ""Leche Entera ARO UHT Caja 1L"", ""ARO"", ""Bebida Coco sin Endulzar LAIVE Vio Caja 946ml Paquete 2un"", ""Recomendado para ti""]}",dataset/txt_limpios/1219.txt,dataset/paginas_descargadas/1219.html,ET,huevo,discard,0.30,heuristic_default
1221,Seja Bem Vindo à Plaza Vea,Información de la marca,Lácteos y Huevos > 900ml,4.0,PEN,,Desconocido,unknown,PE,Seja Bem Vindo à Plaza Vea,Lácteos y Huevos,,900ml,4.00,PEN,S/,S/4,4.0,False,original,1.1268,1.1268,3.55,from_peru_cambio_dolar,,Información de la marca,"Presentación/Empaque | Bolsa | Denominación Dietética | Light | Denominación Contenido De Grasa | Semidescremada | Libre De Lactosa | No | Descripción Técnica | Leche semidescremada UHT. | Porción Sugerida | 200ml | Formato | Líquido | Calorías Por Porción | 90Kcal | Carbohidratos Por Porción | 10g | Descripción Nutricional | Aporta proteínas, vitaminas, fósforo, magneSIo y calcio. | Proteínas Por Porción | 6g | Sodio Por Porción | 97mg | Composición/Origen | Animal | Libre De Aditivos | Advertencias De Almacenamiento | Mantener refrigerado. | Contenido Neto | 900ml | Denominación/Variedad | Advertencias de consumo | Este producto NO sustituye la leche materna. | Revisa todo | Importante destacar | Leche Fresca | Presentación en bolsa | Contenido de 900ml | Descripción del producto | LECHES | plazaVea | presenta lo mejor en productos de | para que acompañes tus | desayunos | , | meriendas | y | diversas recetas | con insumos de alta calidad. Descubre las marcas más destacadas en | y elige tu favorita. | En la web de plazaVea Online, tendrás a tu alcance distintas presentaciones de | , variedad ideal para preparar los más sabrosos jugos para el desayuno, o tan solo beberla acompañada de unas deliciosas galletas en la media tarde. Por otro lado, están las | Leches Evaporadas y Mezclas Lácteas | con las que se pueden cocinar distintos platillos de la cocina nacional e internacional, así como mezclar con una buena taza de agua hirviendo para el clásico | café con leche | de todas las mañanas. Si lo tuyo es la preparación más instantánea y de sabor único, puedes elegir entre las distintas opciones de | Leche en Polvo | que | Leche de Soya y Otras Bebidas Vegetales | es perfecta para ellas. | Complementa tu compra ingresando a nuestra sección de | y descubre toda la variedad de productos que plazaVea Online tiene para ti pensando en brindarte lo mejor para tu | alimentación | y nutrición. | ¡Conoce las distintas opciones de | en plazaVea Online! | ¿No es lo que buscas? Encuentra más | en plazaVea | Componentes del Producto | Vendido por | En caso algo no vaya como gustes: Puedes revisar nuestras | Politicas de cambios y/o devoluciones | y hacerlas efectivas en todas nuestras tiendas. | Productos | que te pueden interesar | similares | Leche GLORIA UHT Zero Lactosa Bolsa 800ml Paquete 3un | .00 | un | 3 | productos agregados | Agrega indicaciones | Guardar | Bebida Almendra sin Endulzar LAIVE Vio Caja 946ml Paquete 4un | Leche GLORIA UHT Fresca niños 1 a 5 años Caja 1L | Multiplicador-de-unidad: MAKRO-Bi-Precio|Vigente Oculto | Recicla Consciente | Vea Days Supermercado marzo | Ver todo | Leche Fresca DANLAC Botella 900ml | DANLAC | Leche UHT GLORIA Niños Sabor a Chocolate Caja 180ml Paquete 6un | Multiplicador-de-unidad: Express | Leche Sabor a Vainilla GLORIA UHT Niños Caja 180ml Paquete 6un | Leche Semidescremada VIGOR UHT Bolsa 800ml Paquete 3un | VIGOR | Leche Entera ARO UHT Caja 1L | ARO | Recomendado para ti",,,,,"{""Descripción"": [""Información de la marca""], ""Características"": [""Presentación/Empaque"", ""Bolsa"", ""Denominación Dietética"", ""Light"", ""Denominación Contenido De Grasa"", ""Semidescremada"", ""Libre De Lactosa"", ""No"", ""Descripción técnica"", ""Leche semidescremada UHT."", ""Porción sugerida"", ""200ml"", ""Formato"", ""Líquido"", ""Calorías Porción"", ""90Kcal"", ""Carbohidratos Porción"", ""10g"", ""Descripción Nutricional"", ""Aporta proteínas, vitaminas, fósforo, magneSIo y calcio."", ""Proteínas Porción"", ""6g"", ""Sodio Porción"", ""97mg"", ""Composición/Origen"", ""Animal"", ""Libre De Aditivos"", ""Advertencias De Almacenamiento"", ""Mantener refrigerado."", ""Contenido Neto"", ""900ml"", ""Denominación/Variedad"", ""Advertencias de consumo"", ""Este producto NO sustituye la leche materna."", ""Revisa todo"", ""Importante destacar"", ""Leche Fresca"", ""Presentación en bolsa"", ""Contenido de 900ml"", ""Descripción del producto"", ""LECHES"", ""plazaVea"", ""presenta lo mejor en productos de"", ""para que acompañes tus"", ""desayunos"", "","", ""meriendas"", ""y"", ""diversas recetas"", ""con insumos de alta calidad. Descubre las marcas más destacadas en"", ""y elige tu favorita."", ""En la web de plaza Vea Online, tendrás diferentes presentaciones de"", "", variedad ideal para preparar los más sabrosos jugos para el desayuno, el tan solo beberla acompañada de unas deliciosas galletas en la media tarde. Por otro lado, están las"", ""Leches Evaporadas y Mezclas Lácteas"", ""con las que se pueden cocinar distintos platillos de la cocina nacional e internacional, así como mezclar con una buena taza de agua hirviendo para el clásico"", ""café con leche"", ""de todas las mañanas. Si lo tuyo es la preparación más instantánea y de sabor único, puedes elegir entre las distintas opciones de"", ""Leche en Polvo"", ""que"", ""Leche de Soya y Otras Bebidas Vegetales"", ""es perfecta para ellas."", ""Complementa tu compra ingresando nuestra sección de"", ""y descubre toda la variedad de productos que plazaVea Online tiene para ti pensando en brindarte lo mejor para tu"", ""alimentación"", ""y nutrición."", ""¡Conoce las distintas opciones de"", ""en plazaVea Online!"", ""¿En qué búsqueda? Encuentra más"", ""en plazaVea"", ""Componentes del Producto"", ""Vendido por"", ""En caso algo no vaya como gustes: Puedes revisar nuestras"", ""Politicas de cambios y/o devoluciones"", ""y hacerlas efectivas en todas nuestras tiendas."", ""Productos"", ""que te pueden interesar"", ""similares"", ""Leche GLORIA UHT Zero Lactosa Bolsa 800ml Paquete 3un"", "".00"", ""un"", ""3"", ""productos agregados"", ""Agrega indicaciones"", ""Guardar"", ""Bebida Almendra sin Endulzar LAIVE Vio Caja 946ml Paquete 4un"", ""Leche GLORIA UHT Fresca niños 1 a 5 años Caja 1L"", ""Multiplicador-de-unidad: MAKRO-Bi-Precio|Vigente Oculto"", ""Recicla Consciente"", ""Vea Days Supermercado marzo | Ver todo"", ""Leche Fresca DANLAC Botella 900ml"", ""DANLAC"", ""Leche UHT GLORIA Niños Sabor a Chocolate Caja 180ml Paquete 6un"", ""Multiplicador-de-unidad: Express"", ""Leche Sabor a Vainilla GLORIA UHT Niños Caja 180ml Paquete 6un"", ""Leche Semidescremada VIGOR UHT Bolsa 800ml Paquete 3un"", ""VIGOR"", ""Leche Entera ARO UHT Caja 1L"", ""ARO"", ""Recomendado para ti""]}",dataset/txt_limpios/1221.txt,dataset/paginas_descargadas/1221.html,ET,huevo,discard,0.30,heuristic_default
