source_id,title,description,breadcrumbs,price_raw,currency_raw,url,seller,availability,country,product_name,brand,reference,unit,price_amount,price_currency,price_symbol,price_text,price_amount_filled,price_is_imputed,price_imputation_source,price_amount_usd,price_amount_usd_filled,fx_rate_local_per_usd,fx_source,information_text,description_text,features_text,specifications_text,benefits_text,details_text,other_sections,sections,txt_path,html_path,es_status,category_canonical,decision,match_score,reasons
845,Saltar menú Cenco,Ingredientes Condición alimentaria Información nutricional Tipo de Producto Spaghettis Cantidad 1 un. Formato Envasado Envase Paquete País de Origen Chile Variedad N°5 Contenido 400 g Garantía Mínima Legal Válida hasta su fecha de caducidad Te podrían interesar Cuisine & Co Pomarola Salsa de Tomate Pomarola 200 g 6 un. Salsa de Tomate Carozzi Toscana Bolognesa 200 g Centro de preferencia de privacidad Gestionar las preferencias de consentimiento Activas siempre Back Button Search Icon Filter Icon Clear checkbox label label Apply Cancel Consent Leg.Interest Permitir todas Rechazar todas Confirmar mis preferencias,Lucchetti > 400 g,1.04,,,Desconocido,unknown,UNKNOWN,Saltar menú Cenco,Lucchetti,,400 g,1.04,,$,$1.04,1.04,False,original,1.04,1.04,1.0,default_1usd,,Ingredientes Condición alimentaria Información nutricional Tipo de Producto Spaghettis Cantidad 1 un. Formato Envasado Envase Paquete País de Origen Chile Variedad N°5 Contenido 400 g Garantía Mínima Legal Válida hasta su fecha de caducidad Te podrían interesar Cuisine & Co Pomarola Salsa de Tomate Pomarola 200 g 6 un. Salsa de Tomate Carozzi Toscana Bolognesa 200 g Centro de preferencia de privacidad Gestionar las preferencias de consentimiento Activas siempre Back Button Search Icon Filter Icon Clear checkbox label label Apply Cancel Consent Leg.Interest Permitir todas Rechazar todas Confirmar mis preferencias,,,,,,"{""Descripción"": [""Ingredientes"", ""Condición alimentaria"", ""Información nutricional"", ""Tipo de Producto"", ""Spaghettis"", ""Cantidad"", ""1 un."", ""Formato"", ""Envasado"", ""Envase"", ""Paquete"", ""País de origen"", ""Chile"", ""Variedad"", ""N°5"", ""Contenido"", ""400 g"", ""Garantía Mínima Legal"", ""Válida hasta su fecha de caducidad"", ""Te podrían interesar"", ""Cuisine & Co"", ""Pomarola"", ""Salsa de Tomate Pomarola 200 g 6 un."", ""Salsa de Tomate Carozzi Toscana Bolognesa 200 g"", ""Centro de preferencia de privacidad"", ""Gestionar las preferencias de consentimiento"", ""Activas siempre"", ""Back Button"", ""Search Icon"", ""Filter Icon"", ""Clear"", ""checkbox label"", ""label"", ""Apply"", ""Cancel"", ""Consent"", ""Leg.Interest"", ""Permitir todas"", ""Rechazar todas"", ""Confirmar mis preferencias""]}",dataset/txt_limpios/845.txt,dataset/paginas_descargadas/845.html,ET,descartado,discard,0.10,excluded_keyword
846,Saltar menú Cenco,,Frutas y verduras,,,,Desconocido,unknown,UNKNOWN,Saltar menú Cenco,Frutas y verduras,,,,,,,234.19,True,country_mean,,234.1938,1.0,default_1usd,,,,,,,,{},dataset/txt_limpios/846.txt,dataset/paginas_descargadas/846.html,EN,sin_categoria,discard,0.30,no_category_detected;price_parse_failed
847,Saltar menú Cenco,Ingredientes Condición alimentaria Información nutricional Tipo de Producto Spaghettis Envase Paquete País de Origen Chile Te podrían interesar Exclusivo online Pomarola Salsa de Tomate Pomarola 200 g 6 un. Oferta Colun 4.5 Frutas y Verduras Propias Albahaca 30 g 4.3 Centro de preferencia de privacidad Gestionar las preferencias de consentimiento Activas siempre Back Button Search Icon Filter Icon Clear checkbox label label Apply Cancel Consent Leg.Interest Permitir todas Rechazar todas Confirmar mis preferencias,Trattoria > 400 g,1.25,,,Desconocido,unknown,UNKNOWN,Saltar menú Cenco,Trattoria,,400 g,1.25,,$,$1.25,1.25,False,original,1.25,1.25,1.0,default_1usd,,Ingredientes Condición alimentaria Información nutricional Tipo de Producto Spaghettis Envase Paquete País de Origen Chile Te podrían interesar Exclusivo online Pomarola Salsa de Tomate Pomarola 200 g 6 un. Oferta Colun 4.5 Frutas y Verduras Propias Albahaca 30 g 4.3 Centro de preferencia de privacidad Gestionar las preferencias de consentimiento Activas siempre Back Button Search Icon Filter Icon Clear checkbox label label Apply Cancel Consent Leg.Interest Permitir todas Rechazar todas Confirmar mis preferencias,,,,,,"{""Descripción"": [""Ingredientes"", ""Condición alimentaria"", ""Información nutricional"", ""Tipo de Producto"", ""Spaghettis"", ""Envase"", ""Paquete"", ""País de origen"", ""Chile"", ""Te podrían interesar"", ""Exclusivo online"", ""Pomarola"", ""Salsa de Tomate Pomarola 200 g 6 un."", ""Oferta"", ""Colun"", ""4.5"", ""Frutas y Verduras Propias"", ""Albahaca 30 g"", ""4.3"", ""Centro de preferencia de privacidad"", ""Gestionar las preferencias de consentimiento"", ""Activas siempre"", ""Back Button"", ""Search Icon"", ""Filter Icon"", ""Clear"", ""checkbox label"", ""label"", ""Apply"", ""Cancel"", ""Consent"", ""Leg.Interest"", ""Permitir todas"", ""Rechazar todas"", ""Confirmar mis preferencias""]}",dataset/txt_limpios/847.txt,dataset/paginas_descargadas/847.html,ET,sin_categoria,discard,0.30,no_category_detected
848,Saltar menú Cenco,Ingredientes Condición alimentaria Información nutricional Tipo de Producto Spaghettis Envase Paquete País de Origen Argentina Garantía Mínima Legal Válida hasta su fecha de caducidad Te podrían interesar Exclusivo online Pomarola Salsa de Tomate Pomarola 200 g 6 un. 5.0 Oferta Colun 4.5 Frutas y Verduras Propias Albahaca 30 g 4.3 Centro de preferencia de privacidad Gestionar las preferencias de consentimiento Activas siempre Back Button Search Icon Filter Icon Clear checkbox label label Apply Cancel Consent Leg.Interest Permitir todas Rechazar todas Confirmar mis preferencias,Cuisine & Co > 400 g,1.04,,,Desconocido,unknown,UNKNOWN,Saltar menú Cenco,Cuisine & Co,,400 g,1.04,,$,$1.04,1.04,False,original,1.04,1.04,1.0,default_1usd,,Ingredientes Condición alimentaria Información nutricional Tipo de Producto Spaghettis Envase Paquete País de Origen Argentina Garantía Mínima Legal Válida hasta su fecha de caducidad Te podrían interesar Exclusivo online Pomarola Salsa de Tomate Pomarola 200 g 6 un. 5.0 Oferta Colun 4.5 Frutas y Verduras Propias Albahaca 30 g 4.3 Centro de preferencia de privacidad Gestionar las preferencias de consentimiento Activas siempre Back Button Search Icon Filter Icon Clear checkbox label label Apply Cancel Consent Leg.Interest Permitir todas Rechazar todas Confirmar mis preferencias,,,,,,"{""Descripción"": [""Ingredientes"", ""Condición alimentaria"", ""Información nutricional"", ""Tipo de Producto"", ""Spaghettis"", ""Envase"", ""Paquete"", ""País de origen"", ""Argentina"", ""Garantía Mínima Legal"", ""Válida hasta su fecha de caducidad"", ""Te podrían interesar"", ""Exclusivo online"", ""Pomarola"", ""Salsa de Tomate Pomarola 200 g 6 un."", ""5.0"", ""Oferta"", ""Colun"", ""4.5"", ""Frutas y Verduras Propias"", ""Albahaca 30 g"", ""4.3"", ""Centro de preferencia de privacidad"", ""Gestionar las preferencias de consentimiento"", ""Activas siempre"", ""Back Button"", ""Search Icon"", ""Filter Icon"", ""Clear"", ""checkbox label"", ""label"", ""Apply"", ""Cancel"", ""Consent"", ""Leg.Interest"", ""Permitir todas"", ""Rechazar todas"", ""Confirmar mis preferencias""]}",dataset/txt_limpios/848.txt,dataset/paginas_descargadas/848.html,ET,descartado,discard,0.10,excluded_keyword
116,Se interrumpió la conexión,,ERR_NETWORK_CHANGED,,,,Desconocido,unknown,UNKNOWN,Se interrumpió la conexión,ERR_NETWORK_CHANGED,,,,,,,234.19,True,country_mean,,234.1938,1.0,default_1usd,,,,,,,,{},dataset/txt_limpios/116.txt,dataset/paginas_descargadas/116.html,EN,sin_categoria,discard,0.30,no_category_detected;price_parse_failed
1360,Se interrumpió la conexión,,ERR_NETWORK_CHANGED,,,,Desconocido,unknown,UNKNOWN,Se interrumpió la conexión,ERR_NETWORK_CHANGED,,,,,,,234.19,True,country_mean,,234.1938,1.0,default_1usd,,,,,,,,{},dataset/txt_limpios/1360.txt,dataset/paginas_descargadas/1360.html,EN,sin_categoria,discard,0.30,no_category_detected;price_parse_failed
137,Se interrumpió la conexión,,ERR_NETWORK_CHANGED,,,,Desconocido,unknown,UNKNOWN,Se interrumpió la conexión,ERR_NETWORK_CHANGED,,,,,,,234.19,True,country_mean,,234.1938,1.0,default_1usd,,,,,,,,{},dataset/txt_limpios/137.txt,dataset/paginas_descargadas/137.html,EN,sin_categoria,discard,0.30,no_category_detected;price_parse_failed
147,Se interrumpió la conexión,,ERR_NETWORK_CHANGED,,,,Desconocido,unknown,UNKNOWN,Se interrumpió la conexión,ERR_NETWORK_CHANGED,,,,,,,234.19,True,country_mean,,234.1938,1.0,default_1usd,,,,,,,,{},dataset/txt_limpios/147.txt,dataset/paginas_descargadas/147.html,EN,sin_categoria,discard,0.30,no_category_detected;price_parse_failed
412,Se interrumpió la conexión,,ERR_NETWORK_CHANGED,,,,Desconocido,unknown,UNKNOWN,Se interrumpió la conexión,ERR_NETWORK_CHANGED,,,,,,,234.19,True,country_mean,,234.1938,1.0,default_1usd,,,,,,,,{},dataset/txt_limpios/412.txt,dataset/paginas_descargadas/412.html,EN,sin_categoria,discard,0.30,no_category_detected;price_parse_failed
617,Se interrumpió la conexión,,ERR_NETWORK_CHANGED,,,,Desconocido,unknown,UNKNOWN,Se interrumpió la conexión,ERR_NETWORK_CHANGED,,,,,,,234.19,True,country_mean,,234.1938,1.0,default_1usd,,,,,,,,{},dataset/txt_limpios/617.txt,dataset/paginas_descargadas/617.html,EN,sin_categoria,discard,0.30,no_category_detected;price_parse_failed
620,Se interrumpió la conexión,,ERR_NETWORK_CHANGED,,,,Desconocido,unknown,UNKNOWN,Se interrumpió la conexión,ERR_NETWORK_CHANGED,,,,,,,234.19,True,country_mean,,234.1938,1.0,default_1usd,,,,,,,,{},dataset/txt_limpios/620.txt,dataset/paginas_descargadas/620.html,EN,sin_categoria,discard,0.30,no_category_detected;price_parse_failed
647,Se interrumpió la conexión,,ERR_NETWORK_CHANGED,,,,Desconocido,unknown,UNKNOWN,Se interrumpió la conexión,ERR_NETWORK_CHANGED,,,,,,,234.19,True,country_mean,,234.1938,1.0,default_1usd,,,,,,,,{},dataset/txt_limpios/647.txt,dataset/paginas_descargadas/647.html,EN,sin_categoria,discard,0.30,no_category_detected;price_parse_failed
715,Se interrumpió la conexión,,ERR_NETWORK_CHANGED,,,,Desconocido,unknown,UNKNOWN,Se interrumpió la conexión,ERR_NETWORK_CHANGED,,,,,,,234.19,True,country_mean,,234.1938,1.0,default_1usd,,,,,,,,{},dataset/txt_limpios/715.txt,dataset/paginas_descargadas/715.html,EN,sin_categoria,discard,0.30,no_category_detected;price_parse_failed
718,Se interrumpió la conexión,,ERR_NETWORK_CHANGED,,,,Desconocido,unknown,UNKNOWN,Se interrumpió la conexión,ERR_NETWORK_CHANGED,,,,,,,234.19,True,country_mean,,234.1938,1.0,default_1usd,,,,,,,,{},dataset/txt_limpios/718.txt,dataset/paginas_descargadas/718.html,EN,sin_categoria,discard,0.30,no_category_detected;price_parse_failed
722,Se interrumpió la conexión,,ERR_NETWORK_CHANGED,,,,Desconocido,unknown,UNKNOWN,Se interrumpió la conexión,ERR_NETWORK_CHANGED,,,,,,,234.19,True,country_mean,,234.1938,1.0,default_1usd,,,,,,,,{},dataset/txt_limpios/722.txt,dataset/paginas_descargadas/722.html,EN,sin_categoria,discard,0.30,no_category_detected;price_parse_failed
740,Se interrumpió la conexión,,ERR_NETWORK_CHANGED,,,,Desconocido,unknown,UNKNOWN,Se interrumpió la conexión,ERR_NETWORK_CHANGED,,,,,,,234.19,True,country_mean,,234.1938,1.0,default_1usd,,,,,,,,{},dataset/txt_limpios/740.txt,dataset/paginas_descargadas/740.html,EN,sin_categoria,discard,0.30,no_category_detected;price_parse_failed
752,Se interrumpió la conexión,,ERR_NETWORK_CHANGED,,,,Desconocido,unknown,UNKNOWN,Se interrumpió la conexión,ERR_NETWORK_CHANGED,,,,,,,234.19,True,country_mean,,234.1938,1.0,default_1usd,,,,,,,,{},dataset/txt_limpios/752.txt,dataset/paginas_descargadas/752.html,EN,sin_categoria,discard,0.30,no_category_detected;price_parse_failed
757,Se interrumpió la conexión,,ERR_NETWORK_CHANGED,,,,Desconocido,unknown,UNKNOWN,Se interrumpió la conexión,ERR_NETWORK_CHANGED,,,,,,,234.19,True,country_mean,,234.1938,1.0,default_1usd,,,,,,,,{},dataset/txt_limpios/757.txt,dataset/paginas_descargadas/757.html,EN,sin_categoria,discard,0.30,no_category_detected;price_parse_failed
786,Se interrumpió la conexión,,ERR_NETWORK_CHANGED,,,,Desconocido,unknown,UNKNOWN,Se interrumpió la conexión,ERR_NETWORK_CHANGED,,,,,,,234.19,True,country_mean,,234.1938,1.0,default_1usd,,,,,,,,{},dataset/txt_limpios/786.txt,dataset/paginas_descargadas/786.html,EN,sin_categoria,discard,0.30,no_category_detected;price_parse_failed
841,Se interrumpió la conexión,,ERR_NETWORK_CHANGED,,,,Desconocido,unknown,UNKNOWN,Se interrumpió la conexión,ERR_NETWORK_CHANGED,,,,,,,234.19,True,country_mean,,234.1938,1.0,default_1usd,,,,,,,,{},dataset/txt_limpios/841.txt,dataset/paginas_descargadas/841.html,EN,sin_categoria,discard,0.30,no_category_detected;price_parse_failed
888,Se interrumpió la conexión,,ERR_NETWORK_CHANGED,,,,Desconocido,unknown,UNKNOWN,Se interrumpió la conexión,ERR_NETWORK_CHANGED,,,,,,,234.19,True,country_mean,,234.1938,1.0,default_1usd,,,,,,,,{},dataset/txt_limpios/888.txt,dataset/paginas_descargadas/888.html,EN,sin_categoria,discard,0.30,no_category_detected;price_parse_failed
916,Se interrumpió la conexión,,ERR_NETWORK_CHANGED,,,,Desconocido,unknown,UNKNOWN,Se interrumpió la conexión,ERR_NETWORK_CHANGED,,,,,,,234.19,True,country_mean,,234.1938,1.0,default_1usd,,,,,,,,{},dataset/txt_limpios/916.txt,dataset/paginas_descargadas/916.html,EN,sin_categoria,discard,0.30,no_category_detected;price_parse_failed
955,Se interrumpió la conexión,,ERR_NETWORK_CHANGED,,,,Desconocido,unknown,UNKNOWN,Se interrumpió la conexión,ERR_NETWORK_CHANGED,,,,,,,234.19,True,country_mean,,234.1938,1.0,default_1usd,,,,,,,,{},dataset/txt_limpios/955.txt,dataset/paginas_descargadas/955.html,EN,sin_categoria,discard,0.30,no_category_detected;price_parse_failed
1011,Seja Bem Vindo à Plaza Vea,,que podemos ofrecer.,,,,Desconocido,unknown,UNKNOWN,Seja Bem Vindo à Plaza Vea,que podemos ofrecer.,,,,,,,234.19,True,country_mean,,234.1938,1.0,default_1usd,,,,,,,,{},dataset/txt_limpios/1011.txt,dataset/paginas_descargadas/1011.html,EN,sin_categoria,discard,0.30,no_category_detected;price_parse_failed
1024,Seja Bem Vindo à Plaza Vea,,que podemos ofrecer.,,,,Desconocido,unknown,UNKNOWN,Seja Bem Vindo à Plaza Vea,que podemos ofrecer.,,,,,,,234.19,True,country_mean,,234.1938,1.0,default_1usd,,,,,,,,{},dataset/txt_limpios/1024.txt,dataset/paginas_descargadas/1024.html,EN,sin_categoria,discard,0.30,no_category_detected;price_parse_failed
1027,Seja Bem Vindo à Plaza Vea,,que podemos ofrecer.,,,,Desconocido,unknown,UNKNOWN,Seja Bem Vindo à Plaza Vea,que podemos ofrecer.,,,,,,,234.19,True,country_mean,,234.1938,1.0,default_1usd,,,,,,,,{},dataset/txt_limpios/1027.txt,dataset/paginas_descargadas/1027.html,EN,sin_categoria,discard,0.30,no_category_detected;price_parse_failed
1036,Seja Bem Vindo à Plaza Vea,,que podemos ofrecer.,,,,Desconocido,unknown,UNKNOWN,Seja Bem Vindo à Plaza Vea,que podemos ofrecer.,,,,,,,234.19,True,country_mean,,234.1938,1.0,default_1usd,,,,,,,,{},dataset/txt_limpios/1036.txt,dataset/paginas_descargadas/1036.html,EN,sin_categoria,discard,0.30,no_category_detected;price_parse_failed
1199,Seja Bem Vindo à Plaza Vea,Información de la marca,Abarrotes > 10Kg,43.0,PEN,,Desconocido,unknown,PE,Seja Bem Vindo à Plaza Vea,Abarrotes,,10Kg,43.00,PEN,S/,S/43,43.0,False,original,12.1127,12.1127,3.55,from_peru_cambio_dolar,,Información de la marca,Advertencias De Almacenamiento | Almacenar en un ambiente fresco y seco | Denominación/Variedad | Arroz cocina receta | Revisa todo | Componentes del Producto | Vendido por | plazaVea | En caso algo no vaya como gustes: Puedes revisar nuestras | Politicas de cambios y/o devoluciones | y hacerlas efectivas en todas nuestras tiendas. | Productos | que te pueden interesar | similares | Multiplicador-de-unidad: MAKRO-Bi-Precio|Vigente Oculto | Arroz Superior COSTEÑO Bolsa 5Kg | .00 | un | 3 | productos agregados | Agrega indicaciones | Guardar | MAKRO-Bi-Precio|Vigente Oculto | Arroz Familiar M&K Bolsa 750g | M&K | Arroz Añejo Amarillo FARAÓN G3 Bolsa 1Kg | Arroz Superior Aro Nir X5Kg | Arroz Superior Añejo ARO Bolsa 10kg | Arroz Superior GRAN CHALAN Gran Añejo Bolsa 5Kg | Arroz Despuntado ARO Nir Bolsa x10Kg | Arroz Superior CUSI CUSA Saco 10Kg | CUSI CUSA | Recomendado para ti,,,,,"{""Descripción"": [""Información de la marca""], ""Características"": [""Advertencias De Almacenamiento"", ""Almacenar en un ambiente fresco y seco"", ""Denominación/Variedad"", ""Arroz cocina receta"", ""Revisa todo"", ""Componentes del Producto"", ""Vendido por"", ""plazaVea"", ""En caso algo no vaya como gustes: Puedes revisar nuestras"", ""Politicas de cambios y/o devoluciones"", ""y hacerlas efectivas en todas nuestras tiendas."", ""Productos"", ""que te pueden interesar"", ""similares"", ""Multiplicador-de-unidad: MAKRO-Bi-Precio|Vigente Oculto"", ""Arroz Superior COSTEÑO Bolsa 5Kg"", "".00"", ""un"", ""3"", ""productos agregados"", ""Agrega indicaciones"", ""Guardar"", ""MAKRO-Bi-Precio|Vigente Oculto"", ""Arroz Familiar M&K Bolsa 750g"", ""M&K"", ""Arroz Añejo Amarillo FARAÓN G3 Bolsa 1Kg"", ""Arroz Superior Aro Nir X5Kg"", ""Arroz Superior Añejo ARO Bolsa 10kg"", ""Arroz Superior GRAN CHALAN Gran Añejo Bolsa 5Kg"", ""Arroz Despuntado ARO Nir Bolsa x10Kg"", ""Arroz Superior CUSI CUSA Saco 10Kg"", ""CUSI CUSA"", ""Recomendado para ti""]}",dataset/txt_limpios/1199.txt,dataset/paginas_descargadas/1199.html,EN,sin_categoria,discard,0.30,no_category_detected
1200,Seja Bem Vindo à Plaza Vea,Información de la marca,Abarrotes > 5Kg,27.0,PEN,,Desconocido,unknown,PE,Seja Bem Vindo à Plaza Vea,Abarrotes,,5Kg,27.00,PEN,S/,S/27,27.0,False,original,7.6056,7.6056,3.55,from_peru_cambio_dolar,,Información de la marca,Presentación/Empaque | Bolsa | Producto Preparado | No | Arroz Pregraneado | Porción Sugerida | 1 | Alérgenos Declarados | Ninguno | Azúcares Por Porción | 0 | Calorías Por Porción | 638 | Carbohidratos Por Porción | 143.3 | Grasas Por Porción | Proteínas Por Porción | 15.3 | Sodio Por Porción | 14.2 | Peso Neto (g) | 5kg | Advertencias De Almacenamiento | Temperatura ambiente | Denominación/Variedad | Arroz Campero Reserva Extra Añejo 5kg | Uso | Consumo previa cocción | Advertencias de consumo | Previa cocción | Revisa todo | Componentes del Producto | Vendido por | plazaVea | En caso algo no vaya como gustes: Puedes revisar nuestras | Politicas de cambios y/o devoluciones | y hacerlas efectivas en todas nuestras tiendas. | Productos | que te pueden interesar | similares | Multiplicador-de-unidad: MAKRO-Bi-Precio|Vigente Oculto | Vea Days Supermercado marzo | Ver todo | .00 | un | 3 | productos agregados | Agrega indicaciones | Guardar | Multiplicador-de-unidad: Express | Arroz Extra COSTEÑITO Importado Saco 50kg | COSTEÑITO | Arroz Extra Añejo ARO Bolsa 10kg | Arroz Extra PACASMAYO Saco 49Kg | PACASMAYO | Arroz Extra VALLENORTE Gran Reserva Bolsa 750g | Arroz Extra CAMPERO Granel Saco 25Kg | Arroz Extra PAISANA Bolsa 1Kg | Recomendado para ti,,,,,"{""Descripción"": [""Información de la marca""], ""Características"": [""Presentación/Empaque"", ""Bolsa"", ""Producto Preparado"", ""No"", ""Arroz Pregraneado"", ""Porción sugerida"", ""1"", ""Alérgenos Declarados"", ""Ninguno"", ""Azúcar por porción"", ""0"", ""Calorías Porción"", ""638"", ""Carbohidratos Porción"", ""143.3"", ""Grasas Porción"", ""Proteínas Porción"", ""15.3"", ""Sodio Porción"", ""14.2"", ""Peso Neto (g)"", ""5kg"", ""Advertencias De Almacenamiento"", ""Temperatura ambiente"", ""Denominación/Variedad"", ""Arroz Campero Reserva Extra Añejo 5kg"", ""Uso"", ""Consumo previa cocción"", ""Advertencias de consumo"", ""Previa cocción"", ""Revisa todo"", ""Componentes del Producto"", ""Vendido por"", ""plazaVea"", ""En caso algo no vaya como gustes: Puedes revisar nuestras"", ""Politicas de cambios y/o devoluciones"", ""y hacerlas efectivas en todas nuestras tiendas."", ""Productos"", ""que te pueden interesar"", ""similares"", ""Multiplicador-de-unidad: MAKRO-Bi-Precio|Vigente Oculto"", ""Vea Days Supermercado marzo | Ver todo"", "".00"", ""un"", ""3"", ""productos agregados"", ""Agrega indicaciones"", ""Guardar"", ""Multiplicador-de-unidad: Express"", ""Arroz Extra COSTEÑITO Importado Saco 50kg"", ""COSTEÑITO"", ""Arroz Extra Añejo ARO Bolsa 10kg"", ""Arroz Extra PACASMAYO Saco 49Kg"", ""PACASMAYO"", ""Arroz Extra VALLENORTE Gran Reserva Bolsa 750g"", ""Arroz Extra CAMPERO Granel Saco 25Kg"", ""Arroz Extra PAISANA Bolsa 1Kg"", ""Recomendado para ti""]}",dataset/txt_limpios/1200.txt,dataset/paginas_descargadas/1200.html,ET,sin_categoria,discard,0.30,no_category_detected
