{"source_id": "390", "title": "Meu Desconto", "description": "", "breadcrumbs": "Minha Lista > 2l", "price_raw": "7.99", "currency_raw": "BRL", "url": "", "seller": "Desconocido", "availability": "unknown", "country": "BR", "product_name": "Meu Desconto", "brand": "Minha Lista", "reference": "", "unit": "2l", "price_amount": 7.99, "price_currency": "BRL", "price_symbol": "R$", "price_text": "R$7,99", "price_amount_filled": "7.99", "price_is_imputed": "False", "price_imputation_source": "original", "price_amount_usd": "1.4666", "price_amount_usd_filled": "1.4666", "fx_rate_local_per_usd": "5.448", "fx_source": "from_brasil_cambio_dolar", "information_text": "", "description_text": "", "features_text": "", "specifications_text": "", "benefits_text": "", "details_text": "", "other_sections": "", "sections": {}, "txt_path": "dataset/txt_limpios/390.txt", "html_path": "dataset/paginas_descargadas/390.html", "es_status": "EN", "category_canonical": "sin_categoria", "decision": "discard", "match_score": 0.3, "reasons": "no_category_detected"}
{"source_id": "391", "title": "Meu Desconto", "description": "", "breadcrumbs": "Minha Lista > 200ml", "price_raw": "1.89", "currency_raw": "BRL", "url": "", "seller": "Desconocido", "availability": "unknown", "country": "BR", "product_name": "Meu Desconto", "brand": "Minha Lista", "reference": "", "unit": "200ml", "price_amount": 1.89, "price_currency": "BRL", "price_symbol": "R$", "price_text": "R$1,89", "price_amount_filled": "1.89", "price_is_imputed": "False", "price_imputation_source": "original", "price_amount_usd": "0.3469", "price_amount_usd_filled": "0.3469", "fx_rate_local_per_usd": "5.448", "fx_source": "from_brasil_cambio_dolar", "information_text": "", "description_text": "", "features_text": "", "specifications_text": "", "benefits_text": "", "details_text": "", "other_sections": "", "sections": {}, "txt_path": "dataset/txt_limpios/391.txt", "html_path": "dataset/paginas_descargadas/391.html", "es_status": "EN", "category_canonical": "sin_categoria", "decision": "discard", "match_score": 0.3, "reasons": "no_category_detected"}
{"source_id": "393", "title": "Meu Desconto", "description": "", "breadcrumbs": "Minha Lista > 500g", "price_raw": "3.89", "currency_raw": "BRL", "url": "", "seller": "Desconocido", "availability": "unknown", "country": "BR", "product_name": "Meu Desconto", "brand": "Minha Lista", "reference": "", "unit": "500g", "price_amount": 3.89, "price_currency": "BRL", "price_symbol": "R$", "price_text": "R$3,89", "price_amount_filled": "3.89", "price_is_imputed": "False", "price_imputation_source": "original", "price_amount_usd": "0.714", "price_amount_usd_filled": "0.714", "fx_rate_local_per_usd": "5.448", "fx_source": "from_brasil_cambio_dolar", "information_text": "", "description_text": "", "features_text": "", "specifications_text": "", "benefits_text": "", "details_text": "", "other_sections": "", "sections": {}, "txt_path": "dataset/txt_limpios/393.txt", "html_path": "dataset/paginas_descargadas/393.html", "es_status": "EN", "category_canonical": "sin_categoria", "decision": "discard", "match_score": 0.3, "reasons": "no_category_detected"}
{"source_id": "394", "title": "Meu Desconto", "description": "", "breadcrumbs": "Minha Lista > 500g", "price_raw": "5.59", "currency_raw": "BRL", "url": "", "seller": "Desconocido", "availability": "unknown", "country": "BR", "product_name": "Meu Desconto", "brand": "Minha Lista", "reference": "", "unit": "500g", "price_amount": 5.59, "price_currency": "BRL", "price_symbol": "R$", "price_text": "R$5,59", "price_amount_filled": "5.59", "price_is_imputed": "False", "price_imputation_source": "original", "price_amount_usd": "1.0261", "price_amount_usd_filled": "1.0261", "fx_rate_local_per_usd": "5.448", "fx_source": "from_brasil_cambio_dolar", "information_text": "", "description_text": "", "features_text": "", "specifications_text": "", "benefits_text": "", "details_text": "", "other_sections": "", "sections": {}, "txt_path": "dataset/txt_limpios/394.txt", "html_path": "dataset/paginas_descargadas/394.html", "es_status": "EN", "category_canonical": "sin_categoria", "decision": "discard", "match_score": 0.3, "reasons": "no_category_detected"}
{"source_id": "395", "title": "Meu Desconto", "description": "", "breadcrumbs": "Minha Lista > 500g", "price_raw": "2.0", "currency_raw": "", "url": "", "seller": "Desconocido", "availability": "unknown", "country": "UNKNOWN", "product_name": "Meu Desconto", "brand": "Minha Lista", "reference": "", "unit": "500g", "price_amount": 2.0, "price_currency": "", "price_symbol": "", "price_text": "2", "price_amount_filled": "2.0", "price_is_imputed": "False", "price_imputation_source": "original", "price_amount_usd": "2.0", "price_amount_usd_filled": "2.0", "fx_rate_local_per_usd": "1.0", "fx_source": "default_1usd", "information_text": "", "description_text": "", "features_text": "", "specifications_text": "", "benefits_text": "", "details_text": "", "other_sections": "", "sections": {}, "txt_path": "dataset/txt_limpios/395.txt", "html_path": "dataset/paginas_descargadas/395.html", "es_status": "EN", "category_canonical": "sin_categoria", "decision": "discard", "match_score": 0.3, "reasons": "no_category_detected"}
{"source_id": "396", "title": "Meu Desconto", "description": "", "breadcrumbs": "Minha Lista > 500g", "price_raw": "11.49", "currency_raw": "BRL", "url": "", "seller": "Desconocido", "availability": "unknown", "country": "BR", "product_name": "Meu Desconto", "brand": "Minha Lista", "reference": "", "unit": "500g", "price_amount": 11.49, "price_currency": "BRL", "price_symbol": "R$", "price_text": "R$11,49", "price_amount_filled": "11.49", "price_is_imputed": "False", "price_imputation_source": "original", "price_amount_usd": "2.109", "price_amount_usd_filled": "2.109", "fx_rate_local_per_usd": "5.448", "fx_source": "from_brasil_cambio_dolar", "information_text": "", "description_text": "", "features_text": "", "specifications_text": "", "benefits_text": "", "details_text": "", "other_sections": "", "sections": {}, "txt_path": "dataset/txt_limpios/396.txt", "html_path": "dataset/paginas_descargadas/396.html", "es_status": "EN", "category_canonical": "sin_categoria", "decision": "discard", "match_score": 0.3, "reasons": "no_category_detected"}
{"source_id": "397", "title": "Meu Desconto", "description": "", "breadcrumbs": "Minha Lista > 500g", "price_raw": "5.59", "currency_raw": "BRL", "url": "", "seller": "Desconocido", "availability": "unknown", "country": "BR", "product_name": "Meu Desconto", "brand": "Minha Lista", "reference": "", "unit": "500g", "price_amount": 5.59, "price_currency": "BRL", "price_symbol": "R$", "price_text": "R$5,59", "price_amount_filled": "5.59", "price_is_imputed": "False", "price_imputation_source": "original", "price_amount_usd": "1.0261", "price_amount_usd_filled": "1.0261", "fx_rate_local_per_usd": "5.448", "fx_source": "from_brasil_cambio_dolar", "information_text": "", "description_text": "", "features_text": "", "specifications_text": "", "benefits_text": "", "details_text": "", "other_sections": "", "sections": {}, "txt_path": "dataset/txt_limpios/397.txt", "html_path": "dataset/paginas_descargadas/397.html", "es_status": "EN", "category_canonical": "sin_categoria", "decision": "discard", "match_score": 0.3, "reasons": "no_category_detected"}
{"source_id": "398", "title": "Meu Desconto", "description": "", "breadcrumbs": "Minha Lista > 1l", "price_raw": "1.0", "currency_raw": "", "url": "", "seller": "Desconocido", "availability": "unknown", "country": "UNKNOWN", "product_name": "Meu Desconto", "brand": "Minha Lista", "reference": "", "unit": "1l", "price_amount": 1.0, "price_currency": "", "price_symbol": "", "price_text": "1", "price_amount_filled": "1.0", "price_is_imputed": "False", "price_imputation_source": "original", "price_amount_usd": "1.0", "price_amount_usd_filled": "1.0", "fx_rate_local_per_usd": "1.0", "fx_source": "default_1usd", "information_text": "", "description_text": "", "features_text": "", "specifications_text": "", "benefits_text": "", "details_text": "", "other_sections": "", "sections": {}, "txt_path": "dataset/txt_limpios/398.txt", "html_path": "dataset/paginas_descargadas/398.html", "es_status": "EN", "category_canonical": "sin_categoria", "decision": "discard", "match_score": 0.3, "reasons": "no_category_detected"}
{"source_id": "399", "title": "Meu Desconto", "description": "", "breadcrumbs": "Minha Lista > 1 Litro", "price_raw": "4.69", "currency_raw": "BRL", "url": "", "seller": "Desconocido", "availability": "unknown", "country": "BR", "product_name": "Meu Desconto", "brand": "Minha Lista", "reference": "", "unit": "1 Litro", "price_amount": 4.69, "price_currency": "BRL", "price_symbol": "R$", "price_text": "R$4,69", "price_amount_filled": "4.69", "price_is_imputed": "False", "price_imputation_source": "original", "price_amount_usd": "0.8609", "price_amount_usd_filled": "0.8609", "fx_rate_local_per_usd": "5.448", "fx_source": "from_brasil_cambio_dolar", "information_text": "", "description_text": "", "features_text": "", "specifications_text": "", "benefits_text": "", "details_text": "", "other_sections": "", "sections": {}, "txt_path": "dataset/txt_limpios/399.txt", "html_path": "dataset/paginas_descargadas/399.html", "es_status": "EN", "category_canonical": "sin_categoria", "decision": "discard", "match_score": 0.3, "reasons": "no_category_detected"}
{"source_id": "400", "title": "Meu Desconto", "description": "", "breadcrumbs": "Minha Lista > 1l", "price_raw": "4.49", "currency_raw": "BRL", "url": "", "seller": "Desconocido", "availability": "unknown", "country": "BR", "product_name": "Meu Desconto", "brand": "Minha Lista", "reference": "", "unit": "1l", "price_amount": 4.49, "price_currency": "BRL", "price_symbol": "R$", "price_text": "R$4,49", "price_amount_filled": "4.49", "price_is_imputed": "False", "price_imputation_source": "original", "price_amount_usd": "0.8242", "price_amount_usd_filled": "0.8242", "fx_rate_local_per_usd": "5.448", "fx_source": "from_brasil_cambio_dolar", "information_text": "", "description_text": "", "features_text": "", "specifications_text": "", "benefits_text": "", "details_text": "", "other_sections": "", "sections": {}, "txt_path": "dataset/txt_limpios/400.txt", "html_path": "dataset/paginas_descargadas/400.html", "es_status": "EN", "category_canonical": "sin_categoria", "decision": "discard", "match_score": 0.3, "reasons": "no_category_detected"}
{"source_id": "401", "title": "Meu Desconto", "description": "", "breadcrumbs": "Minha Lista > 1L", "price_raw": "4.99", "currency_raw": "BRL", "url": "", "seller": "Desconocido", "availability": "unknown", "country": "BR", "product_name": "Meu Desconto", "brand": "Minha Lista", "reference": "", "unit": "1L", "price_amount": 4.99, "price_currency": "BRL", "price_symbol": "R$", "price_text": "R$4,99", "price_amount_filled": "4.99", "price_is_imputed": "False", "price_imputation_source": "original", "price_amount_usd": "0.9159", "price_amount_usd_filled": "0.9159", "fx_rate_local_per_usd": "5.448", "fx_source": "from_brasil_cambio_dolar", "information_text": "", "description_text": "", "features_text": "", "specifications_text": "", "benefits_text": "", "details_text": "", "other_sections": "", "sections": {}, "txt_path": "dataset/txt_limpios/401.txt", "html_path": "dataset/paginas_descargadas/401.html", "es_status": "EN", "category_canonical": "sin_categoria", "decision": "discard", "match_score": 0.3, "reasons": "no_category_detected"}
{"source_id": "402", "title": "Meu Desconto", "description": "", "breadcrumbs": "Minha Lista > 1 Litro", "price_raw": "4.69", "currency_raw": "BRL", "url": "", "seller": "Desconocido", "availability": "unknown", "country": "BR", "product_name": "Meu Desconto", "brand": "Minha Lista", "reference": "", "unit": "1 Litro", "price_amount": 4.69, "price_currency": "BRL", "price_symbol": "R$", "price_text": "R$4,69", "price_amount_filled": "4.69", "price_is_imputed": "False", "price_imputation_source": "original", "price_amount_usd": "0.8609", "price_amount_usd_filled": "0.8609", "fx_rate_local_per_usd": "5.448", "fx_source": "from_brasil_cambio_dolar", "information_text": "", "description_text": "", "features_text": "", "specifications_text": "", "benefits_text": "", "details_text": "", "other_sections": "", "sections": {}, "txt_path": "dataset/txt_limpios/402.txt", "html_path": "dataset/paginas_descargadas/402.html", "es_status": "EN", "category_canonical": "sin_categoria", "decision": "discard", "match_score": 0.3, "reasons": "no_category_detected"}
{"source_id": "403", "title": "Meu Desconto", "description": "", "breadcrumbs": "Minha Lista > 269ml", "price_raw": "3.49", "currency_raw": "BRL", "url": "", "seller": "Desconocido", "availability": "unknown", "country": "BR", "product_name": "Meu Desconto", "brand": "Minha Lista", "reference": "", "unit": "269ml", "price_amount": 3.49, "price_currency": "BRL", "price_symbol": "R$", "price_text": "R$3,49", "price_amount_filled": "3.49", "price_is_imputed": "False", "price_imputation_source": "original", "price_amount_usd": "0.6406", "price_amount_usd_filled": "0.6406", "fx_rate_local_per_usd": "5.448", "fx_source": "from_brasil_cambio_dolar", "information_text": "", "description_text": "", "features_text": "", "specifications_text": "", "benefits_text": "", "details_text": "", "other_sections": "", "sections": {}, "txt_path": "dataset/txt_limpios/403.txt", "html_path": "dataset/paginas_descargadas/403.html", "es_status": "EN", "category_canonical": "sin_categoria", "decision": "discard", "match_score": 0.3, "reasons": "no_category_detected"}
{"source_id": "404", "title": "Meu Desconto", "description": "", "breadcrumbs": "Minha Lista > 350ml", "price_raw": "5.59", "currency_raw": "BRL", "url": "", "seller": "Desconocido", "availability": "unknown", "country": "BR", "product_name": "Meu Desconto", "brand": "Minha Lista", "reference": "", "unit": "350ml", "price_amount": 5.59, "price_currency": "BRL", "price_symbol": "R$", "price_text": "R$5,59", "price_amount_filled": "5.59", "price_is_imputed": "False", "price_imputation_source": "original", "price_amount_usd": "1.0261", "price_amount_usd_filled": "1.0261", "fx_rate_local_per_usd": "5.448", "fx_source": "from_brasil_cambio_dolar", "information_text": "", "description_text": "", "features_text": "", "specifications_text": "", "benefits_text": "", "details_text": "", "other_sections": "", "sections": {}, "txt_path": "dataset/txt_limpios/404.txt", "html_path": "dataset/paginas_descargadas/404.html", "es_status": "EN", "category_canonical": "sin_categoria", "decision": "discard", "match_score": 0.3, "reasons": "no_category_detected"}
{"source_id": "405", "title": "Meu Desconto", "description": "", "breadcrumbs": "Minha Lista > 330ml", "price_raw": "6.79", "currency_raw": "BRL", "url": "", "seller": "Desconocido", "availability": "unknown", "country": "BR", "product_name": "Meu Desconto", "brand": "Minha Lista", "reference": "", "unit": "330ml", "price_amount": 6.79, "price_currency": "BRL", "price_symbol": "R$", "price_text": "R$6,79", "price_amount_filled": "6.79", "price_is_imputed": "False", "price_imputation_source": "original", "price_amount_usd": "1.2463", "price_amount_usd_filled": "1.2463", "fx_rate_local_per_usd": "5.448", "fx_source": "from_brasil_cambio_dolar", "information_text": "", "description_text": "", "features_text": "", "specifications_text": "", "benefits_text": "", "details_text": "", "other_sections": "", "sections": {}, "txt_path": "dataset/txt_limpios/405.txt", "html_path": "dataset/paginas_descargadas/405.html", "es_status": "EN", "category_canonical": "sin_categoria", "decision": "discard", "match_score": 0.3, "reasons": "no_category_detected"}
{"source_id": "406", "title": "Meu Desconto", "description": "", "breadcrumbs": "Minha Lista > 350ml", "price_raw": "3.79", "currency_raw": "BRL", "url": "", "seller": "Desconocido", "availability": "unknown", "country": "BR", "product_name": "Meu Desconto", "brand": "Minha Lista", "reference": "", "unit": "350ml", "price_amount": 3.79, "price_currency": "BRL", "price_symbol": "R$", "price_text": "R$3,79", "price_amount_filled": "3.79", "price_is_imputed": "False", "price_imputation_source": "original", "price_amount_usd": "0.6957", "price_amount_usd_filled": "0.6957", "fx_rate_local_per_usd": "5.448", "fx_source": "from_brasil_cambio_dolar", "information_text": "", "description_text": "", "features_text": "", "specifications_text": "", "benefits_text": "", "details_text": "", "other_sections": "", "sections": {}, "txt_path": "dataset/txt_limpios/406.txt", "html_path": "dataset/paginas_descargadas/406.html", "es_status": "EN", "category_canonical": "sin_categoria", "decision": "discard", "match_score": 0.3, "reasons": "no_category_detected"}
{"source_id": "407", "title": "Meu Desconto", "description": "", "breadcrumbs": "Minha Lista > 269ml", "price_raw": "3.19", "currency_raw": "BRL", "url": "", "seller": "Desconocido", "availability": "unknown", "country": "BR", "product_name": "Meu Desconto", "brand": "Minha Lista", "reference": "", "unit": "269ml", "price_amount": 3.19, "price_currency": "BRL", "price_symbol": "R$", "price_text": "R$3,19", "price_amount_filled": "3.19", "price_is_imputed": "False", "price_imputation_source": "original", "price_amount_usd": "0.5855", "price_amount_usd_filled": "0.5855", "fx_rate_local_per_usd": "5.448", "fx_source": "from_brasil_cambio_dolar", "information_text": "", "description_text": "", "features_text": "", "specifications_text": "", "benefits_text": "", "details_text": "", "other_sections": "", "sections": {}, "txt_path": "dataset/txt_limpios/407.txt", "html_path": "dataset/paginas_descargadas/407.html", "es_status": "EN", "category_canonical": "sin_categoria", "decision": "discard", "match_score": 0.3, "reasons": "no_category_detected"}
{"source_id": "408", "title": "Meu Desconto", "description": "", "breadcrumbs": "Minha Lista > 1kg", "price_raw": "28.9", "currency_raw": "BRL", "url": "", "seller": "Desconocido", "availability": "unknown", "country": "BR", "product_name": "Meu Desconto", "brand": "Minha Lista", "reference": "", "unit": "1kg", "price_amount": 28.9, "price_currency": "BRL", "price_symbol": "R$", "price_text": "R$28,90", "price_amount_filled": "28.9", "price_is_imputed": "False", "price_imputation_source": "original", "price_amount_usd": "5.3047", "price_amount_usd_filled": "5.3047", "fx_rate_local_per_usd": "5.448", "fx_source": "from_brasil_cambio_dolar", "information_text": "", "description_text": "", "features_text": "", "specifications_text": "", "benefits_text": "", "details_text": "", "other_sections": "", "sections": {}, "txt_path": "dataset/txt_limpios/408.txt", "html_path": "dataset/paginas_descargadas/408.html", "es_status": "EN", "category_canonical": "sin_categoria", "decision": "discard", "match_score": 0.3, "reasons": "no_category_detected"}
{"source_id": "409", "title": "Meu Desconto", "description": "", "breadcrumbs": "Minha Lista > 1kg", "price_raw": "1.0", "currency_raw": "", "url": "", "seller": "Desconocido", "availability": "unknown", "country": "UNKNOWN", "product_name": "Meu Desconto", "brand": "Minha Lista", "reference": "", "unit": "1kg", "price_amount": 1.0, "price_currency": "", "price_symbol": "", "price_text": "1", "price_amount_filled": "1.0", "price_is_imputed": "False", "price_imputation_source": "original", "price_amount_usd": "1.0", "price_amount_usd_filled": "1.0", "fx_rate_local_per_usd": "1.0", "fx_source": "default_1usd", "information_text": "", "description_text": "", "features_text": "", "specifications_text": "", "benefits_text": "", "details_text": "", "other_sections": "", "sections": {}, "txt_path": "dataset/txt_limpios/409.txt", "html_path": "dataset/paginas_descargadas/409.html", "es_status": "EN", "category_canonical": "sin_categoria", "decision": "discard", "match_score": 0.3, "reasons": "no_category_detected"}
{"source_id": "410", "title": "Meu Desconto", "description": "", "breadcrumbs": "Minha Lista > 800g", "price_raw": "21.9", "currency_raw": "BRL", "url": "", "seller": "Desconocido", "availability": "unknown", "country": "BR", "product_name": "Meu Desconto", "brand": "Minha Lista", "reference": "", "unit": "800g", "price_amount": 21.9, "price_currency": "BRL", "price_symbol": "R$", "price_text": "R$21,90", "price_amount_filled": "21.9", "price_is_imputed": "False", "price_imputation_source": "original", "price_amount_usd": "4.0198", "price_amount_usd_filled": "4.0198", "fx_rate_local_per_usd": "5.448", "fx_source": "from_brasil_cambio_dolar", "information_text": "", "description_text": "", "features_text": "", "specifications_text": "", "benefits_text": "", "details_text": "", "other_sections": "", "sections": {}, "txt_path": "dataset/txt_limpios/410.txt", "html_path": "dataset/paginas_descargadas/410.html", "es_status": "EN", "category_canonical": "sin_categoria", "decision": "discard", "match_score": 0.3, "reasons": "no_category_detected"}
