{"source_id": "1029", "title": "colaborar con nuestros estudios para marketing. También puede configurarlas.", "description": "Información de la marca", "breadcrumbs": "que podemos ofrecer. > 1Kg", "price_raw": "16.92", "currency_raw": "PEN", "url": "", "seller": "Desconocido", "availability": "unknown", "country": "PE", "product_name": "colaborar con nuestros estudios para marketing. También puede configurarlas.", "brand": "que podemos ofrecer.", "reference": "", "unit": "1Kg", "price_amount": 16.92, "price_currency": "PEN", "price_symbol": "S/", "price_text": "S/16.92", "price_amount_filled": "16.92", "price_is_imputed": "False", "price_imputation_source": "original", "price_amount_usd": "4.7662", "price_amount_usd_filled": "4.7662", "fx_rate_local_per_usd": "3.55", "fx_source": "from_peru_cambio_dolar", "information_text": "", "description_text": "Información de la marca", "features_text": "Presentación/Empaque | Bandeja | Origen Del Huevo | Gallina | Denominación/Variedad | Huevos pardos frescos x 30 un | Revisa todo | Componentes del Producto | Vendido por | plazaVea | En caso de que algo no vaya como gustes: Puedes revisar nuestras | Políticas de cambios y/o devoluciones | y hacerlas efectivas en todas nuestras tiendas. | Productos | que te pueden interesar | Recomendado para ti", "specifications_text": "", "benefits_text": "", "details_text": "", "other_sections": "", "sections": {"Descripción": ["Información de la marca"], "Características": ["Presentación/Empaque", "Bandeja", "Origen Del Huevo", "Gallina", "Denominación/Variedad", "Huevos pardos frescos x 30 un", "Revisa todo", "Componentes del Producto", "Vendido por", "plazaVea", "En caso algo no vaya como gustes: Puedes revisar nuestras", "Politicas de cambios y/o devoluciones", "y hacerlas efectivas en todas nuestras tiendas.", "Productos", "que te pueden interesar", "Recomendado para ti"]}, "txt_path": "dataset/txt_limpios/1029.txt", "html_path": "dataset/paginas_descargadas/1029.html", "es_status": "ET", "category_canonical": "sin_categoria", "decision": "discard", "match_score": 0.3, "reasons": "no_category_detected"}
{"source_id": "1030", "title": "colaborar con nuestros estudios para marketing. También puede configurarlas.", "description": "Información de la marca", "breadcrumbs": "que podemos ofrecer. > 1Kg", "price_raw": "16.92", "currency_raw": "PEN", "url": "", "seller": "Desconocido", "availability": "unknown", "country": "PE", "product_name": "colaborar con nuestros estudios para marketing. También puede configurarlas.", "brand": "que podemos ofrecer.", "reference": "", "unit": "1Kg", "price_amount": 16.92, "price_currency": "PEN", "price_symbol": "S/", "price_text": "S/16.92", "price_amount_filled": "16.92", "price_is_imputed": "False", "price_imputation_source": "original", "price_amount_usd": "4.7662", "price_amount_usd_filled": "4.7662", "fx_rate_local_per_usd": "3.55", "fx_source": "from_peru_cambio_dolar", "information_text": "", "description_text": "Información de la marca", "features_text": "Importante destacar | Presentación: Paquete 30un | Ayuda a la prevención de enfermedades cardiovasculares | Alimento rico en proteínas | Fuente de energías | Descripción del producto | HUEVOS DE GALLINA Y CODORNIZ | plaza Vea | cuenta con una amplia variedad de | para que acompañes tus | Desayunos | y | Almuerzos | junto con los más ricos y nutritivos alimentos de | Puedes elegir entre | Huevos de Gallina | , perfectos para prepararte un delicioso Omelette el un clásico huevo frito. También puedes optar por | Huevos de Codorniz | que se caracterizan por ser una fuente energía, rica en proteínas. Asimismo, poseen calcio y fósforo los que son fundamentales para el mantenimiento de unos huesos y dientes sanos . Gracias a su aporte nutricional se convierten en el alimento ideal para acompañar la lonchera de grandes y niños. | Es recomendable balancear nuestra alimentación para llevar una vida saludable. Por ello dentro de tus alimentos diarios en el pueden faltar las | Frutas | , | Verduras | Carnes, Aves y Pescados | . Sin embargo, si eres de las personas que les gusta consumir alimentos de origen vegetal en | encontrarás una gran variedad de opciones en | Leches de Soya y Leches Vegetales. | que tenemos para ti.! | - Conoce las distintas opciones de | en plazaVea Online! | \"Huevos La Calera son 100% naturales, altamente nutritivos, deliciosos y versátiles para disfrutar en cada comida. Desde hace más de 40 años brindan dedicación, esmero y experiencia , por ello han sido reconocidos como empresa líder en la producción y comercialización de huevos en el Perú\" | ¿En qué búsqueda? Encuentra más | en plaza Vea | Revisa todo | Componentes del Producto | Vendido por | En caso de que algo te guste: Puedes revisar nuestras | Políticas de cambios y/o devoluciones | y hacerlas efectivas en todas nuestras tiendas. | Productos | que te pueden interesar | Recomendado para ti", "specifications_text": "", "benefits_text": "", "details_text": "", "other_sections": "", "sections": {"Descripción": ["Información de la marca"], "Características": ["Importante destacar", "Presentación : Paquete 30un", "Ayuda a la prevención de enfermedades cardiovasculares", "Alimento rico en proteínas", "Fuente de energías", "Descripción del producto", "HUEVOS DE GALLINA Y CODORNIZ", "plazaVea", "cuenta con una amplia variedad de", "para que acompañes tus", "Desayunos", "y", "Almuerzos", "junto con los más ricos y nutritivos alimentos", "Puedes elegir entre", "Huevos de Gallina", ", perfectos para prepararte un delicioso Omelette el un clásico huevo frito. También puedes optar por", "Huevos de Codorniz", "que se caracterizan por ser una fuente energía, rica en proteínas. Asimismo, poseen calcio y fósforo los que son fundamentales para el mantenimiento de unos huesos y dientes sanos . Gracias a su aporte nutricional se convierten en el alimento ideal para acompañar la lonchera de grandes y niños.", "Es recomendable balancear nuestra alimentación para llevar una vida saludable. Por eso dentro de tus alimentos diarios en el pueden faltar las", "Frutas", ",", "Verduras", "Carnes, Aves y Pescados", ". Sin embargo, si eres de las personas que les gusta consumir alimentos de origen Vegetal en", "encontrarás una gran variedad de opciones en", "Leches de Soya y Leches Vegetales.", "que tenemos para ti.!", "¡Conoce las distintas opciones de", "en plazaVea Online!", "\"Huevos La Calera son 100% naturales, altamente nutritivos, deliciosos y versátiles para disfrutar en cada comida. Desde hace más de 40 años brindan dedicación, esmero y experiencia , por ello han sido reconocidos como empresa líder en la producción y comercialización de huevos en el Perú\"", "¿En qué búsqueda? Encuentra más", "en plazaVea", "Revisa todo", "Componentes del Producto", "Vendido por", "En caso algo no vaya como gustes: Puedes revisar nuestras", "Politicas de cambios y/o devoluciones", "y hacerlas efectivas en todas nuestras tiendas.", "Productos", "que te pueden interesar", "Recomendado para ti"]}, "txt_path": "dataset/txt_limpios/1030.txt", "html_path": "dataset/paginas_descargadas/1030.html", "es_status": "ET", "category_canonical": "sin_categoria", "decision": "discard", "match_score": 0.3, "reasons": "no_category_detected"}
{"source_id": "1031", "title": "colaborar con nuestros estudios para marketing. También puede configurarlas.", "description": "Información de la marca", "breadcrumbs": "que podemos ofrecer. > 1Kg", "price_raw": "16.92", "currency_raw": "PEN", "url": "", "seller": "Desconocido", "availability": "unknown", "country": "PE", "product_name": "colaborar con nuestros estudios para marketing. También puede configurarlas.", "brand": "que podemos ofrecer.", "reference": "", "unit": "1Kg", "price_amount": 16.92, "price_currency": "PEN", "price_symbol": "S/", "price_text": "S/16.92", "price_amount_filled": "16.92", "price_is_imputed": "False", "price_imputation_source": "original", "price_amount_usd": "4.7662", "price_amount_usd_filled": "4.7662", "fx_rate_local_per_usd": "3.55", "fx_source": "from_peru_cambio_dolar", "information_text": "", "description_text": "Información de la marca", "features_text": "Presentación/Empaque | Bandeja | Azúcares Porción | 0,36 g/100g | Calorías Porción | 140,5 Kcal/100g | Carbohidratos Porción | 0,99 g/100g | Descripción Nutricional | Energía total 140,5 Kcal/100g | Proteínas Porción | 12,8 g/100g | Sodio Porción | 58,6 mg/100g | Denominación/Variedad | ARTISAN HUEVOS X 15 UNID | Revisa todo | Componentes del Producto | Vendido por | plaza Vea | En caso de que algo te guste: Puedes revisar nuestras | Políticas de cambios y/o devoluciones | y hacerlas efectivas en todas nuestras tiendas. | Productos | que te pueden interesar | Recomendado para ti", "specifications_text": "", "benefits_text": "", "details_text": "", "other_sections": "", "sections": {"Descripción": ["Información de la marca"], "Características": ["Presentación/Empaque", "Bandeja", "Azúcar por porción", "0,36 g/100g", "Calorías Porción", "140,5 Kcal/100g", "Carbohidratos Porción", "0,99 g/100g", "Descripción Nutricional", "Energia total 140,5 Kcal/100g", "Proteínas Porción", "12,8 g/100g", "Sodio Porción", "58,6 mg/100g", "Denominación/Variedad", "ARTISAN HUEVOS X 15 UNID", "Revisa todo", "Componentes del Producto", "Vendido por", "plazaVea", "En caso algo no vaya como gustes: Puedes revisar nuestras", "Politicas de cambios y/o devoluciones", "y hacerlas efectivas en todas nuestras tiendas.", "Productos", "que te pueden interesar", "Recomendado para ti"]}, "txt_path": "dataset/txt_limpios/1031.txt", "html_path": "dataset/paginas_descargadas/1031.html", "es_status": "ET", "category_canonical": "sin_categoria", "decision": "discard", "match_score": 0.3, "reasons": "no_category_detected"}
{"source_id": "1032", "title": "colaborar con nuestros estudios para marketing. También puede configurarlas.", "description": "Descripción del producto Importante destacar Presentación : Bandeja 12un Suavidad y máximo confort HUEVOS DE GALLINA Y CODORNIZ cuenta con una amplia variedad de para que acompañes tus desayunos y Almuerzos junto con los más ricos y nutritivos alimentos de Puedes elegir entre Huevos de Gallina , perfectos para prepararte un delicioso Omelette el un clásico huevo frito. También puedes optar por Huevos de Codorniz que se caracterizan por ser una fuente energía, rica en proteínas. Asimismo, poseen calcio y fósforo los que son fundamentales para el mantenimiento de unos huesos y dientes sanos . Gracias a su aporte nutricional se convierten en el alimento ideal para acompañar la lonchera de grandes y niños. Es recomendable balancear nuestra alimentación para llevar una vida saludable. Por ello dentro de tus alimentos diarios en el pueden faltar las Frutas , Verduras Carnes, Aves y Pescados . Sin embargo, si eres de las personas que les gusta consumir alimentos de origen vegetal en encontrarás una gran variedad de opciones en Leches de Soya y Leches Vegetales. ¡Qué tenemos para ti! ¡Conoce las distintas opciones de en plazaVea Online! \"Gallinas Libres son productores de los mejores huevos de gallinas 100% libres, únicos en el Perú con certificación internacional \"free-range\". Su misión es hacer factible que los peruanos podamos disfrutar de verdaderos huevos de gallinas libres, de campo, 100% naturales, con un mayor valor nutricional y provenientes de gallinas felices sin maltrato alguno.\" ¿En qué búsqueda? Encuentra más en plazaVea En caso de que algo te guste: Puedes revisar nuestras Políticas de cambios y/o devoluciones y hacerlas efectivas en todas nuestras tiendas. Productos que te pueden interesar Recomendado para ti", "breadcrumbs": "que podemos ofrecer. > 1Kg", "price_raw": "16.92", "currency_raw": "PEN", "url": "", "seller": "Desconocido", "availability": "unknown", "country": "PE", "product_name": "colaborar con nuestros estudios para marketing. También puede configurarlas.", "brand": "que podemos ofrecer.", "reference": "", "unit": "1Kg", "price_amount": 16.92, "price_currency": "PEN", "price_symbol": "S/", "price_text": "S/16.92", "price_amount_filled": "16.92", "price_is_imputed": "False", "price_imputation_source": "original", "price_amount_usd": "4.7662", "price_amount_usd_filled": "4.7662", "fx_rate_local_per_usd": "3.55", "fx_source": "from_peru_cambio_dolar", "information_text": "", "description_text": "Descripción del producto Importante destacar Presentación : Bandeja 12un Suavidad y máximo confort HUEVOS DE GALLINA Y CODORNIZ cuenta con una amplia variedad de para que acompañes tus desayunos y Almuerzos junto con los más ricos y nutritivos alimentos de Puedes elegir entre Huevos de Gallina , perfectos para prepararte un delicioso Omelette el un clásico huevo frito. También puedes optar por Huevos de Codorniz que se caracterizan por ser una fuente energía, rica en proteínas. Asimismo, poseen calcio y fósforo los que son fundamentales para el mantenimiento de unos huesos y dientes sanos . Gracias a su aporte nutricional se convierten en el alimento ideal para acompañar la lonchera de grandes y niños. Es recomendable balancear nuestra alimentación para llevar una vida saludable. Por ello dentro de tus alimentos diarios en el pueden faltar las Frutas , Verduras Carnes, Aves y Pescados . Sin embargo, si eres de las personas que les gusta consumir alimentos de origen vegetal en encontrarás una gran variedad de opciones en Leches de Soya y Leches Vegetales. ¡Qué tenemos para ti! ¡Conoce las distintas opciones de en plazaVea Online! \"Gallinas Libres son productores de los mejores huevos de gallinas 100% libres, únicos en el Perú con certificación internacional \"free-range\". Su misión es hacer factible que los peruanos podamos disfrutar de verdaderos huevos de gallinas libres, de campo, 100% naturales, con un mayor valor nutricional y provenientes de gallinas felices sin maltrato alguno.\" ¿En qué búsqueda? Encuentra más en plazaVea En caso de que algo te guste: Puedes revisar nuestras Políticas de cambios y/o devoluciones y hacerlas efectivas en todas nuestras tiendas. Productos que te pueden interesar Recomendado para ti", "features_text": "", "specifications_text": "", "benefits_text": "", "details_text": "", "other_sections": "", "sections": {"Descripción": ["Descripción del producto", "Importante destacar", "Presentación : Bandeja 12un", "Suavidad y máximo confort", "HUEVOS DE GALLINA Y CODORNIZ", "cuenta con una amplia variedad de", "para que acompañes tus", "Desayunos", "y", "Almuerzos", "junto con los más ricos y nutritivos alimentos", "Puedes elegir entre", "Huevos de Gallina", ", perfectos para prepararte un delicioso Omelette el un clásico huevo frito. También puedes optar por", "Huevos de Codorniz", "que se caracterizan por ser una fuente energía, rica en proteínas. Asimismo, poseen calcio y fósforo los que son fundamentales para el mantenimiento de unos huesos y dientes sanos . Gracias a su aporte nutricional se convierten en el alimento ideal para acompañar la lonchera de grandes y niños.", "Es recomendable balancear nuestra alimentación para llevar una vida saludable. Por eso dentro de tus alimentos diarios en el pueden faltar las", "Frutas", ",", "Verduras", "Carnes, Aves y Pescados", ". Sin embargo, si eres de las personas que les gusta consumir alimentos de origen Vegetal en", "encontrarás una gran variedad de opciones en", "Leches de Soya y Leches Vegetales.", "que tenemos para ti.!", "¡Conoce las distintas opciones de", "en plazaVea Online!", "\"Gallinas Libres son productores de los mejores huevos de gallinas 100% libres, únicos en el Perú con certificación internacional \"free-range\". Su misión es hacer factible que los peruanos podamos disfrutar de verdaderos huevos de gallinas libres, de campo, 100% naturales, con un mayor valor nutricional y provenientes de gallinas felices sin maltrato alguno. \"", "¿En qué búsqueda? Encuentra más", "en plazaVea", "En caso algo no vaya como gustes: Puedes revisar nuestras", "Politicas de cambios y/o devoluciones", "y hacerlas efectivas en todas nuestras tiendas.", "Productos", "que te pueden interesar", "Recomendado para ti"]}, "txt_path": "dataset/txt_limpios/1032.txt", "html_path": "dataset/paginas_descargadas/1032.html", "es_status": "ET", "category_canonical": "descartado", "decision": "discard", "match_score": 0.1, "reasons": "excluded_keyword"}
{"source_id": "1033", "title": "colaborar con nuestros estudios para marketing. También puede configurarlas.", "description": "Información de la marca", "breadcrumbs": "que podemos ofrecer. > 5Kg", "price_raw": "16.92", "currency_raw": "PEN", "url": "", "seller": "Desconocido", "availability": "unknown", "country": "PE", "product_name": "colaborar con nuestros estudios para marketing. También puede configurarlas.", "brand": "que podemos ofrecer.", "reference": "", "unit": "5Kg", "price_amount": 16.92, "price_currency": "PEN", "price_symbol": "S/", "price_text": "S/16.92", "price_amount_filled": "16.92", "price_is_imputed": "False", "price_imputation_source": "original", "price_amount_usd": "4.7662", "price_amount_usd_filled": "4.7662", "fx_rate_local_per_usd": "3.55", "fx_source": "from_peru_cambio_dolar", "information_text": "", "description_text": "Información de la marca", "features_text": "Presentación/Empaque | Bolsa | Porción sugerida | 4g | Tipo De Producto | Rubia | Azúcares Porción | Calorías Porción | 16Kcal | Carbohidratos Porción | Grasas Porción | 0g | Proteínas Porción | Sodio Porción | 0mg | Composición/Origen | Caña de azúcar | Advertencias De Almacenamiento | Almacenar en un lugar fresco y seco. | Contenido Neto | 5Kg | Revisa todo | Componentes del Producto | Vendido por | plaza Ver | En caso de que algo te guste: Puedes revisar nuestras | Políticas de cambios y/o devoluciones | y hacerlas efectivas en todas nuestras tiendas. | Productos | que te pueden interesar | Recomendado para ti", "specifications_text": "", "benefits_text": "", "details_text": "", "other_sections": "", "sections": {"Descripción": ["Información de la marca"], "Características": ["Presentación/Empaque", "Bolsa", "Porción sugerida", "4g", "Tipo De Producto", "Rubia", "Azúcar por porción", "Calorías Porción", "16Kcal", "Carbohidratos Porción", "Grasas Porción", "0g", "Proteínas Porción", "Sodio Porción", "0mg", "Composición/Origen", "Caña de azúcar", "Advertencias De Almacenamiento", "Almacenar en un lugar fresco y seco.", "Contenido Neto", "5Kg", "Revisa todo", "Componentes del Producto", "Vendido por", "plazaVea", "En caso algo no vaya como gustes: Puedes revisar nuestras", "Politicas de cambios y/o devoluciones", "y hacerlas efectivas en todas nuestras tiendas.", "Productos", "que te pueden interesar", "Recomendado para ti"]}, "txt_path": "dataset/txt_limpios/1033.txt", "html_path": "dataset/paginas_descargadas/1033.html", "es_status": "ET", "category_canonical": "sin_categoria", "decision": "discard", "match_score": 0.3, "reasons": "no_category_detected"}
