source_id,product_name,brand,unit,country,seller,availability,category_effective,category_canonical,category_canonical_imputed,category_is_imputed,category_model_confidence,price_amount,price_amount_filled,price_amount_usd,price_amount_usd_filled,price_is_imputed,price_imputation_source,fx_rate_local_per_usd,fx_source,es_status,decision,decision_imputed,reasons,txt_path,html_path
1338,El almacenamiento local parece estar deshabilitado en tu navegador.,Aprende,1Kg,UNKNOWN,Desconocido,unknown,azucar,azucar,,False,0.0,1.16,1.16,1.16,1.16,False,original,1.0,default_1usd,ET,keep,keep,heuristic_default,dataset/txt_limpios/1338.txt,dataset/paginas_descargadas/1338.html
1339,El almacenamiento local parece estar deshabilitado en tu navegador.,Aprende,1Kg,UNKNOWN,Desconocido,unknown,azucar,sin_categoria,azucar,True,0.8292524742318917,1.12,1.12,1.12,1.12,False,original,1.0,default_1usd,ET,discard,keep_imputed,no_category_detected,dataset/txt_limpios/1339.txt,dataset/paginas_descargadas/1339.html
544,Elegí tu envío,"Hola, Limpía tú cache",1 Lt,AR,Desconocido,unknown,cafe,cafe,,False,0.0,1.38,1.38,0.0011,0.0011,False,original,1255.0,from_argentina_cambio_dolar,ET,keep,keep,heuristic_default,dataset/txt_limpios/544.txt,dataset/paginas_descargadas/544.html
545,Elegí tu envío,"Hola, Limpía tú cache",,AR,Desconocido,unknown,cafe,sin_categoria,cafe,True,0.9752390505302336,,1663.58,,1.3256,True,country_mean,1255.0,from_argentina_cambio_dolar,EN,discard,keep_imputed,no_category_detected;price_parse_failed,dataset/txt_limpios/545.txt,dataset/paginas_descargadas/545.html
549,Elegí tu envío,"Hola, Limpía tú cache",400 Gr,AR,Desconocido,unknown,leche,leche,,False,0.0,4.8,4.8,0.0038,0.0038,False,original,1255.0,from_argentina_cambio_dolar,ET,keep,keep,heuristic_default,dataset/txt_limpios/549.txt,dataset/paginas_descargadas/549.html
550,Elegí tu envío,"Hola, Limpía tú cache",610 Gr,AR,Desconocido,unknown,leche,leche,,False,0.0,6.43,6.43,0.0051,0.0051,False,original,1255.0,from_argentina_cambio_dolar,ET,keep,keep,heuristic_default,dataset/txt_limpios/550.txt,dataset/paginas_descargadas/550.html
551,Elegí tu envío,"Hola, Limpía tú cache",600 Gr,AR,Desconocido,unknown,cafe,sin_categoria,cafe,True,0.9806226168108634,3.49,3.49,0.0028,0.0028,False,original,1255.0,from_argentina_cambio_dolar,EN,discard,keep_imputed,no_category_detected,dataset/txt_limpios/551.txt,dataset/paginas_descargadas/551.html
553,Elegí tu envío,"Hola, Limpía tú cache",,AR,Desconocido,unknown,cafe,sin_categoria,cafe,True,0.9752390505302336,,1663.58,,1.3256,True,country_mean,1255.0,from_argentina_cambio_dolar,EN,discard,keep_imputed,no_category_detected;price_parse_failed,dataset/txt_limpios/553.txt,dataset/paginas_descargadas/553.html
555,Elegí tu envío,"Hola, Limpía tú cache",1 Kg,AR,Desconocido,unknown,cafe,cafe,,False,0.0,990.0,990.0,0.7888,0.7888,False,original,1255.0,from_argentina_cambio_dolar,ET,keep,keep,heuristic_default,dataset/txt_limpios/555.txt,dataset/paginas_descargadas/555.html
556,Elegí tu envío,"Hola, Limpía tú cache",,AR,Desconocido,unknown,cafe,sin_categoria,cafe,True,0.9752390505302336,,1663.58,,1.3256,True,country_mean,1255.0,from_argentina_cambio_dolar,EN,discard,keep_imputed,no_category_detected;price_parse_failed,dataset/txt_limpios/556.txt,dataset/paginas_descargadas/556.html
557,Elegí tu envío,"Hola, Limpía tú cache",,AR,Desconocido,unknown,cafe,sin_categoria,cafe,True,0.9752390505302336,,1663.58,,1.3256,True,country_mean,1255.0,from_argentina_cambio_dolar,EN,discard,keep_imputed,no_category_detected;price_parse_failed,dataset/txt_limpios/557.txt,dataset/paginas_descargadas/557.html
558,Elegí tu envío,"Hola, Limpía tú cache",500 Gr,AR,Desconocido,unknown,cafe,sin_categoria,cafe,True,0.9918937449642352,590.0,590.0,0.4701,0.4701,False,original,1255.0,from_argentina_cambio_dolar,EN,discard,keep_imputed,no_category_detected,dataset/txt_limpios/558.txt,dataset/paginas_descargadas/558.html
559,Elegí tu envío,"Hola, Limpía tú cache",500 Gr,AR,Desconocido,unknown,cafe,sin_categoria,cafe,True,0.9918937449642352,1.5,1.5,0.0012,0.0012,False,original,1255.0,from_argentina_cambio_dolar,EN,discard,keep_imputed,no_category_detected,dataset/txt_limpios/559.txt,dataset/paginas_descargadas/559.html
560,Elegí tu envío,"Hola, Limpía tú cache",500 Gr,AR,Desconocido,unknown,cafe,sin_categoria,cafe,True,0.9918937449642352,1.75,1.75,0.0014,0.0014,False,original,1255.0,from_argentina_cambio_dolar,EN,discard,keep_imputed,no_category_detected,dataset/txt_limpios/560.txt,dataset/paginas_descargadas/560.html
561,Elegí tu envío,"Hola, Limpía tú cache",500 Gr,AR,Desconocido,unknown,cafe,sin_categoria,cafe,True,0.9918937449642352,1.18,1.18,0.0009,0.0009,False,original,1255.0,from_argentina_cambio_dolar,EN,discard,keep_imputed,no_category_detected,dataset/txt_limpios/561.txt,dataset/paginas_descargadas/561.html
562,Elegí tu envío,"Hola, Limpía tú cache",500 Gr,AR,Desconocido,unknown,cafe,sin_categoria,cafe,True,0.9918937449642352,3.19,3.19,0.0025,0.0025,False,original,1255.0,from_argentina_cambio_dolar,EN,discard,keep_imputed,no_category_detected,dataset/txt_limpios/562.txt,dataset/paginas_descargadas/562.html
564,Elegí tu envío,"Hola, Limpía tú cache",800 Gr,AR,Desconocido,unknown,cafe,sin_categoria,cafe,True,0.9854484801908892,3.0,3.0,0.0024,0.0024,False,original,1255.0,from_argentina_cambio_dolar,EN,discard,keep_imputed,no_category_detected,dataset/txt_limpios/564.txt,dataset/paginas_descargadas/564.html
565,Elegí tu envío,"Hola, Limpía tú cache",1 Kg,AR,Desconocido,unknown,cafe,sin_categoria,cafe,True,0.938905128626353,2.79,2.79,0.0022,0.0022,False,original,1255.0,from_argentina_cambio_dolar,EN,discard,keep_imputed,no_category_detected,dataset/txt_limpios/565.txt,dataset/paginas_descargadas/565.html
566,Elegí tu envío,"Hola, Limpía tú cache",,AR,Desconocido,unknown,cafe,sin_categoria,cafe,True,0.9752390505302336,4.19,4.19,0.0033,0.0033,False,original,1255.0,from_argentina_cambio_dolar,EN,discard,keep_imputed,no_category_detected,dataset/txt_limpios/566.txt,dataset/paginas_descargadas/566.html
568,Elegí tu envío,"Hola, Limpía tú cache",1 Kg,AR,Desconocido,unknown,cafe,sin_categoria,cafe,True,0.938905128626353,11.9,11.9,0.0095,0.0095,False,original,1255.0,from_argentina_cambio_dolar,EN,discard,keep_imputed,no_category_detected,dataset/txt_limpios/568.txt,dataset/paginas_descargadas/568.html
569,Elegí tu envío,"Hola, Limpía tú cache",400 Gr,AR,Desconocido,unknown,cafe,sin_categoria,cafe,True,0.991584674337776,400.0,400.0,0.3187,0.3187,False,original,1255.0,from_argentina_cambio_dolar,EN,discard,keep_imputed,no_category_detected,dataset/txt_limpios/569.txt,dataset/paginas_descargadas/569.html
571,Elegí tu envío,"Hola, Limpía tú cache",250 Gr,AR,Desconocido,unknown,cafe,cafe,,False,0.0,250.0,250.0,0.1992,0.1992,False,original,1255.0,from_argentina_cambio_dolar,ET,keep,keep,heuristic_default,dataset/txt_limpios/571.txt,dataset/paginas_descargadas/571.html
572,Elegí tu envío,"Hola, Limpía tú cache",2.25 Lt,AR,Desconocido,unknown,cafe,sin_categoria,cafe,True,0.6071327095999743,4.6,4.6,0.0037,0.0037,False,original,1255.0,from_argentina_cambio_dolar,EN,discard,keep_imputed,no_category_detected,dataset/txt_limpios/572.txt,dataset/paginas_descargadas/572.html
575,Elegí tu envío,"Hola, Limpía tú cache","2,25 Lt",AR,Desconocido,unknown,cafe,sin_categoria,cafe,True,0.6071327095999743,1.5,1.5,0.0012,0.0012,False,original,1255.0,from_argentina_cambio_dolar,EN,discard,keep_imputed,no_category_detected,dataset/txt_limpios/575.txt,dataset/paginas_descargadas/575.html
576,Elegí tu envío,"Hola, Limpía tú cache",,AR,Desconocido,unknown,cafe,sin_categoria,cafe,True,0.9752390505302336,,1663.58,,1.3256,True,country_mean,1255.0,from_argentina_cambio_dolar,EN,discard,keep_imputed,no_category_detected;price_parse_failed,dataset/txt_limpios/576.txt,dataset/paginas_descargadas/576.html
577,Elegí tu envío,"Hola, Limpía tú cache",1 Kg,AR,Desconocido,unknown,cafe,sin_categoria,cafe,True,0.938905128626353,890.0,890.0,0.7092,0.7092,False,original,1255.0,from_argentina_cambio_dolar,EN,discard,keep_imputed,no_category_detected,dataset/txt_limpios/577.txt,dataset/paginas_descargadas/577.html
578,Elegí tu envío,"Hola, Limpía tú cache",1 Kg,AR,Desconocido,unknown,cafe,sin_categoria,cafe,True,0.938905128626353,4.69,4.69,0.0037,0.0037,False,original,1255.0,from_argentina_cambio_dolar,EN,discard,keep_imputed,no_category_detected,dataset/txt_limpios/578.txt,dataset/paginas_descargadas/578.html
1666,Elige un método de entrega,Unimarc,170 g,UNKNOWN,Desconocido,unknown,cafe,cafe,,False,0.0,6.2,6.2,6.2,6.2,False,original,1.0,default_1usd,EN,keep,keep,heuristic_default,dataset/txt_limpios/1666.txt,dataset/paginas_descargadas/1666.html
1668,Elige un método de entrega,Unimarc,227 g,UNKNOWN,Desconocido,unknown,cafe,cafe,,False,0.0,7.35,7.35,7.35,7.35,False,original,1.0,default_1usd,EN,keep,keep,heuristic_default,dataset/txt_limpios/1668.txt,dataset/paginas_descargadas/1668.html
1670,Elige un método de entrega,Unimarc,250 g,UNKNOWN,Desconocido,unknown,cafe,cafe,,False,0.0,5.29,5.29,5.29,5.29,False,original,1.0,default_1usd,EN,keep,keep,heuristic_default,dataset/txt_limpios/1670.txt,dataset/paginas_descargadas/1670.html
1671,Elige un método de entrega,Unimarc,2 Kg,UNKNOWN,Desconocido,unknown,papa,papa,,False,0.0,2.39,2.39,2.39,2.39,False,original,1.0,default_1usd,ET,keep,keep,heuristic_default,dataset/txt_limpios/1671.txt,dataset/paginas_descargadas/1671.html
1673,Elige un método de entrega,Unimarc,227 g,UNKNOWN,Desconocido,unknown,cafe,cafe,,False,0.0,14.19,14.19,14.19,14.19,False,original,1.0,default_1usd,EN,keep,keep,heuristic_default,dataset/txt_limpios/1673.txt,dataset/paginas_descargadas/1673.html
1677,Elige un método de entrega,Unimarc,1.3 Kg,UNKNOWN,Desconocido,unknown,papa,papa,,False,0.0,1.79,1.79,1.79,1.79,False,original,1.0,default_1usd,EN,keep,keep,heuristic_default,dataset/txt_limpios/1677.txt,dataset/paginas_descargadas/1677.html
1678,Elige un método de entrega,Unimarc,250 g,UNKNOWN,Desconocido,unknown,cafe,cafe,,False,0.0,5.49,5.49,5.49,5.49,False,original,1.0,default_1usd,ET,keep,keep,heuristic_default,dataset/txt_limpios/1678.txt,dataset/paginas_descargadas/1678.html
1682,Elige un método de entrega,Unimarc,500 g,UNKNOWN,Desconocido,unknown,papa,papa,,False,0.0,695.0,695.0,695.0,695.0,False,original,1.0,default_1usd,EN,keep,keep,heuristic_default,dataset/txt_limpios/1682.txt,dataset/paginas_descargadas/1682.html
1685,Elige un método de entrega,Unimarc,750 g,UNKNOWN,Desconocido,unknown,pan,pan,,False,0.0,2.95,2.95,2.95,2.95,False,original,1.0,default_1usd,ET,keep,keep,heuristic_default,dataset/txt_limpios/1685.txt,dataset/paginas_descargadas/1685.html
1686,Elige un método de entrega,Unimarc,750 g,UNKNOWN,Desconocido,unknown,pan,pan,,False,0.0,2.75,2.75,2.75,2.75,False,original,1.0,default_1usd,EN,keep,keep,heuristic_default,dataset/txt_limpios/1686.txt,dataset/paginas_descargadas/1686.html
1688,Elige un método de entrega,Unimarc,1.5 L,UNKNOWN,Desconocido,unknown,refresco de cola,refresco de cola,,False,0.0,1.99,1.99,1.99,1.99,False,original,1.0,default_1usd,ET,keep,keep,heuristic_default,dataset/txt_limpios/1688.txt,dataset/paginas_descargadas/1688.html
1690,Elige un método de entrega,Unimarc,1.5 L,UNKNOWN,Desconocido,unknown,papa,sin_categoria,papa,True,0.9999999999997796,2.0,2.0,2.0,2.0,False,original,1.0,default_1usd,EN,discard,keep_imputed,no_category_detected,dataset/txt_limpios/1690.txt,dataset/paginas_descargadas/1690.html
1693,Elige un método de entrega,Unimarc,750 g,UNKNOWN,Desconocido,unknown,pan,pan,,False,0.0,2.51,2.51,2.51,2.51,False,original,1.0,default_1usd,EN,keep,keep,heuristic_default,dataset/txt_limpios/1693.txt,dataset/paginas_descargadas/1693.html
1694,Elige un método de entrega,Unimarc,650 g,UNKNOWN,Desconocido,unknown,cafe,sin_categoria,cafe,True,0.6285082258650191,2.53,2.53,2.53,2.53,False,original,1.0,default_1usd,EN,discard,keep_imputed,no_category_detected,dataset/txt_limpios/1694.txt,dataset/paginas_descargadas/1694.html
1695,Elige un método de entrega,Unimarc,1.5 L,UNKNOWN,Desconocido,unknown,papa,sin_categoria,papa,True,0.9999403319719748,2.0,2.0,2.0,2.0,False,original,1.0,default_1usd,ET,discard,keep_imputed,no_category_detected,dataset/txt_limpios/1695.txt,dataset/paginas_descargadas/1695.html
1696,Elige un método de entrega,Unimarc,1.5 L,UNKNOWN,Desconocido,unknown,papa,sin_categoria,papa,True,0.9999998943266938,2.0,2.0,2.0,2.0,False,original,1.0,default_1usd,ET,discard,keep_imputed,no_category_detected,dataset/txt_limpios/1696.txt,dataset/paginas_descargadas/1696.html
1697,Elige un método de entrega,Unimarc,300 g,UNKNOWN,Desconocido,unknown,cafe,sin_categoria,cafe,True,0.8021958076938154,1.99,1.99,1.99,1.99,False,original,1.0,default_1usd,EN,discard,keep_imputed,no_category_detected,dataset/txt_limpios/1697.txt,dataset/paginas_descargadas/1697.html
1698,Elige un método de entrega,Unimarc,500 g,UNKNOWN,Desconocido,unknown,papa,sin_categoria,papa,True,0.9999981494965752,1.14,1.14,1.14,1.14,False,original,1.0,default_1usd,ET,discard,keep_imputed,no_category_detected,dataset/txt_limpios/1698.txt,dataset/paginas_descargadas/1698.html
1699,Elige un método de entrega,Unimarc,250 g,UNKNOWN,Desconocido,unknown,cafe,sin_categoria,cafe,True,0.8369399469201205,1.25,1.25,1.25,1.25,False,original,1.0,default_1usd,EN,discard,keep_imputed,no_category_detected,dataset/txt_limpios/1699.txt,dataset/paginas_descargadas/1699.html
1700,Elige un método de entrega,Unimarc,1 Kg,UNKNOWN,Desconocido,unknown,papa,sin_categoria,papa,True,0.7437280936938774,1.8,1.8,1.8,1.8,False,original,1.0,default_1usd,EN,discard,keep_imputed,no_category_detected,dataset/txt_limpios/1700.txt,dataset/paginas_descargadas/1700.html
1701,Elige un método de entrega,Unimarc,12 unidad,UNKNOWN,Desconocido,unknown,huevo,huevo,,False,0.0,4.09,4.09,4.09,4.09,False,original,1.0,default_1usd,ET,discard,keep_imputed,heuristic_default,dataset/txt_limpios/1701.txt,dataset/paginas_descargadas/1701.html
1702,Elige un método de entrega,Unimarc,12 unidad,UNKNOWN,Desconocido,unknown,huevo,sin_categoria,huevo,True,0.8432772963090011,3.89,3.89,3.89,3.89,False,original,1.0,default_1usd,EN,discard,keep_imputed,no_category_detected,dataset/txt_limpios/1702.txt,dataset/paginas_descargadas/1702.html
1703,Elige un método de entrega,Unimarc,2 L,UNKNOWN,Desconocido,unknown,papa,sin_categoria,papa,True,0.999999998339956,2.0,2.0,2.0,2.0,False,original,1.0,default_1usd,EN,discard,keep_imputed,no_category_detected,dataset/txt_limpios/1703.txt,dataset/paginas_descargadas/1703.html
1705,Elige un método de entrega,Unimarc,20 unidad,UNKNOWN,Desconocido,unknown,huevo,sin_categoria,huevo,True,0.8436356824121032,6.59,6.59,6.59,6.59,False,original,1.0,default_1usd,EN,discard,keep_imputed,no_category_detected,dataset/txt_limpios/1705.txt,dataset/paginas_descargadas/1705.html
1707,Elige un método de entrega,Unimarc,12 unidad,UNKNOWN,Desconocido,unknown,huevo,sin_categoria,huevo,True,0.8432772963090011,3.97,3.97,3.97,3.97,False,original,1.0,default_1usd,EN,discard,keep_imputed,no_category_detected,dataset/txt_limpios/1707.txt,dataset/paginas_descargadas/1707.html
1709,Elige un método de entrega,Unimarc,12 unidad,UNKNOWN,Desconocido,unknown,huevo,huevo,,False,0.0,5.19,5.19,5.19,5.19,False,original,1.0,default_1usd,EN,discard,keep_imputed,heuristic_default,dataset/txt_limpios/1709.txt,dataset/paginas_descargadas/1709.html
1718,Elige un método de entrega,Unimarc,500 g,UNKNOWN,Desconocido,unknown,cafe,sin_categoria,cafe,True,0.9978502258747536,1.29,1.29,1.29,1.29,False,original,1.0,default_1usd,EN,discard,keep_imputed,no_category_detected,dataset/txt_limpios/1718.txt,dataset/paginas_descargadas/1718.html
1720,Elige un método de entrega,Unimarc,400 g,UNKNOWN,Desconocido,unknown,huevo,sin_categoria,huevo,True,0.9999999999999998,690.0,690.0,690.0,690.0,False,original,1.0,default_1usd,EN,discard,keep_imputed,no_category_detected,dataset/txt_limpios/1720.txt,dataset/paginas_descargadas/1720.html
1723,Elige un método de entrega,Unimarc,400 g,UNKNOWN,Desconocido,unknown,huevo,huevo,,False,0.0,1.33,1.33,1.33,1.33,False,original,1.0,default_1usd,ET,discard,keep_imputed,heuristic_default,dataset/txt_limpios/1723.txt,dataset/paginas_descargadas/1723.html
1725,Elige un método de entrega,Unimarc,400 g,UNKNOWN,Desconocido,unknown,huevo,sin_categoria,huevo,True,0.9999999999742046,2.0,2.0,2.0,2.0,False,original,1.0,default_1usd,ET,discard,keep_imputed,no_category_detected,dataset/txt_limpios/1725.txt,dataset/paginas_descargadas/1725.html
1729,Elige un método de entrega,Unimarc,3 Kg,UNKNOWN,Desconocido,unknown,papa,sin_categoria,papa,True,0.7437280936938774,11.97,11.97,11.97,11.97,False,original,1.0,default_1usd,EN,discard,keep_imputed,no_category_detected,dataset/txt_limpios/1729.txt,dataset/paginas_descargadas/1729.html
1731,Elige un método de entrega,Unimarc,400 g,UNKNOWN,Desconocido,unknown,huevo,sin_categoria,huevo,True,0.999999936563716,490.0,490.0,490.0,490.0,False,original,1.0,default_1usd,EN,discard,keep_imputed,no_category_detected,dataset/txt_limpios/1731.txt,dataset/paginas_descargadas/1731.html
1289,"Este gato no debería estar en esta caja, ni tú en esta página",Live Chat,,UNKNOWN,Desconocido,unknown,leche,sin_categoria,leche,True,0.9433944455928784,,234.19,,234.1938,True,country_mean,1.0,default_1usd,EN,discard,keep_imputed,no_category_detected;price_parse_failed,dataset/txt_limpios/1289.txt,dataset/paginas_descargadas/1289.html
1297,"Este gato no debería estar en esta caja, ni tú en esta página",Live Chat,,UNKNOWN,Desconocido,unknown,leche,sin_categoria,leche,True,0.9433944455928784,,234.19,,234.1938,True,country_mean,1.0,default_1usd,EN,discard,keep_imputed,no_category_detected;price_parse_failed,dataset/txt_limpios/1297.txt,dataset/paginas_descargadas/1297.html
1738,Fiambres y Huevos,Huevos,12Unidades,UNKNOWN,Desconocido,unknown,azucar,azucar,,False,0.0,3.85,3.85,3.85,3.85,False,original,1.0,default_1usd,ET,keep,keep,heuristic_default,dataset/txt_limpios/1738.txt,dataset/paginas_descargadas/1738.html
1751,Fiambres y Huevos,Huevos,648g,UNKNOWN,Desconocido,unknown,azucar,azucar,,False,0.0,4.2,4.2,4.2,4.2,False,original,1.0,default_1usd,ET,keep,keep,heuristic_default,dataset/txt_limpios/1751.txt,dataset/paginas_descargadas/1751.html
1752,Fiambres y Huevos,Huevos,648g,UNKNOWN,Desconocido,unknown,azucar,azucar,,False,0.0,4.1,4.1,4.1,4.1,False,original,1.0,default_1usd,ET,keep,keep,heuristic_default,dataset/txt_limpios/1752.txt,dataset/paginas_descargadas/1752.html
1754,Fiambres y Huevos,Huevos,732g,UNKNOWN,Desconocido,unknown,azucar,azucar,,False,0.0,4.69,4.69,4.69,4.69,False,original,1.0,default_1usd,ET,keep,keep,heuristic_default,dataset/txt_limpios/1754.txt,dataset/paginas_descargadas/1754.html
1755,Fiambres y Huevos,Huevos,648 G,UNKNOWN,Desconocido,unknown,huevo,huevo,,False,0.0,5.9,5.9,5.9,5.9,False,original,1.0,default_1usd,EN,discard,keep_imputed,heuristic_default,dataset/txt_limpios/1755.txt,dataset/paginas_descargadas/1755.html
1710,Frutas y Verduras,Verduras,500 g,UNKNOWN,Desconocido,unknown,cebolla,cebolla,,False,0.0,1.69,1.69,1.69,1.69,False,original,1.0,default_1usd,ET,keep,keep,heuristic_default,dataset/txt_limpios/1710.txt,dataset/paginas_descargadas/1710.html
1734,Frutas y Verduras,Verduras,1 Kg,UNKNOWN,Desconocido,unknown,cebolla,cebolla,,False,0.0,2.19,2.19,2.19,2.19,False,original,1.0,default_1usd,ET,keep,keep,heuristic_default,dataset/txt_limpios/1734.txt,dataset/paginas_descargadas/1734.html
1739,Frutas y Verduras,Verduras,250 g,UNKNOWN,Desconocido,unknown,tomates,tomates,,False,0.0,1.92,1.92,1.92,1.92,False,original,1.0,default_1usd,ET,keep,keep,heuristic_default,dataset/txt_limpios/1739.txt,dataset/paginas_descargadas/1739.html
39,Frutas y verduras,Verduras,,MX,Chedraui,unknown,cebolla,cebolla,,False,0.0,,12679.94,,680.985,True,category_mean,18.62,from_mexico_cambio_dolar,ET,discard,keep_imputed,price_parse_failed;price<=0,dataset/txt_limpios/39.txt,dataset/paginas_descargadas/39.html
538,Frutas Y Verduras,Verduras,2.25 L,UNKNOWN,Desconocido,unknown,papa,sin_categoria,papa,True,0.9999999026316992,2300.0,2300.0,2300.0,2300.0,False,original,1.0,default_1usd,ET,discard,keep_imputed,no_category_detected,dataset/txt_limpios/538.txt,dataset/paginas_descargadas/538.html
539,Frutas Y Verduras,Verduras,500g,UNKNOWN,Desconocido,unknown,papa,sin_categoria,papa,True,0.9986433732731222,599.0,599.0,599.0,599.0,False,original,1.0,default_1usd,ET,discard,keep_imputed,no_category_detected,dataset/txt_limpios/539.txt,dataset/paginas_descargadas/539.html
540,Frutas Y Verduras,Verduras,600 Gr,UNKNOWN,Desconocido,unknown,papa,sin_categoria,papa,True,0.9997946006824394,3049.0,3049.0,3049.0,3049.0,False,original,1.0,default_1usd,ET,discard,keep_imputed,no_category_detected,dataset/txt_limpios/540.txt,dataset/paginas_descargadas/540.html
541,Frutas Y Verduras,Verduras,600 Gr,UNKNOWN,Desconocido,unknown,papa,sin_categoria,papa,True,0.9999969248482048,7999.0,7999.0,7999.0,7999.0,False,original,1.0,default_1usd,ET,discard,keep_imputed,no_category_detected,dataset/txt_limpios/541.txt,dataset/paginas_descargadas/541.html
542,Frutas Y Verduras,Verduras,600 Gr,UNKNOWN,Desconocido,unknown,papa,sin_categoria,papa,True,0.9999462827711264,2799.0,2799.0,2799.0,2799.0,False,original,1.0,default_1usd,ET,discard,keep_imputed,no_category_detected,dataset/txt_limpios/542.txt,dataset/paginas_descargadas/542.html
543,Frutas Y Verduras,Verduras,300 Gr,UNKNOWN,Desconocido,unknown,papa,sin_categoria,papa,True,0.7131935379598847,2999.0,2999.0,2999.0,2999.0,False,original,1.0,default_1usd,ET,discard,keep_imputed,no_category_detected,dataset/txt_limpios/543.txt,dataset/paginas_descargadas/543.html
33,Harinas y reposteria,San Blas,500g,MX,Chedraui,unknown,harina de trigo,harina de trigo,,False,0.0,,2902.4,,155.8757,True,category_mean,18.62,from_mexico_cambio_dolar,ET,discard,keep_imputed,price_parse_failed;price<=0,dataset/txt_limpios/33.txt,dataset/paginas_descargadas/33.html
