source_id,product_name,brand,unit,country,seller,availability,category_effective,category_canonical,category_canonical_imputed,category_is_imputed,category_model_confidence,price_amount,price_amount_filled,price_amount_usd,price_amount_usd_filled,price_is_imputed,price_imputation_source,fx_rate_local_per_usd,fx_source,es_status,decision,decision_imputed,reasons,txt_path,html_path
133,¡Lo mejor te está esperando!,Descarga la app,200 G,UNKNOWN,Desconocido,unknown,cafe,cafe,,False,0.0,149.9,149.9,149.9,149.9,False,original,1.0,default_1usd,EN,keep,keep,heuristic_default,dataset/txt_limpios/133.txt,dataset/paginas_descargadas/133.html
134,¡Lo mejor te está esperando!,Descarga la app,226 G,UNKNOWN,Desconocido,unknown,cafe,cafe,,False,0.0,224.9,224.9,224.9,224.9,False,original,1.0,default_1usd,EN,keep,keep,heuristic_default,dataset/txt_limpios/134.txt,dataset/paginas_descargadas/134.html
135,¡Lo mejor te está esperando!,Descarga la app,250 Gr,UNKNOWN,Desconocido,unknown,cafe,cafe,,False,0.0,114.9,114.9,114.9,114.9,False,original,1.0,default_1usd,EN,keep,keep,heuristic_default,dataset/txt_limpios/135.txt,dataset/paginas_descargadas/135.html
136,¡Lo mejor te está esperando!,Descarga la app,30 piezas,UNKNOWN,Desconocido,unknown,leche,leche,,False,0.0,99.9,99.9,99.9,99.9,False,original,1.0,default_1usd,EN,keep,keep,heuristic_default,dataset/txt_limpios/136.txt,dataset/paginas_descargadas/136.html
138,¡Lo mejor te está esperando!,Descarga la app,30 unidades,UNKNOWN,Desconocido,unknown,leche,leche,,False,0.0,91.9,91.9,91.9,91.9,False,original,1.0,default_1usd,EN,keep,keep,heuristic_default,dataset/txt_limpios/138.txt,dataset/paginas_descargadas/138.html
139,¡Lo mejor te está esperando!,Descarga la app,30 piezas,UNKNOWN,Desconocido,unknown,leche,leche,,False,0.0,91.9,91.9,91.9,91.9,False,original,1.0,default_1usd,EN,keep,keep,heuristic_default,dataset/txt_limpios/139.txt,dataset/paginas_descargadas/139.html
140,¡Lo mejor te está esperando!,Descarga la app,30 piezas,UNKNOWN,Desconocido,unknown,leche,leche,,False,0.0,98.9,98.9,98.9,98.9,False,original,1.0,default_1usd,EN,keep,keep,heuristic_default,dataset/txt_limpios/140.txt,dataset/paginas_descargadas/140.html
141,¡Lo mejor te está esperando!,Descarga la app,1 Kg,UNKNOWN,Desconocido,unknown,arroz,arroz,,False,0.0,104.9,104.9,104.9,104.9,False,original,1.0,default_1usd,EN,keep,keep,heuristic_default,dataset/txt_limpios/141.txt,dataset/paginas_descargadas/141.html
142,¡Lo mejor te está esperando!,Descarga la app,1 Kg,UNKNOWN,Desconocido,unknown,pan,pan,,False,0.0,16.9,16.9,16.9,16.9,False,original,1.0,default_1usd,EN,keep,keep,heuristic_default,dataset/txt_limpios/142.txt,dataset/paginas_descargadas/142.html
143,¡Lo mejor te está esperando!,Descarga la app,5 Lb,UNKNOWN,Desconocido,unknown,arroz,arroz,,False,0.0,309.9,309.9,309.9,309.9,False,original,1.0,default_1usd,EN,keep,keep,heuristic_default,dataset/txt_limpios/143.txt,dataset/paginas_descargadas/143.html
144,¡Lo mejor te está esperando!,Descarga la app,1 Kg,UNKNOWN,Desconocido,unknown,arroz,arroz,,False,0.0,15.9,15.9,15.9,15.9,False,original,1.0,default_1usd,EN,keep,keep,heuristic_default,dataset/txt_limpios/144.txt,dataset/paginas_descargadas/144.html
145,¡Lo mejor te está esperando!,Descarga la app,1 Kg,UNKNOWN,Desconocido,unknown,pan,pan,,False,0.0,21.9,21.9,21.9,21.9,False,original,1.0,default_1usd,EN,keep,keep,heuristic_default,dataset/txt_limpios/145.txt,dataset/paginas_descargadas/145.html
146,¡Lo mejor te está esperando!,Descarga la app,1 kg,UNKNOWN,Desconocido,unknown,papa,papa,,False,0.0,36.9,36.9,36.9,36.9,False,original,1.0,default_1usd,EN,keep,keep,heuristic_default,dataset/txt_limpios/146.txt,dataset/paginas_descargadas/146.html
40,¡Nueva tarjeta de crédito HEB Afirme!,Consigue la tuya aquí,900 g,MX,Desconocido,unknown,huevo,sin_categoria,huevo,True,0.9842177581464364,38.9,38.9,2.0892,2.0892,False,original,18.62,from_mexico_cambio_dolar,EN,discard,keep_imputed,no_category_detected,dataset/txt_limpios/40.txt,dataset/paginas_descargadas/40.html
41,¡Nueva tarjeta de crédito HEB Afirme!,Consigue la tuya aquí,1 kg,MX,Desconocido,unknown,azucar,sin_categoria,azucar,True,0.9999999521502816,28.9,28.9,1.5521,1.5521,False,original,18.62,from_mexico_cambio_dolar,EN,discard,keep_imputed,no_category_detected,dataset/txt_limpios/41.txt,dataset/paginas_descargadas/41.html
43,¡Nueva tarjeta de crédito HEB Afirme!,Consigue la tuya aquí,1 kg,MX,Desconocido,unknown,huevo,sin_categoria,huevo,True,1.0,36.9,36.9,1.9817,1.9817,False,original,18.62,from_mexico_cambio_dolar,EN,discard,keep_imputed,no_category_detected,dataset/txt_limpios/43.txt,dataset/paginas_descargadas/43.html
45,¡Nueva tarjeta de crédito HEB Afirme!,Consigue la tuya aquí,1 L,MX,Desconocido,unknown,huevo,sin_categoria,huevo,True,0.9999992735589968,37.0,37.0,1.9871,1.9871,False,original,18.62,from_mexico_cambio_dolar,EN,discard,keep_imputed,no_category_detected,dataset/txt_limpios/45.txt,dataset/paginas_descargadas/45.html
46,¡Nueva tarjeta de crédito HEB Afirme!,Consigue la tuya aquí,900 Ml,MX,Desconocido,unknown,aceite vegetal,aceite vegetal,,False,0.0,34.9,34.9,1.8743,1.8743,False,original,18.62,from_mexico_cambio_dolar,EN,keep,keep,heuristic_default,dataset/txt_limpios/46.txt,dataset/paginas_descargadas/46.html
48,¡Nueva tarjeta de crédito HEB Afirme!,Consigue la tuya aquí,1 L,MX,Desconocido,unknown,huevo,sin_categoria,huevo,True,0.9999999994832548,33.0,33.0,1.7723,1.7723,False,original,18.62,from_mexico_cambio_dolar,EN,discard,keep_imputed,no_category_detected,dataset/txt_limpios/48.txt,dataset/paginas_descargadas/48.html
51,¡Nueva tarjeta de crédito HEB Afirme!,Consigue la tuya aquí,1 L,MX,Desconocido,unknown,huevo,sin_categoria,huevo,True,0.9999999601900058,37.0,37.0,1.9871,1.9871,False,original,18.62,from_mexico_cambio_dolar,EN,discard,keep_imputed,no_category_detected,dataset/txt_limpios/51.txt,dataset/paginas_descargadas/51.html
53,¡Nueva tarjeta de crédito HEB Afirme!,Consigue la tuya aquí,,MX,Desconocido,unknown,cafe,sin_categoria,cafe,True,0.60510308945855,56.0,56.0,3.0075,3.0075,False,original,18.62,from_mexico_cambio_dolar,EN,discard,keep_imputed,no_category_detected,dataset/txt_limpios/53.txt,dataset/paginas_descargadas/53.html
54,¡Nueva tarjeta de crédito HEB Afirme!,Consigue la tuya aquí,680 g,MX,Desconocido,unknown,azucar,sin_categoria,azucar,True,0.9999999999844328,35.0,35.0,1.8797,1.8797,False,original,18.62,from_mexico_cambio_dolar,EN,discard,keep_imputed,no_category_detected,dataset/txt_limpios/54.txt,dataset/paginas_descargadas/54.html
55,¡Nueva tarjeta de crédito HEB Afirme!,Consigue la tuya aquí,425 g,MX,Desconocido,unknown,azucar,azucar,,False,0.0,65.0,65.0,3.4909,3.4909,False,original,18.62,from_mexico_cambio_dolar,EN,keep,keep,heuristic_default,dataset/txt_limpios/55.txt,dataset/paginas_descargadas/55.html
56,¡Nueva tarjeta de crédito HEB Afirme!,Consigue la tuya aquí,900 g,MX,Desconocido,unknown,huevo,sin_categoria,huevo,True,1.0,21.0,21.0,1.1278,1.1278,False,original,18.62,from_mexico_cambio_dolar,EN,discard,keep_imputed,no_category_detected,dataset/txt_limpios/56.txt,dataset/paginas_descargadas/56.html
57,¡Nueva tarjeta de crédito HEB Afirme!,Consigue la tuya aquí,750 g,MX,Desconocido,unknown,azucar,azucar,,False,0.0,20.5,20.5,1.101,1.101,False,original,18.62,from_mexico_cambio_dolar,EN,keep,keep,heuristic_default,dataset/txt_limpios/57.txt,dataset/paginas_descargadas/57.html
58,¡Nueva tarjeta de crédito HEB Afirme!,Consigue la tuya aquí,907 g,MX,Desconocido,unknown,huevo,sin_categoria,huevo,True,0.7472565299729634,46.0,46.0,2.4705,2.4705,False,original,18.62,from_mexico_cambio_dolar,EN,discard,keep_imputed,no_category_detected,dataset/txt_limpios/58.txt,dataset/paginas_descargadas/58.html
59,¡Nueva tarjeta de crédito HEB Afirme!,Consigue la tuya aquí,120 g,MX,Desconocido,unknown,cafe,cafe,,False,0.0,98.0,98.0,5.2632,5.2632,False,original,18.62,from_mexico_cambio_dolar,EN,keep,keep,heuristic_default,dataset/txt_limpios/59.txt,dataset/paginas_descargadas/59.html
60,¡Nueva tarjeta de crédito HEB Afirme!,Consigue la tuya aquí,90 g,MX,Desconocido,unknown,cafe,cafe,,False,0.0,51.9,51.9,2.7873,2.7873,False,original,18.62,from_mexico_cambio_dolar,EN,keep,keep,heuristic_default,dataset/txt_limpios/60.txt,dataset/paginas_descargadas/60.html
61,¡Nueva tarjeta de crédito HEB Afirme!,Consigue la tuya aquí,100 g,MX,Desconocido,unknown,cafe,sin_categoria,cafe,True,0.8289099486089246,71.0,71.0,3.8131,3.8131,False,original,18.62,from_mexico_cambio_dolar,EN,discard,keep_imputed,no_category_detected,dataset/txt_limpios/61.txt,dataset/paginas_descargadas/61.html
62,¡Nueva tarjeta de crédito HEB Afirme!,Consigue la tuya aquí,180 Gr,MX,Desconocido,unknown,cafe,sin_categoria,cafe,True,0.9140892496545144,140.0,140.0,7.5188,7.5188,False,original,18.62,from_mexico_cambio_dolar,EN,discard,keep_imputed,no_category_detected,dataset/txt_limpios/62.txt,dataset/paginas_descargadas/62.html
64,¡Nueva tarjeta de crédito HEB Afirme!,Consigue la tuya aquí,60 g,MX,Desconocido,unknown,huevo,huevo,,False,0.0,79.9,79.9,4.2911,4.2911,False,original,18.62,from_mexico_cambio_dolar,EN,discard,keep_imputed,heuristic_default,dataset/txt_limpios/64.txt,dataset/paginas_descargadas/64.html
65,¡Nueva tarjeta de crédito HEB Afirme!,Consigue la tuya aquí,,MX,Desconocido,unknown,huevo,huevo,,False,0.0,59.9,59.9,3.217,3.217,False,original,18.62,from_mexico_cambio_dolar,EN,discard,keep_imputed,heuristic_default,dataset/txt_limpios/65.txt,dataset/paginas_descargadas/65.html
67,¡Nueva tarjeta de crédito HEB Afirme!,Consigue la tuya aquí,30 piezas,MX,Desconocido,unknown,huevo,sin_categoria,huevo,True,1.0,94.0,94.0,5.0483,5.0483,False,original,18.62,from_mexico_cambio_dolar,EN,discard,keep_imputed,no_category_detected,dataset/txt_limpios/67.txt,dataset/paginas_descargadas/67.html
68,¡Nueva tarjeta de crédito HEB Afirme!,Consigue la tuya aquí,,MX,Desconocido,unknown,cafe,sin_categoria,cafe,True,0.60510308945855,84.5,84.5,4.5381,4.5381,False,original,18.62,from_mexico_cambio_dolar,EN,discard,keep_imputed,no_category_detected,dataset/txt_limpios/68.txt,dataset/paginas_descargadas/68.html
69,¡Nueva tarjeta de crédito HEB Afirme!,Consigue la tuya aquí,1 Kg,MX,Desconocido,unknown,huevo,sin_categoria,huevo,True,0.9724211998488668,18.0,18.0,0.9667,0.9667,False,original,18.62,from_mexico_cambio_dolar,EN,discard,keep_imputed,no_category_detected,dataset/txt_limpios/69.txt,dataset/paginas_descargadas/69.html
70,¡Nueva tarjeta de crédito HEB Afirme!,Consigue la tuya aquí,1 kg,MX,Desconocido,unknown,huevo,sin_categoria,huevo,True,0.944317344449926,23.0,23.0,1.2352,1.2352,False,original,18.62,from_mexico_cambio_dolar,EN,discard,keep_imputed,no_category_detected,dataset/txt_limpios/70.txt,dataset/paginas_descargadas/70.html
73,¡Nueva tarjeta de crédito HEB Afirme!,Consigue la tuya aquí,1 kg,MX,Desconocido,unknown,huevo,sin_categoria,huevo,True,0.9999996572955638,24.0,24.0,1.2889,1.2889,False,original,18.62,from_mexico_cambio_dolar,EN,discard,keep_imputed,no_category_detected,dataset/txt_limpios/73.txt,dataset/paginas_descargadas/73.html
1749,¡Qué mal! Justo se agotó,ARIZTIA,1 Kg,UNKNOWN,Desconocido,unknown,aceite vegetal,aceite vegetal,,False,0.0,3.99,3.99,3.99,3.99,False,original,1.0,default_1usd,ET,keep,keep,heuristic_default,dataset/txt_limpios/1749.txt,dataset/paginas_descargadas/1749.html
1733,¿Cómo comprar?,Contáctanos al 800-8000-722,800 g,CR,Desconocido,unknown,huevo,sin_categoria,huevo,True,0.6163743914546527,1.7,1.7,0.0034,0.0034,False,original,503.8,from_costa_rica_cambio_dolar,EN,discard,keep_imputed,no_category_detected,dataset/txt_limpios/1733.txt,dataset/paginas_descargadas/1733.html
1103,¿Que buscas hoy?,Elegir,5kg,PE,Desconocido,unknown,arroz,arroz,,False,0.0,3.0,3.0,0.8451,0.8451,False,original,3.55,from_peru_cambio_dolar,EN,keep,keep,heuristic_default,dataset/txt_limpios/1103.txt,dataset/paginas_descargadas/1103.html
1105,¿Que buscas hoy?,Elegir,5 kg,PE,Desconocido,unknown,huevo,sin_categoria,huevo,True,0.7201795275833702,,55.14,,15.5336,True,country_mean,3.55,from_peru_cambio_dolar,EN,discard,keep_imputed,no_category_detected;price_parse_failed,dataset/txt_limpios/1105.txt,dataset/paginas_descargadas/1105.html
1106,¿Que buscas hoy?,Elegir,5kg,PE,Desconocido,unknown,arroz,arroz,,False,0.0,26.9,26.9,7.5775,7.5775,False,original,3.55,from_peru_cambio_dolar,EN,keep,keep,heuristic_default,dataset/txt_limpios/1106.txt,dataset/paginas_descargadas/1106.html
1107,¿Que buscas hoy?,Elegir,5 kg,PE,Desconocido,unknown,huevo,huevo,,False,0.0,24.9,24.9,7.0141,7.0141,False,original,3.55,from_peru_cambio_dolar,EN,discard,keep_imputed,heuristic_default,dataset/txt_limpios/1107.txt,dataset/paginas_descargadas/1107.html
1109,¿Que buscas hoy?,Elegir,,PE,Desconocido,unknown,arroz,arroz,,False,0.0,16.5,16.5,4.6479,4.6479,False,original,3.55,from_peru_cambio_dolar,EN,keep,keep,heuristic_default,dataset/txt_limpios/1109.txt,dataset/paginas_descargadas/1109.html
1110,¿Que buscas hoy?,Elegir,170g,PE,Desconocido,unknown,cafe,cafe,,False,0.0,37.0,37.0,10.4225,10.4225,False,original,3.55,from_peru_cambio_dolar,EN,keep,keep,heuristic_default,dataset/txt_limpios/1110.txt,dataset/paginas_descargadas/1110.html
1111,¿Que buscas hoy?,Elegir,454g,PE,Desconocido,unknown,cafe,cafe,,False,0.0,45.0,45.0,12.6761,12.6761,False,original,3.55,from_peru_cambio_dolar,EN,keep,keep,heuristic_default,dataset/txt_limpios/1111.txt,dataset/paginas_descargadas/1111.html
1112,¿Que buscas hoy?,Elegir,200g,PE,Desconocido,unknown,cafe,cafe,,False,0.0,27.9,27.9,7.8592,7.8592,False,original,3.55,from_peru_cambio_dolar,EN,keep,keep,heuristic_default,dataset/txt_limpios/1112.txt,dataset/paginas_descargadas/1112.html
1113,¿Que buscas hoy?,Elegir,250g,PE,Desconocido,unknown,huevo,sin_categoria,huevo,True,0.9989509122088164,,55.14,,15.5336,True,country_mean,3.55,from_peru_cambio_dolar,EN,discard,keep_imputed,no_category_detected;price_parse_failed,dataset/txt_limpios/1113.txt,dataset/paginas_descargadas/1113.html
1114,¿Que buscas hoy?,Elegir,500g,PE,Desconocido,unknown,cafe,cafe,,False,0.0,45.0,45.0,12.6761,12.6761,False,original,3.55,from_peru_cambio_dolar,EN,keep,keep,heuristic_default,dataset/txt_limpios/1114.txt,dataset/paginas_descargadas/1114.html
1115,¿Que buscas hoy?,Elegir,900ml,PE,Desconocido,unknown,atun,atun,,False,0.0,3.0,3.0,0.8451,0.8451,False,original,3.55,from_peru_cambio_dolar,EN,keep,keep,heuristic_default,dataset/txt_limpios/1115.txt,dataset/paginas_descargadas/1115.html
1116,¿Que buscas hoy?,Elegir,900ml,PE,Desconocido,unknown,aceite vegetal,aceite vegetal,,False,0.0,20.0,20.0,5.6338,5.6338,False,original,3.55,from_peru_cambio_dolar,EN,keep,keep,heuristic_default,dataset/txt_limpios/1116.txt,dataset/paginas_descargadas/1116.html
1117,¿Que buscas hoy?,Elegir,900ml,PE,Desconocido,unknown,aceite vegetal,aceite vegetal,,False,0.0,22.0,22.0,6.1972,6.1972,False,original,3.55,from_peru_cambio_dolar,EN,keep,keep,heuristic_default,dataset/txt_limpios/1117.txt,dataset/paginas_descargadas/1117.html
1118,¿Que buscas hoy?,Elegir,900ml,PE,Desconocido,unknown,aceite vegetal,aceite vegetal,,False,0.0,20.0,20.0,5.6338,5.6338,False,original,3.55,from_peru_cambio_dolar,EN,keep,keep,heuristic_default,dataset/txt_limpios/1118.txt,dataset/paginas_descargadas/1118.html
1119,¿Que buscas hoy?,Elegir,900ml,PE,Desconocido,unknown,papa,papa,,False,0.0,3.0,3.0,0.8451,0.8451,False,original,3.55,from_peru_cambio_dolar,EN,keep,keep,heuristic_default,dataset/txt_limpios/1119.txt,dataset/paginas_descargadas/1119.html
1120,¿Que buscas hoy?,Elegir,946ml,PE,Desconocido,unknown,leche,leche,,False,0.0,23.5,23.5,6.6197,6.6197,False,original,3.55,from_peru_cambio_dolar,EN,keep,keep,heuristic_default,dataset/txt_limpios/1120.txt,dataset/paginas_descargadas/1120.html
1121,¿Que buscas hoy?,Elegir,946ml,PE,Desconocido,unknown,huevo,sin_categoria,huevo,True,0.931951820625655,,55.14,,15.5336,True,country_mean,3.55,from_peru_cambio_dolar,EN,discard,keep_imputed,no_category_detected;price_parse_failed,dataset/txt_limpios/1121.txt,dataset/paginas_descargadas/1121.html
1122,¿Que buscas hoy?,Elegir,800ml,PE,Desconocido,unknown,leche,leche,,False,0.0,5.5,5.5,1.5493,1.5493,False,original,3.55,from_peru_cambio_dolar,EN,keep,keep,heuristic_default,dataset/txt_limpios/1122.txt,dataset/paginas_descargadas/1122.html
1124,¿Que buscas hoy?,Elegir,1L,PE,Desconocido,unknown,azucar,azucar,,False,0.0,11.9,11.9,3.3521,3.3521,False,original,3.55,from_peru_cambio_dolar,EN,keep,keep,heuristic_default,dataset/txt_limpios/1124.txt,dataset/paginas_descargadas/1124.html
1125,¿Que buscas hoy?,Elegir,30 unidades,PE,Desconocido,unknown,huevo,huevo,,False,0.0,11.9,11.9,3.3521,3.3521,False,original,3.55,from_peru_cambio_dolar,EN,discard,keep_imputed,heuristic_default,dataset/txt_limpios/1125.txt,dataset/paginas_descargadas/1125.html
1126,¿Que buscas hoy?,Elegir,30 Unidades,PE,Desconocido,unknown,huevo,huevo,,False,0.0,20.9,20.9,5.8873,5.8873,False,original,3.55,from_peru_cambio_dolar,EN,discard,keep_imputed,heuristic_default,dataset/txt_limpios/1126.txt,dataset/paginas_descargadas/1126.html
1127,¿Que buscas hoy?,Elegir,15 unidades,PE,Desconocido,unknown,huevo,huevo,,False,0.0,16.5,16.5,4.6479,4.6479,False,original,3.55,from_peru_cambio_dolar,EN,discard,keep_imputed,heuristic_default,dataset/txt_limpios/1127.txt,dataset/paginas_descargadas/1127.html
1128,¿Que buscas hoy?,Elegir,,PE,Desconocido,unknown,huevo,huevo,,False,0.0,11.9,11.9,3.3521,3.3521,False,original,3.55,from_peru_cambio_dolar,EN,discard,keep_imputed,heuristic_default,dataset/txt_limpios/1128.txt,dataset/paginas_descargadas/1128.html
1129,¿Que buscas hoy?,Elegir,30 unidades,PE,Desconocido,unknown,huevo,huevo,,False,0.0,16.5,16.5,4.6479,4.6479,False,original,3.55,from_peru_cambio_dolar,EN,discard,keep_imputed,heuristic_default,dataset/txt_limpios/1129.txt,dataset/paginas_descargadas/1129.html
1130,¿Que buscas hoy?,Elegir,5kg,PE,Desconocido,unknown,azucar,azucar,,False,0.0,3.0,3.0,0.8451,0.8451,False,original,3.55,from_peru_cambio_dolar,EN,keep,keep,heuristic_default,dataset/txt_limpios/1130.txt,dataset/paginas_descargadas/1130.html
1132,¿Que buscas hoy?,Elegir,5 kg,PE,Desconocido,unknown,azucar,azucar,,False,0.0,18.9,18.9,5.3239,5.3239,False,original,3.55,from_peru_cambio_dolar,EN,keep,keep,heuristic_default,dataset/txt_limpios/1132.txt,dataset/paginas_descargadas/1132.html
1133,¿Que buscas hoy?,Elegir,5 kg,PE,Desconocido,unknown,huevo,sin_categoria,huevo,True,0.7201795275833702,,55.14,,15.5336,True,country_mean,3.55,from_peru_cambio_dolar,EN,discard,keep_imputed,no_category_detected;price_parse_failed,dataset/txt_limpios/1133.txt,dataset/paginas_descargadas/1133.html
1134,¿Que buscas hoy?,Elegir,,PE,Desconocido,unknown,huevo,sin_categoria,huevo,True,0.8583322103919997,,55.14,,15.5336,True,country_mean,3.55,from_peru_cambio_dolar,EN,discard,keep_imputed,no_category_detected;price_parse_failed,dataset/txt_limpios/1134.txt,dataset/paginas_descargadas/1134.html
1135,¿Que buscas hoy?,Elegir,770g,PE,Desconocido,unknown,pan,pan,,False,0.0,16.5,16.5,4.6479,4.6479,False,original,3.55,from_peru_cambio_dolar,EN,keep,keep,heuristic_default,dataset/txt_limpios/1135.txt,dataset/paginas_descargadas/1135.html
1136,¿Que buscas hoy?,Elegir,600 g,PE,Desconocido,unknown,leche,leche,,False,0.0,600.0,600.0,169.0141,169.0141,False,original,3.55,from_peru_cambio_dolar,EN,keep,keep,heuristic_default,dataset/txt_limpios/1136.txt,dataset/paginas_descargadas/1136.html
1137,¿Que buscas hoy?,Elegir,560 g,PE,Desconocido,unknown,pan,pan,,False,0.0,10.9,10.9,3.0704,3.0704,False,original,3.55,from_peru_cambio_dolar,EN,keep,keep,heuristic_default,dataset/txt_limpios/1137.txt,dataset/paginas_descargadas/1137.html
1138,¿Que buscas hoy?,Elegir,540g,PE,Desconocido,unknown,leche,leche,,False,0.0,10.9,10.9,3.0704,3.0704,False,original,3.55,from_peru_cambio_dolar,EN,keep,keep,heuristic_default,dataset/txt_limpios/1138.txt,dataset/paginas_descargadas/1138.html
1139,¿Que buscas hoy?,Elegir,,PE,Desconocido,unknown,huevo,sin_categoria,huevo,True,0.8583322103919997,,55.14,,15.5336,True,country_mean,3.55,from_peru_cambio_dolar,EN,discard,keep_imputed,no_category_detected;price_parse_failed,dataset/txt_limpios/1139.txt,dataset/paginas_descargadas/1139.html
1140,¿Que buscas hoy?,Elegir,,PE,Desconocido,unknown,huevo,sin_categoria,huevo,True,0.8583322103919997,2.0,2.0,0.5634,0.5634,False,original,3.55,from_peru_cambio_dolar,EN,discard,keep_imputed,no_category_detected,dataset/txt_limpios/1140.txt,dataset/paginas_descargadas/1140.html
1141,¿Que buscas hoy?,Elegir,500g,PE,Desconocido,unknown,arroz,arroz,,False,0.0,6.1,6.1,1.7183,1.7183,False,original,3.55,from_peru_cambio_dolar,EN,keep,keep,heuristic_default,dataset/txt_limpios/1141.txt,dataset/paginas_descargadas/1141.html
1142,¿Que buscas hoy?,Elegir,500 g,PE,Desconocido,unknown,huevo,huevo,,False,0.0,500.0,500.0,140.8451,140.8451,False,original,3.55,from_peru_cambio_dolar,EN,discard,keep_imputed,heuristic_default,dataset/txt_limpios/1142.txt,dataset/paginas_descargadas/1142.html
1143,¿Que buscas hoy?,Elegir,500 g,PE,Desconocido,unknown,huevo,huevo,,False,0.0,,55.14,,15.5336,True,country_mean,3.55,from_peru_cambio_dolar,EN,discard,keep_imputed,price_parse_failed,dataset/txt_limpios/1143.txt,dataset/paginas_descargadas/1143.html
1144,¿Que buscas hoy?,Elegir,1kg,PE,Desconocido,unknown,huevo,huevo,,False,0.0,,55.14,,15.5336,True,country_mean,3.55,from_peru_cambio_dolar,EN,discard,keep_imputed,price_parse_failed,dataset/txt_limpios/1144.txt,dataset/paginas_descargadas/1144.html
1145,¿Que buscas hoy?,Elegir,150g,PE,Desconocido,unknown,atun,atun,,False,0.0,4.6,4.6,1.2958,1.2958,False,original,3.55,from_peru_cambio_dolar,EN,keep,keep,heuristic_default,dataset/txt_limpios/1145.txt,dataset/paginas_descargadas/1145.html
1146,¿Que buscas hoy?,Elegir,140g,PE,Desconocido,unknown,atun,atun,,False,0.0,3.6,3.6,1.0141,1.0141,False,original,3.55,from_peru_cambio_dolar,EN,keep,keep,heuristic_default,dataset/txt_limpios/1146.txt,dataset/paginas_descargadas/1146.html
