source_id,product_name,brand,unit,country,seller,availability,category_effective,category_canonical,category_canonical_imputed,category_is_imputed,category_model_confidence,price_amount,price_amount_filled,price_amount_usd,price_amount_usd_filled,price_is_imputed,price_imputation_source,fx_rate_local_per_usd,fx_source,es_status,decision,decision_imputed,reasons,txt_path,html_path
1625,Selecciona tu,Método de envío,540 G,CO,Desconocido,unknown,pan,pan,,False,0.0,,7.69,,0.0019,True,category_country_mean,4047.0,from_colombia_cambio_dolar,EN,discard,keep_imputed,price_parse_failed;price<=0,dataset/txt_limpios/1625.txt,dataset/paginas_descargadas/1625.html
1741,Selecciona tu,Método de envío,450 G,CO,Desconocido,unknown,cafe,cafe,,False,0.0,,97.32,,0.024,True,category_country_mean,4047.0,from_colombia_cambio_dolar,EN,discard,keep_imputed,price_parse_failed;price<=0,dataset/txt_limpios/1741.txt,dataset/paginas_descargadas/1741.html
702,Selecciona tu,Método de envío,,CO,Desconocido,unknown,huevo,huevo,,False,0.0,,100.78,,0.0249,True,country_mean,4047.0,from_colombia_cambio_dolar,EN,discard,keep_imputed,price_parse_failed,dataset/txt_limpios/702.txt,dataset/paginas_descargadas/702.html
703,Selecciona tu,Método de envío,,CO,Desconocido,unknown,cafe,cafe,,False,0.0,,97.32,,0.024,True,category_country_mean,4047.0,from_colombia_cambio_dolar,EN,discard,keep_imputed,price_parse_failed;price<=0,dataset/txt_limpios/703.txt,dataset/paginas_descargadas/703.html
704,Selecciona tu,Método de envío,30 Unidades,CO,Desconocido,unknown,cafe,cafe,,False,0.0,,97.32,,0.024,True,category_country_mean,4047.0,from_colombia_cambio_dolar,EN,discard,keep_imputed,price_parse_failed;price<=0,dataset/txt_limpios/704.txt,dataset/paginas_descargadas/704.html
705,Selecciona tu,Método de envío,1000 Ml,CO,Desconocido,unknown,cafe,cafe,,False,0.0,,97.32,,0.024,True,category_country_mean,4047.0,from_colombia_cambio_dolar,EN,discard,keep_imputed,price_parse_failed;price<=0,dataset/txt_limpios/705.txt,dataset/paginas_descargadas/705.html
706,Selecciona tu,Método de envío,5 Kg,CO,Desconocido,unknown,arroz,arroz,,False,0.0,,80817.34,,19.9697,True,category_mean,4047.0,from_colombia_cambio_dolar,EN,discard,keep_imputed,price_parse_failed;price<=0,dataset/txt_limpios/706.txt,dataset/paginas_descargadas/706.html
707,Selecciona tu,Método de envío,5 Kg,CO,Desconocido,unknown,cafe,cafe,,False,0.0,,97.32,,0.024,True,category_country_mean,4047.0,from_colombia_cambio_dolar,EN,discard,keep_imputed,price_parse_failed;price<=0,dataset/txt_limpios/707.txt,dataset/paginas_descargadas/707.html
708,Selecciona tu,Método de envío,10 Kg,CO,Desconocido,unknown,cafe,cafe,,False,0.0,,97.32,,0.024,True,category_country_mean,4047.0,from_colombia_cambio_dolar,EN,discard,keep_imputed,price_parse_failed;price<=0,dataset/txt_limpios/708.txt,dataset/paginas_descargadas/708.html
709,Selecciona tu,Método de envío,5 Kg,CO,Desconocido,unknown,cafe,cafe,,False,0.0,,97.32,,0.024,True,category_country_mean,4047.0,from_colombia_cambio_dolar,EN,discard,keep_imputed,price_parse_failed;price<=0,dataset/txt_limpios/709.txt,dataset/paginas_descargadas/709.html
710,Selecciona tu,Método de envío,3 Kg,CO,Desconocido,unknown,cafe,cafe,,False,0.0,,97.32,,0.024,True,category_country_mean,4047.0,from_colombia_cambio_dolar,EN,discard,keep_imputed,price_parse_failed;price<=0,dataset/txt_limpios/710.txt,dataset/paginas_descargadas/710.html
711,Selecciona tu,Método de envío,12.5 KG,CO,Desconocido,unknown,cafe,sin_categoria,cafe,True,1.0,,100.78,,0.0249,True,country_mean,4047.0,from_colombia_cambio_dolar,EN,discard,keep_imputed,no_category_detected;price_parse_failed,dataset/txt_limpios/711.txt,dataset/paginas_descargadas/711.html
712,Selecciona tu,Método de envío,650 G,CO,Desconocido,unknown,cafe,cafe,,False,0.0,250.0,250.0,0.0618,0.0618,False,original,4047.0,from_colombia_cambio_dolar,EN,keep,keep,heuristic_default,dataset/txt_limpios/712.txt,dataset/paginas_descargadas/712.html
713,Selecciona tu,Método de envío,400 G,CO,Desconocido,unknown,cafe,cafe,,False,0.0,,97.32,,0.024,True,category_country_mean,4047.0,from_colombia_cambio_dolar,EN,discard,keep_imputed,price_parse_failed;price<=0,dataset/txt_limpios/713.txt,dataset/paginas_descargadas/713.html
714,Selecciona tu,Método de envío,500 G,CO,Desconocido,unknown,cafe,cafe,,False,0.0,,97.32,,0.024,True,category_country_mean,4047.0,from_colombia_cambio_dolar,EN,discard,keep_imputed,price_parse_failed;price<=0,dataset/txt_limpios/714.txt,dataset/paginas_descargadas/714.html
716,Selecciona tu,Método de envío,540 G,CO,Desconocido,unknown,cafe,cafe,,False,0.0,,97.32,,0.024,True,category_country_mean,4047.0,from_colombia_cambio_dolar,EN,discard,keep_imputed,price_parse_failed;price<=0,dataset/txt_limpios/716.txt,dataset/paginas_descargadas/716.html
717,Selecciona tu,Método de envío,440 G,CO,Desconocido,unknown,cafe,cafe,,False,0.0,,97.32,,0.024,True,category_country_mean,4047.0,from_colombia_cambio_dolar,EN,discard,keep_imputed,price_parse_failed;price<=0,dataset/txt_limpios/717.txt,dataset/paginas_descargadas/717.html
719,Selecciona tu,Método de envío,1000 Ml,CO,Desconocido,unknown,leche,leche,,False,0.0,400.0,400.0,0.0988,0.0988,False,original,4047.0,from_colombia_cambio_dolar,EN,keep,keep,heuristic_default,dataset/txt_limpios/719.txt,dataset/paginas_descargadas/719.html
720,Selecciona tu,Método de envío,"1,1 Lt",CO,Desconocido,unknown,cafe,cafe,,False,0.0,,97.32,,0.024,True,category_country_mean,4047.0,from_colombia_cambio_dolar,EN,discard,keep_imputed,price_parse_failed;price<=0,dataset/txt_limpios/720.txt,dataset/paginas_descargadas/720.html
721,Selecciona tu,Método de envío,800 Ml,CO,Desconocido,unknown,cafe,sin_categoria,cafe,True,1.0,,100.78,,0.0249,True,country_mean,4047.0,from_colombia_cambio_dolar,EN,discard,keep_imputed,no_category_detected;price_parse_failed,dataset/txt_limpios/721.txt,dataset/paginas_descargadas/721.html
723,Selecciona tu,Método de envío,1 Kg,CO,Desconocido,unknown,cebolla,cebolla,,False,0.0,,2755946.3,,680.985,True,category_mean,4047.0,from_colombia_cambio_dolar,EN,discard,keep_imputed,price_parse_failed;price<=0,dataset/txt_limpios/723.txt,dataset/paginas_descargadas/723.html
724,Selecciona tu,Método de envío,1000 Gramos,CO,Desconocido,unknown,cafe,cafe,,False,0.0,,97.32,,0.024,True,category_country_mean,4047.0,from_colombia_cambio_dolar,EN,discard,keep_imputed,price_parse_failed;price<=0,dataset/txt_limpios/724.txt,dataset/paginas_descargadas/724.html
725,Selecciona tu,Método de envío,1000 Gramos,CO,Desconocido,unknown,cafe,cafe,,False,0.0,,97.32,,0.024,True,category_country_mean,4047.0,from_colombia_cambio_dolar,EN,discard,keep_imputed,price_parse_failed;price<=0,dataset/txt_limpios/725.txt,dataset/paginas_descargadas/725.html
726,Selecciona tu,Método de envío,1000 Gramos,CO,Desconocido,unknown,cafe,cafe,,False,0.0,,97.32,,0.024,True,category_country_mean,4047.0,from_colombia_cambio_dolar,EN,discard,keep_imputed,price_parse_failed;price<=0,dataset/txt_limpios/726.txt,dataset/paginas_descargadas/726.html
727,Selecciona tu,Método de envío,411 G,CO,Desconocido,unknown,cafe,cafe,,False,0.0,,97.32,,0.024,True,category_country_mean,4047.0,from_colombia_cambio_dolar,EN,discard,keep_imputed,price_parse_failed;price<=0,dataset/txt_limpios/727.txt,dataset/paginas_descargadas/727.html
728,Selecciona tu,Método de envío,1000 Gramos,CO,Desconocido,unknown,cafe,cafe,,False,0.0,,97.32,,0.024,True,category_country_mean,4047.0,from_colombia_cambio_dolar,EN,discard,keep_imputed,price_parse_failed;price<=0,dataset/txt_limpios/728.txt,dataset/paginas_descargadas/728.html
729,Selecciona tu,Método de envío,,CO,Desconocido,unknown,cafe,sin_categoria,cafe,True,1.0,,100.78,,0.0249,True,country_mean,4047.0,from_colombia_cambio_dolar,EN,discard,keep_imputed,no_category_detected;price_parse_failed,dataset/txt_limpios/729.txt,dataset/paginas_descargadas/729.html
730,Selecciona tu,Método de envío,1000 Gramos,CO,Desconocido,unknown,cebolla,cebolla,,False,0.0,,2755946.3,,680.985,True,category_mean,4047.0,from_colombia_cambio_dolar,EN,discard,keep_imputed,price_parse_failed;price<=0,dataset/txt_limpios/730.txt,dataset/paginas_descargadas/730.html
731,Selecciona tu,Método de envío,1 Kg,CO,Desconocido,unknown,cafe,cafe,,False,0.0,,97.32,,0.024,True,category_country_mean,4047.0,from_colombia_cambio_dolar,EN,discard,keep_imputed,price_parse_failed;price<=0,dataset/txt_limpios/731.txt,dataset/paginas_descargadas/731.html
732,Selecciona tu,Método de envío,"2,5 Kg",CO,Desconocido,unknown,cafe,cafe,,False,0.0,53.0,53.0,0.0131,0.0131,False,original,4047.0,from_colombia_cambio_dolar,EN,keep,keep,heuristic_default,dataset/txt_limpios/732.txt,dataset/paginas_descargadas/732.html
733,Selecciona tu,Método de envío,"2,5 Kg",CO,Desconocido,unknown,cafe,sin_categoria,cafe,True,1.0,,100.78,,0.0249,True,country_mean,4047.0,from_colombia_cambio_dolar,EN,discard,keep_imputed,no_category_detected;price_parse_failed,dataset/txt_limpios/733.txt,dataset/paginas_descargadas/733.html
734,Selecciona tu,Método de envío,1 Kg,CO,Desconocido,unknown,cafe,sin_categoria,cafe,True,1.0,,100.78,,0.0249,True,country_mean,4047.0,from_colombia_cambio_dolar,EN,discard,keep_imputed,no_category_detected;price_parse_failed,dataset/txt_limpios/734.txt,dataset/paginas_descargadas/734.html
735,Selecciona tu,Método de envío,1000 G,CO,Desconocido,unknown,cafe,cafe,,False,0.0,,97.32,,0.024,True,category_country_mean,4047.0,from_colombia_cambio_dolar,EN,discard,keep_imputed,price_parse_failed;price<=0,dataset/txt_limpios/735.txt,dataset/paginas_descargadas/735.html
736,Selecciona tu,Método de envío,1 Kg,CO,Desconocido,unknown,cafe,cafe,,False,0.0,,97.32,,0.024,True,category_country_mean,4047.0,from_colombia_cambio_dolar,EN,discard,keep_imputed,price_parse_failed;price<=0,dataset/txt_limpios/736.txt,dataset/paginas_descargadas/736.html
737,Selecciona tu,Método de envío,500 G,CO,Desconocido,unknown,cafe,cafe,,False,0.0,500.0,500.0,0.1235,0.1235,False,original,4047.0,from_colombia_cambio_dolar,EN,keep,keep,heuristic_default,dataset/txt_limpios/737.txt,dataset/paginas_descargadas/737.html
738,Selecciona tu,Método de envío,375 G,CO,Desconocido,unknown,cafe,cafe,,False,0.0,375.0,375.0,0.0927,0.0927,False,original,4047.0,from_colombia_cambio_dolar,EN,keep,keep,heuristic_default,dataset/txt_limpios/738.txt,dataset/paginas_descargadas/738.html
739,Selecciona tu,Método de envío,210gr,CO,Desconocido,unknown,cafe,sin_categoria,cafe,True,1.0,210.0,210.0,0.0519,0.0519,False,original,4047.0,from_colombia_cambio_dolar,EN,discard,keep_imputed,no_category_detected,dataset/txt_limpios/739.txt,dataset/paginas_descargadas/739.html
741,Selecciona tu,Método de envío,200 G,CO,Desconocido,unknown,cafe,cafe,,False,0.0,200.0,200.0,0.0494,0.0494,False,original,4047.0,from_colombia_cambio_dolar,EN,keep,keep,heuristic_default,dataset/txt_limpios/741.txt,dataset/paginas_descargadas/741.html
742,Selecciona tu,Método de envío,500 G,CO,Desconocido,unknown,cafe,cafe,,False,0.0,,97.32,,0.024,True,category_country_mean,4047.0,from_colombia_cambio_dolar,EN,discard,keep_imputed,price_parse_failed;price<=0,dataset/txt_limpios/742.txt,dataset/paginas_descargadas/742.html
743,Selecciona tu,Método de envío,1 Kg,CO,Desconocido,unknown,cafe,cafe,,False,0.0,,97.32,,0.024,True,category_country_mean,4047.0,from_colombia_cambio_dolar,EN,discard,keep_imputed,price_parse_failed;price<=0,dataset/txt_limpios/743.txt,dataset/paginas_descargadas/743.html
744,Selecciona tu,Método de envío,1 Kg,CO,Desconocido,unknown,azucar,azucar,,False,0.0,,604582.9,,149.3904,True,category_mean,4047.0,from_colombia_cambio_dolar,EN,discard,keep_imputed,price_parse_failed;price<=0,dataset/txt_limpios/744.txt,dataset/paginas_descargadas/744.html
745,Selecciona tu,Método de envío,"2,5 Kg",CO,Desconocido,unknown,cafe,cafe,,False,0.0,,97.32,,0.024,True,category_country_mean,4047.0,from_colombia_cambio_dolar,EN,discard,keep_imputed,price_parse_failed;price<=0,dataset/txt_limpios/745.txt,dataset/paginas_descargadas/745.html
746,Selecciona tu,Método de envío,"2,5 Kg",CO,Desconocido,unknown,cafe,cafe,,False,0.0,,97.32,,0.024,True,category_country_mean,4047.0,from_colombia_cambio_dolar,EN,discard,keep_imputed,price_parse_failed;price<=0,dataset/txt_limpios/746.txt,dataset/paginas_descargadas/746.html
747,Selecciona tu,Método de envío,"2,5 Kg",CO,Desconocido,unknown,cafe,cafe,,False,0.0,,97.32,,0.024,True,category_country_mean,4047.0,from_colombia_cambio_dolar,EN,discard,keep_imputed,price_parse_failed;price<=0,dataset/txt_limpios/747.txt,dataset/paginas_descargadas/747.html
1242,Selecciona un local,X,000 Ml,US,Desconocido,unknown,cafe,sin_categoria,cafe,True,0.7916882703533221,12.0,12.0,12.0,12.0,False,original,1.0,default_1usd,EN,discard,keep_imputed,no_category_detected,dataset/txt_limpios/1242.txt,dataset/paginas_descargadas/1242.html
1243,Selecciona un local,X,1000 Ml,US,Desconocido,unknown,cafe,sin_categoria,cafe,True,0.8947721063058766,12.0,12.0,12.0,12.0,False,original,1.0,default_1usd,EN,discard,keep_imputed,no_category_detected,dataset/txt_limpios/1243.txt,dataset/paginas_descargadas/1243.html
1244,Selecciona un local,X,1000 Ml,US,Desconocido,unknown,cafe,sin_categoria,cafe,True,0.8947721063058766,12.0,12.0,12.0,12.0,False,original,1.0,default_1usd,EN,discard,keep_imputed,no_category_detected,dataset/txt_limpios/1244.txt,dataset/paginas_descargadas/1244.html
1245,Selecciona un local,X,,US,Desconocido,unknown,cafe,sin_categoria,cafe,True,0.8699377891308989,12.0,12.0,12.0,12.0,False,original,1.0,default_1usd,EN,discard,keep_imputed,no_category_detected,dataset/txt_limpios/1245.txt,dataset/paginas_descargadas/1245.html
1246,Selecciona un local,X,1000 Ml,US,Desconocido,unknown,cafe,sin_categoria,cafe,True,0.8947721063058766,12.0,12.0,12.0,12.0,False,original,1.0,default_1usd,EN,discard,keep_imputed,no_category_detected,dataset/txt_limpios/1246.txt,dataset/paginas_descargadas/1246.html
1247,Selecciona un local,X,,UNKNOWN,Desconocido,unknown,cafe,sin_categoria,cafe,True,0.8699377891308989,12.0,12.0,12.0,12.0,False,original,1.0,default_1usd,EN,discard,keep_imputed,no_category_detected,dataset/txt_limpios/1247.txt,dataset/paginas_descargadas/1247.html
1248,Selecciona un local,X,250 Ml,US,Desconocido,unknown,cafe,sin_categoria,cafe,True,0.9617830415176164,12.0,12.0,12.0,12.0,False,original,1.0,default_1usd,EN,discard,keep_imputed,no_category_detected,dataset/txt_limpios/1248.txt,dataset/paginas_descargadas/1248.html
1249,Selecciona un local,X,355 ML,US,Desconocido,unknown,cafe,sin_categoria,cafe,True,0.8385211927608983,12.0,12.0,12.0,12.0,False,original,1.0,default_1usd,EN,discard,keep_imputed,no_category_detected,dataset/txt_limpios/1249.txt,dataset/paginas_descargadas/1249.html
1250,Selecciona un local,X,330 ML,US,Desconocido,unknown,azucar,sin_categoria,azucar,True,0.6400119219361239,12.0,12.0,12.0,12.0,False,original,1.0,default_1usd,EN,discard,keep_imputed,no_category_detected,dataset/txt_limpios/1250.txt,dataset/paginas_descargadas/1250.html
1253,Selecciona un local,X,550 G,US,Desconocido,unknown,cafe,sin_categoria,cafe,True,0.7998515578729266,12.0,12.0,12.0,12.0,False,original,1.0,default_1usd,EN,discard,keep_imputed,no_category_detected,dataset/txt_limpios/1253.txt,dataset/paginas_descargadas/1253.html
1254,Selecciona un local,X,3 L,UNKNOWN,Desconocido,unknown,cafe,sin_categoria,cafe,True,0.8699377891308989,12.0,12.0,12.0,12.0,False,original,1.0,default_1usd,EN,discard,keep_imputed,no_category_detected,dataset/txt_limpios/1254.txt,dataset/paginas_descargadas/1254.html
1255,Selecciona un local,X,500 G,US,Desconocido,unknown,cafe,sin_categoria,cafe,True,0.8915865356465107,12.0,12.0,12.0,12.0,False,original,1.0,default_1usd,EN,discard,keep_imputed,no_category_detected,dataset/txt_limpios/1255.txt,dataset/paginas_descargadas/1255.html
1256,Selecciona un local,X,"1,25 L",UNKNOWN,Desconocido,unknown,cafe,sin_categoria,cafe,True,0.930128560461766,12.0,12.0,12.0,12.0,False,original,1.0,default_1usd,EN,discard,keep_imputed,no_category_detected,dataset/txt_limpios/1256.txt,dataset/paginas_descargadas/1256.html
1257,Selecciona un local,X,500 Ml,US,Desconocido,unknown,cafe,sin_categoria,cafe,True,0.8850673824608325,12.0,12.0,12.0,12.0,False,original,1.0,default_1usd,EN,discard,keep_imputed,no_category_detected,dataset/txt_limpios/1257.txt,dataset/paginas_descargadas/1257.html
1258,Selecciona un local,X,355 Ml,US,Desconocido,unknown,cafe,sin_categoria,cafe,True,0.8385211927608983,12.0,12.0,12.0,12.0,False,original,1.0,default_1usd,EN,discard,keep_imputed,no_category_detected,dataset/txt_limpios/1258.txt,dataset/paginas_descargadas/1258.html
1259,Selecciona un local,X,355 Ml,US,Desconocido,unknown,cafe,sin_categoria,cafe,True,0.8385211927608983,12.0,12.0,12.0,12.0,False,original,1.0,default_1usd,EN,discard,keep_imputed,no_category_detected,dataset/txt_limpios/1259.txt,dataset/paginas_descargadas/1259.html
1260,Selecciona un local,X,500 Ml,US,Desconocido,unknown,cafe,sin_categoria,cafe,True,0.8850673824608325,12.0,12.0,12.0,12.0,False,original,1.0,default_1usd,EN,discard,keep_imputed,no_category_detected,dataset/txt_limpios/1260.txt,dataset/paginas_descargadas/1260.html
1262,Selecciona un local,X,,US,Desconocido,unknown,cafe,sin_categoria,cafe,True,0.8699377891308989,12.0,12.0,12.0,12.0,False,original,1.0,default_1usd,EN,discard,keep_imputed,no_category_detected,dataset/txt_limpios/1262.txt,dataset/paginas_descargadas/1262.html
1263,Selecciona un local,X,400 G,US,Desconocido,unknown,cafe,sin_categoria,cafe,True,0.9588060068423994,12.0,12.0,12.0,12.0,False,original,1.0,default_1usd,EN,discard,keep_imputed,no_category_detected,dataset/txt_limpios/1263.txt,dataset/paginas_descargadas/1263.html
1264,Selecciona un local,X,1 kg,US,Desconocido,unknown,cafe,sin_categoria,cafe,True,0.6493360418772606,12.0,12.0,12.0,12.0,False,original,1.0,default_1usd,EN,discard,keep_imputed,no_category_detected,dataset/txt_limpios/1264.txt,dataset/paginas_descargadas/1264.html
1265,Selecciona un local,X,250 G,US,Desconocido,unknown,cafe,sin_categoria,cafe,True,0.9643329115596556,12.0,12.0,12.0,12.0,False,original,1.0,default_1usd,EN,discard,keep_imputed,no_category_detected,dataset/txt_limpios/1265.txt,dataset/paginas_descargadas/1265.html
1266,Selecciona un local,X,,UNKNOWN,Desconocido,unknown,cafe,sin_categoria,cafe,True,0.8699377891308989,12.0,12.0,12.0,12.0,False,original,1.0,default_1usd,EN,discard,keep_imputed,no_category_detected,dataset/txt_limpios/1266.txt,dataset/paginas_descargadas/1266.html
1267,Selecciona un local,X,,UNKNOWN,Desconocido,unknown,cafe,sin_categoria,cafe,True,0.8699377891308989,12.0,12.0,12.0,12.0,False,original,1.0,default_1usd,EN,discard,keep_imputed,no_category_detected,dataset/txt_limpios/1267.txt,dataset/paginas_descargadas/1267.html
1268,Selecciona un local,X,5000 g,US,Desconocido,unknown,cafe,sin_categoria,cafe,True,0.7485114561775698,12.0,12.0,12.0,12.0,False,original,1.0,default_1usd,EN,discard,keep_imputed,no_category_detected,dataset/txt_limpios/1268.txt,dataset/paginas_descargadas/1268.html
1269,Selecciona un local,X,750 ML,UNKNOWN,Desconocido,unknown,cafe,sin_categoria,cafe,True,0.7937334101121377,12.0,12.0,12.0,12.0,False,original,1.0,default_1usd,EN,discard,keep_imputed,no_category_detected,dataset/txt_limpios/1269.txt,dataset/paginas_descargadas/1269.html
1270,Selecciona un local,X,,US,Desconocido,unknown,cafe,sin_categoria,cafe,True,0.8699377891308989,12.0,12.0,12.0,12.0,False,original,1.0,default_1usd,EN,discard,keep_imputed,no_category_detected,dataset/txt_limpios/1270.txt,dataset/paginas_descargadas/1270.html
1271,Selecciona un local,X,,UNKNOWN,Desconocido,unknown,cafe,sin_categoria,cafe,True,0.8699377891308989,12.0,12.0,12.0,12.0,False,original,1.0,default_1usd,EN,discard,keep_imputed,no_category_detected,dataset/txt_limpios/1271.txt,dataset/paginas_descargadas/1271.html
1272,Selecciona un local,X,1000 G,US,Desconocido,unknown,cafe,sin_categoria,cafe,True,0.8939350162692912,12.0,12.0,12.0,12.0,False,original,1.0,default_1usd,EN,discard,keep_imputed,no_category_detected,dataset/txt_limpios/1272.txt,dataset/paginas_descargadas/1272.html
1273,Selecciona un local,X,,US,Desconocido,unknown,cafe,sin_categoria,cafe,True,0.8699377891308989,12.0,12.0,12.0,12.0,False,original,1.0,default_1usd,EN,discard,keep_imputed,no_category_detected,dataset/txt_limpios/1273.txt,dataset/paginas_descargadas/1273.html
1274,Selecciona un local,X,,US,Desconocido,unknown,cafe,sin_categoria,cafe,True,0.8699377891308989,12.0,12.0,12.0,12.0,False,original,1.0,default_1usd,EN,discard,keep_imputed,no_category_detected,dataset/txt_limpios/1274.txt,dataset/paginas_descargadas/1274.html
1275,Selecciona un local,X,,US,Desconocido,unknown,cafe,sin_categoria,cafe,True,0.8699377891308989,12.0,12.0,12.0,12.0,False,original,1.0,default_1usd,EN,discard,keep_imputed,no_category_detected,dataset/txt_limpios/1275.txt,dataset/paginas_descargadas/1275.html
1276,Selecciona un local,X,,UNKNOWN,Desconocido,unknown,cafe,sin_categoria,cafe,True,0.8699377891308989,12.0,12.0,12.0,12.0,False,original,1.0,default_1usd,EN,discard,keep_imputed,no_category_detected,dataset/txt_limpios/1276.txt,dataset/paginas_descargadas/1276.html
1277,Selecciona un local,X,5000 G,US,Desconocido,unknown,cafe,sin_categoria,cafe,True,0.7485114561775698,12.0,12.0,12.0,12.0,False,original,1.0,default_1usd,EN,discard,keep_imputed,no_category_detected,dataset/txt_limpios/1277.txt,dataset/paginas_descargadas/1277.html
1278,Selecciona un local,X,1000 G,US,Desconocido,unknown,cafe,sin_categoria,cafe,True,0.8939350162692912,12.0,12.0,12.0,12.0,False,original,1.0,default_1usd,EN,discard,keep_imputed,no_category_detected,dataset/txt_limpios/1278.txt,dataset/paginas_descargadas/1278.html
1279,Selecciona un local,X,5000 g,US,Desconocido,unknown,cafe,sin_categoria,cafe,True,0.7485114561775698,12.0,12.0,12.0,12.0,False,original,1.0,default_1usd,EN,discard,keep_imputed,no_category_detected,dataset/txt_limpios/1279.txt,dataset/paginas_descargadas/1279.html
