source_id,product_name,brand,unit,country,seller,availability,category_effective,category_canonical,category_canonical_imputed,category_is_imputed,category_model_confidence,price_amount,price_amount_filled,price_amount_usd,price_amount_usd_filled,price_is_imputed,price_imputation_source,fx_rate_local_per_usd,fx_source,es_status,decision,decision_imputed,reasons,txt_path,html_path
35,Harinas y reposteria,Harina Chedraui Trigo 1Kg,1Kg,MX,Chedraui,unknown,pan,sin_categoria,pan,True,0.9079817589897416,,66.32,,3.5617,True,country_mean,18.62,from_mexico_cambio_dolar,ET,discard,keep_imputed,no_category_detected;price_parse_failed,dataset/txt_limpios/35.txt,dataset/paginas_descargadas/35.html
36,Harinas y reposteria,La Moderna,1kg,MX,Chedraui,unknown,harina de trigo,harina de trigo,,False,0.0,,2902.4,,155.8757,True,category_mean,18.62,from_mexico_cambio_dolar,EN,discard,keep_imputed,price_parse_failed;price<=0,dataset/txt_limpios/36.txt,dataset/paginas_descargadas/36.html
37,Harinas y reposteria,Sol de Oro,1kg,MX,Chedraui,unknown,harina de trigo,harina de trigo,,False,0.0,,2902.4,,155.8757,True,category_mean,18.62,from_mexico_cambio_dolar,ET,discard,keep_imputed,price_parse_failed;price<=0,dataset/txt_limpios/37.txt,dataset/paginas_descargadas/37.html
546,"Hola, Limpía tú cache",IR AL PAGO,1 Lt,AR,Desconocido,unknown,leche,sin_categoria,leche,True,0.989020121677072,1.59,1.59,0.0013,0.0013,False,original,1255.0,from_argentina_cambio_dolar,EN,discard,keep_imputed,no_category_detected,dataset/txt_limpios/546.txt,dataset/paginas_descargadas/546.html
547,"Hola, Limpía tú cache",IR AL PAGO,1 Lt,AR,Desconocido,unknown,leche,sin_categoria,leche,True,0.989020121677072,1.2,1.2,0.001,0.001,False,original,1255.0,from_argentina_cambio_dolar,EN,discard,keep_imputed,no_category_detected,dataset/txt_limpios/547.txt,dataset/paginas_descargadas/547.html
552,"Hola, Limpía tú cache",¿Quéres terminar tu compra?,560 Gr,AR,Desconocido,unknown,leche,leche,,False,0.0,5.01,5.01,0.004,0.004,False,original,1255.0,from_argentina_cambio_dolar,ET,keep,keep,heuristic_default,dataset/txt_limpios/552.txt,dataset/paginas_descargadas/552.html
554,"Hola, Limpía tú cache",¿Quéres terminar tu compra?,1 Kg,AR,Desconocido,unknown,leche,sin_categoria,leche,True,0.9866538107518706,1.3,1.3,0.001,0.001,False,original,1255.0,from_argentina_cambio_dolar,ET,discard,keep_imputed,no_category_detected,dataset/txt_limpios/554.txt,dataset/paginas_descargadas/554.html
563,"Hola, Limpía tú cache",¿Quéres terminar tu compra?,500 Gr,AR,Desconocido,unknown,leche,sin_categoria,leche,True,0.9308127288296344,965.0,965.0,0.7689,0.7689,False,original,1255.0,from_argentina_cambio_dolar,ET,discard,keep_imputed,no_category_detected,dataset/txt_limpios/563.txt,dataset/paginas_descargadas/563.html
570,"Hola, Limpía tú cache",¿Quéres terminar tu compra?,500 Gr,AR,Desconocido,unknown,leche,sin_categoria,leche,True,0.9308127288296344,500.0,500.0,0.3984,0.3984,False,original,1255.0,from_argentina_cambio_dolar,ET,discard,keep_imputed,no_category_detected,dataset/txt_limpios/570.txt,dataset/paginas_descargadas/570.html
574,"Hola, Limpía tú cache",¿Quéres terminar tu compra?,"1,5 Lt",AR,Desconocido,unknown,leche,sin_categoria,leche,True,0.9989364248241396,800.0,800.0,0.6375,0.6375,False,original,1255.0,from_argentina_cambio_dolar,ET,discard,keep_imputed,no_category_detected,dataset/txt_limpios/574.txt,dataset/paginas_descargadas/574.html
1382,Horarios de entrega,LISTA,400 GR,UNKNOWN,Desconocido,unknown,pan,sin_categoria,pan,True,0.6023337773514449,,234.19,,234.1938,True,country_mean,1.0,default_1usd,EN,discard,keep_imputed,no_category_detected;price_parse_failed,dataset/txt_limpios/1382.txt,dataset/paginas_descargadas/1382.html
1390,Horarios de entrega,LISTA,1.5LT,UNKNOWN,Desconocido,unknown,papa,sin_categoria,papa,True,0.6733730169061252,100.0,100.0,100.0,100.0,False,original,1.0,default_1usd,EN,discard,keep_imputed,no_category_detected,dataset/txt_limpios/1390.txt,dataset/paginas_descargadas/1390.html
1460,Horarios de entrega,LISTA,400 GRAMOS,UNKNOWN,Desconocido,unknown,pan,sin_categoria,pan,True,0.7134656132738774,,234.19,,234.1938,True,country_mean,1.0,default_1usd,EN,discard,keep_imputed,no_category_detected;price_parse_failed,dataset/txt_limpios/1460.txt,dataset/paginas_descargadas/1460.html
1478,Horarios de entrega,LISTA,400 GR,UNKNOWN,Desconocido,unknown,pan,sin_categoria,pan,True,0.6023337773514449,,234.19,,234.1938,True,country_mean,1.0,default_1usd,EN,discard,keep_imputed,no_category_detected;price_parse_failed,dataset/txt_limpios/1478.txt,dataset/paginas_descargadas/1478.html
1479,Horarios de entrega,LISTA,400 GRAMOS,UNKNOWN,Desconocido,unknown,pan,sin_categoria,pan,True,0.7134656132738774,40.0,40.0,40.0,40.0,False,original,1.0,default_1usd,EN,discard,keep_imputed,no_category_detected,dataset/txt_limpios/1479.txt,dataset/paginas_descargadas/1479.html
1486,Horarios de entrega,LISTA,85 GRAMOS,UNKNOWN,Desconocido,unknown,pan,sin_categoria,pan,True,0.7677147541838563,,234.19,,234.1938,True,country_mean,1.0,default_1usd,EN,discard,keep_imputed,no_category_detected;price_parse_failed,dataset/txt_limpios/1486.txt,dataset/paginas_descargadas/1486.html
1515,Horarios de entrega,LISTA,400 GRAMOS,UNKNOWN,Desconocido,unknown,pan,sin_categoria,pan,True,0.7134656132738774,400.0,400.0,400.0,400.0,False,original,1.0,default_1usd,EN,discard,keep_imputed,no_category_detected,dataset/txt_limpios/1515.txt,dataset/paginas_descargadas/1515.html
524,Huevos Blanco,Descripción del producto,500 Gr,UNKNOWN,Desconocido,unknown,huevo,huevo,,False,0.0,627.25,627.25,627.25,627.25,False,original,1.0,default_1usd,ET,discard,keep_imputed,heuristic_default,dataset/txt_limpios/524.txt,dataset/paginas_descargadas/524.html
525,Huevos Blanco,Descripción del producto,500 Gr,UNKNOWN,Desconocido,unknown,huevo,huevo,,False,0.0,3961.0,3961.0,3961.0,3961.0,False,original,1.0,default_1usd,ET,discard,keep_imputed,heuristic_default,dataset/txt_limpios/525.txt,dataset/paginas_descargadas/525.html
526,Huevos Blanco,Descripción del producto,500 Gr,UNKNOWN,Desconocido,unknown,huevo,huevo,,False,0.0,4241.5,4241.5,4241.5,4241.5,False,original,1.0,default_1usd,ET,discard,keep_imputed,heuristic_default,dataset/txt_limpios/526.txt,dataset/paginas_descargadas/526.html
908,Huevos blanco grande,12 un,,UNKNOWN,Desconocido,unknown,huevo,huevo,,False,0.0,4.11,4.11,4.11,4.11,False,original,1.0,default_1usd,EN,discard,keep_imputed,heuristic_default,dataset/txt_limpios/908.txt,dataset/paginas_descargadas/908.html
527,Huevos Color,Descripción del producto,500 Gr,UNKNOWN,Desconocido,unknown,huevo,huevo,,False,0.0,1596.0,1596.0,1596.0,1596.0,False,original,1.0,default_1usd,ET,discard,keep_imputed,heuristic_default,dataset/txt_limpios/527.txt,dataset/paginas_descargadas/527.html
900,kem piña,Bebida desechable,1.5 Litro,UNKNOWN,Desconocido,unknown,papa,sin_categoria,papa,True,0.9869501456953153,1.39,1.39,1.39,1.39,False,original,1.0,default_1usd,EN,discard,keep_imputed,no_category_detected,dataset/txt_limpios/900.txt,dataset/paginas_descargadas/900.html
909,la herradura,Huevo primera color,,UNKNOWN,Desconocido,unknown,huevo,huevo,,False,0.0,,234.19,,234.1938,True,country_mean,1.0,default_1usd,EN,discard,keep_imputed,price_parse_failed,dataset/txt_limpios/909.txt,dataset/paginas_descargadas/909.html
11,Lacteos y huevo,Leche,1L,MX,Chedraui,unknown,leche,leche,,False,0.0,,38.0,,2.0408,True,category_country_mean,18.62,from_mexico_cambio_dolar,ET,discard,keep_imputed,price_parse_failed;price<=0,dataset/txt_limpios/11.txt,dataset/paginas_descargadas/11.html
12,Lacteos y huevo,Leche,1L,MX,Chedraui,unknown,huevo,huevo,,False,0.0,,66.32,,3.5617,True,country_mean,18.62,from_mexico_cambio_dolar,ET,discard,keep_imputed,price_parse_failed,dataset/txt_limpios/12.txt,dataset/paginas_descargadas/12.html
14,Lacteos y huevo,Leche,1L,MX,Chedraui,unknown,leche,leche,,False,0.0,37.0,37.0,1.9871,1.9871,False,original,18.62,from_mexico_cambio_dolar,ET,keep,keep,heuristic_default,dataset/txt_limpios/14.txt,dataset/paginas_descargadas/14.html
15,Lacteos y huevo,Leche,946ml,MX,Chedraui,unknown,leche,leche,,False,0.0,39.0,39.0,2.0945,2.0945,False,original,18.62,from_mexico_cambio_dolar,ET,keep,keep,heuristic_default,dataset/txt_limpios/15.txt,dataset/paginas_descargadas/15.html
28,Lacteos y huevo,Huevos,30 piezas,MX,Chedraui,unknown,huevo,huevo,,False,0.0,106.0,106.0,5.6928,5.6928,False,original,18.62,from_mexico_cambio_dolar,ET,discard,keep_imputed,heuristic_default,dataset/txt_limpios/28.txt,dataset/paginas_descargadas/28.html
29,Lacteos y huevo,Huevos,30 Piezas,MX,Chedraui,unknown,huevo,huevo,,False,0.0,87.5,87.5,4.6992,4.6992,False,original,18.62,from_mexico_cambio_dolar,EN,discard,keep_imputed,heuristic_default,dataset/txt_limpios/29.txt,dataset/paginas_descargadas/29.html
30,Lacteos y huevo,Huevos,30 Piezas,MX,Chedraui,unknown,huevo,huevo,,False,0.0,,66.32,,3.5617,True,country_mean,18.62,from_mexico_cambio_dolar,ET,discard,keep_imputed,price_parse_failed,dataset/txt_limpios/30.txt,dataset/paginas_descargadas/30.html
795,LECHE EQUILIBRIO TETRAPAK UHTLATTI 900ML,Unidades disponibles,900ML,UNKNOWN,Desconocido,unknown,leche,leche,,False,0.0,900.0,900.0,900.0,900.0,False,original,1.0,default_1usd,ET,keep,keep,heuristic_default,dataset/txt_limpios/795.txt,dataset/paginas_descargadas/795.html
1343,LECHE LA LECHERA TETRABRIK 1 L ENTERA,Comparar,1 L,US,Desconocido,unknown,leche,leche,,False,0.0,1.39,1.39,1.39,1.39,False,original,1.0,default_1usd,ET,keep,keep,heuristic_default,dataset/txt_limpios/1343.txt,dataset/paginas_descargadas/1343.html
1344,LECHE PARMALAT 900 ML ENTERA,Comparar,900 ML,US,Desconocido,unknown,leche,leche,,False,0.0,0.99,0.99,0.99,0.99,False,original,1.0,default_1usd,ET,keep,keep,heuristic_default,dataset/txt_limpios/1344.txt,dataset/paginas_descargadas/1344.html
1342,LECHE TONI TETRABRIK 1 L ENTERA,Comparar,1 L,US,Desconocido,unknown,leche,leche,,False,0.0,1.45,1.45,1.45,1.45,False,original,1.0,default_1usd,ET,keep,keep,heuristic_default,dataset/txt_limpios/1342.txt,dataset/paginas_descargadas/1342.html
503,Leches Frescas,Leches Enteras,,UNKNOWN,Desconocido,unknown,leche,leche,,False,0.0,,428.01,,428.0052,True,category_country_mean,1.0,default_1usd,EN,discard,keep_imputed,price_parse_failed;price<=0,dataset/txt_limpios/503.txt,dataset/paginas_descargadas/503.html
504,Leches Larga Vida,Leches Enteras,1l,UNKNOWN,Desconocido,unknown,leche,leche,,False,0.0,1380.0,1380.0,1380.0,1380.0,False,original,1.0,default_1usd,EN,keep,keep,heuristic_default,dataset/txt_limpios/504.txt,dataset/paginas_descargadas/504.html
505,Leches Larga Vida,Leches Enteras,1l,UNKNOWN,Desconocido,unknown,leche,leche,,False,0.0,2049.0,2049.0,2049.0,2049.0,False,original,1.0,default_1usd,EN,keep,keep,heuristic_default,dataset/txt_limpios/505.txt,dataset/paginas_descargadas/505.html
506,Leches Larga Vida,Leches Enteras,1l,UNKNOWN,Desconocido,unknown,leche,leche,,False,0.0,2040.0,2040.0,2040.0,2040.0,False,original,1.0,default_1usd,ET,keep,keep,heuristic_default,dataset/txt_limpios/506.txt,dataset/paginas_descargadas/506.html
507,Leches Larga Vida,Leches Enteras,1l,UNKNOWN,Desconocido,unknown,leche,leche,,False,0.0,1911.0,1911.0,1911.0,1911.0,False,original,1.0,default_1usd,ET,keep,keep,heuristic_default,dataset/txt_limpios/507.txt,dataset/paginas_descargadas/507.html
1748,Lácteos y Quesos,Leches,1 LT,UNKNOWN,Desconocido,unknown,leche,leche,,False,0.0,1.15,1.15,1.15,1.15,False,original,1.0,default_1usd,ET,keep,keep,heuristic_default,dataset/txt_limpios/1748.txt,dataset/paginas_descargadas/1748.html
1750,Lácteos y Quesos,Leches,1 LT,UNKNOWN,Desconocido,unknown,leche,leche,,False,0.0,1.05,1.05,1.05,1.05,False,original,1.0,default_1usd,ET,keep,keep,heuristic_default,dataset/txt_limpios/1750.txt,dataset/paginas_descargadas/1750.html
913,"Lácteos, refrigerados y huevos",Leches líquidas,1 Litro,UNKNOWN,Desconocido,unknown,leche,leche,,False,0.0,1.09,1.09,1.09,1.09,False,original,1.0,default_1usd,ET,keep,keep,heuristic_default,dataset/txt_limpios/913.txt,dataset/paginas_descargadas/913.html
914,"Lácteos, refrigerados y huevos",Leches líquidas,1 Litro,UNKNOWN,Desconocido,unknown,leche,leche,,False,0.0,1.15,1.15,1.15,1.15,False,original,1.0,default_1usd,ET,keep,keep,heuristic_default,dataset/txt_limpios/914.txt,dataset/paginas_descargadas/914.html
915,"Lácteos, refrigerados y huevos",Leches líquidas,1 Litro,UNKNOWN,Desconocido,unknown,leche,leche,,False,0.0,970.0,970.0,970.0,970.0,False,original,1.0,default_1usd,ET,keep,keep,heuristic_default,dataset/txt_limpios/915.txt,dataset/paginas_descargadas/915.html
297,Macarrão Italiano Spaghetti La Campofilone 500 G,Descripción,500 G,BR,Desconocido,unknown,pasta seca,pasta seca,,False,0.0,15.99,15.99,2.935,2.935,False,original,5.448,from_brasil_cambio_dolar,ET,keep,keep,heuristic_default,dataset/txt_limpios/297.txt,dataset/paginas_descargadas/297.html
298,Massa Italiana Integral Spaghetti La Molisana 500 G,Descripción,500 G,BR,Desconocido,unknown,huevo,sin_categoria,huevo,True,0.9997695962764118,15.99,15.99,2.935,2.935,False,original,5.448,from_brasil_cambio_dolar,ET,discard,keep_imputed,no_category_detected,dataset/txt_limpios/298.txt,dataset/paginas_descargadas/298.html
1557,Massas e Molhos,Descripción del producto,500g,UNKNOWN,Desconocido,unknown,cebolla,sin_categoria,cebolla,True,0.682584468332168,,234.19,,234.1938,True,country_mean,1.0,default_1usd,ET,discard,keep_imputed,no_category_detected;price_parse_failed,dataset/txt_limpios/1557.txt,dataset/paginas_descargadas/1557.html
202,Massas e Molhos,fideos,500g,UNKNOWN,Desconocido,unknown,pasta seca,sin_categoria,pasta seca,True,0.8629433548329668,,234.19,,234.1938,True,country_mean,1.0,default_1usd,ET,discard,keep_imputed,no_category_detected;price_parse_failed,dataset/txt_limpios/202.txt,dataset/paginas_descargadas/202.html
1569,Meu Desconto,Blog do Pão,1kg,BR,Desconocido,unknown,pan,pan,,False,0.0,7.49,7.49,1.3748,1.3748,False,original,5.448,from_brasil_cambio_dolar,ET,keep,keep,heuristic_default,dataset/txt_limpios/1569.txt,dataset/paginas_descargadas/1569.html
1571,Meu Desconto,Blog do Pão,1kg,BR,Desconocido,unknown,pan,pan,,False,0.0,6.99,6.99,1.283,1.283,False,original,5.448,from_brasil_cambio_dolar,ET,keep,keep,heuristic_default,dataset/txt_limpios/1571.txt,dataset/paginas_descargadas/1571.html
1573,Meu Desconto,Blog do Pão,5kg,BR,Desconocido,unknown,pan,pan,,False,0.0,23.99,23.99,4.4035,4.4035,False,original,5.448,from_brasil_cambio_dolar,ET,keep,keep,heuristic_default,dataset/txt_limpios/1573.txt,dataset/paginas_descargadas/1573.html
1575,Meu Desconto,Blog do Pão,1kg,UNKNOWN,Desconocido,unknown,pan,pan,,False,0.0,50.0,50.0,50.0,50.0,False,original,1.0,default_1usd,ET,keep,keep,heuristic_default,dataset/txt_limpios/1575.txt,dataset/paginas_descargadas/1575.html
1577,Meu Desconto,Blog do Pão,5kg,UNKNOWN,Desconocido,unknown,pan,pan,,False,0.0,1.0,1.0,1.0,1.0,False,original,1.0,default_1usd,ET,keep,keep,heuristic_default,dataset/txt_limpios/1577.txt,dataset/paginas_descargadas/1577.html
1580,Meu Desconto,Blog do Pão,500g,BR,Desconocido,unknown,pan,pan,,False,0.0,31.99,31.99,5.8719,5.8719,False,original,5.448,from_brasil_cambio_dolar,ET,keep,keep,heuristic_default,dataset/txt_limpios/1580.txt,dataset/paginas_descargadas/1580.html
1582,Meu Desconto,Blog do Pão,500g,BR,Desconocido,unknown,pan,pan,,False,0.0,39.99,39.99,7.3403,7.3403,False,original,5.448,from_brasil_cambio_dolar,ET,keep,keep,heuristic_default,dataset/txt_limpios/1582.txt,dataset/paginas_descargadas/1582.html
1584,Meu Desconto,Blog do Pão,500g,BR,Desconocido,unknown,pan,pan,,False,0.0,39.99,39.99,7.3403,7.3403,False,original,5.448,from_brasil_cambio_dolar,ET,keep,keep,heuristic_default,dataset/txt_limpios/1584.txt,dataset/paginas_descargadas/1584.html
1586,Meu Desconto,Blog do Pão,500g,BR,Desconocido,unknown,pan,pan,,False,0.0,39.99,39.99,7.3403,7.3403,False,original,5.448,from_brasil_cambio_dolar,ET,keep,keep,heuristic_default,dataset/txt_limpios/1586.txt,dataset/paginas_descargadas/1586.html
1587,Meu Desconto,Blog do Pão,250g,BR,Desconocido,unknown,pan,pan,,False,0.0,27.99,27.99,5.1377,5.1377,False,original,5.448,from_brasil_cambio_dolar,ET,keep,keep,heuristic_default,dataset/txt_limpios/1587.txt,dataset/paginas_descargadas/1587.html
1589,Meu Desconto,Blog do Pão,480g,BR,Desconocido,unknown,pan,pan,,False,0.0,9.99,9.99,1.8337,1.8337,False,original,5.448,from_brasil_cambio_dolar,ET,keep,keep,heuristic_default,dataset/txt_limpios/1589.txt,dataset/paginas_descargadas/1589.html
1591,Meu Desconto,Blog do Pão,500g,BR,Desconocido,unknown,pan,pan,,False,0.0,9.99,9.99,1.8337,1.8337,False,original,5.448,from_brasil_cambio_dolar,ET,keep,keep,heuristic_default,dataset/txt_limpios/1591.txt,dataset/paginas_descargadas/1591.html
1593,Meu Desconto,Blog do Pão,450g,BR,Desconocido,unknown,pan,pan,,False,0.0,8.59,8.59,1.5767,1.5767,False,original,5.448,from_brasil_cambio_dolar,ET,keep,keep,heuristic_default,dataset/txt_limpios/1593.txt,dataset/paginas_descargadas/1593.html
1595,Meu Desconto,Blog do Pão,500g,BR,Desconocido,unknown,pan,pan,,False,0.0,14.29,14.29,2.623,2.623,False,original,5.448,from_brasil_cambio_dolar,ET,keep,keep,heuristic_default,dataset/txt_limpios/1595.txt,dataset/paginas_descargadas/1595.html
1597,Meu Desconto,Blog do Pão,400g,UNKNOWN,Desconocido,unknown,pan,pan,,False,0.0,400.0,400.0,400.0,400.0,False,original,1.0,default_1usd,ET,keep,keep,heuristic_default,dataset/txt_limpios/1597.txt,dataset/paginas_descargadas/1597.html
1599,Meu Desconto,Blog do Pão,"1,5l",BR,Desconocido,unknown,pan,pan,,False,0.0,10.99,10.99,2.0173,2.0173,False,original,5.448,from_brasil_cambio_dolar,ET,keep,keep,heuristic_default,dataset/txt_limpios/1599.txt,dataset/paginas_descargadas/1599.html
1601,Meu Desconto,Blog do Pão,600ml,BR,Desconocido,unknown,pan,pan,,False,0.0,4.49,4.49,0.8242,0.8242,False,original,5.448,from_brasil_cambio_dolar,ET,keep,keep,heuristic_default,dataset/txt_limpios/1601.txt,dataset/paginas_descargadas/1601.html
1603,Meu Desconto,Blog do Pão,"1,5l",BR,Desconocido,unknown,pan,pan,,False,0.0,8.59,8.59,1.5767,1.5767,False,original,5.448,from_brasil_cambio_dolar,ET,keep,keep,heuristic_default,dataset/txt_limpios/1603.txt,dataset/paginas_descargadas/1603.html
1604,Meu Desconto,Blog do Pão,"1,5l",BR,Desconocido,unknown,pan,pan,,False,0.0,8.59,8.59,1.5767,1.5767,False,original,5.448,from_brasil_cambio_dolar,ET,keep,keep,heuristic_default,dataset/txt_limpios/1604.txt,dataset/paginas_descargadas/1604.html
1607,Meu Desconto,Blog do Pão,"1,5 Litros",BR,Desconocido,unknown,pan,pan,,False,0.0,7.89,7.89,1.4482,1.4482,False,original,5.448,from_brasil_cambio_dolar,ET,keep,keep,heuristic_default,dataset/txt_limpios/1607.txt,dataset/paginas_descargadas/1607.html
1609,Meu Desconto,Blog do Pão,500g,BR,Desconocido,unknown,pan,pan,,False,0.0,5.39,5.39,0.9894,0.9894,False,original,5.448,from_brasil_cambio_dolar,ET,keep,keep,heuristic_default,dataset/txt_limpios/1609.txt,dataset/paginas_descargadas/1609.html
1611,Meu Desconto,Blog do Pão,500g,BR,Desconocido,unknown,pan,pan,,False,0.0,4.29,4.29,0.7874,0.7874,False,original,5.448,from_brasil_cambio_dolar,ET,keep,keep,heuristic_default,dataset/txt_limpios/1611.txt,dataset/paginas_descargadas/1611.html
1613,Meu Desconto,Blog do Pão,500g,BR,Desconocido,unknown,pan,pan,,False,0.0,4.49,4.49,0.8242,0.8242,False,original,5.448,from_brasil_cambio_dolar,ET,keep,keep,heuristic_default,dataset/txt_limpios/1613.txt,dataset/paginas_descargadas/1613.html
1615,Meu Desconto,Blog do Pão,500g,BR,Desconocido,unknown,pan,pan,,False,0.0,4.49,4.49,0.8242,0.8242,False,original,5.448,from_brasil_cambio_dolar,ET,keep,keep,heuristic_default,dataset/txt_limpios/1615.txt,dataset/paginas_descargadas/1615.html
1620,Meu Desconto,Blog do Pão,500g,BR,Desconocido,unknown,pan,pan,,False,0.0,4.89,4.89,0.8976,0.8976,False,original,5.448,from_brasil_cambio_dolar,ET,keep,keep,heuristic_default,dataset/txt_limpios/1620.txt,dataset/paginas_descargadas/1620.html
1623,Meu Desconto,Blog do Pão,1L,BR,Desconocido,unknown,pan,pan,,False,0.0,7.99,7.99,1.4666,1.4666,False,original,5.448,from_brasil_cambio_dolar,ET,keep,keep,heuristic_default,dataset/txt_limpios/1623.txt,dataset/paginas_descargadas/1623.html
1624,Meu Desconto,Blog do Pão,1 Litro,UNKNOWN,Desconocido,unknown,pan,pan,,False,0.0,1.0,1.0,1.0,1.0,False,original,1.0,default_1usd,ET,keep,keep,heuristic_default,dataset/txt_limpios/1624.txt,dataset/paginas_descargadas/1624.html
1627,Meu Desconto,Blog do Pão,1 Litro,BR,Desconocido,unknown,pan,pan,,False,0.0,5.99,5.99,1.0995,1.0995,False,original,5.448,from_brasil_cambio_dolar,ET,keep,keep,heuristic_default,dataset/txt_limpios/1627.txt,dataset/paginas_descargadas/1627.html
1633,Meu Desconto,Blog do Pão,1 Litro,UNKNOWN,Desconocido,unknown,pan,pan,,False,0.0,18.0,18.0,18.0,18.0,False,original,1.0,default_1usd,ET,keep,keep,heuristic_default,dataset/txt_limpios/1633.txt,dataset/paginas_descargadas/1633.html
1634,Meu Desconto,Blog do Pão,1L,BR,Desconocido,unknown,pan,pan,,False,0.0,7.99,7.99,1.4666,1.4666,False,original,5.448,from_brasil_cambio_dolar,ET,keep,keep,heuristic_default,dataset/txt_limpios/1634.txt,dataset/paginas_descargadas/1634.html
1637,Meu Desconto,Blog do Pão,330ml,BR,Desconocido,unknown,pan,pan,,False,0.0,6.59,6.59,1.2096,1.2096,False,original,5.448,from_brasil_cambio_dolar,ET,keep,keep,heuristic_default,dataset/txt_limpios/1637.txt,dataset/paginas_descargadas/1637.html
1639,Meu Desconto,Blog do Pão,350ml,BR,Desconocido,unknown,pan,pan,,False,0.0,5.29,5.29,0.971,0.971,False,original,5.448,from_brasil_cambio_dolar,ET,keep,keep,heuristic_default,dataset/txt_limpios/1639.txt,dataset/paginas_descargadas/1639.html
1643,Meu Desconto,Blog do Pão,269ml,BR,Desconocido,unknown,pan,pan,,False,0.0,2.99,2.99,0.5488,0.5488,False,original,5.448,from_brasil_cambio_dolar,ET,keep,keep,heuristic_default,dataset/txt_limpios/1643.txt,dataset/paginas_descargadas/1643.html
