source_id,product_name,brand,unit,country,seller,availability,category_effective,category_canonical,category_canonical_imputed,category_is_imputed,category_model_confidence,price_amount,price_amount_filled,price_amount_usd,price_amount_usd_filled,price_is_imputed,price_imputation_source,fx_rate_local_per_usd,fx_source,es_status,decision,decision_imputed,reasons,txt_path,html_path
537,Bebidas Sin Alcohol,Gaseosas,2.25 L,UNKNOWN,Desconocido,unknown,papa,sin_categoria,papa,True,0.9804757115903344,1265.6,1265.6,1265.6,1265.6,False,original,1.0,default_1usd,ET,discard,keep_imputed,no_category_detected,dataset/txt_limpios/537.txt,dataset/paginas_descargadas/537.html
1722,"Bebidas, Aguas y Jugos",Bebidas,1.5 L,UNKNOWN,Desconocido,unknown,papa,papa,,False,0.0,1.99,1.99,1.99,1.99,False,original,1.0,default_1usd,ET,keep,keep,heuristic_default,dataset/txt_limpios/1722.txt,dataset/paginas_descargadas/1722.html
1724,"Bebidas, Aguas y Jugos",Bebidas,1.5 L,UNKNOWN,Desconocido,unknown,papa,papa,,False,0.0,1.99,1.99,1.99,1.99,False,original,1.0,default_1usd,ET,keep,keep,heuristic_default,dataset/txt_limpios/1724.txt,dataset/paginas_descargadas/1724.html
1726,"Bebidas, Aguas y Jugos",Bebidas,1.5 LT,UNKNOWN,Desconocido,unknown,papa,papa,,False,0.0,1.99,1.99,1.99,1.99,False,original,1.0,default_1usd,ET,keep,keep,heuristic_default,dataset/txt_limpios/1726.txt,dataset/paginas_descargadas/1726.html
1728,"Bebidas, Aguas y Jugos",Bebidas,1.5 LT,UNKNOWN,Desconocido,unknown,papa,papa,,False,0.0,1.99,1.99,1.99,1.99,False,original,1.0,default_1usd,ET,keep,keep,heuristic_default,dataset/txt_limpios/1728.txt,dataset/paginas_descargadas/1728.html
1730,"Bebidas, Aguas y Jugos",Bebidas,1.5 LT,UNKNOWN,Desconocido,unknown,papa,papa,,False,0.0,1.99,1.99,1.99,1.99,False,original,1.0,default_1usd,ET,keep,keep,heuristic_default,dataset/txt_limpios/1730.txt,dataset/paginas_descargadas/1730.html
100,BUSCAR PRODUCTOS,Ingresa,30 piezas,UNKNOWN,Desconocido,unknown,huevo,huevo,,False,0.0,443.0,443.0,443.0,443.0,False,original,1.0,default_1usd,EN,discard,keep_imputed,heuristic_default,dataset/txt_limpios/100.txt,dataset/paginas_descargadas/100.html
101,BUSCAR PRODUCTOS,Ingresa,,UNKNOWN,Desconocido,unknown,cafe,sin_categoria,cafe,True,0.8095750011239902,,234.19,,234.1938,True,country_mean,1.0,default_1usd,EN,discard,keep_imputed,no_category_detected;price_parse_failed,dataset/txt_limpios/101.txt,dataset/paginas_descargadas/101.html
102,BUSCAR PRODUCTOS,Ingresa,,UNKNOWN,Desconocido,unknown,cafe,sin_categoria,cafe,True,0.8095750011239902,443.0,443.0,443.0,443.0,False,original,1.0,default_1usd,EN,discard,keep_imputed,no_category_detected,dataset/txt_limpios/102.txt,dataset/paginas_descargadas/102.html
103,BUSCAR PRODUCTOS,Ingresa,,UNKNOWN,Desconocido,unknown,cafe,sin_categoria,cafe,True,0.8095750011239902,443.0,443.0,443.0,443.0,False,original,1.0,default_1usd,EN,discard,keep_imputed,no_category_detected,dataset/txt_limpios/103.txt,dataset/paginas_descargadas/103.html
104,BUSCAR PRODUCTOS,Ingresa,,UNKNOWN,Desconocido,unknown,cafe,sin_categoria,cafe,True,0.8095750011239902,443.0,443.0,443.0,443.0,False,original,1.0,default_1usd,EN,discard,keep_imputed,no_category_detected,dataset/txt_limpios/104.txt,dataset/paginas_descargadas/104.html
105,BUSCAR PRODUCTOS,Ingresa,,UNKNOWN,Desconocido,unknown,cafe,sin_categoria,cafe,True,0.8095750011239902,443.0,443.0,443.0,443.0,False,original,1.0,default_1usd,EN,discard,keep_imputed,no_category_detected,dataset/txt_limpios/105.txt,dataset/paginas_descargadas/105.html
106,BUSCAR PRODUCTOS,Ingresa,,UNKNOWN,Desconocido,unknown,cafe,sin_categoria,cafe,True,0.8095750011239902,443.0,443.0,443.0,443.0,False,original,1.0,default_1usd,EN,discard,keep_imputed,no_category_detected,dataset/txt_limpios/106.txt,dataset/paginas_descargadas/106.html
107,BUSCAR PRODUCTOS,Ingresa,1 KG,UNKNOWN,Desconocido,unknown,harina de trigo,harina de trigo,,False,0.0,443.0,443.0,443.0,443.0,False,original,1.0,default_1usd,ET,keep,keep,heuristic_default,dataset/txt_limpios/107.txt,dataset/paginas_descargadas/107.html
108,BUSCAR PRODUCTOS,Ingresa,,UNKNOWN,Desconocido,unknown,papa,papa,,False,0.0,443.0,443.0,443.0,443.0,False,original,1.0,default_1usd,ET,keep,keep,heuristic_default,dataset/txt_limpios/108.txt,dataset/paginas_descargadas/108.html
109,BUSCAR PRODUCTOS,Ingresa,,UNKNOWN,Desconocido,unknown,cebolla,cebolla,,False,0.0,443.0,443.0,443.0,443.0,False,original,1.0,default_1usd,ET,keep,keep,heuristic_default,dataset/txt_limpios/109.txt,dataset/paginas_descargadas/109.html
71,BUSCAR PRODUCTOS,Ingresa,,UNKNOWN,Desconocido,unknown,cafe,sin_categoria,cafe,True,0.8095750011239902,443.0,443.0,443.0,443.0,False,original,1.0,default_1usd,EN,discard,keep_imputed,no_category_detected,dataset/txt_limpios/71.txt,dataset/paginas_descargadas/71.html
74,BUSCAR PRODUCTOS,Ingresa,,UNKNOWN,Desconocido,unknown,cafe,sin_categoria,cafe,True,0.8095750011239902,443.0,443.0,443.0,443.0,False,original,1.0,default_1usd,EN,discard,keep_imputed,no_category_detected,dataset/txt_limpios/74.txt,dataset/paginas_descargadas/74.html
75,BUSCAR PRODUCTOS,Ingresa,100.00 g,UNKNOWN,Desconocido,unknown,cafe,sin_categoria,cafe,True,0.8464085797090152,443.0,443.0,443.0,443.0,False,original,1.0,default_1usd,EN,discard,keep_imputed,no_category_detected,dataset/txt_limpios/75.txt,dataset/paginas_descargadas/75.html
76,BUSCAR PRODUCTOS,Ingresa,,UNKNOWN,Desconocido,unknown,cafe,sin_categoria,cafe,True,0.8095750011239902,443.0,443.0,443.0,443.0,False,original,1.0,default_1usd,EN,discard,keep_imputed,no_category_detected,dataset/txt_limpios/76.txt,dataset/paginas_descargadas/76.html
77,BUSCAR PRODUCTOS,Ingresa,,UNKNOWN,Desconocido,unknown,cafe,sin_categoria,cafe,True,0.8095750011239902,443.0,443.0,443.0,443.0,False,original,1.0,default_1usd,EN,discard,keep_imputed,no_category_detected,dataset/txt_limpios/77.txt,dataset/paginas_descargadas/77.html
78,BUSCAR PRODUCTOS,Ingresa,,UNKNOWN,Desconocido,unknown,cafe,sin_categoria,cafe,True,0.8095750011239902,443.0,443.0,443.0,443.0,False,original,1.0,default_1usd,EN,discard,keep_imputed,no_category_detected,dataset/txt_limpios/78.txt,dataset/paginas_descargadas/78.html
79,BUSCAR PRODUCTOS,Ingresa,,UNKNOWN,Desconocido,unknown,cafe,sin_categoria,cafe,True,0.8095750011239902,28.7,28.7,28.7,28.7,False,original,1.0,default_1usd,EN,discard,keep_imputed,no_category_detected,dataset/txt_limpios/79.txt,dataset/paginas_descargadas/79.html
80,BUSCAR PRODUCTOS,Ingresa,100.00 ml,UNKNOWN,Desconocido,unknown,cafe,sin_categoria,cafe,True,0.9852551263951084,443.0,443.0,443.0,443.0,False,original,1.0,default_1usd,EN,discard,keep_imputed,no_category_detected,dataset/txt_limpios/80.txt,dataset/paginas_descargadas/80.html
81,BUSCAR PRODUCTOS,Ingresa,800 ML,UNKNOWN,Desconocido,unknown,azucar,azucar,,False,0.0,443.0,443.0,443.0,443.0,False,original,1.0,default_1usd,ET,keep,keep,heuristic_default,dataset/txt_limpios/81.txt,dataset/paginas_descargadas/81.html
82,BUSCAR PRODUCTOS,Ingresa,,UNKNOWN,Desconocido,unknown,cafe,sin_categoria,cafe,True,0.8095750011239902,443.0,443.0,443.0,443.0,False,original,1.0,default_1usd,EN,discard,keep_imputed,no_category_detected,dataset/txt_limpios/82.txt,dataset/paginas_descargadas/82.html
83,BUSCAR PRODUCTOS,Ingresa,100.00 ml,UNKNOWN,Desconocido,unknown,cafe,sin_categoria,cafe,True,0.9852551263951084,443.0,443.0,443.0,443.0,False,original,1.0,default_1usd,EN,discard,keep_imputed,no_category_detected,dataset/txt_limpios/83.txt,dataset/paginas_descargadas/83.html
84,BUSCAR PRODUCTOS,Ingresa,240.00 g,UNKNOWN,Desconocido,unknown,cafe,sin_categoria,cafe,True,0.7425382202469745,443.0,443.0,443.0,443.0,False,original,1.0,default_1usd,EN,discard,keep_imputed,no_category_detected,dataset/txt_limpios/84.txt,dataset/paginas_descargadas/84.html
85,BUSCAR PRODUCTOS,Ingresa,,UNKNOWN,Desconocido,unknown,cafe,sin_categoria,cafe,True,0.8095750011239902,443.0,443.0,443.0,443.0,False,original,1.0,default_1usd,EN,discard,keep_imputed,no_category_detected,dataset/txt_limpios/85.txt,dataset/paginas_descargadas/85.html
86,BUSCAR PRODUCTOS,Ingresa,,UNKNOWN,Desconocido,unknown,cafe,sin_categoria,cafe,True,0.8095750011239902,443.0,443.0,443.0,443.0,False,original,1.0,default_1usd,EN,discard,keep_imputed,no_category_detected,dataset/txt_limpios/86.txt,dataset/paginas_descargadas/86.html
88,BUSCAR PRODUCTOS,Ingresa,,UNKNOWN,Desconocido,unknown,cafe,sin_categoria,cafe,True,0.8095750011239902,443.0,443.0,443.0,443.0,False,original,1.0,default_1usd,EN,discard,keep_imputed,no_category_detected,dataset/txt_limpios/88.txt,dataset/paginas_descargadas/88.html
89,BUSCAR PRODUCTOS,Ingresa,,UNKNOWN,Desconocido,unknown,cafe,sin_categoria,cafe,True,0.8095750011239902,443.0,443.0,443.0,443.0,False,original,1.0,default_1usd,EN,discard,keep_imputed,no_category_detected,dataset/txt_limpios/89.txt,dataset/paginas_descargadas/89.html
90,BUSCAR PRODUCTOS,Ingresa,,UNKNOWN,Desconocido,unknown,cafe,sin_categoria,cafe,True,0.8095750011239902,443.0,443.0,443.0,443.0,False,original,1.0,default_1usd,EN,discard,keep_imputed,no_category_detected,dataset/txt_limpios/90.txt,dataset/paginas_descargadas/90.html
91,BUSCAR PRODUCTOS,Ingresa,,UNKNOWN,Desconocido,unknown,cafe,sin_categoria,cafe,True,0.8095750011239902,443.0,443.0,443.0,443.0,False,original,1.0,default_1usd,EN,discard,keep_imputed,no_category_detected,dataset/txt_limpios/91.txt,dataset/paginas_descargadas/91.html
92,BUSCAR PRODUCTOS,Ingresa,,UNKNOWN,Desconocido,unknown,cafe,sin_categoria,cafe,True,0.8095750011239902,443.0,443.0,443.0,443.0,False,original,1.0,default_1usd,EN,discard,keep_imputed,no_category_detected,dataset/txt_limpios/92.txt,dataset/paginas_descargadas/92.html
93,BUSCAR PRODUCTOS,Ingresa,,UNKNOWN,Desconocido,unknown,cafe,sin_categoria,cafe,True,0.8095750011239902,443.0,443.0,443.0,443.0,False,original,1.0,default_1usd,EN,discard,keep_imputed,no_category_detected,dataset/txt_limpios/93.txt,dataset/paginas_descargadas/93.html
94,BUSCAR PRODUCTOS,Ingresa,,UNKNOWN,Desconocido,unknown,cafe,sin_categoria,cafe,True,0.8095750011239902,443.0,443.0,443.0,443.0,False,original,1.0,default_1usd,EN,discard,keep_imputed,no_category_detected,dataset/txt_limpios/94.txt,dataset/paginas_descargadas/94.html
95,BUSCAR PRODUCTOS,Ingresa,,UNKNOWN,Desconocido,unknown,cafe,sin_categoria,cafe,True,0.8095750011239902,443.0,443.0,443.0,443.0,False,original,1.0,default_1usd,EN,discard,keep_imputed,no_category_detected,dataset/txt_limpios/95.txt,dataset/paginas_descargadas/95.html
96,BUSCAR PRODUCTOS,Ingresa,,UNKNOWN,Desconocido,unknown,cafe,sin_categoria,cafe,True,0.8095750011239902,443.0,443.0,443.0,443.0,False,original,1.0,default_1usd,EN,discard,keep_imputed,no_category_detected,dataset/txt_limpios/96.txt,dataset/paginas_descargadas/96.html
97,BUSCAR PRODUCTOS,Ingresa,100.00 ml,UNKNOWN,Desconocido,unknown,cafe,sin_categoria,cafe,True,0.9852551263951084,443.0,443.0,443.0,443.0,False,original,1.0,default_1usd,EN,discard,keep_imputed,no_category_detected,dataset/txt_limpios/97.txt,dataset/paginas_descargadas/97.html
98,BUSCAR PRODUCTOS,Ingresa,30 piezas,UNKNOWN,Desconocido,unknown,huevo,huevo,,False,0.0,443.0,443.0,443.0,443.0,False,original,1.0,default_1usd,EN,discard,keep_imputed,heuristic_default,dataset/txt_limpios/98.txt,dataset/paginas_descargadas/98.html
99,BUSCAR PRODUCTOS,Ingresa,100.00 g,UNKNOWN,Desconocido,unknown,cafe,sin_categoria,cafe,True,0.8464085797090152,443.0,443.0,443.0,443.0,False,original,1.0,default_1usd,EN,discard,keep_imputed,no_category_detected,dataset/txt_limpios/99.txt,dataset/paginas_descargadas/99.html
23,Cafe y te,Café Nescafé Clásico 300g,300g,MX,Chedraui,unknown,cafe,cafe,,False,0.0,,114.48,,6.1484,True,category_country_mean,18.62,from_mexico_cambio_dolar,EN,discard,keep_imputed,price_parse_failed;price<=0,dataset/txt_limpios/23.txt,dataset/paginas_descargadas/23.html
24,Cafe y te,Legal,180 g,MX,Chedraui,unknown,cafe,cafe,,False,0.0,88.0,88.0,4.7261,4.7261,False,original,18.62,from_mexico_cambio_dolar,ET,keep,keep,heuristic_default,dataset/txt_limpios/24.txt,dataset/paginas_descargadas/24.html
25,Cafe y te,Los Portales de Córdoba,170g,MX,Chedraui,unknown,cafe,cafe,,False,0.0,149.0,149.0,8.0021,8.0021,False,original,18.62,from_mexico_cambio_dolar,ET,keep,keep,heuristic_default,dataset/txt_limpios/25.txt,dataset/paginas_descargadas/25.html
26,Cafe y te,Blasón,400g,MX,Chedraui,unknown,cafe,cafe,,False,0.0,150.0,150.0,8.0559,8.0559,False,original,18.62,from_mexico_cambio_dolar,ET,keep,keep,heuristic_default,dataset/txt_limpios/26.txt,dataset/paginas_descargadas/26.html
27,Cafe y te,Garat,340g,MX,Chedraui,unknown,cafe,cafe,,False,0.0,150.0,150.0,8.0559,8.0559,False,original,18.62,from_mexico_cambio_dolar,ET,keep,keep,heuristic_default,dataset/txt_limpios/27.txt,dataset/paginas_descargadas/27.html
1732,Café e Infusiones,Café Instantáneo,150g,PE,Desconocido,unknown,cafe,cafe,,False,0.0,16.92,16.92,4.7662,4.7662,False,original,3.55,from_peru_cambio_dolar,ET,keep,keep,heuristic_default,dataset/txt_limpios/1732.txt,dataset/paginas_descargadas/1732.html
1742,Café instantáneo clásico lata,170 g,170 g,UNKNOWN,Desconocido,unknown,cafe,cafe,,False,0.0,4.99,4.99,4.99,4.99,False,original,1.0,default_1usd,EN,keep,keep,heuristic_default,dataset/txt_limpios/1742.txt,dataset/paginas_descargadas/1742.html
889,Café instantáneo clásico lata,170 g,170 g,UNKNOWN,Desconocido,unknown,cafe,cafe,,False,0.0,4.94,4.94,4.94,4.94,False,original,1.0,default_1usd,EN,keep,keep,heuristic_default,dataset/txt_limpios/889.txt,dataset/paginas_descargadas/889.html
1745,Café instantáneo institucional,400 g,400 g,UNKNOWN,Desconocido,unknown,cafe,cafe,,False,0.0,13.09,13.09,13.09,13.09,False,original,1.0,default_1usd,EN,keep,keep,heuristic_default,dataset/txt_limpios/1745.txt,dataset/paginas_descargadas/1745.html
643,Cebolla Blanca  1  und,(,,UNKNOWN,Desconocido,unknown,cebolla,cebolla,,False,0.0,,680.98,,680.985,True,category_country_mean,1.0,default_1usd,EN,discard,keep_imputed,price_parse_failed;price<=0,dataset/txt_limpios/643.txt,dataset/paginas_descargadas/643.html
800,CEBOLLA CABEZONA X 1000G,Unidades disponibles,1000G,UNKNOWN,Desconocido,unknown,cebolla,cebolla,,False,0.0,1000.0,1000.0,1000.0,1000.0,False,original,1.0,default_1usd,ET,keep,keep,heuristic_default,dataset/txt_limpios/800.txt,dataset/paginas_descargadas/800.html
1150,Centro de preferencia de la privacidad,Activas siempre,750g,PE,Desconocido,unknown,arroz,sin_categoria,arroz,True,0.9999999999997722,,55.14,,15.5336,True,country_mean,3.55,from_peru_cambio_dolar,ET,discard,keep_imputed,no_category_detected;price_parse_failed,dataset/txt_limpios/1150.txt,dataset/paginas_descargadas/1150.html
1151,Centro de preferencia de la privacidad,Activas siempre,750g,PE,Desconocido,unknown,arroz,sin_categoria,arroz,True,0.9999999999993452,,55.14,,15.5336,True,country_mean,3.55,from_peru_cambio_dolar,ET,discard,keep_imputed,no_category_detected;price_parse_failed,dataset/txt_limpios/1151.txt,dataset/paginas_descargadas/1151.html
1153,Centro de preferencia de la privacidad,Activas siempre,5Kg,PE,Desconocido,unknown,arroz,sin_categoria,arroz,True,0.9999999999845652,,55.14,,15.5336,True,country_mean,3.55,from_peru_cambio_dolar,ET,discard,keep_imputed,no_category_detected;price_parse_failed,dataset/txt_limpios/1153.txt,dataset/paginas_descargadas/1153.html
1155,Centro de preferencia de la privacidad,Activas siempre,8 Piezas,PE,Desconocido,unknown,huevo,sin_categoria,huevo,True,0.9999988207494276,,55.14,,15.5336,True,country_mean,3.55,from_peru_cambio_dolar,ET,discard,keep_imputed,no_category_detected;price_parse_failed,dataset/txt_limpios/1155.txt,dataset/paginas_descargadas/1155.html
1157,Centro de preferencia de la privacidad,Activas siempre,1.4Kg,PE,Desconocido,unknown,aceite vegetal,sin_categoria,aceite vegetal,True,0.999996765027614,,55.14,,15.5336,True,country_mean,3.55,from_peru_cambio_dolar,ET,discard,keep_imputed,no_category_detected;price_parse_failed,dataset/txt_limpios/1157.txt,dataset/paginas_descargadas/1157.html
1158,Centro de preferencia de la privacidad,Activas siempre,1Kg,PE,Desconocido,unknown,azucar,sin_categoria,azucar,True,0.9114149813964192,,55.14,,15.5336,True,country_mean,3.55,from_peru_cambio_dolar,ET,discard,keep_imputed,no_category_detected;price_parse_failed,dataset/txt_limpios/1158.txt,dataset/paginas_descargadas/1158.html
1160,Centro de preferencia de la privacidad,Activas siempre,200g,PE,Desconocido,unknown,cafe,sin_categoria,cafe,True,1.0,,55.14,,15.5336,True,country_mean,3.55,from_peru_cambio_dolar,ET,discard,keep_imputed,no_category_detected;price_parse_failed,dataset/txt_limpios/1160.txt,dataset/paginas_descargadas/1160.html
1161,Centro de preferencia de la privacidad,Activas siempre,190g,PE,Desconocido,unknown,cafe,sin_categoria,cafe,True,1.0,,55.14,,15.5336,True,country_mean,3.55,from_peru_cambio_dolar,ET,discard,keep_imputed,no_category_detected;price_parse_failed,dataset/txt_limpios/1161.txt,dataset/paginas_descargadas/1161.html
1162,Centro de preferencia de la privacidad,Activas siempre,200g,PE,Desconocido,unknown,cafe,sin_categoria,cafe,True,1.0,,55.14,,15.5336,True,country_mean,3.55,from_peru_cambio_dolar,ET,discard,keep_imputed,no_category_detected;price_parse_failed,dataset/txt_limpios/1162.txt,dataset/paginas_descargadas/1162.html
1163,Centro de preferencia de la privacidad,Activas siempre,170g,PE,Desconocido,unknown,cafe,sin_categoria,cafe,True,1.0,,55.14,,15.5336,True,country_mean,3.55,from_peru_cambio_dolar,ET,discard,keep_imputed,no_category_detected;price_parse_failed,dataset/txt_limpios/1163.txt,dataset/paginas_descargadas/1163.html
1164,Centro de preferencia de la privacidad,Activas siempre,850g,PE,Desconocido,unknown,cafe,sin_categoria,cafe,True,1.0,,55.14,,15.5336,True,country_mean,3.55,from_peru_cambio_dolar,ET,discard,keep_imputed,no_category_detected;price_parse_failed,dataset/txt_limpios/1164.txt,dataset/paginas_descargadas/1164.html
1165,Centro de preferencia de la privacidad,Activas siempre,900ml,PE,Desconocido,unknown,aceite vegetal,sin_categoria,aceite vegetal,True,0.9999999999999972,,55.14,,15.5336,True,country_mean,3.55,from_peru_cambio_dolar,ET,discard,keep_imputed,no_category_detected;price_parse_failed,dataset/txt_limpios/1165.txt,dataset/paginas_descargadas/1165.html
1166,Centro de preferencia de la privacidad,Activas siempre,500ml,PE,Desconocido,unknown,aceite vegetal,sin_categoria,aceite vegetal,True,0.9984561868614422,,55.14,,15.5336,True,country_mean,3.55,from_peru_cambio_dolar,ET,discard,keep_imputed,no_category_detected;price_parse_failed,dataset/txt_limpios/1166.txt,dataset/paginas_descargadas/1166.html
1167,Centro de preferencia de la privacidad,Activas siempre,1L,PE,Desconocido,unknown,aceite vegetal,sin_categoria,aceite vegetal,True,0.9945468064026354,,55.14,,15.5336,True,country_mean,3.55,from_peru_cambio_dolar,ET,discard,keep_imputed,no_category_detected;price_parse_failed,dataset/txt_limpios/1167.txt,dataset/paginas_descargadas/1167.html
1168,Centro de preferencia de la privacidad,Activas siempre,1L,PE,Desconocido,unknown,aceite vegetal,sin_categoria,aceite vegetal,True,0.999999760253936,,55.14,,15.5336,True,country_mean,3.55,from_peru_cambio_dolar,ET,discard,keep_imputed,no_category_detected;price_parse_failed,dataset/txt_limpios/1168.txt,dataset/paginas_descargadas/1168.html
1169,Centro de preferencia de la privacidad,Activas siempre,900ml,PE,Desconocido,unknown,aceite vegetal,sin_categoria,aceite vegetal,True,0.9632536240786642,,55.14,,15.5336,True,country_mean,3.55,from_peru_cambio_dolar,ET,discard,keep_imputed,no_category_detected;price_parse_failed,dataset/txt_limpios/1169.txt,dataset/paginas_descargadas/1169.html
1171,Centro de preferencia de la privacidad,Activas siempre,946ml,PE,Desconocido,unknown,leche,sin_categoria,leche,True,1.0,,55.14,,15.5336,True,country_mean,3.55,from_peru_cambio_dolar,ET,discard,keep_imputed,no_category_detected;price_parse_failed,dataset/txt_limpios/1171.txt,dataset/paginas_descargadas/1171.html
1173,Centro de preferencia de la privacidad,Activas siempre,1L,PE,Desconocido,unknown,leche,sin_categoria,leche,True,1.0,,55.14,,15.5336,True,country_mean,3.55,from_peru_cambio_dolar,ET,discard,keep_imputed,no_category_detected;price_parse_failed,dataset/txt_limpios/1173.txt,dataset/paginas_descargadas/1173.html
1174,Centro de preferencia de la privacidad,Activas siempre,800ml,PE,Desconocido,unknown,leche,sin_categoria,leche,True,1.0,,55.14,,15.5336,True,country_mean,3.55,from_peru_cambio_dolar,ET,discard,keep_imputed,no_category_detected;price_parse_failed,dataset/txt_limpios/1174.txt,dataset/paginas_descargadas/1174.html
1176,Centro de preferencia de la privacidad,Activas siempre,500g,PE,Desconocido,unknown,huevo,sin_categoria,huevo,True,1.0,,55.14,,15.5336,True,country_mean,3.55,from_peru_cambio_dolar,ET,discard,keep_imputed,no_category_detected;price_parse_failed,dataset/txt_limpios/1176.txt,dataset/paginas_descargadas/1176.html
1177,Centro de preferencia de la privacidad,Activas siempre,500g,PE,Desconocido,unknown,huevo,sin_categoria,huevo,True,1.0,,55.14,,15.5336,True,country_mean,3.55,from_peru_cambio_dolar,ET,discard,keep_imputed,no_category_detected;price_parse_failed,dataset/txt_limpios/1177.txt,dataset/paginas_descargadas/1177.html
1178,Centro de preferencia de la privacidad,Activas siempre,500g,PE,Desconocido,unknown,huevo,sin_categoria,huevo,True,1.0,,55.14,,15.5336,True,country_mean,3.55,from_peru_cambio_dolar,ET,discard,keep_imputed,no_category_detected;price_parse_failed,dataset/txt_limpios/1178.txt,dataset/paginas_descargadas/1178.html
1179,Centro de preferencia de la privacidad,Activas siempre,1Kg,PE,Desconocido,unknown,azucar,sin_categoria,azucar,True,1.0,,55.14,,15.5336,True,country_mean,3.55,from_peru_cambio_dolar,ET,discard,keep_imputed,no_category_detected;price_parse_failed,dataset/txt_limpios/1179.txt,dataset/paginas_descargadas/1179.html
