source_id,product_name,brand,unit,country,seller,availability,category_effective,category_canonical,category_canonical_imputed,category_is_imputed,category_model_confidence,price_amount,price_amount_filled,price_amount_usd,price_amount_usd_filled,price_is_imputed,price_imputation_source,fx_rate_local_per_usd,fx_source,es_status,decision,decision_imputed,reasons,txt_path,html_path
1050,colaborar con nuestros estudios para marketing. También puede configurarlas.,que podemos ofrecer.,150gr,PE,Desconocido,unknown,aceite vegetal,sin_categoria,aceite vegetal,True,0.993752632751777,16.92,16.92,4.7662,4.7662,False,original,3.55,from_peru_cambio_dolar,ET,discard,keep_imputed,no_category_detected,dataset/txt_limpios/1050.txt,dataset/paginas_descargadas/1050.html
1051,colaborar con nuestros estudios para marketing. También puede configurarlas.,que podemos ofrecer.,140g,PE,Desconocido,unknown,atun,sin_categoria,atun,True,0.9999461083256224,16.92,16.92,4.7662,4.7662,False,original,3.55,from_peru_cambio_dolar,ET,discard,keep_imputed,no_category_detected,dataset/txt_limpios/1051.txt,dataset/paginas_descargadas/1051.html
891,Comida congelada,frutos del maipo,1 Kg,UNKNOWN,Desconocido,unknown,papa,papa,,False,0.0,4.19,4.19,4.19,4.19,False,original,1.0,default_1usd,EN,keep,keep,heuristic_default,dataset/txt_limpios/891.txt,dataset/paginas_descargadas/891.html
392,COMUNICADO IMPORTANTE!,"Caro cliente,",2l,BR,Desconocido,unknown,papa,sin_categoria,papa,True,0.999999999795158,5.99,5.99,1.0995,1.0995,False,original,5.448,from_brasil_cambio_dolar,ET,discard,keep_imputed,no_category_detected,dataset/txt_limpios/392.txt,dataset/paginas_descargadas/392.html
579,DALE VIDA A TU JARDIN,🌷🌻​🌼​,1 L,AR,Desconocido,unknown,cafe,cafe,,False,0.0,1437.19,1437.19,1.1452,1.1452,False,original,1255.0,from_argentina_cambio_dolar,ET,keep,keep,heuristic_default,dataset/txt_limpios/579.txt,dataset/paginas_descargadas/579.html
580,DALE VIDA A TU JARDIN,🌷🌻​🌼​,1 L,AR,Desconocido,unknown,cafe,cafe,,False,0.0,1597.52,1597.52,1.2729,1.2729,False,original,1255.0,from_argentina_cambio_dolar,ET,keep,keep,heuristic_default,dataset/txt_limpios/580.txt,dataset/paginas_descargadas/580.html
581,DALE VIDA A TU JARDIN,🌷🌻​🌼​,1L,AR,Desconocido,unknown,cafe,cafe,,False,0.0,1145.45,1145.45,0.9127,0.9127,False,original,1255.0,from_argentina_cambio_dolar,ET,keep,keep,heuristic_default,dataset/txt_limpios/581.txt,dataset/paginas_descargadas/581.html
582,DALE VIDA A TU JARDIN,🌷🌻​🌼​,,AR,Desconocido,unknown,cafe,cafe,,False,0.0,1643.8,1643.8,1.3098,1.3098,False,original,1255.0,from_argentina_cambio_dolar,ET,keep,keep,heuristic_default,dataset/txt_limpios/582.txt,dataset/paginas_descargadas/582.html
583,DALE VIDA A TU JARDIN,🌷🌻​🌼​,,AR,Desconocido,unknown,cafe,sin_categoria,cafe,True,0.999999953980819,,1663.58,,1.3256,True,country_mean,1255.0,from_argentina_cambio_dolar,EN,discard,keep_imputed,no_category_detected;price_parse_failed,dataset/txt_limpios/583.txt,dataset/paginas_descargadas/583.html
584,DALE VIDA A TU JARDIN,🌷🌻​🌼​,,AR,Desconocido,unknown,cafe,sin_categoria,cafe,True,0.999999953980819,,1663.58,,1.3256,True,country_mean,1255.0,from_argentina_cambio_dolar,EN,discard,keep_imputed,no_category_detected;price_parse_failed,dataset/txt_limpios/584.txt,dataset/paginas_descargadas/584.html
585,DALE VIDA A TU JARDIN,🌷🌻​🌼​,,AR,Desconocido,unknown,cafe,sin_categoria,cafe,True,0.999999953980819,,1663.58,,1.3256,True,country_mean,1255.0,from_argentina_cambio_dolar,EN,discard,keep_imputed,no_category_detected;price_parse_failed,dataset/txt_limpios/585.txt,dataset/paginas_descargadas/585.html
586,DALE VIDA A TU JARDIN,🌷🌻​🌼​,560g,AR,Desconocido,unknown,cafe,cafe,,False,0.0,4693.39,4693.39,3.7398,3.7398,False,original,1255.0,from_argentina_cambio_dolar,ET,keep,keep,heuristic_default,dataset/txt_limpios/586.txt,dataset/paginas_descargadas/586.html
587,DALE VIDA A TU JARDIN,🌷🌻​🌼​,600 Gr,AR,Desconocido,unknown,cafe,cafe,,False,0.0,2652.07,2652.07,2.1132,2.1132,False,original,1255.0,from_argentina_cambio_dolar,ET,keep,keep,heuristic_default,dataset/txt_limpios/587.txt,dataset/paginas_descargadas/587.html
588,DALE VIDA A TU JARDIN,🌷🌻​🌼​,500 G,AR,Desconocido,unknown,cafe,cafe,,False,0.0,1561.98,1561.98,1.2446,1.2446,False,original,1255.0,from_argentina_cambio_dolar,ET,keep,keep,heuristic_default,dataset/txt_limpios/588.txt,dataset/paginas_descargadas/588.html
589,DALE VIDA A TU JARDIN,🌷🌻​🌼​,,AR,Desconocido,unknown,cafe,cafe,,False,0.0,1090.08,1090.08,0.8686,0.8686,False,original,1255.0,from_argentina_cambio_dolar,ET,keep,keep,heuristic_default,dataset/txt_limpios/589.txt,dataset/paginas_descargadas/589.html
590,DALE VIDA A TU JARDIN,🌷🌻​🌼​,,AR,Desconocido,unknown,cafe,cafe,,False,0.0,718.18,718.18,0.5723,0.5723,False,original,1255.0,from_argentina_cambio_dolar,ET,keep,keep,heuristic_default,dataset/txt_limpios/590.txt,dataset/paginas_descargadas/590.html
591,DALE VIDA A TU JARDIN,🌷🌻​🌼​,,AR,Desconocido,unknown,cafe,cafe,,False,0.0,990.91,990.91,0.7896,0.7896,False,original,1255.0,from_argentina_cambio_dolar,ET,keep,keep,heuristic_default,dataset/txt_limpios/591.txt,dataset/paginas_descargadas/591.html
592,DALE VIDA A TU JARDIN,🌷🌻​🌼​,,AR,Desconocido,unknown,cafe,cafe,,False,0.0,726.45,726.45,0.5788,0.5788,False,original,1255.0,from_argentina_cambio_dolar,ET,keep,keep,heuristic_default,dataset/txt_limpios/592.txt,dataset/paginas_descargadas/592.html
593,DALE VIDA A TU JARDIN,🌷🌻​🌼​,500G,AR,Desconocido,unknown,cafe,cafe,,False,0.0,742.98,742.98,0.592,0.592,False,original,1255.0,from_argentina_cambio_dolar,ET,keep,keep,heuristic_default,dataset/txt_limpios/593.txt,dataset/paginas_descargadas/593.html
594,DALE VIDA A TU JARDIN,🌷🌻​🌼​,500 GR,AR,Desconocido,unknown,cafe,cafe,,False,0.0,1404.13,1404.13,1.1188,1.1188,False,original,1255.0,from_argentina_cambio_dolar,ET,keep,keep,heuristic_default,dataset/txt_limpios/594.txt,dataset/paginas_descargadas/594.html
595,DALE VIDA A TU JARDIN,🌷🌻​🌼​,500G,AR,Desconocido,unknown,cafe,cafe,,False,0.0,926.45,926.45,0.7382,0.7382,False,original,1255.0,from_argentina_cambio_dolar,ET,keep,keep,heuristic_default,dataset/txt_limpios/595.txt,dataset/paginas_descargadas/595.html
596,DALE VIDA A TU JARDIN,🌷🌻​🌼​,,AR,Desconocido,unknown,cafe,sin_categoria,cafe,True,0.999999953980819,,1663.58,,1.3256,True,country_mean,1255.0,from_argentina_cambio_dolar,EN,discard,keep_imputed,no_category_detected;price_parse_failed,dataset/txt_limpios/596.txt,dataset/paginas_descargadas/596.html
597,DALE VIDA A TU JARDIN,🌷🌻​🌼​,500G,AR,Desconocido,unknown,cafe,cafe,,False,0.0,2536.36,2536.36,2.021,2.021,False,original,1255.0,from_argentina_cambio_dolar,ET,keep,keep,heuristic_default,dataset/txt_limpios/597.txt,dataset/paginas_descargadas/597.html
598,DALE VIDA A TU JARDIN,🌷🌻​🌼​,"2,5KG",AR,Desconocido,unknown,cafe,cafe,,False,0.0,8316.74,8316.74,6.6269,6.6269,False,original,1255.0,from_argentina_cambio_dolar,ET,keep,keep,heuristic_default,dataset/txt_limpios/598.txt,dataset/paginas_descargadas/598.html
599,DALE VIDA A TU JARDIN,🌷🌻​🌼​,800 GR,AR,Desconocido,unknown,cafe,cafe,,False,0.0,800.0,800.0,0.6375,0.6375,False,original,1255.0,from_argentina_cambio_dolar,ET,keep,keep,heuristic_default,dataset/txt_limpios/599.txt,dataset/paginas_descargadas/599.html
600,DALE VIDA A TU JARDIN,🌷🌻​🌼​,,AR,Desconocido,unknown,cafe,cafe,,False,0.0,1363.64,1363.64,1.0866,1.0866,False,original,1255.0,from_argentina_cambio_dolar,ET,keep,keep,heuristic_default,dataset/txt_limpios/600.txt,dataset/paginas_descargadas/600.html
601,DALE VIDA A TU JARDIN,🌷🌻​🌼​,,AR,Desconocido,unknown,cafe,cafe,,False,0.0,3178.51,3178.51,2.5327,2.5327,False,original,1255.0,from_argentina_cambio_dolar,ET,keep,keep,heuristic_default,dataset/txt_limpios/601.txt,dataset/paginas_descargadas/601.html
602,DALE VIDA A TU JARDIN,🌷🌻​🌼​,,AR,Desconocido,unknown,cafe,sin_categoria,cafe,True,0.999999953980819,,1663.58,,1.3256,True,country_mean,1255.0,from_argentina_cambio_dolar,EN,discard,keep_imputed,no_category_detected;price_parse_failed,dataset/txt_limpios/602.txt,dataset/paginas_descargadas/602.html
603,DALE VIDA A TU JARDIN,🌷🌻​🌼​,450G,AR,Desconocido,unknown,cafe,cafe,,False,0.0,450.0,450.0,0.3586,0.3586,False,original,1255.0,from_argentina_cambio_dolar,ET,keep,keep,heuristic_default,dataset/txt_limpios/603.txt,dataset/paginas_descargadas/603.html
604,DALE VIDA A TU JARDIN,🌷🌻​🌼​,,AR,Desconocido,unknown,cafe,sin_categoria,cafe,True,0.999999953980819,,1663.58,,1.3256,True,country_mean,1255.0,from_argentina_cambio_dolar,EN,discard,keep_imputed,no_category_detected;price_parse_failed,dataset/txt_limpios/604.txt,dataset/paginas_descargadas/604.html
605,DALE VIDA A TU JARDIN,🌷🌻​🌼​,250 GR,AR,Desconocido,unknown,cafe,cafe,,False,0.0,250.0,250.0,0.1992,0.1992,False,original,1255.0,from_argentina_cambio_dolar,ET,keep,keep,heuristic_default,dataset/txt_limpios/605.txt,dataset/paginas_descargadas/605.html
606,DALE VIDA A TU JARDIN,🌷🌻​🌼​,250 G,AR,Desconocido,unknown,cafe,cafe,,False,0.0,250.0,250.0,0.1992,0.1992,False,original,1255.0,from_argentina_cambio_dolar,ET,keep,keep,heuristic_default,dataset/txt_limpios/606.txt,dataset/paginas_descargadas/606.html
607,DALE VIDA A TU JARDIN,🌷🌻​🌼​,"1,5 Lt",AR,Desconocido,unknown,cafe,cafe,,False,0.0,2553.72,2553.72,2.0348,2.0348,False,original,1255.0,from_argentina_cambio_dolar,ET,keep,keep,heuristic_default,dataset/txt_limpios/607.txt,dataset/paginas_descargadas/607.html
608,DALE VIDA A TU JARDIN,🌷🌻​🌼​,2000CC,AR,Desconocido,unknown,cafe,cafe,,False,0.0,2644.63,2644.63,2.1073,2.1073,False,original,1255.0,from_argentina_cambio_dolar,ET,keep,keep,heuristic_default,dataset/txt_limpios/608.txt,dataset/paginas_descargadas/608.html
609,DALE VIDA A TU JARDIN,🌷🌻​🌼​,2.25 Lt,AR,Desconocido,unknown,cafe,cafe,,False,0.0,1900.83,1900.83,1.5146,1.5146,False,original,1255.0,from_argentina_cambio_dolar,ET,keep,keep,heuristic_default,dataset/txt_limpios/609.txt,dataset/paginas_descargadas/609.html
610,DALE VIDA A TU JARDIN,🌷🌻​🌼​,,AR,Desconocido,unknown,cafe,sin_categoria,cafe,True,0.999999953980819,,1663.58,,1.3256,True,country_mean,1255.0,from_argentina_cambio_dolar,EN,discard,keep_imputed,no_category_detected;price_parse_failed,dataset/txt_limpios/610.txt,dataset/paginas_descargadas/610.html
611,DALE VIDA A TU JARDIN,🌷🌻​🌼​,2.25 L,AR,Desconocido,unknown,cafe,cafe,,False,0.0,1809.92,1809.92,1.4422,1.4422,False,original,1255.0,from_argentina_cambio_dolar,ET,keep,keep,heuristic_default,dataset/txt_limpios/611.txt,dataset/paginas_descargadas/611.html
612,DALE VIDA A TU JARDIN,🌷🌻​🌼​,,AR,Desconocido,unknown,cafe,cafe,,False,0.0,904.07,904.07,0.7204,0.7204,False,original,1255.0,from_argentina_cambio_dolar,ET,keep,keep,heuristic_default,dataset/txt_limpios/612.txt,dataset/paginas_descargadas/612.html
613,DALE VIDA A TU JARDIN,🌷🌻​🌼​,600G,AR,Desconocido,unknown,cafe,cafe,,False,0.0,6420.66,6420.66,5.1161,5.1161,False,original,1255.0,from_argentina_cambio_dolar,ET,keep,keep,heuristic_default,dataset/txt_limpios/613.txt,dataset/paginas_descargadas/613.html
614,DALE VIDA A TU JARDIN,🌷🌻​🌼​,500G,AR,Desconocido,unknown,cafe,cafe,,False,0.0,2257.92,2257.92,1.7991,1.7991,False,original,1255.0,from_argentina_cambio_dolar,ET,keep,keep,heuristic_default,dataset/txt_limpios/614.txt,dataset/paginas_descargadas/614.html
1704,Desayuno y Dulces,Café,250 GR,UNKNOWN,Desconocido,unknown,cafe,cafe,,False,0.0,13.45,13.45,13.45,13.45,False,original,1.0,default_1usd,ET,keep,keep,heuristic_default,dataset/txt_limpios/1704.txt,dataset/paginas_descargadas/1704.html
1706,Desayuno y Dulces,Café,250 G,UNKNOWN,Desconocido,unknown,cafe,cafe,,False,0.0,3.99,3.99,3.99,3.99,False,original,1.0,default_1usd,ET,keep,keep,heuristic_default,dataset/txt_limpios/1706.txt,dataset/paginas_descargadas/1706.html
1708,Desayuno y Dulces,Café,50 g,UNKNOWN,Desconocido,unknown,cafe,cafe,,False,0.0,2.85,2.85,2.85,2.85,False,original,1.0,default_1usd,ET,keep,keep,heuristic_default,dataset/txt_limpios/1708.txt,dataset/paginas_descargadas/1708.html
1712,Desayuno y Dulces,Café,170 GR,UNKNOWN,Desconocido,unknown,cafe,cafe,,False,0.0,7.49,7.49,7.49,7.49,False,original,1.0,default_1usd,ET,keep,keep,heuristic_default,dataset/txt_limpios/1712.txt,dataset/paginas_descargadas/1712.html
1714,Desayuno y Dulces,Café,250 GR,UNKNOWN,Desconocido,unknown,cafe,cafe,,False,0.0,13.2,13.2,13.2,13.2,False,original,1.0,default_1usd,ET,keep,keep,heuristic_default,dataset/txt_limpios/1714.txt,dataset/paginas_descargadas/1714.html
966,Desayuno y Dulces,Café,50 g,UNKNOWN,Desconocido,unknown,cafe,cafe,,False,0.0,2.85,2.85,2.85,2.85,False,original,1.0,default_1usd,ET,keep,keep,heuristic_default,dataset/txt_limpios/966.txt,dataset/paginas_descargadas/966.html
508,Descripción del producto,MARCA,1l,UNKNOWN,Desconocido,unknown,leche,sin_categoria,leche,True,1.0,50.0,50.0,50.0,50.0,False,original,1.0,default_1usd,ET,discard,keep_imputed,no_category_detected,dataset/txt_limpios/508.txt,dataset/paginas_descargadas/508.html
509,Descripción del producto,MARCA,610g,UNKNOWN,Desconocido,unknown,leche,sin_categoria,leche,True,1.0,6550.0,6550.0,6550.0,6550.0,False,original,1.0,default_1usd,EN,discard,keep_imputed,no_category_detected,dataset/txt_limpios/509.txt,dataset/paginas_descargadas/509.html
510,Descripción del producto,MARCA,550g,UNKNOWN,Desconocido,unknown,leche,sin_categoria,leche,True,1.0,6434.0,6434.0,6434.0,6434.0,False,original,1.0,default_1usd,ET,discard,keep_imputed,no_category_detected,dataset/txt_limpios/510.txt,dataset/paginas_descargadas/510.html
511,Descripción del producto,MARCA,550g,UNKNOWN,Desconocido,unknown,leche,sin_categoria,leche,True,0.9999999999902414,600.0,600.0,600.0,600.0,False,original,1.0,default_1usd,EN,discard,keep_imputed,no_category_detected,dataset/txt_limpios/511.txt,dataset/paginas_descargadas/511.html
513,Descripción del producto,MARCA,1kg,UNKNOWN,Desconocido,unknown,pan,sin_categoria,pan,True,0.8249018594239768,1312.0,1312.0,1312.0,1312.0,False,original,1.0,default_1usd,ET,discard,keep_imputed,no_category_detected,dataset/txt_limpios/513.txt,dataset/paginas_descargadas/513.html
514,Descripción del producto,MARCA,1 Kg,UNKNOWN,Desconocido,unknown,azucar,sin_categoria,azucar,True,0.9998648592567764,1299.0,1299.0,1299.0,1299.0,False,original,1.0,default_1usd,ET,discard,keep_imputed,no_category_detected,dataset/txt_limpios/514.txt,dataset/paginas_descargadas/514.html
515,Descripción del producto,Azúcar Cristal Uniao 1kg,1kg,UNKNOWN,Desconocido,unknown,azucar,azucar,,False,0.0,990.0,990.0,990.0,990.0,False,original,1.0,default_1usd,ET,keep,keep,heuristic_default,dataset/txt_limpios/515.txt,dataset/paginas_descargadas/515.html
516,Descripción del producto,MARCA,800g,UNKNOWN,Desconocido,unknown,azucar,sin_categoria,azucar,True,0.9999996692204614,1699.0,1699.0,1699.0,1699.0,False,original,1.0,default_1usd,EN,discard,keep_imputed,no_category_detected,dataset/txt_limpios/516.txt,dataset/paginas_descargadas/516.html
517,Descripción del producto,Azúcar AZUCEL 1kg,1kg,UNKNOWN,Desconocido,unknown,azucar,azucar,,False,0.0,4399.0,4399.0,4399.0,4399.0,False,original,1.0,default_1usd,EN,keep,keep,heuristic_default,dataset/txt_limpios/517.txt,dataset/paginas_descargadas/517.html
1756,Devolver este producto es gratis,SUPER POLLO,500 g,UNKNOWN,Desconocido,unknown,aceite vegetal,aceite vegetal,,False,0.0,3.99,3.99,3.99,3.99,False,original,1.0,default_1usd,ET,keep,keep,heuristic_default,dataset/txt_limpios/1756.txt,dataset/paginas_descargadas/1756.html
1316,El almacenamiento local parece estar deshabilitado en tu navegador.,Aprende,1L,US,Desconocido,unknown,cerveza,sin_categoria,cerveza,True,0.699531049101786,2.05,2.05,2.05,2.05,False,original,1.0,default_1usd,ET,discard,keep_imputed,no_category_detected,dataset/txt_limpios/1316.txt,dataset/paginas_descargadas/1316.html
1317,El almacenamiento local parece estar deshabilitado en tu navegador.,Aprende,1L,UNKNOWN,Desconocido,unknown,leche,leche,,False,0.0,1.33,1.33,1.33,1.33,False,original,1.0,default_1usd,ET,keep,keep,heuristic_default,dataset/txt_limpios/1317.txt,dataset/paginas_descargadas/1317.html
1318,El almacenamiento local parece estar deshabilitado en tu navegador.,Aprende,1L,UNKNOWN,Desconocido,unknown,leche,leche,,False,0.0,1.5,1.5,1.5,1.5,False,original,1.0,default_1usd,ET,keep,keep,heuristic_default,dataset/txt_limpios/1318.txt,dataset/paginas_descargadas/1318.html
1319,El almacenamiento local parece estar deshabilitado en tu navegador.,Aprende,900 ML,UNKNOWN,Desconocido,unknown,leche,leche,,False,0.0,0.89,0.89,0.89,0.89,False,original,1.0,default_1usd,ET,keep,keep,heuristic_default,dataset/txt_limpios/1319.txt,dataset/paginas_descargadas/1319.html
1320,El almacenamiento local parece estar deshabilitado en tu navegador.,Aprende,330ML,UNKNOWN,Desconocido,unknown,cerveza,cerveza,,False,0.0,2.2,2.2,2.2,2.2,False,original,1.0,default_1usd,ET,keep,keep,heuristic_default,dataset/txt_limpios/1320.txt,dataset/paginas_descargadas/1320.html
1321,El almacenamiento local parece estar deshabilitado en tu navegador.,Aprende,500ML,UNKNOWN,Desconocido,unknown,cerveza,sin_categoria,cerveza,True,0.871061728765229,3.23,3.23,3.23,3.23,False,original,1.0,default_1usd,ET,discard,keep_imputed,no_category_detected,dataset/txt_limpios/1321.txt,dataset/paginas_descargadas/1321.html
1322,El almacenamiento local parece estar deshabilitado en tu navegador.,Aprende,355ML,UNKNOWN,Desconocido,unknown,cerveza,cerveza,,False,0.0,6.98,6.98,6.98,6.98,False,original,1.0,default_1usd,ET,keep,keep,heuristic_default,dataset/txt_limpios/1322.txt,dataset/paginas_descargadas/1322.html
1324,El almacenamiento local parece estar deshabilitado en tu navegador.,Aprende,355ml,UNKNOWN,Desconocido,unknown,cerveza,cerveza,,False,0.0,5.81,5.81,5.81,5.81,False,original,1.0,default_1usd,ET,keep,keep,heuristic_default,dataset/txt_limpios/1324.txt,dataset/paginas_descargadas/1324.html
1325,El almacenamiento local parece estar deshabilitado en tu navegador.,Aprende,550GR,UNKNOWN,Desconocido,unknown,pan,pan,,False,0.0,1.21,1.21,1.21,1.21,False,original,1.0,default_1usd,ET,keep,keep,heuristic_default,dataset/txt_limpios/1325.txt,dataset/paginas_descargadas/1325.html
1326,El almacenamiento local parece estar deshabilitado en tu navegador.,Aprende,560g,UNKNOWN,Desconocido,unknown,harina de trigo,harina de trigo,,False,0.0,2.12,2.12,2.12,2.12,False,original,1.0,default_1usd,ET,keep,keep,heuristic_default,dataset/txt_limpios/1326.txt,dataset/paginas_descargadas/1326.html
1327,El almacenamiento local parece estar deshabilitado en tu navegador.,Aprende,580g,UNKNOWN,Desconocido,unknown,pan,pan,,False,0.0,3.08,3.08,3.08,3.08,False,original,1.0,default_1usd,ET,keep,keep,heuristic_default,dataset/txt_limpios/1327.txt,dataset/paginas_descargadas/1327.html
1328,El almacenamiento local parece estar deshabilitado en tu navegador.,Aprende,3785Ml,UNKNOWN,Desconocido,unknown,azucar,sin_categoria,azucar,True,0.9999953965626124,1.97,1.97,1.97,1.97,False,original,1.0,default_1usd,ET,discard,keep_imputed,no_category_detected,dataset/txt_limpios/1328.txt,dataset/paginas_descargadas/1328.html
1329,El almacenamiento local parece estar deshabilitado en tu navegador.,Aprende,3785Ml,UNKNOWN,Desconocido,unknown,azucar,sin_categoria,azucar,True,0.9999953965626124,1.97,1.97,1.97,1.97,False,original,1.0,default_1usd,ET,discard,keep_imputed,no_category_detected,dataset/txt_limpios/1329.txt,dataset/paginas_descargadas/1329.html
1330,El almacenamiento local parece estar deshabilitado en tu navegador.,Aprende,3050 ML,UNKNOWN,Desconocido,unknown,azucar,azucar,,False,0.0,2.99,2.99,2.99,2.99,False,original,1.0,default_1usd,ET,keep,keep,heuristic_default,dataset/txt_limpios/1330.txt,dataset/paginas_descargadas/1330.html
1331,El almacenamiento local parece estar deshabilitado en tu navegador.,Aprende,3L,UNKNOWN,Desconocido,unknown,azucar,azucar,,False,0.0,2.92,2.92,2.92,2.92,False,original,1.0,default_1usd,ET,keep,keep,heuristic_default,dataset/txt_limpios/1331.txt,dataset/paginas_descargadas/1331.html
1332,El almacenamiento local parece estar deshabilitado en tu navegador.,Aprende,350G,UNKNOWN,Desconocido,unknown,cerveza,sin_categoria,cerveza,True,0.8710617904398866,350.0,350.0,350.0,350.0,False,original,1.0,default_1usd,ET,discard,keep_imputed,no_category_detected,dataset/txt_limpios/1332.txt,dataset/paginas_descargadas/1332.html
1333,El almacenamiento local parece estar deshabilitado en tu navegador.,Aprende,,UNKNOWN,Desconocido,unknown,cerveza,sin_categoria,cerveza,True,0.7405448768755568,55.13,55.13,55.13,55.13,False,original,1.0,default_1usd,ET,discard,keep_imputed,no_category_detected,dataset/txt_limpios/1333.txt,dataset/paginas_descargadas/1333.html
1334,El almacenamiento local parece estar deshabilitado en tu navegador.,Aprende,4Lb,UNKNOWN,Desconocido,unknown,cerveza,sin_categoria,cerveza,True,0.8710617904398866,2.25,2.25,2.25,2.25,False,original,1.0,default_1usd,ET,discard,keep_imputed,no_category_detected,dataset/txt_limpios/1334.txt,dataset/paginas_descargadas/1334.html
1335,El almacenamiento local parece estar deshabilitado en tu navegador.,Aprende,500G,UNKNOWN,Desconocido,unknown,azucar,sin_categoria,azucar,True,0.8668356658777723,1.75,1.75,1.75,1.75,False,original,1.0,default_1usd,ET,discard,keep_imputed,no_category_detected,dataset/txt_limpios/1335.txt,dataset/paginas_descargadas/1335.html
1336,El almacenamiento local parece estar deshabilitado en tu navegador.,Aprende,,UNKNOWN,Desconocido,unknown,cerveza,sin_categoria,cerveza,True,0.7405448768755568,3.41,3.41,3.41,3.41,False,original,1.0,default_1usd,ET,discard,keep_imputed,no_category_detected,dataset/txt_limpios/1336.txt,dataset/paginas_descargadas/1336.html
1337,El almacenamiento local parece estar deshabilitado en tu navegador.,Aprende,200G,UNKNOWN,Desconocido,unknown,cerveza,sin_categoria,cerveza,True,0.8710254923063799,0.41,0.41,0.41,0.41,False,original,1.0,default_1usd,ET,discard,keep_imputed,no_category_detected,dataset/txt_limpios/1337.txt,dataset/paginas_descargadas/1337.html
