source_id,product_name,brand,unit,country,seller,availability,category_effective,category_canonical,category_canonical_imputed,category_is_imputed,category_model_confidence,price_amount,price_amount_filled,price_amount_usd,price_amount_usd_filled,price_is_imputed,price_imputation_source,fx_rate_local_per_usd,fx_source,es_status,decision,decision_imputed,reasons,txt_path,html_path
401,Meu Desconto,Minha Lista,1L,BR,Desconocido,unknown,pan,sin_categoria,pan,True,0.999908915382599,4.99,4.99,0.9159,0.9159,False,original,5.448,from_brasil_cambio_dolar,EN,discard,keep_imputed,no_category_detected,dataset/txt_limpios/401.txt,dataset/paginas_descargadas/401.html
402,Meu Desconto,Minha Lista,1 Litro,BR,Desconocido,unknown,pan,sin_categoria,pan,True,0.9999258429125654,4.69,4.69,0.8609,0.8609,False,original,5.448,from_brasil_cambio_dolar,EN,discard,keep_imputed,no_category_detected,dataset/txt_limpios/402.txt,dataset/paginas_descargadas/402.html
403,Meu Desconto,Minha Lista,269ml,BR,Desconocido,unknown,pan,sin_categoria,pan,True,0.9998652076966724,3.49,3.49,0.6406,0.6406,False,original,5.448,from_brasil_cambio_dolar,EN,discard,keep_imputed,no_category_detected,dataset/txt_limpios/403.txt,dataset/paginas_descargadas/403.html
404,Meu Desconto,Minha Lista,350ml,BR,Desconocido,unknown,pan,sin_categoria,pan,True,0.9998652076966724,5.59,5.59,1.0261,1.0261,False,original,5.448,from_brasil_cambio_dolar,EN,discard,keep_imputed,no_category_detected,dataset/txt_limpios/404.txt,dataset/paginas_descargadas/404.html
405,Meu Desconto,Minha Lista,330ml,BR,Desconocido,unknown,pan,sin_categoria,pan,True,0.99979695265287,6.79,6.79,1.2463,1.2463,False,original,5.448,from_brasil_cambio_dolar,EN,discard,keep_imputed,no_category_detected,dataset/txt_limpios/405.txt,dataset/paginas_descargadas/405.html
406,Meu Desconto,Minha Lista,350ml,BR,Desconocido,unknown,pan,sin_categoria,pan,True,0.9998652076966724,3.79,3.79,0.6957,0.6957,False,original,5.448,from_brasil_cambio_dolar,EN,discard,keep_imputed,no_category_detected,dataset/txt_limpios/406.txt,dataset/paginas_descargadas/406.html
407,Meu Desconto,Minha Lista,269ml,BR,Desconocido,unknown,pan,sin_categoria,pan,True,0.9998652076966724,3.19,3.19,0.5855,0.5855,False,original,5.448,from_brasil_cambio_dolar,EN,discard,keep_imputed,no_category_detected,dataset/txt_limpios/407.txt,dataset/paginas_descargadas/407.html
408,Meu Desconto,Minha Lista,1kg,BR,Desconocido,unknown,pan,sin_categoria,pan,True,0.9994735561310936,28.9,28.9,5.3047,5.3047,False,original,5.448,from_brasil_cambio_dolar,EN,discard,keep_imputed,no_category_detected,dataset/txt_limpios/408.txt,dataset/paginas_descargadas/408.html
409,Meu Desconto,Minha Lista,1kg,UNKNOWN,Desconocido,unknown,pan,sin_categoria,pan,True,0.9994735561310936,1.0,1.0,1.0,1.0,False,original,1.0,default_1usd,EN,discard,keep_imputed,no_category_detected,dataset/txt_limpios/409.txt,dataset/paginas_descargadas/409.html
410,Meu Desconto,Minha Lista,800g,BR,Desconocido,unknown,pan,sin_categoria,pan,True,0.9996644062023736,21.9,21.9,4.0198,4.0198,False,original,5.448,from_brasil_cambio_dolar,EN,discard,keep_imputed,no_category_detected,dataset/txt_limpios/410.txt,dataset/paginas_descargadas/410.html
411,Meu Desconto,Minha Lista,1kg,BR,Desconocido,unknown,pan,sin_categoria,pan,True,0.9994735561310936,22.9,22.9,4.2034,4.2034,False,original,5.448,from_brasil_cambio_dolar,EN,discard,keep_imputed,no_category_detected,dataset/txt_limpios/411.txt,dataset/paginas_descargadas/411.html
413,Meu Desconto,Minha Lista,1kg,BR,Desconocido,unknown,pan,sin_categoria,pan,True,0.9994735561310936,5.09,5.09,0.9343,0.9343,False,original,5.448,from_brasil_cambio_dolar,EN,discard,keep_imputed,no_category_detected,dataset/txt_limpios/413.txt,dataset/paginas_descargadas/413.html
414,Meu Desconto,Minha Lista,1Kg,UNKNOWN,Desconocido,unknown,pan,sin_categoria,pan,True,0.9994735561310936,1.0,1.0,1.0,1.0,False,original,1.0,default_1usd,EN,discard,keep_imputed,no_category_detected,dataset/txt_limpios/414.txt,dataset/paginas_descargadas/414.html
415,Meu Desconto,Minha Lista,1Kg,BR,Desconocido,unknown,pan,sin_categoria,pan,True,0.9994735561310936,4.29,4.29,0.7874,0.7874,False,original,5.448,from_brasil_cambio_dolar,EN,discard,keep_imputed,no_category_detected,dataset/txt_limpios/415.txt,dataset/paginas_descargadas/415.html
416,Meu Desconto,Minha Lista,1kg,BR,Desconocido,unknown,pan,sin_categoria,pan,True,0.9994735561310936,4.79,4.79,0.8792,0.8792,False,original,5.448,from_brasil_cambio_dolar,EN,discard,keep_imputed,no_category_detected,dataset/txt_limpios/416.txt,dataset/paginas_descargadas/416.html
417,Meu Desconto,Minha Lista,1kg,BR,Desconocido,unknown,pan,sin_categoria,pan,True,0.9994735561310936,7.39,7.39,1.3565,1.3565,False,original,5.448,from_brasil_cambio_dolar,EN,discard,keep_imputed,no_category_detected,dataset/txt_limpios/417.txt,dataset/paginas_descargadas/417.html
418,Meu Desconto,Minha Lista,1Kg,BR,Desconocido,unknown,pan,sin_categoria,pan,True,0.9994735561310936,6.39,6.39,1.1729,1.1729,False,original,5.448,from_brasil_cambio_dolar,EN,discard,keep_imputed,no_category_detected,dataset/txt_limpios/418.txt,dataset/paginas_descargadas/418.html
419,Meu Desconto,Minha Lista,1kg,BR,Desconocido,unknown,pan,sin_categoria,pan,True,0.9994735561310936,5.29,5.29,0.971,0.971,False,original,5.448,from_brasil_cambio_dolar,EN,discard,keep_imputed,no_category_detected,dataset/txt_limpios/419.txt,dataset/paginas_descargadas/419.html
420,Meu Desconto,Minha Lista,1kg,UNKNOWN,Desconocido,unknown,pan,sin_categoria,pan,True,0.9994735561310936,1.0,1.0,1.0,1.0,False,original,1.0,default_1usd,EN,discard,keep_imputed,no_category_detected,dataset/txt_limpios/420.txt,dataset/paginas_descargadas/420.html
421,Meu Desconto,Minha Lista,1kg,BR,Desconocido,unknown,pan,sin_categoria,pan,True,0.9994735561310936,5.09,5.09,0.9343,0.9343,False,original,5.448,from_brasil_cambio_dolar,EN,discard,keep_imputed,no_category_detected,dataset/txt_limpios/421.txt,dataset/paginas_descargadas/421.html
1616,Multi Marca,"Papa Malla, 2 Kg",2 Kg,UNKNOWN,Desconocido,unknown,papa,papa,,False,0.0,2.69,2.69,2.69,2.69,False,original,1.0,default_1usd,ET,keep,keep,heuristic_default,dataset/txt_limpios/1616.txt,dataset/paginas_descargadas/1616.html
902,nuestra cocina,1 Kg,1 Kg,UNKNOWN,Desconocido,unknown,arroz,arroz,,False,0.0,1.59,1.59,1.59,1.59,False,original,1.0,default_1usd,EN,keep,keep,heuristic_default,dataset/txt_limpios/902.txt,dataset/paginas_descargadas/902.html
1544,Padaria e Matinais,Panes y Torradas,500g,BR,Desconocido,unknown,pan,pan,,False,0.0,8.78,8.78,1.6116,1.6116,False,original,5.448,from_brasil_cambio_dolar,ET,keep,keep,heuristic_default,dataset/txt_limpios/1544.txt,dataset/paginas_descargadas/1544.html
1548,Padaria e Matinais,Panes y Torradas,450g,BR,Desconocido,unknown,pan,pan,,False,0.0,13.99,13.99,2.5679,2.5679,False,original,5.448,from_brasil_cambio_dolar,ET,keep,keep,heuristic_default,dataset/txt_limpios/1548.txt,dataset/paginas_descargadas/1548.html
1555,Padaria e Matinais,Panes y Torradas,400g,BR,Desconocido,unknown,pan,pan,,False,0.0,8.78,8.78,1.6116,1.6116,False,original,5.448,from_brasil_cambio_dolar,ET,keep,keep,heuristic_default,dataset/txt_limpios/1555.txt,dataset/paginas_descargadas/1555.html
1564,Padaria e Matinais,Leites,1 L,BR,Desconocido,unknown,pan,sin_categoria,pan,True,0.9989571355866584,33.14,33.14,6.083,6.083,False,original,5.448,from_brasil_cambio_dolar,EN,discard,keep_imputed,no_category_detected,dataset/txt_limpios/1564.txt,dataset/paginas_descargadas/1564.html
1565,Padaria e Matinais,Leites,1 L,BR,Desconocido,unknown,pan,sin_categoria,pan,True,0.9989571355866584,33.14,33.14,6.083,6.083,False,original,5.448,from_brasil_cambio_dolar,EN,discard,keep_imputed,no_category_detected,dataset/txt_limpios/1565.txt,dataset/paginas_descargadas/1565.html
1566,Padaria e Matinais,Leites,1L,BR,Desconocido,unknown,pan,sin_categoria,pan,True,0.9988712809264204,5.99,5.99,1.0995,1.0995,False,original,5.448,from_brasil_cambio_dolar,EN,discard,keep_imputed,no_category_detected,dataset/txt_limpios/1566.txt,dataset/paginas_descargadas/1566.html
1568,Padaria e Matinais,Panes y Torradas,450g,BR,Desconocido,unknown,pan,pan,,False,0.0,33.14,33.14,6.083,6.083,False,original,5.448,from_brasil_cambio_dolar,ET,keep,keep,heuristic_default,dataset/txt_limpios/1568.txt,dataset/paginas_descargadas/1568.html
1614,Padaria e Matinais,Panes y Torradas,450g,BR,Desconocido,unknown,pan,pan,,False,0.0,11.9,11.9,2.1843,2.1843,False,original,5.448,from_brasil_cambio_dolar,ET,keep,keep,heuristic_default,dataset/txt_limpios/1614.txt,dataset/paginas_descargadas/1614.html
1737,Padaria e Matinais,Leites,1 Litro,BR,Desconocido,unknown,pan,sin_categoria,pan,True,0.998957958506796,5.15,5.15,0.9453,0.9453,False,original,5.448,from_brasil_cambio_dolar,EN,discard,keep_imputed,no_category_detected,dataset/txt_limpios/1737.txt,dataset/paginas_descargadas/1737.html
1740,Padaria e Matinais,Leites,1L,BR,Desconocido,unknown,pan,sin_categoria,pan,True,0.9988712809264204,5.99,5.99,1.0995,1.0995,False,original,5.448,from_brasil_cambio_dolar,EN,discard,keep_imputed,no_category_detected,dataset/txt_limpios/1740.txt,dataset/paginas_descargadas/1740.html
190,Padaria e Matinais,Panes y Torradas,500g,BR,Desconocido,unknown,pan,pan,,False,0.0,9.49,9.49,1.7419,1.7419,False,original,5.448,from_brasil_cambio_dolar,ET,keep,keep,heuristic_default,dataset/txt_limpios/190.txt,dataset/paginas_descargadas/190.html
191,Padaria e Matinais,Panes y Torradas,400g,BR,Desconocido,unknown,pan,pan,,False,0.0,9.69,9.69,1.7786,1.7786,False,original,5.448,from_brasil_cambio_dolar,ET,keep,keep,heuristic_default,dataset/txt_limpios/191.txt,dataset/paginas_descargadas/191.html
192,Padaria e Matinais,Panes y Torradas,450g,UNKNOWN,Desconocido,unknown,pan,pan,,False,0.0,,44.23,,44.2339,True,category_country_mean,1.0,default_1usd,ET,discard,keep_imputed,price_parse_failed;price<=0,dataset/txt_limpios/192.txt,dataset/paginas_descargadas/192.html
193,Padaria e Matinais,Panes y Torradas,450g,BR,Desconocido,unknown,pan,pan,,False,0.0,17.59,17.59,3.2287,3.2287,False,original,5.448,from_brasil_cambio_dolar,ET,keep,keep,heuristic_default,dataset/txt_limpios/193.txt,dataset/paginas_descargadas/193.html
194,Padaria e Matinais,Panes y Torradas,450g,BR,Desconocido,unknown,pan,pan,,False,0.0,6.19,6.19,1.1362,1.1362,False,original,5.448,from_brasil_cambio_dolar,ET,keep,keep,heuristic_default,dataset/txt_limpios/194.txt,dataset/paginas_descargadas/194.html
205,Padaria e Matinais,Leites,1 Litro,UNKNOWN,Desconocido,unknown,pan,sin_categoria,pan,True,0.998957958506796,,234.19,,234.1938,True,country_mean,1.0,default_1usd,EN,discard,keep_imputed,no_category_detected;price_parse_failed,dataset/txt_limpios/205.txt,dataset/paginas_descargadas/205.html
206,Padaria e Matinais,Leites,1L,BR,Desconocido,unknown,pan,sin_categoria,pan,True,0.9988712809264204,6.09,6.09,1.1178,1.1178,False,original,5.448,from_brasil_cambio_dolar,EN,discard,keep_imputed,no_category_detected,dataset/txt_limpios/206.txt,dataset/paginas_descargadas/206.html
207,Padaria e Matinais,Leites,1 L,BR,Desconocido,unknown,pan,sin_categoria,pan,True,0.9989571355866584,4.79,4.79,0.8792,0.8792,False,original,5.448,from_brasil_cambio_dolar,EN,discard,keep_imputed,no_category_detected,dataset/txt_limpios/207.txt,dataset/paginas_descargadas/207.html
208,Padaria e Matinais,Leites,1 L,UNKNOWN,Desconocido,unknown,pan,sin_categoria,pan,True,0.9989571355866584,,234.19,,234.1938,True,country_mean,1.0,default_1usd,EN,discard,keep_imputed,no_category_detected;price_parse_failed,dataset/txt_limpios/208.txt,dataset/paginas_descargadas/208.html
209,Padaria e Matinais,Leites,1L,UNKNOWN,Desconocido,unknown,pan,sin_categoria,pan,True,0.9988712809264204,,234.19,,234.1938,True,country_mean,1.0,default_1usd,EN,discard,keep_imputed,no_category_detected;price_parse_failed,dataset/txt_limpios/209.txt,dataset/paginas_descargadas/209.html
1351,PAN MOLDE BLANCO FLOR DE ORO 550 G,Comparar,550 G,US,Desconocido,unknown,pan,pan,,False,0.0,1.05,1.05,1.05,1.05,False,original,1.0,default_1usd,EN,keep,keep,heuristic_default,dataset/txt_limpios/1351.txt,dataset/paginas_descargadas/1351.html
1352,PAN MOLDE BLANCO MODERNA 550 G,Comparar,550 G,US,Desconocido,unknown,pan,pan,,False,0.0,1.59,1.59,1.59,1.59,False,original,1.0,default_1usd,ET,keep,keep,heuristic_default,dataset/txt_limpios/1352.txt,dataset/paginas_descargadas/1352.html
1350,PAN MOLDE BLANCO SUPAN 550 G,Comparar,550 G,US,Desconocido,unknown,pan,pan,,False,0.0,1.56,1.56,1.56,1.56,False,original,1.0,default_1usd,EN,keep,keep,heuristic_default,dataset/txt_limpios/1350.txt,dataset/paginas_descargadas/1350.html
793,PAN TAJADO MANTEQUILLA 450G,Unidades disponibles,450G,UNKNOWN,Desconocido,unknown,leche,leche,,False,0.0,450.0,450.0,450.0,450.0,False,original,1.0,default_1usd,ET,keep,keep,heuristic_default,dataset/txt_limpios/793.txt,dataset/paginas_descargadas/793.html
792,PAN TAJADO MULTIGRANOS 450 G,Unidades disponibles,450 G,UNKNOWN,Desconocido,unknown,pan,pan,,False,0.0,450.0,450.0,450.0,450.0,False,original,1.0,default_1usd,ET,keep,keep,heuristic_default,dataset/txt_limpios/792.txt,dataset/paginas_descargadas/792.html
794,PAN VITAL FRUTICEREAL 500 G,Unidades disponibles,500 G,UNKNOWN,Desconocido,unknown,pan,pan,,False,0.0,500.0,500.0,500.0,500.0,False,original,1.0,default_1usd,ET,keep,keep,heuristic_default,dataset/txt_limpios/794.txt,dataset/paginas_descargadas/794.html
512,Panaderia Propia,Panificados,550g,UNKNOWN,Desconocido,unknown,leche,sin_categoria,leche,True,0.9999853010763256,600.0,600.0,600.0,600.0,False,original,1.0,default_1usd,EN,discard,keep_imputed,no_category_detected,dataset/txt_limpios/512.txt,dataset/paginas_descargadas/512.html
19,Panaderia y tortilleria,Pan salado,675g,MX,Chedraui,unknown,pan,pan,,False,0.0,,72.0,,3.8668,True,category_country_mean,18.62,from_mexico_cambio_dolar,ET,discard,keep_imputed,price_parse_failed;price<=0,dataset/txt_limpios/19.txt,dataset/paginas_descargadas/19.html
1717,Panadería y Pastelería,Panadería,570 GR,UNKNOWN,Desconocido,unknown,pan,pan,,False,0.0,2.49,2.49,2.49,2.49,False,original,1.0,default_1usd,ET,keep,keep,heuristic_default,dataset/txt_limpios/1717.txt,dataset/paginas_descargadas/1717.html
1719,Panadería y Pastelería,Panadería,580 GR,UNKNOWN,Desconocido,unknown,pan,pan,,False,0.0,2.99,2.99,2.99,2.99,False,original,1.0,default_1usd,ET,keep,keep,heuristic_default,dataset/txt_limpios/1719.txt,dataset/paginas_descargadas/1719.html
1721,Panadería y Pastelería,Panadería,740 g,UNKNOWN,Desconocido,unknown,pan,pan,,False,0.0,2.59,2.59,2.59,2.59,False,original,1.0,default_1usd,ET,keep,keep,heuristic_default,dataset/txt_limpios/1721.txt,dataset/paginas_descargadas/1721.html
1747,Panadería y Pastelería,Panadería,580 GR,UNKNOWN,Desconocido,unknown,pan,pan,,False,0.0,2.69,2.69,2.69,2.69,False,original,1.0,default_1usd,ET,keep,keep,heuristic_default,dataset/txt_limpios/1747.txt,dataset/paginas_descargadas/1747.html
1753,Panadería y Pastelería,Panadería,580 g,UNKNOWN,Desconocido,unknown,pan,pan,,False,0.0,2.59,2.59,2.59,2.59,False,original,1.0,default_1usd,ET,keep,keep,heuristic_default,dataset/txt_limpios/1753.txt,dataset/paginas_descargadas/1753.html
892,Panadería y repostería,Pan,500 g,UNKNOWN,Desconocido,unknown,pan,pan,,False,0.0,1.95,1.95,1.95,1.95,False,original,1.0,default_1usd,EN,keep,keep,heuristic_default,dataset/txt_limpios/892.txt,dataset/paginas_descargadas/892.html
893,Panadería y repostería,Pan,750 g,UNKNOWN,Desconocido,unknown,pan,pan,,False,0.0,2.54,2.54,2.54,2.54,False,original,1.0,default_1usd,EN,keep,keep,heuristic_default,dataset/txt_limpios/893.txt,dataset/paginas_descargadas/893.html
894,Panadería y repostería,Pan,740 g,UNKNOWN,Desconocido,unknown,pan,pan,,False,0.0,2.19,2.19,2.19,2.19,False,original,1.0,default_1usd,EN,keep,keep,heuristic_default,dataset/txt_limpios/894.txt,dataset/paginas_descargadas/894.html
895,Panadería y repostería,Pan,800 g,UNKNOWN,Desconocido,unknown,pan,pan,,False,0.0,,44.23,,44.2339,True,category_country_mean,1.0,default_1usd,EN,discard,keep_imputed,price_parse_failed;price<=0,dataset/txt_limpios/895.txt,dataset/paginas_descargadas/895.html
896,Panadería y repostería,Pan,,UNKNOWN,Desconocido,unknown,pan,pan,,False,0.0,1.76,1.76,1.76,1.76,False,original,1.0,default_1usd,EN,keep,keep,heuristic_default,dataset/txt_limpios/896.txt,dataset/paginas_descargadas/896.html
801,PAPA AIRFRYER MCCAIN X 500G,Unidades disponibles,500G,UNKNOWN,Desconocido,unknown,papa,papa,,False,0.0,500.0,500.0,500.0,500.0,False,original,1.0,default_1usd,EN,keep,keep,heuristic_default,dataset/txt_limpios/801.txt,dataset/paginas_descargadas/801.html
802,PAPA CAPIRA X 2500 G,Unidades disponibles,2500 G,UNKNOWN,Desconocido,unknown,cebolla,cebolla,,False,0.0,2500.0,2500.0,2500.0,2500.0,False,original,1.0,default_1usd,EN,keep,keep,heuristic_default,dataset/txt_limpios/802.txt,dataset/paginas_descargadas/802.html
518,"Pasta Seca, Lista Y Rellenas",Pastas Secas,500g,UNKNOWN,Desconocido,unknown,pasta seca,pasta seca,,False,0.0,990.0,990.0,990.0,990.0,False,original,1.0,default_1usd,EN,keep,keep,heuristic_default,dataset/txt_limpios/518.txt,dataset/paginas_descargadas/518.html
519,"Pasta Seca, Lista Y Rellenas",Pastas Secas,500g,UNKNOWN,Desconocido,unknown,pasta seca,pasta seca,,False,0.0,975.0,975.0,975.0,975.0,False,original,1.0,default_1usd,EN,keep,keep,heuristic_default,dataset/txt_limpios/519.txt,dataset/paginas_descargadas/519.html
520,"Pasta Seca, Lista Y Rellenas",Pastas Secas,500 GR,UNKNOWN,Desconocido,unknown,pasta seca,pasta seca,,False,0.0,1137.5,1137.5,1137.5,1137.5,False,original,1.0,default_1usd,EN,keep,keep,heuristic_default,dataset/txt_limpios/520.txt,dataset/paginas_descargadas/520.html
521,"Pasta Seca, Lista Y Rellenas",Pastas Secas,500 Gr,UNKNOWN,Desconocido,unknown,pasta seca,pasta seca,,False,0.0,4224.35,4224.35,4224.35,4224.35,False,original,1.0,default_1usd,EN,keep,keep,heuristic_default,dataset/txt_limpios/521.txt,dataset/paginas_descargadas/521.html
522,"Pasta Seca, Lista Y Rellenas",Pastas Secas,500 GR,UNKNOWN,Desconocido,unknown,pasta seca,pasta seca,,False,0.0,4088.5,4088.5,4088.5,4088.5,False,original,1.0,default_1usd,EN,keep,keep,heuristic_default,dataset/txt_limpios/522.txt,dataset/paginas_descargadas/522.html
926,Pasta spaghetti integral,400 g,400 g,UNKNOWN,Desconocido,unknown,huevo,sin_categoria,huevo,True,0.9999999838438348,950.0,950.0,950.0,950.0,False,original,1.0,default_1usd,EN,discard,keep_imputed,no_category_detected,dataset/txt_limpios/926.txt,dataset/paginas_descargadas/926.html
923,Pasta spaghetti n°5,400 g,400 g,UNKNOWN,Desconocido,unknown,huevo,sin_categoria,huevo,True,0.9999999955443296,680.0,680.0,680.0,680.0,False,original,1.0,default_1usd,EN,discard,keep_imputed,no_category_detected,dataset/txt_limpios/923.txt,dataset/paginas_descargadas/923.html
925,Pasta spaghetti n°5,400 g,400 g,UNKNOWN,Desconocido,unknown,huevo,sin_categoria,huevo,True,0.9999999950618524,470.0,470.0,470.0,470.0,False,original,1.0,default_1usd,EN,discard,keep_imputed,no_category_detected,dataset/txt_limpios/925.txt,dataset/paginas_descargadas/925.html
924,Pasta spaghetti n°5 al huevo,400 g,400 g,UNKNOWN,Desconocido,unknown,huevo,huevo,,False,0.0,1.22,1.22,1.22,1.22,False,original,1.0,default_1usd,EN,discard,keep_imputed,heuristic_default,dataset/txt_limpios/924.txt,dataset/paginas_descargadas/924.html
910,Pechuga deshuesada de pollo co...,4.5 Kg,4.5 Kg,UNKNOWN,Desconocido,unknown,pollo entero,sin_categoria,pollo entero,True,0.7298688613641554,,234.19,,234.1938,True,country_mean,1.0,default_1usd,EN,discard,keep_imputed,no_category_detected;price_parse_failed,dataset/txt_limpios/910.txt,dataset/paginas_descargadas/910.html
1562,Pratos Prontos e Massas Frescas,Massas Frescas,500g,BR,Desconocido,unknown,pasta seca,sin_categoria,pasta seca,True,0.6593941506714305,9.49,9.49,1.7419,1.7419,False,original,5.448,from_brasil_cambio_dolar,EN,discard,keep_imputed,no_category_detected,dataset/txt_limpios/1562.txt,dataset/paginas_descargadas/1562.html
203,Pratos Prontos e Massas Frescas,Massas Frescas,500g,BR,Desconocido,unknown,pasta seca,sin_categoria,pasta seca,True,0.6593941506714305,10.79,10.79,1.9805,1.9805,False,original,5.448,from_brasil_cambio_dolar,EN,discard,keep_imputed,no_category_detected,dataset/txt_limpios/203.txt,dataset/paginas_descargadas/203.html
285,Preços no Site e App podem ser diferentes das Lojas Físicas.,Shipping,500 G,BR,Desconocido,unknown,pasta seca,sin_categoria,pasta seca,True,0.8501585053913469,24.99,24.99,4.587,4.587,False,original,5.448,from_brasil_cambio_dolar,EN,discard,keep_imputed,no_category_detected,dataset/txt_limpios/285.txt,dataset/paginas_descargadas/285.html
290,Preços no Site e App podem ser diferentes das Lojas Físicas.,Shipping,500 G,BR,Desconocido,unknown,pasta seca,sin_categoria,pasta seca,True,0.8501585053913469,24.99,24.99,4.587,4.587,False,original,5.448,from_brasil_cambio_dolar,EN,discard,keep_imputed,no_category_detected,dataset/txt_limpios/290.txt,dataset/paginas_descargadas/290.html
294,Preços no Site e App podem ser diferentes das Lojas Físicas.,Shipping,255 Ml,BR,Desconocido,unknown,cerveza,sin_categoria,cerveza,True,0.9110063750958242,29.99,29.99,5.5048,5.5048,False,original,5.448,from_brasil_cambio_dolar,EN,discard,keep_imputed,no_category_detected,dataset/txt_limpios/294.txt,dataset/paginas_descargadas/294.html
295,Preços no Site e App podem ser diferentes das Lojas Físicas.,Shipping,500 G,BR,Desconocido,unknown,pasta seca,sin_categoria,pasta seca,True,0.8501585053913469,15.99,15.99,2.935,2.935,False,original,5.448,from_brasil_cambio_dolar,EN,discard,keep_imputed,no_category_detected,dataset/txt_limpios/295.txt,dataset/paginas_descargadas/295.html
307,Preços no Site e App podem ser diferentes das Lojas Físicas.,Shipping,600 Ml,BR,Desconocido,unknown,cerveza,sin_categoria,cerveza,True,0.9109121142764656,24.99,24.99,4.587,4.587,False,original,5.448,from_brasil_cambio_dolar,EN,discard,keep_imputed,no_category_detected,dataset/txt_limpios/307.txt,dataset/paginas_descargadas/307.html
