source_id,product_name,brand,unit,country,seller,availability,category_effective,category_canonical,category_canonical_imputed,category_is_imputed,category_model_confidence,price_amount,price_amount_filled,price_amount_usd,price_amount_usd_filled,price_is_imputed,price_imputation_source,fx_rate_local_per_usd,fx_source,es_status,decision,decision_imputed,reasons,txt_path,html_path
641,$ 12.800,Ver detalles del producto,15G,UNKNOWN,Desconocido,unknown,azucar,sin_categoria,azucar,True,0.7233856294730636,12.8,12.8,12.8,12.8,False,original,1.0,default_1usd,EN,discard,keep_imputed,no_category_detected,dataset/txt_limpios/641.txt,dataset/paginas_descargadas/641.html
626,(Gr a $ 10),$ 8.650,0.2 g,UNKNOWN,Desconocido,unknown,cafe,sin_categoria,cafe,True,0.9261816045185276,10.0,10.0,10.0,10.0,False,original,1.0,default_1usd,EN,discard,keep_imputed,no_category_detected,dataset/txt_limpios/626.txt,dataset/paginas_descargadas/626.html
627,(Gr a $ 10),20,480G,UNKNOWN,Desconocido,unknown,cafe,sin_categoria,cafe,True,0.9313465403783502,10.0,10.0,10.0,10.0,False,original,1.0,default_1usd,EN,discard,keep_imputed,no_category_detected,dataset/txt_limpios/627.txt,dataset/paginas_descargadas/627.html
630,(Gr a $ 10),20,,UNKNOWN,Desconocido,unknown,cafe,sin_categoria,cafe,True,0.9548198805580964,10.0,10.0,10.0,10.0,False,original,1.0,default_1usd,EN,discard,keep_imputed,no_category_detected,dataset/txt_limpios/630.txt,dataset/paginas_descargadas/630.html
766,(Gr a $ 11),$ 6.700,,UNKNOWN,Desconocido,unknown,pan,sin_categoria,pan,True,0.972087433279663,11.0,11.0,11.0,11.0,False,original,1.0,default_1usd,EN,discard,keep_imputed,no_category_detected,dataset/txt_limpios/766.txt,dataset/paginas_descargadas/766.html
767,(Gr a $ 12),$ 7.150,,UNKNOWN,Desconocido,unknown,pan,sin_categoria,pan,True,0.6740349023412908,12.0,12.0,12.0,12.0,False,original,1.0,default_1usd,EN,discard,keep_imputed,no_category_detected,dataset/txt_limpios/767.txt,dataset/paginas_descargadas/767.html
778,(Gr a $ 19),$ 39.000,,UNKNOWN,Desconocido,unknown,cafe,sin_categoria,cafe,True,0.7749927987747024,19.0,19.0,19.0,19.0,False,original,1.0,default_1usd,EN,discard,keep_imputed,no_category_detected,dataset/txt_limpios/778.txt,dataset/paginas_descargadas/778.html
628,(Gr a $ 21),$ 10.550,,UNKNOWN,Desconocido,unknown,pan,sin_categoria,pan,True,0.951518145137768,21.0,21.0,21.0,21.0,False,original,1.0,default_1usd,EN,discard,keep_imputed,no_category_detected,dataset/txt_limpios/628.txt,dataset/paginas_descargadas/628.html
765,(Gr a $ 21),20,,UNKNOWN,Desconocido,unknown,pan,sin_categoria,pan,True,0.6990791337488987,21.0,21.0,21.0,21.0,False,original,1.0,default_1usd,EN,discard,keep_imputed,no_category_detected,dataset/txt_limpios/765.txt,dataset/paginas_descargadas/765.html
763,(Gr a $ 23),$ 11.600,,UNKNOWN,Desconocido,unknown,pan,sin_categoria,pan,True,0.7811752627469835,23.0,23.0,23.0,23.0,False,original,1.0,default_1usd,EN,discard,keep_imputed,no_category_detected,dataset/txt_limpios/763.txt,dataset/paginas_descargadas/763.html
629,(Gr a $ 29),$ 13.450,,UNKNOWN,Desconocido,unknown,cafe,sin_categoria,cafe,True,0.7117536398038146,29.0,29.0,29.0,29.0,False,original,1.0,default_1usd,EN,discard,keep_imputed,no_category_detected,dataset/txt_limpios/629.txt,dataset/paginas_descargadas/629.html
764,(Gr a $ 34),$ 15.700,,UNKNOWN,Desconocido,unknown,pan,sin_categoria,pan,True,0.9824413472204474,34.0,34.0,34.0,34.0,False,original,1.0,default_1usd,EN,discard,keep_imputed,no_category_detected,dataset/txt_limpios/764.txt,dataset/paginas_descargadas/764.html
622,(Gr a $ 4),$ 4.680,,UNKNOWN,Desconocido,unknown,pan,sin_categoria,pan,True,0.8946030455626163,4.0,4.0,4.0,4.0,False,original,1.0,default_1usd,EN,discard,keep_imputed,no_category_detected,dataset/txt_limpios/622.txt,dataset/paginas_descargadas/622.html
624,(Gr a $ 4),$ 10.650,,UNKNOWN,Desconocido,unknown,cafe,sin_categoria,cafe,True,0.7203527590690829,4.0,4.0,4.0,4.0,False,original,1.0,default_1usd,EN,discard,keep_imputed,no_category_detected,dataset/txt_limpios/624.txt,dataset/paginas_descargadas/624.html
656,(Gr a $ 4),19,,UNKNOWN,Desconocido,unknown,cafe,sin_categoria,cafe,True,0.7029695408512713,4.0,4.0,4.0,4.0,False,original,1.0,default_1usd,EN,discard,keep_imputed,no_category_detected,dataset/txt_limpios/656.txt,dataset/paginas_descargadas/656.html
754,(Gr a $ 4),10,,UNKNOWN,Desconocido,unknown,cafe,sin_categoria,cafe,True,0.811685765617219,4.0,4.0,4.0,4.0,False,original,1.0,default_1usd,EN,discard,keep_imputed,no_category_detected,dataset/txt_limpios/754.txt,dataset/paginas_descargadas/754.html
758,(Gr a $ 4),$ 2.100,,UNKNOWN,Desconocido,unknown,cafe,sin_categoria,cafe,True,0.6566912972293004,4.0,4.0,4.0,4.0,False,original,1.0,default_1usd,EN,discard,keep_imputed,no_category_detected,dataset/txt_limpios/758.txt,dataset/paginas_descargadas/758.html
649,(Gr a $ 45),20,,UNKNOWN,Desconocido,unknown,pan,sin_categoria,pan,True,0.8159788681699924,45.0,45.0,45.0,45.0,False,original,1.0,default_1usd,EN,discard,keep_imputed,no_category_detected,dataset/txt_limpios/649.txt,dataset/paginas_descargadas/649.html
780,(Gr a $ 46),$ 7.635,,UNKNOWN,Desconocido,unknown,cafe,sin_categoria,cafe,True,0.6093216227558127,46.0,46.0,46.0,46.0,False,original,1.0,default_1usd,EN,discard,keep_imputed,no_category_detected,dataset/txt_limpios/780.txt,dataset/paginas_descargadas/780.html
781,(Gr a $ 47),20,,UNKNOWN,Desconocido,unknown,pan,sin_categoria,pan,True,0.6144929388533549,47.0,47.0,47.0,47.0,False,original,1.0,default_1usd,EN,discard,keep_imputed,no_category_detected,dataset/txt_limpios/781.txt,dataset/paginas_descargadas/781.html
638,(Gr a $ 65),$ 18.100,,UNKNOWN,Desconocido,unknown,cafe,sin_categoria,cafe,True,0.951674953576252,65.0,65.0,65.0,65.0,False,original,1.0,default_1usd,EN,discard,keep_imputed,no_category_detected,dataset/txt_limpios/638.txt,dataset/paginas_descargadas/638.html
784,(Gr a $ 68),$ 14.400,,UNKNOWN,Desconocido,unknown,cafe,sin_categoria,cafe,True,0.7858395624250746,68.0,68.0,68.0,68.0,False,original,1.0,default_1usd,EN,discard,keep_imputed,no_category_detected,dataset/txt_limpios/784.txt,dataset/paginas_descargadas/784.html
646,(Gr a $ 9),$ 9.980,,UNKNOWN,Desconocido,unknown,cafe,sin_categoria,cafe,True,0.6527657597946751,9.0,9.0,9.0,9.0,False,original,1.0,default_1usd,EN,discard,keep_imputed,no_category_detected,dataset/txt_limpios/646.txt,dataset/paginas_descargadas/646.html
779,(Gr a $ 90),$ 21.600,,UNKNOWN,Desconocido,unknown,pan,sin_categoria,pan,True,0.8410605198524032,90.0,90.0,90.0,90.0,False,original,1.0,default_1usd,EN,discard,keep_imputed,no_category_detected,dataset/txt_limpios/779.txt,dataset/paginas_descargadas/779.html
635,(Ml a $ 3),$ 17.040,,UNKNOWN,Desconocido,unknown,aceite vegetal,sin_categoria,aceite vegetal,True,0.6982223256904334,3.0,3.0,3.0,3.0,False,original,1.0,default_1usd,EN,discard,keep_imputed,no_category_detected,dataset/txt_limpios/635.txt,dataset/paginas_descargadas/635.html
769,(Ml a $ 5),$ 4.900,,UNKNOWN,Desconocido,unknown,aceite vegetal,sin_categoria,aceite vegetal,True,0.6106748535578108,5.0,5.0,5.0,5.0,False,original,1.0,default_1usd,EN,discard,keep_imputed,no_category_detected,dataset/txt_limpios/769.txt,dataset/paginas_descargadas/769.html
768,(Ml a $ 6),$ 40.800,1100ml,UNKNOWN,Desconocido,unknown,aceite vegetal,sin_categoria,aceite vegetal,True,0.955130455408538,6.0,6.0,6.0,6.0,False,original,1.0,default_1usd,EN,discard,keep_imputed,no_category_detected,dataset/txt_limpios/768.txt,dataset/paginas_descargadas/768.html
775,(Und a $ 1.312),20,,UNKNOWN,Desconocido,unknown,azucar,sin_categoria,azucar,True,0.6287476813405599,1.31,1.31,1.31,1.31,False,original,1.0,default_1usd,EN,discard,keep_imputed,no_category_detected,dataset/txt_limpios/775.txt,dataset/paginas_descargadas/775.html
644,(Und a $ 1.540),$ 1.540,,UNKNOWN,Desconocido,unknown,leche,sin_categoria,leche,True,0.6037848081570014,1.54,1.54,1.54,1.54,False,original,1.0,default_1usd,EN,discard,keep_imputed,no_category_detected,dataset/txt_limpios/644.txt,dataset/paginas_descargadas/644.html
639,(Und a $ 544),20,,UNKNOWN,Desconocido,unknown,azucar,sin_categoria,azucar,True,0.6287476813405599,544.0,544.0,544.0,544.0,False,original,1.0,default_1usd,EN,discard,keep_imputed,no_category_detected,dataset/txt_limpios/639.txt,dataset/paginas_descargadas/639.html
774,(Und a $ 544),20,,UNKNOWN,Desconocido,unknown,azucar,sin_categoria,azucar,True,0.6287476813405599,544.0,544.0,544.0,544.0,False,original,1.0,default_1usd,EN,discard,keep_imputed,no_category_detected,dataset/txt_limpios/774.txt,dataset/paginas_descargadas/774.html
615,(Und a $ 750),$ 24.500,,UNKNOWN,Desconocido,unknown,pan,sin_categoria,pan,True,0.9004025229556406,750.0,750.0,750.0,750.0,False,original,1.0,default_1usd,EN,discard,keep_imputed,no_category_detected,dataset/txt_limpios/615.txt,dataset/paginas_descargadas/615.html
1406,+595994 874276,Selecciona método de entrega,580 GR,UNKNOWN,Desconocido,unknown,pan,sin_categoria,pan,True,0.6652915234348338,,234.19,,234.1938,True,country_mean,1.0,default_1usd,EN,discard,keep_imputed,no_category_detected;price_parse_failed,dataset/txt_limpios/1406.txt,dataset/paginas_descargadas/1406.html
1410,+595994 874276,Selecciona método de entrega,700 GR,UNKNOWN,Desconocido,unknown,pan,sin_categoria,pan,True,0.8293835065779189,,234.19,,234.1938,True,country_mean,1.0,default_1usd,EN,discard,keep_imputed,no_category_detected;price_parse_failed,dataset/txt_limpios/1410.txt,dataset/paginas_descargadas/1410.html
1415,+595994 874276,Selecciona método de entrega,400 GR,UNKNOWN,Desconocido,unknown,cafe,sin_categoria,cafe,True,0.6733673728331941,,234.19,,234.1938,True,country_mean,1.0,default_1usd,EN,discard,keep_imputed,no_category_detected;price_parse_failed,dataset/txt_limpios/1415.txt,dataset/paginas_descargadas/1415.html
1418,+595994 874276,Selecciona método de entrega,1 LT,UNKNOWN,Desconocido,unknown,papa,sin_categoria,papa,True,0.6526028787460917,,234.19,,234.1938,True,country_mean,1.0,default_1usd,EN,discard,keep_imputed,no_category_detected;price_parse_failed,dataset/txt_limpios/1418.txt,dataset/paginas_descargadas/1418.html
1419,+595994 874276,Selecciona método de entrega,1 LT,UNKNOWN,Desconocido,unknown,papa,sin_categoria,papa,True,0.6526028787460917,,234.19,,234.1938,True,country_mean,1.0,default_1usd,EN,discard,keep_imputed,no_category_detected;price_parse_failed,dataset/txt_limpios/1419.txt,dataset/paginas_descargadas/1419.html
1420,+595994 874276,Selecciona método de entrega,2 LT,UNKNOWN,Desconocido,unknown,papa,sin_categoria,papa,True,0.6526028787460917,2.0,2.0,2.0,2.0,False,original,1.0,default_1usd,EN,discard,keep_imputed,no_category_detected,dataset/txt_limpios/1420.txt,dataset/paginas_descargadas/1420.html
1424,+595994 874276,Selecciona método de entrega,400 GR,UNKNOWN,Desconocido,unknown,cafe,sin_categoria,cafe,True,0.6733673728331941,400.0,400.0,400.0,400.0,False,original,1.0,default_1usd,EN,discard,keep_imputed,no_category_detected,dataset/txt_limpios/1424.txt,dataset/paginas_descargadas/1424.html
1425,+595994 874276,Selecciona método de entrega,250 GR,UNKNOWN,Desconocido,unknown,cafe,sin_categoria,cafe,True,0.7630764402241929,,234.19,,234.1938,True,country_mean,1.0,default_1usd,EN,discard,keep_imputed,no_category_detected;price_parse_failed,dataset/txt_limpios/1425.txt,dataset/paginas_descargadas/1425.html
1426,+595994 874276,Selecciona método de entrega,2 LT,UNKNOWN,Desconocido,unknown,papa,sin_categoria,papa,True,0.6526028787460917,2.0,2.0,2.0,2.0,False,original,1.0,default_1usd,EN,discard,keep_imputed,no_category_detected,dataset/txt_limpios/1426.txt,dataset/paginas_descargadas/1426.html
1428,+595994 874276,Selecciona método de entrega,120 GR,UNKNOWN,Desconocido,unknown,cafe,sin_categoria,cafe,True,0.8907368114009176,,234.19,,234.1938,True,country_mean,1.0,default_1usd,EN,discard,keep_imputed,no_category_detected;price_parse_failed,dataset/txt_limpios/1428.txt,dataset/paginas_descargadas/1428.html
1431,+595994 874276,Selecciona método de entrega,1 LT,UNKNOWN,Desconocido,unknown,papa,sin_categoria,papa,True,0.6526028787460917,,234.19,,234.1938,True,country_mean,1.0,default_1usd,EN,discard,keep_imputed,no_category_detected;price_parse_failed,dataset/txt_limpios/1431.txt,dataset/paginas_descargadas/1431.html
1435,+595994 874276,Selecciona método de entrega,2 LT,UNKNOWN,Desconocido,unknown,papa,sin_categoria,papa,True,0.6526028787460917,2.0,2.0,2.0,2.0,False,original,1.0,default_1usd,EN,discard,keep_imputed,no_category_detected,dataset/txt_limpios/1435.txt,dataset/paginas_descargadas/1435.html
1438,+595994 874276,Selecciona método de entrega,1 LT,UNKNOWN,Desconocido,unknown,papa,sin_categoria,papa,True,0.6526028787460917,,234.19,,234.1938,True,country_mean,1.0,default_1usd,EN,discard,keep_imputed,no_category_detected;price_parse_failed,dataset/txt_limpios/1438.txt,dataset/paginas_descargadas/1438.html
1440,+595994 874276,Selecciona método de entrega,1 LT,UNKNOWN,Desconocido,unknown,papa,sin_categoria,papa,True,0.6526028787460917,,234.19,,234.1938,True,country_mean,1.0,default_1usd,EN,discard,keep_imputed,no_category_detected;price_parse_failed,dataset/txt_limpios/1440.txt,dataset/paginas_descargadas/1440.html
1441,+595994 874276,Selecciona método de entrega,1 LT,UNKNOWN,Desconocido,unknown,papa,sin_categoria,papa,True,0.6526028787460917,,234.19,,234.1938,True,country_mean,1.0,default_1usd,EN,discard,keep_imputed,no_category_detected;price_parse_failed,dataset/txt_limpios/1441.txt,dataset/paginas_descargadas/1441.html
1449,+595994 874276,Selecciona método de entrega,2 LT,UNKNOWN,Desconocido,unknown,papa,sin_categoria,papa,True,0.6526028787460917,2.0,2.0,2.0,2.0,False,original,1.0,default_1usd,EN,discard,keep_imputed,no_category_detected,dataset/txt_limpios/1449.txt,dataset/paginas_descargadas/1449.html
1456,+595994 874276,Selecciona método de entrega,2 LT,UNKNOWN,Desconocido,unknown,papa,sin_categoria,papa,True,0.6526028787460917,2.0,2.0,2.0,2.0,False,original,1.0,default_1usd,EN,discard,keep_imputed,no_category_detected,dataset/txt_limpios/1456.txt,dataset/paginas_descargadas/1456.html
1464,+595994 874276,Selecciona método de entrega,700 GR,UNKNOWN,Desconocido,unknown,pan,sin_categoria,pan,True,0.8293835065779189,,234.19,,234.1938,True,country_mean,1.0,default_1usd,EN,discard,keep_imputed,no_category_detected;price_parse_failed,dataset/txt_limpios/1464.txt,dataset/paginas_descargadas/1464.html
10,Aceites y vinagres,123,1L,MX,Chedraui,unknown,aceite vegetal,aceite vegetal,,False,0.0,37.0,37.0,1.9871,1.9871,False,original,18.62,from_mexico_cambio_dolar,ET,keep,keep,heuristic_default,dataset/txt_limpios/10.txt,dataset/paginas_descargadas/10.html
6,Aceites y vinagres,Nutrioli,700ml,MX,Chedraui,unknown,aceite vegetal,aceite vegetal,,False,0.0,,33.3,,1.7884,True,category_country_mean,18.62,from_mexico_cambio_dolar,ET,discard,keep_imputed,price_parse_failed;price<=0,dataset/txt_limpios/6.txt,dataset/paginas_descargadas/6.html
7,Aceites y vinagres,Aceite Chedraui Mixto 800ml,800ml,MX,Chedraui,unknown,aceite vegetal,aceite vegetal,,False,0.0,28.0,28.0,1.5038,1.5038,False,original,18.62,from_mexico_cambio_dolar,ET,keep,keep,heuristic_default,dataset/txt_limpios/7.txt,dataset/paginas_descargadas/7.html
8,Aceites y vinagres,Patrona,1 L,MX,Chedraui,unknown,aceite vegetal,aceite vegetal,,False,0.0,,33.3,,1.7884,True,category_country_mean,18.62,from_mexico_cambio_dolar,EN,discard,keep_imputed,price_parse_failed;price<=0,dataset/txt_limpios/8.txt,dataset/paginas_descargadas/8.html
269,"Al continuar navegando, usted acepta con nuestra",Política de privacidad,12 unidades,BR,Desconocido,unknown,huevo,sin_categoria,huevo,True,0.6753581511565552,20.0,20.0,3.6711,3.6711,False,original,5.448,from_brasil_cambio_dolar,ET,discard,keep_imputed,no_category_detected,dataset/txt_limpios/269.txt,dataset/paginas_descargadas/269.html
1605,Alimentos básicos,Frijoles,1 Kg,UNKNOWN,Desconocido,unknown,frijoles,frijoles,,False,0.0,,1.02,,1.02,True,category_mean,1.0,default_1usd,ET,discard,keep_imputed,price_parse_failed;price<=0,dataset/txt_limpios/1605.txt,dataset/paginas_descargadas/1605.html
1606,Alimentos básicos,Frijoles,1Kg,UNKNOWN,Desconocido,unknown,frijoles,frijoles,,False,0.0,,1.02,,1.02,True,category_mean,1.0,default_1usd,ET,discard,keep_imputed,price_parse_failed;price<=0,dataset/txt_limpios/1606.txt,dataset/paginas_descargadas/1606.html
1608,Alimentos básicos,Frijoles,1 Kg,UNKNOWN,Desconocido,unknown,frijoles,frijoles,,False,0.0,,1.02,,1.02,True,category_mean,1.0,default_1usd,ET,discard,keep_imputed,price_parse_failed;price<=0,dataset/txt_limpios/1608.txt,dataset/paginas_descargadas/1608.html
1610,Alimentos básicos,Frijoles,1Kg,UNKNOWN,Desconocido,unknown,frijoles,frijoles,,False,0.0,,1.02,,1.02,True,category_mean,1.0,default_1usd,ET,discard,keep_imputed,price_parse_failed;price<=0,dataset/txt_limpios/1610.txt,dataset/paginas_descargadas/1610.html
1612,Alimentos básicos,Frijoles,1 kg,UNKNOWN,Desconocido,unknown,frijoles,frijoles,,False,0.0,,1.02,,1.02,True,category_mean,1.0,default_1usd,ET,discard,keep_imputed,price_parse_failed;price<=0,dataset/txt_limpios/1612.txt,dataset/paginas_descargadas/1612.html
180,Alimentos básicos,Arroz,5Kg,BR,Desconocido,unknown,arroz,arroz,,False,0.0,23.89,23.89,4.3851,4.3851,False,original,5.448,from_brasil_cambio_dolar,ET,keep,keep,heuristic_default,dataset/txt_limpios/180.txt,dataset/paginas_descargadas/180.html
181,Alimentos básicos,Arroz,5Kg,BR,Desconocido,unknown,arroz,arroz,,False,0.0,18.59,18.59,3.4123,3.4123,False,original,5.448,from_brasil_cambio_dolar,ET,keep,keep,heuristic_default,dataset/txt_limpios/181.txt,dataset/paginas_descargadas/181.html
182,Alimentos básicos,Arroz,2Kg,BR,Desconocido,unknown,arroz,arroz,,False,0.0,11.99,11.99,2.2008,2.2008,False,original,5.448,from_brasil_cambio_dolar,ET,keep,keep,heuristic_default,dataset/txt_limpios/182.txt,dataset/paginas_descargadas/182.html
183,Alimentos básicos,Arroz,5 kg,BR,Desconocido,unknown,arroz,arroz,,False,0.0,16.59,16.59,3.0452,3.0452,False,original,5.448,from_brasil_cambio_dolar,ET,keep,keep,heuristic_default,dataset/txt_limpios/183.txt,dataset/paginas_descargadas/183.html
184,Alimentos básicos,Arroz,5Kg,BR,Desconocido,unknown,arroz,arroz,,False,0.0,19.49,19.49,3.5775,3.5775,False,original,5.448,from_brasil_cambio_dolar,ET,keep,keep,heuristic_default,dataset/txt_limpios/184.txt,dataset/paginas_descargadas/184.html
185,Alimentos básicos,Cafés,40g,BR,Desconocido,unknown,frijoles,sin_categoria,frijoles,True,0.9980873262283756,8.89,8.89,1.6318,1.6318,False,original,5.448,from_brasil_cambio_dolar,ET,discard,keep_imputed,no_category_detected,dataset/txt_limpios/185.txt,dataset/paginas_descargadas/185.html
225,Alimentos básicos,Frijoles,1 Kg,BR,Desconocido,unknown,frijoles,frijoles,,False,0.0,5.29,5.29,0.971,0.971,False,original,5.448,from_brasil_cambio_dolar,ET,keep,keep,heuristic_default,dataset/txt_limpios/225.txt,dataset/paginas_descargadas/225.html
226,Alimentos básicos,Frijoles,1Kg,UNKNOWN,Desconocido,unknown,frijoles,frijoles,,False,0.0,,1.02,,1.02,True,category_mean,1.0,default_1usd,ET,discard,keep_imputed,price_parse_failed;price<=0,dataset/txt_limpios/226.txt,dataset/paginas_descargadas/226.html
227,Alimentos básicos,Frijoles,1 Kg,UNKNOWN,Desconocido,unknown,frijoles,frijoles,,False,0.0,,1.02,,1.02,True,category_mean,1.0,default_1usd,ET,discard,keep_imputed,price_parse_failed;price<=0,dataset/txt_limpios/227.txt,dataset/paginas_descargadas/227.html
228,Alimentos básicos,Frijoles,1Kg,BR,Desconocido,unknown,frijoles,frijoles,,False,0.0,4.49,4.49,0.8242,0.8242,False,original,5.448,from_brasil_cambio_dolar,ET,keep,keep,heuristic_default,dataset/txt_limpios/228.txt,dataset/paginas_descargadas/228.html
229,Alimentos básicos,Frijoles,1 kg,BR,Desconocido,unknown,frijoles,frijoles,,False,0.0,6.89,6.89,1.2647,1.2647,False,original,5.448,from_brasil_cambio_dolar,ET,keep,keep,heuristic_default,dataset/txt_limpios/229.txt,dataset/paginas_descargadas/229.html
1287,App Frecuento,Descárgala gratis,330ml,UNKNOWN,Desconocido,unknown,arroz,arroz,,False,0.0,7.45,7.45,7.45,7.45,False,original,1.0,default_1usd,ET,keep,keep,heuristic_default,dataset/txt_limpios/1287.txt,dataset/paginas_descargadas/1287.html
1366,ARROZ CONEJO SACO 20 LB,Comparar,20 LB,US,Desconocido,unknown,arroz,arroz,,False,0.0,9.99,9.99,9.99,9.99,False,original,1.0,default_1usd,ET,keep,keep,heuristic_default,dataset/txt_limpios/1366.txt,dataset/paginas_descargadas/1366.html
790,ARROZ DIANA 500 G,Unidades disponibles,500 G,UNKNOWN,Desconocido,unknown,cebolla,cebolla,,False,0.0,500.0,500.0,500.0,500.0,False,original,1.0,default_1usd,ET,keep,keep,heuristic_default,dataset/txt_limpios/790.txt,dataset/paginas_descargadas/790.html
791,ARROZ ESTÁNDAR ALBAR 500 GRS,Unidades disponibles,500 g,UNKNOWN,Desconocido,unknown,azucar,azucar,,False,0.0,500.0,500.0,500.0,500.0,False,original,1.0,default_1usd,ET,keep,keep,heuristic_default,dataset/txt_limpios/791.txt,dataset/paginas_descargadas/791.html
905,Arroz G1 largo ancho bolsa,1 Kg,1 Kg,UNKNOWN,Desconocido,unknown,arroz,arroz,,False,0.0,1.89,1.89,1.89,1.89,False,original,1.0,default_1usd,EN,keep,keep,heuristic_default,dataset/txt_limpios/905.txt,dataset/paginas_descargadas/905.html
903,Arroz G2 gran selección ancha,1 Kg,1 Kg,UNKNOWN,Desconocido,unknown,arroz,arroz,,False,0.0,1.37,1.37,1.37,1.37,False,original,1.0,default_1usd,ET,keep,keep,heuristic_default,dataset/txt_limpios/903.txt,dataset/paginas_descargadas/903.html
904,Arroz G2 largo delgado,1 Kg,1 Kg,UNKNOWN,Desconocido,unknown,arroz,arroz,,False,0.0,1.02,1.02,1.02,1.02,False,original,1.0,default_1usd,EN,keep,keep,heuristic_default,dataset/txt_limpios/904.txt,dataset/paginas_descargadas/904.html
