source_id,product_name,brand,unit,country,seller,availability,category_effective,category_canonical,category_canonical_imputed,category_is_imputed,category_model_confidence,price_amount,price_amount_filled,price_amount_usd,price_amount_usd_filled,price_is_imputed,price_imputation_source,fx_rate_local_per_usd,fx_source,es_status,decision,decision_imputed,reasons,txt_path,html_path
906,Arroz grano largo delgado grad...,900 g,900 g,UNKNOWN,Desconocido,unknown,arroz,arroz,,False,0.0,1.39,1.39,1.39,1.39,False,original,1.0,default_1usd,EN,keep,keep,heuristic_default,dataset/txt_limpios/906.txt,dataset/paginas_descargadas/906.html
5,Arroz La Merced Super Extra 900g,La Merced,900g,MX,Chedraui,unknown,arroz,arroz,,False,0.0,21.0,21.0,1.1278,1.1278,False,original,18.62,from_mexico_cambio_dolar,EN,keep,keep,heuristic_default,dataset/txt_limpios/5.txt,dataset/paginas_descargadas/5.html
1365,ARROZ REAL 2 KG,Comparar,2 KG,US,Desconocido,unknown,arroz,arroz,,False,0.0,2.99,2.99,2.99,2.99,False,original,1.0,default_1usd,ET,keep,keep,heuristic_default,dataset/txt_limpios/1365.txt,dataset/paginas_descargadas/1365.html
1,Arroz Schettino Verde 900g,Schettino,900g,MX,Chedraui,unknown,arroz,arroz,,False,0.0,19.8,19.8,1.0634,1.0634,False,original,18.62,from_mexico_cambio_dolar,EN,keep,keep,heuristic_default,dataset/txt_limpios/1.txt,dataset/paginas_descargadas/1.html
3,Arroz SOS Super Extra Rojo 900g,SOS,900g,MX,Chedraui,unknown,arroz,arroz,,False,0.0,,20.4,,1.0956,True,category_country_mean,18.62,from_mexico_cambio_dolar,EN,discard,keep_imputed,price_parse_failed;price<=0,dataset/txt_limpios/3.txt,dataset/paginas_descargadas/3.html
4,Arroz Super Extra Chedraui 900g,Chedraui,900g,MX,Chedraui,unknown,arroz,arroz,,False,0.0,,20.4,,1.0956,True,category_country_mean,18.62,from_mexico_cambio_dolar,EN,discard,keep_imputed,price_parse_failed;price<=0,dataset/txt_limpios/4.txt,dataset/paginas_descargadas/4.html
2,Arroz Verde Valle Super Extra 900g,Verde Valle,900g,MX,Chedraui,unknown,arroz,arroz,,False,0.0,,20.4,,1.0956,True,category_country_mean,18.62,from_mexico_cambio_dolar,ET,discard,keep_imputed,price_parse_failed;price<=0,dataset/txt_limpios/2.txt,dataset/paginas_descargadas/2.html
567,Asesoramos tu compra WEB: 📞(601) 6672004 -,"Otras Ciudades clic aquí,",,CO,Desconocido,unknown,cafe,sin_categoria,cafe,True,0.999999999975126,25.0,25.0,0.0062,0.0062,False,original,4047.0,from_colombia_cambio_dolar,EN,discard,keep_imputed,no_category_detected,dataset/txt_limpios/567.txt,dataset/paginas_descargadas/567.html
659,"ASESORAMOS TU COMPRA: 📞(601) 6672004, lun a sab de 7am.a 7pm dom hasta las 6pm",otras ciudades consulta aquí,,CO,Desconocido,unknown,cafe,cafe,,False,0.0,22.99,22.99,0.0057,0.0057,False,original,4047.0,from_colombia_cambio_dolar,ET,keep,keep,heuristic_default,dataset/txt_limpios/659.txt,dataset/paginas_descargadas/659.html
660,"ASESORAMOS TU COMPRA: 📞(601) 6672004, lun a sab de 7am.a 7pm dom hasta las 6pm",otras ciudades consulta aquí,,CO,Desconocido,unknown,cafe,cafe,,False,0.0,25.63,25.63,0.0063,0.0063,False,original,4047.0,from_colombia_cambio_dolar,ET,keep,keep,heuristic_default,dataset/txt_limpios/660.txt,dataset/paginas_descargadas/660.html
661,"ASESORAMOS TU COMPRA: 📞(601) 6672004, lun a sab de 7am.a 7pm dom hasta las 6pm",otras ciudades consulta aquí,,CO,Desconocido,unknown,cafe,cafe,,False,0.0,23.89,23.89,0.0059,0.0059,False,original,4047.0,from_colombia_cambio_dolar,ET,keep,keep,heuristic_default,dataset/txt_limpios/661.txt,dataset/paginas_descargadas/661.html
662,"ASESORAMOS TU COMPRA: 📞(601) 6672004, lun a sab de 7am.a 7pm dom hasta las 6pm",otras ciudades consulta aquí,500gr,CO,Desconocido,unknown,cafe,cafe,,False,0.0,2.5,2.5,0.0006,0.0006,False,original,4047.0,from_colombia_cambio_dolar,ET,keep,keep,heuristic_default,dataset/txt_limpios/662.txt,dataset/paginas_descargadas/662.html
663,"ASESORAMOS TU COMPRA: 📞(601) 6672004, lun a sab de 7am.a 7pm dom hasta las 6pm",otras ciudades consulta aquí,,CO,Desconocido,unknown,cafe,cafe,,False,0.0,24.49,24.49,0.0061,0.0061,False,original,4047.0,from_colombia_cambio_dolar,ET,keep,keep,heuristic_default,dataset/txt_limpios/663.txt,dataset/paginas_descargadas/663.html
664,"ASESORAMOS TU COMPRA: 📞(601) 6672004, lun a sab de 7am.a 7pm dom hasta las 6pm",otras ciudades consulta aquí,,CO,Desconocido,unknown,cafe,cafe,,False,0.0,4.49,4.49,0.0011,0.0011,False,original,4047.0,from_colombia_cambio_dolar,ET,keep,keep,heuristic_default,dataset/txt_limpios/664.txt,dataset/paginas_descargadas/664.html
665,"ASESORAMOS TU COMPRA: 📞(601) 6672004, lun a sab de 7am.a 7pm dom hasta las 6pm",otras ciudades consulta aquí,,CO,Desconocido,unknown,cafe,sin_categoria,cafe,True,1.0,,100.78,,0.0249,True,country_mean,4047.0,from_colombia_cambio_dolar,ET,discard,keep_imputed,no_category_detected;price_parse_failed,dataset/txt_limpios/665.txt,dataset/paginas_descargadas/665.html
666,"ASESORAMOS TU COMPRA: 📞(601) 6672004, lun a sab de 7am.a 7pm dom hasta las 6pm",otras ciudades consulta aquí,,CO,Desconocido,unknown,cafe,cafe,,False,0.0,46.94,46.94,0.0116,0.0116,False,original,4047.0,from_colombia_cambio_dolar,ET,keep,keep,heuristic_default,dataset/txt_limpios/666.txt,dataset/paginas_descargadas/666.html
667,"ASESORAMOS TU COMPRA: 📞(601) 6672004, lun a sab de 7am.a 7pm dom hasta las 6pm",otras ciudades consulta aquí,,CO,Desconocido,unknown,cafe,cafe,,False,0.0,37.52,37.52,0.0093,0.0093,False,original,4047.0,from_colombia_cambio_dolar,ET,keep,keep,heuristic_default,dataset/txt_limpios/667.txt,dataset/paginas_descargadas/667.html
668,"ASESORAMOS TU COMPRA: 📞(601) 6672004, lun a sab de 7am.a 7pm dom hasta las 6pm",otras ciudades consulta aquí,,CO,Desconocido,unknown,cafe,cafe,,False,0.0,14.09,14.09,0.0035,0.0035,False,original,4047.0,from_colombia_cambio_dolar,ET,keep,keep,heuristic_default,dataset/txt_limpios/668.txt,dataset/paginas_descargadas/668.html
669,"ASESORAMOS TU COMPRA: 📞(601) 6672004, lun a sab de 7am.a 7pm dom hasta las 6pm",otras ciudades consulta aquí,,CO,Desconocido,unknown,cafe,sin_categoria,cafe,True,1.0,,100.78,,0.0249,True,country_mean,4047.0,from_colombia_cambio_dolar,ET,discard,keep_imputed,no_category_detected;price_parse_failed,dataset/txt_limpios/669.txt,dataset/paginas_descargadas/669.html
670,"ASESORAMOS TU COMPRA: 📞(601) 6672004, lun a sab de 7am.a 7pm dom hasta las 6pm",otras ciudades consulta aquí,480G,CO,Desconocido,unknown,cafe,cafe,,False,0.0,8.19,8.19,0.002,0.002,False,original,4047.0,from_colombia_cambio_dolar,ET,keep,keep,heuristic_default,dataset/txt_limpios/670.txt,dataset/paginas_descargadas/670.html
671,"ASESORAMOS TU COMPRA: 📞(601) 6672004, lun a sab de 7am.a 7pm dom hasta las 6pm",otras ciudades consulta aquí,750 g,CO,Desconocido,unknown,pan,pan,,False,0.0,7.63,7.63,0.0019,0.0019,False,original,4047.0,from_colombia_cambio_dolar,ET,keep,keep,heuristic_default,dataset/txt_limpios/671.txt,dataset/paginas_descargadas/671.html
672,"ASESORAMOS TU COMPRA: 📞(601) 6672004, lun a sab de 7am.a 7pm dom hasta las 6pm",otras ciudades consulta aquí,460 g,CO,Desconocido,unknown,cafe,cafe,,False,0.0,10.55,10.55,0.0026,0.0026,False,original,4047.0,from_colombia_cambio_dolar,ET,keep,keep,heuristic_default,dataset/txt_limpios/672.txt,dataset/paginas_descargadas/672.html
673,"ASESORAMOS TU COMPRA: 📞(601) 6672004, lun a sab de 7am.a 7pm dom hasta las 6pm",otras ciudades consulta aquí,,CO,Desconocido,unknown,cafe,cafe,,False,0.0,13.15,13.15,0.0032,0.0032,False,original,4047.0,from_colombia_cambio_dolar,ET,keep,keep,heuristic_default,dataset/txt_limpios/673.txt,dataset/paginas_descargadas/673.html
674,"ASESORAMOS TU COMPRA: 📞(601) 6672004, lun a sab de 7am.a 7pm dom hasta las 6pm",otras ciudades consulta aquí,550 g,CO,Desconocido,unknown,cafe,sin_categoria,cafe,True,1.0,6.89,6.89,0.0017,0.0017,False,original,4047.0,from_colombia_cambio_dolar,ET,discard,keep_imputed,no_category_detected,dataset/txt_limpios/674.txt,dataset/paginas_descargadas/674.html
675,"ASESORAMOS TU COMPRA: 📞(601) 6672004, lun a sab de 7am.a 7pm dom hasta las 6pm",otras ciudades consulta aquí,,CO,Desconocido,unknown,cafe,sin_categoria,cafe,True,1.0,39.09,39.09,0.0097,0.0097,False,original,4047.0,from_colombia_cambio_dolar,ET,discard,keep_imputed,no_category_detected,dataset/txt_limpios/675.txt,dataset/paginas_descargadas/675.html
676,"ASESORAMOS TU COMPRA: 📞(601) 6672004, lun a sab de 7am.a 7pm dom hasta las 6pm",otras ciudades consulta aquí,,CO,Desconocido,unknown,cafe,cafe,,False,0.0,22.89,22.89,0.0057,0.0057,False,original,4047.0,from_colombia_cambio_dolar,ET,keep,keep,heuristic_default,dataset/txt_limpios/676.txt,dataset/paginas_descargadas/676.html
677,"ASESORAMOS TU COMPRA: 📞(601) 6672004, lun a sab de 7am.a 7pm dom hasta las 6pm",otras ciudades consulta aquí,,CO,Desconocido,unknown,cafe,sin_categoria,cafe,True,1.0,,100.78,,0.0249,True,country_mean,4047.0,from_colombia_cambio_dolar,ET,discard,keep_imputed,no_category_detected;price_parse_failed,dataset/txt_limpios/677.txt,dataset/paginas_descargadas/677.html
678,"ASESORAMOS TU COMPRA: 📞(601) 6672004, lun a sab de 7am.a 7pm dom hasta las 6pm",otras ciudades consulta aquí,,CO,Desconocido,unknown,cafe,cafe,,False,0.0,3.7,3.7,0.0009,0.0009,False,original,4047.0,from_colombia_cambio_dolar,ET,keep,keep,heuristic_default,dataset/txt_limpios/678.txt,dataset/paginas_descargadas/678.html
679,"ASESORAMOS TU COMPRA: 📞(601) 6672004, lun a sab de 7am.a 7pm dom hasta las 6pm",otras ciudades consulta aquí,500gr,CO,Desconocido,unknown,cafe,cafe,,False,0.0,4.99,4.99,0.0012,0.0012,False,original,4047.0,from_colombia_cambio_dolar,ET,keep,keep,heuristic_default,dataset/txt_limpios/679.txt,dataset/paginas_descargadas/679.html
680,"ASESORAMOS TU COMPRA: 📞(601) 6672004, lun a sab de 7am.a 7pm dom hasta las 6pm",otras ciudades consulta aquí,500gr,CO,Desconocido,unknown,cafe,cafe,,False,0.0,2.5,2.5,0.0006,0.0006,False,original,4047.0,from_colombia_cambio_dolar,ET,keep,keep,heuristic_default,dataset/txt_limpios/680.txt,dataset/paginas_descargadas/680.html
681,"ASESORAMOS TU COMPRA: 📞(601) 6672004, lun a sab de 7am.a 7pm dom hasta las 6pm",otras ciudades consulta aquí,1000 gr,CO,Desconocido,unknown,cafe,cafe,,False,0.0,19.49,19.49,0.0048,0.0048,False,original,4047.0,from_colombia_cambio_dolar,ET,keep,keep,heuristic_default,dataset/txt_limpios/681.txt,dataset/paginas_descargadas/681.html
682,"ASESORAMOS TU COMPRA: 📞(601) 6672004, lun a sab de 7am.a 7pm dom hasta las 6pm",otras ciudades consulta aquí,500 gr,CO,Desconocido,unknown,cafe,cafe,,False,0.0,1.84,1.84,0.0005,0.0005,False,original,4047.0,from_colombia_cambio_dolar,ET,keep,keep,heuristic_default,dataset/txt_limpios/682.txt,dataset/paginas_descargadas/682.html
683,"ASESORAMOS TU COMPRA: 📞(601) 6672004, lun a sab de 7am.a 7pm dom hasta las 6pm",otras ciudades consulta aquí,200 gr,CO,Desconocido,unknown,cafe,cafe,,False,0.0,11.98,11.98,0.003,0.003,False,original,4047.0,from_colombia_cambio_dolar,ET,keep,keep,heuristic_default,dataset/txt_limpios/683.txt,dataset/paginas_descargadas/683.html
684,"ASESORAMOS TU COMPRA: 📞(601) 6672004, lun a sab de 7am.a 7pm dom hasta las 6pm",otras ciudades consulta aquí,500gr,CO,Desconocido,unknown,cafe,sin_categoria,cafe,True,1.0,3.29,3.29,0.0008,0.0008,False,original,4047.0,from_colombia_cambio_dolar,ET,discard,keep_imputed,no_category_detected,dataset/txt_limpios/684.txt,dataset/paginas_descargadas/684.html
685,"ASESORAMOS TU COMPRA: 📞(601) 6672004, lun a sab de 7am.a 7pm dom hasta las 6pm",otras ciudades consulta aquí,,CO,Desconocido,unknown,cafe,cafe,,False,0.0,17.99,17.99,0.0044,0.0044,False,original,4047.0,from_colombia_cambio_dolar,ET,keep,keep,heuristic_default,dataset/txt_limpios/685.txt,dataset/paginas_descargadas/685.html
686,"ASESORAMOS TU COMPRA: 📞(601) 6672004, lun a sab de 7am.a 7pm dom hasta las 6pm",otras ciudades consulta aquí,1000gr,CO,Desconocido,unknown,cafe,cafe,,False,0.0,17.99,17.99,0.0044,0.0044,False,original,4047.0,from_colombia_cambio_dolar,ET,keep,keep,heuristic_default,dataset/txt_limpios/686.txt,dataset/paginas_descargadas/686.html
687,"ASESORAMOS TU COMPRA: 📞(601) 6672004, lun a sab de 7am.a 7pm dom hasta las 6pm",otras ciudades consulta aquí,500gr,CO,Desconocido,unknown,cafe,sin_categoria,cafe,True,1.0,1.69,1.69,0.0004,0.0004,False,original,4047.0,from_colombia_cambio_dolar,ET,discard,keep_imputed,no_category_detected,dataset/txt_limpios/687.txt,dataset/paginas_descargadas/687.html
688,"ASESORAMOS TU COMPRA: 📞(601) 6672004, lun a sab de 7am.a 7pm dom hasta las 6pm",otras ciudades consulta aquí,,CO,Desconocido,unknown,cafe,cafe,,False,0.0,1.79,1.79,0.0004,0.0004,False,original,4047.0,from_colombia_cambio_dolar,ET,keep,keep,heuristic_default,dataset/txt_limpios/688.txt,dataset/paginas_descargadas/688.html
689,"ASESORAMOS TU COMPRA: 📞(601) 6672004, lun a sab de 7am.a 7pm dom hasta las 6pm",otras ciudades consulta aquí,2500gr,CO,Desconocido,unknown,cafe,cafe,,False,0.0,4.99,4.99,0.0012,0.0012,False,original,4047.0,from_colombia_cambio_dolar,ET,keep,keep,heuristic_default,dataset/txt_limpios/689.txt,dataset/paginas_descargadas/689.html
690,"ASESORAMOS TU COMPRA: 📞(601) 6672004, lun a sab de 7am.a 7pm dom hasta las 6pm",otras ciudades consulta aquí,,CO,Desconocido,unknown,papa,papa,,False,0.0,26.39,26.39,0.0065,0.0065,False,original,4047.0,from_colombia_cambio_dolar,ET,keep,keep,heuristic_default,dataset/txt_limpios/690.txt,dataset/paginas_descargadas/690.html
691,"ASESORAMOS TU COMPRA: 📞(601) 6672004, lun a sab de 7am.a 7pm dom hasta las 6pm",otras ciudades consulta aquí,,CO,Desconocido,unknown,cafe,cafe,,False,0.0,500.0,500.0,0.1235,0.1235,False,original,4047.0,from_colombia_cambio_dolar,ET,keep,keep,heuristic_default,dataset/txt_limpios/691.txt,dataset/paginas_descargadas/691.html
692,"ASESORAMOS TU COMPRA: 📞(601) 6672004, lun a sab de 7am.a 7pm dom hasta las 6pm",otras ciudades consulta aquí,,CO,Desconocido,unknown,cafe,cafe,,False,0.0,25.0,25.0,0.0062,0.0062,False,original,4047.0,from_colombia_cambio_dolar,ET,keep,keep,heuristic_default,dataset/txt_limpios/692.txt,dataset/paginas_descargadas/692.html
693,"ASESORAMOS TU COMPRA: 📞(601) 6672004, lun a sab de 7am.a 7pm dom hasta las 6pm",otras ciudades consulta aquí,,CO,Desconocido,unknown,cafe,cafe,,False,0.0,400.0,400.0,0.0988,0.0988,False,original,4047.0,from_colombia_cambio_dolar,ET,keep,keep,heuristic_default,dataset/txt_limpios/693.txt,dataset/paginas_descargadas/693.html
694,"ASESORAMOS TU COMPRA: 📞(601) 6672004, lun a sab de 7am.a 7pm dom hasta las 6pm",otras ciudades consulta aquí,,CO,Desconocido,unknown,cafe,cafe,,False,0.0,500.0,500.0,0.1235,0.1235,False,original,4047.0,from_colombia_cambio_dolar,ET,keep,keep,heuristic_default,dataset/txt_limpios/694.txt,dataset/paginas_descargadas/694.html
695,"ASESORAMOS TU COMPRA: 📞(601) 6672004, lun a sab de 7am.a 7pm dom hasta las 6pm",otras ciudades consulta aquí,,CO,Desconocido,unknown,cafe,cafe,,False,0.0,450.0,450.0,0.1112,0.1112,False,original,4047.0,from_colombia_cambio_dolar,ET,keep,keep,heuristic_default,dataset/txt_limpios/695.txt,dataset/paginas_descargadas/695.html
696,"ASESORAMOS TU COMPRA: 📞(601) 6672004, lun a sab de 7am.a 7pm dom hasta las 6pm",otras ciudades consulta aquí,70g,CO,Desconocido,unknown,cafe,cafe,,False,0.0,70.0,70.0,0.0173,0.0173,False,original,4047.0,from_colombia_cambio_dolar,ET,keep,keep,heuristic_default,dataset/txt_limpios/696.txt,dataset/paginas_descargadas/696.html
697,"ASESORAMOS TU COMPRA: 📞(601) 6672004, lun a sab de 7am.a 7pm dom hasta las 6pm",otras ciudades consulta aquí,,CO,Desconocido,unknown,cafe,cafe,,False,0.0,5.08,5.08,0.0013,0.0013,False,original,4047.0,from_colombia_cambio_dolar,ET,keep,keep,heuristic_default,dataset/txt_limpios/697.txt,dataset/paginas_descargadas/697.html
698,"ASESORAMOS TU COMPRA: 📞(601) 6672004, lun a sab de 7am.a 7pm dom hasta las 6pm",otras ciudades consulta aquí,,CO,Desconocido,unknown,cafe,cafe,,False,0.0,5.69,5.69,0.0014,0.0014,False,original,4047.0,from_colombia_cambio_dolar,ET,keep,keep,heuristic_default,dataset/txt_limpios/698.txt,dataset/paginas_descargadas/698.html
699,"ASESORAMOS TU COMPRA: 📞(601) 6672004, lun a sab de 7am.a 7pm dom hasta las 6pm",otras ciudades consulta aquí,,CO,Desconocido,unknown,cafe,sin_categoria,cafe,True,1.0,,100.78,,0.0249,True,country_mean,4047.0,from_colombia_cambio_dolar,ET,discard,keep_imputed,no_category_detected;price_parse_failed,dataset/txt_limpios/699.txt,dataset/paginas_descargadas/699.html
700,"ASESORAMOS TU COMPRA: 📞(601) 6672004, lun a sab de 7am.a 7pm dom hasta las 6pm",otras ciudades consulta aquí,,CO,Desconocido,unknown,cafe,cafe,,False,0.0,9.6,9.6,0.0024,0.0024,False,original,4047.0,from_colombia_cambio_dolar,ET,keep,keep,heuristic_default,dataset/txt_limpios/700.txt,dataset/paginas_descargadas/700.html
701,"ASESORAMOS TU COMPRA: 📞(601) 6672004, lun a sab de 7am.a 7pm dom hasta las 6pm",otras ciudades consulta aquí,5kg,CO,Desconocido,unknown,cafe,cafe,,False,0.0,10.89,10.89,0.0027,0.0027,False,original,4047.0,from_colombia_cambio_dolar,ET,keep,keep,heuristic_default,dataset/txt_limpios/701.txt,dataset/paginas_descargadas/701.html
805,AZÚCAR BLANCA 1000 GRS,Unidades disponibles,1000 g,UNKNOWN,Desconocido,unknown,leche,leche,,False,0.0,1000.0,1000.0,1000.0,1000.0,False,original,1.0,default_1usd,ET,keep,keep,heuristic_default,dataset/txt_limpios/805.txt,dataset/paginas_descargadas/805.html
808,AZÚCAR BLANCA 1000 GRS,Unidades disponibles,1000 g,UNKNOWN,Desconocido,unknown,leche,leche,,False,0.0,1000.0,1000.0,1000.0,1000.0,False,original,1.0,default_1usd,ET,keep,keep,heuristic_default,dataset/txt_limpios/808.txt,dataset/paginas_descargadas/808.html
315,Azúcar Mascavo Orgánico Native Organic 500 G,Descripción,500 G,BR,Desconocido,unknown,azucar,azucar,,False,0.0,15.99,15.99,2.935,2.935,False,original,5.448,from_brasil_cambio_dolar,ET,keep,keep,heuristic_default,dataset/txt_limpios/315.txt,dataset/paginas_descargadas/315.html
806,AZÚCAR MORENA 1000 GRS,Unidades disponibles,1000 g,UNKNOWN,Desconocido,unknown,cafe,cafe,,False,0.0,1000.0,1000.0,1000.0,1000.0,False,original,1.0,default_1usd,ET,keep,keep,heuristic_default,dataset/txt_limpios/806.txt,dataset/paginas_descargadas/806.html
1594,Azúcar y Adoçante,Azúcar,1kg,BR,Desconocido,unknown,azucar,azucar,,False,0.0,4.88,4.88,0.8957,0.8957,False,original,5.448,from_brasil_cambio_dolar,ET,keep,keep,heuristic_default,dataset/txt_limpios/1594.txt,dataset/paginas_descargadas/1594.html
1596,Azúcar y Adoçante,Azúcar,1Kg,BR,Desconocido,unknown,azucar,azucar,,False,0.0,10.19,10.19,1.8704,1.8704,False,original,5.448,from_brasil_cambio_dolar,ET,keep,keep,heuristic_default,dataset/txt_limpios/1596.txt,dataset/paginas_descargadas/1596.html
1600,Azúcar y Adoçante,Azúcar,1kg,BR,Desconocido,unknown,azucar,azucar,,False,0.0,4.19,4.19,0.7691,0.7691,False,original,5.448,from_brasil_cambio_dolar,ET,keep,keep,heuristic_default,dataset/txt_limpios/1600.txt,dataset/paginas_descargadas/1600.html
1602,Azúcar y Adoçante,Azúcar,500g,BR,Desconocido,unknown,azucar,azucar,,False,0.0,4.99,4.99,0.9159,0.9159,False,original,5.448,from_brasil_cambio_dolar,ET,keep,keep,heuristic_default,dataset/txt_limpios/1602.txt,dataset/paginas_descargadas/1602.html
220,Azúcar y Adoçante,Azúcar,1kg,BR,Desconocido,unknown,azucar,azucar,,False,0.0,4.89,4.89,0.8976,0.8976,False,original,5.448,from_brasil_cambio_dolar,ET,keep,keep,heuristic_default,dataset/txt_limpios/220.txt,dataset/paginas_descargadas/220.html
221,Azúcar y Adoçante,Azúcar,1Kg,BR,Desconocido,unknown,azucar,azucar,,False,0.0,10.19,10.19,1.8704,1.8704,False,original,5.448,from_brasil_cambio_dolar,ET,keep,keep,heuristic_default,dataset/txt_limpios/221.txt,dataset/paginas_descargadas/221.html
223,Azúcar y Adoçante,Azúcar,1kg,BR,Desconocido,unknown,azucar,azucar,,False,0.0,3.99,3.99,0.7324,0.7324,False,original,5.448,from_brasil_cambio_dolar,ET,keep,keep,heuristic_default,dataset/txt_limpios/223.txt,dataset/paginas_descargadas/223.html
224,Azúcar y Adoçante,Azúcar,500g,BR,Desconocido,unknown,azucar,azucar,,False,0.0,4.99,4.99,0.9159,0.9159,False,original,5.448,from_brasil_cambio_dolar,ET,keep,keep,heuristic_default,dataset/txt_limpios/224.txt,dataset/paginas_descargadas/224.html
1228,Azúcar y Endulzantes,Azúcar Rubia,25 Kg,PE,Desconocido,unknown,azucar,azucar,,False,0.0,16.92,16.92,4.7662,4.7662,False,original,3.55,from_peru_cambio_dolar,EN,keep,keep,heuristic_default,dataset/txt_limpios/1228.txt,dataset/paginas_descargadas/1228.html
22,Azúcar Zulka Glass 500g,Zulka,500g,MX,Chedraui,unknown,azucar,azucar,,False,0.0,,42.75,,2.296,True,category_country_mean,18.62,from_mexico_cambio_dolar,ET,discard,keep_imputed,price_parse_failed;price<=0,dataset/txt_limpios/22.txt,dataset/paginas_descargadas/22.html
799,BANANO UNIDAD,Unidades disponibles,1000 G,UNKNOWN,Desconocido,unknown,cebolla,cebolla,,False,0.0,1.0,1.0,1.0,1.0,False,original,1.0,default_1usd,ET,keep,keep,heuristic_default,dataset/txt_limpios/799.txt,dataset/paginas_descargadas/799.html
533,Bebidas Sin Alcohol,Gaseosas,2.25 L,UNKNOWN,Desconocido,unknown,papa,sin_categoria,papa,True,0.991361259881102,130.0,130.0,130.0,130.0,False,original,1.0,default_1usd,ET,discard,keep_imputed,no_category_detected,dataset/txt_limpios/533.txt,dataset/paginas_descargadas/533.html
534,Bebidas Sin Alcohol,Gaseosas,2l,UNKNOWN,Desconocido,unknown,papa,sin_categoria,papa,True,0.9984433071225068,3450.0,3450.0,3450.0,3450.0,False,original,1.0,default_1usd,ET,discard,keep_imputed,no_category_detected,dataset/txt_limpios/534.txt,dataset/paginas_descargadas/534.html
535,Bebidas Sin Alcohol,Gaseosas,2.25 L,UNKNOWN,Desconocido,unknown,papa,sin_categoria,papa,True,0.9950838023866556,1750.0,1750.0,1750.0,1750.0,False,original,1.0,default_1usd,ET,discard,keep_imputed,no_category_detected,dataset/txt_limpios/535.txt,dataset/paginas_descargadas/535.html
536,Bebidas Sin Alcohol,Gaseosas,2.25 L,UNKNOWN,Desconocido,unknown,papa,sin_categoria,papa,True,0.9896339413241152,3225.0,3225.0,3225.0,3225.0,False,original,1.0,default_1usd,ET,discard,keep_imputed,no_category_detected,dataset/txt_limpios/536.txt,dataset/paginas_descargadas/536.html
