source_id,product_name,brand,unit,country,seller,availability,category_effective,category_canonical,category_canonical_imputed,category_is_imputed,category_model_confidence,price_amount,price_amount_filled,price_amount_usd,price_amount_usd_filled,price_is_imputed,price_imputation_source,fx_rate_local_per_usd,fx_source,es_status,decision,decision_imputed,reasons,txt_path,html_path
1147,¿Que buscas hoy?,Elegir,140g,PE,Desconocido,unknown,atun,atun,,False,0.0,3.6,3.6,1.0141,1.0141,False,original,3.55,from_peru_cambio_dolar,EN,keep,keep,heuristic_default,dataset/txt_limpios/1147.txt,dataset/paginas_descargadas/1147.html
1149,¿Que buscas hoy?,Elegir,140g,PE,Desconocido,unknown,atun,atun,,False,0.0,6.4,6.4,1.8028,1.8028,False,original,3.55,from_peru_cambio_dolar,EN,keep,keep,heuristic_default,dataset/txt_limpios/1149.txt,dataset/paginas_descargadas/1149.html
16,¿Qué estás buscando?,Tortilleria y pan empacados,620g,MX,Chedraui,unknown,pan,pan,,False,0.0,,72.0,,3.8668,True,category_country_mean,18.62,from_mexico_cambio_dolar,EN,discard,keep_imputed,price_parse_failed;price<=0,dataset/txt_limpios/16.txt,dataset/paginas_descargadas/16.html
20,¿Qué estás buscando?,Tortilleria y pan empacados,567g,MX,Chedraui,unknown,pan,pan,,False,0.0,,72.0,,3.8668,True,category_country_mean,18.62,from_mexico_cambio_dolar,EN,discard,keep_imputed,price_parse_failed;price<=0,dataset/txt_limpios/20.txt,dataset/paginas_descargadas/20.html
21,¿Qué estás buscando?,Endulzantes,900g,MX,Chedraui,unknown,aceite vegetal,sin_categoria,aceite vegetal,True,0.9999988440312833,,66.32,,3.5617,True,country_mean,18.62,from_mexico_cambio_dolar,ET,discard,keep_imputed,no_category_detected;price_parse_failed,dataset/txt_limpios/21.txt,dataset/paginas_descargadas/21.html
31,¿Qué estás buscando?,Lacteos y huevo,30 Piezas,MX,Chedraui,unknown,huevo,huevo,,False,0.0,,66.32,,3.5617,True,country_mean,18.62,from_mexico_cambio_dolar,EN,discard,keep_imputed,price_parse_failed,dataset/txt_limpios/31.txt,dataset/paginas_descargadas/31.html
34,¿Qué estás buscando?,Harinas y reposteria,1Kg,MX,Chedraui,unknown,harina de trigo,harina de trigo,,False,0.0,,2902.4,,155.8757,True,category_mean,18.62,from_mexico_cambio_dolar,EN,discard,keep_imputed,price_parse_failed;price<=0,dataset/txt_limpios/34.txt,dataset/paginas_descargadas/34.html
9,¿Qué estás buscando?,Aceites y vinagres,170g,MX,Chedraui,unknown,aceite vegetal,aceite vegetal,,False,0.0,,33.3,,1.7884,True,category_country_mean,18.62,from_mexico_cambio_dolar,EN,discard,keep_imputed,price_parse_failed;price<=0,dataset/txt_limpios/9.txt,dataset/paginas_descargadas/9.html
1744,‎ ‎ ‎ ‎ ‎ ‎ ‎ ‎ ‎ ‎ ‎ ‎ ‎ ‎ ‎ ‎ ‎ ‎ ‎ ‎ ‎ ‎ ‎ ‎ ‎ ‎ ‎ ‎ ‎ ‎ ‎ ‎ ‎ ‎ ‎ ‎ ‎ ‎ ‎ ‎ ‎ ‎ ‎ ‎ ‎ ‎ ‎ ‎ ‎ ‎ ‎ ‎ ‎ ‎ ‎ ‎ ‎ ‎ ‎ ‎ ‎ ‎ ‎ ‎ ‎ ‎ ‎ ‎ ‎ ‎ Hazte Socio Diamante para disfrutar de ofertas y beneficios exclusivos.,📍,,UNKNOWN,Desconocido,unknown,huevo,sin_categoria,huevo,True,0.9368808226296684,,234.19,,234.1938,True,country_mean,1.0,default_1usd,EN,discard,keep_imputed,no_category_detected;price_parse_failed,dataset/txt_limpios/1744.txt,dataset/paginas_descargadas/1744.html
927,‎ ‎ ‎ ‎ ‎ ‎ ‎ ‎ ‎ ‎ ‎ ‎ ‎ ‎ ‎ ‎ ‎ ‎ ‎ ‎ ‎ ‎ ‎ ‎ ‎ ‎ ‎ ‎ ‎ ‎ ‎ ‎ ‎ ‎ ‎ ‎ ‎ ‎ ‎ ‎ ‎ ‎ ‎ ‎ ‎ ‎ ‎ ‎ ‎ ‎ ‎ ‎ ‎ ‎ ‎ ‎ ‎ ‎ ‎ ‎ ‎ ‎ ‎ ‎ ‎ ‎ ‎ ‎ ‎ ‎ Hazte Socio Diamante para disfrutar de ofertas y beneficios exclusivos.,📍,170 g,UNKNOWN,Desconocido,unknown,cafe,cafe,,False,0.0,7.99,7.99,7.99,7.99,False,original,1.0,default_1usd,EN,keep,keep,heuristic_default,dataset/txt_limpios/927.txt,dataset/paginas_descargadas/927.html
928,‎ ‎ ‎ ‎ ‎ ‎ ‎ ‎ ‎ ‎ ‎ ‎ ‎ ‎ ‎ ‎ ‎ ‎ ‎ ‎ ‎ ‎ ‎ ‎ ‎ ‎ ‎ ‎ ‎ ‎ ‎ ‎ ‎ ‎ ‎ ‎ ‎ ‎ ‎ ‎ ‎ ‎ ‎ ‎ ‎ ‎ ‎ ‎ ‎ ‎ ‎ ‎ ‎ ‎ ‎ ‎ ‎ ‎ ‎ ‎ ‎ ‎ ‎ ‎ ‎ ‎ ‎ ‎ ‎ ‎ Hazte Socio Diamante para disfrutar de ofertas y beneficios exclusivos.,📍,227 g,UNKNOWN,Desconocido,unknown,cafe,cafe,,False,0.0,6.49,6.49,6.49,6.49,False,original,1.0,default_1usd,EN,keep,keep,heuristic_default,dataset/txt_limpios/928.txt,dataset/paginas_descargadas/928.html
929,‎ ‎ ‎ ‎ ‎ ‎ ‎ ‎ ‎ ‎ ‎ ‎ ‎ ‎ ‎ ‎ ‎ ‎ ‎ ‎ ‎ ‎ ‎ ‎ ‎ ‎ ‎ ‎ ‎ ‎ ‎ ‎ ‎ ‎ ‎ ‎ ‎ ‎ ‎ ‎ ‎ ‎ ‎ ‎ ‎ ‎ ‎ ‎ ‎ ‎ ‎ ‎ ‎ ‎ ‎ ‎ ‎ ‎ ‎ ‎ ‎ ‎ ‎ ‎ ‎ ‎ ‎ ‎ ‎ ‎ Hazte Socio Diamante para disfrutar de ofertas y beneficios exclusivos.,📍,227 g,UNKNOWN,Desconocido,unknown,cafe,cafe,,False,0.0,14.59,14.59,14.59,14.59,False,original,1.0,default_1usd,EN,keep,keep,heuristic_default,dataset/txt_limpios/929.txt,dataset/paginas_descargadas/929.html
930,‎ ‎ ‎ ‎ ‎ ‎ ‎ ‎ ‎ ‎ ‎ ‎ ‎ ‎ ‎ ‎ ‎ ‎ ‎ ‎ ‎ ‎ ‎ ‎ ‎ ‎ ‎ ‎ ‎ ‎ ‎ ‎ ‎ ‎ ‎ ‎ ‎ ‎ ‎ ‎ ‎ ‎ ‎ ‎ ‎ ‎ ‎ ‎ ‎ ‎ ‎ ‎ ‎ ‎ ‎ ‎ ‎ ‎ ‎ ‎ ‎ ‎ ‎ ‎ ‎ ‎ ‎ ‎ ‎ ‎ Hazte Socio Diamante para disfrutar de ofertas y beneficios exclusivos.,📍,250 g,UNKNOWN,Desconocido,unknown,cafe,cafe,,False,0.0,5.45,5.45,5.45,5.45,False,original,1.0,default_1usd,EN,keep,keep,heuristic_default,dataset/txt_limpios/930.txt,dataset/paginas_descargadas/930.html
931,‎ ‎ ‎ ‎ ‎ ‎ ‎ ‎ ‎ ‎ ‎ ‎ ‎ ‎ ‎ ‎ ‎ ‎ ‎ ‎ ‎ ‎ ‎ ‎ ‎ ‎ ‎ ‎ ‎ ‎ ‎ ‎ ‎ ‎ ‎ ‎ ‎ ‎ ‎ ‎ ‎ ‎ ‎ ‎ ‎ ‎ ‎ ‎ ‎ ‎ ‎ ‎ ‎ ‎ ‎ ‎ ‎ ‎ ‎ ‎ ‎ ‎ ‎ ‎ ‎ ‎ ‎ ‎ ‎ ‎ Hazte Socio Diamante para disfrutar de ofertas y beneficios exclusivos.,📍,250 g,UNKNOWN,Desconocido,unknown,cafe,cafe,,False,0.0,5.99,5.99,5.99,5.99,False,original,1.0,default_1usd,ET,keep,keep,heuristic_default,dataset/txt_limpios/931.txt,dataset/paginas_descargadas/931.html
932,‎ ‎ ‎ ‎ ‎ ‎ ‎ ‎ ‎ ‎ ‎ ‎ ‎ ‎ ‎ ‎ ‎ ‎ ‎ ‎ ‎ ‎ ‎ ‎ ‎ ‎ ‎ ‎ ‎ ‎ ‎ ‎ ‎ ‎ ‎ ‎ ‎ ‎ ‎ ‎ ‎ ‎ ‎ ‎ ‎ ‎ ‎ ‎ ‎ ‎ ‎ ‎ ‎ ‎ ‎ ‎ ‎ ‎ ‎ ‎ ‎ ‎ ‎ ‎ ‎ ‎ ‎ ‎ ‎ ‎ Hazte Socio Diamante para disfrutar de ofertas y beneficios exclusivos.,📍,2 Kg,UNKNOWN,Desconocido,unknown,papa,papa,,False,0.0,1.99,1.99,1.99,1.99,False,original,1.0,default_1usd,ET,keep,keep,heuristic_default,dataset/txt_limpios/932.txt,dataset/paginas_descargadas/932.html
933,‎ ‎ ‎ ‎ ‎ ‎ ‎ ‎ ‎ ‎ ‎ ‎ ‎ ‎ ‎ ‎ ‎ ‎ ‎ ‎ ‎ ‎ ‎ ‎ ‎ ‎ ‎ ‎ ‎ ‎ ‎ ‎ ‎ ‎ ‎ ‎ ‎ ‎ ‎ ‎ ‎ ‎ ‎ ‎ ‎ ‎ ‎ ‎ ‎ ‎ ‎ ‎ ‎ ‎ ‎ ‎ ‎ ‎ ‎ ‎ ‎ ‎ ‎ ‎ ‎ ‎ ‎ ‎ ‎ ‎ Hazte Socio Diamante para disfrutar de ofertas y beneficios exclusivos.,📍,500 g,UNKNOWN,Desconocido,unknown,papa,papa,,False,0.0,525.0,525.0,525.0,525.0,False,original,1.0,default_1usd,EN,keep,keep,heuristic_default,dataset/txt_limpios/933.txt,dataset/paginas_descargadas/933.html
934,‎ ‎ ‎ ‎ ‎ ‎ ‎ ‎ ‎ ‎ ‎ ‎ ‎ ‎ ‎ ‎ ‎ ‎ ‎ ‎ ‎ ‎ ‎ ‎ ‎ ‎ ‎ ‎ ‎ ‎ ‎ ‎ ‎ ‎ ‎ ‎ ‎ ‎ ‎ ‎ ‎ ‎ ‎ ‎ ‎ ‎ ‎ ‎ ‎ ‎ ‎ ‎ ‎ ‎ ‎ ‎ ‎ ‎ ‎ ‎ ‎ ‎ ‎ ‎ ‎ ‎ ‎ ‎ ‎ ‎ Hazte Socio Diamante para disfrutar de ofertas y beneficios exclusivos.,📍,1.3 Kg,UNKNOWN,Desconocido,unknown,papa,papa,,False,0.0,1.35,1.35,1.35,1.35,False,original,1.0,default_1usd,EN,keep,keep,heuristic_default,dataset/txt_limpios/934.txt,dataset/paginas_descargadas/934.html
935,‎ ‎ ‎ ‎ ‎ ‎ ‎ ‎ ‎ ‎ ‎ ‎ ‎ ‎ ‎ ‎ ‎ ‎ ‎ ‎ ‎ ‎ ‎ ‎ ‎ ‎ ‎ ‎ ‎ ‎ ‎ ‎ ‎ ‎ ‎ ‎ ‎ ‎ ‎ ‎ ‎ ‎ ‎ ‎ ‎ ‎ ‎ ‎ ‎ ‎ ‎ ‎ ‎ ‎ ‎ ‎ ‎ ‎ ‎ ‎ ‎ ‎ ‎ ‎ ‎ ‎ ‎ ‎ ‎ ‎ Hazte Socio Diamante para disfrutar de ofertas y beneficios exclusivos.,📍,,UNKNOWN,Desconocido,unknown,huevo,sin_categoria,huevo,True,0.9368808226296684,,234.19,,234.1938,True,country_mean,1.0,default_1usd,EN,discard,keep_imputed,no_category_detected;price_parse_failed,dataset/txt_limpios/935.txt,dataset/paginas_descargadas/935.html
936,‎ ‎ ‎ ‎ ‎ ‎ ‎ ‎ ‎ ‎ ‎ ‎ ‎ ‎ ‎ ‎ ‎ ‎ ‎ ‎ ‎ ‎ ‎ ‎ ‎ ‎ ‎ ‎ ‎ ‎ ‎ ‎ ‎ ‎ ‎ ‎ ‎ ‎ ‎ ‎ ‎ ‎ ‎ ‎ ‎ ‎ ‎ ‎ ‎ ‎ ‎ ‎ ‎ ‎ ‎ ‎ ‎ ‎ ‎ ‎ ‎ ‎ ‎ ‎ ‎ ‎ ‎ ‎ ‎ ‎ Hazte Socio Diamante para disfrutar de ofertas y beneficios exclusivos.,📍,750 g,UNKNOWN,Desconocido,unknown,pan,pan,,False,0.0,2.89,2.89,2.89,2.89,False,original,1.0,default_1usd,ET,keep,keep,heuristic_default,dataset/txt_limpios/936.txt,dataset/paginas_descargadas/936.html
937,‎ ‎ ‎ ‎ ‎ ‎ ‎ ‎ ‎ ‎ ‎ ‎ ‎ ‎ ‎ ‎ ‎ ‎ ‎ ‎ ‎ ‎ ‎ ‎ ‎ ‎ ‎ ‎ ‎ ‎ ‎ ‎ ‎ ‎ ‎ ‎ ‎ ‎ ‎ ‎ ‎ ‎ ‎ ‎ ‎ ‎ ‎ ‎ ‎ ‎ ‎ ‎ ‎ ‎ ‎ ‎ ‎ ‎ ‎ ‎ ‎ ‎ ‎ ‎ ‎ ‎ ‎ ‎ ‎ ‎ Hazte Socio Diamante para disfrutar de ofertas y beneficios exclusivos.,📍,,UNKNOWN,Desconocido,unknown,huevo,sin_categoria,huevo,True,0.9368808226296684,,234.19,,234.1938,True,country_mean,1.0,default_1usd,EN,discard,keep_imputed,no_category_detected;price_parse_failed,dataset/txt_limpios/937.txt,dataset/paginas_descargadas/937.html
938,‎ ‎ ‎ ‎ ‎ ‎ ‎ ‎ ‎ ‎ ‎ ‎ ‎ ‎ ‎ ‎ ‎ ‎ ‎ ‎ ‎ ‎ ‎ ‎ ‎ ‎ ‎ ‎ ‎ ‎ ‎ ‎ ‎ ‎ ‎ ‎ ‎ ‎ ‎ ‎ ‎ ‎ ‎ ‎ ‎ ‎ ‎ ‎ ‎ ‎ ‎ ‎ ‎ ‎ ‎ ‎ ‎ ‎ ‎ ‎ ‎ ‎ ‎ ‎ ‎ ‎ ‎ ‎ ‎ ‎ Hazte Socio Diamante para disfrutar de ofertas y beneficios exclusivos.,📍,650 g,UNKNOWN,Desconocido,unknown,pan,pan,,False,0.0,3.15,3.15,3.15,3.15,False,original,1.0,default_1usd,EN,keep,keep,heuristic_default,dataset/txt_limpios/938.txt,dataset/paginas_descargadas/938.html
939,‎ ‎ ‎ ‎ ‎ ‎ ‎ ‎ ‎ ‎ ‎ ‎ ‎ ‎ ‎ ‎ ‎ ‎ ‎ ‎ ‎ ‎ ‎ ‎ ‎ ‎ ‎ ‎ ‎ ‎ ‎ ‎ ‎ ‎ ‎ ‎ ‎ ‎ ‎ ‎ ‎ ‎ ‎ ‎ ‎ ‎ ‎ ‎ ‎ ‎ ‎ ‎ ‎ ‎ ‎ ‎ ‎ ‎ ‎ ‎ ‎ ‎ ‎ ‎ ‎ ‎ ‎ ‎ ‎ ‎ Hazte Socio Diamante para disfrutar de ofertas y beneficios exclusivos.,📍,750 g,UNKNOWN,Desconocido,unknown,pan,pan,,False,0.0,2.55,2.55,2.55,2.55,False,original,1.0,default_1usd,EN,keep,keep,heuristic_default,dataset/txt_limpios/939.txt,dataset/paginas_descargadas/939.html
940,‎ ‎ ‎ ‎ ‎ ‎ ‎ ‎ ‎ ‎ ‎ ‎ ‎ ‎ ‎ ‎ ‎ ‎ ‎ ‎ ‎ ‎ ‎ ‎ ‎ ‎ ‎ ‎ ‎ ‎ ‎ ‎ ‎ ‎ ‎ ‎ ‎ ‎ ‎ ‎ ‎ ‎ ‎ ‎ ‎ ‎ ‎ ‎ ‎ ‎ ‎ ‎ ‎ ‎ ‎ ‎ ‎ ‎ ‎ ‎ ‎ ‎ ‎ ‎ ‎ ‎ ‎ ‎ ‎ ‎ Hazte Socio Diamante para disfrutar de ofertas y beneficios exclusivos.,📍,1.5 L,UNKNOWN,Desconocido,unknown,refresco de cola,refresco de cola,,False,0.0,2.09,2.09,2.09,2.09,False,original,1.0,default_1usd,ET,keep,keep,heuristic_default,dataset/txt_limpios/940.txt,dataset/paginas_descargadas/940.html
941,‎ ‎ ‎ ‎ ‎ ‎ ‎ ‎ ‎ ‎ ‎ ‎ ‎ ‎ ‎ ‎ ‎ ‎ ‎ ‎ ‎ ‎ ‎ ‎ ‎ ‎ ‎ ‎ ‎ ‎ ‎ ‎ ‎ ‎ ‎ ‎ ‎ ‎ ‎ ‎ ‎ ‎ ‎ ‎ ‎ ‎ ‎ ‎ ‎ ‎ ‎ ‎ ‎ ‎ ‎ ‎ ‎ ‎ ‎ ‎ ‎ ‎ ‎ ‎ ‎ ‎ ‎ ‎ ‎ ‎ Hazte Socio Diamante para disfrutar de ofertas y beneficios exclusivos.,📍,,UNKNOWN,Desconocido,unknown,huevo,sin_categoria,huevo,True,0.9368808226296684,,234.19,,234.1938,True,country_mean,1.0,default_1usd,EN,discard,keep_imputed,no_category_detected;price_parse_failed,dataset/txt_limpios/941.txt,dataset/paginas_descargadas/941.html
942,‎ ‎ ‎ ‎ ‎ ‎ ‎ ‎ ‎ ‎ ‎ ‎ ‎ ‎ ‎ ‎ ‎ ‎ ‎ ‎ ‎ ‎ ‎ ‎ ‎ ‎ ‎ ‎ ‎ ‎ ‎ ‎ ‎ ‎ ‎ ‎ ‎ ‎ ‎ ‎ ‎ ‎ ‎ ‎ ‎ ‎ ‎ ‎ ‎ ‎ ‎ ‎ ‎ ‎ ‎ ‎ ‎ ‎ ‎ ‎ ‎ ‎ ‎ ‎ ‎ ‎ ‎ ‎ ‎ ‎ Hazte Socio Diamante para disfrutar de ofertas y beneficios exclusivos.,📍,1.5 L,UNKNOWN,Desconocido,unknown,papa,sin_categoria,papa,True,1.0,2.15,2.15,2.15,2.15,False,original,1.0,default_1usd,EN,discard,keep_imputed,no_category_detected,dataset/txt_limpios/942.txt,dataset/paginas_descargadas/942.html
943,‎ ‎ ‎ ‎ ‎ ‎ ‎ ‎ ‎ ‎ ‎ ‎ ‎ ‎ ‎ ‎ ‎ ‎ ‎ ‎ ‎ ‎ ‎ ‎ ‎ ‎ ‎ ‎ ‎ ‎ ‎ ‎ ‎ ‎ ‎ ‎ ‎ ‎ ‎ ‎ ‎ ‎ ‎ ‎ ‎ ‎ ‎ ‎ ‎ ‎ ‎ ‎ ‎ ‎ ‎ ‎ ‎ ‎ ‎ ‎ ‎ ‎ ‎ ‎ ‎ ‎ ‎ ‎ ‎ ‎ Hazte Socio Diamante para disfrutar de ofertas y beneficios exclusivos.,📍,,UNKNOWN,Desconocido,unknown,huevo,sin_categoria,huevo,True,0.9368808226296684,,234.19,,234.1938,True,country_mean,1.0,default_1usd,EN,discard,keep_imputed,no_category_detected;price_parse_failed,dataset/txt_limpios/943.txt,dataset/paginas_descargadas/943.html
944,‎ ‎ ‎ ‎ ‎ ‎ ‎ ‎ ‎ ‎ ‎ ‎ ‎ ‎ ‎ ‎ ‎ ‎ ‎ ‎ ‎ ‎ ‎ ‎ ‎ ‎ ‎ ‎ ‎ ‎ ‎ ‎ ‎ ‎ ‎ ‎ ‎ ‎ ‎ ‎ ‎ ‎ ‎ ‎ ‎ ‎ ‎ ‎ ‎ ‎ ‎ ‎ ‎ ‎ ‎ ‎ ‎ ‎ ‎ ‎ ‎ ‎ ‎ ‎ ‎ ‎ ‎ ‎ ‎ ‎ Hazte Socio Diamante para disfrutar de ofertas y beneficios exclusivos.,📍,,UNKNOWN,Desconocido,unknown,huevo,sin_categoria,huevo,True,0.9368808226296684,,234.19,,234.1938,True,country_mean,1.0,default_1usd,EN,discard,keep_imputed,no_category_detected;price_parse_failed,dataset/txt_limpios/944.txt,dataset/paginas_descargadas/944.html
945,‎ ‎ ‎ ‎ ‎ ‎ ‎ ‎ ‎ ‎ ‎ ‎ ‎ ‎ ‎ ‎ ‎ ‎ ‎ ‎ ‎ ‎ ‎ ‎ ‎ ‎ ‎ ‎ ‎ ‎ ‎ ‎ ‎ ‎ ‎ ‎ ‎ ‎ ‎ ‎ ‎ ‎ ‎ ‎ ‎ ‎ ‎ ‎ ‎ ‎ ‎ ‎ ‎ ‎ ‎ ‎ ‎ ‎ ‎ ‎ ‎ ‎ ‎ ‎ ‎ ‎ ‎ ‎ ‎ ‎ Hazte Socio Diamante para disfrutar de ofertas y beneficios exclusivos.,📍,500 g,UNKNOWN,Desconocido,unknown,papa,papa,,False,0.0,995.0,995.0,995.0,995.0,False,original,1.0,default_1usd,ET,keep,keep,heuristic_default,dataset/txt_limpios/945.txt,dataset/paginas_descargadas/945.html
946,‎ ‎ ‎ ‎ ‎ ‎ ‎ ‎ ‎ ‎ ‎ ‎ ‎ ‎ ‎ ‎ ‎ ‎ ‎ ‎ ‎ ‎ ‎ ‎ ‎ ‎ ‎ ‎ ‎ ‎ ‎ ‎ ‎ ‎ ‎ ‎ ‎ ‎ ‎ ‎ ‎ ‎ ‎ ‎ ‎ ‎ ‎ ‎ ‎ ‎ ‎ ‎ ‎ ‎ ‎ ‎ ‎ ‎ ‎ ‎ ‎ ‎ ‎ ‎ ‎ ‎ ‎ ‎ ‎ ‎ Hazte Socio Diamante para disfrutar de ofertas y beneficios exclusivos.,📍,1 Kg,UNKNOWN,Desconocido,unknown,papa,papa,,False,0.0,1.99,1.99,1.99,1.99,False,original,1.0,default_1usd,EN,keep,keep,heuristic_default,dataset/txt_limpios/946.txt,dataset/paginas_descargadas/946.html
947,‎ ‎ ‎ ‎ ‎ ‎ ‎ ‎ ‎ ‎ ‎ ‎ ‎ ‎ ‎ ‎ ‎ ‎ ‎ ‎ ‎ ‎ ‎ ‎ ‎ ‎ ‎ ‎ ‎ ‎ ‎ ‎ ‎ ‎ ‎ ‎ ‎ ‎ ‎ ‎ ‎ ‎ ‎ ‎ ‎ ‎ ‎ ‎ ‎ ‎ ‎ ‎ ‎ ‎ ‎ ‎ ‎ ‎ ‎ ‎ ‎ ‎ ‎ ‎ ‎ ‎ ‎ ‎ ‎ ‎ Hazte Socio Diamante para disfrutar de ofertas y beneficios exclusivos.,📍,300 g,UNKNOWN,Desconocido,unknown,papa,papa,,False,0.0,1.99,1.99,1.99,1.99,False,original,1.0,default_1usd,EN,keep,keep,heuristic_default,dataset/txt_limpios/947.txt,dataset/paginas_descargadas/947.html
948,‎ ‎ ‎ ‎ ‎ ‎ ‎ ‎ ‎ ‎ ‎ ‎ ‎ ‎ ‎ ‎ ‎ ‎ ‎ ‎ ‎ ‎ ‎ ‎ ‎ ‎ ‎ ‎ ‎ ‎ ‎ ‎ ‎ ‎ ‎ ‎ ‎ ‎ ‎ ‎ ‎ ‎ ‎ ‎ ‎ ‎ ‎ ‎ ‎ ‎ ‎ ‎ ‎ ‎ ‎ ‎ ‎ ‎ ‎ ‎ ‎ ‎ ‎ ‎ ‎ ‎ ‎ ‎ ‎ ‎ Hazte Socio Diamante para disfrutar de ofertas y beneficios exclusivos.,📍,250 g,UNKNOWN,Desconocido,unknown,banano,banano,,False,0.0,1.25,1.25,1.25,1.25,False,original,1.0,default_1usd,EN,keep,keep,heuristic_default,dataset/txt_limpios/948.txt,dataset/paginas_descargadas/948.html
949,‎ ‎ ‎ ‎ ‎ ‎ ‎ ‎ ‎ ‎ ‎ ‎ ‎ ‎ ‎ ‎ ‎ ‎ ‎ ‎ ‎ ‎ ‎ ‎ ‎ ‎ ‎ ‎ ‎ ‎ ‎ ‎ ‎ ‎ ‎ ‎ ‎ ‎ ‎ ‎ ‎ ‎ ‎ ‎ ‎ ‎ ‎ ‎ ‎ ‎ ‎ ‎ ‎ ‎ ‎ ‎ ‎ ‎ ‎ ‎ ‎ ‎ ‎ ‎ ‎ ‎ ‎ ‎ ‎ ‎ Hazte Socio Diamante para disfrutar de ofertas y beneficios exclusivos.,📍,,UNKNOWN,Desconocido,unknown,huevo,sin_categoria,huevo,True,0.9368808226296684,,234.19,,234.1938,True,country_mean,1.0,default_1usd,EN,discard,keep_imputed,no_category_detected;price_parse_failed,dataset/txt_limpios/949.txt,dataset/paginas_descargadas/949.html
950,‎ ‎ ‎ ‎ ‎ ‎ ‎ ‎ ‎ ‎ ‎ ‎ ‎ ‎ ‎ ‎ ‎ ‎ ‎ ‎ ‎ ‎ ‎ ‎ ‎ ‎ ‎ ‎ ‎ ‎ ‎ ‎ ‎ ‎ ‎ ‎ ‎ ‎ ‎ ‎ ‎ ‎ ‎ ‎ ‎ ‎ ‎ ‎ ‎ ‎ ‎ ‎ ‎ ‎ ‎ ‎ ‎ ‎ ‎ ‎ ‎ ‎ ‎ ‎ ‎ ‎ ‎ ‎ ‎ ‎ Hazte Socio Diamante para disfrutar de ofertas y beneficios exclusivos.,📍,12 unidad,UNKNOWN,Desconocido,unknown,huevo,huevo,,False,0.0,4.29,4.29,4.29,4.29,False,original,1.0,default_1usd,EN,discard,keep_imputed,heuristic_default,dataset/txt_limpios/950.txt,dataset/paginas_descargadas/950.html
951,‎ ‎ ‎ ‎ ‎ ‎ ‎ ‎ ‎ ‎ ‎ ‎ ‎ ‎ ‎ ‎ ‎ ‎ ‎ ‎ ‎ ‎ ‎ ‎ ‎ ‎ ‎ ‎ ‎ ‎ ‎ ‎ ‎ ‎ ‎ ‎ ‎ ‎ ‎ ‎ ‎ ‎ ‎ ‎ ‎ ‎ ‎ ‎ ‎ ‎ ‎ ‎ ‎ ‎ ‎ ‎ ‎ ‎ ‎ ‎ ‎ ‎ ‎ ‎ ‎ ‎ ‎ ‎ ‎ ‎ Hazte Socio Diamante para disfrutar de ofertas y beneficios exclusivos.,📍,20 unidad,UNKNOWN,Desconocido,unknown,huevo,huevo,,False,0.0,7.39,7.39,7.39,7.39,False,original,1.0,default_1usd,EN,discard,keep_imputed,heuristic_default,dataset/txt_limpios/951.txt,dataset/paginas_descargadas/951.html
952,‎ ‎ ‎ ‎ ‎ ‎ ‎ ‎ ‎ ‎ ‎ ‎ ‎ ‎ ‎ ‎ ‎ ‎ ‎ ‎ ‎ ‎ ‎ ‎ ‎ ‎ ‎ ‎ ‎ ‎ ‎ ‎ ‎ ‎ ‎ ‎ ‎ ‎ ‎ ‎ ‎ ‎ ‎ ‎ ‎ ‎ ‎ ‎ ‎ ‎ ‎ ‎ ‎ ‎ ‎ ‎ ‎ ‎ ‎ ‎ ‎ ‎ ‎ ‎ ‎ ‎ ‎ ‎ ‎ ‎ Hazte Socio Diamante para disfrutar de ofertas y beneficios exclusivos.,📍,12 unidad,UNKNOWN,Desconocido,unknown,huevo,huevo,,False,0.0,4.88,4.88,4.88,4.88,False,original,1.0,default_1usd,EN,discard,keep_imputed,heuristic_default,dataset/txt_limpios/952.txt,dataset/paginas_descargadas/952.html
953,‎ ‎ ‎ ‎ ‎ ‎ ‎ ‎ ‎ ‎ ‎ ‎ ‎ ‎ ‎ ‎ ‎ ‎ ‎ ‎ ‎ ‎ ‎ ‎ ‎ ‎ ‎ ‎ ‎ ‎ ‎ ‎ ‎ ‎ ‎ ‎ ‎ ‎ ‎ ‎ ‎ ‎ ‎ ‎ ‎ ‎ ‎ ‎ ‎ ‎ ‎ ‎ ‎ ‎ ‎ ‎ ‎ ‎ ‎ ‎ ‎ ‎ ‎ ‎ ‎ ‎ ‎ ‎ ‎ ‎ Hazte Socio Diamante para disfrutar de ofertas y beneficios exclusivos.,📍,12 unidad,UNKNOWN,Desconocido,unknown,huevo,huevo,,False,0.0,5.55,5.55,5.55,5.55,False,original,1.0,default_1usd,EN,discard,keep_imputed,heuristic_default,dataset/txt_limpios/953.txt,dataset/paginas_descargadas/953.html
957,‎ ‎ ‎ ‎ ‎ ‎ ‎ ‎ ‎ ‎ ‎ ‎ ‎ ‎ ‎ ‎ ‎ ‎ ‎ ‎ ‎ ‎ ‎ ‎ ‎ ‎ ‎ ‎ ‎ ‎ ‎ ‎ ‎ ‎ ‎ ‎ ‎ ‎ ‎ ‎ ‎ ‎ ‎ ‎ ‎ ‎ ‎ ‎ ‎ ‎ ‎ ‎ ‎ ‎ ‎ ‎ ‎ ‎ ‎ ‎ ‎ ‎ ‎ ‎ ‎ ‎ ‎ ‎ ‎ ‎ Hazte Socio Diamante para disfrutar de ofertas y beneficios exclusivos.,📍,,UNKNOWN,Desconocido,unknown,huevo,sin_categoria,huevo,True,0.9368808226296684,,234.19,,234.1938,True,country_mean,1.0,default_1usd,EN,discard,keep_imputed,no_category_detected;price_parse_failed,dataset/txt_limpios/957.txt,dataset/paginas_descargadas/957.html
958,‎ ‎ ‎ ‎ ‎ ‎ ‎ ‎ ‎ ‎ ‎ ‎ ‎ ‎ ‎ ‎ ‎ ‎ ‎ ‎ ‎ ‎ ‎ ‎ ‎ ‎ ‎ ‎ ‎ ‎ ‎ ‎ ‎ ‎ ‎ ‎ ‎ ‎ ‎ ‎ ‎ ‎ ‎ ‎ ‎ ‎ ‎ ‎ ‎ ‎ ‎ ‎ ‎ ‎ ‎ ‎ ‎ ‎ ‎ ‎ ‎ ‎ ‎ ‎ ‎ ‎ ‎ ‎ ‎ ‎ Hazte Socio Diamante para disfrutar de ofertas y beneficios exclusivos.,📍,,UNKNOWN,Desconocido,unknown,huevo,sin_categoria,huevo,True,0.9368808226296684,,234.19,,234.1938,True,country_mean,1.0,default_1usd,EN,discard,keep_imputed,no_category_detected;price_parse_failed,dataset/txt_limpios/958.txt,dataset/paginas_descargadas/958.html
960,‎ ‎ ‎ ‎ ‎ ‎ ‎ ‎ ‎ ‎ ‎ ‎ ‎ ‎ ‎ ‎ ‎ ‎ ‎ ‎ ‎ ‎ ‎ ‎ ‎ ‎ ‎ ‎ ‎ ‎ ‎ ‎ ‎ ‎ ‎ ‎ ‎ ‎ ‎ ‎ ‎ ‎ ‎ ‎ ‎ ‎ ‎ ‎ ‎ ‎ ‎ ‎ ‎ ‎ ‎ ‎ ‎ ‎ ‎ ‎ ‎ ‎ ‎ ‎ ‎ ‎ ‎ ‎ ‎ ‎ Hazte Socio Diamante para disfrutar de ofertas y beneficios exclusivos.,📍,,UNKNOWN,Desconocido,unknown,huevo,sin_categoria,huevo,True,0.9368808226296684,,234.19,,234.1938,True,country_mean,1.0,default_1usd,EN,discard,keep_imputed,no_category_detected;price_parse_failed,dataset/txt_limpios/960.txt,dataset/paginas_descargadas/960.html
961,‎ ‎ ‎ ‎ ‎ ‎ ‎ ‎ ‎ ‎ ‎ ‎ ‎ ‎ ‎ ‎ ‎ ‎ ‎ ‎ ‎ ‎ ‎ ‎ ‎ ‎ ‎ ‎ ‎ ‎ ‎ ‎ ‎ ‎ ‎ ‎ ‎ ‎ ‎ ‎ ‎ ‎ ‎ ‎ ‎ ‎ ‎ ‎ ‎ ‎ ‎ ‎ ‎ ‎ ‎ ‎ ‎ ‎ ‎ ‎ ‎ ‎ ‎ ‎ ‎ ‎ ‎ ‎ ‎ ‎ Hazte Socio Diamante para disfrutar de ofertas y beneficios exclusivos.,📍,400 g,UNKNOWN,Desconocido,unknown,huevo,huevo,,False,0.0,2.0,2.0,2.0,2.0,False,original,1.0,default_1usd,EN,discard,keep_imputed,heuristic_default,dataset/txt_limpios/961.txt,dataset/paginas_descargadas/961.html
962,‎ ‎ ‎ ‎ ‎ ‎ ‎ ‎ ‎ ‎ ‎ ‎ ‎ ‎ ‎ ‎ ‎ ‎ ‎ ‎ ‎ ‎ ‎ ‎ ‎ ‎ ‎ ‎ ‎ ‎ ‎ ‎ ‎ ‎ ‎ ‎ ‎ ‎ ‎ ‎ ‎ ‎ ‎ ‎ ‎ ‎ ‎ ‎ ‎ ‎ ‎ ‎ ‎ ‎ ‎ ‎ ‎ ‎ ‎ ‎ ‎ ‎ ‎ ‎ ‎ ‎ ‎ ‎ ‎ ‎ Hazte Socio Diamante para disfrutar de ofertas y beneficios exclusivos.,📍,,UNKNOWN,Desconocido,unknown,huevo,sin_categoria,huevo,True,0.9368808226296684,,234.19,,234.1938,True,country_mean,1.0,default_1usd,EN,discard,keep_imputed,no_category_detected;price_parse_failed,dataset/txt_limpios/962.txt,dataset/paginas_descargadas/962.html
963,‎ ‎ ‎ ‎ ‎ ‎ ‎ ‎ ‎ ‎ ‎ ‎ ‎ ‎ ‎ ‎ ‎ ‎ ‎ ‎ ‎ ‎ ‎ ‎ ‎ ‎ ‎ ‎ ‎ ‎ ‎ ‎ ‎ ‎ ‎ ‎ ‎ ‎ ‎ ‎ ‎ ‎ ‎ ‎ ‎ ‎ ‎ ‎ ‎ ‎ ‎ ‎ ‎ ‎ ‎ ‎ ‎ ‎ ‎ ‎ ‎ ‎ ‎ ‎ ‎ ‎ ‎ ‎ ‎ ‎ Hazte Socio Diamante para disfrutar de ofertas y beneficios exclusivos.,📍,400 g,UNKNOWN,Desconocido,unknown,huevo,huevo,,False,0.0,1.33,1.33,1.33,1.33,False,original,1.0,default_1usd,ET,discard,keep_imputed,heuristic_default,dataset/txt_limpios/963.txt,dataset/paginas_descargadas/963.html
964,‎ ‎ ‎ ‎ ‎ ‎ ‎ ‎ ‎ ‎ ‎ ‎ ‎ ‎ ‎ ‎ ‎ ‎ ‎ ‎ ‎ ‎ ‎ ‎ ‎ ‎ ‎ ‎ ‎ ‎ ‎ ‎ ‎ ‎ ‎ ‎ ‎ ‎ ‎ ‎ ‎ ‎ ‎ ‎ ‎ ‎ ‎ ‎ ‎ ‎ ‎ ‎ ‎ ‎ ‎ ‎ ‎ ‎ ‎ ‎ ‎ ‎ ‎ ‎ ‎ ‎ ‎ ‎ ‎ ‎ Hazte Socio Diamante para disfrutar de ofertas y beneficios exclusivos.,📍,400 g,UNKNOWN,Desconocido,unknown,huevo,huevo,,False,0.0,2.0,2.0,2.0,2.0,False,original,1.0,default_1usd,ET,discard,keep_imputed,heuristic_default,dataset/txt_limpios/964.txt,dataset/paginas_descargadas/964.html
965,‎ ‎ ‎ ‎ ‎ ‎ ‎ ‎ ‎ ‎ ‎ ‎ ‎ ‎ ‎ ‎ ‎ ‎ ‎ ‎ ‎ ‎ ‎ ‎ ‎ ‎ ‎ ‎ ‎ ‎ ‎ ‎ ‎ ‎ ‎ ‎ ‎ ‎ ‎ ‎ ‎ ‎ ‎ ‎ ‎ ‎ ‎ ‎ ‎ ‎ ‎ ‎ ‎ ‎ ‎ ‎ ‎ ‎ ‎ ‎ ‎ ‎ ‎ ‎ ‎ ‎ ‎ ‎ ‎ ‎ Hazte Socio Diamante para disfrutar de ofertas y beneficios exclusivos.,📍,400 g,UNKNOWN,Desconocido,unknown,huevo,huevo,,False,0.0,480.0,480.0,480.0,480.0,False,original,1.0,default_1usd,EN,discard,keep_imputed,heuristic_default,dataset/txt_limpios/965.txt,dataset/paginas_descargadas/965.html
