source_id,product_name,brand,unit,country,seller,availability,category_effective,category_canonical,category_canonical_imputed,category_is_imputed,category_model_confidence,price_amount,price_amount_filled,price_amount_usd,price_amount_usd_filled,price_is_imputed,price_imputation_source,fx_rate_local_per_usd,fx_source,es_status,decision,decision_imputed,reasons,txt_path,html_path
1180,Centro de preferencia de la privacidad,Activas siempre,1Kg,PE,Desconocido,unknown,azucar,sin_categoria,azucar,True,1.0,,55.14,,15.5336,True,country_mean,3.55,from_peru_cambio_dolar,ET,discard,keep_imputed,no_category_detected;price_parse_failed,dataset/txt_limpios/1180.txt,dataset/paginas_descargadas/1180.html
1181,Centro de preferencia de la privacidad,Activas siempre,2Kg,PE,Desconocido,unknown,azucar,sin_categoria,azucar,True,1.0,,55.14,,15.5336,True,country_mean,3.55,from_peru_cambio_dolar,ET,discard,keep_imputed,no_category_detected;price_parse_failed,dataset/txt_limpios/1181.txt,dataset/paginas_descargadas/1181.html
1183,Centro de preferencia de la privacidad,Activas siempre,200g,PE,Desconocido,unknown,huevo,sin_categoria,huevo,True,0.993604383840333,,55.14,,15.5336,True,country_mean,3.55,from_peru_cambio_dolar,ET,discard,keep_imputed,no_category_detected;price_parse_failed,dataset/txt_limpios/1183.txt,dataset/paginas_descargadas/1183.html
1184,Centro de preferencia de la privacidad,Activas siempre,810g,PE,Desconocido,unknown,pan,sin_categoria,pan,True,1.0,600.0,600.0,169.0141,169.0141,False,original,3.55,from_peru_cambio_dolar,ET,discard,keep_imputed,no_category_detected,dataset/txt_limpios/1184.txt,dataset/paginas_descargadas/1184.html
1186,Centro de preferencia de la privacidad,Activas siempre,500g,PE,Desconocido,unknown,pan,sin_categoria,pan,True,1.0,,55.14,,15.5336,True,country_mean,3.55,from_peru_cambio_dolar,ET,discard,keep_imputed,no_category_detected;price_parse_failed,dataset/txt_limpios/1186.txt,dataset/paginas_descargadas/1186.html
1187,Centro de preferencia de la privacidad,Activas siempre,780g,PE,Desconocido,unknown,pan,sin_categoria,pan,True,1.0,,55.14,,15.5336,True,country_mean,3.55,from_peru_cambio_dolar,ET,discard,keep_imputed,no_category_detected;price_parse_failed,dataset/txt_limpios/1187.txt,dataset/paginas_descargadas/1187.html
1188,Centro de preferencia de la privacidad,Activas siempre,560g,PE,Desconocido,unknown,pan,sin_categoria,pan,True,1.0,,55.14,,15.5336,True,country_mean,3.55,from_peru_cambio_dolar,ET,discard,keep_imputed,no_category_detected;price_parse_failed,dataset/txt_limpios/1188.txt,dataset/paginas_descargadas/1188.html
1191,Centro de preferencia de la privacidad,Activas siempre,500g,PE,Desconocido,unknown,huevo,sin_categoria,huevo,True,1.0,,55.14,,15.5336,True,country_mean,3.55,from_peru_cambio_dolar,ET,discard,keep_imputed,no_category_detected;price_parse_failed,dataset/txt_limpios/1191.txt,dataset/paginas_descargadas/1191.html
1192,Centro de preferencia de la privacidad,Activas siempre,450g,PE,Desconocido,unknown,huevo,sin_categoria,huevo,True,1.0,,55.14,,15.5336,True,country_mean,3.55,from_peru_cambio_dolar,ET,discard,keep_imputed,no_category_detected;price_parse_failed,dataset/txt_limpios/1192.txt,dataset/paginas_descargadas/1192.html
1193,Centro de preferencia de la privacidad,Activas siempre,500g,PE,Desconocido,unknown,huevo,sin_categoria,huevo,True,1.0,,55.14,,15.5336,True,country_mean,3.55,from_peru_cambio_dolar,ET,discard,keep_imputed,no_category_detected;price_parse_failed,dataset/txt_limpios/1193.txt,dataset/paginas_descargadas/1193.html
1194,Centro de preferencia de la privacidad,Activas siempre,140g,PE,Desconocido,unknown,atun,sin_categoria,atun,True,1.0,,55.14,,15.5336,True,country_mean,3.55,from_peru_cambio_dolar,ET,discard,keep_imputed,no_category_detected;price_parse_failed,dataset/txt_limpios/1194.txt,dataset/paginas_descargadas/1194.html
1195,Centro de preferencia de la privacidad,Activas siempre,150g,PE,Desconocido,unknown,atun,sin_categoria,atun,True,1.0,,55.14,,15.5336,True,country_mean,3.55,from_peru_cambio_dolar,ET,discard,keep_imputed,no_category_detected;price_parse_failed,dataset/txt_limpios/1195.txt,dataset/paginas_descargadas/1195.html
1196,Centro de preferencia de la privacidad,Activas siempre,150gr,PE,Desconocido,unknown,atun,sin_categoria,atun,True,1.0,,55.14,,15.5336,True,country_mean,3.55,from_peru_cambio_dolar,ET,discard,keep_imputed,no_category_detected;price_parse_failed,dataset/txt_limpios/1196.txt,dataset/paginas_descargadas/1196.html
1198,Centro de preferencia de la privacidad,Activas siempre,140g,PE,Desconocido,unknown,atun,sin_categoria,atun,True,1.0,,55.14,,15.5336,True,country_mean,3.55,from_peru_cambio_dolar,ET,discard,keep_imputed,no_category_detected;price_parse_failed,dataset/txt_limpios/1198.txt,dataset/paginas_descargadas/1198.html
304,Cerveja Praya Witbier 600ml,Descripción,600ml,UNKNOWN,Desconocido,unknown,cerveza,cerveza,,False,0.0,,127.27,,127.2675,True,category_country_mean,1.0,default_1usd,ET,discard,keep_imputed,price_parse_failed;price<=0,dataset/txt_limpios/304.txt,dataset/paginas_descargadas/304.html
1567,Cervejas Tradicionais,Cerveja Heineken Garrafa 600ml,600ml,BR,Desconocido,unknown,cerveza,cerveza,,False,0.0,13.19,13.19,2.4211,2.4211,False,original,5.448,from_brasil_cambio_dolar,EN,keep,keep,heuristic_default,dataset/txt_limpios/1567.txt,dataset/paginas_descargadas/1567.html
1570,Cervejas Tradicionais,"R$ 6,39",330ml,BR,Desconocido,unknown,cerveza,sin_categoria,cerveza,True,0.9990990588371698,6.39,6.39,1.1729,1.1729,False,original,5.448,from_brasil_cambio_dolar,EN,discard,keep_imputed,no_category_detected,dataset/txt_limpios/1570.txt,dataset/paginas_descargadas/1570.html
1574,Cervejas Tradicionais,de,350ml,BR,Desconocido,unknown,cerveza,sin_categoria,cerveza,True,0.984554750409913,3.99,3.99,0.7324,0.7324,False,original,5.448,from_brasil_cambio_dolar,EN,discard,keep_imputed,no_category_detected,dataset/txt_limpios/1574.txt,dataset/paginas_descargadas/1574.html
1578,Cervejas Tradicionais,"R$ 5,59",330ml,BR,Desconocido,unknown,cerveza,sin_categoria,cerveza,True,0.9991411643539948,5.59,5.59,1.0261,1.0261,False,original,5.448,from_brasil_cambio_dolar,EN,discard,keep_imputed,no_category_detected,dataset/txt_limpios/1578.txt,dataset/paginas_descargadas/1578.html
1581,Cervejas Tradicionais,"R$ 5,19",330ml,BR,Desconocido,unknown,cerveza,sin_categoria,cerveza,True,0.9986339638548626,5.19,5.19,0.9526,0.9526,False,original,5.448,from_brasil_cambio_dolar,EN,discard,keep_imputed,no_category_detected,dataset/txt_limpios/1581.txt,dataset/paginas_descargadas/1581.html
210,Cervejas Tradicionais,Cerveja Heineken Garrafa 600ml,600ml,BR,Desconocido,unknown,cerveza,cerveza,,False,0.0,13.49,13.49,2.4761,2.4761,False,original,5.448,from_brasil_cambio_dolar,EN,keep,keep,heuristic_default,dataset/txt_limpios/210.txt,dataset/paginas_descargadas/210.html
211,Cervejas Tradicionais,"R$ 6,49",330ml,BR,Desconocido,unknown,cerveza,sin_categoria,cerveza,True,0.998675591396529,6.49,6.49,1.1913,1.1913,False,original,5.448,from_brasil_cambio_dolar,EN,discard,keep_imputed,no_category_detected,dataset/txt_limpios/211.txt,dataset/paginas_descargadas/211.html
212,Cervejas Tradicionais,"R$ 3,99",350ml,BR,Desconocido,unknown,cerveza,sin_categoria,cerveza,True,0.9860271075199936,3.99,3.99,0.7324,0.7324,False,original,5.448,from_brasil_cambio_dolar,EN,discard,keep_imputed,no_category_detected,dataset/txt_limpios/212.txt,dataset/paginas_descargadas/212.html
213,Cervejas Tradicionais,"R$ 5,79",330ml,BR,Desconocido,unknown,cerveza,sin_categoria,cerveza,True,0.9991528447304892,5.79,5.79,1.0628,1.0628,False,original,5.448,from_brasil_cambio_dolar,EN,discard,keep_imputed,no_category_detected,dataset/txt_limpios/213.txt,dataset/paginas_descargadas/213.html
214,Cervejas Tradicionais,"R$ 5,69",330ml,BR,Desconocido,unknown,cerveza,sin_categoria,cerveza,True,0.999151220393335,5.69,5.69,1.0444,1.0444,False,original,5.448,from_brasil_cambio_dolar,EN,discard,keep_imputed,no_category_detected,dataset/txt_limpios/214.txt,dataset/paginas_descargadas/214.html
1349,CERVEZA AMSTEL LATA 355 ML,Comparar,355 ML,US,Desconocido,unknown,cerveza,cerveza,,False,0.0,1.2,1.2,1.2,1.2,False,original,1.0,default_1usd,EN,keep,keep,heuristic_default,dataset/txt_limpios/1349.txt,dataset/paginas_descargadas/1349.html
1345,CERVEZA BIELA RESERVA LATA 355 ML,Comparar,355 ML,US,Desconocido,unknown,cerveza,cerveza,,False,0.0,1.0,1.0,1.0,1.0,False,original,1.0,default_1usd,EN,keep,keep,heuristic_default,dataset/txt_limpios/1345.txt,dataset/paginas_descargadas/1345.html
1347,CERVEZA CLUB PLATINO 330 ML,CLUB,330 ML,US,Desconocido,unknown,cerveza,cerveza,,False,0.0,1.45,1.45,1.45,1.45,False,original,1.0,default_1usd,ET,keep,keep,heuristic_default,dataset/txt_limpios/1347.txt,dataset/paginas_descargadas/1347.html
1346,CERVEZA CORONITA EXTRA 210 ML,Comparar,210 ML,US,Desconocido,unknown,cerveza,cerveza,,False,0.0,1.18,1.18,1.18,1.18,False,original,1.0,default_1usd,EN,keep,keep,heuristic_default,dataset/txt_limpios/1346.txt,dataset/paginas_descargadas/1346.html
917,Cerveza extra botella,330 ml,330 ml,UNKNOWN,Desconocido,unknown,cerveza,cerveza,,False,0.0,1.05,1.05,1.05,1.05,False,original,1.0,default_1usd,EN,keep,keep,heuristic_default,dataset/txt_limpios/917.txt,dataset/paginas_descargadas/917.html
1348,CERVEZA PILSENER LATA 355 ML,Comparar,355 ML,US,Desconocido,unknown,cerveza,cerveza,,False,0.0,0.99,0.99,0.99,0.99,False,original,1.0,default_1usd,EN,keep,keep,heuristic_default,dataset/txt_limpios/1348.txt,dataset/paginas_descargadas/1348.html
918,"Cervezas, vinos y licores",Cervezas,473 ml,UNKNOWN,Desconocido,unknown,cerveza,sin_categoria,cerveza,True,0.9999952500594348,1.18,1.18,1.18,1.18,False,original,1.0,default_1usd,EN,discard,keep_imputed,no_category_detected,dataset/txt_limpios/918.txt,dataset/paginas_descargadas/918.html
920,"Cervezas, vinos y licores",Cervezas,330 ml,UNKNOWN,Desconocido,unknown,cerveza,cerveza,,False,0.0,990.0,990.0,990.0,990.0,False,original,1.0,default_1usd,EN,keep,keep,heuristic_default,dataset/txt_limpios/920.txt,dataset/paginas_descargadas/920.html
1359,COLA COCA COLA 2 L ORIGINAL,Comparar,2 L,US,Desconocido,unknown,cerveza,sin_categoria,cerveza,True,1.0,1.86,1.86,1.86,1.86,False,original,1.0,default_1usd,ET,discard,keep_imputed,no_category_detected,dataset/txt_limpios/1359.txt,dataset/paginas_descargadas/1359.html
1356,COLA FANTA 500 ML NARANJA,Comparar,500 ML,US,Desconocido,unknown,cerveza,sin_categoria,cerveza,True,1.0,0.49,0.49,0.49,0.49,False,original,1.0,default_1usd,EN,discard,keep_imputed,no_category_detected,dataset/txt_limpios/1356.txt,dataset/paginas_descargadas/1356.html
1358,COLA INCA KOLA 2 L,Comparar,2 L,US,Desconocido,unknown,cerveza,sin_categoria,cerveza,True,1.0,1.18,1.18,1.18,1.18,False,original,1.0,default_1usd,EN,discard,keep_imputed,no_category_detected,dataset/txt_limpios/1358.txt,dataset/paginas_descargadas/1358.html
1355,COLA ORANGINE 3000 ML MANZANA,Comparar,3000 ML,US,Desconocido,unknown,cerveza,sin_categoria,cerveza,True,1.0,1.55,1.55,1.55,1.55,False,original,1.0,default_1usd,ET,discard,keep_imputed,no_category_detected,dataset/txt_limpios/1355.txt,dataset/paginas_descargadas/1355.html
1357,COLA SPRITE 1.35 L,Comparar,1.35 L,US,Desconocido,unknown,cerveza,sin_categoria,cerveza,True,1.0,1.09,1.09,1.09,1.09,False,original,1.0,default_1usd,ET,discard,keep_imputed,no_category_detected,dataset/txt_limpios/1357.txt,dataset/paginas_descargadas/1357.html
1004,colaborar con nuestros estudios para marketing. También puede configurarlas.,que podemos ofrecer.,5Kg,PE,Desconocido,unknown,aceite vegetal,sin_categoria,aceite vegetal,True,1.0,16.92,16.92,4.7662,4.7662,False,original,3.55,from_peru_cambio_dolar,ET,discard,keep_imputed,no_category_detected,dataset/txt_limpios/1004.txt,dataset/paginas_descargadas/1004.html
1005,colaborar con nuestros estudios para marketing. También puede configurarlas.,que podemos ofrecer.,5Kg,PE,Desconocido,unknown,aceite vegetal,aceite vegetal,,False,0.0,16.92,16.92,4.7662,4.7662,False,original,3.55,from_peru_cambio_dolar,ET,keep,keep,heuristic_default,dataset/txt_limpios/1005.txt,dataset/paginas_descargadas/1005.html
1006,colaborar con nuestros estudios para marketing. También puede configurarlas.,que podemos ofrecer.,5Kg,PE,Desconocido,unknown,aceite vegetal,sin_categoria,aceite vegetal,True,1.0,16.92,16.92,4.7662,4.7662,False,original,3.55,from_peru_cambio_dolar,ET,discard,keep_imputed,no_category_detected,dataset/txt_limpios/1006.txt,dataset/paginas_descargadas/1006.html
1007,colaborar con nuestros estudios para marketing. También puede configurarlas.,que podemos ofrecer.,5Kg,PE,Desconocido,unknown,aceite vegetal,sin_categoria,aceite vegetal,True,1.0,16.92,16.92,4.7662,4.7662,False,original,3.55,from_peru_cambio_dolar,ET,discard,keep_imputed,no_category_detected,dataset/txt_limpios/1007.txt,dataset/paginas_descargadas/1007.html
1008,colaborar con nuestros estudios para marketing. También puede configurarlas.,que podemos ofrecer.,5kg,PE,Desconocido,unknown,aceite vegetal,sin_categoria,aceite vegetal,True,1.0,16.92,16.92,4.7662,4.7662,False,original,3.55,from_peru_cambio_dolar,ET,discard,keep_imputed,no_category_detected,dataset/txt_limpios/1008.txt,dataset/paginas_descargadas/1008.html
1009,colaborar con nuestros estudios para marketing. También puede configurarlas.,que podemos ofrecer.,780g,PE,Desconocido,unknown,huevo,sin_categoria,huevo,True,0.9810623573819368,16.92,16.92,4.7662,4.7662,False,original,3.55,from_peru_cambio_dolar,ET,discard,keep_imputed,no_category_detected,dataset/txt_limpios/1009.txt,dataset/paginas_descargadas/1009.html
1010,colaborar con nuestros estudios para marketing. También puede configurarlas.,que podemos ofrecer.,1Kg,PE,Desconocido,unknown,huevo,sin_categoria,huevo,True,0.6133363322851544,16.92,16.92,4.7662,4.7662,False,original,3.55,from_peru_cambio_dolar,ET,discard,keep_imputed,no_category_detected,dataset/txt_limpios/1010.txt,dataset/paginas_descargadas/1010.html
1013,colaborar con nuestros estudios para marketing. También puede configurarlas.,que podemos ofrecer.,1Kg,PE,Desconocido,unknown,huevo,sin_categoria,huevo,True,0.9990886245518596,42.87,42.87,12.0761,12.0761,False,original,3.55,from_peru_cambio_dolar,ET,discard,keep_imputed,no_category_detected,dataset/txt_limpios/1013.txt,dataset/paginas_descargadas/1013.html
1014,colaborar con nuestros estudios para marketing. También puede configurarlas.,que podemos ofrecer.,200g,PE,Desconocido,unknown,huevo,sin_categoria,huevo,True,0.9983596034351924,16.92,16.92,4.7662,4.7662,False,original,3.55,from_peru_cambio_dolar,ET,discard,keep_imputed,no_category_detected,dataset/txt_limpios/1014.txt,dataset/paginas_descargadas/1014.html
1016,colaborar con nuestros estudios para marketing. También puede configurarlas.,que podemos ofrecer.,170g,PE,Desconocido,unknown,huevo,sin_categoria,huevo,True,0.9999999998141924,16.92,16.92,4.7662,4.7662,False,original,3.55,from_peru_cambio_dolar,ET,discard,keep_imputed,no_category_detected,dataset/txt_limpios/1016.txt,dataset/paginas_descargadas/1016.html
1019,colaborar con nuestros estudios para marketing. También puede configurarlas.,que podemos ofrecer.,900ml,PE,Desconocido,unknown,aceite vegetal,sin_categoria,aceite vegetal,True,0.9999806492362288,16.92,16.92,4.7662,4.7662,False,original,3.55,from_peru_cambio_dolar,ET,discard,keep_imputed,no_category_detected,dataset/txt_limpios/1019.txt,dataset/paginas_descargadas/1019.html
1020,colaborar con nuestros estudios para marketing. También puede configurarlas.,que podemos ofrecer.,1L,PE,Desconocido,unknown,aceite vegetal,sin_categoria,aceite vegetal,True,0.9106306728535012,16.92,16.92,4.7662,4.7662,False,original,3.55,from_peru_cambio_dolar,ET,discard,keep_imputed,no_category_detected,dataset/txt_limpios/1020.txt,dataset/paginas_descargadas/1020.html
1021,colaborar con nuestros estudios para marketing. También puede configurarlas.,que podemos ofrecer.,900ml,PE,Desconocido,unknown,aceite vegetal,sin_categoria,aceite vegetal,True,0.9999806492362288,16.92,16.92,4.7662,4.7662,False,original,3.55,from_peru_cambio_dolar,ET,discard,keep_imputed,no_category_detected,dataset/txt_limpios/1021.txt,dataset/paginas_descargadas/1021.html
1025,colaborar con nuestros estudios para marketing. También puede configurarlas.,que podemos ofrecer.,900ml,PE,Desconocido,unknown,huevo,sin_categoria,huevo,True,0.9999999999999856,16.92,16.92,4.7662,4.7662,False,original,3.55,from_peru_cambio_dolar,ET,discard,keep_imputed,no_category_detected,dataset/txt_limpios/1025.txt,dataset/paginas_descargadas/1025.html
1026,colaborar con nuestros estudios para marketing. También puede configurarlas.,que podemos ofrecer.,800ml,PE,Desconocido,unknown,huevo,sin_categoria,huevo,True,1.0,16.92,16.92,4.7662,4.7662,False,original,3.55,from_peru_cambio_dolar,ET,discard,keep_imputed,no_category_detected,dataset/txt_limpios/1026.txt,dataset/paginas_descargadas/1026.html
1028,colaborar con nuestros estudios para marketing. También puede configurarlas.,que podemos ofrecer.,1L,PE,Desconocido,unknown,leche,sin_categoria,leche,True,0.9999003677400232,16.92,16.92,4.7662,4.7662,False,original,3.55,from_peru_cambio_dolar,ET,discard,keep_imputed,no_category_detected,dataset/txt_limpios/1028.txt,dataset/paginas_descargadas/1028.html
1031,colaborar con nuestros estudios para marketing. También puede configurarlas.,que podemos ofrecer.,1Kg,PE,Desconocido,unknown,huevo,sin_categoria,huevo,True,0.999999989600628,16.92,16.92,4.7662,4.7662,False,original,3.55,from_peru_cambio_dolar,ET,discard,keep_imputed,no_category_detected,dataset/txt_limpios/1031.txt,dataset/paginas_descargadas/1031.html
1033,colaborar con nuestros estudios para marketing. También puede configurarlas.,que podemos ofrecer.,5Kg,PE,Desconocido,unknown,huevo,sin_categoria,huevo,True,0.7155141463182442,16.92,16.92,4.7662,4.7662,False,original,3.55,from_peru_cambio_dolar,ET,discard,keep_imputed,no_category_detected,dataset/txt_limpios/1033.txt,dataset/paginas_descargadas/1033.html
1035,colaborar con nuestros estudios para marketing. También puede configurarlas.,que podemos ofrecer.,1Kg,PE,Desconocido,unknown,azucar,sin_categoria,azucar,True,0.9999999378042786,16.92,16.92,4.7662,4.7662,False,original,3.55,from_peru_cambio_dolar,ET,discard,keep_imputed,no_category_detected,dataset/txt_limpios/1035.txt,dataset/paginas_descargadas/1035.html
1037,colaborar con nuestros estudios para marketing. También puede configurarlas.,que podemos ofrecer.,5Kg,PE,Desconocido,unknown,huevo,sin_categoria,huevo,True,0.9999995586417132,16.92,16.92,4.7662,4.7662,False,original,3.55,from_peru_cambio_dolar,ET,discard,keep_imputed,no_category_detected,dataset/txt_limpios/1037.txt,dataset/paginas_descargadas/1037.html
1039,colaborar con nuestros estudios para marketing. También puede configurarlas.,que podemos ofrecer.,500g,PE,Desconocido,unknown,pan,sin_categoria,pan,True,1.0,16.92,16.92,4.7662,4.7662,False,original,3.55,from_peru_cambio_dolar,ET,discard,keep_imputed,no_category_detected,dataset/txt_limpios/1039.txt,dataset/paginas_descargadas/1039.html
1040,colaborar con nuestros estudios para marketing. También puede configurarlas.,que podemos ofrecer.,540g,PE,Desconocido,unknown,pan,sin_categoria,pan,True,1.0,16.92,16.92,4.7662,4.7662,False,original,3.55,from_peru_cambio_dolar,ET,discard,keep_imputed,no_category_detected,dataset/txt_limpios/1040.txt,dataset/paginas_descargadas/1040.html
1041,colaborar con nuestros estudios para marketing. También puede configurarlas.,que podemos ofrecer.,560g,PE,Desconocido,unknown,pan,sin_categoria,pan,True,1.0,16.92,16.92,4.7662,4.7662,False,original,3.55,from_peru_cambio_dolar,ET,discard,keep_imputed,no_category_detected,dataset/txt_limpios/1041.txt,dataset/paginas_descargadas/1041.html
1042,colaborar con nuestros estudios para marketing. También puede configurarlas.,que podemos ofrecer.,600g,PE,Desconocido,unknown,pan,pan,,False,0.0,16.92,16.92,4.7662,4.7662,False,original,3.55,from_peru_cambio_dolar,ET,keep,keep,heuristic_default,dataset/txt_limpios/1042.txt,dataset/paginas_descargadas/1042.html
1043,colaborar con nuestros estudios para marketing. También puede configurarlas.,que podemos ofrecer.,950g,PE,Desconocido,unknown,huevo,sin_categoria,huevo,True,0.9999999917172196,16.92,16.92,4.7662,4.7662,False,original,3.55,from_peru_cambio_dolar,ET,discard,keep_imputed,no_category_detected,dataset/txt_limpios/1043.txt,dataset/paginas_descargadas/1043.html
1045,colaborar con nuestros estudios para marketing. También puede configurarlas.,que podemos ofrecer.,900g,PE,Desconocido,unknown,huevo,sin_categoria,huevo,True,0.8369543766674229,16.92,16.92,4.7662,4.7662,False,original,3.55,from_peru_cambio_dolar,ET,discard,keep_imputed,no_category_detected,dataset/txt_limpios/1045.txt,dataset/paginas_descargadas/1045.html
1046,colaborar con nuestros estudios para marketing. También puede configurarlas.,que podemos ofrecer.,500g,PE,Desconocido,unknown,huevo,sin_categoria,huevo,True,0.9901852015791582,16.92,16.92,4.7662,4.7662,False,original,3.55,from_peru_cambio_dolar,ET,discard,keep_imputed,no_category_detected,dataset/txt_limpios/1046.txt,dataset/paginas_descargadas/1046.html
1048,colaborar con nuestros estudios para marketing. También puede configurarlas.,que podemos ofrecer.,140g,PE,Desconocido,unknown,atun,atun,,False,0.0,16.92,16.92,4.7662,4.7662,False,original,3.55,from_peru_cambio_dolar,ET,keep,keep,heuristic_default,dataset/txt_limpios/1048.txt,dataset/paginas_descargadas/1048.html
1049,colaborar con nuestros estudios para marketing. También puede configurarlas.,que podemos ofrecer.,150g,PE,Desconocido,unknown,atun,sin_categoria,atun,True,0.9990984867523612,16.92,16.92,4.7662,4.7662,False,original,3.55,from_peru_cambio_dolar,ET,discard,keep_imputed,no_category_detected,dataset/txt_limpios/1049.txt,dataset/paginas_descargadas/1049.html
