source_id,product_name,brand,unit,country,seller,availability,category_effective,category_canonical,category_canonical_imputed,category_is_imputed,category_model_confidence,price_amount,price_amount_filled,price_amount_usd,price_amount_usd_filled,price_is_imputed,price_imputation_source,fx_rate_local_per_usd,fx_source,es_status,decision,decision_imputed,reasons,txt_path,html_path
230,Meu Desconto,Minha Lista,1kg,BR,Desconocido,unknown,pan,sin_categoria,pan,True,0.9994735561310936,7.69,7.69,1.4115,1.4115,False,original,5.448,from_brasil_cambio_dolar,EN,discard,keep_imputed,no_category_detected,dataset/txt_limpios/230.txt,dataset/paginas_descargadas/230.html
231,Meu Desconto,Minha Lista,1kg,BR,Desconocido,unknown,pan,sin_categoria,pan,True,0.9994735561310936,6.59,6.59,1.2096,1.2096,False,original,5.448,from_brasil_cambio_dolar,EN,discard,keep_imputed,no_category_detected,dataset/txt_limpios/231.txt,dataset/paginas_descargadas/231.html
232,Meu Desconto,Minha Lista,5kg,BR,Desconocido,unknown,pan,sin_categoria,pan,True,0.9999080149142808,20.99,20.99,3.8528,3.8528,False,original,5.448,from_brasil_cambio_dolar,EN,discard,keep_imputed,no_category_detected,dataset/txt_limpios/232.txt,dataset/paginas_descargadas/232.html
233,Meu Desconto,Minha Lista,1kg,BR,Desconocido,unknown,pan,sin_categoria,pan,True,0.9994735561310936,18.99,18.99,3.4857,3.4857,False,original,5.448,from_brasil_cambio_dolar,EN,discard,keep_imputed,no_category_detected,dataset/txt_limpios/233.txt,dataset/paginas_descargadas/233.html
234,Meu Desconto,Minha Lista,5kg,UNKNOWN,Desconocido,unknown,pan,sin_categoria,pan,True,0.9999080149142808,1.0,1.0,1.0,1.0,False,original,1.0,default_1usd,EN,discard,keep_imputed,no_category_detected,dataset/txt_limpios/234.txt,dataset/paginas_descargadas/234.html
235,Meu Desconto,Minha Lista,500g,BR,Desconocido,unknown,pan,sin_categoria,pan,True,0.9998916682212332,34.99,34.99,6.4225,6.4225,False,original,5.448,from_brasil_cambio_dolar,EN,discard,keep_imputed,no_category_detected,dataset/txt_limpios/235.txt,dataset/paginas_descargadas/235.html
236,Meu Desconto,Minha Lista,500g,BR,Desconocido,unknown,pan,sin_categoria,pan,True,0.9998916682212332,41.49,41.49,7.6156,7.6156,False,original,5.448,from_brasil_cambio_dolar,EN,discard,keep_imputed,no_category_detected,dataset/txt_limpios/236.txt,dataset/paginas_descargadas/236.html
237,Meu Desconto,Minha Lista,500g,BR,Desconocido,unknown,pan,sin_categoria,pan,True,0.9998916682212332,46.49,46.49,8.5334,8.5334,False,original,5.448,from_brasil_cambio_dolar,EN,discard,keep_imputed,no_category_detected,dataset/txt_limpios/237.txt,dataset/paginas_descargadas/237.html
238,Meu Desconto,Minha Lista,500g,BR,Desconocido,unknown,pan,sin_categoria,pan,True,0.9998916682212332,38.99,38.99,7.1568,7.1568,False,original,5.448,from_brasil_cambio_dolar,EN,discard,keep_imputed,no_category_detected,dataset/txt_limpios/238.txt,dataset/paginas_descargadas/238.html
239,Meu Desconto,Minha Lista,250g,BR,Desconocido,unknown,pan,sin_categoria,pan,True,0.9998649321047188,26.99,26.99,4.9541,4.9541,False,original,5.448,from_brasil_cambio_dolar,EN,discard,keep_imputed,no_category_detected,dataset/txt_limpios/239.txt,dataset/paginas_descargadas/239.html
240,Meu Desconto,Minha Lista,480g,BR,Desconocido,unknown,pan,sin_categoria,pan,True,0.9998652070827072,10.29,10.29,1.8888,1.8888,False,original,5.448,from_brasil_cambio_dolar,EN,discard,keep_imputed,no_category_detected,dataset/txt_limpios/240.txt,dataset/paginas_descargadas/240.html
241,Meu Desconto,Minha Lista,500g,BR,Desconocido,unknown,pan,sin_categoria,pan,True,0.9998916682212332,11.49,11.49,2.109,2.109,False,original,5.448,from_brasil_cambio_dolar,EN,discard,keep_imputed,no_category_detected,dataset/txt_limpios/241.txt,dataset/paginas_descargadas/241.html
242,Meu Desconto,Minha Lista,450g,BR,Desconocido,unknown,pan,sin_categoria,pan,True,0.9999791839646728,7.19,7.19,1.3198,1.3198,False,original,5.448,from_brasil_cambio_dolar,EN,discard,keep_imputed,no_category_detected,dataset/txt_limpios/242.txt,dataset/paginas_descargadas/242.html
243,Meu Desconto,Minha Lista,500g,BR,Desconocido,unknown,pan,sin_categoria,pan,True,0.9998916682212332,15.29,15.29,2.8065,2.8065,False,original,5.448,from_brasil_cambio_dolar,EN,discard,keep_imputed,no_category_detected,dataset/txt_limpios/243.txt,dataset/paginas_descargadas/243.html
244,Meu Desconto,Minha Lista,400g,UNKNOWN,Desconocido,unknown,pan,sin_categoria,pan,True,0.9999324749434788,400.0,400.0,400.0,400.0,False,original,1.0,default_1usd,EN,discard,keep_imputed,no_category_detected,dataset/txt_limpios/244.txt,dataset/paginas_descargadas/244.html
245,Meu Desconto,Minha Lista,"1,5l",BR,Desconocido,unknown,pan,sin_categoria,pan,True,0.9999316829052528,8.49,8.49,1.5584,1.5584,False,original,5.448,from_brasil_cambio_dolar,EN,discard,keep_imputed,no_category_detected,dataset/txt_limpios/245.txt,dataset/paginas_descargadas/245.html
246,Meu Desconto,Minha Lista,600ml,BR,Desconocido,unknown,pan,sin_categoria,pan,True,0.9998333887398796,5.39,5.39,0.9894,0.9894,False,original,5.448,from_brasil_cambio_dolar,EN,discard,keep_imputed,no_category_detected,dataset/txt_limpios/246.txt,dataset/paginas_descargadas/246.html
247,Meu Desconto,Minha Lista,"1,5l",BR,Desconocido,unknown,pan,sin_categoria,pan,True,0.9999316829052528,8.99,8.99,1.6501,1.6501,False,original,5.448,from_brasil_cambio_dolar,EN,discard,keep_imputed,no_category_detected,dataset/txt_limpios/247.txt,dataset/paginas_descargadas/247.html
248,Meu Desconto,Minha Lista,"1,5l",BR,Desconocido,unknown,pan,sin_categoria,pan,True,0.9999316829052528,8.99,8.99,1.6501,1.6501,False,original,5.448,from_brasil_cambio_dolar,EN,discard,keep_imputed,no_category_detected,dataset/txt_limpios/248.txt,dataset/paginas_descargadas/248.html
249,Meu Desconto,Minha Lista,"1,5l",BR,Desconocido,unknown,pan,sin_categoria,pan,True,0.9999316829052528,7.29,7.29,1.3381,1.3381,False,original,5.448,from_brasil_cambio_dolar,EN,discard,keep_imputed,no_category_detected,dataset/txt_limpios/249.txt,dataset/paginas_descargadas/249.html
250,Meu Desconto,Minha Lista,500g,BR,Desconocido,unknown,pan,sin_categoria,pan,True,0.9998916682212332,5.19,5.19,0.9526,0.9526,False,original,5.448,from_brasil_cambio_dolar,EN,discard,keep_imputed,no_category_detected,dataset/txt_limpios/250.txt,dataset/paginas_descargadas/250.html
251,Meu Desconto,Minha Lista,500g,BR,Desconocido,unknown,pan,sin_categoria,pan,True,0.9998916682212332,5.19,5.19,0.9526,0.9526,False,original,5.448,from_brasil_cambio_dolar,EN,discard,keep_imputed,no_category_detected,dataset/txt_limpios/251.txt,dataset/paginas_descargadas/251.html
252,Meu Desconto,Minha Lista,500g,BR,Desconocido,unknown,pan,sin_categoria,pan,True,0.9998916682212332,4.49,4.49,0.8242,0.8242,False,original,5.448,from_brasil_cambio_dolar,EN,discard,keep_imputed,no_category_detected,dataset/txt_limpios/252.txt,dataset/paginas_descargadas/252.html
253,Meu Desconto,Minha Lista,500g,BR,Desconocido,unknown,pan,sin_categoria,pan,True,0.9998916682212332,4.49,4.49,0.8242,0.8242,False,original,5.448,from_brasil_cambio_dolar,EN,discard,keep_imputed,no_category_detected,dataset/txt_limpios/253.txt,dataset/paginas_descargadas/253.html
254,Meu Desconto,Minha Lista,500g,BR,Desconocido,unknown,pan,sin_categoria,pan,True,0.9998916682212332,4.99,4.99,0.9159,0.9159,False,original,5.448,from_brasil_cambio_dolar,EN,discard,keep_imputed,no_category_detected,dataset/txt_limpios/254.txt,dataset/paginas_descargadas/254.html
255,Meu Desconto,Minha Lista,1 Litro,UNKNOWN,Desconocido,unknown,pan,sin_categoria,pan,True,0.9999258429125654,1.0,1.0,1.0,1.0,False,original,1.0,default_1usd,EN,discard,keep_imputed,no_category_detected,dataset/txt_limpios/255.txt,dataset/paginas_descargadas/255.html
256,Meu Desconto,Minha Lista,1L,BR,Desconocido,unknown,pan,sin_categoria,pan,True,0.999908915382599,8.39,8.39,1.54,1.54,False,original,5.448,from_brasil_cambio_dolar,EN,discard,keep_imputed,no_category_detected,dataset/txt_limpios/256.txt,dataset/paginas_descargadas/256.html
257,Meu Desconto,Minha Lista,1 Litro,BR,Desconocido,unknown,pan,sin_categoria,pan,True,0.9999258429125654,6.19,6.19,1.1362,1.1362,False,original,5.448,from_brasil_cambio_dolar,EN,discard,keep_imputed,no_category_detected,dataset/txt_limpios/257.txt,dataset/paginas_descargadas/257.html
258,Meu Desconto,Minha Lista,1L,BR,Desconocido,unknown,pan,sin_categoria,pan,True,0.999908915382599,8.39,8.39,1.54,1.54,False,original,5.448,from_brasil_cambio_dolar,EN,discard,keep_imputed,no_category_detected,dataset/txt_limpios/258.txt,dataset/paginas_descargadas/258.html
259,Meu Desconto,Minha Lista,1 Litro,BR,Desconocido,unknown,pan,sin_categoria,pan,True,0.9999258429125654,6.29,6.29,1.1546,1.1546,False,original,5.448,from_brasil_cambio_dolar,EN,discard,keep_imputed,no_category_detected,dataset/txt_limpios/259.txt,dataset/paginas_descargadas/259.html
260,Meu Desconto,Minha Lista,350ml,BR,Desconocido,unknown,pan,sin_categoria,pan,True,0.9998652076966724,5.59,5.59,1.0261,1.0261,False,original,5.448,from_brasil_cambio_dolar,EN,discard,keep_imputed,no_category_detected,dataset/txt_limpios/260.txt,dataset/paginas_descargadas/260.html
261,Meu Desconto,Minha Lista,330ml,BR,Desconocido,unknown,pan,sin_categoria,pan,True,0.9999986605102928,4.99,4.99,0.9159,0.9159,False,original,5.448,from_brasil_cambio_dolar,ET,discard,keep_imputed,no_category_detected,dataset/txt_limpios/261.txt,dataset/paginas_descargadas/261.html
262,Meu Desconto,Minha Lista,269ml,BR,Desconocido,unknown,pan,sin_categoria,pan,True,0.9998652076966724,3.39,3.39,0.6222,0.6222,False,original,5.448,from_brasil_cambio_dolar,EN,discard,keep_imputed,no_category_detected,dataset/txt_limpios/262.txt,dataset/paginas_descargadas/262.html
263,Meu Desconto,Minha Lista,,UNKNOWN,Desconocido,unknown,pan,sin_categoria,pan,True,0.9999186443263056,18.0,18.0,18.0,18.0,False,original,1.0,default_1usd,EN,discard,keep_imputed,no_category_detected,dataset/txt_limpios/263.txt,dataset/paginas_descargadas/263.html
264,Meu Desconto,Minha Lista,350ml,BR,Desconocido,unknown,pan,sin_categoria,pan,True,0.9998652076966724,5.19,5.19,0.9526,0.9526,False,original,5.448,from_brasil_cambio_dolar,EN,discard,keep_imputed,no_category_detected,dataset/txt_limpios/264.txt,dataset/paginas_descargadas/264.html
265,Meu Desconto,Minha Lista,,UNKNOWN,Desconocido,unknown,pan,sin_categoria,pan,True,0.9999186443263056,18.0,18.0,18.0,18.0,False,original,1.0,default_1usd,EN,discard,keep_imputed,no_category_detected,dataset/txt_limpios/265.txt,dataset/paginas_descargadas/265.html
266,Meu Desconto,Minha Lista,800g,BR,Desconocido,unknown,pan,sin_categoria,pan,True,0.9996644062023736,15.9,15.9,2.9185,2.9185,False,original,5.448,from_brasil_cambio_dolar,EN,discard,keep_imputed,no_category_detected,dataset/txt_limpios/266.txt,dataset/paginas_descargadas/266.html
267,Meu Desconto,Minha Lista,"2,2Kg",BR,Desconocido,unknown,pan,sin_categoria,pan,True,0.9997300820412462,28.99,28.99,5.3212,5.3212,False,original,5.448,from_brasil_cambio_dolar,EN,discard,keep_imputed,no_category_detected,dataset/txt_limpios/267.txt,dataset/paginas_descargadas/267.html
268,Meu Desconto,Minha Lista,700g,BR,Desconocido,unknown,pan,sin_categoria,pan,True,0.9997304492711784,33.99,33.99,6.239,6.239,False,original,5.448,from_brasil_cambio_dolar,EN,discard,keep_imputed,no_category_detected,dataset/txt_limpios/268.txt,dataset/paginas_descargadas/268.html
270,Meu Desconto,Minha Lista,1kg,BR,Desconocido,unknown,pan,sin_categoria,pan,True,0.9994735561310936,5.49,5.49,1.0077,1.0077,False,original,5.448,from_brasil_cambio_dolar,EN,discard,keep_imputed,no_category_detected,dataset/txt_limpios/270.txt,dataset/paginas_descargadas/270.html
271,Meu Desconto,Minha Lista,1kg,BR,Desconocido,unknown,pan,sin_categoria,pan,True,0.9994735561310936,4.29,4.29,0.7874,0.7874,False,original,5.448,from_brasil_cambio_dolar,EN,discard,keep_imputed,no_category_detected,dataset/txt_limpios/271.txt,dataset/paginas_descargadas/271.html
272,Meu Desconto,Minha Lista,1kg,BR,Desconocido,unknown,pan,sin_categoria,pan,True,0.9994735561310936,4.99,4.99,0.9159,0.9159,False,original,5.448,from_brasil_cambio_dolar,EN,discard,keep_imputed,no_category_detected,dataset/txt_limpios/272.txt,dataset/paginas_descargadas/272.html
273,Meu Desconto,Minha Lista,1kg,BR,Desconocido,unknown,pan,sin_categoria,pan,True,0.9994735561310936,9.19,9.19,1.6869,1.6869,False,original,5.448,from_brasil_cambio_dolar,EN,discard,keep_imputed,no_category_detected,dataset/txt_limpios/273.txt,dataset/paginas_descargadas/273.html
274,Meu Desconto,Minha Lista,1kg,BR,Desconocido,unknown,pan,sin_categoria,pan,True,0.9994735561310936,7.99,7.99,1.4666,1.4666,False,original,5.448,from_brasil_cambio_dolar,EN,discard,keep_imputed,no_category_detected,dataset/txt_limpios/274.txt,dataset/paginas_descargadas/274.html
275,Meu Desconto,Minha Lista,500g,BR,Desconocido,unknown,pan,sin_categoria,pan,True,0.9998916682212332,10.29,10.29,1.8888,1.8888,False,original,5.448,from_brasil_cambio_dolar,EN,discard,keep_imputed,no_category_detected,dataset/txt_limpios/275.txt,dataset/paginas_descargadas/275.html
276,Meu Desconto,Minha Lista,500g,BR,Desconocido,unknown,pan,sin_categoria,pan,True,0.9998916682212332,7.99,7.99,1.4666,1.4666,False,original,5.448,from_brasil_cambio_dolar,EN,discard,keep_imputed,no_category_detected,dataset/txt_limpios/276.txt,dataset/paginas_descargadas/276.html
277,Meu Desconto,Minha Lista,1kg,BR,Desconocido,unknown,pan,sin_categoria,pan,True,0.9994735561310936,9.19,9.19,1.6869,1.6869,False,original,5.448,from_brasil_cambio_dolar,EN,discard,keep_imputed,no_category_detected,dataset/txt_limpios/277.txt,dataset/paginas_descargadas/277.html
278,Meu Desconto,Minha Lista,1kg,BR,Desconocido,unknown,pan,sin_categoria,pan,True,0.9994735561310936,8.39,8.39,1.54,1.54,False,original,5.448,from_brasil_cambio_dolar,EN,discard,keep_imputed,no_category_detected,dataset/txt_limpios/278.txt,dataset/paginas_descargadas/278.html
279,Meu Desconto,Minha Lista,250g,BR,Desconocido,unknown,pan,sin_categoria,pan,True,0.9998649321047188,12.29,12.29,2.2559,2.2559,False,original,5.448,from_brasil_cambio_dolar,EN,discard,keep_imputed,no_category_detected,dataset/txt_limpios/279.txt,dataset/paginas_descargadas/279.html
373,Meu Desconto,Minha Lista,5kg,UNKNOWN,Desconocido,unknown,pan,sin_categoria,pan,True,0.9999080149142808,1.0,1.0,1.0,1.0,False,original,1.0,default_1usd,EN,discard,keep_imputed,no_category_detected,dataset/txt_limpios/373.txt,dataset/paginas_descargadas/373.html
374,Meu Desconto,Minha Lista,1kg,BR,Desconocido,unknown,pan,sin_categoria,pan,True,0.9994735561310936,5.09,5.09,0.9343,0.9343,False,original,5.448,from_brasil_cambio_dolar,EN,discard,keep_imputed,no_category_detected,dataset/txt_limpios/374.txt,dataset/paginas_descargadas/374.html
375,Meu Desconto,Minha Lista,1kg,BR,Desconocido,unknown,pan,sin_categoria,pan,True,0.9994735561310936,7.29,7.29,1.3381,1.3381,False,original,5.448,from_brasil_cambio_dolar,EN,discard,keep_imputed,no_category_detected,dataset/txt_limpios/375.txt,dataset/paginas_descargadas/375.html
376,Meu Desconto,Minha Lista,5kg,BR,Desconocido,unknown,pan,sin_categoria,pan,True,0.9999080149142808,17.99,17.99,3.3021,3.3021,False,original,5.448,from_brasil_cambio_dolar,EN,discard,keep_imputed,no_category_detected,dataset/txt_limpios/376.txt,dataset/paginas_descargadas/376.html
377,Meu Desconto,Minha Lista,5kg,BR,Desconocido,unknown,pan,sin_categoria,pan,True,0.9999080149142808,28.99,28.99,5.3212,5.3212,False,original,5.448,from_brasil_cambio_dolar,EN,discard,keep_imputed,no_category_detected,dataset/txt_limpios/377.txt,dataset/paginas_descargadas/377.html
378,Meu Desconto,Minha Lista,500g,BR,Desconocido,unknown,pan,sin_categoria,pan,True,0.9998916682212332,31.99,31.99,5.8719,5.8719,False,original,5.448,from_brasil_cambio_dolar,EN,discard,keep_imputed,no_category_detected,dataset/txt_limpios/378.txt,dataset/paginas_descargadas/378.html
379,Meu Desconto,Minha Lista,500g,BR,Desconocido,unknown,pan,sin_categoria,pan,True,0.9998916682212332,37.99,37.99,6.9732,6.9732,False,original,5.448,from_brasil_cambio_dolar,EN,discard,keep_imputed,no_category_detected,dataset/txt_limpios/379.txt,dataset/paginas_descargadas/379.html
380,Meu Desconto,Minha Lista,500g,BR,Desconocido,unknown,pan,sin_categoria,pan,True,0.9998916682212332,34.99,34.99,6.4225,6.4225,False,original,5.448,from_brasil_cambio_dolar,EN,discard,keep_imputed,no_category_detected,dataset/txt_limpios/380.txt,dataset/paginas_descargadas/380.html
381,Meu Desconto,Minha Lista,500g,BR,Desconocido,unknown,pan,sin_categoria,pan,True,0.9998916682212332,32.49,32.49,5.9637,5.9637,False,original,5.448,from_brasil_cambio_dolar,EN,discard,keep_imputed,no_category_detected,dataset/txt_limpios/381.txt,dataset/paginas_descargadas/381.html
382,Meu Desconto,Minha Lista,500g,BR,Desconocido,unknown,pan,sin_categoria,pan,True,0.9998916682212332,37.99,37.99,6.9732,6.9732,False,original,5.448,from_brasil_cambio_dolar,EN,discard,keep_imputed,no_category_detected,dataset/txt_limpios/382.txt,dataset/paginas_descargadas/382.html
383,Meu Desconto,Minha Lista,400g,UNKNOWN,Desconocido,unknown,pan,sin_categoria,pan,True,0.9999324749434788,400.0,400.0,400.0,400.0,False,original,1.0,default_1usd,EN,discard,keep_imputed,no_category_detected,dataset/txt_limpios/383.txt,dataset/paginas_descargadas/383.html
384,Meu Desconto,Minha Lista,450g,BR,Desconocido,unknown,pan,sin_categoria,pan,True,0.9999791839646728,6.99,6.99,1.283,1.283,False,original,5.448,from_brasil_cambio_dolar,EN,discard,keep_imputed,no_category_detected,dataset/txt_limpios/384.txt,dataset/paginas_descargadas/384.html
385,Meu Desconto,Minha Lista,480g,BR,Desconocido,unknown,pan,sin_categoria,pan,True,0.9998652070827072,9.99,9.99,1.8337,1.8337,False,original,5.448,from_brasil_cambio_dolar,EN,discard,keep_imputed,no_category_detected,dataset/txt_limpios/385.txt,dataset/paginas_descargadas/385.html
386,Meu Desconto,Minha Lista,480g,BR,Desconocido,unknown,pan,sin_categoria,pan,True,0.9998652070827072,9.99,9.99,1.8337,1.8337,False,original,5.448,from_brasil_cambio_dolar,EN,discard,keep_imputed,no_category_detected,dataset/txt_limpios/386.txt,dataset/paginas_descargadas/386.html
387,Meu Desconto,Minha Lista,400g,BR,Desconocido,unknown,pan,sin_categoria,pan,True,0.9999324749434788,5.99,5.99,1.0995,1.0995,False,original,5.448,from_brasil_cambio_dolar,EN,discard,keep_imputed,no_category_detected,dataset/txt_limpios/387.txt,dataset/paginas_descargadas/387.html
388,Meu Desconto,Minha Lista,350ml,BR,Desconocido,unknown,pan,sin_categoria,pan,True,0.9998652076966724,3.49,3.49,0.6406,0.6406,False,original,5.448,from_brasil_cambio_dolar,EN,discard,keep_imputed,no_category_detected,dataset/txt_limpios/388.txt,dataset/paginas_descargadas/388.html
389,Meu Desconto,Minha Lista,2l,BR,Desconocido,unknown,pan,sin_categoria,pan,True,0.9997296766929964,11.99,11.99,2.2008,2.2008,False,original,5.448,from_brasil_cambio_dolar,EN,discard,keep_imputed,no_category_detected,dataset/txt_limpios/389.txt,dataset/paginas_descargadas/389.html
390,Meu Desconto,Minha Lista,2l,BR,Desconocido,unknown,pan,sin_categoria,pan,True,0.9997296766929964,7.99,7.99,1.4666,1.4666,False,original,5.448,from_brasil_cambio_dolar,EN,discard,keep_imputed,no_category_detected,dataset/txt_limpios/390.txt,dataset/paginas_descargadas/390.html
391,Meu Desconto,Minha Lista,200ml,BR,Desconocido,unknown,pan,sin_categoria,pan,True,0.9997283542459888,1.89,1.89,0.3469,0.3469,False,original,5.448,from_brasil_cambio_dolar,EN,discard,keep_imputed,no_category_detected,dataset/txt_limpios/391.txt,dataset/paginas_descargadas/391.html
393,Meu Desconto,Minha Lista,500g,BR,Desconocido,unknown,pan,sin_categoria,pan,True,0.9998916682212332,3.89,3.89,0.714,0.714,False,original,5.448,from_brasil_cambio_dolar,EN,discard,keep_imputed,no_category_detected,dataset/txt_limpios/393.txt,dataset/paginas_descargadas/393.html
394,Meu Desconto,Minha Lista,500g,BR,Desconocido,unknown,pan,sin_categoria,pan,True,0.9998916682212332,5.59,5.59,1.0261,1.0261,False,original,5.448,from_brasil_cambio_dolar,EN,discard,keep_imputed,no_category_detected,dataset/txt_limpios/394.txt,dataset/paginas_descargadas/394.html
395,Meu Desconto,Minha Lista,500g,UNKNOWN,Desconocido,unknown,pan,sin_categoria,pan,True,0.9998916682212332,2.0,2.0,2.0,2.0,False,original,1.0,default_1usd,EN,discard,keep_imputed,no_category_detected,dataset/txt_limpios/395.txt,dataset/paginas_descargadas/395.html
396,Meu Desconto,Minha Lista,500g,BR,Desconocido,unknown,pan,sin_categoria,pan,True,0.9998916682212332,11.49,11.49,2.109,2.109,False,original,5.448,from_brasil_cambio_dolar,EN,discard,keep_imputed,no_category_detected,dataset/txt_limpios/396.txt,dataset/paginas_descargadas/396.html
397,Meu Desconto,Minha Lista,500g,BR,Desconocido,unknown,pan,sin_categoria,pan,True,0.9998916682212332,5.59,5.59,1.0261,1.0261,False,original,5.448,from_brasil_cambio_dolar,EN,discard,keep_imputed,no_category_detected,dataset/txt_limpios/397.txt,dataset/paginas_descargadas/397.html
398,Meu Desconto,Minha Lista,1l,UNKNOWN,Desconocido,unknown,pan,sin_categoria,pan,True,0.999908915382599,1.0,1.0,1.0,1.0,False,original,1.0,default_1usd,EN,discard,keep_imputed,no_category_detected,dataset/txt_limpios/398.txt,dataset/paginas_descargadas/398.html
399,Meu Desconto,Minha Lista,1 Litro,BR,Desconocido,unknown,pan,sin_categoria,pan,True,0.9999258429125654,4.69,4.69,0.8609,0.8609,False,original,5.448,from_brasil_cambio_dolar,EN,discard,keep_imputed,no_category_detected,dataset/txt_limpios/399.txt,dataset/paginas_descargadas/399.html
400,Meu Desconto,Minha Lista,1l,BR,Desconocido,unknown,pan,sin_categoria,pan,True,0.999908915382599,4.49,4.49,0.8242,0.8242,False,original,5.448,from_brasil_cambio_dolar,EN,discard,keep_imputed,no_category_detected,dataset/txt_limpios/400.txt,dataset/paginas_descargadas/400.html
