source_id,product_name,brand,unit,country,seller,availability,category_effective,category_canonical,category_canonical_imputed,category_is_imputed,category_model_confidence,price_amount,price_amount_filled,price_amount_usd,price_amount_usd_filled,price_is_imputed,price_imputation_source,fx_rate_local_per_usd,fx_source,es_status,decision,decision_imputed,reasons,txt_path,html_path
989,Verificar que usted es un ser humano. Esto podría tardar algunos segundos.,Verificación exitosa,,UNKNOWN,Desconocido,unknown,papa,sin_categoria,papa,True,0.9316618454451312,,234.19,,234.1938,True,country_mean,1.0,default_1usd,EN,discard,keep_imputed,no_category_detected;price_parse_failed,dataset/txt_limpios/989.txt,dataset/paginas_descargadas/989.html
990,Verificar que usted es un ser humano. Esto podría tardar algunos segundos.,Verificación exitosa,,UNKNOWN,Desconocido,unknown,papa,sin_categoria,papa,True,0.9316618454451312,,234.19,,234.1938,True,country_mean,1.0,default_1usd,EN,discard,keep_imputed,no_category_detected;price_parse_failed,dataset/txt_limpios/990.txt,dataset/paginas_descargadas/990.html
991,Verificar que usted es un ser humano. Esto podría tardar algunos segundos.,Verificación exitosa,,UNKNOWN,Desconocido,unknown,papa,sin_categoria,papa,True,0.9316618454451312,,234.19,,234.1938,True,country_mean,1.0,default_1usd,EN,discard,keep_imputed,no_category_detected;price_parse_failed,dataset/txt_limpios/991.txt,dataset/paginas_descargadas/991.html
992,Verificar que usted es un ser humano. Esto podría tardar algunos segundos.,Verificación exitosa,,UNKNOWN,Desconocido,unknown,papa,sin_categoria,papa,True,0.9316618454451312,,234.19,,234.1938,True,country_mean,1.0,default_1usd,EN,discard,keep_imputed,no_category_detected;price_parse_failed,dataset/txt_limpios/992.txt,dataset/paginas_descargadas/992.html
993,Verificar que usted es un ser humano. Esto podría tardar algunos segundos.,Verificación exitosa,,UNKNOWN,Desconocido,unknown,papa,sin_categoria,papa,True,0.9316618454451312,,234.19,,234.1938,True,country_mean,1.0,default_1usd,EN,discard,keep_imputed,no_category_detected;price_parse_failed,dataset/txt_limpios/993.txt,dataset/paginas_descargadas/993.html
994,Verificar que usted es un ser humano. Esto podría tardar algunos segundos.,Verificación exitosa,,UNKNOWN,Desconocido,unknown,papa,sin_categoria,papa,True,0.9316618454451312,,234.19,,234.1938,True,country_mean,1.0,default_1usd,EN,discard,keep_imputed,no_category_detected;price_parse_failed,dataset/txt_limpios/994.txt,dataset/paginas_descargadas/994.html
995,Verificar que usted es un ser humano. Esto podría tardar algunos segundos.,Verificación exitosa,,UNKNOWN,Desconocido,unknown,papa,sin_categoria,papa,True,0.9316618454451312,,234.19,,234.1938,True,country_mean,1.0,default_1usd,EN,discard,keep_imputed,no_category_detected;price_parse_failed,dataset/txt_limpios/995.txt,dataset/paginas_descargadas/995.html
996,Verificar que usted es un ser humano. Esto podría tardar algunos segundos.,Verificación exitosa,,UNKNOWN,Desconocido,unknown,papa,sin_categoria,papa,True,0.9316618454451312,,234.19,,234.1938,True,country_mean,1.0,default_1usd,EN,discard,keep_imputed,no_category_detected;price_parse_failed,dataset/txt_limpios/996.txt,dataset/paginas_descargadas/996.html
997,Verificar que usted es un ser humano. Esto podría tardar algunos segundos.,Verificación exitosa,,UNKNOWN,Desconocido,unknown,papa,sin_categoria,papa,True,0.9316618454451312,,234.19,,234.1938,True,country_mean,1.0,default_1usd,EN,discard,keep_imputed,no_category_detected;price_parse_failed,dataset/txt_limpios/997.txt,dataset/paginas_descargadas/997.html
998,Verificar que usted es un ser humano. Esto podría tardar algunos segundos.,Verificación exitosa,,UNKNOWN,Desconocido,unknown,papa,sin_categoria,papa,True,0.9316618454451312,,234.19,,234.1938,True,country_mean,1.0,default_1usd,EN,discard,keep_imputed,no_category_detected;price_parse_failed,dataset/txt_limpios/998.txt,dataset/paginas_descargadas/998.html
999,Verificar que usted es un ser humano. Esto podría tardar algunos segundos.,Verificación exitosa,,UNKNOWN,Desconocido,unknown,papa,sin_categoria,papa,True,0.9316618454451312,,234.19,,234.1938,True,country_mean,1.0,default_1usd,EN,discard,keep_imputed,no_category_detected;price_parse_failed,dataset/txt_limpios/999.txt,dataset/paginas_descargadas/999.html
1053,¡Aún no eres Wong Prime!,Aprovecha el,5 Kg,PE,Desconocido,unknown,azucar,sin_categoria,azucar,True,0.9723061878107816,79.9,79.9,22.507,22.507,False,original,3.55,from_peru_cambio_dolar,EN,discard,keep_imputed,no_category_detected,dataset/txt_limpios/1053.txt,dataset/paginas_descargadas/1053.html
1054,¡Aún no eres Wong Prime!,Aprovecha el,5 kg,PE,Desconocido,unknown,arroz,arroz,,False,0.0,79.9,79.9,22.507,22.507,False,original,3.55,from_peru_cambio_dolar,EN,keep,keep,heuristic_default,dataset/txt_limpios/1054.txt,dataset/paginas_descargadas/1054.html
1055,¡Aún no eres Wong Prime!,Aprovecha el,5kg,PE,Desconocido,unknown,arroz,arroz,,False,0.0,79.9,79.9,22.507,22.507,False,original,3.55,from_peru_cambio_dolar,EN,keep,keep,heuristic_default,dataset/txt_limpios/1055.txt,dataset/paginas_descargadas/1055.html
1056,¡Aún no eres Wong Prime!,Aprovecha el,5 kg,PE,Desconocido,unknown,arroz,arroz,,False,0.0,79.9,79.9,22.507,22.507,False,original,3.55,from_peru_cambio_dolar,EN,keep,keep,heuristic_default,dataset/txt_limpios/1056.txt,dataset/paginas_descargadas/1056.html
1057,¡Aún no eres Wong Prime!,Aprovecha el,5kg,PE,Desconocido,unknown,arroz,arroz,,False,0.0,79.9,79.9,22.507,22.507,False,original,3.55,from_peru_cambio_dolar,EN,keep,keep,heuristic_default,dataset/txt_limpios/1057.txt,dataset/paginas_descargadas/1057.html
1058,¡Aún no eres Wong Prime!,Aprovecha el,,PE,Desconocido,unknown,pollo entero,pollo entero,,False,0.0,79.9,79.9,22.507,22.507,False,original,3.55,from_peru_cambio_dolar,EN,keep,keep,heuristic_default,dataset/txt_limpios/1058.txt,dataset/paginas_descargadas/1058.html
1059,¡Aún no eres Wong Prime!,Aprovecha el,,PE,Desconocido,unknown,pollo entero,pollo entero,,False,0.0,79.9,79.9,22.507,22.507,False,original,3.55,from_peru_cambio_dolar,EN,keep,keep,heuristic_default,dataset/txt_limpios/1059.txt,dataset/paginas_descargadas/1059.html
1060,¡Aún no eres Wong Prime!,Aprovecha el,,PE,Desconocido,unknown,azucar,sin_categoria,azucar,True,0.9591569817072496,79.9,79.9,22.507,22.507,False,original,3.55,from_peru_cambio_dolar,EN,discard,keep_imputed,no_category_detected,dataset/txt_limpios/1060.txt,dataset/paginas_descargadas/1060.html
1061,¡Aún no eres Wong Prime!,Aprovecha el,,PE,Desconocido,unknown,pollo entero,pollo entero,,False,0.0,79.9,79.9,22.507,22.507,False,original,3.55,from_peru_cambio_dolar,EN,keep,keep,heuristic_default,dataset/txt_limpios/1061.txt,dataset/paginas_descargadas/1061.html
1062,¡Aún no eres Wong Prime!,Aprovecha el,800 g,PE,Desconocido,unknown,azucar,azucar,,False,0.0,79.9,79.9,22.507,22.507,False,original,3.55,from_peru_cambio_dolar,EN,keep,keep,heuristic_default,dataset/txt_limpios/1062.txt,dataset/paginas_descargadas/1062.html
1063,¡Aún no eres Wong Prime!,Aprovecha el,,PE,Desconocido,unknown,azucar,sin_categoria,azucar,True,0.9591569817072496,79.9,79.9,22.507,22.507,False,original,3.55,from_peru_cambio_dolar,EN,discard,keep_imputed,no_category_detected,dataset/txt_limpios/1063.txt,dataset/paginas_descargadas/1063.html
1064,¡Aún no eres Wong Prime!,Aprovecha el,,PE,Desconocido,unknown,azucar,sin_categoria,azucar,True,0.9591569817072496,79.9,79.9,22.507,22.507,False,original,3.55,from_peru_cambio_dolar,EN,discard,keep_imputed,no_category_detected,dataset/txt_limpios/1064.txt,dataset/paginas_descargadas/1064.html
1065,¡Aún no eres Wong Prime!,Aprovecha el,900g,PE,Desconocido,unknown,cafe,cafe,,False,0.0,79.9,79.9,22.507,22.507,False,original,3.55,from_peru_cambio_dolar,EN,keep,keep,heuristic_default,dataset/txt_limpios/1065.txt,dataset/paginas_descargadas/1065.html
1067,¡Aún no eres Wong Prime!,Aprovecha el,500g,PE,Desconocido,unknown,cafe,cafe,,False,0.0,79.9,79.9,22.507,22.507,False,original,3.55,from_peru_cambio_dolar,EN,keep,keep,heuristic_default,dataset/txt_limpios/1067.txt,dataset/paginas_descargadas/1067.html
1068,¡Aún no eres Wong Prime!,Aprovecha el,1.8L,PE,Desconocido,unknown,aceite vegetal,aceite vegetal,,False,0.0,79.9,79.9,22.507,22.507,False,original,3.55,from_peru_cambio_dolar,EN,keep,keep,heuristic_default,dataset/txt_limpios/1068.txt,dataset/paginas_descargadas/1068.html
1069,¡Aún no eres Wong Prime!,Aprovecha el,1 Litro,PE,Desconocido,unknown,azucar,sin_categoria,azucar,True,0.9999750453156626,79.9,79.9,22.507,22.507,False,original,3.55,from_peru_cambio_dolar,EN,discard,keep_imputed,no_category_detected,dataset/txt_limpios/1069.txt,dataset/paginas_descargadas/1069.html
1070,¡Aún no eres Wong Prime!,Aprovecha el,1L,PE,Desconocido,unknown,atun,sin_categoria,atun,True,1.0,79.9,79.9,22.507,22.507,False,original,3.55,from_peru_cambio_dolar,EN,discard,keep_imputed,no_category_detected,dataset/txt_limpios/1070.txt,dataset/paginas_descargadas/1070.html
1071,¡Aún no eres Wong Prime!,Aprovecha el,1L,PE,Desconocido,unknown,azucar,sin_categoria,azucar,True,0.987396735568677,79.9,79.9,22.507,22.507,False,original,3.55,from_peru_cambio_dolar,EN,discard,keep_imputed,no_category_detected,dataset/txt_limpios/1071.txt,dataset/paginas_descargadas/1071.html
1072,¡Aún no eres Wong Prime!,Aprovecha el,750ml,PE,Desconocido,unknown,aceite vegetal,sin_categoria,aceite vegetal,True,0.9999999999999996,79.9,79.9,22.507,22.507,False,original,3.55,from_peru_cambio_dolar,EN,discard,keep_imputed,no_category_detected,dataset/txt_limpios/1072.txt,dataset/paginas_descargadas/1072.html
1074,¡Aún no eres Wong Prime!,Aprovecha el,946ml,PE,Desconocido,unknown,azucar,azucar,,False,0.0,79.9,79.9,22.507,22.507,False,original,3.55,from_peru_cambio_dolar,EN,keep,keep,heuristic_default,dataset/txt_limpios/1074.txt,dataset/paginas_descargadas/1074.html
1075,¡Aún no eres Wong Prime!,Aprovecha el,900ml,PE,Desconocido,unknown,leche,leche,,False,0.0,79.9,79.9,22.507,22.507,False,original,3.55,from_peru_cambio_dolar,EN,keep,keep,heuristic_default,dataset/txt_limpios/1075.txt,dataset/paginas_descargadas/1075.html
1076,¡Aún no eres Wong Prime!,Aprovecha el,950 ml,PE,Desconocido,unknown,azucar,azucar,,False,0.0,79.9,79.9,22.507,22.507,False,original,3.55,from_peru_cambio_dolar,EN,keep,keep,heuristic_default,dataset/txt_limpios/1076.txt,dataset/paginas_descargadas/1076.html
1077,¡Aún no eres Wong Prime!,Aprovecha el,800ml,PE,Desconocido,unknown,leche,leche,,False,0.0,79.9,79.9,22.507,22.507,False,original,3.55,from_peru_cambio_dolar,EN,keep,keep,heuristic_default,dataset/txt_limpios/1077.txt,dataset/paginas_descargadas/1077.html
1078,¡Aún no eres Wong Prime!,Aprovecha el,30 unidades,PE,Desconocido,unknown,aceite vegetal,aceite vegetal,,False,0.0,79.9,79.9,22.507,22.507,False,original,3.55,from_peru_cambio_dolar,EN,keep,keep,heuristic_default,dataset/txt_limpios/1078.txt,dataset/paginas_descargadas/1078.html
1079,¡Aún no eres Wong Prime!,Aprovecha el,15 unidades,PE,Desconocido,unknown,huevo,huevo,,False,0.0,79.9,79.9,22.507,22.507,False,original,3.55,from_peru_cambio_dolar,EN,discard,keep_imputed,heuristic_default,dataset/txt_limpios/1079.txt,dataset/paginas_descargadas/1079.html
1080,¡Aún no eres Wong Prime!,Aprovecha el,15 unidades,PE,Desconocido,unknown,huevo,huevo,,False,0.0,79.9,79.9,22.507,22.507,False,original,3.55,from_peru_cambio_dolar,EN,discard,keep_imputed,heuristic_default,dataset/txt_limpios/1080.txt,dataset/paginas_descargadas/1080.html
1081,¡Aún no eres Wong Prime!,Aprovecha el,,PE,Desconocido,unknown,huevo,huevo,,False,0.0,79.9,79.9,22.507,22.507,False,original,3.55,from_peru_cambio_dolar,EN,discard,keep_imputed,heuristic_default,dataset/txt_limpios/1081.txt,dataset/paginas_descargadas/1081.html
1082,¡Aún no eres Wong Prime!,Aprovecha el,,PE,Desconocido,unknown,azucar,sin_categoria,azucar,True,0.988756628999638,79.9,79.9,22.507,22.507,False,original,3.55,from_peru_cambio_dolar,EN,discard,keep_imputed,no_category_detected,dataset/txt_limpios/1082.txt,dataset/paginas_descargadas/1082.html
1083,¡Aún no eres Wong Prime!,Aprovecha el,5 kg,PE,Desconocido,unknown,azucar,azucar,,False,0.0,79.9,79.9,22.507,22.507,False,original,3.55,from_peru_cambio_dolar,EN,keep,keep,heuristic_default,dataset/txt_limpios/1083.txt,dataset/paginas_descargadas/1083.html
1084,¡Aún no eres Wong Prime!,Aprovecha el,2 kg,PE,Desconocido,unknown,azucar,azucar,,False,0.0,79.9,79.9,22.507,22.507,False,original,3.55,from_peru_cambio_dolar,EN,keep,keep,heuristic_default,dataset/txt_limpios/1084.txt,dataset/paginas_descargadas/1084.html
1085,¡Aún no eres Wong Prime!,Aprovecha el,,PE,Desconocido,unknown,azucar,sin_categoria,azucar,True,0.9591569817072496,79.9,79.9,22.507,22.507,False,original,3.55,from_peru_cambio_dolar,EN,discard,keep_imputed,no_category_detected,dataset/txt_limpios/1085.txt,dataset/paginas_descargadas/1085.html
1086,¡Aún no eres Wong Prime!,Aprovecha el,1kg,PE,Desconocido,unknown,azucar,azucar,,False,0.0,79.9,79.9,22.507,22.507,False,original,3.55,from_peru_cambio_dolar,EN,keep,keep,heuristic_default,dataset/txt_limpios/1086.txt,dataset/paginas_descargadas/1086.html
1088,¡Aún no eres Wong Prime!,Aprovecha el,770g,PE,Desconocido,unknown,azucar,azucar,,False,0.0,79.9,79.9,22.507,22.507,False,original,3.55,from_peru_cambio_dolar,EN,keep,keep,heuristic_default,dataset/txt_limpios/1088.txt,dataset/paginas_descargadas/1088.html
1089,¡Aún no eres Wong Prime!,Aprovecha el,360 g,PE,Desconocido,unknown,leche,leche,,False,0.0,79.9,79.9,22.507,22.507,False,original,3.55,from_peru_cambio_dolar,EN,keep,keep,heuristic_default,dataset/txt_limpios/1089.txt,dataset/paginas_descargadas/1089.html
1090,¡Aún no eres Wong Prime!,Aprovecha el,300g,PE,Desconocido,unknown,azucar,azucar,,False,0.0,79.9,79.9,22.507,22.507,False,original,3.55,from_peru_cambio_dolar,EN,keep,keep,heuristic_default,dataset/txt_limpios/1090.txt,dataset/paginas_descargadas/1090.html
1091,¡Aún no eres Wong Prime!,Aprovecha el,400g,PE,Desconocido,unknown,azucar,sin_categoria,azucar,True,0.8605164752136816,79.9,79.9,22.507,22.507,False,original,3.55,from_peru_cambio_dolar,EN,discard,keep_imputed,no_category_detected,dataset/txt_limpios/1091.txt,dataset/paginas_descargadas/1091.html
1092,¡Aún no eres Wong Prime!,Aprovecha el,560 g,PE,Desconocido,unknown,pan,pan,,False,0.0,79.9,79.9,22.507,22.507,False,original,3.55,from_peru_cambio_dolar,EN,keep,keep,heuristic_default,dataset/txt_limpios/1092.txt,dataset/paginas_descargadas/1092.html
1093,¡Aún no eres Wong Prime!,Aprovecha el,950g,PE,Desconocido,unknown,huevo,huevo,,False,0.0,79.9,79.9,22.507,22.507,False,original,3.55,from_peru_cambio_dolar,EN,discard,keep_imputed,heuristic_default,dataset/txt_limpios/1093.txt,dataset/paginas_descargadas/1093.html
1094,¡Aún no eres Wong Prime!,Aprovecha el,400 g,PE,Desconocido,unknown,huevo,huevo,,False,0.0,79.9,79.9,22.507,22.507,False,original,3.55,from_peru_cambio_dolar,EN,discard,keep_imputed,heuristic_default,dataset/txt_limpios/1094.txt,dataset/paginas_descargadas/1094.html
1095,¡Aún no eres Wong Prime!,Aprovecha el,500 g,PE,Desconocido,unknown,azucar,sin_categoria,azucar,True,0.999921836343008,79.9,79.9,22.507,22.507,False,original,3.55,from_peru_cambio_dolar,EN,discard,keep_imputed,no_category_detected,dataset/txt_limpios/1095.txt,dataset/paginas_descargadas/1095.html
1097,¡Aún no eres Wong Prime!,Aprovecha el,950g,PE,Desconocido,unknown,harina de trigo,harina de trigo,,False,0.0,79.9,79.9,22.507,22.507,False,original,3.55,from_peru_cambio_dolar,EN,keep,keep,heuristic_default,dataset/txt_limpios/1097.txt,dataset/paginas_descargadas/1097.html
1098,¡Aún no eres Wong Prime!,Aprovecha el,,PE,Desconocido,unknown,azucar,sin_categoria,azucar,True,0.9591569817072496,79.9,79.9,22.507,22.507,False,original,3.55,from_peru_cambio_dolar,EN,discard,keep_imputed,no_category_detected,dataset/txt_limpios/1098.txt,dataset/paginas_descargadas/1098.html
1099,¡Aún no eres Wong Prime!,Aprovecha el,150g,PE,Desconocido,unknown,atun,atun,,False,0.0,79.9,79.9,22.507,22.507,False,original,3.55,from_peru_cambio_dolar,EN,keep,keep,heuristic_default,dataset/txt_limpios/1099.txt,dataset/paginas_descargadas/1099.html
1100,¡Aún no eres Wong Prime!,Aprovecha el,140g,PE,Desconocido,unknown,azucar,sin_categoria,azucar,True,0.9949202816054928,79.9,79.9,22.507,22.507,False,original,3.55,from_peru_cambio_dolar,EN,discard,keep_imputed,no_category_detected,dataset/txt_limpios/1100.txt,dataset/paginas_descargadas/1100.html
1101,¡Aún no eres Wong Prime!,Aprovecha el,140g,PE,Desconocido,unknown,atun,atun,,False,0.0,79.9,79.9,22.507,22.507,False,original,3.55,from_peru_cambio_dolar,EN,keep,keep,heuristic_default,dataset/txt_limpios/1101.txt,dataset/paginas_descargadas/1101.html
1102,¡Aún no eres Wong Prime!,Aprovecha el,140g,PE,Desconocido,unknown,atun,atun,,False,0.0,79.9,79.9,22.507,22.507,False,original,3.55,from_peru_cambio_dolar,EN,keep,keep,heuristic_default,dataset/txt_limpios/1102.txt,dataset/paginas_descargadas/1102.html
110,¡Lo mejor te está esperando!,Descarga la app,2 Kg,UNKNOWN,Desconocido,unknown,atun,atun,,False,0.0,74.9,74.9,74.9,74.9,False,original,1.0,default_1usd,EN,keep,keep,heuristic_default,dataset/txt_limpios/110.txt,dataset/paginas_descargadas/110.html
111,¡Lo mejor te está esperando!,Descarga la app,907 G,UNKNOWN,Desconocido,unknown,arroz,arroz,,False,0.0,23.9,23.9,23.9,23.9,False,original,1.0,default_1usd,EN,keep,keep,heuristic_default,dataset/txt_limpios/111.txt,dataset/paginas_descargadas/111.html
112,¡Lo mejor te está esperando!,Descarga la app,906 G,UNKNOWN,Desconocido,unknown,atun,atun,,False,0.0,17.9,17.9,17.9,17.9,False,original,1.0,default_1usd,EN,keep,keep,heuristic_default,dataset/txt_limpios/112.txt,dataset/paginas_descargadas/112.html
113,¡Lo mejor te está esperando!,Descarga la app,906 G,UNKNOWN,Desconocido,unknown,atun,atun,,False,0.0,23.9,23.9,23.9,23.9,False,original,1.0,default_1usd,EN,keep,keep,heuristic_default,dataset/txt_limpios/113.txt,dataset/paginas_descargadas/113.html
114,¡Lo mejor te está esperando!,Descarga la app,155 G,UNKNOWN,Desconocido,unknown,atun,atun,,False,0.0,39.9,39.9,39.9,39.9,False,original,1.0,default_1usd,EN,keep,keep,heuristic_default,dataset/txt_limpios/114.txt,dataset/paginas_descargadas/114.html
115,¡Lo mejor te está esperando!,Descarga la app,800 Ml,UNKNOWN,Desconocido,unknown,aceite vegetal,aceite vegetal,,False,0.0,29.9,29.9,29.9,29.9,False,original,1.0,default_1usd,EN,keep,keep,heuristic_default,dataset/txt_limpios/115.txt,dataset/paginas_descargadas/115.html
117,¡Lo mejor te está esperando!,Descarga la app,400 Ml,UNKNOWN,Desconocido,unknown,aceite vegetal,aceite vegetal,,False,0.0,25.9,25.9,25.9,25.9,False,original,1.0,default_1usd,EN,keep,keep,heuristic_default,dataset/txt_limpios/117.txt,dataset/paginas_descargadas/117.html
118,¡Lo mejor te está esperando!,Descarga la app,850 Ml,UNKNOWN,Desconocido,unknown,aceite vegetal,aceite vegetal,,False,0.0,37.9,37.9,37.9,37.9,False,original,1.0,default_1usd,EN,keep,keep,heuristic_default,dataset/txt_limpios/118.txt,dataset/paginas_descargadas/118.html
119,¡Lo mejor te está esperando!,Descarga la app,,UNKNOWN,Desconocido,unknown,leche,sin_categoria,leche,True,0.8874678577025533,,234.19,,234.1938,True,country_mean,1.0,default_1usd,EN,discard,keep_imputed,no_category_detected;price_parse_failed,dataset/txt_limpios/119.txt,dataset/paginas_descargadas/119.html
120,¡Lo mejor te está esperando!,Descarga la app,1 Lt,UNKNOWN,Desconocido,unknown,leche,leche,,False,0.0,27.9,27.9,27.9,27.9,False,original,1.0,default_1usd,EN,keep,keep,heuristic_default,dataset/txt_limpios/120.txt,dataset/paginas_descargadas/120.html
121,¡Lo mejor te está esperando!,Descarga la app,1 Lt,UNKNOWN,Desconocido,unknown,leche,leche,,False,0.0,34.9,34.9,34.9,34.9,False,original,1.0,default_1usd,EN,keep,keep,heuristic_default,dataset/txt_limpios/121.txt,dataset/paginas_descargadas/121.html
122,¡Lo mejor te está esperando!,Descarga la app,1 Lt,UNKNOWN,Desconocido,unknown,leche,leche,,False,0.0,37.9,37.9,37.9,37.9,False,original,1.0,default_1usd,EN,keep,keep,heuristic_default,dataset/txt_limpios/122.txt,dataset/paginas_descargadas/122.html
123,¡Lo mejor te está esperando!,Descarga la app,1 Lt,UNKNOWN,Desconocido,unknown,leche,leche,,False,0.0,30.9,30.9,30.9,30.9,False,original,1.0,default_1usd,EN,keep,keep,heuristic_default,dataset/txt_limpios/123.txt,dataset/paginas_descargadas/123.html
125,¡Lo mejor te está esperando!,Descarga la app,680 G,UNKNOWN,Desconocido,unknown,pan,pan,,False,0.0,44.9,44.9,44.9,44.9,False,original,1.0,default_1usd,EN,keep,keep,heuristic_default,dataset/txt_limpios/125.txt,dataset/paginas_descargadas/125.html
126,¡Lo mejor te está esperando!,Descarga la app,624 G,UNKNOWN,Desconocido,unknown,pan,pan,,False,0.0,62.9,62.9,62.9,62.9,False,original,1.0,default_1usd,EN,keep,keep,heuristic_default,dataset/txt_limpios/126.txt,dataset/paginas_descargadas/126.html
127,¡Lo mejor te está esperando!,Descarga la app,620 G,UNKNOWN,Desconocido,unknown,pan,pan,,False,0.0,54.9,54.9,54.9,54.9,False,original,1.0,default_1usd,EN,keep,keep,heuristic_default,dataset/txt_limpios/127.txt,dataset/paginas_descargadas/127.html
129,¡Lo mejor te está esperando!,Descarga la app,1 Kg,UNKNOWN,Desconocido,unknown,azucar,azucar,,False,0.0,112.9,112.9,112.9,112.9,False,original,1.0,default_1usd,EN,keep,keep,heuristic_default,dataset/txt_limpios/129.txt,dataset/paginas_descargadas/129.html
131,¡Lo mejor te está esperando!,Descarga la app,100 G,UNKNOWN,Desconocido,unknown,cafe,cafe,,False,0.0,54.9,54.9,54.9,54.9,False,original,1.0,default_1usd,EN,keep,keep,heuristic_default,dataset/txt_limpios/131.txt,dataset/paginas_descargadas/131.html
132,¡Lo mejor te está esperando!,Descarga la app,100 G,UNKNOWN,Desconocido,unknown,cafe,cafe,,False,0.0,69.9,69.9,69.9,69.9,False,original,1.0,default_1usd,EN,keep,keep,heuristic_default,dataset/txt_limpios/132.txt,dataset/paginas_descargadas/132.html
