source_id,product_name,brand,unit,country,seller,availability,category_effective,category_canonical,category_canonical_imputed,category_is_imputed,category_model_confidence,price_amount,price_amount_filled,price_amount_usd,price_amount_usd_filled,price_is_imputed,price_imputation_source,fx_rate_local_per_usd,fx_source,es_status,decision,decision_imputed,reasons,txt_path,html_path
1280,Selecciona un local,X,,US,Desconocido,unknown,cafe,sin_categoria,cafe,True,0.8699377891308989,12.0,12.0,12.0,12.0,False,original,1.0,default_1usd,EN,discard,keep_imputed,no_category_detected,dataset/txt_limpios/1280.txt,dataset/paginas_descargadas/1280.html
1576,Sem Açúcar,"R$ 9,49",2L,BR,Desconocido,unknown,azucar,azucar,,False,0.0,9.49,9.49,1.7419,1.7419,False,original,5.448,from_brasil_cambio_dolar,EN,keep,keep,heuristic_default,dataset/txt_limpios/1576.txt,dataset/paginas_descargadas/1576.html
1579,Sem Açúcar,"R$ 8,49",2L,BR,Desconocido,unknown,azucar,azucar,,False,0.0,8.49,8.49,1.5584,1.5584,False,original,5.448,from_brasil_cambio_dolar,EN,keep,keep,heuristic_default,dataset/txt_limpios/1579.txt,dataset/paginas_descargadas/1579.html
196,Sem Açúcar,"R$ 9,49",2L,BR,Desconocido,unknown,azucar,azucar,,False,0.0,9.49,9.49,1.7419,1.7419,False,original,5.448,from_brasil_cambio_dolar,EN,keep,keep,heuristic_default,dataset/txt_limpios/196.txt,dataset/paginas_descargadas/196.html
197,Sem Açúcar,"R$ 8,49",2L,BR,Desconocido,unknown,azucar,azucar,,False,0.0,8.49,8.49,1.5584,1.5584,False,original,5.448,from_brasil_cambio_dolar,EN,keep,keep,heuristic_default,dataset/txt_limpios/197.txt,dataset/paginas_descargadas/197.html
288,SEM GLÚTEN,1,200 G,BR,Desconocido,unknown,azucar,sin_categoria,azucar,True,0.6250561293129905,24.99,24.99,4.587,4.587,False,original,5.448,from_brasil_cambio_dolar,EN,discard,keep_imputed,no_category_detected,dataset/txt_limpios/288.txt,dataset/paginas_descargadas/288.html
306,SEM GLÚTEN,1,275 Ml,BR,Desconocido,unknown,cerveza,sin_categoria,cerveza,True,0.7508922496427534,24.99,24.99,4.587,4.587,False,original,5.448,from_brasil_cambio_dolar,EN,discard,keep_imputed,no_category_detected,dataset/txt_limpios/306.txt,dataset/paginas_descargadas/306.html
789,SOL NACIENTE,Unidades disponibles,12 unidades,UNKNOWN,Desconocido,unknown,banano,banano,,False,0.0,1.0,1.0,1.0,1.0,False,original,1.0,default_1usd,EN,keep,keep,heuristic_default,dataset/txt_limpios/789.txt,dataset/paginas_descargadas/789.html
316,This app could not find url /acucar-cristal-organico-itaja-1-kg-100002544/p,Preferências,,UNKNOWN,Desconocido,unknown,azucar,azucar,,False,0.0,1.0,1.0,1.0,1.0,False,original,1.0,default_1usd,EN,keep,keep,heuristic_default,dataset/txt_limpios/316.txt,dataset/paginas_descargadas/316.html
317,This app could not find url /acucar-extra-fino-mais-doce-1-kg-3783/p,Preferências,,UNKNOWN,Desconocido,unknown,azucar,azucar,,False,0.0,1.0,1.0,1.0,1.0,False,original,1.0,default_1usd,EN,keep,keep,heuristic_default,dataset/txt_limpios/317.txt,dataset/paginas_descargadas/317.html
282,This app could not find url /arroz-camil-1-kg-100004793/p,Preferências,,UNKNOWN,Desconocido,unknown,arroz,arroz,,False,0.0,1.0,1.0,1.0,1.0,False,original,1.0,default_1usd,EN,keep,keep,heuristic_default,dataset/txt_limpios/282.txt,dataset/paginas_descargadas/282.html
305,This app could not find url /cerveja-pure-gold-long-neck-stella-artois-sem-gluten-330-ml-100008859/p,Preferências,,UNKNOWN,Desconocido,unknown,cerveza,cerveza,,False,0.0,1.0,1.0,1.0,1.0,False,original,1.0,default_1usd,EN,keep,keep,heuristic_default,dataset/txt_limpios/305.txt,dataset/paginas_descargadas/305.html
797,TOMATE CHONTO X 1000 G,Unidades disponibles,1000 G,UNKNOWN,Desconocido,unknown,cebolla,cebolla,,False,0.0,1000.0,1000.0,1000.0,1000.0,False,original,1.0,default_1usd,EN,keep,keep,heuristic_default,dataset/txt_limpios/797.txt,dataset/paginas_descargadas/797.html
798,TOMATES SECOS AINOA 180 G,Unidades disponibles,180 G,UNKNOWN,Desconocido,unknown,azucar,azucar,,False,0.0,100.0,100.0,100.0,100.0,False,original,1.0,default_1usd,ET,keep,keep,heuristic_default,dataset/txt_limpios/798.txt,dataset/paginas_descargadas/798.html
18,Tortilleria y pan empacados,Natures Own,624g,MX,Chedraui,unknown,pan,pan,,False,0.0,72.0,72.0,3.8668,3.8668,False,original,18.62,from_mexico_cambio_dolar,ET,keep,keep,heuristic_default,dataset/txt_limpios/18.txt,dataset/paginas_descargadas/18.html
1281,Valoramos tu privacidad,Personalizar,1L,UNKNOWN,Desconocido,unknown,leche,leche,,False,0.0,1.17,1.17,1.17,1.17,False,original,1.0,default_1usd,ET,keep,keep,heuristic_default,dataset/txt_limpios/1281.txt,dataset/paginas_descargadas/1281.html
1282,Valoramos tu privacidad,Personalizar,1L,UNKNOWN,Desconocido,unknown,leche,leche,,False,0.0,1.13,1.13,1.13,1.13,False,original,1.0,default_1usd,ET,keep,keep,heuristic_default,dataset/txt_limpios/1282.txt,dataset/paginas_descargadas/1282.html
1284,Valoramos tu privacidad,Personalizar,,UNKNOWN,Desconocido,unknown,arroz,sin_categoria,arroz,True,1.0,,234.19,,234.1938,True,country_mean,1.0,default_1usd,EN,discard,keep_imputed,no_category_detected;price_parse_failed,dataset/txt_limpios/1284.txt,dataset/paginas_descargadas/1284.html
1285,Valoramos tu privacidad,Personalizar,1L,UNKNOWN,Desconocido,unknown,leche,leche,,False,0.0,1.38,1.38,1.38,1.38,False,original,1.0,default_1usd,ET,keep,keep,heuristic_default,dataset/txt_limpios/1285.txt,dataset/paginas_descargadas/1285.html
1286,Valoramos tu privacidad,Personalizar,330ml,UNKNOWN,Desconocido,unknown,cerveza,cerveza,,False,0.0,5.3,5.3,5.3,5.3,False,original,1.0,default_1usd,ET,keep,keep,heuristic_default,dataset/txt_limpios/1286.txt,dataset/paginas_descargadas/1286.html
1288,Valoramos tu privacidad,Personalizar,330ml,UNKNOWN,Desconocido,unknown,cerveza,cerveza,,False,0.0,5.8,5.8,5.8,5.8,False,original,1.0,default_1usd,ET,keep,keep,heuristic_default,dataset/txt_limpios/1288.txt,dataset/paginas_descargadas/1288.html
1290,Valoramos tu privacidad,Personalizar,,UNKNOWN,Desconocido,unknown,arroz,sin_categoria,arroz,True,1.0,,234.19,,234.1938,True,country_mean,1.0,default_1usd,EN,discard,keep_imputed,no_category_detected;price_parse_failed,dataset/txt_limpios/1290.txt,dataset/paginas_descargadas/1290.html
1291,Valoramos tu privacidad,Personalizar,450g,UNKNOWN,Desconocido,unknown,pan,pan,,False,0.0,0.99,0.99,0.99,0.99,False,original,1.0,default_1usd,ET,keep,keep,heuristic_default,dataset/txt_limpios/1291.txt,dataset/paginas_descargadas/1291.html
1292,Valoramos tu privacidad,Personalizar,750g,UNKNOWN,Desconocido,unknown,pan,pan,,False,0.0,1.89,1.89,1.89,1.89,False,original,1.0,default_1usd,ET,keep,keep,heuristic_default,dataset/txt_limpios/1292.txt,dataset/paginas_descargadas/1292.html
1293,Valoramos tu privacidad,Personalizar,550g,UNKNOWN,Desconocido,unknown,pan,pan,,False,0.0,1.54,1.54,1.54,1.54,False,original,1.0,default_1usd,ET,keep,keep,heuristic_default,dataset/txt_limpios/1293.txt,dataset/paginas_descargadas/1293.html
1294,Valoramos tu privacidad,Personalizar,,UNKNOWN,Desconocido,unknown,arroz,sin_categoria,arroz,True,1.0,,234.19,,234.1938,True,country_mean,1.0,default_1usd,EN,discard,keep_imputed,no_category_detected;price_parse_failed,dataset/txt_limpios/1294.txt,dataset/paginas_descargadas/1294.html
1295,Valoramos tu privacidad,Personalizar,580g,UNKNOWN,Desconocido,unknown,pan,pan,,False,0.0,1.99,1.99,1.99,1.99,False,original,1.0,default_1usd,ET,keep,keep,heuristic_default,dataset/txt_limpios/1295.txt,dataset/paginas_descargadas/1295.html
1296,Valoramos tu privacidad,Personalizar,3.05 L,UNKNOWN,Desconocido,unknown,azucar,azucar,,False,0.0,2.62,2.62,2.62,2.62,False,original,1.0,default_1usd,ET,keep,keep,heuristic_default,dataset/txt_limpios/1296.txt,dataset/paginas_descargadas/1296.html
1298,Valoramos tu privacidad,Personalizar,2L,UNKNOWN,Desconocido,unknown,arroz,sin_categoria,arroz,True,1.0,0.92,0.92,0.92,0.92,False,original,1.0,default_1usd,ET,discard,keep_imputed,no_category_detected,dataset/txt_limpios/1298.txt,dataset/paginas_descargadas/1298.html
1299,Valoramos tu privacidad,Personalizar,1L,UNKNOWN,Desconocido,unknown,arroz,sin_categoria,arroz,True,1.0,0.44,0.44,0.44,0.44,False,original,1.0,default_1usd,ET,discard,keep_imputed,no_category_detected,dataset/txt_limpios/1299.txt,dataset/paginas_descargadas/1299.html
1300,Valoramos tu privacidad,Personalizar,,UNKNOWN,Desconocido,unknown,arroz,sin_categoria,arroz,True,1.0,,234.19,,234.1938,True,country_mean,1.0,default_1usd,EN,discard,keep_imputed,no_category_detected;price_parse_failed,dataset/txt_limpios/1300.txt,dataset/paginas_descargadas/1300.html
1301,Valoramos tu privacidad,Personalizar,226g,UNKNOWN,Desconocido,unknown,azucar,azucar,,False,0.0,226.0,226.0,226.0,226.0,False,original,1.0,default_1usd,ET,keep,keep,heuristic_default,dataset/txt_limpios/1301.txt,dataset/paginas_descargadas/1301.html
1302,Valoramos tu privacidad,Personalizar,100Lb,UNKNOWN,Desconocido,unknown,arroz,arroz,,False,0.0,43.45,43.45,43.45,43.45,False,original,1.0,default_1usd,ET,keep,keep,heuristic_default,dataset/txt_limpios/1302.txt,dataset/paginas_descargadas/1302.html
1303,Valoramos tu privacidad,Personalizar,100lb,UNKNOWN,Desconocido,unknown,arroz,arroz,,False,0.0,41.59,41.59,41.59,41.59,False,original,1.0,default_1usd,ET,keep,keep,heuristic_default,dataset/txt_limpios/1303.txt,dataset/paginas_descargadas/1303.html
1304,Valoramos tu privacidad,Personalizar,10Kg,UNKNOWN,Desconocido,unknown,arroz,arroz,,False,0.0,10.45,10.45,10.45,10.45,False,original,1.0,default_1usd,ET,keep,keep,heuristic_default,dataset/txt_limpios/1304.txt,dataset/paginas_descargadas/1304.html
1305,Valoramos tu privacidad,Personalizar,5kg,UNKNOWN,Desconocido,unknown,arroz,arroz,,False,0.0,5.66,5.66,5.66,5.66,False,original,1.0,default_1usd,ET,keep,keep,heuristic_default,dataset/txt_limpios/1305.txt,dataset/paginas_descargadas/1305.html
1306,Valoramos tu privacidad,Personalizar,5kg,UNKNOWN,Desconocido,unknown,arroz,arroz,,False,0.0,6.45,6.45,6.45,6.45,False,original,1.0,default_1usd,ET,keep,keep,heuristic_default,dataset/txt_limpios/1306.txt,dataset/paginas_descargadas/1306.html
1307,Valoramos tu privacidad,Personalizar,,UNKNOWN,Desconocido,unknown,arroz,sin_categoria,arroz,True,1.0,,234.19,,234.1938,True,country_mean,1.0,default_1usd,EN,discard,keep_imputed,no_category_detected;price_parse_failed,dataset/txt_limpios/1307.txt,dataset/paginas_descargadas/1307.html
1308,Valoramos tu privacidad,Personalizar,400g,UNKNOWN,Desconocido,unknown,arroz,arroz,,False,0.0,1.0,1.0,1.0,1.0,False,original,1.0,default_1usd,ET,keep,keep,heuristic_default,dataset/txt_limpios/1308.txt,dataset/paginas_descargadas/1308.html
1309,Valoramos tu privacidad,Personalizar,,UNKNOWN,Desconocido,unknown,arroz,sin_categoria,arroz,True,1.0,,234.19,,234.1938,True,country_mean,1.0,default_1usd,EN,discard,keep_imputed,no_category_detected;price_parse_failed,dataset/txt_limpios/1309.txt,dataset/paginas_descargadas/1309.html
1310,Valoramos tu privacidad,Personalizar,400g,UNKNOWN,Desconocido,unknown,arroz,arroz,,False,0.0,1.14,1.14,1.14,1.14,False,original,1.0,default_1usd,ET,keep,keep,heuristic_default,dataset/txt_limpios/1310.txt,dataset/paginas_descargadas/1310.html
1311,Valoramos tu privacidad,Personalizar,500g,UNKNOWN,Desconocido,unknown,arroz,arroz,,False,0.0,2.25,2.25,2.25,2.25,False,original,1.0,default_1usd,ET,keep,keep,heuristic_default,dataset/txt_limpios/1311.txt,dataset/paginas_descargadas/1311.html
1312,Valoramos tu privacidad,Personalizar,2 kg,UNKNOWN,Desconocido,unknown,azucar,azucar,,False,0.0,1.7,1.7,1.7,1.7,False,original,1.0,default_1usd,ET,keep,keep,heuristic_default,dataset/txt_limpios/1312.txt,dataset/paginas_descargadas/1312.html
1313,Valoramos tu privacidad,Personalizar,2 kg,UNKNOWN,Desconocido,unknown,azucar,azucar,,False,0.0,1.89,1.89,1.89,1.89,False,original,1.0,default_1usd,ET,keep,keep,heuristic_default,dataset/txt_limpios/1313.txt,dataset/paginas_descargadas/1313.html
1314,Valoramos tu privacidad,Personalizar,1 kg,UNKNOWN,Desconocido,unknown,azucar,azucar,,False,0.0,0.99,0.99,0.99,0.99,False,original,1.0,default_1usd,ET,keep,keep,heuristic_default,dataset/txt_limpios/1314.txt,dataset/paginas_descargadas/1314.html
1315,Valoramos tu privacidad,Personalizar,,UNKNOWN,Desconocido,unknown,arroz,sin_categoria,arroz,True,1.0,,234.19,,234.1938,True,country_mean,1.0,default_1usd,EN,discard,keep_imputed,no_category_detected;price_parse_failed,dataset/txt_limpios/1315.txt,dataset/paginas_descargadas/1315.html
1715,Verduras Congeladas,FRUTOS DEL MAIPO,1 Kg,UNKNOWN,Desconocido,unknown,papa,papa,,False,0.0,3.99,3.99,3.99,3.99,False,original,1.0,default_1usd,ET,keep,keep,heuristic_default,dataset/txt_limpios/1715.txt,dataset/paginas_descargadas/1715.html
1000,Verificar que usted es un ser humano. Esto podría tardar algunos segundos.,Verificación exitosa,,UNKNOWN,Desconocido,unknown,papa,sin_categoria,papa,True,0.9316618454451312,,234.19,,234.1938,True,country_mean,1.0,default_1usd,EN,discard,keep_imputed,no_category_detected;price_parse_failed,dataset/txt_limpios/1000.txt,dataset/paginas_descargadas/1000.html
1001,Verificar que usted es un ser humano. Esto podría tardar algunos segundos.,Verificación exitosa,,UNKNOWN,Desconocido,unknown,papa,sin_categoria,papa,True,0.9316618454451312,,234.19,,234.1938,True,country_mean,1.0,default_1usd,EN,discard,keep_imputed,no_category_detected;price_parse_failed,dataset/txt_limpios/1001.txt,dataset/paginas_descargadas/1001.html
1002,Verificar que usted es un ser humano. Esto podría tardar algunos segundos.,Verificación exitosa,,UNKNOWN,Desconocido,unknown,papa,sin_categoria,papa,True,0.9316618454451312,,234.19,,234.1938,True,country_mean,1.0,default_1usd,EN,discard,keep_imputed,no_category_detected;price_parse_failed,dataset/txt_limpios/1002.txt,dataset/paginas_descargadas/1002.html
1003,Verificar que usted es un ser humano. Esto podría tardar algunos segundos.,Verificación exitosa,,UNKNOWN,Desconocido,unknown,papa,sin_categoria,papa,True,0.9316618454451312,,234.19,,234.1938,True,country_mean,1.0,default_1usd,EN,discard,keep_imputed,no_category_detected;price_parse_failed,dataset/txt_limpios/1003.txt,dataset/paginas_descargadas/1003.html
967,Verificar que usted es un ser humano. Esto podría tardar algunos segundos.,Verificación exitosa,,UNKNOWN,Desconocido,unknown,papa,sin_categoria,papa,True,0.9316618454451312,,234.19,,234.1938,True,country_mean,1.0,default_1usd,EN,discard,keep_imputed,no_category_detected;price_parse_failed,dataset/txt_limpios/967.txt,dataset/paginas_descargadas/967.html
968,Verificar que usted es un ser humano. Esto podría tardar algunos segundos.,Verificación exitosa,,UNKNOWN,Desconocido,unknown,papa,sin_categoria,papa,True,0.9316618454451312,,234.19,,234.1938,True,country_mean,1.0,default_1usd,EN,discard,keep_imputed,no_category_detected;price_parse_failed,dataset/txt_limpios/968.txt,dataset/paginas_descargadas/968.html
969,Verificar que usted es un ser humano. Esto podría tardar algunos segundos.,Verificación exitosa,,UNKNOWN,Desconocido,unknown,papa,sin_categoria,papa,True,0.9316618454451312,,234.19,,234.1938,True,country_mean,1.0,default_1usd,EN,discard,keep_imputed,no_category_detected;price_parse_failed,dataset/txt_limpios/969.txt,dataset/paginas_descargadas/969.html
970,Verificar que usted es un ser humano. Esto podría tardar algunos segundos.,Verificación exitosa,,UNKNOWN,Desconocido,unknown,papa,sin_categoria,papa,True,0.9316618454451312,,234.19,,234.1938,True,country_mean,1.0,default_1usd,EN,discard,keep_imputed,no_category_detected;price_parse_failed,dataset/txt_limpios/970.txt,dataset/paginas_descargadas/970.html
971,Verificar que usted es un ser humano. Esto podría tardar algunos segundos.,Verificación exitosa,,UNKNOWN,Desconocido,unknown,papa,sin_categoria,papa,True,0.9316618454451312,,234.19,,234.1938,True,country_mean,1.0,default_1usd,EN,discard,keep_imputed,no_category_detected;price_parse_failed,dataset/txt_limpios/971.txt,dataset/paginas_descargadas/971.html
972,Verificar que usted es un ser humano. Esto podría tardar algunos segundos.,Verificación exitosa,,UNKNOWN,Desconocido,unknown,papa,sin_categoria,papa,True,0.9316618454451312,,234.19,,234.1938,True,country_mean,1.0,default_1usd,EN,discard,keep_imputed,no_category_detected;price_parse_failed,dataset/txt_limpios/972.txt,dataset/paginas_descargadas/972.html
973,Verificar que usted es un ser humano. Esto podría tardar algunos segundos.,Verificación exitosa,,UNKNOWN,Desconocido,unknown,papa,sin_categoria,papa,True,0.9316618454451312,,234.19,,234.1938,True,country_mean,1.0,default_1usd,EN,discard,keep_imputed,no_category_detected;price_parse_failed,dataset/txt_limpios/973.txt,dataset/paginas_descargadas/973.html
974,Verificar que usted es un ser humano. Esto podría tardar algunos segundos.,Verificación exitosa,,UNKNOWN,Desconocido,unknown,papa,sin_categoria,papa,True,0.9316618454451312,,234.19,,234.1938,True,country_mean,1.0,default_1usd,EN,discard,keep_imputed,no_category_detected;price_parse_failed,dataset/txt_limpios/974.txt,dataset/paginas_descargadas/974.html
975,Verificar que usted es un ser humano. Esto podría tardar algunos segundos.,Verificación exitosa,,UNKNOWN,Desconocido,unknown,papa,sin_categoria,papa,True,0.9316618454451312,,234.19,,234.1938,True,country_mean,1.0,default_1usd,EN,discard,keep_imputed,no_category_detected;price_parse_failed,dataset/txt_limpios/975.txt,dataset/paginas_descargadas/975.html
976,Verificar que usted es un ser humano. Esto podría tardar algunos segundos.,Verificación exitosa,,UNKNOWN,Desconocido,unknown,papa,sin_categoria,papa,True,0.9316618454451312,,234.19,,234.1938,True,country_mean,1.0,default_1usd,EN,discard,keep_imputed,no_category_detected;price_parse_failed,dataset/txt_limpios/976.txt,dataset/paginas_descargadas/976.html
977,Verificar que usted es un ser humano. Esto podría tardar algunos segundos.,Verificación exitosa,,UNKNOWN,Desconocido,unknown,papa,sin_categoria,papa,True,0.9316618454451312,,234.19,,234.1938,True,country_mean,1.0,default_1usd,EN,discard,keep_imputed,no_category_detected;price_parse_failed,dataset/txt_limpios/977.txt,dataset/paginas_descargadas/977.html
978,Verificar que usted es un ser humano. Esto podría tardar algunos segundos.,Verificación exitosa,,UNKNOWN,Desconocido,unknown,papa,sin_categoria,papa,True,0.9316618454451312,,234.19,,234.1938,True,country_mean,1.0,default_1usd,EN,discard,keep_imputed,no_category_detected;price_parse_failed,dataset/txt_limpios/978.txt,dataset/paginas_descargadas/978.html
979,Verificar que usted es un ser humano. Esto podría tardar algunos segundos.,Verificación exitosa,,UNKNOWN,Desconocido,unknown,papa,sin_categoria,papa,True,0.9316618454451312,,234.19,,234.1938,True,country_mean,1.0,default_1usd,EN,discard,keep_imputed,no_category_detected;price_parse_failed,dataset/txt_limpios/979.txt,dataset/paginas_descargadas/979.html
980,Verificar que usted es un ser humano. Esto podría tardar algunos segundos.,Verificación exitosa,,UNKNOWN,Desconocido,unknown,papa,sin_categoria,papa,True,0.9316618454451312,,234.19,,234.1938,True,country_mean,1.0,default_1usd,EN,discard,keep_imputed,no_category_detected;price_parse_failed,dataset/txt_limpios/980.txt,dataset/paginas_descargadas/980.html
981,Verificar que usted es un ser humano. Esto podría tardar algunos segundos.,Verificación exitosa,,UNKNOWN,Desconocido,unknown,papa,sin_categoria,papa,True,0.9316618454451312,,234.19,,234.1938,True,country_mean,1.0,default_1usd,EN,discard,keep_imputed,no_category_detected;price_parse_failed,dataset/txt_limpios/981.txt,dataset/paginas_descargadas/981.html
982,Verificar que usted es un ser humano. Esto podría tardar algunos segundos.,Verificación exitosa,,UNKNOWN,Desconocido,unknown,papa,sin_categoria,papa,True,0.9316618454451312,,234.19,,234.1938,True,country_mean,1.0,default_1usd,EN,discard,keep_imputed,no_category_detected;price_parse_failed,dataset/txt_limpios/982.txt,dataset/paginas_descargadas/982.html
983,Verificar que usted es un ser humano. Esto podría tardar algunos segundos.,Verificación exitosa,,UNKNOWN,Desconocido,unknown,papa,sin_categoria,papa,True,0.9316618454451312,,234.19,,234.1938,True,country_mean,1.0,default_1usd,EN,discard,keep_imputed,no_category_detected;price_parse_failed,dataset/txt_limpios/983.txt,dataset/paginas_descargadas/983.html
984,Verificar que usted es un ser humano. Esto podría tardar algunos segundos.,Verificación exitosa,,UNKNOWN,Desconocido,unknown,papa,sin_categoria,papa,True,0.9316618454451312,,234.19,,234.1938,True,country_mean,1.0,default_1usd,EN,discard,keep_imputed,no_category_detected;price_parse_failed,dataset/txt_limpios/984.txt,dataset/paginas_descargadas/984.html
985,Verificar que usted es un ser humano. Esto podría tardar algunos segundos.,Verificación exitosa,,UNKNOWN,Desconocido,unknown,papa,sin_categoria,papa,True,0.9316618454451312,,234.19,,234.1938,True,country_mean,1.0,default_1usd,EN,discard,keep_imputed,no_category_detected;price_parse_failed,dataset/txt_limpios/985.txt,dataset/paginas_descargadas/985.html
986,Verificar que usted es un ser humano. Esto podría tardar algunos segundos.,Verificación exitosa,,UNKNOWN,Desconocido,unknown,papa,sin_categoria,papa,True,0.9316618454451312,,234.19,,234.1938,True,country_mean,1.0,default_1usd,EN,discard,keep_imputed,no_category_detected;price_parse_failed,dataset/txt_limpios/986.txt,dataset/paginas_descargadas/986.html
987,Verificar que usted es un ser humano. Esto podría tardar algunos segundos.,Verificación exitosa,,UNKNOWN,Desconocido,unknown,papa,sin_categoria,papa,True,0.9316618454451312,,234.19,,234.1938,True,country_mean,1.0,default_1usd,EN,discard,keep_imputed,no_category_detected;price_parse_failed,dataset/txt_limpios/987.txt,dataset/paginas_descargadas/987.html
988,Verificar que usted es un ser humano. Esto podría tardar algunos segundos.,Verificación exitosa,,UNKNOWN,Desconocido,unknown,papa,sin_categoria,papa,True,0.9316618454451312,,234.19,,234.1938,True,country_mean,1.0,default_1usd,EN,discard,keep_imputed,no_category_detected;price_parse_failed,dataset/txt_limpios/988.txt,dataset/paginas_descargadas/988.html
